No.,Time,Source,Destination,Protocol,Length,Info
1,0.1394220000001951,10.0.2.15,54.93.77.70,TLSv1.2,590,Application Data
1,0.1396260000001348,54.93.77.70,10.0.2.15,TCP,60,9001  >  34692 [ACK] Seq=450865837 Ack=24539333 Win=65535 Len=0
1,0.25074099999983446,62.210.85.178,10.0.2.15,TLSv1.2,590,Application Data
1,0.25107199999911245,10.0.2.15,62.210.85.178,TLSv1.2,590,Application Data
1,0.25121799999942596,62.210.85.178,10.0.2.15,TCP,60,9001  >  35978 [ACK] Seq=24468543 Ack=451298637 Win=65535 Len=0
1,0.36574800000016694,54.93.77.70,10.0.2.15,TLSv1.2,590,Application Data
1,0.36616899999899033,10.0.2.15,54.93.77.70,TLSv1.2,1618,Application Data
1,0.36631299999862676,54.93.77.70,10.0.2.15,TCP,60,9001  >  34692 [ACK] Seq=450866373 Ack=24540897 Win=65535 Len=0
1,0.5425119999999879,62.210.85.178,10.0.2.15,TLSv1.2,1618,Application Data
1,0.5427019999988261,10.0.2.15,62.210.85.178,TCP,54,35978  >  9001 [ACK] Seq=451298637 Ack=24470107 Win=65535 Len=0
1,0.5565129999995406,10.0.2.15,62.210.85.178,TLSv1.2,590,Application Data
1,0.5571529999997438,62.210.85.178,10.0.2.15,TCP,60,9001  >  35978 [ACK] Seq=24470107 Ack=451299173 Win=65535 Len=0
1,0.56725699999879,10.0.2.15,62.210.85.178,TLSv1.2,1618,Application Data
1,0.5674629999994067,62.210.85.178,10.0.2.15,TCP,60,9001  >  35978 [ACK] Seq=24470107 Ack=451300633 Win=65535 Len=0
1,0.567481999998563,62.210.85.178,10.0.2.15,TCP,60,9001  >  35978 [ACK] Seq=24470107 Ack=451300737 Win=65535 Len=0
1,0.6644390000001295,54.93.77.70,10.0.2.15,TLSv1.2,590,Application Data
1,0.6974030000001221,54.93.77.70,10.0.2.15,TCP,1502,"9001  >  34692 [PSH, ACK] Seq=450866909 Ack=24540897 Win=65535 Len=1448 [TCP segment of a reassembled PDU]"
1,0.6975059999986115,10.0.2.15,54.93.77.70,TCP,54,34692  >  9001 [ACK] Seq=24540897 Ack=450868357 Win=65535 Len=0
1,0.7137119999988499,54.93.77.70,10.0.2.15,TLSv1.2,170,Application Data
1,0.7140269999999873,10.0.2.15,54.93.77.70,TLSv1.2,590,Application Data
1,0.7141350000001694,54.93.77.70,10.0.2.15,TCP,60,9001  >  34692 [ACK] Seq=450868473 Ack=24541433 Win=65535 Len=0
1,0.7243259999995644,10.0.2.15,54.93.77.70,TLSv1.2,590,Application Data
1,0.7244949999985693,54.93.77.70,10.0.2.15,TCP,60,9001  >  34692 [ACK] Seq=450868473 Ack=24541969 Win=65535 Len=0
1,0.8220249999994849,62.210.85.178,10.0.2.15,TLSv1.2,590,Application Data
1,0.8623379999989993,10.0.2.15,62.210.85.178,TCP,54,35978  >  9001 [ACK] Seq=451300737 Ack=24470643 Win=65535 Len=0
1,0.9351959999985411,62.210.85.178,10.0.2.15,TLSv1.2,590,Application Data
1,0.9353049999990617,10.0.2.15,62.210.85.178,TCP,54,35978  >  9001 [ACK] Seq=451300737 Ack=24471179 Win=65535 Len=0
1,0.9357899999995425,10.0.2.15,62.210.85.178,TLSv1.2,590,Application Data
1,0.9359379999987141,62.210.85.178,10.0.2.15,TCP,60,9001  >  35978 [ACK] Seq=24471179 Ack=451301273 Win=65535 Len=0
1,1.1565080000000307,54.93.77.70,10.0.2.15,TLSv1.2,590,Application Data
1,1.1570299999984854,10.0.2.15,54.93.77.70,TLSv1.2,590,Application Data
1,1.1571899999999005,54.93.77.70,10.0.2.15,TCP,60,9001  >  34692 [ACK] Seq=450869009 Ack=24542505 Win=65535 Len=0
1,1.2707599999994272,62.210.85.178,10.0.2.15,TLSv1.2,590,Application Data
1,1.279171000000133,10.0.2.15,62.210.85.178,TLSv1.2,590,Application Data
1,1.279354999998759,62.210.85.178,10.0.2.15,TCP,60,9001  >  35978 [ACK] Seq=24471715 Ack=451301809 Win=65535 Len=0
1,1.291003999998793,10.0.2.15,62.210.85.178,TLSv1.2,4124,Application Data
1,1.2912059999998746,62.210.85.178,10.0.2.15,TCP,60,9001  >  35978 [ACK] Seq=24471715 Ack=451303269 Win=65535 Len=0
1,1.2912409999989904,62.210.85.178,10.0.2.15,TCP,60,9001  >  35978 [ACK] Seq=24471715 Ack=451304729 Win=65535 Len=0
1,1.2912479999995412,62.210.85.178,10.0.2.15,TCP,60,9001  >  35978 [ACK] Seq=24471715 Ack=451305879 Win=65535 Len=0
1,1.291373999998541,10.0.2.15,62.210.85.178,TLSv1.2,4124,Application Data
1,1.2914619999992283,10.0.2.15,62.210.85.178,TCP,2974,35978  >  9001 [ACK] Seq=451309949 Ack=24471715 Win=65535 Len=2920 [TCP segment of a reassembled PDU]
1,1.2915039999988949,62.210.85.178,10.0.2.15,TCP,60,9001  >  35978 [ACK] Seq=24471715 Ack=451307339 Win=65535 Len=0
1,1.2915130000001227,62.210.85.178,10.0.2.15,TCP,60,9001  >  35978 [ACK] Seq=24471715 Ack=451308799 Win=65535 Len=0
1,1.2915179999999964,62.210.85.178,10.0.2.15,TCP,60,9001  >  35978 [ACK] Seq=24471715 Ack=451309949 Win=65535 Len=0
1,1.2915219999995315,62.210.85.178,10.0.2.15,TCP,60,9001  >  35978 [ACK] Seq=24471715 Ack=451311409 Win=65535 Len=0
1,1.2915269999994052,62.210.85.178,10.0.2.15,TCP,60,9001  >  35978 [ACK] Seq=24471715 Ack=451312869 Win=65535 Len=0
1,1.2915720000000874,10.0.2.15,62.210.85.178,TLSv1.2,1204,Application Data
1,1.291613999999754,62.210.85.178,10.0.2.15,TCP,60,9001  >  35978 [ACK] Seq=24471715 Ack=451314019 Win=65535 Len=0
1,1.2916709999990417,10.0.2.15,62.210.85.178,TLSv1.2,4124,Application Data
1,1.2917629999992641,62.210.85.178,10.0.2.15,TCP,60,9001  >  35978 [ACK] Seq=24471715 Ack=451315479 Win=65535 Len=0
1,1.2917749999996886,62.210.85.178,10.0.2.15,TCP,60,9001  >  35978 [ACK] Seq=24471715 Ack=451316939 Win=65535 Len=0
1,1.2917799999995623,62.210.85.178,10.0.2.15,TCP,60,9001  >  35978 [ACK] Seq=24471715 Ack=451318089 Win=65535 Len=0
1,1.2918209999988903,10.0.2.15,62.210.85.178,TLSv1.2,332,Application Data
1,1.2918639999988955,62.210.85.178,10.0.2.15,TCP,60,9001  >  35978 [ACK] Seq=24471715 Ack=451318367 Win=65535 Len=0
1,1.2919399999991583,10.0.2.15,62.210.85.178,TLSv1.2,3868,Application Data
1,1.2920149999990826,62.210.85.178,10.0.2.15,TCP,60,9001  >  35978 [ACK] Seq=24471715 Ack=451319827 Win=65535 Len=0
1,1.292022999999972,62.210.85.178,10.0.2.15,TCP,60,9001  >  35978 [ACK] Seq=24471715 Ack=451321287 Win=65535 Len=0
1,1.2920290000001842,62.210.85.178,10.0.2.15,TCP,60,9001  >  35978 [ACK] Seq=24471715 Ack=451322181 Win=65535 Len=0
1,1.292078999998921,10.0.2.15,62.210.85.178,TLSv1.2,4124,Application Data
1,1.2921499999993102,62.210.85.178,10.0.2.15,TCP,60,9001  >  35978 [ACK] Seq=24471715 Ack=451323641 Win=65535 Len=0
1,1.292158999998719,62.210.85.178,10.0.2.15,TCP,60,9001  >  35978 [ACK] Seq=24471715 Ack=451325101 Win=65535 Len=0
1,1.2921639999985928,62.210.85.178,10.0.2.15,TCP,60,9001  >  35978 [ACK] Seq=24471715 Ack=451326251 Win=65535 Len=0
1,1.2922229999985575,10.0.2.15,62.210.85.178,TLSv1.2,3030,Application Data
1,1.2922969999999623,62.210.85.178,10.0.2.15,TCP,60,9001  >  35978 [ACK] Seq=24471715 Ack=451327711 Win=65535 Len=0
1,1.292303999998694,62.210.85.178,10.0.2.15,TCP,60,9001  >  35978 [ACK] Seq=24471715 Ack=451329171 Win=65535 Len=0
1,1.2923089999985677,62.210.85.178,10.0.2.15,TCP,60,9001  >  35978 [ACK] Seq=24471715 Ack=451329227 Win=65535 Len=0
1,1.3016329999991285,10.0.2.15,62.210.85.178,TLSv1.2,4124,Application Data
1,1.3017709999985527,62.210.85.178,10.0.2.15,TCP,60,9001  >  35978 [ACK] Seq=24471715 Ack=451330687 Win=65535 Len=0
1,1.301789999999528,62.210.85.178,10.0.2.15,TCP,60,9001  >  35978 [ACK] Seq=24471715 Ack=451332147 Win=65535 Len=0
1,1.3017970000000787,62.210.85.178,10.0.2.15,TCP,60,9001  >  35978 [ACK] Seq=24471715 Ack=451333297 Win=65535 Len=0
1,1.3018539999993664,10.0.2.15,62.210.85.178,TLSv1.2,4124,Application Data
1,1.30193700000018,62.210.85.178,10.0.2.15,TCP,60,9001  >  35978 [ACK] Seq=24471715 Ack=451334757 Win=65535 Len=0
1,1.3019459999995888,62.210.85.178,10.0.2.15,TCP,60,9001  >  35978 [ACK] Seq=24471715 Ack=451336217 Win=65535 Len=0
1,1.3019509999994625,62.210.85.178,10.0.2.15,TCP,60,9001  >  35978 [ACK] Seq=24471715 Ack=451337367 Win=65535 Len=0
1,1.3020010000000184,10.0.2.15,62.210.85.178,TLSv1.2,4124,Application Data
1,1.3020739999992657,62.210.85.178,10.0.2.15,TCP,60,9001  >  35978 [ACK] Seq=24471715 Ack=451338827 Win=65535 Len=0
1,1.3020829999986745,62.210.85.178,10.0.2.15,TCP,60,9001  >  35978 [ACK] Seq=24471715 Ack=451340287 Win=65535 Len=0
1,1.3020879999985482,62.210.85.178,10.0.2.15,TCP,60,9001  >  35978 [ACK] Seq=24471715 Ack=451341437 Win=65535 Len=0
1,1.3021520000002056,10.0.2.15,62.210.85.178,TLSv1.2,4124,Application Data
1,1.3022449999989476,62.210.85.178,10.0.2.15,TCP,60,9001  >  35978 [ACK] Seq=24471715 Ack=451342897 Win=65535 Len=0
1,1.3022559999990335,62.210.85.178,10.0.2.15,TCP,60,9001  >  35978 [ACK] Seq=24471715 Ack=451344357 Win=65535 Len=0
1,1.3022609999989072,62.210.85.178,10.0.2.15,TCP,60,9001  >  35978 [ACK] Seq=24471715 Ack=451345507 Win=65535 Len=0
1,1.3023139999986597,10.0.2.15,62.210.85.178,TLSv1.2,332,Application Data
1,1.302388999998584,62.210.85.178,10.0.2.15,TCP,60,9001  >  35978 [ACK] Seq=24471715 Ack=451345785 Win=65535 Len=0
1,1.3024909999985539,10.0.2.15,62.210.85.178,TLSv1.2,3674,Application Data
1,1.3025659999984782,62.210.85.178,10.0.2.15,TCP,60,9001  >  35978 [ACK] Seq=24471715 Ack=451347245 Win=65535 Len=0
1,1.302574999999706,62.210.85.178,10.0.2.15,TCP,60,9001  >  35978 [ACK] Seq=24471715 Ack=451348705 Win=65535 Len=0
1,1.3025799999995797,62.210.85.178,10.0.2.15,TCP,60,9001  >  35978 [ACK] Seq=24471715 Ack=451349405 Win=65535 Len=0
1,1.4098319999993691,54.93.77.70,10.0.2.15,TLSv1.2,3674,Application Data
1,1.4099959999985003,10.0.2.15,54.93.77.70,TCP,54,34692  >  9001 [ACK] Seq=24542505 Ack=450872629 Win=65535 Len=0
1,1.4634279999991122,54.93.77.70,10.0.2.15,TLSv1.2,3674,Application Data
1,1.4635509999989154,10.0.2.15,54.93.77.70,TCP,54,34692  >  9001 [ACK] Seq=24542505 Ack=450876249 Win=65535 Len=0
1,1.4739909999989322,54.93.77.70,10.0.2.15,TCP,2950,"9001  >  34692 [PSH, ACK] Seq=450876249 Ack=24542505 Win=65535 Len=2896 [TCP segment of a reassembled PDU]"
1,1.4740949999995792,10.0.2.15,54.93.77.70,TCP,54,34692  >  9001 [ACK] Seq=24542505 Ack=450879145 Win=65535 Len=0
1,1.475399999999354,54.93.77.70,10.0.2.15,TLSv1.2,2950,Application Data [TCP segment of a reassembled PDU]
1,1.4754769999999553,10.0.2.15,54.93.77.70,TCP,54,34692  >  9001 [ACK] Seq=24542505 Ack=450882041 Win=65535 Len=0
1,1.4765099999985978,54.93.77.70,10.0.2.15,TLSv1.2,4398,Application Data [TCP segment of a reassembled PDU]
1,1.4765879999995377,10.0.2.15,54.93.77.70,TCP,54,34692  >  9001 [ACK] Seq=24542505 Ack=450886385 Win=65535 Len=0
1,1.4858189999995375,54.93.77.70,10.0.2.15,TLSv1.2,5846,Application Data [TCP segment of a reassembled PDU]
1,1.485966999998709,10.0.2.15,54.93.77.70,TCP,54,34692  >  9001 [ACK] Seq=24542505 Ack=450892177 Win=65535 Len=0
1,1.4914759999992384,54.93.77.70,10.0.2.15,TLSv1.2,2950,"Application Data, Application Data"
1,1.491517999998905,54.93.77.70,10.0.2.15,TLSv1.2,5846,"Application Data, Application Data"
1,1.4915899999996327,10.0.2.15,54.93.77.70,TCP,54,34692  >  9001 [ACK] Seq=24542505 Ack=450895073 Win=65535 Len=0
1,1.491715000000113,10.0.2.15,54.93.77.70,TCP,54,34692  >  9001 [ACK] Seq=24542505 Ack=450900865 Win=65535 Len=0
1,1.4920679999995627,10.0.2.15,54.93.77.70,TLSv1.2,590,Application Data
1,1.4922139999998763,54.93.77.70,10.0.2.15,TCP,60,9001  >  34692 [ACK] Seq=450900865 Ack=24543041 Win=65535 Len=0
1,1.4946970000000874,54.93.77.70,10.0.2.15,TLSv1.2,12174,"Application Data, Application Data, Application Data, Application Data"
1,1.4948349999995116,10.0.2.15,54.93.77.70,TCP,54,34692  >  9001 [ACK] Seq=24543041 Ack=450912985 Win=65535 Len=0
1,1.505020999999033,54.93.77.70,10.0.2.15,TCP,2950,"9001  >  34692 [PSH, ACK] Seq=450912985 Ack=24543041 Win=65535 Len=2896 [TCP segment of a reassembled PDU]"
1,1.5051239999993413,10.0.2.15,54.93.77.70,TCP,54,34692  >  9001 [ACK] Seq=24543041 Ack=450915881 Win=65535 Len=0
1,1.5140129999999772,54.93.77.70,10.0.2.15,TLSv1.2,778,Application Data
1,1.5147559999986697,10.0.2.15,54.93.77.70,TLSv1.2,590,Application Data
1,1.518222999999125,54.93.77.70,10.0.2.15,TCP,60,9001  >  34692 [ACK] Seq=450916605 Ack=24543577 Win=65535 Len=0
1,1.5302859999992506,10.0.2.15,54.93.77.70,TLSv1.2,590,Application Data
1,1.5305499999994936,54.93.77.70,10.0.2.15,TCP,60,9001  >  34692 [ACK] Seq=450916605 Ack=24544113 Win=65535 Len=0
1,1.5319359999994049,54.93.77.70,10.0.2.15,TLSv1.2,590,Application Data
1,1.5750140000000101,10.0.2.15,54.93.77.70,TCP,54,34692  >  9001 [ACK] Seq=24544113 Ack=450917141 Win=65535 Len=0
1,1.6020449999996345,62.210.85.178,10.0.2.15,TLSv1.2,590,Application Data
1,1.6454139999987092,10.0.2.15,62.210.85.178,TCP,54,35978  >  9001 [ACK] Seq=451349405 Ack=24472251 Win=65535 Len=0
1,1.7659739999999147,62.210.85.178,10.0.2.15,TLSv1.2,1104,Application Data
1,1.7660799999994197,10.0.2.15,62.210.85.178,TCP,54,35978  >  9001 [ACK] Seq=451349405 Ack=24473301 Win=65535 Len=0
1,1.7665079999987938,10.0.2.15,62.210.85.178,TLSv1.2,590,Application Data
1,1.767175999999381,62.210.85.178,10.0.2.15,TCP,60,9001  >  35978 [ACK] Seq=24473301 Ack=451349941 Win=65535 Len=0
1,1.8682219999991503,54.93.77.70,10.0.2.15,TLSv1.2,590,Application Data
1,1.8683409999994183,10.0.2.15,54.93.77.70,TCP,54,34692  >  9001 [ACK] Seq=24544113 Ack=450917677 Win=65535 Len=0
1,1.868877999999313,10.0.2.15,54.93.77.70,TLSv1.2,590,Application Data
1,1.868996999999581,54.93.77.70,10.0.2.15,TCP,60,9001  >  34692 [ACK] Seq=450917677 Ack=24544649 Win=65535 Len=0
1,2.0030679999999847,62.210.85.178,10.0.2.15,TLSv1.2,590,Application Data
1,2.0075230000002193,10.0.2.15,62.210.85.178,TLSv1.2,590,Application Data
1,2.007711999998719,62.210.85.178,10.0.2.15,TCP,60,9001  >  35978 [ACK] Seq=24473837 Ack=451350477 Win=65535 Len=0
1,2.0190459999994346,10.0.2.15,62.210.85.178,TLSv1.2,4124,Application Data
1,2.0191759999997885,10.0.2.15,62.210.85.178,TCP,2974,35978  >  9001 [ACK] Seq=451354547 Ack=24473837 Win=65535 Len=2920 [TCP segment of a reassembled PDU]
1,2.019291999999041,62.210.85.178,10.0.2.15,TCP,60,9001  >  35978 [ACK] Seq=24473837 Ack=451351937 Win=65535 Len=0
1,2.019304999999804,62.210.85.178,10.0.2.15,TCP,60,9001  >  35978 [ACK] Seq=24473837 Ack=451353397 Win=65535 Len=0
1,2.0193099999996775,62.210.85.178,10.0.2.15,TCP,60,9001  >  35978 [ACK] Seq=24473837 Ack=451354547 Win=65535 Len=0
1,2.019312999998874,62.210.85.178,10.0.2.15,TCP,60,9001  >  35978 [ACK] Seq=24473837 Ack=451356007 Win=65535 Len=0
1,2.0193170000002283,62.210.85.178,10.0.2.15,TCP,60,9001  >  35978 [ACK] Seq=24473837 Ack=451357467 Win=65535 Len=0
1,2.019360999998753,10.0.2.15,62.210.85.178,TLSv1.2,1204,Application Data
1,2.0194329999994807,10.0.2.15,62.210.85.178,TCP,2974,35978  >  9001 [ACK] Seq=451358617 Ack=24473837 Win=65535 Len=2920 [TCP segment of a reassembled PDU]
1,2.019470999999612,62.210.85.178,10.0.2.15,TCP,60,9001  >  35978 [ACK] Seq=24473837 Ack=451358617 Win=65535 Len=0
1,2.019478000000163,62.210.85.178,10.0.2.15,TCP,60,9001  >  35978 [ACK] Seq=24473837 Ack=451360077 Win=65535 Len=0
1,2.0194830000000366,62.210.85.178,10.0.2.15,TCP,60,9001  >  35978 [ACK] Seq=24473837 Ack=451361537 Win=65535 Len=0
1,2.0195159999984753,10.0.2.15,62.210.85.178,TLSv1.2,1204,Application Data
1,2.0195499999990716,62.210.85.178,10.0.2.15,TCP,60,9001  >  35978 [ACK] Seq=24473837 Ack=451362687 Win=65535 Len=0
1,2.0195960000000923,10.0.2.15,62.210.85.178,TLSv1.2,4124,Application Data
1,2.0196820000001026,62.210.85.178,10.0.2.15,TCP,60,9001  >  35978 [ACK] Seq=24473837 Ack=451364147 Win=65535 Len=0
1,2.019689999999173,62.210.85.178,10.0.2.15,TCP,60,9001  >  35978 [ACK] Seq=24473837 Ack=451365607 Win=65535 Len=0
1,2.0196949999990466,62.210.85.178,10.0.2.15,TCP,60,9001  >  35978 [ACK] Seq=24473837 Ack=451366757 Win=65535 Len=0
1,2.0197279999993043,10.0.2.15,62.210.85.178,TLSv1.2,332,Application Data
1,2.019763000000239,62.210.85.178,10.0.2.15,TCP,60,9001  >  35978 [ACK] Seq=24473837 Ack=451367035 Win=65535 Len=0
1,2.019803999999567,10.0.2.15,62.210.85.178,TLSv1.2,590,Application Data
1,2.01984099999936,62.210.85.178,10.0.2.15,TCP,60,9001  >  35978 [ACK] Seq=24473837 Ack=451367571 Win=65535 Len=0
1,2.11298799999895,54.93.77.70,10.0.2.15,TLSv1.2,590,Application Data
1,2.132485000000088,54.93.77.70,10.0.2.15,TCP,2950,"9001  >  34692 [PSH, ACK] Seq=450918213 Ack=24544649 Win=65535 Len=2896 [TCP segment of a reassembled PDU]"
1,2.132631999998921,10.0.2.15,54.93.77.70,TCP,54,34692  >  9001 [ACK] Seq=24544649 Ack=450921109 Win=65535 Len=0
1,2.1326680000001943,54.93.77.70,10.0.2.15,TLSv1.2,2950,Application Data [TCP segment of a reassembled PDU]
1,2.1327089999995223,10.0.2.15,54.93.77.70,TCP,54,34692  >  9001 [ACK] Seq=24544649 Ack=450924005 Win=65535 Len=0
1,2.1327970000002097,54.93.77.70,10.0.2.15,TLSv1.2,2016,Application Data
1,2.1329439999990427,10.0.2.15,54.93.77.70,TLSv1.2,590,Application Data
1,2.133022999998502,54.93.77.70,10.0.2.15,TCP,60,9001  >  34692 [ACK] Seq=450925967 Ack=24545185 Win=65535 Len=0
1,2.1508450000001176,54.93.77.70,10.0.2.15,TLSv1.2,590,Application Data
1,2.155353999998624,54.93.77.70,10.0.2.15,TCP,2950,"9001  >  34692 [PSH, ACK] Seq=450926503 Ack=24545185 Win=65535 Len=2896 [TCP segment of a reassembled PDU]"
1,2.1554269999996905,10.0.2.15,54.93.77.70,TCP,54,34692  >  9001 [ACK] Seq=24545185 Ack=450929399 Win=65535 Len=0
1,2.1645639999987907,54.93.77.70,10.0.2.15,TLSv1.2,2950,Application Data [TCP segment of a reassembled PDU]
1,2.1646769999988464,10.0.2.15,54.93.77.70,TCP,54,34692  >  9001 [ACK] Seq=24545185 Ack=450932295 Win=65535 Len=0
1,2.164722999999867,54.93.77.70,10.0.2.15,TLSv1.2,2950,Application Data [TCP segment of a reassembled PDU]
1,2.164800999998988,10.0.2.15,54.93.77.70,TCP,54,34692  >  9001 [ACK] Seq=24545185 Ack=450935191 Win=65535 Len=0
1,2.166957999999795,54.93.77.70,10.0.2.15,TLSv1.2,170,Application Data
1,2.169797999998991,10.0.2.15,54.93.77.70,TLSv1.2,590,Application Data
1,2.1699879999996483,54.93.77.70,10.0.2.15,TCP,60,9001  >  34692 [ACK] Seq=450935307 Ack=24545721 Win=65535 Len=0
1,2.2489909999985684,62.210.85.178,10.0.2.15,TLSv1.2,590,Application Data
1,2.290385000000242,10.0.2.15,62.210.85.178,TCP,54,35978  >  9001 [ACK] Seq=451367571 Ack=24474373 Win=65535 Len=0
1,2.4878369999987626,62.210.85.178,10.0.2.15,TLSv1.2,590,Application Data
1,2.487961999999243,10.0.2.15,62.210.85.178,TCP,54,35978  >  9001 [ACK] Seq=451367571 Ack=24474909 Win=65535 Len=0
1,2.48865399999886,10.0.2.15,62.210.85.178,TLSv1.2,590,Application Data
1,2.4888219999993453,62.210.85.178,10.0.2.15,TCP,60,9001  >  35978 [ACK] Seq=24474909 Ack=451368107 Win=65535 Len=0
1,2.6000139999996463,54.93.77.70,10.0.2.15,TLSv1.2,590,Application Data
1,2.6005549999990762,10.0.2.15,54.93.77.70,TLSv1.2,590,Application Data
1,2.6007359999985056,54.93.77.70,10.0.2.15,TCP,60,9001  >  34692 [ACK] Seq=450935843 Ack=24546257 Win=65535 Len=0
1,2.7941510000000562,62.210.85.178,10.0.2.15,TLSv1.2,590,Application Data
1,2.798797999999806,10.0.2.15,62.210.85.178,TLSv1.2,590,Application Data
1,2.7989550000002055,62.210.85.178,10.0.2.15,TCP,60,9001  >  35978 [ACK] Seq=24475445 Ack=451368643 Win=65535 Len=0
1,2.811443999999028,10.0.2.15,62.210.85.178,TLSv1.2,4124,Application Data
1,2.8115839999991294,10.0.2.15,62.210.85.178,TCP,2974,35978  >  9001 [ACK] Seq=451372713 Ack=24475445 Win=65535 Len=2920 [TCP segment of a reassembled PDU]
1,2.811635000000024,62.210.85.178,10.0.2.15,TCP,60,9001  >  35978 [ACK] Seq=24475445 Ack=451370103 Win=65535 Len=0
1,2.8116469999986293,62.210.85.178,10.0.2.15,TCP,60,9001  >  35978 [ACK] Seq=24475445 Ack=451371563 Win=65535 Len=0
1,2.8116529999988416,62.210.85.178,10.0.2.15,TCP,60,9001  >  35978 [ACK] Seq=24475445 Ack=451372713 Win=65535 Len=0
1,2.8116570000001957,62.210.85.178,10.0.2.15,TCP,60,9001  >  35978 [ACK] Seq=24475445 Ack=451374173 Win=65535 Len=0
1,2.8116620000000694,62.210.85.178,10.0.2.15,TCP,60,9001  >  35978 [ACK] Seq=24475445 Ack=451375633 Win=65535 Len=0
1,2.811712999999145,10.0.2.15,62.210.85.178,TLSv1.2,304,Application Data
1,2.811759999998685,62.210.85.178,10.0.2.15,TCP,60,9001  >  35978 [ACK] Seq=24475445 Ack=451375883 Win=65535 Len=0
1,3.0000249999993684,54.93.77.70,10.0.2.15,TLSv1.2,590,Application Data
1,3.0037769999999,54.93.77.70,10.0.2.15,TCP,2950,"9001  >  34692 [PSH, ACK] Seq=450936379 Ack=24546257 Win=65535 Len=2896 [TCP segment of a reassembled PDU]"
1,3.003811999999016,54.93.77.70,10.0.2.15,TLSv1.2,4398,"Application Data, Application Data"
1,3.0039059999999154,10.0.2.15,54.93.77.70,TCP,54,34692  >  9001 [ACK] Seq=24546257 Ack=450943619 Win=65535 Len=0
1,3.0071699999989505,10.0.2.15,54.93.77.70,TLSv1.2,590,Application Data
1,3.0073499999998603,54.93.77.70,10.0.2.15,TCP,60,9001  >  34692 [ACK] Seq=450943619 Ack=24546793 Win=65535 Len=0
1,3.2037769999988086,62.210.85.178,10.0.2.15,TLSv1.2,590,Application Data
1,3.204173999998602,10.0.2.15,62.210.85.178,TLSv1.2,590,Application Data
1,3.204294999999547,62.210.85.178,10.0.2.15,TCP,60,9001  >  35978 [ACK] Seq=24475981 Ack=451376419 Win=65535 Len=0
1,3.4090889999988576,54.93.77.70,10.0.2.15,TLSv1.2,590,Application Data
1,3.409583999999086,10.0.2.15,54.93.77.70,TLSv1.2,590,Application Data
1,3.4097209999999905,54.93.77.70,10.0.2.15,TCP,60,9001  >  34692 [ACK] Seq=450944155 Ack=24547329 Win=65535 Len=0
1,3.6133519999984856,62.210.85.178,10.0.2.15,TLSv1.2,590,Application Data
1,3.622879999998986,10.0.2.15,62.210.85.178,TLSv1.2,590,Application Data
1,3.6231229999993957,62.210.85.178,10.0.2.15,TCP,60,9001  >  35978 [ACK] Seq=24476517 Ack=451376955 Win=65535 Len=0
1,3.634907999999996,10.0.2.15,62.210.85.178,TLSv1.2,4124,Application Data
1,3.635043999998743,10.0.2.15,62.210.85.178,TCP,2974,35978  >  9001 [ACK] Seq=451381025 Ack=24476517 Win=65535 Len=2920 [TCP segment of a reassembled PDU]
1,3.635091000000102,62.210.85.178,10.0.2.15,TCP,60,9001  >  35978 [ACK] Seq=24476517 Ack=451378415 Win=65535 Len=0
1,3.6351029999987077,62.210.85.178,10.0.2.15,TCP,60,9001  >  35978 [ACK] Seq=24476517 Ack=451379875 Win=65535 Len=0
1,3.6351079999985814,62.210.85.178,10.0.2.15,TCP,60,9001  >  35978 [ACK] Seq=24476517 Ack=451381025 Win=65535 Len=0
1,3.635113000000274,62.210.85.178,10.0.2.15,TCP,60,9001  >  35978 [ACK] Seq=24476517 Ack=451382485 Win=65535 Len=0
1,3.635116999999809,62.210.85.178,10.0.2.15,TCP,60,9001  >  35978 [ACK] Seq=24476517 Ack=451383945 Win=65535 Len=0
1,3.635166999998546,10.0.2.15,62.210.85.178,TLSv1.2,1204,Application Data
1,3.635264999998981,10.0.2.15,62.210.85.178,TCP,2974,35978  >  9001 [ACK] Seq=451385095 Ack=24476517 Win=65535 Len=2920 [TCP segment of a reassembled PDU]
1,3.635290000000168,62.210.85.178,10.0.2.15,TCP,60,9001  >  35978 [ACK] Seq=24476517 Ack=451385095 Win=65535 Len=0
1,3.6353279999984807,10.0.2.15,62.210.85.178,TLSv1.2,1204,Application Data
1,3.6353719999988243,62.210.85.178,10.0.2.15,TCP,60,9001  >  35978 [ACK] Seq=24476517 Ack=451386555 Win=65535 Len=0
1,3.635378999999375,62.210.85.178,10.0.2.15,TCP,60,9001  >  35978 [ACK] Seq=24476517 Ack=451388015 Win=65535 Len=0
1,3.6353839999992488,62.210.85.178,10.0.2.15,TCP,60,9001  >  35978 [ACK] Seq=24476517 Ack=451389165 Win=65535 Len=0
1,3.6354780000001483,10.0.2.15,62.210.85.178,TLSv1.2,4124,Application Data
1,3.6356009999999515,62.210.85.178,10.0.2.15,TCP,60,9001  >  35978 [ACK] Seq=24476517 Ack=451390625 Win=65535 Len=0
1,3.6356120000000374,62.210.85.178,10.0.2.15,TCP,60,9001  >  35978 [ACK] Seq=24476517 Ack=451392085 Win=65535 Len=0
1,3.6356159999995725,62.210.85.178,10.0.2.15,TCP,60,9001  >  35978 [ACK] Seq=24476517 Ack=451393235 Win=65535 Len=0
1,3.6356739999991987,10.0.2.15,62.210.85.178,TLSv1.2,332,Application Data
1,3.635716999999204,62.210.85.178,10.0.2.15,TCP,60,9001  >  35978 [ACK] Seq=24476517 Ack=451393513 Win=65535 Len=0
1,3.6357869999992545,10.0.2.15,62.210.85.178,TLSv1.2,3868,Application Data
1,3.6358579999996437,10.0.2.15,62.210.85.178,TCP,2974,35978  >  9001 [ACK] Seq=451397327 Ack=24476517 Win=65535 Len=2920 [TCP segment of a reassembled PDU]
1,3.635897999998633,62.210.85.178,10.0.2.15,TCP,60,9001  >  35978 [ACK] Seq=24476517 Ack=451394973 Win=65535 Len=0
1,3.6359059999995225,62.210.85.178,10.0.2.15,TCP,60,9001  >  35978 [ACK] Seq=24476517 Ack=451396433 Win=65535 Len=0
1,3.635910999999396,62.210.85.178,10.0.2.15,TCP,60,9001  >  35978 [ACK] Seq=24476517 Ack=451397327 Win=65535 Len=0
1,3.63591599999927,62.210.85.178,10.0.2.15,TCP,60,9001  >  35978 [ACK] Seq=24476517 Ack=451398787 Win=65535 Len=0
1,3.6359209999991435,62.210.85.178,10.0.2.15,TCP,60,9001  >  35978 [ACK] Seq=24476517 Ack=451400247 Win=65535 Len=0
1,3.63596299999881,10.0.2.15,62.210.85.178,TLSv1.2,1204,Application Data
1,3.6360029999996186,62.210.85.178,10.0.2.15,TCP,60,9001  >  35978 [ACK] Seq=24476517 Ack=451401397 Win=65535 Len=0
1,3.636053999998694,10.0.2.15,62.210.85.178,TLSv1.2,3030,Application Data
1,3.6360960000001796,62.210.85.178,10.0.2.15,TCP,60,9001  >  35978 [ACK] Seq=24476517 Ack=451402857 Win=65535 Len=0
1,3.6361029999989114,62.210.85.178,10.0.2.15,TCP,60,9001  >  35978 [ACK] Seq=24476517 Ack=451404317 Win=65535 Len=0
1,3.636107999998785,62.210.85.178,10.0.2.15,TCP,60,9001  >  35978 [ACK] Seq=24476517 Ack=451404373 Win=65535 Len=0
1,3.6453849999998056,10.0.2.15,62.210.85.178,TLSv1.2,4124,Application Data
1,3.645532999998977,10.0.2.15,62.210.85.178,TCP,2974,35978  >  9001 [ACK] Seq=451408443 Ack=24476517 Win=65535 Len=2920 [TCP segment of a reassembled PDU]
1,3.6455819999991945,62.210.85.178,10.0.2.15,TCP,60,9001  >  35978 [ACK] Seq=24476517 Ack=451405833 Win=65535 Len=0
1,3.6455929999992804,62.210.85.178,10.0.2.15,TCP,60,9001  >  35978 [ACK] Seq=24476517 Ack=451407293 Win=65535 Len=0
1,3.6455989999994927,62.210.85.178,10.0.2.15,TCP,60,9001  >  35978 [ACK] Seq=24476517 Ack=451408443 Win=65535 Len=0
1,3.6456710000002204,10.0.2.15,62.210.85.178,TLSv1.2,1204,Application Data
1,3.6456949999992503,62.210.85.178,10.0.2.15,TCP,60,9001  >  35978 [ACK] Seq=24476517 Ack=451409903 Win=65535 Len=0
1,3.6457030000001396,62.210.85.178,10.0.2.15,TCP,60,9001  >  35978 [ACK] Seq=24476517 Ack=451411363 Win=65535 Len=0
1,3.6457719999998517,62.210.85.178,10.0.2.15,TCP,60,9001  >  35978 [ACK] Seq=24476517 Ack=451412513 Win=65535 Len=0
1,3.645809999999983,10.0.2.15,62.210.85.178,TCP,2974,35978  >  9001 [ACK] Seq=451412513 Ack=24476517 Win=65535 Len=2920 [TCP segment of a reassembled PDU]
1,3.6458719999991445,10.0.2.15,62.210.85.178,TLSv1.2,1204,Application Data
1,3.645907999998599,62.210.85.178,10.0.2.15,TCP,60,9001  >  35978 [ACK] Seq=24476517 Ack=451413973 Win=65535 Len=0
1,3.6459149999991496,62.210.85.178,10.0.2.15,TCP,60,9001  >  35978 [ACK] Seq=24476517 Ack=451415433 Win=65535 Len=0
1,3.6459199999990233,62.210.85.178,10.0.2.15,TCP,60,9001  >  35978 [ACK] Seq=24476517 Ack=451416583 Win=65535 Len=0
1,3.6459669999985636,10.0.2.15,62.210.85.178,TLSv1.2,4124,Application Data
1,3.646009000000049,62.210.85.178,10.0.2.15,TCP,60,9001  >  35978 [ACK] Seq=24476517 Ack=451418043 Win=65535 Len=0
1,3.646015999998781,62.210.85.178,10.0.2.15,TCP,60,9001  >  35978 [ACK] Seq=24476517 Ack=451419503 Win=65535 Len=0
1,3.6460209999986546,62.210.85.178,10.0.2.15,TCP,60,9001  >  35978 [ACK] Seq=24476517 Ack=451420653 Win=65535 Len=0
1,3.646068000000014,10.0.2.15,62.210.85.178,TLSv1.2,332,Application Data
1,3.646108999999342,62.210.85.178,10.0.2.15,TCP,60,9001  >  35978 [ACK] Seq=24476517 Ack=451420931 Win=65535 Len=0
1,3.646177999999054,10.0.2.15,62.210.85.178,TLSv1.2,3868,Application Data
1,3.646225999998933,62.210.85.178,10.0.2.15,TCP,60,9001  >  35978 [ACK] Seq=24476517 Ack=451422391 Win=65535 Len=0
1,3.64623599999868,62.210.85.178,10.0.2.15,TCP,60,9001  >  35978 [ACK] Seq=24476517 Ack=451423851 Win=65535 Len=0
1,3.6462419999988924,62.210.85.178,10.0.2.15,TCP,60,9001  >  35978 [ACK] Seq=24476517 Ack=451424745 Win=65535 Len=0
1,3.646300999998857,10.0.2.15,62.210.85.178,TLSv1.2,4124,Application Data
1,3.6463669999993726,62.210.85.178,10.0.2.15,TCP,60,9001  >  35978 [ACK] Seq=24476517 Ack=451426205 Win=65535 Len=0
1,3.646380999998655,62.210.85.178,10.0.2.15,TCP,60,9001  >  35978 [ACK] Seq=24476517 Ack=451427665 Win=65535 Len=0
1,3.646385999998529,62.210.85.178,10.0.2.15,TCP,60,9001  >  35978 [ACK] Seq=24476517 Ack=451428815 Win=65535 Len=0
1,3.646443999999974,10.0.2.15,62.210.85.178,TLSv1.2,3030,Application Data
1,3.6464889999988372,62.210.85.178,10.0.2.15,TCP,60,9001  >  35978 [ACK] Seq=24476517 Ack=451430275 Win=65535 Len=0
1,3.646495999999388,62.210.85.178,10.0.2.15,TCP,60,9001  >  35978 [ACK] Seq=24476517 Ack=451431735 Win=65535 Len=0
1,3.6465009999992617,62.210.85.178,10.0.2.15,TCP,60,9001  >  35978 [ACK] Seq=24476517 Ack=451431791 Win=65535 Len=0
1,3.661770999999135,10.0.2.15,62.210.85.178,TLSv1.2,4124,Application Data
1,3.6619009999994887,62.210.85.178,10.0.2.15,TCP,60,9001  >  35978 [ACK] Seq=24476517 Ack=451433251 Win=65535 Len=0
1,3.661919999998645,62.210.85.178,10.0.2.15,TCP,60,9001  >  35978 [ACK] Seq=24476517 Ack=451434711 Win=65535 Len=0
1,3.661925999998857,62.210.85.178,10.0.2.15,TCP,60,9001  >  35978 [ACK] Seq=24476517 Ack=451435861 Win=65535 Len=0
1,3.6619709999995393,10.0.2.15,62.210.85.178,TLSv1.2,140,Application Data
1,3.6620509999993374,62.210.85.178,10.0.2.15,TCP,60,9001  >  35978 [ACK] Seq=24476517 Ack=451435947 Win=65535 Len=0
1,3.725764999999228,54.93.77.70,10.0.2.15,TLSv1.2,590,Application Data
1,3.7571509999997943,54.93.77.70,10.0.2.15,TLSv1.2,7294,"Application Data, Application Data"
1,3.75726399999985,10.0.2.15,54.93.77.70,TCP,54,34692  >  9001 [ACK] Seq=24547329 Ack=450951931 Win=65535 Len=0
1,3.77668999999878,54.93.77.70,10.0.2.15,TLSv1.2,3674,Application Data
1,3.7767839999996795,10.0.2.15,54.93.77.70,TCP,54,34692  >  9001 [ACK] Seq=24547329 Ack=450955551 Win=65535 Len=0
1,3.793854999999894,54.93.77.70,10.0.2.15,TLSv1.2,1104,Application Data
1,3.828156999999919,54.93.77.70,10.0.2.15,TCP,2950,"9001  >  34692 [PSH, ACK] Seq=450956601 Ack=24547329 Win=65535 Len=2896 [TCP segment of a reassembled PDU]"
1,3.8282359999993787,10.0.2.15,54.93.77.70,TCP,54,34692  >  9001 [ACK] Seq=24547329 Ack=450959497 Win=65535 Len=0
1,3.8290089999991324,54.93.77.70,10.0.2.15,TLSv1.2,4912,"Application Data, Application Data"
1,3.8291039999985514,10.0.2.15,54.93.77.70,TCP,54,34692  >  9001 [ACK] Seq=24547329 Ack=450964355 Win=65535 Len=0
1,3.848212999999305,54.93.77.70,10.0.2.15,TLSv1.2,7294,Application Data
1,3.8484389999994164,10.0.2.15,54.93.77.70,TCP,54,34692  >  9001 [ACK] Seq=24547329 Ack=450971595 Win=65535 Len=0
1,3.848750999999538,54.93.77.70,10.0.2.15,TLSv1.2,4702,"Application Data, Application Data"
1,3.8488239999987854,10.0.2.15,54.93.77.70,TCP,54,34692  >  9001 [ACK] Seq=24547329 Ack=450976243 Win=65535 Len=0
1,3.848986999999397,10.0.2.15,54.93.77.70,TLSv1.2,590,Application Data
1,3.849068999999872,54.93.77.70,10.0.2.15,TCP,60,9001  >  34692 [ACK] Seq=450976243 Ack=24547865 Win=65535 Len=0
1,3.8584499999997206,10.0.2.15,54.93.77.70,TLSv1.2,590,Application Data
1,3.8586429999995744,54.93.77.70,10.0.2.15,TCP,60,9001  >  34692 [ACK] Seq=450976243 Ack=24548401 Win=65535 Len=0
1,3.8752499999991414,54.93.77.70,10.0.2.15,TLSv1.2,7808,"Application Data, Application Data"
1,3.875393999998778,10.0.2.15,54.93.77.70,TCP,54,34692  >  9001 [ACK] Seq=24548401 Ack=450983997 Win=65535 Len=0
1,3.929091999998491,54.93.77.70,10.0.2.15,TLSv1.2,5846,Application Data
1,3.929190999999264,10.0.2.15,54.93.77.70,TCP,54,34692  >  9001 [ACK] Seq=24548401 Ack=450989789 Win=65535 Len=0
1,3.9294709999994666,54.93.77.70,10.0.2.15,TLSv1.2,2016,Application Data
1,3.929517999999007,10.0.2.15,54.93.77.70,TCP,54,34692  >  9001 [ACK] Seq=24548401 Ack=450991751 Win=65535 Len=0
1,3.9507229999999254,54.93.77.70,10.0.2.15,TLSv1.2,1104,Application Data
1,3.972325999999157,54.93.77.70,10.0.2.15,TLSv1.2,3674,Application Data
1,3.9724519999999757,10.0.2.15,54.93.77.70,TCP,54,34692  >  9001 [ACK] Seq=24548401 Ack=450996421 Win=65535 Len=0
1,3.972615999999107,10.0.2.15,54.93.77.70,TLSv1.2,590,Application Data
1,3.9727379999985715,54.93.77.70,10.0.2.15,TCP,60,9001  >  34692 [ACK] Seq=450996421 Ack=24548937 Win=65535 Len=0
1,3.9801149999984773,54.93.77.70,10.0.2.15,TLSv1.2,7294,"Application Data, Application Data"
1,3.9802309999995487,10.0.2.15,54.93.77.70,TCP,54,34692  >  9001 [ACK] Seq=24548937 Ack=451003661 Win=65535 Len=0
1,3.9831749999993917,10.0.2.15,54.93.77.70,TLSv1.2,590,Application Data
1,3.983355999998821,54.93.77.70,10.0.2.15,TCP,60,9001  >  34692 [ACK] Seq=451003661 Ack=24549473 Win=65535 Len=0
1,4.041548999999577,62.210.85.178,10.0.2.15,TLSv1.2,1104,Application Data
1,4.082384999999704,10.0.2.15,62.210.85.178,TCP,54,35978  >  9001 [ACK] Seq=451435947 Ack=24477567 Win=65535 Len=0
1,4.10021499999857,62.210.85.178,10.0.2.15,TLSv1.2,590,Application Data
1,4.100297999999384,10.0.2.15,62.210.85.178,TCP,54,35978  >  9001 [ACK] Seq=451435947 Ack=24478103 Win=65535 Len=0
1,4.192933999998786,62.210.85.178,10.0.2.15,TLSv1.2,590,Application Data
1,4.193041999998968,10.0.2.15,62.210.85.178,TCP,54,35978  >  9001 [ACK] Seq=451435947 Ack=24478639 Win=65535 Len=0
1,4.193350999999893,10.0.2.15,62.210.85.178,TLSv1.2,590,Application Data
1,4.193468999999823,62.210.85.178,10.0.2.15,TCP,60,9001  >  35978 [ACK] Seq=24478639 Ack=451436483 Win=65535 Len=0
1,4.285096999999951,54.93.77.70,10.0.2.15,TLSv1.2,590,Application Data
1,4.285514999999577,10.0.2.15,54.93.77.70,TLSv1.2,590,Application Data
1,4.2856359999987035,54.93.77.70,10.0.2.15,TCP,60,9001  >  34692 [ACK] Seq=451004197 Ack=24550009 Win=65535 Len=0
1,4.393546999999671,62.210.85.178,10.0.2.15,TLSv1.2,590,Application Data
1,4.397969999999987,10.0.2.15,62.210.85.178,TLSv1.2,590,Application Data
1,4.398126999998567,62.210.85.178,10.0.2.15,TCP,60,9001  >  35978 [ACK] Seq=24479175 Ack=451437019 Win=65535 Len=0
1,4.410476999999446,10.0.2.15,62.210.85.178,TLSv1.2,4124,Application Data
1,4.4105839999992895,10.0.2.15,62.210.85.178,TCP,2974,35978  >  9001 [ACK] Seq=451441089 Ack=24479175 Win=65535 Len=2920 [TCP segment of a reassembled PDU]
1,4.410626999999295,62.210.85.178,10.0.2.15,TCP,60,9001  >  35978 [ACK] Seq=24479175 Ack=451438479 Win=65535 Len=0
1,4.410638999999719,62.210.85.178,10.0.2.15,TCP,60,9001  >  35978 [ACK] Seq=24479175 Ack=451439939 Win=65535 Len=0
1,4.410642999999254,62.210.85.178,10.0.2.15,TCP,60,9001  >  35978 [ACK] Seq=24479175 Ack=451441089 Win=65535 Len=0
1,4.41064600000027,62.210.85.178,10.0.2.15,TCP,60,9001  >  35978 [ACK] Seq=24479175 Ack=451442549 Win=65535 Len=0
1,4.410647999999128,62.210.85.178,10.0.2.15,TCP,60,9001  >  35978 [ACK] Seq=24479175 Ack=451444009 Win=65535 Len=0
1,4.410683000000063,10.0.2.15,62.210.85.178,TLSv1.2,1204,Application Data
1,4.41071699999884,62.210.85.178,10.0.2.15,TCP,60,9001  >  35978 [ACK] Seq=24479175 Ack=451445159 Win=65535 Len=0
1,4.410760999999184,10.0.2.15,62.210.85.178,TLSv1.2,4124,Application Data
1,4.41079499999978,62.210.85.178,10.0.2.15,TCP,60,9001  >  35978 [ACK] Seq=24479175 Ack=451446619 Win=65535 Len=0
1,4.41080299999885,62.210.85.178,10.0.2.15,TCP,60,9001  >  35978 [ACK] Seq=24479175 Ack=451448079 Win=65535 Len=0
1,4.410807000000204,62.210.85.178,10.0.2.15,TCP,60,9001  >  35978 [ACK] Seq=24479175 Ack=451449229 Win=65535 Len=0
1,4.410844999998517,10.0.2.15,62.210.85.178,TLSv1.2,4124,Application Data
1,4.410877999998775,62.210.85.178,10.0.2.15,TCP,60,9001  >  35978 [ACK] Seq=24479175 Ack=451450689 Win=65535 Len=0
1,4.410884999999325,62.210.85.178,10.0.2.15,TCP,60,9001  >  35978 [ACK] Seq=24479175 Ack=451452149 Win=65535 Len=0
1,4.410936999998739,62.210.85.178,10.0.2.15,TCP,60,9001  >  35978 [ACK] Seq=24479175 Ack=451453299 Win=65535 Len=0
1,4.410964999999123,10.0.2.15,62.210.85.178,TLSv1.2,332,Application Data
1,4.410995999998704,62.210.85.178,10.0.2.15,TCP,60,9001  >  35978 [ACK] Seq=24479175 Ack=451453577 Win=65535 Len=0
1,4.411051999999472,10.0.2.15,62.210.85.178,TLSv1.2,3868,Application Data
1,4.411088999999265,62.210.85.178,10.0.2.15,TCP,60,9001  >  35978 [ACK] Seq=24479175 Ack=451455037 Win=65535 Len=0
1,4.411095999999816,62.210.85.178,10.0.2.15,TCP,60,9001  >  35978 [ACK] Seq=24479175 Ack=451456497 Win=65535 Len=0
1,4.411099999999351,62.210.85.178,10.0.2.15,TCP,60,9001  >  35978 [ACK] Seq=24479175 Ack=451457391 Win=65535 Len=0
1,4.411137999999482,10.0.2.15,62.210.85.178,TLSv1.2,4124,Application Data
1,4.411172999998598,62.210.85.178,10.0.2.15,TCP,60,9001  >  35978 [ACK] Seq=24479175 Ack=451458851 Win=65535 Len=0
1,4.4111789999988105,62.210.85.178,10.0.2.15,TCP,60,9001  >  35978 [ACK] Seq=24479175 Ack=451460311 Win=65535 Len=0
1,4.411181999999826,62.210.85.178,10.0.2.15,TCP,60,9001  >  35978 [ACK] Seq=24479175 Ack=451461461 Win=65535 Len=0
1,4.411215999998603,10.0.2.15,62.210.85.178,TLSv1.2,3030,Application Data
1,4.4112499999992,62.210.85.178,10.0.2.15,TCP,60,9001  >  35978 [ACK] Seq=24479175 Ack=451462921 Win=65535 Len=0
1,4.41125699999975,62.210.85.178,10.0.2.15,TCP,60,9001  >  35978 [ACK] Seq=24479175 Ack=451464381 Win=65535 Len=0
1,4.411259999998947,62.210.85.178,10.0.2.15,TCP,60,9001  >  35978 [ACK] Seq=24479175 Ack=451464437 Win=65535 Len=0
1,4.422693999998955,10.0.2.15,62.210.85.178,TLSv1.2,4124,Application Data
1,4.422776999999769,62.210.85.178,10.0.2.15,TCP,60,9001  >  35978 [ACK] Seq=24479175 Ack=451465897 Win=65535 Len=0
1,4.422786999999516,62.210.85.178,10.0.2.15,TCP,60,9001  >  35978 [ACK] Seq=24479175 Ack=451467357 Win=65535 Len=0
1,4.422789999998713,62.210.85.178,10.0.2.15,TCP,60,9001  >  35978 [ACK] Seq=24479175 Ack=451468507 Win=65535 Len=0
1,4.422832999998718,10.0.2.15,62.210.85.178,TLSv1.2,3738,Application Data
1,4.422891999998683,62.210.85.178,10.0.2.15,TCP,60,9001  >  35978 [ACK] Seq=24479175 Ack=451469967 Win=65535 Len=0
1,4.422898999999234,62.210.85.178,10.0.2.15,TCP,60,9001  >  35978 [ACK] Seq=24479175 Ack=451471427 Win=65535 Len=0
1,4.422902000000249,62.210.85.178,10.0.2.15,TCP,60,9001  >  35978 [ACK] Seq=24479175 Ack=451472191 Win=65535 Len=0
1,4.503123999998934,54.93.77.70,10.0.2.15,TLSv1.2,590,Application Data
1,4.514783999999054,54.93.77.70,10.0.2.15,TCP,2950,"9001  >  34692 [PSH, ACK] Seq=451004733 Ack=24550009 Win=65535 Len=2896 [TCP segment of a reassembled PDU]"
1,4.514951999999539,10.0.2.15,54.93.77.70,TCP,54,34692  >  9001 [ACK] Seq=24550009 Ack=451007629 Win=65535 Len=0
1,4.526418999999805,54.93.77.70,10.0.2.15,TLSv1.2,7294,"Application Data, Application Data"
1,4.526573999999528,10.0.2.15,54.93.77.70,TCP,54,34692  >  9001 [ACK] Seq=24550009 Ack=451014869 Win=65535 Len=0
1,4.547114999999394,54.93.77.70,10.0.2.15,TLSv1.2,5846,"Application Data, Application Data"
1,4.5472069999996165,10.0.2.15,54.93.77.70,TCP,54,34692  >  9001 [ACK] Seq=24550009 Ack=451020661 Win=65535 Len=0
1,4.547260999999708,54.93.77.70,10.0.2.15,TLSv1.2,4702,Application Data [TCP segment of a reassembled PDU]
1,4.54732999999942,10.0.2.15,54.93.77.70,TCP,54,34692  >  9001 [ACK] Seq=24550009 Ack=451025309 Win=65535 Len=0
1,4.561749999998938,54.93.77.70,10.0.2.15,TLSv1.2,7294,"Application Data, Application Data"
1,4.561811999999918,10.0.2.15,54.93.77.70,TCP,54,34692  >  9001 [ACK] Seq=24550009 Ack=451032549 Win=65535 Len=0
1,4.562042999999903,10.0.2.15,54.93.77.70,TLSv1.2,590,Application Data
1,4.562130999998772,54.93.77.70,10.0.2.15,TCP,60,9001  >  34692 [ACK] Seq=451032549 Ack=24550545 Win=65535 Len=0
1,4.56418499999927,54.93.77.70,10.0.2.15,TLSv1.2,170,Application Data
1,4.566326999998637,54.93.77.70,10.0.2.15,TCP,2950,"9001  >  34692 [PSH, ACK] Seq=451032665 Ack=24550545 Win=65535 Len=2896 [TCP segment of a reassembled PDU]"
1,4.566382999999405,10.0.2.15,54.93.77.70,TCP,54,34692  >  9001 [ACK] Seq=24550545 Ack=451035561 Win=65535 Len=0
1,4.572770999999193,10.0.2.15,54.93.77.70,TLSv1.2,590,Application Data
1,4.572873999999501,54.93.77.70,10.0.2.15,TCP,60,9001  >  34692 [ACK] Seq=451035561 Ack=24551081 Win=65535 Len=0
1,4.584106000000247,54.93.77.70,10.0.2.15,TLSv1.2,778,Application Data
1,4.626381000000038,10.0.2.15,54.93.77.70,TCP,54,34692  >  9001 [ACK] Seq=24551081 Ack=451036285 Win=65535 Len=0
1,4.641893999998501,54.93.77.70,10.0.2.15,TLSv1.2,590,Application Data
1,4.641969000000245,10.0.2.15,54.93.77.70,TCP,54,34692  >  9001 [ACK] Seq=24551081 Ack=451036821 Win=65535 Len=0
1,4.660017000000153,54.93.77.70,10.0.2.15,TLSv1.2,3160,Application Data
1,4.66013699999894,10.0.2.15,54.93.77.70,TCP,54,34692  >  9001 [ACK] Seq=24551081 Ack=451039927 Win=65535 Len=0
