No.,Time,Source,Destination,Protocol,Length,Info
1,0.0003260000000864238,54.93.77.70,10.0.2.15,TLSv1.2,590,Application Data
1,0.04398500000002059,10.0.2.15,54.93.77.70,TCP,54,34692  >  9001 [ACK] Seq=2126343 Ack=37387401 Win=65535 Len=0
1,0.07500699999991411,62.210.85.178,10.0.2.15,TLSv1.2,590,Application Data
1,0.07511399999998503,10.0.2.15,62.210.85.178,TCP,54,35978  >  9001 [ACK] Seq=37434025 Ack=2121261 Win=65535 Len=0
1,0.1706890000000385,10.0.2.15,54.93.77.70,TLSv1.2,590,Application Data
1,0.17088300000000345,54.93.77.70,10.0.2.15,TCP,60,9001  >  34692 [ACK] Seq=37387401 Ack=2126879 Win=65535 Len=0
1,0.20639699999992445,62.210.85.178,10.0.2.15,TLSv1.2,590,Application Data
1,0.206478000000061,10.0.2.15,62.210.85.178,TCP,54,35978  >  9001 [ACK] Seq=37434025 Ack=2121797 Win=65535 Len=0
1,0.2835949999998775,62.210.85.178,10.0.2.15,TLSv1.2,590,Application Data
1,0.2836859999999888,10.0.2.15,62.210.85.178,TCP,54,35978  >  9001 [ACK] Seq=37434025 Ack=2122333 Win=65535 Len=0
1,0.28421099999991384,10.0.2.15,62.210.85.178,TLSv1.2,590,Application Data
1,0.2843230000000858,62.210.85.178,10.0.2.15,TCP,60,9001  >  35978 [ACK] Seq=2122333 Ack=37434561 Win=65535 Len=0
1,0.3779469999999492,54.93.77.70,10.0.2.15,TLSv1.2,590,Application Data
1,0.37803200000007564,10.0.2.15,54.93.77.70,TCP,54,34692  >  9001 [ACK] Seq=2126879 Ack=37387937 Win=65535 Len=0
1,0.3784539999999197,10.0.2.15,54.93.77.70,TLSv1.2,1618,Application Data
1,0.37856299999998555,54.93.77.70,10.0.2.15,TCP,60,9001  >  34692 [ACK] Seq=37387937 Ack=2128339 Win=65535 Len=0
1,0.3785760000000664,54.93.77.70,10.0.2.15,TCP,60,9001  >  34692 [ACK] Seq=37387937 Ack=2128443 Win=65535 Len=0
1,0.7194729999998799,62.210.85.178,10.0.2.15,TLSv1.2,1618,Application Data
1,0.7196099999998751,10.0.2.15,62.210.85.178,TCP,54,35978  >  9001 [ACK] Seq=37434561 Ack=2123897 Win=65535 Len=0
1,0.7332870000000185,10.0.2.15,62.210.85.178,TLSv1.2,590,Application Data
1,0.7334639999999126,62.210.85.178,10.0.2.15,TCP,60,9001  >  35978 [ACK] Seq=2123897 Ack=37435097 Win=65535 Len=0
1,0.7480960000000323,10.0.2.15,62.210.85.178,TLSv1.2,1618,Application Data
1,0.748243999999886,62.210.85.178,10.0.2.15,TCP,60,9001  >  35978 [ACK] Seq=2123897 Ack=37436557 Win=65535 Len=0
1,0.7482680000000528,62.210.85.178,10.0.2.15,TCP,60,9001  >  35978 [ACK] Seq=2123897 Ack=37436661 Win=65535 Len=0
1,0.8599859999999353,54.93.77.70,10.0.2.15,TLSv1.2,590,Application Data
1,0.9037479999999505,10.0.2.15,54.93.77.70,TCP,54,34692  >  9001 [ACK] Seq=2128443 Ack=37388473 Win=65535 Len=0
1,0.9250099999999293,54.93.77.70,10.0.2.15,TLSv1.2,1618,Application Data
1,0.9251059999999143,10.0.2.15,54.93.77.70,TCP,54,34692  >  9001 [ACK] Seq=2128443 Ack=37390037 Win=65535 Len=0
1,0.9271719999999277,10.0.2.15,54.93.77.70,TLSv1.2,590,Application Data
1,0.9273459999999432,54.93.77.70,10.0.2.15,TCP,60,9001  >  34692 [ACK] Seq=37390037 Ack=2128979 Win=65535 Len=0
1,1.0391830000000937,62.210.85.178,10.0.2.15,TLSv1.2,590,Application Data
1,1.0395610000000488,10.0.2.15,62.210.85.178,TLSv1.2,590,Application Data
1,1.0396809999999732,62.210.85.178,10.0.2.15,TCP,60,9001  >  35978 [ACK] Seq=2124433 Ack=37437197 Win=65535 Len=0
1,1.1390949999999975,54.93.77.70,10.0.2.15,TLSv1.2,590,Application Data
1,1.1395239999999376,10.0.2.15,54.93.77.70,TLSv1.2,590,Application Data
1,1.1396270000000186,54.93.77.70,10.0.2.15,TCP,60,9001  >  34692 [ACK] Seq=37390573 Ack=2129515 Win=65535 Len=0
1,1.2366369999999733,62.210.85.178,10.0.2.15,TLSv1.2,590,Application Data
1,1.2427370000000337,10.0.2.15,62.210.85.178,TLSv1.2,590,Application Data
1,1.2428800000000138,62.210.85.178,10.0.2.15,TCP,60,9001  >  35978 [ACK] Seq=2124969 Ack=37437733 Win=65535 Len=0
1,1.252520000000004,10.0.2.15,62.210.85.178,TLSv1.2,4124,Application Data
1,1.2526350000000548,10.0.2.15,62.210.85.178,TCP,2974,35978  >  9001 [ACK] Seq=37441803 Ack=2124969 Win=65535 Len=2920 [TCP segment of a reassembled PDU]
1,1.2531739999999445,62.210.85.178,10.0.2.15,TCP,60,9001  >  35978 [ACK] Seq=2124969 Ack=37439193 Win=65535 Len=0
1,1.2531950000000052,62.210.85.178,10.0.2.15,TCP,60,9001  >  35978 [ACK] Seq=2124969 Ack=37440653 Win=65535 Len=0
1,1.2531999999998789,62.210.85.178,10.0.2.15,TCP,60,9001  >  35978 [ACK] Seq=2124969 Ack=37441803 Win=65535 Len=0
1,1.2532040000000961,62.210.85.178,10.0.2.15,TCP,60,9001  >  35978 [ACK] Seq=2124969 Ack=37443263 Win=65535 Len=0
1,1.253208000000086,62.210.85.178,10.0.2.15,TCP,60,9001  >  35978 [ACK] Seq=2124969 Ack=37444723 Win=65535 Len=0
1,1.2532630000000609,10.0.2.15,62.210.85.178,TLSv1.2,1204,Application Data
1,1.2533679999999094,62.210.85.178,10.0.2.15,TCP,60,9001  >  35978 [ACK] Seq=2124969 Ack=37445873 Win=65535 Len=0
1,1.2534089999999196,10.0.2.15,62.210.85.178,TCP,2974,35978  >  9001 [ACK] Seq=37445873 Ack=2124969 Win=65535 Len=2920 [TCP segment of a reassembled PDU]
1,1.2534840000000713,62.210.85.178,10.0.2.15,TCP,60,9001  >  35978 [ACK] Seq=2124969 Ack=37447333 Win=65535 Len=0
1,1.2534949999999299,62.210.85.178,10.0.2.15,TCP,60,9001  >  35978 [ACK] Seq=2124969 Ack=37448793 Win=65535 Len=0
1,1.2535239999999703,10.0.2.15,62.210.85.178,TLSv1.2,1204,Application Data
1,1.2536020000000008,62.210.85.178,10.0.2.15,TCP,60,9001  >  35978 [ACK] Seq=2124969 Ack=37449943 Win=65535 Len=0
1,1.2536689999999453,10.0.2.15,62.210.85.178,TLSv1.2,4124,Application Data
1,1.2537549999999555,62.210.85.178,10.0.2.15,TCP,60,9001  >  35978 [ACK] Seq=2124969 Ack=37451403 Win=65535 Len=0
1,1.2537629999999353,62.210.85.178,10.0.2.15,TCP,60,9001  >  35978 [ACK] Seq=2124969 Ack=37452863 Win=65535 Len=0
1,1.2537680000000364,62.210.85.178,10.0.2.15,TCP,60,9001  >  35978 [ACK] Seq=2124969 Ack=37454013 Win=65535 Len=0
1,1.2538019999999506,10.0.2.15,62.210.85.178,TLSv1.2,332,Application Data
1,1.253840000000082,62.210.85.178,10.0.2.15,TCP,60,9001  >  35978 [ACK] Seq=2124969 Ack=37454291 Win=65535 Len=0
1,1.253928999999971,10.0.2.15,62.210.85.178,TLSv1.2,3868,Application Data
1,1.2539679999999862,62.210.85.178,10.0.2.15,TCP,60,9001  >  35978 [ACK] Seq=2124969 Ack=37455751 Win=65535 Len=0
1,1.2539750000000822,62.210.85.178,10.0.2.15,TCP,60,9001  >  35978 [ACK] Seq=2124969 Ack=37457211 Win=65535 Len=0
1,1.253979999999956,62.210.85.178,10.0.2.15,TCP,60,9001  >  35978 [ACK] Seq=2124969 Ack=37458105 Win=65535 Len=0
1,1.254026999999951,10.0.2.15,62.210.85.178,TLSv1.2,4124,Application Data
1,1.254067999999961,62.210.85.178,10.0.2.15,TCP,60,9001  >  35978 [ACK] Seq=2124969 Ack=37459565 Win=65535 Len=0
1,1.254073999999946,62.210.85.178,10.0.2.15,TCP,60,9001  >  35978 [ACK] Seq=2124969 Ack=37461025 Win=65535 Len=0
1,1.254079000000047,62.210.85.178,10.0.2.15,TCP,60,9001  >  35978 [ACK] Seq=2124969 Ack=37462175 Win=65535 Len=0
1,1.254120999999941,10.0.2.15,62.210.85.178,TLSv1.2,3030,Application Data
1,1.2541619999999511,62.210.85.178,10.0.2.15,TCP,60,9001  >  35978 [ACK] Seq=2124969 Ack=37463635 Win=65535 Len=0
1,1.254167999999936,62.210.85.178,10.0.2.15,TCP,60,9001  >  35978 [ACK] Seq=2124969 Ack=37465095 Win=65535 Len=0
1,1.254173000000037,62.210.85.178,10.0.2.15,TCP,60,9001  >  35978 [ACK] Seq=2124969 Ack=37465151 Win=65535 Len=0
1,1.2633749999999964,10.0.2.15,62.210.85.178,TLSv1.2,4124,Application Data
1,1.2634550000000218,10.0.2.15,62.210.85.178,TCP,2974,35978  >  9001 [ACK] Seq=37469221 Ack=2124969 Win=65535 Len=2920 [TCP segment of a reassembled PDU]
1,1.2634909999999309,62.210.85.178,10.0.2.15,TCP,60,9001  >  35978 [ACK] Seq=2124969 Ack=37466611 Win=65535 Len=0
1,1.2634989999999107,62.210.85.178,10.0.2.15,TCP,60,9001  >  35978 [ACK] Seq=2124969 Ack=37468071 Win=65535 Len=0
1,1.2635029999999006,62.210.85.178,10.0.2.15,TCP,60,9001  >  35978 [ACK] Seq=2124969 Ack=37469221 Win=65535 Len=0
1,1.2635069999998905,62.210.85.178,10.0.2.15,TCP,60,9001  >  35978 [ACK] Seq=2124969 Ack=37470681 Win=65535 Len=0
1,1.2635109999998804,62.210.85.178,10.0.2.15,TCP,60,9001  >  35978 [ACK] Seq=2124969 Ack=37472141 Win=65535 Len=0
1,1.2635510000000068,10.0.2.15,62.210.85.178,TLSv1.2,1204,Application Data
1,1.2636239999999361,62.210.85.178,10.0.2.15,TCP,60,9001  >  35978 [ACK] Seq=2124969 Ack=37473291 Win=65535 Len=0
1,1.2637059999999565,10.0.2.15,62.210.85.178,TLSv1.2,4124,Application Data
1,1.2637500000000728,62.210.85.178,10.0.2.15,TCP,60,9001  >  35978 [ACK] Seq=2124969 Ack=37474751 Win=65535 Len=0
1,1.2637580000000526,62.210.85.178,10.0.2.15,TCP,60,9001  >  35978 [ACK] Seq=2124969 Ack=37476211 Win=65535 Len=0
1,1.2637620000000425,62.210.85.178,10.0.2.15,TCP,60,9001  >  35978 [ACK] Seq=2124969 Ack=37477361 Win=65535 Len=0
1,1.2638110000000324,10.0.2.15,62.210.85.178,TLSv1.2,4124,Application Data
1,1.2638549999999213,62.210.85.178,10.0.2.15,TCP,60,9001  >  35978 [ACK] Seq=2124969 Ack=37478821 Win=65535 Len=0
1,1.2638620000000174,62.210.85.178,10.0.2.15,TCP,60,9001  >  35978 [ACK] Seq=2124969 Ack=37480281 Win=65535 Len=0
1,1.2638660000000073,62.210.85.178,10.0.2.15,TCP,60,9001  >  35978 [ACK] Seq=2124969 Ack=37481431 Win=65535 Len=0
1,1.2639070000000174,10.0.2.15,62.210.85.178,TLSv1.2,332,Application Data
1,1.2639460000000327,62.210.85.178,10.0.2.15,TCP,60,9001  >  35978 [ACK] Seq=2124969 Ack=37481709 Win=65535 Len=0
1,1.2640030000000024,10.0.2.15,62.210.85.178,TLSv1.2,3868,Application Data
1,1.2640449999998964,62.210.85.178,10.0.2.15,TCP,60,9001  >  35978 [ACK] Seq=2124969 Ack=37483169 Win=65535 Len=0
1,1.2640519999999924,62.210.85.178,10.0.2.15,TCP,60,9001  >  35978 [ACK] Seq=2124969 Ack=37484629 Win=65535 Len=0
1,1.2640559999999823,62.210.85.178,10.0.2.15,TCP,60,9001  >  35978 [ACK] Seq=2124969 Ack=37485523 Win=65535 Len=0
1,1.2641020000000935,10.0.2.15,62.210.85.178,TLSv1.2,4124,Application Data
1,1.2641650000000482,10.0.2.15,62.210.85.178,TCP,2974,35978  >  9001 [ACK] Seq=37489593 Ack=2124969 Win=65535 Len=2920 [TCP segment of a reassembled PDU]
1,1.2642020000000684,62.210.85.178,10.0.2.15,TCP,60,9001  >  35978 [ACK] Seq=2124969 Ack=37486983 Win=65535 Len=0
1,1.264208999999937,62.210.85.178,10.0.2.15,TCP,60,9001  >  35978 [ACK] Seq=2124969 Ack=37488443 Win=65535 Len=0
1,1.2642140000000381,62.210.85.178,10.0.2.15,TCP,60,9001  >  35978 [ACK] Seq=2124969 Ack=37489593 Win=65535 Len=0
1,1.2642490000000635,10.0.2.15,62.210.85.178,TLSv1.2,110,Application Data
1,1.2642849999999726,62.210.85.178,10.0.2.15,TCP,60,9001  >  35978 [ACK] Seq=2124969 Ack=37491053 Win=65535 Len=0
1,1.2642920000000686,62.210.85.178,10.0.2.15,TCP,60,9001  >  35978 [ACK] Seq=2124969 Ack=37492513 Win=65535 Len=0
1,1.2642960000000585,62.210.85.178,10.0.2.15,TCP,60,9001  >  35978 [ACK] Seq=2124969 Ack=37492569 Win=65535 Len=0
1,1.2734889999999268,10.0.2.15,62.210.85.178,TLSv1.2,4124,Application Data
1,1.2735740000000533,10.0.2.15,62.210.85.178,TCP,2974,35978  >  9001 [ACK] Seq=37496639 Ack=2124969 Win=65535 Len=2920 [TCP segment of a reassembled PDU]
1,1.2736199999999371,62.210.85.178,10.0.2.15,TCP,60,9001  >  35978 [ACK] Seq=2124969 Ack=37494029 Win=65535 Len=0
1,1.273627999999917,62.210.85.178,10.0.2.15,TCP,60,9001  >  35978 [ACK] Seq=2124969 Ack=37495489 Win=65535 Len=0
1,1.2736319999999068,62.210.85.178,10.0.2.15,TCP,60,9001  >  35978 [ACK] Seq=2124969 Ack=37496639 Win=65535 Len=0
1,1.273637000000008,62.210.85.178,10.0.2.15,TCP,60,9001  >  35978 [ACK] Seq=2124969 Ack=37498099 Win=65535 Len=0
1,1.2736409999999978,62.210.85.178,10.0.2.15,TCP,60,9001  >  35978 [ACK] Seq=2124969 Ack=37499559 Win=65535 Len=0
1,1.2736809999998968,10.0.2.15,62.210.85.178,TLSv1.2,1204,Application Data
1,1.2737190000000282,62.210.85.178,10.0.2.15,TCP,60,9001  >  35978 [ACK] Seq=2124969 Ack=37500709 Win=65535 Len=0
1,1.2737660000000233,10.0.2.15,62.210.85.178,TLSv1.2,4124,Application Data
1,1.2738079999999172,62.210.85.178,10.0.2.15,TCP,60,9001  >  35978 [ACK] Seq=2124969 Ack=37502169 Win=65535 Len=0
1,1.2738150000000132,62.210.85.178,10.0.2.15,TCP,60,9001  >  35978 [ACK] Seq=2124969 Ack=37503629 Win=65535 Len=0
1,1.273819999999887,62.210.85.178,10.0.2.15,TCP,60,9001  >  35978 [ACK] Seq=2124969 Ack=37504779 Win=65535 Len=0
1,1.2738979999999174,10.0.2.15,62.210.85.178,TLSv1.2,3866,Application Data
1,1.2739930000000186,62.210.85.178,10.0.2.15,TCP,60,9001  >  35978 [ACK] Seq=2124969 Ack=37506239 Win=65535 Len=0
1,1.2740049999999883,62.210.85.178,10.0.2.15,TCP,60,9001  >  35978 [ACK] Seq=2124969 Ack=37507699 Win=65535 Len=0
1,1.2740100000000893,62.210.85.178,10.0.2.15,TCP,60,9001  >  35978 [ACK] Seq=2124969 Ack=37508591 Win=65535 Len=0
1,1.3762750000000779,54.93.77.70,10.0.2.15,TLSv1.2,3674,Application Data
1,1.3764109999999619,10.0.2.15,54.93.77.70,TCP,54,34692  >  9001 [ACK] Seq=2129515 Ack=37394193 Win=65535 Len=0
1,1.3786009999998896,54.93.77.70,10.0.2.15,TCP,2950,"9001  >  34692 [PSH, ACK] Seq=37394193 Ack=2129515 Win=65535 Len=2896 [TCP segment of a reassembled PDU]"
1,1.3786649999999554,10.0.2.15,54.93.77.70,TCP,54,34692  >  9001 [ACK] Seq=2129515 Ack=37397089 Win=65535 Len=0
1,1.3926770000000488,54.93.77.70,10.0.2.15,TLSv1.2,1314,"Application Data, Application Data"
1,1.3981289999999262,54.93.77.70,10.0.2.15,TLSv1.2,7294,Application Data
1,1.398253000000068,10.0.2.15,54.93.77.70,TCP,54,34692  >  9001 [ACK] Seq=2129515 Ack=37405589 Win=65535 Len=0
1,1.4067889999998897,54.93.77.70,10.0.2.15,TLSv1.2,4398,Application Data [TCP segment of a reassembled PDU]
1,1.4068399999998746,10.0.2.15,54.93.77.70,TCP,54,34692  >  9001 [ACK] Seq=2129515 Ack=37409933 Win=65535 Len=0
1,1.4147129999998924,54.93.77.70,10.0.2.15,TLSv1.2,380,"Application Data, Application Data"
1,1.424154999999928,54.93.77.70,10.0.2.15,TCP,2950,"9001  >  34692 [PSH, ACK] Seq=37410259 Ack=2129515 Win=65535 Len=2896 [TCP segment of a reassembled PDU]"
1,1.424209000000019,10.0.2.15,54.93.77.70,TCP,54,34692  >  9001 [ACK] Seq=2129515 Ack=37413155 Win=65535 Len=0
1,1.4246719999998732,54.93.77.70,10.0.2.15,TLSv1.2,4398,Application Data [TCP segment of a reassembled PDU]
1,1.424729999999954,10.0.2.15,54.93.77.70,TCP,54,34692  >  9001 [ACK] Seq=2129515 Ack=37417499 Win=65535 Len=0
1,1.424882000000025,10.0.2.15,54.93.77.70,TLSv1.2,590,Application Data
1,1.4249489999999696,54.93.77.70,10.0.2.15,TCP,60,9001  >  34692 [ACK] Seq=37417499 Ack=2130051 Win=65535 Len=0
1,1.4339809999999034,54.93.77.70,10.0.2.15,TLSv1.2,7294,"Application Data, Application Data, Application Data"
1,1.434054999999944,10.0.2.15,54.93.77.70,TCP,54,34692  >  9001 [ACK] Seq=2130051 Ack=37424739 Win=65535 Len=0
1,1.4340970000000652,54.93.77.70,10.0.2.15,TCP,1502,"9001  >  34692 [PSH, ACK] Seq=37424739 Ack=2130051 Win=65535 Len=1448 [TCP segment of a reassembled PDU]"
1,1.4342119999998886,10.0.2.15,54.93.77.70,TLSv1.2,590,Application Data
1,1.4342759999999544,54.93.77.70,10.0.2.15,TCP,60,9001  >  34692 [ACK] Seq=37426187 Ack=2130587 Win=65535 Len=0
1,1.4405340000000706,54.93.77.70,10.0.2.15,TLSv1.2,170,Application Data
1,1.4450070000000323,54.93.77.70,10.0.2.15,TCP,2950,"9001  >  34692 [PSH, ACK] Seq=37426303 Ack=2130587 Win=65535 Len=2896 [TCP segment of a reassembled PDU]"
1,1.445216999999957,10.0.2.15,54.93.77.70,TCP,54,34692  >  9001 [ACK] Seq=2130587 Ack=37429199 Win=65535 Len=0
1,1.4552490000000944,54.93.77.70,10.0.2.15,TLSv1.2,4398,"Application Data, Application Data"
1,1.4553809999999885,10.0.2.15,54.93.77.70,TCP,54,34692  >  9001 [ACK] Seq=2130587 Ack=37433543 Win=65535 Len=0
1,1.4555259999999635,54.93.77.70,10.0.2.15,TCP,2950,"9001  >  34692 [PSH, ACK] Seq=37433543 Ack=2130587 Win=65535 Len=2896 [TCP segment of a reassembled PDU]"
1,1.4555809999999383,10.0.2.15,54.93.77.70,TCP,54,34692  >  9001 [ACK] Seq=2130587 Ack=37436439 Win=65535 Len=0
1,1.462041999999883,54.93.77.70,10.0.2.15,TLSv1.2,778,Application Data
1,1.4682099999999991,54.93.77.70,10.0.2.15,TCP,1502,"9001  >  34692 [PSH, ACK] Seq=37437163 Ack=2130587 Win=65535 Len=1448 [TCP segment of a reassembled PDU]"
1,1.4682809999999336,10.0.2.15,54.93.77.70,TCP,54,34692  >  9001 [ACK] Seq=2130587 Ack=37438611 Win=65535 Len=0
1,1.4852169999999205,54.93.77.70,10.0.2.15,TLSv1.2,1198,Application Data
1,1.490927000000056,54.93.77.70,10.0.2.15,TCP,2950,"9001  >  34692 [PSH, ACK] Seq=37439755 Ack=2130587 Win=65535 Len=2896 [TCP segment of a reassembled PDU]"
1,1.4910899999999856,10.0.2.15,54.93.77.70,TCP,54,34692  >  9001 [ACK] Seq=2130587 Ack=37442651 Win=65535 Len=0
1,1.507327000000032,54.93.77.70,10.0.2.15,TLSv1.2,778,Application Data
1,1.5075070000000323,10.0.2.15,54.93.77.70,TLSv1.2,590,Application Data
1,1.5075999999999112,54.93.77.70,10.0.2.15,TCP,60,9001  >  34692 [ACK] Seq=37443375 Ack=2131123 Win=65535 Len=0
1,1.5142470000000685,54.93.77.70,10.0.2.15,TCP,2950,"9001  >  34692 [PSH, ACK] Seq=37443375 Ack=2131123 Win=65535 Len=2896 [TCP segment of a reassembled PDU]"
1,1.514316000000008,10.0.2.15,54.93.77.70,TCP,54,34692  >  9001 [ACK] Seq=2131123 Ack=37446271 Win=65535 Len=0
1,1.5249069999999847,54.93.77.70,10.0.2.15,TLSv1.2,778,Application Data
1,1.5249229999999443,54.93.77.70,10.0.2.15,TCP,2950,"9001  >  34692 [PSH, ACK] Seq=37446995 Ack=2131123 Win=65535 Len=2896 [TCP segment of a reassembled PDU]"
1,1.5249790000000303,10.0.2.15,54.93.77.70,TCP,54,34692  >  9001 [ACK] Seq=2131123 Ack=37449891 Win=65535 Len=0
1,1.5250670000000355,54.93.77.70,10.0.2.15,TLSv1.2,2950,Application Data [TCP segment of a reassembled PDU]
1,1.5251519999999346,10.0.2.15,54.93.77.70,TCP,54,34692  >  9001 [ACK] Seq=2131123 Ack=37452787 Win=65535 Len=0
1,1.5378639999998995,54.93.77.70,10.0.2.15,TLSv1.2,7294,"Application Data, Application Data"
1,1.5379189999998744,10.0.2.15,54.93.77.70,TCP,54,34692  >  9001 [ACK] Seq=2131123 Ack=37460027 Win=65535 Len=0
1,1.5410970000000361,54.93.77.70,10.0.2.15,TLSv1.2,988,Application Data
1,1.552169000000049,62.210.85.178,10.0.2.15,TLSv1.2,590,Application Data
1,1.5837380000000394,10.0.2.15,54.93.77.70,TCP,54,34692  >  9001 [ACK] Seq=2131123 Ack=37460961 Win=65535 Len=0
1,1.595702000000074,10.0.2.15,62.210.85.178,TCP,54,35978  >  9001 [ACK] Seq=37508591 Ack=2125505 Win=65535 Len=0
1,1.6122869999999239,54.93.77.70,10.0.2.15,TLSv1.2,1104,Application Data
1,1.6123029999998835,62.210.85.178,10.0.2.15,TLSv1.2,590,Application Data
1,1.6123419999998987,10.0.2.15,62.210.85.178,TCP,54,35978  >  9001 [ACK] Seq=37508591 Ack=2126041 Win=65535 Len=0
1,1.6124919999999747,10.0.2.15,54.93.77.70,TCP,54,34692  >  9001 [ACK] Seq=2131123 Ack=37462011 Win=65535 Len=0
1,1.6151529999999639,10.0.2.15,54.93.77.70,TLSv1.2,590,Application Data
1,1.6152999999999338,54.93.77.70,10.0.2.15,TCP,60,9001  >  34692 [ACK] Seq=37462011 Ack=2131659 Win=65535 Len=0
1,1.7326530000000275,62.210.85.178,10.0.2.15,TLSv1.2,1104,Application Data
1,1.732731000000058,10.0.2.15,62.210.85.178,TCP,54,35978  >  9001 [ACK] Seq=37508591 Ack=2127091 Win=65535 Len=0
1,1.7332519999999931,10.0.2.15,62.210.85.178,TLSv1.2,590,Application Data
1,1.733359000000064,62.210.85.178,10.0.2.15,TCP,60,9001  >  35978 [ACK] Seq=2127091 Ack=37509127 Win=65535 Len=0
1,2.561394000000064,54.93.77.70,10.0.2.15,TLSv1.2,590,Application Data
1,2.5617529999999533,10.0.2.15,54.93.77.70,TLSv1.2,590,Application Data
1,2.561866000000009,54.93.77.70,10.0.2.15,TCP,60,9001  >  34692 [ACK] Seq=37462547 Ack=2132195 Win=65535 Len=0
1,2.7662430000000313,62.210.85.178,10.0.2.15,TLSv1.2,590,Application Data
1,2.769414999999981,10.0.2.15,62.210.85.178,TLSv1.2,590,Application Data
1,2.769602999999961,62.210.85.178,10.0.2.15,TCP,60,9001  >  35978 [ACK] Seq=2127627 Ack=37509663 Win=65535 Len=0
1,2.780213999999887,10.0.2.15,62.210.85.178,TLSv1.2,4124,Application Data
1,2.780365999999958,62.210.85.178,10.0.2.15,TCP,60,9001  >  35978 [ACK] Seq=2127627 Ack=37511123 Win=65535 Len=0
1,2.780385000000024,62.210.85.178,10.0.2.15,TCP,60,9001  >  35978 [ACK] Seq=2127627 Ack=37512583 Win=65535 Len=0
1,2.7803879999999026,62.210.85.178,10.0.2.15,TCP,60,9001  >  35978 [ACK] Seq=2127627 Ack=37513733 Win=65535 Len=0
1,2.780422999999928,10.0.2.15,62.210.85.178,TLSv1.2,1168,Application Data
1,2.780483000000004,62.210.85.178,10.0.2.15,TCP,60,9001  >  35978 [ACK] Seq=2127627 Ack=37514847 Win=65535 Len=0
1,2.885665999999901,54.93.77.70,10.0.2.15,TLSv1.2,3674,Application Data
1,2.885780000000068,10.0.2.15,54.93.77.70,TCP,54,34692  >  9001 [ACK] Seq=2132195 Ack=37466167 Win=65535 Len=0
1,2.8859480000000985,10.0.2.15,54.93.77.70,TLSv1.2,590,Application Data
1,2.886019000000033,54.93.77.70,10.0.2.15,TCP,60,9001  >  34692 [ACK] Seq=37466167 Ack=2132731 Win=65535 Len=0
1,2.9314679999999953,54.93.77.70,10.0.2.15,TLSv1.2,590,Application Data
1,2.9571129999999357,54.93.77.70,10.0.2.15,TCP,1502,"9001  >  34692 [PSH, ACK] Seq=37466703 Ack=2132731 Win=65535 Len=1448 [TCP segment of a reassembled PDU]"
1,2.9572290000000976,10.0.2.15,54.93.77.70,TCP,54,34692  >  9001 [ACK] Seq=2132731 Ack=37468151 Win=65535 Len=0
1,2.973027000000002,54.93.77.70,10.0.2.15,TLSv1.2,170,Application Data
1,2.9752220000000307,10.0.2.15,54.93.77.70,TLSv1.2,590,Application Data
1,2.9753729999999905,54.93.77.70,10.0.2.15,TCP,60,9001  >  34692 [ACK] Seq=37468267 Ack=2133267 Win=65535 Len=0
1,3.011107999999922,62.210.85.178,10.0.2.15,TLSv1.2,590,Application Data
1,3.051727000000028,10.0.2.15,62.210.85.178,TCP,54,35978  >  9001 [ACK] Seq=37514847 Ack=2128163 Win=65535 Len=0
1,3.176134999999931,62.210.85.178,10.0.2.15,TLSv1.2,590,Application Data
1,3.1762249999999312,10.0.2.15,62.210.85.178,TCP,54,35978  >  9001 [ACK] Seq=37514847 Ack=2128699 Win=65535 Len=0
1,3.1767919999999776,10.0.2.15,62.210.85.178,TLSv1.2,590,Application Data
1,3.1769440000000486,62.210.85.178,10.0.2.15,TCP,60,9001  >  35978 [ACK] Seq=2128699 Ack=37515383 Win=65535 Len=0
1,3.7915680000000975,54.93.77.70,10.0.2.15,TLSv1.2,590,Application Data
1,3.7920070000000123,10.0.2.15,54.93.77.70,TLSv1.2,590,Application Data
1,3.7921469999998862,54.93.77.70,10.0.2.15,TCP,60,9001  >  34692 [ACK] Seq=37468803 Ack=2133803 Win=65535 Len=0
1,4.404747999999927,62.210.85.178,10.0.2.15,TLSv1.2,590,Application Data
1,4.409877000000051,10.0.2.15,62.210.85.178,TLSv1.2,590,Application Data
1,4.410041000000092,62.210.85.178,10.0.2.15,TCP,60,9001  >  35978 [ACK] Seq=2129235 Ack=37515919 Win=65535 Len=0
1,4.42465900000002,10.0.2.15,62.210.85.178,TLSv1.2,4124,Application Data
1,4.4247629999999845,10.0.2.15,62.210.85.178,TCP,2974,35978  >  9001 [ACK] Seq=37519989 Ack=2129235 Win=65535 Len=2920 [TCP segment of a reassembled PDU]
1,4.424811999999974,62.210.85.178,10.0.2.15,TCP,60,9001  >  35978 [ACK] Seq=2129235 Ack=37517379 Win=65535 Len=0
1,4.424821999999949,62.210.85.178,10.0.2.15,TCP,60,9001  >  35978 [ACK] Seq=2129235 Ack=37518839 Win=65535 Len=0
1,4.42482700000005,62.210.85.178,10.0.2.15,TCP,60,9001  >  35978 [ACK] Seq=2129235 Ack=37519989 Win=65535 Len=0
1,4.424831999999924,62.210.85.178,10.0.2.15,TCP,60,9001  >  35978 [ACK] Seq=2129235 Ack=37521449 Win=65535 Len=0
1,4.424837000000025,62.210.85.178,10.0.2.15,TCP,60,9001  >  35978 [ACK] Seq=2129235 Ack=37522909 Win=65535 Len=0
1,4.424880999999914,10.0.2.15,62.210.85.178,TLSv1.2,1204,Application Data
1,4.424950000000081,10.0.2.15,62.210.85.178,TCP,2974,35978  >  9001 [ACK] Seq=37524059 Ack=2129235 Win=65535 Len=2920 [TCP segment of a reassembled PDU]
1,4.424989000000096,62.210.85.178,10.0.2.15,TCP,60,9001  >  35978 [ACK] Seq=2129235 Ack=37524059 Win=65535 Len=0
1,4.424995999999965,62.210.85.178,10.0.2.15,TCP,60,9001  >  35978 [ACK] Seq=2129235 Ack=37525519 Win=65535 Len=0
1,4.425001000000066,62.210.85.178,10.0.2.15,TCP,60,9001  >  35978 [ACK] Seq=2129235 Ack=37526979 Win=65535 Len=0
1,4.42503499999998,10.0.2.15,62.210.85.178,TLSv1.2,1204,Application Data
1,4.425099999999929,10.0.2.15,62.210.85.178,TCP,2974,35978  >  9001 [ACK] Seq=37528129 Ack=2129235 Win=65535 Len=2920 [TCP segment of a reassembled PDU]
1,4.42513699999995,62.210.85.178,10.0.2.15,TCP,60,9001  >  35978 [ACK] Seq=2129235 Ack=37528129 Win=65535 Len=0
1,4.425144000000046,62.210.85.178,10.0.2.15,TCP,60,9001  >  35978 [ACK] Seq=2129235 Ack=37529589 Win=65535 Len=0
1,4.425148000000036,62.210.85.178,10.0.2.15,TCP,60,9001  >  35978 [ACK] Seq=2129235 Ack=37531049 Win=65535 Len=0
1,4.425179000000071,10.0.2.15,62.210.85.178,TLSv1.2,1204,Application Data
1,4.425257999999985,10.0.2.15,62.210.85.178,TLSv1.2,2974,Application Data
1,4.425297999999884,62.210.85.178,10.0.2.15,TCP,60,9001  >  35978 [ACK] Seq=2129235 Ack=37532199 Win=65535 Len=0
1,4.4253060000000914,62.210.85.178,10.0.2.15,TCP,60,9001  >  35978 [ACK] Seq=2129235 Ack=37533659 Win=65535 Len=0
1,4.425310000000081,62.210.85.178,10.0.2.15,TCP,60,9001  >  35978 [ACK] Seq=2129235 Ack=37535119 Win=65535 Len=0
1,4.4253439999999955,10.0.2.15,62.210.85.178,TLSv1.2,518,Application Data
1,4.4253819999999,62.210.85.178,10.0.2.15,TCP,60,9001  >  35978 [ACK] Seq=2129235 Ack=37535583 Win=65535 Len=0
1,4.5214169999999285,54.93.77.70,10.0.2.15,TLSv1.2,590,Application Data
1,4.528976000000057,54.93.77.70,10.0.2.15,TLSv1.2,7294,Application Data
1,4.5291460000000825,10.0.2.15,54.93.77.70,TCP,54,34692  >  9001 [ACK] Seq=2133803 Ack=37476579 Win=65535 Len=0
1,4.548197999999957,54.93.77.70,10.0.2.15,TLSv1.2,568,Application Data
1,4.5495710000000145,54.93.77.70,10.0.2.15,TCP,2950,"9001  >  34692 [PSH, ACK] Seq=37477093 Ack=2133803 Win=65535 Len=2896 [TCP segment of a reassembled PDU]"
1,4.549623999999994,10.0.2.15,54.93.77.70,TCP,54,34692  >  9001 [ACK] Seq=2133803 Ack=37479989 Win=65535 Len=0
1,4.56860800000004,54.93.77.70,10.0.2.15,TLSv1.2,1314,"Application Data, Application Data"
1,4.6117360000000645,10.0.2.15,54.93.77.70,TCP,54,34692  >  9001 [ACK] Seq=2133803 Ack=37481249 Win=65535 Len=0
1,4.626571999999896,54.93.77.70,10.0.2.15,TCP,2950,"9001  >  34692 [PSH, ACK] Seq=37481249 Ack=2133803 Win=65535 Len=2896 [TCP segment of a reassembled PDU]"
1,4.626649000000043,10.0.2.15,54.93.77.70,TCP,54,34692  >  9001 [ACK] Seq=2133803 Ack=37484145 Win=65535 Len=0
1,4.628108999999995,54.93.77.70,10.0.2.15,TLSv1.2,778,Application Data
1,4.628152999999884,10.0.2.15,54.93.77.70,TCP,54,34692  >  9001 [ACK] Seq=2133803 Ack=37484869 Win=65535 Len=0
1,4.6491799999998875,54.93.77.70,10.0.2.15,TLSv1.2,3674,Application Data
1,4.649251000000049,10.0.2.15,54.93.77.70,TCP,54,34692  >  9001 [ACK] Seq=2133803 Ack=37488489 Win=65535 Len=0
1,4.64964800000007,10.0.2.15,54.93.77.70,TLSv1.2,590,Application Data
1,4.6497770000000855,54.93.77.70,10.0.2.15,TCP,60,9001  >  34692 [ACK] Seq=37488489 Ack=2134339 Win=65535 Len=0
1,4.664301999999907,10.0.2.15,54.93.77.70,TLSv1.2,590,Application Data
1,4.6644699999999375,54.93.77.70,10.0.2.15,TCP,60,9001  >  34692 [ACK] Seq=37488489 Ack=2134875 Win=65535 Len=0
1,4.670998000000054,54.93.77.70,10.0.2.15,TLSv1.2,590,Application Data
1,4.711704999999938,10.0.2.15,54.93.77.70,TCP,54,34692  >  9001 [ACK] Seq=2134875 Ack=37489025 Win=65535 Len=0
1,4.767577000000074,62.210.85.178,10.0.2.15,TLSv1.2,590,Application Data
1,4.807763000000023,10.0.2.15,62.210.85.178,TCP,54,35978  >  9001 [ACK] Seq=37535583 Ack=2129771 Win=65535 Len=0
1,4.917991999999913,62.210.85.178,10.0.2.15,TLSv1.2,590,Application Data
1,4.918077000000039,10.0.2.15,62.210.85.178,TCP,54,35978  >  9001 [ACK] Seq=37535583 Ack=2130307 Win=65535 Len=0
1,4.91861700000004,10.0.2.15,62.210.85.178,TLSv1.2,590,Application Data
1,4.918752999999924,62.210.85.178,10.0.2.15,TCP,60,9001  >  35978 [ACK] Seq=2130307 Ack=37536119 Win=65535 Len=0
1,5.026640000000043,54.93.77.70,10.0.2.15,TLSv1.2,590,Application Data
1,5.026726000000053,10.0.2.15,54.93.77.70,TCP,54,34692  >  9001 [ACK] Seq=2134875 Ack=37489561 Win=65535 Len=0
1,5.027160000000094,10.0.2.15,54.93.77.70,TLSv1.2,590,Application Data
1,5.027282000000014,54.93.77.70,10.0.2.15,TCP,60,9001  >  34692 [ACK] Seq=37489561 Ack=2135411 Win=65535 Len=0
1,5.136482999999998,62.210.85.178,10.0.2.15,TLSv1.2,590,Application Data
1,5.1417639999999665,10.0.2.15,62.210.85.178,TLSv1.2,590,Application Data
1,5.141965999999911,62.210.85.178,10.0.2.15,TCP,60,9001  >  35978 [ACK] Seq=2130843 Ack=37536655 Win=65535 Len=0
1,5.152123000000074,10.0.2.15,62.210.85.178,TLSv1.2,4124,Application Data
1,5.152272999999923,62.210.85.178,10.0.2.15,TCP,60,9001  >  35978 [ACK] Seq=2130843 Ack=37538115 Win=65535 Len=0
1,5.1522930000001,62.210.85.178,10.0.2.15,TCP,60,9001  >  35978 [ACK] Seq=2130843 Ack=37539575 Win=65535 Len=0
1,5.15229700000009,62.210.85.178,10.0.2.15,TCP,60,9001  >  35978 [ACK] Seq=2130843 Ack=37540725 Win=65535 Len=0
1,5.152366000000029,10.0.2.15,62.210.85.178,TLSv1.2,4124,Application Data
1,5.152444999999943,62.210.85.178,10.0.2.15,TCP,60,9001  >  35978 [ACK] Seq=2130843 Ack=37542185 Win=65535 Len=0
1,5.152452999999923,62.210.85.178,10.0.2.15,TCP,60,9001  >  35978 [ACK] Seq=2130843 Ack=37543645 Win=65535 Len=0
1,5.152456000000029,62.210.85.178,10.0.2.15,TCP,60,9001  >  35978 [ACK] Seq=2130843 Ack=37544795 Win=65535 Len=0
1,5.152487999999948,10.0.2.15,62.210.85.178,TLSv1.2,4124,Application Data
1,5.15252600000008,62.210.85.178,10.0.2.15,TCP,60,9001  >  35978 [ACK] Seq=2130843 Ack=37546255 Win=65535 Len=0
1,5.1525349999999435,62.210.85.178,10.0.2.15,TCP,60,9001  >  35978 [ACK] Seq=2130843 Ack=37547715 Win=65535 Len=0
1,5.152538999999933,62.210.85.178,10.0.2.15,TCP,60,9001  >  35978 [ACK] Seq=2130843 Ack=37548865 Win=65535 Len=0
1,5.152577000000065,10.0.2.15,62.210.85.178,TLSv1.2,4124,Application Data
1,5.152614999999969,62.210.85.178,10.0.2.15,TCP,60,9001  >  35978 [ACK] Seq=2130843 Ack=37550325 Win=65535 Len=0
1,5.152622999999949,62.210.85.178,10.0.2.15,TCP,60,9001  >  35978 [ACK] Seq=2130843 Ack=37551785 Win=65535 Len=0
1,5.1526870000000145,10.0.2.15,62.210.85.178,TLSv1.2,2974,Application Data
1,5.152739999999994,62.210.85.178,10.0.2.15,TCP,60,9001  >  35978 [ACK] Seq=2130843 Ack=37552935 Win=65535 Len=0
1,5.1527790000000095,10.0.2.15,62.210.85.178,TLSv1.2,1226,Application Data
1,5.152816999999914,62.210.85.178,10.0.2.15,TCP,60,9001  >  35978 [ACK] Seq=2130843 Ack=37554395 Win=65535 Len=0
1,5.15282400000001,62.210.85.178,10.0.2.15,TCP,60,9001  >  35978 [ACK] Seq=2130843 Ack=37555855 Win=65535 Len=0
1,5.152826999999888,62.210.85.178,10.0.2.15,TCP,60,9001  >  35978 [ACK] Seq=2130843 Ack=37557027 Win=65535 Len=0
1,5.152863999999909,10.0.2.15,62.210.85.178,TLSv1.2,396,Application Data
1,5.152920999999878,62.210.85.178,10.0.2.15,TCP,60,9001  >  35978 [ACK] Seq=2130843 Ack=37557369 Win=65535 Len=0
1,5.2496779999999035,54.93.77.70,10.0.2.15,TCP,2950,"9001  >  34692 [PSH, ACK] Seq=37489561 Ack=2135411 Win=65535 Len=2896 [TCP segment of a reassembled PDU]"
1,5.249802000000045,10.0.2.15,54.93.77.70,TCP,54,34692  >  9001 [ACK] Seq=2135411 Ack=37492457 Win=65535 Len=0
1,5.249882999999954,54.93.77.70,10.0.2.15,TLSv1.2,778,Application Data
1,5.283294999999953,54.93.77.70,10.0.2.15,TLSv1.2,3674,Application Data
1,5.283384000000069,10.0.2.15,54.93.77.70,TCP,54,34692  >  9001 [ACK] Seq=2135411 Ack=37496801 Win=65535 Len=0
1,5.291559000000007,54.93.77.70,10.0.2.15,TCP,2950,"9001  >  34692 [PSH, ACK] Seq=37496801 Ack=2135411 Win=65535 Len=2896 [TCP segment of a reassembled PDU]"
1,5.291829999999891,10.0.2.15,54.93.77.70,TCP,54,34692  >  9001 [ACK] Seq=2135411 Ack=37499697 Win=65535 Len=0
1,5.302263000000039,54.93.77.70,10.0.2.15,TLSv1.2,1314,"Application Data, Application Data"
1,5.323358000000098,54.93.77.70,10.0.2.15,TLSv1.2,1104,Application Data
1,5.323411000000078,10.0.2.15,54.93.77.70,TCP,54,34692  >  9001 [ACK] Seq=2135411 Ack=37502007 Win=65535 Len=0
1,5.4103979999999865,54.93.77.70,10.0.2.15,TLSv1.2,3674,Application Data
1,5.410521000000017,10.0.2.15,54.93.77.70,TCP,54,34692  >  9001 [ACK] Seq=2135411 Ack=37505627 Win=65535 Len=0
1,5.434528,54.93.77.70,10.0.2.15,TLSv1.2,2646,Application Data
1,5.434577999999874,10.0.2.15,54.93.77.70,TCP,54,34692  >  9001 [ACK] Seq=2135411 Ack=37508219 Win=65535 Len=0
1,5.5188479999999345,54.93.77.70,10.0.2.15,TLSv1.2,1618,Application Data
1,5.51892399999997,10.0.2.15,54.93.77.70,TCP,54,34692  >  9001 [ACK] Seq=2135411 Ack=37509783 Win=65535 Len=0
1,5.940070999999989,54.93.77.70,10.0.2.15,TLSv1.2,1104,Application Data
1,5.942414999999983,10.0.2.15,54.93.77.70,TLSv1.2,590,Application Data
1,5.942571000000044,54.93.77.70,10.0.2.15,TCP,60,9001  >  34692 [ACK] Seq=37510833 Ack=2135947 Win=65535 Len=0
1,6.247278999999935,62.210.85.178,10.0.2.15,TLSv1.2,590,Application Data
1,6.247577000000092,10.0.2.15,62.210.85.178,TLSv1.2,590,Application Data
1,6.247699999999895,62.210.85.178,10.0.2.15,TCP,60,9001  >  35978 [ACK] Seq=2131379 Ack=37557905 Win=65535 Len=0
1,6.45359499999995,54.93.77.70,10.0.2.15,TLSv1.2,590,Application Data
1,6.454001000000062,10.0.2.15,54.93.77.70,TLSv1.2,590,Application Data
1,6.4541119999998955,54.93.77.70,10.0.2.15,TCP,60,9001  >  34692 [ACK] Seq=37511369 Ack=2136483 Win=65535 Len=0
1,6.656899000000067,62.210.85.178,10.0.2.15,TLSv1.2,590,Application Data
1,6.662432000000081,10.0.2.15,62.210.85.178,TLSv1.2,590,Application Data
1,6.6625850000000355,62.210.85.178,10.0.2.15,TCP,60,9001  >  35978 [ACK] Seq=2131915 Ack=37558441 Win=65535 Len=0
1,6.676050000000032,10.0.2.15,62.210.85.178,TLSv1.2,4124,Application Data
1,6.676167000000078,10.0.2.15,62.210.85.178,TCP,2974,35978  >  9001 [ACK] Seq=37562511 Ack=2131915 Win=65535 Len=2920 [TCP segment of a reassembled PDU]
1,6.676218000000063,62.210.85.178,10.0.2.15,TCP,60,9001  >  35978 [ACK] Seq=2131915 Ack=37559901 Win=65535 Len=0
1,6.676230999999916,62.210.85.178,10.0.2.15,TCP,60,9001  >  35978 [ACK] Seq=2131915 Ack=37561361 Win=65535 Len=0
1,6.676236000000017,62.210.85.178,10.0.2.15,TCP,60,9001  >  35978 [ACK] Seq=2131915 Ack=37562511 Win=65535 Len=0
1,6.676279999999906,10.0.2.15,62.210.85.178,TLSv1.2,1204,Application Data
1,6.676318999999921,62.210.85.178,10.0.2.15,TCP,60,9001  >  35978 [ACK] Seq=2131915 Ack=37563971 Win=65535 Len=0
1,6.676326000000017,62.210.85.178,10.0.2.15,TCP,60,9001  >  35978 [ACK] Seq=2131915 Ack=37565431 Win=65535 Len=0
1,6.676330000000007,62.210.85.178,10.0.2.15,TCP,60,9001  >  35978 [ACK] Seq=2131915 Ack=37566581 Win=65535 Len=0
1,6.676373999999896,10.0.2.15,62.210.85.178,TLSv1.2,4124,Application Data
1,6.676414999999906,62.210.85.178,10.0.2.15,TCP,60,9001  >  35978 [ACK] Seq=2131915 Ack=37568041 Win=65535 Len=0
1,6.676422999999886,62.210.85.178,10.0.2.15,TCP,60,9001  >  35978 [ACK] Seq=2131915 Ack=37569501 Win=65535 Len=0
1,6.676426999999876,62.210.85.178,10.0.2.15,TCP,60,9001  >  35978 [ACK] Seq=2131915 Ack=37570651 Win=65535 Len=0
1,6.676467999999886,10.0.2.15,62.210.85.178,TLSv1.2,4124,Application Data
1,6.676504999999906,62.210.85.178,10.0.2.15,TCP,60,9001  >  35978 [ACK] Seq=2131915 Ack=37572111 Win=65535 Len=0
1,6.676512999999886,62.210.85.178,10.0.2.15,TCP,60,9001  >  35978 [ACK] Seq=2131915 Ack=37573571 Win=65535 Len=0
1,6.676576999999952,10.0.2.15,62.210.85.178,TLSv1.2,2974,Application Data
1,6.676617000000078,62.210.85.178,10.0.2.15,TCP,60,9001  >  35978 [ACK] Seq=2131915 Ack=37574721 Win=65535 Len=0
1,6.676625000000058,62.210.85.178,10.0.2.15,TCP,60,9001  >  35978 [ACK] Seq=2131915 Ack=37576181 Win=65535 Len=0
1,6.676629999999932,62.210.85.178,10.0.2.15,TCP,60,9001  >  35978 [ACK] Seq=2131915 Ack=37577641 Win=65535 Len=0
1,6.676658000000089,10.0.2.15,62.210.85.178,TLSv1.2,1226,Application Data
1,6.676693999999998,62.210.85.178,10.0.2.15,TCP,60,9001  >  35978 [ACK] Seq=2131915 Ack=37578813 Win=65535 Len=0
1,6.676735999999892,10.0.2.15,62.210.85.178,TLSv1.2,4124,Application Data
1,6.676776000000018,62.210.85.178,10.0.2.15,TCP,60,9001  >  35978 [ACK] Seq=2131915 Ack=37580273 Win=65535 Len=0
1,6.676783999999998,62.210.85.178,10.0.2.15,TCP,60,9001  >  35978 [ACK] Seq=2131915 Ack=37581733 Win=65535 Len=0
1,6.676787999999988,62.210.85.178,10.0.2.15,TCP,60,9001  >  35978 [ACK] Seq=2131915 Ack=37582883 Win=65535 Len=0
1,6.676825000000008,10.0.2.15,62.210.85.178,TLSv1.2,3030,Application Data
1,6.676866000000018,62.210.85.178,10.0.2.15,TCP,60,9001  >  35978 [ACK] Seq=2131915 Ack=37584343 Win=65535 Len=0
1,6.676872999999887,62.210.85.178,10.0.2.15,TCP,60,9001  >  35978 [ACK] Seq=2131915 Ack=37585803 Win=65535 Len=0
1,6.676876999999877,62.210.85.178,10.0.2.15,TCP,60,9001  >  35978 [ACK] Seq=2131915 Ack=37585859 Win=65535 Len=0
1,6.688378000000057,10.0.2.15,62.210.85.178,TLSv1.2,4124,Application Data
1,6.688501999999971,62.210.85.178,10.0.2.15,TCP,60,9001  >  35978 [ACK] Seq=2131915 Ack=37587319 Win=65535 Len=0
1,6.688548999999966,62.210.85.178,10.0.2.15,TCP,60,9001  >  35978 [ACK] Seq=2131915 Ack=37588779 Win=65535 Len=0
1,6.688556000000062,62.210.85.178,10.0.2.15,TCP,60,9001  >  35978 [ACK] Seq=2131915 Ack=37589929 Win=65535 Len=0
1,6.688746999999921,10.0.2.15,62.210.85.178,TLSv1.2,4124,Application Data
1,6.688975999999911,10.0.2.15,62.210.85.178,TCP,2974,35978  >  9001 [ACK] Seq=37593999 Ack=2131915 Win=65535 Len=2920 [TCP segment of a reassembled PDU]
1,6.689071999999896,62.210.85.178,10.0.2.15,TCP,60,9001  >  35978 [ACK] Seq=2131915 Ack=37591389 Win=65535 Len=0
1,6.689098000000058,62.210.85.178,10.0.2.15,TCP,60,9001  >  35978 [ACK] Seq=2131915 Ack=37592849 Win=65535 Len=0
1,6.689104000000043,62.210.85.178,10.0.2.15,TCP,60,9001  >  35978 [ACK] Seq=2131915 Ack=37593999 Win=65535 Len=0
1,6.689174000000094,10.0.2.15,62.210.85.178,TLSv1.2,1204,Application Data
1,6.689237000000048,62.210.85.178,10.0.2.15,TCP,60,9001  >  35978 [ACK] Seq=2131915 Ack=37595459 Win=65535 Len=0
1,6.689247999999907,62.210.85.178,10.0.2.15,TCP,60,9001  >  35978 [ACK] Seq=2131915 Ack=37596919 Win=65535 Len=0
1,6.689256999999998,62.210.85.178,10.0.2.15,TCP,60,9001  >  35978 [ACK] Seq=2131915 Ack=37598069 Win=65535 Len=0
1,6.689345999999887,10.0.2.15,62.210.85.178,TLSv1.2,4124,Application Data
1,6.689489999999978,62.210.85.178,10.0.2.15,TCP,60,9001  >  35978 [ACK] Seq=2131915 Ack=37599529 Win=65535 Len=0
1,6.689505000000054,62.210.85.178,10.0.2.15,TCP,60,9001  >  35978 [ACK] Seq=2131915 Ack=37600989 Win=65535 Len=0
1,6.6895079999999325,62.210.85.178,10.0.2.15,TCP,60,9001  >  35978 [ACK] Seq=2131915 Ack=37602139 Win=65535 Len=0
1,6.689589000000069,10.0.2.15,62.210.85.178,TLSv1.2,332,Application Data
1,6.689640000000054,62.210.85.178,10.0.2.15,TCP,60,9001  >  35978 [ACK] Seq=2131915 Ack=37602417 Win=65535 Len=0
1,6.689751999999999,10.0.2.15,62.210.85.178,TLSv1.2,3868,Application Data
1,6.689798999999994,62.210.85.178,10.0.2.15,TCP,60,9001  >  35978 [ACK] Seq=2131915 Ack=37603877 Win=65535 Len=0
1,6.6898100000000795,62.210.85.178,10.0.2.15,TCP,60,9001  >  35978 [ACK] Seq=2131915 Ack=37605337 Win=65535 Len=0
1,6.689814999999953,62.210.85.178,10.0.2.15,TCP,60,9001  >  35978 [ACK] Seq=2131915 Ack=37606231 Win=65535 Len=0
1,6.689894999999979,10.0.2.15,62.210.85.178,TLSv1.2,4124,Application Data
1,6.689932999999883,62.210.85.178,10.0.2.15,TCP,60,9001  >  35978 [ACK] Seq=2131915 Ack=37607691 Win=65535 Len=0
1,6.689943000000085,62.210.85.178,10.0.2.15,TCP,60,9001  >  35978 [ACK] Seq=2131915 Ack=37609151 Win=65535 Len=0
1,6.68994900000007,62.210.85.178,10.0.2.15,TCP,60,9001  >  35978 [ACK] Seq=2131915 Ack=37610301 Win=65535 Len=0
1,6.689992999999959,10.0.2.15,62.210.85.178,TLSv1.2,3030,Application Data
1,6.690067999999883,62.210.85.178,10.0.2.15,TCP,60,9001  >  35978 [ACK] Seq=2131915 Ack=37611761 Win=65535 Len=0
1,6.690078999999969,62.210.85.178,10.0.2.15,TCP,60,9001  >  35978 [ACK] Seq=2131915 Ack=37613221 Win=65535 Len=0
1,6.690082000000075,62.210.85.178,10.0.2.15,TCP,60,9001  >  35978 [ACK] Seq=2131915 Ack=37613277 Win=65535 Len=0
1,6.699382999999898,10.0.2.15,62.210.85.178,TLSv1.2,4124,Application Data
1,6.6995039999999335,62.210.85.178,10.0.2.15,TCP,60,9001  >  35978 [ACK] Seq=2131915 Ack=37614737 Win=65535 Len=0
1,6.699521000000004,62.210.85.178,10.0.2.15,TCP,60,9001  >  35978 [ACK] Seq=2131915 Ack=37616197 Win=65535 Len=0
1,6.699523999999883,62.210.85.178,10.0.2.15,TCP,60,9001  >  35978 [ACK] Seq=2131915 Ack=37617347 Win=65535 Len=0
1,6.699567999999999,10.0.2.15,62.210.85.178,TLSv1.2,654,Application Data
1,6.699611999999888,62.210.85.178,10.0.2.15,TCP,60,9001  >  35978 [ACK] Seq=2131915 Ack=37617947 Win=65535 Len=0
1,6.768051000000014,54.93.77.70,10.0.2.15,TLSv1.2,590,Application Data
1,6.7917620000000625,54.93.77.70,10.0.2.15,TLSv1.2,3674,Application Data
1,6.791874000000007,10.0.2.15,54.93.77.70,TCP,54,34692  >  9001 [ACK] Seq=2136483 Ack=37515525 Win=65535 Len=0
1,6.799809000000096,54.93.77.70,10.0.2.15,TCP,2950,"9001  >  34692 [PSH, ACK] Seq=37515525 Ack=2136483 Win=65535 Len=2896 [TCP segment of a reassembled PDU]"
1,6.799854000000096,10.0.2.15,54.93.77.70,TCP,54,34692  >  9001 [ACK] Seq=2136483 Ack=37518421 Win=65535 Len=0
1,6.813940000000002,54.93.77.70,10.0.2.15,TLSv1.2,1314,"Application Data, Application Data"
1,6.8331040000000485,54.93.77.70,10.0.2.15,TLSv1.2,3674,Application Data
1,6.833161000000018,10.0.2.15,54.93.77.70,TCP,54,34692  >  9001 [ACK] Seq=2136483 Ack=37523301 Win=65535 Len=0
1,6.833337000000029,10.0.2.15,54.93.77.70,TLSv1.2,590,Application Data
1,6.833433000000014,54.93.77.70,10.0.2.15,TCP,60,9001  >  34692 [ACK] Seq=37523301 Ack=2137019 Win=65535 Len=0
1,6.841846999999916,54.93.77.70,10.0.2.15,TCP,2950,"9001  >  34692 [PSH, ACK] Seq=37523301 Ack=2137019 Win=65535 Len=2896 [TCP segment of a reassembled PDU]"
1,6.841930000000048,10.0.2.15,54.93.77.70,TCP,54,34692  >  9001 [ACK] Seq=2137019 Ack=37526197 Win=65535 Len=0
1,6.849161000000095,54.93.77.70,10.0.2.15,TLSv1.2,1314,"Application Data, Application Data"
1,6.8638180000000375,54.93.77.70,10.0.2.15,TCP,2950,"9001  >  34692 [PSH, ACK] Seq=37527457 Ack=2137019 Win=65535 Len=2896 [TCP segment of a reassembled PDU]"
1,6.863869000000022,10.0.2.15,54.93.77.70,TCP,54,34692  >  9001 [ACK] Seq=2137019 Ack=37530353 Win=65535 Len=0
1,6.865207000000055,54.93.77.70,10.0.2.15,TLSv1.2,778,Application Data
1,6.872538000000077,54.93.77.70,10.0.2.15,TLSv1.2,5846,Application Data
1,6.87261599999988,10.0.2.15,54.93.77.70,TCP,54,34692  >  9001 [ACK] Seq=2137019 Ack=37536869 Win=65535 Len=0
1,6.8728490000000875,54.93.77.70,10.0.2.15,TCP,1502,"9001  >  34692 [PSH, ACK] Seq=37536869 Ack=2137019 Win=65535 Len=1448 [TCP segment of a reassembled PDU]"
1,6.8728869999999915,10.0.2.15,54.93.77.70,TCP,54,34692  >  9001 [ACK] Seq=2137019 Ack=37538317 Win=65535 Len=0
1,6.880965999999944,54.93.77.70,10.0.2.15,TLSv1.2,1104,"Application Data, Application Data"
1,6.88114900000005,10.0.2.15,54.93.77.70,TLSv1.2,590,Application Data
1,6.88122599999997,54.93.77.70,10.0.2.15,TCP,60,9001  >  34692 [ACK] Seq=37539367 Ack=2137555 Win=65535 Len=0
1,6.882560999999896,54.93.77.70,10.0.2.15,TCP,2950,"9001  >  34692 [PSH, ACK] Seq=37539367 Ack=2137555 Win=65535 Len=2896 [TCP segment of a reassembled PDU]"
1,6.882632000000058,10.0.2.15,54.93.77.70,TCP,54,34692  >  9001 [ACK] Seq=2137555 Ack=37542263 Win=65535 Len=0
1,6.892857999999933,54.93.77.70,10.0.2.15,TLSv1.2,4398,"Application Data, Application Data"
1,6.89293100000009,10.0.2.15,54.93.77.70,TCP,54,34692  >  9001 [ACK] Seq=2137555 Ack=37546607 Win=65535 Len=0
1,6.893452999999909,54.93.77.70,10.0.2.15,TLSv1.2,4398,Application Data [TCP segment of a reassembled PDU]
1,6.893497999999909,10.0.2.15,54.93.77.70,TCP,54,34692  >  9001 [ACK] Seq=2137555 Ack=37550951 Win=65535 Len=0
1,6.8974000000000615,54.93.77.70,10.0.2.15,TLSv1.2,380,Application Data
1,6.904633999999987,54.93.77.70,10.0.2.15,TLSv1.2,4398,Application Data
1,6.904676999999992,10.0.2.15,54.93.77.70,TCP,54,34692  >  9001 [ACK] Seq=2137555 Ack=37555621 Win=65535 Len=0
1,6.921374999999898,54.93.77.70,10.0.2.15,TLSv1.2,380,Application Data
1,6.963747000000012,10.0.2.15,54.93.77.70,TCP,54,34692  >  9001 [ACK] Seq=2137555 Ack=37555947 Win=65535 Len=0
1,6.969929000000093,54.93.77.70,10.0.2.15,TLSv1.2,7294,"Application Data, Application Data"
1,6.970000000000027,10.0.2.15,54.93.77.70,TCP,54,34692  >  9001 [ACK] Seq=2137555 Ack=37563187 Win=65535 Len=0
1,6.979364000000032,54.93.77.70,10.0.2.15,TLSv1.2,1104,Application Data
1,6.979428000000098,10.0.2.15,54.93.77.70,TCP,54,34692  >  9001 [ACK] Seq=2137555 Ack=37564237 Win=65535 Len=0
1,6.979612000000088,10.0.2.15,54.93.77.70,TLSv1.2,590,Application Data
1,6.979792999999972,54.93.77.70,10.0.2.15,TCP,60,9001  >  34692 [ACK] Seq=37564237 Ack=2138091 Win=65535 Len=0
1,6.988540999999941,54.93.77.70,10.0.2.15,TCP,2950,"9001  >  34692 [PSH, ACK] Seq=37564237 Ack=2138091 Win=65535 Len=2896 [TCP segment of a reassembled PDU]"
1,6.988667000000078,10.0.2.15,54.93.77.70,TCP,54,34692  >  9001 [ACK] Seq=2138091 Ack=37567133 Win=65535 Len=0
1,6.99618200000009,54.93.77.70,10.0.2.15,TLSv1.2,778,Application Data
1,7.000046999999995,54.93.77.70,10.0.2.15,TCP,2950,"9001  >  34692 [PSH, ACK] Seq=37567857 Ack=2138091 Win=65535 Len=2896 [TCP segment of a reassembled PDU]"
1,7.000094999999874,10.0.2.15,54.93.77.70,TCP,54,34692  >  9001 [ACK] Seq=2138091 Ack=37570753 Win=65535 Len=0
1,7.0007550000000265,62.210.85.178,10.0.2.15,TLSv1.2,590,Application Data
1,7.01233400000001,54.93.77.70,10.0.2.15,TLSv1.2,778,Application Data
