No.,Time,Source,Destination,Protocol,Length,Info
1,0.016740999999910855,10.0.2.15,54.93.77.70,TCP,54,34692  >  9001 [ACK] Seq=2462409 Ack=43245693 Win=65535 Len=0
1,0.052852000000029875,62.210.85.178,10.0.2.15,TLSv1.2,590,Application Data
1,0.09773300000006202,10.0.2.15,62.210.85.178,TCP,54,35978  >  9001 [ACK] Seq=43290733 Ack=2456095 Win=65535 Len=0
1,0.1544139999998606,10.0.2.15,54.93.77.70,TLSv1.2,590,Application Data
1,0.15457199999991644,54.93.77.70,10.0.2.15,TCP,60,9001  >  34692 [ACK] Seq=43245693 Ack=2462945 Win=65535 Len=0
1,0.15599999999994907,62.210.85.178,10.0.2.15,TLSv1.2,590,Application Data
1,0.1560549999999239,10.0.2.15,62.210.85.178,TCP,54,35978  >  9001 [ACK] Seq=43290733 Ack=2456631 Win=65535 Len=0
1,0.26059399999985544,62.210.85.178,10.0.2.15,TLSv1.2,590,Application Data
1,0.2606799999998657,10.0.2.15,62.210.85.178,TCP,54,35978  >  9001 [ACK] Seq=43290733 Ack=2457167 Win=65535 Len=0
1,0.2609749999999167,10.0.2.15,62.210.85.178,TLSv1.2,590,Application Data
1,0.26106400000003305,62.210.85.178,10.0.2.15,TCP,60,9001  >  35978 [ACK] Seq=2457167 Ack=43291269 Win=65535 Len=0
1,0.36270700000000033,54.93.77.70,10.0.2.15,TLSv1.2,590,Application Data
1,0.3627930000000106,10.0.2.15,54.93.77.70,TCP,54,34692  >  9001 [ACK] Seq=2462945 Ack=43246229 Win=65535 Len=0
1,0.36316899999997077,10.0.2.15,54.93.77.70,TLSv1.2,1618,Application Data
1,0.3632800000000316,54.93.77.70,10.0.2.15,TCP,60,9001  >  34692 [ACK] Seq=43246229 Ack=2464405 Win=65535 Len=0
1,0.3632909999998901,54.93.77.70,10.0.2.15,TCP,60,9001  >  34692 [ACK] Seq=43246229 Ack=2464509 Win=65535 Len=0
1,0.6214230000000498,62.210.85.178,10.0.2.15,TLSv1.2,1618,Application Data
1,0.62155800000005,10.0.2.15,62.210.85.178,TCP,54,35978  >  9001 [ACK] Seq=43291269 Ack=2458731 Win=65535 Len=0
1,0.6217360000000554,10.0.2.15,62.210.85.178,TLSv1.2,590,Application Data
1,0.6218109999999797,62.210.85.178,10.0.2.15,TCP,60,9001  >  35978 [ACK] Seq=2458731 Ack=43291805 Win=65535 Len=0
1,0.6355869999999868,10.0.2.15,62.210.85.178,TLSv1.2,590,Application Data
1,0.6357579999998961,62.210.85.178,10.0.2.15,TCP,60,9001  >  35978 [ACK] Seq=2458731 Ack=43292341 Win=65535 Len=0
1,0.6486110000000735,10.0.2.15,62.210.85.178,TLSv1.2,1618,Application Data
1,0.6487449999999626,62.210.85.178,10.0.2.15,TCP,60,9001  >  35978 [ACK] Seq=2458731 Ack=43293801 Win=65535 Len=0
1,0.6487620000000334,62.210.85.178,10.0.2.15,TCP,60,9001  >  35978 [ACK] Seq=2458731 Ack=43293905 Win=65535 Len=0
1,0.7212199999999029,54.93.77.70,10.0.2.15,TLSv1.2,590,Application Data
1,0.7646319999998923,10.0.2.15,54.93.77.70,TCP,54,34692  >  9001 [ACK] Seq=2464509 Ack=43246765 Win=65535 Len=0
1,0.7937039999999342,54.93.77.70,10.0.2.15,TLSv1.2,2132,Application Data
1,0.7937540000000354,10.0.2.15,54.93.77.70,TCP,54,34692  >  9001 [ACK] Seq=2464509 Ack=43248843 Win=65535 Len=0
1,0.7958059999998568,10.0.2.15,54.93.77.70,TLSv1.2,590,Application Data
1,0.7959670000000187,54.93.77.70,10.0.2.15,TCP,60,9001  >  34692 [ACK] Seq=43248843 Ack=2465045 Win=65535 Len=0
1,0.9083049999999275,62.210.85.178,10.0.2.15,TLSv1.2,590,Application Data
1,0.9086150000000544,10.0.2.15,62.210.85.178,TLSv1.2,590,Application Data
1,0.9090289999999186,62.210.85.178,10.0.2.15,TCP,60,9001  >  35978 [ACK] Seq=2459267 Ack=43294441 Win=65535 Len=0
1,1.0192329999999856,54.93.77.70,10.0.2.15,TLSv1.2,590,Application Data
1,1.0196359999999913,10.0.2.15,54.93.77.70,TLSv1.2,590,Application Data
1,1.0197339999999713,54.93.77.70,10.0.2.15,TCP,60,9001  >  34692 [ACK] Seq=43249379 Ack=2465581 Win=65535 Len=0
1,1.1332720000000336,62.210.85.178,10.0.2.15,TLSv1.2,590,Application Data
1,1.1386539999998604,10.0.2.15,62.210.85.178,TLSv1.2,590,Application Data
1,1.1388349999999718,62.210.85.178,10.0.2.15,TCP,60,9001  >  35978 [ACK] Seq=2459803 Ack=43294977 Win=65535 Len=0
1,1.149103999999852,10.0.2.15,62.210.85.178,TLSv1.2,4124,Application Data
1,1.1492699999998877,10.0.2.15,62.210.85.178,TCP,2974,35978  >  9001 [ACK] Seq=43299047 Ack=2459803 Win=65535 Len=2920 [TCP segment of a reassembled PDU]
1,1.1493319999999585,62.210.85.178,10.0.2.15,TCP,60,9001  >  35978 [ACK] Seq=2459803 Ack=43296437 Win=65535 Len=0
1,1.1493450000000394,62.210.85.178,10.0.2.15,TCP,60,9001  >  35978 [ACK] Seq=2459803 Ack=43297897 Win=65535 Len=0
1,1.149349999999913,62.210.85.178,10.0.2.15,TCP,60,9001  >  35978 [ACK] Seq=2459803 Ack=43299047 Win=65535 Len=0
1,1.149353999999903,62.210.85.178,10.0.2.15,TCP,60,9001  >  35978 [ACK] Seq=2459803 Ack=43300507 Win=65535 Len=0
1,1.1493579999998929,62.210.85.178,10.0.2.15,TCP,60,9001  >  35978 [ACK] Seq=2459803 Ack=43301967 Win=65535 Len=0
1,1.1494069999998828,10.0.2.15,62.210.85.178,TLSv1.2,1204,Application Data
1,1.149449999999888,62.210.85.178,10.0.2.15,TCP,60,9001  >  35978 [ACK] Seq=2459803 Ack=43303117 Win=65535 Len=0
1,1.1495049999998628,10.0.2.15,62.210.85.178,TLSv1.2,4124,Application Data
1,1.149547999999868,62.210.85.178,10.0.2.15,TCP,60,9001  >  35978 [ACK] Seq=2459803 Ack=43304577 Win=65535 Len=0
1,1.149554999999964,62.210.85.178,10.0.2.15,TCP,60,9001  >  35978 [ACK] Seq=2459803 Ack=43306037 Win=65535 Len=0
1,1.149560000000065,62.210.85.178,10.0.2.15,TCP,60,9001  >  35978 [ACK] Seq=2459803 Ack=43307187 Win=65535 Len=0
1,1.1496079999999438,10.0.2.15,62.210.85.178,TLSv1.2,4124,Application Data
1,1.149690999999848,10.0.2.15,62.210.85.178,TLSv1.2,2974,Application Data
1,1.1497859999999491,62.210.85.178,10.0.2.15,TCP,60,9001  >  35978 [ACK] Seq=2459803 Ack=43308647 Win=65535 Len=0
1,1.149793999999929,62.210.85.178,10.0.2.15,TCP,60,9001  >  35978 [ACK] Seq=2459803 Ack=43310107 Win=65535 Len=0
1,1.1497979999999188,62.210.85.178,10.0.2.15,TCP,60,9001  >  35978 [ACK] Seq=2459803 Ack=43311257 Win=65535 Len=0
1,1.1498019999999087,62.210.85.178,10.0.2.15,TCP,60,9001  >  35978 [ACK] Seq=2459803 Ack=43312717 Win=65535 Len=0
1,1.1498070000000098,62.210.85.178,10.0.2.15,TCP,60,9001  >  35978 [ACK] Seq=2459803 Ack=43314177 Win=65535 Len=0
1,1.1498469999999088,10.0.2.15,62.210.85.178,TLSv1.2,518,Application Data
1,1.149885999999924,62.210.85.178,10.0.2.15,TCP,60,9001  >  35978 [ACK] Seq=2459803 Ack=43314641 Win=65535 Len=0
1,1.268336999999974,54.93.77.70,10.0.2.15,TLSv1.2,590,Application Data
1,1.2775449999999182,54.93.77.70,10.0.2.15,TLSv1.2,5846,Application Data
1,1.2776340000000346,10.0.2.15,54.93.77.70,TCP,54,34692  >  9001 [ACK] Seq=2465581 Ack=43255707 Win=65535 Len=0
1,1.2782749999998941,54.93.77.70,10.0.2.15,TLSv1.2,7294,"Application Data, Application Data"
1,1.2783339999998589,10.0.2.15,54.93.77.70,TCP,54,34692  >  9001 [ACK] Seq=2465581 Ack=43262947 Win=65535 Len=0
1,1.284889000000021,54.93.77.70,10.0.2.15,TLSv1.2,2530,Application Data
1,1.2849509999998645,10.0.2.15,54.93.77.70,TCP,54,34692  >  9001 [ACK] Seq=2465581 Ack=43265423 Win=65535 Len=0
1,1.309385999999904,54.93.77.70,10.0.2.15,TLSv1.2,3674,Application Data
1,1.3094619999999395,10.0.2.15,54.93.77.70,TCP,54,34692  >  9001 [ACK] Seq=2465581 Ack=43269043 Win=65535 Len=0
1,1.3098559999998542,10.0.2.15,54.93.77.70,TLSv1.2,590,Application Data
1,1.3108729999999014,54.93.77.70,10.0.2.15,TCP,60,9001  >  34692 [ACK] Seq=43269043 Ack=2466117 Win=65535 Len=0
1,1.3187350000000606,10.0.2.15,54.93.77.70,TLSv1.2,590,Application Data
1,1.3188889999998992,54.93.77.70,10.0.2.15,TCP,60,9001  >  34692 [ACK] Seq=43269043 Ack=2466653 Win=65535 Len=0
1,1.3892869999999675,54.93.77.70,10.0.2.15,TLSv1.2,590,Application Data
1,1.4327880000000732,10.0.2.15,54.93.77.70,TCP,54,34692  >  9001 [ACK] Seq=2466653 Ack=43269579 Win=65535 Len=0
1,1.4468839999999545,62.210.85.178,10.0.2.15,TLSv1.2,590,Application Data
1,1.488601000000017,10.0.2.15,62.210.85.178,TCP,54,35978  >  9001 [ACK] Seq=43314641 Ack=2460339 Win=65535 Len=0
1,1.5404320000000098,62.210.85.178,10.0.2.15,TLSv1.2,590,Application Data
1,1.540520000000015,10.0.2.15,62.210.85.178,TCP,54,35978  >  9001 [ACK] Seq=43314641 Ack=2460875 Win=65535 Len=0
1,1.5411070000000109,10.0.2.15,62.210.85.178,TLSv1.2,590,Application Data
1,1.5412559999999758,62.210.85.178,10.0.2.15,TCP,60,9001  >  35978 [ACK] Seq=2460875 Ack=43315177 Win=65535 Len=0
1,1.638398000000052,54.93.77.70,10.0.2.15,TLSv1.2,590,Application Data
1,1.6384860000000572,10.0.2.15,54.93.77.70,TCP,54,34692  >  9001 [ACK] Seq=2466653 Ack=43270115 Win=65535 Len=0
1,1.6389239999998608,10.0.2.15,54.93.77.70,TLSv1.2,590,Application Data
1,1.6390599999999722,54.93.77.70,10.0.2.15,TCP,60,9001  >  34692 [ACK] Seq=43270115 Ack=2467189 Win=65535 Len=0
1,1.7501119999999446,62.210.85.178,10.0.2.15,TLSv1.2,590,Application Data
1,1.7568180000000666,10.0.2.15,62.210.85.178,TLSv1.2,590,Application Data
1,1.7575919999999314,62.210.85.178,10.0.2.15,TCP,60,9001  >  35978 [ACK] Seq=2461411 Ack=43315713 Win=65535 Len=0
1,1.7694159999998647,10.0.2.15,62.210.85.178,TLSv1.2,4124,Application Data
1,1.7695300000000316,10.0.2.15,62.210.85.178,TCP,2974,35978  >  9001 [ACK] Seq=43319783 Ack=2461411 Win=65535 Len=2920 [TCP segment of a reassembled PDU]
1,1.7695759999999154,62.210.85.178,10.0.2.15,TCP,60,9001  >  35978 [ACK] Seq=2461411 Ack=43317173 Win=65535 Len=0
1,1.7695870000000014,62.210.85.178,10.0.2.15,TCP,60,9001  >  35978 [ACK] Seq=2461411 Ack=43318633 Win=65535 Len=0
1,1.769591999999875,62.210.85.178,10.0.2.15,TCP,60,9001  >  35978 [ACK] Seq=2461411 Ack=43319783 Win=65535 Len=0
1,1.769595999999865,62.210.85.178,10.0.2.15,TCP,60,9001  >  35978 [ACK] Seq=2461411 Ack=43321243 Win=65535 Len=0
1,1.769600999999966,62.210.85.178,10.0.2.15,TCP,60,9001  >  35978 [ACK] Seq=2461411 Ack=43322703 Win=65535 Len=0
1,1.7696490000000722,10.0.2.15,62.210.85.178,TLSv1.2,1204,Application Data
1,1.7697180000000117,10.0.2.15,62.210.85.178,TCP,2974,35978  >  9001 [ACK] Seq=43323853 Ack=2461411 Win=65535 Len=2920 [TCP segment of a reassembled PDU]
1,1.769755000000032,62.210.85.178,10.0.2.15,TCP,60,9001  >  35978 [ACK] Seq=2461411 Ack=43323853 Win=65535 Len=0
1,1.7697619999999006,62.210.85.178,10.0.2.15,TCP,60,9001  >  35978 [ACK] Seq=2461411 Ack=43325313 Win=65535 Len=0
1,1.7697659999998905,62.210.85.178,10.0.2.15,TCP,60,9001  >  35978 [ACK] Seq=2461411 Ack=43326773 Win=65535 Len=0
1,1.7698009999999158,10.0.2.15,62.210.85.178,TLSv1.2,1204,Application Data
1,1.7698659999998654,10.0.2.15,62.210.85.178,TCP,2974,35978  >  9001 [ACK] Seq=43327923 Ack=2461411 Win=65535 Len=2920 [TCP segment of a reassembled PDU]
1,1.7699049999998806,62.210.85.178,10.0.2.15,TCP,60,9001  >  35978 [ACK] Seq=2461411 Ack=43327923 Win=65535 Len=0
1,1.7699109999998655,62.210.85.178,10.0.2.15,TCP,60,9001  >  35978 [ACK] Seq=2461411 Ack=43329383 Win=65535 Len=0
1,1.7699159999999665,62.210.85.178,10.0.2.15,TCP,60,9001  >  35978 [ACK] Seq=2461411 Ack=43330843 Win=65535 Len=0
1,1.769947000000002,10.0.2.15,62.210.85.178,TLSv1.2,1204,Application Data
1,1.7700150000000576,62.210.85.178,10.0.2.15,TCP,60,9001  >  35978 [ACK] Seq=2461411 Ack=43331993 Win=65535 Len=0
1,1.7700489999999718,10.0.2.15,62.210.85.178,TLSv1.2,332,Application Data
1,1.770085999999992,62.210.85.178,10.0.2.15,TCP,60,9001  >  35978 [ACK] Seq=2461411 Ack=43332271 Win=65535 Len=0
1,1.7701429999999618,10.0.2.15,62.210.85.178,TLSv1.2,3868,Application Data
1,1.7701849999998558,62.210.85.178,10.0.2.15,TCP,60,9001  >  35978 [ACK] Seq=2461411 Ack=43333731 Win=65535 Len=0
1,1.7701919999999518,62.210.85.178,10.0.2.15,TCP,60,9001  >  35978 [ACK] Seq=2461411 Ack=43335191 Win=65535 Len=0
1,1.7701959999999417,62.210.85.178,10.0.2.15,TCP,60,9001  >  35978 [ACK] Seq=2461411 Ack=43336085 Win=65535 Len=0
1,1.7702429999999367,10.0.2.15,62.210.85.178,TLSv1.2,4124,Application Data
1,1.7702830000000631,62.210.85.178,10.0.2.15,TCP,60,9001  >  35978 [ACK] Seq=2461411 Ack=43337545 Win=65535 Len=0
1,1.770289000000048,62.210.85.178,10.0.2.15,TCP,60,9001  >  35978 [ACK] Seq=2461411 Ack=43339005 Win=65535 Len=0
1,1.7702939999999217,62.210.85.178,10.0.2.15,TCP,60,9001  >  35978 [ACK] Seq=2461411 Ack=43340155 Win=65535 Len=0
1,1.7703369999999268,10.0.2.15,62.210.85.178,TLSv1.2,3030,Application Data
1,1.770377999999937,62.210.85.178,10.0.2.15,TCP,60,9001  >  35978 [ACK] Seq=2461411 Ack=43341615 Win=65535 Len=0
1,1.7703839999999218,62.210.85.178,10.0.2.15,TCP,60,9001  >  35978 [ACK] Seq=2461411 Ack=43343075 Win=65535 Len=0
1,1.7703890000000229,62.210.85.178,10.0.2.15,TCP,60,9001  >  35978 [ACK] Seq=2461411 Ack=43343131 Win=65535 Len=0
1,1.7795759999999063,10.0.2.15,62.210.85.178,TLSv1.2,4124,Application Data
1,1.7796559999999317,10.0.2.15,62.210.85.178,TCP,2974,35978  >  9001 [ACK] Seq=43347201 Ack=2461411 Win=65535 Len=2920 [TCP segment of a reassembled PDU]
1,1.779692999999952,62.210.85.178,10.0.2.15,TCP,60,9001  >  35978 [ACK] Seq=2461411 Ack=43344591 Win=65535 Len=0
1,1.7797009999999318,62.210.85.178,10.0.2.15,TCP,60,9001  >  35978 [ACK] Seq=2461411 Ack=43346051 Win=65535 Len=0
1,1.7797049999999217,62.210.85.178,10.0.2.15,TCP,60,9001  >  35978 [ACK] Seq=2461411 Ack=43347201 Win=65535 Len=0
1,1.7797100000000228,62.210.85.178,10.0.2.15,TCP,60,9001  >  35978 [ACK] Seq=2461411 Ack=43348661 Win=65535 Len=0
1,1.7797140000000127,62.210.85.178,10.0.2.15,TCP,60,9001  >  35978 [ACK] Seq=2461411 Ack=43350121 Win=65535 Len=0
1,1.779753000000028,10.0.2.15,62.210.85.178,TLSv1.2,1204,Application Data
1,1.7798189999998613,10.0.2.15,62.210.85.178,TCP,2974,35978  >  9001 [ACK] Seq=43351271 Ack=2461411 Win=65535 Len=2920 [TCP segment of a reassembled PDU]
1,1.7798559999998815,62.210.85.178,10.0.2.15,TCP,60,9001  >  35978 [ACK] Seq=2461411 Ack=43351271 Win=65535 Len=0
1,1.7798619999998664,62.210.85.178,10.0.2.15,TCP,60,9001  >  35978 [ACK] Seq=2461411 Ack=43352731 Win=65535 Len=0
1,1.7798669999999674,62.210.85.178,10.0.2.15,TCP,60,9001  >  35978 [ACK] Seq=2461411 Ack=43354191 Win=65535 Len=0
1,1.7799009999998816,10.0.2.15,62.210.85.178,TLSv1.2,882,Application Data
1,1.7799959999999828,62.210.85.178,10.0.2.15,TCP,60,9001  >  35978 [ACK] Seq=2461411 Ack=43355019 Win=65535 Len=0
1,1.87829499999998,54.93.77.70,10.0.2.15,TLSv1.2,590,Application Data
1,1.8855469999998604,54.93.77.70,10.0.2.15,TLSv1.2,5846,Application Data
1,1.8856329999998707,10.0.2.15,54.93.77.70,TCP,54,34692  >  9001 [ACK] Seq=2467189 Ack=43276443 Win=65535 Len=0
1,1.8857359999999517,54.93.77.70,10.0.2.15,TLSv1.2,2950,Application Data [TCP segment of a reassembled PDU]
1,1.8858359999999266,10.0.2.15,54.93.77.70,TCP,54,34692  >  9001 [ACK] Seq=2467189 Ack=43279339 Win=65535 Len=0
1,1.886015000000043,54.93.77.70,10.0.2.15,TCP,1502,"9001  >  34692 [PSH, ACK] Seq=43279339 Ack=2467189 Win=65535 Len=1448 [TCP segment of a reassembled PDU]"
1,1.8860760000000028,10.0.2.15,54.93.77.70,TLSv1.2,590,Application Data
1,1.8861870000000636,54.93.77.70,10.0.2.15,TCP,60,9001  >  34692 [ACK] Seq=43280787 Ack=2467725 Win=65535 Len=0
1,1.896778999999924,54.93.77.70,10.0.2.15,TLSv1.2,1292,Application Data
1,1.9288699999999608,54.93.77.70,10.0.2.15,TLSv1.2,3674,Application Data
1,1.9289420000000064,10.0.2.15,54.93.77.70,TCP,54,34692  >  9001 [ACK] Seq=2467725 Ack=43285645 Win=65535 Len=0
1,1.9372309999998834,54.93.77.70,10.0.2.15,TLSv1.2,5846,Application Data
1,1.937251999999944,54.93.77.70,10.0.2.15,TLSv1.2,4398,Application Data [TCP segment of a reassembled PDU]
1,1.9373219999999947,10.0.2.15,54.93.77.70,TCP,54,34692  >  9001 [ACK] Seq=2467725 Ack=43295781 Win=65535 Len=0
1,1.9378010000000359,54.93.77.70,10.0.2.15,TLSv1.2,5846,Application Data [TCP segment of a reassembled PDU]
1,1.9378469999999197,10.0.2.15,54.93.77.70,TCP,54,34692  >  9001 [ACK] Seq=2467725 Ack=43301573 Win=65535 Len=0
1,1.9380429999998796,10.0.2.15,54.93.77.70,TLSv1.2,590,Application Data
1,1.9381490000000667,54.93.77.70,10.0.2.15,TCP,60,9001  >  34692 [ACK] Seq=43301573 Ack=2468261 Win=65535 Len=0
1,1.9400510000000395,54.93.77.70,10.0.2.15,TLSv1.2,2950,"Application Data, Application Data"
1,1.9400969999999234,10.0.2.15,54.93.77.70,TCP,54,34692  >  9001 [ACK] Seq=2468261 Ack=43304469 Win=65535 Len=0
1,1.9467259999998987,54.93.77.70,10.0.2.15,TLSv1.2,2458,"Application Data, Application Data"
1,1.9467759999999998,10.0.2.15,54.93.77.70,TCP,54,34692  >  9001 [ACK] Seq=2468261 Ack=43306873 Win=65535 Len=0
1,1.9639680000000226,54.93.77.70,10.0.2.15,TLSv1.2,1104,Application Data
1,1.9702409999999873,54.93.77.70,10.0.2.15,TCP,1502,"9001  >  34692 [PSH, ACK] Seq=43307923 Ack=2468261 Win=65535 Len=1448 [TCP segment of a reassembled PDU]"
1,1.970294999999851,10.0.2.15,54.93.77.70,TCP,54,34692  >  9001 [ACK] Seq=2468261 Ack=43309371 Win=65535 Len=0
1,1.9865729999999076,54.93.77.70,10.0.2.15,TLSv1.2,684,Application Data
1,1.9899510000000191,10.0.2.15,54.93.77.70,TLSv1.2,590,Application Data
1,1.990103999999974,54.93.77.70,10.0.2.15,TCP,60,9001  >  34692 [ACK] Seq=43310001 Ack=2468797 Win=65535 Len=0
1,2.0160949999999502,62.210.85.178,10.0.2.15,TLSv1.2,590,Application Data
1,2.0566010000000006,10.0.2.15,62.210.85.178,TCP,54,35978  >  9001 [ACK] Seq=43355019 Ack=2461947 Win=65535 Len=0
1,2.077867999999853,62.210.85.178,10.0.2.15,TLSv1.2,590,Application Data
1,2.0779529999999795,10.0.2.15,62.210.85.178,TCP,54,35978  >  9001 [ACK] Seq=43355019 Ack=2462483 Win=65535 Len=0
1,2.1275349999998525,62.210.85.178,10.0.2.15,TLSv1.2,590,Application Data
1,2.127613999999994,10.0.2.15,62.210.85.178,TCP,54,35978  >  9001 [ACK] Seq=43355019 Ack=2463019 Win=65535 Len=0
1,2.128103999999894,10.0.2.15,62.210.85.178,TLSv1.2,590,Application Data
1,2.1282189999999446,62.210.85.178,10.0.2.15,TCP,60,9001  >  35978 [ACK] Seq=2463019 Ack=43355555 Win=65535 Len=0
1,2.4617729999999938,54.93.77.70,10.0.2.15,TLSv1.2,590,Application Data
1,2.4622199999998884,10.0.2.15,54.93.77.70,TLSv1.2,590,Application Data
1,2.4623320000000604,54.93.77.70,10.0.2.15,TCP,60,9001  >  34692 [ACK] Seq=43310537 Ack=2469333 Win=65535 Len=0
1,2.5613579999999274,62.210.85.178,10.0.2.15,TLSv1.2,590,Application Data
1,2.5694260000000213,10.0.2.15,62.210.85.178,TLSv1.2,590,Application Data
1,2.5695989999999256,62.210.85.178,10.0.2.15,TCP,60,9001  >  35978 [ACK] Seq=2463555 Ack=43356091 Win=65535 Len=0
1,2.581079000000045,10.0.2.15,62.210.85.178,TLSv1.2,4124,Application Data
1,2.5811899999998786,10.0.2.15,62.210.85.178,TCP,2974,35978  >  9001 [ACK] Seq=43360161 Ack=2463555 Win=65535 Len=2920 [TCP segment of a reassembled PDU]
1,2.581233999999995,62.210.85.178,10.0.2.15,TCP,60,9001  >  35978 [ACK] Seq=2463555 Ack=43357551 Win=65535 Len=0
1,2.5812439999999697,62.210.85.178,10.0.2.15,TCP,60,9001  >  35978 [ACK] Seq=2463555 Ack=43359011 Win=65535 Len=0
1,2.5812490000000707,62.210.85.178,10.0.2.15,TCP,60,9001  >  35978 [ACK] Seq=2463555 Ack=43360161 Win=65535 Len=0
1,2.5812550000000556,62.210.85.178,10.0.2.15,TCP,60,9001  >  35978 [ACK] Seq=2463555 Ack=43361621 Win=65535 Len=0
1,2.5812590000000455,62.210.85.178,10.0.2.15,TCP,60,9001  >  35978 [ACK] Seq=2463555 Ack=43363081 Win=65535 Len=0
1,2.5813029999999344,10.0.2.15,62.210.85.178,TLSv1.2,1204,Application Data
1,2.581372999999985,10.0.2.15,62.210.85.178,TCP,2974,35978  >  9001 [ACK] Seq=43364231 Ack=2463555 Win=65535 Len=2920 [TCP segment of a reassembled PDU]
1,2.5814120000000003,62.210.85.178,10.0.2.15,TCP,60,9001  >  35978 [ACK] Seq=2463555 Ack=43364231 Win=65535 Len=0
1,2.581418999999869,62.210.85.178,10.0.2.15,TCP,60,9001  >  35978 [ACK] Seq=2463555 Ack=43365691 Win=65535 Len=0
1,2.58142399999997,62.210.85.178,10.0.2.15,TCP,60,9001  >  35978 [ACK] Seq=2463555 Ack=43367151 Win=65535 Len=0
1,2.5814589999999953,10.0.2.15,62.210.85.178,TLSv1.2,1204,Application Data
1,2.581523999999945,10.0.2.15,62.210.85.178,TCP,2974,35978  >  9001 [ACK] Seq=43368301 Ack=2463555 Win=65535 Len=2920 [TCP segment of a reassembled PDU]
1,2.581561999999849,62.210.85.178,10.0.2.15,TCP,60,9001  >  35978 [ACK] Seq=2463555 Ack=43368301 Win=65535 Len=0
1,2.581568999999945,62.210.85.178,10.0.2.15,TCP,60,9001  >  35978 [ACK] Seq=2463555 Ack=43369761 Win=65535 Len=0
1,2.581572999999935,62.210.85.178,10.0.2.15,TCP,60,9001  >  35978 [ACK] Seq=2463555 Ack=43371221 Win=65535 Len=0
1,2.581604999999854,10.0.2.15,62.210.85.178,TLSv1.2,1204,Application Data
1,2.5816899999999805,10.0.2.15,62.210.85.178,TLSv1.2,2974,Application Data
1,2.5817270000000008,62.210.85.178,10.0.2.15,TCP,60,9001  >  35978 [ACK] Seq=2463555 Ack=43372371 Win=65535 Len=0
1,2.5817339999998694,62.210.85.178,10.0.2.15,TCP,60,9001  >  35978 [ACK] Seq=2463555 Ack=43373831 Win=65535 Len=0
1,2.5817379999998593,62.210.85.178,10.0.2.15,TCP,60,9001  >  35978 [ACK] Seq=2463555 Ack=43375291 Win=65535 Len=0
1,2.581770000000006,10.0.2.15,62.210.85.178,TLSv1.2,1226,Application Data
1,2.5818340000000717,10.0.2.15,62.210.85.178,TCP,2974,35978  >  9001 [ACK] Seq=43376463 Ack=2463555 Win=65535 Len=2920 [TCP segment of a reassembled PDU]
1,2.581869999999981,62.210.85.178,10.0.2.15,TCP,60,9001  >  35978 [ACK] Seq=2463555 Ack=43376463 Win=65535 Len=0
1,2.5818759999999656,62.210.85.178,10.0.2.15,TCP,60,9001  >  35978 [ACK] Seq=2463555 Ack=43377923 Win=65535 Len=0
1,2.5818799999999555,62.210.85.178,10.0.2.15,TCP,60,9001  >  35978 [ACK] Seq=2463555 Ack=43379383 Win=65535 Len=0
1,2.581910999999991,10.0.2.15,62.210.85.178,TLSv1.2,1204,Application Data
1,2.5819469999999,62.210.85.178,10.0.2.15,TCP,60,9001  >  35978 [ACK] Seq=2463555 Ack=43380533 Win=65535 Len=0
1,2.5819910000000164,10.0.2.15,62.210.85.178,TLSv1.2,3030,Application Data
1,2.5820300000000316,62.210.85.178,10.0.2.15,TCP,60,9001  >  35978 [ACK] Seq=2463555 Ack=43381993 Win=65535 Len=0
1,2.5820369999999,62.210.85.178,10.0.2.15,TCP,60,9001  >  35978 [ACK] Seq=2463555 Ack=43383453 Win=65535 Len=0
1,2.58204099999989,62.210.85.178,10.0.2.15,TCP,60,9001  >  35978 [ACK] Seq=2463555 Ack=43383509 Win=65535 Len=0
1,2.5912089999999353,10.0.2.15,62.210.85.178,TLSv1.2,4124,Application Data
1,2.5913060000000314,10.0.2.15,62.210.85.178,TCP,2974,35978  >  9001 [ACK] Seq=43387579 Ack=2463555 Win=65535 Len=2920 [TCP segment of a reassembled PDU]
1,2.5913439999999355,62.210.85.178,10.0.2.15,TCP,60,9001  >  35978 [ACK] Seq=2463555 Ack=43384969 Win=65535 Len=0
1,2.5913519999999153,62.210.85.178,10.0.2.15,TCP,60,9001  >  35978 [ACK] Seq=2463555 Ack=43386429 Win=65535 Len=0
1,2.591355999999905,62.210.85.178,10.0.2.15,TCP,60,9001  >  35978 [ACK] Seq=2463555 Ack=43387579 Win=65535 Len=0
1,2.591359999999895,62.210.85.178,10.0.2.15,TCP,60,9001  >  35978 [ACK] Seq=2463555 Ack=43389039 Win=65535 Len=0
1,2.591364999999996,62.210.85.178,10.0.2.15,TCP,60,9001  >  35978 [ACK] Seq=2463555 Ack=43390499 Win=65535 Len=0
1,2.5914029999999,10.0.2.15,62.210.85.178,TLSv1.2,1204,Application Data
1,2.591468999999961,10.0.2.15,62.210.85.178,TCP,2974,35978  >  9001 [ACK] Seq=43391649 Ack=2463555 Win=65535 Len=2920 [TCP segment of a reassembled PDU]
1,2.591505999999981,62.210.85.178,10.0.2.15,TCP,60,9001  >  35978 [ACK] Seq=2463555 Ack=43391649 Win=65535 Len=0
1,2.591511999999966,62.210.85.178,10.0.2.15,TCP,60,9001  >  35978 [ACK] Seq=2463555 Ack=43393109 Win=65535 Len=0
1,2.591517000000067,62.210.85.178,10.0.2.15,TCP,60,9001  >  35978 [ACK] Seq=2463555 Ack=43394569 Win=65535 Len=0
1,2.59154999999987,10.0.2.15,62.210.85.178,TLSv1.2,1204,Application Data
1,2.591613999999936,10.0.2.15,62.210.85.178,TCP,2974,35978  >  9001 [ACK] Seq=43395719 Ack=2463555 Win=65535 Len=2920 [TCP segment of a reassembled PDU]
1,2.591652999999951,62.210.85.178,10.0.2.15,TCP,60,9001  >  35978 [ACK] Seq=2463555 Ack=43395719 Win=65535 Len=0
1,2.591660000000047,62.210.85.178,10.0.2.15,TCP,60,9001  >  35978 [ACK] Seq=2463555 Ack=43397179 Win=65535 Len=0
1,2.591664000000037,62.210.85.178,10.0.2.15,TCP,60,9001  >  35978 [ACK] Seq=2463555 Ack=43398639 Win=65535 Len=0
1,2.5916950000000725,10.0.2.15,62.210.85.178,TLSv1.2,1204,Application Data
1,2.5917669999998907,62.210.85.178,10.0.2.15,TCP,60,9001  >  35978 [ACK] Seq=2463555 Ack=43399789 Win=65535 Len=0
1,2.591799999999921,10.0.2.15,62.210.85.178,TLSv1.2,332,Application Data
1,2.5918719999999666,62.210.85.178,10.0.2.15,TCP,60,9001  >  35978 [ACK] Seq=2463555 Ack=43400067 Win=65535 Len=0
1,2.591904999999997,10.0.2.15,62.210.85.178,TCP,2974,35978  >  9001 [ACK] Seq=43400067 Ack=2463555 Win=65535 Len=2920 [TCP segment of a reassembled PDU]
1,2.5919440000000122,62.210.85.178,10.0.2.15,TCP,60,9001  >  35978 [ACK] Seq=2463555 Ack=43401527 Win=65535 Len=0
1,2.591950999999881,62.210.85.178,10.0.2.15,TCP,60,9001  >  35978 [ACK] Seq=2463555 Ack=43402987 Win=65535 Len=0
1,2.5919819999999163,10.0.2.15,62.210.85.178,TLSv1.2,948,Application Data
1,2.592018000000053,62.210.85.178,10.0.2.15,TCP,60,9001  >  35978 [ACK] Seq=2463555 Ack=43403881 Win=65535 Len=0
1,2.592061000000058,10.0.2.15,62.210.85.178,TLSv1.2,3480,Application Data
1,2.592102000000068,62.210.85.178,10.0.2.15,TCP,60,9001  >  35978 [ACK] Seq=2463555 Ack=43405341 Win=65535 Len=0
1,2.592108000000053,62.210.85.178,10.0.2.15,TCP,60,9001  >  35978 [ACK] Seq=2463555 Ack=43406801 Win=65535 Len=0
1,2.5921129999999266,62.210.85.178,10.0.2.15,TCP,60,9001  >  35978 [ACK] Seq=2463555 Ack=43407307 Win=65535 Len=0
1,2.6942759999999453,54.93.77.70,10.0.2.15,TLSv1.2,7808,"Application Data, Application Data"
1,2.6944109999999455,10.0.2.15,54.93.77.70,TCP,54,34692  >  9001 [ACK] Seq=2469333 Ack=43318291 Win=65535 Len=0
1,2.70966999999996,54.93.77.70,10.0.2.15,TCP,2950,"9001  >  34692 [PSH, ACK] Seq=43318291 Ack=2469333 Win=65535 Len=2896 [TCP segment of a reassembled PDU]"
1,2.7097929999999906,10.0.2.15,54.93.77.70,TCP,54,34692  >  9001 [ACK] Seq=2469333 Ack=43321187 Win=65535 Len=0
1,2.70982499999991,54.93.77.70,10.0.2.15,TLSv1.2,2950,Application Data [TCP segment of a reassembled PDU]
1,2.7099339999999756,10.0.2.15,54.93.77.70,TCP,54,34692  >  9001 [ACK] Seq=2469333 Ack=43324083 Win=65535 Len=0
1,2.7109969999999066,54.93.77.70,10.0.2.15,TLSv1.2,2950,Application Data [TCP segment of a reassembled PDU]
1,2.7110419999999067,10.0.2.15,54.93.77.70,TCP,54,34692  >  9001 [ACK] Seq=2469333 Ack=43326979 Win=65535 Len=0
1,2.7116300000000138,54.93.77.70,10.0.2.15,TCP,1502,"9001  >  34692 [PSH, ACK] Seq=43326979 Ack=2469333 Win=65535 Len=1448 [TCP segment of a reassembled PDU]"
1,2.711673000000019,10.0.2.15,54.93.77.70,TCP,54,34692  >  9001 [ACK] Seq=2469333 Ack=43328427 Win=65535 Len=0
1,2.7125160000000506,54.93.77.70,10.0.2.15,TLSv1.2,5426,"Application Data, Application Data"
1,2.712577999999894,10.0.2.15,54.93.77.70,TCP,54,34692  >  9001 [ACK] Seq=2469333 Ack=43333799 Win=65535 Len=0
1,2.712769999999864,10.0.2.15,54.93.77.70,TLSv1.2,590,Application Data
1,2.712865999999849,54.93.77.70,10.0.2.15,TCP,60,9001  >  34692 [ACK] Seq=43333799 Ack=2469869 Win=65535 Len=0
1,2.7308530000000246,54.93.77.70,10.0.2.15,TCP,2950,"9001  >  34692 [PSH, ACK] Seq=43333799 Ack=2469869 Win=65535 Len=2896 [TCP segment of a reassembled PDU]"
1,2.7309399999999187,10.0.2.15,54.93.77.70,TCP,54,34692  >  9001 [ACK] Seq=2469869 Ack=43336695 Win=65535 Len=0
1,2.7336229999998523,54.93.77.70,10.0.2.15,TLSv1.2,778,Application Data
1,2.733836999999994,10.0.2.15,54.93.77.70,TLSv1.2,590,Application Data
1,2.7339560000000347,54.93.77.70,10.0.2.15,TCP,60,9001  >  34692 [ACK] Seq=43337419 Ack=2470405 Win=65535 Len=0
1,2.7376859999999397,54.93.77.70,10.0.2.15,TLSv1.2,4398,Application Data
1,2.737754999999879,10.0.2.15,54.93.77.70,TCP,54,34692  >  9001 [ACK] Seq=2470405 Ack=43341763 Win=65535 Len=0
1,2.7468509999998787,54.93.77.70,10.0.2.15,TLSv1.2,2950,Application Data [TCP segment of a reassembled PDU]
1,2.7469120000000657,10.0.2.15,54.93.77.70,TCP,54,34692  >  9001 [ACK] Seq=2470405 Ack=43344659 Win=65535 Len=0
1,2.749652999999853,54.93.77.70,10.0.2.15,TLSv1.2,8742,"Application Data, Application Data"
1,2.749740999999858,10.0.2.15,54.93.77.70,TCP,54,34692  >  9001 [ACK] Seq=2470405 Ack=43353347 Win=65535 Len=0
1,2.75024499999995,54.93.77.70,10.0.2.15,TLSv1.2,170,Application Data
1,2.756695000000036,54.93.77.70,10.0.2.15,TCP,2950,"9001  >  34692 [PSH, ACK] Seq=43353463 Ack=2470405 Win=65535 Len=2896 [TCP segment of a reassembled PDU]"
1,2.756750000000011,10.0.2.15,54.93.77.70,TCP,54,34692  >  9001 [ACK] Seq=2470405 Ack=43356359 Win=65535 Len=0
1,2.7588929999999436,54.93.77.70,10.0.2.15,TLSv1.2,4398,Application Data [TCP segment of a reassembled PDU]
1,2.758959999999888,10.0.2.15,54.93.77.70,TCP,54,34692  >  9001 [ACK] Seq=2470405 Ack=43360703 Win=65535 Len=0
1,2.773439999999937,54.93.77.70,10.0.2.15,TLSv1.2,568,Application Data
1,2.8166459999999915,10.0.2.15,54.93.77.70,TCP,54,34692  >  9001 [ACK] Seq=2470405 Ack=43361217 Win=65535 Len=0
1,2.83228199999985,54.93.77.70,10.0.2.15,TLSv1.2,1104,Application Data
1,2.832347999999911,10.0.2.15,54.93.77.70,TCP,54,34692  >  9001 [ACK] Seq=2470405 Ack=43362267 Win=65535 Len=0
1,2.834914000000026,10.0.2.15,54.93.77.70,TLSv1.2,590,Application Data
1,2.8350729999999658,54.93.77.70,10.0.2.15,TCP,60,9001  >  34692 [ACK] Seq=43362267 Ack=2470941 Win=65535 Len=0
1,2.859604999999874,62.210.85.178,10.0.2.15,TLSv1.2,590,Application Data
1,2.9006239999998797,10.0.2.15,62.210.85.178,TCP,54,35978  >  9001 [ACK] Seq=43407307 Ack=2464091 Win=65535 Len=0
1,2.9016469999999117,62.210.85.178,10.0.2.15,TLSv1.2,590,Application Data
1,2.9017019999998865,10.0.2.15,62.210.85.178,TCP,54,35978  >  9001 [ACK] Seq=43407307 Ack=2464627 Win=65535 Len=0
1,2.9640139999999064,62.210.85.178,10.0.2.15,TLSv1.2,590,Application Data
1,2.964087999999947,10.0.2.15,62.210.85.178,TCP,54,35978  >  9001 [ACK] Seq=43407307 Ack=2465163 Win=65535 Len=0
1,2.9645490000000336,10.0.2.15,62.210.85.178,TLSv1.2,590,Application Data
1,2.9647509999999784,62.210.85.178,10.0.2.15,TCP,60,9001  >  35978 [ACK] Seq=2465163 Ack=43407843 Win=65535 Len=0
1,3.0781010000000606,54.93.77.70,10.0.2.15,TLSv1.2,590,Application Data
1,3.078497999999854,10.0.2.15,54.93.77.70,TLSv1.2,590,Application Data
1,3.0786219999999958,54.93.77.70,10.0.2.15,TCP,60,9001  >  34692 [ACK] Seq=43362803 Ack=2471477 Win=65535 Len=0
1,3.192293999999947,62.210.85.178,10.0.2.15,TLSv1.2,590,Application Data
1,3.1955299999999625,10.0.2.15,62.210.85.178,TLSv1.2,590,Application Data
1,3.195700999999872,62.210.85.178,10.0.2.15,TCP,60,9001  >  35978 [ACK] Seq=2465699 Ack=43408379 Win=65535 Len=0
1,3.208738999999923,10.0.2.15,62.210.85.178,TLSv1.2,4124,Application Data
1,3.2088619999999537,10.0.2.15,62.210.85.178,TCP,2974,35978  >  9001 [ACK] Seq=43412449 Ack=2465699 Win=65535 Len=2920 [TCP segment of a reassembled PDU]
1,3.20891400000005,62.210.85.178,10.0.2.15,TCP,60,9001  >  35978 [ACK] Seq=2465699 Ack=43409839 Win=65535 Len=0
1,3.2089289999998982,62.210.85.178,10.0.2.15,TCP,60,9001  >  35978 [ACK] Seq=2465699 Ack=43411299 Win=65535 Len=0
1,3.208934999999883,62.210.85.178,10.0.2.15,TCP,60,9001  >  35978 [ACK] Seq=2465699 Ack=43412449 Win=65535 Len=0
1,3.208936999999878,62.210.85.178,10.0.2.15,TCP,60,9001  >  35978 [ACK] Seq=2465699 Ack=43413909 Win=65535 Len=0
1,3.208939999999984,62.210.85.178,10.0.2.15,TCP,60,9001  >  35978 [ACK] Seq=2465699 Ack=43415369 Win=65535 Len=0
1,3.2089789999999994,10.0.2.15,62.210.85.178,TLSv1.2,1204,Application Data
1,3.209045999999944,10.0.2.15,62.210.85.178,TCP,1514,35978  >  9001 [ACK] Seq=43416519 Ack=2465699 Win=65535 Len=1460 [TCP segment of a reassembled PDU]
1,3.209080999999969,62.210.85.178,10.0.2.15,TCP,60,9001  >  35978 [ACK] Seq=2465699 Ack=43416519 Win=65535 Len=0
1,3.209088999999949,62.210.85.178,10.0.2.15,TCP,60,9001  >  35978 [ACK] Seq=2465699 Ack=43417979 Win=65535 Len=0
1,3.2091199999999844,10.0.2.15,62.210.85.178,TLSv1.2,1314,Application Data
1,3.209225999999944,62.210.85.178,10.0.2.15,TCP,60,9001  >  35978 [ACK] Seq=2465699 Ack=43419239 Win=65535 Len=0
1,3.293143999999984,54.93.77.70,10.0.2.15,TLSv1.2,590,Application Data
1,3.314224999999851,54.93.77.70,10.0.2.15,TLSv1.2,3674,Application Data
1,3.3143149999998514,10.0.2.15,54.93.77.70,TCP,54,34692  >  9001 [ACK] Seq=2471477 Ack=43366959 Win=65535 Len=0
1,3.3248949999999695,54.93.77.70,10.0.2.15,TCP,2950,"9001  >  34692 [PSH, ACK] Seq=43366959 Ack=2471477 Win=65535 Len=2896 [TCP segment of a reassembled PDU]"
1,3.3249739999998837,10.0.2.15,54.93.77.70,TCP,54,34692  >  9001 [ACK] Seq=2471477 Ack=43369855 Win=65535 Len=0
1,3.3255169999999907,54.93.77.70,10.0.2.15,TLSv1.2,4398,"Application Data, Application Data"
1,3.3255759999999555,10.0.2.15,54.93.77.70,TCP,54,34692  >  9001 [ACK] Seq=2471477 Ack=43374199 Win=65535 Len=0
1,3.328187000000071,10.0.2.15,54.93.77.70,TLSv1.2,590,Application Data
1,3.32836199999997,54.93.77.70,10.0.2.15,TCP,60,9001  >  34692 [ACK] Seq=43374199 Ack=2472013 Win=65535 Len=0
1,3.4844590000000153,62.210.85.178,10.0.2.15,TLSv1.2,590,Application Data
1,3.485006999999996,10.0.2.15,62.210.85.178,TLSv1.2,590,Application Data
1,3.4851529999998547,62.210.85.178,10.0.2.15,TCP,60,9001  >  35978 [ACK] Seq=2466235 Ack=43419775 Win=65535 Len=0
1,3.5887720000000627,54.93.77.70,10.0.2.15,TLSv1.2,590,Application Data
1,3.589199000000008,10.0.2.15,54.93.77.70,TLSv1.2,590,Application Data
1,3.589339999999993,54.93.77.70,10.0.2.15,TCP,60,9001  >  34692 [ACK] Seq=43374735 Ack=2472549 Win=65535 Len=0
1,3.790764999999965,62.210.85.178,10.0.2.15,TLSv1.2,590,Application Data
1,3.7967650000000503,10.0.2.15,62.210.85.178,TLSv1.2,590,Application Data
1,3.7969809999999597,62.210.85.178,10.0.2.15,TCP,60,9001  >  35978 [ACK] Seq=2466771 Ack=43420311 Win=65535 Len=0
1,3.8092599999999948,10.0.2.15,62.210.85.178,TLSv1.2,4124,Application Data
1,3.8093830000000253,10.0.2.15,62.210.85.178,TCP,2974,35978  >  9001 [ACK] Seq=43424381 Ack=2466771 Win=65535 Len=2920 [TCP segment of a reassembled PDU]
1,3.8094489999998586,62.210.85.178,10.0.2.15,TCP,60,9001  >  35978 [ACK] Seq=2466771 Ack=43421771 Win=65535 Len=0
1,3.8094610000000557,62.210.85.178,10.0.2.15,TCP,60,9001  >  35978 [ACK] Seq=2466771 Ack=43423231 Win=65535 Len=0
1,3.8094670000000406,62.210.85.178,10.0.2.15,TCP,60,9001  >  35978 [ACK] Seq=2466771 Ack=43424381 Win=65535 Len=0
1,3.809522999999899,10.0.2.15,62.210.85.178,TLSv1.2,1204,Application Data
1,3.8095619999999144,62.210.85.178,10.0.2.15,TCP,60,9001  >  35978 [ACK] Seq=2466771 Ack=43425841 Win=65535 Len=0
1,3.8095710000000054,62.210.85.178,10.0.2.15,TCP,60,9001  >  35978 [ACK] Seq=2466771 Ack=43427301 Win=65535 Len=0
1,3.809573999999884,62.210.85.178,10.0.2.15,TCP,60,9001  >  35978 [ACK] Seq=2466771 Ack=43428451 Win=65535 Len=0
1,3.8096169999998892,10.0.2.15,62.210.85.178,TLSv1.2,4124,Application Data
1,3.8096559999999045,62.210.85.178,10.0.2.15,TCP,60,9001  >  35978 [ACK] Seq=2466771 Ack=43429911 Win=65535 Len=0
1,3.8096649999999954,62.210.85.178,10.0.2.15,TCP,60,9001  >  35978 [ACK] Seq=2466771 Ack=43431371 Win=65535 Len=0
1,3.8096689999999853,62.210.85.178,10.0.2.15,TCP,60,9001  >  35978 [ACK] Seq=2466771 Ack=43432521 Win=65535 Len=0
1,3.8097080000000005,10.0.2.15,62.210.85.178,TLSv1.2,4124,Application Data
1,3.809745000000021,62.210.85.178,10.0.2.15,TCP,60,9001  >  35978 [ACK] Seq=2466771 Ack=43433981 Win=65535 Len=0
1,3.8097539999998844,62.210.85.178,10.0.2.15,TCP,60,9001  >  35978 [ACK] Seq=2466771 Ack=43435441 Win=65535 Len=0
1,3.809825000000046,10.0.2.15,62.210.85.178,TLSv1.2,2974,Application Data
1,3.80986699999994,62.210.85.178,10.0.2.15,TCP,60,9001  >  35978 [ACK] Seq=2466771 Ack=43436591 Win=65535 Len=0
1,3.809874000000036,62.210.85.178,10.0.2.15,TCP,60,9001  >  35978 [ACK] Seq=2466771 Ack=43438051 Win=65535 Len=0
1,3.809876999999915,62.210.85.178,10.0.2.15,TCP,60,9001  >  35978 [ACK] Seq=2466771 Ack=43439511 Win=65535 Len=0
1,3.8099039999999604,10.0.2.15,62.210.85.178,TLSv1.2,1226,Application Data
1,3.8099409999999807,62.210.85.178,10.0.2.15,TCP,60,9001  >  35978 [ACK] Seq=2466771 Ack=43440683 Win=65535 Len=0
1,3.809981999999991,10.0.2.15,62.210.85.178,TLSv1.2,4124,Application Data
1,3.810021000000006,62.210.85.178,10.0.2.15,TCP,60,9001  >  35978 [ACK] Seq=2466771 Ack=43442143 Win=65535 Len=0
1,3.810028999999986,62.210.85.178,10.0.2.15,TCP,60,9001  >  35978 [ACK] Seq=2466771 Ack=43443603 Win=65535 Len=0
1,3.810032999999976,62.210.85.178,10.0.2.15,TCP,60,9001  >  35978 [ACK] Seq=2466771 Ack=43444753 Win=65535 Len=0
1,3.810069999999996,10.0.2.15,62.210.85.178,TLSv1.2,3030,Application Data
1,3.810109999999895,62.210.85.178,10.0.2.15,TCP,60,9001  >  35978 [ACK] Seq=2466771 Ack=43446213 Win=65535 Len=0
1,3.810117999999875,62.210.85.178,10.0.2.15,TCP,60,9001  >  35978 [ACK] Seq=2466771 Ack=43447673 Win=65535 Len=0
1,3.810120999999981,62.210.85.178,10.0.2.15,TCP,60,9001  >  35978 [ACK] Seq=2466771 Ack=43447729 Win=65535 Len=0
1,3.8196109999998953,10.0.2.15,62.210.85.178,TLSv1.2,1104,Application Data
1,3.8197949999998855,62.210.85.178,10.0.2.15,TCP,60,9001  >  35978 [ACK] Seq=2466771 Ack=43448779 Win=65535 Len=0
1,3.9208710000000337,54.93.77.70,10.0.2.15,TLSv1.2,3674,Application Data
1,3.921010000000024,10.0.2.15,54.93.77.70,TCP,54,34692  >  9001 [ACK] Seq=2472549 Ack=43378355 Win=65535 Len=0
1,3.9533930000000055,54.93.77.70,10.0.2.15,TLSv1.2,3674,Application Data
1,3.95345199999997,10.0.2.15,54.93.77.70,TCP,54,34692  >  9001 [ACK] Seq=2472549 Ack=43381975 Win=65535 Len=0
1,3.962084999999888,54.93.77.70,10.0.2.15,TLSv1.2,7294,Application Data
1,3.9621680000000197,10.0.2.15,54.93.77.70,TCP,54,34692  >  9001 [ACK] Seq=2472549 Ack=43389215 Win=65535 Len=0
1,3.9623199999998633,10.0.2.15,54.93.77.70,TLSv1.2,590,Application Data
1,3.962391999999909,54.93.77.70,10.0.2.15,TCP,60,9001  >  34692 [ACK] Seq=43389215 Ack=2473085 Win=65535 Len=0
1,3.979114999999865,54.93.77.70,10.0.2.15,TLSv1.2,568,Application Data
1,3.984610999999859,54.93.77.70,10.0.2.15,TLSv1.2,5846,Application Data
1,3.984670000000051,10.0.2.15,54.93.77.70,TCP,54,34692  >  9001 [ACK] Seq=2473085 Ack=43395521 Win=65535 Len=0
1,3.9847219999999197,54.93.77.70,10.0.2.15,TLSv1.2,2950,Application Data [TCP segment of a reassembled PDU]
1,3.9847729999999046,10.0.2.15,54.93.77.70,TCP,54,34692  >  9001 [ACK] Seq=2473085 Ack=43398417 Win=65535 Len=0
1,3.9864149999998517,54.93.77.70,10.0.2.15,TCP,2950,"9001  >  34692 [PSH, ACK] Seq=43398417 Ack=2473085 Win=65535 Len=2896 [TCP segment of a reassembled PDU]"
1,3.986460999999963,10.0.2.15,54.93.77.70,TCP,54,34692  >  9001 [ACK] Seq=2473085 Ack=43401313 Win=65535 Len=0
1,4.002680000000055,54.93.77.70,10.0.2.15,TLSv1.2,894,"Application Data, Application Data"
1,4.002876000000015,10.0.2.15,54.93.77.70,TLSv1.2,590,Application Data
1,4.0029729999998835,54.93.77.70,10.0.2.15,TCP,60,9001  >  34692 [ACK] Seq=43402153 Ack=2473621 Win=65535 Len=0
1,4.007914000000028,54.93.77.70,10.0.2.15,TCP,1502,"9001  >  34692 [PSH, ACK] Seq=43402153 Ack=2473621 Win=65535 Len=1448 [TCP segment of a reassembled PDU]"
1,4.007963999999902,10.0.2.15,54.93.77.70,TCP,54,34692  >  9001 [ACK] Seq=2473621 Ack=43403601 Win=65535 Len=0
1,4.023525000000063,54.93.77.70,10.0.2.15,TLSv1.2,170,Application Data
1,4.025871999999936,10.0.2.15,54.93.77.70,TLSv1.2,590,Application Data
1,4.02602899999988,54.93.77.70,10.0.2.15,TCP,60,9001  >  34692 [ACK] Seq=43403717 Ack=2474157 Win=65535 Len=0
1,4.069851999999855,62.210.85.178,10.0.2.15,TLSv1.2,590,Application Data
1,4.112644000000046,10.0.2.15,62.210.85.178,TCP,54,35978  >  9001 [ACK] Seq=43448779 Ack=2467307 Win=65535 Len=0
1,4.135430999999926,62.210.85.178,10.0.2.15,TLSv1.2,590,Application Data
1,4.135516000000052,10.0.2.15,62.210.85.178,TCP,54,35978  >  9001 [ACK] Seq=43448779 Ack=2467843 Win=65535 Len=0
1,4.195072999999866,62.210.85.178,10.0.2.15,TLSv1.2,590,Application Data
1,4.195146999999906,10.0.2.15,62.210.85.178,TCP,54,35978  >  9001 [ACK] Seq=43448779 Ack=2468379 Win=65535 Len=0
1,4.195609999999988,10.0.2.15,62.210.85.178,TLSv1.2,590,Application Data
1,4.195725000000039,62.210.85.178,10.0.2.15,TCP,60,9001  >  35978 [ACK] Seq=2468379 Ack=43449315 Win=65535 Len=0
1,4.2861310000000685,54.93.77.70,10.0.2.15,TLSv1.2,590,Application Data
1,4.2865150000000085,10.0.2.15,54.93.77.70,TLSv1.2,590,Application Data
1,4.286624000000074,54.93.77.70,10.0.2.15,TCP,60,9001  >  34692 [ACK] Seq=43404253 Ack=2474693 Win=65535 Len=0
1,4.507472999999891,62.210.85.178,10.0.2.15,TLSv1.2,590,Application Data
