No.,Time,Source,Destination,Protocol,Length,Info
1,0.008440000000064174,10.0.2.15,62.210.85.178,TCP,54,35978  >  9001 [ACK] Seq=47829617 Ack=2703913 Win=65535 Len=0
1,0.018176999999923282,10.0.2.15,54.93.77.70,TCP,54,34692  >  9001 [ACK] Seq=2714029 Ack=47786515 Win=65535 Len=0
1,0.019729999999981374,62.210.85.178,10.0.2.15,TLSv1.2,590,Application Data
1,0.019827000000077533,10.0.2.15,62.210.85.178,TCP,54,35978  >  9001 [ACK] Seq=47829617 Ack=2704449 Win=65535 Len=0
1,0.05156299999998737,62.210.85.178,10.0.2.15,TLSv1.2,590,Application Data
1,0.05166000000008353,10.0.2.15,62.210.85.178,TCP,54,35978  >  9001 [ACK] Seq=47829617 Ack=2704985 Win=65535 Len=0
1,0.17414400000006935,10.0.2.15,54.93.77.70,TLSv1.2,590,Application Data
1,0.17431600000008984,54.93.77.70,10.0.2.15,TCP,60,9001  >  34692 [ACK] Seq=47786515 Ack=2714565 Win=65535 Len=0
1,0.28908499999988635,62.210.85.178,10.0.2.15,TLSv1.2,590,Application Data
1,0.2891629999999168,10.0.2.15,62.210.85.178,TCP,54,35978  >  9001 [ACK] Seq=47829617 Ack=2705521 Win=65535 Len=0
1,0.289698000000044,10.0.2.15,62.210.85.178,TLSv1.2,590,Application Data
1,0.2898040000000037,62.210.85.178,10.0.2.15,TCP,60,9001  >  35978 [ACK] Seq=2705521 Ack=47830153 Win=65535 Len=0
1,0.3952790000000732,54.93.77.70,10.0.2.15,TLSv1.2,590,Application Data
1,0.39535799999998744,10.0.2.15,54.93.77.70,TCP,54,34692  >  9001 [ACK] Seq=2714565 Ack=47787051 Win=65535 Len=0
1,0.39580499999988206,10.0.2.15,54.93.77.70,TLSv1.2,1618,Application Data
1,0.39591999999993277,54.93.77.70,10.0.2.15,TCP,60,9001  >  34692 [ACK] Seq=47787051 Ack=2716025 Win=65535 Len=0
1,0.3959419999998772,54.93.77.70,10.0.2.15,TCP,60,9001  >  34692 [ACK] Seq=47787051 Ack=2716129 Win=65535 Len=0
1,0.6056699999999182,62.210.85.178,10.0.2.15,TLSv1.2,1618,Application Data
1,0.6058179999999993,10.0.2.15,62.210.85.178,TCP,54,35978  >  9001 [ACK] Seq=47830153 Ack=2707085 Win=65535 Len=0
1,0.6268059999999878,10.0.2.15,62.210.85.178,TLSv1.2,590,Application Data
1,0.6269959999999628,62.210.85.178,10.0.2.15,TCP,60,9001  >  35978 [ACK] Seq=2707085 Ack=47830689 Win=65535 Len=0
1,0.6387979999999516,10.0.2.15,62.210.85.178,TLSv1.2,1618,Application Data
1,0.6389309999999568,62.210.85.178,10.0.2.15,TCP,60,9001  >  35978 [ACK] Seq=2707085 Ack=47832149 Win=65535 Len=0
1,0.6389500000000226,62.210.85.178,10.0.2.15,TCP,60,9001  >  35978 [ACK] Seq=2707085 Ack=47832253 Win=65535 Len=0
1,0.7351309999999103,54.93.77.70,10.0.2.15,TLSv1.2,590,Application Data
1,0.7631509999998798,54.93.77.70,10.0.2.15,TLSv1.2,1618,Application Data
1,0.7633009999999558,10.0.2.15,54.93.77.70,TCP,54,34692  >  9001 [ACK] Seq=2716129 Ack=47789151 Win=65535 Len=0
1,0.7654620000000705,10.0.2.15,54.93.77.70,TLSv1.2,590,Application Data
1,0.7656309999999849,54.93.77.70,10.0.2.15,TCP,60,9001  >  34692 [ACK] Seq=47789151 Ack=2716665 Win=65535 Len=0
1,0.8775869999999486,62.210.85.178,10.0.2.15,TLSv1.2,590,Application Data
1,0.8779340000000957,10.0.2.15,62.210.85.178,TLSv1.2,590,Application Data
1,0.8780500000000302,62.210.85.178,10.0.2.15,TCP,60,9001  >  35978 [ACK] Seq=2707621 Ack=47832789 Win=65535 Len=0
1,0.9772060000000238,54.93.77.70,10.0.2.15,TLSv1.2,590,Application Data
1,0.9776879999999437,10.0.2.15,54.93.77.70,TLSv1.2,590,Application Data
1,0.97783000000004,54.93.77.70,10.0.2.15,TCP,60,9001  >  34692 [ACK] Seq=47789687 Ack=2717201 Win=65535 Len=0
1,1.081177999999909,62.210.85.178,10.0.2.15,TLSv1.2,590,Application Data
1,1.0864819999999327,10.0.2.15,62.210.85.178,TLSv1.2,590,Application Data
1,1.086624000000029,62.210.85.178,10.0.2.15,TCP,60,9001  >  35978 [ACK] Seq=2708157 Ack=47833325 Win=65535 Len=0
1,1.0990529999999126,10.0.2.15,62.210.85.178,TLSv1.2,4124,Application Data
1,1.0991699999999582,10.0.2.15,62.210.85.178,TCP,2974,35978  >  9001 [ACK] Seq=47837395 Ack=2708157 Win=65535 Len=2920 [TCP segment of a reassembled PDU]
1,1.0992200000000594,62.210.85.178,10.0.2.15,TCP,60,9001  >  35978 [ACK] Seq=2708157 Ack=47834785 Win=65535 Len=0
1,1.0992329999999129,62.210.85.178,10.0.2.15,TCP,60,9001  >  35978 [ACK] Seq=2708157 Ack=47836245 Win=65535 Len=0
1,1.0992389999998977,62.210.85.178,10.0.2.15,TCP,60,9001  >  35978 [ACK] Seq=2708157 Ack=47837395 Win=65535 Len=0
1,1.0992859999998927,10.0.2.15,62.210.85.178,TLSv1.2,1204,Application Data
1,1.099324999999908,62.210.85.178,10.0.2.15,TCP,60,9001  >  35978 [ACK] Seq=2708157 Ack=47838855 Win=65535 Len=0
1,1.0993329999998878,62.210.85.178,10.0.2.15,TCP,60,9001  >  35978 [ACK] Seq=2708157 Ack=47840315 Win=65535 Len=0
1,1.0993359999999939,62.210.85.178,10.0.2.15,TCP,60,9001  >  35978 [ACK] Seq=2708157 Ack=47841465 Win=65535 Len=0
1,1.099377000000004,10.0.2.15,62.210.85.178,TLSv1.2,4124,Application Data
1,1.0994160000000193,62.210.85.178,10.0.2.15,TCP,60,9001  >  35978 [ACK] Seq=2708157 Ack=47842925 Win=65535 Len=0
1,1.099423999999999,62.210.85.178,10.0.2.15,TCP,60,9001  >  35978 [ACK] Seq=2708157 Ack=47844385 Win=65535 Len=0
1,1.0994290000001001,62.210.85.178,10.0.2.15,TCP,60,9001  >  35978 [ACK] Seq=2708157 Ack=47845535 Win=65535 Len=0
1,1.099467999999888,10.0.2.15,62.210.85.178,TLSv1.2,4124,Application Data
1,1.0995060000000194,62.210.85.178,10.0.2.15,TCP,60,9001  >  35978 [ACK] Seq=2708157 Ack=47846995 Win=65535 Len=0
1,1.0995139999999992,62.210.85.178,10.0.2.15,TCP,60,9001  >  35978 [ACK] Seq=2708157 Ack=47848455 Win=65535 Len=0
1,1.099574000000075,10.0.2.15,62.210.85.178,TLSv1.2,2974,Application Data
1,1.0996139999999741,62.210.85.178,10.0.2.15,TCP,60,9001  >  35978 [ACK] Seq=2708157 Ack=47849605 Win=65535 Len=0
1,1.0996210000000701,62.210.85.178,10.0.2.15,TCP,60,9001  >  35978 [ACK] Seq=2708157 Ack=47851065 Win=65535 Len=0
1,1.0996239999999489,62.210.85.178,10.0.2.15,TCP,60,9001  >  35978 [ACK] Seq=2708157 Ack=47852525 Win=65535 Len=0
1,1.0996519999998782,10.0.2.15,62.210.85.178,TLSv1.2,1226,Application Data
1,1.0996889999998984,62.210.85.178,10.0.2.15,TCP,60,9001  >  35978 [ACK] Seq=2708157 Ack=47853697 Win=65535 Len=0
1,1.0997279999999137,10.0.2.15,62.210.85.178,TLSv1.2,1938,Application Data
1,1.09976800000004,62.210.85.178,10.0.2.15,TCP,60,9001  >  35978 [ACK] Seq=2708157 Ack=47855157 Win=65535 Len=0
1,1.099774000000025,62.210.85.178,10.0.2.15,TCP,60,9001  >  35978 [ACK] Seq=2708157 Ack=47855581 Win=65535 Len=0
1,1.2019319999999425,54.93.77.70,10.0.2.15,TLSv1.2,3674,Application Data
1,1.2020449999999983,10.0.2.15,54.93.77.70,TCP,54,34692  >  9001 [ACK] Seq=2717201 Ack=47793307 Win=65535 Len=0
1,1.2258679999999913,54.93.77.70,10.0.2.15,TLSv1.2,590,Application Data
1,1.2355130000000827,54.93.77.70,10.0.2.15,TCP,2950,"9001  >  34692 [PSH, ACK] Seq=47793843 Ack=2717201 Win=65535 Len=2896 [TCP segment of a reassembled PDU]"
1,1.2356079999999565,10.0.2.15,54.93.77.70,TCP,54,34692  >  9001 [ACK] Seq=2717201 Ack=47796739 Win=65535 Len=0
1,1.2359309999999368,54.93.77.70,10.0.2.15,TLSv1.2,4398,Application Data [TCP segment of a reassembled PDU]
1,1.2360029999999824,10.0.2.15,54.93.77.70,TCP,54,34692  >  9001 [ACK] Seq=2717201 Ack=47801083 Win=65535 Len=0
1,1.2461069999999381,54.93.77.70,10.0.2.15,TLSv1.2,4398,Application Data [TCP segment of a reassembled PDU]
1,1.2461940000000595,10.0.2.15,54.93.77.70,TCP,54,34692  >  9001 [ACK] Seq=2717201 Ack=47805427 Win=65535 Len=0
1,1.2464449999999943,10.0.2.15,54.93.77.70,TLSv1.2,590,Application Data
1,1.2465709999999035,54.93.77.70,10.0.2.15,TCP,60,9001  >  34692 [ACK] Seq=47805427 Ack=2717737 Win=65535 Len=0
1,1.2544129999998859,54.93.77.70,10.0.2.15,TLSv1.2,4514,"Application Data, Application Data, Application Data"
1,1.2545039999999972,10.0.2.15,54.93.77.70,TCP,54,34692  >  9001 [ACK] Seq=2717737 Ack=47809887 Win=65535 Len=0
1,1.266933999999992,54.93.77.70,10.0.2.15,TCP,1502,"9001  >  34692 [PSH, ACK] Seq=47809887 Ack=2717737 Win=65535 Len=1448 [TCP segment of a reassembled PDU]"
1,1.2670120000000225,10.0.2.15,54.93.77.70,TCP,54,34692  >  9001 [ACK] Seq=2717737 Ack=47811335 Win=65535 Len=0
1,1.2717150000000856,54.93.77.70,10.0.2.15,TLSv1.2,1198,Application Data
1,1.2746799999999894,10.0.2.15,54.93.77.70,TLSv1.2,590,Application Data
1,1.2748549999998886,54.93.77.70,10.0.2.15,TCP,60,9001  >  34692 [ACK] Seq=47812479 Ack=2718273 Win=65535 Len=0
1,1.3496489999999994,62.210.85.178,10.0.2.15,TLSv1.2,590,Application Data
1,1.3899770000000444,10.0.2.15,62.210.85.178,TCP,54,35978  >  9001 [ACK] Seq=47855581 Ack=2708693 Win=65535 Len=0
1,1.4841019999998935,62.210.85.178,10.0.2.15,TLSv1.2,590,Application Data
1,1.4841899999998986,10.0.2.15,62.210.85.178,TCP,54,35978  >  9001 [ACK] Seq=47855581 Ack=2709229 Win=65535 Len=0
1,1.4845319999999447,10.0.2.15,62.210.85.178,TLSv1.2,590,Application Data
1,1.484666000000061,62.210.85.178,10.0.2.15,TCP,60,9001  >  35978 [ACK] Seq=2709229 Ack=47856117 Win=65535 Len=0
1,1.5880310000000009,54.93.77.70,10.0.2.15,TLSv1.2,590,Application Data
1,1.5884839999998803,10.0.2.15,54.93.77.70,TLSv1.2,590,Application Data
1,1.5886230000000978,54.93.77.70,10.0.2.15,TCP,60,9001  >  34692 [ACK] Seq=47813015 Ack=2718809 Win=65535 Len=0
1,1.688916000000063,62.210.85.178,10.0.2.15,TLSv1.2,590,Application Data
1,1.6970949999999903,10.0.2.15,62.210.85.178,TLSv1.2,590,Application Data
1,1.6977699999999913,62.210.85.178,10.0.2.15,TCP,60,9001  >  35978 [ACK] Seq=2709765 Ack=47856653 Win=65535 Len=0
1,1.7111050000000887,10.0.2.15,62.210.85.178,TLSv1.2,4124,Application Data
1,1.7112139999999272,10.0.2.15,62.210.85.178,TCP,2974,35978  >  9001 [ACK] Seq=47860723 Ack=2709765 Win=65535 Len=2920 [TCP segment of a reassembled PDU]
1,1.7112560000000485,62.210.85.178,10.0.2.15,TCP,60,9001  >  35978 [ACK] Seq=2709765 Ack=47858113 Win=65535 Len=0
1,1.711266999999907,62.210.85.178,10.0.2.15,TCP,60,9001  >  35978 [ACK] Seq=2709765 Ack=47859573 Win=65535 Len=0
1,1.711270999999897,62.210.85.178,10.0.2.15,TCP,60,9001  >  35978 [ACK] Seq=2709765 Ack=47860723 Win=65535 Len=0
1,1.711275999999998,62.210.85.178,10.0.2.15,TCP,60,9001  >  35978 [ACK] Seq=2709765 Ack=47862183 Win=65535 Len=0
1,1.711279999999988,62.210.85.178,10.0.2.15,TCP,60,9001  >  35978 [ACK] Seq=2709765 Ack=47863643 Win=65535 Len=0
1,1.711322999999993,10.0.2.15,62.210.85.178,TLSv1.2,1204,Application Data
1,1.7113919999999325,10.0.2.15,62.210.85.178,TCP,2974,35978  >  9001 [ACK] Seq=47864793 Ack=2709765 Win=65535 Len=2920 [TCP segment of a reassembled PDU]
1,1.7114309999999477,62.210.85.178,10.0.2.15,TCP,60,9001  >  35978 [ACK] Seq=2709765 Ack=47864793 Win=65535 Len=0
1,1.7114380000000438,62.210.85.178,10.0.2.15,TCP,60,9001  >  35978 [ACK] Seq=2709765 Ack=47866253 Win=65535 Len=0
1,1.7114429999999174,62.210.85.178,10.0.2.15,TCP,60,9001  >  35978 [ACK] Seq=2709765 Ack=47867713 Win=65535 Len=0
1,1.711477000000059,10.0.2.15,62.210.85.178,TLSv1.2,1204,Application Data
1,1.7115420000000086,10.0.2.15,62.210.85.178,TCP,2974,35978  >  9001 [ACK] Seq=47868863 Ack=2709765 Win=65535 Len=2920 [TCP segment of a reassembled PDU]
1,1.7115790000000288,62.210.85.178,10.0.2.15,TCP,60,9001  >  35978 [ACK] Seq=2709765 Ack=47868863 Win=65535 Len=0
1,1.7115850000000137,62.210.85.178,10.0.2.15,TCP,60,9001  >  35978 [ACK] Seq=2709765 Ack=47870323 Win=65535 Len=0
1,1.7115899999998874,62.210.85.178,10.0.2.15,TCP,60,9001  >  35978 [ACK] Seq=2709765 Ack=47871783 Win=65535 Len=0
1,1.7116209999999228,10.0.2.15,62.210.85.178,TLSv1.2,1204,Application Data
1,1.7117009999999482,10.0.2.15,62.210.85.178,TLSv1.2,2974,Application Data
1,1.7117370000000847,62.210.85.178,10.0.2.15,TCP,60,9001  >  35978 [ACK] Seq=2709765 Ack=47872933 Win=65535 Len=0
1,1.7117439999999533,62.210.85.178,10.0.2.15,TCP,60,9001  >  35978 [ACK] Seq=2709765 Ack=47874393 Win=65535 Len=0
1,1.7117490000000544,62.210.85.178,10.0.2.15,TCP,60,9001  >  35978 [ACK] Seq=2709765 Ack=47875853 Win=65535 Len=0
1,1.7117800000000898,10.0.2.15,62.210.85.178,TLSv1.2,1226,Application Data
1,1.7118189999998776,62.210.85.178,10.0.2.15,TCP,60,9001  >  35978 [ACK] Seq=2709765 Ack=47877025 Win=65535 Len=0
1,1.711862999999994,10.0.2.15,62.210.85.178,TLSv1.2,4124,Application Data
1,1.7119020000000091,62.210.85.178,10.0.2.15,TCP,60,9001  >  35978 [ACK] Seq=2709765 Ack=47878485 Win=65535 Len=0
1,1.7119089999998778,62.210.85.178,10.0.2.15,TCP,60,9001  >  35978 [ACK] Seq=2709765 Ack=47879945 Win=65535 Len=0
1,1.711913000000095,62.210.85.178,10.0.2.15,TCP,60,9001  >  35978 [ACK] Seq=2709765 Ack=47881095 Win=65535 Len=0
1,1.711958999999979,10.0.2.15,62.210.85.178,TLSv1.2,3030,Application Data
1,1.7119979999999941,62.210.85.178,10.0.2.15,TCP,60,9001  >  35978 [ACK] Seq=2709765 Ack=47882555 Win=65535 Len=0
1,1.7120050000000901,62.210.85.178,10.0.2.15,TCP,60,9001  >  35978 [ACK] Seq=2709765 Ack=47884015 Win=65535 Len=0
1,1.7120099999999638,62.210.85.178,10.0.2.15,TCP,60,9001  >  35978 [ACK] Seq=2709765 Ack=47884071 Win=65535 Len=0
1,1.7212469999999485,10.0.2.15,62.210.85.178,TLSv1.2,4124,Application Data
1,1.72133000000008,10.0.2.15,62.210.85.178,TCP,2974,35978  >  9001 [ACK] Seq=47888141 Ack=2709765 Win=65535 Len=2920 [TCP segment of a reassembled PDU]
1,1.7213670000001002,62.210.85.178,10.0.2.15,TCP,60,9001  >  35978 [ACK] Seq=2709765 Ack=47885531 Win=65535 Len=0
1,1.7213759999999638,62.210.85.178,10.0.2.15,TCP,60,9001  >  35978 [ACK] Seq=2709765 Ack=47886991 Win=65535 Len=0
1,1.7213799999999537,62.210.85.178,10.0.2.15,TCP,60,9001  >  35978 [ACK] Seq=2709765 Ack=47888141 Win=65535 Len=0
1,1.7213850000000548,62.210.85.178,10.0.2.15,TCP,60,9001  >  35978 [ACK] Seq=2709765 Ack=47889601 Win=65535 Len=0
1,1.7213890000000447,62.210.85.178,10.0.2.15,TCP,60,9001  >  35978 [ACK] Seq=2709765 Ack=47891061 Win=65535 Len=0
1,1.7214300000000549,10.0.2.15,62.210.85.178,TLSv1.2,1204,Application Data
1,1.7214989999999943,10.0.2.15,62.210.85.178,TCP,2974,35978  >  9001 [ACK] Seq=47892211 Ack=2709765 Win=65535 Len=2920 [TCP segment of a reassembled PDU]
1,1.7215349999999034,62.210.85.178,10.0.2.15,TCP,60,9001  >  35978 [ACK] Seq=2709765 Ack=47892211 Win=65535 Len=0
1,1.7215419999999995,62.210.85.178,10.0.2.15,TCP,60,9001  >  35978 [ACK] Seq=2709765 Ack=47893671 Win=65535 Len=0
1,1.7215459999999894,62.210.85.178,10.0.2.15,TCP,60,9001  >  35978 [ACK] Seq=2709765 Ack=47895131 Win=65535 Len=0
1,1.7215799999999035,10.0.2.15,62.210.85.178,TLSv1.2,1204,Application Data
1,1.7216169999999238,62.210.85.178,10.0.2.15,TCP,60,9001  >  35978 [ACK] Seq=2709765 Ack=47896281 Win=65535 Len=0
1,1.7216639999999188,10.0.2.15,62.210.85.178,TLSv1.2,4124,Application Data
1,1.7217619999998988,10.0.2.15,62.210.85.178,TLSv1.2,2974,Application Data
1,1.7217849999999544,62.210.85.178,10.0.2.15,TCP,60,9001  >  35978 [ACK] Seq=2709765 Ack=47897741 Win=65535 Len=0
1,1.7217909999999392,62.210.85.178,10.0.2.15,TCP,60,9001  >  35978 [ACK] Seq=2709765 Ack=47899201 Win=65535 Len=0
1,1.7217960000000403,62.210.85.178,10.0.2.15,TCP,60,9001  >  35978 [ACK] Seq=2709765 Ack=47900351 Win=65535 Len=0
1,1.7218470000000252,62.210.85.178,10.0.2.15,TCP,60,9001  >  35978 [ACK] Seq=2709765 Ack=47901811 Win=65535 Len=0
1,1.721851999999899,62.210.85.178,10.0.2.15,TCP,60,9001  >  35978 [ACK] Seq=2709765 Ack=47903271 Win=65535 Len=0
1,1.7218860000000404,10.0.2.15,62.210.85.178,TLSv1.2,1226,Application Data
1,1.7219239999999445,62.210.85.178,10.0.2.15,TCP,60,9001  >  35978 [ACK] Seq=2709765 Ack=47904443 Win=65535 Len=0
1,1.7219970000001013,10.0.2.15,62.210.85.178,TLSv1.2,4124,Application Data
1,1.7220440000000963,62.210.85.178,10.0.2.15,TCP,60,9001  >  35978 [ACK] Seq=2709765 Ack=47905903 Win=65535 Len=0
1,1.722050999999965,62.210.85.178,10.0.2.15,TCP,60,9001  >  35978 [ACK] Seq=2709765 Ack=47907363 Win=65535 Len=0
1,1.7220549999999548,62.210.85.178,10.0.2.15,TCP,60,9001  >  35978 [ACK] Seq=2709765 Ack=47908513 Win=65535 Len=0
1,1.722101000000066,10.0.2.15,62.210.85.178,TLSv1.2,3030,Application Data
1,1.7221400000000813,62.210.85.178,10.0.2.15,TCP,60,9001  >  35978 [ACK] Seq=2709765 Ack=47909973 Win=65535 Len=0
1,1.7221460000000661,62.210.85.178,10.0.2.15,TCP,60,9001  >  35978 [ACK] Seq=2709765 Ack=47911433 Win=65535 Len=0
1,1.7221509999999398,62.210.85.178,10.0.2.15,TCP,60,9001  >  35978 [ACK] Seq=2709765 Ack=47911489 Win=65535 Len=0
1,1.7345530000000053,10.0.2.15,62.210.85.178,TLSv1.2,2646,Application Data
1,1.734666000000061,62.210.85.178,10.0.2.15,TCP,60,9001  >  35978 [ACK] Seq=2709765 Ack=47912949 Win=65535 Len=0
1,1.7346789999999146,62.210.85.178,10.0.2.15,TCP,60,9001  >  35978 [ACK] Seq=2709765 Ack=47914081 Win=65535 Len=0
1,1.7945819999999912,54.93.77.70,10.0.2.15,TLSv1.2,590,Application Data
1,1.8058349999998882,54.93.77.70,10.0.2.15,TCP,2950,"9001  >  34692 [PSH, ACK] Seq=47813551 Ack=2718809 Win=65535 Len=2896 [TCP segment of a reassembled PDU]"
1,1.8059390000000803,10.0.2.15,54.93.77.70,TCP,54,34692  >  9001 [ACK] Seq=2718809 Ack=47816447 Win=65535 Len=0
1,1.8176750000000084,54.93.77.70,10.0.2.15,TLSv1.2,4398,"Application Data, Application Data"
1,1.8177579999999125,10.0.2.15,54.93.77.70,TCP,54,34692  >  9001 [ACK] Seq=2718809 Ack=47820791 Win=65535 Len=0
1,1.8273819999999432,54.93.77.70,10.0.2.15,TLSv1.2,5846,Application Data
1,1.827434999999923,10.0.2.15,54.93.77.70,TCP,54,34692  >  9001 [ACK] Seq=2718809 Ack=47826583 Win=65535 Len=0
1,1.8275320000000193,54.93.77.70,10.0.2.15,TLSv1.2,2552,"Application Data, Application Data"
1,1.8276550000000498,10.0.2.15,54.93.77.70,TCP,54,34692  >  9001 [ACK] Seq=2718809 Ack=47829081 Win=65535 Len=0
1,1.8471850000000813,54.93.77.70,10.0.2.15,TLSv1.2,5846,Application Data
1,1.8472240000000966,54.93.77.70,10.0.2.15,TLSv1.2,8228,"Application Data, Application Data, Application Data"
1,1.8472790000000714,10.0.2.15,54.93.77.70,TCP,54,34692  >  9001 [ACK] Seq=2718809 Ack=47834873 Win=65535 Len=0
1,1.8473759999999402,10.0.2.15,54.93.77.70,TCP,54,34692  >  9001 [ACK] Seq=2718809 Ack=47843047 Win=65535 Len=0
1,1.8476920000000518,10.0.2.15,54.93.77.70,TLSv1.2,590,Application Data
1,1.8477669999999762,54.93.77.70,10.0.2.15,TCP,60,9001  >  34692 [ACK] Seq=47843047 Ack=2719345 Win=65535 Len=0
1,1.8582429999999022,54.93.77.70,10.0.2.15,TCP,2950,"9001  >  34692 [PSH, ACK] Seq=47843047 Ack=2719345 Win=65535 Len=2896 [TCP segment of a reassembled PDU]"
1,1.8583040000000892,10.0.2.15,54.93.77.70,TCP,54,34692  >  9001 [ACK] Seq=2719345 Ack=47845943 Win=65535 Len=0
1,1.8588689999999133,54.93.77.70,10.0.2.15,TLSv1.2,4398,Application Data [TCP segment of a reassembled PDU]
1,1.8589529999999286,10.0.2.15,54.93.77.70,TCP,54,34692  >  9001 [ACK] Seq=2719345 Ack=47850287 Win=65535 Len=0
1,1.8641979999999876,54.93.77.70,10.0.2.15,TLSv1.2,568,Application Data
1,1.8748330000000806,54.93.77.70,10.0.2.15,TLSv1.2,5846,Application Data
1,1.87485700000002,54.93.77.70,10.0.2.15,TLSv1.2,4398,Application Data [TCP segment of a reassembled PDU]
1,1.8749119999999948,10.0.2.15,54.93.77.70,TCP,54,34692  >  9001 [ACK] Seq=2719345 Ack=47856593 Win=65535 Len=0
1,1.874990999999909,10.0.2.15,54.93.77.70,TCP,54,34692  >  9001 [ACK] Seq=2719345 Ack=47860937 Win=65535 Len=0
1,1.8751640000000407,10.0.2.15,54.93.77.70,TLSv1.2,590,Application Data
1,1.8752360000000863,54.93.77.70,10.0.2.15,TCP,60,9001  >  34692 [ACK] Seq=47860937 Ack=2719881 Win=65535 Len=0
1,1.893624999999929,54.93.77.70,10.0.2.15,TLSv1.2,1292,Application Data
1,1.9072269999999207,54.93.77.70,10.0.2.15,TCP,2950,"9001  >  34692 [PSH, ACK] Seq=47862175 Ack=2719881 Win=65535 Len=2896 [TCP segment of a reassembled PDU]"
1,1.9072810000000118,10.0.2.15,54.93.77.70,TCP,54,34692  >  9001 [ACK] Seq=2719881 Ack=47865071 Win=65535 Len=0
1,1.9251569999998992,54.93.77.70,10.0.2.15,TLSv1.2,778,Application Data
1,1.9253369999998995,10.0.2.15,54.93.77.70,TLSv1.2,590,Application Data
1,1.9254229999999097,54.93.77.70,10.0.2.15,TCP,60,9001  >  34692 [ACK] Seq=47865795 Ack=2720417 Win=65535 Len=0
1,1.9466509999999744,54.93.77.70,10.0.2.15,TLSv1.2,3674,Application Data
1,1.9469280000000708,10.0.2.15,54.93.77.70,TCP,54,34692  >  9001 [ACK] Seq=2720417 Ack=47869415 Win=65535 Len=0
1,1.9559079999999085,62.210.85.178,10.0.2.15,TLSv1.2,590,Application Data
1,1.9633859999999004,54.93.77.70,10.0.2.15,TLSv1.2,590,Application Data
1,1.9944020000000364,62.210.85.178,10.0.2.15,TLSv1.2,590,Application Data
1,1.994462999999996,10.0.2.15,62.210.85.178,TCP,54,35978  >  9001 [ACK] Seq=47914081 Ack=2710837 Win=65535 Len=0
1,2.0059870000000046,10.0.2.15,54.93.77.70,TCP,54,34692  >  9001 [ACK] Seq=2720417 Ack=47869951 Win=65535 Len=0
1,2.0264870000000883,54.93.77.70,10.0.2.15,TLSv1.2,1104,Application Data
1,2.0265750000000935,10.0.2.15,54.93.77.70,TCP,54,34692  >  9001 [ACK] Seq=2720417 Ack=47871001 Win=65535 Len=0
1,2.029156999999941,10.0.2.15,54.93.77.70,TLSv1.2,590,Application Data
1,2.029322000000093,54.93.77.70,10.0.2.15,TCP,60,9001  >  34692 [ACK] Seq=47871001 Ack=2720953 Win=65535 Len=0
1,2.030035999999882,62.210.85.178,10.0.2.15,TLSv1.2,590,Application Data
1,2.0759570000000167,10.0.2.15,62.210.85.178,TCP,54,35978  >  9001 [ACK] Seq=47914081 Ack=2711373 Win=65535 Len=0
1,2.148048999999901,62.210.85.178,10.0.2.15,TLSv1.2,590,Application Data
1,2.148337999999967,10.0.2.15,62.210.85.178,TCP,54,35978  >  9001 [ACK] Seq=47914081 Ack=2711909 Win=65535 Len=0
1,2.1498229999999694,10.0.2.15,62.210.85.178,TLSv1.2,590,Application Data
1,2.1507520000000113,62.210.85.178,10.0.2.15,TCP,60,9001  >  35978 [ACK] Seq=2711909 Ack=47914617 Win=65535 Len=0
1,2.2467269999999644,54.93.77.70,10.0.2.15,TLSv1.2,590,Application Data
1,2.2471969999999146,10.0.2.15,54.93.77.70,TLSv1.2,590,Application Data
1,2.2473359999999047,54.93.77.70,10.0.2.15,TCP,60,9001  >  34692 [ACK] Seq=47871537 Ack=2721489 Win=65535 Len=0
1,2.368240999999898,62.210.85.178,10.0.2.15,TLSv1.2,590,Application Data
1,2.375731000000087,10.0.2.15,62.210.85.178,TLSv1.2,590,Application Data
1,2.375878999999941,62.210.85.178,10.0.2.15,TCP,60,9001  >  35978 [ACK] Seq=2712445 Ack=47915153 Win=65535 Len=0
1,2.390433999999914,10.0.2.15,62.210.85.178,TLSv1.2,4124,Application Data
1,2.39052700000002,10.0.2.15,62.210.85.178,TCP,2974,35978  >  9001 [ACK] Seq=47919223 Ack=2712445 Win=65535 Len=2920 [TCP segment of a reassembled PDU]
1,2.390566999999919,62.210.85.178,10.0.2.15,TCP,60,9001  >  35978 [ACK] Seq=2712445 Ack=47916613 Win=65535 Len=0
1,2.39058,62.210.85.178,10.0.2.15,TCP,60,9001  >  35978 [ACK] Seq=2712445 Ack=47918073 Win=65535 Len=0
1,2.39058399999999,62.210.85.178,10.0.2.15,TCP,60,9001  >  35978 [ACK] Seq=2712445 Ack=47919223 Win=65535 Len=0
1,2.390587000000096,62.210.85.178,10.0.2.15,TCP,60,9001  >  35978 [ACK] Seq=2712445 Ack=47920683 Win=65535 Len=0
1,2.3905899999999747,62.210.85.178,10.0.2.15,TCP,60,9001  >  35978 [ACK] Seq=2712445 Ack=47922143 Win=65535 Len=0
1,2.390623999999889,10.0.2.15,62.210.85.178,TLSv1.2,1204,Application Data
1,2.390656999999919,62.210.85.178,10.0.2.15,TCP,60,9001  >  35978 [ACK] Seq=2712445 Ack=47923293 Win=65535 Len=0
1,2.390707999999904,10.0.2.15,62.210.85.178,TLSv1.2,4124,Application Data
1,2.3907449999999244,62.210.85.178,10.0.2.15,TCP,60,9001  >  35978 [ACK] Seq=2712445 Ack=47924753 Win=65535 Len=0
1,2.3907520000000204,62.210.85.178,10.0.2.15,TCP,60,9001  >  35978 [ACK] Seq=2712445 Ack=47926213 Win=65535 Len=0
1,2.390754999999899,62.210.85.178,10.0.2.15,TCP,60,9001  >  35978 [ACK] Seq=2712445 Ack=47927363 Win=65535 Len=0
1,2.3907939999999144,10.0.2.15,62.210.85.178,TLSv1.2,4124,Application Data
1,2.3908269999999447,62.210.85.178,10.0.2.15,TCP,60,9001  >  35978 [ACK] Seq=2712445 Ack=47928823 Win=65535 Len=0
1,2.3908349999999245,62.210.85.178,10.0.2.15,TCP,60,9001  >  35978 [ACK] Seq=2712445 Ack=47930283 Win=65535 Len=0
1,2.3908739999999398,62.210.85.178,10.0.2.15,TCP,60,9001  >  35978 [ACK] Seq=2712445 Ack=47931433 Win=65535 Len=0
1,2.390908999999965,10.0.2.15,62.210.85.178,TLSv1.2,332,Application Data
1,2.3909429999998792,62.210.85.178,10.0.2.15,TCP,60,9001  >  35978 [ACK] Seq=2712445 Ack=47931711 Win=65535 Len=0
1,2.3909960000000865,10.0.2.15,62.210.85.178,TLSv1.2,3868,Application Data
1,2.3910319999999956,62.210.85.178,10.0.2.15,TCP,60,9001  >  35978 [ACK] Seq=2712445 Ack=47933171 Win=65535 Len=0
1,2.3910390000000916,62.210.85.178,10.0.2.15,TCP,60,9001  >  35978 [ACK] Seq=2712445 Ack=47934631 Win=65535 Len=0
1,2.3910419999999704,62.210.85.178,10.0.2.15,TCP,60,9001  >  35978 [ACK] Seq=2712445 Ack=47935525 Win=65535 Len=0
1,2.3910869999999704,10.0.2.15,62.210.85.178,TLSv1.2,4124,Application Data
1,2.3911279999999806,62.210.85.178,10.0.2.15,TCP,60,9001  >  35978 [ACK] Seq=2712445 Ack=47936985 Win=65535 Len=0
1,2.3911339999999655,62.210.85.178,10.0.2.15,TCP,60,9001  >  35978 [ACK] Seq=2712445 Ack=47938445 Win=65535 Len=0
1,2.3911370000000716,62.210.85.178,10.0.2.15,TCP,60,9001  >  35978 [ACK] Seq=2712445 Ack=47939595 Win=65535 Len=0
1,2.391172000000097,10.0.2.15,62.210.85.178,TLSv1.2,3030,Application Data
1,2.391206999999895,62.210.85.178,10.0.2.15,TCP,60,9001  >  35978 [ACK] Seq=2712445 Ack=47941055 Win=65535 Len=0
1,2.391213999999991,62.210.85.178,10.0.2.15,TCP,60,9001  >  35978 [ACK] Seq=2712445 Ack=47942515 Win=65535 Len=0
1,2.391217000000097,62.210.85.178,10.0.2.15,TCP,60,9001  >  35978 [ACK] Seq=2712445 Ack=47942571 Win=65535 Len=0
1,2.4004339999999047,10.0.2.15,62.210.85.178,TLSv1.2,4124,Application Data
1,2.400511999999935,62.210.85.178,10.0.2.15,TCP,60,9001  >  35978 [ACK] Seq=2712445 Ack=47944031 Win=65535 Len=0
1,2.400519999999915,62.210.85.178,10.0.2.15,TCP,60,9001  >  35978 [ACK] Seq=2712445 Ack=47945491 Win=65535 Len=0
1,2.400523999999905,62.210.85.178,10.0.2.15,TCP,60,9001  >  35978 [ACK] Seq=2712445 Ack=47946641 Win=65535 Len=0
1,2.4005640000000312,10.0.2.15,62.210.85.178,TLSv1.2,4124,Application Data
1,2.4006159999999,62.210.85.178,10.0.2.15,TCP,60,9001  >  35978 [ACK] Seq=2712445 Ack=47948101 Win=65535 Len=0
1,2.400621999999885,62.210.85.178,10.0.2.15,TCP,60,9001  >  35978 [ACK] Seq=2712445 Ack=47949561 Win=65535 Len=0
1,2.400624999999991,62.210.85.178,10.0.2.15,TCP,60,9001  >  35978 [ACK] Seq=2712445 Ack=47950711 Win=65535 Len=0
1,2.4006609999999,10.0.2.15,62.210.85.178,TLSv1.2,4124,Application Data
1,2.4006950000000415,62.210.85.178,10.0.2.15,TCP,60,9001  >  35978 [ACK] Seq=2712445 Ack=47952171 Win=65535 Len=0
1,2.4007030000000213,62.210.85.178,10.0.2.15,TCP,60,9001  >  35978 [ACK] Seq=2712445 Ack=47953631 Win=65535 Len=0
1,2.4007070000000112,62.210.85.178,10.0.2.15,TCP,60,9001  >  35978 [ACK] Seq=2712445 Ack=47954781 Win=65535 Len=0
1,2.4007420000000366,10.0.2.15,62.210.85.178,TLSv1.2,4124,Application Data
1,2.400775000000067,62.210.85.178,10.0.2.15,TCP,60,9001  >  35978 [ACK] Seq=2712445 Ack=47956241 Win=65535 Len=0
1,2.4007819999999356,62.210.85.178,10.0.2.15,TCP,60,9001  >  35978 [ACK] Seq=2712445 Ack=47957701 Win=65535 Len=0
1,2.4007870000000366,62.210.85.178,10.0.2.15,TCP,60,9001  >  35978 [ACK] Seq=2712445 Ack=47958851 Win=65535 Len=0
1,2.400820000000067,10.0.2.15,62.210.85.178,TLSv1.2,332,Application Data
1,2.4008530000000974,62.210.85.178,10.0.2.15,TCP,60,9001  >  35978 [ACK] Seq=2712445 Ack=47959129 Win=65535 Len=0
1,2.400910000000067,10.0.2.15,62.210.85.178,TLSv1.2,3868,Application Data
1,2.4009530000000723,62.210.85.178,10.0.2.15,TCP,60,9001  >  35978 [ACK] Seq=2712445 Ack=47960589 Win=65535 Len=0
1,2.400959999999941,62.210.85.178,10.0.2.15,TCP,60,9001  >  35978 [ACK] Seq=2712445 Ack=47962049 Win=65535 Len=0
1,2.400961999999936,62.210.85.178,10.0.2.15,TCP,60,9001  >  35978 [ACK] Seq=2712445 Ack=47962943 Win=65535 Len=0
1,2.400998999999956,10.0.2.15,62.210.85.178,TLSv1.2,4124,Application Data
1,2.4011149999998906,62.210.85.178,10.0.2.15,TCP,60,9001  >  35978 [ACK] Seq=2712445 Ack=47964403 Win=65535 Len=0
1,2.4011259999999766,62.210.85.178,10.0.2.15,TCP,60,9001  >  35978 [ACK] Seq=2712445 Ack=47965863 Win=65535 Len=0
1,2.4011290000000827,62.210.85.178,10.0.2.15,TCP,60,9001  >  35978 [ACK] Seq=2712445 Ack=47967013 Win=65535 Len=0
1,2.4011780000000726,10.0.2.15,62.210.85.178,TLSv1.2,3030,Application Data
1,2.401217000000088,62.210.85.178,10.0.2.15,TCP,60,9001  >  35978 [ACK] Seq=2712445 Ack=47968473 Win=65535 Len=0
1,2.4012239999999565,62.210.85.178,10.0.2.15,TCP,60,9001  >  35978 [ACK] Seq=2712445 Ack=47969933 Win=65535 Len=0
1,2.4012270000000626,62.210.85.178,10.0.2.15,TCP,60,9001  >  35978 [ACK] Seq=2712445 Ack=47969989 Win=65535 Len=0
1,2.4148969999998826,10.0.2.15,62.210.85.178,TLSv1.2,4124,Application Data
1,2.414982000000009,62.210.85.178,10.0.2.15,TCP,60,9001  >  35978 [ACK] Seq=2712445 Ack=47971449 Win=65535 Len=0
1,2.414993000000095,62.210.85.178,10.0.2.15,TCP,60,9001  >  35978 [ACK] Seq=2712445 Ack=47972909 Win=65535 Len=0
1,2.414997000000085,62.210.85.178,10.0.2.15,TCP,60,9001  >  35978 [ACK] Seq=2712445 Ack=47974059 Win=65535 Len=0
1,2.415036999999984,10.0.2.15,62.210.85.178,TLSv1.2,4124,Application Data
1,2.415074999999888,62.210.85.178,10.0.2.15,TCP,60,9001  >  35978 [ACK] Seq=2712445 Ack=47975519 Win=65535 Len=0
1,2.41508900000008,62.210.85.178,10.0.2.15,TCP,60,9001  >  35978 [ACK] Seq=2712445 Ack=47976979 Win=65535 Len=0
1,2.4150919999999587,62.210.85.178,10.0.2.15,TCP,60,9001  >  35978 [ACK] Seq=2712445 Ack=47978129 Win=65535 Len=0
1,2.41513000000009,10.0.2.15,62.210.85.178,TLSv1.2,4124,Application Data
1,2.415166999999883,62.210.85.178,10.0.2.15,TCP,60,9001  >  35978 [ACK] Seq=2712445 Ack=47979589 Win=65535 Len=0
1,2.415173999999979,62.210.85.178,10.0.2.15,TCP,60,9001  >  35978 [ACK] Seq=2712445 Ack=47981049 Win=65535 Len=0
1,2.415177999999969,62.210.85.178,10.0.2.15,TCP,60,9001  >  35978 [ACK] Seq=2712445 Ack=47982199 Win=65535 Len=0
1,2.415213999999878,10.0.2.15,62.210.85.178,TLSv1.2,4124,Application Data
1,2.4152480000000196,62.210.85.178,10.0.2.15,TCP,60,9001  >  35978 [ACK] Seq=2712445 Ack=47983659 Win=65535 Len=0
1,2.4152910000000247,62.210.85.178,10.0.2.15,TCP,60,9001  >  35978 [ACK] Seq=2712445 Ack=47985119 Win=65535 Len=0
1,2.4152959999998984,62.210.85.178,10.0.2.15,TCP,60,9001  >  35978 [ACK] Seq=2712445 Ack=47986269 Win=65535 Len=0
1,2.41533000000004,10.0.2.15,62.210.85.178,TLSv1.2,332,Application Data
1,2.415367999999944,62.210.85.178,10.0.2.15,TCP,60,9001  >  35978 [ACK] Seq=2712445 Ack=47986547 Win=65535 Len=0
1,2.415418000000045,10.0.2.15,62.210.85.178,TLSv1.2,3868,Application Data
1,2.4154550000000654,62.210.85.178,10.0.2.15,TCP,60,9001  >  35978 [ACK] Seq=2712445 Ack=47988007 Win=65535 Len=0
1,2.415461999999934,62.210.85.178,10.0.2.15,TCP,60,9001  >  35978 [ACK] Seq=2712445 Ack=47989467 Win=65535 Len=0
1,2.41546500000004,62.210.85.178,10.0.2.15,TCP,60,9001  >  35978 [ACK] Seq=2712445 Ack=47990361 Win=65535 Len=0
1,2.4155020000000604,10.0.2.15,62.210.85.178,TLSv1.2,1938,Application Data
1,2.4155370000000858,62.210.85.178,10.0.2.15,TCP,60,9001  >  35978 [ACK] Seq=2712445 Ack=47991821 Win=65535 Len=0
1,2.4155430000000706,62.210.85.178,10.0.2.15,TCP,60,9001  >  35978 [ACK] Seq=2712445 Ack=47992245 Win=65535 Len=0
1,2.6478839999999764,54.93.77.70,10.0.2.15,TCP,2950,"9001  >  34692 [PSH, ACK] Seq=47871537 Ack=2721489 Win=65535 Len=2896 [TCP segment of a reassembled PDU]"
1,2.648018000000093,10.0.2.15,54.93.77.70,TCP,54,34692  >  9001 [ACK] Seq=2721489 Ack=47874433 Win=65535 Len=0
1,2.6528849999999693,54.93.77.70,10.0.2.15,TLSv1.2,778,Application Data
1,2.652904000000035,54.93.77.70,10.0.2.15,TCP,2950,"9001  >  34692 [PSH, ACK] Seq=47875157 Ack=2721489 Win=65535 Len=2896 [TCP segment of a reassembled PDU]"
1,2.6529149999998936,54.93.77.70,10.0.2.15,TLSv1.2,5846,"Application Data, Application Data"
1,2.6529749999999694,10.0.2.15,54.93.77.70,TCP,54,34692  >  9001 [ACK] Seq=2721489 Ack=47883845 Win=65535 Len=0
1,2.653415999999879,54.93.77.70,10.0.2.15,TLSv1.2,7294,Application Data [TCP segment of a reassembled PDU]
1,2.6534609999998793,10.0.2.15,54.93.77.70,TCP,54,34692  >  9001 [ACK] Seq=2721489 Ack=47891085 Win=65535 Len=0
1,2.674152000000049,54.93.77.70,10.0.2.15,TLSv1.2,5846,"Application Data, Application Data, Application Data"
1,2.674201000000039,54.93.77.70,10.0.2.15,TCP,1502,"9001  >  34692 [PSH, ACK] Seq=47896877 Ack=2721489 Win=65535 Len=1448 [TCP segment of a reassembled PDU]"
1,2.674254000000019,10.0.2.15,54.93.77.70,TCP,54,34692  >  9001 [ACK] Seq=2721489 Ack=47896877 Win=65535 Len=0
1,2.674353999999994,10.0.2.15,54.93.77.70,TCP,54,34692  >  9001 [ACK] Seq=2721489 Ack=47898325 Win=65535 Len=0
1,2.689231999999947,54.93.77.70,10.0.2.15,TLSv1.2,5846,"Application Data, Application Data"
1,2.689251000000013,54.93.77.70,10.0.2.15,TLSv1.2,5846,Application Data [TCP segment of a reassembled PDU]
1,2.689296999999897,10.0.2.15,54.93.77.70,TCP,54,34692  >  9001 [ACK] Seq=2721489 Ack=47904117 Win=65535 Len=0
1,2.6893780000000334,10.0.2.15,54.93.77.70,TCP,54,34692  >  9001 [ACK] Seq=2721489 Ack=47909909 Win=65535 Len=0
1,2.6895569999999225,10.0.2.15,54.93.77.70,TLSv1.2,590,Application Data
1,2.689626999999973,54.93.77.70,10.0.2.15,TCP,60,9001  >  34692 [ACK] Seq=47909909 Ack=2722025 Win=65535 Len=0
1,2.6898879999998826,54.93.77.70,10.0.2.15,TLSv1.2,1502,Application Data [TCP segment of a reassembled PDU]
1,2.689933999999994,10.0.2.15,54.93.77.70,TCP,54,34692  >  9001 [ACK] Seq=2722025 Ack=47911357 Win=65535 Len=0
1,2.6914480000000367,54.93.77.70,10.0.2.15,TLSv1.2,8574,"Application Data, Application Data, Application Data, Application Data"
1,2.6914990000000216,10.0.2.15,54.93.77.70,TCP,54,34692  >  9001 [ACK] Seq=2722025 Ack=47919877 Win=65535 Len=0
1,2.6915440000000217,54.93.77.70,10.0.2.15,TLSv1.2,2974,"Application Data, Application Data"
1,2.6916459999999915,10.0.2.15,54.93.77.70,TCP,54,34692  >  9001 [ACK] Seq=2722025 Ack=47922797 Win=65535 Len=0
1,2.7010250000000724,10.0.2.15,54.93.77.70,TLSv1.2,590,Application Data
1,2.7011540000000878,54.93.77.70,10.0.2.15,TCP,60,9001  >  34692 [ACK] Seq=47922797 Ack=2722561 Win=65535 Len=0
1,2.7013970000000427,54.93.77.70,10.0.2.15,TLSv1.2,5846,Application Data
1,2.7014619999999923,10.0.2.15,54.93.77.70,TCP,54,34692  >  9001 [ACK] Seq=2722561 Ack=47928589 Win=65535 Len=0
1,2.702160000000049,54.93.77.70,10.0.2.15,TLSv1.2,10190,"Application Data, Application Data"
1,2.7022320000000946,10.0.2.15,54.93.77.70,TCP,54,34692  >  9001 [ACK] Seq=2722561 Ack=47938725 Win=65535 Len=0
1,2.703801999999996,54.93.77.70,10.0.2.15,TLSv1.2,8742,"Application Data, Application Data, Application Data, Application Data"
1,2.703846999999996,10.0.2.15,54.93.77.70,TCP,54,34692  >  9001 [ACK] Seq=2722561 Ack=47947413 Win=65535 Len=0
1,2.705600000000004,54.93.77.70,10.0.2.15,TCP,1502,"9001  >  34692 [PSH, ACK] Seq=47947413 Ack=2722561 Win=65535 Len=1448 [TCP segment of a reassembled PDU]"
1,2.705646999999999,10.0.2.15,54.93.77.70,TCP,54,34692  >  9001 [ACK] Seq=2722561 Ack=47948861 Win=65535 Len=0
1,2.711178999999902,54.93.77.70,10.0.2.15,TLSv1.2,380,Application Data
1,2.714610999999877,10.0.2.15,54.93.77.70,TLSv1.2,590,Application Data
1,2.7147879999999986,54.93.77.70,10.0.2.15,TCP,60,9001  >  34692 [ACK] Seq=47949187 Ack=2723097 Win=65535 Len=0
1,2.7265460000000985,10.0.2.15,54.93.77.70,TLSv1.2,590,Application Data
1,2.7268380000000434,54.93.77.70,10.0.2.15,TCP,60,9001  >  34692 [ACK] Seq=47949187 Ack=2723633 Win=65535 Len=0
1,2.794480999999905,62.210.85.178,10.0.2.15,TLSv1.2,1104,Application Data
1,2.8380010000000766,10.0.2.15,62.210.85.178,TCP,54,35978  >  9001 [ACK] Seq=47992245 Ack=2713495 Win=65535 Len=0
1,3.2732860000000983,62.210.85.178,10.0.2.15,TLSv1.2,1104,Application Data
1,3.2733630000000176,10.0.2.15,62.210.85.178,TCP,54,35978  >  9001 [ACK] Seq=47992245 Ack=2714545 Win=65535 Len=0
1,3.273877999999968,10.0.2.15,62.210.85.178,TLSv1.2,590,Application Data
1,3.2741300000000138,62.210.85.178,10.0.2.15,TCP,60,9001  >  35978 [ACK] Seq=2714545 Ack=47992781 Win=65535 Len=0
1,3.385097000000087,54.93.77.70,10.0.2.15,TLSv1.2,590,Application Data
1,3.385567999999921,10.0.2.15,54.93.77.70,TLSv1.2,590,Application Data
1,3.385717999999997,54.93.77.70,10.0.2.15,TCP,60,9001  >  34692 [ACK] Seq=47949723 Ack=2724169 Win=65535 Len=0
1,3.882609999999886,62.210.85.178,10.0.2.15,TLSv1.2,590,Application Data
1,3.88713400000006,10.0.2.15,62.210.85.178,TLSv1.2,590,Application Data
1,3.8872959999998784,62.210.85.178,10.0.2.15,TCP,60,9001  >  35978 [ACK] Seq=2715081 Ack=47993317 Win=65535 Len=0
1,3.8986090000000786,10.0.2.15,62.210.85.178,TLSv1.2,4124,Application Data
1,3.898723000000018,10.0.2.15,62.210.85.178,TCP,2974,35978  >  9001 [ACK] Seq=47997387 Ack=2715081 Win=65535 Len=2920 [TCP segment of a reassembled PDU]
1,3.898764999999912,62.210.85.178,10.0.2.15,TCP,60,9001  >  35978 [ACK] Seq=2715081 Ack=47994777 Win=65535 Len=0
1,3.898777999999993,62.210.85.178,10.0.2.15,TCP,60,9001  >  35978 [ACK] Seq=2715081 Ack=47996237 Win=65535 Len=0
1,3.898781999999983,62.210.85.178,10.0.2.15,TCP,60,9001  >  35978 [ACK] Seq=2715081 Ack=47997387 Win=65535 Len=0
1,3.898785000000089,62.210.85.178,10.0.2.15,TCP,60,9001  >  35978 [ACK] Seq=2715081 Ack=47998847 Win=65535 Len=0
1,3.898787000000084,62.210.85.178,10.0.2.15,TCP,60,9001  >  35978 [ACK] Seq=2715081 Ack=48000307 Win=65535 Len=0
1,3.898821999999882,10.0.2.15,62.210.85.178,TLSv1.2,1204,Application Data
1,3.8988560000000234,62.210.85.178,10.0.2.15,TCP,60,9001  >  35978 [ACK] Seq=2715081 Ack=48001457 Win=65535 Len=0
1,3.8989039999999022,10.0.2.15,62.210.85.178,TLSv1.2,4124,Application Data
1,3.8989389999999275,62.210.85.178,10.0.2.15,TCP,60,9001  >  35978 [ACK] Seq=2715081 Ack=48002917 Win=65535 Len=0
1,3.8989460000000236,62.210.85.178,10.0.2.15,TCP,60,9001  >  35978 [ACK] Seq=2715081 Ack=48004377 Win=65535 Len=0
1,3.8989500000000135,62.210.85.178,10.0.2.15,TCP,60,9001  >  35978 [ACK] Seq=2715081 Ack=48005527 Win=65535 Len=0
1,3.8989879999999175,10.0.2.15,62.210.85.178,TLSv1.2,4124,Application Data
1,3.899020999999948,62.210.85.178,10.0.2.15,TCP,60,9001  >  35978 [ACK] Seq=2715081 Ack=48006987 Win=65535 Len=0
1,3.899028000000044,62.210.85.178,10.0.2.15,TCP,60,9001  >  35978 [ACK] Seq=2715081 Ack=48008447 Win=65535 Len=0
1,3.8990980000000945,10.0.2.15,62.210.85.178,TLSv1.2,2974,Application Data
1,3.8991349999998874,62.210.85.178,10.0.2.15,TCP,60,9001  >  35978 [ACK] Seq=2715081 Ack=48009597 Win=65535 Len=0
1,3.8991430000000946,62.210.85.178,10.0.2.15,TCP,60,9001  >  35978 [ACK] Seq=2715081 Ack=48011057 Win=65535 Len=0
1,3.8991470000000845,62.210.85.178,10.0.2.15,TCP,60,9001  >  35978 [ACK] Seq=2715081 Ack=48012517 Win=65535 Len=0
1,3.899175000000014,10.0.2.15,62.210.85.178,TLSv1.2,1226,Application Data
1,3.899208000000044,62.210.85.178,10.0.2.15,TCP,60,9001  >  35978 [ACK] Seq=2715081 Ack=48013689 Win=65535 Len=0
1,3.8992470000000594,10.0.2.15,62.210.85.178,TLSv1.2,4124,Application Data
1,3.8992860000000746,62.210.85.178,10.0.2.15,TCP,60,9001  >  35978 [ACK] Seq=2715081 Ack=48015149 Win=65535 Len=0
1,3.8992929999999433,62.210.85.178,10.0.2.15,TCP,60,9001  >  35978 [ACK] Seq=2715081 Ack=48016609 Win=65535 Len=0
1,3.8992960000000494,62.210.85.178,10.0.2.15,TCP,60,9001  >  35978 [ACK] Seq=2715081 Ack=48017759 Win=65535 Len=0
1,3.8993330000000697,10.0.2.15,62.210.85.178,TLSv1.2,3030,Application Data
1,3.899368000000095,62.210.85.178,10.0.2.15,TCP,60,9001  >  35978 [ACK] Seq=2715081 Ack=48019219 Win=65535 Len=0
1,3.8993749999999636,62.210.85.178,10.0.2.15,TCP,60,9001  >  35978 [ACK] Seq=2715081 Ack=48020679 Win=65535 Len=0
1,3.8993780000000697,62.210.85.178,10.0.2.15,TCP,60,9001  >  35978 [ACK] Seq=2715081 Ack=48020735 Win=65535 Len=0
1,3.9085549999999785,10.0.2.15,62.210.85.178,TLSv1.2,4124,Application Data
1,3.9086379999998826,62.210.85.178,10.0.2.15,TCP,60,9001  >  35978 [ACK] Seq=2715081 Ack=48022195 Win=65535 Len=0
1,3.9086469999999736,62.210.85.178,10.0.2.15,TCP,60,9001  >  35978 [ACK] Seq=2715081 Ack=48023655 Win=65535 Len=0
1,3.9086500000000797,62.210.85.178,10.0.2.15,TCP,60,9001  >  35978 [ACK] Seq=2715081 Ack=48024805 Win=65535 Len=0
1,3.9086899999999787,10.0.2.15,62.210.85.178,TLSv1.2,4124,Application Data
1,3.9087480000000596,62.210.85.178,10.0.2.15,TCP,60,9001  >  35978 [ACK] Seq=2715081 Ack=48026265 Win=65535 Len=0
1,3.9087540000000445,62.210.85.178,10.0.2.15,TCP,60,9001  >  35978 [ACK] Seq=2715081 Ack=48027725 Win=65535 Len=0
1,3.908756999999923,62.210.85.178,10.0.2.15,TCP,60,9001  >  35978 [ACK] Seq=2715081 Ack=48028875 Win=65535 Len=0
1,3.9087930000000597,10.0.2.15,62.210.85.178,TLSv1.2,4124,Application Data
1,3.90882600000009,62.210.85.178,10.0.2.15,TCP,60,9001  >  35978 [ACK] Seq=2715081 Ack=48030335 Win=65535 Len=0
1,3.9088329999999587,62.210.85.178,10.0.2.15,TCP,60,9001  >  35978 [ACK] Seq=2715081 Ack=48031795 Win=65535 Len=0
1,3.9088369999999486,62.210.85.178,10.0.2.15,TCP,60,9001  >  35978 [ACK] Seq=2715081 Ack=48032945 Win=65535 Len=0
1,3.90887100000009,10.0.2.15,62.210.85.178,TLSv1.2,782,Application Data
1,3.9089050000000043,62.210.85.178,10.0.2.15,TCP,60,9001  >  35978 [ACK] Seq=2715081 Ack=48033673 Win=65535 Len=0
1,3.9981310000000576,54.93.77.70,10.0.2.15,TLSv1.2,3674,Application Data
1,3.998295999999982,10.0.2.15,54.93.77.70,TCP,54,34692  >  9001 [ACK] Seq=2724169 Ack=47953343 Win=65535 Len=0
1,4.014572999999928,54.93.77.70,10.0.2.15,TLSv1.2,590,Application Data
1,4.017847999999958,54.93.77.70,10.0.2.15,TCP,2950,"9001  >  34692 [PSH, ACK] Seq=47953879 Ack=2724169 Win=65535 Len=2896 [TCP segment of a reassembled PDU]"
1,4.017910000000029,10.0.2.15,54.93.77.70,TCP,54,34692  >  9001 [ACK] Seq=2724169 Ack=47956775 Win=65535 Len=0
1,4.026898000000074,54.93.77.70,10.0.2.15,TLSv1.2,2950,Application Data [TCP segment of a reassembled PDU]
1,4.026943000000074,10.0.2.15,54.93.77.70,TCP,54,34692  >  9001 [ACK] Seq=2724169 Ack=47959671 Win=65535 Len=0
1,4.0274389999999585,54.93.77.70,10.0.2.15,TCP,1502,"9001  >  34692 [PSH, ACK] Seq=47959671 Ack=2724169 Win=65535 Len=1448 [TCP segment of a reassembled PDU]"
1,4.0274839999999585,10.0.2.15,54.93.77.70,TCP,54,34692  >  9001 [ACK] Seq=2724169 Ack=47961119 Win=65535 Len=0
1,4.034139999999979,54.93.77.70,10.0.2.15,TLSv1.2,590,"Application Data, Application Data"
1,4.03432399999997,10.0.2.15,54.93.77.70,TLSv1.2,590,Application Data
1,4.034435999999914,54.93.77.70,10.0.2.15,TCP,60,9001  >  34692 [ACK] Seq=47961655 Ack=2724705 Win=65535 Len=0
1,4.049535999999989,54.93.77.70,10.0.2.15,TLSv1.2,5846,Application Data
1,4.0496089999999185,10.0.2.15,54.93.77.70,TCP,54,34692  >  9001 [ACK] Seq=2724705 Ack=47967447 Win=65535 Len=0
1,4.049719999999979,54.93.77.70,10.0.2.15,TLSv1.2,2950,Application Data [TCP segment of a reassembled PDU]
1,4.049815999999964,10.0.2.15,54.93.77.70,TCP,54,34692  >  9001 [ACK] Seq=2724705 Ack=47970343 Win=65535 Len=0
1,4.050179999999955,54.93.77.70,10.0.2.15,TCP,2950,"9001  >  34692 [PSH, ACK] Seq=47970343 Ack=2724705 Win=65535 Len=2896 [TCP segment of a reassembled PDU]"
1,4.05022299999996,10.0.2.15,54.93.77.70,TCP,54,34692  >  9001 [ACK] Seq=2724705 Ack=47973239 Win=65535 Len=0
1,4.050672999999961,54.93.77.70,10.0.2.15,TLSv1.2,358,Application Data
1,4.059177000000091,54.93.77.70,10.0.2.15,TCP,2950,"9001  >  34692 [PSH, ACK] Seq=47973543 Ack=2724705 Win=65535 Len=2896 [TCP segment of a reassembled PDU]"
1,4.059230999999954,10.0.2.15,54.93.77.70,TCP,54,34692  >  9001 [ACK] Seq=2724705 Ack=47976439 Win=65535 Len=0
1,4.06005899999991,54.93.77.70,10.0.2.15,TLSv1.2,5846,"Application Data, Application Data"
1,4.060122999999976,10.0.2.15,54.93.77.70,TCP,54,34692  >  9001 [ACK] Seq=2724705 Ack=47982231 Win=65535 Len=0
1,4.060312000000067,10.0.2.15,54.93.77.70,TLSv1.2,590,Application Data
1,4.060410999999931,54.93.77.70,10.0.2.15,TCP,60,9001  >  34692 [ACK] Seq=47982231 Ack=2725241 Win=65535 Len=0
1,4.070447999999942,54.93.77.70,10.0.2.15,TLSv1.2,2950,Application Data [TCP segment of a reassembled PDU]
1,4.070504000000028,10.0.2.15,54.93.77.70,TCP,54,34692  >  9001 [ACK] Seq=2725241 Ack=47985127 Win=65535 Len=0
1,4.071232999999893,54.93.77.70,10.0.2.15,TLSv1.2,4398,Application Data [TCP segment of a reassembled PDU]
1,4.07130200000006,10.0.2.15,54.93.77.70,TCP,54,34692  >  9001 [ACK] Seq=2725241 Ack=47989471 Win=65535 Len=0
1,4.0765409999999065,54.93.77.70,10.0.2.15,TLSv1.2,684,Application Data
1,4.077876999999944,10.0.2.15,54.93.77.70,TLSv1.2,590,Application Data
1,4.0779929999998785,54.93.77.70,10.0.2.15,TCP,60,9001  >  34692 [ACK] Seq=47990101 Ack=2725777 Win=65535 Len=0
1,4.08723800000007,10.0.2.15,54.93.77.70,TLSv1.2,590,Application Data
1,4.08745799999997,54.93.77.70,10.0.2.15,TCP,60,9001  >  34692 [ACK] Seq=47990101 Ack=2726313 Win=65535 Len=0
1,4.09423599999991,54.93.77.70,10.0.2.15,TLSv1.2,590,Application Data
1,4.1368660000000546,62.210.85.178,10.0.2.15,TLSv1.2,590,Application Data
1,4.137956000000031,10.0.2.15,54.93.77.70,TCP,54,34692  >  9001 [ACK] Seq=2726313 Ack=47990637 Win=65535 Len=0
1,4.166987999999947,62.210.85.178,10.0.2.15,TLSv1.2,590,Application Data
1,4.167077999999947,10.0.2.15,62.210.85.178,TCP,54,35978  >  9001 [ACK] Seq=48033673 Ack=2716153 Win=65535 Len=0
1,4.261214999999993,62.210.85.178,10.0.2.15,TLSv1.2,590,Application Data
1,4.296910999999909,62.210.85.178,10.0.2.15,TLSv1.2,590,Application Data
1,4.296978000000081,10.0.2.15,62.210.85.178,TCP,54,35978  >  9001 [ACK] Seq=48033673 Ack=2717225 Win=65535 Len=0
1,4.29724299999998,10.0.2.15,62.210.85.178,TLSv1.2,590,Application Data
1,4.2973259999998845,62.210.85.178,10.0.2.15,TCP,60,9001  >  35978 [ACK] Seq=2717225 Ack=48034209 Win=65535 Len=0
1,4.496822999999949,54.93.77.70,10.0.2.15,TLSv1.2,590,Application Data
1,4.496902000000091,10.0.2.15,54.93.77.70,TCP,54,34692  >  9001 [ACK] Seq=2726313 Ack=47991173 Win=65535 Len=0
1,4.49726499999997,10.0.2.15,54.93.77.70,TLSv1.2,590,Application Data
1,4.4973829999999,54.93.77.70,10.0.2.15,TCP,60,9001  >  34692 [ACK] Seq=47991173 Ack=2726849 Win=65535 Len=0
1,4.5979399999998805,62.210.85.178,10.0.2.15,TLSv1.2,590,Application Data
1,4.600914999999986,10.0.2.15,62.210.85.178,TLSv1.2,590,Application Data
1,4.601067999999941,62.210.85.178,10.0.2.15,TCP,60,9001  >  35978 [ACK] Seq=2717761 Ack=48034745 Win=65535 Len=0
1,4.610582999999906,10.0.2.15,62.210.85.178,TLSv1.2,3160,Application Data
1,4.610715000000027,62.210.85.178,10.0.2.15,TCP,60,9001  >  35978 [ACK] Seq=2717761 Ack=48036205 Win=65535 Len=0
1,4.610729999999876,62.210.85.178,10.0.2.15,TCP,60,9001  >  35978 [ACK] Seq=2717761 Ack=48037665 Win=65535 Len=0
1,4.610734000000093,62.210.85.178,10.0.2.15,TCP,60,9001  >  35978 [ACK] Seq=2717761 Ack=48037851 Win=65535 Len=0
1,4.708658000000014,54.93.77.70,10.0.2.15,TLSv1.2,3674,Application Data
1,4.7087759999999435,10.0.2.15,54.93.77.70,TCP,54,34692  >  9001 [ACK] Seq=2726849 Ack=47994793 Win=65535 Len=0
1,4.7112509999999475,10.0.2.15,54.93.77.70,TLSv1.2,590,Application Data
1,4.711403000000018,54.93.77.70,10.0.2.15,TCP,60,9001  >  34692 [ACK] Seq=47994793 Ack=2727385 Win=65535 Len=0
1,4.820306000000073,62.210.85.178,10.0.2.15,TLSv1.2,590,Application Data
1,4.8206239999999525,10.0.2.15,62.210.85.178,TLSv1.2,590,Application Data
1,4.8207270000000335,62.210.85.178,10.0.2.15,TCP,60,9001  >  35978 [ACK] Seq=2718297 Ack=48038387 Win=65535 Len=0
1,4.954001999999946,54.93.77.70,10.0.2.15,TLSv1.2,590,Application Data
1,4.954430000000002,10.0.2.15,54.93.77.70,TLSv1.2,590,Application Data
1,4.954531999999972,54.93.77.70,10.0.2.15,TCP,60,9001  >  34692 [ACK] Seq=47995329 Ack=2727921 Win=65535 Len=0
1,5.067080000000033,62.210.85.178,10.0.2.15,TLSv1.2,590,Application Data
1,5.071684000000005,10.0.2.15,62.210.85.178,TLSv1.2,590,Application Data
1,5.071832000000086,62.210.85.178,10.0.2.15,TCP,60,9001  >  35978 [ACK] Seq=2718833 Ack=48038923 Win=65535 Len=0
1,5.083165999999892,10.0.2.15,62.210.85.178,TLSv1.2,4124,Application Data
1,5.083260999999993,10.0.2.15,62.210.85.178,TCP,2974,35978  >  9001 [ACK] Seq=48042993 Ack=2718833 Win=65535 Len=2920 [TCP segment of a reassembled PDU]
1,5.083302999999887,62.210.85.178,10.0.2.15,TCP,60,9001  >  35978 [ACK] Seq=2718833 Ack=48040383 Win=65535 Len=0
1,5.083313000000089,62.210.85.178,10.0.2.15,TCP,60,9001  >  35978 [ACK] Seq=2718833 Ack=48041843 Win=65535 Len=0
1,5.083315999999968,62.210.85.178,10.0.2.15,TCP,60,9001  >  35978 [ACK] Seq=2718833 Ack=48042993 Win=65535 Len=0
1,5.083319000000074,62.210.85.178,10.0.2.15,TCP,60,9001  >  35978 [ACK] Seq=2718833 Ack=48044453 Win=65535 Len=0
1,5.083321999999953,62.210.85.178,10.0.2.15,TCP,60,9001  >  35978 [ACK] Seq=2718833 Ack=48045913 Win=65535 Len=0
1,5.083354999999983,10.0.2.15,62.210.85.178,TLSv1.2,1204,Application Data
1,5.083388999999897,62.210.85.178,10.0.2.15,TCP,60,9001  >  35978 [ACK] Seq=2718833 Ack=48047063 Win=65535 Len=0
1,5.083433999999897,10.0.2.15,62.210.85.178,TLSv1.2,4124,Application Data
1,5.083468000000039,62.210.85.178,10.0.2.15,TCP,60,9001  >  35978 [ACK] Seq=2718833 Ack=48048523 Win=65535 Len=0
1,5.0834769999999025,62.210.85.178,10.0.2.15,TCP,60,9001  >  35978 [ACK] Seq=2718833 Ack=48049983 Win=65535 Len=0
1,5.0834809999998924,62.210.85.178,10.0.2.15,TCP,60,9001  >  35978 [ACK] Seq=2718833 Ack=48051133 Win=65535 Len=0
1,5.083519999999908,10.0.2.15,62.210.85.178,TLSv1.2,4124,Application Data
1,5.083552999999938,62.210.85.178,10.0.2.15,TCP,60,9001  >  35978 [ACK] Seq=2718833 Ack=48052593 Win=65535 Len=0
1,5.083560000000034,62.210.85.178,10.0.2.15,TCP,60,9001  >  35978 [ACK] Seq=2718833 Ack=48054053 Win=65535 Len=0
1,5.083615999999893,10.0.2.15,62.210.85.178,TLSv1.2,2974,Application Data
1,5.083652000000029,62.210.85.178,10.0.2.15,TCP,60,9001  >  35978 [ACK] Seq=2718833 Ack=48055203 Win=65535 Len=0
1,5.083658999999898,62.210.85.178,10.0.2.15,TCP,60,9001  >  35978 [ACK] Seq=2718833 Ack=48056663 Win=65535 Len=0
1,5.083662999999888,62.210.85.178,10.0.2.15,TCP,60,9001  >  35978 [ACK] Seq=2718833 Ack=48058123 Win=65535 Len=0
1,5.083689999999933,10.0.2.15,62.210.85.178,TLSv1.2,1226,Application Data
1,5.083722999999964,62.210.85.178,10.0.2.15,TCP,60,9001  >  35978 [ACK] Seq=2718833 Ack=48059295 Win=65535 Len=0
1,5.083761999999979,10.0.2.15,62.210.85.178,TLSv1.2,4124,Application Data
1,5.083797000000004,62.210.85.178,10.0.2.15,TCP,60,9001  >  35978 [ACK] Seq=2718833 Ack=48060755 Win=65535 Len=0
1,5.083802999999989,62.210.85.178,10.0.2.15,TCP,60,9001  >  35978 [ACK] Seq=2718833 Ack=48062215 Win=65535 Len=0
1,5.083806000000095,62.210.85.178,10.0.2.15,TCP,60,9001  >  35978 [ACK] Seq=2718833 Ack=48063365 Win=65535 Len=0
1,5.083842000000004,10.0.2.15,62.210.85.178,TLSv1.2,3030,Application Data
1,5.083881000000019,62.210.85.178,10.0.2.15,TCP,60,9001  >  35978 [ACK] Seq=2718833 Ack=48064825 Win=65535 Len=0
1,5.083889999999883,62.210.85.178,10.0.2.15,TCP,60,9001  >  35978 [ACK] Seq=2718833 Ack=48066285 Win=65535 Len=0
1,5.0838940000001,62.210.85.178,10.0.2.15,TCP,60,9001  >  35978 [ACK] Seq=2718833 Ack=48066341 Win=65535 Len=0
1,5.094204999999874,10.0.2.15,62.210.85.178,TLSv1.2,2646,Application Data
1,5.0942549999999756,62.210.85.178,10.0.2.15,TCP,60,9001  >  35978 [ACK] Seq=2718833 Ack=48067801 Win=65535 Len=0
1,5.09426499999995,62.210.85.178,10.0.2.15,TCP,60,9001  >  35978 [ACK] Seq=2718833 Ack=48068933 Win=65535 Len=0
1,5.212762999999995,54.93.77.70,10.0.2.15,TLSv1.2,3674,Application Data
1,5.212872999999945,10.0.2.15,54.93.77.70,TCP,54,34692  >  9001 [ACK] Seq=2727921 Ack=47998949 Win=65535 Len=0
1,5.22239599999989,54.93.77.70,10.0.2.15,TCP,2950,"9001  >  34692 [PSH, ACK] Seq=47998949 Ack=2727921 Win=65535 Len=2896 [TCP segment of a reassembled PDU]"
1,5.22246999999993,10.0.2.15,54.93.77.70,TCP,54,34692  >  9001 [ACK] Seq=2727921 Ack=48001845 Win=65535 Len=0
1,5.223085000000083,54.93.77.70,10.0.2.15,TLSv1.2,4398,Application Data [TCP segment of a reassembled PDU]
1,5.223150000000032,10.0.2.15,54.93.77.70,TCP,54,34692  >  9001 [ACK] Seq=2727921 Ack=48006189 Win=65535 Len=0
1,5.246286999999938,54.93.77.70,10.0.2.15,TLSv1.2,4912,"Application Data, Application Data"
1,5.24633300000005,54.93.77.70,10.0.2.15,TLSv1.2,5846,Application Data [TCP segment of a reassembled PDU]
1,5.246396000000004,10.0.2.15,54.93.77.70,TCP,54,34692  >  9001 [ACK] Seq=2727921 Ack=48011047 Win=65535 Len=0
1,5.24649700000009,10.0.2.15,54.93.77.70,TCP,54,34692  >  9001 [ACK] Seq=2727921 Ack=48016839 Win=65535 Len=0
1,5.246808999999985,10.0.2.15,54.93.77.70,TLSv1.2,590,Application Data
1,5.246883000000025,54.93.77.70,10.0.2.15,TCP,60,9001  >  34692 [ACK] Seq=48016839 Ack=2728457 Win=65535 Len=0
1,5.260213000000022,54.93.77.70,10.0.2.15,TLSv1.2,5846,Application Data [TCP segment of a reassembled PDU]
1,5.260281999999961,10.0.2.15,54.93.77.70,TCP,54,34692  >  9001 [ACK] Seq=2728457 Ack=48022631 Win=65535 Len=0
1,5.262925999999879,54.93.77.70,10.0.2.15,TLSv1.2,1220,"Application Data, Application Data, Application Data"
1,5.263087000000041,10.0.2.15,54.93.77.70,TLSv1.2,590,Application Data
1,5.26317599999993,54.93.77.70,10.0.2.15,TCP,60,9001  >  34692 [ACK] Seq=48023797 Ack=2728993 Win=65535 Len=0
1,5.26642599999991,54.93.77.70,10.0.2.15,TCP,1502,"9001  >  34692 [PSH, ACK] Seq=48023797 Ack=2728993 Win=65535 Len=1448 [TCP segment of a reassembled PDU]"
1,5.2664689999999155,10.0.2.15,54.93.77.70,TCP,54,34692  >  9001 [ACK] Seq=2728993 Ack=48025245 Win=65535 Len=0
1,5.281925000000001,54.93.77.70,10.0.2.15,TLSv1.2,684,Application Data
1,5.28430000000003,10.0.2.15,54.93.77.70,TLSv1.2,590,Application Data
1,5.284448999999995,54.93.77.70,10.0.2.15,TCP,60,9001  >  34692 [ACK] Seq=48025875 Ack=2729529 Win=65535 Len=0
1,5.35396199999991,62.210.85.178,10.0.2.15,TLSv1.2,590,Application Data
1,5.398007999999891,10.0.2.15,62.210.85.178,TCP,54,35978  >  9001 [ACK] Seq=48068933 Ack=2719369 Win=65535 Len=0
1,5.521326000000045,62.210.85.178,10.0.2.15,TLSv1.2,1104,Application Data
1,5.521404000000075,10.0.2.15,62.210.85.178,TCP,54,35978  >  9001 [ACK] Seq=48068933 Ack=2720419 Win=65535 Len=0
1,5.521702999999889,10.0.2.15,62.210.85.178,TLSv1.2,590,Application Data
1,5.521794,62.210.85.178,10.0.2.15,TCP,60,9001  >  35978 [ACK] Seq=2720419 Ack=48069469 Win=65535 Len=0
1,5.726208999999926,54.93.77.70,10.0.2.15,TLSv1.2,590,Application Data
1,5.726674000000003,10.0.2.15,54.93.77.70,TLSv1.2,590,Application Data
1,5.726818999999978,54.93.77.70,10.0.2.15,TCP,60,9001  >  34692 [ACK] Seq=48026411 Ack=2730065 Win=65535 Len=0
1,5.824305000000095,62.210.85.178,10.0.2.15,TLSv1.2,590,Application Data
1,5.828698000000031,10.0.2.15,62.210.85.178,TLSv1.2,590,Application Data
1,5.828893999999991,62.210.85.178,10.0.2.15,TCP,60,9001  >  35978 [ACK] Seq=2720955 Ack=48070005 Win=65535 Len=0
1,5.838878000000022,10.0.2.15,62.210.85.178,TLSv1.2,4124,Application Data
1,5.839030000000093,62.210.85.178,10.0.2.15,TCP,60,9001  >  35978 [ACK] Seq=2720955 Ack=48071465 Win=65535 Len=0
1,5.839052999999922,62.210.85.178,10.0.2.15,TCP,60,9001  >  35978 [ACK] Seq=2720955 Ack=48072925 Win=65535 Len=0
1,5.8390589999999065,62.210.85.178,10.0.2.15,TCP,60,9001  >  35978 [ACK] Seq=2720955 Ack=48074075 Win=65535 Len=0
1,5.839099999999917,10.0.2.15,62.210.85.178,TCP,2974,35978  >  9001 [ACK] Seq=48074075 Ack=2720955 Win=65535 Len=2920 [TCP segment of a reassembled PDU]
1,5.839629999999943,62.210.85.178,10.0.2.15,TCP,60,9001  >  35978 [ACK] Seq=2720955 Ack=48075535 Win=65535 Len=0
1,5.839643000000024,62.210.85.178,10.0.2.15,TCP,60,9001  >  35978 [ACK] Seq=2720955 Ack=48076995 Win=65535 Len=0
1,5.839715999999953,10.0.2.15,62.210.85.178,TLSv1.2,1204,Application Data
1,5.839778999999908,62.210.85.178,10.0.2.15,TCP,60,9001  >  35978 [ACK] Seq=2720955 Ack=48078145 Win=65535 Len=0
1,5.839856999999938,10.0.2.15,62.210.85.178,TLSv1.2,4124,Application Data
1,5.83994000000007,62.210.85.178,10.0.2.15,TCP,60,9001  >  35978 [ACK] Seq=2720955 Ack=48079605 Win=65535 Len=0
1,5.839948000000049,62.210.85.178,10.0.2.15,TCP,60,9001  >  35978 [ACK] Seq=2720955 Ack=48081065 Win=65535 Len=0
1,5.839952999999923,62.210.85.178,10.0.2.15,TCP,60,9001  >  35978 [ACK] Seq=2720955 Ack=48082215 Win=65535 Len=0
1,5.8399930000000495,10.0.2.15,62.210.85.178,TLSv1.2,2324,Application Data
1,5.840093999999908,62.210.85.178,10.0.2.15,TCP,60,9001  >  35978 [ACK] Seq=2720955 Ack=48083675 Win=65535 Len=0
1,5.840101999999888,62.210.85.178,10.0.2.15,TCP,60,9001  >  35978 [ACK] Seq=2720955 Ack=48084485 Win=65535 Len=0
1,6.009229999999889,54.93.77.70,10.0.2.15,TCP,2950,"9001  >  34692 [PSH, ACK] Seq=48026411 Ack=2730065 Win=65535 Len=2896 [TCP segment of a reassembled PDU]"
1,6.009399999999914,10.0.2.15,54.93.77.70,TCP,54,34692  >  9001 [ACK] Seq=2730065 Ack=48029307 Win=65535 Len=0
1,6.011259999999993,54.93.77.70,10.0.2.15,TLSv1.2,778,Application Data
1,6.012654999999995,54.93.77.70,10.0.2.15,TLSv1.2,7294,Application Data
1,6.012899999999945,54.93.77.70,10.0.2.15,TLSv1.2,2950,Application Data [TCP segment of a reassembled PDU]
1,6.0130529999999,10.0.2.15,54.93.77.70,TCP,54,34692  >  9001 [ACK] Seq=2730065 Ack=48040167 Win=65535 Len=0
1,6.030140000000074,54.93.77.70,10.0.2.15,TLSv1.2,1292,Application Data
1,6.032553000000007,10.0.2.15,54.93.77.70,TLSv1.2,590,Application Data
1,6.032727000000023,54.93.77.70,10.0.2.15,TCP,60,9001  >  34692 [ACK] Seq=48041405 Ack=2730601 Win=65535 Len=0
1,6.160368999999946,62.210.85.178,10.0.2.15,TLSv1.2,590,Application Data
1,6.1611780000000635,10.0.2.15,62.210.85.178,TLSv1.2,590,Application Data
1,6.161366000000044,62.210.85.178,10.0.2.15,TCP,60,9001  >  35978 [ACK] Seq=2721491 Ack=48085021 Win=65535 Len=0
1,6.303417999999965,54.93.77.70,10.0.2.15,TLSv1.2,590,Application Data
1,6.30379999999991,10.0.2.15,54.93.77.70,TLSv1.2,590,Application Data
1,6.303908000000092,54.93.77.70,10.0.2.15,TCP,60,9001  >  34692 [ACK] Seq=48041941 Ack=2731137 Win=65535 Len=0
1,6.462810999999874,62.210.85.178,10.0.2.15,TLSv1.2,590,Application Data
1,6.468638000000055,10.0.2.15,62.210.85.178,TLSv1.2,590,Application Data
1,6.468804999999975,62.210.85.178,10.0.2.15,TCP,60,9001  >  35978 [ACK] Seq=2722027 Ack=48085557 Win=65535 Len=0
1,6.479025999999976,10.0.2.15,62.210.85.178,TLSv1.2,4124,Application Data
1,6.479152999999997,10.0.2.15,62.210.85.178,TCP,2974,35978  >  9001 [ACK] Seq=48089627 Ack=2722027 Win=65535 Len=2920 [TCP segment of a reassembled PDU]
1,6.4791969999998855,62.210.85.178,10.0.2.15,TCP,60,9001  >  35978 [ACK] Seq=2722027 Ack=48087017 Win=65535 Len=0
1,6.4792110000000775,62.210.85.178,10.0.2.15,TCP,60,9001  >  35978 [ACK] Seq=2722027 Ack=48088477 Win=65535 Len=0
1,6.479215999999951,62.210.85.178,10.0.2.15,TCP,60,9001  >  35978 [ACK] Seq=2722027 Ack=48089627 Win=65535 Len=0
1,6.479219999999941,62.210.85.178,10.0.2.15,TCP,60,9001  >  35978 [ACK] Seq=2722027 Ack=48091087 Win=65535 Len=0
1,6.479223000000047,62.210.85.178,10.0.2.15,TCP,60,9001  >  35978 [ACK] Seq=2722027 Ack=48092547 Win=65535 Len=0
1,6.4792620000000625,10.0.2.15,62.210.85.178,TLSv1.2,1204,Application Data
1,6.479311999999936,62.210.85.178,10.0.2.15,TCP,60,9001  >  35978 [ACK] Seq=2722027 Ack=48093697 Win=65535 Len=0
1,6.4793560000000525,10.0.2.15,62.210.85.178,TLSv1.2,4124,Application Data
1,6.479424999999992,62.210.85.178,10.0.2.15,TCP,60,9001  >  35978 [ACK] Seq=2722027 Ack=48095157 Win=65535 Len=0
1,6.479436000000078,62.210.85.178,10.0.2.15,TCP,60,9001  >  35978 [ACK] Seq=2722027 Ack=48096617 Win=65535 Len=0
1,6.479438999999957,62.210.85.178,10.0.2.15,TCP,60,9001  >  35978 [ACK] Seq=2722027 Ack=48097767 Win=65535 Len=0
1,6.479487999999947,10.0.2.15,62.210.85.178,TLSv1.2,4124,Application Data
1,6.479554999999891,62.210.85.178,10.0.2.15,TCP,60,9001  >  35978 [ACK] Seq=2722027 Ack=48099227 Win=65535 Len=0
1,6.479565999999977,62.210.85.178,10.0.2.15,TCP,60,9001  >  35978 [ACK] Seq=2722027 Ack=48100687 Win=65535 Len=0
1,6.479569000000083,62.210.85.178,10.0.2.15,TCP,60,9001  >  35978 [ACK] Seq=2722027 Ack=48101837 Win=65535 Len=0
1,6.479614999999967,10.0.2.15,62.210.85.178,TLSv1.2,332,Application Data
1,6.479657999999972,62.210.85.178,10.0.2.15,TCP,60,9001  >  35978 [ACK] Seq=2722027 Ack=48102115 Win=65535 Len=0
1,6.479720000000043,10.0.2.15,62.210.85.178,TLSv1.2,3868,Application Data
1,6.479761000000053,62.210.85.178,10.0.2.15,TCP,60,9001  >  35978 [ACK] Seq=2722027 Ack=48103575 Win=65535 Len=0
1,6.479767999999922,62.210.85.178,10.0.2.15,TCP,60,9001  >  35978 [ACK] Seq=2722027 Ack=48105035 Win=65535 Len=0
1,6.479771999999912,62.210.85.178,10.0.2.15,TCP,60,9001  >  35978 [ACK] Seq=2722027 Ack=48105929 Win=65535 Len=0
1,6.479810999999927,10.0.2.15,62.210.85.178,TLSv1.2,4124,Application Data
1,6.479847999999947,62.210.85.178,10.0.2.15,TCP,60,9001  >  35978 [ACK] Seq=2722027 Ack=48107389 Win=65535 Len=0
1,6.479857000000038,62.210.85.178,10.0.2.15,TCP,60,9001  >  35978 [ACK] Seq=2722027 Ack=48108849 Win=65535 Len=0
1,6.479861000000028,62.210.85.178,10.0.2.15,TCP,60,9001  >  35978 [ACK] Seq=2722027 Ack=48109999 Win=65535 Len=0
1,6.479898000000048,10.0.2.15,62.210.85.178,TLSv1.2,3030,Application Data
1,6.479935000000069,62.210.85.178,10.0.2.15,TCP,60,9001  >  35978 [ACK] Seq=2722027 Ack=48111459 Win=65535 Len=0
1,6.479943000000048,62.210.85.178,10.0.2.15,TCP,60,9001  >  35978 [ACK] Seq=2722027 Ack=48112919 Win=65535 Len=0
1,6.479947999999922,62.210.85.178,10.0.2.15,TCP,60,9001  >  35978 [ACK] Seq=2722027 Ack=48112975 Win=65535 Len=0
1,6.489166999999952,10.0.2.15,62.210.85.178,TLSv1.2,4124,Application Data
1,6.489262000000053,62.210.85.178,10.0.2.15,TCP,60,9001  >  35978 [ACK] Seq=2722027 Ack=48114435 Win=65535 Len=0
1,6.489270999999917,62.210.85.178,10.0.2.15,TCP,60,9001  >  35978 [ACK] Seq=2722027 Ack=48115895 Win=65535 Len=0
1,6.489274000000023,62.210.85.178,10.0.2.15,TCP,60,9001  >  35978 [ACK] Seq=2722027 Ack=48117045 Win=65535 Len=0
1,6.489313000000038,10.0.2.15,62.210.85.178,TLSv1.2,4124,Application Data
1,6.489376999999877,62.210.85.178,10.0.2.15,TCP,60,9001  >  35978 [ACK] Seq=2722027 Ack=48118505 Win=65535 Len=0
1,6.489383999999973,62.210.85.178,10.0.2.15,TCP,60,9001  >  35978 [ACK] Seq=2722027 Ack=48119965 Win=65535 Len=0
1,6.489387000000079,62.210.85.178,10.0.2.15,TCP,60,9001  >  35978 [ACK] Seq=2722027 Ack=48121115 Win=65535 Len=0
1,6.489424000000099,10.0.2.15,62.210.85.178,TLSv1.2,4124,Application Data
1,6.489462000000003,62.210.85.178,10.0.2.15,TCP,60,9001  >  35978 [ACK] Seq=2722027 Ack=48122575 Win=65535 Len=0
1,6.489469999999983,62.210.85.178,10.0.2.15,TCP,60,9001  >  35978 [ACK] Seq=2722027 Ack=48124035 Win=65535 Len=0
1,6.489475000000084,62.210.85.178,10.0.2.15,TCP,60,9001  >  35978 [ACK] Seq=2722027 Ack=48125185 Win=65535 Len=0
1,6.489511999999877,10.0.2.15,62.210.85.178,TLSv1.2,4124,Application Data
1,6.489550999999892,62.210.85.178,10.0.2.15,TCP,60,9001  >  35978 [ACK] Seq=2722027 Ack=48126645 Win=65535 Len=0
1,6.489559000000099,62.210.85.178,10.0.2.15,TCP,60,9001  >  35978 [ACK] Seq=2722027 Ack=48128105 Win=65535 Len=0
1,6.489563000000089,62.210.85.178,10.0.2.15,TCP,60,9001  >  35978 [ACK] Seq=2722027 Ack=48129255 Win=65535 Len=0
1,6.489597999999887,10.0.2.15,62.210.85.178,TLSv1.2,332,Application Data
1,6.489636000000019,62.210.85.178,10.0.2.15,TCP,60,9001  >  35978 [ACK] Seq=2722027 Ack=48129533 Win=65535 Len=0
1,6.489687999999887,10.0.2.15,62.210.85.178,TLSv1.2,3868,Application Data
1,6.489728000000014,62.210.85.178,10.0.2.15,TCP,60,9001  >  35978 [ACK] Seq=2722027 Ack=48130993 Win=65535 Len=0
1,6.4897359999999935,62.210.85.178,10.0.2.15,TCP,60,9001  >  35978 [ACK] Seq=2722027 Ack=48132453 Win=65535 Len=0
1,6.489739999999983,62.210.85.178,10.0.2.15,TCP,60,9001  >  35978 [ACK] Seq=2722027 Ack=48133347 Win=65535 Len=0
1,6.4897779999998875,10.0.2.15,62.210.85.178,TLSv1.2,4124,Application Data
1,6.489816000000019,62.210.85.178,10.0.2.15,TCP,60,9001  >  35978 [ACK] Seq=2722027 Ack=48134807 Win=65535 Len=0
1,6.489823999999999,62.210.85.178,10.0.2.15,TCP,60,9001  >  35978 [ACK] Seq=2722027 Ack=48136267 Win=65535 Len=0
1,6.489827999999989,62.210.85.178,10.0.2.15,TCP,60,9001  >  35978 [ACK] Seq=2722027 Ack=48137417 Win=65535 Len=0
1,6.489865000000009,10.0.2.15,62.210.85.178,TLSv1.2,3030,Application Data
1,6.489910999999893,62.210.85.178,10.0.2.15,TCP,60,9001  >  35978 [ACK] Seq=2722027 Ack=48138877 Win=65535 Len=0
1,6.489916999999878,62.210.85.178,10.0.2.15,TCP,60,9001  >  35978 [ACK] Seq=2722027 Ack=48140337 Win=65535 Len=0
1,6.489919999999984,62.210.85.178,10.0.2.15,TCP,60,9001  >  35978 [ACK] Seq=2722027 Ack=48140393 Win=65535 Len=0
1,6.502471999999898,10.0.2.15,62.210.85.178,TLSv1.2,4124,Application Data
1,6.502561000000014,62.210.85.178,10.0.2.15,TCP,60,9001  >  35978 [ACK] Seq=2722027 Ack=48141853 Win=65535 Len=0
1,6.502569999999878,62.210.85.178,10.0.2.15,TCP,60,9001  >  35978 [ACK] Seq=2722027 Ack=48143313 Win=65535 Len=0
1,6.502572999999984,62.210.85.178,10.0.2.15,TCP,60,9001  >  35978 [ACK] Seq=2722027 Ack=48144463 Win=65535 Len=0
1,6.502612999999883,10.0.2.15,62.210.85.178,TLSv1.2,4124,Application Data
1,6.502653000000009,62.210.85.178,10.0.2.15,TCP,60,9001  >  35978 [ACK] Seq=2722027 Ack=48145923 Win=65535 Len=0
1,6.5026620000001,62.210.85.178,10.0.2.15,TCP,60,9001  >  35978 [ACK] Seq=2722027 Ack=48147383 Win=65535 Len=0
1,6.50266600000009,62.210.85.178,10.0.2.15,TCP,60,9001  >  35978 [ACK] Seq=2722027 Ack=48148533 Win=65535 Len=0
1,6.502703999999994,10.0.2.15,62.210.85.178,TLSv1.2,4124,Application Data
1,6.5027430000000095,62.210.85.178,10.0.2.15,TCP,60,9001  >  35978 [ACK] Seq=2722027 Ack=48149993 Win=65535 Len=0
1,6.502750999999989,62.210.85.178,10.0.2.15,TCP,60,9001  >  35978 [ACK] Seq=2722027 Ack=48151453 Win=65535 Len=0
1,6.50275600000009,62.210.85.178,10.0.2.15,TCP,60,9001  >  35978 [ACK] Seq=2722027 Ack=48152603 Win=65535 Len=0
1,6.502793999999994,10.0.2.15,62.210.85.178,TLSv1.2,268,Application Data
1,6.502831000000015,62.210.85.178,10.0.2.15,TCP,60,9001  >  35978 [ACK] Seq=2722027 Ack=48152817 Win=65535 Len=0
1,6.62230999999997,54.93.77.70,10.0.2.15,TCP,2950,"9001  >  34692 [PSH, ACK] Seq=48041941 Ack=2731137 Win=65535 Len=2896 [TCP segment of a reassembled PDU]"
1,6.62245299999995,10.0.2.15,54.93.77.70,TCP,54,34692  >  9001 [ACK] Seq=2731137 Ack=48044837 Win=65535 Len=0
1,6.627524999999878,54.93.77.70,10.0.2.15,TLSv1.2,778,Application Data
1,6.627545000000055,54.93.77.70,10.0.2.15,TCP,2950,"9001  >  34692 [PSH, ACK] Seq=48045561 Ack=2731137 Win=65535 Len=2896 [TCP segment of a reassembled PDU]"
1,6.627610000000004,10.0.2.15,54.93.77.70,TCP,54,34692  >  9001 [ACK] Seq=2731137 Ack=48048457 Win=65535 Len=0
1,6.628627999999935,54.93.77.70,10.0.2.15,TLSv1.2,1502,Application Data [TCP segment of a reassembled PDU]
1,6.62867899999992,10.0.2.15,54.93.77.70,TCP,54,34692  >  9001 [ACK] Seq=2731137 Ack=48049905 Win=65535 Len=0
1,6.645027999999911,54.93.77.70,10.0.2.15,TLSv1.2,380,Application Data
1,6.685993999999937,10.0.2.15,54.93.77.70,TCP,54,34692  >  9001 [ACK] Seq=2731137 Ack=48050231 Win=65535 Len=0
1,6.785131999999976,54.93.77.70,10.0.2.15,TLSv1.2,14254,"Application Data, Application Data, Application Data"
1,6.7852069999999,10.0.2.15,54.93.77.70,TCP,54,34692  >  9001 [ACK] Seq=2731137 Ack=48064431 Win=65535 Len=0
1,6.785262999999986,54.93.77.70,10.0.2.15,TCP,848,"9001  >  34692 [PSH, ACK] Seq=48064431 Ack=2731137 Win=65535 Len=794 [TCP segment of a reassembled PDU]"
1,6.7853000000000065,10.0.2.15,54.93.77.70,TCP,54,34692  >  9001 [ACK] Seq=2731137 Ack=48065225 Win=65535 Len=0
1,6.917243999999982,54.93.77.70,10.0.2.15,TLSv1.2,1502,Application Data [TCP segment of a reassembled PDU]
1,6.9173359999999775,10.0.2.15,54.93.77.70,TCP,54,34692  >  9001 [ACK] Seq=2731137 Ack=48066673 Win=65535 Len=0
1,6.92231599999991,54.93.77.70,10.0.2.15,TCP,1502,"9001  >  34692 [PSH, ACK] Seq=48066673 Ack=2731137 Win=65535 Len=1448 [TCP segment of a reassembled PDU]"
1,6.9223420000000715,54.93.77.70,10.0.2.15,TLSv1.2,5846,Application Data [TCP segment of a reassembled PDU]
1,6.922346999999945,54.93.77.70,10.0.2.15,TLSv1.2,4398,"Application Data, Application Data"
1,6.92238999999995,10.0.2.15,54.93.77.70,TCP,54,34692  >  9001 [ACK] Seq=2731137 Ack=48068121 Win=65535 Len=0
1,6.9224380000000565,10.0.2.15,54.93.77.70,TCP,54,34692  >  9001 [ACK] Seq=2731137 Ack=48073913 Win=65535 Len=0
1,6.922460000000001,10.0.2.15,54.93.77.70,TCP,54,34692  >  9001 [ACK] Seq=2731137 Ack=48078257 Win=65535 Len=0
1,6.92263099999991,10.0.2.15,54.93.77.70,TLSv1.2,1104,Application Data
1,6.922714000000042,54.93.77.70,10.0.2.15,TCP,60,9001  >  34692 [ACK] Seq=48078257 Ack=2732187 Win=65535 Len=0
1,6.924076000000014,54.93.77.70,10.0.2.15,TLSv1.2,7200,"Application Data, Application Data, Application Data"
1,6.924125999999887,54.93.77.70,10.0.2.15,TLSv1.2,13086,"Application Data, Application Data, Application Data"
1,6.924197000000049,10.0.2.15,54.93.77.70,TCP,54,34692  >  9001 [ACK] Seq=2732187 Ack=48085403 Win=65535 Len=0
1,6.924326000000065,10.0.2.15,54.93.77.70,TCP,54,34692  >  9001 [ACK] Seq=2732187 Ack=48098435 Win=65535 Len=0
1,6.932904000000008,10.0.2.15,54.93.77.70,TLSv1.2,590,Application Data
1,6.933017999999947,54.93.77.70,10.0.2.15,TCP,60,9001  >  34692 [ACK] Seq=48098435 Ack=2732723 Win=65535 Len=0
1,6.943806999999879,54.93.77.70,10.0.2.15,TLSv1.2,5846,"Application Data, Application Data"
1,6.943854999999985,54.93.77.70,10.0.2.15,TLSv1.2,2950,Application Data [TCP segment of a reassembled PDU]
1,6.943964000000051,54.93.77.70,10.0.2.15,TLSv1.2,2646,Application Data
1,6.944046000000071,10.0.2.15,54.93.77.70,TCP,54,34692  >  9001 [ACK] Seq=2732723 Ack=48109715 Win=65535 Len=0
1,6.948135999999977,10.0.2.15,54.93.77.70,TLSv1.2,590,Application Data
1,6.948278000000073,54.93.77.70,10.0.2.15,TCP,60,9001  >  34692 [ACK] Seq=48109715 Ack=2733259 Win=65535 Len=0
1,7.083337000000029,62.210.85.178,10.0.2.15,TLSv1.2,1104,Application Data
1,7.126019999999926,10.0.2.15,62.210.85.178,TCP,54,35978  >  9001 [ACK] Seq=48152817 Ack=2723077 Win=65535 Len=0
1,7.239528000000064,62.210.85.178,10.0.2.15,TLSv1.2,1104,Application Data
1,7.239604999999983,10.0.2.15,62.210.85.178,TCP,54,35978  >  9001 [ACK] Seq=48152817 Ack=2724127 Win=65535 Len=0
1,7.240088000000014,10.0.2.15,62.210.85.178,TLSv1.2,590,Application Data
1,7.240189999999984,62.210.85.178,10.0.2.15,TCP,60,9001  >  35978 [ACK] Seq=2724127 Ack=48153353 Win=65535 Len=0
1,7.388292000000092,54.93.77.70,10.0.2.15,TLSv1.2,590,Application Data
1,7.389102999999977,10.0.2.15,54.93.77.70,TLSv1.2,590,Application Data
1,7.389273999999887,54.93.77.70,10.0.2.15,TCP,60,9001  >  34692 [ACK] Seq=48110251 Ack=2733795 Win=65535 Len=0
1,7.5692039999999,62.210.85.178,10.0.2.15,TLSv1.2,590,Application Data
1,7.57511999999997,10.0.2.15,62.210.85.178,TLSv1.2,590,Application Data
1,7.575272999999925,62.210.85.178,10.0.2.15,TCP,60,9001  >  35978 [ACK] Seq=2724663 Ack=48153889 Win=65535 Len=0
1,7.586618000000044,10.0.2.15,62.210.85.178,TLSv1.2,4124,Application Data
1,7.586731999999984,10.0.2.15,62.210.85.178,TCP,2974,35978  >  9001 [ACK] Seq=48157959 Ack=2724663 Win=65535 Len=2920 [TCP segment of a reassembled PDU]
1,7.586778999999979,62.210.85.178,10.0.2.15,TCP,60,9001  >  35978 [ACK] Seq=2724663 Ack=48155349 Win=65535 Len=0
1,7.586790999999948,62.210.85.178,10.0.2.15,TCP,60,9001  >  35978 [ACK] Seq=2724663 Ack=48156809 Win=65535 Len=0
1,7.586796000000049,62.210.85.178,10.0.2.15,TCP,60,9001  >  35978 [ACK] Seq=2724663 Ack=48157959 Win=65535 Len=0
1,7.586800000000039,62.210.85.178,10.0.2.15,TCP,60,9001  >  35978 [ACK] Seq=2724663 Ack=48159419 Win=65535 Len=0
1,7.586802999999918,62.210.85.178,10.0.2.15,TCP,60,9001  >  35978 [ACK] Seq=2724663 Ack=48160879 Win=65535 Len=0
1,7.586837999999943,10.0.2.15,62.210.85.178,TLSv1.2,1204,Application Data
1,7.586872999999969,62.210.85.178,10.0.2.15,TCP,60,9001  >  35978 [ACK] Seq=2724663 Ack=48162029 Win=65535 Len=0
1,7.586917000000085,10.0.2.15,62.210.85.178,TLSv1.2,4124,Application Data
1,7.586951999999883,62.210.85.178,10.0.2.15,TCP,60,9001  >  35978 [ACK] Seq=2724663 Ack=48163489 Win=65535 Len=0
1,7.58696000000009,62.210.85.178,10.0.2.15,TCP,60,9001  >  35978 [ACK] Seq=2724663 Ack=48164949 Win=65535 Len=0
1,7.58696400000008,62.210.85.178,10.0.2.15,TCP,60,9001  >  35978 [ACK] Seq=2724663 Ack=48166099 Win=65535 Len=0
1,7.587001999999984,10.0.2.15,62.210.85.178,TLSv1.2,4124,Application Data
1,7.587043999999878,62.210.85.178,10.0.2.15,TCP,60,9001  >  35978 [ACK] Seq=2724663 Ack=48167559 Win=65535 Len=0
1,7.587052000000085,62.210.85.178,10.0.2.15,TCP,60,9001  >  35978 [ACK] Seq=2724663 Ack=48169019 Win=65535 Len=0
1,7.587054999999964,62.210.85.178,10.0.2.15,TCP,60,9001  >  35978 [ACK] Seq=2724663 Ack=48170169 Win=65535 Len=0
1,7.587089999999989,10.0.2.15,62.210.85.178,TLSv1.2,332,Application Data
1,7.58712300000002,62.210.85.178,10.0.2.15,TCP,60,9001  >  35978 [ACK] Seq=2724663 Ack=48170447 Win=65535 Len=0
1,7.5871759999999995,10.0.2.15,62.210.85.178,TLSv1.2,3868,Application Data
1,7.58721300000002,62.210.85.178,10.0.2.15,TCP,60,9001  >  35978 [ACK] Seq=2724663 Ack=48171907 Win=65535 Len=0
1,7.587219999999888,62.210.85.178,10.0.2.15,TCP,60,9001  >  35978 [ACK] Seq=2724663 Ack=48173367 Win=65535 Len=0
1,7.5872229999999945,62.210.85.178,10.0.2.15,TCP,60,9001  >  35978 [ACK] Seq=2724663 Ack=48174261 Win=65535 Len=0
1,7.587260000000015,10.0.2.15,62.210.85.178,TLSv1.2,4124,Application Data
1,7.58729500000004,62.210.85.178,10.0.2.15,TCP,60,9001  >  35978 [ACK] Seq=2724663 Ack=48175721 Win=65535 Len=0
1,7.587301999999909,62.210.85.178,10.0.2.15,TCP,60,9001  >  35978 [ACK] Seq=2724663 Ack=48177181 Win=65535 Len=0
1,7.587305000000015,62.210.85.178,10.0.2.15,TCP,60,9001  >  35978 [ACK] Seq=2724663 Ack=48178331 Win=65535 Len=0
1,7.587338999999929,10.0.2.15,62.210.85.178,TLSv1.2,3030,Application Data
1,7.587373999999954,62.210.85.178,10.0.2.15,TCP,60,9001  >  35978 [ACK] Seq=2724663 Ack=48179791 Win=65535 Len=0
1,7.587379999999939,62.210.85.178,10.0.2.15,TCP,60,9001  >  35978 [ACK] Seq=2724663 Ack=48181251 Win=65535 Len=0
1,7.587383000000045,62.210.85.178,10.0.2.15,TCP,60,9001  >  35978 [ACK] Seq=2724663 Ack=48181307 Win=65535 Len=0
1,7.598942999999963,10.0.2.15,62.210.85.178,TLSv1.2,4124,Application Data
1,7.5990710000000945,62.210.85.178,10.0.2.15,TCP,60,9001  >  35978 [ACK] Seq=2724663 Ack=48182767 Win=65535 Len=0
1,7.599087999999938,62.210.85.178,10.0.2.15,TCP,60,9001  >  35978 [ACK] Seq=2724663 Ack=48184227 Win=65535 Len=0
1,7.599091999999928,62.210.85.178,10.0.2.15,TCP,60,9001  >  35978 [ACK] Seq=2724663 Ack=48185377 Win=65535 Len=0
1,7.599130000000059,10.0.2.15,62.210.85.178,TCP,2974,35978  >  9001 [ACK] Seq=48185377 Ack=2724663 Win=65535 Len=2920 [TCP segment of a reassembled PDU]
1,7.599195999999893,62.210.85.178,10.0.2.15,TCP,60,9001  >  35978 [ACK] Seq=2724663 Ack=48186837 Win=65535 Len=0
1,7.599202999999989,62.210.85.178,10.0.2.15,TCP,60,9001  >  35978 [ACK] Seq=2724663 Ack=48188297 Win=65535 Len=0
1,7.599230000000034,10.0.2.15,62.210.85.178,TLSv1.2,1204,Application Data
1,7.599261999999953,62.210.85.178,10.0.2.15,TCP,60,9001  >  35978 [ACK] Seq=2724663 Ack=48189447 Win=65535 Len=0
1,7.599308999999948,10.0.2.15,62.210.85.178,TLSv1.2,4124,Application Data
1,7.599343999999974,62.210.85.178,10.0.2.15,TCP,60,9001  >  35978 [ACK] Seq=2724663 Ack=48190907 Win=65535 Len=0
1,7.59935100000007,62.210.85.178,10.0.2.15,TCP,60,9001  >  35978 [ACK] Seq=2724663 Ack=48192367 Win=65535 Len=0
1,7.599353999999948,62.210.85.178,10.0.2.15,TCP,60,9001  >  35978 [ACK] Seq=2724663 Ack=48193517 Win=65535 Len=0
1,7.59939200000008,10.0.2.15,62.210.85.178,TLSv1.2,4124,Application Data
1,7.599426999999878,62.210.85.178,10.0.2.15,TCP,60,9001  >  35978 [ACK] Seq=2724663 Ack=48194977 Win=65535 Len=0
1,7.599433999999974,62.210.85.178,10.0.2.15,TCP,60,9001  >  35978 [ACK] Seq=2724663 Ack=48196437 Win=65535 Len=0
1,7.59943700000008,62.210.85.178,10.0.2.15,TCP,60,9001  >  35978 [ACK] Seq=2724663 Ack=48197587 Win=65535 Len=0
1,7.599469999999883,10.0.2.15,62.210.85.178,TLSv1.2,332,Application Data
1,7.5995040000000245,62.210.85.178,10.0.2.15,TCP,60,9001  >  35978 [ACK] Seq=2724663 Ack=48197865 Win=65535 Len=0
1,7.599561999999878,10.0.2.15,62.210.85.178,TLSv1.2,3868,Application Data
1,7.5995980000000145,62.210.85.178,10.0.2.15,TCP,60,9001  >  35978 [ACK] Seq=2724663 Ack=48199325 Win=65535 Len=0
1,7.599604999999883,62.210.85.178,10.0.2.15,TCP,60,9001  >  35978 [ACK] Seq=2724663 Ack=48200785 Win=65535 Len=0
1,7.599607999999989,62.210.85.178,10.0.2.15,TCP,60,9001  >  35978 [ACK] Seq=2724663 Ack=48201679 Win=65535 Len=0
1,7.5996450000000095,10.0.2.15,62.210.85.178,TLSv1.2,4124,Application Data
1,7.59971100000007,62.210.85.178,10.0.2.15,TCP,60,9001  >  35978 [ACK] Seq=2724663 Ack=48203139 Win=65535 Len=0
1,7.599717999999939,62.210.85.178,10.0.2.15,TCP,60,9001  >  35978 [ACK] Seq=2724663 Ack=48204599 Win=65535 Len=0
1,7.599721000000045,62.210.85.178,10.0.2.15,TCP,60,9001  >  35978 [ACK] Seq=2724663 Ack=48205749 Win=65535 Len=0
1,7.599754000000075,10.0.2.15,62.210.85.178,TLSv1.2,3030,Application Data
1,7.599786999999878,62.210.85.178,10.0.2.15,TCP,60,9001  >  35978 [ACK] Seq=2724663 Ack=48207209 Win=65535 Len=0
1,7.599793999999974,62.210.85.178,10.0.2.15,TCP,60,9001  >  35978 [ACK] Seq=2724663 Ack=48208669 Win=65535 Len=0
1,7.5997970000000805,62.210.85.178,10.0.2.15,TCP,60,9001  >  35978 [ACK] Seq=2724663 Ack=48208725 Win=65535 Len=0
1,7.609044999999924,10.0.2.15,62.210.85.178,TLSv1.2,4124,Application Data
1,7.60915,62.210.85.178,10.0.2.15,TCP,60,9001  >  35978 [ACK] Seq=2724663 Ack=48210185 Win=65535 Len=0
1,7.609161999999969,62.210.85.178,10.0.2.15,TCP,60,9001  >  35978 [ACK] Seq=2724663 Ack=48211645 Win=65535 Len=0
1,7.609165999999959,62.210.85.178,10.0.2.15,TCP,60,9001  >  35978 [ACK] Seq=2724663 Ack=48212795 Win=65535 Len=0
1,7.609208000000081,10.0.2.15,62.210.85.178,TLSv1.2,4124,Application Data
1,7.609249000000091,62.210.85.178,10.0.2.15,TCP,60,9001  >  35978 [ACK] Seq=2724663 Ack=48214255 Win=65535 Len=0
1,7.6092570000000705,62.210.85.178,10.0.2.15,TCP,60,9001  >  35978 [ACK] Seq=2724663 Ack=48215715 Win=65535 Len=0
1,7.609259999999949,62.210.85.178,10.0.2.15,TCP,60,9001  >  35978 [ACK] Seq=2724663 Ack=48216865 Win=65535 Len=0
1,7.609296000000086,10.0.2.15,62.210.85.178,TLSv1.2,204,Application Data
1,7.60933,62.210.85.178,10.0.2.15,TCP,60,9001  >  35978 [ACK] Seq=2724663 Ack=48217015 Win=65535 Len=0
1,7.683800000000019,54.93.77.70,10.0.2.15,TLSv1.2,4210,"Application Data, Application Data"
1,7.683948999999984,10.0.2.15,54.93.77.70,TCP,54,34692  >  9001 [ACK] Seq=2733795 Ack=48114407 Win=65535 Len=0
1,7.707724000000098,54.93.77.70,10.0.2.15,TLSv1.2,5846,Application Data
1,7.707762999999886,54.93.77.70,10.0.2.15,TLSv1.2,5298,Application Data [TCP segment of a reassembled PDU]
1,7.707844000000023,10.0.2.15,54.93.77.70,TCP,54,34692  >  9001 [ACK] Seq=2733795 Ack=48125443 Win=65535 Len=0
1,7.708069999999907,10.0.2.15,54.93.77.70,TLSv1.2,590,Application Data
1,7.708141000000069,54.93.77.70,10.0.2.15,TCP,60,9001  >  34692 [ACK] Seq=48125443 Ack=2734331 Win=65535 Len=0
1,7.719873999999891,54.93.77.70,10.0.2.15,TLSv1.2,4398,Application Data [TCP segment of a reassembled PDU]
1,7.719922999999881,10.0.2.15,54.93.77.70,TCP,54,34692  >  9001 [ACK] Seq=2734331 Ack=48129787 Win=65535 Len=0
1,7.726601000000073,54.93.77.70,10.0.2.15,TLSv1.2,12606,"Application Data, Application Data, Application Data, Application Data, Application Data"
1,7.726677999999993,10.0.2.15,54.93.77.70,TCP,54,34692  >  9001 [ACK] Seq=2734331 Ack=48142339 Win=65535 Len=0
1,7.726963999999953,10.0.2.15,54.93.77.70,TLSv1.2,590,Application Data
1,7.727047999999968,54.93.77.70,10.0.2.15,TCP,60,9001  >  34692 [ACK] Seq=48142339 Ack=2734867 Win=65535 Len=0
1,7.732520000000022,54.93.77.70,10.0.2.15,TCP,2950,"9001  >  34692 [PSH, ACK] Seq=48142339 Ack=2734867 Win=65535 Len=2896 [TCP segment of a reassembled PDU]"
1,7.732565000000022,10.0.2.15,54.93.77.70,TCP,54,34692  >  9001 [ACK] Seq=2734867 Ack=48145235 Win=65535 Len=0
1,7.743559000000005,54.93.77.70,10.0.2.15,TLSv1.2,5846,"Application Data, Application Data, Application Data"
1,7.743666999999959,10.0.2.15,54.93.77.70,TCP,54,34692  >  9001 [ACK] Seq=2734867 Ack=48151027 Win=65535 Len=0
1,7.743692999999894,54.93.77.70,10.0.2.15,TCP,2950,"9001  >  34692 [PSH, ACK] Seq=48151027 Ack=2734867 Win=65535 Len=2896 [TCP segment of a reassembled PDU]"
1,7.743786,10.0.2.15,54.93.77.70,TCP,54,34692  >  9001 [ACK] Seq=2734867 Ack=48153923 Win=65535 Len=0
1,7.745349999999917,54.93.77.70,10.0.2.15,TLSv1.2,8648,"Application Data, Application Data, Application Data"
1,7.745392999999922,10.0.2.15,54.93.77.70,TCP,54,34692  >  9001 [ACK] Seq=2734867 Ack=48162517 Win=65535 Len=0
1,7.745642000000089,10.0.2.15,54.93.77.70,TLSv1.2,590,Application Data
1,7.745709999999917,54.93.77.70,10.0.2.15,TCP,60,9001  >  34692 [ACK] Seq=48162517 Ack=2735403 Win=65535 Len=0
1,7.754881999999952,54.93.77.70,10.0.2.15,TLSv1.2,5846,Application Data
1,7.754901999999902,54.93.77.70,10.0.2.15,TLSv1.2,4398,Application Data [TCP segment of a reassembled PDU]
1,7.7549719999999525,10.0.2.15,54.93.77.70,TCP,54,34692  >  9001 [ACK] Seq=2735403 Ack=48172653 Win=65535 Len=0
1,7.764400999999907,54.93.77.70,10.0.2.15,TLSv1.2,1292,Application Data
1,7.764611000000059,10.0.2.15,54.93.77.70,TLSv1.2,590,Application Data
1,7.764697000000069,54.93.77.70,10.0.2.15,TCP,60,9001  >  34692 [ACK] Seq=48173891 Ack=2735939 Win=65535 Len=0
