No.,Time,Source,Destination,Protocol,Length,Info
1,0.004380000000082873,10.0.2.15,62.210.85.178,TCP,54,35978  >  9001 [ACK] Seq=57099855 Ack=3190767 Win=65535 Len=0
1,0.03749900000002526,62.210.85.178,10.0.2.15,TLSv1.2,1640,"Application Data, Application Data"
1,0.037616999999954714,10.0.2.15,62.210.85.178,TCP,54,35978  >  9001 [ACK] Seq=57099855 Ack=3192353 Win=65535 Len=0
1,0.13794800000005125,10.0.2.15,54.93.77.70,TLSv1.2,590,Application Data
1,0.13812299999995048,54.93.77.70,10.0.2.15,TCP,60,9001  >  34692 [ACK] Seq=57056891 Ack=3208223 Win=65535 Len=0
1,0.25779899999997724,62.210.85.178,10.0.2.15,TLSv1.2,590,Application Data
1,0.25788200000010875,10.0.2.15,62.210.85.178,TCP,54,35978  >  9001 [ACK] Seq=57099855 Ack=3192889 Win=65535 Len=0
1,0.2583799999999883,10.0.2.15,62.210.85.178,TLSv1.2,590,Application Data
1,0.25850000000014006,62.210.85.178,10.0.2.15,TCP,60,9001  >  35978 [ACK] Seq=3192889 Ack=57100391 Win=65535 Len=0
1,0.3644320000000789,54.93.77.70,10.0.2.15,TLSv1.2,590,Application Data
1,0.36451400000009926,10.0.2.15,54.93.77.70,TCP,54,34692  >  9001 [ACK] Seq=3208223 Ack=57057427 Win=65535 Len=0
1,0.36491799999998875,10.0.2.15,54.93.77.70,TLSv1.2,1618,Application Data
1,0.3650350000000344,54.93.77.70,10.0.2.15,TCP,60,9001  >  34692 [ACK] Seq=57057427 Ack=3209683 Win=65535 Len=0
1,0.3650470000000041,54.93.77.70,10.0.2.15,TCP,60,9001  >  34692 [ACK] Seq=57057427 Ack=3209787 Win=65535 Len=0
1,0.47488300000009076,62.210.85.178,10.0.2.15,TLSv1.2,1618,Application Data
1,0.4750060000001213,10.0.2.15,62.210.85.178,TCP,54,35978  >  9001 [ACK] Seq=57100391 Ack=3194453 Win=65535 Len=0
1,0.4886430000001383,10.0.2.15,62.210.85.178,TLSv1.2,590,Application Data
1,0.4888020000000779,62.210.85.178,10.0.2.15,TCP,60,9001  >  35978 [ACK] Seq=3194453 Ack=57100927 Win=65535 Len=0
1,0.5017370000000483,10.0.2.15,62.210.85.178,TLSv1.2,1618,Application Data
1,0.5018800000000283,62.210.85.178,10.0.2.15,TCP,60,9001  >  35978 [ACK] Seq=3194453 Ack=57102387 Win=65535 Len=0
1,0.501899000000094,62.210.85.178,10.0.2.15,TCP,60,9001  >  35978 [ACK] Seq=3194453 Ack=57102491 Win=65535 Len=0
1,0.5917380000000776,54.93.77.70,10.0.2.15,TLSv1.2,590,Application Data
1,0.632761999999957,10.0.2.15,54.93.77.70,TCP,54,34692  >  9001 [ACK] Seq=3209787 Ack=57057963 Win=65535 Len=0
1,0.6779400000000351,54.93.77.70,10.0.2.15,TLSv1.2,1618,Application Data
1,0.6780320000000302,10.0.2.15,54.93.77.70,TCP,54,34692  >  9001 [ACK] Seq=3209787 Ack=57059527 Win=65535 Len=0
1,0.6808650000000398,10.0.2.15,54.93.77.70,TLSv1.2,590,Application Data
1,0.6810510000000249,54.93.77.70,10.0.2.15,TCP,60,9001  >  34692 [ACK] Seq=57059527 Ack=3210323 Win=65535 Len=0
1,0.7802280000000792,62.210.85.178,10.0.2.15,TLSv1.2,590,Application Data
1,0.7806150000001253,10.0.2.15,62.210.85.178,TLSv1.2,590,Application Data
1,0.7807669999999689,62.210.85.178,10.0.2.15,TCP,60,9001  >  35978 [ACK] Seq=3194989 Ack=57103027 Win=65535 Len=0
1,0.8706520000000637,54.93.77.70,10.0.2.15,TLSv1.2,590,Application Data
1,0.8711029999999482,10.0.2.15,54.93.77.70,TLSv1.2,590,Application Data
1,0.8712430000000495,54.93.77.70,10.0.2.15,TCP,60,9001  >  34692 [ACK] Seq=57060063 Ack=3210859 Win=65535 Len=0
1,0.9903600000000097,62.210.85.178,10.0.2.15,TLSv1.2,590,Application Data
1,0.9991030000001047,10.0.2.15,62.210.85.178,TLSv1.2,590,Application Data
1,0.9993059999999332,62.210.85.178,10.0.2.15,TCP,60,9001  >  35978 [ACK] Seq=3195525 Ack=57103563 Win=65535 Len=0
1,1.0132340000000113,10.0.2.15,62.210.85.178,TLSv1.2,4124,Application Data
1,1.013347000000067,10.0.2.15,62.210.85.178,TCP,2974,35978  >  9001 [ACK] Seq=57107633 Ack=3195525 Win=65535 Len=2920 [TCP segment of a reassembled PDU]
1,1.013409000000138,62.210.85.178,10.0.2.15,TCP,60,9001  >  35978 [ACK] Seq=3195525 Ack=57105023 Win=65535 Len=0
1,1.0134219999999914,62.210.85.178,10.0.2.15,TCP,60,9001  >  35978 [ACK] Seq=3195525 Ack=57106483 Win=65535 Len=0
1,1.0134270000000924,62.210.85.178,10.0.2.15,TCP,60,9001  >  35978 [ACK] Seq=3195525 Ack=57107633 Win=65535 Len=0
1,1.0134680000001026,10.0.2.15,62.210.85.178,TLSv1.2,1204,Application Data
1,1.0135070000001178,62.210.85.178,10.0.2.15,TCP,60,9001  >  35978 [ACK] Seq=3195525 Ack=57109093 Win=65535 Len=0
1,1.0135159999999814,62.210.85.178,10.0.2.15,TCP,60,9001  >  35978 [ACK] Seq=3195525 Ack=57110553 Win=65535 Len=0
1,1.0135190000000875,62.210.85.178,10.0.2.15,TCP,60,9001  >  35978 [ACK] Seq=3195525 Ack=57111703 Win=65535 Len=0
1,1.0135609999999815,10.0.2.15,62.210.85.178,TLSv1.2,4124,Application Data
1,1.0135999999999967,62.210.85.178,10.0.2.15,TCP,60,9001  >  35978 [ACK] Seq=3195525 Ack=57113163 Win=65535 Len=0
1,1.0136090000000877,62.210.85.178,10.0.2.15,TCP,60,9001  >  35978 [ACK] Seq=3195525 Ack=57114623 Win=65535 Len=0
1,1.0136130000000776,62.210.85.178,10.0.2.15,TCP,60,9001  >  35978 [ACK] Seq=3195525 Ack=57115773 Win=65535 Len=0
1,1.0136520000000928,10.0.2.15,62.210.85.178,TLSv1.2,4124,Application Data
1,1.0136899999999969,62.210.85.178,10.0.2.15,TCP,60,9001  >  35978 [ACK] Seq=3195525 Ack=57117233 Win=65535 Len=0
1,1.0136979999999767,62.210.85.178,10.0.2.15,TCP,60,9001  >  35978 [ACK] Seq=3195525 Ack=57118693 Win=65535 Len=0
1,1.0137589999999363,10.0.2.15,62.210.85.178,TLSv1.2,2974,Application Data
1,1.0138030000000526,62.210.85.178,10.0.2.15,TCP,60,9001  >  35978 [ACK] Seq=3195525 Ack=57119843 Win=65535 Len=0
1,1.0138099999999213,62.210.85.178,10.0.2.15,TCP,60,9001  >  35978 [ACK] Seq=3195525 Ack=57121303 Win=65535 Len=0
1,1.0138130000000274,62.210.85.178,10.0.2.15,TCP,60,9001  >  35978 [ACK] Seq=3195525 Ack=57122763 Win=65535 Len=0
1,1.013840000000073,10.0.2.15,62.210.85.178,TLSv1.2,1226,Application Data
1,1.013875999999982,62.210.85.178,10.0.2.15,TCP,60,9001  >  35978 [ACK] Seq=3195525 Ack=57123935 Win=65535 Len=0
1,1.0139169999999922,10.0.2.15,62.210.85.178,TLSv1.2,4124,Application Data
1,1.0139550000001236,62.210.85.178,10.0.2.15,TCP,60,9001  >  35978 [ACK] Seq=3195525 Ack=57125395 Win=65535 Len=0
1,1.0139639999999872,62.210.85.178,10.0.2.15,TCP,60,9001  >  35978 [ACK] Seq=3195525 Ack=57126855 Win=65535 Len=0
1,1.0139670000000933,62.210.85.178,10.0.2.15,TCP,60,9001  >  35978 [ACK] Seq=3195525 Ack=57128005 Win=65535 Len=0
1,1.0140049999999974,10.0.2.15,62.210.85.178,TLSv1.2,3030,Application Data
1,1.0140450000001238,62.210.85.178,10.0.2.15,TCP,60,9001  >  35978 [ACK] Seq=3195525 Ack=57129465 Win=65535 Len=0
1,1.0140519999999924,62.210.85.178,10.0.2.15,TCP,60,9001  >  35978 [ACK] Seq=3195525 Ack=57130925 Win=65535 Len=0
1,1.0140559999999823,62.210.85.178,10.0.2.15,TCP,60,9001  >  35978 [ACK] Seq=3195525 Ack=57130981 Win=65535 Len=0
1,1.0232659999999214,10.0.2.15,62.210.85.178,TLSv1.2,4124,Application Data
1,1.0233240000000023,62.210.85.178,10.0.2.15,TCP,60,9001  >  35978 [ACK] Seq=3195525 Ack=57132441 Win=65535 Len=0
1,1.023335999999972,62.210.85.178,10.0.2.15,TCP,60,9001  >  35978 [ACK] Seq=3195525 Ack=57133901 Win=65535 Len=0
1,1.023341000000073,62.210.85.178,10.0.2.15,TCP,60,9001  >  35978 [ACK] Seq=3195525 Ack=57135051 Win=65535 Len=0
1,1.023388999999952,10.0.2.15,62.210.85.178,TLSv1.2,4124,Application Data
1,1.023429999999962,62.210.85.178,10.0.2.15,TCP,60,9001  >  35978 [ACK] Seq=3195525 Ack=57136511 Win=65535 Len=0
1,1.023439000000053,62.210.85.178,10.0.2.15,TCP,60,9001  >  35978 [ACK] Seq=3195525 Ack=57137971 Win=65535 Len=0
1,1.0234439999999267,62.210.85.178,10.0.2.15,TCP,60,9001  >  35978 [ACK] Seq=3195525 Ack=57139121 Win=65535 Len=0
1,1.023482999999942,10.0.2.15,62.210.85.178,TLSv1.2,4124,Application Data
1,1.0235210000000734,62.210.85.178,10.0.2.15,TCP,60,9001  >  35978 [ACK] Seq=3195525 Ack=57140581 Win=65535 Len=0
1,1.023529999999937,62.210.85.178,10.0.2.15,TCP,60,9001  >  35978 [ACK] Seq=3195525 Ack=57142041 Win=65535 Len=0
1,1.023533999999927,62.210.85.178,10.0.2.15,TCP,60,9001  >  35978 [ACK] Seq=3195525 Ack=57143191 Win=65535 Len=0
1,1.023582000000033,10.0.2.15,62.210.85.178,TLSv1.2,4124,Application Data
1,1.0236190000000533,62.210.85.178,10.0.2.15,TCP,60,9001  >  35978 [ACK] Seq=3195525 Ack=57144651 Win=65535 Len=0
1,1.0236270000000331,62.210.85.178,10.0.2.15,TCP,60,9001  >  35978 [ACK] Seq=3195525 Ack=57146111 Win=65535 Len=0
1,1.0236320000001342,62.210.85.178,10.0.2.15,TCP,60,9001  >  35978 [ACK] Seq=3195525 Ack=57147261 Win=65535 Len=0
1,1.0236669999999322,10.0.2.15,62.210.85.178,TLSv1.2,332,Application Data
1,1.0237050000000636,62.210.85.178,10.0.2.15,TCP,60,9001  >  35978 [ACK] Seq=3195525 Ack=57147539 Win=65535 Len=0
1,1.0237569999999323,10.0.2.15,62.210.85.178,TLSv1.2,3868,Application Data
1,1.0237990000000536,62.210.85.178,10.0.2.15,TCP,60,9001  >  35978 [ACK] Seq=3195525 Ack=57148999 Win=65535 Len=0
1,1.0238070000000334,62.210.85.178,10.0.2.15,TCP,60,9001  >  35978 [ACK] Seq=3195525 Ack=57150459 Win=65535 Len=0
1,1.0238100000001396,62.210.85.178,10.0.2.15,TCP,60,9001  >  35978 [ACK] Seq=3195525 Ack=57151353 Win=65535 Len=0
1,1.0238489999999274,10.0.2.15,62.210.85.178,TLSv1.2,4124,Application Data
1,1.0238879999999426,62.210.85.178,10.0.2.15,TCP,60,9001  >  35978 [ACK] Seq=3195525 Ack=57152813 Win=65535 Len=0
1,1.0238959999999224,62.210.85.178,10.0.2.15,TCP,60,9001  >  35978 [ACK] Seq=3195525 Ack=57154273 Win=65535 Len=0
1,1.0238990000000285,62.210.85.178,10.0.2.15,TCP,60,9001  >  35978 [ACK] Seq=3195525 Ack=57155423 Win=65535 Len=0
1,1.0239349999999376,10.0.2.15,62.210.85.178,TLSv1.2,3030,Application Data
1,1.023979000000054,62.210.85.178,10.0.2.15,TCP,60,9001  >  35978 [ACK] Seq=3195525 Ack=57156883 Win=65535 Len=0
1,1.0239859999999226,62.210.85.178,10.0.2.15,TCP,60,9001  >  35978 [ACK] Seq=3195525 Ack=57158343 Win=65535 Len=0
1,1.0239900000001398,62.210.85.178,10.0.2.15,TCP,60,9001  >  35978 [ACK] Seq=3195525 Ack=57158399 Win=65535 Len=0
1,1.0376330000001417,10.0.2.15,62.210.85.178,TLSv1.2,4124,Application Data
1,1.0377430000000913,62.210.85.178,10.0.2.15,TCP,60,9001  >  35978 [ACK] Seq=3195525 Ack=57159859 Win=65535 Len=0
1,1.0377539999999499,62.210.85.178,10.0.2.15,TCP,60,9001  >  35978 [ACK] Seq=3195525 Ack=57161319 Win=65535 Len=0
1,1.0377579999999398,62.210.85.178,10.0.2.15,TCP,60,9001  >  35978 [ACK] Seq=3195525 Ack=57162469 Win=65535 Len=0
1,1.03779899999995,10.0.2.15,62.210.85.178,TLSv1.2,4124,Application Data
1,1.037841999999955,62.210.85.178,10.0.2.15,TCP,60,9001  >  35978 [ACK] Seq=3195525 Ack=57163929 Win=65535 Len=0
1,1.037851000000046,62.210.85.178,10.0.2.15,TCP,60,9001  >  35978 [ACK] Seq=3195525 Ack=57165389 Win=65535 Len=0
1,1.037856000000147,62.210.85.178,10.0.2.15,TCP,60,9001  >  35978 [ACK] Seq=3195525 Ack=57166539 Win=65535 Len=0
1,1.0378940000000512,10.0.2.15,62.210.85.178,TLSv1.2,718,Application Data
1,1.0379310000000714,62.210.85.178,10.0.2.15,TCP,60,9001  >  35978 [ACK] Seq=3195525 Ack=57167203 Win=65535 Len=0
1,1.1084419999999682,54.93.77.70,10.0.2.15,TLSv1.2,590,Application Data
1,1.1171480000000429,54.93.77.70,10.0.2.15,TLSv1.2,5846,Application Data
1,1.1172300000000632,10.0.2.15,54.93.77.70,TCP,54,34692  >  9001 [ACK] Seq=3210859 Ack=57066391 Win=65535 Len=0
1,1.1174949999999626,54.93.77.70,10.0.2.15,TLSv1.2,7294,"Application Data, Application Data"
1,1.1175969999999325,10.0.2.15,54.93.77.70,TCP,54,34692  >  9001 [ACK] Seq=3210859 Ack=57073631 Win=65535 Len=0
1,1.13465599999995,54.93.77.70,10.0.2.15,TLSv1.2,2530,Application Data
1,1.134710000000041,10.0.2.15,54.93.77.70,TCP,54,34692  >  9001 [ACK] Seq=3210859 Ack=57076107 Win=65535 Len=0
1,1.1368800000000192,54.93.77.70,10.0.2.15,TCP,2950,"9001  >  34692 [PSH, ACK] Seq=57076107 Ack=3210859 Win=65535 Len=2896 [TCP segment of a reassembled PDU]"
1,1.1369240000001355,10.0.2.15,54.93.77.70,TCP,54,34692  >  9001 [ACK] Seq=3210859 Ack=57079003 Win=65535 Len=0
1,1.1485920000000078,54.93.77.70,10.0.2.15,TLSv1.2,2950,Application Data [TCP segment of a reassembled PDU]
1,1.1486300000001393,54.93.77.70,10.0.2.15,TLSv1.2,8742,"Application Data, Application Data"
1,1.1486970000000838,10.0.2.15,54.93.77.70,TCP,54,34692  >  9001 [ACK] Seq=3210859 Ack=57081899 Win=65535 Len=0
1,1.1488799999999628,10.0.2.15,54.93.77.70,TCP,54,34692  >  9001 [ACK] Seq=3210859 Ack=57090587 Win=65535 Len=0
1,1.1492849999999635,10.0.2.15,54.93.77.70,TLSv1.2,590,Application Data
1,1.1494339999999283,54.93.77.70,10.0.2.15,TCP,60,9001  >  34692 [ACK] Seq=57090587 Ack=3211395 Win=65535 Len=0
1,1.1525340000000597,54.93.77.70,10.0.2.15,TLSv1.2,1082,Application Data
1,1.160519000000022,54.93.77.70,10.0.2.15,TCP,2950,"9001  >  34692 [PSH, ACK] Seq=57091615 Ack=3211395 Win=65535 Len=2896 [TCP segment of a reassembled PDU]"
1,1.160617000000002,10.0.2.15,54.93.77.70,TCP,54,34692  >  9001 [ACK] Seq=3211395 Ack=57094511 Win=65535 Len=0
1,1.172023000000081,54.93.77.70,10.0.2.15,TLSv1.2,1502,Application Data [TCP segment of a reassembled PDU]
1,1.1720960000000105,10.0.2.15,54.93.77.70,TCP,54,34692  >  9001 [ACK] Seq=3211395 Ack=57095959 Win=65535 Len=0
1,1.178225999999995,54.93.77.70,10.0.2.15,TLSv1.2,894,Application Data
1,1.1784529999999904,10.0.2.15,54.93.77.70,TLSv1.2,590,Application Data
1,1.1785730000001422,54.93.77.70,10.0.2.15,TCP,60,9001  >  34692 [ACK] Seq=57096799 Ack=3211931 Win=65535 Len=0
1,1.1881089999999404,54.93.77.70,10.0.2.15,TCP,2950,"9001  >  34692 [PSH, ACK] Seq=57096799 Ack=3211931 Win=65535 Len=2896 [TCP segment of a reassembled PDU]"
1,1.188278000000082,10.0.2.15,54.93.77.70,TCP,54,34692  >  9001 [ACK] Seq=3211931 Ack=57099695 Win=65535 Len=0
1,1.1942650000000867,54.93.77.70,10.0.2.15,TLSv1.2,778,Application Data
1,1.2094740000000002,54.93.77.70,10.0.2.15,TLSv1.2,5846,"Application Data, Application Data"
1,1.2095679999999902,10.0.2.15,54.93.77.70,TCP,54,34692  >  9001 [ACK] Seq=3211931 Ack=57106211 Win=65535 Len=0
1,1.2099869999999555,54.93.77.70,10.0.2.15,TLSv1.2,4398,Application Data [TCP segment of a reassembled PDU]
1,1.2100310000000718,10.0.2.15,54.93.77.70,TCP,54,34692  >  9001 [ACK] Seq=3211931 Ack=57110555 Win=65535 Len=0
1,1.2107969999999568,54.93.77.70,10.0.2.15,TLSv1.2,7294,"Application Data, Application Data"
1,1.2108670000000075,10.0.2.15,54.93.77.70,TCP,54,34692  >  9001 [ACK] Seq=3211931 Ack=57117795 Win=65535 Len=0
1,1.2110230000000684,10.0.2.15,54.93.77.70,TLSv1.2,590,Application Data
1,1.211091000000124,54.93.77.70,10.0.2.15,TCP,60,9001  >  34692 [ACK] Seq=57117795 Ack=3212467 Win=65535 Len=0
1,1.21225000000004,54.93.77.70,10.0.2.15,TLSv1.2,2950,Application Data [TCP segment of a reassembled PDU]
1,1.2123000000001412,10.0.2.15,54.93.77.70,TCP,54,34692  >  9001 [ACK] Seq=3212467 Ack=57120691 Win=65535 Len=0
1,1.2236649999999827,54.93.77.70,10.0.2.15,TLSv1.2,2950,Application Data [TCP segment of a reassembled PDU]
1,1.223709000000099,10.0.2.15,54.93.77.70,TCP,54,34692  >  9001 [ACK] Seq=3212467 Ack=57123587 Win=65535 Len=0
1,1.2259229999999661,54.93.77.70,10.0.2.15,TLSv1.2,706,Application Data
1,1.232185999999956,10.0.2.15,54.93.77.70,TLSv1.2,590,Application Data
1,1.2323930000000018,54.93.77.70,10.0.2.15,TCP,60,9001  >  34692 [ACK] Seq=57124239 Ack=3213003 Win=65535 Len=0
1,1.2686169999999493,62.210.85.178,10.0.2.15,TLSv1.2,590,Application Data
1,1.3127759999999853,10.0.2.15,62.210.85.178,TCP,54,35978  >  9001 [ACK] Seq=57167203 Ack=3196061 Win=65535 Len=0
1,1.3295869999999468,62.210.85.178,10.0.2.15,TLSv1.2,590,Application Data
1,1.3296940000000177,10.0.2.15,62.210.85.178,TCP,54,35978  >  9001 [ACK] Seq=57167203 Ack=3196597 Win=65535 Len=0
1,1.3461580000000595,62.210.85.178,10.0.2.15,TLSv1.2,590,Application Data
1,1.3462119999999231,10.0.2.15,62.210.85.178,TCP,54,35978  >  9001 [ACK] Seq=57167203 Ack=3197133 Win=65535 Len=0
1,1.3957729999999628,62.210.85.178,10.0.2.15,TLSv1.2,590,Application Data
1,1.3958600000000843,10.0.2.15,62.210.85.178,TCP,54,35978  >  9001 [ACK] Seq=57167203 Ack=3197669 Win=65535 Len=0
1,1.3964339999999993,10.0.2.15,62.210.85.178,TLSv1.2,590,Application Data
1,1.3965749999999844,62.210.85.178,10.0.2.15,TCP,60,9001  >  35978 [ACK] Seq=3197669 Ack=57167739 Win=65535 Len=0
1,1.595314000000144,54.93.77.70,10.0.2.15,TLSv1.2,590,Application Data
1,1.5957510000000639,10.0.2.15,54.93.77.70,TLSv1.2,590,Application Data
1,1.595892000000049,54.93.77.70,10.0.2.15,TCP,60,9001  >  34692 [ACK] Seq=57124775 Ack=3213539 Win=65535 Len=0
1,1.7047680000000582,62.210.85.178,10.0.2.15,TLSv1.2,590,Application Data
1,1.711424000000079,10.0.2.15,62.210.85.178,TLSv1.2,590,Application Data
1,1.7116100000000642,62.210.85.178,10.0.2.15,TCP,60,9001  >  35978 [ACK] Seq=3198205 Ack=57168275 Win=65535 Len=0
1,1.7251289999999244,10.0.2.15,62.210.85.178,TLSv1.2,4124,Application Data
1,1.725251999999955,10.0.2.15,62.210.85.178,TCP,2974,35978  >  9001 [ACK] Seq=57172345 Ack=3198205 Win=65535 Len=2920 [TCP segment of a reassembled PDU]
1,1.725292999999965,62.210.85.178,10.0.2.15,TCP,60,9001  >  35978 [ACK] Seq=3198205 Ack=57169735 Win=65535 Len=0
1,1.7253029999999399,62.210.85.178,10.0.2.15,TCP,60,9001  >  35978 [ACK] Seq=3198205 Ack=57171195 Win=65535 Len=0
1,1.725308000000041,62.210.85.178,10.0.2.15,TCP,60,9001  >  35978 [ACK] Seq=3198205 Ack=57172345 Win=65535 Len=0
1,1.7253120000000308,62.210.85.178,10.0.2.15,TCP,60,9001  >  35978 [ACK] Seq=3198205 Ack=57173805 Win=65535 Len=0
1,1.7253160000000207,62.210.85.178,10.0.2.15,TCP,60,9001  >  35978 [ACK] Seq=3198205 Ack=57175265 Win=65535 Len=0
1,1.725360000000137,10.0.2.15,62.210.85.178,TLSv1.2,1204,Application Data
1,1.7254339999999502,62.210.85.178,10.0.2.15,TCP,60,9001  >  35978 [ACK] Seq=3198205 Ack=57176415 Win=65535 Len=0
1,1.7254729999999654,10.0.2.15,62.210.85.178,TLSv1.2,4124,Application Data
1,1.7255139999999756,62.210.85.178,10.0.2.15,TCP,60,9001  >  35978 [ACK] Seq=3198205 Ack=57177875 Win=65535 Len=0
1,1.7255219999999554,62.210.85.178,10.0.2.15,TCP,60,9001  >  35978 [ACK] Seq=3198205 Ack=57179335 Win=65535 Len=0
1,1.7255259999999453,62.210.85.178,10.0.2.15,TCP,60,9001  >  35978 [ACK] Seq=3198205 Ack=57180485 Win=65535 Len=0
1,1.7255729999999403,10.0.2.15,62.210.85.178,TLSv1.2,4124,Application Data
1,1.7256139999999505,62.210.85.178,10.0.2.15,TCP,60,9001  >  35978 [ACK] Seq=3198205 Ack=57181945 Win=65535 Len=0
1,1.7256210000000465,62.210.85.178,10.0.2.15,TCP,60,9001  >  35978 [ACK] Seq=3198205 Ack=57183405 Win=65535 Len=0
1,1.7256640000000516,62.210.85.178,10.0.2.15,TCP,60,9001  >  35978 [ACK] Seq=3198205 Ack=57184555 Win=65535 Len=0
1,1.7257039999999506,10.0.2.15,62.210.85.178,TLSv1.2,332,Application Data
1,1.725793000000067,62.210.85.178,10.0.2.15,TCP,60,9001  >  35978 [ACK] Seq=3198205 Ack=57184833 Win=65535 Len=0
1,1.7258260000000973,10.0.2.15,62.210.85.178,TCP,2974,35978  >  9001 [ACK] Seq=57184833 Ack=3198205 Win=65535 Len=2920 [TCP segment of a reassembled PDU]
1,1.7258790000000772,10.0.2.15,62.210.85.178,TLSv1.2,948,Application Data
1,1.7259129999999914,62.210.85.178,10.0.2.15,TCP,60,9001  >  35978 [ACK] Seq=3198205 Ack=57186293 Win=65535 Len=0
1,1.7259189999999762,62.210.85.178,10.0.2.15,TCP,60,9001  >  35978 [ACK] Seq=3198205 Ack=57187753 Win=65535 Len=0
1,1.7259240000000773,62.210.85.178,10.0.2.15,TCP,60,9001  >  35978 [ACK] Seq=3198205 Ack=57188647 Win=65535 Len=0
1,1.7259710000000723,10.0.2.15,62.210.85.178,TLSv1.2,4124,Application Data
1,1.726035000000138,10.0.2.15,62.210.85.178,TCP,2974,35978  >  9001 [ACK] Seq=57192717 Ack=3198205 Win=65535 Len=2920 [TCP segment of a reassembled PDU]
1,1.726071999999931,62.210.85.178,10.0.2.15,TCP,60,9001  >  35978 [ACK] Seq=3198205 Ack=57190107 Win=65535 Len=0
1,1.726079000000027,62.210.85.178,10.0.2.15,TCP,60,9001  >  35978 [ACK] Seq=3198205 Ack=57191567 Win=65535 Len=0
1,1.726083000000017,62.210.85.178,10.0.2.15,TCP,60,9001  >  35978 [ACK] Seq=3198205 Ack=57192717 Win=65535 Len=0
1,1.7260870000000068,62.210.85.178,10.0.2.15,TCP,60,9001  >  35978 [ACK] Seq=3198205 Ack=57194177 Win=65535 Len=0
1,1.7260909999999967,62.210.85.178,10.0.2.15,TCP,60,9001  >  35978 [ACK] Seq=3198205 Ack=57195637 Win=65535 Len=0
1,1.7261290000001281,10.0.2.15,62.210.85.178,TLSv1.2,110,Application Data
1,1.7262180000000171,62.210.85.178,10.0.2.15,TCP,60,9001  >  35978 [ACK] Seq=3198205 Ack=57195693 Win=65535 Len=0
1,1.7375070000000505,10.0.2.15,62.210.85.178,TLSv1.2,4124,Application Data
1,1.7375999999999294,10.0.2.15,62.210.85.178,TCP,2974,35978  >  9001 [ACK] Seq=57199763 Ack=3198205 Win=65535 Len=2920 [TCP segment of a reassembled PDU]
1,1.7376440000000457,62.210.85.178,10.0.2.15,TCP,60,9001  >  35978 [ACK] Seq=3198205 Ack=57197153 Win=65535 Len=0
1,1.7376540000000205,62.210.85.178,10.0.2.15,TCP,60,9001  >  35978 [ACK] Seq=3198205 Ack=57198613 Win=65535 Len=0
1,1.7376590000001215,62.210.85.178,10.0.2.15,TCP,60,9001  >  35978 [ACK] Seq=3198205 Ack=57199763 Win=65535 Len=0
1,1.7376630000001114,62.210.85.178,10.0.2.15,TCP,60,9001  >  35978 [ACK] Seq=3198205 Ack=57201223 Win=65535 Len=0
1,1.7376670000001013,62.210.85.178,10.0.2.15,TCP,60,9001  >  35978 [ACK] Seq=3198205 Ack=57202683 Win=65535 Len=0
1,1.7377080000001115,10.0.2.15,62.210.85.178,TLSv1.2,1204,Application Data
1,1.7377470000001267,62.210.85.178,10.0.2.15,TCP,60,9001  >  35978 [ACK] Seq=3198205 Ack=57203833 Win=65535 Len=0
1,1.7377940000001217,10.0.2.15,62.210.85.178,TLSv1.2,2774,Application Data
1,1.7378340000000208,62.210.85.178,10.0.2.15,TCP,60,9001  >  35978 [ACK] Seq=3198205 Ack=57205293 Win=65535 Len=0
1,1.7378410000001168,62.210.85.178,10.0.2.15,TCP,60,9001  >  35978 [ACK] Seq=3198205 Ack=57206553 Win=65535 Len=0
1,1.838612000000012,54.93.77.70,10.0.2.15,TLSv1.2,3674,Application Data
1,1.8387569999999869,10.0.2.15,54.93.77.70,TCP,54,34692  >  9001 [ACK] Seq=3213539 Ack=57128395 Win=65535 Len=0
1,1.8481759999999667,54.93.77.70,10.0.2.15,TLSv1.2,10190,"Application Data, Application Data"
1,1.8482839999999214,10.0.2.15,54.93.77.70,TCP,54,34692  >  9001 [ACK] Seq=3213539 Ack=57138531 Win=65535 Len=0
1,1.8546579999999722,54.93.77.70,10.0.2.15,TLSv1.2,1806,Application Data
1,1.8547519999999622,10.0.2.15,54.93.77.70,TCP,54,34692  >  9001 [ACK] Seq=3213539 Ack=57140283 Win=65535 Len=0
1,1.8568800000000465,54.93.77.70,10.0.2.15,TCP,1502,"9001  >  34692 [PSH, ACK] Seq=57140283 Ack=3213539 Win=65535 Len=1448 [TCP segment of a reassembled PDU]"
1,1.8569420000001173,10.0.2.15,54.93.77.70,TCP,54,34692  >  9001 [ACK] Seq=3213539 Ack=57141731 Win=65535 Len=0
1,1.8639550000000327,54.93.77.70,10.0.2.15,TLSv1.2,2950,Application Data [TCP segment of a reassembled PDU]
1,1.864027999999962,10.0.2.15,54.93.77.70,TCP,54,34692  >  9001 [ACK] Seq=3213539 Ack=57144627 Win=65535 Len=0
1,1.8655459999999948,54.93.77.70,10.0.2.15,TLSv1.2,7294,"Application Data, Application Data"
1,1.8656089999999494,10.0.2.15,54.93.77.70,TCP,54,34692  >  9001 [ACK] Seq=3213539 Ack=57151867 Win=65535 Len=0
1,1.8658760000000711,10.0.2.15,54.93.77.70,TLSv1.2,590,Application Data
1,1.8659860000000208,54.93.77.70,10.0.2.15,TCP,60,9001  >  34692 [ACK] Seq=57151867 Ack=3214075 Win=65535 Len=0
1,1.8706859999999779,54.93.77.70,10.0.2.15,TLSv1.2,894,Application Data
1,1.8813760000000457,10.0.2.15,54.93.77.70,TLSv1.2,590,Application Data
1,1.8815130000000408,54.93.77.70,10.0.2.15,TCP,60,9001  >  34692 [ACK] Seq=57152707 Ack=3214611 Win=65535 Len=0
1,1.9132620000000315,54.93.77.70,10.0.2.15,TLSv1.2,590,Application Data
1,1.928673000000117,54.93.77.70,10.0.2.15,TLSv1.2,7294,Application Data
1,1.9287500000000364,10.0.2.15,54.93.77.70,TCP,54,34692  >  9001 [ACK] Seq=3214611 Ack=57160483 Win=65535 Len=0
1,1.9355580000001282,54.93.77.70,10.0.2.15,TLSv1.2,1502,Application Data [TCP segment of a reassembled PDU]
1,1.935608000000002,10.0.2.15,54.93.77.70,TCP,54,34692  >  9001 [ACK] Seq=3214611 Ack=57161931 Win=65535 Len=0
1,1.9444650000000365,54.93.77.70,10.0.2.15,TLSv1.2,170,Application Data
1,1.9474010000001272,54.93.77.70,10.0.2.15,TCP,1502,"9001  >  34692 [PSH, ACK] Seq=57162047 Ack=3214611 Win=65535 Len=1448 [TCP segment of a reassembled PDU]"
1,1.947447000000011,10.0.2.15,54.93.77.70,TCP,54,34692  >  9001 [ACK] Seq=3214611 Ack=57163495 Win=65535 Len=0
1,1.9614520000000084,54.93.77.70,10.0.2.15,TLSv1.2,170,Application Data
1,1.9648520000000644,10.0.2.15,54.93.77.70,TLSv1.2,590,Application Data
1,1.9650739999999587,54.93.77.70,10.0.2.15,TCP,60,9001  >  34692 [ACK] Seq=57163611 Ack=3215147 Win=65535 Len=0
1,1.9741460000000188,62.210.85.178,10.0.2.15,TLSv1.2,590,Application Data
1,2.011658000000125,62.210.85.178,10.0.2.15,TLSv1.2,590,Application Data
1,2.0117700000000696,10.0.2.15,62.210.85.178,TCP,54,35978  >  9001 [ACK] Seq=57206553 Ack=3199277 Win=65535 Len=0
1,2.059637000000066,62.210.85.178,10.0.2.15,TLSv1.2,590,Application Data
1,2.060218999999961,10.0.2.15,62.210.85.178,TLSv1.2,590,Application Data
1,2.0603399999999965,62.210.85.178,10.0.2.15,TCP,60,9001  >  35978 [ACK] Seq=3199813 Ack=57207089 Win=65535 Len=0
1,2.171771000000035,54.93.77.70,10.0.2.15,TLSv1.2,590,Application Data
1,2.1721910000001117,10.0.2.15,54.93.77.70,TLSv1.2,590,Application Data
1,2.1723349999999755,54.93.77.70,10.0.2.15,TCP,60,9001  >  34692 [ACK] Seq=57164147 Ack=3215683 Win=65535 Len=0
1,2.2710270000000037,62.210.85.178,10.0.2.15,TLSv1.2,590,Application Data
1,2.2712750000000597,10.0.2.15,62.210.85.178,TLSv1.2,590,Application Data
1,2.2713820000001306,62.210.85.178,10.0.2.15,TCP,60,9001  >  35978 [ACK] Seq=3200349 Ack=57207625 Win=65535 Len=0
1,2.281594000000041,10.0.2.15,62.210.85.178,TLSv1.2,4124,Application Data
1,2.28176899999994,62.210.85.178,10.0.2.15,TCP,60,9001  >  35978 [ACK] Seq=3200349 Ack=57209085 Win=65535 Len=0
1,2.281789000000117,62.210.85.178,10.0.2.15,TCP,60,9001  >  35978 [ACK] Seq=3200349 Ack=57210545 Win=65535 Len=0
1,2.281793000000107,62.210.85.178,10.0.2.15,TCP,60,9001  >  35978 [ACK] Seq=3200349 Ack=57211695 Win=65535 Len=0
1,2.2818509999999605,10.0.2.15,62.210.85.178,TCP,2974,35978  >  9001 [ACK] Seq=57211695 Ack=3200349 Win=65535 Len=2920 [TCP segment of a reassembled PDU]
1,2.2818990000000667,10.0.2.15,62.210.85.178,TLSv1.2,1204,Application Data
1,2.281921000000011,62.210.85.178,10.0.2.15,TCP,60,9001  >  35978 [ACK] Seq=3200349 Ack=57213155 Win=65535 Len=0
1,2.281928999999991,62.210.85.178,10.0.2.15,TCP,60,9001  >  35978 [ACK] Seq=3200349 Ack=57214615 Win=65535 Len=0
1,2.281932999999981,62.210.85.178,10.0.2.15,TCP,60,9001  >  35978 [ACK] Seq=3200349 Ack=57215765 Win=65535 Len=0
1,2.2819879999999557,10.0.2.15,62.210.85.178,TLSv1.2,4124,Application Data
1,2.2820480000000316,62.210.85.178,10.0.2.15,TCP,60,9001  >  35978 [ACK] Seq=3200349 Ack=57217225 Win=65535 Len=0
1,2.2820580000000064,62.210.85.178,10.0.2.15,TCP,60,9001  >  35978 [ACK] Seq=3200349 Ack=57218685 Win=65535 Len=0
1,2.2820610000001125,62.210.85.178,10.0.2.15,TCP,60,9001  >  35978 [ACK] Seq=3200349 Ack=57219835 Win=65535 Len=0
1,2.2821140000000923,10.0.2.15,62.210.85.178,TLSv1.2,4124,Application Data
1,2.282171999999946,62.210.85.178,10.0.2.15,TCP,60,9001  >  35978 [ACK] Seq=3200349 Ack=57221295 Win=65535 Len=0
1,2.282184000000143,62.210.85.178,10.0.2.15,TCP,60,9001  >  35978 [ACK] Seq=3200349 Ack=57222755 Win=65535 Len=0
1,2.2821870000000217,62.210.85.178,10.0.2.15,TCP,60,9001  >  35978 [ACK] Seq=3200349 Ack=57223905 Win=65535 Len=0
1,2.282230000000027,10.0.2.15,62.210.85.178,TLSv1.2,332,Application Data
1,2.2822850000000017,62.210.85.178,10.0.2.15,TCP,60,9001  >  35978 [ACK] Seq=3200349 Ack=57224183 Win=65535 Len=0
1,2.2823510000000624,10.0.2.15,62.210.85.178,TLSv1.2,3868,Application Data
1,2.2823900000000776,62.210.85.178,10.0.2.15,TCP,60,9001  >  35978 [ACK] Seq=3200349 Ack=57225643 Win=65535 Len=0
1,2.2823969999999463,62.210.85.178,10.0.2.15,TCP,60,9001  >  35978 [ACK] Seq=3200349 Ack=57227103 Win=65535 Len=0
1,2.282400999999936,62.210.85.178,10.0.2.15,TCP,60,9001  >  35978 [ACK] Seq=3200349 Ack=57227997 Win=65535 Len=0
1,2.282447999999931,10.0.2.15,62.210.85.178,TLSv1.2,4124,Application Data
1,2.2825030000001334,62.210.85.178,10.0.2.15,TCP,60,9001  >  35978 [ACK] Seq=3200349 Ack=57229457 Win=65535 Len=0
1,2.282511999999997,62.210.85.178,10.0.2.15,TCP,60,9001  >  35978 [ACK] Seq=3200349 Ack=57230917 Win=65535 Len=0
1,2.282515000000103,62.210.85.178,10.0.2.15,TCP,60,9001  >  35978 [ACK] Seq=3200349 Ack=57232067 Win=65535 Len=0
1,2.282558999999992,10.0.2.15,62.210.85.178,TLSv1.2,3030,Application Data
1,2.2825980000000072,62.210.85.178,10.0.2.15,TCP,60,9001  >  35978 [ACK] Seq=3200349 Ack=57233527 Win=65535 Len=0
1,2.2826050000001032,62.210.85.178,10.0.2.15,TCP,60,9001  >  35978 [ACK] Seq=3200349 Ack=57234987 Win=65535 Len=0
1,2.282607999999982,62.210.85.178,10.0.2.15,TCP,60,9001  >  35978 [ACK] Seq=3200349 Ack=57235043 Win=65535 Len=0
1,2.2929759999999533,10.0.2.15,62.210.85.178,TLSv1.2,4124,Application Data
1,2.29309000000012,62.210.85.178,10.0.2.15,TCP,60,9001  >  35978 [ACK] Seq=3200349 Ack=57236503 Win=65535 Len=0
1,2.29310200000009,62.210.85.178,10.0.2.15,TCP,60,9001  >  35978 [ACK] Seq=3200349 Ack=57237963 Win=65535 Len=0
1,2.2931049999999686,62.210.85.178,10.0.2.15,TCP,60,9001  >  35978 [ACK] Seq=3200349 Ack=57239113 Win=65535 Len=0
1,2.2931479999999738,10.0.2.15,62.210.85.178,TLSv1.2,4124,Application Data
1,2.29320000000007,62.210.85.178,10.0.2.15,TCP,60,9001  >  35978 [ACK] Seq=3200349 Ack=57240573 Win=65535 Len=0
1,2.2932069999999385,62.210.85.178,10.0.2.15,TCP,60,9001  >  35978 [ACK] Seq=3200349 Ack=57242033 Win=65535 Len=0
1,2.2932100000000446,62.210.85.178,10.0.2.15,TCP,60,9001  >  35978 [ACK] Seq=3200349 Ack=57243183 Win=65535 Len=0
1,2.2932479999999487,10.0.2.15,62.210.85.178,TLSv1.2,4124,Application Data
1,2.29328200000009,62.210.85.178,10.0.2.15,TCP,60,9001  >  35978 [ACK] Seq=3200349 Ack=57244643 Win=65535 Len=0
1,2.29329000000007,62.210.85.178,10.0.2.15,TCP,60,9001  >  35978 [ACK] Seq=3200349 Ack=57246103 Win=65535 Len=0
1,2.2932949999999437,62.210.85.178,10.0.2.15,TCP,60,9001  >  35978 [ACK] Seq=3200349 Ack=57247253 Win=65535 Len=0
1,2.29333100000008,10.0.2.15,62.210.85.178,TLSv1.2,4124,Application Data
1,2.2933640000001105,62.210.85.178,10.0.2.15,TCP,60,9001  >  35978 [ACK] Seq=3200349 Ack=57248713 Win=65535 Len=0
1,2.2933720000000903,62.210.85.178,10.0.2.15,TCP,60,9001  >  35978 [ACK] Seq=3200349 Ack=57250173 Win=65535 Len=0
1,2.2933760000000802,62.210.85.178,10.0.2.15,TCP,60,9001  >  35978 [ACK] Seq=3200349 Ack=57251323 Win=65535 Len=0
1,2.2934099999999944,10.0.2.15,62.210.85.178,TLSv1.2,332,Application Data
1,2.293444000000136,62.210.85.178,10.0.2.15,TCP,60,9001  >  35978 [ACK] Seq=3200349 Ack=57251601 Win=65535 Len=0
1,2.2934979999999996,10.0.2.15,62.210.85.178,TLSv1.2,3868,Application Data
1,2.29353500000002,62.210.85.178,10.0.2.15,TCP,60,9001  >  35978 [ACK] Seq=3200349 Ack=57253061 Win=65535 Len=0
1,2.293542000000116,62.210.85.178,10.0.2.15,TCP,60,9001  >  35978 [ACK] Seq=3200349 Ack=57254521 Win=65535 Len=0
1,2.2935449999999946,62.210.85.178,10.0.2.15,TCP,60,9001  >  35978 [ACK] Seq=3200349 Ack=57255415 Win=65535 Len=0
1,2.293583000000126,10.0.2.15,62.210.85.178,TLSv1.2,4124,Application Data
1,2.29361700000004,62.210.85.178,10.0.2.15,TCP,60,9001  >  35978 [ACK] Seq=3200349 Ack=57256875 Win=65535 Len=0
1,2.293624000000136,62.210.85.178,10.0.2.15,TCP,60,9001  >  35978 [ACK] Seq=3200349 Ack=57258335 Win=65535 Len=0
1,2.293627000000015,62.210.85.178,10.0.2.15,TCP,60,9001  >  35978 [ACK] Seq=3200349 Ack=57259485 Win=65535 Len=0
1,2.2936620000000403,10.0.2.15,62.210.85.178,TLSv1.2,3030,Application Data
1,2.2936970000000656,62.210.85.178,10.0.2.15,TCP,60,9001  >  35978 [ACK] Seq=3200349 Ack=57260945 Win=65535 Len=0
1,2.2937030000000505,62.210.85.178,10.0.2.15,TCP,60,9001  >  35978 [ACK] Seq=3200349 Ack=57262405 Win=65535 Len=0
1,2.293705999999929,62.210.85.178,10.0.2.15,TCP,60,9001  >  35978 [ACK] Seq=3200349 Ack=57262461 Win=65535 Len=0
1,2.302903000000015,10.0.2.15,62.210.85.178,TLSv1.2,2132,Application Data
1,2.302957000000106,62.210.85.178,10.0.2.15,TCP,60,9001  >  35978 [ACK] Seq=3200349 Ack=57263921 Win=65535 Len=0
1,2.3029679999999644,62.210.85.178,10.0.2.15,TCP,60,9001  >  35978 [ACK] Seq=3200349 Ack=57264539 Win=65535 Len=0
1,2.3846240000000307,54.93.77.70,10.0.2.15,TLSv1.2,4210,"Application Data, Application Data"
1,2.384755000000041,10.0.2.15,54.93.77.70,TCP,54,34692  >  9001 [ACK] Seq=3215683 Ack=57168303 Win=65535 Len=0
1,2.391988999999967,54.93.77.70,10.0.2.15,TCP,2950,"9001  >  34692 [PSH, ACK] Seq=57168303 Ack=3215683 Win=65535 Len=2896 [TCP segment of a reassembled PDU]"
1,2.3920600000001286,10.0.2.15,54.93.77.70,TCP,54,34692  >  9001 [ACK] Seq=3215683 Ack=57171199 Win=65535 Len=0
1,2.3989389999999275,54.93.77.70,10.0.2.15,TLSv1.2,2950,Application Data [TCP segment of a reassembled PDU]
1,2.398983000000044,10.0.2.15,54.93.77.70,TCP,54,34692  >  9001 [ACK] Seq=3215683 Ack=57174095 Win=65535 Len=0
1,2.40017899999998,54.93.77.70,10.0.2.15,TLSv1.2,8574,"Application Data, Application Data"
1,2.4002439999999297,10.0.2.15,54.93.77.70,TCP,54,34692  >  9001 [ACK] Seq=3215683 Ack=57182615 Win=65535 Len=0
1,2.40028499999994,54.93.77.70,10.0.2.15,TCP,222,"9001  >  34692 [PSH, ACK] Seq=57182615 Ack=3215683 Win=65535 Len=168 [TCP segment of a reassembled PDU]"
1,2.401204000000007,54.93.77.70,10.0.2.15,TLSv1.2,4398,Application Data [TCP segment of a reassembled PDU]
1,2.4012210000000778,54.93.77.70,10.0.2.15,TLSv1.2,9698,"Application Data, Application Data, Application Data, Application Data, Application Data"
1,2.401260000000093,10.0.2.15,54.93.77.70,TCP,54,34692  >  9001 [ACK] Seq=3215683 Ack=57187127 Win=65535 Len=0
1,2.4013300000001436,10.0.2.15,54.93.77.70,TCP,54,34692  >  9001 [ACK] Seq=3215683 Ack=57196771 Win=65535 Len=0
1,2.401563000000124,10.0.2.15,54.93.77.70,TLSv1.2,590,Application Data
1,2.4016320000000633,54.93.77.70,10.0.2.15,TCP,60,9001  >  34692 [ACK] Seq=57196771 Ack=3216219 Win=65535 Len=0
1,2.430663999999979,54.93.77.70,10.0.2.15,TLSv1.2,3674,Application Data
1,2.4306830000000446,54.93.77.70,10.0.2.15,TCP,2950,"9001  >  34692 [PSH, ACK] Seq=57200391 Ack=3216219 Win=65535 Len=2896 [TCP segment of a reassembled PDU]"
1,2.43072200000006,10.0.2.15,54.93.77.70,TCP,54,34692  >  9001 [ACK] Seq=3216219 Ack=57200391 Win=65535 Len=0
1,2.43080000000009,10.0.2.15,54.93.77.70,TCP,54,34692  >  9001 [ACK] Seq=3216219 Ack=57203287 Win=65535 Len=0
1,2.439698000000135,54.93.77.70,10.0.2.15,TLSv1.2,5846,"Application Data, Application Data"
1,2.439740000000029,54.93.77.70,10.0.2.15,TLSv1.2,5846,Application Data [TCP segment of a reassembled PDU]
1,2.4398009999999886,10.0.2.15,54.93.77.70,TCP,54,34692  >  9001 [ACK] Seq=3216219 Ack=57209079 Win=65535 Len=0
1,2.439916999999923,10.0.2.15,54.93.77.70,TCP,54,34692  >  9001 [ACK] Seq=3216219 Ack=57214871 Win=65535 Len=0
1,2.440123999999969,10.0.2.15,54.93.77.70,TLSv1.2,590,Application Data
1,2.4402030000001105,54.93.77.70,10.0.2.15,TCP,60,9001  >  34692 [ACK] Seq=57214871 Ack=3216755 Win=65535 Len=0
1,2.440213999999969,54.93.77.70,10.0.2.15,TLSv1.2,4398,Application Data [TCP segment of a reassembled PDU]
1,2.4402840000000197,10.0.2.15,54.93.77.70,TCP,54,34692  >  9001 [ACK] Seq=3216755 Ack=57219215 Win=65535 Len=0
1,2.4471860000001016,54.93.77.70,10.0.2.15,TLSv1.2,358,Application Data
1,2.453717000000097,10.0.2.15,54.93.77.70,TLSv1.2,590,Application Data
1,2.4538749999999254,54.93.77.70,10.0.2.15,TCP,60,9001  >  34692 [ACK] Seq=57219519 Ack=3217291 Win=65535 Len=0
1,2.5120640000000094,54.93.77.70,10.0.2.15,TLSv1.2,2132,Application Data
1,2.5121950000000197,10.0.2.15,54.93.77.70,TCP,54,34692  >  9001 [ACK] Seq=3217291 Ack=57221597 Win=65535 Len=0
1,2.515928000000031,10.0.2.15,54.93.77.70,TLSv1.2,590,Application Data
1,2.5161219999999958,54.93.77.70,10.0.2.15,TCP,60,9001  >  34692 [ACK] Seq=57221597 Ack=3217827 Win=65535 Len=0
1,2.5234040000000277,62.210.85.178,10.0.2.15,TLSv1.2,590,Application Data
1,2.5650620000001254,10.0.2.15,62.210.85.178,TCP,54,35978  >  9001 [ACK] Seq=57264539 Ack=3200885 Win=65535 Len=0
1,2.6001739999999245,62.210.85.178,10.0.2.15,TLSv1.2,1104,Application Data
1,2.6002730000000156,10.0.2.15,62.210.85.178,TCP,54,35978  >  9001 [ACK] Seq=57264539 Ack=3201935 Win=65535 Len=0
1,2.6788570000001073,62.210.85.178,10.0.2.15,TLSv1.2,590,Application Data
1,2.6789490000001024,10.0.2.15,62.210.85.178,TCP,54,35978  >  9001 [ACK] Seq=57264539 Ack=3202471 Win=65535 Len=0
1,2.6795300000001134,10.0.2.15,62.210.85.178,TLSv1.2,590,Application Data
1,2.6796750000000884,62.210.85.178,10.0.2.15,TCP,60,9001  >  35978 [ACK] Seq=3202471 Ack=57265075 Win=65535 Len=0
1,2.8247140000000854,54.93.77.70,10.0.2.15,TLSv1.2,590,Application Data
1,2.8251580000001013,10.0.2.15,54.93.77.70,TLSv1.2,590,Application Data
1,2.825309000000061,54.93.77.70,10.0.2.15,TCP,60,9001  >  34692 [ACK] Seq=57222133 Ack=3218363 Win=65535 Len=0
1,2.9460699999999633,62.210.85.178,10.0.2.15,TLSv1.2,590,Application Data
1,2.955510000000004,10.0.2.15,62.210.85.178,TLSv1.2,590,Application Data
1,2.955744999999979,62.210.85.178,10.0.2.15,TCP,60,9001  >  35978 [ACK] Seq=3203007 Ack=57265611 Win=65535 Len=0
1,2.969145000000026,10.0.2.15,62.210.85.178,TLSv1.2,4124,Application Data
1,2.9693300000001273,62.210.85.178,10.0.2.15,TCP,60,9001  >  35978 [ACK] Seq=3203007 Ack=57267071 Win=65535 Len=0
1,2.9693560000000616,62.210.85.178,10.0.2.15,TCP,60,9001  >  35978 [ACK] Seq=3203007 Ack=57268531 Win=65535 Len=0
1,2.9693609999999353,62.210.85.178,10.0.2.15,TCP,60,9001  >  35978 [ACK] Seq=3203007 Ack=57269681 Win=65535 Len=0
1,2.9694469999999455,10.0.2.15,62.210.85.178,TLSv1.2,4124,Application Data
1,2.969524000000092,10.0.2.15,62.210.85.178,TCP,2974,35978  >  9001 [ACK] Seq=57273751 Ack=3203007 Win=65535 Len=2920 [TCP segment of a reassembled PDU]
1,2.9695619999999963,62.210.85.178,10.0.2.15,TCP,60,9001  >  35978 [ACK] Seq=3203007 Ack=57271141 Win=65535 Len=0
1,2.969569999999976,62.210.85.178,10.0.2.15,TCP,60,9001  >  35978 [ACK] Seq=3203007 Ack=57272601 Win=65535 Len=0
1,2.969573999999966,62.210.85.178,10.0.2.15,TCP,60,9001  >  35978 [ACK] Seq=3203007 Ack=57273751 Win=65535 Len=0
1,2.969577999999956,62.210.85.178,10.0.2.15,TCP,60,9001  >  35978 [ACK] Seq=3203007 Ack=57275211 Win=65535 Len=0
1,2.969583000000057,62.210.85.178,10.0.2.15,TCP,60,9001  >  35978 [ACK] Seq=3203007 Ack=57276671 Win=65535 Len=0
1,2.969622000000072,10.0.2.15,62.210.85.178,TLSv1.2,1204,Application Data
1,2.9696890000000167,10.0.2.15,62.210.85.178,TCP,2974,35978  >  9001 [ACK] Seq=57277821 Ack=3203007 Win=65535 Len=2920 [TCP segment of a reassembled PDU]
1,2.969724999999926,62.210.85.178,10.0.2.15,TCP,60,9001  >  35978 [ACK] Seq=3203007 Ack=57277821 Win=65535 Len=0
1,2.969732000000022,62.210.85.178,10.0.2.15,TCP,60,9001  >  35978 [ACK] Seq=3203007 Ack=57279281 Win=65535 Len=0
1,2.969737000000123,62.210.85.178,10.0.2.15,TCP,60,9001  >  35978 [ACK] Seq=3203007 Ack=57280741 Win=65535 Len=0
1,2.969771000000037,10.0.2.15,62.210.85.178,TLSv1.2,1204,Application Data
1,2.969859000000042,10.0.2.15,62.210.85.178,TLSv1.2,2974,Application Data
1,2.969906999999921,62.210.85.178,10.0.2.15,TCP,60,9001  >  35978 [ACK] Seq=3203007 Ack=57281891 Win=65535 Len=0
1,2.9699410000000626,10.0.2.15,62.210.85.178,TLSv1.2,1226,Application Data
1,2.9699769999999717,62.210.85.178,10.0.2.15,TCP,60,9001  >  35978 [ACK] Seq=3203007 Ack=57283351 Win=65535 Len=0
1,2.9699829999999565,62.210.85.178,10.0.2.15,TCP,60,9001  >  35978 [ACK] Seq=3203007 Ack=57284811 Win=65535 Len=0
1,2.9699869999999464,62.210.85.178,10.0.2.15,TCP,60,9001  >  35978 [ACK] Seq=3203007 Ack=57285983 Win=65535 Len=0
1,2.9700319999999465,10.0.2.15,62.210.85.178,TLSv1.2,4124,Application Data
1,2.970072000000073,62.210.85.178,10.0.2.15,TCP,60,9001  >  35978 [ACK] Seq=3203007 Ack=57287443 Win=65535 Len=0
1,2.9700780000000577,62.210.85.178,10.0.2.15,TCP,60,9001  >  35978 [ACK] Seq=3203007 Ack=57288903 Win=65535 Len=0
1,2.9700820000000476,62.210.85.178,10.0.2.15,TCP,60,9001  >  35978 [ACK] Seq=3203007 Ack=57290053 Win=65535 Len=0
1,2.9701450000000023,10.0.2.15,62.210.85.178,TLSv1.2,3030,Application Data
1,2.9701850000001286,62.210.85.178,10.0.2.15,TCP,60,9001  >  35978 [ACK] Seq=3203007 Ack=57291513 Win=65535 Len=0
1,2.9701910000001135,62.210.85.178,10.0.2.15,TCP,60,9001  >  35978 [ACK] Seq=3203007 Ack=57292973 Win=65535 Len=0
1,2.970195999999987,62.210.85.178,10.0.2.15,TCP,60,9001  >  35978 [ACK] Seq=3203007 Ack=57293029 Win=65535 Len=0
1,2.979428999999982,10.0.2.15,62.210.85.178,TLSv1.2,4124,Application Data
1,2.9795380000000478,10.0.2.15,62.210.85.178,TCP,2974,35978  >  9001 [ACK] Seq=57297099 Ack=3203007 Win=65535 Len=2920 [TCP segment of a reassembled PDU]
1,2.979581000000053,62.210.85.178,10.0.2.15,TCP,60,9001  >  35978 [ACK] Seq=3203007 Ack=57294489 Win=65535 Len=0
1,2.9795910000000276,62.210.85.178,10.0.2.15,TCP,60,9001  >  35978 [ACK] Seq=3203007 Ack=57295949 Win=65535 Len=0
1,2.9795950000000175,62.210.85.178,10.0.2.15,TCP,60,9001  >  35978 [ACK] Seq=3203007 Ack=57297099 Win=65535 Len=0
1,2.9796000000001186,62.210.85.178,10.0.2.15,TCP,60,9001  >  35978 [ACK] Seq=3203007 Ack=57298559 Win=65535 Len=0
1,2.9796049999999923,62.210.85.178,10.0.2.15,TCP,60,9001  >  35978 [ACK] Seq=3203007 Ack=57300019 Win=65535 Len=0
1,2.9796470000001136,10.0.2.15,62.210.85.178,TLSv1.2,1204,Application Data
1,2.979716999999937,10.0.2.15,62.210.85.178,TCP,2974,35978  >  9001 [ACK] Seq=57301169 Ack=3203007 Win=65535 Len=2920 [TCP segment of a reassembled PDU]
1,2.9797550000000683,62.210.85.178,10.0.2.15,TCP,60,9001  >  35978 [ACK] Seq=3203007 Ack=57301169 Win=65535 Len=0
1,2.9797900000000936,10.0.2.15,62.210.85.178,TLSv1.2,1204,Application Data
1,2.9798330000000988,62.210.85.178,10.0.2.15,TCP,60,9001  >  35978 [ACK] Seq=3203007 Ack=57302629 Win=65535 Len=0
1,2.9798399999999674,62.210.85.178,10.0.2.15,TCP,60,9001  >  35978 [ACK] Seq=3203007 Ack=57304089 Win=65535 Len=0
1,2.9799000000000433,62.210.85.178,10.0.2.15,TCP,60,9001  >  35978 [ACK] Seq=3203007 Ack=57305239 Win=65535 Len=0
1,2.9799399999999423,10.0.2.15,62.210.85.178,TLSv1.2,4124,Application Data
1,2.9799809999999525,62.210.85.178,10.0.2.15,TCP,60,9001  >  35978 [ACK] Seq=3203007 Ack=57306699 Win=65535 Len=0
1,2.9799880000000485,62.210.85.178,10.0.2.15,TCP,60,9001  >  35978 [ACK] Seq=3203007 Ack=57308159 Win=65535 Len=0
1,2.9799920000000384,62.210.85.178,10.0.2.15,TCP,60,9001  >  35978 [ACK] Seq=3203007 Ack=57309309 Win=65535 Len=0
1,2.9800370000000385,10.0.2.15,62.210.85.178,TLSv1.2,332,Application Data
1,2.9800760000000537,62.210.85.178,10.0.2.15,TCP,60,9001  >  35978 [ACK] Seq=3203007 Ack=57309587 Win=65535 Len=0
1,2.9801360000001296,10.0.2.15,62.210.85.178,TLSv1.2,3868,Application Data
1,2.9801830000001246,62.210.85.178,10.0.2.15,TCP,60,9001  >  35978 [ACK] Seq=3203007 Ack=57311047 Win=65535 Len=0
1,2.9801899999999932,62.210.85.178,10.0.2.15,TCP,60,9001  >  35978 [ACK] Seq=3203007 Ack=57312507 Win=65535 Len=0
1,2.980193999999983,62.210.85.178,10.0.2.15,TCP,60,9001  >  35978 [ACK] Seq=3203007 Ack=57313401 Win=65535 Len=0
1,2.980248000000074,10.0.2.15,62.210.85.178,TLSv1.2,4124,Application Data
1,2.980354000000034,10.0.2.15,62.210.85.178,TCP,2974,35978  >  9001 [ACK] Seq=57317471 Ack=3203007 Win=65535 Len=2920 [TCP segment of a reassembled PDU]
1,2.9806539999999586,62.210.85.178,10.0.2.15,TCP,60,9001  >  35978 [ACK] Seq=3203007 Ack=57314861 Win=65535 Len=0
1,2.9806710000000294,62.210.85.178,10.0.2.15,TCP,60,9001  >  35978 [ACK] Seq=3203007 Ack=57316321 Win=65535 Len=0
1,2.9806750000000193,62.210.85.178,10.0.2.15,TCP,60,9001  >  35978 [ACK] Seq=3203007 Ack=57317471 Win=65535 Len=0
1,2.9806800000001203,62.210.85.178,10.0.2.15,TCP,60,9001  >  35978 [ACK] Seq=3203007 Ack=57318931 Win=65535 Len=0
1,2.9806840000001102,62.210.85.178,10.0.2.15,TCP,60,9001  >  35978 [ACK] Seq=3203007 Ack=57320391 Win=65535 Len=0
1,2.9807330000001,10.0.2.15,62.210.85.178,TLSv1.2,110,Application Data
1,2.9807760000001053,62.210.85.178,10.0.2.15,TCP,60,9001  >  35978 [ACK] Seq=3203007 Ack=57320447 Win=65535 Len=0
1,2.9930879999999433,10.0.2.15,62.210.85.178,TLSv1.2,4124,Application Data
1,2.9931819999999334,10.0.2.15,62.210.85.178,TCP,2974,35978  >  9001 [ACK] Seq=57324517 Ack=3203007 Win=65535 Len=2920 [TCP segment of a reassembled PDU]
1,2.9932229999999436,62.210.85.178,10.0.2.15,TCP,60,9001  >  35978 [ACK] Seq=3203007 Ack=57321907 Win=65535 Len=0
1,2.9932309999999234,62.210.85.178,10.0.2.15,TCP,60,9001  >  35978 [ACK] Seq=3203007 Ack=57323367 Win=65535 Len=0
1,2.9932360000000244,62.210.85.178,10.0.2.15,TCP,60,9001  >  35978 [ACK] Seq=3203007 Ack=57324517 Win=65535 Len=0
1,2.9932400000000143,62.210.85.178,10.0.2.15,TCP,60,9001  >  35978 [ACK] Seq=3203007 Ack=57325977 Win=65535 Len=0
1,2.9932440000000042,62.210.85.178,10.0.2.15,TCP,60,9001  >  35978 [ACK] Seq=3203007 Ack=57327437 Win=65535 Len=0
1,2.9932850000000144,10.0.2.15,62.210.85.178,TLSv1.2,1204,Application Data
1,2.993351000000075,10.0.2.15,62.210.85.178,TCP,1514,35978  >  9001 [ACK] Seq=57328587 Ack=3203007 Win=65535 Len=1460 [TCP segment of a reassembled PDU]
1,2.9933880000000954,62.210.85.178,10.0.2.15,TCP,60,9001  >  35978 [ACK] Seq=3203007 Ack=57328587 Win=65535 Len=0
1,2.993394999999964,62.210.85.178,10.0.2.15,TCP,60,9001  >  35978 [ACK] Seq=3203007 Ack=57330047 Win=65535 Len=0
1,2.9934279999999944,10.0.2.15,62.210.85.178,TLSv1.2,1314,Application Data
1,2.99354100000005,62.210.85.178,10.0.2.15,TCP,60,9001  >  35978 [ACK] Seq=3203007 Ack=57331307 Win=65535 Len=0
1,3.053533000000016,54.93.77.70,10.0.2.15,TLSv1.2,590,Application Data
1,3.0860230000000684,54.93.77.70,10.0.2.15,TCP,2950,"9001  >  34692 [PSH, ACK] Seq=57222669 Ack=3218363 Win=65535 Len=2896 [TCP segment of a reassembled PDU]"
1,3.086131000000023,10.0.2.15,54.93.77.70,TCP,54,34692  >  9001 [ACK] Seq=3218363 Ack=57225565 Win=65535 Len=0
1,3.0936490000001413,54.93.77.70,10.0.2.15,TLSv1.2,4398,"Application Data, Application Data"
1,3.0937269999999444,10.0.2.15,54.93.77.70,TCP,54,34692  >  9001 [ACK] Seq=3218363 Ack=57229909 Win=65535 Len=0
1,3.116995000000088,54.93.77.70,10.0.2.15,TLSv1.2,11942,"Application Data, Application Data, Application Data"
1,3.1171489999999267,10.0.2.15,54.93.77.70,TCP,54,34692  >  9001 [ACK] Seq=3218363 Ack=57241797 Win=65535 Len=0
1,3.127817999999934,54.93.77.70,10.0.2.15,TLSv1.2,5846,Application Data
1,3.127868000000035,10.0.2.15,54.93.77.70,TCP,54,34692  >  9001 [ACK] Seq=3218363 Ack=57247589 Win=65535 Len=0
1,3.135541000000103,54.93.77.70,10.0.2.15,TLSv1.2,2016,Application Data
1,3.1356000000000677,10.0.2.15,54.93.77.70,TCP,54,34692  >  9001 [ACK] Seq=3218363 Ack=57249551 Win=65535 Len=0
1,3.1357909999999265,10.0.2.15,54.93.77.70,TLSv1.2,590,Application Data
1,3.1358910000001288,54.93.77.70,10.0.2.15,TCP,60,9001  >  34692 [ACK] Seq=57249551 Ack=3218899 Win=65535 Len=0
1,3.1514790000001085,54.93.77.70,10.0.2.15,TLSv1.2,5846,"Application Data, Application Data"
1,3.151732999999922,10.0.2.15,54.93.77.70,TCP,54,34692  >  9001 [ACK] Seq=3218899 Ack=57255343 Win=65535 Len=0
1,3.1518040000000838,54.93.77.70,10.0.2.15,TLSv1.2,5846,Application Data [TCP segment of a reassembled PDU]
1,3.1518439999999828,10.0.2.15,54.93.77.70,TCP,54,34692  >  9001 [ACK] Seq=3218899 Ack=57261135 Win=65535 Len=0
1,3.1521319999999378,10.0.2.15,54.93.77.70,TLSv1.2,590,Application Data
1,3.1522050000000945,54.93.77.70,10.0.2.15,TCP,60,9001  >  34692 [ACK] Seq=57261135 Ack=3219435 Win=65535 Len=0
1,3.1532770000001165,54.93.77.70,10.0.2.15,TLSv1.2,1408,Application Data
1,3.170515000000023,54.93.77.70,10.0.2.15,TCP,2950,"9001  >  34692 [PSH, ACK] Seq=57262489 Ack=3219435 Win=65535 Len=2896 [TCP segment of a reassembled PDU]"
1,3.170577000000094,10.0.2.15,54.93.77.70,TCP,54,34692  >  9001 [ACK] Seq=3219435 Ack=57265385 Win=65535 Len=0
1,3.189012000000048,54.93.77.70,10.0.2.15,TLSv1.2,264,Application Data
1,3.1998080000000755,54.93.77.70,10.0.2.15,TLSv1.2,5846,Application Data
1,3.1998869999999897,10.0.2.15,54.93.77.70,TCP,54,34692  >  9001 [ACK] Seq=3219435 Ack=57271387 Win=65535 Len=0
1,3.2002780000000257,54.93.77.70,10.0.2.15,TLSv1.2,4398,Application Data [TCP segment of a reassembled PDU]
1,3.200317000000041,10.0.2.15,54.93.77.70,TCP,54,34692  >  9001 [ACK] Seq=3219435 Ack=57275731 Win=65535 Len=0
1,3.223214999999982,54.93.77.70,10.0.2.15,TLSv1.2,4398,"Application Data, Application Data"
1,3.223263000000088,10.0.2.15,54.93.77.70,TCP,54,34692  >  9001 [ACK] Seq=3219435 Ack=57280075 Win=65535 Len=0
1,3.2234189999999217,10.0.2.15,54.93.77.70,TLSv1.2,590,Application Data
1,3.2234889999999723,54.93.77.70,10.0.2.15,TCP,60,9001  >  34692 [ACK] Seq=57280075 Ack=3219971 Win=65535 Len=0
1,3.3072720000000118,54.93.77.70,10.0.2.15,TLSv1.2,7808,"Application Data, Application Data"
1,3.3073229999999967,62.210.85.178,10.0.2.15,TLSv1.2,590,Application Data
1,3.3073289999999815,54.93.77.70,10.0.2.15,TLSv1.2,590,Application Data
1,3.3074490000001333,10.0.2.15,54.93.77.70,TCP,54,34692  >  9001 [ACK] Seq=3219971 Ack=57288365 Win=65535 Len=0
1,3.3101799999999457,10.0.2.15,54.93.77.70,TLSv1.2,590,Application Data
1,3.3103320000000167,54.93.77.70,10.0.2.15,TCP,60,9001  >  34692 [ACK] Seq=57288365 Ack=3220507 Win=65535 Len=0
1,3.3260179999999764,62.210.85.178,10.0.2.15,TLSv1.2,590,Application Data
1,3.326133000000027,10.0.2.15,62.210.85.178,TCP,54,35978  >  9001 [ACK] Seq=57331307 Ack=3204079 Win=65535 Len=0
1,3.955951000000141,62.210.85.178,10.0.2.15,TLSv1.2,1104,Application Data
1,3.9565620000000763,10.0.2.15,62.210.85.178,TLSv1.2,590,Application Data
1,3.9567030000000614,62.210.85.178,10.0.2.15,TCP,60,9001  >  35978 [ACK] Seq=3205129 Ack=57331843 Win=65535 Len=0
1,4.155412999999953,54.93.77.70,10.0.2.15,TLSv1.2,590,Application Data
1,4.155866999999944,10.0.2.15,54.93.77.70,TLSv1.2,590,Application Data
1,4.156016000000136,54.93.77.70,10.0.2.15,TCP,60,9001  >  34692 [ACK] Seq=57288901 Ack=3221043 Win=65535 Len=0
1,4.29719799999998,62.210.85.178,10.0.2.15,TLSv1.2,590,Application Data
1,4.301637000000028,10.0.2.15,62.210.85.178,TLSv1.2,590,Application Data
1,4.301836999999978,62.210.85.178,10.0.2.15,TCP,60,9001  >  35978 [ACK] Seq=3205665 Ack=57332379 Win=65535 Len=0
1,4.313114999999925,10.0.2.15,62.210.85.178,TLSv1.2,4124,Application Data
1,4.313223000000107,10.0.2.15,62.210.85.178,TCP,2974,35978  >  9001 [ACK] Seq=57336449 Ack=3205665 Win=65535 Len=2920 [TCP segment of a reassembled PDU]
1,4.313270000000102,62.210.85.178,10.0.2.15,TCP,60,9001  >  35978 [ACK] Seq=3205665 Ack=57333839 Win=65535 Len=0
1,4.313280000000077,62.210.85.178,10.0.2.15,TCP,60,9001  >  35978 [ACK] Seq=3205665 Ack=57335299 Win=65535 Len=0
1,4.313284999999951,62.210.85.178,10.0.2.15,TCP,60,9001  >  35978 [ACK] Seq=3205665 Ack=57336449 Win=65535 Len=0
1,4.313290000000052,62.210.85.178,10.0.2.15,TCP,60,9001  >  35978 [ACK] Seq=3205665 Ack=57337909 Win=65535 Len=0
1,4.313294000000042,62.210.85.178,10.0.2.15,TCP,60,9001  >  35978 [ACK] Seq=3205665 Ack=57339369 Win=65535 Len=0
1,4.313337000000047,10.0.2.15,62.210.85.178,TLSv1.2,1204,Application Data
1,4.313378000000057,62.210.85.178,10.0.2.15,TCP,60,9001  >  35978 [ACK] Seq=3205665 Ack=57340519 Win=65535 Len=0
1,4.313427000000047,10.0.2.15,62.210.85.178,TLSv1.2,3288,Application Data
1,4.313468000000057,62.210.85.178,10.0.2.15,TCP,60,9001  >  35978 [ACK] Seq=3205665 Ack=57341979 Win=65535 Len=0
1,4.313474999999926,62.210.85.178,10.0.2.15,TCP,60,9001  >  35978 [ACK] Seq=3205665 Ack=57343439 Win=65535 Len=0
1,4.313479000000143,62.210.85.178,10.0.2.15,TCP,60,9001  >  35978 [ACK] Seq=3205665 Ack=57343753 Win=65535 Len=0
1,4.4085130000000845,54.93.77.70,10.0.2.15,TLSv1.2,590,Application Data
1,4.448793000000023,10.0.2.15,54.93.77.70,TCP,54,34692  >  9001 [ACK] Seq=3221043 Ack=57289437 Win=65535 Len=0
1,4.876258000000007,54.93.77.70,10.0.2.15,TCP,2950,"9001  >  34692 [PSH, ACK] Seq=57289437 Ack=3221043 Win=65535 Len=2896 [TCP segment of a reassembled PDU]"
1,4.876351000000113,10.0.2.15,54.93.77.70,TCP,54,34692  >  9001 [ACK] Seq=3221043 Ack=57292333 Win=65535 Len=0
1,4.884600000000091,54.93.77.70,10.0.2.15,TLSv1.2,778,Application Data
1,4.884665999999925,10.0.2.15,54.93.77.70,TCP,54,34692  >  9001 [ACK] Seq=3221043 Ack=57293057 Win=65535 Len=0
1,4.885573000000022,54.93.77.70,10.0.2.15,TLSv1.2,7294,Application Data
1,4.885637000000088,10.0.2.15,54.93.77.70,TCP,54,34692  >  9001 [ACK] Seq=3221043 Ack=57300297 Win=65535 Len=0
1,4.89974200000006,54.93.77.70,10.0.2.15,TLSv1.2,590,"Application Data, Application Data"
1,4.899793999999929,10.0.2.15,54.93.77.70,TCP,54,34692  >  9001 [ACK] Seq=3221043 Ack=57300833 Win=65535 Len=0
1,4.902573000000075,10.0.2.15,54.93.77.70,TLSv1.2,590,Application Data
1,4.902739999999994,54.93.77.70,10.0.2.15,TCP,60,9001  >  34692 [ACK] Seq=57300833 Ack=3221579 Win=65535 Len=0
1,5.794855000000098,62.210.85.178,10.0.2.15,TLSv1.2,590,Application Data
1,5.795163000000002,10.0.2.15,62.210.85.178,TLSv1.2,590,Application Data
1,5.795272999999952,62.210.85.178,10.0.2.15,TCP,60,9001  >  35978 [ACK] Seq=3206201 Ack=57344289 Win=65535 Len=0
1,6.716096999999991,54.93.77.70,10.0.2.15,TLSv1.2,590,Application Data
1,6.716484000000037,10.0.2.15,54.93.77.70,TLSv1.2,590,Application Data
1,6.716599999999971,54.93.77.70,10.0.2.15,TCP,60,9001  >  34692 [ACK] Seq=57301369 Ack=3222115 Win=65535 Len=0
1,7.33050100000014,62.210.85.178,10.0.2.15,TLSv1.2,590,Application Data
1,7.336350000000039,10.0.2.15,62.210.85.178,TLSv1.2,590,Application Data
1,7.336520000000064,62.210.85.178,10.0.2.15,TCP,60,9001  >  35978 [ACK] Seq=3206737 Ack=57344825 Win=65535 Len=0
1,7.3467299999999796,10.0.2.15,62.210.85.178,TLSv1.2,4124,Application Data
1,7.3468279999999595,10.0.2.15,62.210.85.178,TCP,2974,35978  >  9001 [ACK] Seq=57348895 Ack=3206737 Win=65535 Len=2920 [TCP segment of a reassembled PDU]
1,7.3468820000000505,62.210.85.178,10.0.2.15,TCP,60,9001  >  35978 [ACK] Seq=3206737 Ack=57346285 Win=65535 Len=0
1,7.34689400000002,62.210.85.178,10.0.2.15,TCP,60,9001  >  35978 [ACK] Seq=3206737 Ack=57347745 Win=65535 Len=0
1,7.34689800000001,62.210.85.178,10.0.2.15,TCP,60,9001  >  35978 [ACK] Seq=3206737 Ack=57348895 Win=65535 Len=0
1,7.346901000000116,62.210.85.178,10.0.2.15,TCP,60,9001  >  35978 [ACK] Seq=3206737 Ack=57350355 Win=65535 Len=0
1,7.346903000000111,62.210.85.178,10.0.2.15,TCP,60,9001  >  35978 [ACK] Seq=3206737 Ack=57351815 Win=65535 Len=0
1,7.346964000000071,10.0.2.15,62.210.85.178,TLSv1.2,1204,Application Data
1,7.347013999999945,62.210.85.178,10.0.2.15,TCP,60,9001  >  35978 [ACK] Seq=3206737 Ack=57352965 Win=65535 Len=0
1,7.347070000000031,10.0.2.15,62.210.85.178,TLSv1.2,4124,Application Data
1,7.347111000000041,62.210.85.178,10.0.2.15,TCP,60,9001  >  35978 [ACK] Seq=3206737 Ack=57354425 Win=65535 Len=0
1,7.347119000000021,62.210.85.178,10.0.2.15,TCP,60,9001  >  35978 [ACK] Seq=3206737 Ack=57355885 Win=65535 Len=0
1,7.3471230000000105,62.210.85.178,10.0.2.15,TCP,60,9001  >  35978 [ACK] Seq=3206737 Ack=57357035 Win=65535 Len=0
1,7.347162000000026,10.0.2.15,62.210.85.178,TLSv1.2,4124,Application Data
1,7.347197000000051,62.210.85.178,10.0.2.15,TCP,60,9001  >  35978 [ACK] Seq=3206737 Ack=57358495 Win=65535 Len=0
1,7.347204000000147,62.210.85.178,10.0.2.15,TCP,60,9001  >  35978 [ACK] Seq=3206737 Ack=57359955 Win=65535 Len=0
1,7.34727399999997,10.0.2.15,62.210.85.178,TLSv1.2,2974,Application Data
1,7.347310000000107,62.210.85.178,10.0.2.15,TCP,60,9001  >  35978 [ACK] Seq=3206737 Ack=57361105 Win=65535 Len=0
1,7.3473169999999755,62.210.85.178,10.0.2.15,TCP,60,9001  >  35978 [ACK] Seq=3206737 Ack=57362565 Win=65535 Len=0
1,7.347320999999965,62.210.85.178,10.0.2.15,TCP,60,9001  >  35978 [ACK] Seq=3206737 Ack=57364025 Win=65535 Len=0
1,7.347349000000122,10.0.2.15,62.210.85.178,TLSv1.2,1226,Application Data
1,7.347381999999925,62.210.85.178,10.0.2.15,TCP,60,9001  >  35978 [ACK] Seq=3206737 Ack=57365197 Win=65535 Len=0
1,7.347422000000051,10.0.2.15,62.210.85.178,TLSv1.2,4124,Application Data
1,7.347457000000077,62.210.85.178,10.0.2.15,TCP,60,9001  >  35978 [ACK] Seq=3206737 Ack=57366657 Win=65535 Len=0
1,7.347463999999945,62.210.85.178,10.0.2.15,TCP,60,9001  >  35978 [ACK] Seq=3206737 Ack=57368117 Win=65535 Len=0
1,7.3474670000000515,62.210.85.178,10.0.2.15,TCP,60,9001  >  35978 [ACK] Seq=3206737 Ack=57369267 Win=65535 Len=0
1,7.347502999999961,10.0.2.15,62.210.85.178,TLSv1.2,3030,Application Data
1,7.347539000000097,62.210.85.178,10.0.2.15,TCP,60,9001  >  35978 [ACK] Seq=3206737 Ack=57370727 Win=65535 Len=0
1,7.347545000000082,62.210.85.178,10.0.2.15,TCP,60,9001  >  35978 [ACK] Seq=3206737 Ack=57372187 Win=65535 Len=0
1,7.347547999999961,62.210.85.178,10.0.2.15,TCP,60,9001  >  35978 [ACK] Seq=3206737 Ack=57372243 Win=65535 Len=0
1,7.356864999999971,10.0.2.15,62.210.85.178,TLSv1.2,4124,Application Data
1,7.357019000000037,62.210.85.178,10.0.2.15,TCP,60,9001  >  35978 [ACK] Seq=3206737 Ack=57373703 Win=65535 Len=0
1,7.357034000000112,62.210.85.178,10.0.2.15,TCP,60,9001  >  35978 [ACK] Seq=3206737 Ack=57375163 Win=65535 Len=0
1,7.357038000000102,62.210.85.178,10.0.2.15,TCP,60,9001  >  35978 [ACK] Seq=3206737 Ack=57376313 Win=65535 Len=0
1,7.357083000000102,10.0.2.15,62.210.85.178,TLSv1.2,4124,Application Data
1,7.357123000000001,62.210.85.178,10.0.2.15,TCP,60,9001  >  35978 [ACK] Seq=3206737 Ack=57377773 Win=65535 Len=0
1,7.357132000000092,62.210.85.178,10.0.2.15,TCP,60,9001  >  35978 [ACK] Seq=3206737 Ack=57379233 Win=65535 Len=0
1,7.357136999999966,62.210.85.178,10.0.2.15,TCP,60,9001  >  35978 [ACK] Seq=3206737 Ack=57380383 Win=65535 Len=0
1,7.357177999999976,10.0.2.15,62.210.85.178,TLSv1.2,4124,Application Data
1,7.357216000000108,62.210.85.178,10.0.2.15,TCP,60,9001  >  35978 [ACK] Seq=3206737 Ack=57381843 Win=65535 Len=0
1,7.357224999999971,62.210.85.178,10.0.2.15,TCP,60,9001  >  35978 [ACK] Seq=3206737 Ack=57383303 Win=65535 Len=0
1,7.357230000000072,62.210.85.178,10.0.2.15,TCP,60,9001  >  35978 [ACK] Seq=3206737 Ack=57384453 Win=65535 Len=0
1,7.357267999999976,10.0.2.15,62.210.85.178,TLSv1.2,4124,Application Data
1,7.357306999999992,62.210.85.178,10.0.2.15,TCP,60,9001  >  35978 [ACK] Seq=3206737 Ack=57385913 Win=65535 Len=0
1,7.357316000000083,62.210.85.178,10.0.2.15,TCP,60,9001  >  35978 [ACK] Seq=3206737 Ack=57387373 Win=65535 Len=0
1,7.357322000000067,62.210.85.178,10.0.2.15,TCP,60,9001  >  35978 [ACK] Seq=3206737 Ack=57388523 Win=65535 Len=0
1,7.357357000000093,10.0.2.15,62.210.85.178,TLSv1.2,332,Application Data
1,7.357394000000113,62.210.85.178,10.0.2.15,TCP,60,9001  >  35978 [ACK] Seq=3206737 Ack=57388801 Win=65535 Len=0
1,7.3574539999999615,10.0.2.15,62.210.85.178,TLSv1.2,3868,Application Data
1,7.357492999999977,62.210.85.178,10.0.2.15,TCP,60,9001  >  35978 [ACK] Seq=3206737 Ack=57390261 Win=65535 Len=0
1,7.3575009999999565,62.210.85.178,10.0.2.15,TCP,60,9001  >  35978 [ACK] Seq=3206737 Ack=57391721 Win=65535 Len=0
1,7.3575049999999464,62.210.85.178,10.0.2.15,TCP,60,9001  >  35978 [ACK] Seq=3206737 Ack=57392615 Win=65535 Len=0
1,7.357543000000078,10.0.2.15,62.210.85.178,TLSv1.2,4124,Application Data
1,7.357582000000093,62.210.85.178,10.0.2.15,TCP,60,9001  >  35978 [ACK] Seq=3206737 Ack=57394075 Win=65535 Len=0
1,7.357590000000073,62.210.85.178,10.0.2.15,TCP,60,9001  >  35978 [ACK] Seq=3206737 Ack=57395535 Win=65535 Len=0
1,7.357594000000063,62.210.85.178,10.0.2.15,TCP,60,9001  >  35978 [ACK] Seq=3206737 Ack=57396685 Win=65535 Len=0
1,7.357629999999972,10.0.2.15,62.210.85.178,TLSv1.2,3030,Application Data
1,7.357668999999987,62.210.85.178,10.0.2.15,TCP,60,9001  >  35978 [ACK] Seq=3206737 Ack=57398145 Win=65535 Len=0
1,7.357676000000083,62.210.85.178,10.0.2.15,TCP,60,9001  >  35978 [ACK] Seq=3206737 Ack=57399605 Win=65535 Len=0
1,7.357680000000073,62.210.85.178,10.0.2.15,TCP,60,9001  >  35978 [ACK] Seq=3206737 Ack=57399661 Win=65535 Len=0
1,7.369142000000011,10.0.2.15,62.210.85.178,TLSv1.2,4124,Application Data
1,7.369233000000122,62.210.85.178,10.0.2.15,TCP,60,9001  >  35978 [ACK] Seq=3206737 Ack=57401121 Win=65535 Len=0
1,7.369243000000097,62.210.85.178,10.0.2.15,TCP,60,9001  >  35978 [ACK] Seq=3206737 Ack=57402581 Win=65535 Len=0
1,7.3692459999999755,62.210.85.178,10.0.2.15,TCP,60,9001  >  35978 [ACK] Seq=3206737 Ack=57403731 Win=65535 Len=0
1,7.369288999999981,10.0.2.15,62.210.85.178,TLSv1.2,4124,Application Data
1,7.369327999999996,62.210.85.178,10.0.2.15,TCP,60,9001  >  35978 [ACK] Seq=3206737 Ack=57405191 Win=65535 Len=0
1,7.369337000000087,62.210.85.178,10.0.2.15,TCP,60,9001  >  35978 [ACK] Seq=3206737 Ack=57406651 Win=65535 Len=0
1,7.369341000000077,62.210.85.178,10.0.2.15,TCP,60,9001  >  35978 [ACK] Seq=3206737 Ack=57407801 Win=65535 Len=0
1,7.369380000000092,10.0.2.15,62.210.85.178,TLSv1.2,4124,Application Data
1,7.369417999999996,62.210.85.178,10.0.2.15,TCP,60,9001  >  35978 [ACK] Seq=3206737 Ack=57409261 Win=65535 Len=0
1,7.369464999999991,10.0.2.15,62.210.85.178,TCP,1514,35978  >  9001 [ACK] Seq=57411871 Ack=3206737 Win=65535 Len=1460 [TCP segment of a reassembled PDU]
1,7.3695030000001225,62.210.85.178,10.0.2.15,TCP,60,9001  >  35978 [ACK] Seq=3206737 Ack=57410721 Win=65535 Len=0
1,7.369513999999981,62.210.85.178,10.0.2.15,TCP,60,9001  >  35978 [ACK] Seq=3206737 Ack=57411871 Win=65535 Len=0
1,7.369517999999971,62.210.85.178,10.0.2.15,TCP,60,9001  >  35978 [ACK] Seq=3206737 Ack=57413331 Win=65535 Len=0
1,7.369546000000128,10.0.2.15,62.210.85.178,TLSv1.2,864,Application Data
1,7.369582000000037,62.210.85.178,10.0.2.15,TCP,60,9001  >  35978 [ACK] Seq=3206737 Ack=57414141 Win=65535 Len=0
1,7.463899999999967,54.93.77.70,10.0.2.15,TLSv1.2,590,Application Data
1,7.504817000000003,10.0.2.15,54.93.77.70,TCP,54,34692  >  9001 [ACK] Seq=3222115 Ack=57301905 Win=65535 Len=0
1,7.553922999999941,54.93.77.70,10.0.2.15,TLSv1.2,3674,Application Data
1,7.5540340000000015,10.0.2.15,54.93.77.70,TCP,54,34692  >  9001 [ACK] Seq=3222115 Ack=57305525 Win=65535 Len=0
1,7.739990000000034,54.93.77.70,10.0.2.15,TCP,2950,"9001  >  34692 [PSH, ACK] Seq=57305525 Ack=3222115 Win=65535 Len=2896 [TCP segment of a reassembled PDU]"
1,7.740066999999954,10.0.2.15,54.93.77.70,TCP,54,34692  >  9001 [ACK] Seq=3222115 Ack=57308421 Win=65535 Len=0
1,7.74292800000012,54.93.77.70,10.0.2.15,TLSv1.2,778,Application Data
1,7.742972000000009,10.0.2.15,54.93.77.70,TCP,54,34692  >  9001 [ACK] Seq=3222115 Ack=57309145 Win=65535 Len=0
1,7.74316900000008,10.0.2.15,54.93.77.70,TLSv1.2,590,Application Data
1,7.743253999999979,54.93.77.70,10.0.2.15,TCP,60,9001  >  34692 [ACK] Seq=57309145 Ack=3222651 Win=65535 Len=0
1,7.744226000000026,54.93.77.70,10.0.2.15,TLSv1.2,8742,"Application Data, Application Data"
1,7.744300000000067,10.0.2.15,54.93.77.70,TCP,54,34692  >  9001 [ACK] Seq=3222651 Ack=57317833 Win=65535 Len=0
1,7.745496000000003,54.93.77.70,10.0.2.15,TLSv1.2,1502,Application Data [TCP segment of a reassembled PDU]
1,7.745537000000013,10.0.2.15,54.93.77.70,TCP,54,34692  >  9001 [ACK] Seq=3222651 Ack=57319281 Win=65535 Len=0
1,7.758784999999989,54.93.77.70,10.0.2.15,TCP,2950,"9001  >  34692 [PSH, ACK] Seq=57319281 Ack=3222651 Win=65535 Len=2896 [TCP segment of a reassembled PDU]"
1,7.75894900000003,10.0.2.15,54.93.77.70,TCP,54,34692  >  9001 [ACK] Seq=3222651 Ack=57322177 Win=65535 Len=0
1,7.75940700000001,54.93.77.70,10.0.2.15,TLSv1.2,4398,Application Data [TCP segment of a reassembled PDU]
1,7.759477000000061,10.0.2.15,54.93.77.70,TCP,54,34692  >  9001 [ACK] Seq=3222651 Ack=57326521 Win=65535 Len=0
1,7.760316000000103,54.93.77.70,10.0.2.15,TLSv1.2,1502,Application Data [TCP segment of a reassembled PDU]
1,7.760357000000113,10.0.2.15,54.93.77.70,TCP,54,34692  >  9001 [ACK] Seq=3222651 Ack=57327969 Win=65535 Len=0
1,7.7616680000001,54.93.77.70,10.0.2.15,TLSv1.2,5564,"Application Data, Application Data, Application Data"
1,7.761733999999933,10.0.2.15,54.93.77.70,TCP,54,34692  >  9001 [ACK] Seq=3222651 Ack=57333479 Win=65535 Len=0
1,7.761886000000004,10.0.2.15,54.93.77.70,TLSv1.2,590,Application Data
1,7.761952000000065,54.93.77.70,10.0.2.15,TCP,60,9001  >  34692 [ACK] Seq=57333479 Ack=3223187 Win=65535 Len=0
1,7.763550000000123,54.93.77.70,10.0.2.15,TCP,2950,"9001  >  34692 [PSH, ACK] Seq=57333479 Ack=3223187 Win=65535 Len=2896 [TCP segment of a reassembled PDU]"
1,7.763591000000133,10.0.2.15,54.93.77.70,TCP,54,34692  >  9001 [ACK] Seq=3223187 Ack=57336375 Win=65535 Len=0
1,7.777389000000085,54.93.77.70,10.0.2.15,TLSv1.2,264,Application Data
1,7.820807999999943,10.0.2.15,54.93.77.70,TCP,54,34692  >  9001 [ACK] Seq=3223187 Ack=57336585 Win=65535 Len=0
1,7.836696999999958,54.93.77.70,10.0.2.15,TLSv1.2,590,Application Data
1,7.836772999999994,10.0.2.15,54.93.77.70,TCP,54,34692  >  9001 [ACK] Seq=3223187 Ack=57337121 Win=65535 Len=0
1,7.869681000000128,54.93.77.70,10.0.2.15,TLSv1.2,3674,Application Data
1,7.8697400000000926,10.0.2.15,54.93.77.70,TCP,54,34692  >  9001 [ACK] Seq=3223187 Ack=57340741 Win=65535 Len=0
1,7.934068000000025,54.93.77.70,10.0.2.15,TLSv1.2,3674,Application Data
1,7.9341360000000805,10.0.2.15,54.93.77.70,TCP,54,34692  >  9001 [ACK] Seq=3223187 Ack=57344361 Win=65535 Len=0
1,7.948914000000059,62.210.85.178,10.0.2.15,TLSv1.2,590,Application Data
1,7.966519999999946,54.93.77.70,10.0.2.15,TLSv1.2,590,Application Data
1,7.966675000000123,10.0.2.15,54.93.77.70,TCP,54,34692  >  9001 [ACK] Seq=3223187 Ack=57344897 Win=65535 Len=0
1,7.992791000000125,10.0.2.15,62.210.85.178,TCP,54,35978  >  9001 [ACK] Seq=57414141 Ack=3207273 Win=65535 Len=0
1,8.033247999999958,54.93.77.70,10.0.2.15,TLSv1.2,1104,Application Data
1,8.033370000000104,10.0.2.15,54.93.77.70,TCP,54,34692  >  9001 [ACK] Seq=3223187 Ack=57345947 Win=65535 Len=0
1,8.042431000000079,54.93.77.70,10.0.2.15,TLSv1.2,5846,Application Data
1,8.042515000000094,10.0.2.15,54.93.77.70,TCP,54,34692  >  9001 [ACK] Seq=3223187 Ack=57351739 Win=65535 Len=0
1,8.042772000000014,54.93.77.70,10.0.2.15,TCP,1502,"9001  >  34692 [PSH, ACK] Seq=57351739 Ack=3223187 Win=65535 Len=1448 [TCP segment of a reassembled PDU]"
1,8.042809000000034,10.0.2.15,54.93.77.70,TCP,54,34692  >  9001 [ACK] Seq=3223187 Ack=57353187 Win=65535 Len=0
1,8.053010000000086,54.93.77.70,10.0.2.15,TLSv1.2,568,Application Data
1,8.05307300000004,10.0.2.15,54.93.77.70,TCP,54,34692  >  9001 [ACK] Seq=3223187 Ack=57353701 Win=65535 Len=0
1,8.053225999999995,10.0.2.15,54.93.77.70,TLSv1.2,590,Application Data
1,8.053294999999935,54.93.77.70,10.0.2.15,TCP,60,9001  >  34692 [ACK] Seq=57353701 Ack=3223723 Win=65535 Len=0
1,8.109850999999935,54.93.77.70,10.0.2.15,TLSv1.2,3674,Application Data
1,8.109959000000117,10.0.2.15,54.93.77.70,TCP,54,34692  >  9001 [ACK] Seq=3223723 Ack=57357321 Win=65535 Len=0
1,8.122972000000118,62.210.85.178,10.0.2.15,TLSv1.2,590,Application Data
1,8.123021000000108,10.0.2.15,62.210.85.178,TCP,54,35978  >  9001 [ACK] Seq=57414141 Ack=3207809 Win=65535 Len=0
1,8.25613300000009,54.93.77.70,10.0.2.15,TLSv1.2,2132,Application Data
1,8.256246000000147,10.0.2.15,54.93.77.70,TCP,54,34692  >  9001 [ACK] Seq=3223723 Ack=57359399 Win=65535 Len=0
1,8.257789000000002,62.210.85.178,10.0.2.15,TLSv1.2,590,Application Data
1,8.257851000000073,10.0.2.15,62.210.85.178,TCP,54,35978  >  9001 [ACK] Seq=57414141 Ack=3208345 Win=65535 Len=0
1,8.456529000000046,54.93.77.70,10.0.2.15,TCP,2950,"9001  >  34692 [PSH, ACK] Seq=57359399 Ack=3223723 Win=65535 Len=2896 [TCP segment of a reassembled PDU]"
1,8.456626000000142,10.0.2.15,54.93.77.70,TCP,54,34692  >  9001 [ACK] Seq=3223723 Ack=57362295 Win=65535 Len=0
1,8.459835999999996,54.93.77.70,10.0.2.15,TLSv1.2,6990,"Application Data, Application Data, Application Data"
1,8.459913000000142,10.0.2.15,54.93.77.70,TCP,54,34692  >  9001 [ACK] Seq=3223723 Ack=57369231 Win=65535 Len=0
1,8.460125000000062,10.0.2.15,54.93.77.70,TLSv1.2,590,Application Data
1,8.460235000000011,54.93.77.70,10.0.2.15,TCP,60,9001  >  34692 [ACK] Seq=57369231 Ack=3224259 Win=65535 Len=0
1,8.528612000000066,54.93.77.70,10.0.2.15,TLSv1.2,2132,Application Data
1,8.528692999999976,10.0.2.15,54.93.77.70,TCP,54,34692  >  9001 [ACK] Seq=3224259 Ack=57371309 Win=65535 Len=0
1,8.532410000000027,10.0.2.15,54.93.77.70,TLSv1.2,590,Application Data
1,8.532629000000043,54.93.77.70,10.0.2.15,TCP,60,9001  >  34692 [ACK] Seq=57371309 Ack=3224795 Win=65535 Len=0
1,8.871562999999924,62.210.85.178,10.0.2.15,TLSv1.2,1104,Application Data
1,8.87164400000006,10.0.2.15,62.210.85.178,TCP,54,35978  >  9001 [ACK] Seq=57414141 Ack=3209395 Win=65535 Len=0
1,8.872129000000086,10.0.2.15,62.210.85.178,TLSv1.2,590,Application Data
1,8.872237000000041,62.210.85.178,10.0.2.15,TCP,60,9001  >  35978 [ACK] Seq=3209395 Ack=57414677 Win=65535 Len=0
1,8.984369000000015,54.93.77.70,10.0.2.15,TLSv1.2,590,Application Data
1,8.984850999999935,10.0.2.15,54.93.77.70,TLSv1.2,590,Application Data
1,8.984975000000077,54.93.77.70,10.0.2.15,TCP,60,9001  >  34692 [ACK] Seq=57371845 Ack=3225331 Win=65535 Len=0
1,9.48034000000007,62.210.85.178,10.0.2.15,TLSv1.2,590,Application Data
1,9.484875999999986,10.0.2.15,62.210.85.178,TLSv1.2,590,Application Data
1,9.485059999999976,62.210.85.178,10.0.2.15,TCP,60,9001  >  35978 [ACK] Seq=3209931 Ack=57415213 Win=65535 Len=0
1,9.497491999999966,10.0.2.15,62.210.85.178,TLSv1.2,4124,Application Data
1,9.497624000000087,10.0.2.15,62.210.85.178,TCP,2974,35978  >  9001 [ACK] Seq=57419283 Ack=3209931 Win=65535 Len=2920 [TCP segment of a reassembled PDU]
1,9.497669999999971,62.210.85.178,10.0.2.15,TCP,60,9001  >  35978 [ACK] Seq=3209931 Ack=57416673 Win=65535 Len=0
1,9.497681000000057,62.210.85.178,10.0.2.15,TCP,60,9001  >  35978 [ACK] Seq=3209931 Ack=57418133 Win=65535 Len=0
1,9.497685000000047,62.210.85.178,10.0.2.15,TCP,60,9001  >  35978 [ACK] Seq=3209931 Ack=57419283 Win=65535 Len=0
1,9.497690000000148,62.210.85.178,10.0.2.15,TCP,60,9001  >  35978 [ACK] Seq=3209931 Ack=57420743 Win=65535 Len=0
1,9.497694000000138,62.210.85.178,10.0.2.15,TCP,60,9001  >  35978 [ACK] Seq=3209931 Ack=57422203 Win=65535 Len=0
1,9.497738000000027,10.0.2.15,62.210.85.178,TLSv1.2,1204,Application Data
1,9.497806999999966,10.0.2.15,62.210.85.178,TCP,2974,35978  >  9001 [ACK] Seq=57423353 Ack=3209931 Win=65535 Len=2920 [TCP segment of a reassembled PDU]
1,9.497849000000087,62.210.85.178,10.0.2.15,TCP,60,9001  >  35978 [ACK] Seq=3209931 Ack=57423353 Win=65535 Len=0
1,9.497855999999956,62.210.85.178,10.0.2.15,TCP,60,9001  >  35978 [ACK] Seq=3209931 Ack=57424813 Win=65535 Len=0
1,9.497861000000057,62.210.85.178,10.0.2.15,TCP,60,9001  >  35978 [ACK] Seq=3209931 Ack=57426273 Win=65535 Len=0
1,9.497896000000082,10.0.2.15,62.210.85.178,TLSv1.2,1204,Application Data
1,9.497990999999956,62.210.85.178,10.0.2.15,TCP,60,9001  >  35978 [ACK] Seq=3209931 Ack=57427423 Win=65535 Len=0
1,9.498035999999956,10.0.2.15,62.210.85.178,TLSv1.2,268,Application Data
1,9.498137999999926,62.210.85.178,10.0.2.15,TCP,60,9001  >  35978 [ACK] Seq=3209931 Ack=57427637 Win=65535 Len=0
1,9.685398999999961,54.93.77.70,10.0.2.15,TCP,2950,"9001  >  34692 [PSH, ACK] Seq=57371845 Ack=3225331 Win=65535 Len=2896 [TCP segment of a reassembled PDU]"
1,9.685564999999997,10.0.2.15,54.93.77.70,TCP,54,34692  >  9001 [ACK] Seq=3225331 Ack=57374741 Win=65535 Len=0
1,9.688126000000011,54.93.77.70,10.0.2.15,TLSv1.2,778,Application Data
1,9.688806999999997,54.93.77.70,10.0.2.15,TLSv1.2,7294,Application Data
1,9.689225000000079,10.0.2.15,54.93.77.70,TCP,54,34692  >  9001 [ACK] Seq=3225331 Ack=57382705 Win=65535 Len=0
1,9.705015000000003,54.93.77.70,10.0.2.15,TLSv1.2,1104,"Application Data, Application Data"
1,9.748775000000023,10.0.2.15,54.93.77.70,TCP,54,34692  >  9001 [ACK] Seq=3225331 Ack=57383755 Win=65535 Len=0
1,9.775630000000092,54.93.77.70,10.0.2.15,TLSv1.2,1104,Application Data
1,9.775707000000011,10.0.2.15,54.93.77.70,TCP,54,34692  >  9001 [ACK] Seq=3225331 Ack=57384805 Win=65535 Len=0
1,9.77794300000005,10.0.2.15,54.93.77.70,TLSv1.2,590,Application Data
1,9.778109000000086,54.93.77.70,10.0.2.15,TCP,60,9001  >  34692 [ACK] Seq=57384805 Ack=3225867 Win=65535 Len=0
1,9.88735500000007,62.210.85.178,10.0.2.15,TLSv1.2,590,Application Data
1,9.88793099999998,10.0.2.15,62.210.85.178,TLSv1.2,590,Application Data
1,9.888071999999966,62.210.85.178,10.0.2.15,TCP,60,9001  >  35978 [ACK] Seq=3210467 Ack=57428173 Win=65535 Len=0
1,10.09630500000003,54.93.77.70,10.0.2.15,TLSv1.2,590,Application Data
1,10.09682500000008,10.0.2.15,54.93.77.70,TLSv1.2,590,Application Data
1,10.096960999999965,54.93.77.70,10.0.2.15,TCP,60,9001  >  34692 [ACK] Seq=57385341 Ack=3226403 Win=65535 Len=0
1,10.205926999999974,62.210.85.178,10.0.2.15,TLSv1.2,590,Application Data
1,10.211182000000008,10.0.2.15,62.210.85.178,TLSv1.2,590,Application Data
1,10.211393999999927,62.210.85.178,10.0.2.15,TCP,60,9001  >  35978 [ACK] Seq=3211003 Ack=57428709 Win=65535 Len=0
1,10.224901000000045,10.0.2.15,62.210.85.178,TLSv1.2,4124,Application Data
1,10.225009,10.0.2.15,62.210.85.178,TCP,2974,35978  >  9001 [ACK] Seq=57432779 Ack=3211003 Win=65535 Len=2920 [TCP segment of a reassembled PDU]
1,10.225051000000121,62.210.85.178,10.0.2.15,TCP,60,9001  >  35978 [ACK] Seq=3211003 Ack=57430169 Win=65535 Len=0
1,10.225069000000076,62.210.85.178,10.0.2.15,TCP,60,9001  >  35978 [ACK] Seq=3211003 Ack=57431629 Win=65535 Len=0
1,10.22507399999995,62.210.85.178,10.0.2.15,TCP,60,9001  >  35978 [ACK] Seq=3211003 Ack=57432779 Win=65535 Len=0
1,10.22507799999994,62.210.85.178,10.0.2.15,TCP,60,9001  >  35978 [ACK] Seq=3211003 Ack=57434239 Win=65535 Len=0
1,10.22508199999993,62.210.85.178,10.0.2.15,TCP,60,9001  >  35978 [ACK] Seq=3211003 Ack=57435699 Win=65535 Len=0
1,10.225124999999935,10.0.2.15,62.210.85.178,TLSv1.2,1204,Application Data
1,10.225202000000081,10.0.2.15,62.210.85.178,TCP,2974,35978  >  9001 [ACK] Seq=57436849 Ack=3211003 Win=65535 Len=2920 [TCP segment of a reassembled PDU]
1,10.22524199999998,62.210.85.178,10.0.2.15,TCP,60,9001  >  35978 [ACK] Seq=3211003 Ack=57436849 Win=65535 Len=0
1,10.225277000000006,10.0.2.15,62.210.85.178,TLSv1.2,1204,Application Data
1,10.225314000000026,62.210.85.178,10.0.2.15,TCP,60,9001  >  35978 [ACK] Seq=3211003 Ack=57438309 Win=65535 Len=0
1,10.22532000000001,62.210.85.178,10.0.2.15,TCP,60,9001  >  35978 [ACK] Seq=3211003 Ack=57439769 Win=65535 Len=0
1,10.225325000000112,62.210.85.178,10.0.2.15,TCP,60,9001  >  35978 [ACK] Seq=3211003 Ack=57440919 Win=65535 Len=0
1,10.225370999999996,10.0.2.15,62.210.85.178,TLSv1.2,4124,Application Data
1,10.225464000000102,62.210.85.178,10.0.2.15,TCP,60,9001  >  35978 [ACK] Seq=3211003 Ack=57442379 Win=65535 Len=0
1,10.225472000000082,62.210.85.178,10.0.2.15,TCP,60,9001  >  35978 [ACK] Seq=3211003 Ack=57443839 Win=65535 Len=0
1,10.225476000000072,62.210.85.178,10.0.2.15,TCP,60,9001  >  35978 [ACK] Seq=3211003 Ack=57444989 Win=65535 Len=0
1,10.22550799999999,10.0.2.15,62.210.85.178,TLSv1.2,2974,Application Data
1,10.225562999999966,10.0.2.15,62.210.85.178,TLSv1.2,1226,Application Data
1,10.225599999999986,62.210.85.178,10.0.2.15,TCP,60,9001  >  35978 [ACK] Seq=3211003 Ack=57446449 Win=65535 Len=0
1,10.225607000000082,62.210.85.178,10.0.2.15,TCP,60,9001  >  35978 [ACK] Seq=3211003 Ack=57447909 Win=65535 Len=0
1,10.225611000000072,62.210.85.178,10.0.2.15,TCP,60,9001  >  35978 [ACK] Seq=3211003 Ack=57449081 Win=65535 Len=0
1,10.225656999999956,10.0.2.15,62.210.85.178,TLSv1.2,1938,Application Data
1,10.22569599999997,62.210.85.178,10.0.2.15,TCP,60,9001  >  35978 [ACK] Seq=3211003 Ack=57450541 Win=65535 Len=0
1,10.225703000000067,62.210.85.178,10.0.2.15,TCP,60,9001  >  35978 [ACK] Seq=3211003 Ack=57450965 Win=65535 Len=0
1,10.315184999999929,54.93.77.70,10.0.2.15,TLSv1.2,590,Application Data
1,10.324761999999964,54.93.77.70,10.0.2.15,TCP,2950,"9001  >  34692 [PSH, ACK] Seq=57385877 Ack=3226403 Win=65535 Len=2896 [TCP segment of a reassembled PDU]"
1,10.324865000000045,10.0.2.15,54.93.77.70,TCP,54,34692  >  9001 [ACK] Seq=3226403 Ack=57388773 Win=65535 Len=0
1,10.33158000000003,54.93.77.70,10.0.2.15,TLSv1.2,778,Application Data
1,10.340187000000014,54.93.77.70,10.0.2.15,TCP,2950,"9001  >  34692 [PSH, ACK] Seq=57389497 Ack=3226403 Win=65535 Len=2896 [TCP segment of a reassembled PDU]"
1,10.340237000000116,10.0.2.15,54.93.77.70,TCP,54,34692  >  9001 [ACK] Seq=3226403 Ack=57392393 Win=65535 Len=0
1,10.349496999999928,54.93.77.70,10.0.2.15,TLSv1.2,778,Application Data
1,10.350817000000006,54.93.77.70,10.0.2.15,TCP,2950,"9001  >  34692 [PSH, ACK] Seq=57393117 Ack=3226403 Win=65535 Len=2896 [TCP segment of a reassembled PDU]"
1,10.350875999999971,10.0.2.15,54.93.77.70,TCP,54,34692  >  9001 [ACK] Seq=3226403 Ack=57396013 Win=65535 Len=0
1,10.3620370000001,54.93.77.70,10.0.2.15,TLSv1.2,1502,"Application Data, Application Data"
1,10.362102999999934,10.0.2.15,54.93.77.70,TCP,54,34692  >  9001 [ACK] Seq=3226403 Ack=57397461 Win=65535 Len=0
1,10.36828000000014,54.93.77.70,10.0.2.15,TLSv1.2,402,Application Data
1,10.408770000000004,10.0.2.15,54.93.77.70,TCP,54,34692  >  9001 [ACK] Seq=3226403 Ack=57397809 Win=65535 Len=0
1,10.710698000000093,54.93.77.70,10.0.2.15,TLSv1.2,2646,Application Data
1,10.710778000000118,10.0.2.15,54.93.77.70,TCP,54,34692  >  9001 [ACK] Seq=3226403 Ack=57400401 Win=65535 Len=0
1,11.324076000000105,54.93.77.70,10.0.2.15,TLSv1.2,1104,Application Data
1,11.324170999999978,10.0.2.15,54.93.77.70,TCP,54,34692  >  9001 [ACK] Seq=3226403 Ack=57401451 Win=65535 Len=0
1,11.326565999999957,54.93.77.70,10.0.2.15,TLSv1.2,2646,Application Data
1,11.326614000000063,10.0.2.15,54.93.77.70,TCP,54,34692  >  9001 [ACK] Seq=3226403 Ack=57404043 Win=65535 Len=0
1,11.528299000000061,54.93.77.70,10.0.2.15,TLSv1.2,1618,Application Data
1,11.528379000000086,10.0.2.15,54.93.77.70,TCP,54,34692  >  9001 [ACK] Seq=3226403 Ack=57405607 Win=65535 Len=0
1,11.54663000000005,54.93.77.70,10.0.2.15,TLSv1.2,590,Application Data
1,11.546722000000045,10.0.2.15,54.93.77.70,TCP,54,34692  >  9001 [ACK] Seq=3226403 Ack=57406143 Win=65535 Len=0
1,11.733674999999948,54.93.77.70,10.0.2.15,TLSv1.2,2132,Application Data
1,11.733764000000065,10.0.2.15,54.93.77.70,TCP,54,34692  >  9001 [ACK] Seq=3226403 Ack=57408221 Win=65535 Len=0
1,11.736791999999923,10.0.2.15,54.93.77.70,TLSv1.2,590,Application Data
1,11.73695500000008,54.93.77.70,10.0.2.15,TCP,60,9001  >  34692 [ACK] Seq=57408221 Ack=3226939 Win=65535 Len=0
1,11.84986600000002,62.210.85.178,10.0.2.15,TLSv1.2,590,Application Data
1,11.850245000000086,10.0.2.15,62.210.85.178,TLSv1.2,590,Application Data
1,11.850341999999955,62.210.85.178,10.0.2.15,TCP,60,9001  >  35978 [ACK] Seq=3211539 Ack=57451501 Win=65535 Len=0
1,11.943172000000004,54.93.77.70,10.0.2.15,TLSv1.2,590,Application Data
1,11.94367299999999,10.0.2.15,54.93.77.70,TLSv1.2,590,Application Data
1,11.943821999999955,54.93.77.70,10.0.2.15,TCP,60,9001  >  34692 [ACK] Seq=57408757 Ack=3227475 Win=65535 Len=0
1,12.554331000000047,62.210.85.178,10.0.2.15,TLSv1.2,590,Application Data
1,12.560338000000002,10.0.2.15,62.210.85.178,TLSv1.2,590,Application Data
1,12.560486999999966,62.210.85.178,10.0.2.15,TCP,60,9001  >  35978 [ACK] Seq=3212075 Ack=57452037 Win=65535 Len=0
1,12.572879000000057,10.0.2.15,62.210.85.178,TLSv1.2,4124,Application Data
1,12.573002000000088,10.0.2.15,62.210.85.178,TCP,2974,35978  >  9001 [ACK] Seq=57456107 Ack=3212075 Win=65535 Len=2920 [TCP segment of a reassembled PDU]
1,12.573053999999956,62.210.85.178,10.0.2.15,TCP,60,9001  >  35978 [ACK] Seq=3212075 Ack=57453497 Win=65535 Len=0
1,12.573067000000037,62.210.85.178,10.0.2.15,TCP,60,9001  >  35978 [ACK] Seq=3212075 Ack=57454957 Win=65535 Len=0
1,12.573072000000138,62.210.85.178,10.0.2.15,TCP,60,9001  >  35978 [ACK] Seq=3212075 Ack=57456107 Win=65535 Len=0
1,12.573123000000123,10.0.2.15,62.210.85.178,TLSv1.2,1204,Application Data
1,12.573172000000113,62.210.85.178,10.0.2.15,TCP,60,9001  >  35978 [ACK] Seq=3212075 Ack=57457567 Win=65535 Len=0
1,12.573180000000093,62.210.85.178,10.0.2.15,TCP,60,9001  >  35978 [ACK] Seq=3212075 Ack=57459027 Win=65535 Len=0
1,12.573184999999967,62.210.85.178,10.0.2.15,TCP,60,9001  >  35978 [ACK] Seq=3212075 Ack=57460177 Win=65535 Len=0
1,12.573249000000033,10.0.2.15,62.210.85.178,TLSv1.2,4124,Application Data
1,12.573327999999947,10.0.2.15,62.210.85.178,TCP,2974,35978  >  9001 [ACK] Seq=57464247 Ack=3212075 Win=65535 Len=2920 [TCP segment of a reassembled PDU]
1,12.573413000000073,10.0.2.15,62.210.85.178,TLSv1.2,4434,"Application Data, Application Data"
1,12.575289999999995,62.210.85.178,10.0.2.15,TCP,60,9001  >  35978 [ACK] Seq=3212075 Ack=57461637 Win=65535 Len=0
1,12.575333,62.210.85.178,10.0.2.15,TCP,60,9001  >  35978 [ACK] Seq=3212075 Ack=57463097 Win=65535 Len=0
1,12.575340000000097,62.210.85.178,10.0.2.15,TCP,60,9001  >  35978 [ACK] Seq=3212075 Ack=57464247 Win=65535 Len=0
1,12.575344000000086,62.210.85.178,10.0.2.15,TCP,60,9001  >  35978 [ACK] Seq=3212075 Ack=57465707 Win=65535 Len=0
1,12.575348000000076,62.210.85.178,10.0.2.15,TCP,60,9001  >  35978 [ACK] Seq=3212075 Ack=57467167 Win=65535 Len=0
1,12.575352000000066,62.210.85.178,10.0.2.15,TCP,60,9001  >  35978 [ACK] Seq=3212075 Ack=57468627 Win=65535 Len=0
1,12.575354999999945,62.210.85.178,10.0.2.15,TCP,60,9001  >  35978 [ACK] Seq=3212075 Ack=57470087 Win=65535 Len=0
1,12.575358999999935,62.210.85.178,10.0.2.15,TCP,60,9001  >  35978 [ACK] Seq=3212075 Ack=57471547 Win=65535 Len=0
1,12.57543499999997,10.0.2.15,62.210.85.178,TLSv1.2,5894,"Application Data, Application Data"
1,12.57549599999993,10.0.2.15,62.210.85.178,TLSv1.2,2122,Application Data
1,12.57590499999992,62.210.85.178,10.0.2.15,TCP,60,9001  >  35978 [ACK] Seq=3212075 Ack=57473007 Win=65535 Len=0
1,12.575929999999971,62.210.85.178,10.0.2.15,TCP,60,9001  >  35978 [ACK] Seq=3212075 Ack=57474467 Win=65535 Len=0
1,12.575935000000072,62.210.85.178,10.0.2.15,TCP,60,9001  >  35978 [ACK] Seq=3212075 Ack=57475927 Win=65535 Len=0
1,12.575939999999946,62.210.85.178,10.0.2.15,TCP,60,9001  >  35978 [ACK] Seq=3212075 Ack=57477387 Win=65535 Len=0
1,12.575943999999936,62.210.85.178,10.0.2.15,TCP,60,9001  >  35978 [ACK] Seq=3212075 Ack=57478847 Win=65535 Len=0
1,12.575947999999926,62.210.85.178,10.0.2.15,TCP,60,9001  >  35978 [ACK] Seq=3212075 Ack=57479455 Win=65535 Len=0
1,12.585039999999935,10.0.2.15,62.210.85.178,TLSv1.2,4124,Application Data
1,12.585160999999971,62.210.85.178,10.0.2.15,TCP,60,9001  >  35978 [ACK] Seq=3212075 Ack=57480915 Win=65535 Len=0
1,12.58517699999993,62.210.85.178,10.0.2.15,TCP,60,9001  >  35978 [ACK] Seq=3212075 Ack=57482375 Win=65535 Len=0
1,12.585181000000148,62.210.85.178,10.0.2.15,TCP,60,9001  >  35978 [ACK] Seq=3212075 Ack=57483525 Win=65535 Len=0
1,12.585225000000037,10.0.2.15,62.210.85.178,TLSv1.2,4124,Application Data
1,12.585289999999986,62.210.85.178,10.0.2.15,TCP,60,9001  >  35978 [ACK] Seq=3212075 Ack=57484985 Win=65535 Len=0
1,12.585297999999966,62.210.85.178,10.0.2.15,TCP,60,9001  >  35978 [ACK] Seq=3212075 Ack=57486445 Win=65535 Len=0
1,12.585301000000072,62.210.85.178,10.0.2.15,TCP,60,9001  >  35978 [ACK] Seq=3212075 Ack=57487595 Win=65535 Len=0
1,12.585344000000077,10.0.2.15,62.210.85.178,TLSv1.2,4124,Application Data
1,12.585383999999976,62.210.85.178,10.0.2.15,TCP,60,9001  >  35978 [ACK] Seq=3212075 Ack=57489055 Win=65535 Len=0
1,12.585391999999956,62.210.85.178,10.0.2.15,TCP,60,9001  >  35978 [ACK] Seq=3212075 Ack=57490515 Win=65535 Len=0
1,12.585397000000057,62.210.85.178,10.0.2.15,TCP,60,9001  >  35978 [ACK] Seq=3212075 Ack=57491665 Win=65535 Len=0
1,12.585434999999961,10.0.2.15,62.210.85.178,TLSv1.2,4124,Application Data
1,12.585471999999982,62.210.85.178,10.0.2.15,TCP,60,9001  >  35978 [ACK] Seq=3212075 Ack=57493125 Win=65535 Len=0
1,12.585481000000073,62.210.85.178,10.0.2.15,TCP,60,9001  >  35978 [ACK] Seq=3212075 Ack=57494585 Win=65535 Len=0
1,12.585485000000062,62.210.85.178,10.0.2.15,TCP,60,9001  >  35978 [ACK] Seq=3212075 Ack=57495735 Win=65535 Len=0
1,12.585520000000088,10.0.2.15,62.210.85.178,TLSv1.2,332,Application Data
1,12.585565000000088,62.210.85.178,10.0.2.15,TCP,60,9001  >  35978 [ACK] Seq=3212075 Ack=57496013 Win=65535 Len=0
1,12.585618999999951,10.0.2.15,62.210.85.178,TLSv1.2,3868,Application Data
1,12.585772000000134,62.210.85.178,10.0.2.15,TCP,60,9001  >  35978 [ACK] Seq=3212075 Ack=57497473 Win=65535 Len=0
1,12.585796000000073,62.210.85.178,10.0.2.15,TCP,60,9001  >  35978 [ACK] Seq=3212075 Ack=57498933 Win=65535 Len=0
1,12.585798999999952,62.210.85.178,10.0.2.15,TCP,60,9001  >  35978 [ACK] Seq=3212075 Ack=57499827 Win=65535 Len=0
1,12.585851000000048,10.0.2.15,62.210.85.178,TLSv1.2,4124,Application Data
1,12.585894000000053,62.210.85.178,10.0.2.15,TCP,60,9001  >  35978 [ACK] Seq=3212075 Ack=57501287 Win=65535 Len=0
1,12.585902000000033,62.210.85.178,10.0.2.15,TCP,60,9001  >  35978 [ACK] Seq=3212075 Ack=57502747 Win=65535 Len=0
1,12.585906000000023,62.210.85.178,10.0.2.15,TCP,60,9001  >  35978 [ACK] Seq=3212075 Ack=57503897 Win=65535 Len=0
1,12.585943000000043,10.0.2.15,62.210.85.178,TLSv1.2,4124,Application Data
1,12.585980999999947,62.210.85.178,10.0.2.15,TCP,60,9001  >  35978 [ACK] Seq=3212075 Ack=57505357 Win=65535 Len=0
1,12.585990999999922,62.210.85.178,10.0.2.15,TCP,60,9001  >  35978 [ACK] Seq=3212075 Ack=57506817 Win=65535 Len=0
1,12.585995000000139,62.210.85.178,10.0.2.15,TCP,60,9001  >  35978 [ACK] Seq=3212075 Ack=57507967 Win=65535 Len=0
1,12.586031000000048,10.0.2.15,62.210.85.178,TLSv1.2,4124,Application Data
1,12.586070000000063,62.210.85.178,10.0.2.15,TCP,60,9001  >  35978 [ACK] Seq=3212075 Ack=57509427 Win=65535 Len=0
1,12.586076999999932,62.210.85.178,10.0.2.15,TCP,60,9001  >  35978 [ACK] Seq=3212075 Ack=57510887 Win=65535 Len=0
1,12.586080999999922,62.210.85.178,10.0.2.15,TCP,60,9001  >  35978 [ACK] Seq=3212075 Ack=57512037 Win=65535 Len=0
1,12.586115999999947,10.0.2.15,62.210.85.178,TLSv1.2,588,Application Data
1,12.586154000000079,62.210.85.178,10.0.2.15,TCP,60,9001  >  35978 [ACK] Seq=3212075 Ack=57512571 Win=65535 Len=0
1,12.586211000000048,10.0.2.15,62.210.85.178,TLSv1.2,3612,Application Data
1,12.586250999999947,62.210.85.178,10.0.2.15,TCP,60,9001  >  35978 [ACK] Seq=3212075 Ack=57514031 Win=65535 Len=0
1,12.586258000000043,62.210.85.178,10.0.2.15,TCP,60,9001  >  35978 [ACK] Seq=3212075 Ack=57515491 Win=65535 Len=0
1,12.586262000000033,62.210.85.178,10.0.2.15,TCP,60,9001  >  35978 [ACK] Seq=3212075 Ack=57516129 Win=65535 Len=0
1,12.586299999999937,10.0.2.15,62.210.85.178,TLSv1.2,4124,Application Data
1,12.586336999999958,62.210.85.178,10.0.2.15,TCP,60,9001  >  35978 [ACK] Seq=3212075 Ack=57517589 Win=65535 Len=0
1,12.586346000000049,62.210.85.178,10.0.2.15,TCP,60,9001  >  35978 [ACK] Seq=3212075 Ack=57519049 Win=65535 Len=0
1,12.586350999999922,62.210.85.178,10.0.2.15,TCP,60,9001  >  35978 [ACK] Seq=3212075 Ack=57520199 Win=65535 Len=0
1,12.586387999999943,10.0.2.15,62.210.85.178,TLSv1.2,4124,Application Data
1,12.586426999999958,62.210.85.178,10.0.2.15,TCP,60,9001  >  35978 [ACK] Seq=3212075 Ack=57521659 Win=65535 Len=0
1,12.586434999999938,62.210.85.178,10.0.2.15,TCP,60,9001  >  35978 [ACK] Seq=3212075 Ack=57523119 Win=65535 Len=0
1,12.586438999999928,62.210.85.178,10.0.2.15,TCP,60,9001  >  35978 [ACK] Seq=3212075 Ack=57524269 Win=65535 Len=0
1,12.586473999999953,10.0.2.15,62.210.85.178,TLSv1.2,2322,Application Data
1,12.586512000000084,62.210.85.178,10.0.2.15,TCP,60,9001  >  35978 [ACK] Seq=3212075 Ack=57525729 Win=65535 Len=0
1,12.586518999999953,62.210.85.178,10.0.2.15,TCP,60,9001  >  35978 [ACK] Seq=3212075 Ack=57526537 Win=65535 Len=0
1,12.689307000000099,54.93.77.70,10.0.2.15,TLSv1.2,3674,Application Data
1,12.689470000000028,10.0.2.15,54.93.77.70,TCP,54,34692  >  9001 [ACK] Seq=3227475 Ack=57412377 Win=65535 Len=0
1,12.69620000000009,54.93.77.70,10.0.2.15,TCP,2950,"9001  >  34692 [PSH, ACK] Seq=57412377 Ack=3227475 Win=65535 Len=2896 [TCP segment of a reassembled PDU]"
1,12.696279000000004,10.0.2.15,54.93.77.70,TCP,54,34692  >  9001 [ACK] Seq=3227475 Ack=57415273 Win=65535 Len=0
1,12.705007000000023,54.93.77.70,10.0.2.15,TLSv1.2,1502,Application Data [TCP segment of a reassembled PDU]
1,12.705061000000114,10.0.2.15,54.93.77.70,TCP,54,34692  >  9001 [ACK] Seq=3227475 Ack=57416721 Win=65535 Len=0
1,12.705277000000024,10.0.2.15,54.93.77.70,TLSv1.2,590,Application Data
1,12.70539800000006,54.93.77.70,10.0.2.15,TCP,60,9001  >  34692 [ACK] Seq=57416721 Ack=3228011 Win=65535 Len=0
1,12.707006999999976,54.93.77.70,10.0.2.15,TLSv1.2,380,Application Data
1,12.713515000000143,54.93.77.70,10.0.2.15,TCP,2950,"9001  >  34692 [PSH, ACK] Seq=57417047 Ack=3228011 Win=65535 Len=2896 [TCP segment of a reassembled PDU]"
1,12.713582999999971,10.0.2.15,54.93.77.70,TCP,54,34692  >  9001 [ACK] Seq=3228011 Ack=57419943 Win=65535 Len=0
1,12.725777000000107,54.93.77.70,10.0.2.15,TLSv1.2,4398,Application Data [TCP segment of a reassembled PDU]
1,12.725840000000062,10.0.2.15,54.93.77.70,TCP,54,34692  >  9001 [ACK] Seq=3228011 Ack=57424287 Win=65535 Len=0
1,12.73093700000004,54.93.77.70,10.0.2.15,TLSv1.2,590,"Application Data, Application Data"
1,12.735282999999981,54.93.77.70,10.0.2.15,TCP,2950,"9001  >  34692 [PSH, ACK] Seq=57424823 Ack=3228011 Win=65535 Len=2896 [TCP segment of a reassembled PDU]"
1,12.735335999999961,10.0.2.15,54.93.77.70,TCP,54,34692  >  9001 [ACK] Seq=3228011 Ack=57427719 Win=65535 Len=0
1,12.735920000000078,54.93.77.70,10.0.2.15,TLSv1.2,4398,Application Data [TCP segment of a reassembled PDU]
1,12.735986000000139,10.0.2.15,54.93.77.70,TCP,54,34692  >  9001 [ACK] Seq=3228011 Ack=57432063 Win=65535 Len=0
1,12.74627200000009,54.93.77.70,10.0.2.15,TLSv1.2,5846,"Application Data, Application Data"
1,12.74634100000003,10.0.2.15,54.93.77.70,TCP,54,34692  >  9001 [ACK] Seq=3228011 Ack=57437855 Win=65535 Len=0
1,12.746621000000005,10.0.2.15,54.93.77.70,TLSv1.2,590,Application Data
1,12.74670900000001,54.93.77.70,10.0.2.15,TCP,60,9001  >  34692 [ACK] Seq=57437855 Ack=3228547 Win=65535 Len=0
1,12.755714000000125,54.93.77.70,10.0.2.15,TLSv1.2,988,Application Data
1,12.797132000000147,10.0.2.15,54.93.77.70,TCP,54,34692  >  9001 [ACK] Seq=3228547 Ack=57438789 Win=65535 Len=0
1,12.814072000000124,62.210.85.178,10.0.2.15,TLSv1.2,590,Application Data
1,12.856750000000147,10.0.2.15,62.210.85.178,TCP,54,35978  >  9001 [ACK] Seq=57526537 Ack=3212611 Win=65535 Len=0
1,12.927864,62.210.85.178,10.0.2.15,TLSv1.2,590,Application Data
1,12.927941000000146,10.0.2.15,62.210.85.178,TCP,54,35978  >  9001 [ACK] Seq=57526537 Ack=3213147 Win=65535 Len=0
1,12.982238000000052,54.93.77.70,10.0.2.15,TLSv1.2,3674,Application Data
1,12.982297000000017,10.0.2.15,54.93.77.70,TCP,54,34692  >  9001 [ACK] Seq=3228547 Ack=57442409 Win=65535 Len=0
1,12.992539999999963,54.93.77.70,10.0.2.15,TCP,2950,"9001  >  34692 [PSH, ACK] Seq=57442409 Ack=3228547 Win=65535 Len=2896 [TCP segment of a reassembled PDU]"
1,12.992629000000079,10.0.2.15,54.93.77.70,TCP,54,34692  >  9001 [ACK] Seq=3228547 Ack=57445305 Win=65535 Len=0
1,12.992694000000029,54.93.77.70,10.0.2.15,TLSv1.2,4398,Application Data [TCP segment of a reassembled PDU]
1,12.992741000000024,10.0.2.15,54.93.77.70,TCP,54,34692  >  9001 [ACK] Seq=3228547 Ack=57449649 Win=65535 Len=0
1,12.998342000000093,54.93.77.70,10.0.2.15,TLSv1.2,1104,"Application Data, Application Data"
1,12.998383000000103,10.0.2.15,54.93.77.70,TCP,54,34692  >  9001 [ACK] Seq=3228547 Ack=57450699 Win=65535 Len=0
1,13.002308999999968,54.93.77.70,10.0.2.15,TLSv1.2,7294,"Application Data, Application Data"
1,13.00235900000007,10.0.2.15,54.93.77.70,TCP,54,34692  >  9001 [ACK] Seq=3228547 Ack=57457939 Win=65535 Len=0
1,13.01831900000002,54.93.77.70,10.0.2.15,TLSv1.2,5846,Application Data
1,13.018344999999954,54.93.77.70,10.0.2.15,TLSv1.2,10820,"Application Data, Application Data, Application Data, Application Data"
1,13.018387999999959,10.0.2.15,54.93.77.70,TCP,54,34692  >  9001 [ACK] Seq=3228547 Ack=57463731 Win=65535 Len=0
1,13.01842600000009,10.0.2.15,54.93.77.70,TCP,54,34692  >  9001 [ACK] Seq=3228547 Ack=57474497 Win=65535 Len=0
1,13.01856900000007,10.0.2.15,54.93.77.70,TLSv1.2,590,Application Data
1,13.01864599999999,54.93.77.70,10.0.2.15,TCP,60,9001  >  34692 [ACK] Seq=57474497 Ack=3229083 Win=65535 Len=0
1,13.019402000000127,54.93.77.70,10.0.2.15,TCP,2950,"9001  >  34692 [PSH, ACK] Seq=57474497 Ack=3229083 Win=65535 Len=2896 [TCP segment of a reassembled PDU]"
1,13.019449000000122,10.0.2.15,54.93.77.70,TCP,54,34692  >  9001 [ACK] Seq=3229083 Ack=57477393 Win=65535 Len=0
1,13.033169999999927,10.0.2.15,54.93.77.70,TLSv1.2,590,Application Data
1,13.033271000000013,54.93.77.70,10.0.2.15,TCP,60,9001  >  34692 [ACK] Seq=57477393 Ack=3229619 Win=65535 Len=0
1,13.035622000000103,54.93.77.70,10.0.2.15,TLSv1.2,1314,"Application Data, Application Data"
1,13.03714500000001,54.93.77.70,10.0.2.15,TCP,2950,"9001  >  34692 [PSH, ACK] Seq=57478653 Ack=3229619 Win=65535 Len=2896 [TCP segment of a reassembled PDU]"
1,13.03721100000007,10.0.2.15,54.93.77.70,TCP,54,34692  >  9001 [ACK] Seq=3229619 Ack=57481549 Win=65535 Len=0
1,13.038015000000087,54.93.77.70,10.0.2.15,TLSv1.2,1502,Application Data [TCP segment of a reassembled PDU]
1,13.038062000000082,10.0.2.15,54.93.77.70,TCP,54,34692  >  9001 [ACK] Seq=3229619 Ack=57482997 Win=65535 Len=0
1,13.051930999999968,54.93.77.70,10.0.2.15,TLSv1.2,894,Application Data
