No.,Time,Source,Destination,Protocol,Length,Info
1,0.01685799999995652,10.0.2.15,54.93.77.70,TCP,54,34692  >  9001 [ACK] Seq=3722403 Ack=66396963 Win=65535 Len=0
1,0.13483099999984915,10.0.2.15,54.93.77.70,TLSv1.2,590,Application Data
1,0.1349969999998848,54.93.77.70,10.0.2.15,TCP,60,9001  >  34692 [ACK] Seq=66396963 Ack=3722939 Win=65535 Len=0
1,0.23827699999992547,62.210.85.178,10.0.2.15,TLSv1.2,1104,Application Data
1,0.2387509999998656,10.0.2.15,62.210.85.178,TLSv1.2,590,Application Data
1,0.23886900000002242,62.210.85.178,10.0.2.15,TCP,60,9001  >  35978 [ACK] Seq=3733763 Ack=66579589 Win=65535 Len=0
1,0.3195140000000265,54.93.77.70,10.0.2.15,TLSv1.2,590,Application Data
1,0.3196020000000317,10.0.2.15,54.93.77.70,TCP,54,34692  >  9001 [ACK] Seq=3722939 Ack=66397499 Win=65535 Len=0
1,0.3199899999999616,10.0.2.15,54.93.77.70,TLSv1.2,1618,Application Data
1,0.3200939999999264,54.93.77.70,10.0.2.15,TCP,60,9001  >  34692 [ACK] Seq=66397499 Ack=3724399 Win=65535 Len=0
1,0.3201059999998961,54.93.77.70,10.0.2.15,TCP,60,9001  >  34692 [ACK] Seq=66397499 Ack=3724503 Win=65535 Len=0
1,0.4173319999999876,62.210.85.178,10.0.2.15,TLSv1.2,1618,Application Data
1,0.41744900000003327,10.0.2.15,62.210.85.178,TCP,54,35978  >  9001 [ACK] Seq=66579589 Ack=3735327 Win=65535 Len=0
1,0.4307499999999891,10.0.2.15,62.210.85.178,TLSv1.2,590,Application Data
1,0.43091899999990346,62.210.85.178,10.0.2.15,TCP,60,9001  >  35978 [ACK] Seq=3735327 Ack=66580125 Win=65535 Len=0
1,0.44264099999986684,10.0.2.15,62.210.85.178,TLSv1.2,1618,Application Data
1,0.442794000000049,62.210.85.178,10.0.2.15,TCP,60,9001  >  35978 [ACK] Seq=3735327 Ack=66581585 Win=65535 Len=0
1,0.4428129999998873,62.210.85.178,10.0.2.15,TCP,60,9001  >  35978 [ACK] Seq=3735327 Ack=66581689 Win=65535 Len=0
1,0.5517150000000584,54.93.77.70,10.0.2.15,TLSv1.2,590,Application Data
1,0.576033999999936,54.93.77.70,10.0.2.15,TLSv1.2,1618,Application Data
1,0.5761589999999615,10.0.2.15,54.93.77.70,TCP,54,34692  >  9001 [ACK] Seq=3724503 Ack=66399599 Win=65535 Len=0
1,0.5799329999999827,10.0.2.15,54.93.77.70,TLSv1.2,590,Application Data
1,0.580398999999943,54.93.77.70,10.0.2.15,TCP,60,9001  >  34692 [ACK] Seq=66399599 Ack=3725039 Win=65535 Len=0
1,0.6728040000000419,62.210.85.178,10.0.2.15,TLSv1.2,590,Application Data
1,0.6731290000000172,10.0.2.15,62.210.85.178,TLSv1.2,590,Application Data
1,0.6732419999998456,62.210.85.178,10.0.2.15,TCP,60,9001  >  35978 [ACK] Seq=3735863 Ack=66582225 Win=65535 Len=0
1,0.7644179999999778,54.93.77.70,10.0.2.15,TLSv1.2,590,Application Data
1,0.7647879999999532,10.0.2.15,54.93.77.70,TLSv1.2,590,Application Data
1,0.7648959999999079,54.93.77.70,10.0.2.15,TCP,60,9001  >  34692 [ACK] Seq=66400135 Ack=3725575 Win=65535 Len=0
1,0.8595040000000154,62.210.85.178,10.0.2.15,TLSv1.2,590,Application Data
1,0.8633709999999155,10.0.2.15,62.210.85.178,TLSv1.2,590,Application Data
1,0.8642609999999422,62.210.85.178,10.0.2.15,TCP,60,9001  >  35978 [ACK] Seq=3736399 Ack=66582761 Win=65535 Len=0
1,0.8747869999999693,10.0.2.15,62.210.85.178,TLSv1.2,4124,Application Data
1,0.8748779999998533,10.0.2.15,62.210.85.178,TCP,2974,35978  >  9001 [ACK] Seq=66586831 Ack=3736399 Win=65535 Len=2920 [TCP segment of a reassembled PDU]
1,0.8749189999998634,62.210.85.178,10.0.2.15,TCP,60,9001  >  35978 [ACK] Seq=3736399 Ack=66584221 Win=65535 Len=0
1,0.8749310000000605,62.210.85.178,10.0.2.15,TCP,60,9001  >  35978 [ACK] Seq=3736399 Ack=66585681 Win=65535 Len=0
1,0.8749350000000504,62.210.85.178,10.0.2.15,TCP,60,9001  >  35978 [ACK] Seq=3736399 Ack=66586831 Win=65535 Len=0
1,0.8749370000000454,62.210.85.178,10.0.2.15,TCP,60,9001  >  35978 [ACK] Seq=3736399 Ack=66588291 Win=65535 Len=0
1,0.8749399999999241,62.210.85.178,10.0.2.15,TCP,60,9001  >  35978 [ACK] Seq=3736399 Ack=66589751 Win=65535 Len=0
1,0.8749739999998383,10.0.2.15,62.210.85.178,TLSv1.2,1204,Application Data
1,0.8750069999998686,62.210.85.178,10.0.2.15,TCP,60,9001  >  35978 [ACK] Seq=3736399 Ack=66590901 Win=65535 Len=0
1,0.8750519999998687,10.0.2.15,62.210.85.178,TLSv1.2,4124,Application Data
1,0.8750860000000102,62.210.85.178,10.0.2.15,TCP,60,9001  >  35978 [ACK] Seq=3736399 Ack=66592361 Win=65535 Len=0
1,0.87509399999999,62.210.85.178,10.0.2.15,TCP,60,9001  >  35978 [ACK] Seq=3736399 Ack=66593821 Win=65535 Len=0
1,0.87509799999998,62.210.85.178,10.0.2.15,TCP,60,9001  >  35978 [ACK] Seq=3736399 Ack=66594971 Win=65535 Len=0
1,0.8751350000000002,10.0.2.15,62.210.85.178,TLSv1.2,4124,Application Data
1,0.8751689999999144,62.210.85.178,10.0.2.15,TCP,60,9001  >  35978 [ACK] Seq=3736399 Ack=66596431 Win=65535 Len=0
1,0.8751760000000104,62.210.85.178,10.0.2.15,TCP,60,9001  >  35978 [ACK] Seq=3736399 Ack=66597891 Win=65535 Len=0
1,0.8752379999998539,10.0.2.15,62.210.85.178,TLSv1.2,2974,Application Data
1,0.8752729999998792,62.210.85.178,10.0.2.15,TCP,60,9001  >  35978 [ACK] Seq=3736399 Ack=66599041 Win=65535 Len=0
1,0.875280999999859,62.210.85.178,10.0.2.15,TCP,60,9001  >  35978 [ACK] Seq=3736399 Ack=66600501 Win=65535 Len=0
1,0.8752839999999651,62.210.85.178,10.0.2.15,TCP,60,9001  >  35978 [ACK] Seq=3736399 Ack=66601961 Win=65535 Len=0
1,0.8753110000000106,10.0.2.15,62.210.85.178,TLSv1.2,1226,Application Data
1,0.875344000000041,62.210.85.178,10.0.2.15,TCP,60,9001  >  35978 [ACK] Seq=3736399 Ack=66603133 Win=65535 Len=0
1,0.8753830000000562,10.0.2.15,62.210.85.178,TLSv1.2,4124,Application Data
1,0.8754189999999653,62.210.85.178,10.0.2.15,TCP,60,9001  >  35978 [ACK] Seq=3736399 Ack=66604593 Win=65535 Len=0
1,0.8754249999999502,62.210.85.178,10.0.2.15,TCP,60,9001  >  35978 [ACK] Seq=3736399 Ack=66606053 Win=65535 Len=0
1,0.8754280000000563,62.210.85.178,10.0.2.15,TCP,60,9001  >  35978 [ACK] Seq=3736399 Ack=66607203 Win=65535 Len=0
1,0.8754639999999654,10.0.2.15,62.210.85.178,TLSv1.2,3030,Application Data
1,0.8754989999999907,62.210.85.178,10.0.2.15,TCP,60,9001  >  35978 [ACK] Seq=3736399 Ack=66608663 Win=65535 Len=0
1,0.8755049999999756,62.210.85.178,10.0.2.15,TCP,60,9001  >  35978 [ACK] Seq=3736399 Ack=66610123 Win=65535 Len=0
1,0.8755079999998543,62.210.85.178,10.0.2.15,TCP,60,9001  >  35978 [ACK] Seq=3736399 Ack=66610179 Win=65535 Len=0
1,0.8847209999998995,10.0.2.15,62.210.85.178,TLSv1.2,2646,Application Data
1,0.8848169999998845,62.210.85.178,10.0.2.15,TCP,60,9001  >  35978 [ACK] Seq=3736399 Ack=66611639 Win=65535 Len=0
1,0.8848319999999603,62.210.85.178,10.0.2.15,TCP,60,9001  >  35978 [ACK] Seq=3736399 Ack=66612771 Win=65535 Len=0
1,1.1335719999999583,54.93.77.70,10.0.2.15,TCP,2950,"9001  >  34692 [PSH, ACK] Seq=66400135 Ack=3725575 Win=65535 Len=2896 [TCP segment of a reassembled PDU]"
1,1.1336959999998726,10.0.2.15,54.93.77.70,TCP,54,34692  >  9001 [ACK] Seq=3725575 Ack=66403031 Win=65535 Len=0
1,1.1362779999999475,54.93.77.70,10.0.2.15,TLSv1.2,778,Application Data
1,1.136445999999978,10.0.2.15,54.93.77.70,TLSv1.2,590,Application Data
1,1.1365260000000035,54.93.77.70,10.0.2.15,TCP,60,9001  >  34692 [ACK] Seq=66403755 Ack=3726111 Win=65535 Len=0
1,1.1373839999998836,54.93.77.70,10.0.2.15,TLSv1.2,7294,"Application Data, Application Data"
1,1.1374029999999493,54.93.77.70,10.0.2.15,TLSv1.2,2950,"Application Data, Application Data"
1,1.1374779999998736,10.0.2.15,54.93.77.70,TCP,54,34692  >  9001 [ACK] Seq=3726111 Ack=66413891 Win=65535 Len=0
1,1.1520219999999881,54.93.77.70,10.0.2.15,TLSv1.2,2950,Application Data [TCP segment of a reassembled PDU]
1,1.1520980000000236,10.0.2.15,54.93.77.70,TCP,54,34692  >  9001 [ACK] Seq=3726111 Ack=66416787 Win=65535 Len=0
1,1.1523439999998573,54.93.77.70,10.0.2.15,TCP,1502,"9001  >  34692 [PSH, ACK] Seq=66416787 Ack=3726111 Win=65535 Len=1448 [TCP segment of a reassembled PDU]"
1,1.1523869999998624,10.0.2.15,54.93.77.70,TCP,54,34692  >  9001 [ACK] Seq=3726111 Ack=66418235 Win=65535 Len=0
1,1.1538419999999405,54.93.77.70,10.0.2.15,TCP,1502,"9001  >  34692 [PSH, ACK] Seq=66418235 Ack=3726111 Win=65535 Len=1448 [TCP segment of a reassembled PDU]"
1,1.1538649999999961,54.93.77.70,10.0.2.15,TLSv1.2,4398,"Application Data, Application Data"
1,1.1539060000000063,10.0.2.15,54.93.77.70,TCP,54,34692  >  9001 [ACK] Seq=3726111 Ack=66419683 Win=65535 Len=0
1,1.1539889999999104,10.0.2.15,54.93.77.70,TCP,54,34692  >  9001 [ACK] Seq=3726111 Ack=66424027 Win=65535 Len=0
1,1.1543279999998504,54.93.77.70,10.0.2.15,TLSv1.2,4138,"Application Data, Application Data"
1,1.1543689999998605,10.0.2.15,54.93.77.70,TCP,54,34692  >  9001 [ACK] Seq=3726111 Ack=66428111 Win=65535 Len=0
1,1.154544999999871,10.0.2.15,54.93.77.70,TLSv1.2,590,Application Data
1,1.1546109999999317,54.93.77.70,10.0.2.15,TCP,60,9001  >  34692 [ACK] Seq=66428111 Ack=3726647 Win=65535 Len=0
1,1.1599949999999808,54.93.77.70,10.0.2.15,TCP,1502,"9001  >  34692 [PSH, ACK] Seq=66428111 Ack=3726647 Win=65535 Len=1448 [TCP segment of a reassembled PDU]"
1,1.1600579999999354,10.0.2.15,54.93.77.70,TCP,54,34692  >  9001 [ACK] Seq=3726647 Ack=66429559 Win=65535 Len=0
1,1.1705319999998665,54.93.77.70,10.0.2.15,TLSv1.2,1198,Application Data
1,1.1732250000000022,10.0.2.15,54.93.77.70,TLSv1.2,590,Application Data
1,1.1733959999999115,54.93.77.70,10.0.2.15,TCP,60,9001  >  34692 [ACK] Seq=66430703 Ack=3727183 Win=65535 Len=0
1,1.2311909999998534,10.0.2.15,10.0.2.3,DNS,98,Standard query 0x5a92 A safebrowsing.googleapis.com OPT
1,1.2315409999998792,10.0.2.15,10.0.2.3,DNS,98,Standard query 0x0460 AAAA safebrowsing.googleapis.com OPT
1,1.24387999999999,10.0.2.3,10.0.2.15,DNS,114,Standard query response 0x5a92 A safebrowsing.googleapis.com A 172.217.168.74 OPT
1,1.2439079999999194,10.0.2.3,10.0.2.15,DNS,126,Standard query response 0x0460 AAAA safebrowsing.googleapis.com AAAA 2a00:1450:400a:802::200a OPT
1,1.2445769999999357,10.0.2.15,172.217.168.74,TCP,74,50410  >  443 [SYN] Seq=0 Win=29200 Len=0 MSS=1460 SACK_PERM=1 TSval=3330303917 TSecr=0 WS=128
1,1.2568289999999251,172.217.168.74,10.0.2.15,TCP,60,"443  >  50410 [SYN, ACK] Seq=0 Ack=1 Win=65535 Len=0 MSS=1460"
1,1.2568770000000313,10.0.2.15,172.217.168.74,TCP,54,50410  >  443 [ACK] Seq=1 Ack=1 Win=29200 Len=0
1,1.2582680000000437,10.0.2.15,172.217.168.74,TLSv1.3,571,Client Hello
1,1.2584179999998923,172.217.168.74,10.0.2.15,TCP,60,443  >  50410 [ACK] Seq=1 Ack=518 Win=65535 Len=0
1,1.2832949999999528,172.217.168.74,10.0.2.15,TLSv1.3,1472,"Server Hello, Change Cipher Spec"
1,1.2833470000000489,10.0.2.15,172.217.168.74,TCP,54,50410  >  443 [ACK] Seq=518 Ack=1419 Win=31196 Len=0
1,1.2834089999998923,172.217.168.74,10.0.2.15,TCP,1474,443  >  50410 [ACK] Seq=1419 Ack=518 Win=65535 Len=1420 [TCP segment of a reassembled PDU]
1,1.2834179999999833,10.0.2.15,172.217.168.74,TCP,54,50410  >  443 [ACK] Seq=518 Ack=2839 Win=34080 Len=0
1,1.2837769999998727,172.217.168.74,10.0.2.15,TLSv1.3,126,Application Data
1,1.2837909999998374,10.0.2.15,172.217.168.74,TCP,54,50410  >  443 [ACK] Seq=518 Ack=2911 Win=34080 Len=0
1,1.2871020000000044,10.0.2.15,172.217.168.74,TLSv1.3,118,"Change Cipher Spec, Application Data"
1,1.2872459999998682,172.217.168.74,10.0.2.15,TCP,60,443  >  50410 [ACK] Seq=2911 Ack=582 Win=65535 Len=0
1,1.287742999999864,10.0.2.15,172.217.168.74,TLSv1.3,224,Application Data
1,1.2878309999998692,10.0.2.15,172.217.168.74,TLSv1.3,617,Application Data
1,1.28789699999993,172.217.168.74,10.0.2.15,TCP,60,443  >  50410 [ACK] Seq=2911 Ack=752 Win=65535 Len=0
1,1.2879029999999148,172.217.168.74,10.0.2.15,TCP,60,443  >  50410 [ACK] Seq=2911 Ack=1315 Win=65535 Len=0
1,1.2978060000000369,172.217.168.74,10.0.2.15,TLSv1.3,665,"Application Data, Application Data, Application Data"
1,1.2979949999999008,10.0.2.15,172.217.168.74,TLSv1.3,85,Application Data
1,1.2981170000000475,172.217.168.74,10.0.2.15,TCP,60,443  >  50410 [ACK] Seq=3522 Ack=1346 Win=65535 Len=0
1,1.300073999999995,172.217.168.74,10.0.2.15,TLSv1.3,447,Application Data
1,1.3008569999999509,172.217.168.74,10.0.2.15,TLSv1.3,1995,"Application Data, Application Data"
1,1.3008740000000216,10.0.2.15,172.217.168.74,TCP,54,50410  >  443 [ACK] Seq=1346 Ack=5856 Win=44020 Len=0
1,1.300901999999951,172.217.168.74,10.0.2.15,TLSv1.3,93,Application Data
1,1.3023220000000038,10.0.2.15,172.217.168.74,TLSv1.3,93,Application Data
1,1.3024739999998474,172.217.168.74,10.0.2.15,TCP,60,443  >  50410 [ACK] Seq=5895 Ack=1385 Win=65535 Len=0
1,1.3591469999998935,62.210.85.178,10.0.2.15,TLSv1.2,1618,Application Data
1,1.3592710000000352,10.0.2.15,62.210.85.178,TCP,54,35978  >  9001 [ACK] Seq=66612771 Ack=3737963 Win=65535 Len=0
1,1.359762000000046,10.0.2.15,62.210.85.178,TLSv1.2,590,Application Data
1,1.3598739999999907,62.210.85.178,10.0.2.15,TCP,60,9001  >  35978 [ACK] Seq=3737963 Ack=66613307 Win=65535 Len=0
1,1.457685999999967,54.93.77.70,10.0.2.15,TLSv1.2,590,Application Data
1,1.4580879999998615,10.0.2.15,54.93.77.70,TLSv1.2,590,Application Data
1,1.458208999999897,54.93.77.70,10.0.2.15,TCP,60,9001  >  34692 [ACK] Seq=66431239 Ack=3727719 Win=65535 Len=0
1,1.5625549999999748,62.210.85.178,10.0.2.15,TLSv1.2,590,Application Data
1,1.5702119999998558,10.0.2.15,62.210.85.178,TLSv1.2,590,Application Data
1,1.5704229999998915,62.210.85.178,10.0.2.15,TCP,60,9001  >  35978 [ACK] Seq=3738499 Ack=66613843 Win=65535 Len=0
1,1.583693999999923,10.0.2.15,62.210.85.178,TLSv1.2,4124,Application Data
1,1.5838309999999183,10.0.2.15,62.210.85.178,TCP,2974,35978  >  9001 [ACK] Seq=66617913 Ack=3738499 Win=65535 Len=2920 [TCP segment of a reassembled PDU]
1,1.583887999999888,62.210.85.178,10.0.2.15,TCP,60,9001  >  35978 [ACK] Seq=3738499 Ack=66615303 Win=65535 Len=0
1,1.5838999999998578,62.210.85.178,10.0.2.15,TCP,60,9001  >  35978 [ACK] Seq=3738499 Ack=66616763 Win=65535 Len=0
1,1.5839049999999588,62.210.85.178,10.0.2.15,TCP,60,9001  >  35978 [ACK] Seq=3738499 Ack=66617913 Win=65535 Len=0
1,1.5839089999999487,62.210.85.178,10.0.2.15,TCP,60,9001  >  35978 [ACK] Seq=3738499 Ack=66619373 Win=65535 Len=0
1,1.5839140000000498,62.210.85.178,10.0.2.15,TCP,60,9001  >  35978 [ACK] Seq=3738499 Ack=66620833 Win=65535 Len=0
1,1.5839590000000499,10.0.2.15,62.210.85.178,TLSv1.2,1204,Application Data
1,1.5840299999999843,10.0.2.15,62.210.85.178,TCP,2974,35978  >  9001 [ACK] Seq=66621983 Ack=3738499 Win=65535 Len=2920 [TCP segment of a reassembled PDU]
1,1.5840659999998934,62.210.85.178,10.0.2.15,TCP,60,9001  >  35978 [ACK] Seq=3738499 Ack=66621983 Win=65535 Len=0
1,1.5840729999999894,62.210.85.178,10.0.2.15,TCP,60,9001  >  35978 [ACK] Seq=3738499 Ack=66623443 Win=65535 Len=0
1,1.5840769999999793,62.210.85.178,10.0.2.15,TCP,60,9001  >  35978 [ACK] Seq=3738499 Ack=66624903 Win=65535 Len=0
1,1.5841120000000046,10.0.2.15,62.210.85.178,TLSv1.2,1204,Application Data
1,1.584175999999843,10.0.2.15,62.210.85.178,TCP,2974,35978  >  9001 [ACK] Seq=66626053 Ack=3738499 Win=65535 Len=2920 [TCP segment of a reassembled PDU]
1,1.5842189999998482,62.210.85.178,10.0.2.15,TCP,60,9001  >  35978 [ACK] Seq=3738499 Ack=66626053 Win=65535 Len=0
1,1.5842270000000553,62.210.85.178,10.0.2.15,TCP,60,9001  >  35978 [ACK] Seq=3738499 Ack=66627513 Win=65535 Len=0
1,1.584231999999929,62.210.85.178,10.0.2.15,TCP,60,9001  >  35978 [ACK] Seq=3738499 Ack=66628973 Win=65535 Len=0
1,1.5842999999999847,10.0.2.15,62.210.85.178,TLSv1.2,1204,Application Data
1,1.5844359999998687,62.210.85.178,10.0.2.15,TCP,60,9001  >  35978 [ACK] Seq=3738499 Ack=66630123 Win=65535 Len=0
1,1.5845090000000255,10.0.2.15,62.210.85.178,TLSv1.2,332,Application Data
1,1.5845529999999144,62.210.85.178,10.0.2.15,TCP,60,9001  >  35978 [ACK] Seq=3738499 Ack=66630401 Win=65535 Len=0
1,1.5846189999999751,10.0.2.15,62.210.85.178,TLSv1.2,3868,Application Data
1,1.584666999999854,62.210.85.178,10.0.2.15,TCP,60,9001  >  35978 [ACK] Seq=3738499 Ack=66631861 Win=65535 Len=0
1,1.5846750000000611,62.210.85.178,10.0.2.15,TCP,60,9001  >  35978 [ACK] Seq=3738499 Ack=66633321 Win=65535 Len=0
1,1.5846819999999298,62.210.85.178,10.0.2.15,TCP,60,9001  >  35978 [ACK] Seq=3738499 Ack=66634215 Win=65535 Len=0
1,1.5847309999999197,10.0.2.15,62.210.85.178,TLSv1.2,4124,Application Data
1,1.5847929999999906,10.0.2.15,62.210.85.178,TCP,2974,35978  >  9001 [ACK] Seq=66638285 Ack=3738499 Win=65535 Len=2920 [TCP segment of a reassembled PDU]
1,1.5848309999998946,62.210.85.178,10.0.2.15,TCP,60,9001  >  35978 [ACK] Seq=3738499 Ack=66635675 Win=65535 Len=0
1,1.5848379999999906,62.210.85.178,10.0.2.15,TCP,60,9001  >  35978 [ACK] Seq=3738499 Ack=66637135 Win=65535 Len=0
1,1.5848419999999805,62.210.85.178,10.0.2.15,TCP,60,9001  >  35978 [ACK] Seq=3738499 Ack=66638285 Win=65535 Len=0
1,1.5848459999999704,62.210.85.178,10.0.2.15,TCP,60,9001  >  35978 [ACK] Seq=3738499 Ack=66639745 Win=65535 Len=0
1,1.5848509999998441,62.210.85.178,10.0.2.15,TCP,60,9001  >  35978 [ACK] Seq=3738499 Ack=66641205 Win=65535 Len=0
1,1.5848879999998644,10.0.2.15,62.210.85.178,TLSv1.2,110,Application Data
1,1.5849809999999707,62.210.85.178,10.0.2.15,TCP,60,9001  >  35978 [ACK] Seq=3738499 Ack=66641261 Win=65535 Len=0
1,1.5952869999998711,10.0.2.15,62.210.85.178,TLSv1.2,4124,Application Data
1,1.5953899999999521,62.210.85.178,10.0.2.15,TCP,60,9001  >  35978 [ACK] Seq=3738499 Ack=66642721 Win=65535 Len=0
1,1.5954039999999168,62.210.85.178,10.0.2.15,TCP,60,9001  >  35978 [ACK] Seq=3738499 Ack=66644181 Win=65535 Len=0
1,1.5954079999999067,62.210.85.178,10.0.2.15,TCP,60,9001  >  35978 [ACK] Seq=3738499 Ack=66645331 Win=65535 Len=0
1,1.5954890000000432,10.0.2.15,62.210.85.178,TLSv1.2,4124,Application Data
1,1.5955619999999726,62.210.85.178,10.0.2.15,TCP,60,9001  >  35978 [ACK] Seq=3738499 Ack=66646791 Win=65535 Len=0
1,1.5955699999999524,62.210.85.178,10.0.2.15,TCP,60,9001  >  35978 [ACK] Seq=3738499 Ack=66648251 Win=65535 Len=0
1,1.5955730000000585,62.210.85.178,10.0.2.15,TCP,60,9001  >  35978 [ACK] Seq=3738499 Ack=66649401 Win=65535 Len=0
1,1.5956119999998464,10.0.2.15,62.210.85.178,TLSv1.2,4124,Application Data
1,1.5956509999998616,62.210.85.178,10.0.2.15,TCP,60,9001  >  35978 [ACK] Seq=3738499 Ack=66650861 Win=65535 Len=0
1,1.5956599999999526,62.210.85.178,10.0.2.15,TCP,60,9001  >  35978 [ACK] Seq=3738499 Ack=66652321 Win=65535 Len=0
1,1.5956650000000536,62.210.85.178,10.0.2.15,TCP,60,9001  >  35978 [ACK] Seq=3738499 Ack=66653471 Win=65535 Len=0
1,1.5957039999998415,10.0.2.15,62.210.85.178,TLSv1.2,3352,Application Data
1,1.595920999999862,62.210.85.178,10.0.2.15,TCP,60,9001  >  35978 [ACK] Seq=3738499 Ack=66654931 Win=65535 Len=0
1,1.5959470000000238,62.210.85.178,10.0.2.15,TCP,60,9001  >  35978 [ACK] Seq=3738499 Ack=66656391 Win=65535 Len=0
1,1.5959499999999025,62.210.85.178,10.0.2.15,TCP,60,9001  >  35978 [ACK] Seq=3738499 Ack=66656769 Win=65535 Len=0
1,1.677169000000049,54.93.77.70,10.0.2.15,TLSv1.2,590,Application Data
1,1.6877719999999954,54.93.77.70,10.0.2.15,TCP,2950,"9001  >  34692 [PSH, ACK] Seq=66431775 Ack=3727719 Win=65535 Len=2896 [TCP segment of a reassembled PDU]"
1,1.6878119999998944,54.93.77.70,10.0.2.15,TLSv1.2,4398,Application Data [TCP segment of a reassembled PDU]
1,1.6879169999999704,10.0.2.15,54.93.77.70,TCP,54,34692  >  9001 [ACK] Seq=3727719 Ack=66439015 Win=65535 Len=0
1,1.697499999999991,54.93.77.70,10.0.2.15,TLSv1.2,7294,"Application Data, Application Data"
1,1.6977429999999458,10.0.2.15,54.93.77.70,TCP,54,34692  >  9001 [ACK] Seq=3727719 Ack=66446255 Win=65535 Len=0
1,1.7057239999999183,54.93.77.70,10.0.2.15,TLSv1.2,1082,Application Data
1,1.718644999999924,54.93.77.70,10.0.2.15,TLSv1.2,8742,"Application Data, Application Data"
1,1.7187619999999697,10.0.2.15,54.93.77.70,TCP,54,34692  >  9001 [ACK] Seq=3727719 Ack=66455971 Win=65535 Len=0
1,1.7352200000000266,54.93.77.70,10.0.2.15,TLSv1.2,170,Application Data
1,1.7354539999998906,10.0.2.15,54.93.77.70,TLSv1.2,590,Application Data
1,1.7355539999998655,54.93.77.70,10.0.2.15,TCP,60,9001  >  34692 [ACK] Seq=66456087 Ack=3728255 Win=65535 Len=0
1,1.7393909999998414,54.93.77.70,10.0.2.15,TCP,2950,"9001  >  34692 [PSH, ACK] Seq=66456087 Ack=3728255 Win=65535 Len=2896 [TCP segment of a reassembled PDU]"
1,1.7401559999998426,54.93.77.70,10.0.2.15,TLSv1.2,5734,"Application Data, Application Data"
1,1.7404649999998583,10.0.2.15,54.93.77.70,TCP,54,34692  >  9001 [ACK] Seq=3728255 Ack=66464663 Win=65535 Len=0
1,1.7405229999999392,54.93.77.70,10.0.2.15,TCP,1614,"9001  >  34692 [PSH, ACK] Seq=66464663 Ack=3728255 Win=65535 Len=1560 [TCP segment of a reassembled PDU]"
1,1.7405509999998685,10.0.2.15,54.93.77.70,TCP,54,34692  >  9001 [ACK] Seq=3728255 Ack=66466223 Win=65535 Len=0
1,1.7416229999998905,54.93.77.70,10.0.2.15,TLSv1.2,4398,"Application Data, Application Data"
1,1.7416679999998905,10.0.2.15,54.93.77.70,TCP,54,34692  >  9001 [ACK] Seq=3728255 Ack=66470567 Win=65535 Len=0
1,1.7467309999999543,10.0.2.15,54.93.77.70,TLSv1.2,590,Application Data
1,1.746840999999904,54.93.77.70,10.0.2.15,TCP,60,9001  >  34692 [ACK] Seq=66470567 Ack=3728791 Win=65535 Len=0
1,1.747953999999936,54.93.77.70,10.0.2.15,TLSv1.2,1502,Application Data [TCP segment of a reassembled PDU]
1,1.748004999999921,10.0.2.15,54.93.77.70,TCP,54,34692  >  9001 [ACK] Seq=3728791 Ack=66472015 Win=65535 Len=0
1,1.7520779999999831,54.93.77.70,10.0.2.15,TLSv1.2,1220,Application Data
1,1.780614999999898,54.93.77.70,10.0.2.15,TLSv1.2,1618,Application Data
1,1.7808189999998376,10.0.2.15,54.93.77.70,TCP,54,34692  >  9001 [ACK] Seq=3728791 Ack=66474745 Win=65535 Len=0
1,1.7892749999998614,10.0.2.15,54.93.77.70,TLSv1.2,590,Application Data
1,1.7894109999999728,54.93.77.70,10.0.2.15,TCP,60,9001  >  34692 [ACK] Seq=66474745 Ack=3729327 Win=65535 Len=0
1,1.823069999999916,62.210.85.178,10.0.2.15,TLSv1.2,590,Application Data
1,1.8667370000000574,10.0.2.15,62.210.85.178,TCP,54,35978  >  9001 [ACK] Seq=66656769 Ack=3739035 Win=65535 Len=0
1,1.8813199999999597,62.210.85.178,10.0.2.15,TLSv1.2,590,Application Data
1,1.8815569999999298,10.0.2.15,62.210.85.178,TCP,54,35978  >  9001 [ACK] Seq=66656769 Ack=3739571 Win=65535 Len=0
1,2.0599529999999504,62.210.85.178,10.0.2.15,TLSv1.2,590,Application Data
1,2.0600379999998495,10.0.2.15,62.210.85.178,TCP,54,35978  >  9001 [ACK] Seq=66656769 Ack=3740107 Win=65535 Len=0
1,2.0605769999999666,10.0.2.15,62.210.85.178,TLSv1.2,590,Application Data
1,2.060692999999901,62.210.85.178,10.0.2.15,TCP,60,9001  >  35978 [ACK] Seq=3740107 Ack=66657305 Win=65535 Len=0
1,2.1781519999999546,54.93.77.70,10.0.2.15,TLSv1.2,590,Application Data
1,2.1789859999998953,10.0.2.15,54.93.77.70,TLSv1.2,590,Application Data
1,2.179343000000017,54.93.77.70,10.0.2.15,TCP,60,9001  >  34692 [ACK] Seq=66475281 Ack=3729863 Win=65535 Len=0
1,2.362086999999974,62.210.85.178,10.0.2.15,TLSv1.2,590,Application Data
1,2.402466000000004,10.0.2.15,62.210.85.178,TCP,54,35978  >  9001 [ACK] Seq=66657305 Ack=3740643 Win=65535 Len=0
1,2.4262069999999767,10.0.2.15,62.210.85.178,TLSv1.2,590,Application Data
1,2.426420999999891,62.210.85.178,10.0.2.15,TCP,60,9001  >  35978 [ACK] Seq=3740643 Ack=66657841 Win=65535 Len=0
1,2.4387950000000274,10.0.2.15,62.210.85.178,TLSv1.2,4124,Application Data
1,2.4388950000000023,10.0.2.15,62.210.85.178,TCP,2974,35978  >  9001 [ACK] Seq=66661911 Ack=3740643 Win=65535 Len=2920 [TCP segment of a reassembled PDU]
1,2.438938999999891,62.210.85.178,10.0.2.15,TCP,60,9001  >  35978 [ACK] Seq=3740643 Ack=66659301 Win=65535 Len=0
1,2.438948999999866,62.210.85.178,10.0.2.15,TCP,60,9001  >  35978 [ACK] Seq=3740643 Ack=66660761 Win=65535 Len=0
1,2.438952999999856,62.210.85.178,10.0.2.15,TCP,60,9001  >  35978 [ACK] Seq=3740643 Ack=66661911 Win=65535 Len=0
1,2.4389549999998508,62.210.85.178,10.0.2.15,TCP,60,9001  >  35978 [ACK] Seq=3740643 Ack=66663371 Win=65535 Len=0
1,2.438957999999957,62.210.85.178,10.0.2.15,TCP,60,9001  >  35978 [ACK] Seq=3740643 Ack=66664831 Win=65535 Len=0
1,2.438992999999982,10.0.2.15,62.210.85.178,TLSv1.2,1204,Application Data
1,2.4390319999999974,62.210.85.178,10.0.2.15,TCP,60,9001  >  35978 [ACK] Seq=3740643 Ack=66665981 Win=65535 Len=0
1,2.4390759999998863,10.0.2.15,62.210.85.178,TLSv1.2,4124,Application Data
1,2.439110000000028,62.210.85.178,10.0.2.15,TCP,60,9001  >  35978 [ACK] Seq=3740643 Ack=66667441 Win=65535 Len=0
1,2.4391169999998965,62.210.85.178,10.0.2.15,TCP,60,9001  >  35978 [ACK] Seq=3740643 Ack=66668901 Win=65535 Len=0
1,2.4391219999999976,62.210.85.178,10.0.2.15,TCP,60,9001  >  35978 [ACK] Seq=3740643 Ack=66670051 Win=65535 Len=0
1,2.4391599999999016,10.0.2.15,62.210.85.178,TLSv1.2,4124,Application Data
1,2.439194000000043,62.210.85.178,10.0.2.15,TCP,60,9001  >  35978 [ACK] Seq=3740643 Ack=66671511 Win=65535 Len=0
1,2.439200999999912,62.210.85.178,10.0.2.15,TCP,60,9001  >  35978 [ACK] Seq=3740643 Ack=66672971 Win=65535 Len=0
1,2.4392589999999927,10.0.2.15,62.210.85.178,TLSv1.2,2974,Application Data
1,2.439296999999897,62.210.85.178,10.0.2.15,TCP,60,9001  >  35978 [ACK] Seq=3740643 Ack=66674121 Win=65535 Len=0
1,2.439303999999993,62.210.85.178,10.0.2.15,TCP,60,9001  >  35978 [ACK] Seq=3740643 Ack=66675581 Win=65535 Len=0
1,2.4393069999998716,62.210.85.178,10.0.2.15,TCP,60,9001  >  35978 [ACK] Seq=3740643 Ack=66677041 Win=65535 Len=0
1,2.439333999999917,10.0.2.15,62.210.85.178,TLSv1.2,1226,Application Data
1,2.4393659999998363,62.210.85.178,10.0.2.15,TCP,60,9001  >  35978 [ACK] Seq=3740643 Ack=66678213 Win=65535 Len=0
1,2.4394059999999627,10.0.2.15,62.210.85.178,TLSv1.2,4124,Application Data
1,2.4394419999998718,62.210.85.178,10.0.2.15,TCP,60,9001  >  35978 [ACK] Seq=3740643 Ack=66679673 Win=65535 Len=0
1,2.439448999999968,62.210.85.178,10.0.2.15,TCP,60,9001  >  35978 [ACK] Seq=3740643 Ack=66681133 Win=65535 Len=0
1,2.4394519999998465,62.210.85.178,10.0.2.15,TCP,60,9001  >  35978 [ACK] Seq=3740643 Ack=66682283 Win=65535 Len=0
1,2.439488999999867,10.0.2.15,62.210.85.178,TLSv1.2,3030,Application Data
1,2.4395230000000083,62.210.85.178,10.0.2.15,TCP,60,9001  >  35978 [ACK] Seq=3740643 Ack=66683743 Win=65535 Len=0
1,2.439529999999877,62.210.85.178,10.0.2.15,TCP,60,9001  >  35978 [ACK] Seq=3740643 Ack=66685203 Win=65535 Len=0
1,2.439532999999983,62.210.85.178,10.0.2.15,TCP,60,9001  >  35978 [ACK] Seq=3740643 Ack=66685259 Win=65535 Len=0
1,2.450900000000047,10.0.2.15,62.210.85.178,TLSv1.2,4124,Application Data
1,2.450982999999951,62.210.85.178,10.0.2.15,TCP,60,9001  >  35978 [ACK] Seq=3740643 Ack=66686719 Win=65535 Len=0
1,2.450992999999926,62.210.85.178,10.0.2.15,TCP,60,9001  >  35978 [ACK] Seq=3740643 Ack=66688179 Win=65535 Len=0
1,2.450996000000032,62.210.85.178,10.0.2.15,TCP,60,9001  >  35978 [ACK] Seq=3740643 Ack=66689329 Win=65535 Len=0
1,2.451037999999926,10.0.2.15,62.210.85.178,TLSv1.2,4124,Application Data
1,2.451096000000007,62.210.85.178,10.0.2.15,TCP,60,9001  >  35978 [ACK] Seq=3740643 Ack=66690789 Win=65535 Len=0
1,2.4511029999998755,62.210.85.178,10.0.2.15,TCP,60,9001  >  35978 [ACK] Seq=3740643 Ack=66692249 Win=65535 Len=0
1,2.4511059999999816,62.210.85.178,10.0.2.15,TCP,60,9001  >  35978 [ACK] Seq=3740643 Ack=66693399 Win=65535 Len=0
1,2.451141000000007,10.0.2.15,62.210.85.178,TLSv1.2,4124,Application Data
1,2.4511740000000373,62.210.85.178,10.0.2.15,TCP,60,9001  >  35978 [ACK] Seq=3740643 Ack=66694859 Win=65535 Len=0
1,2.451182000000017,62.210.85.178,10.0.2.15,TCP,60,9001  >  35978 [ACK] Seq=3740643 Ack=66696319 Win=65535 Len=0
1,2.451186000000007,62.210.85.178,10.0.2.15,TCP,60,9001  >  35978 [ACK] Seq=3740643 Ack=66697469 Win=65535 Len=0
1,2.451221999999916,10.0.2.15,62.210.85.178,TLSv1.2,4124,Application Data
1,2.4512560000000576,62.210.85.178,10.0.2.15,TCP,60,9001  >  35978 [ACK] Seq=3740643 Ack=66698929 Win=65535 Len=0
1,2.4512640000000374,62.210.85.178,10.0.2.15,TCP,60,9001  >  35978 [ACK] Seq=3740643 Ack=66700389 Win=65535 Len=0
1,2.4512680000000273,62.210.85.178,10.0.2.15,TCP,60,9001  >  35978 [ACK] Seq=3740643 Ack=66701539 Win=65535 Len=0
1,2.4513019999999415,10.0.2.15,62.210.85.178,TLSv1.2,332,Application Data
1,2.451334999999972,62.210.85.178,10.0.2.15,TCP,60,9001  >  35978 [ACK] Seq=3740643 Ack=66701817 Win=65535 Len=0
1,2.4513849999998456,10.0.2.15,62.210.85.178,TLSv1.2,3868,Application Data
1,2.451420999999982,62.210.85.178,10.0.2.15,TCP,60,9001  >  35978 [ACK] Seq=3740643 Ack=66703277 Win=65535 Len=0
1,2.451428999999962,62.210.85.178,10.0.2.15,TCP,60,9001  >  35978 [ACK] Seq=3740643 Ack=66704737 Win=65535 Len=0
1,2.4514319999998406,62.210.85.178,10.0.2.15,TCP,60,9001  >  35978 [ACK] Seq=3740643 Ack=66705631 Win=65535 Len=0
1,2.451469999999972,10.0.2.15,62.210.85.178,TLSv1.2,4124,Application Data
1,2.451511999999866,62.210.85.178,10.0.2.15,TCP,60,9001  >  35978 [ACK] Seq=3740643 Ack=66707091 Win=65535 Len=0
1,2.451517999999851,62.210.85.178,10.0.2.15,TCP,60,9001  >  35978 [ACK] Seq=3740643 Ack=66708551 Win=65535 Len=0
1,2.451520999999957,62.210.85.178,10.0.2.15,TCP,60,9001  >  35978 [ACK] Seq=3740643 Ack=66709701 Win=65535 Len=0
1,2.4515539999999874,10.0.2.15,62.210.85.178,TLSv1.2,2002,Application Data
1,2.4516869999999926,62.210.85.178,10.0.2.15,TCP,60,9001  >  35978 [ACK] Seq=3740643 Ack=66711161 Win=65535 Len=0
1,2.4516989999999623,62.210.85.178,10.0.2.15,TCP,60,9001  >  35978 [ACK] Seq=3740643 Ack=66711649 Win=65535 Len=0
1,2.5547119999998813,54.93.77.70,10.0.2.15,TCP,2950,"9001  >  34692 [PSH, ACK] Seq=66475281 Ack=3729863 Win=65535 Len=2896 [TCP segment of a reassembled PDU]"
1,2.5547509999998965,54.93.77.70,10.0.2.15,TLSv1.2,5448,"Application Data, Application Data, Application Data"
1,2.5548469999998815,10.0.2.15,54.93.77.70,TCP,54,34692  >  9001 [ACK] Seq=3729863 Ack=66483571 Win=65535 Len=0
1,2.5674750000000586,54.93.77.70,10.0.2.15,TCP,2950,"9001  >  34692 [PSH, ACK] Seq=66483571 Ack=3729863 Win=65535 Len=2896 [TCP segment of a reassembled PDU]"
1,2.5675569999998515,10.0.2.15,54.93.77.70,TCP,54,34692  >  9001 [ACK] Seq=3729863 Ack=66486467 Win=65535 Len=0
1,2.570694999999887,54.93.77.70,10.0.2.15,TLSv1.2,264,Application Data
1,2.5793469999998706,54.93.77.70,10.0.2.15,TCP,2950,"9001  >  34692 [PSH, ACK] Seq=66486677 Ack=3729863 Win=65535 Len=2896 [TCP segment of a reassembled PDU]"
1,2.579441999999972,10.0.2.15,54.93.77.70,TCP,54,34692  >  9001 [ACK] Seq=3729863 Ack=66489573 Win=65535 Len=0
1,2.5887299999999414,54.93.77.70,10.0.2.15,TLSv1.2,2950,Application Data [TCP segment of a reassembled PDU]
1,2.5888119999999617,10.0.2.15,54.93.77.70,TCP,54,34692  >  9001 [ACK] Seq=3729863 Ack=66492469 Win=65535 Len=0
1,2.589665999999852,54.93.77.70,10.0.2.15,TLSv1.2,7154,"Application Data, Application Data"
1,2.589719999999943,10.0.2.15,54.93.77.70,TCP,54,34692  >  9001 [ACK] Seq=3729863 Ack=66499569 Win=65535 Len=0
1,2.589770000000044,54.93.77.70,10.0.2.15,TCP,194,"9001  >  34692 [PSH, ACK] Seq=66499569 Ack=3729863 Win=65535 Len=140 [TCP segment of a reassembled PDU]"
1,2.5903220000000147,54.93.77.70,10.0.2.15,TLSv1.2,2950,Application Data [TCP segment of a reassembled PDU]
1,2.5904129999998986,10.0.2.15,54.93.77.70,TCP,54,34692  >  9001 [ACK] Seq=3729863 Ack=66502605 Win=65535 Len=0
1,2.590596000000005,10.0.2.15,54.93.77.70,TLSv1.2,590,Application Data
1,2.5907139999999345,54.93.77.70,10.0.2.15,TCP,60,9001  >  34692 [ACK] Seq=66502605 Ack=3730399 Win=65535 Len=0
1,2.5953649999999016,54.93.77.70,10.0.2.15,TLSv1.2,684,Application Data
1,2.599267999999938,54.93.77.70,10.0.2.15,TLSv1.2,4398,Application Data
1,2.599373000000014,10.0.2.15,54.93.77.70,TCP,54,34692  >  9001 [ACK] Seq=3730399 Ack=66507579 Win=65535 Len=0
1,2.6001320000000305,54.93.77.70,10.0.2.15,TCP,1502,"9001  >  34692 [PSH, ACK] Seq=66507579 Ack=3730399 Win=65535 Len=1448 [TCP segment of a reassembled PDU]"
1,2.60015199999998,54.93.77.70,10.0.2.15,TLSv1.2,5846,Application Data [TCP segment of a reassembled PDU]
1,2.6001890000000003,10.0.2.15,54.93.77.70,TCP,54,34692  >  9001 [ACK] Seq=3730399 Ack=66509027 Win=65535 Len=0
1,2.6002849999999853,10.0.2.15,54.93.77.70,TCP,54,34692  >  9001 [ACK] Seq=3730399 Ack=66514819 Win=65535 Len=0
1,2.6026070000000345,10.0.2.15,54.93.77.70,TLSv1.2,590,Application Data
1,2.6026959999999235,54.93.77.70,10.0.2.15,TCP,60,9001  >  34692 [ACK] Seq=66514819 Ack=3730935 Win=65535 Len=0
1,2.607291000000032,54.93.77.70,10.0.2.15,TLSv1.2,2950,Application Data [TCP segment of a reassembled PDU]
1,2.6074089999999615,10.0.2.15,54.93.77.70,TCP,54,34692  >  9001 [ACK] Seq=3730935 Ack=66517715 Win=65535 Len=0
1,2.608536999999842,54.93.77.70,10.0.2.15,TLSv1.2,4398,Application Data [TCP segment of a reassembled PDU]
1,2.608606000000009,10.0.2.15,54.93.77.70,TCP,54,34692  >  9001 [ACK] Seq=3730935 Ack=66522059 Win=65535 Len=0
1,2.6168049999998857,54.93.77.70,10.0.2.15,TLSv1.2,358,Application Data
1,2.6237659999999323,54.93.77.70,10.0.2.15,TCP,1502,"9001  >  34692 [PSH, ACK] Seq=66522363 Ack=3730935 Win=65535 Len=1448 [TCP segment of a reassembled PDU]"
1,2.6238479999999527,10.0.2.15,54.93.77.70,TCP,54,34692  >  9001 [ACK] Seq=3730935 Ack=66523811 Win=65535 Len=0
1,2.635717999999997,54.93.77.70,10.0.2.15,TLSv1.2,2950,Application Data [TCP segment of a reassembled PDU]
1,2.635802999999896,10.0.2.15,54.93.77.70,TCP,54,34692  >  9001 [ACK] Seq=3730935 Ack=66526707 Win=65535 Len=0
1,2.639787999999953,54.93.77.70,10.0.2.15,TLSv1.2,894,Application Data
1,2.639987999999903,10.0.2.15,54.93.77.70,TLSv1.2,590,Application Data
1,2.6401100000000497,54.93.77.70,10.0.2.15,TCP,60,9001  >  34692 [ACK] Seq=66527547 Ack=3731471 Win=65535 Len=0
1,2.700746999999865,62.210.85.178,10.0.2.15,TLSv1.2,590,Application Data
1,2.700853000000052,10.0.2.15,62.210.85.178,TCP,54,35978  >  9001 [ACK] Seq=66711649 Ack=3741179 Win=65535 Len=0
1,2.7384609999999157,62.210.85.178,10.0.2.15,TLSv1.2,590,Application Data
1,2.738542000000052,10.0.2.15,62.210.85.178,TCP,54,35978  >  9001 [ACK] Seq=66711649 Ack=3741715 Win=65535 Len=0
1,2.8060579999998936,62.210.85.178,10.0.2.15,TLSv1.2,590,Application Data
1,2.8061599999998634,10.0.2.15,62.210.85.178,TCP,54,35978  >  9001 [ACK] Seq=66711649 Ack=3742251 Win=65535 Len=0
1,2.81254100000001,54.93.77.70,10.0.2.15,TLSv1.2,2132,Application Data
1,2.8126330000000053,10.0.2.15,54.93.77.70,TCP,54,34692  >  9001 [ACK] Seq=3731471 Ack=66529625 Win=65535 Len=0
1,2.8162079999999605,10.0.2.15,54.93.77.70,TLSv1.2,590,Application Data
1,2.8164090000000215,54.93.77.70,10.0.2.15,TCP,60,9001  >  34692 [ACK] Seq=66529625 Ack=3732007 Win=65535 Len=0
1,2.9769589999998516,62.210.85.178,10.0.2.15,TLSv1.2,590,Application Data
1,2.977057000000059,10.0.2.15,62.210.85.178,TCP,54,35978  >  9001 [ACK] Seq=66711649 Ack=3742787 Win=65535 Len=0
1,2.9777010000000246,10.0.2.15,62.210.85.178,TLSv1.2,590,Application Data
1,2.9778329999999187,62.210.85.178,10.0.2.15,TCP,60,9001  >  35978 [ACK] Seq=3742787 Ack=66712185 Win=65535 Len=0
1,3.0525169999998525,54.93.77.70,10.0.2.15,TLSv1.2,590,Application Data
1,3.052887999999939,10.0.2.15,54.93.77.70,TLSv1.2,590,Application Data
1,3.0529979999998886,54.93.77.70,10.0.2.15,TCP,60,9001  >  34692 [ACK] Seq=66530161 Ack=3732543 Win=65535 Len=0
1,3.1562589999998636,62.210.85.178,10.0.2.15,TLSv1.2,590,Application Data
1,3.1590249999999287,10.0.2.15,62.210.85.178,TLSv1.2,590,Application Data
1,3.159202999999934,62.210.85.178,10.0.2.15,TCP,60,9001  >  35978 [ACK] Seq=3743323 Ack=66712721 Win=65535 Len=0
1,3.170901999999842,10.0.2.15,62.210.85.178,TLSv1.2,4124,Application Data
1,3.170998000000054,10.0.2.15,62.210.85.178,TCP,2974,35978  >  9001 [ACK] Seq=66716791 Ack=3743323 Win=65535 Len=2920 [TCP segment of a reassembled PDU]
1,3.171037999999953,62.210.85.178,10.0.2.15,TCP,60,9001  >  35978 [ACK] Seq=3743323 Ack=66714181 Win=65535 Len=0
1,3.171051000000034,62.210.85.178,10.0.2.15,TCP,60,9001  >  35978 [ACK] Seq=3743323 Ack=66715641 Win=65535 Len=0
1,3.171055000000024,62.210.85.178,10.0.2.15,TCP,60,9001  >  35978 [ACK] Seq=3743323 Ack=66716791 Win=65535 Len=0
1,3.1710579999999027,62.210.85.178,10.0.2.15,TCP,60,9001  >  35978 [ACK] Seq=3743323 Ack=66718251 Win=65535 Len=0
1,3.1710599999998976,62.210.85.178,10.0.2.15,TCP,60,9001  >  35978 [ACK] Seq=3743323 Ack=66719711 Win=65535 Len=0
1,3.171094000000039,10.0.2.15,62.210.85.178,TLSv1.2,1204,Application Data
1,3.1711279999999533,62.210.85.178,10.0.2.15,TCP,60,9001  >  35978 [ACK] Seq=3743323 Ack=66720861 Win=65535 Len=0
1,3.171173999999837,10.0.2.15,62.210.85.178,TLSv1.2,718,Application Data
1,3.1712089999998625,62.210.85.178,10.0.2.15,TCP,60,9001  >  35978 [ACK] Seq=3743323 Ack=66721525 Win=65535 Len=0
1,3.260381000000052,54.93.77.70,10.0.2.15,TLSv1.2,590,Application Data
1,3.2719640000000254,54.93.77.70,10.0.2.15,TCP,2950,"9001  >  34692 [PSH, ACK] Seq=66530697 Ack=3732543 Win=65535 Len=2896 [TCP segment of a reassembled PDU]"
1,3.2720999999999094,10.0.2.15,54.93.77.70,TCP,54,34692  >  9001 [ACK] Seq=3732543 Ack=66533593 Win=65535 Len=0
1,3.2893149999999878,54.93.77.70,10.0.2.15,TLSv1.2,778,Application Data
1,3.2941510000000562,54.93.77.70,10.0.2.15,TCP,2950,"9001  >  34692 [PSH, ACK] Seq=66534317 Ack=3732543 Win=65535 Len=2896 [TCP segment of a reassembled PDU]"
1,3.29420499999992,10.0.2.15,54.93.77.70,TCP,54,34692  >  9001 [ACK] Seq=3732543 Ack=66537213 Win=65535 Len=0
1,3.310907000000043,54.93.77.70,10.0.2.15,TLSv1.2,1314,"Application Data, Application Data"
1,3.3544399999998404,10.0.2.15,54.93.77.70,TCP,54,34692  >  9001 [ACK] Seq=3732543 Ack=66538473 Win=65535 Len=0
1,3.388826999999992,54.93.77.70,10.0.2.15,TLSv1.2,1104,Application Data
1,3.388907999999901,10.0.2.15,54.93.77.70,TCP,54,34692  >  9001 [ACK] Seq=3732543 Ack=66539523 Win=65535 Len=0
1,3.391253000000006,10.0.2.15,54.93.77.70,TLSv1.2,590,Application Data
1,3.3914239999999154,54.93.77.70,10.0.2.15,TCP,60,9001  >  34692 [ACK] Seq=66539523 Ack=3733079 Win=65535 Len=0
1,3.502661999999873,62.210.85.178,10.0.2.15,TLSv1.2,590,Application Data
1,3.5030609999998887,10.0.2.15,62.210.85.178,TLSv1.2,590,Application Data
1,3.503199999999879,62.210.85.178,10.0.2.15,TCP,60,9001  >  35978 [ACK] Seq=3743859 Ack=66722061 Win=65535 Len=0
1,3.590678999999909,54.93.77.70,10.0.2.15,TLSv1.2,590,Application Data
1,3.5910959999998795,10.0.2.15,54.93.77.70,TLSv1.2,590,Application Data
1,3.591228000000001,54.93.77.70,10.0.2.15,TCP,60,9001  >  34692 [ACK] Seq=66540059 Ack=3733615 Win=65535 Len=0
1,3.6889589999998407,62.210.85.178,10.0.2.15,TLSv1.2,590,Application Data
1,3.6967540000000554,10.0.2.15,62.210.85.178,TLSv1.2,590,Application Data
1,3.6969729999998435,62.210.85.178,10.0.2.15,TCP,60,9001  >  35978 [ACK] Seq=3744395 Ack=66722597 Win=65535 Len=0
1,3.710602999999992,10.0.2.15,62.210.85.178,TLSv1.2,4124,Application Data
1,3.710728999999901,10.0.2.15,62.210.85.178,TCP,2974,35978  >  9001 [ACK] Seq=66726667 Ack=3744395 Win=65535 Len=2920 [TCP segment of a reassembled PDU]
1,3.710773999999901,62.210.85.178,10.0.2.15,TCP,60,9001  >  35978 [ACK] Seq=3744395 Ack=66724057 Win=65535 Len=0
1,3.710785999999871,62.210.85.178,10.0.2.15,TCP,60,9001  >  35978 [ACK] Seq=3744395 Ack=66725517 Win=65535 Len=0
1,3.710789999999861,62.210.85.178,10.0.2.15,TCP,60,9001  >  35978 [ACK] Seq=3744395 Ack=66726667 Win=65535 Len=0
1,3.710794999999962,62.210.85.178,10.0.2.15,TCP,60,9001  >  35978 [ACK] Seq=3744395 Ack=66728127 Win=65535 Len=0
1,3.7107989999999518,62.210.85.178,10.0.2.15,TCP,60,9001  >  35978 [ACK] Seq=3744395 Ack=66729587 Win=65535 Len=0
1,3.710841999999957,10.0.2.15,62.210.85.178,TLSv1.2,1204,Application Data
1,3.7109109999998964,10.0.2.15,62.210.85.178,TCP,2974,35978  >  9001 [ACK] Seq=66730737 Ack=3744395 Win=65535 Len=2920 [TCP segment of a reassembled PDU]
1,3.710949000000028,62.210.85.178,10.0.2.15,TCP,60,9001  >  35978 [ACK] Seq=3744395 Ack=66730737 Win=65535 Len=0
1,3.7109559999998964,62.210.85.178,10.0.2.15,TCP,60,9001  >  35978 [ACK] Seq=3744395 Ack=66732197 Win=65535 Len=0
1,3.7109609999999975,62.210.85.178,10.0.2.15,TCP,60,9001  >  35978 [ACK] Seq=3744395 Ack=66733657 Win=65535 Len=0
1,3.7109949999999117,10.0.2.15,62.210.85.178,TLSv1.2,1204,Application Data
1,3.7110609999999724,10.0.2.15,62.210.85.178,TCP,2974,35978  >  9001 [ACK] Seq=66734807 Ack=3744395 Win=65535 Len=2920 [TCP segment of a reassembled PDU]
1,3.7110969999998815,62.210.85.178,10.0.2.15,TCP,60,9001  >  35978 [ACK] Seq=3744395 Ack=66734807 Win=65535 Len=0
1,3.7111039999999775,62.210.85.178,10.0.2.15,TCP,60,9001  >  35978 [ACK] Seq=3744395 Ack=66736267 Win=65535 Len=0
1,3.7111079999999674,62.210.85.178,10.0.2.15,TCP,60,9001  >  35978 [ACK] Seq=3744395 Ack=66737727 Win=65535 Len=0
1,3.7111399999998866,10.0.2.15,62.210.85.178,TLSv1.2,1204,Application Data
1,3.7112359999998716,10.0.2.15,62.210.85.178,TLSv1.2,2974,Application Data
1,3.7112600000000384,62.210.85.178,10.0.2.15,TCP,60,9001  >  35978 [ACK] Seq=3744395 Ack=66738877 Win=65535 Len=0
1,3.7112660000000233,62.210.85.178,10.0.2.15,TCP,60,9001  >  35978 [ACK] Seq=3744395 Ack=66740337 Win=65535 Len=0
1,3.711270999999897,62.210.85.178,10.0.2.15,TCP,60,9001  >  35978 [ACK] Seq=3744395 Ack=66741797 Win=65535 Len=0
1,3.7113030000000435,10.0.2.15,62.210.85.178,TLSv1.2,1226,Application Data
1,3.7113409999999476,62.210.85.178,10.0.2.15,TCP,60,9001  >  35978 [ACK] Seq=3744395 Ack=66742969 Win=65535 Len=0
1,3.7113849999998365,10.0.2.15,62.210.85.178,TLSv1.2,4124,Application Data
1,3.711424999999963,62.210.85.178,10.0.2.15,TCP,60,9001  >  35978 [ACK] Seq=3744395 Ack=66744429 Win=65535 Len=0
1,3.711432000000059,62.210.85.178,10.0.2.15,TCP,60,9001  >  35978 [ACK] Seq=3744395 Ack=66745889 Win=65535 Len=0
1,3.711436000000049,62.210.85.178,10.0.2.15,TCP,60,9001  >  35978 [ACK] Seq=3744395 Ack=66747039 Win=65535 Len=0
1,3.7114819999999327,10.0.2.15,62.210.85.178,TLSv1.2,3030,Application Data
1,3.711520999999948,62.210.85.178,10.0.2.15,TCP,60,9001  >  35978 [ACK] Seq=3744395 Ack=66748499 Win=65535 Len=0
1,3.711528000000044,62.210.85.178,10.0.2.15,TCP,60,9001  >  35978 [ACK] Seq=3744395 Ack=66749959 Win=65535 Len=0
1,3.7115329999999176,62.210.85.178,10.0.2.15,TCP,60,9001  >  35978 [ACK] Seq=3744395 Ack=66750015 Win=65535 Len=0
1,3.720724999999902,10.0.2.15,62.210.85.178,TLSv1.2,4124,Application Data
1,3.7208169999998972,10.0.2.15,62.210.85.178,TCP,2974,35978  >  9001 [ACK] Seq=66754085 Ack=3744395 Win=65535 Len=2920 [TCP segment of a reassembled PDU]
1,3.7208530000000337,62.210.85.178,10.0.2.15,TCP,60,9001  >  35978 [ACK] Seq=3744395 Ack=66751475 Win=65535 Len=0
1,3.7208610000000135,62.210.85.178,10.0.2.15,TCP,60,9001  >  35978 [ACK] Seq=3744395 Ack=66752935 Win=65535 Len=0
1,3.7208650000000034,62.210.85.178,10.0.2.15,TCP,60,9001  >  35978 [ACK] Seq=3744395 Ack=66754085 Win=65535 Len=0
1,3.7208689999999933,62.210.85.178,10.0.2.15,TCP,60,9001  >  35978 [ACK] Seq=3744395 Ack=66755545 Win=65535 Len=0
1,3.720872999999983,62.210.85.178,10.0.2.15,TCP,60,9001  >  35978 [ACK] Seq=3744395 Ack=66757005 Win=65535 Len=0
1,3.7209119999999984,10.0.2.15,62.210.85.178,TLSv1.2,1204,Application Data
1,3.720978999999943,10.0.2.15,62.210.85.178,TCP,2974,35978  >  9001 [ACK] Seq=66758155 Ack=3744395 Win=65535 Len=2920 [TCP segment of a reassembled PDU]
1,3.721014999999852,62.210.85.178,10.0.2.15,TCP,60,9001  >  35978 [ACK] Seq=3744395 Ack=66758155 Win=65535 Len=0
1,3.721021999999948,62.210.85.178,10.0.2.15,TCP,60,9001  >  35978 [ACK] Seq=3744395 Ack=66759615 Win=65535 Len=0
1,3.721025999999938,62.210.85.178,10.0.2.15,TCP,60,9001  >  35978 [ACK] Seq=3744395 Ack=66761075 Win=65535 Len=0
1,3.721059999999852,10.0.2.15,62.210.85.178,TLSv1.2,1204,Application Data
1,3.721123999999918,10.0.2.15,62.210.85.178,TCP,2974,35978  >  9001 [ACK] Seq=66762225 Ack=3744395 Win=65535 Len=2920 [TCP segment of a reassembled PDU]
1,3.7211589999999433,62.210.85.178,10.0.2.15,TCP,60,9001  >  35978 [ACK] Seq=3744395 Ack=66762225 Win=65535 Len=0
1,3.721166999999923,62.210.85.178,10.0.2.15,TCP,60,9001  >  35978 [ACK] Seq=3744395 Ack=66763685 Win=65535 Len=0
1,3.721172000000024,62.210.85.178,10.0.2.15,TCP,60,9001  >  35978 [ACK] Seq=3744395 Ack=66765145 Win=65535 Len=0
1,3.7212030000000595,10.0.2.15,62.210.85.178,TLSv1.2,1204,Application Data
1,3.7212959999999384,10.0.2.15,62.210.85.178,TLSv1.2,2974,Application Data
1,3.721317999999883,62.210.85.178,10.0.2.15,TCP,60,9001  >  35978 [ACK] Seq=3744395 Ack=66766295 Win=65535 Len=0
1,3.7213500000000295,10.0.2.15,62.210.85.178,TLSv1.2,1226,Application Data
1,3.721385000000055,62.210.85.178,10.0.2.15,TCP,60,9001  >  35978 [ACK] Seq=3744395 Ack=66767755 Win=65535 Len=0
1,3.7213919999999234,62.210.85.178,10.0.2.15,TCP,60,9001  >  35978 [ACK] Seq=3744395 Ack=66769215 Win=65535 Len=0
1,3.7213959999999133,62.210.85.178,10.0.2.15,TCP,60,9001  >  35978 [ACK] Seq=3744395 Ack=66770387 Win=65535 Len=0
1,3.7214420000000246,10.0.2.15,62.210.85.178,TLSv1.2,3994,Application Data
1,3.7214830000000347,62.210.85.178,10.0.2.15,TCP,60,9001  >  35978 [ACK] Seq=3744395 Ack=66771847 Win=65535 Len=0
1,3.7214899999999034,62.210.85.178,10.0.2.15,TCP,60,9001  >  35978 [ACK] Seq=3744395 Ack=66773307 Win=65535 Len=0
1,3.7214950000000044,62.210.85.178,10.0.2.15,TCP,60,9001  >  35978 [ACK] Seq=3744395 Ack=66774327 Win=65535 Len=0
1,3.784629999999879,54.93.77.70,10.0.2.15,TLSv1.2,590,Application Data
1,3.8082039999999324,54.93.77.70,10.0.2.15,TLSv1.2,3674,Application Data
1,3.8083319999998366,10.0.2.15,54.93.77.70,TCP,54,34692  >  9001 [ACK] Seq=3733615 Ack=66544215 Win=65535 Len=0
1,3.8240729999999985,54.93.77.70,10.0.2.15,TLSv1.2,7294,Application Data
1,3.8241619999998875,10.0.2.15,54.93.77.70,TCP,54,34692  >  9001 [ACK] Seq=3733615 Ack=66551455 Win=65535 Len=0
1,3.8244150000000445,54.93.77.70,10.0.2.15,TLSv1.2,568,Application Data
1,3.8415829999999005,54.93.77.70,10.0.2.15,TLSv1.2,590,Application Data
1,3.8416769999998905,10.0.2.15,54.93.77.70,TCP,54,34692  >  9001 [ACK] Seq=3733615 Ack=66552505 Win=65535 Len=0
1,3.846558999999843,54.93.77.70,10.0.2.15,TLSv1.2,5846,Application Data
1,3.8465790000000197,54.93.77.70,10.0.2.15,TLSv1.2,5846,Application Data [TCP segment of a reassembled PDU]
1,3.84667300000001,10.0.2.15,54.93.77.70,TCP,54,34692  >  9001 [ACK] Seq=3733615 Ack=66564089 Win=65535 Len=0
1,3.8573109999999815,54.93.77.70,10.0.2.15,TLSv1.2,5846,"Application Data, Application Data"
1,3.857330999999931,54.93.77.70,10.0.2.15,TLSv1.2,5846,Application Data [TCP segment of a reassembled PDU]
1,3.8573770000000422,10.0.2.15,54.93.77.70,TCP,54,34692  >  9001 [ACK] Seq=3733615 Ack=66569881 Win=65535 Len=0
1,3.8574639999999363,10.0.2.15,54.93.77.70,TCP,54,34692  >  9001 [ACK] Seq=3733615 Ack=66575673 Win=65535 Len=0
1,3.8576539999999113,10.0.2.15,54.93.77.70,TLSv1.2,590,Application Data
1,3.857764999999972,54.93.77.70,10.0.2.15,TCP,60,9001  >  34692 [ACK] Seq=66575673 Ack=3734151 Win=65535 Len=0
1,3.8579330000000027,54.93.77.70,10.0.2.15,TLSv1.2,662,Application Data
1,3.8673099999998612,10.0.2.15,54.93.77.70,TLSv1.2,590,Application Data
1,3.8674009999999726,54.93.77.70,10.0.2.15,TCP,60,9001  >  34692 [ACK] Seq=66576281 Ack=3734687 Win=65535 Len=0
1,3.86874899999998,54.93.77.70,10.0.2.15,TCP,1502,"9001  >  34692 [PSH, ACK] Seq=66576281 Ack=3734687 Win=65535 Len=1448 [TCP segment of a reassembled PDU]"
1,3.8688130000000456,10.0.2.15,54.93.77.70,TCP,54,34692  >  9001 [ACK] Seq=3734687 Ack=66577729 Win=65535 Len=0
1,3.8770489999999427,54.93.77.70,10.0.2.15,TLSv1.2,2950,Application Data [TCP segment of a reassembled PDU]
1,3.8771130000000085,10.0.2.15,54.93.77.70,TCP,54,34692  >  9001 [ACK] Seq=3734687 Ack=66580625 Win=65535 Len=0
1,3.8844480000000203,54.93.77.70,10.0.2.15,TLSv1.2,894,Application Data
1,3.926420999999891,10.0.2.15,54.93.77.70,TCP,54,34692  >  9001 [ACK] Seq=3734687 Ack=66581465 Win=65535 Len=0
1,3.993165999999974,54.93.77.70,10.0.2.15,TCP,2950,"9001  >  34692 [PSH, ACK] Seq=66581465 Ack=3734687 Win=65535 Len=2896 [TCP segment of a reassembled PDU]"
1,3.993298999999979,10.0.2.15,54.93.77.70,TCP,54,34692  >  9001 [ACK] Seq=3734687 Ack=66584361 Win=65535 Len=0
1,3.993580999999949,54.93.77.70,10.0.2.15,TLSv1.2,3370,"Application Data, Application Data"
1,3.9936239999999543,10.0.2.15,54.93.77.70,TCP,54,34692  >  9001 [ACK] Seq=3734687 Ack=66587677 Win=65535 Len=0
1,4.0123409999998785,54.93.77.70,10.0.2.15,TLSv1.2,3674,Application Data
1,4.012406999999939,10.0.2.15,54.93.77.70,TCP,54,34692  >  9001 [ACK] Seq=3734687 Ack=66591297 Win=65535 Len=0
1,4.03445099999999,62.210.85.178,10.0.2.15,TLSv1.2,590,Application Data
1,4.0646039999999175,54.93.77.70,10.0.2.15,TLSv1.2,1104,Application Data
1,4.0646979999999076,10.0.2.15,54.93.77.70,TCP,54,34692  >  9001 [ACK] Seq=3734687 Ack=66592347 Win=65535 Len=0
1,4.064865999999938,10.0.2.15,54.93.77.70,TLSv1.2,590,Application Data
1,4.064948999999842,54.93.77.70,10.0.2.15,TCP,60,9001  >  34692 [ACK] Seq=66592347 Ack=3735223 Win=65535 Len=0
1,4.074513999999908,10.0.2.15,54.93.77.70,TLSv1.2,590,Application Data
1,4.074658999999883,54.93.77.70,10.0.2.15,TCP,60,9001  >  34692 [ACK] Seq=66592347 Ack=3735759 Win=65535 Len=0
1,4.080754999999954,10.0.2.15,62.210.85.178,TCP,54,35978  >  9001 [ACK] Seq=66774327 Ack=3744931 Win=65535 Len=0
1,4.113884999999982,62.210.85.178,10.0.2.15,TLSv1.2,590,Application Data
1,4.113984999999957,10.0.2.15,62.210.85.178,TCP,54,35978  >  9001 [ACK] Seq=66774327 Ack=3745467 Win=65535 Len=0
1,4.208871000000045,62.210.85.178,10.0.2.15,TLSv1.2,1104,Application Data
1,4.20896300000004,10.0.2.15,62.210.85.178,TCP,54,35978  >  9001 [ACK] Seq=66774327 Ack=3746517 Win=65535 Len=0
1,4.209456000000046,10.0.2.15,62.210.85.178,TLSv1.2,590,Application Data
1,4.209564999999884,62.210.85.178,10.0.2.15,TCP,60,9001  >  35978 [ACK] Seq=3746517 Ack=66774863 Win=65535 Len=0
1,4.314010999999937,54.93.77.70,10.0.2.15,TLSv1.2,590,Application Data
1,4.3144700000000284,10.0.2.15,54.93.77.70,TLSv1.2,590,Application Data
1,4.3146509999999125,54.93.77.70,10.0.2.15,TCP,60,9001  >  34692 [ACK] Seq=66592883 Ack=3736295 Win=65535 Len=0
1,4.426541999999927,62.210.85.178,10.0.2.15,TLSv1.2,590,Application Data
1,4.434618,10.0.2.15,62.210.85.178,TLSv1.2,590,Application Data
1,4.434811999999965,62.210.85.178,10.0.2.15,TCP,60,9001  >  35978 [ACK] Seq=3747053 Ack=66775399 Win=65535 Len=0
1,4.447511999999961,10.0.2.15,62.210.85.178,TLSv1.2,4124,Application Data
1,4.44761799999992,10.0.2.15,62.210.85.178,TCP,2974,35978  >  9001 [ACK] Seq=66779469 Ack=3747053 Win=65535 Len=2920 [TCP segment of a reassembled PDU]
1,4.447660000000042,62.210.85.178,10.0.2.15,TCP,60,9001  >  35978 [ACK] Seq=3747053 Ack=66776859 Win=65535 Len=0
1,4.447672000000011,62.210.85.178,10.0.2.15,TCP,60,9001  >  35978 [ACK] Seq=3747053 Ack=66778319 Win=65535 Len=0
1,4.447676000000001,62.210.85.178,10.0.2.15,TCP,60,9001  >  35978 [ACK] Seq=3747053 Ack=66779469 Win=65535 Len=0
1,4.447677999999996,62.210.85.178,10.0.2.15,TCP,60,9001  >  35978 [ACK] Seq=3747053 Ack=66780929 Win=65535 Len=0
1,4.447680999999875,62.210.85.178,10.0.2.15,TCP,60,9001  >  35978 [ACK] Seq=3747053 Ack=66782389 Win=65535 Len=0
1,4.447722999999996,10.0.2.15,62.210.85.178,TLSv1.2,1204,Application Data
1,4.447758999999905,62.210.85.178,10.0.2.15,TCP,60,9001  >  35978 [ACK] Seq=3747053 Ack=66783539 Win=65535 Len=0
1,4.447803000000022,10.0.2.15,62.210.85.178,TLSv1.2,4124,Application Data
1,4.447836999999936,62.210.85.178,10.0.2.15,TCP,60,9001  >  35978 [ACK] Seq=3747053 Ack=66784999 Win=65535 Len=0
1,4.447844999999916,62.210.85.178,10.0.2.15,TCP,60,9001  >  35978 [ACK] Seq=3747053 Ack=66786459 Win=65535 Len=0
1,4.447848999999906,62.210.85.178,10.0.2.15,TCP,60,9001  >  35978 [ACK] Seq=3747053 Ack=66787609 Win=65535 Len=0
1,4.447887000000037,10.0.2.15,62.210.85.178,TLSv1.2,4124,Application Data
1,4.447920999999951,62.210.85.178,10.0.2.15,TCP,60,9001  >  35978 [ACK] Seq=3747053 Ack=66789069 Win=65535 Len=0
1,4.447928999999931,62.210.85.178,10.0.2.15,TCP,60,9001  >  35978 [ACK] Seq=3747053 Ack=66790529 Win=65535 Len=0
1,4.447983999999906,10.0.2.15,62.210.85.178,TLSv1.2,2974,Application Data
1,4.448020999999926,62.210.85.178,10.0.2.15,TCP,60,9001  >  35978 [ACK] Seq=3747053 Ack=66791679 Win=65535 Len=0
1,4.448028000000022,62.210.85.178,10.0.2.15,TCP,60,9001  >  35978 [ACK] Seq=3747053 Ack=66793139 Win=65535 Len=0
1,4.448030999999901,62.210.85.178,10.0.2.15,TCP,60,9001  >  35978 [ACK] Seq=3747053 Ack=66794599 Win=65535 Len=0
1,4.448057999999946,10.0.2.15,62.210.85.178,TLSv1.2,1226,Application Data
1,4.4480899999998655,62.210.85.178,10.0.2.15,TCP,60,9001  >  35978 [ACK] Seq=3747053 Ack=66795771 Win=65535 Len=0
1,4.448128999999881,10.0.2.15,62.210.85.178,TLSv1.2,4124,Application Data
1,4.448163999999906,62.210.85.178,10.0.2.15,TCP,60,9001  >  35978 [ACK] Seq=3747053 Ack=66797231 Win=65535 Len=0
1,4.448169999999891,62.210.85.178,10.0.2.15,TCP,60,9001  >  35978 [ACK] Seq=3747053 Ack=66798691 Win=65535 Len=0
1,4.448172999999997,62.210.85.178,10.0.2.15,TCP,60,9001  >  35978 [ACK] Seq=3747053 Ack=66799841 Win=65535 Len=0
1,4.448210000000017,10.0.2.15,62.210.85.178,TLSv1.2,3030,Application Data
1,4.448245000000043,62.210.85.178,10.0.2.15,TCP,60,9001  >  35978 [ACK] Seq=3747053 Ack=66801301 Win=65535 Len=0
1,4.448251999999911,62.210.85.178,10.0.2.15,TCP,60,9001  >  35978 [ACK] Seq=3747053 Ack=66802761 Win=65535 Len=0
1,4.448255000000017,62.210.85.178,10.0.2.15,TCP,60,9001  >  35978 [ACK] Seq=3747053 Ack=66802817 Win=65535 Len=0
1,4.457478000000037,10.0.2.15,62.210.85.178,TLSv1.2,4124,Application Data
1,4.457580000000007,10.0.2.15,62.210.85.178,TCP,2974,35978  >  9001 [ACK] Seq=66806887 Ack=3747053 Win=65535 Len=2920 [TCP segment of a reassembled PDU]
1,4.457621999999901,62.210.85.178,10.0.2.15,TCP,60,9001  >  35978 [ACK] Seq=3747053 Ack=66804277 Win=65535 Len=0
1,4.457631999999876,62.210.85.178,10.0.2.15,TCP,60,9001  >  35978 [ACK] Seq=3747053 Ack=66805737 Win=65535 Len=0
1,4.457636999999977,62.210.85.178,10.0.2.15,TCP,60,9001  >  35978 [ACK] Seq=3747053 Ack=66806887 Win=65535 Len=0
1,4.457641999999851,62.210.85.178,10.0.2.15,TCP,60,9001  >  35978 [ACK] Seq=3747053 Ack=66808347 Win=65535 Len=0
1,4.457645999999841,62.210.85.178,10.0.2.15,TCP,60,9001  >  35978 [ACK] Seq=3747053 Ack=66809807 Win=65535 Len=0
1,4.457688999999846,10.0.2.15,62.210.85.178,TLSv1.2,1204,Application Data
1,4.457758999999896,10.0.2.15,62.210.85.178,TCP,2974,35978  >  9001 [ACK] Seq=66810957 Ack=3747053 Win=65535 Len=2920 [TCP segment of a reassembled PDU]
1,4.457795999999917,62.210.85.178,10.0.2.15,TCP,60,9001  >  35978 [ACK] Seq=3747053 Ack=66810957 Win=65535 Len=0
1,4.457803000000013,62.210.85.178,10.0.2.15,TCP,60,9001  >  35978 [ACK] Seq=3747053 Ack=66812417 Win=65535 Len=0
1,4.4578070000000025,62.210.85.178,10.0.2.15,TCP,60,9001  >  35978 [ACK] Seq=3747053 Ack=66813877 Win=65535 Len=0
1,4.457842000000028,10.0.2.15,62.210.85.178,TLSv1.2,1204,Application Data
1,4.457906999999977,10.0.2.15,62.210.85.178,TCP,2974,35978  >  9001 [ACK] Seq=66815027 Ack=3747053 Win=65535 Len=2920 [TCP segment of a reassembled PDU]
1,4.457943999999998,62.210.85.178,10.0.2.15,TCP,60,9001  >  35978 [ACK] Seq=3747053 Ack=66815027 Win=65535 Len=0
1,4.457950999999866,62.210.85.178,10.0.2.15,TCP,60,9001  >  35978 [ACK] Seq=3747053 Ack=66816487 Win=65535 Len=0
1,4.457954999999856,62.210.85.178,10.0.2.15,TCP,60,9001  >  35978 [ACK] Seq=3747053 Ack=66817947 Win=65535 Len=0
1,4.457987000000003,10.0.2.15,62.210.85.178,TLSv1.2,1204,Application Data
1,4.458077000000003,62.210.85.178,10.0.2.15,TCP,60,9001  >  35978 [ACK] Seq=3747053 Ack=66819097 Win=65535 Len=0
1,4.458110000000033,10.0.2.15,62.210.85.178,TLSv1.2,2974,Application Data
1,4.458161000000018,10.0.2.15,62.210.85.178,TLSv1.2,1226,Application Data
1,4.458194999999932,62.210.85.178,10.0.2.15,TCP,60,9001  >  35978 [ACK] Seq=3747053 Ack=66820557 Win=65535 Len=0
1,4.458202000000028,62.210.85.178,10.0.2.15,TCP,60,9001  >  35978 [ACK] Seq=3747053 Ack=66822017 Win=65535 Len=0
1,4.458206000000018,62.210.85.178,10.0.2.15,TCP,60,9001  >  35978 [ACK] Seq=3747053 Ack=66823189 Win=65535 Len=0
1,4.458251000000018,10.0.2.15,62.210.85.178,TLSv1.2,4124,Application Data
1,4.458296999999902,62.210.85.178,10.0.2.15,TCP,60,9001  >  35978 [ACK] Seq=3747053 Ack=66824649 Win=65535 Len=0
1,4.458303999999998,62.210.85.178,10.0.2.15,TCP,60,9001  >  35978 [ACK] Seq=3747053 Ack=66826109 Win=65535 Len=0
1,4.458308999999872,62.210.85.178,10.0.2.15,TCP,60,9001  >  35978 [ACK] Seq=3747053 Ack=66827259 Win=65535 Len=0
1,4.458354999999983,10.0.2.15,62.210.85.178,TLSv1.2,3030,Application Data
1,4.458413999999948,62.210.85.178,10.0.2.15,TCP,60,9001  >  35978 [ACK] Seq=3747053 Ack=66828719 Win=65535 Len=0
1,4.458427999999913,62.210.85.178,10.0.2.15,TCP,60,9001  >  35978 [ACK] Seq=3747053 Ack=66830179 Win=65535 Len=0
1,4.458433000000014,62.210.85.178,10.0.2.15,TCP,60,9001  >  35978 [ACK] Seq=3747053 Ack=66830235 Win=65535 Len=0
1,4.470838999999842,10.0.2.15,62.210.85.178,TLSv1.2,1104,Application Data
1,4.470949000000019,62.210.85.178,10.0.2.15,TCP,60,9001  >  35978 [ACK] Seq=3747053 Ack=66831285 Win=65535 Len=0
1,4.592705000000024,54.93.77.70,10.0.2.15,TLSv1.2,590,Application Data
1,4.6110409999998865,54.93.77.70,10.0.2.15,TLSv1.2,4724,"Application Data, Application Data"
1,4.611147999999957,10.0.2.15,54.93.77.70,TCP,54,34692  >  9001 [ACK] Seq=3736295 Ack=66598089 Win=65535 Len=0
1,4.620231999999987,54.93.77.70,10.0.2.15,TLSv1.2,5846,Application Data
1,4.620278999999982,10.0.2.15,54.93.77.70,TCP,54,34692  >  9001 [ACK] Seq=3736295 Ack=66603881 Win=65535 Len=0
1,4.627570999999989,54.93.77.70,10.0.2.15,TLSv1.2,988,Application Data
1,4.641933999999992,54.93.77.70,10.0.2.15,TLSv1.2,7294,Application Data
1,4.642116999999871,10.0.2.15,54.93.77.70,TCP,54,34692  >  9001 [ACK] Seq=3736295 Ack=66612055 Win=65535 Len=0
1,4.642569999999978,54.93.77.70,10.0.2.15,TLSv1.2,2950,Application Data [TCP segment of a reassembled PDU]
1,4.642646000000013,10.0.2.15,54.93.77.70,TCP,54,34692  >  9001 [ACK] Seq=3736295 Ack=66614951 Win=65535 Len=0
1,4.645530000000008,54.93.77.70,10.0.2.15,TLSv1.2,778,Application Data
1,4.645682999999963,10.0.2.15,54.93.77.70,TLSv1.2,590,Application Data
1,4.645784000000049,54.93.77.70,10.0.2.15,TCP,60,9001  >  34692 [ACK] Seq=66615675 Ack=3736831 Win=65535 Len=0
1,4.651542999999947,54.93.77.70,10.0.2.15,TLSv1.2,5846,Application Data
1,4.651618999999982,10.0.2.15,54.93.77.70,TCP,54,34692  >  9001 [ACK] Seq=3736831 Ack=66621467 Win=65535 Len=0
1,4.652065999999877,54.93.77.70,10.0.2.15,TLSv1.2,5846,Application Data [TCP segment of a reassembled PDU]
1,4.652106999999887,10.0.2.15,54.93.77.70,TCP,54,34692  >  9001 [ACK] Seq=3736831 Ack=66627259 Win=65535 Len=0
1,4.656436999999869,10.0.2.15,54.93.77.70,TLSv1.2,590,Application Data
1,4.656561000000011,54.93.77.70,10.0.2.15,TCP,60,9001  >  34692 [ACK] Seq=66627259 Ack=3737367 Win=65535 Len=0
1,4.661153000000013,54.93.77.70,10.0.2.15,TLSv1.2,358,Application Data
1,4.674135999999862,54.93.77.70,10.0.2.15,TLSv1.2,5846,Application Data
1,4.674175999999989,54.93.77.70,10.0.2.15,TLSv1.2,4398,Application Data [TCP segment of a reassembled PDU]
1,4.674277999999958,10.0.2.15,54.93.77.70,TCP,54,34692  >  9001 [ACK] Seq=3737367 Ack=66637699 Win=65535 Len=0
1,4.6870890000000145,54.93.77.70,10.0.2.15,TLSv1.2,5846,"Application Data, Application Data"
1,4.6871380000000045,54.93.77.70,10.0.2.15,TLSv1.2,5846,"Application Data, Application Data"
1,4.687200999999959,10.0.2.15,54.93.77.70,TCP,54,34692  >  9001 [ACK] Seq=3737367 Ack=66643491 Win=65535 Len=0
1,4.6873189999998885,10.0.2.15,54.93.77.70,TCP,54,34692  >  9001 [ACK] Seq=3737367 Ack=66649283 Win=65535 Len=0
1,4.687754000000041,10.0.2.15,54.93.77.70,TLSv1.2,590,Application Data
1,4.68789199999992,54.93.77.70,10.0.2.15,TCP,60,9001  >  34692 [ACK] Seq=66649283 Ack=3737903 Win=65535 Len=0
1,4.703395,10.0.2.15,54.93.77.70,TLSv1.2,590,Application Data
1,4.703655000000026,54.93.77.70,10.0.2.15,TCP,60,9001  >  34692 [ACK] Seq=66649283 Ack=3738439 Win=65535 Len=0
1,4.769696999999951,62.210.85.178,10.0.2.15,TLSv1.2,590,Application Data
1,4.81044699999984,10.0.2.15,62.210.85.178,TCP,54,35978  >  9001 [ACK] Seq=66831285 Ack=3747589 Win=65535 Len=0
1,4.853282999999919,62.210.85.178,10.0.2.15,TLSv1.2,1618,Application Data
1,4.85334499999999,10.0.2.15,62.210.85.178,TCP,54,35978  >  9001 [ACK] Seq=66831285 Ack=3749153 Win=65535 Len=0
1,4.8538200000000415,10.0.2.15,62.210.85.178,TLSv1.2,590,Application Data
1,4.85392499999989,62.210.85.178,10.0.2.15,TCP,60,9001  >  35978 [ACK] Seq=3749153 Ack=66831821 Win=65535 Len=0
1,5.042703999999958,54.93.77.70,10.0.2.15,TLSv1.2,590,Application Data
1,5.043087000000014,10.0.2.15,54.93.77.70,TLSv1.2,590,Application Data
1,5.043198999999959,54.93.77.70,10.0.2.15,TCP,60,9001  >  34692 [ACK] Seq=66649819 Ack=3738975 Win=65535 Len=0
1,5.175596999999925,62.210.85.178,10.0.2.15,TLSv1.2,590,Application Data
1,5.18125699999996,10.0.2.15,62.210.85.178,TLSv1.2,590,Application Data
1,5.18147399999998,62.210.85.178,10.0.2.15,TCP,60,9001  >  35978 [ACK] Seq=3749689 Ack=66832357 Win=65535 Len=0
1,5.191728000000012,10.0.2.15,62.210.85.178,TLSv1.2,4124,Application Data
1,5.191855000000032,10.0.2.15,62.210.85.178,TCP,2974,35978  >  9001 [ACK] Seq=66836427 Ack=3749689 Win=65535 Len=2920 [TCP segment of a reassembled PDU]
1,5.191900000000032,62.210.85.178,10.0.2.15,TCP,60,9001  >  35978 [ACK] Seq=3749689 Ack=66833817 Win=65535 Len=0
1,5.191910999999891,62.210.85.178,10.0.2.15,TCP,60,9001  >  35978 [ACK] Seq=3749689 Ack=66835277 Win=65535 Len=0
1,5.191915999999992,62.210.85.178,10.0.2.15,TCP,60,9001  >  35978 [ACK] Seq=3749689 Ack=66836427 Win=65535 Len=0
1,5.191919999999982,62.210.85.178,10.0.2.15,TCP,60,9001  >  35978 [ACK] Seq=3749689 Ack=66837887 Win=65535 Len=0
1,5.191924999999856,62.210.85.178,10.0.2.15,TCP,60,9001  >  35978 [ACK] Seq=3749689 Ack=66839347 Win=65535 Len=0
1,5.192007999999987,10.0.2.15,62.210.85.178,TLSv1.2,1204,Application Data
1,5.192106999999851,62.210.85.178,10.0.2.15,TCP,60,9001  >  35978 [ACK] Seq=3749689 Ack=66840497 Win=65535 Len=0
1,5.192153999999846,10.0.2.15,62.210.85.178,TLSv1.2,204,Application Data
1,5.192248999999947,62.210.85.178,10.0.2.15,TCP,60,9001  >  35978 [ACK] Seq=3749689 Ack=66840647 Win=65535 Len=0
1,5.284433999999919,54.93.77.70,10.0.2.15,TLSv1.2,590,Application Data
1,5.305147000000034,54.93.77.70,10.0.2.15,TCP,2950,"9001  >  34692 [PSH, ACK] Seq=66650355 Ack=3738975 Win=65535 Len=2896 [TCP segment of a reassembled PDU]"
1,5.305278000000044,10.0.2.15,54.93.77.70,TCP,54,34692  >  9001 [ACK] Seq=3738975 Ack=66653251 Win=65535 Len=0
1,5.319970000000012,54.93.77.70,10.0.2.15,TLSv1.2,4398,"Application Data, Application Data"
1,5.320112999999992,10.0.2.15,54.93.77.70,TCP,54,34692  >  9001 [ACK] Seq=3738975 Ack=66657595 Win=65535 Len=0
1,5.4344079999998485,54.93.77.70,10.0.2.15,TLSv1.2,1104,Application Data
1,5.437294999999949,10.0.2.15,54.93.77.70,TLSv1.2,590,Application Data
1,5.43750399999999,54.93.77.70,10.0.2.15,TCP,60,9001  >  34692 [ACK] Seq=66658645 Ack=3739511 Win=65535 Len=0
1,5.638948999999911,62.210.85.178,10.0.2.15,TLSv1.2,590,Application Data
1,5.639265000000023,10.0.2.15,62.210.85.178,TLSv1.2,590,Application Data
1,5.639374999999973,62.210.85.178,10.0.2.15,TCP,60,9001  >  35978 [ACK] Seq=3750225 Ack=66841183 Win=65535 Len=0
1,5.732086999999865,54.93.77.70,10.0.2.15,TLSv1.2,590,Application Data
1,5.732522000000017,10.0.2.15,54.93.77.70,TLSv1.2,590,Application Data
1,5.732675999999856,54.93.77.70,10.0.2.15,TCP,60,9001  >  34692 [ACK] Seq=66659181 Ack=3740047 Win=65535 Len=0
1,5.830768999999918,62.210.85.178,10.0.2.15,TLSv1.2,590,Application Data
1,5.83480899999995,10.0.2.15,62.210.85.178,TLSv1.2,590,Application Data
1,5.83502099999987,62.210.85.178,10.0.2.15,TCP,60,9001  >  35978 [ACK] Seq=3750761 Ack=66841719 Win=65535 Len=0
1,5.84684900000002,10.0.2.15,62.210.85.178,TLSv1.2,4124,Application Data
1,5.846957999999859,10.0.2.15,62.210.85.178,TCP,2974,35978  >  9001 [ACK] Seq=66845789 Ack=3750761 Win=65535 Len=2920 [TCP segment of a reassembled PDU]
1,5.847001999999975,62.210.85.178,10.0.2.15,TCP,60,9001  >  35978 [ACK] Seq=3750761 Ack=66843179 Win=65535 Len=0
1,5.847013000000061,62.210.85.178,10.0.2.15,TCP,60,9001  >  35978 [ACK] Seq=3750761 Ack=66844639 Win=65535 Len=0
1,5.8470179999999345,62.210.85.178,10.0.2.15,TCP,60,9001  >  35978 [ACK] Seq=3750761 Ack=66845789 Win=65535 Len=0
1,5.8470219999999244,62.210.85.178,10.0.2.15,TCP,60,9001  >  35978 [ACK] Seq=3750761 Ack=66847249 Win=65535 Len=0
1,5.8470270000000255,62.210.85.178,10.0.2.15,TCP,60,9001  >  35978 [ACK] Seq=3750761 Ack=66848709 Win=65535 Len=0
1,5.847070000000031,10.0.2.15,62.210.85.178,TLSv1.2,1204,Application Data
1,5.847166999999899,62.210.85.178,10.0.2.15,TCP,60,9001  >  35978 [ACK] Seq=3750761 Ack=66849859 Win=65535 Len=0
1,5.8472170000000006,10.0.2.15,62.210.85.178,TLSv1.2,204,Application Data
1,5.847319999999854,62.210.85.178,10.0.2.15,TCP,60,9001  >  35978 [ACK] Seq=3750761 Ack=66850009 Win=65535 Len=0
1,5.960516999999982,54.93.77.70,10.0.2.15,TLSv1.2,3674,Application Data
1,5.960669999999936,10.0.2.15,54.93.77.70,TCP,54,34692  >  9001 [ACK] Seq=3740047 Ack=66662801 Win=65535 Len=0
1,5.970646999999872,54.93.77.70,10.0.2.15,TCP,2950,"9001  >  34692 [PSH, ACK] Seq=66662801 Ack=3740047 Win=65535 Len=2896 [TCP segment of a reassembled PDU]"
1,5.970708000000059,10.0.2.15,54.93.77.70,TCP,54,34692  >  9001 [ACK] Seq=3740047 Ack=66665697 Win=65535 Len=0
1,5.978890999999976,54.93.77.70,10.0.2.15,TLSv1.2,778,Application Data
1,5.980501000000004,54.93.77.70,10.0.2.15,TCP,1502,"9001  >  34692 [PSH, ACK] Seq=66666421 Ack=3740047 Win=65535 Len=1448 [TCP segment of a reassembled PDU]"
1,5.980560999999852,10.0.2.15,54.93.77.70,TCP,54,34692  >  9001 [ACK] Seq=3740047 Ack=66667869 Win=65535 Len=0
1,5.997194000000036,54.93.77.70,10.0.2.15,TLSv1.2,170,Application Data
1,5.9974489999999605,10.0.2.15,54.93.77.70,TLSv1.2,590,Application Data
1,5.9975469999999405,54.93.77.70,10.0.2.15,TCP,60,9001  >  34692 [ACK] Seq=66667985 Ack=3740583 Win=65535 Len=0
1,6.007812000000058,10.0.2.15,54.93.77.70,TLSv1.2,590,Application Data
1,6.007949000000053,54.93.77.70,10.0.2.15,TCP,60,9001  >  34692 [ACK] Seq=66667985 Ack=3741119 Win=65535 Len=0
1,6.10651299999995,62.210.85.178,10.0.2.15,TLSv1.2,590,Application Data
1,6.150419000000056,10.0.2.15,62.210.85.178,TCP,54,35978  >  9001 [ACK] Seq=66850009 Ack=3751297 Win=65535 Len=0
1,6.230972999999949,62.210.85.178,10.0.2.15,TLSv1.2,590,Application Data
1,6.23104699999999,10.0.2.15,62.210.85.178,TCP,54,35978  >  9001 [ACK] Seq=66850009 Ack=3751833 Win=65535 Len=0
1,6.2313389999999345,10.0.2.15,62.210.85.178,TLSv1.2,590,Application Data
1,6.231436000000031,62.210.85.178,10.0.2.15,TCP,60,9001  >  35978 [ACK] Seq=3751833 Ack=66850545 Win=65535 Len=0
1,6.34733099999994,54.93.77.70,10.0.2.15,TLSv1.2,590,Application Data
1,6.347713999999996,10.0.2.15,54.93.77.70,TLSv1.2,590,Application Data
1,6.347825000000057,54.93.77.70,10.0.2.15,TCP,60,9001  >  34692 [ACK] Seq=66668521 Ack=3741655 Win=65535 Len=0
1,6.414377000000059,PcsCompu_bb:14:75,RealtekU_12:35:03,ARP,42,Who has 10.0.2.3? Tell 10.0.2.15
1,6.414479999999912,RealtekU_12:35:03,PcsCompu_bb:14:75,ARP,60,10.0.2.3 is at 52:54:00:12:35:03
1,6.44818999999984,62.210.85.178,10.0.2.15,TLSv1.2,590,Application Data
1,6.453980999999885,10.0.2.15,62.210.85.178,TLSv1.2,590,Application Data
1,6.454169999999976,62.210.85.178,10.0.2.15,TCP,60,9001  >  35978 [ACK] Seq=3752369 Ack=66851081 Win=65535 Len=0
1,6.464328999999907,10.0.2.15,62.210.85.178,TLSv1.2,4124,Application Data
1,6.464420999999902,10.0.2.15,62.210.85.178,TCP,2974,35978  >  9001 [ACK] Seq=66855151 Ack=3752369 Win=65535 Len=2920 [TCP segment of a reassembled PDU]
1,6.464465000000018,62.210.85.178,10.0.2.15,TCP,60,9001  >  35978 [ACK] Seq=3752369 Ack=66852541 Win=65535 Len=0
1,6.464476999999988,62.210.85.178,10.0.2.15,TCP,60,9001  >  35978 [ACK] Seq=3752369 Ack=66854001 Win=65535 Len=0
1,6.464481999999862,62.210.85.178,10.0.2.15,TCP,60,9001  >  35978 [ACK] Seq=3752369 Ack=66855151 Win=65535 Len=0
1,6.464484999999968,62.210.85.178,10.0.2.15,TCP,60,9001  >  35978 [ACK] Seq=3752369 Ack=66856611 Win=65535 Len=0
1,6.464487999999847,62.210.85.178,10.0.2.15,TCP,60,9001  >  35978 [ACK] Seq=3752369 Ack=66858071 Win=65535 Len=0
1,6.464549000000034,10.0.2.15,62.210.85.178,TLSv1.2,1204,Application Data
1,6.464598000000024,62.210.85.178,10.0.2.15,TCP,60,9001  >  35978 [ACK] Seq=3752369 Ack=66859221 Win=65535 Len=0
1,6.464654999999993,10.0.2.15,62.210.85.178,TLSv1.2,4124,Application Data
1,6.464698999999882,62.210.85.178,10.0.2.15,TCP,60,9001  >  35978 [ACK] Seq=3752369 Ack=66860681 Win=65535 Len=0
1,6.464705999999978,62.210.85.178,10.0.2.15,TCP,60,9001  >  35978 [ACK] Seq=3752369 Ack=66862141 Win=65535 Len=0
1,6.464709999999968,62.210.85.178,10.0.2.15,TCP,60,9001  >  35978 [ACK] Seq=3752369 Ack=66863291 Win=65535 Len=0
1,6.464747999999872,10.0.2.15,62.210.85.178,TLSv1.2,4124,Application Data
1,6.464782000000014,62.210.85.178,10.0.2.15,TCP,60,9001  >  35978 [ACK] Seq=3752369 Ack=66864751 Win=65535 Len=0
1,6.464788999999882,62.210.85.178,10.0.2.15,TCP,60,9001  >  35978 [ACK] Seq=3752369 Ack=66866211 Win=65535 Len=0
1,6.464846999999963,10.0.2.15,62.210.85.178,TLSv1.2,2974,Application Data
1,6.4648829999998725,62.210.85.178,10.0.2.15,TCP,60,9001  >  35978 [ACK] Seq=3752369 Ack=66867361 Win=65535 Len=0
1,6.4648899999999685,62.210.85.178,10.0.2.15,TCP,60,9001  >  35978 [ACK] Seq=3752369 Ack=66868821 Win=65535 Len=0
1,6.464894999999842,62.210.85.178,10.0.2.15,TCP,60,9001  >  35978 [ACK] Seq=3752369 Ack=66870281 Win=65535 Len=0
1,6.464921999999888,10.0.2.15,62.210.85.178,TLSv1.2,1226,Application Data
1,6.464954999999918,62.210.85.178,10.0.2.15,TCP,60,9001  >  35978 [ACK] Seq=3752369 Ack=66871453 Win=65535 Len=0
1,6.464993999999933,10.0.2.15,62.210.85.178,TLSv1.2,4124,Application Data
1,6.465028999999959,62.210.85.178,10.0.2.15,TCP,60,9001  >  35978 [ACK] Seq=3752369 Ack=66872913 Win=65535 Len=0
1,6.4650349999999435,62.210.85.178,10.0.2.15,TCP,60,9001  >  35978 [ACK] Seq=3752369 Ack=66874373 Win=65535 Len=0
1,6.46503800000005,62.210.85.178,10.0.2.15,TCP,60,9001  >  35978 [ACK] Seq=3752369 Ack=66875523 Win=65535 Len=0
1,6.4650749999998425,10.0.2.15,62.210.85.178,TLSv1.2,3030,Application Data
1,6.465108999999984,62.210.85.178,10.0.2.15,TCP,60,9001  >  35978 [ACK] Seq=3752369 Ack=66876983 Win=65535 Len=0
1,6.465114999999969,62.210.85.178,10.0.2.15,TCP,60,9001  >  35978 [ACK] Seq=3752369 Ack=66878443 Win=65535 Len=0
1,6.465117999999848,62.210.85.178,10.0.2.15,TCP,60,9001  >  35978 [ACK] Seq=3752369 Ack=66878499 Win=65535 Len=0
1,6.474778999999899,10.0.2.15,62.210.85.178,TLSv1.2,4124,Application Data
1,6.474950999999919,62.210.85.178,10.0.2.15,TCP,60,9001  >  35978 [ACK] Seq=3752369 Ack=66879959 Win=65535 Len=0
1,6.474965999999995,62.210.85.178,10.0.2.15,TCP,60,9001  >  35978 [ACK] Seq=3752369 Ack=66881419 Win=65535 Len=0
1,6.474969999999985,62.210.85.178,10.0.2.15,TCP,60,9001  >  35978 [ACK] Seq=3752369 Ack=66882569 Win=65535 Len=0
1,6.474995999999919,10.0.2.15,62.210.85.178,TCP,2974,35978  >  9001 [ACK] Seq=66882569 Ack=3752369 Win=65535 Len=2920 [TCP segment of a reassembled PDU]
1,6.47504200000003,62.210.85.178,10.0.2.15,TCP,60,9001  >  35978 [ACK] Seq=3752369 Ack=66884029 Win=65535 Len=0
1,6.475048000000015,62.210.85.178,10.0.2.15,TCP,60,9001  >  35978 [ACK] Seq=3752369 Ack=66885489 Win=65535 Len=0
1,6.475083999999924,10.0.2.15,62.210.85.178,TLSv1.2,1204,Application Data
1,6.47512299999994,62.210.85.178,10.0.2.15,TCP,60,9001  >  35978 [ACK] Seq=3752369 Ack=66886639 Win=65535 Len=0
1,6.475169999999935,10.0.2.15,62.210.85.178,TLSv1.2,4124,Application Data
1,6.475207999999839,62.210.85.178,10.0.2.15,TCP,60,9001  >  35978 [ACK] Seq=3752369 Ack=66888099 Win=65535 Len=0
1,6.475214999999935,62.210.85.178,10.0.2.15,TCP,60,9001  >  35978 [ACK] Seq=3752369 Ack=66889559 Win=65535 Len=0
1,6.475218999999925,62.210.85.178,10.0.2.15,TCP,60,9001  >  35978 [ACK] Seq=3752369 Ack=66890709 Win=65535 Len=0
1,6.475263000000041,10.0.2.15,62.210.85.178,TLSv1.2,4124,Application Data
1,6.4753240000000005,62.210.85.178,10.0.2.15,TCP,60,9001  >  35978 [ACK] Seq=3752369 Ack=66892169 Win=65535 Len=0
1,6.475329999999985,62.210.85.178,10.0.2.15,TCP,60,9001  >  35978 [ACK] Seq=3752369 Ack=66893629 Win=65535 Len=0
1,6.475333999999975,62.210.85.178,10.0.2.15,TCP,60,9001  >  35978 [ACK] Seq=3752369 Ack=66894779 Win=65535 Len=0
1,6.4753729999999905,10.0.2.15,62.210.85.178,TLSv1.2,332,Application Data
1,6.4754089999999,62.210.85.178,10.0.2.15,TCP,60,9001  >  35978 [ACK] Seq=3752369 Ack=66895057 Win=65535 Len=0
1,6.475472999999965,10.0.2.15,62.210.85.178,TLSv1.2,3868,Application Data
1,6.4755109999998695,62.210.85.178,10.0.2.15,TCP,60,9001  >  35978 [ACK] Seq=3752369 Ack=66896517 Win=65535 Len=0
1,6.475516999999854,62.210.85.178,10.0.2.15,TCP,60,9001  >  35978 [ACK] Seq=3752369 Ack=66897977 Win=65535 Len=0
1,6.475520999999844,62.210.85.178,10.0.2.15,TCP,60,9001  >  35978 [ACK] Seq=3752369 Ack=66898871 Win=65535 Len=0
1,6.4755649999999605,10.0.2.15,62.210.85.178,TLSv1.2,4124,Application Data
1,6.475627999999915,62.210.85.178,10.0.2.15,TCP,60,9001  >  35978 [ACK] Seq=3752369 Ack=66900331 Win=65535 Len=0
1,6.4756339999999,62.210.85.178,10.0.2.15,TCP,60,9001  >  35978 [ACK] Seq=3752369 Ack=66901791 Win=65535 Len=0
1,6.47563799999989,62.210.85.178,10.0.2.15,TCP,60,9001  >  35978 [ACK] Seq=3752369 Ack=66902941 Win=65535 Len=0
1,6.475692999999865,10.0.2.15,62.210.85.178,TLSv1.2,3030,Application Data
1,6.475758000000042,62.210.85.178,10.0.2.15,TCP,60,9001  >  35978 [ACK] Seq=3752369 Ack=66904401 Win=65535 Len=0
1,6.47576499999991,62.210.85.178,10.0.2.15,TCP,60,9001  >  35978 [ACK] Seq=3752369 Ack=66905861 Win=65535 Len=0
1,6.4757689999999,62.210.85.178,10.0.2.15,TCP,60,9001  >  35978 [ACK] Seq=3752369 Ack=66905917 Win=65535 Len=0
1,6.485096999999996,10.0.2.15,62.210.85.178,TLSv1.2,4124,Application Data
1,6.48524499999985,62.210.85.178,10.0.2.15,TCP,60,9001  >  35978 [ACK] Seq=3752369 Ack=66907377 Win=65535 Len=0
1,6.485267000000022,62.210.85.178,10.0.2.15,TCP,60,9001  >  35978 [ACK] Seq=3752369 Ack=66908837 Win=65535 Len=0
1,6.485271999999895,62.210.85.178,10.0.2.15,TCP,60,9001  >  35978 [ACK] Seq=3752369 Ack=66909987 Win=65535 Len=0
1,6.485357000000022,10.0.2.15,62.210.85.178,TLSv1.2,4124,Application Data
1,6.485447999999906,62.210.85.178,10.0.2.15,TCP,60,9001  >  35978 [ACK] Seq=3752369 Ack=66911447 Win=65535 Len=0
1,6.485456999999997,62.210.85.178,10.0.2.15,TCP,60,9001  >  35978 [ACK] Seq=3752369 Ack=66912907 Win=65535 Len=0
1,6.48546199999987,62.210.85.178,10.0.2.15,TCP,60,9001  >  35978 [ACK] Seq=3752369 Ack=66914057 Win=65535 Len=0
1,6.485496000000012,10.0.2.15,62.210.85.178,TCP,2974,35978  >  9001 [ACK] Seq=66914057 Ack=3752369 Win=65535 Len=2920 [TCP segment of a reassembled PDU]
1,6.485557999999855,62.210.85.178,10.0.2.15,TCP,60,9001  >  35978 [ACK] Seq=3752369 Ack=66915517 Win=65535 Len=0
1,6.485564999999951,62.210.85.178,10.0.2.15,TCP,60,9001  >  35978 [ACK] Seq=3752369 Ack=66916977 Win=65535 Len=0
1,6.4856009999998605,10.0.2.15,62.210.85.178,TLSv1.2,368,Application Data
1,6.485637999999881,62.210.85.178,10.0.2.15,TCP,60,9001  >  35978 [ACK] Seq=3752369 Ack=66917291 Win=65535 Len=0
1,6.566331999999875,54.93.77.70,10.0.2.15,TLSv1.2,590,Application Data
1,6.57549999999992,54.93.77.70,10.0.2.15,TLSv1.2,4398,Application Data
1,6.57558199999994,10.0.2.15,54.93.77.70,TCP,54,34692  >  9001 [ACK] Seq=3741655 Ack=66673401 Win=65535 Len=0
1,6.576360000000022,54.93.77.70,10.0.2.15,TCP,2950,"9001  >  34692 [PSH, ACK] Seq=66673401 Ack=3741655 Win=65535 Len=2896 [TCP segment of a reassembled PDU]"
1,6.576407999999901,10.0.2.15,54.93.77.70,TCP,54,34692  >  9001 [ACK] Seq=3741655 Ack=66676297 Win=65535 Len=0
1,6.592128999999886,54.93.77.70,10.0.2.15,TLSv1.2,568,Application Data
1,6.596231999999873,54.93.77.70,10.0.2.15,TLSv1.2,7294,Application Data
1,6.596332999999959,10.0.2.15,54.93.77.70,TCP,54,34692  >  9001 [ACK] Seq=3741655 Ack=66684051 Win=65535 Len=0
1,6.606505999999854,54.93.77.70,10.0.2.15,TLSv1.2,2950,Application Data [TCP segment of a reassembled PDU]
1,6.606550999999854,10.0.2.15,54.93.77.70,TCP,54,34692  >  9001 [ACK] Seq=3741655 Ack=66686947 Win=65535 Len=0
1,6.607344999999896,54.93.77.70,10.0.2.15,TLSv1.2,2950,Application Data [TCP segment of a reassembled PDU]
1,6.607387999999901,10.0.2.15,54.93.77.70,TCP,54,34692  >  9001 [ACK] Seq=3741655 Ack=66689843 Win=65535 Len=0
1,6.607573999999886,54.93.77.70,10.0.2.15,TCP,1502,"9001  >  34692 [PSH, ACK] Seq=66689843 Ack=3741655 Win=65535 Len=1448 [TCP segment of a reassembled PDU]"
1,6.607610999999906,10.0.2.15,54.93.77.70,TCP,54,34692  >  9001 [ACK] Seq=3741655 Ack=66691291 Win=65535 Len=0
1,6.612327999999934,54.93.77.70,10.0.2.15,TLSv1.2,1082,Application Data
1,6.6311900000000605,54.93.77.70,10.0.2.15,TLSv1.2,3674,Application Data
1,6.631284999999934,10.0.2.15,54.93.77.70,TCP,54,34692  >  9001 [ACK] Seq=3741655 Ack=66695939 Win=65535 Len=0
1,6.63144699999998,10.0.2.15,54.93.77.70,TLSv1.2,590,Application Data
1,6.631535999999869,54.93.77.70,10.0.2.15,TCP,60,9001  >  34692 [ACK] Seq=66695939 Ack=3742191 Win=65535 Len=0
1,6.647048000000041,54.93.77.70,10.0.2.15,TLSv1.2,7294,Application Data
1,6.647181000000046,10.0.2.15,54.93.77.70,TCP,54,34692  >  9001 [ACK] Seq=3742191 Ack=66703179 Win=65535 Len=0
1,6.649400000000014,54.93.77.70,10.0.2.15,TLSv1.2,1104,"Application Data, Application Data"
1,6.652751999999964,54.93.77.70,10.0.2.15,TCP,1502,"9001  >  34692 [PSH, ACK] Seq=66704229 Ack=3742191 Win=65535 Len=1448 [TCP segment of a reassembled PDU]"
1,6.652824999999893,10.0.2.15,54.93.77.70,TCP,54,34692  >  9001 [ACK] Seq=3742191 Ack=66705677 Win=65535 Len=0
1,6.665778000000046,54.93.77.70,10.0.2.15,TLSv1.2,7294,"Application Data, Application Data"
1,6.665821999999935,54.93.77.70,10.0.2.15,TLSv1.2,4398,Application Data [TCP segment of a reassembled PDU]
1,6.66593899999998,10.0.2.15,54.93.77.70,TCP,54,34692  >  9001 [ACK] Seq=3742191 Ack=66717261 Win=65535 Len=0
1,6.671563999999989,54.93.77.70,10.0.2.15,TLSv1.2,1010,"Application Data, Application Data"
1,6.674915999999939,54.93.77.70,10.0.2.15,TLSv1.2,5846,Application Data
1,6.6749459999998635,54.93.77.70,10.0.2.15,TLSv1.2,10190,"Application Data, Application Data"
1,6.6750090000000455,10.0.2.15,54.93.77.70,TCP,54,34692  >  9001 [ACK] Seq=3742191 Ack=66724009 Win=65535 Len=0
1,6.6751050000000305,10.0.2.15,54.93.77.70,TCP,54,34692  >  9001 [ACK] Seq=3742191 Ack=66734145 Win=65535 Len=0
1,6.675311999999849,10.0.2.15,54.93.77.70,TLSv1.2,1104,Application Data
1,6.675422000000026,54.93.77.70,10.0.2.15,TCP,60,9001  >  34692 [ACK] Seq=66734145 Ack=3743241 Win=65535 Len=0
1,6.692540999999892,54.93.77.70,10.0.2.15,TLSv1.2,1198,"Application Data, Application Data"
1,6.696267999999918,10.0.2.15,54.93.77.70,TLSv1.2,590,Application Data
1,6.696434999999838,54.93.77.70,10.0.2.15,TCP,60,9001  >  34692 [ACK] Seq=66735289 Ack=3743777 Win=65535 Len=0
1,6.740493999999899,62.210.85.178,10.0.2.15,TLSv1.2,590,Application Data
1,6.782390999999961,10.0.2.15,62.210.85.178,TCP,54,35978  >  9001 [ACK] Seq=66917291 Ack=3752905 Win=65535 Len=0
1,6.815583000000061,62.210.85.178,10.0.2.15,TLSv1.2,1104,Application Data
1,6.815656999999874,10.0.2.15,62.210.85.178,TCP,54,35978  >  9001 [ACK] Seq=66917291 Ack=3753955 Win=65535 Len=0
1,6.8571210000000065,62.210.85.178,10.0.2.15,TLSv1.2,590,Application Data
1,6.85718699999984,10.0.2.15,62.210.85.178,TCP,54,35978  >  9001 [ACK] Seq=66917291 Ack=3754491 Win=65535 Len=0
1,6.8574939999998605,10.0.2.15,62.210.85.178,TLSv1.2,590,Application Data
1,6.857576999999992,62.210.85.178,10.0.2.15,TCP,60,9001  >  35978 [ACK] Seq=3754491 Ack=66917827 Win=65535 Len=0
1,7.079896999999846,54.93.77.70,10.0.2.15,TLSv1.2,590,Application Data
1,7.080330999999887,10.0.2.15,54.93.77.70,TLSv1.2,590,Application Data
1,7.080471999999872,54.93.77.70,10.0.2.15,TCP,60,9001  >  34692 [ACK] Seq=66735825 Ack=3744313 Win=65535 Len=0
1,7.184440999999879,62.210.85.178,10.0.2.15,TLSv1.2,590,Application Data
1,7.1902849999999034,10.0.2.15,62.210.85.178,TLSv1.2,590,Application Data
1,7.1904819999999745,62.210.85.178,10.0.2.15,TCP,60,9001  >  35978 [ACK] Seq=3755027 Ack=66918363 Win=65535 Len=0
1,7.202953999999863,10.0.2.15,62.210.85.178,TLSv1.2,4124,Application Data
1,7.203066999999919,10.0.2.15,62.210.85.178,TCP,2974,35978  >  9001 [ACK] Seq=66922433 Ack=3755027 Win=65535 Len=2920 [TCP segment of a reassembled PDU]
1,7.20311300000003,62.210.85.178,10.0.2.15,TCP,60,9001  >  35978 [ACK] Seq=3755027 Ack=66919823 Win=65535 Len=0
1,7.203123999999889,62.210.85.178,10.0.2.15,TCP,60,9001  >  35978 [ACK] Seq=3755027 Ack=66921283 Win=65535 Len=0
1,7.203127999999879,62.210.85.178,10.0.2.15,TCP,60,9001  >  35978 [ACK] Seq=3755027 Ack=66922433 Win=65535 Len=0
1,7.20313299999998,62.210.85.178,10.0.2.15,TCP,60,9001  >  35978 [ACK] Seq=3755027 Ack=66923893 Win=65535 Len=0
1,7.20313699999997,62.210.85.178,10.0.2.15,TCP,60,9001  >  35978 [ACK] Seq=3755027 Ack=66925353 Win=65535 Len=0
1,7.203180999999859,10.0.2.15,62.210.85.178,TLSv1.2,1204,Application Data
1,7.203258000000005,10.0.2.15,62.210.85.178,TCP,2974,35978  >  9001 [ACK] Seq=66926503 Ack=3755027 Win=65535 Len=2920 [TCP segment of a reassembled PDU]
1,7.203297999999904,62.210.85.178,10.0.2.15,TCP,60,9001  >  35978 [ACK] Seq=3755027 Ack=66926503 Win=65535 Len=0
1,7.2033349999999245,10.0.2.15,62.210.85.178,TLSv1.2,1204,Application Data
1,7.20337799999993,62.210.85.178,10.0.2.15,TCP,60,9001  >  35978 [ACK] Seq=3755027 Ack=66927963 Win=65535 Len=0
1,7.2033839999999145,62.210.85.178,10.0.2.15,TCP,60,9001  >  35978 [ACK] Seq=3755027 Ack=66929423 Win=65535 Len=0
1,7.203436999999894,62.210.85.178,10.0.2.15,TCP,60,9001  >  35978 [ACK] Seq=3755027 Ack=66930573 Win=65535 Len=0
1,7.203479000000016,10.0.2.15,62.210.85.178,TLSv1.2,4124,Application Data
1,7.203518000000031,62.210.85.178,10.0.2.15,TCP,60,9001  >  35978 [ACK] Seq=3755027 Ack=66932033 Win=65535 Len=0
1,7.2035249999999,62.210.85.178,10.0.2.15,TCP,60,9001  >  35978 [ACK] Seq=3755027 Ack=66933493 Win=65535 Len=0
1,7.20358699999997,10.0.2.15,62.210.85.178,TLSv1.2,2974,Application Data
1,7.2036299999999756,62.210.85.178,10.0.2.15,TCP,60,9001  >  35978 [ACK] Seq=3755027 Ack=66934643 Win=65535 Len=0
1,7.20363599999996,62.210.85.178,10.0.2.15,TCP,60,9001  >  35978 [ACK] Seq=3755027 Ack=66936103 Win=65535 Len=0
1,7.2036410000000615,62.210.85.178,10.0.2.15,TCP,60,9001  >  35978 [ACK] Seq=3755027 Ack=66937563 Win=65535 Len=0
1,7.203682999999955,10.0.2.15,62.210.85.178,TLSv1.2,1226,Application Data
1,7.203724999999849,62.210.85.178,10.0.2.15,TCP,60,9001  >  35978 [ACK] Seq=3755027 Ack=66938735 Win=65535 Len=0
1,7.203773999999839,10.0.2.15,62.210.85.178,TLSv1.2,4124,Application Data
1,7.2038149999998495,62.210.85.178,10.0.2.15,TCP,60,9001  >  35978 [ACK] Seq=3755027 Ack=66940195 Win=65535 Len=0
1,7.2038219999999455,62.210.85.178,10.0.2.15,TCP,60,9001  >  35978 [ACK] Seq=3755027 Ack=66941655 Win=65535 Len=0
1,7.2038259999999354,62.210.85.178,10.0.2.15,TCP,60,9001  >  35978 [ACK] Seq=3755027 Ack=66942805 Win=65535 Len=0
1,7.203870000000052,10.0.2.15,62.210.85.178,TLSv1.2,2002,Application Data
1,7.203909999999951,62.210.85.178,10.0.2.15,TCP,60,9001  >  35978 [ACK] Seq=3755027 Ack=66944265 Win=65535 Len=0
1,7.2039219999999204,62.210.85.178,10.0.2.15,TCP,60,9001  >  35978 [ACK] Seq=3755027 Ack=66944753 Win=65535 Len=0
1,7.292580999999927,54.93.77.70,10.0.2.15,TLSv1.2,3674,Application Data
1,7.292717000000039,10.0.2.15,54.93.77.70,TCP,54,34692  >  9001 [ACK] Seq=3744313 Ack=66739445 Win=65535 Len=0
1,7.302087000000029,54.93.77.70,10.0.2.15,TLSv1.2,7294,Application Data
1,7.302185000000009,10.0.2.15,54.93.77.70,TCP,54,34692  >  9001 [ACK] Seq=3744313 Ack=66746685 Win=65535 Len=0
1,7.309017999999924,54.93.77.70,10.0.2.15,TLSv1.2,1104,"Application Data, Application Data"
1,7.324080999999978,54.93.77.70,10.0.2.15,TLSv1.2,7294,"Application Data, Application Data"
1,7.324153999999908,10.0.2.15,54.93.77.70,TCP,54,34692  >  9001 [ACK] Seq=3744313 Ack=66754975 Win=65535 Len=0
1,7.3348419999999805,54.93.77.70,10.0.2.15,TLSv1.2,4398,Application Data [TCP segment of a reassembled PDU]
1,7.33489499999996,10.0.2.15,54.93.77.70,TCP,54,34692  >  9001 [ACK] Seq=3744313 Ack=66759319 Win=65535 Len=0
1,7.3354269999999815,54.93.77.70,10.0.2.15,TLSv1.2,2950,Application Data [TCP segment of a reassembled PDU]
1,7.33547099999987,10.0.2.15,54.93.77.70,TCP,54,34692  >  9001 [ACK] Seq=3744313 Ack=66762215 Win=65535 Len=0
1,7.3412080000000515,54.93.77.70,10.0.2.15,TLSv1.2,590,Application Data
1,7.34141899999986,10.0.2.15,54.93.77.70,TLSv1.2,590,Application Data
1,7.341539000000012,54.93.77.70,10.0.2.15,TCP,60,9001  >  34692 [ACK] Seq=66762751 Ack=3744849 Win=65535 Len=0
1,7.351636999999982,10.0.2.15,54.93.77.70,TLSv1.2,590,Application Data
1,7.351784999999836,54.93.77.70,10.0.2.15,TCP,60,9001  >  34692 [ACK] Seq=66762751 Ack=3745385 Win=65535 Len=0
1,7.4475740000000314,62.210.85.178,10.0.2.15,TLSv1.2,590,Application Data
1,7.490459999999985,10.0.2.15,62.210.85.178,TCP,54,35978  >  9001 [ACK] Seq=66944753 Ack=3755563 Win=65535 Len=0
1,7.55662099999995,62.210.85.178,10.0.2.15,TLSv1.2,590,Application Data
1,7.55670299999997,10.0.2.15,62.210.85.178,TCP,54,35978  >  9001 [ACK] Seq=66944753 Ack=3756099 Win=65535 Len=0
1,7.557231999999885,10.0.2.15,62.210.85.178,TLSv1.2,590,Application Data
1,7.557350000000042,62.210.85.178,10.0.2.15,TCP,60,9001  >  35978 [ACK] Seq=3756099 Ack=66945289 Win=65535 Len=0
1,7.6644139999998515,54.93.77.70,10.0.2.15,TLSv1.2,590,Application Data
1,7.664788999999928,10.0.2.15,54.93.77.70,TLSv1.2,590,Application Data
1,7.664898999999878,54.93.77.70,10.0.2.15,TCP,60,9001  >  34692 [ACK] Seq=66763287 Ack=3745921 Win=65535 Len=0
1,7.780232999999953,62.210.85.178,10.0.2.15,TLSv1.2,590,Application Data
1,7.786533999999847,10.0.2.15,62.210.85.178,TLSv1.2,590,Application Data
1,7.786687999999913,62.210.85.178,10.0.2.15,TCP,60,9001  >  35978 [ACK] Seq=3756635 Ack=66945825 Win=65535 Len=0
1,7.798747999999932,10.0.2.15,62.210.85.178,TLSv1.2,4124,Application Data
1,7.798871999999847,10.0.2.15,62.210.85.178,TCP,2974,35978  >  9001 [ACK] Seq=66949895 Ack=3756635 Win=65535 Len=2920 [TCP segment of a reassembled PDU]
1,7.798920999999837,62.210.85.178,10.0.2.15,TCP,60,9001  >  35978 [ACK] Seq=3756635 Ack=66947285 Win=65535 Len=0
1,7.798931000000039,62.210.85.178,10.0.2.15,TCP,60,9001  >  35978 [ACK] Seq=3756635 Ack=66948745 Win=65535 Len=0
1,7.798935999999912,62.210.85.178,10.0.2.15,TCP,60,9001  >  35978 [ACK] Seq=3756635 Ack=66949895 Win=65535 Len=0
1,7.7989410000000134,62.210.85.178,10.0.2.15,TCP,60,9001  >  35978 [ACK] Seq=3756635 Ack=66951355 Win=65535 Len=0
1,7.798945000000003,62.210.85.178,10.0.2.15,TCP,60,9001  >  35978 [ACK] Seq=3756635 Ack=66952815 Win=65535 Len=0
1,7.798990000000003,10.0.2.15,62.210.85.178,TLSv1.2,1204,Application Data
1,7.799031000000014,62.210.85.178,10.0.2.15,TCP,60,9001  >  35978 [ACK] Seq=3756635 Ack=66953965 Win=65535 Len=0
1,7.799080999999887,10.0.2.15,62.210.85.178,TLSv1.2,4124,Application Data
1,7.799150999999938,10.0.2.15,62.210.85.178,TCP,2974,35978  >  9001 [ACK] Seq=66958035 Ack=3756635 Win=65535 Len=2920 [TCP segment of a reassembled PDU]
1,7.799188999999842,62.210.85.178,10.0.2.15,TCP,60,9001  >  35978 [ACK] Seq=3756635 Ack=66955425 Win=65535 Len=0
1,7.799195999999938,62.210.85.178,10.0.2.15,TCP,60,9001  >  35978 [ACK] Seq=3756635 Ack=66956885 Win=65535 Len=0
1,7.799199999999928,62.210.85.178,10.0.2.15,TCP,60,9001  >  35978 [ACK] Seq=3756635 Ack=66958035 Win=65535 Len=0
1,7.799203999999918,62.210.85.178,10.0.2.15,TCP,60,9001  >  35978 [ACK] Seq=3756635 Ack=66959495 Win=65535 Len=0
1,7.799209000000019,62.210.85.178,10.0.2.15,TCP,60,9001  >  35978 [ACK] Seq=3756635 Ack=66960955 Win=65535 Len=0
1,7.799246000000039,10.0.2.15,62.210.85.178,TLSv1.2,1204,Application Data
1,7.799328999999943,10.0.2.15,62.210.85.178,TLSv1.2,2974,Application Data
1,7.799366999999847,62.210.85.178,10.0.2.15,TCP,60,9001  >  35978 [ACK] Seq=3756635 Ack=66962105 Win=65535 Len=0
1,7.799373999999943,62.210.85.178,10.0.2.15,TCP,60,9001  >  35978 [ACK] Seq=3756635 Ack=66963565 Win=65535 Len=0
1,7.799377999999933,62.210.85.178,10.0.2.15,TCP,60,9001  >  35978 [ACK] Seq=3756635 Ack=66965025 Win=65535 Len=0
1,7.799412999999959,10.0.2.15,62.210.85.178,TLSv1.2,1226,Application Data
1,7.799477000000024,10.0.2.15,62.210.85.178,TCP,2974,35978  >  9001 [ACK] Seq=66966197 Ack=3756635 Win=65535 Len=2920 [TCP segment of a reassembled PDU]
1,7.7995129999999335,62.210.85.178,10.0.2.15,TCP,60,9001  >  35978 [ACK] Seq=3756635 Ack=66966197 Win=65535 Len=0
1,7.799518999999918,62.210.85.178,10.0.2.15,TCP,60,9001  >  35978 [ACK] Seq=3756635 Ack=66967657 Win=65535 Len=0
1,7.799524000000019,62.210.85.178,10.0.2.15,TCP,60,9001  >  35978 [ACK] Seq=3756635 Ack=66969117 Win=65535 Len=0
1,7.799555999999939,10.0.2.15,62.210.85.178,TLSv1.2,1204,Application Data
1,7.799591999999848,62.210.85.178,10.0.2.15,TCP,60,9001  >  35978 [ACK] Seq=3756635 Ack=66970267 Win=65535 Len=0
1,7.799635999999964,10.0.2.15,62.210.85.178,TLSv1.2,3030,Application Data
1,7.799683999999843,62.210.85.178,10.0.2.15,TCP,60,9001  >  35978 [ACK] Seq=3756635 Ack=66971727 Win=65535 Len=0
1,7.79969200000005,62.210.85.178,10.0.2.15,TCP,60,9001  >  35978 [ACK] Seq=3756635 Ack=66973187 Win=65535 Len=0
1,7.79969600000004,62.210.85.178,10.0.2.15,TCP,60,9001  >  35978 [ACK] Seq=3756635 Ack=66973243 Win=65535 Len=0
1,7.808876000000055,10.0.2.15,62.210.85.178,TLSv1.2,4124,Application Data
1,7.808958999999959,10.0.2.15,62.210.85.178,TCP,1514,35978  >  9001 [ACK] Seq=66977313 Ack=3756635 Win=65535 Len=1460 [TCP segment of a reassembled PDU]
1,7.809001999999964,62.210.85.178,10.0.2.15,TCP,60,9001  >  35978 [ACK] Seq=3756635 Ack=66974703 Win=65535 Len=0
1,7.809009999999944,62.210.85.178,10.0.2.15,TCP,60,9001  >  35978 [ACK] Seq=3756635 Ack=66976163 Win=65535 Len=0
1,7.809015000000045,62.210.85.178,10.0.2.15,TCP,60,9001  >  35978 [ACK] Seq=3756635 Ack=66977313 Win=65535 Len=0
1,7.809052999999949,10.0.2.15,62.210.85.178,TLSv1.2,222,Application Data
1,7.809087999999974,62.210.85.178,10.0.2.15,TCP,60,9001  >  35978 [ACK] Seq=3756635 Ack=66978773 Win=65535 Len=0
1,7.809093999999959,62.210.85.178,10.0.2.15,TCP,60,9001  >  35978 [ACK] Seq=3756635 Ack=66978941 Win=65535 Len=0
1,7.887981999999965,54.93.77.70,10.0.2.15,TLSv1.2,590,Application Data
1,7.930442999999968,10.0.2.15,54.93.77.70,TCP,54,34692  >  9001 [ACK] Seq=3745921 Ack=66763823 Win=65535 Len=0
1,7.961657999999943,54.93.77.70,10.0.2.15,TCP,2950,"9001  >  34692 [PSH, ACK] Seq=66763823 Ack=3745921 Win=65535 Len=2896 [TCP segment of a reassembled PDU]"
1,7.961720000000014,10.0.2.15,54.93.77.70,TCP,54,34692  >  9001 [ACK] Seq=3745921 Ack=66766719 Win=65535 Len=0
1,7.961772999999994,54.93.77.70,10.0.2.15,TLSv1.2,2342,"Application Data, Application Data"
1,7.961804999999913,10.0.2.15,54.93.77.70,TCP,54,34692  >  9001 [ACK] Seq=3745921 Ack=66769007 Win=65535 Len=0
1,7.962863999999854,54.93.77.70,10.0.2.15,TCP,1502,"9001  >  34692 [PSH, ACK] Seq=66769007 Ack=3745921 Win=65535 Len=1448 [TCP segment of a reassembled PDU]"
1,7.96291599999995,10.0.2.15,54.93.77.70,TCP,54,34692  >  9001 [ACK] Seq=3745921 Ack=66770455 Win=65535 Len=0
1,7.971585000000005,54.93.77.70,10.0.2.15,TLSv1.2,2950,Application Data [TCP segment of a reassembled PDU]
1,7.9716289999998935,10.0.2.15,54.93.77.70,TCP,54,34692  >  9001 [ACK] Seq=3745921 Ack=66773351 Win=65535 Len=0
1,7.972426999999925,54.93.77.70,10.0.2.15,TLSv1.2,4398,Application Data [TCP segment of a reassembled PDU]
1,7.97251099999994,10.0.2.15,54.93.77.70,TCP,54,34692  >  9001 [ACK] Seq=3745921 Ack=66777695 Win=65535 Len=0
1,7.972786999999926,10.0.2.15,54.93.77.70,TLSv1.2,590,Application Data
1,7.972911999999951,54.93.77.70,10.0.2.15,TCP,60,9001  >  34692 [ACK] Seq=66777695 Ack=3746457 Win=65535 Len=0
1,7.978351999999859,54.93.77.70,10.0.2.15,TLSv1.2,1198,Application Data
1,7.9917800000000625,54.93.77.70,10.0.2.15,TCP,2950,"9001  >  34692 [PSH, ACK] Seq=66778839 Ack=3746457 Win=65535 Len=2896 [TCP segment of a reassembled PDU]"
1,7.9918129999998655,54.93.77.70,10.0.2.15,TLSv1.2,2950,Application Data [TCP segment of a reassembled PDU]
1,7.991856999999982,10.0.2.15,54.93.77.70,TCP,54,34692  >  9001 [ACK] Seq=3746457 Ack=66781735 Win=65535 Len=0
1,7.9919720000000325,10.0.2.15,54.93.77.70,TCP,54,34692  >  9001 [ACK] Seq=3746457 Ack=66784631 Win=65535 Len=0
1,7.992172999999866,54.93.77.70,10.0.2.15,TLSv1.2,4398,Application Data [TCP segment of a reassembled PDU]
1,7.992209999999886,10.0.2.15,54.93.77.70,TCP,54,34692  >  9001 [ACK] Seq=3746457 Ack=66788975 Win=65535 Len=0
1,7.993118999999979,54.93.77.70,10.0.2.15,TLSv1.2,5846,Application Data [TCP segment of a reassembled PDU]
1,7.993160999999873,10.0.2.15,54.93.77.70,TCP,54,34692  >  9001 [ACK] Seq=3746457 Ack=66794767 Win=65535 Len=0
1,7.993301999999858,10.0.2.15,54.93.77.70,TLSv1.2,590,Application Data
1,7.993373999999903,54.93.77.70,10.0.2.15,TCP,60,9001  >  34692 [ACK] Seq=66794767 Ack=3746993 Win=65535 Len=0
1,7.994290999999976,54.93.77.70,10.0.2.15,TLSv1.2,148,Application Data
1,8.017081999999846,54.93.77.70,10.0.2.15,TLSv1.2,2132,Application Data
1,8.017168999999967,10.0.2.15,54.93.77.70,TCP,54,34692  >  9001 [ACK] Seq=3746993 Ack=66796939 Win=65535 Len=0
