No.,Time,Source,Destination,Protocol,Length,Info
1,0.018880000000081054,10.0.2.15,54.93.77.70,TCP,54,34692  >  9001 [ACK] Seq=4257399 Ack=75685811 Win=65535 Len=0
1,0.09478100000001177,62.210.85.178,10.0.2.15,TLSv1.2,1104,Application Data
1,0.14331800000013573,10.0.2.15,62.210.85.178,TCP,54,35978  >  9001 [ACK] Seq=75865987 Ack=4266001 Win=65535 Len=0
1,0.20025600000008126,10.0.2.15,54.93.77.70,TLSv1.2,590,Application Data
1,0.20046900000011192,54.93.77.70,10.0.2.15,TCP,60,9001  >  34692 [ACK] Seq=75685811 Ack=4257935 Win=65535 Len=0
1,0.3089830000001257,62.210.85.178,10.0.2.15,TLSv1.2,590,Application Data
1,0.30906000000004497,10.0.2.15,62.210.85.178,TCP,54,35978  >  9001 [ACK] Seq=75865987 Ack=4266537 Win=65535 Len=0
1,0.30954700000006596,10.0.2.15,62.210.85.178,TLSv1.2,590,Application Data
1,0.30965900000001056,62.210.85.178,10.0.2.15,TCP,60,9001  >  35978 [ACK] Seq=4266537 Ack=75866523 Win=65535 Len=0
1,0.6751170000000002,54.93.77.70,10.0.2.15,TLSv1.2,590,Application Data
1,0.6752060000001165,10.0.2.15,54.93.77.70,TCP,54,34692  >  9001 [ACK] Seq=4257935 Ack=75686347 Win=65535 Len=0
1,0.6756710000001931,10.0.2.15,54.93.77.70,TLSv1.2,1618,Application Data
1,0.6758040000001984,54.93.77.70,10.0.2.15,TCP,60,9001  >  34692 [ACK] Seq=75686347 Ack=4259395 Win=65535 Len=0
1,0.675818000000163,54.93.77.70,10.0.2.15,TCP,60,9001  >  34692 [ACK] Seq=75686347 Ack=4259499 Win=65535 Len=0
1,0.8797840000001997,62.210.85.178,10.0.2.15,TLSv1.2,1618,Application Data
1,0.8799370000001545,10.0.2.15,62.210.85.178,TCP,54,35978  >  9001 [ACK] Seq=75866523 Ack=4268101 Win=65535 Len=0
1,0.9016860000001543,10.0.2.15,62.210.85.178,TLSv1.2,590,Application Data
1,0.901888000000099,62.210.85.178,10.0.2.15,TCP,60,9001  >  35978 [ACK] Seq=4268101 Ack=75867059 Win=65535 Len=0
1,0.9157950000001165,10.0.2.15,62.210.85.178,TLSv1.2,1618,Application Data
1,0.9159740000000056,62.210.85.178,10.0.2.15,TCP,60,9001  >  35978 [ACK] Seq=4268101 Ack=75868519 Win=65535 Len=0
1,0.9159910000000764,62.210.85.178,10.0.2.15,TCP,60,9001  >  35978 [ACK] Seq=4268101 Ack=75868623 Win=65535 Len=0
1,1.0001340000001164,54.93.77.70,10.0.2.15,TLSv1.2,590,Application Data
1,1.0365249999999833,54.93.77.70,10.0.2.15,TLSv1.2,1618,Application Data
1,1.03659800000014,10.0.2.15,54.93.77.70,TCP,54,34692  >  9001 [ACK] Seq=4259499 Ack=75688447 Win=65535 Len=0
1,1.039260000000013,10.0.2.15,54.93.77.70,TLSv1.2,590,Application Data
1,1.0394490000001042,54.93.77.70,10.0.2.15,TCP,60,9001  >  34692 [ACK] Seq=75688447 Ack=4260035 Win=65535 Len=0
1,1.1512870000001385,62.210.85.178,10.0.2.15,TLSv1.2,590,Application Data
1,1.1516410000001542,10.0.2.15,62.210.85.178,TLSv1.2,590,Application Data
1,1.151783000000023,62.210.85.178,10.0.2.15,TCP,60,9001  >  35978 [ACK] Seq=4268637 Ack=75869159 Win=65535 Len=0
1,1.596318999999994,54.93.77.70,10.0.2.15,TLSv1.2,590,Application Data
1,1.59671400000002,10.0.2.15,54.93.77.70,TLSv1.2,590,Application Data
1,1.596826000000192,54.93.77.70,10.0.2.15,TCP,60,9001  >  34692 [ACK] Seq=75688983 Ack=4260571 Win=65535 Len=0
1,1.9033249999999953,62.210.85.178,10.0.2.15,TLSv1.2,590,Application Data
1,1.9094050000001062,10.0.2.15,62.210.85.178,TLSv1.2,590,Application Data
1,1.909558000000061,62.210.85.178,10.0.2.15,TCP,60,9001  >  35978 [ACK] Seq=4269173 Ack=75869695 Win=65535 Len=0
1,1.923108000000184,10.0.2.15,62.210.85.178,TLSv1.2,4124,Application Data
1,1.9232520000000477,10.0.2.15,62.210.85.178,TCP,2974,35978  >  9001 [ACK] Seq=75873765 Ack=4269173 Win=65535 Len=2920 [TCP segment of a reassembled PDU]
1,1.9232990000000427,62.210.85.178,10.0.2.15,TCP,60,9001  >  35978 [ACK] Seq=4269173 Ack=75871155 Win=65535 Len=0
1,1.9233120000001236,62.210.85.178,10.0.2.15,TCP,60,9001  >  35978 [ACK] Seq=4269173 Ack=75872615 Win=65535 Len=0
1,1.9233180000001084,62.210.85.178,10.0.2.15,TCP,60,9001  >  35978 [ACK] Seq=4269173 Ack=75873765 Win=65535 Len=0
1,1.9233659999999873,10.0.2.15,62.210.85.178,TLSv1.2,1204,Application Data
1,1.9234060000001136,62.210.85.178,10.0.2.15,TCP,60,9001  >  35978 [ACK] Seq=4269173 Ack=75875225 Win=65535 Len=0
1,1.9234140000000934,62.210.85.178,10.0.2.15,TCP,60,9001  >  35978 [ACK] Seq=4269173 Ack=75876685 Win=65535 Len=0
1,1.9234190000001945,62.210.85.178,10.0.2.15,TCP,60,9001  >  35978 [ACK] Seq=4269173 Ack=75877835 Win=65535 Len=0
1,1.9235040000000936,10.0.2.15,62.210.85.178,TLSv1.2,4124,Application Data
1,1.923631000000114,10.0.2.15,62.210.85.178,TCP,2974,35978  >  9001 [ACK] Seq=75881905 Ack=4269173 Win=65535 Len=2920 [TCP segment of a reassembled PDU]
1,1.9239509999999882,10.0.2.15,62.210.85.178,TLSv1.2,4434,"Application Data, Application Data"
1,1.9240790000001198,62.210.85.178,10.0.2.15,TCP,60,9001  >  35978 [ACK] Seq=4269173 Ack=75879295 Win=65535 Len=0
1,1.924109000000044,62.210.85.178,10.0.2.15,TCP,60,9001  >  35978 [ACK] Seq=4269173 Ack=75880755 Win=65535 Len=0
1,1.924114000000145,62.210.85.178,10.0.2.15,TCP,60,9001  >  35978 [ACK] Seq=4269173 Ack=75881905 Win=65535 Len=0
1,1.924118000000135,62.210.85.178,10.0.2.15,TCP,60,9001  >  35978 [ACK] Seq=4269173 Ack=75883365 Win=65535 Len=0
1,1.924122000000125,62.210.85.178,10.0.2.15,TCP,60,9001  >  35978 [ACK] Seq=4269173 Ack=75884825 Win=65535 Len=0
1,1.9242189999999937,62.210.85.178,10.0.2.15,TCP,60,9001  >  35978 [ACK] Seq=4269173 Ack=75886285 Win=65535 Len=0
1,1.9242320000000745,62.210.85.178,10.0.2.15,TCP,60,9001  >  35978 [ACK] Seq=4269173 Ack=75887745 Win=65535 Len=0
1,1.9242350000001807,62.210.85.178,10.0.2.15,TCP,60,9001  >  35978 [ACK] Seq=4269173 Ack=75889205 Win=65535 Len=0
1,1.9242800000001807,10.0.2.15,62.210.85.178,TLSv1.2,916,Application Data
1,1.9243470000001253,62.210.85.178,10.0.2.15,TCP,60,9001  >  35978 [ACK] Seq=4269173 Ack=75890067 Win=65535 Len=0
1,1.9245460000001913,10.0.2.15,62.210.85.178,TLSv1.2,4124,Application Data
1,1.924641000000065,62.210.85.178,10.0.2.15,TCP,60,9001  >  35978 [ACK] Seq=4269173 Ack=75891527 Win=65535 Len=0
1,1.9246550000000298,62.210.85.178,10.0.2.15,TCP,60,9001  >  35978 [ACK] Seq=4269173 Ack=75892987 Win=65535 Len=0
1,1.9246580000001359,62.210.85.178,10.0.2.15,TCP,60,9001  >  35978 [ACK] Seq=4269173 Ack=75894137 Win=65535 Len=0
1,1.9247130000001107,10.0.2.15,62.210.85.178,TLSv1.2,3030,Application Data
1,1.9248220000001766,62.210.85.178,10.0.2.15,TCP,60,9001  >  35978 [ACK] Seq=4269173 Ack=75895597 Win=65535 Len=0
1,1.9248300000001564,62.210.85.178,10.0.2.15,TCP,60,9001  >  35978 [ACK] Seq=4269173 Ack=75897057 Win=65535 Len=0
1,1.9248340000001463,62.210.85.178,10.0.2.15,TCP,60,9001  >  35978 [ACK] Seq=4269173 Ack=75897113 Win=65535 Len=0
1,1.9352210000001833,10.0.2.15,62.210.85.178,TLSv1.2,4124,Application Data
1,1.935376000000133,62.210.85.178,10.0.2.15,TCP,60,9001  >  35978 [ACK] Seq=4269173 Ack=75898573 Win=65535 Len=0
1,1.9353909999999814,62.210.85.178,10.0.2.15,TCP,60,9001  >  35978 [ACK] Seq=4269173 Ack=75900033 Win=65535 Len=0
1,1.9353950000001987,62.210.85.178,10.0.2.15,TCP,60,9001  >  35978 [ACK] Seq=4269173 Ack=75901183 Win=65535 Len=0
1,1.935427000000118,10.0.2.15,62.210.85.178,TCP,2974,35978  >  9001 [ACK] Seq=75901183 Ack=4269173 Win=65535 Len=2920 [TCP segment of a reassembled PDU]
1,1.9354940000000624,62.210.85.178,10.0.2.15,TCP,60,9001  >  35978 [ACK] Seq=4269173 Ack=75902643 Win=65535 Len=0
1,1.9355010000001585,62.210.85.178,10.0.2.15,TCP,60,9001  >  35978 [ACK] Seq=4269173 Ack=75904103 Win=65535 Len=0
1,1.9355270000000928,10.0.2.15,62.210.85.178,TLSv1.2,1204,Application Data
1,1.9355600000001232,62.210.85.178,10.0.2.15,TCP,60,9001  >  35978 [ACK] Seq=4269173 Ack=75905253 Win=65535 Len=0
1,1.9356020000000171,10.0.2.15,62.210.85.178,TLSv1.2,4124,Application Data
1,1.9356380000001536,62.210.85.178,10.0.2.15,TCP,60,9001  >  35978 [ACK] Seq=4269173 Ack=75906713 Win=65535 Len=0
1,1.9356450000000223,62.210.85.178,10.0.2.15,TCP,60,9001  >  35978 [ACK] Seq=4269173 Ack=75908173 Win=65535 Len=0
1,1.9356480000001284,62.210.85.178,10.0.2.15,TCP,60,9001  >  35978 [ACK] Seq=4269173 Ack=75909323 Win=65535 Len=0
1,1.9356860000000324,10.0.2.15,62.210.85.178,TLSv1.2,4124,Application Data
1,1.9357500000000982,62.210.85.178,10.0.2.15,TCP,60,9001  >  35978 [ACK] Seq=4269173 Ack=75910783 Win=65535 Len=0
1,1.9357570000001942,62.210.85.178,10.0.2.15,TCP,60,9001  >  35978 [ACK] Seq=4269173 Ack=75912243 Win=65535 Len=0
1,1.935760000000073,62.210.85.178,10.0.2.15,TCP,60,9001  >  35978 [ACK] Seq=4269173 Ack=75913393 Win=65535 Len=0
1,1.9357919999999922,10.0.2.15,62.210.85.178,TLSv1.2,332,Application Data
1,1.9358250000000226,62.210.85.178,10.0.2.15,TCP,60,9001  >  35978 [ACK] Seq=4269173 Ack=75913671 Win=65535 Len=0
1,1.9358790000001136,10.0.2.15,62.210.85.178,TLSv1.2,3868,Application Data
1,1.9359160000001339,62.210.85.178,10.0.2.15,TCP,60,9001  >  35978 [ACK] Seq=4269173 Ack=75915131 Win=65535 Len=0
1,1.9359230000000025,62.210.85.178,10.0.2.15,TCP,60,9001  >  35978 [ACK] Seq=4269173 Ack=75916591 Win=65535 Len=0
1,1.9359260000001086,62.210.85.178,10.0.2.15,TCP,60,9001  >  35978 [ACK] Seq=4269173 Ack=75917485 Win=65535 Len=0
1,1.9359630000001289,10.0.2.15,62.210.85.178,TLSv1.2,4124,Application Data
1,1.935997000000043,62.210.85.178,10.0.2.15,TCP,60,9001  >  35978 [ACK] Seq=4269173 Ack=75918945 Win=65535 Len=0
1,1.936004000000139,62.210.85.178,10.0.2.15,TCP,60,9001  >  35978 [ACK] Seq=4269173 Ack=75920405 Win=65535 Len=0
1,1.936008000000129,62.210.85.178,10.0.2.15,TCP,60,9001  >  35978 [ACK] Seq=4269173 Ack=75921555 Win=65535 Len=0
1,1.9360430000001543,10.0.2.15,62.210.85.178,TLSv1.2,4124,Application Data
1,1.9360770000000684,62.210.85.178,10.0.2.15,TCP,60,9001  >  35978 [ACK] Seq=4269173 Ack=75923015 Win=65535 Len=0
1,1.9360840000001645,62.210.85.178,10.0.2.15,TCP,60,9001  >  35978 [ACK] Seq=4269173 Ack=75924475 Win=65535 Len=0
1,1.9360860000001594,62.210.85.178,10.0.2.15,TCP,60,9001  >  35978 [ACK] Seq=4269173 Ack=75925625 Win=65535 Len=0
1,1.9361310000001595,10.0.2.15,62.210.85.178,TLSv1.2,4124,Application Data
1,1.9361660000001848,62.210.85.178,10.0.2.15,TCP,60,9001  >  35978 [ACK] Seq=4269173 Ack=75927085 Win=65535 Len=0
1,1.9361720000001696,62.210.85.178,10.0.2.15,TCP,60,9001  >  35978 [ACK] Seq=4269173 Ack=75928545 Win=65535 Len=0
1,1.9361750000000484,62.210.85.178,10.0.2.15,TCP,60,9001  >  35978 [ACK] Seq=4269173 Ack=75929695 Win=65535 Len=0
1,1.9362080000000788,10.0.2.15,62.210.85.178,TLSv1.2,588,Application Data
1,1.9362410000001091,62.210.85.178,10.0.2.15,TCP,60,9001  >  35978 [ACK] Seq=4269173 Ack=75930229 Win=65535 Len=0
1,1.9362860000001092,10.0.2.15,62.210.85.178,TLSv1.2,3612,Application Data
1,1.9363220000000183,62.210.85.178,10.0.2.15,TCP,60,9001  >  35978 [ACK] Seq=4269173 Ack=75931689 Win=65535 Len=0
1,1.9363290000001143,62.210.85.178,10.0.2.15,TCP,60,9001  >  35978 [ACK] Seq=4269173 Ack=75933149 Win=65535 Len=0
1,1.936331999999993,62.210.85.178,10.0.2.15,TCP,60,9001  >  35978 [ACK] Seq=4269173 Ack=75933787 Win=65535 Len=0
1,1.9363690000000133,10.0.2.15,62.210.85.178,TLSv1.2,4124,Application Data
1,1.9364030000001549,62.210.85.178,10.0.2.15,TCP,60,9001  >  35978 [ACK] Seq=4269173 Ack=75935247 Win=65535 Len=0
1,1.9364100000000235,62.210.85.178,10.0.2.15,TCP,60,9001  >  35978 [ACK] Seq=4269173 Ack=75936707 Win=65535 Len=0
1,1.9364130000001296,62.210.85.178,10.0.2.15,TCP,60,9001  >  35978 [ACK] Seq=4269173 Ack=75937857 Win=65535 Len=0
1,1.9364470000000438,10.0.2.15,62.210.85.178,TLSv1.2,3800,Application Data
1,1.936482000000069,62.210.85.178,10.0.2.15,TCP,60,9001  >  35978 [ACK] Seq=4269173 Ack=75939317 Win=65535 Len=0
1,1.936489000000165,62.210.85.178,10.0.2.15,TCP,60,9001  >  35978 [ACK] Seq=4269173 Ack=75940777 Win=65535 Len=0
1,1.9364920000000438,62.210.85.178,10.0.2.15,TCP,60,9001  >  35978 [ACK] Seq=4269173 Ack=75941603 Win=65535 Len=0
1,1.9456810000001497,10.0.2.15,62.210.85.178,TLSv1.2,4124,Application Data
1,1.9457600000000639,62.210.85.178,10.0.2.15,TCP,60,9001  >  35978 [ACK] Seq=4269173 Ack=75943063 Win=65535 Len=0
1,1.9457700000000386,62.210.85.178,10.0.2.15,TCP,60,9001  >  35978 [ACK] Seq=4269173 Ack=75944523 Win=65535 Len=0
1,1.9457740000000285,62.210.85.178,10.0.2.15,TCP,60,9001  >  35978 [ACK] Seq=4269173 Ack=75945673 Win=65535 Len=0
1,1.9458190000000286,10.0.2.15,62.210.85.178,TLSv1.2,1682,Application Data
1,1.945855000000165,62.210.85.178,10.0.2.15,TCP,60,9001  >  35978 [ACK] Seq=4269173 Ack=75947133 Win=65535 Len=0
1,1.945863000000145,62.210.85.178,10.0.2.15,TCP,60,9001  >  35978 [ACK] Seq=4269173 Ack=75947301 Win=65535 Len=0
1,2.014029000000164,54.93.77.70,10.0.2.15,TLSv1.2,590,Application Data
1,2.036803000000191,54.93.77.70,10.0.2.15,TLSv1.2,4398,Application Data
1,2.0369060000000445,10.0.2.15,54.93.77.70,TCP,54,34692  >  9001 [ACK] Seq=4260571 Ack=75693863 Win=65535 Len=0
1,2.038716000000022,54.93.77.70,10.0.2.15,TLSv1.2,2950,Application Data [TCP segment of a reassembled PDU]
1,2.0387570000000323,10.0.2.15,54.93.77.70,TCP,54,34692  >  9001 [ACK] Seq=4260571 Ack=75696759 Win=65535 Len=0
1,2.047905000000128,54.93.77.70,10.0.2.15,TLSv1.2,2950,Application Data [TCP segment of a reassembled PDU]
1,2.047994000000017,10.0.2.15,54.93.77.70,TCP,54,34692  >  9001 [ACK] Seq=4260571 Ack=75699655 Win=65535 Len=0
1,2.0531270000001314,54.93.77.70,10.0.2.15,TLSv1.2,1314,Application Data
1,2.0634540000000925,54.93.77.70,10.0.2.15,TCP,2950,"9001  >  34692 [PSH, ACK] Seq=75700915 Ack=4260571 Win=65535 Len=2896 [TCP segment of a reassembled PDU]"
1,2.063718999999992,10.0.2.15,54.93.77.70,TCP,54,34692  >  9001 [ACK] Seq=4260571 Ack=75703811 Win=65535 Len=0
1,2.0668150000001333,54.93.77.70,10.0.2.15,TLSv1.2,2950,Application Data [TCP segment of a reassembled PDU]
1,2.066859000000022,54.93.77.70,10.0.2.15,TCP,1502,"9001  >  34692 [PSH, ACK] Seq=75706707 Ack=4260571 Win=65535 Len=1448 [TCP segment of a reassembled PDU]"
1,2.066924000000199,10.0.2.15,54.93.77.70,TCP,54,34692  >  9001 [ACK] Seq=4260571 Ack=75706707 Win=65535 Len=0
1,2.067071000000169,10.0.2.15,54.93.77.70,TCP,54,34692  >  9001 [ACK] Seq=4260571 Ack=75708155 Win=65535 Len=0
1,2.0678750000001855,54.93.77.70,10.0.2.15,TLSv1.2,2950,Application Data [TCP segment of a reassembled PDU]
1,2.067929000000049,10.0.2.15,54.93.77.70,TCP,54,34692  >  9001 [ACK] Seq=4260571 Ack=75711051 Win=65535 Len=0
1,2.0690680000000157,54.93.77.70,10.0.2.15,TCP,1502,"9001  >  34692 [PSH, ACK] Seq=75711051 Ack=4260571 Win=65535 Len=1448 [TCP segment of a reassembled PDU]"
1,2.069118000000117,10.0.2.15,54.93.77.70,TCP,54,34692  >  9001 [ACK] Seq=4260571 Ack=75712499 Win=65535 Len=0
1,2.078817000000072,54.93.77.70,10.0.2.15,TLSv1.2,916,"Application Data, Application Data, Application Data"
1,2.0863600000000133,54.93.77.70,10.0.2.15,TLSv1.2,7294,Application Data
1,2.0864550000001145,10.0.2.15,54.93.77.70,TCP,54,34692  >  9001 [ACK] Seq=4260571 Ack=75720601 Win=65535 Len=0
1,2.086614000000054,10.0.2.15,54.93.77.70,TLSv1.2,590,Application Data
1,2.0866829999999936,54.93.77.70,10.0.2.15,TCP,60,9001  >  34692 [ACK] Seq=75720601 Ack=4261107 Win=65535 Len=0
1,2.0868000000000393,54.93.77.70,10.0.2.15,TLSv1.2,2950,Application Data [TCP segment of a reassembled PDU]
1,2.086851000000024,10.0.2.15,54.93.77.70,TCP,54,34692  >  9001 [ACK] Seq=4261107 Ack=75723497 Win=65535 Len=0
1,2.095168000000058,54.93.77.70,10.0.2.15,TLSv1.2,7294,"Application Data, Application Data"
1,2.0952409999999873,10.0.2.15,54.93.77.70,TCP,54,34692  >  9001 [ACK] Seq=4261107 Ack=75730737 Win=65535 Len=0
1,2.095749000000069,54.93.77.70,10.0.2.15,TLSv1.2,2950,Application Data [TCP segment of a reassembled PDU]
1,2.095792000000074,10.0.2.15,54.93.77.70,TCP,54,34692  >  9001 [ACK] Seq=4261107 Ack=75733633 Win=65535 Len=0
1,2.0959710000001905,10.0.2.15,54.93.77.70,TLSv1.2,590,Application Data
1,2.096046000000115,54.93.77.70,10.0.2.15,TCP,60,9001  >  34692 [ACK] Seq=75733633 Ack=4261643 Win=65535 Len=0
1,2.0960560000000896,54.93.77.70,10.0.2.15,TCP,1502,"9001  >  34692 [PSH, ACK] Seq=75733633 Ack=4261643 Win=65535 Len=1448 [TCP segment of a reassembled PDU]"
1,2.0960600000000795,54.93.77.70,10.0.2.15,TLSv1.2,568,Application Data
1,2.0961090000000695,10.0.2.15,54.93.77.70,TCP,54,34692  >  9001 [ACK] Seq=4261643 Ack=75735595 Win=65535 Len=0
1,2.113542000000052,54.93.77.70,10.0.2.15,TCP,2950,"9001  >  34692 [PSH, ACK] Seq=75735595 Ack=4261643 Win=65535 Len=2896 [TCP segment of a reassembled PDU]"
1,2.113602000000128,10.0.2.15,54.93.77.70,TCP,54,34692  >  9001 [ACK] Seq=4261643 Ack=75738491 Win=65535 Len=0
1,2.1150790000001507,54.93.77.70,10.0.2.15,TLSv1.2,5298,"Application Data, Application Data"
1,2.115097999999989,54.93.77.70,10.0.2.15,TLSv1.2,4398,Application Data
1,2.115169000000151,10.0.2.15,54.93.77.70,TCP,54,34692  >  9001 [ACK] Seq=4261643 Ack=75748079 Win=65535 Len=0
1,2.1154710000000705,10.0.2.15,54.93.77.70,TLSv1.2,590,Application Data
1,2.11558100000002,54.93.77.70,10.0.2.15,TCP,60,9001  >  34692 [ACK] Seq=75748079 Ack=4262179 Win=65535 Len=0
1,2.12379900000019,54.93.77.70,10.0.2.15,TLSv1.2,2950,Application Data [TCP segment of a reassembled PDU]
1,2.1238600000001497,10.0.2.15,54.93.77.70,TCP,54,34692  >  9001 [ACK] Seq=4262179 Ack=75750975 Win=65535 Len=0
1,2.1312950000001365,54.93.77.70,10.0.2.15,TLSv1.2,1232,Application Data
1,2.1435230000001866,54.93.77.70,10.0.2.15,TLSv1.2,7294,"Application Data, Application Data"
1,2.1436210000001665,10.0.2.15,54.93.77.70,TCP,54,34692  >  9001 [ACK] Seq=4262179 Ack=75759393 Win=65535 Len=0
1,2.1517750000000433,54.93.77.70,10.0.2.15,TLSv1.2,5846,"Application Data, Application Data"
1,2.151890000000094,10.0.2.15,54.93.77.70,TCP,54,34692  >  9001 [ACK] Seq=4262179 Ack=75765185 Win=65535 Len=0
1,2.1519230000001244,54.93.77.70,10.0.2.15,TCP,1502,"9001  >  34692 [PSH, ACK] Seq=75765185 Ack=4262179 Win=65535 Len=1448 [TCP segment of a reassembled PDU]"
1,2.1520090000001346,10.0.2.15,54.93.77.70,TCP,54,34692  >  9001 [ACK] Seq=4262179 Ack=75766633 Win=65535 Len=0
1,2.1616770000000542,54.93.77.70,10.0.2.15,TLSv1.2,590,Application Data
1,2.1620170000001053,10.0.2.15,54.93.77.70,TLSv1.2,590,Application Data
1,2.162142000000131,54.93.77.70,10.0.2.15,TCP,60,9001  >  34692 [ACK] Seq=75767169 Ack=4262715 Win=65535 Len=0
1,2.172027000000071,10.0.2.15,54.93.77.70,TLSv1.2,590,Application Data
1,2.172185000000127,54.93.77.70,10.0.2.15,TCP,60,9001  >  34692 [ACK] Seq=75767169 Ack=4263251 Win=65535 Len=0
1,2.235793000000058,62.210.85.178,10.0.2.15,TLSv1.2,1618,Application Data
1,2.2359220000000732,10.0.2.15,62.210.85.178,TCP,54,35978  >  9001 [ACK] Seq=75947301 Ack=4270737 Win=65535 Len=0
1,2.318757000000005,62.210.85.178,10.0.2.15,TLSv1.2,1104,Application Data
1,2.319255000000112,10.0.2.15,62.210.85.178,TLSv1.2,590,Application Data
1,2.3193740000001526,62.210.85.178,10.0.2.15,TCP,60,9001  >  35978 [ACK] Seq=4271787 Ack=75947837 Win=65535 Len=0
1,2.5171100000000024,54.93.77.70,10.0.2.15,TLSv1.2,590,Application Data
1,2.517473999999993,10.0.2.15,54.93.77.70,TLSv1.2,590,Application Data
1,2.51758000000018,54.93.77.70,10.0.2.15,TCP,60,9001  >  34692 [ACK] Seq=75767705 Ack=4263787 Win=65535 Len=0
1,3.131460000000061,62.210.85.178,10.0.2.15,TLSv1.2,590,Application Data
1,3.1376650000001973,10.0.2.15,62.210.85.178,TLSv1.2,590,Application Data
1,3.1378429999999753,62.210.85.178,10.0.2.15,TCP,60,9001  >  35978 [ACK] Seq=4272323 Ack=75948373 Win=65535 Len=0
1,3.1515340000000833,10.0.2.15,62.210.85.178,TLSv1.2,4124,Application Data
1,3.151638000000048,10.0.2.15,62.210.85.178,TCP,2974,35978  >  9001 [ACK] Seq=75952443 Ack=4272323 Win=65535 Len=2920 [TCP segment of a reassembled PDU]
1,3.1516800000001695,62.210.85.178,10.0.2.15,TCP,60,9001  >  35978 [ACK] Seq=4272323 Ack=75949833 Win=65535 Len=0
1,3.151692000000139,62.210.85.178,10.0.2.15,TCP,60,9001  >  35978 [ACK] Seq=4272323 Ack=75951293 Win=65535 Len=0
1,3.151695000000018,62.210.85.178,10.0.2.15,TCP,60,9001  >  35978 [ACK] Seq=4272323 Ack=75952443 Win=65535 Len=0
1,3.151698000000124,62.210.85.178,10.0.2.15,TCP,60,9001  >  35978 [ACK] Seq=4272323 Ack=75953903 Win=65535 Len=0
1,3.151700000000119,62.210.85.178,10.0.2.15,TCP,60,9001  >  35978 [ACK] Seq=4272323 Ack=75955363 Win=65535 Len=0
1,3.151738000000023,10.0.2.15,62.210.85.178,TLSv1.2,1204,Application Data
1,3.1517720000001646,62.210.85.178,10.0.2.15,TCP,60,9001  >  35978 [ACK] Seq=4272323 Ack=75956513 Win=65535 Len=0
1,3.151828000000023,10.0.2.15,62.210.85.178,TLSv1.2,4124,Application Data
1,3.1519200000000183,62.210.85.178,10.0.2.15,TCP,60,9001  >  35978 [ACK] Seq=4272323 Ack=75957973 Win=65535 Len=0
1,3.151929999999993,62.210.85.178,10.0.2.15,TCP,60,9001  >  35978 [ACK] Seq=4272323 Ack=75959433 Win=65535 Len=0
1,3.151933000000099,62.210.85.178,10.0.2.15,TCP,60,9001  >  35978 [ACK] Seq=4272323 Ack=75960583 Win=65535 Len=0
1,3.151994000000059,10.0.2.15,62.210.85.178,TLSv1.2,4124,Application Data
1,3.152041000000054,62.210.85.178,10.0.2.15,TCP,60,9001  >  35978 [ACK] Seq=4272323 Ack=75962043 Win=65535 Len=0
1,3.152050000000145,62.210.85.178,10.0.2.15,TCP,60,9001  >  35978 [ACK] Seq=4272323 Ack=75963503 Win=65535 Len=0
1,3.152113999999983,10.0.2.15,62.210.85.178,TLSv1.2,2974,Application Data
1,3.1521529999999984,62.210.85.178,10.0.2.15,TCP,60,9001  >  35978 [ACK] Seq=4272323 Ack=75964653 Win=65535 Len=0
1,3.1521600000000944,62.210.85.178,10.0.2.15,TCP,60,9001  >  35978 [ACK] Seq=4272323 Ack=75966113 Win=65535 Len=0
1,3.1521630000002006,62.210.85.178,10.0.2.15,TCP,60,9001  >  35978 [ACK] Seq=4272323 Ack=75967573 Win=65535 Len=0
1,3.1521900000000187,10.0.2.15,62.210.85.178,TLSv1.2,1226,Application Data
1,3.1522240000001602,62.210.85.178,10.0.2.15,TCP,60,9001  >  35978 [ACK] Seq=4272323 Ack=75968745 Win=65535 Len=0
1,3.1522640000000592,10.0.2.15,62.210.85.178,TLSv1.2,4124,Application Data
1,3.1522990000000846,62.210.85.178,10.0.2.15,TCP,60,9001  >  35978 [ACK] Seq=4272323 Ack=75970205 Win=65535 Len=0
1,3.1523060000001806,62.210.85.178,10.0.2.15,TCP,60,9001  >  35978 [ACK] Seq=4272323 Ack=75971665 Win=65535 Len=0
1,3.1523090000000593,62.210.85.178,10.0.2.15,TCP,60,9001  >  35978 [ACK] Seq=4272323 Ack=75972815 Win=65535 Len=0
1,3.152345000000196,10.0.2.15,62.210.85.178,TLSv1.2,3030,Application Data
1,3.1523819999999887,62.210.85.178,10.0.2.15,TCP,60,9001  >  35978 [ACK] Seq=4272323 Ack=75974275 Win=65535 Len=0
1,3.152390000000196,62.210.85.178,10.0.2.15,TCP,60,9001  >  35978 [ACK] Seq=4272323 Ack=75975735 Win=65535 Len=0
1,3.1523930000000746,62.210.85.178,10.0.2.15,TCP,60,9001  >  35978 [ACK] Seq=4272323 Ack=75975791 Win=65535 Len=0
1,3.1619290000001,10.0.2.15,62.210.85.178,TLSv1.2,4124,Application Data
1,3.1622580000000653,62.210.85.178,10.0.2.15,TCP,60,9001  >  35978 [ACK] Seq=4272323 Ack=75977251 Win=65535 Len=0
1,3.1622960000001967,62.210.85.178,10.0.2.15,TCP,60,9001  >  35978 [ACK] Seq=4272323 Ack=75978711 Win=65535 Len=0
1,3.1623010000000704,62.210.85.178,10.0.2.15,TCP,60,9001  >  35978 [ACK] Seq=4272323 Ack=75979861 Win=65535 Len=0
1,3.162409000000025,10.0.2.15,62.210.85.178,TLSv1.2,4124,Application Data
1,3.1624990000000253,62.210.85.178,10.0.2.15,TCP,60,9001  >  35978 [ACK] Seq=4272323 Ack=75981321 Win=65535 Len=0
1,3.162509,62.210.85.178,10.0.2.15,TCP,60,9001  >  35978 [ACK] Seq=4272323 Ack=75982781 Win=65535 Len=0
1,3.162514000000101,62.210.85.178,10.0.2.15,TCP,60,9001  >  35978 [ACK] Seq=4272323 Ack=75983931 Win=65535 Len=0
1,3.1625900000001366,10.0.2.15,62.210.85.178,TLSv1.2,4124,Application Data
1,3.162659000000076,62.210.85.178,10.0.2.15,TCP,60,9001  >  35978 [ACK] Seq=4272323 Ack=75985391 Win=65535 Len=0
1,3.162669000000051,62.210.85.178,10.0.2.15,TCP,60,9001  >  35978 [ACK] Seq=4272323 Ack=75986851 Win=65535 Len=0
1,3.162674000000152,62.210.85.178,10.0.2.15,TCP,60,9001  >  35978 [ACK] Seq=4272323 Ack=75988001 Win=65535 Len=0
1,3.1627260000000206,10.0.2.15,62.210.85.178,TLSv1.2,4124,Application Data
1,3.162908000000016,62.210.85.178,10.0.2.15,TCP,60,9001  >  35978 [ACK] Seq=4272323 Ack=75989461 Win=65535 Len=0
1,3.1629260000001977,62.210.85.178,10.0.2.15,TCP,60,9001  >  35978 [ACK] Seq=4272323 Ack=75990921 Win=65535 Len=0
1,3.1629310000000714,62.210.85.178,10.0.2.15,TCP,60,9001  >  35978 [ACK] Seq=4272323 Ack=75992071 Win=65535 Len=0
1,3.1629740000000766,10.0.2.15,62.210.85.178,TLSv1.2,332,Application Data
1,3.163385000000062,62.210.85.178,10.0.2.15,TCP,60,9001  >  35978 [ACK] Seq=4272323 Ack=75992349 Win=65535 Len=0
1,3.163763000000017,10.0.2.15,62.210.85.178,TLSv1.2,3868,Application Data
1,3.164023000000043,10.0.2.15,62.210.85.178,TCP,2974,35978  >  9001 [ACK] Seq=75996163 Ack=4272323 Win=65535 Len=2920 [TCP segment of a reassembled PDU]
1,3.1640570000001844,62.210.85.178,10.0.2.15,TCP,60,9001  >  35978 [ACK] Seq=4272323 Ack=75993809 Win=65535 Len=0
1,3.164070000000038,62.210.85.178,10.0.2.15,TCP,60,9001  >  35978 [ACK] Seq=4272323 Ack=75995269 Win=65535 Len=0
1,3.1640760000000228,62.210.85.178,10.0.2.15,TCP,60,9001  >  35978 [ACK] Seq=4272323 Ack=75996163 Win=65535 Len=0
1,3.1641349999999875,62.210.85.178,10.0.2.15,TCP,60,9001  >  35978 [ACK] Seq=4272323 Ack=75997623 Win=65535 Len=0
1,3.1641420000000835,62.210.85.178,10.0.2.15,TCP,60,9001  >  35978 [ACK] Seq=4272323 Ack=75999083 Win=65535 Len=0
1,3.1641830000000937,10.0.2.15,62.210.85.178,TLSv1.2,1204,Application Data
1,3.164226000000099,62.210.85.178,10.0.2.15,TCP,60,9001  >  35978 [ACK] Seq=4272323 Ack=76000233 Win=65535 Len=0
1,3.1643300000000636,10.0.2.15,62.210.85.178,TLSv1.2,3030,Application Data
1,3.1643790000000536,62.210.85.178,10.0.2.15,TCP,60,9001  >  35978 [ACK] Seq=4272323 Ack=76001693 Win=65535 Len=0
1,3.1643890000000283,62.210.85.178,10.0.2.15,TCP,60,9001  >  35978 [ACK] Seq=4272323 Ack=76003153 Win=65535 Len=0
1,3.164393000000018,62.210.85.178,10.0.2.15,TCP,60,9001  >  35978 [ACK] Seq=4272323 Ack=76003209 Win=65535 Len=0
1,3.1736590000000433,10.0.2.15,62.210.85.178,TLSv1.2,4124,Application Data
1,3.1737550000000283,10.0.2.15,62.210.85.178,TCP,2974,35978  >  9001 [ACK] Seq=76007279 Ack=4272323 Win=65535 Len=2920 [TCP segment of a reassembled PDU]
1,3.1737950000001547,62.210.85.178,10.0.2.15,TCP,60,9001  >  35978 [ACK] Seq=4272323 Ack=76004669 Win=65535 Len=0
1,3.1738050000001294,62.210.85.178,10.0.2.15,TCP,60,9001  >  35978 [ACK] Seq=4272323 Ack=76006129 Win=65535 Len=0
1,3.1738090000001193,62.210.85.178,10.0.2.15,TCP,60,9001  >  35978 [ACK] Seq=4272323 Ack=76007279 Win=65535 Len=0
1,3.1738130000001092,62.210.85.178,10.0.2.15,TCP,60,9001  >  35978 [ACK] Seq=4272323 Ack=76008739 Win=65535 Len=0
1,3.173817999999983,62.210.85.178,10.0.2.15,TCP,60,9001  >  35978 [ACK] Seq=4272323 Ack=76010199 Win=65535 Len=0
1,3.1738600000001043,10.0.2.15,62.210.85.178,TLSv1.2,1204,Application Data
1,3.173905999999988,62.210.85.178,10.0.2.15,TCP,60,9001  >  35978 [ACK] Seq=4272323 Ack=76011349 Win=65535 Len=0
1,3.1739570000002004,10.0.2.15,62.210.85.178,TLSv1.2,4124,Application Data
1,3.1740389999999934,10.0.2.15,62.210.85.178,TCP,2974,35978  >  9001 [ACK] Seq=76015419 Ack=4272323 Win=65535 Len=2920 [TCP segment of a reassembled PDU]
1,3.1740610000001652,62.210.85.178,10.0.2.15,TCP,60,9001  >  35978 [ACK] Seq=4272323 Ack=76012809 Win=65535 Len=0
1,3.174068000000034,62.210.85.178,10.0.2.15,TCP,60,9001  >  35978 [ACK] Seq=4272323 Ack=76014269 Win=65535 Len=0
1,3.1740720000000238,62.210.85.178,10.0.2.15,TCP,60,9001  >  35978 [ACK] Seq=4272323 Ack=76015419 Win=65535 Len=0
1,3.1740760000000137,62.210.85.178,10.0.2.15,TCP,60,9001  >  35978 [ACK] Seq=4272323 Ack=76016879 Win=65535 Len=0
1,3.1740800000000036,62.210.85.178,10.0.2.15,TCP,60,9001  >  35978 [ACK] Seq=4272323 Ack=76018339 Win=65535 Len=0
1,3.174118000000135,10.0.2.15,62.210.85.178,TLSv1.2,1204,Application Data
1,3.174154000000044,62.210.85.178,10.0.2.15,TCP,60,9001  >  35978 [ACK] Seq=4272323 Ack=76019489 Win=65535 Len=0
1,3.174199000000044,10.0.2.15,62.210.85.178,TLSv1.2,332,Application Data
1,3.1742450000001554,62.210.85.178,10.0.2.15,TCP,60,9001  >  35978 [ACK] Seq=4272323 Ack=76019767 Win=65535 Len=0
1,3.174317000000201,10.0.2.15,62.210.85.178,TLSv1.2,3868,Application Data
1,3.1743619999999737,62.210.85.178,10.0.2.15,TCP,60,9001  >  35978 [ACK] Seq=4272323 Ack=76021227 Win=65535 Len=0
1,3.1743690000000697,62.210.85.178,10.0.2.15,TCP,60,9001  >  35978 [ACK] Seq=4272323 Ack=76022687 Win=65535 Len=0
1,3.174374000000171,62.210.85.178,10.0.2.15,TCP,60,9001  >  35978 [ACK] Seq=4272323 Ack=76023581 Win=65535 Len=0
1,3.1744200000000546,10.0.2.15,62.210.85.178,TLSv1.2,2452,Application Data
1,3.174460000000181,62.210.85.178,10.0.2.15,TCP,60,9001  >  35978 [ACK] Seq=4272323 Ack=76025041 Win=65535 Len=0
1,3.174466000000166,62.210.85.178,10.0.2.15,TCP,60,9001  >  35978 [ACK] Seq=4272323 Ack=76025979 Win=65535 Len=0
1,3.2475650000001224,54.93.77.70,10.0.2.15,TLSv1.2,590,Application Data
1,3.27183500000001,54.93.77.70,10.0.2.15,TCP,2950,"9001  >  34692 [PSH, ACK] Seq=75768241 Ack=4263787 Win=65535 Len=2896 [TCP segment of a reassembled PDU]"
1,3.2719540000000507,10.0.2.15,54.93.77.70,TCP,54,34692  >  9001 [ACK] Seq=4263787 Ack=75771137 Win=65535 Len=0
1,3.2795000000000982,54.93.77.70,10.0.2.15,TLSv1.2,4398,"Application Data, Application Data"
1,3.2795750000000226,10.0.2.15,54.93.77.70,TCP,54,34692  >  9001 [ACK] Seq=4263787 Ack=75775481 Win=65535 Len=0
1,3.289367000000084,54.93.77.70,10.0.2.15,TCP,2950,"9001  >  34692 [PSH, ACK] Seq=75775481 Ack=4263787 Win=65535 Len=2896 [TCP segment of a reassembled PDU]"
1,3.289416000000074,10.0.2.15,54.93.77.70,TCP,54,34692  >  9001 [ACK] Seq=4263787 Ack=75778377 Win=65535 Len=0
1,3.290132000000085,54.93.77.70,10.0.2.15,TLSv1.2,5448,"Application Data, Application Data, Application Data"
1,3.290194000000156,10.0.2.15,54.93.77.70,TCP,54,34692  >  9001 [ACK] Seq=4263787 Ack=75783771 Win=65535 Len=0
1,3.290472000000136,10.0.2.15,54.93.77.70,TLSv1.2,590,Application Data
1,3.290578000000096,54.93.77.70,10.0.2.15,TCP,60,9001  >  34692 [ACK] Seq=75783771 Ack=4264323 Win=65535 Len=0
1,3.2997199999999793,54.93.77.70,10.0.2.15,TLSv1.2,4398,Application Data
1,3.29978200000005,10.0.2.15,54.93.77.70,TCP,54,34692  >  9001 [ACK] Seq=4264323 Ack=75788115 Win=65535 Len=0
1,3.306538000000046,54.93.77.70,10.0.2.15,TLSv1.2,1408,Application Data
1,3.3077330000000984,54.93.77.70,10.0.2.15,TLSv1.2,7294,Application Data
1,3.3078870000001643,10.0.2.15,54.93.77.70,TCP,54,34692  >  9001 [ACK] Seq=4264323 Ack=75796709 Win=65535 Len=0
1,3.3150270000001,54.93.77.70,10.0.2.15,TLSv1.2,4398,Application Data [TCP segment of a reassembled PDU]
1,3.315117999999984,10.0.2.15,54.93.77.70,TCP,54,34692  >  9001 [ACK] Seq=4264323 Ack=75801053 Win=65535 Len=0
1,3.3153990000000704,10.0.2.15,54.93.77.70,TLSv1.2,590,Application Data
1,3.3155390000001717,54.93.77.70,10.0.2.15,TCP,60,9001  >  34692 [ACK] Seq=75801053 Ack=4264859 Win=65535 Len=0
1,3.31555400000002,54.93.77.70,10.0.2.15,TLSv1.2,4398,"Application Data, Application Data"
1,3.315597000000025,10.0.2.15,54.93.77.70,TCP,54,34692  >  9001 [ACK] Seq=4264859 Ack=75805397 Win=65535 Len=0
1,3.316669000000047,54.93.77.70,10.0.2.15,TCP,2950,"9001  >  34692 [PSH, ACK] Seq=75805397 Ack=4264859 Win=65535 Len=2896 [TCP segment of a reassembled PDU]"
1,3.3167130000001634,10.0.2.15,54.93.77.70,TCP,54,34692  >  9001 [ACK] Seq=4264859 Ack=75808293 Win=65535 Len=0
1,3.324689000000035,54.93.77.70,10.0.2.15,TLSv1.2,872,Application Data
1,3.326524000000063,54.93.77.70,10.0.2.15,TLSv1.2,7294,Application Data
1,3.3265989999999874,10.0.2.15,54.93.77.70,TCP,54,34692  >  9001 [ACK] Seq=4264859 Ack=75816351 Win=65535 Len=0
1,3.3349100000000362,54.93.77.70,10.0.2.15,TLSv1.2,2950,Application Data [TCP segment of a reassembled PDU]
1,3.334965000000011,10.0.2.15,54.93.77.70,TCP,54,34692  >  9001 [ACK] Seq=4264859 Ack=75819247 Win=65535 Len=0
1,3.3358210000001236,54.93.77.70,10.0.2.15,TLSv1.2,5846,"Application Data, Application Data"
1,3.335898000000043,10.0.2.15,54.93.77.70,TCP,54,34692  >  9001 [ACK] Seq=4264859 Ack=75825039 Win=65535 Len=0
1,3.3360720000000583,10.0.2.15,54.93.77.70,TLSv1.2,590,Application Data
1,3.33620000000019,54.93.77.70,10.0.2.15,TCP,60,9001  >  34692 [ACK] Seq=75825039 Ack=4265395 Win=65535 Len=0
1,3.343224000000191,54.93.77.70,10.0.2.15,TLSv1.2,684,Application Data
1,3.346781000000192,54.93.77.70,10.0.2.15,TLSv1.2,4398,Application Data
1,3.347064000000046,10.0.2.15,54.93.77.70,TCP,54,34692  >  9001 [ACK] Seq=4265395 Ack=75830013 Win=65535 Len=0
1,3.3483530000000883,54.93.77.70,10.0.2.15,TLSv1.2,5846,Application Data [TCP segment of a reassembled PDU]
1,3.34948600000007,10.0.2.15,54.93.77.70,TCP,54,34692  >  9001 [ACK] Seq=4265395 Ack=75835805 Win=65535 Len=0
1,3.363080000000082,54.93.77.70,10.0.2.15,TLSv1.2,7294,"Application Data, Application Data"
1,3.3631850000001577,10.0.2.15,54.93.77.70,TCP,54,34692  >  9001 [ACK] Seq=4265395 Ack=75843045 Win=65535 Len=0
1,3.363458000000037,54.93.77.70,10.0.2.15,TLSv1.2,1292,Application Data
1,3.363508000000138,10.0.2.15,54.93.77.70,TLSv1.2,590,Application Data
1,3.363614000000098,54.93.77.70,10.0.2.15,TCP,60,9001  >  34692 [ACK] Seq=75844283 Ack=4265931 Win=65535 Len=0
1,3.374570000000176,54.93.77.70,10.0.2.15,TCP,1502,"9001  >  34692 [PSH, ACK] Seq=75844283 Ack=4265931 Win=65535 Len=1448 [TCP segment of a reassembled PDU]"
1,3.374631000000136,10.0.2.15,54.93.77.70,TCP,54,34692  >  9001 [ACK] Seq=4265931 Ack=75845731 Win=65535 Len=0
1,3.3801330000001144,54.93.77.70,10.0.2.15,TLSv1.2,170,Application Data
1,3.3820760000000973,10.0.2.15,54.93.77.70,TLSv1.2,590,Application Data
1,3.383299000000079,54.93.77.70,10.0.2.15,TCP,60,9001  >  34692 [ACK] Seq=75845847 Ack=4266467 Win=65535 Len=0
1,3.391553000000158,10.0.2.15,54.93.77.70,TLSv1.2,590,Application Data
1,3.391717000000199,54.93.77.70,10.0.2.15,TCP,60,9001  >  34692 [ACK] Seq=75845847 Ack=4267003 Win=65535 Len=0
1,3.43969200000015,62.210.85.178,10.0.2.15,TLSv1.2,1104,Application Data
1,3.4828950000000987,10.0.2.15,62.210.85.178,TCP,54,35978  >  9001 [ACK] Seq=76025979 Ack=4273373 Win=65535 Len=0
1,3.5001740000000154,62.210.85.178,10.0.2.15,TLSv1.2,1104,Application Data
1,3.500254000000041,10.0.2.15,62.210.85.178,TCP,54,35978  >  9001 [ACK] Seq=76025979 Ack=4274423 Win=65535 Len=0
1,3.5718590000001313,62.210.85.178,10.0.2.15,TLSv1.2,1104,Application Data
1,3.571965000000091,10.0.2.15,62.210.85.178,TCP,54,35978  >  9001 [ACK] Seq=76025979 Ack=4275473 Win=65535 Len=0
1,3.5722500000001673,10.0.2.15,62.210.85.178,TLSv1.2,590,Application Data
1,3.572352000000137,62.210.85.178,10.0.2.15,TCP,60,9001  >  35978 [ACK] Seq=4275473 Ack=76026515 Win=65535 Len=0
1,3.6798949999999877,54.93.77.70,10.0.2.15,TLSv1.2,590,Application Data
1,3.68028100000015,10.0.2.15,54.93.77.70,TLSv1.2,590,Application Data
1,3.6803970000000845,54.93.77.70,10.0.2.15,TCP,60,9001  >  34692 [ACK] Seq=75846383 Ack=4267539 Win=65535 Len=0
1,3.7857870000000275,62.210.85.178,10.0.2.15,TLSv1.2,590,Application Data
1,3.789492999999993,10.0.2.15,62.210.85.178,TLSv1.2,590,Application Data
1,3.789651000000049,62.210.85.178,10.0.2.15,TCP,60,9001  >  35978 [ACK] Seq=4276009 Ack=76027051 Win=65535 Len=0
1,3.803044,10.0.2.15,62.210.85.178,TLSv1.2,4124,Application Data
1,3.803148000000192,10.0.2.15,62.210.85.178,TCP,2974,35978  >  9001 [ACK] Seq=76031121 Ack=4276009 Win=65535 Len=2920 [TCP segment of a reassembled PDU]
1,3.8032000000000608,62.210.85.178,10.0.2.15,TCP,60,9001  >  35978 [ACK] Seq=4276009 Ack=76028511 Win=65535 Len=0
1,3.8032100000000355,62.210.85.178,10.0.2.15,TCP,60,9001  >  35978 [ACK] Seq=4276009 Ack=76029971 Win=65535 Len=0
1,3.8032150000001366,62.210.85.178,10.0.2.15,TCP,60,9001  >  35978 [ACK] Seq=4276009 Ack=76031121 Win=65535 Len=0
1,3.8032200000000103,62.210.85.178,10.0.2.15,TCP,60,9001  >  35978 [ACK] Seq=4276009 Ack=76032581 Win=65535 Len=0
1,3.8032230000001164,62.210.85.178,10.0.2.15,TCP,60,9001  >  35978 [ACK] Seq=4276009 Ack=76034041 Win=65535 Len=0
1,3.8032580000001417,10.0.2.15,62.210.85.178,TLSv1.2,1204,Application Data
1,3.803293000000167,62.210.85.178,10.0.2.15,TCP,60,9001  >  35978 [ACK] Seq=4276009 Ack=76035191 Win=65535 Len=0
1,3.803338000000167,10.0.2.15,62.210.85.178,TLSv1.2,4124,Application Data
1,3.8033720000000812,62.210.85.178,10.0.2.15,TCP,60,9001  >  35978 [ACK] Seq=4276009 Ack=76036651 Win=65535 Len=0
1,3.803380000000061,62.210.85.178,10.0.2.15,TCP,60,9001  >  35978 [ACK] Seq=4276009 Ack=76038111 Win=65535 Len=0
1,3.803383000000167,62.210.85.178,10.0.2.15,TCP,60,9001  >  35978 [ACK] Seq=4276009 Ack=76039261 Win=65535 Len=0
1,3.8034220000001824,10.0.2.15,62.210.85.178,TLSv1.2,4124,Application Data
1,3.8034560000000965,62.210.85.178,10.0.2.15,TCP,60,9001  >  35978 [ACK] Seq=4276009 Ack=76040721 Win=65535 Len=0
1,3.8034630000001926,62.210.85.178,10.0.2.15,TCP,60,9001  >  35978 [ACK] Seq=4276009 Ack=76042181 Win=65535 Len=0
1,3.8035050000000865,62.210.85.178,10.0.2.15,TCP,60,9001  >  35978 [ACK] Seq=4276009 Ack=76043331 Win=65535 Len=0
1,3.8035390000000007,10.0.2.15,62.210.85.178,TLSv1.2,332,Application Data
1,3.803572000000031,62.210.85.178,10.0.2.15,TCP,60,9001  >  35978 [ACK] Seq=4276009 Ack=76043609 Win=65535 Len=0
1,3.803625000000011,10.0.2.15,62.210.85.178,TLSv1.2,3868,Application Data
1,3.803662000000031,62.210.85.178,10.0.2.15,TCP,60,9001  >  35978 [ACK] Seq=4276009 Ack=76045069 Win=65535 Len=0
1,3.803668000000016,62.210.85.178,10.0.2.15,TCP,60,9001  >  35978 [ACK] Seq=4276009 Ack=76046529 Win=65535 Len=0
1,3.803671000000122,62.210.85.178,10.0.2.15,TCP,60,9001  >  35978 [ACK] Seq=4276009 Ack=76047423 Win=65535 Len=0
1,3.8037080000001424,10.0.2.15,62.210.85.178,TLSv1.2,3994,Application Data
1,3.8037430000001677,62.210.85.178,10.0.2.15,TCP,60,9001  >  35978 [ACK] Seq=4276009 Ack=76048883 Win=65535 Len=0
1,3.8037500000000364,62.210.85.178,10.0.2.15,TCP,60,9001  >  35978 [ACK] Seq=4276009 Ack=76050343 Win=65535 Len=0
1,3.8037530000001425,62.210.85.178,10.0.2.15,TCP,60,9001  >  35978 [ACK] Seq=4276009 Ack=76051363 Win=65535 Len=0
1,3.9054009999999835,54.93.77.70,10.0.2.15,TCP,2950,"9001  >  34692 [PSH, ACK] Seq=75846383 Ack=4267539 Win=65535 Len=2896 [TCP segment of a reassembled PDU]"
1,3.905524000000014,10.0.2.15,54.93.77.70,TCP,54,34692  >  9001 [ACK] Seq=4267539 Ack=75849279 Win=65535 Len=0
1,3.9060480000000553,54.93.77.70,10.0.2.15,TLSv1.2,4912,"Application Data, Application Data"
1,3.906112000000121,10.0.2.15,54.93.77.70,TCP,54,34692  >  9001 [ACK] Seq=4267539 Ack=75854137 Win=65535 Len=0
1,3.9194910000001073,54.93.77.70,10.0.2.15,TLSv1.2,5846,Application Data
1,3.919548000000077,10.0.2.15,54.93.77.70,TCP,54,34692  >  9001 [ACK] Seq=4267539 Ack=75859929 Win=65535 Len=0
1,3.920281000000159,54.93.77.70,10.0.2.15,TLSv1.2,2950,Application Data [TCP segment of a reassembled PDU]
1,3.920336000000134,10.0.2.15,54.93.77.70,TCP,54,34692  >  9001 [ACK] Seq=4267539 Ack=75862825 Win=65535 Len=0
1,3.9213130000000547,54.93.77.70,10.0.2.15,TCP,2950,"9001  >  34692 [PSH, ACK] Seq=75862825 Ack=4267539 Win=65535 Len=2896 [TCP segment of a reassembled PDU]"
1,3.921359000000166,10.0.2.15,54.93.77.70,TCP,54,34692  >  9001 [ACK] Seq=4267539 Ack=75865721 Win=65535 Len=0
1,3.9222920000001977,54.93.77.70,10.0.2.15,TLSv1.2,894,"Application Data, Application Data"
1,3.9628999999999905,10.0.2.15,54.93.77.70,TCP,54,34692  >  9001 [ACK] Seq=4267539 Ack=75866561 Win=65535 Len=0
1,3.9827500000001237,54.93.77.70,10.0.2.15,TLSv1.2,590,Application Data
1,3.9828529999999773,10.0.2.15,54.93.77.70,TCP,54,34692  >  9001 [ACK] Seq=4267539 Ack=75867097 Win=65535 Len=0
1,4.360668000000032,54.93.77.70,10.0.2.15,TCP,2950,"9001  >  34692 [PSH, ACK] Seq=75867097 Ack=4267539 Win=65535 Len=2896 [TCP segment of a reassembled PDU]"
1,4.360757000000149,10.0.2.15,54.93.77.70,TCP,54,34692  >  9001 [ACK] Seq=4267539 Ack=75869993 Win=65535 Len=0
1,4.363243000000011,54.93.77.70,10.0.2.15,TLSv1.2,778,Application Data
1,4.363295000000107,10.0.2.15,54.93.77.70,TCP,54,34692  >  9001 [ACK] Seq=4267539 Ack=75870717 Win=65535 Len=0
1,4.363542000000052,54.93.77.70,10.0.2.15,TLSv1.2,590,Application Data
