No.,Time,Source,Destination,Protocol,Length,Info
1,0.0,62.210.85.178,10.0.2.15,TLSv1.2,590,Application Data
1,0.000202,10.0.2.15,62.210.85.178,TCP,54,35978  >  9001 [ACK] Seq=1 Ack=537 Win=65535 Len=0
1,1.914676,10.0.2.15,54.93.77.70,TLSv1.2,590,Application Data
1,1.914901,54.93.77.70,10.0.2.15,TCP,60,9001  >  34692 [ACK] Seq=1 Ack=537 Win=65535 Len=0
1,2.150363,62.210.85.178,10.0.2.15,TLSv1.2,590,Application Data
1,2.150598,10.0.2.15,62.210.85.178,TCP,54,35978  >  9001 [ACK] Seq=1 Ack=1073 Win=65535 Len=0
1,2.151695,10.0.2.15,62.210.85.178,TLSv1.2,590,Application Data
1,2.152129,62.210.85.178,10.0.2.15,TCP,60,9001  >  35978 [ACK] Seq=1073 Ack=537 Win=65535 Len=0
1,2.252949,54.93.77.70,10.0.2.15,TLSv1.2,590,Application Data
1,2.254302,10.0.2.15,54.93.77.70,TLSv1.2,1618,Application Data
1,2.254759,54.93.77.70,10.0.2.15,TCP,60,9001  >  34692 [ACK] Seq=537 Ack=2101 Win=65535 Len=0
1,2.358757,62.210.85.178,10.0.2.15,TLSv1.2,1618,Application Data
1,2.359249,10.0.2.15,62.210.85.178,TCP,54,35978  >  9001 [ACK] Seq=537 Ack=2637 Win=65535 Len=0
1,2.399687,10.0.2.15,62.210.85.178,TLSv1.2,590,Application Data
1,2.39991,62.210.85.178,10.0.2.15,TCP,60,9001  >  35978 [ACK] Seq=2637 Ack=1073 Win=65535 Len=0
1,2.411188,10.0.2.15,62.210.85.178,TLSv1.2,1618,Application Data
1,2.411413,62.210.85.178,10.0.2.15,TCP,60,9001  >  35978 [ACK] Seq=2637 Ack=2533 Win=65535 Len=0
1,2.411435,62.210.85.178,10.0.2.15,TCP,60,9001  >  35978 [ACK] Seq=2637 Ack=2637 Win=65535 Len=0
1,2.765295,54.93.77.70,10.0.2.15,TLSv1.2,590,Application Data
1,2.768188,54.93.77.70,10.0.2.15,TCP,1502,"9001  >  34692 [PSH, ACK] Seq=1073 Ack=2101 Win=65535 Len=1448 [TCP segment of a reassembled PDU]"
1,2.768373,10.0.2.15,54.93.77.70,TCP,54,34692  >  9001 [ACK] Seq=2101 Ack=2521 Win=65535 Len=0
1,2.783052,54.93.77.70,10.0.2.15,TLSv1.2,170,Application Data
1,2.786881,10.0.2.15,54.93.77.70,TLSv1.2,590,Application Data
1,2.787151,54.93.77.70,10.0.2.15,TCP,60,9001  >  34692 [ACK] Seq=2637 Ack=2637 Win=65535 Len=0
1,3.072391,62.210.85.178,10.0.2.15,TLSv1.2,590,Application Data
1,3.072832,10.0.2.15,62.210.85.178,TLSv1.2,590,Application Data
1,3.072999,62.210.85.178,10.0.2.15,TCP,60,9001  >  35978 [ACK] Seq=3173 Ack=3173 Win=65535 Len=0
1,3.165067,54.93.77.70,10.0.2.15,TLSv1.2,590,Application Data
1,3.16619,10.0.2.15,54.93.77.70,TLSv1.2,590,Application Data
1,3.166625,54.93.77.70,10.0.2.15,TCP,60,9001  >  34692 [ACK] Seq=3173 Ack=3173 Win=65535 Len=0
1,3.268143,62.210.85.178,10.0.2.15,TLSv1.2,590,Application Data
1,3.280323,10.0.2.15,62.210.85.178,TLSv1.2,590,Application Data
1,3.280554,62.210.85.178,10.0.2.15,TCP,60,9001  >  35978 [ACK] Seq=3709 Ack=3709 Win=65535 Len=0
1,3.294089,10.0.2.15,62.210.85.178,TLSv1.2,4124,Application Data
1,3.294315,62.210.85.178,10.0.2.15,TCP,60,9001  >  35978 [ACK] Seq=3709 Ack=5169 Win=65535 Len=0
1,3.294348,62.210.85.178,10.0.2.15,TCP,60,9001  >  35978 [ACK] Seq=3709 Ack=6629 Win=65535 Len=0
1,3.294356,62.210.85.178,10.0.2.15,TCP,60,9001  >  35978 [ACK] Seq=3709 Ack=7779 Win=65535 Len=0
1,3.294543,10.0.2.15,62.210.85.178,TLSv1.2,4124,Application Data
1,3.294663,10.0.2.15,62.210.85.178,TCP,2974,35978  >  9001 [ACK] Seq=11849 Ack=3709 Win=65535 Len=2920 [TCP segment of a reassembled PDU]
1,3.294723,62.210.85.178,10.0.2.15,TCP,60,9001  >  35978 [ACK] Seq=3709 Ack=9239 Win=65535 Len=0
1,3.294734,62.210.85.178,10.0.2.15,TCP,60,9001  >  35978 [ACK] Seq=3709 Ack=10699 Win=65535 Len=0
1,3.294738,62.210.85.178,10.0.2.15,TCP,60,9001  >  35978 [ACK] Seq=3709 Ack=11849 Win=65535 Len=0
1,3.29479,10.0.2.15,62.210.85.178,TLSv1.2,1204,Application Data
1,3.294851,62.210.85.178,10.0.2.15,TCP,60,9001  >  35978 [ACK] Seq=3709 Ack=13309 Win=65535 Len=0
1,3.29486,62.210.85.178,10.0.2.15,TCP,60,9001  >  35978 [ACK] Seq=3709 Ack=14769 Win=65535 Len=0
1,3.294923,10.0.2.15,62.210.85.178,TCP,2974,35978  >  9001 [ACK] Seq=15919 Ack=3709 Win=65535 Len=2920 [TCP segment of a reassembled PDU]
1,3.29499,62.210.85.178,10.0.2.15,TCP,60,9001  >  35978 [ACK] Seq=3709 Ack=15919 Win=65535 Len=0
1,3.29508,10.0.2.15,62.210.85.178,TLSv1.2,1204,Application Data
1,3.295109,62.210.85.178,10.0.2.15,TCP,60,9001  >  35978 [ACK] Seq=3709 Ack=17379 Win=65535 Len=0
1,3.29512,62.210.85.178,10.0.2.15,TCP,60,9001  >  35978 [ACK] Seq=3709 Ack=18839 Win=65535 Len=0
1,3.29519,62.210.85.178,10.0.2.15,TCP,60,9001  >  35978 [ACK] Seq=3709 Ack=19989 Win=65535 Len=0
1,3.295239,10.0.2.15,62.210.85.178,TLSv1.2,332,Application Data
1,3.295294,62.210.85.178,10.0.2.15,TCP,60,9001  >  35978 [ACK] Seq=3709 Ack=20267 Win=65535 Len=0
1,3.295374,10.0.2.15,62.210.85.178,TLSv1.2,3868,Application Data
1,3.295432,62.210.85.178,10.0.2.15,TCP,60,9001  >  35978 [ACK] Seq=3709 Ack=21727 Win=65535 Len=0
1,3.295444,62.210.85.178,10.0.2.15,TCP,60,9001  >  35978 [ACK] Seq=3709 Ack=23187 Win=65535 Len=0
1,3.295451,62.210.85.178,10.0.2.15,TCP,60,9001  >  35978 [ACK] Seq=3709 Ack=24081 Win=65535 Len=0
1,3.295507,10.0.2.15,62.210.85.178,TLSv1.2,4124,Application Data
1,3.29562,10.0.2.15,62.210.85.178,TCP,2974,35978  >  9001 [ACK] Seq=28151 Ack=3709 Win=65535 Len=2920 [TCP segment of a reassembled PDU]
1,3.295651,62.210.85.178,10.0.2.15,TCP,60,9001  >  35978 [ACK] Seq=3709 Ack=25541 Win=65535 Len=0
1,3.295662,62.210.85.178,10.0.2.15,TCP,60,9001  >  35978 [ACK] Seq=3709 Ack=27001 Win=65535 Len=0
1,3.295669,62.210.85.178,10.0.2.15,TCP,60,9001  >  35978 [ACK] Seq=3709 Ack=28151 Win=65535 Len=0
1,3.295735,62.210.85.178,10.0.2.15,TCP,60,9001  >  35978 [ACK] Seq=3709 Ack=29611 Win=65535 Len=0
1,3.295742,62.210.85.178,10.0.2.15,TCP,60,9001  >  35978 [ACK] Seq=3709 Ack=31071 Win=65535 Len=0
1,3.29578,10.0.2.15,62.210.85.178,TLSv1.2,110,Application Data
1,3.295869,62.210.85.178,10.0.2.15,TCP,60,9001  >  35978 [ACK] Seq=3709 Ack=31127 Win=65535 Len=0
1,3.30326,10.0.2.15,62.210.85.178,TLSv1.2,4124,Application Data
1,3.303418,62.210.85.178,10.0.2.15,TCP,60,9001  >  35978 [ACK] Seq=3709 Ack=32587 Win=65535 Len=0
1,3.303438,62.210.85.178,10.0.2.15,TCP,60,9001  >  35978 [ACK] Seq=3709 Ack=34047 Win=65535 Len=0
1,3.303443,62.210.85.178,10.0.2.15,TCP,60,9001  >  35978 [ACK] Seq=3709 Ack=35197 Win=65535 Len=0
1,3.303492,10.0.2.15,62.210.85.178,TLSv1.2,4124,Application Data
1,3.303557,62.210.85.178,10.0.2.15,TCP,60,9001  >  35978 [ACK] Seq=3709 Ack=36657 Win=65535 Len=0
1,3.303566,62.210.85.178,10.0.2.15,TCP,60,9001  >  35978 [ACK] Seq=3709 Ack=38117 Win=65535 Len=0
1,3.30357,62.210.85.178,10.0.2.15,TCP,60,9001  >  35978 [ACK] Seq=3709 Ack=39267 Win=65535 Len=0
1,3.303619,10.0.2.15,62.210.85.178,TLSv1.2,4124,Application Data
1,3.303662,62.210.85.178,10.0.2.15,TCP,60,9001  >  35978 [ACK] Seq=3709 Ack=40727 Win=65535 Len=0
1,3.303672,62.210.85.178,10.0.2.15,TCP,60,9001  >  35978 [ACK] Seq=3709 Ack=42187 Win=65535 Len=0
1,3.303676,62.210.85.178,10.0.2.15,TCP,60,9001  >  35978 [ACK] Seq=3709 Ack=43337 Win=65535 Len=0
1,3.303722,10.0.2.15,62.210.85.178,TLSv1.2,4124,Application Data
1,3.303846,62.210.85.178,10.0.2.15,TCP,60,9001  >  35978 [ACK] Seq=3709 Ack=44797 Win=65535 Len=0
1,3.30386,62.210.85.178,10.0.2.15,TCP,60,9001  >  35978 [ACK] Seq=3709 Ack=46257 Win=65535 Len=0
1,3.303866,62.210.85.178,10.0.2.15,TCP,60,9001  >  35978 [ACK] Seq=3709 Ack=47407 Win=65535 Len=0
1,3.303932,10.0.2.15,62.210.85.178,TLSv1.2,332,Application Data
1,3.304044,10.0.2.15,62.210.85.178,TCP,2974,35978  >  9001 [ACK] Seq=47685 Ack=3709 Win=65535 Len=2920 [TCP segment of a reassembled PDU]
1,3.304091,62.210.85.178,10.0.2.15,TCP,60,9001  >  35978 [ACK] Seq=3709 Ack=47685 Win=65535 Len=0
1,3.304101,62.210.85.178,10.0.2.15,TCP,60,9001  >  35978 [ACK] Seq=3709 Ack=49145 Win=65535 Len=0
1,3.304105,62.210.85.178,10.0.2.15,TCP,60,9001  >  35978 [ACK] Seq=3709 Ack=50605 Win=65535 Len=0
1,3.30414,10.0.2.15,62.210.85.178,TLSv1.2,948,Application Data
1,3.304182,62.210.85.178,10.0.2.15,TCP,60,9001  >  35978 [ACK] Seq=3709 Ack=51499 Win=65535 Len=0
1,3.304241,10.0.2.15,62.210.85.178,TLSv1.2,4124,Application Data
1,3.304286,62.210.85.178,10.0.2.15,TCP,60,9001  >  35978 [ACK] Seq=3709 Ack=52959 Win=65535 Len=0
1,3.304295,62.210.85.178,10.0.2.15,TCP,60,9001  >  35978 [ACK] Seq=3709 Ack=54419 Win=65535 Len=0
1,3.304298,62.210.85.178,10.0.2.15,TCP,60,9001  >  35978 [ACK] Seq=3709 Ack=55569 Win=65535 Len=0
1,3.304345,10.0.2.15,62.210.85.178,TLSv1.2,3030,Application Data
1,3.30439,62.210.85.178,10.0.2.15,TCP,60,9001  >  35978 [ACK] Seq=3709 Ack=57029 Win=65535 Len=0
1,3.304398,62.210.85.178,10.0.2.15,TCP,60,9001  >  35978 [ACK] Seq=3709 Ack=58489 Win=65535 Len=0
1,3.304402,62.210.85.178,10.0.2.15,TCP,60,9001  >  35978 [ACK] Seq=3709 Ack=58545 Win=65535 Len=0
1,3.314978,10.0.2.15,62.210.85.178,TLSv1.2,4124,Application Data
1,3.315355,62.210.85.178,10.0.2.15,TCP,60,9001  >  35978 [ACK] Seq=3709 Ack=60005 Win=65535 Len=0
1,3.315409,62.210.85.178,10.0.2.15,TCP,60,9001  >  35978 [ACK] Seq=3709 Ack=61465 Win=65535 Len=0
1,3.31543,62.210.85.178,10.0.2.15,TCP,60,9001  >  35978 [ACK] Seq=3709 Ack=62615 Win=65535 Len=0
1,3.315588,10.0.2.15,62.210.85.178,TCP,1514,35978  >  9001 [ACK] Seq=62615 Ack=3709 Win=65535 Len=1460 [TCP segment of a reassembled PDU]
1,3.315839,10.0.2.15,62.210.85.178,TLSv1.2,222,Application Data
1,3.315971,62.210.85.178,10.0.2.15,TCP,60,9001  >  35978 [ACK] Seq=3709 Ack=64075 Win=65535 Len=0
1,3.316005,62.210.85.178,10.0.2.15,TCP,60,9001  >  35978 [ACK] Seq=3709 Ack=64243 Win=65535 Len=0
1,3.385766,54.93.77.70,10.0.2.15,TLSv1.2,590,Application Data
1,3.397886,54.93.77.70,10.0.2.15,TCP,2950,"9001  >  34692 [PSH, ACK] Seq=3709 Ack=3173 Win=65535 Len=2896 [TCP segment of a reassembled PDU]"
1,3.39822,10.0.2.15,54.93.77.70,TCP,54,34692  >  9001 [ACK] Seq=3173 Ack=6605 Win=65535 Len=0
1,3.408085,54.93.77.70,10.0.2.15,TLSv1.2,4398,"Application Data, Application Data"
1,3.408477,10.0.2.15,54.93.77.70,TCP,54,34692  >  9001 [ACK] Seq=3173 Ack=10949 Win=65535 Len=0
1,3.419121,54.93.77.70,10.0.2.15,TLSv1.2,4210,"Application Data, Application Data"
1,3.419336,10.0.2.15,54.93.77.70,TCP,54,34692  >  9001 [ACK] Seq=3173 Ack=15105 Win=65535 Len=0
1,3.430171,54.93.77.70,10.0.2.15,TLSv1.2,7294,Application Data
1,3.430562,10.0.2.15,54.93.77.70,TCP,54,34692  >  9001 [ACK] Seq=3173 Ack=22345 Win=65535 Len=0
1,3.435687,54.93.77.70,10.0.2.15,TLSv1.2,568,Application Data
1,3.444915,54.93.77.70,10.0.2.15,TLSv1.2,7294,"Application Data, Application Data"
1,3.445117,10.0.2.15,54.93.77.70,TCP,54,34692  >  9001 [ACK] Seq=3173 Ack=30099 Win=65535 Len=0
1,3.445646,10.0.2.15,54.93.77.70,TLSv1.2,590,Application Data
1,3.446002,54.93.77.70,10.0.2.15,TCP,60,9001  >  34692 [ACK] Seq=30099 Ack=3709 Win=65535 Len=0
1,3.46104,54.93.77.70,10.0.2.15,TLSv1.2,76,Application Data
1,3.461679,10.0.2.15,54.93.77.70,TLSv1.2,590,Application Data
1,3.462062,54.93.77.70,10.0.2.15,TCP,60,9001  >  34692 [ACK] Seq=30121 Ack=4245 Win=65535 Len=0
1,3.530639,54.93.77.70,10.0.2.15,TLSv1.2,3674,Application Data
1,3.530802,10.0.2.15,54.93.77.70,TCP,54,34692  >  9001 [ACK] Seq=4245 Ack=33741 Win=65535 Len=0
1,3.552541,62.210.85.178,10.0.2.15,TLSv1.2,590,Application Data
1,3.552602,54.93.77.70,10.0.2.15,TLSv1.2,11942,"Application Data, Application Data, Application Data"
1,3.552848,10.0.2.15,54.93.77.70,TCP,54,34692  >  9001 [ACK] Seq=4245 Ack=45629 Win=65535 Len=0
1,3.5821,54.93.77.70,10.0.2.15,TLSv1.2,6266,"Application Data, Application Data"
1,3.58224,10.0.2.15,54.93.77.70,TCP,54,34692  >  9001 [ACK] Seq=4245 Ack=51841 Win=65535 Len=0
1,3.593335,54.93.77.70,10.0.2.15,TCP,2950,"9001  >  34692 [PSH, ACK] Seq=51841 Ack=4245 Win=65535 Len=2896 [TCP segment of a reassembled PDU]"
1,3.593521,10.0.2.15,54.93.77.70,TCP,54,34692  >  9001 [ACK] Seq=4245 Ack=54737 Win=65535 Len=0
1,3.594241,10.0.2.15,62.210.85.178,TCP,54,35978  >  9001 [ACK] Seq=64243 Ack=4245 Win=65535 Len=0
1,3.600884,54.93.77.70,10.0.2.15,TLSv1.2,778,Application Data
1,3.601519,10.0.2.15,54.93.77.70,TLSv1.2,590,Application Data
1,3.601829,54.93.77.70,10.0.2.15,TCP,60,9001  >  34692 [ACK] Seq=55461 Ack=4781 Win=65535 Len=0
1,3.604442,54.93.77.70,10.0.2.15,TCP,2950,"9001  >  34692 [PSH, ACK] Seq=55461 Ack=4781 Win=65535 Len=2896 [TCP segment of a reassembled PDU]"
1,3.604766,10.0.2.15,54.93.77.70,TCP,54,34692  >  9001 [ACK] Seq=4781 Ack=58357 Win=65535 Len=0
1,3.615001,62.210.85.178,10.0.2.15,TLSv1.2,590,Application Data
1,3.615236,10.0.2.15,62.210.85.178,TCP,54,35978  >  9001 [ACK] Seq=64243 Ack=4781 Win=65535 Len=0
1,3.61994,54.93.77.70,10.0.2.15,TLSv1.2,1314,"Application Data, Application Data"
1,3.662415,10.0.2.15,54.93.77.70,TCP,54,34692  >  9001 [ACK] Seq=4781 Ack=59617 Win=65535 Len=0
1,3.705698,62.210.85.178,10.0.2.15,TLSv1.2,590,Application Data
1,3.705959,10.0.2.15,62.210.85.178,TCP,54,35978  >  9001 [ACK] Seq=64243 Ack=5317 Win=65535 Len=0
1,3.752671,54.93.77.70,10.0.2.15,TLSv1.2,3674,Application Data
1,3.75297,10.0.2.15,54.93.77.70,TCP,54,34692  >  9001 [ACK] Seq=4781 Ack=63237 Win=65535 Len=0
1,3.854062,54.93.77.70,10.0.2.15,TLSv1.2,1104,Application Data
1,3.85446,10.0.2.15,54.93.77.70,TCP,54,34692  >  9001 [ACK] Seq=4781 Ack=64287 Win=65535 Len=0
1,3.873297,10.0.2.15,54.93.77.70,TLSv1.2,590,Application Data
1,3.873682,54.93.77.70,10.0.2.15,TCP,60,9001  >  34692 [ACK] Seq=64287 Ack=5317 Win=65535 Len=0
1,4.096357,62.210.85.178,10.0.2.15,TLSv1.2,590,Application Data
1,4.096539,10.0.2.15,62.210.85.178,TCP,54,35978  >  9001 [ACK] Seq=64243 Ack=5853 Win=65535 Len=0
1,4.09791,10.0.2.15,62.210.85.178,TLSv1.2,590,Application Data
1,4.098357,62.210.85.178,10.0.2.15,TCP,60,9001  >  35978 [ACK] Seq=5853 Ack=64779 Win=65535 Len=0
1,4.304025,54.93.77.70,10.0.2.15,TLSv1.2,590,Application Data
1,4.307014,10.0.2.15,54.93.77.70,TLSv1.2,590,Application Data
1,4.307261,54.93.77.70,10.0.2.15,TCP,60,9001  >  34692 [ACK] Seq=64823 Ack=5853 Win=65535 Len=0
1,4.608614,62.210.85.178,10.0.2.15,TLSv1.2,590,Application Data
1,4.645308,10.0.2.15,62.210.85.178,TLSv1.2,590,Application Data
1,4.646341,62.210.85.178,10.0.2.15,TCP,60,9001  >  35978 [ACK] Seq=6389 Ack=65315 Win=65535 Len=0
1,4.660659,10.0.2.15,62.210.85.178,TLSv1.2,4124,Application Data
1,4.661139,10.0.2.15,62.210.85.178,TCP,2974,35978  >  9001 [ACK] Seq=69385 Ack=6389 Win=65535 Len=2920 [TCP segment of a reassembled PDU]
1,4.661372,62.210.85.178,10.0.2.15,TCP,60,9001  >  35978 [ACK] Seq=6389 Ack=66775 Win=65535 Len=0
1,4.661427,62.210.85.178,10.0.2.15,TCP,60,9001  >  35978 [ACK] Seq=6389 Ack=68235 Win=65535 Len=0
1,4.661451,62.210.85.178,10.0.2.15,TCP,60,9001  >  35978 [ACK] Seq=6389 Ack=69385 Win=65535 Len=0
1,4.661685,10.0.2.15,62.210.85.178,TLSv1.2,1204,Application Data
1,4.662168,62.210.85.178,10.0.2.15,TCP,60,9001  >  35978 [ACK] Seq=6389 Ack=70845 Win=65535 Len=0
1,4.662225,62.210.85.178,10.0.2.15,TCP,60,9001  >  35978 [ACK] Seq=6389 Ack=72305 Win=65535 Len=0
1,4.662247,62.210.85.178,10.0.2.15,TCP,60,9001  >  35978 [ACK] Seq=6389 Ack=73455 Win=65535 Len=0
1,4.662614,10.0.2.15,62.210.85.178,TCP,2974,35978  >  9001 [ACK] Seq=73455 Ack=6389 Win=65535 Len=2920 [TCP segment of a reassembled PDU]
1,4.662886,10.0.2.15,62.210.85.178,TLSv1.2,1204,Application Data
1,4.663022,62.210.85.178,10.0.2.15,TCP,60,9001  >  35978 [ACK] Seq=6389 Ack=74915 Win=65535 Len=0
1,4.663065,62.210.85.178,10.0.2.15,TCP,60,9001  >  35978 [ACK] Seq=6389 Ack=76375 Win=65535 Len=0
1,4.663446,62.210.85.178,10.0.2.15,TCP,60,9001  >  35978 [ACK] Seq=6389 Ack=77525 Win=65535 Len=0
1,4.663775,10.0.2.15,62.210.85.178,TLSv1.2,4124,Application Data
1,4.66421,62.210.85.178,10.0.2.15,TCP,60,9001  >  35978 [ACK] Seq=6389 Ack=78985 Win=65535 Len=0
1,4.664261,62.210.85.178,10.0.2.15,TCP,60,9001  >  35978 [ACK] Seq=6389 Ack=80445 Win=65535 Len=0
1,4.664285,62.210.85.178,10.0.2.15,TCP,60,9001  >  35978 [ACK] Seq=6389 Ack=81595 Win=65535 Len=0
1,4.664559,10.0.2.15,62.210.85.178,TLSv1.2,332,Application Data
1,4.664956,62.210.85.178,10.0.2.15,TCP,60,9001  >  35978 [ACK] Seq=6389 Ack=81873 Win=65535 Len=0
1,4.665369,10.0.2.15,62.210.85.178,TLSv1.2,3868,Application Data
1,4.665773,10.0.2.15,62.210.85.178,TCP,2974,35978  >  9001 [ACK] Seq=85687 Ack=6389 Win=65535 Len=2920 [TCP segment of a reassembled PDU]
1,4.666008,62.210.85.178,10.0.2.15,TCP,60,9001  >  35978 [ACK] Seq=6389 Ack=83333 Win=65535 Len=0
1,4.666052,62.210.85.178,10.0.2.15,TCP,60,9001  >  35978 [ACK] Seq=6389 Ack=84793 Win=65535 Len=0
1,4.666077,62.210.85.178,10.0.2.15,TCP,60,9001  >  35978 [ACK] Seq=6389 Ack=85687 Win=65535 Len=0
1,4.6661,62.210.85.178,10.0.2.15,TCP,60,9001  >  35978 [ACK] Seq=6389 Ack=87147 Win=65535 Len=0
1,4.666122,62.210.85.178,10.0.2.15,TCP,60,9001  >  35978 [ACK] Seq=6389 Ack=88607 Win=65535 Len=0
1,4.666495,10.0.2.15,62.210.85.178,TLSv1.2,1204,Application Data
1,4.666806,62.210.85.178,10.0.2.15,TCP,60,9001  >  35978 [ACK] Seq=6389 Ack=89757 Win=65535 Len=0
1,4.667011,10.0.2.15,62.210.85.178,TLSv1.2,3030,Application Data
1,4.667292,62.210.85.178,10.0.2.15,TCP,60,9001  >  35978 [ACK] Seq=6389 Ack=91217 Win=65535 Len=0
1,4.66733,62.210.85.178,10.0.2.15,TCP,60,9001  >  35978 [ACK] Seq=6389 Ack=92677 Win=65535 Len=0
1,4.667345,62.210.85.178,10.0.2.15,TCP,60,9001  >  35978 [ACK] Seq=6389 Ack=92733 Win=65535 Len=0
1,4.67469,10.0.2.15,62.210.85.178,TLSv1.2,4124,Application Data
1,4.675897,62.210.85.178,10.0.2.15,TCP,60,9001  >  35978 [ACK] Seq=6389 Ack=94193 Win=65535 Len=0
1,4.676054,62.210.85.178,10.0.2.15,TCP,60,9001  >  35978 [ACK] Seq=6389 Ack=95653 Win=65535 Len=0
1,4.676093,62.210.85.178,10.0.2.15,TCP,60,9001  >  35978 [ACK] Seq=6389 Ack=96803 Win=65535 Len=0
1,4.676835,10.0.2.15,62.210.85.178,TLSv1.2,4124,Application Data
1,4.677751,62.210.85.178,10.0.2.15,TCP,60,9001  >  35978 [ACK] Seq=6389 Ack=98263 Win=65535 Len=0
1,4.677967,62.210.85.178,10.0.2.15,TCP,60,9001  >  35978 [ACK] Seq=6389 Ack=99723 Win=65535 Len=0
1,4.678011,62.210.85.178,10.0.2.15,TCP,60,9001  >  35978 [ACK] Seq=6389 Ack=100873 Win=65535 Len=0
1,4.679323,10.0.2.15,62.210.85.178,TLSv1.2,4124,Application Data
1,4.680112,62.210.85.178,10.0.2.15,TCP,60,9001  >  35978 [ACK] Seq=6389 Ack=102333 Win=65535 Len=0
1,4.680187,62.210.85.178,10.0.2.15,TCP,60,9001  >  35978 [ACK] Seq=6389 Ack=103793 Win=65535 Len=0
1,4.680212,62.210.85.178,10.0.2.15,TCP,60,9001  >  35978 [ACK] Seq=6389 Ack=104943 Win=65535 Len=0
1,4.680583,10.0.2.15,62.210.85.178,TLSv1.2,268,Application Data
1,4.681091,62.210.85.178,10.0.2.15,TCP,60,9001  >  35978 [ACK] Seq=6389 Ack=105157 Win=65535 Len=0
1,4.73324,54.93.77.70,10.0.2.15,TLSv1.2,590,Application Data
1,4.771308,54.93.77.70,10.0.2.15,TLSv1.2,3674,Application Data
1,4.771584,10.0.2.15,54.93.77.70,TCP,54,34692  >  9001 [ACK] Seq=5853 Ack=68979 Win=65535 Len=0
1,4.781149,54.93.77.70,10.0.2.15,TCP,2950,"9001  >  34692 [PSH, ACK] Seq=68979 Ack=5853 Win=65535 Len=2896 [TCP segment of a reassembled PDU]"
1,4.78125,10.0.2.15,54.93.77.70,TCP,54,34692  >  9001 [ACK] Seq=5853 Ack=71875 Win=65535 Len=0
1,4.787436,54.93.77.70,10.0.2.15,TLSv1.2,778,Application Data
1,4.800492,54.93.77.70,10.0.2.15,TLSv1.2,5846,Application Data
1,4.800895,10.0.2.15,54.93.77.70,TCP,54,34692  >  9001 [ACK] Seq=5853 Ack=78391 Win=65535 Len=0
1,4.801155,54.93.77.70,10.0.2.15,TLSv1.2,7154,"Application Data, Application Data"
1,4.801249,10.0.2.15,54.93.77.70,TCP,54,34692  >  9001 [ACK] Seq=5853 Ack=85491 Win=65535 Len=0
1,4.801328,54.93.77.70,10.0.2.15,TCP,194,"9001  >  34692 [PSH, ACK] Seq=85491 Ack=5853 Win=65535 Len=140 [TCP segment of a reassembled PDU]"
1,4.801733,10.0.2.15,54.93.77.70,TLSv1.2,590,Application Data
1,4.802111,54.93.77.70,10.0.2.15,TCP,60,9001  >  34692 [ACK] Seq=85631 Ack=6389 Win=65535 Len=0
1,4.803823,54.93.77.70,10.0.2.15,TLSv1.2,2016,Application Data
1,4.804164,10.0.2.15,54.93.77.70,TCP,54,34692  >  9001 [ACK] Seq=6389 Ack=87593 Win=65535 Len=0
1,4.817363,54.93.77.70,10.0.2.15,TCP,1502,"9001  >  34692 [PSH, ACK] Seq=87593 Ack=6389 Win=65535 Len=1448 [TCP segment of a reassembled PDU]"
1,4.817501,10.0.2.15,54.93.77.70,TCP,54,34692  >  9001 [ACK] Seq=6389 Ack=89041 Win=65535 Len=0
1,4.818516,54.93.77.70,10.0.2.15,TLSv1.2,1502,Application Data [TCP segment of a reassembled PDU]
1,4.818643,10.0.2.15,54.93.77.70,TCP,54,34692  >  9001 [ACK] Seq=6389 Ack=90489 Win=65535 Len=0
1,4.820488,54.93.77.70,10.0.2.15,TLSv1.2,8742,"Application Data, Application Data"
1,4.820765,10.0.2.15,54.93.77.70,TCP,54,34692  >  9001 [ACK] Seq=6389 Ack=99177 Win=65535 Len=0
1,4.820933,54.93.77.70,10.0.2.15,TLSv1.2,1922,Application Data
1,4.821406,10.0.2.15,54.93.77.70,TLSv1.2,590,Application Data
1,4.82165,54.93.77.70,10.0.2.15,TCP,60,9001  >  34692 [ACK] Seq=101045 Ack=6925 Win=65535 Len=0
1,4.830263,54.93.77.70,10.0.2.15,TCP,1502,"9001  >  34692 [PSH, ACK] Seq=101045 Ack=6925 Win=65535 Len=1448 [TCP segment of a reassembled PDU]"
1,4.830539,10.0.2.15,54.93.77.70,TCP,54,34692  >  9001 [ACK] Seq=6925 Ack=102493 Win=65535 Len=0
1,4.838612,54.93.77.70,10.0.2.15,TLSv1.2,684,Application Data
1,4.854743,54.93.77.70,10.0.2.15,TLSv1.2,1104,Application Data
1,4.855019,10.0.2.15,54.93.77.70,TCP,54,34692  >  9001 [ACK] Seq=6925 Ack=104173 Win=65535 Len=0
1,4.915172,54.93.77.70,10.0.2.15,TLSv1.2,1104,Application Data
1,4.915267,62.210.85.178,10.0.2.15,TLSv1.2,590,Application Data
1,4.924366,10.0.2.15,54.93.77.70,TLSv1.2,590,Application Data
1,4.924801,54.93.77.70,10.0.2.15,TCP,60,9001  >  34692 [ACK] Seq=105223 Ack=7461 Win=65535 Len=0
1,4.958506,10.0.2.15,62.210.85.178,TCP,54,35978  >  9001 [ACK] Seq=105157 Ack=6925 Win=65535 Len=0
1,5.22217,62.210.85.178,10.0.2.15,TLSv1.2,1104,Application Data
1,5.222285,10.0.2.15,62.210.85.178,TCP,54,35978  >  9001 [ACK] Seq=105157 Ack=7975 Win=65535 Len=0
1,5.223114,10.0.2.15,62.210.85.178,TLSv1.2,590,Application Data
1,5.223347,62.210.85.178,10.0.2.15,TCP,60,9001  >  35978 [ACK] Seq=7975 Ack=105693 Win=65535 Len=0
1,5.31813,54.93.77.70,10.0.2.15,TLSv1.2,590,Application Data
1,5.319507,10.0.2.15,54.93.77.70,TLSv1.2,590,Application Data
1,5.319976,54.93.77.70,10.0.2.15,TCP,60,9001  >  34692 [ACK] Seq=105759 Ack=7997 Win=65535 Len=0
1,5.529903,62.210.85.178,10.0.2.15,TLSv1.2,590,Application Data
1,5.564991,10.0.2.15,62.210.85.178,TLSv1.2,590,Application Data
1,5.565441,62.210.85.178,10.0.2.15,TCP,60,9001  >  35978 [ACK] Seq=8511 Ack=106229 Win=65535 Len=0
1,5.573947,10.0.2.15,62.210.85.178,TLSv1.2,4124,Application Data
1,5.574584,62.210.85.178,10.0.2.15,TCP,60,9001  >  35978 [ACK] Seq=8511 Ack=107689 Win=65535 Len=0
1,5.5747,62.210.85.178,10.0.2.15,TCP,60,9001  >  35978 [ACK] Seq=8511 Ack=109149 Win=65535 Len=0
1,5.574716,62.210.85.178,10.0.2.15,TCP,60,9001  >  35978 [ACK] Seq=8511 Ack=110299 Win=65535 Len=0
1,5.576429,10.0.2.15,62.210.85.178,TLSv1.2,4124,Application Data
1,5.576893,62.210.85.178,10.0.2.15,TCP,60,9001  >  35978 [ACK] Seq=8511 Ack=111759 Win=65535 Len=0
1,5.576955,62.210.85.178,10.0.2.15,TCP,60,9001  >  35978 [ACK] Seq=8511 Ack=113219 Win=65535 Len=0
1,5.57697,62.210.85.178,10.0.2.15,TCP,60,9001  >  35978 [ACK] Seq=8511 Ack=114369 Win=65535 Len=0
1,5.577174,10.0.2.15,62.210.85.178,TLSv1.2,4124,Application Data
1,5.577478,10.0.2.15,62.210.85.178,TCP,2974,35978  >  9001 [ACK] Seq=118439 Ack=8511 Win=65535 Len=2920 [TCP segment of a reassembled PDU]
1,5.577593,62.210.85.178,10.0.2.15,TCP,60,9001  >  35978 [ACK] Seq=8511 Ack=115829 Win=65535 Len=0
1,5.577633,62.210.85.178,10.0.2.15,TCP,60,9001  >  35978 [ACK] Seq=8511 Ack=117289 Win=65535 Len=0
1,5.577654,62.210.85.178,10.0.2.15,TCP,60,9001  >  35978 [ACK] Seq=8511 Ack=118439 Win=65535 Len=0
1,5.577673,62.210.85.178,10.0.2.15,TCP,60,9001  >  35978 [ACK] Seq=8511 Ack=119899 Win=65535 Len=0
1,5.577687,62.210.85.178,10.0.2.15,TCP,60,9001  >  35978 [ACK] Seq=8511 Ack=121359 Win=65535 Len=0
1,5.577871,10.0.2.15,62.210.85.178,TLSv1.2,1204,Application Data
1,5.578132,62.210.85.178,10.0.2.15,TCP,60,9001  >  35978 [ACK] Seq=8511 Ack=122509 Win=65535 Len=0
1,5.578409,10.0.2.15,62.210.85.178,TLSv1.2,332,Application Data
1,5.578568,62.210.85.178,10.0.2.15,TCP,60,9001  >  35978 [ACK] Seq=8511 Ack=122787 Win=65535 Len=0
1,5.579043,10.0.2.15,62.210.85.178,TLSv1.2,3868,Application Data
1,5.579368,62.210.85.178,10.0.2.15,TCP,60,9001  >  35978 [ACK] Seq=8511 Ack=124247 Win=65535 Len=0
1,5.579401,62.210.85.178,10.0.2.15,TCP,60,9001  >  35978 [ACK] Seq=8511 Ack=125707 Win=65535 Len=0
1,5.579414,62.210.85.178,10.0.2.15,TCP,60,9001  >  35978 [ACK] Seq=8511 Ack=126601 Win=65535 Len=0
1,5.579582,10.0.2.15,62.210.85.178,TLSv1.2,4124,Application Data
1,5.579752,62.210.85.178,10.0.2.15,TCP,60,9001  >  35978 [ACK] Seq=8511 Ack=128061 Win=65535 Len=0
1,5.579793,62.210.85.178,10.0.2.15,TCP,60,9001  >  35978 [ACK] Seq=8511 Ack=129521 Win=65535 Len=0
1,5.579814,62.210.85.178,10.0.2.15,TCP,60,9001  >  35978 [ACK] Seq=8511 Ack=130671 Win=65535 Len=0
1,5.579983,10.0.2.15,62.210.85.178,TLSv1.2,3030,Application Data
1,5.580162,62.210.85.178,10.0.2.15,TCP,60,9001  >  35978 [ACK] Seq=8511 Ack=132131 Win=65535 Len=0
1,5.580201,62.210.85.178,10.0.2.15,TCP,60,9001  >  35978 [ACK] Seq=8511 Ack=133591 Win=65535 Len=0
1,5.580221,62.210.85.178,10.0.2.15,TCP,60,9001  >  35978 [ACK] Seq=8511 Ack=133647 Win=65535 Len=0
1,5.587276,10.0.2.15,62.210.85.178,TLSv1.2,4124,Application Data
1,5.587668,62.210.85.178,10.0.2.15,TCP,60,9001  >  35978 [ACK] Seq=8511 Ack=135107 Win=65535 Len=0
1,5.587721,62.210.85.178,10.0.2.15,TCP,60,9001  >  35978 [ACK] Seq=8511 Ack=136567 Win=65535 Len=0
1,5.587737,62.210.85.178,10.0.2.15,TCP,60,9001  >  35978 [ACK] Seq=8511 Ack=137717 Win=65535 Len=0
1,5.587943,10.0.2.15,62.210.85.178,TLSv1.2,4124,Application Data
1,5.588317,62.210.85.178,10.0.2.15,TCP,60,9001  >  35978 [ACK] Seq=8511 Ack=139177 Win=65535 Len=0
1,5.588356,62.210.85.178,10.0.2.15,TCP,60,9001  >  35978 [ACK] Seq=8511 Ack=140637 Win=65535 Len=0
1,5.588369,62.210.85.178,10.0.2.15,TCP,60,9001  >  35978 [ACK] Seq=8511 Ack=141787 Win=65535 Len=0
1,5.588514,10.0.2.15,62.210.85.178,TLSv1.2,4124,Application Data
1,5.588761,62.210.85.178,10.0.2.15,TCP,60,9001  >  35978 [ACK] Seq=8511 Ack=143247 Win=65535 Len=0
1,5.588808,62.210.85.178,10.0.2.15,TCP,60,9001  >  35978 [ACK] Seq=8511 Ack=144707 Win=65535 Len=0
1,5.58883,62.210.85.178,10.0.2.15,TCP,60,9001  >  35978 [ACK] Seq=8511 Ack=145857 Win=65535 Len=0
1,5.589007,10.0.2.15,62.210.85.178,TLSv1.2,4124,Application Data
1,5.589313,62.210.85.178,10.0.2.15,TCP,60,9001  >  35978 [ACK] Seq=8511 Ack=147317 Win=65535 Len=0
1,5.589352,62.210.85.178,10.0.2.15,TCP,60,9001  >  35978 [ACK] Seq=8511 Ack=148777 Win=65535 Len=0
1,5.589371,62.210.85.178,10.0.2.15,TCP,60,9001  >  35978 [ACK] Seq=8511 Ack=149927 Win=65535 Len=0
1,5.589557,10.0.2.15,62.210.85.178,TLSv1.2,332,Application Data
1,5.589757,62.210.85.178,10.0.2.15,TCP,60,9001  >  35978 [ACK] Seq=8511 Ack=150205 Win=65535 Len=0
1,5.590088,10.0.2.15,62.210.85.178,TLSv1.2,3868,Application Data
1,5.590378,62.210.85.178,10.0.2.15,TCP,60,9001  >  35978 [ACK] Seq=8511 Ack=151665 Win=65535 Len=0
1,5.590448,62.210.85.178,10.0.2.15,TCP,60,9001  >  35978 [ACK] Seq=8511 Ack=153125 Win=65535 Len=0
1,5.59047,62.210.85.178,10.0.2.15,TCP,60,9001  >  35978 [ACK] Seq=8511 Ack=154019 Win=65535 Len=0
1,5.590775,10.0.2.15,62.210.85.178,TLSv1.2,4124,Application Data
1,5.591134,62.210.85.178,10.0.2.15,TCP,60,9001  >  35978 [ACK] Seq=8511 Ack=155479 Win=65535 Len=0
1,5.591181,62.210.85.178,10.0.2.15,TCP,60,9001  >  35978 [ACK] Seq=8511 Ack=156939 Win=65535 Len=0
1,5.591195,62.210.85.178,10.0.2.15,TCP,60,9001  >  35978 [ACK] Seq=8511 Ack=158089 Win=65535 Len=0
1,5.591764,10.0.2.15,62.210.85.178,TLSv1.2,3030,Application Data
1,5.592298,62.210.85.178,10.0.2.15,TCP,60,9001  >  35978 [ACK] Seq=8511 Ack=159549 Win=65535 Len=0
1,5.592354,62.210.85.178,10.0.2.15,TCP,60,9001  >  35978 [ACK] Seq=8511 Ack=161009 Win=65535 Len=0
1,5.592378,62.210.85.178,10.0.2.15,TCP,60,9001  >  35978 [ACK] Seq=8511 Ack=161065 Win=65535 Len=0
1,5.601717,10.0.2.15,62.210.85.178,TLSv1.2,4124,Application Data
1,5.602176,62.210.85.178,10.0.2.15,TCP,60,9001  >  35978 [ACK] Seq=8511 Ack=162525 Win=65535 Len=0
1,5.602241,62.210.85.178,10.0.2.15,TCP,60,9001  >  35978 [ACK] Seq=8511 Ack=163985 Win=65535 Len=0
1,5.602256,62.210.85.178,10.0.2.15,TCP,60,9001  >  35978 [ACK] Seq=8511 Ack=165135 Win=65535 Len=0
1,5.602511,10.0.2.15,62.210.85.178,TLSv1.2,4124,Application Data
1,5.60283,62.210.85.178,10.0.2.15,TCP,60,9001  >  35978 [ACK] Seq=8511 Ack=166595 Win=65535 Len=0
1,5.602868,62.210.85.178,10.0.2.15,TCP,60,9001  >  35978 [ACK] Seq=8511 Ack=168055 Win=65535 Len=0
1,5.60288,62.210.85.178,10.0.2.15,TCP,60,9001  >  35978 [ACK] Seq=8511 Ack=169205 Win=65535 Len=0
1,5.603004,10.0.2.15,62.210.85.178,TCP,2974,35978  >  9001 [ACK] Seq=169205 Ack=8511 Win=65535 Len=2920 [TCP segment of a reassembled PDU]
1,5.60316,62.210.85.178,10.0.2.15,TCP,60,9001  >  35978 [ACK] Seq=8511 Ack=170665 Win=65535 Len=0
1,5.603193,62.210.85.178,10.0.2.15,TCP,60,9001  >  35978 [ACK] Seq=8511 Ack=172125 Win=65535 Len=0
1,5.60335,10.0.2.15,62.210.85.178,TLSv1.2,1204,Application Data
1,5.60357,62.210.85.178,10.0.2.15,TCP,60,9001  >  35978 [ACK] Seq=8511 Ack=173275 Win=65535 Len=0
1,5.603788,10.0.2.15,62.210.85.178,TLSv1.2,4124,Application Data
1,5.604094,62.210.85.178,10.0.2.15,TCP,60,9001  >  35978 [ACK] Seq=8511 Ack=174735 Win=65535 Len=0
1,5.604127,62.210.85.178,10.0.2.15,TCP,60,9001  >  35978 [ACK] Seq=8511 Ack=176195 Win=65535 Len=0
1,5.604141,62.210.85.178,10.0.2.15,TCP,60,9001  >  35978 [ACK] Seq=8511 Ack=177345 Win=65535 Len=0
1,5.604335,10.0.2.15,62.210.85.178,TLSv1.2,332,Application Data
1,5.604712,62.210.85.178,10.0.2.15,TCP,60,9001  >  35978 [ACK] Seq=8511 Ack=177623 Win=65535 Len=0
1,5.60493,10.0.2.15,62.210.85.178,TLSv1.2,590,Application Data
1,5.605361,62.210.85.178,10.0.2.15,TCP,60,9001  >  35978 [ACK] Seq=8511 Ack=178159 Win=65535 Len=0
1,5.675584,54.93.77.70,10.0.2.15,TLSv1.2,3674,Application Data
1,5.675999,10.0.2.15,54.93.77.70,TCP,54,34692  >  9001 [ACK] Seq=7997 Ack=109379 Win=65535 Len=0
1,5.683891,54.93.77.70,10.0.2.15,TLSv1.2,4398,Application Data
1,5.684299,10.0.2.15,54.93.77.70,TCP,54,34692  >  9001 [ACK] Seq=7997 Ack=113723 Win=65535 Len=0
1,5.692163,54.93.77.70,10.0.2.15,TLSv1.2,1408,Application Data
1,5.709522,54.93.77.70,10.0.2.15,TLSv1.2,3160,Application Data
1,5.709822,10.0.2.15,54.93.77.70,TCP,54,34692  >  9001 [ACK] Seq=7997 Ack=118183 Win=65535 Len=0
1,5.720216,54.93.77.70,10.0.2.15,TCP,1502,"9001  >  34692 [PSH, ACK] Seq=118183 Ack=7997 Win=65535 Len=1448 [TCP segment of a reassembled PDU]"
1,5.720482,10.0.2.15,54.93.77.70,TCP,54,34692  >  9001 [ACK] Seq=7997 Ack=119631 Win=65535 Len=0
1,5.726208,54.93.77.70,10.0.2.15,TLSv1.2,684,Application Data
1,5.770441,10.0.2.15,54.93.77.70,TCP,54,34692  >  9001 [ACK] Seq=7997 Ack=120261 Win=65535 Len=0
1,5.804898,54.93.77.70,10.0.2.15,TLSv1.2,1618,Application Data
1,5.805135,10.0.2.15,54.93.77.70,TCP,54,34692  >  9001 [ACK] Seq=7997 Ack=121825 Win=65535 Len=0
1,5.816468,54.93.77.70,10.0.2.15,TCP,2950,"9001  >  34692 [PSH, ACK] Seq=121825 Ack=7997 Win=65535 Len=2896 [TCP segment of a reassembled PDU]"
1,5.816666,10.0.2.15,54.93.77.70,TCP,54,34692  >  9001 [ACK] Seq=7997 Ack=124721 Win=65535 Len=0
1,5.816935,54.93.77.70,10.0.2.15,TLSv1.2,1474,Application Data [TCP segment of a reassembled PDU]
1,5.817034,10.0.2.15,54.93.77.70,TCP,54,34692  >  9001 [ACK] Seq=7997 Ack=126141 Win=65535 Len=0
1,5.817232,54.93.77.70,10.0.2.15,TCP,2978,"9001  >  34692 [PSH, ACK] Seq=126141 Ack=7997 Win=65535 Len=2924 [TCP segment of a reassembled PDU]"
1,5.817354,10.0.2.15,54.93.77.70,TCP,54,34692  >  9001 [ACK] Seq=7997 Ack=129065 Win=65535 Len=0
1,5.821441,54.93.77.70,10.0.2.15,TLSv1.2,568,Application Data
1,5.821624,10.0.2.15,54.93.77.70,TCP,54,34692  >  9001 [ACK] Seq=7997 Ack=129579 Win=65535 Len=0
1,5.82235,10.0.2.15,54.93.77.70,TLSv1.2,590,Application Data
1,5.822808,54.93.77.70,10.0.2.15,TCP,60,9001  >  34692 [ACK] Seq=129579 Ack=8533 Win=65535 Len=0
1,5.825973,54.93.77.70,10.0.2.15,TLSv1.2,4398,Application Data
1,5.826069,54.93.77.70,10.0.2.15,TCP,1502,"9001  >  34692 [PSH, ACK] Seq=133923 Ack=8533 Win=65535 Len=1448 [TCP segment of a reassembled PDU]"
1,5.826435,10.0.2.15,54.93.77.70,TCP,54,34692  >  9001 [ACK] Seq=8533 Ack=135371 Win=65535 Len=0
1,5.833705,10.0.2.15,54.93.77.70,TLSv1.2,590,Application Data
1,5.834154,54.93.77.70,10.0.2.15,TCP,60,9001  >  34692 [ACK] Seq=135371 Ack=9069 Win=65535 Len=0
1,5.838134,54.93.77.70,10.0.2.15,TLSv1.2,988,Application Data
1,5.878464,10.0.2.15,54.93.77.70,TCP,54,34692  >  9001 [ACK] Seq=9069 Ack=136305 Win=65535 Len=0
1,5.911995,54.93.77.70,10.0.2.15,TLSv1.2,5846,Application Data
1,5.912095,54.93.77.70,10.0.2.15,TLSv1.2,2016,Application Data
1,5.912343,10.0.2.15,54.93.77.70,TCP,54,34692  >  9001 [ACK] Seq=9069 Ack=142097 Win=65535 Len=0
1,5.912537,10.0.2.15,54.93.77.70,TCP,54,34692  >  9001 [ACK] Seq=9069 Ack=144059 Win=65535 Len=0
1,5.924416,54.93.77.70,10.0.2.15,TCP,1502,"9001  >  34692 [PSH, ACK] Seq=144059 Ack=9069 Win=65535 Len=1448 [TCP segment of a reassembled PDU]"
1,5.924528,62.210.85.178,10.0.2.15,TLSv1.2,590,Application Data
1,5.924752,10.0.2.15,54.93.77.70,TCP,54,34692  >  9001 [ACK] Seq=9069 Ack=145507 Win=65535 Len=0
1,5.928343,54.93.77.70,10.0.2.15,TLSv1.2,684,Application Data
1,5.928716,10.0.2.15,54.93.77.70,TCP,54,34692  >  9001 [ACK] Seq=9069 Ack=146137 Win=65535 Len=0
1,5.966627,10.0.2.15,62.210.85.178,TCP,54,35978  >  9001 [ACK] Seq=178159 Ack=9047 Win=65535 Len=0
1,5.96846,54.93.77.70,10.0.2.15,TCP,2950,"9001  >  34692 [PSH, ACK] Seq=146137 Ack=9069 Win=65535 Len=2896 [TCP segment of a reassembled PDU]"
1,5.968831,10.0.2.15,54.93.77.70,TCP,54,34692  >  9001 [ACK] Seq=9069 Ack=149033 Win=65535 Len=0
1,5.96922,54.93.77.70,10.0.2.15,TLSv1.2,1474,Application Data [TCP segment of a reassembled PDU]
1,5.970115,54.93.77.70,10.0.2.15,TLSv1.2,6294,"Application Data, Application Data"
1,5.970461,10.0.2.15,54.93.77.70,TCP,54,34692  >  9001 [ACK] Seq=9069 Ack=156693 Win=65535 Len=0
1,5.982394,54.93.77.70,10.0.2.15,TLSv1.2,4398,Application Data [TCP segment of a reassembled PDU]
1,5.982765,10.0.2.15,54.93.77.70,TCP,54,34692  >  9001 [ACK] Seq=9069 Ack=161037 Win=65535 Len=0
1,5.983585,10.0.2.15,54.93.77.70,TLSv1.2,590,Application Data
1,5.983989,54.93.77.70,10.0.2.15,TCP,60,9001  >  34692 [ACK] Seq=161037 Ack=9605 Win=65535 Len=0
1,5.985411,54.93.77.70,10.0.2.15,TLSv1.2,684,Application Data
1,6.005174,54.93.77.70,10.0.2.15,TLSv1.2,5846,Application Data
1,6.005356,54.93.77.70,10.0.2.15,TLSv1.2,3580,"Application Data, Application Data"
1,6.005401,54.93.77.70,10.0.2.15,TCP,1502,"9001  >  34692 [PSH, ACK] Seq=170985 Ack=9605 Win=65535 Len=1448 [TCP segment of a reassembled PDU]"
1,6.005734,10.0.2.15,54.93.77.70,TCP,54,34692  >  9001 [ACK] Seq=9605 Ack=167459 Win=65535 Len=0
1,6.006342,10.0.2.15,54.93.77.70,TCP,54,34692  >  9001 [ACK] Seq=9605 Ack=172433 Win=65535 Len=0
1,6.022759,54.93.77.70,10.0.2.15,TLSv1.2,1198,Application Data
1,6.038936,54.93.77.70,10.0.2.15,TLSv1.2,4398,Application Data
1,6.039061,54.93.77.70,10.0.2.15,TLSv1.2,380,Application Data
1,6.039315,10.0.2.15,54.93.77.70,TCP,54,34692  >  9001 [ACK] Seq=9605 Ack=177921 Win=65535 Len=0
1,6.042556,62.210.85.178,10.0.2.15,TLSv1.2,590,Application Data
1,6.049105,10.0.2.15,62.210.85.178,TCP,54,35978  >  9001 [ACK] Seq=178159 Ack=9583 Win=65535 Len=0
1,6.063165,10.0.2.15,54.93.77.70,TLSv1.2,590,Application Data
1,6.06823,54.93.77.70,10.0.2.15,TCP,60,9001  >  34692 [ACK] Seq=178247 Ack=10141 Win=65535 Len=0
1,6.09497,62.210.85.178,10.0.2.15,TLSv1.2,590,Application Data
1,6.095234,10.0.2.15,62.210.85.178,TCP,54,35978  >  9001 [ACK] Seq=178159 Ack=10119 Win=65535 Len=0
1,6.182421,62.210.85.178,10.0.2.15,TLSv1.2,590,Application Data
1,6.182615,10.0.2.15,62.210.85.178,TCP,54,35978  >  9001 [ACK] Seq=178159 Ack=10655 Win=65535 Len=0
1,6.183733,10.0.2.15,62.210.85.178,TLSv1.2,590,Application Data
1,6.184006,62.210.85.178,10.0.2.15,TCP,60,9001  >  35978 [ACK] Seq=10655 Ack=178695 Win=65535 Len=0
1,6.273864,54.93.77.70,10.0.2.15,TLSv1.2,590,Application Data
1,6.274996,10.0.2.15,54.93.77.70,TLSv1.2,590,Application Data
1,6.275357,54.93.77.70,10.0.2.15,TCP,60,9001  >  34692 [ACK] Seq=178783 Ack=10677 Win=65535 Len=0
1,6.382305,62.210.85.178,10.0.2.15,TLSv1.2,590,Application Data
1,6.396507,10.0.2.15,62.210.85.178,TLSv1.2,590,Application Data
1,6.396922,62.210.85.178,10.0.2.15,TCP,60,9001  >  35978 [ACK] Seq=11191 Ack=179231 Win=65535 Len=0
1,6.408543,10.0.2.15,62.210.85.178,TLSv1.2,4124,Application Data
1,6.408946,62.210.85.178,10.0.2.15,TCP,60,9001  >  35978 [ACK] Seq=11191 Ack=180691 Win=65535 Len=0
1,6.408993,62.210.85.178,10.0.2.15,TCP,60,9001  >  35978 [ACK] Seq=11191 Ack=182151 Win=65535 Len=0
1,6.409005,62.210.85.178,10.0.2.15,TCP,60,9001  >  35978 [ACK] Seq=11191 Ack=183301 Win=65535 Len=0
1,6.409202,10.0.2.15,62.210.85.178,TLSv1.2,4124,Application Data
1,6.409407,10.0.2.15,62.210.85.178,TCP,2974,35978  >  9001 [ACK] Seq=187371 Ack=11191 Win=65535 Len=2920 [TCP segment of a reassembled PDU]
1,6.409509,62.210.85.178,10.0.2.15,TCP,60,9001  >  35978 [ACK] Seq=11191 Ack=184761 Win=65535 Len=0
1,6.40953,62.210.85.178,10.0.2.15,TCP,60,9001  >  35978 [ACK] Seq=11191 Ack=186221 Win=65535 Len=0
1,6.40954,62.210.85.178,10.0.2.15,TCP,60,9001  >  35978 [ACK] Seq=11191 Ack=187371 Win=65535 Len=0
1,6.409638,10.0.2.15,62.210.85.178,TLSv1.2,1204,Application Data
1,6.409765,62.210.85.178,10.0.2.15,TCP,60,9001  >  35978 [ACK] Seq=11191 Ack=188831 Win=65535 Len=0
1,6.409814,62.210.85.178,10.0.2.15,TCP,60,9001  >  35978 [ACK] Seq=11191 Ack=190291 Win=65535 Len=0
1,6.409831,62.210.85.178,10.0.2.15,TCP,60,9001  >  35978 [ACK] Seq=11191 Ack=191441 Win=65535 Len=0
1,6.40997,10.0.2.15,62.210.85.178,TLSv1.2,3352,Application Data
1,6.410255,62.210.85.178,10.0.2.15,TCP,60,9001  >  35978 [ACK] Seq=11191 Ack=192901 Win=65535 Len=0
1,6.410279,62.210.85.178,10.0.2.15,TCP,60,9001  >  35978 [ACK] Seq=11191 Ack=194361 Win=65535 Len=0
1,6.410289,62.210.85.178,10.0.2.15,TCP,60,9001  >  35978 [ACK] Seq=11191 Ack=194739 Win=65535 Len=0
1,6.511161,54.93.77.70,10.0.2.15,TCP,2950,"9001  >  34692 [PSH, ACK] Seq=178783 Ack=10677 Win=65535 Len=2896 [TCP segment of a reassembled PDU]"
1,6.511697,10.0.2.15,54.93.77.70,TCP,54,34692  >  9001 [ACK] Seq=10677 Ack=181679 Win=65535 Len=0
1,6.512308,54.93.77.70,10.0.2.15,TLSv1.2,5448,"Application Data, Application Data, Application Data"
1,6.512709,10.0.2.15,54.93.77.70,TCP,54,34692  >  9001 [ACK] Seq=10677 Ack=187073 Win=65535 Len=0
1,6.513685,10.0.2.15,54.93.77.70,TLSv1.2,590,Application Data
1,6.514496,54.93.77.70,10.0.2.15,TCP,60,9001  >  34692 [ACK] Seq=187073 Ack=11213 Win=65535 Len=0
1,6.523151,54.93.77.70,10.0.2.15,TCP,2950,"9001  >  34692 [PSH, ACK] Seq=187073 Ack=11213 Win=65535 Len=2896 [TCP segment of a reassembled PDU]"
1,6.523589,10.0.2.15,54.93.77.70,TCP,54,34692  >  9001 [ACK] Seq=11213 Ack=189969 Win=65535 Len=0
1,6.53005,54.93.77.70,10.0.2.15,TLSv1.2,778,Application Data
1,6.535699,54.93.77.70,10.0.2.15,TCP,2950,"9001  >  34692 [PSH, ACK] Seq=190693 Ack=11213 Win=65535 Len=2896 [TCP segment of a reassembled PDU]"
1,6.536076,10.0.2.15,54.93.77.70,TCP,54,34692  >  9001 [ACK] Seq=11213 Ack=193589 Win=65535 Len=0
1,6.555129,54.93.77.70,10.0.2.15,TLSv1.2,1314,"Application Data, Application Data"
1,6.568084,10.0.2.15,54.93.77.70,TLSv1.2,590,Application Data
1,6.568738,54.93.77.70,10.0.2.15,TCP,60,9001  >  34692 [ACK] Seq=194849 Ack=11749 Win=65535 Len=0
1,6.654824,62.210.85.178,10.0.2.15,TLSv1.2,590,Application Data
1,6.698485,10.0.2.15,62.210.85.178,TCP,54,35978  >  9001 [ACK] Seq=194739 Ack=11727 Win=65535 Len=0
1,7.066513,62.210.85.178,10.0.2.15,TLSv1.2,590,Application Data
1,7.066827,10.0.2.15,62.210.85.178,TCP,54,35978  >  9001 [ACK] Seq=194739 Ack=12263 Win=65535 Len=0
1,7.068294,10.0.2.15,62.210.85.178,TLSv1.2,590,Application Data
1,7.068768,62.210.85.178,10.0.2.15,TCP,60,9001  >  35978 [ACK] Seq=12263 Ack=195275 Win=65535 Len=0
1,7.680459,54.93.77.70,10.0.2.15,TLSv1.2,590,Application Data
1,7.681547,10.0.2.15,54.93.77.70,TLSv1.2,590,Application Data
1,7.681815,54.93.77.70,10.0.2.15,TCP,60,9001  >  34692 [ACK] Seq=195385 Ack=12285 Win=65535 Len=0
1,7.779829,62.210.85.178,10.0.2.15,TLSv1.2,590,Application Data
1,7.797556,10.0.2.15,62.210.85.178,TLSv1.2,590,Application Data
1,7.797921,62.210.85.178,10.0.2.15,TCP,60,9001  >  35978 [ACK] Seq=12799 Ack=195811 Win=65535 Len=0
1,7.811484,10.0.2.15,62.210.85.178,TLSv1.2,4124,Application Data
1,7.811913,10.0.2.15,62.210.85.178,TCP,2974,35978  >  9001 [ACK] Seq=199881 Ack=12799 Win=65535 Len=2920 [TCP segment of a reassembled PDU]
1,7.811993,62.210.85.178,10.0.2.15,TCP,60,9001  >  35978 [ACK] Seq=12799 Ack=197271 Win=65535 Len=0
1,7.812025,62.210.85.178,10.0.2.15,TCP,60,9001  >  35978 [ACK] Seq=12799 Ack=198731 Win=65535 Len=0
1,7.812041,62.210.85.178,10.0.2.15,TCP,60,9001  >  35978 [ACK] Seq=12799 Ack=199881 Win=65535 Len=0
1,7.812185,62.210.85.178,10.0.2.15,TCP,60,9001  >  35978 [ACK] Seq=12799 Ack=201341 Win=65535 Len=0
1,7.812198,62.210.85.178,10.0.2.15,TCP,60,9001  >  35978 [ACK] Seq=12799 Ack=202801 Win=65535 Len=0
1,7.81228,10.0.2.15,62.210.85.178,TLSv1.2,1204,Application Data
1,7.812469,62.210.85.178,10.0.2.15,TCP,60,9001  >  35978 [ACK] Seq=12799 Ack=203951 Win=65535 Len=0
1,7.812574,10.0.2.15,62.210.85.178,TLSv1.2,4124,Application Data
1,7.812769,62.210.85.178,10.0.2.15,TCP,60,9001  >  35978 [ACK] Seq=12799 Ack=205411 Win=65535 Len=0
1,7.81279,62.210.85.178,10.0.2.15,TCP,60,9001  >  35978 [ACK] Seq=12799 Ack=206871 Win=65535 Len=0
1,7.812798,62.210.85.178,10.0.2.15,TCP,60,9001  >  35978 [ACK] Seq=12799 Ack=208021 Win=65535 Len=0
1,7.812869,10.0.2.15,62.210.85.178,TCP,2974,35978  >  9001 [ACK] Seq=208021 Ack=12799 Win=65535 Len=2920 [TCP segment of a reassembled PDU]
1,7.813012,10.0.2.15,62.210.85.178,TLSv1.2,1204,Application Data
1,7.813115,62.210.85.178,10.0.2.15,TCP,60,9001  >  35978 [ACK] Seq=12799 Ack=209481 Win=65535 Len=0
1,7.813137,62.210.85.178,10.0.2.15,TCP,60,9001  >  35978 [ACK] Seq=12799 Ack=210941 Win=65535 Len=0
1,7.813253,62.210.85.178,10.0.2.15,TCP,60,9001  >  35978 [ACK] Seq=12799 Ack=212091 Win=65535 Len=0
1,7.813354,10.0.2.15,62.210.85.178,TLSv1.2,332,Application Data
1,7.81354,62.210.85.178,10.0.2.15,TCP,60,9001  >  35978 [ACK] Seq=12799 Ack=212369 Win=65535 Len=0
1,7.813655,10.0.2.15,62.210.85.178,TLSv1.2,3868,Application Data
1,7.813905,62.210.85.178,10.0.2.15,TCP,60,9001  >  35978 [ACK] Seq=12799 Ack=213829 Win=65535 Len=0
1,7.813926,62.210.85.178,10.0.2.15,TCP,60,9001  >  35978 [ACK] Seq=12799 Ack=215289 Win=65535 Len=0
1,7.813935,62.210.85.178,10.0.2.15,TCP,60,9001  >  35978 [ACK] Seq=12799 Ack=216183 Win=65535 Len=0
1,7.813988,10.0.2.15,62.210.85.178,TCP,2974,35978  >  9001 [ACK] Seq=216183 Ack=12799 Win=65535 Len=2920 [TCP segment of a reassembled PDU]
1,7.814179,10.0.2.15,62.210.85.178,TLSv1.2,1204,Application Data
1,7.814303,62.210.85.178,10.0.2.15,TCP,60,9001  >  35978 [ACK] Seq=12799 Ack=217643 Win=65535 Len=0
1,7.814331,62.210.85.178,10.0.2.15,TCP,60,9001  >  35978 [ACK] Seq=12799 Ack=219103 Win=65535 Len=0
1,7.81434,62.210.85.178,10.0.2.15,TCP,60,9001  >  35978 [ACK] Seq=12799 Ack=220253 Win=65535 Len=0
1,7.81448,10.0.2.15,62.210.85.178,TLSv1.2,3030,Application Data
1,7.814595,62.210.85.178,10.0.2.15,TCP,60,9001  >  35978 [ACK] Seq=12799 Ack=221713 Win=65535 Len=0
1,7.814618,62.210.85.178,10.0.2.15,TCP,60,9001  >  35978 [ACK] Seq=12799 Ack=223173 Win=65535 Len=0
1,7.814629,62.210.85.178,10.0.2.15,TCP,60,9001  >  35978 [ACK] Seq=12799 Ack=223229 Win=65535 Len=0
1,7.824375,10.0.2.15,62.210.85.178,TLSv1.2,4124,Application Data
1,7.824596,62.210.85.178,10.0.2.15,TCP,60,9001  >  35978 [ACK] Seq=12799 Ack=224689 Win=65535 Len=0
1,7.824634,62.210.85.178,10.0.2.15,TCP,60,9001  >  35978 [ACK] Seq=12799 Ack=226149 Win=65535 Len=0
1,7.82465,62.210.85.178,10.0.2.15,TCP,60,9001  >  35978 [ACK] Seq=12799 Ack=227299 Win=65535 Len=0
1,7.824854,10.0.2.15,62.210.85.178,TLSv1.2,4124,Application Data
1,7.824996,62.210.85.178,10.0.2.15,TCP,60,9001  >  35978 [ACK] Seq=12799 Ack=228759 Win=65535 Len=0
1,7.825024,62.210.85.178,10.0.2.15,TCP,60,9001  >  35978 [ACK] Seq=12799 Ack=230219 Win=65535 Len=0
1,7.825039,62.210.85.178,10.0.2.15,TCP,60,9001  >  35978 [ACK] Seq=12799 Ack=231369 Win=65535 Len=0
1,7.82519,10.0.2.15,62.210.85.178,TLSv1.2,3288,Application Data
1,7.825317,62.210.85.178,10.0.2.15,TCP,60,9001  >  35978 [ACK] Seq=12799 Ack=232829 Win=65535 Len=0
1,7.825342,62.210.85.178,10.0.2.15,TCP,60,9001  >  35978 [ACK] Seq=12799 Ack=234289 Win=65535 Len=0
1,7.825351,62.210.85.178,10.0.2.15,TCP,60,9001  >  35978 [ACK] Seq=12799 Ack=234603 Win=65535 Len=0
1,7.900262,54.93.77.70,10.0.2.15,TLSv1.2,590,Application Data
1,7.942615,10.0.2.15,54.93.77.70,TCP,54,34692  >  9001 [ACK] Seq=12285 Ack=195921 Win=65535 Len=0
1,7.970177,54.93.77.70,10.0.2.15,TLSv1.2,3674,Application Data
1,7.970577,10.0.2.15,54.93.77.70,TCP,54,34692  >  9001 [ACK] Seq=12285 Ack=199541 Win=65535 Len=0
1,7.980001,54.93.77.70,10.0.2.15,TLSv1.2,4398,Application Data
1,7.980159,10.0.2.15,54.93.77.70,TCP,54,34692  >  9001 [ACK] Seq=12285 Ack=203885 Win=65535 Len=0
1,7.981084,54.93.77.70,10.0.2.15,TCP,2950,"9001  >  34692 [PSH, ACK] Seq=203885 Ack=12285 Win=65535 Len=2896 [TCP segment of a reassembled PDU]"
1,7.981227,10.0.2.15,54.93.77.70,TCP,54,34692  >  9001 [ACK] Seq=12285 Ack=206781 Win=65535 Len=0
1,7.986869,54.93.77.70,10.0.2.15,TLSv1.2,568,Application Data
1,7.987685,10.0.2.15,54.93.77.70,TCP,54,34692  >  9001 [ACK] Seq=12285 Ack=207295 Win=65535 Len=0
1,7.989757,54.93.77.70,10.0.2.15,TCP,2950,"9001  >  34692 [PSH, ACK] Seq=207295 Ack=12285 Win=65535 Len=2896 [TCP segment of a reassembled PDU]"
1,7.989957,10.0.2.15,54.93.77.70,TCP,54,34692  >  9001 [ACK] Seq=12285 Ack=210191 Win=65535 Len=0
1,8.00195,54.93.77.70,10.0.2.15,TLSv1.2,5846,"Application Data, Application Data, Application Data"
1,8.002137,54.93.77.70,10.0.2.15,TCP,2950,"9001  >  34692 [PSH, ACK] Seq=215983 Ack=12285 Win=65535 Len=2896 [TCP segment of a reassembled PDU]"
1,8.002514,10.0.2.15,54.93.77.70,TCP,54,34692  >  9001 [ACK] Seq=12285 Ack=215983 Win=65535 Len=0
1,8.002886,10.0.2.15,54.93.77.70,TCP,54,34692  >  9001 [ACK] Seq=12285 Ack=218879 Win=65535 Len=0
1,8.00312,54.93.77.70,10.0.2.15,TLSv1.2,380,Application Data
1,8.003383,10.0.2.15,54.93.77.70,TCP,54,34692  >  9001 [ACK] Seq=12285 Ack=219205 Win=65535 Len=0
1,8.009455,54.93.77.70,10.0.2.15,TCP,2950,"9001  >  34692 [PSH, ACK] Seq=219205 Ack=12285 Win=65535 Len=2896 [TCP segment of a reassembled PDU]"
1,8.009995,10.0.2.15,54.93.77.70,TCP,54,34692  >  9001 [ACK] Seq=12285 Ack=222101 Win=65535 Len=0
1,8.019132,54.93.77.70,10.0.2.15,TLSv1.2,1314,"Application Data, Application Data"
1,8.019538,10.0.2.15,54.93.77.70,TCP,54,34692  >  9001 [ACK] Seq=12285 Ack=223361 Win=65535 Len=0
1,8.021076,10.0.2.15,54.93.77.70,TLSv1.2,590,Application Data
1,8.021274,54.93.77.70,10.0.2.15,TLSv1.2,8742,"Application Data, Application Data"
1,8.021679,10.0.2.15,54.93.77.70,TCP,54,34692  >  9001 [ACK] Seq=12821 Ack=232049 Win=65535 Len=0
1,8.021997,54.93.77.70,10.0.2.15,TCP,60,9001  >  34692 [ACK] Seq=232049 Ack=12821 Win=65535 Len=0
1,8.031938,54.93.77.70,10.0.2.15,TLSv1.2,1502,Application Data [TCP segment of a reassembled PDU]
1,8.032391,10.0.2.15,54.93.77.70,TCP,54,34692  >  9001 [ACK] Seq=12821 Ack=233497 Win=65535 Len=0
1,8.03888,54.93.77.70,10.0.2.15,TLSv1.2,1314,Application Data
1,8.057909,10.0.2.15,54.93.77.70,TLSv1.2,590,Application Data
1,8.058944,54.93.77.70,10.0.2.15,TCP,60,9001  >  34692 [ACK] Seq=234757 Ack=13357 Win=65535 Len=0
1,8.112678,62.210.85.178,10.0.2.15,TLSv1.2,590,Application Data
1,8.154775,10.0.2.15,62.210.85.178,TCP,54,35978  >  9001 [ACK] Seq=234603 Ack=13335 Win=65535 Len=0
1,8.227044,62.210.85.178,10.0.2.15,TLSv1.2,590,Application Data
1,8.22739,10.0.2.15,62.210.85.178,TCP,54,35978  >  9001 [ACK] Seq=234603 Ack=13871 Win=65535 Len=0
1,8.229695,10.0.2.15,62.210.85.178,TLSv1.2,590,Application Data
1,8.23048,62.210.85.178,10.0.2.15,TCP,60,9001  >  35978 [ACK] Seq=13871 Ack=235139 Win=65535 Len=0
1,8.396943,54.93.77.70,10.0.2.15,TLSv1.2,590,Application Data
1,8.398432,10.0.2.15,54.93.77.70,TLSv1.2,590,Application Data
1,8.398909,54.93.77.70,10.0.2.15,TCP,60,9001  >  34692 [ACK] Seq=235293 Ack=13893 Win=65535 Len=0
1,8.494458,62.210.85.178,10.0.2.15,TLSv1.2,590,Application Data
1,8.52513,10.0.2.15,62.210.85.178,TLSv1.2,590,Application Data
1,8.525943,62.210.85.178,10.0.2.15,TCP,60,9001  >  35978 [ACK] Seq=14407 Ack=235675 Win=65535 Len=0
1,8.538808,10.0.2.15,62.210.85.178,TLSv1.2,4124,Application Data
1,8.539187,62.210.85.178,10.0.2.15,TCP,60,9001  >  35978 [ACK] Seq=14407 Ack=237135 Win=65535 Len=0
1,8.539242,62.210.85.178,10.0.2.15,TCP,60,9001  >  35978 [ACK] Seq=14407 Ack=238595 Win=65535 Len=0
1,8.539258,62.210.85.178,10.0.2.15,TCP,60,9001  >  35978 [ACK] Seq=14407 Ack=239745 Win=65535 Len=0
1,8.539416,10.0.2.15,62.210.85.178,TCP,2974,35978  >  9001 [ACK] Seq=239745 Ack=14407 Win=65535 Len=2920 [TCP segment of a reassembled PDU]
1,8.539628,10.0.2.15,62.210.85.178,TLSv1.2,1204,Application Data
1,8.53973,62.210.85.178,10.0.2.15,TCP,60,9001  >  35978 [ACK] Seq=14407 Ack=241205 Win=65535 Len=0
1,8.539752,62.210.85.178,10.0.2.15,TCP,60,9001  >  35978 [ACK] Seq=14407 Ack=242665 Win=65535 Len=0
1,8.539762,62.210.85.178,10.0.2.15,TCP,60,9001  >  35978 [ACK] Seq=14407 Ack=243815 Win=65535 Len=0
1,8.539942,10.0.2.15,62.210.85.178,TLSv1.2,4124,Application Data
1,8.540104,62.210.85.178,10.0.2.15,TCP,60,9001  >  35978 [ACK] Seq=14407 Ack=245275 Win=65535 Len=0
1,8.540131,62.210.85.178,10.0.2.15,TCP,60,9001  >  35978 [ACK] Seq=14407 Ack=246735 Win=65535 Len=0
1,8.540141,62.210.85.178,10.0.2.15,TCP,60,9001  >  35978 [ACK] Seq=14407 Ack=247885 Win=65535 Len=0
1,8.540273,10.0.2.15,62.210.85.178,TLSv1.2,4124,Application Data
1,8.540511,62.210.85.178,10.0.2.15,TCP,60,9001  >  35978 [ACK] Seq=14407 Ack=249345 Win=65535 Len=0
1,8.540536,62.210.85.178,10.0.2.15,TCP,60,9001  >  35978 [ACK] Seq=14407 Ack=250805 Win=65535 Len=0
1,8.540545,62.210.85.178,10.0.2.15,TCP,60,9001  >  35978 [ACK] Seq=14407 Ack=251955 Win=65535 Len=0
1,8.540634,10.0.2.15,62.210.85.178,TLSv1.2,332,Application Data
1,8.540948,10.0.2.15,62.210.85.178,TCP,2974,35978  >  9001 [ACK] Seq=252233 Ack=14407 Win=65535 Len=2920 [TCP segment of a reassembled PDU]
1,8.541066,62.210.85.178,10.0.2.15,TCP,60,9001  >  35978 [ACK] Seq=14407 Ack=252233 Win=65535 Len=0
1,8.541197,62.210.85.178,10.0.2.15,TCP,60,9001  >  35978 [ACK] Seq=14407 Ack=253693 Win=65535 Len=0
1,8.541211,62.210.85.178,10.0.2.15,TCP,60,9001  >  35978 [ACK] Seq=14407 Ack=255153 Win=65535 Len=0
1,8.541293,10.0.2.15,62.210.85.178,TLSv1.2,948,Application Data
1,8.541563,10.0.2.15,62.210.85.178,TCP,2974,35978  >  9001 [ACK] Seq=256047 Ack=14407 Win=65535 Len=2920 [TCP segment of a reassembled PDU]
1,8.542938,62.210.85.178,10.0.2.15,TCP,60,9001  >  35978 [ACK] Seq=14407 Ack=256047 Win=65535 Len=0
1,8.543029,62.210.85.178,10.0.2.15,TCP,60,9001  >  35978 [ACK] Seq=14407 Ack=257507 Win=65535 Len=0
1,8.543057,62.210.85.178,10.0.2.15,TCP,60,9001  >  35978 [ACK] Seq=14407 Ack=258967 Win=65535 Len=0
1,8.54325,10.0.2.15,62.210.85.178,TLSv1.2,1204,Application Data
1,8.543688,10.0.2.15,62.210.85.178,TCP,2974,35978  >  9001 [ACK] Seq=260117 Ack=14407 Win=65535 Len=2920 [TCP segment of a reassembled PDU]
1,8.544123,62.210.85.178,10.0.2.15,TCP,60,9001  >  35978 [ACK] Seq=14407 Ack=260117 Win=65535 Len=0
1,8.544214,62.210.85.178,10.0.2.15,TCP,60,9001  >  35978 [ACK] Seq=14407 Ack=261577 Win=65535 Len=0
1,8.544231,62.210.85.178,10.0.2.15,TCP,60,9001  >  35978 [ACK] Seq=14407 Ack=263037 Win=65535 Len=0
1,8.544367,10.0.2.15,62.210.85.178,TLSv1.2,110,Application Data
1,8.545078,62.210.85.178,10.0.2.15,TCP,60,9001  >  35978 [ACK] Seq=14407 Ack=263093 Win=65535 Len=0
1,8.553369,10.0.2.15,62.210.85.178,TLSv1.2,4124,Application Data
1,8.553618,62.210.85.178,10.0.2.15,TCP,60,9001  >  35978 [ACK] Seq=14407 Ack=264553 Win=65535 Len=0
1,8.553651,62.210.85.178,10.0.2.15,TCP,60,9001  >  35978 [ACK] Seq=14407 Ack=266013 Win=65535 Len=0
1,8.553663,62.210.85.178,10.0.2.15,TCP,60,9001  >  35978 [ACK] Seq=14407 Ack=267163 Win=65535 Len=0
1,8.553833,10.0.2.15,62.210.85.178,TLSv1.2,4124,Application Data
1,8.554016,62.210.85.178,10.0.2.15,TCP,60,9001  >  35978 [ACK] Seq=14407 Ack=268623 Win=65535 Len=0
1,8.554049,62.210.85.178,10.0.2.15,TCP,60,9001  >  35978 [ACK] Seq=14407 Ack=270083 Win=65535 Len=0
1,8.554062,62.210.85.178,10.0.2.15,TCP,60,9001  >  35978 [ACK] Seq=14407 Ack=271233 Win=65535 Len=0
1,8.554172,10.0.2.15,62.210.85.178,TCP,2974,35978  >  9001 [ACK] Seq=271233 Ack=14407 Win=65535 Len=2920 [TCP segment of a reassembled PDU]
1,8.554412,62.210.85.178,10.0.2.15,TCP,60,9001  >  35978 [ACK] Seq=14407 Ack=272693 Win=65535 Len=0
1,8.554455,62.210.85.178,10.0.2.15,TCP,60,9001  >  35978 [ACK] Seq=14407 Ack=274153 Win=65535 Len=0
1,8.55461,10.0.2.15,62.210.85.178,TLSv1.2,1204,Application Data
1,8.554747,62.210.85.178,10.0.2.15,TCP,60,9001  >  35978 [ACK] Seq=14407 Ack=275303 Win=65535 Len=0
1,8.554882,10.0.2.15,62.210.85.178,TLSv1.2,4124,Application Data
1,8.555002,62.210.85.178,10.0.2.15,TCP,60,9001  >  35978 [ACK] Seq=14407 Ack=276763 Win=65535 Len=0
1,8.555024,62.210.85.178,10.0.2.15,TCP,60,9001  >  35978 [ACK] Seq=14407 Ack=278223 Win=65535 Len=0
1,8.555038,62.210.85.178,10.0.2.15,TCP,60,9001  >  35978 [ACK] Seq=14407 Ack=279373 Win=65535 Len=0
1,8.555191,10.0.2.15,62.210.85.178,TLSv1.2,332,Application Data
1,8.555377,62.210.85.178,10.0.2.15,TCP,60,9001  >  35978 [ACK] Seq=14407 Ack=279651 Win=65535 Len=0
1,8.555598,10.0.2.15,62.210.85.178,TLSv1.2,3868,Application Data
1,8.555782,62.210.85.178,10.0.2.15,TCP,60,9001  >  35978 [ACK] Seq=14407 Ack=281111 Win=65535 Len=0
1,8.555806,62.210.85.178,10.0.2.15,TCP,60,9001  >  35978 [ACK] Seq=14407 Ack=282571 Win=65535 Len=0
1,8.555818,62.210.85.178,10.0.2.15,TCP,60,9001  >  35978 [ACK] Seq=14407 Ack=283465 Win=65535 Len=0
1,8.555908,10.0.2.15,62.210.85.178,TLSv1.2,4124,Application Data
1,8.556083,10.0.2.15,62.210.85.178,TCP,2974,35978  >  9001 [ACK] Seq=287535 Ack=14407 Win=65535 Len=2920 [TCP segment of a reassembled PDU]
1,8.556368,62.210.85.178,10.0.2.15,TCP,60,9001  >  35978 [ACK] Seq=14407 Ack=284925 Win=65535 Len=0
1,8.556412,62.210.85.178,10.0.2.15,TCP,60,9001  >  35978 [ACK] Seq=14407 Ack=286385 Win=65535 Len=0
1,8.556423,62.210.85.178,10.0.2.15,TCP,60,9001  >  35978 [ACK] Seq=14407 Ack=287535 Win=65535 Len=0
1,8.556431,62.210.85.178,10.0.2.15,TCP,60,9001  >  35978 [ACK] Seq=14407 Ack=288995 Win=65535 Len=0
1,8.55644,62.210.85.178,10.0.2.15,TCP,60,9001  >  35978 [ACK] Seq=14407 Ack=290455 Win=65535 Len=0
1,8.55656,10.0.2.15,62.210.85.178,TLSv1.2,110,Application Data
1,8.55668,62.210.85.178,10.0.2.15,TCP,60,9001  >  35978 [ACK] Seq=14407 Ack=290511 Win=65535 Len=0
1,8.562707,10.0.2.15,62.210.85.178,TLSv1.2,3160,Application Data
1,8.562942,62.210.85.178,10.0.2.15,TCP,60,9001  >  35978 [ACK] Seq=14407 Ack=291971 Win=65535 Len=0
1,8.562973,62.210.85.178,10.0.2.15,TCP,60,9001  >  35978 [ACK] Seq=14407 Ack=293431 Win=65535 Len=0
1,8.56298,62.210.85.178,10.0.2.15,TCP,60,9001  >  35978 [ACK] Seq=14407 Ack=293617 Win=65535 Len=0
1,8.622897,54.93.77.70,10.0.2.15,TLSv1.2,590,Application Data
1,8.623826,10.0.2.15,54.93.77.70,TLSv1.2,590,Application Data
1,8.624174,54.93.77.70,10.0.2.15,TCP,60,9001  >  34692 [ACK] Seq=235829 Ack=14429 Win=65535 Len=0
1,8.658217,54.93.77.70,10.0.2.15,TLSv1.2,5846,Application Data
1,8.658273,54.93.77.70,10.0.2.15,TLSv1.2,2552,"Application Data, Application Data"
1,8.658469,10.0.2.15,54.93.77.70,TCP,54,34692  >  9001 [ACK] Seq=14429 Ack=244119 Win=65535 Len=0
1,8.66815,54.93.77.70,10.0.2.15,TCP,2950,"9001  >  34692 [PSH, ACK] Seq=244119 Ack=14429 Win=65535 Len=2896 [TCP segment of a reassembled PDU]"
1,8.66843,10.0.2.15,54.93.77.70,TCP,54,34692  >  9001 [ACK] Seq=14429 Ack=247015 Win=65535 Len=0
1,8.668553,54.93.77.70,10.0.2.15,TLSv1.2,2950,Application Data [TCP segment of a reassembled PDU]
1,8.668693,10.0.2.15,54.93.77.70,TCP,54,34692  >  9001 [ACK] Seq=14429 Ack=249911 Win=65535 Len=0
1,8.675187,54.93.77.70,10.0.2.15,TLSv1.2,988,Application Data
1,8.682034,54.93.77.70,10.0.2.15,TCP,2950,"9001  >  34692 [PSH, ACK] Seq=250845 Ack=14429 Win=65535 Len=2896 [TCP segment of a reassembled PDU]"
1,8.682923,10.0.2.15,54.93.77.70,TCP,54,34692  >  9001 [ACK] Seq=14429 Ack=253741 Win=65535 Len=0
1,8.684034,54.93.77.70,10.0.2.15,TLSv1.2,7294,"Application Data, Application Data"
1,8.685413,10.0.2.15,54.93.77.70,TCP,54,34692  >  9001 [ACK] Seq=14429 Ack=260981 Win=65535 Len=0
1,8.692322,54.93.77.70,10.0.2.15,TLSv1.2,4398,Application Data [TCP segment of a reassembled PDU]
1,8.692549,10.0.2.15,54.93.77.70,TCP,54,34692  >  9001 [ACK] Seq=14429 Ack=265325 Win=65535 Len=0
1,8.693036,10.0.2.15,54.93.77.70,TLSv1.2,590,Application Data
1,8.693287,54.93.77.70,10.0.2.15,TCP,60,9001  >  34692 [ACK] Seq=265325 Ack=14965 Win=65535 Len=0
1,8.700827,54.93.77.70,10.0.2.15,TLSv1.2,1104,"Application Data, Application Data"
1,8.702859,54.93.77.70,10.0.2.15,TLSv1.2,4398,Application Data
1,8.702991,10.0.2.15,54.93.77.70,TCP,54,34692  >  9001 [ACK] Seq=14965 Ack=270719 Win=65535 Len=0
1,8.719513,54.93.77.70,10.0.2.15,TLSv1.2,380,Application Data
1,8.72537,54.93.77.70,10.0.2.15,TCP,2950,"9001  >  34692 [PSH, ACK] Seq=271045 Ack=14965 Win=65535 Len=2896 [TCP segment of a reassembled PDU]"
1,8.725495,10.0.2.15,54.93.77.70,TCP,54,34692  >  9001 [ACK] Seq=14965 Ack=273941 Win=65535 Len=0
1,8.741519,54.93.77.70,10.0.2.15,TLSv1.2,4398,"Application Data, Application Data"
1,8.741778,10.0.2.15,54.93.77.70,TCP,54,34692  >  9001 [ACK] Seq=14965 Ack=278285 Win=65535 Len=0
1,8.742326,54.93.77.70,10.0.2.15,TLSv1.2,76,Application Data
1,8.771792,62.210.85.178,10.0.2.15,TLSv1.2,590,Application Data
1,8.786546,10.0.2.15,54.93.77.70,TCP,54,34692  >  9001 [ACK] Seq=14965 Ack=278307 Win=65535 Len=0
1,8.814615,10.0.2.15,62.210.85.178,TCP,54,35978  >  9001 [ACK] Seq=293617 Ack=14943 Win=65535 Len=0
1,9.216979,54.93.77.70,10.0.2.15,TCP,2950,"9001  >  34692 [PSH, ACK] Seq=278307 Ack=14965 Win=65535 Len=2896 [TCP segment of a reassembled PDU]"
1,9.217604,10.0.2.15,54.93.77.70,TCP,54,34692  >  9001 [ACK] Seq=14965 Ack=281203 Win=65535 Len=0
1,9.219434,54.93.77.70,10.0.2.15,TLSv1.2,778,Application Data
1,9.219649,10.0.2.15,54.93.77.70,TCP,54,34692  >  9001 [ACK] Seq=14965 Ack=281927 Win=65535 Len=0
1,9.220548,54.93.77.70,10.0.2.15,TCP,2894,9001  >  34692 [ACK] Seq=281927 Ack=14965 Win=65535 Len=2840 [TCP segment of a reassembled PDU]
1,9.220695,10.0.2.15,54.93.77.70,TCP,54,34692  >  9001 [ACK] Seq=14965 Ack=284767 Win=65535 Len=0
1,9.220898,54.93.77.70,10.0.2.15,TLSv1.2,3006,Application Data [TCP segment of a reassembled PDU]
1,9.221059,10.0.2.15,54.93.77.70,TCP,54,34692  >  9001 [ACK] Seq=14965 Ack=287719 Win=65535 Len=0
1,9.221242,54.93.77.70,10.0.2.15,TLSv1.2,4398,Application Data [TCP segment of a reassembled PDU]
1,9.22129,54.93.77.70,10.0.2.15,TLSv1.2,1828,"Application Data, Application Data"
1,9.221315,62.210.85.178,10.0.2.15,TLSv1.2,590,Application Data
1,9.22153,10.0.2.15,54.93.77.70,TCP,54,34692  >  9001 [ACK] Seq=14965 Ack=292063 Win=65535 Len=0
1,9.221753,10.0.2.15,54.93.77.70,TCP,54,34692  >  9001 [ACK] Seq=14965 Ack=293837 Win=65535 Len=0
1,9.221904,10.0.2.15,62.210.85.178,TCP,54,35978  >  9001 [ACK] Seq=293617 Ack=15479 Win=65535 Len=0
1,9.224604,10.0.2.15,54.93.77.70,TLSv1.2,1104,Application Data
1,9.225097,54.93.77.70,10.0.2.15,TCP,60,9001  >  34692 [ACK] Seq=293837 Ack=16015 Win=65535 Len=0
1,9.239585,10.0.2.15,54.93.77.70,TLSv1.2,590,Application Data
1,9.240142,54.93.77.70,10.0.2.15,TCP,60,9001  >  34692 [ACK] Seq=293837 Ack=16551 Win=65535 Len=0
1,9.311152,62.210.85.178,10.0.2.15,TLSv1.2,1104,Application Data
1,9.311401,10.0.2.15,62.210.85.178,TCP,54,35978  >  9001 [ACK] Seq=293617 Ack=16529 Win=65535 Len=0
1,9.523256,62.210.85.178,10.0.2.15,TLSv1.2,590,Application Data
1,9.523605,10.0.2.15,62.210.85.178,TCP,54,35978  >  9001 [ACK] Seq=293617 Ack=17065 Win=65535 Len=0
1,9.525038,10.0.2.15,62.210.85.178,TLSv1.2,590,Application Data
1,9.52617,62.210.85.178,10.0.2.15,TCP,60,9001  >  35978 [ACK] Seq=17065 Ack=294153 Win=65535 Len=0
1,9.728387,54.93.77.70,10.0.2.15,TLSv1.2,590,Application Data
1,9.729667,10.0.2.15,54.93.77.70,TLSv1.2,590,Application Data
1,9.730082,54.93.77.70,10.0.2.15,TCP,60,9001  >  34692 [ACK] Seq=294373 Ack=17087 Win=65535 Len=0
1,9.836849,62.210.85.178,10.0.2.15,TLSv1.2,590,Application Data
1,9.853252,10.0.2.15,62.210.85.178,TLSv1.2,590,Application Data
1,9.854538,62.210.85.178,10.0.2.15,TCP,60,9001  >  35978 [ACK] Seq=17601 Ack=294689 Win=65535 Len=0
1,9.866955,10.0.2.15,62.210.85.178,TLSv1.2,4124,Application Data
1,9.867825,62.210.85.178,10.0.2.15,TCP,60,9001  >  35978 [ACK] Seq=17601 Ack=296149 Win=65535 Len=0
1,9.86794,62.210.85.178,10.0.2.15,TCP,60,9001  >  35978 [ACK] Seq=17601 Ack=297609 Win=65535 Len=0
1,9.867955,62.210.85.178,10.0.2.15,TCP,60,9001  >  35978 [ACK] Seq=17601 Ack=298759 Win=65535 Len=0
1,9.868168,10.0.2.15,62.210.85.178,TCP,2974,35978  >  9001 [ACK] Seq=298759 Ack=17601 Win=65535 Len=2920 [TCP segment of a reassembled PDU]
1,9.86861,10.0.2.15,62.210.85.178,TLSv1.2,1204,Application Data
1,9.868867,62.210.85.178,10.0.2.15,TCP,60,9001  >  35978 [ACK] Seq=17601 Ack=300219 Win=65535 Len=0
1,9.868934,62.210.85.178,10.0.2.15,TCP,60,9001  >  35978 [ACK] Seq=17601 Ack=301679 Win=65535 Len=0
1,9.869385,62.210.85.178,10.0.2.15,TCP,60,9001  >  35978 [ACK] Seq=17601 Ack=302829 Win=65535 Len=0
1,9.869576,10.0.2.15,62.210.85.178,TCP,2974,35978  >  9001 [ACK] Seq=302829 Ack=17601 Win=65535 Len=2920 [TCP segment of a reassembled PDU]
1,9.870059,62.210.85.178,10.0.2.15,TCP,60,9001  >  35978 [ACK] Seq=17601 Ack=304289 Win=65535 Len=0
1,9.87018,62.210.85.178,10.0.2.15,TCP,60,9001  >  35978 [ACK] Seq=17601 Ack=305749 Win=65535 Len=0
1,9.870678,10.0.2.15,62.210.85.178,TLSv1.2,1204,Application Data
1,9.871546,10.0.2.15,62.210.85.178,TCP,1514,35978  >  9001 [ACK] Seq=306899 Ack=17601 Win=65535 Len=1460 [TCP segment of a reassembled PDU]
1,9.871829,62.210.85.178,10.0.2.15,TCP,60,9001  >  35978 [ACK] Seq=17601 Ack=306899 Win=65535 Len=0
1,9.872109,62.210.85.178,10.0.2.15,TCP,60,9001  >  35978 [ACK] Seq=17601 Ack=308359 Win=65535 Len=0
1,9.872317,10.0.2.15,62.210.85.178,TLSv1.2,350,Application Data
1,9.872693,62.210.85.178,10.0.2.15,TCP,60,9001  >  35978 [ACK] Seq=17601 Ack=308655 Win=65535 Len=0
1,9.972898,54.93.77.70,10.0.2.15,TLSv1.2,3674,Application Data
1,9.9736,10.0.2.15,54.93.77.70,TCP,54,34692  >  9001 [ACK] Seq=17087 Ack=297993 Win=65535 Len=0
1,9.982616,54.93.77.70,10.0.2.15,TCP,2950,"9001  >  34692 [PSH, ACK] Seq=297993 Ack=17087 Win=65535 Len=2896 [TCP segment of a reassembled PDU]"
1,9.982865,10.0.2.15,54.93.77.70,TCP,54,34692  >  9001 [ACK] Seq=17087 Ack=300889 Win=65535 Len=0
1,9.988275,54.93.77.70,10.0.2.15,TLSv1.2,1314,"Application Data, Application Data"
1,9.994335,54.93.77.70,10.0.2.15,TCP,2950,"9001  >  34692 [PSH, ACK] Seq=302149 Ack=17087 Win=65535 Len=2896 [TCP segment of a reassembled PDU]"
1,9.994598,10.0.2.15,54.93.77.70,TCP,54,34692  >  9001 [ACK] Seq=17087 Ack=305045 Win=65535 Len=0
1,10.005564,54.93.77.70,10.0.2.15,TLSv1.2,3906,"Application Data, Application Data, Application Data"
1,10.005899,10.0.2.15,54.93.77.70,TCP,54,34692  >  9001 [ACK] Seq=17087 Ack=308897 Win=65535 Len=0
1,10.016502,10.0.2.15,54.93.77.70,TLSv1.2,590,Application Data
1,10.017333,54.93.77.70,10.0.2.15,TCP,60,9001  >  34692 [ACK] Seq=308897 Ack=17623 Win=65535 Len=0
1,10.445918,62.210.85.178,10.0.2.15,TLSv1.2,590,Application Data
1,10.446967,10.0.2.15,62.210.85.178,TLSv1.2,590,Application Data
1,10.44733,62.210.85.178,10.0.2.15,TCP,60,9001  >  35978 [ACK] Seq=18137 Ack=309191 Win=65535 Len=0
1,10.649822,54.93.77.70,10.0.2.15,TLSv1.2,590,Application Data
1,10.651591,10.0.2.15,54.93.77.70,TLSv1.2,590,Application Data
1,10.652427,54.93.77.70,10.0.2.15,TCP,60,9001  >  34692 [ACK] Seq=309433 Ack=18159 Win=65535 Len=0
1,11.059171,62.210.85.178,10.0.2.15,TLSv1.2,590,Application Data
1,11.068107,10.0.2.15,62.210.85.178,TLSv1.2,590,Application Data
1,11.06832,62.210.85.178,10.0.2.15,TCP,60,9001  >  35978 [ACK] Seq=18673 Ack=309727 Win=65535 Len=0
1,11.08335,10.0.2.15,62.210.85.178,TLSv1.2,4124,Application Data
1,11.083678,10.0.2.15,62.210.85.178,TCP,2974,35978  >  9001 [ACK] Seq=313797 Ack=18673 Win=65535 Len=2920 [TCP segment of a reassembled PDU]
1,11.083762,62.210.85.178,10.0.2.15,TCP,60,9001  >  35978 [ACK] Seq=18673 Ack=311187 Win=65535 Len=0
1,11.083782,62.210.85.178,10.0.2.15,TCP,60,9001  >  35978 [ACK] Seq=18673 Ack=312647 Win=65535 Len=0
1,11.083786,62.210.85.178,10.0.2.15,TCP,60,9001  >  35978 [ACK] Seq=18673 Ack=313797 Win=65535 Len=0
1,11.08379,62.210.85.178,10.0.2.15,TCP,60,9001  >  35978 [ACK] Seq=18673 Ack=315257 Win=65535 Len=0
1,11.083793,62.210.85.178,10.0.2.15,TCP,60,9001  >  35978 [ACK] Seq=18673 Ack=316717 Win=65535 Len=0
1,11.083857,10.0.2.15,62.210.85.178,TLSv1.2,1204,Application Data
1,11.084014,62.210.85.178,10.0.2.15,TCP,60,9001  >  35978 [ACK] Seq=18673 Ack=317867 Win=65535 Len=0
1,11.084125,10.0.2.15,62.210.85.178,TLSv1.2,1232,Application Data
1,11.084187,62.210.85.178,10.0.2.15,TCP,60,9001  >  35978 [ACK] Seq=18673 Ack=319045 Win=65535 Len=0
1,11.174671,54.93.77.70,10.0.2.15,TCP,2950,"9001  >  34692 [PSH, ACK] Seq=309433 Ack=18159 Win=65535 Len=2896 [TCP segment of a reassembled PDU]"
1,11.174795,54.93.77.70,10.0.2.15,TLSv1.2,778,Application Data
1,11.175184,10.0.2.15,54.93.77.70,TCP,54,34692  >  9001 [ACK] Seq=18159 Ack=313053 Win=65535 Len=0
1,11.228777,54.93.77.70,10.0.2.15,TCP,2950,"9001  >  34692 [PSH, ACK] Seq=313053 Ack=18159 Win=65535 Len=2896 [TCP segment of a reassembled PDU]"
1,11.229114,10.0.2.15,54.93.77.70,TCP,54,34692  >  9001 [ACK] Seq=18159 Ack=315949 Win=65535 Len=0
1,11.23448,54.93.77.70,10.0.2.15,TLSv1.2,778,Application Data
1,11.237555,54.93.77.70,10.0.2.15,TCP,1502,"9001  >  34692 [PSH, ACK] Seq=316673 Ack=18159 Win=65535 Len=1448 [TCP segment of a reassembled PDU]"
1,11.237988,10.0.2.15,54.93.77.70,TCP,54,34692  >  9001 [ACK] Seq=18159 Ack=318121 Win=65535 Len=0
1,11.25117,54.93.77.70,10.0.2.15,TLSv1.2,1198,Application Data
1,11.26068,10.0.2.15,54.93.77.70,TLSv1.2,590,Application Data
1,11.261166,54.93.77.70,10.0.2.15,TCP,60,9001  >  34692 [ACK] Seq=319265 Ack=18695 Win=65535 Len=0
1,11.674059,62.210.85.178,10.0.2.15,TLSv1.2,590,Application Data
1,11.675114,10.0.2.15,62.210.85.178,TLSv1.2,590,Application Data
1,11.675523,62.210.85.178,10.0.2.15,TCP,60,9001  >  35978 [ACK] Seq=19209 Ack=319581 Win=65535 Len=0
1,11.779123,54.93.77.70,10.0.2.15,TLSv1.2,590,Application Data
1,11.780353,10.0.2.15,54.93.77.70,TLSv1.2,590,Application Data
1,11.780794,54.93.77.70,10.0.2.15,TCP,60,9001  >  34692 [ACK] Seq=319801 Ack=19231 Win=65535 Len=0
1,12.288163,62.210.85.178,10.0.2.15,TLSv1.2,590,Application Data
1,12.309409,10.0.2.15,62.210.85.178,TLSv1.2,590,Application Data
1,12.310144,62.210.85.178,10.0.2.15,TCP,60,9001  >  35978 [ACK] Seq=19745 Ack=320117 Win=65535 Len=0
1,12.323105,10.0.2.15,62.210.85.178,TLSv1.2,4124,Application Data
1,12.323386,10.0.2.15,62.210.85.178,TCP,2974,35978  >  9001 [ACK] Seq=324187 Ack=19745 Win=65535 Len=2920 [TCP segment of a reassembled PDU]
1,12.323513,62.210.85.178,10.0.2.15,TCP,60,9001  >  35978 [ACK] Seq=19745 Ack=321577 Win=65535 Len=0
1,12.323547,62.210.85.178,10.0.2.15,TCP,60,9001  >  35978 [ACK] Seq=19745 Ack=323037 Win=65535 Len=0
1,12.323563,62.210.85.178,10.0.2.15,TCP,60,9001  >  35978 [ACK] Seq=19745 Ack=324187 Win=65535 Len=0
1,12.323575,62.210.85.178,10.0.2.15,TCP,60,9001  >  35978 [ACK] Seq=19745 Ack=325647 Win=65535 Len=0
1,12.3237,10.0.2.15,62.210.85.178,TLSv1.2,1204,Application Data
1,12.323844,62.210.85.178,10.0.2.15,TCP,60,9001  >  35978 [ACK] Seq=19745 Ack=327107 Win=65535 Len=0
1,12.324086,62.210.85.178,10.0.2.15,TCP,60,9001  >  35978 [ACK] Seq=19745 Ack=328257 Win=65535 Len=0
1,12.324254,10.0.2.15,62.210.85.178,TLSv1.2,4124,Application Data
1,12.324485,10.0.2.15,62.210.85.178,TCP,2974,35978  >  9001 [ACK] Seq=332327 Ack=19745 Win=65535 Len=2920 [TCP segment of a reassembled PDU]
1,12.32454,62.210.85.178,10.0.2.15,TCP,60,9001  >  35978 [ACK] Seq=19745 Ack=329717 Win=65535 Len=0
1,12.324558,62.210.85.178,10.0.2.15,TCP,60,9001  >  35978 [ACK] Seq=19745 Ack=331177 Win=65535 Len=0
1,12.324571,62.210.85.178,10.0.2.15,TCP,60,9001  >  35978 [ACK] Seq=19745 Ack=332327 Win=65535 Len=0
1,12.324584,62.210.85.178,10.0.2.15,TCP,60,9001  >  35978 [ACK] Seq=19745 Ack=333787 Win=65535 Len=0
1,12.324597,62.210.85.178,10.0.2.15,TCP,60,9001  >  35978 [ACK] Seq=19745 Ack=335247 Win=65535 Len=0
1,12.32469,10.0.2.15,62.210.85.178,TLSv1.2,1204,Application Data
1,12.324921,62.210.85.178,10.0.2.15,TCP,60,9001  >  35978 [ACK] Seq=19745 Ack=336397 Win=65535 Len=0
1,12.325015,10.0.2.15,62.210.85.178,TLSv1.2,332,Application Data
1,12.325168,10.0.2.15,62.210.85.178,TCP,2974,35978  >  9001 [ACK] Seq=336675 Ack=19745 Win=65535 Len=2920 [TCP segment of a reassembled PDU]
1,12.325274,62.210.85.178,10.0.2.15,TCP,60,9001  >  35978 [ACK] Seq=19745 Ack=336675 Win=65535 Len=0
1,12.325296,62.210.85.178,10.0.2.15,TCP,60,9001  >  35978 [ACK] Seq=19745 Ack=338135 Win=65535 Len=0
1,12.325305,62.210.85.178,10.0.2.15,TCP,60,9001  >  35978 [ACK] Seq=19745 Ack=339595 Win=65535 Len=0
1,12.32538,10.0.2.15,62.210.85.178,TLSv1.2,948,Application Data
1,12.325595,10.0.2.15,62.210.85.178,TCP,2974,35978  >  9001 [ACK] Seq=340489 Ack=19745 Win=65535 Len=2920 [TCP segment of a reassembled PDU]
1,12.32565,62.210.85.178,10.0.2.15,TCP,60,9001  >  35978 [ACK] Seq=19745 Ack=340489 Win=65535 Len=0
1,12.325788,62.210.85.178,10.0.2.15,TCP,60,9001  >  35978 [ACK] Seq=19745 Ack=341949 Win=65535 Len=0
1,12.325804,62.210.85.178,10.0.2.15,TCP,60,9001  >  35978 [ACK] Seq=19745 Ack=343409 Win=65535 Len=0
1,12.325873,10.0.2.15,62.210.85.178,TLSv1.2,1204,Application Data
1,12.325972,62.210.85.178,10.0.2.15,TCP,60,9001  >  35978 [ACK] Seq=19745 Ack=344559 Win=65535 Len=0
1,12.326089,10.0.2.15,62.210.85.178,TLSv1.2,3030,Application Data
1,12.326281,62.210.85.178,10.0.2.15,TCP,60,9001  >  35978 [ACK] Seq=19745 Ack=346019 Win=65535 Len=0
1,12.326309,62.210.85.178,10.0.2.15,TCP,60,9001  >  35978 [ACK] Seq=19745 Ack=347479 Win=65535 Len=0
1,12.326318,62.210.85.178,10.0.2.15,TCP,60,9001  >  35978 [ACK] Seq=19745 Ack=347535 Win=65535 Len=0
1,12.335719,10.0.2.15,62.210.85.178,TLSv1.2,4124,Application Data
1,12.336021,62.210.85.178,10.0.2.15,TCP,60,9001  >  35978 [ACK] Seq=19745 Ack=348995 Win=65535 Len=0
1,12.336057,62.210.85.178,10.0.2.15,TCP,60,9001  >  35978 [ACK] Seq=19745 Ack=350455 Win=65535 Len=0
1,12.336066,62.210.85.178,10.0.2.15,TCP,60,9001  >  35978 [ACK] Seq=19745 Ack=351605 Win=65535 Len=0
1,12.336179,10.0.2.15,62.210.85.178,TLSv1.2,4124,Application Data
1,12.336361,62.210.85.178,10.0.2.15,TCP,60,9001  >  35978 [ACK] Seq=19745 Ack=353065 Win=65535 Len=0
1,12.336384,62.210.85.178,10.0.2.15,TCP,60,9001  >  35978 [ACK] Seq=19745 Ack=354525 Win=65535 Len=0
1,12.336393,62.210.85.178,10.0.2.15,TCP,60,9001  >  35978 [ACK] Seq=19745 Ack=355675 Win=65535 Len=0
1,12.33649,10.0.2.15,62.210.85.178,TLSv1.2,4124,Application Data
1,12.336781,62.210.85.178,10.0.2.15,TCP,60,9001  >  35978 [ACK] Seq=19745 Ack=357135 Win=65535 Len=0
1,12.336823,62.210.85.178,10.0.2.15,TCP,60,9001  >  35978 [ACK] Seq=19745 Ack=358595 Win=65535 Len=0
1,12.336838,62.210.85.178,10.0.2.15,TCP,60,9001  >  35978 [ACK] Seq=19745 Ack=359745 Win=65535 Len=0
1,12.337108,10.0.2.15,62.210.85.178,TLSv1.2,4124,Application Data
1,12.337395,62.210.85.178,10.0.2.15,TCP,60,9001  >  35978 [ACK] Seq=19745 Ack=361205 Win=65535 Len=0
1,12.337427,62.210.85.178,10.0.2.15,TCP,60,9001  >  35978 [ACK] Seq=19745 Ack=362665 Win=65535 Len=0
1,12.337437,62.210.85.178,10.0.2.15,TCP,60,9001  >  35978 [ACK] Seq=19745 Ack=363815 Win=65535 Len=0
1,12.337549,10.0.2.15,62.210.85.178,TLSv1.2,332,Application Data
1,12.337655,62.210.85.178,10.0.2.15,TCP,60,9001  >  35978 [ACK] Seq=19745 Ack=364093 Win=65535 Len=0
1,12.337938,10.0.2.15,62.210.85.178,TLSv1.2,3868,Application Data
1,12.338201,62.210.85.178,10.0.2.15,TCP,60,9001  >  35978 [ACK] Seq=19745 Ack=365553 Win=65535 Len=0
1,12.338228,62.210.85.178,10.0.2.15,TCP,60,9001  >  35978 [ACK] Seq=19745 Ack=367013 Win=65535 Len=0
1,12.338237,62.210.85.178,10.0.2.15,TCP,60,9001  >  35978 [ACK] Seq=19745 Ack=367907 Win=65535 Len=0
1,12.338482,10.0.2.15,62.210.85.178,TCP,2974,35978  >  9001 [ACK] Seq=367907 Ack=19745 Win=65535 Len=2920 [TCP segment of a reassembled PDU]
1,12.338637,10.0.2.15,62.210.85.178,TLSv1.2,1204,Application Data
1,12.338782,62.210.85.178,10.0.2.15,TCP,60,9001  >  35978 [ACK] Seq=19745 Ack=369367 Win=65535 Len=0
1,12.338816,62.210.85.178,10.0.2.15,TCP,60,9001  >  35978 [ACK] Seq=19745 Ack=370827 Win=65535 Len=0
1,12.33883,62.210.85.178,10.0.2.15,TCP,60,9001  >  35978 [ACK] Seq=19745 Ack=371977 Win=65535 Len=0
1,12.339049,10.0.2.15,62.210.85.178,TLSv1.2,974,Application Data
1,12.339308,62.210.85.178,10.0.2.15,TCP,60,9001  >  35978 [ACK] Seq=19745 Ack=372897 Win=65535 Len=0
1,12.441494,54.93.77.70,10.0.2.15,TLSv1.2,3674,Application Data
1,12.441952,10.0.2.15,54.93.77.70,TCP,54,34692  >  9001 [ACK] Seq=19231 Ack=323421 Win=65535 Len=0
1,12.446188,54.93.77.70,10.0.2.15,TCP,2950,"9001  >  34692 [PSH, ACK] Seq=323421 Ack=19231 Win=65535 Len=2896 [TCP segment of a reassembled PDU]"
1,12.446439,10.0.2.15,54.93.77.70,TCP,54,34692  >  9001 [ACK] Seq=19231 Ack=326317 Win=65535 Len=0
1,12.453302,54.93.77.70,10.0.2.15,TLSv1.2,5846,"Application Data, Application Data"
1,12.453672,10.0.2.15,54.93.77.70,TCP,54,34692  >  9001 [ACK] Seq=19231 Ack=332109 Win=65535 Len=0
1,12.460572,54.93.77.70,10.0.2.15,TLSv1.2,170,Application Data
1,12.473931,54.93.77.70,10.0.2.15,TCP,2950,"9001  >  34692 [PSH, ACK] Seq=332225 Ack=19231 Win=65535 Len=2896 [TCP segment of a reassembled PDU]"
1,12.474058,10.0.2.15,54.93.77.70,TCP,54,34692  >  9001 [ACK] Seq=19231 Ack=335121 Win=65535 Len=0
1,12.478681,54.93.77.70,10.0.2.15,TLSv1.2,778,Application Data
1,12.486626,54.93.77.70,10.0.2.15,TCP,2950,"9001  >  34692 [PSH, ACK] Seq=335845 Ack=19231 Win=65535 Len=2896 [TCP segment of a reassembled PDU]"
1,12.486911,10.0.2.15,54.93.77.70,TCP,54,34692  >  9001 [ACK] Seq=19231 Ack=338741 Win=65535 Len=0
1,12.496568,54.93.77.70,10.0.2.15,TLSv1.2,2950,"Application Data, Application Data"
1,12.496807,54.93.77.70,10.0.2.15,TLSv1.2,10190,"Application Data, Application Data"
1,12.49693,10.0.2.15,54.93.77.70,TCP,54,34692  >  9001 [ACK] Seq=19231 Ack=341637 Win=65535 Len=0
1,12.497164,10.0.2.15,54.93.77.70,TCP,54,34692  >  9001 [ACK] Seq=19231 Ack=351773 Win=65535 Len=0
1,12.497673,10.0.2.15,54.93.77.70,TLSv1.2,590,Application Data
1,12.497907,54.93.77.70,10.0.2.15,TCP,60,9001  >  34692 [ACK] Seq=351773 Ack=19767 Win=65535 Len=0
1,12.507723,10.0.2.15,54.93.77.70,TLSv1.2,590,Application Data
1,12.508083,54.93.77.70,10.0.2.15,TCP,60,9001  >  34692 [ACK] Seq=351773 Ack=20303 Win=65535 Len=0
1,12.516649,54.93.77.70,10.0.2.15,TLSv1.2,4840,"Application Data, Application Data, Application Data"
1,12.517807,10.0.2.15,54.93.77.70,TCP,54,34692  >  9001 [ACK] Seq=20303 Ack=356559 Win=65535 Len=0
1,12.518189,54.93.77.70,10.0.2.15,TLSv1.2,7294,Application Data
1,12.5203,10.0.2.15,54.93.77.70,TCP,54,34692  >  9001 [ACK] Seq=20303 Ack=363799 Win=65535 Len=0
1,12.523186,54.93.77.70,10.0.2.15,TLSv1.2,4398,"Application Data, Application Data"
1,12.523399,10.0.2.15,54.93.77.70,TCP,54,34692  >  9001 [ACK] Seq=20303 Ack=368143 Win=65535 Len=0
1,12.537759,54.93.77.70,10.0.2.15,TLSv1.2,916,"Application Data, Application Data"
1,12.544275,54.93.77.70,10.0.2.15,TCP,2950,"9001  >  34692 [PSH, ACK] Seq=369005 Ack=20303 Win=65535 Len=2896 [TCP segment of a reassembled PDU]"
1,12.5444,10.0.2.15,54.93.77.70,TCP,54,34692  >  9001 [ACK] Seq=20303 Ack=371901 Win=65535 Len=0
1,12.57182,54.93.77.70,10.0.2.15,TLSv1.2,1314,"Application Data, Application Data"
1,12.572314,10.0.2.15,54.93.77.70,TLSv1.2,590,Application Data
1,12.572657,54.93.77.70,10.0.2.15,TCP,60,9001  >  34692 [ACK] Seq=373161 Ack=20839 Win=65535 Len=0
1,12.586299,10.0.2.15,54.93.77.70,TLSv1.2,590,Application Data
1,12.586975,54.93.77.70,10.0.2.15,TCP,60,9001  >  34692 [ACK] Seq=373161 Ack=21375 Win=65535 Len=0
1,12.800262,62.210.85.178,10.0.2.15,TLSv1.2,2132,Application Data
1,12.800844,10.0.2.15,62.210.85.178,TCP,54,35978  >  9001 [ACK] Seq=372897 Ack=21823 Win=65535 Len=0
1,12.802022,10.0.2.15,62.210.85.178,TLSv1.2,590,Application Data
1,12.80312,62.210.85.178,10.0.2.15,TCP,60,9001  >  35978 [ACK] Seq=21823 Ack=373433 Win=65535 Len=0
1,13.210475,54.93.77.70,10.0.2.15,TLSv1.2,590,Application Data
1,13.211166,10.0.2.15,54.93.77.70,TLSv1.2,590,Application Data
1,13.211393,54.93.77.70,10.0.2.15,TCP,60,9001  >  34692 [ACK] Seq=373697 Ack=21911 Win=65535 Len=0
1,13.314636,62.210.85.178,10.0.2.15,TLSv1.2,590,Application Data
1,13.326435,10.0.2.15,62.210.85.178,TLSv1.2,590,Application Data
1,13.326751,62.210.85.178,10.0.2.15,TCP,60,9001  >  35978 [ACK] Seq=22359 Ack=373969 Win=65535 Len=0
1,13.338557,10.0.2.15,62.210.85.178,TLSv1.2,4124,Application Data
1,13.338802,62.210.85.178,10.0.2.15,TCP,60,9001  >  35978 [ACK] Seq=22359 Ack=375429 Win=65535 Len=0
1,13.338826,62.210.85.178,10.0.2.15,TCP,60,9001  >  35978 [ACK] Seq=22359 Ack=376889 Win=65535 Len=0
1,13.338833,62.210.85.178,10.0.2.15,TCP,60,9001  >  35978 [ACK] Seq=22359 Ack=378039 Win=65535 Len=0
1,13.338898,10.0.2.15,62.210.85.178,TCP,2974,35978  >  9001 [ACK] Seq=378039 Ack=22359 Win=65535 Len=2920 [TCP segment of a reassembled PDU]
1,13.339047,62.210.85.178,10.0.2.15,TCP,60,9001  >  35978 [ACK] Seq=22359 Ack=379499 Win=65535 Len=0
1,13.339072,62.210.85.178,10.0.2.15,TCP,60,9001  >  35978 [ACK] Seq=22359 Ack=380959 Win=65535 Len=0
1,13.339152,10.0.2.15,62.210.85.178,TLSv1.2,1204,Application Data
1,13.339299,62.210.85.178,10.0.2.15,TCP,60,9001  >  35978 [ACK] Seq=22359 Ack=382109 Win=65535 Len=0
1,13.33944,10.0.2.15,62.210.85.178,TLSv1.2,4124,Application Data
1,13.339591,62.210.85.178,10.0.2.15,TCP,60,9001  >  35978 [ACK] Seq=22359 Ack=383569 Win=65535 Len=0
1,13.339607,62.210.85.178,10.0.2.15,TCP,60,9001  >  35978 [ACK] Seq=22359 Ack=385029 Win=65535 Len=0
1,13.339615,62.210.85.178,10.0.2.15,TCP,60,9001  >  35978 [ACK] Seq=22359 Ack=386179 Win=65535 Len=0
1,13.339708,10.0.2.15,62.210.85.178,TLSv1.2,4124,Application Data
1,13.339864,62.210.85.178,10.0.2.15,TCP,60,9001  >  35978 [ACK] Seq=22359 Ack=387639 Win=65535 Len=0
1,13.33988,62.210.85.178,10.0.2.15,TCP,60,9001  >  35978 [ACK] Seq=22359 Ack=389099 Win=65535 Len=0
1,13.339887,62.210.85.178,10.0.2.15,TCP,60,9001  >  35978 [ACK] Seq=22359 Ack=390249 Win=65535 Len=0
1,13.339951,10.0.2.15,62.210.85.178,TLSv1.2,332,Application Data
1,13.340087,62.210.85.178,10.0.2.15,TCP,60,9001  >  35978 [ACK] Seq=22359 Ack=390527 Win=65535 Len=0
1,13.340231,10.0.2.15,62.210.85.178,TLSv1.2,3868,Application Data
1,13.340385,62.210.85.178,10.0.2.15,TCP,60,9001  >  35978 [ACK] Seq=22359 Ack=391987 Win=65535 Len=0
1,13.3404,62.210.85.178,10.0.2.15,TCP,60,9001  >  35978 [ACK] Seq=22359 Ack=393447 Win=65535 Len=0
1,13.340406,62.210.85.178,10.0.2.15,TCP,60,9001  >  35978 [ACK] Seq=22359 Ack=394341 Win=65535 Len=0
1,13.340478,10.0.2.15,62.210.85.178,TLSv1.2,4124,Application Data
1,13.340649,10.0.2.15,62.210.85.178,TCP,2974,35978  >  9001 [ACK] Seq=398411 Ack=22359 Win=65535 Len=2920 [TCP segment of a reassembled PDU]
1,13.340695,62.210.85.178,10.0.2.15,TCP,60,9001  >  35978 [ACK] Seq=22359 Ack=395801 Win=65535 Len=0
1,13.340712,62.210.85.178,10.0.2.15,TCP,60,9001  >  35978 [ACK] Seq=22359 Ack=397261 Win=65535 Len=0
1,13.340723,62.210.85.178,10.0.2.15,TCP,60,9001  >  35978 [ACK] Seq=22359 Ack=398411 Win=65535 Len=0
1,13.340732,62.210.85.178,10.0.2.15,TCP,60,9001  >  35978 [ACK] Seq=22359 Ack=399871 Win=65535 Len=0
1,13.340742,62.210.85.178,10.0.2.15,TCP,60,9001  >  35978 [ACK] Seq=22359 Ack=401331 Win=65535 Len=0
1,13.340816,10.0.2.15,62.210.85.178,TLSv1.2,110,Application Data
1,13.340894,62.210.85.178,10.0.2.15,TCP,60,9001  >  35978 [ACK] Seq=22359 Ack=401387 Win=65535 Len=0
1,13.350584,10.0.2.15,62.210.85.178,TLSv1.2,1618,Application Data
1,13.350845,62.210.85.178,10.0.2.15,TCP,60,9001  >  35978 [ACK] Seq=22359 Ack=402847 Win=65535 Len=0
1,13.350874,62.210.85.178,10.0.2.15,TCP,60,9001  >  35978 [ACK] Seq=22359 Ack=402951 Win=65535 Len=0
1,13.421548,54.93.77.70,10.0.2.15,TLSv1.2,3674,Application Data
1,13.421951,10.0.2.15,54.93.77.70,TCP,54,34692  >  9001 [ACK] Seq=21911 Ack=377317 Win=65535 Len=0
1,13.453588,54.93.77.70,10.0.2.15,TLSv1.2,590,Application Data
1,13.461171,54.93.77.70,10.0.2.15,TCP,2950,"9001  >  34692 [PSH, ACK] Seq=377853 Ack=21911 Win=65535 Len=2896 [TCP segment of a reassembled PDU]"
1,13.461298,10.0.2.15,54.93.77.70,TCP,54,34692  >  9001 [ACK] Seq=21911 Ack=380749 Win=65535 Len=0
1,13.468566,54.93.77.70,10.0.2.15,TLSv1.2,2950,Application Data [TCP segment of a reassembled PDU]
1,13.468754,10.0.2.15,54.93.77.70,TCP,54,34692  >  9001 [ACK] Seq=21911 Ack=383645 Win=65535 Len=0
1,13.468962,54.93.77.70,10.0.2.15,TLSv1.2,5846,Application Data [TCP segment of a reassembled PDU]
1,13.469173,10.0.2.15,54.93.77.70,TCP,54,34692  >  9001 [ACK] Seq=21911 Ack=389437 Win=65535 Len=0
1,13.477196,54.93.77.70,10.0.2.15,TLSv1.2,380,"Application Data, Application Data"
1,13.493157,54.93.77.70,10.0.2.15,TLSv1.2,4398,Application Data
1,13.493315,10.0.2.15,54.93.77.70,TCP,54,34692  >  9001 [ACK] Seq=21911 Ack=394107 Win=65535 Len=0
1,13.509321,54.93.77.70,10.0.2.15,TLSv1.2,916,"Application Data, Application Data"
1,13.551235,10.0.2.15,54.93.77.70,TCP,54,34692  >  9001 [ACK] Seq=21911 Ack=394969 Win=65535 Len=0
1,13.624519,54.93.77.70,10.0.2.15,TCP,2950,"9001  >  34692 [PSH, ACK] Seq=394969 Ack=21911 Win=65535 Len=2896 [TCP segment of a reassembled PDU]"
1,13.624676,10.0.2.15,54.93.77.70,TCP,54,34692  >  9001 [ACK] Seq=21911 Ack=397865 Win=65535 Len=0
1,13.625274,54.93.77.70,10.0.2.15,TLSv1.2,5448,"Application Data, Application Data, Application Data"
1,13.625356,10.0.2.15,54.93.77.70,TCP,54,34692  >  9001 [ACK] Seq=21911 Ack=403259 Win=65535 Len=0
1,13.625677,10.0.2.15,54.93.77.70,TLSv1.2,590,Application Data
1,13.625836,54.93.77.70,10.0.2.15,TCP,60,9001  >  34692 [ACK] Seq=403259 Ack=22447 Win=65535 Len=0
1,13.644675,10.0.2.15,54.93.77.70,TLSv1.2,1104,Application Data
1,13.64489,54.93.77.70,10.0.2.15,TCP,60,9001  >  34692 [ACK] Seq=403259 Ack=23497 Win=65535 Len=0
1,13.718284,62.210.85.178,10.0.2.15,TLSv1.2,590,Application Data
1,13.758315,10.0.2.15,62.210.85.178,TCP,54,35978  >  9001 [ACK] Seq=402951 Ack=22895 Win=65535 Len=0
1,13.8255,62.210.85.178,10.0.2.15,TLSv1.2,1104,Application Data
1,13.825753,10.0.2.15,62.210.85.178,TCP,54,35978  >  9001 [ACK] Seq=402951 Ack=23945 Win=65535 Len=0
1,13.826851,10.0.2.15,62.210.85.178,TLSv1.2,590,Application Data
1,13.827153,62.210.85.178,10.0.2.15,TCP,60,9001  >  35978 [ACK] Seq=23945 Ack=403487 Win=65535 Len=0
1,13.960612,54.93.77.70,10.0.2.15,TLSv1.2,590,Application Data
1,13.961784,10.0.2.15,54.93.77.70,TLSv1.2,590,Application Data
1,13.962173,54.93.77.70,10.0.2.15,TCP,60,9001  >  34692 [ACK] Seq=403795 Ack=24033 Win=65535 Len=0
1,14.438429,62.210.85.178,10.0.2.15,TLSv1.2,590,Application Data
1,14.46375,10.0.2.15,62.210.85.178,TLSv1.2,590,Application Data
1,14.464106,62.210.85.178,10.0.2.15,TCP,60,9001  >  35978 [ACK] Seq=24481 Ack=404023 Win=65535 Len=0
1,14.478709,10.0.2.15,62.210.85.178,TLSv1.2,4124,Application Data
1,14.478961,62.210.85.178,10.0.2.15,TCP,60,9001  >  35978 [ACK] Seq=24481 Ack=405483 Win=65535 Len=0
1,14.478993,62.210.85.178,10.0.2.15,TCP,60,9001  >  35978 [ACK] Seq=24481 Ack=406943 Win=65535 Len=0
1,14.479002,62.210.85.178,10.0.2.15,TCP,60,9001  >  35978 [ACK] Seq=24481 Ack=408093 Win=65535 Len=0
1,14.479116,10.0.2.15,62.210.85.178,TLSv1.2,4124,Application Data
1,14.479266,10.0.2.15,62.210.85.178,TCP,2974,35978  >  9001 [ACK] Seq=412163 Ack=24481 Win=65535 Len=2920 [TCP segment of a reassembled PDU]
1,14.479309,62.210.85.178,10.0.2.15,TCP,60,9001  >  35978 [ACK] Seq=24481 Ack=409553 Win=65535 Len=0
1,14.479323,62.210.85.178,10.0.2.15,TCP,60,9001  >  35978 [ACK] Seq=24481 Ack=411013 Win=65535 Len=0
1,14.479331,62.210.85.178,10.0.2.15,TCP,60,9001  >  35978 [ACK] Seq=24481 Ack=412163 Win=65535 Len=0
1,14.479338,62.210.85.178,10.0.2.15,TCP,60,9001  >  35978 [ACK] Seq=24481 Ack=413623 Win=65535 Len=0
1,14.479345,62.210.85.178,10.0.2.15,TCP,60,9001  >  35978 [ACK] Seq=24481 Ack=415083 Win=65535 Len=0
1,14.479401,10.0.2.15,62.210.85.178,TLSv1.2,1204,Application Data
1,14.479468,62.210.85.178,10.0.2.15,TCP,60,9001  >  35978 [ACK] Seq=24481 Ack=416233 Win=65535 Len=0
1,14.47956,10.0.2.15,62.210.85.178,TLSv1.2,4124,Application Data
1,14.479714,62.210.85.178,10.0.2.15,TCP,60,9001  >  35978 [ACK] Seq=24481 Ack=417693 Win=65535 Len=0
1,14.479726,62.210.85.178,10.0.2.15,TCP,60,9001  >  35978 [ACK] Seq=24481 Ack=419153 Win=65535 Len=0
1,14.479731,62.210.85.178,10.0.2.15,TCP,60,9001  >  35978 [ACK] Seq=24481 Ack=420303 Win=65535 Len=0
1,14.479791,10.0.2.15,62.210.85.178,TLSv1.2,332,Application Data
1,14.479847,62.210.85.178,10.0.2.15,TCP,60,9001  >  35978 [ACK] Seq=24481 Ack=420581 Win=65535 Len=0
1,14.479942,10.0.2.15,62.210.85.178,TLSv1.2,3868,Application Data
1,14.480005,62.210.85.178,10.0.2.15,TCP,60,9001  >  35978 [ACK] Seq=24481 Ack=422041 Win=65535 Len=0
1,14.480017,62.210.85.178,10.0.2.15,TCP,60,9001  >  35978 [ACK] Seq=24481 Ack=423501 Win=65535 Len=0
1,14.480022,62.210.85.178,10.0.2.15,TCP,60,9001  >  35978 [ACK] Seq=24481 Ack=424395 Win=65535 Len=0
1,14.48008,10.0.2.15,62.210.85.178,TLSv1.2,4124,Application Data
1,14.480179,62.210.85.178,10.0.2.15,TCP,60,9001  >  35978 [ACK] Seq=24481 Ack=425855 Win=65535 Len=0
1,14.48019,62.210.85.178,10.0.2.15,TCP,60,9001  >  35978 [ACK] Seq=24481 Ack=427315 Win=65535 Len=0
1,14.480194,62.210.85.178,10.0.2.15,TCP,60,9001  >  35978 [ACK] Seq=24481 Ack=428465 Win=65535 Len=0
1,14.480244,10.0.2.15,62.210.85.178,TLSv1.2,3030,Application Data
1,14.480301,62.210.85.178,10.0.2.15,TCP,60,9001  >  35978 [ACK] Seq=24481 Ack=429925 Win=65535 Len=0
1,14.480313,62.210.85.178,10.0.2.15,TCP,60,9001  >  35978 [ACK] Seq=24481 Ack=431385 Win=65535 Len=0
1,14.480319,62.210.85.178,10.0.2.15,TCP,60,9001  >  35978 [ACK] Seq=24481 Ack=431441 Win=65535 Len=0
1,14.492169,10.0.2.15,62.210.85.178,TLSv1.2,4124,Application Data
1,14.492354,10.0.2.15,62.210.85.178,TCP,2974,35978  >  9001 [ACK] Seq=435511 Ack=24481 Win=65535 Len=2920 [TCP segment of a reassembled PDU]
1,14.492392,62.210.85.178,10.0.2.15,TCP,60,9001  >  35978 [ACK] Seq=24481 Ack=432901 Win=65535 Len=0
1,14.492408,62.210.85.178,10.0.2.15,TCP,60,9001  >  35978 [ACK] Seq=24481 Ack=434361 Win=65535 Len=0
1,14.492416,62.210.85.178,10.0.2.15,TCP,60,9001  >  35978 [ACK] Seq=24481 Ack=435511 Win=65535 Len=0
1,14.492499,62.210.85.178,10.0.2.15,TCP,60,9001  >  35978 [ACK] Seq=24481 Ack=436971 Win=65535 Len=0
1,14.492508,62.210.85.178,10.0.2.15,TCP,60,9001  >  35978 [ACK] Seq=24481 Ack=438431 Win=65535 Len=0
1,14.492543,10.0.2.15,62.210.85.178,TLSv1.2,1204,Application Data
1,14.492648,62.210.85.178,10.0.2.15,TCP,60,9001  >  35978 [ACK] Seq=24481 Ack=439581 Win=65535 Len=0
1,14.4927,10.0.2.15,62.210.85.178,TCP,2974,35978  >  9001 [ACK] Seq=439581 Ack=24481 Win=65535 Len=2920 [TCP segment of a reassembled PDU]
1,14.492772,10.0.2.15,62.210.85.178,TLSv1.2,1204,Application Data
1,14.492824,62.210.85.178,10.0.2.15,TCP,60,9001  >  35978 [ACK] Seq=24481 Ack=441041 Win=65535 Len=0
1,14.492836,62.210.85.178,10.0.2.15,TCP,60,9001  >  35978 [ACK] Seq=24481 Ack=442501 Win=65535 Len=0
1,14.492841,62.210.85.178,10.0.2.15,TCP,60,9001  >  35978 [ACK] Seq=24481 Ack=443651 Win=65535 Len=0
1,14.492897,10.0.2.15,62.210.85.178,TLSv1.2,4124,Application Data
1,14.493011,62.210.85.178,10.0.2.15,TCP,60,9001  >  35978 [ACK] Seq=24481 Ack=445111 Win=65535 Len=0
1,14.493023,62.210.85.178,10.0.2.15,TCP,60,9001  >  35978 [ACK] Seq=24481 Ack=446571 Win=65535 Len=0
1,14.493027,62.210.85.178,10.0.2.15,TCP,60,9001  >  35978 [ACK] Seq=24481 Ack=447721 Win=65535 Len=0
1,14.493066,10.0.2.15,62.210.85.178,TLSv1.2,332,Application Data
1,14.493166,62.210.85.178,10.0.2.15,TCP,60,9001  >  35978 [ACK] Seq=24481 Ack=447999 Win=65535 Len=0
1,14.493216,10.0.2.15,62.210.85.178,TLSv1.2,3868,Application Data
1,14.49333,10.0.2.15,62.210.85.178,TCP,2974,35978  >  9001 [ACK] Seq=451813 Ack=24481 Win=65535 Len=2920 [TCP segment of a reassembled PDU]
1,14.493371,62.210.85.178,10.0.2.15,TCP,60,9001  >  35978 [ACK] Seq=24481 Ack=449459 Win=65535 Len=0
1,14.493382,62.210.85.178,10.0.2.15,TCP,60,9001  >  35978 [ACK] Seq=24481 Ack=450919 Win=65535 Len=0
1,14.493387,62.210.85.178,10.0.2.15,TCP,60,9001  >  35978 [ACK] Seq=24481 Ack=451813 Win=65535 Len=0
1,14.493452,62.210.85.178,10.0.2.15,TCP,60,9001  >  35978 [ACK] Seq=24481 Ack=453273 Win=65535 Len=0
1,14.493461,62.210.85.178,10.0.2.15,TCP,60,9001  >  35978 [ACK] Seq=24481 Ack=454733 Win=65535 Len=0
1,14.493498,10.0.2.15,62.210.85.178,TLSv1.2,1204,Application Data
1,14.49361,62.210.85.178,10.0.2.15,TCP,60,9001  >  35978 [ACK] Seq=24481 Ack=455883 Win=65535 Len=0
1,14.493639,10.0.2.15,62.210.85.178,TCP,2974,35978  >  9001 [ACK] Seq=455883 Ack=24481 Win=65535 Len=2920 [TCP segment of a reassembled PDU]
1,14.49369,62.210.85.178,10.0.2.15,TCP,60,9001  >  35978 [ACK] Seq=24481 Ack=457343 Win=65535 Len=0
1,14.493698,62.210.85.178,10.0.2.15,TCP,60,9001  >  35978 [ACK] Seq=24481 Ack=458803 Win=65535 Len=0
1,14.493737,10.0.2.15,62.210.85.178,TLSv1.2,110,Application Data
1,14.493782,62.210.85.178,10.0.2.15,TCP,60,9001  >  35978 [ACK] Seq=24481 Ack=458859 Win=65535 Len=0
1,14.50651,10.0.2.15,62.210.85.178,TLSv1.2,4124,Application Data
1,14.506667,10.0.2.15,62.210.85.178,TCP,2974,35978  >  9001 [ACK] Seq=462929 Ack=24481 Win=65535 Len=2920 [TCP segment of a reassembled PDU]
1,14.506701,62.210.85.178,10.0.2.15,TCP,60,9001  >  35978 [ACK] Seq=24481 Ack=460319 Win=65535 Len=0
1,14.506715,62.210.85.178,10.0.2.15,TCP,60,9001  >  35978 [ACK] Seq=24481 Ack=461779 Win=65535 Len=0
1,14.506723,62.210.85.178,10.0.2.15,TCP,60,9001  >  35978 [ACK] Seq=24481 Ack=462929 Win=65535 Len=0
1,14.506782,62.210.85.178,10.0.2.15,TCP,60,9001  >  35978 [ACK] Seq=24481 Ack=464389 Win=65535 Len=0
1,14.506788,62.210.85.178,10.0.2.15,TCP,60,9001  >  35978 [ACK] Seq=24481 Ack=465849 Win=65535 Len=0
1,14.506825,10.0.2.15,62.210.85.178,TLSv1.2,1204,Application Data
1,14.506911,62.210.85.178,10.0.2.15,TCP,60,9001  >  35978 [ACK] Seq=24481 Ack=466999 Win=65535 Len=0
1,14.506949,10.0.2.15,62.210.85.178,TCP,1514,35978  >  9001 [ACK] Seq=466999 Ack=24481 Win=65535 Len=1460 [TCP segment of a reassembled PDU]
1,14.507008,10.0.2.15,62.210.85.178,TLSv1.2,800,Application Data
1,14.507052,62.210.85.178,10.0.2.15,TCP,60,9001  >  35978 [ACK] Seq=24481 Ack=468459 Win=65535 Len=0
1,14.507111,62.210.85.178,10.0.2.15,TCP,60,9001  >  35978 [ACK] Seq=24481 Ack=469205 Win=65535 Len=0
1,14.612141,54.93.77.70,10.0.2.15,TCP,2950,"9001  >  34692 [PSH, ACK] Seq=403795 Ack=24033 Win=65535 Len=2896 [TCP segment of a reassembled PDU]"
1,14.612225,54.93.77.70,10.0.2.15,TLSv1.2,778,Application Data
1,14.612569,10.0.2.15,54.93.77.70,TCP,54,34692  >  9001 [ACK] Seq=24033 Ack=407415 Win=65535 Len=0
1,14.621816,54.93.77.70,10.0.2.15,TCP,2950,"9001  >  34692 [PSH, ACK] Seq=407415 Ack=24033 Win=65535 Len=2896 [TCP segment of a reassembled PDU]"
1,14.622054,10.0.2.15,54.93.77.70,TCP,54,34692  >  9001 [ACK] Seq=24033 Ack=410311 Win=65535 Len=0
1,14.628836,54.93.77.70,10.0.2.15,TLSv1.2,778,Application Data
1,14.632822,54.93.77.70,10.0.2.15,TCP,2950,"9001  >  34692 [PSH, ACK] Seq=411035 Ack=24033 Win=65535 Len=2896 [TCP segment of a reassembled PDU]"
1,14.633291,10.0.2.15,54.93.77.70,TCP,54,34692  >  9001 [ACK] Seq=24033 Ack=413931 Win=65535 Len=0
1,14.642172,54.93.77.70,10.0.2.15,TLSv1.2,5846,"Application Data, Application Data, Application Data"
1,14.642274,54.93.77.70,10.0.2.15,TCP,2950,"9001  >  34692 [PSH, ACK] Seq=419723 Ack=24033 Win=65535 Len=2896 [TCP segment of a reassembled PDU]"
1,14.642598,10.0.2.15,54.93.77.70,TCP,54,34692  >  9001 [ACK] Seq=24033 Ack=422619 Win=65535 Len=0
1,14.644785,54.93.77.70,10.0.2.15,TLSv1.2,916,"Application Data, Application Data"
1,14.652354,54.93.77.70,10.0.2.15,TLSv1.2,5846,Application Data
1,14.652597,10.0.2.15,54.93.77.70,TCP,54,34692  >  9001 [ACK] Seq=24033 Ack=429273 Win=65535 Len=0
1,14.653957,54.93.77.70,10.0.2.15,TLSv1.2,2950,Application Data [TCP segment of a reassembled PDU]
1,14.654288,10.0.2.15,54.93.77.70,TCP,54,34692  >  9001 [ACK] Seq=24033 Ack=432169 Win=65535 Len=0
1,14.655388,10.0.2.15,54.93.77.70,TLSv1.2,590,Application Data
1,14.655786,54.93.77.70,10.0.2.15,TCP,60,9001  >  34692 [ACK] Seq=432169 Ack=24569 Win=65535 Len=0
1,14.658107,54.93.77.70,10.0.2.15,TCP,2950,"9001  >  34692 [PSH, ACK] Seq=432169 Ack=24569 Win=65535 Len=2896 [TCP segment of a reassembled PDU]"
1,14.658324,10.0.2.15,54.93.77.70,TCP,54,34692  >  9001 [ACK] Seq=24569 Ack=435065 Win=65535 Len=0
1,14.661463,54.93.77.70,10.0.2.15,TLSv1.2,894,"Application Data, Application Data"
1,14.664792,54.93.77.70,10.0.2.15,TLSv1.2,7294,Application Data
1,14.66535,10.0.2.15,54.93.77.70,TCP,54,34692  >  9001 [ACK] Seq=24569 Ack=443145 Win=65535 Len=0
1,14.676521,54.93.77.70,10.0.2.15,TLSv1.2,7294,"Application Data, Application Data, Application Data"
1,14.67664,54.93.77.70,10.0.2.15,TLSv1.2,7294,"Application Data, Application Data"
1,14.67689,10.0.2.15,54.93.77.70,TCP,54,34692  >  9001 [ACK] Seq=24569 Ack=450385 Win=65535 Len=0
1,14.677263,10.0.2.15,54.93.77.70,TCP,54,34692  >  9001 [ACK] Seq=24569 Ack=457625 Win=65535 Len=0
1,14.679846,10.0.2.15,54.93.77.70,TLSv1.2,590,Application Data
1,14.684878,54.93.77.70,10.0.2.15,TCP,60,9001  >  34692 [ACK] Seq=457625 Ack=25105 Win=65535 Len=0
1,14.685036,54.93.77.70,10.0.2.15,TLSv1.2,590,Application Data
1,14.685061,54.93.77.70,10.0.2.15,TCP,2950,"9001  >  34692 [PSH, ACK] Seq=458161 Ack=25105 Win=65535 Len=2896 [TCP segment of a reassembled PDU]"
1,14.685321,54.93.77.70,10.0.2.15,TLSv1.2,7294,"Application Data, Application Data"
1,14.686016,10.0.2.15,54.93.77.70,TCP,54,34692  >  9001 [ACK] Seq=25105 Ack=461057 Win=65535 Len=0
1,14.68657,10.0.2.15,54.93.77.70,TCP,54,34692  >  9001 [ACK] Seq=25105 Ack=468297 Win=65535 Len=0
1,14.690514,10.0.2.15,54.93.77.70,TLSv1.2,590,Application Data
1,14.690974,54.93.77.70,10.0.2.15,TCP,60,9001  >  34692 [ACK] Seq=468297 Ack=25641 Win=65535 Len=0
1,14.702415,54.93.77.70,10.0.2.15,TLSv1.2,1314,"Application Data, Application Data"
1,14.746457,10.0.2.15,54.93.77.70,TCP,54,34692  >  9001 [ACK] Seq=25641 Ack=469557 Win=65535 Len=0
