No.,Time,Source,Destination,Protocol,Length,Info
1,0.2434339999999935,10.0.2.15,54.93.77.70,TLSv1.2,590,Application Data
1,0.24362499999999443,54.93.77.70,10.0.2.15,TCP,60,9001  >  34692 [ACK] Seq=3284993 Ack=181757 Win=65535 Len=0
1,0.36933299999999747,62.210.85.178,10.0.2.15,TLSv1.2,590,Application Data
1,0.3694279999999992,10.0.2.15,62.210.85.178,TCP,54,35978  >  9001 [ACK] Seq=3283871 Ack=181391 Win=65535 Len=0
1,0.3697920000000039,10.0.2.15,62.210.85.178,TLSv1.2,590,Application Data
1,0.369891999999993,62.210.85.178,10.0.2.15,TCP,60,9001  >  35978 [ACK] Seq=181391 Ack=3284407 Win=65535 Len=0
1,0.8571120000000008,54.93.77.70,10.0.2.15,TLSv1.2,590,Application Data
1,0.857206000000005,10.0.2.15,54.93.77.70,TCP,54,34692  >  9001 [ACK] Seq=181757 Ack=3285529 Win=65535 Len=0
1,0.857647,10.0.2.15,54.93.77.70,TLSv1.2,1618,Application Data
1,0.8577829999999977,54.93.77.70,10.0.2.15,TCP,60,9001  >  34692 [ACK] Seq=3285529 Ack=183217 Win=65535 Len=0
1,0.8577980000000025,54.93.77.70,10.0.2.15,TCP,60,9001  >  34692 [ACK] Seq=3285529 Ack=183321 Win=65535 Len=0
1,0.9568660000000051,62.210.85.178,10.0.2.15,TLSv1.2,1618,Application Data
1,0.9570290000000057,10.0.2.15,62.210.85.178,TCP,54,35978  >  9001 [ACK] Seq=3284407 Ack=182955 Win=65535 Len=0
1,0.9708909999999946,10.0.2.15,62.210.85.178,TLSv1.2,590,Application Data
1,0.971076999999994,62.210.85.178,10.0.2.15,TCP,60,9001  >  35978 [ACK] Seq=182955 Ack=3284943 Win=65535 Len=0
1,0.9841140000000053,10.0.2.15,62.210.85.178,TLSv1.2,1618,Application Data
1,0.9842880000000065,62.210.85.178,10.0.2.15,TCP,60,9001  >  35978 [ACK] Seq=182955 Ack=3286403 Win=65535 Len=0
1,0.9843130000000002,62.210.85.178,10.0.2.15,TCP,60,9001  >  35978 [ACK] Seq=182955 Ack=3286507 Win=65535 Len=0
1,1.0541750000000008,54.93.77.70,10.0.2.15,TLSv1.2,590,Application Data
1,1.0952209999999951,54.93.77.70,10.0.2.15,TLSv1.2,1618,Application Data
1,1.0953080000000028,10.0.2.15,54.93.77.70,TCP,54,34692  >  9001 [ACK] Seq=183321 Ack=3287629 Win=65535 Len=0
1,1.097610000000003,10.0.2.15,54.93.77.70,TLSv1.2,590,Application Data
1,1.0977829999999926,54.93.77.70,10.0.2.15,TCP,60,9001  >  34692 [ACK] Seq=3287629 Ack=183857 Win=65535 Len=0
1,1.195252999999994,62.210.85.178,10.0.2.15,TLSv1.2,590,Application Data
1,1.1955999999999989,10.0.2.15,62.210.85.178,TLSv1.2,590,Application Data
1,1.1960360000000065,62.210.85.178,10.0.2.15,TCP,60,9001  >  35978 [ACK] Seq=183491 Ack=3287043 Win=65535 Len=0
1,1.3233879999999942,54.93.77.70,10.0.2.15,TLSv1.2,590,Application Data
1,1.3238699999999994,10.0.2.15,54.93.77.70,TLSv1.2,590,Application Data
1,1.3240140000000054,54.93.77.70,10.0.2.15,TCP,60,9001  >  34692 [ACK] Seq=3288165 Ack=184393 Win=65535 Len=0
1,1.7783510000000007,62.210.85.178,10.0.2.15,TLSv1.2,590,Application Data
1,1.7846820000000037,10.0.2.15,62.210.85.178,TLSv1.2,590,Application Data
1,1.7848879999999951,62.210.85.178,10.0.2.15,TCP,60,9001  >  35978 [ACK] Seq=184027 Ack=3287579 Win=65535 Len=0
1,1.796297999999993,10.0.2.15,62.210.85.178,TLSv1.2,4124,Application Data
1,1.7964510000000047,10.0.2.15,62.210.85.178,TCP,2974,35978  >  9001 [ACK] Seq=3291649 Ack=184027 Win=65535 Len=2920 [TCP segment of a reassembled PDU]
1,1.7965020000000038,62.210.85.178,10.0.2.15,TCP,60,9001  >  35978 [ACK] Seq=184027 Ack=3289039 Win=65535 Len=0
1,1.796515999999997,62.210.85.178,10.0.2.15,TCP,60,9001  >  35978 [ACK] Seq=184027 Ack=3290499 Win=65535 Len=0
1,1.7965209999999985,62.210.85.178,10.0.2.15,TCP,60,9001  >  35978 [ACK] Seq=184027 Ack=3291649 Win=65535 Len=0
1,1.796526,62.210.85.178,10.0.2.15,TCP,60,9001  >  35978 [ACK] Seq=184027 Ack=3293109 Win=65535 Len=0
1,1.7965300000000042,62.210.85.178,10.0.2.15,TCP,60,9001  >  35978 [ACK] Seq=184027 Ack=3294569 Win=65535 Len=0
1,1.7965700000000027,10.0.2.15,62.210.85.178,TLSv1.2,1204,Application Data
1,1.7966100000000012,62.210.85.178,10.0.2.15,TCP,60,9001  >  35978 [ACK] Seq=184027 Ack=3295719 Win=65535 Len=0
1,1.7966579999999936,10.0.2.15,62.210.85.178,TLSv1.2,4124,Application Data
1,1.7966990000000038,62.210.85.178,10.0.2.15,TCP,60,9001  >  35978 [ACK] Seq=184027 Ack=3297179 Win=65535 Len=0
1,1.7967079999999953,62.210.85.178,10.0.2.15,TCP,60,9001  >  35978 [ACK] Seq=184027 Ack=3298639 Win=65535 Len=0
1,1.7967119999999994,62.210.85.178,10.0.2.15,TCP,60,9001  >  35978 [ACK] Seq=184027 Ack=3299789 Win=65535 Len=0
1,1.7967539999999929,10.0.2.15,62.210.85.178,TLSv1.2,4124,Application Data
1,1.7967919999999964,62.210.85.178,10.0.2.15,TCP,60,9001  >  35978 [ACK] Seq=184027 Ack=3301249 Win=65535 Len=0
1,1.7968000000000046,62.210.85.178,10.0.2.15,TCP,60,9001  >  35978 [ACK] Seq=184027 Ack=3302709 Win=65535 Len=0
1,1.7968740000000025,10.0.2.15,62.210.85.178,TLSv1.2,2974,Application Data
1,1.796915999999996,62.210.85.178,10.0.2.15,TCP,60,9001  >  35978 [ACK] Seq=184027 Ack=3303859 Win=65535 Len=0
1,1.7969240000000042,62.210.85.178,10.0.2.15,TCP,60,9001  >  35978 [ACK] Seq=184027 Ack=3305319 Win=65535 Len=0
1,1.7969269999999966,62.210.85.178,10.0.2.15,TCP,60,9001  >  35978 [ACK] Seq=184027 Ack=3306779 Win=65535 Len=0
1,1.7969570000000061,10.0.2.15,62.210.85.178,TLSv1.2,1226,Application Data
1,1.796992000000003,62.210.85.178,10.0.2.15,TCP,60,9001  >  35978 [ACK] Seq=184027 Ack=3307951 Win=65535 Len=0
1,1.797034999999994,10.0.2.15,62.210.85.178,TLSv1.2,4124,Application Data
1,1.797073999999995,62.210.85.178,10.0.2.15,TCP,60,9001  >  35978 [ACK] Seq=184027 Ack=3309411 Win=65535 Len=0
1,1.7970820000000032,62.210.85.178,10.0.2.15,TCP,60,9001  >  35978 [ACK] Seq=184027 Ack=3310871 Win=65535 Len=0
1,1.7970849999999956,62.210.85.178,10.0.2.15,TCP,60,9001  >  35978 [ACK] Seq=184027 Ack=3312021 Win=65535 Len=0
1,1.7971239999999966,10.0.2.15,62.210.85.178,TLSv1.2,3030,Application Data
1,1.797163999999995,62.210.85.178,10.0.2.15,TCP,60,9001  >  35978 [ACK] Seq=184027 Ack=3313481 Win=65535 Len=0
1,1.7971720000000033,62.210.85.178,10.0.2.15,TCP,60,9001  >  35978 [ACK] Seq=184027 Ack=3314941 Win=65535 Len=0
1,1.7971759999999932,62.210.85.178,10.0.2.15,TCP,60,9001  >  35978 [ACK] Seq=184027 Ack=3314997 Win=65535 Len=0
1,1.806550999999999,10.0.2.15,62.210.85.178,TLSv1.2,4124,Application Data
1,1.8066850000000017,62.210.85.178,10.0.2.15,TCP,60,9001  >  35978 [ACK] Seq=184027 Ack=3316457 Win=65535 Len=0
1,1.8066979999999973,62.210.85.178,10.0.2.15,TCP,60,9001  >  35978 [ACK] Seq=184027 Ack=3317917 Win=65535 Len=0
1,1.8067020000000014,62.210.85.178,10.0.2.15,TCP,60,9001  >  35978 [ACK] Seq=184027 Ack=3319067 Win=65535 Len=0
1,1.8067489999999964,10.0.2.15,62.210.85.178,TLSv1.2,4124,Application Data
1,1.8068119999999936,62.210.85.178,10.0.2.15,TCP,60,9001  >  35978 [ACK] Seq=184027 Ack=3320527 Win=65535 Len=0
1,1.8068279999999959,62.210.85.178,10.0.2.15,TCP,60,9001  >  35978 [ACK] Seq=184027 Ack=3321987 Win=65535 Len=0
1,1.8068310000000025,62.210.85.178,10.0.2.15,TCP,60,9001  >  35978 [ACK] Seq=184027 Ack=3323137 Win=65535 Len=0
1,1.8068810000000042,10.0.2.15,62.210.85.178,TLSv1.2,4124,Application Data
1,1.8069310000000058,62.210.85.178,10.0.2.15,TCP,60,9001  >  35978 [ACK] Seq=184027 Ack=3324597 Win=65535 Len=0
1,1.8069380000000024,62.210.85.178,10.0.2.15,TCP,60,9001  >  35978 [ACK] Seq=184027 Ack=3326057 Win=65535 Len=0
1,1.8069440000000014,62.210.85.178,10.0.2.15,TCP,60,9001  >  35978 [ACK] Seq=184027 Ack=3327207 Win=65535 Len=0
1,1.806984,10.0.2.15,62.210.85.178,TLSv1.2,4124,Application Data
1,1.8070299999999975,62.210.85.178,10.0.2.15,TCP,60,9001  >  35978 [ACK] Seq=184027 Ack=3328667 Win=65535 Len=0
1,1.807036999999994,62.210.85.178,10.0.2.15,TCP,60,9001  >  35978 [ACK] Seq=184027 Ack=3330127 Win=65535 Len=0
1,1.8070390000000032,62.210.85.178,10.0.2.15,TCP,60,9001  >  35978 [ACK] Seq=184027 Ack=3331277 Win=65535 Len=0
1,1.8070749999999975,10.0.2.15,62.210.85.178,TLSv1.2,332,Application Data
1,1.8071120000000036,62.210.85.178,10.0.2.15,TCP,60,9001  >  35978 [ACK] Seq=184027 Ack=3331555 Win=65535 Len=0
1,1.8071719999999942,10.0.2.15,62.210.85.178,TLSv1.2,3868,Application Data
1,1.8072119999999927,62.210.85.178,10.0.2.15,TCP,60,9001  >  35978 [ACK] Seq=184027 Ack=3333015 Win=65535 Len=0
1,1.807220000000001,62.210.85.178,10.0.2.15,TCP,60,9001  >  35978 [ACK] Seq=184027 Ack=3334475 Win=65535 Len=0
1,1.807224000000005,62.210.85.178,10.0.2.15,TCP,60,9001  >  35978 [ACK] Seq=184027 Ack=3335369 Win=65535 Len=0
1,1.8072619999999944,10.0.2.15,62.210.85.178,TLSv1.2,4124,Application Data
1,1.8073019999999929,62.210.85.178,10.0.2.15,TCP,60,9001  >  35978 [ACK] Seq=184027 Ack=3336829 Win=65535 Len=0
1,1.8073109999999986,62.210.85.178,10.0.2.15,TCP,60,9001  >  35978 [ACK] Seq=184027 Ack=3338289 Win=65535 Len=0
1,1.8073140000000052,62.210.85.178,10.0.2.15,TCP,60,9001  >  35978 [ACK] Seq=184027 Ack=3339439 Win=65535 Len=0
1,1.8073499999999996,10.0.2.15,62.210.85.178,TLSv1.2,3030,Application Data
1,1.8073890000000006,62.210.85.178,10.0.2.15,TCP,60,9001  >  35978 [ACK] Seq=184027 Ack=3340899 Win=65535 Len=0
1,1.8073969999999946,62.210.85.178,10.0.2.15,TCP,60,9001  >  35978 [ACK] Seq=184027 Ack=3342359 Win=65535 Len=0
1,1.8074000000000012,62.210.85.178,10.0.2.15,TCP,60,9001  >  35978 [ACK] Seq=184027 Ack=3342415 Win=65535 Len=0
1,1.819909999999993,10.0.2.15,62.210.85.178,TLSv1.2,4124,Application Data
1,1.8200319999999977,62.210.85.178,10.0.2.15,TCP,60,9001  >  35978 [ACK] Seq=184027 Ack=3343875 Win=65535 Len=0
1,1.8200489999999974,62.210.85.178,10.0.2.15,TCP,60,9001  >  35978 [ACK] Seq=184027 Ack=3345335 Win=65535 Len=0
1,1.8200530000000015,62.210.85.178,10.0.2.15,TCP,60,9001  >  35978 [ACK] Seq=184027 Ack=3346485 Win=65535 Len=0
1,1.8200980000000015,10.0.2.15,62.210.85.178,TLSv1.2,1682,Application Data
1,1.820143999999999,62.210.85.178,10.0.2.15,TCP,60,9001  >  35978 [ACK] Seq=184027 Ack=3347945 Win=65535 Len=0
1,1.8201530000000048,62.210.85.178,10.0.2.15,TCP,60,9001  >  35978 [ACK] Seq=184027 Ack=3348113 Win=65535 Len=0
1,1.8926330000000036,54.93.77.70,10.0.2.15,TLSv1.2,590,Application Data
1,1.904168999999996,54.93.77.70,10.0.2.15,TCP,2950,"9001  >  34692 [PSH, ACK] Seq=3288701 Ack=184393 Win=65535 Len=2896 [TCP segment of a reassembled PDU]"
1,1.9043120000000044,10.0.2.15,54.93.77.70,TCP,54,34692  >  9001 [ACK] Seq=184393 Ack=3291597 Win=65535 Len=0
1,1.9087490000000003,54.93.77.70,10.0.2.15,TLSv1.2,778,Application Data
1,1.9152030000000053,54.93.77.70,10.0.2.15,TCP,2950,"9001  >  34692 [PSH, ACK] Seq=3292321 Ack=184393 Win=65535 Len=2896 [TCP segment of a reassembled PDU]"
1,1.915262999999996,10.0.2.15,54.93.77.70,TCP,54,34692  >  9001 [ACK] Seq=184393 Ack=3295217 Win=65535 Len=0
1,1.9255119999999977,54.93.77.70,10.0.2.15,TLSv1.2,4398,Application Data [TCP segment of a reassembled PDU]
1,1.9256400000000014,10.0.2.15,54.93.77.70,TCP,54,34692  >  9001 [ACK] Seq=184393 Ack=3299561 Win=65535 Len=0
1,1.9257800000000032,54.93.77.70,10.0.2.15,TLSv1.2,590,"Application Data, Application Data"
1,1.9371909999999986,54.93.77.70,10.0.2.15,TCP,2950,"9001  >  34692 [PSH, ACK] Seq=3300097 Ack=184393 Win=65535 Len=2896 [TCP segment of a reassembled PDU]"
1,1.9372649999999965,10.0.2.15,54.93.77.70,TCP,54,34692  >  9001 [ACK] Seq=184393 Ack=3302993 Win=65535 Len=0
1,1.9422849999999983,54.93.77.70,10.0.2.15,TLSv1.2,1314,"Application Data, Application Data"
1,1.9686849999999936,54.93.77.70,10.0.2.15,TLSv1.2,3674,Application Data
1,1.9687679999999972,10.0.2.15,54.93.77.70,TCP,54,34692  >  9001 [ACK] Seq=184393 Ack=3307873 Win=65535 Len=0
1,1.9851060000000018,54.93.77.70,10.0.2.15,TLSv1.2,5846,Application Data
1,1.9851519999999994,54.93.77.70,10.0.2.15,TLSv1.2,2950,Application Data [TCP segment of a reassembled PDU]
1,1.9852479999999986,10.0.2.15,54.93.77.70,TCP,54,34692  >  9001 [ACK] Seq=184393 Ack=3316561 Win=65535 Len=0
1,1.9855299999999971,10.0.2.15,54.93.77.70,TLSv1.2,590,Application Data
1,1.9856359999999995,54.93.77.70,10.0.2.15,TCP,60,9001  >  34692 [ACK] Seq=3316561 Ack=184929 Win=65535 Len=0
1,1.9856479999999976,54.93.77.70,10.0.2.15,TLSv1.2,170,Application Data
1,1.9976979999999998,54.93.77.70,10.0.2.15,TCP,2950,"9001  >  34692 [PSH, ACK] Seq=3316677 Ack=184929 Win=65535 Len=2896 [TCP segment of a reassembled PDU]"
1,1.9977389999999957,54.93.77.70,10.0.2.15,TLSv1.2,5846,"Application Data, Application Data"
1,1.997792000000004,10.0.2.15,54.93.77.70,TCP,54,34692  >  9001 [ACK] Seq=184929 Ack=3319573 Win=65535 Len=0
1,1.9979040000000055,10.0.2.15,54.93.77.70,TCP,54,34692  >  9001 [ACK] Seq=184929 Ack=3325365 Win=65535 Len=0
1,1.9981769999999983,10.0.2.15,54.93.77.70,TLSv1.2,590,Application Data
1,1.9982590000000044,54.93.77.70,10.0.2.15,TCP,60,9001  >  34692 [ACK] Seq=3325365 Ack=185465 Win=65535 Len=0
1,2.0080179999999928,54.93.77.70,10.0.2.15,TLSv1.2,7294,"Application Data, Application Data"
1,2.0080949999999973,10.0.2.15,54.93.77.70,TCP,54,34692  >  9001 [ACK] Seq=185465 Ack=3332605 Win=65535 Len=0
1,2.0155010000000004,54.93.77.70,10.0.2.15,TLSv1.2,684,Application Data
1,2.018199999999993,54.93.77.70,10.0.2.15,TLSv1.2,7294,Application Data
1,2.0182750000000027,10.0.2.15,54.93.77.70,TCP,54,34692  >  9001 [ACK] Seq=185465 Ack=3340475 Win=65535 Len=0
1,2.019043999999994,54.93.77.70,10.0.2.15,TLSv1.2,2950,Application Data [TCP segment of a reassembled PDU]
1,2.019094999999993,10.0.2.15,54.93.77.70,TCP,54,34692  >  9001 [ACK] Seq=185465 Ack=3343371 Win=65535 Len=0
1,2.0192980000000063,10.0.2.15,54.93.77.70,TLSv1.2,590,Application Data
1,2.019379999999998,54.93.77.70,10.0.2.15,TCP,60,9001  >  34692 [ACK] Seq=3343371 Ack=186001 Win=65535 Len=0
1,2.0370980000000003,54.93.77.70,10.0.2.15,TLSv1.2,1292,Application Data
1,2.079740000000001,10.0.2.15,54.93.77.70,TCP,54,34692  >  9001 [ACK] Seq=186001 Ack=3344609 Win=65535 Len=0
1,2.289957000000001,62.210.85.178,10.0.2.15,TLSv1.2,1618,Application Data
1,2.2900939999999963,10.0.2.15,62.210.85.178,TCP,54,35978  >  9001 [ACK] Seq=3348113 Ack=185591 Win=65535 Len=0
1,2.4951870000000014,54.93.77.70,10.0.2.15,TLSv1.2,2132,Application Data
1,2.495276000000004,10.0.2.15,54.93.77.70,TCP,54,34692  >  9001 [ACK] Seq=186001 Ack=3346687 Win=65535 Len=0
1,2.698685999999995,54.93.77.70,10.0.2.15,TLSv1.2,1618,Application Data
1,2.6987799999999993,10.0.2.15,54.93.77.70,TCP,54,34692  >  9001 [ACK] Seq=186001 Ack=3348251 Win=65535 Len=0
1,2.716966999999997,54.93.77.70,10.0.2.15,TLSv1.2,1104,Application Data
1,2.717097999999993,10.0.2.15,54.93.77.70,TCP,54,34692  >  9001 [ACK] Seq=186001 Ack=3349301 Win=65535 Len=0
1,2.720208999999997,10.0.2.15,54.93.77.70,TLSv1.2,590,Application Data
1,2.7203889999999973,54.93.77.70,10.0.2.15,TCP,60,9001  >  34692 [ACK] Seq=3349301 Ack=186537 Win=65535 Len=0
1,2.9001739999999927,62.210.85.178,10.0.2.15,TLSv1.2,590,Application Data
1,2.9007799999999975,10.0.2.15,62.210.85.178,TLSv1.2,590,Application Data
1,2.900938999999994,62.210.85.178,10.0.2.15,TCP,60,9001  >  35978 [ACK] Seq=186127 Ack=3348649 Win=65535 Len=0
1,2.9985259999999982,54.93.77.70,10.0.2.15,TLSv1.2,590,Application Data
1,2.998993999999996,10.0.2.15,54.93.77.70,TLSv1.2,590,Application Data
1,2.9991150000000033,54.93.77.70,10.0.2.15,TCP,60,9001  >  34692 [ACK] Seq=3349837 Ack=187073 Win=65535 Len=0
1,3.107809000000003,62.210.85.178,10.0.2.15,TLSv1.2,590,Application Data
1,3.1125849999999957,10.0.2.15,62.210.85.178,TLSv1.2,590,Application Data
1,3.1127809999999982,62.210.85.178,10.0.2.15,TCP,60,9001  >  35978 [ACK] Seq=186663 Ack=3349185 Win=65535 Len=0
1,3.124746000000002,10.0.2.15,62.210.85.178,TLSv1.2,4124,Application Data
1,3.124885000000006,10.0.2.15,62.210.85.178,TCP,2974,35978  >  9001 [ACK] Seq=3353255 Ack=186663 Win=65535 Len=2920 [TCP segment of a reassembled PDU]
1,3.124927999999997,62.210.85.178,10.0.2.15,TCP,60,9001  >  35978 [ACK] Seq=186663 Ack=3350645 Win=65535 Len=0
1,3.1249420000000043,62.210.85.178,10.0.2.15,TCP,60,9001  >  35978 [ACK] Seq=186663 Ack=3352105 Win=65535 Len=0
1,3.124947000000006,62.210.85.178,10.0.2.15,TCP,60,9001  >  35978 [ACK] Seq=186663 Ack=3353255 Win=65535 Len=0
1,3.124949000000001,62.210.85.178,10.0.2.15,TCP,60,9001  >  35978 [ACK] Seq=186663 Ack=3354715 Win=65535 Len=0
1,3.1249519999999933,62.210.85.178,10.0.2.15,TCP,60,9001  >  35978 [ACK] Seq=186663 Ack=3356175 Win=65535 Len=0
1,3.124988000000002,10.0.2.15,62.210.85.178,TLSv1.2,1204,Application Data
1,3.125021000000004,62.210.85.178,10.0.2.15,TCP,60,9001  >  35978 [ACK] Seq=186663 Ack=3357325 Win=65535 Len=0
1,3.1250670000000014,10.0.2.15,62.210.85.178,TLSv1.2,4124,Application Data
1,3.1251000000000033,62.210.85.178,10.0.2.15,TCP,60,9001  >  35978 [ACK] Seq=186663 Ack=3358785 Win=65535 Len=0
1,3.1251079999999973,62.210.85.178,10.0.2.15,TCP,60,9001  >  35978 [ACK] Seq=186663 Ack=3360245 Win=65535 Len=0
1,3.1251120000000014,62.210.85.178,10.0.2.15,TCP,60,9001  >  35978 [ACK] Seq=186663 Ack=3361395 Win=65535 Len=0
1,3.1251510000000025,10.0.2.15,62.210.85.178,TLSv1.2,4124,Application Data
1,3.1252549999999957,62.210.85.178,10.0.2.15,TCP,60,9001  >  35978 [ACK] Seq=186663 Ack=3362855 Win=65535 Len=0
1,3.1252659999999963,62.210.85.178,10.0.2.15,TCP,60,9001  >  35978 [ACK] Seq=186663 Ack=3364315 Win=65535 Len=0
1,3.125269000000003,62.210.85.178,10.0.2.15,TCP,60,9001  >  35978 [ACK] Seq=186663 Ack=3365465 Win=65535 Len=0
1,3.125298000000001,10.0.2.15,62.210.85.178,TLSv1.2,332,Application Data
1,3.125333999999995,62.210.85.178,10.0.2.15,TCP,60,9001  >  35978 [ACK] Seq=186663 Ack=3365743 Win=65535 Len=0
1,3.1253970000000066,10.0.2.15,62.210.85.178,TLSv1.2,3868,Application Data
1,3.1254339999999985,62.210.85.178,10.0.2.15,TCP,60,9001  >  35978 [ACK] Seq=186663 Ack=3367203 Win=65535 Len=0
1,3.1254420000000067,62.210.85.178,10.0.2.15,TCP,60,9001  >  35978 [ACK] Seq=186663 Ack=3368663 Win=65535 Len=0
1,3.125444999999999,62.210.85.178,10.0.2.15,TCP,60,9001  >  35978 [ACK] Seq=186663 Ack=3369557 Win=65535 Len=0
1,3.125484,10.0.2.15,62.210.85.178,TLSv1.2,4124,Application Data
1,3.125518999999997,62.210.85.178,10.0.2.15,TCP,60,9001  >  35978 [ACK] Seq=186663 Ack=3371017 Win=65535 Len=0
1,3.125524999999996,62.210.85.178,10.0.2.15,TCP,60,9001  >  35978 [ACK] Seq=186663 Ack=3372477 Win=65535 Len=0
1,3.1255290000000002,62.210.85.178,10.0.2.15,TCP,60,9001  >  35978 [ACK] Seq=186663 Ack=3373627 Win=65535 Len=0
1,3.1255629999999996,10.0.2.15,62.210.85.178,TLSv1.2,3030,Application Data
1,3.1255979999999965,62.210.85.178,10.0.2.15,TCP,60,9001  >  35978 [ACK] Seq=186663 Ack=3375087 Win=65535 Len=0
1,3.125604999999993,62.210.85.178,10.0.2.15,TCP,60,9001  >  35978 [ACK] Seq=186663 Ack=3376547 Win=65535 Len=0
1,3.1256079999999997,62.210.85.178,10.0.2.15,TCP,60,9001  >  35978 [ACK] Seq=186663 Ack=3376603 Win=65535 Len=0
1,3.134851999999995,10.0.2.15,62.210.85.178,TLSv1.2,4124,Application Data
1,3.1349560000000025,62.210.85.178,10.0.2.15,TCP,60,9001  >  35978 [ACK] Seq=186663 Ack=3378063 Win=65535 Len=0
1,3.1349830000000054,62.210.85.178,10.0.2.15,TCP,60,9001  >  35978 [ACK] Seq=186663 Ack=3379523 Win=65535 Len=0
1,3.134985999999998,62.210.85.178,10.0.2.15,TCP,60,9001  >  35978 [ACK] Seq=186663 Ack=3380673 Win=65535 Len=0
1,3.1350359999999995,10.0.2.15,62.210.85.178,TLSv1.2,4124,Application Data
1,3.135097000000002,62.210.85.178,10.0.2.15,TCP,60,9001  >  35978 [ACK] Seq=186663 Ack=3382133 Win=65535 Len=0
1,3.135104999999996,62.210.85.178,10.0.2.15,TCP,60,9001  >  35978 [ACK] Seq=186663 Ack=3383593 Win=65535 Len=0
1,3.1351080000000024,62.210.85.178,10.0.2.15,TCP,60,9001  >  35978 [ACK] Seq=186663 Ack=3384743 Win=65535 Len=0
1,3.1351429999999993,10.0.2.15,62.210.85.178,TLSv1.2,4124,Application Data
1,3.1351769999999988,62.210.85.178,10.0.2.15,TCP,60,9001  >  35978 [ACK] Seq=186663 Ack=3386203 Win=65535 Len=0
1,3.135184999999993,62.210.85.178,10.0.2.15,TCP,60,9001  >  35978 [ACK] Seq=186663 Ack=3387663 Win=65535 Len=0
1,3.135188999999997,62.210.85.178,10.0.2.15,TCP,60,9001  >  35978 [ACK] Seq=186663 Ack=3388813 Win=65535 Len=0
1,3.1352250000000055,10.0.2.15,62.210.85.178,TLSv1.2,268,Application Data
1,3.135257999999993,62.210.85.178,10.0.2.15,TCP,60,9001  >  35978 [ACK] Seq=186663 Ack=3389027 Win=65535 Len=0
1,3.2056249999999977,54.93.77.70,10.0.2.15,TLSv1.2,590,Application Data
1,3.238478999999998,54.93.77.70,10.0.2.15,TCP,2950,"9001  >  34692 [PSH, ACK] Seq=3350373 Ack=187073 Win=65535 Len=2896 [TCP segment of a reassembled PDU]"
1,3.238617000000005,10.0.2.15,54.93.77.70,TCP,54,34692  >  9001 [ACK] Seq=187073 Ack=3353269 Win=65535 Len=0
1,3.2391350000000045,54.93.77.70,10.0.2.15,TLSv1.2,4912,"Application Data, Application Data"
1,3.2392210000000006,10.0.2.15,54.93.77.70,TCP,54,34692  >  9001 [ACK] Seq=187073 Ack=3358127 Win=65535 Len=0
1,3.2619590000000045,54.93.77.70,10.0.2.15,TLSv1.2,5846,Application Data
1,3.2620660000000044,10.0.2.15,54.93.77.70,TCP,54,34692  >  9001 [ACK] Seq=187073 Ack=3363919 Win=65535 Len=0
1,3.2649749999999926,54.93.77.70,10.0.2.15,TLSv1.2,5846,Application Data [TCP segment of a reassembled PDU]
1,3.2650210000000044,54.93.77.70,10.0.2.15,TLSv1.2,3978,"Application Data, Application Data"
1,3.265067000000002,10.0.2.15,54.93.77.70,TCP,54,34692  >  9001 [ACK] Seq=187073 Ack=3369711 Win=65535 Len=0
1,3.2651620000000037,10.0.2.15,54.93.77.70,TCP,54,34692  >  9001 [ACK] Seq=187073 Ack=3373635 Win=65535 Len=0
1,3.281626000000003,54.93.77.70,10.0.2.15,TCP,2950,"9001  >  34692 [PSH, ACK] Seq=3373635 Ack=187073 Win=65535 Len=2896 [TCP segment of a reassembled PDU]"
1,3.2817440000000033,54.93.77.70,10.0.2.15,TLSv1.2,2950,Application Data [TCP segment of a reassembled PDU]
1,3.2818110000000047,10.0.2.15,54.93.77.70,TCP,54,34692  >  9001 [ACK] Seq=187073 Ack=3376531 Win=65535 Len=0
1,3.281907000000004,54.93.77.70,10.0.2.15,TLSv1.2,2016,Application Data
1,3.281997000000004,10.0.2.15,54.93.77.70,TCP,54,34692  >  9001 [ACK] Seq=187073 Ack=3381389 Win=65535 Len=0
1,3.282203999999993,10.0.2.15,54.93.77.70,TLSv1.2,1104,Application Data
1,3.2822900000000033,54.93.77.70,10.0.2.15,TCP,60,9001  >  34692 [ACK] Seq=3381389 Ack=188123 Win=65535 Len=0
1,3.3006400000000014,54.93.77.70,10.0.2.15,TLSv1.2,8858,"Application Data, Application Data, Application Data"
1,3.3007240000000024,10.0.2.15,54.93.77.70,TCP,54,34692  >  9001 [ACK] Seq=188123 Ack=3390193 Win=65535 Len=0
1,3.3038159999999976,10.0.2.15,54.93.77.70,TLSv1.2,590,Application Data
1,3.3039799999999957,54.93.77.70,10.0.2.15,TCP,60,9001  >  34692 [ACK] Seq=3390193 Ack=188659 Win=65535 Len=0
1,3.3944369999999964,62.210.85.178,10.0.2.15,TLSv1.2,1104,Application Data
1,3.435689999999994,10.0.2.15,62.210.85.178,TCP,54,35978  >  9001 [ACK] Seq=3389027 Ack=187713 Win=65535 Len=0
1,3.4944789999999983,62.210.85.178,10.0.2.15,TLSv1.2,590,Application Data
1,3.4946410000000014,10.0.2.15,62.210.85.178,TCP,54,35978  >  9001 [ACK] Seq=3389027 Ack=188249 Win=65535 Len=0
1,3.4952360000000056,10.0.2.15,62.210.85.178,TLSv1.2,590,Application Data
1,3.4953720000000033,62.210.85.178,10.0.2.15,TCP,60,9001  >  35978 [ACK] Seq=188249 Ack=3389563 Win=65535 Len=0
1,3.5862130000000008,54.93.77.70,10.0.2.15,TLSv1.2,590,Application Data
1,3.586675999999997,10.0.2.15,54.93.77.70,TLSv1.2,590,Application Data
1,3.5868190000000055,54.93.77.70,10.0.2.15,TCP,60,9001  >  34692 [ACK] Seq=3390729 Ack=189195 Win=65535 Len=0
1,3.9292549999999977,62.210.85.178,10.0.2.15,TLSv1.2,590,Application Data
1,3.935760000000002,10.0.2.15,62.210.85.178,TLSv1.2,590,Application Data
1,3.935937999999993,62.210.85.178,10.0.2.15,TCP,60,9001  >  35978 [ACK] Seq=188785 Ack=3390099 Win=65535 Len=0
1,3.9484740000000045,10.0.2.15,62.210.85.178,TLSv1.2,4124,Application Data
1,3.9485870000000034,10.0.2.15,62.210.85.178,TCP,2974,35978  >  9001 [ACK] Seq=3394169 Ack=188785 Win=65535 Len=2920 [TCP segment of a reassembled PDU]
1,3.948631000000006,62.210.85.178,10.0.2.15,TCP,60,9001  >  35978 [ACK] Seq=188785 Ack=3391559 Win=65535 Len=0
1,3.9486440000000016,62.210.85.178,10.0.2.15,TCP,60,9001  >  35978 [ACK] Seq=188785 Ack=3393019 Win=65535 Len=0
1,3.948649000000003,62.210.85.178,10.0.2.15,TCP,60,9001  >  35978 [ACK] Seq=188785 Ack=3394169 Win=65535 Len=0
1,3.9486519999999956,62.210.85.178,10.0.2.15,TCP,60,9001  >  35978 [ACK] Seq=188785 Ack=3395629 Win=65535 Len=0
1,3.9486550000000022,62.210.85.178,10.0.2.15,TCP,60,9001  >  35978 [ACK] Seq=188785 Ack=3397089 Win=65535 Len=0
1,3.9486909999999966,10.0.2.15,62.210.85.178,TLSv1.2,1204,Application Data
1,3.948729,62.210.85.178,10.0.2.15,TCP,60,9001  >  35978 [ACK] Seq=188785 Ack=3398239 Win=65535 Len=0
1,3.9487749999999977,10.0.2.15,62.210.85.178,TLSv1.2,4124,Application Data
1,3.9488099999999946,62.210.85.178,10.0.2.15,TCP,60,9001  >  35978 [ACK] Seq=188785 Ack=3399699 Win=65535 Len=0
1,3.9488170000000054,62.210.85.178,10.0.2.15,TCP,60,9001  >  35978 [ACK] Seq=188785 Ack=3401159 Win=65535 Len=0
1,3.9488209999999953,62.210.85.178,10.0.2.15,TCP,60,9001  >  35978 [ACK] Seq=188785 Ack=3402309 Win=65535 Len=0
1,3.948858999999999,10.0.2.15,62.210.85.178,TLSv1.2,4124,Application Data
1,3.948926,62.210.85.178,10.0.2.15,TCP,60,9001  >  35978 [ACK] Seq=188785 Ack=3403769 Win=65535 Len=0
1,3.948937000000001,62.210.85.178,10.0.2.15,TCP,60,9001  >  35978 [ACK] Seq=188785 Ack=3405229 Win=65535 Len=0
1,3.948941000000005,62.210.85.178,10.0.2.15,TCP,60,9001  >  35978 [ACK] Seq=188785 Ack=3406379 Win=65535 Len=0
1,3.9489769999999993,10.0.2.15,62.210.85.178,TLSv1.2,332,Application Data
1,3.9490160000000003,62.210.85.178,10.0.2.15,TCP,60,9001  >  35978 [ACK] Seq=188785 Ack=3406657 Win=65535 Len=0
1,3.949076000000005,10.0.2.15,62.210.85.178,TLSv1.2,3868,Application Data
1,3.9491160000000036,62.210.85.178,10.0.2.15,TCP,60,9001  >  35978 [ACK] Seq=188785 Ack=3408117 Win=65535 Len=0
1,3.9491239999999976,62.210.85.178,10.0.2.15,TCP,60,9001  >  35978 [ACK] Seq=188785 Ack=3409577 Win=65535 Len=0
1,3.9491280000000017,62.210.85.178,10.0.2.15,TCP,60,9001  >  35978 [ACK] Seq=188785 Ack=3410471 Win=65535 Len=0
1,3.9491660000000053,10.0.2.15,62.210.85.178,TLSv1.2,4124,Application Data
1,3.9492060000000038,62.210.85.178,10.0.2.15,TCP,60,9001  >  35978 [ACK] Seq=188785 Ack=3411931 Win=65535 Len=0
1,3.949213999999998,62.210.85.178,10.0.2.15,TCP,60,9001  >  35978 [ACK] Seq=188785 Ack=3413391 Win=65535 Len=0
1,3.949218000000002,62.210.85.178,10.0.2.15,TCP,60,9001  >  35978 [ACK] Seq=188785 Ack=3414541 Win=65535 Len=0
1,3.9492539999999963,10.0.2.15,62.210.85.178,TLSv1.2,3030,Application Data
1,3.9492929999999973,62.210.85.178,10.0.2.15,TCP,60,9001  >  35978 [ACK] Seq=188785 Ack=3416001 Win=65535 Len=0
1,3.9493010000000055,62.210.85.178,10.0.2.15,TCP,60,9001  >  35978 [ACK] Seq=188785 Ack=3417461 Win=65535 Len=0
1,3.949303999999998,62.210.85.178,10.0.2.15,TCP,60,9001  >  35978 [ACK] Seq=188785 Ack=3417517 Win=65535 Len=0
1,3.958603999999994,10.0.2.15,62.210.85.178,TLSv1.2,4124,Application Data
1,3.958720999999997,62.210.85.178,10.0.2.15,TCP,60,9001  >  35978 [ACK] Seq=188785 Ack=3418977 Win=65535 Len=0
1,3.9587350000000043,62.210.85.178,10.0.2.15,TCP,60,9001  >  35978 [ACK] Seq=188785 Ack=3420437 Win=65535 Len=0
1,3.9587379999999968,62.210.85.178,10.0.2.15,TCP,60,9001  >  35978 [ACK] Seq=188785 Ack=3421587 Win=65535 Len=0
1,3.958788999999996,10.0.2.15,62.210.85.178,TLSv1.2,4124,Application Data
1,3.958832000000001,62.210.85.178,10.0.2.15,TCP,60,9001  >  35978 [ACK] Seq=188785 Ack=3423047 Win=65535 Len=0
1,3.9588410000000067,62.210.85.178,10.0.2.15,TCP,60,9001  >  35978 [ACK] Seq=188785 Ack=3424507 Win=65535 Len=0
1,3.9588449999999966,62.210.85.178,10.0.2.15,TCP,60,9001  >  35978 [ACK] Seq=188785 Ack=3425657 Win=65535 Len=0
1,3.9588859999999926,10.0.2.15,62.210.85.178,TLSv1.2,4124,Application Data
1,3.9589270000000027,62.210.85.178,10.0.2.15,TCP,60,9001  >  35978 [ACK] Seq=188785 Ack=3427117 Win=65535 Len=0
1,3.9589349999999968,62.210.85.178,10.0.2.15,TCP,60,9001  >  35978 [ACK] Seq=188785 Ack=3428577 Win=65535 Len=0
1,3.9589399999999983,62.210.85.178,10.0.2.15,TCP,60,9001  >  35978 [ACK] Seq=188785 Ack=3429727 Win=65535 Len=0
1,3.958979999999997,10.0.2.15,62.210.85.178,TLSv1.2,4124,Application Data
1,3.9590180000000004,62.210.85.178,10.0.2.15,TCP,60,9001  >  35978 [ACK] Seq=188785 Ack=3431187 Win=65535 Len=0
1,3.959027000000006,62.210.85.178,10.0.2.15,TCP,60,9001  >  35978 [ACK] Seq=188785 Ack=3432647 Win=65535 Len=0
1,3.959030999999996,62.210.85.178,10.0.2.15,TCP,60,9001  >  35978 [ACK] Seq=188785 Ack=3433797 Win=65535 Len=0
1,3.959065999999993,10.0.2.15,62.210.85.178,TLSv1.2,332,Application Data
1,3.9591039999999964,62.210.85.178,10.0.2.15,TCP,60,9001  >  35978 [ACK] Seq=188785 Ack=3434075 Win=65535 Len=0
1,3.9591630000000038,10.0.2.15,62.210.85.178,TLSv1.2,3868,Application Data
1,3.9592039999999997,62.210.85.178,10.0.2.15,TCP,60,9001  >  35978 [ACK] Seq=188785 Ack=3435535 Win=65535 Len=0
1,3.9592119999999937,62.210.85.178,10.0.2.15,TCP,60,9001  >  35978 [ACK] Seq=188785 Ack=3436995 Win=65535 Len=0
1,3.959215999999998,62.210.85.178,10.0.2.15,TCP,60,9001  >  35978 [ACK] Seq=188785 Ack=3437889 Win=65535 Len=0
1,3.9592540000000014,10.0.2.15,62.210.85.178,TLSv1.2,4124,Application Data
1,3.9592930000000024,62.210.85.178,10.0.2.15,TCP,60,9001  >  35978 [ACK] Seq=188785 Ack=3439349 Win=65535 Len=0
1,3.9593009999999964,62.210.85.178,10.0.2.15,TCP,60,9001  >  35978 [ACK] Seq=188785 Ack=3440809 Win=65535 Len=0
1,3.959304000000003,62.210.85.178,10.0.2.15,TCP,60,9001  >  35978 [ACK] Seq=188785 Ack=3441959 Win=65535 Len=0
1,3.9593399999999974,10.0.2.15,62.210.85.178,TLSv1.2,3030,Application Data
1,3.959378000000001,62.210.85.178,10.0.2.15,TCP,60,9001  >  35978 [ACK] Seq=188785 Ack=3443419 Win=65535 Len=0
1,3.959385999999995,62.210.85.178,10.0.2.15,TCP,60,9001  >  35978 [ACK] Seq=188785 Ack=3444879 Win=65535 Len=0
1,3.959389999999999,62.210.85.178,10.0.2.15,TCP,60,9001  >  35978 [ACK] Seq=188785 Ack=3444935 Win=65535 Len=0
1,3.9719580000000008,10.0.2.15,62.210.85.178,TLSv1.2,4124,Application Data
1,3.972129999999993,62.210.85.178,10.0.2.15,TCP,60,9001  >  35978 [ACK] Seq=188785 Ack=3446395 Win=65535 Len=0
1,3.9721540000000033,62.210.85.178,10.0.2.15,TCP,60,9001  >  35978 [ACK] Seq=188785 Ack=3447855 Win=65535 Len=0
1,3.972159000000005,62.210.85.178,10.0.2.15,TCP,60,9001  >  35978 [ACK] Seq=188785 Ack=3449005 Win=65535 Len=0
1,3.972217999999998,10.0.2.15,62.210.85.178,TLSv1.2,4124,Application Data
1,3.9722849999999994,62.210.85.178,10.0.2.15,TCP,60,9001  >  35978 [ACK] Seq=188785 Ack=3450465 Win=65535 Len=0
1,3.9722929999999934,62.210.85.178,10.0.2.15,TCP,60,9001  >  35978 [ACK] Seq=188785 Ack=3451925 Win=65535 Len=0
1,3.9722969999999975,62.210.85.178,10.0.2.15,TCP,60,9001  >  35978 [ACK] Seq=188785 Ack=3453075 Win=65535 Len=0
1,3.9723440000000068,10.0.2.15,62.210.85.178,TLSv1.2,4124,Application Data
1,3.972407000000004,62.210.85.178,10.0.2.15,TCP,60,9001  >  35978 [ACK] Seq=188785 Ack=3454535 Win=65535 Len=0
1,3.9724140000000006,62.210.85.178,10.0.2.15,TCP,60,9001  >  35978 [ACK] Seq=188785 Ack=3455995 Win=65535 Len=0
1,3.972419000000002,62.210.85.178,10.0.2.15,TCP,60,9001  >  35978 [ACK] Seq=188785 Ack=3457145 Win=65535 Len=0
1,3.9724609999999956,10.0.2.15,62.210.85.178,TLSv1.2,4124,Application Data
1,3.972523999999993,62.210.85.178,10.0.2.15,TCP,60,9001  >  35978 [ACK] Seq=188785 Ack=3458605 Win=65535 Len=0
1,3.9725310000000036,62.210.85.178,10.0.2.15,TCP,60,9001  >  35978 [ACK] Seq=188785 Ack=3460065 Win=65535 Len=0
1,3.972538,62.210.85.178,10.0.2.15,TCP,60,9001  >  35978 [ACK] Seq=188785 Ack=3461215 Win=65535 Len=0
1,3.9725820000000027,10.0.2.15,62.210.85.178,TLSv1.2,332,Application Data
1,3.9726210000000037,62.210.85.178,10.0.2.15,TCP,60,9001  >  35978 [ACK] Seq=188785 Ack=3461493 Win=65535 Len=0
1,3.972688000000005,10.0.2.15,62.210.85.178,TLSv1.2,590,Application Data
1,3.972730999999996,62.210.85.178,10.0.2.15,TCP,60,9001  >  35978 [ACK] Seq=188785 Ack=3462029 Win=65535 Len=0
1,4.074877000000001,54.93.77.70,10.0.2.15,TLSv1.2,3674,Application Data
1,4.077877000000001,10.0.2.15,54.93.77.70,TCP,54,34692  >  9001 [ACK] Seq=189195 Ack=3394349 Win=65535 Len=0
1,4.094694000000004,54.93.77.70,10.0.2.15,TCP,2950,"9001  >  34692 [PSH, ACK] Seq=3394349 Ack=189195 Win=65535 Len=2896 [TCP segment of a reassembled PDU]"
1,4.094755000000006,54.93.77.70,10.0.2.15,TLSv1.2,778,Application Data
1,4.094819000000001,10.0.2.15,54.93.77.70,TCP,54,34692  >  9001 [ACK] Seq=189195 Ack=3397245 Win=65535 Len=0
1,4.096857,54.93.77.70,10.0.2.15,TCP,2950,"9001  >  34692 [PSH, ACK] Seq=3397969 Ack=189195 Win=65535 Len=2896 [TCP segment of a reassembled PDU]"
1,4.096926999999994,10.0.2.15,54.93.77.70,TCP,54,34692  >  9001 [ACK] Seq=189195 Ack=3400865 Win=65535 Len=0
1,4.109151999999995,54.93.77.70,10.0.2.15,TLSv1.2,8742,"Application Data, Application Data, Application Data"
1,4.109746999999999,10.0.2.15,54.93.77.70,TCP,54,34692  >  9001 [ACK] Seq=189195 Ack=3409553 Win=65535 Len=0
1,4.112525000000005,54.93.77.70,10.0.2.15,TLSv1.2,1502,"Application Data, Application Data"
1,4.112643000000006,10.0.2.15,54.93.77.70,TCP,54,34692  >  9001 [ACK] Seq=189195 Ack=3411001 Win=65535 Len=0
1,4.118752000000001,54.93.77.70,10.0.2.15,TCP,2950,"9001  >  34692 [PSH, ACK] Seq=3411001 Ack=189195 Win=65535 Len=2896 [TCP segment of a reassembled PDU]"
1,4.118790000000004,54.93.77.70,10.0.2.15,TLSv1.2,4326,"Application Data, Application Data"
1,4.118882999999997,10.0.2.15,54.93.77.70,TCP,54,34692  >  9001 [ACK] Seq=189195 Ack=3418169 Win=65535 Len=0
1,4.119146999999998,10.0.2.15,54.93.77.70,TLSv1.2,590,Application Data
1,4.119280000000003,54.93.77.70,10.0.2.15,TCP,60,9001  >  34692 [ACK] Seq=3418169 Ack=189731 Win=65535 Len=0
1,4.124013000000005,54.93.77.70,10.0.2.15,TCP,1502,"9001  >  34692 [PSH, ACK] Seq=3418169 Ack=189731 Win=65535 Len=1448 [TCP segment of a reassembled PDU]"
1,4.1241330000000005,10.0.2.15,54.93.77.70,TCP,54,34692  >  9001 [ACK] Seq=189731 Ack=3419617 Win=65535 Len=0
1,4.127176000000006,54.93.77.70,10.0.2.15,TLSv1.2,7294,"Application Data, Application Data"
1,4.127274,10.0.2.15,54.93.77.70,TCP,54,34692  >  9001 [ACK] Seq=189731 Ack=3426857 Win=65535 Len=0
1,4.136550999999997,54.93.77.70,10.0.2.15,TLSv1.2,170,Application Data
1,4.136578999999998,54.93.77.70,10.0.2.15,TCP,2950,"9001  >  34692 [PSH, ACK] Seq=3426973 Ack=189731 Win=65535 Len=2896 [TCP segment of a reassembled PDU]"
1,4.136621000000005,10.0.2.15,54.93.77.70,TCP,54,34692  >  9001 [ACK] Seq=189731 Ack=3429869 Win=65535 Len=0
1,4.148054999999999,54.93.77.70,10.0.2.15,TLSv1.2,10190,"Application Data, Application Data, Application Data, Application Data"
1,4.148206000000002,10.0.2.15,54.93.77.70,TCP,54,34692  >  9001 [ACK] Seq=189731 Ack=3440005 Win=65535 Len=0
1,4.148450999999994,54.93.77.70,10.0.2.15,TCP,2950,"9001  >  34692 [PSH, ACK] Seq=3440005 Ack=189731 Win=65535 Len=2896 [TCP segment of a reassembled PDU]"
1,4.148535999999993,10.0.2.15,54.93.77.70,TLSv1.2,590,Application Data
1,4.148645000000002,54.93.77.70,10.0.2.15,TCP,60,9001  >  34692 [ACK] Seq=3442901 Ack=190267 Win=65535 Len=0
1,4.149278999999993,54.93.77.70,10.0.2.15,TLSv1.2,4398,Application Data [TCP segment of a reassembled PDU]
1,4.149345999999994,10.0.2.15,54.93.77.70,TCP,54,34692  >  9001 [ACK] Seq=190267 Ack=3447245 Win=65535 Len=0
1,4.152984000000004,54.93.77.70,10.0.2.15,TLSv1.2,496,"Application Data, Application Data"
1,4.158850000000001,10.0.2.15,54.93.77.70,TLSv1.2,590,Application Data
1,4.159042999999997,54.93.77.70,10.0.2.15,TCP,60,9001  >  34692 [ACK] Seq=3447687 Ack=190803 Win=65535 Len=0
1,4.159280999999993,54.93.77.70,10.0.2.15,TCP,2950,"9001  >  34692 [PSH, ACK] Seq=3447687 Ack=190803 Win=65535 Len=2896 [TCP segment of a reassembled PDU]"
1,4.159398999999993,10.0.2.15,54.93.77.70,TCP,54,34692  >  9001 [ACK] Seq=190803 Ack=3450583 Win=65535 Len=0
1,4.1764399999999995,54.93.77.70,10.0.2.15,TLSv1.2,778,Application Data
1,4.183490000000006,54.93.77.70,10.0.2.15,TLSv1.2,7294,Application Data
1,4.183631000000005,10.0.2.15,54.93.77.70,TCP,54,34692  >  9001 [ACK] Seq=190803 Ack=3458547 Win=65535 Len=0
1,4.190760999999995,54.93.77.70,10.0.2.15,TLSv1.2,2950,"Application Data, Application Data"
1,4.191073000000003,10.0.2.15,54.93.77.70,TCP,54,34692  >  9001 [ACK] Seq=190803 Ack=3461443 Win=65535 Len=0
1,4.191318999999993,54.93.77.70,10.0.2.15,TCP,1502,"9001  >  34692 [PSH, ACK] Seq=3461443 Ack=190803 Win=65535 Len=1448 [TCP segment of a reassembled PDU]"
1,4.191597000000002,10.0.2.15,54.93.77.70,TCP,54,34692  >  9001 [ACK] Seq=190803 Ack=3462891 Win=65535 Len=0
1,4.199530999999993,54.93.77.70,10.0.2.15,TLSv1.2,380,Application Data
1,4.202937000000006,10.0.2.15,54.93.77.70,TLSv1.2,590,Application Data
1,4.203108999999998,54.93.77.70,10.0.2.15,TCP,60,9001  >  34692 [ACK] Seq=3463217 Ack=191339 Win=65535 Len=0
1,4.217491999999993,62.210.85.178,10.0.2.15,TLSv1.2,590,Application Data
1,4.260447999999997,10.0.2.15,62.210.85.178,TCP,54,35978  >  9001 [ACK] Seq=3462029 Ack=189321 Win=65535 Len=0
1,4.366673000000006,62.210.85.178,10.0.2.15,TLSv1.2,1104,Application Data
1,4.366771999999997,10.0.2.15,62.210.85.178,TCP,54,35978  >  9001 [ACK] Seq=3462029 Ack=190371 Win=65535 Len=0
1,4.383443999999997,62.210.85.178,10.0.2.15,TLSv1.2,590,Application Data
1,4.383544999999998,10.0.2.15,62.210.85.178,TCP,54,35978  >  9001 [ACK] Seq=3462029 Ack=190907 Win=65535 Len=0
1,4.383943000000002,10.0.2.15,62.210.85.178,TLSv1.2,590,Application Data
1,4.384039000000001,62.210.85.178,10.0.2.15,TCP,60,9001  >  35978 [ACK] Seq=190907 Ack=3462565 Win=65535 Len=0
1,4.496444999999994,54.93.77.70,10.0.2.15,TLSv1.2,590,Application Data
1,4.496938,10.0.2.15,54.93.77.70,TLSv1.2,590,Application Data
1,4.497108999999995,54.93.77.70,10.0.2.15,TCP,60,9001  >  34692 [ACK] Seq=3463753 Ack=191875 Win=65535 Len=0
1,4.603660000000005,62.210.85.178,10.0.2.15,TLSv1.2,590,Application Data
1,4.607277999999994,10.0.2.15,62.210.85.178,TLSv1.2,590,Application Data
1,4.607445999999996,62.210.85.178,10.0.2.15,TCP,60,9001  >  35978 [ACK] Seq=191443 Ack=3463101 Win=65535 Len=0
1,4.617150999999993,10.0.2.15,62.210.85.178,TLSv1.2,4124,Application Data
1,4.617763999999994,62.210.85.178,10.0.2.15,TCP,60,9001  >  35978 [ACK] Seq=191443 Ack=3464561 Win=65535 Len=0
1,4.617813999999996,62.210.85.178,10.0.2.15,TCP,60,9001  >  35978 [ACK] Seq=191443 Ack=3466021 Win=65535 Len=0
1,4.617819999999995,62.210.85.178,10.0.2.15,TCP,60,9001  >  35978 [ACK] Seq=191443 Ack=3467171 Win=65535 Len=0
1,4.617925999999997,10.0.2.15,62.210.85.178,TLSv1.2,4124,Application Data
1,4.618013000000005,62.210.85.178,10.0.2.15,TCP,60,9001  >  35978 [ACK] Seq=191443 Ack=3468631 Win=65535 Len=0
1,4.618025000000003,62.210.85.178,10.0.2.15,TCP,60,9001  >  35978 [ACK] Seq=191443 Ack=3470091 Win=65535 Len=0
1,4.6180300000000045,62.210.85.178,10.0.2.15,TCP,60,9001  >  35978 [ACK] Seq=191443 Ack=3471241 Win=65535 Len=0
1,4.618090999999993,10.0.2.15,62.210.85.178,TLSv1.2,4124,Application Data
1,4.618195,62.210.85.178,10.0.2.15,TCP,60,9001  >  35978 [ACK] Seq=191443 Ack=3472701 Win=65535 Len=0
1,4.618206000000001,62.210.85.178,10.0.2.15,TCP,60,9001  >  35978 [ACK] Seq=191443 Ack=3474161 Win=65535 Len=0
1,4.618211000000002,62.210.85.178,10.0.2.15,TCP,60,9001  >  35978 [ACK] Seq=191443 Ack=3475311 Win=65535 Len=0
1,4.618261000000004,10.0.2.15,62.210.85.178,TLSv1.2,3352,Application Data
1,4.618356000000006,62.210.85.178,10.0.2.15,TCP,60,9001  >  35978 [ACK] Seq=191443 Ack=3476771 Win=65535 Len=0
1,4.618367000000006,62.210.85.178,10.0.2.15,TCP,60,9001  >  35978 [ACK] Seq=191443 Ack=3478231 Win=65535 Len=0
1,4.618371999999994,62.210.85.178,10.0.2.15,TCP,60,9001  >  35978 [ACK] Seq=191443 Ack=3478609 Win=65535 Len=0
1,4.714051999999995,54.93.77.70,10.0.2.15,TLSv1.2,590,Application Data
1,4.726561000000004,54.93.77.70,10.0.2.15,TLSv1.2,7294,Application Data
1,4.726674000000003,10.0.2.15,54.93.77.70,TCP,54,34692  >  9001 [ACK] Seq=191875 Ack=3471529 Win=65535 Len=0
1,4.743739000000005,54.93.77.70,10.0.2.15,TLSv1.2,568,Application Data
1,4.749493000000001,54.93.77.70,10.0.2.15,TCP,2950,"9001  >  34692 [PSH, ACK] Seq=3472043 Ack=191875 Win=65535 Len=2896 [TCP segment of a reassembled PDU]"
