No.,Time,Source,Destination,Protocol,Length,Info
1,0.14494499999999988,10.0.2.15,54.93.77.70,TLSv1.2,590,Application Data
1,0.1451369999999983,54.93.77.70,10.0.2.15,TCP,60,9001  >  34692 [ACK] Seq=1407671 Ack=77545 Win=65535 Len=0
1,0.19653299999999874,62.210.85.178,10.0.2.15,TLSv1.2,1618,Application Data
1,0.1966329999999985,10.0.2.15,62.210.85.178,TCP,54,35978  >  9001 [ACK] Seq=1407077 Ack=77149 Win=65535 Len=0
1,0.24677900000000008,62.210.85.178,10.0.2.15,TLSv1.2,590,Application Data
1,0.246969,10.0.2.15,62.210.85.178,TCP,54,35978  >  9001 [ACK] Seq=1407077 Ack=77685 Win=65535 Len=0
1,0.24813800000000086,10.0.2.15,62.210.85.178,TLSv1.2,590,Application Data
1,0.2484649999999995,62.210.85.178,10.0.2.15,TCP,60,9001  >  35978 [ACK] Seq=77685 Ack=1407613 Win=65535 Len=0
1,0.3326430000000009,54.93.77.70,10.0.2.15,TLSv1.2,590,Application Data
1,0.3339439999999989,10.0.2.15,54.93.77.70,TLSv1.2,1618,Application Data
1,0.33448900000000137,54.93.77.70,10.0.2.15,TCP,60,9001  >  34692 [ACK] Seq=1408207 Ack=79109 Win=65535 Len=0
1,0.4271780000000014,62.210.85.178,10.0.2.15,TLSv1.2,1618,Application Data
1,0.4275209999999987,10.0.2.15,62.210.85.178,TCP,54,35978  >  9001 [ACK] Seq=1407613 Ack=79249 Win=65535 Len=0
1,0.4708369999999995,10.0.2.15,62.210.85.178,TLSv1.2,590,Application Data
1,0.47173700000000096,62.210.85.178,10.0.2.15,TCP,60,9001  >  35978 [ACK] Seq=79249 Ack=1408149 Win=65535 Len=0
1,0.4828019999999995,10.0.2.15,62.210.85.178,TLSv1.2,1618,Application Data
1,0.4830059999999996,62.210.85.178,10.0.2.15,TCP,60,9001  >  35978 [ACK] Seq=79249 Ack=1409609 Win=65535 Len=0
1,0.4830229999999993,62.210.85.178,10.0.2.15,TCP,60,9001  >  35978 [ACK] Seq=79249 Ack=1409713 Win=65535 Len=0
1,0.5655559999999973,54.93.77.70,10.0.2.15,TLSv1.2,590,Application Data
1,0.6065780000000025,10.0.2.15,54.93.77.70,TCP,54,34692  >  9001 [ACK] Seq=79109 Ack=1408743 Win=65535 Len=0
1,0.6144360000000013,54.93.77.70,10.0.2.15,TCP,1502,"9001  >  34692 [PSH, ACK] Seq=1408743 Ack=79109 Win=65535 Len=1448 [TCP segment of a reassembled PDU]"
1,0.6146670000000007,10.0.2.15,54.93.77.70,TCP,54,34692  >  9001 [ACK] Seq=79109 Ack=1410191 Win=65535 Len=0
1,0.6229339999999972,54.93.77.70,10.0.2.15,TLSv1.2,170,Application Data
1,0.6231270000000002,10.0.2.15,54.93.77.70,TCP,54,34692  >  9001 [ACK] Seq=79109 Ack=1410307 Win=65535 Len=0
1,0.630906999999997,10.0.2.15,54.93.77.70,TLSv1.2,590,Application Data
1,0.6313939999999967,54.93.77.70,10.0.2.15,TCP,60,9001  >  34692 [ACK] Seq=1410307 Ack=79645 Win=65535 Len=0
1,0.7417660000000019,62.210.85.178,10.0.2.15,TLSv1.2,590,Application Data
1,0.743115999999997,10.0.2.15,62.210.85.178,TLSv1.2,590,Application Data
1,0.743509999999997,62.210.85.178,10.0.2.15,TCP,60,9001  >  35978 [ACK] Seq=79785 Ack=1410249 Win=65535 Len=0
1,0.9653290000000005,54.93.77.70,10.0.2.15,TLSv1.2,590,Application Data
1,0.9665349999999968,10.0.2.15,54.93.77.70,TLSv1.2,590,Application Data
1,0.9673210000000019,54.93.77.70,10.0.2.15,TCP,60,9001  >  34692 [ACK] Seq=1410843 Ack=80181 Win=65535 Len=0
1,1.1700539999999968,62.210.85.178,10.0.2.15,TLSv1.2,590,Application Data
1,1.1919250000000012,10.0.2.15,62.210.85.178,TLSv1.2,590,Application Data
1,1.1924469999999978,62.210.85.178,10.0.2.15,TCP,60,9001  >  35978 [ACK] Seq=80321 Ack=1410785 Win=65535 Len=0
1,1.207578999999999,10.0.2.15,62.210.85.178,TLSv1.2,4124,Application Data
1,1.2079470000000008,10.0.2.15,62.210.85.178,TCP,2974,35978  >  9001 [ACK] Seq=1414855 Ack=80321 Win=65535 Len=2920 [TCP segment of a reassembled PDU]
1,1.208121000000002,62.210.85.178,10.0.2.15,TCP,60,9001  >  35978 [ACK] Seq=80321 Ack=1412245 Win=65535 Len=0
1,1.2081720000000011,62.210.85.178,10.0.2.15,TCP,60,9001  >  35978 [ACK] Seq=80321 Ack=1413705 Win=65535 Len=0
1,1.2081929999999979,62.210.85.178,10.0.2.15,TCP,60,9001  >  35978 [ACK] Seq=80321 Ack=1414855 Win=65535 Len=0
1,1.208206999999998,62.210.85.178,10.0.2.15,TCP,60,9001  >  35978 [ACK] Seq=80321 Ack=1416315 Win=65535 Len=0
1,1.2082179999999987,62.210.85.178,10.0.2.15,TCP,60,9001  >  35978 [ACK] Seq=80321 Ack=1417775 Win=65535 Len=0
1,1.208366999999999,10.0.2.15,62.210.85.178,TLSv1.2,1204,Application Data
1,1.2086480000000002,10.0.2.15,62.210.85.178,TCP,2974,35978  >  9001 [ACK] Seq=1418925 Ack=80321 Win=65535 Len=2920 [TCP segment of a reassembled PDU]
1,1.2088209999999968,62.210.85.178,10.0.2.15,TCP,60,9001  >  35978 [ACK] Seq=80321 Ack=1418925 Win=65535 Len=0
1,1.208983,10.0.2.15,62.210.85.178,TLSv1.2,1204,Application Data
1,1.2091239999999992,62.210.85.178,10.0.2.15,TCP,60,9001  >  35978 [ACK] Seq=80321 Ack=1420385 Win=65535 Len=0
1,1.2091499999999975,62.210.85.178,10.0.2.15,TCP,60,9001  >  35978 [ACK] Seq=80321 Ack=1421845 Win=65535 Len=0
1,1.2093489999999996,10.0.2.15,62.210.85.178,TCP,2974,35978  >  9001 [ACK] Seq=1422995 Ack=80321 Win=65535 Len=2920 [TCP segment of a reassembled PDU]
1,1.2094950000000004,62.210.85.178,10.0.2.15,TCP,60,9001  >  35978 [ACK] Seq=80321 Ack=1422995 Win=65535 Len=0
1,1.2097149999999992,10.0.2.15,62.210.85.178,TLSv1.2,1204,Application Data
1,1.2097930000000012,62.210.85.178,10.0.2.15,TCP,60,9001  >  35978 [ACK] Seq=80321 Ack=1424455 Win=65535 Len=0
1,1.209850999999997,62.210.85.178,10.0.2.15,TCP,60,9001  >  35978 [ACK] Seq=80321 Ack=1425915 Win=65535 Len=0
1,1.210010999999998,62.210.85.178,10.0.2.15,TCP,60,9001  >  35978 [ACK] Seq=80321 Ack=1427065 Win=65535 Len=0
1,1.210161000000003,10.0.2.15,62.210.85.178,TLSv1.2,332,Application Data
1,1.2105360000000012,62.210.85.178,10.0.2.15,TCP,60,9001  >  35978 [ACK] Seq=80321 Ack=1427343 Win=65535 Len=0
1,1.2107780000000012,10.0.2.15,62.210.85.178,TLSv1.2,3868,Application Data
1,1.2109289999999966,62.210.85.178,10.0.2.15,TCP,60,9001  >  35978 [ACK] Seq=80321 Ack=1428803 Win=65535 Len=0
1,1.2109559999999995,62.210.85.178,10.0.2.15,TCP,60,9001  >  35978 [ACK] Seq=80321 Ack=1430263 Win=65535 Len=0
1,1.2109690000000022,62.210.85.178,10.0.2.15,TCP,60,9001  >  35978 [ACK] Seq=80321 Ack=1431157 Win=65535 Len=0
1,1.2111369999999972,10.0.2.15,62.210.85.178,TLSv1.2,4124,Application Data
1,1.2113600000000027,10.0.2.15,62.210.85.178,TCP,2974,35978  >  9001 [ACK] Seq=1435227 Ack=80321 Win=65535 Len=2920 [TCP segment of a reassembled PDU]
1,1.211510999999998,62.210.85.178,10.0.2.15,TCP,60,9001  >  35978 [ACK] Seq=80321 Ack=1432617 Win=65535 Len=0
1,1.2115350000000014,62.210.85.178,10.0.2.15,TCP,60,9001  >  35978 [ACK] Seq=80321 Ack=1434077 Win=65535 Len=0
1,1.2115639999999992,62.210.85.178,10.0.2.15,TCP,60,9001  >  35978 [ACK] Seq=80321 Ack=1435227 Win=65535 Len=0
1,1.2115899999999975,62.210.85.178,10.0.2.15,TCP,60,9001  >  35978 [ACK] Seq=80321 Ack=1436687 Win=65535 Len=0
1,1.2116080000000018,62.210.85.178,10.0.2.15,TCP,60,9001  >  35978 [ACK] Seq=80321 Ack=1438147 Win=65535 Len=0
1,1.2117960000000032,10.0.2.15,62.210.85.178,TLSv1.2,110,Application Data
1,1.2120819999999988,62.210.85.178,10.0.2.15,TCP,60,9001  >  35978 [ACK] Seq=80321 Ack=1438203 Win=65535 Len=0
1,1.2215560000000032,10.0.2.15,62.210.85.178,TLSv1.2,4124,Application Data
1,1.221936000000003,62.210.85.178,10.0.2.15,TCP,60,9001  >  35978 [ACK] Seq=80321 Ack=1439663 Win=65535 Len=0
1,1.221974999999997,62.210.85.178,10.0.2.15,TCP,60,9001  >  35978 [ACK] Seq=80321 Ack=1441123 Win=65535 Len=0
1,1.2219900000000017,62.210.85.178,10.0.2.15,TCP,60,9001  >  35978 [ACK] Seq=80321 Ack=1442273 Win=65535 Len=0
1,1.2221319999999984,10.0.2.15,62.210.85.178,TLSv1.2,4124,Application Data
1,1.2226719999999993,62.210.85.178,10.0.2.15,TCP,60,9001  >  35978 [ACK] Seq=80321 Ack=1443733 Win=65535 Len=0
1,1.222722000000001,62.210.85.178,10.0.2.15,TCP,60,9001  >  35978 [ACK] Seq=80321 Ack=1445193 Win=65535 Len=0
1,1.2227410000000027,62.210.85.178,10.0.2.15,TCP,60,9001  >  35978 [ACK] Seq=80321 Ack=1446343 Win=65535 Len=0
1,1.2229220000000005,10.0.2.15,62.210.85.178,TCP,2974,35978  >  9001 [ACK] Seq=1446343 Ack=80321 Win=65535 Len=2920 [TCP segment of a reassembled PDU]
1,1.2232379999999985,10.0.2.15,62.210.85.178,TLSv1.2,1204,Application Data
1,1.2233279999999986,62.210.85.178,10.0.2.15,TCP,60,9001  >  35978 [ACK] Seq=80321 Ack=1447803 Win=65535 Len=0
1,1.223355999999999,62.210.85.178,10.0.2.15,TCP,60,9001  >  35978 [ACK] Seq=80321 Ack=1449263 Win=65535 Len=0
1,1.2235610000000001,10.0.2.15,62.210.85.178,TCP,2974,35978  >  9001 [ACK] Seq=1450413 Ack=80321 Win=65535 Len=2920 [TCP segment of a reassembled PDU]
1,1.223707000000001,62.210.85.178,10.0.2.15,TCP,60,9001  >  35978 [ACK] Seq=80321 Ack=1450413 Win=65535 Len=0
1,1.2238599999999984,10.0.2.15,62.210.85.178,TLSv1.2,1204,Application Data
1,1.2239970000000007,62.210.85.178,10.0.2.15,TCP,60,9001  >  35978 [ACK] Seq=80321 Ack=1451873 Win=65535 Len=0
1,1.224020999999997,62.210.85.178,10.0.2.15,TCP,60,9001  >  35978 [ACK] Seq=80321 Ack=1453333 Win=65535 Len=0
1,1.2242799999999967,10.0.2.15,62.210.85.178,TLSv1.2,2974,Application Data
1,1.2244399999999978,62.210.85.178,10.0.2.15,TCP,60,9001  >  35978 [ACK] Seq=80321 Ack=1454483 Win=65535 Len=0
1,1.2244759999999992,62.210.85.178,10.0.2.15,TCP,60,9001  >  35978 [ACK] Seq=80321 Ack=1455943 Win=65535 Len=0
1,1.2244940000000035,62.210.85.178,10.0.2.15,TCP,60,9001  >  35978 [ACK] Seq=80321 Ack=1457403 Win=65535 Len=0
1,1.2246089999999974,10.0.2.15,62.210.85.178,TLSv1.2,1226,Application Data
1,1.2247560000000028,62.210.85.178,10.0.2.15,TCP,60,9001  >  35978 [ACK] Seq=80321 Ack=1458575 Win=65535 Len=0
1,1.2249799999999986,10.0.2.15,62.210.85.178,TLSv1.2,4124,Application Data
1,1.2252919999999996,62.210.85.178,10.0.2.15,TCP,60,9001  >  35978 [ACK] Seq=80321 Ack=1460035 Win=65535 Len=0
1,1.2253250000000016,62.210.85.178,10.0.2.15,TCP,60,9001  >  35978 [ACK] Seq=80321 Ack=1461495 Win=65535 Len=0
1,1.2253379999999972,62.210.85.178,10.0.2.15,TCP,60,9001  >  35978 [ACK] Seq=80321 Ack=1462645 Win=65535 Len=0
1,1.225441,10.0.2.15,62.210.85.178,TCP,2974,35978  >  9001 [ACK] Seq=1462645 Ack=80321 Win=65535 Len=2920 [TCP segment of a reassembled PDU]
1,1.2256460000000011,10.0.2.15,62.210.85.178,TLSv1.2,110,Application Data
1,1.2257969999999965,62.210.85.178,10.0.2.15,TCP,60,9001  >  35978 [ACK] Seq=80321 Ack=1464105 Win=65535 Len=0
1,1.2258579999999988,62.210.85.178,10.0.2.15,TCP,60,9001  >  35978 [ACK] Seq=80321 Ack=1465565 Win=65535 Len=0
1,1.22588,62.210.85.178,10.0.2.15,TCP,60,9001  >  35978 [ACK] Seq=80321 Ack=1465621 Win=65535 Len=0
1,1.2356590000000018,10.0.2.15,62.210.85.178,TLSv1.2,4124,Application Data
1,1.2361189999999986,62.210.85.178,10.0.2.15,TCP,60,9001  >  35978 [ACK] Seq=80321 Ack=1467081 Win=65535 Len=0
1,1.2361759999999968,62.210.85.178,10.0.2.15,TCP,60,9001  >  35978 [ACK] Seq=80321 Ack=1468541 Win=65535 Len=0
1,1.2362029999999997,62.210.85.178,10.0.2.15,TCP,60,9001  >  35978 [ACK] Seq=80321 Ack=1469691 Win=65535 Len=0
1,1.236456999999998,10.0.2.15,62.210.85.178,TLSv1.2,1682,Application Data
1,1.2367969999999993,62.210.85.178,10.0.2.15,TCP,60,9001  >  35978 [ACK] Seq=80321 Ack=1471151 Win=65535 Len=0
1,1.2368360000000003,62.210.85.178,10.0.2.15,TCP,60,9001  >  35978 [ACK] Seq=80321 Ack=1471319 Win=65535 Len=0
1,1.3006100000000025,54.93.77.70,10.0.2.15,TLSv1.2,3674,Application Data
1,1.3010430000000035,10.0.2.15,54.93.77.70,TCP,54,34692  >  9001 [ACK] Seq=80181 Ack=1414463 Win=65535 Len=0
1,1.316823000000003,54.93.77.70,10.0.2.15,TLSv1.2,590,Application Data
1,1.3276810000000019,54.93.77.70,10.0.2.15,TLSv1.2,7294,Application Data
1,1.3280100000000026,10.0.2.15,54.93.77.70,TCP,54,34692  >  9001 [ACK] Seq=80181 Ack=1422239 Win=65535 Len=0
1,1.332696000000002,54.93.77.70,10.0.2.15,TLSv1.2,568,Application Data
1,1.3386650000000024,54.93.77.70,10.0.2.15,TLSv1.2,5846,Application Data
1,1.3387649999999987,54.93.77.70,10.0.2.15,TCP,1502,"9001  >  34692 [PSH, ACK] Seq=1428545 Ack=80181 Win=65535 Len=1448 [TCP segment of a reassembled PDU]"
1,1.338978000000001,10.0.2.15,54.93.77.70,TCP,54,34692  >  9001 [ACK] Seq=80181 Ack=1428545 Win=65535 Len=0
1,1.3392990000000005,10.0.2.15,54.93.77.70,TCP,54,34692  >  9001 [ACK] Seq=80181 Ack=1429993 Win=65535 Len=0
1,1.343954,54.93.77.70,10.0.2.15,TLSv1.2,2950,Application Data [TCP segment of a reassembled PDU]
1,1.344139000000002,10.0.2.15,54.93.77.70,TCP,54,34692  >  9001 [ACK] Seq=80181 Ack=1432889 Win=65535 Len=0
1,1.344576,54.93.77.70,10.0.2.15,TCP,1502,"9001  >  34692 [PSH, ACK] Seq=1432889 Ack=80181 Win=65535 Len=1448 [TCP segment of a reassembled PDU]"
1,1.3449399999999976,10.0.2.15,54.93.77.70,TCP,54,34692  >  9001 [ACK] Seq=80181 Ack=1434337 Win=65535 Len=0
1,1.3486670000000025,54.93.77.70,10.0.2.15,TLSv1.2,894,"Application Data, Application Data"
1,1.360789999999998,54.93.77.70,10.0.2.15,TCP,2950,"9001  >  34692 [PSH, ACK] Seq=1435177 Ack=80181 Win=65535 Len=2896 [TCP segment of a reassembled PDU]"
1,1.3610130000000034,10.0.2.15,54.93.77.70,TCP,54,34692  >  9001 [ACK] Seq=80181 Ack=1438073 Win=65535 Len=0
1,1.365010999999999,54.93.77.70,10.0.2.15,TLSv1.2,778,Application Data
1,1.365790999999998,10.0.2.15,54.93.77.70,TLSv1.2,590,Application Data
1,1.3662889999999983,54.93.77.70,10.0.2.15,TCP,60,9001  >  34692 [ACK] Seq=1438797 Ack=80717 Win=65535 Len=0
1,1.3707600000000006,54.93.77.70,10.0.2.15,TCP,2950,"9001  >  34692 [PSH, ACK] Seq=1438797 Ack=80717 Win=65535 Len=2896 [TCP segment of a reassembled PDU]"
1,1.3710529999999999,10.0.2.15,54.93.77.70,TCP,54,34692  >  9001 [ACK] Seq=80717 Ack=1441693 Win=65535 Len=0
1,1.3763710000000025,54.93.77.70,10.0.2.15,TLSv1.2,5846,"Application Data, Application Data"
1,1.3764860000000034,54.93.77.70,10.0.2.15,TLSv1.2,5846,Application Data [TCP segment of a reassembled PDU]
1,1.3768350000000034,10.0.2.15,54.93.77.70,TCP,54,34692  >  9001 [ACK] Seq=80717 Ack=1453277 Win=65535 Len=0
1,1.3809330000000024,54.93.77.70,10.0.2.15,TLSv1.2,1502,Application Data [TCP segment of a reassembled PDU]
1,1.3812379999999997,10.0.2.15,54.93.77.70,TCP,54,34692  >  9001 [ACK] Seq=80717 Ack=1454725 Win=65535 Len=0
1,1.3814420000000034,54.93.77.70,10.0.2.15,TLSv1.2,684,Application Data
1,1.3919760000000032,54.93.77.70,10.0.2.15,TCP,2950,"9001  >  34692 [PSH, ACK] Seq=1455355 Ack=80717 Win=65535 Len=2896 [TCP segment of a reassembled PDU]"
1,1.3925149999999995,10.0.2.15,54.93.77.70,TCP,54,34692  >  9001 [ACK] Seq=80717 Ack=1458251 Win=65535 Len=0
1,1.392664,54.93.77.70,10.0.2.15,TLSv1.2,7294,"Application Data, Application Data"
1,1.3930019999999992,10.0.2.15,54.93.77.70,TCP,54,34692  >  9001 [ACK] Seq=80717 Ack=1465491 Win=65535 Len=0
1,1.3932040000000008,54.93.77.70,10.0.2.15,TLSv1.2,5846,Application Data [TCP segment of a reassembled PDU]
1,1.3936519999999994,10.0.2.15,54.93.77.70,TCP,54,34692  >  9001 [ACK] Seq=80717 Ack=1471283 Win=65535 Len=0
1,1.3949960000000026,10.0.2.15,54.93.77.70,TLSv1.2,1104,Application Data
1,1.3953620000000022,54.93.77.70,10.0.2.15,TCP,60,9001  >  34692 [ACK] Seq=1471283 Ack=81767 Win=65535 Len=0
1,1.3976799999999976,54.93.77.70,10.0.2.15,TLSv1.2,148,Application Data
1,1.4109409999999976,10.0.2.15,54.93.77.70,TLSv1.2,590,Application Data
1,1.4112839999999984,54.93.77.70,10.0.2.15,TCP,60,9001  >  34692 [ACK] Seq=1471377 Ack=82303 Win=65535 Len=0
1,1.4248160000000034,10.0.2.15,54.93.77.70,TLSv1.2,590,Application Data
1,1.425031999999998,54.93.77.70,10.0.2.15,TCP,60,9001  >  34692 [ACK] Seq=1471377 Ack=82839 Win=65535 Len=0
1,1.428177999999999,54.93.77.70,10.0.2.15,TLSv1.2,590,Application Data
1,1.4706360000000025,10.0.2.15,54.93.77.70,TCP,54,34692  >  9001 [ACK] Seq=82839 Ack=1471913 Win=65535 Len=0
1,1.4955760000000033,62.210.85.178,10.0.2.15,TLSv1.2,590,Application Data
1,1.5387370000000011,10.0.2.15,62.210.85.178,TCP,54,35978  >  9001 [ACK] Seq=1471319 Ack=80857 Win=65535 Len=0
1,1.5563559999999974,62.210.85.178,10.0.2.15,TLSv1.2,1104,Application Data
1,1.5567499999999974,10.0.2.15,62.210.85.178,TCP,54,35978  >  9001 [ACK] Seq=1471319 Ack=81907 Win=65535 Len=0
1,1.5728690000000007,62.210.85.178,10.0.2.15,TLSv1.2,590,Application Data
1,1.573001999999999,10.0.2.15,62.210.85.178,TCP,54,35978  >  9001 [ACK] Seq=1471319 Ack=82443 Win=65535 Len=0
1,1.651092000000002,62.210.85.178,10.0.2.15,TLSv1.2,590,Application Data
1,1.6513400000000011,10.0.2.15,62.210.85.178,TCP,54,35978  >  9001 [ACK] Seq=1471319 Ack=82979 Win=65535 Len=0
1,1.6531839999999995,10.0.2.15,62.210.85.178,TLSv1.2,590,Application Data
1,1.6535959999999967,62.210.85.178,10.0.2.15,TCP,60,9001  >  35978 [ACK] Seq=82979 Ack=1471855 Win=65535 Len=0
1,1.7637999999999998,54.93.77.70,10.0.2.15,TLSv1.2,590,Application Data
1,1.7640980000000006,10.0.2.15,54.93.77.70,TCP,54,34692  >  9001 [ACK] Seq=82839 Ack=1472449 Win=65535 Len=0
1,1.7653039999999969,10.0.2.15,54.93.77.70,TLSv1.2,590,Application Data
1,1.7657399999999974,54.93.77.70,10.0.2.15,TCP,60,9001  >  34692 [ACK] Seq=1472449 Ack=83375 Win=65535 Len=0
1,1.8695199999999979,62.210.85.178,10.0.2.15,TLSv1.2,590,Application Data
1,1.8872099999999996,10.0.2.15,62.210.85.178,TLSv1.2,590,Application Data
1,1.8877109999999995,62.210.85.178,10.0.2.15,TCP,60,9001  >  35978 [ACK] Seq=83515 Ack=1472391 Win=65535 Len=0
1,1.9007510000000032,10.0.2.15,62.210.85.178,TLSv1.2,4124,Application Data
1,1.9009469999999986,10.0.2.15,62.210.85.178,TCP,2974,35978  >  9001 [ACK] Seq=1476461 Ack=83515 Win=65535 Len=2920 [TCP segment of a reassembled PDU]
1,1.9010459999999973,62.210.85.178,10.0.2.15,TCP,60,9001  >  35978 [ACK] Seq=83515 Ack=1473851 Win=65535 Len=0
1,1.9010649999999991,62.210.85.178,10.0.2.15,TCP,60,9001  >  35978 [ACK] Seq=83515 Ack=1475311 Win=65535 Len=0
1,1.9010739999999977,62.210.85.178,10.0.2.15,TCP,60,9001  >  35978 [ACK] Seq=83515 Ack=1476461 Win=65535 Len=0
1,1.9010840000000009,62.210.85.178,10.0.2.15,TCP,60,9001  >  35978 [ACK] Seq=83515 Ack=1477921 Win=65535 Len=0
1,1.901093999999997,62.210.85.178,10.0.2.15,TCP,60,9001  >  35978 [ACK] Seq=83515 Ack=1479381 Win=65535 Len=0
1,1.901176000000003,10.0.2.15,62.210.85.178,TLSv1.2,1204,Application Data
1,1.901253999999998,62.210.85.178,10.0.2.15,TCP,60,9001  >  35978 [ACK] Seq=83515 Ack=1480531 Win=65535 Len=0
1,1.9013510000000018,10.0.2.15,62.210.85.178,TLSv1.2,4124,Application Data
1,1.9014339999999983,62.210.85.178,10.0.2.15,TCP,60,9001  >  35978 [ACK] Seq=83515 Ack=1481991 Win=65535 Len=0
1,1.9014500000000005,62.210.85.178,10.0.2.15,TCP,60,9001  >  35978 [ACK] Seq=83515 Ack=1483451 Win=65535 Len=0
1,1.9014559999999996,62.210.85.178,10.0.2.15,TCP,60,9001  >  35978 [ACK] Seq=83515 Ack=1484601 Win=65535 Len=0
1,1.9015480000000018,10.0.2.15,62.210.85.178,TLSv1.2,4124,Application Data
1,1.9016279999999988,62.210.85.178,10.0.2.15,TCP,60,9001  >  35978 [ACK] Seq=83515 Ack=1486061 Win=65535 Len=0
1,1.9016430000000035,62.210.85.178,10.0.2.15,TCP,60,9001  >  35978 [ACK] Seq=83515 Ack=1487521 Win=65535 Len=0
1,1.9018630000000023,62.210.85.178,10.0.2.15,TCP,60,9001  >  35978 [ACK] Seq=83515 Ack=1488671 Win=65535 Len=0
1,1.9019330000000032,10.0.2.15,62.210.85.178,TLSv1.2,332,Application Data
1,1.9020189999999992,62.210.85.178,10.0.2.15,TCP,60,9001  >  35978 [ACK] Seq=83515 Ack=1488949 Win=65535 Len=0
1,1.9021310000000007,10.0.2.15,62.210.85.178,TLSv1.2,3868,Application Data
1,1.902232999999999,62.210.85.178,10.0.2.15,TCP,60,9001  >  35978 [ACK] Seq=83515 Ack=1490409 Win=65535 Len=0
1,1.9022540000000028,62.210.85.178,10.0.2.15,TCP,60,9001  >  35978 [ACK] Seq=83515 Ack=1491869 Win=65535 Len=0
1,1.902266000000001,62.210.85.178,10.0.2.15,TCP,60,9001  >  35978 [ACK] Seq=83515 Ack=1492763 Win=65535 Len=0
1,1.9023849999999989,10.0.2.15,62.210.85.178,TLSv1.2,4124,Application Data
1,1.9025330000000018,62.210.85.178,10.0.2.15,TCP,60,9001  >  35978 [ACK] Seq=83515 Ack=1494223 Win=65535 Len=0
1,1.9025610000000022,62.210.85.178,10.0.2.15,TCP,60,9001  >  35978 [ACK] Seq=83515 Ack=1495683 Win=65535 Len=0
1,1.9025730000000003,62.210.85.178,10.0.2.15,TCP,60,9001  >  35978 [ACK] Seq=83515 Ack=1496833 Win=65535 Len=0
1,1.9027119999999975,10.0.2.15,62.210.85.178,TLSv1.2,3030,Application Data
1,1.9028290000000005,62.210.85.178,10.0.2.15,TCP,60,9001  >  35978 [ACK] Seq=83515 Ack=1498293 Win=65535 Len=0
1,1.9028480000000023,62.210.85.178,10.0.2.15,TCP,60,9001  >  35978 [ACK] Seq=83515 Ack=1499753 Win=65535 Len=0
1,1.9028579999999984,62.210.85.178,10.0.2.15,TCP,60,9001  >  35978 [ACK] Seq=83515 Ack=1499809 Win=65535 Len=0
1,1.912237000000001,10.0.2.15,62.210.85.178,TLSv1.2,4124,Application Data
1,1.9123970000000021,62.210.85.178,10.0.2.15,TCP,60,9001  >  35978 [ACK] Seq=83515 Ack=1501269 Win=65535 Len=0
1,1.9124179999999988,62.210.85.178,10.0.2.15,TCP,60,9001  >  35978 [ACK] Seq=83515 Ack=1502729 Win=65535 Len=0
1,1.912423999999998,62.210.85.178,10.0.2.15,TCP,60,9001  >  35978 [ACK] Seq=83515 Ack=1503879 Win=65535 Len=0
1,1.912665999999998,10.0.2.15,62.210.85.178,TLSv1.2,4124,Application Data
1,1.9127919999999996,10.0.2.15,62.210.85.178,TCP,2974,35978  >  9001 [ACK] Seq=1507949 Ack=83515 Win=65535 Len=2920 [TCP segment of a reassembled PDU]
1,1.9128519999999973,62.210.85.178,10.0.2.15,TCP,60,9001  >  35978 [ACK] Seq=83515 Ack=1505339 Win=65535 Len=0
1,1.912862999999998,62.210.85.178,10.0.2.15,TCP,60,9001  >  35978 [ACK] Seq=83515 Ack=1506799 Win=65535 Len=0
1,1.9128679999999996,62.210.85.178,10.0.2.15,TCP,60,9001  >  35978 [ACK] Seq=83515 Ack=1507949 Win=65535 Len=0
1,1.9128730000000012,62.210.85.178,10.0.2.15,TCP,60,9001  >  35978 [ACK] Seq=83515 Ack=1509409 Win=65535 Len=0
1,1.9128769999999982,62.210.85.178,10.0.2.15,TCP,60,9001  >  35978 [ACK] Seq=83515 Ack=1510869 Win=65535 Len=0
1,1.9129290000000019,10.0.2.15,62.210.85.178,TLSv1.2,1204,Application Data
1,1.912983999999998,62.210.85.178,10.0.2.15,TCP,60,9001  >  35978 [ACK] Seq=83515 Ack=1512019 Win=65535 Len=0
1,1.9130459999999978,10.0.2.15,62.210.85.178,TLSv1.2,268,Application Data
1,1.9131779999999985,62.210.85.178,10.0.2.15,TCP,60,9001  >  35978 [ACK] Seq=83515 Ack=1512233 Win=65535 Len=0
1,1.9746429999999968,54.93.77.70,10.0.2.15,TLSv1.2,590,Application Data
1,2.0019620000000025,54.93.77.70,10.0.2.15,TLSv1.2,8194,"Application Data, Application Data"
1,2.002075999999999,54.93.77.70,10.0.2.15,TCP,2950,"9001  >  34692 [PSH, ACK] Seq=1481125 Ack=83375 Win=65535 Len=2896 [TCP segment of a reassembled PDU]"
1,2.006285000000002,10.0.2.15,54.93.77.70,TCP,54,34692  >  9001 [ACK] Seq=83375 Ack=1484021 Win=65535 Len=0
1,2.0091649999999994,54.93.77.70,10.0.2.15,TLSv1.2,2950,Application Data [TCP segment of a reassembled PDU]
1,2.0095940000000034,10.0.2.15,54.93.77.70,TCP,54,34692  >  9001 [ACK] Seq=83375 Ack=1486917 Win=65535 Len=0
1,2.0184409999999993,54.93.77.70,10.0.2.15,TLSv1.2,1116,Application Data
1,2.0201930000000026,54.93.77.70,10.0.2.15,TCP,2950,"9001  >  34692 [PSH, ACK] Seq=1487979 Ack=83375 Win=65535 Len=2896 [TCP segment of a reassembled PDU]"
1,2.021595999999999,10.0.2.15,54.93.77.70,TCP,54,34692  >  9001 [ACK] Seq=83375 Ack=1490875 Win=65535 Len=0
1,2.0345809999999993,54.93.77.70,10.0.2.15,TLSv1.2,1314,"Application Data, Application Data"
1,2.0395819999999993,54.93.77.70,10.0.2.15,TCP,2950,"9001  >  34692 [PSH, ACK] Seq=1492135 Ack=83375 Win=65535 Len=2896 [TCP segment of a reassembled PDU]"
1,2.0398960000000024,10.0.2.15,54.93.77.70,TCP,54,34692  >  9001 [ACK] Seq=83375 Ack=1495031 Win=65535 Len=0
1,2.040789,54.93.77.70,10.0.2.15,TLSv1.2,11638,"Application Data, Application Data, Application Data"
1,2.0408579999999965,54.93.77.70,10.0.2.15,TCP,1502,"9001  >  34692 [PSH, ACK] Seq=1506615 Ack=83375 Win=65535 Len=1448 [TCP segment of a reassembled PDU]"
1,2.0410980000000016,10.0.2.15,54.93.77.70,TCP,54,34692  >  9001 [ACK] Seq=83375 Ack=1508063 Win=65535 Len=0
1,2.041467000000001,54.93.77.70,10.0.2.15,TLSv1.2,1474,"Application Data, Application Data"
1,2.041999999999998,54.93.77.70,10.0.2.15,TCP,2978,"9001  >  34692 [PSH, ACK] Seq=1509483 Ack=83375 Win=65535 Len=2924 [TCP segment of a reassembled PDU]"
1,2.0424219999999984,10.0.2.15,54.93.77.70,TCP,54,34692  >  9001 [ACK] Seq=83375 Ack=1512407 Win=65535 Len=0
1,2.043695000000003,10.0.2.15,54.93.77.70,TLSv1.2,590,Application Data
1,2.0440879999999986,54.93.77.70,10.0.2.15,TCP,60,9001  >  34692 [ACK] Seq=1512407 Ack=83911 Win=65535 Len=0
1,2.051530000000003,54.93.77.70,10.0.2.15,TLSv1.2,496,"Application Data, Application Data"
1,2.060671000000003,10.0.2.15,54.93.77.70,TLSv1.2,590,Application Data
1,2.061074999999999,54.93.77.70,10.0.2.15,TCP,60,9001  >  34692 [ACK] Seq=1512849 Ack=84447 Win=65535 Len=0
1,2.071085,10.0.2.15,54.93.77.70,TLSv1.2,590,Application Data
1,2.071293999999998,54.93.77.70,10.0.2.15,TCP,60,9001  >  34692 [ACK] Seq=1512849 Ack=84983 Win=65535 Len=0
1,2.181669000000003,62.210.85.178,10.0.2.15,TLSv1.2,590,Application Data
1,2.2227449999999997,10.0.2.15,62.210.85.178,TCP,54,35978  >  9001 [ACK] Seq=1512233 Ack=84051 Win=65535 Len=0
1,2.2587280000000014,62.210.85.178,10.0.2.15,TLSv1.2,1104,Application Data
1,2.258975000000003,10.0.2.15,62.210.85.178,TCP,54,35978  >  9001 [ACK] Seq=1512233 Ack=85101 Win=65535 Len=0
1,2.2606179999999974,10.0.2.15,62.210.85.178,TLSv1.2,590,Application Data
1,2.2610550000000025,62.210.85.178,10.0.2.15,TCP,60,9001  >  35978 [ACK] Seq=85101 Ack=1512769 Win=65535 Len=0
1,2.363389999999999,54.93.77.70,10.0.2.15,TLSv1.2,590,Application Data
1,2.364819999999998,10.0.2.15,54.93.77.70,TLSv1.2,590,Application Data
1,2.365247,54.93.77.70,10.0.2.15,TCP,60,9001  >  34692 [ACK] Seq=1513385 Ack=85519 Win=65535 Len=0
1,2.6044250000000027,62.210.85.178,10.0.2.15,TLSv1.2,590,Application Data
1,2.6237999999999992,10.0.2.15,62.210.85.178,TLSv1.2,590,Application Data
1,2.624109999999998,62.210.85.178,10.0.2.15,TCP,60,9001  >  35978 [ACK] Seq=85637 Ack=1513305 Win=65535 Len=0
1,2.635757999999999,10.0.2.15,62.210.85.178,TLSv1.2,4124,Application Data
1,2.6359379999999994,10.0.2.15,62.210.85.178,TCP,2974,35978  >  9001 [ACK] Seq=1517375 Ack=85637 Win=65535 Len=2920 [TCP segment of a reassembled PDU]
1,2.636019000000001,62.210.85.178,10.0.2.15,TCP,60,9001  >  35978 [ACK] Seq=85637 Ack=1514765 Win=65535 Len=0
1,2.6360390000000002,62.210.85.178,10.0.2.15,TCP,60,9001  >  35978 [ACK] Seq=85637 Ack=1516225 Win=65535 Len=0
1,2.6360490000000034,62.210.85.178,10.0.2.15,TCP,60,9001  >  35978 [ACK] Seq=85637 Ack=1517375 Win=65535 Len=0
1,2.6360569999999974,62.210.85.178,10.0.2.15,TCP,60,9001  >  35978 [ACK] Seq=85637 Ack=1518835 Win=65535 Len=0
1,2.636064000000001,62.210.85.178,10.0.2.15,TCP,60,9001  >  35978 [ACK] Seq=85637 Ack=1520295 Win=65535 Len=0
1,2.6361349999999995,10.0.2.15,62.210.85.178,TLSv1.2,1204,Application Data
1,2.6362029999999983,62.210.85.178,10.0.2.15,TCP,60,9001  >  35978 [ACK] Seq=85637 Ack=1521445 Win=65535 Len=0
1,2.6362789999999983,10.0.2.15,62.210.85.178,TLSv1.2,4124,Application Data
1,2.636346999999997,62.210.85.178,10.0.2.15,TCP,60,9001  >  35978 [ACK] Seq=85637 Ack=1522905 Win=65535 Len=0
1,2.636362000000002,62.210.85.178,10.0.2.15,TCP,60,9001  >  35978 [ACK] Seq=85637 Ack=1524365 Win=65535 Len=0
1,2.636370000000003,62.210.85.178,10.0.2.15,TCP,60,9001  >  35978 [ACK] Seq=85637 Ack=1525515 Win=65535 Len=0
1,2.636438000000002,10.0.2.15,62.210.85.178,TLSv1.2,4124,Application Data
1,2.6365799999999986,62.210.85.178,10.0.2.15,TCP,60,9001  >  35978 [ACK] Seq=85637 Ack=1526975 Win=65535 Len=0
1,2.6365939999999988,62.210.85.178,10.0.2.15,TCP,60,9001  >  35978 [ACK] Seq=85637 Ack=1528435 Win=65535 Len=0
1,2.6365990000000004,62.210.85.178,10.0.2.15,TCP,60,9001  >  35978 [ACK] Seq=85637 Ack=1529585 Win=65535 Len=0
1,2.6366460000000025,10.0.2.15,62.210.85.178,TLSv1.2,332,Application Data
1,2.6367119999999993,62.210.85.178,10.0.2.15,TCP,60,9001  >  35978 [ACK] Seq=85637 Ack=1529863 Win=65535 Len=0
1,2.6368019999999994,10.0.2.15,62.210.85.178,TLSv1.2,3868,Application Data
1,2.6368699999999983,62.210.85.178,10.0.2.15,TCP,60,9001  >  35978 [ACK] Seq=85637 Ack=1531323 Win=65535 Len=0
1,2.6368839999999985,62.210.85.178,10.0.2.15,TCP,60,9001  >  35978 [ACK] Seq=85637 Ack=1532783 Win=65535 Len=0
1,2.6368919999999996,62.210.85.178,10.0.2.15,TCP,60,9001  >  35978 [ACK] Seq=85637 Ack=1533677 Win=65535 Len=0
1,2.636968999999997,10.0.2.15,62.210.85.178,TLSv1.2,4124,Application Data
1,2.6370439999999995,62.210.85.178,10.0.2.15,TCP,60,9001  >  35978 [ACK] Seq=85637 Ack=1535137 Win=65535 Len=0
1,2.6370600000000017,62.210.85.178,10.0.2.15,TCP,60,9001  >  35978 [ACK] Seq=85637 Ack=1536597 Win=65535 Len=0
1,2.6370669999999983,62.210.85.178,10.0.2.15,TCP,60,9001  >  35978 [ACK] Seq=85637 Ack=1537747 Win=65535 Len=0
1,2.637133000000002,10.0.2.15,62.210.85.178,TLSv1.2,3030,Application Data
1,2.637272999999997,62.210.85.178,10.0.2.15,TCP,60,9001  >  35978 [ACK] Seq=85637 Ack=1539207 Win=65535 Len=0
1,2.637302000000002,62.210.85.178,10.0.2.15,TCP,60,9001  >  35978 [ACK] Seq=85637 Ack=1540667 Win=65535 Len=0
1,2.637308000000001,62.210.85.178,10.0.2.15,TCP,60,9001  >  35978 [ACK] Seq=85637 Ack=1540723 Win=65535 Len=0
1,2.6465679999999985,10.0.2.15,62.210.85.178,TLSv1.2,4124,Application Data
1,2.646767999999998,62.210.85.178,10.0.2.15,TCP,60,9001  >  35978 [ACK] Seq=85637 Ack=1542183 Win=65535 Len=0
1,2.6468019999999974,62.210.85.178,10.0.2.15,TCP,60,9001  >  35978 [ACK] Seq=85637 Ack=1543643 Win=65535 Len=0
1,2.646809000000001,62.210.85.178,10.0.2.15,TCP,60,9001  >  35978 [ACK] Seq=85637 Ack=1544793 Win=65535 Len=0
1,2.646916000000001,10.0.2.15,62.210.85.178,TLSv1.2,4124,Application Data
1,2.6470439999999975,62.210.85.178,10.0.2.15,TCP,60,9001  >  35978 [ACK] Seq=85637 Ack=1546253 Win=65535 Len=0
1,2.6470590000000023,62.210.85.178,10.0.2.15,TCP,60,9001  >  35978 [ACK] Seq=85637 Ack=1547713 Win=65535 Len=0
1,2.6470639999999968,62.210.85.178,10.0.2.15,TCP,60,9001  >  35978 [ACK] Seq=85637 Ack=1548863 Win=65535 Len=0
1,2.6471430000000034,10.0.2.15,62.210.85.178,TLSv1.2,4124,Application Data
1,2.647211000000002,62.210.85.178,10.0.2.15,TCP,60,9001  >  35978 [ACK] Seq=85637 Ack=1550323 Win=65535 Len=0
1,2.6472269999999973,62.210.85.178,10.0.2.15,TCP,60,9001  >  35978 [ACK] Seq=85637 Ack=1551783 Win=65535 Len=0
1,2.6472349999999985,62.210.85.178,10.0.2.15,TCP,60,9001  >  35978 [ACK] Seq=85637 Ack=1552933 Win=65535 Len=0
1,2.6473029999999973,10.0.2.15,62.210.85.178,TLSv1.2,4124,Application Data
1,2.6473699999999987,62.210.85.178,10.0.2.15,TCP,60,9001  >  35978 [ACK] Seq=85637 Ack=1554393 Win=65535 Len=0
1,2.6473850000000034,62.210.85.178,10.0.2.15,TCP,60,9001  >  35978 [ACK] Seq=85637 Ack=1555853 Win=65535 Len=0
1,2.6473929999999974,62.210.85.178,10.0.2.15,TCP,60,9001  >  35978 [ACK] Seq=85637 Ack=1557003 Win=65535 Len=0
1,2.6474579999999968,10.0.2.15,62.210.85.178,TLSv1.2,332,Application Data
1,2.647530999999997,62.210.85.178,10.0.2.15,TCP,60,9001  >  35978 [ACK] Seq=85637 Ack=1557281 Win=65535 Len=0
1,2.6476349999999975,10.0.2.15,62.210.85.178,TLSv1.2,3868,Application Data
1,2.6477150000000016,62.210.85.178,10.0.2.15,TCP,60,9001  >  35978 [ACK] Seq=85637 Ack=1558741 Win=65535 Len=0
1,2.6477340000000034,62.210.85.178,10.0.2.15,TCP,60,9001  >  35978 [ACK] Seq=85637 Ack=1560201 Win=65535 Len=0
1,2.647743000000002,62.210.85.178,10.0.2.15,TCP,60,9001  >  35978 [ACK] Seq=85637 Ack=1561095 Win=65535 Len=0
1,2.647856000000001,10.0.2.15,62.210.85.178,TLSv1.2,4124,Application Data
1,2.6480070000000033,10.0.2.15,62.210.85.178,TCP,2974,35978  >  9001 [ACK] Seq=1565165 Ack=85637 Win=65535 Len=2920 [TCP segment of a reassembled PDU]
1,2.6484500000000004,62.210.85.178,10.0.2.15,TCP,60,9001  >  35978 [ACK] Seq=85637 Ack=1562555 Win=65535 Len=0
1,2.6484869999999994,62.210.85.178,10.0.2.15,TCP,60,9001  >  35978 [ACK] Seq=85637 Ack=1564015 Win=65535 Len=0
1,2.6484929999999984,62.210.85.178,10.0.2.15,TCP,60,9001  >  35978 [ACK] Seq=85637 Ack=1565165 Win=65535 Len=0
1,2.648498,62.210.85.178,10.0.2.15,TCP,60,9001  >  35978 [ACK] Seq=85637 Ack=1566625 Win=65535 Len=0
1,2.6485030000000016,62.210.85.178,10.0.2.15,TCP,60,9001  >  35978 [ACK] Seq=85637 Ack=1568085 Win=65535 Len=0
1,2.6485749999999975,10.0.2.15,62.210.85.178,TLSv1.2,110,Application Data
1,2.6486490000000025,62.210.85.178,10.0.2.15,TCP,60,9001  >  35978 [ACK] Seq=85637 Ack=1568141 Win=65535 Len=0
1,2.657517000000002,10.0.2.15,62.210.85.178,TLSv1.2,4124,Application Data
1,2.657739000000003,62.210.85.178,10.0.2.15,TCP,60,9001  >  35978 [ACK] Seq=85637 Ack=1569601 Win=65535 Len=0
1,2.657762999999999,62.210.85.178,10.0.2.15,TCP,60,9001  >  35978 [ACK] Seq=85637 Ack=1571061 Win=65535 Len=0
1,2.657771999999998,62.210.85.178,10.0.2.15,TCP,60,9001  >  35978 [ACK] Seq=85637 Ack=1572211 Win=65535 Len=0
1,2.6578479999999978,10.0.2.15,62.210.85.178,TCP,2974,35978  >  9001 [ACK] Seq=1572211 Ack=85637 Win=65535 Len=2920 [TCP segment of a reassembled PDU]
1,2.657982999999998,10.0.2.15,62.210.85.178,TLSv1.2,1204,Application Data
1,2.658021999999999,62.210.85.178,10.0.2.15,TCP,60,9001  >  35978 [ACK] Seq=85637 Ack=1573671 Win=65535 Len=0
1,2.6580389999999987,62.210.85.178,10.0.2.15,TCP,60,9001  >  35978 [ACK] Seq=85637 Ack=1575131 Win=65535 Len=0
1,2.6581360000000025,10.0.2.15,62.210.85.178,TCP,2974,35978  >  9001 [ACK] Seq=1576281 Ack=85637 Win=65535 Len=2920 [TCP segment of a reassembled PDU]
1,2.658204999999999,62.210.85.178,10.0.2.15,TCP,60,9001  >  35978 [ACK] Seq=85637 Ack=1576281 Win=65535 Len=0
1,2.6582669999999986,10.0.2.15,62.210.85.178,TLSv1.2,1204,Application Data
1,2.658330000000003,62.210.85.178,10.0.2.15,TCP,60,9001  >  35978 [ACK] Seq=85637 Ack=1577741 Win=65535 Len=0
1,2.6583409999999965,62.210.85.178,10.0.2.15,TCP,60,9001  >  35978 [ACK] Seq=85637 Ack=1579201 Win=65535 Len=0
1,2.658413999999997,10.0.2.15,62.210.85.178,TCP,2974,35978  >  9001 [ACK] Seq=1580351 Ack=85637 Win=65535 Len=2920 [TCP segment of a reassembled PDU]
1,2.6585110000000007,62.210.85.178,10.0.2.15,TCP,60,9001  >  35978 [ACK] Seq=85637 Ack=1580351 Win=65535 Len=0
1,2.6585399999999986,62.210.85.178,10.0.2.15,TCP,60,9001  >  35978 [ACK] Seq=85637 Ack=1581811 Win=65535 Len=0
1,2.658547000000002,62.210.85.178,10.0.2.15,TCP,60,9001  >  35978 [ACK] Seq=85637 Ack=1583271 Win=65535 Len=0
1,2.658598999999999,10.0.2.15,62.210.85.178,TLSv1.2,1204,Application Data
1,2.6586689999999997,62.210.85.178,10.0.2.15,TCP,60,9001  >  35978 [ACK] Seq=85637 Ack=1584421 Win=65535 Len=0
1,2.658745999999997,10.0.2.15,62.210.85.178,TLSv1.2,332,Application Data
1,2.6588689999999993,62.210.85.178,10.0.2.15,TCP,60,9001  >  35978 [ACK] Seq=85637 Ack=1584699 Win=65535 Len=0
1,2.658952000000003,10.0.2.15,62.210.85.178,TLSv1.2,590,Application Data
1,2.659017000000002,62.210.85.178,10.0.2.15,TCP,60,9001  >  35978 [ACK] Seq=85637 Ack=1585235 Win=65535 Len=0
1,2.7191190000000027,54.93.77.70,10.0.2.15,TLSv1.2,590,Application Data
1,2.762659000000003,10.0.2.15,54.93.77.70,TCP,54,34692  >  9001 [ACK] Seq=85519 Ack=1513921 Win=65535 Len=0
1,2.773227000000002,54.93.77.70,10.0.2.15,TLSv1.2,10190,"Application Data, Application Data"
1,2.7734810000000003,10.0.2.15,54.93.77.70,TCP,54,34692  >  9001 [ACK] Seq=85519 Ack=1524057 Win=65535 Len=0
1,2.773695,54.93.77.70,10.0.2.15,TCP,1502,"9001  >  34692 [PSH, ACK] Seq=1524057 Ack=85519 Win=65535 Len=1448 [TCP segment of a reassembled PDU]"
1,2.773861,10.0.2.15,54.93.77.70,TCP,54,34692  >  9001 [ACK] Seq=85519 Ack=1525505 Win=65535 Len=0
1,2.780412000000002,54.93.77.70,10.0.2.15,TLSv1.2,3978,"Application Data, Application Data"
1,2.7806749999999987,10.0.2.15,54.93.77.70,TCP,54,34692  >  9001 [ACK] Seq=85519 Ack=1529429 Win=65535 Len=0
1,2.7898689999999995,54.93.77.70,10.0.2.15,TCP,2950,"9001  >  34692 [PSH, ACK] Seq=1529429 Ack=85519 Win=65535 Len=2896 [TCP segment of a reassembled PDU]"
1,2.7900659999999995,10.0.2.15,54.93.77.70,TCP,54,34692  >  9001 [ACK] Seq=85519 Ack=1532325 Win=65535 Len=0
1,2.793735999999999,54.93.77.70,10.0.2.15,TLSv1.2,1502,Application Data [TCP segment of a reassembled PDU]
1,2.793955999999998,10.0.2.15,54.93.77.70,TCP,54,34692  >  9001 [ACK] Seq=85519 Ack=1533773 Win=65535 Len=0
1,2.796726000000003,54.93.77.70,10.0.2.15,TLSv1.2,380,Application Data
1,2.7969060000000034,10.0.2.15,54.93.77.70,TCP,54,34692  >  9001 [ACK] Seq=85519 Ack=1534099 Win=65535 Len=0
1,2.8036040000000035,54.93.77.70,10.0.2.15,TLSv1.2,7294,Application Data
1,2.803842999999997,10.0.2.15,54.93.77.70,TCP,54,34692  >  9001 [ACK] Seq=85519 Ack=1541339 Win=65535 Len=0
1,2.804143,54.93.77.70,10.0.2.15,TLSv1.2,1474,Application Data [TCP segment of a reassembled PDU]
1,2.8042520000000017,10.0.2.15,54.93.77.70,TCP,54,34692  >  9001 [ACK] Seq=85519 Ack=1542759 Win=65535 Len=0
1,2.804421999999999,54.93.77.70,10.0.2.15,TCP,2978,"9001  >  34692 [PSH, ACK] Seq=1542759 Ack=85519 Win=65535 Len=2924 [TCP segment of a reassembled PDU]"
1,2.8045399999999994,10.0.2.15,54.93.77.70,TCP,54,34692  >  9001 [ACK] Seq=85519 Ack=1545683 Win=65535 Len=0
1,2.805432999999997,10.0.2.15,54.93.77.70,TLSv1.2,590,Application Data
1,2.805862000000001,54.93.77.70,10.0.2.15,TCP,60,9001  >  34692 [ACK] Seq=1545683 Ack=86055 Win=65535 Len=0
1,2.8131919999999973,54.93.77.70,10.0.2.15,TLSv1.2,358,Application Data
1,2.814003000000003,54.93.77.70,10.0.2.15,TCP,2950,"9001  >  34692 [PSH, ACK] Seq=1545987 Ack=86055 Win=65535 Len=2896 [TCP segment of a reassembled PDU]"
1,2.8141789999999993,10.0.2.15,54.93.77.70,TCP,54,34692  >  9001 [ACK] Seq=86055 Ack=1548883 Win=65535 Len=0
1,2.816196999999999,54.93.77.70,10.0.2.15,TLSv1.2,12834,"Application Data, Application Data, Application Data"
1,2.816429000000003,10.0.2.15,54.93.77.70,TCP,54,34692  >  9001 [ACK] Seq=86055 Ack=1561663 Win=65535 Len=0
1,2.816604999999999,54.93.77.70,10.0.2.15,TCP,306,"9001  >  34692 [PSH, ACK] Seq=1561663 Ack=86055 Win=65535 Len=252 [TCP segment of a reassembled PDU]"
1,2.8296030000000023,54.93.77.70,10.0.2.15,TLSv1.2,684,"Application Data, Application Data"
1,2.830197000000002,10.0.2.15,54.93.77.70,TCP,54,34692  >  9001 [ACK] Seq=86055 Ack=1562545 Win=65535 Len=0
1,2.8631729999999997,54.93.77.70,10.0.2.15,TLSv1.2,3674,Application Data
1,2.863653000000003,10.0.2.15,54.93.77.70,TCP,54,34692  >  9001 [ACK] Seq=86055 Ack=1566165 Win=65535 Len=0
1,2.8645669999999974,10.0.2.15,54.93.77.70,TLSv1.2,1104,Application Data
1,2.865015000000003,54.93.77.70,10.0.2.15,TCP,60,9001  >  34692 [ACK] Seq=1566165 Ack=87105 Win=65535 Len=0
1,2.8701469999999993,54.93.77.70,10.0.2.15,TCP,2950,"9001  >  34692 [PSH, ACK] Seq=1566165 Ack=87105 Win=65535 Len=2896 [TCP segment of a reassembled PDU]"
1,2.8704530000000013,10.0.2.15,54.93.77.70,TCP,54,34692  >  9001 [ACK] Seq=87105 Ack=1569061 Win=65535 Len=0
1,2.8711790000000015,54.93.77.70,10.0.2.15,TLSv1.2,8574,"Application Data, Application Data"
1,2.8714169999999974,10.0.2.15,54.93.77.70,TCP,54,34692  >  9001 [ACK] Seq=87105 Ack=1577581 Win=65535 Len=0
1,2.871602999999997,54.93.77.70,10.0.2.15,TLSv1.2,4566,Application Data [TCP segment of a reassembled PDU]
1,2.871989000000003,10.0.2.15,54.93.77.70,TCP,54,34692  >  9001 [ACK] Seq=87105 Ack=1582093 Win=65535 Len=0
1,2.872418999999997,54.93.77.70,10.0.2.15,TLSv1.2,2950,"Application Data, Application Data"
1,2.8733889999999995,10.0.2.15,54.93.77.70,TCP,54,34692  >  9001 [ACK] Seq=87105 Ack=1584989 Win=65535 Len=0
1,2.8791720000000005,54.93.77.70,10.0.2.15,TLSv1.2,380,Application Data
1,2.8833730000000024,10.0.2.15,54.93.77.70,TLSv1.2,590,Application Data
1,2.8837909999999987,54.93.77.70,10.0.2.15,TCP,60,9001  >  34692 [ACK] Seq=1585315 Ack=87641 Win=65535 Len=0
1,2.893825000000003,10.0.2.15,54.93.77.70,TLSv1.2,590,Application Data
1,2.894319999999997,54.93.77.70,10.0.2.15,TCP,60,9001  >  34692 [ACK] Seq=1585315 Ack=88177 Win=65535 Len=0
1,2.904171999999999,54.93.77.70,10.0.2.15,TLSv1.2,590,Application Data
1,2.9043039999999998,62.210.85.178,10.0.2.15,TLSv1.2,590,Application Data
1,2.946558999999997,10.0.2.15,62.210.85.178,TCP,54,35978  >  9001 [ACK] Seq=1585235 Ack=86173 Win=65535 Len=0
1,2.9466569999999983,10.0.2.15,54.93.77.70,TCP,54,34692  >  9001 [ACK] Seq=88177 Ack=1585851 Win=65535 Len=0
1,2.9870139999999985,62.210.85.178,10.0.2.15,TLSv1.2,1104,Application Data
1,2.9871099999999977,10.0.2.15,62.210.85.178,TCP,54,35978  >  9001 [ACK] Seq=1585235 Ack=87223 Win=65535 Len=0
