No.,Time,Source,Destination,Protocol,Length,Info
1,0.14792899999997644,10.0.2.15,54.93.77.70,TLSv1.2,590,Application Data
1,0.14806100000009792,54.93.77.70,10.0.2.15,TCP,60,9001  >  34692 [ACK] Seq=86964499 Ack=4839769 Win=65535 Len=0
1,0.2505390000001171,62.210.85.178,10.0.2.15,TLSv1.2,590,Application Data
1,0.2509130000000823,10.0.2.15,62.210.85.178,TLSv1.2,590,Application Data
1,0.2510580000000573,62.210.85.178,10.0.2.15,TCP,60,9001  >  35978 [ACK] Seq=4845797 Ack=87143209 Win=65535 Len=0
1,0.364373999999998,54.93.77.70,10.0.2.15,TLSv1.2,590,Application Data
1,0.3644659999999931,10.0.2.15,54.93.77.70,TCP,54,34692  >  9001 [ACK] Seq=4839769 Ack=86965035 Win=65535 Len=0
1,0.36486199999990276,10.0.2.15,54.93.77.70,TLSv1.2,1618,Application Data
1,0.36499000000003434,54.93.77.70,10.0.2.15,TCP,60,9001  >  34692 [ACK] Seq=86965035 Ack=4841229 Win=65535 Len=0
1,0.36499899999989793,54.93.77.70,10.0.2.15,TCP,60,9001  >  34692 [ACK] Seq=86965035 Ack=4841333 Win=65535 Len=0
1,0.716220999999905,62.210.85.178,10.0.2.15,TLSv1.2,1618,Application Data
1,0.7163590000000113,10.0.2.15,62.210.85.178,TCP,54,35978  >  9001 [ACK] Seq=87143209 Ack=4847361 Win=65535 Len=0
1,0.7296770000000379,10.0.2.15,62.210.85.178,TLSv1.2,590,Application Data
1,0.7298330000000988,62.210.85.178,10.0.2.15,TCP,60,9001  >  35978 [ACK] Seq=4847361 Ack=87143745 Win=65535 Len=0
1,0.7438329999999951,10.0.2.15,62.210.85.178,TLSv1.2,1618,Application Data
1,0.7439710000001014,62.210.85.178,10.0.2.15,TCP,60,9001  >  35978 [ACK] Seq=4847361 Ack=87145205 Win=65535 Len=0
1,0.7439899999999398,62.210.85.178,10.0.2.15,TCP,60,9001  >  35978 [ACK] Seq=4847361 Ack=87145309 Win=65535 Len=0
1,0.8275530000000799,54.93.77.70,10.0.2.15,TLSv1.2,590,Application Data
1,0.8710320000000138,10.0.2.15,54.93.77.70,TCP,54,34692  >  9001 [ACK] Seq=4841333 Ack=86965571 Win=65535 Len=0
1,0.8956459999999424,54.93.77.70,10.0.2.15,TLSv1.2,1618,Application Data
1,0.8956989999999223,10.0.2.15,54.93.77.70,TCP,54,34692  >  9001 [ACK] Seq=4841333 Ack=86967135 Win=65535 Len=0
1,0.8978890000000774,10.0.2.15,54.93.77.70,TLSv1.2,590,Application Data
1,0.8980859999999211,54.93.77.70,10.0.2.15,TCP,60,9001  >  34692 [ACK] Seq=86967135 Ack=4841869 Win=65535 Len=0
1,1.3292570000000978,62.210.85.178,10.0.2.15,TLSv1.2,590,Application Data
1,1.3295660000001135,10.0.2.15,62.210.85.178,TLSv1.2,590,Application Data
1,1.3296640000000934,62.210.85.178,10.0.2.15,TCP,60,9001  >  35978 [ACK] Seq=4847897 Ack=87145845 Win=65535 Len=0
1,1.4814590000000862,54.93.77.70,10.0.2.15,TLSv1.2,590,Application Data
1,1.481909000000087,10.0.2.15,54.93.77.70,TLSv1.2,590,Application Data
1,1.4820589999999356,54.93.77.70,10.0.2.15,TCP,60,9001  >  34692 [ACK] Seq=86967671 Ack=4842405 Win=65535 Len=0
1,1.6365690000000086,62.210.85.178,10.0.2.15,TLSv1.2,590,Application Data
1,1.646891000000096,10.0.2.15,62.210.85.178,TLSv1.2,590,Application Data
1,1.6471080000001166,62.210.85.178,10.0.2.15,TCP,60,9001  >  35978 [ACK] Seq=4848433 Ack=87146381 Win=65535 Len=0
1,1.6600949999999557,10.0.2.15,62.210.85.178,TLSv1.2,4124,Application Data
1,1.6602060000000165,10.0.2.15,62.210.85.178,TCP,2974,35978  >  9001 [ACK] Seq=87150451 Ack=4848433 Win=65535 Len=2920 [TCP segment of a reassembled PDU]
1,1.6602490000000216,62.210.85.178,10.0.2.15,TCP,60,9001  >  35978 [ACK] Seq=4848433 Ack=87147841 Win=65535 Len=0
1,1.6602600000001075,62.210.85.178,10.0.2.15,TCP,60,9001  >  35978 [ACK] Seq=4848433 Ack=87149301 Win=65535 Len=0
1,1.6602649999999812,62.210.85.178,10.0.2.15,TCP,60,9001  >  35978 [ACK] Seq=4848433 Ack=87150451 Win=65535 Len=0
1,1.6602689999999711,62.210.85.178,10.0.2.15,TCP,60,9001  >  35978 [ACK] Seq=4848433 Ack=87151911 Win=65535 Len=0
1,1.6602740000000722,62.210.85.178,10.0.2.15,TCP,60,9001  >  35978 [ACK] Seq=4848433 Ack=87153371 Win=65535 Len=0
1,1.6603170000000773,10.0.2.15,62.210.85.178,TLSv1.2,1204,Application Data
1,1.6603950000001078,62.210.85.178,10.0.2.15,TCP,60,9001  >  35978 [ACK] Seq=4848433 Ack=87154521 Win=65535 Len=0
1,1.6604299999999057,10.0.2.15,62.210.85.178,TCP,2974,35978  >  9001 [ACK] Seq=87154521 Ack=4848433 Win=65535 Len=2920 [TCP segment of a reassembled PDU]
1,1.660470000000032,62.210.85.178,10.0.2.15,TCP,60,9001  >  35978 [ACK] Seq=4848433 Ack=87155981 Win=65535 Len=0
1,1.6604769999999007,62.210.85.178,10.0.2.15,TCP,60,9001  >  35978 [ACK] Seq=4848433 Ack=87157441 Win=65535 Len=0
1,1.6605110000000423,10.0.2.15,62.210.85.178,TLSv1.2,1204,Application Data
1,1.6605489999999463,62.210.85.178,10.0.2.15,TCP,60,9001  >  35978 [ACK] Seq=4848433 Ack=87158591 Win=65535 Len=0
1,1.6606019999999262,10.0.2.15,62.210.85.178,TLSv1.2,4124,Application Data
1,1.6606449999999313,62.210.85.178,10.0.2.15,TCP,60,9001  >  35978 [ACK] Seq=4848433 Ack=87160051 Win=65535 Len=0
1,1.6606520000000273,62.210.85.178,10.0.2.15,TCP,60,9001  >  35978 [ACK] Seq=4848433 Ack=87161511 Win=65535 Len=0
1,1.660716999999977,10.0.2.15,62.210.85.178,TLSv1.2,2974,Application Data
1,1.660759999999982,62.210.85.178,10.0.2.15,TCP,60,9001  >  35978 [ACK] Seq=4848433 Ack=87162661 Win=65535 Len=0
1,1.660767000000078,62.210.85.178,10.0.2.15,TCP,60,9001  >  35978 [ACK] Seq=4848433 Ack=87164121 Win=65535 Len=0
1,1.660771000000068,62.210.85.178,10.0.2.15,TCP,60,9001  >  35978 [ACK] Seq=4848433 Ack=87165581 Win=65535 Len=0
1,1.6608060000000933,10.0.2.15,62.210.85.178,TLSv1.2,1226,Application Data
1,1.6608450000001085,62.210.85.178,10.0.2.15,TCP,60,9001  >  35978 [ACK] Seq=4848433 Ack=87166753 Win=65535 Len=0
1,1.6608920000001035,10.0.2.15,62.210.85.178,TLSv1.2,4124,Application Data
1,1.6609339999999975,62.210.85.178,10.0.2.15,TCP,60,9001  >  35978 [ACK] Seq=4848433 Ack=87168213 Win=65535 Len=0
1,1.6609410000000935,62.210.85.178,10.0.2.15,TCP,60,9001  >  35978 [ACK] Seq=4848433 Ack=87169673 Win=65535 Len=0
1,1.6609450000000834,62.210.85.178,10.0.2.15,TCP,60,9001  >  35978 [ACK] Seq=4848433 Ack=87170823 Win=65535 Len=0
1,1.6609909999999672,10.0.2.15,62.210.85.178,TLSv1.2,3030,Application Data
1,1.6610359999999673,62.210.85.178,10.0.2.15,TCP,60,9001  >  35978 [ACK] Seq=4848433 Ack=87172283 Win=65535 Len=0
1,1.6610419999999522,62.210.85.178,10.0.2.15,TCP,60,9001  >  35978 [ACK] Seq=4848433 Ack=87173743 Win=65535 Len=0
1,1.6610470000000532,62.210.85.178,10.0.2.15,TCP,60,9001  >  35978 [ACK] Seq=4848433 Ack=87173799 Win=65535 Len=0
1,1.6702649999999721,10.0.2.15,62.210.85.178,TLSv1.2,4124,Application Data
1,1.6703529999999773,10.0.2.15,62.210.85.178,TCP,2974,35978  >  9001 [ACK] Seq=87177869 Ack=4848433 Win=65535 Len=2920 [TCP segment of a reassembled PDU]
1,1.6703950000000987,62.210.85.178,10.0.2.15,TCP,60,9001  >  35978 [ACK] Seq=4848433 Ack=87175259 Win=65535 Len=0
1,1.6704039999999623,62.210.85.178,10.0.2.15,TCP,60,9001  >  35978 [ACK] Seq=4848433 Ack=87176719 Win=65535 Len=0
1,1.6704090000000633,62.210.85.178,10.0.2.15,TCP,60,9001  >  35978 [ACK] Seq=4848433 Ack=87177869 Win=65535 Len=0
1,1.6704130000000532,62.210.85.178,10.0.2.15,TCP,60,9001  >  35978 [ACK] Seq=4848433 Ack=87179329 Win=65535 Len=0
1,1.6704170000000431,62.210.85.178,10.0.2.15,TCP,60,9001  >  35978 [ACK] Seq=4848433 Ack=87180789 Win=65535 Len=0
1,1.6704580000000533,10.0.2.15,62.210.85.178,TLSv1.2,1204,Application Data
1,1.6705500000000484,10.0.2.15,62.210.85.178,TCP,2974,35978  >  9001 [ACK] Seq=87181939 Ack=4848433 Win=65535 Len=2920 [TCP segment of a reassembled PDU]
1,1.6705719999999928,62.210.85.178,10.0.2.15,TCP,60,9001  >  35978 [ACK] Seq=4848433 Ack=87181939 Win=65535 Len=0
1,1.670605999999907,10.0.2.15,62.210.85.178,TLSv1.2,1204,Application Data
1,1.6706409999999323,62.210.85.178,10.0.2.15,TCP,60,9001  >  35978 [ACK] Seq=4848433 Ack=87183399 Win=65535 Len=0
1,1.6706469999999172,62.210.85.178,10.0.2.15,TCP,60,9001  >  35978 [ACK] Seq=4848433 Ack=87184859 Win=65535 Len=0
1,1.6706520000000182,62.210.85.178,10.0.2.15,TCP,60,9001  >  35978 [ACK] Seq=4848433 Ack=87186009 Win=65535 Len=0
1,1.670697999999902,10.0.2.15,62.210.85.178,TLSv1.2,4124,Application Data
1,1.6707899999998972,62.210.85.178,10.0.2.15,TCP,60,9001  >  35978 [ACK] Seq=4848433 Ack=87187469 Win=65535 Len=0
1,1.6707969999999932,62.210.85.178,10.0.2.15,TCP,60,9001  >  35978 [ACK] Seq=4848433 Ack=87188929 Win=65535 Len=0
1,1.6708020000000943,62.210.85.178,10.0.2.15,TCP,60,9001  >  35978 [ACK] Seq=4848433 Ack=87190079 Win=65535 Len=0
1,1.6708320000000185,10.0.2.15,62.210.85.178,TLSv1.2,2974,Application Data
1,1.6708869999999933,10.0.2.15,62.210.85.178,TLSv1.2,1226,Application Data
1,1.6709209999999075,62.210.85.178,10.0.2.15,TCP,60,9001  >  35978 [ACK] Seq=4848433 Ack=87191539 Win=65535 Len=0
1,1.6709270000001197,62.210.85.178,10.0.2.15,TCP,60,9001  >  35978 [ACK] Seq=4848433 Ack=87192999 Win=65535 Len=0
1,1.6709310000001096,62.210.85.178,10.0.2.15,TCP,60,9001  >  35978 [ACK] Seq=4848433 Ack=87194171 Win=65535 Len=0
1,1.6710049999999228,10.0.2.15,62.210.85.178,TLSv1.2,4124,Application Data
1,1.6710900000000493,10.0.2.15,62.210.85.178,TCP,2974,35978  >  9001 [ACK] Seq=87198241 Ack=4848433 Win=65535 Len=2920 [TCP segment of a reassembled PDU]
1,1.6711119999999937,62.210.85.178,10.0.2.15,TCP,60,9001  >  35978 [ACK] Seq=4848433 Ack=87195631 Win=65535 Len=0
1,1.6711190000000897,62.210.85.178,10.0.2.15,TCP,60,9001  >  35978 [ACK] Seq=4848433 Ack=87197091 Win=65535 Len=0
1,1.6711230000000796,62.210.85.178,10.0.2.15,TCP,60,9001  >  35978 [ACK] Seq=4848433 Ack=87198241 Win=65535 Len=0
1,1.6711729999999534,62.210.85.178,10.0.2.15,TCP,60,9001  >  35978 [ACK] Seq=4848433 Ack=87199701 Win=65535 Len=0
1,1.6711780000000545,62.210.85.178,10.0.2.15,TCP,60,9001  >  35978 [ACK] Seq=4848433 Ack=87201161 Win=65535 Len=0
1,1.6712119999999686,10.0.2.15,62.210.85.178,TLSv1.2,110,Application Data
1,1.671248000000105,62.210.85.178,10.0.2.15,TCP,60,9001  >  35978 [ACK] Seq=4848433 Ack=87201217 Win=65535 Len=0
1,1.6836929999999484,10.0.2.15,62.210.85.178,TLSv1.2,4124,Application Data
1,1.6837769999999637,10.0.2.15,62.210.85.178,TCP,2974,35978  >  9001 [ACK] Seq=87205287 Ack=4848433 Win=65535 Len=2920 [TCP segment of a reassembled PDU]
1,1.6838159999999789,62.210.85.178,10.0.2.15,TCP,60,9001  >  35978 [ACK] Seq=4848433 Ack=87202677 Win=65535 Len=0
1,1.6838239999999587,62.210.85.178,10.0.2.15,TCP,60,9001  >  35978 [ACK] Seq=4848433 Ack=87204137 Win=65535 Len=0
1,1.6838279999999486,62.210.85.178,10.0.2.15,TCP,60,9001  >  35978 [ACK] Seq=4848433 Ack=87205287 Win=65535 Len=0
1,1.6838330000000497,62.210.85.178,10.0.2.15,TCP,60,9001  >  35978 [ACK] Seq=4848433 Ack=87206747 Win=65535 Len=0
1,1.6838370000000396,62.210.85.178,10.0.2.15,TCP,60,9001  >  35978 [ACK] Seq=4848433 Ack=87208207 Win=65535 Len=0
1,1.6838769999999386,10.0.2.15,62.210.85.178,TLSv1.2,1204,Application Data
1,1.6839480000001004,10.0.2.15,62.210.85.178,TCP,2974,35978  >  9001 [ACK] Seq=87209357 Ack=4848433 Win=65535 Len=2920 [TCP segment of a reassembled PDU]
1,1.6839860000000044,62.210.85.178,10.0.2.15,TCP,60,9001  >  35978 [ACK] Seq=4848433 Ack=87209357 Win=65535 Len=0
1,1.6840210000000297,10.0.2.15,62.210.85.178,TLSv1.2,1204,Application Data
1,1.68405800000005,62.210.85.178,10.0.2.15,TCP,60,9001  >  35978 [ACK] Seq=4848433 Ack=87210817 Win=65535 Len=0
1,1.6840640000000349,62.210.85.178,10.0.2.15,TCP,60,9001  >  35978 [ACK] Seq=4848433 Ack=87212277 Win=65535 Len=0
1,1.6840680000000248,62.210.85.178,10.0.2.15,TCP,60,9001  >  35978 [ACK] Seq=4848433 Ack=87213427 Win=65535 Len=0
1,1.6841150000000198,10.0.2.15,62.210.85.178,TLSv1.2,4124,Application Data
1,1.68415600000003,62.210.85.178,10.0.2.15,TCP,60,9001  >  35978 [ACK] Seq=4848433 Ack=87214887 Win=65535 Len=0
1,1.6841629999998986,62.210.85.178,10.0.2.15,TCP,60,9001  >  35978 [ACK] Seq=4848433 Ack=87216347 Win=65535 Len=0
1,1.6841670000001159,62.210.85.178,10.0.2.15,TCP,60,9001  >  35978 [ACK] Seq=4848433 Ack=87217497 Win=65535 Len=0
1,1.6842110000000048,10.0.2.15,62.210.85.178,TLSv1.2,332,Application Data
1,1.6842489999999088,62.210.85.178,10.0.2.15,TCP,60,9001  >  35978 [ACK] Seq=4848433 Ack=87217775 Win=65535 Len=0
1,1.684304000000111,10.0.2.15,62.210.85.178,TLSv1.2,3868,Application Data
1,1.684346000000005,62.210.85.178,10.0.2.15,TCP,60,9001  >  35978 [ACK] Seq=4848433 Ack=87219235 Win=65535 Len=0
1,1.6843539999999848,62.210.85.178,10.0.2.15,TCP,60,9001  >  35978 [ACK] Seq=4848433 Ack=87220695 Win=65535 Len=0
1,1.6843590000000859,62.210.85.178,10.0.2.15,TCP,60,9001  >  35978 [ACK] Seq=4848433 Ack=87221589 Win=65535 Len=0
1,1.684406000000081,10.0.2.15,62.210.85.178,TLSv1.2,4124,Application Data
1,1.6844479999999749,62.210.85.178,10.0.2.15,TCP,60,9001  >  35978 [ACK] Seq=4848433 Ack=87223049 Win=65535 Len=0
1,1.6844550000000709,62.210.85.178,10.0.2.15,TCP,60,9001  >  35978 [ACK] Seq=4848433 Ack=87224509 Win=65535 Len=0
1,1.6844590000000608,62.210.85.178,10.0.2.15,TCP,60,9001  >  35978 [ACK] Seq=4848433 Ack=87225659 Win=65535 Len=0
1,1.684502000000066,10.0.2.15,62.210.85.178,TLSv1.2,2002,Application Data
1,1.684543000000076,62.210.85.178,10.0.2.15,TCP,60,9001  >  35978 [ACK] Seq=4848433 Ack=87227119 Win=65535 Len=0
1,1.684549000000061,62.210.85.178,10.0.2.15,TCP,60,9001  >  35978 [ACK] Seq=4848433 Ack=87227607 Win=65535 Len=0
1,1.77489700000001,54.93.77.70,10.0.2.15,TLSv1.2,590,Application Data
1,1.7881870000001072,54.93.77.70,10.0.2.15,TCP,2950,"9001  >  34692 [PSH, ACK] Seq=86968207 Ack=4842405 Win=65535 Len=2896 [TCP segment of a reassembled PDU]"
1,1.7882850000000872,10.0.2.15,54.93.77.70,TCP,54,34692  >  9001 [ACK] Seq=4842405 Ack=86971103 Win=65535 Len=0
1,1.798712999999907,54.93.77.70,10.0.2.15,TLSv1.2,4398,Application Data [TCP segment of a reassembled PDU]
1,1.798813999999993,10.0.2.15,54.93.77.70,TCP,54,34692  >  9001 [ACK] Seq=4842405 Ack=86975447 Win=65535 Len=0
1,1.8083610000001045,54.93.77.70,10.0.2.15,TLSv1.2,590,"Application Data, Application Data"
1,1.8203169999999318,54.93.77.70,10.0.2.15,TCP,2950,"9001  >  34692 [PSH, ACK] Seq=86975983 Ack=4842405 Win=65535 Len=2896 [TCP segment of a reassembled PDU]"
1,1.820402999999942,10.0.2.15,54.93.77.70,TCP,54,34692  >  9001 [ACK] Seq=4842405 Ack=86978879 Win=65535 Len=0
1,1.8271939999999631,54.93.77.70,10.0.2.15,TLSv1.2,4398,"Application Data, Application Data"
1,1.8272770000000946,10.0.2.15,54.93.77.70,TCP,54,34692  >  9001 [ACK] Seq=4842405 Ack=86983223 Win=65535 Len=0
1,1.8346619999999803,54.93.77.70,10.0.2.15,TCP,2950,"9001  >  34692 [PSH, ACK] Seq=86983223 Ack=4842405 Win=65535 Len=2896 [TCP segment of a reassembled PDU]"
1,1.834730000000036,10.0.2.15,54.93.77.70,TCP,54,34692  >  9001 [ACK] Seq=4842405 Ack=86986119 Win=65535 Len=0
1,1.8353919999999562,54.93.77.70,10.0.2.15,TLSv1.2,4398,Application Data [TCP segment of a reassembled PDU]
1,1.8354569999999057,10.0.2.15,54.93.77.70,TCP,54,34692  >  9001 [ACK] Seq=4842405 Ack=86990463 Win=65535 Len=0
1,1.8384470000000874,54.93.77.70,10.0.2.15,TLSv1.2,1104,"Application Data, Application Data"
1,1.847532000000001,54.93.77.70,10.0.2.15,TCP,2950,"9001  >  34692 [PSH, ACK] Seq=86991513 Ack=4842405 Win=65535 Len=2896 [TCP segment of a reassembled PDU]"
1,1.847580999999991,10.0.2.15,54.93.77.70,TCP,54,34692  >  9001 [ACK] Seq=4842405 Ack=86994409 Win=65535 Len=0
1,1.848079000000098,54.93.77.70,10.0.2.15,TLSv1.2,8574,"Application Data, Application Data"
1,1.8481309999999667,10.0.2.15,54.93.77.70,TCP,54,34692  >  9001 [ACK] Seq=4842405 Ack=87002929 Win=65535 Len=0
1,1.8481779999999617,54.93.77.70,10.0.2.15,TLSv1.2,3118,"Application Data, Application Data"
1,1.8483479999999872,10.0.2.15,54.93.77.70,TLSv1.2,590,Application Data
1,1.848451999999952,54.93.77.70,10.0.2.15,TCP,60,9001  >  34692 [ACK] Seq=87005993 Ack=4842941 Win=65535 Len=0
1,1.8600490000001173,10.0.2.15,54.93.77.70,TLSv1.2,590,Application Data
1,1.8601699999999255,54.93.77.70,10.0.2.15,TCP,60,9001  >  34692 [ACK] Seq=87005993 Ack=4843477 Win=65535 Len=0
1,1.866903000000093,54.93.77.70,10.0.2.15,TLSv1.2,1104,Application Data
1,1.885571999999911,54.93.77.70,10.0.2.15,TCP,2950,"9001  >  34692 [PSH, ACK] Seq=87007043 Ack=4843477 Win=65535 Len=2896 [TCP segment of a reassembled PDU]"
1,1.8856590000000324,10.0.2.15,54.93.77.70,TCP,54,34692  >  9001 [ACK] Seq=4843477 Ack=87009939 Win=65535 Len=0
1,1.8961500000000342,54.93.77.70,10.0.2.15,TLSv1.2,2950,Application Data [TCP segment of a reassembled PDU]
1,1.8962039999998979,10.0.2.15,54.93.77.70,TCP,54,34692  >  9001 [ACK] Seq=4843477 Ack=87012835 Win=65535 Len=0
1,1.8967179999999644,54.93.77.70,10.0.2.15,TLSv1.2,5846,Application Data [TCP segment of a reassembled PDU]
1,1.8968139999999494,10.0.2.15,54.93.77.70,TCP,54,34692  >  9001 [ACK] Seq=4843477 Ack=87018627 Win=65535 Len=0
1,1.897335000000112,54.93.77.70,10.0.2.15,TLSv1.2,2950,Application Data [TCP segment of a reassembled PDU]
1,1.8974040000000514,10.0.2.15,54.93.77.70,TCP,54,34692  >  9001 [ACK] Seq=4843477 Ack=87021523 Win=65535 Len=0
1,1.8980269999999564,54.93.77.70,10.0.2.15,TLSv1.2,1502,Application Data [TCP segment of a reassembled PDU]
1,1.8980759999999464,10.0.2.15,54.93.77.70,TCP,54,34692  >  9001 [ACK] Seq=4843477 Ack=87022971 Win=65535 Len=0
1,1.8983700000001136,10.0.2.15,54.93.77.70,TLSv1.2,590,Application Data
1,1.898482999999942,54.93.77.70,10.0.2.15,TCP,60,9001  >  34692 [ACK] Seq=87022971 Ack=4844013 Win=65535 Len=0
1,1.9025810000000547,54.93.77.70,10.0.2.15,TLSv1.2,706,"Application Data, Application Data"
1,1.9094789999999193,54.93.77.70,10.0.2.15,TLSv1.2,10190,"Application Data, Application Data"
1,1.9098050000000057,10.0.2.15,54.93.77.70,TCP,54,34692  >  9001 [ACK] Seq=4844013 Ack=87033759 Win=65535 Len=0
1,1.9184829999999238,54.93.77.70,10.0.2.15,TLSv1.2,2950,Application Data [TCP segment of a reassembled PDU]
1,1.9185660000000553,10.0.2.15,54.93.77.70,TCP,54,34692  >  9001 [ACK] Seq=4844013 Ack=87036655 Win=65535 Len=0
1,1.9193800000000465,54.93.77.70,10.0.2.15,TLSv1.2,8742,"Application Data, Application Data"
1,1.9194549999999708,10.0.2.15,54.93.77.70,TCP,54,34692  >  9001 [ACK] Seq=4844013 Ack=87045343 Win=65535 Len=0
1,1.9205839999999625,54.93.77.70,10.0.2.15,TLSv1.2,2950,Application Data [TCP segment of a reassembled PDU]
1,1.9206329999999525,10.0.2.15,54.93.77.70,TCP,54,34692  >  9001 [ACK] Seq=4844013 Ack=87048239 Win=65535 Len=0
1,1.9208109999999579,10.0.2.15,54.93.77.70,TLSv1.2,590,Application Data
1,1.9208889999999883,54.93.77.70,10.0.2.15,TCP,60,9001  >  34692 [ACK] Seq=87048239 Ack=4844549 Win=65535 Len=0
1,1.9263539999999466,54.93.77.70,10.0.2.15,TLSv1.2,1292,Application Data
1,1.9302430000000186,10.0.2.15,54.93.77.70,TLSv1.2,590,Application Data
1,1.930405999999948,54.93.77.70,10.0.2.15,TCP,60,9001  >  34692 [ACK] Seq=87049477 Ack=4845085 Win=65535 Len=0
1,1.967828000000054,62.210.85.178,10.0.2.15,TLSv1.2,590,Application Data
1,2.0041439999999966,62.210.85.178,10.0.2.15,TLSv1.2,590,Application Data
1,2.004224000000022,10.0.2.15,62.210.85.178,TCP,54,35978  >  9001 [ACK] Seq=87227607 Ack=4849505 Win=65535 Len=0
1,2.030228000000079,62.210.85.178,10.0.2.15,TLSv1.2,590,Application Data
1,2.071032999999943,10.0.2.15,62.210.85.178,TCP,54,35978  >  9001 [ACK] Seq=87227607 Ack=4850041 Win=65535 Len=0
1,2.119171999999935,62.210.85.178,10.0.2.15,TLSv1.2,1104,Application Data
1,2.1192510000000766,10.0.2.15,62.210.85.178,TCP,54,35978  >  9001 [ACK] Seq=87227607 Ack=4851091 Win=65535 Len=0
1,2.119560999999976,10.0.2.15,62.210.85.178,TLSv1.2,590,Application Data
1,2.1196460000001025,62.210.85.178,10.0.2.15,TCP,60,9001  >  35978 [ACK] Seq=4851091 Ack=87228143 Win=65535 Len=0
1,2.222389000000021,54.93.77.70,10.0.2.15,TLSv1.2,590,Application Data
1,2.222831000000042,10.0.2.15,54.93.77.70,TLSv1.2,590,Application Data
1,2.222972999999911,54.93.77.70,10.0.2.15,TCP,60,9001  >  34692 [ACK] Seq=87050013 Ack=4845621 Win=65535 Len=0
1,2.3396809999999277,62.210.85.178,10.0.2.15,TLSv1.2,590,Application Data
1,2.342967000000044,10.0.2.15,62.210.85.178,TLSv1.2,590,Application Data
1,2.3431299999999737,62.210.85.178,10.0.2.15,TCP,60,9001  >  35978 [ACK] Seq=4851627 Ack=87228679 Win=65535 Len=0
1,2.356089000000111,10.0.2.15,62.210.85.178,TLSv1.2,4124,Application Data
1,2.3561839999999847,10.0.2.15,62.210.85.178,TCP,2974,35978  >  9001 [ACK] Seq=87232749 Ack=4851627 Win=65535 Len=2920 [TCP segment of a reassembled PDU]
1,2.356228999999985,62.210.85.178,10.0.2.15,TCP,60,9001  >  35978 [ACK] Seq=4851627 Ack=87230139 Win=65535 Len=0
1,2.3562409999999545,62.210.85.178,10.0.2.15,TCP,60,9001  >  35978 [ACK] Seq=4851627 Ack=87231599 Win=65535 Len=0
1,2.3562460000000556,62.210.85.178,10.0.2.15,TCP,60,9001  >  35978 [ACK] Seq=4851627 Ack=87232749 Win=65535 Len=0
1,2.3562500000000455,62.210.85.178,10.0.2.15,TCP,60,9001  >  35978 [ACK] Seq=4851627 Ack=87234209 Win=65535 Len=0
1,2.3562520000000404,62.210.85.178,10.0.2.15,TCP,60,9001  >  35978 [ACK] Seq=4851627 Ack=87235669 Win=65535 Len=0
1,2.3562970000000405,10.0.2.15,62.210.85.178,TLSv1.2,1204,Application Data
1,2.3563309999999547,62.210.85.178,10.0.2.15,TCP,60,9001  >  35978 [ACK] Seq=4851627 Ack=87236819 Win=65535 Len=0
1,2.3563759999999547,10.0.2.15,62.210.85.178,TLSv1.2,4124,Application Data
1,2.3564100000000963,62.210.85.178,10.0.2.15,TCP,60,9001  >  35978 [ACK] Seq=4851627 Ack=87238279 Win=65535 Len=0
1,2.356418000000076,62.210.85.178,10.0.2.15,TCP,60,9001  >  35978 [ACK] Seq=4851627 Ack=87239739 Win=65535 Len=0
1,2.356420999999955,62.210.85.178,10.0.2.15,TCP,60,9001  >  35978 [ACK] Seq=4851627 Ack=87240889 Win=65535 Len=0
1,2.3564590000000862,10.0.2.15,62.210.85.178,TLSv1.2,1810,Application Data
1,2.3564930000000004,62.210.85.178,10.0.2.15,TCP,60,9001  >  35978 [ACK] Seq=4851627 Ack=87242349 Win=65535 Len=0
1,2.3565000000000964,62.210.85.178,10.0.2.15,TCP,60,9001  >  35978 [ACK] Seq=4851627 Ack=87242645 Win=65535 Len=0
1,2.4568500000000313,54.93.77.70,10.0.2.15,TLSv1.2,590,Application Data
1,2.4634189999999307,54.93.77.70,10.0.2.15,TCP,2950,"9001  >  34692 [PSH, ACK] Seq=87050549 Ack=4845621 Win=65535 Len=2896 [TCP segment of a reassembled PDU]"
1,2.463504000000057,10.0.2.15,54.93.77.70,TCP,54,34692  >  9001 [ACK] Seq=4845621 Ack=87053445 Win=65535 Len=0
1,2.473887999999988,54.93.77.70,10.0.2.15,TLSv1.2,2950,Application Data [TCP segment of a reassembled PDU]
1,2.473930999999993,10.0.2.15,54.93.77.70,TCP,54,34692  >  9001 [ACK] Seq=4845621 Ack=87056341 Win=65535 Len=0
1,2.4761530000000675,54.93.77.70,10.0.2.15,TLSv1.2,4398,Application Data [TCP segment of a reassembled PDU]
1,2.476212999999916,10.0.2.15,54.93.77.70,TCP,54,34692  >  9001 [ACK] Seq=4845621 Ack=87060685 Win=65535 Len=0
1,2.4841590000000906,54.93.77.70,10.0.2.15,TLSv1.2,1292,Application Data
1,2.4843180000000302,10.0.2.15,54.93.77.70,TLSv1.2,590,Application Data
1,2.4844120000000203,54.93.77.70,10.0.2.15,TCP,60,9001  >  34692 [ACK] Seq=87061923 Ack=4846157 Win=65535 Len=0
1,2.499033000000054,54.93.77.70,10.0.2.15,TLSv1.2,1502,Application Data
1,2.4995490000001155,10.0.2.15,54.93.77.70,TCP,54,34692  >  9001 [ACK] Seq=4846157 Ack=87063371 Win=65535 Len=0
1,2.5034049999999297,54.93.77.70,10.0.2.15,TLSv1.2,1220,Application Data
1,2.5056119999999282,10.0.2.15,54.93.77.70,TLSv1.2,590,Application Data
1,2.5057610000001205,54.93.77.70,10.0.2.15,TCP,60,9001  >  34692 [ACK] Seq=87064537 Ack=4846693 Win=65535 Len=0
1,2.58810799999992,62.210.85.178,10.0.2.15,TLSv1.2,590,Application Data
1,2.631016999999929,10.0.2.15,62.210.85.178,TCP,54,35978  >  9001 [ACK] Seq=87242645 Ack=4852163 Win=65535 Len=0
1,2.7090619999999035,62.210.85.178,10.0.2.15,TLSv1.2,590,Application Data
1,2.7092709999999443,10.0.2.15,62.210.85.178,TCP,54,35978  >  9001 [ACK] Seq=87242645 Ack=4852699 Win=65535 Len=0
1,2.7100419999999303,10.0.2.15,62.210.85.178,TLSv1.2,590,Application Data
1,2.7101800000000367,62.210.85.178,10.0.2.15,TCP,60,9001  >  35978 [ACK] Seq=4852699 Ack=87243181 Win=65535 Len=0
1,2.801036999999951,54.93.77.70,10.0.2.15,TLSv1.2,590,Application Data
1,2.8015270000000783,10.0.2.15,54.93.77.70,TLSv1.2,590,Application Data
1,2.801635000000033,54.93.77.70,10.0.2.15,TCP,60,9001  >  34692 [ACK] Seq=87065073 Ack=4847229 Win=65535 Len=0
1,2.9132230000000163,62.210.85.178,10.0.2.15,TLSv1.2,590,Application Data
1,2.9226960000000872,10.0.2.15,62.210.85.178,TLSv1.2,590,Application Data
1,2.922890000000052,62.210.85.178,10.0.2.15,TCP,60,9001  >  35978 [ACK] Seq=4853235 Ack=87243717 Win=65535 Len=0
1,2.9358190000000377,10.0.2.15,62.210.85.178,TLSv1.2,4124,Application Data
1,2.9359320000000935,10.0.2.15,62.210.85.178,TCP,2974,35978  >  9001 [ACK] Seq=87247787 Ack=4853235 Win=65535 Len=2920 [TCP segment of a reassembled PDU]
1,2.9359870000000683,62.210.85.178,10.0.2.15,TCP,60,9001  >  35978 [ACK] Seq=4853235 Ack=87245177 Win=65535 Len=0
1,2.935999000000038,62.210.85.178,10.0.2.15,TCP,60,9001  >  35978 [ACK] Seq=4853235 Ack=87246637 Win=65535 Len=0
1,2.936005000000023,62.210.85.178,10.0.2.15,TCP,60,9001  >  35978 [ACK] Seq=4853235 Ack=87247787 Win=65535 Len=0
1,2.936010000000124,62.210.85.178,10.0.2.15,TCP,60,9001  >  35978 [ACK] Seq=4853235 Ack=87249247 Win=65535 Len=0
1,2.936014000000114,62.210.85.178,10.0.2.15,TCP,60,9001  >  35978 [ACK] Seq=4853235 Ack=87250707 Win=65535 Len=0
1,2.936050000000023,10.0.2.15,62.210.85.178,TLSv1.2,1204,Application Data
1,2.936087999999927,62.210.85.178,10.0.2.15,TCP,60,9001  >  35978 [ACK] Seq=4853235 Ack=87251857 Win=65535 Len=0
1,2.936134000000038,10.0.2.15,62.210.85.178,TLSv1.2,4124,Application Data
1,2.9361730000000534,62.210.85.178,10.0.2.15,TCP,60,9001  >  35978 [ACK] Seq=4853235 Ack=87253317 Win=65535 Len=0
1,2.936181999999917,62.210.85.178,10.0.2.15,TCP,60,9001  >  35978 [ACK] Seq=4853235 Ack=87254777 Win=65535 Len=0
1,2.936185999999907,62.210.85.178,10.0.2.15,TCP,60,9001  >  35978 [ACK] Seq=4853235 Ack=87255927 Win=65535 Len=0
1,2.936224999999922,10.0.2.15,62.210.85.178,TLSv1.2,4124,Application Data
1,2.9362989999999627,62.210.85.178,10.0.2.15,TCP,60,9001  >  35978 [ACK] Seq=4853235 Ack=87257387 Win=65535 Len=0
1,2.9363100000000486,62.210.85.178,10.0.2.15,TCP,60,9001  >  35978 [ACK] Seq=4853235 Ack=87258847 Win=65535 Len=0
1,2.9363129999999273,62.210.85.178,10.0.2.15,TCP,60,9001  >  35978 [ACK] Seq=4853235 Ack=87259997 Win=65535 Len=0
1,2.9363610000000335,10.0.2.15,62.210.85.178,TLSv1.2,332,Application Data
1,2.9364049999999224,62.210.85.178,10.0.2.15,TCP,60,9001  >  35978 [ACK] Seq=4853235 Ack=87260275 Win=65535 Len=0
1,2.9364610000000084,10.0.2.15,62.210.85.178,TLSv1.2,3868,Application Data
1,2.9365020000000186,62.210.85.178,10.0.2.15,TCP,60,9001  >  35978 [ACK] Seq=4853235 Ack=87261735 Win=65535 Len=0
1,2.9365099999999984,62.210.85.178,10.0.2.15,TCP,60,9001  >  35978 [ACK] Seq=4853235 Ack=87263195 Win=65535 Len=0
1,2.9365130000001045,62.210.85.178,10.0.2.15,TCP,60,9001  >  35978 [ACK] Seq=4853235 Ack=87264089 Win=65535 Len=0
1,2.9365520000001197,10.0.2.15,62.210.85.178,TLSv1.2,4124,Application Data
1,2.9365980000000036,62.210.85.178,10.0.2.15,TCP,60,9001  >  35978 [ACK] Seq=4853235 Ack=87265549 Win=65535 Len=0
1,2.9366059999999834,62.210.85.178,10.0.2.15,TCP,60,9001  >  35978 [ACK] Seq=4853235 Ack=87267009 Win=65535 Len=0
1,2.9366090000000895,62.210.85.178,10.0.2.15,TCP,60,9001  >  35978 [ACK] Seq=4853235 Ack=87268159 Win=65535 Len=0
1,2.93664600000011,10.0.2.15,62.210.85.178,TLSv1.2,3030,Application Data
1,2.9366849999998976,62.210.85.178,10.0.2.15,TCP,60,9001  >  35978 [ACK] Seq=4853235 Ack=87269619 Win=65535 Len=0
1,2.936693000000105,62.210.85.178,10.0.2.15,TCP,60,9001  >  35978 [ACK] Seq=4853235 Ack=87271079 Win=65535 Len=0
1,2.9366970000000947,62.210.85.178,10.0.2.15,TCP,60,9001  >  35978 [ACK] Seq=4853235 Ack=87271135 Win=65535 Len=0
1,2.9459260000000995,10.0.2.15,62.210.85.178,TLSv1.2,4124,Application Data
1,2.945981999999958,62.210.85.178,10.0.2.15,TCP,60,9001  >  35978 [ACK] Seq=4853235 Ack=87272595 Win=65535 Len=0
1,2.945993999999928,62.210.85.178,10.0.2.15,TCP,60,9001  >  35978 [ACK] Seq=4853235 Ack=87274055 Win=65535 Len=0
1,2.945999000000029,62.210.85.178,10.0.2.15,TCP,60,9001  >  35978 [ACK] Seq=4853235 Ack=87275205 Win=65535 Len=0
1,2.946048000000019,10.0.2.15,62.210.85.178,TLSv1.2,4124,Application Data
1,2.946089000000029,62.210.85.178,10.0.2.15,TCP,60,9001  >  35978 [ACK] Seq=4853235 Ack=87276665 Win=65535 Len=0
1,2.94609800000012,62.210.85.178,10.0.2.15,TCP,60,9001  >  35978 [ACK] Seq=4853235 Ack=87278125 Win=65535 Len=0
1,2.9461029999999937,62.210.85.178,10.0.2.15,TCP,60,9001  >  35978 [ACK] Seq=4853235 Ack=87279275 Win=65535 Len=0
1,2.946142000000009,10.0.2.15,62.210.85.178,TLSv1.2,4124,Application Data
1,2.946183000000019,62.210.85.178,10.0.2.15,TCP,60,9001  >  35978 [ACK] Seq=4853235 Ack=87280735 Win=65535 Len=0
1,2.94619200000011,62.210.85.178,10.0.2.15,TCP,60,9001  >  35978 [ACK] Seq=4853235 Ack=87282195 Win=65535 Len=0
1,2.9461969999999837,62.210.85.178,10.0.2.15,TCP,60,9001  >  35978 [ACK] Seq=4853235 Ack=87283345 Win=65535 Len=0
1,2.946234000000004,10.0.2.15,62.210.85.178,TLSv1.2,4124,Application Data
1,2.946271999999908,62.210.85.178,10.0.2.15,TCP,60,9001  >  35978 [ACK] Seq=4853235 Ack=87284805 Win=65535 Len=0
1,2.9462800000001153,62.210.85.178,10.0.2.15,TCP,60,9001  >  35978 [ACK] Seq=4853235 Ack=87286265 Win=65535 Len=0
1,2.946284999999989,62.210.85.178,10.0.2.15,TCP,60,9001  >  35978 [ACK] Seq=4853235 Ack=87287415 Win=65535 Len=0
1,2.9463200000000143,10.0.2.15,62.210.85.178,TLSv1.2,332,Application Data
1,2.9463570000000345,62.210.85.178,10.0.2.15,TCP,60,9001  >  35978 [ACK] Seq=4853235 Ack=87287693 Win=65535 Len=0
1,2.946410999999898,10.0.2.15,62.210.85.178,TLSv1.2,3868,Application Data
1,2.9464499999999134,62.210.85.178,10.0.2.15,TCP,60,9001  >  35978 [ACK] Seq=4853235 Ack=87289153 Win=65535 Len=0
1,2.9464590000000044,62.210.85.178,10.0.2.15,TCP,60,9001  >  35978 [ACK] Seq=4853235 Ack=87290613 Win=65535 Len=0
1,2.9464629999999943,62.210.85.178,10.0.2.15,TCP,60,9001  >  35978 [ACK] Seq=4853235 Ack=87291507 Win=65535 Len=0
1,2.9465020000000095,10.0.2.15,62.210.85.178,TLSv1.2,4124,Application Data
1,2.9465419999999085,62.210.85.178,10.0.2.15,TCP,60,9001  >  35978 [ACK] Seq=4853235 Ack=87292967 Win=65535 Len=0
1,2.9465500000001157,62.210.85.178,10.0.2.15,TCP,60,9001  >  35978 [ACK] Seq=4853235 Ack=87294427 Win=65535 Len=0
1,2.9465540000001056,62.210.85.178,10.0.2.15,TCP,60,9001  >  35978 [ACK] Seq=4853235 Ack=87295577 Win=65535 Len=0
1,2.9465900000000147,10.0.2.15,62.210.85.178,TLSv1.2,3030,Application Data
1,2.94662900000003,62.210.85.178,10.0.2.15,TCP,60,9001  >  35978 [ACK] Seq=4853235 Ack=87297037 Win=65535 Len=0
1,2.9466370000000097,62.210.85.178,10.0.2.15,TCP,60,9001  >  35978 [ACK] Seq=4853235 Ack=87298497 Win=65535 Len=0
1,2.946642000000111,62.210.85.178,10.0.2.15,TCP,60,9001  >  35978 [ACK] Seq=4853235 Ack=87298553 Win=65535 Len=0
1,2.959190999999919,10.0.2.15,62.210.85.178,TLSv1.2,4124,Application Data
1,2.959329000000025,10.0.2.15,62.210.85.178,TCP,2974,35978  >  9001 [ACK] Seq=87302623 Ack=4853235 Win=65535 Len=2920 [TCP segment of a reassembled PDU]
1,2.9593560000000707,62.210.85.178,10.0.2.15,TCP,60,9001  >  35978 [ACK] Seq=4853235 Ack=87300013 Win=65535 Len=0
1,2.9593669999999292,62.210.85.178,10.0.2.15,TCP,60,9001  >  35978 [ACK] Seq=4853235 Ack=87301473 Win=65535 Len=0
1,2.959372999999914,62.210.85.178,10.0.2.15,TCP,60,9001  >  35978 [ACK] Seq=4853235 Ack=87302623 Win=65535 Len=0
1,2.959376999999904,62.210.85.178,10.0.2.15,TCP,60,9001  >  35978 [ACK] Seq=4853235 Ack=87304083 Win=65535 Len=0
1,2.95938000000001,62.210.85.178,10.0.2.15,TCP,60,9001  >  35978 [ACK] Seq=4853235 Ack=87305543 Win=65535 Len=0
1,2.9594150000000354,10.0.2.15,62.210.85.178,TLSv1.2,1204,Application Data
1,2.9594529999999395,62.210.85.178,10.0.2.15,TCP,60,9001  >  35978 [ACK] Seq=4853235 Ack=87306693 Win=65535 Len=0
1,2.9595099999999093,10.0.2.15,62.210.85.178,TLSv1.2,4124,Application Data
1,2.9595509999999194,62.210.85.178,10.0.2.15,TCP,60,9001  >  35978 [ACK] Seq=4853235 Ack=87308153 Win=65535 Len=0
1,2.9595600000000104,62.210.85.178,10.0.2.15,TCP,60,9001  >  35978 [ACK] Seq=4853235 Ack=87309613 Win=65535 Len=0
1,2.9595650000001115,62.210.85.178,10.0.2.15,TCP,60,9001  >  35978 [ACK] Seq=4853235 Ack=87310763 Win=65535 Len=0
1,2.9596050000000105,10.0.2.15,62.210.85.178,TLSv1.2,4124,Application Data
1,2.9596460000000206,62.210.85.178,10.0.2.15,TCP,60,9001  >  35978 [ACK] Seq=4853235 Ack=87312223 Win=65535 Len=0
1,2.9596540000000005,62.210.85.178,10.0.2.15,TCP,60,9001  >  35978 [ACK] Seq=4853235 Ack=87313683 Win=65535 Len=0
1,2.9596590000001015,62.210.85.178,10.0.2.15,TCP,60,9001  >  35978 [ACK] Seq=4853235 Ack=87314833 Win=65535 Len=0
1,2.9596930000000157,10.0.2.15,62.210.85.178,TLSv1.2,332,Application Data
1,2.959732000000031,62.210.85.178,10.0.2.15,TCP,60,9001  >  35978 [ACK] Seq=4853235 Ack=87315111 Win=65535 Len=0
1,2.959781000000021,10.0.2.15,62.210.85.178,TLSv1.2,1104,Application Data
1,2.95982099999992,62.210.85.178,10.0.2.15,TCP,60,9001  >  35978 [ACK] Seq=4853235 Ack=87316161 Win=65535 Len=0
1,3.0214679999999134,54.93.77.70,10.0.2.15,TLSv1.2,590,Application Data
1,3.063034000000016,10.0.2.15,54.93.77.70,TCP,54,34692  >  9001 [ACK] Seq=4847229 Ack=87065609 Win=65535 Len=0
1,3.100106000000096,54.93.77.70,10.0.2.15,TLSv1.2,3674,Application Data
1,3.1001830000000155,10.0.2.15,54.93.77.70,TCP,54,34692  >  9001 [ACK] Seq=4847229 Ack=87069229 Win=65535 Len=0
1,3.110738000000083,54.93.77.70,10.0.2.15,TCP,2950,"9001  >  34692 [PSH, ACK] Seq=87069229 Ack=4847229 Win=65535 Len=2896 [TCP segment of a reassembled PDU]"
1,3.1108189999999922,10.0.2.15,54.93.77.70,TCP,54,34692  >  9001 [ACK] Seq=4847229 Ack=87072125 Win=65535 Len=0
1,3.111163999999917,54.93.77.70,10.0.2.15,TLSv1.2,4398,Application Data [TCP segment of a reassembled PDU]
1,3.111204999999927,10.0.2.15,54.93.77.70,TCP,54,34692  >  9001 [ACK] Seq=4847229 Ack=87076469 Win=65535 Len=0
1,3.1175089999999273,54.93.77.70,10.0.2.15,TLSv1.2,568,Application Data
1,3.1175510000000486,10.0.2.15,54.93.77.70,TCP,54,34692  >  9001 [ACK] Seq=4847229 Ack=87076983 Win=65535 Len=0
1,3.1310410000000957,54.93.77.70,10.0.2.15,TLSv1.2,5846,"Application Data, Application Data"
1,3.131155999999919,10.0.2.15,54.93.77.70,TCP,54,34692  >  9001 [ACK] Seq=4847229 Ack=87082775 Win=65535 Len=0
1,3.131208000000015,54.93.77.70,10.0.2.15,TLSv1.2,2950,Application Data [TCP segment of a reassembled PDU]
1,3.1312379999999393,10.0.2.15,54.93.77.70,TCP,54,34692  >  9001 [ACK] Seq=4847229 Ack=87085671 Win=65535 Len=0
1,3.13408000000004,54.93.77.70,10.0.2.15,TLSv1.2,192,Application Data
1,3.134123000000045,10.0.2.15,54.93.77.70,TCP,54,34692  >  9001 [ACK] Seq=4847229 Ack=87085809 Win=65535 Len=0
1,3.1411410000000615,54.93.77.70,10.0.2.15,TLSv1.2,5846,Application Data
1,3.1411829999999554,54.93.77.70,10.0.2.15,TLSv1.2,2950,Application Data [TCP segment of a reassembled PDU]
1,3.1412330000000566,10.0.2.15,54.93.77.70,TCP,54,34692  >  9001 [ACK] Seq=4847229 Ack=87091601 Win=65535 Len=0
1,3.1412780000000566,10.0.2.15,54.93.77.70,TCP,54,34692  >  9001 [ACK] Seq=4847229 Ack=87094497 Win=65535 Len=0
1,3.1415680000000066,10.0.2.15,54.93.77.70,TLSv1.2,590,Application Data
1,3.141640999999936,54.93.77.70,10.0.2.15,TCP,60,9001  >  34692 [ACK] Seq=87094497 Ack=4847765 Win=65535 Len=0
1,3.142266999999947,54.93.77.70,10.0.2.15,TCP,2950,"9001  >  34692 [PSH, ACK] Seq=87094497 Ack=4847765 Win=65535 Len=2896 [TCP segment of a reassembled PDU]"
1,3.1423090000000684,10.0.2.15,54.93.77.70,TCP,54,34692  >  9001 [ACK] Seq=4847765 Ack=87097393 Win=65535 Len=0
1,3.149977999999919,54.93.77.70,10.0.2.15,TLSv1.2,2950,Application Data [TCP segment of a reassembled PDU]
1,3.1500189999999293,10.0.2.15,54.93.77.70,TCP,54,34692  >  9001 [ACK] Seq=4847765 Ack=87100289 Win=65535 Len=0
1,3.151157000000012,54.93.77.70,10.0.2.15,TLSv1.2,8742,"Application Data, Application Data"
1,3.1511749999999665,54.93.77.70,10.0.2.15,TLSv1.2,662,Application Data
1,3.1512370000000374,10.0.2.15,54.93.77.70,TCP,54,34692  >  9001 [ACK] Seq=4847765 Ack=87109585 Win=65535 Len=0
1,3.1592450000000554,54.93.77.70,10.0.2.15,TCP,2950,"9001  >  34692 [PSH, ACK] Seq=87109585 Ack=4847765 Win=65535 Len=2896 [TCP segment of a reassembled PDU]"
1,3.159296999999924,10.0.2.15,54.93.77.70,TCP,54,34692  >  9001 [ACK] Seq=4847765 Ack=87112481 Win=65535 Len=0
1,3.1710230000001047,54.93.77.70,10.0.2.15,TLSv1.2,5846,"Application Data, Application Data"
1,3.171049000000039,54.93.77.70,10.0.2.15,TLSv1.2,11544,"Application Data, Application Data, Application Data, Application Data"
1,3.1711159999999836,10.0.2.15,54.93.77.70,TCP,54,34692  >  9001 [ACK] Seq=4847765 Ack=87129763 Win=65535 Len=0
1,3.1712950000001,10.0.2.15,54.93.77.70,TLSv1.2,590,Application Data
1,3.171379999999999,54.93.77.70,10.0.2.15,TCP,60,9001  >  34692 [ACK] Seq=87129763 Ack=4848301 Win=65535 Len=0
1,3.179014000000052,54.93.77.70,10.0.2.15,TLSv1.2,2950,Application Data
1,3.1790860000000976,10.0.2.15,54.93.77.70,TCP,54,34692  >  9001 [ACK] Seq=4848301 Ack=87132659 Win=65535 Len=0
1,3.1835980000000745,10.0.2.15,54.93.77.70,TLSv1.2,590,Application Data
1,3.183712999999898,54.93.77.70,10.0.2.15,TCP,60,9001  >  34692 [ACK] Seq=87132659 Ack=4848837 Win=65535 Len=0
1,3.1896180000001095,54.93.77.70,10.0.2.15,TLSv1.2,1314,Application Data
1,3.1899439999999686,54.93.77.70,10.0.2.15,TCP,2950,"9001  >  34692 [PSH, ACK] Seq=87133919 Ack=4848837 Win=65535 Len=2896 [TCP segment of a reassembled PDU]"
1,3.190121999999974,10.0.2.15,54.93.77.70,TCP,54,34692  >  9001 [ACK] Seq=4848837 Ack=87136815 Win=65535 Len=0
1,3.2064660000000913,54.93.77.70,10.0.2.15,TLSv1.2,1314,"Application Data, Application Data"
1,3.210600000000113,10.0.2.15,54.93.77.70,TLSv1.2,590,Application Data
1,3.2109609999999975,54.93.77.70,10.0.2.15,TCP,60,9001  >  34692 [ACK] Seq=87138075 Ack=4849373 Win=65535 Len=0
1,3.271103000000039,62.210.85.178,10.0.2.15,TLSv1.2,590,Application Data
1,3.311582999999928,62.210.85.178,10.0.2.15,TLSv1.2,590,Application Data
1,3.3116620000000694,10.0.2.15,62.210.85.178,TCP,54,35978  >  9001 [ACK] Seq=87316161 Ack=4854307 Win=65535 Len=0
1,3.479663999999957,62.210.85.178,10.0.2.15,TLSv1.2,1104,Application Data
1,3.4801780000000235,10.0.2.15,62.210.85.178,TLSv1.2,590,Application Data
1,3.4802870000000894,62.210.85.178,10.0.2.15,TCP,60,9001  >  35978 [ACK] Seq=4855357 Ack=87316697 Win=65535 Len=0
1,3.684930000000122,54.93.77.70,10.0.2.15,TLSv1.2,590,Application Data
1,3.685367000000042,10.0.2.15,54.93.77.70,TLSv1.2,590,Application Data
1,3.6854809999999816,54.93.77.70,10.0.2.15,TCP,60,9001  >  34692 [ACK] Seq=87138611 Ack=4849909 Win=65535 Len=0
1,3.796743000000106,62.210.85.178,10.0.2.15,TLSv1.2,590,Application Data
1,3.8022439999999733,10.0.2.15,62.210.85.178,TLSv1.2,590,Application Data
1,3.8033660000000964,62.210.85.178,10.0.2.15,TCP,60,9001  >  35978 [ACK] Seq=4855893 Ack=87317233 Win=65535 Len=0
1,3.815988999999945,10.0.2.15,62.210.85.178,TLSv1.2,4124,Application Data
1,3.8161039999999957,10.0.2.15,62.210.85.178,TCP,2974,35978  >  9001 [ACK] Seq=87321303 Ack=4855893 Win=65535 Len=2920 [TCP segment of a reassembled PDU]
1,3.816147000000001,62.210.85.178,10.0.2.15,TCP,60,9001  >  35978 [ACK] Seq=4855893 Ack=87318693 Win=65535 Len=0
1,3.8161589999999705,62.210.85.178,10.0.2.15,TCP,60,9001  >  35978 [ACK] Seq=4855893 Ack=87320153 Win=65535 Len=0
1,3.8161620000000767,62.210.85.178,10.0.2.15,TCP,60,9001  >  35978 [ACK] Seq=4855893 Ack=87321303 Win=65535 Len=0
1,3.8161649999999554,62.210.85.178,10.0.2.15,TCP,60,9001  >  35978 [ACK] Seq=4855893 Ack=87322763 Win=65535 Len=0
1,3.8161680000000615,62.210.85.178,10.0.2.15,TCP,60,9001  >  35978 [ACK] Seq=4855893 Ack=87324223 Win=65535 Len=0
1,3.816203000000087,10.0.2.15,62.210.85.178,TLSv1.2,1204,Application Data
1,3.816238000000112,62.210.85.178,10.0.2.15,TCP,60,9001  >  35978 [ACK] Seq=4855893 Ack=87325373 Win=65535 Len=0
1,3.816287999999986,10.0.2.15,62.210.85.178,TLSv1.2,4124,Application Data
1,3.8163230000000112,62.210.85.178,10.0.2.15,TCP,60,9001  >  35978 [ACK] Seq=4855893 Ack=87326833 Win=65535 Len=0
1,3.816330999999991,62.210.85.178,10.0.2.15,TCP,60,9001  >  35978 [ACK] Seq=4855893 Ack=87328293 Win=65535 Len=0
1,3.816334999999981,62.210.85.178,10.0.2.15,TCP,60,9001  >  35978 [ACK] Seq=4855893 Ack=87329443 Win=65535 Len=0
1,3.8163730000001124,10.0.2.15,62.210.85.178,TLSv1.2,4124,Application Data
1,3.8164079999999103,62.210.85.178,10.0.2.15,TCP,60,9001  >  35978 [ACK] Seq=4855893 Ack=87330903 Win=65535 Len=0
1,3.8164150000000063,62.210.85.178,10.0.2.15,TCP,60,9001  >  35978 [ACK] Seq=4855893 Ack=87332363 Win=65535 Len=0
1,3.8164730000000873,10.0.2.15,62.210.85.178,TLSv1.2,2974,Application Data
1,3.8165140000000974,62.210.85.178,10.0.2.15,TCP,60,9001  >  35978 [ACK] Seq=4855893 Ack=87333513 Win=65535 Len=0
1,3.816520999999966,62.210.85.178,10.0.2.15,TCP,60,9001  >  35978 [ACK] Seq=4855893 Ack=87334973 Win=65535 Len=0
1,3.816524000000072,62.210.85.178,10.0.2.15,TCP,60,9001  >  35978 [ACK] Seq=4855893 Ack=87336433 Win=65535 Len=0
1,3.8165510000001177,10.0.2.15,62.210.85.178,TLSv1.2,1226,Application Data
1,3.816618999999946,10.0.2.15,62.210.85.178,TCP,2974,35978  >  9001 [ACK] Seq=87337605 Ack=4855893 Win=65535 Len=2920 [TCP segment of a reassembled PDU]
1,3.8166559999999663,62.210.85.178,10.0.2.15,TCP,60,9001  >  35978 [ACK] Seq=4855893 Ack=87337605 Win=65535 Len=0
1,3.8166630000000623,62.210.85.178,10.0.2.15,TCP,60,9001  >  35978 [ACK] Seq=4855893 Ack=87339065 Win=65535 Len=0
1,3.816665999999941,62.210.85.178,10.0.2.15,TCP,60,9001  >  35978 [ACK] Seq=4855893 Ack=87340525 Win=65535 Len=0
1,3.816692000000103,10.0.2.15,62.210.85.178,TLSv1.2,1204,Application Data
1,3.816724000000022,62.210.85.178,10.0.2.15,TCP,60,9001  >  35978 [ACK] Seq=4855893 Ack=87341675 Win=65535 Len=0
1,3.816761999999926,10.0.2.15,62.210.85.178,TLSv1.2,3030,Application Data
1,3.8167969999999514,62.210.85.178,10.0.2.15,TCP,60,9001  >  35978 [ACK] Seq=4855893 Ack=87343135 Win=65535 Len=0
1,3.816802999999936,62.210.85.178,10.0.2.15,TCP,60,9001  >  35978 [ACK] Seq=4855893 Ack=87344595 Win=65535 Len=0
1,3.8168060000000423,62.210.85.178,10.0.2.15,TCP,60,9001  >  35978 [ACK] Seq=4855893 Ack=87344651 Win=65535 Len=0
1,3.827097999999978,10.0.2.15,62.210.85.178,TLSv1.2,4124,Application Data
1,3.8271870000000945,62.210.85.178,10.0.2.15,TCP,60,9001  >  35978 [ACK] Seq=4855893 Ack=87346111 Win=65535 Len=0
1,3.827197999999953,62.210.85.178,10.0.2.15,TCP,60,9001  >  35978 [ACK] Seq=4855893 Ack=87347571 Win=65535 Len=0
1,3.827201000000059,62.210.85.178,10.0.2.15,TCP,60,9001  >  35978 [ACK] Seq=4855893 Ack=87348721 Win=65535 Len=0
1,3.827244999999948,10.0.2.15,62.210.85.178,TLSv1.2,4124,Application Data
1,3.8273039999999128,62.210.85.178,10.0.2.15,TCP,60,9001  >  35978 [ACK] Seq=4855893 Ack=87350181 Win=65535 Len=0
1,3.827311000000009,62.210.85.178,10.0.2.15,TCP,60,9001  >  35978 [ACK] Seq=4855893 Ack=87351641 Win=65535 Len=0
1,3.827314000000115,62.210.85.178,10.0.2.15,TCP,60,9001  >  35978 [ACK] Seq=4855893 Ack=87352791 Win=65535 Len=0
1,3.8273549999998977,10.0.2.15,62.210.85.178,TLSv1.2,4124,Application Data
1,3.827389999999923,62.210.85.178,10.0.2.15,TCP,60,9001  >  35978 [ACK] Seq=4855893 Ack=87354251 Win=65535 Len=0
1,3.827397000000019,62.210.85.178,10.0.2.15,TCP,60,9001  >  35978 [ACK] Seq=4855893 Ack=87355711 Win=65535 Len=0
1,3.827401000000009,62.210.85.178,10.0.2.15,TCP,60,9001  >  35978 [ACK] Seq=4855893 Ack=87356861 Win=65535 Len=0
1,3.827436999999918,10.0.2.15,62.210.85.178,TLSv1.2,4124,Application Data
1,3.827479999999923,62.210.85.178,10.0.2.15,TCP,60,9001  >  35978 [ACK] Seq=4855893 Ack=87358321 Win=65535 Len=0
1,3.827487000000019,62.210.85.178,10.0.2.15,TCP,60,9001  >  35978 [ACK] Seq=4855893 Ack=87359781 Win=65535 Len=0
1,3.827489000000014,62.210.85.178,10.0.2.15,TCP,60,9001  >  35978 [ACK] Seq=4855893 Ack=87360931 Win=65535 Len=0
1,3.8275229999999283,10.0.2.15,62.210.85.178,TLSv1.2,332,Application Data
1,3.827643999999964,62.210.85.178,10.0.2.15,TCP,60,9001  >  35978 [ACK] Seq=4855893 Ack=87361209 Win=65535 Len=0
1,3.8277129999999033,10.0.2.15,62.210.85.178,TLSv1.2,3868,Application Data
1,3.8277590000000146,62.210.85.178,10.0.2.15,TCP,60,9001  >  35978 [ACK] Seq=4855893 Ack=87362669 Win=65535 Len=0
1,3.8277660000001106,62.210.85.178,10.0.2.15,TCP,60,9001  >  35978 [ACK] Seq=4855893 Ack=87364129 Win=65535 Len=0
1,3.8277689999999893,62.210.85.178,10.0.2.15,TCP,60,9001  >  35978 [ACK] Seq=4855893 Ack=87365023 Win=65535 Len=0
1,3.8278070000001208,10.0.2.15,62.210.85.178,TLSv1.2,4124,Application Data
1,3.82784300000003,62.210.85.178,10.0.2.15,TCP,60,9001  >  35978 [ACK] Seq=4855893 Ack=87366483 Win=65535 Len=0
1,3.8278490000000147,62.210.85.178,10.0.2.15,TCP,60,9001  >  35978 [ACK] Seq=4855893 Ack=87367943 Win=65535 Len=0
1,3.827852000000121,62.210.85.178,10.0.2.15,TCP,60,9001  >  35978 [ACK] Seq=4855893 Ack=87369093 Win=65535 Len=0
1,3.8278869999999188,10.0.2.15,62.210.85.178,TLSv1.2,3030,Application Data
1,3.827923999999939,62.210.85.178,10.0.2.15,TCP,60,9001  >  35978 [ACK] Seq=4855893 Ack=87370553 Win=65535 Len=0
1,3.827931000000035,62.210.85.178,10.0.2.15,TCP,60,9001  >  35978 [ACK] Seq=4855893 Ack=87372013 Win=65535 Len=0
1,3.82793300000003,62.210.85.178,10.0.2.15,TCP,60,9001  >  35978 [ACK] Seq=4855893 Ack=87372069 Win=65535 Len=0
1,3.9038889999999355,54.93.77.70,10.0.2.15,TLSv1.2,590,Application Data
1,3.9362209999999322,54.93.77.70,10.0.2.15,TLSv1.2,7294,"Application Data, Application Data"
1,3.936302000000069,10.0.2.15,54.93.77.70,TCP,54,34692  >  9001 [ACK] Seq=4849909 Ack=87146387 Win=65535 Len=0
1,3.946815999999899,54.93.77.70,10.0.2.15,TLSv1.2,5846,Application Data
1,3.946871000000101,10.0.2.15,54.93.77.70,TCP,54,34692  >  9001 [ACK] Seq=4849909 Ack=87152179 Win=65535 Len=0
1,3.95269600000006,54.93.77.70,10.0.2.15,TLSv1.2,2950,Application Data [TCP segment of a reassembled PDU]
1,3.9527579999999034,10.0.2.15,54.93.77.70,TCP,54,34692  >  9001 [ACK] Seq=4849909 Ack=87155075 Win=65535 Len=0
1,3.9534940000000915,54.93.77.70,10.0.2.15,TLSv1.2,5332,"Application Data, Application Data"
1,3.953557000000046,10.0.2.15,54.93.77.70,TCP,54,34692  >  9001 [ACK] Seq=4849909 Ack=87160353 Win=65535 Len=0
1,3.9548440000000937,54.93.77.70,10.0.2.15,TLSv1.2,7294,Application Data
1,3.954887000000099,10.0.2.15,54.93.77.70,TCP,54,34692  >  9001 [ACK] Seq=4849909 Ack=87167593 Win=65535 Len=0
1,3.955556999999999,54.93.77.70,10.0.2.15,TLSv1.2,1502,Application Data [TCP segment of a reassembled PDU]
1,3.955596000000014,10.0.2.15,54.93.77.70,TCP,54,34692  >  9001 [ACK] Seq=4849909 Ack=87169041 Win=65535 Len=0
1,3.955748000000085,10.0.2.15,54.93.77.70,TLSv1.2,1104,Application Data
1,3.9558190000000195,54.93.77.70,10.0.2.15,TCP,60,9001  >  34692 [ACK] Seq=87169041 Ack=4850959 Win=65535 Len=0
1,3.964723999999933,54.93.77.70,10.0.2.15,TCP,2950,"9001  >  34692 [PSH, ACK] Seq=87169041 Ack=4850959 Win=65535 Len=2896 [TCP segment of a reassembled PDU]"
1,3.964787000000115,10.0.2.15,54.93.77.70,TCP,54,34692  >  9001 [ACK] Seq=4850959 Ack=87171937 Win=65535 Len=0
1,3.966564000000062,54.93.77.70,10.0.2.15,TLSv1.2,1502,"Application Data, Application Data"
1,3.966609999999946,10.0.2.15,54.93.77.70,TCP,54,34692  >  9001 [ACK] Seq=4850959 Ack=87173385 Win=65535 Len=0
1,3.9697470000000976,54.93.77.70,10.0.2.15,TLSv1.2,1010,Application Data
1,3.974279000000024,54.93.77.70,10.0.2.15,TCP,2950,"9001  >  34692 [PSH, ACK] Seq=87174341 Ack=4850959 Win=65535 Len=2896 [TCP segment of a reassembled PDU]"
1,3.974328000000014,10.0.2.15,54.93.77.70,TCP,54,34692  >  9001 [ACK] Seq=4850959 Ack=87177237 Win=65535 Len=0
1,3.975932000000057,54.93.77.70,10.0.2.15,TLSv1.2,4398,Application Data [TCP segment of a reassembled PDU]
1,3.9759990000000016,10.0.2.15,54.93.77.70,TCP,54,34692  >  9001 [ACK] Seq=4850959 Ack=87181581 Win=65535 Len=0
1,3.986219000000119,54.93.77.70,10.0.2.15,TLSv1.2,568,Application Data
1,3.9964809999999034,54.93.77.70,10.0.2.15,TLSv1.2,8742,"Application Data, Application Data"
1,3.99655400000006,10.0.2.15,54.93.77.70,TCP,54,34692  >  9001 [ACK] Seq=4850959 Ack=87190783 Win=65535 Len=0
1,4.0067039999999,54.93.77.70,10.0.2.15,TLSv1.2,2950,Application Data [TCP segment of a reassembled PDU]
1,4.006761999999981,10.0.2.15,54.93.77.70,TCP,54,34692  >  9001 [ACK] Seq=4850959 Ack=87193679 Win=65535 Len=0
1,4.006928000000016,10.0.2.15,54.93.77.70,TLSv1.2,590,Application Data
1,4.007047000000057,54.93.77.70,10.0.2.15,TCP,60,9001  >  34692 [ACK] Seq=87193679 Ack=4851495 Win=65535 Len=0
1,4.012969000000112,54.93.77.70,10.0.2.15,TLSv1.2,380,Application Data
1,4.016364000000067,10.0.2.15,54.93.77.70,TLSv1.2,590,Application Data
1,4.016626999999971,54.93.77.70,10.0.2.15,TCP,60,9001  >  34692 [ACK] Seq=87194005 Ack=4852031 Win=65535 Len=0
1,4.048371999999972,62.210.85.178,10.0.2.15,TLSv1.2,1104,Application Data
1,4.09101499999997,10.0.2.15,62.210.85.178,TCP,54,35978  >  9001 [ACK] Seq=87372069 Ack=4856943 Win=65535 Len=0
1,4.13402300000007,62.210.85.178,10.0.2.15,TLSv1.2,590,Application Data
1,4.1340979999999945,10.0.2.15,62.210.85.178,TCP,54,35978  >  9001 [ACK] Seq=87372069 Ack=4857479 Win=65535 Len=0
1,4.156946000000062,62.210.85.178,10.0.2.15,TLSv1.2,590,Application Data
1,4.156999999999925,10.0.2.15,62.210.85.178,TCP,54,35978  >  9001 [ACK] Seq=87372069 Ack=4858015 Win=65535 Len=0
1,4.157427999999982,10.0.2.15,62.210.85.178,TLSv1.2,590,Application Data
1,4.1575370000000476,62.210.85.178,10.0.2.15,TCP,60,9001  >  35978 [ACK] Seq=4858015 Ack=87372605 Win=65535 Len=0
1,4.263435000000072,54.93.77.70,10.0.2.15,TLSv1.2,590,Application Data
1,4.263871999999992,10.0.2.15,54.93.77.70,TLSv1.2,590,Application Data
1,4.263983999999937,54.93.77.70,10.0.2.15,TCP,60,9001  >  34692 [ACK] Seq=87194541 Ack=4852567 Win=65535 Len=0
1,4.409612999999808,62.210.85.178,10.0.2.15,TLSv1.2,590,Application Data
1,4.4202110000001085,10.0.2.15,62.210.85.178,TLSv1.2,590,Application Data
1,4.4203590000001896,62.210.85.178,10.0.2.15,TCP,60,9001  >  35978 [ACK] Seq=4858551 Ack=87373141 Win=65535 Len=0
1,4.432013000000097,10.0.2.15,62.210.85.178,TLSv1.2,4124,Application Data
1,4.432142999999996,10.0.2.15,62.210.85.178,TCP,2974,35978  >  9001 [ACK] Seq=87377211 Ack=4858551 Win=65535 Len=2920 [TCP segment of a reassembled PDU]
1,4.432196000000204,62.210.85.178,10.0.2.15,TCP,60,9001  >  35978 [ACK] Seq=4858551 Ack=87374601 Win=65535 Len=0
1,4.432209000000057,62.210.85.178,10.0.2.15,TCP,60,9001  >  35978 [ACK] Seq=4858551 Ack=87376061 Win=65535 Len=0
1,4.432213999999931,62.210.85.178,10.0.2.15,TCP,60,9001  >  35978 [ACK] Seq=4858551 Ack=87377211 Win=65535 Len=0
1,4.432256999999936,10.0.2.15,62.210.85.178,TLSv1.2,1204,Application Data
1,4.432295000000067,62.210.85.178,10.0.2.15,TCP,60,9001  >  35978 [ACK] Seq=4858551 Ack=87378671 Win=65535 Len=0
1,4.432303000000047,62.210.85.178,10.0.2.15,TCP,60,9001  >  35978 [ACK] Seq=4858551 Ack=87380131 Win=65535 Len=0
1,4.432307000000037,62.210.85.178,10.0.2.15,TCP,60,9001  >  35978 [ACK] Seq=4858551 Ack=87381281 Win=65535 Len=0
1,4.432349000000158,10.0.2.15,62.210.85.178,TLSv1.2,4124,Application Data
1,4.432386999999835,62.210.85.178,10.0.2.15,TCP,60,9001  >  35978 [ACK] Seq=4858551 Ack=87382741 Win=65535 Len=0
1,4.432396000000153,62.210.85.178,10.0.2.15,TCP,60,9001  >  35978 [ACK] Seq=4858551 Ack=87384201 Win=65535 Len=0
1,4.432400000000143,62.210.85.178,10.0.2.15,TCP,60,9001  >  35978 [ACK] Seq=4858551 Ack=87385351 Win=65535 Len=0
1,4.432440000000042,10.0.2.15,62.210.85.178,TLSv1.2,4124,Application Data
1,4.432478000000174,62.210.85.178,10.0.2.15,TCP,60,9001  >  35978 [ACK] Seq=4858551 Ack=87386811 Win=65535 Len=0
1,4.432486000000154,62.210.85.178,10.0.2.15,TCP,60,9001  >  35978 [ACK] Seq=4858551 Ack=87388271 Win=65535 Len=0
1,4.432534000000032,62.210.85.178,10.0.2.15,TCP,60,9001  >  35978 [ACK] Seq=4858551 Ack=87389421 Win=65535 Len=0
1,4.432578999999805,10.0.2.15,62.210.85.178,TLSv1.2,332,Application Data
1,4.4326169999999365,62.210.85.178,10.0.2.15,TCP,60,9001  >  35978 [ACK] Seq=4858551 Ack=87389699 Win=65535 Len=0
1,4.432672999999795,10.0.2.15,62.210.85.178,TLSv1.2,3868,Application Data
1,4.432714000000033,62.210.85.178,10.0.2.15,TCP,60,9001  >  35978 [ACK] Seq=4858551 Ack=87391159 Win=65535 Len=0
1,4.4327220000000125,62.210.85.178,10.0.2.15,TCP,60,9001  >  35978 [ACK] Seq=4858551 Ack=87392619 Win=65535 Len=0
1,4.432726000000002,62.210.85.178,10.0.2.15,TCP,60,9001  >  35978 [ACK] Seq=4858551 Ack=87393513 Win=65535 Len=0
1,4.432764000000134,10.0.2.15,62.210.85.178,TLSv1.2,4124,Application Data
1,4.4328019999998105,62.210.85.178,10.0.2.15,TCP,60,9001  >  35978 [ACK] Seq=4858551 Ack=87394973 Win=65535 Len=0
1,4.43280999999979,62.210.85.178,10.0.2.15,TCP,60,9001  >  35978 [ACK] Seq=4858551 Ack=87396433 Win=65535 Len=0
1,4.432815000000119,62.210.85.178,10.0.2.15,TCP,60,9001  >  35978 [ACK] Seq=4858551 Ack=87397583 Win=65535 Len=0
1,4.432851000000028,10.0.2.15,62.210.85.178,TLSv1.2,3030,Application Data
1,4.432889000000159,62.210.85.178,10.0.2.15,TCP,60,9001  >  35978 [ACK] Seq=4858551 Ack=87399043 Win=65535 Len=0
1,4.4328959999998006,62.210.85.178,10.0.2.15,TCP,60,9001  >  35978 [ACK] Seq=4858551 Ack=87400503 Win=65535 Len=0
1,4.4328999999997905,62.210.85.178,10.0.2.15,TCP,60,9001  >  35978 [ACK] Seq=4858551 Ack=87400559 Win=65535 Len=0
1,4.442157999999836,10.0.2.15,62.210.85.178,TLSv1.2,4124,Application Data
1,4.442250999999942,62.210.85.178,10.0.2.15,TCP,60,9001  >  35978 [ACK] Seq=4858551 Ack=87402019 Win=65535 Len=0
1,4.442262999999912,62.210.85.178,10.0.2.15,TCP,60,9001  >  35978 [ACK] Seq=4858551 Ack=87403479 Win=65535 Len=0
1,4.442266000000018,62.210.85.178,10.0.2.15,TCP,60,9001  >  35978 [ACK] Seq=4858551 Ack=87404629 Win=65535 Len=0
1,4.442316000000119,10.0.2.15,62.210.85.178,TLSv1.2,4124,Application Data
1,4.442403000000013,62.210.85.178,10.0.2.15,TCP,60,9001  >  35978 [ACK] Seq=4858551 Ack=87406089 Win=65535 Len=0
1,4.442413000000215,62.210.85.178,10.0.2.15,TCP,60,9001  >  35978 [ACK] Seq=4858551 Ack=87407549 Win=65535 Len=0
1,4.4424159999998665,62.210.85.178,10.0.2.15,TCP,60,9001  >  35978 [ACK] Seq=4858551 Ack=87408699 Win=65535 Len=0
1,4.44245200000023,10.0.2.15,62.210.85.178,TLSv1.2,4124,Application Data
1,4.442492000000129,62.210.85.178,10.0.2.15,TCP,60,9001  >  35978 [ACK] Seq=4858551 Ack=87410159 Win=65535 Len=0
1,4.442500999999993,62.210.85.178,10.0.2.15,TCP,60,9001  >  35978 [ACK] Seq=4858551 Ack=87411619 Win=65535 Len=0
1,4.442504999999983,62.210.85.178,10.0.2.15,TCP,60,9001  >  35978 [ACK] Seq=4858551 Ack=87412769 Win=65535 Len=0
1,4.44255000000021,10.0.2.15,62.210.85.178,TLSv1.2,4124,Application Data
1,4.4425890000002255,62.210.85.178,10.0.2.15,TCP,60,9001  >  35978 [ACK] Seq=4858551 Ack=87414229 Win=65535 Len=0
1,4.442598000000089,62.210.85.178,10.0.2.15,TCP,60,9001  >  35978 [ACK] Seq=4858551 Ack=87415689 Win=65535 Len=0
1,4.442602000000079,62.210.85.178,10.0.2.15,TCP,60,9001  >  35978 [ACK] Seq=4858551 Ack=87416839 Win=65535 Len=0
1,4.442637000000104,10.0.2.15,62.210.85.178,TLSv1.2,332,Application Data
1,4.442673999999897,62.210.85.178,10.0.2.15,TCP,60,9001  >  35978 [ACK] Seq=4858551 Ack=87417117 Win=65535 Len=0
1,4.442739999999958,10.0.2.15,62.210.85.178,TLSv1.2,3868,Application Data
1,4.442779999999857,62.210.85.178,10.0.2.15,TCP,60,9001  >  35978 [ACK] Seq=4858551 Ack=87418577 Win=65535 Len=0
1,4.442787999999837,62.210.85.178,10.0.2.15,TCP,60,9001  >  35978 [ACK] Seq=4858551 Ack=87420037 Win=65535 Len=0
1,4.442793000000165,62.210.85.178,10.0.2.15,TCP,60,9001  >  35978 [ACK] Seq=4858551 Ack=87420931 Win=65535 Len=0
1,4.44283200000018,10.0.2.15,62.210.85.178,TLSv1.2,4124,Application Data
1,4.442879000000175,62.210.85.178,10.0.2.15,TCP,60,9001  >  35978 [ACK] Seq=4858551 Ack=87422391 Win=65535 Len=0
1,4.442885999999817,62.210.85.178,10.0.2.15,TCP,60,9001  >  35978 [ACK] Seq=4858551 Ack=87423851 Win=65535 Len=0
1,4.442888999999923,62.210.85.178,10.0.2.15,TCP,60,9001  >  35978 [ACK] Seq=4858551 Ack=87425001 Win=65535 Len=0
1,4.442923999999948,10.0.2.15,62.210.85.178,TLSv1.2,3030,Application Data
1,4.442982999999913,62.210.85.178,10.0.2.15,TCP,60,9001  >  35978 [ACK] Seq=4858551 Ack=87426461 Win=65535 Len=0
1,4.442994999999883,62.210.85.178,10.0.2.15,TCP,60,9001  >  35978 [ACK] Seq=4858551 Ack=87427921 Win=65535 Len=0
1,4.442997999999989,62.210.85.178,10.0.2.15,TCP,60,9001  >  35978 [ACK] Seq=4858551 Ack=87427977 Win=65535 Len=0
1,4.455573000000186,10.0.2.15,62.210.85.178,TLSv1.2,4124,Application Data
1,4.455634999999802,62.210.85.178,10.0.2.15,TCP,60,9001  >  35978 [ACK] Seq=4858551 Ack=87429437 Win=65535 Len=0
1,4.45564800000011,62.210.85.178,10.0.2.15,TCP,60,9001  >  35978 [ACK] Seq=4858551 Ack=87430897 Win=65535 Len=0
1,4.4556520000001,62.210.85.178,10.0.2.15,TCP,60,9001  >  35978 [ACK] Seq=4858551 Ack=87432047 Win=65535 Len=0
1,4.455699999999979,10.0.2.15,62.210.85.178,TLSv1.2,4124,Application Data
1,4.4557420000001,62.210.85.178,10.0.2.15,TCP,60,9001  >  35978 [ACK] Seq=4858551 Ack=87433507 Win=65535 Len=0
1,4.455750999999964,62.210.85.178,10.0.2.15,TCP,60,9001  >  35978 [ACK] Seq=4858551 Ack=87434967 Win=65535 Len=0
1,4.4557559999998375,62.210.85.178,10.0.2.15,TCP,60,9001  >  35978 [ACK] Seq=4858551 Ack=87436117 Win=65535 Len=0
1,4.455793999999969,10.0.2.15,62.210.85.178,TLSv1.2,4124,Application Data
1,4.4558320000001,62.210.85.178,10.0.2.15,TCP,60,9001  >  35978 [ACK] Seq=4858551 Ack=87437577 Win=65535 Len=0
1,4.455840999999964,62.210.85.178,10.0.2.15,TCP,60,9001  >  35978 [ACK] Seq=4858551 Ack=87439037 Win=65535 Len=0
1,4.455844999999954,62.210.85.178,10.0.2.15,TCP,60,9001  >  35978 [ACK] Seq=4858551 Ack=87440187 Win=65535 Len=0
1,4.455890000000181,10.0.2.15,62.210.85.178,TLSv1.2,4124,Application Data
1,4.455927999999858,62.210.85.178,10.0.2.15,TCP,60,9001  >  35978 [ACK] Seq=4858551 Ack=87441647 Win=65535 Len=0
1,4.455935999999838,62.210.85.178,10.0.2.15,TCP,60,9001  >  35978 [ACK] Seq=4858551 Ack=87443107 Win=65535 Len=0
1,4.455939999999828,62.210.85.178,10.0.2.15,TCP,60,9001  >  35978 [ACK] Seq=4858551 Ack=87444257 Win=65535 Len=0
1,4.455974999999853,10.0.2.15,62.210.85.178,TLSv1.2,332,Application Data
1,4.456012000000101,62.210.85.178,10.0.2.15,TCP,60,9001  >  35978 [ACK] Seq=4858551 Ack=87444535 Win=65535 Len=0
1,4.456063999999969,10.0.2.15,62.210.85.178,TLSv1.2,3868,Application Data
1,4.456103999999868,62.210.85.178,10.0.2.15,TCP,60,9001  >  35978 [ACK] Seq=4858551 Ack=87445995 Win=65535 Len=0
1,4.456111999999848,62.210.85.178,10.0.2.15,TCP,60,9001  >  35978 [ACK] Seq=4858551 Ack=87447455 Win=65535 Len=0
1,4.456115999999838,62.210.85.178,10.0.2.15,TCP,60,9001  >  35978 [ACK] Seq=4858551 Ack=87448349 Win=65535 Len=0
1,4.456153000000086,10.0.2.15,62.210.85.178,TLSv1.2,2966,Application Data
1,4.4561939999998685,62.210.85.178,10.0.2.15,TCP,60,9001  >  35978 [ACK] Seq=4858551 Ack=87449809 Win=65535 Len=0
1,4.4562009999999646,62.210.85.178,10.0.2.15,TCP,60,9001  >  35978 [ACK] Seq=4858551 Ack=87451261 Win=65535 Len=0
1,4.5157500000000255,54.93.77.70,10.0.2.15,TLSv1.2,590,Application Data
1,4.536462999999912,54.93.77.70,10.0.2.15,TCP,2950,"9001  >  34692 [PSH, ACK] Seq=87195077 Ack=4852567 Win=65535 Len=2896 [TCP segment of a reassembled PDU]"
1,4.5365780000001905,10.0.2.15,54.93.77.70,TCP,54,34692  >  9001 [ACK] Seq=4852567 Ack=87197973 Win=65535 Len=0
1,4.547856000000138,54.93.77.70,10.0.2.15,TLSv1.2,7294,"Application Data, Application Data"
1,4.547977000000174,10.0.2.15,54.93.77.70,TCP,54,34692  >  9001 [ACK] Seq=4852567 Ack=87205213 Win=65535 Len=0
1,4.556270999999924,54.93.77.70,10.0.2.15,TLSv1.2,1292,Application Data
1,4.566436000000067,54.93.77.70,10.0.2.15,TCP,2950,"9001  >  34692 [PSH, ACK] Seq=87206451 Ack=4852567 Win=65535 Len=2896 [TCP segment of a reassembled PDU]"
1,4.566507999999885,10.0.2.15,54.93.77.70,TCP,54,34692  >  9001 [ACK] Seq=4852567 Ack=87209347 Win=65535 Len=0
1,4.580184999999801,54.93.77.70,10.0.2.15,TLSv1.2,14254,"Application Data, Application Data, Application Data, Application Data"
1,4.580254999999852,10.0.2.15,54.93.77.70,TCP,54,34692  >  9001 [ACK] Seq=4852567 Ack=87223547 Win=65535 Len=0
1,4.580300999999963,54.93.77.70,10.0.2.15,TCP,1782,"9001  >  34692 [PSH, ACK] Seq=87223547 Ack=4852567 Win=65535 Len=1728 [TCP segment of a reassembled PDU]"
1,4.580410999999913,10.0.2.15,54.93.77.70,TCP,54,34692  >  9001 [ACK] Seq=4852567 Ack=87225275 Win=65535 Len=0
1,4.58064800000011,10.0.2.15,54.93.77.70,TLSv1.2,590,Application Data
1,4.580722000000151,54.93.77.70,10.0.2.15,TCP,60,9001  >  34692 [ACK] Seq=87225275 Ack=4853103 Win=65535 Len=0
1,4.582694000000174,54.93.77.70,10.0.2.15,TLSv1.2,872,Application Data
1,4.592011000000184,10.0.2.15,54.93.77.70,TLSv1.2,590,Application Data
1,4.5921189999999115,54.93.77.70,10.0.2.15,TCP,60,9001  >  34692 [ACK] Seq=87226093 Ack=4853639 Win=65535 Len=0
1,4.6363970000002155,54.93.77.70,10.0.2.15,TCP,2950,"9001  >  34692 [PSH, ACK] Seq=87226093 Ack=4853639 Win=65535 Len=2896 [TCP segment of a reassembled PDU]"
1,4.636504000000059,10.0.2.15,54.93.77.70,TCP,54,34692  >  9001 [ACK] Seq=4853639 Ack=87228989 Win=65535 Len=0
1,4.638460000000123,54.93.77.70,10.0.2.15,TLSv1.2,2950,Application Data [TCP segment of a reassembled PDU]
1,4.638500999999906,10.0.2.15,54.93.77.70,TCP,54,34692  >  9001 [ACK] Seq=4853639 Ack=87231885 Win=65535 Len=0
1,4.639393999999811,54.93.77.70,10.0.2.15,TLSv1.2,2016,Application Data
1,4.639436999999816,10.0.2.15,54.93.77.70,TCP,54,34692  >  9001 [ACK] Seq=4853639 Ack=87233847 Win=65535 Len=0
1,4.659114000000045,54.93.77.70,10.0.2.15,TLSv1.2,3674,Application Data
1,4.659192999999959,10.0.2.15,54.93.77.70,TCP,54,34692  >  9001 [ACK] Seq=4853639 Ack=87237467 Win=65535 Len=0
1,4.668571000000156,54.93.77.70,10.0.2.15,TLSv1.2,5846,Application Data
1,4.668649000000187,10.0.2.15,54.93.77.70,TCP,54,34692  >  9001 [ACK] Seq=4853639 Ack=87243259 Win=65535 Len=0
1,4.669956000000184,54.93.77.70,10.0.2.15,TLSv1.2,10190,"Application Data, Application Data"
1,4.670020999999906,10.0.2.15,54.93.77.70,TCP,54,34692  >  9001 [ACK] Seq=4853639 Ack=87253395 Win=65535 Len=0
1,4.670326999999816,10.0.2.15,54.93.77.70,TLSv1.2,590,Application Data
1,4.670400999999856,54.93.77.70,10.0.2.15,TCP,60,9001  >  34692 [ACK] Seq=87253395 Ack=4854175 Win=65535 Len=0
1,4.678035999999793,54.93.77.70,10.0.2.15,TLSv1.2,12572,"Application Data, Application Data, Application Data, Application Data, Application Data"
1,4.678109999999833,10.0.2.15,54.93.77.70,TCP,54,34692  >  9001 [ACK] Seq=4854175 Ack=87265913 Win=65535 Len=0
1,4.698598999999831,54.93.77.70,10.0.2.15,TLSv1.2,3674,Application Data
1,4.698617000000013,62.210.85.178,10.0.2.15,TLSv1.2,590,Application Data
1,4.698661999999786,10.0.2.15,54.93.77.70,TCP,54,34692  >  9001 [ACK] Seq=4854175 Ack=87269533 Win=65535 Len=0
1,4.698880999999801,10.0.2.15,54.93.77.70,TLSv1.2,590,Application Data
1,4.699001999999837,54.93.77.70,10.0.2.15,TCP,60,9001  >  34692 [ACK] Seq=87269533 Ack=4854711 Win=65535 Len=0
1,4.728962000000138,62.210.85.178,10.0.2.15,TLSv1.2,590,Application Data
1,4.728987999999845,54.93.77.70,10.0.2.15,TLSv1.2,3674,Application Data
1,4.729036000000178,10.0.2.15,62.210.85.178,TCP,54,35978  >  9001 [ACK] Seq=87451261 Ack=4859623 Win=65535 Len=0
1,4.729201000000103,10.0.2.15,54.93.77.70,TCP,54,34692  >  9001 [ACK] Seq=4854711 Ack=87273153 Win=65535 Len=0
1,4.731898000000001,10.0.2.15,54.93.77.70,TLSv1.2,590,Application Data
1,4.732386000000133,54.93.77.70,10.0.2.15,TCP,60,9001  >  34692 [ACK] Seq=87273153 Ack=4855247 Win=65535 Len=0
1,4.745073999999931,10.0.2.15,54.93.77.70,TLSv1.2,590,Application Data
1,4.745300000000043,54.93.77.70,10.0.2.15,TCP,60,9001  >  34692 [ACK] Seq=87273153 Ack=4855783 Win=65535 Len=0
1,4.780352000000221,62.210.85.178,10.0.2.15,TLSv1.2,590,Application Data
1,4.822994000000108,10.0.2.15,62.210.85.178,TCP,54,35978  >  9001 [ACK] Seq=87451261 Ack=4860159 Win=65535 Len=0
1,4.831235000000106,62.210.85.178,10.0.2.15,TLSv1.2,590,Application Data
1,4.831295999999838,10.0.2.15,62.210.85.178,TCP,54,35978  >  9001 [ACK] Seq=87451261 Ack=4860695 Win=65535 Len=0
1,4.924215999999888,62.210.85.178,10.0.2.15,TLSv1.2,1104,Application Data
1,4.9243139999998675,10.0.2.15,62.210.85.178,TCP,54,35978  >  9001 [ACK] Seq=87451261 Ack=4861745 Win=65535 Len=0
1,4.924945000000207,10.0.2.15,62.210.85.178,TLSv1.2,590,Application Data
1,4.925095000000056,62.210.85.178,10.0.2.15,TCP,60,9001  >  35978 [ACK] Seq=4861745 Ack=87451797 Win=65535 Len=0
1,5.12188900000001,54.93.77.70,10.0.2.15,TLSv1.2,590,Application Data
1,5.122436999999991,10.0.2.15,54.93.77.70,TLSv1.2,590,Application Data
1,5.1225939999999355,54.93.77.70,10.0.2.15,TCP,60,9001  >  34692 [ACK] Seq=87273689 Ack=4856319 Win=65535 Len=0
1,5.254328999999871,62.210.85.178,10.0.2.15,TLSv1.2,590,Application Data
1,5.260851999999886,10.0.2.15,62.210.85.178,TLSv1.2,590,Application Data
1,5.261061000000154,62.210.85.178,10.0.2.15,TCP,60,9001  >  35978 [ACK] Seq=4862281 Ack=87452333 Win=65535 Len=0
1,5.275705000000016,10.0.2.15,62.210.85.178,TLSv1.2,4124,Application Data
1,5.275814999999966,10.0.2.15,62.210.85.178,TCP,2974,35978  >  9001 [ACK] Seq=87456403 Ack=4862281 Win=65535 Len=2920 [TCP segment of a reassembled PDU]
1,5.275869000000057,62.210.85.178,10.0.2.15,TCP,60,9001  >  35978 [ACK] Seq=4862281 Ack=87453793 Win=65535 Len=0
1,5.2758859999999,62.210.85.178,10.0.2.15,TCP,60,9001  >  35978 [ACK] Seq=4862281 Ack=87455253 Win=65535 Len=0
1,5.275891000000229,62.210.85.178,10.0.2.15,TCP,60,9001  >  35978 [ACK] Seq=4862281 Ack=87456403 Win=65535 Len=0
1,5.27589399999988,62.210.85.178,10.0.2.15,TCP,60,9001  >  35978 [ACK] Seq=4862281 Ack=87457863 Win=65535 Len=0
1,5.2758960000001025,62.210.85.178,10.0.2.15,TCP,60,9001  >  35978 [ACK] Seq=4862281 Ack=87459323 Win=65535 Len=0
1,5.275932000000012,10.0.2.15,62.210.85.178,TLSv1.2,1204,Application Data
1,5.275971000000027,62.210.85.178,10.0.2.15,TCP,60,9001  >  35978 [ACK] Seq=4862281 Ack=87460473 Win=65535 Len=0
1,5.2760159999997995,10.0.2.15,62.210.85.178,TLSv1.2,4124,Application Data
1,5.276054999999815,62.210.85.178,10.0.2.15,TCP,60,9001  >  35978 [ACK] Seq=4862281 Ack=87461933 Win=65535 Len=0
1,5.276062999999795,62.210.85.178,10.0.2.15,TCP,60,9001  >  35978 [ACK] Seq=4862281 Ack=87463393 Win=65535 Len=0
1,5.276068000000123,62.210.85.178,10.0.2.15,TCP,60,9001  >  35978 [ACK] Seq=4862281 Ack=87464543 Win=65535 Len=0
1,5.276107000000138,10.0.2.15,62.210.85.178,TLSv1.2,4124,Application Data
1,5.276146000000153,62.210.85.178,10.0.2.15,TCP,60,9001  >  35978 [ACK] Seq=4862281 Ack=87466003 Win=65535 Len=0
1,5.276154000000133,62.210.85.178,10.0.2.15,TCP,60,9001  >  35978 [ACK] Seq=4862281 Ack=87467463 Win=65535 Len=0
1,5.276198000000022,62.210.85.178,10.0.2.15,TCP,60,9001  >  35978 [ACK] Seq=4862281 Ack=87468613 Win=65535 Len=0
1,5.276232000000164,10.0.2.15,62.210.85.178,TLSv1.2,332,Application Data
1,5.276268000000073,62.210.85.178,10.0.2.15,TCP,60,9001  >  35978 [ACK] Seq=4862281 Ack=87468891 Win=65535 Len=0
1,5.2763270000000375,10.0.2.15,62.210.85.178,TLSv1.2,3868,Application Data
1,5.27636799999982,62.210.85.178,10.0.2.15,TCP,60,9001  >  35978 [ACK] Seq=4862281 Ack=87470351 Win=65535 Len=0
1,5.2763759999998,62.210.85.178,10.0.2.15,TCP,60,9001  >  35978 [ACK] Seq=4862281 Ack=87471811 Win=65535 Len=0
1,5.276378999999906,62.210.85.178,10.0.2.15,TCP,60,9001  >  35978 [ACK] Seq=4862281 Ack=87472705 Win=65535 Len=0
1,5.2764179999999214,10.0.2.15,62.210.85.178,TLSv1.2,4124,Application Data
1,5.276456000000053,62.210.85.178,10.0.2.15,TCP,60,9001  >  35978 [ACK] Seq=4862281 Ack=87474165 Win=65535 Len=0
1,5.276464000000033,62.210.85.178,10.0.2.15,TCP,60,9001  >  35978 [ACK] Seq=4862281 Ack=87475625 Win=65535 Len=0
1,5.276468000000023,62.210.85.178,10.0.2.15,TCP,60,9001  >  35978 [ACK] Seq=4862281 Ack=87476775 Win=65535 Len=0
1,5.276503999999932,10.0.2.15,62.210.85.178,TLSv1.2,3030,Application Data
1,5.276542999999947,62.210.85.178,10.0.2.15,TCP,60,9001  >  35978 [ACK] Seq=4862281 Ack=87478235 Win=65535 Len=0
1,5.276550999999927,62.210.85.178,10.0.2.15,TCP,60,9001  >  35978 [ACK] Seq=4862281 Ack=87479695 Win=65535 Len=0
1,5.276554000000033,62.210.85.178,10.0.2.15,TCP,60,9001  >  35978 [ACK] Seq=4862281 Ack=87479751 Win=65535 Len=0
1,5.2857349999999315,10.0.2.15,62.210.85.178,TLSv1.2,4124,Application Data
1,5.28579099999979,62.210.85.178,10.0.2.15,TCP,60,9001  >  35978 [ACK] Seq=4862281 Ack=87481211 Win=65535 Len=0
1,5.285801999999876,62.210.85.178,10.0.2.15,TCP,60,9001  >  35978 [ACK] Seq=4862281 Ack=87482671 Win=65535 Len=0
1,5.285807000000204,62.210.85.178,10.0.2.15,TCP,60,9001  >  35978 [ACK] Seq=4862281 Ack=87483821 Win=65535 Len=0
1,5.285851999999977,10.0.2.15,62.210.85.178,TLSv1.2,4124,Application Data
1,5.285891999999876,62.210.85.178,10.0.2.15,TCP,60,9001  >  35978 [ACK] Seq=4862281 Ack=87485281 Win=65535 Len=0
1,5.2859010000001945,62.210.85.178,10.0.2.15,TCP,60,9001  >  35978 [ACK] Seq=4862281 Ack=87486741 Win=65535 Len=0
1,5.285949000000073,10.0.2.15,62.210.85.178,TCP,1514,35978  >  9001 [ACK] Seq=87487891 Ack=4862281 Win=65535 Len=1460 [TCP segment of a reassembled PDU]
1,5.285992000000078,62.210.85.178,10.0.2.15,TCP,60,9001  >  35978 [ACK] Seq=4862281 Ack=87487891 Win=65535 Len=0
1,5.286000000000058,62.210.85.178,10.0.2.15,TCP,60,9001  >  35978 [ACK] Seq=4862281 Ack=87489351 Win=65535 Len=0
1,5.286028999999871,10.0.2.15,62.210.85.178,TLSv1.2,286,Application Data
1,5.286073000000215,62.210.85.178,10.0.2.15,TCP,60,9001  >  35978 [ACK] Seq=4862281 Ack=87489583 Win=65535 Len=0
1,5.3792669999998,54.93.77.70,10.0.2.15,TLSv1.2,590,Application Data
1,5.395535000000109,54.93.77.70,10.0.2.15,TLSv1.2,11638,"Application Data, Application Data"
1,5.395646999999826,10.0.2.15,54.93.77.70,TCP,54,34692  >  9001 [ACK] Seq=4856319 Ack=87285809 Win=65535 Len=0
1,5.4125709999998435,54.93.77.70,10.0.2.15,TLSv1.2,1502,Application Data [TCP segment of a reassembled PDU]
1,5.4126649999998335,54.93.77.70,10.0.2.15,TLSv1.2,2530,Application Data
1,5.4127229999999145,10.0.2.15,54.93.77.70,TCP,54,34692  >  9001 [ACK] Seq=4856319 Ack=87287257 Win=65535 Len=0
1,5.412839000000076,10.0.2.15,54.93.77.70,TCP,54,34692  >  9001 [ACK] Seq=4856319 Ack=87289733 Win=65535 Len=0
1,5.430370000000039,54.93.77.70,10.0.2.15,TLSv1.2,7294,Application Data
1,5.4304879999999685,10.0.2.15,54.93.77.70,TCP,54,34692  >  9001 [ACK] Seq=4856319 Ack=87296973 Win=65535 Len=0
1,5.431239000000005,54.93.77.70,10.0.2.15,TLSv1.2,5846,"Application Data, Application Data"
1,5.431332000000111,10.0.2.15,54.93.77.70,TCP,54,34692  >  9001 [ACK] Seq=4856319 Ack=87302765 Win=65535 Len=0
1,5.431672000000162,10.0.2.15,54.93.77.70,TLSv1.2,590,Application Data
1,5.431752999999844,54.93.77.70,10.0.2.15,TCP,60,9001  >  34692 [ACK] Seq=87302765 Ack=4856855 Win=65535 Len=0
1,5.4359840000001896,54.93.77.70,10.0.2.15,TCP,2950,"9001  >  34692 [PSH, ACK] Seq=87302765 Ack=4856855 Win=65535 Len=2896 [TCP segment of a reassembled PDU]"
1,5.436079000000063,10.0.2.15,54.93.77.70,TCP,54,34692  >  9001 [ACK] Seq=4856855 Ack=87305661 Win=65535 Len=0
1,5.437821999999869,54.93.77.70,10.0.2.15,TLSv1.2,684,"Application Data, Application Data"
1,5.456084999999803,54.93.77.70,10.0.2.15,TLSv1.2,4398,Application Data
1,5.456216999999924,10.0.2.15,54.93.77.70,TCP,54,34692  >  9001 [ACK] Seq=4856855 Ack=87310635 Win=65535 Len=0
1,5.473429000000124,54.93.77.70,10.0.2.15,TLSv1.2,916,"Application Data, Application Data"
1,5.475836999999956,10.0.2.15,54.93.77.70,TLSv1.2,590,Application Data
1,5.476016999999956,54.93.77.70,10.0.2.15,TCP,60,9001  >  34692 [ACK] Seq=87311497 Ack=4857391 Win=65535 Len=0
1,5.5860969999998815,62.210.85.178,10.0.2.15,TLSv1.2,590,Application Data
1,5.627015999999912,10.0.2.15,62.210.85.178,TCP,54,35978  >  9001 [ACK] Seq=87489583 Ack=4862817 Win=65535 Len=0
1,5.646733999999924,62.210.85.178,10.0.2.15,TLSv1.2,590,Application Data
1,5.6468009999998685,10.0.2.15,62.210.85.178,TCP,54,35978  >  9001 [ACK] Seq=87489583 Ack=4863353 Win=65535 Len=0
1,5.6472969999999805,10.0.2.15,62.210.85.178,TLSv1.2,590,Application Data
1,5.64751299999989,62.210.85.178,10.0.2.15,TCP,60,9001  >  35978 [ACK] Seq=4863353 Ack=87490119 Win=65535 Len=0
1,5.834769000000051,54.93.77.70,10.0.2.15,TLSv1.2,590,Application Data
1,5.835285999999996,10.0.2.15,54.93.77.70,TLSv1.2,590,Application Data
1,5.835431999999855,54.93.77.70,10.0.2.15,TCP,60,9001  >  34692 [ACK] Seq=87312033 Ack=4857927 Win=65535 Len=0
1,6.040031999999883,62.210.85.178,10.0.2.15,TLSv1.2,590,Application Data
1,6.043051000000105,10.0.2.15,62.210.85.178,TLSv1.2,590,Application Data
1,6.043201999999837,62.210.85.178,10.0.2.15,TCP,60,9001  >  35978 [ACK] Seq=4863889 Ack=87490655 Win=65535 Len=0
1,6.056026000000202,10.0.2.15,62.210.85.178,TLSv1.2,2132,Application Data
1,6.056160999999975,62.210.85.178,10.0.2.15,TCP,60,9001  >  35978 [ACK] Seq=4863889 Ack=87492115 Win=65535 Len=0
1,6.056177999999818,62.210.85.178,10.0.2.15,TCP,60,9001  >  35978 [ACK] Seq=4863889 Ack=87492733 Win=65535 Len=0
1,6.151973999999882,54.93.77.70,10.0.2.15,TLSv1.2,590,Application Data
1,6.192426000000069,54.93.77.70,10.0.2.15,TCP,1502,"9001  >  34692 [PSH, ACK] Seq=87312569 Ack=4857927 Win=65535 Len=1448 [TCP segment of a reassembled PDU]"
1,6.192486999999801,10.0.2.15,54.93.77.70,TCP,54,34692  >  9001 [ACK] Seq=4857927 Ack=87314017 Win=65535 Len=0
1,6.2109449999998105,54.93.77.70,10.0.2.15,TLSv1.2,684,Application Data
