No.,Time,Source,Destination,Protocol,Length,Info
1,0.14088900000024296,10.0.2.15,54.93.77.70,TLSv1.2,590,Application Data
1,0.14107100000001083,54.93.77.70,10.0.2.15,TCP,60,9001  >  34692 [ACK] Seq=90374473 Ack=5040535 Win=65535 Len=0
1,0.5836990000002515,62.210.85.178,10.0.2.15,TLSv1.2,590,Application Data
1,0.5840400000001864,10.0.2.15,62.210.85.178,TLSv1.2,590,Application Data
1,0.5841720000003079,62.210.85.178,10.0.2.15,TCP,60,9001  >  35978 [ACK] Seq=5045705 Ack=90552567 Win=65535 Len=0
1,1.1977740000002086,54.93.77.70,10.0.2.15,TLSv1.2,590,Application Data
1,1.1982710000002044,10.0.2.15,54.93.77.70,TLSv1.2,1618,Application Data
1,1.1983890000001338,54.93.77.70,10.0.2.15,TCP,60,9001  >  34692 [ACK] Seq=90375009 Ack=5042099 Win=65535 Len=0
1,1.4037029999999504,62.210.85.178,10.0.2.15,TLSv1.2,1618,Application Data
1,1.4038300000001982,10.0.2.15,62.210.85.178,TCP,54,35978  >  9001 [ACK] Seq=90552567 Ack=5047269 Win=65535 Len=0
1,1.4177020000001903,10.0.2.15,62.210.85.178,TLSv1.2,590,Application Data
1,1.4178930000002765,62.210.85.178,10.0.2.15,TCP,60,9001  >  35978 [ACK] Seq=5047269 Ack=90553103 Win=65535 Len=0
1,1.4296180000001186,10.0.2.15,62.210.85.178,TLSv1.2,1618,Application Data
1,1.4297609999998713,62.210.85.178,10.0.2.15,TCP,60,9001  >  35978 [ACK] Seq=5047269 Ack=90554563 Win=65535 Len=0
1,1.429779999999937,62.210.85.178,10.0.2.15,TCP,60,9001  >  35978 [ACK] Seq=5047269 Ack=90554667 Win=65535 Len=0
1,1.6099309999999605,54.93.77.70,10.0.2.15,TLSv1.2,590,Application Data
1,1.6314250000000357,54.93.77.70,10.0.2.15,TCP,1502,"9001  >  34692 [PSH, ACK] Seq=90375545 Ack=5042099 Win=65535 Len=1448 [TCP segment of a reassembled PDU]"
1,1.6315770000001066,10.0.2.15,54.93.77.70,TCP,54,34692  >  9001 [ACK] Seq=5042099 Ack=90376993 Win=65535 Len=0
1,1.63325900000018,54.93.77.70,10.0.2.15,TLSv1.2,170,Application Data
1,1.6372340000002623,10.0.2.15,54.93.77.70,TLSv1.2,590,Application Data
1,1.637431000000106,54.93.77.70,10.0.2.15,TCP,60,9001  >  34692 [ACK] Seq=90377109 Ack=5042635 Win=65535 Len=0
1,1.8133579999998801,62.210.85.178,10.0.2.15,TLSv1.2,590,Application Data
1,1.8136500000000524,10.0.2.15,62.210.85.178,TLSv1.2,590,Application Data
1,1.8140550000002804,62.210.85.178,10.0.2.15,TCP,60,9001  >  35978 [ACK] Seq=5047805 Ack=90555203 Win=65535 Len=0
1,2.0170280000002094,54.93.77.70,10.0.2.15,TLSv1.2,590,Application Data
1,2.0174070000002757,10.0.2.15,54.93.77.70,TLSv1.2,590,Application Data
1,2.017522999999983,54.93.77.70,10.0.2.15,TCP,60,9001  >  34692 [ACK] Seq=90377645 Ack=5043171 Win=65535 Len=0
1,2.1340170000003127,62.210.85.178,10.0.2.15,TLSv1.2,590,Application Data
1,2.1412949999999,10.0.2.15,62.210.85.178,TLSv1.2,590,Application Data
1,2.1414740000000165,62.210.85.178,10.0.2.15,TCP,60,9001  >  35978 [ACK] Seq=5048341 Ack=90555739 Win=65535 Len=0
1,2.153823999999986,10.0.2.15,62.210.85.178,TLSv1.2,4124,Application Data
1,2.1539379999999255,10.0.2.15,62.210.85.178,TCP,2974,35978  >  9001 [ACK] Seq=90559809 Ack=5048341 Win=65535 Len=2920 [TCP segment of a reassembled PDU]
1,2.153986000000259,62.210.85.178,10.0.2.15,TCP,60,9001  >  35978 [ACK] Seq=5048341 Ack=90557199 Win=65535 Len=0
1,2.15400099999988,62.210.85.178,10.0.2.15,TCP,60,9001  >  35978 [ACK] Seq=5048341 Ack=90558659 Win=65535 Len=0
1,2.1540060000002086,62.210.85.178,10.0.2.15,TCP,60,9001  >  35978 [ACK] Seq=5048341 Ack=90559809 Win=65535 Len=0
1,2.154007999999976,62.210.85.178,10.0.2.15,TCP,60,9001  >  35978 [ACK] Seq=5048341 Ack=90561269 Win=65535 Len=0
1,2.1540110000000823,62.210.85.178,10.0.2.15,TCP,60,9001  >  35978 [ACK] Seq=5048341 Ack=90562729 Win=65535 Len=0
1,2.1540460000001076,10.0.2.15,62.210.85.178,TLSv1.2,1204,Application Data
1,2.154085000000123,62.210.85.178,10.0.2.15,TCP,60,9001  >  35978 [ACK] Seq=5048341 Ack=90563879 Win=65535 Len=0
1,2.154131000000234,10.0.2.15,62.210.85.178,TLSv1.2,4124,Application Data
1,2.1541660000002594,62.210.85.178,10.0.2.15,TCP,60,9001  >  35978 [ACK] Seq=5048341 Ack=90565339 Win=65535 Len=0
1,2.1541729999999006,62.210.85.178,10.0.2.15,TCP,60,9001  >  35978 [ACK] Seq=5048341 Ack=90566799 Win=65535 Len=0
1,2.1541769999998905,62.210.85.178,10.0.2.15,TCP,60,9001  >  35978 [ACK] Seq=5048341 Ack=90567949 Win=65535 Len=0
1,2.1542159999999058,10.0.2.15,62.210.85.178,TLSv1.2,4124,Application Data
1,2.1542500000000473,62.210.85.178,10.0.2.15,TCP,60,9001  >  35978 [ACK] Seq=5048341 Ack=90569409 Win=65535 Len=0
1,2.154258999999911,62.210.85.178,10.0.2.15,TCP,60,9001  >  35978 [ACK] Seq=5048341 Ack=90570869 Win=65535 Len=0
1,2.1543030000002545,62.210.85.178,10.0.2.15,TCP,60,9001  >  35978 [ACK] Seq=5048341 Ack=90572019 Win=65535 Len=0
1,2.15433800000028,10.0.2.15,62.210.85.178,TLSv1.2,332,Application Data
1,2.1543719999999666,62.210.85.178,10.0.2.15,TCP,60,9001  >  35978 [ACK] Seq=5048341 Ack=90572297 Win=65535 Len=0
1,2.1544260000000577,10.0.2.15,62.210.85.178,TLSv1.2,3868,Application Data
1,2.154461999999967,62.210.85.178,10.0.2.15,TCP,60,9001  >  35978 [ACK] Seq=5048341 Ack=90573757 Win=65535 Len=0
1,2.1544699999999466,62.210.85.178,10.0.2.15,TCP,60,9001  >  35978 [ACK] Seq=5048341 Ack=90575217 Win=65535 Len=0
1,2.1544739999999365,62.210.85.178,10.0.2.15,TCP,60,9001  >  35978 [ACK] Seq=5048341 Ack=90576111 Win=65535 Len=0
1,2.154511000000184,10.0.2.15,62.210.85.178,TLSv1.2,4124,Application Data
1,2.1545470000000932,62.210.85.178,10.0.2.15,TCP,60,9001  >  35978 [ACK] Seq=5048341 Ack=90577571 Win=65535 Len=0
1,2.1545530000003055,62.210.85.178,10.0.2.15,TCP,60,9001  >  35978 [ACK] Seq=5048341 Ack=90579031 Win=65535 Len=0
1,2.154566000000159,62.210.85.178,10.0.2.15,TCP,60,9001  >  35978 [ACK] Seq=5048341 Ack=90580181 Win=65535 Len=0
1,2.154602000000068,10.0.2.15,62.210.85.178,TLSv1.2,3030,Application Data
1,2.154637999999977,62.210.85.178,10.0.2.15,TCP,60,9001  >  35978 [ACK] Seq=5048341 Ack=90581641 Win=65535 Len=0
1,2.1546440000001894,62.210.85.178,10.0.2.15,TCP,60,9001  >  35978 [ACK] Seq=5048341 Ack=90583101 Win=65535 Len=0
1,2.1546480000001793,62.210.85.178,10.0.2.15,TCP,60,9001  >  35978 [ACK] Seq=5048341 Ack=90583157 Win=65535 Len=0
1,2.163872999999967,10.0.2.15,62.210.85.178,TLSv1.2,4124,Application Data
1,2.163958999999977,62.210.85.178,10.0.2.15,TCP,60,9001  >  35978 [ACK] Seq=5048341 Ack=90584617 Win=65535 Len=0
1,2.163970000000063,62.210.85.178,10.0.2.15,TCP,60,9001  >  35978 [ACK] Seq=5048341 Ack=90586077 Win=65535 Len=0
1,2.163974000000053,62.210.85.178,10.0.2.15,TCP,60,9001  >  35978 [ACK] Seq=5048341 Ack=90587227 Win=65535 Len=0
1,2.1640219999999317,10.0.2.15,62.210.85.178,TLSv1.2,4124,Application Data
1,2.1640849999998863,62.210.85.178,10.0.2.15,TCP,60,9001  >  35978 [ACK] Seq=5048341 Ack=90588687 Win=65535 Len=0
1,2.164092999999866,62.210.85.178,10.0.2.15,TCP,60,9001  >  35978 [ACK] Seq=5048341 Ack=90590147 Win=65535 Len=0
1,2.1640959999999723,62.210.85.178,10.0.2.15,TCP,60,9001  >  35978 [ACK] Seq=5048341 Ack=90591297 Win=65535 Len=0
1,2.1641340000001037,10.0.2.15,62.210.85.178,TLSv1.2,4124,Application Data
1,2.164213000000018,62.210.85.178,10.0.2.15,TCP,60,9001  >  35978 [ACK] Seq=5048341 Ack=90592757 Win=65535 Len=0
1,2.1642219999998815,62.210.85.178,10.0.2.15,TCP,60,9001  >  35978 [ACK] Seq=5048341 Ack=90594217 Win=65535 Len=0
1,2.1642249999999876,62.210.85.178,10.0.2.15,TCP,60,9001  >  35978 [ACK] Seq=5048341 Ack=90595367 Win=65535 Len=0
1,2.1642580000002454,10.0.2.15,62.210.85.178,TLSv1.2,4124,Application Data
1,2.1642930000002707,62.210.85.178,10.0.2.15,TCP,60,9001  >  35978 [ACK] Seq=5048341 Ack=90596827 Win=65535 Len=0
1,2.1643010000002505,62.210.85.178,10.0.2.15,TCP,60,9001  >  35978 [ACK] Seq=5048341 Ack=90598287 Win=65535 Len=0
1,2.1643050000002404,62.210.85.178,10.0.2.15,TCP,60,9001  >  35978 [ACK] Seq=5048341 Ack=90599437 Win=65535 Len=0
1,2.1643410000001495,10.0.2.15,62.210.85.178,TLSv1.2,332,Application Data
1,2.164376000000175,62.210.85.178,10.0.2.15,TCP,60,9001  >  35978 [ACK] Seq=5048341 Ack=90599715 Win=65535 Len=0
1,2.1644280000000435,10.0.2.15,62.210.85.178,TLSv1.2,3868,Application Data
1,2.164470000000165,62.210.85.178,10.0.2.15,TCP,60,9001  >  35978 [ACK] Seq=5048341 Ack=90601175 Win=65535 Len=0
1,2.164477000000261,62.210.85.178,10.0.2.15,TCP,60,9001  >  35978 [ACK] Seq=5048341 Ack=90602635 Win=65535 Len=0
1,2.1644799999999123,62.210.85.178,10.0.2.15,TCP,60,9001  >  35978 [ACK] Seq=5048341 Ack=90603529 Win=65535 Len=0
1,2.1645180000000437,10.0.2.15,62.210.85.178,TLSv1.2,4124,Application Data
1,2.164553000000069,62.210.85.178,10.0.2.15,TCP,60,9001  >  35978 [ACK] Seq=5048341 Ack=90604989 Win=65535 Len=0
1,2.164560000000165,62.210.85.178,10.0.2.15,TCP,60,9001  >  35978 [ACK] Seq=5048341 Ack=90606449 Win=65535 Len=0
1,2.164563000000271,62.210.85.178,10.0.2.15,TCP,60,9001  >  35978 [ACK] Seq=5048341 Ack=90607599 Win=65535 Len=0
1,2.1645980000002965,10.0.2.15,62.210.85.178,TLSv1.2,3030,Application Data
1,2.164632999999867,62.210.85.178,10.0.2.15,TCP,60,9001  >  35978 [ACK] Seq=5048341 Ack=90609059 Win=65535 Len=0
1,2.164639999999963,62.210.85.178,10.0.2.15,TCP,60,9001  >  35978 [ACK] Seq=5048341 Ack=90610519 Win=65535 Len=0
1,2.164643000000069,62.210.85.178,10.0.2.15,TCP,60,9001  >  35978 [ACK] Seq=5048341 Ack=90610575 Win=65535 Len=0
1,2.1782250000001113,10.0.2.15,62.210.85.178,TLSv1.2,4124,Application Data
1,2.178327000000081,10.0.2.15,62.210.85.178,TCP,2974,35978  >  9001 [ACK] Seq=90614645 Ack=5048341 Win=65535 Len=2920 [TCP segment of a reassembled PDU]
1,2.1783680000003187,62.210.85.178,10.0.2.15,TCP,60,9001  >  35978 [ACK] Seq=5048341 Ack=90612035 Win=65535 Len=0
1,2.1783770000001823,62.210.85.178,10.0.2.15,TCP,60,9001  >  35978 [ACK] Seq=5048341 Ack=90613495 Win=65535 Len=0
1,2.178382000000056,62.210.85.178,10.0.2.15,TCP,60,9001  >  35978 [ACK] Seq=5048341 Ack=90614645 Win=65535 Len=0
1,2.178386000000046,62.210.85.178,10.0.2.15,TCP,60,9001  >  35978 [ACK] Seq=5048341 Ack=90616105 Win=65535 Len=0
1,2.178390000000036,62.210.85.178,10.0.2.15,TCP,60,9001  >  35978 [ACK] Seq=5048341 Ack=90617565 Win=65535 Len=0
1,2.178433000000041,10.0.2.15,62.210.85.178,TLSv1.2,1204,Application Data
1,2.1785070000000815,62.210.85.178,10.0.2.15,TCP,60,9001  >  35978 [ACK] Seq=5048341 Ack=90618715 Win=65535 Len=0
1,2.1785469999999805,10.0.2.15,62.210.85.178,TLSv1.2,4124,Application Data
1,2.178595000000314,62.210.85.178,10.0.2.15,TCP,60,9001  >  35978 [ACK] Seq=5048341 Ack=90620175 Win=65535 Len=0
1,2.1786019999999553,62.210.85.178,10.0.2.15,TCP,60,9001  >  35978 [ACK] Seq=5048341 Ack=90621635 Win=65535 Len=0
1,2.1786070000002837,62.210.85.178,10.0.2.15,TCP,60,9001  >  35978 [ACK] Seq=5048341 Ack=90622785 Win=65535 Len=0
1,2.1786540000002788,10.0.2.15,62.210.85.178,TLSv1.2,4124,Application Data
1,2.1786959999999453,62.210.85.178,10.0.2.15,TCP,60,9001  >  35978 [ACK] Seq=5048341 Ack=90624245 Win=65535 Len=0
1,2.1787020000001576,62.210.85.178,10.0.2.15,TCP,60,9001  >  35978 [ACK] Seq=5048341 Ack=90625705 Win=65535 Len=0
1,2.1787070000000313,62.210.85.178,10.0.2.15,TCP,60,9001  >  35978 [ACK] Seq=5048341 Ack=90626855 Win=65535 Len=0
1,2.178748000000269,10.0.2.15,62.210.85.178,TLSv1.2,332,Application Data
1,2.178788000000168,62.210.85.178,10.0.2.15,TCP,60,9001  >  35978 [ACK] Seq=5048341 Ack=90627133 Win=65535 Len=0
1,2.2539080000001377,54.93.77.70,10.0.2.15,TLSv1.2,590,Application Data
1,2.297598999999991,10.0.2.15,54.93.77.70,TCP,54,34692  >  9001 [ACK] Seq=5043171 Ack=90378181 Win=65535 Len=0
1,2.4281639999999243,54.93.77.70,10.0.2.15,TCP,2950,"9001  >  34692 [PSH, ACK] Seq=90378181 Ack=5043171 Win=65535 Len=2896 [TCP segment of a reassembled PDU]"
1,2.4282579999999143,10.0.2.15,54.93.77.70,TCP,54,34692  >  9001 [ACK] Seq=5043171 Ack=90381077 Win=65535 Len=0
1,2.429997000000185,54.93.77.70,10.0.2.15,TLSv1.2,778,Application Data
1,2.43004000000019,10.0.2.15,54.93.77.70,TCP,54,34692  >  9001 [ACK] Seq=5043171 Ack=90381801 Win=65535 Len=0
1,2.4317630000000463,54.93.77.70,10.0.2.15,TLSv1.2,7294,"Application Data, Application Data"
1,2.4317949999999655,54.93.77.70,10.0.2.15,TCP,2950,"9001  >  34692 [PSH, ACK] Seq=90389041 Ack=5043171 Win=65535 Len=2896 [TCP segment of a reassembled PDU]"
1,2.4318459999999504,10.0.2.15,54.93.77.70,TCP,54,34692  >  9001 [ACK] Seq=5043171 Ack=90389041 Win=65535 Len=0
1,2.431895000000168,10.0.2.15,54.93.77.70,TCP,54,34692  >  9001 [ACK] Seq=5043171 Ack=90391937 Win=65535 Len=0
1,2.4461169999999584,54.93.77.70,10.0.2.15,TLSv1.2,2950,Application Data [TCP segment of a reassembled PDU]
1,2.446208000000297,10.0.2.15,54.93.77.70,TCP,54,34692  >  9001 [ACK] Seq=5043171 Ack=90394833 Win=65535 Len=0
1,2.446546000000126,54.93.77.70,10.0.2.15,TLSv1.2,2950,"Application Data, Application Data"
1,2.446602999999868,10.0.2.15,54.93.77.70,TCP,54,34692  >  9001 [ACK] Seq=5043171 Ack=90397729 Win=65535 Len=0
1,2.447313000000122,54.93.77.70,10.0.2.15,TCP,2950,"9001  >  34692 [PSH, ACK] Seq=90397729 Ack=5043171 Win=65535 Len=2896 [TCP segment of a reassembled PDU]"
1,2.4473550000002433,10.0.2.15,54.93.77.70,TCP,54,34692  >  9001 [ACK] Seq=5043171 Ack=90400625 Win=65535 Len=0
1,2.447954000000209,54.93.77.70,10.0.2.15,TLSv1.2,5586,"Application Data, Application Data, Application Data, Application Data"
1,2.4479959999998755,10.0.2.15,54.93.77.70,TCP,54,34692  >  9001 [ACK] Seq=5043171 Ack=90406157 Win=65535 Len=0
1,2.448272999999972,10.0.2.15,54.93.77.70,TLSv1.2,590,Application Data
1,2.448355999999876,54.93.77.70,10.0.2.15,TCP,60,9001  >  34692 [ACK] Seq=90406157 Ack=5043707 Win=65535 Len=0
1,2.453269999999975,54.93.77.70,10.0.2.15,TLSv1.2,5846,Application Data
1,2.45331699999997,10.0.2.15,54.93.77.70,TCP,54,34692  >  9001 [ACK] Seq=5043707 Ack=90411949 Win=65535 Len=0
1,2.455224000000271,54.93.77.70,10.0.2.15,TLSv1.2,8742,"Application Data, Application Data, Application Data"
1,2.4553100000002814,10.0.2.15,54.93.77.70,TCP,54,34692  >  9001 [ACK] Seq=5043707 Ack=90420637 Win=65535 Len=0
1,2.46196800000007,10.0.2.15,54.93.77.70,TLSv1.2,590,Application Data
1,2.4620789999999033,54.93.77.70,10.0.2.15,TCP,60,9001  >  34692 [ACK] Seq=90420637 Ack=5044243 Win=65535 Len=0
1,2.4657569999999396,54.93.77.70,10.0.2.15,TLSv1.2,3696,"Application Data, Application Data"
1,2.465819999999894,10.0.2.15,54.93.77.70,TCP,54,34692  >  9001 [ACK] Seq=5044243 Ack=90424279 Win=65535 Len=0
1,2.4962869999999384,54.93.77.70,10.0.2.15,TCP,2950,"9001  >  34692 [PSH, ACK] Seq=90424279 Ack=5044243 Win=65535 Len=2896 [TCP segment of a reassembled PDU]"
1,2.4963379999999233,10.0.2.15,54.93.77.70,TCP,54,34692  >  9001 [ACK] Seq=5044243 Ack=90427175 Win=65535 Len=0
1,2.4971810000001824,54.93.77.70,10.0.2.15,TLSv1.2,8194,"Application Data, Application Data"
1,2.497245000000021,10.0.2.15,54.93.77.70,TCP,54,34692  >  9001 [ACK] Seq=5044243 Ack=90435315 Win=65535 Len=0
1,2.4974710000001323,10.0.2.15,54.93.77.70,TLSv1.2,590,Application Data
1,2.4975279999998747,54.93.77.70,10.0.2.15,TCP,60,9001  >  34692 [ACK] Seq=90435315 Ack=5044779 Win=65535 Len=0
1,2.4989370000002964,54.93.77.70,10.0.2.15,TLSv1.2,4398,Application Data [TCP segment of a reassembled PDU]
1,2.498978999999963,10.0.2.15,54.93.77.70,TCP,54,34692  >  9001 [ACK] Seq=5044779 Ack=90439659 Win=65535 Len=0
1,2.513832999999977,54.93.77.70,10.0.2.15,TLSv1.2,696,Application Data
1,2.515272999999979,54.93.77.70,10.0.2.15,TCP,2950,"9001  >  34692 [PSH, ACK] Seq=90440301 Ack=5044779 Win=65535 Len=2896 [TCP segment of a reassembled PDU]"
1,2.515335999999934,10.0.2.15,54.93.77.70,TCP,54,34692  >  9001 [ACK] Seq=5044779 Ack=90443197 Win=65535 Len=0
1,2.531162000000222,54.93.77.70,10.0.2.15,TLSv1.2,264,Application Data
1,2.5665720000001784,54.93.77.70,10.0.2.15,TCP,2950,"9001  >  34692 [PSH, ACK] Seq=90443407 Ack=5044779 Win=65535 Len=2896 [TCP segment of a reassembled PDU]"
1,2.5666519999999764,10.0.2.15,54.93.77.70,TCP,54,34692  >  9001 [ACK] Seq=5044779 Ack=90446303 Win=65535 Len=0
1,2.5799019999999473,54.93.77.70,10.0.2.15,TLSv1.2,2950,Application Data [TCP segment of a reassembled PDU]
1,2.5799740000002203,10.0.2.15,54.93.77.70,TCP,54,34692  >  9001 [ACK] Seq=5044779 Ack=90449199 Win=65535 Len=0
1,2.5831590000002507,54.93.77.70,10.0.2.15,TLSv1.2,474,Application Data
1,2.5857770000002347,10.0.2.15,54.93.77.70,TLSv1.2,590,Application Data
1,2.5859150000001137,54.93.77.70,10.0.2.15,TCP,60,9001  >  34692 [ACK] Seq=90449619 Ack=5045315 Win=65535 Len=0
1,2.605609000000186,62.210.85.178,10.0.2.15,TLSv1.2,1104,Application Data
1,2.6495740000000296,10.0.2.15,62.210.85.178,TCP,54,35978  >  9001 [ACK] Seq=90627133 Ack=5049391 Win=65535 Len=0
1,2.6632950000002893,62.210.85.178,10.0.2.15,TLSv1.2,590,Application Data
1,2.6633569999999054,10.0.2.15,62.210.85.178,TCP,54,35978  >  9001 [ACK] Seq=90627133 Ack=5049927 Win=65535 Len=0
1,2.6944659999999203,62.210.85.178,10.0.2.15,TLSv1.2,590,Application Data
1,2.6945230000001175,10.0.2.15,62.210.85.178,TCP,54,35978  >  9001 [ACK] Seq=90627133 Ack=5050463 Win=65535 Len=0
1,2.6949640000002546,10.0.2.15,62.210.85.178,TLSv1.2,590,Application Data
1,2.695079000000078,62.210.85.178,10.0.2.15,TCP,60,9001  >  35978 [ACK] Seq=5050463 Ack=90627669 Win=65535 Len=0
1,2.789009999999962,54.93.77.70,10.0.2.15,TLSv1.2,590,Application Data
1,2.7894320000000334,10.0.2.15,54.93.77.70,TLSv1.2,590,Application Data
1,2.78960300000017,54.93.77.70,10.0.2.15,TCP,60,9001  >  34692 [ACK] Seq=90450155 Ack=5045851 Win=65535 Len=0
1,2.9433670000003076,62.210.85.178,10.0.2.15,TLSv1.2,590,Application Data
1,2.9464350000002923,10.0.2.15,62.210.85.178,TLSv1.2,590,Application Data
1,2.9466240000001562,62.210.85.178,10.0.2.15,TCP,60,9001  >  35978 [ACK] Seq=5050999 Ack=90628205 Win=65535 Len=0
1,2.9587569999998777,10.0.2.15,62.210.85.178,TLSv1.2,2132,Application Data
1,2.959193000000141,62.210.85.178,10.0.2.15,TCP,60,9001  >  35978 [ACK] Seq=5050999 Ack=90629665 Win=65535 Len=0
1,2.9592219999999543,62.210.85.178,10.0.2.15,TCP,60,9001  >  35978 [ACK] Seq=5050999 Ack=90630283 Win=65535 Len=0
1,3.1436800000001313,54.93.77.70,10.0.2.15,TLSv1.2,2646,Application Data
1,3.143822999999884,10.0.2.15,54.93.77.70,TCP,54,34692  >  9001 [ACK] Seq=5045851 Ack=90452747 Win=65535 Len=0
1,3.146346999999878,10.0.2.15,54.93.77.70,TLSv1.2,590,Application Data
1,3.1465069999999287,54.93.77.70,10.0.2.15,TCP,60,9001  >  34692 [ACK] Seq=90452747 Ack=5046387 Win=65535 Len=0
1,3.3498239999998987,62.210.85.178,10.0.2.15,TLSv1.2,590,Application Data
1,3.3504210000000967,10.0.2.15,62.210.85.178,TLSv1.2,590,Application Data
1,3.3505629999999655,62.210.85.178,10.0.2.15,TCP,60,9001  >  35978 [ACK] Seq=5051535 Ack=90630819 Win=65535 Len=0
1,3.462398000000121,54.93.77.70,10.0.2.15,TLSv1.2,590,Application Data
1,3.4628680000000713,10.0.2.15,54.93.77.70,TLSv1.2,590,Application Data
1,3.4630160000001524,54.93.77.70,10.0.2.15,TCP,60,9001  >  34692 [ACK] Seq=90453283 Ack=5046923 Win=65535 Len=0
1,3.9625879999998688,62.210.85.178,10.0.2.15,TLSv1.2,590,Application Data
1,3.970299999999952,10.0.2.15,62.210.85.178,TLSv1.2,590,Application Data
1,3.970487999999932,62.210.85.178,10.0.2.15,TCP,60,9001  >  35978 [ACK] Seq=5052071 Ack=90631355 Win=65535 Len=0
1,3.981959000000188,10.0.2.15,62.210.85.178,TLSv1.2,4124,Application Data
1,3.9820700000000215,10.0.2.15,62.210.85.178,TCP,2974,35978  >  9001 [ACK] Seq=90635425 Ack=5052071 Win=65535 Len=2920 [TCP segment of a reassembled PDU]
1,3.982119000000239,62.210.85.178,10.0.2.15,TCP,60,9001  >  35978 [ACK] Seq=5052071 Ack=90632815 Win=65535 Len=0
1,3.98212999999987,62.210.85.178,10.0.2.15,TCP,60,9001  >  35978 [ACK] Seq=5052071 Ack=90634275 Win=65535 Len=0
1,3.9821350000001985,62.210.85.178,10.0.2.15,TCP,60,9001  >  35978 [ACK] Seq=5052071 Ack=90635425 Win=65535 Len=0
1,3.9821390000001884,62.210.85.178,10.0.2.15,TCP,60,9001  >  35978 [ACK] Seq=5052071 Ack=90636885 Win=65535 Len=0
1,3.9821430000001783,62.210.85.178,10.0.2.15,TCP,60,9001  >  35978 [ACK] Seq=5052071 Ack=90638345 Win=65535 Len=0
1,3.982187000000067,10.0.2.15,62.210.85.178,TLSv1.2,1204,Application Data
1,3.9822549999998955,10.0.2.15,62.210.85.178,TCP,2974,35978  >  9001 [ACK] Seq=90639495 Ack=5052071 Win=65535 Len=2920 [TCP segment of a reassembled PDU]
1,3.9822939999999107,62.210.85.178,10.0.2.15,TCP,60,9001  >  35978 [ACK] Seq=5052071 Ack=90639495 Win=65535 Len=0
1,3.9823010000000068,62.210.85.178,10.0.2.15,TCP,60,9001  >  35978 [ACK] Seq=5052071 Ack=90640955 Win=65535 Len=0
1,3.9823059999998804,62.210.85.178,10.0.2.15,TCP,60,9001  >  35978 [ACK] Seq=5052071 Ack=90642415 Win=65535 Len=0
1,3.9823409999999058,10.0.2.15,62.210.85.178,TLSv1.2,1204,Application Data
1,3.9824060000000827,10.0.2.15,62.210.85.178,TCP,2974,35978  >  9001 [ACK] Seq=90643565 Ack=5052071 Win=65535 Len=2920 [TCP segment of a reassembled PDU]
1,3.9824429999998756,62.210.85.178,10.0.2.15,TCP,60,9001  >  35978 [ACK] Seq=5052071 Ack=90643565 Win=65535 Len=0
1,3.982449000000088,62.210.85.178,10.0.2.15,TCP,60,9001  >  35978 [ACK] Seq=5052071 Ack=90645025 Win=65535 Len=0
1,3.9824539999999615,62.210.85.178,10.0.2.15,TCP,60,9001  >  35978 [ACK] Seq=5052071 Ack=90646485 Win=65535 Len=0
1,3.982484999999997,10.0.2.15,62.210.85.178,TLSv1.2,1204,Application Data
1,3.98254900000029,62.210.85.178,10.0.2.15,TCP,60,9001  >  35978 [ACK] Seq=5052071 Ack=90647635 Win=65535 Len=0
1,3.982594000000063,10.0.2.15,62.210.85.178,TLSv1.2,332,Application Data
1,3.982633999999962,62.210.85.178,10.0.2.15,TCP,60,9001  >  35978 [ACK] Seq=5052071 Ack=90647913 Win=65535 Len=0
1,3.9826920000000428,10.0.2.15,62.210.85.178,TLSv1.2,3868,Application Data
1,3.98273700000027,62.210.85.178,10.0.2.15,TCP,60,9001  >  35978 [ACK] Seq=5052071 Ack=90649373 Win=65535 Len=0
1,3.9827439999999115,62.210.85.178,10.0.2.15,TCP,60,9001  >  35978 [ACK] Seq=5052071 Ack=90650833 Win=65535 Len=0
1,3.9827479999999014,62.210.85.178,10.0.2.15,TCP,60,9001  >  35978 [ACK] Seq=5052071 Ack=90651727 Win=65535 Len=0
1,3.9827949999998964,10.0.2.15,62.210.85.178,TLSv1.2,4124,Application Data
1,3.9828339999999116,62.210.85.178,10.0.2.15,TCP,60,9001  >  35978 [ACK] Seq=5052071 Ack=90653187 Win=65535 Len=0
1,3.9828410000000076,62.210.85.178,10.0.2.15,TCP,60,9001  >  35978 [ACK] Seq=5052071 Ack=90654647 Win=65535 Len=0
1,3.9828459999998813,62.210.85.178,10.0.2.15,TCP,60,9001  >  35978 [ACK] Seq=5052071 Ack=90655797 Win=65535 Len=0
1,3.9828889999998864,10.0.2.15,62.210.85.178,TLSv1.2,3030,Application Data
1,3.98292900000024,62.210.85.178,10.0.2.15,TCP,60,9001  >  35978 [ACK] Seq=5052071 Ack=90657257 Win=65535 Len=0
1,3.9829359999998815,62.210.85.178,10.0.2.15,TCP,60,9001  >  35978 [ACK] Seq=5052071 Ack=90658717 Win=65535 Len=0
1,3.9829399999998714,62.210.85.178,10.0.2.15,TCP,60,9001  >  35978 [ACK] Seq=5052071 Ack=90658773 Win=65535 Len=0
1,3.9921400000002905,10.0.2.15,62.210.85.178,TLSv1.2,4124,Application Data
1,3.9922190000002047,10.0.2.15,62.210.85.178,TCP,2974,35978  >  9001 [ACK] Seq=90662843 Ack=5052071 Win=65535 Len=2920 [TCP segment of a reassembled PDU]
1,3.9922569999998814,62.210.85.178,10.0.2.15,TCP,60,9001  >  35978 [ACK] Seq=5052071 Ack=90660233 Win=65535 Len=0
1,3.992265000000316,62.210.85.178,10.0.2.15,TCP,60,9001  >  35978 [ACK] Seq=5052071 Ack=90661693 Win=65535 Len=0
1,3.992269000000306,62.210.85.178,10.0.2.15,TCP,60,9001  >  35978 [ACK] Seq=5052071 Ack=90662843 Win=65535 Len=0
1,3.9922740000001795,62.210.85.178,10.0.2.15,TCP,60,9001  >  35978 [ACK] Seq=5052071 Ack=90664303 Win=65535 Len=0
1,3.9922780000001694,62.210.85.178,10.0.2.15,TCP,60,9001  >  35978 [ACK] Seq=5052071 Ack=90665763 Win=65535 Len=0
1,3.9923180000000684,10.0.2.15,62.210.85.178,TLSv1.2,1204,Application Data
1,3.9923830000002454,10.0.2.15,62.210.85.178,TCP,2974,35978  >  9001 [ACK] Seq=90666913 Ack=5052071 Win=65535 Len=2920 [TCP segment of a reassembled PDU]
1,3.992420999999922,62.210.85.178,10.0.2.15,TCP,60,9001  >  35978 [ACK] Seq=5052071 Ack=90666913 Win=65535 Len=0
1,3.992428000000018,62.210.85.178,10.0.2.15,TCP,60,9001  >  35978 [ACK] Seq=5052071 Ack=90668373 Win=65535 Len=0
1,3.992432000000008,62.210.85.178,10.0.2.15,TCP,60,9001  >  35978 [ACK] Seq=5052071 Ack=90669833 Win=65535 Len=0
1,3.9924660000001495,10.0.2.15,62.210.85.178,TLSv1.2,1204,Application Data
1,3.992529999999988,10.0.2.15,62.210.85.178,TCP,2974,35978  >  9001 [ACK] Seq=90670983 Ack=5052071 Win=65535 Len=2920 [TCP segment of a reassembled PDU]
1,3.9925650000000132,62.210.85.178,10.0.2.15,TCP,60,9001  >  35978 [ACK] Seq=5052071 Ack=90670983 Win=65535 Len=0
1,3.9925710000002255,62.210.85.178,10.0.2.15,TCP,60,9001  >  35978 [ACK] Seq=5052071 Ack=90672443 Win=65535 Len=0
1,3.992576000000099,62.210.85.178,10.0.2.15,TCP,60,9001  >  35978 [ACK] Seq=5052071 Ack=90673903 Win=65535 Len=0
1,3.9926070000001346,10.0.2.15,62.210.85.178,TLSv1.2,1204,Application Data
1,3.9926430000000437,62.210.85.178,10.0.2.15,TCP,60,9001  >  35978 [ACK] Seq=5052071 Ack=90675053 Win=65535 Len=0
1,3.992685000000165,10.0.2.15,62.210.85.178,TLSv1.2,332,Application Data
1,3.992753999999877,10.0.2.15,62.210.85.178,TCP,2974,35978  >  9001 [ACK] Seq=90675331 Ack=5052071 Win=65535 Len=2920 [TCP segment of a reassembled PDU]
1,3.992794000000231,62.210.85.178,10.0.2.15,TCP,60,9001  >  35978 [ACK] Seq=5052071 Ack=90675331 Win=65535 Len=0
1,3.992800999999872,62.210.85.178,10.0.2.15,TCP,60,9001  >  35978 [ACK] Seq=5052071 Ack=90676791 Win=65535 Len=0
1,3.9928060000002006,62.210.85.178,10.0.2.15,TCP,60,9001  >  35978 [ACK] Seq=5052071 Ack=90678251 Win=65535 Len=0
1,3.992837000000236,10.0.2.15,62.210.85.178,TLSv1.2,948,Application Data
1,3.992874000000029,62.210.85.178,10.0.2.15,TCP,60,9001  >  35978 [ACK] Seq=5052071 Ack=90679145 Win=65535 Len=0
1,3.992917000000034,10.0.2.15,62.210.85.178,TLSv1.2,3994,Application Data
1,3.9929580000002716,62.210.85.178,10.0.2.15,TCP,60,9001  >  35978 [ACK] Seq=5052071 Ack=90680605 Win=65535 Len=0
1,3.992964999999913,62.210.85.178,10.0.2.15,TCP,60,9001  >  35978 [ACK] Seq=5052071 Ack=90682065 Win=65535 Len=0
1,3.9929689999999027,62.210.85.178,10.0.2.15,TCP,60,9001  >  35978 [ACK] Seq=5052071 Ack=90683085 Win=65535 Len=0
1,4.076935999999932,54.93.77.70,10.0.2.15,TLSv1.2,590,Application Data
1,4.093908000000283,54.93.77.70,10.0.2.15,TLSv1.2,3674,Application Data
1,4.093999000000167,10.0.2.15,54.93.77.70,TCP,54,34692  >  9001 [ACK] Seq=5046923 Ack=90457439 Win=65535 Len=0
1,4.114751999999953,54.93.77.70,10.0.2.15,TLSv1.2,2132,Application Data
1,4.114845000000059,10.0.2.15,54.93.77.70,TCP,54,34692  >  9001 [ACK] Seq=5046923 Ack=90459517 Win=65535 Len=0
1,4.123227000000043,54.93.77.70,10.0.2.15,TLSv1.2,5846,Application Data
1,4.123328000000129,10.0.2.15,54.93.77.70,TCP,54,34692  >  9001 [ACK] Seq=5046923 Ack=90465309 Win=65535 Len=0
1,4.13306700000021,54.93.77.70,10.0.2.15,TLSv1.2,5846,"Application Data, Application Data"
1,4.133295000000089,10.0.2.15,54.93.77.70,TCP,54,34692  >  9001 [ACK] Seq=5046923 Ack=90471101 Win=65535 Len=0
1,4.1334280000000945,54.93.77.70,10.0.2.15,TLSv1.2,2436,Application Data
1,4.133628999999928,10.0.2.15,54.93.77.70,TCP,54,34692  >  9001 [ACK] Seq=5046923 Ack=90473483 Win=65535 Len=0
1,4.134293000000071,10.0.2.15,54.93.77.70,TLSv1.2,590,Application Data
1,4.134679000000233,54.93.77.70,10.0.2.15,TCP,60,9001  >  34692 [ACK] Seq=90473483 Ack=5047459 Win=65535 Len=0
1,4.1528840000000855,54.93.77.70,10.0.2.15,TLSv1.2,5846,Application Data
1,4.1529709999999795,10.0.2.15,54.93.77.70,TCP,54,34692  >  9001 [ACK] Seq=5047459 Ack=90479275 Win=65535 Len=0
1,4.153025999999954,54.93.77.70,10.0.2.15,TLSv1.2,2016,Application Data
1,4.153133000000253,10.0.2.15,54.93.77.70,TCP,54,34692  >  9001 [ACK] Seq=5047459 Ack=90481237 Win=65535 Len=0
1,4.153447000000142,10.0.2.15,54.93.77.70,TLSv1.2,590,Application Data
1,4.153556000000208,54.93.77.70,10.0.2.15,TCP,60,9001  >  34692 [ACK] Seq=90481237 Ack=5047995 Win=65535 Len=0
1,4.160960000000159,54.93.77.70,10.0.2.15,TCP,2950,"9001  >  34692 [PSH, ACK] Seq=90481237 Ack=5047995 Win=65535 Len=2896 [TCP segment of a reassembled PDU]"
1,4.160984999999982,54.93.77.70,10.0.2.15,TLSv1.2,4398,Application Data [TCP segment of a reassembled PDU]
1,4.161062000000129,10.0.2.15,54.93.77.70,TCP,54,34692  >  9001 [ACK] Seq=5047995 Ack=90488477 Win=65535 Len=0
1,4.169362999999976,54.93.77.70,10.0.2.15,TLSv1.2,568,Application Data
1,4.182092999999895,54.93.77.70,10.0.2.15,TLSv1.2,7294,Application Data
1,4.182122000000163,54.93.77.70,10.0.2.15,TLSv1.2,4398,Application Data [TCP segment of a reassembled PDU]
1,4.182166999999936,10.0.2.15,54.93.77.70,TCP,54,34692  >  9001 [ACK] Seq=5047995 Ack=90496231 Win=65535 Len=0
1,4.182260000000042,10.0.2.15,54.93.77.70,TCP,54,34692  >  9001 [ACK] Seq=5047995 Ack=90500575 Win=65535 Len=0
1,4.189092000000073,54.93.77.70,10.0.2.15,TLSv1.2,2950,Application Data [TCP segment of a reassembled PDU]
1,4.189137000000301,10.0.2.15,54.93.77.70,TCP,54,34692  >  9001 [ACK] Seq=5047995 Ack=90503471 Win=65535 Len=0
1,4.189554000000044,54.93.77.70,10.0.2.15,TCP,1502,"9001  >  34692 [PSH, ACK] Seq=90503471 Ack=5047995 Win=65535 Len=1448 [TCP segment of a reassembled PDU]"
1,4.189600000000155,10.0.2.15,54.93.77.70,TCP,54,34692  >  9001 [ACK] Seq=5047995 Ack=90504919 Win=65535 Len=0
1,4.198460999999952,54.93.77.70,10.0.2.15,TLSv1.2,170,"Application Data, Application Data"
1,4.198656000000028,10.0.2.15,54.93.77.70,TLSv1.2,590,Application Data
1,4.198732000000291,54.93.77.70,10.0.2.15,TCP,60,9001  >  34692 [ACK] Seq=90505035 Ack=5048531 Win=65535 Len=0
1,4.21301799999992,10.0.2.15,54.93.77.70,TLSv1.2,1104,Application Data
1,4.21330399999988,54.93.77.70,10.0.2.15,TCP,60,9001  >  34692 [ACK] Seq=90505035 Ack=5049581 Win=65535 Len=0
1,4.216641999999865,54.93.77.70,10.0.2.15,TLSv1.2,590,Application Data
1,4.257542000000285,10.0.2.15,54.93.77.70,TCP,54,34692  >  9001 [ACK] Seq=5049581 Ack=90505571 Win=65535 Len=0
1,4.277902000000267,62.210.85.178,10.0.2.15,TLSv1.2,590,Application Data
1,4.321570000000065,10.0.2.15,62.210.85.178,TCP,54,35978  >  9001 [ACK] Seq=90683085 Ack=5052607 Win=65535 Len=0
1,4.3410210000001825,62.210.85.178,10.0.2.15,TLSv1.2,590,Application Data
1,4.341111000000183,10.0.2.15,62.210.85.178,TCP,54,35978  >  9001 [ACK] Seq=90683085 Ack=5053143 Win=65535 Len=0
1,4.887279999999919,62.210.85.178,10.0.2.15,TLSv1.2,1618,Application Data
1,4.887361999999939,10.0.2.15,62.210.85.178,TCP,54,35978  >  9001 [ACK] Seq=90683085 Ack=5054707 Win=65535 Len=0
1,4.887678000000051,10.0.2.15,62.210.85.178,TLSv1.2,590,Application Data
1,4.887768000000051,62.210.85.178,10.0.2.15,TCP,60,9001  >  35978 [ACK] Seq=5054707 Ack=90683621 Win=65535 Len=0
1,5.089109999999891,54.93.77.70,10.0.2.15,TLSv1.2,590,Application Data
1,5.089191999999912,10.0.2.15,54.93.77.70,TCP,54,34692  >  9001 [ACK] Seq=5049581 Ack=90506107 Win=65535 Len=0
1,5.089563999999882,10.0.2.15,54.93.77.70,TLSv1.2,590,Application Data
1,5.089645999999902,54.93.77.70,10.0.2.15,TCP,60,9001  >  34692 [ACK] Seq=90506107 Ack=5050117 Win=65535 Len=0
1,5.294417000000067,62.210.85.178,10.0.2.15,TLSv1.2,590,Application Data
1,5.302638999999999,10.0.2.15,62.210.85.178,TLSv1.2,590,Application Data
1,5.302802000000156,62.210.85.178,10.0.2.15,TCP,60,9001  >  35978 [ACK] Seq=5055243 Ack=90684157 Win=65535 Len=0
1,5.314143999999942,10.0.2.15,62.210.85.178,TLSv1.2,4124,Application Data
1,5.314239000000271,10.0.2.15,62.210.85.178,TCP,2974,35978  >  9001 [ACK] Seq=90688227 Ack=5055243 Win=65535 Len=2920 [TCP segment of a reassembled PDU]
1,5.314280999999937,62.210.85.178,10.0.2.15,TCP,60,9001  >  35978 [ACK] Seq=5055243 Ack=90685617 Win=65535 Len=0
1,5.314292000000023,62.210.85.178,10.0.2.15,TCP,60,9001  >  35978 [ACK] Seq=5055243 Ack=90687077 Win=65535 Len=0
1,5.314295000000129,62.210.85.178,10.0.2.15,TCP,60,9001  >  35978 [ACK] Seq=5055243 Ack=90688227 Win=65535 Len=0
1,5.314298000000235,62.210.85.178,10.0.2.15,TCP,60,9001  >  35978 [ACK] Seq=5055243 Ack=90689687 Win=65535 Len=0
1,5.314300000000003,62.210.85.178,10.0.2.15,TCP,60,9001  >  35978 [ACK] Seq=5055243 Ack=90691147 Win=65535 Len=0
1,5.314346999999998,10.0.2.15,62.210.85.178,TLSv1.2,1204,Application Data
1,5.3143810000001395,62.210.85.178,10.0.2.15,TCP,60,9001  >  35978 [ACK] Seq=5055243 Ack=90692297 Win=65535 Len=0
1,5.314425999999912,10.0.2.15,62.210.85.178,TLSv1.2,4124,Application Data
1,5.314462000000276,62.210.85.178,10.0.2.15,TCP,60,9001  >  35978 [ACK] Seq=5055243 Ack=90693757 Win=65535 Len=0
1,5.314470000000256,62.210.85.178,10.0.2.15,TCP,60,9001  >  35978 [ACK] Seq=5055243 Ack=90695217 Win=65535 Len=0
1,5.314474000000246,62.210.85.178,10.0.2.15,TCP,60,9001  >  35978 [ACK] Seq=5055243 Ack=90696367 Win=65535 Len=0
1,5.314511000000039,10.0.2.15,62.210.85.178,TLSv1.2,4124,Application Data
1,5.314546000000064,62.210.85.178,10.0.2.15,TCP,60,9001  >  35978 [ACK] Seq=5055243 Ack=90697827 Win=65535 Len=0
1,5.314552000000276,62.210.85.178,10.0.2.15,TCP,60,9001  >  35978 [ACK] Seq=5055243 Ack=90699287 Win=65535 Len=0
1,5.314623000000211,10.0.2.15,62.210.85.178,TLSv1.2,2974,Application Data
1,5.314668999999867,62.210.85.178,10.0.2.15,TCP,60,9001  >  35978 [ACK] Seq=5055243 Ack=90700437 Win=65535 Len=0
1,5.314677000000302,62.210.85.178,10.0.2.15,TCP,60,9001  >  35978 [ACK] Seq=5055243 Ack=90701897 Win=65535 Len=0
1,5.3146810000002915,62.210.85.178,10.0.2.15,TCP,60,9001  >  35978 [ACK] Seq=5055243 Ack=90703357 Win=65535 Len=0
1,5.3147210000001905,10.0.2.15,62.210.85.178,TLSv1.2,1226,Application Data
1,5.314765999999963,62.210.85.178,10.0.2.15,TCP,60,9001  >  35978 [ACK] Seq=5055243 Ack=90704529 Win=65535 Len=0
1,5.314820999999938,10.0.2.15,62.210.85.178,TLSv1.2,4124,Application Data
1,5.314858000000186,62.210.85.178,10.0.2.15,TCP,60,9001  >  35978 [ACK] Seq=5055243 Ack=90705989 Win=65535 Len=0
1,5.3148660000001655,62.210.85.178,10.0.2.15,TCP,60,9001  >  35978 [ACK] Seq=5055243 Ack=90707449 Win=65535 Len=0
1,5.314869000000272,62.210.85.178,10.0.2.15,TCP,60,9001  >  35978 [ACK] Seq=5055243 Ack=90708599 Win=65535 Len=0
1,5.314906999999948,10.0.2.15,62.210.85.178,TLSv1.2,3030,Application Data
1,5.314943000000312,62.210.85.178,10.0.2.15,TCP,60,9001  >  35978 [ACK] Seq=5055243 Ack=90710059 Win=65535 Len=0
1,5.31494900000007,62.210.85.178,10.0.2.15,TCP,60,9001  >  35978 [ACK] Seq=5055243 Ack=90711519 Win=65535 Len=0
1,5.314952000000176,62.210.85.178,10.0.2.15,TCP,60,9001  >  35978 [ACK] Seq=5055243 Ack=90711575 Win=65535 Len=0
1,5.324202000000241,10.0.2.15,62.210.85.178,TLSv1.2,4124,Application Data
1,5.324284000000262,62.210.85.178,10.0.2.15,TCP,60,9001  >  35978 [ACK] Seq=5055243 Ack=90713035 Win=65535 Len=0
1,5.324294000000009,62.210.85.178,10.0.2.15,TCP,60,9001  >  35978 [ACK] Seq=5055243 Ack=90714495 Win=65535 Len=0
1,5.324297000000115,62.210.85.178,10.0.2.15,TCP,60,9001  >  35978 [ACK] Seq=5055243 Ack=90715645 Win=65535 Len=0
1,5.32434000000012,10.0.2.15,62.210.85.178,TLSv1.2,4124,Application Data
1,5.324418000000151,62.210.85.178,10.0.2.15,TCP,60,9001  >  35978 [ACK] Seq=5055243 Ack=90717105 Win=65535 Len=0
1,5.324427000000014,62.210.85.178,10.0.2.15,TCP,60,9001  >  35978 [ACK] Seq=5055243 Ack=90718565 Win=65535 Len=0
1,5.32443000000012,62.210.85.178,10.0.2.15,TCP,60,9001  >  35978 [ACK] Seq=5055243 Ack=90719715 Win=65535 Len=0
1,5.324464000000262,10.0.2.15,62.210.85.178,TLSv1.2,4124,Application Data
1,5.324501999999939,62.210.85.178,10.0.2.15,TCP,60,9001  >  35978 [ACK] Seq=5055243 Ack=90721175 Win=65535 Len=0
1,5.324511000000257,62.210.85.178,10.0.2.15,TCP,60,9001  >  35978 [ACK] Seq=5055243 Ack=90722635 Win=65535 Len=0
1,5.324515000000247,62.210.85.178,10.0.2.15,TCP,60,9001  >  35978 [ACK] Seq=5055243 Ack=90723785 Win=65535 Len=0
1,5.3245529999999235,10.0.2.15,62.210.85.178,TLSv1.2,4124,Application Data
1,5.324591000000055,62.210.85.178,10.0.2.15,TCP,60,9001  >  35978 [ACK] Seq=5055243 Ack=90725245 Win=65535 Len=0
1,5.324599000000035,62.210.85.178,10.0.2.15,TCP,60,9001  >  35978 [ACK] Seq=5055243 Ack=90726705 Win=65535 Len=0
1,5.324603999999908,62.210.85.178,10.0.2.15,TCP,60,9001  >  35978 [ACK] Seq=5055243 Ack=90727855 Win=65535 Len=0
1,5.324638999999934,10.0.2.15,62.210.85.178,TLSv1.2,332,Application Data
1,5.324676000000181,62.210.85.178,10.0.2.15,TCP,60,9001  >  35978 [ACK] Seq=5055243 Ack=90728133 Win=65535 Len=0
1,5.324730000000272,10.0.2.15,62.210.85.178,TLSv1.2,3868,Application Data
1,5.324771000000055,62.210.85.178,10.0.2.15,TCP,60,9001  >  35978 [ACK] Seq=5055243 Ack=90729593 Win=65535 Len=0
1,5.324779999999919,62.210.85.178,10.0.2.15,TCP,60,9001  >  35978 [ACK] Seq=5055243 Ack=90731053 Win=65535 Len=0
1,5.324783000000025,62.210.85.178,10.0.2.15,TCP,60,9001  >  35978 [ACK] Seq=5055243 Ack=90731947 Win=65535 Len=0
1,5.324821000000156,10.0.2.15,62.210.85.178,TLSv1.2,4124,Application Data
1,5.324861000000055,62.210.85.178,10.0.2.15,TCP,60,9001  >  35978 [ACK] Seq=5055243 Ack=90733407 Win=65535 Len=0
1,5.324869000000035,62.210.85.178,10.0.2.15,TCP,60,9001  >  35978 [ACK] Seq=5055243 Ack=90734867 Win=65535 Len=0
1,5.324872000000141,62.210.85.178,10.0.2.15,TCP,60,9001  >  35978 [ACK] Seq=5055243 Ack=90736017 Win=65535 Len=0
1,5.324907000000167,10.0.2.15,62.210.85.178,TLSv1.2,2516,Application Data
1,5.324947000000066,62.210.85.178,10.0.2.15,TCP,60,9001  >  35978 [ACK] Seq=5055243 Ack=90737477 Win=65535 Len=0
1,5.324954000000162,62.210.85.178,10.0.2.15,TCP,60,9001  >  35978 [ACK] Seq=5055243 Ack=90738479 Win=65535 Len=0
1,5.4050890000003164,54.93.77.70,10.0.2.15,TLSv1.2,590,Application Data
1,5.422039000000041,54.93.77.70,10.0.2.15,TLSv1.2,3674,Application Data
1,5.4221520000000965,10.0.2.15,54.93.77.70,TCP,54,34692  >  9001 [ACK] Seq=5050117 Ack=90510263 Win=65535 Len=0
1,5.4328340000001845,54.93.77.70,10.0.2.15,TCP,2950,"9001  >  34692 [PSH, ACK] Seq=90510263 Ack=5050117 Win=65535 Len=2896 [TCP segment of a reassembled PDU]"
1,5.4329139999999825,10.0.2.15,54.93.77.70,TCP,54,34692  >  9001 [ACK] Seq=5050117 Ack=90513159 Win=65535 Len=0
1,5.439830000000256,54.93.77.70,10.0.2.15,TLSv1.2,1314,"Application Data, Application Data"
1,5.449392999999873,54.93.77.70,10.0.2.15,TCP,2950,"9001  >  34692 [PSH, ACK] Seq=90514419 Ack=5050117 Win=65535 Len=2896 [TCP segment of a reassembled PDU]"
1,5.449469000000136,10.0.2.15,54.93.77.70,TCP,54,34692  >  9001 [ACK] Seq=5050117 Ack=90517315 Win=65535 Len=0
1,5.456167000000278,54.93.77.70,10.0.2.15,TLSv1.2,778,Application Data
1,5.457033000000138,54.93.77.70,10.0.2.15,TCP,2950,"9001  >  34692 [PSH, ACK] Seq=90518039 Ack=5050117 Win=65535 Len=2896 [TCP segment of a reassembled PDU]"
1,5.457080000000133,10.0.2.15,54.93.77.70,TCP,54,34692  >  9001 [ACK] Seq=5050117 Ack=90520935 Win=65535 Len=0
1,5.46761000000015,54.93.77.70,10.0.2.15,TLSv1.2,4398,Application Data [TCP segment of a reassembled PDU]
1,5.467744000000039,10.0.2.15,54.93.77.70,TCP,54,34692  >  9001 [ACK] Seq=5050117 Ack=90525279 Win=65535 Len=0
1,5.467919000000165,10.0.2.15,54.93.77.70,TLSv1.2,590,Application Data
1,5.467993000000206,54.93.77.70,10.0.2.15,TCP,60,9001  >  34692 [ACK] Seq=90525279 Ack=5050653 Win=65535 Len=0
1,5.472968000000037,54.93.77.70,10.0.2.15,TLSv1.2,1104,"Application Data, Application Data"
1,5.480818999999883,54.93.77.70,10.0.2.15,TCP,1502,"9001  >  34692 [PSH, ACK] Seq=90526329 Ack=5050653 Win=65535 Len=1448 [TCP segment of a reassembled PDU]"
1,5.480867000000217,10.0.2.15,54.93.77.70,TCP,54,34692  >  9001 [ACK] Seq=5050653 Ack=90527777 Win=65535 Len=0
1,5.488980000000083,54.93.77.70,10.0.2.15,TLSv1.2,2950,Application Data [TCP segment of a reassembled PDU]
1,5.489025000000311,10.0.2.15,54.93.77.70,TCP,54,34692  >  9001 [ACK] Seq=5050653 Ack=90530673 Win=65535 Len=0
1,5.491312999999991,54.93.77.70,10.0.2.15,TLSv1.2,1408,Application Data
1,5.49145099999987,10.0.2.15,54.93.77.70,TLSv1.2,590,Application Data
1,5.491524000000027,54.93.77.70,10.0.2.15,TCP,60,9001  >  34692 [ACK] Seq=90532027 Ack=5051189 Win=65535 Len=0
1,5.499744000000192,54.93.77.70,10.0.2.15,TLSv1.2,5846,Application Data
1,5.49982,10.0.2.15,54.93.77.70,TCP,54,34692  >  9001 [ACK] Seq=5051189 Ack=90537819 Win=65535 Len=0
1,5.500168000000031,54.93.77.70,10.0.2.15,TCP,1502,"9001  >  34692 [PSH, ACK] Seq=90537819 Ack=5051189 Win=65535 Len=1448 [TCP segment of a reassembled PDU]"
1,5.500205000000278,10.0.2.15,54.93.77.70,TCP,54,34692  >  9001 [ACK] Seq=5051189 Ack=90539267 Win=65535 Len=0
1,5.508072000000084,54.93.77.70,10.0.2.15,TLSv1.2,568,Application Data
1,5.511115000000245,54.93.77.70,10.0.2.15,TLSv1.2,5846,Application Data
1,5.511222999999973,10.0.2.15,54.93.77.70,TCP,54,34692  >  9001 [ACK] Seq=5051189 Ack=90545573 Win=65535 Len=0
1,5.512320000000273,54.93.77.70,10.0.2.15,TLSv1.2,5846,Application Data [TCP segment of a reassembled PDU]
1,5.512368000000151,10.0.2.15,54.93.77.70,TCP,54,34692  >  9001 [ACK] Seq=5051189 Ack=90551365 Win=65535 Len=0
1,5.525574000000233,54.93.77.70,10.0.2.15,TLSv1.2,894,"Application Data, Application Data"
1,5.56955999999991,10.0.2.15,54.93.77.70,TCP,54,34692  >  9001 [ACK] Seq=5051189 Ack=90552205 Win=65535 Len=0
1,5.5864150000002155,54.93.77.70,10.0.2.15,TLSv1.2,7294,"Application Data, Application Data"
1,5.586481000000276,10.0.2.15,54.93.77.70,TCP,54,34692  >  9001 [ACK] Seq=5051189 Ack=90559445 Win=65535 Len=0
1,5.586773999999878,10.0.2.15,54.93.77.70,TLSv1.2,590,Application Data
1,5.586863999999878,54.93.77.70,10.0.2.15,TCP,60,9001  >  34692 [ACK] Seq=90559445 Ack=5051725 Win=65535 Len=0
1,5.5934910000000855,54.93.77.70,10.0.2.15,TLSv1.2,1618,Application Data
1,5.593556000000262,10.0.2.15,54.93.77.70,TCP,54,34692  >  9001 [ACK] Seq=5051725 Ack=90561009 Win=65535 Len=0
1,5.5960949999998775,10.0.2.15,54.93.77.70,TLSv1.2,590,Application Data
1,5.596248000000287,54.93.77.70,10.0.2.15,TCP,60,9001  >  34692 [ACK] Seq=90561009 Ack=5052261 Win=65535 Len=0
1,5.605235999999877,62.210.85.178,10.0.2.15,TLSv1.2,590,Application Data
1,5.645625999999993,10.0.2.15,62.210.85.178,TCP,54,35978  >  9001 [ACK] Seq=90738479 Ack=5055779 Win=65535 Len=0
1,5.697374000000309,62.210.85.178,10.0.2.15,TLSv1.2,1618,Application Data
1,5.69747499999994,10.0.2.15,62.210.85.178,TCP,54,35978  >  9001 [ACK] Seq=90738479 Ack=5057343 Win=65535 Len=0
1,5.6980570000000625,10.0.2.15,62.210.85.178,TLSv1.2,590,Application Data
1,5.698186999999962,62.210.85.178,10.0.2.15,TCP,60,9001  >  35978 [ACK] Seq=5057343 Ack=90739015 Win=65535 Len=0
1,6.113554999999906,54.93.77.70,10.0.2.15,TLSv1.2,590,Application Data
1,6.114023000000088,10.0.2.15,54.93.77.70,TLSv1.2,590,Application Data
1,6.11413900000025,54.93.77.70,10.0.2.15,TCP,60,9001  >  34692 [ACK] Seq=90561545 Ack=5052797 Win=65535 Len=0
1,6.3199030000000675,62.210.85.178,10.0.2.15,TLSv1.2,590,Application Data
1,6.325177000000167,10.0.2.15,62.210.85.178,TLSv1.2,590,Application Data
1,6.325322000000142,62.210.85.178,10.0.2.15,TCP,60,9001  >  35978 [ACK] Seq=5057879 Ack=90739551 Win=65535 Len=0
1,6.3337759999999435,10.0.2.15,62.210.85.178,TLSv1.2,4124,Application Data
1,6.33396700000003,62.210.85.178,10.0.2.15,TCP,60,9001  >  35978 [ACK] Seq=5057879 Ack=90741011 Win=65535 Len=0
1,6.333988000000318,62.210.85.178,10.0.2.15,TCP,60,9001  >  35978 [ACK] Seq=5057879 Ack=90742471 Win=65535 Len=0
1,6.333993000000191,62.210.85.178,10.0.2.15,TCP,60,9001  >  35978 [ACK] Seq=5057879 Ack=90743621 Win=65535 Len=0
1,6.334068000000116,10.0.2.15,62.210.85.178,TLSv1.2,4124,Application Data
1,6.3341810000001715,62.210.85.178,10.0.2.15,TCP,60,9001  >  35978 [ACK] Seq=5057879 Ack=90745081 Win=65535 Len=0
1,6.334190999999919,62.210.85.178,10.0.2.15,TCP,60,9001  >  35978 [ACK] Seq=5057879 Ack=90746541 Win=65535 Len=0
1,6.334198000000015,62.210.85.178,10.0.2.15,TCP,60,9001  >  35978 [ACK] Seq=5057879 Ack=90747691 Win=65535 Len=0
1,6.334252000000106,10.0.2.15,62.210.85.178,TLSv1.2,4124,Application Data
1,6.334321000000273,62.210.85.178,10.0.2.15,TCP,60,9001  >  35978 [ACK] Seq=5057879 Ack=90749151 Win=65535 Len=0
1,6.334327999999914,62.210.85.178,10.0.2.15,TCP,60,9001  >  35978 [ACK] Seq=5057879 Ack=90750611 Win=65535 Len=0
1,6.3343330000002425,62.210.85.178,10.0.2.15,TCP,60,9001  >  35978 [ACK] Seq=5057879 Ack=90751761 Win=65535 Len=0
1,6.334389000000101,10.0.2.15,62.210.85.178,TLSv1.2,4124,Application Data
1,6.3344850000003134,62.210.85.178,10.0.2.15,TCP,60,9001  >  35978 [ACK] Seq=5057879 Ack=90753221 Win=65535 Len=0
1,6.334494000000177,62.210.85.178,10.0.2.15,TCP,60,9001  >  35978 [ACK] Seq=5057879 Ack=90754681 Win=65535 Len=0
1,6.334499000000051,62.210.85.178,10.0.2.15,TCP,60,9001  >  35978 [ACK] Seq=5057879 Ack=90755831 Win=65535 Len=0
1,6.334536000000298,10.0.2.15,62.210.85.178,TLSv1.2,332,Application Data
1,6.334576000000197,62.210.85.178,10.0.2.15,TCP,60,9001  >  35978 [ACK] Seq=5057879 Ack=90756109 Win=65535 Len=0
1,6.334639000000152,10.0.2.15,62.210.85.178,TLSv1.2,3868,Application Data
1,6.334710000000086,62.210.85.178,10.0.2.15,TCP,60,9001  >  35978 [ACK] Seq=5057879 Ack=90757569 Win=65535 Len=0
1,6.3347170000001825,62.210.85.178,10.0.2.15,TCP,60,9001  >  35978 [ACK] Seq=5057879 Ack=90759029 Win=65535 Len=0
1,6.334722000000056,62.210.85.178,10.0.2.15,TCP,60,9001  >  35978 [ACK] Seq=5057879 Ack=90759923 Win=65535 Len=0
1,6.334768000000167,10.0.2.15,62.210.85.178,TLSv1.2,4124,Application Data
1,6.334835000000112,62.210.85.178,10.0.2.15,TCP,60,9001  >  35978 [ACK] Seq=5057879 Ack=90761383 Win=65535 Len=0
1,6.334842000000208,62.210.85.178,10.0.2.15,TCP,60,9001  >  35978 [ACK] Seq=5057879 Ack=90762843 Win=65535 Len=0
1,6.334847000000082,62.210.85.178,10.0.2.15,TCP,60,9001  >  35978 [ACK] Seq=5057879 Ack=90763993 Win=65535 Len=0
1,6.334892000000309,10.0.2.15,62.210.85.178,TLSv1.2,3030,Application Data
1,6.334929999999986,62.210.85.178,10.0.2.15,TCP,60,9001  >  35978 [ACK] Seq=5057879 Ack=90765453 Win=65535 Len=0
1,6.334936000000198,62.210.85.178,10.0.2.15,TCP,60,9001  >  35978 [ACK] Seq=5057879 Ack=90766913 Win=65535 Len=0
1,6.334941000000072,62.210.85.178,10.0.2.15,TCP,60,9001  >  35978 [ACK] Seq=5057879 Ack=90766969 Win=65535 Len=0
1,6.344256000000314,10.0.2.15,62.210.85.178,TLSv1.2,4124,Application Data
1,6.344380999999885,10.0.2.15,62.210.85.178,TCP,2974,35978  >  9001 [ACK] Seq=90771039 Ack=5057879 Win=65535 Len=2920 [TCP segment of a reassembled PDU]
1,6.344426000000112,62.210.85.178,10.0.2.15,TCP,60,9001  >  35978 [ACK] Seq=5057879 Ack=90768429 Win=65535 Len=0
1,6.344437000000198,62.210.85.178,10.0.2.15,TCP,60,9001  >  35978 [ACK] Seq=5057879 Ack=90769889 Win=65535 Len=0
1,6.344442000000072,62.210.85.178,10.0.2.15,TCP,60,9001  >  35978 [ACK] Seq=5057879 Ack=90771039 Win=65535 Len=0
1,6.344508000000133,10.0.2.15,62.210.85.178,TLSv1.2,1204,Application Data
1,6.344528999999966,62.210.85.178,10.0.2.15,TCP,60,9001  >  35978 [ACK] Seq=5057879 Ack=90772499 Win=65535 Len=0
1,6.344536000000062,62.210.85.178,10.0.2.15,TCP,60,9001  >  35978 [ACK] Seq=5057879 Ack=90773959 Win=65535 Len=0
1,6.3446100000001024,10.0.2.15,62.210.85.178,TCP,2974,35978  >  9001 [ACK] Seq=90775109 Ack=5057879 Win=65535 Len=2920 [TCP segment of a reassembled PDU]
1,6.344630999999936,62.210.85.178,10.0.2.15,TCP,60,9001  >  35978 [ACK] Seq=5057879 Ack=90775109 Win=65535 Len=0
1,6.344665999999961,10.0.2.15,62.210.85.178,TLSv1.2,1204,Application Data
1,6.34470199999987,62.210.85.178,10.0.2.15,TCP,60,9001  >  35978 [ACK] Seq=5057879 Ack=90776569 Win=65535 Len=0
1,6.344708000000082,62.210.85.178,10.0.2.15,TCP,60,9001  >  35978 [ACK] Seq=5057879 Ack=90778029 Win=65535 Len=0
1,6.344712000000072,62.210.85.178,10.0.2.15,TCP,60,9001  >  35978 [ACK] Seq=5057879 Ack=90779179 Win=65535 Len=0
1,6.344759000000067,10.0.2.15,62.210.85.178,TLSv1.2,4124,Application Data
1,6.344798999999966,62.210.85.178,10.0.2.15,TCP,60,9001  >  35978 [ACK] Seq=5057879 Ack=90780639 Win=65535 Len=0
1,6.344806000000062,62.210.85.178,10.0.2.15,TCP,60,9001  >  35978 [ACK] Seq=5057879 Ack=90782099 Win=65535 Len=0
1,6.344810000000052,62.210.85.178,10.0.2.15,TCP,60,9001  >  35978 [ACK] Seq=5057879 Ack=90783249 Win=65535 Len=0
1,6.34485500000028,10.0.2.15,62.210.85.178,TLSv1.2,332,Application Data
1,6.344895000000179,62.210.85.178,10.0.2.15,TCP,60,9001  >  35978 [ACK] Seq=5057879 Ack=90783527 Win=65535 Len=0
1,6.344955000000027,10.0.2.15,62.210.85.178,TLSv1.2,3868,Application Data
1,6.344998999999916,62.210.85.178,10.0.2.15,TCP,60,9001  >  35978 [ACK] Seq=5057879 Ack=90784987 Win=65535 Len=0
1,6.345006000000012,62.210.85.178,10.0.2.15,TCP,60,9001  >  35978 [ACK] Seq=5057879 Ack=90786447 Win=65535 Len=0
1,6.345010000000002,62.210.85.178,10.0.2.15,TCP,60,9001  >  35978 [ACK] Seq=5057879 Ack=90787341 Win=65535 Len=0
1,6.345056000000113,10.0.2.15,62.210.85.178,TLSv1.2,4124,Application Data
1,6.345096999999896,62.210.85.178,10.0.2.15,TCP,60,9001  >  35978 [ACK] Seq=5057879 Ack=90788801 Win=65535 Len=0
1,6.345103999999992,62.210.85.178,10.0.2.15,TCP,60,9001  >  35978 [ACK] Seq=5057879 Ack=90790261 Win=65535 Len=0
1,6.345107999999982,62.210.85.178,10.0.2.15,TCP,60,9001  >  35978 [ACK] Seq=5057879 Ack=90791411 Win=65535 Len=0
1,6.345150999999987,10.0.2.15,62.210.85.178,TLSv1.2,3030,Application Data
1,6.345190999999886,62.210.85.178,10.0.2.15,TCP,60,9001  >  35978 [ACK] Seq=5057879 Ack=90792871 Win=65535 Len=0
1,6.345197999999982,62.210.85.178,10.0.2.15,TCP,60,9001  >  35978 [ACK] Seq=5057879 Ack=90794331 Win=65535 Len=0
1,6.345201999999972,62.210.85.178,10.0.2.15,TCP,60,9001  >  35978 [ACK] Seq=5057879 Ack=90794387 Win=65535 Len=0
1,6.359385000000202,10.0.2.15,62.210.85.178,TLSv1.2,1618,Application Data
1,6.359527000000071,62.210.85.178,10.0.2.15,TCP,60,9001  >  35978 [ACK] Seq=5057879 Ack=90795847 Win=65535 Len=0
1,6.359547999999904,62.210.85.178,10.0.2.15,TCP,60,9001  >  35978 [ACK] Seq=5057879 Ack=90795951 Win=65535 Len=0
1,6.448660999999902,54.93.77.70,10.0.2.15,TLSv1.2,3674,Application Data
1,6.44878800000015,10.0.2.15,54.93.77.70,TCP,54,34692  >  9001 [ACK] Seq=5052797 Ack=90565165 Win=65535 Len=0
1,6.457123000000138,54.93.77.70,10.0.2.15,TCP,2950,"9001  >  34692 [PSH, ACK] Seq=90565165 Ack=5052797 Win=65535 Len=2896 [TCP segment of a reassembled PDU]"
1,6.457190000000082,10.0.2.15,54.93.77.70,TCP,54,34692  >  9001 [ACK] Seq=5052797 Ack=90568061 Win=65535 Len=0
1,6.465012000000115,54.93.77.70,10.0.2.15,TLSv1.2,778,Application Data
1,6.468804000000091,54.93.77.70,10.0.2.15,TCP,2950,"9001  >  34692 [PSH, ACK] Seq=90568785 Ack=5052797 Win=65535 Len=2896 [TCP segment of a reassembled PDU]"
1,6.4688639999999396,10.0.2.15,54.93.77.70,TCP,54,34692  >  9001 [ACK] Seq=5052797 Ack=90571681 Win=65535 Len=0
1,6.479896000000281,54.93.77.70,10.0.2.15,TLSv1.2,5846,"Application Data, Application Data"
1,6.479969999999867,10.0.2.15,54.93.77.70,TCP,54,34692  >  9001 [ACK] Seq=5052797 Ack=90577473 Win=65535 Len=0
1,6.480156999999963,10.0.2.15,54.93.77.70,TLSv1.2,590,Application Data
1,6.480250000000069,54.93.77.70,10.0.2.15,TCP,60,9001  >  34692 [ACK] Seq=90577473 Ack=5053333 Win=65535 Len=0
1,6.4803249999999935,54.93.77.70,10.0.2.15,TCP,2950,"9001  >  34692 [PSH, ACK] Seq=90577473 Ack=5053333 Win=65535 Len=2896 [TCP segment of a reassembled PDU]"
1,6.480363000000125,10.0.2.15,54.93.77.70,TCP,54,34692  >  9001 [ACK] Seq=5053333 Ack=90580369 Win=65535 Len=0
1,6.484801999999945,54.93.77.70,10.0.2.15,TLSv1.2,380,"Application Data, Application Data"
1,6.488842000000204,54.93.77.70,10.0.2.15,TLSv1.2,5846,Application Data
1,6.488892000000305,10.0.2.15,54.93.77.70,TCP,54,34692  >  9001 [ACK] Seq=5053333 Ack=90586487 Win=65535 Len=0
1,6.49632500000007,54.93.77.70,10.0.2.15,TLSv1.2,4398,Application Data [TCP segment of a reassembled PDU]
1,6.496372000000065,10.0.2.15,54.93.77.70,TCP,54,34692  >  9001 [ACK] Seq=5053333 Ack=90590831 Win=65535 Len=0
1,6.496540999999979,10.0.2.15,54.93.77.70,TLSv1.2,590,Application Data
1,6.496650000000045,54.93.77.70,10.0.2.15,TCP,60,9001  >  34692 [ACK] Seq=90590831 Ack=5053869 Win=65535 Len=0
1,6.496857999999975,54.93.77.70,10.0.2.15,TLSv1.2,4398,"Application Data, Application Data"
1,6.496899000000212,10.0.2.15,54.93.77.70,TCP,54,34692  >  9001 [ACK] Seq=5053869 Ack=90595175 Win=65535 Len=0
1,6.510024000000158,54.93.77.70,10.0.2.15,TLSv1.2,1618,Application Data
1,6.510097000000314,10.0.2.15,54.93.77.70,TCP,54,34692  >  9001 [ACK] Seq=5053869 Ack=90596739 Win=65535 Len=0
1,6.569168999999874,54.93.77.70,10.0.2.15,TLSv1.2,7808,"Application Data, Application Data"
1,6.569316999999955,10.0.2.15,54.93.77.70,TCP,54,34692  >  9001 [ACK] Seq=5053869 Ack=90604493 Win=65535 Len=0
1,6.576923000000079,54.93.77.70,10.0.2.15,TLSv1.2,5846,Application Data
1,6.57698100000016,10.0.2.15,54.93.77.70,TCP,54,34692  >  9001 [ACK] Seq=5053869 Ack=90610285 Win=65535 Len=0
1,6.585802000000058,54.93.77.70,10.0.2.15,TLSv1.2,474,Application Data
1,6.604640999999901,62.210.85.178,10.0.2.15,TLSv1.2,590,Application Data
1,6.6295600000003105,10.0.2.15,54.93.77.70,TCP,54,34692  >  9001 [ACK] Seq=5053869 Ack=90610705 Win=65535 Len=0
1,6.645551000000069,10.0.2.15,62.210.85.178,TCP,54,35978  >  9001 [ACK] Seq=90795951 Ack=5058415 Win=65535 Len=0
1,6.734809000000041,62.210.85.178,10.0.2.15,TLSv1.2,590,Application Data
1,6.734903999999915,10.0.2.15,62.210.85.178,TCP,54,35978  >  9001 [ACK] Seq=90795951 Ack=5058951 Win=65535 Len=0
1,6.761849999999868,54.93.77.70,10.0.2.15,TCP,2950,"9001  >  34692 [PSH, ACK] Seq=90610705 Ack=5053869 Win=65535 Len=2896 [TCP segment of a reassembled PDU]"
1,6.76194200000009,10.0.2.15,54.93.77.70,TCP,54,34692  >  9001 [ACK] Seq=5053869 Ack=90613601 Win=65535 Len=0
1,6.763476999999966,54.93.77.70,10.0.2.15,TLSv1.2,778,Application Data
1,6.763526000000184,10.0.2.15,54.93.77.70,TCP,54,34692  >  9001 [ACK] Seq=5053869 Ack=90614325 Win=65535 Len=0
1,6.763738999999987,10.0.2.15,54.93.77.70,TLSv1.2,590,Application Data
1,6.763858000000255,54.93.77.70,10.0.2.15,TCP,60,9001  >  34692 [ACK] Seq=90614325 Ack=5054405 Win=65535 Len=0
1,6.795599999999922,54.93.77.70,10.0.2.15,TCP,2950,"9001  >  34692 [PSH, ACK] Seq=90614325 Ack=5054405 Win=65535 Len=2896 [TCP segment of a reassembled PDU]"
1,6.795644000000266,54.93.77.70,10.0.2.15,TLSv1.2,778,Application Data
1,6.795769000000291,10.0.2.15,54.93.77.70,TCP,54,34692  >  9001 [ACK] Seq=5054405 Ack=90617945 Win=65535 Len=0
1,6.7982999999999265,10.0.2.15,54.93.77.70,TLSv1.2,590,Application Data
1,6.798456999999871,54.93.77.70,10.0.2.15,TCP,60,9001  >  34692 [ACK] Seq=90617945 Ack=5054941 Win=65535 Len=0
1,6.814016000000265,54.93.77.70,10.0.2.15,TLSv1.2,590,Application Data
1,6.814274000000296,10.0.2.15,54.93.77.70,TLSv1.2,590,Application Data
1,6.8143700000000536,54.93.77.70,10.0.2.15,TCP,60,9001  >  34692 [ACK] Seq=90618481 Ack=5055477 Win=65535 Len=0
1,7.0351080000000366,62.210.85.178,10.0.2.15,TLSv1.2,1618,Application Data
1,7.035198000000037,10.0.2.15,62.210.85.178,TCP,54,35978  >  9001 [ACK] Seq=90795951 Ack=5060515 Win=65535 Len=0
1,7.0357349999999315,10.0.2.15,62.210.85.178,TLSv1.2,590,Application Data
1,7.0358430000001135,62.210.85.178,10.0.2.15,TCP,60,9001  >  35978 [ACK] Seq=5060515 Ack=90796487 Win=65535 Len=0
1,7.130486000000019,54.93.77.70,10.0.2.15,TLSv1.2,590,Application Data
1,7.130955000000085,10.0.2.15,54.93.77.70,TLSv1.2,590,Application Data
1,7.131076000000121,54.93.77.70,10.0.2.15,TCP,60,9001  >  34692 [ACK] Seq=90619017 Ack=5056013 Win=65535 Len=0
1,7.64917400000013,62.210.85.178,10.0.2.15,TLSv1.2,590,Application Data
1,7.651849000000311,10.0.2.15,62.210.85.178,TLSv1.2,590,Application Data
1,7.65200700000014,62.210.85.178,10.0.2.15,TCP,60,9001  >  35978 [ACK] Seq=5061051 Ack=90797023 Win=65535 Len=0
1,7.666094000000157,10.0.2.15,62.210.85.178,TLSv1.2,4124,Application Data
1,7.666199000000233,10.0.2.15,62.210.85.178,TCP,1514,35978  >  9001 [ACK] Seq=90801093 Ack=5061051 Win=65535 Len=1460 [TCP segment of a reassembled PDU]
1,7.6662409999999,62.210.85.178,10.0.2.15,TCP,60,9001  >  35978 [ACK] Seq=5061051 Ack=90798483 Win=65535 Len=0
1,7.66625299999987,62.210.85.178,10.0.2.15,TCP,60,9001  >  35978 [ACK] Seq=5061051 Ack=90799943 Win=65535 Len=0
1,7.666258000000198,62.210.85.178,10.0.2.15,TCP,60,9001  >  35978 [ACK] Seq=5061051 Ack=90801093 Win=65535 Len=0
1,7.666261000000304,62.210.85.178,10.0.2.15,TCP,60,9001  >  35978 [ACK] Seq=5061051 Ack=90802553 Win=65535 Len=0
1,7.666294999999991,10.0.2.15,62.210.85.178,TLSv1.2,736,Application Data
1,7.6663290000001325,62.210.85.178,10.0.2.15,TCP,60,9001  >  35978 [ACK] Seq=5061051 Ack=90803235 Win=65535 Len=0
1,7.7437589999999545,54.93.77.70,10.0.2.15,TLSv1.2,590,Application Data
1,7.785627000000204,10.0.2.15,54.93.77.70,TCP,54,34692  >  9001 [ACK] Seq=5056013 Ack=90619553 Win=65535 Len=0
1,7.785701000000245,54.93.77.70,10.0.2.15,TCP,2950,"9001  >  34692 [PSH, ACK] Seq=90619553 Ack=5056013 Win=65535 Len=2896 [TCP segment of a reassembled PDU]"
1,7.785741000000144,10.0.2.15,54.93.77.70,TCP,54,34692  >  9001 [ACK] Seq=5056013 Ack=90622449 Win=65535 Len=0
1,7.796074000000317,54.93.77.70,10.0.2.15,TLSv1.2,2950,Application Data [TCP segment of a reassembled PDU]
1,7.796135000000049,10.0.2.15,54.93.77.70,TCP,54,34692  >  9001 [ACK] Seq=5056013 Ack=90625345 Win=65535 Len=0
1,7.8021020000001045,54.93.77.70,10.0.2.15,TLSv1.2,474,Application Data
1,7.802153999999973,10.0.2.15,54.93.77.70,TCP,54,34692  >  9001 [ACK] Seq=5056013 Ack=90625765 Win=65535 Len=0
1,7.802361000000019,10.0.2.15,54.93.77.70,TLSv1.2,590,Application Data
1,7.802447000000029,54.93.77.70,10.0.2.15,TCP,60,9001  >  34692 [ACK] Seq=90625765 Ack=5056549 Win=65535 Len=0
