No.,Time,Source,Destination,Protocol,Length,Info
1,0.016658000000006723,10.0.2.15,54.93.77.70,TCP,54,34692  >  9001 [ACK] Seq=4962073 Ack=89117631 Win=65535 Len=0
1,0.14208800000005795,10.0.2.15,54.93.77.70,TLSv1.2,590,Application Data
1,0.14224100000001272,54.93.77.70,10.0.2.15,TCP,60,9001  >  34692 [ACK] Seq=89117631 Ack=4962609 Win=65535 Len=0
1,0.25897100000020146,62.210.85.178,10.0.2.15,TLSv1.2,590,Application Data
1,0.25944299999991927,10.0.2.15,62.210.85.178,TLSv1.2,590,Application Data
1,0.25956600000017716,62.210.85.178,10.0.2.15,TCP,60,9001  >  35978 [ACK] Seq=4968065 Ack=89296033 Win=65535 Len=0
1,0.3510500000002139,54.93.77.70,10.0.2.15,TLSv1.2,590,Application Data
1,0.35112400000025445,10.0.2.15,54.93.77.70,TCP,54,34692  >  9001 [ACK] Seq=4962609 Ack=89118167 Win=65535 Len=0
1,0.3515379999998913,10.0.2.15,54.93.77.70,TLSv1.2,1618,Application Data
1,0.3516429999999673,54.93.77.70,10.0.2.15,TCP,60,9001  >  34692 [ACK] Seq=89118167 Ack=4964069 Win=65535 Len=0
1,0.351654999999937,54.93.77.70,10.0.2.15,TCP,60,9001  >  34692 [ACK] Seq=89118167 Ack=4964173 Win=65535 Len=0
1,0.5683130000002166,62.210.85.178,10.0.2.15,TLSv1.2,1618,Application Data
1,0.5684519999999793,10.0.2.15,62.210.85.178,TCP,54,35978  >  9001 [ACK] Seq=89296033 Ack=4969629 Win=65535 Len=0
1,0.5817480000000614,10.0.2.15,62.210.85.178,TLSv1.2,590,Application Data
1,0.5819350000001577,62.210.85.178,10.0.2.15,TCP,60,9001  >  35978 [ACK] Seq=4969629 Ack=89296569 Win=65535 Len=0
1,0.591483000000153,10.0.2.15,62.210.85.178,TLSv1.2,1618,Application Data
1,0.5916000000001986,62.210.85.178,10.0.2.15,TCP,60,9001  >  35978 [ACK] Seq=4969629 Ack=89298029 Win=65535 Len=0
1,0.5916179999999258,62.210.85.178,10.0.2.15,TCP,60,9001  >  35978 [ACK] Seq=4969629 Ack=89298133 Win=65535 Len=0
1,0.6812650000001668,54.93.77.70,10.0.2.15,TLSv1.2,2132,Application Data
1,0.6813900000001922,10.0.2.15,54.93.77.70,TCP,54,34692  >  9001 [ACK] Seq=4964173 Ack=89120245 Win=65535 Len=0
1,0.6835470000000896,10.0.2.15,54.93.77.70,TLSv1.2,590,Application Data
1,0.683690000000297,54.93.77.70,10.0.2.15,TCP,60,9001  >  34692 [ACK] Seq=89120245 Ack=4964709 Win=65535 Len=0
1,0.7844960000002175,62.210.85.178,10.0.2.15,TLSv1.2,590,Application Data
1,0.7848460000000159,10.0.2.15,62.210.85.178,TLSv1.2,590,Application Data
1,0.7849409999998898,62.210.85.178,10.0.2.15,TCP,60,9001  >  35978 [ACK] Seq=4970165 Ack=89298669 Win=65535 Len=0
1,0.8743050000002768,54.93.77.70,10.0.2.15,TLSv1.2,590,Application Data
1,0.8746690000002673,10.0.2.15,54.93.77.70,TLSv1.2,590,Application Data
1,0.874775000000227,54.93.77.70,10.0.2.15,TCP,60,9001  >  34692 [ACK] Seq=89120781 Ack=4965245 Win=65535 Len=0
1,0.9887920000001031,62.210.85.178,10.0.2.15,TLSv1.2,590,Application Data
1,0.994713000000047,10.0.2.15,62.210.85.178,TLSv1.2,590,Application Data
1,0.9954259999999522,62.210.85.178,10.0.2.15,TCP,60,9001  >  35978 [ACK] Seq=4970701 Ack=89299205 Win=65535 Len=0
1,1.0034100000002582,10.0.2.15,62.210.85.178,TLSv1.2,4124,Application Data
1,1.0035109999998895,10.0.2.15,62.210.85.178,TCP,2974,35978  >  9001 [ACK] Seq=89303275 Ack=4970701 Win=65535 Len=2920 [TCP segment of a reassembled PDU]
1,1.0035579999998845,62.210.85.178,10.0.2.15,TCP,60,9001  >  35978 [ACK] Seq=4970701 Ack=89300665 Win=65535 Len=0
1,1.0035689999999704,62.210.85.178,10.0.2.15,TCP,60,9001  >  35978 [ACK] Seq=4970701 Ack=89302125 Win=65535 Len=0
1,1.0035720000000765,62.210.85.178,10.0.2.15,TCP,60,9001  >  35978 [ACK] Seq=4970701 Ack=89303275 Win=65535 Len=0
1,1.0035740000002988,62.210.85.178,10.0.2.15,TCP,60,9001  >  35978 [ACK] Seq=4970701 Ack=89304735 Win=65535 Len=0
1,1.0035769999999502,62.210.85.178,10.0.2.15,TCP,60,9001  >  35978 [ACK] Seq=4970701 Ack=89306195 Win=65535 Len=0
1,1.0036119999999755,10.0.2.15,62.210.85.178,TLSv1.2,1204,Application Data
1,1.003646000000117,62.210.85.178,10.0.2.15,TCP,60,9001  >  35978 [ACK] Seq=4970701 Ack=89307345 Win=65535 Len=0
1,1.0036909999998898,10.0.2.15,62.210.85.178,TLSv1.2,4124,Application Data
1,1.0037250000000313,62.210.85.178,10.0.2.15,TCP,60,9001  >  35978 [ACK] Seq=4970701 Ack=89308805 Win=65535 Len=0
1,1.003733000000011,62.210.85.178,10.0.2.15,TCP,60,9001  >  35978 [ACK] Seq=4970701 Ack=89310265 Win=65535 Len=0
1,1.003737000000001,62.210.85.178,10.0.2.15,TCP,60,9001  >  35978 [ACK] Seq=4970701 Ack=89311415 Win=65535 Len=0
1,1.0037750000001324,10.0.2.15,62.210.85.178,TLSv1.2,4124,Application Data
1,1.003809000000274,62.210.85.178,10.0.2.15,TCP,60,9001  >  35978 [ACK] Seq=4970701 Ack=89312875 Win=65535 Len=0
1,1.0038159999999152,62.210.85.178,10.0.2.15,TCP,60,9001  >  35978 [ACK] Seq=4970701 Ack=89314335 Win=65535 Len=0
1,1.0038730000001124,10.0.2.15,62.210.85.178,TLSv1.2,2974,Application Data
1,1.0039090000000215,62.210.85.178,10.0.2.15,TCP,60,9001  >  35978 [ACK] Seq=4970701 Ack=89315485 Win=65535 Len=0
1,1.0039160000001175,62.210.85.178,10.0.2.15,TCP,60,9001  >  35978 [ACK] Seq=4970701 Ack=89316945 Win=65535 Len=0
1,1.0039200000001074,62.210.85.178,10.0.2.15,TCP,60,9001  >  35978 [ACK] Seq=4970701 Ack=89318405 Win=65535 Len=0
1,1.003947000000153,10.0.2.15,62.210.85.178,TLSv1.2,1226,Application Data
1,1.003979999999956,62.210.85.178,10.0.2.15,TCP,60,9001  >  35978 [ACK] Seq=4970701 Ack=89319577 Win=65535 Len=0
1,1.004019999999855,10.0.2.15,62.210.85.178,TLSv1.2,4124,Application Data
1,1.0040549999998802,62.210.85.178,10.0.2.15,TCP,60,9001  >  35978 [ACK] Seq=4970701 Ack=89321037 Win=65535 Len=0
1,1.0040619999999763,62.210.85.178,10.0.2.15,TCP,60,9001  >  35978 [ACK] Seq=4970701 Ack=89322497 Win=65535 Len=0
1,1.0040650000000824,62.210.85.178,10.0.2.15,TCP,60,9001  >  35978 [ACK] Seq=4970701 Ack=89323647 Win=65535 Len=0
1,1.0041009999999915,10.0.2.15,62.210.85.178,TLSv1.2,3030,Application Data
1,1.0041360000000168,62.210.85.178,10.0.2.15,TCP,60,9001  >  35978 [ACK] Seq=4970701 Ack=89325107 Win=65535 Len=0
1,1.004142000000229,62.210.85.178,10.0.2.15,TCP,60,9001  >  35978 [ACK] Seq=4970701 Ack=89326567 Win=65535 Len=0
1,1.0041449999998804,62.210.85.178,10.0.2.15,TCP,60,9001  >  35978 [ACK] Seq=4970701 Ack=89326623 Win=65535 Len=0
1,1.0133780000001025,10.0.2.15,62.210.85.178,TLSv1.2,4124,Application Data
1,1.0134640000001127,62.210.85.178,10.0.2.15,TCP,60,9001  >  35978 [ACK] Seq=4970701 Ack=89328083 Win=65535 Len=0
1,1.0134750000001986,62.210.85.178,10.0.2.15,TCP,60,9001  >  35978 [ACK] Seq=4970701 Ack=89329543 Win=65535 Len=0
1,1.0134780000003047,62.210.85.178,10.0.2.15,TCP,60,9001  >  35978 [ACK] Seq=4970701 Ack=89330693 Win=65535 Len=0
1,1.0135230000000774,10.0.2.15,62.210.85.178,TLSv1.2,4124,Application Data
1,1.0135820000000422,62.210.85.178,10.0.2.15,TCP,60,9001  >  35978 [ACK] Seq=4970701 Ack=89332153 Win=65535 Len=0
1,1.0135890000001382,62.210.85.178,10.0.2.15,TCP,60,9001  >  35978 [ACK] Seq=4970701 Ack=89333613 Win=65535 Len=0
1,1.0135920000002443,62.210.85.178,10.0.2.15,TCP,60,9001  >  35978 [ACK] Seq=4970701 Ack=89334763 Win=65535 Len=0
1,1.0136290000000372,10.0.2.15,62.210.85.178,TLSv1.2,4124,Application Data
1,1.0136630000001787,62.210.85.178,10.0.2.15,TCP,60,9001  >  35978 [ACK] Seq=4970701 Ack=89336223 Win=65535 Len=0
1,1.0136700000002747,62.210.85.178,10.0.2.15,TCP,60,9001  >  35978 [ACK] Seq=4970701 Ack=89337683 Win=65535 Len=0
1,1.0136740000002646,62.210.85.178,10.0.2.15,TCP,60,9001  >  35978 [ACK] Seq=4970701 Ack=89338833 Win=65535 Len=0
1,1.0137100000001737,10.0.2.15,62.210.85.178,TLSv1.2,4124,Application Data
1,1.0137439999998605,62.210.85.178,10.0.2.15,TCP,60,9001  >  35978 [ACK] Seq=4970701 Ack=89340293 Win=65535 Len=0
1,1.0137509999999565,62.210.85.178,10.0.2.15,TCP,60,9001  >  35978 [ACK] Seq=4970701 Ack=89341753 Win=65535 Len=0
1,1.0137549999999464,62.210.85.178,10.0.2.15,TCP,60,9001  >  35978 [ACK] Seq=4970701 Ack=89342903 Win=65535 Len=0
1,1.013789000000088,10.0.2.15,62.210.85.178,TLSv1.2,332,Application Data
1,1.013821999999891,62.210.85.178,10.0.2.15,TCP,60,9001  >  35978 [ACK] Seq=4970701 Ack=89343181 Win=65535 Len=0
1,1.013875999999982,10.0.2.15,62.210.85.178,TLSv1.2,3868,Application Data
1,1.0139130000002297,62.210.85.178,10.0.2.15,TCP,60,9001  >  35978 [ACK] Seq=4970701 Ack=89344641 Win=65535 Len=0
1,1.013919999999871,62.210.85.178,10.0.2.15,TCP,60,9001  >  35978 [ACK] Seq=4970701 Ack=89346101 Win=65535 Len=0
1,1.013922999999977,62.210.85.178,10.0.2.15,TCP,60,9001  >  35978 [ACK] Seq=4970701 Ack=89346995 Win=65535 Len=0
1,1.0139600000002247,10.0.2.15,62.210.85.178,TLSv1.2,4124,Application Data
1,1.0139970000000176,62.210.85.178,10.0.2.15,TCP,60,9001  >  35978 [ACK] Seq=4970701 Ack=89348455 Win=65535 Len=0
1,1.0140040000001136,62.210.85.178,10.0.2.15,TCP,60,9001  >  35978 [ACK] Seq=4970701 Ack=89349915 Win=65535 Len=0
1,1.0140070000002197,62.210.85.178,10.0.2.15,TCP,60,9001  >  35978 [ACK] Seq=4970701 Ack=89351065 Win=65535 Len=0
1,1.014042000000245,10.0.2.15,62.210.85.178,TLSv1.2,3030,Application Data
1,1.0140770000002703,62.210.85.178,10.0.2.15,TCP,60,9001  >  35978 [ACK] Seq=4970701 Ack=89352525 Win=65535 Len=0
1,1.0140839999999116,62.210.85.178,10.0.2.15,TCP,60,9001  >  35978 [ACK] Seq=4970701 Ack=89353985 Win=65535 Len=0
1,1.0140870000000177,62.210.85.178,10.0.2.15,TCP,60,9001  >  35978 [ACK] Seq=4970701 Ack=89354041 Win=65535 Len=0
1,1.0277679999999236,10.0.2.15,62.210.85.178,TLSv1.2,4124,Application Data
1,1.0278630000002522,10.0.2.15,62.210.85.178,TCP,2974,35978  >  9001 [ACK] Seq=89358111 Ack=4970701 Win=65535 Len=2920 [TCP segment of a reassembled PDU]
1,1.027908000000025,62.210.85.178,10.0.2.15,TCP,60,9001  >  35978 [ACK] Seq=4970701 Ack=89355501 Win=65535 Len=0
1,1.0279169999998885,62.210.85.178,10.0.2.15,TCP,60,9001  >  35978 [ACK] Seq=4970701 Ack=89356961 Win=65535 Len=0
1,1.0279199999999946,62.210.85.178,10.0.2.15,TCP,60,9001  >  35978 [ACK] Seq=4970701 Ack=89358111 Win=65535 Len=0
1,1.0279230000001007,62.210.85.178,10.0.2.15,TCP,60,9001  >  35978 [ACK] Seq=4970701 Ack=89359571 Win=65535 Len=0
1,1.0279249999998683,62.210.85.178,10.0.2.15,TCP,60,9001  >  35978 [ACK] Seq=4970701 Ack=89361031 Win=65535 Len=0
1,1.0279599999998936,10.0.2.15,62.210.85.178,TLSv1.2,1204,Application Data
1,1.0279940000000352,62.210.85.178,10.0.2.15,TCP,60,9001  >  35978 [ACK] Seq=4970701 Ack=89362181 Win=65535 Len=0
1,1.028037999999924,10.0.2.15,62.210.85.178,TLSv1.2,4124,Application Data
1,1.0280729999999494,62.210.85.178,10.0.2.15,TCP,60,9001  >  35978 [ACK] Seq=4970701 Ack=89363641 Win=65535 Len=0
1,1.0280809999999292,62.210.85.178,10.0.2.15,TCP,60,9001  >  35978 [ACK] Seq=4970701 Ack=89365101 Win=65535 Len=0
1,1.028084999999919,62.210.85.178,10.0.2.15,TCP,60,9001  >  35978 [ACK] Seq=4970701 Ack=89366251 Win=65535 Len=0
1,1.0281230000000505,10.0.2.15,62.210.85.178,TLSv1.2,4124,Application Data
1,1.0281560000003083,62.210.85.178,10.0.2.15,TCP,60,9001  >  35978 [ACK] Seq=4970701 Ack=89367711 Win=65535 Len=0
1,1.028164000000288,62.210.85.178,10.0.2.15,TCP,60,9001  >  35978 [ACK] Seq=4970701 Ack=89369171 Win=65535 Len=0
1,1.028168000000278,62.210.85.178,10.0.2.15,TCP,60,9001  >  35978 [ACK] Seq=4970701 Ack=89370321 Win=65535 Len=0
1,1.0282030000003033,10.0.2.15,62.210.85.178,TLSv1.2,332,Application Data
1,1.0282900000001973,62.210.85.178,10.0.2.15,TCP,60,9001  >  35978 [ACK] Seq=4970701 Ack=89370599 Win=65535 Len=0
1,1.107144000000062,54.93.77.70,10.0.2.15,TLSv1.2,3674,Application Data
1,1.1072580000000016,10.0.2.15,54.93.77.70,TCP,54,34692  >  9001 [ACK] Seq=4965245 Ack=89124401 Win=65535 Len=0
1,1.1493530000002465,54.93.77.70,10.0.2.15,TLSv1.2,7294,"Application Data, Application Data"
1,1.1495079999999689,10.0.2.15,54.93.77.70,TCP,54,34692  >  9001 [ACK] Seq=4965245 Ack=89131641 Win=65535 Len=0
1,1.1582360000002154,54.93.77.70,10.0.2.15,TCP,2950,"9001  >  34692 [PSH, ACK] Seq=89131641 Ack=4965245 Win=65535 Len=2896 [TCP segment of a reassembled PDU]"
1,1.158281999999872,10.0.2.15,54.93.77.70,TCP,54,34692  >  9001 [ACK] Seq=4965245 Ack=89134537 Win=65535 Len=0
1,1.158842000000277,54.93.77.70,10.0.2.15,TLSv1.2,4398,Application Data [TCP segment of a reassembled PDU]
1,1.1589030000000093,10.0.2.15,54.93.77.70,TCP,54,34692  >  9001 [ACK] Seq=4965245 Ack=89138881 Win=65535 Len=0
1,1.1590550000000803,10.0.2.15,54.93.77.70,TLSv1.2,590,Application Data
1,1.1591459999999643,54.93.77.70,10.0.2.15,TCP,60,9001  >  34692 [ACK] Seq=89138881 Ack=4965781 Win=65535 Len=0
1,1.1656619999998838,54.93.77.70,10.0.2.15,TLSv1.2,568,Application Data
1,1.1782250000001113,54.93.77.70,10.0.2.15,TLSv1.2,4398,Application Data
1,1.1782710000002226,10.0.2.15,54.93.77.70,TCP,54,34692  >  9001 [ACK] Seq=4965781 Ack=89143739 Win=65535 Len=0
1,1.1902650000001813,54.93.77.70,10.0.2.15,TLSv1.2,2950,Application Data [TCP segment of a reassembled PDU]
1,1.1903160000001662,10.0.2.15,54.93.77.70,TCP,54,34692  >  9001 [ACK] Seq=4965781 Ack=89146635 Win=65535 Len=0
1,1.1918390000000727,54.93.77.70,10.0.2.15,TLSv1.2,10190,"Application Data, Application Data, Application Data"
1,1.1919149999998808,10.0.2.15,54.93.77.70,TCP,54,34692  >  9001 [ACK] Seq=4965781 Ack=89156771 Win=65535 Len=0
1,1.192058999999972,10.0.2.15,54.93.77.70,TLSv1.2,590,Application Data
1,1.1921320000001288,54.93.77.70,10.0.2.15,TCP,60,9001  >  34692 [ACK] Seq=89156771 Ack=4966317 Win=65535 Len=0
1,1.1944570000000567,54.93.77.70,10.0.2.15,TLSv1.2,286,Application Data
1,1.2098140000002786,54.93.77.70,10.0.2.15,TCP,2950,"9001  >  34692 [PSH, ACK] Seq=89157003 Ack=4966317 Win=65535 Len=2896 [TCP segment of a reassembled PDU]"
1,1.209896000000299,10.0.2.15,54.93.77.70,TCP,54,34692  >  9001 [ACK] Seq=4966317 Ack=89159899 Win=65535 Len=0
1,1.2104119999999057,54.93.77.70,10.0.2.15,TLSv1.2,4398,Application Data [TCP segment of a reassembled PDU]
1,1.2104760000001988,10.0.2.15,54.93.77.70,TCP,54,34692  >  9001 [ACK] Seq=4966317 Ack=89164243 Win=65535 Len=0
1,1.2213990000000194,54.93.77.70,10.0.2.15,TLSv1.2,2950,Application Data [TCP segment of a reassembled PDU]
1,1.2214939999998933,10.0.2.15,54.93.77.70,TCP,54,34692  >  9001 [ACK] Seq=4966317 Ack=89167139 Win=65535 Len=0
1,1.2278540000002067,54.93.77.70,10.0.2.15,TLSv1.2,1292,Application Data
1,1.2302960000001804,54.93.77.70,10.0.2.15,TLSv1.2,5846,Application Data
1,1.2303980000001502,10.0.2.15,54.93.77.70,TCP,54,34692  >  9001 [ACK] Seq=4966317 Ack=89174169 Win=65535 Len=0
1,1.230532999999923,54.93.77.70,10.0.2.15,TCP,1502,"9001  >  34692 [PSH, ACK] Seq=89174169 Ack=4966317 Win=65535 Len=1448 [TCP segment of a reassembled PDU]"
1,1.2305759999999282,10.0.2.15,54.93.77.70,TCP,54,34692  >  9001 [ACK] Seq=4966317 Ack=89175617 Win=65535 Len=0
1,1.248798000000079,54.93.77.70,10.0.2.15,TLSv1.2,5846,"Application Data, Application Data, Application Data"
1,1.2488250000001244,54.93.77.70,10.0.2.15,TLSv1.2,7200,"Application Data, Application Data"
1,1.2488769999999931,10.0.2.15,54.93.77.70,TCP,54,34692  >  9001 [ACK] Seq=4966317 Ack=89181409 Win=65535 Len=0
1,1.2489800000003015,10.0.2.15,54.93.77.70,TCP,54,34692  >  9001 [ACK] Seq=4966317 Ack=89188555 Win=65535 Len=0
1,1.249174000000039,10.0.2.15,54.93.77.70,TLSv1.2,590,Application Data
1,1.2492820000002212,54.93.77.70,10.0.2.15,TCP,60,9001  >  34692 [ACK] Seq=89188555 Ack=4966853 Win=65535 Len=0
1,1.2545880000002398,54.93.77.70,10.0.2.15,TCP,2950,"9001  >  34692 [PSH, ACK] Seq=89188555 Ack=4966853 Win=65535 Len=2896 [TCP segment of a reassembled PDU]"
1,1.2546409999999923,10.0.2.15,54.93.77.70,TCP,54,34692  >  9001 [ACK] Seq=4966853 Ack=89191451 Win=65535 Len=0
1,1.2642020000002958,10.0.2.15,54.93.77.70,TLSv1.2,590,Application Data
1,1.2643330000000788,54.93.77.70,10.0.2.15,TCP,60,9001  >  34692 [ACK] Seq=89191451 Ack=4967389 Win=65535 Len=0
1,1.273609000000306,54.93.77.70,10.0.2.15,TLSv1.2,1314,"Application Data, Application Data"
1,1.2817720000002737,10.0.2.15,54.93.77.70,TLSv1.2,590,Application Data
1,1.2819490000001679,54.93.77.70,10.0.2.15,TCP,60,9001  >  34692 [ACK] Seq=89192711 Ack=4967925 Win=65535 Len=0
1,1.284621000000243,62.210.85.178,10.0.2.15,TLSv1.2,590,Application Data
1,1.3276660000001357,10.0.2.15,62.210.85.178,TCP,54,35978  >  9001 [ACK] Seq=89370599 Ack=4971237 Win=65535 Len=0
1,1.3510770000002594,62.210.85.178,10.0.2.15,TLSv1.2,590,Application Data
1,1.3511619999999311,10.0.2.15,62.210.85.178,TCP,54,35978  >  9001 [ACK] Seq=89370599 Ack=4971773 Win=65535 Len=0
1,1.4456190000000788,62.210.85.178,10.0.2.15,TLSv1.2,1104,Application Data
1,1.4457139999999526,10.0.2.15,62.210.85.178,TCP,54,35978  >  9001 [ACK] Seq=89370599 Ack=4972823 Win=65535 Len=0
1,1.4932229999999436,62.210.85.178,10.0.2.15,TLSv1.2,590,Application Data
1,1.4932960000001003,10.0.2.15,62.210.85.178,TCP,54,35978  >  9001 [ACK] Seq=89370599 Ack=4973359 Win=65535 Len=0
1,1.4938210000000254,10.0.2.15,62.210.85.178,TLSv1.2,590,Application Data
1,1.4939540000000306,62.210.85.178,10.0.2.15,TCP,60,9001  >  35978 [ACK] Seq=4973359 Ack=89371135 Win=65535 Len=0
1,1.6104629999999815,54.93.77.70,10.0.2.15,TLSv1.2,590,Application Data
1,1.6110920000000988,10.0.2.15,54.93.77.70,TLSv1.2,590,Application Data
1,1.6112120000002506,54.93.77.70,10.0.2.15,TCP,60,9001  >  34692 [ACK] Seq=89193247 Ack=4968461 Win=65535 Len=0
1,1.7119120000002113,62.210.85.178,10.0.2.15,TLSv1.2,590,Application Data
1,1.7121460000003026,10.0.2.15,62.210.85.178,TLSv1.2,590,Application Data
1,1.7122460000000501,62.210.85.178,10.0.2.15,TCP,60,9001  >  35978 [ACK] Seq=4973895 Ack=89371671 Win=65535 Len=0
1,1.7215869999999995,10.0.2.15,62.210.85.178,TLSv1.2,2646,Application Data
1,1.7217460000001665,62.210.85.178,10.0.2.15,TCP,60,9001  >  35978 [ACK] Seq=4973895 Ack=89373131 Win=65535 Len=0
1,1.7217749999999796,62.210.85.178,10.0.2.15,TCP,60,9001  >  35978 [ACK] Seq=4973895 Ack=89374263 Win=65535 Len=0
1,1.8404850000001716,54.93.77.70,10.0.2.15,TLSv1.2,3160,Application Data
1,1.840614000000187,10.0.2.15,54.93.77.70,TCP,54,34692  >  9001 [ACK] Seq=4968461 Ack=89196353 Win=65535 Len=0
1,1.8430090000001655,10.0.2.15,54.93.77.70,TLSv1.2,590,Application Data
1,1.843141000000287,54.93.77.70,10.0.2.15,TCP,60,9001  >  34692 [ACK] Seq=89196353 Ack=4968997 Win=65535 Len=0
1,1.9581499999999323,62.210.85.178,10.0.2.15,TLSv1.2,590,Application Data
1,1.9584789999998975,10.0.2.15,62.210.85.178,TLSv1.2,590,Application Data
1,1.958599999999933,62.210.85.178,10.0.2.15,TCP,60,9001  >  35978 [ACK] Seq=4974431 Ack=89374799 Win=65535 Len=0
1,2.2068349999999555,54.93.77.70,10.0.2.15,TLSv1.2,590,Application Data
1,2.2072790000001987,10.0.2.15,54.93.77.70,TLSv1.2,590,Application Data
1,2.2074149999998554,54.93.77.70,10.0.2.15,TCP,60,9001  >  34692 [ACK] Seq=89196889 Ack=4969533 Win=65535 Len=0
1,2.4121110000000954,62.210.85.178,10.0.2.15,TLSv1.2,590,Application Data
1,2.4205660000002354,10.0.2.15,62.210.85.178,TLSv1.2,590,Application Data
1,2.4212470000002213,62.210.85.178,10.0.2.15,TCP,60,9001  >  35978 [ACK] Seq=4974967 Ack=89375335 Win=65535 Len=0
1,2.4322120000001632,10.0.2.15,62.210.85.178,TLSv1.2,4124,Application Data
1,2.432365000000118,10.0.2.15,62.210.85.178,TCP,2974,35978  >  9001 [ACK] Seq=89379405 Ack=4974967 Win=65535 Len=2920 [TCP segment of a reassembled PDU]
1,2.432393999999931,62.210.85.178,10.0.2.15,TCP,60,9001  >  35978 [ACK] Seq=4974967 Ack=89376795 Win=65535 Len=0
1,2.432405000000017,62.210.85.178,10.0.2.15,TCP,60,9001  >  35978 [ACK] Seq=4974967 Ack=89378255 Win=65535 Len=0
1,2.4324099999998907,62.210.85.178,10.0.2.15,TCP,60,9001  >  35978 [ACK] Seq=4974967 Ack=89379405 Win=65535 Len=0
1,2.432452999999896,10.0.2.15,62.210.85.178,TLSv1.2,1204,Application Data
1,2.4324970000002395,62.210.85.178,10.0.2.15,TCP,60,9001  >  35978 [ACK] Seq=4974967 Ack=89380865 Win=65535 Len=0
1,2.4325039999998808,62.210.85.178,10.0.2.15,TCP,60,9001  >  35978 [ACK] Seq=4974967 Ack=89382325 Win=65535 Len=0
1,2.4325079999998707,62.210.85.178,10.0.2.15,TCP,60,9001  >  35978 [ACK] Seq=4974967 Ack=89383475 Win=65535 Len=0
1,2.432557999999972,10.0.2.15,62.210.85.178,TLSv1.2,4124,Application Data
1,2.4326230000001487,10.0.2.15,62.210.85.178,TCP,2974,35978  >  9001 [ACK] Seq=89387545 Ack=4974967 Win=65535 Len=2920 [TCP segment of a reassembled PDU]
1,2.4326630000000478,62.210.85.178,10.0.2.15,TCP,60,9001  >  35978 [ACK] Seq=4974967 Ack=89384935 Win=65535 Len=0
1,2.4326710000000276,62.210.85.178,10.0.2.15,TCP,60,9001  >  35978 [ACK] Seq=4974967 Ack=89386395 Win=65535 Len=0
1,2.4326759999999013,62.210.85.178,10.0.2.15,TCP,60,9001  >  35978 [ACK] Seq=4974967 Ack=89387545 Win=65535 Len=0
1,2.432679999999891,62.210.85.178,10.0.2.15,TCP,60,9001  >  35978 [ACK] Seq=4974967 Ack=89389005 Win=65535 Len=0
1,2.432683999999881,62.210.85.178,10.0.2.15,TCP,60,9001  >  35978 [ACK] Seq=4974967 Ack=89390465 Win=65535 Len=0
1,2.4327220000000125,10.0.2.15,62.210.85.178,TLSv1.2,1204,Application Data
1,2.4328080000000227,10.0.2.15,62.210.85.178,TLSv1.2,2974,Application Data
1,2.4328479999999217,62.210.85.178,10.0.2.15,TCP,60,9001  >  35978 [ACK] Seq=4974967 Ack=89391615 Win=65535 Len=0
1,2.432882999999947,10.0.2.15,62.210.85.178,TLSv1.2,1226,Application Data
1,2.4329200000001947,62.210.85.178,10.0.2.15,TCP,60,9001  >  35978 [ACK] Seq=4974967 Ack=89393075 Win=65535 Len=0
1,2.432925999999952,62.210.85.178,10.0.2.15,TCP,60,9001  >  35978 [ACK] Seq=4974967 Ack=89394535 Win=65535 Len=0
1,2.4329310000002806,62.210.85.178,10.0.2.15,TCP,60,9001  >  35978 [ACK] Seq=4974967 Ack=89395707 Win=65535 Len=0
1,2.432976999999937,10.0.2.15,62.210.85.178,TLSv1.2,4124,Application Data
1,2.433017000000291,62.210.85.178,10.0.2.15,TCP,60,9001  >  35978 [ACK] Seq=4974967 Ack=89397167 Win=65535 Len=0
1,2.433023999999932,62.210.85.178,10.0.2.15,TCP,60,9001  >  35978 [ACK] Seq=4974967 Ack=89398627 Win=65535 Len=0
1,2.433027999999922,62.210.85.178,10.0.2.15,TCP,60,9001  >  35978 [ACK] Seq=4974967 Ack=89399777 Win=65535 Len=0
1,2.433074999999917,10.0.2.15,62.210.85.178,TLSv1.2,3030,Application Data
1,2.433168999999907,62.210.85.178,10.0.2.15,TCP,60,9001  >  35978 [ACK] Seq=4974967 Ack=89401237 Win=65535 Len=0
1,2.433183000000099,62.210.85.178,10.0.2.15,TCP,60,9001  >  35978 [ACK] Seq=4974967 Ack=89402697 Win=65535 Len=0
1,2.433187000000089,62.210.85.178,10.0.2.15,TCP,60,9001  >  35978 [ACK] Seq=4974967 Ack=89402753 Win=65535 Len=0
1,2.4422910000002958,10.0.2.15,62.210.85.178,TLSv1.2,4124,Application Data
1,2.44237000000021,10.0.2.15,62.210.85.178,TCP,2974,35978  >  9001 [ACK] Seq=89406823 Ack=4974967 Win=65535 Len=2920 [TCP segment of a reassembled PDU]
1,2.442410000000109,62.210.85.178,10.0.2.15,TCP,60,9001  >  35978 [ACK] Seq=4974967 Ack=89404213 Win=65535 Len=0
1,2.442417000000205,62.210.85.178,10.0.2.15,TCP,60,9001  >  35978 [ACK] Seq=4974967 Ack=89405673 Win=65535 Len=0
1,2.442421000000195,62.210.85.178,10.0.2.15,TCP,60,9001  >  35978 [ACK] Seq=4974967 Ack=89406823 Win=65535 Len=0
1,2.4424260000000686,62.210.85.178,10.0.2.15,TCP,60,9001  >  35978 [ACK] Seq=4974967 Ack=89408283 Win=65535 Len=0
1,2.4424300000000585,62.210.85.178,10.0.2.15,TCP,60,9001  >  35978 [ACK] Seq=4974967 Ack=89409743 Win=65535 Len=0
1,2.4424739999999474,10.0.2.15,62.210.85.178,TLSv1.2,1204,Application Data
1,2.442540000000008,10.0.2.15,62.210.85.178,TCP,2974,35978  >  9001 [ACK] Seq=89410893 Ack=4974967 Win=65535 Len=2920 [TCP segment of a reassembled PDU]
1,2.4425780000001396,62.210.85.178,10.0.2.15,TCP,60,9001  >  35978 [ACK] Seq=4974967 Ack=89410893 Win=65535 Len=0
1,2.4425850000002356,62.210.85.178,10.0.2.15,TCP,60,9001  >  35978 [ACK] Seq=4974967 Ack=89412353 Win=65535 Len=0
1,2.4425890000002255,62.210.85.178,10.0.2.15,TCP,60,9001  >  35978 [ACK] Seq=4974967 Ack=89413813 Win=65535 Len=0
1,2.4426229999999123,10.0.2.15,62.210.85.178,TLSv1.2,1204,Application Data
1,2.4426870000002054,10.0.2.15,62.210.85.178,TCP,2974,35978  >  9001 [ACK] Seq=89414963 Ack=4974967 Win=65535 Len=2920 [TCP segment of a reassembled PDU]
1,2.4427239999999983,62.210.85.178,10.0.2.15,TCP,60,9001  >  35978 [ACK] Seq=4974967 Ack=89414963 Win=65535 Len=0
1,2.4427310000000944,62.210.85.178,10.0.2.15,TCP,60,9001  >  35978 [ACK] Seq=4974967 Ack=89416423 Win=65535 Len=0
1,2.4427350000000843,62.210.85.178,10.0.2.15,TCP,60,9001  >  35978 [ACK] Seq=4974967 Ack=89417883 Win=65535 Len=0
1,2.4427660000001197,10.0.2.15,62.210.85.178,TLSv1.2,1204,Application Data
1,2.4428579999998874,10.0.2.15,62.210.85.178,TLSv1.2,2974,Application Data
1,2.442884999999933,62.210.85.178,10.0.2.15,TCP,60,9001  >  35978 [ACK] Seq=4974967 Ack=89419033 Win=65535 Len=0
1,2.4429159999999683,10.0.2.15,62.210.85.178,TLSv1.2,1226,Application Data
1,2.4429540000000998,62.210.85.178,10.0.2.15,TCP,60,9001  >  35978 [ACK] Seq=4974967 Ack=89420493 Win=65535 Len=0
1,2.4429599999998572,62.210.85.178,10.0.2.15,TCP,60,9001  >  35978 [ACK] Seq=4974967 Ack=89421953 Win=65535 Len=0
1,2.442964000000302,62.210.85.178,10.0.2.15,TCP,60,9001  >  35978 [ACK] Seq=4974967 Ack=89423125 Win=65535 Len=0
1,2.443008000000191,10.0.2.15,62.210.85.178,TLSv1.2,3994,Application Data
1,2.4430489999999736,62.210.85.178,10.0.2.15,TCP,60,9001  >  35978 [ACK] Seq=4974967 Ack=89424585 Win=65535 Len=0
1,2.4430560000000696,62.210.85.178,10.0.2.15,TCP,60,9001  >  35978 [ACK] Seq=4974967 Ack=89426045 Win=65535 Len=0
1,2.4430609999999433,62.210.85.178,10.0.2.15,TCP,60,9001  >  35978 [ACK] Seq=4974967 Ack=89427065 Win=65535 Len=0
1,2.5574639999999818,54.93.77.70,10.0.2.15,TLSv1.2,3674,Application Data
1,2.5576089999999567,10.0.2.15,54.93.77.70,TCP,54,34692  >  9001 [ACK] Seq=4969533 Ack=89200509 Win=65535 Len=0
1,2.594926000000214,54.93.77.70,10.0.2.15,TLSv1.2,5846,Application Data
1,2.5949860000000626,54.93.77.70,10.0.2.15,TCP,1474,9001  >  34692 [ACK] Seq=89206301 Ack=4969533 Win=65535 Len=1420 [TCP segment of a reassembled PDU]
1,2.5950659999998607,10.0.2.15,54.93.77.70,TCP,54,34692  >  9001 [ACK] Seq=4969533 Ack=89207721 Win=65535 Len=0
1,2.5951270000000477,54.93.77.70,10.0.2.15,TLSv1.2,1132,"Application Data, Application Data"
1,2.6080799999999726,54.93.77.70,10.0.2.15,TLSv1.2,5846,Application Data
1,2.6081490000001395,10.0.2.15,54.93.77.70,TCP,54,34692  >  9001 [ACK] Seq=4969533 Ack=89214591 Win=65535 Len=0
1,2.6141379999999117,54.93.77.70,10.0.2.15,TLSv1.2,5846,Application Data [TCP segment of a reassembled PDU]
1,2.6141780000002655,54.93.77.70,10.0.2.15,TLSv1.2,5028,"Application Data, Application Data, Application Data"
1,2.614235000000008,10.0.2.15,54.93.77.70,TCP,54,34692  >  9001 [ACK] Seq=4969533 Ack=89220383 Win=65535 Len=0
1,2.6143379999998615,10.0.2.15,54.93.77.70,TCP,54,34692  >  9001 [ACK] Seq=4969533 Ack=89225357 Win=65535 Len=0
1,2.614618999999948,10.0.2.15,54.93.77.70,TLSv1.2,590,Application Data
1,2.6146899999998823,54.93.77.70,10.0.2.15,TCP,60,9001  >  34692 [ACK] Seq=89225357 Ack=4970069 Win=65535 Len=0
1,2.6149890000001506,54.93.77.70,10.0.2.15,TCP,1502,"9001  >  34692 [PSH, ACK] Seq=89225357 Ack=4970069 Win=65535 Len=1448 [TCP segment of a reassembled PDU]"
1,2.6150250000000597,10.0.2.15,54.93.77.70,TCP,54,34692  >  9001 [ACK] Seq=4970069 Ack=89226805 Win=65535 Len=0
1,2.6199870000000374,54.93.77.70,10.0.2.15,TLSv1.2,2950,Application Data [TCP segment of a reassembled PDU]
1,2.620046999999886,10.0.2.15,54.93.77.70,TCP,54,34692  >  9001 [ACK] Seq=4970069 Ack=89229701 Win=65535 Len=0
1,2.621172000000115,54.93.77.70,10.0.2.15,TCP,1502,"9001  >  34692 [PSH, ACK] Seq=89229701 Ack=4970069 Win=65535 Len=1448 [TCP segment of a reassembled PDU]"
1,2.6212140000002364,10.0.2.15,54.93.77.70,TCP,54,34692  >  9001 [ACK] Seq=4970069 Ack=89231149 Win=65535 Len=0
1,2.630130999999892,54.93.77.70,10.0.2.15,TLSv1.2,1010,"Application Data, Application Data"
1,2.6402689999999893,54.93.77.70,10.0.2.15,TLSv1.2,4398,Application Data
1,2.640346000000136,10.0.2.15,54.93.77.70,TCP,54,34692  >  9001 [ACK] Seq=4970069 Ack=89236449 Win=65535 Len=0
1,2.641171000000213,54.93.77.70,10.0.2.15,TLSv1.2,7294,Application Data [TCP segment of a reassembled PDU]
1,2.641239999999925,10.0.2.15,54.93.77.70,TCP,54,34692  >  9001 [ACK] Seq=4970069 Ack=89243689 Win=65535 Len=0
1,2.6413790000001427,10.0.2.15,54.93.77.70,TLSv1.2,590,Application Data
1,2.6414460000000872,54.93.77.70,10.0.2.15,TCP,60,9001  >  34692 [ACK] Seq=89243689 Ack=4970605 Win=65535 Len=0
1,2.647324000000026,54.93.77.70,10.0.2.15,TLSv1.2,894,"Application Data, Application Data"
1,2.6515010000002803,54.93.77.70,10.0.2.15,TCP,2950,"9001  >  34692 [PSH, ACK] Seq=89244529 Ack=4970605 Win=65535 Len=2896 [TCP segment of a reassembled PDU]"
1,2.6515549999999166,10.0.2.15,54.93.77.70,TCP,54,34692  >  9001 [ACK] Seq=4970605 Ack=89247425 Win=65535 Len=0
1,2.6580360000002656,54.93.77.70,10.0.2.15,TLSv1.2,1502,Application Data [TCP segment of a reassembled PDU]
1,2.658077999999932,10.0.2.15,54.93.77.70,TCP,54,34692  >  9001 [ACK] Seq=4970605 Ack=89248873 Win=65535 Len=0
1,2.6678729999998723,54.93.77.70,10.0.2.15,TLSv1.2,380,Application Data
1,2.6680679999999484,10.0.2.15,54.93.77.70,TLSv1.2,590,Application Data
1,2.668149000000085,54.93.77.70,10.0.2.15,TCP,60,9001  >  34692 [ACK] Seq=89249199 Ack=4971141 Win=65535 Len=0
1,2.677541999999903,10.0.2.15,54.93.77.70,TLSv1.2,590,Application Data
1,2.677672000000257,54.93.77.70,10.0.2.15,TCP,60,9001  >  34692 [ACK] Seq=89249199 Ack=4971677 Win=65535 Len=0
1,2.722475999999915,62.210.85.178,10.0.2.15,TLSv1.2,590,Application Data
1,2.7631830000000264,10.0.2.15,62.210.85.178,TCP,54,35978  >  9001 [ACK] Seq=89427065 Ack=4975503 Win=65535 Len=0
1,2.786540000000059,62.210.85.178,10.0.2.15,TLSv1.2,590,Application Data
1,2.7866370000001552,10.0.2.15,62.210.85.178,TCP,54,35978  >  9001 [ACK] Seq=89427065 Ack=4976039 Win=65535 Len=0
1,2.8235090000002856,62.210.85.178,10.0.2.15,TLSv1.2,1104,Application Data
1,2.823609000000033,10.0.2.15,62.210.85.178,TCP,54,35978  >  9001 [ACK] Seq=89427065 Ack=4977089 Win=65535 Len=0
1,2.824199000000135,10.0.2.15,62.210.85.178,TLSv1.2,590,Application Data
1,2.824329999999918,62.210.85.178,10.0.2.15,TCP,60,9001  >  35978 [ACK] Seq=4977089 Ack=89427601 Win=65535 Len=0
1,2.9499500000001717,54.93.77.70,10.0.2.15,TLSv1.2,590,Application Data
1,2.9503359999998793,10.0.2.15,54.93.77.70,TLSv1.2,590,Application Data
1,2.9504420000002938,54.93.77.70,10.0.2.15,TCP,60,9001  >  34692 [ACK] Seq=89249735 Ack=4972213 Win=65535 Len=0
1,3.0610700000002,62.210.85.178,10.0.2.15,TLSv1.2,590,Application Data
1,3.066424999999981,10.0.2.15,62.210.85.178,TLSv1.2,590,Application Data
1,3.0665760000001683,62.210.85.178,10.0.2.15,TCP,60,9001  >  35978 [ACK] Seq=4977625 Ack=89428137 Win=65535 Len=0
1,3.076759000000038,10.0.2.15,62.210.85.178,TLSv1.2,4124,Application Data
1,3.076853999999912,10.0.2.15,62.210.85.178,TCP,2974,35978  >  9001 [ACK] Seq=89432207 Ack=4977625 Win=65535 Len=2920 [TCP segment of a reassembled PDU]
1,3.0768960000000334,62.210.85.178,10.0.2.15,TCP,60,9001  >  35978 [ACK] Seq=4977625 Ack=89429597 Win=65535 Len=0
1,3.0769060000002355,62.210.85.178,10.0.2.15,TCP,60,9001  >  35978 [ACK] Seq=4977625 Ack=89431057 Win=65535 Len=0
1,3.076908999999887,62.210.85.178,10.0.2.15,TCP,60,9001  >  35978 [ACK] Seq=4977625 Ack=89432207 Win=65535 Len=0
1,3.076911999999993,62.210.85.178,10.0.2.15,TCP,60,9001  >  35978 [ACK] Seq=4977625 Ack=89433667 Win=65535 Len=0
1,3.076915000000099,62.210.85.178,10.0.2.15,TCP,60,9001  >  35978 [ACK] Seq=4977625 Ack=89435127 Win=65535 Len=0
1,3.076947999999902,10.0.2.15,62.210.85.178,TLSv1.2,1204,Application Data
1,3.0770120000001953,62.210.85.178,10.0.2.15,TCP,60,9001  >  35978 [ACK] Seq=4977625 Ack=89436277 Win=65535 Len=0
1,3.07707500000015,10.0.2.15,62.210.85.178,TLSv1.2,4124,Application Data
1,3.077135999999882,62.210.85.178,10.0.2.15,TCP,60,9001  >  35978 [ACK] Seq=4977625 Ack=89437737 Win=65535 Len=0
1,3.0771450000002005,62.210.85.178,10.0.2.15,TCP,60,9001  >  35978 [ACK] Seq=4977625 Ack=89439197 Win=65535 Len=0
1,3.0771480000003066,62.210.85.178,10.0.2.15,TCP,60,9001  >  35978 [ACK] Seq=4977625 Ack=89440347 Win=65535 Len=0
1,3.0771960000001854,10.0.2.15,62.210.85.178,TLSv1.2,4124,Application Data
1,3.077233999999862,62.210.85.178,10.0.2.15,TCP,60,9001  >  35978 [ACK] Seq=4977625 Ack=89441807 Win=65535 Len=0
1,3.077240999999958,62.210.85.178,10.0.2.15,TCP,60,9001  >  35978 [ACK] Seq=4977625 Ack=89443267 Win=65535 Len=0
1,3.0772799999999734,62.210.85.178,10.0.2.15,TCP,60,9001  >  35978 [ACK] Seq=4977625 Ack=89444417 Win=65535 Len=0
1,3.077313000000231,10.0.2.15,62.210.85.178,TLSv1.2,332,Application Data
1,3.0773450000001503,62.210.85.178,10.0.2.15,TCP,60,9001  >  35978 [ACK] Seq=4977625 Ack=89444695 Win=65535 Len=0
1,3.077400000000125,10.0.2.15,62.210.85.178,TLSv1.2,3868,Application Data
1,3.0774390000001404,62.210.85.178,10.0.2.15,TCP,60,9001  >  35978 [ACK] Seq=4977625 Ack=89446155 Win=65535 Len=0
1,3.0774460000002364,62.210.85.178,10.0.2.15,TCP,60,9001  >  35978 [ACK] Seq=4977625 Ack=89447615 Win=65535 Len=0
1,3.0774489999998877,62.210.85.178,10.0.2.15,TCP,60,9001  >  35978 [ACK] Seq=4977625 Ack=89448509 Win=65535 Len=0
1,3.077487000000019,10.0.2.15,62.210.85.178,TLSv1.2,4124,Application Data
1,3.0775220000000445,62.210.85.178,10.0.2.15,TCP,60,9001  >  35978 [ACK] Seq=4977625 Ack=89449969 Win=65535 Len=0
1,3.0775280000002567,62.210.85.178,10.0.2.15,TCP,60,9001  >  35978 [ACK] Seq=4977625 Ack=89451429 Win=65535 Len=0
1,3.077530999999908,62.210.85.178,10.0.2.15,TCP,60,9001  >  35978 [ACK] Seq=4977625 Ack=89452579 Win=65535 Len=0
1,3.0775650000000496,10.0.2.15,62.210.85.178,TLSv1.2,3030,Application Data
1,3.077600000000075,62.210.85.178,10.0.2.15,TCP,60,9001  >  35978 [ACK] Seq=4977625 Ack=89454039 Win=65535 Len=0
1,3.077606000000287,62.210.85.178,10.0.2.15,TCP,60,9001  >  35978 [ACK] Seq=4977625 Ack=89455499 Win=65535 Len=0
1,3.0776089999999385,62.210.85.178,10.0.2.15,TCP,60,9001  >  35978 [ACK] Seq=4977625 Ack=89455555 Win=65535 Len=0
1,3.0868359999999484,10.0.2.15,62.210.85.178,TLSv1.2,4124,Application Data
1,3.0869109999998727,62.210.85.178,10.0.2.15,TCP,60,9001  >  35978 [ACK] Seq=4977625 Ack=89457015 Win=65535 Len=0
1,3.0869190000003073,62.210.85.178,10.0.2.15,TCP,60,9001  >  35978 [ACK] Seq=4977625 Ack=89458475 Win=65535 Len=0
1,3.0869219999999586,62.210.85.178,10.0.2.15,TCP,60,9001  >  35978 [ACK] Seq=4977625 Ack=89459625 Win=65535 Len=0
1,3.0869619999998577,10.0.2.15,62.210.85.178,TLSv1.2,4124,Application Data
1,3.087014000000181,62.210.85.178,10.0.2.15,TCP,60,9001  >  35978 [ACK] Seq=4977625 Ack=89461085 Win=65535 Len=0
1,3.087022000000161,62.210.85.178,10.0.2.15,TCP,60,9001  >  35978 [ACK] Seq=4977625 Ack=89462545 Win=65535 Len=0
1,3.087025000000267,62.210.85.178,10.0.2.15,TCP,60,9001  >  35978 [ACK] Seq=4977625 Ack=89463695 Win=65535 Len=0
1,3.087061000000176,10.0.2.15,62.210.85.178,TLSv1.2,4124,Application Data
1,3.087116000000151,62.210.85.178,10.0.2.15,TCP,60,9001  >  35978 [ACK] Seq=4977625 Ack=89465155 Win=65535 Len=0
1,3.0871259999998983,62.210.85.178,10.0.2.15,TCP,60,9001  >  35978 [ACK] Seq=4977625 Ack=89466615 Win=65535 Len=0
1,3.0871290000000045,62.210.85.178,10.0.2.15,TCP,60,9001  >  35978 [ACK] Seq=4977625 Ack=89467765 Win=65535 Len=0
1,3.087171000000126,10.0.2.15,62.210.85.178,TLSv1.2,4124,Application Data
1,3.0872079999999187,62.210.85.178,10.0.2.15,TCP,60,9001  >  35978 [ACK] Seq=4977625 Ack=89469225 Win=65535 Len=0
1,3.087217000000237,62.210.85.178,10.0.2.15,TCP,60,9001  >  35978 [ACK] Seq=4977625 Ack=89470685 Win=65535 Len=0
1,3.0872199999998884,62.210.85.178,10.0.2.15,TCP,60,9001  >  35978 [ACK] Seq=4977625 Ack=89471835 Win=65535 Len=0
1,3.0872549999999137,10.0.2.15,62.210.85.178,TLSv1.2,332,Application Data
1,3.0872890000000552,62.210.85.178,10.0.2.15,TCP,60,9001  >  35978 [ACK] Seq=4977625 Ack=89472113 Win=65535 Len=0
1,3.0873390000001564,10.0.2.15,62.210.85.178,TLSv1.2,3868,Application Data
1,3.0873750000000655,62.210.85.178,10.0.2.15,TCP,60,9001  >  35978 [ACK] Seq=4977625 Ack=89473573 Win=65535 Len=0
1,3.0873820000001615,62.210.85.178,10.0.2.15,TCP,60,9001  >  35978 [ACK] Seq=4977625 Ack=89475033 Win=65535 Len=0
1,3.0873850000002676,62.210.85.178,10.0.2.15,TCP,60,9001  >  35978 [ACK] Seq=4977625 Ack=89475927 Win=65535 Len=0
1,3.0874220000000605,10.0.2.15,62.210.85.178,TLSv1.2,4124,Application Data
1,3.0874579999999696,62.210.85.178,10.0.2.15,TCP,60,9001  >  35978 [ACK] Seq=4977625 Ack=89477387 Win=65535 Len=0
1,3.087464000000182,62.210.85.178,10.0.2.15,TCP,60,9001  >  35978 [ACK] Seq=4977625 Ack=89478847 Win=65535 Len=0
1,3.087467000000288,62.210.85.178,10.0.2.15,TCP,60,9001  >  35978 [ACK] Seq=4977625 Ack=89479997 Win=65535 Len=0
1,3.0875019999998585,10.0.2.15,62.210.85.178,TLSv1.2,2516,Application Data
1,3.087536,62.210.85.178,10.0.2.15,TCP,60,9001  >  35978 [ACK] Seq=4977625 Ack=89481457 Win=65535 Len=0
1,3.087543000000096,62.210.85.178,10.0.2.15,TCP,60,9001  >  35978 [ACK] Seq=4977625 Ack=89482459 Win=65535 Len=0
1,3.1853690000002644,54.93.77.70,10.0.2.15,TLSv1.2,3674,Application Data
1,3.1855239999999867,10.0.2.15,54.93.77.70,TCP,54,34692  >  9001 [ACK] Seq=4972213 Ack=89253355 Win=65535 Len=0
1,3.19371000000001,54.93.77.70,10.0.2.15,TCP,2950,"9001  >  34692 [PSH, ACK] Seq=89253355 Ack=4972213 Win=65535 Len=2896 [TCP segment of a reassembled PDU]"
1,3.193796999999904,10.0.2.15,54.93.77.70,TCP,54,34692  >  9001 [ACK] Seq=4972213 Ack=89256251 Win=65535 Len=0
1,3.1944830000002185,54.93.77.70,10.0.2.15,TLSv1.2,4398,Application Data [TCP segment of a reassembled PDU]
1,3.1945590000000266,10.0.2.15,54.93.77.70,TCP,54,34692  >  9001 [ACK] Seq=4972213 Ack=89260595 Win=65535 Len=0
1,3.2012869999998657,54.93.77.70,10.0.2.15,TLSv1.2,568,Application Data
1,3.2159420000002683,54.93.77.70,10.0.2.15,TLSv1.2,5846,Application Data
1,3.2162990000001628,54.93.77.70,10.0.2.15,TLSv1.2,2950,Application Data [TCP segment of a reassembled PDU]
1,3.2165020000002187,10.0.2.15,54.93.77.70,TCP,54,34692  >  9001 [ACK] Seq=4972213 Ack=89269797 Win=65535 Len=0
1,3.2223469999998997,54.93.77.70,10.0.2.15,TLSv1.2,7294,"Application Data, Application Data"
1,3.2224260000002687,10.0.2.15,54.93.77.70,TCP,54,34692  >  9001 [ACK] Seq=4972213 Ack=89277037 Win=65535 Len=0
1,3.233028000000104,54.93.77.70,10.0.2.15,TLSv1.2,684,Application Data
1,3.2332580000002054,10.0.2.15,54.93.77.70,TLSv1.2,590,Application Data
1,3.233367000000271,54.93.77.70,10.0.2.15,TCP,60,9001  >  34692 [ACK] Seq=89277667 Ack=4972749 Win=65535 Len=0
1,3.2419629999999415,54.93.77.70,10.0.2.15,TCP,2950,"9001  >  34692 [PSH, ACK] Seq=89277667 Ack=4972749 Win=65535 Len=2896 [TCP segment of a reassembled PDU]"
1,3.242037999999866,10.0.2.15,54.93.77.70,TCP,54,34692  >  9001 [ACK] Seq=4972749 Ack=89280563 Win=65535 Len=0
1,3.2532200000000557,54.93.77.70,10.0.2.15,TLSv1.2,778,Application Data
1,3.253266000000167,54.93.77.70,10.0.2.15,TLSv1.2,11638,"Application Data, Application Data"
1,3.253356000000167,10.0.2.15,54.93.77.70,TCP,54,34692  >  9001 [ACK] Seq=4972749 Ack=89292871 Win=65535 Len=0
1,3.2706080000002657,54.93.77.70,10.0.2.15,TLSv1.2,1430,"Application Data, Application Data, Application Data"
1,3.2708270000002813,10.0.2.15,54.93.77.70,TLSv1.2,590,Application Data
1,3.270966999999928,54.93.77.70,10.0.2.15,TCP,60,9001  >  34692 [ACK] Seq=89294247 Ack=4973285 Win=65535 Len=0
1,3.283596000000216,54.93.77.70,10.0.2.15,TLSv1.2,5846,Application Data
1,3.283680000000004,10.0.2.15,54.93.77.70,TCP,54,34692  >  9001 [ACK] Seq=4973285 Ack=89300039 Win=65535 Len=0
1,3.2846870000003037,54.93.77.70,10.0.2.15,TLSv1.2,4398,Application Data [TCP segment of a reassembled PDU]
1,3.2847320000000764,10.0.2.15,54.93.77.70,TCP,54,34692  >  9001 [ACK] Seq=4973285 Ack=89304383 Win=65535 Len=0
1,3.2870630000002166,54.93.77.70,10.0.2.15,TLSv1.2,264,Application Data
1,3.2872729999999137,10.0.2.15,54.93.77.70,TLSv1.2,590,Application Data
1,3.287391000000298,54.93.77.70,10.0.2.15,TCP,60,9001  >  34692 [ACK] Seq=89304593 Ack=4973821 Win=65535 Len=0
1,3.296845000000303,10.0.2.15,54.93.77.70,TLSv1.2,590,Application Data
1,3.297034000000167,54.93.77.70,10.0.2.15,TCP,60,9001  >  34692 [ACK] Seq=89304593 Ack=4974357 Win=65535 Len=0
1,3.3228440000002593,62.210.85.178,10.0.2.15,TLSv1.2,590,Application Data
1,3.3631970000001274,10.0.2.15,62.210.85.178,TCP,54,35978  >  9001 [ACK] Seq=89482459 Ack=4978161 Win=65535 Len=0
1,3.7424909999999727,62.210.85.178,10.0.2.15,TLSv1.2,590,Application Data
1,3.7425670000002356,10.0.2.15,62.210.85.178,TCP,54,35978  >  9001 [ACK] Seq=89482459 Ack=4978697 Win=65535 Len=0
1,3.74545500000022,62.210.85.178,10.0.2.15,TLSv1.2,1104,Application Data
1,3.745496000000003,10.0.2.15,62.210.85.178,TCP,54,35978  >  9001 [ACK] Seq=89482459 Ack=4979747 Win=65535 Len=0
1,3.745918999999958,10.0.2.15,62.210.85.178,TLSv1.2,590,Application Data
1,3.7460140000002866,62.210.85.178,10.0.2.15,TCP,60,9001  >  35978 [ACK] Seq=4979747 Ack=89482995 Win=65535 Len=0
1,3.8582400000000234,54.93.77.70,10.0.2.15,TLSv1.2,590,Application Data
1,3.858618000000206,10.0.2.15,54.93.77.70,TLSv1.2,590,Application Data
1,3.8587330000000293,54.93.77.70,10.0.2.15,TCP,60,9001  >  34692 [ACK] Seq=89305129 Ack=4974893 Win=65535 Len=0
1,3.9636430000000473,62.210.85.178,10.0.2.15,TLSv1.2,590,Application Data
1,3.968685000000278,10.0.2.15,62.210.85.178,TLSv1.2,590,Application Data
1,3.9688500000002023,62.210.85.178,10.0.2.15,TCP,60,9001  >  35978 [ACK] Seq=4980283 Ack=89483531 Win=65535 Len=0
1,3.984183999999914,10.0.2.15,62.210.85.178,TLSv1.2,4124,Application Data
1,3.984291000000212,10.0.2.15,62.210.85.178,TCP,2974,35978  >  9001 [ACK] Seq=89487601 Ack=4980283 Win=65535 Len=2920 [TCP segment of a reassembled PDU]
1,3.9843329999998787,62.210.85.178,10.0.2.15,TCP,60,9001  >  35978 [ACK] Seq=4980283 Ack=89484991 Win=65535 Len=0
1,3.9843510000000606,62.210.85.178,10.0.2.15,TCP,60,9001  >  35978 [ACK] Seq=4980283 Ack=89486451 Win=65535 Len=0
1,3.9843559999999343,62.210.85.178,10.0.2.15,TCP,60,9001  >  35978 [ACK] Seq=4980283 Ack=89487601 Win=65535 Len=0
1,3.9843580000001566,62.210.85.178,10.0.2.15,TCP,60,9001  >  35978 [ACK] Seq=4980283 Ack=89489061 Win=65535 Len=0
1,3.9843610000002627,62.210.85.178,10.0.2.15,TCP,60,9001  >  35978 [ACK] Seq=4980283 Ack=89490521 Win=65535 Len=0
1,3.984396000000288,10.0.2.15,62.210.85.178,TLSv1.2,1204,Application Data
1,3.984429999999975,62.210.85.178,10.0.2.15,TCP,60,9001  >  35978 [ACK] Seq=4980283 Ack=89491671 Win=65535 Len=0
1,3.9844750000002023,10.0.2.15,62.210.85.178,TLSv1.2,4124,Application Data
1,3.9845100000002276,62.210.85.178,10.0.2.15,TCP,60,9001  >  35978 [ACK] Seq=4980283 Ack=89493131 Win=65535 Len=0
1,3.9845180000002074,62.210.85.178,10.0.2.15,TCP,60,9001  >  35978 [ACK] Seq=4980283 Ack=89494591 Win=65535 Len=0
1,3.984523000000081,62.210.85.178,10.0.2.15,TCP,60,9001  >  35978 [ACK] Seq=4980283 Ack=89495741 Win=65535 Len=0
1,3.9845620000000963,10.0.2.15,62.210.85.178,TLSv1.2,4124,Application Data
1,3.984596000000238,62.210.85.178,10.0.2.15,TCP,60,9001  >  35978 [ACK] Seq=4980283 Ack=89497201 Win=65535 Len=0
1,3.984602999999879,62.210.85.178,10.0.2.15,TCP,60,9001  >  35978 [ACK] Seq=4980283 Ack=89498661 Win=65535 Len=0
1,3.9846419999998943,62.210.85.178,10.0.2.15,TCP,60,9001  >  35978 [ACK] Seq=4980283 Ack=89499811 Win=65535 Len=0
1,3.984675000000152,10.0.2.15,62.210.85.178,TLSv1.2,332,Application Data
1,3.984707999999955,62.210.85.178,10.0.2.15,TCP,60,9001  >  35978 [ACK] Seq=4980283 Ack=89500089 Win=65535 Len=0
1,3.9847610000001623,10.0.2.15,62.210.85.178,TLSv1.2,3868,Application Data
1,3.984797999999955,62.210.85.178,10.0.2.15,TCP,60,9001  >  35978 [ACK] Seq=4980283 Ack=89501549 Win=65535 Len=0
1,3.9848040000001674,62.210.85.178,10.0.2.15,TCP,60,9001  >  35978 [ACK] Seq=4980283 Ack=89503009 Win=65535 Len=0
1,3.9848070000002735,62.210.85.178,10.0.2.15,TCP,60,9001  >  35978 [ACK] Seq=4980283 Ack=89503903 Win=65535 Len=0
1,3.9848440000000664,10.0.2.15,62.210.85.178,TLSv1.2,4124,Application Data
1,3.9848790000000918,62.210.85.178,10.0.2.15,TCP,60,9001  >  35978 [ACK] Seq=4980283 Ack=89505363 Win=65535 Len=0
1,3.984885000000304,62.210.85.178,10.0.2.15,TCP,60,9001  >  35978 [ACK] Seq=4980283 Ack=89506823 Win=65535 Len=0
1,3.9848879999999554,62.210.85.178,10.0.2.15,TCP,60,9001  >  35978 [ACK] Seq=4980283 Ack=89507973 Win=65535 Len=0
1,3.9849229999999807,10.0.2.15,62.210.85.178,TLSv1.2,3030,Application Data
1,3.984957000000122,62.210.85.178,10.0.2.15,TCP,60,9001  >  35978 [ACK] Seq=4980283 Ack=89509433 Win=65535 Len=0
1,3.984964000000218,62.210.85.178,10.0.2.15,TCP,60,9001  >  35978 [ACK] Seq=4980283 Ack=89510893 Win=65535 Len=0
1,3.984965999999986,62.210.85.178,10.0.2.15,TCP,60,9001  >  35978 [ACK] Seq=4980283 Ack=89510949 Win=65535 Len=0
1,3.994216999999935,10.0.2.15,62.210.85.178,TLSv1.2,4124,Application Data
1,3.9943590000002587,62.210.85.178,10.0.2.15,TCP,60,9001  >  35978 [ACK] Seq=4980283 Ack=89512409 Win=65535 Len=0
1,3.9943710000002284,62.210.85.178,10.0.2.15,TCP,60,9001  >  35978 [ACK] Seq=4980283 Ack=89513869 Win=65535 Len=0
1,3.9943750000002183,62.210.85.178,10.0.2.15,TCP,60,9001  >  35978 [ACK] Seq=4980283 Ack=89515019 Win=65535 Len=0
1,3.9944220000002133,10.0.2.15,62.210.85.178,TLSv1.2,4124,Application Data
1,3.994485000000168,62.210.85.178,10.0.2.15,TCP,60,9001  >  35978 [ACK] Seq=4980283 Ack=89516479 Win=65535 Len=0
1,3.994492000000264,62.210.85.178,10.0.2.15,TCP,60,9001  >  35978 [ACK] Seq=4980283 Ack=89517939 Win=65535 Len=0
1,3.9944949999999153,62.210.85.178,10.0.2.15,TCP,60,9001  >  35978 [ACK] Seq=4980283 Ack=89519089 Win=65535 Len=0
1,3.9945299999999406,10.0.2.15,62.210.85.178,TLSv1.2,4124,Application Data
1,3.994564000000082,62.210.85.178,10.0.2.15,TCP,60,9001  >  35978 [ACK] Seq=4980283 Ack=89520549 Win=65535 Len=0
1,3.994572000000062,62.210.85.178,10.0.2.15,TCP,60,9001  >  35978 [ACK] Seq=4980283 Ack=89522009 Win=65535 Len=0
1,3.994576000000052,62.210.85.178,10.0.2.15,TCP,60,9001  >  35978 [ACK] Seq=4980283 Ack=89523159 Win=65535 Len=0
1,3.9946130000002995,10.0.2.15,62.210.85.178,TLSv1.2,4124,Application Data
1,3.9946460000001025,62.210.85.178,10.0.2.15,TCP,60,9001  >  35978 [ACK] Seq=4980283 Ack=89524619 Win=65535 Len=0
1,3.9946540000000823,62.210.85.178,10.0.2.15,TCP,60,9001  >  35978 [ACK] Seq=4980283 Ack=89526079 Win=65535 Len=0
1,3.994658000000072,62.210.85.178,10.0.2.15,TCP,60,9001  >  35978 [ACK] Seq=4980283 Ack=89527229 Win=65535 Len=0
1,3.9946920000002137,10.0.2.15,62.210.85.178,TLSv1.2,332,Application Data
1,3.994727000000239,62.210.85.178,10.0.2.15,TCP,60,9001  >  35978 [ACK] Seq=4980283 Ack=89527507 Win=65535 Len=0
1,3.9947790000001078,10.0.2.15,62.210.85.178,TLSv1.2,3868,Application Data
1,3.994815000000017,62.210.85.178,10.0.2.15,TCP,60,9001  >  35978 [ACK] Seq=4980283 Ack=89528967 Win=65535 Len=0
1,3.994822000000113,62.210.85.178,10.0.2.15,TCP,60,9001  >  35978 [ACK] Seq=4980283 Ack=89530427 Win=65535 Len=0
1,3.994825000000219,62.210.85.178,10.0.2.15,TCP,60,9001  >  35978 [ACK] Seq=4980283 Ack=89531321 Win=65535 Len=0
1,3.994862000000012,10.0.2.15,62.210.85.178,TLSv1.2,4124,Application Data
1,3.9948960000001534,62.210.85.178,10.0.2.15,TCP,60,9001  >  35978 [ACK] Seq=4980283 Ack=89532781 Win=65535 Len=0
1,3.994901999999911,62.210.85.178,10.0.2.15,TCP,60,9001  >  35978 [ACK] Seq=4980283 Ack=89534241 Win=65535 Len=0
1,3.994905000000017,62.210.85.178,10.0.2.15,TCP,60,9001  >  35978 [ACK] Seq=4980283 Ack=89535391 Win=65535 Len=0
1,3.9949390000001586,10.0.2.15,62.210.85.178,TLSv1.2,3030,Application Data
1,3.994974000000184,62.210.85.178,10.0.2.15,TCP,60,9001  >  35978 [ACK] Seq=4980283 Ack=89536851 Win=65535 Len=0
1,3.9949799999999414,62.210.85.178,10.0.2.15,TCP,60,9001  >  35978 [ACK] Seq=4980283 Ack=89538311 Win=65535 Len=0
1,3.9949830000000475,62.210.85.178,10.0.2.15,TCP,60,9001  >  35978 [ACK] Seq=4980283 Ack=89538367 Win=65535 Len=0
1,4.007543000000169,10.0.2.15,62.210.85.178,TLSv1.2,1618,Application Data
1,4.007626000000073,62.210.85.178,10.0.2.15,TCP,60,9001  >  35978 [ACK] Seq=4980283 Ack=89539827 Win=65535 Len=0
1,4.007637000000159,62.210.85.178,10.0.2.15,TCP,60,9001  >  35978 [ACK] Seq=4980283 Ack=89539931 Win=65535 Len=0
1,4.111517000000276,54.93.77.70,10.0.2.15,TLSv1.2,590,Application Data
1,4.121828000000278,54.93.77.70,10.0.2.15,TCP,2950,"9001  >  34692 [PSH, ACK] Seq=89305665 Ack=4974893 Win=65535 Len=2896 [TCP segment of a reassembled PDU]"
1,4.122154000000137,10.0.2.15,54.93.77.70,TCP,54,34692  >  9001 [ACK] Seq=4974893 Ack=89308561 Win=65535 Len=0
1,4.132390000000214,54.93.77.70,10.0.2.15,TLSv1.2,4398,Application Data [TCP segment of a reassembled PDU]
1,4.132512000000133,10.0.2.15,54.93.77.70,TCP,54,34692  >  9001 [ACK] Seq=4974893 Ack=89312905 Win=65535 Len=0
1,4.13325500000019,54.93.77.70,10.0.2.15,TLSv1.2,2950,"Application Data, Application Data"
1,4.133296999999857,10.0.2.15,54.93.77.70,TCP,54,34692  >  9001 [ACK] Seq=4974893 Ack=89315801 Win=65535 Len=0
1,4.138695000000098,54.93.77.70,10.0.2.15,TLSv1.2,1314,Application Data
1,4.142566999999872,54.93.77.70,10.0.2.15,TLSv1.2,5846,Application Data
1,4.14258400000017,54.93.77.70,10.0.2.15,TLSv1.2,4398,Application Data [TCP segment of a reassembled PDU]
1,4.142650000000231,10.0.2.15,54.93.77.70,TCP,54,34692  >  9001 [ACK] Seq=4974893 Ack=89327197 Win=65535 Len=0
1,4.149445000000014,54.93.77.70,10.0.2.15,TCP,1502,"9001  >  34692 [PSH, ACK] Seq=89327197 Ack=4974893 Win=65535 Len=1448 [TCP segment of a reassembled PDU]"
1,4.149641999999858,10.0.2.15,54.93.77.70,TCP,54,34692  >  9001 [ACK] Seq=4974893 Ack=89328645 Win=65535 Len=0
1,4.158609999999953,54.93.77.70,10.0.2.15,TLSv1.2,894,"Application Data, Application Data"
1,4.161762000000181,54.93.77.70,10.0.2.15,TLSv1.2,4398,Application Data
1,4.161837999999989,10.0.2.15,54.93.77.70,TCP,54,34692  >  9001 [ACK] Seq=4974893 Ack=89333829 Win=65535 Len=0
1,4.16199000000006,10.0.2.15,54.93.77.70,TLSv1.2,590,Application Data
1,4.162057000000004,54.93.77.70,10.0.2.15,TCP,60,9001  >  34692 [ACK] Seq=89333829 Ack=4975429 Win=65535 Len=0
1,4.162646000000223,54.93.77.70,10.0.2.15,TLSv1.2,7294,Application Data [TCP segment of a reassembled PDU]
1,4.162712000000283,10.0.2.15,54.93.77.70,TCP,54,34692  >  9001 [ACK] Seq=4975429 Ack=89341069 Win=65535 Len=0
1,4.163050000000112,54.93.77.70,10.0.2.15,TLSv1.2,2950,Application Data [TCP segment of a reassembled PDU]
1,4.163101000000097,10.0.2.15,54.93.77.70,TCP,54,34692  >  9001 [ACK] Seq=4975429 Ack=89343965 Win=65535 Len=0
1,4.1656269999998585,54.93.77.70,10.0.2.15,TLSv1.2,5846,"Application Data, Application Data"
1,4.165743999999904,10.0.2.15,54.93.77.70,TCP,54,34692  >  9001 [ACK] Seq=4975429 Ack=89349757 Win=65535 Len=0
1,4.16614699999991,54.93.77.70,10.0.2.15,TLSv1.2,2950,Application Data [TCP segment of a reassembled PDU]
1,4.166199000000233,10.0.2.15,54.93.77.70,TCP,54,34692  >  9001 [ACK] Seq=4975429 Ack=89352653 Win=65535 Len=0
1,4.1725719999999455,10.0.2.15,54.93.77.70,TLSv1.2,590,Application Data
1,4.172700000000077,54.93.77.70,10.0.2.15,TCP,60,9001  >  34692 [ACK] Seq=89352653 Ack=4975965 Win=65535 Len=0
1,4.173251000000164,54.93.77.70,10.0.2.15,TLSv1.2,4398,Application Data [TCP segment of a reassembled PDU]
1,4.1733140000001185,10.0.2.15,54.93.77.70,TCP,54,34692  >  9001 [ACK] Seq=4975965 Ack=89356997 Win=65535 Len=0
1,4.175236000000041,54.93.77.70,10.0.2.15,TLSv1.2,474,Application Data
1,4.177892000000156,54.93.77.70,10.0.2.15,TCP,2950,"9001  >  34692 [PSH, ACK] Seq=89357417 Ack=4975965 Win=65535 Len=2896 [TCP segment of a reassembled PDU]"
1,4.177940000000035,10.0.2.15,54.93.77.70,TCP,54,34692  >  9001 [ACK] Seq=4975965 Ack=89360313 Win=65535 Len=0
1,4.178229999999985,54.93.77.70,10.0.2.15,TLSv1.2,1502,Application Data [TCP segment of a reassembled PDU]
1,4.17827299999999,10.0.2.15,54.93.77.70,TCP,54,34692  >  9001 [ACK] Seq=4975965 Ack=89361761 Win=65535 Len=0
1,4.185582999999951,10.0.2.15,54.93.77.70,TLSv1.2,590,Application Data
1,4.185710000000199,54.93.77.70,10.0.2.15,TCP,60,9001  >  34692 [ACK] Seq=89361761 Ack=4976501 Win=65535 Len=0
1,4.195232000000033,54.93.77.70,10.0.2.15,TLSv1.2,380,Application Data
1,4.198668999999882,10.0.2.15,54.93.77.70,TLSv1.2,590,Application Data
1,4.198859000000084,54.93.77.70,10.0.2.15,TCP,60,9001  >  34692 [ACK] Seq=89362087 Ack=4977037 Win=65535 Len=0
1,4.265229999999974,62.210.85.178,10.0.2.15,TLSv1.2,590,Application Data
1,4.307213000000047,10.0.2.15,62.210.85.178,TCP,54,35978  >  9001 [ACK] Seq=89539931 Ack=4980819 Win=65535 Len=0
1,4.3278479999999035,62.210.85.178,10.0.2.15,TLSv1.2,1640,"Application Data, Application Data"
1,4.3280250000002525,10.0.2.15,62.210.85.178,TCP,54,35978  >  9001 [ACK] Seq=89539931 Ack=4982405 Win=65535 Len=0
1,4.3287209999998595,10.0.2.15,62.210.85.178,TLSv1.2,590,Application Data
1,4.328856999999971,62.210.85.178,10.0.2.15,TCP,60,9001  >  35978 [ACK] Seq=4982405 Ack=89540467 Win=65535 Len=0
1,4.6656520000001365,54.93.77.70,10.0.2.15,TLSv1.2,590,Application Data
1,4.666007000000263,10.0.2.15,54.93.77.70,TLSv1.2,590,Application Data
1,4.666157000000112,54.93.77.70,10.0.2.15,TCP,60,9001  >  34692 [ACK] Seq=89362623 Ack=4977573 Win=65535 Len=0
1,4.781631000000289,62.210.85.178,10.0.2.15,TLSv1.2,590,Application Data
1,4.785625999999866,10.0.2.15,62.210.85.178,TLSv1.2,590,Application Data
1,4.78581800000029,62.210.85.178,10.0.2.15,TCP,60,9001  >  35978 [ACK] Seq=4982941 Ack=89541003 Win=65535 Len=0
1,4.795446999999967,10.0.2.15,62.210.85.178,TLSv1.2,4124,Application Data
1,4.7960149999998976,62.210.85.178,10.0.2.15,TCP,60,9001  >  35978 [ACK] Seq=4982941 Ack=89542463 Win=65535 Len=0
1,4.796037000000069,62.210.85.178,10.0.2.15,TCP,60,9001  >  35978 [ACK] Seq=4982941 Ack=89543923 Win=65535 Len=0
1,4.796041999999943,62.210.85.178,10.0.2.15,TCP,60,9001  >  35978 [ACK] Seq=4982941 Ack=89545073 Win=65535 Len=0
1,4.796155999999883,10.0.2.15,62.210.85.178,TLSv1.2,2196,Application Data
1,4.796288999999888,62.210.85.178,10.0.2.15,TCP,60,9001  >  35978 [ACK] Seq=4982941 Ack=89546533 Win=65535 Len=0
1,4.796300999999858,62.210.85.178,10.0.2.15,TCP,60,9001  >  35978 [ACK] Seq=4982941 Ack=89547215 Win=65535 Len=0
1,4.8799440000002505,54.93.77.70,10.0.2.15,TLSv1.2,590,Application Data
1,4.923221000000012,10.0.2.15,54.93.77.70,TCP,54,34692  >  9001 [ACK] Seq=4977573 Ack=89363159 Win=65535 Len=0
1,4.946871999999985,54.93.77.70,10.0.2.15,TLSv1.2,3674,Application Data
1,4.946952000000238,10.0.2.15,54.93.77.70,TCP,54,34692  >  9001 [ACK] Seq=4977573 Ack=89366779 Win=65535 Len=0
1,4.966761000000133,54.93.77.70,10.0.2.15,TLSv1.2,2646,Application Data
1,4.966844999999921,10.0.2.15,54.93.77.70,TCP,54,34692  >  9001 [ACK] Seq=4977573 Ack=89369371 Win=65535 Len=0
