No.,Time,Source,Destination,Protocol,Length,Info
1,0.18686499999967054,10.0.2.15,54.93.77.70,TLSv1.2,590,Application Data
1,0.18702699999994365,54.93.77.70,10.0.2.15,TCP,60,9001  >  34692 [ACK] Seq=94434349 Ack=5279445 Win=65535 Len=0
1,0.34765799999968294,62.210.85.178,10.0.2.15,TLSv1.2,590,Application Data
1,0.3479729999999108,10.0.2.15,62.210.85.178,TLSv1.2,590,Application Data
1,0.3480909999998403,62.210.85.178,10.0.2.15,TCP,60,9001  >  35978 [ACK] Seq=5283603 Ack=94611761 Win=65535 Len=0
1,0.4546949999999015,54.93.77.70,10.0.2.15,TLSv1.2,590,Application Data
1,0.4551219999998466,10.0.2.15,54.93.77.70,TLSv1.2,1618,Application Data
1,0.45524399999976595,54.93.77.70,10.0.2.15,TCP,60,9001  >  34692 [ACK] Seq=94434885 Ack=5281009 Win=65535 Len=0
1,0.6552089999995587,62.210.85.178,10.0.2.15,TLSv1.2,1618,Application Data
1,0.6553539999999884,10.0.2.15,62.210.85.178,TCP,54,35978  >  9001 [ACK] Seq=94611761 Ack=5285167 Win=65535 Len=0
1,0.6800899999998364,10.0.2.15,62.210.85.178,TLSv1.2,590,Application Data
1,0.680800999999974,62.210.85.178,10.0.2.15,TCP,60,9001  >  35978 [ACK] Seq=5285167 Ack=94612297 Win=65535 Len=0
1,0.6930239999996957,10.0.2.15,62.210.85.178,TLSv1.2,1618,Application Data
1,0.6931949999998324,62.210.85.178,10.0.2.15,TCP,60,9001  >  35978 [ACK] Seq=5285167 Ack=94613757 Win=65535 Len=0
1,0.6932119999996758,62.210.85.178,10.0.2.15,TCP,60,9001  >  35978 [ACK] Seq=5285167 Ack=94613861 Win=65535 Len=0
1,0.7756489999997029,54.93.77.70,10.0.2.15,TLSv1.2,590,Application Data
1,0.8163469999999506,10.0.2.15,54.93.77.70,TCP,54,34692  >  9001 [ACK] Seq=5281009 Ack=94435421 Win=65535 Len=0
1,0.8247139999998581,54.93.77.70,10.0.2.15,TCP,1502,"9001  >  34692 [PSH, ACK] Seq=94435421 Ack=5281009 Win=65535 Len=1448 [TCP segment of a reassembled PDU]"
1,0.8247679999999491,10.0.2.15,54.93.77.70,TCP,54,34692  >  9001 [ACK] Seq=5281009 Ack=94436869 Win=65535 Len=0
1,0.8342450000000099,54.93.77.70,10.0.2.15,TLSv1.2,170,Application Data
1,0.8342889999998988,10.0.2.15,54.93.77.70,TCP,54,34692  >  9001 [ACK] Seq=5281009 Ack=94436985 Win=65535 Len=0
1,0.8363039999999273,10.0.2.15,54.93.77.70,TLSv1.2,590,Application Data
1,0.8364549999996598,54.93.77.70,10.0.2.15,TCP,60,9001  >  34692 [ACK] Seq=94436985 Ack=5281545 Win=65535 Len=0
1,0.9311109999998735,62.210.85.178,10.0.2.15,TLSv1.2,590,Application Data
1,0.9314379999996163,10.0.2.15,62.210.85.178,TLSv1.2,590,Application Data
1,0.9315419999998085,62.210.85.178,10.0.2.15,TCP,60,9001  >  35978 [ACK] Seq=5285703 Ack=94614397 Win=65535 Len=0
1,1.0233159999997952,54.93.77.70,10.0.2.15,TLSv1.2,590,Application Data
1,1.0237229999997908,10.0.2.15,54.93.77.70,TLSv1.2,590,Application Data
1,1.023819999999887,54.93.77.70,10.0.2.15,TCP,60,9001  >  34692 [ACK] Seq=94437521 Ack=5282081 Win=65535 Len=0
1,1.1346779999998944,62.210.85.178,10.0.2.15,TLSv1.2,590,Application Data
1,1.1390319999995882,10.0.2.15,62.210.85.178,TLSv1.2,590,Application Data
1,1.1391739999999118,62.210.85.178,10.0.2.15,TCP,60,9001  >  35978 [ACK] Seq=5286239 Ack=94614933 Win=65535 Len=0
1,1.1493749999999636,10.0.2.15,62.210.85.178,TLSv1.2,4124,Application Data
1,1.1495109999996203,62.210.85.178,10.0.2.15,TCP,60,9001  >  35978 [ACK] Seq=5286239 Ack=94616393 Win=65535 Len=0
1,1.149529999999686,62.210.85.178,10.0.2.15,TCP,60,9001  >  35978 [ACK] Seq=5286239 Ack=94617853 Win=65535 Len=0
1,1.149532999999792,62.210.85.178,10.0.2.15,TCP,60,9001  >  35978 [ACK] Seq=5286239 Ack=94619003 Win=65535 Len=0
1,1.1496069999998326,10.0.2.15,62.210.85.178,TLSv1.2,4124,Application Data
1,1.1497099999996863,62.210.85.178,10.0.2.15,TCP,60,9001  >  35978 [ACK] Seq=5286239 Ack=94620463 Win=65535 Len=0
1,1.1497169999997823,62.210.85.178,10.0.2.15,TCP,60,9001  >  35978 [ACK] Seq=5286239 Ack=94621923 Win=65535 Len=0
1,1.1497199999998884,62.210.85.178,10.0.2.15,TCP,60,9001  >  35978 [ACK] Seq=5286239 Ack=94623073 Win=65535 Len=0
1,1.1497419999996055,10.0.2.15,62.210.85.178,TCP,2974,35978  >  9001 [ACK] Seq=94623073 Ack=5286239 Win=65535 Len=2920 [TCP segment of a reassembled PDU]
1,1.1497819999999592,62.210.85.178,10.0.2.15,TCP,60,9001  >  35978 [ACK] Seq=5286239 Ack=94624533 Win=65535 Len=0
1,1.1497879999997167,62.210.85.178,10.0.2.15,TCP,60,9001  >  35978 [ACK] Seq=5286239 Ack=94625993 Win=65535 Len=0
1,1.149815999999646,10.0.2.15,62.210.85.178,TLSv1.2,1204,Application Data
1,1.1498489999999038,62.210.85.178,10.0.2.15,TCP,60,9001  >  35978 [ACK] Seq=5286239 Ack=94627143 Win=65535 Len=0
1,1.1498919999999089,10.0.2.15,62.210.85.178,TLSv1.2,4124,Application Data
1,1.1499379999995654,62.210.85.178,10.0.2.15,TCP,60,9001  >  35978 [ACK] Seq=5286239 Ack=94628603 Win=65535 Len=0
1,1.1499449999996614,62.210.85.178,10.0.2.15,TCP,60,9001  >  35978 [ACK] Seq=5286239 Ack=94630063 Win=65535 Len=0
1,1.1499959999996463,62.210.85.178,10.0.2.15,TCP,60,9001  >  35978 [ACK] Seq=5286239 Ack=94631213 Win=65535 Len=0
1,1.1500320000000102,10.0.2.15,62.210.85.178,TLSv1.2,332,Application Data
1,1.1500649999998132,62.210.85.178,10.0.2.15,TCP,60,9001  >  35978 [ACK] Seq=5286239 Ack=94631491 Win=65535 Len=0
1,1.1501209999996718,10.0.2.15,62.210.85.178,TLSv1.2,3868,Application Data
1,1.1502099999997881,62.210.85.178,10.0.2.15,TCP,60,9001  >  35978 [ACK] Seq=5286239 Ack=94632951 Win=65535 Len=0
1,1.1502169999998841,62.210.85.178,10.0.2.15,TCP,60,9001  >  35978 [ACK] Seq=5286239 Ack=94634411 Win=65535 Len=0
1,1.1502199999999903,62.210.85.178,10.0.2.15,TCP,60,9001  >  35978 [ACK] Seq=5286239 Ack=94635305 Win=65535 Len=0
1,1.150253999999677,10.0.2.15,62.210.85.178,TLSv1.2,4124,Application Data
1,1.1502889999997024,62.210.85.178,10.0.2.15,TCP,60,9001  >  35978 [ACK] Seq=5286239 Ack=94636765 Win=65535 Len=0
1,1.1502949999999146,62.210.85.178,10.0.2.15,TCP,60,9001  >  35978 [ACK] Seq=5286239 Ack=94638225 Win=65535 Len=0
1,1.150297999999566,62.210.85.178,10.0.2.15,TCP,60,9001  >  35978 [ACK] Seq=5286239 Ack=94639375 Win=65535 Len=0
1,1.1503329999995913,10.0.2.15,62.210.85.178,TLSv1.2,3030,Application Data
1,1.150365999999849,62.210.85.178,10.0.2.15,TCP,60,9001  >  35978 [ACK] Seq=5286239 Ack=94640835 Win=65535 Len=0
1,1.1503739999998288,62.210.85.178,10.0.2.15,TCP,60,9001  >  35978 [ACK] Seq=5286239 Ack=94642295 Win=65535 Len=0
1,1.1503789999997025,62.210.85.178,10.0.2.15,TCP,60,9001  >  35978 [ACK] Seq=5286239 Ack=94642351 Win=65535 Len=0
1,1.1595759999995607,10.0.2.15,62.210.85.178,TLSv1.2,4124,Application Data
1,1.1596259999996619,62.210.85.178,10.0.2.15,TCP,60,9001  >  35978 [ACK] Seq=5286239 Ack=94643811 Win=65535 Len=0
1,1.1596369999997478,62.210.85.178,10.0.2.15,TCP,60,9001  >  35978 [ACK] Seq=5286239 Ack=94645271 Win=65535 Len=0
1,1.1596419999996215,62.210.85.178,10.0.2.15,TCP,60,9001  >  35978 [ACK] Seq=5286239 Ack=94646421 Win=65535 Len=0
1,1.159686999999849,10.0.2.15,62.210.85.178,TLSv1.2,140,Application Data
1,1.1597259999998641,62.210.85.178,10.0.2.15,TCP,60,9001  >  35978 [ACK] Seq=5286239 Ack=94646507 Win=65535 Len=0
1,1.2762659999998505,54.93.77.70,10.0.2.15,TLSv1.2,590,Application Data
1,1.2868589999998221,54.93.77.70,10.0.2.15,TCP,2950,"9001  >  34692 [PSH, ACK] Seq=94438057 Ack=5282081 Win=65535 Len=2896 [TCP segment of a reassembled PDU]"
1,1.286960999999792,10.0.2.15,54.93.77.70,TCP,54,34692  >  9001 [ACK] Seq=5282081 Ack=94440953 Win=65535 Len=0
1,1.2922869999997602,54.93.77.70,10.0.2.15,TLSv1.2,778,Application Data
1,1.2947409999997035,54.93.77.70,10.0.2.15,TCP,2950,"9001  >  34692 [PSH, ACK] Seq=94441677 Ack=5282081 Win=65535 Len=2896 [TCP segment of a reassembled PDU]"
1,1.2947999999996682,10.0.2.15,54.93.77.70,TCP,54,34692  >  9001 [ACK] Seq=5282081 Ack=94444573 Win=65535 Len=0
1,1.29558999999972,54.93.77.70,10.0.2.15,TLSv1.2,7294,"Application Data, Application Data"
1,1.295654999999897,10.0.2.15,54.93.77.70,TCP,54,34692  >  9001 [ACK] Seq=5282081 Ack=94451813 Win=65535 Len=0
1,1.3034749999997075,54.93.77.70,10.0.2.15,TLSv1.2,4398,Application Data [TCP segment of a reassembled PDU]
1,1.3035219999997025,10.0.2.15,54.93.77.70,TCP,54,34692  >  9001 [ACK] Seq=5282081 Ack=94456157 Win=65535 Len=0
1,1.308444999999665,54.93.77.70,10.0.2.15,TLSv1.2,2132,"Application Data, Application Data"
1,1.3084899999998925,10.0.2.15,54.93.77.70,TCP,54,34692  >  9001 [ACK] Seq=5282081 Ack=94458235 Win=65535 Len=0
1,1.3157899999996516,54.93.77.70,10.0.2.15,TLSv1.2,7294,Application Data
1,1.3158639999996922,10.0.2.15,54.93.77.70,TCP,54,34692  >  9001 [ACK] Seq=5282081 Ack=94465475 Win=65535 Len=0
1,1.3177439999999478,54.93.77.70,10.0.2.15,TLSv1.2,2950,Application Data [TCP segment of a reassembled PDU]
1,1.3177959999998166,10.0.2.15,54.93.77.70,TCP,54,34692  >  9001 [ACK] Seq=5282081 Ack=94468371 Win=65535 Len=0
1,1.3179869999999028,10.0.2.15,54.93.77.70,TLSv1.2,590,Application Data
1,1.318051999999625,54.93.77.70,10.0.2.15,TCP,60,9001  >  34692 [ACK] Seq=94468371 Ack=5282617 Win=65535 Len=0
1,1.32598199999984,54.93.77.70,10.0.2.15,TLSv1.2,1292,Application Data
1,1.33410799999956,10.0.2.15,54.93.77.70,TLSv1.2,1104,Application Data
1,1.3342539999998735,54.93.77.70,10.0.2.15,TCP,60,9001  >  34692 [ACK] Seq=94469609 Ack=5283667 Win=65535 Len=0
1,1.425307999999859,62.210.85.178,10.0.2.15,TLSv1.2,590,Application Data
1,1.46833099999958,10.0.2.15,62.210.85.178,TCP,54,35978  >  9001 [ACK] Seq=94646507 Ack=5286775 Win=65535 Len=0
1,1.6797719999999572,62.210.85.178,10.0.2.15,TLSv1.2,1104,Application Data
1,1.6798499999999876,10.0.2.15,62.210.85.178,TCP,54,35978  >  9001 [ACK] Seq=94646507 Ack=5287825 Win=65535 Len=0
1,1.6803479999998672,10.0.2.15,62.210.85.178,TLSv1.2,590,Application Data
1,1.6805729999996402,62.210.85.178,10.0.2.15,TCP,60,9001  >  35978 [ACK] Seq=5287825 Ack=94647043 Win=65535 Len=0
1,1.7840449999998782,54.93.77.70,10.0.2.15,TLSv1.2,590,Application Data
1,1.7844289999998182,10.0.2.15,54.93.77.70,TLSv1.2,590,Application Data
1,1.7845399999996516,54.93.77.70,10.0.2.15,TCP,60,9001  >  34692 [ACK] Seq=94470145 Ack=5284203 Win=65535 Len=0
1,1.8889449999996941,62.210.85.178,10.0.2.15,TLSv1.2,590,Application Data
1,1.8976719999996021,10.0.2.15,62.210.85.178,TLSv1.2,590,Application Data
1,1.8978069999998297,62.210.85.178,10.0.2.15,TCP,60,9001  >  35978 [ACK] Seq=5288361 Ack=94647579 Win=65535 Len=0
1,1.9091269999998985,10.0.2.15,62.210.85.178,TLSv1.2,4124,Application Data
1,1.9092279999999846,10.0.2.15,62.210.85.178,TCP,2974,35978  >  9001 [ACK] Seq=94651649 Ack=5288361 Win=65535 Len=2920 [TCP segment of a reassembled PDU]
1,1.9093339999999444,62.210.85.178,10.0.2.15,TCP,60,9001  >  35978 [ACK] Seq=5288361 Ack=94649039 Win=65535 Len=0
1,1.9093439999996917,62.210.85.178,10.0.2.15,TCP,60,9001  >  35978 [ACK] Seq=5288361 Ack=94650499 Win=65535 Len=0
1,1.9093469999997978,62.210.85.178,10.0.2.15,TCP,60,9001  >  35978 [ACK] Seq=5288361 Ack=94651649 Win=65535 Len=0
1,1.909349999999904,62.210.85.178,10.0.2.15,TCP,60,9001  >  35978 [ACK] Seq=5288361 Ack=94653109 Win=65535 Len=0
1,1.9093519999996715,62.210.85.178,10.0.2.15,TCP,60,9001  >  35978 [ACK] Seq=5288361 Ack=94654569 Win=65535 Len=0
1,1.909385999999813,10.0.2.15,62.210.85.178,TLSv1.2,1204,Application Data
1,1.9094279999999344,62.210.85.178,10.0.2.15,TCP,60,9001  >  35978 [ACK] Seq=5288361 Ack=94655719 Win=65535 Len=0
1,1.9094779999995808,10.0.2.15,62.210.85.178,TLSv1.2,4124,Application Data
1,1.9095179999999345,62.210.85.178,10.0.2.15,TCP,60,9001  >  35978 [ACK] Seq=5288361 Ack=94657179 Win=65535 Len=0
1,1.9095269999997981,62.210.85.178,10.0.2.15,TCP,60,9001  >  35978 [ACK] Seq=5288361 Ack=94658639 Win=65535 Len=0
1,1.9095319999996718,62.210.85.178,10.0.2.15,TCP,60,9001  >  35978 [ACK] Seq=5288361 Ack=94659789 Win=65535 Len=0
1,1.9095719999995708,10.0.2.15,62.210.85.178,TLSv1.2,4124,Application Data
1,1.9096099999997023,62.210.85.178,10.0.2.15,TCP,60,9001  >  35978 [ACK] Seq=5288361 Ack=94661249 Win=65535 Len=0
1,1.909617999999682,62.210.85.178,10.0.2.15,TCP,60,9001  >  35978 [ACK] Seq=5288361 Ack=94662709 Win=65535 Len=0
1,1.909679999999753,10.0.2.15,62.210.85.178,TLSv1.2,2974,Application Data
1,1.9097209999999905,62.210.85.178,10.0.2.15,TCP,60,9001  >  35978 [ACK] Seq=5288361 Ack=94663859 Win=65535 Len=0
1,1.9097309999997378,62.210.85.178,10.0.2.15,TCP,60,9001  >  35978 [ACK] Seq=5288361 Ack=94665319 Win=65535 Len=0
1,1.909733999999844,62.210.85.178,10.0.2.15,TCP,60,9001  >  35978 [ACK] Seq=5288361 Ack=94666779 Win=65535 Len=0
1,1.909762999999657,10.0.2.15,62.210.85.178,TLSv1.2,1226,Application Data
1,1.9097979999996824,62.210.85.178,10.0.2.15,TCP,60,9001  >  35978 [ACK] Seq=5288361 Ack=94667951 Win=65535 Len=0
1,1.9098409999996875,10.0.2.15,62.210.85.178,TLSv1.2,4124,Application Data
1,1.9098799999997027,62.210.85.178,10.0.2.15,TCP,60,9001  >  35978 [ACK] Seq=5288361 Ack=94669411 Win=65535 Len=0
1,1.9098879999996825,62.210.85.178,10.0.2.15,TCP,60,9001  >  35978 [ACK] Seq=5288361 Ack=94670871 Win=65535 Len=0
1,1.9098919999996724,62.210.85.178,10.0.2.15,TCP,60,9001  >  35978 [ACK] Seq=5288361 Ack=94672021 Win=65535 Len=0
1,1.9099369999998999,10.0.2.15,62.210.85.178,TLSv1.2,3030,Application Data
1,1.9099769999997989,62.210.85.178,10.0.2.15,TCP,60,9001  >  35978 [ACK] Seq=5288361 Ack=94673481 Win=65535 Len=0
1,1.9099849999997787,62.210.85.178,10.0.2.15,TCP,60,9001  >  35978 [ACK] Seq=5288361 Ack=94674941 Win=65535 Len=0
1,1.9099879999998848,62.210.85.178,10.0.2.15,TCP,60,9001  >  35978 [ACK] Seq=5288361 Ack=94674997 Win=65535 Len=0
1,1.9192109999999047,10.0.2.15,62.210.85.178,TLSv1.2,4124,Application Data
1,1.9192729999999756,62.210.85.178,10.0.2.15,TCP,60,9001  >  35978 [ACK] Seq=5288361 Ack=94676457 Win=65535 Len=0
1,1.9192849999999453,62.210.85.178,10.0.2.15,TCP,60,9001  >  35978 [ACK] Seq=5288361 Ack=94677917 Win=65535 Len=0
1,1.9192889999999352,62.210.85.178,10.0.2.15,TCP,60,9001  >  35978 [ACK] Seq=5288361 Ack=94679067 Win=65535 Len=0
1,1.919336999999814,10.0.2.15,62.210.85.178,TLSv1.2,4124,Application Data
1,1.9193779999995968,62.210.85.178,10.0.2.15,TCP,60,9001  >  35978 [ACK] Seq=5288361 Ack=94680527 Win=65535 Len=0
1,1.919387999999799,62.210.85.178,10.0.2.15,TCP,60,9001  >  35978 [ACK] Seq=5288361 Ack=94681987 Win=65535 Len=0
1,1.9193919999997888,62.210.85.178,10.0.2.15,TCP,60,9001  >  35978 [ACK] Seq=5288361 Ack=94683137 Win=65535 Len=0
1,1.919430999999804,10.0.2.15,62.210.85.178,TLSv1.2,4124,Application Data
1,1.9194699999998193,62.210.85.178,10.0.2.15,TCP,60,9001  >  35978 [ACK] Seq=5288361 Ack=94684597 Win=65535 Len=0
1,1.919477999999799,62.210.85.178,10.0.2.15,TCP,60,9001  >  35978 [ACK] Seq=5288361 Ack=94686057 Win=65535 Len=0
1,1.9194829999996728,62.210.85.178,10.0.2.15,TCP,60,9001  >  35978 [ACK] Seq=5288361 Ack=94687207 Win=65535 Len=0
1,1.9195259999996779,10.0.2.15,62.210.85.178,TLSv1.2,4124,Application Data
1,1.9195639999998093,62.210.85.178,10.0.2.15,TCP,60,9001  >  35978 [ACK] Seq=5288361 Ack=94688667 Win=65535 Len=0
1,1.9195719999997891,62.210.85.178,10.0.2.15,TCP,60,9001  >  35978 [ACK] Seq=5288361 Ack=94690127 Win=65535 Len=0
1,1.9195769999996628,62.210.85.178,10.0.2.15,TCP,60,9001  >  35978 [ACK] Seq=5288361 Ack=94691277 Win=65535 Len=0
1,1.9196119999996881,10.0.2.15,62.210.85.178,TLSv1.2,332,Application Data
1,1.9196479999995972,62.210.85.178,10.0.2.15,TCP,60,9001  >  35978 [ACK] Seq=5288361 Ack=94691555 Win=65535 Len=0
1,1.9197019999996883,10.0.2.15,62.210.85.178,TLSv1.2,3868,Application Data
1,1.9197409999997035,62.210.85.178,10.0.2.15,TCP,60,9001  >  35978 [ACK] Seq=5288361 Ack=94693015 Win=65535 Len=0
1,1.9197489999996833,62.210.85.178,10.0.2.15,TCP,60,9001  >  35978 [ACK] Seq=5288361 Ack=94694475 Win=65535 Len=0
1,1.919753999999557,62.210.85.178,10.0.2.15,TCP,60,9001  >  35978 [ACK] Seq=5288361 Ack=94695369 Win=65535 Len=0
1,1.9197929999995722,10.0.2.15,62.210.85.178,TLSv1.2,4124,Application Data
1,1.9198299999998198,62.210.85.178,10.0.2.15,TCP,60,9001  >  35978 [ACK] Seq=5288361 Ack=94696829 Win=65535 Len=0
1,1.9198379999997996,62.210.85.178,10.0.2.15,TCP,60,9001  >  35978 [ACK] Seq=5288361 Ack=94698289 Win=65535 Len=0
1,1.9198419999997896,62.210.85.178,10.0.2.15,TCP,60,9001  >  35978 [ACK] Seq=5288361 Ack=94699439 Win=65535 Len=0
1,1.9198779999996987,10.0.2.15,62.210.85.178,TLSv1.2,3030,Application Data
1,1.9199179999995977,62.210.85.178,10.0.2.15,TCP,60,9001  >  35978 [ACK] Seq=5288361 Ack=94700899 Win=65535 Len=0
1,1.9199259999995775,62.210.85.178,10.0.2.15,TCP,60,9001  >  35978 [ACK] Seq=5288361 Ack=94702359 Win=65535 Len=0
1,1.9199289999996836,62.210.85.178,10.0.2.15,TCP,60,9001  >  35978 [ACK] Seq=5288361 Ack=94702415 Win=65535 Len=0
1,1.932346999999936,10.0.2.15,62.210.85.178,TLSv1.2,4124,Application Data
1,1.9324479999995674,62.210.85.178,10.0.2.15,TCP,60,9001  >  35978 [ACK] Seq=5288361 Ack=94703875 Win=65535 Len=0
1,1.9324579999997695,62.210.85.178,10.0.2.15,TCP,60,9001  >  35978 [ACK] Seq=5288361 Ack=94705335 Win=65535 Len=0
1,1.9324609999998756,62.210.85.178,10.0.2.15,TCP,60,9001  >  35978 [ACK] Seq=5288361 Ack=94706485 Win=65535 Len=0
1,1.932499000000007,10.0.2.15,62.210.85.178,TLSv1.2,4124,Application Data
1,1.9325399999997899,62.210.85.178,10.0.2.15,TCP,60,9001  >  35978 [ACK] Seq=5288361 Ack=94707945 Win=65535 Len=0
1,1.932549999999992,62.210.85.178,10.0.2.15,TCP,60,9001  >  35978 [ACK] Seq=5288361 Ack=94709405 Win=65535 Len=0
1,1.932553999999982,62.210.85.178,10.0.2.15,TCP,60,9001  >  35978 [ACK] Seq=5288361 Ack=94710555 Win=65535 Len=0
1,1.9325929999999971,10.0.2.15,62.210.85.178,TLSv1.2,4124,Application Data
1,1.9326309999996738,62.210.85.178,10.0.2.15,TCP,60,9001  >  35978 [ACK] Seq=5288361 Ack=94712015 Win=65535 Len=0
1,1.9326399999999921,62.210.85.178,10.0.2.15,TCP,60,9001  >  35978 [ACK] Seq=5288361 Ack=94713475 Win=65535 Len=0
1,1.9326449999998658,62.210.85.178,10.0.2.15,TCP,60,9001  >  35978 [ACK] Seq=5288361 Ack=94714625 Win=65535 Len=0
1,1.9326829999999973,10.0.2.15,62.210.85.178,TLSv1.2,2838,Application Data
1,1.9327199999997902,62.210.85.178,10.0.2.15,TCP,60,9001  >  35978 [ACK] Seq=5288361 Ack=94716085 Win=65535 Len=0
1,1.93272799999977,62.210.85.178,10.0.2.15,TCP,60,9001  >  35978 [ACK] Seq=5288361 Ack=94717409 Win=65535 Len=0
1,2.0179669999997714,54.93.77.70,10.0.2.15,TLSv1.2,590,Application Data
1,2.0383959999999206,54.93.77.70,10.0.2.15,TLSv1.2,10190,"Application Data, Application Data"
1,2.038506999999754,10.0.2.15,54.93.77.70,TCP,54,34692  >  9001 [ACK] Seq=5284203 Ack=94480817 Win=65535 Len=0
1,2.0565999999998894,54.93.77.70,10.0.2.15,TLSv1.2,1292,Application Data
1,2.059339999999793,54.93.77.70,10.0.2.15,TCP,2950,"9001  >  34692 [PSH, ACK] Seq=94482055 Ack=5284203 Win=65535 Len=2896 [TCP segment of a reassembled PDU]"
1,2.0594179999998232,10.0.2.15,54.93.77.70,TCP,54,34692  >  9001 [ACK] Seq=5284203 Ack=94484951 Win=65535 Len=0
1,2.0701099999996586,54.93.77.70,10.0.2.15,TLSv1.2,4398,"Application Data, Application Data"
1,2.0702409999998963,10.0.2.15,54.93.77.70,TCP,54,34692  >  9001 [ACK] Seq=5284203 Ack=94489295 Win=65535 Len=0
1,2.082807999999659,54.93.77.70,10.0.2.15,TCP,2950,"9001  >  34692 [PSH, ACK] Seq=94489295 Ack=5284203 Win=65535 Len=2896 [TCP segment of a reassembled PDU]"
1,2.082890999999563,10.0.2.15,54.93.77.70,TCP,54,34692  >  9001 [ACK] Seq=5284203 Ack=94492191 Win=65535 Len=0
1,2.0870709999999235,54.93.77.70,10.0.2.15,TLSv1.2,5448,"Application Data, Application Data, Application Data"
1,2.0871659999997974,10.0.2.15,54.93.77.70,TCP,54,34692  >  9001 [ACK] Seq=5284203 Ack=94497585 Win=65535 Len=0
1,2.087525999999798,10.0.2.15,54.93.77.70,TLSv1.2,590,Application Data
1,2.087611999999808,54.93.77.70,10.0.2.15,TCP,60,9001  >  34692 [ACK] Seq=94497585 Ack=5284739 Win=65535 Len=0
1,2.0998719999997775,54.93.77.70,10.0.2.15,TLSv1.2,5846,"Application Data, Application Data"
1,2.099917000000005,54.93.77.70,10.0.2.15,TLSv1.2,5846,Application Data [TCP segment of a reassembled PDU]
1,2.0999739999997473,10.0.2.15,54.93.77.70,TCP,54,34692  >  9001 [ACK] Seq=5284739 Ack=94503377 Win=65535 Len=0
1,2.100101999999879,10.0.2.15,54.93.77.70,TCP,54,34692  >  9001 [ACK] Seq=5284739 Ack=94509169 Win=65535 Len=0
1,2.1033079999997426,54.93.77.70,10.0.2.15,TLSv1.2,380,Application Data
1,2.1182989999997517,54.93.77.70,10.0.2.15,TLSv1.2,4398,Application Data
1,2.1184039999998276,10.0.2.15,54.93.77.70,TCP,54,34692  >  9001 [ACK] Seq=5284739 Ack=94513839 Win=65535 Len=0
1,2.1294019999995726,54.93.77.70,10.0.2.15,TLSv1.2,7294,"Application Data, Application Data"
1,2.129508999999871,10.0.2.15,54.93.77.70,TCP,54,34692  >  9001 [ACK] Seq=5284739 Ack=94521079 Win=65535 Len=0
1,2.1349959999997736,54.93.77.70,10.0.2.15,TLSv1.2,894,Application Data
1,2.1352179999998953,10.0.2.15,54.93.77.70,TLSv1.2,1104,Application Data
1,2.1353379999995923,54.93.77.70,10.0.2.15,TCP,60,9001  >  34692 [ACK] Seq=94521919 Ack=5285789 Win=65535 Len=0
1,2.1376579999996466,54.93.77.70,10.0.2.15,TLSv1.2,7294,Application Data
1,2.1377269999998134,10.0.2.15,54.93.77.70,TCP,54,34692  >  9001 [ACK] Seq=5285789 Ack=94529159 Win=65535 Len=0
1,2.152694999999767,54.93.77.70,10.0.2.15,TLSv1.2,568,Application Data
1,2.160642999999709,54.93.77.70,10.0.2.15,TCP,2950,"9001  >  34692 [PSH, ACK] Seq=94529673 Ack=5285789 Win=65535 Len=2896 [TCP segment of a reassembled PDU]"
1,2.160671999999977,54.93.77.70,10.0.2.15,TLSv1.2,1474,Application Data [TCP segment of a reassembled PDU]
1,2.1607019999996737,10.0.2.15,54.93.77.70,TCP,54,34692  >  9001 [ACK] Seq=5285789 Ack=94532569 Win=65535 Len=0
1,2.1607529999996586,54.93.77.70,10.0.2.15,TCP,1530,"9001  >  34692 [PSH, ACK] Seq=94533989 Ack=5285789 Win=65535 Len=1476 [TCP segment of a reassembled PDU]"
1,2.1608079999996335,10.0.2.15,54.93.77.70,TCP,54,34692  >  9001 [ACK] Seq=5285789 Ack=94535465 Win=65535 Len=0
1,2.161818999999923,54.93.77.70,10.0.2.15,TLSv1.2,2950,Application Data [TCP segment of a reassembled PDU]
1,2.161870999999792,10.0.2.15,54.93.77.70,TCP,54,34692  >  9001 [ACK] Seq=5285789 Ack=94538361 Win=65535 Len=0
1,2.1739819999997962,54.93.77.70,10.0.2.15,TLSv1.2,1502,Application Data [TCP segment of a reassembled PDU]
1,2.1741649999999026,10.0.2.15,54.93.77.70,TCP,54,34692  >  9001 [ACK] Seq=5285789 Ack=94539809 Win=65535 Len=0
1,2.1793439999996735,54.93.77.70,10.0.2.15,TLSv1.2,800,Application Data
1,2.1793869999996787,62.210.85.178,10.0.2.15,TLSv1.2,590,Application Data
1,2.183396999999786,10.0.2.15,54.93.77.70,TLSv1.2,590,Application Data
1,2.1836019999996097,54.93.77.70,10.0.2.15,TCP,60,9001  >  34692 [ACK] Seq=94540555 Ack=5286325 Win=65535 Len=0
1,2.2202869999996437,10.0.2.15,62.210.85.178,TCP,54,35978  >  9001 [ACK] Seq=94717409 Ack=5288897 Win=65535 Len=0
1,2.2783449999997174,62.210.85.178,10.0.2.15,TLSv1.2,1104,Application Data
1,2.2784349999997175,10.0.2.15,62.210.85.178,TCP,54,35978  >  9001 [ACK] Seq=94717409 Ack=5289947 Win=65535 Len=0
1,2.3058039999996254,62.210.85.178,10.0.2.15,TLSv1.2,590,Application Data
1,2.3058549999996103,10.0.2.15,62.210.85.178,TCP,54,35978  >  9001 [ACK] Seq=94717409 Ack=5290483 Win=65535 Len=0
1,2.3061189999998533,10.0.2.15,62.210.85.178,TLSv1.2,590,Application Data
1,2.3062049999998635,62.210.85.178,10.0.2.15,TCP,60,9001  >  35978 [ACK] Seq=5290483 Ack=94717945 Win=65535 Len=0
1,2.498087999999825,54.93.77.70,10.0.2.15,TLSv1.2,590,Application Data
1,2.4985359999996035,10.0.2.15,54.93.77.70,TLSv1.2,590,Application Data
1,2.4986849999995684,54.93.77.70,10.0.2.15,TCP,60,9001  >  34692 [ACK] Seq=94541091 Ack=5286861 Win=65535 Len=0
1,2.7039709999999104,62.210.85.178,10.0.2.15,TLSv1.2,590,Application Data
1,2.7110359999996945,10.0.2.15,62.210.85.178,TLSv1.2,590,Application Data
1,2.7112089999995987,62.210.85.178,10.0.2.15,TCP,60,9001  >  35978 [ACK] Seq=5291019 Ack=94718481 Win=65535 Len=0
1,2.7249629999996614,10.0.2.15,62.210.85.178,TLSv1.2,4124,Application Data
1,2.7252049999997325,10.0.2.15,62.210.85.178,TCP,2974,35978  >  9001 [ACK] Seq=94722551 Ack=5291019 Win=65535 Len=2920 [TCP segment of a reassembled PDU]
1,2.7252809999999954,62.210.85.178,10.0.2.15,TCP,60,9001  >  35978 [ACK] Seq=5291019 Ack=94719941 Win=65535 Len=0
1,2.725292999999965,62.210.85.178,10.0.2.15,TCP,60,9001  >  35978 [ACK] Seq=5291019 Ack=94721401 Win=65535 Len=0
1,2.725297999999839,62.210.85.178,10.0.2.15,TCP,60,9001  >  35978 [ACK] Seq=5291019 Ack=94722551 Win=65535 Len=0
1,2.7253029999997125,62.210.85.178,10.0.2.15,TCP,60,9001  >  35978 [ACK] Seq=5291019 Ack=94724011 Win=65535 Len=0
1,2.7253069999997024,62.210.85.178,10.0.2.15,TCP,60,9001  >  35978 [ACK] Seq=5291019 Ack=94725471 Win=65535 Len=0
1,2.7253529999998136,10.0.2.15,62.210.85.178,TLSv1.2,1204,Application Data
1,2.7253939999995964,62.210.85.178,10.0.2.15,TCP,60,9001  >  35978 [ACK] Seq=5291019 Ack=94726621 Win=65535 Len=0
1,2.7254509999997936,10.0.2.15,62.210.85.178,TLSv1.2,3288,Application Data
1,2.7255309999995916,62.210.85.178,10.0.2.15,TCP,60,9001  >  35978 [ACK] Seq=5291019 Ack=94728081 Win=65535 Len=0
1,2.7255389999995714,62.210.85.178,10.0.2.15,TCP,60,9001  >  35978 [ACK] Seq=5291019 Ack=94729541 Win=65535 Len=0
1,2.7255429999995613,62.210.85.178,10.0.2.15,TCP,60,9001  >  35978 [ACK] Seq=5291019 Ack=94729855 Win=65535 Len=0
1,2.9078700000000026,54.93.77.70,10.0.2.15,TCP,2950,"9001  >  34692 [PSH, ACK] Seq=94541091 Ack=5286861 Win=65535 Len=2896 [TCP segment of a reassembled PDU]"
1,2.9080109999999877,10.0.2.15,54.93.77.70,TCP,54,34692  >  9001 [ACK] Seq=5286861 Ack=94543987 Win=65535 Len=0
1,2.9123789999998735,54.93.77.70,10.0.2.15,TLSv1.2,7294,"Application Data, Application Data"
1,2.9123939999999493,54.93.77.70,10.0.2.15,TLSv1.2,1828,"Application Data, Application Data"
1,2.912452999999914,10.0.2.15,54.93.77.70,TCP,54,34692  >  9001 [ACK] Seq=5286861 Ack=94553001 Win=65535 Len=0
1,2.915161999999782,10.0.2.15,54.93.77.70,TLSv1.2,590,Application Data
1,2.9153219999998328,54.93.77.70,10.0.2.15,TCP,60,9001  >  34692 [ACK] Seq=94553001 Ack=5287397 Win=65535 Len=0
1,3.1175979999998162,62.210.85.178,10.0.2.15,TLSv1.2,590,Application Data
1,3.118109000000004,10.0.2.15,62.210.85.178,TLSv1.2,590,Application Data
1,3.118229999999585,62.210.85.178,10.0.2.15,TCP,60,9001  >  35978 [ACK] Seq=5291555 Ack=94730391 Win=65535 Len=0
1,3.3173589999996693,54.93.77.70,10.0.2.15,TLSv1.2,590,Application Data
1,3.3177959999998166,10.0.2.15,54.93.77.70,TLSv1.2,590,Application Data
1,3.317963999999847,54.93.77.70,10.0.2.15,TCP,60,9001  >  34692 [ACK] Seq=94553537 Ack=5287933 Win=65535 Len=0
1,3.4256399999999303,62.210.85.178,10.0.2.15,TLSv1.2,590,Application Data
1,3.4299329999998918,10.0.2.15,62.210.85.178,TLSv1.2,590,Application Data
1,3.430108999999902,62.210.85.178,10.0.2.15,TCP,60,9001  >  35978 [ACK] Seq=5292091 Ack=94730927 Win=65535 Len=0
1,3.445440999999846,10.0.2.15,62.210.85.178,TLSv1.2,4124,Application Data
1,3.4455519999996795,10.0.2.15,62.210.85.178,TCP,2974,35978  >  9001 [ACK] Seq=94734997 Ack=5292091 Win=65535 Len=2920 [TCP segment of a reassembled PDU]
1,3.445607999999993,62.210.85.178,10.0.2.15,TCP,60,9001  >  35978 [ACK] Seq=5292091 Ack=94732387 Win=65535 Len=0
1,3.4456169999998565,62.210.85.178,10.0.2.15,TCP,60,9001  >  35978 [ACK] Seq=5292091 Ack=94733847 Win=65535 Len=0
1,3.44562199999973,62.210.85.178,10.0.2.15,TCP,60,9001  >  35978 [ACK] Seq=5292091 Ack=94734997 Win=65535 Len=0
1,3.44562599999972,62.210.85.178,10.0.2.15,TCP,60,9001  >  35978 [ACK] Seq=5292091 Ack=94736457 Win=65535 Len=0
1,3.44562999999971,62.210.85.178,10.0.2.15,TCP,60,9001  >  35978 [ACK] Seq=5292091 Ack=94737917 Win=65535 Len=0
1,3.4456719999998313,10.0.2.15,62.210.85.178,TLSv1.2,1204,Application Data
1,3.445738999999776,10.0.2.15,62.210.85.178,TCP,1514,35978  >  9001 [ACK] Seq=94739067 Ack=5292091 Win=65535 Len=1460 [TCP segment of a reassembled PDU]
1,3.4457759999995687,62.210.85.178,10.0.2.15,TCP,60,9001  >  35978 [ACK] Seq=5292091 Ack=94739067 Win=65535 Len=0
1,3.445781999999781,62.210.85.178,10.0.2.15,TCP,60,9001  >  35978 [ACK] Seq=5292091 Ack=94740527 Win=65535 Len=0
1,3.445814999999584,10.0.2.15,62.210.85.178,TLSv1.2,1314,Application Data
1,3.445853999999599,62.210.85.178,10.0.2.15,TCP,60,9001  >  35978 [ACK] Seq=5292091 Ack=94741787 Win=65535 Len=0
1,3.5537899999999354,54.93.77.70,10.0.2.15,TLSv1.2,590,Application Data
1,3.582905999999639,54.93.77.70,10.0.2.15,TCP,2950,"9001  >  34692 [PSH, ACK] Seq=94554073 Ack=5287933 Win=65535 Len=2896 [TCP segment of a reassembled PDU]"
1,3.5830669999995735,10.0.2.15,54.93.77.70,TCP,54,34692  >  9001 [ACK] Seq=5287933 Ack=94556969 Win=65535 Len=0
1,3.5845179999996617,54.93.77.70,10.0.2.15,TLSv1.2,7294,"Application Data, Application Data"
1,3.5845879999997123,10.0.2.15,54.93.77.70,TCP,54,34692  >  9001 [ACK] Seq=5287933 Ack=94564209 Win=65535 Len=0
1,3.601492999999664,54.93.77.70,10.0.2.15,TLSv1.2,778,Application Data
1,3.603770999999597,10.0.2.15,54.93.77.70,TLSv1.2,590,Application Data
1,3.6039599999999155,54.93.77.70,10.0.2.15,TCP,60,9001  >  34692 [ACK] Seq=94564933 Ack=5288469 Win=65535 Len=0
1,3.8294559999999365,62.210.85.178,10.0.2.15,TLSv1.2,590,Application Data
1,3.8300609999996595,10.0.2.15,62.210.85.178,TLSv1.2,590,Application Data
1,3.8302279999998063,62.210.85.178,10.0.2.15,TCP,60,9001  >  35978 [ACK] Seq=5292627 Ack=94742323 Win=65535 Len=0
1,3.9357239999999365,54.93.77.70,10.0.2.15,TLSv1.2,590,Application Data
1,3.9361149999999725,10.0.2.15,54.93.77.70,TLSv1.2,590,Application Data
1,3.9362559999999576,54.93.77.70,10.0.2.15,TCP,60,9001  >  34692 [ACK] Seq=94565469 Ack=5289005 Win=65535 Len=0
1,4.04636199999959,62.210.85.178,10.0.2.15,TLSv1.2,590,Application Data
1,4.052624999999807,10.0.2.15,62.210.85.178,TLSv1.2,590,Application Data
1,4.052780999999868,62.210.85.178,10.0.2.15,TCP,60,9001  >  35978 [ACK] Seq=5293163 Ack=94742859 Win=65535 Len=0
1,4.0653089999996155,10.0.2.15,62.210.85.178,TLSv1.2,4124,Application Data
1,4.065405999999712,10.0.2.15,62.210.85.178,TCP,2974,35978  >  9001 [ACK] Seq=94746929 Ack=5293163 Win=65535 Len=2920 [TCP segment of a reassembled PDU]
1,4.065448999999717,62.210.85.178,10.0.2.15,TCP,60,9001  >  35978 [ACK] Seq=5293163 Ack=94744319 Win=65535 Len=0
1,4.0654609999996865,62.210.85.178,10.0.2.15,TCP,60,9001  >  35978 [ACK] Seq=5293163 Ack=94745779 Win=65535 Len=0
1,4.065466999999899,62.210.85.178,10.0.2.15,TCP,60,9001  >  35978 [ACK] Seq=5293163 Ack=94746929 Win=65535 Len=0
1,4.065470999999889,62.210.85.178,10.0.2.15,TCP,60,9001  >  35978 [ACK] Seq=5293163 Ack=94748389 Win=65535 Len=0
1,4.0654749999998785,62.210.85.178,10.0.2.15,TCP,60,9001  >  35978 [ACK] Seq=5293163 Ack=94749849 Win=65535 Len=0
1,4.065511999999671,10.0.2.15,62.210.85.178,TLSv1.2,1204,Application Data
1,4.065544999999929,62.210.85.178,10.0.2.15,TCP,60,9001  >  35978 [ACK] Seq=5293163 Ack=94750999 Win=65535 Len=0
1,4.065589999999702,10.0.2.15,62.210.85.178,TLSv1.2,4124,Application Data
1,4.065625999999611,62.210.85.178,10.0.2.15,TCP,60,9001  >  35978 [ACK] Seq=5293163 Ack=94752459 Win=65535 Len=0
1,4.065632999999707,62.210.85.178,10.0.2.15,TCP,60,9001  >  35978 [ACK] Seq=5293163 Ack=94753919 Win=65535 Len=0
1,4.065635999999813,62.210.85.178,10.0.2.15,TCP,60,9001  >  35978 [ACK] Seq=5293163 Ack=94755069 Win=65535 Len=0
1,4.0656739999999445,10.0.2.15,62.210.85.178,TLSv1.2,4124,Application Data
1,4.06570899999997,62.210.85.178,10.0.2.15,TCP,60,9001  >  35978 [ACK] Seq=5293163 Ack=94756529 Win=65535 Len=0
1,4.065714999999727,62.210.85.178,10.0.2.15,TCP,60,9001  >  35978 [ACK] Seq=5293163 Ack=94757989 Win=65535 Len=0
1,4.065770999999586,10.0.2.15,62.210.85.178,TLSv1.2,2974,Application Data
1,4.06580699999995,62.210.85.178,10.0.2.15,TCP,60,9001  >  35978 [ACK] Seq=5293163 Ack=94759139 Win=65535 Len=0
1,4.065813999999591,62.210.85.178,10.0.2.15,TCP,60,9001  >  35978 [ACK] Seq=5293163 Ack=94760599 Win=65535 Len=0
1,4.065816999999697,62.210.85.178,10.0.2.15,TCP,60,9001  >  35978 [ACK] Seq=5293163 Ack=94762059 Win=65535 Len=0
1,4.065843999999743,10.0.2.15,62.210.85.178,TLSv1.2,1226,Application Data
1,4.065877,62.210.85.178,10.0.2.15,TCP,60,9001  >  35978 [ACK] Seq=5293163 Ack=94763231 Win=65535 Len=0
1,4.065923999999995,10.0.2.15,62.210.85.178,TLSv1.2,4124,Application Data
1,4.065960999999788,62.210.85.178,10.0.2.15,TCP,60,9001  >  35978 [ACK] Seq=5293163 Ack=94764691 Win=65535 Len=0
1,4.065967999999884,62.210.85.178,10.0.2.15,TCP,60,9001  >  35978 [ACK] Seq=5293163 Ack=94766151 Win=65535 Len=0
1,4.0659709999999905,62.210.85.178,10.0.2.15,TCP,60,9001  >  35978 [ACK] Seq=5293163 Ack=94767301 Win=65535 Len=0
1,4.066007999999783,10.0.2.15,62.210.85.178,TLSv1.2,3030,Application Data
1,4.066042999999809,62.210.85.178,10.0.2.15,TCP,60,9001  >  35978 [ACK] Seq=5293163 Ack=94768761 Win=65535 Len=0
1,4.066048999999566,62.210.85.178,10.0.2.15,TCP,60,9001  >  35978 [ACK] Seq=5293163 Ack=94770221 Win=65535 Len=0
1,4.066051999999672,62.210.85.178,10.0.2.15,TCP,60,9001  >  35978 [ACK] Seq=5293163 Ack=94770277 Win=65535 Len=0
1,4.075270999999702,10.0.2.15,62.210.85.178,TLSv1.2,4124,Application Data
1,4.075352999999723,62.210.85.178,10.0.2.15,TCP,60,9001  >  35978 [ACK] Seq=5293163 Ack=94771737 Win=65535 Len=0
1,4.075364999999692,62.210.85.178,10.0.2.15,TCP,60,9001  >  35978 [ACK] Seq=5293163 Ack=94773197 Win=65535 Len=0
1,4.0753679999997985,62.210.85.178,10.0.2.15,TCP,60,9001  >  35978 [ACK] Seq=5293163 Ack=94774347 Win=65535 Len=0
1,4.075408999999581,10.0.2.15,62.210.85.178,TLSv1.2,4124,Application Data
1,4.075460999999905,62.210.85.178,10.0.2.15,TCP,60,9001  >  35978 [ACK] Seq=5293163 Ack=94775807 Win=65535 Len=0
1,4.075468000000001,62.210.85.178,10.0.2.15,TCP,60,9001  >  35978 [ACK] Seq=5293163 Ack=94777267 Win=65535 Len=0
1,4.075470999999652,62.210.85.178,10.0.2.15,TCP,60,9001  >  35978 [ACK] Seq=5293163 Ack=94778417 Win=65535 Len=0
1,4.0755079999999,10.0.2.15,62.210.85.178,TLSv1.2,4124,Application Data
1,4.0755419999995866,62.210.85.178,10.0.2.15,TCP,60,9001  >  35978 [ACK] Seq=5293163 Ack=94779877 Win=65535 Len=0
1,4.075548999999683,62.210.85.178,10.0.2.15,TCP,60,9001  >  35978 [ACK] Seq=5293163 Ack=94781337 Win=65535 Len=0
1,4.0755529999996725,62.210.85.178,10.0.2.15,TCP,60,9001  >  35978 [ACK] Seq=5293163 Ack=94782487 Win=65535 Len=0
1,4.0755979999999,10.0.2.15,62.210.85.178,TLSv1.2,4124,Application Data
1,4.075631999999587,62.210.85.178,10.0.2.15,TCP,60,9001  >  35978 [ACK] Seq=5293163 Ack=94783947 Win=65535 Len=0
1,4.075638999999683,62.210.85.178,10.0.2.15,TCP,60,9001  >  35978 [ACK] Seq=5293163 Ack=94785407 Win=65535 Len=0
1,4.075642999999673,62.210.85.178,10.0.2.15,TCP,60,9001  >  35978 [ACK] Seq=5293163 Ack=94786557 Win=65535 Len=0
1,4.075676999999814,10.0.2.15,62.210.85.178,TLSv1.2,332,Application Data
1,4.075709999999617,62.210.85.178,10.0.2.15,TCP,60,9001  >  35978 [ACK] Seq=5293163 Ack=94786835 Win=65535 Len=0
1,4.075762999999824,10.0.2.15,62.210.85.178,TLSv1.2,3868,Application Data
1,4.075799999999617,62.210.85.178,10.0.2.15,TCP,60,9001  >  35978 [ACK] Seq=5293163 Ack=94788295 Win=65535 Len=0
1,4.0758059999998295,62.210.85.178,10.0.2.15,TCP,60,9001  >  35978 [ACK] Seq=5293163 Ack=94789755 Win=65535 Len=0
1,4.075808999999936,62.210.85.178,10.0.2.15,TCP,60,9001  >  35978 [ACK] Seq=5293163 Ack=94790649 Win=65535 Len=0
1,4.0758459999997285,10.0.2.15,62.210.85.178,TLSv1.2,4124,Application Data
1,4.075880999999754,62.210.85.178,10.0.2.15,TCP,60,9001  >  35978 [ACK] Seq=5293163 Ack=94792109 Win=65535 Len=0
1,4.07588799999985,62.210.85.178,10.0.2.15,TCP,60,9001  >  35978 [ACK] Seq=5293163 Ack=94793569 Win=65535 Len=0
1,4.075889999999617,62.210.85.178,10.0.2.15,TCP,60,9001  >  35978 [ACK] Seq=5293163 Ack=94794719 Win=65535 Len=0
1,4.075924999999643,10.0.2.15,62.210.85.178,TLSv1.2,3030,Application Data
1,4.075959999999668,62.210.85.178,10.0.2.15,TCP,60,9001  >  35978 [ACK] Seq=5293163 Ack=94796179 Win=65535 Len=0
1,4.075966999999764,62.210.85.178,10.0.2.15,TCP,60,9001  >  35978 [ACK] Seq=5293163 Ack=94797639 Win=65535 Len=0
1,4.075968999999986,62.210.85.178,10.0.2.15,TCP,60,9001  >  35978 [ACK] Seq=5293163 Ack=94797695 Win=65535 Len=0
1,4.088665999999648,10.0.2.15,62.210.85.178,TLSv1.2,4124,Application Data
1,4.0887549999997646,10.0.2.15,62.210.85.178,TCP,2974,35978  >  9001 [ACK] Seq=94801765 Ack=5293163 Win=65535 Len=2920 [TCP segment of a reassembled PDU]
1,4.088794999999664,62.210.85.178,10.0.2.15,TCP,60,9001  >  35978 [ACK] Seq=5293163 Ack=94799155 Win=65535 Len=0
1,4.088804999999866,62.210.85.178,10.0.2.15,TCP,60,9001  >  35978 [ACK] Seq=5293163 Ack=94800615 Win=65535 Len=0
1,4.088807999999972,62.210.85.178,10.0.2.15,TCP,60,9001  >  35978 [ACK] Seq=5293163 Ack=94801765 Win=65535 Len=0
1,4.088810999999623,62.210.85.178,10.0.2.15,TCP,60,9001  >  35978 [ACK] Seq=5293163 Ack=94803225 Win=65535 Len=0
1,4.0888129999998455,62.210.85.178,10.0.2.15,TCP,60,9001  >  35978 [ACK] Seq=5293163 Ack=94804685 Win=65535 Len=0
1,4.088846999999987,10.0.2.15,62.210.85.178,TLSv1.2,1204,Application Data
1,4.088877999999568,62.210.85.178,10.0.2.15,TCP,60,9001  >  35978 [ACK] Seq=5293163 Ack=94805835 Win=65535 Len=0
1,4.088922999999795,10.0.2.15,62.210.85.178,TLSv1.2,4124,Application Data
1,4.088956999999937,62.210.85.178,10.0.2.15,TCP,60,9001  >  35978 [ACK] Seq=5293163 Ack=94807295 Win=65535 Len=0
1,4.0889649999999165,62.210.85.178,10.0.2.15,TCP,60,9001  >  35978 [ACK] Seq=5293163 Ack=94808755 Win=65535 Len=0
1,4.088968999999906,62.210.85.178,10.0.2.15,TCP,60,9001  >  35978 [ACK] Seq=5293163 Ack=94809905 Win=65535 Len=0
1,4.089014999999563,10.0.2.15,62.210.85.178,TLSv1.2,4124,Application Data
1,4.089048999999704,62.210.85.178,10.0.2.15,TCP,60,9001  >  35978 [ACK] Seq=5293163 Ack=94811365 Win=65535 Len=0
1,4.0890559999998,62.210.85.178,10.0.2.15,TCP,60,9001  >  35978 [ACK] Seq=5293163 Ack=94812825 Win=65535 Len=0
1,4.08905999999979,62.210.85.178,10.0.2.15,TCP,60,9001  >  35978 [ACK] Seq=5293163 Ack=94813975 Win=65535 Len=0
1,4.089093999999932,10.0.2.15,62.210.85.178,TLSv1.2,332,Application Data
1,4.089126999999735,62.210.85.178,10.0.2.15,TCP,60,9001  >  35978 [ACK] Seq=5293163 Ack=94814253 Win=65535 Len=0
1,4.089180999999826,10.0.2.15,62.210.85.178,TLSv1.2,3868,Application Data
1,4.089216999999735,62.210.85.178,10.0.2.15,TCP,60,9001  >  35978 [ACK] Seq=5293163 Ack=94815713 Win=65535 Len=0
1,4.089223999999831,62.210.85.178,10.0.2.15,TCP,60,9001  >  35978 [ACK] Seq=5293163 Ack=94817173 Win=65535 Len=0
1,4.089226999999937,62.210.85.178,10.0.2.15,TCP,60,9001  >  35978 [ACK] Seq=5293163 Ack=94818067 Win=65535 Len=0
1,4.08926399999973,10.0.2.15,62.210.85.178,TLSv1.2,4124,Application Data
1,4.089298999999755,62.210.85.178,10.0.2.15,TCP,60,9001  >  35978 [ACK] Seq=5293163 Ack=94819527 Win=65535 Len=0
1,4.089305999999851,62.210.85.178,10.0.2.15,TCP,60,9001  >  35978 [ACK] Seq=5293163 Ack=94820987 Win=65535 Len=0
1,4.0893089999999575,62.210.85.178,10.0.2.15,TCP,60,9001  >  35978 [ACK] Seq=5293163 Ack=94822137 Win=65535 Len=0
1,4.089342999999644,10.0.2.15,62.210.85.178,TLSv1.2,3030,Application Data
1,4.0893779999996696,62.210.85.178,10.0.2.15,TCP,60,9001  >  35978 [ACK] Seq=5293163 Ack=94823597 Win=65535 Len=0
1,4.089383999999882,62.210.85.178,10.0.2.15,TCP,60,9001  >  35978 [ACK] Seq=5293163 Ack=94825057 Win=65535 Len=0
1,4.089386999999988,62.210.85.178,10.0.2.15,TCP,60,9001  >  35978 [ACK] Seq=5293163 Ack=94825113 Win=65535 Len=0
1,4.098626999999851,10.0.2.15,62.210.85.178,TLSv1.2,1104,Application Data
1,4.098720999999841,62.210.85.178,10.0.2.15,TCP,60,9001  >  35978 [ACK] Seq=5293163 Ack=94826163 Win=65535 Len=0
1,4.1426799999999275,54.93.77.70,10.0.2.15,TLSv1.2,590,Application Data
1,4.180522999999994,54.93.77.70,10.0.2.15,TLSv1.2,5846,Application Data
1,4.180591999999706,54.93.77.70,10.0.2.15,TLSv1.2,7294,"Application Data, Application Data"
1,4.180655999999999,10.0.2.15,54.93.77.70,TCP,54,34692  >  9001 [ACK] Seq=5289005 Ack=94571797 Win=65535 Len=0
1,4.1807669999998325,10.0.2.15,54.93.77.70,TCP,54,34692  >  9001 [ACK] Seq=5289005 Ack=94579037 Win=65535 Len=0
1,4.1811399999996866,10.0.2.15,54.93.77.70,TLSv1.2,590,Application Data
1,4.181247999999869,54.93.77.70,10.0.2.15,TCP,60,9001  >  34692 [ACK] Seq=94579037 Ack=5289541 Win=65535 Len=0
1,4.196668999999929,54.93.77.70,10.0.2.15,TLSv1.2,2016,Application Data
1,4.196729999999661,10.0.2.15,54.93.77.70,TCP,54,34692  >  9001 [ACK] Seq=5289541 Ack=94580999 Win=65535 Len=0
1,4.198844999999892,54.93.77.70,10.0.2.15,TCP,2950,"9001  >  34692 [PSH, ACK] Seq=94580999 Ack=5289541 Win=65535 Len=2896 [TCP segment of a reassembled PDU]"
1,4.198894999999993,10.0.2.15,54.93.77.70,TCP,54,34692  >  9001 [ACK] Seq=5289541 Ack=94583895 Win=65535 Len=0
1,4.21028299999989,54.93.77.70,10.0.2.15,TLSv1.2,5846,"Application Data, Application Data"
1,4.210356999999931,10.0.2.15,54.93.77.70,TCP,54,34692  >  9001 [ACK] Seq=5289541 Ack=94589687 Win=65535 Len=0
1,4.212203999999929,54.93.77.70,10.0.2.15,TLSv1.2,5846,Application Data [TCP segment of a reassembled PDU]
1,4.212290999999823,10.0.2.15,54.93.77.70,TCP,54,34692  >  9001 [ACK] Seq=5289541 Ack=94595479 Win=65535 Len=0
1,4.212495999999646,10.0.2.15,54.93.77.70,TLSv1.2,590,Application Data
1,4.212626,54.93.77.70,10.0.2.15,TCP,60,9001  >  34692 [ACK] Seq=94595479 Ack=5290077 Win=65535 Len=0
1,4.212964999999713,54.93.77.70,10.0.2.15,TLSv1.2,1082,Application Data
1,4.256265999999869,10.0.2.15,54.93.77.70,TCP,54,34692  >  9001 [ACK] Seq=5290077 Ack=94596507 Win=65535 Len=0
1,4.256425999999919,54.93.77.70,10.0.2.15,TCP,2950,"9001  >  34692 [PSH, ACK] Seq=94596507 Ack=5290077 Win=65535 Len=2896 [TCP segment of a reassembled PDU]"
1,4.256484,10.0.2.15,54.93.77.70,TCP,54,34692  >  9001 [ACK] Seq=5290077 Ack=94599403 Win=65535 Len=0
1,4.264582999999675,54.93.77.70,10.0.2.15,TLSv1.2,2950,Application Data [TCP segment of a reassembled PDU]
1,4.26462599999968,10.0.2.15,54.93.77.70,TCP,54,34692  >  9001 [ACK] Seq=5290077 Ack=94602299 Win=65535 Len=0
1,4.265434999999798,54.93.77.70,10.0.2.15,TLSv1.2,8574,"Application Data, Application Data"
1,4.26547599999958,10.0.2.15,54.93.77.70,TCP,54,34692  >  9001 [ACK] Seq=5290077 Ack=94610819 Win=65535 Len=0
1,4.265524999999798,54.93.77.70,10.0.2.15,TLSv1.2,1670,Application Data [TCP segment of a reassembled PDU]
1,4.265557999999601,10.0.2.15,54.93.77.70,TCP,54,34692  >  9001 [ACK] Seq=5290077 Ack=94612435 Win=65535 Len=0
1,4.2700779999995575,54.93.77.70,10.0.2.15,TLSv1.2,170,Application Data
1,4.270140999999967,10.0.2.15,54.93.77.70,TCP,54,34692  >  9001 [ACK] Seq=5290077 Ack=94612551 Win=65535 Len=0
1,4.275700999999572,54.93.77.70,10.0.2.15,TCP,2950,"9001  >  34692 [PSH, ACK] Seq=94612551 Ack=5290077 Win=65535 Len=2896 [TCP segment of a reassembled PDU]"
1,4.275771999999961,10.0.2.15,54.93.77.70,TCP,54,34692  >  9001 [ACK] Seq=5290077 Ack=94615447 Win=65535 Len=0
1,4.2770459999997,54.93.77.70,10.0.2.15,TLSv1.2,4398,Application Data [TCP segment of a reassembled PDU]
1,4.277114999999867,10.0.2.15,54.93.77.70,TCP,54,34692  >  9001 [ACK] Seq=5290077 Ack=94619791 Win=65535 Len=0
1,4.2883389999997235,54.93.77.70,10.0.2.15,TLSv1.2,568,Application Data
1,4.2883600000000115,54.93.77.70,10.0.2.15,TCP,2950,"9001  >  34692 [PSH, ACK] Seq=94620305 Ack=5290077 Win=65535 Len=2896 [TCP segment of a reassembled PDU]"
1,4.288368999999875,54.93.77.70,10.0.2.15,TLSv1.2,8742,"Application Data, Application Data"
1,4.288414999999986,10.0.2.15,54.93.77.70,TCP,54,34692  >  9001 [ACK] Seq=5290077 Ack=94623201 Win=65535 Len=0
1,4.288497000000007,10.0.2.15,54.93.77.70,TCP,54,34692  >  9001 [ACK] Seq=5290077 Ack=94631889 Win=65535 Len=0
1,4.288688999999977,10.0.2.15,54.93.77.70,TLSv1.2,590,Application Data
1,4.288794999999936,54.93.77.70,10.0.2.15,TCP,60,9001  >  34692 [ACK] Seq=94631889 Ack=5290613 Win=65535 Len=0
1,4.298149999999623,10.0.2.15,54.93.77.70,TLSv1.2,590,Application Data
1,4.298279999999977,54.93.77.70,10.0.2.15,TCP,60,9001  >  34692 [ACK] Seq=94631889 Ack=5291149 Win=65535 Len=0
1,4.300773999999819,54.93.77.70,10.0.2.15,TLSv1.2,7294,"Application Data, Application Data"
1,4.300883999999769,10.0.2.15,54.93.77.70,TCP,54,34692  >  9001 [ACK] Seq=5291149 Ack=94639129 Win=65535 Len=0
1,4.305032999999639,54.93.77.70,10.0.2.15,TLSv1.2,872,Application Data
1,4.314105999999811,54.93.77.70,10.0.2.15,TCP,2950,"9001  >  34692 [PSH, ACK] Seq=94639947 Ack=5291149 Win=65535 Len=2896 [TCP segment of a reassembled PDU]"
1,4.314151999999922,10.0.2.15,54.93.77.70,TCP,54,34692  >  9001 [ACK] Seq=5291149 Ack=94642843 Win=65535 Len=0
1,4.321066999999857,54.93.77.70,10.0.2.15,TLSv1.2,264,Application Data
1,4.321234999999888,10.0.2.15,54.93.77.70,TLSv1.2,590,Application Data
1,4.321349999999711,54.93.77.70,10.0.2.15,TCP,60,9001  >  34692 [ACK] Seq=94643053 Ack=5291685 Win=65535 Len=0
1,4.353813999999602,54.93.77.70,10.0.2.15,TLSv1.2,2646,Application Data
1,4.353905999999824,10.0.2.15,54.93.77.70,TCP,54,34692  >  9001 [ACK] Seq=5291685 Ack=94645645 Win=65535 Len=0
1,4.381202999999914,54.93.77.70,10.0.2.15,TLSv1.2,3674,Application Data
1,4.381305999999768,10.0.2.15,54.93.77.70,TCP,54,34692  >  9001 [ACK] Seq=5291685 Ack=94649265 Win=65535 Len=0
1,4.385274999999638,10.0.2.15,54.93.77.70,TLSv1.2,590,Application Data
1,4.385491999999886,54.93.77.70,10.0.2.15,TCP,60,9001  >  34692 [ACK] Seq=94649265 Ack=5292221 Win=65535 Len=0
1,4.440172999999959,62.210.85.178,10.0.2.15,TLSv1.2,2646,Application Data
1,4.440492999999606,10.0.2.15,62.210.85.178,TCP,54,35978  >  9001 [ACK] Seq=94826163 Ack=5295755 Win=65535 Len=0
1,4.750998999999865,62.210.85.178,10.0.2.15,TLSv1.2,590,Application Data
1,4.751360999999633,10.0.2.15,62.210.85.178,TLSv1.2,590,Application Data
1,4.751498999999967,62.210.85.178,10.0.2.15,TCP,60,9001  >  35978 [ACK] Seq=5296291 Ack=94826699 Win=65535 Len=0
1,4.955939999999828,54.93.77.70,10.0.2.15,TLSv1.2,590,Application Data
1,4.956381999999849,10.0.2.15,54.93.77.70,TLSv1.2,590,Application Data
1,4.956535999999687,54.93.77.70,10.0.2.15,TCP,60,9001  >  34692 [ACK] Seq=94649801 Ack=5292757 Win=65535 Len=0
1,5.160522999999557,62.210.85.178,10.0.2.15,TLSv1.2,590,Application Data
1,5.1679449999996905,10.0.2.15,62.210.85.178,TLSv1.2,590,Application Data
1,5.168165999999928,62.210.85.178,10.0.2.15,TCP,60,9001  >  35978 [ACK] Seq=5296827 Ack=94827235 Win=65535 Len=0
1,5.174507999999605,10.0.2.15,62.210.85.178,TLSv1.2,4124,Application Data
1,5.174670999999762,62.210.85.178,10.0.2.15,TCP,60,9001  >  35978 [ACK] Seq=5296827 Ack=94828695 Win=65535 Len=0
1,5.174695999999585,62.210.85.178,10.0.2.15,TCP,60,9001  >  35978 [ACK] Seq=5296827 Ack=94830155 Win=65535 Len=0
1,5.174698999999691,62.210.85.178,10.0.2.15,TCP,60,9001  >  35978 [ACK] Seq=5296827 Ack=94831305 Win=65535 Len=0
1,5.174771999999848,10.0.2.15,62.210.85.178,TLSv1.2,4124,Application Data
1,5.174845999999889,62.210.85.178,10.0.2.15,TCP,60,9001  >  35978 [ACK] Seq=5296827 Ack=94832765 Win=65535 Len=0
1,5.174858999999742,62.210.85.178,10.0.2.15,TCP,60,9001  >  35978 [ACK] Seq=5296827 Ack=94834225 Win=65535 Len=0
1,5.174862999999732,62.210.85.178,10.0.2.15,TCP,60,9001  >  35978 [ACK] Seq=5296827 Ack=94835375 Win=65535 Len=0
1,5.174910999999611,10.0.2.15,62.210.85.178,TLSv1.2,4124,Application Data
1,5.1749769999996715,62.210.85.178,10.0.2.15,TCP,60,9001  >  35978 [ACK] Seq=5296827 Ack=94836835 Win=65535 Len=0
1,5.17498599999999,62.210.85.178,10.0.2.15,TCP,60,9001  >  35978 [ACK] Seq=5296827 Ack=94838295 Win=65535 Len=0
1,5.174988999999641,62.210.85.178,10.0.2.15,TCP,60,9001  >  35978 [ACK] Seq=5296827 Ack=94839445 Win=65535 Len=0
1,5.1750349999997525,10.0.2.15,62.210.85.178,TLSv1.2,4124,Application Data
1,5.175105999999687,62.210.85.178,10.0.2.15,TCP,60,9001  >  35978 [ACK] Seq=5296827 Ack=94840905 Win=65535 Len=0
1,5.175138999999945,62.210.85.178,10.0.2.15,TCP,60,9001  >  35978 [ACK] Seq=5296827 Ack=94842365 Win=65535 Len=0
1,5.175143999999818,62.210.85.178,10.0.2.15,TCP,60,9001  >  35978 [ACK] Seq=5296827 Ack=94843515 Win=65535 Len=0
1,5.1751869999998235,10.0.2.15,62.210.85.178,TLSv1.2,332,Application Data
1,5.1752480000000105,62.210.85.178,10.0.2.15,TCP,60,9001  >  35978 [ACK] Seq=5296827 Ack=94843793 Win=65535 Len=0
1,5.175333999999566,10.0.2.15,62.210.85.178,TLSv1.2,3868,Application Data
1,5.175397999999859,62.210.85.178,10.0.2.15,TCP,60,9001  >  35978 [ACK] Seq=5296827 Ack=94845253 Win=65535 Len=0
1,5.175406999999723,62.210.85.178,10.0.2.15,TCP,60,9001  >  35978 [ACK] Seq=5296827 Ack=94846713 Win=65535 Len=0
1,5.175410999999713,62.210.85.178,10.0.2.15,TCP,60,9001  >  35978 [ACK] Seq=5296827 Ack=94847607 Win=65535 Len=0
1,5.175457999999708,10.0.2.15,62.210.85.178,TLSv1.2,4124,Application Data
1,5.175522000000001,62.210.85.178,10.0.2.15,TCP,60,9001  >  35978 [ACK] Seq=5296827 Ack=94849067 Win=65535 Len=0
1,5.175530999999864,62.210.85.178,10.0.2.15,TCP,60,9001  >  35978 [ACK] Seq=5296827 Ack=94850527 Win=65535 Len=0
1,5.175534999999854,62.210.85.178,10.0.2.15,TCP,60,9001  >  35978 [ACK] Seq=5296827 Ack=94851677 Win=65535 Len=0
1,5.175578999999743,10.0.2.15,62.210.85.178,TLSv1.2,3030,Application Data
1,5.17564399999992,62.210.85.178,10.0.2.15,TCP,60,9001  >  35978 [ACK] Seq=5296827 Ack=94853137 Win=65535 Len=0
1,5.175653999999668,62.210.85.178,10.0.2.15,TCP,60,9001  >  35978 [ACK] Seq=5296827 Ack=94854597 Win=65535 Len=0
1,5.175656999999774,62.210.85.178,10.0.2.15,TCP,60,9001  >  35978 [ACK] Seq=5296827 Ack=94854653 Win=65535 Len=0
1,5.189250999999786,10.0.2.15,62.210.85.178,TLSv1.2,4124,Application Data
1,5.1894869999996445,62.210.85.178,10.0.2.15,TCP,60,9001  >  35978 [ACK] Seq=5296827 Ack=94856113 Win=65535 Len=0
1,5.189508999999816,62.210.85.178,10.0.2.15,TCP,60,9001  >  35978 [ACK] Seq=5296827 Ack=94857573 Win=65535 Len=0
1,5.18951399999969,62.210.85.178,10.0.2.15,TCP,60,9001  >  35978 [ACK] Seq=5296827 Ack=94858723 Win=65535 Len=0
1,5.189592999999604,10.0.2.15,62.210.85.178,TLSv1.2,4124,Application Data
1,5.189690999999584,62.210.85.178,10.0.2.15,TCP,60,9001  >  35978 [ACK] Seq=5296827 Ack=94860183 Win=65535 Len=0
1,5.1896999999999025,62.210.85.178,10.0.2.15,TCP,60,9001  >  35978 [ACK] Seq=5296827 Ack=94861643 Win=65535 Len=0
1,5.189703999999892,62.210.85.178,10.0.2.15,TCP,60,9001  >  35978 [ACK] Seq=5296827 Ack=94862793 Win=65535 Len=0
1,5.1897539999999935,10.0.2.15,62.210.85.178,TLSv1.2,4124,Application Data
1,5.189840999999888,62.210.85.178,10.0.2.15,TCP,60,9001  >  35978 [ACK] Seq=5296827 Ack=94864253 Win=65535 Len=0
1,5.1898519999999735,62.210.85.178,10.0.2.15,TCP,60,9001  >  35978 [ACK] Seq=5296827 Ack=94865713 Win=65535 Len=0
1,5.189856999999847,62.210.85.178,10.0.2.15,TCP,60,9001  >  35978 [ACK] Seq=5296827 Ack=94866863 Win=65535 Len=0
1,5.189903999999842,10.0.2.15,62.210.85.178,TLSv1.2,4124,Application Data
1,5.18998399999964,62.210.85.178,10.0.2.15,TCP,60,9001  >  35978 [ACK] Seq=5296827 Ack=94868323 Win=65535 Len=0
1,5.18999199999962,62.210.85.178,10.0.2.15,TCP,60,9001  >  35978 [ACK] Seq=5296827 Ack=94869783 Win=65535 Len=0
1,5.18999599999961,62.210.85.178,10.0.2.15,TCP,60,9001  >  35978 [ACK] Seq=5296827 Ack=94870933 Win=65535 Len=0
1,5.190042999999605,10.0.2.15,62.210.85.178,TLSv1.2,332,Application Data
1,5.19010199999957,62.210.85.178,10.0.2.15,TCP,60,9001  >  35978 [ACK] Seq=5296827 Ack=94871211 Win=65535 Len=0
1,5.190174999999726,10.0.2.15,62.210.85.178,TLSv1.2,1618,Application Data
1,5.190241999999671,62.210.85.178,10.0.2.15,TCP,60,9001  >  35978 [ACK] Seq=5296827 Ack=94872671 Win=65535 Len=0
1,5.190252999999757,62.210.85.178,10.0.2.15,TCP,60,9001  >  35978 [ACK] Seq=5296827 Ack=94872775 Win=65535 Len=0
1,5.275459999999839,54.93.77.70,10.0.2.15,TLSv1.2,590,Application Data
1,5.283433999999943,54.93.77.70,10.0.2.15,TCP,2950,"9001  >  34692 [PSH, ACK] Seq=94650337 Ack=5292757 Win=65535 Len=2896 [TCP segment of a reassembled PDU]"
1,5.283551999999872,10.0.2.15,54.93.77.70,TCP,54,34692  >  9001 [ACK] Seq=5292757 Ack=94653233 Win=65535 Len=0
1,5.29510399999981,54.93.77.70,10.0.2.15,TLSv1.2,4398,"Application Data, Application Data"
1,5.2951929999999265,10.0.2.15,54.93.77.70,TCP,54,34692  >  9001 [ACK] Seq=5292757 Ack=94657577 Win=65535 Len=0
1,5.326461999999992,54.93.77.70,10.0.2.15,TLSv1.2,3674,Application Data
1,5.326529999999821,10.0.2.15,54.93.77.70,TCP,54,34692  >  9001 [ACK] Seq=5292757 Ack=94661197 Win=65535 Len=0
1,5.337118999999802,54.93.77.70,10.0.2.15,TLSv1.2,4398,Application Data
1,5.337176999999883,10.0.2.15,54.93.77.70,TCP,54,34692  >  9001 [ACK] Seq=5292757 Ack=94665541 Win=65535 Len=0
1,5.339220999999725,54.93.77.70,10.0.2.15,TLSv1.2,8574,"Application Data, Application Data"
1,5.3392839999996795,10.0.2.15,54.93.77.70,TCP,54,34692  >  9001 [ACK] Seq=5292757 Ack=94674061 Win=65535 Len=0
1,5.3393309999996745,54.93.77.70,10.0.2.15,TCP,1670,"9001  >  34692 [PSH, ACK] Seq=94674061 Ack=5292757 Win=65535 Len=1616 [TCP segment of a reassembled PDU]"
1,5.339456999999584,10.0.2.15,54.93.77.70,TCP,54,34692  >  9001 [ACK] Seq=5292757 Ack=94675677 Win=65535 Len=0
1,5.342591999999968,54.93.77.70,10.0.2.15,TLSv1.2,1082,Application Data
1,5.342773999999736,10.0.2.15,54.93.77.70,TLSv1.2,590,Application Data
1,5.342888999999559,54.93.77.70,10.0.2.15,TCP,60,9001  >  34692 [ACK] Seq=94676705 Ack=5293293 Win=65535 Len=0
1,5.346180000000004,54.93.77.70,10.0.2.15,TCP,2950,"9001  >  34692 [PSH, ACK] Seq=94676705 Ack=5293293 Win=65535 Len=2896 [TCP segment of a reassembled PDU]"
1,5.34624599999961,10.0.2.15,54.93.77.70,TCP,54,34692  >  9001 [ACK] Seq=5293293 Ack=94679601 Win=65535 Len=0
1,5.347842999999557,54.93.77.70,10.0.2.15,TLSv1.2,4398,Application Data [TCP segment of a reassembled PDU]
1,5.34790299999986,10.0.2.15,54.93.77.70,TCP,54,34692  >  9001 [ACK] Seq=5293293 Ack=94683945 Win=65535 Len=0
1,5.354377999999997,10.0.2.15,54.93.77.70,TLSv1.2,590,Application Data
1,5.354505999999674,54.93.77.70,10.0.2.15,TCP,60,9001  >  34692 [ACK] Seq=94683945 Ack=5293829 Win=65535 Len=0
1,5.3577879999998,54.93.77.70,10.0.2.15,TLSv1.2,2950,Application Data [TCP segment of a reassembled PDU]
1,5.357852999999977,10.0.2.15,54.93.77.70,TCP,54,34692  >  9001 [ACK] Seq=5293829 Ack=94686841 Win=65535 Len=0
1,5.359827999999652,54.93.77.70,10.0.2.15,TLSv1.2,778,Application Data
1,5.368662999999742,54.93.77.70,10.0.2.15,TCP,2950,"9001  >  34692 [PSH, ACK] Seq=94687565 Ack=5293829 Win=65535 Len=2896 [TCP segment of a reassembled PDU]"
1,5.368685999999798,54.93.77.70,10.0.2.15,TLSv1.2,2950,Application Data [TCP segment of a reassembled PDU]
1,5.368735999999899,10.0.2.15,54.93.77.70,TCP,54,34692  >  9001 [ACK] Seq=5293829 Ack=94690461 Win=65535 Len=0
1,5.368816999999581,10.0.2.15,54.93.77.70,TCP,54,34692  >  9001 [ACK] Seq=5293829 Ack=94693357 Win=65535 Len=0
1,5.38078299999961,54.93.77.70,10.0.2.15,TLSv1.2,1502,Application Data [TCP segment of a reassembled PDU]
1,5.3808319999998275,10.0.2.15,54.93.77.70,TCP,54,34692  >  9001 [ACK] Seq=5293829 Ack=94694805 Win=65535 Len=0
1,5.384981999999582,54.93.77.70,10.0.2.15,TLSv1.2,1104,Application Data
1,5.390289999999823,10.0.2.15,54.93.77.70,TLSv1.2,590,Application Data
1,5.390445,54.93.77.70,10.0.2.15,TCP,60,9001  >  34692 [ACK] Seq=94695855 Ack=5294365 Win=65535 Len=0
1,5.456101999999646,62.210.85.178,10.0.2.15,TLSv1.2,590,Application Data
1,5.496291999999812,10.0.2.15,62.210.85.178,TCP,54,35978  >  9001 [ACK] Seq=94872775 Ack=5297363 Win=65535 Len=0
1,5.599170999999842,62.210.85.178,10.0.2.15,TLSv1.2,1104,Application Data
1,5.599268999999822,10.0.2.15,62.210.85.178,TCP,54,35978  >  9001 [ACK] Seq=94872775 Ack=5298413 Win=65535 Len=0
1,5.5996269999996,10.0.2.15,62.210.85.178,TLSv1.2,590,Application Data
1,5.599764999999934,62.210.85.178,10.0.2.15,TCP,60,9001  >  35978 [ACK] Seq=5298413 Ack=94873311 Win=65535 Len=0
1,5.724768999999924,54.93.77.70,10.0.2.15,TLSv1.2,590,Application Data
1,5.725561999999627,10.0.2.15,54.93.77.70,TLSv1.2,590,Application Data
1,5.725728999999774,54.93.77.70,10.0.2.15,TCP,60,9001  >  34692 [ACK] Seq=94696391 Ack=5294901 Win=65535 Len=0
1,5.844136999999591,62.210.85.178,10.0.2.15,TLSv1.2,590,Application Data
1,5.849700999999641,10.0.2.15,62.210.85.178,TLSv1.2,590,Application Data
1,5.849913999999899,62.210.85.178,10.0.2.15,TCP,60,9001  >  35978 [ACK] Seq=5298949 Ack=94873847 Win=65535 Len=0
1,5.865303999999924,10.0.2.15,62.210.85.178,TLSv1.2,4124,Application Data
1,5.865414999999757,10.0.2.15,62.210.85.178,TCP,2974,35978  >  9001 [ACK] Seq=94877917 Ack=5298949 Win=65535 Len=2920 [TCP segment of a reassembled PDU]
1,5.865459999999985,62.210.85.178,10.0.2.15,TCP,60,9001  >  35978 [ACK] Seq=5298949 Ack=94875307 Win=65535 Len=0
1,5.865481999999702,62.210.85.178,10.0.2.15,TCP,60,9001  >  35978 [ACK] Seq=5298949 Ack=94876767 Win=65535 Len=0
1,5.865485999999692,62.210.85.178,10.0.2.15,TCP,60,9001  >  35978 [ACK] Seq=5298949 Ack=94877917 Win=65535 Len=0
1,5.865490999999565,62.210.85.178,10.0.2.15,TCP,60,9001  >  35978 [ACK] Seq=5298949 Ack=94879377 Win=65535 Len=0
1,5.86549500000001,62.210.85.178,10.0.2.15,TCP,60,9001  >  35978 [ACK] Seq=5298949 Ack=94880837 Win=65535 Len=0
1,5.865538999999899,10.0.2.15,62.210.85.178,TLSv1.2,1204,Application Data
1,5.865606999999727,10.0.2.15,62.210.85.178,TCP,2974,35978  >  9001 [ACK] Seq=94881987 Ack=5298949 Win=65535 Len=2920 [TCP segment of a reassembled PDU]
1,5.865645999999742,62.210.85.178,10.0.2.15,TCP,60,9001  >  35978 [ACK] Seq=5298949 Ack=94881987 Win=65535 Len=0
1,5.865651999999955,62.210.85.178,10.0.2.15,TCP,60,9001  >  35978 [ACK] Seq=5298949 Ack=94883447 Win=65535 Len=0
1,5.865656999999828,62.210.85.178,10.0.2.15,TCP,60,9001  >  35978 [ACK] Seq=5298949 Ack=94884907 Win=65535 Len=0
1,5.86569099999997,10.0.2.15,62.210.85.178,TLSv1.2,1204,Application Data
1,5.86576500000001,62.210.85.178,10.0.2.15,TCP,60,9001  >  35978 [ACK] Seq=5298949 Ack=94886057 Win=65535 Len=0
1,5.8657969999999295,10.0.2.15,62.210.85.178,TCP,2974,35978  >  9001 [ACK] Seq=94886057 Ack=5298949 Win=65535 Len=2920 [TCP segment of a reassembled PDU]
1,5.865834999999606,62.210.85.178,10.0.2.15,TCP,60,9001  >  35978 [ACK] Seq=5298949 Ack=94887517 Win=65535 Len=0
1,5.865841999999702,62.210.85.178,10.0.2.15,TCP,60,9001  >  35978 [ACK] Seq=5298949 Ack=94888977 Win=65535 Len=0
1,5.865872999999738,10.0.2.15,62.210.85.178,TLSv1.2,1204,Application Data
1,5.865938999999798,62.210.85.178,10.0.2.15,TCP,60,9001  >  35978 [ACK] Seq=5298949 Ack=94890127 Win=65535 Len=0
1,5.86598099999992,10.0.2.15,62.210.85.178,TLSv1.2,332,Application Data
1,5.866019999999935,62.210.85.178,10.0.2.15,TCP,60,9001  >  35978 [ACK] Seq=5298949 Ack=94890405 Win=65535 Len=0
1,5.866085999999996,10.0.2.15,62.210.85.178,TLSv1.2,3868,Application Data
1,5.866149999999834,62.210.85.178,10.0.2.15,TCP,60,9001  >  35978 [ACK] Seq=5298949 Ack=94891865 Win=65535 Len=0
1,5.86615699999993,62.210.85.178,10.0.2.15,TCP,60,9001  >  35978 [ACK] Seq=5298949 Ack=94893325 Win=65535 Len=0
1,5.86616099999992,62.210.85.178,10.0.2.15,TCP,60,9001  >  35978 [ACK] Seq=5298949 Ack=94894219 Win=65535 Len=0
1,5.866221999999652,10.0.2.15,62.210.85.178,TLSv1.2,4124,Application Data
1,5.866287999999713,62.210.85.178,10.0.2.15,TCP,60,9001  >  35978 [ACK] Seq=5298949 Ack=94895679 Win=65535 Len=0
1,5.866294999999809,62.210.85.178,10.0.2.15,TCP,60,9001  >  35978 [ACK] Seq=5298949 Ack=94897139 Win=65535 Len=0
1,5.866298999999799,62.210.85.178,10.0.2.15,TCP,60,9001  >  35978 [ACK] Seq=5298949 Ack=94898289 Win=65535 Len=0
1,5.866349999999784,10.0.2.15,62.210.85.178,TLSv1.2,1488,Application Data
1,5.866530999999668,62.210.85.178,10.0.2.15,TCP,60,9001  >  35978 [ACK] Seq=5298949 Ack=94899723 Win=65535 Len=0
1,5.948623999999654,54.93.77.70,10.0.2.15,TLSv1.2,590,Application Data
1,5.980048999999781,54.93.77.70,10.0.2.15,TLSv1.2,5846,Application Data
1,5.98019099999965,10.0.2.15,54.93.77.70,TCP,54,34692  >  9001 [ACK] Seq=5294901 Ack=94702719 Win=65535 Len=0
1,5.981176999999661,54.93.77.70,10.0.2.15,TCP,1502,"9001  >  34692 [PSH, ACK] Seq=94702719 Ack=5294901 Win=65535 Len=1448 [TCP segment of a reassembled PDU]"
1,5.981222999999773,10.0.2.15,54.93.77.70,TCP,54,34692  >  9001 [ACK] Seq=5294901 Ack=94704167 Win=65535 Len=0
1,5.997689999999693,54.93.77.70,10.0.2.15,TLSv1.2,568,Application Data
1,5.997711999999865,54.93.77.70,10.0.2.15,TLSv1.2,4398,Application Data
1,5.9977859999999055,10.0.2.15,54.93.77.70,TCP,54,34692  >  9001 [ACK] Seq=5294901 Ack=94709025 Win=65535 Len=0
1,5.998809999999594,54.93.77.70,10.0.2.15,TCP,2950,"9001  >  34692 [PSH, ACK] Seq=94709025 Ack=5294901 Win=65535 Len=2896 [TCP segment of a reassembled PDU]"
1,5.998859999999695,10.0.2.15,54.93.77.70,TCP,54,34692  >  9001 [ACK] Seq=5294901 Ack=94711921 Win=65535 Len=0
1,6.009006999999656,54.93.77.70,10.0.2.15,TLSv1.2,2950,Application Data [TCP segment of a reassembled PDU]
1,6.009054999999989,10.0.2.15,54.93.77.70,TCP,54,34692  >  9001 [ACK] Seq=5294901 Ack=94714817 Win=65535 Len=0
1,6.009529999999813,54.93.77.70,10.0.2.15,TLSv1.2,4398,Application Data [TCP segment of a reassembled PDU]
1,6.009599999999864,10.0.2.15,54.93.77.70,TCP,54,34692  >  9001 [ACK] Seq=5294901 Ack=94719161 Win=65535 Len=0
1,6.014552999999978,54.93.77.70,10.0.2.15,TLSv1.2,3674,"Application Data, Application Data"
1,6.0145989999996345,10.0.2.15,54.93.77.70,TCP,54,34692  >  9001 [ACK] Seq=5294901 Ack=94722781 Win=65535 Len=0
1,6.017640999999912,10.0.2.15,54.93.77.70,TLSv1.2,590,Application Data
1,6.017801999999847,54.93.77.70,10.0.2.15,TCP,60,9001  >  34692 [ACK] Seq=94722781 Ack=5295437 Win=65535 Len=0
1,6.126411999999618,62.210.85.178,10.0.2.15,TLSv1.2,590,Application Data
1,6.126969999999801,10.0.2.15,62.210.85.178,TLSv1.2,590,Application Data
1,6.127139999999599,62.210.85.178,10.0.2.15,TCP,60,9001  >  35978 [ACK] Seq=5299485 Ack=94900259 Win=65535 Len=0
1,6.265561999999591,54.93.77.70,10.0.2.15,TLSv1.2,590,Application Data
1,6.266036999999869,10.0.2.15,54.93.77.70,TLSv1.2,590,Application Data
1,6.266152999999576,54.93.77.70,10.0.2.15,TCP,60,9001  >  34692 [ACK] Seq=94723317 Ack=5295973 Win=65535 Len=0
1,6.3753569999998945,62.210.85.178,10.0.2.15,TLSv1.2,590,Application Data
1,6.379704999999831,10.0.2.15,62.210.85.178,TLSv1.2,590,Application Data
1,6.379889999999705,62.210.85.178,10.0.2.15,TCP,60,9001  >  35978 [ACK] Seq=5300021 Ack=94900795 Win=65535 Len=0
1,6.39340699999957,10.0.2.15,62.210.85.178,TLSv1.2,4124,Application Data
1,6.393523999999616,10.0.2.15,62.210.85.178,TCP,2974,35978  >  9001 [ACK] Seq=94904865 Ack=5300021 Win=65535 Len=2920 [TCP segment of a reassembled PDU]
1,6.393573999999717,62.210.85.178,10.0.2.15,TCP,60,9001  >  35978 [ACK] Seq=5300021 Ack=94902255 Win=65535 Len=0
1,6.39358699999957,62.210.85.178,10.0.2.15,TCP,60,9001  >  35978 [ACK] Seq=5300021 Ack=94903715 Win=65535 Len=0
1,6.3935929999997825,62.210.85.178,10.0.2.15,TCP,60,9001  >  35978 [ACK] Seq=5300021 Ack=94904865 Win=65535 Len=0
1,6.393596999999772,62.210.85.178,10.0.2.15,TCP,60,9001  >  35978 [ACK] Seq=5300021 Ack=94906325 Win=65535 Len=0
1,6.3935999999998785,62.210.85.178,10.0.2.15,TCP,60,9001  >  35978 [ACK] Seq=5300021 Ack=94907785 Win=65535 Len=0
1,6.393634999999904,10.0.2.15,62.210.85.178,TLSv1.2,1204,Application Data
1,6.3936729999995805,62.210.85.178,10.0.2.15,TCP,60,9001  >  35978 [ACK] Seq=5300021 Ack=94908935 Win=65535 Len=0
1,6.393721999999798,10.0.2.15,62.210.85.178,TLSv1.2,4124,Application Data
1,6.393764999999803,62.210.85.178,10.0.2.15,TCP,60,9001  >  35978 [ACK] Seq=5300021 Ack=94910395 Win=65535 Len=0
1,6.393772999999783,62.210.85.178,10.0.2.15,TCP,60,9001  >  35978 [ACK] Seq=5300021 Ack=94911855 Win=65535 Len=0
1,6.393776999999773,62.210.85.178,10.0.2.15,TCP,60,9001  >  35978 [ACK] Seq=5300021 Ack=94913005 Win=65535 Len=0
1,6.393815999999788,10.0.2.15,62.210.85.178,TLSv1.2,4124,Application Data
1,6.393854999999803,62.210.85.178,10.0.2.15,TCP,60,9001  >  35978 [ACK] Seq=5300021 Ack=94914465 Win=65535 Len=0
1,6.393863999999667,62.210.85.178,10.0.2.15,TCP,60,9001  >  35978 [ACK] Seq=5300021 Ack=94915925 Win=65535 Len=0
1,6.393924999999854,10.0.2.15,62.210.85.178,TLSv1.2,2974,Application Data
1,6.393974999999955,62.210.85.178,10.0.2.15,TCP,60,9001  >  35978 [ACK] Seq=5300021 Ack=94917075 Win=65535 Len=0
1,6.393982999999935,62.210.85.178,10.0.2.15,TCP,60,9001  >  35978 [ACK] Seq=5300021 Ack=94918535 Win=65535 Len=0
1,6.393986999999925,62.210.85.178,10.0.2.15,TCP,60,9001  >  35978 [ACK] Seq=5300021 Ack=94919995 Win=65535 Len=0
1,6.394014999999854,10.0.2.15,62.210.85.178,TLSv1.2,1226,Application Data
1,6.394050999999763,62.210.85.178,10.0.2.15,TCP,60,9001  >  35978 [ACK] Seq=5300021 Ack=94921167 Win=65535 Len=0
1,6.394093999999768,10.0.2.15,62.210.85.178,TLSv1.2,4124,Application Data
1,6.394133999999667,62.210.85.178,10.0.2.15,TCP,60,9001  >  35978 [ACK] Seq=5300021 Ack=94922627 Win=65535 Len=0
1,6.394141999999647,62.210.85.178,10.0.2.15,TCP,60,9001  >  35978 [ACK] Seq=5300021 Ack=94924087 Win=65535 Len=0
1,6.394145999999637,62.210.85.178,10.0.2.15,TCP,60,9001  >  35978 [ACK] Seq=5300021 Ack=94925237 Win=65535 Len=0
1,6.394183999999768,10.0.2.15,62.210.85.178,TLSv1.2,3030,Application Data
1,6.394220999999561,62.210.85.178,10.0.2.15,TCP,60,9001  >  35978 [ACK] Seq=5300021 Ack=94926697 Win=65535 Len=0
1,6.3942299999998795,62.210.85.178,10.0.2.15,TCP,60,9001  >  35978 [ACK] Seq=5300021 Ack=94928157 Win=65535 Len=0
1,6.394233999999869,62.210.85.178,10.0.2.15,TCP,60,9001  >  35978 [ACK] Seq=5300021 Ack=94928213 Win=65535 Len=0
1,6.404562999999598,10.0.2.15,62.210.85.178,TLSv1.2,4124,Application Data
1,6.404622999999901,62.210.85.178,10.0.2.15,TCP,60,9001  >  35978 [ACK] Seq=5300021 Ack=94929673 Win=65535 Len=0
1,6.404635999999755,62.210.85.178,10.0.2.15,TCP,60,9001  >  35978 [ACK] Seq=5300021 Ack=94931133 Win=65535 Len=0
1,6.404639999999745,62.210.85.178,10.0.2.15,TCP,60,9001  >  35978 [ACK] Seq=5300021 Ack=94932283 Win=65535 Len=0
1,6.40468699999974,10.0.2.15,62.210.85.178,TLSv1.2,4124,Application Data
1,6.404727999999977,62.210.85.178,10.0.2.15,TCP,60,9001  >  35978 [ACK] Seq=5300021 Ack=94933743 Win=65535 Len=0
1,6.404736999999841,62.210.85.178,10.0.2.15,TCP,60,9001  >  35978 [ACK] Seq=5300021 Ack=94935203 Win=65535 Len=0
1,6.404741999999715,62.210.85.178,10.0.2.15,TCP,60,9001  >  35978 [ACK] Seq=5300021 Ack=94936353 Win=65535 Len=0
1,6.404781999999614,10.0.2.15,62.210.85.178,TLSv1.2,2260,Application Data
1,6.404820999999629,62.210.85.178,10.0.2.15,TCP,60,9001  >  35978 [ACK] Seq=5300021 Ack=94937813 Win=65535 Len=0
1,6.404828999999609,62.210.85.178,10.0.2.15,TCP,60,9001  >  35978 [ACK] Seq=5300021 Ack=94938559 Win=65535 Len=0
1,6.495054999999866,54.93.77.70,10.0.2.15,TLSv1.2,590,Application Data
1,6.506584999999632,54.93.77.70,10.0.2.15,TCP,2950,"9001  >  34692 [PSH, ACK] Seq=94723853 Ack=5295973 Win=65535 Len=2896 [TCP segment of a reassembled PDU]"
1,6.5066719999999805,10.0.2.15,54.93.77.70,TCP,54,34692  >  9001 [ACK] Seq=5295973 Ack=94726749 Win=65535 Len=0
1,6.522885999999744,54.93.77.70,10.0.2.15,TLSv1.2,778,Application Data
1,6.5610029999998005,54.93.77.70,10.0.2.15,TLSv1.2,7294,"Application Data, Application Data"
1,6.561064999999871,10.0.2.15,54.93.77.70,TCP,54,34692  >  9001 [ACK] Seq=5295973 Ack=94734713 Win=65535 Len=0
1,6.561319999999796,10.0.2.15,54.93.77.70,TLSv1.2,590,Application Data
1,6.561416999999892,54.93.77.70,10.0.2.15,TCP,60,9001  >  34692 [ACK] Seq=94734713 Ack=5296509 Win=65535 Len=0
1,6.56781299999966,54.93.77.70,10.0.2.15,TLSv1.2,5846,Application Data
1,6.567911999999978,10.0.2.15,54.93.77.70,TCP,54,34692  >  9001 [ACK] Seq=5296509 Ack=94740505 Win=65535 Len=0
1,6.5787209999998595,54.93.77.70,10.0.2.15,TLSv1.2,2016,Application Data
1,6.5787749999999505,10.0.2.15,54.93.77.70,TCP,54,34692  >  9001 [ACK] Seq=5296509 Ack=94742467 Win=65535 Len=0
1,6.580909999999676,54.93.77.70,10.0.2.15,TLSv1.2,11638,"Application Data, Application Data"
1,6.581020999999964,10.0.2.15,54.93.77.70,TCP,54,34692  >  9001 [ACK] Seq=5296509 Ack=94754051 Win=65535 Len=0
1,6.581365999999889,10.0.2.15,54.93.77.70,TLSv1.2,590,Application Data
1,6.581545999999889,54.93.77.70,10.0.2.15,TCP,60,9001  >  34692 [ACK] Seq=94754051 Ack=5297045 Win=65535 Len=0
1,6.587136999999984,54.93.77.70,10.0.2.15,TLSv1.2,4398,"Application Data, Application Data"
1,6.587203999999929,10.0.2.15,54.93.77.70,TCP,54,34692  >  9001 [ACK] Seq=5297045 Ack=94758395 Win=65535 Len=0
1,6.595912999999655,54.93.77.70,10.0.2.15,TLSv1.2,706,"Application Data, Application Data"
1,6.597388999999566,54.93.77.70,10.0.2.15,TCP,1502,"9001  >  34692 [PSH, ACK] Seq=94759047 Ack=5297045 Win=65535 Len=1448 [TCP segment of a reassembled PDU]"
1,6.59744099999989,10.0.2.15,54.93.77.70,TCP,54,34692  >  9001 [ACK] Seq=5297045 Ack=94760495 Win=65535 Len=0
1,6.613469999999779,54.93.77.70,10.0.2.15,TLSv1.2,1198,Application Data
1,6.616615999999794,10.0.2.15,54.93.77.70,TLSv1.2,590,Application Data
1,6.6168039999997745,54.93.77.70,10.0.2.15,TCP,60,9001  >  34692 [ACK] Seq=94761639 Ack=5297581 Win=65535 Len=0
1,6.676340999999866,62.210.85.178,10.0.2.15,TLSv1.2,590,Application Data
1,6.720304999999826,10.0.2.15,62.210.85.178,TCP,54,35978  >  9001 [ACK] Seq=94938559 Ack=5300557 Win=65535 Len=0
1,6.779463999999734,62.210.85.178,10.0.2.15,TLSv1.2,1104,Application Data
1,6.779559999999947,10.0.2.15,62.210.85.178,TCP,54,35978  >  9001 [ACK] Seq=94938559 Ack=5301607 Win=65535 Len=0
1,6.780261999999766,10.0.2.15,62.210.85.178,TLSv1.2,590,Application Data
1,6.78091699999959,62.210.85.178,10.0.2.15,TCP,60,9001  >  35978 [ACK] Seq=5301607 Ack=94939095 Win=65535 Len=0
1,7.0063679999998385,54.93.77.70,10.0.2.15,TLSv1.2,590,Application Data
1,7.006822999999713,10.0.2.15,54.93.77.70,TLSv1.2,590,Application Data
1,7.006971999999678,54.93.77.70,10.0.2.15,TCP,60,9001  >  34692 [ACK] Seq=94762175 Ack=5298117 Win=65535 Len=0
1,7.118355999999949,62.210.85.178,10.0.2.15,TLSv1.2,590,Application Data
1,7.126227999999628,10.0.2.15,62.210.85.178,TLSv1.2,590,Application Data
1,7.126438999999664,62.210.85.178,10.0.2.15,TCP,60,9001  >  35978 [ACK] Seq=5302143 Ack=94939631 Win=65535 Len=0
1,7.141339999999673,10.0.2.15,62.210.85.178,TLSv1.2,4124,Application Data
1,7.141456999999718,10.0.2.15,62.210.85.178,TCP,2974,35978  >  9001 [ACK] Seq=94943701 Ack=5302143 Win=65535 Len=2920 [TCP segment of a reassembled PDU]
1,7.1415069999998195,62.210.85.178,10.0.2.15,TCP,60,9001  >  35978 [ACK] Seq=5302143 Ack=94941091 Win=65535 Len=0
1,7.141519999999673,62.210.85.178,10.0.2.15,TCP,60,9001  >  35978 [ACK] Seq=5302143 Ack=94942551 Win=65535 Len=0
1,7.1415250000000015,62.210.85.178,10.0.2.15,TCP,60,9001  >  35978 [ACK] Seq=5302143 Ack=94943701 Win=65535 Len=0
1,7.141527999999653,62.210.85.178,10.0.2.15,TCP,60,9001  >  35978 [ACK] Seq=5302143 Ack=94945161 Win=65535 Len=0
1,7.141530999999759,62.210.85.178,10.0.2.15,TCP,60,9001  >  35978 [ACK] Seq=5302143 Ack=94946621 Win=65535 Len=0
1,7.141565999999784,10.0.2.15,62.210.85.178,TLSv1.2,1204,Application Data
1,7.141603999999916,62.210.85.178,10.0.2.15,TCP,60,9001  >  35978 [ACK] Seq=5302143 Ack=94947771 Win=65535 Len=0
1,7.141650999999911,10.0.2.15,62.210.85.178,TLSv1.2,4124,Application Data
1,7.141689999999926,62.210.85.178,10.0.2.15,TCP,60,9001  >  35978 [ACK] Seq=5302143 Ack=94949231 Win=65535 Len=0
1,7.1416989999997895,62.210.85.178,10.0.2.15,TCP,60,9001  >  35978 [ACK] Seq=5302143 Ack=94950691 Win=65535 Len=0
1,7.141702999999779,62.210.85.178,10.0.2.15,TCP,60,9001  >  35978 [ACK] Seq=5302143 Ack=94951841 Win=65535 Len=0
1,7.141741999999795,10.0.2.15,62.210.85.178,TLSv1.2,4124,Application Data
1,7.1417789999995875,62.210.85.178,10.0.2.15,TCP,60,9001  >  35978 [ACK] Seq=5302143 Ack=94953301 Win=65535 Len=0
1,7.141787999999906,62.210.85.178,10.0.2.15,TCP,60,9001  >  35978 [ACK] Seq=5302143 Ack=94954761 Win=65535 Len=0
1,7.141859999999724,10.0.2.15,62.210.85.178,TLSv1.2,2974,Application Data
1,7.141899999999623,62.210.85.178,10.0.2.15,TCP,60,9001  >  35978 [ACK] Seq=5302143 Ack=94955911 Win=65535 Len=0
1,7.141907999999603,62.210.85.178,10.0.2.15,TCP,60,9001  >  35978 [ACK] Seq=5302143 Ack=94957371 Win=65535 Len=0
1,7.141910999999709,62.210.85.178,10.0.2.15,TCP,60,9001  >  35978 [ACK] Seq=5302143 Ack=94958831 Win=65535 Len=0
1,7.141945999999734,10.0.2.15,62.210.85.178,TLSv1.2,1226,Application Data
1,7.141982999999982,62.210.85.178,10.0.2.15,TCP,60,9001  >  35978 [ACK] Seq=5302143 Ack=94960003 Win=65535 Len=0
1,7.1420289999996385,10.0.2.15,62.210.85.178,TLSv1.2,4124,Application Data
1,7.142067999999654,62.210.85.178,10.0.2.15,TCP,60,9001  >  35978 [ACK] Seq=5302143 Ack=94961463 Win=65535 Len=0
1,7.1420759999996335,62.210.85.178,10.0.2.15,TCP,60,9001  >  35978 [ACK] Seq=5302143 Ack=94962923 Win=65535 Len=0
1,7.142079999999623,62.210.85.178,10.0.2.15,TCP,60,9001  >  35978 [ACK] Seq=5302143 Ack=94964073 Win=65535 Len=0
1,7.142117999999755,10.0.2.15,62.210.85.178,TLSv1.2,3030,Application Data
1,7.14215699999977,62.210.85.178,10.0.2.15,TCP,60,9001  >  35978 [ACK] Seq=5302143 Ack=94965533 Win=65535 Len=0
1,7.142165999999634,62.210.85.178,10.0.2.15,TCP,60,9001  >  35978 [ACK] Seq=5302143 Ack=94966993 Win=65535 Len=0
1,7.14216899999974,62.210.85.178,10.0.2.15,TCP,60,9001  >  35978 [ACK] Seq=5302143 Ack=94967049 Win=65535 Len=0
1,7.15138799999977,10.0.2.15,62.210.85.178,TLSv1.2,4124,Application Data
1,7.1514869999996336,62.210.85.178,10.0.2.15,TCP,60,9001  >  35978 [ACK] Seq=5302143 Ack=94968509 Win=65535 Len=0
1,7.151496999999836,62.210.85.178,10.0.2.15,TCP,60,9001  >  35978 [ACK] Seq=5302143 Ack=94969969 Win=65535 Len=0
1,7.151499999999942,62.210.85.178,10.0.2.15,TCP,60,9001  >  35978 [ACK] Seq=5302143 Ack=94971119 Win=65535 Len=0
1,7.151615999999649,10.0.2.15,62.210.85.178,TLSv1.2,4124,Application Data
1,7.151666999999634,62.210.85.178,10.0.2.15,TCP,60,9001  >  35978 [ACK] Seq=5302143 Ack=94972579 Win=65535 Len=0
1,7.151676999999836,62.210.85.178,10.0.2.15,TCP,60,9001  >  35978 [ACK] Seq=5302143 Ack=94974039 Win=65535 Len=0
1,7.15168199999971,62.210.85.178,10.0.2.15,TCP,60,9001  >  35978 [ACK] Seq=5302143 Ack=94975189 Win=65535 Len=0
1,7.151721999999609,10.0.2.15,62.210.85.178,TLSv1.2,4124,Application Data
1,7.151760999999624,62.210.85.178,10.0.2.15,TCP,60,9001  >  35978 [ACK] Seq=5302143 Ack=94976649 Win=65535 Len=0
1,7.151768999999604,62.210.85.178,10.0.2.15,TCP,60,9001  >  35978 [ACK] Seq=5302143 Ack=94978109 Win=65535 Len=0
1,7.151773999999932,62.210.85.178,10.0.2.15,TCP,60,9001  >  35978 [ACK] Seq=5302143 Ack=94979259 Win=65535 Len=0
1,7.151810999999725,10.0.2.15,62.210.85.178,TLSv1.2,4124,Application Data
1,7.1518489999998565,62.210.85.178,10.0.2.15,TCP,60,9001  >  35978 [ACK] Seq=5302143 Ack=94980719 Win=65535 Len=0
1,7.15185799999972,62.210.85.178,10.0.2.15,TCP,60,9001  >  35978 [ACK] Seq=5302143 Ack=94982179 Win=65535 Len=0
1,7.15186199999971,62.210.85.178,10.0.2.15,TCP,60,9001  >  35978 [ACK] Seq=5302143 Ack=94983329 Win=65535 Len=0
1,7.151896999999735,10.0.2.15,62.210.85.178,TLSv1.2,332,Application Data
1,7.151933999999983,62.210.85.178,10.0.2.15,TCP,60,9001  >  35978 [ACK] Seq=5302143 Ack=94983607 Win=65535 Len=0
1,7.151986999999735,10.0.2.15,62.210.85.178,TLSv1.2,3868,Application Data
1,7.152025999999751,62.210.85.178,10.0.2.15,TCP,60,9001  >  35978 [ACK] Seq=5302143 Ack=94985067 Win=65535 Len=0
1,7.152034999999614,62.210.85.178,10.0.2.15,TCP,60,9001  >  35978 [ACK] Seq=5302143 Ack=94986527 Win=65535 Len=0
1,7.152039999999943,62.210.85.178,10.0.2.15,TCP,60,9001  >  35978 [ACK] Seq=5302143 Ack=94987421 Win=65535 Len=0
1,7.152078999999958,10.0.2.15,62.210.85.178,TLSv1.2,4124,Application Data
1,7.152116999999635,62.210.85.178,10.0.2.15,TCP,60,9001  >  35978 [ACK] Seq=5302143 Ack=94988881 Win=65535 Len=0
1,7.152124999999614,62.210.85.178,10.0.2.15,TCP,60,9001  >  35978 [ACK] Seq=5302143 Ack=94990341 Win=65535 Len=0
1,7.152128999999604,62.210.85.178,10.0.2.15,TCP,60,9001  >  35978 [ACK] Seq=5302143 Ack=94991491 Win=65535 Len=0
1,7.152162999999746,10.0.2.15,62.210.85.178,TLSv1.2,460,Application Data
1,7.152205999999751,62.210.85.178,10.0.2.15,TCP,60,9001  >  35978 [ACK] Seq=5302143 Ack=94991897 Win=65535 Len=0
1,7.254778999999871,54.93.77.70,10.0.2.15,TLSv1.2,590,Application Data
1,7.282848999999715,54.93.77.70,10.0.2.15,TLSv1.2,4398,Application Data
1,7.282987999999932,10.0.2.15,54.93.77.70,TCP,54,34692  >  9001 [ACK] Seq=5298117 Ack=94767055 Win=65535 Len=0
1,7.283556999999746,54.93.77.70,10.0.2.15,TCP,2950,"9001  >  34692 [PSH, ACK] Seq=94767055 Ack=5298117 Win=65535 Len=2896 [TCP segment of a reassembled PDU]"
1,7.283600999999635,10.0.2.15,54.93.77.70,TCP,54,34692  >  9001 [ACK] Seq=5298117 Ack=94769951 Win=65535 Len=0
1,7.284588999999869,54.93.77.70,10.0.2.15,TLSv1.2,2950,Application Data [TCP segment of a reassembled PDU]
1,7.28463099999999,10.0.2.15,54.93.77.70,TCP,54,34692  >  9001 [ACK] Seq=5298117 Ack=94772847 Win=65535 Len=0
1,7.293419999999969,54.93.77.70,10.0.2.15,TLSv1.2,2950,Application Data [TCP segment of a reassembled PDU]
1,7.293477999999595,10.0.2.15,54.93.77.70,TCP,54,34692  >  9001 [ACK] Seq=5298117 Ack=94775743 Win=65535 Len=0
1,7.299907999999959,54.93.77.70,10.0.2.15,TLSv1.2,2950,Application Data [TCP segment of a reassembled PDU]
1,7.299958999999944,10.0.2.15,54.93.77.70,TCP,54,34692  >  9001 [ACK] Seq=5298117 Ack=94778639 Win=65535 Len=0
1,7.302210999999716,54.93.77.70,10.0.2.15,TLSv1.2,7924,"Application Data, Application Data, Application Data"
1,7.30228999999963,10.0.2.15,54.93.77.70,TCP,54,34692  >  9001 [ACK] Seq=5298117 Ack=94786509 Win=65535 Len=0
1,7.302527999999711,10.0.2.15,54.93.77.70,TLSv1.2,590,Application Data
1,7.302596999999878,54.93.77.70,10.0.2.15,TCP,60,9001  >  34692 [ACK] Seq=94786509 Ack=5298653 Win=65535 Len=0
1,7.302701999999954,54.93.77.70,10.0.2.15,TLSv1.2,4398,Application Data
1,7.302750999999716,10.0.2.15,54.93.77.70,TCP,54,34692  >  9001 [ACK] Seq=5298653 Ack=94790853 Win=65535 Len=0
1,7.303657999999814,54.93.77.70,10.0.2.15,TLSv1.2,7294,Application Data [TCP segment of a reassembled PDU]
1,7.303722999999991,10.0.2.15,54.93.77.70,TCP,54,34692  >  9001 [ACK] Seq=5298653 Ack=94798093 Win=65535 Len=0
1,7.31450199999972,54.93.77.70,10.0.2.15,TLSv1.2,5846,"Application Data, Application Data"
1,7.3145809999996345,10.0.2.15,54.93.77.70,TCP,54,34692  >  9001 [ACK] Seq=5298653 Ack=94803885 Win=65535 Len=0
1,7.31713899999977,10.0.2.15,54.93.77.70,TLSv1.2,590,Application Data
1,7.317233999999644,54.93.77.70,10.0.2.15,TCP,60,9001  >  34692 [ACK] Seq=94803885 Ack=5299189 Win=65535 Len=0
1,7.318837999999687,54.93.77.70,10.0.2.15,TLSv1.2,2950,Application Data [TCP segment of a reassembled PDU]
1,7.31889799999999,10.0.2.15,54.93.77.70,TCP,54,34692  >  9001 [ACK] Seq=5299189 Ack=94806781 Win=65535 Len=0
1,7.320137999999588,54.93.77.70,10.0.2.15,TCP,2950,"9001  >  34692 [PSH, ACK] Seq=94806781 Ack=5299189 Win=65535 Len=2896 [TCP segment of a reassembled PDU]"
1,7.320203999999649,10.0.2.15,54.93.77.70,TCP,54,34692  >  9001 [ACK] Seq=5299189 Ack=94809677 Win=65535 Len=0
1,7.322018999999727,54.93.77.70,10.0.2.15,TLSv1.2,3768,"Application Data, Application Data"
1,7.3223189999998795,10.0.2.15,54.93.77.70,TCP,54,34692  >  9001 [ACK] Seq=5299189 Ack=94813391 Win=65535 Len=0
1,7.327140999999756,54.93.77.70,10.0.2.15,TCP,1502,"9001  >  34692 [PSH, ACK] Seq=94813391 Ack=5299189 Win=65535 Len=1448 [TCP segment of a reassembled PDU]"
1,7.327242999999726,10.0.2.15,54.93.77.70,TCP,54,34692  >  9001 [ACK] Seq=5299189 Ack=94814839 Win=65535 Len=0
1,7.337630999999874,54.93.77.70,10.0.2.15,TLSv1.2,170,Application Data
1,7.33793199999991,10.0.2.15,54.93.77.70,TLSv1.2,590,Application Data
1,7.338038999999753,54.93.77.70,10.0.2.15,TCP,60,9001  >  34692 [ACK] Seq=94814955 Ack=5299725 Win=65535 Len=0
1,7.347531999999774,10.0.2.15,54.93.77.70,TLSv1.2,590,Application Data
1,7.3476849999997285,54.93.77.70,10.0.2.15,TCP,60,9001  >  34692 [ACK] Seq=94814955 Ack=5300261 Win=65535 Len=0
1,7.410494999999628,62.210.85.178,10.0.2.15,TLSv1.2,590,Application Data
1,7.452300999999807,10.0.2.15,62.210.85.178,TCP,54,35978  >  9001 [ACK] Seq=94991897 Ack=5302679 Win=65535 Len=0
1,7.475054,62.210.85.178,10.0.2.15,TLSv1.2,590,Application Data
1,7.475135999999566,10.0.2.15,62.210.85.178,TCP,54,35978  >  9001 [ACK] Seq=94991897 Ack=5303215 Win=65535 Len=0
1,7.491617999999562,62.210.85.178,10.0.2.15,TLSv1.2,1104,Application Data
1,7.491681999999855,10.0.2.15,62.210.85.178,TCP,54,35978  >  9001 [ACK] Seq=94991897 Ack=5304265 Win=65535 Len=0
1,7.492152999999689,10.0.2.15,62.210.85.178,TLSv1.2,590,Application Data
1,7.492287999999917,62.210.85.178,10.0.2.15,TCP,60,9001  >  35978 [ACK] Seq=5304265 Ack=94992433 Win=65535 Len=0
1,7.823079999999663,54.93.77.70,10.0.2.15,TLSv1.2,590,Application Data
1,7.823470999999699,10.0.2.15,54.93.77.70,TLSv1.2,590,Application Data
1,7.823587999999745,54.93.77.70,10.0.2.15,TCP,60,9001  >  34692 [ACK] Seq=94815491 Ack=5300797 Win=65535 Len=0
1,7.958313999999973,62.210.85.178,10.0.2.15,TLSv1.2,590,Application Data
1,7.962383999999929,10.0.2.15,62.210.85.178,TLSv1.2,590,Application Data
1,7.962549999999737,62.210.85.178,10.0.2.15,TCP,60,9001  >  35978 [ACK] Seq=5304801 Ack=94992969 Win=65535 Len=0
1,7.972366999999849,10.0.2.15,62.210.85.178,TLSv1.2,4124,Application Data
1,7.972477999999683,10.0.2.15,62.210.85.178,TCP,2974,35978  >  9001 [ACK] Seq=94997039 Ack=5304801 Win=65535 Len=2920 [TCP segment of a reassembled PDU]
1,7.972519999999804,62.210.85.178,10.0.2.15,TCP,60,9001  >  35978 [ACK] Seq=5304801 Ack=94994429 Win=65535 Len=0
1,7.9725329999996575,62.210.85.178,10.0.2.15,TCP,60,9001  >  35978 [ACK] Seq=5304801 Ack=94995889 Win=65535 Len=0
1,7.972537999999986,62.210.85.178,10.0.2.15,TCP,60,9001  >  35978 [ACK] Seq=5304801 Ack=94997039 Win=65535 Len=0
1,7.9725399999997535,62.210.85.178,10.0.2.15,TCP,60,9001  >  35978 [ACK] Seq=5304801 Ack=94998499 Win=65535 Len=0
1,7.97254299999986,62.210.85.178,10.0.2.15,TCP,60,9001  >  35978 [ACK] Seq=5304801 Ack=94999959 Win=65535 Len=0
1,7.972577999999885,10.0.2.15,62.210.85.178,TLSv1.2,1204,Application Data
1,7.972610999999688,62.210.85.178,10.0.2.15,TCP,60,9001  >  35978 [ACK] Seq=5304801 Ack=95001109 Win=65535 Len=0
1,7.972655999999915,10.0.2.15,62.210.85.178,TLSv1.2,4124,Application Data
1,7.972708999999668,62.210.85.178,10.0.2.15,TCP,60,9001  >  35978 [ACK] Seq=5304801 Ack=95002569 Win=65535 Len=0
1,7.972721999999976,62.210.85.178,10.0.2.15,TCP,60,9001  >  35978 [ACK] Seq=5304801 Ack=95004029 Win=65535 Len=0
1,7.9727249999996275,62.210.85.178,10.0.2.15,TCP,60,9001  >  35978 [ACK] Seq=5304801 Ack=95005179 Win=65535 Len=0
1,7.972788999999921,10.0.2.15,62.210.85.178,TLSv1.2,1296,Application Data
1,7.972840999999789,62.210.85.178,10.0.2.15,TCP,60,9001  >  35978 [ACK] Seq=5304801 Ack=95006421 Win=65535 Len=0
1,8.052286999999978,54.93.77.70,10.0.2.15,TLSv1.2,590,Application Data
1,8.073484999999891,54.93.77.70,10.0.2.15,TCP,2950,"9001  >  34692 [PSH, ACK] Seq=94816027 Ack=5300797 Win=65535 Len=2896 [TCP segment of a reassembled PDU]"
1,8.07364299999972,10.0.2.15,54.93.77.70,TCP,54,34692  >  9001 [ACK] Seq=5300797 Ack=94818923 Win=65535 Len=0
1,8.086205999999947,54.93.77.70,10.0.2.15,TLSv1.2,4398,Application Data [TCP segment of a reassembled PDU]
1,8.086313999999675,10.0.2.15,54.93.77.70,TCP,54,34692  >  9001 [ACK] Seq=5300797 Ack=94823267 Win=65535 Len=0
1,8.089436999999634,54.93.77.70,10.0.2.15,TLSv1.2,590,"Application Data, Application Data"
1,8.091573999999582,54.93.77.70,10.0.2.15,TCP,2950,"9001  >  34692 [PSH, ACK] Seq=94823803 Ack=5300797 Win=65535 Len=2896 [TCP segment of a reassembled PDU]"
1,8.091616999999587,10.0.2.15,54.93.77.70,TCP,54,34692  >  9001 [ACK] Seq=5300797 Ack=94826699 Win=65535 Len=0
1,8.107982999999876,54.93.77.70,10.0.2.15,TLSv1.2,778,Application Data
1,8.122985999999855,54.93.77.70,10.0.2.15,TCP,1502,"9001  >  34692 [PSH, ACK] Seq=94827423 Ack=5300797 Win=65535 Len=1448 [TCP segment of a reassembled PDU]"
1,8.123038999999608,10.0.2.15,54.93.77.70,TCP,54,34692  >  9001 [ACK] Seq=5300797 Ack=94828871 Win=65535 Len=0
1,8.139458999999988,54.93.77.70,10.0.2.15,TLSv1.2,684,Application Data
