No.,Time,Source,Destination,Protocol,Length,Info
1,0.20964099999991959,10.0.2.15,54.93.77.70,TLSv1.2,590,Application Data
1,0.20983399999977337,54.93.77.70,10.0.2.15,TCP,60,9001  >  34692 [ACK] Seq=98336679 Ack=5499529 Win=65535 Len=0
1,0.31721299999981056,62.210.85.178,10.0.2.15,TLSv1.2,590,Application Data
1,0.31754999999975553,10.0.2.15,62.210.85.178,TLSv1.2,590,Application Data
1,0.3176949999997305,62.210.85.178,10.0.2.15,TCP,60,9001  >  35978 [ACK] Seq=5502675 Ack=98517939 Win=65535 Len=0
1,0.4155839999998534,54.93.77.70,10.0.2.15,TLSv1.2,590,Application Data
1,0.41601600000012695,10.0.2.15,54.93.77.70,TLSv1.2,1618,Application Data
1,0.4161380000000463,54.93.77.70,10.0.2.15,TCP,60,9001  >  34692 [ACK] Seq=98337215 Ack=5501093 Win=65535 Len=0
1,0.5309990000000653,62.210.85.178,10.0.2.15,TLSv1.2,1618,Application Data
1,0.5311659999997573,10.0.2.15,62.210.85.178,TCP,54,35978  >  9001 [ACK] Seq=98517939 Ack=5504239 Win=65535 Len=0
1,0.554819999999836,10.0.2.15,62.210.85.178,TLSv1.2,590,Application Data
1,0.5550050000001647,62.210.85.178,10.0.2.15,TCP,60,9001  >  35978 [ACK] Seq=5504239 Ack=98518475 Win=65535 Len=0
1,0.5689290000000256,10.0.2.15,62.210.85.178,TLSv1.2,1618,Application Data
1,0.5690890000000763,62.210.85.178,10.0.2.15,TCP,60,9001  >  35978 [ACK] Seq=5504239 Ack=98519935 Win=65535 Len=0
1,0.5691170000000056,62.210.85.178,10.0.2.15,TCP,60,9001  >  35978 [ACK] Seq=5504239 Ack=98520039 Win=65535 Len=0
1,0.6603449999997792,54.93.77.70,10.0.2.15,TLSv1.2,590,Application Data
1,0.7004859999997279,10.0.2.15,54.93.77.70,TCP,54,34692  >  9001 [ACK] Seq=5501093 Ack=98337751 Win=65535 Len=0
1,0.7190769999997428,54.93.77.70,10.0.2.15,TLSv1.2,1618,Application Data
1,0.7191349999998238,10.0.2.15,54.93.77.70,TCP,54,34692  >  9001 [ACK] Seq=5501093 Ack=98339315 Win=65535 Len=0
1,0.721766000000116,10.0.2.15,54.93.77.70,TLSv1.2,590,Application Data
1,0.7219460000001163,54.93.77.70,10.0.2.15,TCP,60,9001  >  34692 [ACK] Seq=98339315 Ack=5501629 Win=65535 Len=0
1,0.8228420000000369,62.210.85.178,10.0.2.15,TLSv1.2,590,Application Data
1,0.8235230000000229,10.0.2.15,62.210.85.178,TLSv1.2,590,Application Data
1,0.8238809999998011,62.210.85.178,10.0.2.15,TCP,60,9001  >  35978 [ACK] Seq=5504775 Ack=98520575 Win=65535 Len=0
1,0.9852319999999963,54.93.77.70,10.0.2.15,TLSv1.2,590,Application Data
1,0.9858100000001286,10.0.2.15,54.93.77.70,TLSv1.2,590,Application Data
1,0.9859630000000834,54.93.77.70,10.0.2.15,TCP,60,9001  >  34692 [ACK] Seq=98339851 Ack=5502165 Win=65535 Len=0
1,1.0854309999999714,62.210.85.178,10.0.2.15,TLSv1.2,590,Application Data
1,1.0856669999998303,10.0.2.15,62.210.85.178,TLSv1.2,590,Application Data
1,1.0857740000001286,62.210.85.178,10.0.2.15,TCP,60,9001  >  35978 [ACK] Seq=5505311 Ack=98521111 Win=65535 Len=0
1,1.096618000000035,10.0.2.15,62.210.85.178,TLSv1.2,4124,Application Data
1,1.0967860000000655,10.0.2.15,62.210.85.178,TCP,2974,35978  >  9001 [ACK] Seq=98525181 Ack=5505311 Win=65535 Len=2920 [TCP segment of a reassembled PDU]
1,1.0968179999999847,62.210.85.178,10.0.2.15,TCP,60,9001  >  35978 [ACK] Seq=5505311 Ack=98522571 Win=65535 Len=0
1,1.0968269999998483,62.210.85.178,10.0.2.15,TCP,60,9001  >  35978 [ACK] Seq=5505311 Ack=98524031 Win=65535 Len=0
1,1.0968299999999545,62.210.85.178,10.0.2.15,TCP,60,9001  >  35978 [ACK] Seq=5505311 Ack=98525181 Win=65535 Len=0
1,1.0968739999998434,62.210.85.178,10.0.2.15,TCP,60,9001  >  35978 [ACK] Seq=5505311 Ack=98526641 Win=65535 Len=0
1,1.0968790000001718,62.210.85.178,10.0.2.15,TCP,60,9001  >  35978 [ACK] Seq=5505311 Ack=98528101 Win=65535 Len=0
1,1.096907000000101,10.0.2.15,62.210.85.178,TLSv1.2,1204,Application Data
1,1.0969660000000658,62.210.85.178,10.0.2.15,TCP,60,9001  >  35978 [ACK] Seq=5505311 Ack=98529251 Win=65535 Len=0
1,1.0970200000001569,10.0.2.15,62.210.85.178,TLSv1.2,4124,Application Data
1,1.0970600000000559,62.210.85.178,10.0.2.15,TCP,60,9001  >  35978 [ACK] Seq=5505311 Ack=98530711 Win=65535 Len=0
1,1.097067000000152,62.210.85.178,10.0.2.15,TCP,60,9001  >  35978 [ACK] Seq=5505311 Ack=98532171 Win=65535 Len=0
1,1.0970699999998033,62.210.85.178,10.0.2.15,TCP,60,9001  >  35978 [ACK] Seq=5505311 Ack=98533321 Win=65535 Len=0
1,1.0971079999999347,10.0.2.15,62.210.85.178,TLSv1.2,4124,Application Data
1,1.0971439999998438,62.210.85.178,10.0.2.15,TCP,60,9001  >  35978 [ACK] Seq=5505311 Ack=98534781 Win=65535 Len=0
1,1.0971509999999398,62.210.85.178,10.0.2.15,TCP,60,9001  >  35978 [ACK] Seq=5505311 Ack=98536241 Win=65535 Len=0
1,1.0972069999997984,10.0.2.15,62.210.85.178,TLSv1.2,2974,Application Data
1,1.0972459999998136,62.210.85.178,10.0.2.15,TCP,60,9001  >  35978 [ACK] Seq=5505311 Ack=98537391 Win=65535 Len=0
1,1.0972529999999097,62.210.85.178,10.0.2.15,TCP,60,9001  >  35978 [ACK] Seq=5505311 Ack=98538851 Win=65535 Len=0
1,1.097255000000132,62.210.85.178,10.0.2.15,TCP,60,9001  >  35978 [ACK] Seq=5505311 Ack=98540311 Win=65535 Len=0
1,1.0972819999997228,10.0.2.15,62.210.85.178,TLSv1.2,1226,Application Data
1,1.0973330000001624,62.210.85.178,10.0.2.15,TCP,60,9001  >  35978 [ACK] Seq=5505311 Ack=98541483 Win=65535 Len=0
1,1.0973840000001474,10.0.2.15,62.210.85.178,TLSv1.2,4124,Application Data
1,1.097421999999824,62.210.85.178,10.0.2.15,TCP,60,9001  >  35978 [ACK] Seq=5505311 Ack=98542943 Win=65535 Len=0
1,1.0974280000000363,62.210.85.178,10.0.2.15,TCP,60,9001  >  35978 [ACK] Seq=5505311 Ack=98544403 Win=65535 Len=0
1,1.0974310000001424,62.210.85.178,10.0.2.15,TCP,60,9001  >  35978 [ACK] Seq=5505311 Ack=98545553 Win=65535 Len=0
1,1.0974679999999353,10.0.2.15,62.210.85.178,TLSv1.2,3030,Application Data
1,1.0975009999997383,62.210.85.178,10.0.2.15,TCP,60,9001  >  35978 [ACK] Seq=5505311 Ack=98547013 Win=65535 Len=0
1,1.0975079999998343,62.210.85.178,10.0.2.15,TCP,60,9001  >  35978 [ACK] Seq=5505311 Ack=98548473 Win=65535 Len=0
1,1.0975119999998242,62.210.85.178,10.0.2.15,TCP,60,9001  >  35978 [ACK] Seq=5505311 Ack=98548529 Win=65535 Len=0
1,1.1067140000000109,10.0.2.15,62.210.85.178,TLSv1.2,4124,Application Data
1,1.106792999999925,62.210.85.178,10.0.2.15,TCP,60,9001  >  35978 [ACK] Seq=5505311 Ack=98549989 Win=65535 Len=0
1,1.1068049999998948,62.210.85.178,10.0.2.15,TCP,60,9001  >  35978 [ACK] Seq=5505311 Ack=98551449 Win=65535 Len=0
1,1.1068089999998847,62.210.85.178,10.0.2.15,TCP,60,9001  >  35978 [ACK] Seq=5505311 Ack=98552599 Win=65535 Len=0
1,1.106854999999996,10.0.2.15,62.210.85.178,TLSv1.2,4124,Application Data
1,1.1069159999997282,62.210.85.178,10.0.2.15,TCP,60,9001  >  35978 [ACK] Seq=5505311 Ack=98554059 Win=65535 Len=0
1,1.1069229999998242,62.210.85.178,10.0.2.15,TCP,60,9001  >  35978 [ACK] Seq=5505311 Ack=98555519 Win=65535 Len=0
1,1.1069269999998141,62.210.85.178,10.0.2.15,TCP,60,9001  >  35978 [ACK] Seq=5505311 Ack=98556669 Win=65535 Len=0
1,1.1069629999997233,10.0.2.15,62.210.85.178,TLSv1.2,4124,Application Data
1,1.1069969999998648,62.210.85.178,10.0.2.15,TCP,60,9001  >  35978 [ACK] Seq=5505311 Ack=98558129 Win=65535 Len=0
1,1.1070049999998446,62.210.85.178,10.0.2.15,TCP,60,9001  >  35978 [ACK] Seq=5505311 Ack=98559589 Win=65535 Len=0
1,1.1070089999998345,62.210.85.178,10.0.2.15,TCP,60,9001  >  35978 [ACK] Seq=5505311 Ack=98560739 Win=65535 Len=0
1,1.1070449999997436,10.0.2.15,62.210.85.178,TLSv1.2,4124,Application Data
1,1.107079999999769,62.210.85.178,10.0.2.15,TCP,60,9001  >  35978 [ACK] Seq=5505311 Ack=98562199 Win=65535 Len=0
1,1.107086999999865,62.210.85.178,10.0.2.15,TCP,60,9001  >  35978 [ACK] Seq=5505311 Ack=98563659 Win=65535 Len=0
1,1.107089999999971,62.210.85.178,10.0.2.15,TCP,60,9001  >  35978 [ACK] Seq=5505311 Ack=98564809 Win=65535 Len=0
1,1.1071240000001126,10.0.2.15,62.210.85.178,TLSv1.2,332,Application Data
1,1.1071649999998954,62.210.85.178,10.0.2.15,TCP,60,9001  >  35978 [ACK] Seq=5505311 Ack=98565087 Win=65535 Len=0
1,1.107216999999764,10.0.2.15,62.210.85.178,TLSv1.2,3868,Application Data
1,1.107278999999835,62.210.85.178,10.0.2.15,TCP,60,9001  >  35978 [ACK] Seq=5505311 Ack=98566547 Win=65535 Len=0
1,1.107289000000037,62.210.85.178,10.0.2.15,TCP,60,9001  >  35978 [ACK] Seq=5505311 Ack=98568007 Win=65535 Len=0
1,1.107293000000027,62.210.85.178,10.0.2.15,TCP,60,9001  >  35978 [ACK] Seq=5505311 Ack=98568901 Win=65535 Len=0
1,1.107347000000118,10.0.2.15,62.210.85.178,TLSv1.2,4124,Application Data
1,1.1074180000000524,62.210.85.178,10.0.2.15,TCP,60,9001  >  35978 [ACK] Seq=5505311 Ack=98570361 Win=65535 Len=0
1,1.107426999999916,62.210.85.178,10.0.2.15,TCP,60,9001  >  35978 [ACK] Seq=5505311 Ack=98571821 Win=65535 Len=0
1,1.1074300000000221,62.210.85.178,10.0.2.15,TCP,60,9001  >  35978 [ACK] Seq=5505311 Ack=98572971 Win=65535 Len=0
1,1.1074749999997948,10.0.2.15,62.210.85.178,TLSv1.2,3030,Application Data
1,1.1075120000000425,62.210.85.178,10.0.2.15,TCP,60,9001  >  35978 [ACK] Seq=5505311 Ack=98574431 Win=65535 Len=0
1,1.1075200000000223,62.210.85.178,10.0.2.15,TCP,60,9001  >  35978 [ACK] Seq=5505311 Ack=98575891 Win=65535 Len=0
1,1.1075230000001284,62.210.85.178,10.0.2.15,TCP,60,9001  >  35978 [ACK] Seq=5505311 Ack=98575947 Win=65535 Len=0
1,1.121161999999913,10.0.2.15,62.210.85.178,TLSv1.2,4124,Application Data
1,1.1212470000000394,62.210.85.178,10.0.2.15,TCP,60,9001  >  35978 [ACK] Seq=5505311 Ack=98577407 Win=65535 Len=0
1,1.1212580000001253,62.210.85.178,10.0.2.15,TCP,60,9001  >  35978 [ACK] Seq=5505311 Ack=98578867 Win=65535 Len=0
1,1.1212609999997767,62.210.85.178,10.0.2.15,TCP,60,9001  >  35978 [ACK] Seq=5505311 Ack=98580017 Win=65535 Len=0
1,1.1213259999999536,10.0.2.15,62.210.85.178,TLSv1.2,4124,Application Data
1,1.1213629999997465,62.210.85.178,10.0.2.15,TCP,60,9001  >  35978 [ACK] Seq=5505311 Ack=98581477 Win=65535 Len=0
1,1.1213709999997263,62.210.85.178,10.0.2.15,TCP,60,9001  >  35978 [ACK] Seq=5505311 Ack=98582937 Win=65535 Len=0
1,1.1213760000000548,62.210.85.178,10.0.2.15,TCP,60,9001  >  35978 [ACK] Seq=5505311 Ack=98584087 Win=65535 Len=0
1,1.12141500000007,10.0.2.15,62.210.85.178,TLSv1.2,4124,Application Data
1,1.1214500000000953,62.210.85.178,10.0.2.15,TCP,60,9001  >  35978 [ACK] Seq=5505311 Ack=98585547 Win=65535 Len=0
1,1.1214569999997366,62.210.85.178,10.0.2.15,TCP,60,9001  >  35978 [ACK] Seq=5505311 Ack=98587007 Win=65535 Len=0
1,1.1214609999997265,62.210.85.178,10.0.2.15,TCP,60,9001  >  35978 [ACK] Seq=5505311 Ack=98588157 Win=65535 Len=0
1,1.1214970000000903,10.0.2.15,62.210.85.178,TLSv1.2,3352,Application Data
1,1.1215309999997771,62.210.85.178,10.0.2.15,TCP,60,9001  >  35978 [ACK] Seq=5505311 Ack=98589617 Win=65535 Len=0
1,1.1215379999998731,62.210.85.178,10.0.2.15,TCP,60,9001  >  35978 [ACK] Seq=5505311 Ack=98591077 Win=65535 Len=0
1,1.121541999999863,62.210.85.178,10.0.2.15,TCP,60,9001  >  35978 [ACK] Seq=5505311 Ack=98591455 Win=65535 Len=0
1,1.1961769999998069,54.93.77.70,10.0.2.15,TLSv1.2,590,Application Data
1,1.212047999999868,54.93.77.70,10.0.2.15,TCP,2950,"9001  >  34692 [PSH, ACK] Seq=98340387 Ack=5502165 Win=65535 Len=2896 [TCP segment of a reassembled PDU]"
1,1.2121259999998983,10.0.2.15,54.93.77.70,TCP,54,34692  >  9001 [ACK] Seq=5502165 Ack=98343283 Win=65535 Len=0
1,1.2191079999997783,54.93.77.70,10.0.2.15,TLSv1.2,4398,"Application Data, Application Data"
1,1.2191889999999148,10.0.2.15,54.93.77.70,TCP,54,34692  >  9001 [ACK] Seq=5502165 Ack=98347627 Win=65535 Len=0
1,1.2430639999997766,54.93.77.70,10.0.2.15,TLSv1.2,3674,Application Data
1,1.2431369999999333,10.0.2.15,54.93.77.70,TCP,54,34692  >  9001 [ACK] Seq=5502165 Ack=98351247 Win=65535 Len=0
1,1.2511279999998806,54.93.77.70,10.0.2.15,TLSv1.2,5846,Application Data
1,1.2511530000001585,54.93.77.70,10.0.2.15,TLSv1.2,4398,Application Data [TCP segment of a reassembled PDU]
1,1.2512369999999464,10.0.2.15,54.93.77.70,TCP,54,34692  >  9001 [ACK] Seq=5502165 Ack=98361383 Win=65535 Len=0
1,1.2513199999998506,54.93.77.70,10.0.2.15,TCP,1502,"9001  >  34692 [PSH, ACK] Seq=98361383 Ack=5502165 Win=65535 Len=1448 [TCP segment of a reassembled PDU]"
1,1.2514909999999873,10.0.2.15,54.93.77.70,TLSv1.2,590,Application Data
1,1.251596999999947,54.93.77.70,10.0.2.15,TCP,60,9001  >  34692 [ACK] Seq=98362831 Ack=5502701 Win=65535 Len=0
1,1.2579649999997855,54.93.77.70,10.0.2.15,TLSv1.2,2950,Application Data [TCP segment of a reassembled PDU]
1,1.2580140000000029,10.0.2.15,54.93.77.70,TCP,54,34692  >  9001 [ACK] Seq=5502701 Ack=98365727 Win=65535 Len=0
1,1.2593120000001363,54.93.77.70,10.0.2.15,TLSv1.2,2950,Application Data [TCP segment of a reassembled PDU]
1,1.259356999999909,10.0.2.15,54.93.77.70,TCP,54,34692  >  9001 [ACK] Seq=5502701 Ack=98368623 Win=65535 Len=0
1,1.260323999999855,54.93.77.70,10.0.2.15,TLSv1.2,5846,Application Data [TCP segment of a reassembled PDU]
1,1.2603840000001583,10.0.2.15,54.93.77.70,TCP,54,34692  >  9001 [ACK] Seq=5502701 Ack=98374415 Win=65535 Len=0
1,1.260609999999815,10.0.2.15,54.93.77.70,TLSv1.2,590,Application Data
1,1.2606949999999415,54.93.77.70,10.0.2.15,TCP,60,9001  >  34692 [ACK] Seq=98374415 Ack=5503237 Win=65535 Len=0
1,1.2679109999999127,54.93.77.70,10.0.2.15,TLSv1.2,1198,"Application Data, Application Data"
1,1.2796260000000075,54.93.77.70,10.0.2.15,TLSv1.2,8742,"Application Data, Application Data"
1,1.2797359999999571,10.0.2.15,54.93.77.70,TCP,54,34692  >  9001 [ACK] Seq=5503237 Ack=98384247 Win=65535 Len=0
1,1.2800739999997859,54.93.77.70,10.0.2.15,TCP,2950,"9001  >  34692 [PSH, ACK] Seq=98384247 Ack=5503237 Win=65535 Len=2896 [TCP segment of a reassembled PDU]"
1,1.2801190000000133,10.0.2.15,54.93.77.70,TCP,54,34692  >  9001 [ACK] Seq=5503237 Ack=98387143 Win=65535 Len=0
1,1.2809090000000651,54.93.77.70,10.0.2.15,TLSv1.2,4398,Application Data [TCP segment of a reassembled PDU]
1,1.2809739999997873,10.0.2.15,54.93.77.70,TCP,54,34692  >  9001 [ACK] Seq=5503237 Ack=98391487 Win=65535 Len=0
1,1.3014689999999973,54.93.77.70,10.0.2.15,TLSv1.2,4304,"Application Data, Application Data, Application Data"
1,1.3015329999998357,10.0.2.15,54.93.77.70,TCP,54,34692  >  9001 [ACK] Seq=5503237 Ack=98395737 Win=65535 Len=0
1,1.3018099999999322,10.0.2.15,54.93.77.70,TLSv1.2,590,Application Data
1,1.3019269999999779,54.93.77.70,10.0.2.15,TCP,60,9001  >  34692 [ACK] Seq=98395737 Ack=5503773 Win=65535 Len=0
1,1.3131379999999808,54.93.77.70,10.0.2.15,TLSv1.2,5846,Application Data
1,1.3131610000000364,54.93.77.70,10.0.2.15,TLSv1.2,5846,Application Data [TCP segment of a reassembled PDU]
1,1.3132359999999608,10.0.2.15,54.93.77.70,TCP,54,34692  >  9001 [ACK] Seq=5503773 Ack=98407321 Win=65535 Len=0
1,1.3136469999999463,54.93.77.70,10.0.2.15,TLSv1.2,2950,Application Data [TCP segment of a reassembled PDU]
1,1.313687999999729,10.0.2.15,54.93.77.70,TCP,54,34692  >  9001 [ACK] Seq=5503773 Ack=98410217 Win=65535 Len=0
1,1.3138730000000578,10.0.2.15,54.93.77.70,TLSv1.2,590,Application Data
1,1.3139439999999922,54.93.77.70,10.0.2.15,TCP,60,9001  >  34692 [ACK] Seq=98410217 Ack=5504309 Win=65535 Len=0
1,1.3200819999997293,54.93.77.70,10.0.2.15,TLSv1.2,568,Application Data
1,1.3248640000001615,10.0.2.15,54.93.77.70,TLSv1.2,590,Application Data
1,1.3250130000001263,54.93.77.70,10.0.2.15,TCP,60,9001  >  34692 [ACK] Seq=98410731 Ack=5504845 Win=65535 Len=0
1,1.3579690000001392,62.210.85.178,10.0.2.15,TLSv1.2,1104,Application Data
1,1.4004930000000968,10.0.2.15,62.210.85.178,TCP,54,35978  >  9001 [ACK] Seq=98591455 Ack=5506361 Win=65535 Len=0
1,1.6000300000000607,62.210.85.178,10.0.2.15,TLSv1.2,1618,Application Data
1,1.6001350000001366,10.0.2.15,62.210.85.178,TCP,54,35978  >  9001 [ACK] Seq=98591455 Ack=5507925 Win=65535 Len=0
1,1.6006489999999758,10.0.2.15,62.210.85.178,TLSv1.2,590,Application Data
1,1.6008480000000418,62.210.85.178,10.0.2.15,TCP,60,9001  >  35978 [ACK] Seq=5507925 Ack=98591991 Win=65535 Len=0
1,1.702139999999872,54.93.77.70,10.0.2.15,TLSv1.2,590,Application Data
1,1.702585999999883,10.0.2.15,54.93.77.70,TLSv1.2,590,Application Data
1,1.702722999999878,54.93.77.70,10.0.2.15,TCP,60,9001  >  34692 [ACK] Seq=98411267 Ack=5505381 Win=65535 Len=0
1,1.8149469999998473,62.210.85.178,10.0.2.15,TLSv1.2,590,Application Data
1,1.8222270000001117,10.0.2.15,62.210.85.178,TLSv1.2,590,Application Data
1,1.8227679999999964,62.210.85.178,10.0.2.15,TCP,60,9001  >  35978 [ACK] Seq=5508461 Ack=98592527 Win=65535 Len=0
1,1.8372220000001107,10.0.2.15,62.210.85.178,TLSv1.2,4124,Application Data
1,1.837340999999924,10.0.2.15,62.210.85.178,TCP,2974,35978  >  9001 [ACK] Seq=98596597 Ack=5508461 Win=65535 Len=2920 [TCP segment of a reassembled PDU]
1,1.837430999999924,62.210.85.178,10.0.2.15,TCP,60,9001  >  35978 [ACK] Seq=5508461 Ack=98593987 Win=65535 Len=0
1,1.8374499999999898,62.210.85.178,10.0.2.15,TCP,60,9001  >  35978 [ACK] Seq=5508461 Ack=98595447 Win=65535 Len=0
1,1.8374539999999797,62.210.85.178,10.0.2.15,TCP,60,9001  >  35978 [ACK] Seq=5508461 Ack=98596597 Win=65535 Len=0
1,1.8374570000000858,62.210.85.178,10.0.2.15,TCP,60,9001  >  35978 [ACK] Seq=5508461 Ack=98598057 Win=65535 Len=0
1,1.8374589999998534,62.210.85.178,10.0.2.15,TCP,60,9001  >  35978 [ACK] Seq=5508461 Ack=98599517 Win=65535 Len=0
1,1.8374969999999848,10.0.2.15,62.210.85.178,TLSv1.2,1204,Application Data
1,1.8375390000001062,62.210.85.178,10.0.2.15,TCP,60,9001  >  35978 [ACK] Seq=5508461 Ack=98600667 Win=65535 Len=0
1,1.8375860000001012,10.0.2.15,62.210.85.178,TLSv1.2,4124,Application Data
1,1.8376260000000002,62.210.85.178,10.0.2.15,TCP,60,9001  >  35978 [ACK] Seq=5508461 Ack=98602127 Win=65535 Len=0
1,1.8376349999998638,62.210.85.178,10.0.2.15,TCP,60,9001  >  35978 [ACK] Seq=5508461 Ack=98603587 Win=65535 Len=0
1,1.83763799999997,62.210.85.178,10.0.2.15,TCP,60,9001  >  35978 [ACK] Seq=5508461 Ack=98604737 Win=65535 Len=0
1,1.8376769999999851,10.0.2.15,62.210.85.178,TLSv1.2,4124,Application Data
1,1.8377169999998841,62.210.85.178,10.0.2.15,TCP,60,9001  >  35978 [ACK] Seq=5508461 Ack=98606197 Win=65535 Len=0
1,1.837724999999864,62.210.85.178,10.0.2.15,TCP,60,9001  >  35978 [ACK] Seq=5508461 Ack=98607657 Win=65535 Len=0
1,1.8377919999998085,10.0.2.15,62.210.85.178,TLSv1.2,2974,Application Data
1,1.8378320000001622,62.210.85.178,10.0.2.15,TCP,60,9001  >  35978 [ACK] Seq=5508461 Ack=98608807 Win=65535 Len=0
1,1.837840000000142,62.210.85.178,10.0.2.15,TCP,60,9001  >  35978 [ACK] Seq=5508461 Ack=98610267 Win=65535 Len=0
1,1.837844000000132,62.210.85.178,10.0.2.15,TCP,60,9001  >  35978 [ACK] Seq=5508461 Ack=98611727 Win=65535 Len=0
1,1.8378760000000511,10.0.2.15,62.210.85.178,TLSv1.2,1226,Application Data
1,1.837912999999844,62.210.85.178,10.0.2.15,TCP,60,9001  >  35978 [ACK] Seq=5508461 Ack=98612899 Win=65535 Len=0
1,1.8379549999999654,10.0.2.15,62.210.85.178,TLSv1.2,4124,Application Data
1,1.8379930000000968,62.210.85.178,10.0.2.15,TCP,60,9001  >  35978 [ACK] Seq=5508461 Ack=98614359 Win=65535 Len=0
1,1.8380010000000766,62.210.85.178,10.0.2.15,TCP,60,9001  >  35978 [ACK] Seq=5508461 Ack=98615819 Win=65535 Len=0
1,1.8380050000000665,62.210.85.178,10.0.2.15,TCP,60,9001  >  35978 [ACK] Seq=5508461 Ack=98616969 Win=65535 Len=0
1,1.8380429999997432,10.0.2.15,62.210.85.178,TLSv1.2,3030,Application Data
1,1.8380819999997584,62.210.85.178,10.0.2.15,TCP,60,9001  >  35978 [ACK] Seq=5508461 Ack=98618429 Win=65535 Len=0
1,1.8380889999998544,62.210.85.178,10.0.2.15,TCP,60,9001  >  35978 [ACK] Seq=5508461 Ack=98619889 Win=65535 Len=0
1,1.8380929999998443,62.210.85.178,10.0.2.15,TCP,60,9001  >  35978 [ACK] Seq=5508461 Ack=98619945 Win=65535 Len=0
1,1.8473810000000412,10.0.2.15,62.210.85.178,TLSv1.2,4124,Application Data
1,1.8474409999998898,62.210.85.178,10.0.2.15,TCP,60,9001  >  35978 [ACK] Seq=5508461 Ack=98621405 Win=65535 Len=0
1,1.8474529999998595,62.210.85.178,10.0.2.15,TCP,60,9001  >  35978 [ACK] Seq=5508461 Ack=98622865 Win=65535 Len=0
1,1.8474579999997331,62.210.85.178,10.0.2.15,TCP,60,9001  >  35978 [ACK] Seq=5508461 Ack=98624015 Win=65535 Len=0
1,1.8475039999998444,10.0.2.15,62.210.85.178,TLSv1.2,4124,Application Data
1,1.847545000000082,62.210.85.178,10.0.2.15,TCP,60,9001  >  35978 [ACK] Seq=5508461 Ack=98625475 Win=65535 Len=0
1,1.8475539999999455,62.210.85.178,10.0.2.15,TCP,60,9001  >  35978 [ACK] Seq=5508461 Ack=98626935 Win=65535 Len=0
1,1.8475579999999354,62.210.85.178,10.0.2.15,TCP,60,9001  >  35978 [ACK] Seq=5508461 Ack=98628085 Win=65535 Len=0
1,1.8475969999999506,10.0.2.15,62.210.85.178,TLSv1.2,4124,Application Data
1,1.847639000000072,62.210.85.178,10.0.2.15,TCP,60,9001  >  35978 [ACK] Seq=5508461 Ack=98629545 Win=65535 Len=0
1,1.8476470000000518,62.210.85.178,10.0.2.15,TCP,60,9001  >  35978 [ACK] Seq=5508461 Ack=98631005 Win=65535 Len=0
1,1.8476519999999255,62.210.85.178,10.0.2.15,TCP,60,9001  >  35978 [ACK] Seq=5508461 Ack=98632155 Win=65535 Len=0
1,1.847689000000173,10.0.2.15,62.210.85.178,TLSv1.2,4124,Application Data
1,1.8477269999998498,62.210.85.178,10.0.2.15,TCP,60,9001  >  35978 [ACK] Seq=5508461 Ack=98633615 Win=65535 Len=0
1,1.8477360000001681,62.210.85.178,10.0.2.15,TCP,60,9001  >  35978 [ACK] Seq=5508461 Ack=98635075 Win=65535 Len=0
1,1.8477410000000418,62.210.85.178,10.0.2.15,TCP,60,9001  >  35978 [ACK] Seq=5508461 Ack=98636225 Win=65535 Len=0
1,1.8477790000001733,10.0.2.15,62.210.85.178,TLSv1.2,332,Application Data
1,1.8478159999999662,62.210.85.178,10.0.2.15,TCP,60,9001  >  35978 [ACK] Seq=5508461 Ack=98636503 Win=65535 Len=0
1,1.847870999999941,10.0.2.15,62.210.85.178,TLSv1.2,3868,Application Data
1,1.84791099999984,62.210.85.178,10.0.2.15,TCP,60,9001  >  35978 [ACK] Seq=5508461 Ack=98637963 Win=65535 Len=0
1,1.8479189999998198,62.210.85.178,10.0.2.15,TCP,60,9001  >  35978 [ACK] Seq=5508461 Ack=98639423 Win=65535 Len=0
1,1.8479240000001482,62.210.85.178,10.0.2.15,TCP,60,9001  >  35978 [ACK] Seq=5508461 Ack=98640317 Win=65535 Len=0
1,1.8479630000001634,10.0.2.15,62.210.85.178,TLSv1.2,4124,Application Data
1,1.8479999999999563,62.210.85.178,10.0.2.15,TCP,60,9001  >  35978 [ACK] Seq=5508461 Ack=98641777 Win=65535 Len=0
1,1.8480079999999361,62.210.85.178,10.0.2.15,TCP,60,9001  >  35978 [ACK] Seq=5508461 Ack=98643237 Win=65535 Len=0
1,1.8480129999998098,62.210.85.178,10.0.2.15,TCP,60,9001  >  35978 [ACK] Seq=5508461 Ack=98644387 Win=65535 Len=0
1,1.8480490000001737,10.0.2.15,62.210.85.178,TLSv1.2,3030,Application Data
1,1.8480869999998504,62.210.85.178,10.0.2.15,TCP,60,9001  >  35978 [ACK] Seq=5508461 Ack=98645847 Win=65535 Len=0
1,1.8480949999998302,62.210.85.178,10.0.2.15,TCP,60,9001  >  35978 [ACK] Seq=5508461 Ack=98647307 Win=65535 Len=0
1,1.84809899999982,62.210.85.178,10.0.2.15,TCP,60,9001  >  35978 [ACK] Seq=5508461 Ack=98647363 Win=65535 Len=0
1,1.8605899999997746,10.0.2.15,62.210.85.178,TLSv1.2,4124,Application Data
1,1.8606899999999769,62.210.85.178,10.0.2.15,TCP,60,9001  >  35978 [ACK] Seq=5508461 Ack=98648823 Win=65535 Len=0
1,1.8606999999997242,62.210.85.178,10.0.2.15,TCP,60,9001  >  35978 [ACK] Seq=5508461 Ack=98650283 Win=65535 Len=0
1,1.8607029999998304,62.210.85.178,10.0.2.15,TCP,60,9001  >  35978 [ACK] Seq=5508461 Ack=98651433 Win=65535 Len=0
1,1.8607480000000578,10.0.2.15,62.210.85.178,TLSv1.2,4124,Application Data
1,1.8607879999999568,62.210.85.178,10.0.2.15,TCP,60,9001  >  35978 [ACK] Seq=5508461 Ack=98652893 Win=65535 Len=0
1,1.8607969999998204,62.210.85.178,10.0.2.15,TCP,60,9001  >  35978 [ACK] Seq=5508461 Ack=98654353 Win=65535 Len=0
1,1.8608020000001488,62.210.85.178,10.0.2.15,TCP,60,9001  >  35978 [ACK] Seq=5508461 Ack=98655503 Win=65535 Len=0
1,1.8608429999999316,10.0.2.15,62.210.85.178,TLSv1.2,2260,Application Data
1,1.860881000000063,62.210.85.178,10.0.2.15,TCP,60,9001  >  35978 [ACK] Seq=5508461 Ack=98656963 Win=65535 Len=0
1,1.8608890000000429,62.210.85.178,10.0.2.15,TCP,60,9001  >  35978 [ACK] Seq=5508461 Ack=98657709 Win=65535 Len=0
1,1.9494199999999182,54.93.77.70,10.0.2.15,TCP,2950,"9001  >  34692 [PSH, ACK] Seq=98411267 Ack=5505381 Win=65535 Len=2896 [TCP segment of a reassembled PDU]"
1,1.9495349999997416,10.0.2.15,54.93.77.70,TCP,54,34692  >  9001 [ACK] Seq=5505381 Ack=98414163 Win=65535 Len=0
1,1.9503759999997783,54.93.77.70,10.0.2.15,TLSv1.2,9046,"Application Data, Application Data, Application Data"
1,1.9504400000000714,10.0.2.15,54.93.77.70,TCP,54,34692  >  9001 [ACK] Seq=5505381 Ack=98423155 Win=65535 Len=0
1,1.96659899999986,54.93.77.70,10.0.2.15,TLSv1.2,2950,Application Data
1,1.966653999999835,10.0.2.15,54.93.77.70,TCP,54,34692  >  9001 [ACK] Seq=5505381 Ack=98426051 Win=65535 Len=0
1,1.9674650000001748,54.93.77.70,10.0.2.15,TLSv1.2,7294,"Application Data, Application Data"
1,1.9680170000001453,10.0.2.15,54.93.77.70,TCP,54,34692  >  9001 [ACK] Seq=5505381 Ack=98433291 Win=65535 Len=0
1,1.9684120000001712,54.93.77.70,10.0.2.15,TLSv1.2,2342,Application Data
1,1.9684560000000602,10.0.2.15,54.93.77.70,TCP,54,34692  >  9001 [ACK] Seq=5505381 Ack=98435579 Win=65535 Len=0
1,1.9758419999998296,54.93.77.70,10.0.2.15,TLSv1.2,7294,Application Data
1,1.975879999999961,54.93.77.70,10.0.2.15,TLSv1.2,7294,"Application Data, Application Data"
1,1.9759859999999208,10.0.2.15,54.93.77.70,TCP,54,34692  >  9001 [ACK] Seq=5505381 Ack=98450059 Win=65535 Len=0
1,1.9762110000001485,10.0.2.15,54.93.77.70,TLSv1.2,590,Application Data
1,1.976314999999886,54.93.77.70,10.0.2.15,TCP,60,9001  >  34692 [ACK] Seq=98450059 Ack=5505917 Win=65535 Len=0
1,1.983208999999988,54.93.77.70,10.0.2.15,TCP,1502,"9001  >  34692 [PSH, ACK] Seq=98450059 Ack=5505917 Win=65535 Len=1448 [TCP segment of a reassembled PDU]"
1,1.9832569999998668,10.0.2.15,54.93.77.70,TCP,54,34692  >  9001 [ACK] Seq=5505917 Ack=98451507 Win=65535 Len=0
1,1.9842730000000302,54.93.77.70,10.0.2.15,TLSv1.2,684,"Application Data, Application Data"
1,1.9873029999998835,54.93.77.70,10.0.2.15,TCP,1502,"9001  >  34692 [PSH, ACK] Seq=98452137 Ack=5505917 Win=65535 Len=1448 [TCP segment of a reassembled PDU]"
1,1.987619999999879,10.0.2.15,54.93.77.70,TCP,54,34692  >  9001 [ACK] Seq=5505917 Ack=98453585 Win=65535 Len=0
1,1.9954090000001088,54.93.77.70,10.0.2.15,TLSv1.2,4398,Application Data [TCP segment of a reassembled PDU]
1,1.9955110000000786,10.0.2.15,54.93.77.70,TCP,54,34692  >  9001 [ACK] Seq=5505917 Ack=98457929 Win=65535 Len=0
1,2.000756999999794,54.93.77.70,10.0.2.15,TLSv1.2,474,Application Data
1,2.0146209999998064,54.93.77.70,10.0.2.15,TLSv1.2,4398,Application Data
1,2.014691999999741,10.0.2.15,54.93.77.70,TCP,54,34692  >  9001 [ACK] Seq=5505917 Ack=98462693 Win=65535 Len=0
1,2.0148559999997815,10.0.2.15,54.93.77.70,TLSv1.2,590,Application Data
1,2.0149280000000545,54.93.77.70,10.0.2.15,TCP,60,9001  >  34692 [ACK] Seq=98462693 Ack=5506453 Win=65535 Len=0
1,2.0154379999999037,54.93.77.70,10.0.2.15,TLSv1.2,7294,"Application Data, Application Data"
1,2.015505999999732,10.0.2.15,54.93.77.70,TCP,54,34692  >  9001 [ACK] Seq=5506453 Ack=98469933 Win=65535 Len=0
1,2.01676899999984,54.93.77.70,10.0.2.15,TLSv1.2,5846,"Application Data, Application Data, Application Data"
1,2.0168149999999514,10.0.2.15,54.93.77.70,TCP,54,34692  >  9001 [ACK] Seq=5506453 Ack=98475725 Win=65535 Len=0
1,2.0261930000001485,10.0.2.15,54.93.77.70,TLSv1.2,590,Application Data
1,2.0262790000001587,54.93.77.70,10.0.2.15,TCP,60,9001  >  34692 [ACK] Seq=98475725 Ack=5506989 Win=65535 Len=0
1,2.031825000000026,54.93.77.70,10.0.2.15,TLSv1.2,1336,Application Data
1,2.035417999999936,10.0.2.15,54.93.77.70,TLSv1.2,590,Application Data
1,2.0355509999999413,54.93.77.70,10.0.2.15,TCP,60,9001  >  34692 [ACK] Seq=98477007 Ack=5507525 Win=65535 Len=0
1,2.0887739999998303,62.210.85.178,10.0.2.15,TLSv1.2,590,Application Data
1,2.1325019999999313,10.0.2.15,62.210.85.178,TCP,54,35978  >  9001 [ACK] Seq=98657709 Ack=5508997 Win=65535 Len=0
1,2.1610759999998663,62.210.85.178,10.0.2.15,TLSv1.2,590,Application Data
1,2.1611330000000635,10.0.2.15,62.210.85.178,TCP,54,35978  >  9001 [ACK] Seq=98657709 Ack=5509533 Win=65535 Len=0
1,2.2186689999998634,62.210.85.178,10.0.2.15,TLSv1.2,1104,Application Data
1,2.218742999999904,10.0.2.15,62.210.85.178,TCP,54,35978  >  9001 [ACK] Seq=98657709 Ack=5510583 Win=65535 Len=0
1,2.2192230000000563,10.0.2.15,62.210.85.178,TLSv1.2,590,Application Data
1,2.21932599999991,62.210.85.178,10.0.2.15,TCP,60,9001  >  35978 [ACK] Seq=5510583 Ack=98658245 Win=65535 Len=0
1,2.3311659999999392,54.93.77.70,10.0.2.15,TLSv1.2,590,Application Data
1,2.3318289999997432,10.0.2.15,54.93.77.70,TLSv1.2,590,Application Data
1,2.3319799999999304,54.93.77.70,10.0.2.15,TCP,60,9001  >  34692 [ACK] Seq=98477543 Ack=5508061 Win=65535 Len=0
1,2.4313090000000557,62.210.85.178,10.0.2.15,TLSv1.2,590,Application Data
1,2.4377439999998387,10.0.2.15,62.210.85.178,TLSv1.2,590,Application Data
1,2.4378999999998996,62.210.85.178,10.0.2.15,TCP,60,9001  >  35978 [ACK] Seq=5511119 Ack=98658781 Win=65535 Len=0
1,2.4534029999999802,10.0.2.15,62.210.85.178,TLSv1.2,4124,Application Data
1,2.453498999999738,10.0.2.15,62.210.85.178,TCP,2974,35978  >  9001 [ACK] Seq=98662851 Ack=5511119 Win=65535 Len=2920 [TCP segment of a reassembled PDU]
1,2.4535439999999653,62.210.85.178,10.0.2.15,TCP,60,9001  >  35978 [ACK] Seq=5511119 Ack=98660241 Win=65535 Len=0
1,2.453556999999819,62.210.85.178,10.0.2.15,TCP,60,9001  >  35978 [ACK] Seq=5511119 Ack=98661701 Win=65535 Len=0
1,2.4535620000001472,62.210.85.178,10.0.2.15,TCP,60,9001  >  35978 [ACK] Seq=5511119 Ack=98662851 Win=65535 Len=0
1,2.453563999999915,62.210.85.178,10.0.2.15,TCP,60,9001  >  35978 [ACK] Seq=5511119 Ack=98664311 Win=65535 Len=0
1,2.453567000000021,62.210.85.178,10.0.2.15,TCP,60,9001  >  35978 [ACK] Seq=5511119 Ack=98665771 Win=65535 Len=0
1,2.4536010000001625,10.0.2.15,62.210.85.178,TLSv1.2,1204,Application Data
1,2.453635999999733,62.210.85.178,10.0.2.15,TCP,60,9001  >  35978 [ACK] Seq=5511119 Ack=98666921 Win=65535 Len=0
1,2.4536800000000767,10.0.2.15,62.210.85.178,TLSv1.2,4124,Application Data
1,2.453715000000102,62.210.85.178,10.0.2.15,TCP,60,9001  >  35978 [ACK] Seq=5511119 Ack=98668381 Win=65535 Len=0
1,2.453723000000082,62.210.85.178,10.0.2.15,TCP,60,9001  >  35978 [ACK] Seq=5511119 Ack=98669841 Win=65535 Len=0
1,2.4537270000000717,62.210.85.178,10.0.2.15,TCP,60,9001  >  35978 [ACK] Seq=5511119 Ack=98670991 Win=65535 Len=0
1,2.4537639999998646,10.0.2.15,62.210.85.178,TLSv1.2,4124,Application Data
1,2.453798000000006,62.210.85.178,10.0.2.15,TCP,60,9001  >  35978 [ACK] Seq=5511119 Ack=98672451 Win=65535 Len=0
1,2.453805000000102,62.210.85.178,10.0.2.15,TCP,60,9001  >  35978 [ACK] Seq=5511119 Ack=98673911 Win=65535 Len=0
1,2.4538480000001073,62.210.85.178,10.0.2.15,TCP,60,9001  >  35978 [ACK] Seq=5511119 Ack=98675061 Win=65535 Len=0
1,2.4538830000001326,10.0.2.15,62.210.85.178,TLSv1.2,332,Application Data
1,2.453915000000052,62.210.85.178,10.0.2.15,TCP,60,9001  >  35978 [ACK] Seq=5511119 Ack=98675339 Win=65535 Len=0
1,2.453969000000143,10.0.2.15,62.210.85.178,TLSv1.2,3868,Application Data
1,2.4540059999999357,62.210.85.178,10.0.2.15,TCP,60,9001  >  35978 [ACK] Seq=5511119 Ack=98676799 Win=65535 Len=0
1,2.454012000000148,62.210.85.178,10.0.2.15,TCP,60,9001  >  35978 [ACK] Seq=5511119 Ack=98678259 Win=65535 Len=0
1,2.4540149999997993,62.210.85.178,10.0.2.15,TCP,60,9001  >  35978 [ACK] Seq=5511119 Ack=98679153 Win=65535 Len=0
1,2.454052000000047,10.0.2.15,62.210.85.178,TLSv1.2,4124,Application Data
1,2.4540870000000723,62.210.85.178,10.0.2.15,TCP,60,9001  >  35978 [ACK] Seq=5511119 Ack=98680613 Win=65535 Len=0
1,2.4540929999998298,62.210.85.178,10.0.2.15,TCP,60,9001  >  35978 [ACK] Seq=5511119 Ack=98682073 Win=65535 Len=0
1,2.454095999999936,62.210.85.178,10.0.2.15,TCP,60,9001  >  35978 [ACK] Seq=5511119 Ack=98683223 Win=65535 Len=0
1,2.4541300000000774,10.0.2.15,62.210.85.178,TLSv1.2,3030,Application Data
1,2.4541650000001027,62.210.85.178,10.0.2.15,TCP,60,9001  >  35978 [ACK] Seq=5511119 Ack=98684683 Win=65535 Len=0
1,2.45417099999986,62.210.85.178,10.0.2.15,TCP,60,9001  >  35978 [ACK] Seq=5511119 Ack=98686143 Win=65535 Len=0
1,2.4541739999999663,62.210.85.178,10.0.2.15,TCP,60,9001  >  35978 [ACK] Seq=5511119 Ack=98686199 Win=65535 Len=0
1,2.4634820000001127,10.0.2.15,62.210.85.178,TLSv1.2,4124,Application Data
1,2.46367999999984,62.210.85.178,10.0.2.15,TCP,60,9001  >  35978 [ACK] Seq=5511119 Ack=98687659 Win=65535 Len=0
1,2.463698999999906,62.210.85.178,10.0.2.15,TCP,60,9001  >  35978 [ACK] Seq=5511119 Ack=98689119 Win=65535 Len=0
1,2.4637039999997796,62.210.85.178,10.0.2.15,TCP,60,9001  >  35978 [ACK] Seq=5511119 Ack=98690269 Win=65535 Len=0
1,2.4637830000001486,10.0.2.15,62.210.85.178,TLSv1.2,4124,Application Data
1,2.4638629999999466,62.210.85.178,10.0.2.15,TCP,60,9001  >  35978 [ACK] Seq=5511119 Ack=98691729 Win=65535 Len=0
1,2.4638759999998,62.210.85.178,10.0.2.15,TCP,60,9001  >  35978 [ACK] Seq=5511119 Ack=98693189 Win=65535 Len=0
1,2.46387999999979,62.210.85.178,10.0.2.15,TCP,60,9001  >  35978 [ACK] Seq=5511119 Ack=98694339 Win=65535 Len=0
1,2.463929999999891,10.0.2.15,62.210.85.178,TLSv1.2,4124,Application Data
1,2.4639750000001186,62.210.85.178,10.0.2.15,TCP,60,9001  >  35978 [ACK] Seq=5511119 Ack=98695799 Win=65535 Len=0
1,2.463983999999982,62.210.85.178,10.0.2.15,TCP,60,9001  >  35978 [ACK] Seq=5511119 Ack=98697259 Win=65535 Len=0
1,2.463987999999972,62.210.85.178,10.0.2.15,TCP,60,9001  >  35978 [ACK] Seq=5511119 Ack=98698409 Win=65535 Len=0
1,2.4640519999998105,10.0.2.15,62.210.85.178,TLSv1.2,4124,Application Data
1,2.46416999999974,62.210.85.178,10.0.2.15,TCP,60,9001  >  35978 [ACK] Seq=5511119 Ack=98699869 Win=65535 Len=0
1,2.464183000000048,62.210.85.178,10.0.2.15,TCP,60,9001  >  35978 [ACK] Seq=5511119 Ack=98701329 Win=65535 Len=0
1,2.464187999999922,62.210.85.178,10.0.2.15,TCP,60,9001  >  35978 [ACK] Seq=5511119 Ack=98702479 Win=65535 Len=0
1,2.4642439999997805,10.0.2.15,62.210.85.178,TLSv1.2,332,Application Data
1,2.4642939999998816,62.210.85.178,10.0.2.15,TCP,60,9001  >  35978 [ACK] Seq=5511119 Ack=98702757 Win=65535 Len=0
1,2.4643769999997858,10.0.2.15,62.210.85.178,TLSv1.2,3868,Application Data
1,2.4644560000001547,62.210.85.178,10.0.2.15,TCP,60,9001  >  35978 [ACK] Seq=5511119 Ack=98704217 Win=65535 Len=0
1,2.4644690000000082,62.210.85.178,10.0.2.15,TCP,60,9001  >  35978 [ACK] Seq=5511119 Ack=98705677 Win=65535 Len=0
1,2.464472999999998,62.210.85.178,10.0.2.15,TCP,60,9001  >  35978 [ACK] Seq=5511119 Ack=98706571 Win=65535 Len=0
1,2.4645399999999427,10.0.2.15,62.210.85.178,TLSv1.2,4124,Application Data
1,2.4646170000000893,10.0.2.15,62.210.85.178,TCP,2974,35978  >  9001 [ACK] Seq=98710641 Ack=5511119 Win=65535 Len=2920 [TCP segment of a reassembled PDU]
1,2.464657999999872,62.210.85.178,10.0.2.15,TCP,60,9001  >  35978 [ACK] Seq=5511119 Ack=98708031 Win=65535 Len=0
1,2.4646669999997357,62.210.85.178,10.0.2.15,TCP,60,9001  >  35978 [ACK] Seq=5511119 Ack=98709491 Win=65535 Len=0
1,2.464672000000064,62.210.85.178,10.0.2.15,TCP,60,9001  >  35978 [ACK] Seq=5511119 Ack=98710641 Win=65535 Len=0
1,2.4646779999998216,62.210.85.178,10.0.2.15,TCP,60,9001  >  35978 [ACK] Seq=5511119 Ack=98712101 Win=65535 Len=0
1,2.46468300000015,62.210.85.178,10.0.2.15,TCP,60,9001  >  35978 [ACK] Seq=5511119 Ack=98713561 Win=65535 Len=0
1,2.4647289999998065,10.0.2.15,62.210.85.178,TLSv1.2,110,Application Data
1,2.464774000000034,62.210.85.178,10.0.2.15,TCP,60,9001  >  35978 [ACK] Seq=5511119 Ack=98713617 Win=65535 Len=0
1,2.47739700000011,10.0.2.15,62.210.85.178,TLSv1.2,4124,Application Data
1,2.4775449999997363,62.210.85.178,10.0.2.15,TCP,60,9001  >  35978 [ACK] Seq=5511119 Ack=98715077 Win=65535 Len=0
1,2.4775620000000345,62.210.85.178,10.0.2.15,TCP,60,9001  >  35978 [ACK] Seq=5511119 Ack=98716537 Win=65535 Len=0
1,2.477566999999908,62.210.85.178,10.0.2.15,TCP,60,9001  >  35978 [ACK] Seq=5511119 Ack=98717687 Win=65535 Len=0
1,2.4775949999998375,10.0.2.15,62.210.85.178,TCP,2974,35978  >  9001 [ACK] Seq=98717687 Ack=5511119 Win=65535 Len=2920 [TCP segment of a reassembled PDU]
1,2.477644000000055,62.210.85.178,10.0.2.15,TCP,60,9001  >  35978 [ACK] Seq=5511119 Ack=98719147 Win=65535 Len=0
1,2.4776499999998123,62.210.85.178,10.0.2.15,TCP,60,9001  >  35978 [ACK] Seq=5511119 Ack=98720607 Win=65535 Len=0
1,2.4776879999999437,10.0.2.15,62.210.85.178,TLSv1.2,1204,Application Data
1,2.4777289999997265,62.210.85.178,10.0.2.15,TCP,60,9001  >  35978 [ACK] Seq=5511119 Ack=98721757 Win=65535 Len=0
1,2.4777789999998276,10.0.2.15,62.210.85.178,TLSv1.2,4124,Application Data
1,2.4778189999997267,62.210.85.178,10.0.2.15,TCP,60,9001  >  35978 [ACK] Seq=5511119 Ack=98723217 Win=65535 Len=0
1,2.4778259999998227,62.210.85.178,10.0.2.15,TCP,60,9001  >  35978 [ACK] Seq=5511119 Ack=98724677 Win=65535 Len=0
1,2.477831000000151,62.210.85.178,10.0.2.15,TCP,60,9001  >  35978 [ACK] Seq=5511119 Ack=98725827 Win=65535 Len=0
1,2.477878000000146,10.0.2.15,62.210.85.178,TLSv1.2,4124,Application Data
1,2.477918999999929,62.210.85.178,10.0.2.15,TCP,60,9001  >  35978 [ACK] Seq=5511119 Ack=98727287 Win=65535 Len=0
1,2.477925000000141,62.210.85.178,10.0.2.15,TCP,60,9001  >  35978 [ACK] Seq=5511119 Ack=98728747 Win=65535 Len=0
1,2.477930000000015,62.210.85.178,10.0.2.15,TCP,60,9001  >  35978 [ACK] Seq=5511119 Ack=98729897 Win=65535 Len=0
1,2.4779709999997976,10.0.2.15,62.210.85.178,TLSv1.2,332,Application Data
1,2.478071,10.0.2.15,62.210.85.178,TCP,2974,35978  >  9001 [ACK] Seq=98730175 Ack=5511119 Win=65535 Len=2920 [TCP segment of a reassembled PDU]
1,2.4780940000000555,62.210.85.178,10.0.2.15,TCP,60,9001  >  35978 [ACK] Seq=5511119 Ack=98730175 Win=65535 Len=0
1,2.4781330000000708,10.0.2.15,62.210.85.178,TLSv1.2,948,Application Data
1,2.478176000000076,62.210.85.178,10.0.2.15,TCP,60,9001  >  35978 [ACK] Seq=5511119 Ack=98731635 Win=65535 Len=0
1,2.478183000000172,62.210.85.178,10.0.2.15,TCP,60,9001  >  35978 [ACK] Seq=5511119 Ack=98733095 Win=65535 Len=0
1,2.4781880000000456,62.210.85.178,10.0.2.15,TCP,60,9001  >  35978 [ACK] Seq=5511119 Ack=98733989 Win=65535 Len=0
1,2.4782359999999244,10.0.2.15,62.210.85.178,TLSv1.2,4124,Application Data
1,2.4782759999998234,62.210.85.178,10.0.2.15,TCP,60,9001  >  35978 [ACK] Seq=5511119 Ack=98735449 Win=65535 Len=0
1,2.4782829999999194,62.210.85.178,10.0.2.15,TCP,60,9001  >  35978 [ACK] Seq=5511119 Ack=98736909 Win=65535 Len=0
1,2.478287999999793,62.210.85.178,10.0.2.15,TCP,60,9001  >  35978 [ACK] Seq=5511119 Ack=98738059 Win=65535 Len=0
1,2.4783339999999043,10.0.2.15,62.210.85.178,TLSv1.2,3030,Application Data
1,2.478375000000142,62.210.85.178,10.0.2.15,TCP,60,9001  >  35978 [ACK] Seq=5511119 Ack=98739519 Win=65535 Len=0
1,2.478381999999783,62.210.85.178,10.0.2.15,TCP,60,9001  >  35978 [ACK] Seq=5511119 Ack=98740979 Win=65535 Len=0
1,2.4783870000001116,62.210.85.178,10.0.2.15,TCP,60,9001  >  35978 [ACK] Seq=5511119 Ack=98741035 Win=65535 Len=0
1,2.48756800000001,10.0.2.15,62.210.85.178,TLSv1.2,1104,Application Data
1,2.4877120000001014,62.210.85.178,10.0.2.15,TCP,60,9001  >  35978 [ACK] Seq=5511119 Ack=98742085 Win=65535 Len=0
1,2.726466999999957,54.93.77.70,10.0.2.15,TCP,2950,"9001  >  34692 [PSH, ACK] Seq=98477543 Ack=5508061 Win=65535 Len=2896 [TCP segment of a reassembled PDU]"
1,2.7266239999999016,10.0.2.15,54.93.77.70,TCP,54,34692  >  9001 [ACK] Seq=5508061 Ack=98480439 Win=65535 Len=0
1,2.7301769999999124,54.93.77.70,10.0.2.15,TLSv1.2,4398,Application Data [TCP segment of a reassembled PDU]
1,2.7302009999998518,54.93.77.70,10.0.2.15,TLSv1.2,3850,Application Data [TCP segment of a reassembled PDU]
1,2.7302089999998316,54.93.77.70,10.0.2.15,TLSv1.2,2950,Application Data [TCP segment of a reassembled PDU]
1,2.7302669999999125,10.0.2.15,54.93.77.70,TCP,54,34692  >  9001 [ACK] Seq=5508061 Ack=98491475 Win=65535 Len=0
1,2.730772999999772,54.93.77.70,10.0.2.15,TLSv1.2,1502,Application Data [TCP segment of a reassembled PDU]
1,2.730814999999893,10.0.2.15,54.93.77.70,TCP,54,34692  >  9001 [ACK] Seq=5508061 Ack=98492923 Win=65535 Len=0
1,2.745379999999841,54.93.77.70,10.0.2.15,TCP,2950,"9001  >  34692 [PSH, ACK] Seq=98492923 Ack=5508061 Win=65535 Len=2896 [TCP segment of a reassembled PDU]"
1,2.7454499999998916,10.0.2.15,54.93.77.70,TCP,54,34692  >  9001 [ACK] Seq=5508061 Ack=98495819 Win=65535 Len=0
1,2.746810000000096,54.93.77.70,10.0.2.15,TLSv1.2,5846,"Application Data, Application Data"
1,2.7468810000000303,10.0.2.15,54.93.77.70,TCP,54,34692  >  9001 [ACK] Seq=5508061 Ack=98501611 Win=65535 Len=0
1,2.748051999999916,54.93.77.70,10.0.2.15,TLSv1.2,5482,"Application Data, Application Data, Application Data"
1,2.7480970000001435,10.0.2.15,54.93.77.70,TCP,54,34692  >  9001 [ACK] Seq=5508061 Ack=98507039 Win=65535 Len=0
1,2.748243999999886,10.0.2.15,54.93.77.70,TLSv1.2,590,Application Data
1,2.748312000000169,54.93.77.70,10.0.2.15,TCP,60,9001  >  34692 [ACK] Seq=98507039 Ack=5508597 Win=65535 Len=0
1,2.7532759999999143,54.93.77.70,10.0.2.15,TCP,2950,"9001  >  34692 [PSH, ACK] Seq=98507039 Ack=5508597 Win=65535 Len=2896 [TCP segment of a reassembled PDU]"
1,2.7533189999999195,10.0.2.15,54.93.77.70,TCP,54,34692  >  9001 [ACK] Seq=5508597 Ack=98509935 Win=65535 Len=0
1,2.7546919999999773,54.93.77.70,10.0.2.15,TLSv1.2,8742,"Application Data, Application Data"
1,2.754758000000038,10.0.2.15,54.93.77.70,TCP,54,34692  >  9001 [ACK] Seq=5508597 Ack=98518623 Win=65535 Len=0
1,2.755482999999913,54.93.77.70,10.0.2.15,TLSv1.2,1502,Application Data [TCP segment of a reassembled PDU]
1,2.755522999999812,10.0.2.15,54.93.77.70,TCP,54,34692  >  9001 [ACK] Seq=5508597 Ack=98520071 Win=65535 Len=0
1,2.7588479999999436,10.0.2.15,54.93.77.70,TLSv1.2,590,Application Data
1,2.759012999999868,54.93.77.70,10.0.2.15,TCP,60,9001  >  34692 [ACK] Seq=98520071 Ack=5509133 Win=65535 Len=0
1,2.761837999999898,54.93.77.70,10.0.2.15,TCP,2950,"9001  >  34692 [PSH, ACK] Seq=98520071 Ack=5509133 Win=65535 Len=2896 [TCP segment of a reassembled PDU]"
1,2.7621509999999034,10.0.2.15,54.93.77.70,TCP,54,34692  >  9001 [ACK] Seq=5509133 Ack=98522967 Win=65535 Len=0
1,2.7630810000000565,54.93.77.70,10.0.2.15,TLSv1.2,5846,"Application Data, Application Data, Application Data"
1,2.7634119999997893,10.0.2.15,54.93.77.70,TCP,54,34692  >  9001 [ACK] Seq=5509133 Ack=98528759 Win=65535 Len=0
1,2.7654640000000654,54.93.77.70,10.0.2.15,TLSv1.2,14534,"Application Data, Application Data, Application Data, Application Data"
1,2.7656699999997727,10.0.2.15,54.93.77.70,TCP,54,34692  >  9001 [ACK] Seq=5509133 Ack=98543239 Win=65535 Len=0
1,2.7690959999999905,10.0.2.15,54.93.77.70,TLSv1.2,590,Application Data
1,2.769267000000127,54.93.77.70,10.0.2.15,TCP,60,9001  >  34692 [ACK] Seq=98543239 Ack=5509669 Win=65535 Len=0
1,2.770242000000053,54.93.77.70,10.0.2.15,TLSv1.2,2950,Application Data [TCP segment of a reassembled PDU]
1,2.770318999999745,10.0.2.15,54.93.77.70,TCP,54,34692  >  9001 [ACK] Seq=5509669 Ack=98546135 Win=65535 Len=0
1,2.7714559999999437,54.93.77.70,10.0.2.15,TLSv1.2,5846,"Application Data, Application Data"
1,2.771527999999762,10.0.2.15,54.93.77.70,TCP,54,34692  >  9001 [ACK] Seq=5509669 Ack=98551927 Win=65535 Len=0
1,2.772997999999916,54.93.77.70,10.0.2.15,TLSv1.2,8460,"Application Data, Application Data, Application Data"
1,2.7730750000000626,10.0.2.15,54.93.77.70,TCP,54,34692  >  9001 [ACK] Seq=5509669 Ack=98560333 Win=65535 Len=0
1,2.7786059999998542,10.0.2.15,54.93.77.70,TLSv1.2,590,Application Data
1,2.7787570000000414,54.93.77.70,10.0.2.15,TCP,60,9001  >  34692 [ACK] Seq=98560333 Ack=5510205 Win=65535 Len=0
1,2.861402999999882,54.93.77.70,10.0.2.15,TLSv1.2,1104,Application Data
1,2.8655109999999695,10.0.2.15,54.93.77.70,TLSv1.2,590,Application Data
1,2.865729999999985,54.93.77.70,10.0.2.15,TCP,60,9001  >  34692 [ACK] Seq=98561383 Ack=5510741 Win=65535 Len=0
1,2.8670859999997447,62.210.85.178,10.0.2.15,TLSv1.2,590,Application Data
1,2.9100429999998596,10.0.2.15,62.210.85.178,TCP,54,35978  >  9001 [ACK] Seq=98742085 Ack=5511655 Win=65535 Len=0
1,2.927447000000029,62.210.85.178,10.0.2.15,TLSv1.2,1640,"Application Data, Application Data"
1,2.9275539999998728,10.0.2.15,62.210.85.178,TCP,54,35978  >  9001 [ACK] Seq=98742085 Ack=5513241 Win=65535 Len=0
1,3.03841199999988,62.210.85.178,10.0.2.15,TLSv1.2,590,Application Data
1,3.038641000000098,10.0.2.15,62.210.85.178,TCP,54,35978  >  9001 [ACK] Seq=98742085 Ack=5513777 Win=65535 Len=0
1,3.0399139999999534,10.0.2.15,62.210.85.178,TLSv1.2,590,Application Data
1,3.040345999999772,62.210.85.178,10.0.2.15,TCP,60,9001  >  35978 [ACK] Seq=5513777 Ack=98742621 Win=65535 Len=0
1,3.1411629999997785,54.93.77.70,10.0.2.15,TLSv1.2,590,Application Data
1,3.1432599999998274,10.0.2.15,54.93.77.70,TLSv1.2,590,Application Data
1,3.143721999999798,54.93.77.70,10.0.2.15,TCP,60,9001  >  34692 [ACK] Seq=98561919 Ack=5511277 Win=65535 Len=0
1,3.2422339999998258,62.210.85.178,10.0.2.15,TLSv1.2,590,Application Data
1,3.2464129999998477,10.0.2.15,62.210.85.178,TLSv1.2,590,Application Data
1,3.2466199999998935,62.210.85.178,10.0.2.15,TCP,60,9001  >  35978 [ACK] Seq=5514313 Ack=98743157 Win=65535 Len=0
1,3.2568639999999505,10.0.2.15,62.210.85.178,TLSv1.2,4124,Application Data
1,3.25706799999989,62.210.85.178,10.0.2.15,TCP,60,9001  >  35978 [ACK] Seq=5514313 Ack=98744617 Win=65535 Len=0
1,3.257105000000138,62.210.85.178,10.0.2.15,TCP,60,9001  >  35978 [ACK] Seq=5514313 Ack=98746077 Win=65535 Len=0
1,3.257107999999789,62.210.85.178,10.0.2.15,TCP,60,9001  >  35978 [ACK] Seq=5514313 Ack=98747227 Win=65535 Len=0
1,3.2571749999997337,10.0.2.15,62.210.85.178,TLSv1.2,4124,Application Data
1,3.2572730000001684,10.0.2.15,62.210.85.178,TCP,1514,35978  >  9001 [ACK] Seq=98751297 Ack=5514313 Win=65535 Len=1460 [TCP segment of a reassembled PDU]
1,3.2572989999998754,62.210.85.178,10.0.2.15,TCP,60,9001  >  35978 [ACK] Seq=5514313 Ack=98748687 Win=65535 Len=0
1,3.257306999999855,62.210.85.178,10.0.2.15,TCP,60,9001  >  35978 [ACK] Seq=5514313 Ack=98750147 Win=65535 Len=0
1,3.2573130000000674,62.210.85.178,10.0.2.15,TCP,60,9001  >  35978 [ACK] Seq=5514313 Ack=98751297 Win=65535 Len=0
1,3.2573170000000573,62.210.85.178,10.0.2.15,TCP,60,9001  >  35978 [ACK] Seq=5514313 Ack=98752757 Win=65535 Len=0
1,3.2573520000000826,10.0.2.15,62.210.85.178,TLSv1.2,1314,Application Data
1,3.2573899999997593,62.210.85.178,10.0.2.15,TCP,60,9001  >  35978 [ACK] Seq=5514313 Ack=98754017 Win=65535 Len=0
1,3.339328000000023,54.93.77.70,10.0.2.15,TLSv1.2,590,Application Data
1,3.363018000000011,54.93.77.70,10.0.2.15,TCP,2950,"9001  >  34692 [PSH, ACK] Seq=98562455 Ack=5511277 Win=65535 Len=2896 [TCP segment of a reassembled PDU]"
1,3.36314799999991,10.0.2.15,54.93.77.70,TCP,54,34692  >  9001 [ACK] Seq=5511277 Ack=98565351 Win=65535 Len=0
1,3.373508000000129,54.93.77.70,10.0.2.15,TLSv1.2,4398,"Application Data, Application Data"
1,3.3737409999998818,10.0.2.15,54.93.77.70,TCP,54,34692  >  9001 [ACK] Seq=5511277 Ack=98569695 Win=65535 Len=0
1,3.374108999999862,10.0.2.15,54.93.77.70,TLSv1.2,590,Application Data
1,3.3742349999997714,54.93.77.70,10.0.2.15,TCP,60,9001  >  34692 [ACK] Seq=98569695 Ack=5511813 Win=65535 Len=0
1,3.384860000000117,54.93.77.70,10.0.2.15,TLSv1.2,3674,Application Data
1,3.4007339999998294,10.0.2.15,54.93.77.70,TCP,54,34692  >  9001 [ACK] Seq=5511813 Ack=98573315 Win=65535 Len=0
1,3.412453999999798,10.0.2.15,54.93.77.70,TLSv1.2,590,Application Data
1,3.4141460000000734,54.93.77.70,10.0.2.15,TCP,60,9001  >  34692 [ACK] Seq=98573315 Ack=5512349 Win=65535 Len=0
1,3.537891999999829,62.210.85.178,10.0.2.15,TLSv1.2,590,Application Data
1,3.5805059999997866,10.0.2.15,62.210.85.178,TCP,54,35978  >  9001 [ACK] Seq=98754017 Ack=5514849 Win=65535 Len=0
1,3.6401379999997516,62.210.85.178,10.0.2.15,TLSv1.2,590,Application Data
1,3.640237999999954,10.0.2.15,62.210.85.178,TCP,54,35978  >  9001 [ACK] Seq=98754017 Ack=5515385 Win=65535 Len=0
1,3.640617999999904,10.0.2.15,62.210.85.178,TLSv1.2,590,Application Data
1,3.6410620000001472,62.210.85.178,10.0.2.15,TCP,60,9001  >  35978 [ACK] Seq=5515385 Ack=98754553 Win=65535 Len=0
1,3.734106999999767,54.93.77.70,10.0.2.15,TLSv1.2,590,Application Data
1,3.734574000000066,10.0.2.15,54.93.77.70,TLSv1.2,590,Application Data
1,3.7347279999999046,54.93.77.70,10.0.2.15,TCP,60,9001  >  34692 [ACK] Seq=98573851 Ack=5512885 Win=65535 Len=0
1,3.843406999999843,62.210.85.178,10.0.2.15,TLSv1.2,590,Application Data
1,3.8491869999998016,10.0.2.15,62.210.85.178,TLSv1.2,590,Application Data
1,3.849689000000126,62.210.85.178,10.0.2.15,TCP,60,9001  >  35978 [ACK] Seq=5515921 Ack=98755089 Win=65535 Len=0
1,3.860869999999977,10.0.2.15,62.210.85.178,TLSv1.2,4124,Application Data
1,3.861011999999846,10.0.2.15,62.210.85.178,TCP,2974,35978  >  9001 [ACK] Seq=98759159 Ack=5515921 Win=65535 Len=2920 [TCP segment of a reassembled PDU]
1,3.8610720000001493,62.210.85.178,10.0.2.15,TCP,60,9001  >  35978 [ACK] Seq=5515921 Ack=98756549 Win=65535 Len=0
1,3.8610869999997703,62.210.85.178,10.0.2.15,TCP,60,9001  >  35978 [ACK] Seq=5515921 Ack=98758009 Win=65535 Len=0
1,3.8610929999999826,62.210.85.178,10.0.2.15,TCP,60,9001  >  35978 [ACK] Seq=5515921 Ack=98759159 Win=65535 Len=0
1,3.8611379999997553,10.0.2.15,62.210.85.178,TLSv1.2,1204,Application Data
1,3.861178999999993,62.210.85.178,10.0.2.15,TCP,60,9001  >  35978 [ACK] Seq=5515921 Ack=98760619 Win=65535 Len=0
1,3.8611879999998564,62.210.85.178,10.0.2.15,TCP,60,9001  >  35978 [ACK] Seq=5515921 Ack=98762079 Win=65535 Len=0
1,3.8611919999998463,62.210.85.178,10.0.2.15,TCP,60,9001  >  35978 [ACK] Seq=5515921 Ack=98763229 Win=65535 Len=0
1,3.8612410000000637,10.0.2.15,62.210.85.178,TLSv1.2,4124,Application Data
1,3.861305999999786,62.210.85.178,10.0.2.15,TCP,60,9001  >  35978 [ACK] Seq=5515921 Ack=98764689 Win=65535 Len=0
1,3.861315000000104,62.210.85.178,10.0.2.15,TCP,60,9001  >  35978 [ACK] Seq=5515921 Ack=98766149 Win=65535 Len=0
1,3.8613179999997556,62.210.85.178,10.0.2.15,TCP,60,9001  >  35978 [ACK] Seq=5515921 Ack=98767299 Win=65535 Len=0
1,3.861355999999887,10.0.2.15,62.210.85.178,TLSv1.2,4124,Application Data
1,3.8614489999999932,62.210.85.178,10.0.2.15,TCP,60,9001  >  35978 [ACK] Seq=5515921 Ack=98768759 Win=65535 Len=0
1,3.8614589999997406,62.210.85.178,10.0.2.15,TCP,60,9001  >  35978 [ACK] Seq=5515921 Ack=98770219 Win=65535 Len=0
1,3.8614619999998467,62.210.85.178,10.0.2.15,TCP,60,9001  >  35978 [ACK] Seq=5515921 Ack=98771369 Win=65535 Len=0
1,3.861497999999756,10.0.2.15,62.210.85.178,TLSv1.2,332,Application Data
1,3.8615340000001197,62.210.85.178,10.0.2.15,TCP,60,9001  >  35978 [ACK] Seq=5515921 Ack=98771647 Win=65535 Len=0
1,3.861586999999872,10.0.2.15,62.210.85.178,TLSv1.2,3868,Application Data
1,3.861649999999827,62.210.85.178,10.0.2.15,TCP,60,9001  >  35978 [ACK] Seq=5515921 Ack=98773107 Win=65535 Len=0
1,3.861659000000145,62.210.85.178,10.0.2.15,TCP,60,9001  >  35978 [ACK] Seq=5515921 Ack=98774567 Win=65535 Len=0
1,3.8616619999997965,62.210.85.178,10.0.2.15,TCP,60,9001  >  35978 [ACK] Seq=5515921 Ack=98775461 Win=65535 Len=0
1,3.861699999999928,10.0.2.15,62.210.85.178,TLSv1.2,4124,Application Data
1,3.861765000000105,62.210.85.178,10.0.2.15,TCP,60,9001  >  35978 [ACK] Seq=5515921 Ack=98776921 Win=65535 Len=0
1,3.8617739999999685,62.210.85.178,10.0.2.15,TCP,60,9001  >  35978 [ACK] Seq=5515921 Ack=98778381 Win=65535 Len=0
1,3.8617770000000746,62.210.85.178,10.0.2.15,TCP,60,9001  >  35978 [ACK] Seq=5515921 Ack=98779531 Win=65535 Len=0
1,3.8618120000001,10.0.2.15,62.210.85.178,TLSv1.2,3030,Application Data
1,3.861883999999918,62.210.85.178,10.0.2.15,TCP,60,9001  >  35978 [ACK] Seq=5515921 Ack=98780991 Win=65535 Len=0
1,3.861891000000014,62.210.85.178,10.0.2.15,TCP,60,9001  >  35978 [ACK] Seq=5515921 Ack=98782451 Win=65535 Len=0
1,3.8618940000001203,62.210.85.178,10.0.2.15,TCP,60,9001  >  35978 [ACK] Seq=5515921 Ack=98782507 Win=65535 Len=0
1,3.8715769999998884,10.0.2.15,62.210.85.178,TLSv1.2,4124,Application Data
1,3.872005000000172,62.210.85.178,10.0.2.15,TCP,60,9001  >  35978 [ACK] Seq=5515921 Ack=98783967 Win=65535 Len=0
1,3.872236000000157,62.210.85.178,10.0.2.15,TCP,60,9001  >  35978 [ACK] Seq=5515921 Ack=98785427 Win=65535 Len=0
1,3.8722429999997985,62.210.85.178,10.0.2.15,TCP,60,9001  >  35978 [ACK] Seq=5515921 Ack=98786577 Win=65535 Len=0
1,3.8723409999997784,10.0.2.15,62.210.85.178,TLSv1.2,4124,Application Data
1,3.872469999999794,10.0.2.15,62.210.85.178,TCP,2974,35978  >  9001 [ACK] Seq=98790647 Ack=5515921 Win=65535 Len=2920 [TCP segment of a reassembled PDU]
1,3.872508999999809,62.210.85.178,10.0.2.15,TCP,60,9001  >  35978 [ACK] Seq=5515921 Ack=98788037 Win=65535 Len=0
1,3.8725289999997585,62.210.85.178,10.0.2.15,TCP,60,9001  >  35978 [ACK] Seq=5515921 Ack=98789497 Win=65535 Len=0
1,3.872534000000087,62.210.85.178,10.0.2.15,TCP,60,9001  >  35978 [ACK] Seq=5515921 Ack=98790647 Win=65535 Len=0
1,3.8725369999997383,62.210.85.178,10.0.2.15,TCP,60,9001  >  35978 [ACK] Seq=5515921 Ack=98792107 Win=65535 Len=0
1,3.8725399999998444,62.210.85.178,10.0.2.15,TCP,60,9001  >  35978 [ACK] Seq=5515921 Ack=98793567 Win=65535 Len=0
1,3.8725789999998597,10.0.2.15,62.210.85.178,TLSv1.2,1204,Application Data
1,3.8726259999998547,62.210.85.178,10.0.2.15,TCP,60,9001  >  35978 [ACK] Seq=5515921 Ack=98794717 Win=65535 Len=0
1,3.8726849999998194,10.0.2.15,62.210.85.178,TLSv1.2,4124,Application Data
1,3.872769999999946,62.210.85.178,10.0.2.15,TCP,60,9001  >  35978 [ACK] Seq=5515921 Ack=98796177 Win=65535 Len=0
1,3.872781000000032,62.210.85.178,10.0.2.15,TCP,60,9001  >  35978 [ACK] Seq=5515921 Ack=98797637 Win=65535 Len=0
1,3.8727869999997893,62.210.85.178,10.0.2.15,TCP,60,9001  >  35978 [ACK] Seq=5515921 Ack=98798787 Win=65535 Len=0
1,3.8728360000000066,10.0.2.15,62.210.85.178,TLSv1.2,332,Application Data
1,3.8728759999999056,62.210.85.178,10.0.2.15,TCP,60,9001  >  35978 [ACK] Seq=5515921 Ack=98799065 Win=65535 Len=0
1,3.873001999999815,10.0.2.15,62.210.85.178,TLSv1.2,3868,Application Data
1,3.8730679999998756,62.210.85.178,10.0.2.15,TCP,60,9001  >  35978 [ACK] Seq=5515921 Ack=98800525 Win=65535 Len=0
1,3.8730759999998554,62.210.85.178,10.0.2.15,TCP,60,9001  >  35978 [ACK] Seq=5515921 Ack=98801985 Win=65535 Len=0
1,3.8730789999999615,62.210.85.178,10.0.2.15,TCP,60,9001  >  35978 [ACK] Seq=5515921 Ack=98802879 Win=65535 Len=0
1,3.8731159999997544,10.0.2.15,62.210.85.178,TLSv1.2,1938,Application Data
1,3.8732249999998203,62.210.85.178,10.0.2.15,TCP,60,9001  >  35978 [ACK] Seq=5515921 Ack=98804339 Win=65535 Len=0
1,3.8732350000000224,62.210.85.178,10.0.2.15,TCP,60,9001  >  35978 [ACK] Seq=5515921 Ack=98804763 Win=65535 Len=0
1,3.9585879999999634,54.93.77.70,10.0.2.15,TLSv1.2,590,Application Data
1,3.9764470000000074,54.93.77.70,10.0.2.15,TCP,2950,"9001  >  34692 [PSH, ACK] Seq=98574387 Ack=5512885 Win=65535 Len=2896 [TCP segment of a reassembled PDU]"
1,3.976666000000023,10.0.2.15,54.93.77.70,TCP,54,34692  >  9001 [ACK] Seq=5512885 Ack=98577283 Win=65535 Len=0
1,3.996146999999837,54.93.77.70,10.0.2.15,TLSv1.2,778,Application Data
1,4.007786000000124,54.93.77.70,10.0.2.15,TLSv1.2,11638,"Application Data, Application Data"
1,4.008154000000104,10.0.2.15,54.93.77.70,TCP,54,34692  >  9001 [ACK] Seq=5512885 Ack=98589591 Win=65535 Len=0
1,4.021204000000125,54.93.77.70,10.0.2.15,TLSv1.2,4398,Application Data [TCP segment of a reassembled PDU]
1,4.021408000000065,10.0.2.15,54.93.77.70,TCP,54,34692  >  9001 [ACK] Seq=5512885 Ack=98593935 Win=65535 Len=0
1,4.027649999999994,54.93.77.70,10.0.2.15,TLSv1.2,2950,Application Data [TCP segment of a reassembled PDU]
1,4.0277390000001105,10.0.2.15,54.93.77.70,TCP,54,34692  >  9001 [ACK] Seq=5512885 Ack=98596831 Win=65535 Len=0
1,4.028632000000016,54.93.77.70,10.0.2.15,TLSv1.2,5006,"Application Data, Application Data"
1,4.028700999999728,10.0.2.15,54.93.77.70,TCP,54,34692  >  9001 [ACK] Seq=5512885 Ack=98601783 Win=65535 Len=0
1,4.0289239999997335,10.0.2.15,54.93.77.70,TLSv1.2,590,Application Data
1,4.028997999999774,54.93.77.70,10.0.2.15,TCP,60,9001  >  34692 [ACK] Seq=98601783 Ack=5513421 Win=65535 Len=0
1,4.044613000000027,54.93.77.70,10.0.2.15,TLSv1.2,8742,"Application Data, Application Data"
1,4.04493599999978,10.0.2.15,54.93.77.70,TCP,54,34692  >  9001 [ACK] Seq=5513421 Ack=98610471 Win=65535 Len=0
1,4.0536990000000515,54.93.77.70,10.0.2.15,TLSv1.2,2950,Application Data [TCP segment of a reassembled PDU]
1,4.0538659999997435,10.0.2.15,54.93.77.70,TCP,54,34692  >  9001 [ACK] Seq=5513421 Ack=98613367 Win=65535 Len=0
1,4.059813999999733,54.93.77.70,10.0.2.15,TLSv1.2,5846,"Application Data, Application Data"
1,4.059867999999824,54.93.77.70,10.0.2.15,TLSv1.2,4934,"Application Data, Application Data"
1,4.060023000000001,10.0.2.15,54.93.77.70,TCP,54,34692  >  9001 [ACK] Seq=5513421 Ack=98624039 Win=65535 Len=0
1,4.060324999999921,10.0.2.15,54.93.77.70,TLSv1.2,590,Application Data
1,4.060488000000078,54.93.77.70,10.0.2.15,TCP,60,9001  >  34692 [ACK] Seq=98624039 Ack=5513957 Win=65535 Len=0
1,4.069067999999788,10.0.2.15,54.93.77.70,TLSv1.2,590,Application Data
1,4.0692189999999755,54.93.77.70,10.0.2.15,TCP,60,9001  >  34692 [ACK] Seq=98624039 Ack=5514493 Win=65535 Len=0
1,4.15459299999975,62.210.85.178,10.0.2.15,TLSv1.2,590,Application Data
1,4.1965580000000955,10.0.2.15,62.210.85.178,TCP,54,35978  >  9001 [ACK] Seq=98804763 Ack=5516457 Win=65535 Len=0
1,4.267992999999933,62.210.85.178,10.0.2.15,TLSv1.2,1104,Application Data
1,4.268086999999923,10.0.2.15,62.210.85.178,TCP,54,35978  >  9001 [ACK] Seq=98804763 Ack=5517507 Win=65535 Len=0
1,4.2687519999999495,10.0.2.15,62.210.85.178,TLSv1.2,590,Application Data
1,4.268893999999818,62.210.85.178,10.0.2.15,TCP,60,9001  >  35978 [ACK] Seq=5517507 Ack=98805299 Win=65535 Len=0
1,4.355399000000034,54.93.77.70,10.0.2.15,TLSv1.2,590,Application Data
1,4.355864999999994,10.0.2.15,54.93.77.70,TLSv1.2,590,Application Data
1,4.3560090000000855,54.93.77.70,10.0.2.15,TCP,60,9001  >  34692 [ACK] Seq=98624575 Ack=5515029 Win=65535 Len=0
1,4.450358999999935,62.210.85.178,10.0.2.15,TLSv1.2,590,Application Data
1,4.4553970000001755,10.0.2.15,62.210.85.178,TLSv1.2,590,Application Data
1,4.455567999999857,62.210.85.178,10.0.2.15,TCP,60,9001  >  35978 [ACK] Seq=5518043 Ack=98805835 Win=65535 Len=0
1,4.46584299999995,10.0.2.15,62.210.85.178,TLSv1.2,4124,Application Data
1,4.466016999999738,62.210.85.178,10.0.2.15,TCP,60,9001  >  35978 [ACK] Seq=5518043 Ack=98807295 Win=65535 Len=0
1,4.46603899999991,62.210.85.178,10.0.2.15,TCP,60,9001  >  35978 [ACK] Seq=5518043 Ack=98808755 Win=65535 Len=0
1,4.466043999999783,62.210.85.178,10.0.2.15,TCP,60,9001  >  35978 [ACK] Seq=5518043 Ack=98809905 Win=65535 Len=0
1,4.4661120000000665,10.0.2.15,62.210.85.178,TCP,2974,35978  >  9001 [ACK] Seq=98809905 Ack=5518043 Win=65535 Len=2920 [TCP segment of a reassembled PDU]
1,4.466179000000011,10.0.2.15,62.210.85.178,TLSv1.2,1204,Application Data
1,4.466217000000142,62.210.85.178,10.0.2.15,TCP,60,9001  >  35978 [ACK] Seq=5518043 Ack=98811365 Win=65535 Len=0
1,4.466223999999784,62.210.85.178,10.0.2.15,TCP,60,9001  >  35978 [ACK] Seq=5518043 Ack=98812825 Win=65535 Len=0
1,4.466229000000112,62.210.85.178,10.0.2.15,TCP,60,9001  >  35978 [ACK] Seq=5518043 Ack=98813975 Win=65535 Len=0
1,4.466280000000097,10.0.2.15,62.210.85.178,TLSv1.2,4124,Application Data
1,4.466378000000077,62.210.85.178,10.0.2.15,TCP,60,9001  >  35978 [ACK] Seq=5518043 Ack=98815435 Win=65535 Len=0
1,4.466386000000057,62.210.85.178,10.0.2.15,TCP,60,9001  >  35978 [ACK] Seq=5518043 Ack=98816895 Win=65535 Len=0
1,4.466390000000047,62.210.85.178,10.0.2.15,TCP,60,9001  >  35978 [ACK] Seq=5518043 Ack=98818045 Win=65535 Len=0
1,4.4664239999997335,10.0.2.15,62.210.85.178,TLSv1.2,268,Application Data
1,4.466468999999961,62.210.85.178,10.0.2.15,TCP,60,9001  >  35978 [ACK] Seq=5518043 Ack=98818259 Win=65535 Len=0
1,4.672118999999839,54.93.77.70,10.0.2.15,TLSv1.2,590,Application Data
1,4.675672999999733,54.93.77.70,10.0.2.15,TLSv1.2,7294,Application Data
1,4.675722999999834,54.93.77.70,10.0.2.15,TLSv1.2,2950,Application Data [TCP segment of a reassembled PDU]
1,4.675827000000027,10.0.2.15,54.93.77.70,TCP,54,34692  >  9001 [ACK] Seq=5515029 Ack=98635247 Win=65535 Len=0
1,4.6760089999997945,54.93.77.70,10.0.2.15,TLSv1.2,1502,Application Data [TCP segment of a reassembled PDU]
1,4.676050999999916,10.0.2.15,54.93.77.70,TCP,54,34692  >  9001 [ACK] Seq=5515029 Ack=98636695 Win=65535 Len=0
1,4.692203999999947,54.93.77.70,10.0.2.15,TLSv1.2,380,Application Data
1,4.713306000000102,10.0.2.15,54.93.77.70,TLSv1.2,590,Application Data
1,4.713492999999744,54.93.77.70,10.0.2.15,TCP,60,9001  >  34692 [ACK] Seq=98637021 Ack=5515565 Win=65535 Len=0
1,4.723109999999906,54.93.77.70,10.0.2.15,TLSv1.2,590,Application Data
1,4.723224999999729,10.0.2.15,54.93.77.70,TLSv1.2,590,Application Data
1,4.723347000000103,54.93.77.70,10.0.2.15,TCP,60,9001  >  34692 [ACK] Seq=98637557 Ack=5516101 Win=65535 Len=0
1,4.826857999999902,62.210.85.178,10.0.2.15,TLSv1.2,590,Application Data
1,4.868500999999924,10.0.2.15,62.210.85.178,TCP,54,35978  >  9001 [ACK] Seq=98818259 Ack=5518579 Win=65535 Len=0
1,4.979444000000058,62.210.85.178,10.0.2.15,TLSv1.2,590,Application Data
1,4.979526000000078,10.0.2.15,62.210.85.178,TCP,54,35978  >  9001 [ACK] Seq=98818259 Ack=5519115 Win=65535 Len=0
1,4.979824000000008,10.0.2.15,62.210.85.178,TLSv1.2,590,Application Data
1,4.979921000000104,62.210.85.178,10.0.2.15,TCP,60,9001  >  35978 [ACK] Seq=5519115 Ack=98818795 Win=65535 Len=0
1,5.087504999999965,54.93.77.70,10.0.2.15,TLSv1.2,590,Application Data
1,5.089492999999948,10.0.2.15,54.93.77.70,TLSv1.2,590,Application Data
1,5.089660000000094,54.93.77.70,10.0.2.15,TCP,60,9001  >  34692 [ACK] Seq=98638093 Ack=5516637 Win=65535 Len=0
1,5.286236999999801,62.210.85.178,10.0.2.15,TLSv1.2,590,Application Data
1,5.293592999999873,10.0.2.15,62.210.85.178,TLSv1.2,590,Application Data
1,5.293804999999793,62.210.85.178,10.0.2.15,TCP,60,9001  >  35978 [ACK] Seq=5519651 Ack=98819331 Win=65535 Len=0
1,5.30560000000014,10.0.2.15,62.210.85.178,TLSv1.2,4124,Application Data
1,5.305784000000131,62.210.85.178,10.0.2.15,TCP,60,9001  >  35978 [ACK] Seq=5519651 Ack=98820791 Win=65535 Len=0
1,5.305823000000146,62.210.85.178,10.0.2.15,TCP,60,9001  >  35978 [ACK] Seq=5519651 Ack=98822251 Win=65535 Len=0
1,5.3058280000000195,62.210.85.178,10.0.2.15,TCP,60,9001  >  35978 [ACK] Seq=5519651 Ack=98823401 Win=65535 Len=0
1,5.305872999999792,10.0.2.15,62.210.85.178,TLSv1.2,140,Application Data
1,5.305973999999878,62.210.85.178,10.0.2.15,TCP,60,9001  >  35978 [ACK] Seq=5519651 Ack=98823487 Win=65535 Len=0
1,5.394992999999886,54.93.77.70,10.0.2.15,TLSv1.2,590,Application Data
1,5.436561999999867,10.0.2.15,54.93.77.70,TCP,54,34692  >  9001 [ACK] Seq=5516637 Ack=98638629 Win=65535 Len=0
1,5.445374999999785,54.93.77.70,10.0.2.15,TCP,2950,"9001  >  34692 [PSH, ACK] Seq=98638629 Ack=5516637 Win=65535 Len=2896 [TCP segment of a reassembled PDU]"
1,5.445488999999725,10.0.2.15,54.93.77.70,TCP,54,34692  >  9001 [ACK] Seq=5516637 Ack=98641525 Win=65535 Len=0
1,5.447354999999789,54.93.77.70,10.0.2.15,TLSv1.2,778,Application Data
1,5.447416999999859,10.0.2.15,54.93.77.70,TCP,54,34692  >  9001 [ACK] Seq=5516637 Ack=98642249 Win=65535 Len=0
1,5.44834899999978,10.0.2.15,54.93.77.70,TLSv1.2,590,Application Data
1,5.448515000000043,54.93.77.70,10.0.2.15,TCP,60,9001  >  34692 [ACK] Seq=98642249 Ack=5517173 Win=65535 Len=0
1,5.458892000000105,10.0.2.15,54.93.77.70,TLSv1.2,590,Application Data
1,5.459018999999898,54.93.77.70,10.0.2.15,TCP,60,9001  >  34692 [ACK] Seq=98642249 Ack=5517709 Win=65535 Len=0
1,5.464288000000124,54.93.77.70,10.0.2.15,TLSv1.2,590,Application Data
1,5.505579000000125,10.0.2.15,54.93.77.70,TCP,54,34692  >  9001 [ACK] Seq=5517709 Ack=98642785 Win=65535 Len=0
1,5.550377000000026,62.210.85.178,10.0.2.15,TLSv1.2,590,Application Data
1,5.593014999999923,10.0.2.15,62.210.85.178,TCP,54,35978  >  9001 [ACK] Seq=98823487 Ack=5520187 Win=65535 Len=0
1,5.658762999999908,62.210.85.178,10.0.2.15,TLSv1.2,590,Application Data
1,5.659237999999732,10.0.2.15,62.210.85.178,TCP,54,35978  >  9001 [ACK] Seq=98823487 Ack=5520723 Win=65535 Len=0
1,5.661188999999922,10.0.2.15,62.210.85.178,TLSv1.2,590,Application Data
1,5.661360000000059,62.210.85.178,10.0.2.15,TCP,60,9001  >  35978 [ACK] Seq=5520723 Ack=98824023 Win=65535 Len=0
1,5.763723999999911,54.93.77.70,10.0.2.15,TLSv1.2,590,Application Data
1,5.763806999999815,10.0.2.15,54.93.77.70,TCP,54,34692  >  9001 [ACK] Seq=5517709 Ack=98643321 Win=65535 Len=0
1,5.764184000000114,10.0.2.15,54.93.77.70,TLSv1.2,590,Application Data
1,5.764282999999978,54.93.77.70,10.0.2.15,TCP,60,9001  >  34692 [ACK] Seq=98643321 Ack=5518245 Win=65535 Len=0
1,5.881124999999884,62.210.85.178,10.0.2.15,TLSv1.2,590,Application Data
1,5.892119999999977,10.0.2.15,62.210.85.178,TLSv1.2,590,Application Data
1,5.892271000000164,62.210.85.178,10.0.2.15,TCP,60,9001  >  35978 [ACK] Seq=5521259 Ack=98824559 Win=65535 Len=0
1,5.904903000000104,10.0.2.15,62.210.85.178,TLSv1.2,4124,Application Data
1,5.905044999999973,10.0.2.15,62.210.85.178,TCP,2974,35978  >  9001 [ACK] Seq=98828629 Ack=5521259 Win=65535 Len=2920 [TCP segment of a reassembled PDU]
1,5.905091000000084,62.210.85.178,10.0.2.15,TCP,60,9001  >  35978 [ACK] Seq=5521259 Ack=98826019 Win=65535 Len=0
1,5.905103000000054,62.210.85.178,10.0.2.15,TCP,60,9001  >  35978 [ACK] Seq=5521259 Ack=98827479 Win=65535 Len=0
1,5.905107999999927,62.210.85.178,10.0.2.15,TCP,60,9001  >  35978 [ACK] Seq=5521259 Ack=98828629 Win=65535 Len=0
1,5.905112999999801,62.210.85.178,10.0.2.15,TCP,60,9001  >  35978 [ACK] Seq=5521259 Ack=98830089 Win=65535 Len=0
1,5.9051180000001295,62.210.85.178,10.0.2.15,TCP,60,9001  >  35978 [ACK] Seq=5521259 Ack=98831549 Win=65535 Len=0
1,5.905163999999786,10.0.2.15,62.210.85.178,TLSv1.2,1204,Application Data
1,5.905233999999837,10.0.2.15,62.210.85.178,TCP,2974,35978  >  9001 [ACK] Seq=98832699 Ack=5521259 Win=65535 Len=2920 [TCP segment of a reassembled PDU]
1,5.905275000000074,62.210.85.178,10.0.2.15,TCP,60,9001  >  35978 [ACK] Seq=5521259 Ack=98832699 Win=65535 Len=0
1,5.905310999999983,10.0.2.15,62.210.85.178,TLSv1.2,1204,Application Data
1,5.905359999999746,62.210.85.178,10.0.2.15,TCP,60,9001  >  35978 [ACK] Seq=5521259 Ack=98834159 Win=65535 Len=0
1,5.905366999999842,62.210.85.178,10.0.2.15,TCP,60,9001  >  35978 [ACK] Seq=5521259 Ack=98835619 Win=65535 Len=0
1,5.90537200000017,62.210.85.178,10.0.2.15,TCP,60,9001  >  35978 [ACK] Seq=5521259 Ack=98836769 Win=65535 Len=0
1,5.905428000000029,10.0.2.15,62.210.85.178,TLSv1.2,4124,Application Data
1,5.905525000000125,62.210.85.178,10.0.2.15,TCP,60,9001  >  35978 [ACK] Seq=5521259 Ack=98838229 Win=65535 Len=0
1,5.905533000000105,62.210.85.178,10.0.2.15,TCP,60,9001  >  35978 [ACK] Seq=5521259 Ack=98839689 Win=65535 Len=0
1,5.905537999999979,62.210.85.178,10.0.2.15,TCP,60,9001  >  35978 [ACK] Seq=5521259 Ack=98840839 Win=65535 Len=0
1,5.905573000000004,10.0.2.15,62.210.85.178,TLSv1.2,332,Application Data
1,5.905633999999736,10.0.2.15,62.210.85.178,TCP,2974,35978  >  9001 [ACK] Seq=98841117 Ack=5521259 Win=65535 Len=2920 [TCP segment of a reassembled PDU]
1,5.9056700000001,62.210.85.178,10.0.2.15,TCP,60,9001  >  35978 [ACK] Seq=5521259 Ack=98841117 Win=65535 Len=0
1,5.905675999999858,62.210.85.178,10.0.2.15,TCP,60,9001  >  35978 [ACK] Seq=5521259 Ack=98842577 Win=65535 Len=0
1,5.905680999999731,62.210.85.178,10.0.2.15,TCP,60,9001  >  35978 [ACK] Seq=5521259 Ack=98844037 Win=65535 Len=0
1,5.905713999999989,10.0.2.15,62.210.85.178,TLSv1.2,948,Application Data
1,5.905750999999782,62.210.85.178,10.0.2.15,TCP,60,9001  >  35978 [ACK] Seq=5521259 Ack=98844931 Win=65535 Len=0
1,5.905799999999999,10.0.2.15,62.210.85.178,TLSv1.2,4124,Application Data
1,5.905840999999782,62.210.85.178,10.0.2.15,TCP,60,9001  >  35978 [ACK] Seq=5521259 Ack=98846391 Win=65535 Len=0
1,5.905847999999878,62.210.85.178,10.0.2.15,TCP,60,9001  >  35978 [ACK] Seq=5521259 Ack=98847851 Win=65535 Len=0
1,5.905851999999868,62.210.85.178,10.0.2.15,TCP,60,9001  >  35978 [ACK] Seq=5521259 Ack=98849001 Win=65535 Len=0
1,5.905897999999979,10.0.2.15,62.210.85.178,TLSv1.2,3030,Application Data
1,5.9059400000001006,62.210.85.178,10.0.2.15,TCP,60,9001  >  35978 [ACK] Seq=5521259 Ack=98850461 Win=65535 Len=0
1,5.905945999999858,62.210.85.178,10.0.2.15,TCP,60,9001  >  35978 [ACK] Seq=5521259 Ack=98851921 Win=65535 Len=0
1,5.905950999999732,62.210.85.178,10.0.2.15,TCP,60,9001  >  35978 [ACK] Seq=5521259 Ack=98851977 Win=65535 Len=0
1,5.915204999999787,10.0.2.15,62.210.85.178,TLSv1.2,4124,Application Data
1,5.915302999999767,10.0.2.15,62.210.85.178,TCP,2974,35978  >  9001 [ACK] Seq=98856047 Ack=5521259 Win=65535 Len=2920 [TCP segment of a reassembled PDU]
1,5.9153479999999945,62.210.85.178,10.0.2.15,TCP,60,9001  >  35978 [ACK] Seq=5521259 Ack=98853437 Win=65535 Len=0
1,5.915356999999858,62.210.85.178,10.0.2.15,TCP,60,9001  >  35978 [ACK] Seq=5521259 Ack=98854897 Win=65535 Len=0
1,5.915361999999732,62.210.85.178,10.0.2.15,TCP,60,9001  >  35978 [ACK] Seq=5521259 Ack=98856047 Win=65535 Len=0
1,5.9154020000000855,10.0.2.15,62.210.85.178,TLSv1.2,1204,Application Data
1,5.915439999999762,62.210.85.178,10.0.2.15,TCP,60,9001  >  35978 [ACK] Seq=5521259 Ack=98857507 Win=65535 Len=0
1,5.9154459999999744,62.210.85.178,10.0.2.15,TCP,60,9001  >  35978 [ACK] Seq=5521259 Ack=98858967 Win=65535 Len=0
1,5.915450999999848,62.210.85.178,10.0.2.15,TCP,60,9001  >  35978 [ACK] Seq=5521259 Ack=98860117 Win=65535 Len=0
1,5.915504999999939,10.0.2.15,62.210.85.178,TLSv1.2,4124,Application Data
1,5.915570000000116,10.0.2.15,62.210.85.178,TCP,2974,35978  >  9001 [ACK] Seq=98864187 Ack=5521259 Win=65535 Len=2920 [TCP segment of a reassembled PDU]
1,5.915606000000025,62.210.85.178,10.0.2.15,TCP,60,9001  >  35978 [ACK] Seq=5521259 Ack=98861577 Win=65535 Len=0
1,5.915613000000121,62.210.85.178,10.0.2.15,TCP,60,9001  >  35978 [ACK] Seq=5521259 Ack=98863037 Win=65535 Len=0
1,5.915617000000111,62.210.85.178,10.0.2.15,TCP,60,9001  >  35978 [ACK] Seq=5521259 Ack=98864187 Win=65535 Len=0
1,5.915621999999985,62.210.85.178,10.0.2.15,TCP,60,9001  >  35978 [ACK] Seq=5521259 Ack=98865647 Win=65535 Len=0
1,5.915625999999975,62.210.85.178,10.0.2.15,TCP,60,9001  >  35978 [ACK] Seq=5521259 Ack=98867107 Win=65535 Len=0
1,5.915664000000106,10.0.2.15,62.210.85.178,TLSv1.2,1204,Application Data
1,5.915752999999768,62.210.85.178,10.0.2.15,TCP,60,9001  >  35978 [ACK] Seq=5521259 Ack=98868257 Win=65535 Len=0
1,5.915790000000015,10.0.2.15,62.210.85.178,TLSv1.2,332,Application Data
1,5.915848000000096,10.0.2.15,62.210.85.178,TCP,2974,35978  >  9001 [ACK] Seq=98868535 Ack=5521259 Win=65535 Len=2920 [TCP segment of a reassembled PDU]
1,5.9158840000000055,62.210.85.178,10.0.2.15,TCP,60,9001  >  35978 [ACK] Seq=5521259 Ack=98868535 Win=65535 Len=0
1,5.915889999999763,62.210.85.178,10.0.2.15,TCP,60,9001  >  35978 [ACK] Seq=5521259 Ack=98869995 Win=65535 Len=0
1,5.915893999999753,62.210.85.178,10.0.2.15,TCP,60,9001  >  35978 [ACK] Seq=5521259 Ack=98871455 Win=65535 Len=0
1,5.915926000000127,10.0.2.15,62.210.85.178,TLSv1.2,948,Application Data
1,5.915962000000036,62.210.85.178,10.0.2.15,TCP,60,9001  >  35978 [ACK] Seq=5521259 Ack=98872349 Win=65535 Len=0
1,5.916006999999809,10.0.2.15,62.210.85.178,TLSv1.2,4124,Application Data
1,5.916069999999763,10.0.2.15,62.210.85.178,TCP,2974,35978  >  9001 [ACK] Seq=98876419 Ack=5521259 Win=65535 Len=2920 [TCP segment of a reassembled PDU]
1,5.916104999999789,62.210.85.178,10.0.2.15,TCP,60,9001  >  35978 [ACK] Seq=5521259 Ack=98873809 Win=65535 Len=0
1,5.916111999999885,62.210.85.178,10.0.2.15,TCP,60,9001  >  35978 [ACK] Seq=5521259 Ack=98875269 Win=65535 Len=0
1,5.9161159999998745,62.210.85.178,10.0.2.15,TCP,60,9001  >  35978 [ACK] Seq=5521259 Ack=98876419 Win=65535 Len=0
1,5.916119999999864,62.210.85.178,10.0.2.15,TCP,60,9001  >  35978 [ACK] Seq=5521259 Ack=98877879 Win=65535 Len=0
1,5.916123999999854,62.210.85.178,10.0.2.15,TCP,60,9001  >  35978 [ACK] Seq=5521259 Ack=98879339 Win=65535 Len=0
1,5.916161999999986,10.0.2.15,62.210.85.178,TLSv1.2,110,Application Data
1,5.916251000000102,62.210.85.178,10.0.2.15,TCP,60,9001  >  35978 [ACK] Seq=5521259 Ack=98879395 Win=65535 Len=0
1,5.928719000000001,10.0.2.15,62.210.85.178,TLSv1.2,4124,Application Data
1,5.928841999999804,10.0.2.15,62.210.85.178,TCP,2974,35978  >  9001 [ACK] Seq=98883465 Ack=5521259 Win=65535 Len=2920 [TCP segment of a reassembled PDU]
1,5.9288870000000315,62.210.85.178,10.0.2.15,TCP,60,9001  >  35978 [ACK] Seq=5521259 Ack=98880855 Win=65535 Len=0
1,5.9288980000001175,62.210.85.178,10.0.2.15,TCP,60,9001  >  35978 [ACK] Seq=5521259 Ack=98882315 Win=65535 Len=0
1,5.928902999999991,62.210.85.178,10.0.2.15,TCP,60,9001  >  35978 [ACK] Seq=5521259 Ack=98883465 Win=65535 Len=0
1,5.928977000000032,10.0.2.15,62.210.85.178,TLSv1.2,1204,Application Data
1,5.929002999999739,62.210.85.178,10.0.2.15,TCP,60,9001  >  35978 [ACK] Seq=5521259 Ack=98884925 Win=65535 Len=0
1,5.929008999999951,62.210.85.178,10.0.2.15,TCP,60,9001  >  35978 [ACK] Seq=5521259 Ack=98886385 Win=65535 Len=0
1,5.929059999999936,10.0.2.15,62.210.85.178,TCP,2974,35978  >  9001 [ACK] Seq=98887535 Ack=5521259 Win=65535 Len=2920 [TCP segment of a reassembled PDU]
1,5.929098999999951,62.210.85.178,10.0.2.15,TCP,60,9001  >  35978 [ACK] Seq=5521259 Ack=98887535 Win=65535 Len=0
1,5.929106000000047,62.210.85.178,10.0.2.15,TCP,60,9001  >  35978 [ACK] Seq=5521259 Ack=98888995 Win=65535 Len=0
1,5.929110000000037,62.210.85.178,10.0.2.15,TCP,60,9001  >  35978 [ACK] Seq=5521259 Ack=98890455 Win=65535 Len=0
1,5.929145000000062,10.0.2.15,62.210.85.178,TLSv1.2,1204,Application Data
1,5.929231999999956,62.210.85.178,10.0.2.15,TCP,60,9001  >  35978 [ACK] Seq=5521259 Ack=98891605 Win=65535 Len=0
1,5.929301000000123,10.0.2.15,62.210.85.178,TLSv1.2,4124,Application Data
1,5.929411000000073,62.210.85.178,10.0.2.15,TCP,60,9001  >  35978 [ACK] Seq=5521259 Ack=98893065 Win=65535 Len=0
1,5.929419000000053,62.210.85.178,10.0.2.15,TCP,60,9001  >  35978 [ACK] Seq=5521259 Ack=98894525 Win=65535 Len=0
1,5.929423999999926,62.210.85.178,10.0.2.15,TCP,60,9001  >  35978 [ACK] Seq=5521259 Ack=98895675 Win=65535 Len=0
1,5.929458999999952,10.0.2.15,62.210.85.178,TLSv1.2,332,Application Data
1,5.929497000000083,62.210.85.178,10.0.2.15,TCP,60,9001  >  35978 [ACK] Seq=5521259 Ack=98895953 Win=65535 Len=0
1,5.929552000000058,10.0.2.15,62.210.85.178,TLSv1.2,3868,Application Data
1,5.929592999999841,62.210.85.178,10.0.2.15,TCP,60,9001  >  35978 [ACK] Seq=5521259 Ack=98897413 Win=65535 Len=0
1,5.929599999999937,62.210.85.178,10.0.2.15,TCP,60,9001  >  35978 [ACK] Seq=5521259 Ack=98898873 Win=65535 Len=0
1,5.92960499999981,62.210.85.178,10.0.2.15,TCP,60,9001  >  35978 [ACK] Seq=5521259 Ack=98899767 Win=65535 Len=0
1,5.929651999999805,10.0.2.15,62.210.85.178,TLSv1.2,4124,Application Data
1,5.9296989999998,62.210.85.178,10.0.2.15,TCP,60,9001  >  35978 [ACK] Seq=5521259 Ack=98901227 Win=65535 Len=0
1,5.9297059999998964,62.210.85.178,10.0.2.15,TCP,60,9001  >  35978 [ACK] Seq=5521259 Ack=98902687 Win=65535 Len=0
1,5.92971099999977,62.210.85.178,10.0.2.15,TCP,60,9001  >  35978 [ACK] Seq=5521259 Ack=98903837 Win=65535 Len=0
1,5.9297529999998915,10.0.2.15,62.210.85.178,TLSv1.2,974,Application Data
1,5.9297929999997905,62.210.85.178,10.0.2.15,TCP,60,9001  >  35978 [ACK] Seq=5521259 Ack=98904757 Win=65535 Len=0
1,6.005881000000045,54.93.77.70,10.0.2.15,TLSv1.2,3674,Application Data
1,6.006323000000066,10.0.2.15,54.93.77.70,TCP,54,34692  >  9001 [ACK] Seq=5518245 Ack=98646941 Win=65535 Len=0
1,6.023631999999907,54.93.77.70,10.0.2.15,TLSv1.2,590,Application Data
1,6.0268559999999525,54.93.77.70,10.0.2.15,TCP,2950,"9001  >  34692 [PSH, ACK] Seq=98647477 Ack=5518245 Win=65535 Len=2896 [TCP segment of a reassembled PDU]"
1,6.026945000000069,10.0.2.15,54.93.77.70,TCP,54,34692  >  9001 [ACK] Seq=5518245 Ack=98650373 Win=65535 Len=0
1,6.040227999999843,54.93.77.70,10.0.2.15,TLSv1.2,1314,"Application Data, Application Data"
1,6.045281000000159,54.93.77.70,10.0.2.15,TLSv1.2,7294,Application Data
1,6.0453959999999825,10.0.2.15,54.93.77.70,TCP,54,34692  >  9001 [ACK] Seq=5518245 Ack=98658873 Win=65535 Len=0
1,6.0565959999998995,54.93.77.70,10.0.2.15,TLSv1.2,568,Application Data
1,6.057726999999886,54.93.77.70,10.0.2.15,TCP,2950,"9001  >  34692 [PSH, ACK] Seq=98659387 Ack=5518245 Win=65535 Len=2896 [TCP segment of a reassembled PDU]"
1,6.057788000000073,10.0.2.15,54.93.77.70,TCP,54,34692  >  9001 [ACK] Seq=5518245 Ack=98662283 Win=65535 Len=0
1,6.070796999999857,54.93.77.70,10.0.2.15,TLSv1.2,2950,Application Data [TCP segment of a reassembled PDU]
1,6.070901999999933,10.0.2.15,54.93.77.70,TCP,54,34692  >  9001 [ACK] Seq=5518245 Ack=98665179 Win=65535 Len=0
1,6.072781999999734,54.93.77.70,10.0.2.15,TLSv1.2,5846,Application Data [TCP segment of a reassembled PDU]
1,6.0728579999999965,10.0.2.15,54.93.77.70,TCP,54,34692  >  9001 [ACK] Seq=5518245 Ack=98670971 Win=65535 Len=0
1,6.073685999999725,54.93.77.70,10.0.2.15,TLSv1.2,380,"Application Data, Application Data"
1,6.07387000000017,10.0.2.15,54.93.77.70,TLSv1.2,590,Application Data
1,6.073992000000089,54.93.77.70,10.0.2.15,TCP,60,9001  >  34692 [ACK] Seq=98671297 Ack=5518781 Win=65535 Len=0
1,6.078204999999798,54.93.77.70,10.0.2.15,TCP,2950,"9001  >  34692 [PSH, ACK] Seq=98671297 Ack=5518781 Win=65535 Len=2896 [TCP segment of a reassembled PDU]"
1,6.078285999999935,10.0.2.15,54.93.77.70,TCP,54,34692  >  9001 [ACK] Seq=5518781 Ack=98674193 Win=65535 Len=0
1,6.07926899999984,54.93.77.70,10.0.2.15,TLSv1.2,4398,"Application Data, Application Data"
1,6.079334999999901,10.0.2.15,54.93.77.70,TCP,54,34692  >  9001 [ACK] Seq=5518781 Ack=98678537 Win=65535 Len=0
1,6.0878999999999905,10.0.2.15,54.93.77.70,TLSv1.2,590,Application Data
1,6.088083000000097,54.93.77.70,10.0.2.15,TCP,60,9001  >  34692 [ACK] Seq=98678537 Ack=5519317 Win=65535 Len=0
1,6.101489000000129,54.93.77.70,10.0.2.15,TCP,2950,"9001  >  34692 [PSH, ACK] Seq=98678537 Ack=5519317 Win=65535 Len=2896 [TCP segment of a reassembled PDU]"
1,6.101575000000139,10.0.2.15,54.93.77.70,TCP,54,34692  >  9001 [ACK] Seq=5519317 Ack=98681433 Win=65535 Len=0
1,6.102049999999963,54.93.77.70,10.0.2.15,TLSv1.2,1828,"Application Data, Application Data"
1,6.1020730000000185,54.93.77.70,10.0.2.15,TCP,2950,"9001  >  34692 [PSH, ACK] Seq=98683207 Ack=5519317 Win=65535 Len=2896 [TCP segment of a reassembled PDU]"
1,6.102128999999877,10.0.2.15,54.93.77.70,TCP,54,34692  >  9001 [ACK] Seq=5519317 Ack=98683207 Win=65535 Len=0
1,6.102219999999761,10.0.2.15,54.93.77.70,TCP,54,34692  >  9001 [ACK] Seq=5519317 Ack=98686103 Win=65535 Len=0
1,6.11082899999974,54.93.77.70,10.0.2.15,TLSv1.2,5846,"Application Data, Application Data"
1,6.110905999999886,10.0.2.15,54.93.77.70,TCP,54,34692  >  9001 [ACK] Seq=5519317 Ack=98691895 Win=65535 Len=0
1,6.118609000000106,54.93.77.70,10.0.2.15,TLSv1.2,170,Application Data
1,6.128491999999824,54.93.77.70,10.0.2.15,TCP,2950,"9001  >  34692 [PSH, ACK] Seq=98692011 Ack=5519317 Win=65535 Len=2896 [TCP segment of a reassembled PDU]"
1,6.128601999999773,10.0.2.15,54.93.77.70,TCP,54,34692  >  9001 [ACK] Seq=5519317 Ack=98694907 Win=65535 Len=0
1,6.143414000000121,54.93.77.70,10.0.2.15,TLSv1.2,4398,"Application Data, Application Data"
1,6.143549999999777,10.0.2.15,54.93.77.70,TCP,54,34692  >  9001 [ACK] Seq=5519317 Ack=98699251 Win=65535 Len=0
1,6.143775999999889,10.0.2.15,54.93.77.70,TLSv1.2,590,Application Data
1,6.1438859999998385,54.93.77.70,10.0.2.15,TCP,60,9001  >  34692 [ACK] Seq=98699251 Ack=5519853 Win=65535 Len=0
1,6.19195899999977,54.93.77.70,10.0.2.15,TLSv1.2,3160,Application Data
1,6.1920649999997295,10.0.2.15,54.93.77.70,TCP,54,34692  >  9001 [ACK] Seq=5519853 Ack=98702357 Win=65535 Len=0
1,6.202913999999964,54.93.77.70,10.0.2.15,TCP,2950,"9001  >  34692 [PSH, ACK] Seq=98702357 Ack=5519853 Win=65535 Len=2896 [TCP segment of a reassembled PDU]"
1,6.202968999999939,54.93.77.70,10.0.2.15,TLSv1.2,7294,"Application Data, Application Data"
1,6.203024999999798,10.0.2.15,54.93.77.70,TCP,54,34692  >  9001 [ACK] Seq=5519853 Ack=98705253 Win=65535 Len=0
1,6.2031379999998535,10.0.2.15,54.93.77.70,TCP,54,34692  >  9001 [ACK] Seq=5519853 Ack=98712493 Win=65535 Len=0
1,6.209463000000142,54.93.77.70,10.0.2.15,TLSv1.2,1292,Application Data
1,6.211011999999755,62.210.85.178,10.0.2.15,TLSv1.2,590,Application Data
1,6.22251099999994,54.93.77.70,10.0.2.15,TCP,2950,"9001  >  34692 [PSH, ACK] Seq=98713731 Ack=5519853 Win=65535 Len=2896 [TCP segment of a reassembled PDU]"
1,6.222639000000072,10.0.2.15,54.93.77.70,TCP,54,34692  >  9001 [ACK] Seq=5519853 Ack=98716627 Win=65535 Len=0
1,6.222702000000027,54.93.77.70,10.0.2.15,TLSv1.2,4398,Application Data [TCP segment of a reassembled PDU]
1,6.222788000000037,10.0.2.15,54.93.77.70,TCP,54,34692  >  9001 [ACK] Seq=5519853 Ack=98720971 Win=65535 Len=0
1,6.234214999999949,54.93.77.70,10.0.2.15,TLSv1.2,1502,Application Data [TCP segment of a reassembled PDU]
1,6.234277999999904,10.0.2.15,54.93.77.70,TCP,54,34692  >  9001 [ACK] Seq=5519853 Ack=98722419 Win=65535 Len=0
1,6.234517999999753,10.0.2.15,54.93.77.70,TLSv1.2,590,Application Data
1,6.234609000000091,54.93.77.70,10.0.2.15,TCP,60,9001  >  34692 [ACK] Seq=98722419 Ack=5520389 Win=65535 Len=0
1,6.241571000000022,54.93.77.70,10.0.2.15,TLSv1.2,684,Application Data
1,6.250152999999955,62.210.85.178,10.0.2.15,TLSv1.2,590,Application Data
1,6.2502049999998235,10.0.2.15,62.210.85.178,TCP,54,35978  >  9001 [ACK] Seq=98904757 Ack=5522331 Win=65535 Len=0
1,6.2715079999998125,62.210.85.178,10.0.2.15,TLSv1.2,590,Application Data
1,6.284460999999737,10.0.2.15,54.93.77.70,TCP,54,34692  >  9001 [ACK] Seq=5520389 Ack=98723049 Win=65535 Len=0
1,6.299642999999833,54.93.77.70,10.0.2.15,TLSv1.2,1104,Application Data
1,6.2997519999998985,10.0.2.15,54.93.77.70,TCP,54,34692  >  9001 [ACK] Seq=5520389 Ack=98724099 Win=65535 Len=0
1,6.302103999999872,10.0.2.15,54.93.77.70,TLSv1.2,590,Application Data
1,6.302245999999741,54.93.77.70,10.0.2.15,TCP,60,9001  >  34692 [ACK] Seq=98724099 Ack=5520925 Win=65535 Len=0
1,6.3124589999997625,10.0.2.15,62.210.85.178,TCP,54,35978  >  9001 [ACK] Seq=98904757 Ack=5522867 Win=65535 Len=0
1,6.3452330000000075,62.210.85.178,10.0.2.15,TLSv1.2,590,Application Data
1,6.345299999999952,10.0.2.15,62.210.85.178,TCP,54,35978  >  9001 [ACK] Seq=98904757 Ack=5523403 Win=65535 Len=0
1,6.412535999999818,62.210.85.178,10.0.2.15,TLSv1.2,590,Application Data
1,6.412624000000051,10.0.2.15,62.210.85.178,TCP,54,35978  >  9001 [ACK] Seq=98904757 Ack=5523939 Win=65535 Len=0
1,6.41322799999989,10.0.2.15,62.210.85.178,TLSv1.2,590,Application Data
1,6.4133600000000115,62.210.85.178,10.0.2.15,TCP,60,9001  >  35978 [ACK] Seq=5523939 Ack=98905293 Win=65535 Len=0
1,6.502430999999888,54.93.77.70,10.0.2.15,TLSv1.2,590,Application Data
1,6.503056999999899,10.0.2.15,54.93.77.70,TLSv1.2,590,Application Data
1,6.503196000000116,54.93.77.70,10.0.2.15,TCP,60,9001  >  34692 [ACK] Seq=98724635 Ack=5521461 Win=65535 Len=0
1,6.639087000000018,62.210.85.178,10.0.2.15,TLSv1.2,590,Application Data
1,6.645473000000038,10.0.2.15,62.210.85.178,TLSv1.2,590,Application Data
1,6.645909999999731,62.210.85.178,10.0.2.15,TCP,60,9001  >  35978 [ACK] Seq=5524475 Ack=98905829 Win=65535 Len=0
1,6.657249999999749,10.0.2.15,62.210.85.178,TLSv1.2,2132,Application Data
1,6.657427999999982,62.210.85.178,10.0.2.15,TCP,60,9001  >  35978 [ACK] Seq=5524475 Ack=98907289 Win=65535 Len=0
1,6.6574500000001535,62.210.85.178,10.0.2.15,TCP,60,9001  >  35978 [ACK] Seq=5524475 Ack=98907907 Win=65535 Len=0
1,6.748215000000073,54.93.77.70,10.0.2.15,TLSv1.2,590,Application Data
1,6.748496000000159,10.0.2.15,54.93.77.70,TLSv1.2,590,Application Data
1,6.748584999999821,54.93.77.70,10.0.2.15,TCP,60,9001  >  34692 [ACK] Seq=98725171 Ack=5521997 Win=65535 Len=0
1,6.815872000000127,54.93.77.70,10.0.2.15,TLSv1.2,2132,Application Data
1,6.816033999999945,10.0.2.15,54.93.77.70,TCP,54,34692  >  9001 [ACK] Seq=5521997 Ack=98727249 Win=65535 Len=0
