No.,Time,Source,Destination,Protocol,Length,Info
1,0.01869299999998475,10.0.2.15,54.93.77.70,TCP,54,34692  >  9001 [ACK] Seq=6502969 Ack=116794205 Win=65535 Len=0
1,0.020623999999770604,62.210.85.178,10.0.2.15,TLSv1.2,1104,Application Data
1,0.06900599999971746,10.0.2.15,62.210.85.178,TCP,54,35978  >  9001 [ACK] Seq=116968985 Ack=6497529 Win=65535 Len=0
1,0.0795509999998103,62.210.85.178,10.0.2.15,TLSv1.2,590,Application Data
1,0.07964099999981045,10.0.2.15,62.210.85.178,TCP,54,35978  >  9001 [ACK] Seq=116968985 Ack=6498065 Win=65535 Len=0
1,0.24509199999965858,10.0.2.15,54.93.77.70,TLSv1.2,590,Application Data
1,0.24527600000010352,54.93.77.70,10.0.2.15,TCP,60,9001  >  34692 [ACK] Seq=116794205 Ack=6503505 Win=65535 Len=0
1,0.369228000000021,62.210.85.178,10.0.2.15,TLSv1.2,590,Application Data
1,0.3693239999997786,10.0.2.15,62.210.85.178,TCP,54,35978  >  9001 [ACK] Seq=116968985 Ack=6498601 Win=65535 Len=0
1,0.3696860000000015,10.0.2.15,62.210.85.178,TLSv1.2,590,Application Data
1,0.3698070000000371,62.210.85.178,10.0.2.15,TCP,60,9001  >  35978 [ACK] Seq=6498601 Ack=116969521 Win=65535 Len=0
1,0.48331299999972543,54.93.77.70,10.0.2.15,TLSv1.2,590,Application Data
1,0.4836119999999937,10.0.2.15,54.93.77.70,TCP,54,34692  >  9001 [ACK] Seq=6503505 Ack=116794741 Win=65535 Len=0
1,0.484653999999864,10.0.2.15,54.93.77.70,TLSv1.2,1618,Application Data
1,0.485157000000072,54.93.77.70,10.0.2.15,TCP,60,9001  >  34692 [ACK] Seq=116794741 Ack=6504965 Win=65535 Len=0
1,0.48521200000004683,54.93.77.70,10.0.2.15,TCP,60,9001  >  34692 [ACK] Seq=116794741 Ack=6505069 Win=65535 Len=0
1,0.6446229999996831,62.210.85.178,10.0.2.15,TLSv1.2,1618,Application Data
1,0.6447909999997137,10.0.2.15,62.210.85.178,TCP,54,35978  >  9001 [ACK] Seq=116969521 Ack=6500165 Win=65535 Len=0
1,0.6596529999997074,10.0.2.15,62.210.85.178,TLSv1.2,590,Application Data
1,0.6603849999996783,62.210.85.178,10.0.2.15,TCP,60,9001  >  35978 [ACK] Seq=6500165 Ack=116970057 Win=65535 Len=0
1,0.6711019999997916,10.0.2.15,62.210.85.178,TLSv1.2,1618,Application Data
1,0.6713259999996808,62.210.85.178,10.0.2.15,TCP,60,9001  >  35978 [ACK] Seq=6500165 Ack=116971517 Win=65535 Len=0
1,0.6713559999998324,62.210.85.178,10.0.2.15,TCP,60,9001  >  35978 [ACK] Seq=6500165 Ack=116971621 Win=65535 Len=0
1,0.7589599999996608,54.93.77.70,10.0.2.15,TLSv1.2,590,Application Data
1,0.8025479999996605,10.0.2.15,54.93.77.70,TCP,54,34692  >  9001 [ACK] Seq=6505069 Ack=116795277 Win=65535 Len=0
1,0.8277020000000448,54.93.77.70,10.0.2.15,TLSv1.2,1618,Application Data
1,0.8277849999999489,10.0.2.15,54.93.77.70,TCP,54,34692  >  9001 [ACK] Seq=6505069 Ack=116796841 Win=65535 Len=0
1,0.8298479999998563,10.0.2.15,54.93.77.70,TLSv1.2,590,Application Data
1,0.8300039999999171,54.93.77.70,10.0.2.15,TCP,60,9001  >  34692 [ACK] Seq=116796841 Ack=6505605 Win=65535 Len=0
1,0.9447449999997843,62.210.85.178,10.0.2.15,TLSv1.2,590,Application Data
1,0.9450649999998859,10.0.2.15,62.210.85.178,TLSv1.2,590,Application Data
1,0.9451529999996637,62.210.85.178,10.0.2.15,TCP,60,9001  >  35978 [ACK] Seq=6500701 Ack=116972157 Win=65535 Len=0
1,1.055438999999751,54.93.77.70,10.0.2.15,TLSv1.2,590,Application Data
1,1.0558609999998225,10.0.2.15,54.93.77.70,TLSv1.2,590,Application Data
1,1.0559579999999187,54.93.77.70,10.0.2.15,TCP,60,9001  >  34692 [ACK] Seq=116797377 Ack=6506141 Win=65535 Len=0
1,1.1637539999996989,62.210.85.178,10.0.2.15,TLSv1.2,590,Application Data
1,1.1731989999998405,10.0.2.15,62.210.85.178,TLSv1.2,590,Application Data
1,1.1733399999998255,62.210.85.178,10.0.2.15,TCP,60,9001  >  35978 [ACK] Seq=6501237 Ack=116972693 Win=65535 Len=0
1,1.183552999999847,10.0.2.15,62.210.85.178,TLSv1.2,4124,Application Data
1,1.1836589999998068,10.0.2.15,62.210.85.178,TCP,2974,35978  >  9001 [ACK] Seq=116976763 Ack=6501237 Win=65535 Len=2920 [TCP segment of a reassembled PDU]
1,1.1837069999996856,62.210.85.178,10.0.2.15,TCP,60,9001  >  35978 [ACK] Seq=6501237 Ack=116974153 Win=65535 Len=0
1,1.1837189999996554,62.210.85.178,10.0.2.15,TCP,60,9001  >  35978 [ACK] Seq=6501237 Ack=116975613 Win=65535 Len=0
1,1.1837249999998676,62.210.85.178,10.0.2.15,TCP,60,9001  >  35978 [ACK] Seq=6501237 Ack=116976763 Win=65535 Len=0
1,1.1837289999998575,62.210.85.178,10.0.2.15,TCP,60,9001  >  35978 [ACK] Seq=6501237 Ack=116978223 Win=65535 Len=0
1,1.1837319999999636,62.210.85.178,10.0.2.15,TCP,60,9001  >  35978 [ACK] Seq=6501237 Ack=116979683 Win=65535 Len=0
1,1.183770000000095,10.0.2.15,62.210.85.178,TLSv1.2,1204,Application Data
1,1.1838330000000497,62.210.85.178,10.0.2.15,TCP,60,9001  >  35978 [ACK] Seq=6501237 Ack=116980833 Win=65535 Len=0
1,1.1838920000000144,10.0.2.15,62.210.85.178,TLSv1.2,4124,Application Data
1,1.1839569999997366,62.210.85.178,10.0.2.15,TCP,60,9001  >  35978 [ACK] Seq=6501237 Ack=116982293 Win=65535 Len=0
1,1.183966000000055,62.210.85.178,10.0.2.15,TCP,60,9001  >  35978 [ACK] Seq=6501237 Ack=116983753 Win=65535 Len=0
1,1.1839689999997063,62.210.85.178,10.0.2.15,TCP,60,9001  >  35978 [ACK] Seq=6501237 Ack=116984903 Win=65535 Len=0
1,1.1840170000000398,10.0.2.15,62.210.85.178,TLSv1.2,4124,Application Data
1,1.1840579999998226,62.210.85.178,10.0.2.15,TCP,60,9001  >  35978 [ACK] Seq=6501237 Ack=116986363 Win=65535 Len=0
1,1.1840669999996862,62.210.85.178,10.0.2.15,TCP,60,9001  >  35978 [ACK] Seq=6501237 Ack=116987823 Win=65535 Len=0
1,1.184128999999757,10.0.2.15,62.210.85.178,TLSv1.2,2974,Application Data
1,1.184168999999656,62.210.85.178,10.0.2.15,TCP,60,9001  >  35978 [ACK] Seq=6501237 Ack=116988973 Win=65535 Len=0
1,1.1841770000000906,62.210.85.178,10.0.2.15,TCP,60,9001  >  35978 [ACK] Seq=6501237 Ack=116990433 Win=65535 Len=0
1,1.1841810000000805,62.210.85.178,10.0.2.15,TCP,60,9001  >  35978 [ACK] Seq=6501237 Ack=116991893 Win=65535 Len=0
1,1.1842090000000098,10.0.2.15,62.210.85.178,TLSv1.2,1226,Application Data
1,1.184244999999919,62.210.85.178,10.0.2.15,TCP,60,9001  >  35978 [ACK] Seq=6501237 Ack=116993065 Win=65535 Len=0
1,1.1842859999997017,10.0.2.15,62.210.85.178,TLSv1.2,4124,Application Data
1,1.184324999999717,62.210.85.178,10.0.2.15,TCP,60,9001  >  35978 [ACK] Seq=6501237 Ack=116994525 Win=65535 Len=0
1,1.1843329999996968,62.210.85.178,10.0.2.15,TCP,60,9001  >  35978 [ACK] Seq=6501237 Ack=116995985 Win=65535 Len=0
1,1.1843369999996867,62.210.85.178,10.0.2.15,TCP,60,9001  >  35978 [ACK] Seq=6501237 Ack=116997135 Win=65535 Len=0
1,1.1843739999999343,10.0.2.15,62.210.85.178,TLSv1.2,3030,Application Data
1,1.1844129999999495,62.210.85.178,10.0.2.15,TCP,60,9001  >  35978 [ACK] Seq=6501237 Ack=116998595 Win=65535 Len=0
1,1.1844200000000455,62.210.85.178,10.0.2.15,TCP,60,9001  >  35978 [ACK] Seq=6501237 Ack=117000055 Win=65535 Len=0
1,1.1844240000000354,62.210.85.178,10.0.2.15,TCP,60,9001  >  35978 [ACK] Seq=6501237 Ack=117000111 Win=65535 Len=0
1,1.1936339999997472,10.0.2.15,62.210.85.178,TLSv1.2,4124,Application Data
1,1.1936879999998382,62.210.85.178,10.0.2.15,TCP,60,9001  >  35978 [ACK] Seq=6501237 Ack=117001571 Win=65535 Len=0
1,1.1936980000000403,62.210.85.178,10.0.2.15,TCP,60,9001  >  35978 [ACK] Seq=6501237 Ack=117003031 Win=65535 Len=0
1,1.193702999999914,62.210.85.178,10.0.2.15,TCP,60,9001  >  35978 [ACK] Seq=6501237 Ack=117004181 Win=65535 Len=0
1,1.1937479999996867,10.0.2.15,62.210.85.178,TLSv1.2,4124,Application Data
1,1.1937889999999243,62.210.85.178,10.0.2.15,TCP,60,9001  >  35978 [ACK] Seq=6501237 Ack=117005641 Win=65535 Len=0
1,1.1937979999997879,62.210.85.178,10.0.2.15,TCP,60,9001  >  35978 [ACK] Seq=6501237 Ack=117007101 Win=65535 Len=0
1,1.1938019999997778,62.210.85.178,10.0.2.15,TCP,60,9001  >  35978 [ACK] Seq=6501237 Ack=117008251 Win=65535 Len=0
1,1.1938419999996768,10.0.2.15,62.210.85.178,TLSv1.2,4124,Application Data
1,1.1938799999998082,62.210.85.178,10.0.2.15,TCP,60,9001  >  35978 [ACK] Seq=6501237 Ack=117009711 Win=65535 Len=0
1,1.1938889999996718,62.210.85.178,10.0.2.15,TCP,60,9001  >  35978 [ACK] Seq=6501237 Ack=117011171 Win=65535 Len=0
1,1.1938929999996617,62.210.85.178,10.0.2.15,TCP,60,9001  >  35978 [ACK] Seq=6501237 Ack=117012321 Win=65535 Len=0
1,1.1939299999999093,10.0.2.15,62.210.85.178,TLSv1.2,4124,Application Data
1,1.1939680000000408,62.210.85.178,10.0.2.15,TCP,60,9001  >  35978 [ACK] Seq=6501237 Ack=117013781 Win=65535 Len=0
1,1.1939760000000206,62.210.85.178,10.0.2.15,TCP,60,9001  >  35978 [ACK] Seq=6501237 Ack=117015241 Win=65535 Len=0
1,1.1939809999998943,62.210.85.178,10.0.2.15,TCP,60,9001  >  35978 [ACK] Seq=6501237 Ack=117016391 Win=65535 Len=0
1,1.1940159999999196,10.0.2.15,62.210.85.178,TLSv1.2,332,Application Data
1,1.1940529999997125,62.210.85.178,10.0.2.15,TCP,60,9001  >  35978 [ACK] Seq=6501237 Ack=117016669 Win=65535 Len=0
1,1.1941039999996974,10.0.2.15,62.210.85.178,TLSv1.2,3868,Application Data
1,1.1941429999997126,62.210.85.178,10.0.2.15,TCP,60,9001  >  35978 [ACK] Seq=6501237 Ack=117018129 Win=65535 Len=0
1,1.194152000000031,62.210.85.178,10.0.2.15,TCP,60,9001  >  35978 [ACK] Seq=6501237 Ack=117019589 Win=65535 Len=0
1,1.1941560000000209,62.210.85.178,10.0.2.15,TCP,60,9001  >  35978 [ACK] Seq=6501237 Ack=117020483 Win=65535 Len=0
1,1.194195000000036,10.0.2.15,62.210.85.178,TLSv1.2,4124,Application Data
1,1.1942329999997128,62.210.85.178,10.0.2.15,TCP,60,9001  >  35978 [ACK] Seq=6501237 Ack=117021943 Win=65535 Len=0
1,1.1942409999996926,62.210.85.178,10.0.2.15,TCP,60,9001  >  35978 [ACK] Seq=6501237 Ack=117023403 Win=65535 Len=0
1,1.1942439999997987,62.210.85.178,10.0.2.15,TCP,60,9001  >  35978 [ACK] Seq=6501237 Ack=117024553 Win=65535 Len=0
1,1.1942799999997078,10.0.2.15,62.210.85.178,TLSv1.2,3030,Application Data
1,1.194318999999723,62.210.85.178,10.0.2.15,TCP,60,9001  >  35978 [ACK] Seq=6501237 Ack=117026013 Win=65535 Len=0
1,1.1943269999997028,62.210.85.178,10.0.2.15,TCP,60,9001  >  35978 [ACK] Seq=6501237 Ack=117027473 Win=65535 Len=0
1,1.194329999999809,62.210.85.178,10.0.2.15,TCP,60,9001  >  35978 [ACK] Seq=6501237 Ack=117027529 Win=65535 Len=0
1,1.206800999999814,10.0.2.15,62.210.85.178,TLSv1.2,4124,Application Data
1,1.2068999999996777,62.210.85.178,10.0.2.15,TCP,60,9001  >  35978 [ACK] Seq=6501237 Ack=117028989 Win=65535 Len=0
1,1.2069109999997636,62.210.85.178,10.0.2.15,TCP,60,9001  >  35978 [ACK] Seq=6501237 Ack=117030449 Win=65535 Len=0
1,1.2069139999998697,62.210.85.178,10.0.2.15,TCP,60,9001  >  35978 [ACK] Seq=6501237 Ack=117031599 Win=65535 Len=0
1,1.2069509999996626,10.0.2.15,62.210.85.178,TLSv1.2,4124,Application Data
1,1.2069910000000164,62.210.85.178,10.0.2.15,TCP,60,9001  >  35978 [ACK] Seq=6501237 Ack=117033059 Win=65535 Len=0
1,1.20699999999988,62.210.85.178,10.0.2.15,TCP,60,9001  >  35978 [ACK] Seq=6501237 Ack=117034519 Win=65535 Len=0
1,1.2070039999998698,62.210.85.178,10.0.2.15,TCP,60,9001  >  35978 [ACK] Seq=6501237 Ack=117035669 Win=65535 Len=0
1,1.207042999999885,10.0.2.15,62.210.85.178,TLSv1.2,4124,Application Data
1,1.2070810000000165,62.210.85.178,10.0.2.15,TCP,60,9001  >  35978 [ACK] Seq=6501237 Ack=117037129 Win=65535 Len=0
1,1.2070889999999963,62.210.85.178,10.0.2.15,TCP,60,9001  >  35978 [ACK] Seq=6501237 Ack=117038589 Win=65535 Len=0
1,1.20709399999987,62.210.85.178,10.0.2.15,TCP,60,9001  >  35978 [ACK] Seq=6501237 Ack=117039739 Win=65535 Len=0
1,1.2071329999998852,10.0.2.15,62.210.85.178,TLSv1.2,4124,Application Data
1,1.2071699999996781,62.210.85.178,10.0.2.15,TCP,60,9001  >  35978 [ACK] Seq=6501237 Ack=117041199 Win=65535 Len=0
1,1.207177999999658,62.210.85.178,10.0.2.15,TCP,60,9001  >  35978 [ACK] Seq=6501237 Ack=117042659 Win=65535 Len=0
1,1.2071829999999864,62.210.85.178,10.0.2.15,TCP,60,9001  >  35978 [ACK] Seq=6501237 Ack=117043809 Win=65535 Len=0
1,1.2072199999997792,10.0.2.15,62.210.85.178,TLSv1.2,332,Application Data
1,1.207257000000027,62.210.85.178,10.0.2.15,TCP,60,9001  >  35978 [ACK] Seq=6501237 Ack=117044087 Win=65535 Len=0
1,1.2073129999998855,10.0.2.15,62.210.85.178,TLSv1.2,3868,Application Data
1,1.2073550000000068,62.210.85.178,10.0.2.15,TCP,60,9001  >  35978 [ACK] Seq=6501237 Ack=117045547 Win=65535 Len=0
1,1.2073629999999866,62.210.85.178,10.0.2.15,TCP,60,9001  >  35978 [ACK] Seq=6501237 Ack=117047007 Win=65535 Len=0
1,1.2073660000000928,62.210.85.178,10.0.2.15,TCP,60,9001  >  35978 [ACK] Seq=6501237 Ack=117047901 Win=65535 Len=0
1,1.2074029999998857,10.0.2.15,62.210.85.178,TLSv1.2,1938,Application Data
1,1.2074419999999009,62.210.85.178,10.0.2.15,TCP,60,9001  >  35978 [ACK] Seq=6501237 Ack=117049361 Win=65535 Len=0
1,1.2074489999999969,62.210.85.178,10.0.2.15,TCP,60,9001  >  35978 [ACK] Seq=6501237 Ack=117049785 Win=65535 Len=0
1,1.3382659999997486,54.93.77.70,10.0.2.15,TLSv1.2,590,Application Data
1,1.3497929999998632,54.93.77.70,10.0.2.15,TLSv1.2,7294,"Application Data, Application Data"
1,1.3499269999997523,10.0.2.15,54.93.77.70,TCP,54,34692  >  9001 [ACK] Seq=6506141 Ack=116805153 Win=65535 Len=0
1,1.3678070000000844,54.93.77.70,10.0.2.15,TLSv1.2,8742,"Application Data, Application Data"
1,1.367862999999943,54.93.77.70,10.0.2.15,TLSv1.2,7388,"Application Data, Application Data"
1,1.3679799999999886,10.0.2.15,54.93.77.70,TCP,54,34692  >  9001 [ACK] Seq=6506141 Ack=116821175 Win=65535 Len=0
1,1.368199999999888,10.0.2.15,54.93.77.70,TLSv1.2,590,Application Data
1,1.3683200000000397,54.93.77.70,10.0.2.15,TCP,60,9001  >  34692 [ACK] Seq=116821175 Ack=6506677 Win=65535 Len=0
1,1.3824719999997797,54.93.77.70,10.0.2.15,TLSv1.2,4398,Application Data
1,1.3825309999997444,54.93.77.70,10.0.2.15,TCP,1502,"9001  >  34692 [PSH, ACK] Seq=116825519 Ack=6506677 Win=65535 Len=1448 [TCP segment of a reassembled PDU]"
1,1.3826810000000478,10.0.2.15,54.93.77.70,TCP,54,34692  >  9001 [ACK] Seq=6506677 Ack=116825519 Win=65535 Len=0
1,1.382890999999745,10.0.2.15,54.93.77.70,TCP,54,34692  >  9001 [ACK] Seq=6506677 Ack=116826967 Win=65535 Len=0
1,1.3831929999996646,10.0.2.15,54.93.77.70,TLSv1.2,590,Application Data
1,1.3834509999996953,54.93.77.70,10.0.2.15,TCP,60,9001  >  34692 [ACK] Seq=116826967 Ack=6507213 Win=65535 Len=0
1,1.3844749999998385,54.93.77.70,10.0.2.15,TLSv1.2,5846,Application Data [TCP segment of a reassembled PDU]
1,1.3845569999998588,10.0.2.15,54.93.77.70,TCP,54,34692  >  9001 [ACK] Seq=6507213 Ack=116832759 Win=65535 Len=0
1,1.386098999999831,54.93.77.70,10.0.2.15,TLSv1.2,4492,"Application Data, Application Data"
1,1.38614299999972,10.0.2.15,54.93.77.70,TCP,54,34692  >  9001 [ACK] Seq=6507213 Ack=116837197 Win=65535 Len=0
1,1.38943399999971,54.93.77.70,10.0.2.15,TCP,2950,"9001  >  34692 [PSH, ACK] Seq=116837197 Ack=6507213 Win=65535 Len=2896 [TCP segment of a reassembled PDU]"
1,1.3894759999998314,10.0.2.15,54.93.77.70,TCP,54,34692  >  9001 [ACK] Seq=6507213 Ack=116840093 Win=65535 Len=0
1,1.3917750000000524,54.93.77.70,10.0.2.15,TLSv1.2,2950,Application Data [TCP segment of a reassembled PDU]
1,1.3918159999998352,10.0.2.15,54.93.77.70,TCP,54,34692  >  9001 [ACK] Seq=6507213 Ack=116842989 Win=65535 Len=0
1,1.3926069999997708,54.93.77.70,10.0.2.15,TLSv1.2,2950,Application Data [TCP segment of a reassembled PDU]
1,1.3926480000000083,10.0.2.15,54.93.77.70,TCP,54,34692  >  9001 [ACK] Seq=6507213 Ack=116845885 Win=65535 Len=0
1,1.3932850000001054,54.93.77.70,10.0.2.15,TCP,1502,"9001  >  34692 [PSH, ACK] Seq=116845885 Ack=6507213 Win=65535 Len=1448 [TCP segment of a reassembled PDU]"
1,1.3933489999999438,10.0.2.15,54.93.77.70,TCP,54,34692  >  9001 [ACK] Seq=6507213 Ack=116847333 Win=65535 Len=0
1,1.4022569999997359,54.93.77.70,10.0.2.15,TLSv1.2,1292,Application Data
1,1.4105420000000777,54.93.77.70,10.0.2.15,TLSv1.2,5846,Application Data
1,1.4105599999998049,54.93.77.70,10.0.2.15,TLSv1.2,4398,Application Data [TCP segment of a reassembled PDU]
1,1.4106349999997292,10.0.2.15,54.93.77.70,TCP,54,34692  >  9001 [ACK] Seq=6507213 Ack=116858707 Win=65535 Len=0
1,1.4107810000000427,10.0.2.15,54.93.77.70,TLSv1.2,590,Application Data
1,1.4108479999999872,54.93.77.70,10.0.2.15,TCP,60,9001  >  34692 [ACK] Seq=116858707 Ack=6507749 Win=65535 Len=0
1,1.411098999999922,54.93.77.70,10.0.2.15,TLSv1.2,5846,Application Data [TCP segment of a reassembled PDU]
1,1.411138999999821,10.0.2.15,54.93.77.70,TCP,54,34692  >  9001 [ACK] Seq=6507749 Ack=116864499 Win=65535 Len=0
1,1.4188129999997727,54.93.77.70,10.0.2.15,TLSv1.2,148,Application Data
1,1.4234630000000834,10.0.2.15,54.93.77.70,TLSv1.2,590,Application Data
1,1.4235549999998511,54.93.77.70,10.0.2.15,TCP,60,9001  >  34692 [ACK] Seq=116864593 Ack=6508285 Win=65535 Len=0
1,1.4333119999996597,54.93.77.70,10.0.2.15,TLSv1.2,2950,Application Data
1,1.4334029999999984,54.93.77.70,10.0.2.15,TCP,1502,"9001  >  34692 [PSH, ACK] Seq=116867489 Ack=6508285 Win=65535 Len=1448 [TCP segment of a reassembled PDU]"
1,1.4335139999998319,10.0.2.15,54.93.77.70,TCP,54,34692  >  9001 [ACK] Seq=6508285 Ack=116868937 Win=65535 Len=0
1,1.4409249999998792,54.93.77.70,10.0.2.15,TLSv1.2,916,"Application Data, Application Data"
1,1.442457000000104,54.93.77.70,10.0.2.15,TCP,2950,"9001  >  34692 [PSH, ACK] Seq=116869799 Ack=6508285 Win=65535 Len=2896 [TCP segment of a reassembled PDU]"
1,1.4425179999998363,10.0.2.15,54.93.77.70,TCP,54,34692  >  9001 [ACK] Seq=6508285 Ack=116872695 Win=65535 Len=0
1,1.4529749999996966,54.93.77.70,10.0.2.15,TLSv1.2,1502,Application Data [TCP segment of a reassembled PDU]
1,1.4531280000001061,10.0.2.15,54.93.77.70,TCP,54,34692  >  9001 [ACK] Seq=6508285 Ack=116874143 Win=65535 Len=0
1,1.457578999999896,54.93.77.70,10.0.2.15,TLSv1.2,894,Application Data
1,1.46048699999983,10.0.2.15,54.93.77.70,TLSv1.2,590,Application Data
1,1.460645999999997,54.93.77.70,10.0.2.15,TCP,60,9001  >  34692 [ACK] Seq=116874983 Ack=6508821 Win=65535 Len=0
1,1.4950189999999566,62.210.85.178,10.0.2.15,TLSv1.2,1104,Application Data
1,1.5384939999999006,10.0.2.15,62.210.85.178,TCP,54,35978  >  9001 [ACK] Seq=117049785 Ack=6502287 Win=65535 Len=0
1,1.5583670000000893,62.210.85.178,10.0.2.15,TLSv1.2,1104,Application Data
1,1.5584239999998317,10.0.2.15,62.210.85.178,TCP,54,35978  >  9001 [ACK] Seq=117049785 Ack=6503337 Win=65535 Len=0
1,1.7104349999999613,62.210.85.178,10.0.2.15,TLSv1.2,590,Application Data
1,1.7105109999997694,10.0.2.15,62.210.85.178,TCP,54,35978  >  9001 [ACK] Seq=117049785 Ack=6503873 Win=65535 Len=0
1,1.7109949999999117,10.0.2.15,62.210.85.178,TLSv1.2,590,Application Data
1,1.7111190000000533,62.210.85.178,10.0.2.15,TCP,60,9001  >  35978 [ACK] Seq=6503873 Ack=117050321 Win=65535 Len=0
1,1.8525049999998373,54.93.77.70,10.0.2.15,TLSv1.2,590,Application Data
1,1.8529679999996915,10.0.2.15,54.93.77.70,TLSv1.2,590,Application Data
1,1.8531290000000809,54.93.77.70,10.0.2.15,TCP,60,9001  >  34692 [ACK] Seq=116875519 Ack=6509357 Win=65535 Len=0
1,2.0050619999997252,62.210.85.178,10.0.2.15,TLSv1.2,590,Application Data
1,2.010978999999679,10.0.2.15,62.210.85.178,TLSv1.2,590,Application Data
1,2.011156000000028,62.210.85.178,10.0.2.15,TCP,60,9001  >  35978 [ACK] Seq=6504409 Ack=117050857 Win=65535 Len=0
1,2.023525999999947,10.0.2.15,62.210.85.178,TLSv1.2,4124,Application Data
1,2.0236259999996946,10.0.2.15,62.210.85.178,TCP,2974,35978  >  9001 [ACK] Seq=117054927 Ack=6504409 Win=65535 Len=2920 [TCP segment of a reassembled PDU]
1,2.023667999999816,62.210.85.178,10.0.2.15,TCP,60,9001  >  35978 [ACK] Seq=6504409 Ack=117052317 Win=65535 Len=0
1,2.023678999999902,62.210.85.178,10.0.2.15,TCP,60,9001  >  35978 [ACK] Seq=6504409 Ack=117053777 Win=65535 Len=0
1,2.0236829999998918,62.210.85.178,10.0.2.15,TCP,60,9001  >  35978 [ACK] Seq=6504409 Ack=117054927 Win=65535 Len=0
1,2.023685999999998,62.210.85.178,10.0.2.15,TCP,60,9001  >  35978 [ACK] Seq=6504409 Ack=117056387 Win=65535 Len=0
1,2.023689000000104,62.210.85.178,10.0.2.15,TCP,60,9001  >  35978 [ACK] Seq=6504409 Ack=117057847 Win=65535 Len=0
1,2.0237229999997908,10.0.2.15,62.210.85.178,TLSv1.2,1204,Application Data
1,2.023757999999816,62.210.85.178,10.0.2.15,TCP,60,9001  >  35978 [ACK] Seq=6504409 Ack=117058997 Win=65535 Len=0
1,2.023800999999821,10.0.2.15,62.210.85.178,TLSv1.2,4124,Application Data
1,2.0238359999998465,62.210.85.178,10.0.2.15,TCP,60,9001  >  35978 [ACK] Seq=6504409 Ack=117060457 Win=65535 Len=0
1,2.0238439999998263,62.210.85.178,10.0.2.15,TCP,60,9001  >  35978 [ACK] Seq=6504409 Ack=117061917 Win=65535 Len=0
1,2.0238469999999325,62.210.85.178,10.0.2.15,TCP,60,9001  >  35978 [ACK] Seq=6504409 Ack=117063067 Win=65535 Len=0
1,2.023885000000064,10.0.2.15,62.210.85.178,TLSv1.2,4124,Application Data
1,2.0239189999997507,62.210.85.178,10.0.2.15,TCP,60,9001  >  35978 [ACK] Seq=6504409 Ack=117064527 Win=65535 Len=0
1,2.023924999999963,62.210.85.178,10.0.2.15,TCP,60,9001  >  35978 [ACK] Seq=6504409 Ack=117065987 Win=65535 Len=0
1,2.0239809999998215,10.0.2.15,62.210.85.178,TLSv1.2,2974,Application Data
1,2.0240199999998367,62.210.85.178,10.0.2.15,TCP,60,9001  >  35978 [ACK] Seq=6504409 Ack=117067137 Win=65535 Len=0
1,2.0240269999999327,62.210.85.178,10.0.2.15,TCP,60,9001  >  35978 [ACK] Seq=6504409 Ack=117068597 Win=65535 Len=0
1,2.0240309999999226,62.210.85.178,10.0.2.15,TCP,60,9001  >  35978 [ACK] Seq=6504409 Ack=117070057 Win=65535 Len=0
1,2.024057999999968,10.0.2.15,62.210.85.178,TLSv1.2,1226,Application Data
1,2.0240899999998874,62.210.85.178,10.0.2.15,TCP,60,9001  >  35978 [ACK] Seq=6504409 Ack=117071229 Win=65535 Len=0
1,2.0241289999999026,10.0.2.15,62.210.85.178,TLSv1.2,4124,Application Data
1,2.0241649999998117,62.210.85.178,10.0.2.15,TCP,60,9001  >  35978 [ACK] Seq=6504409 Ack=117072689 Win=65535 Len=0
1,2.024171000000024,62.210.85.178,10.0.2.15,TCP,60,9001  >  35978 [ACK] Seq=6504409 Ack=117074149 Win=65535 Len=0
1,2.0241739999996753,62.210.85.178,10.0.2.15,TCP,60,9001  >  35978 [ACK] Seq=6504409 Ack=117075299 Win=65535 Len=0
1,2.024210999999923,10.0.2.15,62.210.85.178,TLSv1.2,3030,Application Data
1,2.0242450000000645,62.210.85.178,10.0.2.15,TCP,60,9001  >  35978 [ACK] Seq=6504409 Ack=117076759 Win=65535 Len=0
1,2.0242519999997057,62.210.85.178,10.0.2.15,TCP,60,9001  >  35978 [ACK] Seq=6504409 Ack=117078219 Win=65535 Len=0
1,2.024254999999812,62.210.85.178,10.0.2.15,TCP,60,9001  >  35978 [ACK] Seq=6504409 Ack=117078275 Win=65535 Len=0
1,2.033477999999832,10.0.2.15,62.210.85.178,TLSv1.2,4124,Application Data
1,2.0335549999999785,62.210.85.178,10.0.2.15,TCP,60,9001  >  35978 [ACK] Seq=6504409 Ack=117079735 Win=65535 Len=0
1,2.033563999999842,62.210.85.178,10.0.2.15,TCP,60,9001  >  35978 [ACK] Seq=6504409 Ack=117081195 Win=65535 Len=0
1,2.033567999999832,62.210.85.178,10.0.2.15,TCP,60,9001  >  35978 [ACK] Seq=6504409 Ack=117082345 Win=65535 Len=0
1,2.0336419999998725,10.0.2.15,62.210.85.178,TLSv1.2,4124,Application Data
1,2.0337259999996604,62.210.85.178,10.0.2.15,TCP,60,9001  >  35978 [ACK] Seq=6504409 Ack=117083805 Win=65535 Len=0
1,2.0337389999999687,62.210.85.178,10.0.2.15,TCP,60,9001  >  35978 [ACK] Seq=6504409 Ack=117085265 Win=65535 Len=0
1,2.0337439999998423,62.210.85.178,10.0.2.15,TCP,60,9001  >  35978 [ACK] Seq=6504409 Ack=117086415 Win=65535 Len=0
1,2.033773999999994,10.0.2.15,62.210.85.178,TCP,2974,35978  >  9001 [ACK] Seq=117086415 Ack=6504409 Win=65535 Len=2920 [TCP segment of a reassembled PDU]
1,2.0338119999996707,62.210.85.178,10.0.2.15,TCP,60,9001  >  35978 [ACK] Seq=6504409 Ack=117087875 Win=65535 Len=0
1,2.033820000000105,62.210.85.178,10.0.2.15,TCP,60,9001  >  35978 [ACK] Seq=6504409 Ack=117089335 Win=65535 Len=0
1,2.033852999999908,10.0.2.15,62.210.85.178,TLSv1.2,1204,Application Data
1,2.033889999999701,62.210.85.178,10.0.2.15,TCP,60,9001  >  35978 [ACK] Seq=6504409 Ack=117090485 Win=65535 Len=0
1,2.0339329999997062,10.0.2.15,62.210.85.178,TLSv1.2,4124,Application Data
1,2.0339719999997214,62.210.85.178,10.0.2.15,TCP,60,9001  >  35978 [ACK] Seq=6504409 Ack=117091945 Win=65535 Len=0
1,2.0339799999997012,62.210.85.178,10.0.2.15,TCP,60,9001  >  35978 [ACK] Seq=6504409 Ack=117093405 Win=65535 Len=0
1,2.033983999999691,62.210.85.178,10.0.2.15,TCP,60,9001  >  35978 [ACK] Seq=6504409 Ack=117094555 Win=65535 Len=0
1,2.034020999999939,10.0.2.15,62.210.85.178,TLSv1.2,332,Application Data
1,2.0340579999997317,62.210.85.178,10.0.2.15,TCP,60,9001  >  35978 [ACK] Seq=6504409 Ack=117094833 Win=65535 Len=0
1,2.034110000000055,10.0.2.15,62.210.85.178,TLSv1.2,3868,Application Data
1,2.0341530000000603,62.210.85.178,10.0.2.15,TCP,60,9001  >  35978 [ACK] Seq=6504409 Ack=117096293 Win=65535 Len=0
1,2.03416100000004,62.210.85.178,10.0.2.15,TCP,60,9001  >  35978 [ACK] Seq=6504409 Ack=117097753 Win=65535 Len=0
1,2.03416500000003,62.210.85.178,10.0.2.15,TCP,60,9001  >  35978 [ACK] Seq=6504409 Ack=117098647 Win=65535 Len=0
1,2.0342069999996966,10.0.2.15,62.210.85.178,TLSv1.2,4124,Application Data
1,2.034245999999712,62.210.85.178,10.0.2.15,TCP,60,9001  >  35978 [ACK] Seq=6504409 Ack=117100107 Win=65535 Len=0
1,2.0342539999996916,62.210.85.178,10.0.2.15,TCP,60,9001  >  35978 [ACK] Seq=6504409 Ack=117101567 Win=65535 Len=0
1,2.0342579999996815,62.210.85.178,10.0.2.15,TCP,60,9001  >  35978 [ACK] Seq=6504409 Ack=117102717 Win=65535 Len=0
1,2.034292999999707,10.0.2.15,62.210.85.178,TLSv1.2,3030,Application Data
1,2.0343309999998382,62.210.85.178,10.0.2.15,TCP,60,9001  >  35978 [ACK] Seq=6504409 Ack=117104177 Win=65535 Len=0
1,2.0343379999999343,62.210.85.178,10.0.2.15,TCP,60,9001  >  35978 [ACK] Seq=6504409 Ack=117105637 Win=65535 Len=0
1,2.0343439999996917,62.210.85.178,10.0.2.15,TCP,60,9001  >  35978 [ACK] Seq=6504409 Ack=117105693 Win=65535 Len=0
1,2.046899999999823,10.0.2.15,62.210.85.178,TLSv1.2,4124,Application Data
1,2.046955999999682,62.210.85.178,10.0.2.15,TCP,60,9001  >  35978 [ACK] Seq=6504409 Ack=117107153 Win=65535 Len=0
1,2.0469669999997677,62.210.85.178,10.0.2.15,TCP,60,9001  >  35978 [ACK] Seq=6504409 Ack=117108613 Win=65535 Len=0
1,2.046972000000096,62.210.85.178,10.0.2.15,TCP,60,9001  >  35978 [ACK] Seq=6504409 Ack=117109763 Win=65535 Len=0
1,2.0470179999997526,10.0.2.15,62.210.85.178,TLSv1.2,4124,Application Data
1,2.047059999999874,62.210.85.178,10.0.2.15,TCP,60,9001  >  35978 [ACK] Seq=6504409 Ack=117111223 Win=65535 Len=0
1,2.047067999999854,62.210.85.178,10.0.2.15,TCP,60,9001  >  35978 [ACK] Seq=6504409 Ack=117112683 Win=65535 Len=0
1,2.0470719999998437,62.210.85.178,10.0.2.15,TCP,60,9001  >  35978 [ACK] Seq=6504409 Ack=117113833 Win=65535 Len=0
1,2.047109999999975,10.0.2.15,62.210.85.178,TLSv1.2,1746,Application Data
1,2.0471480000001065,62.210.85.178,10.0.2.15,TCP,60,9001  >  35978 [ACK] Seq=6504409 Ack=117115293 Win=65535 Len=0
1,2.0471560000000864,62.210.85.178,10.0.2.15,TCP,60,9001  >  35978 [ACK] Seq=6504409 Ack=117115525 Win=65535 Len=0
1,2.1435849999998027,54.93.77.70,10.0.2.15,TLSv1.2,590,Application Data
1,2.1507309999997233,54.93.77.70,10.0.2.15,TCP,2950,"9001  >  34692 [PSH, ACK] Seq=116876055 Ack=6509357 Win=65535 Len=2896 [TCP segment of a reassembled PDU]"
1,2.150853999999981,10.0.2.15,54.93.77.70,TCP,54,34692  >  9001 [ACK] Seq=6509357 Ack=116878951 Win=65535 Len=0
1,2.1674840000000586,54.93.77.70,10.0.2.15,TLSv1.2,778,Application Data
1,2.21049099999982,10.0.2.15,54.93.77.70,TCP,54,34692  >  9001 [ACK] Seq=6509357 Ack=116879675 Win=65535 Len=0
1,2.322490000000016,54.93.77.70,10.0.2.15,TCP,2950,"9001  >  34692 [PSH, ACK] Seq=116879675 Ack=6509357 Win=65535 Len=2896 [TCP segment of a reassembled PDU]"
1,2.3225789999996778,10.0.2.15,54.93.77.70,TCP,54,34692  >  9001 [ACK] Seq=6509357 Ack=116882571 Win=65535 Len=0
1,2.323562000000038,54.93.77.70,10.0.2.15,TLSv1.2,10190,"Application Data, Application Data, Application Data"
1,2.3235819999999876,54.93.77.70,10.0.2.15,TCP,1502,"9001  >  34692 [PSH, ACK] Seq=116892707 Ack=6509357 Win=65535 Len=1448 [TCP segment of a reassembled PDU]"
1,2.3236199999996643,10.0.2.15,54.93.77.70,TCP,54,34692  >  9001 [ACK] Seq=6509357 Ack=116892707 Win=65535 Len=0
1,2.323660999999902,10.0.2.15,54.93.77.70,TCP,54,34692  >  9001 [ACK] Seq=6509357 Ack=116894155 Win=65535 Len=0
1,2.3378199999997378,54.93.77.70,10.0.2.15,TLSv1.2,1502,Application Data [TCP segment of a reassembled PDU]
1,2.337905999999748,10.0.2.15,54.93.77.70,TCP,54,34692  >  9001 [ACK] Seq=6509357 Ack=116895603 Win=65535 Len=0
1,2.340175999999701,54.93.77.70,10.0.2.15,TCP,2950,"9001  >  34692 [PSH, ACK] Seq=116895603 Ack=6509357 Win=65535 Len=2896 [TCP segment of a reassembled PDU]"
1,2.340194999999767,54.93.77.70,10.0.2.15,TLSv1.2,2950,"Application Data, Application Data, Application Data"
1,2.340200999999979,54.93.77.70,10.0.2.15,TLSv1.2,4398,Application Data [TCP segment of a reassembled PDU]
1,2.340247999999974,10.0.2.15,54.93.77.70,TCP,54,34692  >  9001 [ACK] Seq=6509357 Ack=116898499 Win=65535 Len=0
1,2.3402909999999792,10.0.2.15,54.93.77.70,TCP,54,34692  >  9001 [ACK] Seq=6509357 Ack=116901395 Win=65535 Len=0
1,2.3403119999998125,10.0.2.15,54.93.77.70,TCP,54,34692  >  9001 [ACK] Seq=6509357 Ack=116905739 Win=65535 Len=0
1,2.3405619999998635,10.0.2.15,54.93.77.70,TLSv1.2,590,Application Data
1,2.3406379999996716,54.93.77.70,10.0.2.15,TCP,60,9001  >  34692 [ACK] Seq=116905739 Ack=6509893 Win=65535 Len=0
1,2.340948000000026,54.93.77.70,10.0.2.15,TLSv1.2,2480,"Application Data, Application Data"
1,2.340961999999763,54.93.77.70,10.0.2.15,TCP,2950,"9001  >  34692 [PSH, ACK] Seq=116908165 Ack=6509893 Win=65535 Len=2896 [TCP segment of a reassembled PDU]"
1,2.3409939999996823,10.0.2.15,54.93.77.70,TCP,54,34692  >  9001 [ACK] Seq=6509893 Ack=116908165 Win=65535 Len=0
1,2.3410659999999552,10.0.2.15,54.93.77.70,TCP,54,34692  >  9001 [ACK] Seq=6509893 Ack=116911061 Win=65535 Len=0
1,2.3417819999999665,54.93.77.70,10.0.2.15,TLSv1.2,2950,Application Data [TCP segment of a reassembled PDU]
1,2.3418229999997493,10.0.2.15,54.93.77.70,TCP,54,34692  >  9001 [ACK] Seq=6509893 Ack=116913957 Win=65535 Len=0
1,2.3503069999997024,10.0.2.15,54.93.77.70,TLSv1.2,590,Application Data
1,2.350517999999738,54.93.77.70,10.0.2.15,TCP,60,9001  >  34692 [ACK] Seq=116913957 Ack=6510429 Win=65535 Len=0
1,2.4619049999996605,54.93.77.70,10.0.2.15,TLSv1.2,2950,Application Data [TCP segment of a reassembled PDU]
1,2.462035999999898,10.0.2.15,54.93.77.70,TCP,54,34692  >  9001 [ACK] Seq=6510429 Ack=116916853 Win=65535 Len=0
1,2.465958999999657,54.93.77.70,10.0.2.15,TCP,2950,"9001  >  34692 [PSH, ACK] Seq=116916853 Ack=6510429 Win=65535 Len=2896 [TCP segment of a reassembled PDU]"
1,2.4660069999999905,54.93.77.70,10.0.2.15,TLSv1.2,4398,Application Data [TCP segment of a reassembled PDU]
1,2.466038000000026,54.93.77.70,10.0.2.15,TLSv1.2,16402,"Application Data, Application Data, Application Data, Application Data, Application Data, Application Data"
1,2.4661049999999705,10.0.2.15,54.93.77.70,TCP,54,34692  >  9001 [ACK] Seq=6510429 Ack=116919749 Win=65535 Len=0
1,2.4662029999999504,10.0.2.15,54.93.77.70,TCP,54,34692  >  9001 [ACK] Seq=6510429 Ack=116940441 Win=65535 Len=0
1,2.4665390000000116,10.0.2.15,54.93.77.70,TLSv1.2,590,Application Data
1,2.4665979999999763,54.93.77.70,10.0.2.15,TCP,60,9001  >  34692 [ACK] Seq=116940441 Ack=6510965 Win=65535 Len=0
1,2.4683939999999893,54.93.77.70,10.0.2.15,TLSv1.2,380,Application Data
1,2.4684079999997266,62.210.85.178,10.0.2.15,TLSv1.2,590,Application Data
1,2.4761359999997694,10.0.2.15,54.93.77.70,TLSv1.2,590,Application Data
1,2.4762799999998606,54.93.77.70,10.0.2.15,TCP,60,9001  >  34692 [ACK] Seq=116940767 Ack=6511501 Win=65535 Len=0
1,2.5104819999996835,10.0.2.15,62.210.85.178,TCP,54,35978  >  9001 [ACK] Seq=117115525 Ack=6504945 Win=65535 Len=0
1,2.6160930000000917,62.210.85.178,10.0.2.15,TLSv1.2,1104,Application Data
1,2.6161870000000818,10.0.2.15,62.210.85.178,TCP,54,35978  >  9001 [ACK] Seq=117115525 Ack=6505995 Win=65535 Len=0
1,2.7565199999999095,62.210.85.178,10.0.2.15,TLSv1.2,590,Application Data
1,2.756634999999733,10.0.2.15,62.210.85.178,TCP,54,35978  >  9001 [ACK] Seq=117115525 Ack=6506531 Win=65535 Len=0
1,2.7572070000001077,10.0.2.15,62.210.85.178,TLSv1.2,590,Application Data
1,2.757337000000007,62.210.85.178,10.0.2.15,TCP,60,9001  >  35978 [ACK] Seq=6506531 Ack=117116061 Win=65535 Len=0
1,2.922486999999819,54.93.77.70,10.0.2.15,TLSv1.2,590,Application Data
1,2.9229599999998754,10.0.2.15,54.93.77.70,TLSv1.2,590,Application Data
1,2.923103000000083,54.93.77.70,10.0.2.15,TCP,60,9001  >  34692 [ACK] Seq=116941303 Ack=6512037 Win=65535 Len=0
1,3.0658469999998488,62.210.85.178,10.0.2.15,TLSv1.2,590,Application Data
1,3.072280999999748,10.0.2.15,62.210.85.178,TLSv1.2,590,Application Data
1,3.0765870000000177,62.210.85.178,10.0.2.15,TCP,60,9001  >  35978 [ACK] Seq=6507067 Ack=117116597 Win=65535 Len=0
1,3.093840999999884,10.0.2.15,62.210.85.178,TLSv1.2,4124,Application Data
1,3.0949259999997594,62.210.85.178,10.0.2.15,TCP,60,9001  >  35978 [ACK] Seq=6507067 Ack=117118057 Win=65535 Len=0
1,3.0950779999998304,62.210.85.178,10.0.2.15,TCP,60,9001  >  35978 [ACK] Seq=6507067 Ack=117119517 Win=65535 Len=0
1,3.0950989999996636,62.210.85.178,10.0.2.15,TCP,60,9001  >  35978 [ACK] Seq=6507067 Ack=117120667 Win=65535 Len=0
1,3.095440999999937,10.0.2.15,62.210.85.178,TLSv1.2,4124,Application Data
1,3.0956999999998516,62.210.85.178,10.0.2.15,TCP,60,9001  >  35978 [ACK] Seq=6507067 Ack=117122127 Win=65535 Len=0
1,3.0957220000000234,62.210.85.178,10.0.2.15,TCP,60,9001  >  35978 [ACK] Seq=6507067 Ack=117123587 Win=65535 Len=0
1,3.095730000000003,62.210.85.178,10.0.2.15,TCP,60,9001  >  35978 [ACK] Seq=6507067 Ack=117124737 Win=65535 Len=0
1,3.0958479999999327,10.0.2.15,62.210.85.178,TLSv1.2,4124,Application Data
1,3.0959649999999783,62.210.85.178,10.0.2.15,TCP,60,9001  >  35978 [ACK] Seq=6507067 Ack=117126197 Win=65535 Len=0
1,3.095977999999832,62.210.85.178,10.0.2.15,TCP,60,9001  >  35978 [ACK] Seq=6507067 Ack=117127657 Win=65535 Len=0
1,3.0959829999997055,62.210.85.178,10.0.2.15,TCP,60,9001  >  35978 [ACK] Seq=6507067 Ack=117128807 Win=65535 Len=0
1,3.0960580000000846,10.0.2.15,62.210.85.178,TLSv1.2,4124,Application Data
1,3.096266000000014,62.210.85.178,10.0.2.15,TCP,60,9001  >  35978 [ACK] Seq=6507067 Ack=117130267 Win=65535 Len=0
1,3.0962829999998576,62.210.85.178,10.0.2.15,TCP,60,9001  >  35978 [ACK] Seq=6507067 Ack=117131727 Win=65535 Len=0
1,3.0962879999997313,62.210.85.178,10.0.2.15,TCP,60,9001  >  35978 [ACK] Seq=6507067 Ack=117132877 Win=65535 Len=0
1,3.0963659999997617,10.0.2.15,62.210.85.178,TLSv1.2,332,Application Data
1,3.09646500000008,62.210.85.178,10.0.2.15,TCP,60,9001  >  35978 [ACK] Seq=6507067 Ack=117133155 Win=65535 Len=0
1,3.0965799999999035,10.0.2.15,62.210.85.178,TLSv1.2,3160,Application Data
1,3.096802000000025,62.210.85.178,10.0.2.15,TCP,60,9001  >  35978 [ACK] Seq=6507067 Ack=117134615 Win=65535 Len=0
1,3.0968559999996614,62.210.85.178,10.0.2.15,TCP,60,9001  >  35978 [ACK] Seq=6507067 Ack=117136075 Win=65535 Len=0
1,3.096868000000086,62.210.85.178,10.0.2.15,TCP,60,9001  >  35978 [ACK] Seq=6507067 Ack=117136261 Win=65535 Len=0
1,3.212757999999667,54.93.77.70,10.0.2.15,TLSv1.2,590,Application Data
1,3.2239439999998467,54.93.77.70,10.0.2.15,TCP,2950,"9001  >  34692 [PSH, ACK] Seq=116941839 Ack=6512037 Win=65535 Len=2896 [TCP segment of a reassembled PDU]"
1,3.223993000000064,54.93.77.70,10.0.2.15,TLSv1.2,5846,"Application Data, Application Data"
1,3.224171999999726,10.0.2.15,54.93.77.70,TCP,54,34692  >  9001 [ACK] Seq=6512037 Ack=116950527 Win=65535 Len=0
1,3.2243499999999585,54.93.77.70,10.0.2.15,TCP,1502,"9001  >  34692 [PSH, ACK] Seq=116950527 Ack=6512037 Win=65535 Len=1448 [TCP segment of a reassembled PDU]"
1,3.224412999999913,10.0.2.15,54.93.77.70,TCP,54,34692  >  9001 [ACK] Seq=6512037 Ack=116951975 Win=65535 Len=0
1,3.240820999999869,54.93.77.70,10.0.2.15,TLSv1.2,2950,Application Data [TCP segment of a reassembled PDU]
1,3.2409319999997024,10.0.2.15,54.93.77.70,TCP,54,34692  >  9001 [ACK] Seq=6512037 Ack=116954871 Win=65535 Len=0
1,3.2412939999999253,54.93.77.70,10.0.2.15,TLSv1.2,2552,"Application Data, Application Data"
1,3.2413549999996576,10.0.2.15,54.93.77.70,TCP,54,34692  >  9001 [ACK] Seq=6512037 Ack=116957369 Win=65535 Len=0
1,3.2589849999999387,54.93.77.70,10.0.2.15,TLSv1.2,3674,Application Data
1,3.259113999999954,10.0.2.15,54.93.77.70,TCP,54,34692  >  9001 [ACK] Seq=6512037 Ack=116960989 Win=65535 Len=0
1,3.259411,10.0.2.15,54.93.77.70,TLSv1.2,590,Application Data
1,3.2594899999999143,54.93.77.70,10.0.2.15,TCP,60,9001  >  34692 [ACK] Seq=116960989 Ack=6512573 Win=65535 Len=0
1,3.2701130000000376,10.0.2.15,54.93.77.70,TLSv1.2,590,Application Data
1,3.275017999999818,54.93.77.70,10.0.2.15,TCP,60,9001  >  34692 [ACK] Seq=116960989 Ack=6513109 Win=65535 Len=0
1,3.275832999999693,54.93.77.70,10.0.2.15,TLSv1.2,590,Application Data
1,3.318637999999737,10.0.2.15,54.93.77.70,TCP,54,34692  >  9001 [ACK] Seq=6513109 Ack=116961525 Win=65535 Len=0
1,3.51433599999973,62.210.85.178,10.0.2.15,TLSv1.2,590,Application Data
1,3.5563179999999193,10.0.2.15,62.210.85.178,TCP,54,35978  >  9001 [ACK] Seq=117136261 Ack=6507603 Win=65535 Len=0
1,3.5734189999998307,62.210.85.178,10.0.2.15,TLSv1.2,590,Application Data
1,3.573508999999831,10.0.2.15,62.210.85.178,TCP,54,35978  >  9001 [ACK] Seq=117136261 Ack=6508139 Win=65535 Len=0
1,3.57411299999967,10.0.2.15,62.210.85.178,TLSv1.2,590,Application Data
1,3.5742409999998017,62.210.85.178,10.0.2.15,TCP,60,9001  >  35978 [ACK] Seq=6508139 Ack=117136797 Win=65535 Len=0
1,3.7217289999998684,54.93.77.70,10.0.2.15,TLSv1.2,590,Application Data
1,3.7218250000000808,10.0.2.15,54.93.77.70,TCP,54,34692  >  9001 [ACK] Seq=6513109 Ack=116962061 Win=65535 Len=0
1,3.7223469999998997,10.0.2.15,54.93.77.70,TLSv1.2,590,Application Data
1,3.722498000000087,54.93.77.70,10.0.2.15,TCP,60,9001  >  34692 [ACK] Seq=116962061 Ack=6513645 Win=65535 Len=0
1,3.851705000000038,62.210.85.178,10.0.2.15,TLSv1.2,590,Application Data
1,3.860580000000027,10.0.2.15,62.210.85.178,TLSv1.2,590,Application Data
1,3.8607919999999467,62.210.85.178,10.0.2.15,TCP,60,9001  >  35978 [ACK] Seq=6508675 Ack=117137333 Win=65535 Len=0
1,3.874769000000015,10.0.2.15,62.210.85.178,TLSv1.2,4124,Application Data
1,3.8749159999997573,10.0.2.15,62.210.85.178,TCP,2974,35978  >  9001 [ACK] Seq=117141403 Ack=6508675 Win=65535 Len=2920 [TCP segment of a reassembled PDU]
1,3.8749669999997423,62.210.85.178,10.0.2.15,TCP,60,9001  >  35978 [ACK] Seq=6508675 Ack=117138793 Win=65535 Len=0
1,3.8749800000000505,62.210.85.178,10.0.2.15,TCP,60,9001  >  35978 [ACK] Seq=6508675 Ack=117140253 Win=65535 Len=0
1,3.874984999999924,62.210.85.178,10.0.2.15,TCP,60,9001  >  35978 [ACK] Seq=6508675 Ack=117141403 Win=65535 Len=0
1,3.875028999999813,10.0.2.15,62.210.85.178,TLSv1.2,1204,Application Data
1,3.8750679999998283,62.210.85.178,10.0.2.15,TCP,60,9001  >  35978 [ACK] Seq=6508675 Ack=117142863 Win=65535 Len=0
1,3.875075999999808,62.210.85.178,10.0.2.15,TCP,60,9001  >  35978 [ACK] Seq=6508675 Ack=117144323 Win=65535 Len=0
1,3.8750789999999142,62.210.85.178,10.0.2.15,TCP,60,9001  >  35978 [ACK] Seq=6508675 Ack=117145473 Win=65535 Len=0
1,3.8751219999999194,10.0.2.15,62.210.85.178,TLSv1.2,4124,Application Data
1,3.8751609999999346,62.210.85.178,10.0.2.15,TCP,60,9001  >  35978 [ACK] Seq=6508675 Ack=117146933 Win=65535 Len=0
1,3.8751689999999144,62.210.85.178,10.0.2.15,TCP,60,9001  >  35978 [ACK] Seq=6508675 Ack=117148393 Win=65535 Len=0
1,3.8751729999999043,62.210.85.178,10.0.2.15,TCP,60,9001  >  35978 [ACK] Seq=6508675 Ack=117149543 Win=65535 Len=0
1,3.8752159999999094,10.0.2.15,62.210.85.178,TLSv1.2,4124,Application Data
1,3.875254000000041,62.210.85.178,10.0.2.15,TCP,60,9001  >  35978 [ACK] Seq=6508675 Ack=117151003 Win=65535 Len=0
1,3.8752629999999044,62.210.85.178,10.0.2.15,TCP,60,9001  >  35978 [ACK] Seq=6508675 Ack=117152463 Win=65535 Len=0
1,3.8753249999999753,10.0.2.15,62.210.85.178,TLSv1.2,2974,Application Data
1,3.875365999999758,62.210.85.178,10.0.2.15,TCP,60,9001  >  35978 [ACK] Seq=6508675 Ack=117153613 Win=65535 Len=0
1,3.875372999999854,62.210.85.178,10.0.2.15,TCP,60,9001  >  35978 [ACK] Seq=6508675 Ack=117155073 Win=65535 Len=0
