No.,Time,Source,Destination,Protocol,Length,Info
1,0.19570299999986673,10.0.2.15,54.93.77.70,TLSv1.2,590,Application Data
1,0.19588599999997314,54.93.77.70,10.0.2.15,TCP,60,9001  >  34692 [ACK] Seq=126373985 Ack=6982265 Win=65535 Len=0
1,0.308596999999736,62.210.85.178,10.0.2.15,TLSv1.2,590,Application Data
1,0.30869399999983216,10.0.2.15,62.210.85.178,TCP,54,35978  >  9001 [ACK] Seq=126546697 Ack=6975007 Win=65535 Len=0
1,0.3089929999996457,10.0.2.15,62.210.85.178,TLSv1.2,590,Application Data
1,0.30908499999986816,62.210.85.178,10.0.2.15,TCP,60,9001  >  35978 [ACK] Seq=6975007 Ack=126547233 Win=65535 Len=0
1,0.4134839999996984,54.93.77.70,10.0.2.15,TLSv1.2,590,Application Data
1,0.41355899999962276,10.0.2.15,54.93.77.70,TCP,54,34692  >  9001 [ACK] Seq=6982265 Ack=126374521 Win=65535 Len=0
1,0.41395399999964866,10.0.2.15,54.93.77.70,TLSv1.2,1618,Application Data
1,0.41408400000000256,54.93.77.70,10.0.2.15,TCP,60,9001  >  34692 [ACK] Seq=126374521 Ack=6983725 Win=65535 Len=0
1,0.41409599999997226,54.93.77.70,10.0.2.15,TCP,60,9001  >  34692 [ACK] Seq=126374521 Ack=6983829 Win=65535 Len=0
1,0.505724999999984,62.210.85.178,10.0.2.15,TLSv1.2,1618,Application Data
1,0.5058549999998831,10.0.2.15,62.210.85.178,TCP,54,35978  >  9001 [ACK] Seq=126547233 Ack=6976571 Win=65535 Len=0
1,0.5199509999997645,10.0.2.15,62.210.85.178,TLSv1.2,590,Application Data
1,0.5201439999996182,62.210.85.178,10.0.2.15,TCP,60,9001  >  35978 [ACK] Seq=6976571 Ack=126547769 Win=65535 Len=0
1,0.531912999999804,10.0.2.15,62.210.85.178,TLSv1.2,1618,Application Data
1,0.532057999999779,62.210.85.178,10.0.2.15,TCP,60,9001  >  35978 [ACK] Seq=6976571 Ack=126549229 Win=65535 Len=0
1,0.5320779999997285,62.210.85.178,10.0.2.15,TCP,60,9001  >  35978 [ACK] Seq=6976571 Ack=126549333 Win=65535 Len=0
1,0.6521719999996094,54.93.77.70,10.0.2.15,TLSv1.2,2132,Application Data
1,0.6523049999996147,10.0.2.15,54.93.77.70,TCP,54,34692  >  9001 [ACK] Seq=6983829 Ack=126376599 Win=65535 Len=0
1,0.6542779999999766,10.0.2.15,54.93.77.70,TLSv1.2,590,Application Data
1,0.654453999999987,54.93.77.70,10.0.2.15,TCP,60,9001  >  34692 [ACK] Seq=126376599 Ack=6984365 Win=65535 Len=0
1,0.8306329999995796,62.210.85.178,10.0.2.15,TLSv1.2,590,Application Data
1,0.8309379999996054,10.0.2.15,62.210.85.178,TLSv1.2,590,Application Data
1,0.8310249999999542,62.210.85.178,10.0.2.15,TCP,60,9001  >  35978 [ACK] Seq=6977107 Ack=126549869 Win=65535 Len=0
1,0.9300019999996039,54.93.77.70,10.0.2.15,TLSv1.2,590,Application Data
1,0.9303909999998723,10.0.2.15,54.93.77.70,TLSv1.2,590,Application Data
1,0.9304919999999584,54.93.77.70,10.0.2.15,TCP,60,9001  >  34692 [ACK] Seq=126377135 Ack=6984901 Win=65535 Len=0
1,1.138075999999728,62.210.85.178,10.0.2.15,TLSv1.2,590,Application Data
1,1.1416599999997743,10.0.2.15,62.210.85.178,TLSv1.2,590,Application Data
1,1.1418299999995725,62.210.85.178,10.0.2.15,TCP,60,9001  >  35978 [ACK] Seq=6977643 Ack=126550405 Win=65535 Len=0
1,1.155978999999661,10.0.2.15,62.210.85.178,TLSv1.2,4124,Application Data
1,1.156087999999727,10.0.2.15,62.210.85.178,TCP,2974,35978  >  9001 [ACK] Seq=126554475 Ack=6977643 Win=65535 Len=2920 [TCP segment of a reassembled PDU]
1,1.1561399999995956,62.210.85.178,10.0.2.15,TCP,60,9001  >  35978 [ACK] Seq=6977643 Ack=126551865 Win=65535 Len=0
1,1.15615200000002,62.210.85.178,10.0.2.15,TCP,60,9001  >  35978 [ACK] Seq=6977643 Ack=126553325 Win=65535 Len=0
1,1.1561569999998937,62.210.85.178,10.0.2.15,TCP,60,9001  >  35978 [ACK] Seq=6977643 Ack=126554475 Win=65535 Len=0
1,1.1561999999998989,10.0.2.15,62.210.85.178,TLSv1.2,1204,Application Data
1,1.156238999999914,62.210.85.178,10.0.2.15,TCP,60,9001  >  35978 [ACK] Seq=6977643 Ack=126555935 Win=65535 Len=0
1,1.1562469999998939,62.210.85.178,10.0.2.15,TCP,60,9001  >  35978 [ACK] Seq=6977643 Ack=126557395 Win=65535 Len=0
1,1.1562509999998838,62.210.85.178,10.0.2.15,TCP,60,9001  >  35978 [ACK] Seq=6977643 Ack=126558545 Win=65535 Len=0
1,1.156293999999889,10.0.2.15,62.210.85.178,TLSv1.2,4124,Application Data
1,1.1563349999996717,62.210.85.178,10.0.2.15,TCP,60,9001  >  35978 [ACK] Seq=6977643 Ack=126560005 Win=65535 Len=0
1,1.15634399999999,62.210.85.178,10.0.2.15,TCP,60,9001  >  35978 [ACK] Seq=6977643 Ack=126561465 Win=65535 Len=0
1,1.1563499999997475,62.210.85.178,10.0.2.15,TCP,60,9001  >  35978 [ACK] Seq=6977643 Ack=126562615 Win=65535 Len=0
1,1.1563919999998689,10.0.2.15,62.210.85.178,TLSv1.2,4124,Application Data
1,1.1564599999996972,62.210.85.178,10.0.2.15,TCP,60,9001  >  35978 [ACK] Seq=6977643 Ack=126564075 Win=65535 Len=0
1,1.1564669999997932,62.210.85.178,10.0.2.15,TCP,60,9001  >  35978 [ACK] Seq=6977643 Ack=126565535 Win=65535 Len=0
1,1.1564699999998993,62.210.85.178,10.0.2.15,TCP,60,9001  >  35978 [ACK] Seq=6977643 Ack=126566685 Win=65535 Len=0
1,1.156503999999586,10.0.2.15,62.210.85.178,TLSv1.2,332,Application Data
1,1.1565409999998337,62.210.85.178,10.0.2.15,TCP,60,9001  >  35978 [ACK] Seq=6977643 Ack=126566963 Win=65535 Len=0
1,1.1565959999998086,10.0.2.15,62.210.85.178,TLSv1.2,2646,Application Data
1,1.1566379999999299,62.210.85.178,10.0.2.15,TCP,60,9001  >  35978 [ACK] Seq=6977643 Ack=126568423 Win=65535 Len=0
1,1.1566449999995712,62.210.85.178,10.0.2.15,TCP,60,9001  >  35978 [ACK] Seq=6977643 Ack=126569555 Win=65535 Len=0
1,1.3430679999996755,54.93.77.70,10.0.2.15,TLSv1.2,590,Application Data
1,1.3604269999996177,54.93.77.70,10.0.2.15,TLSv1.2,8742,"Application Data, Application Data"
1,1.3605309999998099,10.0.2.15,54.93.77.70,TCP,54,34692  >  9001 [ACK] Seq=6984901 Ack=126386359 Win=65535 Len=0
1,1.360761999999795,10.0.2.15,54.93.77.70,TLSv1.2,590,Application Data
1,1.360849999999573,54.93.77.70,10.0.2.15,TCP,60,9001  >  34692 [ACK] Seq=126386359 Ack=6985437 Win=65535 Len=0
1,1.3615609999997105,54.93.77.70,10.0.2.15,TLSv1.2,1502,Application Data [TCP segment of a reassembled PDU]
1,1.3616099999999278,10.0.2.15,54.93.77.70,TCP,54,34692  >  9001 [ACK] Seq=6985437 Ack=126387807 Win=65535 Len=0
1,1.37548199999992,54.93.77.70,10.0.2.15,TLSv1.2,2950,Application Data [TCP segment of a reassembled PDU]
1,1.375561999999718,10.0.2.15,54.93.77.70,TCP,54,34692  >  9001 [ACK] Seq=6985437 Ack=126390703 Win=65535 Len=0
1,1.3766429999996035,54.93.77.70,10.0.2.15,TLSv1.2,2950,Application Data [TCP segment of a reassembled PDU]
1,1.3767069999998967,10.0.2.15,54.93.77.70,TCP,54,34692  >  9001 [ACK] Seq=6985437 Ack=126393599 Win=65535 Len=0
1,1.3776829999997062,54.93.77.70,10.0.2.15,TLSv1.2,3298,"Application Data, Application Data"
1,1.3777439999998933,10.0.2.15,54.93.77.70,TCP,54,34692  >  9001 [ACK] Seq=6985437 Ack=126396843 Win=65535 Len=0
1,1.3804129999998622,10.0.2.15,54.93.77.70,TLSv1.2,590,Application Data
1,1.3806119999999282,54.93.77.70,10.0.2.15,TCP,60,9001  >  34692 [ACK] Seq=126396843 Ack=6985973 Win=65535 Len=0
1,1.4713049999995746,62.210.85.178,10.0.2.15,TLSv1.2,590,Application Data
1,1.5148929999995744,10.0.2.15,62.210.85.178,TCP,54,35978  >  9001 [ACK] Seq=126569555 Ack=6978179 Win=65535 Len=0
1,1.5866689999998016,62.210.85.178,10.0.2.15,TLSv1.2,590,Application Data
1,1.5870539999996254,10.0.2.15,62.210.85.178,TCP,54,35978  >  9001 [ACK] Seq=126569555 Ack=6978715 Win=65535 Len=0
1,1.5883789999998044,10.0.2.15,62.210.85.178,TLSv1.2,590,Application Data
1,1.5888829999998961,62.210.85.178,10.0.2.15,TCP,60,9001  >  35978 [ACK] Seq=6978715 Ack=126570091 Win=65535 Len=0
1,1.7521639999999934,54.93.77.70,10.0.2.15,TLSv1.2,590,Application Data
1,1.752715999999964,10.0.2.15,54.93.77.70,TLSv1.2,590,Application Data
1,1.7528579999998328,54.93.77.70,10.0.2.15,TCP,60,9001  >  34692 [ACK] Seq=126397379 Ack=6986509 Win=65535 Len=0
1,1.9573809999997138,62.210.85.178,10.0.2.15,TLSv1.2,590,Application Data
1,1.9632769999998345,10.0.2.15,62.210.85.178,TLSv1.2,590,Application Data
1,1.963437999999769,62.210.85.178,10.0.2.15,TCP,60,9001  >  35978 [ACK] Seq=6979251 Ack=126570627 Win=65535 Len=0
1,1.9763499999999112,10.0.2.15,62.210.85.178,TLSv1.2,4124,Application Data
1,1.9767009999995935,10.0.2.15,62.210.85.178,TCP,2974,35978  >  9001 [ACK] Seq=126574697 Ack=6979251 Win=65535 Len=2920 [TCP segment of a reassembled PDU]
1,1.9768119999998817,62.210.85.178,10.0.2.15,TCP,60,9001  >  35978 [ACK] Seq=6979251 Ack=126572087 Win=65535 Len=0
1,1.9768379999995886,62.210.85.178,10.0.2.15,TCP,60,9001  >  35978 [ACK] Seq=6979251 Ack=126573547 Win=65535 Len=0
1,1.9768449999996847,62.210.85.178,10.0.2.15,TCP,60,9001  >  35978 [ACK] Seq=6979251 Ack=126574697 Win=65535 Len=0
1,1.9769149999997353,10.0.2.15,62.210.85.178,TLSv1.2,1204,Application Data
1,1.976970999999594,62.210.85.178,10.0.2.15,TCP,60,9001  >  35978 [ACK] Seq=6979251 Ack=126576157 Win=65535 Len=0
1,1.9769830000000184,62.210.85.178,10.0.2.15,TCP,60,9001  >  35978 [ACK] Seq=6979251 Ack=126577617 Win=65535 Len=0
1,1.9769859999996697,62.210.85.178,10.0.2.15,TCP,60,9001  >  35978 [ACK] Seq=6979251 Ack=126578767 Win=65535 Len=0
1,1.9770849999999882,10.0.2.15,62.210.85.178,TLSv1.2,4124,Application Data
1,1.9771670000000086,62.210.85.178,10.0.2.15,TCP,60,9001  >  35978 [ACK] Seq=6979251 Ack=126580227 Win=65535 Len=0
1,1.9771779999996397,62.210.85.178,10.0.2.15,TCP,60,9001  >  35978 [ACK] Seq=6979251 Ack=126581687 Win=65535 Len=0
1,1.9771809999997458,62.210.85.178,10.0.2.15,TCP,60,9001  >  35978 [ACK] Seq=6979251 Ack=126582837 Win=65535 Len=0
1,1.9772369999996044,10.0.2.15,62.210.85.178,TLSv1.2,4124,Application Data
1,1.9773699999996097,62.210.85.178,10.0.2.15,TCP,60,9001  >  35978 [ACK] Seq=6979251 Ack=126584297 Win=65535 Len=0
1,1.9773909999998978,62.210.85.178,10.0.2.15,TCP,60,9001  >  35978 [ACK] Seq=6979251 Ack=126585757 Win=65535 Len=0
1,1.9773949999998877,62.210.85.178,10.0.2.15,TCP,60,9001  >  35978 [ACK] Seq=6979251 Ack=126586907 Win=65535 Len=0
1,1.977433000000019,10.0.2.15,62.210.85.178,TLSv1.2,332,Application Data
1,1.9774979999997413,62.210.85.178,10.0.2.15,TCP,60,9001  >  35978 [ACK] Seq=6979251 Ack=126587185 Win=65535 Len=0
1,1.977624999999989,10.0.2.15,62.210.85.178,TLSv1.2,3868,Application Data
1,1.9777429999999185,62.210.85.178,10.0.2.15,TCP,60,9001  >  35978 [ACK] Seq=6979251 Ack=126588645 Win=65535 Len=0
1,1.9777549999998882,62.210.85.178,10.0.2.15,TCP,60,9001  >  35978 [ACK] Seq=6979251 Ack=126590105 Win=65535 Len=0
1,1.9777589999998781,62.210.85.178,10.0.2.15,TCP,60,9001  >  35978 [ACK] Seq=6979251 Ack=126590999 Win=65535 Len=0
1,1.9777979999998934,10.0.2.15,62.210.85.178,TLSv1.2,4124,Application Data
1,1.9778839999999036,62.210.85.178,10.0.2.15,TCP,60,9001  >  35978 [ACK] Seq=6979251 Ack=126592459 Win=65535 Len=0
1,1.977893999999651,62.210.85.178,10.0.2.15,TCP,60,9001  >  35978 [ACK] Seq=6979251 Ack=126593919 Win=65535 Len=0
1,1.977896999999757,62.210.85.178,10.0.2.15,TCP,60,9001  >  35978 [ACK] Seq=6979251 Ack=126595069 Win=65535 Len=0
1,1.9779469999998582,10.0.2.15,62.210.85.178,TLSv1.2,3030,Application Data
1,1.9780029999997168,62.210.85.178,10.0.2.15,TCP,60,9001  >  35978 [ACK] Seq=6979251 Ack=126596529 Win=65535 Len=0
1,1.9780169999999089,62.210.85.178,10.0.2.15,TCP,60,9001  >  35978 [ACK] Seq=6979251 Ack=126597989 Win=65535 Len=0
1,1.9780219999997826,62.210.85.178,10.0.2.15,TCP,60,9001  >  35978 [ACK] Seq=6979251 Ack=126598045 Win=65535 Len=0
1,1.9873389999997926,10.0.2.15,62.210.85.178,TLSv1.2,4124,Application Data
1,1.987449999999626,62.210.85.178,10.0.2.15,TCP,60,9001  >  35978 [ACK] Seq=6979251 Ack=126599505 Win=65535 Len=0
1,1.987463999999818,62.210.85.178,10.0.2.15,TCP,60,9001  >  35978 [ACK] Seq=6979251 Ack=126600965 Win=65535 Len=0
1,1.9874669999999242,62.210.85.178,10.0.2.15,TCP,60,9001  >  35978 [ACK] Seq=6979251 Ack=126602115 Win=65535 Len=0
1,1.987514999999803,10.0.2.15,62.210.85.178,TLSv1.2,4124,Application Data
1,1.9875559999995858,62.210.85.178,10.0.2.15,TCP,60,9001  >  35978 [ACK] Seq=6979251 Ack=126603575 Win=65535 Len=0
1,1.987564999999904,62.210.85.178,10.0.2.15,TCP,60,9001  >  35978 [ACK] Seq=6979251 Ack=126605035 Win=65535 Len=0
1,1.9875699999997778,62.210.85.178,10.0.2.15,TCP,60,9001  >  35978 [ACK] Seq=6979251 Ack=126606185 Win=65535 Len=0
1,1.9876389999999446,10.0.2.15,62.210.85.178,TLSv1.2,4124,Application Data
1,1.9876779999999599,62.210.85.178,10.0.2.15,TCP,60,9001  >  35978 [ACK] Seq=6979251 Ack=126607645 Win=65535 Len=0
1,1.987688999999591,62.210.85.178,10.0.2.15,TCP,60,9001  >  35978 [ACK] Seq=6979251 Ack=126609105 Win=65535 Len=0
1,1.987692999999581,62.210.85.178,10.0.2.15,TCP,60,9001  >  35978 [ACK] Seq=6979251 Ack=126610255 Win=65535 Len=0
1,1.9877309999997124,10.0.2.15,62.210.85.178,TLSv1.2,4124,Application Data
1,1.98776799999996,62.210.85.178,10.0.2.15,TCP,60,9001  >  35978 [ACK] Seq=6979251 Ack=126611715 Win=65535 Len=0
1,1.9877769999998236,62.210.85.178,10.0.2.15,TCP,60,9001  >  35978 [ACK] Seq=6979251 Ack=126613175 Win=65535 Len=0
1,1.9877819999996973,62.210.85.178,10.0.2.15,TCP,60,9001  >  35978 [ACK] Seq=6979251 Ack=126614325 Win=65535 Len=0
1,1.9878159999998388,10.0.2.15,62.210.85.178,TLSv1.2,332,Application Data
1,1.9878539999999703,62.210.85.178,10.0.2.15,TCP,60,9001  >  35978 [ACK] Seq=6979251 Ack=126614603 Win=65535 Len=0
1,1.9879099999998289,10.0.2.15,62.210.85.178,TLSv1.2,3868,Application Data
1,1.9879499999997279,62.210.85.178,10.0.2.15,TCP,60,9001  >  35978 [ACK] Seq=6979251 Ack=126616063 Win=65535 Len=0
1,1.9879579999997077,62.210.85.178,10.0.2.15,TCP,60,9001  >  35978 [ACK] Seq=6979251 Ack=126617523 Win=65535 Len=0
1,1.9879619999996976,62.210.85.178,10.0.2.15,TCP,60,9001  >  35978 [ACK] Seq=6979251 Ack=126618417 Win=65535 Len=0
1,1.987999999999829,10.0.2.15,62.210.85.178,TLSv1.2,4124,Application Data
1,1.9880379999999604,62.210.85.178,10.0.2.15,TCP,60,9001  >  35978 [ACK] Seq=6979251 Ack=126619877 Win=65535 Len=0
1,1.9880459999999402,62.210.85.178,10.0.2.15,TCP,60,9001  >  35978 [ACK] Seq=6979251 Ack=126621337 Win=65535 Len=0
1,1.9880499999999302,62.210.85.178,10.0.2.15,TCP,60,9001  >  35978 [ACK] Seq=6979251 Ack=126622487 Win=65535 Len=0
1,1.9880859999998393,10.0.2.15,62.210.85.178,TLSv1.2,3030,Application Data
1,1.9881259999997383,62.210.85.178,10.0.2.15,TCP,60,9001  >  35978 [ACK] Seq=6979251 Ack=126623947 Win=65535 Len=0
1,1.988133999999718,62.210.85.178,10.0.2.15,TCP,60,9001  >  35978 [ACK] Seq=6979251 Ack=126625407 Win=65535 Len=0
1,1.988137999999708,62.210.85.178,10.0.2.15,TCP,60,9001  >  35978 [ACK] Seq=6979251 Ack=126625463 Win=65535 Len=0
1,1.9974489999999605,10.0.2.15,62.210.85.178,TLSv1.2,3160,Application Data
1,1.997646999999688,62.210.85.178,10.0.2.15,TCP,60,9001  >  35978 [ACK] Seq=6979251 Ack=126626923 Win=65535 Len=0
1,1.9976619999997638,62.210.85.178,10.0.2.15,TCP,60,9001  >  35978 [ACK] Seq=6979251 Ack=126628383 Win=65535 Len=0
1,1.9976669999996375,62.210.85.178,10.0.2.15,TCP,60,9001  >  35978 [ACK] Seq=6979251 Ack=126628569 Win=65535 Len=0
1,2.0782939999999144,54.93.77.70,10.0.2.15,TLSv1.2,590,Application Data
1,2.089100999999573,54.93.77.70,10.0.2.15,TCP,2950,"9001  >  34692 [PSH, ACK] Seq=126397915 Ack=6986509 Win=65535 Len=2896 [TCP segment of a reassembled PDU]"
1,2.089129999999841,54.93.77.70,10.0.2.15,TLSv1.2,2950,Application Data [TCP segment of a reassembled PDU]
1,2.089205999999649,10.0.2.15,54.93.77.70,TCP,54,34692  >  9001 [ACK] Seq=6986509 Ack=126403707 Win=65535 Len=0
1,2.089367999999922,54.93.77.70,10.0.2.15,TLSv1.2,1502,Application Data
1,2.089400999999725,10.0.2.15,54.93.77.70,TCP,54,34692  >  9001 [ACK] Seq=6986509 Ack=126405155 Win=65535 Len=0
1,2.112608999999793,54.93.77.70,10.0.2.15,TCP,2950,"9001  >  34692 [PSH, ACK] Seq=126405155 Ack=6986509 Win=65535 Len=2896 [TCP segment of a reassembled PDU]"
1,2.1126769999996213,10.0.2.15,54.93.77.70,TCP,54,34692  >  9001 [ACK] Seq=6986509 Ack=126408051 Win=65535 Len=0
1,2.1141249999996035,54.93.77.70,10.0.2.15,TLSv1.2,5298,"Application Data, Application Data"
1,2.1141959999999926,10.0.2.15,54.93.77.70,TCP,54,34692  >  9001 [ACK] Seq=6986509 Ack=126413295 Win=65535 Len=0
1,2.130163999999695,54.93.77.70,10.0.2.15,TLSv1.2,204,Application Data
1,2.150941999999759,54.93.77.70,10.0.2.15,TCP,2950,"9001  >  34692 [PSH, ACK] Seq=126413445 Ack=6986509 Win=65535 Len=2896 [TCP segment of a reassembled PDU]"
1,2.151018000000022,10.0.2.15,54.93.77.70,TCP,54,34692  >  9001 [ACK] Seq=6986509 Ack=126416341 Win=65535 Len=0
1,2.165364999999838,54.93.77.70,10.0.2.15,TLSv1.2,2950,Application Data [TCP segment of a reassembled PDU]
1,2.1654219999995803,10.0.2.15,54.93.77.70,TCP,54,34692  >  9001 [ACK] Seq=6986509 Ack=126419237 Win=65535 Len=0
1,2.1654679999996915,54.93.77.70,10.0.2.15,TCP,1502,"9001  >  34692 [PSH, ACK] Seq=126419237 Ack=6986509 Win=65535 Len=1448 [TCP segment of a reassembled PDU]"
1,2.165516999999909,10.0.2.15,54.93.77.70,TCP,54,34692  >  9001 [ACK] Seq=6986509 Ack=126420685 Win=65535 Len=0
1,2.1658989999996265,54.93.77.70,10.0.2.15,TLSv1.2,2950,Application Data [TCP segment of a reassembled PDU]
1,2.1659389999999803,10.0.2.15,54.93.77.70,TCP,54,34692  >  9001 [ACK] Seq=6986509 Ack=126423581 Win=65535 Len=0
1,2.1676869999996597,54.93.77.70,10.0.2.15,TLSv1.2,264,Application Data
1,2.1678179999998974,10.0.2.15,54.93.77.70,TLSv1.2,590,Application Data
1,2.1678969999998117,54.93.77.70,10.0.2.15,TCP,60,9001  >  34692 [ACK] Seq=126423791 Ack=6987045 Win=65535 Len=0
1,2.1851919999999154,54.93.77.70,10.0.2.15,TLSv1.2,7808,"Application Data, Application Data"
1,2.1852850000000217,10.0.2.15,54.93.77.70,TCP,54,34692  >  9001 [ACK] Seq=6987045 Ack=126431545 Win=65535 Len=0
1,2.2022689999998875,54.93.77.70,10.0.2.15,TCP,2950,"9001  >  34692 [PSH, ACK] Seq=126431545 Ack=6987045 Win=65535 Len=2896 [TCP segment of a reassembled PDU]"
1,2.202320999999756,54.93.77.70,10.0.2.15,TLSv1.2,3884,"Application Data, Application Data"
1,2.2023709999998573,10.0.2.15,54.93.77.70,TCP,54,34692  >  9001 [ACK] Seq=6987045 Ack=126434441 Win=65535 Len=0
1,2.202479999999923,10.0.2.15,54.93.77.70,TCP,54,34692  >  9001 [ACK] Seq=6987045 Ack=126438271 Win=65535 Len=0
1,2.2027209999996558,10.0.2.15,54.93.77.70,TLSv1.2,590,Application Data
1,2.202802999999676,54.93.77.70,10.0.2.15,TCP,60,9001  >  34692 [ACK] Seq=126438271 Ack=6987581 Win=65535 Len=0
1,2.2231889999998202,54.93.77.70,10.0.2.15,TLSv1.2,4398,Application Data
1,2.2236109999998916,10.0.2.15,54.93.77.70,TCP,54,34692  >  9001 [ACK] Seq=6987581 Ack=126442615 Win=65535 Len=0
1,2.22434099999964,54.93.77.70,10.0.2.15,TLSv1.2,8194,"Application Data, Application Data"
1,2.2248579999995854,10.0.2.15,54.93.77.70,TCP,54,34692  >  9001 [ACK] Seq=6987581 Ack=126450755 Win=65535 Len=0
1,2.225087999999687,54.93.77.70,10.0.2.15,TCP,1502,"9001  >  34692 [PSH, ACK] Seq=126450755 Ack=6987581 Win=65535 Len=1448 [TCP segment of a reassembled PDU]"
1,2.225224999999682,10.0.2.15,54.93.77.70,TCP,54,34692  >  9001 [ACK] Seq=6987581 Ack=126452203 Win=65535 Len=0
1,2.225586000000021,10.0.2.15,54.93.77.70,TLSv1.2,590,Application Data
1,2.225716999999804,54.93.77.70,10.0.2.15,TCP,60,9001  >  34692 [ACK] Seq=126452203 Ack=6988117 Win=65535 Len=0
1,2.2404869999995753,54.93.77.70,10.0.2.15,TLSv1.2,88,Application Data
1,2.259233999999651,54.93.77.70,10.0.2.15,TCP,2950,"9001  >  34692 [PSH, ACK] Seq=126452237 Ack=6988117 Win=65535 Len=2896 [TCP segment of a reassembled PDU]"
1,2.2593259999998736,10.0.2.15,54.93.77.70,TCP,54,34692  >  9001 [ACK] Seq=6988117 Ack=126455133 Win=65535 Len=0
1,2.275977999999668,54.93.77.70,10.0.2.15,TLSv1.2,778,Application Data
1,2.2791089999996075,10.0.2.15,54.93.77.70,TLSv1.2,590,Application Data
1,2.279345999999805,54.93.77.70,10.0.2.15,TCP,60,9001  >  34692 [ACK] Seq=126455857 Ack=6988653 Win=65535 Len=0
1,2.2808539999996356,62.210.85.178,10.0.2.15,TLSv1.2,590,Application Data
1,2.316458999999668,62.210.85.178,10.0.2.15,TLSv1.2,590,Application Data
1,2.316573999999946,10.0.2.15,62.210.85.178,TCP,54,35978  >  9001 [ACK] Seq=126628569 Ack=6980323 Win=65535 Len=0
1,2.348797999999988,62.210.85.178,10.0.2.15,TLSv1.2,590,Application Data
1,2.390965999999935,10.0.2.15,62.210.85.178,TCP,54,35978  >  9001 [ACK] Seq=126628569 Ack=6980859 Win=65535 Len=0
1,2.400804999999764,62.210.85.178,10.0.2.15,TLSv1.2,590,Application Data
1,2.400858999999855,10.0.2.15,62.210.85.178,TCP,54,35978  >  9001 [ACK] Seq=126628569 Ack=6981395 Win=65535 Len=0
1,2.4011359999999513,10.0.2.15,62.210.85.178,TLSv1.2,590,Application Data
1,2.4012189999998554,62.210.85.178,10.0.2.15,TCP,60,9001  >  35978 [ACK] Seq=6981395 Ack=126629105 Win=65535 Len=0
1,2.5712439999997514,54.93.77.70,10.0.2.15,TLSv1.2,590,Application Data
1,2.5717839999997523,10.0.2.15,54.93.77.70,TLSv1.2,590,Application Data
1,2.5719169999997575,54.93.77.70,10.0.2.15,TCP,60,9001  >  34692 [ACK] Seq=126456393 Ack=6989189 Win=65535 Len=0
1,2.7765129999997953,62.210.85.178,10.0.2.15,TLSv1.2,590,Application Data
1,2.793409999999767,10.0.2.15,62.210.85.178,TLSv1.2,590,Application Data
1,2.793604999999843,62.210.85.178,10.0.2.15,TCP,60,9001  >  35978 [ACK] Seq=6981931 Ack=126629641 Win=65535 Len=0
1,2.8090869999996357,10.0.2.15,62.210.85.178,TLSv1.2,4124,Application Data
1,2.809218999999757,10.0.2.15,62.210.85.178,TCP,2974,35978  >  9001 [ACK] Seq=126633711 Ack=6981931 Win=65535 Len=2920 [TCP segment of a reassembled PDU]
1,2.8092689999998584,62.210.85.178,10.0.2.15,TCP,60,9001  >  35978 [ACK] Seq=6981931 Ack=126631101 Win=65535 Len=0
1,2.8092829999995956,62.210.85.178,10.0.2.15,TCP,60,9001  >  35978 [ACK] Seq=6981931 Ack=126632561 Win=65535 Len=0
1,2.809287999999924,62.210.85.178,10.0.2.15,TCP,60,9001  >  35978 [ACK] Seq=6981931 Ack=126633711 Win=65535 Len=0
1,2.809291999999914,62.210.85.178,10.0.2.15,TCP,60,9001  >  35978 [ACK] Seq=6981931 Ack=126635171 Win=65535 Len=0
1,2.80929500000002,62.210.85.178,10.0.2.15,TCP,60,9001  >  35978 [ACK] Seq=6981931 Ack=126636631 Win=65535 Len=0
1,2.809330999999929,10.0.2.15,62.210.85.178,TLSv1.2,1204,Application Data
1,2.809403999999631,10.0.2.15,62.210.85.178,TCP,2974,35978  >  9001 [ACK] Seq=126637781 Ack=6981931 Win=65535 Len=2920 [TCP segment of a reassembled PDU]
1,2.809483,62.210.85.178,10.0.2.15,TCP,60,9001  >  35978 [ACK] Seq=6981931 Ack=126637781 Win=65535 Len=0
1,2.80949499999997,62.210.85.178,10.0.2.15,TCP,60,9001  >  35978 [ACK] Seq=6981931 Ack=126639241 Win=65535 Len=0
1,2.8094999999998436,62.210.85.178,10.0.2.15,TCP,60,9001  >  35978 [ACK] Seq=6981931 Ack=126640701 Win=65535 Len=0
1,2.809533999999985,10.0.2.15,62.210.85.178,TLSv1.2,1204,Application Data
1,2.809602999999697,10.0.2.15,62.210.85.178,TCP,2974,35978  >  9001 [ACK] Seq=126641851 Ack=6981931 Win=65535 Len=2920 [TCP segment of a reassembled PDU]
1,2.8096379999997225,62.210.85.178,10.0.2.15,TCP,60,9001  >  35978 [ACK] Seq=6981931 Ack=126641851 Win=65535 Len=0
1,2.8096459999997023,62.210.85.178,10.0.2.15,TCP,60,9001  >  35978 [ACK] Seq=6981931 Ack=126643311 Win=65535 Len=0
1,2.8096499999996922,62.210.85.178,10.0.2.15,TCP,60,9001  >  35978 [ACK] Seq=6981931 Ack=126644771 Win=65535 Len=0
1,2.80967499999997,10.0.2.15,62.210.85.178,TLSv1.2,1204,Application Data
1,2.809745000000021,62.210.85.178,10.0.2.15,TCP,60,9001  >  35978 [ACK] Seq=6981931 Ack=126645921 Win=65535 Len=0
1,2.809773999999834,10.0.2.15,62.210.85.178,TLSv1.2,332,Application Data
1,2.809806999999637,62.210.85.178,10.0.2.15,TCP,60,9001  >  35978 [ACK] Seq=6981931 Ack=126646199 Win=65535 Len=0
1,2.809856999999738,10.0.2.15,62.210.85.178,TLSv1.2,3868,Application Data
1,2.8098939999999857,62.210.85.178,10.0.2.15,TCP,60,9001  >  35978 [ACK] Seq=6981931 Ack=126647659 Win=65535 Len=0
1,2.809900999999627,62.210.85.178,10.0.2.15,TCP,60,9001  >  35978 [ACK] Seq=6981931 Ack=126649119 Win=65535 Len=0
1,2.809903999999733,62.210.85.178,10.0.2.15,TCP,60,9001  >  35978 [ACK] Seq=6981931 Ack=126650013 Win=65535 Len=0
1,2.8099409999999807,10.0.2.15,62.210.85.178,TLSv1.2,4124,Application Data
1,2.809976000000006,62.210.85.178,10.0.2.15,TCP,60,9001  >  35978 [ACK] Seq=6981931 Ack=126651473 Win=65535 Len=0
1,2.8099819999997635,62.210.85.178,10.0.2.15,TCP,60,9001  >  35978 [ACK] Seq=6981931 Ack=126652933 Win=65535 Len=0
1,2.8099849999998696,62.210.85.178,10.0.2.15,TCP,60,9001  >  35978 [ACK] Seq=6981931 Ack=126654083 Win=65535 Len=0
1,2.810019999999895,10.0.2.15,62.210.85.178,TLSv1.2,3030,Application Data
1,2.8100539999995817,62.210.85.178,10.0.2.15,TCP,60,9001  >  35978 [ACK] Seq=6981931 Ack=126655543 Win=65535 Len=0
1,2.810059999999794,62.210.85.178,10.0.2.15,TCP,60,9001  >  35978 [ACK] Seq=6981931 Ack=126657003 Win=65535 Len=0
1,2.8100629999999,62.210.85.178,10.0.2.15,TCP,60,9001  >  35978 [ACK] Seq=6981931 Ack=126657059 Win=65535 Len=0
1,2.8239159999998265,10.0.2.15,62.210.85.178,TLSv1.2,4124,Application Data
1,2.8242159999999785,62.210.85.178,10.0.2.15,TCP,60,9001  >  35978 [ACK] Seq=6981931 Ack=126658519 Win=65535 Len=0
1,2.824265999999625,62.210.85.178,10.0.2.15,TCP,60,9001  >  35978 [ACK] Seq=6981931 Ack=126659979 Win=65535 Len=0
1,2.824271999999837,62.210.85.178,10.0.2.15,TCP,60,9001  >  35978 [ACK] Seq=6981931 Ack=126661129 Win=65535 Len=0
1,2.824370999999701,10.0.2.15,62.210.85.178,TLSv1.2,4124,Application Data
1,2.8244869999998627,10.0.2.15,62.210.85.178,TCP,2974,35978  >  9001 [ACK] Seq=126665199 Ack=6981931 Win=65535 Len=2920 [TCP segment of a reassembled PDU]
1,2.8245679999999993,62.210.85.178,10.0.2.15,TCP,60,9001  >  35978 [ACK] Seq=6981931 Ack=126662589 Win=65535 Len=0
1,2.8245789999996305,62.210.85.178,10.0.2.15,TCP,60,9001  >  35978 [ACK] Seq=6981931 Ack=126664049 Win=65535 Len=0
1,2.824583999999959,62.210.85.178,10.0.2.15,TCP,60,9001  >  35978 [ACK] Seq=6981931 Ack=126665199 Win=65535 Len=0
1,2.8245889999998326,62.210.85.178,10.0.2.15,TCP,60,9001  >  35978 [ACK] Seq=6981931 Ack=126666659 Win=65535 Len=0
1,2.8245929999998225,62.210.85.178,10.0.2.15,TCP,60,9001  >  35978 [ACK] Seq=6981931 Ack=126668119 Win=65535 Len=0
1,2.8246619999999893,10.0.2.15,62.210.85.178,TLSv1.2,1204,Application Data
1,2.8248139999996056,10.0.2.15,62.210.85.178,TCP,2974,35978  >  9001 [ACK] Seq=126669269 Ack=6981931 Win=65535 Len=2920 [TCP segment of a reassembled PDU]
1,2.824843999999757,62.210.85.178,10.0.2.15,TCP,60,9001  >  35978 [ACK] Seq=6981931 Ack=126669269 Win=65535 Len=0
1,2.824887999999646,10.0.2.15,62.210.85.178,TLSv1.2,1204,Application Data
1,2.824952999999823,62.210.85.178,10.0.2.15,TCP,60,9001  >  35978 [ACK] Seq=6981931 Ack=126670729 Win=65535 Len=0
1,2.8249619999996867,62.210.85.178,10.0.2.15,TCP,60,9001  >  35978 [ACK] Seq=6981931 Ack=126672189 Win=65535 Len=0
1,2.824967000000015,62.210.85.178,10.0.2.15,TCP,60,9001  >  35978 [ACK] Seq=6981931 Ack=126673339 Win=65535 Len=0
1,2.82502199999999,10.0.2.15,62.210.85.178,TLSv1.2,332,Application Data
1,2.825133999999707,62.210.85.178,10.0.2.15,TCP,60,9001  >  35978 [ACK] Seq=6981931 Ack=126673617 Win=65535 Len=0
1,2.825238999999783,10.0.2.15,62.210.85.178,TLSv1.2,3868,Application Data
1,2.8253759999997783,62.210.85.178,10.0.2.15,TCP,60,9001  >  35978 [ACK] Seq=6981931 Ack=126675077 Win=65535 Len=0
1,2.8253899999999703,62.210.85.178,10.0.2.15,TCP,60,9001  >  35978 [ACK] Seq=6981931 Ack=126676537 Win=65535 Len=0
1,2.825394999999844,62.210.85.178,10.0.2.15,TCP,60,9001  >  35978 [ACK] Seq=6981931 Ack=126677431 Win=65535 Len=0
1,2.825430999999753,10.0.2.15,62.210.85.178,TCP,2974,35978  >  9001 [ACK] Seq=126677431 Ack=6981931 Win=65535 Len=2920 [TCP segment of a reassembled PDU]
1,2.8255519999997887,62.210.85.178,10.0.2.15,TCP,60,9001  >  35978 [ACK] Seq=6981931 Ack=126678891 Win=65535 Len=0
1,2.825583999999708,62.210.85.178,10.0.2.15,TCP,60,9001  >  35978 [ACK] Seq=6981931 Ack=126680351 Win=65535 Len=0
1,2.8258639999999104,10.0.2.15,62.210.85.178,TLSv1.2,1204,Application Data
1,2.8260439999999107,62.210.85.178,10.0.2.15,TCP,60,9001  >  35978 [ACK] Seq=6981931 Ack=126681501 Win=65535 Len=0
1,2.8261329999995723,10.0.2.15,62.210.85.178,TLSv1.2,3030,Application Data
1,2.826205999999729,62.210.85.178,10.0.2.15,TCP,60,9001  >  35978 [ACK] Seq=6981931 Ack=126682961 Win=65535 Len=0
1,2.8262149999995927,62.210.85.178,10.0.2.15,TCP,60,9001  >  35978 [ACK] Seq=6981931 Ack=126684421 Win=65535 Len=0
1,2.826219999999921,62.210.85.178,10.0.2.15,TCP,60,9001  >  35978 [ACK] Seq=6981931 Ack=126684477 Win=65535 Len=0
1,2.835479999999734,10.0.2.15,62.210.85.178,TLSv1.2,4124,Application Data
1,2.8356269999999313,62.210.85.178,10.0.2.15,TCP,60,9001  >  35978 [ACK] Seq=6981931 Ack=126685937 Win=65535 Len=0
1,2.835642000000007,62.210.85.178,10.0.2.15,TCP,60,9001  >  35978 [ACK] Seq=6981931 Ack=126687397 Win=65535 Len=0
1,2.835645999999997,62.210.85.178,10.0.2.15,TCP,60,9001  >  35978 [ACK] Seq=6981931 Ack=126688547 Win=65535 Len=0
1,2.8356999999996333,10.0.2.15,62.210.85.178,TLSv1.2,4124,Application Data
1,2.8357429999996384,62.210.85.178,10.0.2.15,TCP,60,9001  >  35978 [ACK] Seq=6981931 Ack=126690007 Win=65535 Len=0
1,2.8357499999997344,62.210.85.178,10.0.2.15,TCP,60,9001  >  35978 [ACK] Seq=6981931 Ack=126691467 Win=65535 Len=0
1,2.835754999999608,62.210.85.178,10.0.2.15,TCP,60,9001  >  35978 [ACK] Seq=6981931 Ack=126692617 Win=65535 Len=0
1,2.8357999999998356,10.0.2.15,62.210.85.178,TLSv1.2,4124,Application Data
1,2.8358409999996184,62.210.85.178,10.0.2.15,TCP,60,9001  >  35978 [ACK] Seq=6981931 Ack=126694077 Win=65535 Len=0
1,2.8358469999998306,62.210.85.178,10.0.2.15,TCP,60,9001  >  35978 [ACK] Seq=6981931 Ack=126695537 Win=65535 Len=0
1,2.8358519999997043,62.210.85.178,10.0.2.15,TCP,60,9001  >  35978 [ACK] Seq=6981931 Ack=126696687 Win=65535 Len=0
1,2.8358949999997094,10.0.2.15,62.210.85.178,TLSv1.2,4124,Application Data
1,2.8359369999998307,62.210.85.178,10.0.2.15,TCP,60,9001  >  35978 [ACK] Seq=6981931 Ack=126698147 Win=65535 Len=0
1,2.8359439999999267,62.210.85.178,10.0.2.15,TCP,60,9001  >  35978 [ACK] Seq=6981931 Ack=126699607 Win=65535 Len=0
1,2.8359479999999166,62.210.85.178,10.0.2.15,TCP,60,9001  >  35978 [ACK] Seq=6981931 Ack=126700757 Win=65535 Len=0
1,2.8359889999996994,10.0.2.15,62.210.85.178,TLSv1.2,332,Application Data
1,2.836061999999856,62.210.85.178,10.0.2.15,TCP,60,9001  >  35978 [ACK] Seq=6981931 Ack=126701035 Win=65535 Len=0
1,2.8361149999996087,10.0.2.15,62.210.85.178,TLSv1.2,3868,Application Data
1,2.8361559999998462,62.210.85.178,10.0.2.15,TCP,60,9001  >  35978 [ACK] Seq=6981931 Ack=126702495 Win=65535 Len=0
1,2.8361629999999423,62.210.85.178,10.0.2.15,TCP,60,9001  >  35978 [ACK] Seq=6981931 Ack=126703955 Win=65535 Len=0
1,2.836167999999816,62.210.85.178,10.0.2.15,TCP,60,9001  >  35978 [ACK] Seq=6981931 Ack=126704849 Win=65535 Len=0
1,2.836214999999811,10.0.2.15,62.210.85.178,TLSv1.2,3994,Application Data
1,2.8362709999996696,62.210.85.178,10.0.2.15,TCP,60,9001  >  35978 [ACK] Seq=6981931 Ack=126706309 Win=65535 Len=0
1,2.8362849999998616,62.210.85.178,10.0.2.15,TCP,60,9001  >  35978 [ACK] Seq=6981931 Ack=126707769 Win=65535 Len=0
1,2.8362899999997353,62.210.85.178,10.0.2.15,TCP,60,9001  >  35978 [ACK] Seq=6981931 Ack=126708789 Win=65535 Len=0
1,2.9143199999998615,54.93.77.70,10.0.2.15,TLSv1.2,590,Application Data
1,2.9380199999995966,54.93.77.70,10.0.2.15,TCP,2950,"9001  >  34692 [PSH, ACK] Seq=126456929 Ack=6989189 Win=65535 Len=2896 [TCP segment of a reassembled PDU]"
1,2.9381369999996423,10.0.2.15,54.93.77.70,TCP,54,34692  >  9001 [ACK] Seq=6989189 Ack=126459825 Win=65535 Len=0
1,2.949667999999747,54.93.77.70,10.0.2.15,TLSv1.2,2950,Application Data [TCP segment of a reassembled PDU]
1,2.9496909999998024,54.93.77.70,10.0.2.15,TLSv1.2,7294,"Application Data, Application Data"
1,2.94974000000002,10.0.2.15,54.93.77.70,TCP,54,34692  >  9001 [ACK] Seq=6989189 Ack=126462721 Win=65535 Len=0
1,2.9498329999996713,10.0.2.15,54.93.77.70,TCP,54,34692  >  9001 [ACK] Seq=6989189 Ack=126469961 Win=65535 Len=0
1,2.9578950000000077,54.93.77.70,10.0.2.15,TLSv1.2,6150,"Application Data, Application Data"
1,2.957958999999846,10.0.2.15,54.93.77.70,TCP,54,34692  >  9001 [ACK] Seq=6989189 Ack=126476057 Win=65535 Len=0
1,2.969633999999587,54.93.77.70,10.0.2.15,TCP,2950,"9001  >  34692 [PSH, ACK] Seq=126476057 Ack=6989189 Win=65535 Len=2896 [TCP segment of a reassembled PDU]"
1,2.9696869999997944,10.0.2.15,54.93.77.70,TCP,54,34692  >  9001 [ACK] Seq=6989189 Ack=126478953 Win=65535 Len=0
1,2.9743209999996907,54.93.77.70,10.0.2.15,TLSv1.2,778,Application Data
1,2.990979999999581,54.93.77.70,10.0.2.15,TLSv1.2,2950,Application Data
1,2.9910839999997734,10.0.2.15,54.93.77.70,TCP,54,34692  >  9001 [ACK] Seq=6989189 Ack=126482573 Win=65535 Len=0
1,2.991845000000012,54.93.77.70,10.0.2.15,TLSv1.2,8742,"Application Data, Application Data"
1,2.991960999999719,10.0.2.15,54.93.77.70,TCP,54,34692  >  9001 [ACK] Seq=6989189 Ack=126491261 Win=65535 Len=0
1,2.99212499999976,10.0.2.15,54.93.77.70,TLSv1.2,590,Application Data
1,2.992236999999932,54.93.77.70,10.0.2.15,TCP,60,9001  >  34692 [ACK] Seq=126491261 Ack=6989725 Win=65535 Len=0
1,2.997146999999586,54.93.77.70,10.0.2.15,TLSv1.2,2950,Application Data [TCP segment of a reassembled PDU]
1,2.997164999999768,54.93.77.70,10.0.2.15,TLSv1.2,2950,Application Data [TCP segment of a reassembled PDU]
1,2.997200999999677,10.0.2.15,54.93.77.70,TCP,54,34692  >  9001 [ACK] Seq=6989725 Ack=126494157 Win=65535 Len=0
1,2.9972759999996015,10.0.2.15,54.93.77.70,TCP,54,34692  >  9001 [ACK] Seq=6989725 Ack=126497053 Win=65535 Len=0
1,2.9978699999996934,54.93.77.70,10.0.2.15,TLSv1.2,4398,Application Data [TCP segment of a reassembled PDU]
1,2.997910999999931,10.0.2.15,54.93.77.70,TCP,54,34692  >  9001 [ACK] Seq=6989725 Ack=126501397 Win=65535 Len=0
1,3.002194999999574,10.0.2.15,54.93.77.70,TLSv1.2,590,Application Data
1,3.0022869999997965,54.93.77.70,10.0.2.15,TCP,60,9001  >  34692 [ACK] Seq=126501397 Ack=6990261 Win=65535 Len=0
1,3.008990999999696,54.93.77.70,10.0.2.15,TLSv1.2,1104,Application Data
1,3.016092999999728,54.93.77.70,10.0.2.15,TCP,2950,"9001  >  34692 [PSH, ACK] Seq=126502447 Ack=6990261 Win=65535 Len=2896 [TCP segment of a reassembled PDU]"
1,3.0161169999996673,54.93.77.70,10.0.2.15,TLSv1.2,1502,Application Data [TCP segment of a reassembled PDU]
1,3.0161809999999605,10.0.2.15,54.93.77.70,TCP,54,34692  >  9001 [ACK] Seq=6990261 Ack=126506791 Win=65535 Len=0
1,3.0165899999997237,54.93.77.70,10.0.2.15,TCP,2950,"9001  >  34692 [PSH, ACK] Seq=126506791 Ack=6990261 Win=65535 Len=2896 [TCP segment of a reassembled PDU]"
1,3.016630999999961,10.0.2.15,54.93.77.70,TCP,54,34692  >  9001 [ACK] Seq=6990261 Ack=126509687 Win=65535 Len=0
1,3.0276929999999993,54.93.77.70,10.0.2.15,TLSv1.2,2950,Application Data [TCP segment of a reassembled PDU]
1,3.027733999999782,10.0.2.15,54.93.77.70,TCP,54,34692  >  9001 [ACK] Seq=6990261 Ack=126512583 Win=65535 Len=0
1,3.0278949999997167,10.0.2.15,54.93.77.70,TLSv1.2,590,Application Data
1,3.0279719999998633,54.93.77.70,10.0.2.15,TCP,60,9001  >  34692 [ACK] Seq=126512583 Ack=6990797 Win=65535 Len=0
1,3.029389999999694,54.93.77.70,10.0.2.15,TLSv1.2,7294,"Application Data, Application Data"
1,3.029457999999977,10.0.2.15,54.93.77.70,TCP,54,34692  >  9001 [ACK] Seq=6990797 Ack=126519823 Win=65535 Len=0
1,3.0323089999997137,54.93.77.70,10.0.2.15,TLSv1.2,264,Application Data
1,3.0627549999999246,54.93.77.70,10.0.2.15,TCP,2950,"9001  >  34692 [PSH, ACK] Seq=126520033 Ack=6990797 Win=65535 Len=2896 [TCP segment of a reassembled PDU]"
1,3.0627979999999297,54.93.77.70,10.0.2.15,TLSv1.2,7294,"Application Data, Application Data"
1,3.0628539999997884,10.0.2.15,54.93.77.70,TCP,54,34692  >  9001 [ACK] Seq=6990797 Ack=126522929 Win=65535 Len=0
1,3.0629829999998037,10.0.2.15,54.93.77.70,TCP,54,34692  >  9001 [ACK] Seq=6990797 Ack=126530169 Win=65535 Len=0
1,3.0792349999996986,54.93.77.70,10.0.2.15,TLSv1.2,1292,Application Data
1,3.083835999999792,54.93.77.70,10.0.2.15,TCP,2950,"9001  >  34692 [PSH, ACK] Seq=126531407 Ack=6990797 Win=65535 Len=2896 [TCP segment of a reassembled PDU]"
1,3.0839539999997214,10.0.2.15,54.93.77.70,TCP,54,34692  >  9001 [ACK] Seq=6990797 Ack=126534303 Win=65535 Len=0
1,3.084176999999727,54.93.77.70,10.0.2.15,TLSv1.2,1502,Application Data [TCP segment of a reassembled PDU]
1,3.084229999999934,10.0.2.15,54.93.77.70,TCP,54,34692  >  9001 [ACK] Seq=6990797 Ack=126535751 Win=65535 Len=0
1,3.084455999999591,10.0.2.15,54.93.77.70,TLSv1.2,590,Application Data
1,3.0845339999996213,54.93.77.70,10.0.2.15,TCP,60,9001  >  34692 [ACK] Seq=126535751 Ack=6991333 Win=65535 Len=0
1,3.1014249999998356,54.93.77.70,10.0.2.15,TLSv1.2,380,Application Data
1,3.101556999999957,62.210.85.178,10.0.2.15,TLSv1.2,590,Application Data
1,3.107228999999734,10.0.2.15,54.93.77.70,TLSv1.2,590,Application Data
1,3.1077189999996335,54.93.77.70,10.0.2.15,TCP,60,9001  >  34692 [ACK] Seq=126536077 Ack=6991869 Win=65535 Len=0
1,3.143011999999999,10.0.2.15,62.210.85.178,TCP,54,35978  >  9001 [ACK] Seq=126708789 Ack=6982467 Win=65535 Len=0
1,3.2415139999998246,62.210.85.178,10.0.2.15,TLSv1.2,1618,Application Data
1,3.241592999999739,10.0.2.15,62.210.85.178,TCP,54,35978  >  9001 [ACK] Seq=126708789 Ack=6984031 Win=65535 Len=0
1,3.2608149999996385,62.210.85.178,10.0.2.15,TLSv1.2,590,Application Data
1,3.260863999999856,10.0.2.15,62.210.85.178,TCP,54,35978  >  9001 [ACK] Seq=126708789 Ack=6984567 Win=65535 Len=0
1,3.261298999999781,10.0.2.15,62.210.85.178,TLSv1.2,590,Application Data
1,3.261395999999877,62.210.85.178,10.0.2.15,TCP,60,9001  >  35978 [ACK] Seq=6984567 Ack=126709325 Win=65535 Len=0
1,3.3745739999999387,54.93.77.70,10.0.2.15,TLSv1.2,590,Application Data
1,3.374970999999732,10.0.2.15,54.93.77.70,TLSv1.2,590,Application Data
1,3.375087999999778,54.93.77.70,10.0.2.15,TCP,60,9001  >  34692 [ACK] Seq=126536613 Ack=6992405 Win=65535 Len=0
1,3.487043999999969,62.210.85.178,10.0.2.15,TLSv1.2,590,Application Data
1,3.494854999999916,10.0.2.15,62.210.85.178,TLSv1.2,590,Application Data
1,3.495024999999714,62.210.85.178,10.0.2.15,TCP,60,9001  >  35978 [ACK] Seq=6985103 Ack=126709861 Win=65535 Len=0
1,3.509480999999596,10.0.2.15,62.210.85.178,TLSv1.2,4124,Application Data
1,3.50970099999995,62.210.85.178,10.0.2.15,TCP,60,9001  >  35978 [ACK] Seq=6985103 Ack=126711321 Win=65535 Len=0
1,3.5097209999998995,62.210.85.178,10.0.2.15,TCP,60,9001  >  35978 [ACK] Seq=6985103 Ack=126712781 Win=65535 Len=0
1,3.5097279999999955,62.210.85.178,10.0.2.15,TCP,60,9001  >  35978 [ACK] Seq=6985103 Ack=126713931 Win=65535 Len=0
1,3.509863999999652,10.0.2.15,62.210.85.178,TLSv1.2,4124,Application Data
1,3.509980999999698,62.210.85.178,10.0.2.15,TCP,60,9001  >  35978 [ACK] Seq=6985103 Ack=126715391 Win=65535 Len=0
1,3.5099929999996675,62.210.85.178,10.0.2.15,TCP,60,9001  >  35978 [ACK] Seq=6985103 Ack=126716851 Win=65535 Len=0
1,3.5099969999996574,62.210.85.178,10.0.2.15,TCP,60,9001  >  35978 [ACK] Seq=6985103 Ack=126718001 Win=65535 Len=0
1,3.5100579999998445,10.0.2.15,62.210.85.178,TLSv1.2,4124,Application Data
1,3.5101409999997486,62.210.85.178,10.0.2.15,TCP,60,9001  >  35978 [ACK] Seq=6985103 Ack=126719461 Win=65535 Len=0
1,3.510149999999612,62.210.85.178,10.0.2.15,TCP,60,9001  >  35978 [ACK] Seq=6985103 Ack=126720921 Win=65535 Len=0
1,3.510153999999602,62.210.85.178,10.0.2.15,TCP,60,9001  >  35978 [ACK] Seq=6985103 Ack=126722071 Win=65535 Len=0
1,3.510204999999587,10.0.2.15,62.210.85.178,TLSv1.2,4124,Application Data
1,3.5103769999996075,62.210.85.178,10.0.2.15,TCP,60,9001  >  35978 [ACK] Seq=6985103 Ack=126723531 Win=65535 Len=0
1,3.5103919999996833,62.210.85.178,10.0.2.15,TCP,60,9001  >  35978 [ACK] Seq=6985103 Ack=126724991 Win=65535 Len=0
1,3.5103970000000118,62.210.85.178,10.0.2.15,TCP,60,9001  >  35978 [ACK] Seq=6985103 Ack=126726141 Win=65535 Len=0
1,3.5104389999996783,10.0.2.15,62.210.85.178,TLSv1.2,332,Application Data
1,3.5105039999998553,62.210.85.178,10.0.2.15,TCP,60,9001  >  35978 [ACK] Seq=6985103 Ack=126726419 Win=65535 Len=0
1,3.5105899999998655,10.0.2.15,62.210.85.178,TLSv1.2,3868,Application Data
1,3.510663999999906,62.210.85.178,10.0.2.15,TCP,60,9001  >  35978 [ACK] Seq=6985103 Ack=126727879 Win=65535 Len=0
