No.,Time,Source,Destination,Protocol,Length,Info
1,0.005089999999995598,10.0.2.15,54.93.77.70,TCP,54,34692  >  9001 [ACK] Seq=435609 Ack=7499317 Win=65535 Len=0
1,0.23913500000000454,10.0.2.15,54.93.77.70,TLSv1.2,590,Application Data
1,0.2393419999999935,54.93.77.70,10.0.2.15,TCP,60,9001  >  34692 [ACK] Seq=7499317 Ack=436145 Win=65535 Len=0
1,0.24294900000001007,62.210.85.178,10.0.2.15,TLSv1.2,1104,Application Data
1,0.2847360000000094,10.0.2.15,62.210.85.178,TCP,54,35978  >  9001 [ACK] Seq=7497579 Ack=434165 Win=65535 Len=0
1,0.4792930000000126,62.210.85.178,10.0.2.15,TLSv1.2,590,Application Data
1,0.47938800000000015,10.0.2.15,62.210.85.178,TCP,54,35978  >  9001 [ACK] Seq=7497579 Ack=434701 Win=65535 Len=0
1,0.47976500000001465,10.0.2.15,62.210.85.178,TLSv1.2,590,Application Data
1,0.47986600000001545,62.210.85.178,10.0.2.15,TCP,60,9001  >  35978 [ACK] Seq=434701 Ack=7498115 Win=65535 Len=0
1,1.1981859999999926,54.93.77.70,10.0.2.15,TLSv1.2,590,Application Data
1,1.1982950000000017,10.0.2.15,54.93.77.70,TCP,54,34692  >  9001 [ACK] Seq=436145 Ack=7499853 Win=65535 Len=0
1,1.1988939999999957,10.0.2.15,54.93.77.70,TLSv1.2,1618,Application Data
1,1.1990539999999896,54.93.77.70,10.0.2.15,TCP,60,9001  >  34692 [ACK] Seq=7499853 Ack=437605 Win=65535 Len=0
1,1.1990749999999935,54.93.77.70,10.0.2.15,TCP,60,9001  >  34692 [ACK] Seq=7499853 Ack=437709 Win=65535 Len=0
1,1.3106490000000122,62.210.85.178,10.0.2.15,TLSv1.2,1618,Application Data
1,1.3108500000000163,10.0.2.15,62.210.85.178,TCP,54,35978  >  9001 [ACK] Seq=7498115 Ack=436265 Win=65535 Len=0
1,1.3355249999999899,10.0.2.15,62.210.85.178,TLSv1.2,590,Application Data
1,1.335692999999992,62.210.85.178,10.0.2.15,TCP,60,9001  >  35978 [ACK] Seq=436265 Ack=7498651 Win=65535 Len=0
1,1.3492019999999911,10.0.2.15,62.210.85.178,TLSv1.2,1618,Application Data
1,1.3494290000000149,62.210.85.178,10.0.2.15,TCP,60,9001  >  35978 [ACK] Seq=436265 Ack=7500111 Win=65535 Len=0
1,1.3494619999999884,62.210.85.178,10.0.2.15,TCP,60,9001  >  35978 [ACK] Seq=436265 Ack=7500215 Win=65535 Len=0
1,1.4384359999999958,54.93.77.70,10.0.2.15,TLSv1.2,590,Application Data
1,1.466245000000015,54.93.77.70,10.0.2.15,TLSv1.2,1618,Application Data
1,1.4663759999999968,10.0.2.15,54.93.77.70,TCP,54,34692  >  9001 [ACK] Seq=437709 Ack=7501953 Win=65535 Len=0
1,1.4685709999999972,10.0.2.15,54.93.77.70,TLSv1.2,590,Application Data
1,1.4687749999999937,54.93.77.70,10.0.2.15,TCP,60,9001  >  34692 [ACK] Seq=7501953 Ack=438245 Win=65535 Len=0
1,1.6063739999999882,62.210.85.178,10.0.2.15,TLSv1.2,590,Application Data
1,1.606708999999995,10.0.2.15,62.210.85.178,TLSv1.2,590,Application Data
1,1.6068270000000098,62.210.85.178,10.0.2.15,TCP,60,9001  >  35978 [ACK] Seq=436801 Ack=7500751 Win=65535 Len=0
1,1.810637000000014,54.93.77.70,10.0.2.15,TLSv1.2,590,Application Data
1,1.8110870000000148,10.0.2.15,54.93.77.70,TLSv1.2,590,Application Data
1,1.8112199999999916,54.93.77.70,10.0.2.15,TCP,60,9001  >  34692 [ACK] Seq=7502489 Ack=438781 Win=65535 Len=0
1,1.927424000000002,62.210.85.178,10.0.2.15,TLSv1.2,590,Application Data
1,1.932030999999995,10.0.2.15,62.210.85.178,TLSv1.2,590,Application Data
1,1.9322249999999883,62.210.85.178,10.0.2.15,TCP,60,9001  >  35978 [ACK] Seq=437337 Ack=7501287 Win=65535 Len=0
1,1.9446990000000142,10.0.2.15,62.210.85.178,TLSv1.2,4124,Application Data
1,1.944829999999996,10.0.2.15,62.210.85.178,TCP,2974,35978  >  9001 [ACK] Seq=7505357 Ack=437337 Win=65535 Len=2920 [TCP segment of a reassembled PDU]
1,1.9448790000000145,62.210.85.178,10.0.2.15,TCP,60,9001  >  35978 [ACK] Seq=437337 Ack=7502747 Win=65535 Len=0
1,1.9448910000000126,62.210.85.178,10.0.2.15,TCP,60,9001  >  35978 [ACK] Seq=437337 Ack=7504207 Win=65535 Len=0
1,1.944896,62.210.85.178,10.0.2.15,TCP,60,9001  >  35978 [ACK] Seq=437337 Ack=7505357 Win=65535 Len=0
1,1.9449010000000158,62.210.85.178,10.0.2.15,TCP,60,9001  >  35978 [ACK] Seq=437337 Ack=7506817 Win=65535 Len=0
1,1.9449050000000057,62.210.85.178,10.0.2.15,TCP,60,9001  >  35978 [ACK] Seq=437337 Ack=7508277 Win=65535 Len=0
1,1.9449970000000008,10.0.2.15,62.210.85.178,TLSv1.2,1204,Application Data
1,1.9451469999999915,62.210.85.178,10.0.2.15,TCP,60,9001  >  35978 [ACK] Seq=437337 Ack=7509427 Win=65535 Len=0
1,1.9451990000000023,10.0.2.15,62.210.85.178,TLSv1.2,1232,Application Data
1,1.945305999999988,62.210.85.178,10.0.2.15,TCP,60,9001  >  35978 [ACK] Seq=437337 Ack=7510605 Win=65535 Len=0
1,2.0266459999999995,54.93.77.70,10.0.2.15,TLSv1.2,590,Application Data
1,2.045828,54.93.77.70,10.0.2.15,TCP,2950,"9001  >  34692 [PSH, ACK] Seq=7503025 Ack=438781 Win=65535 Len=2896 [TCP segment of a reassembled PDU]"
1,2.045968000000016,54.93.77.70,10.0.2.15,TLSv1.2,4398,"Application Data, Application Data"
1,2.0460759999999993,10.0.2.15,54.93.77.70,TCP,54,34692  >  9001 [ACK] Seq=438781 Ack=7510265 Win=65535 Len=0
1,2.0689700000000073,54.93.77.70,10.0.2.15,TLSv1.2,2132,Application Data
1,2.0690779999999904,10.0.2.15,54.93.77.70,TCP,54,34692  >  9001 [ACK] Seq=438781 Ack=7512343 Win=65535 Len=0
1,2.0724950000000035,10.0.2.15,54.93.77.70,TLSv1.2,590,Application Data
1,2.072755000000001,54.93.77.70,10.0.2.15,TCP,60,9001  >  34692 [ACK] Seq=7512343 Ack=439317 Win=65535 Len=0
1,2.1882520000000056,62.210.85.178,10.0.2.15,TLSv1.2,590,Application Data
1,2.1885790000000043,10.0.2.15,62.210.85.178,TLSv1.2,590,Application Data
1,2.1889480000000106,62.210.85.178,10.0.2.15,TCP,60,9001  >  35978 [ACK] Seq=437873 Ack=7511141 Win=65535 Len=0
1,2.2914240000000063,54.93.77.70,10.0.2.15,TLSv1.2,590,Application Data
1,2.291832999999997,10.0.2.15,54.93.77.70,TLSv1.2,590,Application Data
1,2.291983000000016,54.93.77.70,10.0.2.15,TCP,60,9001  >  34692 [ACK] Seq=7512879 Ack=439853 Win=65535 Len=0
1,2.425124000000011,62.210.85.178,10.0.2.15,TLSv1.2,590,Application Data
1,2.429326000000003,10.0.2.15,62.210.85.178,TLSv1.2,590,Application Data
1,2.4295449999999903,62.210.85.178,10.0.2.15,TCP,60,9001  >  35978 [ACK] Seq=438409 Ack=7511677 Win=65535 Len=0
1,2.442259000000007,10.0.2.15,62.210.85.178,TLSv1.2,4124,Application Data
1,2.4428489999999954,10.0.2.15,62.210.85.178,TCP,2974,35978  >  9001 [ACK] Seq=7515747 Ack=438409 Win=65535 Len=2920 [TCP segment of a reassembled PDU]
1,2.4429409999999905,62.210.85.178,10.0.2.15,TCP,60,9001  >  35978 [ACK] Seq=438409 Ack=7513137 Win=65535 Len=0
1,2.443002000000007,62.210.85.178,10.0.2.15,TCP,60,9001  >  35978 [ACK] Seq=438409 Ack=7514597 Win=65535 Len=0
1,2.4430150000000026,62.210.85.178,10.0.2.15,TCP,60,9001  >  35978 [ACK] Seq=438409 Ack=7515747 Win=65535 Len=0
1,2.443168000000014,62.210.85.178,10.0.2.15,TCP,60,9001  >  35978 [ACK] Seq=438409 Ack=7517207 Win=65535 Len=0
1,2.443185999999997,62.210.85.178,10.0.2.15,TCP,60,9001  >  35978 [ACK] Seq=438409 Ack=7518667 Win=65535 Len=0
1,2.443250000000006,10.0.2.15,62.210.85.178,TLSv1.2,818,Application Data
1,2.443571999999989,62.210.85.178,10.0.2.15,TCP,60,9001  >  35978 [ACK] Seq=438409 Ack=7519431 Win=65535 Len=0
1,2.556643000000008,54.93.77.70,10.0.2.15,TLSv1.2,590,Application Data
1,2.576243000000005,54.93.77.70,10.0.2.15,TCP,2950,"9001  >  34692 [PSH, ACK] Seq=7513415 Ack=439853 Win=65535 Len=2896 [TCP segment of a reassembled PDU]"
1,2.57629399999999,54.93.77.70,10.0.2.15,TLSv1.2,1502,Application Data [TCP segment of a reassembled PDU]
1,2.576451999999989,10.0.2.15,54.93.77.70,TCP,54,34692  >  9001 [ACK] Seq=439853 Ack=7517759 Win=65535 Len=0
1,2.5931229999999914,54.93.77.70,10.0.2.15,TLSv1.2,894,Application Data
1,2.5979440000000125,54.93.77.70,10.0.2.15,TCP,1502,"9001  >  34692 [PSH, ACK] Seq=7518599 Ack=439853 Win=65535 Len=1448 [TCP segment of a reassembled PDU]"
1,2.5980340000000126,10.0.2.15,54.93.77.70,TCP,54,34692  >  9001 [ACK] Seq=439853 Ack=7520047 Win=65535 Len=0
1,2.609286999999995,54.93.77.70,10.0.2.15,TLSv1.2,1198,Application Data
1,2.614559000000014,10.0.2.15,54.93.77.70,TLSv1.2,590,Application Data
1,2.6147280000000137,54.93.77.70,10.0.2.15,TCP,60,9001  >  34692 [ACK] Seq=7521191 Ack=440389 Win=65535 Len=0
1,2.8352020000000095,62.210.85.178,10.0.2.15,TLSv1.2,590,Application Data
1,2.8357540000000085,10.0.2.15,62.210.85.178,TLSv1.2,590,Application Data
1,2.835923000000008,62.210.85.178,10.0.2.15,TCP,60,9001  >  35978 [ACK] Seq=438945 Ack=7519967 Win=65535 Len=0
1,3.0423429999999883,54.93.77.70,10.0.2.15,TLSv1.2,590,Application Data
1,3.0429259999999942,10.0.2.15,54.93.77.70,TLSv1.2,590,Application Data
1,3.0432710000000043,54.93.77.70,10.0.2.15,TCP,60,9001  >  34692 [ACK] Seq=7521727 Ack=440925 Win=65535 Len=0
1,3.244737000000015,62.210.85.178,10.0.2.15,TLSv1.2,590,Application Data
1,3.249258999999995,10.0.2.15,62.210.85.178,TLSv1.2,590,Application Data
1,3.2494529999999884,62.210.85.178,10.0.2.15,TCP,60,9001  >  35978 [ACK] Seq=439481 Ack=7520503 Win=65535 Len=0
1,3.260874000000001,10.0.2.15,62.210.85.178,TLSv1.2,4124,Application Data
1,3.260987,10.0.2.15,62.210.85.178,TCP,2974,35978  >  9001 [ACK] Seq=7524573 Ack=439481 Win=65535 Len=2920 [TCP segment of a reassembled PDU]
1,3.2610600000000147,62.210.85.178,10.0.2.15,TCP,60,9001  >  35978 [ACK] Seq=439481 Ack=7521963 Win=65535 Len=0
1,3.261074000000008,62.210.85.178,10.0.2.15,TCP,60,9001  >  35978 [ACK] Seq=439481 Ack=7523423 Win=65535 Len=0
1,3.261078999999995,62.210.85.178,10.0.2.15,TCP,60,9001  >  35978 [ACK] Seq=439481 Ack=7524573 Win=65535 Len=0
1,3.261082000000016,62.210.85.178,10.0.2.15,TCP,60,9001  >  35978 [ACK] Seq=439481 Ack=7526033 Win=65535 Len=0
1,3.261084000000011,62.210.85.178,10.0.2.15,TCP,60,9001  >  35978 [ACK] Seq=439481 Ack=7527493 Win=65535 Len=0
1,3.2611220000000003,10.0.2.15,62.210.85.178,TLSv1.2,1204,Application Data
1,3.2611890000000017,10.0.2.15,62.210.85.178,TCP,2974,35978  >  9001 [ACK] Seq=7528643 Ack=439481 Win=65535 Len=2920 [TCP segment of a reassembled PDU]
1,3.2612239999999986,62.210.85.178,10.0.2.15,TCP,60,9001  >  35978 [ACK] Seq=439481 Ack=7528643 Win=65535 Len=0
1,3.261232000000007,62.210.85.178,10.0.2.15,TCP,60,9001  >  35978 [ACK] Seq=439481 Ack=7530103 Win=65535 Len=0
1,3.261236999999994,62.210.85.178,10.0.2.15,TCP,60,9001  >  35978 [ACK] Seq=439481 Ack=7531563 Win=65535 Len=0
1,3.2612650000000087,10.0.2.15,62.210.85.178,TLSv1.2,1204,Application Data
1,3.2612960000000157,62.210.85.178,10.0.2.15,TCP,60,9001  >  35978 [ACK] Seq=439481 Ack=7532713 Win=65535 Len=0
1,3.2613369999999975,10.0.2.15,62.210.85.178,TLSv1.2,4124,Application Data
1,3.261370999999997,62.210.85.178,10.0.2.15,TCP,60,9001  >  35978 [ACK] Seq=439481 Ack=7534173 Win=65535 Len=0
1,3.2613780000000077,62.210.85.178,10.0.2.15,TCP,60,9001  >  35978 [ACK] Seq=439481 Ack=7535633 Win=65535 Len=0
1,3.2614499999999964,10.0.2.15,62.210.85.178,TLSv1.2,2974,Application Data
1,3.2614869999999883,62.210.85.178,10.0.2.15,TCP,60,9001  >  35978 [ACK] Seq=439481 Ack=7536783 Win=65535 Len=0
1,3.261493999999999,62.210.85.178,10.0.2.15,TCP,60,9001  >  35978 [ACK] Seq=439481 Ack=7538243 Win=65535 Len=0
1,3.2614969999999914,62.210.85.178,10.0.2.15,TCP,60,9001  >  35978 [ACK] Seq=439481 Ack=7539703 Win=65535 Len=0
1,3.2615240000000085,10.0.2.15,62.210.85.178,TLSv1.2,1226,Application Data
1,3.261558000000008,62.210.85.178,10.0.2.15,TCP,60,9001  >  35978 [ACK] Seq=439481 Ack=7540875 Win=65535 Len=0
1,3.2615969999999948,10.0.2.15,62.210.85.178,TLSv1.2,4124,Application Data
1,3.261630999999994,62.210.85.178,10.0.2.15,TCP,60,9001  >  35978 [ACK] Seq=439481 Ack=7542335 Win=65535 Len=0
1,3.2616390000000024,62.210.85.178,10.0.2.15,TCP,60,9001  >  35978 [ACK] Seq=439481 Ack=7543795 Win=65535 Len=0
1,3.261641999999995,62.210.85.178,10.0.2.15,TCP,60,9001  >  35978 [ACK] Seq=439481 Ack=7544945 Win=65535 Len=0
1,3.261677999999989,10.0.2.15,62.210.85.178,TLSv1.2,3030,Application Data
1,3.2617119999999886,62.210.85.178,10.0.2.15,TCP,60,9001  >  35978 [ACK] Seq=439481 Ack=7546405 Win=65535 Len=0
1,3.2617189999999994,62.210.85.178,10.0.2.15,TCP,60,9001  >  35978 [ACK] Seq=439481 Ack=7547865 Win=65535 Len=0
1,3.261721999999992,62.210.85.178,10.0.2.15,TCP,60,9001  >  35978 [ACK] Seq=439481 Ack=7547921 Win=65535 Len=0
1,3.2743859999999927,10.0.2.15,62.210.85.178,TLSv1.2,2132,Application Data
1,3.274854000000005,62.210.85.178,10.0.2.15,TCP,60,9001  >  35978 [ACK] Seq=439481 Ack=7549381 Win=65535 Len=0
1,3.27489700000001,62.210.85.178,10.0.2.15,TCP,60,9001  >  35978 [ACK] Seq=439481 Ack=7549999 Win=65535 Len=0
1,3.34773899999999,54.93.77.70,10.0.2.15,TLSv1.2,3674,Application Data
1,3.3478760000000136,10.0.2.15,54.93.77.70,TCP,54,34692  >  9001 [ACK] Seq=440925 Ack=7525347 Win=65535 Len=0
1,3.375292999999999,54.93.77.70,10.0.2.15,TLSv1.2,3674,Application Data
1,3.375440999999995,10.0.2.15,54.93.77.70,TCP,54,34692  >  9001 [ACK] Seq=440925 Ack=7528967 Win=65535 Len=0
1,3.392230000000012,54.93.77.70,10.0.2.15,TLSv1.2,2950,Application Data
1,3.3923670000000072,10.0.2.15,54.93.77.70,TCP,54,34692  >  9001 [ACK] Seq=440925 Ack=7531863 Win=65535 Len=0
1,3.3932829999999967,54.93.77.70,10.0.2.15,TLSv1.2,1314,Application Data
1,3.436635999999993,10.0.2.15,54.93.77.70,TCP,54,34692  >  9001 [ACK] Seq=440925 Ack=7533123 Win=65535 Len=0
1,3.436909000000014,54.93.77.70,10.0.2.15,TCP,2950,"9001  >  34692 [PSH, ACK] Seq=7533123 Ack=440925 Win=65535 Len=2896 [TCP segment of a reassembled PDU]"
1,3.4370429999999885,10.0.2.15,54.93.77.70,TCP,54,34692  >  9001 [ACK] Seq=440925 Ack=7536019 Win=65535 Len=0
1,3.4480230000000063,54.93.77.70,10.0.2.15,TLSv1.2,2950,Application Data [TCP segment of a reassembled PDU]
1,3.4481230000000096,10.0.2.15,54.93.77.70,TCP,54,34692  >  9001 [ACK] Seq=440925 Ack=7538915 Win=65535 Len=0
1,3.448752000000013,54.93.77.70,10.0.2.15,TLSv1.2,5846,Application Data [TCP segment of a reassembled PDU]
1,3.448837999999995,10.0.2.15,54.93.77.70,TCP,54,34692  >  9001 [ACK] Seq=440925 Ack=7544707 Win=65535 Len=0
1,3.4491669999999885,54.93.77.70,10.0.2.15,TLSv1.2,1502,Application Data [TCP segment of a reassembled PDU]
1,3.4492170000000044,10.0.2.15,54.93.77.70,TCP,54,34692  >  9001 [ACK] Seq=440925 Ack=7546155 Win=65535 Len=0
1,3.450603000000001,54.93.77.70,10.0.2.15,TLSv1.2,2950,Application Data [TCP segment of a reassembled PDU]
1,3.4506680000000074,10.0.2.15,54.93.77.70,TCP,54,34692  >  9001 [ACK] Seq=440925 Ack=7549051 Win=65535 Len=0
1,3.4509060000000034,10.0.2.15,54.93.77.70,TLSv1.2,1104,Application Data
1,3.4509940000000086,54.93.77.70,10.0.2.15,TCP,60,9001  >  34692 [ACK] Seq=7549051 Ack=441975 Win=65535 Len=0
1,3.454275999999993,54.93.77.70,10.0.2.15,TLSv1.2,2740,Application Data
1,3.4543720000000064,10.0.2.15,54.93.77.70,TCP,54,34692  >  9001 [ACK] Seq=441975 Ack=7551737 Win=65535 Len=0
1,3.4699310000000025,10.0.2.15,54.93.77.70,TLSv1.2,590,Application Data
1,3.4701960000000156,54.93.77.70,10.0.2.15,TCP,60,9001  >  34692 [ACK] Seq=7551737 Ack=442511 Win=65535 Len=0
1,3.5439810000000023,62.210.85.178,10.0.2.15,TLSv1.2,1104,Application Data
1,3.5845669999999927,10.0.2.15,62.210.85.178,TCP,54,35978  >  9001 [ACK] Seq=7549999 Ack=440531 Win=65535 Len=0
1,3.6544179999999926,62.210.85.178,10.0.2.15,TLSv1.2,590,Application Data
1,3.654519999999991,10.0.2.15,62.210.85.178,TCP,54,35978  >  9001 [ACK] Seq=7549999 Ack=441067 Win=65535 Len=0
1,3.65520699999999,10.0.2.15,62.210.85.178,TLSv1.2,590,Application Data
1,3.655425000000008,62.210.85.178,10.0.2.15,TCP,60,9001  >  35978 [ACK] Seq=441067 Ack=7550535 Win=65535 Len=0
1,3.858869999999996,54.93.77.70,10.0.2.15,TLSv1.2,590,Application Data
1,3.8594659999999976,10.0.2.15,54.93.77.70,TLSv1.2,590,Application Data
1,3.859636999999992,54.93.77.70,10.0.2.15,TCP,60,9001  >  34692 [ACK] Seq=7552273 Ack=443047 Win=65535 Len=0
1,4.064488000000011,62.210.85.178,10.0.2.15,TLSv1.2,590,Application Data
1,4.070982000000015,10.0.2.15,62.210.85.178,TLSv1.2,590,Application Data
1,4.072303000000005,62.210.85.178,10.0.2.15,TCP,60,9001  >  35978 [ACK] Seq=441603 Ack=7551071 Win=65535 Len=0
1,4.081601000000006,10.0.2.15,62.210.85.178,TLSv1.2,4124,Application Data
1,4.081771000000003,62.210.85.178,10.0.2.15,TCP,60,9001  >  35978 [ACK] Seq=441603 Ack=7552531 Win=65535 Len=0
1,4.081804000000005,62.210.85.178,10.0.2.15,TCP,60,9001  >  35978 [ACK] Seq=441603 Ack=7553991 Win=65535 Len=0
1,4.08180999999999,62.210.85.178,10.0.2.15,TCP,60,9001  >  35978 [ACK] Seq=441603 Ack=7555141 Win=65535 Len=0
1,4.081848000000008,10.0.2.15,62.210.85.178,TCP,2974,35978  >  9001 [ACK] Seq=7555141 Ack=441603 Win=65535 Len=2920 [TCP segment of a reassembled PDU]
1,4.081919999999997,62.210.85.178,10.0.2.15,TCP,60,9001  >  35978 [ACK] Seq=441603 Ack=7556601 Win=65535 Len=0
1,4.081927000000007,62.210.85.178,10.0.2.15,TCP,60,9001  >  35978 [ACK] Seq=441603 Ack=7558061 Win=65535 Len=0
1,4.081967999999989,10.0.2.15,62.210.85.178,TLSv1.2,1204,Application Data
1,4.082049000000012,10.0.2.15,62.210.85.178,TCP,2974,35978  >  9001 [ACK] Seq=7559211 Ack=441603 Win=65535 Len=2920 [TCP segment of a reassembled PDU]
1,4.082087999999999,62.210.85.178,10.0.2.15,TCP,60,9001  >  35978 [ACK] Seq=441603 Ack=7559211 Win=65535 Len=0
1,4.08209500000001,62.210.85.178,10.0.2.15,TCP,60,9001  >  35978 [ACK] Seq=441603 Ack=7560671 Win=65535 Len=0
1,4.082099999999997,62.210.85.178,10.0.2.15,TCP,60,9001  >  35978 [ACK] Seq=441603 Ack=7562131 Win=65535 Len=0
1,4.082134999999994,10.0.2.15,62.210.85.178,TLSv1.2,1204,Application Data
1,4.082228000000015,10.0.2.15,62.210.85.178,TCP,2974,35978  >  9001 [ACK] Seq=7563281 Ack=441603 Win=65535 Len=2920 [TCP segment of a reassembled PDU]
1,4.082251000000014,62.210.85.178,10.0.2.15,TCP,60,9001  >  35978 [ACK] Seq=441603 Ack=7563281 Win=65535 Len=0
1,4.082257999999996,62.210.85.178,10.0.2.15,TCP,60,9001  >  35978 [ACK] Seq=441603 Ack=7564741 Win=65535 Len=0
1,4.082263000000012,62.210.85.178,10.0.2.15,TCP,60,9001  >  35978 [ACK] Seq=441603 Ack=7566201 Win=65535 Len=0
1,4.082295000000016,10.0.2.15,62.210.85.178,TLSv1.2,1204,Application Data
1,4.082358999999997,62.210.85.178,10.0.2.15,TCP,60,9001  >  35978 [ACK] Seq=441603 Ack=7567351 Win=65535 Len=0
1,4.082401000000004,10.0.2.15,62.210.85.178,TLSv1.2,332,Application Data
1,4.082438999999994,62.210.85.178,10.0.2.15,TCP,60,9001  >  35978 [ACK] Seq=441603 Ack=7567629 Win=65535 Len=0
1,4.082510000000013,10.0.2.15,62.210.85.178,TLSv1.2,3868,Application Data
1,4.0825550000000135,62.210.85.178,10.0.2.15,TCP,60,9001  >  35978 [ACK] Seq=441603 Ack=7569089 Win=65535 Len=0
1,4.082564999999988,62.210.85.178,10.0.2.15,TCP,60,9001  >  35978 [ACK] Seq=441603 Ack=7570549 Win=65535 Len=0
1,4.082570000000004,62.210.85.178,10.0.2.15,TCP,60,9001  >  35978 [ACK] Seq=441603 Ack=7571443 Win=65535 Len=0
1,4.082620999999989,10.0.2.15,62.210.85.178,TLSv1.2,4124,Application Data
1,4.082671000000005,62.210.85.178,10.0.2.15,TCP,60,9001  >  35978 [ACK] Seq=441603 Ack=7572903 Win=65535 Len=0
1,4.082679000000013,62.210.85.178,10.0.2.15,TCP,60,9001  >  35978 [ACK] Seq=441603 Ack=7574363 Win=65535 Len=0
1,4.082684,62.210.85.178,10.0.2.15,TCP,60,9001  >  35978 [ACK] Seq=441603 Ack=7575513 Win=65535 Len=0
1,4.082729999999998,10.0.2.15,62.210.85.178,TLSv1.2,3030,Application Data
1,4.082810999999992,62.210.85.178,10.0.2.15,TCP,60,9001  >  35978 [ACK] Seq=441603 Ack=7576973 Win=65535 Len=0
1,4.082827000000009,62.210.85.178,10.0.2.15,TCP,60,9001  >  35978 [ACK] Seq=441603 Ack=7578433 Win=65535 Len=0
1,4.082831999999996,62.210.85.178,10.0.2.15,TCP,60,9001  >  35978 [ACK] Seq=441603 Ack=7578489 Win=65535 Len=0
1,4.0924420000000055,10.0.2.15,62.210.85.178,TLSv1.2,4124,Application Data
1,4.0927269999999965,62.210.85.178,10.0.2.15,TCP,60,9001  >  35978 [ACK] Seq=441603 Ack=7579949 Win=65535 Len=0
1,4.092763999999988,62.210.85.178,10.0.2.15,TCP,60,9001  >  35978 [ACK] Seq=441603 Ack=7581409 Win=65535 Len=0
1,4.092770000000002,62.210.85.178,10.0.2.15,TCP,60,9001  >  35978 [ACK] Seq=441603 Ack=7582559 Win=65535 Len=0
1,4.0934640000000115,10.0.2.15,62.210.85.178,TLSv1.2,4124,Application Data
1,4.093670000000003,62.210.85.178,10.0.2.15,TCP,60,9001  >  35978 [ACK] Seq=441603 Ack=7584019 Win=65535 Len=0
1,4.09370100000001,62.210.85.178,10.0.2.15,TCP,60,9001  >  35978 [ACK] Seq=441603 Ack=7585479 Win=65535 Len=0
1,4.093705999999997,62.210.85.178,10.0.2.15,TCP,60,9001  >  35978 [ACK] Seq=441603 Ack=7586629 Win=65535 Len=0
1,4.0937959999999975,10.0.2.15,62.210.85.178,TLSv1.2,4124,Application Data
1,4.093948000000012,62.210.85.178,10.0.2.15,TCP,60,9001  >  35978 [ACK] Seq=441603 Ack=7588089 Win=65535 Len=0
1,4.093962000000005,62.210.85.178,10.0.2.15,TCP,60,9001  >  35978 [ACK] Seq=441603 Ack=7589549 Win=65535 Len=0
1,4.09396799999999,62.210.85.178,10.0.2.15,TCP,60,9001  >  35978 [ACK] Seq=441603 Ack=7590699 Win=65535 Len=0
1,4.094053000000002,10.0.2.15,62.210.85.178,TLSv1.2,4124,Application Data
1,4.094209000000006,62.210.85.178,10.0.2.15,TCP,60,9001  >  35978 [ACK] Seq=441603 Ack=7592159 Win=65535 Len=0
1,4.094223999999997,62.210.85.178,10.0.2.15,TCP,60,9001  >  35978 [ACK] Seq=441603 Ack=7593619 Win=65535 Len=0
1,4.094229000000013,62.210.85.178,10.0.2.15,TCP,60,9001  >  35978 [ACK] Seq=441603 Ack=7594769 Win=65535 Len=0
1,4.094278000000003,10.0.2.15,62.210.85.178,TLSv1.2,332,Application Data
1,4.094391000000002,10.0.2.15,62.210.85.178,TCP,2974,35978  >  9001 [ACK] Seq=7595047 Ack=441603 Win=65535 Len=2920 [TCP segment of a reassembled PDU]
1,4.094437999999997,62.210.85.178,10.0.2.15,TCP,60,9001  >  35978 [ACK] Seq=441603 Ack=7595047 Win=65535 Len=0
1,4.094446000000005,62.210.85.178,10.0.2.15,TCP,60,9001  >  35978 [ACK] Seq=441603 Ack=7596507 Win=65535 Len=0
1,4.094448999999997,62.210.85.178,10.0.2.15,TCP,60,9001  >  35978 [ACK] Seq=441603 Ack=7597967 Win=65535 Len=0
1,4.094477000000012,10.0.2.15,62.210.85.178,TLSv1.2,948,Application Data
1,4.094513000000006,62.210.85.178,10.0.2.15,TCP,60,9001  >  35978 [ACK] Seq=441603 Ack=7598861 Win=65535 Len=0
1,4.094557000000009,10.0.2.15,62.210.85.178,TLSv1.2,4124,Application Data
1,4.094595999999996,62.210.85.178,10.0.2.15,TCP,60,9001  >  35978 [ACK] Seq=441603 Ack=7600321 Win=65535 Len=0
1,4.094604000000004,62.210.85.178,10.0.2.15,TCP,60,9001  >  35978 [ACK] Seq=441603 Ack=7601781 Win=65535 Len=0
1,4.094608999999991,62.210.85.178,10.0.2.15,TCP,60,9001  >  35978 [ACK] Seq=441603 Ack=7602931 Win=65535 Len=0
1,4.0946480000000065,10.0.2.15,62.210.85.178,TLSv1.2,3030,Application Data
1,4.094687999999991,62.210.85.178,10.0.2.15,TCP,60,9001  >  35978 [ACK] Seq=441603 Ack=7604391 Win=65535 Len=0
1,4.094695999999999,62.210.85.178,10.0.2.15,TCP,60,9001  >  35978 [ACK] Seq=441603 Ack=7605851 Win=65535 Len=0
1,4.094698999999991,62.210.85.178,10.0.2.15,TCP,60,9001  >  35978 [ACK] Seq=441603 Ack=7605907 Win=65535 Len=0
1,4.103973999999994,10.0.2.15,62.210.85.178,TLSv1.2,4124,Application Data
1,4.104128000000003,62.210.85.178,10.0.2.15,TCP,60,9001  >  35978 [ACK] Seq=441603 Ack=7607367 Win=65535 Len=0
1,4.104150000000004,62.210.85.178,10.0.2.15,TCP,60,9001  >  35978 [ACK] Seq=441603 Ack=7608827 Win=65535 Len=0
1,4.104154999999992,62.210.85.178,10.0.2.15,TCP,60,9001  >  35978 [ACK] Seq=441603 Ack=7609977 Win=65535 Len=0
1,4.104192000000012,10.0.2.15,62.210.85.178,TLSv1.2,140,Application Data
1,4.104230999999999,62.210.85.178,10.0.2.15,TCP,60,9001  >  35978 [ACK] Seq=441603 Ack=7610063 Win=65535 Len=0
1,4.1752329999999915,54.93.77.70,10.0.2.15,TLSv1.2,3674,Application Data
1,4.175371000000013,10.0.2.15,54.93.77.70,TCP,54,34692  >  9001 [ACK] Seq=443047 Ack=7555893 Win=65535 Len=0
1,4.1845189999999945,54.93.77.70,10.0.2.15,TCP,2950,"9001  >  34692 [PSH, ACK] Seq=7555893 Ack=443047 Win=65535 Len=2896 [TCP segment of a reassembled PDU]"
1,4.18462199999999,10.0.2.15,54.93.77.70,TCP,54,34692  >  9001 [ACK] Seq=443047 Ack=7558789 Win=65535 Len=0
1,4.195222999999999,54.93.77.70,10.0.2.15,TLSv1.2,778,Application Data
1,4.206665000000015,54.93.77.70,10.0.2.15,TLSv1.2,2950,Application Data
1,4.206789000000015,10.0.2.15,54.93.77.70,TCP,54,34692  >  9001 [ACK] Seq=443047 Ack=7562409 Win=65535 Len=0
1,4.214235000000002,54.93.77.70,10.0.2.15,TLSv1.2,2950,Application Data [TCP segment of a reassembled PDU]
1,4.214345000000009,10.0.2.15,54.93.77.70,TCP,54,34692  >  9001 [ACK] Seq=443047 Ack=7565305 Win=65535 Len=0
1,4.2144150000000025,54.93.77.70,10.0.2.15,TLSv1.2,2950,Application Data [TCP segment of a reassembled PDU]
1,4.214507999999995,10.0.2.15,54.93.77.70,TCP,54,34692  >  9001 [ACK] Seq=443047 Ack=7568201 Win=65535 Len=0
1,4.226140000000015,54.93.77.70,10.0.2.15,TLSv1.2,192,Application Data
1,4.2336640000000045,54.93.77.70,10.0.2.15,TLSv1.2,11638,"Application Data, Application Data"
1,4.233846999999997,10.0.2.15,54.93.77.70,TCP,54,34692  >  9001 [ACK] Seq=443047 Ack=7579923 Win=65535 Len=0
1,4.2500479999999925,54.93.77.70,10.0.2.15,TLSv1.2,358,Application Data
1,4.250385999999992,10.0.2.15,54.93.77.70,TLSv1.2,590,Application Data
1,4.250553999999994,54.93.77.70,10.0.2.15,TCP,60,9001  >  34692 [ACK] Seq=7580227 Ack=443583 Win=65535 Len=0
1,4.254884000000004,54.93.77.70,10.0.2.15,TCP,2950,"9001  >  34692 [PSH, ACK] Seq=7580227 Ack=443583 Win=65535 Len=2896 [TCP segment of a reassembled PDU]"
1,4.254959000000014,54.93.77.70,10.0.2.15,TLSv1.2,1502,Application Data [TCP segment of a reassembled PDU]
1,4.255087000000003,10.0.2.15,54.93.77.70,TCP,54,34692  >  9001 [ACK] Seq=443583 Ack=7584571 Win=65535 Len=0
1,4.266043999999994,54.93.77.70,10.0.2.15,TLSv1.2,2950,Application Data [TCP segment of a reassembled PDU]
1,4.266180999999989,10.0.2.15,54.93.77.70,TCP,54,34692  >  9001 [ACK] Seq=443583 Ack=7587467 Win=65535 Len=0
1,4.266457000000003,54.93.77.70,10.0.2.15,TLSv1.2,4398,Application Data [TCP segment of a reassembled PDU]
1,4.266626000000002,10.0.2.15,54.93.77.70,TCP,54,34692  >  9001 [ACK] Seq=443583 Ack=7591811 Win=65535 Len=0
1,4.268204999999995,54.93.77.70,10.0.2.15,TLSv1.2,1408,Application Data
1,4.286009000000007,54.93.77.70,10.0.2.15,TLSv1.2,2950,Application Data
1,4.286112000000003,10.0.2.15,54.93.77.70,TCP,54,34692  >  9001 [ACK] Seq=443583 Ack=7596061 Win=65535 Len=0
1,4.2961190000000045,54.93.77.70,10.0.2.15,TLSv1.2,2950,Application Data [TCP segment of a reassembled PDU]
1,4.296167999999994,54.93.77.70,10.0.2.15,TLSv1.2,7294,"Application Data, Application Data"
1,4.2962459999999965,10.0.2.15,54.93.77.70,TCP,54,34692  >  9001 [ACK] Seq=443583 Ack=7598957 Win=65535 Len=0
1,4.296389000000005,10.0.2.15,54.93.77.70,TCP,54,34692  >  9001 [ACK] Seq=443583 Ack=7606197 Win=65535 Len=0
1,4.296584999999993,54.93.77.70,10.0.2.15,TLSv1.2,4398,Application Data [TCP segment of a reassembled PDU]
1,4.296696999999995,10.0.2.15,54.93.77.70,TCP,54,34692  >  9001 [ACK] Seq=443583 Ack=7610541 Win=65535 Len=0
1,4.297275000000013,10.0.2.15,54.93.77.70,TLSv1.2,1104,Application Data
1,4.297435000000007,54.93.77.70,10.0.2.15,TCP,60,9001  >  34692 [ACK] Seq=7610541 Ack=444633 Win=65535 Len=0
1,4.301988999999992,54.93.77.70,10.0.2.15,TLSv1.2,1314,Application Data
1,4.309308000000016,10.0.2.15,54.93.77.70,TLSv1.2,590,Application Data
1,4.3095360000000085,54.93.77.70,10.0.2.15,TCP,60,9001  >  34692 [ACK] Seq=7611801 Ack=445169 Win=65535 Len=0
1,4.365061999999995,62.210.85.178,10.0.2.15,TLSv1.2,590,Application Data
1,4.404157999999995,62.210.85.178,10.0.2.15,TLSv1.2,1104,Application Data
1,4.404254000000009,10.0.2.15,62.210.85.178,TCP,54,35978  >  9001 [ACK] Seq=7610063 Ack=443189 Win=65535 Len=0
1,4.488975000000011,62.210.85.178,10.0.2.15,TLSv1.2,590,Application Data
1,4.489634999999993,10.0.2.15,62.210.85.178,TLSv1.2,590,Application Data
1,4.48977099999999,62.210.85.178,10.0.2.15,TCP,60,9001  >  35978 [ACK] Seq=443725 Ack=7610599 Win=65535 Len=0
1,4.590789000000001,54.93.77.70,10.0.2.15,TLSv1.2,590,Application Data
1,4.591552000000007,10.0.2.15,54.93.77.70,TLSv1.2,590,Application Data
1,4.591711000000004,54.93.77.70,10.0.2.15,TCP,60,9001  >  34692 [ACK] Seq=7612337 Ack=445705 Win=65535 Len=0
1,4.70619099999999,62.210.85.178,10.0.2.15,TLSv1.2,590,Application Data
1,4.714830000000006,10.0.2.15,62.210.85.178,TLSv1.2,590,Application Data
1,4.71503100000001,62.210.85.178,10.0.2.15,TCP,60,9001  >  35978 [ACK] Seq=444261 Ack=7611135 Win=65535 Len=0
1,4.7255910000000085,10.0.2.15,62.210.85.178,TLSv1.2,4124,Application Data
1,4.725930000000005,62.210.85.178,10.0.2.15,TCP,60,9001  >  35978 [ACK] Seq=444261 Ack=7612595 Win=65535 Len=0
1,4.725963000000007,62.210.85.178,10.0.2.15,TCP,60,9001  >  35978 [ACK] Seq=444261 Ack=7614055 Win=65535 Len=0
1,4.725979999999993,62.210.85.178,10.0.2.15,TCP,60,9001  >  35978 [ACK] Seq=444261 Ack=7615205 Win=65535 Len=0
1,4.72610499999999,10.0.2.15,62.210.85.178,TLSv1.2,4124,Application Data
1,4.726188000000008,10.0.2.15,62.210.85.178,TCP,2974,35978  >  9001 [ACK] Seq=7619275 Ack=444261 Win=65535 Len=2920 [TCP segment of a reassembled PDU]
1,4.726233000000008,62.210.85.178,10.0.2.15,TCP,60,9001  >  35978 [ACK] Seq=444261 Ack=7616665 Win=65535 Len=0
1,4.726241000000016,62.210.85.178,10.0.2.15,TCP,60,9001  >  35978 [ACK] Seq=444261 Ack=7618125 Win=65535 Len=0
1,4.726245000000006,62.210.85.178,10.0.2.15,TCP,60,9001  >  35978 [ACK] Seq=444261 Ack=7619275 Win=65535 Len=0
1,4.726248999999996,62.210.85.178,10.0.2.15,TCP,60,9001  >  35978 [ACK] Seq=444261 Ack=7620735 Win=65535 Len=0
1,4.7262540000000115,62.210.85.178,10.0.2.15,TCP,60,9001  >  35978 [ACK] Seq=444261 Ack=7622195 Win=65535 Len=0
1,4.726295999999991,10.0.2.15,62.210.85.178,TLSv1.2,1204,Application Data
1,4.726340999999991,62.210.85.178,10.0.2.15,TCP,60,9001  >  35978 [ACK] Seq=444261 Ack=7623345 Win=65535 Len=0
1,4.726404000000002,10.0.2.15,62.210.85.178,TLSv1.2,4124,Application Data
1,4.726472999999999,62.210.85.178,10.0.2.15,TCP,60,9001  >  35978 [ACK] Seq=444261 Ack=7624805 Win=65535 Len=0
1,4.726481000000007,62.210.85.178,10.0.2.15,TCP,60,9001  >  35978 [ACK] Seq=444261 Ack=7626265 Win=65535 Len=0
1,4.726485999999994,62.210.85.178,10.0.2.15,TCP,60,9001  >  35978 [ACK] Seq=444261 Ack=7627415 Win=65535 Len=0
1,4.726531999999992,10.0.2.15,62.210.85.178,TLSv1.2,332,Application Data
1,4.726573999999999,62.210.85.178,10.0.2.15,TCP,60,9001  >  35978 [ACK] Seq=444261 Ack=7627693 Win=65535 Len=0
1,4.726652000000001,10.0.2.15,62.210.85.178,TLSv1.2,3868,Application Data
1,4.726739000000009,62.210.85.178,10.0.2.15,TCP,60,9001  >  35978 [ACK] Seq=444261 Ack=7629153 Win=65535 Len=0
1,4.726752000000005,62.210.85.178,10.0.2.15,TCP,60,9001  >  35978 [ACK] Seq=444261 Ack=7630613 Win=65535 Len=0
1,4.726756999999992,62.210.85.178,10.0.2.15,TCP,60,9001  >  35978 [ACK] Seq=444261 Ack=7631507 Win=65535 Len=0
1,4.7268239999999935,10.0.2.15,62.210.85.178,TLSv1.2,4124,Application Data
1,4.7269000000000005,62.210.85.178,10.0.2.15,TCP,60,9001  >  35978 [ACK] Seq=444261 Ack=7632967 Win=65535 Len=0
1,4.726911000000001,62.210.85.178,10.0.2.15,TCP,60,9001  >  35978 [ACK] Seq=444261 Ack=7634427 Win=65535 Len=0
1,4.726915999999989,62.210.85.178,10.0.2.15,TCP,60,9001  >  35978 [ACK] Seq=444261 Ack=7635577 Win=65535 Len=0
1,4.7269819999999925,10.0.2.15,62.210.85.178,TLSv1.2,3030,Application Data
1,4.727029000000016,62.210.85.178,10.0.2.15,TCP,60,9001  >  35978 [ACK] Seq=444261 Ack=7637037 Win=65535 Len=0
1,4.727035999999998,62.210.85.178,10.0.2.15,TCP,60,9001  >  35978 [ACK] Seq=444261 Ack=7638497 Win=65535 Len=0
1,4.727041000000014,62.210.85.178,10.0.2.15,TCP,60,9001  >  35978 [ACK] Seq=444261 Ack=7638553 Win=65535 Len=0
1,4.738500000000016,10.0.2.15,62.210.85.178,TLSv1.2,4124,Application Data
1,4.7386339999999905,62.210.85.178,10.0.2.15,TCP,60,9001  >  35978 [ACK] Seq=444261 Ack=7640013 Win=65535 Len=0
1,4.738653999999997,62.210.85.178,10.0.2.15,TCP,60,9001  >  35978 [ACK] Seq=444261 Ack=7641473 Win=65535 Len=0
1,4.738659000000013,62.210.85.178,10.0.2.15,TCP,60,9001  >  35978 [ACK] Seq=444261 Ack=7642623 Win=65535 Len=0
1,4.738728000000009,10.0.2.15,62.210.85.178,TLSv1.2,4124,Application Data
1,4.738804000000016,62.210.85.178,10.0.2.15,TCP,60,9001  >  35978 [ACK] Seq=444261 Ack=7644083 Win=65535 Len=0
1,4.738812999999993,62.210.85.178,10.0.2.15,TCP,60,9001  >  35978 [ACK] Seq=444261 Ack=7645543 Win=65535 Len=0
1,4.738817000000012,62.210.85.178,10.0.2.15,TCP,60,9001  >  35978 [ACK] Seq=444261 Ack=7646693 Win=65535 Len=0
1,4.7388679999999965,10.0.2.15,62.210.85.178,TLSv1.2,4124,Application Data
1,4.738910000000004,62.210.85.178,10.0.2.15,TCP,60,9001  >  35978 [ACK] Seq=444261 Ack=7648153 Win=65535 Len=0
1,4.738918000000012,62.210.85.178,10.0.2.15,TCP,60,9001  >  35978 [ACK] Seq=444261 Ack=7649613 Win=65535 Len=0
1,4.738922000000002,62.210.85.178,10.0.2.15,TCP,60,9001  >  35978 [ACK] Seq=444261 Ack=7650763 Win=65535 Len=0
1,4.738970999999992,10.0.2.15,62.210.85.178,TLSv1.2,3866,Application Data
1,4.7390120000000024,62.210.85.178,10.0.2.15,TCP,60,9001  >  35978 [ACK] Seq=444261 Ack=7652223 Win=65535 Len=0
1,4.739020000000011,62.210.85.178,10.0.2.15,TCP,60,9001  >  35978 [ACK] Seq=444261 Ack=7653683 Win=65535 Len=0
1,4.739024999999998,62.210.85.178,10.0.2.15,TCP,60,9001  >  35978 [ACK] Seq=444261 Ack=7654575 Win=65535 Len=0
1,4.85911200000001,54.93.77.70,10.0.2.15,TLSv1.2,3674,Application Data
1,4.8592979999999955,10.0.2.15,54.93.77.70,TCP,54,34692  >  9001 [ACK] Seq=445705 Ack=7615957 Win=65535 Len=0
1,4.8799960000000056,54.93.77.70,10.0.2.15,TCP,2950,"9001  >  34692 [PSH, ACK] Seq=7615957 Ack=445705 Win=65535 Len=2896 [TCP segment of a reassembled PDU]"
1,4.880120000000005,10.0.2.15,54.93.77.70,TCP,54,34692  >  9001 [ACK] Seq=445705 Ack=7618853 Win=65535 Len=0
1,4.880488000000014,54.93.77.70,10.0.2.15,TLSv1.2,4912,"Application Data, Application Data"
1,4.8806299999999965,10.0.2.15,54.93.77.70,TCP,54,34692  >  9001 [ACK] Seq=445705 Ack=7623711 Win=65535 Len=0
1,4.896903000000009,54.93.77.70,10.0.2.15,TLSv1.2,590,Application Data
1,4.935723999999993,54.93.77.70,10.0.2.15,TCP,2950,"9001  >  34692 [PSH, ACK] Seq=7624247 Ack=445705 Win=65535 Len=2896 [TCP segment of a reassembled PDU]"
1,4.93584899999999,10.0.2.15,54.93.77.70,TCP,54,34692  >  9001 [ACK] Seq=445705 Ack=7627143 Win=65535 Len=0
1,4.944829999999996,54.93.77.70,10.0.2.15,TLSv1.2,2950,Application Data [TCP segment of a reassembled PDU]
1,4.944966999999991,10.0.2.15,54.93.77.70,TCP,54,34692  >  9001 [ACK] Seq=445705 Ack=7630039 Win=65535 Len=0
1,4.945155,54.93.77.70,10.0.2.15,TLSv1.2,4398,Application Data [TCP segment of a reassembled PDU]
1,4.945312999999999,10.0.2.15,54.93.77.70,TCP,54,34692  >  9001 [ACK] Seq=445705 Ack=7634383 Win=65535 Len=0
1,4.953611999999993,54.93.77.70,10.0.2.15,TLSv1.2,1292,Application Data
1,4.9567499999999995,54.93.77.70,10.0.2.15,TCP,2950,"9001  >  34692 [PSH, ACK] Seq=7635621 Ack=445705 Win=65535 Len=2896 [TCP segment of a reassembled PDU]"
1,4.956790000000012,54.93.77.70,10.0.2.15,TLSv1.2,4398,Application Data [TCP segment of a reassembled PDU]
1,4.956846000000013,10.0.2.15,54.93.77.70,TCP,54,34692  >  9001 [ACK] Seq=445705 Ack=7638517 Win=65535 Len=0
1,4.956961000000007,10.0.2.15,54.93.77.70,TCP,54,34692  >  9001 [ACK] Seq=445705 Ack=7642861 Win=65535 Len=0
1,4.957156999999995,54.93.77.70,10.0.2.15,TLSv1.2,2950,Application Data [TCP segment of a reassembled PDU]
1,4.957244000000003,10.0.2.15,54.93.77.70,TLSv1.2,590,Application Data
1,4.957340000000016,54.93.77.70,10.0.2.15,TCP,60,9001  >  34692 [ACK] Seq=7645757 Ack=446241 Win=65535 Len=0
1,4.973655000000008,54.93.77.70,10.0.2.15,TLSv1.2,264,Application Data
1,4.976435000000009,54.93.77.70,10.0.2.15,TCP,2950,"9001  >  34692 [PSH, ACK] Seq=7645967 Ack=446241 Win=65535 Len=2896 [TCP segment of a reassembled PDU]"
1,4.9765230000000145,10.0.2.15,54.93.77.70,TCP,54,34692  >  9001 [ACK] Seq=446241 Ack=7648863 Win=65535 Len=0
1,4.976780999999988,54.93.77.70,10.0.2.15,TLSv1.2,2950,Application Data [TCP segment of a reassembled PDU]
1,4.976843000000002,10.0.2.15,54.93.77.70,TCP,54,34692  >  9001 [ACK] Seq=446241 Ack=7651759 Win=65535 Len=0
1,4.996636999999993,54.93.77.70,10.0.2.15,TLSv1.2,2950,Application Data [TCP segment of a reassembled PDU]
1,4.996775000000014,54.93.77.70,10.0.2.15,TLSv1.2,1734,"Application Data, Application Data"
1,4.996838999999994,10.0.2.15,54.93.77.70,TCP,54,34692  >  9001 [ACK] Seq=446241 Ack=7654655 Win=65535 Len=0
1,4.997002000000009,10.0.2.15,54.93.77.70,TCP,54,34692  >  9001 [ACK] Seq=446241 Ack=7656335 Win=65535 Len=0
1,5.000052000000011,10.0.2.15,54.93.77.70,TLSv1.2,590,Application Data
1,5.00025500000001,54.93.77.70,10.0.2.15,TCP,60,9001  >  34692 [ACK] Seq=7656335 Ack=446777 Win=65535 Len=0
1,5.012755999999996,10.0.2.15,54.93.77.70,TLSv1.2,590,Application Data
1,5.013126999999997,54.93.77.70,10.0.2.15,TCP,60,9001  >  34692 [ACK] Seq=7656335 Ack=447313 Win=65535 Len=0
1,5.068040999999994,62.210.85.178,10.0.2.15,TLSv1.2,590,Application Data
1,5.108727000000016,10.0.2.15,62.210.85.178,TCP,54,35978  >  9001 [ACK] Seq=7654575 Ack=444797 Win=65535 Len=0
1,5.1764459999999985,62.210.85.178,10.0.2.15,TLSv1.2,1104,Application Data
1,5.176546999999999,10.0.2.15,62.210.85.178,TCP,54,35978  >  9001 [ACK] Seq=7654575 Ack=445847 Win=65535 Len=0
1,5.176961000000006,10.0.2.15,62.210.85.178,TLSv1.2,590,Application Data
1,5.177064999999999,62.210.85.178,10.0.2.15,TCP,60,9001  >  35978 [ACK] Seq=445847 Ack=7655111 Win=65535 Len=0
1,5.27940000000001,54.93.77.70,10.0.2.15,TLSv1.2,590,Application Data
1,5.279978999999997,10.0.2.15,54.93.77.70,TLSv1.2,590,Application Data
1,5.2801310000000115,54.93.77.70,10.0.2.15,TCP,60,9001  >  34692 [ACK] Seq=7656871 Ack=447849 Win=65535 Len=0
1,5.390699000000012,62.210.85.178,10.0.2.15,TLSv1.2,590,Application Data
1,5.4007159999999885,10.0.2.15,62.210.85.178,TLSv1.2,590,Application Data
1,5.400929999999988,62.210.85.178,10.0.2.15,TCP,60,9001  >  35978 [ACK] Seq=446383 Ack=7655647 Win=65535 Len=0
1,5.411338999999998,10.0.2.15,62.210.85.178,TLSv1.2,4124,Application Data
1,5.411480000000012,10.0.2.15,62.210.85.178,TCP,2974,35978  >  9001 [ACK] Seq=7659717 Ack=446383 Win=65535 Len=2920 [TCP segment of a reassembled PDU]
1,5.411529999999999,62.210.85.178,10.0.2.15,TCP,60,9001  >  35978 [ACK] Seq=446383 Ack=7657107 Win=65535 Len=0
1,5.411542999999995,62.210.85.178,10.0.2.15,TCP,60,9001  >  35978 [ACK] Seq=446383 Ack=7658567 Win=65535 Len=0
1,5.411547000000013,62.210.85.178,10.0.2.15,TCP,60,9001  >  35978 [ACK] Seq=446383 Ack=7659717 Win=65535 Len=0
1,5.41160099999999,62.210.85.178,10.0.2.15,TCP,60,9001  >  35978 [ACK] Seq=446383 Ack=7661177 Win=65535 Len=0
1,5.411607000000004,62.210.85.178,10.0.2.15,TCP,60,9001  >  35978 [ACK] Seq=446383 Ack=7662637 Win=65535 Len=0
1,5.411639000000008,10.0.2.15,62.210.85.178,TLSv1.2,1204,Application Data
1,5.411702999999989,10.0.2.15,62.210.85.178,TCP,2974,35978  >  9001 [ACK] Seq=7663787 Ack=446383 Win=65535 Len=2920 [TCP segment of a reassembled PDU]
1,5.411739000000011,62.210.85.178,10.0.2.15,TCP,60,9001  >  35978 [ACK] Seq=446383 Ack=7663787 Win=65535 Len=0
1,5.411745999999994,62.210.85.178,10.0.2.15,TCP,60,9001  >  35978 [ACK] Seq=446383 Ack=7665247 Win=65535 Len=0
1,5.411750000000012,62.210.85.178,10.0.2.15,TCP,60,9001  >  35978 [ACK] Seq=446383 Ack=7666707 Win=65535 Len=0
1,5.411786000000006,10.0.2.15,62.210.85.178,TLSv1.2,1204,Application Data
1,5.411845,10.0.2.15,62.210.85.178,TCP,2974,35978  >  9001 [ACK] Seq=7667857 Ack=446383 Win=65535 Len=2920 [TCP segment of a reassembled PDU]
1,5.411880999999994,62.210.85.178,10.0.2.15,TCP,60,9001  >  35978 [ACK] Seq=446383 Ack=7667857 Win=65535 Len=0
1,5.411887000000007,62.210.85.178,10.0.2.15,TCP,60,9001  >  35978 [ACK] Seq=446383 Ack=7669317 Win=65535 Len=0
1,5.411890999999997,62.210.85.178,10.0.2.15,TCP,60,9001  >  35978 [ACK] Seq=446383 Ack=7670777 Win=65535 Len=0
1,5.411921000000007,10.0.2.15,62.210.85.178,TLSv1.2,1204,Application Data
1,5.412001000000004,62.210.85.178,10.0.2.15,TCP,60,9001  >  35978 [ACK] Seq=446383 Ack=7671927 Win=65535 Len=0
1,5.412034000000006,10.0.2.15,62.210.85.178,TLSv1.2,332,Application Data
1,5.412068000000005,62.210.85.178,10.0.2.15,TCP,60,9001  >  35978 [ACK] Seq=446383 Ack=7672205 Win=65535 Len=0
1,5.41211100000001,10.0.2.15,62.210.85.178,TLSv1.2,3868,Application Data
