No.,Time,Source,Destination,Protocol,Length,Info
1,0.04015199999997776,62.210.85.178,10.0.2.15,TLSv1.2,590,Application Data
1,0.0403079999999818,10.0.2.15,54.93.77.70,TCP,54,34692  >  9001 [ACK] Seq=376803 Ack=6563575 Win=65535 Len=0
1,0.08409199999999828,10.0.2.15,62.210.85.178,TCP,54,35978  >  9001 [ACK] Seq=6562035 Ack=374485 Win=65535 Len=0
1,0.13514599999999177,62.210.85.178,10.0.2.15,TLSv1.2,590,Application Data
1,0.1352550000000008,10.0.2.15,62.210.85.178,TCP,54,35978  >  9001 [ACK] Seq=6562035 Ack=375021 Win=65535 Len=0
1,0.14774099999999635,10.0.2.15,54.93.77.70,TLSv1.2,590,Application Data
1,0.14792899999997644,54.93.77.70,10.0.2.15,TCP,60,9001  >  34692 [ACK] Seq=6563575 Ack=377339 Win=65535 Len=0
1,0.1532529999999781,62.210.85.178,10.0.2.15,TLSv1.2,590,Application Data
1,0.15331199999999967,10.0.2.15,62.210.85.178,TCP,54,35978  >  9001 [ACK] Seq=6562035 Ack=375557 Win=65535 Len=0
1,0.5372270000000015,62.210.85.178,10.0.2.15,TLSv1.2,590,Application Data
1,0.5373479999999802,10.0.2.15,62.210.85.178,TCP,54,35978  >  9001 [ACK] Seq=6562035 Ack=376093 Win=65535 Len=0
1,0.5380349999999794,10.0.2.15,62.210.85.178,TLSv1.2,590,Application Data
1,0.5382079999999974,62.210.85.178,10.0.2.15,TCP,60,9001  >  35978 [ACK] Seq=376093 Ack=6562571 Win=65535 Len=0
1,0.6360059999999805,54.93.77.70,10.0.2.15,TLSv1.2,590,Application Data
1,0.6361079999999788,10.0.2.15,54.93.77.70,TCP,54,34692  >  9001 [ACK] Seq=377339 Ack=6564111 Win=65535 Len=0
1,0.6366439999999898,10.0.2.15,54.93.77.70,TLSv1.2,1618,Application Data
1,0.6368359999999882,54.93.77.70,10.0.2.15,TCP,60,9001  >  34692 [ACK] Seq=6564111 Ack=378799 Win=65535 Len=0
1,0.6368549999999971,54.93.77.70,10.0.2.15,TCP,60,9001  >  34692 [ACK] Seq=6564111 Ack=378903 Win=65535 Len=0
1,0.8445609999999988,62.210.85.178,10.0.2.15,TLSv1.2,1618,Application Data
1,0.844695999999999,10.0.2.15,62.210.85.178,TCP,54,35978  >  9001 [ACK] Seq=6562571 Ack=377657 Win=65535 Len=0
1,0.8586349999999925,10.0.2.15,62.210.85.178,TLSv1.2,590,Application Data
1,0.8588509999999872,62.210.85.178,10.0.2.15,TCP,60,9001  >  35978 [ACK] Seq=377657 Ack=6563107 Win=65535 Len=0
1,0.8720239999999819,10.0.2.15,62.210.85.178,TLSv1.2,1618,Application Data
1,0.872208999999998,62.210.85.178,10.0.2.15,TCP,60,9001  >  35978 [ACK] Seq=377657 Ack=6564567 Win=65535 Len=0
1,0.8722309999999993,62.210.85.178,10.0.2.15,TCP,60,9001  >  35978 [ACK] Seq=377657 Ack=6564671 Win=65535 Len=0
1,0.9716799999999921,54.93.77.70,10.0.2.15,TLSv1.2,590,Application Data
1,1.0018709999999942,54.93.77.70,10.0.2.15,TLSv1.2,1618,Application Data
1,1.0020339999999806,10.0.2.15,54.93.77.70,TCP,54,34692  >  9001 [ACK] Seq=378903 Ack=6566211 Win=65535 Len=0
1,1.005110000000002,10.0.2.15,54.93.77.70,TLSv1.2,590,Application Data
1,1.0053049999999928,54.93.77.70,10.0.2.15,TCP,60,9001  >  34692 [ACK] Seq=6566211 Ack=379439 Win=65535 Len=0
1,1.4585769999999911,62.210.85.178,10.0.2.15,TLSv1.2,590,Application Data
1,1.458941999999979,10.0.2.15,62.210.85.178,TLSv1.2,590,Application Data
1,1.45908399999999,62.210.85.178,10.0.2.15,TCP,60,9001  >  35978 [ACK] Seq=378193 Ack=6565207 Win=65535 Len=0
1,1.5565349999999967,54.93.77.70,10.0.2.15,TLSv1.2,590,Application Data
1,1.5569459999999822,10.0.2.15,54.93.77.70,TLSv1.2,590,Application Data
1,1.5571019999999862,54.93.77.70,10.0.2.15,TCP,60,9001  >  34692 [ACK] Seq=6566747 Ack=379975 Win=65535 Len=0
1,1.6601169999999854,62.210.85.178,10.0.2.15,TLSv1.2,590,Application Data
1,1.6647909999999797,10.0.2.15,62.210.85.178,TLSv1.2,590,Application Data
1,1.6649850000000015,62.210.85.178,10.0.2.15,TCP,60,9001  >  35978 [ACK] Seq=378729 Ack=6565743 Win=65535 Len=0
1,1.6763149999999882,10.0.2.15,62.210.85.178,TLSv1.2,4124,Application Data
1,1.676464999999979,10.0.2.15,62.210.85.178,TCP,2974,35978  >  9001 [ACK] Seq=6569813 Ack=378729 Win=65535 Len=2920 [TCP segment of a reassembled PDU]
1,1.6765189999999848,62.210.85.178,10.0.2.15,TCP,60,9001  >  35978 [ACK] Seq=378729 Ack=6567203 Win=65535 Len=0
1,1.676530999999983,62.210.85.178,10.0.2.15,TCP,60,9001  >  35978 [ACK] Seq=378729 Ack=6568663 Win=65535 Len=0
1,1.6765359999999987,62.210.85.178,10.0.2.15,TCP,60,9001  >  35978 [ACK] Seq=378729 Ack=6569813 Win=65535 Len=0
1,1.676540999999986,62.210.85.178,10.0.2.15,TCP,60,9001  >  35978 [ACK] Seq=378729 Ack=6571273 Win=65535 Len=0
1,1.6765460000000019,62.210.85.178,10.0.2.15,TCP,60,9001  >  35978 [ACK] Seq=378729 Ack=6572733 Win=65535 Len=0
1,1.6765939999999944,10.0.2.15,62.210.85.178,TLSv1.2,1204,Application Data
1,1.6766889999999819,62.210.85.178,10.0.2.15,TCP,60,9001  >  35978 [ACK] Seq=378729 Ack=6573883 Win=65535 Len=0
1,1.6767269999999996,10.0.2.15,62.210.85.178,TLSv1.2,1232,Application Data
1,1.6768069999999966,62.210.85.178,10.0.2.15,TCP,60,9001  >  35978 [ACK] Seq=378729 Ack=6575061 Win=65535 Len=0
1,1.7664069999999867,54.93.77.70,10.0.2.15,TLSv1.2,3674,Application Data
1,1.7665529999999876,10.0.2.15,54.93.77.70,TCP,54,34692  >  9001 [ACK] Seq=379975 Ack=6570367 Win=65535 Len=0
1,1.8010589999999809,54.93.77.70,10.0.2.15,TCP,2950,"9001  >  34692 [PSH, ACK] Seq=6570367 Ack=379975 Win=65535 Len=2896 [TCP segment of a reassembled PDU]"
1,1.8011630000000025,10.0.2.15,54.93.77.70,TCP,54,34692  >  9001 [ACK] Seq=379975 Ack=6573263 Win=65535 Len=0
1,1.8019269999999779,54.93.77.70,10.0.2.15,TLSv1.2,778,Application Data
1,1.8195279999999912,54.93.77.70,10.0.2.15,TLSv1.2,1502,Application Data
1,1.8196329999999818,10.0.2.15,54.93.77.70,TCP,54,34692  >  9001 [ACK] Seq=379975 Ack=6575435 Win=65535 Len=0
1,1.8369160000000022,54.93.77.70,10.0.2.15,TLSv1.2,1220,Application Data
1,1.8399629999999831,10.0.2.15,54.93.77.70,TLSv1.2,590,Application Data
1,1.840170999999998,54.93.77.70,10.0.2.15,TCP,60,9001  >  34692 [ACK] Seq=6576601 Ack=380511 Win=65535 Len=0
1,1.9723520000000008,62.210.85.178,10.0.2.15,TLSv1.2,590,Application Data
1,1.973639999999989,10.0.2.15,62.210.85.178,TLSv1.2,590,Application Data
1,1.9740520000000004,62.210.85.178,10.0.2.15,TCP,60,9001  >  35978 [ACK] Seq=379265 Ack=6575597 Win=65535 Len=0
1,2.0758909999999844,54.93.77.70,10.0.2.15,TLSv1.2,590,Application Data
1,2.0764789999999778,10.0.2.15,54.93.77.70,TLSv1.2,590,Application Data
1,2.0766179999999963,54.93.77.70,10.0.2.15,TCP,60,9001  >  34692 [ACK] Seq=6577137 Ack=381047 Win=65535 Len=0
1,2.3372209999999995,62.210.85.178,10.0.2.15,TLSv1.2,590,Application Data
1,2.3416739999999834,10.0.2.15,62.210.85.178,TLSv1.2,590,Application Data
1,2.341875999999985,62.210.85.178,10.0.2.15,TCP,60,9001  >  35978 [ACK] Seq=379801 Ack=6576133 Win=65535 Len=0
1,2.355401999999998,10.0.2.15,62.210.85.178,TLSv1.2,4124,Application Data
1,2.3555360000000007,10.0.2.15,62.210.85.178,TCP,2974,35978  >  9001 [ACK] Seq=6580203 Ack=379801 Win=65535 Len=2920 [TCP segment of a reassembled PDU]
1,2.355585999999988,62.210.85.178,10.0.2.15,TCP,60,9001  >  35978 [ACK] Seq=379801 Ack=6577593 Win=65535 Len=0
1,2.3555979999999863,62.210.85.178,10.0.2.15,TCP,60,9001  >  35978 [ACK] Seq=379801 Ack=6579053 Win=65535 Len=0
1,2.355603000000002,62.210.85.178,10.0.2.15,TCP,60,9001  >  35978 [ACK] Seq=379801 Ack=6580203 Win=65535 Len=0
1,2.355606999999992,62.210.85.178,10.0.2.15,TCP,60,9001  >  35978 [ACK] Seq=379801 Ack=6581663 Win=65535 Len=0
1,2.3556119999999794,62.210.85.178,10.0.2.15,TCP,60,9001  >  35978 [ACK] Seq=379801 Ack=6583123 Win=65535 Len=0
1,2.355659000000003,10.0.2.15,62.210.85.178,TLSv1.2,818,Application Data
1,2.3557419999999922,62.210.85.178,10.0.2.15,TCP,60,9001  >  35978 [ACK] Seq=379801 Ack=6583887 Win=65535 Len=0
1,2.5077059999999847,54.93.77.70,10.0.2.15,TLSv1.2,590,Application Data
1,2.510237999999987,54.93.77.70,10.0.2.15,TLSv1.2,7294,"Application Data, Application Data"
1,2.5103659999999763,10.0.2.15,54.93.77.70,TCP,54,34692  >  9001 [ACK] Seq=381047 Ack=6584913 Win=65535 Len=0
1,2.510660999999999,10.0.2.15,54.93.77.70,TLSv1.2,590,Application Data
1,2.5108249999999828,54.93.77.70,10.0.2.15,TCP,60,9001  >  34692 [ACK] Seq=6584913 Ack=381583 Win=65535 Len=0
1,2.5520190000000014,10.0.2.15,54.93.77.70,TLSv1.2,590,Application Data
1,2.5522279999999853,54.93.77.70,10.0.2.15,TCP,60,9001  >  34692 [ACK] Seq=6584913 Ack=382119 Win=65535 Len=0
1,2.5620899999999835,10.0.2.15,54.93.77.70,TLSv1.2,590,Application Data
1,2.562246999999985,54.93.77.70,10.0.2.15,TCP,60,9001  >  34692 [ACK] Seq=6584913 Ack=382655 Win=65535 Len=0
1,2.6467919999999765,54.93.77.70,10.0.2.15,TLSv1.2,590,Application Data
1,2.6501799999999776,62.210.85.178,10.0.2.15,TLSv1.2,590,Application Data
1,2.6872439999999926,10.0.2.15,54.93.77.70,TCP,54,34692  >  9001 [ACK] Seq=382655 Ack=6585449 Win=65535 Len=0
1,2.6912379999999985,10.0.2.15,62.210.85.178,TCP,54,35978  >  9001 [ACK] Seq=6583887 Ack=380337 Win=65535 Len=0
1,2.787387999999993,62.210.85.178,10.0.2.15,TLSv1.2,1104,Application Data
1,2.7874869999999987,10.0.2.15,62.210.85.178,TCP,54,35978  >  9001 [ACK] Seq=6583887 Ack=381387 Win=65535 Len=0
1,2.788170999999977,10.0.2.15,62.210.85.178,TLSv1.2,590,Application Data
1,2.788361999999978,62.210.85.178,10.0.2.15,TCP,60,9001  >  35978 [ACK] Seq=381387 Ack=6584423 Win=65535 Len=0
1,2.9216519999999946,54.93.77.70,10.0.2.15,TLSv1.2,590,Application Data
1,2.9217439999999897,10.0.2.15,54.93.77.70,TCP,54,34692  >  9001 [ACK] Seq=382655 Ack=6585985 Win=65535 Len=0
1,2.922208999999981,10.0.2.15,54.93.77.70,TLSv1.2,590,Application Data
1,2.922359,54.93.77.70,10.0.2.15,TCP,60,9001  >  34692 [ACK] Seq=6585985 Ack=383191 Win=65535 Len=0
1,3.119447999999977,62.210.85.178,10.0.2.15,TLSv1.2,590,Application Data
1,3.1257650000000012,10.0.2.15,62.210.85.178,TLSv1.2,590,Application Data
1,3.1259729999999877,62.210.85.178,10.0.2.15,TCP,60,9001  >  35978 [ACK] Seq=381923 Ack=6584959 Win=65535 Len=0
1,3.136587999999989,10.0.2.15,62.210.85.178,TLSv1.2,4124,Application Data
1,3.136726999999979,62.210.85.178,10.0.2.15,TCP,60,9001  >  35978 [ACK] Seq=381923 Ack=6586419 Win=65535 Len=0
1,3.1367609999999786,62.210.85.178,10.0.2.15,TCP,60,9001  >  35978 [ACK] Seq=381923 Ack=6587879 Win=65535 Len=0
1,3.1367659999999944,62.210.85.178,10.0.2.15,TCP,60,9001  >  35978 [ACK] Seq=381923 Ack=6589029 Win=65535 Len=0
1,3.1368789999999933,10.0.2.15,62.210.85.178,TLSv1.2,4124,Application Data
1,3.1369880000000023,62.210.85.178,10.0.2.15,TCP,60,9001  >  35978 [ACK] Seq=381923 Ack=6590489 Win=65535 Len=0
1,3.136997999999977,62.210.85.178,10.0.2.15,TCP,60,9001  >  35978 [ACK] Seq=381923 Ack=6591949 Win=65535 Len=0
1,3.137002999999993,62.210.85.178,10.0.2.15,TCP,60,9001  >  35978 [ACK] Seq=381923 Ack=6593099 Win=65535 Len=0
1,3.137049999999988,10.0.2.15,62.210.85.178,TLSv1.2,4124,Application Data
1,3.137092999999993,62.210.85.178,10.0.2.15,TCP,60,9001  >  35978 [ACK] Seq=381923 Ack=6594559 Win=65535 Len=0
1,3.1371010000000012,62.210.85.178,10.0.2.15,TCP,60,9001  >  35978 [ACK] Seq=381923 Ack=6596019 Win=65535 Len=0
1,3.1371059999999886,62.210.85.178,10.0.2.15,TCP,60,9001  >  35978 [ACK] Seq=381923 Ack=6597169 Win=65535 Len=0
1,3.137158999999997,10.0.2.15,62.210.85.178,TLSv1.2,4124,Application Data
1,3.137202000000002,62.210.85.178,10.0.2.15,TCP,60,9001  >  35978 [ACK] Seq=381923 Ack=6598629 Win=65535 Len=0
1,3.1372089999999844,62.210.85.178,10.0.2.15,TCP,60,9001  >  35978 [ACK] Seq=381923 Ack=6600089 Win=65535 Len=0
1,3.137285999999989,10.0.2.15,62.210.85.178,TLSv1.2,2974,Application Data
1,3.1373299999999915,62.210.85.178,10.0.2.15,TCP,60,9001  >  35978 [ACK] Seq=381923 Ack=6601239 Win=65535 Len=0
1,3.137338999999997,62.210.85.178,10.0.2.15,TCP,60,9001  >  35978 [ACK] Seq=381923 Ack=6602699 Win=65535 Len=0
1,3.1373439999999846,62.210.85.178,10.0.2.15,TCP,60,9001  >  35978 [ACK] Seq=381923 Ack=6604159 Win=65535 Len=0
1,3.1373839999999973,10.0.2.15,62.210.85.178,TLSv1.2,1226,Application Data
1,3.137424999999979,62.210.85.178,10.0.2.15,TCP,60,9001  >  35978 [ACK] Seq=381923 Ack=6605331 Win=65535 Len=0
1,3.13747699999999,10.0.2.15,62.210.85.178,TLSv1.2,4124,Application Data
1,3.1375209999999925,62.210.85.178,10.0.2.15,TCP,60,9001  >  35978 [ACK] Seq=381923 Ack=6606791 Win=65535 Len=0
1,3.137528000000003,62.210.85.178,10.0.2.15,TCP,60,9001  >  35978 [ACK] Seq=381923 Ack=6608251 Win=65535 Len=0
1,3.1375329999999906,62.210.85.178,10.0.2.15,TCP,60,9001  >  35978 [ACK] Seq=381923 Ack=6609401 Win=65535 Len=0
1,3.1375839999999755,10.0.2.15,62.210.85.178,TLSv1.2,3030,Application Data
1,3.1376269999999806,62.210.85.178,10.0.2.15,TCP,60,9001  >  35978 [ACK] Seq=381923 Ack=6610861 Win=65535 Len=0
1,3.1376339999999914,62.210.85.178,10.0.2.15,TCP,60,9001  >  35978 [ACK] Seq=381923 Ack=6612321 Win=65535 Len=0
1,3.1376389999999788,62.210.85.178,10.0.2.15,TCP,60,9001  >  35978 [ACK] Seq=381923 Ack=6612377 Win=65535 Len=0
1,3.146880999999979,10.0.2.15,62.210.85.178,TLSv1.2,2132,Application Data
1,3.1470359999999857,62.210.85.178,10.0.2.15,TCP,60,9001  >  35978 [ACK] Seq=381923 Ack=6613837 Win=65535 Len=0
1,3.1470609999999795,62.210.85.178,10.0.2.15,TCP,60,9001  >  35978 [ACK] Seq=381923 Ack=6614455 Win=65535 Len=0
1,3.431997999999993,54.93.77.70,10.0.2.15,TCP,2950,"9001  >  34692 [PSH, ACK] Seq=6585985 Ack=383191 Win=65535 Len=2896 [TCP segment of a reassembled PDU]"
1,3.4320419999999956,54.93.77.70,10.0.2.15,TLSv1.2,10914,"Application Data, Application Data, Application Data, Application Data"
1,3.4321589999999844,10.0.2.15,54.93.77.70,TCP,54,34692  >  9001 [ACK] Seq=383191 Ack=6599741 Win=65535 Len=0
1,3.449216999999976,54.93.77.70,10.0.2.15,TLSv1.2,2950,Application Data [TCP segment of a reassembled PDU]
1,3.449259999999981,54.93.77.70,10.0.2.15,TLSv1.2,7294,"Application Data, Application Data, Application Data"
1,3.449360999999982,10.0.2.15,54.93.77.70,TCP,54,34692  >  9001 [ACK] Seq=383191 Ack=6602637 Win=65535 Len=0
1,3.449454000000003,10.0.2.15,54.93.77.70,TCP,54,34692  >  9001 [ACK] Seq=383191 Ack=6609877 Win=65535 Len=0
1,3.4497049999999945,54.93.77.70,10.0.2.15,TLSv1.2,4138,"Application Data, Application Data"
1,3.449832999999984,10.0.2.15,54.93.77.70,TCP,54,34692  >  9001 [ACK] Seq=383191 Ack=6613961 Win=65535 Len=0
1,3.4500189999999975,10.0.2.15,54.93.77.70,TLSv1.2,590,Application Data
1,3.4501029999999844,54.93.77.70,10.0.2.15,TCP,60,9001  >  34692 [ACK] Seq=6613961 Ack=383727 Win=65535 Len=0
1,3.572737999999987,54.93.77.70,10.0.2.15,TLSv1.2,2132,Application Data
1,3.572850999999986,10.0.2.15,54.93.77.70,TCP,54,34692  >  9001 [ACK] Seq=383727 Ack=6616039 Win=65535 Len=0
1,3.5765119999999797,10.0.2.15,54.93.77.70,TLSv1.2,590,Application Data
1,3.5766929999999775,54.93.77.70,10.0.2.15,TCP,60,9001  >  34692 [ACK] Seq=6616039 Ack=384263 Win=65535 Len=0
1,3.582917999999978,62.210.85.178,10.0.2.15,TLSv1.2,590,Application Data
1,3.6232669999999985,10.0.2.15,62.210.85.178,TCP,54,35978  >  9001 [ACK] Seq=6614455 Ack=382459 Win=65535 Len=0
1,3.7366759999999886,62.210.85.178,10.0.2.15,TLSv1.2,590,Application Data
1,3.7368099999999913,10.0.2.15,62.210.85.178,TCP,54,35978  >  9001 [ACK] Seq=6614455 Ack=382995 Win=65535 Len=0
1,3.737384999999989,10.0.2.15,62.210.85.178,TLSv1.2,590,Application Data
1,3.737528999999995,62.210.85.178,10.0.2.15,TCP,60,9001  >  35978 [ACK] Seq=382995 Ack=6614991 Win=65535 Len=0
1,3.8434409999999843,54.93.77.70,10.0.2.15,TLSv1.2,590,Application Data
1,3.843835999999982,10.0.2.15,54.93.77.70,TLSv1.2,590,Application Data
1,3.8439539999999965,54.93.77.70,10.0.2.15,TCP,60,9001  >  34692 [ACK] Seq=6616575 Ack=384799 Win=65535 Len=0
1,3.9505679999999757,62.210.85.178,10.0.2.15,TLSv1.2,590,Application Data
1,3.9562159999999835,10.0.2.15,62.210.85.178,TLSv1.2,590,Application Data
1,3.9566469999999754,62.210.85.178,10.0.2.15,TCP,60,9001  >  35978 [ACK] Seq=383531 Ack=6615527 Win=65535 Len=0
1,3.9679749999999956,10.0.2.15,62.210.85.178,TLSv1.2,4124,Application Data
1,3.9681129999999882,10.0.2.15,62.210.85.178,TCP,2974,35978  >  9001 [ACK] Seq=6619597 Ack=383531 Win=65535 Len=2920 [TCP segment of a reassembled PDU]
1,3.968161999999978,62.210.85.178,10.0.2.15,TCP,60,9001  >  35978 [ACK] Seq=383531 Ack=6616987 Win=65535 Len=0
1,3.9681759999999997,62.210.85.178,10.0.2.15,TCP,60,9001  >  35978 [ACK] Seq=383531 Ack=6618447 Win=65535 Len=0
1,3.968180999999987,62.210.85.178,10.0.2.15,TCP,60,9001  >  35978 [ACK] Seq=383531 Ack=6619597 Win=65535 Len=0
1,3.968184999999977,62.210.85.178,10.0.2.15,TCP,60,9001  >  35978 [ACK] Seq=383531 Ack=6621057 Win=65535 Len=0
1,3.968187999999998,62.210.85.178,10.0.2.15,TCP,60,9001  >  35978 [ACK] Seq=383531 Ack=6622517 Win=65535 Len=0
1,3.9682339999999954,10.0.2.15,62.210.85.178,TLSv1.2,1204,Application Data
1,3.968272999999982,62.210.85.178,10.0.2.15,TCP,60,9001  >  35978 [ACK] Seq=383531 Ack=6623667 Win=65535 Len=0
1,3.9683189999999797,10.0.2.15,62.210.85.178,TLSv1.2,4124,Application Data
1,3.9683589999999924,62.210.85.178,10.0.2.15,TCP,60,9001  >  35978 [ACK] Seq=383531 Ack=6625127 Win=65535 Len=0
1,3.968367999999998,62.210.85.178,10.0.2.15,TCP,60,9001  >  35978 [ACK] Seq=383531 Ack=6626587 Win=65535 Len=0
1,3.968371999999988,62.210.85.178,10.0.2.15,TCP,60,9001  >  35978 [ACK] Seq=383531 Ack=6627737 Win=65535 Len=0
1,3.9684110000000032,10.0.2.15,62.210.85.178,TLSv1.2,4124,Application Data
1,3.9684509999999875,62.210.85.178,10.0.2.15,TCP,60,9001  >  35978 [ACK] Seq=383531 Ack=6629197 Win=65535 Len=0
1,3.9684589999999957,62.210.85.178,10.0.2.15,TCP,60,9001  >  35978 [ACK] Seq=383531 Ack=6630657 Win=65535 Len=0
1,3.968463999999983,62.210.85.178,10.0.2.15,TCP,60,9001  >  35978 [ACK] Seq=383531 Ack=6631807 Win=65535 Len=0
1,3.9684999999999775,10.0.2.15,62.210.85.178,TLSv1.2,332,Application Data
1,3.9685360000000003,62.210.85.178,10.0.2.15,TCP,60,9001  >  35978 [ACK] Seq=383531 Ack=6632085 Win=65535 Len=0
1,3.968595999999991,10.0.2.15,62.210.85.178,TLSv1.2,3868,Application Data
1,3.9686579999999765,62.210.85.178,10.0.2.15,TCP,60,9001  >  35978 [ACK] Seq=383531 Ack=6633545 Win=65535 Len=0
1,3.9686649999999872,62.210.85.178,10.0.2.15,TCP,60,9001  >  35978 [ACK] Seq=383531 Ack=6635005 Win=65535 Len=0
1,3.9686679999999797,62.210.85.178,10.0.2.15,TCP,60,9001  >  35978 [ACK] Seq=383531 Ack=6635899 Win=65535 Len=0
1,3.9687059999999974,10.0.2.15,62.210.85.178,TLSv1.2,4124,Application Data
1,3.9687649999999906,62.210.85.178,10.0.2.15,TCP,60,9001  >  35978 [ACK] Seq=383531 Ack=6637359 Win=65535 Len=0
1,3.9687720000000013,62.210.85.178,10.0.2.15,TCP,60,9001  >  35978 [ACK] Seq=383531 Ack=6638819 Win=65535 Len=0
1,3.9687749999999937,62.210.85.178,10.0.2.15,TCP,60,9001  >  35978 [ACK] Seq=383531 Ack=6639969 Win=65535 Len=0
1,3.9688060000000007,10.0.2.15,62.210.85.178,TLSv1.2,3030,Application Data
1,3.9688409999999976,62.210.85.178,10.0.2.15,TCP,60,9001  >  35978 [ACK] Seq=383531 Ack=6641429 Win=65535 Len=0
1,3.9688489999999774,62.210.85.178,10.0.2.15,TCP,60,9001  >  35978 [ACK] Seq=383531 Ack=6642889 Win=65535 Len=0
1,3.9688519999999983,62.210.85.178,10.0.2.15,TCP,60,9001  >  35978 [ACK] Seq=383531 Ack=6642945 Win=65535 Len=0
1,3.978079999999977,10.0.2.15,62.210.85.178,TLSv1.2,4124,Application Data
1,3.978185999999994,10.0.2.15,62.210.85.178,TCP,2974,35978  >  9001 [ACK] Seq=6647015 Ack=383531 Win=65535 Len=2920 [TCP segment of a reassembled PDU]
1,3.9782559999999876,62.210.85.178,10.0.2.15,TCP,60,9001  >  35978 [ACK] Seq=383531 Ack=6644405 Win=65535 Len=0
1,3.9782669999999882,62.210.85.178,10.0.2.15,TCP,60,9001  >  35978 [ACK] Seq=383531 Ack=6645865 Win=65535 Len=0
1,3.9782730000000015,62.210.85.178,10.0.2.15,TCP,60,9001  >  35978 [ACK] Seq=383531 Ack=6647015 Win=65535 Len=0
1,3.9782769999999914,62.210.85.178,10.0.2.15,TCP,60,9001  >  35978 [ACK] Seq=383531 Ack=6648475 Win=65535 Len=0
1,3.978281999999979,62.210.85.178,10.0.2.15,TCP,60,9001  >  35978 [ACK] Seq=383531 Ack=6649935 Win=65535 Len=0
1,3.9783180000000016,10.0.2.15,62.210.85.178,TLSv1.2,1204,Application Data
1,3.978352000000001,62.210.85.178,10.0.2.15,TCP,60,9001  >  35978 [ACK] Seq=383531 Ack=6651085 Win=65535 Len=0
1,3.978398999999996,10.0.2.15,62.210.85.178,TLSv1.2,4124,Application Data
1,3.978457999999989,62.210.85.178,10.0.2.15,TCP,60,9001  >  35978 [ACK] Seq=383531 Ack=6652545 Win=65535 Len=0
1,3.9784640000000024,62.210.85.178,10.0.2.15,TCP,60,9001  >  35978 [ACK] Seq=383531 Ack=6654005 Win=65535 Len=0
1,3.978466999999995,62.210.85.178,10.0.2.15,TCP,60,9001  >  35978 [ACK] Seq=383531 Ack=6655155 Win=65535 Len=0
1,3.9785029999999892,10.0.2.15,62.210.85.178,TLSv1.2,4124,Application Data
1,3.9785349999999937,62.210.85.178,10.0.2.15,TCP,60,9001  >  35978 [ACK] Seq=383531 Ack=6656615 Win=65535 Len=0
1,3.978541999999976,62.210.85.178,10.0.2.15,TCP,60,9001  >  35978 [ACK] Seq=383531 Ack=6658075 Win=65535 Len=0
1,3.978546999999992,62.210.85.178,10.0.2.15,TCP,60,9001  >  35978 [ACK] Seq=383531 Ack=6659225 Win=65535 Len=0
1,3.9785809999999913,10.0.2.15,62.210.85.178,TLSv1.2,332,Application Data
1,3.978615999999988,62.210.85.178,10.0.2.15,TCP,60,9001  >  35978 [ACK] Seq=383531 Ack=6659503 Win=65535 Len=0
1,3.978673999999984,10.0.2.15,62.210.85.178,TLSv1.2,3868,Application Data
1,3.9787589999999966,10.0.2.15,62.210.85.178,TCP,2974,35978  >  9001 [ACK] Seq=6663317 Ack=383531 Win=65535 Len=2920 [TCP segment of a reassembled PDU]
1,3.9787800000000004,62.210.85.178,10.0.2.15,TCP,60,9001  >  35978 [ACK] Seq=383531 Ack=6660963 Win=65535 Len=0
1,3.9787869999999828,62.210.85.178,10.0.2.15,TCP,60,9001  >  35978 [ACK] Seq=383531 Ack=6662423 Win=65535 Len=0
1,3.9787919999999986,62.210.85.178,10.0.2.15,TCP,60,9001  >  35978 [ACK] Seq=383531 Ack=6663317 Win=65535 Len=0
1,3.9787959999999885,62.210.85.178,10.0.2.15,TCP,60,9001  >  35978 [ACK] Seq=383531 Ack=6664777 Win=65535 Len=0
1,3.9787999999999784,62.210.85.178,10.0.2.15,TCP,60,9001  >  35978 [ACK] Seq=383531 Ack=6666237 Win=65535 Len=0
1,3.978829999999988,10.0.2.15,62.210.85.178,TLSv1.2,1204,Application Data
1,3.9788619999999923,62.210.85.178,10.0.2.15,TCP,60,9001  >  35978 [ACK] Seq=383531 Ack=6667387 Win=65535 Len=0
1,3.9789019999999766,10.0.2.15,62.210.85.178,TLSv1.2,3030,Application Data
1,3.978935999999976,62.210.85.178,10.0.2.15,TCP,60,9001  >  35978 [ACK] Seq=383531 Ack=6668847 Win=65535 Len=0
1,3.978942999999987,62.210.85.178,10.0.2.15,TCP,60,9001  >  35978 [ACK] Seq=383531 Ack=6670307 Win=65535 Len=0
1,3.978945999999979,62.210.85.178,10.0.2.15,TCP,60,9001  >  35978 [ACK] Seq=383531 Ack=6670363 Win=65535 Len=0
1,3.9914839999999856,10.0.2.15,62.210.85.178,TLSv1.2,4124,Application Data
1,3.9916439999999795,62.210.85.178,10.0.2.15,TCP,60,9001  >  35978 [ACK] Seq=383531 Ack=6671823 Win=65535 Len=0
1,3.9916669999999783,62.210.85.178,10.0.2.15,TCP,60,9001  >  35978 [ACK] Seq=383531 Ack=6673283 Win=65535 Len=0
1,3.9916709999999966,62.210.85.178,10.0.2.15,TCP,60,9001  >  35978 [ACK] Seq=383531 Ack=6674433 Win=65535 Len=0
1,3.991706999999991,10.0.2.15,62.210.85.178,TLSv1.2,140,Application Data
1,3.991772999999995,62.210.85.178,10.0.2.15,TCP,60,9001  >  35978 [ACK] Seq=383531 Ack=6674519 Win=65535 Len=0
1,4.046679999999981,54.93.77.70,10.0.2.15,TLSv1.2,590,Application Data
1,4.079392999999982,54.93.77.70,10.0.2.15,TCP,2950,"9001  >  34692 [PSH, ACK] Seq=6617111 Ack=384799 Win=65535 Len=2896 [TCP segment of a reassembled PDU]"
1,4.079484999999977,54.93.77.70,10.0.2.15,TLSv1.2,2894,Application Data [TCP segment of a reassembled PDU]
1,4.079540999999978,10.0.2.15,54.93.77.70,TCP,54,34692  >  9001 [ACK] Seq=384799 Ack=6620007 Win=65535 Len=0
1,4.079593999999986,54.93.77.70,10.0.2.15,TLSv1.2,2072,Application Data
1,4.0796689999999955,10.0.2.15,54.93.77.70,TCP,54,34692  >  9001 [ACK] Seq=384799 Ack=6624865 Win=65535 Len=0
1,4.086032999999986,54.93.77.70,10.0.2.15,TCP,2950,"9001  >  34692 [PSH, ACK] Seq=6624865 Ack=384799 Win=65535 Len=2896 [TCP segment of a reassembled PDU]"
1,4.086111999999986,10.0.2.15,54.93.77.70,TCP,54,34692  >  9001 [ACK] Seq=384799 Ack=6627761 Win=65535 Len=0
1,4.087312999999995,54.93.77.70,10.0.2.15,TLSv1.2,4398,"Application Data, Application Data"
1,4.087391999999994,10.0.2.15,54.93.77.70,TCP,54,34692  >  9001 [ACK] Seq=384799 Ack=6632105 Win=65535 Len=0
1,4.096311999999983,54.93.77.70,10.0.2.15,TLSv1.2,5846,Application Data
1,4.096386999999993,10.0.2.15,54.93.77.70,TCP,54,34692  >  9001 [ACK] Seq=384799 Ack=6637897 Win=65535 Len=0
1,4.098282999999981,54.93.77.70,10.0.2.15,TLSv1.2,3580,"Application Data, Application Data"
1,4.098347999999987,10.0.2.15,54.93.77.70,TCP,54,34692  >  9001 [ACK] Seq=384799 Ack=6641423 Win=65535 Len=0
1,4.098553999999979,10.0.2.15,54.93.77.70,TLSv1.2,590,Application Data
1,4.098640999999986,54.93.77.70,10.0.2.15,TCP,60,9001  >  34692 [ACK] Seq=6641423 Ack=385335 Win=65535 Len=0
1,4.110516999999987,54.93.77.70,10.0.2.15,TLSv1.2,5846,Application Data
1,4.110655999999977,10.0.2.15,54.93.77.70,TCP,54,34692  >  9001 [ACK] Seq=385335 Ack=6647215 Win=65535 Len=0
1,4.110838000000001,10.0.2.15,54.93.77.70,TLSv1.2,590,Application Data
1,4.110921999999988,54.93.77.70,10.0.2.15,TCP,60,9001  >  34692 [ACK] Seq=6647215 Ack=385871 Win=65535 Len=0
1,4.112955999999997,54.93.77.70,10.0.2.15,TLSv1.2,5846,Application Data [TCP segment of a reassembled PDU]
1,4.113022000000001,10.0.2.15,54.93.77.70,TCP,54,34692  >  9001 [ACK] Seq=385871 Ack=6653007 Win=65535 Len=0
1,4.114762999999982,54.93.77.70,10.0.2.15,TLSv1.2,894,"Application Data, Application Data"
1,4.118988999999999,54.93.77.70,10.0.2.15,TLSv1.2,5846,Application Data
1,4.1190560000000005,10.0.2.15,54.93.77.70,TCP,54,34692  >  9001 [ACK] Seq=385871 Ack=6659639 Win=65535 Len=0
1,4.119934000000001,54.93.77.70,10.0.2.15,TLSv1.2,2950,Application Data [TCP segment of a reassembled PDU]
1,4.119997999999981,10.0.2.15,54.93.77.70,TCP,54,34692  >  9001 [ACK] Seq=385871 Ack=6662535 Win=65535 Len=0
1,4.12050499999998,54.93.77.70,10.0.2.15,TCP,2950,"9001  >  34692 [PSH, ACK] Seq=6662535 Ack=385871 Win=65535 Len=2896 [TCP segment of a reassembled PDU]"
1,4.120556999999991,10.0.2.15,54.93.77.70,TCP,54,34692  >  9001 [ACK] Seq=385871 Ack=6665431 Win=65535 Len=0
1,4.129549999999995,54.93.77.70,10.0.2.15,TLSv1.2,2950,"Application Data, Application Data"
1,4.129629999999992,10.0.2.15,54.93.77.70,TCP,54,34692  >  9001 [ACK] Seq=385871 Ack=6668327 Win=65535 Len=0
1,4.1370299999999816,54.93.77.70,10.0.2.15,TLSv1.2,2950,Application Data [TCP segment of a reassembled PDU]
1,4.137158999999997,10.0.2.15,54.93.77.70,TCP,54,34692  >  9001 [ACK] Seq=385871 Ack=6671223 Win=65535 Len=0
1,4.137781999999987,10.0.2.15,54.93.77.70,TLSv1.2,590,Application Data
1,4.13805099999999,54.93.77.70,10.0.2.15,TCP,60,9001  >  34692 [ACK] Seq=6671223 Ack=386407 Win=65535 Len=0
1,4.139283999999975,54.93.77.70,10.0.2.15,TLSv1.2,1314,Application Data
1,4.17074599999998,54.93.77.70,10.0.2.15,TCP,2950,"9001  >  34692 [PSH, ACK] Seq=6672483 Ack=386407 Win=65535 Len=2896 [TCP segment of a reassembled PDU]"
1,4.170873,10.0.2.15,54.93.77.70,TCP,54,34692  >  9001 [ACK] Seq=386407 Ack=6675379 Win=65535 Len=0
1,4.189670999999976,54.93.77.70,10.0.2.15,TLSv1.2,778,Application Data
1,4.192432999999994,10.0.2.15,54.93.77.70,TLSv1.2,590,Application Data
1,4.192635999999993,54.93.77.70,10.0.2.15,TCP,60,9001  >  34692 [ACK] Seq=6676103 Ack=386943 Win=65535 Len=0
1,4.222239000000002,62.210.85.178,10.0.2.15,TLSv1.2,1104,Application Data
1,4.263240999999994,10.0.2.15,62.210.85.178,TCP,54,35978  >  9001 [ACK] Seq=6674519 Ack=384581 Win=65535 Len=0
1,4.291753,62.210.85.178,10.0.2.15,TLSv1.2,590,Application Data
1,4.291865000000001,10.0.2.15,62.210.85.178,TCP,54,35978  >  9001 [ACK] Seq=6674519 Ack=385117 Win=65535 Len=0
1,4.311044999999979,62.210.85.178,10.0.2.15,TLSv1.2,590,Application Data
1,4.311153999999988,10.0.2.15,62.210.85.178,TCP,54,35978  >  9001 [ACK] Seq=6674519 Ack=385653 Win=65535 Len=0
1,4.3118069999999875,10.0.2.15,62.210.85.178,TLSv1.2,590,Application Data
1,4.311994999999996,62.210.85.178,10.0.2.15,TCP,60,9001  >  35978 [ACK] Seq=385653 Ack=6675055 Win=65535 Len=0
1,4.432616999999993,54.93.77.70,10.0.2.15,TLSv1.2,590,Application Data
1,4.433132999999998,10.0.2.15,54.93.77.70,TLSv1.2,590,Application Data
1,4.433301,54.93.77.70,10.0.2.15,TCP,60,9001  >  34692 [ACK] Seq=6676639 Ack=387479 Win=65535 Len=0
1,4.547593999999975,62.210.85.178,10.0.2.15,TLSv1.2,590,Application Data
1,4.555027999999993,10.0.2.15,62.210.85.178,TLSv1.2,590,Application Data
1,4.555272000000002,62.210.85.178,10.0.2.15,TCP,60,9001  >  35978 [ACK] Seq=386189 Ack=6675591 Win=65535 Len=0
1,4.567855999999978,10.0.2.15,62.210.85.178,TLSv1.2,4124,Application Data
1,4.567994999999996,10.0.2.15,62.210.85.178,TCP,2974,35978  >  9001 [ACK] Seq=6679661 Ack=386189 Win=65535 Len=2920 [TCP segment of a reassembled PDU]
1,4.568053999999989,62.210.85.178,10.0.2.15,TCP,60,9001  >  35978 [ACK] Seq=386189 Ack=6677051 Win=65535 Len=0
1,4.5680659999999875,62.210.85.178,10.0.2.15,TCP,60,9001  >  35978 [ACK] Seq=386189 Ack=6678511 Win=65535 Len=0
1,4.568070999999975,62.210.85.178,10.0.2.15,TCP,60,9001  >  35978 [ACK] Seq=386189 Ack=6679661 Win=65535 Len=0
1,4.568074999999993,62.210.85.178,10.0.2.15,TCP,60,9001  >  35978 [ACK] Seq=386189 Ack=6681121 Win=65535 Len=0
1,4.568079999999981,62.210.85.178,10.0.2.15,TCP,60,9001  >  35978 [ACK] Seq=386189 Ack=6682581 Win=65535 Len=0
1,4.568126999999976,10.0.2.15,62.210.85.178,TLSv1.2,1204,Application Data
1,4.568220999999994,10.0.2.15,62.210.85.178,TCP,2974,35978  >  9001 [ACK] Seq=6683731 Ack=386189 Win=65535 Len=2920 [TCP segment of a reassembled PDU]
1,4.568246999999985,62.210.85.178,10.0.2.15,TCP,60,9001  >  35978 [ACK] Seq=386189 Ack=6683731 Win=65535 Len=0
1,4.568285000000003,10.0.2.15,62.210.85.178,TLSv1.2,1204,Application Data
1,4.5683329999999955,62.210.85.178,10.0.2.15,TCP,60,9001  >  35978 [ACK] Seq=386189 Ack=6685191 Win=65535 Len=0
1,4.568339999999978,62.210.85.178,10.0.2.15,TCP,60,9001  >  35978 [ACK] Seq=386189 Ack=6686651 Win=65535 Len=0
1,4.568343999999996,62.210.85.178,10.0.2.15,TCP,60,9001  >  35978 [ACK] Seq=386189 Ack=6687801 Win=65535 Len=0
1,4.568395999999979,10.0.2.15,62.210.85.178,TLSv1.2,4124,Application Data
1,4.5684909999999945,62.210.85.178,10.0.2.15,TCP,60,9001  >  35978 [ACK] Seq=386189 Ack=6689261 Win=65535 Len=0
1,4.568500999999998,62.210.85.178,10.0.2.15,TCP,60,9001  >  35978 [ACK] Seq=386189 Ack=6690721 Win=65535 Len=0
1,4.568504999999988,62.210.85.178,10.0.2.15,TCP,60,9001  >  35978 [ACK] Seq=386189 Ack=6691871 Win=65535 Len=0
1,4.568542999999977,10.0.2.15,62.210.85.178,TLSv1.2,332,Application Data
1,4.568618999999984,62.210.85.178,10.0.2.15,TCP,60,9001  >  35978 [ACK] Seq=386189 Ack=6692149 Win=65535 Len=0
1,4.568653999999981,10.0.2.15,62.210.85.178,TCP,2974,35978  >  9001 [ACK] Seq=6692149 Ack=386189 Win=65535 Len=2920 [TCP segment of a reassembled PDU]
1,4.568710999999979,10.0.2.15,62.210.85.178,TLSv1.2,948,Application Data
1,4.568745999999976,62.210.85.178,10.0.2.15,TCP,60,9001  >  35978 [ACK] Seq=386189 Ack=6693609 Win=65535 Len=0
1,4.568752999999987,62.210.85.178,10.0.2.15,TCP,60,9001  >  35978 [ACK] Seq=386189 Ack=6695069 Win=65535 Len=0
1,4.5687580000000025,62.210.85.178,10.0.2.15,TCP,60,9001  >  35978 [ACK] Seq=386189 Ack=6695963 Win=65535 Len=0
1,4.5688069999999925,10.0.2.15,62.210.85.178,TLSv1.2,4124,Application Data
1,4.568849999999998,62.210.85.178,10.0.2.15,TCP,60,9001  >  35978 [ACK] Seq=386189 Ack=6697423 Win=65535 Len=0
1,4.56885699999998,62.210.85.178,10.0.2.15,TCP,60,9001  >  35978 [ACK] Seq=386189 Ack=6698883 Win=65535 Len=0
1,4.568861999999996,62.210.85.178,10.0.2.15,TCP,60,9001  >  35978 [ACK] Seq=386189 Ack=6700033 Win=65535 Len=0
1,4.568911999999983,10.0.2.15,62.210.85.178,TLSv1.2,3030,Application Data
1,4.5690290000000005,62.210.85.178,10.0.2.15,TCP,60,9001  >  35978 [ACK] Seq=386189 Ack=6701493 Win=65535 Len=0
1,4.569047999999981,62.210.85.178,10.0.2.15,TCP,60,9001  >  35978 [ACK] Seq=386189 Ack=6702953 Win=65535 Len=0
1,4.569052999999997,62.210.85.178,10.0.2.15,TCP,60,9001  >  35978 [ACK] Seq=386189 Ack=6703009 Win=65535 Len=0
1,4.579385000000002,10.0.2.15,62.210.85.178,TLSv1.2,4124,Application Data
1,4.57956999999999,10.0.2.15,62.210.85.178,TCP,2974,35978  >  9001 [ACK] Seq=6707079 Ack=386189 Win=65535 Len=2920 [TCP segment of a reassembled PDU]
1,4.579603999999989,62.210.85.178,10.0.2.15,TCP,60,9001  >  35978 [ACK] Seq=386189 Ack=6704469 Win=65535 Len=0
1,4.579615999999987,62.210.85.178,10.0.2.15,TCP,60,9001  >  35978 [ACK] Seq=386189 Ack=6705929 Win=65535 Len=0
1,4.579621000000003,62.210.85.178,10.0.2.15,TCP,60,9001  >  35978 [ACK] Seq=386189 Ack=6707079 Win=65535 Len=0
1,4.57962599999999,62.210.85.178,10.0.2.15,TCP,60,9001  >  35978 [ACK] Seq=386189 Ack=6708539 Win=65535 Len=0
1,4.57962999999998,62.210.85.178,10.0.2.15,TCP,60,9001  >  35978 [ACK] Seq=386189 Ack=6709999 Win=65535 Len=0
1,4.579675999999978,10.0.2.15,62.210.85.178,TLSv1.2,1204,Application Data
1,4.579718999999983,62.210.85.178,10.0.2.15,TCP,60,9001  >  35978 [ACK] Seq=386189 Ack=6711149 Win=65535 Len=0
1,4.579772999999989,10.0.2.15,62.210.85.178,TLSv1.2,4124,Application Data
1,4.579816999999991,62.210.85.178,10.0.2.15,TCP,60,9001  >  35978 [ACK] Seq=386189 Ack=6712609 Win=65535 Len=0
1,4.579824000000002,62.210.85.178,10.0.2.15,TCP,60,9001  >  35978 [ACK] Seq=386189 Ack=6714069 Win=65535 Len=0
1,4.579835000000003,62.210.85.178,10.0.2.15,TCP,60,9001  >  35978 [ACK] Seq=386189 Ack=6715219 Win=65535 Len=0
1,4.579889999999978,10.0.2.15,62.210.85.178,TLSv1.2,3866,Application Data
1,4.57992999999999,62.210.85.178,10.0.2.15,TCP,60,9001  >  35978 [ACK] Seq=386189 Ack=6716679 Win=65535 Len=0
1,4.5799379999999985,62.210.85.178,10.0.2.15,TCP,60,9001  >  35978 [ACK] Seq=386189 Ack=6718139 Win=65535 Len=0
1,4.579942999999986,62.210.85.178,10.0.2.15,TCP,60,9001  >  35978 [ACK] Seq=386189 Ack=6719031 Win=65535 Len=0
1,4.661722999999995,54.93.77.70,10.0.2.15,TLSv1.2,3674,Application Data
1,4.661873999999983,10.0.2.15,54.93.77.70,TCP,54,34692  >  9001 [ACK] Seq=387479 Ack=6680259 Win=65535 Len=0
1,4.66986399999999,54.93.77.70,10.0.2.15,TLSv1.2,10190,"Application Data, Application Data"
1,4.670009999999991,10.0.2.15,54.93.77.70,TCP,54,34692  >  9001 [ACK] Seq=387479 Ack=6690395 Win=65535 Len=0
1,4.678685999999999,54.93.77.70,10.0.2.15,TLSv1.2,778,Application Data
1,4.679001999999997,10.0.2.15,54.93.77.70,TLSv1.2,590,Application Data
1,4.67915499999998,54.93.77.70,10.0.2.15,TCP,60,9001  >  34692 [ACK] Seq=6691119 Ack=388015 Win=65535 Len=0
1,4.701743999999991,54.93.77.70,10.0.2.15,TCP,2950,"9001  >  34692 [PSH, ACK] Seq=6691119 Ack=388015 Win=65535 Len=2896 [TCP segment of a reassembled PDU]"
1,4.702247,10.0.2.15,54.93.77.70,TCP,54,34692  >  9001 [ACK] Seq=388015 Ack=6694015 Win=65535 Len=0
1,4.704037,54.93.77.70,10.0.2.15,TLSv1.2,8194,"Application Data, Application Data"
1,4.704182000000003,10.0.2.15,54.93.77.70,TCP,54,34692  >  9001 [ACK] Seq=388015 Ack=6702155 Win=65535 Len=0
1,4.711388999999997,54.93.77.70,10.0.2.15,TLSv1.2,2950,Application Data [TCP segment of a reassembled PDU]
1,4.711548999999991,10.0.2.15,54.93.77.70,TCP,54,34692  >  9001 [ACK] Seq=388015 Ack=6705051 Win=65535 Len=0
1,4.711727999999994,54.93.77.70,10.0.2.15,TCP,1502,"9001  >  34692 [PSH, ACK] Seq=6705051 Ack=388015 Win=65535 Len=1448 [TCP segment of a reassembled PDU]"
1,4.7118919999999775,10.0.2.15,54.93.77.70,TLSv1.2,590,Application Data
1,4.711995000000002,54.93.77.70,10.0.2.15,TCP,60,9001  >  34692 [ACK] Seq=6706499 Ack=388551 Win=65535 Len=0
1,4.712294999999983,54.93.77.70,10.0.2.15,TLSv1.2,8742,"Application Data, Application Data"
1,4.712393999999989,10.0.2.15,54.93.77.70,TCP,54,34692  >  9001 [ACK] Seq=388551 Ack=6715187 Win=65535 Len=0
1,4.7132780000000025,54.93.77.70,10.0.2.15,TLSv1.2,1502,Application Data [TCP segment of a reassembled PDU]
1,4.713336999999996,10.0.2.15,54.93.77.70,TCP,54,34692  >  9001 [ACK] Seq=388551 Ack=6716635 Win=65535 Len=0
1,4.720408999999989,54.93.77.70,10.0.2.15,TLSv1.2,392,Application Data
1,4.742079999999987,54.93.77.70,10.0.2.15,TLSv1.2,3674,Application Data
1,4.7422289999999805,10.0.2.15,54.93.77.70,TCP,54,34692  >  9001 [ACK] Seq=388551 Ack=6720593 Win=65535 Len=0
1,4.745874999999984,10.0.2.15,54.93.77.70,TLSv1.2,590,Application Data
1,4.746161000000001,54.93.77.70,10.0.2.15,TCP,60,9001  >  34692 [ACK] Seq=6720593 Ack=389087 Win=65535 Len=0
1,4.786439000000001,62.210.85.178,10.0.2.15,TLSv1.2,590,Application Data
1,4.827219999999983,10.0.2.15,62.210.85.178,TCP,54,35978  >  9001 [ACK] Seq=6719031 Ack=386725 Win=65535 Len=0
1,4.864559999999983,62.210.85.178,10.0.2.15,TLSv1.2,590,Application Data
1,4.8646889999999985,10.0.2.15,62.210.85.178,TCP,54,35978  >  9001 [ACK] Seq=6719031 Ack=387261 Win=65535 Len=0
1,4.937432999999999,62.210.85.178,10.0.2.15,TLSv1.2,590,Application Data
1,4.937544000000003,10.0.2.15,62.210.85.178,TCP,54,35978  >  9001 [ACK] Seq=6719031 Ack=387797 Win=65535 Len=0
1,4.938138999999978,10.0.2.15,62.210.85.178,TLSv1.2,590,Application Data
1,4.938457,62.210.85.178,10.0.2.15,TCP,60,9001  >  35978 [ACK] Seq=387797 Ack=6719567 Win=65535 Len=0
1,5.056663999999984,54.93.77.70,10.0.2.15,TLSv1.2,590,Application Data
1,5.057148999999981,10.0.2.15,54.93.77.70,TLSv1.2,590,Application Data
1,5.057284999999979,54.93.77.70,10.0.2.15,TCP,60,9001  >  34692 [ACK] Seq=6721129 Ack=389623 Win=65535 Len=0
1,5.160798999999997,62.210.85.178,10.0.2.15,TLSv1.2,590,Application Data
1,5.171905999999979,10.0.2.15,62.210.85.178,TLSv1.2,590,Application Data
1,5.173735999999991,62.210.85.178,10.0.2.15,TCP,60,9001  >  35978 [ACK] Seq=388333 Ack=6720103 Win=65535 Len=0
1,5.183839999999975,10.0.2.15,62.210.85.178,TLSv1.2,4124,Application Data
1,5.183978999999994,10.0.2.15,62.210.85.178,TCP,2974,35978  >  9001 [ACK] Seq=6724173 Ack=388333 Win=65535 Len=2920 [TCP segment of a reassembled PDU]
1,5.184086999999977,62.210.85.178,10.0.2.15,TCP,60,9001  >  35978 [ACK] Seq=388333 Ack=6721563 Win=65535 Len=0
1,5.184101999999996,62.210.85.178,10.0.2.15,TCP,60,9001  >  35978 [ACK] Seq=388333 Ack=6723023 Win=65535 Len=0
1,5.184106999999983,62.210.85.178,10.0.2.15,TCP,60,9001  >  35978 [ACK] Seq=388333 Ack=6724173 Win=65535 Len=0
1,5.184109999999976,62.210.85.178,10.0.2.15,TCP,60,9001  >  35978 [ACK] Seq=388333 Ack=6725633 Win=65535 Len=0
1,5.184116999999986,62.210.85.178,10.0.2.15,TCP,60,9001  >  35978 [ACK] Seq=388333 Ack=6727093 Win=65535 Len=0
1,5.1841579999999965,10.0.2.15,62.210.85.178,TLSv1.2,1204,Application Data
1,5.184224999999998,10.0.2.15,62.210.85.178,TCP,2974,35978  >  9001 [ACK] Seq=6728243 Ack=388333 Win=65535 Len=2920 [TCP segment of a reassembled PDU]
1,5.184259999999995,62.210.85.178,10.0.2.15,TCP,60,9001  >  35978 [ACK] Seq=388333 Ack=6728243 Win=65535 Len=0
1,5.18426599999998,62.210.85.178,10.0.2.15,TCP,60,9001  >  35978 [ACK] Seq=388333 Ack=6729703 Win=65535 Len=0
1,5.184269999999998,62.210.85.178,10.0.2.15,TCP,60,9001  >  35978 [ACK] Seq=388333 Ack=6731163 Win=65535 Len=0
1,5.184302000000002,10.0.2.15,62.210.85.178,TLSv1.2,1204,Application Data
1,5.1843339999999785,62.210.85.178,10.0.2.15,TCP,60,9001  >  35978 [ACK] Seq=388333 Ack=6732313 Win=65535 Len=0
1,5.184377999999981,10.0.2.15,62.210.85.178,TLSv1.2,4124,Application Data
1,5.184463999999991,62.210.85.178,10.0.2.15,TCP,60,9001  >  35978 [ACK] Seq=388333 Ack=6733773 Win=65535 Len=0
1,5.184471000000002,62.210.85.178,10.0.2.15,TCP,60,9001  >  35978 [ACK] Seq=388333 Ack=6735233 Win=65535 Len=0
1,5.184474999999992,62.210.85.178,10.0.2.15,TCP,60,9001  >  35978 [ACK] Seq=388333 Ack=6736383 Win=65535 Len=0
1,5.184505999999999,10.0.2.15,62.210.85.178,TLSv1.2,332,Application Data
1,5.184541999999993,62.210.85.178,10.0.2.15,TCP,60,9001  >  35978 [ACK] Seq=388333 Ack=6736661 Win=65535 Len=0
1,5.18458099999998,10.0.2.15,62.210.85.178,TLSv1.2,3868,Application Data
1,5.184641999999997,62.210.85.178,10.0.2.15,TCP,60,9001  >  35978 [ACK] Seq=388333 Ack=6738121 Win=65535 Len=0
1,5.1846479999999815,62.210.85.178,10.0.2.15,TCP,60,9001  >  35978 [ACK] Seq=388333 Ack=6739581 Win=65535 Len=0
1,5.184652,62.210.85.178,10.0.2.15,TCP,60,9001  >  35978 [ACK] Seq=388333 Ack=6740475 Win=65535 Len=0
