No.,Time,Source,Destination,Protocol,Length,Info
1,0.021930999999767664,62.210.85.178,10.0.2.15,TLSv1.2,1104,Application Data
1,0.022040999999717314,10.0.2.15,62.210.85.178,TCP,54,35978  >  9001 [ACK] Seq=142667969 Ack=7821153 Win=65535 Len=0
1,0.1048359999999775,62.210.85.178,10.0.2.15,TLSv1.2,590,Application Data
1,0.10496399999965433,10.0.2.15,62.210.85.178,TCP,54,35978  >  9001 [ACK] Seq=142667969 Ack=7821689 Win=65535 Len=0
1,0.3014909999997144,10.0.2.15,54.93.77.70,TLSv1.2,590,Application Data
1,0.301778000000013,54.93.77.70,10.0.2.15,TCP,60,9001  >  34692 [ACK] Seq=142502741 Ack=7837159 Win=65535 Len=0
1,0.4090320000000247,62.210.85.178,10.0.2.15,TLSv1.2,590,Application Data
1,0.40913000000000466,10.0.2.15,62.210.85.178,TCP,54,35978  >  9001 [ACK] Seq=142667969 Ack=7822225 Win=65535 Len=0
1,0.4094609999997374,10.0.2.15,62.210.85.178,TLSv1.2,590,Application Data
1,0.40955199999962133,62.210.85.178,10.0.2.15,TCP,60,9001  >  35978 [ACK] Seq=7822225 Ack=142668505 Win=65535 Len=0
1,0.603179999999611,54.93.77.70,10.0.2.15,TLSv1.2,590,Application Data
1,0.6036679999997432,10.0.2.15,54.93.77.70,TLSv1.2,1618,Application Data
1,0.6039789999999812,54.93.77.70,10.0.2.15,TCP,60,9001  >  34692 [ACK] Seq=142503277 Ack=7838723 Win=65535 Len=0
1,0.7461299999999937,62.210.85.178,10.0.2.15,TLSv1.2,1618,Application Data
1,0.7464419999996608,10.0.2.15,62.210.85.178,TCP,54,35978  >  9001 [ACK] Seq=142668505 Ack=7823789 Win=65535 Len=0
1,0.7770900000000438,10.0.2.15,62.210.85.178,TLSv1.2,590,Application Data
1,0.7772639999998319,62.210.85.178,10.0.2.15,TCP,60,9001  >  35978 [ACK] Seq=7823789 Ack=142669041 Win=65535 Len=0
1,0.7899210000000494,10.0.2.15,62.210.85.178,TLSv1.2,1618,Application Data
1,0.7901179999998931,62.210.85.178,10.0.2.15,TCP,60,9001  >  35978 [ACK] Seq=7823789 Ack=142670501 Win=65535 Len=0
1,0.7901469999997062,62.210.85.178,10.0.2.15,TCP,60,9001  >  35978 [ACK] Seq=7823789 Ack=142670605 Win=65535 Len=0
1,1.056995999999799,54.93.77.70,10.0.2.15,TLSv1.2,2132,Application Data
1,1.057191999999759,10.0.2.15,54.93.77.70,TCP,54,34692  >  9001 [ACK] Seq=7838723 Ack=142505355 Win=65535 Len=0
1,1.060584999999719,10.0.2.15,54.93.77.70,TLSv1.2,590,Application Data
1,1.0607639999998355,54.93.77.70,10.0.2.15,TCP,60,9001  >  34692 [ACK] Seq=142505355 Ack=7839259 Win=65535 Len=0
1,1.4737430000000131,62.210.85.178,10.0.2.15,TLSv1.2,590,Application Data
1,1.4740999999999076,10.0.2.15,62.210.85.178,TLSv1.2,590,Application Data
1,1.4742309999996905,62.210.85.178,10.0.2.15,TCP,60,9001  >  35978 [ACK] Seq=7824325 Ack=142671141 Win=65535 Len=0
1,1.6510019999996075,54.93.77.70,10.0.2.15,TLSv1.2,590,Application Data
1,1.6527909999999792,10.0.2.15,54.93.77.70,TLSv1.2,590,Application Data
1,1.6529689999997572,54.93.77.70,10.0.2.15,TCP,60,9001  >  34692 [ACK] Seq=142505891 Ack=7839795 Win=65535 Len=0
1,1.7938759999997274,62.210.85.178,10.0.2.15,TLSv1.2,590,Application Data
1,1.8005679999996573,10.0.2.15,62.210.85.178,TLSv1.2,590,Application Data
1,1.8007729999999356,62.210.85.178,10.0.2.15,TCP,60,9001  >  35978 [ACK] Seq=7824861 Ack=142671677 Win=65535 Len=0
1,1.8142669999997452,10.0.2.15,62.210.85.178,TLSv1.2,4124,Application Data
1,1.8147030000000086,62.210.85.178,10.0.2.15,TCP,60,9001  >  35978 [ACK] Seq=7824861 Ack=142673137 Win=65535 Len=0
1,1.8148079999996298,62.210.85.178,10.0.2.15,TCP,60,9001  >  35978 [ACK] Seq=7824861 Ack=142674597 Win=65535 Len=0
1,1.8148119999996197,62.210.85.178,10.0.2.15,TCP,60,9001  >  35978 [ACK] Seq=7824861 Ack=142675747 Win=65535 Len=0
1,1.8148919999998725,10.0.2.15,62.210.85.178,TLSv1.2,4124,Application Data
1,1.8150049999999283,62.210.85.178,10.0.2.15,TCP,60,9001  >  35978 [ACK] Seq=7824861 Ack=142677207 Win=65535 Len=0
1,1.815023999999994,62.210.85.178,10.0.2.15,TCP,60,9001  >  35978 [ACK] Seq=7824861 Ack=142678667 Win=65535 Len=0
1,1.8150299999997515,62.210.85.178,10.0.2.15,TCP,60,9001  >  35978 [ACK] Seq=7824861 Ack=142679817 Win=65535 Len=0
1,1.815099999999802,10.0.2.15,62.210.85.178,TLSv1.2,4124,Application Data
1,1.8152029999996557,10.0.2.15,62.210.85.178,TCP,2974,35978  >  9001 [ACK] Seq=142683887 Ack=7824861 Win=65535 Len=2920 [TCP segment of a reassembled PDU]
1,1.8155639999999948,62.210.85.178,10.0.2.15,TCP,60,9001  >  35978 [ACK] Seq=7824861 Ack=142681277 Win=65535 Len=0
1,1.8155899999997018,62.210.85.178,10.0.2.15,TCP,60,9001  >  35978 [ACK] Seq=7824861 Ack=142682737 Win=65535 Len=0
1,1.815595999999914,62.210.85.178,10.0.2.15,TCP,60,9001  >  35978 [ACK] Seq=7824861 Ack=142683887 Win=65535 Len=0
1,1.8156009999997877,62.210.85.178,10.0.2.15,TCP,60,9001  >  35978 [ACK] Seq=7824861 Ack=142685347 Win=65535 Len=0
1,1.8156059999996614,62.210.85.178,10.0.2.15,TCP,60,9001  >  35978 [ACK] Seq=7824861 Ack=142686807 Win=65535 Len=0
1,1.8156709999998384,10.0.2.15,62.210.85.178,TLSv1.2,1482,"Application Data, Application Data"
1,1.8160759999996117,10.0.2.15,62.210.85.178,TCP,2974,35978  >  9001 [ACK] Seq=142688235 Ack=7824861 Win=65535 Len=2920 [TCP segment of a reassembled PDU]
1,1.8161119999999755,62.210.85.178,10.0.2.15,TCP,60,9001  >  35978 [ACK] Seq=7824861 Ack=142688235 Win=65535 Len=0
1,1.8161709999999402,10.0.2.15,62.210.85.178,TLSv1.2,948,Application Data
1,1.8162819999997737,62.210.85.178,10.0.2.15,TCP,60,9001  >  35978 [ACK] Seq=7824861 Ack=142689695 Win=65535 Len=0
1,1.8162959999999657,62.210.85.178,10.0.2.15,TCP,60,9001  >  35978 [ACK] Seq=7824861 Ack=142691155 Win=65535 Len=0
1,1.8163009999998394,62.210.85.178,10.0.2.15,TCP,60,9001  >  35978 [ACK] Seq=7824861 Ack=142692049 Win=65535 Len=0
1,1.8164099999999053,10.0.2.15,62.210.85.178,TLSv1.2,4124,Application Data
1,1.8164639999999963,62.210.85.178,10.0.2.15,TCP,60,9001  >  35978 [ACK] Seq=7824861 Ack=142693509 Win=65535 Len=0
1,1.816475999999966,62.210.85.178,10.0.2.15,TCP,60,9001  >  35978 [ACK] Seq=7824861 Ack=142694969 Win=65535 Len=0
1,1.8164819999997235,62.210.85.178,10.0.2.15,TCP,60,9001  >  35978 [ACK] Seq=7824861 Ack=142696119 Win=65535 Len=0
1,1.8167129999997087,10.0.2.15,62.210.85.178,TLSv1.2,3030,Application Data
1,1.8167669999997997,62.210.85.178,10.0.2.15,TCP,60,9001  >  35978 [ACK] Seq=7824861 Ack=142697579 Win=65535 Len=0
1,1.8167789999997694,62.210.85.178,10.0.2.15,TCP,60,9001  >  35978 [ACK] Seq=7824861 Ack=142699039 Win=65535 Len=0
1,1.8167849999999817,62.210.85.178,10.0.2.15,TCP,60,9001  >  35978 [ACK] Seq=7824861 Ack=142699095 Win=65535 Len=0
1,1.8262679999998,10.0.2.15,62.210.85.178,TLSv1.2,4124,Application Data
1,1.8264009999998052,62.210.85.178,10.0.2.15,TCP,60,9001  >  35978 [ACK] Seq=7824861 Ack=142700555 Win=65535 Len=0
1,1.826415999999881,62.210.85.178,10.0.2.15,TCP,60,9001  >  35978 [ACK] Seq=7824861 Ack=142702015 Win=65535 Len=0
1,1.826419999999871,62.210.85.178,10.0.2.15,TCP,60,9001  >  35978 [ACK] Seq=7824861 Ack=142703165 Win=65535 Len=0
1,1.8264749999998457,10.0.2.15,62.210.85.178,TLSv1.2,4124,Application Data
1,1.8265369999999166,62.210.85.178,10.0.2.15,TCP,60,9001  >  35978 [ACK] Seq=7824861 Ack=142704625 Win=65535 Len=0
1,1.8265440000000126,62.210.85.178,10.0.2.15,TCP,60,9001  >  35978 [ACK] Seq=7824861 Ack=142706085 Win=65535 Len=0
1,1.826546999999664,62.210.85.178,10.0.2.15,TCP,60,9001  >  35978 [ACK] Seq=7824861 Ack=142707235 Win=65535 Len=0
1,1.8265859999996792,10.0.2.15,62.210.85.178,TLSv1.2,3288,Application Data
1,1.826622000000043,62.210.85.178,10.0.2.15,TCP,60,9001  >  35978 [ACK] Seq=7824861 Ack=142708695 Win=65535 Len=0
1,1.8266300000000228,62.210.85.178,10.0.2.15,TCP,60,9001  >  35978 [ACK] Seq=7824861 Ack=142710155 Win=65535 Len=0
1,1.8266340000000127,62.210.85.178,10.0.2.15,TCP,60,9001  >  35978 [ACK] Seq=7824861 Ack=142710469 Win=65535 Len=0
1,1.9615609999996195,54.93.77.70,10.0.2.15,TLSv1.2,590,Application Data
1,1.9638669999999365,54.93.77.70,10.0.2.15,TLSv1.2,7294,"Application Data, Application Data"
1,1.9640939999999318,54.93.77.70,10.0.2.15,TCP,2950,"9001  >  34692 [PSH, ACK] Seq=142513667 Ack=7839795 Win=65535 Len=2896 [TCP segment of a reassembled PDU]"
1,1.9646699999998418,10.0.2.15,54.93.77.70,TCP,54,34692  >  9001 [ACK] Seq=7839795 Ack=142516563 Win=65535 Len=0
1,1.965733999999884,10.0.2.15,54.93.77.70,TLSv1.2,590,Application Data
1,1.9710489999997662,54.93.77.70,10.0.2.15,TLSv1.2,1502,"Application Data, Application Data"
1,1.9711539999998422,54.93.77.70,10.0.2.15,TCP,60,9001  >  34692 [ACK] Seq=142518011 Ack=7840331 Win=65535 Len=0
1,1.9713059999999132,10.0.2.15,54.93.77.70,TCP,54,34692  >  9001 [ACK] Seq=7840331 Ack=142518011 Win=65535 Len=0
1,1.9820780000000013,54.93.77.70,10.0.2.15,TLSv1.2,402,Application Data
1,2.0243499999996857,10.0.2.15,54.93.77.70,TCP,54,34692  >  9001 [ACK] Seq=7840331 Ack=142518359 Win=65535 Len=0
1,2.107668999999987,54.93.77.70,10.0.2.15,TLSv1.2,3674,Application Data
1,2.107720999999856,62.210.85.178,10.0.2.15,TLSv1.2,590,Application Data
1,2.107821999999942,10.0.2.15,54.93.77.70,TCP,54,34692  >  9001 [ACK] Seq=7840331 Ack=142521979 Win=65535 Len=0
1,2.108987999999954,54.93.77.70,10.0.2.15,TLSv1.2,7294,Application Data
1,2.1091010000000097,10.0.2.15,54.93.77.70,TCP,54,34692  >  9001 [ACK] Seq=7840331 Ack=142529219 Win=65535 Len=0
1,2.1216529999996965,54.93.77.70,10.0.2.15,TLSv1.2,568,Application Data
1,2.1218489999996564,10.0.2.15,54.93.77.70,TCP,54,34692  >  9001 [ACK] Seq=7840331 Ack=142529733 Win=65535 Len=0
1,2.148565999999846,10.0.2.15,62.210.85.178,TCP,54,35978  >  9001 [ACK] Seq=142710469 Ack=7825397 Win=65535 Len=0
1,2.179333999999926,54.93.77.70,10.0.2.15,TLSv1.2,590,Application Data
1,2.1795210000000225,10.0.2.15,54.93.77.70,TCP,54,34692  >  9001 [ACK] Seq=7840331 Ack=142530269 Win=65535 Len=0
1,2.1914429999997083,54.93.77.70,10.0.2.15,TLSv1.2,4398,Application Data
1,2.1915070000000014,54.93.77.70,10.0.2.15,TCP,2950,"9001  >  34692 [PSH, ACK] Seq=142534613 Ack=7840331 Win=65535 Len=2896 [TCP segment of a reassembled PDU]"
1,2.191569999999956,10.0.2.15,54.93.77.70,TCP,54,34692  >  9001 [ACK] Seq=7840331 Ack=142534613 Win=65535 Len=0
1,2.1916189999997187,10.0.2.15,54.93.77.70,TCP,54,34692  >  9001 [ACK] Seq=7840331 Ack=142537509 Win=65535 Len=0
1,2.191906999999901,10.0.2.15,54.93.77.70,TLSv1.2,590,Application Data
1,2.191996999999901,54.93.77.70,10.0.2.15,TCP,60,9001  >  34692 [ACK] Seq=142537509 Ack=7840867 Win=65535 Len=0
1,2.195075999999972,54.93.77.70,10.0.2.15,TLSv1.2,568,Application Data
1,2.2142479999997704,54.93.77.70,10.0.2.15,TLSv1.2,7294,"Application Data, Application Data"
1,2.2143569999998363,10.0.2.15,54.93.77.70,TCP,54,34692  >  9001 [ACK] Seq=7840867 Ack=142545263 Win=65535 Len=0
1,2.2183619999996154,10.0.2.15,54.93.77.70,TLSv1.2,590,Application Data
1,2.2185209999997824,54.93.77.70,10.0.2.15,TCP,60,9001  >  34692 [ACK] Seq=142545263 Ack=7841403 Win=65535 Len=0
1,2.3083739999997306,62.210.85.178,10.0.2.15,TLSv1.2,590,Application Data
1,2.30848799999967,10.0.2.15,62.210.85.178,TCP,54,35978  >  9001 [ACK] Seq=142710469 Ack=7825933 Win=65535 Len=0
1,2.3928280000000086,62.210.85.178,10.0.2.15,TLSv1.2,590,Application Data
1,2.3929149999999026,10.0.2.15,62.210.85.178,TCP,54,35978  >  9001 [ACK] Seq=142710469 Ack=7826469 Win=65535 Len=0
1,2.3932230000000345,10.0.2.15,62.210.85.178,TLSv1.2,590,Application Data
1,2.393325999999888,62.210.85.178,10.0.2.15,TCP,60,9001  >  35978 [ACK] Seq=7826469 Ack=142711005 Win=65535 Len=0
1,2.499108999999862,54.93.77.70,10.0.2.15,TLSv1.2,590,Application Data
1,2.4997549999998228,10.0.2.15,54.93.77.70,TLSv1.2,590,Application Data
1,2.499988999999914,54.93.77.70,10.0.2.15,TCP,60,9001  >  34692 [ACK] Seq=142545799 Ack=7841939 Win=65535 Len=0
1,2.6520919999998114,62.210.85.178,10.0.2.15,TLSv1.2,590,Application Data
1,2.6609959999996136,10.0.2.15,62.210.85.178,TLSv1.2,590,Application Data
1,2.6611579999998867,62.210.85.178,10.0.2.15,TCP,60,9001  >  35978 [ACK] Seq=7827005 Ack=142711541 Win=65535 Len=0
1,2.67369699999972,10.0.2.15,62.210.85.178,TLSv1.2,4124,Application Data
1,2.6740129999998317,10.0.2.15,62.210.85.178,TCP,2974,35978  >  9001 [ACK] Seq=142715611 Ack=7827005 Win=65535 Len=2920 [TCP segment of a reassembled PDU]
1,2.674152000000049,10.0.2.15,62.210.85.178,TLSv1.2,4434,Application Data [TCP segment of a reassembled PDU]
1,2.6742269999999735,62.210.85.178,10.0.2.15,TCP,60,9001  >  35978 [ACK] Seq=7827005 Ack=142713001 Win=65535 Len=0
1,2.674246000000039,62.210.85.178,10.0.2.15,TCP,60,9001  >  35978 [ACK] Seq=7827005 Ack=142714461 Win=65535 Len=0
1,2.674254999999903,62.210.85.178,10.0.2.15,TCP,60,9001  >  35978 [ACK] Seq=7827005 Ack=142715611 Win=65535 Len=0
1,2.6742599999997765,62.210.85.178,10.0.2.15,TCP,60,9001  >  35978 [ACK] Seq=7827005 Ack=142717071 Win=65535 Len=0
1,2.67426499999965,62.210.85.178,10.0.2.15,TCP,60,9001  >  35978 [ACK] Seq=7827005 Ack=142718531 Win=65535 Len=0
1,2.6743639999999687,62.210.85.178,10.0.2.15,TCP,60,9001  >  35978 [ACK] Seq=7827005 Ack=142719991 Win=65535 Len=0
1,2.6743729999998322,62.210.85.178,10.0.2.15,TCP,60,9001  >  35978 [ACK] Seq=7827005 Ack=142721451 Win=65535 Len=0
1,2.6743790000000445,62.210.85.178,10.0.2.15,TCP,60,9001  >  35978 [ACK] Seq=7827005 Ack=142722911 Win=65535 Len=0
1,2.6744369999996707,10.0.2.15,62.210.85.178,TLSv1.2,894,Application Data
1,2.6745639999999185,10.0.2.15,62.210.85.178,TCP,2974,35978  >  9001 [ACK] Seq=142723751 Ack=7827005 Win=65535 Len=2920 [TCP segment of a reassembled PDU]
1,2.674779999999828,62.210.85.178,10.0.2.15,TCP,60,9001  >  35978 [ACK] Seq=7827005 Ack=142723751 Win=65535 Len=0
1,2.6748029999998835,62.210.85.178,10.0.2.15,TCP,60,9001  >  35978 [ACK] Seq=7827005 Ack=142725211 Win=65535 Len=0
1,2.674807999999757,62.210.85.178,10.0.2.15,TCP,60,9001  >  35978 [ACK] Seq=7827005 Ack=142726671 Win=65535 Len=0
1,2.6749689999996917,10.0.2.15,62.210.85.178,TLSv1.2,1482,"Application Data, Application Data"
1,2.6750990000000456,62.210.85.178,10.0.2.15,TCP,60,9001  >  35978 [ACK] Seq=7827005 Ack=142728099 Win=65535 Len=0
1,2.675724999999602,10.0.2.15,62.210.85.178,TLSv1.2,3868,Application Data
1,2.6758279999999104,62.210.85.178,10.0.2.15,TCP,60,9001  >  35978 [ACK] Seq=7827005 Ack=142729559 Win=65535 Len=0
1,2.6758389999999963,62.210.85.178,10.0.2.15,TCP,60,9001  >  35978 [ACK] Seq=7827005 Ack=142731019 Win=65535 Len=0
1,2.67584399999987,62.210.85.178,10.0.2.15,TCP,60,9001  >  35978 [ACK] Seq=7827005 Ack=142731913 Win=65535 Len=0
1,2.6759149999998044,10.0.2.15,62.210.85.178,TLSv1.2,4124,Application Data
1,2.6759909999996125,62.210.85.178,10.0.2.15,TCP,60,9001  >  35978 [ACK] Seq=7827005 Ack=142733373 Win=65535 Len=0
1,2.675999000000047,62.210.85.178,10.0.2.15,TCP,60,9001  >  35978 [ACK] Seq=7827005 Ack=142734833 Win=65535 Len=0
1,2.676003999999921,62.210.85.178,10.0.2.15,TCP,60,9001  >  35978 [ACK] Seq=7827005 Ack=142735983 Win=65535 Len=0
1,2.676054000000022,10.0.2.15,62.210.85.178,TLSv1.2,3030,Application Data
1,2.6761279999996077,62.210.85.178,10.0.2.15,TCP,60,9001  >  35978 [ACK] Seq=7827005 Ack=142737443 Win=65535 Len=0
1,2.6761360000000423,62.210.85.178,10.0.2.15,TCP,60,9001  >  35978 [ACK] Seq=7827005 Ack=142738903 Win=65535 Len=0
1,2.676140000000032,62.210.85.178,10.0.2.15,TCP,60,9001  >  35978 [ACK] Seq=7827005 Ack=142738959 Win=65535 Len=0
1,2.6856549999997696,10.0.2.15,62.210.85.178,TLSv1.2,4124,Application Data
1,2.685967999999775,62.210.85.178,10.0.2.15,TCP,60,9001  >  35978 [ACK] Seq=7827005 Ack=142740419 Win=65535 Len=0
1,2.685990999999831,62.210.85.178,10.0.2.15,TCP,60,9001  >  35978 [ACK] Seq=7827005 Ack=142741879 Win=65535 Len=0
1,2.685997999999927,62.210.85.178,10.0.2.15,TCP,60,9001  >  35978 [ACK] Seq=7827005 Ack=142743029 Win=65535 Len=0
1,2.686087999999927,10.0.2.15,62.210.85.178,TLSv1.2,4124,Application Data
1,2.6861729999995987,10.0.2.15,62.210.85.178,TCP,2974,35978  >  9001 [ACK] Seq=142747099 Ack=7827005 Win=65535 Len=2920 [TCP segment of a reassembled PDU]
1,2.68621499999972,62.210.85.178,10.0.2.15,TCP,60,9001  >  35978 [ACK] Seq=7827005 Ack=142744489 Win=65535 Len=0
1,2.6862229999997,62.210.85.178,10.0.2.15,TCP,60,9001  >  35978 [ACK] Seq=7827005 Ack=142745949 Win=65535 Len=0
1,2.6862280000000283,62.210.85.178,10.0.2.15,TCP,60,9001  >  35978 [ACK] Seq=7827005 Ack=142747099 Win=65535 Len=0
1,2.686232999999902,62.210.85.178,10.0.2.15,TCP,60,9001  >  35978 [ACK] Seq=7827005 Ack=142748559 Win=65535 Len=0
1,2.686236999999892,62.210.85.178,10.0.2.15,TCP,60,9001  >  35978 [ACK] Seq=7827005 Ack=142750019 Win=65535 Len=0
1,2.686279000000013,10.0.2.15,62.210.85.178,TLSv1.2,1204,Application Data
1,2.686329999999998,62.210.85.178,10.0.2.15,TCP,60,9001  >  35978 [ACK] Seq=7827005 Ack=142751169 Win=65535 Len=0
1,2.686380999999983,10.0.2.15,62.210.85.178,TLSv1.2,3352,Application Data
1,2.6865899999997964,62.210.85.178,10.0.2.15,TCP,60,9001  >  35978 [ACK] Seq=7827005 Ack=142752629 Win=65535 Len=0
1,2.6866079999999783,62.210.85.178,10.0.2.15,TCP,60,9001  >  35978 [ACK] Seq=7827005 Ack=142754089 Win=65535 Len=0
1,2.686612999999852,62.210.85.178,10.0.2.15,TCP,60,9001  >  35978 [ACK] Seq=7827005 Ack=142754467 Win=65535 Len=0
1,2.773409999999785,54.93.77.70,10.0.2.15,TCP,2950,"9001  >  34692 [PSH, ACK] Seq=142545799 Ack=7841939 Win=65535 Len=2896 [TCP segment of a reassembled PDU]"
1,2.773601999999755,10.0.2.15,54.93.77.70,TCP,54,34692  >  9001 [ACK] Seq=7841939 Ack=142548695 Win=65535 Len=0
1,2.773863999999776,54.93.77.70,10.0.2.15,TLSv1.2,4912,"Application Data, Application Data"
1,2.7740239999998266,10.0.2.15,54.93.77.70,TCP,54,34692  >  9001 [ACK] Seq=7841939 Ack=142553553 Win=65535 Len=0
1,2.7968439999999646,54.93.77.70,10.0.2.15,TLSv1.2,3674,Application Data
1,2.7971419999998943,10.0.2.15,54.93.77.70,TCP,54,34692  >  9001 [ACK] Seq=7841939 Ack=142557173 Win=65535 Len=0
1,2.823261999999886,54.93.77.70,10.0.2.15,TLSv1.2,4210,"Application Data, Application Data"
1,2.8233759999998256,10.0.2.15,54.93.77.70,TCP,54,34692  >  9001 [ACK] Seq=7841939 Ack=142561329 Win=65535 Len=0
1,2.8239659999999276,10.0.2.15,54.93.77.70,TLSv1.2,590,Application Data
1,2.8241159999997762,54.93.77.70,10.0.2.15,TCP,60,9001  >  34692 [ACK] Seq=142561329 Ack=7842475 Win=65535 Len=0
1,2.8431399999999485,54.93.77.70,10.0.2.15,TCP,2950,"9001  >  34692 [PSH, ACK] Seq=142561329 Ack=7842475 Win=65535 Len=2896 [TCP segment of a reassembled PDU]"
1,2.843301999999767,10.0.2.15,54.93.77.70,TCP,54,34692  >  9001 [ACK] Seq=7842475 Ack=142564225 Win=65535 Len=0
1,2.851057999999739,54.93.77.70,10.0.2.15,TLSv1.2,2950,Application Data [TCP segment of a reassembled PDU]
1,2.851306999999906,54.93.77.70,10.0.2.15,TLSv1.2,5846,"Application Data, Application Data"
1,2.852030999999897,10.0.2.15,54.93.77.70,TCP,54,34692  >  9001 [ACK] Seq=7842475 Ack=142567121 Win=65535 Len=0
1,2.8528819999996813,10.0.2.15,54.93.77.70,TCP,54,34692  >  9001 [ACK] Seq=7842475 Ack=142572913 Win=65535 Len=0
1,2.8595550000000003,54.93.77.70,10.0.2.15,TLSv1.2,2950,Application Data [TCP segment of a reassembled PDU]
1,2.8596589999997377,54.93.77.70,10.0.2.15,TLSv1.2,2950,Application Data [TCP segment of a reassembled PDU]
1,2.85966899999994,54.93.77.70,10.0.2.15,TLSv1.2,1314,Application Data
1,2.859751999999844,10.0.2.15,54.93.77.70,TCP,54,34692  >  9001 [ACK] Seq=7842475 Ack=142575809 Win=65535 Len=0
1,2.859893999999713,10.0.2.15,54.93.77.70,TCP,54,34692  >  9001 [ACK] Seq=7842475 Ack=142579965 Win=65535 Len=0
1,2.8602200000000266,10.0.2.15,54.93.77.70,TLSv1.2,590,Application Data
1,2.8607669999996688,54.93.77.70,10.0.2.15,TCP,60,9001  >  34692 [ACK] Seq=142579965 Ack=7843011 Win=65535 Len=0
1,2.8624159999999392,54.93.77.70,10.0.2.15,TLSv1.2,4398,Application Data
1,2.862514999999803,10.0.2.15,54.93.77.70,TCP,54,34692  >  9001 [ACK] Seq=7843011 Ack=142584309 Win=65535 Len=0
1,2.867858999999953,54.93.77.70,10.0.2.15,TCP,2950,"9001  >  34692 [PSH, ACK] Seq=142584309 Ack=7843011 Win=65535 Len=2896 [TCP segment of a reassembled PDU]"
1,2.868326999999681,10.0.2.15,54.93.77.70,TCP,54,34692  >  9001 [ACK] Seq=7843011 Ack=142587205 Win=65535 Len=0
1,2.8755429999996522,54.93.77.70,10.0.2.15,TLSv1.2,1502,Application Data [TCP segment of a reassembled PDU]
1,2.8756349999998747,10.0.2.15,54.93.77.70,TCP,54,34692  >  9001 [ACK] Seq=7843011 Ack=142588653 Win=65535 Len=0
1,2.8773049999999785,54.93.77.70,10.0.2.15,TLSv1.2,684,Application Data
1,2.880011999999624,10.0.2.15,54.93.77.70,TLSv1.2,590,Application Data
1,2.8801690000000235,54.93.77.70,10.0.2.15,TCP,60,9001  >  34692 [ACK] Seq=142589283 Ack=7843547 Win=65535 Len=0
1,2.9472749999999905,62.210.85.178,10.0.2.15,TLSv1.2,590,Application Data
1,2.9883959999997387,10.0.2.15,62.210.85.178,TCP,54,35978  >  9001 [ACK] Seq=142754467 Ack=7827541 Win=65535 Len=0
1,3.16370599999982,62.210.85.178,10.0.2.15,TLSv1.2,1104,Application Data
1,3.163825999999972,10.0.2.15,62.210.85.178,TCP,54,35978  >  9001 [ACK] Seq=142754467 Ack=7828591 Win=65535 Len=0
1,3.169699000000037,10.0.2.15,62.210.85.178,TLSv1.2,590,Application Data
1,3.1700449999998455,62.210.85.178,10.0.2.15,TCP,60,9001  >  35978 [ACK] Seq=7828591 Ack=142755003 Win=65535 Len=0
1,3.2977509999996073,54.93.77.70,10.0.2.15,TLSv1.2,590,Application Data
1,3.2985749999998006,10.0.2.15,54.93.77.70,TLSv1.2,590,Application Data
1,3.2987929999999324,54.93.77.70,10.0.2.15,TCP,60,9001  >  34692 [ACK] Seq=142589819 Ack=7844083 Win=65535 Len=0
1,3.401731999999811,62.210.85.178,10.0.2.15,TLSv1.2,590,Application Data
1,3.408230999999887,10.0.2.15,62.210.85.178,TLSv1.2,590,Application Data
1,3.408379999999852,62.210.85.178,10.0.2.15,TCP,60,9001  >  35978 [ACK] Seq=7829127 Ack=142755539 Win=65535 Len=0
1,3.421016999999665,10.0.2.15,62.210.85.178,TLSv1.2,4124,Application Data
1,3.421252999999979,10.0.2.15,62.210.85.178,TCP,2974,35978  >  9001 [ACK] Seq=142759609 Ack=7829127 Win=65535 Len=2920 [TCP segment of a reassembled PDU]
1,3.4213159999999334,62.210.85.178,10.0.2.15,TCP,60,9001  >  35978 [ACK] Seq=7829127 Ack=142756999 Win=65535 Len=0
1,3.4213409999997566,62.210.85.178,10.0.2.15,TCP,60,9001  >  35978 [ACK] Seq=7829127 Ack=142758459 Win=65535 Len=0
1,3.42134999999962,62.210.85.178,10.0.2.15,TCP,60,9001  >  35978 [ACK] Seq=7829127 Ack=142759609 Win=65535 Len=0
1,3.4213559999998324,62.210.85.178,10.0.2.15,TCP,60,9001  >  35978 [ACK] Seq=7829127 Ack=142761069 Win=65535 Len=0
1,3.4213620000000446,62.210.85.178,10.0.2.15,TCP,60,9001  >  35978 [ACK] Seq=7829127 Ack=142762529 Win=65535 Len=0
1,3.421425999999883,10.0.2.15,62.210.85.178,TLSv1.2,1204,Application Data
1,3.4214829999996255,62.210.85.178,10.0.2.15,TCP,60,9001  >  35978 [ACK] Seq=7829127 Ack=142763679 Win=65535 Len=0
1,3.421564999999646,10.0.2.15,62.210.85.178,TLSv1.2,4124,Application Data
1,3.4217369999996663,10.0.2.15,62.210.85.178,TCP,2974,35978  >  9001 [ACK] Seq=142767749 Ack=7829127 Win=65535 Len=2920 [TCP segment of a reassembled PDU]
1,3.4218839999998636,62.210.85.178,10.0.2.15,TCP,60,9001  >  35978 [ACK] Seq=7829127 Ack=142765139 Win=65535 Len=0
1,3.421897999999601,62.210.85.178,10.0.2.15,TCP,60,9001  >  35978 [ACK] Seq=7829127 Ack=142766599 Win=65535 Len=0
1,3.4219060000000354,62.210.85.178,10.0.2.15,TCP,60,9001  >  35978 [ACK] Seq=7829127 Ack=142767749 Win=65535 Len=0
1,3.421911999999793,62.210.85.178,10.0.2.15,TCP,60,9001  >  35978 [ACK] Seq=7829127 Ack=142769209 Win=65535 Len=0
1,3.421915999999783,62.210.85.178,10.0.2.15,TCP,60,9001  >  35978 [ACK] Seq=7829127 Ack=142770669 Win=65535 Len=0
1,3.4219809999999597,10.0.2.15,62.210.85.178,TLSv1.2,1204,Application Data
1,3.4221349999997983,62.210.85.178,10.0.2.15,TCP,60,9001  >  35978 [ACK] Seq=7829127 Ack=142771819 Win=65535 Len=0
1,3.4222169999998187,10.0.2.15,62.210.85.178,TLSv1.2,332,Application Data
1,3.4223589999996875,10.0.2.15,62.210.85.178,TCP,2974,35978  >  9001 [ACK] Seq=142772097 Ack=7829127 Win=65535 Len=2920 [TCP segment of a reassembled PDU]
1,3.4224739999999656,62.210.85.178,10.0.2.15,TCP,60,9001  >  35978 [ACK] Seq=7829127 Ack=142772097 Win=65535 Len=0
1,3.4224890000000414,62.210.85.178,10.0.2.15,TCP,60,9001  >  35978 [ACK] Seq=7829127 Ack=142773557 Win=65535 Len=0
1,3.422493999999915,62.210.85.178,10.0.2.15,TCP,60,9001  >  35978 [ACK] Seq=7829127 Ack=142775017 Win=65535 Len=0
1,3.422537999999804,10.0.2.15,62.210.85.178,TLSv1.2,948,Application Data
1,3.4226129999997283,62.210.85.178,10.0.2.15,TCP,60,9001  >  35978 [ACK] Seq=7829127 Ack=142775911 Win=65535 Len=0
1,3.422726999999668,10.0.2.15,62.210.85.178,TLSv1.2,1424,Application Data
1,3.422776999999769,62.210.85.178,10.0.2.15,TCP,60,9001  >  35978 [ACK] Seq=7829127 Ack=142777281 Win=65535 Len=0
1,3.5488259999997354,54.93.77.70,10.0.2.15,TCP,2950,"9001  >  34692 [PSH, ACK] Seq=142589819 Ack=7844083 Win=65535 Len=2896 [TCP segment of a reassembled PDU]"
1,3.5488719999998466,54.93.77.70,10.0.2.15,TLSv1.2,778,Application Data
1,3.5490350000000035,10.0.2.15,54.93.77.70,TCP,54,34692  >  9001 [ACK] Seq=7844083 Ack=142593439 Win=65535 Len=0
1,3.5589740000000347,54.93.77.70,10.0.2.15,TCP,2950,"9001  >  34692 [PSH, ACK] Seq=142593439 Ack=7844083 Win=65535 Len=2896 [TCP segment of a reassembled PDU]"
1,3.5590609999999288,10.0.2.15,54.93.77.70,TCP,54,34692  >  9001 [ACK] Seq=7844083 Ack=142596335 Win=65535 Len=0
1,3.560722999999598,54.93.77.70,10.0.2.15,TLSv1.2,4398,Application Data [TCP segment of a reassembled PDU]
1,3.560793999999987,10.0.2.15,54.93.77.70,TCP,54,34692  >  9001 [ACK] Seq=7844083 Ack=142600679 Win=65535 Len=0
1,3.5676329999996597,54.93.77.70,10.0.2.15,TLSv1.2,2950,"Application Data, Application Data"
1,3.567735999999968,10.0.2.15,54.93.77.70,TCP,54,34692  >  9001 [ACK] Seq=7844083 Ack=142603575 Win=65535 Len=0
1,3.599314999999933,54.93.77.70,10.0.2.15,TLSv1.2,2950,Application Data [TCP segment of a reassembled PDU]
1,3.5994659999996657,10.0.2.15,54.93.77.70,TCP,54,34692  >  9001 [ACK] Seq=7844083 Ack=142606471 Win=65535 Len=0
1,3.651234999999815,54.93.77.70,10.0.2.15,TLSv1.2,5658,"Application Data, Application Data"
1,3.6517439999997805,10.0.2.15,54.93.77.70,TCP,54,34692  >  9001 [ACK] Seq=7844083 Ack=142612075 Win=65535 Len=0
1,3.6620060000000194,10.0.2.15,54.93.77.70,TLSv1.2,590,Application Data
1,3.6621789999999237,54.93.77.70,10.0.2.15,TCP,60,9001  >  34692 [ACK] Seq=142612075 Ack=7844619 Win=65535 Len=0
1,3.7670140000000174,62.210.85.178,10.0.2.15,TLSv1.2,590,Application Data
1,3.7703669999996237,10.0.2.15,62.210.85.178,TLSv1.2,590,Application Data
1,3.7706490000000485,62.210.85.178,10.0.2.15,TCP,60,9001  >  35978 [ACK] Seq=7829663 Ack=142777817 Win=65535 Len=0
1,3.8691579999999703,54.93.77.70,10.0.2.15,TLSv1.2,590,Application Data
1,3.8695709999997234,10.0.2.15,54.93.77.70,TLSv1.2,590,Application Data
1,3.8697199999996883,54.93.77.70,10.0.2.15,TCP,60,9001  >  34692 [ACK] Seq=142612611 Ack=7845155 Win=65535 Len=0
1,3.981397999999899,62.210.85.178,10.0.2.15,TLSv1.2,590,Application Data
1,3.9980679999998756,10.0.2.15,62.210.85.178,TLSv1.2,590,Application Data
1,3.9984239999998863,62.210.85.178,10.0.2.15,TCP,60,9001  >  35978 [ACK] Seq=7830199 Ack=142778353 Win=65535 Len=0
1,4.009982000000036,10.0.2.15,62.210.85.178,TLSv1.2,4124,Application Data
1,4.010150999999951,10.0.2.15,62.210.85.178,TCP,2974,35978  >  9001 [ACK] Seq=142782423 Ack=7830199 Win=65535 Len=2920 [TCP segment of a reassembled PDU]
1,4.010180999999648,62.210.85.178,10.0.2.15,TCP,60,9001  >  35978 [ACK] Seq=7830199 Ack=142779813 Win=65535 Len=0
1,4.010192999999617,62.210.85.178,10.0.2.15,TCP,60,9001  >  35978 [ACK] Seq=7830199 Ack=142781273 Win=65535 Len=0
1,4.010197999999946,62.210.85.178,10.0.2.15,TCP,60,9001  >  35978 [ACK] Seq=7830199 Ack=142782423 Win=65535 Len=0
1,4.010244999999941,10.0.2.15,62.210.85.178,TLSv1.2,1204,Application Data
1,4.010286999999607,62.210.85.178,10.0.2.15,TCP,60,9001  >  35978 [ACK] Seq=7830199 Ack=142783883 Win=65535 Len=0
1,4.010295000000042,62.210.85.178,10.0.2.15,TCP,60,9001  >  35978 [ACK] Seq=7830199 Ack=142785343 Win=65535 Len=0
1,4.010299000000032,62.210.85.178,10.0.2.15,TCP,60,9001  >  35978 [ACK] Seq=7830199 Ack=142786493 Win=65535 Len=0
1,4.01035499999989,10.0.2.15,62.210.85.178,TLSv1.2,4124,Application Data
1,4.010436000000027,62.210.85.178,10.0.2.15,TCP,60,9001  >  35978 [ACK] Seq=7830199 Ack=142787953 Win=65535 Len=0
1,4.010445999999774,62.210.85.178,10.0.2.15,TCP,60,9001  >  35978 [ACK] Seq=7830199 Ack=142789413 Win=65535 Len=0
1,4.010449999999764,62.210.85.178,10.0.2.15,TCP,60,9001  >  35978 [ACK] Seq=7830199 Ack=142790563 Win=65535 Len=0
1,4.010483000000022,10.0.2.15,62.210.85.178,TCP,2974,35978  >  9001 [ACK] Seq=142790563 Ack=7830199 Win=65535 Len=2920 [TCP segment of a reassembled PDU]
1,4.010523999999805,62.210.85.178,10.0.2.15,TCP,60,9001  >  35978 [ACK] Seq=7830199 Ack=142792023 Win=65535 Len=0
1,4.010530999999901,62.210.85.178,10.0.2.15,TCP,60,9001  >  35978 [ACK] Seq=7830199 Ack=142793483 Win=65535 Len=0
1,4.010567999999694,10.0.2.15,62.210.85.178,TLSv1.2,1204,Application Data
1,4.010628999999881,62.210.85.178,10.0.2.15,TCP,60,9001  >  35978 [ACK] Seq=7830199 Ack=142794633 Win=65535 Len=0
1,4.01067699999976,10.0.2.15,62.210.85.178,TLSv1.2,332,Application Data
1,4.010716999999659,62.210.85.178,10.0.2.15,TCP,60,9001  >  35978 [ACK] Seq=7830199 Ack=142794911 Win=65535 Len=0
1,4.010782999999719,10.0.2.15,62.210.85.178,TLSv1.2,3868,Application Data
1,4.010826999999608,62.210.85.178,10.0.2.15,TCP,60,9001  >  35978 [ACK] Seq=7830199 Ack=142796371 Win=65535 Len=0
1,4.010833999999704,62.210.85.178,10.0.2.15,TCP,60,9001  >  35978 [ACK] Seq=7830199 Ack=142797831 Win=65535 Len=0
1,4.010839000000033,62.210.85.178,10.0.2.15,TCP,60,9001  >  35978 [ACK] Seq=7830199 Ack=142798725 Win=65535 Len=0
1,4.010887999999795,10.0.2.15,62.210.85.178,TLSv1.2,4124,Application Data
1,4.010929999999917,62.210.85.178,10.0.2.15,TCP,60,9001  >  35978 [ACK] Seq=7830199 Ack=142800185 Win=65535 Len=0
1,4.010937000000013,62.210.85.178,10.0.2.15,TCP,60,9001  >  35978 [ACK] Seq=7830199 Ack=142801645 Win=65535 Len=0
1,4.010941999999886,62.210.85.178,10.0.2.15,TCP,60,9001  >  35978 [ACK] Seq=7830199 Ack=142802795 Win=65535 Len=0
1,4.0109879999999976,10.0.2.15,62.210.85.178,TLSv1.2,3030,Application Data
1,4.011029999999664,62.210.85.178,10.0.2.15,TCP,60,9001  >  35978 [ACK] Seq=7830199 Ack=142804255 Win=65535 Len=0
1,4.01103699999976,62.210.85.178,10.0.2.15,TCP,60,9001  >  35978 [ACK] Seq=7830199 Ack=142805715 Win=65535 Len=0
1,4.011041999999634,62.210.85.178,10.0.2.15,TCP,60,9001  >  35978 [ACK] Seq=7830199 Ack=142805771 Win=65535 Len=0
1,4.021514000000025,10.0.2.15,62.210.85.178,TLSv1.2,4124,Application Data
1,4.021660999999767,62.210.85.178,10.0.2.15,TCP,60,9001  >  35978 [ACK] Seq=7830199 Ack=142807231 Win=65535 Len=0
1,4.0216819999996005,62.210.85.178,10.0.2.15,TCP,60,9001  >  35978 [ACK] Seq=7830199 Ack=142808691 Win=65535 Len=0
1,4.021684999999707,62.210.85.178,10.0.2.15,TCP,60,9001  >  35978 [ACK] Seq=7830199 Ack=142809841 Win=65535 Len=0
1,4.021772999999939,10.0.2.15,62.210.85.178,TLSv1.2,4124,Application Data
1,4.021852999999737,62.210.85.178,10.0.2.15,TCP,60,9001  >  35978 [ACK] Seq=7830199 Ack=142811301 Win=65535 Len=0
1,4.021863999999823,62.210.85.178,10.0.2.15,TCP,60,9001  >  35978 [ACK] Seq=7830199 Ack=142812761 Win=65535 Len=0
1,4.021866999999929,62.210.85.178,10.0.2.15,TCP,60,9001  >  35978 [ACK] Seq=7830199 Ack=142813911 Win=65535 Len=0
1,4.021899999999732,10.0.2.15,62.210.85.178,TLSv1.2,4124,Application Data
1,4.021968999999899,62.210.85.178,10.0.2.15,TCP,60,9001  >  35978 [ACK] Seq=7830199 Ack=142815371 Win=65535 Len=0
1,4.0219789999996465,62.210.85.178,10.0.2.15,TCP,60,9001  >  35978 [ACK] Seq=7830199 Ack=142816831 Win=65535 Len=0
1,4.021981999999753,62.210.85.178,10.0.2.15,TCP,60,9001  >  35978 [ACK] Seq=7830199 Ack=142817981 Win=65535 Len=0
1,4.02202299999999,10.0.2.15,62.210.85.178,TLSv1.2,4124,Application Data
1,4.022115999999642,62.210.85.178,10.0.2.15,TCP,60,9001  >  35978 [ACK] Seq=7830199 Ack=142819441 Win=65535 Len=0
1,4.022133999999824,62.210.85.178,10.0.2.15,TCP,60,9001  >  35978 [ACK] Seq=7830199 Ack=142820901 Win=65535 Len=0
1,4.022142999999687,62.210.85.178,10.0.2.15,TCP,60,9001  >  35978 [ACK] Seq=7830199 Ack=142822051 Win=65535 Len=0
1,4.022250999999869,10.0.2.15,62.210.85.178,TLSv1.2,332,Application Data
1,4.022339999999986,62.210.85.178,10.0.2.15,TCP,60,9001  >  35978 [ACK] Seq=7830199 Ack=142822329 Win=65535 Len=0
1,4.0224889999999505,10.0.2.15,62.210.85.178,TLSv1.2,3868,Application Data
1,4.022569999999632,62.210.85.178,10.0.2.15,TCP,60,9001  >  35978 [ACK] Seq=7830199 Ack=142823789 Win=65535 Len=0
1,4.022578999999951,62.210.85.178,10.0.2.15,TCP,60,9001  >  35978 [ACK] Seq=7830199 Ack=142825249 Win=65535 Len=0
1,4.022587999999814,62.210.85.178,10.0.2.15,TCP,60,9001  >  35978 [ACK] Seq=7830199 Ack=142826143 Win=65535 Len=0
1,4.022678999999698,10.0.2.15,62.210.85.178,TLSv1.2,4124,Application Data
1,4.022743999999875,62.210.85.178,10.0.2.15,TCP,60,9001  >  35978 [ACK] Seq=7830199 Ack=142827603 Win=65535 Len=0
1,4.022756999999729,62.210.85.178,10.0.2.15,TCP,60,9001  >  35978 [ACK] Seq=7830199 Ack=142829063 Win=65535 Len=0
1,4.022764999999708,62.210.85.178,10.0.2.15,TCP,60,9001  >  35978 [ACK] Seq=7830199 Ack=142830213 Win=65535 Len=0
1,4.022822999999789,10.0.2.15,62.210.85.178,TLSv1.2,3030,Application Data
1,4.0228729999998905,62.210.85.178,10.0.2.15,TCP,60,9001  >  35978 [ACK] Seq=7830199 Ack=142831673 Win=65535 Len=0
1,4.02288099999987,62.210.85.178,10.0.2.15,TCP,60,9001  >  35978 [ACK] Seq=7830199 Ack=142833133 Win=65535 Len=0
1,4.022886999999628,62.210.85.178,10.0.2.15,TCP,60,9001  >  35978 [ACK] Seq=7830199 Ack=142833189 Win=65535 Len=0
1,4.032357999999931,10.0.2.15,62.210.85.178,TLSv1.2,4124,Application Data
1,4.032506000000012,62.210.85.178,10.0.2.15,TCP,60,9001  >  35978 [ACK] Seq=7830199 Ack=142834649 Win=65535 Len=0
1,4.032533999999941,62.210.85.178,10.0.2.15,TCP,60,9001  >  35978 [ACK] Seq=7830199 Ack=142836109 Win=65535 Len=0
1,4.032539999999699,62.210.85.178,10.0.2.15,TCP,60,9001  >  35978 [ACK] Seq=7830199 Ack=142837259 Win=65535 Len=0
1,4.032636999999795,10.0.2.15,62.210.85.178,TLSv1.2,4124,Application Data
1,4.032705999999962,62.210.85.178,10.0.2.15,TCP,60,9001  >  35978 [ACK] Seq=7830199 Ack=142838719 Win=65535 Len=0
1,4.032721000000038,62.210.85.178,10.0.2.15,TCP,60,9001  >  35978 [ACK] Seq=7830199 Ack=142840179 Win=65535 Len=0
1,4.032726999999795,62.210.85.178,10.0.2.15,TCP,60,9001  >  35978 [ACK] Seq=7830199 Ack=142841329 Win=65535 Len=0
1,4.032780999999886,10.0.2.15,62.210.85.178,TLSv1.2,4124,Application Data
1,4.03287999999975,62.210.85.178,10.0.2.15,TCP,60,9001  >  35978 [ACK] Seq=7830199 Ack=142842789 Win=65535 Len=0
1,4.032889999999952,62.210.85.178,10.0.2.15,TCP,60,9001  >  35978 [ACK] Seq=7830199 Ack=142844249 Win=65535 Len=0
1,4.032897000000048,62.210.85.178,10.0.2.15,TCP,60,9001  >  35978 [ACK] Seq=7830199 Ack=142845399 Win=65535 Len=0
1,4.032952000000023,10.0.2.15,62.210.85.178,TLSv1.2,4124,Application Data
1,4.033019999999851,62.210.85.178,10.0.2.15,TCP,60,9001  >  35978 [ACK] Seq=7830199 Ack=142846859 Win=65535 Len=0
1,4.033027999999831,62.210.85.178,10.0.2.15,TCP,60,9001  >  35978 [ACK] Seq=7830199 Ack=142848319 Win=65535 Len=0
1,4.033035999999811,62.210.85.178,10.0.2.15,TCP,60,9001  >  35978 [ACK] Seq=7830199 Ack=142849469 Win=65535 Len=0
1,4.03308799999968,10.0.2.15,62.210.85.178,TLSv1.2,332,Application Data
1,4.0332180000000335,10.0.2.15,62.210.85.178,TCP,2974,35978  >  9001 [ACK] Seq=142849747 Ack=7830199 Win=65535 Len=2920 [TCP segment of a reassembled PDU]
1,4.0332509999998365,62.210.85.178,10.0.2.15,TCP,60,9001  >  35978 [ACK] Seq=7830199 Ack=142849747 Win=65535 Len=0
1,4.033293999999842,10.0.2.15,62.210.85.178,TLSv1.2,240,Application Data
1,4.033336999999847,62.210.85.178,10.0.2.15,TCP,60,9001  >  35978 [ACK] Seq=7830199 Ack=142851207 Win=65535 Len=0
1,4.033343999999943,62.210.85.178,10.0.2.15,TCP,60,9001  >  35978 [ACK] Seq=7830199 Ack=142852667 Win=65535 Len=0
1,4.0333519999999226,62.210.85.178,10.0.2.15,TCP,60,9001  >  35978 [ACK] Seq=7830199 Ack=142852853 Win=65535 Len=0
1,4.109588999999687,54.93.77.70,10.0.2.15,TCP,2950,"9001  >  34692 [PSH, ACK] Seq=142612611 Ack=7845155 Win=65535 Len=2896 [TCP segment of a reassembled PDU]"
1,4.109985999999935,54.93.77.70,10.0.2.15,TLSv1.2,4912,"Application Data, Application Data"
1,4.11012699999992,10.0.2.15,54.93.77.70,TCP,54,34692  >  9001 [ACK] Seq=7845155 Ack=142620365 Win=65535 Len=0
1,4.110304999999698,10.0.2.15,54.93.77.70,TLSv1.2,590,Application Data
1,4.1103949999996985,54.93.77.70,10.0.2.15,TCP,60,9001  >  34692 [ACK] Seq=142620365 Ack=7845691 Win=65535 Len=0
1,4.167916999999761,54.93.77.70,10.0.2.15,TCP,2950,"9001  >  34692 [PSH, ACK] Seq=142620365 Ack=7845691 Win=65535 Len=2896 [TCP segment of a reassembled PDU]"
1,4.168026999999711,10.0.2.15,54.93.77.70,TCP,54,34692  >  9001 [ACK] Seq=7845691 Ack=142623261 Win=65535 Len=0
1,4.16895199999999,54.93.77.70,10.0.2.15,TLSv1.2,778,Application Data
1,4.176951999999801,54.93.77.70,10.0.2.15,TCP,2950,"9001  >  34692 [PSH, ACK] Seq=142623985 Ack=7845691 Win=65535 Len=2896 [TCP segment of a reassembled PDU]"
1,4.17700399999967,54.93.77.70,10.0.2.15,TLSv1.2,1502,Application Data [TCP segment of a reassembled PDU]
1,4.177057999999761,10.0.2.15,54.93.77.70,TCP,54,34692  >  9001 [ACK] Seq=7845691 Ack=142626881 Win=65535 Len=0
1,4.1771749999998065,10.0.2.15,54.93.77.70,TCP,54,34692  >  9001 [ACK] Seq=7845691 Ack=142628329 Win=65535 Len=0
1,4.189112000000023,54.93.77.70,10.0.2.15,TLSv1.2,2950,Application Data [TCP segment of a reassembled PDU]
1,4.189344999999776,10.0.2.15,54.93.77.70,TCP,54,34692  >  9001 [ACK] Seq=7845691 Ack=142631225 Win=65535 Len=0
1,4.192976999999701,54.93.77.70,10.0.2.15,TLSv1.2,1104,Application Data
1,4.20011999999997,54.93.77.70,10.0.2.15,TCP,2950,"9001  >  34692 [PSH, ACK] Seq=142632275 Ack=7845691 Win=65535 Len=2896 [TCP segment of a reassembled PDU]"
1,4.200169999999616,54.93.77.70,10.0.2.15,TLSv1.2,4398,Application Data [TCP segment of a reassembled PDU]
1,4.200254999999743,10.0.2.15,54.93.77.70,TCP,54,34692  >  9001 [ACK] Seq=7845691 Ack=142635171 Win=65535 Len=0
1,4.200398999999834,54.93.77.70,10.0.2.15,TLSv1.2,2950,Application Data [TCP segment of a reassembled PDU]
1,4.200449999999819,10.0.2.15,54.93.77.70,TCP,54,34692  >  9001 [ACK] Seq=7845691 Ack=142642411 Win=65535 Len=0
1,4.200800999999956,10.0.2.15,54.93.77.70,TLSv1.2,590,Application Data
1,4.2008679999999,54.93.77.70,10.0.2.15,TCP,60,9001  >  34692 [ACK] Seq=142642411 Ack=7846227 Win=65535 Len=0
1,4.205108999999993,54.93.77.70,10.0.2.15,TCP,1502,"9001  >  34692 [PSH, ACK] Seq=142642411 Ack=7846227 Win=65535 Len=1448 [TCP segment of a reassembled PDU]"
1,4.205203999999867,10.0.2.15,54.93.77.70,TCP,54,34692  >  9001 [ACK] Seq=7846227 Ack=142643859 Win=65535 Len=0
1,4.20843799999966,54.93.77.70,10.0.2.15,TLSv1.2,2950,"Application Data, Application Data"
1,4.208550999999716,10.0.2.15,54.93.77.70,TCP,54,34692  >  9001 [ACK] Seq=7846227 Ack=142646755 Win=65535 Len=0
1,4.21728099999973,54.93.77.70,10.0.2.15,TLSv1.2,2950,Application Data [TCP segment of a reassembled PDU]
1,4.217326999999841,54.93.77.70,10.0.2.15,TLSv1.2,4398,Application Data [TCP segment of a reassembled PDU]
1,4.217398999999659,10.0.2.15,54.93.77.70,TCP,54,34692  >  9001 [ACK] Seq=7846227 Ack=142649651 Win=65535 Len=0
1,4.2175569999999425,10.0.2.15,54.93.77.70,TCP,54,34692  >  9001 [ACK] Seq=7846227 Ack=142653995 Win=65535 Len=0
1,4.217955999999958,54.93.77.70,10.0.2.15,TCP,1502,"9001  >  34692 [PSH, ACK] Seq=142653995 Ack=7846227 Win=65535 Len=1448 [TCP segment of a reassembled PDU]"
1,4.217967999999928,54.93.77.70,10.0.2.15,TLSv1.2,4398,Application Data [TCP segment of a reassembled PDU]
1,4.218011999999817,10.0.2.15,54.93.77.70,TCP,54,34692  >  9001 [ACK] Seq=7846227 Ack=142655443 Win=65535 Len=0
1,4.218104999999923,10.0.2.15,54.93.77.70,TCP,54,34692  >  9001 [ACK] Seq=7846227 Ack=142659787 Win=65535 Len=0
1,4.225723000000016,54.93.77.70,10.0.2.15,TLSv1.2,2552,"Application Data, Application Data"
1,4.225938000000042,10.0.2.15,54.93.77.70,TCP,54,34692  >  9001 [ACK] Seq=7846227 Ack=142662285 Win=65535 Len=0
1,4.226623000000018,54.93.77.70,10.0.2.15,TCP,1502,"9001  >  34692 [PSH, ACK] Seq=142662285 Ack=7846227 Win=65535 Len=1448 [TCP segment of a reassembled PDU]"
1,4.226701999999932,10.0.2.15,54.93.77.70,TCP,54,34692  >  9001 [ACK] Seq=7846227 Ack=142663733 Win=65535 Len=0
1,4.234897999999703,54.93.77.70,10.0.2.15,TLSv1.2,7294,"Application Data, Application Data"
1,4.235067999999956,10.0.2.15,54.93.77.70,TCP,54,34692  >  9001 [ACK] Seq=7846227 Ack=142670973 Win=65535 Len=0
1,4.235306999999921,10.0.2.15,54.93.77.70,TLSv1.2,590,Application Data
1,4.235477999999603,54.93.77.70,10.0.2.15,TCP,60,9001  >  34692 [ACK] Seq=142670973 Ack=7846763 Win=65535 Len=0
1,4.235494999999901,54.93.77.70,10.0.2.15,TLSv1.2,5846,Application Data [TCP segment of a reassembled PDU]
1,4.235617999999704,10.0.2.15,54.93.77.70,TCP,54,34692  >  9001 [ACK] Seq=7846763 Ack=142676765 Win=65535 Len=0
1,4.242173999999977,54.93.77.70,10.0.2.15,TLSv1.2,2950,"Application Data, Application Data"
1,4.242269999999735,62.210.85.178,10.0.2.15,TLSv1.2,590,Application Data
1,4.242381999999907,10.0.2.15,54.93.77.70,TCP,54,34692  >  9001 [ACK] Seq=7846763 Ack=142679661 Win=65535 Len=0
1,4.248267999999825,10.0.2.15,54.93.77.70,TLSv1.2,590,Application Data
1,4.248670999999831,54.93.77.70,10.0.2.15,TCP,60,9001  >  34692 [ACK] Seq=142679661 Ack=7847299 Win=65535 Len=0
1,4.252541999999721,54.93.77.70,10.0.2.15,TLSv1.2,2950,Application Data [TCP segment of a reassembled PDU]
1,4.2525839999998425,54.93.77.70,10.0.2.15,TLSv1.2,5144,"Application Data, Application Data"
1,4.252708999999868,10.0.2.15,54.93.77.70,TCP,54,34692  >  9001 [ACK] Seq=7847299 Ack=142687647 Win=65535 Len=0
1,4.260910999999851,10.0.2.15,54.93.77.70,TLSv1.2,590,Application Data
1,4.26104499999974,54.93.77.70,10.0.2.15,TCP,60,9001  >  34692 [ACK] Seq=142687647 Ack=7847835 Win=65535 Len=0
1,4.284392999999909,10.0.2.15,62.210.85.178,TCP,54,35978  >  9001 [ACK] Seq=142852853 Ack=7830735 Win=65535 Len=0
1,4.322718999999779,62.210.85.178,10.0.2.15,TLSv1.2,590,Application Data
1,4.3231409999998505,10.0.2.15,62.210.85.178,TCP,54,35978  >  9001 [ACK] Seq=142852853 Ack=7831271 Win=65535 Len=0
1,4.368029999999635,62.210.85.178,10.0.2.15,TLSv1.2,590,Application Data
1,4.368138999999701,10.0.2.15,62.210.85.178,TCP,54,35978  >  9001 [ACK] Seq=142852853 Ack=7831807 Win=65535 Len=0
1,4.437140999999883,62.210.85.178,10.0.2.15,TLSv1.2,1104,Application Data
1,4.437275999999656,10.0.2.15,62.210.85.178,TCP,54,35978  >  9001 [ACK] Seq=142852853 Ack=7832857 Win=65535 Len=0
1,4.437832999999955,10.0.2.15,62.210.85.178,TLSv1.2,590,Application Data
1,4.437963999999738,62.210.85.178,10.0.2.15,TCP,60,9001  >  35978 [ACK] Seq=7832857 Ack=142853389 Win=65535 Len=0
1,4.545540999999957,54.93.77.70,10.0.2.15,TLSv1.2,590,Application Data
1,4.5460409999996045,10.0.2.15,54.93.77.70,TLSv1.2,590,Application Data
1,4.546171999999842,54.93.77.70,10.0.2.15,TCP,60,9001  >  34692 [ACK] Seq=142688183 Ack=7848371 Win=65535 Len=0
1,4.647407999999814,62.210.85.178,10.0.2.15,TLSv1.2,590,Application Data
1,4.659321999999975,10.0.2.15,62.210.85.178,TLSv1.2,590,Application Data
1,4.6594969999996465,62.210.85.178,10.0.2.15,TCP,60,9001  >  35978 [ACK] Seq=7833393 Ack=142853925 Win=65535 Len=0
1,4.6704759999997805,10.0.2.15,62.210.85.178,TLSv1.2,4124,Application Data
1,4.67067999999972,10.0.2.15,62.210.85.178,TCP,2974,35978  >  9001 [ACK] Seq=142857995 Ack=7833393 Win=65535 Len=2920 [TCP segment of a reassembled PDU]
1,4.670733999999811,62.210.85.178,10.0.2.15,TCP,60,9001  >  35978 [ACK] Seq=7833393 Ack=142855385 Win=65535 Len=0
1,4.670745999999781,62.210.85.178,10.0.2.15,TCP,60,9001  >  35978 [ACK] Seq=7833393 Ack=142856845 Win=65535 Len=0
1,4.670750999999655,62.210.85.178,10.0.2.15,TCP,60,9001  >  35978 [ACK] Seq=7833393 Ack=142857995 Win=65535 Len=0
1,4.670798999999988,10.0.2.15,62.210.85.178,TLSv1.2,1204,Application Data
1,4.670842999999877,62.210.85.178,10.0.2.15,TCP,60,9001  >  35978 [ACK] Seq=7833393 Ack=142859455 Win=65535 Len=0
1,4.670850999999857,62.210.85.178,10.0.2.15,TCP,60,9001  >  35978 [ACK] Seq=7833393 Ack=142860915 Win=65535 Len=0
1,4.670854999999847,62.210.85.178,10.0.2.15,TCP,60,9001  >  35978 [ACK] Seq=7833393 Ack=142862065 Win=65535 Len=0
1,4.670912999999928,10.0.2.15,62.210.85.178,TLSv1.2,4124,Application Data
1,4.670999999999822,62.210.85.178,10.0.2.15,TCP,60,9001  >  35978 [ACK] Seq=7833393 Ack=142863525 Win=65535 Len=0
1,4.671008999999685,62.210.85.178,10.0.2.15,TCP,60,9001  >  35978 [ACK] Seq=7833393 Ack=142864985 Win=65535 Len=0
1,4.671012999999675,62.210.85.178,10.0.2.15,TCP,60,9001  >  35978 [ACK] Seq=7833393 Ack=142866135 Win=65535 Len=0
1,4.671045999999933,10.0.2.15,62.210.85.178,TCP,2974,35978  >  9001 [ACK] Seq=142866135 Ack=7833393 Win=65535 Len=2920 [TCP segment of a reassembled PDU]
1,4.6711129999998775,62.210.85.178,10.0.2.15,TCP,60,9001  >  35978 [ACK] Seq=7833393 Ack=142867595 Win=65535 Len=0
1,4.671122999999625,62.210.85.178,10.0.2.15,TCP,60,9001  >  35978 [ACK] Seq=7833393 Ack=142869055 Win=65535 Len=0
1,4.671162999999979,10.0.2.15,62.210.85.178,TLSv1.2,1204,Application Data
1,4.671256999999969,62.210.85.178,10.0.2.15,TCP,60,9001  >  35978 [ACK] Seq=7833393 Ack=142870205 Win=65535 Len=0
1,4.6713049999998475,10.0.2.15,62.210.85.178,TLSv1.2,332,Application Data
1,4.672555999999986,62.210.85.178,10.0.2.15,TCP,60,9001  >  35978 [ACK] Seq=7833393 Ack=142870483 Win=65535 Len=0
1,4.6727029999997285,10.0.2.15,62.210.85.178,TLSv1.2,3868,Application Data
1,4.672820999999658,62.210.85.178,10.0.2.15,TCP,60,9001  >  35978 [ACK] Seq=7833393 Ack=142871943 Win=65535 Len=0
1,4.672829999999976,62.210.85.178,10.0.2.15,TCP,60,9001  >  35978 [ACK] Seq=7833393 Ack=142873403 Win=65535 Len=0
1,4.672833999999966,62.210.85.178,10.0.2.15,TCP,60,9001  >  35978 [ACK] Seq=7833393 Ack=142874297 Win=65535 Len=0
1,4.6728619999998955,10.0.2.15,62.210.85.178,TCP,2974,35978  >  9001 [ACK] Seq=142874297 Ack=7833393 Win=65535 Len=2920 [TCP segment of a reassembled PDU]
1,4.672898999999688,62.210.85.178,10.0.2.15,TCP,60,9001  >  35978 [ACK] Seq=7833393 Ack=142875757 Win=65535 Len=0
1,4.672906999999668,62.210.85.178,10.0.2.15,TCP,60,9001  >  35978 [ACK] Seq=7833393 Ack=142877217 Win=65535 Len=0
1,4.672939000000042,10.0.2.15,62.210.85.178,TLSv1.2,1204,Application Data
1,4.672974999999951,62.210.85.178,10.0.2.15,TCP,60,9001  >  35978 [ACK] Seq=7833393 Ack=142878367 Win=65535 Len=0
1,4.673017999999956,10.0.2.15,62.210.85.178,TLSv1.2,3030,Application Data
1,4.673163999999815,62.210.85.178,10.0.2.15,TCP,60,9001  >  35978 [ACK] Seq=7833393 Ack=142879827 Win=65535 Len=0
1,4.673178000000007,62.210.85.178,10.0.2.15,TCP,60,9001  >  35978 [ACK] Seq=7833393 Ack=142881287 Win=65535 Len=0
1,4.673182999999881,62.210.85.178,10.0.2.15,TCP,60,9001  >  35978 [ACK] Seq=7833393 Ack=142881343 Win=65535 Len=0
1,4.678477999999814,10.0.2.15,62.210.85.178,TLSv1.2,4124,Application Data
1,4.678631999999652,10.0.2.15,62.210.85.178,TCP,2974,35978  >  9001 [ACK] Seq=142885413 Ack=7833393 Win=65535 Len=2920 [TCP segment of a reassembled PDU]
1,4.678686999999627,62.210.85.178,10.0.2.15,TCP,60,9001  >  35978 [ACK] Seq=7833393 Ack=142882803 Win=65535 Len=0
1,4.678698999999597,62.210.85.178,10.0.2.15,TCP,60,9001  >  35978 [ACK] Seq=7833393 Ack=142884263 Win=65535 Len=0
1,4.678704999999809,62.210.85.178,10.0.2.15,TCP,60,9001  >  35978 [ACK] Seq=7833393 Ack=142885413 Win=65535 Len=0
1,4.678754000000026,10.0.2.15,62.210.85.178,TLSv1.2,1204,Application Data
1,4.678850999999668,62.210.85.178,10.0.2.15,TCP,60,9001  >  35978 [ACK] Seq=7833393 Ack=142886873 Win=65535 Len=0
1,4.678866999999627,62.210.85.178,10.0.2.15,TCP,60,9001  >  35978 [ACK] Seq=7833393 Ack=142888333 Win=65535 Len=0
1,4.678871999999956,62.210.85.178,10.0.2.15,TCP,60,9001  >  35978 [ACK] Seq=7833393 Ack=142889483 Win=65535 Len=0
1,4.67894699999988,10.0.2.15,62.210.85.178,TLSv1.2,4124,Application Data
1,4.679039999999986,62.210.85.178,10.0.2.15,TCP,60,9001  >  35978 [ACK] Seq=7833393 Ack=142890943 Win=65535 Len=0
1,4.67904899999985,62.210.85.178,10.0.2.15,TCP,60,9001  >  35978 [ACK] Seq=7833393 Ack=142892403 Win=65535 Len=0
1,4.67905299999984,62.210.85.178,10.0.2.15,TCP,60,9001  >  35978 [ACK] Seq=7833393 Ack=142893553 Win=65535 Len=0
1,4.6790979999996125,10.0.2.15,62.210.85.178,TLSv1.2,4124,Application Data
1,4.6791589999998,62.210.85.178,10.0.2.15,TCP,60,9001  >  35978 [ACK] Seq=7833393 Ack=142895013 Win=65535 Len=0
1,4.679167999999663,62.210.85.178,10.0.2.15,TCP,60,9001  >  35978 [ACK] Seq=7833393 Ack=142896473 Win=65535 Len=0
1,4.679172999999992,62.210.85.178,10.0.2.15,TCP,60,9001  >  35978 [ACK] Seq=7833393 Ack=142897623 Win=65535 Len=0
1,4.679206999999678,10.0.2.15,62.210.85.178,TLSv1.2,332,Application Data
1,4.679286999999931,62.210.85.178,10.0.2.15,TCP,60,9001  >  35978 [ACK] Seq=7833393 Ack=142897901 Win=65535 Len=0
1,4.679370999999719,10.0.2.15,62.210.85.178,TLSv1.2,3868,Application Data
1,4.679442999999992,62.210.85.178,10.0.2.15,TCP,60,9001  >  35978 [ACK] Seq=7833393 Ack=142899361 Win=65535 Len=0
1,4.679452999999739,62.210.85.178,10.0.2.15,TCP,60,9001  >  35978 [ACK] Seq=7833393 Ack=142900821 Win=65535 Len=0
1,4.679457999999613,62.210.85.178,10.0.2.15,TCP,60,9001  >  35978 [ACK] Seq=7833393 Ack=142901715 Win=65535 Len=0
1,4.679508999999598,10.0.2.15,62.210.85.178,TLSv1.2,4124,Application Data
1,4.679574999999659,62.210.85.178,10.0.2.15,TCP,60,9001  >  35978 [ACK] Seq=7833393 Ack=142903175 Win=65535 Len=0
1,4.679582999999639,62.210.85.178,10.0.2.15,TCP,60,9001  >  35978 [ACK] Seq=7833393 Ack=142904635 Win=65535 Len=0
1,4.6795869999996285,62.210.85.178,10.0.2.15,TCP,60,9001  >  35978 [ACK] Seq=7833393 Ack=142905785 Win=65535 Len=0
1,4.679625999999644,10.0.2.15,62.210.85.178,TLSv1.2,3030,Application Data
1,4.6796989999998,62.210.85.178,10.0.2.15,TCP,60,9001  >  35978 [ACK] Seq=7833393 Ack=142907245 Win=65535 Len=0
1,4.6797059999998964,62.210.85.178,10.0.2.15,TCP,60,9001  >  35978 [ACK] Seq=7833393 Ack=142908705 Win=65535 Len=0
1,4.679709000000003,62.210.85.178,10.0.2.15,TCP,60,9001  >  35978 [ACK] Seq=7833393 Ack=142908761 Win=65535 Len=0
1,4.693471000000045,10.0.2.15,62.210.85.178,TLSv1.2,4124,Application Data
1,4.693617999999788,62.210.85.178,10.0.2.15,TCP,60,9001  >  35978 [ACK] Seq=7833393 Ack=142910221 Win=65535 Len=0
1,4.693638999999621,62.210.85.178,10.0.2.15,TCP,60,9001  >  35978 [ACK] Seq=7833393 Ack=142911681 Win=65535 Len=0
1,4.693641999999727,62.210.85.178,10.0.2.15,TCP,60,9001  >  35978 [ACK] Seq=7833393 Ack=142912831 Win=65535 Len=0
1,4.6936829999999645,10.0.2.15,62.210.85.178,TLSv1.2,4124,Application Data
1,4.6937629999997625,62.210.85.178,10.0.2.15,TCP,60,9001  >  35978 [ACK] Seq=7833393 Ack=142914291 Win=65535 Len=0
1,4.6937739999998485,62.210.85.178,10.0.2.15,TCP,60,9001  >  35978 [ACK] Seq=7833393 Ack=142915751 Win=65535 Len=0
1,4.693777999999838,62.210.85.178,10.0.2.15,TCP,60,9001  >  35978 [ACK] Seq=7833393 Ack=142916901 Win=65535 Len=0
1,4.693809999999758,10.0.2.15,62.210.85.178,TLSv1.2,718,Application Data
1,4.693850999999995,62.210.85.178,10.0.2.15,TCP,60,9001  >  35978 [ACK] Seq=7833393 Ack=142917565 Win=65535 Len=0
1,4.762883999999758,54.93.77.70,10.0.2.15,TLSv1.2,590,Application Data
1,4.773912999999993,54.93.77.70,10.0.2.15,TCP,2950,"9001  >  34692 [PSH, ACK] Seq=142688719 Ack=7848371 Win=65535 Len=2896 [TCP segment of a reassembled PDU]"
1,4.774121999999807,10.0.2.15,54.93.77.70,TCP,54,34692  >  9001 [ACK] Seq=7848371 Ack=142691615 Win=65535 Len=0
1,4.781766999999945,54.93.77.70,10.0.2.15,TLSv1.2,1502,Application Data [TCP segment of a reassembled PDU]
1,4.781881999999769,10.0.2.15,54.93.77.70,TCP,54,34692  >  9001 [ACK] Seq=7848371 Ack=142693063 Win=65535 Len=0
1,4.791093999999703,54.93.77.70,10.0.2.15,TLSv1.2,380,Application Data
1,4.792676999999912,54.93.77.70,10.0.2.15,TLSv1.2,11638,"Application Data, Application Data"
1,4.7927999999997155,10.0.2.15,54.93.77.70,TCP,54,34692  >  9001 [ACK] Seq=7848371 Ack=142704973 Win=65535 Len=0
1,4.809085999999752,54.93.77.70,10.0.2.15,TLSv1.2,2950,Application Data [TCP segment of a reassembled PDU]
1,4.809132999999747,54.93.77.70,10.0.2.15,TLSv1.2,2950,Application Data [TCP segment of a reassembled PDU]
1,4.809188999999606,10.0.2.15,54.93.77.70,TCP,54,34692  >  9001 [ACK] Seq=7848371 Ack=142707869 Win=65535 Len=0
1,4.8092979999996714,10.0.2.15,54.93.77.70,TCP,54,34692  >  9001 [ACK] Seq=7848371 Ack=142710765 Win=65535 Len=0
1,4.8107780000000275,54.93.77.70,10.0.2.15,TLSv1.2,8018,"Application Data, Application Data, Application Data"
1,4.8108619999998155,10.0.2.15,54.93.77.70,TCP,54,34692  >  9001 [ACK] Seq=7848371 Ack=142718729 Win=65535 Len=0
1,4.811087000000043,10.0.2.15,54.93.77.70,TLSv1.2,590,Application Data
1,4.811172999999599,54.93.77.70,10.0.2.15,TCP,60,9001  >  34692 [ACK] Seq=142718729 Ack=7848907 Win=65535 Len=0
1,4.822279999999864,54.93.77.70,10.0.2.15,TCP,2950,"9001  >  34692 [PSH, ACK] Seq=142718729 Ack=7848907 Win=65535 Len=2896 [TCP segment of a reassembled PDU]"
1,4.822371999999632,10.0.2.15,54.93.77.70,TCP,54,34692  >  9001 [ACK] Seq=7848907 Ack=142721625 Win=65535 Len=0
1,4.826288999999633,54.93.77.70,10.0.2.15,TLSv1.2,2950,Application Data [TCP segment of a reassembled PDU]
1,4.8264030000000275,10.0.2.15,54.93.77.70,TCP,54,34692  >  9001 [ACK] Seq=7848907 Ack=142724521 Win=65535 Len=0
1,4.826704999999947,10.0.2.15,54.93.77.70,TLSv1.2,590,Application Data
1,4.826799999999821,54.93.77.70,10.0.2.15,TCP,60,9001  >  34692 [ACK] Seq=142724521 Ack=7849443 Win=65535 Len=0
1,4.827664999999797,54.93.77.70,10.0.2.15,TLSv1.2,8742,"Application Data, Application Data"
1,4.827790999999706,10.0.2.15,54.93.77.70,TCP,54,34692  >  9001 [ACK] Seq=7849443 Ack=142733209 Win=65535 Len=0
1,4.828628999999637,54.93.77.70,10.0.2.15,TLSv1.2,1596,Application Data
1,4.828704000000016,10.0.2.15,54.93.77.70,TCP,54,34692  >  9001 [ACK] Seq=7849443 Ack=142734751 Win=65535 Len=0
1,4.841074999999819,54.93.77.70,10.0.2.15,TCP,2950,"9001  >  34692 [PSH, ACK] Seq=142734751 Ack=7849443 Win=65535 Len=2896 [TCP segment of a reassembled PDU]"
1,4.841199999999844,10.0.2.15,54.93.77.70,TCP,54,34692  >  9001 [ACK] Seq=7849443 Ack=142737647 Win=65535 Len=0
1,4.84488599999986,54.93.77.70,10.0.2.15,TLSv1.2,2950,Application Data [TCP segment of a reassembled PDU]
1,4.84498399999984,10.0.2.15,54.93.77.70,TCP,54,34692  >  9001 [ACK] Seq=7849443 Ack=142740543 Win=65535 Len=0
1,4.845568999999614,54.93.77.70,10.0.2.15,TLSv1.2,6686,"Application Data, Application Data, Application Data"
1,4.845632999999907,10.0.2.15,54.93.77.70,TCP,54,34692  >  9001 [ACK] Seq=7849443 Ack=142747175 Win=65535 Len=0
1,4.845766999999796,10.0.2.15,54.93.77.70,TLSv1.2,590,Application Data
1,4.845835999999963,54.93.77.70,10.0.2.15,TCP,60,9001  >  34692 [ACK] Seq=142747175 Ack=7849979 Win=65535 Len=0
1,4.862345000000005,54.93.77.70,10.0.2.15,TLSv1.2,1104,Application Data
1,4.868663999999626,54.93.77.70,10.0.2.15,TCP,2950,"9001  >  34692 [PSH, ACK] Seq=142748225 Ack=7849979 Win=65535 Len=2896 [TCP segment of a reassembled PDU]"
1,4.8687700000000405,10.0.2.15,54.93.77.70,TCP,54,34692  >  9001 [ACK] Seq=7849979 Ack=142751121 Win=65535 Len=0
1,4.881649999999809,54.93.77.70,10.0.2.15,TLSv1.2,1314,"Application Data, Application Data"
1,4.893041999999696,10.0.2.15,54.93.77.70,TLSv1.2,590,Application Data
1,4.893229999999676,54.93.77.70,10.0.2.15,TCP,60,9001  >  34692 [ACK] Seq=142752381 Ack=7850515 Win=65535 Len=0
1,4.928909999999632,62.210.85.178,10.0.2.15,TLSv1.2,590,Application Data
1,4.962358999999651,62.210.85.178,10.0.2.15,TLSv1.2,590,Application Data
1,4.963038999999753,10.0.2.15,62.210.85.178,TCP,54,35978  >  9001 [ACK] Seq=142917565 Ack=7834465 Win=65535 Len=0
1,4.985679999999775,62.210.85.178,10.0.2.15,TLSv1.2,590,Application Data
1,5.028385999999955,10.0.2.15,62.210.85.178,TCP,54,35978  >  9001 [ACK] Seq=142917565 Ack=7835001 Win=65535 Len=0
1,5.036732000000029,62.210.85.178,10.0.2.15,TLSv1.2,590,Application Data
1,5.036857999999938,10.0.2.15,62.210.85.178,TCP,54,35978  >  9001 [ACK] Seq=142917565 Ack=7835537 Win=65535 Len=0
1,5.037284,10.0.2.15,62.210.85.178,TLSv1.2,590,Application Data
1,5.0374189999997725,62.210.85.178,10.0.2.15,TCP,60,9001  >  35978 [ACK] Seq=7835537 Ack=142918101 Win=65535 Len=0
1,5.518397999999706,54.93.77.70,10.0.2.15,TLSv1.2,590,Application Data
1,5.518933999999717,10.0.2.15,54.93.77.70,TLSv1.2,590,Application Data
1,5.519097999999758,54.93.77.70,10.0.2.15,TCP,60,9001  >  34692 [ACK] Seq=142752917 Ack=7851051 Win=65535 Len=0
1,5.632600999999795,62.210.85.178,10.0.2.15,TLSv1.2,590,Application Data
1,5.645340999999917,10.0.2.15,62.210.85.178,TLSv1.2,590,Application Data
1,5.64554999999973,62.210.85.178,10.0.2.15,TCP,60,9001  >  35978 [ACK] Seq=7836073 Ack=142918637 Win=65535 Len=0
1,5.667426999999861,10.0.2.15,62.210.85.178,TLSv1.2,4124,Application Data
1,5.668378999999732,62.210.85.178,10.0.2.15,TCP,60,9001  >  35978 [ACK] Seq=7836073 Ack=142920097 Win=65535 Len=0
1,5.668468999999732,62.210.85.178,10.0.2.15,TCP,60,9001  >  35978 [ACK] Seq=7836073 Ack=142921557 Win=65535 Len=0
1,5.668474999999944,62.210.85.178,10.0.2.15,TCP,60,9001  >  35978 [ACK] Seq=7836073 Ack=142922707 Win=65535 Len=0
1,5.672286999999869,10.0.2.15,62.210.85.178,TLSv1.2,4124,Application Data
1,5.672553999999764,62.210.85.178,10.0.2.15,TCP,60,9001  >  35978 [ACK] Seq=7836073 Ack=142924167 Win=65535 Len=0
1,5.672581999999693,62.210.85.178,10.0.2.15,TCP,60,9001  >  35978 [ACK] Seq=7836073 Ack=142925627 Win=65535 Len=0
1,5.672591999999895,62.210.85.178,10.0.2.15,TCP,60,9001  >  35978 [ACK] Seq=7836073 Ack=142926777 Win=65535 Len=0
1,5.672721999999794,10.0.2.15,62.210.85.178,TLSv1.2,4124,Application Data
1,5.672896999999921,62.210.85.178,10.0.2.15,TCP,60,9001  >  35978 [ACK] Seq=7836073 Ack=142928237 Win=65535 Len=0
1,5.672909999999774,62.210.85.178,10.0.2.15,TCP,60,9001  >  35978 [ACK] Seq=7836073 Ack=142929697 Win=65535 Len=0
1,5.672914999999648,62.210.85.178,10.0.2.15,TCP,60,9001  >  35978 [ACK] Seq=7836073 Ack=142930847 Win=65535 Len=0
1,5.6774209999998675,10.0.2.15,62.210.85.178,TLSv1.2,4124,Application Data
1,5.677631999999903,62.210.85.178,10.0.2.15,TCP,60,9001  >  35978 [ACK] Seq=7836073 Ack=142932307 Win=65535 Len=0
1,5.677651999999853,62.210.85.178,10.0.2.15,TCP,60,9001  >  35978 [ACK] Seq=7836073 Ack=142933767 Win=65535 Len=0
1,5.67765799999961,62.210.85.178,10.0.2.15,TCP,60,9001  >  35978 [ACK] Seq=7836073 Ack=142934917 Win=65535 Len=0
1,5.677735999999641,10.0.2.15,62.210.85.178,TLSv1.2,332,Application Data
1,5.677807999999914,62.210.85.178,10.0.2.15,TCP,60,9001  >  35978 [ACK] Seq=7836073 Ack=142935195 Win=65535 Len=0
1,5.678101999999853,10.0.2.15,62.210.85.178,TLSv1.2,3868,Application Data
1,5.678218000000015,62.210.85.178,10.0.2.15,TCP,60,9001  >  35978 [ACK] Seq=7836073 Ack=142936655 Win=65535 Len=0
1,5.678227999999763,62.210.85.178,10.0.2.15,TCP,60,9001  >  35978 [ACK] Seq=7836073 Ack=142938115 Win=65535 Len=0
1,5.678231999999753,62.210.85.178,10.0.2.15,TCP,60,9001  >  35978 [ACK] Seq=7836073 Ack=142939009 Win=65535 Len=0
1,5.678291999999601,10.0.2.15,62.210.85.178,TLSv1.2,4124,Application Data
1,5.678402999999889,62.210.85.178,10.0.2.15,TCP,60,9001  >  35978 [ACK] Seq=7836073 Ack=142940469 Win=65535 Len=0
1,5.678416999999627,62.210.85.178,10.0.2.15,TCP,60,9001  >  35978 [ACK] Seq=7836073 Ack=142941929 Win=65535 Len=0
1,5.678421999999955,62.210.85.178,10.0.2.15,TCP,60,9001  >  35978 [ACK] Seq=7836073 Ack=142943079 Win=65535 Len=0
1,5.67847699999993,10.0.2.15,62.210.85.178,TLSv1.2,3030,Application Data
1,5.678578000000016,62.210.85.178,10.0.2.15,TCP,60,9001  >  35978 [ACK] Seq=7836073 Ack=142944539 Win=65535 Len=0
1,5.678585999999996,62.210.85.178,10.0.2.15,TCP,60,9001  >  35978 [ACK] Seq=7836073 Ack=142945999 Win=65535 Len=0
1,5.678590999999869,62.210.85.178,10.0.2.15,TCP,60,9001  >  35978 [ACK] Seq=7836073 Ack=142946055 Win=65535 Len=0
1,5.678729999999632,10.0.2.15,62.210.85.178,TLSv1.2,4124,Application Data
1,5.67885299999989,62.210.85.178,10.0.2.15,TCP,60,9001  >  35978 [ACK] Seq=7836073 Ack=142947515 Win=65535 Len=0
1,5.678862999999637,62.210.85.178,10.0.2.15,TCP,60,9001  >  35978 [ACK] Seq=7836073 Ack=142948975 Win=65535 Len=0
1,5.678867999999966,62.210.85.178,10.0.2.15,TCP,60,9001  >  35978 [ACK] Seq=7836073 Ack=142950125 Win=65535 Len=0
1,5.678926000000047,10.0.2.15,62.210.85.178,TLSv1.2,4124,Application Data
1,5.67903299999989,62.210.85.178,10.0.2.15,TCP,60,9001  >  35978 [ACK] Seq=7836073 Ack=142951585 Win=65535 Len=0
1,5.679041999999754,62.210.85.178,10.0.2.15,TCP,60,9001  >  35978 [ACK] Seq=7836073 Ack=142953045 Win=65535 Len=0
1,5.679045999999744,62.210.85.178,10.0.2.15,TCP,60,9001  >  35978 [ACK] Seq=7836073 Ack=142954195 Win=65535 Len=0
1,5.679100999999719,10.0.2.15,62.210.85.178,TLSv1.2,4124,Application Data
1,5.6792029999996885,62.210.85.178,10.0.2.15,TCP,60,9001  >  35978 [ACK] Seq=7836073 Ack=142955655 Win=65535 Len=0
1,5.679388000000017,62.210.85.178,10.0.2.15,TCP,60,9001  >  35978 [ACK] Seq=7836073 Ack=142957115 Win=65535 Len=0
1,5.6794019999997545,62.210.85.178,10.0.2.15,TCP,60,9001  >  35978 [ACK] Seq=7836073 Ack=142958265 Win=65535 Len=0
1,5.679475999999795,10.0.2.15,62.210.85.178,TLSv1.2,4124,Application Data
1,5.680836999999883,62.210.85.178,10.0.2.15,TCP,60,9001  >  35978 [ACK] Seq=7836073 Ack=142959725 Win=65535 Len=0
1,5.680882999999994,62.210.85.178,10.0.2.15,TCP,60,9001  >  35978 [ACK] Seq=7836073 Ack=142961185 Win=65535 Len=0
1,5.680886999999984,62.210.85.178,10.0.2.15,TCP,60,9001  >  35978 [ACK] Seq=7836073 Ack=142962335 Win=65535 Len=0
1,5.682071999999607,10.0.2.15,62.210.85.178,TLSv1.2,332,Application Data
1,5.682174000000032,62.210.85.178,10.0.2.15,TCP,60,9001  >  35978 [ACK] Seq=7836073 Ack=142962613 Win=65535 Len=0
1,5.682724999999664,10.0.2.15,62.210.85.178,TLSv1.2,3868,Application Data
1,5.682921999999962,62.210.85.178,10.0.2.15,TCP,60,9001  >  35978 [ACK] Seq=7836073 Ack=142964073 Win=65535 Len=0
1,5.682938999999806,62.210.85.178,10.0.2.15,TCP,60,9001  >  35978 [ACK] Seq=7836073 Ack=142965533 Win=65535 Len=0
1,5.682942999999796,62.210.85.178,10.0.2.15,TCP,60,9001  >  35978 [ACK] Seq=7836073 Ack=142966427 Win=65535 Len=0
1,5.683004999999866,10.0.2.15,62.210.85.178,TLSv1.2,3994,Application Data
1,5.683092999999644,62.210.85.178,10.0.2.15,TCP,60,9001  >  35978 [ACK] Seq=7836073 Ack=142967887 Win=65535 Len=0
1,5.68310399999973,62.210.85.178,10.0.2.15,TCP,60,9001  >  35978 [ACK] Seq=7836073 Ack=142969347 Win=65535 Len=0
1,5.68310799999972,62.210.85.178,10.0.2.15,TCP,60,9001  >  35978 [ACK] Seq=7836073 Ack=142970367 Win=65535 Len=0
1,5.69251499999973,10.0.2.15,62.210.85.178,TLSv1.2,4124,Application Data
1,5.692705999999816,62.210.85.178,10.0.2.15,TCP,60,9001  >  35978 [ACK] Seq=7836073 Ack=142971827 Win=65535 Len=0
1,5.692723999999998,62.210.85.178,10.0.2.15,TCP,60,9001  >  35978 [ACK] Seq=7836073 Ack=142973287 Win=65535 Len=0
1,5.692728999999872,62.210.85.178,10.0.2.15,TCP,60,9001  >  35978 [ACK] Seq=7836073 Ack=142974437 Win=65535 Len=0
1,5.692819999999756,10.0.2.15,62.210.85.178,TLSv1.2,4124,Application Data
1,5.692931000000044,62.210.85.178,10.0.2.15,TCP,60,9001  >  35978 [ACK] Seq=7836073 Ack=142975897 Win=65535 Len=0
1,5.692990999999893,62.210.85.178,10.0.2.15,TCP,60,9001  >  35978 [ACK] Seq=7836073 Ack=142977357 Win=65535 Len=0
1,5.693003999999746,62.210.85.178,10.0.2.15,TCP,60,9001  >  35978 [ACK] Seq=7836073 Ack=142978507 Win=65535 Len=0
1,5.693213000000014,10.0.2.15,62.210.85.178,TLSv1.2,4124,Application Data
1,5.6935709999997925,62.210.85.178,10.0.2.15,TCP,60,9001  >  35978 [ACK] Seq=7836073 Ack=142979967 Win=65535 Len=0
1,5.693585999999868,62.210.85.178,10.0.2.15,TCP,60,9001  >  35978 [ACK] Seq=7836073 Ack=142981427 Win=65535 Len=0
1,5.693590999999742,62.210.85.178,10.0.2.15,TCP,60,9001  >  35978 [ACK] Seq=7836073 Ack=142982577 Win=65535 Len=0
1,5.693669999999656,10.0.2.15,62.210.85.178,TLSv1.2,2324,Application Data
1,5.693843999999899,62.210.85.178,10.0.2.15,TCP,60,9001  >  35978 [ACK] Seq=7836073 Ack=142984037 Win=65535 Len=0
1,5.693858999999975,62.210.85.178,10.0.2.15,TCP,60,9001  >  35978 [ACK] Seq=7836073 Ack=142984847 Win=65535 Len=0
1,5.758548999999675,54.93.77.70,10.0.2.15,TLSv1.2,590,Application Data
1,5.800662999999986,10.0.2.15,54.93.77.70,TCP,54,34692  >  9001 [ACK] Seq=7851051 Ack=142753453 Win=65535 Len=0
1,5.857524999999896,54.93.77.70,10.0.2.15,TLSv1.2,3674,Application Data
1,5.857657999999901,10.0.2.15,54.93.77.70,TCP,54,34692  >  9001 [ACK] Seq=7851051 Ack=142757073 Win=65535 Len=0
1,5.87266099999988,54.93.77.70,10.0.2.15,TCP,2950,"9001  >  34692 [PSH, ACK] Seq=142757073 Ack=7851051 Win=65535 Len=2896 [TCP segment of a reassembled PDU]"
1,5.872802999999749,10.0.2.15,54.93.77.70,TCP,54,34692  >  9001 [ACK] Seq=7851051 Ack=142759969 Win=65535 Len=0
1,5.874521999999615,54.93.77.70,10.0.2.15,TLSv1.2,1314,"Application Data, Application Data"
1,5.874629999999797,10.0.2.15,54.93.77.70,TCP,54,34692  >  9001 [ACK] Seq=7851051 Ack=142761229 Win=65535 Len=0
1,5.901065000000017,54.93.77.70,10.0.2.15,TCP,2950,"9001  >  34692 [PSH, ACK] Seq=142761229 Ack=7851051 Win=65535 Len=2896 [TCP segment of a reassembled PDU]"
1,5.901112000000012,54.93.77.70,10.0.2.15,TLSv1.2,8742,"Application Data, Application Data"
1,5.901192999999694,10.0.2.15,54.93.77.70,TCP,54,34692  >  9001 [ACK] Seq=7851051 Ack=142764125 Win=65535 Len=0
1,5.901250999999775,10.0.2.15,54.93.77.70,TCP,54,34692  >  9001 [ACK] Seq=7851051 Ack=142772813 Win=65535 Len=0
1,5.901512999999795,54.93.77.70,10.0.2.15,TLSv1.2,5028,"Application Data, Application Data, Application Data"
1,5.901569999999992,10.0.2.15,54.93.77.70,TCP,54,34692  >  9001 [ACK] Seq=7851051 Ack=142777787 Win=65535 Len=0
1,5.901894999999968,10.0.2.15,54.93.77.70,TLSv1.2,590,Application Data
1,5.901991999999609,54.93.77.70,10.0.2.15,TCP,60,9001  >  34692 [ACK] Seq=142777787 Ack=7851587 Win=65535 Len=0
1,5.961786999999731,54.93.77.70,10.0.2.15,TCP,2950,"9001  >  34692 [PSH, ACK] Seq=142777787 Ack=7851587 Win=65535 Len=2896 [TCP segment of a reassembled PDU]"
1,5.961843000000044,54.93.77.70,10.0.2.15,TLSv1.2,4398,"Application Data, Application Data"
1,5.96190899999965,10.0.2.15,54.93.77.70,TCP,54,34692  >  9001 [ACK] Seq=7851587 Ack=142780683 Win=65535 Len=0
1,5.962031999999908,10.0.2.15,54.93.77.70,TCP,54,34692  >  9001 [ACK] Seq=7851587 Ack=142785027 Win=65535 Len=0
1,5.962229999999636,10.0.2.15,54.93.77.70,TLSv1.2,590,Application Data
1,5.962322999999742,54.93.77.70,10.0.2.15,TCP,60,9001  >  34692 [ACK] Seq=142785027 Ack=7852123 Win=65535 Len=0
1,5.979354999999941,54.93.77.70,10.0.2.15,TCP,2950,"9001  >  34692 [PSH, ACK] Seq=142785027 Ack=7852123 Win=65535 Len=2896 [TCP segment of a reassembled PDU]"
1,5.979472999999871,10.0.2.15,54.93.77.70,TCP,54,34692  >  9001 [ACK] Seq=7852123 Ack=142787923 Win=65535 Len=0
1,5.979895999999826,54.93.77.70,10.0.2.15,TLSv1.2,4912,"Application Data, Application Data"
1,5.979961999999887,10.0.2.15,54.93.77.70,TCP,54,34692  >  9001 [ACK] Seq=7852123 Ack=142792781 Win=65535 Len=0
1,5.997213999999985,54.93.77.70,10.0.2.15,TLSv1.2,5846,Application Data
1,5.997306999999637,54.93.77.70,10.0.2.15,TLSv1.2,8742,"Application Data, Application Data, Application Data"
1,5.997503999999935,10.0.2.15,54.93.77.70,TCP,54,34692  >  9001 [ACK] Seq=7852123 Ack=142798573 Win=65535 Len=0
1,5.997785000000022,10.0.2.15,54.93.77.70,TCP,54,34692  >  9001 [ACK] Seq=7852123 Ack=142807261 Win=65535 Len=0
1,5.9989080000000286,10.0.2.15,54.93.77.70,TLSv1.2,590,Application Data
1,5.99918099999968,54.93.77.70,10.0.2.15,TCP,60,9001  >  34692 [ACK] Seq=142807261 Ack=7852659 Win=65535 Len=0
1,6.009965999999622,62.210.85.178,10.0.2.15,TLSv1.2,590,Application Data
1,6.026418999999805,54.93.77.70,10.0.2.15,TLSv1.2,2646,Application Data
1,6.026540999999725,10.0.2.15,54.93.77.70,TCP,54,34692  >  9001 [ACK] Seq=7852659 Ack=142809853 Win=65535 Len=0
1,6.052396000000044,10.0.2.15,62.210.85.178,TCP,54,35978  >  9001 [ACK] Seq=142984847 Ack=7836609 Win=65535 Len=0
1,6.069694999999683,54.93.77.70,10.0.2.15,TLSv1.2,3674,Application Data
1,6.069923000000017,10.0.2.15,54.93.77.70,TCP,54,34692  >  9001 [ACK] Seq=7852659 Ack=142813473 Win=65535 Len=0
1,6.081971999999951,54.93.77.70,10.0.2.15,TLSv1.2,5846,Application Data
1,6.0831819999998515,10.0.2.15,54.93.77.70,TCP,54,34692  >  9001 [ACK] Seq=7852659 Ack=142819265 Win=65535 Len=0
1,6.0865139999996245,54.93.77.70,10.0.2.15,TLSv1.2,474,Application Data
1,6.092731999999614,10.0.2.15,54.93.77.70,TLSv1.2,590,Application Data
1,6.092925999999807,54.93.77.70,10.0.2.15,TCP,60,9001  >  34692 [ACK] Seq=142819685 Ack=7853195 Win=65535 Len=0
1,6.094335999999657,62.210.85.178,10.0.2.15,TLSv1.2,590,Application Data
1,6.094411000000036,10.0.2.15,62.210.85.178,TCP,54,35978  >  9001 [ACK] Seq=142984847 Ack=7837145 Win=65535 Len=0
1,6.118544999999813,62.210.85.178,10.0.2.15,TLSv1.2,590,Application Data
1,6.11878200000001,10.0.2.15,62.210.85.178,TCP,54,35978  >  9001 [ACK] Seq=142984847 Ack=7837681 Win=65535 Len=0
1,6.2489009999999325,62.210.85.178,10.0.2.15,TLSv1.2,590,Application Data
1,6.249633999999787,10.0.2.15,62.210.85.178,TCP,54,35978  >  9001 [ACK] Seq=142984847 Ack=7838217 Win=65535 Len=0
1,6.25311899999997,10.0.2.15,62.210.85.178,TLSv1.2,590,Application Data
1,6.253560999999991,62.210.85.178,10.0.2.15,TCP,60,9001  >  35978 [ACK] Seq=7838217 Ack=142985383 Win=65535 Len=0
1,6.3537499999997635,54.93.77.70,10.0.2.15,TLSv1.2,590,Application Data
1,6.3542929999998705,10.0.2.15,54.93.77.70,TLSv1.2,590,Application Data
1,6.354489999999714,54.93.77.70,10.0.2.15,TCP,60,9001  >  34692 [ACK] Seq=142820221 Ack=7853731 Win=65535 Len=0
1,6.543154999999842,62.210.85.178,10.0.2.15,TLSv1.2,590,Application Data
1,6.550464999999804,10.0.2.15,62.210.85.178,TLSv1.2,590,Application Data
1,6.550669999999627,62.210.85.178,10.0.2.15,TCP,60,9001  >  35978 [ACK] Seq=7838753 Ack=142985919 Win=65535 Len=0
1,6.562167000000045,10.0.2.15,62.210.85.178,TLSv1.2,4124,Application Data
1,6.562950000000001,62.210.85.178,10.0.2.15,TCP,60,9001  >  35978 [ACK] Seq=7838753 Ack=142987379 Win=65535 Len=0
1,6.563068999999814,62.210.85.178,10.0.2.15,TCP,60,9001  >  35978 [ACK] Seq=7838753 Ack=142988839 Win=65535 Len=0
1,6.563076999999794,62.210.85.178,10.0.2.15,TCP,60,9001  >  35978 [ACK] Seq=7838753 Ack=142989989 Win=65535 Len=0
1,6.563376999999946,10.0.2.15,62.210.85.178,TLSv1.2,4124,Application Data
1,6.563668999999663,10.0.2.15,62.210.85.178,TCP,2974,35978  >  9001 [ACK] Seq=142994059 Ack=7838753 Win=65535 Len=2920 [TCP segment of a reassembled PDU]
1,6.563774999999623,62.210.85.178,10.0.2.15,TCP,60,9001  >  35978 [ACK] Seq=7838753 Ack=142991449 Win=65535 Len=0
1,6.563799999999901,62.210.85.178,10.0.2.15,TCP,60,9001  >  35978 [ACK] Seq=7838753 Ack=142992909 Win=65535 Len=0
1,6.5638059999996585,62.210.85.178,10.0.2.15,TCP,60,9001  >  35978 [ACK] Seq=7838753 Ack=142994059 Win=65535 Len=0
1,6.563810999999987,62.210.85.178,10.0.2.15,TCP,60,9001  >  35978 [ACK] Seq=7838753 Ack=142995519 Win=65535 Len=0
1,6.563815999999861,62.210.85.178,10.0.2.15,TCP,60,9001  >  35978 [ACK] Seq=7838753 Ack=142996979 Win=65535 Len=0
1,6.563883999999689,10.0.2.15,62.210.85.178,TLSv1.2,1204,Application Data
1,6.563943999999992,62.210.85.178,10.0.2.15,TCP,60,9001  >  35978 [ACK] Seq=7838753 Ack=142998129 Win=65535 Len=0
1,6.564057000000048,10.0.2.15,62.210.85.178,TLSv1.2,4124,Application Data
1,6.56413399999974,62.210.85.178,10.0.2.15,TCP,60,9001  >  35978 [ACK] Seq=7838753 Ack=142999589 Win=65535 Len=0
1,6.564147000000048,62.210.85.178,10.0.2.15,TCP,60,9001  >  35978 [ACK] Seq=7838753 Ack=143001049 Win=65535 Len=0
1,6.564151999999922,62.210.85.178,10.0.2.15,TCP,60,9001  >  35978 [ACK] Seq=7838753 Ack=143002199 Win=65535 Len=0
1,6.564225999999962,10.0.2.15,62.210.85.178,TLSv1.2,332,Application Data
1,6.5643489999997655,62.210.85.178,10.0.2.15,TCP,60,9001  >  35978 [ACK] Seq=7838753 Ack=143002477 Win=65535 Len=0
1,6.564576999999645,10.0.2.15,62.210.85.178,TLSv1.2,3868,Application Data
1,6.564735999999812,62.210.85.178,10.0.2.15,TCP,60,9001  >  35978 [ACK] Seq=7838753 Ack=143003937 Win=65535 Len=0
1,6.564747999999781,62.210.85.178,10.0.2.15,TCP,60,9001  >  35978 [ACK] Seq=7838753 Ack=143005397 Win=65535 Len=0
1,6.564752999999655,62.210.85.178,10.0.2.15,TCP,60,9001  >  35978 [ACK] Seq=7838753 Ack=143006291 Win=65535 Len=0
1,6.565157999999883,10.0.2.15,62.210.85.178,TLSv1.2,4124,Application Data
1,6.565368000000035,10.0.2.15,62.210.85.178,TCP,2974,35978  >  9001 [ACK] Seq=143010361 Ack=7838753 Win=65535 Len=2920 [TCP segment of a reassembled PDU]
1,6.5654169999997976,62.210.85.178,10.0.2.15,TCP,60,9001  >  35978 [ACK] Seq=7838753 Ack=143007751 Win=65535 Len=0
1,6.5654279999998835,62.210.85.178,10.0.2.15,TCP,60,9001  >  35978 [ACK] Seq=7838753 Ack=143009211 Win=65535 Len=0
1,6.565431999999873,62.210.85.178,10.0.2.15,TCP,60,9001  >  35978 [ACK] Seq=7838753 Ack=143010361 Win=65535 Len=0
1,6.565436999999747,62.210.85.178,10.0.2.15,TCP,60,9001  >  35978 [ACK] Seq=7838753 Ack=143011821 Win=65535 Len=0
1,6.565440999999737,62.210.85.178,10.0.2.15,TCP,60,9001  >  35978 [ACK] Seq=7838753 Ack=143013281 Win=65535 Len=0
1,6.565486999999848,10.0.2.15,62.210.85.178,TLSv1.2,110,Application Data
1,6.5655289999999695,62.210.85.178,10.0.2.15,TCP,60,9001  >  35978 [ACK] Seq=7838753 Ack=143013337 Win=65535 Len=0
1,6.571939999999813,10.0.2.15,62.210.85.178,TLSv1.2,4124,Application Data
1,6.572077999999692,62.210.85.178,10.0.2.15,TCP,60,9001  >  35978 [ACK] Seq=7838753 Ack=143014797 Win=65535 Len=0
1,6.57209499999999,62.210.85.178,10.0.2.15,TCP,60,9001  >  35978 [ACK] Seq=7838753 Ack=143016257 Win=65535 Len=0
1,6.572099999999864,62.210.85.178,10.0.2.15,TCP,60,9001  >  35978 [ACK] Seq=7838753 Ack=143017407 Win=65535 Len=0
1,6.572162999999819,10.0.2.15,62.210.85.178,TLSv1.2,4124,Application Data
1,6.57220899999993,62.210.85.178,10.0.2.15,TCP,60,9001  >  35978 [ACK] Seq=7838753 Ack=143018867 Win=65535 Len=0
1,6.57221699999991,62.210.85.178,10.0.2.15,TCP,60,9001  >  35978 [ACK] Seq=7838753 Ack=143020327 Win=65535 Len=0
1,6.572221999999783,62.210.85.178,10.0.2.15,TCP,60,9001  >  35978 [ACK] Seq=7838753 Ack=143021477 Win=65535 Len=0
1,6.572268999999778,10.0.2.15,62.210.85.178,TLSv1.2,718,Application Data
1,6.572333999999955,62.210.85.178,10.0.2.15,TCP,60,9001  >  35978 [ACK] Seq=7838753 Ack=143022141 Win=65535 Len=0
1,6.703148999999939,54.93.77.70,10.0.2.15,TLSv1.2,590,Application Data
1,6.720745999999963,54.93.77.70,10.0.2.15,TCP,2950,"9001  >  34692 [PSH, ACK] Seq=142820757 Ack=7853731 Win=65535 Len=2896 [TCP segment of a reassembled PDU]"
1,6.721125999999913,10.0.2.15,54.93.77.70,TCP,54,34692  >  9001 [ACK] Seq=7853731 Ack=142823653 Win=65535 Len=0
1,6.727989999999863,54.93.77.70,10.0.2.15,TLSv1.2,4398,"Application Data, Application Data"
1,6.728132999999616,10.0.2.15,54.93.77.70,TCP,54,34692  >  9001 [ACK] Seq=7853731 Ack=142827997 Win=65535 Len=0
1,6.728458000000046,10.0.2.15,54.93.77.70,TLSv1.2,590,Application Data
1,6.728753999999753,54.93.77.70,10.0.2.15,TCP,60,9001  >  34692 [ACK] Seq=142827997 Ack=7854267 Win=65535 Len=0
1,6.73551899999984,54.93.77.70,10.0.2.15,TCP,2950,"9001  >  34692 [PSH, ACK] Seq=142827997 Ack=7854267 Win=65535 Len=2896 [TCP segment of a reassembled PDU]"
1,6.735773999999765,10.0.2.15,54.93.77.70,TCP,54,34692  >  9001 [ACK] Seq=7854267 Ack=142830893 Win=65535 Len=0
1,6.745368999999755,54.93.77.70,10.0.2.15,TLSv1.2,1314,"Application Data, Application Data"
1,6.7712509999996655,54.93.77.70,10.0.2.15,TLSv1.2,2950,Application Data
1,6.771479999999883,10.0.2.15,54.93.77.70,TCP,54,34692  >  9001 [ACK] Seq=7854267 Ack=142835049 Win=65535 Len=0
1,6.7764869999996336,54.93.77.70,10.0.2.15,TLSv1.2,2950,Application Data [TCP segment of a reassembled PDU]
1,6.776535999999851,54.93.77.70,10.0.2.15,TLSv1.2,2950,Application Data [TCP segment of a reassembled PDU]
1,6.776593000000048,10.0.2.15,54.93.77.70,TCP,54,34692  >  9001 [ACK] Seq=7854267 Ack=142837945 Win=65535 Len=0
1,6.776707999999871,10.0.2.15,54.93.77.70,TCP,54,34692  >  9001 [ACK] Seq=7854267 Ack=142840841 Win=65535 Len=0
1,6.777791999999863,54.93.77.70,10.0.2.15,TLSv1.2,7294,Application Data [TCP segment of a reassembled PDU]
1,6.777847999999722,10.0.2.15,54.93.77.70,TCP,54,34692  >  9001 [ACK] Seq=7854267 Ack=142848081 Win=65535 Len=0
1,6.788436999999703,54.93.77.70,10.0.2.15,TLSv1.2,170,Application Data
1,6.788896999999906,10.0.2.15,54.93.77.70,TLSv1.2,590,Application Data
1,6.789025999999922,54.93.77.70,10.0.2.15,TCP,60,9001  >  34692 [ACK] Seq=142848197 Ack=7854803 Win=65535 Len=0
1,6.797472999999627,54.93.77.70,10.0.2.15,TCP,2950,"9001  >  34692 [PSH, ACK] Seq=142848197 Ack=7854803 Win=65535 Len=2896 [TCP segment of a reassembled PDU]"
1,6.797641999999996,10.0.2.15,54.93.77.70,TCP,54,34692  >  9001 [ACK] Seq=7854803 Ack=142851093 Win=65535 Len=0
1,6.798903999999766,54.93.77.70,10.0.2.15,TLSv1.2,4398,Application Data [TCP segment of a reassembled PDU]
1,6.799209999999675,10.0.2.15,54.93.77.70,TCP,54,34692  >  9001 [ACK] Seq=7854803 Ack=142855437 Win=65535 Len=0
1,6.805461999999807,54.93.77.70,10.0.2.15,TLSv1.2,568,Application Data
1,6.838706999999886,62.210.85.178,10.0.2.15,TLSv1.2,590,Application Data
1,6.8486149999998815,10.0.2.15,54.93.77.70,TCP,54,34692  >  9001 [ACK] Seq=7854803 Ack=142855951 Win=65535 Len=0
1,6.86806899999965,54.93.77.70,10.0.2.15,TLSv1.2,1104,Application Data
1,6.86817499999961,10.0.2.15,54.93.77.70,TCP,54,34692  >  9001 [ACK] Seq=7854803 Ack=142857001 Win=65535 Len=0
1,6.870899999999892,10.0.2.15,54.93.77.70,TLSv1.2,590,Application Data
1,6.871107999999822,54.93.77.70,10.0.2.15,TCP,60,9001  >  34692 [ACK] Seq=142857001 Ack=7855339 Win=65535 Len=0
1,6.881947999999738,10.0.2.15,62.210.85.178,TCP,54,35978  >  9001 [ACK] Seq=143022141 Ack=7839289 Win=65535 Len=0
1,7.361793000000034,62.210.85.178,10.0.2.15,TLSv1.2,1104,Application Data
1,7.361887999999908,10.0.2.15,62.210.85.178,TCP,54,35978  >  9001 [ACK] Seq=143022141 Ack=7840339 Win=65535 Len=0
1,7.362603999999919,10.0.2.15,62.210.85.178,TLSv1.2,590,Application Data
1,7.362753999999768,62.210.85.178,10.0.2.15,TCP,60,9001  >  35978 [ACK] Seq=7840339 Ack=143022677 Win=65535 Len=0
1,7.4693059999999605,54.93.77.70,10.0.2.15,TLSv1.2,590,Application Data
1,7.469984999999724,10.0.2.15,54.93.77.70,TLSv1.2,590,Application Data
1,7.470149999999649,54.93.77.70,10.0.2.15,TCP,60,9001  >  34692 [ACK] Seq=142857537 Ack=7855875 Win=65535 Len=0
1,7.9763379999999415,62.210.85.178,10.0.2.15,TLSv1.2,590,Application Data
1,7.987440999999762,10.0.2.15,62.210.85.178,TLSv1.2,590,Application Data
1,7.989829999999984,62.210.85.178,10.0.2.15,TCP,60,9001  >  35978 [ACK] Seq=7840875 Ack=143023213 Win=65535 Len=0
1,7.99899699999969,10.0.2.15,62.210.85.178,TLSv1.2,4124,Application Data
1,7.999258999999711,62.210.85.178,10.0.2.15,TCP,60,9001  >  35978 [ACK] Seq=7840875 Ack=143024673 Win=65535 Len=0
1,7.999362999999903,62.210.85.178,10.0.2.15,TCP,60,9001  >  35978 [ACK] Seq=7840875 Ack=143026133 Win=65535 Len=0
1,7.9993829999998525,62.210.85.178,10.0.2.15,TCP,60,9001  >  35978 [ACK] Seq=7840875 Ack=143027283 Win=65535 Len=0
1,7.99956899999961,10.0.2.15,62.210.85.178,TLSv1.2,4124,Application Data
1,7.99971000000005,62.210.85.178,10.0.2.15,TCP,60,9001  >  35978 [ACK] Seq=7840875 Ack=143028743 Win=65535 Len=0
1,7.999723999999787,62.210.85.178,10.0.2.15,TCP,60,9001  >  35978 [ACK] Seq=7840875 Ack=143030203 Win=65535 Len=0
1,7.999728999999661,62.210.85.178,10.0.2.15,TCP,60,9001  >  35978 [ACK] Seq=7840875 Ack=143031353 Win=65535 Len=0
1,7.99980000000005,10.0.2.15,62.210.85.178,TLSv1.2,4124,Application Data
1,7.9999009999996815,62.210.85.178,10.0.2.15,TCP,60,9001  >  35978 [ACK] Seq=7840875 Ack=143032813 Win=65535 Len=0
1,7.999910999999884,62.210.85.178,10.0.2.15,TCP,60,9001  >  35978 [ACK] Seq=7840875 Ack=143034273 Win=65535 Len=0
1,7.9999189999998634,62.210.85.178,10.0.2.15,TCP,60,9001  >  35978 [ACK] Seq=7840875 Ack=143035423 Win=65535 Len=0
1,7.999975999999606,10.0.2.15,62.210.85.178,TLSv1.2,4124,Application Data
1,8.000060999999732,62.210.85.178,10.0.2.15,TCP,60,9001  >  35978 [ACK] Seq=7840875 Ack=143036883 Win=65535 Len=0
1,8.000069999999596,62.210.85.178,10.0.2.15,TCP,60,9001  >  35978 [ACK] Seq=7840875 Ack=143038343 Win=65535 Len=0
1,8.000074999999924,62.210.85.178,10.0.2.15,TCP,60,9001  >  35978 [ACK] Seq=7840875 Ack=143039493 Win=65535 Len=0
1,8.000129000000015,10.0.2.15,62.210.85.178,TLSv1.2,332,Application Data
1,8.000192999999854,62.210.85.178,10.0.2.15,TCP,60,9001  >  35978 [ACK] Seq=7840875 Ack=143039771 Win=65535 Len=0
1,8.000278999999864,10.0.2.15,62.210.85.178,TLSv1.2,3868,Application Data
1,8.000356999999894,62.210.85.178,10.0.2.15,TCP,60,9001  >  35978 [ACK] Seq=7840875 Ack=143041231 Win=65535 Len=0
1,8.00037199999997,62.210.85.178,10.0.2.15,TCP,60,9001  >  35978 [ACK] Seq=7840875 Ack=143042691 Win=65535 Len=0
1,8.000377999999728,62.210.85.178,10.0.2.15,TCP,60,9001  >  35978 [ACK] Seq=7840875 Ack=143043585 Win=65535 Len=0
1,8.000443999999789,10.0.2.15,62.210.85.178,TLSv1.2,4124,Application Data
1,8.000491999999667,62.210.85.178,10.0.2.15,TCP,60,9001  >  35978 [ACK] Seq=7840875 Ack=143045045 Win=65535 Len=0
1,8.000499999999647,62.210.85.178,10.0.2.15,TCP,60,9001  >  35978 [ACK] Seq=7840875 Ack=143046505 Win=65535 Len=0
1,8.000504999999976,62.210.85.178,10.0.2.15,TCP,60,9001  >  35978 [ACK] Seq=7840875 Ack=143047655 Win=65535 Len=0
1,8.000552999999854,10.0.2.15,62.210.85.178,TLSv1.2,3030,Application Data
1,8.000597999999627,62.210.85.178,10.0.2.15,TCP,60,9001  >  35978 [ACK] Seq=7840875 Ack=143049115 Win=65535 Len=0
1,8.000606999999945,62.210.85.178,10.0.2.15,TCP,60,9001  >  35978 [ACK] Seq=7840875 Ack=143050575 Win=65535 Len=0
1,8.000611999999819,62.210.85.178,10.0.2.15,TCP,60,9001  >  35978 [ACK] Seq=7840875 Ack=143050631 Win=65535 Len=0
1,8.01017899999988,10.0.2.15,62.210.85.178,TLSv1.2,4124,Application Data
1,8.010497999999643,62.210.85.178,10.0.2.15,TCP,60,9001  >  35978 [ACK] Seq=7840875 Ack=143052091 Win=65535 Len=0
1,8.010536999999658,62.210.85.178,10.0.2.15,TCP,60,9001  >  35978 [ACK] Seq=7840875 Ack=143053551 Win=65535 Len=0
1,8.010540999999648,62.210.85.178,10.0.2.15,TCP,60,9001  >  35978 [ACK] Seq=7840875 Ack=143054701 Win=65535 Len=0
1,8.010606999999709,10.0.2.15,62.210.85.178,TLSv1.2,4124,Application Data
1,8.010718999999881,62.210.85.178,10.0.2.15,TCP,60,9001  >  35978 [ACK] Seq=7840875 Ack=143056161 Win=65535 Len=0
1,8.010732999999618,62.210.85.178,10.0.2.15,TCP,60,9001  >  35978 [ACK] Seq=7840875 Ack=143057621 Win=65535 Len=0
1,8.010736999999608,62.210.85.178,10.0.2.15,TCP,60,9001  >  35978 [ACK] Seq=7840875 Ack=143058771 Win=65535 Len=0
1,8.010792000000038,10.0.2.15,62.210.85.178,TLSv1.2,4124,Application Data
1,8.0108809999997,62.210.85.178,10.0.2.15,TCP,60,9001  >  35978 [ACK] Seq=7840875 Ack=143060231 Win=65535 Len=0
1,8.010890000000018,62.210.85.178,10.0.2.15,TCP,60,9001  >  35978 [ACK] Seq=7840875 Ack=143061691 Win=65535 Len=0
1,8.010892999999669,62.210.85.178,10.0.2.15,TCP,60,9001  >  35978 [ACK] Seq=7840875 Ack=143062841 Win=65535 Len=0
1,8.010943999999654,10.0.2.15,62.210.85.178,TLSv1.2,4124,Application Data
1,8.011005999999725,62.210.85.178,10.0.2.15,TCP,60,9001  >  35978 [ACK] Seq=7840875 Ack=143064301 Win=65535 Len=0
1,8.011015999999927,62.210.85.178,10.0.2.15,TCP,60,9001  >  35978 [ACK] Seq=7840875 Ack=143065761 Win=65535 Len=0
1,8.011019000000033,62.210.85.178,10.0.2.15,TCP,60,9001  >  35978 [ACK] Seq=7840875 Ack=143066911 Win=65535 Len=0
1,8.011081999999988,10.0.2.15,62.210.85.178,TLSv1.2,332,Application Data
1,8.011123999999654,62.210.85.178,10.0.2.15,TCP,60,9001  >  35978 [ACK] Seq=7840875 Ack=143067189 Win=65535 Len=0
1,8.011242000000038,10.0.2.15,62.210.85.178,TLSv1.2,3868,Application Data
1,8.011317999999847,62.210.85.178,10.0.2.15,TCP,60,9001  >  35978 [ACK] Seq=7840875 Ack=143068649 Win=65535 Len=0
1,8.011325999999826,62.210.85.178,10.0.2.15,TCP,60,9001  >  35978 [ACK] Seq=7840875 Ack=143070109 Win=65535 Len=0
1,8.011328999999932,62.210.85.178,10.0.2.15,TCP,60,9001  >  35978 [ACK] Seq=7840875 Ack=143071003 Win=65535 Len=0
1,8.011373999999705,10.0.2.15,62.210.85.178,TLSv1.2,4124,Application Data
1,8.011438999999882,62.210.85.178,10.0.2.15,TCP,60,9001  >  35978 [ACK] Seq=7840875 Ack=143072463 Win=65535 Len=0
1,8.01144899999963,62.210.85.178,10.0.2.15,TCP,60,9001  >  35978 [ACK] Seq=7840875 Ack=143073923 Win=65535 Len=0
1,8.01145299999962,62.210.85.178,10.0.2.15,TCP,60,9001  >  35978 [ACK] Seq=7840875 Ack=143075073 Win=65535 Len=0
1,8.011512999999923,10.0.2.15,62.210.85.178,TLSv1.2,3030,Application Data
1,8.011578999999983,62.210.85.178,10.0.2.15,TCP,60,9001  >  35978 [ACK] Seq=7840875 Ack=143076533 Win=65535 Len=0
1,8.011586999999963,62.210.85.178,10.0.2.15,TCP,60,9001  >  35978 [ACK] Seq=7840875 Ack=143077993 Win=65535 Len=0
1,8.011589999999615,62.210.85.178,10.0.2.15,TCP,60,9001  >  35978 [ACK] Seq=7840875 Ack=143078049 Win=65535 Len=0
1,8.025423000000046,10.0.2.15,62.210.85.178,TLSv1.2,4124,Application Data
1,8.025555999999597,62.210.85.178,10.0.2.15,TCP,60,9001  >  35978 [ACK] Seq=7840875 Ack=143079509 Win=65535 Len=0
1,8.025573999999779,62.210.85.178,10.0.2.15,TCP,60,9001  >  35978 [ACK] Seq=7840875 Ack=143080969 Win=65535 Len=0
1,8.025578999999652,62.210.85.178,10.0.2.15,TCP,60,9001  >  35978 [ACK] Seq=7840875 Ack=143082119 Win=65535 Len=0
1,8.025646999999935,10.0.2.15,62.210.85.178,TLSv1.2,4124,Application Data
1,8.02569399999993,62.210.85.178,10.0.2.15,TCP,60,9001  >  35978 [ACK] Seq=7840875 Ack=143083579 Win=65535 Len=0
1,8.02570199999991,62.210.85.178,10.0.2.15,TCP,60,9001  >  35978 [ACK] Seq=7840875 Ack=143085039 Win=65535 Len=0
1,8.025706999999784,62.210.85.178,10.0.2.15,TCP,60,9001  >  35978 [ACK] Seq=7840875 Ack=143086189 Win=65535 Len=0
1,8.025756000000001,10.0.2.15,62.210.85.178,TLSv1.2,4124,Application Data
1,8.025799000000006,62.210.85.178,10.0.2.15,TCP,60,9001  >  35978 [ACK] Seq=7840875 Ack=143087649 Win=65535 Len=0
1,8.025805999999648,62.210.85.178,10.0.2.15,TCP,60,9001  >  35978 [ACK] Seq=7840875 Ack=143089109 Win=65535 Len=0
1,8.025810999999976,62.210.85.178,10.0.2.15,TCP,60,9001  >  35978 [ACK] Seq=7840875 Ack=143090259 Win=65535 Len=0
1,8.025856999999633,10.0.2.15,62.210.85.178,TLSv1.2,4124,Application Data
1,8.025900999999976,62.210.85.178,10.0.2.15,TCP,60,9001  >  35978 [ACK] Seq=7840875 Ack=143091719 Win=65535 Len=0
1,8.025907999999617,62.210.85.178,10.0.2.15,TCP,60,9001  >  35978 [ACK] Seq=7840875 Ack=143093179 Win=65535 Len=0
1,8.025912999999946,62.210.85.178,10.0.2.15,TCP,60,9001  >  35978 [ACK] Seq=7840875 Ack=143094329 Win=65535 Len=0
1,8.025956999999835,10.0.2.15,62.210.85.178,TLSv1.2,332,Application Data
1,8.02599999999984,62.210.85.178,10.0.2.15,TCP,60,9001  >  35978 [ACK] Seq=7840875 Ack=143094607 Win=65535 Len=0
1,8.026063999999678,10.0.2.15,62.210.85.178,TLSv1.2,3868,Application Data
1,8.026108999999906,62.210.85.178,10.0.2.15,TCP,60,9001  >  35978 [ACK] Seq=7840875 Ack=143096067 Win=65535 Len=0
1,8.026116000000002,62.210.85.178,10.0.2.15,TCP,60,9001  >  35978 [ACK] Seq=7840875 Ack=143097527 Win=65535 Len=0
1,8.026120999999875,62.210.85.178,10.0.2.15,TCP,60,9001  >  35978 [ACK] Seq=7840875 Ack=143098421 Win=65535 Len=0
1,8.026168999999754,10.0.2.15,62.210.85.178,TLSv1.2,2966,Application Data
1,8.026212999999643,62.210.85.178,10.0.2.15,TCP,60,9001  >  35978 [ACK] Seq=7840875 Ack=143099881 Win=65535 Len=0
1,8.02621999999974,62.210.85.178,10.0.2.15,TCP,60,9001  >  35978 [ACK] Seq=7840875 Ack=143101333 Win=65535 Len=0
1,8.106236999999965,54.93.77.70,10.0.2.15,TLSv1.2,590,Application Data
1,8.148479999999836,10.0.2.15,54.93.77.70,TCP,54,34692  >  9001 [ACK] Seq=7855875 Ack=142858073 Win=65535 Len=0
1,8.283318999999665,54.93.77.70,10.0.2.15,TCP,2950,"9001  >  34692 [PSH, ACK] Seq=142858073 Ack=7855875 Win=65535 Len=2896 [TCP segment of a reassembled PDU]"
1,8.283421999999973,10.0.2.15,54.93.77.70,TCP,54,34692  >  9001 [ACK] Seq=7855875 Ack=142860969 Win=65535 Len=0
1,8.286078999999972,54.93.77.70,10.0.2.15,TLSv1.2,778,Application Data
1,8.2861469999998,10.0.2.15,54.93.77.70,TCP,54,34692  >  9001 [ACK] Seq=7855875 Ack=142861693 Win=65535 Len=0
1,8.286957999999686,54.93.77.70,10.0.2.15,TLSv1.2,7294,"Application Data, Application Data"
1,8.286989999999605,54.93.77.70,10.0.2.15,TCP,2950,"9001  >  34692 [PSH, ACK] Seq=142868933 Ack=7855875 Win=65535 Len=2896 [TCP segment of a reassembled PDU]"
1,8.287035999999716,10.0.2.15,54.93.77.70,TCP,54,34692  >  9001 [ACK] Seq=7855875 Ack=142868933 Win=65535 Len=0
1,8.287080999999944,10.0.2.15,54.93.77.70,TCP,54,34692  >  9001 [ACK] Seq=7855875 Ack=142871829 Win=65535 Len=0
1,8.302318999999898,54.93.77.70,10.0.2.15,TLSv1.2,2950,"Application Data, Application Data"
1,8.3024419999997,10.0.2.15,54.93.77.70,TCP,54,34692  >  9001 [ACK] Seq=7855875 Ack=142874725 Win=65535 Len=0
1,8.302491999999802,54.93.77.70,10.0.2.15,TLSv1.2,2950,Application Data [TCP segment of a reassembled PDU]
1,8.30253300000004,10.0.2.15,54.93.77.70,TCP,54,34692  >  9001 [ACK] Seq=7855875 Ack=142877621 Win=65535 Len=0
1,8.302836999999727,54.93.77.70,10.0.2.15,TCP,2950,"9001  >  34692 [PSH, ACK] Seq=142877621 Ack=7855875 Win=65535 Len=2896 [TCP segment of a reassembled PDU]"
1,8.302887999999712,10.0.2.15,54.93.77.70,TCP,54,34692  >  9001 [ACK] Seq=7855875 Ack=142880517 Win=65535 Len=0
1,8.303785999999945,54.93.77.70,10.0.2.15,TLSv1.2,2950,"Application Data, Application Data"
1,8.303838999999698,10.0.2.15,54.93.77.70,TCP,54,34692  >  9001 [ACK] Seq=7855875 Ack=142883413 Win=65535 Len=0
1,8.304016000000047,10.0.2.15,54.93.77.70,TLSv1.2,590,Application Data
1,8.304106000000047,54.93.77.70,10.0.2.15,TCP,60,9001  >  34692 [ACK] Seq=142883413 Ack=7856411 Win=65535 Len=0
1,8.307144999999764,54.93.77.70,10.0.2.15,TLSv1.2,2712,"Application Data, Application Data, Application Data"
1,8.30746199999976,10.0.2.15,54.93.77.70,TCP,54,34692  >  9001 [ACK] Seq=7856411 Ack=142886071 Win=65535 Len=0
1,8.308133999999882,54.93.77.70,10.0.2.15,TLSv1.2,4398,Application Data
1,8.308226999999988,10.0.2.15,54.93.77.70,TCP,54,34692  >  9001 [ACK] Seq=7856411 Ack=142890415 Win=65535 Len=0
1,8.31212800000003,54.93.77.70,10.0.2.15,TLSv1.2,1502,Application Data [TCP segment of a reassembled PDU]
1,8.312212999999701,10.0.2.15,54.93.77.70,TCP,54,34692  >  9001 [ACK] Seq=7856411 Ack=142891863 Win=65535 Len=0
1,8.314934999999878,10.0.2.15,54.93.77.70,TLSv1.2,590,Application Data
1,8.315178999999716,54.93.77.70,10.0.2.15,TCP,60,9001  >  34692 [ACK] Seq=142891863 Ack=7856947 Win=65535 Len=0
1,8.319475999999668,54.93.77.70,10.0.2.15,TCP,2950,"9001  >  34692 [PSH, ACK] Seq=142891863 Ack=7856947 Win=65535 Len=2896 [TCP segment of a reassembled PDU]"
1,8.319614999999885,10.0.2.15,54.93.77.70,TCP,54,34692  >  9001 [ACK] Seq=7856947 Ack=142894759 Win=65535 Len=0
1,8.319745999999668,54.93.77.70,10.0.2.15,TLSv1.2,4398,Application Data [TCP segment of a reassembled PDU]
1,8.31979999999976,10.0.2.15,54.93.77.70,TCP,54,34692  >  9001 [ACK] Seq=7856947 Ack=142899103 Win=65535 Len=0
1,8.323991999999635,54.93.77.70,10.0.2.15,TLSv1.2,474,Application Data
1,8.333902999999736,54.93.77.70,10.0.2.15,TCP,2950,"9001  >  34692 [PSH, ACK] Seq=142899523 Ack=7856947 Win=65535 Len=2896 [TCP segment of a reassembled PDU]"
1,8.334027999999762,10.0.2.15,54.93.77.70,TCP,54,34692  >  9001 [ACK] Seq=7856947 Ack=142902419 Win=65535 Len=0
1,8.334089999999833,54.93.77.70,10.0.2.15,TLSv1.2,4398,Application Data [TCP segment of a reassembled PDU]
1,8.3341819999996,10.0.2.15,54.93.77.70,TCP,54,34692  >  9001 [ACK] Seq=7856947 Ack=142906763 Win=65535 Len=0
1,8.350087999999687,54.93.77.70,10.0.2.15,TLSv1.2,1104,"Application Data, Application Data"
1,8.353701000000001,54.93.77.70,10.0.2.15,TCP,1502,"9001  >  34692 [PSH, ACK] Seq=142907813 Ack=7856947 Win=65535 Len=1448 [TCP segment of a reassembled PDU]"
1,8.353780999999799,10.0.2.15,54.93.77.70,TCP,54,34692  >  9001 [ACK] Seq=7856947 Ack=142909261 Win=65535 Len=0
1,8.371866999999838,54.93.77.70,10.0.2.15,TLSv1.2,684,Application Data
1,8.372525999999652,10.0.2.15,54.93.77.70,TLSv1.2,590,Application Data
1,8.3729629999998,54.93.77.70,10.0.2.15,TCP,60,9001  >  34692 [ACK] Seq=142909891 Ack=7857483 Win=65535 Len=0
1,8.404787999999826,62.210.85.178,10.0.2.15,TLSv1.2,590,Application Data
1,8.409367999999631,54.93.77.70,10.0.2.15,TLSv1.2,3674,Application Data
1,8.409516999999596,10.0.2.15,54.93.77.70,TCP,54,34692  >  9001 [ACK] Seq=7857483 Ack=142913511 Win=65535 Len=0
1,8.417426999999861,54.93.77.70,10.0.2.15,TCP,2950,"9001  >  34692 [PSH, ACK] Seq=142913511 Ack=7857483 Win=65535 Len=2896 [TCP segment of a reassembled PDU]"
1,8.417531999999937,10.0.2.15,54.93.77.70,TCP,54,34692  >  9001 [ACK] Seq=7857483 Ack=142916407 Win=65535 Len=0
1,8.417586999999912,54.93.77.70,10.0.2.15,TLSv1.2,4398,Application Data [TCP segment of a reassembled PDU]
1,8.417668000000049,10.0.2.15,54.93.77.70,TCP,54,34692  >  9001 [ACK] Seq=7857483 Ack=142920751 Win=65535 Len=0
1,8.427138000000014,54.93.77.70,10.0.2.15,TLSv1.2,1104,"Application Data, Application Data"
1,8.429459999999835,54.93.77.70,10.0.2.15,TCP,2950,"9001  >  34692 [PSH, ACK] Seq=142921801 Ack=7857483 Win=65535 Len=2896 [TCP segment of a reassembled PDU]"
1,8.429626999999982,10.0.2.15,54.93.77.70,TCP,54,34692  >  9001 [ACK] Seq=7857483 Ack=142924697 Win=65535 Len=0
1,8.432402999999795,54.93.77.70,10.0.2.15,TLSv1.2,4398,Application Data [TCP segment of a reassembled PDU]
1,8.43259799999987,10.0.2.15,54.93.77.70,TCP,54,34692  >  9001 [ACK] Seq=7857483 Ack=142929041 Win=65535 Len=0
1,8.444989999999962,54.93.77.70,10.0.2.15,TLSv1.2,2950,"Application Data, Application Data"
1,8.445034999999734,54.93.77.70,10.0.2.15,TLSv1.2,4398,Application Data [TCP segment of a reassembled PDU]
1,8.44513599999982,10.0.2.15,54.93.77.70,TCP,54,34692  >  9001 [ACK] Seq=7857483 Ack=142931937 Win=65535 Len=0
1,8.44525399999975,10.0.2.15,54.93.77.70,TCP,54,34692  >  9001 [ACK] Seq=7857483 Ack=142936281 Win=65535 Len=0
1,8.445627999999942,10.0.2.15,54.93.77.70,TLSv1.2,590,Application Data
1,8.445741999999882,54.93.77.70,10.0.2.15,TCP,60,9001  >  34692 [ACK] Seq=142936281 Ack=7858019 Win=65535 Len=0
1,8.446781999999985,54.93.77.70,10.0.2.15,TLSv1.2,76,Application Data
1,8.448408999999629,10.0.2.15,62.210.85.178,TCP,54,35978  >  9001 [ACK] Seq=143101333 Ack=7841411 Win=65535 Len=0
1,8.45669799999996,10.0.2.15,54.93.77.70,TLSv1.2,590,Application Data
1,8.457107999999607,54.93.77.70,10.0.2.15,TCP,60,9001  >  34692 [ACK] Seq=142936303 Ack=7858555 Win=65535 Len=0
1,8.461762999999792,62.210.85.178,10.0.2.15,TLSv1.2,590,Application Data
1,8.461866999999984,10.0.2.15,62.210.85.178,TCP,54,35978  >  9001 [ACK] Seq=143101333 Ack=7841947 Win=65535 Len=0
