No.,Time,Source,Destination,Protocol,Length,Info
1,0.29148499999973865,10.0.2.15,54.93.77.70,TLSv1.2,590,Application Data
1,0.2917099999999664,54.93.77.70,10.0.2.15,TCP,60,9001  >  34692 [ACK] Seq=150617543 Ack=8287489 Win=65535 Len=0
1,0.39235999999982596,62.210.85.178,10.0.2.15,TLSv1.2,590,Application Data
1,0.3928080000000591,10.0.2.15,62.210.85.178,TLSv1.2,590,Application Data
1,0.39295799999990777,62.210.85.178,10.0.2.15,TCP,60,9001  >  35978 [ACK] Seq=8255655 Ack=150768531 Win=65535 Len=0
1,0.8420169999999416,54.93.77.70,10.0.2.15,TLSv1.2,590,Application Data
1,0.8421969999999419,10.0.2.15,54.93.77.70,TCP,54,34692  >  9001 [ACK] Seq=8287489 Ack=150618079 Win=65535 Len=0
1,0.8431089999999131,10.0.2.15,54.93.77.70,TLSv1.2,1618,Application Data
1,0.8433529999997518,54.93.77.70,10.0.2.15,TCP,60,9001  >  34692 [ACK] Seq=150618079 Ack=8288949 Win=65535 Len=0
1,0.8433929999996508,54.93.77.70,10.0.2.15,TCP,60,9001  >  34692 [ACK] Seq=150618079 Ack=8289053 Win=65535 Len=0
1,0.8707989999998063,10.0.2.15,10.0.2.3,DNS,98,Standard query 0x3f0e A shavar.services.mozilla.com OPT
1,0.8716989999998077,10.0.2.15,10.0.2.3,DNS,98,Standard query 0xc149 AAAA shavar.services.mozilla.com OPT
1,0.8838689999997769,10.0.2.3,10.0.2.15,DNS,241,Standard query response 0xc149 AAAA shavar.services.mozilla.com CNAME shavar.services.mozilla.com.edgesuite.net CNAME a1895.dscd.akamai.net AAAA 2001:918:ffad::c1f7:2b13 AAAA 2001:918:ffad::c1f7:2b4a OPT
1,0.8838989999999285,10.0.2.3,10.0.2.15,DNS,217,Standard query response 0x3f0e A shavar.services.mozilla.com CNAME shavar.services.mozilla.com.edgesuite.net CNAME a1895.dscd.akamai.net A 193.246.105.131 A 193.246.105.82 OPT
1,0.8863929999997708,10.0.2.15,193.246.105.82,TCP,74,42316  >  443 [SYN] Seq=0 Win=29200 Len=0 MSS=1460 SACK_PERM=1 TSval=3441392388 TSecr=0 WS=128
1,0.8994029999998929,193.246.105.82,10.0.2.15,TCP,60,"443  >  42316 [SYN, ACK] Seq=0 Ack=1 Win=65535 Len=0 MSS=1460"
1,0.8994490000000042,10.0.2.15,193.246.105.82,TCP,54,42316  >  443 [ACK] Seq=1 Ack=1 Win=29200 Len=0
1,0.9004749999999149,10.0.2.15,193.246.105.82,TLSv1.3,751,Client Hello
1,0.900597999999718,193.246.105.82,10.0.2.15,TCP,60,443  >  42316 [ACK] Seq=1 Ack=698 Win=65535 Len=0
1,0.9123709999998937,193.246.105.82,10.0.2.15,TLSv1.3,320,"Server Hello, Change Cipher Spec, Application Data, Application Data"
1,0.9134089999997741,10.0.2.15,193.246.105.82,TCP,54,42316  >  443 [ACK] Seq=698 Ack=267 Win=30016 Len=0
1,0.9142309999997451,10.0.2.15,193.246.105.82,TLSv1.3,134,"Change Cipher Spec, Application Data"
1,0.9143549999998868,193.246.105.82,10.0.2.15,TCP,60,443  >  42316 [ACK] Seq=267 Ack=778 Win=65535 Len=0
1,0.9161609999996472,10.0.2.15,193.246.105.82,TLSv1.3,1246,Application Data
1,0.9164209999999002,193.246.105.82,10.0.2.15,TCP,60,443  >  42316 [ACK] Seq=267 Ack=1970 Win=65535 Len=0
1,0.9238989999998921,193.246.105.82,10.0.2.15,TLSv1.3,341,Application Data
1,0.9267789999998968,193.246.105.82,10.0.2.15,TLSv1.3,286,Application Data
1,0.9272149999997055,10.0.2.15,193.246.105.82,TCP,54,42316  >  443 [ACK] Seq=1970 Ack=786 Win=32160 Len=0
1,0.9460369999997056,62.210.85.178,10.0.2.15,TLSv1.2,1618,Application Data
1,0.9463519999999335,10.0.2.15,62.210.85.178,TCP,54,35978  >  9001 [ACK] Seq=150768531 Ack=8257219 Win=65535 Len=0
1,0.9773509999999987,10.0.2.15,62.210.85.178,TLSv1.2,590,Application Data
1,0.9775919999997313,62.210.85.178,10.0.2.15,TCP,60,9001  >  35978 [ACK] Seq=8257219 Ack=150769067 Win=65535 Len=0
1,0.9920149999998102,10.0.2.15,62.210.85.178,TLSv1.2,1618,Application Data
1,0.9923979999998664,62.210.85.178,10.0.2.15,TCP,60,9001  >  35978 [ACK] Seq=8257219 Ack=150770527 Win=65535 Len=0
1,0.9924439999999777,62.210.85.178,10.0.2.15,TCP,60,9001  >  35978 [ACK] Seq=8257219 Ack=150770631 Win=65535 Len=0
1,1.0804579999999078,54.93.77.70,10.0.2.15,TLSv1.2,590,Application Data
1,1.1227169999997386,10.0.2.15,54.93.77.70,TCP,54,34692  >  9001 [ACK] Seq=8289053 Ack=150618615 Win=65535 Len=0
1,1.24928699999964,54.93.77.70,10.0.2.15,TLSv1.2,1618,Application Data
1,1.2495770000000448,10.0.2.15,54.93.77.70,TCP,54,34692  >  9001 [ACK] Seq=8289053 Ack=150620179 Win=65535 Len=0
1,1.2540779999999359,10.0.2.15,54.93.77.70,TLSv1.2,590,Application Data
1,1.254265999999916,54.93.77.70,10.0.2.15,TCP,60,9001  >  34692 [ACK] Seq=150620179 Ack=8289589 Win=65535 Len=0
1,1.369452999999794,62.210.85.178,10.0.2.15,TLSv1.2,590,Application Data
1,1.3697950000000674,10.0.2.15,62.210.85.178,TLSv1.2,590,Application Data
1,1.3699229999997442,62.210.85.178,10.0.2.15,TCP,60,9001  >  35978 [ACK] Seq=8257755 Ack=150771167 Win=65535 Len=0
1,1.7609349999997903,54.93.77.70,10.0.2.15,TLSv1.2,590,Application Data
1,1.761442999999872,10.0.2.15,54.93.77.70,TLSv1.2,590,Application Data
1,1.7617169999998623,54.93.77.70,10.0.2.15,TCP,60,9001  >  34692 [ACK] Seq=150620715 Ack=8290125 Win=65535 Len=0
1,1.870118999999704,62.210.85.178,10.0.2.15,TLSv1.2,590,Application Data
1,1.886540999999852,10.0.2.15,62.210.85.178,TLSv1.2,590,Application Data
1,1.8867249999998421,62.210.85.178,10.0.2.15,TCP,60,9001  >  35978 [ACK] Seq=8258291 Ack=150771703 Win=65535 Len=0
1,1.9014389999997547,10.0.2.15,62.210.85.178,TLSv1.2,4124,Application Data
1,1.9017739999999321,62.210.85.178,10.0.2.15,TCP,60,9001  >  35978 [ACK] Seq=8258291 Ack=150773163 Win=65535 Len=0
1,1.9017989999997553,62.210.85.178,10.0.2.15,TCP,60,9001  >  35978 [ACK] Seq=8258291 Ack=150774623 Win=65535 Len=0
1,1.901803999999629,62.210.85.178,10.0.2.15,TCP,60,9001  >  35978 [ACK] Seq=8258291 Ack=150775773 Win=65535 Len=0
1,1.9021359999997003,10.0.2.15,62.210.85.178,TLSv1.2,4124,Application Data
1,1.9022949999998673,62.210.85.178,10.0.2.15,TCP,60,9001  >  35978 [ACK] Seq=8258291 Ack=150777233 Win=65535 Len=0
1,1.9023079999997208,62.210.85.178,10.0.2.15,TCP,60,9001  >  35978 [ACK] Seq=8258291 Ack=150778693 Win=65535 Len=0
1,1.9023130000000492,62.210.85.178,10.0.2.15,TCP,60,9001  >  35978 [ACK] Seq=8258291 Ack=150779843 Win=65535 Len=0
1,1.9023749999996653,10.0.2.15,62.210.85.178,TLSv1.2,4124,Application Data
1,1.9024679999997716,62.210.85.178,10.0.2.15,TCP,60,9001  >  35978 [ACK] Seq=8258291 Ack=150781303 Win=65535 Len=0
1,1.9024759999997514,62.210.85.178,10.0.2.15,TCP,60,9001  >  35978 [ACK] Seq=8258291 Ack=150782763 Win=65535 Len=0
1,1.902480999999625,62.210.85.178,10.0.2.15,TCP,60,9001  >  35978 [ACK] Seq=8258291 Ack=150783913 Win=65535 Len=0
1,1.9025769999998374,10.0.2.15,62.210.85.178,TLSv1.2,4124,Application Data
1,1.9026559999997517,62.210.85.178,10.0.2.15,TCP,60,9001  >  35978 [ACK] Seq=8258291 Ack=150785373 Win=65535 Len=0
1,1.9026669999998376,62.210.85.178,10.0.2.15,TCP,60,9001  >  35978 [ACK] Seq=8258291 Ack=150786833 Win=65535 Len=0
1,1.9026709999998275,62.210.85.178,10.0.2.15,TCP,60,9001  >  35978 [ACK] Seq=8258291 Ack=150787983 Win=65535 Len=0
1,1.9027109999997265,10.0.2.15,62.210.85.178,TLSv1.2,332,Application Data
1,1.902751999999964,62.210.85.178,10.0.2.15,TCP,60,9001  >  35978 [ACK] Seq=8258291 Ack=150788261 Win=65535 Len=0
1,1.902842999999848,10.0.2.15,62.210.85.178,TLSv1.2,3868,Application Data
1,1.9028869999997369,62.210.85.178,10.0.2.15,TCP,60,9001  >  35978 [ACK] Seq=8258291 Ack=150789721 Win=65535 Len=0
1,1.9028939999998329,62.210.85.178,10.0.2.15,TCP,60,9001  >  35978 [ACK] Seq=8258291 Ack=150791181 Win=65535 Len=0
1,1.9028989999997066,62.210.85.178,10.0.2.15,TCP,60,9001  >  35978 [ACK] Seq=8258291 Ack=150792075 Win=65535 Len=0
1,1.902947999999924,10.0.2.15,62.210.85.178,TLSv1.2,4124,Application Data
1,1.9029900000000453,62.210.85.178,10.0.2.15,TCP,60,9001  >  35978 [ACK] Seq=8258291 Ack=150793535 Win=65535 Len=0
1,1.9029969999996865,62.210.85.178,10.0.2.15,TCP,60,9001  >  35978 [ACK] Seq=8258291 Ack=150794995 Win=65535 Len=0
1,1.903002000000015,62.210.85.178,10.0.2.15,TCP,60,9001  >  35978 [ACK] Seq=8258291 Ack=150796145 Win=65535 Len=0
1,1.9030479999996714,10.0.2.15,62.210.85.178,TLSv1.2,3030,Application Data
1,1.903088999999909,62.210.85.178,10.0.2.15,TCP,60,9001  >  35978 [ACK] Seq=8258291 Ack=150797605 Win=65535 Len=0
1,1.903096000000005,62.210.85.178,10.0.2.15,TCP,60,9001  >  35978 [ACK] Seq=8258291 Ack=150799065 Win=65535 Len=0
1,1.9031009999998787,62.210.85.178,10.0.2.15,TCP,60,9001  >  35978 [ACK] Seq=8258291 Ack=150799121 Win=65535 Len=0
1,1.9092109999996865,10.0.2.15,62.210.85.178,TLSv1.2,4124,Application Data
1,1.909527999999682,10.0.2.15,62.210.85.178,TCP,2974,35978  >  9001 [ACK] Seq=150803191 Ack=8258291 Win=65535 Len=2920 [TCP segment of a reassembled PDU]
1,1.9095859999997629,62.210.85.178,10.0.2.15,TCP,60,9001  >  35978 [ACK] Seq=8258291 Ack=150800581 Win=65535 Len=0
1,1.9096049999998286,62.210.85.178,10.0.2.15,TCP,60,9001  >  35978 [ACK] Seq=8258291 Ack=150802041 Win=65535 Len=0
1,1.9096099999997023,62.210.85.178,10.0.2.15,TCP,60,9001  >  35978 [ACK] Seq=8258291 Ack=150803191 Win=65535 Len=0
1,1.9096159999999145,62.210.85.178,10.0.2.15,TCP,60,9001  >  35978 [ACK] Seq=8258291 Ack=150804651 Win=65535 Len=0
1,1.9096199999999044,62.210.85.178,10.0.2.15,TCP,60,9001  >  35978 [ACK] Seq=8258291 Ack=150806111 Win=65535 Len=0
1,1.909671999999773,10.0.2.15,62.210.85.178,TLSv1.2,1204,Application Data
1,1.9098049999997784,10.0.2.15,62.210.85.178,TCP,2974,35978  >  9001 [ACK] Seq=150807261 Ack=8258291 Win=65535 Len=2920 [TCP segment of a reassembled PDU]
1,1.9098329999997077,62.210.85.178,10.0.2.15,TCP,60,9001  >  35978 [ACK] Seq=8258291 Ack=150807261 Win=65535 Len=0
1,1.909881999999925,10.0.2.15,62.210.85.178,TLSv1.2,1204,Application Data
1,1.9099569999998494,10.0.2.15,62.210.85.178,TCP,2974,35978  >  9001 [ACK] Seq=150811331 Ack=8258291 Win=65535 Len=2920 [TCP segment of a reassembled PDU]
1,1.9100650000000314,10.0.2.15,62.210.85.178,TLSv1.2,4434,"Application Data, Application Data"
1,1.9104339999998956,62.210.85.178,10.0.2.15,TCP,60,9001  >  35978 [ACK] Seq=8258291 Ack=150808721 Win=65535 Len=0
1,1.9104669999996986,62.210.85.178,10.0.2.15,TCP,60,9001  >  35978 [ACK] Seq=8258291 Ack=150810181 Win=65535 Len=0
1,1.9104709999996885,62.210.85.178,10.0.2.15,TCP,60,9001  >  35978 [ACK] Seq=8258291 Ack=150811331 Win=65535 Len=0
1,1.910476000000017,62.210.85.178,10.0.2.15,TCP,60,9001  >  35978 [ACK] Seq=8258291 Ack=150812791 Win=65535 Len=0
1,1.9104800000000068,62.210.85.178,10.0.2.15,TCP,60,9001  >  35978 [ACK] Seq=8258291 Ack=150814251 Win=65535 Len=0
1,1.9104849999998805,62.210.85.178,10.0.2.15,TCP,60,9001  >  35978 [ACK] Seq=8258291 Ack=150815711 Win=65535 Len=0
1,1.9104889999998704,62.210.85.178,10.0.2.15,TCP,60,9001  >  35978 [ACK] Seq=8258291 Ack=150817171 Win=65535 Len=0
1,1.9104929999998603,62.210.85.178,10.0.2.15,TCP,60,9001  >  35978 [ACK] Seq=8258291 Ack=150818631 Win=65535 Len=0
1,1.910570000000007,10.0.2.15,62.210.85.178,TLSv1.2,5894,"Application Data, Application Data"
1,1.9106199999996534,10.0.2.15,62.210.85.178,TLSv1.2,2122,Application Data
1,1.9107789999998204,62.210.85.178,10.0.2.15,TCP,60,9001  >  35978 [ACK] Seq=8258291 Ack=150820091 Win=65535 Len=0
1,1.9107939999998962,62.210.85.178,10.0.2.15,TCP,60,9001  >  35978 [ACK] Seq=8258291 Ack=150821551 Win=65535 Len=0
1,1.910808999999972,62.210.85.178,10.0.2.15,TCP,60,9001  >  35978 [ACK] Seq=8258291 Ack=150823011 Win=65535 Len=0
1,1.910816000000068,62.210.85.178,10.0.2.15,TCP,60,9001  >  35978 [ACK] Seq=8258291 Ack=150824471 Win=65535 Len=0
1,1.9108229999997093,62.210.85.178,10.0.2.15,TCP,60,9001  >  35978 [ACK] Seq=8258291 Ack=150825931 Win=65535 Len=0
1,1.9108280000000377,62.210.85.178,10.0.2.15,TCP,60,9001  >  35978 [ACK] Seq=8258291 Ack=150826539 Win=65535 Len=0
1,1.9250389999997424,10.0.2.15,62.210.85.178,TLSv1.2,4124,Application Data
1,1.9252830000000358,62.210.85.178,10.0.2.15,TCP,60,9001  >  35978 [ACK] Seq=8258291 Ack=150827999 Win=65535 Len=0
1,1.9253319999997984,62.210.85.178,10.0.2.15,TCP,60,9001  >  35978 [ACK] Seq=8258291 Ack=150829459 Win=65535 Len=0
1,1.9253389999998944,62.210.85.178,10.0.2.15,TCP,60,9001  >  35978 [ACK] Seq=8258291 Ack=150830609 Win=65535 Len=0
1,1.92545599999994,10.0.2.15,62.210.85.178,TLSv1.2,4124,Application Data
1,1.9255519999996977,62.210.85.178,10.0.2.15,TCP,60,9001  >  35978 [ACK] Seq=8258291 Ack=150832069 Win=65535 Len=0
1,1.9255639999996674,62.210.85.178,10.0.2.15,TCP,60,9001  >  35978 [ACK] Seq=8258291 Ack=150833529 Win=65535 Len=0
1,1.9255699999998797,62.210.85.178,10.0.2.15,TCP,60,9001  >  35978 [ACK] Seq=8258291 Ack=150834679 Win=65535 Len=0
1,1.9256289999998444,10.0.2.15,62.210.85.178,TLSv1.2,4124,Application Data
1,1.9257149999998546,62.210.85.178,10.0.2.15,TCP,60,9001  >  35978 [ACK] Seq=8258291 Ack=150836139 Win=65535 Len=0
1,1.9257269999998243,62.210.85.178,10.0.2.15,TCP,60,9001  >  35978 [ACK] Seq=8258291 Ack=150837599 Win=65535 Len=0
1,1.925731999999698,62.210.85.178,10.0.2.15,TCP,60,9001  >  35978 [ACK] Seq=8258291 Ack=150838749 Win=65535 Len=0
1,1.925778999999693,10.0.2.15,62.210.85.178,TLSv1.2,4124,Application Data
1,1.9258719999997993,62.210.85.178,10.0.2.15,TCP,60,9001  >  35978 [ACK] Seq=8258291 Ack=150840209 Win=65535 Len=0
1,1.9258869999998751,62.210.85.178,10.0.2.15,TCP,60,9001  >  35978 [ACK] Seq=8258291 Ack=150841669 Win=65535 Len=0
1,1.9258959999997387,62.210.85.178,10.0.2.15,TCP,60,9001  >  35978 [ACK] Seq=8258291 Ack=150842819 Win=65535 Len=0
1,1.9260199999998804,10.0.2.15,62.210.85.178,TLSv1.2,332,Application Data
1,1.9261639999999716,10.0.2.15,62.210.85.178,TCP,2974,35978  >  9001 [ACK] Seq=150843097 Ack=8258291 Win=65535 Len=2920 [TCP segment of a reassembled PDU]
1,1.926216999999724,62.210.85.178,10.0.2.15,TCP,60,9001  >  35978 [ACK] Seq=8258291 Ack=150843097 Win=65535 Len=0
1,1.9262269999999262,62.210.85.178,10.0.2.15,TCP,60,9001  >  35978 [ACK] Seq=8258291 Ack=150844557 Win=65535 Len=0
1,1.9262319999997999,62.210.85.178,10.0.2.15,TCP,60,9001  >  35978 [ACK] Seq=8258291 Ack=150846017 Win=65535 Len=0
1,1.9262879999996585,10.0.2.15,62.210.85.178,TLSv1.2,948,Application Data
1,1.9263479999999618,62.210.85.178,10.0.2.15,TCP,60,9001  >  35978 [ACK] Seq=8258291 Ack=150846911 Win=65535 Len=0
1,1.926408999999694,10.0.2.15,62.210.85.178,TLSv1.2,396,Application Data
1,1.9265419999996993,62.210.85.178,10.0.2.15,TCP,60,9001  >  35978 [ACK] Seq=8258291 Ack=150847253 Win=65535 Len=0
1,1.986873999999716,54.93.77.70,10.0.2.15,TLSv1.2,590,Application Data
1,2.018869999999879,54.93.77.70,10.0.2.15,TLSv1.2,3674,Application Data
1,2.018978999999945,10.0.2.15,54.93.77.70,TCP,54,34692  >  9001 [ACK] Seq=8290125 Ack=150624871 Win=65535 Len=0
1,2.0296149999999216,54.93.77.70,10.0.2.15,TCP,1502,"9001  >  34692 [PSH, ACK] Seq=150624871 Ack=8290125 Win=65535 Len=1448 [TCP segment of a reassembled PDU]"
1,2.0297199999999975,10.0.2.15,54.93.77.70,TCP,54,34692  >  9001 [ACK] Seq=8290125 Ack=150626319 Win=65535 Len=0
1,2.038060999999743,54.93.77.70,10.0.2.15,TLSv1.2,684,Application Data
1,2.0508740000000216,54.93.77.70,10.0.2.15,TCP,2950,"9001  >  34692 [PSH, ACK] Seq=150626949 Ack=8290125 Win=65535 Len=2896 [TCP segment of a reassembled PDU]"
1,2.050987999999961,10.0.2.15,54.93.77.70,TCP,54,34692  >  9001 [ACK] Seq=8290125 Ack=150629845 Win=65535 Len=0
1,2.0553729999996904,54.93.77.70,10.0.2.15,TLSv1.2,778,Application Data
1,2.0616479999998774,54.93.77.70,10.0.2.15,TCP,1502,"9001  >  34692 [PSH, ACK] Seq=150630569 Ack=8290125 Win=65535 Len=1448 [TCP segment of a reassembled PDU]"
1,2.061997999999676,10.0.2.15,54.93.77.70,TCP,54,34692  >  9001 [ACK] Seq=8290125 Ack=150632017 Win=65535 Len=0
1,2.0745539999998073,54.93.77.70,10.0.2.15,TLSv1.2,1198,Application Data
1,2.118622999999843,10.0.2.15,54.93.77.70,TCP,54,34692  >  9001 [ACK] Seq=8290125 Ack=150633161 Win=65535 Len=0
1,2.141599000000042,54.93.77.70,10.0.2.15,TLSv1.2,3674,Application Data
1,2.1420939999998154,10.0.2.15,54.93.77.70,TCP,54,34692  >  9001 [ACK] Seq=8290125 Ack=150636781 Win=65535 Len=0
1,2.151480999999876,54.93.77.70,10.0.2.15,TCP,2950,"9001  >  34692 [PSH, ACK] Seq=150636781 Ack=8290125 Win=65535 Len=2896 [TCP segment of a reassembled PDU]"
1,2.151578999999856,10.0.2.15,54.93.77.70,TCP,54,34692  >  9001 [ACK] Seq=8290125 Ack=150639677 Win=65535 Len=0
1,2.158292999999958,54.93.77.70,10.0.2.15,TLSv1.2,778,Application Data
1,2.1585469999999987,10.0.2.15,54.93.77.70,TCP,54,34692  >  9001 [ACK] Seq=8290125 Ack=150640401 Win=65535 Len=0
1,2.1754040000000714,54.93.77.70,10.0.2.15,TLSv1.2,1104,Application Data
1,2.1755349999998543,10.0.2.15,54.93.77.70,TCP,54,34692  >  9001 [ACK] Seq=8290125 Ack=150641451 Win=65535 Len=0
1,2.1858109999998305,54.93.77.70,10.0.2.15,TCP,2950,"9001  >  34692 [PSH, ACK] Seq=150641451 Ack=8290125 Win=65535 Len=2896 [TCP segment of a reassembled PDU]"
1,2.185954000000038,10.0.2.15,54.93.77.70,TCP,54,34692  >  9001 [ACK] Seq=8290125 Ack=150644347 Win=65535 Len=0
1,2.186001000000033,54.93.77.70,10.0.2.15,TLSv1.2,2950,Application Data [TCP segment of a reassembled PDU]
1,2.1860489999999118,10.0.2.15,54.93.77.70,TCP,54,34692  >  9001 [ACK] Seq=8290125 Ack=150647243 Win=65535 Len=0
1,2.1860999999998967,54.93.77.70,10.0.2.15,TLSv1.2,1502,Application Data
1,2.186131999999816,10.0.2.15,54.93.77.70,TCP,54,34692  >  9001 [ACK] Seq=8290125 Ack=150648691 Win=65535 Len=0
1,2.1863839999996344,10.0.2.15,54.93.77.70,TLSv1.2,590,Application Data
1,2.1864519999999175,54.93.77.70,10.0.2.15,TCP,60,9001  >  34692 [ACK] Seq=150648691 Ack=8290661 Win=65535 Len=0
1,2.19619799999964,10.0.2.15,54.93.77.70,TLSv1.2,590,Application Data
1,2.196700999999848,54.93.77.70,10.0.2.15,TCP,60,9001  >  34692 [ACK] Seq=150648691 Ack=8291197 Win=65535 Len=0
1,2.1994909999998526,54.93.77.70,10.0.2.15,TCP,2950,"9001  >  34692 [PSH, ACK] Seq=150648691 Ack=8291197 Win=65535 Len=2896 [TCP segment of a reassembled PDU]"
1,2.200043999999707,10.0.2.15,54.93.77.70,TCP,54,34692  >  9001 [ACK] Seq=8291197 Ack=150651587 Win=65535 Len=0
1,2.203009999999722,54.93.77.70,10.0.2.15,TLSv1.2,2950,Application Data [TCP segment of a reassembled PDU]
1,2.2030509999999595,54.93.77.70,10.0.2.15,TLSv1.2,2016,Application Data
1,2.203109999999924,10.0.2.15,54.93.77.70,TCP,54,34692  >  9001 [ACK] Seq=8291197 Ack=150654483 Win=65535 Len=0
1,2.203230000000076,10.0.2.15,54.93.77.70,TCP,54,34692  >  9001 [ACK] Seq=8291197 Ack=150656445 Win=65535 Len=0
1,2.206314999999904,54.93.77.70,10.0.2.15,TCP,1502,"9001  >  34692 [PSH, ACK] Seq=150656445 Ack=8291197 Win=65535 Len=1448 [TCP segment of a reassembled PDU]"
1,2.2064289999998437,10.0.2.15,54.93.77.70,TCP,54,34692  >  9001 [ACK] Seq=8291197 Ack=150657893 Win=65535 Len=0
1,2.2151019999996606,54.93.77.70,10.0.2.15,TLSv1.2,2950,Application Data [TCP segment of a reassembled PDU]
1,2.2152189999997063,10.0.2.15,54.93.77.70,TCP,54,34692  >  9001 [ACK] Seq=8291197 Ack=150660789 Win=65535 Len=0
1,2.220307999999932,54.93.77.70,10.0.2.15,TLSv1.2,1408,Application Data
1,2.228298999999879,54.93.77.70,10.0.2.15,TCP,2950,"9001  >  34692 [PSH, ACK] Seq=150662143 Ack=8291197 Win=65535 Len=2896 [TCP segment of a reassembled PDU]"
1,2.228494999999839,10.0.2.15,54.93.77.70,TCP,54,34692  >  9001 [ACK] Seq=8291197 Ack=150665039 Win=65535 Len=0
1,2.236591999999746,54.93.77.70,10.0.2.15,TLSv1.2,264,Application Data
1,2.242819000000054,54.93.77.70,10.0.2.15,TCP,2950,"9001  >  34692 [PSH, ACK] Seq=150665249 Ack=8291197 Win=65535 Len=2896 [TCP segment of a reassembled PDU]"
1,2.243062000000009,10.0.2.15,54.93.77.70,TCP,54,34692  >  9001 [ACK] Seq=8291197 Ack=150668145 Win=65535 Len=0
1,2.2509079999999813,54.93.77.70,10.0.2.15,TLSv1.2,2950,Application Data [TCP segment of a reassembled PDU]
1,2.251014999999825,10.0.2.15,54.93.77.70,TCP,54,34692  >  9001 [ACK] Seq=8291197 Ack=150671041 Win=65535 Len=0
1,2.251499999999851,54.93.77.70,10.0.2.15,TLSv1.2,4398,Application Data [TCP segment of a reassembled PDU]
1,2.2515739999998914,10.0.2.15,54.93.77.70,TCP,54,34692  >  9001 [ACK] Seq=8291197 Ack=150675385 Win=65535 Len=0
1,2.2517469999997957,10.0.2.15,54.93.77.70,TLSv1.2,590,Application Data
1,2.2518599999998514,54.93.77.70,10.0.2.15,TCP,60,9001  >  34692 [ACK] Seq=150675385 Ack=8291733 Win=65535 Len=0
1,2.254399999999805,54.93.77.70,10.0.2.15,TLSv1.2,1292,Application Data
1,2.266639999999825,54.93.77.70,10.0.2.15,TLSv1.2,2950,Application Data
1,2.266736000000037,54.93.77.70,10.0.2.15,TLSv1.2,4398,Application Data [TCP segment of a reassembled PDU]
1,2.2668799999996736,10.0.2.15,54.93.77.70,TCP,54,34692  >  9001 [ACK] Seq=8291733 Ack=150679519 Win=65535 Len=0
1,2.2672059999999874,10.0.2.15,54.93.77.70,TCP,54,34692  >  9001 [ACK] Seq=8291733 Ack=150683863 Win=65535 Len=0
1,2.2786379999997735,54.93.77.70,10.0.2.15,TLSv1.2,2950,Application Data [TCP segment of a reassembled PDU]
1,2.278870999999981,54.93.77.70,10.0.2.15,TLSv1.2,5846,Application Data [TCP segment of a reassembled PDU]
1,2.2789809999999306,10.0.2.15,54.93.77.70,TCP,54,34692  >  9001 [ACK] Seq=8291733 Ack=150686759 Win=65535 Len=0
1,2.2792319999998654,10.0.2.15,54.93.77.70,TCP,54,34692  >  9001 [ACK] Seq=8291733 Ack=150692551 Win=65535 Len=0
1,2.2845539999998437,54.93.77.70,10.0.2.15,TLSv1.2,170,Application Data
1,2.2976599999997234,62.210.85.178,10.0.2.15,TLSv1.2,590,Application Data
1,2.3164409999999407,54.93.77.70,10.0.2.15,TCP,2950,"9001  >  34692 [PSH, ACK] Seq=150692667 Ack=8291733 Win=65535 Len=2896 [TCP segment of a reassembled PDU]"
1,2.316530999999941,10.0.2.15,54.93.77.70,TCP,54,34692  >  9001 [ACK] Seq=8291733 Ack=150695563 Win=65535 Len=0
1,2.3326139999999214,54.93.77.70,10.0.2.15,TLSv1.2,1314,"Application Data, Application Data"
1,2.3329140000000734,10.0.2.15,54.93.77.70,TLSv1.2,590,Application Data
1,2.333024999999907,54.93.77.70,10.0.2.15,TCP,60,9001  >  34692 [ACK] Seq=150696823 Ack=8292269 Win=65535 Len=0
1,2.338545999999951,10.0.2.15,62.210.85.178,TCP,54,35978  >  9001 [ACK] Seq=150847253 Ack=8258827 Win=65535 Len=0
1,2.342830999999933,10.0.2.15,54.93.77.70,TLSv1.2,590,Application Data
1,2.344260999999733,54.93.77.70,10.0.2.15,TCP,60,9001  >  34692 [ACK] Seq=150696823 Ack=8292805 Win=65535 Len=0
1,2.355091999999786,62.210.85.178,10.0.2.15,TLSv1.2,1104,Application Data
1,2.355217999999695,10.0.2.15,62.210.85.178,TCP,54,35978  >  9001 [ACK] Seq=150847253 Ack=8259877 Win=65535 Len=0
1,2.6837249999998676,62.210.85.178,10.0.2.15,TLSv1.2,1104,Application Data
1,2.683831999999711,10.0.2.15,62.210.85.178,TCP,54,35978  >  9001 [ACK] Seq=150847253 Ack=8260927 Win=65535 Len=0
1,2.684171999999762,10.0.2.15,62.210.85.178,TLSv1.2,590,Application Data
1,2.684758999999758,62.210.85.178,10.0.2.15,TCP,60,9001  >  35978 [ACK] Seq=8260927 Ack=150847789 Win=65535 Len=0
1,2.8882119999998395,54.93.77.70,10.0.2.15,TLSv1.2,590,Application Data
1,2.888832999999977,10.0.2.15,54.93.77.70,TLSv1.2,590,Application Data
1,2.8891969999999674,54.93.77.70,10.0.2.15,TCP,60,9001  >  34692 [ACK] Seq=150697359 Ack=8293341 Win=65535 Len=0
1,3.0052499999997053,62.210.85.178,10.0.2.15,TLSv1.2,590,Application Data
1,3.0153669999999693,10.0.2.15,62.210.85.178,TLSv1.2,590,Application Data
1,3.0155909999998585,62.210.85.178,10.0.2.15,TCP,60,9001  >  35978 [ACK] Seq=8261463 Ack=150848325 Win=65535 Len=0
1,3.0271349999998165,10.0.2.15,62.210.85.178,TLSv1.2,4124,Application Data
1,3.0272829999998976,10.0.2.15,62.210.85.178,TCP,2974,35978  >  9001 [ACK] Seq=150852395 Ack=8261463 Win=65535 Len=2920 [TCP segment of a reassembled PDU]
1,3.02733599999965,62.210.85.178,10.0.2.15,TCP,60,9001  >  35978 [ACK] Seq=8261463 Ack=150849785 Win=65535 Len=0
1,3.0273480000000745,62.210.85.178,10.0.2.15,TCP,60,9001  >  35978 [ACK] Seq=8261463 Ack=150851245 Win=65535 Len=0
1,3.0273529999999482,62.210.85.178,10.0.2.15,TCP,60,9001  >  35978 [ACK] Seq=8261463 Ack=150852395 Win=65535 Len=0
1,3.027356999999938,62.210.85.178,10.0.2.15,TCP,60,9001  >  35978 [ACK] Seq=8261463 Ack=150853855 Win=65535 Len=0
1,3.027361999999812,62.210.85.178,10.0.2.15,TCP,60,9001  >  35978 [ACK] Seq=8261463 Ack=150855315 Win=65535 Len=0
1,3.027411999999913,10.0.2.15,62.210.85.178,TLSv1.2,1204,Application Data
1,3.027454999999918,62.210.85.178,10.0.2.15,TCP,60,9001  >  35978 [ACK] Seq=8261463 Ack=150856465 Win=65535 Len=0
1,3.0275109999997767,10.0.2.15,62.210.85.178,TLSv1.2,4124,Application Data
1,3.027588999999807,10.0.2.15,62.210.85.178,TCP,2974,35978  >  9001 [ACK] Seq=150860535 Ack=8261463 Win=65535 Len=2920 [TCP segment of a reassembled PDU]
1,3.027697999999873,62.210.85.178,10.0.2.15,TCP,60,9001  >  35978 [ACK] Seq=8261463 Ack=150857925 Win=65535 Len=0
1,3.0277509999996255,62.210.85.178,10.0.2.15,TCP,60,9001  >  35978 [ACK] Seq=8261463 Ack=150859385 Win=65535 Len=0
1,3.0277659999997013,62.210.85.178,10.0.2.15,TCP,60,9001  >  35978 [ACK] Seq=8261463 Ack=150860535 Win=65535 Len=0
1,3.0277729999997973,62.210.85.178,10.0.2.15,TCP,60,9001  >  35978 [ACK] Seq=8261463 Ack=150861995 Win=65535 Len=0
1,3.027777999999671,62.210.85.178,10.0.2.15,TCP,60,9001  >  35978 [ACK] Seq=8261463 Ack=150863455 Win=65535 Len=0
1,3.0278659999999036,10.0.2.15,62.210.85.178,TLSv1.2,1204,Application Data
1,3.028256000000056,10.0.2.15,62.210.85.178,TLSv1.2,2974,Application Data
1,3.028495000000021,62.210.85.178,10.0.2.15,TCP,60,9001  >  35978 [ACK] Seq=8261463 Ack=150864605 Win=65535 Len=0
1,3.028556999999637,62.210.85.178,10.0.2.15,TCP,60,9001  >  35978 [ACK] Seq=8261463 Ack=150866065 Win=65535 Len=0
1,3.028563999999733,62.210.85.178,10.0.2.15,TCP,60,9001  >  35978 [ACK] Seq=8261463 Ack=150867525 Win=65535 Len=0
1,3.0286439999999857,10.0.2.15,62.210.85.178,TLSv1.2,1226,Application Data
1,3.028758999999809,62.210.85.178,10.0.2.15,TCP,60,9001  >  35978 [ACK] Seq=8261463 Ack=150868697 Win=65535 Len=0
1,3.0291079999997237,10.0.2.15,62.210.85.178,TLSv1.2,910,Application Data
1,3.0292239999998856,62.210.85.178,10.0.2.15,TCP,60,9001  >  35978 [ACK] Seq=8261463 Ack=150869553 Win=65535 Len=0
1,3.133527999999842,54.93.77.70,10.0.2.15,TLSv1.2,590,Application Data
1,3.1482969999997295,54.93.77.70,10.0.2.15,TCP,2950,"9001  >  34692 [PSH, ACK] Seq=150697895 Ack=8293341 Win=65535 Len=2896 [TCP segment of a reassembled PDU]"
1,3.1484780000000683,10.0.2.15,54.93.77.70,TCP,54,34692  >  9001 [ACK] Seq=8293341 Ack=150700791 Win=65535 Len=0
1,3.158770999999888,54.93.77.70,10.0.2.15,TLSv1.2,1502,Application Data [TCP segment of a reassembled PDU]
1,3.158907999999883,10.0.2.15,54.93.77.70,TCP,54,34692  >  9001 [ACK] Seq=8293341 Ack=150702239 Win=65535 Len=0
1,3.162597000000005,54.93.77.70,10.0.2.15,TCP,2950,"9001  >  34692 [PSH, ACK] Seq=150702239 Ack=8293341 Win=65535 Len=2896 [TCP segment of a reassembled PDU]"
1,3.162818999999672,10.0.2.15,54.93.77.70,TCP,54,34692  >  9001 [ACK] Seq=8293341 Ack=150705135 Win=65535 Len=0
1,3.1828609999997752,54.93.77.70,10.0.2.15,TLSv1.2,590,"Application Data, Application Data"
1,3.1941139999998995,54.93.77.70,10.0.2.15,TCP,2950,"9001  >  34692 [PSH, ACK] Seq=150705671 Ack=8293341 Win=65535 Len=2896 [TCP segment of a reassembled PDU]"
1,3.194227999999839,10.0.2.15,54.93.77.70,TCP,54,34692  >  9001 [ACK] Seq=8293341 Ack=150708567 Win=65535 Len=0
1,3.252501999999822,54.93.77.70,10.0.2.15,TLSv1.2,1314,"Application Data, Application Data"
1,3.282126999999946,54.93.77.70,10.0.2.15,TCP,2950,"9001  >  34692 [PSH, ACK] Seq=150709827 Ack=8293341 Win=65535 Len=2896 [TCP segment of a reassembled PDU]"
1,3.282314000000042,10.0.2.15,54.93.77.70,TCP,54,34692  >  9001 [ACK] Seq=8293341 Ack=150712723 Win=65535 Len=0
1,3.2861809999999423,54.93.77.70,10.0.2.15,TLSv1.2,4398,"Application Data, Application Data"
1,3.2863099999999577,10.0.2.15,54.93.77.70,TCP,54,34692  >  9001 [ACK] Seq=8293341 Ack=150717067 Win=65535 Len=0
1,3.3181399999998575,54.93.77.70,10.0.2.15,TLSv1.2,1104,Application Data
1,3.3622059999997873,10.0.2.15,54.93.77.70,TCP,54,34692  >  9001 [ACK] Seq=8293341 Ack=150718117 Win=65535 Len=0
1,3.3881059999998797,54.93.77.70,10.0.2.15,TLSv1.2,1104,Application Data
1,3.3882079999998496,10.0.2.15,54.93.77.70,TCP,54,34692  >  9001 [ACK] Seq=8293341 Ack=150719167 Win=65535 Len=0
1,3.392573999999968,10.0.2.15,54.93.77.70,TLSv1.2,590,Application Data
1,3.3927599999997256,54.93.77.70,10.0.2.15,TCP,60,9001  >  34692 [ACK] Seq=150719167 Ack=8293877 Win=65535 Len=0
1,3.505319999999756,62.210.85.178,10.0.2.15,TLSv1.2,590,Application Data
1,3.506003999999848,10.0.2.15,62.210.85.178,TLSv1.2,590,Application Data
1,3.5062849999999344,62.210.85.178,10.0.2.15,TCP,60,9001  >  35978 [ACK] Seq=8261999 Ack=150870089 Win=65535 Len=0
1,3.603098999999929,54.93.77.70,10.0.2.15,TLSv1.2,590,Application Data
1,3.60363899999993,10.0.2.15,54.93.77.70,TLSv1.2,590,Application Data
1,3.603744000000006,54.93.77.70,10.0.2.15,TCP,60,9001  >  34692 [ACK] Seq=150719703 Ack=8294413 Win=65535 Len=0
1,3.8089569999997366,62.210.85.178,10.0.2.15,TLSv1.2,590,Application Data
1,3.8126680000000306,10.0.2.15,62.210.85.178,TLSv1.2,590,Application Data
1,3.8128509999996822,62.210.85.178,10.0.2.15,TCP,60,9001  >  35978 [ACK] Seq=8262535 Ack=150870625 Win=65535 Len=0
1,3.822654000000057,10.0.2.15,62.210.85.178,TLSv1.2,4124,Application Data
1,3.822827999999845,10.0.2.15,62.210.85.178,TCP,2974,35978  >  9001 [ACK] Seq=150874695 Ack=8262535 Win=65535 Len=2920 [TCP segment of a reassembled PDU]
1,3.8229369999999108,62.210.85.178,10.0.2.15,TCP,60,9001  >  35978 [ACK] Seq=8262535 Ack=150872085 Win=65535 Len=0
1,3.822958999999628,62.210.85.178,10.0.2.15,TCP,60,9001  >  35978 [ACK] Seq=8262535 Ack=150873545 Win=65535 Len=0
1,3.8229639999999563,62.210.85.178,10.0.2.15,TCP,60,9001  >  35978 [ACK] Seq=8262535 Ack=150874695 Win=65535 Len=0
1,3.82296899999983,62.210.85.178,10.0.2.15,TCP,60,9001  >  35978 [ACK] Seq=8262535 Ack=150876155 Win=65535 Len=0
1,3.82297299999982,62.210.85.178,10.0.2.15,TCP,60,9001  >  35978 [ACK] Seq=8262535 Ack=150877615 Win=65535 Len=0
1,3.8230469999998604,10.0.2.15,62.210.85.178,TLSv1.2,1204,Application Data
1,3.8232239999997546,10.0.2.15,62.210.85.178,TCP,2974,35978  >  9001 [ACK] Seq=150878765 Ack=8262535 Win=65535 Len=2920 [TCP segment of a reassembled PDU]
1,3.823297999999795,62.210.85.178,10.0.2.15,TCP,60,9001  >  35978 [ACK] Seq=8262535 Ack=150878765 Win=65535 Len=0
1,3.823312999999871,62.210.85.178,10.0.2.15,TCP,60,9001  >  35978 [ACK] Seq=8262535 Ack=150880225 Win=65535 Len=0
1,3.8233189999996284,62.210.85.178,10.0.2.15,TCP,60,9001  >  35978 [ACK] Seq=8262535 Ack=150881685 Win=65535 Len=0
1,3.823367999999846,10.0.2.15,62.210.85.178,TLSv1.2,1204,Application Data
1,3.8234800000000178,62.210.85.178,10.0.2.15,TCP,60,9001  >  35978 [ACK] Seq=8262535 Ack=150882835 Win=65535 Len=0
1,3.8235209999998006,10.0.2.15,62.210.85.178,TCP,1514,35978  >  9001 [ACK] Seq=150882835 Ack=8262535 Win=65535 Len=1460 [TCP segment of a reassembled PDU]
1,3.8237639999997555,62.210.85.178,10.0.2.15,TCP,60,9001  >  35978 [ACK] Seq=8262535 Ack=150884295 Win=65535 Len=0
1,3.8238189999997303,10.0.2.15,62.210.85.178,TLSv1.2,350,Application Data
1,3.82412099999965,62.210.85.178,10.0.2.15,TCP,60,9001  >  35978 [ACK] Seq=8262535 Ack=150884591 Win=65535 Len=0
1,3.911816999999701,54.93.77.70,10.0.2.15,TLSv1.2,590,Application Data
1,3.9254729999997835,54.93.77.70,10.0.2.15,TCP,2950,"9001  >  34692 [PSH, ACK] Seq=150720239 Ack=8294413 Win=65535 Len=2896 [TCP segment of a reassembled PDU]"
1,3.9258169999998245,10.0.2.15,54.93.77.70,TCP,54,34692  >  9001 [ACK] Seq=8294413 Ack=150723135 Win=65535 Len=0
1,3.9260810000000674,54.93.77.70,10.0.2.15,TLSv1.2,4398,"Application Data, Application Data"
1,3.9261469999996734,10.0.2.15,54.93.77.70,TCP,54,34692  >  9001 [ACK] Seq=8294413 Ack=150727479 Win=65535 Len=0
1,3.94609999999966,54.93.77.70,10.0.2.15,TLSv1.2,4398,Application Data
1,3.946269999999913,10.0.2.15,54.93.77.70,TCP,54,34692  >  9001 [ACK] Seq=8294413 Ack=150731823 Win=65535 Len=0
1,3.9475549999997384,54.93.77.70,10.0.2.15,TLSv1.2,2436,Application Data
1,3.948091999999633,10.0.2.15,54.93.77.70,TCP,54,34692  >  9001 [ACK] Seq=8294413 Ack=150734205 Win=65535 Len=0
1,3.9523269999999684,10.0.2.15,54.93.77.70,TLSv1.2,590,Application Data
1,3.9525289999996858,54.93.77.70,10.0.2.15,TCP,60,9001  >  34692 [ACK] Seq=150734205 Ack=8294949 Win=65535 Len=0
1,4.629039999999804,62.210.85.178,10.0.2.15,TLSv1.2,590,Application Data
1,4.629404999999679,10.0.2.15,62.210.85.178,TLSv1.2,590,Application Data
1,4.629942999999912,62.210.85.178,10.0.2.15,TCP,60,9001  >  35978 [ACK] Seq=8263071 Ack=150885127 Win=65535 Len=0
1,4.725010999999995,54.93.77.70,10.0.2.15,TLSv1.2,590,Application Data
1,4.7261969999999565,10.0.2.15,54.93.77.70,TLSv1.2,590,Application Data
1,4.726897000000008,54.93.77.70,10.0.2.15,TCP,60,9001  >  34692 [ACK] Seq=150734741 Ack=8295485 Win=65535 Len=0
1,4.831593999999768,62.210.85.178,10.0.2.15,TLSv1.2,590,Application Data
1,4.843735999999808,10.0.2.15,62.210.85.178,TLSv1.2,590,Application Data
1,4.844368000000031,62.210.85.178,10.0.2.15,TCP,60,9001  >  35978 [ACK] Seq=8263607 Ack=150885663 Win=65535 Len=0
1,4.858839999999873,10.0.2.15,62.210.85.178,TLSv1.2,4124,Application Data
1,4.859044999999696,10.0.2.15,62.210.85.178,TCP,2974,35978  >  9001 [ACK] Seq=150889733 Ack=8263607 Win=65535 Len=2920 [TCP segment of a reassembled PDU]
1,4.859105,62.210.85.178,10.0.2.15,TCP,60,9001  >  35978 [ACK] Seq=8263607 Ack=150887123 Win=65535 Len=0
1,4.859121999999843,62.210.85.178,10.0.2.15,TCP,60,9001  >  35978 [ACK] Seq=8263607 Ack=150888583 Win=65535 Len=0
1,4.859126999999717,62.210.85.178,10.0.2.15,TCP,60,9001  >  35978 [ACK] Seq=8263607 Ack=150889733 Win=65535 Len=0
1,4.859218000000055,10.0.2.15,62.210.85.178,TLSv1.2,1204,Application Data
1,4.859247999999752,62.210.85.178,10.0.2.15,TCP,60,9001  >  35978 [ACK] Seq=8263607 Ack=150891193 Win=65535 Len=0
1,4.859255999999732,62.210.85.178,10.0.2.15,TCP,60,9001  >  35978 [ACK] Seq=8263607 Ack=150892653 Win=65535 Len=0
1,4.8593299999997726,10.0.2.15,62.210.85.178,TCP,2974,35978  >  9001 [ACK] Seq=150893803 Ack=8263607 Win=65535 Len=2920 [TCP segment of a reassembled PDU]
1,4.859381999999641,62.210.85.178,10.0.2.15,TCP,60,9001  >  35978 [ACK] Seq=8263607 Ack=150893803 Win=65535 Len=0
1,4.859390000000076,62.210.85.178,10.0.2.15,TCP,60,9001  >  35978 [ACK] Seq=8263607 Ack=150895263 Win=65535 Len=0
1,4.8593949999999495,62.210.85.178,10.0.2.15,TCP,60,9001  >  35978 [ACK] Seq=8263607 Ack=150896723 Win=65535 Len=0
1,4.859439999999722,10.0.2.15,62.210.85.178,TLSv1.2,1204,Application Data
1,4.859488000000056,62.210.85.178,10.0.2.15,TCP,60,9001  >  35978 [ACK] Seq=8263607 Ack=150897873 Win=65535 Len=0
1,4.859556999999768,10.0.2.15,62.210.85.178,TLSv1.2,4124,Application Data
1,4.859688999999889,62.210.85.178,10.0.2.15,TCP,60,9001  >  35978 [ACK] Seq=8263607 Ack=150899333 Win=65535 Len=0
1,4.859700999999859,62.210.85.178,10.0.2.15,TCP,60,9001  >  35978 [ACK] Seq=8263607 Ack=150900793 Win=65535 Len=0
1,4.859708999999839,62.210.85.178,10.0.2.15,TCP,60,9001  >  35978 [ACK] Seq=8263607 Ack=150901943 Win=65535 Len=0
1,4.85975899999994,10.0.2.15,62.210.85.178,TLSv1.2,332,Application Data
1,4.859875999999986,62.210.85.178,10.0.2.15,TCP,60,9001  >  35978 [ACK] Seq=8263607 Ack=150902221 Win=65535 Len=0
1,4.859973999999966,10.0.2.15,62.210.85.178,TLSv1.2,3868,Application Data
1,4.860051999999996,10.0.2.15,62.210.85.178,TCP,2974,35978  >  9001 [ACK] Seq=150906035 Ack=8263607 Win=65535 Len=2920 [TCP segment of a reassembled PDU]
1,4.860119999999824,10.0.2.15,62.210.85.178,TLSv1.2,2974,Application Data [TCP segment of a reassembled PDU]
1,4.860276999999769,62.210.85.178,10.0.2.15,TCP,60,9001  >  35978 [ACK] Seq=8263607 Ack=150903681 Win=65535 Len=0
1,4.860290999999961,62.210.85.178,10.0.2.15,TCP,60,9001  >  35978 [ACK] Seq=8263607 Ack=150905141 Win=65535 Len=0
1,4.860295999999835,62.210.85.178,10.0.2.15,TCP,60,9001  >  35978 [ACK] Seq=8263607 Ack=150906035 Win=65535 Len=0
1,4.860300999999708,62.210.85.178,10.0.2.15,TCP,60,9001  >  35978 [ACK] Seq=8263607 Ack=150907495 Win=65535 Len=0
1,4.860304999999698,62.210.85.178,10.0.2.15,TCP,60,9001  >  35978 [ACK] Seq=8263607 Ack=150908955 Win=65535 Len=0
1,4.860310000000027,62.210.85.178,10.0.2.15,TCP,60,9001  >  35978 [ACK] Seq=8263607 Ack=150910415 Win=65535 Len=0
1,4.860314000000017,62.210.85.178,10.0.2.15,TCP,60,9001  >  35978 [ACK] Seq=8263607 Ack=150911875 Win=65535 Len=0
1,4.860362999999779,10.0.2.15,62.210.85.178,TLSv1.2,1260,Application Data
1,4.860651999999845,62.210.85.178,10.0.2.15,TCP,60,9001  >  35978 [ACK] Seq=8263607 Ack=150913081 Win=65535 Len=0
1,4.8694000000000415,10.0.2.15,62.210.85.178,TLSv1.2,4124,Application Data
1,4.8695339999999305,62.210.85.178,10.0.2.15,TCP,60,9001  >  35978 [ACK] Seq=8263607 Ack=150914541 Win=65535 Len=0
1,4.869556999999986,62.210.85.178,10.0.2.15,TCP,60,9001  >  35978 [ACK] Seq=8263607 Ack=150916001 Win=65535 Len=0
1,4.869562999999744,62.210.85.178,10.0.2.15,TCP,60,9001  >  35978 [ACK] Seq=8263607 Ack=150917151 Win=65535 Len=0
1,4.869642999999996,10.0.2.15,62.210.85.178,TLSv1.2,3738,Application Data
1,4.869694999999865,62.210.85.178,10.0.2.15,TCP,60,9001  >  35978 [ACK] Seq=8263607 Ack=150918611 Win=65535 Len=0
1,4.869701999999961,62.210.85.178,10.0.2.15,TCP,60,9001  >  35978 [ACK] Seq=8263607 Ack=150920071 Win=65535 Len=0
1,4.869706999999835,62.210.85.178,10.0.2.15,TCP,60,9001  >  35978 [ACK] Seq=8263607 Ack=150920835 Win=65535 Len=0
1,4.953254999999899,54.93.77.70,10.0.2.15,TLSv1.2,590,Application Data
1,4.977386999999908,54.93.77.70,10.0.2.15,TCP,2950,"9001  >  34692 [PSH, ACK] Seq=150735277 Ack=8295485 Win=65535 Len=2896 [TCP segment of a reassembled PDU]"
1,4.977973999999904,10.0.2.15,54.93.77.70,TCP,54,34692  >  9001 [ACK] Seq=8295485 Ack=150738173 Win=65535 Len=0
1,4.9953160000000025,54.93.77.70,10.0.2.15,TLSv1.2,4398,"Application Data, Application Data"
1,4.9955989999998565,10.0.2.15,54.93.77.70,TCP,54,34692  >  9001 [ACK] Seq=8295485 Ack=150742517 Win=65535 Len=0
1,5.0033449999996265,54.93.77.70,10.0.2.15,TLSv1.2,3674,Application Data
1,5.003449999999702,10.0.2.15,54.93.77.70,TCP,54,34692  >  9001 [ACK] Seq=8295485 Ack=150746137 Win=65535 Len=0
1,5.022523999999976,54.93.77.70,10.0.2.15,TLSv1.2,1104,Application Data
1,5.022579999999834,54.93.77.70,10.0.2.15,TLSv1.2,7294,Application Data
1,5.0227609999997185,10.0.2.15,54.93.77.70,TCP,54,34692  >  9001 [ACK] Seq=8295485 Ack=150754427 Win=65535 Len=0
1,5.023402999999689,10.0.2.15,54.93.77.70,TLSv1.2,590,Application Data
1,5.023569999999836,54.93.77.70,10.0.2.15,TCP,60,9001  >  34692 [ACK] Seq=150754427 Ack=8296021 Win=65535 Len=0
1,5.0309729999999035,54.93.77.70,10.0.2.15,TLSv1.2,2950,Application Data [TCP segment of a reassembled PDU]
1,5.031078999999863,54.93.77.70,10.0.2.15,TLSv1.2,5846,"Application Data, Application Data"
1,5.031130999999732,54.93.77.70,10.0.2.15,TCP,1502,"9001  >  34692 [PSH, ACK] Seq=150763115 Ack=8296021 Win=65535 Len=1448 [TCP segment of a reassembled PDU]"
1,5.0312959999996565,10.0.2.15,54.93.77.70,TCP,54,34692  >  9001 [ACK] Seq=8296021 Ack=150757323 Win=65535 Len=0
1,5.031406999999945,10.0.2.15,54.93.77.70,TCP,54,34692  >  9001 [ACK] Seq=8296021 Ack=150764563 Win=65535 Len=0
1,5.035441999999875,10.0.2.15,54.93.77.70,TLSv1.2,590,Application Data
1,5.035660000000007,54.93.77.70,10.0.2.15,TCP,60,9001  >  34692 [ACK] Seq=150764563 Ack=8296557 Win=65535 Len=0
1,5.051666999999725,54.93.77.70,10.0.2.15,TLSv1.2,2320,Application Data
1,5.051813000000038,10.0.2.15,54.93.77.70,TCP,54,34692  >  9001 [ACK] Seq=8296557 Ack=150766829 Win=65535 Len=0
1,5.058477000000039,54.93.77.70,10.0.2.15,TCP,1502,"9001  >  34692 [PSH, ACK] Seq=150766829 Ack=8296557 Win=65535 Len=1448 [TCP segment of a reassembled PDU]"
1,5.058798999999908,10.0.2.15,54.93.77.70,TCP,54,34692  >  9001 [ACK] Seq=8296557 Ack=150768277 Win=65535 Len=0
1,5.073128999999881,54.93.77.70,10.0.2.15,TLSv1.2,1198,Application Data
1,5.1012369999998555,54.93.77.70,10.0.2.15,TLSv1.2,1104,Application Data
1,5.101329999999962,10.0.2.15,54.93.77.70,TCP,54,34692  >  9001 [ACK] Seq=8296557 Ack=150770471 Win=65535 Len=0
1,5.104855999999927,10.0.2.15,54.93.77.70,TLSv1.2,590,Application Data
1,5.105047000000013,54.93.77.70,10.0.2.15,TCP,60,9001  >  34692 [ACK] Seq=150770471 Ack=8297093 Win=65535 Len=0
1,5.135038999999779,62.210.85.178,10.0.2.15,TLSv1.2,590,Application Data
1,5.178627999999662,10.0.2.15,62.210.85.178,TCP,54,35978  >  9001 [ACK] Seq=150920835 Ack=8264143 Win=65535 Len=0
1,5.220798999999715,62.210.85.178,10.0.2.15,TLSv1.2,590,Application Data
1,5.220898999999918,10.0.2.15,62.210.85.178,TCP,54,35978  >  9001 [ACK] Seq=150920835 Ack=8264679 Win=65535 Len=0
1,5.281050999999934,62.210.85.178,10.0.2.15,TLSv1.2,590,Application Data
1,5.281363000000056,10.0.2.15,62.210.85.178,TCP,54,35978  >  9001 [ACK] Seq=150920835 Ack=8265215 Win=65535 Len=0
1,5.2819979999999305,10.0.2.15,62.210.85.178,TLSv1.2,590,Application Data
1,5.283343999999943,62.210.85.178,10.0.2.15,TCP,60,9001  >  35978 [ACK] Seq=8265215 Ack=150921371 Win=65535 Len=0
1,5.503922999999759,54.93.77.70,10.0.2.15,TLSv1.2,590,Application Data
1,5.504539999999906,10.0.2.15,54.93.77.70,TLSv1.2,590,Application Data
1,5.504668999999922,54.93.77.70,10.0.2.15,TCP,60,9001  >  34692 [ACK] Seq=150771007 Ack=8297629 Win=65535 Len=0
1,5.754553999999644,62.210.85.178,10.0.2.15,TLSv1.2,590,Application Data
1,5.759526999999707,10.0.2.15,62.210.85.178,TLSv1.2,590,Application Data
1,5.761180999999851,62.210.85.178,10.0.2.15,TCP,60,9001  >  35978 [ACK] Seq=8265751 Ack=150921907 Win=65535 Len=0
1,5.775388000000021,10.0.2.15,62.210.85.178,TLSv1.2,4124,Application Data
1,5.775858999999855,62.210.85.178,10.0.2.15,TCP,60,9001  >  35978 [ACK] Seq=8265751 Ack=150923367 Win=65535 Len=0
1,5.775903999999628,62.210.85.178,10.0.2.15,TCP,60,9001  >  35978 [ACK] Seq=8265751 Ack=150924827 Win=65535 Len=0
1,5.775908000000072,62.210.85.178,10.0.2.15,TCP,60,9001  >  35978 [ACK] Seq=8265751 Ack=150925977 Win=65535 Len=0
1,5.775993999999628,10.0.2.15,62.210.85.178,TLSv1.2,4124,Application Data
1,5.776072999999997,10.0.2.15,62.210.85.178,TCP,2974,35978  >  9001 [ACK] Seq=150930047 Ack=8265751 Win=65535 Len=2920 [TCP segment of a reassembled PDU]
1,5.776143000000047,62.210.85.178,10.0.2.15,TCP,60,9001  >  35978 [ACK] Seq=8265751 Ack=150927437 Win=65535 Len=0
1,5.7761539999996785,62.210.85.178,10.0.2.15,TCP,60,9001  >  35978 [ACK] Seq=8265751 Ack=150928897 Win=65535 Len=0
1,5.776159999999891,62.210.85.178,10.0.2.15,TCP,60,9001  >  35978 [ACK] Seq=8265751 Ack=150930047 Win=65535 Len=0
1,5.776162999999997,62.210.85.178,10.0.2.15,TCP,60,9001  >  35978 [ACK] Seq=8265751 Ack=150931507 Win=65535 Len=0
1,5.776164999999764,62.210.85.178,10.0.2.15,TCP,60,9001  >  35978 [ACK] Seq=8265751 Ack=150932967 Win=65535 Len=0
1,5.7762009999996735,10.0.2.15,62.210.85.178,TLSv1.2,1204,Application Data
1,5.776241999999911,62.210.85.178,10.0.2.15,TCP,60,9001  >  35978 [ACK] Seq=8265751 Ack=150934117 Win=65535 Len=0
1,5.776296000000002,10.0.2.15,62.210.85.178,TLSv1.2,4124,Application Data
1,5.7764469999997345,62.210.85.178,10.0.2.15,TCP,60,9001  >  35978 [ACK] Seq=8265751 Ack=150935577 Win=65535 Len=0
1,5.7764579999998205,62.210.85.178,10.0.2.15,TCP,60,9001  >  35978 [ACK] Seq=8265751 Ack=150937037 Win=65535 Len=0
1,5.776460999999927,62.210.85.178,10.0.2.15,TCP,60,9001  >  35978 [ACK] Seq=8265751 Ack=150938187 Win=65535 Len=0
1,5.77648999999974,10.0.2.15,62.210.85.178,TLSv1.2,332,Application Data
1,5.776529999999639,62.210.85.178,10.0.2.15,TCP,60,9001  >  35978 [ACK] Seq=8265751 Ack=150938465 Win=65535 Len=0
1,5.776595999999699,10.0.2.15,62.210.85.178,TLSv1.2,1618,Application Data
1,5.776688999999806,62.210.85.178,10.0.2.15,TCP,60,9001  >  35978 [ACK] Seq=8265751 Ack=150939925 Win=65535 Len=0
1,5.776732999999695,62.210.85.178,10.0.2.15,TCP,60,9001  >  35978 [ACK] Seq=8265751 Ack=150940029 Win=65535 Len=0
1,5.959692999999788,54.93.77.70,10.0.2.15,TCP,2950,"9001  >  34692 [PSH, ACK] Seq=150771007 Ack=8297629 Win=65535 Len=2896 [TCP segment of a reassembled PDU]"
1,5.960163999999622,10.0.2.15,54.93.77.70,TCP,54,34692  >  9001 [ACK] Seq=8297629 Ack=150773903 Win=65535 Len=0
1,5.966402000000016,54.93.77.70,10.0.2.15,TLSv1.2,2950,Application Data [TCP segment of a reassembled PDU]
1,5.966454999999769,54.93.77.70,10.0.2.15,TLSv1.2,8742,"Application Data, Application Data"
1,5.966515000000072,10.0.2.15,54.93.77.70,TCP,54,34692  >  9001 [ACK] Seq=8297629 Ack=150776799 Win=65535 Len=0
1,5.966629000000012,10.0.2.15,54.93.77.70,TCP,54,34692  >  9001 [ACK] Seq=8297629 Ack=150785487 Win=65535 Len=0
1,5.982365999999729,54.93.77.70,10.0.2.15,TLSv1.2,1596,Application Data
1,5.982762999999977,10.0.2.15,54.93.77.70,TCP,54,34692  >  9001 [ACK] Seq=8297629 Ack=150787029 Win=65535 Len=0
1,6.110435000000052,PcsCompu_bb:14:75,RealtekU_12:35:03,ARP,42,Who has 10.0.2.3? Tell 10.0.2.15
1,6.11127499999975,RealtekU_12:35:03,PcsCompu_bb:14:75,ARP,60,10.0.2.3 is at 52:54:00:12:35:03
1,6.678587999999763,54.93.77.70,10.0.2.15,TLSv1.2,2646,Application Data
1,6.6786879999999655,10.0.2.15,54.93.77.70,TCP,54,34692  >  9001 [ACK] Seq=8297629 Ack=150789621 Win=65535 Len=0
1,6.682440999999926,10.0.2.15,54.93.77.70,TLSv1.2,590,Application Data
1,6.682692999999745,54.93.77.70,10.0.2.15,TCP,60,9001  >  34692 [ACK] Seq=150789621 Ack=8298165 Win=65535 Len=0
1,6.87295099999983,62.210.85.178,10.0.2.15,TLSv1.2,590,Application Data
1,6.873490999999831,10.0.2.15,62.210.85.178,TLSv1.2,590,Application Data
1,6.874260999999933,62.210.85.178,10.0.2.15,TCP,60,9001  >  35978 [ACK] Seq=8266287 Ack=150940565 Win=65535 Len=0
1,7.086938999999802,54.93.77.70,10.0.2.15,TLSv1.2,590,Application Data
1,7.08753200000001,10.0.2.15,54.93.77.70,TLSv1.2,590,Application Data
1,7.087641000000076,54.93.77.70,10.0.2.15,TCP,60,9001  >  34692 [ACK] Seq=150790157 Ack=8298701 Win=65535 Len=0
1,7.326407000000017,62.210.85.178,10.0.2.15,TLSv1.2,590,Application Data
1,7.353441999999632,10.0.2.15,62.210.85.178,TLSv1.2,590,Application Data
1,7.356865999999627,62.210.85.178,10.0.2.15,TCP,60,9001  >  35978 [ACK] Seq=8266823 Ack=150941101 Win=65535 Len=0
1,7.367169999999987,10.0.2.15,62.210.85.178,TLSv1.2,4124,Application Data
1,7.369065999999748,62.210.85.178,10.0.2.15,TCP,60,9001  >  35978 [ACK] Seq=8266823 Ack=150942561 Win=65535 Len=0
1,7.369216000000051,62.210.85.178,10.0.2.15,TCP,60,9001  >  35978 [ACK] Seq=8266823 Ack=150944021 Win=65535 Len=0
1,7.369232000000011,62.210.85.178,10.0.2.15,TCP,60,9001  >  35978 [ACK] Seq=8266823 Ack=150945171 Win=65535 Len=0
1,7.369530999999824,10.0.2.15,62.210.85.178,TLSv1.2,4124,Application Data
1,7.369764000000032,62.210.85.178,10.0.2.15,TCP,60,9001  >  35978 [ACK] Seq=8266823 Ack=150946631 Win=65535 Len=0
1,7.369777999999769,62.210.85.178,10.0.2.15,TCP,60,9001  >  35978 [ACK] Seq=8266823 Ack=150948091 Win=65535 Len=0
1,7.3697839999999815,62.210.85.178,10.0.2.15,TCP,60,9001  >  35978 [ACK] Seq=8266823 Ack=150949241 Win=65535 Len=0
1,7.369975000000068,10.0.2.15,62.210.85.178,TLSv1.2,4124,Application Data
1,7.3701499999997395,62.210.85.178,10.0.2.15,TCP,60,9001  >  35978 [ACK] Seq=8266823 Ack=150950701 Win=65535 Len=0
1,7.370160999999825,62.210.85.178,10.0.2.15,TCP,60,9001  >  35978 [ACK] Seq=8266823 Ack=150952161 Win=65535 Len=0
1,7.370164999999815,62.210.85.178,10.0.2.15,TCP,60,9001  >  35978 [ACK] Seq=8266823 Ack=150953311 Win=65535 Len=0
1,7.370218000000023,10.0.2.15,62.210.85.178,TLSv1.2,4124,Application Data
1,7.370336999999836,62.210.85.178,10.0.2.15,TCP,60,9001  >  35978 [ACK] Seq=8266823 Ack=150954771 Win=65535 Len=0
1,7.370359999999891,62.210.85.178,10.0.2.15,TCP,60,9001  >  35978 [ACK] Seq=8266823 Ack=150956231 Win=65535 Len=0
1,7.3703669999999875,62.210.85.178,10.0.2.15,TCP,60,9001  >  35978 [ACK] Seq=8266823 Ack=150957381 Win=65535 Len=0
1,7.37043199999971,10.0.2.15,62.210.85.178,TLSv1.2,332,Application Data
1,7.370559999999841,62.210.85.178,10.0.2.15,TCP,60,9001  >  35978 [ACK] Seq=8266823 Ack=150957659 Win=65535 Len=0
1,7.371443999999883,10.0.2.15,62.210.85.178,TLSv1.2,3868,Application Data
1,7.371574999999666,10.0.2.15,62.210.85.178,TCP,2974,35978  >  9001 [ACK] Seq=150961473 Ack=8266823 Win=65535 Len=2920 [TCP segment of a reassembled PDU]
1,7.371662000000015,62.210.85.178,10.0.2.15,TCP,60,9001  >  35978 [ACK] Seq=8266823 Ack=150959119 Win=65535 Len=0
1,7.371671999999762,62.210.85.178,10.0.2.15,TCP,60,9001  >  35978 [ACK] Seq=8266823 Ack=150960579 Win=65535 Len=0
1,7.371675999999752,62.210.85.178,10.0.2.15,TCP,60,9001  >  35978 [ACK] Seq=8266823 Ack=150961473 Win=65535 Len=0
1,7.371678999999858,62.210.85.178,10.0.2.15,TCP,60,9001  >  35978 [ACK] Seq=8266823 Ack=150962933 Win=65535 Len=0
1,7.371681999999964,62.210.85.178,10.0.2.15,TCP,60,9001  >  35978 [ACK] Seq=8266823 Ack=150964393 Win=65535 Len=0
1,7.371719999999641,10.0.2.15,62.210.85.178,TLSv1.2,1204,Application Data
1,7.3717790000000605,62.210.85.178,10.0.2.15,TCP,60,9001  >  35978 [ACK] Seq=8266823 Ack=150965543 Win=65535 Len=0
1,7.371830000000045,10.0.2.15,62.210.85.178,TLSv1.2,3030,Application Data
1,7.37189699999999,62.210.85.178,10.0.2.15,TCP,60,9001  >  35978 [ACK] Seq=8266823 Ack=150967003 Win=65535 Len=0
1,7.37190499999997,62.210.85.178,10.0.2.15,TCP,60,9001  >  35978 [ACK] Seq=8266823 Ack=150968463 Win=65535 Len=0
1,7.371908000000076,62.210.85.178,10.0.2.15,TCP,60,9001  >  35978 [ACK] Seq=8266823 Ack=150968519 Win=65535 Len=0
1,7.380327999999736,10.0.2.15,62.210.85.178,TLSv1.2,4124,Application Data
1,7.382913999999801,62.210.85.178,10.0.2.15,TCP,60,9001  >  35978 [ACK] Seq=8266823 Ack=150969979 Win=65535 Len=0
1,7.382944999999836,62.210.85.178,10.0.2.15,TCP,60,9001  >  35978 [ACK] Seq=8266823 Ack=150971439 Win=65535 Len=0
1,7.38294999999971,62.210.85.178,10.0.2.15,TCP,60,9001  >  35978 [ACK] Seq=8266823 Ack=150972589 Win=65535 Len=0
1,7.383076000000074,10.0.2.15,62.210.85.178,TLSv1.2,4124,Application Data
1,7.383155999999872,62.210.85.178,10.0.2.15,TCP,60,9001  >  35978 [ACK] Seq=8266823 Ack=150974049 Win=65535 Len=0
1,7.3831639999998515,62.210.85.178,10.0.2.15,TCP,60,9001  >  35978 [ACK] Seq=8266823 Ack=150975509 Win=65535 Len=0
1,7.383167999999841,62.210.85.178,10.0.2.15,TCP,60,9001  >  35978 [ACK] Seq=8266823 Ack=150976659 Win=65535 Len=0
1,7.383213999999953,10.0.2.15,62.210.85.178,TLSv1.2,4124,Application Data
1,7.383281999999781,62.210.85.178,10.0.2.15,TCP,60,9001  >  35978 [ACK] Seq=8266823 Ack=150978119 Win=65535 Len=0
1,7.383288999999877,62.210.85.178,10.0.2.15,TCP,60,9001  >  35978 [ACK] Seq=8266823 Ack=150979579 Win=65535 Len=0
1,7.383291999999983,62.210.85.178,10.0.2.15,TCP,60,9001  >  35978 [ACK] Seq=8266823 Ack=150980729 Win=65535 Len=0
1,7.38333399999965,10.0.2.15,62.210.85.178,TLSv1.2,1810,Application Data
1,7.383397999999943,62.210.85.178,10.0.2.15,TCP,60,9001  >  35978 [ACK] Seq=8266823 Ack=150982189 Win=65535 Len=0
1,7.383405999999923,62.210.85.178,10.0.2.15,TCP,60,9001  >  35978 [ACK] Seq=8266823 Ack=150982485 Win=65535 Len=0
1,7.489063999999871,54.93.77.70,10.0.2.15,TLSv1.2,590,Application Data
1,7.497765999999956,54.93.77.70,10.0.2.15,TCP,2950,"9001  >  34692 [PSH, ACK] Seq=150790693 Ack=8298701 Win=65535 Len=2896 [TCP segment of a reassembled PDU]"
1,7.498790999999983,10.0.2.15,54.93.77.70,TCP,54,34692  >  9001 [ACK] Seq=8298701 Ack=150793589 Win=65535 Len=0
1,7.504407999999785,54.93.77.70,10.0.2.15,TLSv1.2,4398,"Application Data, Application Data"
1,7.504602999999861,10.0.2.15,54.93.77.70,TCP,54,34692  >  9001 [ACK] Seq=8298701 Ack=150797933 Win=65535 Len=0
1,7.553999999999633,54.93.77.70,10.0.2.15,TCP,2950,"9001  >  34692 [PSH, ACK] Seq=150797933 Ack=8298701 Win=65535 Len=2896 [TCP segment of a reassembled PDU]"
1,7.55412699999988,10.0.2.15,54.93.77.70,TCP,54,34692  >  9001 [ACK] Seq=8298701 Ack=150800829 Win=65535 Len=0
1,7.558997999999974,54.93.77.70,10.0.2.15,TLSv1.2,778,Application Data
1,7.559060000000045,54.93.77.70,10.0.2.15,TLSv1.2,4398,Application Data
1,7.559378999999808,10.0.2.15,54.93.77.70,TCP,54,34692  >  9001 [ACK] Seq=8298701 Ack=150805897 Win=65535 Len=0
1,7.563097999999627,54.93.77.70,10.0.2.15,TLSv1.2,7294,"Application Data, Application Data, Application Data"
1,7.5636930000000575,10.0.2.15,54.93.77.70,TCP,54,34692  >  9001 [ACK] Seq=8298701 Ack=150813137 Win=65535 Len=0
1,7.566229000000021,10.0.2.15,54.93.77.70,TLSv1.2,590,Application Data
1,7.5664279999996324,54.93.77.70,10.0.2.15,TCP,60,9001  >  34692 [ACK] Seq=150813137 Ack=8299237 Win=65535 Len=0
1,7.5784349999998994,54.93.77.70,10.0.2.15,TLSv1.2,1452,"Application Data, Application Data"
1,7.618576999999732,10.0.2.15,54.93.77.70,TCP,54,34692  >  9001 [ACK] Seq=8299237 Ack=150814535 Win=65535 Len=0
1,7.628104999999778,54.93.77.70,10.0.2.15,TCP,2950,"9001  >  34692 [PSH, ACK] Seq=150814535 Ack=8299237 Win=65535 Len=2896 [TCP segment of a reassembled PDU]"
1,7.628289999999652,54.93.77.70,10.0.2.15,TLSv1.2,1828,"Application Data, Application Data"
1,7.628320999999687,54.93.77.70,10.0.2.15,TCP,2950,"9001  >  34692 [PSH, ACK] Seq=150819205 Ack=8299237 Win=65535 Len=2896 [TCP segment of a reassembled PDU]"
1,7.628911999999673,10.0.2.15,54.93.77.70,TCP,54,34692  >  9001 [ACK] Seq=8299237 Ack=150817431 Win=65535 Len=0
1,7.628969999999754,10.0.2.15,54.93.77.70,TCP,54,34692  >  9001 [ACK] Seq=8299237 Ack=150819205 Win=65535 Len=0
1,7.6289959999999155,10.0.2.15,54.93.77.70,TCP,54,34692  >  9001 [ACK] Seq=8299237 Ack=150822101 Win=65535 Len=0
1,7.629279999999653,10.0.2.15,54.93.77.70,TLSv1.2,590,Application Data
1,7.629388999999719,54.93.77.70,10.0.2.15,TCP,60,9001  >  34692 [ACK] Seq=150822101 Ack=8299773 Win=65535 Len=0
1,7.63945399999966,54.93.77.70,10.0.2.15,TLSv1.2,2950,Application Data [TCP segment of a reassembled PDU]
1,7.63954799999965,54.93.77.70,10.0.2.15,TLSv1.2,2950,Application Data [TCP segment of a reassembled PDU]
1,7.6396179999997,10.0.2.15,54.93.77.70,TCP,54,34692  >  9001 [ACK] Seq=8299773 Ack=150824997 Win=65535 Len=0
1,7.639769999999771,10.0.2.15,54.93.77.70,TCP,54,34692  >  9001 [ACK] Seq=8299773 Ack=150827893 Win=65535 Len=0
1,7.6456530000000384,54.93.77.70,10.0.2.15,TLSv1.2,684,Application Data
1,7.679487999999765,62.210.85.178,10.0.2.15,TLSv1.2,590,Application Data
1,7.686588999999913,10.0.2.15,54.93.77.70,TCP,54,34692  >  9001 [ACK] Seq=8299773 Ack=150828523 Win=65535 Len=0
1,7.722901999999976,10.0.2.15,62.210.85.178,TCP,54,35978  >  9001 [ACK] Seq=150982485 Ack=8267359 Win=65535 Len=0
1,7.752328000000034,54.93.77.70,10.0.2.15,TLSv1.2,2132,Application Data
1,7.752465000000029,10.0.2.15,54.93.77.70,TCP,54,34692  >  9001 [ACK] Seq=8299773 Ack=150830601 Win=65535 Len=0
1,7.789021000000048,54.93.77.70,10.0.2.15,TLSv1.2,187,Application Data
1,7.789151999999831,10.0.2.15,54.93.77.70,TCP,54,34692  >  9001 [ACK] Seq=8299773 Ack=150830734 Win=65535 Len=0
1,7.808367999999973,62.210.85.178,10.0.2.15,TLSv1.2,590,Application Data
1,7.808559000000059,10.0.2.15,62.210.85.178,TCP,54,35978  >  9001 [ACK] Seq=150982485 Ack=8267895 Win=65535 Len=0
1,7.86770899999965,54.93.77.70,10.0.2.15,TLSv1.2,1507,Application Data
1,7.867921999999908,10.0.2.15,54.93.77.70,TCP,54,34692  >  9001 [ACK] Seq=8299773 Ack=150832187 Win=65535 Len=0
1,7.87081199999966,10.0.2.15,54.93.77.70,TLSv1.2,590,Application Data
1,7.870951999999761,54.93.77.70,10.0.2.15,TCP,60,9001  >  34692 [ACK] Seq=150832187 Ack=8300309 Win=65535 Len=0
1,8.11042099999986,62.210.85.178,10.0.2.15,TLSv1.2,590,Application Data
1,8.110650999999962,10.0.2.15,62.210.85.178,TCP,54,35978  >  9001 [ACK] Seq=150982485 Ack=8268431 Win=65535 Len=0
1,8.111353999999665,10.0.2.15,62.210.85.178,TLSv1.2,590,Application Data
1,8.111456999999973,62.210.85.178,10.0.2.15,TCP,60,9001  >  35978 [ACK] Seq=8268431 Ack=150983021 Win=65535 Len=0
1,8.315458000000035,54.93.77.70,10.0.2.15,TLSv1.2,590,Application Data
1,8.315973999999642,10.0.2.15,54.93.77.70,TLSv1.2,590,Application Data
1,8.316117999999733,54.93.77.70,10.0.2.15,TCP,60,9001  >  34692 [ACK] Seq=150832723 Ack=8300845 Win=65535 Len=0
1,8.420442999999977,62.210.85.178,10.0.2.15,TLSv1.2,590,Application Data
1,8.435872999999901,10.0.2.15,62.210.85.178,TLSv1.2,590,Application Data
1,8.436052000000018,62.210.85.178,10.0.2.15,TCP,60,9001  >  35978 [ACK] Seq=8268967 Ack=150983557 Win=65535 Len=0
1,8.450698999999986,10.0.2.15,62.210.85.178,TLSv1.2,4124,Application Data
1,8.451853999999912,62.210.85.178,10.0.2.15,TCP,60,9001  >  35978 [ACK] Seq=8268967 Ack=150985017 Win=65535 Len=0
1,8.451897999999801,62.210.85.178,10.0.2.15,TCP,60,9001  >  35978 [ACK] Seq=8268967 Ack=150986477 Win=65535 Len=0
1,8.451904000000013,62.210.85.178,10.0.2.15,TCP,60,9001  >  35978 [ACK] Seq=8268967 Ack=150987627 Win=65535 Len=0
1,8.452045999999882,10.0.2.15,62.210.85.178,TLSv1.2,4124,Application Data
1,8.452143999999862,10.0.2.15,62.210.85.178,TCP,2974,35978  >  9001 [ACK] Seq=150991697 Ack=8268967 Win=65535 Len=2920 [TCP segment of a reassembled PDU]
1,8.452238999999736,62.210.85.178,10.0.2.15,TCP,60,9001  >  35978 [ACK] Seq=8268967 Ack=150989087 Win=65535 Len=0
1,8.452248999999938,62.210.85.178,10.0.2.15,TCP,60,9001  >  35978 [ACK] Seq=8268967 Ack=150990547 Win=65535 Len=0
1,8.452253999999812,62.210.85.178,10.0.2.15,TCP,60,9001  >  35978 [ACK] Seq=8268967 Ack=150991697 Win=65535 Len=0
1,8.452258999999685,62.210.85.178,10.0.2.15,TCP,60,9001  >  35978 [ACK] Seq=8268967 Ack=150993157 Win=65535 Len=0
1,8.452262999999675,62.210.85.178,10.0.2.15,TCP,60,9001  >  35978 [ACK] Seq=8268967 Ack=150994617 Win=65535 Len=0
1,8.452307999999903,10.0.2.15,62.210.85.178,TLSv1.2,1204,Application Data
1,8.452394999999797,10.0.2.15,62.210.85.178,TCP,2974,35978  >  9001 [ACK] Seq=150995767 Ack=8268967 Win=65535 Len=2920 [TCP segment of a reassembled PDU]
1,8.452440000000024,62.210.85.178,10.0.2.15,TCP,60,9001  >  35978 [ACK] Seq=8268967 Ack=150995767 Win=65535 Len=0
1,8.452448000000004,62.210.85.178,10.0.2.15,TCP,60,9001  >  35978 [ACK] Seq=8268967 Ack=150997227 Win=65535 Len=0
1,8.452452999999878,62.210.85.178,10.0.2.15,TCP,60,9001  >  35978 [ACK] Seq=8268967 Ack=150998687 Win=65535 Len=0
1,8.452491000000009,10.0.2.15,62.210.85.178,TLSv1.2,1204,Application Data
1,8.452530999999908,62.210.85.178,10.0.2.15,TCP,60,9001  >  35978 [ACK] Seq=8268967 Ack=150999837 Win=65535 Len=0
1,8.45258100000001,10.0.2.15,62.210.85.178,TLSv1.2,332,Application Data
1,8.452635999999984,62.210.85.178,10.0.2.15,TCP,60,9001  >  35978 [ACK] Seq=8268967 Ack=151000115 Win=65535 Len=0
1,8.452712999999676,10.0.2.15,62.210.85.178,TLSv1.2,3868,Application Data
1,8.452790999999706,62.210.85.178,10.0.2.15,TCP,60,9001  >  35978 [ACK] Seq=8268967 Ack=151001575 Win=65535 Len=0
1,8.452798999999686,62.210.85.178,10.0.2.15,TCP,60,9001  >  35978 [ACK] Seq=8268967 Ack=151003035 Win=65535 Len=0
1,8.452804000000015,62.210.85.178,10.0.2.15,TCP,60,9001  >  35978 [ACK] Seq=8268967 Ack=151003929 Win=65535 Len=0
1,8.452851999999893,10.0.2.15,62.210.85.178,TLSv1.2,4124,Application Data
1,8.452914999999848,62.210.85.178,10.0.2.15,TCP,60,9001  >  35978 [ACK] Seq=8268967 Ack=151005389 Win=65535 Len=0
1,8.452922999999828,62.210.85.178,10.0.2.15,TCP,60,9001  >  35978 [ACK] Seq=8268967 Ack=151006849 Win=65535 Len=0
1,8.452926999999818,62.210.85.178,10.0.2.15,TCP,60,9001  >  35978 [ACK] Seq=8268967 Ack=151007999 Win=65535 Len=0
1,8.452974999999697,10.0.2.15,62.210.85.178,TLSv1.2,3030,Application Data
1,8.45305099999996,62.210.85.178,10.0.2.15,TCP,60,9001  >  35978 [ACK] Seq=8268967 Ack=151009459 Win=65535 Len=0
1,8.45305899999994,62.210.85.178,10.0.2.15,TCP,60,9001  >  35978 [ACK] Seq=8268967 Ack=151010919 Win=65535 Len=0
1,8.45306299999993,62.210.85.178,10.0.2.15,TCP,60,9001  >  35978 [ACK] Seq=8268967 Ack=151010975 Win=65535 Len=0
1,8.462684999999965,10.0.2.15,62.210.85.178,TLSv1.2,4124,Application Data
1,8.46429199999966,62.210.85.178,10.0.2.15,TCP,60,9001  >  35978 [ACK] Seq=8268967 Ack=151012435 Win=65535 Len=0
1,8.464492000000064,62.210.85.178,10.0.2.15,TCP,60,9001  >  35978 [ACK] Seq=8268967 Ack=151013895 Win=65535 Len=0
1,8.464520999999877,62.210.85.178,10.0.2.15,TCP,60,9001  >  35978 [ACK] Seq=8268967 Ack=151015045 Win=65535 Len=0
1,8.465016999999989,10.0.2.15,62.210.85.178,TLSv1.2,4124,Application Data
1,8.46534900000006,62.210.85.178,10.0.2.15,TCP,60,9001  >  35978 [ACK] Seq=8268967 Ack=151016505 Win=65535 Len=0
1,8.465367999999671,62.210.85.178,10.0.2.15,TCP,60,9001  >  35978 [ACK] Seq=8268967 Ack=151017965 Win=65535 Len=0
1,8.465374999999767,62.210.85.178,10.0.2.15,TCP,60,9001  >  35978 [ACK] Seq=8268967 Ack=151019115 Win=65535 Len=0
1,8.465471999999863,10.0.2.15,62.210.85.178,TLSv1.2,4124,Application Data
1,8.465562999999747,62.210.85.178,10.0.2.15,TCP,60,9001  >  35978 [ACK] Seq=8268967 Ack=151020575 Win=65535 Len=0
1,8.46557299999995,62.210.85.178,10.0.2.15,TCP,60,9001  >  35978 [ACK] Seq=8268967 Ack=151022035 Win=65535 Len=0
1,8.465577999999823,62.210.85.178,10.0.2.15,TCP,60,9001  >  35978 [ACK] Seq=8268967 Ack=151023185 Win=65535 Len=0
1,8.465633999999682,10.0.2.15,62.210.85.178,TLSv1.2,4124,Application Data
1,8.465696999999636,62.210.85.178,10.0.2.15,TCP,60,9001  >  35978 [ACK] Seq=8268967 Ack=151024645 Win=65535 Len=0
1,8.465707999999722,62.210.85.178,10.0.2.15,TCP,60,9001  >  35978 [ACK] Seq=8268967 Ack=151026105 Win=65535 Len=0
1,8.46571300000005,62.210.85.178,10.0.2.15,TCP,60,9001  >  35978 [ACK] Seq=8268967 Ack=151027255 Win=65535 Len=0
1,8.465910999999778,10.0.2.15,62.210.85.178,TLSv1.2,332,Application Data
1,8.465965999999753,62.210.85.178,10.0.2.15,TCP,60,9001  >  35978 [ACK] Seq=8268967 Ack=151027533 Win=65535 Len=0
1,8.466053999999986,10.0.2.15,62.210.85.178,TLSv1.2,1618,Application Data
1,8.46610499999997,62.210.85.178,10.0.2.15,TCP,60,9001  >  35978 [ACK] Seq=8268967 Ack=151028993 Win=65535 Len=0
1,8.46611299999995,62.210.85.178,10.0.2.15,TCP,60,9001  >  35978 [ACK] Seq=8268967 Ack=151029097 Win=65535 Len=0
1,8.589150999999674,54.93.77.70,10.0.2.15,TLSv1.2,590,Application Data
1,8.630697999999938,10.0.2.15,54.93.77.70,TCP,54,34692  >  9001 [ACK] Seq=8300845 Ack=150833259 Win=65535 Len=0
1,8.683407999999872,54.93.77.70,10.0.2.15,TCP,2950,"9001  >  34692 [PSH, ACK] Seq=150833259 Ack=8300845 Win=65535 Len=2896 [TCP segment of a reassembled PDU]"
1,8.683509999999842,54.93.77.70,10.0.2.15,TLSv1.2,11638,"Application Data, Application Data, Application Data, Application Data"
1,8.683604999999716,10.0.2.15,54.93.77.70,TCP,54,34692  >  9001 [ACK] Seq=8300845 Ack=150836155 Win=65535 Len=0
1,8.683672999999999,10.0.2.15,54.93.77.70,TCP,54,34692  >  9001 [ACK] Seq=8300845 Ack=150847739 Win=65535 Len=0
1,8.705876999999873,54.93.77.70,10.0.2.15,TCP,2950,"9001  >  34692 [PSH, ACK] Seq=150847739 Ack=8300845 Win=65535 Len=2896 [TCP segment of a reassembled PDU]"
1,8.705977000000075,10.0.2.15,54.93.77.70,TCP,54,34692  >  9001 [ACK] Seq=8300845 Ack=150850635 Win=65535 Len=0
1,8.707366999999977,54.93.77.70,10.0.2.15,TLSv1.2,1828,"Application Data, Application Data"
1,8.707434999999805,10.0.2.15,54.93.77.70,TCP,54,34692  >  9001 [ACK] Seq=8300845 Ack=150852409 Win=65535 Len=0
1,8.717765999999756,54.93.77.70,10.0.2.15,TLSv1.2,2950,Application Data
1,8.717905999999857,10.0.2.15,54.93.77.70,TCP,54,34692  >  9001 [ACK] Seq=8300845 Ack=150855305 Win=65535 Len=0
1,8.717960999999832,54.93.77.70,10.0.2.15,TCP,1502,"9001  >  34692 [PSH, ACK] Seq=150855305 Ack=8300845 Win=65535 Len=1448 [TCP segment of a reassembled PDU]"
1,8.717998999999963,10.0.2.15,54.93.77.70,TCP,54,34692  >  9001 [ACK] Seq=8300845 Ack=150856753 Win=65535 Len=0
1,8.721334999999726,54.93.77.70,10.0.2.15,TLSv1.2,4398,"Application Data, Application Data"
1,8.721379999999954,10.0.2.15,54.93.77.70,TCP,54,34692  >  9001 [ACK] Seq=8300845 Ack=150861097 Win=65535 Len=0
1,8.72157100000004,10.0.2.15,54.93.77.70,TLSv1.2,590,Application Data
1,8.721674999999777,54.93.77.70,10.0.2.15,TCP,60,9001  >  34692 [ACK] Seq=150861097 Ack=8301381 Win=65535 Len=0
1,8.724275999999918,54.93.77.70,10.0.2.15,TLSv1.2,192,Application Data
1,8.736144999999851,54.93.77.70,10.0.2.15,TCP,2950,"9001  >  34692 [PSH, ACK] Seq=150861235 Ack=8301381 Win=65535 Len=2896 [TCP segment of a reassembled PDU]"
1,8.73626699999977,10.0.2.15,54.93.77.70,TCP,54,34692  >  9001 [ACK] Seq=8301381 Ack=150864131 Win=65535 Len=0
1,8.736468999999943,10.0.2.15,54.93.77.70,TLSv1.2,590,Application Data
1,8.736536999999771,54.93.77.70,10.0.2.15,TCP,60,9001  >  34692 [ACK] Seq=150864131 Ack=8301917 Win=65535 Len=0
1,8.738906999999926,54.93.77.70,10.0.2.15,TLSv1.2,4398,Application Data [TCP segment of a reassembled PDU]
1,8.739894999999706,10.0.2.15,54.93.77.70,TCP,54,34692  >  9001 [ACK] Seq=8301917 Ack=150868475 Win=65535 Len=0
1,8.752713999999742,54.93.77.70,10.0.2.15,TLSv1.2,568,Application Data
1,8.767607999999655,54.93.77.70,10.0.2.15,TCP,2950,"9001  >  34692 [PSH, ACK] Seq=150868989 Ack=8301917 Win=65535 Len=2896 [TCP segment of a reassembled PDU]"
1,8.767767999999705,54.93.77.70,10.0.2.15,TLSv1.2,4398,Application Data [TCP segment of a reassembled PDU]
1,8.767957999999908,10.0.2.15,54.93.77.70,TCP,54,34692  >  9001 [ACK] Seq=8301917 Ack=150871885 Win=65535 Len=0
1,8.768342999999732,10.0.2.15,54.93.77.70,TCP,54,34692  >  9001 [ACK] Seq=8301917 Ack=150876229 Win=65535 Len=0
1,8.777615999999853,54.93.77.70,10.0.2.15,TLSv1.2,1502,"Application Data, Application Data"
1,8.77871499999992,10.0.2.15,54.93.77.70,TCP,54,34692  >  9001 [ACK] Seq=8301917 Ack=150877677 Win=65535 Len=0
1,8.784500999999636,54.93.77.70,10.0.2.15,TLSv1.2,1220,Application Data
1,8.788122999999814,10.0.2.15,54.93.77.70,TLSv1.2,590,Application Data
1,8.788307999999688,54.93.77.70,10.0.2.15,TCP,60,9001  >  34692 [ACK] Seq=150878843 Ack=8302453 Win=65535 Len=0
1,8.903985999999804,62.210.85.178,10.0.2.15,TLSv1.2,1104,Application Data
1,8.942559999999958,10.0.2.15,62.210.85.178,TCP,54,35978  >  9001 [ACK] Seq=151029097 Ack=8270017 Win=65535 Len=0
1,8.960242999999991,62.210.85.178,10.0.2.15,TLSv1.2,590,Application Data
1,8.960450000000037,10.0.2.15,62.210.85.178,TCP,54,35978  >  9001 [ACK] Seq=151029097 Ack=8270553 Win=65535 Len=0
1,8.961526000000049,10.0.2.15,62.210.85.178,TLSv1.2,590,Application Data
1,8.963841999999659,62.210.85.178,10.0.2.15,TCP,60,9001  >  35978 [ACK] Seq=8270553 Ack=151029633 Win=65535 Len=0
1,9.44134299999996,54.93.77.70,10.0.2.15,TLSv1.2,590,Application Data
1,9.442545999999766,10.0.2.15,54.93.77.70,TLSv1.2,590,Application Data
1,9.442721999999776,54.93.77.70,10.0.2.15,TCP,60,9001  >  34692 [ACK] Seq=150879379 Ack=8302989 Win=65535 Len=0
1,9.645893999999771,62.210.85.178,10.0.2.15,TLSv1.2,590,Application Data
1,9.65240700000004,10.0.2.15,62.210.85.178,TLSv1.2,590,Application Data
1,9.652611999999863,62.210.85.178,10.0.2.15,TCP,60,9001  >  35978 [ACK] Seq=8271089 Ack=151030169 Win=65535 Len=0
1,9.662681999999677,10.0.2.15,62.210.85.178,TLSv1.2,4124,Application Data
1,9.66386599999987,62.210.85.178,10.0.2.15,TCP,60,9001  >  35978 [ACK] Seq=8271089 Ack=151031629 Win=65535 Len=0
1,9.663986000000023,62.210.85.178,10.0.2.15,TCP,60,9001  >  35978 [ACK] Seq=8271089 Ack=151033089 Win=65535 Len=0
1,9.663992999999664,62.210.85.178,10.0.2.15,TCP,60,9001  >  35978 [ACK] Seq=8271089 Ack=151034239 Win=65535 Len=0
1,9.664444999999887,10.0.2.15,62.210.85.178,TLSv1.2,4124,Application Data
1,9.665174999999635,62.210.85.178,10.0.2.15,TCP,60,9001  >  35978 [ACK] Seq=8271089 Ack=151035699 Win=65535 Len=0
1,9.665364999999838,62.210.85.178,10.0.2.15,TCP,60,9001  >  35978 [ACK] Seq=8271089 Ack=151037159 Win=65535 Len=0
1,9.665412999999717,62.210.85.178,10.0.2.15,TCP,60,9001  >  35978 [ACK] Seq=8271089 Ack=151038309 Win=65535 Len=0
1,9.66603699999996,10.0.2.15,62.210.85.178,TLSv1.2,4124,Application Data
1,9.6669109999998,62.210.85.178,10.0.2.15,TCP,60,9001  >  35978 [ACK] Seq=8271089 Ack=151039769 Win=65535 Len=0
1,9.667136999999911,62.210.85.178,10.0.2.15,TCP,60,9001  >  35978 [ACK] Seq=8271089 Ack=151041229 Win=65535 Len=0
1,9.667144000000008,62.210.85.178,10.0.2.15,TCP,60,9001  >  35978 [ACK] Seq=8271089 Ack=151042379 Win=65535 Len=0
1,9.667296999999962,10.0.2.15,62.210.85.178,TLSv1.2,4124,Application Data
1,9.667445000000043,62.210.85.178,10.0.2.15,TCP,60,9001  >  35978 [ACK] Seq=8271089 Ack=151043839 Win=65535 Len=0
1,9.667455999999675,62.210.85.178,10.0.2.15,TCP,60,9001  >  35978 [ACK] Seq=8271089 Ack=151045299 Win=65535 Len=0
1,9.667459999999664,62.210.85.178,10.0.2.15,TCP,60,9001  >  35978 [ACK] Seq=8271089 Ack=151046449 Win=65535 Len=0
1,9.667521999999735,10.0.2.15,62.210.85.178,TLSv1.2,332,Application Data
1,9.667625000000044,62.210.85.178,10.0.2.15,TCP,60,9001  >  35978 [ACK] Seq=8271089 Ack=151046727 Win=65535 Len=0
1,9.667807999999695,10.0.2.15,62.210.85.178,TLSv1.2,3868,Application Data
1,9.667899000000034,62.210.85.178,10.0.2.15,TCP,60,9001  >  35978 [ACK] Seq=8271089 Ack=151048187 Win=65535 Len=0
1,9.667907999999898,62.210.85.178,10.0.2.15,TCP,60,9001  >  35978 [ACK] Seq=8271089 Ack=151049647 Win=65535 Len=0
1,9.667911000000004,62.210.85.178,10.0.2.15,TCP,60,9001  >  35978 [ACK] Seq=8271089 Ack=151050541 Win=65535 Len=0
1,9.667954999999893,10.0.2.15,62.210.85.178,TLSv1.2,4124,Application Data
1,9.66803200000004,62.210.85.178,10.0.2.15,TCP,60,9001  >  35978 [ACK] Seq=8271089 Ack=151052001 Win=65535 Len=0
1,9.668041999999787,62.210.85.178,10.0.2.15,TCP,60,9001  >  35978 [ACK] Seq=8271089 Ack=151053461 Win=65535 Len=0
1,9.668044999999893,62.210.85.178,10.0.2.15,TCP,60,9001  >  35978 [ACK] Seq=8271089 Ack=151054611 Win=65535 Len=0
1,9.668081999999686,10.0.2.15,62.210.85.178,TLSv1.2,3030,Application Data
1,9.668155999999726,62.210.85.178,10.0.2.15,TCP,60,9001  >  35978 [ACK] Seq=8271089 Ack=151056071 Win=65535 Len=0
1,9.668162999999822,62.210.85.178,10.0.2.15,TCP,60,9001  >  35978 [ACK] Seq=8271089 Ack=151057531 Win=65535 Len=0
1,9.668165999999928,62.210.85.178,10.0.2.15,TCP,60,9001  >  35978 [ACK] Seq=8271089 Ack=151057587 Win=65535 Len=0
1,9.674779999999828,10.0.2.15,62.210.85.178,TLSv1.2,4124,Application Data
1,9.675139999999828,62.210.85.178,10.0.2.15,TCP,60,9001  >  35978 [ACK] Seq=8271089 Ack=151059047 Win=65535 Len=0
1,9.675171999999748,62.210.85.178,10.0.2.15,TCP,60,9001  >  35978 [ACK] Seq=8271089 Ack=151060507 Win=65535 Len=0
1,9.67517799999996,62.210.85.178,10.0.2.15,TCP,60,9001  >  35978 [ACK] Seq=8271089 Ack=151061657 Win=65535 Len=0
1,9.67529599999989,10.0.2.15,62.210.85.178,TLSv1.2,4124,Application Data
1,9.675432,62.210.85.178,10.0.2.15,TCP,60,9001  >  35978 [ACK] Seq=8271089 Ack=151063117 Win=65535 Len=0
1,9.675444999999854,62.210.85.178,10.0.2.15,TCP,60,9001  >  35978 [ACK] Seq=8271089 Ack=151064577 Win=65535 Len=0
1,9.67545199999995,62.210.85.178,10.0.2.15,TCP,60,9001  >  35978 [ACK] Seq=8271089 Ack=151065727 Win=65535 Len=0
1,9.675531999999748,10.0.2.15,62.210.85.178,TLSv1.2,4124,Application Data
1,9.675618999999642,62.210.85.178,10.0.2.15,TCP,60,9001  >  35978 [ACK] Seq=8271089 Ack=151067187 Win=65535 Len=0
1,9.675628999999844,62.210.85.178,10.0.2.15,TCP,60,9001  >  35978 [ACK] Seq=8271089 Ack=151068647 Win=65535 Len=0
1,9.675632999999834,62.210.85.178,10.0.2.15,TCP,60,9001  >  35978 [ACK] Seq=8271089 Ack=151069797 Win=65535 Len=0
1,9.676904999999806,10.0.2.15,62.210.85.178,TLSv1.2,2324,Application Data
1,9.677308999999696,62.210.85.178,10.0.2.15,TCP,60,9001  >  35978 [ACK] Seq=8271089 Ack=151071257 Win=65535 Len=0
1,9.677440999999817,62.210.85.178,10.0.2.15,TCP,60,9001  >  35978 [ACK] Seq=8271089 Ack=151072067 Win=65535 Len=0
1,10.058164000000033,54.93.77.70,10.0.2.15,TCP,2950,"9001  >  34692 [PSH, ACK] Seq=150879379 Ack=8302989 Win=65535 Len=2896 [TCP segment of a reassembled PDU]"
1,10.058345999999801,10.0.2.15,54.93.77.70,TCP,54,34692  >  9001 [ACK] Seq=8302989 Ack=150882275 Win=65535 Len=0
1,10.06023099999993,54.93.77.70,10.0.2.15,TLSv1.2,778,Application Data
1,10.06026699999984,54.93.77.70,10.0.2.15,TCP,2950,"9001  >  34692 [PSH, ACK] Seq=150882999 Ack=8302989 Win=65535 Len=2896 [TCP segment of a reassembled PDU]"
1,10.060363999999936,10.0.2.15,54.93.77.70,TCP,54,34692  >  9001 [ACK] Seq=8302989 Ack=150885895 Win=65535 Len=0
1,10.060669999999845,54.93.77.70,10.0.2.15,TLSv1.2,7294,"Application Data, Application Data"
1,10.060685999999805,54.93.77.70,10.0.2.15,TLSv1.2,1502,Application Data [TCP segment of a reassembled PDU]
1,10.061196999999993,10.0.2.15,54.93.77.70,TCP,54,34692  >  9001 [ACK] Seq=8302989 Ack=150894583 Win=65535 Len=0
1,10.076302999999825,54.93.77.70,10.0.2.15,TLSv1.2,2950,Application Data [TCP segment of a reassembled PDU]
1,10.076412999999775,10.0.2.15,54.93.77.70,TCP,54,34692  >  9001 [ACK] Seq=8302989 Ack=150897479 Win=65535 Len=0
1,10.078278999999839,54.93.77.70,10.0.2.15,TLSv1.2,8742,"Application Data, Application Data, Application Data"
1,10.078534999999647,54.93.77.70,10.0.2.15,TLSv1.2,2806,"Application Data, Application Data, Application Data"
1,10.078759999999875,10.0.2.15,54.93.77.70,TCP,54,34692  >  9001 [ACK] Seq=8302989 Ack=150908919 Win=65535 Len=0
1,10.079095000000052,10.0.2.15,54.93.77.70,TLSv1.2,590,Application Data
1,10.079389999999876,54.93.77.70,10.0.2.15,TCP,60,9001  >  34692 [ACK] Seq=150908919 Ack=8303525 Win=65535 Len=0
1,10.082899999999881,54.93.77.70,10.0.2.15,TCP,2950,"9001  >  34692 [PSH, ACK] Seq=150908919 Ack=8303525 Win=65535 Len=2896 [TCP segment of a reassembled PDU]"
1,10.082985000000008,10.0.2.15,54.93.77.70,TCP,54,34692  >  9001 [ACK] Seq=8303525 Ack=150911815 Win=65535 Len=0
1,10.085049999999683,54.93.77.70,10.0.2.15,TLSv1.2,8742,"Application Data, Application Data"
1,10.085141999999905,10.0.2.15,54.93.77.70,TCP,54,34692  >  9001 [ACK] Seq=8303525 Ack=150920503 Win=65535 Len=0
1,10.090701999999965,10.0.2.15,54.93.77.70,TLSv1.2,590,Application Data
1,10.091061999999965,54.93.77.70,10.0.2.15,TCP,60,9001  >  34692 [ACK] Seq=150920503 Ack=8304061 Win=65535 Len=0
1,10.095342999999957,54.93.77.70,10.0.2.15,TLSv1.2,1408,"Application Data, Application Data"
1,10.103212999999869,10.0.2.15,54.93.77.70,TLSv1.2,590,Application Data
1,10.103356000000076,54.93.77.70,10.0.2.15,TCP,60,9001  >  34692 [ACK] Seq=150921857 Ack=8304597 Win=65535 Len=0
1,10.209458999999697,62.210.85.178,10.0.2.15,TLSv1.2,590,Application Data
1,10.250618999999915,10.0.2.15,62.210.85.178,TCP,54,35978  >  9001 [ACK] Seq=151072067 Ack=8271625 Win=65535 Len=0
1,10.316894999999931,62.210.85.178,10.0.2.15,TLSv1.2,1104,Application Data
1,10.317000000000007,10.0.2.15,62.210.85.178,TCP,54,35978  >  9001 [ACK] Seq=151072067 Ack=8272675 Win=65535 Len=0
1,10.317317000000003,10.0.2.15,62.210.85.178,TLSv1.2,590,Application Data
1,10.317411999999877,62.210.85.178,10.0.2.15,TCP,60,9001  >  35978 [ACK] Seq=8272675 Ack=151072603 Win=65535 Len=0
1,10.42319499999985,54.93.77.70,10.0.2.15,TLSv1.2,590,Application Data
1,10.42367299999978,10.0.2.15,54.93.77.70,TLSv1.2,590,Application Data
1,10.423808999999892,54.93.77.70,10.0.2.15,TCP,60,9001  >  34692 [ACK] Seq=150922393 Ack=8305133 Win=65535 Len=0
1,10.970565999999963,10.0.2.15,193.246.105.82,TCP,54,[TCP Keep-Alive] 42316  >  443 [ACK] Seq=1969 Ack=786 Win=32160 Len=0
1,10.970800999999938,193.246.105.82,10.0.2.15,TCP,60,[TCP Keep-Alive ACK] 443  >  42316 [ACK] Seq=786 Ack=1970 Win=65535 Len=0
1,10.97714199999973,62.210.85.178,10.0.2.15,TLSv1.2,590,Application Data
1,10.985987000000023,10.0.2.15,62.210.85.178,TLSv1.2,590,Application Data
1,10.98616099999981,62.210.85.178,10.0.2.15,TCP,60,9001  >  35978 [ACK] Seq=8273211 Ack=151073139 Win=65535 Len=0
1,10.999021999999968,10.0.2.15,62.210.85.178,TLSv1.2,4124,Application Data
1,10.999277999999777,10.0.2.15,62.210.85.178,TCP,2974,35978  >  9001 [ACK] Seq=151077209 Ack=8273211 Win=65535 Len=2920 [TCP segment of a reassembled PDU]
1,10.999315999999908,62.210.85.178,10.0.2.15,TCP,60,9001  >  35978 [ACK] Seq=8273211 Ack=151074599 Win=65535 Len=0
1,10.99935400000004,62.210.85.178,10.0.2.15,TCP,60,9001  >  35978 [ACK] Seq=8273211 Ack=151076059 Win=65535 Len=0
1,10.99936099999968,62.210.85.178,10.0.2.15,TCP,60,9001  >  35978 [ACK] Seq=8273211 Ack=151077209 Win=65535 Len=0
1,10.999366000000009,62.210.85.178,10.0.2.15,TCP,60,9001  >  35978 [ACK] Seq=8273211 Ack=151078669 Win=65535 Len=0
1,10.999369999999999,62.210.85.178,10.0.2.15,TCP,60,9001  >  35978 [ACK] Seq=8273211 Ack=151080129 Win=65535 Len=0
1,10.999421999999868,10.0.2.15,62.210.85.178,TLSv1.2,1204,Application Data
1,10.999485999999706,62.210.85.178,10.0.2.15,TCP,60,9001  >  35978 [ACK] Seq=8273211 Ack=151081279 Win=65535 Len=0
1,10.99954600000001,10.0.2.15,62.210.85.178,TLSv1.2,4124,Application Data
1,10.999593000000004,62.210.85.178,10.0.2.15,TCP,60,9001  >  35978 [ACK] Seq=8273211 Ack=151082739 Win=65535 Len=0
1,10.999601999999868,62.210.85.178,10.0.2.15,TCP,60,9001  >  35978 [ACK] Seq=8273211 Ack=151084199 Win=65535 Len=0
1,10.999605999999858,62.210.85.178,10.0.2.15,TCP,60,9001  >  35978 [ACK] Seq=8273211 Ack=151085349 Win=65535 Len=0
1,10.99965199999997,10.0.2.15,62.210.85.178,TLSv1.2,4124,Application Data
1,10.999691999999868,62.210.85.178,10.0.2.15,TCP,60,9001  >  35978 [ACK] Seq=8273211 Ack=151086809 Win=65535 Len=0
1,10.999697999999626,62.210.85.178,10.0.2.15,TCP,60,9001  >  35978 [ACK] Seq=8273211 Ack=151088269 Win=65535 Len=0
1,10.999761000000035,10.0.2.15,62.210.85.178,TLSv1.2,2974,Application Data
1,10.999801999999818,62.210.85.178,10.0.2.15,TCP,60,9001  >  35978 [ACK] Seq=8273211 Ack=151089419 Win=65535 Len=0
1,10.999808999999914,62.210.85.178,10.0.2.15,TCP,60,9001  >  35978 [ACK] Seq=8273211 Ack=151090879 Win=65535 Len=0
1,10.99981200000002,62.210.85.178,10.0.2.15,TCP,60,9001  >  35978 [ACK] Seq=8273211 Ack=151092339 Win=65535 Len=0
1,10.99983999999995,10.0.2.15,62.210.85.178,TLSv1.2,1226,Application Data
1,10.999874999999975,62.210.85.178,10.0.2.15,TCP,60,9001  >  35978 [ACK] Seq=8273211 Ack=151093511 Win=65535 Len=0
1,10.999916999999641,10.0.2.15,62.210.85.178,TLSv1.2,4124,Application Data
1,10.999953000000005,62.210.85.178,10.0.2.15,TCP,60,9001  >  35978 [ACK] Seq=8273211 Ack=151094971 Win=65535 Len=0
1,10.999960999999985,62.210.85.178,10.0.2.15,TCP,60,9001  >  35978 [ACK] Seq=8273211 Ack=151096431 Win=65535 Len=0
1,10.999963999999636,62.210.85.178,10.0.2.15,TCP,60,9001  >  35978 [ACK] Seq=8273211 Ack=151097581 Win=65535 Len=0
1,11.000001999999768,10.0.2.15,62.210.85.178,TLSv1.2,3030,Application Data
1,11.000037999999677,62.210.85.178,10.0.2.15,TCP,60,9001  >  35978 [ACK] Seq=8273211 Ack=151099041 Win=65535 Len=0
1,11.000045999999656,62.210.85.178,10.0.2.15,TCP,60,9001  >  35978 [ACK] Seq=8273211 Ack=151100501 Win=65535 Len=0
1,11.000048999999763,62.210.85.178,10.0.2.15,TCP,60,9001  >  35978 [ACK] Seq=8273211 Ack=151100557 Win=65535 Len=0
1,11.009424999999737,10.0.2.15,62.210.85.178,TLSv1.2,4124,Application Data
1,11.00957900000003,62.210.85.178,10.0.2.15,TCP,60,9001  >  35978 [ACK] Seq=8273211 Ack=151102017 Win=65535 Len=0
1,11.009599999999864,62.210.85.178,10.0.2.15,TCP,60,9001  >  35978 [ACK] Seq=8273211 Ack=151103477 Win=65535 Len=0
1,11.009603999999854,62.210.85.178,10.0.2.15,TCP,60,9001  >  35978 [ACK] Seq=8273211 Ack=151104627 Win=65535 Len=0
1,11.00963899999988,10.0.2.15,62.210.85.178,TCP,2974,35978  >  9001 [ACK] Seq=151104627 Ack=8273211 Win=65535 Len=2920 [TCP segment of a reassembled PDU]
1,11.009706999999707,10.0.2.15,62.210.85.178,TLSv1.2,1204,Application Data
1,11.009749999999713,62.210.85.178,10.0.2.15,TCP,60,9001  >  35978 [ACK] Seq=8273211 Ack=151106087 Win=65535 Len=0
1,11.009757999999692,62.210.85.178,10.0.2.15,TCP,60,9001  >  35978 [ACK] Seq=8273211 Ack=151107547 Win=65535 Len=0
1,11.009761999999682,62.210.85.178,10.0.2.15,TCP,60,9001  >  35978 [ACK] Seq=8273211 Ack=151108697 Win=65535 Len=0
1,11.009804999999687,10.0.2.15,62.210.85.178,TLSv1.2,4124,Application Data
1,11.009861,62.210.85.178,10.0.2.15,TCP,60,9001  >  35978 [ACK] Seq=8273211 Ack=151110157 Win=65535 Len=0
1,11.009870999999748,62.210.85.178,10.0.2.15,TCP,60,9001  >  35978 [ACK] Seq=8273211 Ack=151111617 Win=65535 Len=0
1,11.009876000000077,62.210.85.178,10.0.2.15,TCP,60,9001  >  35978 [ACK] Seq=8273211 Ack=151112767 Win=65535 Len=0
1,11.009933999999703,10.0.2.15,62.210.85.178,TLSv1.2,4124,Application Data
1,11.01000699999986,62.210.85.178,10.0.2.15,TCP,60,9001  >  35978 [ACK] Seq=8273211 Ack=151114227 Win=65535 Len=0
1,11.010017000000062,62.210.85.178,10.0.2.15,TCP,60,9001  >  35978 [ACK] Seq=8273211 Ack=151115687 Win=65535 Len=0
1,11.010021000000052,62.210.85.178,10.0.2.15,TCP,60,9001  >  35978 [ACK] Seq=8273211 Ack=151116837 Win=65535 Len=0
1,11.010072000000036,10.0.2.15,62.210.85.178,TLSv1.2,332,Application Data
1,11.010120999999799,62.210.85.178,10.0.2.15,TCP,60,9001  >  35978 [ACK] Seq=8273211 Ack=151117115 Win=65535 Len=0
1,11.010205000000042,10.0.2.15,62.210.85.178,TLSv1.2,3868,Application Data
1,11.010327999999845,62.210.85.178,10.0.2.15,TCP,60,9001  >  35978 [ACK] Seq=8273211 Ack=151118575 Win=65535 Len=0
1,11.010354000000007,62.210.85.178,10.0.2.15,TCP,60,9001  >  35978 [ACK] Seq=8273211 Ack=151120035 Win=65535 Len=0
1,11.01035899999988,62.210.85.178,10.0.2.15,TCP,60,9001  >  35978 [ACK] Seq=8273211 Ack=151120929 Win=65535 Len=0
1,11.010421999999835,10.0.2.15,62.210.85.178,TLSv1.2,4124,Application Data
1,11.010708999999679,62.210.85.178,10.0.2.15,TCP,60,9001  >  35978 [ACK] Seq=8273211 Ack=151122389 Win=65535 Len=0
1,11.010773999999856,62.210.85.178,10.0.2.15,TCP,60,9001  >  35978 [ACK] Seq=8273211 Ack=151123849 Win=65535 Len=0
1,11.01078699999971,62.210.85.178,10.0.2.15,TCP,60,9001  >  35978 [ACK] Seq=8273211 Ack=151124999 Win=65535 Len=0
1,11.010929000000033,10.0.2.15,62.210.85.178,TLSv1.2,3030,Application Data
1,11.01114299999972,62.210.85.178,10.0.2.15,TCP,60,9001  >  35978 [ACK] Seq=8273211 Ack=151126459 Win=65535 Len=0
1,11.011157999999796,62.210.85.178,10.0.2.15,TCP,60,9001  >  35978 [ACK] Seq=8273211 Ack=151127919 Win=65535 Len=0
1,11.011161999999786,62.210.85.178,10.0.2.15,TCP,60,9001  >  35978 [ACK] Seq=8273211 Ack=151127975 Win=65535 Len=0
1,11.022727999999915,10.0.2.15,62.210.85.178,TLSv1.2,4124,Application Data
1,11.022921999999653,10.0.2.15,62.210.85.178,TCP,2974,35978  >  9001 [ACK] Seq=151132045 Ack=8273211 Win=65535 Len=2920 [TCP segment of a reassembled PDU]
1,11.022973999999977,62.210.85.178,10.0.2.15,TCP,60,9001  >  35978 [ACK] Seq=8273211 Ack=151129435 Win=65535 Len=0
1,11.02298699999983,62.210.85.178,10.0.2.15,TCP,60,9001  >  35978 [ACK] Seq=8273211 Ack=151130895 Win=65535 Len=0
1,11.022991999999704,62.210.85.178,10.0.2.15,TCP,60,9001  >  35978 [ACK] Seq=8273211 Ack=151132045 Win=65535 Len=0
1,11.023739999999634,10.0.2.15,62.210.85.178,TLSv1.2,1204,Application Data
1,11.023909999999887,62.210.85.178,10.0.2.15,TCP,60,9001  >  35978 [ACK] Seq=8273211 Ack=151133505 Win=65535 Len=0
1,11.023921999999857,62.210.85.178,10.0.2.15,TCP,60,9001  >  35978 [ACK] Seq=8273211 Ack=151134965 Win=65535 Len=0
1,11.02392699999973,62.210.85.178,10.0.2.15,TCP,60,9001  >  35978 [ACK] Seq=8273211 Ack=151136115 Win=65535 Len=0
1,11.023992999999791,10.0.2.15,62.210.85.178,TLSv1.2,204,Application Data
1,11.024116999999933,62.210.85.178,10.0.2.15,TCP,60,9001  >  35978 [ACK] Seq=8273211 Ack=151136265 Win=65535 Len=0
1,11.098320999999942,54.93.77.70,10.0.2.15,TLSv1.2,590,Application Data
1,11.137134999999944,54.93.77.70,10.0.2.15,TLSv1.2,5846,Application Data
1,11.137248,10.0.2.15,54.93.77.70,TCP,54,34692  >  9001 [ACK] Seq=8305133 Ack=150928721 Win=65535 Len=0
1,11.137283999999909,54.93.77.70,10.0.2.15,TLSv1.2,1502,Application Data
1,11.137374999999793,10.0.2.15,54.93.77.70,TCP,54,34692  >  9001 [ACK] Seq=8305133 Ack=150930169 Win=65535 Len=0
1,11.156651999999667,54.93.77.70,10.0.2.15,TCP,2950,"9001  >  34692 [PSH, ACK] Seq=150930169 Ack=8305133 Win=65535 Len=2896 [TCP segment of a reassembled PDU]"
1,11.156783999999789,10.0.2.15,54.93.77.70,TCP,54,34692  >  9001 [ACK] Seq=8305133 Ack=150933065 Win=65535 Len=0
1,11.156912999999804,54.93.77.70,10.0.2.15,TLSv1.2,1314,"Application Data, Application Data"
1,11.169599999999718,54.93.77.70,10.0.2.15,TCP,2950,"9001  >  34692 [PSH, ACK] Seq=150934325 Ack=8305133 Win=65535 Len=2896 [TCP segment of a reassembled PDU]"
1,11.169687000000067,10.0.2.15,54.93.77.70,TCP,54,34692  >  9001 [ACK] Seq=8305133 Ack=150937221 Win=65535 Len=0
1,11.183450999999877,54.93.77.70,10.0.2.15,TLSv1.2,2950,Application Data [TCP segment of a reassembled PDU]
1,11.183598000000075,10.0.2.15,54.93.77.70,TCP,54,34692  >  9001 [ACK] Seq=8305133 Ack=150940117 Win=65535 Len=0
1,11.18364900000006,54.93.77.70,10.0.2.15,TLSv1.2,4398,Application Data [TCP segment of a reassembled PDU]
1,11.18375100000003,10.0.2.15,54.93.77.70,TCP,54,34692  >  9001 [ACK] Seq=8305133 Ack=150944461 Win=65535 Len=0
1,11.191132999999809,54.93.77.70,10.0.2.15,TLSv1.2,1292,Application Data
1,11.192323999999644,54.93.77.70,10.0.2.15,TCP,2950,"9001  >  34692 [PSH, ACK] Seq=150945699 Ack=8305133 Win=65535 Len=2896 [TCP segment of a reassembled PDU]"
1,11.192630000000008,10.0.2.15,54.93.77.70,TCP,54,34692  >  9001 [ACK] Seq=8305133 Ack=150948595 Win=65535 Len=0
1,11.204698000000008,54.93.77.70,10.0.2.15,TLSv1.2,2950,"Application Data, Application Data"
1,11.20478699999967,54.93.77.70,10.0.2.15,TCP,1474,9001  >  34692 [ACK] Seq=150951491 Ack=8305133 Win=65535 Len=1420 [TCP segment of a reassembled PDU]
1,11.204845999999634,10.0.2.15,54.93.77.70,TCP,54,34692  >  9001 [ACK] Seq=8305133 Ack=150951491 Win=65535 Len=0
1,11.204903999999715,54.93.77.70,10.0.2.15,TLSv1.2,1530,Application Data [TCP segment of a reassembled PDU]
1,11.204991999999947,10.0.2.15,54.93.77.70,TCP,54,34692  >  9001 [ACK] Seq=8305133 Ack=150954387 Win=65535 Len=0
1,11.205271999999695,10.0.2.15,54.93.77.70,TLSv1.2,590,Application Data
1,11.205920999999762,54.93.77.70,10.0.2.15,TCP,60,9001  >  34692 [ACK] Seq=150954387 Ack=8305669 Win=65535 Len=0
1,11.208251000000018,54.93.77.70,10.0.2.15,TLSv1.2,192,Application Data
1,11.214180999999826,54.93.77.70,10.0.2.15,TCP,2950,"9001  >  34692 [PSH, ACK] Seq=150954525 Ack=8305669 Win=65535 Len=2896 [TCP segment of a reassembled PDU]"
1,11.214273999999932,10.0.2.15,54.93.77.70,TCP,54,34692  >  9001 [ACK] Seq=8305669 Ack=150957421 Win=65535 Len=0
1,11.214699999999993,54.93.77.70,10.0.2.15,TLSv1.2,4398,Application Data [TCP segment of a reassembled PDU]
1,11.214795999999751,10.0.2.15,54.93.77.70,TCP,54,34692  >  9001 [ACK] Seq=8305669 Ack=150961765 Win=65535 Len=0
1,11.226921999999831,54.93.77.70,10.0.2.15,TLSv1.2,5846,"Application Data, Application Data"
1,11.227109999999811,10.0.2.15,54.93.77.70,TCP,54,34692  >  9001 [ACK] Seq=8305669 Ack=150967557 Win=65535 Len=0
1,11.227413999999953,10.0.2.15,54.93.77.70,TLSv1.2,590,Application Data
1,11.227582999999868,54.93.77.70,10.0.2.15,TCP,60,9001  >  34692 [ACK] Seq=150967557 Ack=8306205 Win=65535 Len=0
1,11.232410000000073,54.93.77.70,10.0.2.15,TLSv1.2,474,Application Data
1,11.23806999999988,54.93.77.70,10.0.2.15,TCP,1502,"9001  >  34692 [PSH, ACK] Seq=150967977 Ack=8306205 Win=65535 Len=1448 [TCP segment of a reassembled PDU]"
1,11.238153999999668,10.0.2.15,54.93.77.70,TCP,54,34692  >  9001 [ACK] Seq=8306205 Ack=150969425 Win=65535 Len=0
1,11.249047999999675,54.93.77.70,10.0.2.15,TLSv1.2,2950,Application Data [TCP segment of a reassembled PDU]
1,11.249125999999706,54.93.77.70,10.0.2.15,TCP,1502,"9001  >  34692 [PSH, ACK] Seq=150972321 Ack=8306205 Win=65535 Len=1448 [TCP segment of a reassembled PDU]"
1,11.249211999999716,10.0.2.15,54.93.77.70,TCP,54,34692  >  9001 [ACK] Seq=8306205 Ack=150972321 Win=65535 Len=0
1,11.249449999999797,10.0.2.15,54.93.77.70,TCP,54,34692  >  9001 [ACK] Seq=8306205 Ack=150973769 Win=65535 Len=0
1,11.249953999999889,54.93.77.70,10.0.2.15,TLSv1.2,4398,Application Data [TCP segment of a reassembled PDU]
1,11.25001999999995,10.0.2.15,54.93.77.70,TCP,54,34692  >  9001 [ACK] Seq=8306205 Ack=150978113 Win=65535 Len=0
1,11.25022399999989,10.0.2.15,54.93.77.70,TLSv1.2,590,Application Data
1,11.250340999999935,54.93.77.70,10.0.2.15,TCP,60,9001  >  34692 [ACK] Seq=150978113 Ack=8306741 Win=65535 Len=0
1,11.253832999999759,54.93.77.70,10.0.2.15,TLSv1.2,264,Application Data
1,11.260579999999663,54.93.77.70,10.0.2.15,TCP,2950,"9001  >  34692 [PSH, ACK] Seq=150978323 Ack=8306741 Win=65535 Len=2896 [TCP segment of a reassembled PDU]"
1,11.260755999999674,10.0.2.15,54.93.77.70,TCP,54,34692  >  9001 [ACK] Seq=8306741 Ack=150981219 Win=65535 Len=0
1,11.276906999999937,54.93.77.70,10.0.2.15,TLSv1.2,1314,"Application Data, Application Data"
1,11.282913000000008,54.93.77.70,10.0.2.15,TCP,2950,"9001  >  34692 [PSH, ACK] Seq=150982479 Ack=8306741 Win=65535 Len=2896 [TCP segment of a reassembled PDU]"
1,11.28388300000006,10.0.2.15,54.93.77.70,TCP,54,34692  >  9001 [ACK] Seq=8306741 Ack=150985375 Win=65535 Len=0
1,11.299698999999691,54.93.77.70,10.0.2.15,TLSv1.2,778,Application Data
1,11.317227000000003,62.210.85.178,10.0.2.15,TLSv1.2,590,Application Data
1,11.347088999999869,10.0.2.15,54.93.77.70,TCP,54,34692  >  9001 [ACK] Seq=8306741 Ack=150986099 Win=65535 Len=0
