No.,Time,Source,Destination,Protocol,Length,Info
1,0.024355000000014115,62.210.85.178,10.0.2.15,TLSv1.2,1126,"Application Data, Application Data"
1,0.02447600000004968,10.0.2.15,62.210.85.178,TCP,54,35978  >  9001 [ACK] Seq=149663743 Ack=8194925 Win=65535 Len=0
1,0.30291799999986324,10.0.2.15,54.93.77.70,TLSv1.2,590,Application Data
1,0.30313599999999497,54.93.77.70,10.0.2.15,TCP,60,9001  >  34692 [ACK] Seq=149512851 Ack=8227075 Win=65535 Len=0
1,0.4434219999998277,62.210.85.178,10.0.2.15,TLSv1.2,590,Application Data
1,0.44354799999973693,10.0.2.15,62.210.85.178,TCP,54,35978  >  9001 [ACK] Seq=149663743 Ack=8195461 Win=65535 Len=0
1,0.4441510000001472,10.0.2.15,62.210.85.178,TLSv1.2,590,Application Data
1,0.4442519999997785,62.210.85.178,10.0.2.15,TCP,60,9001  >  35978 [ACK] Seq=8195461 Ack=149664279 Win=65535 Len=0
1,0.7207290000001194,54.93.77.70,10.0.2.15,TLSv1.2,590,Application Data
1,0.7208209999998871,10.0.2.15,54.93.77.70,TCP,54,34692  >  9001 [ACK] Seq=8227075 Ack=149513387 Win=65535 Len=0
1,0.7212529999997059,10.0.2.15,54.93.77.70,TLSv1.2,1618,Application Data
1,0.721360999999888,54.93.77.70,10.0.2.15,TCP,60,9001  >  34692 [ACK] Seq=149513387 Ack=8228535 Win=65535 Len=0
1,0.7213739999997415,54.93.77.70,10.0.2.15,TCP,60,9001  >  34692 [ACK] Seq=149513387 Ack=8228639 Win=65535 Len=0
1,0.8236799999999675,62.210.85.178,10.0.2.15,TLSv1.2,1618,Application Data
1,0.8238289999999324,10.0.2.15,62.210.85.178,TCP,54,35978  >  9001 [ACK] Seq=149664279 Ack=8197025 Win=65535 Len=0
1,0.8469340000001466,10.0.2.15,62.210.85.178,TLSv1.2,590,Application Data
1,0.8470919999999751,62.210.85.178,10.0.2.15,TCP,60,9001  >  35978 [ACK] Seq=8197025 Ack=149664815 Win=65535 Len=0
1,0.8603140000000167,10.0.2.15,62.210.85.178,TLSv1.2,1618,Application Data
1,0.8605050000001029,62.210.85.178,10.0.2.15,TCP,60,9001  >  35978 [ACK] Seq=8197025 Ack=149666275 Win=65535 Len=0
1,0.8605379999999059,62.210.85.178,10.0.2.15,TCP,60,9001  >  35978 [ACK] Seq=8197025 Ack=149666379 Win=65535 Len=0
1,0.9430449999999837,54.93.77.70,10.0.2.15,TLSv1.2,590,Application Data
1,0.9867079999999078,10.0.2.15,54.93.77.70,TCP,54,34692  >  9001 [ACK] Seq=8228639 Ack=149513923 Win=65535 Len=0
1,0.9880849999999555,54.93.77.70,10.0.2.15,TLSv1.2,1618,Application Data
1,0.9881649999997535,10.0.2.15,54.93.77.70,TCP,54,34692  >  9001 [ACK] Seq=8228639 Ack=149515487 Win=65535 Len=0
1,0.991537999999764,10.0.2.15,54.93.77.70,TLSv1.2,590,Application Data
1,0.9920299999998861,54.93.77.70,10.0.2.15,TCP,60,9001  >  34692 [ACK] Seq=149515487 Ack=8229175 Win=65535 Len=0
1,1.131626999999753,62.210.85.178,10.0.2.15,TLSv1.2,590,Application Data
1,1.131996000000072,10.0.2.15,62.210.85.178,TLSv1.2,590,Application Data
1,1.1324749999998858,62.210.85.178,10.0.2.15,TCP,60,9001  >  35978 [ACK] Seq=8197561 Ack=149666915 Win=65535 Len=0
1,1.2516799999998511,54.93.77.70,10.0.2.15,TLSv1.2,590,Application Data
1,1.2522329999997055,10.0.2.15,54.93.77.70,TLSv1.2,590,Application Data
1,1.2525799999998526,54.93.77.70,10.0.2.15,TCP,60,9001  >  34692 [ACK] Seq=149516023 Ack=8229711 Win=65535 Len=0
1,1.3522179999999935,62.210.85.178,10.0.2.15,TLSv1.2,590,Application Data
1,1.3689789999998538,10.0.2.15,62.210.85.178,TLSv1.2,590,Application Data
1,1.369239000000107,62.210.85.178,10.0.2.15,TCP,60,9001  >  35978 [ACK] Seq=8198097 Ack=149667451 Win=65535 Len=0
1,1.3807659999997668,10.0.2.15,62.210.85.178,TLSv1.2,4124,Application Data
1,1.3810519999997268,10.0.2.15,62.210.85.178,TCP,2974,35978  >  9001 [ACK] Seq=149671521 Ack=8198097 Win=65535 Len=2920 [TCP segment of a reassembled PDU]
1,1.3811059999998179,62.210.85.178,10.0.2.15,TCP,60,9001  >  35978 [ACK] Seq=8198097 Ack=149668911 Win=65535 Len=0
1,1.3811179999997876,62.210.85.178,10.0.2.15,TCP,60,9001  >  35978 [ACK] Seq=8198097 Ack=149670371 Win=65535 Len=0
1,1.381123000000116,62.210.85.178,10.0.2.15,TCP,60,9001  >  35978 [ACK] Seq=8198097 Ack=149671521 Win=65535 Len=0
1,1.381127000000106,62.210.85.178,10.0.2.15,TCP,60,9001  >  35978 [ACK] Seq=8198097 Ack=149672981 Win=65535 Len=0
1,1.3811319999999796,62.210.85.178,10.0.2.15,TCP,60,9001  >  35978 [ACK] Seq=8198097 Ack=149674441 Win=65535 Len=0
1,1.3811799999998584,10.0.2.15,62.210.85.178,TLSv1.2,1204,Application Data
1,1.3812600000001112,62.210.85.178,10.0.2.15,TCP,60,9001  >  35978 [ACK] Seq=8198097 Ack=149675591 Win=65535 Len=0
1,1.3813099999997576,10.0.2.15,62.210.85.178,TLSv1.2,4124,Application Data
1,1.3813930000001164,62.210.85.178,10.0.2.15,TCP,60,9001  >  35978 [ACK] Seq=8198097 Ack=149677051 Win=65535 Len=0
1,1.38140199999998,62.210.85.178,10.0.2.15,TCP,60,9001  >  35978 [ACK] Seq=8198097 Ack=149678511 Win=65535 Len=0
1,1.38140599999997,62.210.85.178,10.0.2.15,TCP,60,9001  >  35978 [ACK] Seq=8198097 Ack=149679661 Win=65535 Len=0
1,1.381448999999975,10.0.2.15,62.210.85.178,TLSv1.2,4124,Application Data
1,1.3815249999997832,62.210.85.178,10.0.2.15,TCP,60,9001  >  35978 [ACK] Seq=8198097 Ack=149681121 Win=65535 Len=0
1,1.381532999999763,62.210.85.178,10.0.2.15,TCP,60,9001  >  35978 [ACK] Seq=8198097 Ack=149682581 Win=65535 Len=0
1,1.3815369999997529,62.210.85.178,10.0.2.15,TCP,60,9001  >  35978 [ACK] Seq=8198097 Ack=149683731 Win=65535 Len=0
1,1.3815730000001167,10.0.2.15,62.210.85.178,TLSv1.2,332,Application Data
1,1.3816130000000157,62.210.85.178,10.0.2.15,TCP,60,9001  >  35978 [ACK] Seq=8198097 Ack=149684009 Win=65535 Len=0
1,1.381680999999844,10.0.2.15,62.210.85.178,TLSv1.2,3868,Application Data
1,1.381724999999733,62.210.85.178,10.0.2.15,TCP,60,9001  >  35978 [ACK] Seq=8198097 Ack=149685469 Win=65535 Len=0
1,1.3817329999997128,62.210.85.178,10.0.2.15,TCP,60,9001  >  35978 [ACK] Seq=8198097 Ack=149686929 Win=65535 Len=0
1,1.3817369999997027,62.210.85.178,10.0.2.15,TCP,60,9001  >  35978 [ACK] Seq=8198097 Ack=149687823 Win=65535 Len=0
1,1.3817949999997836,10.0.2.15,62.210.85.178,TLSv1.2,4124,Application Data
1,1.3818379999997887,62.210.85.178,10.0.2.15,TCP,60,9001  >  35978 [ACK] Seq=8198097 Ack=149689283 Win=65535 Len=0
1,1.381844000000001,62.210.85.178,10.0.2.15,TCP,60,9001  >  35978 [ACK] Seq=8198097 Ack=149690743 Win=65535 Len=0
1,1.3818489999998746,62.210.85.178,10.0.2.15,TCP,60,9001  >  35978 [ACK] Seq=8198097 Ack=149691893 Win=65535 Len=0
1,1.3818949999999859,10.0.2.15,62.210.85.178,TLSv1.2,3030,Application Data
1,1.3819370000001072,62.210.85.178,10.0.2.15,TCP,60,9001  >  35978 [ACK] Seq=8198097 Ack=149693353 Win=65535 Len=0
1,1.3819439999997485,62.210.85.178,10.0.2.15,TCP,60,9001  >  35978 [ACK] Seq=8198097 Ack=149694813 Win=65535 Len=0
1,1.3819479999997384,62.210.85.178,10.0.2.15,TCP,60,9001  >  35978 [ACK] Seq=8198097 Ack=149694869 Win=65535 Len=0
1,1.3912900000000263,10.0.2.15,62.210.85.178,TLSv1.2,4124,Application Data
1,1.391559000000143,62.210.85.178,10.0.2.15,TCP,60,9001  >  35978 [ACK] Seq=8198097 Ack=149696329 Win=65535 Len=0
1,1.3916129999997793,62.210.85.178,10.0.2.15,TCP,60,9001  >  35978 [ACK] Seq=8198097 Ack=149697789 Win=65535 Len=0
1,1.3916269999999713,62.210.85.178,10.0.2.15,TCP,60,9001  >  35978 [ACK] Seq=8198097 Ack=149698939 Win=65535 Len=0
1,1.391783999999916,10.0.2.15,62.210.85.178,TLSv1.2,4124,Application Data
1,1.3929589999997916,10.0.2.15,62.210.85.178,TCP,2974,35978  >  9001 [ACK] Seq=149703009 Ack=8198097 Win=65535 Len=2920 [TCP segment of a reassembled PDU]
1,1.3932639999998173,62.210.85.178,10.0.2.15,TCP,60,9001  >  35978 [ACK] Seq=8198097 Ack=149700399 Win=65535 Len=0
1,1.3933520000000499,62.210.85.178,10.0.2.15,TCP,60,9001  >  35978 [ACK] Seq=8198097 Ack=149701859 Win=65535 Len=0
1,1.3933659999997872,62.210.85.178,10.0.2.15,TCP,60,9001  >  35978 [ACK] Seq=8198097 Ack=149703009 Win=65535 Len=0
1,1.3935599999999795,10.0.2.15,62.210.85.178,TLSv1.2,1204,Application Data
1,1.396132999999736,62.210.85.178,10.0.2.15,TCP,60,9001  >  35978 [ACK] Seq=8198097 Ack=149704469 Win=65535 Len=0
1,1.3964149999997062,62.210.85.178,10.0.2.15,TCP,60,9001  >  35978 [ACK] Seq=8198097 Ack=149705929 Win=65535 Len=0
1,1.3965049999997063,62.210.85.178,10.0.2.15,TCP,60,9001  >  35978 [ACK] Seq=8198097 Ack=149707079 Win=65535 Len=0
1,1.3970829999998386,10.0.2.15,62.210.85.178,TLSv1.2,4124,Application Data
1,1.3972749999998086,62.210.85.178,10.0.2.15,TCP,60,9001  >  35978 [ACK] Seq=8198097 Ack=149708539 Win=65535 Len=0
1,1.3972909999997682,62.210.85.178,10.0.2.15,TCP,60,9001  >  35978 [ACK] Seq=8198097 Ack=149709999 Win=65535 Len=0
1,1.3972960000000967,62.210.85.178,10.0.2.15,TCP,60,9001  >  35978 [ACK] Seq=8198097 Ack=149711149 Win=65535 Len=0
1,1.3973439999999755,10.0.2.15,62.210.85.178,TLSv1.2,332,Application Data
1,1.3973889999997482,62.210.85.178,10.0.2.15,TCP,60,9001  >  35978 [ACK] Seq=8198097 Ack=149711427 Win=65535 Len=0
1,1.3974589999997988,10.0.2.15,62.210.85.178,TLSv1.2,3868,Application Data
1,1.397501999999804,62.210.85.178,10.0.2.15,TCP,60,9001  >  35978 [ACK] Seq=8198097 Ack=149712887 Win=65535 Len=0
1,1.3975099999997838,62.210.85.178,10.0.2.15,TCP,60,9001  >  35978 [ACK] Seq=8198097 Ack=149714347 Win=65535 Len=0
1,1.3975139999997737,62.210.85.178,10.0.2.15,TCP,60,9001  >  35978 [ACK] Seq=8198097 Ack=149715241 Win=65535 Len=0
1,1.3975649999997586,10.0.2.15,62.210.85.178,TLSv1.2,4124,Application Data
1,1.3976090000001022,62.210.85.178,10.0.2.15,TCP,60,9001  >  35978 [ACK] Seq=8198097 Ack=149716701 Win=65535 Len=0
1,1.3976159999997435,62.210.85.178,10.0.2.15,TCP,60,9001  >  35978 [ACK] Seq=8198097 Ack=149718161 Win=65535 Len=0
1,1.3976199999997334,62.210.85.178,10.0.2.15,TCP,60,9001  >  35978 [ACK] Seq=8198097 Ack=149719311 Win=65535 Len=0
1,1.3976669999997284,10.0.2.15,62.210.85.178,TLSv1.2,3030,Application Data
1,1.3977119999999559,62.210.85.178,10.0.2.15,TCP,60,9001  >  35978 [ACK] Seq=8198097 Ack=149720771 Win=65535 Len=0
1,1.397719000000052,62.210.85.178,10.0.2.15,TCP,60,9001  >  35978 [ACK] Seq=8198097 Ack=149722231 Win=65535 Len=0
1,1.3977230000000418,62.210.85.178,10.0.2.15,TCP,60,9001  >  35978 [ACK] Seq=8198097 Ack=149722287 Win=65535 Len=0
1,1.4031089999998585,10.0.2.15,62.210.85.178,TLSv1.2,4124,Application Data
1,1.4033879999997225,10.0.2.15,62.210.85.178,TCP,2974,35978  >  9001 [ACK] Seq=149726357 Ack=8198097 Win=65535 Len=2920 [TCP segment of a reassembled PDU]
1,1.4034790000000612,62.210.85.178,10.0.2.15,TCP,60,9001  >  35978 [ACK] Seq=8198097 Ack=149723747 Win=65535 Len=0
1,1.4035060000001067,62.210.85.178,10.0.2.15,TCP,60,9001  >  35978 [ACK] Seq=8198097 Ack=149725207 Win=65535 Len=0
1,1.4035140000000865,62.210.85.178,10.0.2.15,TCP,60,9001  >  35978 [ACK] Seq=8198097 Ack=149726357 Win=65535 Len=0
1,1.4035209999997278,62.210.85.178,10.0.2.15,TCP,60,9001  >  35978 [ACK] Seq=8198097 Ack=149727817 Win=65535 Len=0
1,1.4035279999998238,62.210.85.178,10.0.2.15,TCP,60,9001  >  35978 [ACK] Seq=8198097 Ack=149729277 Win=65535 Len=0
1,1.403592000000117,10.0.2.15,62.210.85.178,TLSv1.2,1204,Application Data
1,1.4036590000000615,62.210.85.178,10.0.2.15,TCP,60,9001  >  35978 [ACK] Seq=8198097 Ack=149730427 Win=65535 Len=0
1,1.403903999999784,10.0.2.15,62.210.85.178,TLSv1.2,4124,Application Data
1,1.403957999999875,62.210.85.178,10.0.2.15,TCP,60,9001  >  35978 [ACK] Seq=8198097 Ack=149731887 Win=65535 Len=0
1,1.403968999999961,62.210.85.178,10.0.2.15,TCP,60,9001  >  35978 [ACK] Seq=8198097 Ack=149733347 Win=65535 Len=0
1,1.4039739999998346,62.210.85.178,10.0.2.15,TCP,60,9001  >  35978 [ACK] Seq=8198097 Ack=149734497 Win=65535 Len=0
1,1.4040249999998196,10.0.2.15,62.210.85.178,TLSv1.2,4124,Application Data
1,1.4040679999998247,62.210.85.178,10.0.2.15,TCP,60,9001  >  35978 [ACK] Seq=8198097 Ack=149735957 Win=65535 Len=0
1,1.4040759999998045,62.210.85.178,10.0.2.15,TCP,60,9001  >  35978 [ACK] Seq=8198097 Ack=149737417 Win=65535 Len=0
1,1.4040799999997944,62.210.85.178,10.0.2.15,TCP,60,9001  >  35978 [ACK] Seq=8198097 Ack=149738567 Win=65535 Len=0
1,1.4041179999999258,10.0.2.15,62.210.85.178,TLSv1.2,332,Application Data
1,1.404156999999941,62.210.85.178,10.0.2.15,TCP,60,9001  >  35978 [ACK] Seq=8198097 Ack=149738845 Win=65535 Len=0
1,1.4042209999997795,10.0.2.15,62.210.85.178,TLSv1.2,3674,Application Data
1,1.4042629999999008,62.210.85.178,10.0.2.15,TCP,60,9001  >  35978 [ACK] Seq=8198097 Ack=149740305 Win=65535 Len=0
1,1.4042719999997644,62.210.85.178,10.0.2.15,TCP,60,9001  >  35978 [ACK] Seq=8198097 Ack=149741765 Win=65535 Len=0
1,1.4042759999997543,62.210.85.178,10.0.2.15,TCP,60,9001  >  35978 [ACK] Seq=8198097 Ack=149742465 Win=65535 Len=0
1,1.4800199999999677,54.93.77.70,10.0.2.15,TLSv1.2,590,Application Data
1,1.489162999999735,54.93.77.70,10.0.2.15,TCP,2950,"9001  >  34692 [PSH, ACK] Seq=149516559 Ack=8229711 Win=65535 Len=2896 [TCP segment of a reassembled PDU]"
1,1.4893090000000484,10.0.2.15,54.93.77.70,TCP,54,34692  >  9001 [ACK] Seq=8229711 Ack=149519455 Win=65535 Len=0
1,1.5035389999998188,54.93.77.70,10.0.2.15,TLSv1.2,4398,"Application Data, Application Data"
1,1.5039429999997083,10.0.2.15,54.93.77.70,TCP,54,34692  >  9001 [ACK] Seq=8229711 Ack=149523799 Win=65535 Len=0
1,1.5045529999997598,10.0.2.15,54.93.77.70,TLSv1.2,590,Application Data
1,1.5046919999999773,54.93.77.70,10.0.2.15,TCP,60,9001  >  34692 [ACK] Seq=149523799 Ack=8230247 Win=65535 Len=0
1,1.563806999999997,54.93.77.70,10.0.2.15,TLSv1.2,3674,Application Data
1,1.5639659999997093,10.0.2.15,54.93.77.70,TCP,54,34692  >  9001 [ACK] Seq=8230247 Ack=149527419 Win=65535 Len=0
1,1.578751999999895,54.93.77.70,10.0.2.15,TCP,2950,"9001  >  34692 [PSH, ACK] Seq=149527419 Ack=8230247 Win=65535 Len=2896 [TCP segment of a reassembled PDU]"
1,1.5790670000001228,10.0.2.15,54.93.77.70,TCP,54,34692  >  9001 [ACK] Seq=8230247 Ack=149530315 Win=65535 Len=0
1,1.5800019999996948,54.93.77.70,10.0.2.15,TLSv1.2,778,Application Data
1,1.6006569999999556,54.93.77.70,10.0.2.15,TLSv1.2,4398,Application Data
1,1.6008080000001428,10.0.2.15,54.93.77.70,TCP,54,34692  >  9001 [ACK] Seq=8230247 Ack=149535383 Win=65535 Len=0
1,1.610768999999891,54.93.77.70,10.0.2.15,TLSv1.2,7294,"Application Data, Application Data, Application Data"
1,1.6118579999997564,10.0.2.15,54.93.77.70,TCP,54,34692  >  9001 [ACK] Seq=8230247 Ack=149542623 Win=65535 Len=0
1,1.6174259999997957,54.93.77.70,10.0.2.15,TLSv1.2,1430,Application Data
1,1.6179250000000138,10.0.2.15,54.93.77.70,TLSv1.2,590,Application Data
1,1.6180799999997362,54.93.77.70,10.0.2.15,TCP,60,9001  >  34692 [ACK] Seq=149543999 Ack=8230783 Win=65535 Len=0
1,1.6310680000001412,54.93.77.70,10.0.2.15,TCP,2950,"9001  >  34692 [PSH, ACK] Seq=149543999 Ack=8230783 Win=65535 Len=2896 [TCP segment of a reassembled PDU]"
1,1.6311919999998281,10.0.2.15,54.93.77.70,TCP,54,34692  >  9001 [ACK] Seq=8230783 Ack=149546895 Win=65535 Len=0
1,1.634911000000102,54.93.77.70,10.0.2.15,TLSv1.2,778,Application Data
1,1.6429299999999785,54.93.77.70,10.0.2.15,TLSv1.2,5846,Application Data
1,1.642996999999923,54.93.77.70,10.0.2.15,TLSv1.2,4398,Application Data [TCP segment of a reassembled PDU]
1,1.643004000000019,62.210.85.178,10.0.2.15,TLSv1.2,590,Application Data
1,1.6431609999999637,10.0.2.15,54.93.77.70,TCP,54,34692  >  9001 [ACK] Seq=8230783 Ack=149557755 Win=65535 Len=0
1,1.6597889999998188,54.93.77.70,10.0.2.15,TLSv1.2,778,Application Data
1,1.6616789999998218,54.93.77.70,10.0.2.15,TCP,2950,"9001  >  34692 [PSH, ACK] Seq=149558479 Ack=8230783 Win=65535 Len=2896 [TCP segment of a reassembled PDU]"
1,1.661714999999731,54.93.77.70,10.0.2.15,TLSv1.2,4398,Application Data [TCP segment of a reassembled PDU]
1,1.6617769999998018,10.0.2.15,54.93.77.70,TCP,54,34692  >  9001 [ACK] Seq=8230783 Ack=149561375 Win=65535 Len=0
1,1.6618840000001,54.93.77.70,10.0.2.15,TLSv1.2,1502,Application Data [TCP segment of a reassembled PDU]
1,1.6619390000000749,10.0.2.15,54.93.77.70,TCP,54,34692  >  9001 [ACK] Seq=8230783 Ack=149567167 Win=65535 Len=0
1,1.6778449999997065,54.93.77.70,10.0.2.15,TLSv1.2,706,"Application Data, Application Data"
1,1.678241000000071,10.0.2.15,54.93.77.70,TLSv1.2,590,Application Data
1,1.678378000000066,54.93.77.70,10.0.2.15,TCP,60,9001  >  34692 [ACK] Seq=149567819 Ack=8231319 Win=65535 Len=0
1,1.6820410000000265,54.93.77.70,10.0.2.15,TLSv1.2,4398,Application Data
1,1.6821529999997438,10.0.2.15,54.93.77.70,TCP,54,34692  >  9001 [ACK] Seq=8231319 Ack=149572163 Win=65535 Len=0
1,1.6833389999997053,54.93.77.70,10.0.2.15,TLSv1.2,7294,Application Data [TCP segment of a reassembled PDU]
1,1.6834340000000338,10.0.2.15,54.93.77.70,TCP,54,34692  >  9001 [ACK] Seq=8231319 Ack=149579403 Win=65535 Len=0
1,1.686848999999711,10.0.2.15,62.210.85.178,TCP,54,35978  >  9001 [ACK] Seq=149742465 Ack=8198633 Win=65535 Len=0
1,1.6880569999998443,10.0.2.15,54.93.77.70,TLSv1.2,590,Application Data
1,1.6882259999997586,54.93.77.70,10.0.2.15,TCP,60,9001  >  34692 [ACK] Seq=149579403 Ack=8231855 Win=65535 Len=0
1,1.6949580000000424,54.93.77.70,10.0.2.15,TLSv1.2,358,Application Data
1,1.6971209999996972,54.93.77.70,10.0.2.15,TCP,2950,"9001  >  34692 [PSH, ACK] Seq=149579707 Ack=8231855 Win=65535 Len=2896 [TCP segment of a reassembled PDU]"
1,1.6972499999997126,10.0.2.15,54.93.77.70,TCP,54,34692  >  9001 [ACK] Seq=8231855 Ack=149582603 Win=65535 Len=0
1,1.7074419999999009,54.93.77.70,10.0.2.15,TLSv1.2,2950,Application Data [TCP segment of a reassembled PDU]
1,1.7075509999999667,10.0.2.15,54.93.77.70,TCP,54,34692  >  9001 [ACK] Seq=8231855 Ack=149585499 Win=65535 Len=0
1,1.707625999999891,54.93.77.70,10.0.2.15,TLSv1.2,4398,Application Data [TCP segment of a reassembled PDU]
1,1.7077319999998508,10.0.2.15,54.93.77.70,TCP,54,34692  >  9001 [ACK] Seq=8231855 Ack=149589843 Win=65535 Len=0
1,1.7131749999998647,54.93.77.70,10.0.2.15,TLSv1.2,778,Application Data
1,1.7387079999998605,62.210.85.178,10.0.2.15,TLSv1.2,590,Application Data
1,1.7388209999999162,10.0.2.15,62.210.85.178,TCP,54,35978  >  9001 [ACK] Seq=149742465 Ack=8199169 Win=65535 Len=0
1,1.7547859999999673,10.0.2.15,54.93.77.70,TCP,54,34692  >  9001 [ACK] Seq=8231855 Ack=149590567 Win=65535 Len=0
1,1.7717400000001362,54.93.77.70,10.0.2.15,TLSv1.2,1104,Application Data
1,1.7719889999998486,10.0.2.15,54.93.77.70,TCP,54,34692  >  9001 [ACK] Seq=8231855 Ack=149591617 Win=65535 Len=0
1,1.7766639999999825,10.0.2.15,54.93.77.70,TLSv1.2,590,Application Data
1,1.7770019999998112,54.93.77.70,10.0.2.15,TCP,60,9001  >  34692 [ACK] Seq=149591617 Ack=8232391 Win=65535 Len=0
1,1.7880420000001322,62.210.85.178,10.0.2.15,TLSv1.2,1104,Application Data
1,1.7882759999997688,10.0.2.15,62.210.85.178,TCP,54,35978  >  9001 [ACK] Seq=149742465 Ack=8200219 Win=65535 Len=0
1,1.8820749999999862,62.210.85.178,10.0.2.15,TLSv1.2,590,Application Data
1,1.8821939999997994,10.0.2.15,62.210.85.178,TCP,54,35978  >  9001 [ACK] Seq=149742465 Ack=8200755 Win=65535 Len=0
1,1.8828269999999065,10.0.2.15,62.210.85.178,TLSv1.2,590,Application Data
1,1.8831009999998969,62.210.85.178,10.0.2.15,TCP,60,9001  >  35978 [ACK] Seq=8200755 Ack=149743001 Win=65535 Len=0
1,2.0212870000000294,54.93.77.70,10.0.2.15,TLSv1.2,590,Application Data
1,2.0220610000001216,10.0.2.15,54.93.77.70,TLSv1.2,590,Application Data
1,2.0225139999997737,54.93.77.70,10.0.2.15,TCP,60,9001  >  34692 [ACK] Seq=149592153 Ack=8232927 Win=65535 Len=0
1,2.4613759999997455,62.210.85.178,10.0.2.15,TLSv1.2,590,Application Data
1,2.4649529999996957,10.0.2.15,62.210.85.178,TLSv1.2,590,Application Data
1,2.4650990000000093,62.210.85.178,10.0.2.15,TCP,60,9001  >  35978 [ACK] Seq=8201291 Ack=149743537 Win=65535 Len=0
1,2.479291000000103,10.0.2.15,62.210.85.178,TLSv1.2,4124,Application Data
1,2.479440000000068,10.0.2.15,62.210.85.178,TCP,2974,35978  >  9001 [ACK] Seq=149747607 Ack=8201291 Win=65535 Len=2920 [TCP segment of a reassembled PDU]
1,2.4794859999997243,62.210.85.178,10.0.2.15,TCP,60,9001  >  35978 [ACK] Seq=8201291 Ack=149744997 Win=65535 Len=0
1,2.479497999999694,62.210.85.178,10.0.2.15,TCP,60,9001  >  35978 [ACK] Seq=8201291 Ack=149746457 Win=65535 Len=0
1,2.4795030000000224,62.210.85.178,10.0.2.15,TCP,60,9001  >  35978 [ACK] Seq=8201291 Ack=149747607 Win=65535 Len=0
1,2.4795070000000123,62.210.85.178,10.0.2.15,TCP,60,9001  >  35978 [ACK] Seq=8201291 Ack=149749067 Win=65535 Len=0
1,2.4795110000000022,62.210.85.178,10.0.2.15,TCP,60,9001  >  35978 [ACK] Seq=8201291 Ack=149750527 Win=65535 Len=0
1,2.479558999999881,10.0.2.15,62.210.85.178,TLSv1.2,1204,Application Data
1,2.4796309999996993,10.0.2.15,62.210.85.178,TCP,2974,35978  >  9001 [ACK] Seq=149751677 Ack=8201291 Win=65535 Len=2920 [TCP segment of a reassembled PDU]
1,2.4796799999999166,62.210.85.178,10.0.2.15,TCP,60,9001  >  35978 [ACK] Seq=8201291 Ack=149751677 Win=65535 Len=0
1,2.4796879999998964,62.210.85.178,10.0.2.15,TCP,60,9001  >  35978 [ACK] Seq=8201291 Ack=149753137 Win=65535 Len=0
1,2.4796919999998863,62.210.85.178,10.0.2.15,TCP,60,9001  >  35978 [ACK] Seq=8201291 Ack=149754597 Win=65535 Len=0
1,2.4797279999997954,10.0.2.15,62.210.85.178,TLSv1.2,1204,Application Data
1,2.47979499999974,10.0.2.15,62.210.85.178,TCP,2974,35978  >  9001 [ACK] Seq=149755747 Ack=8201291 Win=65535 Len=2920 [TCP segment of a reassembled PDU]
1,2.479831000000104,62.210.85.178,10.0.2.15,TCP,60,9001  >  35978 [ACK] Seq=8201291 Ack=149755747 Win=65535 Len=0
1,2.479837999999745,62.210.85.178,10.0.2.15,TCP,60,9001  >  35978 [ACK] Seq=8201291 Ack=149757207 Win=65535 Len=0
1,2.479841999999735,62.210.85.178,10.0.2.15,TCP,60,9001  >  35978 [ACK] Seq=8201291 Ack=149758667 Win=65535 Len=0
1,2.4798749999999927,10.0.2.15,62.210.85.178,TLSv1.2,1204,Application Data
1,2.4799370000000636,62.210.85.178,10.0.2.15,TCP,60,9001  >  35978 [ACK] Seq=8201291 Ack=149759817 Win=65535 Len=0
1,2.4799779999998464,10.0.2.15,62.210.85.178,TLSv1.2,332,Application Data
1,2.4800169999998616,62.210.85.178,10.0.2.15,TCP,60,9001  >  35978 [ACK] Seq=8201291 Ack=149760095 Win=65535 Len=0
1,2.480079999999816,10.0.2.15,62.210.85.178,TLSv1.2,3868,Application Data
1,2.4801229999998213,62.210.85.178,10.0.2.15,TCP,60,9001  >  35978 [ACK] Seq=8201291 Ack=149761555 Win=65535 Len=0
1,2.4801299999999173,62.210.85.178,10.0.2.15,TCP,60,9001  >  35978 [ACK] Seq=8201291 Ack=149763015 Win=65535 Len=0
1,2.4801339999999072,62.210.85.178,10.0.2.15,TCP,60,9001  >  35978 [ACK] Seq=8201291 Ack=149763909 Win=65535 Len=0
1,2.4801800000000185,10.0.2.15,62.210.85.178,TLSv1.2,1424,Application Data
1,2.4802209999998013,62.210.85.178,10.0.2.15,TCP,60,9001  >  35978 [ACK] Seq=8201291 Ack=149765279 Win=65535 Len=0
1,2.5858119999998053,54.93.77.70,10.0.2.15,TLSv1.2,590,Application Data
1,2.5960799999998017,54.93.77.70,10.0.2.15,TLSv1.2,4398,Application Data
1,2.5961859999997614,54.93.77.70,10.0.2.15,TLSv1.2,2950,Application Data
1,2.5964239999998426,10.0.2.15,54.93.77.70,TCP,54,34692  >  9001 [ACK] Seq=8232927 Ack=149599929 Win=65535 Len=0
1,2.6176660000000993,54.93.77.70,10.0.2.15,TLSv1.2,4398,Application Data
1,2.617780000000039,10.0.2.15,54.93.77.70,TCP,54,34692  >  9001 [ACK] Seq=8232927 Ack=149604273 Win=65535 Len=0
1,2.619858999999906,54.93.77.70,10.0.2.15,TCP,2950,"9001  >  34692 [PSH, ACK] Seq=149604273 Ack=8232927 Win=65535 Len=2896 [TCP segment of a reassembled PDU]"
1,2.6200800000001436,10.0.2.15,54.93.77.70,TCP,54,34692  >  9001 [ACK] Seq=8232927 Ack=149607169 Win=65535 Len=0
1,2.621824999999717,54.93.77.70,10.0.2.15,TLSv1.2,7294,"Application Data, Application Data, Application Data"
1,2.6219270000001416,10.0.2.15,54.93.77.70,TCP,54,34692  >  9001 [ACK] Seq=8232927 Ack=149614409 Win=65535 Len=0
1,2.6273839999998927,10.0.2.15,54.93.77.70,TLSv1.2,590,Application Data
1,2.6276490000000194,54.93.77.70,10.0.2.15,TCP,60,9001  >  34692 [ACK] Seq=149614409 Ack=8233463 Win=65535 Len=0
1,2.942751000000044,62.210.85.178,10.0.2.15,TLSv1.2,590,Application Data
1,2.9433039999998982,10.0.2.15,62.210.85.178,TLSv1.2,590,Application Data
1,2.943435000000136,62.210.85.178,10.0.2.15,TCP,60,9001  >  35978 [ACK] Seq=8201827 Ack=149765815 Win=65535 Len=0
1,3.0639109999997345,54.93.77.70,10.0.2.15,TLSv1.2,590,Application Data
1,3.065172999999959,10.0.2.15,54.93.77.70,TLSv1.2,590,Application Data
1,3.065657000000101,54.93.77.70,10.0.2.15,TCP,60,9001  >  34692 [ACK] Seq=149614945 Ack=8233999 Win=65535 Len=0
1,3.207821999999851,62.210.85.178,10.0.2.15,TLSv1.2,590,Application Data
1,3.215729999999894,10.0.2.15,62.210.85.178,TLSv1.2,590,Application Data
1,3.2158949999998185,62.210.85.178,10.0.2.15,TCP,60,9001  >  35978 [ACK] Seq=8202363 Ack=149766351 Win=65535 Len=0
1,3.227632000000085,10.0.2.15,62.210.85.178,TLSv1.2,4124,Application Data
1,3.2278799999999137,62.210.85.178,10.0.2.15,TCP,60,9001  >  35978 [ACK] Seq=8202363 Ack=149767811 Win=65535 Len=0
1,3.227900999999747,62.210.85.178,10.0.2.15,TCP,60,9001  >  35978 [ACK] Seq=8202363 Ack=149769271 Win=65535 Len=0
1,3.2279060000000754,62.210.85.178,10.0.2.15,TCP,60,9001  >  35978 [ACK] Seq=8202363 Ack=149770421 Win=65535 Len=0
1,3.228005999999823,10.0.2.15,62.210.85.178,TLSv1.2,4124,Application Data
1,3.228110000000015,62.210.85.178,10.0.2.15,TCP,60,9001  >  35978 [ACK] Seq=8202363 Ack=149771881 Win=65535 Len=0
1,3.2281229999998686,62.210.85.178,10.0.2.15,TCP,60,9001  >  35978 [ACK] Seq=8202363 Ack=149773341 Win=65535 Len=0
1,3.2281279999997423,62.210.85.178,10.0.2.15,TCP,60,9001  >  35978 [ACK] Seq=8202363 Ack=149774491 Win=65535 Len=0
1,3.228196999999909,10.0.2.15,62.210.85.178,TLSv1.2,4124,Application Data
1,3.228266000000076,62.210.85.178,10.0.2.15,TCP,60,9001  >  35978 [ACK] Seq=8202363 Ack=149775951 Win=65535 Len=0
1,3.2282749999999396,62.210.85.178,10.0.2.15,TCP,60,9001  >  35978 [ACK] Seq=8202363 Ack=149777411 Win=65535 Len=0
1,3.2282789999999295,62.210.85.178,10.0.2.15,TCP,60,9001  >  35978 [ACK] Seq=8202363 Ack=149778561 Win=65535 Len=0
1,3.2283269999998083,10.0.2.15,62.210.85.178,TLSv1.2,1810,Application Data
1,3.2283870000001116,62.210.85.178,10.0.2.15,TCP,60,9001  >  35978 [ACK] Seq=8202363 Ack=149780021 Win=65535 Len=0
1,3.2283950000000914,62.210.85.178,10.0.2.15,TCP,60,9001  >  35978 [ACK] Seq=8202363 Ack=149780317 Win=65535 Len=0
1,3.3478729999997086,54.93.77.70,10.0.2.15,TLSv1.2,590,Application Data
1,3.3679990000000544,54.93.77.70,10.0.2.15,TLSv1.2,7294,"Application Data, Application Data"
1,3.3682269999999335,10.0.2.15,54.93.77.70,TCP,54,34692  >  9001 [ACK] Seq=8233999 Ack=149622721 Win=65535 Len=0
1,3.3825980000001437,54.93.77.70,10.0.2.15,TCP,2950,"9001  >  34692 [PSH, ACK] Seq=149622721 Ack=8233999 Win=65535 Len=2896 [TCP segment of a reassembled PDU]"
1,3.3828239999998004,10.0.2.15,54.93.77.70,TCP,54,34692  >  9001 [ACK] Seq=8233999 Ack=149625617 Win=65535 Len=0
1,3.385653999999704,54.93.77.70,10.0.2.15,TLSv1.2,778,Application Data
1,3.426723999999922,10.0.2.15,54.93.77.70,TCP,54,34692  >  9001 [ACK] Seq=8233999 Ack=149626341 Win=65535 Len=0
1,3.449557999999797,54.93.77.70,10.0.2.15,TLSv1.2,3160,Application Data
1,3.4496879999996963,10.0.2.15,54.93.77.70,TCP,54,34692  >  9001 [ACK] Seq=8233999 Ack=149629447 Win=65535 Len=0
1,3.450061000000005,10.0.2.15,54.93.77.70,TLSv1.2,590,Application Data
1,3.4533050000000003,54.93.77.70,10.0.2.15,TCP,60,9001  >  34692 [ACK] Seq=149629447 Ack=8234535 Win=65535 Len=0
1,3.466932999999699,10.0.2.15,54.93.77.70,TLSv1.2,590,Application Data
1,3.4672590000000127,54.93.77.70,10.0.2.15,TCP,60,9001  >  34692 [ACK] Seq=149629447 Ack=8235071 Win=65535 Len=0
1,3.5563389999997526,62.210.85.178,10.0.2.15,TLSv1.2,590,Application Data
1,3.5986769999999524,10.0.2.15,62.210.85.178,TCP,54,35978  >  9001 [ACK] Seq=149780317 Ack=8202899 Win=65535 Len=0
1,3.997609999999895,62.210.85.178,10.0.2.15,TLSv1.2,590,Application Data
1,3.997718000000077,10.0.2.15,62.210.85.178,TCP,54,35978  >  9001 [ACK] Seq=149780317 Ack=8203435 Win=65535 Len=0
1,3.998204999999871,10.0.2.15,62.210.85.178,TLSv1.2,590,Application Data
1,3.9983440000000883,62.210.85.178,10.0.2.15,TCP,60,9001  >  35978 [ACK] Seq=8203435 Ack=149780853 Win=65535 Len=0
1,4.203654999999799,54.93.77.70,10.0.2.15,TLSv1.2,590,Application Data
1,4.204315999999835,10.0.2.15,54.93.77.70,TLSv1.2,590,Application Data
1,4.20446899999979,54.93.77.70,10.0.2.15,TCP,60,9001  >  34692 [ACK] Seq=149629983 Ack=8235607 Win=65535 Len=0
1,4.407028000000082,62.210.85.178,10.0.2.15,TLSv1.2,590,Application Data
1,4.418229999999767,10.0.2.15,62.210.85.178,TLSv1.2,590,Application Data
1,4.418518999999833,62.210.85.178,10.0.2.15,TCP,60,9001  >  35978 [ACK] Seq=8203971 Ack=149781389 Win=65535 Len=0
1,4.42733700000008,10.0.2.15,62.210.85.178,TLSv1.2,4124,Application Data
1,4.427494999999908,10.0.2.15,62.210.85.178,TCP,2974,35978  >  9001 [ACK] Seq=149785459 Ack=8203971 Win=65535 Len=2920 [TCP segment of a reassembled PDU]
1,4.427556999999979,62.210.85.178,10.0.2.15,TCP,60,9001  >  35978 [ACK] Seq=8203971 Ack=149782849 Win=65535 Len=0
1,4.427569999999832,62.210.85.178,10.0.2.15,TCP,60,9001  >  35978 [ACK] Seq=8203971 Ack=149784309 Win=65535 Len=0
1,4.427573999999822,62.210.85.178,10.0.2.15,TCP,60,9001  >  35978 [ACK] Seq=8203971 Ack=149785459 Win=65535 Len=0
1,4.42762300000004,10.0.2.15,62.210.85.178,TLSv1.2,1204,Application Data
1,4.427667999999812,62.210.85.178,10.0.2.15,TCP,60,9001  >  35978 [ACK] Seq=8203971 Ack=149786919 Win=65535 Len=0
1,4.427677000000131,62.210.85.178,10.0.2.15,TCP,60,9001  >  35978 [ACK] Seq=8203971 Ack=149788379 Win=65535 Len=0
1,4.427682000000004,62.210.85.178,10.0.2.15,TCP,60,9001  >  35978 [ACK] Seq=8203971 Ack=149789529 Win=65535 Len=0
1,4.427748000000065,10.0.2.15,62.210.85.178,TLSv1.2,4124,Application Data
1,4.427793999999722,62.210.85.178,10.0.2.15,TCP,60,9001  >  35978 [ACK] Seq=8203971 Ack=149790989 Win=65535 Len=0
1,4.42780300000004,62.210.85.178,10.0.2.15,TCP,60,9001  >  35978 [ACK] Seq=8203971 Ack=149792449 Win=65535 Len=0
1,4.42780700000003,62.210.85.178,10.0.2.15,TCP,60,9001  >  35978 [ACK] Seq=8203971 Ack=149793599 Win=65535 Len=0
1,4.427861000000121,10.0.2.15,62.210.85.178,TLSv1.2,4124,Application Data
1,4.428483000000142,62.210.85.178,10.0.2.15,TCP,60,9001  >  35978 [ACK] Seq=8203971 Ack=149795059 Win=65535 Len=0
1,4.428503000000092,62.210.85.178,10.0.2.15,TCP,60,9001  >  35978 [ACK] Seq=8203971 Ack=149796519 Win=65535 Len=0
1,4.428507999999965,62.210.85.178,10.0.2.15,TCP,60,9001  >  35978 [ACK] Seq=8203971 Ack=149797669 Win=65535 Len=0
1,4.428605000000061,10.0.2.15,62.210.85.178,TLSv1.2,332,Application Data
1,4.428736999999728,62.210.85.178,10.0.2.15,TCP,60,9001  >  35978 [ACK] Seq=8203971 Ack=149797947 Win=65535 Len=0
1,4.428837999999814,10.0.2.15,62.210.85.178,TLSv1.2,3868,Application Data
1,4.428918000000067,10.0.2.15,62.210.85.178,TCP,2974,35978  >  9001 [ACK] Seq=149801761 Ack=8203971 Win=65535 Len=2920 [TCP segment of a reassembled PDU]
1,4.429000000000087,10.0.2.15,62.210.85.178,TLSv1.2,2974,Application Data [TCP segment of a reassembled PDU]
1,4.429047999999966,62.210.85.178,10.0.2.15,TCP,60,9001  >  35978 [ACK] Seq=8203971 Ack=149799407 Win=65535 Len=0
1,4.4290579999997135,62.210.85.178,10.0.2.15,TCP,60,9001  >  35978 [ACK] Seq=8203971 Ack=149800867 Win=65535 Len=0
1,4.429063999999926,62.210.85.178,10.0.2.15,TCP,60,9001  >  35978 [ACK] Seq=8203971 Ack=149801761 Win=65535 Len=0
1,4.429068999999799,62.210.85.178,10.0.2.15,TCP,60,9001  >  35978 [ACK] Seq=8203971 Ack=149803221 Win=65535 Len=0
1,4.429072999999789,62.210.85.178,10.0.2.15,TCP,60,9001  >  35978 [ACK] Seq=8203971 Ack=149804681 Win=65535 Len=0
1,4.429125999999997,10.0.2.15,62.210.85.178,TLSv1.2,1260,Application Data
1,4.42922099999987,62.210.85.178,10.0.2.15,TCP,60,9001  >  35978 [ACK] Seq=8203971 Ack=149806141 Win=65535 Len=0
1,4.429235999999946,62.210.85.178,10.0.2.15,TCP,60,9001  >  35978 [ACK] Seq=8203971 Ack=149807601 Win=65535 Len=0
1,4.429241999999704,62.210.85.178,10.0.2.15,TCP,60,9001  >  35978 [ACK] Seq=8203971 Ack=149808807 Win=65535 Len=0
1,4.442571999999927,10.0.2.15,62.210.85.178,TLSv1.2,4124,Application Data
1,4.442806000000019,62.210.85.178,10.0.2.15,TCP,60,9001  >  35978 [ACK] Seq=8203971 Ack=149810267 Win=65535 Len=0
1,4.4428399999997055,62.210.85.178,10.0.2.15,TCP,60,9001  >  35978 [ACK] Seq=8203971 Ack=149811727 Win=65535 Len=0
1,4.442845999999918,62.210.85.178,10.0.2.15,TCP,60,9001  >  35978 [ACK] Seq=8203971 Ack=149812877 Win=65535 Len=0
1,4.442956999999751,10.0.2.15,62.210.85.178,TLSv1.2,3738,Application Data
1,4.443053999999847,62.210.85.178,10.0.2.15,TCP,60,9001  >  35978 [ACK] Seq=8203971 Ack=149814337 Win=65535 Len=0
1,4.443065999999817,62.210.85.178,10.0.2.15,TCP,60,9001  >  35978 [ACK] Seq=8203971 Ack=149815797 Win=65535 Len=0
1,4.443072000000029,62.210.85.178,10.0.2.15,TCP,60,9001  >  35978 [ACK] Seq=8203971 Ack=149816561 Win=65535 Len=0
1,4.613487999999961,54.93.77.70,10.0.2.15,TCP,2950,"9001  >  34692 [PSH, ACK] Seq=149629983 Ack=8235607 Win=65535 Len=2896 [TCP segment of a reassembled PDU]"
1,4.613652000000002,10.0.2.15,54.93.77.70,TCP,54,34692  >  9001 [ACK] Seq=8235607 Ack=149632879 Win=65535 Len=0
1,4.615884999999707,54.93.77.70,10.0.2.15,TLSv1.2,4912,"Application Data, Application Data"
1,4.615964000000076,10.0.2.15,54.93.77.70,TCP,54,34692  >  9001 [ACK] Seq=8235607 Ack=149637737 Win=65535 Len=0
1,4.628538999999819,54.93.77.70,10.0.2.15,TCP,2950,"9001  >  34692 [PSH, ACK] Seq=149637737 Ack=8235607 Win=65535 Len=2896 [TCP segment of a reassembled PDU]"
1,4.62858899999992,54.93.77.70,10.0.2.15,TLSv1.2,2950,Application Data [TCP segment of a reassembled PDU]
1,4.628656999999748,10.0.2.15,54.93.77.70,TCP,54,34692  >  9001 [ACK] Seq=8235607 Ack=149640633 Win=65535 Len=0
1,4.628928000000087,10.0.2.15,54.93.77.70,TCP,54,34692  >  9001 [ACK] Seq=8235607 Ack=149643529 Win=65535 Len=0
1,4.633168999999725,54.93.77.70,10.0.2.15,TLSv1.2,5846,Application Data [TCP segment of a reassembled PDU]
1,4.633209000000079,54.93.77.70,10.0.2.15,TLSv1.2,2950,Application Data [TCP segment of a reassembled PDU]
1,4.633269999999811,10.0.2.15,54.93.77.70,TCP,54,34692  >  9001 [ACK] Seq=8235607 Ack=149649321 Win=65535 Len=0
1,4.63345900000013,10.0.2.15,54.93.77.70,TCP,54,34692  >  9001 [ACK] Seq=8235607 Ack=149652217 Win=65535 Len=0
1,4.638022999999976,54.93.77.70,10.0.2.15,TLSv1.2,3182,"Application Data, Application Data, Application Data"
1,4.638247999999749,10.0.2.15,54.93.77.70,TCP,54,34692  >  9001 [ACK] Seq=8235607 Ack=149655345 Win=65535 Len=0
1,4.639724000000115,54.93.77.70,10.0.2.15,TCP,1502,"9001  >  34692 [PSH, ACK] Seq=149655345 Ack=8235607 Win=65535 Len=1448 [TCP segment of a reassembled PDU]"
1,4.6399099999998725,10.0.2.15,54.93.77.70,TCP,54,34692  >  9001 [ACK] Seq=8235607 Ack=149656793 Win=65535 Len=0
1,4.654716999999891,54.93.77.70,10.0.2.15,TLSv1.2,1198,Application Data
1,4.654993999999988,10.0.2.15,54.93.77.70,TLSv1.2,590,Application Data
1,4.6551039999999375,54.93.77.70,10.0.2.15,TCP,60,9001  >  34692 [ACK] Seq=149657937 Ack=8236143 Win=65535 Len=0
1,4.756000999999742,62.210.85.178,10.0.2.15,TLSv1.2,590,Application Data
1,4.7986980000000585,10.0.2.15,62.210.85.178,TCP,54,35978  >  9001 [ACK] Seq=149816561 Ack=8204507 Win=65535 Len=0
1,4.81081499999982,54.93.77.70,10.0.2.15,TLSv1.2,3674,Application Data
1,4.811251000000084,10.0.2.15,54.93.77.70,TCP,54,34692  >  9001 [ACK] Seq=8236143 Ack=149661557 Win=65535 Len=0
1,4.832002000000102,54.93.77.70,10.0.2.15,TLSv1.2,3674,Application Data
1,4.832104000000072,10.0.2.15,54.93.77.70,TCP,54,34692  >  9001 [ACK] Seq=8236143 Ack=149665177 Win=65535 Len=0
1,4.836551999999756,10.0.2.15,54.93.77.70,TLSv1.2,590,Application Data
1,4.837032999999792,54.93.77.70,10.0.2.15,TCP,60,9001  >  34692 [ACK] Seq=149665177 Ack=8236679 Win=65535 Len=0
1,4.848030000000108,10.0.2.15,54.93.77.70,TLSv1.2,590,Application Data
1,4.848181999999724,54.93.77.70,10.0.2.15,TCP,60,9001  >  34692 [ACK] Seq=149665177 Ack=8237215 Win=65535 Len=0
1,4.85147999999981,54.93.77.70,10.0.2.15,TLSv1.2,590,Application Data
1,4.898483999999826,10.0.2.15,54.93.77.70,TCP,54,34692  >  9001 [ACK] Seq=8237215 Ack=149665713 Win=65535 Len=0
1,4.966916999999739,62.210.85.178,10.0.2.15,TLSv1.2,1104,Application Data
1,4.967271999999866,10.0.2.15,62.210.85.178,TCP,54,35978  >  9001 [ACK] Seq=149816561 Ack=8205557 Win=65535 Len=0
1,4.968332999999802,10.0.2.15,62.210.85.178,TLSv1.2,590,Application Data
1,4.968523000000005,62.210.85.178,10.0.2.15,TCP,60,9001  >  35978 [ACK] Seq=8205557 Ack=149817097 Win=65535 Len=0
1,5.075769000000037,54.93.77.70,10.0.2.15,TLSv1.2,590,Application Data
1,5.0760629999999765,10.0.2.15,54.93.77.70,TCP,54,34692  >  9001 [ACK] Seq=8237215 Ack=149666249 Win=65535 Len=0
1,5.079490999999962,10.0.2.15,54.93.77.70,TLSv1.2,590,Application Data
1,5.0800319999998464,54.93.77.70,10.0.2.15,TCP,60,9001  >  34692 [ACK] Seq=149666249 Ack=8237751 Win=65535 Len=0
1,5.171519999999873,62.210.85.178,10.0.2.15,TLSv1.2,590,Application Data
1,5.178028999999697,10.0.2.15,62.210.85.178,TLSv1.2,590,Application Data
1,5.1782429999998385,62.210.85.178,10.0.2.15,TCP,60,9001  >  35978 [ACK] Seq=8206093 Ack=149817633 Win=65535 Len=0
1,5.188525000000027,10.0.2.15,62.210.85.178,TLSv1.2,4124,Application Data
1,5.188701999999921,10.0.2.15,62.210.85.178,TCP,2974,35978  >  9001 [ACK] Seq=149821703 Ack=8206093 Win=65535 Len=2920 [TCP segment of a reassembled PDU]
1,5.1887329999999565,62.210.85.178,10.0.2.15,TCP,60,9001  >  35978 [ACK] Seq=8206093 Ack=149819093 Win=65535 Len=0
1,5.188744999999926,62.210.85.178,10.0.2.15,TCP,60,9001  >  35978 [ACK] Seq=8206093 Ack=149820553 Win=65535 Len=0
1,5.1887510000001384,62.210.85.178,10.0.2.15,TCP,60,9001  >  35978 [ACK] Seq=8206093 Ack=149821703 Win=65535 Len=0
1,5.188755000000128,62.210.85.178,10.0.2.15,TCP,60,9001  >  35978 [ACK] Seq=8206093 Ack=149823163 Win=65535 Len=0
1,5.188759000000118,62.210.85.178,10.0.2.15,TCP,60,9001  >  35978 [ACK] Seq=8206093 Ack=149824623 Win=65535 Len=0
1,5.188807999999881,10.0.2.15,62.210.85.178,TLSv1.2,1204,Application Data
1,5.188850000000002,62.210.85.178,10.0.2.15,TCP,60,9001  >  35978 [ACK] Seq=8206093 Ack=149825773 Win=65535 Len=0
1,5.188908000000083,10.0.2.15,62.210.85.178,TLSv1.2,4124,Application Data
1,5.188952999999856,62.210.85.178,10.0.2.15,TCP,60,9001  >  35978 [ACK] Seq=8206093 Ack=149827233 Win=65535 Len=0
1,5.188960999999836,62.210.85.178,10.0.2.15,TCP,60,9001  >  35978 [ACK] Seq=8206093 Ack=149828693 Win=65535 Len=0
1,5.188965999999709,62.210.85.178,10.0.2.15,TCP,60,9001  >  35978 [ACK] Seq=8206093 Ack=149829843 Win=65535 Len=0
1,5.189016999999694,10.0.2.15,62.210.85.178,TLSv1.2,4124,Application Data
1,5.189057999999932,62.210.85.178,10.0.2.15,TCP,60,9001  >  35978 [ACK] Seq=8206093 Ack=149831303 Win=65535 Len=0
1,5.189065000000028,62.210.85.178,10.0.2.15,TCP,60,9001  >  35978 [ACK] Seq=8206093 Ack=149832763 Win=65535 Len=0
1,5.1890699999999015,62.210.85.178,10.0.2.15,TCP,60,9001  >  35978 [ACK] Seq=8206093 Ack=149833913 Win=65535 Len=0
1,5.189148999999816,10.0.2.15,62.210.85.178,TLSv1.2,332,Application Data
1,5.189225999999962,62.210.85.178,10.0.2.15,TCP,60,9001  >  35978 [ACK] Seq=8206093 Ack=149834191 Win=65535 Len=0
1,5.189278999999715,10.0.2.15,62.210.85.178,TLSv1.2,1618,Application Data
1,5.189323999999942,62.210.85.178,10.0.2.15,TCP,60,9001  >  35978 [ACK] Seq=8206093 Ack=149835651 Win=65535 Len=0
1,5.189331000000038,62.210.85.178,10.0.2.15,TCP,60,9001  >  35978 [ACK] Seq=8206093 Ack=149835755 Win=65535 Len=0
1,5.303765000000112,54.93.77.70,10.0.2.15,TLSv1.2,590,Application Data
1,5.313524000000143,54.93.77.70,10.0.2.15,TCP,2950,"9001  >  34692 [PSH, ACK] Seq=149666785 Ack=8237751 Win=65535 Len=2896 [TCP segment of a reassembled PDU]"
1,5.313682999999855,10.0.2.15,54.93.77.70,TCP,54,34692  >  9001 [ACK] Seq=8237751 Ack=149669681 Win=65535 Len=0
1,5.319806999999855,54.93.77.70,10.0.2.15,TLSv1.2,778,Application Data
1,5.335559000000103,54.93.77.70,10.0.2.15,TLSv1.2,7294,Application Data
1,5.335638000000017,54.93.77.70,10.0.2.15,TLSv1.2,568,Application Data
1,5.3357780000001185,10.0.2.15,54.93.77.70,TCP,54,34692  >  9001 [ACK] Seq=8237751 Ack=149678159 Win=65535 Len=0
1,5.35042999999996,54.93.77.70,10.0.2.15,TCP,1502,"9001  >  34692 [PSH, ACK] Seq=149678159 Ack=8237751 Win=65535 Len=1448 [TCP segment of a reassembled PDU]"
1,5.35055199999988,10.0.2.15,54.93.77.70,TCP,54,34692  >  9001 [ACK] Seq=8237751 Ack=149679607 Win=65535 Len=0
1,5.351580000000013,54.93.77.70,10.0.2.15,TLSv1.2,170,Application Data
1,5.3627409999999145,54.93.77.70,10.0.2.15,TCP,1502,"9001  >  34692 [PSH, ACK] Seq=149679723 Ack=8237751 Win=65535 Len=1448 [TCP segment of a reassembled PDU]"
1,5.362824999999702,10.0.2.15,54.93.77.70,TCP,54,34692  >  9001 [ACK] Seq=8237751 Ack=149681171 Win=65535 Len=0
1,5.367675999999847,54.93.77.70,10.0.2.15,TLSv1.2,170,Application Data
1,5.370896999999786,54.93.77.70,10.0.2.15,TCP,2950,"9001  >  34692 [PSH, ACK] Seq=149681287 Ack=8237751 Win=65535 Len=2896 [TCP segment of a reassembled PDU]"
1,5.370992999999999,10.0.2.15,54.93.77.70,TCP,54,34692  >  9001 [ACK] Seq=8237751 Ack=149684183 Win=65535 Len=0
1,5.384461000000101,54.93.77.70,10.0.2.15,TLSv1.2,778,Application Data
1,5.389133000000129,10.0.2.15,54.93.77.70,TLSv1.2,590,Application Data
1,5.389538999999786,54.93.77.70,10.0.2.15,TCP,60,9001  >  34692 [ACK] Seq=149684907 Ack=8238287 Win=65535 Len=0
1,5.399615999999696,10.0.2.15,54.93.77.70,TLSv1.2,590,Application Data
1,5.399814999999762,54.93.77.70,10.0.2.15,TCP,60,9001  >  34692 [ACK] Seq=149684907 Ack=8238823 Win=65535 Len=0
1,5.535176999999749,62.210.85.178,10.0.2.15,TLSv1.2,1104,Application Data
1,5.53587299999981,10.0.2.15,62.210.85.178,TLSv1.2,590,Application Data
1,5.536051000000043,62.210.85.178,10.0.2.15,TCP,60,9001  >  35978 [ACK] Seq=8207143 Ack=149836291 Win=65535 Len=0
1,5.738499999999931,54.93.77.70,10.0.2.15,TLSv1.2,590,Application Data
1,5.739088999999694,10.0.2.15,54.93.77.70,TLSv1.2,590,Application Data
1,5.739246000000094,54.93.77.70,10.0.2.15,TCP,60,9001  >  34692 [ACK] Seq=149685443 Ack=8239359 Win=65535 Len=0
1,6.101742999999715,62.210.85.178,10.0.2.15,TLSv1.2,590,Application Data
1,6.108734999999797,10.0.2.15,62.210.85.178,TLSv1.2,590,Application Data
1,6.109286999999767,62.210.85.178,10.0.2.15,TCP,60,9001  >  35978 [ACK] Seq=8207679 Ack=149836827 Win=65535 Len=0
1,6.122642999999698,10.0.2.15,62.210.85.178,TLSv1.2,4124,Application Data
1,6.122821999999815,62.210.85.178,10.0.2.15,TCP,60,9001  >  35978 [ACK] Seq=8207679 Ack=149838287 Win=65535 Len=0
1,6.12284099999988,62.210.85.178,10.0.2.15,TCP,60,9001  >  35978 [ACK] Seq=8207679 Ack=149839747 Win=65535 Len=0
1,6.12284499999987,62.210.85.178,10.0.2.15,TCP,60,9001  >  35978 [ACK] Seq=8207679 Ack=149840897 Win=65535 Len=0
1,6.122902999999951,10.0.2.15,62.210.85.178,TLSv1.2,4124,Application Data
1,6.123001999999815,10.0.2.15,62.210.85.178,TCP,2974,35978  >  9001 [ACK] Seq=149844967 Ack=8207679 Win=65535 Len=2920 [TCP segment of a reassembled PDU]
1,6.123031000000083,62.210.85.178,10.0.2.15,TCP,60,9001  >  35978 [ACK] Seq=8207679 Ack=149842357 Win=65535 Len=0
1,6.123039999999946,62.210.85.178,10.0.2.15,TCP,60,9001  >  35978 [ACK] Seq=8207679 Ack=149843817 Win=65535 Len=0
1,6.123043999999936,62.210.85.178,10.0.2.15,TCP,60,9001  >  35978 [ACK] Seq=8207679 Ack=149844967 Win=65535 Len=0
1,6.123082000000068,10.0.2.15,62.210.85.178,TLSv1.2,1204,Application Data
1,6.123117999999977,62.210.85.178,10.0.2.15,TCP,60,9001  >  35978 [ACK] Seq=8207679 Ack=149846427 Win=65535 Len=0
1,6.12312699999984,62.210.85.178,10.0.2.15,TCP,60,9001  >  35978 [ACK] Seq=8207679 Ack=149847887 Win=65535 Len=0
1,6.12313099999983,62.210.85.178,10.0.2.15,TCP,60,9001  >  35978 [ACK] Seq=8207679 Ack=149849037 Win=65535 Len=0
1,6.123173999999835,10.0.2.15,62.210.85.178,TLSv1.2,4124,Application Data
1,6.1232099999997445,62.210.85.178,10.0.2.15,TCP,60,9001  >  35978 [ACK] Seq=8207679 Ack=149850497 Win=65535 Len=0
1,6.123217999999724,62.210.85.178,10.0.2.15,TCP,60,9001  >  35978 [ACK] Seq=8207679 Ack=149851957 Win=65535 Len=0
1,6.123260999999729,62.210.85.178,10.0.2.15,TCP,60,9001  >  35978 [ACK] Seq=8207679 Ack=149853107 Win=65535 Len=0
1,6.123297000000093,10.0.2.15,62.210.85.178,TLSv1.2,332,Application Data
1,6.123332000000119,62.210.85.178,10.0.2.15,TCP,60,9001  >  35978 [ACK] Seq=8207679 Ack=149853385 Win=65535 Len=0
1,6.123391999999967,10.0.2.15,62.210.85.178,TLSv1.2,3868,Application Data
1,6.123430999999982,62.210.85.178,10.0.2.15,TCP,60,9001  >  35978 [ACK] Seq=8207679 Ack=149854845 Win=65535 Len=0
1,6.123438999999962,62.210.85.178,10.0.2.15,TCP,60,9001  >  35978 [ACK] Seq=8207679 Ack=149856305 Win=65535 Len=0
1,6.123442000000068,62.210.85.178,10.0.2.15,TCP,60,9001  >  35978 [ACK] Seq=8207679 Ack=149857199 Win=65535 Len=0
1,6.123481999999967,10.0.2.15,62.210.85.178,TLSv1.2,4124,Application Data
1,6.123517999999876,62.210.85.178,10.0.2.15,TCP,60,9001  >  35978 [ACK] Seq=8207679 Ack=149858659 Win=65535 Len=0
1,6.123525999999856,62.210.85.178,10.0.2.15,TCP,60,9001  >  35978 [ACK] Seq=8207679 Ack=149860119 Win=65535 Len=0
1,6.12353099999973,62.210.85.178,10.0.2.15,TCP,60,9001  >  35978 [ACK] Seq=8207679 Ack=149861269 Win=65535 Len=0
1,6.123567000000094,10.0.2.15,62.210.85.178,TLSv1.2,3030,Application Data
1,6.123603000000003,62.210.85.178,10.0.2.15,TCP,60,9001  >  35978 [ACK] Seq=8207679 Ack=149862729 Win=65535 Len=0
1,6.123610000000099,62.210.85.178,10.0.2.15,TCP,60,9001  >  35978 [ACK] Seq=8207679 Ack=149864189 Win=65535 Len=0
1,6.123614000000089,62.210.85.178,10.0.2.15,TCP,60,9001  >  35978 [ACK] Seq=8207679 Ack=149864245 Win=65535 Len=0
1,6.132915000000139,10.0.2.15,62.210.85.178,TLSv1.2,4124,Application Data
1,6.133065999999872,62.210.85.178,10.0.2.15,TCP,60,9001  >  35978 [ACK] Seq=8207679 Ack=149865705 Win=65535 Len=0
1,6.133099000000129,62.210.85.178,10.0.2.15,TCP,60,9001  >  35978 [ACK] Seq=8207679 Ack=149867165 Win=65535 Len=0
1,6.133104000000003,62.210.85.178,10.0.2.15,TCP,60,9001  >  35978 [ACK] Seq=8207679 Ack=149868315 Win=65535 Len=0
1,6.133182999999917,10.0.2.15,62.210.85.178,TLSv1.2,4124,Application Data
1,6.133272000000034,10.0.2.15,62.210.85.178,TCP,2974,35978  >  9001 [ACK] Seq=149872385 Ack=8207679 Win=65535 Len=2920 [TCP segment of a reassembled PDU]
1,6.133326000000125,62.210.85.178,10.0.2.15,TCP,60,9001  >  35978 [ACK] Seq=8207679 Ack=149869775 Win=65535 Len=0
1,6.133338000000094,62.210.85.178,10.0.2.15,TCP,60,9001  >  35978 [ACK] Seq=8207679 Ack=149871235 Win=65535 Len=0
1,6.133342999999968,62.210.85.178,10.0.2.15,TCP,60,9001  >  35978 [ACK] Seq=8207679 Ack=149872385 Win=65535 Len=0
1,6.133347999999842,62.210.85.178,10.0.2.15,TCP,60,9001  >  35978 [ACK] Seq=8207679 Ack=149873845 Win=65535 Len=0
1,6.133352999999715,62.210.85.178,10.0.2.15,TCP,60,9001  >  35978 [ACK] Seq=8207679 Ack=149875305 Win=65535 Len=0
1,6.133405999999923,10.0.2.15,62.210.85.178,TLSv1.2,1204,Application Data
1,6.136234999999942,62.210.85.178,10.0.2.15,TCP,60,9001  >  35978 [ACK] Seq=8207679 Ack=149876455 Win=65535 Len=0
1,6.13638600000013,10.0.2.15,62.210.85.178,TLSv1.2,1810,Application Data
1,6.136576999999761,62.210.85.178,10.0.2.15,TCP,60,9001  >  35978 [ACK] Seq=8207679 Ack=149877915 Win=65535 Len=0
1,6.136590000000069,62.210.85.178,10.0.2.15,TCP,60,9001  >  35978 [ACK] Seq=8207679 Ack=149878211 Win=65535 Len=0
1,6.255399000000125,54.93.77.70,10.0.2.15,TLSv1.2,590,Application Data
1,6.302353999999923,10.0.2.15,54.93.77.70,TCP,54,34692  >  9001 [ACK] Seq=8239359 Ack=149685979 Win=65535 Len=0
1,6.314865999999711,54.93.77.70,10.0.2.15,TCP,2950,"9001  >  34692 [PSH, ACK] Seq=149685979 Ack=8239359 Win=65535 Len=2896 [TCP segment of a reassembled PDU]"
1,6.314966999999797,10.0.2.15,54.93.77.70,TCP,54,34692  >  9001 [ACK] Seq=8239359 Ack=149688875 Win=65535 Len=0
1,6.3629329999998845,54.93.77.70,10.0.2.15,TLSv1.2,778,Application Data
1,6.3630619999999,10.0.2.15,54.93.77.70,TCP,54,34692  >  9001 [ACK] Seq=8239359 Ack=149689599 Win=65535 Len=0
1,6.382456999999704,54.93.77.70,10.0.2.15,TCP,2950,"9001  >  34692 [PSH, ACK] Seq=149689599 Ack=8239359 Win=65535 Len=2896 [TCP segment of a reassembled PDU]"
1,6.382552999999916,10.0.2.15,54.93.77.70,TCP,54,34692  >  9001 [ACK] Seq=8239359 Ack=149692495 Win=65535 Len=0
1,6.384087999999792,54.93.77.70,10.0.2.15,TLSv1.2,1502,Application Data [TCP segment of a reassembled PDU]
1,6.384232999999767,10.0.2.15,54.93.77.70,TCP,54,34692  >  9001 [ACK] Seq=8239359 Ack=149693943 Win=65535 Len=0
1,6.390004999999746,54.93.77.70,10.0.2.15,TLSv1.2,1502,Application Data [TCP segment of a reassembled PDU]
1,6.39013900000009,10.0.2.15,54.93.77.70,TCP,54,34692  >  9001 [ACK] Seq=8239359 Ack=149695391 Win=65535 Len=0
1,6.390689999999722,54.93.77.70,10.0.2.15,TLSv1.2,2038,Application Data
1,6.3907829999998285,10.0.2.15,54.93.77.70,TCP,54,34692  >  9001 [ACK] Seq=8239359 Ack=149697375 Win=65535 Len=0
1,6.441628999999921,54.93.77.70,10.0.2.15,TLSv1.2,7808,"Application Data, Application Data"
1,6.441823000000113,10.0.2.15,54.93.77.70,TCP,54,34692  >  9001 [ACK] Seq=8239359 Ack=149705129 Win=65535 Len=0
1,6.454329000000143,54.93.77.70,10.0.2.15,TCP,2950,"9001  >  34692 [PSH, ACK] Seq=149705129 Ack=8239359 Win=65535 Len=2896 [TCP segment of a reassembled PDU]"
1,6.454459000000043,10.0.2.15,54.93.77.70,TCP,54,34692  >  9001 [ACK] Seq=8239359 Ack=149708025 Win=65535 Len=0
1,6.454805999999735,54.93.77.70,10.0.2.15,TLSv1.2,5846,"Application Data, Application Data"
1,6.454874999999902,10.0.2.15,54.93.77.70,TCP,54,34692  >  9001 [ACK] Seq=8239359 Ack=149713817 Win=65535 Len=0
1,6.455206000000089,10.0.2.15,54.93.77.70,TLSv1.2,590,Application Data
1,6.455547000000024,54.93.77.70,10.0.2.15,TCP,60,9001  >  34692 [ACK] Seq=149713817 Ack=8239895 Win=65535 Len=0
1,6.45765399999982,54.93.77.70,10.0.2.15,TLSv1.2,1198,Application Data
1,6.47099500000013,54.93.77.70,10.0.2.15,TCP,2950,"9001  >  34692 [PSH, ACK] Seq=149714961 Ack=8239895 Win=65535 Len=2896 [TCP segment of a reassembled PDU]"
1,6.471219000000019,10.0.2.15,54.93.77.70,TCP,54,34692  >  9001 [ACK] Seq=8239895 Ack=149717857 Win=65535 Len=0
1,6.473269999999957,54.93.77.70,10.0.2.15,TLSv1.2,4398,Application Data [TCP segment of a reassembled PDU]
1,6.473427999999785,10.0.2.15,54.93.77.70,TCP,54,34692  >  9001 [ACK] Seq=8239895 Ack=149722201 Win=65535 Len=0
1,6.473889999999756,54.93.77.70,10.0.2.15,TLSv1.2,568,Application Data
1,6.486883999999918,54.93.77.70,10.0.2.15,TCP,1502,"9001  >  34692 [PSH, ACK] Seq=149722715 Ack=8239895 Win=65535 Len=1448 [TCP segment of a reassembled PDU]"
1,6.487115999999787,10.0.2.15,54.93.77.70,TCP,54,34692  >  9001 [ACK] Seq=8239895 Ack=149724163 Win=65535 Len=0
1,6.489843999999721,54.93.77.70,10.0.2.15,TLSv1.2,1198,Application Data
1,6.5072839999998,54.93.77.70,10.0.2.15,TLSv1.2,1104,Application Data
1,6.507482999999866,10.0.2.15,54.93.77.70,TCP,54,34692  >  9001 [ACK] Seq=8239895 Ack=149726357 Win=65535 Len=0
1,6.583482000000004,54.93.77.70,10.0.2.15,TLSv1.2,1104,Application Data
1,6.5835259999998925,62.210.85.178,10.0.2.15,TLSv1.2,590,Application Data
1,6.58811199999991,10.0.2.15,54.93.77.70,TLSv1.2,590,Application Data
1,6.588275999999951,54.93.77.70,10.0.2.15,TCP,60,9001  >  34692 [ACK] Seq=149727407 Ack=8240431 Win=65535 Len=0
1,6.627938999999969,10.0.2.15,62.210.85.178,TCP,54,35978  >  9001 [ACK] Seq=149878211 Ack=8208215 Win=65535 Len=0
1,6.727680999999848,62.210.85.178,10.0.2.15,TLSv1.2,590,Application Data
1,6.7277829999998175,10.0.2.15,62.210.85.178,TCP,54,35978  >  9001 [ACK] Seq=149878211 Ack=8208751 Win=65535 Len=0
1,6.7281410000000506,10.0.2.15,62.210.85.178,TLSv1.2,590,Application Data
1,6.728229999999712,62.210.85.178,10.0.2.15,TCP,60,9001  >  35978 [ACK] Seq=8208751 Ack=149878747 Win=65535 Len=0
1,6.841697999999724,54.93.77.70,10.0.2.15,TLSv1.2,590,Application Data
1,6.84246499999972,10.0.2.15,54.93.77.70,TLSv1.2,590,Application Data
1,6.842854999999872,54.93.77.70,10.0.2.15,TCP,60,9001  >  34692 [ACK] Seq=149727943 Ack=8240967 Win=65535 Len=0
1,6.942023000000063,62.210.85.178,10.0.2.15,TLSv1.2,590,Application Data
1,6.95070399999986,10.0.2.15,62.210.85.178,TLSv1.2,590,Application Data
1,6.95087199999989,62.210.85.178,10.0.2.15,TCP,60,9001  >  35978 [ACK] Seq=8209287 Ack=149879283 Win=65535 Len=0
1,6.963717999999972,10.0.2.15,62.210.85.178,TLSv1.2,4124,Application Data
1,6.963868999999704,10.0.2.15,62.210.85.178,TCP,2974,35978  >  9001 [ACK] Seq=149883353 Ack=8209287 Win=65535 Len=2920 [TCP segment of a reassembled PDU]
1,6.963917000000038,62.210.85.178,10.0.2.15,TCP,60,9001  >  35978 [ACK] Seq=8209287 Ack=149880743 Win=65535 Len=0
1,6.963930999999775,62.210.85.178,10.0.2.15,TCP,60,9001  >  35978 [ACK] Seq=8209287 Ack=149882203 Win=65535 Len=0
1,6.963940000000093,62.210.85.178,10.0.2.15,TCP,60,9001  >  35978 [ACK] Seq=8209287 Ack=149883353 Win=65535 Len=0
1,6.963987000000088,10.0.2.15,62.210.85.178,TLSv1.2,1204,Application Data
1,6.964030999999977,62.210.85.178,10.0.2.15,TCP,60,9001  >  35978 [ACK] Seq=8209287 Ack=149884813 Win=65535 Len=0
1,6.964038000000073,62.210.85.178,10.0.2.15,TCP,60,9001  >  35978 [ACK] Seq=8209287 Ack=149886273 Win=65535 Len=0
1,6.964042000000063,62.210.85.178,10.0.2.15,TCP,60,9001  >  35978 [ACK] Seq=8209287 Ack=149887423 Win=65535 Len=0
1,6.964086999999836,10.0.2.15,62.210.85.178,TLSv1.2,4124,Application Data
1,6.964160999999876,62.210.85.178,10.0.2.15,TCP,60,9001  >  35978 [ACK] Seq=8209287 Ack=149888883 Win=65535 Len=0
1,6.964168999999856,62.210.85.178,10.0.2.15,TCP,60,9001  >  35978 [ACK] Seq=8209287 Ack=149890343 Win=65535 Len=0
1,6.964171999999962,62.210.85.178,10.0.2.15,TCP,60,9001  >  35978 [ACK] Seq=8209287 Ack=149891493 Win=65535 Len=0
1,6.964220999999725,10.0.2.15,62.210.85.178,TLSv1.2,4124,Application Data
1,6.964309999999841,62.210.85.178,10.0.2.15,TCP,60,9001  >  35978 [ACK] Seq=8209287 Ack=149892953 Win=65535 Len=0
1,6.964318999999705,62.210.85.178,10.0.2.15,TCP,60,9001  >  35978 [ACK] Seq=8209287 Ack=149894413 Win=65535 Len=0
1,6.964321999999811,62.210.85.178,10.0.2.15,TCP,60,9001  >  35978 [ACK] Seq=8209287 Ack=149895563 Win=65535 Len=0
1,6.964351000000079,10.0.2.15,62.210.85.178,TLSv1.2,332,Application Data
1,6.964390000000094,62.210.85.178,10.0.2.15,TCP,60,9001  >  35978 [ACK] Seq=8209287 Ack=149895841 Win=65535 Len=0
1,6.96444399999973,10.0.2.15,62.210.85.178,TLSv1.2,3868,Application Data
1,6.964516000000003,62.210.85.178,10.0.2.15,TCP,60,9001  >  35978 [ACK] Seq=8209287 Ack=149897301 Win=65535 Len=0
1,6.964523999999983,62.210.85.178,10.0.2.15,TCP,60,9001  >  35978 [ACK] Seq=8209287 Ack=149898761 Win=65535 Len=0
1,6.964527000000089,62.210.85.178,10.0.2.15,TCP,60,9001  >  35978 [ACK] Seq=8209287 Ack=149899655 Win=65535 Len=0
1,6.964564999999766,10.0.2.15,62.210.85.178,TLSv1.2,4124,Application Data
1,6.964633000000049,62.210.85.178,10.0.2.15,TCP,60,9001  >  35978 [ACK] Seq=8209287 Ack=149901115 Win=65535 Len=0
1,6.964641000000029,62.210.85.178,10.0.2.15,TCP,60,9001  >  35978 [ACK] Seq=8209287 Ack=149902575 Win=65535 Len=0
1,6.964645000000019,62.210.85.178,10.0.2.15,TCP,60,9001  >  35978 [ACK] Seq=8209287 Ack=149903725 Win=65535 Len=0
1,6.964682999999695,10.0.2.15,62.210.85.178,TLSv1.2,3030,Application Data
1,6.9647540000000845,62.210.85.178,10.0.2.15,TCP,60,9001  >  35978 [ACK] Seq=8209287 Ack=149905185 Win=65535 Len=0
1,6.964760999999726,62.210.85.178,10.0.2.15,TCP,60,9001  >  35978 [ACK] Seq=8209287 Ack=149906645 Win=65535 Len=0
1,6.964763999999832,62.210.85.178,10.0.2.15,TCP,60,9001  >  35978 [ACK] Seq=8209287 Ack=149906701 Win=65535 Len=0
1,6.9742559999999685,10.0.2.15,62.210.85.178,TLSv1.2,4124,Application Data
1,6.97475600000007,62.210.85.178,10.0.2.15,TCP,60,9001  >  35978 [ACK] Seq=8209287 Ack=149908161 Win=65535 Len=0
1,6.974809999999707,62.210.85.178,10.0.2.15,TCP,60,9001  >  35978 [ACK] Seq=8209287 Ack=149909621 Win=65535 Len=0
1,6.9748139999996965,62.210.85.178,10.0.2.15,TCP,60,9001  >  35978 [ACK] Seq=8209287 Ack=149910771 Win=65535 Len=0
1,6.97504600000002,10.0.2.15,62.210.85.178,TLSv1.2,4124,Application Data
1,6.975324999999884,10.0.2.15,62.210.85.178,TCP,2974,35978  >  9001 [ACK] Seq=149914841 Ack=8209287 Win=65535 Len=2920 [TCP segment of a reassembled PDU]
1,6.975388999999723,62.210.85.178,10.0.2.15,TCP,60,9001  >  35978 [ACK] Seq=8209287 Ack=149912231 Win=65535 Len=0
1,6.975411999999778,62.210.85.178,10.0.2.15,TCP,60,9001  >  35978 [ACK] Seq=8209287 Ack=149913691 Win=65535 Len=0
1,6.975421000000097,62.210.85.178,10.0.2.15,TCP,60,9001  >  35978 [ACK] Seq=8209287 Ack=149914841 Win=65535 Len=0
1,6.975488000000041,10.0.2.15,62.210.85.178,TLSv1.2,1204,Application Data
1,6.9755439999999,62.210.85.178,10.0.2.15,TCP,60,9001  >  35978 [ACK] Seq=8209287 Ack=149916301 Win=65535 Len=0
1,6.975558000000092,62.210.85.178,10.0.2.15,TCP,60,9001  >  35978 [ACK] Seq=8209287 Ack=149917761 Win=65535 Len=0
1,6.975564999999733,62.210.85.178,10.0.2.15,TCP,60,9001  >  35978 [ACK] Seq=8209287 Ack=149918911 Win=65535 Len=0
1,6.975658999999723,10.0.2.15,62.210.85.178,TLSv1.2,4124,Application Data
1,6.975805000000037,62.210.85.178,10.0.2.15,TCP,60,9001  >  35978 [ACK] Seq=8209287 Ack=149920371 Win=65535 Len=0
1,6.975826999999754,62.210.85.178,10.0.2.15,TCP,60,9001  >  35978 [ACK] Seq=8209287 Ack=149921831 Win=65535 Len=0
1,6.975832000000082,62.210.85.178,10.0.2.15,TCP,60,9001  >  35978 [ACK] Seq=8209287 Ack=149922981 Win=65535 Len=0
1,6.975875999999971,10.0.2.15,62.210.85.178,TLSv1.2,332,Application Data
1,6.975954999999885,62.210.85.178,10.0.2.15,TCP,60,9001  >  35978 [ACK] Seq=8209287 Ack=149923259 Win=65535 Len=0
1,6.97612799999979,10.0.2.15,62.210.85.178,TLSv1.2,1618,Application Data
1,6.976388000000043,62.210.85.178,10.0.2.15,TCP,60,9001  >  35978 [ACK] Seq=8209287 Ack=149924719 Win=65535 Len=0
1,6.976429999999709,62.210.85.178,10.0.2.15,TCP,60,9001  >  35978 [ACK] Seq=8209287 Ack=149924823 Win=65535 Len=0
1,7.092521999999917,54.93.77.70,10.0.2.15,TLSv1.2,590,Application Data
1,7.134778000000097,10.0.2.15,54.93.77.70,TCP,54,34692  >  9001 [ACK] Seq=8240967 Ack=149728479 Win=65535 Len=0
1,7.179540000000088,54.93.77.70,10.0.2.15,TLSv1.2,3674,Application Data
1,7.17980099999977,10.0.2.15,54.93.77.70,TCP,54,34692  >  9001 [ACK] Seq=8240967 Ack=149732099 Win=65535 Len=0
1,7.21020099999987,54.93.77.70,10.0.2.15,TLSv1.2,3674,Application Data
1,7.210467999999764,10.0.2.15,54.93.77.70,TCP,54,34692  >  9001 [ACK] Seq=8240967 Ack=149735719 Win=65535 Len=0
1,7.227323999999953,54.93.77.70,10.0.2.15,TLSv1.2,3674,Application Data
1,7.227781999999934,10.0.2.15,54.93.77.70,TCP,54,34692  >  9001 [ACK] Seq=8240967 Ack=149739339 Win=65535 Len=0
1,7.229073999999855,10.0.2.15,54.93.77.70,TLSv1.2,590,Application Data
1,7.229792999999972,54.93.77.70,10.0.2.15,TCP,60,9001  >  34692 [ACK] Seq=149739339 Ack=8241503 Win=65535 Len=0
1,7.2466739999999845,54.93.77.70,10.0.2.15,TLSv1.2,2950,Application Data
1,7.246863999999732,10.0.2.15,54.93.77.70,TCP,54,34692  >  9001 [ACK] Seq=8241503 Ack=149742235 Win=65535 Len=0
1,7.256057999999939,54.93.77.70,10.0.2.15,TLSv1.2,1314,Application Data
1,7.258209999999963,54.93.77.70,10.0.2.15,TCP,2950,"9001  >  34692 [PSH, ACK] Seq=149743495 Ack=8241503 Win=65535 Len=2896 [TCP segment of a reassembled PDU]"
1,7.2588660000001255,10.0.2.15,54.93.77.70,TCP,54,34692  >  9001 [ACK] Seq=8241503 Ack=149746391 Win=65535 Len=0
1,7.264850000000024,54.93.77.70,10.0.2.15,TLSv1.2,1502,Application Data [TCP segment of a reassembled PDU]
1,7.264933999999812,10.0.2.15,54.93.77.70,TCP,54,34692  >  9001 [ACK] Seq=8241503 Ack=149747839 Win=65535 Len=0
1,7.274222999999893,54.93.77.70,10.0.2.15,TLSv1.2,380,Application Data
1,7.291949999999815,54.93.77.70,10.0.2.15,TLSv1.2,1104,Application Data
1,7.292554999999993,10.0.2.15,54.93.77.70,TCP,54,34692  >  9001 [ACK] Seq=8241503 Ack=149749215 Win=65535 Len=0
1,7.335954000000129,54.93.77.70,10.0.2.15,TCP,2950,"9001  >  34692 [PSH, ACK] Seq=149749215 Ack=8241503 Win=65535 Len=2896 [TCP segment of a reassembled PDU]"
1,7.336002000000008,54.93.77.70,10.0.2.15,TLSv1.2,4912,"Application Data, Application Data"
1,7.336182000000008,10.0.2.15,54.93.77.70,TCP,54,34692  >  9001 [ACK] Seq=8241503 Ack=149756969 Win=65535 Len=0
1,7.337051999999858,10.0.2.15,54.93.77.70,TLSv1.2,590,Application Data
1,7.33725400000003,54.93.77.70,10.0.2.15,TCP,60,9001  >  34692 [ACK] Seq=149756969 Ack=8242039 Win=65535 Len=0
1,7.3599920000001475,54.93.77.70,10.0.2.15,TLSv1.2,3674,Application Data
1,7.360452999999779,10.0.2.15,54.93.77.70,TCP,54,34692  >  9001 [ACK] Seq=8242039 Ack=149760589 Win=65535 Len=0
1,7.372833999999784,54.93.77.70,10.0.2.15,TCP,1502,"9001  >  34692 [PSH, ACK] Seq=149760589 Ack=8242039 Win=65535 Len=1448 [TCP segment of a reassembled PDU]"
1,7.37303299999985,10.0.2.15,54.93.77.70,TCP,54,34692  >  9001 [ACK] Seq=8242039 Ack=149762037 Win=65535 Len=0
1,7.378319999999803,54.93.77.70,10.0.2.15,TLSv1.2,170,Application Data
1,7.382900999999947,54.93.77.70,10.0.2.15,TLSv1.2,5846,Application Data
1,7.3830119999997805,10.0.2.15,54.93.77.70,TCP,54,34692  >  9001 [ACK] Seq=8242039 Ack=149767945 Win=65535 Len=0
1,7.395184999999856,54.93.77.70,10.0.2.15,TLSv1.2,988,Application Data
1,7.40371499999992,54.93.77.70,10.0.2.15,TCP,2950,"9001  >  34692 [PSH, ACK] Seq=149768879 Ack=8242039 Win=65535 Len=2896 [TCP segment of a reassembled PDU]"
1,7.40382099999988,10.0.2.15,54.93.77.70,TCP,54,34692  >  9001 [ACK] Seq=8242039 Ack=149771775 Win=65535 Len=0
1,7.411599999999908,54.93.77.70,10.0.2.15,TLSv1.2,778,Application Data
1,7.452538999999888,54.93.77.70,10.0.2.15,TLSv1.2,1618,Application Data
1,7.452682999999979,10.0.2.15,54.93.77.70,TCP,54,34692  >  9001 [ACK] Seq=8242039 Ack=149774063 Win=65535 Len=0
1,7.4557159999999385,62.210.85.178,10.0.2.15,TLSv1.2,1104,Application Data
1,7.458186999999725,10.0.2.15,54.93.77.70,TLSv1.2,590,Application Data
1,7.458403000000089,54.93.77.70,10.0.2.15,TCP,60,9001  >  34692 [ACK] Seq=149774063 Ack=8242575 Win=65535 Len=0
1,7.499201000000085,10.0.2.15,62.210.85.178,TCP,54,35978  >  9001 [ACK] Seq=149924823 Ack=8210337 Win=65535 Len=0
1,7.871396000000004,62.210.85.178,10.0.2.15,TLSv1.2,590,Application Data
1,7.871485000000121,10.0.2.15,62.210.85.178,TCP,54,35978  >  9001 [ACK] Seq=149924823 Ack=8210873 Win=65535 Len=0
1,7.871832999999697,10.0.2.15,62.210.85.178,TLSv1.2,590,Application Data
1,7.871944999999869,62.210.85.178,10.0.2.15,TCP,60,9001  >  35978 [ACK] Seq=8210873 Ack=149925359 Win=65535 Len=0
1,8.093945000000076,54.93.77.70,10.0.2.15,TLSv1.2,590,Application Data
1,8.096132000000125,10.0.2.15,54.93.77.70,TLSv1.2,590,Application Data
1,8.09667300000001,54.93.77.70,10.0.2.15,TCP,60,9001  >  34692 [ACK] Seq=149774599 Ack=8243111 Win=65535 Len=0
1,8.212657000000036,62.210.85.178,10.0.2.15,TLSv1.2,590,Application Data
1,8.221176000000014,10.0.2.15,62.210.85.178,TLSv1.2,590,Application Data
1,8.221352999999908,62.210.85.178,10.0.2.15,TCP,60,9001  >  35978 [ACK] Seq=8211409 Ack=149925895 Win=65535 Len=0
1,8.232226999999966,10.0.2.15,62.210.85.178,TLSv1.2,4124,Application Data
1,8.232394000000113,62.210.85.178,10.0.2.15,TCP,60,9001  >  35978 [ACK] Seq=8211409 Ack=149927355 Win=65535 Len=0
1,8.23241599999983,62.210.85.178,10.0.2.15,TCP,60,9001  >  35978 [ACK] Seq=8211409 Ack=149928815 Win=65535 Len=0
1,8.23241999999982,62.210.85.178,10.0.2.15,TCP,60,9001  >  35978 [ACK] Seq=8211409 Ack=149929965 Win=65535 Len=0
1,8.232472000000143,10.0.2.15,62.210.85.178,TLSv1.2,4124,Application Data
1,8.232553999999709,10.0.2.15,62.210.85.178,TCP,2974,35978  >  9001 [ACK] Seq=149934035 Ack=8211409 Win=65535 Len=2920 [TCP segment of a reassembled PDU]
1,8.232594000000063,62.210.85.178,10.0.2.15,TCP,60,9001  >  35978 [ACK] Seq=8211409 Ack=149931425 Win=65535 Len=0
1,8.23260399999981,62.210.85.178,10.0.2.15,TCP,60,9001  >  35978 [ACK] Seq=8211409 Ack=149932885 Win=65535 Len=0
1,8.232609000000139,62.210.85.178,10.0.2.15,TCP,60,9001  >  35978 [ACK] Seq=8211409 Ack=149934035 Win=65535 Len=0
1,8.232614000000012,62.210.85.178,10.0.2.15,TCP,60,9001  >  35978 [ACK] Seq=8211409 Ack=149935495 Win=65535 Len=0
1,8.232618999999886,62.210.85.178,10.0.2.15,TCP,60,9001  >  35978 [ACK] Seq=8211409 Ack=149936955 Win=65535 Len=0
1,8.232664000000113,10.0.2.15,62.210.85.178,TLSv1.2,1204,Application Data
1,8.232708999999886,62.210.85.178,10.0.2.15,TCP,60,9001  >  35978 [ACK] Seq=8211409 Ack=149938105 Win=65535 Len=0
1,8.232770999999957,10.0.2.15,62.210.85.178,TLSv1.2,4124,Application Data
1,8.232860999999957,62.210.85.178,10.0.2.15,TCP,60,9001  >  35978 [ACK] Seq=8211409 Ack=149939565 Win=65535 Len=0
1,8.232872000000043,62.210.85.178,10.0.2.15,TCP,60,9001  >  35978 [ACK] Seq=8211409 Ack=149941025 Win=65535 Len=0
1,8.232876999999917,62.210.85.178,10.0.2.15,TCP,60,9001  >  35978 [ACK] Seq=8211409 Ack=149942175 Win=65535 Len=0
1,8.232916999999816,10.0.2.15,62.210.85.178,TLSv1.2,332,Application Data
1,8.233014999999796,10.0.2.15,62.210.85.178,TCP,2974,35978  >  9001 [ACK] Seq=149942453 Ack=8211409 Win=65535 Len=2920 [TCP segment of a reassembled PDU]
1,8.233095999999932,62.210.85.178,10.0.2.15,TCP,60,9001  >  35978 [ACK] Seq=8211409 Ack=149942453 Win=65535 Len=0
1,8.233177000000069,62.210.85.178,10.0.2.15,TCP,60,9001  >  35978 [ACK] Seq=8211409 Ack=149943913 Win=65535 Len=0
1,8.233193000000028,62.210.85.178,10.0.2.15,TCP,60,9001  >  35978 [ACK] Seq=8211409 Ack=149945373 Win=65535 Len=0
1,8.233232999999927,10.0.2.15,62.210.85.178,TLSv1.2,948,Application Data
1,8.233316999999715,10.0.2.15,62.210.85.178,TCP,2974,35978  >  9001 [ACK] Seq=149946267 Ack=8211409 Win=65535 Len=2920 [TCP segment of a reassembled PDU]
1,8.2333679999997,62.210.85.178,10.0.2.15,TCP,60,9001  >  35978 [ACK] Seq=8211409 Ack=149946267 Win=65535 Len=0
1,8.233377000000019,62.210.85.178,10.0.2.15,TCP,60,9001  >  35978 [ACK] Seq=8211409 Ack=149947727 Win=65535 Len=0
1,8.233381999999892,62.210.85.178,10.0.2.15,TCP,60,9001  >  35978 [ACK] Seq=8211409 Ack=149949187 Win=65535 Len=0
1,8.23341900000014,10.0.2.15,62.210.85.178,TLSv1.2,1204,Application Data
1,8.233463000000029,62.210.85.178,10.0.2.15,TCP,60,9001  >  35978 [ACK] Seq=8211409 Ack=149950337 Win=65535 Len=0
1,8.23351700000012,10.0.2.15,62.210.85.178,TLSv1.2,3030,Application Data
1,8.233562999999776,62.210.85.178,10.0.2.15,TCP,60,9001  >  35978 [ACK] Seq=8211409 Ack=149951797 Win=65535 Len=0
1,8.233572000000095,62.210.85.178,10.0.2.15,TCP,60,9001  >  35978 [ACK] Seq=8211409 Ack=149953257 Win=65535 Len=0
1,8.233577999999852,62.210.85.178,10.0.2.15,TCP,60,9001  >  35978 [ACK] Seq=8211409 Ack=149953313 Win=65535 Len=0
1,8.242988999999852,10.0.2.15,62.210.85.178,TLSv1.2,4124,Application Data
1,8.243159999999989,62.210.85.178,10.0.2.15,TCP,60,9001  >  35978 [ACK] Seq=8211409 Ack=149954773 Win=65535 Len=0
1,8.243176999999832,62.210.85.178,10.0.2.15,TCP,60,9001  >  35978 [ACK] Seq=8211409 Ack=149956233 Win=65535 Len=0
1,8.243180999999822,62.210.85.178,10.0.2.15,TCP,60,9001  >  35978 [ACK] Seq=8211409 Ack=149957383 Win=65535 Len=0
1,8.243215999999848,10.0.2.15,62.210.85.178,TCP,2974,35978  >  9001 [ACK] Seq=149957383 Ack=8211409 Win=65535 Len=2920 [TCP segment of a reassembled PDU]
1,8.243282999999792,10.0.2.15,62.210.85.178,TLSv1.2,1204,Application Data
1,8.243359999999939,62.210.85.178,10.0.2.15,TCP,60,9001  >  35978 [ACK] Seq=8211409 Ack=149958843 Win=65535 Len=0
1,8.243375999999898,62.210.85.178,10.0.2.15,TCP,60,9001  >  35978 [ACK] Seq=8211409 Ack=149960303 Win=65535 Len=0
1,8.243379999999888,62.210.85.178,10.0.2.15,TCP,60,9001  >  35978 [ACK] Seq=8211409 Ack=149961453 Win=65535 Len=0
1,8.243429000000106,10.0.2.15,62.210.85.178,TLSv1.2,4124,Application Data
1,8.24350400000003,62.210.85.178,10.0.2.15,TCP,60,9001  >  35978 [ACK] Seq=8211409 Ack=149962913 Win=65535 Len=0
1,8.24351200000001,62.210.85.178,10.0.2.15,TCP,60,9001  >  35978 [ACK] Seq=8211409 Ack=149964373 Win=65535 Len=0
1,8.243515000000116,62.210.85.178,10.0.2.15,TCP,60,9001  >  35978 [ACK] Seq=8211409 Ack=149965523 Win=65535 Len=0
1,8.243554000000131,10.0.2.15,62.210.85.178,TLSv1.2,2324,Application Data
1,8.24367600000005,62.210.85.178,10.0.2.15,TCP,60,9001  >  35978 [ACK] Seq=8211409 Ack=149966983 Win=65535 Len=0
1,8.24369200000001,62.210.85.178,10.0.2.15,TCP,60,9001  >  35978 [ACK] Seq=8211409 Ack=149967793 Win=65535 Len=0
1,8.506422999999813,54.93.77.70,10.0.2.15,TLSv1.2,7808,"Application Data, Application Data"
1,8.506589000000076,10.0.2.15,54.93.77.70,TCP,54,34692  >  9001 [ACK] Seq=8243111 Ack=149782353 Win=65535 Len=0
1,8.519643000000087,54.93.77.70,10.0.2.15,TLSv1.2,5846,Application Data
1,8.51981399999977,10.0.2.15,54.93.77.70,TCP,54,34692  >  9001 [ACK] Seq=8243111 Ack=149788145 Win=65535 Len=0
1,8.525219000000106,54.93.77.70,10.0.2.15,TLSv1.2,988,Application Data
1,8.526718000000074,10.0.2.15,54.93.77.70,TLSv1.2,590,Application Data
1,8.527099999999791,54.93.77.70,10.0.2.15,TCP,60,9001  >  34692 [ACK] Seq=149789079 Ack=8243647 Win=65535 Len=0
1,8.578657999999905,54.93.77.70,10.0.2.15,TCP,1474,9001  >  34692 [ACK] Seq=149789079 Ack=8243647 Win=65535 Len=1420 [TCP segment of a reassembled PDU]
1,8.57897099999991,54.93.77.70,10.0.2.15,TLSv1.2,4426,Application Data [TCP segment of a reassembled PDU]
1,8.579005999999936,54.93.77.70,10.0.2.15,TLSv1.2,4398,Application Data [TCP segment of a reassembled PDU]
1,8.579079000000092,10.0.2.15,54.93.77.70,TCP,54,34692  >  9001 [ACK] Seq=8243647 Ack=149799215 Win=65535 Len=0
1,8.579913999999917,54.93.77.70,10.0.2.15,TLSv1.2,6476,"Application Data, Application Data, Application Data"
1,8.580015999999887,10.0.2.15,54.93.77.70,TCP,54,34692  >  9001 [ACK] Seq=8243647 Ack=149805637 Win=65535 Len=0
1,8.580305999999837,10.0.2.15,54.93.77.70,TLSv1.2,590,Application Data
1,8.580414999999903,54.93.77.70,10.0.2.15,TCP,60,9001  >  34692 [ACK] Seq=149805637 Ack=8244183 Win=65535 Len=0
1,8.598023000000012,54.93.77.70,10.0.2.15,TLSv1.2,590,Application Data
1,8.605326999999761,54.93.77.70,10.0.2.15,TCP,2950,"9001  >  34692 [PSH, ACK] Seq=149806173 Ack=8244183 Win=65535 Len=2896 [TCP segment of a reassembled PDU]"
1,8.605372999999872,54.93.77.70,10.0.2.15,TLSv1.2,7294,"Application Data, Application Data"
1,8.605438999999933,10.0.2.15,54.93.77.70,TCP,54,34692  >  9001 [ACK] Seq=8244183 Ack=149809069 Win=65535 Len=0
1,8.605577999999696,10.0.2.15,54.93.77.70,TCP,54,34692  >  9001 [ACK] Seq=8244183 Ack=149816309 Win=65535 Len=0
1,8.62441600000011,54.93.77.70,10.0.2.15,TLSv1.2,778,Application Data
1,8.628687999999784,10.0.2.15,54.93.77.70,TLSv1.2,590,Application Data
1,8.62894899999992,54.93.77.70,10.0.2.15,TCP,60,9001  >  34692 [ACK] Seq=149817033 Ack=8244719 Win=65535 Len=0
1,8.649496,62.210.85.178,10.0.2.15,TLSv1.2,590,Application Data
1,8.691084000000046,10.0.2.15,62.210.85.178,TCP,54,35978  >  9001 [ACK] Seq=149967793 Ack=8211945 Win=65535 Len=0
1,8.694028999999773,62.210.85.178,10.0.2.15,TLSv1.2,590,Application Data
1,8.694318999999723,10.0.2.15,62.210.85.178,TCP,54,35978  >  9001 [ACK] Seq=149967793 Ack=8212481 Win=65535 Len=0
1,8.74699099999998,62.210.85.178,10.0.2.15,TLSv1.2,590,Application Data
1,8.747086999999738,10.0.2.15,62.210.85.178,TCP,54,35978  >  9001 [ACK] Seq=149967793 Ack=8213017 Win=65535 Len=0
1,8.747614999999769,10.0.2.15,62.210.85.178,TLSv1.2,590,Application Data
1,8.747723999999835,62.210.85.178,10.0.2.15,TCP,60,9001  >  35978 [ACK] Seq=8213017 Ack=149968329 Win=65535 Len=0
1,8.857019000000037,54.93.77.70,10.0.2.15,TLSv1.2,590,Application Data
1,8.860197999999855,10.0.2.15,54.93.77.70,TLSv1.2,590,Application Data
1,8.86059699999987,54.93.77.70,10.0.2.15,TCP,60,9001  >  34692 [ACK] Seq=149817569 Ack=8245255 Win=65535 Len=0
1,9.299580999999762,62.210.85.178,10.0.2.15,TLSv1.2,590,Application Data
1,9.312167000000045,10.0.2.15,62.210.85.178,TLSv1.2,590,Application Data
1,9.312356999999793,62.210.85.178,10.0.2.15,TCP,60,9001  >  35978 [ACK] Seq=8213553 Ack=149968865 Win=65535 Len=0
1,9.326924999999846,10.0.2.15,62.210.85.178,TLSv1.2,4124,Application Data
1,9.327081999999791,10.0.2.15,62.210.85.178,TCP,2974,35978  >  9001 [ACK] Seq=149972935 Ack=8213553 Win=65535 Len=2920 [TCP segment of a reassembled PDU]
1,9.327134000000115,62.210.85.178,10.0.2.15,TCP,60,9001  >  35978 [ACK] Seq=8213553 Ack=149970325 Win=65535 Len=0
1,9.327147999999852,62.210.85.178,10.0.2.15,TCP,60,9001  >  35978 [ACK] Seq=8213553 Ack=149971785 Win=65535 Len=0
1,9.327154999999948,62.210.85.178,10.0.2.15,TCP,60,9001  >  35978 [ACK] Seq=8213553 Ack=149972935 Win=65535 Len=0
1,9.327205000000049,10.0.2.15,62.210.85.178,TLSv1.2,1204,Application Data
1,9.327250999999706,62.210.85.178,10.0.2.15,TCP,60,9001  >  35978 [ACK] Seq=8213553 Ack=149974395 Win=65535 Len=0
1,9.32725900000014,62.210.85.178,10.0.2.15,TCP,60,9001  >  35978 [ACK] Seq=8213553 Ack=149975855 Win=65535 Len=0
1,9.32726300000013,62.210.85.178,10.0.2.15,TCP,60,9001  >  35978 [ACK] Seq=8213553 Ack=149977005 Win=65535 Len=0
1,9.327307999999903,10.0.2.15,62.210.85.178,TLSv1.2,4124,Application Data
1,9.327381999999943,62.210.85.178,10.0.2.15,TCP,60,9001  >  35978 [ACK] Seq=8213553 Ack=149978465 Win=65535 Len=0
1,9.327389999999923,62.210.85.178,10.0.2.15,TCP,60,9001  >  35978 [ACK] Seq=8213553 Ack=149979925 Win=65535 Len=0
1,9.32739300000003,62.210.85.178,10.0.2.15,TCP,60,9001  >  35978 [ACK] Seq=8213553 Ack=149981075 Win=65535 Len=0
1,9.327432000000044,10.0.2.15,62.210.85.178,TLSv1.2,4124,Application Data
1,9.327522999999928,62.210.85.178,10.0.2.15,TCP,60,9001  >  35978 [ACK] Seq=8213553 Ack=149982535 Win=65535 Len=0
1,9.32753300000013,62.210.85.178,10.0.2.15,TCP,60,9001  >  35978 [ACK] Seq=8213553 Ack=149983995 Win=65535 Len=0
1,9.327535999999782,62.210.85.178,10.0.2.15,TCP,60,9001  >  35978 [ACK] Seq=8213553 Ack=149985145 Win=65535 Len=0
1,9.32756500000005,10.0.2.15,62.210.85.178,TLSv1.2,332,Application Data
1,9.327604999999949,62.210.85.178,10.0.2.15,TCP,60,9001  >  35978 [ACK] Seq=8213553 Ack=149985423 Win=65535 Len=0
1,9.327663999999913,10.0.2.15,62.210.85.178,TLSv1.2,3868,Application Data
1,9.32773700000007,62.210.85.178,10.0.2.15,TCP,60,9001  >  35978 [ACK] Seq=8213553 Ack=149986883 Win=65535 Len=0
1,9.327743999999711,62.210.85.178,10.0.2.15,TCP,60,9001  >  35978 [ACK] Seq=8213553 Ack=149988343 Win=65535 Len=0
1,9.327746999999817,62.210.85.178,10.0.2.15,TCP,60,9001  >  35978 [ACK] Seq=8213553 Ack=149989237 Win=65535 Len=0
1,9.327794999999696,10.0.2.15,62.210.85.178,TLSv1.2,4124,Application Data
1,9.327855999999883,62.210.85.178,10.0.2.15,TCP,60,9001  >  35978 [ACK] Seq=8213553 Ack=149990697 Win=65535 Len=0
1,9.327863999999863,62.210.85.178,10.0.2.15,TCP,60,9001  >  35978 [ACK] Seq=8213553 Ack=149992157 Win=65535 Len=0
1,9.327867999999853,62.210.85.178,10.0.2.15,TCP,60,9001  >  35978 [ACK] Seq=8213553 Ack=149993307 Win=65535 Len=0
1,9.327905999999984,10.0.2.15,62.210.85.178,TLSv1.2,3030,Application Data
1,9.327979000000141,62.210.85.178,10.0.2.15,TCP,60,9001  >  35978 [ACK] Seq=8213553 Ack=149994767 Win=65535 Len=0
1,9.327985999999783,62.210.85.178,10.0.2.15,TCP,60,9001  >  35978 [ACK] Seq=8213553 Ack=149996227 Win=65535 Len=0
1,9.327988999999889,62.210.85.178,10.0.2.15,TCP,60,9001  >  35978 [ACK] Seq=8213553 Ack=149996283 Win=65535 Len=0
1,9.33855799999992,10.0.2.15,62.210.85.178,TLSv1.2,4124,Application Data
1,9.338705000000118,62.210.85.178,10.0.2.15,TCP,60,9001  >  35978 [ACK] Seq=8213553 Ack=149997743 Win=65535 Len=0
1,9.338726999999835,62.210.85.178,10.0.2.15,TCP,60,9001  >  35978 [ACK] Seq=8213553 Ack=149999203 Win=65535 Len=0
1,9.338731999999709,62.210.85.178,10.0.2.15,TCP,60,9001  >  35978 [ACK] Seq=8213553 Ack=150000353 Win=65535 Len=0
1,9.338823999999931,10.0.2.15,62.210.85.178,TLSv1.2,4124,Application Data
1,9.3388759999998,62.210.85.178,10.0.2.15,TCP,60,9001  >  35978 [ACK] Seq=8213553 Ack=150001813 Win=65535 Len=0
1,9.33888399999978,62.210.85.178,10.0.2.15,TCP,60,9001  >  35978 [ACK] Seq=8213553 Ack=150003273 Win=65535 Len=0
1,9.33888799999977,62.210.85.178,10.0.2.15,TCP,60,9001  >  35978 [ACK] Seq=8213553 Ack=150004423 Win=65535 Len=0
1,9.338938999999755,10.0.2.15,62.210.85.178,TLSv1.2,4124,Application Data
1,9.33898599999975,62.210.85.178,10.0.2.15,TCP,60,9001  >  35978 [ACK] Seq=8213553 Ack=150005883 Win=65535 Len=0
1,9.33899399999973,62.210.85.178,10.0.2.15,TCP,60,9001  >  35978 [ACK] Seq=8213553 Ack=150007343 Win=65535 Len=0
1,9.33899799999972,62.210.85.178,10.0.2.15,TCP,60,9001  >  35978 [ACK] Seq=8213553 Ack=150008493 Win=65535 Len=0
1,9.339044999999714,10.0.2.15,62.210.85.178,TLSv1.2,4124,Application Data
1,9.339085999999952,62.210.85.178,10.0.2.15,TCP,60,9001  >  35978 [ACK] Seq=8213553 Ack=150009953 Win=65535 Len=0
1,9.339093999999932,62.210.85.178,10.0.2.15,TCP,60,9001  >  35978 [ACK] Seq=8213553 Ack=150011413 Win=65535 Len=0
1,9.339097999999922,62.210.85.178,10.0.2.15,TCP,60,9001  >  35978 [ACK] Seq=8213553 Ack=150012563 Win=65535 Len=0
1,9.339142999999694,10.0.2.15,62.210.85.178,TLSv1.2,332,Application Data
1,9.3391859999997,62.210.85.178,10.0.2.15,TCP,60,9001  >  35978 [ACK] Seq=8213553 Ack=150012841 Win=65535 Len=0
1,9.339254999999866,10.0.2.15,62.210.85.178,TLSv1.2,3868,Application Data
1,9.339301999999861,62.210.85.178,10.0.2.15,TCP,60,9001  >  35978 [ACK] Seq=8213553 Ack=150014301 Win=65535 Len=0
1,9.339309999999841,62.210.85.178,10.0.2.15,TCP,60,9001  >  35978 [ACK] Seq=8213553 Ack=150015761 Win=65535 Len=0
1,9.339313999999831,62.210.85.178,10.0.2.15,TCP,60,9001  >  35978 [ACK] Seq=8213553 Ack=150016655 Win=65535 Len=0
1,9.339363000000048,10.0.2.15,62.210.85.178,TLSv1.2,4124,Application Data
1,9.33951900000011,10.0.2.15,62.210.85.178,TCP,2974,35978  >  9001 [ACK] Seq=150020725 Ack=8213553 Win=65535 Len=2920 [TCP segment of a reassembled PDU]
1,9.339566999999988,62.210.85.178,10.0.2.15,TCP,60,9001  >  35978 [ACK] Seq=8213553 Ack=150018115 Win=65535 Len=0
1,9.339582999999948,62.210.85.178,10.0.2.15,TCP,60,9001  >  35978 [ACK] Seq=8213553 Ack=150019575 Win=65535 Len=0
1,9.339587999999821,62.210.85.178,10.0.2.15,TCP,60,9001  >  35978 [ACK] Seq=8213553 Ack=150020725 Win=65535 Len=0
1,9.339629000000059,10.0.2.15,62.210.85.178,TLSv1.2,110,Application Data
1,9.339746999999988,62.210.85.178,10.0.2.15,TCP,60,9001  >  35978 [ACK] Seq=8213553 Ack=150022185 Win=65535 Len=0
1,9.339762000000064,62.210.85.178,10.0.2.15,TCP,60,9001  >  35978 [ACK] Seq=8213553 Ack=150023645 Win=65535 Len=0
1,9.339766000000054,62.210.85.178,10.0.2.15,TCP,60,9001  >  35978 [ACK] Seq=8213553 Ack=150023701 Win=65535 Len=0
1,9.34894099999974,10.0.2.15,62.210.85.178,TLSv1.2,4124,Application Data
1,9.349056000000019,62.210.85.178,10.0.2.15,TCP,60,9001  >  35978 [ACK] Seq=8213553 Ack=150025161 Win=65535 Len=0
1,9.349072999999862,62.210.85.178,10.0.2.15,TCP,60,9001  >  35978 [ACK] Seq=8213553 Ack=150026621 Win=65535 Len=0
1,9.349077999999736,62.210.85.178,10.0.2.15,TCP,60,9001  >  35978 [ACK] Seq=8213553 Ack=150027771 Win=65535 Len=0
1,9.349142999999913,10.0.2.15,62.210.85.178,TLSv1.2,4124,Application Data
1,9.349247000000105,62.210.85.178,10.0.2.15,TCP,60,9001  >  35978 [ACK] Seq=8213553 Ack=150029231 Win=65535 Len=0
1,9.349273999999696,62.210.85.178,10.0.2.15,TCP,60,9001  >  35978 [ACK] Seq=8213553 Ack=150030691 Win=65535 Len=0
1,9.349279000000024,62.210.85.178,10.0.2.15,TCP,60,9001  >  35978 [ACK] Seq=8213553 Ack=150031841 Win=65535 Len=0
1,9.34932200000003,10.0.2.15,62.210.85.178,TLSv1.2,204,Application Data
1,9.349429999999757,62.210.85.178,10.0.2.15,TCP,60,9001  >  35978 [ACK] Seq=8213553 Ack=150031991 Win=65535 Len=0
1,9.527462000000014,54.93.77.70,10.0.2.15,TCP,2950,"9001  >  34692 [PSH, ACK] Seq=149817569 Ack=8245255 Win=65535 Len=2896 [TCP segment of a reassembled PDU]"
1,9.527646999999888,10.0.2.15,54.93.77.70,TCP,54,34692  >  9001 [ACK] Seq=8245255 Ack=149820465 Win=65535 Len=0
1,9.534517999999935,54.93.77.70,10.0.2.15,TLSv1.2,6896,"Application Data, Application Data, Application Data"
1,9.534783000000061,10.0.2.15,54.93.77.70,TCP,54,34692  >  9001 [ACK] Seq=8245255 Ack=149827307 Win=65535 Len=0
1,9.536274000000049,54.93.77.70,10.0.2.15,TCP,1502,"9001  >  34692 [PSH, ACK] Seq=149827307 Ack=8245255 Win=65535 Len=1448 [TCP segment of a reassembled PDU]"
1,9.53636299999971,10.0.2.15,54.93.77.70,TCP,54,34692  >  9001 [ACK] Seq=8245255 Ack=149828755 Win=65535 Len=0
1,9.554741999999806,54.93.77.70,10.0.2.15,TLSv1.2,778,Application Data
1,9.587799999999788,54.93.77.70,10.0.2.15,TLSv1.2,590,Application Data
1,9.58790399999998,10.0.2.15,54.93.77.70,TCP,54,34692  >  9001 [ACK] Seq=8245255 Ack=149830015 Win=65535 Len=0
1,9.599936999999954,54.93.77.70,10.0.2.15,TCP,2950,"9001  >  34692 [PSH, ACK] Seq=149830015 Ack=8245255 Win=65535 Len=2896 [TCP segment of a reassembled PDU]"
1,9.600098999999773,54.93.77.70,10.0.2.15,TLSv1.2,5846,"Application Data, Application Data"
1,9.600200999999743,10.0.2.15,54.93.77.70,TCP,54,34692  >  9001 [ACK] Seq=8245255 Ack=149832911 Win=65535 Len=0
1,9.60033999999996,10.0.2.15,54.93.77.70,TCP,54,34692  >  9001 [ACK] Seq=8245255 Ack=149838703 Win=65535 Len=0
1,9.602053999999953,54.93.77.70,10.0.2.15,TCP,1502,"9001  >  34692 [PSH, ACK] Seq=149838703 Ack=8245255 Win=65535 Len=1448 [TCP segment of a reassembled PDU]"
1,9.602163000000019,10.0.2.15,54.93.77.70,TCP,54,34692  >  9001 [ACK] Seq=8245255 Ack=149840151 Win=65535 Len=0
1,9.616125999999895,54.93.77.70,10.0.2.15,TLSv1.2,1292,Application Data
1,9.619674999999916,54.93.77.70,10.0.2.15,TCP,2950,"9001  >  34692 [PSH, ACK] Seq=149841389 Ack=8245255 Win=65535 Len=2896 [TCP segment of a reassembled PDU]"
1,9.619838999999956,10.0.2.15,54.93.77.70,TCP,54,34692  >  9001 [ACK] Seq=8245255 Ack=149844285 Win=65535 Len=0
1,9.62059999999974,54.93.77.70,10.0.2.15,TLSv1.2,7294,"Application Data, Application Data"
1,9.62069399999973,10.0.2.15,54.93.77.70,TCP,54,34692  >  9001 [ACK] Seq=8245255 Ack=149851525 Win=65535 Len=0
1,9.620891999999913,10.0.2.15,54.93.77.70,TLSv1.2,1104,Application Data
1,9.620974999999817,54.93.77.70,10.0.2.15,TCP,60,9001  >  34692 [ACK] Seq=149851525 Ack=8246305 Win=65535 Len=0
1,9.632796999999755,54.93.77.70,10.0.2.15,TLSv1.2,1292,Application Data
1,9.643587000000025,54.93.77.70,10.0.2.15,TCP,2950,"9001  >  34692 [PSH, ACK] Seq=149852763 Ack=8246305 Win=65535 Len=2896 [TCP segment of a reassembled PDU]"
1,9.64370800000006,10.0.2.15,54.93.77.70,TCP,54,34692  >  9001 [ACK] Seq=8246305 Ack=149855659 Win=65535 Len=0
1,9.645054999999957,54.93.77.70,10.0.2.15,TLSv1.2,5846,"Application Data, Application Data"
1,9.645148999999947,10.0.2.15,54.93.77.70,TCP,54,34692  >  9001 [ACK] Seq=8246305 Ack=149861451 Win=65535 Len=0
1,9.66169600000012,54.93.77.70,10.0.2.15,TLSv1.2,170,Application Data
1,9.675527999999758,54.93.77.70,10.0.2.15,TLSv1.2,8742,"Application Data, Application Data"
1,9.675774999999703,54.93.77.70,10.0.2.15,TCP,1502,"9001  >  34692 [PSH, ACK] Seq=149870255 Ack=8246305 Win=65535 Len=1448 [TCP segment of a reassembled PDU]"
1,9.676594000000023,10.0.2.15,54.93.77.70,TCP,54,34692  >  9001 [ACK] Seq=8246305 Ack=149871703 Win=65535 Len=0
1,9.680864999999812,10.0.2.15,54.93.77.70,TLSv1.2,590,Application Data
1,9.681047999999919,54.93.77.70,10.0.2.15,TCP,60,9001  >  34692 [ACK] Seq=149871703 Ack=8246841 Win=65535 Len=0
1,9.687855000000127,54.93.77.70,10.0.2.15,TLSv1.2,4398,Application Data [TCP segment of a reassembled PDU]
1,9.68795,10.0.2.15,54.93.77.70,TCP,54,34692  >  9001 [ACK] Seq=8246841 Ack=149876047 Win=65535 Len=0
1,9.69095900000002,54.93.77.70,10.0.2.15,TLSv1.2,568,Application Data
1,9.70097399999986,54.93.77.70,10.0.2.15,TLSv1.2,4398,Application Data
1,9.701102999999875,10.0.2.15,54.93.77.70,TCP,54,34692  >  9001 [ACK] Seq=8246841 Ack=149880905 Win=65535 Len=0
1,9.72818899999993,54.93.77.70,10.0.2.15,TLSv1.2,380,Application Data
