No.,Time,Source,Destination,Protocol,Length,Info
1,0.3050339999999778,10.0.2.15,54.93.77.70,TLSv1.2,590,Application Data
1,0.30533799999966504,54.93.77.70,10.0.2.15,TCP,60,9001  >  34692 [ACK] Seq=147674703 Ack=8128201 Win=65535 Len=0
1,0.637840999999753,62.210.85.178,10.0.2.15,TLSv1.2,590,Application Data
1,0.6379409999999552,10.0.2.15,62.210.85.178,TCP,54,35978  >  9001 [ACK] Seq=147826101 Ack=8096961 Win=65535 Len=0
1,0.6383809999997538,10.0.2.15,62.210.85.178,TLSv1.2,590,Application Data
1,0.6390129999999772,62.210.85.178,10.0.2.15,TCP,60,9001  >  35978 [ACK] Seq=8096961 Ack=147826637 Win=65535 Len=0
1,0.7787439999997332,54.93.77.70,10.0.2.15,TLSv1.2,590,Application Data
1,0.7791199999996934,10.0.2.15,54.93.77.70,TCP,54,34692  >  9001 [ACK] Seq=8128201 Ack=147675239 Win=65535 Len=0
1,0.7868519999997261,10.0.2.15,54.93.77.70,TLSv1.2,1618,Application Data
1,0.7870829999997113,54.93.77.70,10.0.2.15,TCP,60,9001  >  34692 [ACK] Seq=147675239 Ack=8129661 Win=65535 Len=0
1,0.7871119999999792,54.93.77.70,10.0.2.15,TCP,60,9001  >  34692 [ACK] Seq=147675239 Ack=8129765 Win=65535 Len=0
1,0.9059049999996205,62.210.85.178,10.0.2.15,TLSv1.2,1618,Application Data
1,0.9060749999998734,10.0.2.15,62.210.85.178,TCP,54,35978  >  9001 [ACK] Seq=147826637 Ack=8098525 Win=65535 Len=0
1,0.9392869999996947,10.0.2.15,62.210.85.178,TLSv1.2,590,Application Data
1,0.9395309999999881,62.210.85.178,10.0.2.15,TCP,60,9001  >  35978 [ACK] Seq=8098525 Ack=147827173 Win=65535 Len=0
1,0.9536020000000462,10.0.2.15,62.210.85.178,TLSv1.2,1618,Application Data
1,0.9541099999996732,62.210.85.178,10.0.2.15,TCP,60,9001  >  35978 [ACK] Seq=8098525 Ack=147828633 Win=65535 Len=0
1,0.9542349999996986,62.210.85.178,10.0.2.15,TCP,60,9001  >  35978 [ACK] Seq=8098525 Ack=147828737 Win=65535 Len=0
1,1.8722789999997076,54.93.77.70,10.0.2.15,TLSv1.2,2132,Application Data
1,1.8724520000000666,10.0.2.15,54.93.77.70,TCP,54,34692  >  9001 [ACK] Seq=8129765 Ack=147677317 Win=65535 Len=0
1,1.8754179999996268,10.0.2.15,54.93.77.70,TLSv1.2,590,Application Data
1,1.875564999999824,54.93.77.70,10.0.2.15,TCP,60,9001  >  34692 [ACK] Seq=147677317 Ack=8130301 Win=65535 Len=0
1,2.0709099999999125,62.210.85.178,10.0.2.15,TLSv1.2,590,Application Data
1,2.0714129999996658,10.0.2.15,62.210.85.178,TLSv1.2,590,Application Data
1,2.0715579999996407,62.210.85.178,10.0.2.15,TCP,60,9001  >  35978 [ACK] Seq=8099061 Ack=147829273 Win=65535 Len=0
1,2.276184999999714,54.93.77.70,10.0.2.15,TLSv1.2,590,Application Data
1,2.276687000000038,10.0.2.15,54.93.77.70,TLSv1.2,590,Application Data
1,2.2767839999996795,54.93.77.70,10.0.2.15,TCP,60,9001  >  34692 [ACK] Seq=147677853 Ack=8130837 Win=65535 Len=0
1,2.7883069999998042,62.210.85.178,10.0.2.15,TLSv1.2,590,Application Data
1,2.797241999999642,10.0.2.15,62.210.85.178,TLSv1.2,590,Application Data
1,2.797505000000001,62.210.85.178,10.0.2.15,TCP,60,9001  >  35978 [ACK] Seq=8099597 Ack=147829809 Win=65535 Len=0
1,2.806503999999677,10.0.2.15,62.210.85.178,TLSv1.2,4124,Application Data
1,2.8067739999996775,10.0.2.15,62.210.85.178,TCP,2974,35978  >  9001 [ACK] Seq=147833879 Ack=8099597 Win=65535 Len=2920 [TCP segment of a reassembled PDU]
1,2.8068349999998645,62.210.85.178,10.0.2.15,TCP,60,9001  >  35978 [ACK] Seq=8099597 Ack=147831269 Win=65535 Len=0
1,2.806872999999996,62.210.85.178,10.0.2.15,TCP,60,9001  >  35978 [ACK] Seq=8099597 Ack=147832729 Win=65535 Len=0
1,2.8068779999998696,62.210.85.178,10.0.2.15,TCP,60,9001  >  35978 [ACK] Seq=8099597 Ack=147833879 Win=65535 Len=0
1,2.8068829999997433,62.210.85.178,10.0.2.15,TCP,60,9001  >  35978 [ACK] Seq=8099597 Ack=147835339 Win=65535 Len=0
1,2.806887999999617,62.210.85.178,10.0.2.15,TCP,60,9001  >  35978 [ACK] Seq=8099597 Ack=147836799 Win=65535 Len=0
1,2.806937999999718,10.0.2.15,62.210.85.178,TLSv1.2,1204,Application Data
1,2.8083950000000186,62.210.85.178,10.0.2.15,TCP,60,9001  >  35978 [ACK] Seq=8099597 Ack=147837949 Win=65535 Len=0
1,2.808505999999852,10.0.2.15,62.210.85.178,TLSv1.2,4124,Application Data
1,2.8086020000000644,62.210.85.178,10.0.2.15,TCP,60,9001  >  35978 [ACK] Seq=8099597 Ack=147839409 Win=65535 Len=0
1,2.808611999999812,62.210.85.178,10.0.2.15,TCP,60,9001  >  35978 [ACK] Seq=8099597 Ack=147840869 Win=65535 Len=0
1,2.808614999999918,62.210.85.178,10.0.2.15,TCP,60,9001  >  35978 [ACK] Seq=8099597 Ack=147842019 Win=65535 Len=0
1,2.808654999999817,10.0.2.15,62.210.85.178,TLSv1.2,4124,Application Data
1,2.808693999999832,62.210.85.178,10.0.2.15,TCP,60,9001  >  35978 [ACK] Seq=8099597 Ack=147843479 Win=65535 Len=0
1,2.808701999999812,62.210.85.178,10.0.2.15,TCP,60,9001  >  35978 [ACK] Seq=8099597 Ack=147844939 Win=65535 Len=0
1,2.808705999999802,62.210.85.178,10.0.2.15,TCP,60,9001  >  35978 [ACK] Seq=8099597 Ack=147846089 Win=65535 Len=0
1,2.8087430000000495,10.0.2.15,62.210.85.178,TLSv1.2,332,Application Data
1,2.808780999999726,62.210.85.178,10.0.2.15,TCP,60,9001  >  35978 [ACK] Seq=8099597 Ack=147846367 Win=65535 Len=0
1,2.808845999999903,10.0.2.15,62.210.85.178,TLSv1.2,3868,Application Data
1,2.8088849999999184,62.210.85.178,10.0.2.15,TCP,60,9001  >  35978 [ACK] Seq=8099597 Ack=147847827 Win=65535 Len=0
1,2.8088920000000144,62.210.85.178,10.0.2.15,TCP,60,9001  >  35978 [ACK] Seq=8099597 Ack=147849287 Win=65535 Len=0
1,2.8088960000000043,62.210.85.178,10.0.2.15,TCP,60,9001  >  35978 [ACK] Seq=8099597 Ack=147850181 Win=65535 Len=0
1,2.8089350000000195,10.0.2.15,62.210.85.178,TLSv1.2,4124,Application Data
1,2.8089709999999286,62.210.85.178,10.0.2.15,TCP,60,9001  >  35978 [ACK] Seq=8099597 Ack=147851641 Win=65535 Len=0
1,2.8089789999999084,62.210.85.178,10.0.2.15,TCP,60,9001  >  35978 [ACK] Seq=8099597 Ack=147853101 Win=65535 Len=0
1,2.8089829999998983,62.210.85.178,10.0.2.15,TCP,60,9001  >  35978 [ACK] Seq=8099597 Ack=147854251 Win=65535 Len=0
1,2.8090189999998074,10.0.2.15,62.210.85.178,TLSv1.2,3030,Application Data
1,2.809056000000055,62.210.85.178,10.0.2.15,TCP,60,9001  >  35978 [ACK] Seq=8099597 Ack=147855711 Win=65535 Len=0
1,2.8090629999996963,62.210.85.178,10.0.2.15,TCP,60,9001  >  35978 [ACK] Seq=8099597 Ack=147857171 Win=65535 Len=0
1,2.8090659999998024,62.210.85.178,10.0.2.15,TCP,60,9001  >  35978 [ACK] Seq=8099597 Ack=147857227 Win=65535 Len=0
1,2.8189189999998234,10.0.2.15,62.210.85.178,TLSv1.2,4124,Application Data
1,2.819176999999854,62.210.85.178,10.0.2.15,TCP,60,9001  >  35978 [ACK] Seq=8099597 Ack=147858687 Win=65535 Len=0
1,2.819217999999637,62.210.85.178,10.0.2.15,TCP,60,9001  >  35978 [ACK] Seq=8099597 Ack=147860147 Win=65535 Len=0
1,2.8192259999996168,62.210.85.178,10.0.2.15,TCP,60,9001  >  35978 [ACK] Seq=8099597 Ack=147861297 Win=65535 Len=0
1,2.819307999999637,10.0.2.15,62.210.85.178,TLSv1.2,4124,Application Data
1,2.819478999999774,62.210.85.178,10.0.2.15,TCP,60,9001  >  35978 [ACK] Seq=8099597 Ack=147862757 Win=65535 Len=0
1,2.8194969999999557,62.210.85.178,10.0.2.15,TCP,60,9001  >  35978 [ACK] Seq=8099597 Ack=147864217 Win=65535 Len=0
1,2.8195019999998294,62.210.85.178,10.0.2.15,TCP,60,9001  >  35978 [ACK] Seq=8099597 Ack=147865367 Win=65535 Len=0
1,2.819564999999784,10.0.2.15,62.210.85.178,TLSv1.2,4124,Application Data
1,2.819626999999855,62.210.85.178,10.0.2.15,TCP,60,9001  >  35978 [ACK] Seq=8099597 Ack=147866827 Win=65535 Len=0
1,2.8196349999998347,62.210.85.178,10.0.2.15,TCP,60,9001  >  35978 [ACK] Seq=8099597 Ack=147868287 Win=65535 Len=0
1,2.8196389999998246,62.210.85.178,10.0.2.15,TCP,60,9001  >  35978 [ACK] Seq=8099597 Ack=147869437 Win=65535 Len=0
1,2.819688000000042,10.0.2.15,62.210.85.178,TLSv1.2,4124,Application Data
1,2.8197259999997186,62.210.85.178,10.0.2.15,TCP,60,9001  >  35978 [ACK] Seq=8099597 Ack=147870897 Win=65535 Len=0
1,2.8197339999996984,62.210.85.178,10.0.2.15,TCP,60,9001  >  35978 [ACK] Seq=8099597 Ack=147872357 Win=65535 Len=0
1,2.8197379999996883,62.210.85.178,10.0.2.15,TCP,60,9001  >  35978 [ACK] Seq=8099597 Ack=147873507 Win=65535 Len=0
1,2.8197769999997035,10.0.2.15,62.210.85.178,TLSv1.2,332,Application Data
1,2.819813999999951,62.210.85.178,10.0.2.15,TCP,60,9001  >  35978 [ACK] Seq=8099597 Ack=147873785 Win=65535 Len=0
1,2.8198779999997896,10.0.2.15,62.210.85.178,TLSv1.2,3868,Application Data
1,2.819916999999805,62.210.85.178,10.0.2.15,TCP,60,9001  >  35978 [ACK] Seq=8099597 Ack=147875245 Win=65535 Len=0
1,2.819923999999901,62.210.85.178,10.0.2.15,TCP,60,9001  >  35978 [ACK] Seq=8099597 Ack=147876705 Win=65535 Len=0
1,2.819927000000007,62.210.85.178,10.0.2.15,TCP,60,9001  >  35978 [ACK] Seq=8099597 Ack=147877599 Win=65535 Len=0
1,2.819966999999906,10.0.2.15,62.210.85.178,TLSv1.2,4124,Application Data
1,2.820003999999699,62.210.85.178,10.0.2.15,TCP,60,9001  >  35978 [ACK] Seq=8099597 Ack=147879059 Win=65535 Len=0
1,2.820010999999795,62.210.85.178,10.0.2.15,TCP,60,9001  >  35978 [ACK] Seq=8099597 Ack=147880519 Win=65535 Len=0
1,2.820013999999901,62.210.85.178,10.0.2.15,TCP,60,9001  >  35978 [ACK] Seq=8099597 Ack=147881669 Win=65535 Len=0
1,2.820050999999694,10.0.2.15,62.210.85.178,TLSv1.2,3030,Application Data
1,2.8200889999998253,62.210.85.178,10.0.2.15,TCP,60,9001  >  35978 [ACK] Seq=8099597 Ack=147883129 Win=65535 Len=0
1,2.8200959999999213,62.210.85.178,10.0.2.15,TCP,60,9001  >  35978 [ACK] Seq=8099597 Ack=147884589 Win=65535 Len=0
1,2.8200990000000274,62.210.85.178,10.0.2.15,TCP,60,9001  >  35978 [ACK] Seq=8099597 Ack=147884645 Win=65535 Len=0
1,2.8295899999998255,10.0.2.15,62.210.85.178,TLSv1.2,4124,Application Data
1,2.8305679999998574,62.210.85.178,10.0.2.15,TCP,60,9001  >  35978 [ACK] Seq=8099597 Ack=147886105 Win=65535 Len=0
1,2.8308210000000145,62.210.85.178,10.0.2.15,TCP,60,9001  >  35978 [ACK] Seq=8099597 Ack=147887565 Win=65535 Len=0
1,2.8308569999999236,62.210.85.178,10.0.2.15,TCP,60,9001  >  35978 [ACK] Seq=8099597 Ack=147888715 Win=65535 Len=0
1,2.8314759999998387,10.0.2.15,62.210.85.178,TLSv1.2,4124,Application Data
1,2.8320919999996477,62.210.85.178,10.0.2.15,TCP,60,9001  >  35978 [ACK] Seq=8099597 Ack=147890175 Win=65535 Len=0
1,2.832198999999946,62.210.85.178,10.0.2.15,TCP,60,9001  >  35978 [ACK] Seq=8099597 Ack=147891635 Win=65535 Len=0
1,2.8322180000000117,62.210.85.178,10.0.2.15,TCP,60,9001  >  35978 [ACK] Seq=8099597 Ack=147892785 Win=65535 Len=0
1,2.8325419999996484,10.0.2.15,62.210.85.178,TLSv1.2,4124,Application Data
1,2.8332080000000133,62.210.85.178,10.0.2.15,TCP,60,9001  >  35978 [ACK] Seq=8099597 Ack=147894245 Win=65535 Len=0
1,2.8333089999996446,62.210.85.178,10.0.2.15,TCP,60,9001  >  35978 [ACK] Seq=8099597 Ack=147895705 Win=65535 Len=0
1,2.8333189999998467,62.210.85.178,10.0.2.15,TCP,60,9001  >  35978 [ACK] Seq=8099597 Ack=147896855 Win=65535 Len=0
1,2.836935999999696,10.0.2.15,62.210.85.178,TLSv1.2,4124,Application Data
1,2.837144999999964,62.210.85.178,10.0.2.15,TCP,60,9001  >  35978 [ACK] Seq=8099597 Ack=147898315 Win=65535 Len=0
1,2.8371680000000197,62.210.85.178,10.0.2.15,TCP,60,9001  >  35978 [ACK] Seq=8099597 Ack=147899775 Win=65535 Len=0
1,2.8371729999998934,62.210.85.178,10.0.2.15,TCP,60,9001  >  35978 [ACK] Seq=8099597 Ack=147900925 Win=65535 Len=0
1,2.8374149999999645,10.0.2.15,62.210.85.178,TLSv1.2,332,Application Data
1,2.8376549999998133,62.210.85.178,10.0.2.15,TCP,60,9001  >  35978 [ACK] Seq=8099597 Ack=147901203 Win=65535 Len=0
1,2.837953999999627,10.0.2.15,62.210.85.178,TLSv1.2,3674,Application Data
1,2.838199999999688,62.210.85.178,10.0.2.15,TCP,60,9001  >  35978 [ACK] Seq=8099597 Ack=147902663 Win=65535 Len=0
1,2.838220999999976,62.210.85.178,10.0.2.15,TCP,60,9001  >  35978 [ACK] Seq=8099597 Ack=147904123 Win=65535 Len=0
1,2.8382299999998395,62.210.85.178,10.0.2.15,TCP,60,9001  >  35978 [ACK] Seq=8099597 Ack=147904823 Win=65535 Len=0
1,2.9627189999996517,54.93.77.70,10.0.2.15,TLSv1.2,4210,"Application Data, Application Data"
1,2.9629219999997076,10.0.2.15,54.93.77.70,TCP,54,34692  >  9001 [ACK] Seq=8130837 Ack=147682009 Win=65535 Len=0
1,3.0507739999998194,54.93.77.70,10.0.2.15,TLSv1.2,5846,Application Data
1,3.0508279999999104,54.93.77.70,10.0.2.15,TLSv1.2,8742,"Application Data, Application Data"
1,3.0509829999996327,10.0.2.15,54.93.77.70,TCP,54,34692  >  9001 [ACK] Seq=8130837 Ack=147696489 Win=65535 Len=0
1,3.069207000000006,54.93.77.70,10.0.2.15,TLSv1.2,2950,Application Data [TCP segment of a reassembled PDU]
1,3.069278999999824,54.93.77.70,10.0.2.15,TLSv1.2,4398,Application Data [TCP segment of a reassembled PDU]
1,3.0693449999998847,10.0.2.15,54.93.77.70,TCP,54,34692  >  9001 [ACK] Seq=8130837 Ack=147699385 Win=65535 Len=0
1,3.0694730000000163,10.0.2.15,54.93.77.70,TCP,54,34692  >  9001 [ACK] Seq=8130837 Ack=147703729 Win=65535 Len=0
1,3.0698899999997593,54.93.77.70,10.0.2.15,TLSv1.2,6266,"Application Data, Application Data, Application Data"
1,3.0699409999997442,10.0.2.15,54.93.77.70,TCP,54,34692  >  9001 [ACK] Seq=8130837 Ack=147709941 Win=65535 Len=0
1,3.070154999999886,10.0.2.15,54.93.77.70,TLSv1.2,590,Application Data
1,3.0710039999999026,54.93.77.70,10.0.2.15,TCP,60,9001  >  34692 [ACK] Seq=147709941 Ack=8131373 Win=65535 Len=0
1,3.0751499999996668,54.93.77.70,10.0.2.15,TCP,2950,"9001  >  34692 [PSH, ACK] Seq=147709941 Ack=8131373 Win=65535 Len=2896 [TCP segment of a reassembled PDU]"
1,3.075196999999662,54.93.77.70,10.0.2.15,TLSv1.2,11638,"Application Data, Application Data, Application Data"
1,3.0752619999998387,10.0.2.15,54.93.77.70,TCP,54,34692  >  9001 [ACK] Seq=8131373 Ack=147712837 Win=65535 Len=0
1,3.075398999999834,10.0.2.15,54.93.77.70,TCP,54,34692  >  9001 [ACK] Seq=8131373 Ack=147724421 Win=65535 Len=0
1,3.081543999999667,10.0.2.15,54.93.77.70,TLSv1.2,590,Application Data
1,3.0820659999999407,54.93.77.70,10.0.2.15,TCP,60,9001  >  34692 [ACK] Seq=147724421 Ack=8131909 Win=65535 Len=0
1,3.086706999999933,54.93.77.70,10.0.2.15,TLSv1.2,2950,"Application Data, Application Data"
1,3.0868000000000393,54.93.77.70,10.0.2.15,TLSv1.2,6520,"Application Data, Application Data, Application Data, Application Data"
1,3.087040999999772,10.0.2.15,54.93.77.70,TCP,54,34692  >  9001 [ACK] Seq=8131909 Ack=147733783 Win=65535 Len=0
1,3.0922099999997954,10.0.2.15,54.93.77.70,TLSv1.2,590,Application Data
1,3.092414999999619,54.93.77.70,10.0.2.15,TCP,60,9001  >  34692 [ACK] Seq=147733783 Ack=8132445 Win=65535 Len=0
1,3.1020199999998113,54.93.77.70,10.0.2.15,TCP,2950,"9001  >  34692 [PSH, ACK] Seq=147733783 Ack=8132445 Win=65535 Len=2896 [TCP segment of a reassembled PDU]"
1,3.102229999999963,10.0.2.15,54.93.77.70,TCP,54,34692  >  9001 [ACK] Seq=8132445 Ack=147736679 Win=65535 Len=0
1,3.1029069999999592,54.93.77.70,10.0.2.15,TLSv1.2,7294,"Application Data, Application Data, Application Data"
1,3.102926000000025,54.93.77.70,10.0.2.15,TLSv1.2,2950,Application Data [TCP segment of a reassembled PDU]
1,3.102991999999631,10.0.2.15,54.93.77.70,TCP,54,34692  >  9001 [ACK] Seq=8132445 Ack=147746815 Win=65535 Len=0
1,3.1034089999998287,54.93.77.70,10.0.2.15,TLSv1.2,3088,"Application Data, Application Data"
1,3.1034700000000157,10.0.2.15,54.93.77.70,TCP,54,34692  >  9001 [ACK] Seq=8132445 Ack=147749849 Win=65535 Len=0
1,3.1282859999996617,54.93.77.70,10.0.2.15,TLSv1.2,2646,Application Data
1,3.1283949999997276,10.0.2.15,54.93.77.70,TCP,54,34692  >  9001 [ACK] Seq=8132445 Ack=147752441 Win=65535 Len=0
1,3.1647189999998773,54.93.77.70,10.0.2.15,TLSv1.2,1104,Application Data
1,3.1721729999999297,10.0.2.15,54.93.77.70,TLSv1.2,590,Application Data
1,3.17235699999992,54.93.77.70,10.0.2.15,TCP,60,9001  >  34692 [ACK] Seq=147753491 Ack=8132981 Win=65535 Len=0
1,3.1912789999996676,62.210.85.178,10.0.2.15,TLSv1.2,1618,Application Data
1,3.191420999999991,10.0.2.15,62.210.85.178,TCP,54,35978  >  9001 [ACK] Seq=147904823 Ack=8101161 Win=65535 Len=0
1,3.2801359999998567,62.210.85.178,10.0.2.15,TLSv1.2,590,Application Data
1,3.282922999999755,10.0.2.15,62.210.85.178,TLSv1.2,590,Application Data
1,3.283494999999675,62.210.85.178,10.0.2.15,TCP,60,9001  >  35978 [ACK] Seq=8101697 Ack=147905359 Win=65535 Len=0
1,3.709697999999662,54.93.77.70,10.0.2.15,TLSv1.2,590,Application Data
1,3.710219000000052,10.0.2.15,54.93.77.70,TLSv1.2,590,Application Data
1,3.7103689999999006,54.93.77.70,10.0.2.15,TCP,60,9001  >  34692 [ACK] Seq=147754027 Ack=8133517 Win=65535 Len=0
1,4.017371999999796,62.210.85.178,10.0.2.15,TLSv1.2,590,Application Data
1,4.025204999999914,10.0.2.15,62.210.85.178,TLSv1.2,590,Application Data
1,4.025471999999809,62.210.85.178,10.0.2.15,TCP,60,9001  >  35978 [ACK] Seq=8102233 Ack=147905895 Win=65535 Len=0
1,4.036123999999745,10.0.2.15,62.210.85.178,TLSv1.2,4124,Application Data
1,4.036310999999841,10.0.2.15,62.210.85.178,TCP,2974,35978  >  9001 [ACK] Seq=147909965 Ack=8102233 Win=65535 Len=2920 [TCP segment of a reassembled PDU]
1,4.036341999999877,62.210.85.178,10.0.2.15,TCP,60,9001  >  35978 [ACK] Seq=8102233 Ack=147907355 Win=65535 Len=0
1,4.036353999999847,62.210.85.178,10.0.2.15,TCP,60,9001  >  35978 [ACK] Seq=8102233 Ack=147908815 Win=65535 Len=0
1,4.03635899999972,62.210.85.178,10.0.2.15,TCP,60,9001  >  35978 [ACK] Seq=8102233 Ack=147909965 Win=65535 Len=0
1,4.036364000000049,62.210.85.178,10.0.2.15,TCP,60,9001  >  35978 [ACK] Seq=8102233 Ack=147911425 Win=65535 Len=0
1,4.036368000000039,62.210.85.178,10.0.2.15,TCP,60,9001  >  35978 [ACK] Seq=8102233 Ack=147912885 Win=65535 Len=0
1,4.036473999999998,10.0.2.15,62.210.85.178,TLSv1.2,1204,Application Data
1,4.036533999999847,62.210.85.178,10.0.2.15,TCP,60,9001  >  35978 [ACK] Seq=8102233 Ack=147914035 Win=65535 Len=0
1,4.036616999999751,10.0.2.15,62.210.85.178,TLSv1.2,4124,Application Data
1,4.036827999999787,62.210.85.178,10.0.2.15,TCP,60,9001  >  35978 [ACK] Seq=8102233 Ack=147915495 Win=65535 Len=0
1,4.036841999999979,62.210.85.178,10.0.2.15,TCP,60,9001  >  35978 [ACK] Seq=8102233 Ack=147916955 Win=65535 Len=0
1,4.036846999999852,62.210.85.178,10.0.2.15,TCP,60,9001  >  35978 [ACK] Seq=8102233 Ack=147918105 Win=65535 Len=0
1,4.036908999999923,10.0.2.15,62.210.85.178,TLSv1.2,4124,Application Data
1,4.037017999999989,62.210.85.178,10.0.2.15,TCP,60,9001  >  35978 [ACK] Seq=8102233 Ack=147919565 Win=65535 Len=0
1,4.037026999999853,62.210.85.178,10.0.2.15,TCP,60,9001  >  35978 [ACK] Seq=8102233 Ack=147921025 Win=65535 Len=0
1,4.037031999999726,62.210.85.178,10.0.2.15,TCP,60,9001  >  35978 [ACK] Seq=8102233 Ack=147922175 Win=65535 Len=0
1,4.037069999999858,10.0.2.15,62.210.85.178,TLSv1.2,332,Application Data
1,4.037143999999898,10.0.2.15,62.210.85.178,TCP,2974,35978  >  9001 [ACK] Seq=147922453 Ack=8102233 Win=65535 Len=2920 [TCP segment of a reassembled PDU]
1,4.037434999999732,62.210.85.178,10.0.2.15,TCP,60,9001  >  35978 [ACK] Seq=8102233 Ack=147922453 Win=65535 Len=0
1,4.037457999999788,62.210.85.178,10.0.2.15,TCP,60,9001  >  35978 [ACK] Seq=8102233 Ack=147923913 Win=65535 Len=0
1,4.037464,62.210.85.178,10.0.2.15,TCP,60,9001  >  35978 [ACK] Seq=8102233 Ack=147925373 Win=65535 Len=0
1,4.0375199999998586,10.0.2.15,62.210.85.178,TLSv1.2,948,Application Data
1,4.037699999999859,62.210.85.178,10.0.2.15,TCP,60,9001  >  35978 [ACK] Seq=8102233 Ack=147926267 Win=65535 Len=0
1,4.037834999999632,10.0.2.15,62.210.85.178,TLSv1.2,910,Application Data
1,4.037930999999844,62.210.85.178,10.0.2.15,TCP,60,9001  >  35978 [ACK] Seq=8102233 Ack=147927123 Win=65535 Len=0
1,4.122566000000006,54.93.77.70,10.0.2.15,TLSv1.2,590,Application Data
1,4.155633999999736,54.93.77.70,10.0.2.15,TLSv1.2,3674,Application Data
1,4.155777999999827,10.0.2.15,54.93.77.70,TCP,54,34692  >  9001 [ACK] Seq=8133517 Ack=147758183 Win=65535 Len=0
1,4.2403989999997975,54.93.77.70,10.0.2.15,TLSv1.2,3674,Application Data
1,4.2404899999996815,10.0.2.15,54.93.77.70,TCP,54,34692  >  9001 [ACK] Seq=8133517 Ack=147761803 Win=65535 Len=0
1,4.251342000000022,54.93.77.70,10.0.2.15,TLSv1.2,4398,Application Data
1,4.251558999999816,10.0.2.15,54.93.77.70,TCP,54,34692  >  9001 [ACK] Seq=8133517 Ack=147766147 Win=65535 Len=0
1,4.251964000000044,10.0.2.15,54.93.77.70,TLSv1.2,590,Application Data
1,4.252530999999635,54.93.77.70,10.0.2.15,TLSv1.2,5846,Application Data [TCP segment of a reassembled PDU]
1,4.252555000000029,54.93.77.70,10.0.2.15,TCP,60,9001  >  34692 [ACK] Seq=147771939 Ack=8134053 Win=65535 Len=0
1,4.252628999999615,10.0.2.15,54.93.77.70,TCP,54,34692  >  9001 [ACK] Seq=8134053 Ack=147771939 Win=65535 Len=0
1,4.257858999999826,54.93.77.70,10.0.2.15,TLSv1.2,1806,Application Data
1,4.257959999999912,10.0.2.15,54.93.77.70,TCP,54,34692  >  9001 [ACK] Seq=8134053 Ack=147773691 Win=65535 Len=0
1,4.2724889999999505,54.93.77.70,10.0.2.15,TCP,1502,"9001  >  34692 [PSH, ACK] Seq=147773691 Ack=8134053 Win=65535 Len=1448 [TCP segment of a reassembled PDU]"
1,4.272602000000006,10.0.2.15,54.93.77.70,TCP,54,34692  >  9001 [ACK] Seq=8134053 Ack=147775139 Win=65535 Len=0
1,4.274112000000059,54.93.77.70,10.0.2.15,TLSv1.2,684,Application Data
1,4.276482999999644,10.0.2.15,54.93.77.70,TLSv1.2,590,Application Data
1,4.27665799999977,54.93.77.70,10.0.2.15,TCP,60,9001  >  34692 [ACK] Seq=147775769 Ack=8134589 Win=65535 Len=0
1,4.374831999999969,62.210.85.178,10.0.2.15,TLSv1.2,590,Application Data
1,4.418381999999838,10.0.2.15,62.210.85.178,TCP,54,35978  >  9001 [ACK] Seq=147927123 Ack=8102769 Win=65535 Len=0
1,4.475314999999682,62.210.85.178,10.0.2.15,TLSv1.2,590,Application Data
1,4.475399999999809,10.0.2.15,62.210.85.178,TCP,54,35978  >  9001 [ACK] Seq=147927123 Ack=8103305 Win=65535 Len=0
1,4.475926999999956,10.0.2.15,62.210.85.178,TLSv1.2,590,Application Data
1,4.476047999999992,62.210.85.178,10.0.2.15,TCP,60,9001  >  35978 [ACK] Seq=8103305 Ack=147927659 Win=65535 Len=0
1,4.93836599999986,54.93.77.70,10.0.2.15,TLSv1.2,590,Application Data
1,4.93892199999982,10.0.2.15,54.93.77.70,TLSv1.2,590,Application Data
1,4.939093999999841,54.93.77.70,10.0.2.15,TCP,60,9001  >  34692 [ACK] Seq=147776305 Ack=8135125 Win=65535 Len=0
1,5.046474999999646,62.210.85.178,10.0.2.15,TLSv1.2,590,Application Data
1,5.05590600000005,10.0.2.15,62.210.85.178,TLSv1.2,590,Application Data
1,5.056118999999853,62.210.85.178,10.0.2.15,TCP,60,9001  >  35978 [ACK] Seq=8103841 Ack=147928195 Win=65535 Len=0
1,5.067458999999872,10.0.2.15,62.210.85.178,TLSv1.2,4124,Application Data
1,5.067740999999842,62.210.85.178,10.0.2.15,TCP,60,9001  >  35978 [ACK] Seq=8103841 Ack=147929655 Win=65535 Len=0
1,5.067798000000039,62.210.85.178,10.0.2.15,TCP,60,9001  >  35978 [ACK] Seq=8103841 Ack=147931115 Win=65535 Len=0
1,5.067802999999913,62.210.85.178,10.0.2.15,TCP,60,9001  >  35978 [ACK] Seq=8103841 Ack=147932265 Win=65535 Len=0
1,5.06790299999966,10.0.2.15,62.210.85.178,TLSv1.2,4124,Application Data
1,5.068025000000034,62.210.85.178,10.0.2.15,TCP,60,9001  >  35978 [ACK] Seq=8103841 Ack=147933725 Win=65535 Len=0
1,5.0680389999997715,62.210.85.178,10.0.2.15,TCP,60,9001  >  35978 [ACK] Seq=8103841 Ack=147935185 Win=65535 Len=0
1,5.068042999999761,62.210.85.178,10.0.2.15,TCP,60,9001  >  35978 [ACK] Seq=8103841 Ack=147936335 Win=65535 Len=0
1,5.068103000000065,10.0.2.15,62.210.85.178,TLSv1.2,4124,Application Data
1,5.068198999999822,62.210.85.178,10.0.2.15,TCP,60,9001  >  35978 [ACK] Seq=8103841 Ack=147937795 Win=65535 Len=0
1,5.068205999999918,62.210.85.178,10.0.2.15,TCP,60,9001  >  35978 [ACK] Seq=8103841 Ack=147939255 Win=65535 Len=0
1,5.068210999999792,62.210.85.178,10.0.2.15,TCP,60,9001  >  35978 [ACK] Seq=8103841 Ack=147940405 Win=65535 Len=0
1,5.068257999999787,10.0.2.15,62.210.85.178,TLSv1.2,1810,Application Data
1,5.068353999999999,62.210.85.178,10.0.2.15,TCP,60,9001  >  35978 [ACK] Seq=8103841 Ack=147941865 Win=65535 Len=0
1,5.068361999999979,62.210.85.178,10.0.2.15,TCP,60,9001  >  35978 [ACK] Seq=8103841 Ack=147942161 Win=65535 Len=0
1,5.14714099999992,54.93.77.70,10.0.2.15,TLSv1.2,590,Application Data
1,5.190393999999742,10.0.2.15,54.93.77.70,TCP,54,34692  >  9001 [ACK] Seq=8135125 Ack=147776841 Win=65535 Len=0
1,5.553386000000046,54.93.77.70,10.0.2.15,TCP,2950,"9001  >  34692 [PSH, ACK] Seq=147776841 Ack=8135125 Win=65535 Len=2896 [TCP segment of a reassembled PDU]"
1,5.55365699999993,10.0.2.15,54.93.77.70,TCP,54,34692  >  9001 [ACK] Seq=8135125 Ack=147779737 Win=65535 Len=0
1,5.5561109999998735,54.93.77.70,10.0.2.15,TLSv1.2,1502,Application Data [TCP segment of a reassembled PDU]
1,5.556159999999636,54.93.77.70,10.0.2.15,TLSv1.2,2436,Application Data
1,5.556169999999838,54.93.77.70,10.0.2.15,TLSv1.2,7294,"Application Data, Application Data"
1,5.556245999999646,10.0.2.15,54.93.77.70,TCP,54,34692  >  9001 [ACK] Seq=8135125 Ack=147781185 Win=65535 Len=0
1,5.556303999999727,10.0.2.15,54.93.77.70,TCP,54,34692  >  9001 [ACK] Seq=8135125 Ack=147783567 Win=65535 Len=0
1,5.556332999999995,10.0.2.15,54.93.77.70,TCP,54,34692  >  9001 [ACK] Seq=8135125 Ack=147790807 Win=65535 Len=0
1,5.573309999999765,54.93.77.70,10.0.2.15,TLSv1.2,76,Application Data
1,5.573429999999917,10.0.2.15,54.93.77.70,TCP,54,34692  >  9001 [ACK] Seq=8135125 Ack=147790829 Win=65535 Len=0
1,5.576600999999755,10.0.2.15,54.93.77.70,TLSv1.2,590,Application Data
1,5.5768669999997655,54.93.77.70,10.0.2.15,TCP,60,9001  >  34692 [ACK] Seq=147790829 Ack=8135661 Win=65535 Len=0
1,6.064586999999847,62.210.85.178,10.0.2.15,TLSv1.2,590,Application Data
1,6.064962999999807,10.0.2.15,62.210.85.178,TLSv1.2,590,Application Data
1,6.065086000000065,62.210.85.178,10.0.2.15,TCP,60,9001  >  35978 [ACK] Seq=8104377 Ack=147942697 Win=65535 Len=0
1,6.160058999999819,54.93.77.70,10.0.2.15,TLSv1.2,590,Application Data
1,6.16060299999981,10.0.2.15,54.93.77.70,TLSv1.2,590,Application Data
1,6.160985999999866,54.93.77.70,10.0.2.15,TCP,60,9001  >  34692 [ACK] Seq=147791365 Ack=8136197 Win=65535 Len=0
1,6.273405999999795,62.210.85.178,10.0.2.15,TLSv1.2,590,Application Data
1,6.278211999999712,10.0.2.15,62.210.85.178,TLSv1.2,590,Application Data
1,6.278729999999996,62.210.85.178,10.0.2.15,TCP,60,9001  >  35978 [ACK] Seq=8104913 Ack=147943233 Win=65535 Len=0
1,6.2909059999997226,10.0.2.15,62.210.85.178,TLSv1.2,4124,Application Data
1,6.291056000000026,10.0.2.15,62.210.85.178,TCP,2974,35978  >  9001 [ACK] Seq=147947303 Ack=8104913 Win=65535 Len=2920 [TCP segment of a reassembled PDU]
1,6.291103999999905,62.210.85.178,10.0.2.15,TCP,60,9001  >  35978 [ACK] Seq=8104913 Ack=147944693 Win=65535 Len=0
1,6.291117999999642,62.210.85.178,10.0.2.15,TCP,60,9001  >  35978 [ACK] Seq=8104913 Ack=147946153 Win=65535 Len=0
1,6.2911229999999705,62.210.85.178,10.0.2.15,TCP,60,9001  >  35978 [ACK] Seq=8104913 Ack=147947303 Win=65535 Len=0
1,6.291125999999622,62.210.85.178,10.0.2.15,TCP,60,9001  >  35978 [ACK] Seq=8104913 Ack=147948763 Win=65535 Len=0
1,6.291127999999844,62.210.85.178,10.0.2.15,TCP,60,9001  >  35978 [ACK] Seq=8104913 Ack=147950223 Win=65535 Len=0
1,6.291165999999976,10.0.2.15,62.210.85.178,TLSv1.2,1204,Application Data
1,6.2912029999997685,62.210.85.178,10.0.2.15,TCP,60,9001  >  35978 [ACK] Seq=8104913 Ack=147951373 Win=65535 Len=0
1,6.2912499999997635,10.0.2.15,62.210.85.178,TLSv1.2,4124,Application Data
1,6.291287999999895,62.210.85.178,10.0.2.15,TCP,60,9001  >  35978 [ACK] Seq=8104913 Ack=147952833 Win=65535 Len=0
1,6.291294999999991,62.210.85.178,10.0.2.15,TCP,60,9001  >  35978 [ACK] Seq=8104913 Ack=147954293 Win=65535 Len=0
1,6.291298999999981,62.210.85.178,10.0.2.15,TCP,60,9001  >  35978 [ACK] Seq=8104913 Ack=147955443 Win=65535 Len=0
1,6.291348999999627,10.0.2.15,62.210.85.178,TLSv1.2,4124,Application Data
1,6.291384999999991,62.210.85.178,10.0.2.15,TCP,60,9001  >  35978 [ACK] Seq=8104913 Ack=147956903 Win=65535 Len=0
1,6.291392999999971,62.210.85.178,10.0.2.15,TCP,60,9001  >  35978 [ACK] Seq=8104913 Ack=147958363 Win=65535 Len=0
1,6.29143299999987,62.210.85.178,10.0.2.15,TCP,60,9001  >  35978 [ACK] Seq=8104913 Ack=147959513 Win=65535 Len=0
1,6.291468999999779,10.0.2.15,62.210.85.178,TLSv1.2,332,Application Data
1,6.291503999999804,62.210.85.178,10.0.2.15,TCP,60,9001  >  35978 [ACK] Seq=8104913 Ack=147959791 Win=65535 Len=0
1,6.291562999999769,10.0.2.15,62.210.85.178,TLSv1.2,3868,Application Data
1,6.291601999999784,62.210.85.178,10.0.2.15,TCP,60,9001  >  35978 [ACK] Seq=8104913 Ack=147961251 Win=65535 Len=0
1,6.29160899999988,62.210.85.178,10.0.2.15,TCP,60,9001  >  35978 [ACK] Seq=8104913 Ack=147962711 Win=65535 Len=0
1,6.291611999999986,62.210.85.178,10.0.2.15,TCP,60,9001  >  35978 [ACK] Seq=8104913 Ack=147963605 Win=65535 Len=0
1,6.291651000000002,10.0.2.15,62.210.85.178,TLSv1.2,4124,Application Data
1,6.291686999999911,62.210.85.178,10.0.2.15,TCP,60,9001  >  35978 [ACK] Seq=8104913 Ack=147965065 Win=65535 Len=0
1,6.291694999999891,62.210.85.178,10.0.2.15,TCP,60,9001  >  35978 [ACK] Seq=8104913 Ack=147966525 Win=65535 Len=0
1,6.291697999999997,62.210.85.178,10.0.2.15,TCP,60,9001  >  35978 [ACK] Seq=8104913 Ack=147967675 Win=65535 Len=0
1,6.291733999999906,10.0.2.15,62.210.85.178,TLSv1.2,3030,Application Data
1,6.291770999999699,62.210.85.178,10.0.2.15,TCP,60,9001  >  35978 [ACK] Seq=8104913 Ack=147969135 Win=65535 Len=0
1,6.291777999999795,62.210.85.178,10.0.2.15,TCP,60,9001  >  35978 [ACK] Seq=8104913 Ack=147970595 Win=65535 Len=0
1,6.291780999999901,62.210.85.178,10.0.2.15,TCP,60,9001  >  35978 [ACK] Seq=8104913 Ack=147970651 Win=65535 Len=0
1,6.301098999999795,10.0.2.15,62.210.85.178,TLSv1.2,4124,Application Data
1,6.301326999999674,62.210.85.178,10.0.2.15,TCP,60,9001  >  35978 [ACK] Seq=8104913 Ack=147972111 Win=65535 Len=0
1,6.3013819999996485,62.210.85.178,10.0.2.15,TCP,60,9001  >  35978 [ACK] Seq=8104913 Ack=147973571 Win=65535 Len=0
1,6.301391999999851,62.210.85.178,10.0.2.15,TCP,60,9001  >  35978 [ACK] Seq=8104913 Ack=147974721 Win=65535 Len=0
1,6.301531999999952,10.0.2.15,62.210.85.178,TLSv1.2,3738,Application Data
1,6.301648999999998,62.210.85.178,10.0.2.15,TCP,60,9001  >  35978 [ACK] Seq=8104913 Ack=147976181 Win=65535 Len=0
1,6.301663999999619,62.210.85.178,10.0.2.15,TCP,60,9001  >  35978 [ACK] Seq=8104913 Ack=147977641 Win=65535 Len=0
1,6.301672000000053,62.210.85.178,10.0.2.15,TCP,60,9001  >  35978 [ACK] Seq=8104913 Ack=147978405 Win=65535 Len=0
1,6.402559999999994,54.93.77.70,10.0.2.15,TLSv1.2,4210,"Application Data, Application Data"
1,6.4029569999997875,10.0.2.15,54.93.77.70,TCP,54,34692  >  9001 [ACK] Seq=8136197 Ack=147795521 Win=65535 Len=0
1,6.410288999999921,54.93.77.70,10.0.2.15,TCP,2950,"9001  >  34692 [PSH, ACK] Seq=147795521 Ack=8136197 Win=65535 Len=2896 [TCP segment of a reassembled PDU]"
1,6.410378999999921,10.0.2.15,54.93.77.70,TCP,54,34692  >  9001 [ACK] Seq=8136197 Ack=147798417 Win=65535 Len=0
1,6.418761999999788,54.93.77.70,10.0.2.15,TLSv1.2,778,Application Data
1,6.450774999999794,54.93.77.70,10.0.2.15,TLSv1.2,590,Application Data
1,6.450884999999744,10.0.2.15,54.93.77.70,TCP,54,34692  >  9001 [ACK] Seq=8136197 Ack=147799677 Win=65535 Len=0
1,6.531778000000031,54.93.77.70,10.0.2.15,TCP,1502,"9001  >  34692 [PSH, ACK] Seq=147799677 Ack=8136197 Win=65535 Len=1448 [TCP segment of a reassembled PDU]"
1,6.531908999999814,10.0.2.15,54.93.77.70,TCP,54,34692  >  9001 [ACK] Seq=8136197 Ack=147801125 Win=65535 Len=0
1,6.534569999999803,54.93.77.70,10.0.2.15,TLSv1.2,10190,"Application Data, Application Data"
1,6.534666000000016,54.93.77.70,10.0.2.15,TLSv1.2,2950,Application Data [TCP segment of a reassembled PDU]
1,6.534858999999869,10.0.2.15,54.93.77.70,TCP,54,34692  >  9001 [ACK] Seq=8136197 Ack=147814157 Win=65535 Len=0
1,6.549105000000054,54.93.77.70,10.0.2.15,TLSv1.2,2950,"Application Data, Application Data"
1,6.549495999999635,10.0.2.15,54.93.77.70,TCP,54,34692  >  9001 [ACK] Seq=8136197 Ack=147817053 Win=65535 Len=0
1,6.551291999999648,10.0.2.15,54.93.77.70,TLSv1.2,590,Application Data
1,6.551418999999896,54.93.77.70,10.0.2.15,TCP,2950,"9001  >  34692 [PSH, ACK] Seq=147817053 Ack=8136197 Win=65535 Len=2896 [TCP segment of a reassembled PDU]"
1,6.551436999999623,54.93.77.70,10.0.2.15,TLSv1.2,2950,Application Data [TCP segment of a reassembled PDU]
1,6.551442999999836,54.93.77.70,10.0.2.15,TCP,60,9001  >  34692 [ACK] Seq=147822845 Ack=8136733 Win=65535 Len=0
1,6.551539999999932,10.0.2.15,54.93.77.70,TCP,54,34692  >  9001 [ACK] Seq=8136733 Ack=147822845 Win=65535 Len=0
1,6.552643999999873,54.93.77.70,10.0.2.15,TLSv1.2,4304,"Application Data, Application Data"
1,6.5527579999998125,10.0.2.15,54.93.77.70,TCP,54,34692  >  9001 [ACK] Seq=8136733 Ack=147827095 Win=65535 Len=0
1,6.564568999999665,10.0.2.15,54.93.77.70,TLSv1.2,1104,Application Data
1,6.566624999999931,54.93.77.70,10.0.2.15,TCP,60,9001  >  34692 [ACK] Seq=147827095 Ack=8137783 Win=65535 Len=0
1,6.69069300000001,62.210.85.178,10.0.2.15,TLSv1.2,590,Application Data
1,6.7347139999997125,10.0.2.15,62.210.85.178,TCP,54,35978  >  9001 [ACK] Seq=147978405 Ack=8105449 Win=65535 Len=0
1,6.787094999999681,62.210.85.178,10.0.2.15,TLSv1.2,1104,Application Data
1,6.787315000000035,10.0.2.15,62.210.85.178,TCP,54,35978  >  9001 [ACK] Seq=147978405 Ack=8106499 Win=65535 Len=0
1,6.787766999999803,10.0.2.15,62.210.85.178,TLSv1.2,590,Application Data
1,6.788861999999881,62.210.85.178,10.0.2.15,TCP,60,9001  >  35978 [ACK] Seq=8106499 Ack=147978941 Win=65535 Len=0
1,6.908308999999917,54.93.77.70,10.0.2.15,TLSv1.2,590,Application Data
1,6.908838999999716,10.0.2.15,54.93.77.70,TLSv1.2,590,Application Data
1,6.908930000000055,54.93.77.70,10.0.2.15,TCP,60,9001  >  34692 [ACK] Seq=147827631 Ack=8138319 Win=65535 Len=0
1,7.090803000000051,62.210.85.178,10.0.2.15,TLSv1.2,590,Application Data
1,7.095521999999619,10.0.2.15,62.210.85.178,TLSv1.2,590,Application Data
1,7.095856999999796,62.210.85.178,10.0.2.15,TCP,60,9001  >  35978 [ACK] Seq=8107035 Ack=147979477 Win=65535 Len=0
1,7.106531999999788,10.0.2.15,62.210.85.178,TLSv1.2,4124,Application Data
1,7.1067519999996875,62.210.85.178,10.0.2.15,TCP,60,9001  >  35978 [ACK] Seq=8107035 Ack=147980937 Win=65535 Len=0
1,7.106773999999859,62.210.85.178,10.0.2.15,TCP,60,9001  >  35978 [ACK] Seq=8107035 Ack=147982397 Win=65535 Len=0
1,7.106778999999733,62.210.85.178,10.0.2.15,TCP,60,9001  >  35978 [ACK] Seq=8107035 Ack=147983547 Win=65535 Len=0
1,7.106862999999976,10.0.2.15,62.210.85.178,TLSv1.2,4124,Application Data
1,7.106970999999703,62.210.85.178,10.0.2.15,TCP,60,9001  >  35978 [ACK] Seq=8107035 Ack=147985007 Win=65535 Len=0
1,7.106982999999673,62.210.85.178,10.0.2.15,TCP,60,9001  >  35978 [ACK] Seq=8107035 Ack=147986467 Win=65535 Len=0
1,7.106988000000001,62.210.85.178,10.0.2.15,TCP,60,9001  >  35978 [ACK] Seq=8107035 Ack=147987617 Win=65535 Len=0
1,7.10703999999987,10.0.2.15,62.210.85.178,TLSv1.2,4124,Application Data
1,7.1071179999999,62.210.85.178,10.0.2.15,TCP,60,9001  >  35978 [ACK] Seq=8107035 Ack=147989077 Win=65535 Len=0
1,7.107126999999764,62.210.85.178,10.0.2.15,TCP,60,9001  >  35978 [ACK] Seq=8107035 Ack=147990537 Win=65535 Len=0
1,7.107131999999638,62.210.85.178,10.0.2.15,TCP,60,9001  >  35978 [ACK] Seq=8107035 Ack=147991687 Win=65535 Len=0
1,7.107170999999653,10.0.2.15,62.210.85.178,TLSv1.2,4124,Application Data
1,7.107263999999759,62.210.85.178,10.0.2.15,TCP,60,9001  >  35978 [ACK] Seq=8107035 Ack=147993147 Win=65535 Len=0
1,7.107282999999825,62.210.85.178,10.0.2.15,TCP,60,9001  >  35978 [ACK] Seq=8107035 Ack=147994607 Win=65535 Len=0
1,7.1072879999996985,62.210.85.178,10.0.2.15,TCP,60,9001  >  35978 [ACK] Seq=8107035 Ack=147995757 Win=65535 Len=0
1,7.107363999999961,10.0.2.15,62.210.85.178,TLSv1.2,332,Application Data
1,7.107488999999987,62.210.85.178,10.0.2.15,TCP,60,9001  >  35978 [ACK] Seq=8107035 Ack=147996035 Win=65535 Len=0
1,7.1076530000000275,10.0.2.15,62.210.85.178,TLSv1.2,1618,Application Data
1,7.107728999999836,62.210.85.178,10.0.2.15,TCP,60,9001  >  35978 [ACK] Seq=8107035 Ack=147997495 Win=65535 Len=0
1,7.107737999999699,62.210.85.178,10.0.2.15,TCP,60,9001  >  35978 [ACK] Seq=8107035 Ack=147997599 Win=65535 Len=0
1,7.196316000000024,54.93.77.70,10.0.2.15,TLSv1.2,590,Application Data
1,7.226776999999856,54.93.77.70,10.0.2.15,TCP,2950,"9001  >  34692 [PSH, ACK] Seq=147828167 Ack=8138319 Win=65535 Len=2896 [TCP segment of a reassembled PDU]"
1,7.2268810000000485,10.0.2.15,54.93.77.70,TCP,54,34692  >  9001 [ACK] Seq=8138319 Ack=147831063 Win=65535 Len=0
1,7.242506999999932,54.93.77.70,10.0.2.15,TLSv1.2,264,Application Data
1,7.286540000000059,10.0.2.15,54.93.77.70,TCP,54,34692  >  9001 [ACK] Seq=8138319 Ack=147831273 Win=65535 Len=0
1,7.303114999999707,54.93.77.70,10.0.2.15,TLSv1.2,590,Application Data
1,7.303203999999823,10.0.2.15,54.93.77.70,TCP,54,34692  >  9001 [ACK] Seq=8138319 Ack=147831809 Win=65535 Len=0
1,7.319833000000017,54.93.77.70,10.0.2.15,TCP,2950,"9001  >  34692 [PSH, ACK] Seq=147831809 Ack=8138319 Win=65535 Len=2896 [TCP segment of a reassembled PDU]"
1,7.319892999999865,54.93.77.70,10.0.2.15,TLSv1.2,8742,"Application Data, Application Data"
1,7.31995599999982,10.0.2.15,54.93.77.70,TCP,54,34692  >  9001 [ACK] Seq=8138319 Ack=147834705 Win=65535 Len=0
1,7.320003999999699,10.0.2.15,54.93.77.70,TCP,54,34692  >  9001 [ACK] Seq=8138319 Ack=147843393 Win=65535 Len=0
1,7.320807999999943,54.93.77.70,10.0.2.15,TLSv1.2,358,Application Data
1,7.320877999999993,10.0.2.15,54.93.77.70,TCP,54,34692  >  9001 [ACK] Seq=8138319 Ack=147843697 Win=65535 Len=0
1,7.335446000000047,54.93.77.70,10.0.2.15,TCP,1502,"9001  >  34692 [PSH, ACK] Seq=147843697 Ack=8138319 Win=65535 Len=1448 [TCP segment of a reassembled PDU]"
1,7.335638999999901,10.0.2.15,54.93.77.70,TCP,54,34692  >  9001 [ACK] Seq=8138319 Ack=147845145 Win=65535 Len=0
1,7.336671000000024,54.93.77.70,10.0.2.15,TLSv1.2,1198,Application Data
1,7.3367129999996905,10.0.2.15,54.93.77.70,TCP,54,34692  >  9001 [ACK] Seq=8138319 Ack=147846289 Win=65535 Len=0
1,7.341202000000067,10.0.2.15,54.93.77.70,TLSv1.2,590,Application Data
1,7.341394000000037,54.93.77.70,10.0.2.15,TCP,60,9001  >  34692 [ACK] Seq=147846289 Ack=8138855 Win=65535 Len=0
1,7.499225999999908,62.210.85.178,10.0.2.15,TLSv1.2,590,Application Data
1,7.499769999999899,10.0.2.15,62.210.85.178,TLSv1.2,590,Application Data
1,7.49989400000004,62.210.85.178,10.0.2.15,TCP,60,9001  >  35978 [ACK] Seq=8107571 Ack=147998135 Win=65535 Len=0
1,7.610948999999891,54.93.77.70,10.0.2.15,TLSv1.2,590,Application Data
1,7.6114749999997,10.0.2.15,54.93.77.70,TLSv1.2,590,Application Data
1,7.611685999999736,54.93.77.70,10.0.2.15,TCP,60,9001  >  34692 [ACK] Seq=147846825 Ack=8139391 Win=65535 Len=0
1,7.805409000000054,62.210.85.178,10.0.2.15,TLSv1.2,590,Application Data
1,7.810729999999694,10.0.2.15,62.210.85.178,TLSv1.2,590,Application Data
1,7.811273999999685,62.210.85.178,10.0.2.15,TCP,60,9001  >  35978 [ACK] Seq=8108107 Ack=147998671 Win=65535 Len=0
1,7.822791000000052,10.0.2.15,62.210.85.178,TLSv1.2,4124,Application Data
1,7.822944000000007,10.0.2.15,62.210.85.178,TCP,2974,35978  >  9001 [ACK] Seq=148002741 Ack=8108107 Win=65535 Len=2920 [TCP segment of a reassembled PDU]
1,7.823010999999951,62.210.85.178,10.0.2.15,TCP,60,9001  >  35978 [ACK] Seq=8108107 Ack=148000131 Win=65535 Len=0
1,7.823026000000027,62.210.85.178,10.0.2.15,TCP,60,9001  >  35978 [ACK] Seq=8108107 Ack=148001591 Win=65535 Len=0
1,7.823031999999785,62.210.85.178,10.0.2.15,TCP,60,9001  >  35978 [ACK] Seq=8108107 Ack=148002741 Win=65535 Len=0
1,7.823093999999855,10.0.2.15,62.210.85.178,TLSv1.2,1204,Application Data
1,7.823149999999714,62.210.85.178,10.0.2.15,TCP,60,9001  >  35978 [ACK] Seq=8108107 Ack=148004201 Win=65535 Len=0
1,7.823159999999916,62.210.85.178,10.0.2.15,TCP,60,9001  >  35978 [ACK] Seq=8108107 Ack=148005661 Win=65535 Len=0
1,7.82316499999979,62.210.85.178,10.0.2.15,TCP,60,9001  >  35978 [ACK] Seq=8108107 Ack=148006811 Win=65535 Len=0
1,7.8232279999997445,10.0.2.15,62.210.85.178,TLSv1.2,4124,Application Data
1,7.823282999999719,62.210.85.178,10.0.2.15,TCP,60,9001  >  35978 [ACK] Seq=8108107 Ack=148008271 Win=65535 Len=0
1,7.8232929999999214,62.210.85.178,10.0.2.15,TCP,60,9001  >  35978 [ACK] Seq=8108107 Ack=148009731 Win=65535 Len=0
1,7.823298999999679,62.210.85.178,10.0.2.15,TCP,60,9001  >  35978 [ACK] Seq=8108107 Ack=148010881 Win=65535 Len=0
1,7.82336099999975,10.0.2.15,62.210.85.178,TLSv1.2,4124,Application Data
1,7.823415999999725,62.210.85.178,10.0.2.15,TCP,60,9001  >  35978 [ACK] Seq=8108107 Ack=148012341 Win=65535 Len=0
1,7.8234269999998105,62.210.85.178,10.0.2.15,TCP,60,9001  >  35978 [ACK] Seq=8108107 Ack=148013801 Win=65535 Len=0
1,7.82343499999979,62.210.85.178,10.0.2.15,TCP,60,9001  >  35978 [ACK] Seq=8108107 Ack=148014951 Win=65535 Len=0
1,7.823495999999977,10.0.2.15,62.210.85.178,TLSv1.2,332,Application Data
1,7.82354899999973,62.210.85.178,10.0.2.15,TCP,60,9001  >  35978 [ACK] Seq=8108107 Ack=148015229 Win=65535 Len=0
1,7.8236329999999725,10.0.2.15,62.210.85.178,TLSv1.2,3868,Application Data
1,7.823684999999841,62.210.85.178,10.0.2.15,TCP,60,9001  >  35978 [ACK] Seq=8108107 Ack=148016689 Win=65535 Len=0
1,7.823695000000043,62.210.85.178,10.0.2.15,TCP,60,9001  >  35978 [ACK] Seq=8108107 Ack=148018149 Win=65535 Len=0
1,7.823699999999917,62.210.85.178,10.0.2.15,TCP,60,9001  >  35978 [ACK] Seq=8108107 Ack=148019043 Win=65535 Len=0
1,7.823764999999639,10.0.2.15,62.210.85.178,TLSv1.2,4124,Application Data
1,7.823819999999614,62.210.85.178,10.0.2.15,TCP,60,9001  >  35978 [ACK] Seq=8108107 Ack=148020503 Win=65535 Len=0
1,7.8238320000000385,62.210.85.178,10.0.2.15,TCP,60,9001  >  35978 [ACK] Seq=8108107 Ack=148021963 Win=65535 Len=0
1,7.823836999999912,62.210.85.178,10.0.2.15,TCP,60,9001  >  35978 [ACK] Seq=8108107 Ack=148023113 Win=65535 Len=0
1,7.823892999999771,10.0.2.15,62.210.85.178,TLSv1.2,3030,Application Data
1,7.8239449999996395,62.210.85.178,10.0.2.15,TCP,60,9001  >  35978 [ACK] Seq=8108107 Ack=148024573 Win=65535 Len=0
1,7.823957000000064,62.210.85.178,10.0.2.15,TCP,60,9001  >  35978 [ACK] Seq=8108107 Ack=148026033 Win=65535 Len=0
1,7.823961999999938,62.210.85.178,10.0.2.15,TCP,60,9001  >  35978 [ACK] Seq=8108107 Ack=148026089 Win=65535 Len=0
1,7.833701999999903,10.0.2.15,62.210.85.178,TLSv1.2,4124,Application Data
1,7.833901999999853,62.210.85.178,10.0.2.15,TCP,60,9001  >  35978 [ACK] Seq=8108107 Ack=148027549 Win=65535 Len=0
1,7.833922999999686,62.210.85.178,10.0.2.15,TCP,60,9001  >  35978 [ACK] Seq=8108107 Ack=148029009 Win=65535 Len=0
1,7.833928000000014,62.210.85.178,10.0.2.15,TCP,60,9001  >  35978 [ACK] Seq=8108107 Ack=148030159 Win=65535 Len=0
1,7.834016999999676,10.0.2.15,62.210.85.178,TLSv1.2,4124,Application Data
1,7.834102999999686,62.210.85.178,10.0.2.15,TCP,60,9001  >  35978 [ACK] Seq=8108107 Ack=148031619 Win=65535 Len=0
1,7.834110999999666,62.210.85.178,10.0.2.15,TCP,60,9001  >  35978 [ACK] Seq=8108107 Ack=148033079 Win=65535 Len=0
1,7.8341159999999945,62.210.85.178,10.0.2.15,TCP,60,9001  >  35978 [ACK] Seq=8108107 Ack=148034229 Win=65535 Len=0
1,7.834182999999939,10.0.2.15,62.210.85.178,TLSv1.2,4124,Application Data
1,7.834298999999646,62.210.85.178,10.0.2.15,TCP,60,9001  >  35978 [ACK] Seq=8108107 Ack=148035689 Win=65535 Len=0
1,7.834317999999712,62.210.85.178,10.0.2.15,TCP,60,9001  >  35978 [ACK] Seq=8108107 Ack=148037149 Win=65535 Len=0
1,7.83432300000004,62.210.85.178,10.0.2.15,TCP,60,9001  >  35978 [ACK] Seq=8108107 Ack=148038299 Win=65535 Len=0
1,7.834389999999985,10.0.2.15,62.210.85.178,TLSv1.2,1296,Application Data
1,7.8344600000000355,62.210.85.178,10.0.2.15,TCP,60,9001  >  35978 [ACK] Seq=8108107 Ack=148039541 Win=65535 Len=0
1,7.90258300000005,54.93.77.70,10.0.2.15,TLSv1.2,590,Application Data
1,7.946410000000014,10.0.2.15,54.93.77.70,TCP,54,34692  >  9001 [ACK] Seq=8139391 Ack=147847361 Win=65535 Len=0
1,7.960227000000032,54.93.77.70,10.0.2.15,TCP,2950,"9001  >  34692 [PSH, ACK] Seq=147847361 Ack=8139391 Win=65535 Len=2896 [TCP segment of a reassembled PDU]"
1,7.960325999999895,10.0.2.15,54.93.77.70,TCP,54,34692  >  9001 [ACK] Seq=8139391 Ack=147850257 Win=65535 Len=0
1,7.964629000000059,54.93.77.70,10.0.2.15,TLSv1.2,11090,"Application Data, Application Data, Application Data"
1,7.9647399999998925,10.0.2.15,54.93.77.70,TCP,54,34692  >  9001 [ACK] Seq=8139391 Ack=147861293 Win=65535 Len=0
1,7.979440999999952,54.93.77.70,10.0.2.15,TLSv1.2,2950,Application Data [TCP segment of a reassembled PDU]
1,7.979585999999927,10.0.2.15,54.93.77.70,TCP,54,34692  >  9001 [ACK] Seq=8139391 Ack=147864189 Win=65535 Len=0
1,7.979655999999977,54.93.77.70,10.0.2.15,TLSv1.2,2950,Application Data [TCP segment of a reassembled PDU]
1,7.97969699999976,10.0.2.15,54.93.77.70,TCP,54,34692  >  9001 [ACK] Seq=8139391 Ack=147867085 Win=65535 Len=0
1,7.980939000000035,54.93.77.70,10.0.2.15,TLSv1.2,1536,Application Data
1,7.981038999999782,10.0.2.15,54.93.77.70,TCP,54,34692  >  9001 [ACK] Seq=8139391 Ack=147868567 Win=65535 Len=0
1,7.982212999999774,54.93.77.70,10.0.2.15,TLSv1.2,10190,"Application Data, Application Data"
1,7.982295999999678,10.0.2.15,54.93.77.70,TCP,54,34692  >  9001 [ACK] Seq=8139391 Ack=147878703 Win=65535 Len=0
1,7.982561999999689,10.0.2.15,54.93.77.70,TLSv1.2,590,Application Data
1,7.983072999999877,54.93.77.70,10.0.2.15,TLSv1.2,5846,"Application Data, Application Data"
1,7.983099999999922,54.93.77.70,10.0.2.15,TCP,60,9001  >  34692 [ACK] Seq=147884495 Ack=8139927 Win=65535 Len=0
1,7.983154000000013,10.0.2.15,54.93.77.70,TCP,54,34692  >  9001 [ACK] Seq=8139927 Ack=147884495 Win=65535 Len=0
1,7.9852639999999155,54.93.77.70,10.0.2.15,TLSv1.2,1502,Application Data [TCP segment of a reassembled PDU]
1,7.985445999999683,10.0.2.15,54.93.77.70,TCP,54,34692  >  9001 [ACK] Seq=8139927 Ack=147885943 Win=65535 Len=0
1,7.995476000000053,10.0.2.15,54.93.77.70,TLSv1.2,590,Application Data
1,7.995932999999695,54.93.77.70,10.0.2.15,TCP,60,9001  >  34692 [ACK] Seq=147885943 Ack=8140463 Win=65535 Len=0
1,7.9976529999999,54.93.77.70,10.0.2.15,TLSv1.2,1314,Application Data
1,8.03850999999986,10.0.2.15,54.93.77.70,TCP,54,34692  >  9001 [ACK] Seq=8140463 Ack=147887203 Win=65535 Len=0
1,8.06514900000002,54.93.77.70,10.0.2.15,TLSv1.2,1104,Application Data
1,8.065477999999985,10.0.2.15,54.93.77.70,TCP,54,34692  >  9001 [ACK] Seq=8140463 Ack=147888253 Win=65535 Len=0
1,8.072513999999956,10.0.2.15,54.93.77.70,TLSv1.2,590,Application Data
1,8.0726709999999,54.93.77.70,10.0.2.15,TCP,60,9001  >  34692 [ACK] Seq=147888253 Ack=8140999 Win=65535 Len=0
1,8.090157999999974,62.210.85.178,10.0.2.15,TLSv1.2,590,Application Data
1,8.135714000000007,10.0.2.15,62.210.85.178,TCP,54,35978  >  9001 [ACK] Seq=148039541 Ack=8108643 Win=65535 Len=0
1,8.148702999999841,62.210.85.178,10.0.2.15,TLSv1.2,590,Application Data
1,8.148992999999791,10.0.2.15,62.210.85.178,TCP,54,35978  >  9001 [ACK] Seq=148039541 Ack=8109179 Win=65535 Len=0
1,8.619607999999971,62.210.85.178,10.0.2.15,TLSv1.2,590,Application Data
1,8.619715999999698,10.0.2.15,62.210.85.178,TCP,54,35978  >  9001 [ACK] Seq=148039541 Ack=8109715 Win=65535 Len=0
1,8.620087999999669,10.0.2.15,62.210.85.178,TLSv1.2,590,Application Data
1,8.620208999999704,62.210.85.178,10.0.2.15,TCP,60,9001  >  35978 [ACK] Seq=8109715 Ack=148040077 Win=65535 Len=0
1,8.806322999999793,54.93.77.70,10.0.2.15,TLSv1.2,590,Application Data
1,8.8068659999999,10.0.2.15,54.93.77.70,TLSv1.2,590,Application Data
1,8.80698399999983,54.93.77.70,10.0.2.15,TCP,60,9001  >  34692 [ACK] Seq=147888789 Ack=8141535 Win=65535 Len=0
1,8.908693999999741,62.210.85.178,10.0.2.15,TLSv1.2,590,Application Data
1,8.916013999999905,10.0.2.15,62.210.85.178,TLSv1.2,590,Application Data
1,8.916197999999895,62.210.85.178,10.0.2.15,TCP,60,9001  >  35978 [ACK] Seq=8110251 Ack=148040613 Win=65535 Len=0
1,8.935307999999623,10.0.2.15,62.210.85.178,TLSv1.2,4124,Application Data
1,8.93584699999974,10.0.2.15,62.210.85.178,TCP,2974,35978  >  9001 [ACK] Seq=148044683 Ack=8110251 Win=65535 Len=2920 [TCP segment of a reassembled PDU]
1,8.936023999999634,10.0.2.15,62.210.85.178,TLSv1.2,4434,Application Data [TCP segment of a reassembled PDU]
1,8.936715999999706,62.210.85.178,10.0.2.15,TCP,60,9001  >  35978 [ACK] Seq=8110251 Ack=148042073 Win=65535 Len=0
1,8.936801999999716,62.210.85.178,10.0.2.15,TCP,60,9001  >  35978 [ACK] Seq=8110251 Ack=148043533 Win=65535 Len=0
1,8.936817999999676,62.210.85.178,10.0.2.15,TCP,60,9001  >  35978 [ACK] Seq=8110251 Ack=148044683 Win=65535 Len=0
1,8.936826999999994,62.210.85.178,10.0.2.15,TCP,60,9001  >  35978 [ACK] Seq=8110251 Ack=148046143 Win=65535 Len=0
1,8.936834999999974,62.210.85.178,10.0.2.15,TCP,60,9001  >  35978 [ACK] Seq=8110251 Ack=148047603 Win=65535 Len=0
1,8.936841999999615,62.210.85.178,10.0.2.15,TCP,60,9001  >  35978 [ACK] Seq=8110251 Ack=148049063 Win=65535 Len=0
1,8.93685000000005,62.210.85.178,10.0.2.15,TCP,60,9001  >  35978 [ACK] Seq=8110251 Ack=148050523 Win=65535 Len=0
1,8.93685800000003,62.210.85.178,10.0.2.15,TCP,60,9001  >  35978 [ACK] Seq=8110251 Ack=148051983 Win=65535 Len=0
1,8.937074999999822,10.0.2.15,62.210.85.178,TLSv1.2,5894,"Application Data, Application Data, Application Data"
1,8.937473999999838,10.0.2.15,62.210.85.178,TLSv1.2,8814,"Application Data, Application Data"
1,8.937699000000066,10.0.2.15,62.210.85.178,TLSv1.2,1502,Application Data
1,8.937797000000046,62.210.85.178,10.0.2.15,TCP,60,9001  >  35978 [ACK] Seq=8110251 Ack=148053443 Win=65535 Len=0
1,8.93781799999988,62.210.85.178,10.0.2.15,TCP,60,9001  >  35978 [ACK] Seq=8110251 Ack=148054903 Win=65535 Len=0
1,8.937831999999617,62.210.85.178,10.0.2.15,TCP,60,9001  >  35978 [ACK] Seq=8110251 Ack=148056363 Win=65535 Len=0
1,8.937838999999713,62.210.85.178,10.0.2.15,TCP,60,9001  >  35978 [ACK] Seq=8110251 Ack=148057823 Win=65535 Len=0
1,8.937844999999925,62.210.85.178,10.0.2.15,TCP,60,9001  >  35978 [ACK] Seq=8110251 Ack=148059283 Win=65535 Len=0
1,8.937848999999915,62.210.85.178,10.0.2.15,TCP,60,9001  >  35978 [ACK] Seq=8110251 Ack=148060743 Win=65535 Len=0
1,8.937853999999788,62.210.85.178,10.0.2.15,TCP,60,9001  >  35978 [ACK] Seq=8110251 Ack=148062203 Win=65535 Len=0
1,8.937857999999778,62.210.85.178,10.0.2.15,TCP,60,9001  >  35978 [ACK] Seq=8110251 Ack=148063663 Win=65535 Len=0
1,8.93786399999999,62.210.85.178,10.0.2.15,TCP,60,9001  >  35978 [ACK] Seq=8110251 Ack=148065123 Win=65535 Len=0
1,8.937872999999854,62.210.85.178,10.0.2.15,TCP,60,9001  >  35978 [ACK] Seq=8110251 Ack=148066583 Win=65535 Len=0
1,8.937879000000066,62.210.85.178,10.0.2.15,TCP,60,9001  >  35978 [ACK] Seq=8110251 Ack=148068031 Win=65535 Len=0
1,8.949682999999823,10.0.2.15,62.210.85.178,TLSv1.2,4124,Application Data
1,8.950456999999915,62.210.85.178,10.0.2.15,TCP,60,9001  >  35978 [ACK] Seq=8110251 Ack=148069491 Win=65535 Len=0
1,8.950578999999834,62.210.85.178,10.0.2.15,TCP,60,9001  >  35978 [ACK] Seq=8110251 Ack=148070951 Win=65535 Len=0
1,8.9505979999999,62.210.85.178,10.0.2.15,TCP,60,9001  >  35978 [ACK] Seq=8110251 Ack=148072101 Win=65535 Len=0
1,8.951032999999825,10.0.2.15,62.210.85.178,TLSv1.2,4124,Application Data
1,8.951636999999664,10.0.2.15,62.210.85.178,TCP,2974,35978  >  9001 [ACK] Seq=148076171 Ack=8110251 Win=65535 Len=2920 [TCP segment of a reassembled PDU]
1,8.951781999999639,10.0.2.15,62.210.85.178,TLSv1.2,4434,Application Data [TCP segment of a reassembled PDU]
1,8.951967999999852,10.0.2.15,62.210.85.178,TLSv1.2,1514,"Application Data, Application Data"
1,8.953731999999945,62.210.85.178,10.0.2.15,TCP,60,9001  >  35978 [ACK] Seq=8110251 Ack=148073561 Win=65535 Len=0
1,8.953783999999814,62.210.85.178,10.0.2.15,TCP,60,9001  >  35978 [ACK] Seq=8110251 Ack=148075021 Win=65535 Len=0
1,8.95379099999991,62.210.85.178,10.0.2.15,TCP,60,9001  >  35978 [ACK] Seq=8110251 Ack=148076171 Win=65535 Len=0
1,8.953796999999668,62.210.85.178,10.0.2.15,TCP,60,9001  >  35978 [ACK] Seq=8110251 Ack=148077631 Win=65535 Len=0
1,8.953801999999996,62.210.85.178,10.0.2.15,TCP,60,9001  >  35978 [ACK] Seq=8110251 Ack=148079091 Win=65535 Len=0
1,8.953805999999986,62.210.85.178,10.0.2.15,TCP,60,9001  >  35978 [ACK] Seq=8110251 Ack=148080551 Win=65535 Len=0
1,8.953811999999743,62.210.85.178,10.0.2.15,TCP,60,9001  >  35978 [ACK] Seq=8110251 Ack=148082011 Win=65535 Len=0
1,8.953815999999733,62.210.85.178,10.0.2.15,TCP,60,9001  >  35978 [ACK] Seq=8110251 Ack=148083471 Win=65535 Len=0
1,8.953821000000062,62.210.85.178,10.0.2.15,TCP,60,9001  >  35978 [ACK] Seq=8110251 Ack=148084931 Win=65535 Len=0
1,8.957797000000028,10.0.2.15,62.210.85.178,TLSv1.2,1276,Application Data
1,8.958036999999877,62.210.85.178,10.0.2.15,TCP,60,9001  >  35978 [ACK] Seq=8110251 Ack=148086153 Win=65535 Len=0
1,9.050690999999915,54.93.77.70,10.0.2.15,TLSv1.2,590,Application Data
1,9.056742999999642,54.93.77.70,10.0.2.15,TCP,2950,"9001  >  34692 [PSH, ACK] Seq=147889325 Ack=8141535 Win=65535 Len=2896 [TCP segment of a reassembled PDU]"
1,9.05698799999982,10.0.2.15,54.93.77.70,TCP,54,34692  >  9001 [ACK] Seq=8141535 Ack=147892221 Win=65535 Len=0
1,9.069884000000002,54.93.77.70,10.0.2.15,TLSv1.2,264,Application Data
1,9.076006999999663,54.93.77.70,10.0.2.15,TLSv1.2,2950,Application Data
1,9.076090000000022,10.0.2.15,54.93.77.70,TCP,54,34692  >  9001 [ACK] Seq=8141535 Ack=147895327 Win=65535 Len=0
1,9.07701999999972,54.93.77.70,10.0.2.15,TLSv1.2,7294,"Application Data, Application Data"
1,9.077154999999948,10.0.2.15,54.93.77.70,TCP,54,34692  >  9001 [ACK] Seq=8141535 Ack=147902567 Win=65535 Len=0
1,9.08654899999965,54.93.77.70,10.0.2.15,TCP,1502,"9001  >  34692 [PSH, ACK] Seq=147902567 Ack=8141535 Win=65535 Len=1448 [TCP segment of a reassembled PDU]"
1,9.086836999999832,10.0.2.15,54.93.77.70,TCP,54,34692  >  9001 [ACK] Seq=8141535 Ack=147904015 Win=65535 Len=0
1,9.134653999999955,54.93.77.70,10.0.2.15,TLSv1.2,5846,"Application Data, Application Data"
1,9.134877999999844,10.0.2.15,54.93.77.70,TCP,54,34692  >  9001 [ACK] Seq=8141535 Ack=147909807 Win=65535 Len=0
1,9.141147999999703,54.93.77.70,10.0.2.15,TLSv1.2,2878,"Application Data, Application Data"
1,9.14126299999998,10.0.2.15,54.93.77.70,TCP,54,34692  >  9001 [ACK] Seq=8141535 Ack=147912631 Win=65535 Len=0
1,9.143898999999692,54.93.77.70,10.0.2.15,TLSv1.2,15982,"Application Data, Application Data, Application Data"
1,9.144074999999702,10.0.2.15,54.93.77.70,TCP,54,34692  >  9001 [ACK] Seq=8141535 Ack=147928559 Win=65535 Len=0
1,9.144286999999622,10.0.2.15,54.93.77.70,TLSv1.2,590,Application Data
1,9.144375999999738,54.93.77.70,10.0.2.15,TCP,60,9001  >  34692 [ACK] Seq=147928559 Ack=8142071 Win=65535 Len=0
1,9.158574000000044,10.0.2.15,54.93.77.70,TLSv1.2,590,Application Data
1,9.158742999999959,54.93.77.70,10.0.2.15,TCP,60,9001  >  34692 [ACK] Seq=147928559 Ack=8142607 Win=65535 Len=0
1,9.161800999999741,54.93.77.70,10.0.2.15,TLSv1.2,684,"Application Data, Application Data"
1,9.202420999999958,10.0.2.15,54.93.77.70,TCP,54,34692  >  9001 [ACK] Seq=8142607 Ack=147929189 Win=65535 Len=0
1,9.298409999999876,62.210.85.178,10.0.2.15,TLSv1.2,1104,Application Data
1,9.342392000000018,10.0.2.15,62.210.85.178,TCP,54,35978  >  9001 [ACK] Seq=148086153 Ack=8111301 Win=65535 Len=0
1,9.56700899999987,54.93.77.70,10.0.2.15,TLSv1.2,5752,"Application Data, Application Data"
1,9.567344999999932,10.0.2.15,54.93.77.70,TCP,54,34692  >  9001 [ACK] Seq=8142607 Ack=147934887 Win=65535 Len=0
1,9.572276999999758,10.0.2.15,54.93.77.70,TLSv1.2,590,Application Data
1,9.57249899999988,54.93.77.70,10.0.2.15,TCP,60,9001  >  34692 [ACK] Seq=147934887 Ack=8143143 Win=65535 Len=0
1,9.775642999999945,62.210.85.178,10.0.2.15,TLSv1.2,590,Application Data
1,9.775748000000021,10.0.2.15,62.210.85.178,TCP,54,35978  >  9001 [ACK] Seq=148086153 Ack=8111837 Win=65535 Len=0
1,9.776335000000017,10.0.2.15,62.210.85.178,TLSv1.2,590,Application Data
1,9.776458999999704,62.210.85.178,10.0.2.15,TCP,60,9001  >  35978 [ACK] Seq=8111837 Ack=148086689 Win=65535 Len=0
1,10.290577999999641,54.93.77.70,10.0.2.15,TLSv1.2,590,Application Data
1,10.29113899999993,10.0.2.15,54.93.77.70,TLSv1.2,590,Application Data
1,10.29125299999987,54.93.77.70,10.0.2.15,TCP,60,9001  >  34692 [ACK] Seq=147935423 Ack=8143679 Win=65535 Len=0
1,10.48064499999964,62.210.85.178,10.0.2.15,TLSv1.2,590,Application Data
1,10.503486000000066,10.0.2.15,62.210.85.178,TLSv1.2,590,Application Data
1,10.505081999999675,62.210.85.178,10.0.2.15,TCP,60,9001  >  35978 [ACK] Seq=8112373 Ack=148087225 Win=65535 Len=0
1,10.533865999999762,10.0.2.15,62.210.85.178,TLSv1.2,4124,Application Data
1,10.534744000000046,62.210.85.178,10.0.2.15,TCP,60,9001  >  35978 [ACK] Seq=8112373 Ack=148088685 Win=65535 Len=0
1,10.53490499999998,62.210.85.178,10.0.2.15,TCP,60,9001  >  35978 [ACK] Seq=8112373 Ack=148090145 Win=65535 Len=0
1,10.534925999999814,62.210.85.178,10.0.2.15,TCP,60,9001  >  35978 [ACK] Seq=8112373 Ack=148091295 Win=65535 Len=0
1,10.535171999999875,10.0.2.15,62.210.85.178,TLSv1.2,4124,Application Data
1,10.535472000000027,10.0.2.15,62.210.85.178,TCP,2974,35978  >  9001 [ACK] Seq=148095365 Ack=8112373 Win=65535 Len=2920 [TCP segment of a reassembled PDU]
1,10.535548999999719,10.0.2.15,62.210.85.178,TLSv1.2,4434,Application Data [TCP segment of a reassembled PDU]
1,10.535591999999724,62.210.85.178,10.0.2.15,TCP,60,9001  >  35978 [ACK] Seq=8112373 Ack=148092755 Win=65535 Len=0
1,10.535601999999926,62.210.85.178,10.0.2.15,TCP,60,9001  >  35978 [ACK] Seq=8112373 Ack=148094215 Win=65535 Len=0
1,10.5356069999998,62.210.85.178,10.0.2.15,TCP,60,9001  >  35978 [ACK] Seq=8112373 Ack=148095365 Win=65535 Len=0
1,10.53561099999979,62.210.85.178,10.0.2.15,TCP,60,9001  >  35978 [ACK] Seq=8112373 Ack=148096825 Win=65535 Len=0
1,10.535615999999663,62.210.85.178,10.0.2.15,TCP,60,9001  >  35978 [ACK] Seq=8112373 Ack=148098285 Win=65535 Len=0
1,10.535619999999653,62.210.85.178,10.0.2.15,TCP,60,9001  >  35978 [ACK] Seq=8112373 Ack=148099745 Win=65535 Len=0
1,10.535624999999982,62.210.85.178,10.0.2.15,TCP,60,9001  >  35978 [ACK] Seq=8112373 Ack=148101205 Win=65535 Len=0
1,10.535628999999972,62.210.85.178,10.0.2.15,TCP,60,9001  >  35978 [ACK] Seq=8112373 Ack=148102665 Win=65535 Len=0
1,10.535691000000043,10.0.2.15,62.210.85.178,TLSv1.2,894,Application Data
1,10.53579899999977,62.210.85.178,10.0.2.15,TCP,60,9001  >  35978 [ACK] Seq=8112373 Ack=148103505 Win=65535 Len=0
1,10.535838999999669,10.0.2.15,62.210.85.178,TLSv1.2,332,Application Data
1,10.535914999999932,62.210.85.178,10.0.2.15,TCP,60,9001  >  35978 [ACK] Seq=8112373 Ack=148103783 Win=65535 Len=0
1,10.535997999999836,10.0.2.15,62.210.85.178,TLSv1.2,3868,Application Data
1,10.53608499999973,62.210.85.178,10.0.2.15,TCP,60,9001  >  35978 [ACK] Seq=8112373 Ack=148105243 Win=65535 Len=0
1,10.536094999999932,62.210.85.178,10.0.2.15,TCP,60,9001  >  35978 [ACK] Seq=8112373 Ack=148106703 Win=65535 Len=0
1,10.536099999999806,62.210.85.178,10.0.2.15,TCP,60,9001  >  35978 [ACK] Seq=8112373 Ack=148107597 Win=65535 Len=0
1,10.536157999999887,10.0.2.15,62.210.85.178,TLSv1.2,4124,Application Data
1,10.536243999999897,62.210.85.178,10.0.2.15,TCP,60,9001  >  35978 [ACK] Seq=8112373 Ack=148109057 Win=65535 Len=0
1,10.53625299999976,62.210.85.178,10.0.2.15,TCP,60,9001  >  35978 [ACK] Seq=8112373 Ack=148110517 Win=65535 Len=0
1,10.536257999999634,62.210.85.178,10.0.2.15,TCP,60,9001  >  35978 [ACK] Seq=8112373 Ack=148111667 Win=65535 Len=0
1,10.536314999999831,10.0.2.15,62.210.85.178,TLSv1.2,3030,Application Data
1,10.53638699999965,62.210.85.178,10.0.2.15,TCP,60,9001  >  35978 [ACK] Seq=8112373 Ack=148113127 Win=65535 Len=0
1,10.536395999999968,62.210.85.178,10.0.2.15,TCP,60,9001  >  35978 [ACK] Seq=8112373 Ack=148114587 Win=65535 Len=0
1,10.536400999999842,62.210.85.178,10.0.2.15,TCP,60,9001  >  35978 [ACK] Seq=8112373 Ack=148114643 Win=65535 Len=0
1,10.54715299999998,10.0.2.15,62.210.85.178,TLSv1.2,4124,Application Data
1,10.54859099999976,10.0.2.15,62.210.85.178,TCP,2974,35978  >  9001 [ACK] Seq=148118713 Ack=8112373 Win=65535 Len=2920 [TCP segment of a reassembled PDU]
1,10.549070000000029,62.210.85.178,10.0.2.15,TCP,60,9001  >  35978 [ACK] Seq=8112373 Ack=148116103 Win=65535 Len=0
1,10.549177999999756,62.210.85.178,10.0.2.15,TCP,60,9001  >  35978 [ACK] Seq=8112373 Ack=148117563 Win=65535 Len=0
1,10.549213999999665,62.210.85.178,10.0.2.15,TCP,60,9001  >  35978 [ACK] Seq=8112373 Ack=148118713 Win=65535 Len=0
1,10.549220999999761,62.210.85.178,10.0.2.15,TCP,60,9001  >  35978 [ACK] Seq=8112373 Ack=148120173 Win=65535 Len=0
1,10.549225999999635,62.210.85.178,10.0.2.15,TCP,60,9001  >  35978 [ACK] Seq=8112373 Ack=148121633 Win=65535 Len=0
1,10.549393999999666,10.0.2.15,62.210.85.178,TLSv1.2,1204,Application Data
1,10.549646999999823,62.210.85.178,10.0.2.15,TCP,60,9001  >  35978 [ACK] Seq=8112373 Ack=148122783 Win=65535 Len=0
1,10.55016999999998,10.0.2.15,62.210.85.178,TLSv1.2,4124,Application Data
1,10.550988999999845,10.0.2.15,62.210.85.178,TCP,1514,35978  >  9001 [ACK] Seq=148126853 Ack=8112373 Win=65535 Len=1460 [TCP segment of a reassembled PDU]
1,10.55111799999986,62.210.85.178,10.0.2.15,TCP,60,9001  >  35978 [ACK] Seq=8112373 Ack=148124243 Win=65535 Len=0
1,10.551163999999972,62.210.85.178,10.0.2.15,TCP,60,9001  >  35978 [ACK] Seq=8112373 Ack=148125703 Win=65535 Len=0
1,10.551171999999951,62.210.85.178,10.0.2.15,TCP,60,9001  >  35978 [ACK] Seq=8112373 Ack=148126853 Win=65535 Len=0
1,10.551177999999709,62.210.85.178,10.0.2.15,TCP,60,9001  >  35978 [ACK] Seq=8112373 Ack=148128313 Win=65535 Len=0
1,10.551320999999916,10.0.2.15,62.210.85.178,TLSv1.2,864,Application Data
1,10.551434999999856,62.210.85.178,10.0.2.15,TCP,60,9001  >  35978 [ACK] Seq=8112373 Ack=148129123 Win=65535 Len=0
1,10.629103999999643,54.93.77.70,10.0.2.15,TLSv1.2,590,Application Data
1,10.670347999999649,10.0.2.15,54.93.77.70,TCP,54,34692  >  9001 [ACK] Seq=8143679 Ack=147935959 Win=65535 Len=0
1,10.674576999999772,54.93.77.70,10.0.2.15,TCP,2950,"9001  >  34692 [PSH, ACK] Seq=147935959 Ack=8143679 Win=65535 Len=2896 [TCP segment of a reassembled PDU]"
1,10.674622999999883,54.93.77.70,10.0.2.15,TLSv1.2,778,Application Data
1,10.674698999999691,10.0.2.15,54.93.77.70,TCP,54,34692  >  9001 [ACK] Seq=8143679 Ack=147938855 Win=65535 Len=0
1,10.674752999999782,10.0.2.15,54.93.77.70,TCP,54,34692  >  9001 [ACK] Seq=8143679 Ack=147939579 Win=65535 Len=0
1,10.69876499999964,54.93.77.70,10.0.2.15,TCP,1502,"9001  >  34692 [PSH, ACK] Seq=147939579 Ack=8143679 Win=65535 Len=1448 [TCP segment of a reassembled PDU]"
1,10.698867999999948,10.0.2.15,54.93.77.70,TCP,54,34692  >  9001 [ACK] Seq=8143679 Ack=147941027 Win=65535 Len=0
1,10.78463099999999,54.93.77.70,10.0.2.15,TLSv1.2,2762,"Application Data, Application Data"
1,10.784753999999793,10.0.2.15,54.93.77.70,TCP,54,34692  >  9001 [ACK] Seq=8143679 Ack=147943735 Win=65535 Len=0
1,10.832145999999739,54.93.77.70,10.0.2.15,TLSv1.2,5846,Application Data
1,10.832234999999855,10.0.2.15,54.93.77.70,TCP,54,34692  >  9001 [ACK] Seq=8143679 Ack=147949527 Win=65535 Len=0
1,10.835325999999895,54.93.77.70,10.0.2.15,TLSv1.2,2950,Application Data [TCP segment of a reassembled PDU]
1,10.835450000000037,10.0.2.15,54.93.77.70,TCP,54,34692  >  9001 [ACK] Seq=8143679 Ack=147952423 Win=65535 Len=0
1,10.835687999999664,54.93.77.70,10.0.2.15,TCP,1502,"9001  >  34692 [PSH, ACK] Seq=147952423 Ack=8143679 Win=65535 Len=1448 [TCP segment of a reassembled PDU]"
1,10.835745999999745,10.0.2.15,54.93.77.70,TCP,54,34692  >  9001 [ACK] Seq=8143679 Ack=147953871 Win=65535 Len=0
1,10.87277499999982,54.93.77.70,10.0.2.15,TLSv1.2,5962,"Application Data, Application Data, Application Data"
1,10.872890999999981,10.0.2.15,54.93.77.70,TCP,54,34692  >  9001 [ACK] Seq=8143679 Ack=147959779 Win=65535 Len=0
1,10.910841999999775,54.93.77.70,10.0.2.15,TLSv1.2,7294,"Application Data, Application Data"
1,10.910967999999684,10.0.2.15,54.93.77.70,TCP,54,34692  >  9001 [ACK] Seq=8143679 Ack=147967019 Win=65535 Len=0
1,10.911265999999614,10.0.2.15,54.93.77.70,TLSv1.2,590,Application Data
1,10.911381999999776,54.93.77.70,10.0.2.15,TCP,60,9001  >  34692 [ACK] Seq=147967019 Ack=8144215 Win=65535 Len=0
1,11.043719999999666,54.93.77.70,10.0.2.15,TLSv1.2,4398,Application Data
1,11.043839999999818,10.0.2.15,54.93.77.70,TCP,54,34692  >  9001 [ACK] Seq=8144215 Ack=147971363 Win=65535 Len=0
1,11.046609999999873,54.93.77.70,10.0.2.15,TLSv1.2,2950,Application Data
1,11.046877999999651,10.0.2.15,54.93.77.70,TCP,54,34692  >  9001 [ACK] Seq=8144215 Ack=147974259 Win=65535 Len=0
1,11.139783999999963,62.210.85.178,10.0.2.15,TLSv1.2,590,Application Data
1,11.182614999999714,10.0.2.15,62.210.85.178,TCP,54,35978  >  9001 [ACK] Seq=148129123 Ack=8112909 Win=65535 Len=0
1,11.259838999999829,54.93.77.70,10.0.2.15,TLSv1.2,3674,Application Data
1,11.260299999999916,10.0.2.15,54.93.77.70,TCP,54,34692  >  9001 [ACK] Seq=8144215 Ack=147977879 Win=65535 Len=0
1,11.263042999999925,10.0.2.15,54.93.77.70,TLSv1.2,590,Application Data
1,11.263235999999779,54.93.77.70,10.0.2.15,TCP,60,9001  >  34692 [ACK] Seq=147977879 Ack=8144751 Win=65535 Len=0
1,11.277579999999944,10.0.2.15,54.93.77.70,TLSv1.2,590,Application Data
1,11.277743999999984,54.93.77.70,10.0.2.15,TCP,60,9001  >  34692 [ACK] Seq=147977879 Ack=8145287 Win=65535 Len=0
1,11.357044999999744,62.210.85.178,10.0.2.15,TLSv1.2,590,Application Data
1,11.357138999999734,10.0.2.15,62.210.85.178,TCP,54,35978  >  9001 [ACK] Seq=148129123 Ack=8113445 Win=65535 Len=0
1,11.414180999999644,62.210.85.178,10.0.2.15,TLSv1.2,590,Application Data
1,11.414276999999856,10.0.2.15,62.210.85.178,TCP,54,35978  >  9001 [ACK] Seq=148129123 Ack=8113981 Win=65535 Len=0
1,11.4146539999997,10.0.2.15,62.210.85.178,TLSv1.2,590,Application Data
1,11.414934999999787,62.210.85.178,10.0.2.15,TCP,60,9001  >  35978 [ACK] Seq=8113981 Ack=148129659 Win=65535 Len=0
1,11.55648599999995,54.93.77.70,10.0.2.15,TLSv1.2,590,Application Data
1,11.557102999999643,10.0.2.15,54.93.77.70,TLSv1.2,590,Application Data
1,11.557406999999785,54.93.77.70,10.0.2.15,TCP,60,9001  >  34692 [ACK] Seq=147978415 Ack=8145823 Win=65535 Len=0
1,11.730931999999939,62.210.85.178,10.0.2.15,TLSv1.2,590,Application Data
1,11.761724999999842,10.0.2.15,62.210.85.178,TLSv1.2,590,Application Data
1,11.762369000000035,62.210.85.178,10.0.2.15,TCP,60,9001  >  35978 [ACK] Seq=8114517 Ack=148130195 Win=65535 Len=0
1,11.770764999999756,10.0.2.15,62.210.85.178,TLSv1.2,4124,Application Data
1,11.770920999999817,10.0.2.15,62.210.85.178,TCP,2974,35978  >  9001 [ACK] Seq=148134265 Ack=8114517 Win=65535 Len=2920 [TCP segment of a reassembled PDU]
1,11.770983999999771,62.210.85.178,10.0.2.15,TCP,60,9001  >  35978 [ACK] Seq=8114517 Ack=148131655 Win=65535 Len=0
1,11.770996999999625,62.210.85.178,10.0.2.15,TCP,60,9001  >  35978 [ACK] Seq=8114517 Ack=148133115 Win=65535 Len=0
1,11.771001999999953,62.210.85.178,10.0.2.15,TCP,60,9001  >  35978 [ACK] Seq=8114517 Ack=148134265 Win=65535 Len=0
1,11.771271999999954,10.0.2.15,62.210.85.178,TLSv1.2,1204,Application Data
1,11.771310999999969,62.210.85.178,10.0.2.15,TCP,60,9001  >  35978 [ACK] Seq=8114517 Ack=148135725 Win=65535 Len=0
1,11.771327999999812,62.210.85.178,10.0.2.15,TCP,60,9001  >  35978 [ACK] Seq=8114517 Ack=148137185 Win=65535 Len=0
1,11.771334000000024,62.210.85.178,10.0.2.15,TCP,60,9001  >  35978 [ACK] Seq=8114517 Ack=148138335 Win=65535 Len=0
1,11.771439999999984,10.0.2.15,62.210.85.178,TLSv1.2,4124,Application Data
1,11.772114999999758,62.210.85.178,10.0.2.15,TCP,60,9001  >  35978 [ACK] Seq=8114517 Ack=148139795 Win=65535 Len=0
1,11.772164999999859,62.210.85.178,10.0.2.15,TCP,60,9001  >  35978 [ACK] Seq=8114517 Ack=148141255 Win=65535 Len=0
1,11.772176999999829,62.210.85.178,10.0.2.15,TCP,60,9001  >  35978 [ACK] Seq=8114517 Ack=148142405 Win=65535 Len=0
1,11.772335999999996,10.0.2.15,62.210.85.178,TLSv1.2,4124,Application Data
1,11.772450999999819,62.210.85.178,10.0.2.15,TCP,60,9001  >  35978 [ACK] Seq=8114517 Ack=148143865 Win=65535 Len=0
1,11.772465000000011,62.210.85.178,10.0.2.15,TCP,60,9001  >  35978 [ACK] Seq=8114517 Ack=148145325 Win=65535 Len=0
1,11.772470999999769,62.210.85.178,10.0.2.15,TCP,60,9001  >  35978 [ACK] Seq=8114517 Ack=148146475 Win=65535 Len=0
1,11.772545999999693,10.0.2.15,62.210.85.178,TLSv1.2,332,Application Data
1,11.772669999999835,62.210.85.178,10.0.2.15,TCP,60,9001  >  35978 [ACK] Seq=8114517 Ack=148146753 Win=65535 Len=0
1,11.773159999999734,10.0.2.15,62.210.85.178,TLSv1.2,3868,Application Data
1,11.773486000000048,62.210.85.178,10.0.2.15,TCP,60,9001  >  35978 [ACK] Seq=8114517 Ack=148148213 Win=65535 Len=0
1,11.773513999999977,62.210.85.178,10.0.2.15,TCP,60,9001  >  35978 [ACK] Seq=8114517 Ack=148149673 Win=65535 Len=0
1,11.773519999999735,62.210.85.178,10.0.2.15,TCP,60,9001  >  35978 [ACK] Seq=8114517 Ack=148150567 Win=65535 Len=0
1,11.773589999999786,10.0.2.15,62.210.85.178,TLSv1.2,4124,Application Data
1,11.773686999999882,62.210.85.178,10.0.2.15,TCP,60,9001  >  35978 [ACK] Seq=8114517 Ack=148152027 Win=65535 Len=0
1,11.773696999999629,62.210.85.178,10.0.2.15,TCP,60,9001  >  35978 [ACK] Seq=8114517 Ack=148153487 Win=65535 Len=0
1,11.773701999999957,62.210.85.178,10.0.2.15,TCP,60,9001  >  35978 [ACK] Seq=8114517 Ack=148154637 Win=65535 Len=0
1,11.773749999999836,10.0.2.15,62.210.85.178,TLSv1.2,3030,Application Data
1,11.773837999999614,62.210.85.178,10.0.2.15,TCP,60,9001  >  35978 [ACK] Seq=8114517 Ack=148156097 Win=65535 Len=0
1,11.7738489999997,62.210.85.178,10.0.2.15,TCP,60,9001  >  35978 [ACK] Seq=8114517 Ack=148157557 Win=65535 Len=0
1,11.773854000000028,62.210.85.178,10.0.2.15,TCP,60,9001  >  35978 [ACK] Seq=8114517 Ack=148157613 Win=65535 Len=0
1,11.783593999999994,10.0.2.15,62.210.85.178,TLSv1.2,4124,Application Data
1,11.783758999999918,62.210.85.178,10.0.2.15,TCP,60,9001  >  35978 [ACK] Seq=8114517 Ack=148159073 Win=65535 Len=0
1,11.783780999999635,62.210.85.178,10.0.2.15,TCP,60,9001  >  35978 [ACK] Seq=8114517 Ack=148160533 Win=65535 Len=0
1,11.783858999999666,62.210.85.178,10.0.2.15,TCP,60,9001  >  35978 [ACK] Seq=8114517 Ack=148161683 Win=65535 Len=0
1,11.784024999999929,10.0.2.15,62.210.85.178,TLSv1.2,4124,Application Data
1,11.78415700000005,10.0.2.15,62.210.85.178,TCP,2974,35978  >  9001 [ACK] Seq=148165753 Ack=8114517 Win=65535 Len=2920 [TCP segment of a reassembled PDU]
1,11.784186999999747,62.210.85.178,10.0.2.15,TCP,60,9001  >  35978 [ACK] Seq=8114517 Ack=148163143 Win=65535 Len=0
1,11.78419699999995,62.210.85.178,10.0.2.15,TCP,60,9001  >  35978 [ACK] Seq=8114517 Ack=148164603 Win=65535 Len=0
1,11.784202999999707,62.210.85.178,10.0.2.15,TCP,60,9001  >  35978 [ACK] Seq=8114517 Ack=148165753 Win=65535 Len=0
1,11.784208000000035,62.210.85.178,10.0.2.15,TCP,60,9001  >  35978 [ACK] Seq=8114517 Ack=148167213 Win=65535 Len=0
1,11.784212999999909,62.210.85.178,10.0.2.15,TCP,60,9001  >  35978 [ACK] Seq=8114517 Ack=148168673 Win=65535 Len=0
1,11.784268999999767,10.0.2.15,62.210.85.178,TLSv1.2,1204,Application Data
1,11.784319999999752,62.210.85.178,10.0.2.15,TCP,60,9001  >  35978 [ACK] Seq=8114517 Ack=148169823 Win=65535 Len=0
1,11.78438099999994,10.0.2.15,62.210.85.178,TLSv1.2,4124,Application Data
1,11.78442700000005,62.210.85.178,10.0.2.15,TCP,60,9001  >  35978 [ACK] Seq=8114517 Ack=148171283 Win=65535 Len=0
1,11.784435999999914,62.210.85.178,10.0.2.15,TCP,60,9001  >  35978 [ACK] Seq=8114517 Ack=148172743 Win=65535 Len=0
1,11.784440999999788,62.210.85.178,10.0.2.15,TCP,60,9001  >  35978 [ACK] Seq=8114517 Ack=148173893 Win=65535 Len=0
1,11.784490999999889,10.0.2.15,62.210.85.178,TLSv1.2,332,Application Data
1,11.7845769999999,62.210.85.178,10.0.2.15,TCP,60,9001  >  35978 [ACK] Seq=8114517 Ack=148174171 Win=65535 Len=0
1,11.784637999999632,10.0.2.15,62.210.85.178,TLSv1.2,3868,Application Data
1,11.784680999999637,62.210.85.178,10.0.2.15,TCP,60,9001  >  35978 [ACK] Seq=8114517 Ack=148175631 Win=65535 Len=0
1,11.784689999999955,62.210.85.178,10.0.2.15,TCP,60,9001  >  35978 [ACK] Seq=8114517 Ack=148177091 Win=65535 Len=0
1,11.784695999999713,62.210.85.178,10.0.2.15,TCP,60,9001  >  35978 [ACK] Seq=8114517 Ack=148177985 Win=65535 Len=0
1,11.784741999999824,10.0.2.15,62.210.85.178,TLSv1.2,4124,Application Data
1,11.784784999999829,62.210.85.178,10.0.2.15,TCP,60,9001  >  35978 [ACK] Seq=8114517 Ack=148179445 Win=65535 Len=0
1,11.784795000000031,62.210.85.178,10.0.2.15,TCP,60,9001  >  35978 [ACK] Seq=8114517 Ack=148180905 Win=65535 Len=0
1,11.784799999999905,62.210.85.178,10.0.2.15,TCP,60,9001  >  35978 [ACK] Seq=8114517 Ack=148182055 Win=65535 Len=0
1,11.78483899999992,10.0.2.15,62.210.85.178,TLSv1.2,3030,Application Data
1,11.784883999999693,62.210.85.178,10.0.2.15,TCP,60,9001  >  35978 [ACK] Seq=8114517 Ack=148183515 Win=65535 Len=0
1,11.784893999999895,62.210.85.178,10.0.2.15,TCP,60,9001  >  35978 [ACK] Seq=8114517 Ack=148184975 Win=65535 Len=0
1,11.784899999999652,62.210.85.178,10.0.2.15,TCP,60,9001  >  35978 [ACK] Seq=8114517 Ack=148185031 Win=65535 Len=0
1,11.79442599999993,10.0.2.15,62.210.85.178,TLSv1.2,4124,Application Data
1,11.794583999999759,62.210.85.178,10.0.2.15,TCP,60,9001  >  35978 [ACK] Seq=8114517 Ack=148186491 Win=65535 Len=0
1,11.794602999999825,62.210.85.178,10.0.2.15,TCP,60,9001  >  35978 [ACK] Seq=8114517 Ack=148187951 Win=65535 Len=0
1,11.794609000000037,62.210.85.178,10.0.2.15,TCP,60,9001  >  35978 [ACK] Seq=8114517 Ack=148189101 Win=65535 Len=0
1,11.794677999999749,10.0.2.15,62.210.85.178,TLSv1.2,4124,Application Data
1,11.794729999999618,62.210.85.178,10.0.2.15,TCP,60,9001  >  35978 [ACK] Seq=8114517 Ack=148190561 Win=65535 Len=0
1,11.794740999999703,62.210.85.178,10.0.2.15,TCP,60,9001  >  35978 [ACK] Seq=8114517 Ack=148192021 Win=65535 Len=0
1,11.794746000000032,62.210.85.178,10.0.2.15,TCP,60,9001  >  35978 [ACK] Seq=8114517 Ack=148193171 Win=65535 Len=0
1,11.794801000000007,10.0.2.15,62.210.85.178,TLSv1.2,204,Application Data
1,11.794848999999886,62.210.85.178,10.0.2.15,TCP,60,9001  >  35978 [ACK] Seq=8114517 Ack=148193321 Win=65535 Len=0
1,11.883542999999918,54.93.77.70,10.0.2.15,TLSv1.2,3674,Application Data
1,11.884182999999666,10.0.2.15,54.93.77.70,TCP,54,34692  >  9001 [ACK] Seq=8145823 Ack=147982035 Win=65535 Len=0
1,11.915232999999716,54.93.77.70,10.0.2.15,TLSv1.2,10190,"Application Data, Application Data"
1,11.915459999999712,10.0.2.15,54.93.77.70,TCP,54,34692  >  9001 [ACK] Seq=8145823 Ack=147992171 Win=65535 Len=0
1,11.918337000000065,54.93.77.70,10.0.2.15,TCP,1502,"9001  >  34692 [PSH, ACK] Seq=147992171 Ack=8145823 Win=65535 Len=1448 [TCP segment of a reassembled PDU]"
1,11.918478999999934,10.0.2.15,54.93.77.70,TCP,54,34692  >  9001 [ACK] Seq=8145823 Ack=147993619 Win=65535 Len=0
1,11.9327159999998,54.93.77.70,10.0.2.15,TLSv1.2,4492,"Application Data, Application Data"
1,11.93338999999969,10.0.2.15,54.93.77.70,TCP,54,34692  >  9001 [ACK] Seq=8145823 Ack=147998057 Win=65535 Len=0
1,11.965915999999652,54.93.77.70,10.0.2.15,TLSv1.2,4398,Application Data
1,11.96628899999996,10.0.2.15,54.93.77.70,TCP,54,34692  >  9001 [ACK] Seq=8145823 Ack=148002401 Win=65535 Len=0
1,11.967067999999927,54.93.77.70,10.0.2.15,TLSv1.2,4514,"Application Data, Application Data"
1,11.96776699999964,10.0.2.15,54.93.77.70,TCP,54,34692  >  9001 [ACK] Seq=8145823 Ack=148006861 Win=65535 Len=0
1,11.968706999999995,10.0.2.15,54.93.77.70,TLSv1.2,590,Application Data
1,11.96886799999993,54.93.77.70,10.0.2.15,TCP,60,9001  >  34692 [ACK] Seq=148006861 Ack=8146359 Win=65535 Len=0
1,11.982754999999997,54.93.77.70,10.0.2.15,TLSv1.2,4398,Application Data
1,11.983032999999978,10.0.2.15,54.93.77.70,TCP,54,34692  >  9001 [ACK] Seq=8146359 Ack=148011205 Win=65535 Len=0
1,11.985040000000026,54.93.77.70,10.0.2.15,TLSv1.2,2950,Application Data
1,11.985294999999951,10.0.2.15,54.93.77.70,TCP,54,34692  >  9001 [ACK] Seq=8146359 Ack=148014101 Win=65535 Len=0
1,12.024759999999787,54.93.77.70,10.0.2.15,TLSv1.2,3674,Application Data
1,12.024906999999985,10.0.2.15,54.93.77.70,TCP,54,34692  >  9001 [ACK] Seq=8146359 Ack=148017721 Win=65535 Len=0
1,12.04020700000001,54.93.77.70,10.0.2.15,TCP,2950,"9001  >  34692 [PSH, ACK] Seq=148017721 Ack=8146359 Win=65535 Len=2896 [TCP segment of a reassembled PDU]"
1,12.040295999999671,10.0.2.15,54.93.77.70,TCP,54,34692  >  9001 [ACK] Seq=8146359 Ack=148020617 Win=65535 Len=0
1,12.041858999999931,54.93.77.70,10.0.2.15,TLSv1.2,1314,"Application Data, Application Data"
1,12.06410599999981,54.93.77.70,10.0.2.15,TCP,2950,"9001  >  34692 [PSH, ACK] Seq=148021877 Ack=8146359 Win=65535 Len=2896 [TCP segment of a reassembled PDU]"
1,12.064314999999624,10.0.2.15,54.93.77.70,TCP,54,34692  >  9001 [ACK] Seq=8146359 Ack=148024773 Win=65535 Len=0
1,12.0664969999998,54.93.77.70,10.0.2.15,TLSv1.2,7294,"Application Data, Application Data"
1,12.066990999999689,10.0.2.15,54.93.77.70,TCP,54,34692  >  9001 [ACK] Seq=8146359 Ack=148032013 Win=65535 Len=0
1,12.067825999999968,10.0.2.15,54.93.77.70,TLSv1.2,590,Application Data
1,12.068111999999928,54.93.77.70,10.0.2.15,TCP,60,9001  >  34692 [ACK] Seq=148032013 Ack=8146895 Win=65535 Len=0
1,12.081664999999703,54.93.77.70,10.0.2.15,TLSv1.2,5846,Application Data [TCP segment of a reassembled PDU]
1,12.081980999999814,10.0.2.15,54.93.77.70,TCP,54,34692  >  9001 [ACK] Seq=8146895 Ack=148037805 Win=65535 Len=0
1,12.0829719999997,10.0.2.15,54.93.77.70,TLSv1.2,590,Application Data
1,12.083545999999842,54.93.77.70,10.0.2.15,TLSv1.2,3044,Application Data [TCP segment of a reassembled PDU]
1,12.083779999999933,54.93.77.70,10.0.2.15,TCP,60,9001  >  34692 [ACK] Seq=148040795 Ack=8147431 Win=65535 Len=0
1,12.083916999999929,10.0.2.15,54.93.77.70,TCP,54,34692  >  9001 [ACK] Seq=8147431 Ack=148040795 Win=65535 Len=0
1,12.099667999999838,54.93.77.70,10.0.2.15,TLSv1.2,1314,"Application Data, Application Data"
1,12.119534999999814,62.210.85.178,10.0.2.15,TLSv1.2,590,Application Data
