No.,Time,Source,Destination,Protocol,Length,Info
1,0.015926000000035856,62.210.85.178,10.0.2.15,TLSv1.2,590,Application Data
1,0.047383999999965454,62.210.85.178,10.0.2.15,TLSv1.2,590,Application Data
1,0.0475189999997383,10.0.2.15,62.210.85.178,TCP,54,35978  >  9001 [ACK] Seq=148561055 Ack=8135803 Win=65535 Len=0
1,0.3196709999997438,10.0.2.15,54.93.77.70,TLSv1.2,590,Application Data
1,0.3198649999999361,54.93.77.70,10.0.2.15,TCP,60,9001  >  34692 [ACK] Seq=148409833 Ack=8167733 Win=65535 Len=0
1,0.46904700000004595,62.210.85.178,10.0.2.15,TLSv1.2,590,Application Data
1,0.46983000000000175,10.0.2.15,62.210.85.178,TLSv1.2,590,Application Data
1,0.470459000000119,62.210.85.178,10.0.2.15,TCP,60,9001  >  35978 [ACK] Seq=8136339 Ack=148561591 Win=65535 Len=0
1,0.5716689999999289,54.93.77.70,10.0.2.15,TLSv1.2,590,Application Data
1,0.5717899999999645,10.0.2.15,54.93.77.70,TCP,54,34692  >  9001 [ACK] Seq=8167733 Ack=148410369 Win=65535 Len=0
1,0.5724559999998746,10.0.2.15,54.93.77.70,TLSv1.2,1618,Application Data
1,0.5729739999997037,54.93.77.70,10.0.2.15,TCP,60,9001  >  34692 [ACK] Seq=148410369 Ack=8169193 Win=65535 Len=0
1,0.5730100000000675,54.93.77.70,10.0.2.15,TCP,60,9001  >  34692 [ACK] Seq=148410369 Ack=8169297 Win=65535 Len=0
1,1.0316549999997733,62.210.85.178,10.0.2.15,TLSv1.2,1618,Application Data
1,1.0318109999998342,10.0.2.15,62.210.85.178,TCP,54,35978  >  9001 [ACK] Seq=148561591 Ack=8137903 Win=65535 Len=0
1,1.0620140000000902,10.0.2.15,62.210.85.178,TLSv1.2,590,Application Data
1,1.0621909999999843,62.210.85.178,10.0.2.15,TCP,60,9001  >  35978 [ACK] Seq=8137903 Ack=148562127 Win=65535 Len=0
1,1.074558999999681,10.0.2.15,62.210.85.178,TLSv1.2,1618,Application Data
1,1.07472800000005,62.210.85.178,10.0.2.15,TCP,60,9001  >  35978 [ACK] Seq=8137903 Ack=148563587 Win=65535 Len=0
1,1.074779000000035,62.210.85.178,10.0.2.15,TCP,60,9001  >  35978 [ACK] Seq=8137903 Ack=148563691 Win=65535 Len=0
1,1.236391999999796,54.93.77.70,10.0.2.15,TLSv1.2,2132,Application Data
1,1.2365489999997408,10.0.2.15,54.93.77.70,TCP,54,34692  >  9001 [ACK] Seq=8169297 Ack=148412447 Win=65535 Len=0
1,1.239966000000095,10.0.2.15,54.93.77.70,TLSv1.2,590,Application Data
1,1.2401569999997264,54.93.77.70,10.0.2.15,TCP,60,9001  >  34692 [ACK] Seq=148412447 Ack=8169833 Win=65535 Len=0
1,1.3404599999998936,62.210.85.178,10.0.2.15,TLSv1.2,590,Application Data
1,1.3418619999997645,10.0.2.15,62.210.85.178,TLSv1.2,590,Application Data
1,1.3428369999996903,62.210.85.178,10.0.2.15,TCP,60,9001  >  35978 [ACK] Seq=8138439 Ack=148564227 Win=65535 Len=0
1,1.4748070000000553,54.93.77.70,10.0.2.15,TLSv1.2,590,Application Data
1,1.4754469999998037,10.0.2.15,54.93.77.70,TLSv1.2,590,Application Data
1,1.475680999999895,54.93.77.70,10.0.2.15,TCP,60,9001  >  34692 [ACK] Seq=148412983 Ack=8170369 Win=65535 Len=0
1,1.6158419999997022,62.210.85.178,10.0.2.15,TLSv1.2,590,Application Data
1,1.6272069999999985,10.0.2.15,62.210.85.178,TLSv1.2,590,Application Data
1,1.6274279999997816,62.210.85.178,10.0.2.15,TCP,60,9001  >  35978 [ACK] Seq=8138975 Ack=148564763 Win=65535 Len=0
1,1.6398399999998219,10.0.2.15,62.210.85.178,TLSv1.2,4124,Application Data
1,1.6401590000000397,62.210.85.178,10.0.2.15,TCP,60,9001  >  35978 [ACK] Seq=8138975 Ack=148566223 Win=65535 Len=0
1,1.640186999999969,62.210.85.178,10.0.2.15,TCP,60,9001  >  35978 [ACK] Seq=8138975 Ack=148567683 Win=65535 Len=0
1,1.6401929999997265,62.210.85.178,10.0.2.15,TCP,60,9001  >  35978 [ACK] Seq=8138975 Ack=148568833 Win=65535 Len=0
1,1.6402969999999186,10.0.2.15,62.210.85.178,TLSv1.2,4124,Application Data
1,1.6404640000000654,62.210.85.178,10.0.2.15,TCP,60,9001  >  35978 [ACK] Seq=8138975 Ack=148570293 Win=65535 Len=0
1,1.6404760000000351,62.210.85.178,10.0.2.15,TCP,60,9001  >  35978 [ACK] Seq=8138975 Ack=148571753 Win=65535 Len=0
1,1.6404809999999088,62.210.85.178,10.0.2.15,TCP,60,9001  >  35978 [ACK] Seq=8138975 Ack=148572903 Win=65535 Len=0
1,1.6405469999999696,10.0.2.15,62.210.85.178,TLSv1.2,4124,Application Data
1,1.6406560000000354,62.210.85.178,10.0.2.15,TCP,60,9001  >  35978 [ACK] Seq=8138975 Ack=148574363 Win=65535 Len=0
1,1.640664999999899,62.210.85.178,10.0.2.15,TCP,60,9001  >  35978 [ACK] Seq=8138975 Ack=148575823 Win=65535 Len=0
1,1.6406699999997727,62.210.85.178,10.0.2.15,TCP,60,9001  >  35978 [ACK] Seq=8138975 Ack=148576973 Win=65535 Len=0
1,1.6407399999998233,10.0.2.15,62.210.85.178,TLSv1.2,4124,Application Data
1,1.6408799999999246,62.210.85.178,10.0.2.15,TCP,60,9001  >  35978 [ACK] Seq=8138975 Ack=148578433 Win=65535 Len=0
1,1.6408959999998842,62.210.85.178,10.0.2.15,TCP,60,9001  >  35978 [ACK] Seq=8138975 Ack=148579893 Win=65535 Len=0
1,1.640900999999758,62.210.85.178,10.0.2.15,TCP,60,9001  >  35978 [ACK] Seq=8138975 Ack=148581043 Win=65535 Len=0
1,1.6409629999998288,10.0.2.15,62.210.85.178,TLSv1.2,332,Application Data
1,1.6411229999998795,62.210.85.178,10.0.2.15,TCP,60,9001  >  35978 [ACK] Seq=8138975 Ack=148581321 Win=65535 Len=0
1,1.6412559999998848,10.0.2.15,62.210.85.178,TLSv1.2,3868,Application Data
1,1.6414159999999356,62.210.85.178,10.0.2.15,TCP,60,9001  >  35978 [ACK] Seq=8138975 Ack=148582781 Win=65535 Len=0
1,1.641428999999789,62.210.85.178,10.0.2.15,TCP,60,9001  >  35978 [ACK] Seq=8138975 Ack=148584241 Win=65535 Len=0
1,1.6414350000000013,62.210.85.178,10.0.2.15,TCP,60,9001  >  35978 [ACK] Seq=8138975 Ack=148585135 Win=65535 Len=0
1,1.6415219999998953,10.0.2.15,62.210.85.178,TLSv1.2,4124,Application Data
1,1.6416399999998248,62.210.85.178,10.0.2.15,TCP,60,9001  >  35978 [ACK] Seq=8138975 Ack=148586595 Win=65535 Len=0
1,1.641650000000027,62.210.85.178,10.0.2.15,TCP,60,9001  >  35978 [ACK] Seq=8138975 Ack=148588055 Win=65535 Len=0
1,1.6416559999997844,62.210.85.178,10.0.2.15,TCP,60,9001  >  35978 [ACK] Seq=8138975 Ack=148589205 Win=65535 Len=0
1,1.6417109999997592,10.0.2.15,62.210.85.178,TLSv1.2,3030,Application Data
1,1.6418399999997746,62.210.85.178,10.0.2.15,TCP,60,9001  >  35978 [ACK] Seq=8138975 Ack=148590665 Win=65535 Len=0
1,1.6418499999999767,62.210.85.178,10.0.2.15,TCP,60,9001  >  35978 [ACK] Seq=8138975 Ack=148592125 Win=65535 Len=0
1,1.6418549999998504,62.210.85.178,10.0.2.15,TCP,60,9001  >  35978 [ACK] Seq=8138975 Ack=148592181 Win=65535 Len=0
1,1.651354000000083,10.0.2.15,62.210.85.178,TLSv1.2,4124,Application Data
1,1.6515569999996842,62.210.85.178,10.0.2.15,TCP,60,9001  >  35978 [ACK] Seq=8138975 Ack=148593641 Win=65535 Len=0
1,1.6515799999997398,62.210.85.178,10.0.2.15,TCP,60,9001  >  35978 [ACK] Seq=8138975 Ack=148595101 Win=65535 Len=0
1,1.651585999999952,62.210.85.178,10.0.2.15,TCP,60,9001  >  35978 [ACK] Seq=8138975 Ack=148596251 Win=65535 Len=0
1,1.6516670000000886,10.0.2.15,62.210.85.178,TLSv1.2,4124,Application Data
1,1.6517669999998361,62.210.85.178,10.0.2.15,TCP,60,9001  >  35978 [ACK] Seq=8138975 Ack=148597711 Win=65535 Len=0
1,1.6517799999996896,62.210.85.178,10.0.2.15,TCP,60,9001  >  35978 [ACK] Seq=8138975 Ack=148599171 Win=65535 Len=0
1,1.6517839999996795,62.210.85.178,10.0.2.15,TCP,60,9001  >  35978 [ACK] Seq=8138975 Ack=148600321 Win=65535 Len=0
1,1.6518479999999727,10.0.2.15,62.210.85.178,TLSv1.2,4124,Application Data
1,1.6519419999999627,62.210.85.178,10.0.2.15,TCP,60,9001  >  35978 [ACK] Seq=8138975 Ack=148601781 Win=65535 Len=0
1,1.6519530000000486,62.210.85.178,10.0.2.15,TCP,60,9001  >  35978 [ACK] Seq=8138975 Ack=148603241 Win=65535 Len=0
1,1.6519579999999223,62.210.85.178,10.0.2.15,TCP,60,9001  >  35978 [ACK] Seq=8138975 Ack=148604391 Win=65535 Len=0
1,1.6521099999999933,10.0.2.15,62.210.85.178,TLSv1.2,4124,Application Data
1,1.6522099999997408,62.210.85.178,10.0.2.15,TCP,60,9001  >  35978 [ACK] Seq=8138975 Ack=148605851 Win=65535 Len=0
1,1.6522219999997105,62.210.85.178,10.0.2.15,TCP,60,9001  >  35978 [ACK] Seq=8138975 Ack=148607311 Win=65535 Len=0
1,1.652227000000039,62.210.85.178,10.0.2.15,TCP,60,9001  >  35978 [ACK] Seq=8138975 Ack=148608461 Win=65535 Len=0
1,1.6522809999996753,10.0.2.15,62.210.85.178,TLSv1.2,332,Application Data
1,1.6523669999996855,62.210.85.178,10.0.2.15,TCP,60,9001  >  35978 [ACK] Seq=8138975 Ack=148608739 Win=65535 Len=0
1,1.6524540000000343,10.0.2.15,62.210.85.178,TLSv1.2,3868,Application Data
1,1.652552999999898,62.210.85.178,10.0.2.15,TCP,60,9001  >  35978 [ACK] Seq=8138975 Ack=148610199 Win=65535 Len=0
1,1.6525630000001001,62.210.85.178,10.0.2.15,TCP,60,9001  >  35978 [ACK] Seq=8138975 Ack=148611659 Win=65535 Len=0
1,1.6525679999999738,62.210.85.178,10.0.2.15,TCP,60,9001  >  35978 [ACK] Seq=8138975 Ack=148612553 Win=65535 Len=0
1,1.6526450000001205,10.0.2.15,62.210.85.178,TLSv1.2,4124,Application Data
1,1.65276300000005,62.210.85.178,10.0.2.15,TCP,60,9001  >  35978 [ACK] Seq=8138975 Ack=148614013 Win=65535 Len=0
1,1.6527729999997973,62.210.85.178,10.0.2.15,TCP,60,9001  >  35978 [ACK] Seq=8138975 Ack=148615473 Win=65535 Len=0
1,1.652777999999671,62.210.85.178,10.0.2.15,TCP,60,9001  >  35978 [ACK] Seq=8138975 Ack=148616623 Win=65535 Len=0
1,1.6528330000001006,10.0.2.15,62.210.85.178,TLSv1.2,3030,Application Data
1,1.6529249999998683,62.210.85.178,10.0.2.15,TCP,60,9001  >  35978 [ACK] Seq=8138975 Ack=148618083 Win=65535 Len=0
1,1.6529350000000704,62.210.85.178,10.0.2.15,TCP,60,9001  >  35978 [ACK] Seq=8138975 Ack=148619543 Win=65535 Len=0
1,1.6529399999999441,62.210.85.178,10.0.2.15,TCP,60,9001  >  35978 [ACK] Seq=8138975 Ack=148619599 Win=65535 Len=0
1,1.6635049999999865,10.0.2.15,62.210.85.178,TLSv1.2,4124,Application Data
1,1.6638490000000274,62.210.85.178,10.0.2.15,TCP,60,9001  >  35978 [ACK] Seq=8138975 Ack=148621059 Win=65535 Len=0
1,1.6638889999999265,62.210.85.178,10.0.2.15,TCP,60,9001  >  35978 [ACK] Seq=8138975 Ack=148622519 Win=65535 Len=0
1,1.6638939999998001,62.210.85.178,10.0.2.15,TCP,60,9001  >  35978 [ACK] Seq=8138975 Ack=148623669 Win=65535 Len=0
1,1.6639860000000226,10.0.2.15,62.210.85.178,TLSv1.2,4124,Application Data
1,1.6640739999998004,62.210.85.178,10.0.2.15,TCP,60,9001  >  35978 [ACK] Seq=8138975 Ack=148625129 Win=65535 Len=0
1,1.6640830000001188,62.210.85.178,10.0.2.15,TCP,60,9001  >  35978 [ACK] Seq=8138975 Ack=148626589 Win=65535 Len=0
1,1.6640859999997701,62.210.85.178,10.0.2.15,TCP,60,9001  >  35978 [ACK] Seq=8138975 Ack=148627739 Win=65535 Len=0
1,1.6641259999996691,10.0.2.15,62.210.85.178,TLSv1.2,4124,Application Data
1,1.6641689999996743,62.210.85.178,10.0.2.15,TCP,60,9001  >  35978 [ACK] Seq=8138975 Ack=148629199 Win=65535 Len=0
1,1.6641759999997703,62.210.85.178,10.0.2.15,TCP,60,9001  >  35978 [ACK] Seq=8138975 Ack=148630659 Win=65535 Len=0
1,1.6641789999998764,62.210.85.178,10.0.2.15,TCP,60,9001  >  35978 [ACK] Seq=8138975 Ack=148631809 Win=65535 Len=0
1,1.6642179999998916,10.0.2.15,62.210.85.178,TLSv1.2,4124,Application Data
1,1.6642569999999068,62.210.85.178,10.0.2.15,TCP,60,9001  >  35978 [ACK] Seq=8138975 Ack=148633269 Win=65535 Len=0
1,1.664263000000119,62.210.85.178,10.0.2.15,TCP,60,9001  >  35978 [ACK] Seq=8138975 Ack=148634729 Win=65535 Len=0
1,1.6642659999997704,62.210.85.178,10.0.2.15,TCP,60,9001  >  35978 [ACK] Seq=8138975 Ack=148635879 Win=65535 Len=0
1,1.6643039999999019,10.0.2.15,62.210.85.178,TLSv1.2,332,Application Data
1,1.6643420000000333,62.210.85.178,10.0.2.15,TCP,60,9001  >  35978 [ACK] Seq=8138975 Ack=148636157 Win=65535 Len=0
1,1.664408000000094,10.0.2.15,62.210.85.178,TLSv1.2,3674,Application Data
1,1.6644459999997707,62.210.85.178,10.0.2.15,TCP,60,9001  >  35978 [ACK] Seq=8138975 Ack=148637617 Win=65535 Len=0
1,1.6644539999997505,62.210.85.178,10.0.2.15,TCP,60,9001  >  35978 [ACK] Seq=8138975 Ack=148639077 Win=65535 Len=0
1,1.6644569999998566,62.210.85.178,10.0.2.15,TCP,60,9001  >  35978 [ACK] Seq=8138975 Ack=148639777 Win=65535 Len=0
1,1.858878999999888,54.93.77.70,10.0.2.15,TCP,2950,"9001  >  34692 [PSH, ACK] Seq=148412983 Ack=8170369 Win=65535 Len=2896 [TCP segment of a reassembled PDU]"
1,1.8591049999999996,10.0.2.15,54.93.77.70,TCP,54,34692  >  9001 [ACK] Seq=8170369 Ack=148415879 Win=65535 Len=0
1,1.8591919999998936,54.93.77.70,10.0.2.15,TLSv1.2,4398,"Application Data, Application Data"
1,1.8592549999998482,10.0.2.15,54.93.77.70,TCP,54,34692  >  9001 [ACK] Seq=8170369 Ack=148420223 Win=65535 Len=0
1,1.8684029999999439,54.93.77.70,10.0.2.15,TCP,2950,"9001  >  34692 [PSH, ACK] Seq=148420223 Ack=8170369 Win=65535 Len=2896 [TCP segment of a reassembled PDU]"
1,1.8685150000001158,10.0.2.15,54.93.77.70,TCP,54,34692  >  9001 [ACK] Seq=8170369 Ack=148423119 Win=65535 Len=0
1,1.8685679999998683,54.93.77.70,10.0.2.15,TLSv1.2,2950,Application Data [TCP segment of a reassembled PDU]
1,1.8686529999999948,10.0.2.15,54.93.77.70,TCP,54,34692  >  9001 [ACK] Seq=8170369 Ack=148426015 Win=65535 Len=0
1,1.8853049999997893,54.93.77.70,10.0.2.15,TLSv1.2,3580,"Application Data, Application Data"
1,1.8857600000001185,10.0.2.15,54.93.77.70,TCP,54,34692  >  9001 [ACK] Seq=8170369 Ack=148429541 Win=65535 Len=0
1,1.926220999999714,54.93.77.70,10.0.2.15,TCP,2950,"9001  >  34692 [PSH, ACK] Seq=148429541 Ack=8170369 Win=65535 Len=2896 [TCP segment of a reassembled PDU]"
1,1.926267999999709,54.93.77.70,10.0.2.15,TLSv1.2,5846,"Application Data, Application Data"
1,1.9263369999998758,10.0.2.15,54.93.77.70,TCP,54,34692  >  9001 [ACK] Seq=8170369 Ack=148432437 Win=65535 Len=0
1,1.926480999999967,10.0.2.15,54.93.77.70,TCP,54,34692  >  9001 [ACK] Seq=8170369 Ack=148438229 Win=65535 Len=0
1,1.9266999999999825,54.93.77.70,10.0.2.15,TLSv1.2,2740,Application Data
1,1.9268529999999373,10.0.2.15,54.93.77.70,TCP,54,34692  >  9001 [ACK] Seq=8170369 Ack=148440915 Win=65535 Len=0
1,1.9270419999998012,10.0.2.15,54.93.77.70,TLSv1.2,590,Application Data
1,1.927114999999958,54.93.77.70,10.0.2.15,TCP,60,9001  >  34692 [ACK] Seq=148440915 Ack=8170905 Win=65535 Len=0
1,1.9445479999999407,54.93.77.70,10.0.2.15,TCP,2950,"9001  >  34692 [PSH, ACK] Seq=148440915 Ack=8170905 Win=65535 Len=2896 [TCP segment of a reassembled PDU]"
1,1.9447119999999813,10.0.2.15,54.93.77.70,TCP,54,34692  >  9001 [ACK] Seq=8170905 Ack=148443811 Win=65535 Len=0
1,1.9447719999998299,54.93.77.70,10.0.2.15,TLSv1.2,4398,"Application Data, Application Data"
1,1.9448119999997289,10.0.2.15,54.93.77.70,TCP,54,34692  >  9001 [ACK] Seq=8170905 Ack=148448155 Win=65535 Len=0
1,1.9665679999998247,54.93.77.70,10.0.2.15,TLSv1.2,3674,Application Data
1,1.966656999999941,10.0.2.15,54.93.77.70,TCP,54,34692  >  9001 [ACK] Seq=8170905 Ack=148451775 Win=65535 Len=0
1,1.9823099999998703,54.93.77.70,10.0.2.15,TCP,2950,"9001  >  34692 [PSH, ACK] Seq=148451775 Ack=8170905 Win=65535 Len=2896 [TCP segment of a reassembled PDU]"
1,1.9824679999996988,10.0.2.15,54.93.77.70,TCP,54,34692  >  9001 [ACK] Seq=8170905 Ack=148454671 Win=65535 Len=0
1,1.9831610000001092,54.93.77.70,10.0.2.15,TLSv1.2,5846,"Application Data, Application Data"
1,1.9833530000000792,10.0.2.15,54.93.77.70,TCP,54,34692  >  9001 [ACK] Seq=8170905 Ack=148460463 Win=65535 Len=0
1,1.983918999999787,10.0.2.15,54.93.77.70,TLSv1.2,590,Application Data
1,1.9845279999999548,54.93.77.70,10.0.2.15,TCP,60,9001  >  34692 [ACK] Seq=148460463 Ack=8171441 Win=65535 Len=0
1,1.9846159999997326,54.93.77.70,10.0.2.15,TLSv1.2,4304,"Application Data, Application Data"
1,1.9848189999997885,10.0.2.15,54.93.77.70,TCP,54,34692  >  9001 [ACK] Seq=8171441 Ack=148464713 Win=65535 Len=0
1,1.9943089999997028,10.0.2.15,54.93.77.70,TLSv1.2,590,Application Data
1,1.9945189999998547,54.93.77.70,10.0.2.15,TCP,60,9001  >  34692 [ACK] Seq=148464713 Ack=8171977 Win=65535 Len=0
1,2.004417000000103,54.93.77.70,10.0.2.15,TLSv1.2,3674,Application Data
1,2.004613999999947,10.0.2.15,54.93.77.70,TCP,54,34692  >  9001 [ACK] Seq=8171977 Ack=148468333 Win=65535 Len=0
1,2.0240389999999024,54.93.77.70,10.0.2.15,TCP,2950,"9001  >  34692 [PSH, ACK] Seq=148468333 Ack=8171977 Win=65535 Len=2896 [TCP segment of a reassembled PDU]"
1,2.0241470000000845,10.0.2.15,54.93.77.70,TCP,54,34692  >  9001 [ACK] Seq=8171977 Ack=148471229 Win=65535 Len=0
1,2.029833999999937,54.93.77.70,10.0.2.15,TLSv1.2,778,Application Data
1,2.0701070000000072,10.0.2.15,54.93.77.70,TCP,54,34692  >  9001 [ACK] Seq=8171977 Ack=148471953 Win=65535 Len=0
1,2.0999449999999342,62.210.85.178,10.0.2.15,TLSv1.2,1618,Application Data
1,2.1000810000000456,10.0.2.15,62.210.85.178,TCP,54,35978  >  9001 [ACK] Seq=148639777 Ack=8140539 Win=65535 Len=0
1,2.146332999999686,54.93.77.70,10.0.2.15,TCP,2950,"9001  >  34692 [PSH, ACK] Seq=148471953 Ack=8171977 Win=65535 Len=2896 [TCP segment of a reassembled PDU]"
1,2.1464889999997467,54.93.77.70,10.0.2.15,TLSv1.2,13086,"Application Data, Application Data, Application Data"
1,2.1468469999999797,10.0.2.15,54.93.77.70,TCP,54,34692  >  9001 [ACK] Seq=8171977 Ack=148487881 Win=65535 Len=0
1,2.167787999999746,54.93.77.70,10.0.2.15,TLSv1.2,684,"Application Data, Application Data"
1,2.168141000000105,10.0.2.15,54.93.77.70,TCP,54,34692  >  9001 [ACK] Seq=8171977 Ack=148488511 Win=65535 Len=0
1,2.1739880000000085,10.0.2.15,54.93.77.70,TLSv1.2,590,Application Data
1,2.174144999999953,54.93.77.70,10.0.2.15,TCP,60,9001  >  34692 [ACK] Seq=148488511 Ack=8172513 Win=65535 Len=0
1,2.874757000000045,62.210.85.178,10.0.2.15,TLSv1.2,590,Application Data
1,2.875169999999798,10.0.2.15,62.210.85.178,TLSv1.2,590,Application Data
1,2.875931000000037,62.210.85.178,10.0.2.15,TCP,60,9001  >  35978 [ACK] Seq=8141075 Ack=148640313 Win=65535 Len=0
1,2.9863000000000284,54.93.77.70,10.0.2.15,TLSv1.2,590,Application Data
1,2.9869579999999587,10.0.2.15,54.93.77.70,TLSv1.2,590,Application Data
1,2.987134999999853,54.93.77.70,10.0.2.15,TCP,60,9001  >  34692 [ACK] Seq=148489047 Ack=8173049 Win=65535 Len=0
1,3.101141000000098,62.210.85.178,10.0.2.15,TLSv1.2,590,Application Data
1,3.1104519999998956,10.0.2.15,62.210.85.178,TLSv1.2,590,Application Data
1,3.1106549999999515,62.210.85.178,10.0.2.15,TCP,60,9001  >  35978 [ACK] Seq=8141611 Ack=148640849 Win=65535 Len=0
1,3.1233469999997396,10.0.2.15,62.210.85.178,TLSv1.2,4124,Application Data
1,3.1241519999998673,62.210.85.178,10.0.2.15,TCP,60,9001  >  35978 [ACK] Seq=8141611 Ack=148642309 Win=65535 Len=0
1,3.124195999999756,62.210.85.178,10.0.2.15,TCP,60,9001  >  35978 [ACK] Seq=8141611 Ack=148643769 Win=65535 Len=0
1,3.124203999999736,62.210.85.178,10.0.2.15,TCP,60,9001  >  35978 [ACK] Seq=8141611 Ack=148644919 Win=65535 Len=0
1,3.124655999999959,10.0.2.15,62.210.85.178,TLSv1.2,4124,Application Data
1,3.124757000000045,62.210.85.178,10.0.2.15,TCP,60,9001  >  35978 [ACK] Seq=8141611 Ack=148646379 Win=65535 Len=0
1,3.1247739999998885,62.210.85.178,10.0.2.15,TCP,60,9001  >  35978 [ACK] Seq=8141611 Ack=148647839 Win=65535 Len=0
1,3.1247800000001007,62.210.85.178,10.0.2.15,TCP,60,9001  >  35978 [ACK] Seq=8141611 Ack=148648989 Win=65535 Len=0
1,3.1248350000000755,10.0.2.15,62.210.85.178,TLSv1.2,4124,Application Data
1,3.1249139999999898,62.210.85.178,10.0.2.15,TCP,60,9001  >  35978 [ACK] Seq=8141611 Ack=148650449 Win=65535 Len=0
1,3.1249229999998533,62.210.85.178,10.0.2.15,TCP,60,9001  >  35978 [ACK] Seq=8141611 Ack=148651909 Win=65535 Len=0
1,3.1249269999998432,62.210.85.178,10.0.2.15,TCP,60,9001  >  35978 [ACK] Seq=8141611 Ack=148653059 Win=65535 Len=0
1,3.124970999999732,10.0.2.15,62.210.85.178,TLSv1.2,4124,Application Data
1,3.12500799999998,62.210.85.178,10.0.2.15,TCP,60,9001  >  35978 [ACK] Seq=8141611 Ack=148654519 Win=65535 Len=0
1,3.1250159999999596,62.210.85.178,10.0.2.15,TCP,60,9001  >  35978 [ACK] Seq=8141611 Ack=148655979 Win=65535 Len=0
1,3.1250199999999495,62.210.85.178,10.0.2.15,TCP,60,9001  >  35978 [ACK] Seq=8141611 Ack=148657129 Win=65535 Len=0
1,3.125058000000081,10.0.2.15,62.210.85.178,TLSv1.2,332,Application Data
1,3.1251119999997172,62.210.85.178,10.0.2.15,TCP,60,9001  >  35978 [ACK] Seq=8141611 Ack=148657407 Win=65535 Len=0
1,3.1253240000000915,10.0.2.15,62.210.85.178,TLSv1.2,3868,Application Data
1,3.1254009999997834,62.210.85.178,10.0.2.15,TCP,60,9001  >  35978 [ACK] Seq=8141611 Ack=148658867 Win=65535 Len=0
1,3.1254399999997986,62.210.85.178,10.0.2.15,TCP,60,9001  >  35978 [ACK] Seq=8141611 Ack=148660327 Win=65535 Len=0
1,3.125446000000011,62.210.85.178,10.0.2.15,TCP,60,9001  >  35978 [ACK] Seq=8141611 Ack=148661221 Win=65535 Len=0
1,3.1255160000000615,10.0.2.15,62.210.85.178,TLSv1.2,910,Application Data
1,3.1255699999996978,62.210.85.178,10.0.2.15,TCP,60,9001  >  35978 [ACK] Seq=8141611 Ack=148662077 Win=65535 Len=0
1,3.225576999999703,54.93.77.70,10.0.2.15,TLSv1.2,590,Application Data
1,3.2559729999998126,54.93.77.70,10.0.2.15,TLSv1.2,3674,Application Data
1,3.2560679999996864,10.0.2.15,54.93.77.70,TCP,54,34692  >  9001 [ACK] Seq=8173049 Ack=148493203 Win=65535 Len=0
1,3.287420999999995,54.93.77.70,10.0.2.15,TLSv1.2,3160,Application Data
1,3.2875779999999395,10.0.2.15,54.93.77.70,TCP,54,34692  >  9001 [ACK] Seq=8173049 Ack=148496309 Win=65535 Len=0
1,3.2989050000001043,54.93.77.70,10.0.2.15,TLSv1.2,2950,Application Data
1,3.299070000000029,10.0.2.15,54.93.77.70,TCP,54,34692  >  9001 [ACK] Seq=8173049 Ack=148499205 Win=65535 Len=0
1,3.304192999999941,54.93.77.70,10.0.2.15,TLSv1.2,1314,Application Data
1,3.3184189999997216,54.93.77.70,10.0.2.15,TCP,2950,"9001  >  34692 [PSH, ACK] Seq=148500465 Ack=8173049 Win=65535 Len=2896 [TCP segment of a reassembled PDU]"
1,3.3184729999998126,54.93.77.70,10.0.2.15,TLSv1.2,4398,Application Data [TCP segment of a reassembled PDU]
1,3.3185429999998632,10.0.2.15,54.93.77.70,TCP,54,34692  >  9001 [ACK] Seq=8173049 Ack=148503361 Win=65535 Len=0
1,3.3186829999999645,10.0.2.15,54.93.77.70,TCP,54,34692  >  9001 [ACK] Seq=8173049 Ack=148507705 Win=65535 Len=0
1,3.3205339999999524,54.93.77.70,10.0.2.15,TLSv1.2,568,Application Data
1,3.321012999999766,10.0.2.15,54.93.77.70,TLSv1.2,590,Application Data
1,3.3213089999999283,54.93.77.70,10.0.2.15,TCP,60,9001  >  34692 [ACK] Seq=148508219 Ack=8173585 Win=65535 Len=0
1,3.329617999999755,54.93.77.70,10.0.2.15,TCP,1502,"9001  >  34692 [PSH, ACK] Seq=148508219 Ack=8173585 Win=65535 Len=1448 [TCP segment of a reassembled PDU]"
1,3.329816999999821,10.0.2.15,54.93.77.70,TCP,54,34692  >  9001 [ACK] Seq=8173585 Ack=148509667 Win=65535 Len=0
1,3.336601999999857,54.93.77.70,10.0.2.15,TLSv1.2,153,Application Data
1,3.378193999999894,10.0.2.15,54.93.77.70,TCP,54,34692  >  9001 [ACK] Seq=8173585 Ack=148509766 Win=65535 Len=0
1,3.6562629999998535,62.210.85.178,10.0.2.15,TLSv1.2,590,Application Data
1,3.6941659999997682,54.93.77.70,10.0.2.15,TLSv1.2,1121,Application Data
1,3.6943129999999655,10.0.2.15,54.93.77.70,TCP,54,34692  >  9001 [ACK] Seq=8173585 Ack=148510833 Win=65535 Len=0
1,3.698217999999997,10.0.2.15,62.210.85.178,TCP,54,35978  >  9001 [ACK] Seq=148662077 Ack=8142147 Win=65535 Len=0
1,3.7181399999999485,10.0.2.15,54.93.77.70,TLSv1.2,590,Application Data
1,3.7184159999997064,54.93.77.70,10.0.2.15,TCP,60,9001  >  34692 [ACK] Seq=148510833 Ack=8174121 Win=65535 Len=0
1,3.87992899999972,62.210.85.178,10.0.2.15,TLSv1.2,590,Application Data
1,3.8801469999998517,10.0.2.15,62.210.85.178,TCP,54,35978  >  9001 [ACK] Seq=148662077 Ack=8142683 Win=65535 Len=0
1,3.8807389999997213,10.0.2.15,62.210.85.178,TLSv1.2,590,Application Data
1,3.8811219999997775,62.210.85.178,10.0.2.15,TCP,60,9001  >  35978 [ACK] Seq=8142683 Ack=148662613 Win=65535 Len=0
1,4.108467000000019,54.93.77.70,10.0.2.15,TLSv1.2,590,Application Data
1,4.1091309999997065,10.0.2.15,54.93.77.70,TLSv1.2,590,Application Data
1,4.109904999999799,54.93.77.70,10.0.2.15,TCP,60,9001  >  34692 [ACK] Seq=148511369 Ack=8174657 Win=65535 Len=0
1,4.307710999999927,62.210.85.178,10.0.2.15,TLSv1.2,590,Application Data
1,4.311670000000049,10.0.2.15,62.210.85.178,TLSv1.2,590,Application Data
1,4.311852999999701,62.210.85.178,10.0.2.15,TCP,60,9001  >  35978 [ACK] Seq=8143219 Ack=148663149 Win=65535 Len=0
1,4.3266020000000935,10.0.2.15,62.210.85.178,TLSv1.2,4124,Application Data
1,4.326756999999816,10.0.2.15,62.210.85.178,TCP,2974,35978  >  9001 [ACK] Seq=148667219 Ack=8143219 Win=65535 Len=2920 [TCP segment of a reassembled PDU]
1,4.326810000000023,62.210.85.178,10.0.2.15,TCP,60,9001  >  35978 [ACK] Seq=8143219 Ack=148664609 Win=65535 Len=0
1,4.326822999999877,62.210.85.178,10.0.2.15,TCP,60,9001  >  35978 [ACK] Seq=8143219 Ack=148666069 Win=65535 Len=0
1,4.32682799999975,62.210.85.178,10.0.2.15,TCP,60,9001  >  35978 [ACK] Seq=8143219 Ack=148667219 Win=65535 Len=0
1,4.32683199999974,62.210.85.178,10.0.2.15,TCP,60,9001  >  35978 [ACK] Seq=8143219 Ack=148668679 Win=65535 Len=0
1,4.326837000000069,62.210.85.178,10.0.2.15,TCP,60,9001  >  35978 [ACK] Seq=8143219 Ack=148670139 Win=65535 Len=0
1,4.3268849999999475,10.0.2.15,62.210.85.178,TLSv1.2,1204,Application Data
1,4.326928999999836,62.210.85.178,10.0.2.15,TCP,60,9001  >  35978 [ACK] Seq=8143219 Ack=148671289 Win=65535 Len=0
1,4.326980999999705,10.0.2.15,62.210.85.178,TLSv1.2,4124,Application Data
1,4.327022999999826,62.210.85.178,10.0.2.15,TCP,60,9001  >  35978 [ACK] Seq=8143219 Ack=148672749 Win=65535 Len=0
1,4.327030999999806,62.210.85.178,10.0.2.15,TCP,60,9001  >  35978 [ACK] Seq=8143219 Ack=148674209 Win=65535 Len=0
1,4.32703599999968,62.210.85.178,10.0.2.15,TCP,60,9001  >  35978 [ACK] Seq=8143219 Ack=148675359 Win=65535 Len=0
1,4.3270910000001095,10.0.2.15,62.210.85.178,TLSv1.2,1810,Application Data
1,4.327307999999903,62.210.85.178,10.0.2.15,TCP,60,9001  >  35978 [ACK] Seq=8143219 Ack=148676819 Win=65535 Len=0
1,4.327324999999746,62.210.85.178,10.0.2.15,TCP,60,9001  >  35978 [ACK] Seq=8143219 Ack=148677115 Win=65535 Len=0
1,4.406244999999672,54.93.77.70,10.0.2.15,TLSv1.2,590,Application Data
1,4.430934999999863,54.93.77.70,10.0.2.15,TCP,2950,"9001  >  34692 [PSH, ACK] Seq=148511905 Ack=8174657 Win=65535 Len=2896 [TCP segment of a reassembled PDU]"
1,4.430974999999762,54.93.77.70,10.0.2.15,TLSv1.2,1502,Application Data [TCP segment of a reassembled PDU]
1,4.431072999999742,10.0.2.15,54.93.77.70,TCP,54,34692  >  9001 [ACK] Seq=8174657 Ack=148516249 Win=65535 Len=0
1,4.43184599999995,54.93.77.70,10.0.2.15,TLSv1.2,2950,Application Data
1,4.431882999999743,10.0.2.15,54.93.77.70,TCP,54,34692  >  9001 [ACK] Seq=8174657 Ack=148519145 Win=65535 Len=0
1,4.498379000000114,54.93.77.70,10.0.2.15,TCP,2950,"9001  >  34692 [PSH, ACK] Seq=148519145 Ack=8174657 Win=65535 Len=2896 [TCP segment of a reassembled PDU]"
1,4.498438000000078,54.93.77.70,10.0.2.15,TLSv1.2,3884,"Application Data, Application Data"
1,4.498493000000053,10.0.2.15,54.93.77.70,TCP,54,34692  >  9001 [ACK] Seq=8174657 Ack=148522041 Win=65535 Len=0
1,4.498614000000089,10.0.2.15,54.93.77.70,TCP,54,34692  >  9001 [ACK] Seq=8174657 Ack=148525871 Win=65535 Len=0
1,4.501866999999947,10.0.2.15,54.93.77.70,TLSv1.2,590,Application Data
1,4.502085999999963,54.93.77.70,10.0.2.15,TCP,60,9001  >  34692 [ACK] Seq=148525871 Ack=8175193 Win=65535 Len=0
1,4.5967179999997825,62.210.85.178,10.0.2.15,TLSv1.2,590,Application Data
1,4.597289999999703,10.0.2.15,62.210.85.178,TLSv1.2,590,Application Data
1,4.597421999999824,62.210.85.178,10.0.2.15,TCP,60,9001  >  35978 [ACK] Seq=8143755 Ack=148677651 Win=65535 Len=0
1,5.024852999999894,54.93.77.70,10.0.2.15,TLSv1.2,590,Application Data
1,5.025264999999763,10.0.2.15,54.93.77.70,TLSv1.2,590,Application Data
1,5.025380999999925,54.93.77.70,10.0.2.15,TCP,60,9001  >  34692 [ACK] Seq=148526407 Ack=8175729 Win=65535 Len=0
1,5.3320269999999255,62.210.85.178,10.0.2.15,TLSv1.2,590,Application Data
1,5.344630999999936,10.0.2.15,62.210.85.178,TLSv1.2,590,Application Data
1,5.344802999999956,62.210.85.178,10.0.2.15,TCP,60,9001  >  35978 [ACK] Seq=8144291 Ack=148678187 Win=65535 Len=0
1,5.360034999999698,10.0.2.15,62.210.85.178,TLSv1.2,4124,Application Data
1,5.3606949999998506,62.210.85.178,10.0.2.15,TCP,60,9001  >  35978 [ACK] Seq=8144291 Ack=148679647 Win=65535 Len=0
1,5.360740000000078,62.210.85.178,10.0.2.15,TCP,60,9001  >  35978 [ACK] Seq=8144291 Ack=148681107 Win=65535 Len=0
1,5.360744999999952,62.210.85.178,10.0.2.15,TCP,60,9001  >  35978 [ACK] Seq=8144291 Ack=148682257 Win=65535 Len=0
1,5.360843999999815,10.0.2.15,62.210.85.178,TLSv1.2,4124,Application Data
1,5.360991000000013,62.210.85.178,10.0.2.15,TCP,60,9001  >  35978 [ACK] Seq=8144291 Ack=148683717 Win=65535 Len=0
1,5.361002000000099,62.210.85.178,10.0.2.15,TCP,60,9001  >  35978 [ACK] Seq=8144291 Ack=148685177 Win=65535 Len=0
1,5.361006999999972,62.210.85.178,10.0.2.15,TCP,60,9001  >  35978 [ACK] Seq=8144291 Ack=148686327 Win=65535 Len=0
1,5.361074999999801,10.0.2.15,62.210.85.178,TLSv1.2,4124,Application Data
1,5.3612049999997,62.210.85.178,10.0.2.15,TCP,60,9001  >  35978 [ACK] Seq=8144291 Ack=148687787 Win=65535 Len=0
1,5.361214000000018,62.210.85.178,10.0.2.15,TCP,60,9001  >  35978 [ACK] Seq=8144291 Ack=148689247 Win=65535 Len=0
1,5.361218999999892,62.210.85.178,10.0.2.15,TCP,60,9001  >  35978 [ACK] Seq=8144291 Ack=148690397 Win=65535 Len=0
1,5.361272999999983,10.0.2.15,62.210.85.178,TLSv1.2,4124,Application Data
1,5.361370000000079,62.210.85.178,10.0.2.15,TCP,60,9001  >  35978 [ACK] Seq=8144291 Ack=148691857 Win=65535 Len=0
1,5.361378999999943,62.210.85.178,10.0.2.15,TCP,60,9001  >  35978 [ACK] Seq=8144291 Ack=148693317 Win=65535 Len=0
1,5.3613829999999325,62.210.85.178,10.0.2.15,TCP,60,9001  >  35978 [ACK] Seq=8144291 Ack=148694467 Win=65535 Len=0
1,5.361439999999675,10.0.2.15,62.210.85.178,TLSv1.2,332,Application Data
1,5.3615209999998115,62.210.85.178,10.0.2.15,TCP,60,9001  >  35978 [ACK] Seq=8144291 Ack=148694745 Win=65535 Len=0
1,5.361605999999938,10.0.2.15,62.210.85.178,TLSv1.2,3868,Application Data
1,5.3617129999997815,62.210.85.178,10.0.2.15,TCP,60,9001  >  35978 [ACK] Seq=8144291 Ack=148696205 Win=65535 Len=0
1,5.3617220000001,62.210.85.178,10.0.2.15,TCP,60,9001  >  35978 [ACK] Seq=8144291 Ack=148697665 Win=65535 Len=0
1,5.3617269999999735,62.210.85.178,10.0.2.15,TCP,60,9001  >  35978 [ACK] Seq=8144291 Ack=148698559 Win=65535 Len=0
1,5.361802999999782,10.0.2.15,62.210.85.178,TLSv1.2,4124,Application Data
1,5.361912999999731,62.210.85.178,10.0.2.15,TCP,60,9001  >  35978 [ACK] Seq=8144291 Ack=148700019 Win=65535 Len=0
1,5.36192200000005,62.210.85.178,10.0.2.15,TCP,60,9001  >  35978 [ACK] Seq=8144291 Ack=148701479 Win=65535 Len=0
1,5.361926999999923,62.210.85.178,10.0.2.15,TCP,60,9001  >  35978 [ACK] Seq=8144291 Ack=148702629 Win=65535 Len=0
1,5.361986999999772,10.0.2.15,62.210.85.178,TLSv1.2,3030,Application Data
1,5.362114999999903,62.210.85.178,10.0.2.15,TCP,60,9001  >  35978 [ACK] Seq=8144291 Ack=148704089 Win=65535 Len=0
1,5.362129999999979,62.210.85.178,10.0.2.15,TCP,60,9001  >  35978 [ACK] Seq=8144291 Ack=148705549 Win=65535 Len=0
1,5.362134999999853,62.210.85.178,10.0.2.15,TCP,60,9001  >  35978 [ACK] Seq=8144291 Ack=148705605 Win=65535 Len=0
1,5.3714679999998225,10.0.2.15,62.210.85.178,TLSv1.2,4124,Application Data
1,5.371673000000101,62.210.85.178,10.0.2.15,TCP,60,9001  >  35978 [ACK] Seq=8144291 Ack=148707065 Win=65535 Len=0
1,5.371693999999934,62.210.85.178,10.0.2.15,TCP,60,9001  >  35978 [ACK] Seq=8144291 Ack=148708525 Win=65535 Len=0
1,5.3716999999996915,62.210.85.178,10.0.2.15,TCP,60,9001  >  35978 [ACK] Seq=8144291 Ack=148709675 Win=65535 Len=0
1,5.371785999999702,10.0.2.15,62.210.85.178,TLSv1.2,3738,Application Data
1,5.37189699999999,62.210.85.178,10.0.2.15,TCP,60,9001  >  35978 [ACK] Seq=8144291 Ack=148711135 Win=65535 Len=0
1,5.371906999999737,62.210.85.178,10.0.2.15,TCP,60,9001  >  35978 [ACK] Seq=8144291 Ack=148712595 Win=65535 Len=0
1,5.371910999999727,62.210.85.178,10.0.2.15,TCP,60,9001  >  35978 [ACK] Seq=8144291 Ack=148713359 Win=65535 Len=0
1,5.45943699999998,54.93.77.70,10.0.2.15,TLSv1.2,3674,Application Data
1,5.459645999999793,10.0.2.15,54.93.77.70,TCP,54,34692  >  9001 [ACK] Seq=8175729 Ack=148530027 Win=65535 Len=0
1,5.476843999999801,54.93.77.70,10.0.2.15,TLSv1.2,590,Application Data
1,5.493429999999989,54.93.77.70,10.0.2.15,TCP,2950,"9001  >  34692 [PSH, ACK] Seq=148530563 Ack=8175729 Win=65535 Len=2896 [TCP segment of a reassembled PDU]"
1,5.493524999999863,10.0.2.15,54.93.77.70,TCP,54,34692  >  9001 [ACK] Seq=8175729 Ack=148533459 Win=65535 Len=0
1,5.501134000000093,54.93.77.70,10.0.2.15,TLSv1.2,2950,Application Data [TCP segment of a reassembled PDU]
1,5.501186999999845,54.93.77.70,10.0.2.15,TLSv1.2,5846,Application Data [TCP segment of a reassembled PDU]
1,5.5012799999999515,10.0.2.15,54.93.77.70,TCP,54,34692  >  9001 [ACK] Seq=8175729 Ack=148536355 Win=65535 Len=0
1,5.50144599999976,10.0.2.15,54.93.77.70,TCP,54,34692  >  9001 [ACK] Seq=8175729 Ack=148542147 Win=65535 Len=0
1,5.5142000000000735,54.93.77.70,10.0.2.15,TLSv1.2,380,"Application Data, Application Data"
1,5.558132000000114,10.0.2.15,54.93.77.70,TCP,54,34692  >  9001 [ACK] Seq=8175729 Ack=148542473 Win=65535 Len=0
1,5.582821999999851,54.93.77.70,10.0.2.15,TCP,2950,"9001  >  34692 [PSH, ACK] Seq=148542473 Ack=8175729 Win=65535 Len=2896 [TCP segment of a reassembled PDU]"
1,5.583188000000064,10.0.2.15,54.93.77.70,TCP,54,34692  >  9001 [ACK] Seq=8175729 Ack=148545369 Win=65535 Len=0
1,5.603419999999915,54.93.77.70,10.0.2.15,TLSv1.2,778,Application Data
1,5.603614000000107,10.0.2.15,54.93.77.70,TCP,54,34692  >  9001 [ACK] Seq=8175729 Ack=148546093 Win=65535 Len=0
1,5.607089000000087,54.93.77.70,10.0.2.15,TCP,1502,"9001  >  34692 [PSH, ACK] Seq=148546093 Ack=8175729 Win=65535 Len=1448 [TCP segment of a reassembled PDU]"
1,5.6072079999999005,10.0.2.15,54.93.77.70,TCP,54,34692  >  9001 [ACK] Seq=8175729 Ack=148547541 Win=65535 Len=0
1,5.609762000000046,54.93.77.70,10.0.2.15,TLSv1.2,2950,Application Data [TCP segment of a reassembled PDU]
1,5.609908999999789,10.0.2.15,54.93.77.70,TCP,54,34692  >  9001 [ACK] Seq=8175729 Ack=148550437 Win=65535 Len=0
1,5.611675000000105,54.93.77.70,10.0.2.15,TLSv1.2,5846,Application Data [TCP segment of a reassembled PDU]
1,5.611769999999979,10.0.2.15,54.93.77.70,TCP,54,34692  >  9001 [ACK] Seq=8175729 Ack=148556229 Win=65535 Len=0
1,5.6120969999997214,10.0.2.15,54.93.77.70,TLSv1.2,590,Application Data
1,5.612213999999767,54.93.77.70,10.0.2.15,TCP,60,9001  >  34692 [ACK] Seq=148556229 Ack=8176265 Win=65535 Len=0
1,5.632454999999936,54.93.77.70,10.0.2.15,TLSv1.2,1292,Application Data
1,5.674199999999928,10.0.2.15,54.93.77.70,TCP,54,34692  >  9001 [ACK] Seq=8176265 Ack=148557467 Win=65535 Len=0
1,5.693794999999682,54.93.77.70,10.0.2.15,TLSv1.2,4724,"Application Data, Application Data"
1,5.693898999999874,10.0.2.15,54.93.77.70,TCP,54,34692  >  9001 [ACK] Seq=8176265 Ack=148562137 Win=65535 Len=0
1,5.702508999999736,10.0.2.15,54.93.77.70,TLSv1.2,590,Application Data
1,5.702845999999681,54.93.77.70,10.0.2.15,TCP,60,9001  >  34692 [ACK] Seq=148562137 Ack=8176801 Win=65535 Len=0
1,5.796213999999964,62.210.85.178,10.0.2.15,TLSv1.2,590,Application Data
1,5.838163999999779,10.0.2.15,62.210.85.178,TCP,54,35978  >  9001 [ACK] Seq=148713359 Ack=8144827 Win=65535 Len=0
1,5.855074000000059,62.210.85.178,10.0.2.15,TLSv1.2,590,Application Data
1,5.855176000000029,10.0.2.15,62.210.85.178,TCP,54,35978  >  9001 [ACK] Seq=148713359 Ack=8145363 Win=65535 Len=0
1,5.855794999999944,10.0.2.15,62.210.85.178,TLSv1.2,590,Application Data
1,5.855958999999984,62.210.85.178,10.0.2.15,TCP,60,9001  >  35978 [ACK] Seq=8145363 Ack=148713895 Win=65535 Len=0
1,6.04877899999974,54.93.77.70,10.0.2.15,TLSv1.2,590,Application Data
1,6.049747000000025,10.0.2.15,54.93.77.70,TLSv1.2,590,Application Data
1,6.0501429999999345,54.93.77.70,10.0.2.15,TCP,60,9001  >  34692 [ACK] Seq=148562673 Ack=8177337 Win=65535 Len=0
1,6.254286999999749,62.210.85.178,10.0.2.15,TLSv1.2,590,Application Data
1,6.259334999999737,10.0.2.15,62.210.85.178,TLSv1.2,590,Application Data
1,6.259787999999844,62.210.85.178,10.0.2.15,TCP,60,9001  >  35978 [ACK] Seq=8145899 Ack=148714431 Win=65535 Len=0
1,6.271279999999933,10.0.2.15,62.210.85.178,TLSv1.2,4124,Application Data
1,6.271486999999979,62.210.85.178,10.0.2.15,TCP,60,9001  >  35978 [ACK] Seq=8145899 Ack=148715891 Win=65535 Len=0
1,6.271514000000025,62.210.85.178,10.0.2.15,TCP,60,9001  >  35978 [ACK] Seq=8145899 Ack=148717351 Win=65535 Len=0
1,6.271519999999782,62.210.85.178,10.0.2.15,TCP,60,9001  >  35978 [ACK] Seq=8145899 Ack=148718501 Win=65535 Len=0
1,6.271573999999873,10.0.2.15,62.210.85.178,TCP,2974,35978  >  9001 [ACK] Seq=148718501 Ack=8145899 Win=65535 Len=2920 [TCP segment of a reassembled PDU]
1,6.271651999999904,10.0.2.15,62.210.85.178,TLSv1.2,1204,Application Data
1,6.271690999999919,62.210.85.178,10.0.2.15,TCP,60,9001  >  35978 [ACK] Seq=8145899 Ack=148719961 Win=65535 Len=0
1,6.271698000000015,62.210.85.178,10.0.2.15,TCP,60,9001  >  35978 [ACK] Seq=8145899 Ack=148721421 Win=65535 Len=0
1,6.271702999999889,62.210.85.178,10.0.2.15,TCP,60,9001  >  35978 [ACK] Seq=8145899 Ack=148722571 Win=65535 Len=0
1,6.271756000000096,10.0.2.15,62.210.85.178,TLSv1.2,4124,Application Data
1,6.27182300000004,62.210.85.178,10.0.2.15,TCP,60,9001  >  35978 [ACK] Seq=8145899 Ack=148724031 Win=65535 Len=0
1,6.271829999999682,62.210.85.178,10.0.2.15,TCP,60,9001  >  35978 [ACK] Seq=8145899 Ack=148725491 Win=65535 Len=0
1,6.27183500000001,62.210.85.178,10.0.2.15,TCP,60,9001  >  35978 [ACK] Seq=8145899 Ack=148726641 Win=65535 Len=0
1,6.271882999999889,10.0.2.15,62.210.85.178,TLSv1.2,4124,Application Data
1,6.271976999999879,62.210.85.178,10.0.2.15,TCP,60,9001  >  35978 [ACK] Seq=8145899 Ack=148728101 Win=65535 Len=0
1,6.271984999999859,62.210.85.178,10.0.2.15,TCP,60,9001  >  35978 [ACK] Seq=8145899 Ack=148729561 Win=65535 Len=0
1,6.271991000000071,62.210.85.178,10.0.2.15,TCP,60,9001  >  35978 [ACK] Seq=8145899 Ack=148730711 Win=65535 Len=0
1,6.27203099999997,10.0.2.15,62.210.85.178,TLSv1.2,332,Application Data
1,6.272098999999798,62.210.85.178,10.0.2.15,TCP,60,9001  >  35978 [ACK] Seq=8145899 Ack=148730989 Win=65535 Len=0
1,6.272169999999733,10.0.2.15,62.210.85.178,TLSv1.2,1618,Application Data
1,6.272218000000066,62.210.85.178,10.0.2.15,TCP,60,9001  >  35978 [ACK] Seq=8145899 Ack=148732449 Win=65535 Len=0
1,6.2722249999997075,62.210.85.178,10.0.2.15,TCP,60,9001  >  35978 [ACK] Seq=8145899 Ack=148732553 Win=65535 Len=0
1,6.458370999999715,54.93.77.70,10.0.2.15,TCP,2950,"9001  >  34692 [PSH, ACK] Seq=148562673 Ack=8177337 Win=65535 Len=2896 [TCP segment of a reassembled PDU]"
1,6.458575999999994,10.0.2.15,54.93.77.70,TCP,54,34692  >  9001 [ACK] Seq=8177337 Ack=148565569 Win=65535 Len=0
1,6.461283000000094,54.93.77.70,10.0.2.15,TLSv1.2,778,Application Data
1,6.461640999999872,10.0.2.15,54.93.77.70,TLSv1.2,590,Application Data
1,6.4627009999999245,54.93.77.70,10.0.2.15,TCP,60,9001  >  34692 [ACK] Seq=148566293 Ack=8177873 Win=65535 Len=0
1,6.464810999999827,54.93.77.70,10.0.2.15,TCP,2950,"9001  >  34692 [PSH, ACK] Seq=148566293 Ack=8177873 Win=65535 Len=2896 [TCP segment of a reassembled PDU]"
1,6.464848999999958,54.93.77.70,10.0.2.15,TLSv1.2,4398,Application Data [TCP segment of a reassembled PDU]
1,6.464963999999782,10.0.2.15,54.93.77.70,TCP,54,34692  >  9001 [ACK] Seq=8177873 Ack=148573533 Win=65535 Len=0
1,6.479479000000083,54.93.77.70,10.0.2.15,TLSv1.2,568,Application Data
1,6.486088999999993,54.93.77.70,10.0.2.15,TCP,1502,"9001  >  34692 [PSH, ACK] Seq=148574047 Ack=8177873 Win=65535 Len=1448 [TCP segment of a reassembled PDU]"
1,6.4862450000000536,10.0.2.15,54.93.77.70,TCP,54,34692  >  9001 [ACK] Seq=8177873 Ack=148575495 Win=65535 Len=0
1,6.502265999999963,54.93.77.70,10.0.2.15,TLSv1.2,684,Application Data
1,6.546492999999828,10.0.2.15,54.93.77.70,TCP,54,34692  >  9001 [ACK] Seq=8177873 Ack=148576125 Win=65535 Len=0
1,6.5549519999999575,54.93.77.70,10.0.2.15,TCP,1502,"9001  >  34692 [PSH, ACK] Seq=148576125 Ack=8177873 Win=65535 Len=1448 [TCP segment of a reassembled PDU]"
1,6.555049999999937,10.0.2.15,54.93.77.70,TCP,54,34692  >  9001 [ACK] Seq=8177873 Ack=148577573 Win=65535 Len=0
1,6.562419999999747,54.93.77.70,10.0.2.15,TLSv1.2,1220,"Application Data, Application Data"
1,6.562543999999889,10.0.2.15,54.93.77.70,TCP,54,34692  >  9001 [ACK] Seq=8177873 Ack=148578739 Win=65535 Len=0
1,6.575645999999779,54.93.77.70,10.0.2.15,TCP,1502,"9001  >  34692 [PSH, ACK] Seq=148578739 Ack=8177873 Win=65535 Len=1448 [TCP segment of a reassembled PDU]"
1,6.57577399999991,10.0.2.15,54.93.77.70,TCP,54,34692  >  9001 [ACK] Seq=8177873 Ack=148580187 Win=65535 Len=0
1,6.579948999999942,62.210.85.178,10.0.2.15,TLSv1.2,590,Application Data
1,6.5799879999999575,54.93.77.70,10.0.2.15,TLSv1.2,1198,Application Data
1,6.580065999999988,10.0.2.15,54.93.77.70,TCP,54,34692  >  9001 [ACK] Seq=8177873 Ack=148581331 Win=65535 Len=0
1,6.582852000000003,10.0.2.15,54.93.77.70,TLSv1.2,590,Application Data
1,6.583024999999907,54.93.77.70,10.0.2.15,TCP,60,9001  >  34692 [ACK] Seq=148581331 Ack=8178409 Win=65535 Len=0
1,6.622234999999819,10.0.2.15,62.210.85.178,TCP,54,35978  >  9001 [ACK] Seq=148732553 Ack=8146435 Win=65535 Len=0
1,7.025462999999945,62.210.85.178,10.0.2.15,TLSv1.2,590,Application Data
1,7.0255919999999605,10.0.2.15,62.210.85.178,TCP,54,35978  >  9001 [ACK] Seq=148732553 Ack=8146971 Win=65535 Len=0
1,7.026025000000118,10.0.2.15,62.210.85.178,TLSv1.2,590,Application Data
1,7.026503999999932,62.210.85.178,10.0.2.15,TCP,60,9001  >  35978 [ACK] Seq=8146971 Ack=148733089 Win=65535 Len=0
1,7.482646999999815,54.93.77.70,10.0.2.15,TLSv1.2,590,Application Data
1,7.483071000000109,10.0.2.15,54.93.77.70,TLSv1.2,590,Application Data
1,7.483185999999932,54.93.77.70,10.0.2.15,TCP,60,9001  >  34692 [ACK] Seq=148581867 Ack=8178945 Win=65535 Len=0
1,7.600300000000061,62.210.85.178,10.0.2.15,TLSv1.2,590,Application Data
1,7.609649999999874,10.0.2.15,62.210.85.178,TLSv1.2,590,Application Data
1,7.610883999999714,62.210.85.178,10.0.2.15,TCP,60,9001  >  35978 [ACK] Seq=8147507 Ack=148733625 Win=65535 Len=0
1,7.620711000000028,10.0.2.15,62.210.85.178,TLSv1.2,4124,Application Data
1,7.620950999999877,62.210.85.178,10.0.2.15,TCP,60,9001  >  35978 [ACK] Seq=8147507 Ack=148735085 Win=65535 Len=0
1,7.62097999999969,62.210.85.178,10.0.2.15,TCP,60,9001  >  35978 [ACK] Seq=8147507 Ack=148736545 Win=65535 Len=0
1,7.620986999999786,62.210.85.178,10.0.2.15,TCP,60,9001  >  35978 [ACK] Seq=8147507 Ack=148737695 Win=65535 Len=0
1,7.621087999999872,10.0.2.15,62.210.85.178,TLSv1.2,4124,Application Data
1,7.62123100000008,62.210.85.178,10.0.2.15,TCP,60,9001  >  35978 [ACK] Seq=8147507 Ack=148739155 Win=65535 Len=0
1,7.621240999999827,62.210.85.178,10.0.2.15,TCP,60,9001  >  35978 [ACK] Seq=8147507 Ack=148740615 Win=65535 Len=0
1,7.621245999999701,62.210.85.178,10.0.2.15,TCP,60,9001  >  35978 [ACK] Seq=8147507 Ack=148741765 Win=65535 Len=0
1,7.621299999999792,10.0.2.15,62.210.85.178,TLSv1.2,4124,Application Data
1,7.621393999999782,62.210.85.178,10.0.2.15,TCP,60,9001  >  35978 [ACK] Seq=8147507 Ack=148743225 Win=65535 Len=0
1,7.6214030000001,62.210.85.178,10.0.2.15,TCP,60,9001  >  35978 [ACK] Seq=8147507 Ack=148744685 Win=65535 Len=0
1,7.621407999999974,62.210.85.178,10.0.2.15,TCP,60,9001  >  35978 [ACK] Seq=8147507 Ack=148745835 Win=65535 Len=0
1,7.621458000000075,10.0.2.15,62.210.85.178,TLSv1.2,4124,Application Data
1,7.621583999999984,62.210.85.178,10.0.2.15,TCP,60,9001  >  35978 [ACK] Seq=8147507 Ack=148747295 Win=65535 Len=0
1,7.621595999999954,62.210.85.178,10.0.2.15,TCP,60,9001  >  35978 [ACK] Seq=8147507 Ack=148748755 Win=65535 Len=0
1,7.621600999999828,62.210.85.178,10.0.2.15,TCP,60,9001  >  35978 [ACK] Seq=8147507 Ack=148749905 Win=65535 Len=0
1,7.621654000000035,10.0.2.15,62.210.85.178,TLSv1.2,332,Application Data
1,7.621728999999959,62.210.85.178,10.0.2.15,TCP,60,9001  >  35978 [ACK] Seq=8147507 Ack=148750183 Win=65535 Len=0
1,7.621830000000045,10.0.2.15,62.210.85.178,TLSv1.2,3868,Application Data
1,7.621933999999783,62.210.85.178,10.0.2.15,TCP,60,9001  >  35978 [ACK] Seq=8147507 Ack=148751643 Win=65535 Len=0
1,7.621943000000101,62.210.85.178,10.0.2.15,TCP,60,9001  >  35978 [ACK] Seq=8147507 Ack=148753103 Win=65535 Len=0
1,7.621947999999975,62.210.85.178,10.0.2.15,TCP,60,9001  >  35978 [ACK] Seq=8147507 Ack=148753997 Win=65535 Len=0
1,7.622014999999919,10.0.2.15,62.210.85.178,TLSv1.2,4124,Application Data
1,7.622135999999955,62.210.85.178,10.0.2.15,TCP,60,9001  >  35978 [ACK] Seq=8147507 Ack=148755457 Win=65535 Len=0
1,7.622151000000031,62.210.85.178,10.0.2.15,TCP,60,9001  >  35978 [ACK] Seq=8147507 Ack=148756917 Win=65535 Len=0
1,7.6221559999999045,62.210.85.178,10.0.2.15,TCP,60,9001  >  35978 [ACK] Seq=8147507 Ack=148758067 Win=65535 Len=0
1,7.622225000000071,10.0.2.15,62.210.85.178,TLSv1.2,3030,Application Data
1,7.622321999999713,62.210.85.178,10.0.2.15,TCP,60,9001  >  35978 [ACK] Seq=8147507 Ack=148759527 Win=65535 Len=0
1,7.6223299999996925,62.210.85.178,10.0.2.15,TCP,60,9001  >  35978 [ACK] Seq=8147507 Ack=148760987 Win=65535 Len=0
1,7.622335000000021,62.210.85.178,10.0.2.15,TCP,60,9001  >  35978 [ACK] Seq=8147507 Ack=148761043 Win=65535 Len=0
1,7.631618999999773,10.0.2.15,62.210.85.178,TLSv1.2,4124,Application Data
1,7.631754000000001,62.210.85.178,10.0.2.15,TCP,60,9001  >  35978 [ACK] Seq=8147507 Ack=148762503 Win=65535 Len=0
1,7.631769000000077,62.210.85.178,10.0.2.15,TCP,60,9001  >  35978 [ACK] Seq=8147507 Ack=148763963 Win=65535 Len=0
1,7.631774999999834,62.210.85.178,10.0.2.15,TCP,60,9001  >  35978 [ACK] Seq=8147507 Ack=148765113 Win=65535 Len=0
1,7.631836000000021,10.0.2.15,62.210.85.178,TLSv1.2,4124,Application Data
1,7.631881999999678,62.210.85.178,10.0.2.15,TCP,60,9001  >  35978 [ACK] Seq=8147507 Ack=148766573 Win=65535 Len=0
1,7.631888999999774,62.210.85.178,10.0.2.15,TCP,60,9001  >  35978 [ACK] Seq=8147507 Ack=148768033 Win=65535 Len=0
1,7.631894000000102,62.210.85.178,10.0.2.15,TCP,60,9001  >  35978 [ACK] Seq=8147507 Ack=148769183 Win=65535 Len=0
1,7.6319439999997485,10.0.2.15,62.210.85.178,TLSv1.2,4124,Application Data
1,7.632009999999809,10.0.2.15,62.210.85.178,TCP,1514,35978  >  9001 [ACK] Seq=148773253 Ack=8147507 Win=65535 Len=1460 [TCP segment of a reassembled PDU]
1,7.632056999999804,62.210.85.178,10.0.2.15,TCP,60,9001  >  35978 [ACK] Seq=8147507 Ack=148770643 Win=65535 Len=0
1,7.6320639999999,62.210.85.178,10.0.2.15,TCP,60,9001  >  35978 [ACK] Seq=8147507 Ack=148772103 Win=65535 Len=0
1,7.632068999999774,62.210.85.178,10.0.2.15,TCP,60,9001  >  35978 [ACK] Seq=8147507 Ack=148773253 Win=65535 Len=0
1,7.632074000000102,62.210.85.178,10.0.2.15,TCP,60,9001  >  35978 [ACK] Seq=8147507 Ack=148774713 Win=65535 Len=0
1,7.632113000000118,10.0.2.15,62.210.85.178,TLSv1.2,350,Application Data
1,7.632208999999875,62.210.85.178,10.0.2.15,TCP,60,9001  >  35978 [ACK] Seq=8147507 Ack=148775009 Win=65535 Len=0
1,7.717106999999942,54.93.77.70,10.0.2.15,TLSv1.2,3674,Application Data
1,7.717420999999831,10.0.2.15,54.93.77.70,TCP,54,34692  >  9001 [ACK] Seq=8178945 Ack=148585487 Win=65535 Len=0
1,7.728971999999885,54.93.77.70,10.0.2.15,TCP,2950,"9001  >  34692 [PSH, ACK] Seq=148585487 Ack=8178945 Win=65535 Len=2896 [TCP segment of a reassembled PDU]"
1,7.729250999999749,10.0.2.15,54.93.77.70,TCP,54,34692  >  9001 [ACK] Seq=8178945 Ack=148588383 Win=65535 Len=0
1,7.738432000000103,54.93.77.70,10.0.2.15,TLSv1.2,778,Application Data
1,7.750414999999975,54.93.77.70,10.0.2.15,TCP,2950,"9001  >  34692 [PSH, ACK] Seq=148589107 Ack=8178945 Win=65535 Len=2896 [TCP segment of a reassembled PDU]"
1,7.7505309999996825,10.0.2.15,54.93.77.70,TCP,54,34692  >  9001 [ACK] Seq=8178945 Ack=148592003 Win=65535 Len=0
1,7.752784999999676,54.93.77.70,10.0.2.15,TLSv1.2,8742,"Application Data, Application Data"
1,7.752968999999666,10.0.2.15,54.93.77.70,TCP,54,34692  >  9001 [ACK] Seq=8178945 Ack=148600691 Win=65535 Len=0
1,7.7569180000000415,54.93.77.70,10.0.2.15,TLSv1.2,1408,"Application Data, Application Data"
1,7.7883139999999,54.93.77.70,10.0.2.15,TCP,2950,"9001  >  34692 [PSH, ACK] Seq=148602045 Ack=8178945 Win=65535 Len=2896 [TCP segment of a reassembled PDU]"
1,7.788364999999885,54.93.77.70,10.0.2.15,TLSv1.2,9046,"Application Data, Application Data, Application Data"
1,7.788443999999799,10.0.2.15,54.93.77.70,TCP,54,34692  >  9001 [ACK] Seq=8178945 Ack=148604941 Win=65535 Len=0
1,7.788606999999956,10.0.2.15,54.93.77.70,TCP,54,34692  >  9001 [ACK] Seq=8178945 Ack=148613933 Win=65535 Len=0
1,7.789018999999826,10.0.2.15,54.93.77.70,TLSv1.2,590,Application Data
1,7.7891749999998865,54.93.77.70,10.0.2.15,TCP,60,9001  >  34692 [ACK] Seq=148613933 Ack=8179481 Win=65535 Len=0
1,7.810903000000053,54.93.77.70,10.0.2.15,TLSv1.2,1618,Application Data
1,7.811013999999886,10.0.2.15,54.93.77.70,TCP,54,34692  >  9001 [ACK] Seq=8179481 Ack=148615497 Win=65535 Len=0
1,7.87927099999979,54.93.77.70,10.0.2.15,TLSv1.2,4724,"Application Data, Application Data"
1,7.879623999999694,10.0.2.15,54.93.77.70,TCP,54,34692  >  9001 [ACK] Seq=8179481 Ack=148620167 Win=65535 Len=0
1,7.880162999999811,10.0.2.15,54.93.77.70,TLSv1.2,590,Application Data
1,7.880577999999787,54.93.77.70,10.0.2.15,TCP,60,9001  >  34692 [ACK] Seq=148620167 Ack=8180017 Win=65535 Len=0
1,7.89470399999982,54.93.77.70,10.0.2.15,TCP,2950,"9001  >  34692 [PSH, ACK] Seq=148620167 Ack=8180017 Win=65535 Len=2896 [TCP segment of a reassembled PDU]"
1,7.8948199999999815,10.0.2.15,54.93.77.70,TCP,54,34692  >  9001 [ACK] Seq=8180017 Ack=148623063 Win=65535 Len=0
1,7.902332000000115,62.210.85.178,10.0.2.15,TLSv1.2,590,Application Data
1,7.905363999999736,54.93.77.70,10.0.2.15,TLSv1.2,778,Application Data
1,7.913864000000103,10.0.2.15,54.93.77.70,TLSv1.2,590,Application Data
1,7.914119999999912,54.93.77.70,10.0.2.15,TCP,60,9001  >  34692 [ACK] Seq=148623787 Ack=8180553 Win=65535 Len=0
1,7.9461599999999635,10.0.2.15,62.210.85.178,TCP,54,35978  >  9001 [ACK] Seq=148775009 Ack=8148043 Win=65535 Len=0
1,7.99709699999994,62.210.85.178,10.0.2.15,TLSv1.2,590,Application Data
1,7.997293999999783,10.0.2.15,62.210.85.178,TCP,54,35978  >  9001 [ACK] Seq=148775009 Ack=8148579 Win=65535 Len=0
1,8.19944200000009,62.210.85.178,10.0.2.15,TLSv1.2,590,Application Data
1,8.199769999999717,10.0.2.15,62.210.85.178,TCP,54,35978  >  9001 [ACK] Seq=148775009 Ack=8149115 Win=65535 Len=0
1,8.200649999999769,10.0.2.15,62.210.85.178,TLSv1.2,590,Application Data
1,8.20124399999986,62.210.85.178,10.0.2.15,TCP,60,9001  >  35978 [ACK] Seq=8149115 Ack=148775545 Win=65535 Len=0
1,8.833321999999953,54.93.77.70,10.0.2.15,TLSv1.2,590,Application Data
1,8.833814000000075,10.0.2.15,54.93.77.70,TLSv1.2,590,Application Data
1,8.833983999999873,54.93.77.70,10.0.2.15,TCP,60,9001  >  34692 [ACK] Seq=148624323 Ack=8181089 Win=65535 Len=0
1,8.953560999999809,62.210.85.178,10.0.2.15,TLSv1.2,590,Application Data
1,8.964927999999873,10.0.2.15,62.210.85.178,TLSv1.2,590,Application Data
1,8.965392999999949,62.210.85.178,10.0.2.15,TCP,60,9001  >  35978 [ACK] Seq=8149651 Ack=148776081 Win=65535 Len=0
1,8.980810999999903,10.0.2.15,62.210.85.178,TLSv1.2,4124,Application Data
1,8.981202999999823,62.210.85.178,10.0.2.15,TCP,60,9001  >  35978 [ACK] Seq=8149651 Ack=148777541 Win=65535 Len=0
1,8.98124400000006,62.210.85.178,10.0.2.15,TCP,60,9001  >  35978 [ACK] Seq=8149651 Ack=148779001 Win=65535 Len=0
1,8.981249999999818,62.210.85.178,10.0.2.15,TCP,60,9001  >  35978 [ACK] Seq=8149651 Ack=148780151 Win=65535 Len=0
1,8.981327999999849,10.0.2.15,62.210.85.178,TLSv1.2,4124,Application Data
1,8.981437999999798,62.210.85.178,10.0.2.15,TCP,60,9001  >  35978 [ACK] Seq=8149651 Ack=148781611 Win=65535 Len=0
1,8.98145199999999,62.210.85.178,10.0.2.15,TCP,60,9001  >  35978 [ACK] Seq=8149651 Ack=148783071 Win=65535 Len=0
1,8.981457999999748,62.210.85.178,10.0.2.15,TCP,60,9001  >  35978 [ACK] Seq=8149651 Ack=148784221 Win=65535 Len=0
1,8.981573000000026,10.0.2.15,62.210.85.178,TLSv1.2,4124,Application Data
1,8.981643000000076,62.210.85.178,10.0.2.15,TCP,60,9001  >  35978 [ACK] Seq=8149651 Ack=148785681 Win=65535 Len=0
1,8.981655000000046,62.210.85.178,10.0.2.15,TCP,60,9001  >  35978 [ACK] Seq=8149651 Ack=148787141 Win=65535 Len=0
1,8.981660999999804,62.210.85.178,10.0.2.15,TCP,60,9001  >  35978 [ACK] Seq=8149651 Ack=148788291 Win=65535 Len=0
1,8.981746999999814,10.0.2.15,62.210.85.178,TLSv1.2,4124,Application Data
1,8.982024999999794,62.210.85.178,10.0.2.15,TCP,60,9001  >  35978 [ACK] Seq=8149651 Ack=148789751 Win=65535 Len=0
1,8.982062999999926,62.210.85.178,10.0.2.15,TCP,60,9001  >  35978 [ACK] Seq=8149651 Ack=148791211 Win=65535 Len=0
1,8.982068999999683,62.210.85.178,10.0.2.15,TCP,60,9001  >  35978 [ACK] Seq=8149651 Ack=148792361 Win=65535 Len=0
1,8.98223199999984,10.0.2.15,62.210.85.178,TLSv1.2,332,Application Data
1,8.98244399999976,62.210.85.178,10.0.2.15,TCP,60,9001  >  35978 [ACK] Seq=8149651 Ack=148792639 Win=65535 Len=0
1,8.982692000000043,10.0.2.15,62.210.85.178,TLSv1.2,3868,Application Data
1,8.983005999999932,62.210.85.178,10.0.2.15,TCP,60,9001  >  35978 [ACK] Seq=8149651 Ack=148794099 Win=65535 Len=0
1,8.983044999999947,62.210.85.178,10.0.2.15,TCP,60,9001  >  35978 [ACK] Seq=8149651 Ack=148795559 Win=65535 Len=0
1,8.983052000000043,62.210.85.178,10.0.2.15,TCP,60,9001  >  35978 [ACK] Seq=8149651 Ack=148796453 Win=65535 Len=0
1,8.983173999999963,10.0.2.15,62.210.85.178,TLSv1.2,4124,Application Data
1,8.983256999999867,62.210.85.178,10.0.2.15,TCP,60,9001  >  35978 [ACK] Seq=8149651 Ack=148797913 Win=65535 Len=0
1,8.98326599999973,62.210.85.178,10.0.2.15,TCP,60,9001  >  35978 [ACK] Seq=8149651 Ack=148799373 Win=65535 Len=0
1,8.983271000000059,62.210.85.178,10.0.2.15,TCP,60,9001  >  35978 [ACK] Seq=8149651 Ack=148800523 Win=65535 Len=0
1,8.983319999999821,10.0.2.15,62.210.85.178,TLSv1.2,3030,Application Data
1,8.983362999999827,62.210.85.178,10.0.2.15,TCP,60,9001  >  35978 [ACK] Seq=8149651 Ack=148801983 Win=65535 Len=0
1,8.983369999999923,62.210.85.178,10.0.2.15,TCP,60,9001  >  35978 [ACK] Seq=8149651 Ack=148803443 Win=65535 Len=0
1,8.983374999999796,62.210.85.178,10.0.2.15,TCP,60,9001  >  35978 [ACK] Seq=8149651 Ack=148803499 Win=65535 Len=0
1,8.99269699999968,10.0.2.15,62.210.85.178,TLSv1.2,4124,Application Data
1,8.992878000000019,62.210.85.178,10.0.2.15,TCP,60,9001  >  35978 [ACK] Seq=8149651 Ack=148804959 Win=65535 Len=0
1,8.992897000000085,62.210.85.178,10.0.2.15,TCP,60,9001  >  35978 [ACK] Seq=8149651 Ack=148806419 Win=65535 Len=0
1,8.992901999999958,62.210.85.178,10.0.2.15,TCP,60,9001  >  35978 [ACK] Seq=8149651 Ack=148807569 Win=65535 Len=0
1,8.992953999999827,10.0.2.15,62.210.85.178,TLSv1.2,4124,Application Data
1,8.993026999999984,62.210.85.178,10.0.2.15,TCP,60,9001  >  35978 [ACK] Seq=8149651 Ack=148809029 Win=65535 Len=0
1,8.993035999999847,62.210.85.178,10.0.2.15,TCP,60,9001  >  35978 [ACK] Seq=8149651 Ack=148810489 Win=65535 Len=0
1,8.993040999999721,62.210.85.178,10.0.2.15,TCP,60,9001  >  35978 [ACK] Seq=8149651 Ack=148811639 Win=65535 Len=0
1,8.993086999999832,10.0.2.15,62.210.85.178,TLSv1.2,4124,Application Data
1,8.993129999999837,62.210.85.178,10.0.2.15,TCP,60,9001  >  35978 [ACK] Seq=8149651 Ack=148813099 Win=65535 Len=0
1,8.993136999999933,62.210.85.178,10.0.2.15,TCP,60,9001  >  35978 [ACK] Seq=8149651 Ack=148814559 Win=65535 Len=0
1,8.993141999999807,62.210.85.178,10.0.2.15,TCP,60,9001  >  35978 [ACK] Seq=8149651 Ack=148815709 Win=65535 Len=0
1,8.993191999999908,10.0.2.15,62.210.85.178,TLSv1.2,4124,Application Data
1,8.993261999999959,62.210.85.178,10.0.2.15,TCP,60,9001  >  35978 [ACK] Seq=8149651 Ack=148817169 Win=65535 Len=0
1,8.993269000000055,62.210.85.178,10.0.2.15,TCP,60,9001  >  35978 [ACK] Seq=8149651 Ack=148818629 Win=65535 Len=0
1,8.993273999999928,62.210.85.178,10.0.2.15,TCP,60,9001  >  35978 [ACK] Seq=8149651 Ack=148819779 Win=65535 Len=0
1,8.993318999999701,10.0.2.15,62.210.85.178,TLSv1.2,332,Application Data
1,8.993360999999823,62.210.85.178,10.0.2.15,TCP,60,9001  >  35978 [ACK] Seq=8149651 Ack=148820057 Win=65535 Len=0
1,8.99343399999998,10.0.2.15,62.210.85.178,TLSv1.2,1618,Application Data
1,8.9934760000001,62.210.85.178,10.0.2.15,TCP,60,9001  >  35978 [ACK] Seq=8149651 Ack=148821517 Win=65535 Len=0
1,8.993482999999742,62.210.85.178,10.0.2.15,TCP,60,9001  >  35978 [ACK] Seq=8149651 Ack=148821621 Win=65535 Len=0
1,9.059472999999798,54.93.77.70,10.0.2.15,TLSv1.2,590,Application Data
1,9.085211000000072,54.93.77.70,10.0.2.15,TCP,2950,"9001  >  34692 [PSH, ACK] Seq=148624859 Ack=8181089 Win=65535 Len=2896 [TCP segment of a reassembled PDU]"
1,9.08547099999987,10.0.2.15,54.93.77.70,TCP,54,34692  >  9001 [ACK] Seq=8181089 Ack=148627755 Win=65535 Len=0
1,9.103142999999818,54.93.77.70,10.0.2.15,TLSv1.2,3674,Application Data [TCP segment of a reassembled PDU]
1,9.10332100000005,10.0.2.15,54.93.77.70,TCP,54,34692  >  9001 [ACK] Seq=8181089 Ack=148631375 Win=65535 Len=0
1,9.112870999999814,54.93.77.70,10.0.2.15,TLSv1.2,7294,"Application Data, Application Data"
1,9.11304599999994,10.0.2.15,54.93.77.70,TCP,54,34692  >  9001 [ACK] Seq=8181089 Ack=148638615 Win=65535 Len=0
1,9.121071999999913,54.93.77.70,10.0.2.15,TLSv1.2,2950,Application Data [TCP segment of a reassembled PDU]
1,9.121161999999913,10.0.2.15,54.93.77.70,TCP,54,34692  >  9001 [ACK] Seq=8181089 Ack=148641511 Win=65535 Len=0
1,9.123168000000078,54.93.77.70,10.0.2.15,TLSv1.2,2552,"Application Data, Application Data"
1,9.123255999999856,10.0.2.15,54.93.77.70,TCP,54,34692  >  9001 [ACK] Seq=8181089 Ack=148644009 Win=65535 Len=0
1,9.146146999999928,54.93.77.70,10.0.2.15,TLSv1.2,5846,Application Data
1,9.146276999999827,54.93.77.70,10.0.2.15,TLSv1.2,3580,"Application Data, Application Data"
1,9.146612999999888,10.0.2.15,54.93.77.70,TCP,54,34692  >  9001 [ACK] Seq=8181089 Ack=148653327 Win=65535 Len=0
1,9.148037999999815,10.0.2.15,54.93.77.70,TLSv1.2,590,Application Data
1,9.14839099999972,54.93.77.70,10.0.2.15,TCP,60,9001  >  34692 [ACK] Seq=148653327 Ack=8181625 Win=65535 Len=0
1,9.206988999999794,54.93.77.70,10.0.2.15,TCP,2950,"9001  >  34692 [PSH, ACK] Seq=148653327 Ack=8181625 Win=65535 Len=2896 [TCP segment of a reassembled PDU]"
1,9.207032999999683,54.93.77.70,10.0.2.15,TLSv1.2,9046,"Application Data, Application Data, Application Data"
1,9.20712599999979,10.0.2.15,54.93.77.70,TCP,54,34692  >  9001 [ACK] Seq=8181625 Ack=148656223 Win=65535 Len=0
1,9.207242999999835,10.0.2.15,54.93.77.70,TCP,54,34692  >  9001 [ACK] Seq=8181625 Ack=148665215 Win=65535 Len=0
1,9.225610999999844,54.93.77.70,10.0.2.15,TCP,1502,"9001  >  34692 [PSH, ACK] Seq=148665215 Ack=8181625 Win=65535 Len=1448 [TCP segment of a reassembled PDU]"
1,9.225748999999723,10.0.2.15,54.93.77.70,TCP,54,34692  >  9001 [ACK] Seq=8181625 Ack=148666663 Win=65535 Len=0
1,9.22903499999984,54.93.77.70,10.0.2.15,TLSv1.2,684,Application Data
1,9.271459999999934,10.0.2.15,54.93.77.70,TCP,54,34692  >  9001 [ACK] Seq=8181625 Ack=148667293 Win=65535 Len=0
1,9.276155000000017,54.93.77.70,10.0.2.15,TLSv1.2,2068,Application Data
1,9.276272000000063,10.0.2.15,54.93.77.70,TCP,54,34692  >  9001 [ACK] Seq=8181625 Ack=148669307 Win=65535 Len=0
1,9.276573000000099,10.0.2.15,54.93.77.70,TLSv1.2,590,Application Data
1,9.276671999999962,54.93.77.70,10.0.2.15,TCP,60,9001  >  34692 [ACK] Seq=148669307 Ack=8182161 Win=65535 Len=0
1,9.294867000000067,54.93.77.70,10.0.2.15,TLSv1.2,1168,Application Data
1,9.29758099999981,10.0.2.15,54.93.77.70,TLSv1.2,590,Application Data
1,9.297778000000108,54.93.77.70,10.0.2.15,TCP,60,9001  >  34692 [ACK] Seq=148670421 Ack=8182697 Win=65535 Len=0
1,9.359148000000005,62.210.85.178,10.0.2.15,TLSv1.2,590,Application Data
1,9.402937999999722,10.0.2.15,62.210.85.178,TCP,54,35978  >  9001 [ACK] Seq=148821621 Ack=8150187 Win=65535 Len=0
1,9.530354999999872,62.210.85.178,10.0.2.15,TLSv1.2,1104,Application Data
1,9.530547999999726,10.0.2.15,62.210.85.178,TCP,54,35978  >  9001 [ACK] Seq=148821621 Ack=8151237 Win=65535 Len=0
1,9.531075999999757,10.0.2.15,62.210.85.178,TLSv1.2,590,Application Data
1,9.531183000000055,62.210.85.178,10.0.2.15,TCP,60,9001  >  35978 [ACK] Seq=8151237 Ack=148822157 Win=65535 Len=0
1,9.635197000000062,54.93.77.70,10.0.2.15,TLSv1.2,590,Application Data
1,9.635886000000028,10.0.2.15,54.93.77.70,TLSv1.2,590,Application Data
1,9.636181999999735,54.93.77.70,10.0.2.15,TCP,60,9001  >  34692 [ACK] Seq=148670957 Ack=8183233 Win=65535 Len=0
1,9.739047999999912,62.210.85.178,10.0.2.15,TLSv1.2,590,Application Data
1,9.746190999999726,10.0.2.15,62.210.85.178,TLSv1.2,590,Application Data
1,9.746368999999959,62.210.85.178,10.0.2.15,TCP,60,9001  >  35978 [ACK] Seq=8151773 Ack=148822693 Win=65535 Len=0
1,9.758710000000065,10.0.2.15,62.210.85.178,TLSv1.2,4124,Application Data
1,9.759039999999914,10.0.2.15,62.210.85.178,TCP,2974,35978  >  9001 [ACK] Seq=148826763 Ack=8151773 Win=65535 Len=2920 [TCP segment of a reassembled PDU]
1,9.75915699999996,62.210.85.178,10.0.2.15,TCP,60,9001  >  35978 [ACK] Seq=8151773 Ack=148824153 Win=65535 Len=0
1,9.759176999999909,62.210.85.178,10.0.2.15,TCP,60,9001  >  35978 [ACK] Seq=8151773 Ack=148825613 Win=65535 Len=0
1,9.759182999999666,62.210.85.178,10.0.2.15,TCP,60,9001  >  35978 [ACK] Seq=8151773 Ack=148826763 Win=65535 Len=0
1,9.75918700000011,62.210.85.178,10.0.2.15,TCP,60,9001  >  35978 [ACK] Seq=8151773 Ack=148828223 Win=65535 Len=0
1,9.759191999999985,62.210.85.178,10.0.2.15,TCP,60,9001  >  35978 [ACK] Seq=8151773 Ack=148829683 Win=65535 Len=0
1,9.759251999999833,10.0.2.15,62.210.85.178,TLSv1.2,1204,Application Data
1,9.759371999999985,10.0.2.15,62.210.85.178,TCP,2974,35978  >  9001 [ACK] Seq=148830833 Ack=8151773 Win=65535 Len=2920 [TCP segment of a reassembled PDU]
1,9.759459999999763,62.210.85.178,10.0.2.15,TCP,60,9001  >  35978 [ACK] Seq=8151773 Ack=148830833 Win=65535 Len=0
1,9.759469999999965,62.210.85.178,10.0.2.15,TCP,60,9001  >  35978 [ACK] Seq=8151773 Ack=148832293 Win=65535 Len=0
1,9.759473000000071,62.210.85.178,10.0.2.15,TCP,60,9001  >  35978 [ACK] Seq=8151773 Ack=148833753 Win=65535 Len=0
1,9.75950499999999,10.0.2.15,62.210.85.178,TLSv1.2,1204,Application Data
1,9.759544000000005,62.210.85.178,10.0.2.15,TCP,60,9001  >  35978 [ACK] Seq=8151773 Ack=148834903 Win=65535 Len=0
1,9.759595999999874,10.0.2.15,62.210.85.178,TLSv1.2,4124,Application Data
1,9.759698999999728,62.210.85.178,10.0.2.15,TCP,60,9001  >  35978 [ACK] Seq=8151773 Ack=148836363 Win=65535 Len=0
1,9.759710999999697,62.210.85.178,10.0.2.15,TCP,60,9001  >  35978 [ACK] Seq=8151773 Ack=148837823 Win=65535 Len=0
1,9.759713999999803,62.210.85.178,10.0.2.15,TCP,60,9001  >  35978 [ACK] Seq=8151773 Ack=148838973 Win=65535 Len=0
1,9.759748999999829,10.0.2.15,62.210.85.178,TLSv1.2,332,Application Data
1,9.759788999999728,62.210.85.178,10.0.2.15,TCP,60,9001  >  35978 [ACK] Seq=8151773 Ack=148839251 Win=65535 Len=0
1,9.759849000000031,10.0.2.15,62.210.85.178,TLSv1.2,3868,Application Data
1,9.759923999999955,62.210.85.178,10.0.2.15,TCP,60,9001  >  35978 [ACK] Seq=8151773 Ack=148840711 Win=65535 Len=0
1,9.759931000000051,62.210.85.178,10.0.2.15,TCP,60,9001  >  35978 [ACK] Seq=8151773 Ack=148842171 Win=65535 Len=0
1,9.759935000000041,62.210.85.178,10.0.2.15,TCP,60,9001  >  35978 [ACK] Seq=8151773 Ack=148843065 Win=65535 Len=0
1,9.759974000000057,10.0.2.15,62.210.85.178,TLSv1.2,4124,Application Data
1,9.760035999999673,62.210.85.178,10.0.2.15,TCP,60,9001  >  35978 [ACK] Seq=8151773 Ack=148844525 Win=65535 Len=0
1,9.760044000000107,62.210.85.178,10.0.2.15,TCP,60,9001  >  35978 [ACK] Seq=8151773 Ack=148845985 Win=65535 Len=0
1,9.760048000000097,62.210.85.178,10.0.2.15,TCP,60,9001  >  35978 [ACK] Seq=8151773 Ack=148847135 Win=65535 Len=0
1,9.760107999999946,10.0.2.15,62.210.85.178,TLSv1.2,3030,Application Data
1,9.760422999999719,62.210.85.178,10.0.2.15,TCP,60,9001  >  35978 [ACK] Seq=8151773 Ack=148848595 Win=65535 Len=0
1,9.760438999999678,62.210.85.178,10.0.2.15,TCP,60,9001  >  35978 [ACK] Seq=8151773 Ack=148850055 Win=65535 Len=0
1,9.760442999999668,62.210.85.178,10.0.2.15,TCP,60,9001  >  35978 [ACK] Seq=8151773 Ack=148850111 Win=65535 Len=0
1,9.769463000000087,10.0.2.15,62.210.85.178,TLSv1.2,4124,Application Data
1,9.769616999999926,62.210.85.178,10.0.2.15,TCP,60,9001  >  35978 [ACK] Seq=8151773 Ack=148851571 Win=65535 Len=0
1,9.769633999999769,62.210.85.178,10.0.2.15,TCP,60,9001  >  35978 [ACK] Seq=8151773 Ack=148853031 Win=65535 Len=0
1,9.769637999999759,62.210.85.178,10.0.2.15,TCP,60,9001  >  35978 [ACK] Seq=8151773 Ack=148854181 Win=65535 Len=0
1,9.76969999999983,10.0.2.15,62.210.85.178,TLSv1.2,4124,Application Data
1,9.769786999999724,62.210.85.178,10.0.2.15,TCP,60,9001  >  35978 [ACK] Seq=8151773 Ack=148855641 Win=65535 Len=0
1,9.769794999999704,62.210.85.178,10.0.2.15,TCP,60,9001  >  35978 [ACK] Seq=8151773 Ack=148857101 Win=65535 Len=0
1,9.76979799999981,62.210.85.178,10.0.2.15,TCP,60,9001  >  35978 [ACK] Seq=8151773 Ack=148858251 Win=65535 Len=0
1,9.769843000000037,10.0.2.15,62.210.85.178,TLSv1.2,4124,Application Data
1,9.769905999999992,62.210.85.178,10.0.2.15,TCP,60,9001  >  35978 [ACK] Seq=8151773 Ack=148859711 Win=65535 Len=0
1,9.769914999999855,62.210.85.178,10.0.2.15,TCP,60,9001  >  35978 [ACK] Seq=8151773 Ack=148861171 Win=65535 Len=0
1,9.769918999999845,62.210.85.178,10.0.2.15,TCP,60,9001  >  35978 [ACK] Seq=8151773 Ack=148862321 Win=65535 Len=0
1,9.769982999999684,10.0.2.15,62.210.85.178,TLSv1.2,2324,Application Data
1,9.770328999999947,62.210.85.178,10.0.2.15,TCP,60,9001  >  35978 [ACK] Seq=8151773 Ack=148863781 Win=65535 Len=0
1,9.770387000000028,62.210.85.178,10.0.2.15,TCP,60,9001  >  35978 [ACK] Seq=8151773 Ack=148864591 Win=65535 Len=0
1,9.941078999999718,54.93.77.70,10.0.2.15,TLSv1.2,2132,Application Data
1,9.941238999999769,10.0.2.15,54.93.77.70,TCP,54,34692  >  9001 [ACK] Seq=8183233 Ack=148673035 Win=65535 Len=0
1,9.94446599999992,54.93.77.70,10.0.2.15,TLSv1.2,2950,Application Data
1,9.944508999999925,54.93.77.70,10.0.2.15,TLSv1.2,5846,Application Data [TCP segment of a reassembled PDU]
1,9.944568999999774,10.0.2.15,54.93.77.70,TCP,54,34692  >  9001 [ACK] Seq=8183233 Ack=148675931 Win=65535 Len=0
1,9.944696999999906,10.0.2.15,54.93.77.70,TCP,54,34692  >  9001 [ACK] Seq=8183233 Ack=148681723 Win=65535 Len=0
1,9.960990999999922,54.93.77.70,10.0.2.15,TLSv1.2,1198,Application Data
1,9.983451999999943,54.93.77.70,10.0.2.15,TCP,2950,"9001  >  34692 [PSH, ACK] Seq=148682867 Ack=8183233 Win=65535 Len=2896 [TCP segment of a reassembled PDU]"
1,9.983502000000044,54.93.77.70,10.0.2.15,TLSv1.2,10190,"Application Data, Application Data, Application Data"
1,9.983577999999852,10.0.2.15,54.93.77.70,TCP,54,34692  >  9001 [ACK] Seq=8183233 Ack=148685763 Win=65535 Len=0
1,9.983729999999923,10.0.2.15,54.93.77.70,TCP,54,34692  >  9001 [ACK] Seq=8183233 Ack=148695899 Win=65535 Len=0
1,10.000230000000101,54.93.77.70,10.0.2.15,TLSv1.2,4116,"Application Data, Application Data, Application Data"
1,10.000500999999986,10.0.2.15,54.93.77.70,TCP,54,34692  >  9001 [ACK] Seq=8183233 Ack=148699961 Win=65535 Len=0
1,10.001068999999916,10.0.2.15,54.93.77.70,TLSv1.2,590,Application Data
1,10.001228999999967,54.93.77.70,10.0.2.15,TCP,60,9001  >  34692 [ACK] Seq=148699961 Ack=8183769 Win=65535 Len=0
1,10.088954999999714,54.93.77.70,10.0.2.15,TCP,2950,"9001  >  34692 [PSH, ACK] Seq=148699961 Ack=8183769 Win=65535 Len=2896 [TCP segment of a reassembled PDU]"
1,10.089019999999891,54.93.77.70,10.0.2.15,TLSv1.2,8742,"Application Data, Application Data"
1,10.089116999999987,10.0.2.15,54.93.77.70,TCP,54,34692  >  9001 [ACK] Seq=8183769 Ack=148702857 Win=65535 Len=0
1,10.089253000000099,10.0.2.15,54.93.77.70,TCP,54,34692  >  9001 [ACK] Seq=8183769 Ack=148711545 Win=65535 Len=0
1,10.08981999999969,54.93.77.70,10.0.2.15,TLSv1.2,1922,"Application Data, Application Data"
1,10.089879999999994,10.0.2.15,54.93.77.70,TCP,54,34692  >  9001 [ACK] Seq=8183769 Ack=148713413 Win=65535 Len=0
1,10.092654999999922,10.0.2.15,54.93.77.70,TLSv1.2,590,Application Data
1,10.09307600000011,54.93.77.70,10.0.2.15,TCP,60,9001  >  34692 [ACK] Seq=148713413 Ack=8184305 Win=65535 Len=0
1,10.099680999999691,62.210.85.178,10.0.2.15,TLSv1.2,590,Application Data
1,10.142448999999942,10.0.2.15,62.210.85.178,TCP,54,35978  >  9001 [ACK] Seq=148864591 Ack=8152309 Win=65535 Len=0
1,10.433388999999806,62.210.85.178,10.0.2.15,TLSv1.2,590,Application Data
1,10.433478999999807,10.0.2.15,62.210.85.178,TCP,54,35978  >  9001 [ACK] Seq=148864591 Ack=8152845 Win=65535 Len=0
1,10.434135999999853,10.0.2.15,62.210.85.178,TLSv1.2,590,Application Data
1,10.434545000000071,62.210.85.178,10.0.2.15,TCP,60,9001  >  35978 [ACK] Seq=8152845 Ack=148865127 Win=65535 Len=0
1,10.656635999999708,54.93.77.70,10.0.2.15,TLSv1.2,590,Application Data
1,10.65729999999985,10.0.2.15,54.93.77.70,TLSv1.2,590,Application Data
1,10.657650000000103,54.93.77.70,10.0.2.15,TCP,60,9001  >  34692 [ACK] Seq=148713949 Ack=8184841 Win=65535 Len=0
1,10.773909000000003,62.210.85.178,10.0.2.15,TLSv1.2,590,Application Data
1,10.785938999999871,10.0.2.15,62.210.85.178,TLSv1.2,590,Application Data
1,10.786250999999993,62.210.85.178,10.0.2.15,TCP,60,9001  >  35978 [ACK] Seq=8153381 Ack=148865663 Win=65535 Len=0
1,10.799869999999828,10.0.2.15,62.210.85.178,TLSv1.2,4124,Application Data
1,10.80027199999995,10.0.2.15,62.210.85.178,TCP,2974,35978  >  9001 [ACK] Seq=148869733 Ack=8153381 Win=65535 Len=2920 [TCP segment of a reassembled PDU]
1,10.800404000000071,62.210.85.178,10.0.2.15,TCP,60,9001  >  35978 [ACK] Seq=8153381 Ack=148867123 Win=65535 Len=0
1,10.800476999999773,62.210.85.178,10.0.2.15,TCP,60,9001  >  35978 [ACK] Seq=8153381 Ack=148868583 Win=65535 Len=0
1,10.800484999999753,62.210.85.178,10.0.2.15,TCP,60,9001  >  35978 [ACK] Seq=8153381 Ack=148869733 Win=65535 Len=0
1,10.800490000000082,62.210.85.178,10.0.2.15,TCP,60,9001  >  35978 [ACK] Seq=8153381 Ack=148871193 Win=65535 Len=0
1,10.800494000000072,62.210.85.178,10.0.2.15,TCP,60,9001  >  35978 [ACK] Seq=8153381 Ack=148872653 Win=65535 Len=0
1,10.800601999999799,10.0.2.15,62.210.85.178,TLSv1.2,1204,Application Data
1,10.800766999999723,10.0.2.15,62.210.85.178,TCP,2974,35978  >  9001 [ACK] Seq=148873803 Ack=8153381 Win=65535 Len=2920 [TCP segment of a reassembled PDU]
1,10.801973000000089,10.0.2.15,62.210.85.178,TLSv1.2,4434,Application Data [TCP segment of a reassembled PDU]
1,10.802126000000044,62.210.85.178,10.0.2.15,TCP,60,9001  >  35978 [ACK] Seq=8153381 Ack=148873803 Win=65535 Len=0
1,10.802153999999973,62.210.85.178,10.0.2.15,TCP,60,9001  >  35978 [ACK] Seq=8153381 Ack=148875263 Win=65535 Len=0
1,10.802158999999847,62.210.85.178,10.0.2.15,TCP,60,9001  >  35978 [ACK] Seq=8153381 Ack=148876723 Win=65535 Len=0
1,10.802216000000044,10.0.2.15,62.210.85.178,TLSv1.2,894,Application Data
1,10.802357999999913,10.0.2.15,62.210.85.178,TLSv1.2,2974,Application Data
1,10.802470000000085,10.0.2.15,62.210.85.178,TLSv1.2,4434,Application Data [TCP segment of a reassembled PDU]
1,10.803192999999737,62.210.85.178,10.0.2.15,TCP,60,9001  >  35978 [ACK] Seq=8153381 Ack=148878183 Win=65535 Len=0
1,10.803223999999773,62.210.85.178,10.0.2.15,TCP,60,9001  >  35978 [ACK] Seq=8153381 Ack=148879643 Win=65535 Len=0
1,10.803229999999985,62.210.85.178,10.0.2.15,TCP,60,9001  >  35978 [ACK] Seq=8153381 Ack=148881103 Win=65535 Len=0
1,10.803234999999859,62.210.85.178,10.0.2.15,TCP,60,9001  >  35978 [ACK] Seq=8153381 Ack=148881943 Win=65535 Len=0
1,10.803239999999732,62.210.85.178,10.0.2.15,TCP,60,9001  >  35978 [ACK] Seq=8153381 Ack=148883403 Win=65535 Len=0
1,10.803243999999722,62.210.85.178,10.0.2.15,TCP,60,9001  >  35978 [ACK] Seq=8153381 Ack=148884863 Win=65535 Len=0
1,10.80324900000005,62.210.85.178,10.0.2.15,TCP,60,9001  >  35978 [ACK] Seq=8153381 Ack=148886323 Win=65535 Len=0
1,10.80325300000004,62.210.85.178,10.0.2.15,TCP,60,9001  >  35978 [ACK] Seq=8153381 Ack=148887783 Win=65535 Len=0
1,10.803257999999914,62.210.85.178,10.0.2.15,TCP,60,9001  >  35978 [ACK] Seq=8153381 Ack=148889243 Win=65535 Len=0
1,10.803375999999844,10.0.2.15,62.210.85.178,TLSv1.2,2974,Application Data [TCP segment of a reassembled PDU]
1,10.803433999999925,10.0.2.15,62.210.85.178,TLSv1.2,972,Application Data
1,10.803507999999965,62.210.85.178,10.0.2.15,TCP,60,9001  >  35978 [ACK] Seq=8153381 Ack=148890703 Win=65535 Len=0
1,10.803516999999829,62.210.85.178,10.0.2.15,TCP,60,9001  >  35978 [ACK] Seq=8153381 Ack=148892163 Win=65535 Len=0
1,10.803521999999703,62.210.85.178,10.0.2.15,TCP,60,9001  >  35978 [ACK] Seq=8153381 Ack=148893081 Win=65535 Len=0
1,10.80855399999973,10.0.2.15,62.210.85.178,TLSv1.2,4124,Application Data
1,10.808798999999908,62.210.85.178,10.0.2.15,TCP,60,9001  >  35978 [ACK] Seq=8153381 Ack=148894541 Win=65535 Len=0
1,10.808869999999843,62.210.85.178,10.0.2.15,TCP,60,9001  >  35978 [ACK] Seq=8153381 Ack=148896001 Win=65535 Len=0
1,10.808947999999873,62.210.85.178,10.0.2.15,TCP,60,9001  >  35978 [ACK] Seq=8153381 Ack=148897151 Win=65535 Len=0
1,10.809018999999807,10.0.2.15,62.210.85.178,TCP,2974,35978  >  9001 [ACK] Seq=148897151 Ack=8153381 Win=65535 Len=2920 [TCP segment of a reassembled PDU]
1,10.809092999999848,62.210.85.178,10.0.2.15,TCP,60,9001  >  35978 [ACK] Seq=8153381 Ack=148898611 Win=65535 Len=0
1,10.809100999999828,62.210.85.178,10.0.2.15,TCP,60,9001  >  35978 [ACK] Seq=8153381 Ack=148900071 Win=65535 Len=0
1,10.809143999999833,10.0.2.15,62.210.85.178,TLSv1.2,1204,Application Data
1,10.809234999999717,10.0.2.15,62.210.85.178,TCP,2974,35978  >  9001 [ACK] Seq=148901221 Ack=8153381 Win=65535 Len=2920 [TCP segment of a reassembled PDU]
1,10.809276999999838,62.210.85.178,10.0.2.15,TCP,60,9001  >  35978 [ACK] Seq=8153381 Ack=148901221 Win=65535 Len=0
1,10.809284999999818,62.210.85.178,10.0.2.15,TCP,60,9001  >  35978 [ACK] Seq=8153381 Ack=148902681 Win=65535 Len=0
1,10.809289999999692,62.210.85.178,10.0.2.15,TCP,60,9001  >  35978 [ACK] Seq=8153381 Ack=148904141 Win=65535 Len=0
1,10.80932699999994,10.0.2.15,62.210.85.178,TLSv1.2,1204,Application Data
1,10.809365999999955,62.210.85.178,10.0.2.15,TCP,60,9001  >  35978 [ACK] Seq=8153381 Ack=148905291 Win=65535 Len=0
1,10.809430999999677,10.0.2.15,62.210.85.178,TLSv1.2,4124,Application Data
1,10.80947100000003,62.210.85.178,10.0.2.15,TCP,60,9001  >  35978 [ACK] Seq=8153381 Ack=148906751 Win=65535 Len=0
1,10.80947900000001,62.210.85.178,10.0.2.15,TCP,60,9001  >  35978 [ACK] Seq=8153381 Ack=148908211 Win=65535 Len=0
1,10.809483,62.210.85.178,10.0.2.15,TCP,60,9001  >  35978 [ACK] Seq=8153381 Ack=148909361 Win=65535 Len=0
1,10.809531999999763,10.0.2.15,62.210.85.178,TLSv1.2,332,Application Data
1,10.809572000000117,62.210.85.178,10.0.2.15,TCP,60,9001  >  35978 [ACK] Seq=8153381 Ack=148909639 Win=65535 Len=0
1,10.809655999999904,10.0.2.15,62.210.85.178,TLSv1.2,3868,Application Data
1,10.809729000000061,62.210.85.178,10.0.2.15,TCP,60,9001  >  35978 [ACK] Seq=8153381 Ack=148911099 Win=65535 Len=0
1,10.809737000000041,62.210.85.178,10.0.2.15,TCP,60,9001  >  35978 [ACK] Seq=8153381 Ack=148912559 Win=65535 Len=0
1,10.809753999999884,62.210.85.178,10.0.2.15,TCP,60,9001  >  35978 [ACK] Seq=8153381 Ack=148913453 Win=65535 Len=0
1,10.80980499999987,10.0.2.15,62.210.85.178,TLSv1.2,4124,Application Data
1,10.809886000000006,62.210.85.178,10.0.2.15,TCP,60,9001  >  35978 [ACK] Seq=8153381 Ack=148914913 Win=65535 Len=0
1,10.809893999999986,62.210.85.178,10.0.2.15,TCP,60,9001  >  35978 [ACK] Seq=8153381 Ack=148916373 Win=65535 Len=0
1,10.80989899999986,62.210.85.178,10.0.2.15,TCP,60,9001  >  35978 [ACK] Seq=8153381 Ack=148917523 Win=65535 Len=0
1,10.80994099999998,10.0.2.15,62.210.85.178,TLSv1.2,4124,Application Data
1,10.809993999999733,62.210.85.178,10.0.2.15,TCP,60,9001  >  35978 [ACK] Seq=8153381 Ack=148918983 Win=65535 Len=0
1,10.810001999999713,62.210.85.178,10.0.2.15,TCP,60,9001  >  35978 [ACK] Seq=8153381 Ack=148920443 Win=65535 Len=0
1,10.810005999999703,62.210.85.178,10.0.2.15,TCP,60,9001  >  35978 [ACK] Seq=8153381 Ack=148921593 Win=65535 Len=0
1,10.810128000000077,10.0.2.15,62.210.85.178,TLSv1.2,4124,Application Data
1,10.81017299999985,62.210.85.178,10.0.2.15,TCP,60,9001  >  35978 [ACK] Seq=8153381 Ack=148923053 Win=65535 Len=0
1,10.81018099999983,62.210.85.178,10.0.2.15,TCP,60,9001  >  35978 [ACK] Seq=8153381 Ack=148924513 Win=65535 Len=0
1,10.810185999999703,62.210.85.178,10.0.2.15,TCP,60,9001  >  35978 [ACK] Seq=8153381 Ack=148925663 Win=65535 Len=0
1,10.810234000000037,10.0.2.15,62.210.85.178,TLSv1.2,588,Application Data
1,10.81027499999982,62.210.85.178,10.0.2.15,TCP,60,9001  >  35978 [ACK] Seq=8153381 Ack=148926197 Win=65535 Len=0
1,10.810336000000007,10.0.2.15,62.210.85.178,TLSv1.2,2646,Application Data
1,10.810377999999673,62.210.85.178,10.0.2.15,TCP,60,9001  >  35978 [ACK] Seq=8153381 Ack=148927657 Win=65535 Len=0
1,10.81038499999977,62.210.85.178,10.0.2.15,TCP,60,9001  >  35978 [ACK] Seq=8153381 Ack=148928789 Win=65535 Len=0
1,10.88358100000005,54.93.77.70,10.0.2.15,TLSv1.2,590,Application Data
1,10.914970999999696,54.93.77.70,10.0.2.15,TCP,1502,"9001  >  34692 [PSH, ACK] Seq=148714485 Ack=8184841 Win=65535 Len=1448 [TCP segment of a reassembled PDU]"
1,10.915054000000055,10.0.2.15,54.93.77.70,TCP,54,34692  >  9001 [ACK] Seq=8184841 Ack=148715933 Win=65535 Len=0
1,10.93264199999976,54.93.77.70,10.0.2.15,TLSv1.2,684,Application Data
1,10.974138999999923,10.0.2.15,54.93.77.70,TCP,54,34692  >  9001 [ACK] Seq=8184841 Ack=148716563 Win=65535 Len=0
1,10.994053999999778,54.93.77.70,10.0.2.15,TLSv1.2,2950,Application Data
1,10.99415799999997,10.0.2.15,54.93.77.70,TCP,54,34692  >  9001 [ACK] Seq=8184841 Ack=148719459 Win=65535 Len=0
1,10.99506399999973,54.93.77.70,10.0.2.15,TLSv1.2,2342,Application Data
1,10.995120000000043,10.0.2.15,54.93.77.70,TCP,54,34692  >  9001 [ACK] Seq=8184841 Ack=148721747 Win=65535 Len=0
1,11.044419999999718,54.93.77.70,10.0.2.15,TCP,2950,"9001  >  34692 [PSH, ACK] Seq=148721747 Ack=8184841 Win=65535 Len=2896 [TCP segment of a reassembled PDU]"
1,11.044468999999935,54.93.77.70,10.0.2.15,TLSv1.2,11638,"Application Data, Application Data, Application Data"
1,11.044554999999946,10.0.2.15,54.93.77.70,TCP,54,34692  >  9001 [ACK] Seq=8184841 Ack=148724643 Win=65535 Len=0
1,11.04461399999991,10.0.2.15,54.93.77.70,TCP,54,34692  >  9001 [ACK] Seq=8184841 Ack=148736227 Win=65535 Len=0
1,11.044904999999744,10.0.2.15,54.93.77.70,TLSv1.2,590,Application Data
1,11.045004000000063,54.93.77.70,10.0.2.15,TCP,60,9001  >  34692 [ACK] Seq=148736227 Ack=8185377 Win=65535 Len=0
1,11.066996999999901,54.93.77.70,10.0.2.15,TLSv1.2,5752,"Application Data, Application Data, Application Data"
1,11.067097999999987,10.0.2.15,54.93.77.70,TCP,54,34692  >  9001 [ACK] Seq=8185377 Ack=148741925 Win=65535 Len=0
1,11.067717999999786,10.0.2.15,54.93.77.70,TLSv1.2,590,Application Data
1,11.068353000000116,54.93.77.70,10.0.2.15,TCP,60,9001  >  34692 [ACK] Seq=148741925 Ack=8185913 Win=65535 Len=0
1,11.077154000000064,54.93.77.70,10.0.2.15,TCP,2950,"9001  >  34692 [PSH, ACK] Seq=148741925 Ack=8185913 Win=65535 Len=2896 [TCP segment of a reassembled PDU]"
1,11.0772079999997,54.93.77.70,10.0.2.15,TLSv1.2,2950,Application Data [TCP segment of a reassembled PDU]
1,11.077284999999847,10.0.2.15,54.93.77.70,TCP,54,34692  >  9001 [ACK] Seq=8185913 Ack=148744821 Win=65535 Len=0
1,11.077402999999777,10.0.2.15,54.93.77.70,TCP,54,34692  >  9001 [ACK] Seq=8185913 Ack=148747717 Win=65535 Len=0
1,11.07837900000004,54.93.77.70,10.0.2.15,TLSv1.2,5846,Application Data [TCP segment of a reassembled PDU]
1,11.078453999999965,10.0.2.15,54.93.77.70,TCP,54,34692  >  9001 [ACK] Seq=8185913 Ack=148753509 Win=65535 Len=0
1,11.08576499999981,54.93.77.70,10.0.2.15,TLSv1.2,358,Application Data
1,11.126181000000088,10.0.2.15,54.93.77.70,TCP,54,34692  >  9001 [ACK] Seq=8185913 Ack=148753813 Win=65535 Len=0
1,11.153453999999783,62.210.85.178,10.0.2.15,TLSv1.2,590,Application Data
1,11.191057,54.93.77.70,10.0.2.15,TLSv1.2,2132,Application Data
1,11.191171999999824,10.0.2.15,54.93.77.70,TCP,54,34692  >  9001 [ACK] Seq=8185913 Ack=148755891 Win=65535 Len=0
1,11.194148999999925,10.0.2.15,62.210.85.178,TCP,54,35978  >  9001 [ACK] Seq=148928789 Ack=8153917 Win=65535 Len=0
1,11.226885999999922,54.93.77.70,10.0.2.15,TLSv1.2,2068,Application Data
1,11.226998999999978,10.0.2.15,54.93.77.70,TCP,54,34692  >  9001 [ACK] Seq=8185913 Ack=148757905 Win=65535 Len=0
1,11.24266499999976,54.93.77.70,10.0.2.15,TLSv1.2,2950,Application Data
1,11.242805999999746,10.0.2.15,54.93.77.70,TCP,54,34692  >  9001 [ACK] Seq=8185913 Ack=148760801 Win=65535 Len=0
1,11.243453999999929,54.93.77.70,10.0.2.15,TLSv1.2,7294,"Application Data, Application Data"
1,11.243575999999848,10.0.2.15,54.93.77.70,TCP,54,34692  >  9001 [ACK] Seq=8185913 Ack=148768041 Win=65535 Len=0
1,11.244096999999783,10.0.2.15,54.93.77.70,TLSv1.2,590,Application Data
1,11.245883999999933,54.93.77.70,10.0.2.15,TCP,60,9001  >  34692 [ACK] Seq=148768041 Ack=8186449 Win=65535 Len=0
1,11.248352000000068,54.93.77.70,10.0.2.15,TLSv1.2,9668,"Application Data, Application Data, Application Data, Application Data"
1,11.248681999999917,10.0.2.15,54.93.77.70,TCP,54,34692  >  9001 [ACK] Seq=8186449 Ack=148777655 Win=65535 Len=0
1,11.258710000000065,10.0.2.15,54.93.77.70,TLSv1.2,590,Application Data
1,11.259097999999994,54.93.77.70,10.0.2.15,TCP,60,9001  >  34692 [ACK] Seq=148777655 Ack=8186985 Win=65535 Len=0
