No.,Time,Source,Destination,Protocol,Length,Info
1,0.1531739999995807,62.210.85.178,10.0.2.15,TLSv1.2,590,Application Data
1,0.1533079999999245,10.0.2.15,62.210.85.178,TCP,54,35978  >  9001 [ACK] Seq=151945337 Ack=8321055 Win=65535 Len=0
1,0.29914999999982683,10.0.2.15,54.93.77.70,TLSv1.2,590,Application Data
1,0.30178099999966435,54.93.77.70,10.0.2.15,TCP,60,9001  >  34692 [ACK] Seq=151795633 Ack=8353733 Win=65535 Len=0
1,0.5975269999999,62.210.85.178,10.0.2.15,TLSv1.2,590,Application Data
1,0.5976160000000164,10.0.2.15,62.210.85.178,TCP,54,35978  >  9001 [ACK] Seq=151945337 Ack=8321591 Win=65535 Len=0
1,0.5979559999996127,10.0.2.15,62.210.85.178,TLSv1.2,590,Application Data
1,0.5980529999997088,62.210.85.178,10.0.2.15,TCP,60,9001  >  35978 [ACK] Seq=8321591 Ack=151945873 Win=65535 Len=0
1,0.9054499999997461,54.93.77.70,10.0.2.15,TLSv1.2,590,Application Data
1,0.9055379999999786,10.0.2.15,54.93.77.70,TCP,54,34692  >  9001 [ACK] Seq=8353733 Ack=151796169 Win=65535 Len=0
1,0.9060660000000098,10.0.2.15,54.93.77.70,TLSv1.2,1618,Application Data
1,0.90634799999998,54.93.77.70,10.0.2.15,TCP,60,9001  >  34692 [ACK] Seq=151796169 Ack=8355193 Win=65535 Len=0
1,0.9063709999995808,54.93.77.70,10.0.2.15,TCP,60,9001  >  34692 [ACK] Seq=151796169 Ack=8355297 Win=65535 Len=0
1,1.069234999999935,62.210.85.178,10.0.2.15,TLSv1.2,1618,Application Data
1,1.0694069999999556,10.0.2.15,62.210.85.178,TCP,54,35978  >  9001 [ACK] Seq=151945873 Ack=8323155 Win=65535 Len=0
1,1.1006049999996321,10.0.2.15,62.210.85.178,TLSv1.2,590,Application Data
1,1.1037799999999152,62.210.85.178,10.0.2.15,TCP,60,9001  >  35978 [ACK] Seq=8323155 Ack=151946409 Win=65535 Len=0
1,1.1159859999997934,10.0.2.15,62.210.85.178,TLSv1.2,1104,Application Data
1,1.116153999999824,62.210.85.178,10.0.2.15,TCP,60,9001  >  35978 [ACK] Seq=8323155 Ack=151947459 Win=65535 Len=0
1,1.6962469999998575,54.93.77.70,10.0.2.15,TLSv1.2,1618,Application Data
1,1.6965629999999692,10.0.2.15,54.93.77.70,TCP,54,34692  >  9001 [ACK] Seq=8355297 Ack=151797733 Win=65535 Len=0
1,1.705876999999873,10.0.2.15,54.93.77.70,TLSv1.2,590,Application Data
1,1.7060859999996865,54.93.77.70,10.0.2.15,TCP,60,9001  >  34692 [ACK] Seq=151797733 Ack=8355833 Win=65535 Len=0
1,2.2678079999996044,10.0.2.15,193.246.105.82,TCP,54,[TCP Keep-Alive] 42316  >  443 [ACK] Seq=1969 Ack=786 Win=32160 Len=0
1,2.2680709999999635,193.246.105.82,10.0.2.15,TCP,60,[TCP Keep-Alive ACK] 443  >  42316 [ACK] Seq=786 Ack=1970 Win=65535 Len=0
1,2.3164899999997033,62.210.85.178,10.0.2.15,TLSv1.2,590,Application Data
1,2.317087999999785,10.0.2.15,62.210.85.178,TLSv1.2,590,Application Data
1,2.3172169999998005,62.210.85.178,10.0.2.15,TCP,60,9001  >  35978 [ACK] Seq=8323691 Ack=151947995 Win=65535 Len=0
1,2.770346999999674,54.93.77.70,10.0.2.15,TLSv1.2,590,Application Data
1,2.7709239999999227,10.0.2.15,54.93.77.70,TLSv1.2,590,Application Data
1,2.771082999999635,54.93.77.70,10.0.2.15,TCP,60,9001  >  34692 [ACK] Seq=151798269 Ack=8356369 Win=65535 Len=0
1,3.0555139999996754,62.210.85.178,10.0.2.15,TLSv1.2,590,Application Data
1,3.0721340000000055,10.0.2.15,62.210.85.178,TLSv1.2,590,Application Data
1,3.0723009999996975,62.210.85.178,10.0.2.15,TCP,60,9001  >  35978 [ACK] Seq=8324227 Ack=151948531 Win=65535 Len=0
1,3.084752999999637,10.0.2.15,62.210.85.178,TLSv1.2,4124,Application Data
1,3.0856850000000122,62.210.85.178,10.0.2.15,TCP,60,9001  >  35978 [ACK] Seq=8324227 Ack=151949991 Win=65535 Len=0
1,3.0857449999998607,62.210.85.178,10.0.2.15,TCP,60,9001  >  35978 [ACK] Seq=8324227 Ack=151951451 Win=65535 Len=0
1,3.0857529999998405,62.210.85.178,10.0.2.15,TCP,60,9001  >  35978 [ACK] Seq=8324227 Ack=151952601 Win=65535 Len=0
1,3.086192999999639,10.0.2.15,62.210.85.178,TLSv1.2,4124,Application Data
1,3.0862999999999374,62.210.85.178,10.0.2.15,TCP,60,9001  >  35978 [ACK] Seq=8324227 Ack=151954061 Win=65535 Len=0
1,3.0863299999996343,62.210.85.178,10.0.2.15,TCP,60,9001  >  35978 [ACK] Seq=8324227 Ack=151955521 Win=65535 Len=0
1,3.0863349999999627,62.210.85.178,10.0.2.15,TCP,60,9001  >  35978 [ACK] Seq=8324227 Ack=151956671 Win=65535 Len=0
1,3.0865139999996245,10.0.2.15,62.210.85.178,TLSv1.2,4124,Application Data
1,3.0867019999996046,62.210.85.178,10.0.2.15,TCP,60,9001  >  35978 [ACK] Seq=8324227 Ack=151958131 Win=65535 Len=0
1,3.0867139999995743,62.210.85.178,10.0.2.15,TCP,60,9001  >  35978 [ACK] Seq=8324227 Ack=151959591 Win=65535 Len=0
1,3.0867189999999027,62.210.85.178,10.0.2.15,TCP,60,9001  >  35978 [ACK] Seq=8324227 Ack=151960741 Win=65535 Len=0
1,3.0867809999999736,10.0.2.15,62.210.85.178,TLSv1.2,4124,Application Data
1,3.086848999999802,62.210.85.178,10.0.2.15,TCP,60,9001  >  35978 [ACK] Seq=8324227 Ack=151962201 Win=65535 Len=0
1,3.086859000000004,62.210.85.178,10.0.2.15,TCP,60,9001  >  35978 [ACK] Seq=8324227 Ack=151963661 Win=65535 Len=0
1,3.0868649999997615,62.210.85.178,10.0.2.15,TCP,60,9001  >  35978 [ACK] Seq=8324227 Ack=151964811 Win=65535 Len=0
1,3.0869159999997464,10.0.2.15,62.210.85.178,TLSv1.2,332,Application Data
1,3.0869769999999335,62.210.85.178,10.0.2.15,TCP,60,9001  >  35978 [ACK] Seq=8324227 Ack=151965089 Win=65535 Len=0
1,3.0870559999998477,10.0.2.15,62.210.85.178,TLSv1.2,3868,Application Data
1,3.087119999999686,62.210.85.178,10.0.2.15,TCP,60,9001  >  35978 [ACK] Seq=8324227 Ack=151966549 Win=65535 Len=0
1,3.0871259999998983,62.210.85.178,10.0.2.15,TCP,60,9001  >  35978 [ACK] Seq=8324227 Ack=151968009 Win=65535 Len=0
1,3.0871290000000045,62.210.85.178,10.0.2.15,TCP,60,9001  >  35978 [ACK] Seq=8324227 Ack=151968903 Win=65535 Len=0
1,3.087177999999767,10.0.2.15,62.210.85.178,TLSv1.2,4124,Application Data
1,3.087239999999838,62.210.85.178,10.0.2.15,TCP,60,9001  >  35978 [ACK] Seq=8324227 Ack=151970363 Win=65535 Len=0
1,3.0872449999997116,62.210.85.178,10.0.2.15,TCP,60,9001  >  35978 [ACK] Seq=8324227 Ack=151971823 Win=65535 Len=0
1,3.0872479999998177,62.210.85.178,10.0.2.15,TCP,60,9001  >  35978 [ACK] Seq=8324227 Ack=151972973 Win=65535 Len=0
1,3.087290999999823,10.0.2.15,62.210.85.178,TLSv1.2,3030,Application Data
1,3.0873499999997875,62.210.85.178,10.0.2.15,TCP,60,9001  >  35978 [ACK] Seq=8324227 Ack=151974433 Win=65535 Len=0
1,3.0873569999998836,62.210.85.178,10.0.2.15,TCP,60,9001  >  35978 [ACK] Seq=8324227 Ack=151975893 Win=65535 Len=0
1,3.0873599999999897,62.210.85.178,10.0.2.15,TCP,60,9001  >  35978 [ACK] Seq=8324227 Ack=151975949 Win=65535 Len=0
1,3.0969099999997525,10.0.2.15,62.210.85.178,TLSv1.2,4124,Application Data
1,3.0972019999999247,62.210.85.178,10.0.2.15,TCP,60,9001  >  35978 [ACK] Seq=8324227 Ack=151977409 Win=65535 Len=0
1,3.0972389999997176,62.210.85.178,10.0.2.15,TCP,60,9001  >  35978 [ACK] Seq=8324227 Ack=151978869 Win=65535 Len=0
1,3.0972419999998237,62.210.85.178,10.0.2.15,TCP,60,9001  >  35978 [ACK] Seq=8324227 Ack=151980019 Win=65535 Len=0
1,3.097327999999834,10.0.2.15,62.210.85.178,TLSv1.2,4124,Application Data
1,3.097429999999804,62.210.85.178,10.0.2.15,TCP,60,9001  >  35978 [ACK] Seq=8324227 Ack=151981479 Win=65535 Len=0
1,3.0974499999997533,62.210.85.178,10.0.2.15,TCP,60,9001  >  35978 [ACK] Seq=8324227 Ack=151982939 Win=65535 Len=0
1,3.0974529999998595,62.210.85.178,10.0.2.15,TCP,60,9001  >  35978 [ACK] Seq=8324227 Ack=151984089 Win=65535 Len=0
1,3.09751899999992,10.0.2.15,62.210.85.178,TLSv1.2,4124,Application Data
1,3.0976089999999203,62.210.85.178,10.0.2.15,TCP,60,9001  >  35978 [ACK] Seq=8324227 Ack=151985549 Win=65535 Len=0
1,3.09762099999989,62.210.85.178,10.0.2.15,TCP,60,9001  >  35978 [ACK] Seq=8324227 Ack=151987009 Win=65535 Len=0
1,3.097623999999996,62.210.85.178,10.0.2.15,TCP,60,9001  >  35978 [ACK] Seq=8324227 Ack=151988159 Win=65535 Len=0
1,3.097675999999865,10.0.2.15,62.210.85.178,TLSv1.2,4124,Application Data
1,3.0977960000000166,62.210.85.178,10.0.2.15,TCP,60,9001  >  35978 [ACK] Seq=8324227 Ack=151989619 Win=65535 Len=0
1,3.0978109999996377,62.210.85.178,10.0.2.15,TCP,60,9001  >  35978 [ACK] Seq=8324227 Ack=151991079 Win=65535 Len=0
1,3.097813999999744,62.210.85.178,10.0.2.15,TCP,60,9001  >  35978 [ACK] Seq=8324227 Ack=151992229 Win=65535 Len=0
1,3.0978449999997792,10.0.2.15,62.210.85.178,TLSv1.2,332,Application Data
1,3.0979419999998754,62.210.85.178,10.0.2.15,TCP,60,9001  >  35978 [ACK] Seq=8324227 Ack=151992507 Win=65535 Len=0
1,3.098066999999901,10.0.2.15,62.210.85.178,TLSv1.2,3868,Application Data
1,3.0984199999998054,62.210.85.178,10.0.2.15,TCP,60,9001  >  35978 [ACK] Seq=8324227 Ack=151993967 Win=65535 Len=0
1,3.098464999999578,62.210.85.178,10.0.2.15,TCP,60,9001  >  35978 [ACK] Seq=8324227 Ack=151995427 Win=65535 Len=0
1,3.0984679999996843,62.210.85.178,10.0.2.15,TCP,60,9001  >  35978 [ACK] Seq=8324227 Ack=151996321 Win=65535 Len=0
1,3.098616999999649,10.0.2.15,62.210.85.178,TLSv1.2,1424,Application Data
1,3.098750999999993,62.210.85.178,10.0.2.15,TCP,60,9001  >  35978 [ACK] Seq=8324227 Ack=151997691 Win=65535 Len=0
1,3.22435299999961,54.93.77.70,10.0.2.15,TLSv1.2,590,Application Data
1,3.2286029999995662,54.93.77.70,10.0.2.15,TCP,2950,"9001  >  34692 [PSH, ACK] Seq=151798805 Ack=8356369 Win=65535 Len=2896 [TCP segment of a reassembled PDU]"
1,3.228939999999966,10.0.2.15,54.93.77.70,TCP,54,34692  >  9001 [ACK] Seq=8356369 Ack=151801701 Win=65535 Len=0
1,3.2465839999999844,54.93.77.70,10.0.2.15,TLSv1.2,778,Application Data
1,3.2879179999999906,10.0.2.15,54.93.77.70,TCP,54,34692  >  9001 [ACK] Seq=8356369 Ack=151802425 Win=65535 Len=0
1,3.4075119999997696,54.93.77.70,10.0.2.15,TLSv1.2,11638,"Application Data, Application Data"
1,3.4075629999997545,54.93.77.70,10.0.2.15,TLSv1.2,1502,"Application Data, Application Data"
1,3.4075749999997242,54.93.77.70,10.0.2.15,TCP,2950,"9001  >  34692 [PSH, ACK] Seq=151815457 Ack=8356369 Win=65535 Len=2896 [TCP segment of a reassembled PDU]"
1,3.407658999999967,10.0.2.15,54.93.77.70,TCP,54,34692  >  9001 [ACK] Seq=8356369 Ack=151814009 Win=65535 Len=0
1,3.407716999999593,10.0.2.15,54.93.77.70,TCP,54,34692  >  9001 [ACK] Seq=8356369 Ack=151815457 Win=65535 Len=0
1,3.407745999999861,10.0.2.15,54.93.77.70,TCP,54,34692  >  9001 [ACK] Seq=8356369 Ack=151818353 Win=65535 Len=0
1,3.5765409999999065,54.93.77.70,10.0.2.15,TLSv1.2,15722,"Application Data, Application Data, Application Data, Application Data, Application Data, Application Data, Application Data"
1,3.5769099999997707,10.0.2.15,54.93.77.70,TCP,54,34692  >  9001 [ACK] Seq=8356369 Ack=151834021 Win=65535 Len=0
1,3.578142999999727,10.0.2.15,54.93.77.70,TLSv1.2,590,Application Data
1,3.5795069999999214,54.93.77.70,10.0.2.15,TCP,1502,"9001  >  34692 [PSH, ACK] Seq=151834021 Ack=8356369 Win=65535 Len=1448 [TCP segment of a reassembled PDU]"
1,3.5796080000000075,54.93.77.70,10.0.2.15,TCP,60,9001  >  34692 [ACK] Seq=151835469 Ack=8356905 Win=65535 Len=0
1,3.5797880000000077,10.0.2.15,54.93.77.70,TCP,54,34692  >  9001 [ACK] Seq=8356905 Ack=151835469 Win=65535 Len=0
1,3.5886959999998,10.0.2.15,54.93.77.70,TLSv1.2,590,Application Data
1,3.5889009999996233,54.93.77.70,10.0.2.15,TCP,60,9001  >  34692 [ACK] Seq=151835469 Ack=8357441 Win=65535 Len=0
1,3.5889259999999013,54.93.77.70,10.0.2.15,TLSv1.2,4398,"Application Data, Application Data"
1,3.5889909999996235,10.0.2.15,54.93.77.70,TCP,54,34692  >  9001 [ACK] Seq=8357441 Ack=151839813 Win=65535 Len=0
1,3.5932559999996556,54.93.77.70,10.0.2.15,TLSv1.2,7294,"Application Data, Application Data"
1,3.5938759999999093,10.0.2.15,54.93.77.70,TCP,54,34692  >  9001 [ACK] Seq=8357441 Ack=151847053 Win=65535 Len=0
1,3.607071999999789,54.93.77.70,10.0.2.15,TLSv1.2,1010,Application Data
1,3.6179149999998117,10.0.2.15,54.93.77.70,TLSv1.2,590,Application Data
1,3.6181189999997514,54.93.77.70,10.0.2.15,TCP,60,9001  >  34692 [ACK] Seq=151848009 Ack=8357977 Win=65535 Len=0
1,3.7049349999997503,62.210.85.178,10.0.2.15,TLSv1.2,590,Application Data
1,3.7477890000000116,10.0.2.15,62.210.85.178,TCP,54,35978  >  9001 [ACK] Seq=151997691 Ack=8324763 Win=65535 Len=0
1,3.7979089999998905,62.210.85.178,10.0.2.15,TLSv1.2,1104,Application Data
1,3.7980369999995673,10.0.2.15,62.210.85.178,TCP,54,35978  >  9001 [ACK] Seq=151997691 Ack=8325813 Win=65535 Len=0
1,3.7990149999995992,10.0.2.15,62.210.85.178,TLSv1.2,590,Application Data
1,3.7993799999999283,62.210.85.178,10.0.2.15,TCP,60,9001  >  35978 [ACK] Seq=8325813 Ack=151998227 Win=65535 Len=0
1,3.9174079999997957,54.93.77.70,10.0.2.15,TLSv1.2,590,Application Data
1,3.9179519999997865,10.0.2.15,54.93.77.70,TLSv1.2,590,Application Data
1,3.9181049999997413,54.93.77.70,10.0.2.15,TCP,60,9001  >  34692 [ACK] Seq=151848545 Ack=8358513 Win=65535 Len=0
1,4.322805999999673,62.210.85.178,10.0.2.15,TLSv1.2,590,Application Data
1,4.326622999999927,10.0.2.15,62.210.85.178,TLSv1.2,590,Application Data
1,4.326948999999786,62.210.85.178,10.0.2.15,TCP,60,9001  >  35978 [ACK] Seq=8326349 Ack=151998763 Win=65535 Len=0
1,4.337253999999575,10.0.2.15,62.210.85.178,TLSv1.2,4124,Application Data
1,4.33755199999996,62.210.85.178,10.0.2.15,TCP,60,9001  >  35978 [ACK] Seq=8326349 Ack=152000223 Win=65535 Len=0
1,4.337580999999773,62.210.85.178,10.0.2.15,TCP,60,9001  >  35978 [ACK] Seq=8326349 Ack=152001683 Win=65535 Len=0
1,4.3375859999996464,62.210.85.178,10.0.2.15,TCP,60,9001  >  35978 [ACK] Seq=8326349 Ack=152002833 Win=65535 Len=0
1,4.337734999999611,10.0.2.15,62.210.85.178,TLSv1.2,4124,Application Data
1,4.337818999999854,10.0.2.15,62.210.85.178,TCP,1514,35978  >  9001 [ACK] Seq=152006903 Ack=8326349 Win=65535 Len=1460 [TCP segment of a reassembled PDU]
1,4.337859999999637,62.210.85.178,10.0.2.15,TCP,60,9001  >  35978 [ACK] Seq=8326349 Ack=152004293 Win=65535 Len=0
1,4.337868999999955,62.210.85.178,10.0.2.15,TCP,60,9001  >  35978 [ACK] Seq=8326349 Ack=152005753 Win=65535 Len=0
1,4.337873999999829,62.210.85.178,10.0.2.15,TCP,60,9001  >  35978 [ACK] Seq=8326349 Ack=152006903 Win=65535 Len=0
1,4.337912999999844,10.0.2.15,62.210.85.178,TLSv1.2,800,Application Data
1,4.337977999999566,62.210.85.178,10.0.2.15,TCP,60,9001  >  35978 [ACK] Seq=8326349 Ack=152008363 Win=65535 Len=0
1,4.337986000000001,62.210.85.178,10.0.2.15,TCP,60,9001  >  35978 [ACK] Seq=8326349 Ack=152009109 Win=65535 Len=0
1,4.422787999999855,54.93.77.70,10.0.2.15,TLSv1.2,3674,Application Data
1,4.422980999999709,10.0.2.15,54.93.77.70,TCP,54,34692  >  9001 [ACK] Seq=8358513 Ack=151852165 Win=65535 Len=0
1,4.624714999999924,54.93.77.70,10.0.2.15,TLSv1.2,3674,Application Data
1,4.6249989999996615,10.0.2.15,54.93.77.70,TCP,54,34692  >  9001 [ACK] Seq=8358513 Ack=151855785 Win=65535 Len=0
1,4.716073999999935,54.93.77.70,10.0.2.15,TCP,2950,"9001  >  34692 [PSH, ACK] Seq=151855785 Ack=8358513 Win=65535 Len=2896 [TCP segment of a reassembled PDU]"
1,4.7164639999996325,10.0.2.15,54.93.77.70,TCP,54,34692  >  9001 [ACK] Seq=8358513 Ack=151858681 Win=65535 Len=0
1,4.717610999999579,54.93.77.70,10.0.2.15,TLSv1.2,778,Application Data
1,4.721590999999989,10.0.2.15,54.93.77.70,TLSv1.2,590,Application Data
1,4.7220179999999345,54.93.77.70,10.0.2.15,TCP,60,9001  >  34692 [ACK] Seq=151859405 Ack=8359049 Win=65535 Len=0
1,5.247705999999653,62.210.85.178,10.0.2.15,TLSv1.2,590,Application Data
1,5.2491839999997865,10.0.2.15,62.210.85.178,TLSv1.2,590,Application Data
1,5.250032999999803,62.210.85.178,10.0.2.15,TCP,60,9001  >  35978 [ACK] Seq=8326885 Ack=152009645 Win=65535 Len=0
1,5.562946999999895,54.93.77.70,10.0.2.15,TLSv1.2,590,Application Data
1,5.563829999999598,10.0.2.15,54.93.77.70,TLSv1.2,590,Application Data
1,5.564293999999791,54.93.77.70,10.0.2.15,TCP,60,9001  >  34692 [ACK] Seq=151859941 Ack=8359585 Win=65535 Len=0
1,6.692129999999906,62.210.85.178,10.0.2.15,TLSv1.2,590,Application Data
1,6.698621000000003,10.0.2.15,62.210.85.178,TLSv1.2,590,Application Data
1,6.698831999999584,62.210.85.178,10.0.2.15,TCP,60,9001  >  35978 [ACK] Seq=8327421 Ack=152010181 Win=65535 Len=0
1,6.709208999999646,10.0.2.15,62.210.85.178,TLSv1.2,4124,Application Data
1,6.709486999999626,62.210.85.178,10.0.2.15,TCP,60,9001  >  35978 [ACK] Seq=8327421 Ack=152011641 Win=65535 Len=0
1,6.709520999999768,62.210.85.178,10.0.2.15,TCP,60,9001  >  35978 [ACK] Seq=8327421 Ack=152013101 Win=65535 Len=0
1,6.7095259999996415,62.210.85.178,10.0.2.15,TCP,60,9001  >  35978 [ACK] Seq=8327421 Ack=152014251 Win=65535 Len=0
1,6.709633999999824,10.0.2.15,62.210.85.178,TLSv1.2,4124,Application Data
1,6.709953999999925,62.210.85.178,10.0.2.15,TCP,60,9001  >  35978 [ACK] Seq=8327421 Ack=152015711 Win=65535 Len=0
1,6.712776999999733,62.210.85.178,10.0.2.15,TCP,60,9001  >  35978 [ACK] Seq=8327421 Ack=152017171 Win=65535 Len=0
1,6.7127919999998085,62.210.85.178,10.0.2.15,TCP,60,9001  >  35978 [ACK] Seq=8327421 Ack=152018321 Win=65535 Len=0
1,6.713456999999835,10.0.2.15,62.210.85.178,TLSv1.2,4124,Application Data
1,6.714274999999816,62.210.85.178,10.0.2.15,TCP,60,9001  >  35978 [ACK] Seq=8327421 Ack=152019781 Win=65535 Len=0
1,6.714386999999988,62.210.85.178,10.0.2.15,TCP,60,9001  >  35978 [ACK] Seq=8327421 Ack=152021241 Win=65535 Len=0
1,6.714398999999958,62.210.85.178,10.0.2.15,TCP,60,9001  >  35978 [ACK] Seq=8327421 Ack=152022391 Win=65535 Len=0
1,6.714642999999796,10.0.2.15,62.210.85.178,TLSv1.2,4124,Application Data
1,6.715295999999853,62.210.85.178,10.0.2.15,TCP,60,9001  >  35978 [ACK] Seq=8327421 Ack=152023851 Win=65535 Len=0
1,6.715426999999636,62.210.85.178,10.0.2.15,TCP,60,9001  >  35978 [ACK] Seq=8327421 Ack=152025311 Win=65535 Len=0
1,6.715433999999732,62.210.85.178,10.0.2.15,TCP,60,9001  >  35978 [ACK] Seq=8327421 Ack=152026461 Win=65535 Len=0
1,6.7157069999998384,10.0.2.15,62.210.85.178,TLSv1.2,332,Application Data
1,6.716600999999628,62.210.85.178,10.0.2.15,TCP,60,9001  >  35978 [ACK] Seq=8327421 Ack=152026739 Win=65535 Len=0
1,6.717466999999942,10.0.2.15,62.210.85.178,TLSv1.2,2646,Application Data
1,6.717801999999665,62.210.85.178,10.0.2.15,TCP,60,9001  >  35978 [ACK] Seq=8327421 Ack=152028199 Win=65535 Len=0
1,6.717837999999574,62.210.85.178,10.0.2.15,TCP,60,9001  >  35978 [ACK] Seq=8327421 Ack=152029331 Win=65535 Len=0
1,6.837936999999783,54.93.77.70,10.0.2.15,TCP,2950,"9001  >  34692 [PSH, ACK] Seq=151859941 Ack=8359585 Win=65535 Len=2896 [TCP segment of a reassembled PDU]"
1,6.838003999999728,54.93.77.70,10.0.2.15,TLSv1.2,4398,"Application Data, Application Data"
1,6.838129999999637,10.0.2.15,54.93.77.70,TCP,54,34692  >  9001 [ACK] Seq=8359585 Ack=151867181 Win=65535 Len=0
1,6.985525999999936,54.93.77.70,10.0.2.15,TLSv1.2,1104,Application Data
1,7.027912999999899,10.0.2.15,54.93.77.70,TCP,54,34692  >  9001 [ACK] Seq=8359585 Ack=151868231 Win=65535 Len=0
1,7.0314949999997225,54.93.77.70,10.0.2.15,TCP,2950,"9001  >  34692 [PSH, ACK] Seq=151868231 Ack=8359585 Win=65535 Len=2896 [TCP segment of a reassembled PDU]"
1,7.031536999999844,54.93.77.70,10.0.2.15,TLSv1.2,1502,Application Data [TCP segment of a reassembled PDU]
1,7.031603999999788,10.0.2.15,54.93.77.70,TCP,54,34692  >  9001 [ACK] Seq=8359585 Ack=151871127 Win=65535 Len=0
1,7.0316499999999,10.0.2.15,54.93.77.70,TCP,54,34692  >  9001 [ACK] Seq=8359585 Ack=151872575 Win=65535 Len=0
1,7.031876000000011,10.0.2.15,54.93.77.70,TLSv1.2,590,Application Data
1,7.031952999999703,54.93.77.70,10.0.2.15,TCP,60,9001  >  34692 [ACK] Seq=151872575 Ack=8360121 Win=65535 Len=0
1,7.044736999999714,54.93.77.70,10.0.2.15,TLSv1.2,1408,Application Data
1,7.087840999999571,10.0.2.15,54.93.77.70,TCP,54,34692  >  9001 [ACK] Seq=8360121 Ack=151873929 Win=65535 Len=0
1,8.009752999999819,62.210.85.178,10.0.2.15,TLSv1.2,590,Application Data
1,8.014659999999822,54.93.77.70,10.0.2.15,TLSv1.2,2132,Application Data
1,8.014762999999675,10.0.2.15,54.93.77.70,TCP,54,34692  >  9001 [ACK] Seq=8360121 Ack=151876007 Win=65535 Len=0
1,8.015093999999863,54.93.77.70,10.0.2.15,TLSv1.2,3674,Application Data
1,8.015134999999646,10.0.2.15,54.93.77.70,TCP,54,34692  >  9001 [ACK] Seq=8360121 Ack=151879627 Win=65535 Len=0
1,8.017852999999832,10.0.2.15,54.93.77.70,TLSv1.2,590,Application Data
1,8.017989999999827,54.93.77.70,10.0.2.15,TCP,60,9001  >  34692 [ACK] Seq=151879627 Ack=8360657 Win=65535 Len=0
1,8.051894999999604,10.0.2.15,62.210.85.178,TCP,54,35978  >  9001 [ACK] Seq=152029331 Ack=8327957 Win=65535 Len=0
1,8.124828999999863,62.210.85.178,10.0.2.15,TLSv1.2,590,Application Data
1,8.124935999999707,10.0.2.15,62.210.85.178,TCP,54,35978  >  9001 [ACK] Seq=152029331 Ack=8328493 Win=65535 Len=0
1,8.125334999999723,10.0.2.15,62.210.85.178,TLSv1.2,590,Application Data
1,8.12545399999999,62.210.85.178,10.0.2.15,TCP,60,9001  >  35978 [ACK] Seq=8328493 Ack=152029867 Win=65535 Len=0
1,8.221055999999862,54.93.77.70,10.0.2.15,TLSv1.2,590,Application Data
1,8.221518999999716,10.0.2.15,54.93.77.70,TLSv1.2,590,Application Data
1,8.221901999999773,54.93.77.70,10.0.2.15,TCP,60,9001  >  34692 [ACK] Seq=151880163 Ack=8361193 Win=65535 Len=0
1,8.418494999999893,62.210.85.178,10.0.2.15,TLSv1.2,590,Application Data
1,8.427361000000019,10.0.2.15,62.210.85.178,TLSv1.2,590,Application Data
1,8.427819999999883,62.210.85.178,10.0.2.15,TCP,60,9001  >  35978 [ACK] Seq=8329029 Ack=152030403 Win=65535 Len=0
1,8.444606999999905,10.0.2.15,62.210.85.178,TLSv1.2,4124,Application Data
1,8.445154999999886,62.210.85.178,10.0.2.15,TCP,60,9001  >  35978 [ACK] Seq=8329029 Ack=152031863 Win=65535 Len=0
1,8.445193999999901,62.210.85.178,10.0.2.15,TCP,60,9001  >  35978 [ACK] Seq=8329029 Ack=152033323 Win=65535 Len=0
1,8.445199999999659,62.210.85.178,10.0.2.15,TCP,60,9001  >  35978 [ACK] Seq=8329029 Ack=152034473 Win=65535 Len=0
1,8.4453239999998,10.0.2.15,62.210.85.178,TLSv1.2,4124,Application Data
1,8.445588999999927,62.210.85.178,10.0.2.15,TCP,60,9001  >  35978 [ACK] Seq=8329029 Ack=152035933 Win=65535 Len=0
1,8.445604999999887,62.210.85.178,10.0.2.15,TCP,60,9001  >  35978 [ACK] Seq=8329029 Ack=152037393 Win=65535 Len=0
1,8.44560999999976,62.210.85.178,10.0.2.15,TCP,60,9001  >  35978 [ACK] Seq=8329029 Ack=152038543 Win=65535 Len=0
1,8.445804999999837,10.0.2.15,62.210.85.178,TLSv1.2,4124,Application Data
1,8.44594799999959,62.210.85.178,10.0.2.15,TCP,60,9001  >  35978 [ACK] Seq=8329029 Ack=152040003 Win=65535 Len=0
1,8.446031999999832,62.210.85.178,10.0.2.15,TCP,60,9001  >  35978 [ACK] Seq=8329029 Ack=152041463 Win=65535 Len=0
1,8.44604199999958,62.210.85.178,10.0.2.15,TCP,60,9001  >  35978 [ACK] Seq=8329029 Ack=152042613 Win=65535 Len=0
1,8.446105999999872,10.0.2.15,62.210.85.178,TLSv1.2,4124,Application Data
1,8.446198999999979,62.210.85.178,10.0.2.15,TCP,60,9001  >  35978 [ACK] Seq=8329029 Ack=152044073 Win=65535 Len=0
1,8.446207999999842,62.210.85.178,10.0.2.15,TCP,60,9001  >  35978 [ACK] Seq=8329029 Ack=152045533 Win=65535 Len=0
1,8.446211999999832,62.210.85.178,10.0.2.15,TCP,60,9001  >  35978 [ACK] Seq=8329029 Ack=152046683 Win=65535 Len=0
1,8.446249999999964,10.0.2.15,62.210.85.178,TLSv1.2,332,Application Data
1,8.446350999999595,10.0.2.15,62.210.85.178,TCP,2974,35978  >  9001 [ACK] Seq=152046961 Ack=8329029 Win=65535 Len=2920 [TCP segment of a reassembled PDU]
1,8.446421999999984,10.0.2.15,62.210.85.178,TLSv1.2,4434,Application Data [TCP segment of a reassembled PDU]
1,8.446494999999686,10.0.2.15,62.210.85.178,TLSv1.2,2974,Application Data [TCP segment of a reassembled PDU]
1,8.44672300000002,62.210.85.178,10.0.2.15,TCP,60,9001  >  35978 [ACK] Seq=8329029 Ack=152046961 Win=65535 Len=0
1,8.446739999999863,62.210.85.178,10.0.2.15,TCP,60,9001  >  35978 [ACK] Seq=8329029 Ack=152048421 Win=65535 Len=0
1,8.446744999999737,62.210.85.178,10.0.2.15,TCP,60,9001  >  35978 [ACK] Seq=8329029 Ack=152049881 Win=65535 Len=0
1,8.44674999999961,62.210.85.178,10.0.2.15,TCP,60,9001  >  35978 [ACK] Seq=8329029 Ack=152051341 Win=65535 Len=0
1,8.44675499999994,62.210.85.178,10.0.2.15,TCP,60,9001  >  35978 [ACK] Seq=8329029 Ack=152052801 Win=65535 Len=0
1,8.446758999999929,62.210.85.178,10.0.2.15,TCP,60,9001  >  35978 [ACK] Seq=8329029 Ack=152054261 Win=65535 Len=0
1,8.446762999999919,62.210.85.178,10.0.2.15,TCP,60,9001  >  35978 [ACK] Seq=8329029 Ack=152055721 Win=65535 Len=0
1,8.446767999999793,62.210.85.178,10.0.2.15,TCP,60,9001  >  35978 [ACK] Seq=8329029 Ack=152057181 Win=65535 Len=0
1,8.446837999999843,10.0.2.15,62.210.85.178,TLSv1.2,694,Application Data
1,8.449319999999716,62.210.85.178,10.0.2.15,TCP,60,9001  >  35978 [ACK] Seq=8329029 Ack=152057821 Win=65535 Len=0
1,8.45689399999992,10.0.2.15,62.210.85.178,TLSv1.2,4124,Application Data
1,8.457016999999723,62.210.85.178,10.0.2.15,TCP,60,9001  >  35978 [ACK] Seq=8329029 Ack=152059281 Win=65535 Len=0
1,8.457034999999905,62.210.85.178,10.0.2.15,TCP,60,9001  >  35978 [ACK] Seq=8329029 Ack=152060741 Win=65535 Len=0
1,8.457038999999895,62.210.85.178,10.0.2.15,TCP,60,9001  >  35978 [ACK] Seq=8329029 Ack=152061891 Win=65535 Len=0
1,8.45710199999985,10.0.2.15,62.210.85.178,TLSv1.2,4124,Application Data
1,8.45717999999988,10.0.2.15,62.210.85.178,TCP,2974,35978  >  9001 [ACK] Seq=152065961 Ack=8329029 Win=65535 Len=2920 [TCP segment of a reassembled PDU]
1,8.457222999999885,62.210.85.178,10.0.2.15,TCP,60,9001  >  35978 [ACK] Seq=8329029 Ack=152063351 Win=65535 Len=0
1,8.457229999999981,62.210.85.178,10.0.2.15,TCP,60,9001  >  35978 [ACK] Seq=8329029 Ack=152064811 Win=65535 Len=0
1,8.457234999999855,62.210.85.178,10.0.2.15,TCP,60,9001  >  35978 [ACK] Seq=8329029 Ack=152065961 Win=65535 Len=0
1,8.457239999999729,62.210.85.178,10.0.2.15,TCP,60,9001  >  35978 [ACK] Seq=8329029 Ack=152067421 Win=65535 Len=0
1,8.457243999999719,62.210.85.178,10.0.2.15,TCP,60,9001  >  35978 [ACK] Seq=8329029 Ack=152068881 Win=65535 Len=0
1,8.457284999999956,10.0.2.15,62.210.85.178,TLSv1.2,1204,Application Data
1,8.457360999999764,62.210.85.178,10.0.2.15,TCP,60,9001  >  35978 [ACK] Seq=8329029 Ack=152070031 Win=65535 Len=0
1,8.457406999999876,10.0.2.15,62.210.85.178,TLSv1.2,4124,Application Data
1,8.457488000000012,62.210.85.178,10.0.2.15,TCP,60,9001  >  35978 [ACK] Seq=8329029 Ack=152071491 Win=65535 Len=0
1,8.457496999999876,62.210.85.178,10.0.2.15,TCP,60,9001  >  35978 [ACK] Seq=8329029 Ack=152072951 Win=65535 Len=0
1,8.45750199999975,62.210.85.178,10.0.2.15,TCP,60,9001  >  35978 [ACK] Seq=8329029 Ack=152074101 Win=65535 Len=0
1,8.457537999999658,10.0.2.15,62.210.85.178,TLSv1.2,332,Application Data
1,8.457578999999896,62.210.85.178,10.0.2.15,TCP,60,9001  >  35978 [ACK] Seq=8329029 Ack=152074379 Win=65535 Len=0
1,8.457635999999638,10.0.2.15,62.210.85.178,TLSv1.2,3160,Application Data
1,8.457679999999982,62.210.85.178,10.0.2.15,TCP,60,9001  >  35978 [ACK] Seq=8329029 Ack=152075839 Win=65535 Len=0
1,8.457686999999623,62.210.85.178,10.0.2.15,TCP,60,9001  >  35978 [ACK] Seq=8329029 Ack=152077299 Win=65535 Len=0
1,8.457690999999613,62.210.85.178,10.0.2.15,TCP,60,9001  >  35978 [ACK] Seq=8329029 Ack=152077485 Win=65535 Len=0
1,8.589592999999695,54.93.77.70,10.0.2.15,TLSv1.2,3674,Application Data
1,8.589784999999665,10.0.2.15,54.93.77.70,TCP,54,34692  >  9001 [ACK] Seq=8361193 Ack=151883783 Win=65535 Len=0
1,8.593543999999838,54.93.77.70,10.0.2.15,TCP,1502,"9001  >  34692 [PSH, ACK] Seq=151883783 Ack=8361193 Win=65535 Len=1448 [TCP segment of a reassembled PDU]"
1,8.59368799999993,10.0.2.15,54.93.77.70,TCP,54,34692  >  9001 [ACK] Seq=8361193 Ack=151885231 Win=65535 Len=0
1,8.598237999999583,54.93.77.70,10.0.2.15,TCP,1502,"9001  >  34692 [PSH, ACK] Seq=151885231 Ack=8361193 Win=65535 Len=1448 [TCP segment of a reassembled PDU]"
1,8.598591999999826,10.0.2.15,54.93.77.70,TCP,54,34692  >  9001 [ACK] Seq=8361193 Ack=151886679 Win=65535 Len=0
1,8.606848999999784,54.93.77.70,10.0.2.15,TLSv1.2,5846,"Application Data, Application Data"
1,8.60700799999995,10.0.2.15,54.93.77.70,TCP,54,34692  >  9001 [ACK] Seq=8361193 Ack=151892471 Win=65535 Len=0
1,8.612082999999984,54.93.77.70,10.0.2.15,TLSv1.2,1502,Application Data [TCP segment of a reassembled PDU]
1,8.612197999999808,10.0.2.15,54.93.77.70,TCP,54,34692  >  9001 [ACK] Seq=8361193 Ack=151893919 Win=65535 Len=0
1,8.62839699999995,54.93.77.70,10.0.2.15,TLSv1.2,6498,"Application Data, Application Data, Application Data"
1,8.628453999999692,54.93.77.70,10.0.2.15,TCP,1502,"9001  >  34692 [PSH, ACK] Seq=151900363 Ack=8361193 Win=65535 Len=1448 [TCP segment of a reassembled PDU]"
1,8.633986999999706,10.0.2.15,54.93.77.70,TCP,54,34692  >  9001 [ACK] Seq=8361193 Ack=151901811 Win=65535 Len=0
1,8.636057999999593,54.93.77.70,10.0.2.15,TLSv1.2,5846,Application Data [TCP segment of a reassembled PDU]
1,8.636219999999867,10.0.2.15,54.93.77.70,TCP,54,34692  >  9001 [ACK] Seq=8361193 Ack=151907603 Win=65535 Len=0
1,8.645966999999928,54.93.77.70,10.0.2.15,TLSv1.2,2950,Application Data [TCP segment of a reassembled PDU]
1,8.646148999999696,10.0.2.15,54.93.77.70,TCP,54,34692  >  9001 [ACK] Seq=8361193 Ack=151910499 Win=65535 Len=0
1,8.646698000000015,10.0.2.15,54.93.77.70,TLSv1.2,590,Application Data
1,8.64696399999957,54.93.77.70,10.0.2.15,TCP,60,9001  >  34692 [ACK] Seq=151910499 Ack=8361729 Win=65535 Len=0
1,8.652964999999767,54.93.77.70,10.0.2.15,TLSv1.2,4398,Application Data [TCP segment of a reassembled PDU]
1,8.653366000000005,10.0.2.15,54.93.77.70,TCP,54,34692  >  9001 [ACK] Seq=8361729 Ack=151914843 Win=65535 Len=0
1,8.666757999999845,54.93.77.70,10.0.2.15,TLSv1.2,2950,Application Data [TCP segment of a reassembled PDU]
1,8.666822999999567,54.93.77.70,10.0.2.15,TLSv1.2,2950,Application Data [TCP segment of a reassembled PDU]
1,8.666838999999982,54.93.77.70,10.0.2.15,TLSv1.2,2530,Application Data
1,8.666905999999926,10.0.2.15,54.93.77.70,TCP,54,34692  >  9001 [ACK] Seq=8361729 Ack=151917739 Win=65535 Len=0
1,8.667050000000017,10.0.2.15,54.93.77.70,TCP,54,34692  >  9001 [ACK] Seq=8361729 Ack=151923111 Win=65535 Len=0
1,8.674673999999868,54.93.77.70,10.0.2.15,TCP,1502,"9001  >  34692 [PSH, ACK] Seq=151923111 Ack=8361729 Win=65535 Len=1448 [TCP segment of a reassembled PDU]"
1,8.674859999999626,10.0.2.15,54.93.77.70,TCP,54,34692  >  9001 [ACK] Seq=8361729 Ack=151924559 Win=65535 Len=0
1,8.690902999999707,54.93.77.70,10.0.2.15,TLSv1.2,2950,Application Data [TCP segment of a reassembled PDU]
1,8.691257999999834,10.0.2.15,54.93.77.70,TCP,54,34692  >  9001 [ACK] Seq=8361729 Ack=151927455 Win=65535 Len=0
1,8.69153899999992,10.0.2.15,54.93.77.70,TLSv1.2,590,Application Data
1,8.691687000000002,54.93.77.70,10.0.2.15,TCP,60,9001  >  34692 [ACK] Seq=151927455 Ack=8362265 Win=65535 Len=0
1,8.711293999999725,54.93.77.70,10.0.2.15,TLSv1.2,380,Application Data
1,8.719454999999925,10.0.2.15,54.93.77.70,TLSv1.2,590,Application Data
1,8.71964799999978,54.93.77.70,10.0.2.15,TCP,60,9001  >  34692 [ACK] Seq=151927781 Ack=8362801 Win=65535 Len=0
1,8.80151799999976,62.210.85.178,10.0.2.15,TLSv1.2,590,Application Data
1,8.843993999999839,10.0.2.15,62.210.85.178,TCP,54,35978  >  9001 [ACK] Seq=152077485 Ack=8329565 Win=65535 Len=0
1,9.242780999999923,62.210.85.178,10.0.2.15,TLSv1.2,1104,Application Data
1,9.243441999999959,10.0.2.15,62.210.85.178,TCP,54,35978  >  9001 [ACK] Seq=152077485 Ack=8330615 Win=65535 Len=0
1,9.244624999999814,10.0.2.15,62.210.85.178,TLSv1.2,590,Application Data
1,9.244877999999972,62.210.85.178,10.0.2.15,TCP,60,9001  >  35978 [ACK] Seq=8330615 Ack=152078021 Win=65535 Len=0
1,9.852210999999897,54.93.77.70,10.0.2.15,TLSv1.2,590,Application Data
1,9.852722999999969,10.0.2.15,54.93.77.70,TLSv1.2,590,Application Data
1,9.85288700000001,54.93.77.70,10.0.2.15,TCP,60,9001  >  34692 [ACK] Seq=151928317 Ack=8363337 Win=65535 Len=0
1,10.159327999999732,62.210.85.178,10.0.2.15,TLSv1.2,590,Application Data
1,10.165240999999696,10.0.2.15,62.210.85.178,TLSv1.2,590,Application Data
1,10.165380999999797,62.210.85.178,10.0.2.15,TCP,60,9001  >  35978 [ACK] Seq=8331151 Ack=152078557 Win=65535 Len=0
1,10.181578999999601,10.0.2.15,62.210.85.178,TLSv1.2,4124,Application Data
1,10.181814999999915,10.0.2.15,62.210.85.178,TCP,2974,35978  >  9001 [ACK] Seq=152082627 Ack=8331151 Win=65535 Len=2920 [TCP segment of a reassembled PDU]
1,10.181912000000011,62.210.85.178,10.0.2.15,TCP,60,9001  >  35978 [ACK] Seq=8331151 Ack=152080017 Win=65535 Len=0
1,10.181929999999738,62.210.85.178,10.0.2.15,TCP,60,9001  >  35978 [ACK] Seq=8331151 Ack=152081477 Win=65535 Len=0
1,10.182007999999769,62.210.85.178,10.0.2.15,TCP,60,9001  >  35978 [ACK] Seq=8331151 Ack=152082627 Win=65535 Len=0
1,10.182012999999642,62.210.85.178,10.0.2.15,TCP,60,9001  >  35978 [ACK] Seq=8331151 Ack=152084087 Win=65535 Len=0
1,10.182015999999749,62.210.85.178,10.0.2.15,TCP,60,9001  >  35978 [ACK] Seq=8331151 Ack=152085547 Win=65535 Len=0
1,10.18207799999982,10.0.2.15,62.210.85.178,TLSv1.2,1204,Application Data
1,10.182129999999688,62.210.85.178,10.0.2.15,TCP,60,9001  >  35978 [ACK] Seq=8331151 Ack=152086697 Win=65535 Len=0
1,10.182203999999729,10.0.2.15,62.210.85.178,TLSv1.2,4124,Application Data
1,10.182270999999673,62.210.85.178,10.0.2.15,TCP,60,9001  >  35978 [ACK] Seq=8331151 Ack=152088157 Win=65535 Len=0
1,10.182287999999971,62.210.85.178,10.0.2.15,TCP,60,9001  >  35978 [ACK] Seq=8331151 Ack=152089617 Win=65535 Len=0
1,10.182293999999729,62.210.85.178,10.0.2.15,TCP,60,9001  >  35978 [ACK] Seq=8331151 Ack=152090767 Win=65535 Len=0
1,10.182338999999956,10.0.2.15,62.210.85.178,TLSv1.2,2838,Application Data
1,10.182528999999704,62.210.85.178,10.0.2.15,TCP,60,9001  >  35978 [ACK] Seq=8331151 Ack=152092227 Win=65535 Len=0
1,10.182586999999785,62.210.85.178,10.0.2.15,TCP,60,9001  >  35978 [ACK] Seq=8331151 Ack=152093551 Win=65535 Len=0
1,10.28036899999961,54.93.77.70,10.0.2.15,TLSv1.2,590,Application Data
1,10.323817999999847,10.0.2.15,54.93.77.70,TCP,54,34692  >  9001 [ACK] Seq=8363337 Ack=151928853 Win=65535 Len=0
1,10.365114999999605,54.93.77.70,10.0.2.15,TLSv1.2,3674,Application Data
1,10.365256999999929,10.0.2.15,54.93.77.70,TCP,54,34692  >  9001 [ACK] Seq=8363337 Ack=151932473 Win=65535 Len=0
1,10.376274999999623,54.93.77.70,10.0.2.15,TCP,2950,"9001  >  34692 [PSH, ACK] Seq=151932473 Ack=8363337 Win=65535 Len=2896 [TCP segment of a reassembled PDU]"
1,10.3765199999998,10.0.2.15,54.93.77.70,TCP,54,34692  >  9001 [ACK] Seq=8363337 Ack=151935369 Win=65535 Len=0
1,10.381647999999586,54.93.77.70,10.0.2.15,TLSv1.2,778,Application Data
1,10.381750999999895,10.0.2.15,54.93.77.70,TCP,54,34692  >  9001 [ACK] Seq=8363337 Ack=151936093 Win=65535 Len=0
1,10.388016999999763,54.93.77.70,10.0.2.15,TCP,2950,"9001  >  34692 [PSH, ACK] Seq=151936093 Ack=8363337 Win=65535 Len=2896 [TCP segment of a reassembled PDU]"
1,10.388111999999637,10.0.2.15,54.93.77.70,TCP,54,34692  >  9001 [ACK] Seq=8363337 Ack=151938989 Win=65535 Len=0
1,10.399091999999655,54.93.77.70,10.0.2.15,TLSv1.2,778,Application Data
1,10.399189999999635,10.0.2.15,54.93.77.70,TCP,54,34692  >  9001 [ACK] Seq=8363337 Ack=151939713 Win=65535 Len=0
1,10.41504599999962,54.93.77.70,10.0.2.15,TLSv1.2,1104,Application Data
1,10.415146999999706,10.0.2.15,54.93.77.70,TCP,54,34692  >  9001 [ACK] Seq=8363337 Ack=151940763 Win=65535 Len=0
1,11.38837199999989,54.93.77.70,10.0.2.15,TCP,2950,"9001  >  34692 [PSH, ACK] Seq=151940763 Ack=8363337 Win=65535 Len=2896 [TCP segment of a reassembled PDU]"
1,11.388517999999749,10.0.2.15,54.93.77.70,TCP,54,34692  >  9001 [ACK] Seq=8363337 Ack=151943659 Win=65535 Len=0
1,11.391038999999637,54.93.77.70,10.0.2.15,TLSv1.2,264,Application Data
1,11.39113499999985,10.0.2.15,54.93.77.70,TCP,54,34692  >  9001 [ACK] Seq=8363337 Ack=151943869 Win=65535 Len=0
1,11.394300999999814,10.0.2.15,54.93.77.70,TLSv1.2,590,Application Data
1,11.395203999999922,54.93.77.70,10.0.2.15,TCP,60,9001  >  34692 [ACK] Seq=151943869 Ack=8363873 Win=65535 Len=0
1,11.574823999999808,62.210.85.178,10.0.2.15,TLSv1.2,590,Application Data
1,11.577523999999812,10.0.2.15,62.210.85.178,TLSv1.2,590,Application Data
1,11.578359999999975,62.210.85.178,10.0.2.15,TCP,60,9001  >  35978 [ACK] Seq=8331687 Ack=152094087 Win=65535 Len=0
1,11.741477999999915,54.93.77.70,10.0.2.15,TLSv1.2,590,Application Data
1,11.743919000000005,10.0.2.15,54.93.77.70,TLSv1.2,590,Application Data
1,11.744444999999814,54.93.77.70,10.0.2.15,TCP,60,9001  >  34692 [ACK] Seq=151944405 Ack=8364409 Win=65535 Len=0
1,12.3109529999997,62.210.85.178,10.0.2.15,TLSv1.2,590,Application Data
1,12.32400699999971,10.0.2.15,62.210.85.178,TLSv1.2,590,Application Data
1,12.32418299999972,62.210.85.178,10.0.2.15,TCP,60,9001  >  35978 [ACK] Seq=8332223 Ack=152094623 Win=65535 Len=0
1,12.336538999999902,10.0.2.15,62.210.85.178,TLSv1.2,4124,Application Data
1,12.336661999999706,10.0.2.15,62.210.85.178,TCP,2974,35978  >  9001 [ACK] Seq=152098693 Ack=8332223 Win=65535 Len=2920 [TCP segment of a reassembled PDU]
1,12.336741999999958,62.210.85.178,10.0.2.15,TCP,60,9001  >  35978 [ACK] Seq=8332223 Ack=152096083 Win=65535 Len=0
1,12.33675699999958,62.210.85.178,10.0.2.15,TCP,60,9001  >  35978 [ACK] Seq=8332223 Ack=152097543 Win=65535 Len=0
1,12.336762999999792,62.210.85.178,10.0.2.15,TCP,60,9001  >  35978 [ACK] Seq=8332223 Ack=152098693 Win=65535 Len=0
1,12.336766999999782,62.210.85.178,10.0.2.15,TCP,60,9001  >  35978 [ACK] Seq=8332223 Ack=152100153 Win=65535 Len=0
1,12.336771999999655,62.210.85.178,10.0.2.15,TCP,60,9001  >  35978 [ACK] Seq=8332223 Ack=152101613 Win=65535 Len=0
1,12.33681099999967,10.0.2.15,62.210.85.178,TLSv1.2,1204,Application Data
1,12.336853999999676,62.210.85.178,10.0.2.15,TCP,60,9001  >  35978 [ACK] Seq=8332223 Ack=152102763 Win=65535 Len=0
1,12.336899999999787,10.0.2.15,62.210.85.178,TLSv1.2,4124,Application Data
1,12.336941999999908,62.210.85.178,10.0.2.15,TCP,60,9001  >  35978 [ACK] Seq=8332223 Ack=152104223 Win=65535 Len=0
1,12.336949999999888,62.210.85.178,10.0.2.15,TCP,60,9001  >  35978 [ACK] Seq=8332223 Ack=152105683 Win=65535 Len=0
1,12.336953999999878,62.210.85.178,10.0.2.15,TCP,60,9001  >  35978 [ACK] Seq=8332223 Ack=152106833 Win=65535 Len=0
1,12.336993999999777,10.0.2.15,62.210.85.178,TLSv1.2,4124,Application Data
1,12.337032999999792,62.210.85.178,10.0.2.15,TCP,60,9001  >  35978 [ACK] Seq=8332223 Ack=152108293 Win=65535 Len=0
1,12.337041999999656,62.210.85.178,10.0.2.15,TCP,60,9001  >  35978 [ACK] Seq=8332223 Ack=152109753 Win=65535 Len=0
1,12.337118999999802,10.0.2.15,62.210.85.178,TLSv1.2,2974,Application Data
1,12.337162999999691,62.210.85.178,10.0.2.15,TCP,60,9001  >  35978 [ACK] Seq=8332223 Ack=152110903 Win=65535 Len=0
1,12.337170999999671,62.210.85.178,10.0.2.15,TCP,60,9001  >  35978 [ACK] Seq=8332223 Ack=152112363 Win=65535 Len=0
1,12.337174999999661,62.210.85.178,10.0.2.15,TCP,60,9001  >  35978 [ACK] Seq=8332223 Ack=152113823 Win=65535 Len=0
1,12.337213999999676,10.0.2.15,62.210.85.178,TLSv1.2,1226,Application Data
1,12.337290999999823,10.0.2.15,62.210.85.178,TCP,2974,35978  >  9001 [ACK] Seq=152114995 Ack=8332223 Win=65535 Len=2920 [TCP segment of a reassembled PDU]
1,12.337336999999934,62.210.85.178,10.0.2.15,TCP,60,9001  >  35978 [ACK] Seq=8332223 Ack=152114995 Win=65535 Len=0
1,12.337345999999798,62.210.85.178,10.0.2.15,TCP,60,9001  >  35978 [ACK] Seq=8332223 Ack=152116455 Win=65535 Len=0
1,12.33735200000001,62.210.85.178,10.0.2.15,TCP,60,9001  >  35978 [ACK] Seq=8332223 Ack=152117915 Win=65535 Len=0
1,12.337384999999813,10.0.2.15,62.210.85.178,TLSv1.2,1204,Application Data
1,12.337422999999944,62.210.85.178,10.0.2.15,TCP,60,9001  >  35978 [ACK] Seq=8332223 Ack=152119065 Win=65535 Len=0
1,12.337467999999717,10.0.2.15,62.210.85.178,TLSv1.2,3030,Application Data
1,12.337536,62.210.85.178,10.0.2.15,TCP,60,9001  >  35978 [ACK] Seq=8332223 Ack=152120525 Win=65535 Len=0
1,12.33754399999998,62.210.85.178,10.0.2.15,TCP,60,9001  >  35978 [ACK] Seq=8332223 Ack=152121985 Win=65535 Len=0
1,12.33754799999997,62.210.85.178,10.0.2.15,TCP,60,9001  >  35978 [ACK] Seq=8332223 Ack=152122041 Win=65535 Len=0
1,12.347004999999626,10.0.2.15,62.210.85.178,TLSv1.2,4124,Application Data
1,12.347320999999738,62.210.85.178,10.0.2.15,TCP,60,9001  >  35978 [ACK] Seq=8332223 Ack=152123501 Win=65535 Len=0
1,12.347374999999829,62.210.85.178,10.0.2.15,TCP,60,9001  >  35978 [ACK] Seq=8332223 Ack=152124961 Win=65535 Len=0
1,12.347384999999576,62.210.85.178,10.0.2.15,TCP,60,9001  >  35978 [ACK] Seq=8332223 Ack=152126111 Win=65535 Len=0
1,12.347544999999627,10.0.2.15,62.210.85.178,TLSv1.2,4124,Application Data
1,12.347729999999956,62.210.85.178,10.0.2.15,TCP,60,9001  >  35978 [ACK] Seq=8332223 Ack=152127571 Win=65535 Len=0
1,12.347827999999936,62.210.85.178,10.0.2.15,TCP,60,9001  >  35978 [ACK] Seq=8332223 Ack=152129031 Win=65535 Len=0
1,12.347835999999916,62.210.85.178,10.0.2.15,TCP,60,9001  >  35978 [ACK] Seq=8332223 Ack=152130181 Win=65535 Len=0
1,12.34847499999978,10.0.2.15,62.210.85.178,TLSv1.2,4124,Application Data
1,12.348700999999892,62.210.85.178,10.0.2.15,TCP,60,9001  >  35978 [ACK] Seq=8332223 Ack=152131641 Win=65535 Len=0
1,12.348718999999619,62.210.85.178,10.0.2.15,TCP,60,9001  >  35978 [ACK] Seq=8332223 Ack=152133101 Win=65535 Len=0
1,12.348723999999947,62.210.85.178,10.0.2.15,TCP,60,9001  >  35978 [ACK] Seq=8332223 Ack=152134251 Win=65535 Len=0
1,12.348798999999872,10.0.2.15,62.210.85.178,TLSv1.2,4124,Application Data
1,12.348987999999736,62.210.85.178,10.0.2.15,TCP,60,9001  >  35978 [ACK] Seq=8332223 Ack=152135711 Win=65535 Len=0
1,12.349005999999918,62.210.85.178,10.0.2.15,TCP,60,9001  >  35978 [ACK] Seq=8332223 Ack=152137171 Win=65535 Len=0
1,12.349013000000014,62.210.85.178,10.0.2.15,TCP,60,9001  >  35978 [ACK] Seq=8332223 Ack=152138321 Win=65535 Len=0
1,12.349141999999574,10.0.2.15,62.210.85.178,TLSv1.2,332,Application Data
1,12.349190999999792,62.210.85.178,10.0.2.15,TCP,60,9001  >  35978 [ACK] Seq=8332223 Ack=152138599 Win=65535 Len=0
1,12.349291999999878,10.0.2.15,62.210.85.178,TLSv1.2,3868,Application Data
1,12.349347999999736,62.210.85.178,10.0.2.15,TCP,60,9001  >  35978 [ACK] Seq=8332223 Ack=152140059 Win=65535 Len=0
1,12.349358999999822,62.210.85.178,10.0.2.15,TCP,60,9001  >  35978 [ACK] Seq=8332223 Ack=152141519 Win=65535 Len=0
1,12.349365999999918,62.210.85.178,10.0.2.15,TCP,60,9001  >  35978 [ACK] Seq=8332223 Ack=152142413 Win=65535 Len=0
1,12.349424999999883,10.0.2.15,62.210.85.178,TLSv1.2,4124,Application Data
1,12.349475999999868,62.210.85.178,10.0.2.15,TCP,60,9001  >  35978 [ACK] Seq=8332223 Ack=152143873 Win=65535 Len=0
1,12.349484999999731,62.210.85.178,10.0.2.15,TCP,60,9001  >  35978 [ACK] Seq=8332223 Ack=152145333 Win=65535 Len=0
1,12.349488999999721,62.210.85.178,10.0.2.15,TCP,60,9001  >  35978 [ACK] Seq=8332223 Ack=152146483 Win=65535 Len=0
1,12.349542999999812,10.0.2.15,62.210.85.178,TLSv1.2,3030,Application Data
1,12.349637999999686,62.210.85.178,10.0.2.15,TCP,60,9001  >  35978 [ACK] Seq=8332223 Ack=152147943 Win=65535 Len=0
1,12.349647999999888,62.210.85.178,10.0.2.15,TCP,60,9001  >  35978 [ACK] Seq=8332223 Ack=152149403 Win=65535 Len=0
1,12.349651999999878,62.210.85.178,10.0.2.15,TCP,60,9001  >  35978 [ACK] Seq=8332223 Ack=152149459 Win=65535 Len=0
1,12.360487999999805,10.0.2.15,62.210.85.178,TLSv1.2,4124,Application Data
1,12.36065299999973,62.210.85.178,10.0.2.15,TCP,60,9001  >  35978 [ACK] Seq=8332223 Ack=152150919 Win=65535 Len=0
1,12.360670999999911,62.210.85.178,10.0.2.15,TCP,60,9001  >  35978 [ACK] Seq=8332223 Ack=152152379 Win=65535 Len=0
1,12.360674999999901,62.210.85.178,10.0.2.15,TCP,60,9001  >  35978 [ACK] Seq=8332223 Ack=152153529 Win=65535 Len=0
1,12.360707999999704,10.0.2.15,62.210.85.178,TCP,2974,35978  >  9001 [ACK] Seq=152153529 Ack=8332223 Win=65535 Len=2920 [TCP segment of a reassembled PDU]
1,12.360795999999937,10.0.2.15,62.210.85.178,TLSv1.2,1204,Application Data
1,12.360849999999573,62.210.85.178,10.0.2.15,TCP,60,9001  >  35978 [ACK] Seq=8332223 Ack=152154989 Win=65535 Len=0
1,12.360861999999997,62.210.85.178,10.0.2.15,TCP,60,9001  >  35978 [ACK] Seq=8332223 Ack=152156449 Win=65535 Len=0
1,12.360868999999639,62.210.85.178,10.0.2.15,TCP,60,9001  >  35978 [ACK] Seq=8332223 Ack=152157599 Win=65535 Len=0
1,12.360933999999816,10.0.2.15,62.210.85.178,TLSv1.2,4124,Application Data
1,12.361018999999942,62.210.85.178,10.0.2.15,TCP,60,9001  >  35978 [ACK] Seq=8332223 Ack=152159059 Win=65535 Len=0
1,12.361035999999785,62.210.85.178,10.0.2.15,TCP,60,9001  >  35978 [ACK] Seq=8332223 Ack=152160519 Win=65535 Len=0
1,12.361042999999881,62.210.85.178,10.0.2.15,TCP,60,9001  >  35978 [ACK] Seq=8332223 Ack=152161669 Win=65535 Len=0
1,12.361109999999826,10.0.2.15,62.210.85.178,TLSv1.2,4124,Application Data
1,12.361181999999644,62.210.85.178,10.0.2.15,TCP,60,9001  >  35978 [ACK] Seq=8332223 Ack=152163129 Win=65535 Len=0
1,12.361191999999846,62.210.85.178,10.0.2.15,TCP,60,9001  >  35978 [ACK] Seq=8332223 Ack=152164589 Win=65535 Len=0
1,12.361195999999836,62.210.85.178,10.0.2.15,TCP,60,9001  >  35978 [ACK] Seq=8332223 Ack=152165739 Win=65535 Len=0
1,12.361235999999735,10.0.2.15,62.210.85.178,TLSv1.2,332,Application Data
1,12.36296799999991,62.210.85.178,10.0.2.15,TCP,60,9001  >  35978 [ACK] Seq=8332223 Ack=152166017 Win=65535 Len=0
1,12.36343799999986,10.0.2.15,62.210.85.178,TLSv1.2,3868,Application Data
1,12.363729999999578,62.210.85.178,10.0.2.15,TCP,60,9001  >  35978 [ACK] Seq=8332223 Ack=152167477 Win=65535 Len=0
1,12.363785000000007,62.210.85.178,10.0.2.15,TCP,60,9001  >  35978 [ACK] Seq=8332223 Ack=152168937 Win=65535 Len=0
1,12.363791999999648,62.210.85.178,10.0.2.15,TCP,60,9001  >  35978 [ACK] Seq=8332223 Ack=152169831 Win=65535 Len=0
1,12.363937999999962,10.0.2.15,62.210.85.178,TLSv1.2,4124,Application Data
1,12.364034999999603,62.210.85.178,10.0.2.15,TCP,60,9001  >  35978 [ACK] Seq=8332223 Ack=152171291 Win=65535 Len=0
1,12.364046999999573,62.210.85.178,10.0.2.15,TCP,60,9001  >  35978 [ACK] Seq=8332223 Ack=152172751 Win=65535 Len=0
1,12.364051999999901,62.210.85.178,10.0.2.15,TCP,60,9001  >  35978 [ACK] Seq=8332223 Ack=152173901 Win=65535 Len=0
1,12.364122999999836,10.0.2.15,62.210.85.178,TLSv1.2,1488,Application Data
1,12.364314999999806,62.210.85.178,10.0.2.15,TCP,60,9001  >  35978 [ACK] Seq=8332223 Ack=152175335 Win=65535 Len=0
1,12.50774599999977,10.0.2.15,193.246.105.82,TCP,54,[TCP Keep-Alive] 42316  >  443 [ACK] Seq=1969 Ack=786 Win=32160 Len=0
1,12.50786799999969,193.246.105.82,10.0.2.15,TCP,60,[TCP Keep-Alive ACK] 443  >  42316 [ACK] Seq=786 Ack=1970 Win=65535 Len=0
1,12.617343999999775,54.93.77.70,10.0.2.15,TCP,2950,"9001  >  34692 [PSH, ACK] Seq=151944405 Ack=8364409 Win=65535 Len=2896 [TCP segment of a reassembled PDU]"
1,12.617948999999953,10.0.2.15,54.93.77.70,TCP,54,34692  >  9001 [ACK] Seq=8364409 Ack=151947301 Win=65535 Len=0
1,12.620013999999628,54.93.77.70,10.0.2.15,TLSv1.2,778,Application Data
1,12.621450999999979,54.93.77.70,10.0.2.15,TCP,2950,"9001  >  34692 [PSH, ACK] Seq=151948025 Ack=8364409 Win=65535 Len=2896 [TCP segment of a reassembled PDU]"
1,12.621518999999807,10.0.2.15,54.93.77.70,TCP,54,34692  >  9001 [ACK] Seq=8364409 Ack=151950921 Win=65535 Len=0
1,12.636221999999634,54.93.77.70,10.0.2.15,TLSv1.2,1314,"Application Data, Application Data"
1,12.655126999999993,54.93.77.70,10.0.2.15,TLSv1.2,3160,Application Data
1,12.655283999999938,10.0.2.15,54.93.77.70,TCP,54,34692  >  9001 [ACK] Seq=8364409 Ack=151955287 Win=65535 Len=0
1,12.693193999999949,54.93.77.70,10.0.2.15,TCP,2950,"9001  >  34692 [PSH, ACK] Seq=151955287 Ack=8364409 Win=65535 Len=2896 [TCP segment of a reassembled PDU]"
1,12.693347999999787,10.0.2.15,54.93.77.70,TCP,54,34692  >  9001 [ACK] Seq=8364409 Ack=151958183 Win=65535 Len=0
1,12.694446999999855,54.93.77.70,10.0.2.15,TLSv1.2,778,Application Data
1,12.703281999999945,54.93.77.70,10.0.2.15,TCP,2950,"9001  >  34692 [PSH, ACK] Seq=151958907 Ack=8364409 Win=65535 Len=2896 [TCP segment of a reassembled PDU]"
1,12.703400999999758,10.0.2.15,54.93.77.70,TCP,54,34692  >  9001 [ACK] Seq=8364409 Ack=151961803 Win=65535 Len=0
1,12.711415999999645,54.93.77.70,10.0.2.15,TLSv1.2,778,Application Data
1,12.728598999999576,54.93.77.70,10.0.2.15,TLSv1.2,2132,Application Data
1,12.728707999999642,10.0.2.15,54.93.77.70,TCP,54,34692  >  9001 [ACK] Seq=8364409 Ack=151964605 Win=65535 Len=0
1,12.786487999999736,54.93.77.70,10.0.2.15,TLSv1.2,3674,Application Data
1,12.786695999999665,10.0.2.15,54.93.77.70,TCP,54,34692  >  9001 [ACK] Seq=8364409 Ack=151968225 Win=65535 Len=0
1,12.822190999999748,54.93.77.70,10.0.2.15,TCP,2950,"9001  >  34692 [PSH, ACK] Seq=151968225 Ack=8364409 Win=65535 Len=2896 [TCP segment of a reassembled PDU]"
1,12.822289999999612,10.0.2.15,54.93.77.70,TCP,54,34692  >  9001 [ACK] Seq=8364409 Ack=151971121 Win=65535 Len=0
1,12.823037999999997,54.93.77.70,10.0.2.15,TLSv1.2,778,Application Data
1,12.823257999999896,10.0.2.15,54.93.77.70,TLSv1.2,590,Application Data
1,12.823377999999593,54.93.77.70,10.0.2.15,TCP,60,9001  >  34692 [ACK] Seq=151971845 Ack=8364945 Win=65535 Len=0
1,12.831928999999946,54.93.77.70,10.0.2.15,TCP,2950,"9001  >  34692 [PSH, ACK] Seq=151971845 Ack=8364945 Win=65535 Len=2896 [TCP segment of a reassembled PDU]"
1,12.832952999999634,10.0.2.15,54.93.77.70,TCP,54,34692  >  9001 [ACK] Seq=8364945 Ack=151974741 Win=65535 Len=0
1,12.839321999999811,54.93.77.70,10.0.2.15,TLSv1.2,778,Application Data
1,12.845516999999745,54.93.77.70,10.0.2.15,TCP,2950,"9001  >  34692 [PSH, ACK] Seq=151975465 Ack=8364945 Win=65535 Len=2896 [TCP segment of a reassembled PDU]"
1,12.845644999999877,10.0.2.15,54.93.77.70,TCP,54,34692  >  9001 [ACK] Seq=8364945 Ack=151978361 Win=65535 Len=0
1,12.863080999999966,54.93.77.70,10.0.2.15,TLSv1.2,778,Application Data
1,12.863447999999607,10.0.2.15,54.93.77.70,TLSv1.2,590,Application Data
1,12.86356399999977,54.93.77.70,10.0.2.15,TCP,60,9001  >  34692 [ACK] Seq=151979085 Ack=8365481 Win=65535 Len=0
1,12.893415999999888,54.93.77.70,10.0.2.15,TCP,2950,"9001  >  34692 [PSH, ACK] Seq=151979085 Ack=8365481 Win=65535 Len=2896 [TCP segment of a reassembled PDU]"
1,12.893495999999686,54.93.77.70,10.0.2.15,TLSv1.2,778,Application Data
1,12.893622999999934,10.0.2.15,54.93.77.70,TCP,54,34692  >  9001 [ACK] Seq=8365481 Ack=151982705 Win=65535 Len=0
1,12.952286999999615,54.93.77.70,10.0.2.15,TLSv1.2,590,Application Data
1,12.996752999999899,10.0.2.15,54.93.77.70,TCP,54,34692  >  9001 [ACK] Seq=8365481 Ack=151983241 Win=65535 Len=0
1,12.997332999999799,54.93.77.70,10.0.2.15,TLSv1.2,3160,Application Data
1,12.99739099999988,10.0.2.15,54.93.77.70,TCP,54,34692  >  9001 [ACK] Seq=8365481 Ack=151986347 Win=65535 Len=0
1,13.054410999999618,54.93.77.70,10.0.2.15,TLSv1.2,3674,Application Data
1,13.054529999999886,10.0.2.15,54.93.77.70,TCP,54,34692  >  9001 [ACK] Seq=8365481 Ack=151989967 Win=65535 Len=0
1,13.114231000000018,54.93.77.70,10.0.2.15,TLSv1.2,1104,Application Data
1,13.114441999999599,10.0.2.15,54.93.77.70,TCP,54,34692  >  9001 [ACK] Seq=8365481 Ack=151991017 Win=65535 Len=0
1,13.14188699999977,62.210.85.178,10.0.2.15,TLSv1.2,1104,Application Data
1,13.183846999999787,10.0.2.15,62.210.85.178,TCP,54,35978  >  9001 [ACK] Seq=152175335 Ack=8333273 Win=65535 Len=0
1,13.18696,54.93.77.70,10.0.2.15,TLSv1.2,3674,Application Data
1,13.18714699999964,10.0.2.15,54.93.77.70,TCP,54,34692  >  9001 [ACK] Seq=8365481 Ack=151994637 Win=65535 Len=0
1,13.393685000000005,54.93.77.70,10.0.2.15,TLSv1.2,4398,Application Data
1,13.39382599999999,10.0.2.15,54.93.77.70,TCP,54,34692  >  9001 [ACK] Seq=8365481 Ack=151998981 Win=65535 Len=0
1,13.394138999999996,10.0.2.15,54.93.77.70,TLSv1.2,590,Application Data
1,13.394642999999633,54.93.77.70,10.0.2.15,TLSv1.2,3850,Application Data
1,13.39468799999986,54.93.77.70,10.0.2.15,TCP,1502,"9001  >  34692 [PSH, ACK] Seq=152002777 Ack=8365481 Win=65535 Len=1448 [TCP segment of a reassembled PDU]"
1,13.394693999999618,54.93.77.70,10.0.2.15,TCP,60,9001  >  34692 [ACK] Seq=152004225 Ack=8366017 Win=65535 Len=0
1,13.394786999999724,10.0.2.15,54.93.77.70,TCP,54,34692  >  9001 [ACK] Seq=8366017 Ack=152002777 Win=65535 Len=0
1,13.394933999999921,10.0.2.15,54.93.77.70,TCP,54,34692  >  9001 [ACK] Seq=8366017 Ack=152004225 Win=65535 Len=0
1,13.410277999999835,54.93.77.70,10.0.2.15,TLSv1.2,298,Application Data
1,13.428424999999606,54.93.77.70,10.0.2.15,TLSv1.2,590,Application Data
1,13.428721999999652,10.0.2.15,54.93.77.70,TCP,54,34692  >  9001 [ACK] Seq=8366017 Ack=152005005 Win=65535 Len=0
1,13.465327999999772,54.93.77.70,10.0.2.15,TLSv1.2,2132,Application Data
1,13.465483999999833,10.0.2.15,54.93.77.70,TCP,54,34692  >  9001 [ACK] Seq=8366017 Ack=152007083 Win=65535 Len=0
1,13.641243999999915,54.93.77.70,10.0.2.15,TLSv1.2,1104,Application Data
1,13.64528799999971,54.93.77.70,10.0.2.15,TCP,2950,"9001  >  34692 [PSH, ACK] Seq=152008133 Ack=8366017 Win=65535 Len=2896 [TCP segment of a reassembled PDU]"
1,13.645524999999907,10.0.2.15,54.93.77.70,TCP,54,34692  >  9001 [ACK] Seq=8366017 Ack=152011029 Win=65535 Len=0
1,13.658534999999574,62.210.85.178,10.0.2.15,TLSv1.2,590,Application Data
1,13.658806999999797,10.0.2.15,62.210.85.178,TCP,54,35978  >  9001 [ACK] Seq=152175335 Ack=8333809 Win=65535 Len=0
1,13.66049699999985,54.93.77.70,10.0.2.15,TLSv1.2,778,Application Data
1,13.703799999999774,10.0.2.15,54.93.77.70,TCP,54,34692  >  9001 [ACK] Seq=8366017 Ack=152011753 Win=65535 Len=0
1,13.723038999999972,54.93.77.70,10.0.2.15,TLSv1.2,3674,Application Data
1,13.723169999999755,10.0.2.15,54.93.77.70,TCP,54,34692  >  9001 [ACK] Seq=8366017 Ack=152015373 Win=65535 Len=0
1,13.810375999999906,54.93.77.70,10.0.2.15,TLSv1.2,2132,Application Data
1,13.810493999999835,10.0.2.15,54.93.77.70,TCP,54,34692  >  9001 [ACK] Seq=8366017 Ack=152017451 Win=65535 Len=0
1,13.923160999999709,54.93.77.70,10.0.2.15,TLSv1.2,2132,Application Data
1,13.92324699999972,10.0.2.15,54.93.77.70,TCP,54,34692  >  9001 [ACK] Seq=8366017 Ack=152019529 Win=65535 Len=0
1,14.27983499999982,54.93.77.70,10.0.2.15,TLSv1.2,5260,"Application Data, Application Data, Application Data"
1,14.27994499999977,10.0.2.15,54.93.77.70,TCP,54,34692  >  9001 [ACK] Seq=8366017 Ack=152024735 Win=65535 Len=0
1,14.280390999999781,10.0.2.15,54.93.77.70,TLSv1.2,590,Application Data
1,14.280513999999584,54.93.77.70,10.0.2.15,TCP,60,9001  >  34692 [ACK] Seq=152024735 Ack=8366553 Win=65535 Len=0
1,14.298612999999932,54.93.77.70,10.0.2.15,TLSv1.2,1104,Application Data
1,14.302059999999983,10.0.2.15,54.93.77.70,TLSv1.2,590,Application Data
1,14.302236999999877,54.93.77.70,10.0.2.15,TCP,60,9001  >  34692 [ACK] Seq=152025785 Ack=8367089 Win=65535 Len=0
1,14.449239999999918,62.210.85.178,10.0.2.15,TLSv1.2,590,Application Data
1,14.449350999999751,10.0.2.15,62.210.85.178,TCP,54,35978  >  9001 [ACK] Seq=152175335 Ack=8334345 Win=65535 Len=0
1,14.769485999999688,62.210.85.178,10.0.2.15,TLSv1.2,590,Application Data
1,14.769596999999976,10.0.2.15,62.210.85.178,TCP,54,35978  >  9001 [ACK] Seq=152175335 Ack=8334881 Win=65535 Len=0
1,14.770303999999669,10.0.2.15,62.210.85.178,TLSv1.2,590,Application Data
1,14.77084399999967,62.210.85.178,10.0.2.15,TCP,60,9001  >  35978 [ACK] Seq=8334881 Ack=152175871 Win=65535 Len=0
1,14.973101999999926,54.93.77.70,10.0.2.15,TLSv1.2,590,Application Data
1,14.9736869999997,10.0.2.15,54.93.77.70,TLSv1.2,590,Application Data
1,14.973942999999963,54.93.77.70,10.0.2.15,TCP,60,9001  >  34692 [ACK] Seq=152026321 Ack=8367625 Win=65535 Len=0
1,15.690325999999914,62.210.85.178,10.0.2.15,TLSv1.2,590,Application Data
1,15.698727999999846,10.0.2.15,62.210.85.178,TLSv1.2,590,Application Data
1,15.698942999999872,62.210.85.178,10.0.2.15,TCP,60,9001  >  35978 [ACK] Seq=8335417 Ack=152176407 Win=65535 Len=0
1,15.709854999999607,10.0.2.15,62.210.85.178,TLSv1.2,4124,Application Data
1,15.710128999999597,62.210.85.178,10.0.2.15,TCP,60,9001  >  35978 [ACK] Seq=8335417 Ack=152177867 Win=65535 Len=0
1,15.712387999999919,62.210.85.178,10.0.2.15,TCP,60,9001  >  35978 [ACK] Seq=8335417 Ack=152179327 Win=65535 Len=0
1,15.712427999999818,62.210.85.178,10.0.2.15,TCP,60,9001  >  35978 [ACK] Seq=8335417 Ack=152180477 Win=65535 Len=0
1,15.712721999999758,10.0.2.15,62.210.85.178,TLSv1.2,4124,Application Data
1,15.71291599999995,10.0.2.15,62.210.85.178,TCP,2974,35978  >  9001 [ACK] Seq=152184547 Ack=8335417 Win=65535 Len=2920 [TCP segment of a reassembled PDU]
1,15.71300999999994,10.0.2.15,62.210.85.178,TLSv1.2,4434,Application Data [TCP segment of a reassembled PDU]
1,15.713169999999991,62.210.85.178,10.0.2.15,TCP,60,9001  >  35978 [ACK] Seq=8335417 Ack=152181937 Win=65535 Len=0
1,15.713191999999708,62.210.85.178,10.0.2.15,TCP,60,9001  >  35978 [ACK] Seq=8335417 Ack=152183397 Win=65535 Len=0
1,15.71319799999992,62.210.85.178,10.0.2.15,TCP,60,9001  >  35978 [ACK] Seq=8335417 Ack=152184547 Win=65535 Len=0
1,15.713202999999794,62.210.85.178,10.0.2.15,TCP,60,9001  >  35978 [ACK] Seq=8335417 Ack=152186007 Win=65535 Len=0
1,15.713209000000006,62.210.85.178,10.0.2.15,TCP,60,9001  >  35978 [ACK] Seq=8335417 Ack=152187467 Win=65535 Len=0
1,15.713214999999764,62.210.85.178,10.0.2.15,TCP,60,9001  >  35978 [ACK] Seq=8335417 Ack=152188927 Win=65535 Len=0
1,15.713219999999637,62.210.85.178,10.0.2.15,TCP,60,9001  >  35978 [ACK] Seq=8335417 Ack=152190387 Win=65535 Len=0
1,15.71322599999985,62.210.85.178,10.0.2.15,TCP,60,9001  >  35978 [ACK] Seq=8335417 Ack=152191847 Win=65535 Len=0
1,15.71328799999992,10.0.2.15,62.210.85.178,TLSv1.2,894,Application Data
1,15.713456999999835,10.0.2.15,62.210.85.178,TLSv1.2,2974,Application Data
1,15.713553999999931,62.210.85.178,10.0.2.15,TCP,60,9001  >  35978 [ACK] Seq=8335417 Ack=152192687 Win=65535 Len=0
1,15.713570999999774,62.210.85.178,10.0.2.15,TCP,60,9001  >  35978 [ACK] Seq=8335417 Ack=152194147 Win=65535 Len=0
1,15.713575999999648,62.210.85.178,10.0.2.15,TCP,60,9001  >  35978 [ACK] Seq=8335417 Ack=152195607 Win=65535 Len=0
1,15.713614999999663,10.0.2.15,62.210.85.178,TLSv1.2,1226,Application Data
1,15.713673999999628,62.210.85.178,10.0.2.15,TCP,60,9001  >  35978 [ACK] Seq=8335417 Ack=152196779 Win=65535 Len=0
1,15.713726999999835,10.0.2.15,62.210.85.178,TLSv1.2,4124,Application Data
1,15.713767999999618,62.210.85.178,10.0.2.15,TCP,60,9001  >  35978 [ACK] Seq=8335417 Ack=152198239 Win=65535 Len=0
1,15.713775999999598,62.210.85.178,10.0.2.15,TCP,60,9001  >  35978 [ACK] Seq=8335417 Ack=152199699 Win=65535 Len=0
1,15.713779999999588,62.210.85.178,10.0.2.15,TCP,60,9001  >  35978 [ACK] Seq=8335417 Ack=152200849 Win=65535 Len=0
1,15.713829999999689,10.0.2.15,62.210.85.178,TLSv1.2,3030,Application Data
1,15.713955999999598,62.210.85.178,10.0.2.15,TCP,60,9001  >  35978 [ACK] Seq=8335417 Ack=152202309 Win=65535 Len=0
1,15.71398199999976,62.210.85.178,10.0.2.15,TCP,60,9001  >  35978 [ACK] Seq=8335417 Ack=152203769 Win=65535 Len=0
1,15.713986999999634,62.210.85.178,10.0.2.15,TCP,60,9001  >  35978 [ACK] Seq=8335417 Ack=152203825 Win=65535 Len=0
1,15.719261999999617,10.0.2.15,62.210.85.178,TLSv1.2,4124,Application Data
1,15.719404999999824,62.210.85.178,10.0.2.15,TCP,60,9001  >  35978 [ACK] Seq=8335417 Ack=152205285 Win=65535 Len=0
1,15.71942399999989,62.210.85.178,10.0.2.15,TCP,60,9001  >  35978 [ACK] Seq=8335417 Ack=152206745 Win=65535 Len=0
1,15.719428999999764,62.210.85.178,10.0.2.15,TCP,60,9001  >  35978 [ACK] Seq=8335417 Ack=152207895 Win=65535 Len=0
1,15.719487999999728,10.0.2.15,62.210.85.178,TLSv1.2,4124,Application Data
1,15.719574999999622,62.210.85.178,10.0.2.15,TCP,60,9001  >  35978 [ACK] Seq=8335417 Ack=152209355 Win=65535 Len=0
1,15.719582999999602,62.210.85.178,10.0.2.15,TCP,60,9001  >  35978 [ACK] Seq=8335417 Ack=152210815 Win=65535 Len=0
1,15.71958799999993,62.210.85.178,10.0.2.15,TCP,60,9001  >  35978 [ACK] Seq=8335417 Ack=152211965 Win=65535 Len=0
1,15.719617999999628,10.0.2.15,62.210.85.178,TCP,1514,35978  >  9001 [ACK] Seq=152211965 Ack=8335417 Win=65535 Len=1460 [TCP segment of a reassembled PDU]
1,15.719712999999956,10.0.2.15,62.210.85.178,TLSv1.2,800,Application Data
1,15.719760999999835,62.210.85.178,10.0.2.15,TCP,60,9001  >  35978 [ACK] Seq=8335417 Ack=152213425 Win=65535 Len=0
1,15.71977599999991,62.210.85.178,10.0.2.15,TCP,60,9001  >  35978 [ACK] Seq=8335417 Ack=152214171 Win=65535 Len=0
1,15.809943999999632,54.93.77.70,10.0.2.15,TLSv1.2,590,Application Data
1,15.852026999999907,10.0.2.15,54.93.77.70,TCP,54,34692  >  9001 [ACK] Seq=8367625 Ack=152026857 Win=65535 Len=0
1,15.852449999999862,54.93.77.70,10.0.2.15,TCP,2950,"9001  >  34692 [PSH, ACK] Seq=152026857 Ack=8367625 Win=65535 Len=2896 [TCP segment of a reassembled PDU]"
1,15.85252700000001,10.0.2.15,54.93.77.70,TCP,54,34692  >  9001 [ACK] Seq=8367625 Ack=152029753 Win=65535 Len=0
1,15.860331999999744,54.93.77.70,10.0.2.15,TLSv1.2,2950,Application Data [TCP segment of a reassembled PDU]
1,15.860375999999633,54.93.77.70,10.0.2.15,TLSv1.2,1502,Application Data
1,15.860437999999704,10.0.2.15,54.93.77.70,TCP,54,34692  >  9001 [ACK] Seq=8367625 Ack=152032649 Win=65535 Len=0
1,15.860528999999588,10.0.2.15,54.93.77.70,TCP,54,34692  >  9001 [ACK] Seq=8367625 Ack=152034097 Win=65535 Len=0
1,15.86148299999968,10.0.2.15,54.93.77.70,TLSv1.2,590,Application Data
1,15.86167899999964,54.93.77.70,10.0.2.15,TCP,60,9001  >  34692 [ACK] Seq=152034097 Ack=8368161 Win=65535 Len=0
1,15.866219000000001,54.93.77.70,10.0.2.15,TCP,2950,"9001  >  34692 [PSH, ACK] Seq=152034097 Ack=8368161 Win=65535 Len=2896 [TCP segment of a reassembled PDU]"
1,15.866358999999647,10.0.2.15,54.93.77.70,TCP,54,34692  >  9001 [ACK] Seq=8368161 Ack=152036993 Win=65535 Len=0
1,15.869143999999778,54.93.77.70,10.0.2.15,TLSv1.2,1828,"Application Data, Application Data"
1,15.86927199999991,10.0.2.15,54.93.77.70,TCP,54,34692  >  9001 [ACK] Seq=8368161 Ack=152038767 Win=65535 Len=0
1,15.887555999999677,54.93.77.70,10.0.2.15,TCP,2950,"9001  >  34692 [PSH, ACK] Seq=152038767 Ack=8368161 Win=65535 Len=2896 [TCP segment of a reassembled PDU]"
1,15.88760400000001,54.93.77.70,10.0.2.15,TLSv1.2,778,Application Data
1,15.887703999999758,10.0.2.15,54.93.77.70,TCP,54,34692  >  9001 [ACK] Seq=8368161 Ack=152041663 Win=65535 Len=0
1,15.895509999999831,54.93.77.70,10.0.2.15,TCP,2950,"9001  >  34692 [PSH, ACK] Seq=152042387 Ack=8368161 Win=65535 Len=2896 [TCP segment of a reassembled PDU]"
1,15.895616999999675,10.0.2.15,54.93.77.70,TCP,54,34692  >  9001 [ACK] Seq=8368161 Ack=152045283 Win=65535 Len=0
1,15.904100999999628,54.93.77.70,10.0.2.15,TLSv1.2,1314,"Application Data, Application Data"
1,15.918987000000016,54.93.77.70,10.0.2.15,TCP,2950,"9001  >  34692 [PSH, ACK] Seq=152046543 Ack=8368161 Win=65535 Len=2896 [TCP segment of a reassembled PDU]"
1,15.919268999999986,10.0.2.15,54.93.77.70,TCP,54,34692  >  9001 [ACK] Seq=8368161 Ack=152049439 Win=65535 Len=0
1,15.92172999999957,54.93.77.70,10.0.2.15,TLSv1.2,778,Application Data
1,15.930255999999645,54.93.77.70,10.0.2.15,TLSv1.2,7294,Application Data
1,15.93040499999961,10.0.2.15,54.93.77.70,TCP,54,34692  >  9001 [ACK] Seq=8368161 Ack=152057403 Win=65535 Len=0
1,15.930594999999812,10.0.2.15,54.93.77.70,TLSv1.2,590,Application Data
1,15.930689999999686,54.93.77.70,10.0.2.15,TCP,60,9001  >  34692 [ACK] Seq=152057403 Ack=8368697 Win=65535 Len=0
1,15.938188999999966,54.93.77.70,10.0.2.15,TLSv1.2,1104,"Application Data, Application Data"
1,15.963868999999704,54.93.77.70,10.0.2.15,TLSv1.2,2646,Application Data
1,15.963995999999952,10.0.2.15,54.93.77.70,TCP,54,34692  >  9001 [ACK] Seq=8368697 Ack=152061045 Win=65535 Len=0
1,15.988754999999855,54.93.77.70,10.0.2.15,TLSv1.2,3674,Application Data
1,15.989250999999967,10.0.2.15,54.93.77.70,TCP,54,34692  >  9001 [ACK] Seq=8368697 Ack=152064665 Win=65535 Len=0
