No.,Time,Source,Destination,Protocol,Length,Info
1,0.029922000000169646,62.210.85.178,10.0.2.15,TLSv1.2,590,Application Data
1,0.07679000000007363,10.0.2.15,62.210.85.178,TCP,54,35978  >  9001 [ACK] Seq=152214171 Ack=8335953 Win=65535 Len=0
1,0.2523700000001554,62.210.85.178,10.0.2.15,TLSv1.2,590,Application Data
1,0.252498000000287,10.0.2.15,62.210.85.178,TCP,54,35978  >  9001 [ACK] Seq=152214171 Ack=8336489 Win=65535 Len=0
1,0.26153000000022075,10.0.2.15,54.93.77.70,TLSv1.2,590,Application Data
1,0.2618580000003021,54.93.77.70,10.0.2.15,TCP,60,9001  >  34692 [ACK] Seq=152064665 Ack=8369233 Win=65535 Len=0
1,0.38376500000003944,62.210.85.178,10.0.2.15,TLSv1.2,590,Application Data
1,0.3839900000002672,10.0.2.15,62.210.85.178,TCP,54,35978  >  9001 [ACK] Seq=152214171 Ack=8337025 Win=65535 Len=0
1,0.38592000000016924,10.0.2.15,62.210.85.178,TLSv1.2,590,Application Data
1,0.38616200000024037,62.210.85.178,10.0.2.15,TCP,60,9001  >  35978 [ACK] Seq=8337025 Ack=152214707 Win=65535 Len=0
1,0.5599980000001779,54.93.77.70,10.0.2.15,TLSv1.2,590,Application Data
1,0.560617000000093,10.0.2.15,54.93.77.70,TLSv1.2,1618,Application Data
1,0.5608580000002803,54.93.77.70,10.0.2.15,TCP,60,9001  >  34692 [ACK] Seq=152065201 Ack=8370797 Win=65535 Len=0
1,0.6803610000001754,62.210.85.178,10.0.2.15,TLSv1.2,1618,Application Data
1,0.6805210000002262,10.0.2.15,62.210.85.178,TCP,54,35978  >  9001 [ACK] Seq=152214707 Ack=8338589 Win=65535 Len=0
1,0.7063450000000557,10.0.2.15,62.210.85.178,TLSv1.2,590,Application Data
1,0.7065190000002985,62.210.85.178,10.0.2.15,TCP,60,9001  >  35978 [ACK] Seq=8338589 Ack=152215243 Win=65535 Len=0
1,0.7174760000002607,10.0.2.15,62.210.85.178,TLSv1.2,1618,Application Data
1,0.7177000000001499,62.210.85.178,10.0.2.15,TCP,60,9001  >  35978 [ACK] Seq=8338589 Ack=152216703 Win=65535 Len=0
1,0.7177200000000994,62.210.85.178,10.0.2.15,TCP,60,9001  >  35978 [ACK] Seq=8338589 Ack=152216807 Win=65535 Len=0
1,0.8193740000001526,54.93.77.70,10.0.2.15,TLSv1.2,590,Application Data
1,0.860906000000341,10.0.2.15,54.93.77.70,TCP,54,34692  >  9001 [ACK] Seq=8370797 Ack=152065737 Win=65535 Len=0
1,1.2776750000002721,54.93.77.70,10.0.2.15,TLSv1.2,1618,Application Data
1,1.2778740000003381,10.0.2.15,54.93.77.70,TCP,54,34692  >  9001 [ACK] Seq=8370797 Ack=152067301 Win=65535 Len=0
1,1.280623000000105,10.0.2.15,54.93.77.70,TLSv1.2,590,Application Data
1,1.2808060000002115,54.93.77.70,10.0.2.15,TCP,60,9001  >  34692 [ACK] Seq=152067301 Ack=8371333 Win=65535 Len=0
1,1.7883449999999357,62.210.85.178,10.0.2.15,TLSv1.2,590,Application Data
1,1.7887500000001637,10.0.2.15,62.210.85.178,TLSv1.2,590,Application Data
1,1.788893000000371,62.210.85.178,10.0.2.15,TCP,60,9001  >  35978 [ACK] Seq=8339125 Ack=152217343 Win=65535 Len=0
1,1.899956000000202,54.93.77.70,10.0.2.15,TLSv1.2,590,Application Data
1,1.9006060000001526,10.0.2.15,54.93.77.70,TLSv1.2,590,Application Data
1,1.9008330000001479,54.93.77.70,10.0.2.15,TCP,60,9001  >  34692 [ACK] Seq=152067837 Ack=8371869 Win=65535 Len=0
1,2.096342000000277,62.210.85.178,10.0.2.15,TLSv1.2,590,Application Data
1,2.1032070000001113,10.0.2.15,62.210.85.178,TLSv1.2,590,Application Data
1,2.1036779999999453,62.210.85.178,10.0.2.15,TCP,60,9001  >  35978 [ACK] Seq=8339661 Ack=152217879 Win=65535 Len=0
1,2.110704000000169,10.0.2.15,62.210.85.178,TLSv1.2,4124,Application Data
1,2.1111260000002403,10.0.2.15,62.210.85.178,TCP,2974,35978  >  9001 [ACK] Seq=152221949 Ack=8339661 Win=65535 Len=2920 [TCP segment of a reassembled PDU]
1,2.111207000000377,62.210.85.178,10.0.2.15,TCP,60,9001  >  35978 [ACK] Seq=8339661 Ack=152219339 Win=65535 Len=0
1,2.11123600000019,62.210.85.178,10.0.2.15,TCP,60,9001  >  35978 [ACK] Seq=8339661 Ack=152220799 Win=65535 Len=0
1,2.1112459999999373,62.210.85.178,10.0.2.15,TCP,60,9001  >  35978 [ACK] Seq=8339661 Ack=152221949 Win=65535 Len=0
1,2.1112530000000334,62.210.85.178,10.0.2.15,TCP,60,9001  >  35978 [ACK] Seq=8339661 Ack=152223409 Win=65535 Len=0
1,2.1112710000002153,62.210.85.178,10.0.2.15,TCP,60,9001  >  35978 [ACK] Seq=8339661 Ack=152224869 Win=65535 Len=0
1,2.1113650000002053,10.0.2.15,62.210.85.178,TLSv1.2,1204,Application Data
1,2.111417999999958,62.210.85.178,10.0.2.15,TCP,60,9001  >  35978 [ACK] Seq=8339661 Ack=152226019 Win=65535 Len=0
1,2.1114919999999984,10.0.2.15,62.210.85.178,TLSv1.2,4124,Application Data
1,2.111742999999933,62.210.85.178,10.0.2.15,TCP,60,9001  >  35978 [ACK] Seq=8339661 Ack=152227479 Win=65535 Len=0
1,2.1117560000002413,62.210.85.178,10.0.2.15,TCP,60,9001  >  35978 [ACK] Seq=8339661 Ack=152228939 Win=65535 Len=0
1,2.1117600000002312,62.210.85.178,10.0.2.15,TCP,60,9001  >  35978 [ACK] Seq=8339661 Ack=152230089 Win=65535 Len=0
1,2.111818000000312,10.0.2.15,62.210.85.178,TLSv1.2,4124,Application Data
1,2.111891000000014,62.210.85.178,10.0.2.15,TCP,60,9001  >  35978 [ACK] Seq=8339661 Ack=152231549 Win=65535 Len=0
1,2.1119040000003224,62.210.85.178,10.0.2.15,TCP,60,9001  >  35978 [ACK] Seq=8339661 Ack=152233009 Win=65535 Len=0
1,2.1119080000003123,62.210.85.178,10.0.2.15,TCP,60,9001  >  35978 [ACK] Seq=8339661 Ack=152234159 Win=65535 Len=0
1,2.1119579999999587,10.0.2.15,62.210.85.178,TLSv1.2,332,Application Data
1,2.1120240000000194,62.210.85.178,10.0.2.15,TCP,60,9001  >  35978 [ACK] Seq=8339661 Ack=152234437 Win=65535 Len=0
1,2.1121180000000095,10.0.2.15,62.210.85.178,TLSv1.2,3868,Application Data
1,2.1122410000002674,62.210.85.178,10.0.2.15,TCP,60,9001  >  35978 [ACK] Seq=8339661 Ack=152235897 Win=65535 Len=0
1,2.1122550000000047,62.210.85.178,10.0.2.15,TCP,60,9001  >  35978 [ACK] Seq=8339661 Ack=152237357 Win=65535 Len=0
1,2.112261000000217,62.210.85.178,10.0.2.15,TCP,60,9001  >  35978 [ACK] Seq=8339661 Ack=152238251 Win=65535 Len=0
1,2.1123420000003534,10.0.2.15,62.210.85.178,TLSv1.2,4124,Application Data
1,2.1124650000001566,62.210.85.178,10.0.2.15,TCP,60,9001  >  35978 [ACK] Seq=8339661 Ack=152239711 Win=65535 Len=0
1,2.1124840000002223,62.210.85.178,10.0.2.15,TCP,60,9001  >  35978 [ACK] Seq=8339661 Ack=152241171 Win=65535 Len=0
1,2.112492000000202,62.210.85.178,10.0.2.15,TCP,60,9001  >  35978 [ACK] Seq=8339661 Ack=152242321 Win=65535 Len=0
1,2.1125630000001365,10.0.2.15,62.210.85.178,TLSv1.2,3030,Application Data
1,2.1127980000001116,62.210.85.178,10.0.2.15,TCP,60,9001  >  35978 [ACK] Seq=8339661 Ack=152243781 Win=65535 Len=0
1,2.1128120000003037,62.210.85.178,10.0.2.15,TCP,60,9001  >  35978 [ACK] Seq=8339661 Ack=152245241 Win=65535 Len=0
1,2.1128170000001774,62.210.85.178,10.0.2.15,TCP,60,9001  >  35978 [ACK] Seq=8339661 Ack=152245297 Win=65535 Len=0
1,2.128161000000091,10.0.2.15,62.210.85.178,TLSv1.2,4124,Application Data
1,2.128845000000183,62.210.85.178,10.0.2.15,TCP,60,9001  >  35978 [ACK] Seq=8339661 Ack=152246757 Win=65535 Len=0
1,2.1289080000001377,62.210.85.178,10.0.2.15,TCP,60,9001  >  35978 [ACK] Seq=8339661 Ack=152248217 Win=65535 Len=0
1,2.12891400000035,62.210.85.178,10.0.2.15,TCP,60,9001  >  35978 [ACK] Seq=8339661 Ack=152249367 Win=65535 Len=0
1,2.1291300000002593,10.0.2.15,62.210.85.178,TLSv1.2,4124,Application Data
1,2.1292459999999664,10.0.2.15,62.210.85.178,TCP,2974,35978  >  9001 [ACK] Seq=152253437 Ack=8339661 Win=65535 Len=2920 [TCP segment of a reassembled PDU]
1,2.129316000000017,10.0.2.15,62.210.85.178,TLSv1.2,4434,Application Data [TCP segment of a reassembled PDU]
1,2.1293610000002445,62.210.85.178,10.0.2.15,TCP,60,9001  >  35978 [ACK] Seq=8339661 Ack=152250827 Win=65535 Len=0
1,2.129370999999992,62.210.85.178,10.0.2.15,TCP,60,9001  >  35978 [ACK] Seq=8339661 Ack=152252287 Win=65535 Len=0
1,2.1294620000003306,10.0.2.15,62.210.85.178,TLSv1.2,4434,"Application Data, Application Data"
1,2.129507999999987,62.210.85.178,10.0.2.15,TCP,60,9001  >  35978 [ACK] Seq=8339661 Ack=152253437 Win=65535 Len=0
1,2.129515999999967,62.210.85.178,10.0.2.15,TCP,60,9001  >  35978 [ACK] Seq=8339661 Ack=152254897 Win=65535 Len=0
1,2.1308420000000297,62.210.85.178,10.0.2.15,TCP,60,9001  >  35978 [ACK] Seq=8339661 Ack=152256357 Win=65535 Len=0
1,2.130859000000328,62.210.85.178,10.0.2.15,TCP,60,9001  >  35978 [ACK] Seq=8339661 Ack=152257817 Win=65535 Len=0
1,2.1308640000002015,62.210.85.178,10.0.2.15,TCP,60,9001  >  35978 [ACK] Seq=8339661 Ack=152259277 Win=65535 Len=0
1,2.130869000000075,62.210.85.178,10.0.2.15,TCP,60,9001  >  35978 [ACK] Seq=8339661 Ack=152260737 Win=65535 Len=0
1,2.130873000000065,62.210.85.178,10.0.2.15,TCP,60,9001  >  35978 [ACK] Seq=8339661 Ack=152262197 Win=65535 Len=0
1,2.1308779999999388,62.210.85.178,10.0.2.15,TCP,60,9001  >  35978 [ACK] Seq=8339661 Ack=152263657 Win=65535 Len=0
1,2.1308819999999287,62.210.85.178,10.0.2.15,TCP,60,9001  >  35978 [ACK] Seq=8339661 Ack=152265117 Win=65535 Len=0
1,2.130978000000141,10.0.2.15,62.210.85.178,TLSv1.2,606,Application Data
1,2.131122000000232,62.210.85.178,10.0.2.15,TCP,60,9001  >  35978 [ACK] Seq=8339661 Ack=152265669 Win=65535 Len=0
1,2.131167000000005,10.0.2.15,62.210.85.178,TLSv1.2,1424,Application Data
1,2.1312370000000556,62.210.85.178,10.0.2.15,TCP,60,9001  >  35978 [ACK] Seq=8339661 Ack=152267039 Win=65535 Len=0
1,2.2319139999999607,54.93.77.70,10.0.2.15,TCP,2950,"9001  >  34692 [PSH, ACK] Seq=152067837 Ack=8371869 Win=65535 Len=2896 [TCP segment of a reassembled PDU]"
1,2.231960000000072,54.93.77.70,10.0.2.15,TLSv1.2,2856,"Application Data, Application Data"
1,2.2321360000000823,10.0.2.15,54.93.77.70,TCP,54,34692  >  9001 [ACK] Seq=8371869 Ack=152073535 Win=65535 Len=0
1,2.2359840000003715,54.93.77.70,10.0.2.15,TCP,1502,"9001  >  34692 [PSH, ACK] Seq=152073535 Ack=8371869 Win=65535 Len=1448 [TCP segment of a reassembled PDU]"
1,2.2360960000000887,10.0.2.15,54.93.77.70,TCP,54,34692  >  9001 [ACK] Seq=8371869 Ack=152074983 Win=65535 Len=0
1,2.248815000000377,54.93.77.70,10.0.2.15,TLSv1.2,170,Application Data
1,2.2671220000001995,54.93.77.70,10.0.2.15,TLSv1.2,4000,Application Data
1,2.267174000000068,54.93.77.70,10.0.2.15,TLSv1.2,4398,Application Data [TCP segment of a reassembled PDU]
1,2.267327000000023,10.0.2.15,54.93.77.70,TCP,54,34692  >  9001 [ACK] Seq=8371869 Ack=152083389 Win=65535 Len=0
1,2.283824999999979,54.93.77.70,10.0.2.15,TLSv1.2,568,Application Data
1,2.3247920000003433,10.0.2.15,54.93.77.70,TCP,54,34692  >  9001 [ACK] Seq=8371869 Ack=152083903 Win=65535 Len=0
1,2.3293910000002143,54.93.77.70,10.0.2.15,TLSv1.2,3674,Application Data
1,2.3294920000003003,10.0.2.15,54.93.77.70,TCP,54,34692  >  9001 [ACK] Seq=8371869 Ack=152087523 Win=65535 Len=0
1,2.329793000000336,10.0.2.15,54.93.77.70,TLSv1.2,590,Application Data
1,2.3299110000002656,54.93.77.70,10.0.2.15,TCP,60,9001  >  34692 [ACK] Seq=152087523 Ack=8372405 Win=65535 Len=0
1,2.3403400000001966,54.93.77.70,10.0.2.15,TCP,2950,"9001  >  34692 [PSH, ACK] Seq=152087523 Ack=8372405 Win=65535 Len=2896 [TCP segment of a reassembled PDU]"
1,2.3406910000003336,10.0.2.15,54.93.77.70,TCP,54,34692  >  9001 [ACK] Seq=8372405 Ack=152090419 Win=65535 Len=0
1,2.345614000000296,54.93.77.70,10.0.2.15,TLSv1.2,778,Application Data
1,2.347012000000177,54.93.77.70,10.0.2.15,TLSv1.2,4398,Application Data
1,2.34713499999998,10.0.2.15,54.93.77.70,TCP,54,34692  >  9001 [ACK] Seq=8372405 Ack=152095487 Win=65535 Len=0
1,2.347291000000041,10.0.2.15,54.93.77.70,TLSv1.2,590,Application Data
1,2.347371000000294,54.93.77.70,10.0.2.15,TCP,60,9001  >  34692 [ACK] Seq=152095487 Ack=8372941 Win=65535 Len=0
1,2.3654719999999543,54.93.77.70,10.0.2.15,TLSv1.2,380,Application Data
1,2.368003999999928,54.93.77.70,10.0.2.15,TCP,2950,"9001  >  34692 [PSH, ACK] Seq=152095813 Ack=8372941 Win=65535 Len=2896 [TCP segment of a reassembled PDU]"
1,2.368093999999928,10.0.2.15,54.93.77.70,TCP,54,34692  >  9001 [ACK] Seq=8372941 Ack=152098709 Win=65535 Len=0
1,2.3796919999999773,54.93.77.70,10.0.2.15,TLSv1.2,2950,Application Data [TCP segment of a reassembled PDU]
1,2.379740000000311,54.93.77.70,10.0.2.15,TLSv1.2,2950,Application Data [TCP segment of a reassembled PDU]
1,2.3797960000001694,10.0.2.15,54.93.77.70,TCP,54,34692  >  9001 [ACK] Seq=8372941 Ack=152101605 Win=65535 Len=0
1,2.379910000000109,10.0.2.15,54.93.77.70,TCP,54,34692  >  9001 [ACK] Seq=8372941 Ack=152104501 Win=65535 Len=0
1,2.3809989999999743,54.93.77.70,10.0.2.15,TLSv1.2,2950,Application Data [TCP segment of a reassembled PDU]
1,2.3810459999999694,10.0.2.15,54.93.77.70,TCP,54,34692  >  9001 [ACK] Seq=8372941 Ack=152107397 Win=65535 Len=0
1,2.3843550000001414,54.93.77.70,10.0.2.15,TLSv1.2,380,Application Data
1,2.3997690000001057,54.93.77.70,10.0.2.15,TCP,2950,"9001  >  34692 [PSH, ACK] Seq=152107723 Ack=8372941 Win=65535 Len=2896 [TCP segment of a reassembled PDU]"
1,2.399870000000192,10.0.2.15,54.93.77.70,TCP,54,34692  >  9001 [ACK] Seq=8372941 Ack=152110619 Win=65535 Len=0
1,2.4008640000001833,54.93.77.70,10.0.2.15,TLSv1.2,1502,Application Data [TCP segment of a reassembled PDU]
1,2.4009570000002896,10.0.2.15,54.93.77.70,TCP,54,34692  >  9001 [ACK] Seq=8372941 Ack=152112067 Win=65535 Len=0
1,2.417954000000009,54.93.77.70,10.0.2.15,TLSv1.2,1408,Application Data
1,2.425529000000097,54.93.77.70,10.0.2.15,TCP,2950,"9001  >  34692 [PSH, ACK] Seq=152113421 Ack=8372941 Win=65535 Len=2896 [TCP segment of a reassembled PDU]"
1,2.4294840000002296,10.0.2.15,54.93.77.70,TCP,54,34692  >  9001 [ACK] Seq=8372941 Ack=152116317 Win=65535 Len=0
1,2.434222000000318,54.93.77.70,10.0.2.15,TLSv1.2,1314,"Application Data, Application Data"
1,2.4508390000000873,62.210.85.178,10.0.2.15,TLSv1.2,590,Application Data
1,2.4520510000002105,10.0.2.15,54.93.77.70,TLSv1.2,590,Application Data
1,2.4529099999999744,54.93.77.70,10.0.2.15,TCP,60,9001  >  34692 [ACK] Seq=152117577 Ack=8373477 Win=65535 Len=0
1,2.4930010000002767,10.0.2.15,62.210.85.178,TCP,54,35978  >  9001 [ACK] Seq=152267039 Ack=8340197 Win=65535 Len=0
1,2.51079400000026,62.210.85.178,10.0.2.15,TLSv1.2,590,Application Data
1,2.510943000000225,10.0.2.15,62.210.85.178,TCP,54,35978  >  9001 [ACK] Seq=152267039 Ack=8340733 Win=65535 Len=0
1,2.567195999999967,62.210.85.178,10.0.2.15,TLSv1.2,590,Application Data
1,2.5674900000003618,10.0.2.15,62.210.85.178,TCP,54,35978  >  9001 [ACK] Seq=152267039 Ack=8341269 Win=65535 Len=0
1,2.5683180000000903,10.0.2.15,62.210.85.178,TLSv1.2,590,Application Data
1,2.5684590000000753,62.210.85.178,10.0.2.15,TCP,60,9001  >  35978 [ACK] Seq=8341269 Ack=152267575 Win=65535 Len=0
1,2.680804999999964,54.93.77.70,10.0.2.15,TLSv1.2,590,Application Data
1,2.6812300000001414,10.0.2.15,54.93.77.70,TLSv1.2,590,Application Data
1,2.681347000000187,54.93.77.70,10.0.2.15,TCP,60,9001  >  34692 [ACK] Seq=152118113 Ack=8374013 Win=65535 Len=0
1,2.960762000000159,62.210.85.178,10.0.2.15,TLSv1.2,590,Application Data
1,2.968573000000106,10.0.2.15,62.210.85.178,TLSv1.2,590,Application Data
1,2.9687619999999697,62.210.85.178,10.0.2.15,TCP,60,9001  >  35978 [ACK] Seq=8341805 Ack=152268111 Win=65535 Len=0
1,2.9795460000000276,10.0.2.15,62.210.85.178,TLSv1.2,4124,Application Data
1,2.9797410000001037,62.210.85.178,10.0.2.15,TCP,60,9001  >  35978 [ACK] Seq=8341805 Ack=152269571 Win=65535 Len=0
1,2.9797590000002856,62.210.85.178,10.0.2.15,TCP,60,9001  >  35978 [ACK] Seq=8341805 Ack=152271031 Win=65535 Len=0
1,2.9797630000002755,62.210.85.178,10.0.2.15,TCP,60,9001  >  35978 [ACK] Seq=8341805 Ack=152272181 Win=65535 Len=0
1,2.9798180000002503,10.0.2.15,62.210.85.178,TLSv1.2,4124,Application Data
1,2.979892000000291,62.210.85.178,10.0.2.15,TCP,60,9001  >  35978 [ACK] Seq=8341805 Ack=152273641 Win=65535 Len=0
1,2.9799000000002707,62.210.85.178,10.0.2.15,TCP,60,9001  >  35978 [ACK] Seq=8341805 Ack=152275101 Win=65535 Len=0
1,2.979903000000377,62.210.85.178,10.0.2.15,TCP,60,9001  >  35978 [ACK] Seq=8341805 Ack=152276251 Win=65535 Len=0
1,2.9799339999999575,10.0.2.15,62.210.85.178,TLSv1.2,2774,Application Data
1,2.979978000000301,62.210.85.178,10.0.2.15,TCP,60,9001  >  35978 [ACK] Seq=8341805 Ack=152277711 Win=65535 Len=0
1,2.979986000000281,62.210.85.178,10.0.2.15,TCP,60,9001  >  35978 [ACK] Seq=8341805 Ack=152278971 Win=65535 Len=0
1,3.173236999999972,54.93.77.70,10.0.2.15,TCP,1502,"9001  >  34692 [PSH, ACK] Seq=152118113 Ack=8374013 Win=65535 Len=1448 [TCP segment of a reassembled PDU]"
1,3.1736110000001645,10.0.2.15,54.93.77.70,TCP,54,34692  >  9001 [ACK] Seq=8374013 Ack=152119561 Win=65535 Len=0
1,3.306544000000031,54.93.77.70,10.0.2.15,TLSv1.2,2226,Application Data
1,3.306736000000001,10.0.2.15,54.93.77.70,TCP,54,34692  >  9001 [ACK] Seq=8374013 Ack=152121733 Win=65535 Len=0
1,3.5098150000003443,54.93.77.70,10.0.2.15,TLSv1.2,2132,Application Data
1,3.5099199999999655,10.0.2.15,54.93.77.70,TCP,54,34692  >  9001 [ACK] Seq=8374013 Ack=152123811 Win=65535 Len=0
1,4.554342000000361,54.93.77.70,10.0.2.15,TLSv1.2,1618,Application Data
1,4.554440000000341,10.0.2.15,54.93.77.70,TCP,54,34692  >  9001 [ACK] Seq=8374013 Ack=152125375 Win=65535 Len=0
1,4.556663000000299,54.93.77.70,10.0.2.15,TLSv1.2,3674,Application Data
1,4.556777000000238,10.0.2.15,54.93.77.70,TCP,54,34692  >  9001 [ACK] Seq=8374013 Ack=152128995 Win=65535 Len=0
1,4.557148000000325,10.0.2.15,54.93.77.70,TLSv1.2,590,Application Data
1,4.55726900000036,54.93.77.70,10.0.2.15,TCP,60,9001  >  34692 [ACK] Seq=152128995 Ack=8374549 Win=65535 Len=0
1,4.566991000000144,10.0.2.15,54.93.77.70,TLSv1.2,590,Application Data
1,4.5672520000002805,54.93.77.70,10.0.2.15,TCP,60,9001  >  34692 [ACK] Seq=152128995 Ack=8375085 Win=65535 Len=0
1,4.57340000000022,54.93.77.70,10.0.2.15,TLSv1.2,590,Application Data
1,4.616817999999967,10.0.2.15,54.93.77.70,TCP,54,34692  >  9001 [ACK] Seq=8375085 Ack=152129531 Win=65535 Len=0
1,4.758332000000337,62.210.85.178,10.0.2.15,TLSv1.2,590,Application Data
1,4.800756999999976,10.0.2.15,62.210.85.178,TCP,54,35978  >  9001 [ACK] Seq=152278971 Ack=8342341 Win=65535 Len=0
1,4.850400000000263,62.210.85.178,10.0.2.15,TLSv1.2,590,Application Data
1,4.850511000000097,10.0.2.15,62.210.85.178,TCP,54,35978  >  9001 [ACK] Seq=152278971 Ack=8342877 Win=65535 Len=0
1,4.850934000000052,10.0.2.15,62.210.85.178,TLSv1.2,590,Application Data
1,4.851038000000244,62.210.85.178,10.0.2.15,TCP,60,9001  >  35978 [ACK] Seq=8342877 Ack=152279507 Win=65535 Len=0
1,5.782157999999981,54.93.77.70,10.0.2.15,TLSv1.2,590,Application Data
1,5.78224900000032,10.0.2.15,54.93.77.70,TCP,54,34692  >  9001 [ACK] Seq=8375085 Ack=152130067 Win=65535 Len=0
1,5.782631000000038,10.0.2.15,54.93.77.70,TLSv1.2,590,Application Data
1,5.782736999999997,54.93.77.70,10.0.2.15,TCP,60,9001  >  34692 [ACK] Seq=152130067 Ack=8375621 Win=65535 Len=0
1,6.396929,62.210.85.178,10.0.2.15,TLSv1.2,590,Application Data
1,6.401339000000007,10.0.2.15,62.210.85.178,TLSv1.2,590,Application Data
1,6.40151700000024,62.210.85.178,10.0.2.15,TCP,60,9001  >  35978 [ACK] Seq=8343413 Ack=152280043 Win=65535 Len=0
1,6.413714000000255,10.0.2.15,62.210.85.178,TLSv1.2,4124,Application Data
1,6.413850000000366,10.0.2.15,62.210.85.178,TCP,2974,35978  >  9001 [ACK] Seq=152284113 Ack=8343413 Win=65535 Len=2920 [TCP segment of a reassembled PDU]
1,6.413898000000245,62.210.85.178,10.0.2.15,TCP,60,9001  >  35978 [ACK] Seq=8343413 Ack=152281503 Win=65535 Len=0
1,6.413911000000098,62.210.85.178,10.0.2.15,TCP,60,9001  >  35978 [ACK] Seq=8343413 Ack=152282963 Win=65535 Len=0
1,6.413915999999972,62.210.85.178,10.0.2.15,TCP,60,9001  >  35978 [ACK] Seq=8343413 Ack=152284113 Win=65535 Len=0
1,6.413919999999962,62.210.85.178,10.0.2.15,TCP,60,9001  >  35978 [ACK] Seq=8343413 Ack=152285573 Win=65535 Len=0
1,6.41392500000029,62.210.85.178,10.0.2.15,TCP,60,9001  >  35978 [ACK] Seq=8343413 Ack=152287033 Win=65535 Len=0
1,6.413974000000053,10.0.2.15,62.210.85.178,TLSv1.2,1204,Application Data
1,6.414017999999942,62.210.85.178,10.0.2.15,TCP,60,9001  >  35978 [ACK] Seq=8343413 Ack=152288183 Win=65535 Len=0
1,6.414072000000033,10.0.2.15,62.210.85.178,TLSv1.2,4124,Application Data
1,6.414157000000159,62.210.85.178,10.0.2.15,TCP,60,9001  >  35978 [ACK] Seq=8343413 Ack=152289643 Win=65535 Len=0
1,6.414166000000023,62.210.85.178,10.0.2.15,TCP,60,9001  >  35978 [ACK] Seq=8343413 Ack=152291103 Win=65535 Len=0
1,6.414173000000119,62.210.85.178,10.0.2.15,TCP,60,9001  >  35978 [ACK] Seq=8343413 Ack=152292253 Win=65535 Len=0
1,6.414226000000326,10.0.2.15,62.210.85.178,TLSv1.2,4124,Application Data
1,6.414273000000321,62.210.85.178,10.0.2.15,TCP,60,9001  >  35978 [ACK] Seq=8343413 Ack=152293713 Win=65535 Len=0
1,6.4142799999999625,62.210.85.178,10.0.2.15,TCP,60,9001  >  35978 [ACK] Seq=8343413 Ack=152295173 Win=65535 Len=0
1,6.414361999999983,10.0.2.15,62.210.85.178,TLSv1.2,1514,Application Data
1,6.41440700000021,62.210.85.178,10.0.2.15,TCP,60,9001  >  35978 [ACK] Seq=8343413 Ack=152296323 Win=65535 Len=0
1,6.41441500000019,62.210.85.178,10.0.2.15,TCP,60,9001  >  35978 [ACK] Seq=8343413 Ack=152297783 Win=65535 Len=0
1,6.414451000000099,10.0.2.15,62.210.85.178,TLSv1.2,1464,Application Data
1,6.414490999999998,62.210.85.178,10.0.2.15,TCP,60,9001  >  35978 [ACK] Seq=8343413 Ack=152299193 Win=65535 Len=0
1,6.5185740000001715,54.93.77.70,10.0.2.15,TCP,2950,"9001  >  34692 [PSH, ACK] Seq=152130067 Ack=8375621 Win=65535 Len=2896 [TCP segment of a reassembled PDU]"
1,6.518909000000349,10.0.2.15,54.93.77.70,TCP,54,34692  >  9001 [ACK] Seq=8375621 Ack=152132963 Win=65535 Len=0
1,6.518986000000041,54.93.77.70,10.0.2.15,TLSv1.2,778,Application Data
1,6.53245300000026,54.93.77.70,10.0.2.15,TCP,2950,"9001  >  34692 [PSH, ACK] Seq=152133687 Ack=8375621 Win=65535 Len=2896 [TCP segment of a reassembled PDU]"
1,6.5325410000000375,10.0.2.15,54.93.77.70,TCP,54,34692  >  9001 [ACK] Seq=8375621 Ack=152136583 Win=65535 Len=0
1,6.537470000000212,54.93.77.70,10.0.2.15,TLSv1.2,778,Application Data
1,6.55446400000028,54.93.77.70,10.0.2.15,TLSv1.2,1104,Application Data
1,6.554551000000174,10.0.2.15,54.93.77.70,TCP,54,34692  >  9001 [ACK] Seq=8375621 Ack=152138357 Win=65535 Len=0
1,6.5551980000000185,54.93.77.70,10.0.2.15,TCP,2950,"9001  >  34692 [PSH, ACK] Seq=152138357 Ack=8375621 Win=65535 Len=2896 [TCP segment of a reassembled PDU]"
1,6.5552450000000135,10.0.2.15,54.93.77.70,TCP,54,34692  >  9001 [ACK] Seq=8375621 Ack=152141253 Win=65535 Len=0
1,6.5679190000000744,54.93.77.70,10.0.2.15,TLSv1.2,5846,"Application Data, Application Data"
1,6.568105000000287,10.0.2.15,54.93.77.70,TCP,54,34692  >  9001 [ACK] Seq=8375621 Ack=152147045 Win=65535 Len=0
1,6.568313000000217,10.0.2.15,54.93.77.70,TLSv1.2,590,Application Data
1,6.568408999999974,54.93.77.70,10.0.2.15,TCP,60,9001  >  34692 [ACK] Seq=152147045 Ack=8376157 Win=65535 Len=0
1,6.573331000000053,54.93.77.70,10.0.2.15,TLSv1.2,1198,Application Data
1,6.578061000000162,54.93.77.70,10.0.2.15,TCP,1502,"9001  >  34692 [PSH, ACK] Seq=152148189 Ack=8376157 Win=65535 Len=1448 [TCP segment of a reassembled PDU]"
1,6.57830100000001,10.0.2.15,54.93.77.70,TCP,54,34692  >  9001 [ACK] Seq=8376157 Ack=152149637 Win=65535 Len=0
1,6.595273000000361,54.93.77.70,10.0.2.15,TLSv1.2,170,Application Data
1,6.597901999999976,10.0.2.15,54.93.77.70,TLSv1.2,590,Application Data
1,6.598077000000103,54.93.77.70,10.0.2.15,TCP,60,9001  >  34692 [ACK] Seq=152149753 Ack=8376693 Win=65535 Len=0
1,6.689376000000266,62.210.85.178,10.0.2.15,TLSv1.2,590,Application Data
1,6.696681000000353,10.0.2.15,193.246.105.82,TCP,54,[TCP Keep-Alive] 42316  >  443 [ACK] Seq=1969 Ack=786 Win=32160 Len=0
1,6.6968910000000506,193.246.105.82,10.0.2.15,TCP,60,[TCP Keep-Alive ACK] 443  >  42316 [ACK] Seq=786 Ack=1970 Win=65535 Len=0
1,6.732776000000285,10.0.2.15,62.210.85.178,TCP,54,35978  >  9001 [ACK] Seq=152299193 Ack=8343949 Win=65535 Len=0
1,7.320020000000113,62.210.85.178,10.0.2.15,TLSv1.2,590,Application Data
1,7.32018700000026,10.0.2.15,62.210.85.178,TCP,54,35978  >  9001 [ACK] Seq=152299193 Ack=8344485 Win=65535 Len=0
1,7.320636000000377,10.0.2.15,62.210.85.178,TLSv1.2,590,Application Data
1,7.320754000000306,62.210.85.178,10.0.2.15,TCP,60,9001  >  35978 [ACK] Seq=8344485 Ack=152299729 Win=65535 Len=0
1,7.807978000000276,54.93.77.70,10.0.2.15,TLSv1.2,590,Application Data
1,7.808534000000236,10.0.2.15,54.93.77.70,TLSv1.2,590,Application Data
1,7.808803000000353,54.93.77.70,10.0.2.15,TCP,60,9001  >  34692 [ACK] Seq=152150289 Ack=8377229 Win=65535 Len=0
1,7.954691000000366,62.210.85.178,10.0.2.15,TLSv1.2,590,Application Data
1,7.963149000000158,10.0.2.15,62.210.85.178,TLSv1.2,590,Application Data
1,7.963320000000294,62.210.85.178,10.0.2.15,TCP,60,9001  >  35978 [ACK] Seq=8345021 Ack=152300265 Win=65535 Len=0
1,7.974211000000196,10.0.2.15,62.210.85.178,TLSv1.2,4124,Application Data
1,7.975346000000172,62.210.85.178,10.0.2.15,TCP,60,9001  >  35978 [ACK] Seq=8345021 Ack=152301725 Win=65535 Len=0
1,7.9753890000001775,62.210.85.178,10.0.2.15,TCP,60,9001  >  35978 [ACK] Seq=8345021 Ack=152303185 Win=65535 Len=0
1,7.9753960000002735,62.210.85.178,10.0.2.15,TCP,60,9001  >  35978 [ACK] Seq=8345021 Ack=152304335 Win=65535 Len=0
1,7.9755880000002435,10.0.2.15,62.210.85.178,TLSv1.2,4124,Application Data
1,7.98107200000004,62.210.85.178,10.0.2.15,TCP,60,9001  >  35978 [ACK] Seq=8345021 Ack=152305795 Win=65535 Len=0
1,7.981110000000172,62.210.85.178,10.0.2.15,TCP,60,9001  >  35978 [ACK] Seq=8345021 Ack=152307255 Win=65535 Len=0
1,7.9811140000001615,62.210.85.178,10.0.2.15,TCP,60,9001  >  35978 [ACK] Seq=8345021 Ack=152308405 Win=65535 Len=0
1,7.981259000000136,10.0.2.15,62.210.85.178,TLSv1.2,4124,Application Data
1,7.981351000000359,10.0.2.15,62.210.85.178,TCP,2974,35978  >  9001 [ACK] Seq=152312475 Ack=8345021 Win=65535 Len=2920 [TCP segment of a reassembled PDU]
1,7.981420000000071,62.210.85.178,10.0.2.15,TCP,60,9001  >  35978 [ACK] Seq=8345021 Ack=152309865 Win=65535 Len=0
1,7.981432000000041,62.210.85.178,10.0.2.15,TCP,60,9001  >  35978 [ACK] Seq=8345021 Ack=152311325 Win=65535 Len=0
1,7.981437000000369,62.210.85.178,10.0.2.15,TCP,60,9001  >  35978 [ACK] Seq=8345021 Ack=152312475 Win=65535 Len=0
1,7.981441000000359,62.210.85.178,10.0.2.15,TCP,60,9001  >  35978 [ACK] Seq=8345021 Ack=152313935 Win=65535 Len=0
1,7.98144400000001,62.210.85.178,10.0.2.15,TCP,60,9001  >  35978 [ACK] Seq=8345021 Ack=152315395 Win=65535 Len=0
1,7.981479000000036,10.0.2.15,62.210.85.178,TLSv1.2,1204,Application Data
1,7.981518999999935,62.210.85.178,10.0.2.15,TCP,60,9001  >  35978 [ACK] Seq=8345021 Ack=152316545 Win=65535 Len=0
1,7.981565000000046,10.0.2.15,62.210.85.178,TLSv1.2,332,Application Data
1,7.9816060000002835,62.210.85.178,10.0.2.15,TCP,60,9001  >  35978 [ACK] Seq=8345021 Ack=152316823 Win=65535 Len=0
1,7.981678000000102,10.0.2.15,62.210.85.178,TLSv1.2,3868,Application Data
1,7.981727000000319,62.210.85.178,10.0.2.15,TCP,60,9001  >  35978 [ACK] Seq=8345021 Ack=152318283 Win=65535 Len=0
1,7.981736000000183,62.210.85.178,10.0.2.15,TCP,60,9001  >  35978 [ACK] Seq=8345021 Ack=152319743 Win=65535 Len=0
1,7.98174199999994,62.210.85.178,10.0.2.15,TCP,60,9001  >  35978 [ACK] Seq=8345021 Ack=152320637 Win=65535 Len=0
1,7.9817980000002535,10.0.2.15,62.210.85.178,TLSv1.2,4124,Application Data
1,7.981909999999971,10.0.2.15,62.210.85.178,TCP,2974,35978  >  9001 [ACK] Seq=152324707 Ack=8345021 Win=65535 Len=2920 [TCP segment of a reassembled PDU]
1,7.981954000000314,62.210.85.178,10.0.2.15,TCP,60,9001  >  35978 [ACK] Seq=8345021 Ack=152322097 Win=65535 Len=0
1,7.981964000000062,62.210.85.178,10.0.2.15,TCP,60,9001  >  35978 [ACK] Seq=8345021 Ack=152323557 Win=65535 Len=0
1,7.9819689999999355,62.210.85.178,10.0.2.15,TCP,60,9001  >  35978 [ACK] Seq=8345021 Ack=152324707 Win=65535 Len=0
1,7.981974000000264,62.210.85.178,10.0.2.15,TCP,60,9001  >  35978 [ACK] Seq=8345021 Ack=152326167 Win=65535 Len=0
1,7.981979000000138,62.210.85.178,10.0.2.15,TCP,60,9001  >  35978 [ACK] Seq=8345021 Ack=152327627 Win=65535 Len=0
1,7.982015000000047,10.0.2.15,62.210.85.178,TLSv1.2,110,Application Data
1,7.982054000000062,62.210.85.178,10.0.2.15,TCP,60,9001  >  35978 [ACK] Seq=8345021 Ack=152327683 Win=65535 Len=0
1,7.985548000000108,10.0.2.15,62.210.85.178,TLSv1.2,4124,Application Data
1,7.986400000000231,62.210.85.178,10.0.2.15,TCP,60,9001  >  35978 [ACK] Seq=8345021 Ack=152329143 Win=65535 Len=0
1,7.986470000000281,62.210.85.178,10.0.2.15,TCP,60,9001  >  35978 [ACK] Seq=8345021 Ack=152330603 Win=65535 Len=0
1,7.986484000000019,62.210.85.178,10.0.2.15,TCP,60,9001  >  35978 [ACK] Seq=8345021 Ack=152331753 Win=65535 Len=0
1,7.986577000000125,10.0.2.15,62.210.85.178,TLSv1.2,4124,Application Data
1,7.986663000000135,10.0.2.15,62.210.85.178,TCP,2974,35978  >  9001 [ACK] Seq=152335823 Ack=8345021 Win=65535 Len=2920 [TCP segment of a reassembled PDU]
1,7.986732000000302,10.0.2.15,62.210.85.178,TLSv1.2,4434,Application Data [TCP segment of a reassembled PDU]
1,7.986861000000317,10.0.2.15,62.210.85.178,TLSv1.2,2974,"Application Data, Application Data"
1,7.98691800000006,62.210.85.178,10.0.2.15,TCP,60,9001  >  35978 [ACK] Seq=8345021 Ack=152333213 Win=65535 Len=0
1,7.986957000000075,62.210.85.178,10.0.2.15,TCP,60,9001  >  35978 [ACK] Seq=8345021 Ack=152334673 Win=65535 Len=0
1,7.9869659999999385,62.210.85.178,10.0.2.15,TCP,60,9001  >  35978 [ACK] Seq=8345021 Ack=152335823 Win=65535 Len=0
1,7.986971000000267,62.210.85.178,10.0.2.15,TCP,60,9001  >  35978 [ACK] Seq=8345021 Ack=152337283 Win=65535 Len=0
1,7.986977000000024,62.210.85.178,10.0.2.15,TCP,60,9001  >  35978 [ACK] Seq=8345021 Ack=152338743 Win=65535 Len=0
1,7.986982000000353,62.210.85.178,10.0.2.15,TCP,60,9001  >  35978 [ACK] Seq=8345021 Ack=152340203 Win=65535 Len=0
1,7.98698800000011,62.210.85.178,10.0.2.15,TCP,60,9001  >  35978 [ACK] Seq=8345021 Ack=152341663 Win=65535 Len=0
1,7.986994000000323,62.210.85.178,10.0.2.15,TCP,60,9001  >  35978 [ACK] Seq=8345021 Ack=152343123 Win=65535 Len=0
1,7.987000999999964,62.210.85.178,10.0.2.15,TCP,60,9001  >  35978 [ACK] Seq=8345021 Ack=152344583 Win=65535 Len=0
1,7.987008999999944,62.210.85.178,10.0.2.15,TCP,60,9001  >  35978 [ACK] Seq=8345021 Ack=152346043 Win=65535 Len=0
1,7.987093000000186,10.0.2.15,62.210.85.178,TLSv1.2,1358,Application Data
1,7.9874039999999695,62.210.85.178,10.0.2.15,TCP,60,9001  >  35978 [ACK] Seq=8345021 Ack=152347347 Win=65535 Len=0
1,8.189276000000064,54.93.77.70,10.0.2.15,TLSv1.2,3674,Application Data
1,8.189436999999998,10.0.2.15,54.93.77.70,TCP,54,34692  >  9001 [ACK] Seq=8377229 Ack=152153909 Win=65535 Len=0
1,8.209634000000278,54.93.77.70,10.0.2.15,TCP,2950,"9001  >  34692 [PSH, ACK] Seq=152153909 Ack=8377229 Win=65535 Len=2896 [TCP segment of a reassembled PDU]"
1,8.209849000000304,10.0.2.15,54.93.77.70,TCP,54,34692  >  9001 [ACK] Seq=8377229 Ack=152156805 Win=65535 Len=0
1,8.223300000000108,54.93.77.70,10.0.2.15,TLSv1.2,2950,Application Data [TCP segment of a reassembled PDU]
1,8.22378800000024,10.0.2.15,54.93.77.70,TCP,54,34692  >  9001 [ACK] Seq=8377229 Ack=152159701 Win=65535 Len=0
1,8.225750000000062,54.93.77.70,10.0.2.15,TCP,1502,"9001  >  34692 [PSH, ACK] Seq=152159701 Ack=8377229 Win=65535 Len=1448 [TCP segment of a reassembled PDU]"
1,8.225866000000224,10.0.2.15,54.93.77.70,TCP,54,34692  >  9001 [ACK] Seq=8377229 Ack=152161149 Win=65535 Len=0
1,8.23864900000035,54.93.77.70,10.0.2.15,TLSv1.2,2950,"Application Data, Application Data"
1,8.239522000000306,10.0.2.15,54.93.77.70,TCP,54,34692  >  9001 [ACK] Seq=8377229 Ack=152164045 Win=65535 Len=0
1,8.243518000000222,54.93.77.70,10.0.2.15,TCP,1502,"9001  >  34692 [PSH, ACK] Seq=152164045 Ack=8377229 Win=65535 Len=1448 [TCP segment of a reassembled PDU]"
1,8.24371199999996,10.0.2.15,54.93.77.70,TCP,54,34692  >  9001 [ACK] Seq=8377229 Ack=152165493 Win=65535 Len=0
1,8.24971000000005,54.93.77.70,10.0.2.15,TLSv1.2,2950,Application Data [TCP segment of a reassembled PDU]
1,8.249833000000308,10.0.2.15,54.93.77.70,TCP,54,34692  >  9001 [ACK] Seq=8377229 Ack=152168389 Win=65535 Len=0
1,8.269282000000203,54.93.77.70,10.0.2.15,TLSv1.2,2950,"Application Data, Application Data"
1,8.269368000000213,10.0.2.15,54.93.77.70,TCP,54,34692  >  9001 [ACK] Seq=8377229 Ack=152171285 Win=65535 Len=0
1,8.284105000000181,54.93.77.70,10.0.2.15,TCP,2950,"9001  >  34692 [PSH, ACK] Seq=152171285 Ack=8377229 Win=65535 Len=2896 [TCP segment of a reassembled PDU]"
1,8.284219000000121,10.0.2.15,54.93.77.70,TCP,54,34692  >  9001 [ACK] Seq=8377229 Ack=152174181 Win=65535 Len=0
1,8.290303000000222,54.93.77.70,10.0.2.15,TLSv1.2,1502,Application Data [TCP segment of a reassembled PDU]
1,8.290405000000192,10.0.2.15,54.93.77.70,TCP,54,34692  >  9001 [ACK] Seq=8377229 Ack=152175629 Win=65535 Len=0
1,8.293001000000004,54.93.77.70,10.0.2.15,TLSv1.2,1502,Application Data [TCP segment of a reassembled PDU]
1,8.2932780000001,10.0.2.15,54.93.77.70,TCP,54,34692  >  9001 [ACK] Seq=8377229 Ack=152177077 Win=65535 Len=0
1,8.293793000000278,10.0.2.15,54.93.77.70,TLSv1.2,590,Application Data
1,8.294243000000279,54.93.77.70,10.0.2.15,TCP,60,9001  >  34692 [ACK] Seq=152177077 Ack=8377765 Win=65535 Len=0
1,8.300553000000036,54.93.77.70,10.0.2.15,TCP,1502,"9001  >  34692 [PSH, ACK] Seq=152177077 Ack=8377765 Win=65535 Len=1448 [TCP segment of a reassembled PDU]"
1,8.300607000000127,54.93.77.70,10.0.2.15,TLSv1.2,1502,Application Data [TCP segment of a reassembled PDU]
1,8.300790000000234,10.0.2.15,54.93.77.70,TCP,54,34692  >  9001 [ACK] Seq=8377765 Ack=152178525 Win=65535 Len=0
1,8.300975999999991,10.0.2.15,54.93.77.70,TCP,54,34692  >  9001 [ACK] Seq=8377765 Ack=152179973 Win=65535 Len=0
1,8.30400200000031,54.93.77.70,10.0.2.15,TLSv1.2,2950,Application Data [TCP segment of a reassembled PDU]
1,8.304609000000255,10.0.2.15,54.93.77.70,TCP,54,34692  >  9001 [ACK] Seq=8377765 Ack=152182869 Win=65535 Len=0
1,8.318856000000324,54.93.77.70,10.0.2.15,TCP,2950,"9001  >  34692 [PSH, ACK] Seq=152182869 Ack=8377765 Win=65535 Len=2896 [TCP segment of a reassembled PDU]"
1,8.31896800000004,10.0.2.15,54.93.77.70,TCP,54,34692  >  9001 [ACK] Seq=8377765 Ack=152185765 Win=65535 Len=0
1,8.336782000000312,54.93.77.70,10.0.2.15,TLSv1.2,2950,"Application Data, Application Data"
1,8.336956999999984,54.93.77.70,10.0.2.15,TCP,1502,"9001  >  34692 [PSH, ACK] Seq=152188661 Ack=8377765 Win=65535 Len=1448 [TCP segment of a reassembled PDU]"
1,8.33703000000014,10.0.2.15,54.93.77.70,TCP,54,34692  >  9001 [ACK] Seq=8377765 Ack=152188661 Win=65535 Len=0
1,8.337165000000368,10.0.2.15,54.93.77.70,TCP,54,34692  >  9001 [ACK] Seq=8377765 Ack=152190109 Win=65535 Len=0
1,8.34070900000006,54.93.77.70,10.0.2.15,TLSv1.2,5846,"Application Data, Application Data, Application Data"
1,8.34084699999994,10.0.2.15,54.93.77.70,TCP,54,34692  >  9001 [ACK] Seq=8377765 Ack=152195901 Win=65535 Len=0
1,8.341597999999976,10.0.2.15,54.93.77.70,TLSv1.2,590,Application Data
1,8.34175200000027,54.93.77.70,10.0.2.15,TLSv1.2,2126,"Application Data, Application Data"
1,8.341885000000275,54.93.77.70,10.0.2.15,TCP,60,9001  >  34692 [ACK] Seq=152197973 Ack=8378301 Win=65535 Len=0
1,8.341991000000235,10.0.2.15,54.93.77.70,TCP,54,34692  >  9001 [ACK] Seq=8378301 Ack=152197973 Win=65535 Len=0
1,8.361090000000331,10.0.2.15,54.93.77.70,TLSv1.2,590,Application Data
1,8.36151400000017,54.93.77.70,10.0.2.15,TCP,60,9001  >  34692 [ACK] Seq=152197973 Ack=8378837 Win=65535 Len=0
1,8.414870999999948,62.210.85.178,10.0.2.15,TLSv1.2,590,Application Data
1,8.456813000000238,10.0.2.15,62.210.85.178,TCP,54,35978  >  9001 [ACK] Seq=152347347 Ack=8345557 Win=65535 Len=0
1,8.551930999999968,62.210.85.178,10.0.2.15,TLSv1.2,1104,Application Data
1,8.55204300000014,10.0.2.15,62.210.85.178,TCP,54,35978  >  9001 [ACK] Seq=152347347 Ack=8346607 Win=65535 Len=0
1,8.552496000000247,10.0.2.15,62.210.85.178,TLSv1.2,590,Application Data
1,8.553431000000273,62.210.85.178,10.0.2.15,TCP,60,9001  >  35978 [ACK] Seq=8346607 Ack=152347883 Win=65535 Len=0
1,8.669524000000365,54.93.77.70,10.0.2.15,TLSv1.2,590,Application Data
1,8.670642999999927,10.0.2.15,54.93.77.70,TLSv1.2,590,Application Data
1,8.671220000000176,54.93.77.70,10.0.2.15,TCP,60,9001  >  34692 [ACK] Seq=152198509 Ack=8379373 Win=65535 Len=0
1,8.787134000000151,62.210.85.178,10.0.2.15,TLSv1.2,590,Application Data
1,8.795388000000003,10.0.2.15,62.210.85.178,TLSv1.2,590,Application Data
1,8.795708999999988,62.210.85.178,10.0.2.15,TCP,60,9001  >  35978 [ACK] Seq=8347143 Ack=152348419 Win=65535 Len=0
1,8.805849000000308,10.0.2.15,62.210.85.178,TLSv1.2,4124,Application Data
1,8.806129000000055,62.210.85.178,10.0.2.15,TCP,60,9001  >  35978 [ACK] Seq=8347143 Ack=152349879 Win=65535 Len=0
1,8.806152000000111,62.210.85.178,10.0.2.15,TCP,60,9001  >  35978 [ACK] Seq=8347143 Ack=152351339 Win=65535 Len=0
1,8.806158000000323,62.210.85.178,10.0.2.15,TCP,60,9001  >  35978 [ACK] Seq=8347143 Ack=152352489 Win=65535 Len=0
1,8.806242999999995,10.0.2.15,62.210.85.178,TLSv1.2,4124,Application Data
1,8.806330000000344,10.0.2.15,62.210.85.178,TCP,2974,35978  >  9001 [ACK] Seq=152356559 Ack=8347143 Win=65535 Len=2920 [TCP segment of a reassembled PDU]
1,8.806379000000106,62.210.85.178,10.0.2.15,TCP,60,9001  >  35978 [ACK] Seq=8347143 Ack=152353949 Win=65535 Len=0
1,8.806389000000308,62.210.85.178,10.0.2.15,TCP,60,9001  >  35978 [ACK] Seq=8347143 Ack=152355409 Win=65535 Len=0
1,8.806394000000182,62.210.85.178,10.0.2.15,TCP,60,9001  >  35978 [ACK] Seq=8347143 Ack=152356559 Win=65535 Len=0
1,8.806399000000056,62.210.85.178,10.0.2.15,TCP,60,9001  >  35978 [ACK] Seq=8347143 Ack=152358019 Win=65535 Len=0
1,8.80640399999993,62.210.85.178,10.0.2.15,TCP,60,9001  >  35978 [ACK] Seq=8347143 Ack=152359479 Win=65535 Len=0
1,8.806444000000283,10.0.2.15,62.210.85.178,TLSv1.2,1204,Application Data
1,8.806535000000167,62.210.85.178,10.0.2.15,TCP,60,9001  >  35978 [ACK] Seq=8347143 Ack=152360629 Win=65535 Len=0
1,8.806601000000228,10.0.2.15,62.210.85.178,TLSv1.2,2838,Application Data
1,8.806671000000279,62.210.85.178,10.0.2.15,TCP,60,9001  >  35978 [ACK] Seq=8347143 Ack=152362089 Win=65535 Len=0
1,8.806681000000026,62.210.85.178,10.0.2.15,TCP,60,9001  >  35978 [ACK] Seq=8347143 Ack=152363413 Win=65535 Len=0
1,8.906449000000066,54.93.77.70,10.0.2.15,TCP,2950,"9001  >  34692 [PSH, ACK] Seq=152198509 Ack=8379373 Win=65535 Len=2896 [TCP segment of a reassembled PDU]"
1,8.906616000000213,10.0.2.15,54.93.77.70,TCP,54,34692  >  9001 [ACK] Seq=8379373 Ack=152201405 Win=65535 Len=0
1,8.906999000000269,54.93.77.70,10.0.2.15,TLSv1.2,778,Application Data
1,8.935018000000127,54.93.77.70,10.0.2.15,TLSv1.2,7294,Application Data
1,8.935189000000264,10.0.2.15,54.93.77.70,TCP,54,34692  >  9001 [ACK] Seq=8379373 Ack=152209369 Win=65535 Len=0
1,8.952959000000192,54.93.77.70,10.0.2.15,TLSv1.2,1104,"Application Data, Application Data"
1,8.996759000000111,10.0.2.15,54.93.77.70,TCP,54,34692  >  9001 [ACK] Seq=8379373 Ack=152210419 Win=65535 Len=0
1,8.999619000000166,54.93.77.70,10.0.2.15,TCP,2950,"9001  >  34692 [PSH, ACK] Seq=152210419 Ack=8379373 Win=65535 Len=2896 [TCP segment of a reassembled PDU]"
1,8.999705000000176,10.0.2.15,54.93.77.70,TCP,54,34692  >  9001 [ACK] Seq=8379373 Ack=152213315 Win=65535 Len=0
1,9.012312000000293,54.93.77.70,10.0.2.15,TLSv1.2,778,Application Data
1,9.01248600000008,10.0.2.15,54.93.77.70,TCP,54,34692  >  9001 [ACK] Seq=8379373 Ack=152214039 Win=65535 Len=0
1,9.015644000000066,10.0.2.15,54.93.77.70,TLSv1.2,590,Application Data
1,9.015842000000248,54.93.77.70,10.0.2.15,TCP,60,9001  >  34692 [ACK] Seq=152214039 Ack=8379909 Win=65535 Len=0
1,9.468843000000106,62.210.85.178,10.0.2.15,TLSv1.2,590,Application Data
1,9.469324000000142,10.0.2.15,62.210.85.178,TLSv1.2,590,Application Data
1,9.470002000000022,62.210.85.178,10.0.2.15,TCP,60,9001  >  35978 [ACK] Seq=8347679 Ack=152363949 Win=65535 Len=0
1,9.571992000000137,54.93.77.70,10.0.2.15,TLSv1.2,590,Application Data
1,9.573233000000073,10.0.2.15,54.93.77.70,TLSv1.2,590,Application Data
1,9.573660000000018,54.93.77.70,10.0.2.15,TCP,60,9001  >  34692 [ACK] Seq=152214575 Ack=8380445 Win=65535 Len=0
1,10.082849000000351,62.210.85.178,10.0.2.15,TLSv1.2,590,Application Data
1,10.094649000000118,10.0.2.15,62.210.85.178,TLSv1.2,590,Application Data
1,10.09482300000036,62.210.85.178,10.0.2.15,TCP,60,9001  >  35978 [ACK] Seq=8348215 Ack=152364485 Win=65535 Len=0
1,10.106149000000187,10.0.2.15,62.210.85.178,TLSv1.2,4124,Application Data
1,10.10627199999999,10.0.2.15,62.210.85.178,TCP,2974,35978  >  9001 [ACK] Seq=152368555 Ack=8348215 Win=65535 Len=2920 [TCP segment of a reassembled PDU]
1,10.106322999999975,62.210.85.178,10.0.2.15,TCP,60,9001  >  35978 [ACK] Seq=8348215 Ack=152365945 Win=65535 Len=0
1,10.106334999999945,62.210.85.178,10.0.2.15,TCP,60,9001  >  35978 [ACK] Seq=8348215 Ack=152367405 Win=65535 Len=0
1,10.106338999999934,62.210.85.178,10.0.2.15,TCP,60,9001  >  35978 [ACK] Seq=8348215 Ack=152368555 Win=65535 Len=0
1,10.10634200000004,62.210.85.178,10.0.2.15,TCP,60,9001  >  35978 [ACK] Seq=8348215 Ack=152370015 Win=65535 Len=0
1,10.106344000000263,62.210.85.178,10.0.2.15,TCP,60,9001  >  35978 [ACK] Seq=8348215 Ack=152371475 Win=65535 Len=0
1,10.106383000000278,10.0.2.15,62.210.85.178,TLSv1.2,1204,Application Data
1,10.106423000000177,62.210.85.178,10.0.2.15,TCP,60,9001  >  35978 [ACK] Seq=8348215 Ack=152372625 Win=65535 Len=0
1,10.106470000000172,10.0.2.15,62.210.85.178,TLSv1.2,4124,Application Data
1,10.106509000000187,62.210.85.178,10.0.2.15,TCP,60,9001  >  35978 [ACK] Seq=8348215 Ack=152374085 Win=65535 Len=0
1,10.106517000000167,62.210.85.178,10.0.2.15,TCP,60,9001  >  35978 [ACK] Seq=8348215 Ack=152375545 Win=65535 Len=0
1,10.106520000000273,62.210.85.178,10.0.2.15,TCP,60,9001  >  35978 [ACK] Seq=8348215 Ack=152376695 Win=65535 Len=0
1,10.106561000000056,10.0.2.15,62.210.85.178,TLSv1.2,4124,Application Data
1,10.106599000000188,62.210.85.178,10.0.2.15,TCP,60,9001  >  35978 [ACK] Seq=8348215 Ack=152378155 Win=65535 Len=0
1,10.106606000000284,62.210.85.178,10.0.2.15,TCP,60,9001  >  35978 [ACK] Seq=8348215 Ack=152379615 Win=65535 Len=0
1,10.106667000000016,10.0.2.15,62.210.85.178,TLSv1.2,2974,Application Data
1,10.106706000000031,62.210.85.178,10.0.2.15,TCP,60,9001  >  35978 [ACK] Seq=8348215 Ack=152380765 Win=65535 Len=0
1,10.10671400000001,62.210.85.178,10.0.2.15,TCP,60,9001  >  35978 [ACK] Seq=8348215 Ack=152382225 Win=65535 Len=0
1,10.106717000000117,62.210.85.178,10.0.2.15,TCP,60,9001  >  35978 [ACK] Seq=8348215 Ack=152383685 Win=65535 Len=0
1,10.10674599999993,10.0.2.15,62.210.85.178,TLSv1.2,1226,Application Data
1,10.106780000000072,62.210.85.178,10.0.2.15,TCP,60,9001  >  35978 [ACK] Seq=8348215 Ack=152384857 Win=65535 Len=0
1,10.106823000000077,10.0.2.15,62.210.85.178,TLSv1.2,4124,Application Data
1,10.106861000000208,62.210.85.178,10.0.2.15,TCP,60,9001  >  35978 [ACK] Seq=8348215 Ack=152386317 Win=65535 Len=0
1,10.106868000000304,62.210.85.178,10.0.2.15,TCP,60,9001  >  35978 [ACK] Seq=8348215 Ack=152387777 Win=65535 Len=0
1,10.106870999999956,62.210.85.178,10.0.2.15,TCP,60,9001  >  35978 [ACK] Seq=8348215 Ack=152388927 Win=65535 Len=0
1,10.106909000000087,10.0.2.15,62.210.85.178,TLSv1.2,3030,Application Data
1,10.106946000000335,62.210.85.178,10.0.2.15,TCP,60,9001  >  35978 [ACK] Seq=8348215 Ack=152390387 Win=65535 Len=0
1,10.106952999999976,62.210.85.178,10.0.2.15,TCP,60,9001  >  35978 [ACK] Seq=8348215 Ack=152391847 Win=65535 Len=0
1,10.106956000000082,62.210.85.178,10.0.2.15,TCP,60,9001  >  35978 [ACK] Seq=8348215 Ack=152391903 Win=65535 Len=0
1,10.11630200000036,10.0.2.15,62.210.85.178,TLSv1.2,4124,Application Data
1,10.116473000000042,62.210.85.178,10.0.2.15,TCP,60,9001  >  35978 [ACK] Seq=8348215 Ack=152393363 Win=65535 Len=0
1,10.11649400000033,62.210.85.178,10.0.2.15,TCP,60,9001  >  35978 [ACK] Seq=8348215 Ack=152394823 Win=65535 Len=0
1,10.116500999999971,62.210.85.178,10.0.2.15,TCP,60,9001  >  35978 [ACK] Seq=8348215 Ack=152395973 Win=65535 Len=0
1,10.116555999999946,10.0.2.15,62.210.85.178,TCP,2974,35978  >  9001 [ACK] Seq=152395973 Ack=8348215 Win=65535 Len=2920 [TCP segment of a reassembled PDU]
1,10.116757000000234,62.210.85.178,10.0.2.15,TCP,60,9001  >  35978 [ACK] Seq=8348215 Ack=152397433 Win=65535 Len=0
1,10.116774000000078,62.210.85.178,10.0.2.15,TCP,60,9001  >  35978 [ACK] Seq=8348215 Ack=152398893 Win=65535 Len=0
1,10.117866000000049,10.0.2.15,62.210.85.178,TLSv1.2,1204,Application Data
1,10.117983000000095,62.210.85.178,10.0.2.15,TCP,60,9001  >  35978 [ACK] Seq=8348215 Ack=152400043 Win=65535 Len=0
1,10.118097000000034,10.0.2.15,62.210.85.178,TLSv1.2,4124,Application Data
1,10.11818200000016,62.210.85.178,10.0.2.15,TCP,60,9001  >  35978 [ACK] Seq=8348215 Ack=152401503 Win=65535 Len=0
1,10.118192000000363,62.210.85.178,10.0.2.15,TCP,60,9001  >  35978 [ACK] Seq=8348215 Ack=152402963 Win=65535 Len=0
1,10.118195000000014,62.210.85.178,10.0.2.15,TCP,60,9001  >  35978 [ACK] Seq=8348215 Ack=152404113 Win=65535 Len=0
1,10.11823400000003,10.0.2.15,62.210.85.178,TLSv1.2,4124,Application Data
1,10.118303000000196,62.210.85.178,10.0.2.15,TCP,60,9001  >  35978 [ACK] Seq=8348215 Ack=152405573 Win=65535 Len=0
1,10.118312999999944,62.210.85.178,10.0.2.15,TCP,60,9001  >  35978 [ACK] Seq=8348215 Ack=152407033 Win=65535 Len=0
1,10.11831600000005,62.210.85.178,10.0.2.15,TCP,60,9001  >  35978 [ACK] Seq=8348215 Ack=152408183 Win=65535 Len=0
1,10.118357000000287,10.0.2.15,62.210.85.178,TLSv1.2,332,Application Data
1,10.118566999999985,62.210.85.178,10.0.2.15,TCP,60,9001  >  35978 [ACK] Seq=8348215 Ack=152408461 Win=65535 Len=0
1,10.118644000000131,10.0.2.15,62.210.85.178,TLSv1.2,3868,Application Data
1,10.118729000000258,62.210.85.178,10.0.2.15,TCP,60,9001  >  35978 [ACK] Seq=8348215 Ack=152409921 Win=65535 Len=0
1,10.118739000000005,62.210.85.178,10.0.2.15,TCP,60,9001  >  35978 [ACK] Seq=8348215 Ack=152411381 Win=65535 Len=0
1,10.118744000000333,62.210.85.178,10.0.2.15,TCP,60,9001  >  35978 [ACK] Seq=8348215 Ack=152412275 Win=65535 Len=0
1,10.118812000000162,10.0.2.15,62.210.85.178,TLSv1.2,4124,Application Data
1,10.118885000000319,10.0.2.15,62.210.85.178,TCP,2974,35978  >  9001 [ACK] Seq=152416345 Ack=8348215 Win=65535 Len=2920 [TCP segment of a reassembled PDU]
1,10.118983000000298,62.210.85.178,10.0.2.15,TCP,60,9001  >  35978 [ACK] Seq=8348215 Ack=152413735 Win=65535 Len=0
1,10.118995000000268,62.210.85.178,10.0.2.15,TCP,60,9001  >  35978 [ACK] Seq=8348215 Ack=152415195 Win=65535 Len=0
1,10.119003000000248,62.210.85.178,10.0.2.15,TCP,60,9001  >  35978 [ACK] Seq=8348215 Ack=152416345 Win=65535 Len=0
1,10.119009000000005,62.210.85.178,10.0.2.15,TCP,60,9001  >  35978 [ACK] Seq=8348215 Ack=152417805 Win=65535 Len=0
1,10.119014000000334,62.210.85.178,10.0.2.15,TCP,60,9001  >  35978 [ACK] Seq=8348215 Ack=152419265 Win=65535 Len=0
1,10.119067000000086,10.0.2.15,62.210.85.178,TLSv1.2,110,Application Data
1,10.119146,62.210.85.178,10.0.2.15,TCP,60,9001  >  35978 [ACK] Seq=8348215 Ack=152419321 Win=65535 Len=0
1,10.129720000000361,10.0.2.15,62.210.85.178,TLSv1.2,4124,Application Data
1,10.129875999999967,10.0.2.15,62.210.85.178,TCP,2974,35978  >  9001 [ACK] Seq=152423391 Ack=8348215 Win=65535 Len=2920 [TCP segment of a reassembled PDU]
1,10.12998000000016,62.210.85.178,10.0.2.15,TCP,60,9001  >  35978 [ACK] Seq=8348215 Ack=152420781 Win=65535 Len=0
1,10.129993000000013,62.210.85.178,10.0.2.15,TCP,60,9001  >  35978 [ACK] Seq=8348215 Ack=152422241 Win=65535 Len=0
1,10.130000999999993,62.210.85.178,10.0.2.15,TCP,60,9001  >  35978 [ACK] Seq=8348215 Ack=152423391 Win=65535 Len=0
1,10.130004999999983,62.210.85.178,10.0.2.15,TCP,60,9001  >  35978 [ACK] Seq=8348215 Ack=152424851 Win=65535 Len=0
1,10.130010000000311,62.210.85.178,10.0.2.15,TCP,60,9001  >  35978 [ACK] Seq=8348215 Ack=152426311 Win=65535 Len=0
1,10.130059999999958,10.0.2.15,62.210.85.178,TLSv1.2,1204,Application Data
1,10.130105000000185,62.210.85.178,10.0.2.15,TCP,60,9001  >  35978 [ACK] Seq=8348215 Ack=152427461 Win=65535 Len=0
1,10.130163000000266,10.0.2.15,62.210.85.178,TLSv1.2,4124,Application Data
1,10.130247000000054,62.210.85.178,10.0.2.15,TCP,60,9001  >  35978 [ACK] Seq=8348215 Ack=152428921 Win=65535 Len=0
1,10.130255000000034,62.210.85.178,10.0.2.15,TCP,60,9001  >  35978 [ACK] Seq=8348215 Ack=152430381 Win=65535 Len=0
1,10.130260000000362,62.210.85.178,10.0.2.15,TCP,60,9001  >  35978 [ACK] Seq=8348215 Ack=152431531 Win=65535 Len=0
1,10.130308000000241,10.0.2.15,62.210.85.178,TLSv1.2,4124,Application Data
1,10.13035200000013,62.210.85.178,10.0.2.15,TCP,60,9001  >  35978 [ACK] Seq=8348215 Ack=152432991 Win=65535 Len=0
1,10.130359000000226,62.210.85.178,10.0.2.15,TCP,60,9001  >  35978 [ACK] Seq=8348215 Ack=152434451 Win=65535 Len=0
1,10.1303640000001,62.210.85.178,10.0.2.15,TCP,60,9001  >  35978 [ACK] Seq=8348215 Ack=152435601 Win=65535 Len=0
1,10.13041000000021,10.0.2.15,62.210.85.178,TLSv1.2,332,Application Data
1,10.130454999999984,62.210.85.178,10.0.2.15,TCP,60,9001  >  35978 [ACK] Seq=8348215 Ack=152435879 Win=65535 Len=0
1,10.130526000000373,10.0.2.15,62.210.85.178,TLSv1.2,3868,Application Data
1,10.130573000000368,62.210.85.178,10.0.2.15,TCP,60,9001  >  35978 [ACK] Seq=8348215 Ack=152437339 Win=65535 Len=0
1,10.130580000000009,62.210.85.178,10.0.2.15,TCP,60,9001  >  35978 [ACK] Seq=8348215 Ack=152438799 Win=65535 Len=0
1,10.130585000000337,62.210.85.178,10.0.2.15,TCP,60,9001  >  35978 [ACK] Seq=8348215 Ack=152439693 Win=65535 Len=0
1,10.130637000000206,10.0.2.15,62.210.85.178,TLSv1.2,4124,Application Data
1,10.130680000000211,62.210.85.178,10.0.2.15,TCP,60,9001  >  35978 [ACK] Seq=8348215 Ack=152441153 Win=65535 Len=0
1,10.130687000000307,62.210.85.178,10.0.2.15,TCP,60,9001  >  35978 [ACK] Seq=8348215 Ack=152442613 Win=65535 Len=0
1,10.130692000000181,62.210.85.178,10.0.2.15,TCP,60,9001  >  35978 [ACK] Seq=8348215 Ack=152443763 Win=65535 Len=0
1,10.13074000000006,10.0.2.15,62.210.85.178,TLSv1.2,1488,Application Data
1,10.130787000000055,62.210.85.178,10.0.2.15,TCP,60,9001  >  35978 [ACK] Seq=8348215 Ack=152445197 Win=65535 Len=0
1,10.222232000000076,54.93.77.70,10.0.2.15,TLSv1.2,3674,Application Data
1,10.222388000000137,10.0.2.15,54.93.77.70,TCP,54,34692  >  9001 [ACK] Seq=8380445 Ack=152218195 Win=65535 Len=0
1,10.234063000000333,54.93.77.70,10.0.2.15,TCP,2950,"9001  >  34692 [PSH, ACK] Seq=152218195 Ack=8380445 Win=65535 Len=2896 [TCP segment of a reassembled PDU]"
1,10.23425700000007,10.0.2.15,54.93.77.70,TCP,54,34692  >  9001 [ACK] Seq=8380445 Ack=152221091 Win=65535 Len=0
1,10.239111000000321,54.93.77.70,10.0.2.15,TLSv1.2,1314,"Application Data, Application Data"
1,10.246401000000333,54.93.77.70,10.0.2.15,TCP,2950,"9001  >  34692 [PSH, ACK] Seq=152222351 Ack=8380445 Win=65535 Len=2896 [TCP segment of a reassembled PDU]"
1,10.246528000000126,10.0.2.15,54.93.77.70,TCP,54,34692  >  9001 [ACK] Seq=8380445 Ack=152225247 Win=65535 Len=0
1,10.254893000000266,54.93.77.70,10.0.2.15,TLSv1.2,778,Application Data
1,10.258094000000256,54.93.77.70,10.0.2.15,TCP,2950,"9001  >  34692 [PSH, ACK] Seq=152225971 Ack=8380445 Win=65535 Len=2896 [TCP segment of a reassembled PDU]"
1,10.258203000000321,10.0.2.15,54.93.77.70,TCP,54,34692  >  9001 [ACK] Seq=8380445 Ack=152228867 Win=65535 Len=0
1,10.27371200000016,54.93.77.70,10.0.2.15,TLSv1.2,778,Application Data
1,10.294630000000325,54.93.77.70,10.0.2.15,TLSv1.2,4724,"Application Data, Application Data"
1,10.29506500000025,10.0.2.15,54.93.77.70,TCP,54,34692  >  9001 [ACK] Seq=8380445 Ack=152234261 Win=65535 Len=0
1,10.346953000000212,54.93.77.70,10.0.2.15,TLSv1.2,3674,Application Data
1,10.347052000000076,10.0.2.15,54.93.77.70,TCP,54,34692  >  9001 [ACK] Seq=8380445 Ack=152237881 Win=65535 Len=0
1,10.364655000000312,54.93.77.70,10.0.2.15,TLSv1.2,590,Application Data
1,10.384774000000107,54.93.77.70,10.0.2.15,TCP,2950,"9001  >  34692 [PSH, ACK] Seq=152238417 Ack=8380445 Win=65535 Len=2896 [TCP segment of a reassembled PDU]"
1,10.384898000000248,10.0.2.15,54.93.77.70,TCP,54,34692  >  9001 [ACK] Seq=8380445 Ack=152241313 Win=65535 Len=0
1,10.38497899999993,54.93.77.70,10.0.2.15,TLSv1.2,778,Application Data
1,10.385253000000375,10.0.2.15,54.93.77.70,TLSv1.2,590,Application Data
1,10.385637000000315,54.93.77.70,10.0.2.15,TCP,60,9001  >  34692 [ACK] Seq=152242037 Ack=8380981 Win=65535 Len=0
1,10.39939400000003,54.93.77.70,10.0.2.15,TLSv1.2,2950,Application Data
1,10.3995460000001,10.0.2.15,54.93.77.70,TCP,54,34692  >  9001 [ACK] Seq=8380981 Ack=152244933 Win=65535 Len=0
1,10.399793999999929,54.93.77.70,10.0.2.15,TCP,1502,"9001  >  34692 [PSH, ACK] Seq=152244933 Ack=8380981 Win=65535 Len=1448 [TCP segment of a reassembled PDU]"
1,10.399834000000283,10.0.2.15,54.93.77.70,TCP,54,34692  >  9001 [ACK] Seq=8380981 Ack=152246381 Win=65535 Len=0
1,10.432856000000356,54.93.77.70,10.0.2.15,TLSv1.2,2950,"Application Data, Application Data"
1,10.432903000000351,54.93.77.70,10.0.2.15,TLSv1.2,2154,Application Data
1,10.432920000000195,54.93.77.70,10.0.2.15,TCP,2950,"9001  >  34692 [PSH, ACK] Seq=152251377 Ack=8380981 Win=65535 Len=2896 [TCP segment of a reassembled PDU]"
1,10.432990000000245,10.0.2.15,54.93.77.70,TCP,54,34692  >  9001 [ACK] Seq=8380981 Ack=152249277 Win=65535 Len=0
1,10.43313500000022,10.0.2.15,54.93.77.70,TCP,54,34692  >  9001 [ACK] Seq=8380981 Ack=152254273 Win=65535 Len=0
1,10.433373000000302,10.0.2.15,54.93.77.70,TLSv1.2,590,Application Data
1,10.434226000000308,54.93.77.70,10.0.2.15,TCP,60,9001  >  34692 [ACK] Seq=152254273 Ack=8381517 Win=65535 Len=0
1,10.445071000000098,54.93.77.70,10.0.2.15,TLSv1.2,2950,Application Data [TCP segment of a reassembled PDU]
1,10.44521500000019,10.0.2.15,54.93.77.70,TCP,54,34692  >  9001 [ACK] Seq=8381517 Ack=152257169 Win=65535 Len=0
1,10.450624000000062,54.93.77.70,10.0.2.15,TLSv1.2,8742,"Application Data, Application Data, Application Data"
1,10.450850000000173,10.0.2.15,54.93.77.70,TCP,54,34692  >  9001 [ACK] Seq=8381517 Ack=152265857 Win=65535 Len=0
1,10.451888999999937,54.93.77.70,10.0.2.15,TLSv1.2,1126,"Application Data, Application Data"
1,10.452131000000008,10.0.2.15,54.93.77.70,TLSv1.2,590,Application Data
1,10.452536000000237,54.93.77.70,10.0.2.15,TCP,60,9001  >  34692 [ACK] Seq=152266929 Ack=8382053 Win=65535 Len=0
1,10.45687799999996,54.93.77.70,10.0.2.15,TCP,1502,"9001  >  34692 [PSH, ACK] Seq=152266929 Ack=8382053 Win=65535 Len=1448 [TCP segment of a reassembled PDU]"
1,10.457194999999956,10.0.2.15,54.93.77.70,TCP,54,34692  >  9001 [ACK] Seq=8382053 Ack=152268377 Win=65535 Len=0
1,10.465642000000116,54.93.77.70,10.0.2.15,TLSv1.2,2950,Application Data [TCP segment of a reassembled PDU]
1,10.465750000000298,10.0.2.15,54.93.77.70,TCP,54,34692  >  9001 [ACK] Seq=8382053 Ack=152271273 Win=65535 Len=0
1,10.468307999999979,54.93.77.70,10.0.2.15,TLSv1.2,2950,Application Data
1,10.468438000000333,10.0.2.15,54.93.77.70,TCP,54,34692  >  9001 [ACK] Seq=8382053 Ack=152274169 Win=65535 Len=0
1,10.470228000000134,54.93.77.70,10.0.2.15,TLSv1.2,3674,Application Data
1,10.47038300000031,10.0.2.15,54.93.77.70,TCP,54,34692  >  9001 [ACK] Seq=8382053 Ack=152277789 Win=65535 Len=0
1,10.48183199999994,54.93.77.70,10.0.2.15,TCP,2950,"9001  >  34692 [PSH, ACK] Seq=152277789 Ack=8382053 Win=65535 Len=2896 [TCP segment of a reassembled PDU]"
1,10.481944999999996,10.0.2.15,54.93.77.70,TCP,54,34692  >  9001 [ACK] Seq=8382053 Ack=152280685 Win=65535 Len=0
1,10.487728999999945,54.93.77.70,10.0.2.15,TLSv1.2,1314,"Application Data, Application Data"
1,10.506138000000192,54.93.77.70,10.0.2.15,TLSv1.2,2950,Application Data
1,10.50618200000008,54.93.77.70,10.0.2.15,TCP,1502,"9001  >  34692 [PSH, ACK] Seq=152284841 Ack=8382053 Win=65535 Len=1448 [TCP segment of a reassembled PDU]"
1,10.506247000000258,10.0.2.15,54.93.77.70,TCP,54,34692  >  9001 [ACK] Seq=8382053 Ack=152284841 Win=65535 Len=0
1,10.506383000000369,10.0.2.15,54.93.77.70,TCP,54,34692  >  9001 [ACK] Seq=8382053 Ack=152286289 Win=65535 Len=0
1,10.52257099999997,54.93.77.70,10.0.2.15,TLSv1.2,2950,Application Data [TCP segment of a reassembled PDU]
1,10.522663000000193,10.0.2.15,54.93.77.70,TCP,54,34692  >  9001 [ACK] Seq=8382053 Ack=152289185 Win=65535 Len=0
1,10.523519000000306,54.93.77.70,10.0.2.15,TLSv1.2,1104,Application Data
1,10.523538000000372,62.210.85.178,10.0.2.15,TLSv1.2,590,Application Data
1,10.555184000000281,54.93.77.70,10.0.2.15,TLSv1.2,2950,Application Data
1,10.555279000000155,10.0.2.15,54.93.77.70,TCP,54,34692  >  9001 [ACK] Seq=8382053 Ack=152293131 Win=65535 Len=0
1,10.555560000000241,54.93.77.70,10.0.2.15,TCP,1502,"9001  >  34692 [PSH, ACK] Seq=152293131 Ack=8382053 Win=65535 Len=1448 [TCP segment of a reassembled PDU]"
1,10.555612999999994,10.0.2.15,54.93.77.70,TCP,54,34692  >  9001 [ACK] Seq=8382053 Ack=152294579 Win=65535 Len=0
1,10.564802000000327,10.0.2.15,62.210.85.178,TCP,54,35978  >  9001 [ACK] Seq=152445197 Ack=8348751 Win=65535 Len=0
1,10.571631000000252,54.93.77.70,10.0.2.15,TLSv1.2,380,Application Data
1,10.571913000000222,10.0.2.15,54.93.77.70,TLSv1.2,590,Application Data
1,10.572014000000308,54.93.77.70,10.0.2.15,TCP,60,9001  >  34692 [ACK] Seq=152294905 Ack=8382589 Win=65535 Len=0
1,10.622755000000325,62.210.85.178,10.0.2.15,TLSv1.2,1104,Application Data
1,10.622983000000204,10.0.2.15,62.210.85.178,TCP,54,35978  >  9001 [ACK] Seq=152445197 Ack=8349801 Win=65535 Len=0
1,10.718644999999924,62.210.85.178,10.0.2.15,TLSv1.2,590,Application Data
1,10.718760000000202,10.0.2.15,62.210.85.178,TCP,54,35978  >  9001 [ACK] Seq=152445197 Ack=8350337 Win=65535 Len=0
1,10.780519000000368,54.93.77.70,10.0.2.15,TLSv1.2,1104,Application Data
1,10.783822000000328,10.0.2.15,54.93.77.70,TLSv1.2,590,Application Data
1,10.784148000000187,54.93.77.70,10.0.2.15,TCP,60,9001  >  34692 [ACK] Seq=152295955 Ack=8383125 Win=65535 Len=0
1,10.894082000000253,62.210.85.178,10.0.2.15,TLSv1.2,590,Application Data
1,10.89419799999996,10.0.2.15,62.210.85.178,TCP,54,35978  >  9001 [ACK] Seq=152445197 Ack=8350873 Win=65535 Len=0
1,10.8952790000003,10.0.2.15,62.210.85.178,TLSv1.2,590,Application Data
1,10.89562500000011,62.210.85.178,10.0.2.15,TCP,60,9001  >  35978 [ACK] Seq=8350873 Ack=152445733 Win=65535 Len=0
1,11.926968000000215,54.93.77.70,10.0.2.15,TLSv1.2,590,Application Data
1,11.92768500000011,10.0.2.15,54.93.77.70,TLSv1.2,590,Application Data
1,11.928031000000374,54.93.77.70,10.0.2.15,TCP,60,9001  >  34692 [ACK] Seq=152296491 Ack=8383661 Win=65535 Len=0
1,11.929431000000022,52.24.195.172,10.0.2.15,TLSv1.2,85,Application Data
1,11.929747000000134,10.0.2.15,52.24.195.172,TLSv1.2,89,Application Data
1,11.929863000000296,52.24.195.172,10.0.2.15,TCP,60,443  >  36862 [ACK] Seq=439 Ack=495 Win=65535 Len=0
1,12.23118599999998,62.210.85.178,10.0.2.15,TLSv1.2,590,Application Data
1,12.241669000000002,10.0.2.15,62.210.85.178,TLSv1.2,590,Application Data
1,12.241937000000235,62.210.85.178,10.0.2.15,TCP,60,9001  >  35978 [ACK] Seq=8351409 Ack=152446269 Win=65535 Len=0
1,12.254137000000355,10.0.2.15,62.210.85.178,TLSv1.2,4124,Application Data
1,12.25430200000028,10.0.2.15,62.210.85.178,TCP,2974,35978  >  9001 [ACK] Seq=152450339 Ack=8351409 Win=65535 Len=2920 [TCP segment of a reassembled PDU]
1,12.254363000000012,62.210.85.178,10.0.2.15,TCP,60,9001  >  35978 [ACK] Seq=8351409 Ack=152447729 Win=65535 Len=0
1,12.25437600000032,62.210.85.178,10.0.2.15,TCP,60,9001  >  35978 [ACK] Seq=8351409 Ack=152449189 Win=65535 Len=0
1,12.254381000000194,62.210.85.178,10.0.2.15,TCP,60,9001  >  35978 [ACK] Seq=8351409 Ack=152450339 Win=65535 Len=0
1,12.254386000000068,62.210.85.178,10.0.2.15,TCP,60,9001  >  35978 [ACK] Seq=8351409 Ack=152451799 Win=65535 Len=0
1,12.254390000000058,62.210.85.178,10.0.2.15,TCP,60,9001  >  35978 [ACK] Seq=8351409 Ack=152453259 Win=65535 Len=0
1,12.254441000000043,10.0.2.15,62.210.85.178,TLSv1.2,1204,Application Data
1,12.25448600000027,62.210.85.178,10.0.2.15,TCP,60,9001  >  35978 [ACK] Seq=8351409 Ack=152454409 Win=65535 Len=0
1,12.254543000000012,10.0.2.15,62.210.85.178,TLSv1.2,4124,Application Data
1,12.254613000000063,62.210.85.178,10.0.2.15,TCP,60,9001  >  35978 [ACK] Seq=8351409 Ack=152455869 Win=65535 Len=0
1,12.254621000000043,62.210.85.178,10.0.2.15,TCP,60,9001  >  35978 [ACK] Seq=8351409 Ack=152457329 Win=65535 Len=0
1,12.254624000000149,62.210.85.178,10.0.2.15,TCP,60,9001  >  35978 [ACK] Seq=8351409 Ack=152458479 Win=65535 Len=0
1,12.254660999999942,10.0.2.15,62.210.85.178,TLSv1.2,4124,Application Data
1,12.254733000000215,62.210.85.178,10.0.2.15,TCP,60,9001  >  35978 [ACK] Seq=8351409 Ack=152459939 Win=65535 Len=0
1,12.254741000000195,62.210.85.178,10.0.2.15,TCP,60,9001  >  35978 [ACK] Seq=8351409 Ack=152461399 Win=65535 Len=0
1,12.254745000000185,62.210.85.178,10.0.2.15,TCP,60,9001  >  35978 [ACK] Seq=8351409 Ack=152462549 Win=65535 Len=0
1,12.254785000000084,10.0.2.15,62.210.85.178,TLSv1.2,332,Application Data
1,12.254823000000215,62.210.85.178,10.0.2.15,TCP,60,9001  >  35978 [ACK] Seq=8351409 Ack=152462827 Win=65535 Len=0
1,12.254885000000286,10.0.2.15,62.210.85.178,TLSv1.2,3868,Application Data
1,12.254922999999962,62.210.85.178,10.0.2.15,TCP,60,9001  >  35978 [ACK] Seq=8351409 Ack=152464287 Win=65535 Len=0
1,12.254969999999958,10.0.2.15,62.210.85.178,TCP,2974,35978  >  9001 [ACK] Seq=152466641 Ack=8351409 Win=65535 Len=2920 [TCP segment of a reassembled PDU]
1,12.255008000000089,62.210.85.178,10.0.2.15,TCP,60,9001  >  35978 [ACK] Seq=8351409 Ack=152465747 Win=65535 Len=0
1,12.255015000000185,62.210.85.178,10.0.2.15,TCP,60,9001  >  35978 [ACK] Seq=8351409 Ack=152466641 Win=65535 Len=0
1,12.255018000000291,62.210.85.178,10.0.2.15,TCP,60,9001  >  35978 [ACK] Seq=8351409 Ack=152468101 Win=65535 Len=0
1,12.255020999999942,62.210.85.178,10.0.2.15,TCP,60,9001  >  35978 [ACK] Seq=8351409 Ack=152469561 Win=65535 Len=0
1,12.255051000000094,10.0.2.15,62.210.85.178,TLSv1.2,1204,Application Data
1,12.255085000000236,62.210.85.178,10.0.2.15,TCP,60,9001  >  35978 [ACK] Seq=8351409 Ack=152470711 Win=65535 Len=0
1,12.255127000000357,10.0.2.15,62.210.85.178,TLSv1.2,3030,Application Data
1,12.25516400000015,62.210.85.178,10.0.2.15,TCP,60,9001  >  35978 [ACK] Seq=8351409 Ack=152472171 Win=65535 Len=0
1,12.25517200000013,62.210.85.178,10.0.2.15,TCP,60,9001  >  35978 [ACK] Seq=8351409 Ack=152473631 Win=65535 Len=0
1,12.255175000000236,62.210.85.178,10.0.2.15,TCP,60,9001  >  35978 [ACK] Seq=8351409 Ack=152473687 Win=65535 Len=0
1,12.264427000000069,10.0.2.15,62.210.85.178,TLSv1.2,4124,Application Data
1,12.264585000000352,62.210.85.178,10.0.2.15,TCP,60,9001  >  35978 [ACK] Seq=8351409 Ack=152475147 Win=65535 Len=0
1,12.264601000000312,62.210.85.178,10.0.2.15,TCP,60,9001  >  35978 [ACK] Seq=8351409 Ack=152476607 Win=65535 Len=0
1,12.264603999999963,62.210.85.178,10.0.2.15,TCP,60,9001  >  35978 [ACK] Seq=8351409 Ack=152477757 Win=65535 Len=0
1,12.264650999999958,10.0.2.15,62.210.85.178,TLSv1.2,4124,Application Data
1,12.264720000000125,62.210.85.178,10.0.2.15,TCP,60,9001  >  35978 [ACK] Seq=8351409 Ack=152479217 Win=65535 Len=0
1,12.26473100000021,62.210.85.178,10.0.2.15,TCP,60,9001  >  35978 [ACK] Seq=8351409 Ack=152480677 Win=65535 Len=0
1,12.264734000000317,62.210.85.178,10.0.2.15,TCP,60,9001  >  35978 [ACK] Seq=8351409 Ack=152481827 Win=65535 Len=0
1,12.264786000000186,10.0.2.15,62.210.85.178,TLSv1.2,2260,Application Data
1,12.264826999999968,62.210.85.178,10.0.2.15,TCP,60,9001  >  35978 [ACK] Seq=8351409 Ack=152483287 Win=65535 Len=0
1,12.264834999999948,62.210.85.178,10.0.2.15,TCP,60,9001  >  35978 [ACK] Seq=8351409 Ack=152484033 Win=65535 Len=0
1,12.371689999999944,54.93.77.70,10.0.2.15,TLSv1.2,4398,Application Data
1,12.372009000000162,10.0.2.15,54.93.77.70,TCP,54,34692  >  9001 [ACK] Seq=8383661 Ack=152300835 Win=65535 Len=0
1,12.372400000000198,10.0.2.15,54.93.77.70,TLSv1.2,590,Application Data
1,12.372734000000037,54.93.77.70,10.0.2.15,TCP,60,9001  >  34692 [ACK] Seq=152300835 Ack=8384197 Win=65535 Len=0
1,12.373455000000376,54.93.77.70,10.0.2.15,TLSv1.2,2950,Application Data
1,12.37367200000017,10.0.2.15,54.93.77.70,TCP,54,34692  >  9001 [ACK] Seq=8384197 Ack=152303731 Win=65535 Len=0
1,12.397531999999956,54.93.77.70,10.0.2.15,TLSv1.2,1104,Application Data
1,12.410871999999927,54.93.77.70,10.0.2.15,TCP,2950,"9001  >  34692 [PSH, ACK] Seq=152304781 Ack=8384197 Win=65535 Len=2896 [TCP segment of a reassembled PDU]"
1,12.4109940000003,10.0.2.15,54.93.77.70,TCP,54,34692  >  9001 [ACK] Seq=8384197 Ack=152307677 Win=65535 Len=0
1,12.413857000000007,54.93.77.70,10.0.2.15,TLSv1.2,778,Application Data
1,12.421528000000308,54.93.77.70,10.0.2.15,TCP,2950,"9001  >  34692 [PSH, ACK] Seq=152308401 Ack=8384197 Win=65535 Len=2896 [TCP segment of a reassembled PDU]"
1,12.421684000000369,10.0.2.15,54.93.77.70,TCP,54,34692  >  9001 [ACK] Seq=8384197 Ack=152311297 Win=65535 Len=0
1,12.430487000000085,54.93.77.70,10.0.2.15,TLSv1.2,778,Application Data
1,12.433093000000099,54.93.77.70,10.0.2.15,TLSv1.2,7294,Application Data
1,12.433190000000195,10.0.2.15,54.93.77.70,TCP,54,34692  >  9001 [ACK] Seq=8384197 Ack=152319261 Win=65535 Len=0
1,12.446347999999944,54.93.77.70,10.0.2.15,TLSv1.2,568,Application Data
1,12.45557400000007,54.93.77.70,10.0.2.15,TCP,2950,"9001  >  34692 [PSH, ACK] Seq=152319775 Ack=8384197 Win=65535 Len=2896 [TCP segment of a reassembled PDU]"
1,12.455685000000358,10.0.2.15,54.93.77.70,TCP,54,34692  >  9001 [ACK] Seq=8384197 Ack=152322671 Win=65535 Len=0
1,12.456185000000005,54.93.77.70,10.0.2.15,TLSv1.2,4398,Application Data [TCP segment of a reassembled PDU]
1,12.456250000000182,10.0.2.15,54.93.77.70,TCP,54,34692  >  9001 [ACK] Seq=8384197 Ack=152327015 Win=65535 Len=0
1,12.456419000000096,10.0.2.15,54.93.77.70,TLSv1.2,590,Application Data
1,12.456492000000253,54.93.77.70,10.0.2.15,TCP,60,9001  >  34692 [ACK] Seq=152327015 Ack=8384733 Win=65535 Len=0
1,12.462449000000106,54.93.77.70,10.0.2.15,TLSv1.2,568,Application Data
1,12.467313000000104,54.93.77.70,10.0.2.15,TCP,2950,"9001  >  34692 [PSH, ACK] Seq=152327529 Ack=8384733 Win=65535 Len=2896 [TCP segment of a reassembled PDU]"
1,12.467364999999972,54.93.77.70,10.0.2.15,TLSv1.2,2950,Application Data [TCP segment of a reassembled PDU]
1,12.46743400000014,10.0.2.15,54.93.77.70,TCP,54,34692  >  9001 [ACK] Seq=8384733 Ack=152330425 Win=65535 Len=0
1,12.467572000000018,10.0.2.15,54.93.77.70,TCP,54,34692  >  9001 [ACK] Seq=8384733 Ack=152333321 Win=65535 Len=0
1,12.47286800000029,54.93.77.70,10.0.2.15,TLSv1.2,1502,Application Data
1,12.472973000000366,10.0.2.15,54.93.77.70,TCP,54,34692  >  9001 [ACK] Seq=8384733 Ack=152334769 Win=65535 Len=0
1,12.538636000000224,62.210.85.178,10.0.2.15,TLSv1.2,590,Application Data
