No.,Time,Source,Destination,Protocol,Length,Info
1,0.01853499999970154,10.0.2.15,62.210.85.178,TCP,54,35978  >  9001 [ACK] Seq=166587231 Ack=9130645 Win=65535 Len=0
1,0.028998999999657826,10.0.2.15,54.93.77.70,TCP,54,34692  >  9001 [ACK] Seq=9169513 Ack=166440999 Win=65535 Len=0
1,0.03686999999990803,62.210.85.178,10.0.2.15,TLSv1.2,590,Application Data
1,0.03700899999967078,10.0.2.15,62.210.85.178,TCP,54,35978  >  9001 [ACK] Seq=166587231 Ack=9131181 Win=65535 Len=0
1,0.058153999999831285,62.210.85.178,10.0.2.15,TLSv1.2,1104,Application Data
1,0.058237999999619205,10.0.2.15,62.210.85.178,TCP,54,35978  >  9001 [ACK] Seq=166587231 Ack=9132231 Win=65535 Len=0
1,0.13705499999969106,10.0.2.15,54.93.77.70,TLSv1.2,590,Application Data
1,0.13723099999970145,54.93.77.70,10.0.2.15,TCP,60,9001  >  34692 [ACK] Seq=166440999 Ack=9170049 Win=65535 Len=0
1,1.0593699999999444,62.210.85.178,10.0.2.15,TLSv1.2,590,Application Data
1,1.0594749999995656,10.0.2.15,62.210.85.178,TCP,54,35978  >  9001 [ACK] Seq=166587231 Ack=9132767 Win=65535 Len=0
1,1.0600469999999405,10.0.2.15,62.210.85.178,TLSv1.2,590,Application Data
1,1.0601999999998952,62.210.85.178,10.0.2.15,TCP,60,9001  >  35978 [ACK] Seq=9132767 Ack=166587767 Win=65535 Len=0
1,1.264983999999913,54.93.77.70,10.0.2.15,TLSv1.2,590,Application Data
1,1.265060999999605,10.0.2.15,54.93.77.70,TCP,54,34692  >  9001 [ACK] Seq=9170049 Ack=166441535 Win=65535 Len=0
1,1.2654349999997976,10.0.2.15,54.93.77.70,TLSv1.2,1618,Application Data
1,1.2655399999998735,54.93.77.70,10.0.2.15,TCP,60,9001  >  34692 [ACK] Seq=166441535 Ack=9171509 Win=65535 Len=0
1,1.2655519999998432,54.93.77.70,10.0.2.15,TCP,60,9001  >  34692 [ACK] Seq=166441535 Ack=9171613 Win=65535 Len=0
1,1.8801089999997203,62.210.85.178,10.0.2.15,TLSv1.2,1618,Application Data
1,1.880232999999862,10.0.2.15,62.210.85.178,TCP,54,35978  >  9001 [ACK] Seq=166587767 Ack=9134331 Win=65535 Len=0
1,1.8937519999999495,10.0.2.15,62.210.85.178,TLSv1.2,590,Application Data
1,1.8939309999996112,62.210.85.178,10.0.2.15,TCP,60,9001  >  35978 [ACK] Seq=9134331 Ack=166588303 Win=65535 Len=0
1,1.9085319999999228,10.0.2.15,62.210.85.178,TLSv1.2,1618,Application Data
1,1.908680000000004,62.210.85.178,10.0.2.15,TCP,60,9001  >  35978 [ACK] Seq=9134331 Ack=166589763 Win=65535 Len=0
1,1.9087009999998372,62.210.85.178,10.0.2.15,TCP,60,9001  >  35978 [ACK] Seq=9134331 Ack=166589867 Win=65535 Len=0
1,2.0829819999999017,54.93.77.70,10.0.2.15,TLSv1.2,590,Application Data
1,2.123899999999594,10.0.2.15,54.93.77.70,TCP,54,34692  >  9001 [ACK] Seq=9171613 Ack=166442071 Win=65535 Len=0
1,2.2890769999999065,54.93.77.70,10.0.2.15,TLSv1.2,1618,Application Data
1,2.2891539999995985,10.0.2.15,54.93.77.70,TCP,54,34692  >  9001 [ACK] Seq=9171613 Ack=166443635 Win=65535 Len=0
1,2.291171999999733,10.0.2.15,54.93.77.70,TLSv1.2,590,Application Data
1,2.29133499999989,54.93.77.70,10.0.2.15,TCP,60,9001  >  34692 [ACK] Seq=166443635 Ack=9172149 Win=65535 Len=0
1,2.799957999999606,62.210.85.178,10.0.2.15,TLSv1.2,590,Application Data
1,2.8002549999996518,10.0.2.15,62.210.85.178,TLSv1.2,590,Application Data
1,2.8003599999997277,62.210.85.178,10.0.2.15,TCP,60,9001  >  35978 [ACK] Seq=9134867 Ack=166590403 Win=65535 Len=0
1,3.0056969999996,54.93.77.70,10.0.2.15,TLSv1.2,590,Application Data
1,3.0061469999996007,10.0.2.15,54.93.77.70,TLSv1.2,590,Application Data
1,3.006300999999894,54.93.77.70,10.0.2.15,TCP,60,9001  >  34692 [ACK] Seq=166444171 Ack=9172685 Win=65535 Len=0
1,3.211272999999892,62.210.85.178,10.0.2.15,TLSv1.2,590,Application Data
1,3.217931999999564,10.0.2.15,62.210.85.178,TLSv1.2,590,Application Data
1,3.2183749999999236,62.210.85.178,10.0.2.15,TCP,60,9001  >  35978 [ACK] Seq=9135403 Ack=166590939 Win=65535 Len=0
1,3.22844299999997,10.0.2.15,62.210.85.178,TLSv1.2,4124,Application Data
1,3.2285579999997935,10.0.2.15,62.210.85.178,TCP,2974,35978  >  9001 [ACK] Seq=166595009 Ack=9135403 Win=65535 Len=2920 [TCP segment of a reassembled PDU]
1,3.2286369999997078,62.210.85.178,10.0.2.15,TCP,60,9001  >  35978 [ACK] Seq=9135403 Ack=166592399 Win=65535 Len=0
1,3.2286559999997735,62.210.85.178,10.0.2.15,TCP,60,9001  >  35978 [ACK] Seq=9135403 Ack=166593859 Win=65535 Len=0
1,3.2286589999998796,62.210.85.178,10.0.2.15,TCP,60,9001  >  35978 [ACK] Seq=9135403 Ack=166595009 Win=65535 Len=0
1,3.2286619999999857,62.210.85.178,10.0.2.15,TCP,60,9001  >  35978 [ACK] Seq=9135403 Ack=166596469 Win=65535 Len=0
1,3.228664999999637,62.210.85.178,10.0.2.15,TCP,60,9001  >  35978 [ACK] Seq=9135403 Ack=166597929 Win=65535 Len=0
1,3.2287129999999706,10.0.2.15,62.210.85.178,TLSv1.2,1204,Application Data
1,3.2287609999998494,62.210.85.178,10.0.2.15,TCP,60,9001  >  35978 [ACK] Seq=9135403 Ack=166599079 Win=65535 Len=0
1,3.228827999999794,10.0.2.15,62.210.85.178,TLSv1.2,4124,Application Data
1,3.228874999999789,62.210.85.178,10.0.2.15,TCP,60,9001  >  35978 [ACK] Seq=9135403 Ack=166600539 Win=65535 Len=0
1,3.228881999999885,62.210.85.178,10.0.2.15,TCP,60,9001  >  35978 [ACK] Seq=9135403 Ack=166601999 Win=65535 Len=0
1,3.2288869999997587,62.210.85.178,10.0.2.15,TCP,60,9001  >  35978 [ACK] Seq=9135403 Ack=166603149 Win=65535 Len=0
1,3.2289279999999962,10.0.2.15,62.210.85.178,TLSv1.2,4124,Application Data
1,3.229023999999754,62.210.85.178,10.0.2.15,TCP,60,9001  >  35978 [ACK] Seq=9135403 Ack=166604609 Win=65535 Len=0
1,3.2290319999997337,62.210.85.178,10.0.2.15,TCP,60,9001  >  35978 [ACK] Seq=9135403 Ack=166606069 Win=65535 Len=0
1,3.22903499999984,62.210.85.178,10.0.2.15,TCP,60,9001  >  35978 [ACK] Seq=9135403 Ack=166607219 Win=65535 Len=0
1,3.2290619999998853,10.0.2.15,62.210.85.178,TLSv1.2,332,Application Data
1,3.229099999999562,62.210.85.178,10.0.2.15,TCP,60,9001  >  35978 [ACK] Seq=9135403 Ack=166607497 Win=65535 Len=0
1,3.2291369999998096,10.0.2.15,62.210.85.178,TLSv1.2,3868,Application Data
1,3.229174999999941,62.210.85.178,10.0.2.15,TCP,60,9001  >  35978 [ACK] Seq=9135403 Ack=166608957 Win=65535 Len=0
1,3.229182999999921,62.210.85.178,10.0.2.15,TCP,60,9001  >  35978 [ACK] Seq=9135403 Ack=166610417 Win=65535 Len=0
1,3.2291869999999108,62.210.85.178,10.0.2.15,TCP,60,9001  >  35978 [ACK] Seq=9135403 Ack=166611311 Win=65535 Len=0
1,3.229225999999926,10.0.2.15,62.210.85.178,TLSv1.2,4124,Application Data
1,3.229264999999941,62.210.85.178,10.0.2.15,TCP,60,9001  >  35978 [ACK] Seq=9135403 Ack=166612771 Win=65535 Len=0
1,3.229272999999921,62.210.85.178,10.0.2.15,TCP,60,9001  >  35978 [ACK] Seq=9135403 Ack=166614231 Win=65535 Len=0
1,3.229276999999911,62.210.85.178,10.0.2.15,TCP,60,9001  >  35978 [ACK] Seq=9135403 Ack=166615381 Win=65535 Len=0
1,3.22931299999982,10.0.2.15,62.210.85.178,TLSv1.2,3030,Application Data
1,3.229349999999613,62.210.85.178,10.0.2.15,TCP,60,9001  >  35978 [ACK] Seq=9135403 Ack=166616841 Win=65535 Len=0
1,3.2293579999995927,62.210.85.178,10.0.2.15,TCP,60,9001  >  35978 [ACK] Seq=9135403 Ack=166618301 Win=65535 Len=0
1,3.2293619999995826,62.210.85.178,10.0.2.15,TCP,60,9001  >  35978 [ACK] Seq=9135403 Ack=166618357 Win=65535 Len=0
1,3.238534999999956,10.0.2.15,62.210.85.178,TLSv1.2,4124,Application Data
1,3.2386179999998603,62.210.85.178,10.0.2.15,TCP,60,9001  >  35978 [ACK] Seq=9135403 Ack=166619817 Win=65535 Len=0
1,3.2386249999999563,62.210.85.178,10.0.2.15,TCP,60,9001  >  35978 [ACK] Seq=9135403 Ack=166621277 Win=65535 Len=0
1,3.2386279999996077,62.210.85.178,10.0.2.15,TCP,60,9001  >  35978 [ACK] Seq=9135403 Ack=166622427 Win=65535 Len=0
1,3.2386639999999716,10.0.2.15,62.210.85.178,TLSv1.2,4124,Application Data
1,3.2387289999996938,62.210.85.178,10.0.2.15,TCP,60,9001  >  35978 [ACK] Seq=9135403 Ack=166623887 Win=65535 Len=0
1,3.23873599999979,62.210.85.178,10.0.2.15,TCP,60,9001  >  35978 [ACK] Seq=9135403 Ack=166625347 Win=65535 Len=0
1,3.238738999999896,62.210.85.178,10.0.2.15,TCP,60,9001  >  35978 [ACK] Seq=9135403 Ack=166626497 Win=65535 Len=0
1,3.238774999999805,10.0.2.15,62.210.85.178,TLSv1.2,4124,Application Data
1,3.238811999999598,62.210.85.178,10.0.2.15,TCP,60,9001  >  35978 [ACK] Seq=9135403 Ack=166627957 Win=65535 Len=0
1,3.2388199999995777,62.210.85.178,10.0.2.15,TCP,60,9001  >  35978 [ACK] Seq=9135403 Ack=166629417 Win=65535 Len=0
1,3.2388239999995676,62.210.85.178,10.0.2.15,TCP,60,9001  >  35978 [ACK] Seq=9135403 Ack=166630567 Win=65535 Len=0
1,3.2388599999999315,10.0.2.15,62.210.85.178,TLSv1.2,4124,Application Data
1,3.238897999999608,62.210.85.178,10.0.2.15,TCP,60,9001  >  35978 [ACK] Seq=9135403 Ack=166632027 Win=65535 Len=0
1,3.238905999999588,62.210.85.178,10.0.2.15,TCP,60,9001  >  35978 [ACK] Seq=9135403 Ack=166633487 Win=65535 Len=0
1,3.238909999999578,62.210.85.178,10.0.2.15,TCP,60,9001  >  35978 [ACK] Seq=9135403 Ack=166634637 Win=65535 Len=0
1,3.2389439999997194,10.0.2.15,62.210.85.178,TLSv1.2,332,Application Data
1,3.2389829999997346,62.210.85.178,10.0.2.15,TCP,60,9001  >  35978 [ACK] Seq=9135403 Ack=166634915 Win=65535 Len=0
1,3.2390329999998357,10.0.2.15,62.210.85.178,TLSv1.2,3868,Application Data
1,3.239071999999851,62.210.85.178,10.0.2.15,TCP,60,9001  >  35978 [ACK] Seq=9135403 Ack=166636375 Win=65535 Len=0
1,3.2390799999998308,62.210.85.178,10.0.2.15,TCP,60,9001  >  35978 [ACK] Seq=9135403 Ack=166637835 Win=65535 Len=0
1,3.2390839999998207,62.210.85.178,10.0.2.15,TCP,60,9001  >  35978 [ACK] Seq=9135403 Ack=166638729 Win=65535 Len=0
1,3.239121999999952,10.0.2.15,62.210.85.178,TLSv1.2,4124,Application Data
1,3.239159999999629,62.210.85.178,10.0.2.15,TCP,60,9001  >  35978 [ACK] Seq=9135403 Ack=166640189 Win=65535 Len=0
1,3.2391679999996086,62.210.85.178,10.0.2.15,TCP,60,9001  >  35978 [ACK] Seq=9135403 Ack=166641649 Win=65535 Len=0
1,3.2391719999995985,62.210.85.178,10.0.2.15,TCP,60,9001  >  35978 [ACK] Seq=9135403 Ack=166642799 Win=65535 Len=0
1,3.239208999999846,10.0.2.15,62.210.85.178,TLSv1.2,3030,Application Data
1,3.2392479999998613,62.210.85.178,10.0.2.15,TCP,60,9001  >  35978 [ACK] Seq=9135403 Ack=166644259 Win=65535 Len=0
1,3.239255999999841,62.210.85.178,10.0.2.15,TCP,60,9001  >  35978 [ACK] Seq=9135403 Ack=166645719 Win=65535 Len=0
1,3.239259999999831,62.210.85.178,10.0.2.15,TCP,60,9001  >  35978 [ACK] Seq=9135403 Ack=166645775 Win=65535 Len=0
1,3.2529099999997015,10.0.2.15,62.210.85.178,TLSv1.2,4124,Application Data
1,3.2530299999998533,10.0.2.15,62.210.85.178,TCP,2974,35978  >  9001 [ACK] Seq=166649845 Ack=9135403 Win=65535 Len=2920 [TCP segment of a reassembled PDU]
1,3.2530559999995603,62.210.85.178,10.0.2.15,TCP,60,9001  >  35978 [ACK] Seq=9135403 Ack=166647235 Win=65535 Len=0
1,3.2530659999997624,62.210.85.178,10.0.2.15,TCP,60,9001  >  35978 [ACK] Seq=9135403 Ack=166648695 Win=65535 Len=0
1,3.2530719999999747,62.210.85.178,10.0.2.15,TCP,60,9001  >  35978 [ACK] Seq=9135403 Ack=166649845 Win=65535 Len=0
1,3.2530769999998483,62.210.85.178,10.0.2.15,TCP,60,9001  >  35978 [ACK] Seq=9135403 Ack=166651305 Win=65535 Len=0
1,3.253081999999722,62.210.85.178,10.0.2.15,TCP,60,9001  >  35978 [ACK] Seq=9135403 Ack=166652765 Win=65535 Len=0
1,3.2531169999997473,10.0.2.15,62.210.85.178,TLSv1.2,1204,Application Data
1,3.2531589999998687,62.210.85.178,10.0.2.15,TCP,60,9001  >  35978 [ACK] Seq=9135403 Ack=166653915 Win=65535 Len=0
1,3.2532029999997576,10.0.2.15,62.210.85.178,TLSv1.2,4124,Application Data
1,3.253240999999889,62.210.85.178,10.0.2.15,TCP,60,9001  >  35978 [ACK] Seq=9135403 Ack=166655375 Win=65535 Len=0
1,3.2532499999997526,62.210.85.178,10.0.2.15,TCP,60,9001  >  35978 [ACK] Seq=9135403 Ack=166656835 Win=65535 Len=0
1,3.2532549999996263,62.210.85.178,10.0.2.15,TCP,60,9001  >  35978 [ACK] Seq=9135403 Ack=166657985 Win=65535 Len=0
1,3.2532939999996415,10.0.2.15,62.210.85.178,TLSv1.2,3866,Application Data
1,3.253331999999773,62.210.85.178,10.0.2.15,TCP,60,9001  >  35978 [ACK] Seq=9135403 Ack=166659445 Win=65535 Len=0
1,3.2533409999996366,62.210.85.178,10.0.2.15,TCP,60,9001  >  35978 [ACK] Seq=9135403 Ack=166660905 Win=65535 Len=0
1,3.2533449999996265,62.210.85.178,10.0.2.15,TCP,60,9001  >  35978 [ACK] Seq=9135403 Ack=166661797 Win=65535 Len=0
1,3.3231159999995725,54.93.77.70,10.0.2.15,TLSv1.2,3674,Application Data
1,3.323261999999886,10.0.2.15,54.93.77.70,TCP,54,34692  >  9001 [ACK] Seq=9172685 Ack=166447791 Win=65535 Len=0
1,3.3634969999998248,54.93.77.70,10.0.2.15,TLSv1.2,3674,Application Data
1,3.363576999999623,10.0.2.15,54.93.77.70,TCP,54,34692  >  9001 [ACK] Seq=9172685 Ack=166451411 Win=65535 Len=0
1,3.3762909999995827,54.93.77.70,10.0.2.15,TLSv1.2,7294,"Application Data, Application Data"
1,3.3763859999999113,10.0.2.15,54.93.77.70,TCP,54,34692  >  9001 [ACK] Seq=9172685 Ack=166458651 Win=65535 Len=0
1,3.38188799999989,54.93.77.70,10.0.2.15,TLSv1.2,1104,Application Data
1,3.389125999999578,54.93.77.70,10.0.2.15,TCP,2950,"9001  >  34692 [PSH, ACK] Seq=166459701 Ack=9172685 Win=65535 Len=2896 [TCP segment of a reassembled PDU]"
1,3.389169999999922,10.0.2.15,54.93.77.70,TCP,54,34692  >  9001 [ACK] Seq=9172685 Ack=166462597 Win=65535 Len=0
1,3.3972219999996014,54.93.77.70,10.0.2.15,TLSv1.2,2950,Application Data [TCP segment of a reassembled PDU]
1,3.3972359999997934,54.93.77.70,10.0.2.15,TCP,1502,"9001  >  34692 [PSH, ACK] Seq=166465493 Ack=9172685 Win=65535 Len=1448 [TCP segment of a reassembled PDU]"
1,3.3972709999998187,10.0.2.15,54.93.77.70,TCP,54,34692  >  9001 [ACK] Seq=9172685 Ack=166465493 Win=65535 Len=0
1,3.3973439999999755,10.0.2.15,54.93.77.70,TCP,54,34692  >  9001 [ACK] Seq=9172685 Ack=166466941 Win=65535 Len=0
1,3.3974739999998746,54.93.77.70,10.0.2.15,TLSv1.2,1104,"Application Data, Application Data"
1,3.407440999999835,54.93.77.70,10.0.2.15,TCP,2950,"9001  >  34692 [PSH, ACK] Seq=166467991 Ack=9172685 Win=65535 Len=2896 [TCP segment of a reassembled PDU]"
1,3.407502999999906,10.0.2.15,54.93.77.70,TCP,54,34692  >  9001 [ACK] Seq=9172685 Ack=166470887 Win=65535 Len=0
1,3.4136099999996077,54.93.77.70,10.0.2.15,TLSv1.2,778,Application Data
1,3.4138319999997293,10.0.2.15,54.93.77.70,TLSv1.2,590,Application Data
1,3.4139499999996588,54.93.77.70,10.0.2.15,TCP,60,9001  >  34692 [ACK] Seq=166471611 Ack=9173221 Win=65535 Len=0
1,3.4187729999998737,54.93.77.70,10.0.2.15,TCP,1502,"9001  >  34692 [PSH, ACK] Seq=166471611 Ack=9173221 Win=65535 Len=1448 [TCP segment of a reassembled PDU]"
1,3.4189179999998487,10.0.2.15,54.93.77.70,TCP,54,34692  >  9001 [ACK] Seq=9173221 Ack=166473059 Win=65535 Len=0
1,3.4260379999996076,54.93.77.70,10.0.2.15,TLSv1.2,5846,"Application Data, Application Data"
1,3.4261139999998704,10.0.2.15,54.93.77.70,TCP,54,34692  >  9001 [ACK] Seq=9173221 Ack=166478851 Win=65535 Len=0
1,3.4264119999998,10.0.2.15,54.93.77.70,TLSv1.2,590,Application Data
1,3.426524999999856,54.93.77.70,10.0.2.15,TCP,60,9001  >  34692 [ACK] Seq=166478851 Ack=9173757 Win=65535 Len=0
1,3.429041999999754,54.93.77.70,10.0.2.15,TLSv1.2,76,Application Data
1,3.4441039999996974,54.93.77.70,10.0.2.15,TCP,2950,"9001  >  34692 [PSH, ACK] Seq=166478873 Ack=9173757 Win=65535 Len=2896 [TCP segment of a reassembled PDU]"
1,3.4441569999999047,10.0.2.15,54.93.77.70,TCP,54,34692  >  9001 [ACK] Seq=9173757 Ack=166481769 Win=65535 Len=0
1,3.444590999999946,54.93.77.70,10.0.2.15,TLSv1.2,4398,Application Data [TCP segment of a reassembled PDU]
1,3.444659999999658,10.0.2.15,54.93.77.70,TCP,54,34692  >  9001 [ACK] Seq=9173757 Ack=166486113 Win=65535 Len=0
1,3.454500999999709,54.93.77.70,10.0.2.15,TLSv1.2,2950,Application Data [TCP segment of a reassembled PDU]
1,3.4545549999998,10.0.2.15,54.93.77.70,TCP,54,34692  >  9001 [ACK] Seq=9173757 Ack=166489009 Win=65535 Len=0
1,3.460341999999855,54.93.77.70,10.0.2.15,TLSv1.2,1292,Application Data
1,3.4990060000000085,54.93.77.70,10.0.2.15,TLSv1.2,4398,Application Data
1,3.499072999999953,10.0.2.15,54.93.77.70,TCP,54,34692  >  9001 [ACK] Seq=9173757 Ack=166494591 Win=65535 Len=0
1,3.5047679999997854,54.93.77.70,10.0.2.15,TLSv1.2,2950,"Application Data, Application Data"
1,3.50483899999972,10.0.2.15,54.93.77.70,TCP,54,34692  >  9001 [ACK] Seq=9173757 Ack=166497487 Win=65535 Len=0
1,3.5058939999998984,54.93.77.70,10.0.2.15,TLSv1.2,4398,Application Data [TCP segment of a reassembled PDU]
1,3.5059689999998227,10.0.2.15,54.93.77.70,TCP,54,34692  >  9001 [ACK] Seq=9173757 Ack=166501831 Win=65535 Len=0
1,3.5061549999995805,10.0.2.15,54.93.77.70,TLSv1.2,590,Application Data
1,3.5062589999997726,54.93.77.70,10.0.2.15,TCP,60,9001  >  34692 [ACK] Seq=166501831 Ack=9174293 Win=65535 Len=0
1,3.514748999999938,54.93.77.70,10.0.2.15,TLSv1.2,402,Application Data
1,3.5218379999996614,54.93.77.70,10.0.2.15,TLSv1.2,5846,Application Data
1,3.5219819999997526,10.0.2.15,54.93.77.70,TCP,54,34692  >  9001 [ACK] Seq=9174293 Ack=166507971 Win=65535 Len=0
1,3.53918399999975,54.93.77.70,10.0.2.15,TLSv1.2,988,Application Data
1,3.5550399999997353,62.210.85.178,10.0.2.15,TLSv1.2,1104,Application Data
1,3.5667709999997896,54.93.77.70,10.0.2.15,TLSv1.2,2950,Application Data
1,3.566787999999633,54.93.77.70,10.0.2.15,TCP,1502,"9001  >  34692 [PSH, ACK] Seq=166511801 Ack=9174293 Win=65535 Len=1448 [TCP segment of a reassembled PDU]"
1,3.5668329999998605,10.0.2.15,54.93.77.70,TCP,54,34692  >  9001 [ACK] Seq=9174293 Ack=166511801 Win=65535 Len=0
1,3.566924999999628,10.0.2.15,54.93.77.70,TCP,54,34692  >  9001 [ACK] Seq=9174293 Ack=166513249 Win=65535 Len=0
1,3.5822220000000016,54.93.77.70,10.0.2.15,TLSv1.2,380,Application Data
1,3.595882999999958,10.0.2.15,62.210.85.178,TCP,54,35978  >  9001 [ACK] Seq=166661797 Ack=9136453 Win=65535 Len=0
1,3.605231999999887,54.93.77.70,10.0.2.15,TLSv1.2,590,Application Data
1,3.6053219999998873,10.0.2.15,54.93.77.70,TCP,54,34692  >  9001 [ACK] Seq=9174293 Ack=166514111 Win=65535 Len=0
1,3.6718439999999646,54.93.77.70,10.0.2.15,TLSv1.2,1618,Application Data
1,3.671950999999808,10.0.2.15,54.93.77.70,TCP,54,34692  >  9001 [ACK] Seq=9174293 Ack=166515675 Win=65535 Len=0
1,3.675680999999713,10.0.2.15,54.93.77.70,TLSv1.2,590,Application Data
1,3.675884999999653,54.93.77.70,10.0.2.15,TCP,60,9001  >  34692 [ACK] Seq=166515675 Ack=9174829 Win=65535 Len=0
1,4.337880999999925,62.210.85.178,10.0.2.15,TLSv1.2,1104,Application Data
1,4.337967999999819,10.0.2.15,62.210.85.178,TCP,54,35978  >  9001 [ACK] Seq=166661797 Ack=9137503 Win=65535 Len=0
1,4.338332999999693,10.0.2.15,62.210.85.178,TLSv1.2,590,Application Data
1,4.338462999999592,62.210.85.178,10.0.2.15,TCP,60,9001  >  35978 [ACK] Seq=9137503 Ack=166662333 Win=65535 Len=0
1,4.426770999999917,54.93.77.70,10.0.2.15,TLSv1.2,590,Application Data
1,4.427294999999958,10.0.2.15,54.93.77.70,TLSv1.2,590,Application Data
1,4.427402999999686,54.93.77.70,10.0.2.15,TCP,60,9001  >  34692 [ACK] Seq=166516211 Ack=9175365 Win=65535 Len=0
1,4.631278999999722,62.210.85.178,10.0.2.15,TLSv1.2,590,Application Data
1,4.6361989999995785,10.0.2.15,62.210.85.178,TLSv1.2,590,Application Data
1,4.636376999999811,62.210.85.178,10.0.2.15,TCP,60,9001  >  35978 [ACK] Seq=9138039 Ack=166662869 Win=65535 Len=0
1,4.648820999999771,10.0.2.15,62.210.85.178,TLSv1.2,4124,Application Data
1,4.64893499999971,10.0.2.15,62.210.85.178,TCP,2974,35978  >  9001 [ACK] Seq=166666939 Ack=9138039 Win=65535 Len=2920 [TCP segment of a reassembled PDU]
1,4.648979999999938,62.210.85.178,10.0.2.15,TCP,60,9001  >  35978 [ACK] Seq=9138039 Ack=166664329 Win=65535 Len=0
1,4.648990999999569,62.210.85.178,10.0.2.15,TCP,60,9001  >  35978 [ACK] Seq=9138039 Ack=166665789 Win=65535 Len=0
1,4.648995999999897,62.210.85.178,10.0.2.15,TCP,60,9001  >  35978 [ACK] Seq=9138039 Ack=166666939 Win=65535 Len=0
1,4.648999999999887,62.210.85.178,10.0.2.15,TCP,60,9001  >  35978 [ACK] Seq=9138039 Ack=166668399 Win=65535 Len=0
1,4.649003999999877,62.210.85.178,10.0.2.15,TCP,60,9001  >  35978 [ACK] Seq=9138039 Ack=166669859 Win=65535 Len=0
1,4.649047999999766,10.0.2.15,62.210.85.178,TLSv1.2,1204,Application Data
1,4.649116999999933,10.0.2.15,62.210.85.178,TCP,2974,35978  >  9001 [ACK] Seq=166671009 Ack=9138039 Win=65535 Len=2920 [TCP segment of a reassembled PDU]
1,4.649156999999832,62.210.85.178,10.0.2.15,TCP,60,9001  >  35978 [ACK] Seq=9138039 Ack=166671009 Win=65535 Len=0
1,4.649163999999928,62.210.85.178,10.0.2.15,TCP,60,9001  >  35978 [ACK] Seq=9138039 Ack=166672469 Win=65535 Len=0
1,4.649167999999918,62.210.85.178,10.0.2.15,TCP,60,9001  >  35978 [ACK] Seq=9138039 Ack=166673929 Win=65535 Len=0
1,4.649203999999827,10.0.2.15,62.210.85.178,TLSv1.2,1204,Application Data
1,4.649267999999665,10.0.2.15,62.210.85.178,TCP,1514,35978  >  9001 [ACK] Seq=166675079 Ack=9138039 Win=65535 Len=1460 [TCP segment of a reassembled PDU]
1,4.649303999999574,62.210.85.178,10.0.2.15,TCP,60,9001  >  35978 [ACK] Seq=9138039 Ack=166675079 Win=65535 Len=0
1,4.6493109999996705,62.210.85.178,10.0.2.15,TCP,60,9001  >  35978 [ACK] Seq=9138039 Ack=166676539 Win=65535 Len=0
1,4.649340999999822,10.0.2.15,62.210.85.178,TLSv1.2,1378,Application Data
1,4.649433999999928,62.210.85.178,10.0.2.15,TCP,60,9001  >  35978 [ACK] Seq=9138039 Ack=166677863 Win=65535 Len=0
1,4.806417999999667,54.93.77.70,10.0.2.15,TLSv1.2,3674,Application Data
1,4.806592999999793,10.0.2.15,54.93.77.70,TCP,54,34692  >  9001 [ACK] Seq=9175365 Ack=166519831 Win=65535 Len=0
1,4.815572999999858,54.93.77.70,10.0.2.15,TCP,2950,"9001  >  34692 [PSH, ACK] Seq=166519831 Ack=9175365 Win=65535 Len=2896 [TCP segment of a reassembled PDU]"
1,4.815661999999975,10.0.2.15,54.93.77.70,TCP,54,34692  >  9001 [ACK] Seq=9175365 Ack=166522727 Win=65535 Len=0
1,4.822675999999774,54.93.77.70,10.0.2.15,TLSv1.2,778,Application Data
1,4.8238579999997455,54.93.77.70,10.0.2.15,TCP,2950,"9001  >  34692 [PSH, ACK] Seq=166523451 Ack=9175365 Win=65535 Len=2896 [TCP segment of a reassembled PDU]"
1,4.8239049999997405,10.0.2.15,54.93.77.70,TCP,54,34692  >  9001 [ACK] Seq=9175365 Ack=166526347 Win=65535 Len=0
1,4.831319999999778,54.93.77.70,10.0.2.15,TLSv1.2,4398,"Application Data, Application Data"
1,4.831401999999798,10.0.2.15,54.93.77.70,TCP,54,34692  >  9001 [ACK] Seq=9175365 Ack=166530691 Win=65535 Len=0
1,4.838918999999805,54.93.77.70,10.0.2.15,TLSv1.2,1126,"Application Data, Application Data"
1,4.839107999999669,10.0.2.15,54.93.77.70,TLSv1.2,590,Application Data
1,4.839220999999725,54.93.77.70,10.0.2.15,TCP,60,9001  >  34692 [ACK] Seq=166531763 Ack=9175901 Win=65535 Len=0
1,4.849247999999989,10.0.2.15,54.93.77.70,TLSv1.2,590,Application Data
1,4.849420000000009,54.93.77.70,10.0.2.15,TCP,60,9001  >  34692 [ACK] Seq=166531763 Ack=9176437 Win=65535 Len=0
1,5.046385999999984,62.210.85.178,10.0.2.15,TLSv1.2,590,Application Data
1,5.075314999999591,62.210.85.178,10.0.2.15,TLSv1.2,590,Application Data
1,5.0754179999999,10.0.2.15,62.210.85.178,TCP,54,35978  >  9001 [ACK] Seq=166677863 Ack=9139111 Win=65535 Len=0
1,5.075908999999683,10.0.2.15,62.210.85.178,TLSv1.2,590,Application Data
1,5.076134999999795,62.210.85.178,10.0.2.15,TCP,60,9001  >  35978 [ACK] Seq=9139111 Ack=166678399 Win=65535 Len=0
1,5.565509999999904,54.93.77.70,10.0.2.15,TLSv1.2,590,Application Data
1,5.565955999999915,10.0.2.15,54.93.77.70,TLSv1.2,590,Application Data
1,5.566094999999677,54.93.77.70,10.0.2.15,TCP,60,9001  >  34692 [ACK] Seq=166532299 Ack=9176973 Win=65535 Len=0
1,6.180823999999575,62.210.85.178,10.0.2.15,TLSv1.2,590,Application Data
1,6.193697999999586,10.0.2.15,62.210.85.178,TLSv1.2,590,Application Data
1,6.195015999999669,62.210.85.178,10.0.2.15,TCP,60,9001  >  35978 [ACK] Seq=9139647 Ack=166678935 Win=65535 Len=0
1,6.20417499999985,10.0.2.15,62.210.85.178,TLSv1.2,4124,Application Data
1,6.204306999999972,10.0.2.15,62.210.85.178,TCP,2974,35978  >  9001 [ACK] Seq=166683005 Ack=9139647 Win=65535 Len=2920 [TCP segment of a reassembled PDU]
1,6.20435899999984,62.210.85.178,10.0.2.15,TCP,60,9001  >  35978 [ACK] Seq=9139647 Ack=166680395 Win=65535 Len=0
1,6.20437099999981,62.210.85.178,10.0.2.15,TCP,60,9001  >  35978 [ACK] Seq=9139647 Ack=166681855 Win=65535 Len=0
1,6.204375999999684,62.210.85.178,10.0.2.15,TCP,60,9001  >  35978 [ACK] Seq=9139647 Ack=166683005 Win=65535 Len=0
1,6.204418999999689,10.0.2.15,62.210.85.178,TLSv1.2,1204,Application Data
1,6.204483999999866,62.210.85.178,10.0.2.15,TCP,60,9001  >  35978 [ACK] Seq=9139647 Ack=166684465 Win=65535 Len=0
1,6.2044959999998355,62.210.85.178,10.0.2.15,TCP,60,9001  >  35978 [ACK] Seq=9139647 Ack=166685925 Win=65535 Len=0
1,6.204498999999942,62.210.85.178,10.0.2.15,TCP,60,9001  >  35978 [ACK] Seq=9139647 Ack=166687075 Win=65535 Len=0
1,6.204551999999694,10.0.2.15,62.210.85.178,TLSv1.2,4124,Application Data
1,6.204617999999755,62.210.85.178,10.0.2.15,TCP,60,9001  >  35978 [ACK] Seq=9139647 Ack=166688535 Win=65535 Len=0
1,6.204626999999618,62.210.85.178,10.0.2.15,TCP,60,9001  >  35978 [ACK] Seq=9139647 Ack=166689995 Win=65535 Len=0
1,6.2046299999997245,62.210.85.178,10.0.2.15,TCP,60,9001  >  35978 [ACK] Seq=9139647 Ack=166691145 Win=65535 Len=0
1,6.204677999999603,10.0.2.15,62.210.85.178,TLSv1.2,4124,Application Data
1,6.204719999999725,62.210.85.178,10.0.2.15,TCP,60,9001  >  35978 [ACK] Seq=9139647 Ack=166692605 Win=65535 Len=0
1,6.204728999999588,62.210.85.178,10.0.2.15,TCP,60,9001  >  35978 [ACK] Seq=9139647 Ack=166694065 Win=65535 Len=0
1,6.204791999999998,10.0.2.15,62.210.85.178,TLSv1.2,2974,Application Data
1,6.20483299999978,62.210.85.178,10.0.2.15,TCP,60,9001  >  35978 [ACK] Seq=9139647 Ack=166695215 Win=65535 Len=0
1,6.2048399999998765,62.210.85.178,10.0.2.15,TCP,60,9001  >  35978 [ACK] Seq=9139647 Ack=166696675 Win=65535 Len=0
1,6.204842999999983,62.210.85.178,10.0.2.15,TCP,60,9001  >  35978 [ACK] Seq=9139647 Ack=166698135 Win=65535 Len=0
1,6.204870999999912,10.0.2.15,62.210.85.178,TLSv1.2,1226,Application Data
1,6.204907999999705,62.210.85.178,10.0.2.15,TCP,60,9001  >  35978 [ACK] Seq=9139647 Ack=166699307 Win=65535 Len=0
1,6.204948999999942,10.0.2.15,62.210.85.178,TLSv1.2,4124,Application Data
1,6.204985999999735,62.210.85.178,10.0.2.15,TCP,60,9001  >  35978 [ACK] Seq=9139647 Ack=166700767 Win=65535 Len=0
1,6.204993999999715,62.210.85.178,10.0.2.15,TCP,60,9001  >  35978 [ACK] Seq=9139647 Ack=166702227 Win=65535 Len=0
1,6.204998999999589,62.210.85.178,10.0.2.15,TCP,60,9001  >  35978 [ACK] Seq=9139647 Ack=166703377 Win=65535 Len=0
1,6.205035999999836,10.0.2.15,62.210.85.178,TLSv1.2,3030,Application Data
1,6.205073999999968,62.210.85.178,10.0.2.15,TCP,60,9001  >  35978 [ACK] Seq=9139647 Ack=166704837 Win=65535 Len=0
1,6.205081999999948,62.210.85.178,10.0.2.15,TCP,60,9001  >  35978 [ACK] Seq=9139647 Ack=166706297 Win=65535 Len=0
1,6.205086999999821,62.210.85.178,10.0.2.15,TCP,60,9001  >  35978 [ACK] Seq=9139647 Ack=166706353 Win=65535 Len=0
1,6.214296999999988,10.0.2.15,62.210.85.178,TLSv1.2,4124,Application Data
1,6.214414999999917,62.210.85.178,10.0.2.15,TCP,60,9001  >  35978 [ACK] Seq=9139647 Ack=166707813 Win=65535 Len=0
1,6.214427999999771,62.210.85.178,10.0.2.15,TCP,60,9001  >  35978 [ACK] Seq=9139647 Ack=166709273 Win=65535 Len=0
1,6.214431999999761,62.210.85.178,10.0.2.15,TCP,60,9001  >  35978 [ACK] Seq=9139647 Ack=166710423 Win=65535 Len=0
1,6.214470999999776,10.0.2.15,62.210.85.178,TLSv1.2,4124,Application Data
1,6.214543999999933,62.210.85.178,10.0.2.15,TCP,60,9001  >  35978 [ACK] Seq=9139647 Ack=166711883 Win=65535 Len=0
1,6.21455399999968,62.210.85.178,10.0.2.15,TCP,60,9001  >  35978 [ACK] Seq=9139647 Ack=166713343 Win=65535 Len=0
1,6.214559000000008,62.210.85.178,10.0.2.15,TCP,60,9001  >  35978 [ACK] Seq=9139647 Ack=166714493 Win=65535 Len=0
1,6.214622999999847,10.0.2.15,62.210.85.178,TLSv1.2,4124,Application Data
1,6.214759999999842,62.210.85.178,10.0.2.15,TCP,60,9001  >  35978 [ACK] Seq=9139647 Ack=166715953 Win=65535 Len=0
1,6.214783999999781,62.210.85.178,10.0.2.15,TCP,60,9001  >  35978 [ACK] Seq=9139647 Ack=166717413 Win=65535 Len=0
1,6.214791999999761,62.210.85.178,10.0.2.15,TCP,60,9001  >  35978 [ACK] Seq=9139647 Ack=166718563 Win=65535 Len=0
1,6.2148919999999634,10.0.2.15,62.210.85.178,TLSv1.2,4124,Application Data
1,6.215040999999928,62.210.85.178,10.0.2.15,TCP,60,9001  >  35978 [ACK] Seq=9139647 Ack=166720023 Win=65535 Len=0
1,6.215074999999615,62.210.85.178,10.0.2.15,TCP,60,9001  >  35978 [ACK] Seq=9139647 Ack=166721483 Win=65535 Len=0
1,6.215083999999933,62.210.85.178,10.0.2.15,TCP,60,9001  >  35978 [ACK] Seq=9139647 Ack=166722633 Win=65535 Len=0
1,6.215248999999858,10.0.2.15,62.210.85.178,TLSv1.2,332,Application Data
1,6.215464999999767,62.210.85.178,10.0.2.15,TCP,60,9001  >  35978 [ACK] Seq=9139647 Ack=166722911 Win=65535 Len=0
1,6.215672999999697,10.0.2.15,62.210.85.178,TLSv1.2,3868,Application Data
1,6.215749999999844,62.210.85.178,10.0.2.15,TCP,60,9001  >  35978 [ACK] Seq=9139647 Ack=166724371 Win=65535 Len=0
1,6.215762999999697,62.210.85.178,10.0.2.15,TCP,60,9001  >  35978 [ACK] Seq=9139647 Ack=166725831 Win=65535 Len=0
1,6.215765999999803,62.210.85.178,10.0.2.15,TCP,60,9001  >  35978 [ACK] Seq=9139647 Ack=166726725 Win=65535 Len=0
1,6.215843999999834,10.0.2.15,62.210.85.178,TLSv1.2,4124,Application Data
1,6.215958999999657,62.210.85.178,10.0.2.15,TCP,60,9001  >  35978 [ACK] Seq=9139647 Ack=166728185 Win=65535 Len=0
1,6.215994999999566,62.210.85.178,10.0.2.15,TCP,60,9001  >  35978 [ACK] Seq=9139647 Ack=166729645 Win=65535 Len=0
1,6.215997999999672,62.210.85.178,10.0.2.15,TCP,60,9001  >  35978 [ACK] Seq=9139647 Ack=166730795 Win=65535 Len=0
1,6.216065999999955,10.0.2.15,62.210.85.178,TLSv1.2,3030,Application Data
1,6.216154999999617,62.210.85.178,10.0.2.15,TCP,60,9001  >  35978 [ACK] Seq=9139647 Ack=166732255 Win=65535 Len=0
1,6.216165999999703,62.210.85.178,10.0.2.15,TCP,60,9001  >  35978 [ACK] Seq=9139647 Ack=166733715 Win=65535 Len=0
1,6.216168999999809,62.210.85.178,10.0.2.15,TCP,60,9001  >  35978 [ACK] Seq=9139647 Ack=166733771 Win=65535 Len=0
1,6.22884699999986,10.0.2.15,62.210.85.178,TLSv1.2,4124,Application Data
1,6.228958999999577,62.210.85.178,10.0.2.15,TCP,60,9001  >  35978 [ACK] Seq=9139647 Ack=166735231 Win=65535 Len=0
1,6.228973999999653,62.210.85.178,10.0.2.15,TCP,60,9001  >  35978 [ACK] Seq=9139647 Ack=166736691 Win=65535 Len=0
1,6.228977999999643,62.210.85.178,10.0.2.15,TCP,60,9001  >  35978 [ACK] Seq=9139647 Ack=166737841 Win=65535 Len=0
1,6.22902699999986,10.0.2.15,62.210.85.178,TLSv1.2,4124,Application Data
1,6.229068999999981,62.210.85.178,10.0.2.15,TCP,60,9001  >  35978 [ACK] Seq=9139647 Ack=166739301 Win=65535 Len=0
1,6.229077999999845,62.210.85.178,10.0.2.15,TCP,60,9001  >  35978 [ACK] Seq=9139647 Ack=166740761 Win=65535 Len=0
1,6.229082999999719,62.210.85.178,10.0.2.15,TCP,60,9001  >  35978 [ACK] Seq=9139647 Ack=166741911 Win=65535 Len=0
1,6.229129999999714,10.0.2.15,62.210.85.178,TLSv1.2,4124,Application Data
1,6.229167999999845,62.210.85.178,10.0.2.15,TCP,60,9001  >  35978 [ACK] Seq=9139647 Ack=166743371 Win=65535 Len=0
1,6.229176999999709,62.210.85.178,10.0.2.15,TCP,60,9001  >  35978 [ACK] Seq=9139647 Ack=166744831 Win=65535 Len=0
1,6.229181999999582,62.210.85.178,10.0.2.15,TCP,60,9001  >  35978 [ACK] Seq=9139647 Ack=166745981 Win=65535 Len=0
1,6.229223999999704,10.0.2.15,62.210.85.178,TLSv1.2,4124,Application Data
1,6.229261999999835,62.210.85.178,10.0.2.15,TCP,60,9001  >  35978 [ACK] Seq=9139647 Ack=166747441 Win=65535 Len=0
1,6.229269999999815,62.210.85.178,10.0.2.15,TCP,60,9001  >  35978 [ACK] Seq=9139647 Ack=166748901 Win=65535 Len=0
1,6.229274999999689,62.210.85.178,10.0.2.15,TCP,60,9001  >  35978 [ACK] Seq=9139647 Ack=166750051 Win=65535 Len=0
1,6.229309999999714,10.0.2.15,62.210.85.178,TLSv1.2,332,Application Data
1,6.229345999999623,62.210.85.178,10.0.2.15,TCP,60,9001  >  35978 [ACK] Seq=9139647 Ack=166750329 Win=65535 Len=0
1,6.229440999999952,10.0.2.15,62.210.85.178,TLSv1.2,3868,Application Data
1,6.229482999999618,62.210.85.178,10.0.2.15,TCP,60,9001  >  35978 [ACK] Seq=9139647 Ack=166751789 Win=65535 Len=0
1,6.229490999999598,62.210.85.178,10.0.2.15,TCP,60,9001  >  35978 [ACK] Seq=9139647 Ack=166753249 Win=65535 Len=0
1,6.229493999999704,62.210.85.178,10.0.2.15,TCP,60,9001  >  35978 [ACK] Seq=9139647 Ack=166754143 Win=65535 Len=0
1,6.229532999999719,10.0.2.15,62.210.85.178,TLSv1.2,4124,Application Data
1,6.229592999999568,10.0.2.15,62.210.85.178,TCP,2974,35978  >  9001 [ACK] Seq=166758213 Ack=9139647 Win=65535 Len=2920 [TCP segment of a reassembled PDU]
1,6.229635999999573,62.210.85.178,10.0.2.15,TCP,60,9001  >  35978 [ACK] Seq=9139647 Ack=166755603 Win=65535 Len=0
1,6.229641999999785,62.210.85.178,10.0.2.15,TCP,60,9001  >  35978 [ACK] Seq=9139647 Ack=166757063 Win=65535 Len=0
1,6.229644999999891,62.210.85.178,10.0.2.15,TCP,60,9001  >  35978 [ACK] Seq=9139647 Ack=166758213 Win=65535 Len=0
1,6.229647999999997,62.210.85.178,10.0.2.15,TCP,60,9001  >  35978 [ACK] Seq=9139647 Ack=166759673 Win=65535 Len=0
1,6.229650999999649,62.210.85.178,10.0.2.15,TCP,60,9001  >  35978 [ACK] Seq=9139647 Ack=166761133 Win=65535 Len=0
1,6.229679999999917,10.0.2.15,62.210.85.178,TLSv1.2,110,Application Data
1,6.229715999999826,62.210.85.178,10.0.2.15,TCP,60,9001  >  35978 [ACK] Seq=9139647 Ack=166761189 Win=65535 Len=0
1,6.2389119999998,10.0.2.15,62.210.85.178,TLSv1.2,1104,Application Data
1,6.238965000000007,62.210.85.178,10.0.2.15,TCP,60,9001  >  35978 [ACK] Seq=9139647 Ack=166762239 Win=65535 Len=0
1,6.335187999999562,54.93.77.70,10.0.2.15,TLSv1.2,3674,Application Data
1,6.335305999999946,10.0.2.15,54.93.77.70,TCP,54,34692  >  9001 [ACK] Seq=9176973 Ack=166535919 Win=65535 Len=0
1,6.3504479999996875,54.93.77.70,10.0.2.15,TCP,2950,"9001  >  34692 [PSH, ACK] Seq=166535919 Ack=9176973 Win=65535 Len=2896 [TCP segment of a reassembled PDU]"
1,6.350509999999758,10.0.2.15,54.93.77.70,TCP,54,34692  >  9001 [ACK] Seq=9176973 Ack=166538815 Win=65535 Len=0
1,6.351137999999992,54.93.77.70,10.0.2.15,TLSv1.2,778,Application Data
1,6.357958999999937,54.93.77.70,10.0.2.15,TCP,2950,"9001  >  34692 [PSH, ACK] Seq=166539539 Ack=9176973 Win=65535 Len=2896 [TCP segment of a reassembled PDU]"
1,6.3580079999997,10.0.2.15,54.93.77.70,TCP,54,34692  >  9001 [ACK] Seq=9176973 Ack=166542435 Win=65535 Len=0
1,6.368759999999838,54.93.77.70,10.0.2.15,TLSv1.2,1314,"Application Data, Application Data"
1,6.380454999999984,54.93.77.70,10.0.2.15,TLSv1.2,2950,Application Data
1,6.380501999999979,10.0.2.15,54.93.77.70,TCP,54,34692  >  9001 [ACK] Seq=9176973 Ack=166546591 Win=65535 Len=0
1,6.3855359999997745,54.93.77.70,10.0.2.15,TLSv1.2,1314,Application Data
1,6.3894579999996495,54.93.77.70,10.0.2.15,TLSv1.2,4398,Application Data
1,6.389516999999614,10.0.2.15,54.93.77.70,TCP,54,34692  >  9001 [ACK] Seq=9176973 Ack=166552195 Win=65535 Len=0
1,6.402325999999903,54.93.77.70,10.0.2.15,TLSv1.2,2950,Application Data [TCP segment of a reassembled PDU]
1,6.402405999999701,10.0.2.15,54.93.77.70,TCP,54,34692  >  9001 [ACK] Seq=9176973 Ack=166555091 Win=65535 Len=0
1,6.402439999999842,54.93.77.70,10.0.2.15,TLSv1.2,1618,Application Data
1,6.402493999999933,10.0.2.15,54.93.77.70,TCP,54,34692  >  9001 [ACK] Seq=9176973 Ack=166556655 Win=65535 Len=0
1,6.411863999999696,54.93.77.70,10.0.2.15,TCP,2950,"9001  >  34692 [PSH, ACK] Seq=166556655 Ack=9176973 Win=65535 Len=2896 [TCP segment of a reassembled PDU]"
1,6.41193499999963,10.0.2.15,54.93.77.70,TCP,54,34692  >  9001 [ACK] Seq=9176973 Ack=166559551 Win=65535 Len=0
1,6.411995999999817,54.93.77.70,10.0.2.15,TLSv1.2,4398,Application Data [TCP segment of a reassembled PDU]
1,6.412069999999858,10.0.2.15,54.93.77.70,TCP,54,34692  >  9001 [ACK] Seq=9176973 Ack=166563895 Win=65535 Len=0
1,6.412238999999772,10.0.2.15,54.93.77.70,TLSv1.2,590,Application Data
1,6.412309999999707,54.93.77.70,10.0.2.15,TCP,60,9001  >  34692 [ACK] Seq=166563895 Ack=9177509 Win=65535 Len=0
1,6.419226999999864,54.93.77.70,10.0.2.15,TLSv1.2,568,Application Data
1,6.422906999999668,54.93.77.70,10.0.2.15,TCP,2950,"9001  >  34692 [PSH, ACK] Seq=166564409 Ack=9177509 Win=65535 Len=2896 [TCP segment of a reassembled PDU]"
1,6.422958999999992,10.0.2.15,54.93.77.70,TCP,54,34692  >  9001 [ACK] Seq=9177509 Ack=166567305 Win=65535 Len=0
1,6.432877999999619,54.93.77.70,10.0.2.15,TLSv1.2,7294,"Application Data, Application Data, Application Data"
1,6.432956999999988,10.0.2.15,54.93.77.70,TCP,54,34692  >  9001 [ACK] Seq=9177509 Ack=166574545 Win=65535 Len=0
1,6.434909999999945,54.93.77.70,10.0.2.15,TLSv1.2,1314,Application Data
1,6.459131999999954,54.93.77.70,10.0.2.15,TCP,2950,"9001  >  34692 [PSH, ACK] Seq=166575805 Ack=9177509 Win=65535 Len=2896 [TCP segment of a reassembled PDU]"
1,6.459182999999939,10.0.2.15,54.93.77.70,TCP,54,34692  >  9001 [ACK] Seq=9177509 Ack=166578701 Win=65535 Len=0
1,6.4592329999995854,54.93.77.70,10.0.2.15,TLSv1.2,778,Application Data
1,6.4619119999997565,54.93.77.70,10.0.2.15,TCP,2950,"9001  >  34692 [PSH, ACK] Seq=166579425 Ack=9177509 Win=65535 Len=2896 [TCP segment of a reassembled PDU]"
1,6.461955999999645,10.0.2.15,54.93.77.70,TCP,54,34692  >  9001 [ACK] Seq=9177509 Ack=166582321 Win=65535 Len=0
1,6.473381999999674,54.93.77.70,10.0.2.15,TLSv1.2,1502,Application Data [TCP segment of a reassembled PDU]
1,6.473423999999795,10.0.2.15,54.93.77.70,TCP,54,34692  >  9001 [ACK] Seq=9177509 Ack=166583769 Win=65535 Len=0
1,6.473595999999816,10.0.2.15,54.93.77.70,TLSv1.2,590,Application Data
1,6.473673999999846,54.93.77.70,10.0.2.15,TCP,60,9001  >  34692 [ACK] Seq=166583769 Ack=9178045 Win=65535 Len=0
1,6.475402999999915,54.93.77.70,10.0.2.15,TLSv1.2,894,Application Data
1,6.482687999999598,54.93.77.70,10.0.2.15,TLSv1.2,7294,Application Data
1,6.482763999999861,10.0.2.15,54.93.77.70,TCP,54,34692  >  9001 [ACK] Seq=9178045 Ack=166591849 Win=65535 Len=0
1,6.48290599999973,10.0.2.15,54.93.77.70,TLSv1.2,590,Application Data
1,6.4829759999997805,54.93.77.70,10.0.2.15,TCP,60,9001  >  34692 [ACK] Seq=166591849 Ack=9178581 Win=65535 Len=0
1,6.491039000000001,54.93.77.70,10.0.2.15,TLSv1.2,2950,Application Data [TCP segment of a reassembled PDU]
1,6.49108299999989,10.0.2.15,54.93.77.70,TCP,54,34692  >  9001 [ACK] Seq=9178581 Ack=166594745 Win=65535 Len=0
1,6.492461999999705,54.93.77.70,10.0.2.15,TLSv1.2,1292,Application Data
1,6.501001999999971,54.93.77.70,10.0.2.15,TCP,2950,"9001  >  34692 [PSH, ACK] Seq=166595983 Ack=9178581 Win=65535 Len=2896 [TCP segment of a reassembled PDU]"
1,6.501055999999608,10.0.2.15,54.93.77.70,TCP,54,34692  >  9001 [ACK] Seq=9178581 Ack=166598879 Win=65535 Len=0
1,6.518612999999732,54.93.77.70,10.0.2.15,TLSv1.2,2950,Application Data [TCP segment of a reassembled PDU]
1,6.518675999999687,54.93.77.70,10.0.2.15,TLSv1.2,3580,"Application Data, Application Data"
1,6.518725999999788,10.0.2.15,54.93.77.70,TCP,54,34692  >  9001 [ACK] Seq=9178581 Ack=166601775 Win=65535 Len=0
1,6.518822999999884,10.0.2.15,54.93.77.70,TCP,54,34692  >  9001 [ACK] Seq=9178581 Ack=166605301 Win=65535 Len=0
1,6.539127000000008,54.93.77.70,10.0.2.15,TCP,2950,"9001  >  34692 [PSH, ACK] Seq=166605301 Ack=9178581 Win=65535 Len=2896 [TCP segment of a reassembled PDU]"
1,6.539238999999725,10.0.2.15,54.93.77.70,TCP,54,34692  >  9001 [ACK] Seq=9178581 Ack=166608197 Win=65535 Len=0
1,6.539276999999856,54.93.77.70,10.0.2.15,TLSv1.2,1502,Application Data [TCP segment of a reassembled PDU]
1,6.539346999999907,10.0.2.15,54.93.77.70,TCP,54,34692  >  9001 [ACK] Seq=9178581 Ack=166609645 Win=65535 Len=0
1,6.543388999999934,54.93.77.70,10.0.2.15,TLSv1.2,3464,Application Data
1,6.543461999999636,10.0.2.15,54.93.77.70,TCP,54,34692  >  9001 [ACK] Seq=9178581 Ack=166613055 Win=65535 Len=0
1,6.543730999999752,10.0.2.15,54.93.77.70,TLSv1.2,590,Application Data
1,6.5438789999998335,54.93.77.70,10.0.2.15,TCP,60,9001  >  34692 [ACK] Seq=166613055 Ack=9179117 Win=65535 Len=0
1,6.562033999999585,62.210.85.178,10.0.2.15,TLSv1.2,590,Application Data
1,6.563554999999724,54.93.77.70,10.0.2.15,TLSv1.2,3160,Application Data
1,6.56363599999986,10.0.2.15,54.93.77.70,TCP,54,34692  >  9001 [ACK] Seq=9179117 Ack=166616161 Win=65535 Len=0
1,6.567555999999968,10.0.2.15,54.93.77.70,TLSv1.2,590,Application Data
