No.,Time,Source,Destination,Protocol,Length,Info
1,0.021287999999969998,10.0.2.15,54.93.77.70,TCP,54,34692  >  9001 [ACK] Seq=842405 Ack=14900275 Win=65535 Len=0
1,0.06848899999999958,62.210.85.178,10.0.2.15,TLSv1.2,590,Application Data
1,0.11121900000000551,10.0.2.15,62.210.85.178,TCP,54,35978  >  9001 [ACK] Seq=14895281 Ack=838247 Win=65535 Len=0
1,0.13317499999999427,10.0.2.15,54.93.77.70,TLSv1.2,590,Application Data
1,0.133357999999987,54.93.77.70,10.0.2.15,TCP,60,9001  >  34692 [ACK] Seq=14900275 Ack=842941 Win=65535 Len=0
1,0.9865439999999808,62.210.85.178,10.0.2.15,TLSv1.2,1104,Application Data
1,0.98664500000001,10.0.2.15,62.210.85.178,TCP,54,35978  >  9001 [ACK] Seq=14895281 Ack=839297 Win=65535 Len=0
1,0.9870300000000043,10.0.2.15,62.210.85.178,TLSv1.2,590,Application Data
1,0.9871539999999754,62.210.85.178,10.0.2.15,TCP,60,9001  >  35978 [ACK] Seq=839297 Ack=14895817 Win=65535 Len=0
1,1.2943639999999732,54.93.77.70,10.0.2.15,TLSv1.2,590,Application Data
1,1.2944519999999784,10.0.2.15,54.93.77.70,TCP,54,34692  >  9001 [ACK] Seq=842941 Ack=14900811 Win=65535 Len=0
1,1.2949120000000107,10.0.2.15,54.93.77.70,TLSv1.2,1618,Application Data
1,1.295047000000011,54.93.77.70,10.0.2.15,TCP,60,9001  >  34692 [ACK] Seq=14900811 Ack=844401 Win=65535 Len=0
1,1.2950609999999756,54.93.77.70,10.0.2.15,TCP,60,9001  >  34692 [ACK] Seq=14900811 Ack=844505 Win=65535 Len=0
1,1.4996150000000057,62.210.85.178,10.0.2.15,TLSv1.2,1618,Application Data
1,1.499746000000016,10.0.2.15,62.210.85.178,TCP,54,35978  >  9001 [ACK] Seq=14895817 Ack=840861 Win=65535 Len=0
1,1.517142999999976,10.0.2.15,62.210.85.178,TLSv1.2,590,Application Data
1,1.5175800000000095,62.210.85.178,10.0.2.15,TCP,60,9001  >  35978 [ACK] Seq=840861 Ack=14896353 Win=65535 Len=0
1,1.52986199999998,10.0.2.15,62.210.85.178,TLSv1.2,1618,Application Data
1,1.5300560000000019,62.210.85.178,10.0.2.15,TCP,60,9001  >  35978 [ACK] Seq=840861 Ack=14897813 Win=65535 Len=0
1,1.530095000000017,62.210.85.178,10.0.2.15,TCP,60,9001  >  35978 [ACK] Seq=840861 Ack=14897917 Win=65535 Len=0
1,1.6261149999999702,54.93.77.70,10.0.2.15,TLSv1.2,590,Application Data
1,1.6696430000000078,10.0.2.15,54.93.77.70,TCP,54,34692  >  9001 [ACK] Seq=844505 Ack=14901347 Win=65535 Len=0
1,1.6904870000000187,54.93.77.70,10.0.2.15,TLSv1.2,1618,Application Data
1,1.6905669999999873,10.0.2.15,54.93.77.70,TCP,54,34692  >  9001 [ACK] Seq=844505 Ack=14902911 Win=65535 Len=0
1,1.6927130000000261,10.0.2.15,54.93.77.70,TLSv1.2,590,Application Data
1,1.6929480000000012,54.93.77.70,10.0.2.15,TCP,60,9001  >  34692 [ACK] Seq=14902911 Ack=845041 Win=65535 Len=0
1,1.7900260000000117,62.210.85.178,10.0.2.15,TLSv1.2,590,Application Data
1,1.7904149999999959,10.0.2.15,62.210.85.178,TLSv1.2,590,Application Data
1,1.7905440000000112,62.210.85.178,10.0.2.15,TCP,60,9001  >  35978 [ACK] Seq=841397 Ack=14898453 Win=65535 Len=0
1,2.218076999999994,54.93.77.70,10.0.2.15,TLSv1.2,590,Application Data
1,2.218543000000011,10.0.2.15,54.93.77.70,TLSv1.2,590,Application Data
1,2.2186829999999986,54.93.77.70,10.0.2.15,TCP,60,9001  >  34692 [ACK] Seq=14903447 Ack=845577 Win=65535 Len=0
1,2.829907999999989,62.210.85.178,10.0.2.15,TLSv1.2,590,Application Data
1,2.8367549999999824,10.0.2.15,62.210.85.178,TLSv1.2,590,Application Data
1,2.8369789999999853,62.210.85.178,10.0.2.15,TCP,60,9001  >  35978 [ACK] Seq=841933 Ack=14898989 Win=65535 Len=0
1,2.8504800000000046,10.0.2.15,62.210.85.178,TLSv1.2,4124,Application Data
1,2.850588000000016,10.0.2.15,62.210.85.178,TCP,2974,35978  >  9001 [ACK] Seq=14903059 Ack=841933 Win=65535 Len=2920 [TCP segment of a reassembled PDU]
1,2.850635000000011,62.210.85.178,10.0.2.15,TCP,60,9001  >  35978 [ACK] Seq=841933 Ack=14900449 Win=65535 Len=0
1,2.8506459999999834,62.210.85.178,10.0.2.15,TCP,60,9001  >  35978 [ACK] Seq=841933 Ack=14901909 Win=65535 Len=0
1,2.8506499999999733,62.210.85.178,10.0.2.15,TCP,60,9001  >  35978 [ACK] Seq=841933 Ack=14903059 Win=65535 Len=0
1,2.85065400000002,62.210.85.178,10.0.2.15,TCP,60,9001  >  35978 [ACK] Seq=841933 Ack=14904519 Win=65535 Len=0
1,2.8506590000000074,62.210.85.178,10.0.2.15,TCP,60,9001  >  35978 [ACK] Seq=841933 Ack=14905979 Win=65535 Len=0
1,2.850701000000015,10.0.2.15,62.210.85.178,TLSv1.2,1204,Application Data
1,2.850791000000015,62.210.85.178,10.0.2.15,TCP,60,9001  >  35978 [ACK] Seq=841933 Ack=14907129 Win=65535 Len=0
1,2.8508209999999963,10.0.2.15,62.210.85.178,TCP,2974,35978  >  9001 [ACK] Seq=14907129 Ack=841933 Win=65535 Len=2920 [TCP segment of a reassembled PDU]
1,2.8508770000000254,10.0.2.15,62.210.85.178,TLSv1.2,1204,Application Data
1,2.850911999999994,62.210.85.178,10.0.2.15,TCP,60,9001  >  35978 [ACK] Seq=841933 Ack=14908589 Win=65535 Len=0
1,2.8509189999999762,62.210.85.178,10.0.2.15,TCP,60,9001  >  35978 [ACK] Seq=841933 Ack=14910049 Win=65535 Len=0
1,2.850923000000023,62.210.85.178,10.0.2.15,TCP,60,9001  >  35978 [ACK] Seq=841933 Ack=14911199 Win=65535 Len=0
1,2.8509690000000205,10.0.2.15,62.210.85.178,TLSv1.2,4124,Application Data
1,2.8510089999999764,62.210.85.178,10.0.2.15,TCP,60,9001  >  35978 [ACK] Seq=841933 Ack=14912659 Win=65535 Len=0
1,2.8510160000000155,62.210.85.178,10.0.2.15,TCP,60,9001  >  35978 [ACK] Seq=841933 Ack=14914119 Win=65535 Len=0
1,2.851099999999974,62.210.85.178,10.0.2.15,TCP,60,9001  >  35978 [ACK] Seq=841933 Ack=14915269 Win=65535 Len=0
1,2.8511330000000044,10.0.2.15,62.210.85.178,TLSv1.2,2974,Application Data
1,2.8511720000000196,62.210.85.178,10.0.2.15,TCP,60,9001  >  35978 [ACK] Seq=841933 Ack=14916729 Win=65535 Len=0
1,2.851179000000002,62.210.85.178,10.0.2.15,TCP,60,9001  >  35978 [ACK] Seq=841933 Ack=14918189 Win=65535 Len=0
1,2.8512119999999754,10.0.2.15,62.210.85.178,TLSv1.2,1226,Application Data
1,2.8512489999999957,62.210.85.178,10.0.2.15,TCP,60,9001  >  35978 [ACK] Seq=841933 Ack=14919361 Win=65535 Len=0
1,2.8512959999999907,10.0.2.15,62.210.85.178,TLSv1.2,4124,Application Data
1,2.8513360000000034,62.210.85.178,10.0.2.15,TCP,60,9001  >  35978 [ACK] Seq=841933 Ack=14920821 Win=65535 Len=0
1,2.8513429999999858,62.210.85.178,10.0.2.15,TCP,60,9001  >  35978 [ACK] Seq=841933 Ack=14922281 Win=65535 Len=0
1,2.851347999999973,62.210.85.178,10.0.2.15,TCP,60,9001  >  35978 [ACK] Seq=841933 Ack=14923431 Win=65535 Len=0
1,2.851392999999973,10.0.2.15,62.210.85.178,TLSv1.2,3030,Application Data
1,2.8514339999999834,62.210.85.178,10.0.2.15,TCP,60,9001  >  35978 [ACK] Seq=841933 Ack=14924891 Win=65535 Len=0
1,2.8514410000000225,62.210.85.178,10.0.2.15,TCP,60,9001  >  35978 [ACK] Seq=841933 Ack=14926351 Win=65535 Len=0
1,2.8514450000000124,62.210.85.178,10.0.2.15,TCP,60,9001  >  35978 [ACK] Seq=841933 Ack=14926407 Win=65535 Len=0
1,2.860640999999987,10.0.2.15,62.210.85.178,TLSv1.2,4124,Application Data
1,2.8607259999999997,10.0.2.15,62.210.85.178,TCP,2974,35978  >  9001 [ACK] Seq=14930477 Ack=841933 Win=65535 Len=2920 [TCP segment of a reassembled PDU]
1,2.8607660000000124,62.210.85.178,10.0.2.15,TCP,60,9001  >  35978 [ACK] Seq=841933 Ack=14927867 Win=65535 Len=0
1,2.860773999999992,62.210.85.178,10.0.2.15,TCP,60,9001  >  35978 [ACK] Seq=841933 Ack=14929327 Win=65535 Len=0
1,2.860777999999982,62.210.85.178,10.0.2.15,TCP,60,9001  >  35978 [ACK] Seq=841933 Ack=14930477 Win=65535 Len=0
1,2.860781999999972,62.210.85.178,10.0.2.15,TCP,60,9001  >  35978 [ACK] Seq=841933 Ack=14931937 Win=65535 Len=0
1,2.860787000000016,62.210.85.178,10.0.2.15,TCP,60,9001  >  35978 [ACK] Seq=841933 Ack=14933397 Win=65535 Len=0
1,2.860826999999972,10.0.2.15,62.210.85.178,TLSv1.2,1204,Application Data
1,2.86090200000001,62.210.85.178,10.0.2.15,TCP,60,9001  >  35978 [ACK] Seq=841933 Ack=14934547 Win=65535 Len=0
1,2.8609420000000227,10.0.2.15,62.210.85.178,TLSv1.2,4124,Application Data
1,2.8609839999999735,62.210.85.178,10.0.2.15,TCP,60,9001  >  35978 [ACK] Seq=841933 Ack=14936007 Win=65535 Len=0
1,2.8609900000000152,62.210.85.178,10.0.2.15,TCP,60,9001  >  35978 [ACK] Seq=841933 Ack=14937467 Win=65535 Len=0
1,2.8609950000000026,62.210.85.178,10.0.2.15,TCP,60,9001  >  35978 [ACK] Seq=841933 Ack=14938617 Win=65535 Len=0
1,2.861039000000005,10.0.2.15,62.210.85.178,TLSv1.2,268,Application Data
1,2.861077000000023,62.210.85.178,10.0.2.15,TCP,60,9001  >  35978 [ACK] Seq=841933 Ack=14938831 Win=65535 Len=0
1,2.9439709999999764,54.93.77.70,10.0.2.15,TLSv1.2,590,Application Data
1,2.9656870000000026,54.93.77.70,10.0.2.15,TCP,2950,"9001  >  34692 [PSH, ACK] Seq=14903983 Ack=845577 Win=65535 Len=2896 [TCP segment of a reassembled PDU]"
1,2.9658019999999965,10.0.2.15,54.93.77.70,TCP,54,34692  >  9001 [ACK] Seq=845577 Ack=14906879 Win=65535 Len=0
1,2.984014000000002,54.93.77.70,10.0.2.15,TLSv1.2,3674,Application Data [TCP segment of a reassembled PDU]
1,2.984107999999992,10.0.2.15,54.93.77.70,TCP,54,34692  >  9001 [ACK] Seq=845577 Ack=14910499 Win=65535 Len=0
1,2.9856359999999995,54.93.77.70,10.0.2.15,TLSv1.2,8742,"Application Data, Application Data"
1,2.985699000000011,10.0.2.15,54.93.77.70,TCP,54,34692  >  9001 [ACK] Seq=845577 Ack=14919187 Win=65535 Len=0
1,2.9960829999999987,54.93.77.70,10.0.2.15,TLSv1.2,1502,Application Data [TCP segment of a reassembled PDU]
1,2.9961569999999824,10.0.2.15,54.93.77.70,TCP,54,34692  >  9001 [ACK] Seq=845577 Ack=14920635 Win=65535 Len=0
1,3.001086999999984,54.93.77.70,10.0.2.15,TLSv1.2,474,Application Data
1,3.0068600000000174,54.93.77.70,10.0.2.15,TCP,1502,"9001  >  34692 [PSH, ACK] Seq=14921055 Ack=845577 Win=65535 Len=1448 [TCP segment of a reassembled PDU]"
1,3.0069179999999847,10.0.2.15,54.93.77.70,TCP,54,34692  >  9001 [ACK] Seq=845577 Ack=14922503 Win=65535 Len=0
1,3.0086339999999723,54.93.77.70,10.0.2.15,TCP,1502,"9001  >  34692 [PSH, ACK] Seq=14922503 Ack=845577 Win=65535 Len=1448 [TCP segment of a reassembled PDU]"
1,3.0086769999999774,10.0.2.15,54.93.77.70,TCP,54,34692  >  9001 [ACK] Seq=845577 Ack=14923951 Win=65535 Len=0
1,3.0178020000000174,54.93.77.70,10.0.2.15,TLSv1.2,2950,Application Data [TCP segment of a reassembled PDU]
1,3.017872000000011,10.0.2.15,54.93.77.70,TCP,54,34692  >  9001 [ACK] Seq=845577 Ack=14926847 Win=65535 Len=0
1,3.01813599999997,54.93.77.70,10.0.2.15,TCP,1502,"9001  >  34692 [PSH, ACK] Seq=14926847 Ack=845577 Win=65535 Len=1448 [TCP segment of a reassembled PDU]"
1,3.0181779999999776,10.0.2.15,54.93.77.70,TCP,54,34692  >  9001 [ACK] Seq=845577 Ack=14928295 Win=65535 Len=0
1,3.019808000000012,54.93.77.70,10.0.2.15,TLSv1.2,8322,"Application Data, Application Data, Application Data"
1,3.0198720000000208,10.0.2.15,54.93.77.70,TCP,54,34692  >  9001 [ACK] Seq=845577 Ack=14936563 Win=65535 Len=0
1,3.020153999999991,10.0.2.15,54.93.77.70,TLSv1.2,590,Application Data
1,3.0202639999999974,54.93.77.70,10.0.2.15,TCP,60,9001  >  34692 [ACK] Seq=14936563 Ack=846113 Win=65535 Len=0
1,3.029876999999999,54.93.77.70,10.0.2.15,TLSv1.2,7294,"Application Data, Application Data"
1,3.029935000000023,10.0.2.15,54.93.77.70,TCP,54,34692  >  9001 [ACK] Seq=846113 Ack=14943803 Win=65535 Len=0
1,3.0302839999999946,10.0.2.15,54.93.77.70,TLSv1.2,590,Application Data
1,3.030399999999986,54.93.77.70,10.0.2.15,TCP,60,9001  >  34692 [ACK] Seq=14943803 Ack=846649 Win=65535 Len=0
1,3.039581999999996,10.0.2.15,54.93.77.70,TLSv1.2,590,Application Data
1,3.0397459999999796,54.93.77.70,10.0.2.15,TCP,60,9001  >  34692 [ACK] Seq=14943803 Ack=847185 Win=65535 Len=0
1,3.4441790000000196,62.210.85.178,10.0.2.15,TLSv1.2,590,Application Data
1,3.485629000000017,10.0.2.15,62.210.85.178,TCP,54,35978  >  9001 [ACK] Seq=14938831 Ack=842469 Win=65535 Len=0
1,3.502724999999998,62.210.85.178,10.0.2.15,TLSv1.2,1104,Application Data
1,3.502830000000017,10.0.2.15,62.210.85.178,TCP,54,35978  >  9001 [ACK] Seq=14938831 Ack=843519 Win=65535 Len=0
1,3.5034329999999727,10.0.2.15,62.210.85.178,TLSv1.2,590,Application Data
1,3.503559999999993,62.210.85.178,10.0.2.15,TCP,60,9001  >  35978 [ACK] Seq=843519 Ack=14939367 Win=65535 Len=0
1,3.618419000000017,54.93.77.70,10.0.2.15,TLSv1.2,590,Application Data
1,3.618862999999976,10.0.2.15,54.93.77.70,TLSv1.2,590,Application Data
1,3.6190050000000156,54.93.77.70,10.0.2.15,TCP,60,9001  >  34692 [ACK] Seq=14944339 Ack=847721 Win=65535 Len=0
1,3.735149999999976,62.210.85.178,10.0.2.15,TLSv1.2,590,Application Data
1,3.742504999999994,10.0.2.15,62.210.85.178,TLSv1.2,590,Application Data
1,3.742709999999988,62.210.85.178,10.0.2.15,TCP,60,9001  >  35978 [ACK] Seq=844055 Ack=14939903 Win=65535 Len=0
1,3.7540819999999826,10.0.2.15,62.210.85.178,TLSv1.2,4124,Application Data
1,3.7541949999999815,10.0.2.15,62.210.85.178,TCP,2974,35978  >  9001 [ACK] Seq=14943973 Ack=844055 Win=65535 Len=2920 [TCP segment of a reassembled PDU]
1,3.7542399999999816,62.210.85.178,10.0.2.15,TCP,60,9001  >  35978 [ACK] Seq=844055 Ack=14941363 Win=65535 Len=0
1,3.7542510000000107,62.210.85.178,10.0.2.15,TCP,60,9001  >  35978 [ACK] Seq=844055 Ack=14942823 Win=65535 Len=0
1,3.754255999999998,62.210.85.178,10.0.2.15,TCP,60,9001  >  35978 [ACK] Seq=844055 Ack=14943973 Win=65535 Len=0
1,3.754259999999988,62.210.85.178,10.0.2.15,TCP,60,9001  >  35978 [ACK] Seq=844055 Ack=14945433 Win=65535 Len=0
1,3.7542649999999753,62.210.85.178,10.0.2.15,TCP,60,9001  >  35978 [ACK] Seq=844055 Ack=14946893 Win=65535 Len=0
1,3.7543079999999804,10.0.2.15,62.210.85.178,TLSv1.2,1204,Application Data
1,3.7543759999999793,10.0.2.15,62.210.85.178,TCP,2974,35978  >  9001 [ACK] Seq=14948043 Ack=844055 Win=65535 Len=2920 [TCP segment of a reassembled PDU]
1,3.754415999999992,62.210.85.178,10.0.2.15,TCP,60,9001  >  35978 [ACK] Seq=844055 Ack=14948043 Win=65535 Len=0
1,3.7544229999999743,62.210.85.178,10.0.2.15,TCP,60,9001  >  35978 [ACK] Seq=844055 Ack=14949503 Win=65535 Len=0
1,3.7544280000000185,62.210.85.178,10.0.2.15,TCP,60,9001  >  35978 [ACK] Seq=844055 Ack=14950963 Win=65535 Len=0
1,3.7544619999999895,10.0.2.15,62.210.85.178,TLSv1.2,1204,Application Data
1,3.7545279999999934,10.0.2.15,62.210.85.178,TCP,2974,35978  >  9001 [ACK] Seq=14952113 Ack=844055 Win=65535 Len=2920 [TCP segment of a reassembled PDU]
1,3.7545670000000086,62.210.85.178,10.0.2.15,TCP,60,9001  >  35978 [ACK] Seq=844055 Ack=14952113 Win=65535 Len=0
1,3.754573999999991,62.210.85.178,10.0.2.15,TCP,60,9001  >  35978 [ACK] Seq=844055 Ack=14953573 Win=65535 Len=0
1,3.754577999999981,62.210.85.178,10.0.2.15,TCP,60,9001  >  35978 [ACK] Seq=844055 Ack=14955033 Win=65535 Len=0
1,3.7546090000000163,10.0.2.15,62.210.85.178,TLSv1.2,1204,Application Data
1,3.7546879999999874,10.0.2.15,62.210.85.178,TLSv1.2,2974,Application Data
1,3.7547270000000026,62.210.85.178,10.0.2.15,TCP,60,9001  >  35978 [ACK] Seq=844055 Ack=14956183 Win=65535 Len=0
1,3.754733999999985,62.210.85.178,10.0.2.15,TCP,60,9001  >  35978 [ACK] Seq=844055 Ack=14957643 Win=65535 Len=0
1,3.7547389999999723,62.210.85.178,10.0.2.15,TCP,60,9001  >  35978 [ACK] Seq=844055 Ack=14959103 Win=65535 Len=0
1,3.7547700000000077,10.0.2.15,62.210.85.178,TLSv1.2,1226,Application Data
1,3.754806999999971,62.210.85.178,10.0.2.15,TCP,60,9001  >  35978 [ACK] Seq=844055 Ack=14960275 Win=65535 Len=0
1,3.754851999999971,10.0.2.15,62.210.85.178,TLSv1.2,4124,Application Data
1,3.754893999999979,62.210.85.178,10.0.2.15,TCP,60,9001  >  35978 [ACK] Seq=844055 Ack=14961735 Win=65535 Len=0
1,3.754901000000018,62.210.85.178,10.0.2.15,TCP,60,9001  >  35978 [ACK] Seq=844055 Ack=14963195 Win=65535 Len=0
1,3.754905000000008,62.210.85.178,10.0.2.15,TCP,60,9001  >  35978 [ACK] Seq=844055 Ack=14964345 Win=65535 Len=0
1,3.7549510000000055,10.0.2.15,62.210.85.178,TLSv1.2,3030,Application Data
1,3.7549900000000207,62.210.85.178,10.0.2.15,TCP,60,9001  >  35978 [ACK] Seq=844055 Ack=14965805 Win=65535 Len=0
1,3.754997000000003,62.210.85.178,10.0.2.15,TCP,60,9001  >  35978 [ACK] Seq=844055 Ack=14967265 Win=65535 Len=0
1,3.755000999999993,62.210.85.178,10.0.2.15,TCP,60,9001  >  35978 [ACK] Seq=844055 Ack=14967321 Win=65535 Len=0
1,3.7642190000000255,10.0.2.15,62.210.85.178,TLSv1.2,4124,Application Data
1,3.7642999999999915,10.0.2.15,62.210.85.178,TCP,2974,35978  >  9001 [ACK] Seq=14971391 Ack=844055 Win=65535 Len=2920 [TCP segment of a reassembled PDU]
1,3.764337000000012,62.210.85.178,10.0.2.15,TCP,60,9001  >  35978 [ACK] Seq=844055 Ack=14968781 Win=65535 Len=0
1,3.7643449999999916,62.210.85.178,10.0.2.15,TCP,60,9001  >  35978 [ACK] Seq=844055 Ack=14970241 Win=65535 Len=0
1,3.764349999999979,62.210.85.178,10.0.2.15,TCP,60,9001  >  35978 [ACK] Seq=844055 Ack=14971391 Win=65535 Len=0
1,3.7643540000000257,62.210.85.178,10.0.2.15,TCP,60,9001  >  35978 [ACK] Seq=844055 Ack=14972851 Win=65535 Len=0
1,3.7643580000000156,62.210.85.178,10.0.2.15,TCP,60,9001  >  35978 [ACK] Seq=844055 Ack=14974311 Win=65535 Len=0
1,3.764396999999974,10.0.2.15,62.210.85.178,TLSv1.2,1204,Application Data
1,3.764462999999978,10.0.2.15,62.210.85.178,TCP,2974,35978  >  9001 [ACK] Seq=14975461 Ack=844055 Win=65535 Len=2920 [TCP segment of a reassembled PDU]
1,3.764501999999993,62.210.85.178,10.0.2.15,TCP,60,9001  >  35978 [ACK] Seq=844055 Ack=14975461 Win=65535 Len=0
1,3.7645089999999755,62.210.85.178,10.0.2.15,TCP,60,9001  >  35978 [ACK] Seq=844055 Ack=14976921 Win=65535 Len=0
1,3.7645140000000197,62.210.85.178,10.0.2.15,TCP,60,9001  >  35978 [ACK] Seq=844055 Ack=14978381 Win=65535 Len=0
1,3.7645479999999907,10.0.2.15,62.210.85.178,TLSv1.2,1204,Application Data
1,3.7645840000000135,62.210.85.178,10.0.2.15,TCP,60,9001  >  35978 [ACK] Seq=844055 Ack=14979531 Win=65535 Len=0
1,3.7646310000000085,10.0.2.15,62.210.85.178,TLSv1.2,4124,Application Data
1,3.7647269999999935,10.0.2.15,62.210.85.178,TLSv1.2,1514,Application Data
1,3.7647499999999923,62.210.85.178,10.0.2.15,TCP,60,9001  >  35978 [ACK] Seq=844055 Ack=14980991 Win=65535 Len=0
1,3.764755999999977,62.210.85.178,10.0.2.15,TCP,60,9001  >  35978 [ACK] Seq=844055 Ack=14982451 Win=65535 Len=0
1,3.7647610000000213,62.210.85.178,10.0.2.15,TCP,60,9001  >  35978 [ACK] Seq=844055 Ack=14983601 Win=65535 Len=0
1,3.76479599999999,10.0.2.15,62.210.85.178,TLSv1.2,1464,Application Data
1,3.764831000000015,62.210.85.178,10.0.2.15,TCP,60,9001  >  35978 [ACK] Seq=844055 Ack=14985061 Win=65535 Len=0
1,3.764837,62.210.85.178,10.0.2.15,TCP,60,9001  >  35978 [ACK] Seq=844055 Ack=14986471 Win=65535 Len=0
1,3.8668670000000134,54.93.77.70,10.0.2.15,TLSv1.2,590,Application Data
1,3.882854000000009,54.93.77.70,10.0.2.15,TCP,2950,"9001  >  34692 [PSH, ACK] Seq=14944875 Ack=847721 Win=65535 Len=2896 [TCP segment of a reassembled PDU]"
1,3.883145000000013,10.0.2.15,54.93.77.70,TCP,54,34692  >  9001 [ACK] Seq=847721 Ack=14947771 Win=65535 Len=0
1,3.8906299999999874,54.93.77.70,10.0.2.15,TLSv1.2,4398,Application Data [TCP segment of a reassembled PDU]
1,3.8907560000000103,10.0.2.15,54.93.77.70,TCP,54,34692  >  9001 [ACK] Seq=847721 Ack=14952115 Win=65535 Len=0
1,3.898303999999996,54.93.77.70,10.0.2.15,TLSv1.2,4398,"Application Data, Application Data"
1,3.8983650000000125,10.0.2.15,54.93.77.70,TCP,54,34692  >  9001 [ACK] Seq=847721 Ack=14956459 Win=65535 Len=0
1,3.902684000000022,54.93.77.70,10.0.2.15,TLSv1.2,2972,"Application Data, Application Data"
1,3.902733000000012,10.0.2.15,54.93.77.70,TCP,54,34692  >  9001 [ACK] Seq=847721 Ack=14959377 Win=65535 Len=0
1,3.9076900000000023,54.93.77.70,10.0.2.15,TCP,2950,"9001  >  34692 [PSH, ACK] Seq=14959377 Ack=847721 Win=65535 Len=2896 [TCP segment of a reassembled PDU]"
1,3.9077330000000075,10.0.2.15,54.93.77.70,TCP,54,34692  >  9001 [ACK] Seq=847721 Ack=14962273 Win=65535 Len=0
1,3.9331379999999854,54.93.77.70,10.0.2.15,TLSv1.2,2950,"Application Data, Application Data"
1,3.9331710000000157,54.93.77.70,10.0.2.15,TLSv1.2,6708,"Application Data, Application Data, Application Data"
1,3.933176000000003,54.93.77.70,10.0.2.15,TCP,2950,"9001  >  34692 [PSH, ACK] Seq=14971823 Ack=847721 Win=65535 Len=2896 [TCP segment of a reassembled PDU]"
1,3.9332239999999956,10.0.2.15,54.93.77.70,TCP,54,34692  >  9001 [ACK] Seq=847721 Ack=14965169 Win=65535 Len=0
1,3.9333290000000147,10.0.2.15,54.93.77.70,TCP,54,34692  >  9001 [ACK] Seq=847721 Ack=14974719 Win=65535 Len=0
1,3.933618000000024,10.0.2.15,54.93.77.70,TLSv1.2,590,Application Data
1,3.933674999999994,54.93.77.70,10.0.2.15,TCP,60,9001  >  34692 [ACK] Seq=14974719 Ack=848257 Win=65535 Len=0
1,3.9345579999999813,54.93.77.70,10.0.2.15,TLSv1.2,2950,"Application Data, Application Data"
1,3.9346009999999865,10.0.2.15,54.93.77.70,TCP,54,34692  >  9001 [ACK] Seq=848257 Ack=14977615 Win=65535 Len=0
1,3.9348059999999805,54.93.77.70,10.0.2.15,TCP,1502,"9001  >  34692 [PSH, ACK] Seq=14977615 Ack=848257 Win=65535 Len=1448 [TCP segment of a reassembled PDU]"
1,3.9348439999999982,10.0.2.15,54.93.77.70,TCP,54,34692  >  9001 [ACK] Seq=848257 Ack=14979063 Win=65535 Len=0
1,3.9497519999999895,54.93.77.70,10.0.2.15,TLSv1.2,590,Application Data
1,3.993641000000025,10.0.2.15,54.93.77.70,TCP,54,34692  >  9001 [ACK] Seq=848257 Ack=14979599 Win=65535 Len=0
1,4.365605000000016,62.210.85.178,10.0.2.15,TLSv1.2,590,Application Data
1,4.369344000000012,54.93.77.70,10.0.2.15,TLSv1.2,6570,Application Data
1,4.369372999999996,54.93.77.70,10.0.2.15,TLSv1.2,3370,"Application Data, Application Data"
1,4.369376999999986,54.93.77.70,10.0.2.15,TLSv1.2,2132,Application Data
1,4.369427999999971,10.0.2.15,54.93.77.70,TCP,54,34692  >  9001 [ACK] Seq=848257 Ack=14986115 Win=65535 Len=0
1,4.369470999999976,10.0.2.15,54.93.77.70,TCP,54,34692  >  9001 [ACK] Seq=848257 Ack=14989431 Win=65535 Len=0
1,4.369488999999987,10.0.2.15,54.93.77.70,TCP,54,34692  >  9001 [ACK] Seq=848257 Ack=14991509 Win=65535 Len=0
1,4.371876999999984,10.0.2.15,54.93.77.70,TLSv1.2,590,Application Data
1,4.3720369999999775,54.93.77.70,10.0.2.15,TCP,60,9001  >  34692 [ACK] Seq=14991509 Ack=848793 Win=65535 Len=0
1,4.409663000000023,10.0.2.15,62.210.85.178,TCP,54,35978  >  9001 [ACK] Seq=14986471 Ack=844591 Win=65535 Len=0
1,4.571019999999976,62.210.85.178,10.0.2.15,TLSv1.2,590,Application Data
1,4.571107999999981,10.0.2.15,62.210.85.178,TCP,54,35978  >  9001 [ACK] Seq=14986471 Ack=845127 Win=65535 Len=0
1,4.57144999999997,10.0.2.15,62.210.85.178,TLSv1.2,590,Application Data
1,4.5715849999999705,62.210.85.178,10.0.2.15,TCP,60,9001  >  35978 [ACK] Seq=845127 Ack=14987007 Win=65535 Len=0
1,4.688102000000015,54.93.77.70,10.0.2.15,TLSv1.2,590,Application Data
1,4.688613999999973,10.0.2.15,54.93.77.70,TLSv1.2,590,Application Data
1,4.688787999999988,54.93.77.70,10.0.2.15,TCP,60,9001  >  34692 [ACK] Seq=14992045 Ack=849329 Win=65535 Len=0
1,4.9802629999999795,62.210.85.178,10.0.2.15,TLSv1.2,590,Application Data
1,4.989100000000008,10.0.2.15,62.210.85.178,TLSv1.2,590,Application Data
1,4.989293999999973,62.210.85.178,10.0.2.15,TCP,60,9001  >  35978 [ACK] Seq=845663 Ack=14987543 Win=65535 Len=0
1,5.002130000000022,10.0.2.15,62.210.85.178,TLSv1.2,4124,Application Data
1,5.002251999999999,10.0.2.15,62.210.85.178,TCP,2974,35978  >  9001 [ACK] Seq=14991613 Ack=845663 Win=65535 Len=2920 [TCP segment of a reassembled PDU]
1,5.002305999999976,62.210.85.178,10.0.2.15,TCP,60,9001  >  35978 [ACK] Seq=845663 Ack=14989003 Win=65535 Len=0
1,5.0023180000000025,62.210.85.178,10.0.2.15,TCP,60,9001  >  35978 [ACK] Seq=845663 Ack=14990463 Win=65535 Len=0
1,5.00232299999999,62.210.85.178,10.0.2.15,TCP,60,9001  >  35978 [ACK] Seq=845663 Ack=14991613 Win=65535 Len=0
1,5.002327999999977,62.210.85.178,10.0.2.15,TCP,60,9001  >  35978 [ACK] Seq=845663 Ack=14993073 Win=65535 Len=0
1,5.002332000000024,62.210.85.178,10.0.2.15,TCP,60,9001  >  35978 [ACK] Seq=845663 Ack=14994533 Win=65535 Len=0
1,5.002376000000027,10.0.2.15,62.210.85.178,TLSv1.2,1204,Application Data
1,5.002447000000018,10.0.2.15,62.210.85.178,TCP,2974,35978  >  9001 [ACK] Seq=14995683 Ack=845663 Win=65535 Len=2920 [TCP segment of a reassembled PDU]
1,5.002483999999981,62.210.85.178,10.0.2.15,TCP,60,9001  >  35978 [ACK] Seq=845663 Ack=14995683 Win=65535 Len=0
1,5.0024910000000204,62.210.85.178,10.0.2.15,TCP,60,9001  >  35978 [ACK] Seq=845663 Ack=14997143 Win=65535 Len=0
1,5.00249500000001,62.210.85.178,10.0.2.15,TCP,60,9001  >  35978 [ACK] Seq=845663 Ack=14998603 Win=65535 Len=0
1,5.002529999999979,10.0.2.15,62.210.85.178,TLSv1.2,1204,Application Data
1,5.002604000000019,62.210.85.178,10.0.2.15,TCP,60,9001  >  35978 [ACK] Seq=845663 Ack=14999753 Win=65535 Len=0
1,5.002635999999995,10.0.2.15,62.210.85.178,TCP,2974,35978  >  9001 [ACK] Seq=14999753 Ack=845663 Win=65535 Len=2920 [TCP segment of a reassembled PDU]
1,5.002673000000016,62.210.85.178,10.0.2.15,TCP,60,9001  >  35978 [ACK] Seq=845663 Ack=15001213 Win=65535 Len=0
1,5.002679999999998,62.210.85.178,10.0.2.15,TCP,60,9001  >  35978 [ACK] Seq=845663 Ack=15002673 Win=65535 Len=0
1,5.002710999999977,10.0.2.15,62.210.85.178,TLSv1.2,1204,Application Data
1,5.002769999999998,62.210.85.178,10.0.2.15,TCP,60,9001  >  35978 [ACK] Seq=845663 Ack=15003823 Win=65535 Len=0
1,5.002815999999996,10.0.2.15,62.210.85.178,TLSv1.2,332,Application Data
1,5.0028540000000135,62.210.85.178,10.0.2.15,TCP,60,9001  >  35978 [ACK] Seq=845663 Ack=15004101 Win=65535 Len=0
1,5.002913999999976,10.0.2.15,62.210.85.178,TLSv1.2,3868,Application Data
1,5.002976999999987,62.210.85.178,10.0.2.15,TCP,60,9001  >  35978 [ACK] Seq=845663 Ack=15005561 Win=65535 Len=0
1,5.002984000000026,62.210.85.178,10.0.2.15,TCP,60,9001  >  35978 [ACK] Seq=845663 Ack=15007021 Win=65535 Len=0
1,5.002989000000014,62.210.85.178,10.0.2.15,TCP,60,9001  >  35978 [ACK] Seq=845663 Ack=15007915 Win=65535 Len=0
1,5.003033000000016,10.0.2.15,62.210.85.178,TLSv1.2,4124,Application Data
1,5.0030929999999785,10.0.2.15,62.210.85.178,TCP,2974,35978  >  9001 [ACK] Seq=15011985 Ack=845663 Win=65535 Len=2920 [TCP segment of a reassembled PDU]
1,5.003131999999994,62.210.85.178,10.0.2.15,TCP,60,9001  >  35978 [ACK] Seq=845663 Ack=15009375 Win=65535 Len=0
1,5.003138999999976,62.210.85.178,10.0.2.15,TCP,60,9001  >  35978 [ACK] Seq=845663 Ack=15010835 Win=65535 Len=0
1,5.00314400000002,62.210.85.178,10.0.2.15,TCP,60,9001  >  35978 [ACK] Seq=845663 Ack=15011985 Win=65535 Len=0
1,5.00314800000001,62.210.85.178,10.0.2.15,TCP,60,9001  >  35978 [ACK] Seq=845663 Ack=15013445 Win=65535 Len=0
1,5.003152,62.210.85.178,10.0.2.15,TCP,60,9001  >  35978 [ACK] Seq=845663 Ack=15014905 Win=65535 Len=0
1,5.003190000000018,10.0.2.15,62.210.85.178,TLSv1.2,110,Application Data
1,5.003226999999981,62.210.85.178,10.0.2.15,TCP,60,9001  >  35978 [ACK] Seq=845663 Ack=15014961 Win=65535 Len=0
1,5.012365999999986,10.0.2.15,62.210.85.178,TLSv1.2,4124,Application Data
1,5.012447000000009,10.0.2.15,62.210.85.178,TCP,2974,35978  >  9001 [ACK] Seq=15019031 Ack=845663 Win=65535 Len=2920 [TCP segment of a reassembled PDU]
1,5.012483999999972,62.210.85.178,10.0.2.15,TCP,60,9001  >  35978 [ACK] Seq=845663 Ack=15016421 Win=65535 Len=0
1,5.012492000000009,62.210.85.178,10.0.2.15,TCP,60,9001  >  35978 [ACK] Seq=845663 Ack=15017881 Win=65535 Len=0
1,5.012495999999999,62.210.85.178,10.0.2.15,TCP,60,9001  >  35978 [ACK] Seq=845663 Ack=15019031 Win=65535 Len=0
1,5.012500999999986,62.210.85.178,10.0.2.15,TCP,60,9001  >  35978 [ACK] Seq=845663 Ack=15020491 Win=65535 Len=0
1,5.012504999999976,62.210.85.178,10.0.2.15,TCP,60,9001  >  35978 [ACK] Seq=845663 Ack=15021951 Win=65535 Len=0
1,5.012543999999991,10.0.2.15,62.210.85.178,TLSv1.2,1204,Application Data
1,5.012610999999993,10.0.2.15,62.210.85.178,TCP,2974,35978  >  9001 [ACK] Seq=15023101 Ack=845663 Win=65535 Len=2920 [TCP segment of a reassembled PDU]
1,5.012650000000008,62.210.85.178,10.0.2.15,TCP,60,9001  >  35978 [ACK] Seq=845663 Ack=15023101 Win=65535 Len=0
1,5.01265699999999,62.210.85.178,10.0.2.15,TCP,60,9001  >  35978 [ACK] Seq=845663 Ack=15024561 Win=65535 Len=0
1,5.01266099999998,62.210.85.178,10.0.2.15,TCP,60,9001  >  35978 [ACK] Seq=845663 Ack=15026021 Win=65535 Len=0
1,5.012695000000008,10.0.2.15,62.210.85.178,TLSv1.2,1204,Application Data
1,5.012759000000017,10.0.2.15,62.210.85.178,TCP,2974,35978  >  9001 [ACK] Seq=15027171 Ack=845663 Win=65535 Len=2920 [TCP segment of a reassembled PDU]
1,5.012797999999975,62.210.85.178,10.0.2.15,TCP,60,9001  >  35978 [ACK] Seq=845663 Ack=15027171 Win=65535 Len=0
1,5.012804000000017,62.210.85.178,10.0.2.15,TCP,60,9001  >  35978 [ACK] Seq=845663 Ack=15028631 Win=65535 Len=0
1,5.012809000000004,62.210.85.178,10.0.2.15,TCP,60,9001  >  35978 [ACK] Seq=845663 Ack=15030091 Win=65535 Len=0
1,5.012839999999983,10.0.2.15,62.210.85.178,TLSv1.2,1204,Application Data
1,5.012926999999991,62.210.85.178,10.0.2.15,TCP,60,9001  >  35978 [ACK] Seq=845663 Ack=15031241 Win=65535 Len=0
1,5.012961000000018,10.0.2.15,62.210.85.178,TLSv1.2,2974,Application Data
1,5.012998999999979,62.210.85.178,10.0.2.15,TCP,60,9001  >  35978 [ACK] Seq=845663 Ack=15032701 Win=65535 Len=0
1,5.0130060000000185,62.210.85.178,10.0.2.15,TCP,60,9001  >  35978 [ACK] Seq=845663 Ack=15034161 Win=65535 Len=0
1,5.013036999999997,10.0.2.15,62.210.85.178,TLSv1.2,1226,Application Data
1,5.013074000000017,62.210.85.178,10.0.2.15,TCP,60,9001  >  35978 [ACK] Seq=845663 Ack=15035333 Win=65535 Len=0
1,5.01311800000002,10.0.2.15,62.210.85.178,TLSv1.2,4124,Application Data
1,5.013157999999976,62.210.85.178,10.0.2.15,TCP,60,9001  >  35978 [ACK] Seq=845663 Ack=15036793 Win=65535 Len=0
1,5.013165000000015,62.210.85.178,10.0.2.15,TCP,60,9001  >  35978 [ACK] Seq=845663 Ack=15038253 Win=65535 Len=0
1,5.013170000000002,62.210.85.178,10.0.2.15,TCP,60,9001  >  35978 [ACK] Seq=845663 Ack=15039403 Win=65535 Len=0
1,5.013215000000002,10.0.2.15,62.210.85.178,TLSv1.2,3030,Application Data
1,5.01325700000001,62.210.85.178,10.0.2.15,TCP,60,9001  >  35978 [ACK] Seq=845663 Ack=15040863 Win=65535 Len=0
1,5.013263999999992,62.210.85.178,10.0.2.15,TCP,60,9001  >  35978 [ACK] Seq=845663 Ack=15042323 Win=65535 Len=0
1,5.013267999999982,62.210.85.178,10.0.2.15,TCP,60,9001  >  35978 [ACK] Seq=845663 Ack=15042379 Win=65535 Len=0
1,5.025687000000005,10.0.2.15,62.210.85.178,TLSv1.2,4124,Application Data
1,5.025773000000015,10.0.2.15,62.210.85.178,TCP,2974,35978  >  9001 [ACK] Seq=15046449 Ack=845663 Win=65535 Len=2920 [TCP segment of a reassembled PDU]
1,5.025812999999971,62.210.85.178,10.0.2.15,TCP,60,9001  >  35978 [ACK] Seq=845663 Ack=15043839 Win=65535 Len=0
1,5.025822000000005,62.210.85.178,10.0.2.15,TCP,60,9001  >  35978 [ACK] Seq=845663 Ack=15045299 Win=65535 Len=0
1,5.0258269999999925,62.210.85.178,10.0.2.15,TCP,60,9001  >  35978 [ACK] Seq=845663 Ack=15046449 Win=65535 Len=0
1,5.025830999999982,62.210.85.178,10.0.2.15,TCP,60,9001  >  35978 [ACK] Seq=845663 Ack=15047909 Win=65535 Len=0
1,5.025834999999972,62.210.85.178,10.0.2.15,TCP,60,9001  >  35978 [ACK] Seq=845663 Ack=15049369 Win=65535 Len=0
1,5.025874999999985,10.0.2.15,62.210.85.178,TLSv1.2,1204,Application Data
1,5.02596699999998,62.210.85.178,10.0.2.15,TCP,60,9001  >  35978 [ACK] Seq=845663 Ack=15050519 Win=65535 Len=0
1,5.026010999999983,10.0.2.15,62.210.85.178,TLSv1.2,718,Application Data
1,5.026114000000007,62.210.85.178,10.0.2.15,TCP,60,9001  >  35978 [ACK] Seq=845663 Ack=15051183 Win=65535 Len=0
1,5.186022999999977,54.93.77.70,10.0.2.15,TLSv1.2,3674,Application Data
1,5.186184000000026,10.0.2.15,54.93.77.70,TCP,54,34692  >  9001 [ACK] Seq=849329 Ack=14995665 Win=65535 Len=0
1,5.197550999999976,54.93.77.70,10.0.2.15,TLSv1.2,4398,Application Data
1,5.197673000000009,10.0.2.15,54.93.77.70,TCP,54,34692  >  9001 [ACK] Seq=849329 Ack=15000009 Win=65535 Len=0
1,5.197881999999993,10.0.2.15,54.93.77.70,TLSv1.2,590,Application Data
1,5.1980290000000196,54.93.77.70,10.0.2.15,TCP,60,9001  >  34692 [ACK] Seq=15000009 Ack=849865 Win=65535 Len=0
1,5.198040999999989,54.93.77.70,10.0.2.15,TCP,2950,"9001  >  34692 [PSH, ACK] Seq=15000009 Ack=849865 Win=65535 Len=2896 [TCP segment of a reassembled PDU]"
1,5.198077000000012,10.0.2.15,54.93.77.70,TCP,54,34692  >  9001 [ACK] Seq=849865 Ack=15002905 Win=65535 Len=0
1,5.207337999999993,54.93.77.70,10.0.2.15,TLSv1.2,568,Application Data
1,5.2147919999999885,54.93.77.70,10.0.2.15,TLSv1.2,1502,Application Data
1,5.214878999999996,10.0.2.15,54.93.77.70,TCP,54,34692  >  9001 [ACK] Seq=849865 Ack=15004867 Win=65535 Len=0
1,5.226282000000026,54.93.77.70,10.0.2.15,TLSv1.2,5846,"Application Data, Application Data"
1,5.22644200000002,10.0.2.15,54.93.77.70,TCP,54,34692  >  9001 [ACK] Seq=849865 Ack=15010659 Win=65535 Len=0
1,5.226787999999999,54.93.77.70,10.0.2.15,TCP,2950,"9001  >  34692 [PSH, ACK] Seq=15010659 Ack=849865 Win=65535 Len=2896 [TCP segment of a reassembled PDU]"
1,5.226835999999992,10.0.2.15,54.93.77.70,TCP,54,34692  >  9001 [ACK] Seq=849865 Ack=15013555 Win=65535 Len=0
1,5.2342029999999795,54.93.77.70,10.0.2.15,TLSv1.2,286,Application Data
1,5.235813000000007,54.93.77.70,10.0.2.15,TCP,2950,"9001  >  34692 [PSH, ACK] Seq=15013787 Ack=849865 Win=65535 Len=2896 [TCP segment of a reassembled PDU]"
1,5.235875000000021,10.0.2.15,54.93.77.70,TCP,54,34692  >  9001 [ACK] Seq=849865 Ack=15016683 Win=65535 Len=0
1,5.248100000000022,54.93.77.70,10.0.2.15,TLSv1.2,5846,"Application Data, Application Data, Application Data"
1,5.248198000000002,10.0.2.15,54.93.77.70,TCP,54,34692  >  9001 [ACK] Seq=849865 Ack=15022475 Win=65535 Len=0
1,5.248404999999991,10.0.2.15,54.93.77.70,TLSv1.2,590,Application Data
1,5.248482000000024,54.93.77.70,10.0.2.15,TCP,60,9001  >  34692 [ACK] Seq=15022475 Ack=850401 Win=65535 Len=0
1,5.254235999999992,54.93.77.70,10.0.2.15,TLSv1.2,1220,Application Data
1,5.257200000000012,54.93.77.70,10.0.2.15,TLSv1.2,5846,Application Data
1,5.257218000000023,54.93.77.70,10.0.2.15,TLSv1.2,2950,Application Data [TCP segment of a reassembled PDU]
1,5.257258999999976,10.0.2.15,54.93.77.70,TCP,54,34692  >  9001 [ACK] Seq=850401 Ack=15029433 Win=65535 Len=0
1,5.257347999999979,10.0.2.15,54.93.77.70,TCP,54,34692  >  9001 [ACK] Seq=850401 Ack=15032329 Win=65535 Len=0
1,5.258398,54.93.77.70,10.0.2.15,TCP,1502,"9001  >  34692 [PSH, ACK] Seq=15032329 Ack=850401 Win=65535 Len=1448 [TCP segment of a reassembled PDU]"
1,5.258441000000005,10.0.2.15,54.93.77.70,TCP,54,34692  >  9001 [ACK] Seq=850401 Ack=15033777 Win=65535 Len=0
1,5.2775740000000155,54.93.77.70,10.0.2.15,TLSv1.2,264,Application Data
1,5.277606999999989,54.93.77.70,10.0.2.15,TLSv1.2,4398,Application Data
1,5.27773000000002,54.93.77.70,10.0.2.15,TLSv1.2,5734,Application Data [TCP segment of a reassembled PDU]
1,5.277798000000018,10.0.2.15,54.93.77.70,TCP,54,34692  >  9001 [ACK] Seq=850401 Ack=15044011 Win=65535 Len=0
1,5.277838999999972,54.93.77.70,10.0.2.15,TCP,166,"9001  >  34692 [PSH, ACK] Seq=15044011 Ack=850401 Win=65535 Len=112 [TCP segment of a reassembled PDU]"
1,5.298696000000007,54.93.77.70,10.0.2.15,TLSv1.2,5846,"Application Data, Application Data"
1,5.298765000000003,54.93.77.70,10.0.2.15,TCP,2950,"9001  >  34692 [PSH, ACK] Seq=15049915 Ack=850401 Win=65535 Len=2896 [TCP segment of a reassembled PDU]"
1,5.298833000000002,10.0.2.15,54.93.77.70,TCP,54,34692  >  9001 [ACK] Seq=850401 Ack=15049915 Win=65535 Len=0
1,5.298940000000016,10.0.2.15,54.93.77.70,TCP,54,34692  >  9001 [ACK] Seq=850401 Ack=15052811 Win=65535 Len=0
1,5.299119000000019,10.0.2.15,54.93.77.70,TLSv1.2,590,Application Data
1,5.29919000000001,54.93.77.70,10.0.2.15,TCP,60,9001  >  34692 [ACK] Seq=15052811 Ack=850937 Win=65535 Len=0
1,5.304117000000019,54.93.77.70,10.0.2.15,TLSv1.2,358,Application Data
1,5.309898999999973,10.0.2.15,54.93.77.70,TLSv1.2,590,Application Data
1,5.3099920000000225,54.93.77.70,10.0.2.15,TCP,60,9001  >  34692 [ACK] Seq=15053115 Ack=851473 Win=65535 Len=0
1,5.333512999999982,54.93.77.70,10.0.2.15,TLSv1.2,590,Application Data
1,5.356964000000005,62.210.85.178,10.0.2.15,TLSv1.2,1104,Application Data
1,5.369922999999972,54.93.77.70,10.0.2.15,TCP,1502,"9001  >  34692 [PSH, ACK] Seq=15053651 Ack=851473 Win=65535 Len=1448 [TCP segment of a reassembled PDU]"
1,5.369972000000018,10.0.2.15,54.93.77.70,TCP,54,34692  >  9001 [ACK] Seq=851473 Ack=15055099 Win=65535 Len=0
1,5.394268000000011,54.93.77.70,10.0.2.15,TLSv1.2,684,Application Data
1,5.395512999999994,10.0.2.15,54.93.77.70,TLSv1.2,590,Application Data
1,5.39562699999999,54.93.77.70,10.0.2.15,TCP,60,9001  >  34692 [ACK] Seq=15055729 Ack=852009 Win=65535 Len=0
1,5.397572000000025,10.0.2.15,62.210.85.178,TCP,54,35978  >  9001 [ACK] Seq=15051183 Ack=846713 Win=65535 Len=0
1,5.405415000000005,10.0.2.15,54.93.77.70,TLSv1.2,590,Application Data
1,5.4055700000000115,54.93.77.70,10.0.2.15,TCP,60,9001  >  34692 [ACK] Seq=15055729 Ack=852545 Win=65535 Len=0
1,5.420807000000025,54.93.77.70,10.0.2.15,TLSv1.2,590,Application Data
1,5.461601999999971,10.0.2.15,54.93.77.70,TCP,54,34692  >  9001 [ACK] Seq=852545 Ack=15056265 Win=65535 Len=0
1,5.466392999999982,62.210.85.178,10.0.2.15,TLSv1.2,590,Application Data
1,5.466453999999999,10.0.2.15,62.210.85.178,TCP,54,35978  >  9001 [ACK] Seq=15051183 Ack=847249 Win=65535 Len=0
1,5.510772999999972,62.210.85.178,10.0.2.15,TLSv1.2,590,Application Data
1,5.510862999999972,10.0.2.15,62.210.85.178,TCP,54,35978  >  9001 [ACK] Seq=15051183 Ack=847785 Win=65535 Len=0
1,5.902753000000018,62.210.85.178,10.0.2.15,TLSv1.2,1104,Application Data
1,5.902842000000021,10.0.2.15,62.210.85.178,TCP,54,35978  >  9001 [ACK] Seq=15051183 Ack=848835 Win=65535 Len=0
1,5.903149999999982,10.0.2.15,62.210.85.178,TLSv1.2,590,Application Data
1,5.903257999999994,62.210.85.178,10.0.2.15,TCP,60,9001  >  35978 [ACK] Seq=848835 Ack=15051719 Win=65535 Len=0
1,6.014021000000014,54.93.77.70,10.0.2.15,TLSv1.2,590,Application Data
1,6.014109000000019,10.0.2.15,54.93.77.70,TCP,54,34692  >  9001 [ACK] Seq=852545 Ack=15056801 Win=65535 Len=0
1,6.0144599999999855,10.0.2.15,54.93.77.70,TLSv1.2,590,Application Data
1,6.014561000000015,54.93.77.70,10.0.2.15,TCP,60,9001  >  34692 [ACK] Seq=15056801 Ack=853081 Win=65535 Len=0
1,6.135762999999997,62.210.85.178,10.0.2.15,TLSv1.2,590,Application Data
1,6.139387999999997,10.0.2.15,62.210.85.178,TLSv1.2,590,Application Data
1,6.139551999999981,62.210.85.178,10.0.2.15,TCP,60,9001  >  35978 [ACK] Seq=849371 Ack=15052255 Win=65535 Len=0
1,6.154381000000001,10.0.2.15,62.210.85.178,TLSv1.2,4124,Application Data
1,6.154471999999998,10.0.2.15,62.210.85.178,TCP,2974,35978  >  9001 [ACK] Seq=15056325 Ack=849371 Win=65535 Len=2920 [TCP segment of a reassembled PDU]
1,6.154526999999973,62.210.85.178,10.0.2.15,TCP,60,9001  >  35978 [ACK] Seq=849371 Ack=15053715 Win=65535 Len=0
1,6.154539999999997,62.210.85.178,10.0.2.15,TCP,60,9001  >  35978 [ACK] Seq=849371 Ack=15055175 Win=65535 Len=0
1,6.154544999999985,62.210.85.178,10.0.2.15,TCP,60,9001  >  35978 [ACK] Seq=849371 Ack=15056325 Win=65535 Len=0
1,6.154547999999977,62.210.85.178,10.0.2.15,TCP,60,9001  >  35978 [ACK] Seq=849371 Ack=15057785 Win=65535 Len=0
1,6.154551000000026,62.210.85.178,10.0.2.15,TCP,60,9001  >  35978 [ACK] Seq=849371 Ack=15059245 Win=65535 Len=0
1,6.154585999999995,10.0.2.15,62.210.85.178,TLSv1.2,1204,Application Data
1,6.154620000000023,62.210.85.178,10.0.2.15,TCP,60,9001  >  35978 [ACK] Seq=849371 Ack=15060395 Win=65535 Len=0
1,6.154665000000023,10.0.2.15,62.210.85.178,TLSv1.2,4124,Application Data
1,6.154699999999991,62.210.85.178,10.0.2.15,TCP,60,9001  >  35978 [ACK] Seq=849371 Ack=15061855 Win=65535 Len=0
1,6.154707999999971,62.210.85.178,10.0.2.15,TCP,60,9001  >  35978 [ACK] Seq=849371 Ack=15063315 Win=65535 Len=0
1,6.15471100000002,62.210.85.178,10.0.2.15,TCP,60,9001  >  35978 [ACK] Seq=849371 Ack=15064465 Win=65535 Len=0
1,6.154748999999981,10.0.2.15,62.210.85.178,TLSv1.2,4124,Application Data
1,6.154783000000009,62.210.85.178,10.0.2.15,TCP,60,9001  >  35978 [ACK] Seq=849371 Ack=15065925 Win=65535 Len=0
1,6.154789999999991,62.210.85.178,10.0.2.15,TCP,60,9001  >  35978 [ACK] Seq=849371 Ack=15067385 Win=65535 Len=0
1,6.154842999999971,10.0.2.15,62.210.85.178,TLSv1.2,2974,Application Data
1,6.154878999999994,62.210.85.178,10.0.2.15,TCP,60,9001  >  35978 [ACK] Seq=849371 Ack=15068535 Win=65535 Len=0
