No.,Time,Source,Destination,Protocol,Length,Info
1,0.008393000000012307,10.0.2.15,62.210.85.178,TCP,54,35978  >  9001 [ACK] Seq=11825409 Ack=678451 Win=65535 Len=0
1,0.1416189999999915,10.0.2.15,54.93.77.70,TLSv1.2,590,Application Data
1,0.14180599999997412,54.93.77.70,10.0.2.15,TCP,60,9001  >  34692 [ACK] Seq=11828159 Ack=682089 Win=65535 Len=0
1,0.8921159999999873,62.210.85.178,10.0.2.15,TLSv1.2,1104,Application Data
1,0.8922319999999786,10.0.2.15,62.210.85.178,TCP,54,35978  >  9001 [ACK] Seq=11825409 Ack=679501 Win=65535 Len=0
1,0.892628000000002,10.0.2.15,62.210.85.178,TLSv1.2,590,Application Data
1,0.8927129999999579,62.210.85.178,10.0.2.15,TCP,60,9001  >  35978 [ACK] Seq=679501 Ack=11825945 Win=65535 Len=0
1,1.0891509999999585,54.93.77.70,10.0.2.15,TLSv1.2,590,Application Data
1,1.0903509999999983,10.0.2.15,54.93.77.70,TLSv1.2,1618,Application Data
1,1.0908109999999738,54.93.77.70,10.0.2.15,TCP,60,9001  >  34692 [ACK] Seq=11828695 Ack=683653 Win=65535 Len=0
1,1.5039620000000014,62.210.85.178,10.0.2.15,TLSv1.2,1618,Application Data
1,1.5041099999999687,10.0.2.15,62.210.85.178,TCP,54,35978  >  9001 [ACK] Seq=11825945 Ack=681065 Win=65535 Len=0
1,1.5237060000000042,10.0.2.15,62.210.85.178,TLSv1.2,590,Application Data
1,1.5238809999999603,62.210.85.178,10.0.2.15,TCP,60,9001  >  35978 [ACK] Seq=681065 Ack=11826481 Win=65535 Len=0
1,1.5385229999999979,10.0.2.15,62.210.85.178,TLSv1.2,1618,Application Data
1,1.5386659999999779,62.210.85.178,10.0.2.15,TCP,60,9001  >  35978 [ACK] Seq=681065 Ack=11827941 Win=65535 Len=0
1,1.5386839999999893,62.210.85.178,10.0.2.15,TCP,60,9001  >  35978 [ACK] Seq=681065 Ack=11828045 Win=65535 Len=0
1,1.7059319999999616,54.93.77.70,10.0.2.15,TLSv1.2,2132,Application Data
1,1.7060730000000035,10.0.2.15,54.93.77.70,TCP,54,34692  >  9001 [ACK] Seq=683653 Ack=11830773 Win=65535 Len=0
1,1.7080569999999966,10.0.2.15,54.93.77.70,TLSv1.2,590,Application Data
1,1.708235000000002,54.93.77.70,10.0.2.15,TCP,60,9001  >  34692 [ACK] Seq=11830773 Ack=684189 Win=65535 Len=0
1,1.8121810000000096,62.210.85.178,10.0.2.15,TLSv1.2,590,Application Data
1,1.8125400000000127,10.0.2.15,62.210.85.178,TLSv1.2,590,Application Data
1,1.8126719999999636,62.210.85.178,10.0.2.15,TCP,60,9001  >  35978 [ACK] Seq=681601 Ack=11828581 Win=65535 Len=0
1,1.922824999999989,54.93.77.70,10.0.2.15,TLSv1.2,590,Application Data
1,1.9232020000000034,10.0.2.15,54.93.77.70,TLSv1.2,590,Application Data
1,1.92331200000001,54.93.77.70,10.0.2.15,TCP,60,9001  >  34692 [ACK] Seq=11831309 Ack=684725 Win=65535 Len=0
1,2.1206019999999626,62.210.85.178,10.0.2.15,TLSv1.2,590,Application Data
1,2.127607000000012,10.0.2.15,62.210.85.178,TLSv1.2,590,Application Data
1,2.1278069999999616,62.210.85.178,10.0.2.15,TCP,60,9001  >  35978 [ACK] Seq=682137 Ack=11829117 Win=65535 Len=0
1,2.142104999999958,10.0.2.15,62.210.85.178,TLSv1.2,4124,Application Data
1,2.142228999999986,10.0.2.15,62.210.85.178,TCP,2974,35978  >  9001 [ACK] Seq=11833187 Ack=682137 Win=65535 Len=2920 [TCP segment of a reassembled PDU]
1,2.1422880000000077,62.210.85.178,10.0.2.15,TCP,60,9001  >  35978 [ACK] Seq=682137 Ack=11830577 Win=65535 Len=0
1,2.1423019999999724,62.210.85.178,10.0.2.15,TCP,60,9001  >  35978 [ACK] Seq=682137 Ack=11832037 Win=65535 Len=0
1,2.1423069999999598,62.210.85.178,10.0.2.15,TCP,60,9001  >  35978 [ACK] Seq=682137 Ack=11833187 Win=65535 Len=0
1,2.1423110000000065,62.210.85.178,10.0.2.15,TCP,60,9001  >  35978 [ACK] Seq=682137 Ack=11834647 Win=65535 Len=0
1,2.142313999999999,62.210.85.178,10.0.2.15,TCP,60,9001  >  35978 [ACK] Seq=682137 Ack=11836107 Win=65535 Len=0
1,2.14235199999996,10.0.2.15,62.210.85.178,TLSv1.2,1204,Application Data
1,2.1423899999999776,62.210.85.178,10.0.2.15,TCP,60,9001  >  35978 [ACK] Seq=682137 Ack=11837257 Win=65535 Len=0
1,2.14243799999997,10.0.2.15,62.210.85.178,TLSv1.2,4124,Application Data
1,2.1424789999999803,62.210.85.178,10.0.2.15,TCP,60,9001  >  35978 [ACK] Seq=682137 Ack=11838717 Win=65535 Len=0
1,2.1424880000000144,62.210.85.178,10.0.2.15,TCP,60,9001  >  35978 [ACK] Seq=682137 Ack=11840177 Win=65535 Len=0
1,2.1424920000000043,62.210.85.178,10.0.2.15,TCP,60,9001  >  35978 [ACK] Seq=682137 Ack=11841327 Win=65535 Len=0
1,2.14253199999996,10.0.2.15,62.210.85.178,TLSv1.2,4124,Application Data
1,2.142569999999978,62.210.85.178,10.0.2.15,TCP,60,9001  >  35978 [ACK] Seq=682137 Ack=11842787 Win=65535 Len=0
1,2.1425779999999577,62.210.85.178,10.0.2.15,TCP,60,9001  >  35978 [ACK] Seq=682137 Ack=11844247 Win=65535 Len=0
1,2.1426419999999666,10.0.2.15,62.210.85.178,TLSv1.2,2974,Application Data
1,2.142682999999977,62.210.85.178,10.0.2.15,TCP,60,9001  >  35978 [ACK] Seq=682137 Ack=11845397 Win=65535 Len=0
1,2.142689999999959,62.210.85.178,10.0.2.15,TCP,60,9001  >  35978 [ACK] Seq=682137 Ack=11846857 Win=65535 Len=0
1,2.142694000000006,62.210.85.178,10.0.2.15,TCP,60,9001  >  35978 [ACK] Seq=682137 Ack=11848317 Win=65535 Len=0
1,2.142721999999992,10.0.2.15,62.210.85.178,TLSv1.2,1226,Application Data
1,2.1427569999999605,62.210.85.178,10.0.2.15,TCP,60,9001  >  35978 [ACK] Seq=682137 Ack=11849489 Win=65535 Len=0
1,2.1427979999999707,10.0.2.15,62.210.85.178,TLSv1.2,4124,Application Data
1,2.1428379999999834,62.210.85.178,10.0.2.15,TCP,60,9001  >  35978 [ACK] Seq=682137 Ack=11850949 Win=65535 Len=0
1,2.142847999999958,62.210.85.178,10.0.2.15,TCP,60,9001  >  35978 [ACK] Seq=682137 Ack=11852409 Win=65535 Len=0
1,2.1428510000000074,62.210.85.178,10.0.2.15,TCP,60,9001  >  35978 [ACK] Seq=682137 Ack=11853559 Win=65535 Len=0
1,2.1428889999999683,10.0.2.15,62.210.85.178,TLSv1.2,3030,Application Data
1,2.1429279999999835,62.210.85.178,10.0.2.15,TCP,60,9001  >  35978 [ACK] Seq=682137 Ack=11855019 Win=65535 Len=0
1,2.1429359999999633,62.210.85.178,10.0.2.15,TCP,60,9001  >  35978 [ACK] Seq=682137 Ack=11856479 Win=65535 Len=0
1,2.14294000000001,62.210.85.178,10.0.2.15,TCP,60,9001  >  35978 [ACK] Seq=682137 Ack=11856535 Win=65535 Len=0
1,2.152209999999968,10.0.2.15,62.210.85.178,TLSv1.2,4124,Application Data
1,2.1523029999999608,62.210.85.178,10.0.2.15,TCP,60,9001  >  35978 [ACK] Seq=682137 Ack=11857995 Win=65535 Len=0
1,2.15231399999999,62.210.85.178,10.0.2.15,TCP,60,9001  >  35978 [ACK] Seq=682137 Ack=11859455 Win=65535 Len=0
1,2.1523169999999823,62.210.85.178,10.0.2.15,TCP,60,9001  >  35978 [ACK] Seq=682137 Ack=11860605 Win=65535 Len=0
1,2.15236299999998,10.0.2.15,62.210.85.178,TLSv1.2,4124,Application Data
1,2.15240799999998,62.210.85.178,10.0.2.15,TCP,60,9001  >  35978 [ACK] Seq=682137 Ack=11862065 Win=65535 Len=0
1,2.1524159999999597,62.210.85.178,10.0.2.15,TCP,60,9001  >  35978 [ACK] Seq=682137 Ack=11863525 Win=65535 Len=0
1,2.152421000000004,62.210.85.178,10.0.2.15,TCP,60,9001  >  35978 [ACK] Seq=682137 Ack=11864675 Win=65535 Len=0
1,2.1524609999999598,10.0.2.15,62.210.85.178,TLSv1.2,4124,Application Data
1,2.15250199999997,62.210.85.178,10.0.2.15,TCP,60,9001  >  35978 [ACK] Seq=682137 Ack=11866135 Win=65535 Len=0
1,2.152511000000004,62.210.85.178,10.0.2.15,TCP,60,9001  >  35978 [ACK] Seq=682137 Ack=11867595 Win=65535 Len=0
1,2.152514999999994,62.210.85.178,10.0.2.15,TCP,60,9001  >  35978 [ACK] Seq=682137 Ack=11868745 Win=65535 Len=0
1,2.15255099999996,10.0.2.15,62.210.85.178,TLSv1.2,268,Application Data
1,2.15258799999998,62.210.85.178,10.0.2.15,TCP,60,9001  >  35978 [ACK] Seq=682137 Ack=11868959 Win=65535 Len=0
1,2.2547669999999584,54.93.77.70,10.0.2.15,TLSv1.2,3674,Application Data
1,2.2549080000000004,10.0.2.15,54.93.77.70,TCP,54,34692  >  9001 [ACK] Seq=684725 Ack=11834929 Win=65535 Len=0
1,2.264630000000011,54.93.77.70,10.0.2.15,TLSv1.2,7294,Application Data
1,2.2647309999999834,10.0.2.15,54.93.77.70,TCP,54,34692  >  9001 [ACK] Seq=684725 Ack=11842169 Win=65535 Len=0
1,2.271396999999979,54.93.77.70,10.0.2.15,TLSv1.2,568,Application Data
1,2.2886239999999702,54.93.77.70,10.0.2.15,TLSv1.2,4398,Application Data
1,2.2887189999999578,10.0.2.15,54.93.77.70,TCP,54,34692  >  9001 [ACK] Seq=684725 Ack=11847027 Win=65535 Len=0
1,2.2982999999999834,54.93.77.70,10.0.2.15,TLSv1.2,7294,"Application Data, Application Data"
1,2.298435999999981,10.0.2.15,54.93.77.70,TCP,54,34692  >  9001 [ACK] Seq=684725 Ack=11854267 Win=65535 Len=0
1,2.3106300000000033,54.93.77.70,10.0.2.15,TLSv1.2,5774,"Application Data, Application Data, Application Data"
1,2.3106879999999705,10.0.2.15,54.93.77.70,TCP,54,34692  >  9001 [ACK] Seq=684725 Ack=11859987 Win=65535 Len=0
1,2.311035000000004,10.0.2.15,54.93.77.70,TLSv1.2,590,Application Data
1,2.311154999999985,54.93.77.70,10.0.2.15,TCP,60,9001  >  34692 [ACK] Seq=11859987 Ack=685261 Win=65535 Len=0
1,2.3430819999999812,54.93.77.70,10.0.2.15,TLSv1.2,1408,Application Data
1,2.385706999999968,10.0.2.15,54.93.77.70,TCP,54,34692  >  9001 [ACK] Seq=685261 Ack=11861341 Win=65535 Len=0
1,2.730062999999973,62.210.85.178,10.0.2.15,TLSv1.2,590,Application Data
1,2.7336899999999673,54.93.77.70,10.0.2.15,TLSv1.2,6266,"Application Data, Application Data"
1,2.7337519999999813,10.0.2.15,54.93.77.70,TCP,54,34692  >  9001 [ACK] Seq=685261 Ack=11867553 Win=65535 Len=0
1,2.733930999999984,10.0.2.15,54.93.77.70,TLSv1.2,590,Application Data
1,2.7340079999999602,54.93.77.70,10.0.2.15,TCP,60,9001  >  34692 [ACK] Seq=11867553 Ack=685797 Win=65535 Len=0
1,2.7447500000000105,54.93.77.70,10.0.2.15,TLSv1.2,1104,Application Data
1,2.7737169999999765,10.0.2.15,62.210.85.178,TCP,54,35978  >  9001 [ACK] Seq=11868959 Ack=682673 Win=65535 Len=0
1,2.785685000000001,10.0.2.15,54.93.77.70,TCP,54,34692  >  9001 [ACK] Seq=685797 Ack=11868603 Win=65535 Len=0
1,3.3444599999999696,54.93.77.70,10.0.2.15,TLSv1.2,2132,Application Data
1,3.3445580000000064,10.0.2.15,54.93.77.70,TCP,54,34692  >  9001 [ACK] Seq=685797 Ack=11870681 Win=65535 Len=0
1,3.3479939999999715,62.210.85.178,10.0.2.15,TLSv1.2,590,Application Data
1,3.3480519999999956,10.0.2.15,62.210.85.178,TCP,54,35978  >  9001 [ACK] Seq=11868959 Ack=683209 Win=65535 Len=0
1,4.084434999999985,54.93.77.70,10.0.2.15,TLSv1.2,1104,Application Data
1,4.084519999999998,10.0.2.15,54.93.77.70,TCP,54,34692  >  9001 [ACK] Seq=685797 Ack=11871731 Win=65535 Len=0
1,4.087565999999981,10.0.2.15,54.93.77.70,TLSv1.2,590,Application Data
1,4.088007000000005,54.93.77.70,10.0.2.15,TCP,60,9001  >  34692 [ACK] Seq=11871731 Ack=686333 Win=65535 Len=0
1,4.3906109999999785,62.210.85.178,10.0.2.15,TLSv1.2,590,Application Data
1,4.390700999999979,10.0.2.15,62.210.85.178,TCP,54,35978  >  9001 [ACK] Seq=11868959 Ack=683745 Win=65535 Len=0
1,4.391042999999968,10.0.2.15,62.210.85.178,TLSv1.2,590,Application Data
1,4.391166999999996,62.210.85.178,10.0.2.15,TCP,60,9001  >  35978 [ACK] Seq=683745 Ack=11869495 Win=65535 Len=0
1,4.541471999999999,54.93.77.70,10.0.2.15,TLSv1.2,590,Application Data
1,4.541947999999991,10.0.2.15,54.93.77.70,TLSv1.2,590,Application Data
1,4.542076000000009,54.93.77.70,10.0.2.15,TCP,60,9001  >  34692 [ACK] Seq=11872267 Ack=686869 Win=65535 Len=0
1,4.698540999999977,62.210.85.178,10.0.2.15,TLSv1.2,590,Application Data
1,4.7078710000000115,10.0.2.15,62.210.85.178,TLSv1.2,590,Application Data
1,4.708065999999974,62.210.85.178,10.0.2.15,TCP,60,9001  >  35978 [ACK] Seq=684281 Ack=11870031 Win=65535 Len=0
1,4.7227249999999685,10.0.2.15,62.210.85.178,TLSv1.2,4124,Application Data
1,4.722858999999971,10.0.2.15,62.210.85.178,TCP,2974,35978  >  9001 [ACK] Seq=11874101 Ack=684281 Win=65535 Len=2920 [TCP segment of a reassembled PDU]
1,4.722905999999966,62.210.85.178,10.0.2.15,TCP,60,9001  >  35978 [ACK] Seq=684281 Ack=11871491 Win=65535 Len=0
1,4.722915999999998,62.210.85.178,10.0.2.15,TCP,60,9001  >  35978 [ACK] Seq=684281 Ack=11872951 Win=65535 Len=0
1,4.722920999999985,62.210.85.178,10.0.2.15,TCP,60,9001  >  35978 [ACK] Seq=684281 Ack=11874101 Win=65535 Len=0
1,4.722924999999975,62.210.85.178,10.0.2.15,TCP,60,9001  >  35978 [ACK] Seq=684281 Ack=11875561 Win=65535 Len=0
1,4.72293099999996,62.210.85.178,10.0.2.15,TCP,60,9001  >  35978 [ACK] Seq=684281 Ack=11877021 Win=65535 Len=0
1,4.72297599999996,10.0.2.15,62.210.85.178,TLSv1.2,1204,Application Data
1,4.723100999999986,62.210.85.178,10.0.2.15,TCP,60,9001  >  35978 [ACK] Seq=684281 Ack=11878171 Win=65535 Len=0
1,4.723194999999976,10.0.2.15,62.210.85.178,TLSv1.2,4124,Application Data
1,4.723243999999966,62.210.85.178,10.0.2.15,TCP,60,9001  >  35978 [ACK] Seq=684281 Ack=11879631 Win=65535 Len=0
1,4.723252000000002,62.210.85.178,10.0.2.15,TCP,60,9001  >  35978 [ACK] Seq=684281 Ack=11881091 Win=65535 Len=0
1,4.723255999999992,62.210.85.178,10.0.2.15,TCP,60,9001  >  35978 [ACK] Seq=684281 Ack=11882241 Win=65535 Len=0
1,4.723303999999985,10.0.2.15,62.210.85.178,TLSv1.2,4124,Application Data
1,4.723396999999977,62.210.85.178,10.0.2.15,TCP,60,9001  >  35978 [ACK] Seq=684281 Ack=11883701 Win=65535 Len=0
1,4.723406000000011,62.210.85.178,10.0.2.15,TCP,60,9001  >  35978 [ACK] Seq=684281 Ack=11885161 Win=65535 Len=0
1,4.723410000000001,62.210.85.178,10.0.2.15,TCP,60,9001  >  35978 [ACK] Seq=684281 Ack=11886311 Win=65535 Len=0
1,4.723442999999975,10.0.2.15,62.210.85.178,TLSv1.2,2974,Application Data
1,4.723500000000001,10.0.2.15,62.210.85.178,TLSv1.2,1226,Application Data
1,4.723537999999962,62.210.85.178,10.0.2.15,TCP,60,9001  >  35978 [ACK] Seq=684281 Ack=11887771 Win=65535 Len=0
1,4.723545000000001,62.210.85.178,10.0.2.15,TCP,60,9001  >  35978 [ACK] Seq=684281 Ack=11889231 Win=65535 Len=0
1,4.723597999999981,62.210.85.178,10.0.2.15,TCP,60,9001  >  35978 [ACK] Seq=684281 Ack=11890403 Win=65535 Len=0
1,4.723643999999979,10.0.2.15,62.210.85.178,TLSv1.2,4124,Application Data
1,4.723686999999984,62.210.85.178,10.0.2.15,TCP,60,9001  >  35978 [ACK] Seq=684281 Ack=11891863 Win=65535 Len=0
1,4.723693999999966,62.210.85.178,10.0.2.15,TCP,60,9001  >  35978 [ACK] Seq=684281 Ack=11893323 Win=65535 Len=0
1,4.723698000000013,62.210.85.178,10.0.2.15,TCP,60,9001  >  35978 [ACK] Seq=684281 Ack=11894473 Win=65535 Len=0
1,4.723744000000011,10.0.2.15,62.210.85.178,TLSv1.2,3030,Application Data
1,4.723784999999964,62.210.85.178,10.0.2.15,TCP,60,9001  >  35978 [ACK] Seq=684281 Ack=11895933 Win=65535 Len=0
1,4.723792000000003,62.210.85.178,10.0.2.15,TCP,60,9001  >  35978 [ACK] Seq=684281 Ack=11897393 Win=65535 Len=0
1,4.7237969999999905,62.210.85.178,10.0.2.15,TCP,60,9001  >  35978 [ACK] Seq=684281 Ack=11897449 Win=65535 Len=0
1,4.733008999999981,10.0.2.15,62.210.85.178,TLSv1.2,4124,Application Data
1,4.733087000000012,10.0.2.15,62.210.85.178,TCP,2974,35978  >  9001 [ACK] Seq=11901519 Ack=684281 Win=65535 Len=2920 [TCP segment of a reassembled PDU]
1,4.733124999999973,62.210.85.178,10.0.2.15,TCP,60,9001  >  35978 [ACK] Seq=684281 Ack=11898909 Win=65535 Len=0
1,4.733132000000012,62.210.85.178,10.0.2.15,TCP,60,9001  >  35978 [ACK] Seq=684281 Ack=11900369 Win=65535 Len=0
1,4.733136999999999,62.210.85.178,10.0.2.15,TCP,60,9001  >  35978 [ACK] Seq=684281 Ack=11901519 Win=65535 Len=0
1,4.733140999999989,62.210.85.178,10.0.2.15,TCP,60,9001  >  35978 [ACK] Seq=684281 Ack=11902979 Win=65535 Len=0
1,4.7331459999999765,62.210.85.178,10.0.2.15,TCP,60,9001  >  35978 [ACK] Seq=684281 Ack=11904439 Win=65535 Len=0
1,4.733184999999992,10.0.2.15,62.210.85.178,TLSv1.2,1204,Application Data
1,4.733308999999963,62.210.85.178,10.0.2.15,TCP,60,9001  >  35978 [ACK] Seq=684281 Ack=11905589 Win=65535 Len=0
1,4.733377999999959,10.0.2.15,62.210.85.178,TLSv1.2,4124,Application Data
1,4.73344800000001,10.0.2.15,62.210.85.178,TCP,2974,35978  >  9001 [ACK] Seq=11909659 Ack=684281 Win=65535 Len=2920 [TCP segment of a reassembled PDU]
1,4.733486999999968,62.210.85.178,10.0.2.15,TCP,60,9001  >  35978 [ACK] Seq=684281 Ack=11907049 Win=65535 Len=0
1,4.733494000000007,62.210.85.178,10.0.2.15,TCP,60,9001  >  35978 [ACK] Seq=684281 Ack=11908509 Win=65535 Len=0
1,4.733498999999995,62.210.85.178,10.0.2.15,TCP,60,9001  >  35978 [ACK] Seq=684281 Ack=11909659 Win=65535 Len=0
1,4.733502999999985,62.210.85.178,10.0.2.15,TCP,60,9001  >  35978 [ACK] Seq=684281 Ack=11911119 Win=65535 Len=0
1,4.733507999999972,62.210.85.178,10.0.2.15,TCP,60,9001  >  35978 [ACK] Seq=684281 Ack=11912579 Win=65535 Len=0
1,4.73354599999999,10.0.2.15,62.210.85.178,TLSv1.2,1204,Application Data
1,4.733588999999995,62.210.85.178,10.0.2.15,TCP,60,9001  >  35978 [ACK] Seq=684281 Ack=11913729 Win=65535 Len=0
1,4.7336329999999975,10.0.2.15,62.210.85.178,TLSv1.2,332,Application Data
1,4.733686999999975,62.210.85.178,10.0.2.15,TCP,60,9001  >  35978 [ACK] Seq=684281 Ack=11914007 Win=65535 Len=0
1,4.733769999999993,10.0.2.15,62.210.85.178,TLSv1.2,2646,Application Data
1,4.733813999999995,62.210.85.178,10.0.2.15,TCP,60,9001  >  35978 [ACK] Seq=684281 Ack=11915467 Win=65535 Len=0
1,4.733820999999978,62.210.85.178,10.0.2.15,TCP,60,9001  >  35978 [ACK] Seq=684281 Ack=11916599 Win=65535 Len=0
1,4.8589829999999665,54.93.77.70,10.0.2.15,TLSv1.2,590,Application Data
1,4.901765000000012,10.0.2.15,54.93.77.70,TCP,54,34692  >  9001 [ACK] Seq=686869 Ack=11872803 Win=65535 Len=0
1,5.009007999999994,54.93.77.70,10.0.2.15,TLSv1.2,3674,Application Data
1,5.009053999999992,54.93.77.70,10.0.2.15,TLSv1.2,10190,"Application Data, Application Data"
1,5.009120999999993,10.0.2.15,54.93.77.70,TCP,54,34692  >  9001 [ACK] Seq=686869 Ack=11876423 Win=65535 Len=0
1,5.009169999999983,10.0.2.15,54.93.77.70,TCP,54,34692  >  9001 [ACK] Seq=686869 Ack=11886559 Win=65535 Len=0
1,5.026954999999987,54.93.77.70,10.0.2.15,TLSv1.2,11414,"Application Data, Application Data, Application Data, Application Data, Application Data"
1,5.027014000000008,10.0.2.15,54.93.77.70,TCP,54,34692  >  9001 [ACK] Seq=686869 Ack=11897919 Win=65535 Len=0
1,5.027067999999986,54.93.77.70,10.0.2.15,TLSv1.2,2892,Application Data
1,5.027106000000003,10.0.2.15,54.93.77.70,TCP,54,34692  >  9001 [ACK] Seq=686869 Ack=11900757 Win=65535 Len=0
1,5.0276569999999765,10.0.2.15,54.93.77.70,TLSv1.2,590,Application Data
1,5.02777199999997,54.93.77.70,10.0.2.15,TCP,60,9001  >  34692 [ACK] Seq=11900757 Ack=687405 Win=65535 Len=0
1,5.148986999999977,54.93.77.70,10.0.2.15,TCP,2950,"9001  >  34692 [PSH, ACK] Seq=11900757 Ack=687405 Win=65535 Len=2896 [TCP segment of a reassembled PDU]"
1,5.149115999999992,10.0.2.15,54.93.77.70,TCP,54,34692  >  9001 [ACK] Seq=687405 Ack=11903653 Win=65535 Len=0
1,5.152123999999958,54.93.77.70,10.0.2.15,TLSv1.2,7294,"Application Data, Application Data"
1,5.152141999999969,54.93.77.70,10.0.2.15,TLSv1.2,1292,Application Data
1,5.152145999999959,62.210.85.178,10.0.2.15,TLSv1.2,590,Application Data
1,5.15221600000001,10.0.2.15,54.93.77.70,TCP,54,34692  >  9001 [ACK] Seq=687405 Ack=11912131 Win=65535 Len=0
1,5.193785999999989,10.0.2.15,62.210.85.178,TCP,54,35978  >  9001 [ACK] Seq=11916599 Ack=684817 Win=65535 Len=0
1,5.312857000000008,54.93.77.70,10.0.2.15,TCP,2950,"9001  >  34692 [PSH, ACK] Seq=11912131 Ack=687405 Win=65535 Len=2896 [TCP segment of a reassembled PDU]"
1,5.312934999999982,10.0.2.15,54.93.77.70,TCP,54,34692  >  9001 [ACK] Seq=687405 Ack=11915027 Win=65535 Len=0
1,5.3165989999999965,54.93.77.70,10.0.2.15,TLSv1.2,778,Application Data
1,5.317795999999987,54.93.77.70,10.0.2.15,TCP,1502,"9001  >  34692 [PSH, ACK] Seq=11915751 Ack=687405 Win=65535 Len=1448 [TCP segment of a reassembled PDU]"
1,5.317844999999977,10.0.2.15,54.93.77.70,TCP,54,34692  >  9001 [ACK] Seq=687405 Ack=11917199 Win=65535 Len=0
1,5.3350509999999645,54.93.77.70,10.0.2.15,TLSv1.2,1198,Application Data
1,5.335207999999966,10.0.2.15,54.93.77.70,TLSv1.2,590,Application Data
1,5.335290999999984,54.93.77.70,10.0.2.15,TCP,60,9001  >  34692 [ACK] Seq=11918343 Ack=687941 Win=65535 Len=0
1,5.456709999999987,54.93.77.70,10.0.2.15,TLSv1.2,1104,Application Data
1,5.459157000000005,10.0.2.15,54.93.77.70,TLSv1.2,590,Application Data
1,5.459328999999968,54.93.77.70,10.0.2.15,TCP,60,9001  >  34692 [ACK] Seq=11919393 Ack=688477 Win=65535 Len=0
1,5.622714999999971,62.210.85.178,10.0.2.15,TLSv1.2,1104,Application Data
1,5.622804999999971,10.0.2.15,62.210.85.178,TCP,54,35978  >  9001 [ACK] Seq=11916599 Ack=685867 Win=65535 Len=0
1,5.623309000000006,10.0.2.15,62.210.85.178,TLSv1.2,590,Application Data
1,5.623410999999976,62.210.85.178,10.0.2.15,TCP,60,9001  >  35978 [ACK] Seq=685867 Ack=11917135 Win=65535 Len=0
1,5.765564999999981,54.93.77.70,10.0.2.15,TLSv1.2,590,Application Data
1,5.765960000000007,10.0.2.15,54.93.77.70,TLSv1.2,590,Application Data
1,5.766057999999987,54.93.77.70,10.0.2.15,TCP,60,9001  >  34692 [ACK] Seq=11919929 Ack=689013 Win=65535 Len=0
1,5.930330999999967,62.210.85.178,10.0.2.15,TLSv1.2,590,Application Data
1,5.938879999999983,10.0.2.15,62.210.85.178,TLSv1.2,590,Application Data
1,5.940064000000007,62.210.85.178,10.0.2.15,TCP,60,9001  >  35978 [ACK] Seq=686403 Ack=11917671 Win=65535 Len=0
1,5.95029199999999,10.0.2.15,62.210.85.178,TLSv1.2,4124,Application Data
1,5.950403999999992,10.0.2.15,62.210.85.178,TCP,2974,35978  >  9001 [ACK] Seq=11921741 Ack=686403 Win=65535 Len=2920 [TCP segment of a reassembled PDU]
1,5.950458999999967,62.210.85.178,10.0.2.15,TCP,60,9001  >  35978 [ACK] Seq=686403 Ack=11919131 Win=65535 Len=0
1,5.950470999999993,62.210.85.178,10.0.2.15,TCP,60,9001  >  35978 [ACK] Seq=686403 Ack=11920591 Win=65535 Len=0
1,5.950475999999981,62.210.85.178,10.0.2.15,TCP,60,9001  >  35978 [ACK] Seq=686403 Ack=11921741 Win=65535 Len=0
1,5.9504779999999755,62.210.85.178,10.0.2.15,TCP,60,9001  >  35978 [ACK] Seq=686403 Ack=11923201 Win=65535 Len=0
1,5.950480999999968,62.210.85.178,10.0.2.15,TCP,60,9001  >  35978 [ACK] Seq=686403 Ack=11924661 Win=65535 Len=0
1,5.950516999999991,10.0.2.15,62.210.85.178,TLSv1.2,1204,Application Data
1,5.950549999999964,62.210.85.178,10.0.2.15,TCP,60,9001  >  35978 [ACK] Seq=686403 Ack=11925811 Win=65535 Len=0
1,5.950594999999964,10.0.2.15,62.210.85.178,TLSv1.2,4124,Application Data
1,5.950663999999961,62.210.85.178,10.0.2.15,TCP,60,9001  >  35978 [ACK] Seq=686403 Ack=11927271 Win=65535 Len=0
1,5.950671,62.210.85.178,10.0.2.15,TCP,60,9001  >  35978 [ACK] Seq=686403 Ack=11928731 Win=65535 Len=0
1,5.950673999999992,62.210.85.178,10.0.2.15,TCP,60,9001  >  35978 [ACK] Seq=686403 Ack=11929881 Win=65535 Len=0
1,5.950709999999958,10.0.2.15,62.210.85.178,TLSv1.2,4124,Application Data
1,5.950742999999989,62.210.85.178,10.0.2.15,TCP,60,9001  >  35978 [ACK] Seq=686403 Ack=11931341 Win=65535 Len=0
1,5.950752999999963,62.210.85.178,10.0.2.15,TCP,60,9001  >  35978 [ACK] Seq=686403 Ack=11932801 Win=65535 Len=0
1,5.950801000000013,62.210.85.178,10.0.2.15,TCP,60,9001  >  35978 [ACK] Seq=686403 Ack=11933951 Win=65535 Len=0
1,5.950833999999986,10.0.2.15,62.210.85.178,TLSv1.2,332,Application Data
1,5.95086699999996,62.210.85.178,10.0.2.15,TCP,60,9001  >  35978 [ACK] Seq=686403 Ack=11934229 Win=65535 Len=0
1,5.950921999999991,10.0.2.15,62.210.85.178,TLSv1.2,3868,Application Data
1,5.950958000000014,62.210.85.178,10.0.2.15,TCP,60,9001  >  35978 [ACK] Seq=686403 Ack=11935689 Win=65535 Len=0
1,5.9509649999999965,62.210.85.178,10.0.2.15,TCP,60,9001  >  35978 [ACK] Seq=686403 Ack=11937149 Win=65535 Len=0
1,5.9509669999999915,62.210.85.178,10.0.2.15,TCP,60,9001  >  35978 [ACK] Seq=686403 Ack=11938043 Win=65535 Len=0
1,5.951004000000012,10.0.2.15,62.210.85.178,TLSv1.2,4124,Application Data
1,5.95103899999998,62.210.85.178,10.0.2.15,TCP,60,9001  >  35978 [ACK] Seq=686403 Ack=11939503 Win=65535 Len=0
1,5.9510459999999625,62.210.85.178,10.0.2.15,TCP,60,9001  >  35978 [ACK] Seq=686403 Ack=11940963 Win=65535 Len=0
1,5.951049000000012,62.210.85.178,10.0.2.15,TCP,60,9001  >  35978 [ACK] Seq=686403 Ack=11942113 Win=65535 Len=0
1,5.95108399999998,10.0.2.15,62.210.85.178,TLSv1.2,3030,Application Data
1,5.951118000000008,62.210.85.178,10.0.2.15,TCP,60,9001  >  35978 [ACK] Seq=686403 Ack=11943573 Win=65535 Len=0
1,5.951123999999993,62.210.85.178,10.0.2.15,TCP,60,9001  >  35978 [ACK] Seq=686403 Ack=11945033 Win=65535 Len=0
1,5.951126999999985,62.210.85.178,10.0.2.15,TCP,60,9001  >  35978 [ACK] Seq=686403 Ack=11945089 Win=65535 Len=0
1,5.962603000000001,10.0.2.15,62.210.85.178,TLSv1.2,4124,Application Data
1,5.962690000000009,62.210.85.178,10.0.2.15,TCP,60,9001  >  35978 [ACK] Seq=686403 Ack=11946549 Win=65535 Len=0
1,5.962699999999984,62.210.85.178,10.0.2.15,TCP,60,9001  >  35978 [ACK] Seq=686403 Ack=11948009 Win=65535 Len=0
1,5.962703999999974,62.210.85.178,10.0.2.15,TCP,60,9001  >  35978 [ACK] Seq=686403 Ack=11949159 Win=65535 Len=0
1,5.9627419999999915,10.0.2.15,62.210.85.178,TLSv1.2,4124,Application Data
1,5.962799999999959,62.210.85.178,10.0.2.15,TCP,60,9001  >  35978 [ACK] Seq=686403 Ack=11950619 Win=65535 Len=0
1,5.962806999999998,62.210.85.178,10.0.2.15,TCP,60,9001  >  35978 [ACK] Seq=686403 Ack=11952079 Win=65535 Len=0
1,5.96280999999999,62.210.85.178,10.0.2.15,TCP,60,9001  >  35978 [ACK] Seq=686403 Ack=11953229 Win=65535 Len=0
1,5.962846000000013,10.0.2.15,62.210.85.178,TLSv1.2,4124,Application Data
1,5.962878999999987,62.210.85.178,10.0.2.15,TCP,60,9001  >  35978 [ACK] Seq=686403 Ack=11954689 Win=65535 Len=0
1,5.9628869999999665,62.210.85.178,10.0.2.15,TCP,60,9001  >  35978 [ACK] Seq=686403 Ack=11956149 Win=65535 Len=0
1,5.962891000000013,62.210.85.178,10.0.2.15,TCP,60,9001  >  35978 [ACK] Seq=686403 Ack=11957299 Win=65535 Len=0
1,5.962926999999979,10.0.2.15,62.210.85.178,TLSv1.2,4124,Application Data
1,5.962961000000007,62.210.85.178,10.0.2.15,TCP,60,9001  >  35978 [ACK] Seq=686403 Ack=11958759 Win=65535 Len=0
1,5.962968999999987,62.210.85.178,10.0.2.15,TCP,60,9001  >  35978 [ACK] Seq=686403 Ack=11960219 Win=65535 Len=0
1,5.962972999999977,62.210.85.178,10.0.2.15,TCP,60,9001  >  35978 [ACK] Seq=686403 Ack=11961369 Win=65535 Len=0
1,5.963006000000007,10.0.2.15,62.210.85.178,TLSv1.2,332,Application Data
1,5.963039999999978,62.210.85.178,10.0.2.15,TCP,60,9001  >  35978 [ACK] Seq=686403 Ack=11961647 Win=65535 Len=0
1,5.963088999999968,10.0.2.15,62.210.85.178,TLSv1.2,3868,Application Data
1,5.963124999999991,62.210.85.178,10.0.2.15,TCP,60,9001  >  35978 [ACK] Seq=686403 Ack=11963107 Win=65535 Len=0
1,5.963132999999971,62.210.85.178,10.0.2.15,TCP,60,9001  >  35978 [ACK] Seq=686403 Ack=11964567 Win=65535 Len=0
1,5.963135999999963,62.210.85.178,10.0.2.15,TCP,60,9001  >  35978 [ACK] Seq=686403 Ack=11965461 Win=65535 Len=0
1,5.963172999999983,10.0.2.15,62.210.85.178,TLSv1.2,4124,Application Data
1,5.963209000000006,62.210.85.178,10.0.2.15,TCP,60,9001  >  35978 [ACK] Seq=686403 Ack=11966921 Win=65535 Len=0
1,5.9632159999999885,62.210.85.178,10.0.2.15,TCP,60,9001  >  35978 [ACK] Seq=686403 Ack=11968381 Win=65535 Len=0
1,5.963218999999981,62.210.85.178,10.0.2.15,TCP,60,9001  >  35978 [ACK] Seq=686403 Ack=11969531 Win=65535 Len=0
1,5.963253000000009,10.0.2.15,62.210.85.178,TLSv1.2,3030,Application Data
1,5.963288999999975,62.210.85.178,10.0.2.15,TCP,60,9001  >  35978 [ACK] Seq=686403 Ack=11970991 Win=65535 Len=0
1,5.963296000000014,62.210.85.178,10.0.2.15,TCP,60,9001  >  35978 [ACK] Seq=686403 Ack=11972451 Win=65535 Len=0
1,5.963300000000004,62.210.85.178,10.0.2.15,TCP,60,9001  >  35978 [ACK] Seq=686403 Ack=11972507 Win=65535 Len=0
1,5.972501999999963,10.0.2.15,62.210.85.178,TLSv1.2,4124,Application Data
1,5.9725819999999885,62.210.85.178,10.0.2.15,TCP,60,9001  >  35978 [ACK] Seq=686403 Ack=11973967 Win=65535 Len=0
1,5.972591999999963,62.210.85.178,10.0.2.15,TCP,60,9001  >  35978 [ACK] Seq=686403 Ack=11975427 Win=65535 Len=0
1,5.9725950000000125,62.210.85.178,10.0.2.15,TCP,60,9001  >  35978 [ACK] Seq=686403 Ack=11976577 Win=65535 Len=0
1,5.972635999999966,10.0.2.15,62.210.85.178,TLSv1.2,4124,Application Data
1,5.972671999999989,62.210.85.178,10.0.2.15,TCP,60,9001  >  35978 [ACK] Seq=686403 Ack=11978037 Win=65535 Len=0
1,5.972682999999961,62.210.85.178,10.0.2.15,TCP,60,9001  >  35978 [ACK] Seq=686403 Ack=11979497 Win=65535 Len=0
1,5.972688000000005,62.210.85.178,10.0.2.15,TCP,60,9001  >  35978 [ACK] Seq=686403 Ack=11980647 Win=65535 Len=0
1,5.972723999999971,10.0.2.15,62.210.85.178,TLSv1.2,718,Application Data
1,5.972758999999996,62.210.85.178,10.0.2.15,TCP,60,9001  >  35978 [ACK] Seq=686403 Ack=11981311 Win=65535 Len=0
1,6.094107000000008,54.93.77.70,10.0.2.15,TLSv1.2,3674,Application Data
1,6.0942569999999705,10.0.2.15,54.93.77.70,TCP,54,34692  >  9001 [ACK] Seq=689013 Ack=11923549 Win=65535 Len=0
1,6.234622000000002,54.93.77.70,10.0.2.15,TCP,2950,"9001  >  34692 [PSH, ACK] Seq=11923549 Ack=689013 Win=65535 Len=2896 [TCP segment of a reassembled PDU]"
1,6.234702999999968,10.0.2.15,54.93.77.70,TCP,54,34692  >  9001 [ACK] Seq=689013 Ack=11926445 Win=65535 Len=0
1,6.236559,54.93.77.70,10.0.2.15,TLSv1.2,778,Application Data
1,6.237634000000014,54.93.77.70,10.0.2.15,TCP,2950,"9001  >  34692 [PSH, ACK] Seq=11927169 Ack=689013 Win=65535 Len=2896 [TCP segment of a reassembled PDU]"
1,6.237653999999964,54.93.77.70,10.0.2.15,TLSv1.2,11638,"Application Data, Application Data, Application Data, Application Data, Application Data"
1,6.23770300000001,10.0.2.15,54.93.77.70,TCP,54,34692  >  9001 [ACK] Seq=689013 Ack=11930065 Win=65535 Len=0
1,6.237785999999971,10.0.2.15,54.93.77.70,TCP,54,34692  >  9001 [ACK] Seq=689013 Ack=11941649 Win=65535 Len=0
1,6.239278000000013,54.93.77.70,10.0.2.15,TCP,1502,"9001  >  34692 [PSH, ACK] Seq=11941649 Ack=689013 Win=65535 Len=1448 [TCP segment of a reassembled PDU]"
1,6.239318999999966,10.0.2.15,54.93.77.70,TCP,54,34692  >  9001 [ACK] Seq=689013 Ack=11943097 Win=65535 Len=0
1,6.23970700000001,54.93.77.70,10.0.2.15,TLSv1.2,2950,"Application Data, Application Data"
1,6.239776000000006,10.0.2.15,54.93.77.70,TCP,54,34692  >  9001 [ACK] Seq=689013 Ack=11945993 Win=65535 Len=0
1,6.253398000000004,54.93.77.70,10.0.2.15,TLSv1.2,2950,Application Data [TCP segment of a reassembled PDU]
1,6.253444000000002,10.0.2.15,54.93.77.70,TCP,54,34692  >  9001 [ACK] Seq=689013 Ack=11948889 Win=65535 Len=0
1,6.2536119999999755,10.0.2.15,54.93.77.70,TLSv1.2,590,Application Data
1,6.253681999999969,54.93.77.70,10.0.2.15,TCP,60,9001  >  34692 [ACK] Seq=11948889 Ack=689549 Win=65535 Len=0
1,6.253779000000009,54.93.77.70,10.0.2.15,TCP,2950,"9001  >  34692 [PSH, ACK] Seq=11948889 Ack=689549 Win=65535 Len=2896 [TCP segment of a reassembled PDU]"
1,6.2538470000000075,10.0.2.15,54.93.77.70,TCP,54,34692  >  9001 [ACK] Seq=689549 Ack=11951785 Win=65535 Len=0
1,6.254658000000006,54.93.77.70,10.0.2.15,TLSv1.2,844,"Application Data, Application Data"
1,6.297790999999961,10.0.2.15,54.93.77.70,TCP,54,34692  >  9001 [ACK] Seq=689549 Ack=11952575 Win=65535 Len=0
1,6.381918999999982,62.210.85.178,10.0.2.15,TLSv1.2,590,Application Data
1,6.382122999999979,54.93.77.70,10.0.2.15,TCP,1502,"9001  >  34692 [PSH, ACK] Seq=11952575 Ack=689549 Win=65535 Len=1448 [TCP segment of a reassembled PDU]"
1,6.382171999999969,10.0.2.15,54.93.77.70,TCP,54,34692  >  9001 [ACK] Seq=689549 Ack=11954023 Win=65535 Len=0
1,6.397485999999958,54.93.77.70,10.0.2.15,TLSv1.2,1198,Application Data
1,6.397592999999972,10.0.2.15,54.93.77.70,TCP,54,34692  >  9001 [ACK] Seq=689549 Ack=11955167 Win=65535 Len=0
1,6.425743000000011,10.0.2.15,62.210.85.178,TCP,54,35978  >  9001 [ACK] Seq=11981311 Ack=686939 Win=65535 Len=0
1,6.6854979999999955,54.93.77.70,10.0.2.15,TLSv1.2,1104,Application Data
1,6.685575999999969,10.0.2.15,54.93.77.70,TCP,54,34692  >  9001 [ACK] Seq=689549 Ack=11956217 Win=65535 Len=0
1,6.848361000000011,54.93.77.70,10.0.2.15,TLSv1.2,1104,Application Data
1,6.848442999999975,10.0.2.15,54.93.77.70,TCP,54,34692  >  9001 [ACK] Seq=689549 Ack=11957267 Win=65535 Len=0
1,6.992461999999989,54.93.77.70,10.0.2.15,TCP,1502,"9001  >  34692 [PSH, ACK] Seq=11957267 Ack=689549 Win=65535 Len=1448 [TCP segment of a reassembled PDU]"
1,6.992565000000013,10.0.2.15,54.93.77.70,TCP,54,34692  >  9001 [ACK] Seq=689549 Ack=11958715 Win=65535 Len=0
1,6.995118999999988,54.93.77.70,10.0.2.15,TLSv1.2,4398,Application Data [TCP segment of a reassembled PDU]
1,6.995135000000005,54.93.77.70,10.0.2.15,TLSv1.2,4398,Application Data [TCP segment of a reassembled PDU]
1,6.995171999999968,10.0.2.15,54.93.77.70,TCP,54,34692  >  9001 [ACK] Seq=689549 Ack=11963059 Win=65535 Len=0
1,6.995213999999976,10.0.2.15,54.93.77.70,TCP,54,34692  >  9001 [ACK] Seq=689549 Ack=11967403 Win=65535 Len=0
1,7.011024999999961,54.93.77.70,10.0.2.15,TLSv1.2,1314,"Application Data, Application Data"
1,7.011097000000007,10.0.2.15,54.93.77.70,TCP,54,34692  >  9001 [ACK] Seq=689549 Ack=11968663 Win=65535 Len=0
1,7.1420439999999985,54.93.77.70,10.0.2.15,TLSv1.2,590,Application Data
1,7.142119999999977,10.0.2.15,54.93.77.70,TCP,54,34692  >  9001 [ACK] Seq=689549 Ack=11969199 Win=65535 Len=0
1,7.951905000000011,54.93.77.70,10.0.2.15,TLSv1.2,2132,Application Data
1,7.951989999999967,10.0.2.15,54.93.77.70,TCP,54,34692  >  9001 [ACK] Seq=689549 Ack=11971277 Win=65535 Len=0
1,7.952225999999996,10.0.2.15,54.93.77.70,TLSv1.2,590,Application Data
1,7.952312000000006,54.93.77.70,10.0.2.15,TCP,60,9001  >  34692 [ACK] Seq=11971277 Ack=690085 Win=65535 Len=0
1,8.566588999999965,62.210.85.178,10.0.2.15,TLSv1.2,590,Application Data
1,8.566675999999973,10.0.2.15,62.210.85.178,TCP,54,35978  >  9001 [ACK] Seq=11981311 Ack=687475 Win=65535 Len=0
1,8.569533999999976,54.93.77.70,10.0.2.15,TLSv1.2,1618,Application Data
1,8.569551999999987,54.93.77.70,10.0.2.15,TCP,1502,"9001  >  34692 [PSH, ACK] Seq=11972841 Ack=690085 Win=65535 Len=1448 [TCP segment of a reassembled PDU]"
1,8.569623999999976,10.0.2.15,54.93.77.70,TCP,54,34692  >  9001 [ACK] Seq=690085 Ack=11974289 Win=65535 Len=0
1,8.56978399999997,10.0.2.15,54.93.77.70,TLSv1.2,590,Application Data
1,8.569872999999973,54.93.77.70,10.0.2.15,TCP,60,9001  >  34692 [ACK] Seq=11974289 Ack=690621 Win=65535 Len=0
1,8.584397999999965,54.93.77.70,10.0.2.15,TLSv1.2,1502,Application Data [TCP segment of a reassembled PDU]
1,8.584447000000011,10.0.2.15,54.93.77.70,TCP,54,34692  >  9001 [ACK] Seq=690621 Ack=11975737 Win=65535 Len=0
1,8.586419999999976,54.93.77.70,10.0.2.15,TLSv1.2,1314,Application Data
1,8.629741999999965,10.0.2.15,54.93.77.70,TCP,54,34692  >  9001 [ACK] Seq=690621 Ack=11976997 Win=65535 Len=0
1,8.646744000000012,54.93.77.70,10.0.2.15,TLSv1.2,1104,Application Data
1,8.64679799999999,10.0.2.15,54.93.77.70,TCP,54,34692  >  9001 [ACK] Seq=690621 Ack=11978047 Win=65535 Len=0
1,8.726667999999961,62.210.85.178,10.0.2.15,TLSv1.2,590,Application Data
1,8.726763000000005,10.0.2.15,62.210.85.178,TCP,54,35978  >  9001 [ACK] Seq=11981311 Ack=688011 Win=65535 Len=0
1,9.180883999999992,54.93.77.70,10.0.2.15,TCP,2950,"9001  >  34692 [PSH, ACK] Seq=11978047 Ack=690621 Win=65535 Len=2896 [TCP segment of a reassembled PDU]"
1,9.180960999999968,10.0.2.15,54.93.77.70,TCP,54,34692  >  9001 [ACK] Seq=690621 Ack=11980943 Win=65535 Len=0
1,9.183963000000006,54.93.77.70,10.0.2.15,TLSv1.2,264,Application Data
1,9.184005000000013,10.0.2.15,54.93.77.70,TCP,54,34692  >  9001 [ACK] Seq=690621 Ack=11981153 Win=65535 Len=0
1,9.184456000000011,54.93.77.70,10.0.2.15,TLSv1.2,3160,Application Data
1,9.184501000000012,10.0.2.15,54.93.77.70,TCP,54,34692  >  9001 [ACK] Seq=690621 Ack=11984259 Win=65535 Len=0
1,9.187612999999999,10.0.2.15,54.93.77.70,TLSv1.2,590,Application Data
1,9.188054999999963,54.93.77.70,10.0.2.15,TCP,60,9001  >  34692 [ACK] Seq=11984259 Ack=691157 Win=65535 Len=0
1,9.387112000000002,62.210.85.178,10.0.2.15,TLSv1.2,590,Application Data
1,9.38721899999996,10.0.2.15,62.210.85.178,TCP,54,35978  >  9001 [ACK] Seq=11981311 Ack=688547 Win=65535 Len=0
1,9.38858399999998,10.0.2.15,62.210.85.178,TLSv1.2,590,Application Data
1,9.388959999999997,62.210.85.178,10.0.2.15,TCP,60,9001  >  35978 [ACK] Seq=688547 Ack=11981847 Win=65535 Len=0
1,9.49364399999996,54.93.77.70,10.0.2.15,TLSv1.2,590,Application Data
1,9.49422199999998,10.0.2.15,54.93.77.70,TLSv1.2,590,Application Data
1,9.494368000000009,54.93.77.70,10.0.2.15,TCP,60,9001  >  34692 [ACK] Seq=11984795 Ack=691693 Win=65535 Len=0
1,9.601512000000014,62.210.85.178,10.0.2.15,TLSv1.2,590,Application Data
1,9.605334999999968,10.0.2.15,62.210.85.178,TLSv1.2,590,Application Data
1,9.605550999999991,62.210.85.178,10.0.2.15,TCP,60,9001  >  35978 [ACK] Seq=689083 Ack=11982383 Win=65535 Len=0
1,9.617786999999964,10.0.2.15,62.210.85.178,TLSv1.2,4124,Application Data
1,9.617942999999968,10.0.2.15,62.210.85.178,TCP,2974,35978  >  9001 [ACK] Seq=11986453 Ack=689083 Win=65535 Len=2920 [TCP segment of a reassembled PDU]
1,9.617972000000009,62.210.85.178,10.0.2.15,TCP,60,9001  >  35978 [ACK] Seq=689083 Ack=11983843 Win=65535 Len=0
1,9.617981999999984,62.210.85.178,10.0.2.15,TCP,60,9001  >  35978 [ACK] Seq=689083 Ack=11985303 Win=65535 Len=0
1,9.617986999999971,62.210.85.178,10.0.2.15,TCP,60,9001  >  35978 [ACK] Seq=689083 Ack=11986453 Win=65535 Len=0
1,9.618028999999979,10.0.2.15,62.210.85.178,TLSv1.2,1204,Application Data
1,9.618067999999994,62.210.85.178,10.0.2.15,TCP,60,9001  >  35978 [ACK] Seq=689083 Ack=11987913 Win=65535 Len=0
1,9.618074999999976,62.210.85.178,10.0.2.15,TCP,60,9001  >  35978 [ACK] Seq=689083 Ack=11989373 Win=65535 Len=0
1,9.618078999999966,62.210.85.178,10.0.2.15,TCP,60,9001  >  35978 [ACK] Seq=689083 Ack=11990523 Win=65535 Len=0
1,9.618128000000013,10.0.2.15,62.210.85.178,TLSv1.2,4124,Application Data
1,9.61819399999996,10.0.2.15,62.210.85.178,TCP,2974,35978  >  9001 [ACK] Seq=11994593 Ack=689083 Win=65535 Len=2920 [TCP segment of a reassembled PDU]
1,9.618233999999973,62.210.85.178,10.0.2.15,TCP,60,9001  >  35978 [ACK] Seq=689083 Ack=11991983 Win=65535 Len=0
1,9.618241000000012,62.210.85.178,10.0.2.15,TCP,60,9001  >  35978 [ACK] Seq=689083 Ack=11993443 Win=65535 Len=0
1,9.618246,62.210.85.178,10.0.2.15,TCP,60,9001  >  35978 [ACK] Seq=689083 Ack=11994593 Win=65535 Len=0
1,9.618250999999987,62.210.85.178,10.0.2.15,TCP,60,9001  >  35978 [ACK] Seq=689083 Ack=11996053 Win=65535 Len=0
1,9.618255999999974,62.210.85.178,10.0.2.15,TCP,60,9001  >  35978 [ACK] Seq=689083 Ack=11997513 Win=65535 Len=0
1,9.618293999999992,10.0.2.15,62.210.85.178,TLSv1.2,1204,Application Data
1,9.618383999999992,62.210.85.178,10.0.2.15,TCP,60,9001  >  35978 [ACK] Seq=689083 Ack=11998663 Win=65535 Len=0
1,9.618421000000012,10.0.2.15,62.210.85.178,TLSv1.2,332,Application Data
1,9.618480999999974,10.0.2.15,62.210.85.178,TCP,2974,35978  >  9001 [ACK] Seq=11998941 Ack=689083 Win=65535 Len=2920 [TCP segment of a reassembled PDU]
1,9.618517999999995,62.210.85.178,10.0.2.15,TCP,60,9001  >  35978 [ACK] Seq=689083 Ack=11998941 Win=65535 Len=0
1,9.61852399999998,62.210.85.178,10.0.2.15,TCP,60,9001  >  35978 [ACK] Seq=689083 Ack=12000401 Win=65535 Len=0
1,9.618528999999967,62.210.85.178,10.0.2.15,TCP,60,9001  >  35978 [ACK] Seq=689083 Ack=12001861 Win=65535 Len=0
1,9.618561,10.0.2.15,62.210.85.178,TLSv1.2,948,Application Data
1,9.618659999999977,62.210.85.178,10.0.2.15,TCP,60,9001  >  35978 [ACK] Seq=689083 Ack=12002755 Win=65535 Len=0
1,9.618702999999982,10.0.2.15,62.210.85.178,TLSv1.2,910,Application Data
1,9.618742999999995,62.210.85.178,10.0.2.15,TCP,60,9001  >  35978 [ACK] Seq=689083 Ack=12003611 Win=65535 Len=0
1,9.706254999999999,54.93.77.70,10.0.2.15,TLSv1.2,590,Application Data
1,9.749678999999958,10.0.2.15,54.93.77.70,TCP,54,34692  >  9001 [ACK] Seq=691693 Ack=11985331 Win=65535 Len=0
1,10.409573999999964,54.93.77.70,10.0.2.15,TCP,2950,"9001  >  34692 [PSH, ACK] Seq=11985331 Ack=691693 Win=65535 Len=2896 [TCP segment of a reassembled PDU]"
1,10.409669000000008,10.0.2.15,54.93.77.70,TCP,54,34692  >  9001 [ACK] Seq=691693 Ack=11988227 Win=65535 Len=0
1,10.41315800000001,54.93.77.70,10.0.2.15,TLSv1.2,778,Application Data
1,10.413207999999997,10.0.2.15,54.93.77.70,TCP,54,34692  >  9001 [ACK] Seq=691693 Ack=11988951 Win=65535 Len=0
1,10.413572999999985,54.93.77.70,10.0.2.15,TLSv1.2,2950,Application Data
1,10.413616999999988,10.0.2.15,54.93.77.70,TCP,54,34692  >  9001 [ACK] Seq=691693 Ack=11991847 Win=65535 Len=0
1,10.431038999999998,54.93.77.70,10.0.2.15,TLSv1.2,800,Application Data
