No.,Time,Source,Destination,Protocol,Length,Info
1,0.019389000000046508,10.0.2.15,54.93.77.70,TCP,54,34692  >  9001 [ACK] Seq=9870787 Ack=179257771 Win=65535 Len=0
1,0.07271200000013778,62.210.85.178,10.0.2.15,TLSv1.2,1104,Application Data
1,0.1193410000005315,10.0.2.15,62.210.85.178,TCP,54,35978  >  9001 [ACK] Seq=179394783 Ack=9827753 Win=65535 Len=0
1,0.14036399999986315,10.0.2.15,54.93.77.70,TLSv1.2,590,Application Data
1,0.14053799999965122,54.93.77.70,10.0.2.15,TCP,60,9001  >  34692 [ACK] Seq=179257771 Ack=9871323 Win=65535 Len=0
1,0.2625450000005003,62.210.85.178,10.0.2.15,TLSv1.2,590,Application Data
1,0.2626200000004246,10.0.2.15,62.210.85.178,TCP,54,35978  >  9001 [ACK] Seq=179394783 Ack=9828289 Win=65535 Len=0
1,0.2630970000000161,10.0.2.15,62.210.85.178,TLSv1.2,590,Application Data
1,0.26320399999985966,62.210.85.178,10.0.2.15,TCP,60,9001  >  35978 [ACK] Seq=9828289 Ack=179395319 Win=65535 Len=0
1,0.3757130000003599,54.93.77.70,10.0.2.15,TLSv1.2,590,Application Data
1,0.3757900000000518,10.0.2.15,54.93.77.70,TCP,54,34692  >  9001 [ACK] Seq=9871323 Ack=179258307 Win=65535 Len=0
1,0.3761709999998857,10.0.2.15,54.93.77.70,TLSv1.2,1618,Application Data
1,0.37627299999985553,54.93.77.70,10.0.2.15,TCP,60,9001  >  34692 [ACK] Seq=179258307 Ack=9872783 Win=65535 Len=0
1,0.3762930000002598,54.93.77.70,10.0.2.15,TCP,60,9001  >  34692 [ACK] Seq=179258307 Ack=9872887 Win=65535 Len=0
1,0.5596040000000357,62.210.85.178,10.0.2.15,TLSv1.2,1618,Application Data
1,0.5597429999997985,10.0.2.15,62.210.85.178,TCP,54,35978  >  9001 [ACK] Seq=179395319 Ack=9829853 Win=65535 Len=0
1,0.5734259999999267,10.0.2.15,62.210.85.178,TLSv1.2,590,Application Data
1,0.5735860000004323,62.210.85.178,10.0.2.15,TCP,60,9001  >  35978 [ACK] Seq=9829853 Ack=179395855 Win=65535 Len=0
1,0.5882440000004863,10.0.2.15,62.210.85.178,TLSv1.2,1618,Application Data
1,0.5883880000001227,62.210.85.178,10.0.2.15,TCP,60,9001  >  35978 [ACK] Seq=9829853 Ack=179397315 Win=65535 Len=0
1,0.5884050000004208,62.210.85.178,10.0.2.15,TCP,60,9001  >  35978 [ACK] Seq=9829853 Ack=179397419 Win=65535 Len=0
1,0.6815809999998237,54.93.77.70,10.0.2.15,TLSv1.2,590,Application Data
1,0.7123090000004595,54.93.77.70,10.0.2.15,TLSv1.2,1618,Application Data
1,0.7123710000005303,10.0.2.15,54.93.77.70,TCP,54,34692  >  9001 [ACK] Seq=9872887 Ack=179260407 Win=65535 Len=0
1,0.7143059999998513,10.0.2.15,54.93.77.70,TLSv1.2,590,Application Data
1,0.7144829999997455,54.93.77.70,10.0.2.15,TCP,60,9001  >  34692 [ACK] Seq=179260407 Ack=9873423 Win=65535 Len=0
1,0.9691940000002432,62.210.85.178,10.0.2.15,TLSv1.2,590,Application Data
1,0.9695389999997133,10.0.2.15,62.210.85.178,TLSv1.2,590,Application Data
1,0.9696439999997892,62.210.85.178,10.0.2.15,TCP,60,9001  >  35978 [ACK] Seq=9830389 Ack=179397955 Win=65535 Len=0
1,1.278269999999793,54.93.77.70,10.0.2.15,TLSv1.2,590,Application Data
1,1.2787109999999302,10.0.2.15,54.93.77.70,TLSv1.2,590,Application Data
1,1.2788540000001376,54.93.77.70,10.0.2.15,TCP,60,9001  >  34692 [ACK] Seq=179260943 Ack=9873959 Win=65535 Len=0
1,1.4811369999997623,62.210.85.178,10.0.2.15,TLSv1.2,590,Application Data
1,1.4865680000002612,10.0.2.15,62.210.85.178,TLSv1.2,590,Application Data
1,1.4867730000005395,62.210.85.178,10.0.2.15,TCP,60,9001  >  35978 [ACK] Seq=9830925 Ack=179398491 Win=65535 Len=0
1,1.497056000000157,10.0.2.15,62.210.85.178,TLSv1.2,4124,Application Data
1,1.4972139999999854,10.0.2.15,62.210.85.178,TCP,2974,35978  >  9001 [ACK] Seq=179402561 Ack=9830925 Win=65535 Len=2920 [TCP segment of a reassembled PDU]
1,1.497266999999738,62.210.85.178,10.0.2.15,TCP,60,9001  >  35978 [ACK] Seq=9830925 Ack=179399951 Win=65535 Len=0
1,1.4972800000005009,62.210.85.178,10.0.2.15,TCP,60,9001  >  35978 [ACK] Seq=9830925 Ack=179401411 Win=65535 Len=0
1,1.4972850000003746,62.210.85.178,10.0.2.15,TCP,60,9001  >  35978 [ACK] Seq=9830925 Ack=179402561 Win=65535 Len=0
1,1.4973589999999604,10.0.2.15,62.210.85.178,TLSv1.2,1204,Application Data
1,1.4973820000004707,62.210.85.178,10.0.2.15,TCP,60,9001  >  35978 [ACK] Seq=9830925 Ack=179404021 Win=65535 Len=0
1,1.497389000000112,62.210.85.178,10.0.2.15,TCP,60,9001  >  35978 [ACK] Seq=9830925 Ack=179405481 Win=65535 Len=0
1,1.4974600000005012,62.210.85.178,10.0.2.15,TCP,60,9001  >  35978 [ACK] Seq=9830925 Ack=179406631 Win=65535 Len=0
1,1.4975000000004002,10.0.2.15,62.210.85.178,TCP,2974,35978  >  9001 [ACK] Seq=179406631 Ack=9830925 Win=65535 Len=2920 [TCP segment of a reassembled PDU]
1,1.4975560000002588,10.0.2.15,62.210.85.178,TLSv1.2,1204,Application Data
1,1.4975899999999456,62.210.85.178,10.0.2.15,TCP,60,9001  >  35978 [ACK] Seq=9830925 Ack=179408091 Win=65535 Len=0
1,1.4975970000004963,62.210.85.178,10.0.2.15,TCP,60,9001  >  35978 [ACK] Seq=9830925 Ack=179409551 Win=65535 Len=0
1,1.49760200000037,62.210.85.178,10.0.2.15,TCP,60,9001  >  35978 [ACK] Seq=9830925 Ack=179410701 Win=65535 Len=0
1,1.4976470000001427,10.0.2.15,62.210.85.178,TLSv1.2,4124,Application Data
1,1.4976859999997032,62.210.85.178,10.0.2.15,TCP,60,9001  >  35978 [ACK] Seq=9830925 Ack=179412161 Win=65535 Len=0
1,1.4976919999999154,62.210.85.178,10.0.2.15,TCP,60,9001  >  35978 [ACK] Seq=9830925 Ack=179413621 Win=65535 Len=0
1,1.4977559999997538,10.0.2.15,62.210.85.178,TLSv1.2,2974,Application Data
1,1.4977959999996528,62.210.85.178,10.0.2.15,TCP,60,9001  >  35978 [ACK] Seq=9830925 Ack=179414771 Win=65535 Len=0
1,1.4978030000002036,62.210.85.178,10.0.2.15,TCP,60,9001  >  35978 [ACK] Seq=9830925 Ack=179416231 Win=65535 Len=0
1,1.4978080000000773,62.210.85.178,10.0.2.15,TCP,60,9001  >  35978 [ACK] Seq=9830925 Ack=179417691 Win=65535 Len=0
1,1.497841999999764,10.0.2.15,62.210.85.178,TLSv1.2,1226,Application Data
1,1.4978790000004665,62.210.85.178,10.0.2.15,TCP,60,9001  >  35978 [ACK] Seq=9830925 Ack=179418863 Win=65535 Len=0
1,1.4979240000002392,10.0.2.15,62.210.85.178,TLSv1.2,2966,Application Data
1,1.4979640000001382,62.210.85.178,10.0.2.15,TCP,60,9001  >  35978 [ACK] Seq=9830925 Ack=179420323 Win=65535 Len=0
1,1.4979700000003504,62.210.85.178,10.0.2.15,TCP,60,9001  >  35978 [ACK] Seq=9830925 Ack=179421775 Win=65535 Len=0
1,1.8929699999998775,54.93.77.70,10.0.2.15,TCP,2950,"9001  >  34692 [PSH, ACK] Seq=179260943 Ack=9873959 Win=65535 Len=2896 [TCP segment of a reassembled PDU]"
1,1.8931030000003375,10.0.2.15,54.93.77.70,TCP,54,34692  >  9001 [ACK] Seq=9873959 Ack=179263839 Win=65535 Len=0
1,1.895531000000119,54.93.77.70,10.0.2.15,TLSv1.2,778,Application Data
1,1.8978950000000623,54.93.77.70,10.0.2.15,TCP,2950,"9001  >  34692 [PSH, ACK] Seq=179264563 Ack=9873959 Win=65535 Len=2896 [TCP segment of a reassembled PDU]"
1,1.897954000000027,10.0.2.15,54.93.77.70,TCP,54,34692  >  9001 [ACK] Seq=9873959 Ack=179267459 Win=65535 Len=0
1,1.89865699999973,54.93.77.70,10.0.2.15,TLSv1.2,4398,"Application Data, Application Data"
1,1.8986729999996896,54.93.77.70,10.0.2.15,TLSv1.2,4398,Application Data
1,1.8987340000003314,10.0.2.15,54.93.77.70,TCP,54,34692  >  9001 [ACK] Seq=9873959 Ack=179276147 Win=65535 Len=0
1,1.9135690000002796,54.93.77.70,10.0.2.15,TLSv1.2,2950,Application Data [TCP segment of a reassembled PDU]
1,1.9136209999996936,10.0.2.15,54.93.77.70,TCP,54,34692  >  9001 [ACK] Seq=9873959 Ack=179279043 Win=65535 Len=0
1,1.9166199999999662,54.93.77.70,10.0.2.15,TLSv1.2,5774,"Application Data, Application Data, Application Data"
1,1.9166889999996783,10.0.2.15,54.93.77.70,TCP,54,34692  >  9001 [ACK] Seq=9873959 Ack=179284763 Win=65535 Len=0
1,1.9198409999999058,10.0.2.15,54.93.77.70,TLSv1.2,590,Application Data
1,1.920017000000371,54.93.77.70,10.0.2.15,TCP,60,9001  >  34692 [ACK] Seq=179284763 Ack=9874495 Win=65535 Len=0
1,2.0972529999999097,62.210.85.178,10.0.2.15,TLSv1.2,590,Application Data
1,2.09755800000039,10.0.2.15,62.210.85.178,TLSv1.2,590,Application Data
1,2.0976790000004257,62.210.85.178,10.0.2.15,TCP,60,9001  >  35978 [ACK] Seq=9831461 Ack=179422311 Win=65535 Len=0
1,2.19370600000002,54.93.77.70,10.0.2.15,TLSv1.2,590,Application Data
1,2.1941360000000714,10.0.2.15,54.93.77.70,TLSv1.2,590,Application Data
1,2.1942840000001524,54.93.77.70,10.0.2.15,TCP,60,9001  >  34692 [ACK] Seq=179285299 Ack=9875031 Win=65535 Len=0
1,2.3037210000002233,62.210.85.178,10.0.2.15,TLSv1.2,590,Application Data
1,2.308984000000237,10.0.2.15,62.210.85.178,TLSv1.2,590,Application Data
1,2.309164999999666,62.210.85.178,10.0.2.15,TCP,60,9001  >  35978 [ACK] Seq=9831997 Ack=179422847 Win=65535 Len=0
1,2.323793999999907,10.0.2.15,62.210.85.178,TLSv1.2,4124,Application Data
1,2.3239009999997506,10.0.2.15,62.210.85.178,TCP,2974,35978  >  9001 [ACK] Seq=179426917 Ack=9831997 Win=65535 Len=2920 [TCP segment of a reassembled PDU]
1,2.3239430000003267,62.210.85.178,10.0.2.15,TCP,60,9001  >  35978 [ACK] Seq=9831997 Ack=179424307 Win=65535 Len=0
1,2.3239540000004126,62.210.85.178,10.0.2.15,TCP,60,9001  >  35978 [ACK] Seq=9831997 Ack=179425767 Win=65535 Len=0
1,2.3239590000002863,62.210.85.178,10.0.2.15,TCP,60,9001  >  35978 [ACK] Seq=9831997 Ack=179426917 Win=65535 Len=0
1,2.3239629999998215,62.210.85.178,10.0.2.15,TCP,60,9001  >  35978 [ACK] Seq=9831997 Ack=179428377 Win=65535 Len=0
1,2.323967000000266,62.210.85.178,10.0.2.15,TCP,60,9001  >  35978 [ACK] Seq=9831997 Ack=179429837 Win=65535 Len=0
1,2.3240100000002712,10.0.2.15,62.210.85.178,TLSv1.2,1204,Application Data
1,2.324083999999857,62.210.85.178,10.0.2.15,TCP,60,9001  >  35978 [ACK] Seq=9831997 Ack=179430987 Win=65535 Len=0
1,2.324123999999756,10.0.2.15,62.210.85.178,TLSv1.2,4124,Application Data
1,2.324163000000226,62.210.85.178,10.0.2.15,TCP,60,9001  >  35978 [ACK] Seq=9831997 Ack=179432447 Win=65535 Len=0
1,2.3241699999998673,62.210.85.178,10.0.2.15,TCP,60,9001  >  35978 [ACK] Seq=9831997 Ack=179433907 Win=65535 Len=0
1,2.324174000000312,62.210.85.178,10.0.2.15,TCP,60,9001  >  35978 [ACK] Seq=9831997 Ack=179435057 Win=65535 Len=0
1,2.3242220000001907,10.0.2.15,62.210.85.178,TLSv1.2,4124,Application Data
1,2.324268000000302,62.210.85.178,10.0.2.15,TCP,60,9001  >  35978 [ACK] Seq=9831997 Ack=179436517 Win=65535 Len=0
1,2.3242749999999432,62.210.85.178,10.0.2.15,TCP,60,9001  >  35978 [ACK] Seq=9831997 Ack=179437977 Win=65535 Len=0
1,2.324279999999817,62.210.85.178,10.0.2.15,TCP,60,9001  >  35978 [ACK] Seq=9831997 Ack=179439127 Win=65535 Len=0
1,2.324322999999822,10.0.2.15,62.210.85.178,TLSv1.2,332,Application Data
1,2.324413000000277,62.210.85.178,10.0.2.15,TCP,60,9001  >  35978 [ACK] Seq=9831997 Ack=179439405 Win=65535 Len=0
1,2.32444200000009,10.0.2.15,62.210.85.178,TCP,2974,35978  >  9001 [ACK] Seq=179439405 Ack=9831997 Win=65535 Len=2920 [TCP segment of a reassembled PDU]
1,2.3244970000005196,10.0.2.15,62.210.85.178,TLSv1.2,754,Application Data
1,2.324532000000545,62.210.85.178,10.0.2.15,TCP,60,9001  >  35978 [ACK] Seq=9831997 Ack=179440865 Win=65535 Len=0
1,2.3245379999998477,62.210.85.178,10.0.2.15,TCP,60,9001  >  35978 [ACK] Seq=9831997 Ack=179442325 Win=65535 Len=0
1,2.3245429999997214,62.210.85.178,10.0.2.15,TCP,60,9001  >  35978 [ACK] Seq=9831997 Ack=179443025 Win=65535 Len=0
1,2.43075300000055,54.93.77.70,10.0.2.15,TLSv1.2,590,Application Data
1,2.4374159999997573,54.93.77.70,10.0.2.15,TLSv1.2,7294,Application Data
1,2.4374980000002324,10.0.2.15,54.93.77.70,TCP,54,34692  >  9001 [ACK] Seq=9875031 Ack=179293075 Win=65535 Len=0
1,2.4563880000005156,54.93.77.70,10.0.2.15,TLSv1.2,568,Application Data
1,2.45828100000017,54.93.77.70,10.0.2.15,TCP,2950,"9001  >  34692 [PSH, ACK] Seq=179293589 Ack=9875031 Win=65535 Len=2896 [TCP segment of a reassembled PDU]"
1,2.4583309999998164,10.0.2.15,54.93.77.70,TCP,54,34692  >  9001 [ACK] Seq=9875031 Ack=179296485 Win=65535 Len=0
1,2.466374000000542,54.93.77.70,10.0.2.15,TLSv1.2,7294,"Application Data, Application Data"
1,2.4664560000001075,10.0.2.15,54.93.77.70,TCP,54,34692  >  9001 [ACK] Seq=9875031 Ack=179303725 Win=65535 Len=0
1,2.466634999999769,10.0.2.15,54.93.77.70,TLSv1.2,590,Application Data
1,2.46674400000029,54.93.77.70,10.0.2.15,TCP,60,9001  >  34692 [ACK] Seq=179303725 Ack=9875567 Win=65535 Len=0
1,2.473931000000448,54.93.77.70,10.0.2.15,TLSv1.2,1292,Application Data
1,2.515172999999777,10.0.2.15,54.93.77.70,TCP,54,34692  >  9001 [ACK] Seq=9875567 Ack=179304963 Win=65535 Len=0
1,2.532774000000245,54.93.77.70,10.0.2.15,TLSv1.2,1104,Application Data
1,2.5329579999997804,10.0.2.15,54.93.77.70,TCP,54,34692  >  9001 [ACK] Seq=9875567 Ack=179306013 Win=65535 Len=0
1,2.5366329999997106,10.0.2.15,54.93.77.70,TLSv1.2,590,Application Data
1,2.5368650000000343,54.93.77.70,10.0.2.15,TCP,60,9001  >  34692 [ACK] Seq=179306013 Ack=9876103 Win=65535 Len=0
1,2.5902420000002166,62.210.85.178,10.0.2.15,TLSv1.2,590,Application Data
1,2.6311610000002474,10.0.2.15,62.210.85.178,TCP,54,35978  >  9001 [ACK] Seq=179443025 Ack=9832533 Win=65535 Len=0
1,2.649413000000095,62.210.85.178,10.0.2.15,TLSv1.2,590,Application Data
1,2.649478000000272,10.0.2.15,62.210.85.178,TCP,54,35978  >  9001 [ACK] Seq=179443025 Ack=9833069 Win=65535 Len=0
1,2.649996000000101,10.0.2.15,62.210.85.178,TLSv1.2,590,Application Data
1,2.650137000000541,62.210.85.178,10.0.2.15,TCP,60,9001  >  35978 [ACK] Seq=9833069 Ack=179443561 Win=65535 Len=0
1,2.734915000000001,54.93.77.70,10.0.2.15,TLSv1.2,590,Application Data
1,2.7353220000004512,10.0.2.15,54.93.77.70,TLSv1.2,590,Application Data
1,2.735453000000234,54.93.77.70,10.0.2.15,TCP,60,9001  >  34692 [ACK] Seq=179306549 Ack=9876639 Win=65535 Len=0
1,2.8591489999998885,62.210.85.178,10.0.2.15,TLSv1.2,590,Application Data
1,2.867384000000129,10.0.2.15,62.210.85.178,TLSv1.2,590,Application Data
1,2.868930999999975,62.210.85.178,10.0.2.15,TCP,60,9001  >  35978 [ACK] Seq=9833605 Ack=179444097 Win=65535 Len=0
1,2.8800899999996545,10.0.2.15,62.210.85.178,TLSv1.2,4124,Application Data
1,2.8801860000003217,10.0.2.15,62.210.85.178,TCP,2974,35978  >  9001 [ACK] Seq=179448167 Ack=9833605 Win=65535 Len=2920 [TCP segment of a reassembled PDU]
1,2.8802260000002207,62.210.85.178,10.0.2.15,TCP,60,9001  >  35978 [ACK] Seq=9833605 Ack=179445557 Win=65535 Len=0
1,2.8802450000002864,62.210.85.178,10.0.2.15,TCP,60,9001  >  35978 [ACK] Seq=9833605 Ack=179447017 Win=65535 Len=0
1,2.88025000000016,62.210.85.178,10.0.2.15,TCP,60,9001  >  35978 [ACK] Seq=9833605 Ack=179448167 Win=65535 Len=0
1,2.8802539999996952,62.210.85.178,10.0.2.15,TCP,60,9001  >  35978 [ACK] Seq=9833605 Ack=179449627 Win=65535 Len=0
1,2.880264999999781,62.210.85.178,10.0.2.15,TCP,60,9001  >  35978 [ACK] Seq=9833605 Ack=179451087 Win=65535 Len=0
1,2.8803079999997863,10.0.2.15,62.210.85.178,TLSv1.2,1204,Application Data
1,2.880377000000408,10.0.2.15,62.210.85.178,TCP,2974,35978  >  9001 [ACK] Seq=179452237 Ack=9833605 Win=65535 Len=2920 [TCP segment of a reassembled PDU]
1,2.8804159999999683,62.210.85.178,10.0.2.15,TCP,60,9001  >  35978 [ACK] Seq=9833605 Ack=179452237 Win=65535 Len=0
1,2.880423000000519,62.210.85.178,10.0.2.15,TCP,60,9001  >  35978 [ACK] Seq=9833605 Ack=179453697 Win=65535 Len=0
1,2.8804270000000542,62.210.85.178,10.0.2.15,TCP,60,9001  >  35978 [ACK] Seq=9833605 Ack=179455157 Win=65535 Len=0
1,2.8804620000000796,10.0.2.15,62.210.85.178,TLSv1.2,1204,Application Data
1,2.8805270000002565,10.0.2.15,62.210.85.178,TCP,2974,35978  >  9001 [ACK] Seq=179456307 Ack=9833605 Win=65535 Len=2920 [TCP segment of a reassembled PDU]
1,2.880562000000282,62.210.85.178,10.0.2.15,TCP,60,9001  >  35978 [ACK] Seq=9833605 Ack=179456307 Win=65535 Len=0
1,2.880568999999923,62.210.85.178,10.0.2.15,TCP,60,9001  >  35978 [ACK] Seq=9833605 Ack=179457767 Win=65535 Len=0
1,2.880573999999797,62.210.85.178,10.0.2.15,TCP,60,9001  >  35978 [ACK] Seq=9833605 Ack=179459227 Win=65535 Len=0
1,2.880605000000287,10.0.2.15,62.210.85.178,TLSv1.2,1204,Application Data
1,2.8806830000003174,10.0.2.15,62.210.85.178,TLSv1.2,2974,Application Data
1,2.8807200000001103,62.210.85.178,10.0.2.15,TCP,60,9001  >  35978 [ACK] Seq=9833605 Ack=179460377 Win=65535 Len=0
1,2.8807269999997516,62.210.85.178,10.0.2.15,TCP,60,9001  >  35978 [ACK] Seq=9833605 Ack=179461837 Win=65535 Len=0
1,2.8807320000005348,62.210.85.178,10.0.2.15,TCP,60,9001  >  35978 [ACK] Seq=9833605 Ack=179463297 Win=65535 Len=0
1,2.8807630000001154,10.0.2.15,62.210.85.178,TLSv1.2,1226,Application Data
1,2.880826000000525,10.0.2.15,62.210.85.178,TCP,2974,35978  >  9001 [ACK] Seq=179464469 Ack=9833605 Win=65535 Len=2920 [TCP segment of a reassembled PDU]
1,2.880861999999979,62.210.85.178,10.0.2.15,TCP,60,9001  >  35978 [ACK] Seq=9833605 Ack=179464469 Win=65535 Len=0
1,2.88086900000053,62.210.85.178,10.0.2.15,TCP,60,9001  >  35978 [ACK] Seq=9833605 Ack=179465929 Win=65535 Len=0
1,2.8808740000004036,62.210.85.178,10.0.2.15,TCP,60,9001  >  35978 [ACK] Seq=9833605 Ack=179467389 Win=65535 Len=0
1,2.8809049999999843,10.0.2.15,62.210.85.178,TLSv1.2,1204,Application Data
1,2.880941000000348,62.210.85.178,10.0.2.15,TCP,60,9001  >  35978 [ACK] Seq=9833605 Ack=179468539 Win=65535 Len=0
1,2.880986000000121,10.0.2.15,62.210.85.178,TLSv1.2,3030,Application Data
1,2.8810270000003584,62.210.85.178,10.0.2.15,TCP,60,9001  >  35978 [ACK] Seq=9833605 Ack=179469999 Win=65535 Len=0
1,2.881032999999661,62.210.85.178,10.0.2.15,TCP,60,9001  >  35978 [ACK] Seq=9833605 Ack=179471459 Win=65535 Len=0
1,2.881040000000212,62.210.85.178,10.0.2.15,TCP,60,9001  >  35978 [ACK] Seq=9833605 Ack=179471515 Win=65535 Len=0
1,2.890215999999782,10.0.2.15,62.210.85.178,TLSv1.2,4124,Application Data
1,2.890295000000151,10.0.2.15,62.210.85.178,TCP,2974,35978  >  9001 [ACK] Seq=179475585 Ack=9833605 Win=65535 Len=2920 [TCP segment of a reassembled PDU]
1,2.8903330000002825,62.210.85.178,10.0.2.15,TCP,60,9001  >  35978 [ACK] Seq=9833605 Ack=179472975 Win=65535 Len=0
1,2.8903410000002623,62.210.85.178,10.0.2.15,TCP,60,9001  >  35978 [ACK] Seq=9833605 Ack=179474435 Win=65535 Len=0
1,2.8903449999997974,62.210.85.178,10.0.2.15,TCP,60,9001  >  35978 [ACK] Seq=9833605 Ack=179475585 Win=65535 Len=0
1,2.890349999999671,62.210.85.178,10.0.2.15,TCP,60,9001  >  35978 [ACK] Seq=9833605 Ack=179477045 Win=65535 Len=0
1,2.8903540000001158,62.210.85.178,10.0.2.15,TCP,60,9001  >  35978 [ACK] Seq=9833605 Ack=179478505 Win=65535 Len=0
1,2.890394000000015,10.0.2.15,62.210.85.178,TLSv1.2,1204,Application Data
1,2.8904609999999593,10.0.2.15,62.210.85.178,TCP,2974,35978  >  9001 [ACK] Seq=179479655 Ack=9833605 Win=65535 Len=2920 [TCP segment of a reassembled PDU]
1,2.890497000000323,62.210.85.178,10.0.2.15,TCP,60,9001  >  35978 [ACK] Seq=9833605 Ack=179479655 Win=65535 Len=0
1,2.8905030000005354,62.210.85.178,10.0.2.15,TCP,60,9001  >  35978 [ACK] Seq=9833605 Ack=179481115 Win=65535 Len=0
1,2.890508000000409,62.210.85.178,10.0.2.15,TCP,60,9001  >  35978 [ACK] Seq=9833605 Ack=179482575 Win=65535 Len=0
1,2.890542000000096,10.0.2.15,62.210.85.178,TLSv1.2,1204,Application Data
1,2.8906050000005052,10.0.2.15,62.210.85.178,TCP,2974,35978  >  9001 [ACK] Seq=179483725 Ack=9833605 Win=65535 Len=2920 [TCP segment of a reassembled PDU]
1,2.8906400000005306,62.210.85.178,10.0.2.15,TCP,60,9001  >  35978 [ACK] Seq=9833605 Ack=179483725 Win=65535 Len=0
1,2.8906459999998333,62.210.85.178,10.0.2.15,TCP,60,9001  >  35978 [ACK] Seq=9833605 Ack=179485185 Win=65535 Len=0
1,2.890650999999707,62.210.85.178,10.0.2.15,TCP,60,9001  >  35978 [ACK] Seq=9833605 Ack=179486645 Win=65535 Len=0
1,2.890682000000197,10.0.2.15,62.210.85.178,TLSv1.2,1204,Application Data
1,2.8907740000004196,10.0.2.15,62.210.85.178,TLSv1.2,2974,Application Data
1,2.8907970000000205,62.210.85.178,10.0.2.15,TCP,60,9001  >  35978 [ACK] Seq=9833605 Ack=179487795 Win=65535 Len=0
1,2.8908289999999397,10.0.2.15,62.210.85.178,TLSv1.2,1226,Application Data
1,2.8908680000004097,62.210.85.178,10.0.2.15,TCP,60,9001  >  35978 [ACK] Seq=9833605 Ack=179489255 Win=65535 Len=0
1,2.890875000000051,62.210.85.178,10.0.2.15,TCP,60,9001  >  35978 [ACK] Seq=9833605 Ack=179490715 Win=65535 Len=0
1,2.8908790000004956,62.210.85.178,10.0.2.15,TCP,60,9001  >  35978 [ACK] Seq=9833605 Ack=179491887 Win=65535 Len=0
1,2.8909229999999297,10.0.2.15,62.210.85.178,TLSv1.2,4124,Application Data
1,2.8909629999998288,62.210.85.178,10.0.2.15,TCP,60,9001  >  35978 [ACK] Seq=9833605 Ack=179493347 Win=65535 Len=0
1,2.8909700000003795,62.210.85.178,10.0.2.15,TCP,60,9001  >  35978 [ACK] Seq=9833605 Ack=179494807 Win=65535 Len=0
1,2.8909739999999147,62.210.85.178,10.0.2.15,TCP,60,9001  >  35978 [ACK] Seq=9833605 Ack=179495957 Win=65535 Len=0
1,2.891020000000026,10.0.2.15,62.210.85.178,TLSv1.2,3030,Application Data
1,2.8910580000001573,62.210.85.178,10.0.2.15,TCP,60,9001  >  35978 [ACK] Seq=9833605 Ack=179497417 Win=65535 Len=0
1,2.8910649999997986,62.210.85.178,10.0.2.15,TCP,60,9001  >  35978 [ACK] Seq=9833605 Ack=179498877 Win=65535 Len=0
1,2.8910690000002432,62.210.85.178,10.0.2.15,TCP,60,9001  >  35978 [ACK] Seq=9833605 Ack=179498933 Win=65535 Len=0
1,2.9034700000001976,10.0.2.15,62.210.85.178,TLSv1.2,2646,Application Data
1,2.9035750000002736,62.210.85.178,10.0.2.15,TCP,60,9001  >  35978 [ACK] Seq=9833605 Ack=179500393 Win=65535 Len=0
1,2.903588000000127,62.210.85.178,10.0.2.15,TCP,60,9001  >  35978 [ACK] Seq=9833605 Ack=179501525 Win=65535 Len=0
1,3.020328000000518,54.93.77.70,10.0.2.15,TLSv1.2,590,Application Data
1,3.0632320000004256,10.0.2.15,54.93.77.70,TCP,54,34692  >  9001 [ACK] Seq=9876639 Ack=179307085 Win=65535 Len=0
1,3.087728999999854,54.93.77.70,10.0.2.15,TLSv1.2,3674,Application Data
1,3.087797000000137,10.0.2.15,54.93.77.70,TCP,54,34692  >  9001 [ACK] Seq=9876639 Ack=179310705 Win=65535 Len=0
1,3.120998000000327,54.93.77.70,10.0.2.15,TCP,2950,"9001  >  34692 [PSH, ACK] Seq=179310705 Ack=9876639 Win=65535 Len=2896 [TCP segment of a reassembled PDU]"
1,3.121075000000019,10.0.2.15,54.93.77.70,TCP,54,34692  >  9001 [ACK] Seq=9876639 Ack=179313601 Win=65535 Len=0
1,3.1229160000002594,54.93.77.70,10.0.2.15,TLSv1.2,5846,"Application Data, Application Data"
1,3.122961000000032,10.0.2.15,54.93.77.70,TCP,54,34692  >  9001 [ACK] Seq=9876639 Ack=179319393 Win=65535 Len=0
1,3.1231760000000577,54.93.77.70,10.0.2.15,TCP,1502,"9001  >  34692 [PSH, ACK] Seq=179319393 Ack=9876639 Win=65535 Len=1448 [TCP segment of a reassembled PDU]"
1,3.1232099999997445,10.0.2.15,54.93.77.70,TCP,54,34692  >  9001 [ACK] Seq=9876639 Ack=179320841 Win=65535 Len=0
1,3.1301610000000437,54.93.77.70,10.0.2.15,TLSv1.2,2950,Application Data [TCP segment of a reassembled PDU]
1,3.130235000000539,10.0.2.15,54.93.77.70,TCP,54,34692  >  9001 [ACK] Seq=9876639 Ack=179323737 Win=65535 Len=0
1,3.1312920000000304,54.93.77.70,10.0.2.15,TLSv1.2,5846,Application Data [TCP segment of a reassembled PDU]
1,3.1313350000000355,10.0.2.15,54.93.77.70,TCP,54,34692  >  9001 [ACK] Seq=9876639 Ack=179329529 Win=65535 Len=0
1,3.1373249999996915,54.93.77.70,10.0.2.15,TLSv1.2,894,"Application Data, Application Data"
1,3.1373810000004596,10.0.2.15,54.93.77.70,TCP,54,34692  >  9001 [ACK] Seq=9876639 Ack=179330369 Win=65535 Len=0
1,3.1426970000002257,54.93.77.70,10.0.2.15,TCP,2950,"9001  >  34692 [PSH, ACK] Seq=179330369 Ack=9876639 Win=65535 Len=2896 [TCP segment of a reassembled PDU]"
1,3.1427510000003167,10.0.2.15,54.93.77.70,TCP,54,34692  >  9001 [ACK] Seq=9876639 Ack=179333265 Win=65535 Len=0
1,3.1556179999997767,54.93.77.70,10.0.2.15,TLSv1.2,1314,"Application Data, Application Data"
1,3.155692999999701,10.0.2.15,54.93.77.70,TCP,54,34692  >  9001 [ACK] Seq=9876639 Ack=179334525 Win=65535 Len=0
1,3.1559260000003633,10.0.2.15,54.93.77.70,TLSv1.2,590,Application Data
1,3.1560070000005,54.93.77.70,10.0.2.15,TCP,60,9001  >  34692 [ACK] Seq=179334525 Ack=9877175 Win=65535 Len=0
1,3.1628689999997732,54.93.77.70,10.0.2.15,TCP,2950,"9001  >  34692 [PSH, ACK] Seq=179334525 Ack=9877175 Win=65535 Len=2896 [TCP segment of a reassembled PDU]"
1,3.162919000000329,10.0.2.15,54.93.77.70,TCP,54,34692  >  9001 [ACK] Seq=9877175 Ack=179337421 Win=65535 Len=0
1,3.1723659999997835,54.93.77.70,10.0.2.15,TLSv1.2,264,Application Data
1,3.18463200000042,54.93.77.70,10.0.2.15,TLSv1.2,7294,Application Data
1,3.184704000000238,10.0.2.15,54.93.77.70,TCP,54,34692  >  9001 [ACK] Seq=9877175 Ack=179344871 Win=65535 Len=0
1,3.195064999999886,54.93.77.70,10.0.2.15,TLSv1.2,7294,"Application Data, Application Data"
1,3.195107999999891,10.0.2.15,54.93.77.70,TCP,54,34692  >  9001 [ACK] Seq=9877175 Ack=179352111 Win=65535 Len=0
1,3.201546000000235,54.93.77.70,10.0.2.15,TLSv1.2,1082,Application Data
1,3.2016890000004423,10.0.2.15,54.93.77.70,TLSv1.2,590,Application Data
1,3.2017660000001342,54.93.77.70,10.0.2.15,TCP,60,9001  >  34692 [ACK] Seq=179353139 Ack=9877711 Win=65535 Len=0
1,3.2130889999998544,54.93.77.70,10.0.2.15,TLSv1.2,7294,Application Data
1,3.213169999999991,10.0.2.15,54.93.77.70,TCP,54,34692  >  9001 [ACK] Seq=9877711 Ack=179360379 Win=65535 Len=0
1,3.222541000000092,54.93.77.70,10.0.2.15,TLSv1.2,568,Application Data
1,3.2226900000005116,10.0.2.15,54.93.77.70,TLSv1.2,590,Application Data
1,3.222765999999865,54.93.77.70,10.0.2.15,TCP,60,9001  >  34692 [ACK] Seq=179360893 Ack=9878247 Win=65535 Len=0
1,3.2336820000000444,54.93.77.70,10.0.2.15,TCP,1502,"9001  >  34692 [PSH, ACK] Seq=179360893 Ack=9878247 Win=65535 Len=1448 [TCP segment of a reassembled PDU]"
1,3.2338129999998273,10.0.2.15,54.93.77.70,TCP,54,34692  >  9001 [ACK] Seq=9878247 Ack=179362341 Win=65535 Len=0
1,3.2422169999999824,54.93.77.70,10.0.2.15,TLSv1.2,684,Application Data
1,3.243430999999873,54.93.77.70,10.0.2.15,TCP,1502,"9001  >  34692 [PSH, ACK] Seq=179362971 Ack=9878247 Win=65535 Len=1448 [TCP segment of a reassembled PDU]"
1,3.2435139999997773,10.0.2.15,54.93.77.70,TCP,54,34692  >  9001 [ACK] Seq=9878247 Ack=179364419 Win=65535 Len=0
1,3.258461000000352,54.93.77.70,10.0.2.15,TLSv1.2,170,Application Data
1,3.2611690000003364,10.0.2.15,54.93.77.70,TLSv1.2,590,Application Data
1,3.2613140000003114,54.93.77.70,10.0.2.15,TCP,60,9001  >  34692 [ACK] Seq=179364535 Ack=9878783 Win=65535 Len=0
1,3.3063069999998334,62.210.85.178,10.0.2.15,TLSv1.2,590,Application Data
1,3.347171999999773,10.0.2.15,62.210.85.178,TCP,54,35978  >  9001 [ACK] Seq=179501525 Ack=9834141 Win=65535 Len=0
1,3.383676000000378,62.210.85.178,10.0.2.15,TLSv1.2,1104,Application Data
1,3.38374500000009,10.0.2.15,62.210.85.178,TCP,54,35978  >  9001 [ACK] Seq=179501525 Ack=9835191 Win=65535 Len=0
1,3.4215210000002116,62.210.85.178,10.0.2.15,TLSv1.2,590,Application Data
1,3.4215720000001966,10.0.2.15,62.210.85.178,TCP,54,35978  >  9001 [ACK] Seq=179501525 Ack=9835727 Win=65535 Len=0
1,3.422070000000531,10.0.2.15,62.210.85.178,TLSv1.2,590,Application Data
1,3.4222030000000814,62.210.85.178,10.0.2.15,TCP,60,9001  >  35978 [ACK] Seq=9835727 Ack=179502061 Win=65535 Len=0
1,3.5328150000004825,54.93.77.70,10.0.2.15,TLSv1.2,590,Application Data
1,3.533269000000473,10.0.2.15,54.93.77.70,TLSv1.2,590,Application Data
1,3.533408000000236,54.93.77.70,10.0.2.15,TCP,60,9001  >  34692 [ACK] Seq=179365071 Ack=9879319 Win=65535 Len=0
1,3.7389469999998255,62.210.85.178,10.0.2.15,TLSv1.2,590,Application Data
1,3.7495920000001206,10.0.2.15,62.210.85.178,TLSv1.2,590,Application Data
1,3.7497339999999895,62.210.85.178,10.0.2.15,TCP,60,9001  >  35978 [ACK] Seq=9836263 Ack=179502597 Win=65535 Len=0
1,3.759957000000213,10.0.2.15,62.210.85.178,TLSv1.2,4124,Application Data
1,3.7600689999999304,10.0.2.15,62.210.85.178,TCP,2974,35978  >  9001 [ACK] Seq=179506667 Ack=9836263 Win=65535 Len=2920 [TCP segment of a reassembled PDU]
1,3.760110000000168,62.210.85.178,10.0.2.15,TCP,60,9001  >  35978 [ACK] Seq=9836263 Ack=179504057 Win=65535 Len=0
1,3.7601230000000214,62.210.85.178,10.0.2.15,TCP,60,9001  >  35978 [ACK] Seq=9836263 Ack=179505517 Win=65535 Len=0
1,3.760127000000466,62.210.85.178,10.0.2.15,TCP,60,9001  >  35978 [ACK] Seq=9836263 Ack=179506667 Win=65535 Len=0
1,3.7601299999996627,62.210.85.178,10.0.2.15,TCP,60,9001  >  35978 [ACK] Seq=9836263 Ack=179508127 Win=65535 Len=0
1,3.760132999999769,62.210.85.178,10.0.2.15,TCP,60,9001  >  35978 [ACK] Seq=9836263 Ack=179509587 Win=65535 Len=0
1,3.760167000000365,10.0.2.15,62.210.85.178,TLSv1.2,1204,Application Data
1,3.7602029999998194,62.210.85.178,10.0.2.15,TCP,60,9001  >  35978 [ACK] Seq=9836263 Ack=179510737 Win=65535 Len=0
1,3.760247000000163,10.0.2.15,62.210.85.178,TLSv1.2,4124,Application Data
1,3.7602969999998095,62.210.85.178,10.0.2.15,TCP,60,9001  >  35978 [ACK] Seq=9836263 Ack=179512197 Win=65535 Len=0
1,3.7603049999997893,62.210.85.178,10.0.2.15,TCP,60,9001  >  35978 [ACK] Seq=9836263 Ack=179513657 Win=65535 Len=0
1,3.760309000000234,62.210.85.178,10.0.2.15,TCP,60,9001  >  35978 [ACK] Seq=9836263 Ack=179514807 Win=65535 Len=0
1,3.7603479999997944,10.0.2.15,62.210.85.178,TLSv1.2,4124,Application Data
1,3.7603820000003907,62.210.85.178,10.0.2.15,TCP,60,9001  >  35978 [ACK] Seq=9836263 Ack=179516267 Win=65535 Len=0
1,3.7603900000003705,62.210.85.178,10.0.2.15,TCP,60,9001  >  35978 [ACK] Seq=9836263 Ack=179517727 Win=65535 Len=0
1,3.7604479999999967,10.0.2.15,62.210.85.178,TLSv1.2,2974,Application Data
1,3.7604870000004667,62.210.85.178,10.0.2.15,TCP,60,9001  >  35978 [ACK] Seq=9836263 Ack=179518877 Win=65535 Len=0
1,3.760494000000108,62.210.85.178,10.0.2.15,TCP,60,9001  >  35978 [ACK] Seq=9836263 Ack=179520337 Win=65535 Len=0
1,3.760497000000214,62.210.85.178,10.0.2.15,TCP,60,9001  >  35978 [ACK] Seq=9836263 Ack=179521797 Win=65535 Len=0
1,3.7605240000002595,10.0.2.15,62.210.85.178,TLSv1.2,1226,Application Data
1,3.7605570000005173,62.210.85.178,10.0.2.15,TCP,60,9001  >  35978 [ACK] Seq=9836263 Ack=179522969 Win=65535 Len=0
1,3.7605960000000778,10.0.2.15,62.210.85.178,TLSv1.2,4124,Application Data
1,3.760631000000103,62.210.85.178,10.0.2.15,TCP,60,9001  >  35978 [ACK] Seq=9836263 Ack=179524429 Win=65535 Len=0
1,3.7606370000003153,62.210.85.178,10.0.2.15,TCP,60,9001  >  35978 [ACK] Seq=9836263 Ack=179525889 Win=65535 Len=0
1,3.7606400000004214,62.210.85.178,10.0.2.15,TCP,60,9001  >  35978 [ACK] Seq=9836263 Ack=179527039 Win=65535 Len=0
1,3.760675999999876,10.0.2.15,62.210.85.178,TLSv1.2,3030,Application Data
1,3.760710999999901,62.210.85.178,10.0.2.15,TCP,60,9001  >  35978 [ACK] Seq=9836263 Ack=179528499 Win=65535 Len=0
1,3.7607170000001133,62.210.85.178,10.0.2.15,TCP,60,9001  >  35978 [ACK] Seq=9836263 Ack=179529959 Win=65535 Len=0
1,3.7607200000002194,62.210.85.178,10.0.2.15,TCP,60,9001  >  35978 [ACK] Seq=9836263 Ack=179530015 Win=65535 Len=0
1,3.7699039999997694,10.0.2.15,62.210.85.178,TLSv1.2,4124,Application Data
1,3.769951000000219,62.210.85.178,10.0.2.15,TCP,60,9001  >  35978 [ACK] Seq=9836263 Ack=179531475 Win=65535 Len=0
1,3.7699600000005375,62.210.85.178,10.0.2.15,TCP,60,9001  >  35978 [ACK] Seq=9836263 Ack=179532935 Win=65535 Len=0
1,3.7699650000004112,62.210.85.178,10.0.2.15,TCP,60,9001  >  35978 [ACK] Seq=9836263 Ack=179534085 Win=65535 Len=0
1,3.7700059999997393,10.0.2.15,62.210.85.178,TLSv1.2,4124,Application Data
1,3.7700720000002548,62.210.85.178,10.0.2.15,TCP,60,9001  >  35978 [ACK] Seq=9836263 Ack=179535545 Win=65535 Len=0
1,3.7700800000002346,62.210.85.178,10.0.2.15,TCP,60,9001  >  35978 [ACK] Seq=9836263 Ack=179537005 Win=65535 Len=0
1,3.7700839999997697,62.210.85.178,10.0.2.15,TCP,60,9001  >  35978 [ACK] Seq=9836263 Ack=179538155 Win=65535 Len=0
1,3.7701170000000275,10.0.2.15,62.210.85.178,TLSv1.2,4124,Application Data
1,3.7701509999997143,62.210.85.178,10.0.2.15,TCP,60,9001  >  35978 [ACK] Seq=9836263 Ack=179539615 Win=65535 Len=0
1,3.770158999999694,62.210.85.178,10.0.2.15,TCP,60,9001  >  35978 [ACK] Seq=9836263 Ack=179541075 Win=65535 Len=0
1,3.7701619999998,62.210.85.178,10.0.2.15,TCP,60,9001  >  35978 [ACK] Seq=9836263 Ack=179542225 Win=65535 Len=0
1,3.770198000000164,10.0.2.15,62.210.85.178,TLSv1.2,4124,Application Data
1,3.7702310000004218,62.210.85.178,10.0.2.15,TCP,60,9001  >  35978 [ACK] Seq=9836263 Ack=179543685 Win=65535 Len=0
1,3.7702390000004016,62.210.85.178,10.0.2.15,TCP,60,9001  >  35978 [ACK] Seq=9836263 Ack=179545145 Win=65535 Len=0
1,3.7702429999999367,62.210.85.178,10.0.2.15,TCP,60,9001  >  35978 [ACK] Seq=9836263 Ack=179546295 Win=65535 Len=0
1,3.7702760000001945,10.0.2.15,62.210.85.178,TLSv1.2,332,Application Data
1,3.7703099999998813,62.210.85.178,10.0.2.15,TCP,60,9001  >  35978 [ACK] Seq=9836263 Ack=179546573 Win=65535 Len=0
1,3.770360000000437,10.0.2.15,62.210.85.178,TLSv1.2,3868,Application Data
1,3.7703950000004625,62.210.85.178,10.0.2.15,TCP,60,9001  >  35978 [ACK] Seq=9836263 Ack=179548033 Win=65535 Len=0
1,3.7704030000004423,62.210.85.178,10.0.2.15,TCP,60,9001  >  35978 [ACK] Seq=9836263 Ack=179549493 Win=65535 Len=0
1,3.7704060000005484,62.210.85.178,10.0.2.15,TCP,60,9001  >  35978 [ACK] Seq=9836263 Ack=179550387 Win=65535 Len=0
1,3.770448000000215,10.0.2.15,62.210.85.178,TLSv1.2,4124,Application Data
1,3.7704819999999017,62.210.85.178,10.0.2.15,TCP,60,9001  >  35978 [ACK] Seq=9836263 Ack=179551847 Win=65535 Len=0
1,3.7704890000004525,62.210.85.178,10.0.2.15,TCP,60,9001  >  35978 [ACK] Seq=9836263 Ack=179553307 Win=65535 Len=0
1,3.7704929999999877,62.210.85.178,10.0.2.15,TCP,60,9001  >  35978 [ACK] Seq=9836263 Ack=179554457 Win=65535 Len=0
1,3.7705269999996744,10.0.2.15,62.210.85.178,TLSv1.2,3030,Application Data
1,3.7705619999996998,62.210.85.178,10.0.2.15,TCP,60,9001  >  35978 [ACK] Seq=9836263 Ack=179555917 Win=65535 Len=0
1,3.770567999999912,62.210.85.178,10.0.2.15,TCP,60,9001  >  35978 [ACK] Seq=9836263 Ack=179557377 Win=65535 Len=0
1,3.770571000000018,62.210.85.178,10.0.2.15,TCP,60,9001  >  35978 [ACK] Seq=9836263 Ack=179557433 Win=65535 Len=0
1,3.7841779999998835,10.0.2.15,62.210.85.178,TLSv1.2,4124,Application Data
1,3.7842820000005304,10.0.2.15,62.210.85.178,TCP,2974,35978  >  9001 [ACK] Seq=179561503 Ack=9836263 Win=65535 Len=2920 [TCP segment of a reassembled PDU]
1,3.7843050000001313,62.210.85.178,10.0.2.15,TCP,60,9001  >  35978 [ACK] Seq=9836263 Ack=179558893 Win=65535 Len=0
1,3.7843140000004496,62.210.85.178,10.0.2.15,TCP,60,9001  >  35978 [ACK] Seq=9836263 Ack=179560353 Win=65535 Len=0
1,3.7843190000003233,62.210.85.178,10.0.2.15,TCP,60,9001  >  35978 [ACK] Seq=9836263 Ack=179561503 Win=65535 Len=0
1,3.784324000000197,62.210.85.178,10.0.2.15,TCP,60,9001  >  35978 [ACK] Seq=9836263 Ack=179562963 Win=65535 Len=0
1,3.784327999999732,62.210.85.178,10.0.2.15,TCP,60,9001  >  35978 [ACK] Seq=9836263 Ack=179564423 Win=65535 Len=0
1,3.784364000000096,10.0.2.15,62.210.85.178,TLSv1.2,1204,Application Data
1,3.7843979999997828,62.210.85.178,10.0.2.15,TCP,60,9001  >  35978 [ACK] Seq=9836263 Ack=179565573 Win=65535 Len=0
1,3.7844420000001264,10.0.2.15,62.210.85.178,TLSv1.2,4124,Application Data
1,3.7844770000001517,62.210.85.178,10.0.2.15,TCP,60,9001  >  35978 [ACK] Seq=9836263 Ack=179567033 Win=65535 Len=0
1,3.7844850000001315,62.210.85.178,10.0.2.15,TCP,60,9001  >  35978 [ACK] Seq=9836263 Ack=179568493 Win=65535 Len=0
1,3.7844889999996667,62.210.85.178,10.0.2.15,TCP,60,9001  >  35978 [ACK] Seq=9836263 Ack=179569643 Win=65535 Len=0
1,3.784526999999798,10.0.2.15,62.210.85.178,TLSv1.2,4124,Application Data
1,3.7845610000003944,62.210.85.178,10.0.2.15,TCP,60,9001  >  35978 [ACK] Seq=9836263 Ack=179571103 Win=65535 Len=0
1,3.784569000000374,62.210.85.178,10.0.2.15,TCP,60,9001  >  35978 [ACK] Seq=9836263 Ack=179572563 Win=65535 Len=0
1,3.7845729999999094,62.210.85.178,10.0.2.15,TCP,60,9001  >  35978 [ACK] Seq=9836263 Ack=179573713 Win=65535 Len=0
1,3.7846070000005056,10.0.2.15,62.210.85.178,TLSv1.2,332,Application Data
1,3.784642000000531,62.210.85.178,10.0.2.15,TCP,60,9001  >  35978 [ACK] Seq=9836263 Ack=179573991 Win=65535 Len=0
1,3.7846980000003896,10.0.2.15,62.210.85.178,TLSv1.2,3868,Application Data
1,3.784733000000415,62.210.85.178,10.0.2.15,TCP,60,9001  >  35978 [ACK] Seq=9836263 Ack=179575451 Win=65535 Len=0
1,3.7847410000003947,62.210.85.178,10.0.2.15,TCP,60,9001  >  35978 [ACK] Seq=9836263 Ack=179576911 Win=65535 Len=0
1,3.78474499999993,62.210.85.178,10.0.2.15,TCP,60,9001  >  35978 [ACK] Seq=9836263 Ack=179577805 Win=65535 Len=0
1,3.7847810000002937,10.0.2.15,62.210.85.178,TLSv1.2,1424,Application Data
1,3.784816999999748,62.210.85.178,10.0.2.15,TCP,60,9001  >  35978 [ACK] Seq=9836263 Ack=179579175 Win=65535 Len=0
1,3.8749580000003334,54.93.77.70,10.0.2.15,TLSv1.2,3674,Application Data
1,3.8750840000002427,10.0.2.15,54.93.77.70,TCP,54,34692  >  9001 [ACK] Seq=9879319 Ack=179368691 Win=65535 Len=0
1,3.894583999999668,54.93.77.70,10.0.2.15,TCP,2950,"9001  >  34692 [PSH, ACK] Seq=179368691 Ack=9879319 Win=65535 Len=2896 [TCP segment of a reassembled PDU]"
1,3.894637999999759,10.0.2.15,54.93.77.70,TCP,54,34692  >  9001 [ACK] Seq=9879319 Ack=179371587 Win=65535 Len=0
1,3.8960079999997106,54.93.77.70,10.0.2.15,TLSv1.2,4912,"Application Data, Application Data"
1,3.8960699999997814,10.0.2.15,54.93.77.70,TCP,54,34692  >  9001 [ACK] Seq=9879319 Ack=179376445 Win=65535 Len=0
1,3.947911000000204,54.93.77.70,10.0.2.15,TLSv1.2,3674,Application Data
1,3.9479899999996633,10.0.2.15,54.93.77.70,TCP,54,34692  >  9001 [ACK] Seq=9879319 Ack=179380065 Win=65535 Len=0
1,4.017800000000534,54.93.77.70,10.0.2.15,TLSv1.2,4724,"Application Data, Application Data"
1,4.0179040000002715,10.0.2.15,54.93.77.70,TCP,54,34692  >  9001 [ACK] Seq=9879319 Ack=179384735 Win=65535 Len=0
1,4.019967000000179,54.93.77.70,10.0.2.15,TCP,2950,"9001  >  34692 [PSH, ACK] Seq=179384735 Ack=9879319 Win=65535 Len=2896 [TCP segment of a reassembled PDU]"
1,4.020018000000164,10.0.2.15,54.93.77.70,TCP,54,34692  >  9001 [ACK] Seq=9879319 Ack=179387631 Win=65535 Len=0
1,4.031477999999879,54.93.77.70,10.0.2.15,TLSv1.2,2950,"Application Data, Application Data"
1,4.0315870000004,10.0.2.15,54.93.77.70,TCP,54,34692  >  9001 [ACK] Seq=9879319 Ack=179390527 Win=65535 Len=0
1,4.031619999999748,54.93.77.70,10.0.2.15,TCP,1502,"9001  >  34692 [PSH, ACK] Seq=179390527 Ack=9879319 Win=65535 Len=1448 [TCP segment of a reassembled PDU]"
1,4.031708999999864,10.0.2.15,54.93.77.70,TCP,54,34692  >  9001 [ACK] Seq=9879319 Ack=179391975 Win=65535 Len=0
1,4.031954000000042,54.93.77.70,10.0.2.15,TLSv1.2,4398,"Application Data, Application Data"
1,4.031998999999814,10.0.2.15,54.93.77.70,TCP,54,34692  >  9001 [ACK] Seq=9879319 Ack=179396319 Win=65535 Len=0
1,4.032162999999855,10.0.2.15,54.93.77.70,TLSv1.2,590,Application Data
1,4.0322320000004765,54.93.77.70,10.0.2.15,TCP,60,9001  >  34692 [ACK] Seq=179396319 Ack=9879855 Win=65535 Len=0
1,4.034437000000253,54.93.77.70,10.0.2.15,TLSv1.2,2950,"Application Data, Application Data"
1,4.034523999999692,10.0.2.15,54.93.77.70,TCP,54,34692  >  9001 [ACK] Seq=9879855 Ack=179399215 Win=65535 Len=0
1,4.035697000000255,54.93.77.70,10.0.2.15,TLSv1.2,8410,"Application Data, Application Data, Application Data, Application Data"
1,4.035759999999755,10.0.2.15,54.93.77.70,TCP,54,34692  >  9001 [ACK] Seq=9879855 Ack=179407571 Win=65535 Len=0
1,4.035971999999674,54.93.77.70,10.0.2.15,TCP,1502,"9001  >  34692 [PSH, ACK] Seq=179407571 Ack=9879855 Win=65535 Len=1448 [TCP segment of a reassembled PDU]"
1,4.036014999999679,10.0.2.15,54.93.77.70,TCP,54,34692  >  9001 [ACK] Seq=9879855 Ack=179409019 Win=65535 Len=0
1,4.042292000000089,10.0.2.15,54.93.77.70,TLSv1.2,590,Application Data
1,4.042402000000038,54.93.77.70,10.0.2.15,TCP,60,9001  >  34692 [ACK] Seq=179409019 Ack=9880391 Win=65535 Len=0
1,4.047943999999916,54.93.77.70,10.0.2.15,TLSv1.2,2950,Application Data [TCP segment of a reassembled PDU]
1,4.048085999999785,10.0.2.15,54.93.77.70,TCP,54,34692  >  9001 [ACK] Seq=9880391 Ack=179411915 Win=65535 Len=0
1,4.049645000000055,54.93.77.70,10.0.2.15,TLSv1.2,2950,Application Data [TCP segment of a reassembled PDU]
1,4.049702000000252,10.0.2.15,54.93.77.70,TCP,54,34692  >  9001 [ACK] Seq=9880391 Ack=179414811 Win=65535 Len=0
1,4.051217000000179,54.93.77.70,10.0.2.15,TLSv1.2,612,"Application Data, Application Data"
1,4.083311999999751,54.93.77.70,10.0.2.15,TLSv1.2,7294,"Application Data, Application Data"
