No.,Time,Source,Destination,Protocol,Length,Info
1,0.012635999999474734,10.0.2.15,54.93.77.70,TCP,54,34692  >  9001 [ACK] Seq=9938661 Ack=180589061 Win=65535 Len=0
1,0.05007999999997992,62.210.85.178,10.0.2.15,TLSv1.2,1104,Application Data
1,0.10289800000009564,10.0.2.15,62.210.85.178,TCP,54,35978  >  9001 [ACK] Seq=180725237 Ack=9895495 Win=65535 Len=0
1,0.17605399999956717,10.0.2.15,54.93.77.70,TLSv1.2,590,Application Data
1,0.17625199999929464,54.93.77.70,10.0.2.15,TCP,60,9001  >  34692 [ACK] Seq=180589061 Ack=9939197 Win=65535 Len=0
1,0.29662199999984296,62.210.85.178,10.0.2.15,TLSv1.2,590,Application Data
1,0.2966980000001058,10.0.2.15,62.210.85.178,TCP,54,35978  >  9001 [ACK] Seq=180725237 Ack=9896031 Win=65535 Len=0
1,0.29717099999925267,10.0.2.15,62.210.85.178,TLSv1.2,590,Application Data
1,0.2972749999998996,62.210.85.178,10.0.2.15,TCP,60,9001  >  35978 [ACK] Seq=9896031 Ack=180725773 Win=65535 Len=0
1,0.4131680000000415,54.93.77.70,10.0.2.15,TLSv1.2,590,Application Data
1,0.41324099999928876,10.0.2.15,54.93.77.70,TCP,54,34692  >  9001 [ACK] Seq=9939197 Ack=180589597 Win=65535 Len=0
1,0.41363599999931466,10.0.2.15,54.93.77.70,TLSv1.2,1618,Application Data
1,0.4137379999992845,54.93.77.70,10.0.2.15,TCP,60,9001  >  34692 [ACK] Seq=180589597 Ack=9940657 Win=65535 Len=0
1,0.41374999999970896,54.93.77.70,10.0.2.15,TCP,60,9001  >  34692 [ACK] Seq=180589597 Ack=9940761 Win=65535 Len=0
1,0.6196159999999509,62.210.85.178,10.0.2.15,TLSv1.2,1618,Application Data
1,0.6197419999998601,10.0.2.15,62.210.85.178,TCP,54,35978  >  9001 [ACK] Seq=180725773 Ack=9897595 Win=65535 Len=0
1,0.6337439999997514,10.0.2.15,62.210.85.178,TLSv1.2,590,Application Data
1,0.6339239999997517,62.210.85.178,10.0.2.15,TCP,60,9001  >  35978 [ACK] Seq=9897595 Ack=180726309 Win=65535 Len=0
1,0.6456469999993715,10.0.2.15,62.210.85.178,TLSv1.2,1618,Application Data
1,0.6457860000000437,62.210.85.178,10.0.2.15,TCP,60,9001  >  35978 [ACK] Seq=9897595 Ack=180727769 Win=65535 Len=0
1,0.6458050000001094,62.210.85.178,10.0.2.15,TCP,60,9001  >  35978 [ACK] Seq=9897595 Ack=180727873 Win=65535 Len=0
1,0.7575809999998455,54.93.77.70,10.0.2.15,TLSv1.2,590,Application Data
1,0.7891959999997198,54.93.77.70,10.0.2.15,TLSv1.2,1618,Application Data
1,0.7892590000001292,10.0.2.15,54.93.77.70,TCP,54,34692  >  9001 [ACK] Seq=9940761 Ack=180591697 Win=65535 Len=0
1,0.7912729999998191,10.0.2.15,54.93.77.70,TLSv1.2,590,Application Data
1,0.791439999999966,54.93.77.70,10.0.2.15,TCP,60,9001  >  34692 [ACK] Seq=180591697 Ack=9941297 Win=65535 Len=0
1,1.2334679999994478,62.210.85.178,10.0.2.15,TLSv1.2,590,Application Data
1,1.233803999999509,10.0.2.15,62.210.85.178,TLSv1.2,590,Application Data
1,1.233911999999691,62.210.85.178,10.0.2.15,TCP,60,9001  >  35978 [ACK] Seq=9898131 Ack=180728409 Win=65535 Len=0
1,1.4390729999995528,54.93.77.70,10.0.2.15,TLSv1.2,590,Application Data
1,1.4394699999993463,10.0.2.15,54.93.77.70,TLSv1.2,590,Application Data
1,1.439579999999296,54.93.77.70,10.0.2.15,TCP,60,9001  >  34692 [ACK] Seq=180592233 Ack=9941833 Win=65535 Len=0
1,1.6454409999996642,62.210.85.178,10.0.2.15,TLSv1.2,590,Application Data
1,1.6492349999998623,10.0.2.15,62.210.85.178,TLSv1.2,590,Application Data
1,1.6494229999998424,62.210.85.178,10.0.2.15,TCP,60,9001  >  35978 [ACK] Seq=9898667 Ack=180728945 Win=65535 Len=0
1,1.661787999999433,10.0.2.15,62.210.85.178,TLSv1.2,4124,Application Data
1,1.661921999999322,10.0.2.15,62.210.85.178,TCP,2974,35978  >  9001 [ACK] Seq=180733015 Ack=9898667 Win=65535 Len=2920 [TCP segment of a reassembled PDU]
1,1.66197800000009,62.210.85.178,10.0.2.15,TCP,60,9001  >  35978 [ACK] Seq=9898667 Ack=180730405 Win=65535 Len=0
1,1.661989999999605,62.210.85.178,10.0.2.15,TCP,60,9001  >  35978 [ACK] Seq=9898667 Ack=180731865 Win=65535 Len=0
1,1.6619959999998173,62.210.85.178,10.0.2.15,TCP,60,9001  >  35978 [ACK] Seq=9898667 Ack=180733015 Win=65535 Len=0
1,1.6620399999992514,10.0.2.15,62.210.85.178,TLSv1.2,1204,Application Data
1,1.662083999999595,62.210.85.178,10.0.2.15,TCP,60,9001  >  35978 [ACK] Seq=9898667 Ack=180734475 Win=65535 Len=0
1,1.6620910000001459,62.210.85.178,10.0.2.15,TCP,60,9001  >  35978 [ACK] Seq=9898667 Ack=180735935 Win=65535 Len=0
1,1.6620939999993425,62.210.85.178,10.0.2.15,TCP,60,9001  >  35978 [ACK] Seq=9898667 Ack=180737085 Win=65535 Len=0
1,1.6621359999999186,10.0.2.15,62.210.85.178,TLSv1.2,4124,Application Data
1,1.662174999999479,62.210.85.178,10.0.2.15,TCP,60,9001  >  35978 [ACK] Seq=9898667 Ack=180738545 Win=65535 Len=0
1,1.6621839999997974,62.210.85.178,10.0.2.15,TCP,60,9001  >  35978 [ACK] Seq=9898667 Ack=180740005 Win=65535 Len=0
1,1.662188999999671,62.210.85.178,10.0.2.15,TCP,60,9001  >  35978 [ACK] Seq=9898667 Ack=180741155 Win=65535 Len=0
1,1.662228000000141,10.0.2.15,62.210.85.178,TLSv1.2,4124,Application Data
1,1.662265999999363,62.210.85.178,10.0.2.15,TCP,60,9001  >  35978 [ACK] Seq=9898667 Ack=180742615 Win=65535 Len=0
1,1.6622749999996813,62.210.85.178,10.0.2.15,TCP,60,9001  >  35978 [ACK] Seq=9898667 Ack=180744075 Win=65535 Len=0
1,1.6623460000000705,10.0.2.15,62.210.85.178,TLSv1.2,2974,Application Data
1,1.662387999999737,62.210.85.178,10.0.2.15,TCP,60,9001  >  35978 [ACK] Seq=9898667 Ack=180745225 Win=65535 Len=0
1,1.6623949999993783,62.210.85.178,10.0.2.15,TCP,60,9001  >  35978 [ACK] Seq=9898667 Ack=180746685 Win=65535 Len=0
1,1.6623979999994845,62.210.85.178,10.0.2.15,TCP,60,9001  >  35978 [ACK] Seq=9898667 Ack=180748145 Win=65535 Len=0
1,1.66242499999953,10.0.2.15,62.210.85.178,TLSv1.2,1226,Application Data
1,1.662464999999429,62.210.85.178,10.0.2.15,TCP,60,9001  >  35978 [ACK] Seq=9898667 Ack=180749317 Win=65535 Len=0
1,1.662507000000005,10.0.2.15,62.210.85.178,TLSv1.2,2966,Application Data
1,1.6625459999995655,62.210.85.178,10.0.2.15,TCP,60,9001  >  35978 [ACK] Seq=9898667 Ack=180750777 Win=65535 Len=0
1,1.6625530000001163,62.210.85.178,10.0.2.15,TCP,60,9001  >  35978 [ACK] Seq=9898667 Ack=180752229 Win=65535 Len=0
1,1.7640559999999823,54.93.77.70,10.0.2.15,TLSv1.2,590,Application Data
1,1.8046850000000632,10.0.2.15,54.93.77.70,TCP,54,34692  >  9001 [ACK] Seq=9941833 Ack=180592769 Win=65535 Len=0
1,1.8859859999993205,54.93.77.70,10.0.2.15,TLSv1.2,3674,Application Data
1,1.886069000000134,10.0.2.15,54.93.77.70,TCP,54,34692  >  9001 [ACK] Seq=9941833 Ack=180596389 Win=65535 Len=0
1,1.8968979999999647,54.93.77.70,10.0.2.15,TCP,2950,"9001  >  34692 [PSH, ACK] Seq=180596389 Ack=9941833 Win=65535 Len=2896 [TCP segment of a reassembled PDU]"
1,1.8969559999995909,10.0.2.15,54.93.77.70,TCP,54,34692  >  9001 [ACK] Seq=9941833 Ack=180599285 Win=65535 Len=0
1,1.9022299999996903,54.93.77.70,10.0.2.15,TLSv1.2,778,Application Data
1,1.90227700000014,10.0.2.15,54.93.77.70,TCP,54,34692  >  9001 [ACK] Seq=9941833 Ack=180600009 Win=65535 Len=0
1,1.9056549999995696,54.93.77.70,10.0.2.15,TCP,2950,"9001  >  34692 [PSH, ACK] Seq=180600009 Ack=9941833 Win=65535 Len=2896 [TCP segment of a reassembled PDU]"
1,1.9056949999994686,10.0.2.15,54.93.77.70,TCP,54,34692  >  9001 [ACK] Seq=9941833 Ack=180602905 Win=65535 Len=0
1,1.9187379999993937,54.93.77.70,10.0.2.15,TLSv1.2,5448,"Application Data, Application Data, Application Data"
1,1.9187830000000758,10.0.2.15,54.93.77.70,TCP,54,34692  >  9001 [ACK] Seq=9941833 Ack=180608299 Win=65535 Len=0
1,1.927372999999534,54.93.77.70,10.0.2.15,TCP,2950,"9001  >  34692 [PSH, ACK] Seq=180608299 Ack=9941833 Win=65535 Len=2896 [TCP segment of a reassembled PDU]"
1,1.9274589999995442,10.0.2.15,54.93.77.70,TCP,54,34692  >  9001 [ACK] Seq=9941833 Ack=180611195 Win=65535 Len=0
1,1.9344029999992927,54.93.77.70,10.0.2.15,TLSv1.2,778,Application Data
1,1.9344789999995555,10.0.2.15,54.93.77.70,TCP,54,34692  >  9001 [ACK] Seq=9941833 Ack=180611919 Win=65535 Len=0
1,1.9511949999996432,54.93.77.70,10.0.2.15,TLSv1.2,1104,Application Data
1,1.9512629999999263,10.0.2.15,54.93.77.70,TCP,54,34692  >  9001 [ACK] Seq=9941833 Ack=180612969 Win=65535 Len=0
1,1.9741629999998622,54.93.77.70,10.0.2.15,TLSv1.2,3160,Application Data
1,1.9742139999998471,10.0.2.15,54.93.77.70,TCP,54,34692  >  9001 [ACK] Seq=9941833 Ack=180616075 Win=65535 Len=0
1,1.9765600000000632,10.0.2.15,54.93.77.70,TLSv1.2,590,Application Data
1,1.9767349999992803,54.93.77.70,10.0.2.15,TCP,60,9001  >  34692 [ACK] Seq=180616075 Ack=9942369 Win=65535 Len=0
1,2.1605460000000676,62.210.85.178,10.0.2.15,TLSv1.2,590,Application Data
1,2.1610359999995126,10.0.2.15,62.210.85.178,TLSv1.2,590,Application Data
1,2.1611589999993157,62.210.85.178,10.0.2.15,TCP,60,9001  >  35978 [ACK] Seq=9899203 Ack=180752765 Win=65535 Len=0
1,2.3612880000000587,54.93.77.70,10.0.2.15,TLSv1.2,590,Application Data
1,2.361685999999281,10.0.2.15,54.93.77.70,TLSv1.2,590,Application Data
1,2.3617859999994835,54.93.77.70,10.0.2.15,TCP,60,9001  >  34692 [ACK] Seq=180616611 Ack=9942905 Win=65535 Len=0
1,2.5644869999996445,62.210.85.178,10.0.2.15,TLSv1.2,590,Application Data
1,2.5681549999999334,10.0.2.15,62.210.85.178,TLSv1.2,590,Application Data
1,2.5683140000001004,62.210.85.178,10.0.2.15,TCP,60,9001  >  35978 [ACK] Seq=9899739 Ack=180753301 Win=65535 Len=0
1,2.581333999999515,10.0.2.15,62.210.85.178,TLSv1.2,4124,Application Data
1,2.5814399999999296,10.0.2.15,62.210.85.178,TCP,2974,35978  >  9001 [ACK] Seq=180757371 Ack=9899739 Win=65535 Len=2920 [TCP segment of a reassembled PDU]
1,2.58148699999947,62.210.85.178,10.0.2.15,TCP,60,9001  >  35978 [ACK] Seq=9899739 Ack=180754761 Win=65535 Len=0
1,2.5814999999993233,62.210.85.178,10.0.2.15,TCP,60,9001  >  35978 [ACK] Seq=9899739 Ack=180756221 Win=65535 Len=0
1,2.581503999999768,62.210.85.178,10.0.2.15,TCP,60,9001  >  35978 [ACK] Seq=9899739 Ack=180757371 Win=65535 Len=0
1,2.581506999999874,62.210.85.178,10.0.2.15,TCP,60,9001  >  35978 [ACK] Seq=9899739 Ack=180758831 Win=65535 Len=0
1,2.5815089999996417,62.210.85.178,10.0.2.15,TCP,60,9001  >  35978 [ACK] Seq=9899739 Ack=180760291 Win=65535 Len=0
1,2.581551999999647,10.0.2.15,62.210.85.178,TLSv1.2,1204,Application Data
1,2.581586999999672,62.210.85.178,10.0.2.15,TCP,60,9001  >  35978 [ACK] Seq=9899739 Ack=180761441 Win=65535 Len=0
1,2.581631999999445,10.0.2.15,62.210.85.178,TLSv1.2,4124,Application Data
1,2.5816679999998087,62.210.85.178,10.0.2.15,TCP,60,9001  >  35978 [ACK] Seq=9899739 Ack=180762901 Win=65535 Len=0
1,2.58167499999945,62.210.85.178,10.0.2.15,TCP,60,9001  >  35978 [ACK] Seq=9899739 Ack=180764361 Win=65535 Len=0
1,2.581677999999556,62.210.85.178,10.0.2.15,TCP,60,9001  >  35978 [ACK] Seq=9899739 Ack=180765511 Win=65535 Len=0
1,2.581717000000026,10.0.2.15,62.210.85.178,TLSv1.2,4124,Application Data
1,2.581750999999713,62.210.85.178,10.0.2.15,TCP,60,9001  >  35978 [ACK] Seq=9899739 Ack=180766971 Win=65535 Len=0
1,2.581757999999354,62.210.85.178,10.0.2.15,TCP,60,9001  >  35978 [ACK] Seq=9899739 Ack=180768431 Win=65535 Len=0
1,2.5818129999997836,10.0.2.15,62.210.85.178,TLSv1.2,2974,Application Data
1,2.5818529999996827,62.210.85.178,10.0.2.15,TCP,60,9001  >  35978 [ACK] Seq=9899739 Ack=180769581 Win=65535 Len=0
1,2.581858999999895,62.210.85.178,10.0.2.15,TCP,60,9001  >  35978 [ACK] Seq=9899739 Ack=180771041 Win=65535 Len=0
1,2.581862000000001,62.210.85.178,10.0.2.15,TCP,60,9001  >  35978 [ACK] Seq=9899739 Ack=180772501 Win=65535 Len=0
1,2.5818890000000465,10.0.2.15,62.210.85.178,TLSv1.2,1032,Application Data
1,2.5819219999993948,62.210.85.178,10.0.2.15,TCP,60,9001  >  35978 [ACK] Seq=9899739 Ack=180773479 Win=65535 Len=0
1,2.6922859999995126,54.93.77.70,10.0.2.15,TLSv1.2,590,Application Data
1,2.7084989999993923,54.93.77.70,10.0.2.15,TCP,2950,"9001  >  34692 [PSH, ACK] Seq=180617147 Ack=9942905 Win=65535 Len=2896 [TCP segment of a reassembled PDU]"
1,2.708571999999549,10.0.2.15,54.93.77.70,TCP,54,34692  >  9001 [ACK] Seq=9942905 Ack=180620043 Win=65535 Len=0
1,2.7088749999993524,54.93.77.70,10.0.2.15,TLSv1.2,778,Application Data
1,2.7257279999994353,54.93.77.70,10.0.2.15,TCP,2950,"9001  >  34692 [PSH, ACK] Seq=180620767 Ack=9942905 Win=65535 Len=2896 [TCP segment of a reassembled PDU]"
1,2.7258169999995516,10.0.2.15,54.93.77.70,TCP,54,34692  >  9001 [ACK] Seq=9942905 Ack=180623663 Win=65535 Len=0
1,2.7264029999996637,54.93.77.70,10.0.2.15,TLSv1.2,778,Application Data
1,2.7650159999993775,54.93.77.70,10.0.2.15,TLSv1.2,5846,Application Data
1,2.7650800000001254,10.0.2.15,54.93.77.70,TCP,54,34692  >  9001 [ACK] Seq=9942905 Ack=180630179 Win=65535 Len=0
1,2.765288999999939,10.0.2.15,54.93.77.70,TLSv1.2,590,Application Data
1,2.7654169999996157,54.93.77.70,10.0.2.15,TCP,60,9001  >  34692 [ACK] Seq=180630179 Ack=9943441 Win=65535 Len=0
1,2.76542900000004,54.93.77.70,10.0.2.15,TLSv1.2,2016,Application Data
1,2.7654609999999593,10.0.2.15,54.93.77.70,TCP,54,34692  >  9001 [ACK] Seq=9943441 Ack=180632141 Win=65535 Len=0
1,2.772454999999354,54.93.77.70,10.0.2.15,TCP,2950,"9001  >  34692 [PSH, ACK] Seq=180632141 Ack=9943441 Win=65535 Len=2896 [TCP segment of a reassembled PDU]"
1,2.7725000000000364,10.0.2.15,54.93.77.70,TCP,54,34692  >  9001 [ACK] Seq=9943441 Ack=180635037 Win=65535 Len=0
1,2.779733999999735,54.93.77.70,10.0.2.15,TLSv1.2,1502,"Application Data, Application Data"
1,2.779779999999846,10.0.2.15,54.93.77.70,TCP,54,34692  >  9001 [ACK] Seq=9943441 Ack=180636485 Win=65535 Len=0
1,2.7829469999996945,54.93.77.70,10.0.2.15,TLSv1.2,916,Application Data
1,2.7853390000000218,10.0.2.15,54.93.77.70,TLSv1.2,590,Application Data
1,2.785530000000108,54.93.77.70,10.0.2.15,TCP,60,9001  >  34692 [ACK] Seq=180637347 Ack=9943977 Win=65535 Len=0
1,2.897490999999718,62.210.85.178,10.0.2.15,TLSv1.2,590,Application Data
1,2.9406669999998485,10.0.2.15,62.210.85.178,TCP,54,35978  >  9001 [ACK] Seq=180773479 Ack=9900275 Win=65535 Len=0
1,3.3838230000001204,62.210.85.178,10.0.2.15,TLSv1.2,590,Application Data
1,3.383930999999393,10.0.2.15,62.210.85.178,TCP,54,35978  >  9001 [ACK] Seq=180773479 Ack=9900811 Win=65535 Len=0
1,3.3859969999994064,10.0.2.15,62.210.85.178,TLSv1.2,590,Application Data
1,3.3861409999999523,62.210.85.178,10.0.2.15,TCP,60,9001  >  35978 [ACK] Seq=9900811 Ack=180774015 Win=65535 Len=0
1,3.5889200000001438,54.93.77.70,10.0.2.15,TLSv1.2,590,Application Data
1,3.589288999999553,10.0.2.15,54.93.77.70,TLSv1.2,590,Application Data
1,3.5893889999997555,54.93.77.70,10.0.2.15,TCP,60,9001  >  34692 [ACK] Seq=180637883 Ack=9944513 Win=65535 Len=0
1,3.999554999999418,62.210.85.178,10.0.2.15,TLSv1.2,590,Application Data
1,4.004852999999457,10.0.2.15,62.210.85.178,TLSv1.2,590,Application Data
1,4.005020999999942,62.210.85.178,10.0.2.15,TCP,60,9001  >  35978 [ACK] Seq=9901347 Ack=180774551 Win=65535 Len=0
1,4.017444000000069,10.0.2.15,62.210.85.178,TLSv1.2,4124,Application Data
1,4.017593999999917,10.0.2.15,62.210.85.178,TCP,2974,35978  >  9001 [ACK] Seq=180778621 Ack=9901347 Win=65535 Len=2920 [TCP segment of a reassembled PDU]
1,4.017645999999331,62.210.85.178,10.0.2.15,TCP,60,9001  >  35978 [ACK] Seq=9901347 Ack=180776011 Win=65535 Len=0
1,4.017657999999756,62.210.85.178,10.0.2.15,TCP,60,9001  >  35978 [ACK] Seq=9901347 Ack=180777471 Win=65535 Len=0
1,4.017662999999629,62.210.85.178,10.0.2.15,TCP,60,9001  >  35978 [ACK] Seq=9901347 Ack=180778621 Win=65535 Len=0
1,4.017710000000079,10.0.2.15,62.210.85.178,TLSv1.2,1204,Application Data
1,4.017751999999746,62.210.85.178,10.0.2.15,TCP,60,9001  >  35978 [ACK] Seq=9901347 Ack=180780081 Win=65535 Len=0
1,4.0177599999997256,62.210.85.178,10.0.2.15,TCP,60,9001  >  35978 [ACK] Seq=9901347 Ack=180781541 Win=65535 Len=0
1,4.017763999999261,62.210.85.178,10.0.2.15,TCP,60,9001  >  35978 [ACK] Seq=9901347 Ack=180782691 Win=65535 Len=0
1,4.017807999999604,10.0.2.15,62.210.85.178,TLSv1.2,4124,Application Data
1,4.017874999999549,62.210.85.178,10.0.2.15,TCP,60,9001  >  35978 [ACK] Seq=9901347 Ack=180784151 Win=65535 Len=0
1,4.017883999999867,62.210.85.178,10.0.2.15,TCP,60,9001  >  35978 [ACK] Seq=9901347 Ack=180785611 Win=65535 Len=0
1,4.017886999999973,62.210.85.178,10.0.2.15,TCP,60,9001  >  35978 [ACK] Seq=9901347 Ack=180786761 Win=65535 Len=0
1,4.017927999999301,10.0.2.15,62.210.85.178,TLSv1.2,4124,Application Data
1,4.018028999999842,62.210.85.178,10.0.2.15,TCP,60,9001  >  35978 [ACK] Seq=9901347 Ack=180788221 Win=65535 Len=0
1,4.018039999999928,62.210.85.178,10.0.2.15,TCP,60,9001  >  35978 [ACK] Seq=9901347 Ack=180789681 Win=65535 Len=0
1,4.018043000000034,62.210.85.178,10.0.2.15,TCP,60,9001  >  35978 [ACK] Seq=9901347 Ack=180790831 Win=65535 Len=0
1,4.018071999999847,10.0.2.15,62.210.85.178,TLSv1.2,332,Application Data
1,4.01810899999964,62.210.85.178,10.0.2.15,TCP,60,9001  >  35978 [ACK] Seq=9901347 Ack=180791109 Win=65535 Len=0
1,4.018157999999858,10.0.2.15,62.210.85.178,TLSv1.2,3868,Application Data
1,4.018235999999888,62.210.85.178,10.0.2.15,TCP,60,9001  >  35978 [ACK] Seq=9901347 Ack=180792569 Win=65535 Len=0
1,4.018245999999635,62.210.85.178,10.0.2.15,TCP,60,9001  >  35978 [ACK] Seq=9901347 Ack=180794029 Win=65535 Len=0
1,4.018250999999509,62.210.85.178,10.0.2.15,TCP,60,9001  >  35978 [ACK] Seq=9901347 Ack=180794923 Win=65535 Len=0
1,4.018294999999853,10.0.2.15,62.210.85.178,TLSv1.2,4124,Application Data
1,4.018360999999459,62.210.85.178,10.0.2.15,TCP,60,9001  >  35978 [ACK] Seq=9901347 Ack=180796383 Win=65535 Len=0
1,4.018369999999777,62.210.85.178,10.0.2.15,TCP,60,9001  >  35978 [ACK] Seq=9901347 Ack=180797843 Win=65535 Len=0
1,4.018372999999883,62.210.85.178,10.0.2.15,TCP,60,9001  >  35978 [ACK] Seq=9901347 Ack=180798993 Win=65535 Len=0
1,4.018414000000121,10.0.2.15,62.210.85.178,TLSv1.2,3030,Application Data
1,4.018482999999833,62.210.85.178,10.0.2.15,TCP,60,9001  >  35978 [ACK] Seq=9901347 Ack=180800453 Win=65535 Len=0
1,4.018492000000151,62.210.85.178,10.0.2.15,TCP,60,9001  >  35978 [ACK] Seq=9901347 Ack=180801913 Win=65535 Len=0
1,4.018495999999686,62.210.85.178,10.0.2.15,TCP,60,9001  >  35978 [ACK] Seq=9901347 Ack=180801969 Win=65535 Len=0
1,4.02776300000005,10.0.2.15,62.210.85.178,TLSv1.2,4124,Application Data
1,4.027876000000106,62.210.85.178,10.0.2.15,TCP,60,9001  >  35978 [ACK] Seq=9901347 Ack=180803429 Win=65535 Len=0
1,4.027885999999853,62.210.85.178,10.0.2.15,TCP,60,9001  >  35978 [ACK] Seq=9901347 Ack=180804889 Win=65535 Len=0
1,4.027888999999959,62.210.85.178,10.0.2.15,TCP,60,9001  >  35978 [ACK] Seq=9901347 Ack=180806039 Win=65535 Len=0
1,4.027931999999964,10.0.2.15,62.210.85.178,TLSv1.2,4124,Application Data
1,4.027970999999525,62.210.85.178,10.0.2.15,TCP,60,9001  >  35978 [ACK] Seq=9901347 Ack=180807499 Win=65535 Len=0
1,4.027979999999843,62.210.85.178,10.0.2.15,TCP,60,9001  >  35978 [ACK] Seq=9901347 Ack=180808959 Win=65535 Len=0
1,4.027984999999717,62.210.85.178,10.0.2.15,TCP,60,9001  >  35978 [ACK] Seq=9901347 Ack=180810109 Win=65535 Len=0
1,4.028024999999616,10.0.2.15,62.210.85.178,TLSv1.2,4124,Application Data
1,4.028064000000086,62.210.85.178,10.0.2.15,TCP,60,9001  >  35978 [ACK] Seq=9901347 Ack=180811569 Win=65535 Len=0
1,4.028072000000066,62.210.85.178,10.0.2.15,TCP,60,9001  >  35978 [ACK] Seq=9901347 Ack=180813029 Win=65535 Len=0
1,4.028076999999939,62.210.85.178,10.0.2.15,TCP,60,9001  >  35978 [ACK] Seq=9901347 Ack=180814179 Win=65535 Len=0
1,4.028113999999732,10.0.2.15,62.210.85.178,TLSv1.2,4124,Application Data
1,4.028151999999864,62.210.85.178,10.0.2.15,TCP,60,9001  >  35978 [ACK] Seq=9901347 Ack=180815639 Win=65535 Len=0
1,4.028159999999843,62.210.85.178,10.0.2.15,TCP,60,9001  >  35978 [ACK] Seq=9901347 Ack=180817099 Win=65535 Len=0
1,4.028164999999717,62.210.85.178,10.0.2.15,TCP,60,9001  >  35978 [ACK] Seq=9901347 Ack=180818249 Win=65535 Len=0
1,4.028199999999742,10.0.2.15,62.210.85.178,TLSv1.2,332,Application Data
1,4.028236999999535,62.210.85.178,10.0.2.15,TCP,60,9001  >  35978 [ACK] Seq=9901347 Ack=180818527 Win=65535 Len=0
1,4.028290999999626,10.0.2.15,62.210.85.178,TLSv1.2,3868,Application Data
1,4.028366999999889,62.210.85.178,10.0.2.15,TCP,60,9001  >  35978 [ACK] Seq=9901347 Ack=180819987 Win=65535 Len=0
1,4.028374999999869,62.210.85.178,10.0.2.15,TCP,60,9001  >  35978 [ACK] Seq=9901347 Ack=180821447 Win=65535 Len=0
1,4.028377999999975,62.210.85.178,10.0.2.15,TCP,60,9001  >  35978 [ACK] Seq=9901347 Ack=180822341 Win=65535 Len=0
1,4.028418999999303,10.0.2.15,62.210.85.178,TLSv1.2,4124,Application Data
1,4.028494000000137,62.210.85.178,10.0.2.15,TCP,60,9001  >  35978 [ACK] Seq=9901347 Ack=180823801 Win=65535 Len=0
1,4.028502999999546,62.210.85.178,10.0.2.15,TCP,60,9001  >  35978 [ACK] Seq=9901347 Ack=180825261 Win=65535 Len=0
1,4.028505999999652,62.210.85.178,10.0.2.15,TCP,60,9001  >  35978 [ACK] Seq=9901347 Ack=180826411 Win=65535 Len=0
1,4.028540999999677,10.0.2.15,62.210.85.178,TLSv1.2,3030,Application Data
1,4.028590999999324,62.210.85.178,10.0.2.15,TCP,60,9001  >  35978 [ACK] Seq=9901347 Ack=180827871 Win=65535 Len=0
1,4.028596999999536,62.210.85.178,10.0.2.15,TCP,60,9001  >  35978 [ACK] Seq=9901347 Ack=180829331 Win=65535 Len=0
1,4.028599999999642,62.210.85.178,10.0.2.15,TCP,60,9001  >  35978 [ACK] Seq=9901347 Ack=180829387 Win=65535 Len=0
1,4.041110999999546,10.0.2.15,62.210.85.178,TLSv1.2,2646,Application Data
1,4.04120999999941,62.210.85.178,10.0.2.15,TCP,60,9001  >  35978 [ACK] Seq=9901347 Ack=180830847 Win=65535 Len=0
1,4.041218999999728,62.210.85.178,10.0.2.15,TCP,60,9001  >  35978 [ACK] Seq=9901347 Ack=180831979 Win=65535 Len=0
1,4.112884999999551,54.93.77.70,10.0.2.15,TLSv1.2,590,Application Data
1,4.145811999999751,54.93.77.70,10.0.2.15,TCP,2950,"9001  >  34692 [PSH, ACK] Seq=180638419 Ack=9944513 Win=65535 Len=2896 [TCP segment of a reassembled PDU]"
1,4.145865999999842,10.0.2.15,54.93.77.70,TCP,54,34692  >  9001 [ACK] Seq=9944513 Ack=180641315 Win=65535 Len=0
1,4.162606999999298,54.93.77.70,10.0.2.15,TLSv1.2,778,Application Data
1,4.201060999999754,54.93.77.70,10.0.2.15,TCP,2950,"9001  >  34692 [PSH, ACK] Seq=180642039 Ack=9944513 Win=65535 Len=2896 [TCP segment of a reassembled PDU]"
1,4.201137000000017,10.0.2.15,54.93.77.70,TCP,54,34692  >  9001 [ACK] Seq=9944513 Ack=180644935 Win=65535 Len=0
1,4.217450000000099,54.93.77.70,10.0.2.15,TLSv1.2,2950,Application Data [TCP segment of a reassembled PDU]
1,4.217496999999639,10.0.2.15,54.93.77.70,TCP,54,34692  >  9001 [ACK] Seq=9944513 Ack=180647831 Win=65535 Len=0
1,4.217818999999508,54.93.77.70,10.0.2.15,TLSv1.2,1502,Application Data
1,4.217863999999281,10.0.2.15,54.93.77.70,TCP,54,34692  >  9001 [ACK] Seq=9944513 Ack=180649279 Win=65535 Len=0
1,4.228670999999849,54.93.77.70,10.0.2.15,TLSv1.2,1104,Application Data
1,4.235147999999754,54.93.77.70,10.0.2.15,TCP,2950,"9001  >  34692 [PSH, ACK] Seq=180650329 Ack=9944513 Win=65535 Len=2896 [TCP segment of a reassembled PDU]"
1,4.2352219999993395,10.0.2.15,54.93.77.70,TCP,54,34692  >  9001 [ACK] Seq=9944513 Ack=180653225 Win=65535 Len=0
1,4.24821399999928,54.93.77.70,10.0.2.15,TLSv1.2,778,Application Data
1,4.253608999999415,54.93.77.70,10.0.2.15,TCP,1502,"9001  >  34692 [PSH, ACK] Seq=180653949 Ack=9944513 Win=65535 Len=1448 [TCP segment of a reassembled PDU]"
1,4.2536569999992935,10.0.2.15,54.93.77.70,TCP,54,34692  >  9001 [ACK] Seq=9944513 Ack=180655397 Win=65535 Len=0
1,4.263328000000001,54.93.77.70,10.0.2.15,TLSv1.2,2950,Application Data [TCP segment of a reassembled PDU]
1,4.2633719999994355,10.0.2.15,54.93.77.70,TCP,54,34692  >  9001 [ACK] Seq=9944513 Ack=180658293 Win=65535 Len=0
1,4.273140999999669,54.93.77.70,10.0.2.15,TLSv1.2,1408,Application Data
1,4.283473999999842,54.93.77.70,10.0.2.15,TLSv1.2,4398,Application Data
1,4.2835439999998925,10.0.2.15,54.93.77.70,TCP,54,34692  >  9001 [ACK] Seq=9944513 Ack=180663991 Win=65535 Len=0
1,4.30274399999962,54.93.77.70,10.0.2.15,TLSv1.2,380,Application Data
1,4.302896000000146,10.0.2.15,54.93.77.70,TLSv1.2,590,Application Data
1,4.302993999999671,54.93.77.70,10.0.2.15,TCP,60,9001  >  34692 [ACK] Seq=180664317 Ack=9945049 Win=65535 Len=0
1,4.314480999999432,54.93.77.70,10.0.2.15,TCP,2950,"9001  >  34692 [PSH, ACK] Seq=180664317 Ack=9945049 Win=65535 Len=2896 [TCP segment of a reassembled PDU]"
1,4.314547999999377,10.0.2.15,54.93.77.70,TCP,54,34692  >  9001 [ACK] Seq=9945049 Ack=180667213 Win=65535 Len=0
1,4.324549999999363,54.93.77.70,10.0.2.15,TLSv1.2,1314,"Application Data, Application Data"
1,4.364658999999847,10.0.2.15,54.93.77.70,TCP,54,34692  >  9001 [ACK] Seq=9945049 Ack=180668473 Win=65535 Len=0
1,4.413994999999886,54.93.77.70,10.0.2.15,TLSv1.2,4210,"Application Data, Application Data"
1,4.41406299999926,10.0.2.15,54.93.77.70,TCP,54,34692  >  9001 [ACK] Seq=9945049 Ack=180672629 Win=65535 Len=0
1,4.423797999999806,54.93.77.70,10.0.2.15,TLSv1.2,14534,"Application Data, Application Data, Application Data"
1,4.423911999999291,10.0.2.15,54.93.77.70,TCP,54,34692  >  9001 [ACK] Seq=9945049 Ack=180687109 Win=65535 Len=0
1,4.424337999999807,10.0.2.15,54.93.77.70,TLSv1.2,590,Application Data
1,4.424428999999691,54.93.77.70,10.0.2.15,TCP,60,9001  >  34692 [ACK] Seq=180687109 Ack=9945585 Win=65535 Len=0
1,4.4303030000000945,54.93.77.70,10.0.2.15,TLSv1.2,1082,Application Data
1,4.432942999999796,54.93.77.70,10.0.2.15,TLSv1.2,7294,Application Data
1,4.433030999999573,10.0.2.15,54.93.77.70,TCP,54,34692  >  9001 [ACK] Seq=9945585 Ack=180695377 Win=65535 Len=0
1,4.437688999999409,10.0.2.15,54.93.77.70,TLSv1.2,590,Application Data
1,4.437820999999531,54.93.77.70,10.0.2.15,TCP,60,9001  >  34692 [ACK] Seq=180695377 Ack=9946121 Win=65535 Len=0
1,4.44683299999997,54.93.77.70,10.0.2.15,TLSv1.2,568,Application Data
1,4.4494269999995595,10.0.2.15,54.93.77.70,TLSv1.2,590,Application Data
1,4.449598000000151,54.93.77.70,10.0.2.15,TCP,60,9001  >  34692 [ACK] Seq=180695891 Ack=9946657 Win=65535 Len=0
1,4.503778999999668,62.210.85.178,10.0.2.15,TLSv1.2,590,Application Data
1,4.532381999999416,62.210.85.178,10.0.2.15,TLSv1.2,590,Application Data
1,4.53250399999979,10.0.2.15,62.210.85.178,TCP,54,35978  >  9001 [ACK] Seq=180831979 Ack=9902419 Win=65535 Len=0
1,4.715523999999277,62.210.85.178,10.0.2.15,TLSv1.2,1104,Application Data
1,4.716023999999379,10.0.2.15,62.210.85.178,TLSv1.2,590,Application Data
1,4.716129999999794,62.210.85.178,10.0.2.15,TCP,60,9001  >  35978 [ACK] Seq=9903469 Ack=180832515 Win=65535 Len=0
1,4.921408000000156,54.93.77.70,10.0.2.15,TLSv1.2,590,Application Data
1,4.921813999999358,10.0.2.15,54.93.77.70,TLSv1.2,590,Application Data
1,4.921922999999879,54.93.77.70,10.0.2.15,TCP,60,9001  >  34692 [ACK] Seq=180696427 Ack=9947193 Win=65535 Len=0
1,5.226980999999796,62.210.85.178,10.0.2.15,TLSv1.2,590,Application Data
1,5.233067000000119,10.0.2.15,62.210.85.178,TLSv1.2,590,Application Data
1,5.233231999999589,62.210.85.178,10.0.2.15,TCP,60,9001  >  35978 [ACK] Seq=9904005 Ack=180833051 Win=65535 Len=0
1,5.245673999999781,10.0.2.15,62.210.85.178,TLSv1.2,4124,Application Data
1,5.2457729999996445,10.0.2.15,62.210.85.178,TCP,2974,35978  >  9001 [ACK] Seq=180837121 Ack=9904005 Win=65535 Len=2920 [TCP segment of a reassembled PDU]
1,5.245818999999756,62.210.85.178,10.0.2.15,TCP,60,9001  >  35978 [ACK] Seq=9904005 Ack=180834511 Win=65535 Len=0
1,5.245830999999271,62.210.85.178,10.0.2.15,TCP,60,9001  >  35978 [ACK] Seq=9904005 Ack=180835971 Win=65535 Len=0
1,5.245836000000054,62.210.85.178,10.0.2.15,TCP,60,9001  >  35978 [ACK] Seq=9904005 Ack=180837121 Win=65535 Len=0
1,5.245839999999589,62.210.85.178,10.0.2.15,TCP,60,9001  >  35978 [ACK] Seq=9904005 Ack=180838581 Win=65535 Len=0
1,5.245842999999695,62.210.85.178,10.0.2.15,TCP,60,9001  >  35978 [ACK] Seq=9904005 Ack=180840041 Win=65535 Len=0
1,5.245879000000059,10.0.2.15,62.210.85.178,TLSv1.2,1204,Application Data
1,5.245912999999746,62.210.85.178,10.0.2.15,TCP,60,9001  >  35978 [ACK] Seq=9904005 Ack=180841191 Win=65535 Len=0
1,5.2459579999995185,10.0.2.15,62.210.85.178,TLSv1.2,4124,Application Data
1,5.245992999999544,62.210.85.178,10.0.2.15,TCP,60,9001  >  35978 [ACK] Seq=9904005 Ack=180842651 Win=65535 Len=0
1,5.246000999999524,62.210.85.178,10.0.2.15,TCP,60,9001  >  35978 [ACK] Seq=9904005 Ack=180844111 Win=65535 Len=0
1,5.24600399999963,62.210.85.178,10.0.2.15,TCP,60,9001  >  35978 [ACK] Seq=9904005 Ack=180845261 Win=65535 Len=0
1,5.246041999999761,10.0.2.15,62.210.85.178,TLSv1.2,4124,Application Data
1,5.246075999999448,62.210.85.178,10.0.2.15,TCP,60,9001  >  35978 [ACK] Seq=9904005 Ack=180846721 Win=65535 Len=0
1,5.246082999999999,62.210.85.178,10.0.2.15,TCP,60,9001  >  35978 [ACK] Seq=9904005 Ack=180848181 Win=65535 Len=0
1,5.246122999999898,62.210.85.178,10.0.2.15,TCP,60,9001  >  35978 [ACK] Seq=9904005 Ack=180849331 Win=65535 Len=0
1,5.2461560000001555,10.0.2.15,62.210.85.178,TLSv1.2,332,Application Data
1,5.246188999999504,62.210.85.178,10.0.2.15,TCP,60,9001  >  35978 [ACK] Seq=9904005 Ack=180849609 Win=65535 Len=0
1,5.246241999999256,10.0.2.15,62.210.85.178,TLSv1.2,3868,Application Data
1,5.24627799999962,62.210.85.178,10.0.2.15,TCP,60,9001  >  35978 [ACK] Seq=9904005 Ack=180851069 Win=65535 Len=0
1,5.246284999999261,62.210.85.178,10.0.2.15,TCP,60,9001  >  35978 [ACK] Seq=9904005 Ack=180852529 Win=65535 Len=0
1,5.2462879999993675,62.210.85.178,10.0.2.15,TCP,60,9001  >  35978 [ACK] Seq=9904005 Ack=180853423 Win=65535 Len=0
1,5.246323999999731,10.0.2.15,62.210.85.178,TLSv1.2,4124,Application Data
1,5.246358999999757,62.210.85.178,10.0.2.15,TCP,60,9001  >  35978 [ACK] Seq=9904005 Ack=180854883 Win=65535 Len=0
1,5.246364999999969,62.210.85.178,10.0.2.15,TCP,60,9001  >  35978 [ACK] Seq=9904005 Ack=180856343 Win=65535 Len=0
1,5.246368000000075,62.210.85.178,10.0.2.15,TCP,60,9001  >  35978 [ACK] Seq=9904005 Ack=180857493 Win=65535 Len=0
1,5.246401999999762,10.0.2.15,62.210.85.178,TLSv1.2,3030,Application Data
1,5.2464359999994485,62.210.85.178,10.0.2.15,TCP,60,9001  >  35978 [ACK] Seq=9904005 Ack=180858953 Win=65535 Len=0
1,5.246443999999428,62.210.85.178,10.0.2.15,TCP,60,9001  >  35978 [ACK] Seq=9904005 Ack=180860413 Win=65535 Len=0
1,5.246447999999873,62.210.85.178,10.0.2.15,TCP,60,9001  >  35978 [ACK] Seq=9904005 Ack=180860469 Win=65535 Len=0
1,5.255675999999767,10.0.2.15,62.210.85.178,TLSv1.2,4124,Application Data
1,5.255755000000136,62.210.85.178,10.0.2.15,TCP,60,9001  >  35978 [ACK] Seq=9904005 Ack=180861929 Win=65535 Len=0
1,5.2557639999995445,62.210.85.178,10.0.2.15,TCP,60,9001  >  35978 [ACK] Seq=9904005 Ack=180863389 Win=65535 Len=0
1,5.255766999999651,62.210.85.178,10.0.2.15,TCP,60,9001  >  35978 [ACK] Seq=9904005 Ack=180864539 Win=65535 Len=0
1,5.255807999999888,10.0.2.15,62.210.85.178,TLSv1.2,4124,Application Data
1,5.255861999999979,62.210.85.178,10.0.2.15,TCP,60,9001  >  35978 [ACK] Seq=9904005 Ack=180865999 Win=65535 Len=0
1,5.25586899999962,62.210.85.178,10.0.2.15,TCP,60,9001  >  35978 [ACK] Seq=9904005 Ack=180867459 Win=65535 Len=0
1,5.2558719999997265,62.210.85.178,10.0.2.15,TCP,60,9001  >  35978 [ACK] Seq=9904005 Ack=180868609 Win=65535 Len=0
1,5.255908999999519,10.0.2.15,62.210.85.178,TLSv1.2,4124,Application Data
1,5.255943999999545,62.210.85.178,10.0.2.15,TCP,60,9001  >  35978 [ACK] Seq=9904005 Ack=180870069 Win=65535 Len=0
1,5.2559510000000955,62.210.85.178,10.0.2.15,TCP,60,9001  >  35978 [ACK] Seq=9904005 Ack=180871529 Win=65535 Len=0
1,5.255954999999631,62.210.85.178,10.0.2.15,TCP,60,9001  >  35978 [ACK] Seq=9904005 Ack=180872679 Win=65535 Len=0
1,5.255989999999656,10.0.2.15,62.210.85.178,TLSv1.2,4124,Application Data
1,5.256023999999343,62.210.85.178,10.0.2.15,TCP,60,9001  >  35978 [ACK] Seq=9904005 Ack=180874139 Win=65535 Len=0
1,5.2560309999998935,62.210.85.178,10.0.2.15,TCP,60,9001  >  35978 [ACK] Seq=9904005 Ack=180875599 Win=65535 Len=0
1,5.256035999999767,62.210.85.178,10.0.2.15,TCP,60,9001  >  35978 [ACK] Seq=9904005 Ack=180876749 Win=65535 Len=0
1,5.2560709999997925,10.0.2.15,62.210.85.178,TLSv1.2,332,Application Data
1,5.25610400000005,62.210.85.178,10.0.2.15,TCP,60,9001  >  35978 [ACK] Seq=9904005 Ack=180877027 Win=65535 Len=0
1,5.256155000000035,10.0.2.15,62.210.85.178,TLSv1.2,3868,Application Data
1,5.256191999999828,62.210.85.178,10.0.2.15,TCP,60,9001  >  35978 [ACK] Seq=9904005 Ack=180878487 Win=65535 Len=0
1,5.25619800000004,62.210.85.178,10.0.2.15,TCP,60,9001  >  35978 [ACK] Seq=9904005 Ack=180879947 Win=65535 Len=0
1,5.2562010000001465,62.210.85.178,10.0.2.15,TCP,60,9001  >  35978 [ACK] Seq=9904005 Ack=180880841 Win=65535 Len=0
1,5.256237999999939,10.0.2.15,62.210.85.178,TLSv1.2,4124,Application Data
1,5.256273999999394,62.210.85.178,10.0.2.15,TCP,60,9001  >  35978 [ACK] Seq=9904005 Ack=180882301 Win=65535 Len=0
1,5.256279999999606,62.210.85.178,10.0.2.15,TCP,60,9001  >  35978 [ACK] Seq=9904005 Ack=180883761 Win=65535 Len=0
1,5.256282999999712,62.210.85.178,10.0.2.15,TCP,60,9001  >  35978 [ACK] Seq=9904005 Ack=180884911 Win=65535 Len=0
1,5.256316999999399,10.0.2.15,62.210.85.178,TLSv1.2,3030,Application Data
1,5.256351999999424,62.210.85.178,10.0.2.15,TCP,60,9001  >  35978 [ACK] Seq=9904005 Ack=180886371 Win=65535 Len=0
1,5.256358999999975,62.210.85.178,10.0.2.15,TCP,60,9001  >  35978 [ACK] Seq=9904005 Ack=180887831 Win=65535 Len=0
1,5.256362000000081,62.210.85.178,10.0.2.15,TCP,60,9001  >  35978 [ACK] Seq=9904005 Ack=180887887 Win=65535 Len=0
1,5.268796999999722,10.0.2.15,62.210.85.178,TLSv1.2,4124,Application Data
1,5.268901999999798,62.210.85.178,10.0.2.15,TCP,60,9001  >  35978 [ACK] Seq=9904005 Ack=180889347 Win=65535 Len=0
1,5.268912999999884,62.210.85.178,10.0.2.15,TCP,60,9001  >  35978 [ACK] Seq=9904005 Ack=180890807 Win=65535 Len=0
1,5.26891599999999,62.210.85.178,10.0.2.15,TCP,60,9001  >  35978 [ACK] Seq=9904005 Ack=180891957 Win=65535 Len=0
1,5.268954000000122,10.0.2.15,62.210.85.178,TLSv1.2,4124,Application Data
1,5.268989999999576,62.210.85.178,10.0.2.15,TCP,60,9001  >  35978 [ACK] Seq=9904005 Ack=180893417 Win=65535 Len=0
1,5.268997999999556,62.210.85.178,10.0.2.15,TCP,60,9001  >  35978 [ACK] Seq=9904005 Ack=180894877 Win=65535 Len=0
1,5.2690029999994294,62.210.85.178,10.0.2.15,TCP,60,9001  >  35978 [ACK] Seq=9904005 Ack=180896027 Win=65535 Len=0
1,5.269040000000132,10.0.2.15,62.210.85.178,TLSv1.2,4124,Application Data
1,5.269073999999819,62.210.85.178,10.0.2.15,TCP,60,9001  >  35978 [ACK] Seq=9904005 Ack=180897487 Win=65535 Len=0
1,5.269081999999798,62.210.85.178,10.0.2.15,TCP,60,9001  >  35978 [ACK] Seq=9904005 Ack=180898947 Win=65535 Len=0
1,5.269085999999334,62.210.85.178,10.0.2.15,TCP,60,9001  >  35978 [ACK] Seq=9904005 Ack=180900097 Win=65535 Len=0
1,5.269121999999697,10.0.2.15,62.210.85.178,TLSv1.2,4124,Application Data
1,5.269156999999723,62.210.85.178,10.0.2.15,TCP,60,9001  >  35978 [ACK] Seq=9904005 Ack=180901557 Win=65535 Len=0
1,5.269163999999364,62.210.85.178,10.0.2.15,TCP,60,9001  >  35978 [ACK] Seq=9904005 Ack=180903017 Win=65535 Len=0
1,5.269167999999809,62.210.85.178,10.0.2.15,TCP,60,9001  >  35978 [ACK] Seq=9904005 Ack=180904167 Win=65535 Len=0
1,5.2692019999994955,10.0.2.15,62.210.85.178,TLSv1.2,332,Application Data
1,5.269236000000092,62.210.85.178,10.0.2.15,TCP,60,9001  >  35978 [ACK] Seq=9904005 Ack=180904445 Win=65535 Len=0
1,5.269285999999738,10.0.2.15,62.210.85.178,TLSv1.2,3868,Application Data
1,5.269322999999531,62.210.85.178,10.0.2.15,TCP,60,9001  >  35978 [ACK] Seq=9904005 Ack=180905905 Win=65535 Len=0
1,5.269330000000082,62.210.85.178,10.0.2.15,TCP,60,9001  >  35978 [ACK] Seq=9904005 Ack=180907365 Win=65535 Len=0
1,5.269332999999278,62.210.85.178,10.0.2.15,TCP,60,9001  >  35978 [ACK] Seq=9904005 Ack=180908259 Win=65535 Len=0
1,5.269369999999981,10.0.2.15,62.210.85.178,TLSv1.2,1424,Application Data
1,5.269405000000006,62.210.85.178,10.0.2.15,TCP,60,9001  >  35978 [ACK] Seq=9904005 Ack=180909629 Win=65535 Len=0
1,5.534393999999338,54.93.77.70,10.0.2.15,TCP,2950,"9001  >  34692 [PSH, ACK] Seq=180696427 Ack=9947193 Win=65535 Len=2896 [TCP segment of a reassembled PDU]"
1,5.534515999999712,10.0.2.15,54.93.77.70,TCP,54,34692  >  9001 [ACK] Seq=9947193 Ack=180699323 Win=65535 Len=0
1,5.53714299999956,54.93.77.70,10.0.2.15,TLSv1.2,778,Application Data
1,5.540876999999455,54.93.77.70,10.0.2.15,TLSv1.2,10190,"Application Data, Application Data, Application Data, Application Data"
1,5.54095899999993,10.0.2.15,54.93.77.70,TCP,54,34692  >  9001 [ACK] Seq=9947193 Ack=180710183 Win=65535 Len=0
1,5.55312799999956,54.93.77.70,10.0.2.15,TLSv1.2,5846,Application Data [TCP segment of a reassembled PDU]
1,5.553175999999439,10.0.2.15,54.93.77.70,TCP,54,34692  >  9001 [ACK] Seq=9947193 Ack=180715975 Win=65535 Len=0
1,5.557524999999259,54.93.77.70,10.0.2.15,TLSv1.2,2950,Application Data [TCP segment of a reassembled PDU]
1,5.557573999999477,10.0.2.15,54.93.77.70,TCP,54,34692  >  9001 [ACK] Seq=9947193 Ack=180718871 Win=65535 Len=0
1,5.558161999999356,54.93.77.70,10.0.2.15,TLSv1.2,5050,"Application Data, Application Data"
1,5.558226999999533,10.0.2.15,54.93.77.70,TCP,54,34692  >  9001 [ACK] Seq=9947193 Ack=180723867 Win=65535 Len=0
1,5.558407999999872,10.0.2.15,54.93.77.70,TLSv1.2,590,Application Data
1,5.55847999999969,54.93.77.70,10.0.2.15,TCP,60,9001  >  34692 [ACK] Seq=180723867 Ack=9947729 Win=65535 Len=0
1,5.566855999999461,54.93.77.70,10.0.2.15,TLSv1.2,4398,Application Data
1,5.566923999999744,10.0.2.15,54.93.77.70,TCP,54,34692  >  9001 [ACK] Seq=9947729 Ack=180728211 Win=65535 Len=0
1,5.568605999999818,54.93.77.70,10.0.2.15,TLSv1.2,4398,Application Data [TCP segment of a reassembled PDU]
1,5.568645999999717,10.0.2.15,54.93.77.70,TCP,54,34692  >  9001 [ACK] Seq=9947729 Ack=180732555 Win=65535 Len=0
1,5.573714999999538,54.93.77.70,10.0.2.15,TLSv1.2,684,Application Data
1,5.573841999999786,10.0.2.15,54.93.77.70,TLSv1.2,590,Application Data
1,5.5739119999998366,54.93.77.70,10.0.2.15,TCP,60,9001  >  34692 [ACK] Seq=180733185 Ack=9948265 Win=65535 Len=0
1,5.581162999999833,54.93.77.70,10.0.2.15,TCP,2950,"9001  >  34692 [PSH, ACK] Seq=180733185 Ack=9948265 Win=65535 Len=2896 [TCP segment of a reassembled PDU]"
1,5.5812269999996715,10.0.2.15,54.93.77.70,TCP,54,34692  >  9001 [ACK] Seq=9948265 Ack=180736081 Win=65535 Len=0
1,5.58248999999978,54.93.77.70,10.0.2.15,TLSv1.2,8742,"Application Data, Application Data"
1,5.582582000000002,10.0.2.15,54.93.77.70,TCP,54,34692  >  9001 [ACK] Seq=9948265 Ack=180744769 Win=65535 Len=0
1,5.583152000000155,54.93.77.70,10.0.2.15,TLSv1.2,2950,Application Data [TCP segment of a reassembled PDU]
1,5.583190999999715,10.0.2.15,54.93.77.70,TCP,54,34692  >  9001 [ACK] Seq=9948265 Ack=180747665 Win=65535 Len=0
1,5.589877999999771,54.93.77.70,10.0.2.15,TLSv1.2,1082,Application Data
1,5.5900400000000445,10.0.2.15,54.93.77.70,TLSv1.2,590,Application Data
1,5.590120999999272,54.93.77.70,10.0.2.15,TCP,60,9001  >  34692 [ACK] Seq=180748693 Ack=9948801 Win=65535 Len=0
1,5.60708699999941,54.93.77.70,10.0.2.15,TLSv1.2,590,Application Data
1,5.618163000000095,54.93.77.70,10.0.2.15,TCP,2950,"9001  >  34692 [PSH, ACK] Seq=180749229 Ack=9948801 Win=65535 Len=2896 [TCP segment of a reassembled PDU]"
1,5.618273999999474,54.93.77.70,10.0.2.15,TLSv1.2,1502,Application Data [TCP segment of a reassembled PDU]
1,5.618347999999969,10.0.2.15,54.93.77.70,TCP,54,34692  >  9001 [ACK] Seq=9948801 Ack=180753573 Win=65535 Len=0
1,5.6188489999995,54.93.77.70,10.0.2.15,TLSv1.2,4398,Application Data [TCP segment of a reassembled PDU]
1,5.618918999999551,10.0.2.15,54.93.77.70,TCP,54,34692  >  9001 [ACK] Seq=9948801 Ack=180757917 Win=65535 Len=0
1,5.6326609999996435,54.93.77.70,10.0.2.15,TLSv1.2,7294,"Application Data, Application Data"
1,5.632769999999255,10.0.2.15,54.93.77.70,TCP,54,34692  >  9001 [ACK] Seq=9948801 Ack=180765157 Win=65535 Len=0
1,5.634209999999257,54.93.77.70,10.0.2.15,TLSv1.2,684,Application Data
1,5.644132999999783,54.93.77.70,10.0.2.15,TCP,1502,"9001  >  34692 [PSH, ACK] Seq=180765787 Ack=9948801 Win=65535 Len=1448 [TCP segment of a reassembled PDU]"
1,5.644180999999662,10.0.2.15,54.93.77.70,TCP,54,34692  >  9001 [ACK] Seq=9948801 Ack=180767235 Win=65535 Len=0
1,5.652713999999833,54.93.77.70,10.0.2.15,TLSv1.2,4398,Application Data [TCP segment of a reassembled PDU]
