No.,Time,Source,Destination,Protocol,Length,Info
1,0.017154000000118685,10.0.2.15,54.93.77.70,TCP,54,34692  >  9001 [ACK] Seq=10177483 Ack=184667799 Win=65535 Len=0
1,0.12993199999982608,10.0.2.15,54.93.77.70,TLSv1.2,590,Application Data
1,0.1301290000001245,54.93.77.70,10.0.2.15,TCP,60,9001  >  34692 [ACK] Seq=184667799 Ack=10178019 Win=65535 Len=0
1,0.22113600000011502,62.210.85.178,10.0.2.15,TLSv1.2,1618,Application Data
1,0.2212470000004032,10.0.2.15,62.210.85.178,TCP,54,35978  >  9001 [ACK] Seq=184802567 Ack=10133525 Win=65535 Len=0
1,0.2687519999999495,62.210.85.178,10.0.2.15,TLSv1.2,590,Application Data
1,0.26916999999957625,10.0.2.15,62.210.85.178,TLSv1.2,590,Application Data
1,0.26927599999999074,62.210.85.178,10.0.2.15,TCP,60,9001  >  35978 [ACK] Seq=10134061 Ack=184803103 Win=65535 Len=0
1,0.9114849999996295,54.93.77.70,10.0.2.15,TLSv1.2,590,Application Data
1,0.911576999999852,10.0.2.15,54.93.77.70,TCP,54,34692  >  9001 [ACK] Seq=10178019 Ack=184668335 Win=65535 Len=0
1,0.912068999999974,10.0.2.15,54.93.77.70,TLSv1.2,1618,Application Data
1,0.9121900000000096,54.93.77.70,10.0.2.15,TCP,60,9001  >  34692 [ACK] Seq=184668335 Ack=10179479 Win=65535 Len=0
1,0.9122010000000955,54.93.77.70,10.0.2.15,TCP,60,9001  >  34692 [ACK] Seq=184668335 Ack=10179583 Win=65535 Len=0
1,1.1218550000003233,62.210.85.178,10.0.2.15,TLSv1.2,1618,Application Data
1,1.12199099999998,10.0.2.15,62.210.85.178,TCP,54,35978  >  9001 [ACK] Seq=184803103 Ack=10135625 Win=65535 Len=0
1,1.1418830000002345,10.0.2.15,62.210.85.178,TLSv1.2,590,Application Data
1,1.1420639999996638,62.210.85.178,10.0.2.15,TCP,60,9001  >  35978 [ACK] Seq=10135625 Ack=184803639 Win=65535 Len=0
1,1.156688000000031,10.0.2.15,62.210.85.178,TLSv1.2,1618,Application Data
1,1.1568260000003647,62.210.85.178,10.0.2.15,TCP,60,9001  >  35978 [ACK] Seq=10135625 Ack=184805099 Win=65535 Len=0
1,1.1568459999998595,62.210.85.178,10.0.2.15,TCP,60,9001  >  35978 [ACK] Seq=10135625 Ack=184805203 Win=65535 Len=0
1,1.2669159999995827,54.93.77.70,10.0.2.15,TLSv1.2,590,Application Data
1,1.2826500000001033,54.93.77.70,10.0.2.15,TLSv1.2,1618,Application Data
1,1.2827379999998811,10.0.2.15,54.93.77.70,TCP,54,34692  >  9001 [ACK] Seq=10179583 Ack=184670435 Win=65535 Len=0
1,1.2848869999997987,10.0.2.15,54.93.77.70,TLSv1.2,590,Application Data
1,1.2850429999998596,54.93.77.70,10.0.2.15,TCP,60,9001  >  34692 [ACK] Seq=184670435 Ack=10180119 Win=65535 Len=0
1,1.5251619999999093,62.210.85.178,10.0.2.15,TLSv1.2,590,Application Data
1,1.525536000000102,10.0.2.15,62.210.85.178,TLSv1.2,590,Application Data
1,1.525681000000077,62.210.85.178,10.0.2.15,TCP,60,9001  >  35978 [ACK] Seq=10136161 Ack=184805739 Win=65535 Len=0
1,1.644285000000309,54.93.77.70,10.0.2.15,TLSv1.2,590,Application Data
1,1.6447129999996832,10.0.2.15,54.93.77.70,TLSv1.2,590,Application Data
1,1.644839999999931,54.93.77.70,10.0.2.15,TCP,60,9001  >  34692 [ACK] Seq=184670971 Ack=10180655 Win=65535 Len=0
1,1.7578419999999824,62.210.85.178,10.0.2.15,TLSv1.2,590,Application Data
1,1.7678210000003673,10.0.2.15,62.210.85.178,TLSv1.2,590,Application Data
1,1.7680419999996957,62.210.85.178,10.0.2.15,TCP,60,9001  >  35978 [ACK] Seq=10136697 Ack=184806275 Win=65535 Len=0
1,1.7810019999997166,10.0.2.15,62.210.85.178,TLSv1.2,4124,Application Data
1,1.7811220000003232,10.0.2.15,62.210.85.178,TCP,2974,35978  >  9001 [ACK] Seq=184810345 Ack=10136697 Win=65535 Len=2920 [TCP segment of a reassembled PDU]
1,1.7811760000004142,62.210.85.178,10.0.2.15,TCP,60,9001  >  35978 [ACK] Seq=10136697 Ack=184807735 Win=65535 Len=0
1,1.7811869999995906,62.210.85.178,10.0.2.15,TCP,60,9001  >  35978 [ACK] Seq=10136697 Ack=184809195 Win=65535 Len=0
1,1.7811920000003738,62.210.85.178,10.0.2.15,TCP,60,9001  >  35978 [ACK] Seq=10136697 Ack=184810345 Win=65535 Len=0
1,1.7811970000002475,62.210.85.178,10.0.2.15,TCP,60,9001  >  35978 [ACK] Seq=10136697 Ack=184811805 Win=65535 Len=0
1,1.7812009999997827,62.210.85.178,10.0.2.15,TCP,60,9001  >  35978 [ACK] Seq=10136697 Ack=184813265 Win=65535 Len=0
1,1.7812459999995554,10.0.2.15,62.210.85.178,TLSv1.2,1204,Application Data
1,1.7812860000003639,62.210.85.178,10.0.2.15,TCP,60,9001  >  35978 [ACK] Seq=10136697 Ack=184814415 Win=65535 Len=0
1,1.7813349999996717,10.0.2.15,62.210.85.178,TLSv1.2,4124,Application Data
1,1.7814010000001872,10.0.2.15,62.210.85.178,TCP,2974,35978  >  9001 [ACK] Seq=184818485 Ack=10136697 Win=65535 Len=2920 [TCP segment of a reassembled PDU]
1,1.7814399999997477,62.210.85.178,10.0.2.15,TCP,60,9001  >  35978 [ACK] Seq=10136697 Ack=184815875 Win=65535 Len=0
1,1.7814470000002984,62.210.85.178,10.0.2.15,TCP,60,9001  >  35978 [ACK] Seq=10136697 Ack=184817335 Win=65535 Len=0
1,1.7814509999998336,62.210.85.178,10.0.2.15,TCP,60,9001  >  35978 [ACK] Seq=10136697 Ack=184818485 Win=65535 Len=0
1,1.7814559999997073,62.210.85.178,10.0.2.15,TCP,60,9001  >  35978 [ACK] Seq=10136697 Ack=184819945 Win=65535 Len=0
1,1.781460000000152,62.210.85.178,10.0.2.15,TCP,60,9001  >  35978 [ACK] Seq=10136697 Ack=184821405 Win=65535 Len=0
1,1.7814980000002834,10.0.2.15,62.210.85.178,TLSv1.2,1204,Application Data
1,1.7815819999996165,10.0.2.15,62.210.85.178,TLSv1.2,2974,Application Data
1,1.7816219999995155,62.210.85.178,10.0.2.15,TCP,60,9001  >  35978 [ACK] Seq=10136697 Ack=184822555 Win=65535 Len=0
1,1.7816290000000663,62.210.85.178,10.0.2.15,TCP,60,9001  >  35978 [ACK] Seq=10136697 Ack=184824015 Win=65535 Len=0
1,1.78163399999994,62.210.85.178,10.0.2.15,TCP,60,9001  >  35978 [ACK] Seq=10136697 Ack=184825475 Win=65535 Len=0
1,1.7816689999999653,10.0.2.15,62.210.85.178,TLSv1.2,1226,Application Data
1,1.7817329999998037,10.0.2.15,62.210.85.178,TCP,2974,35978  >  9001 [ACK] Seq=184826647 Ack=10136697 Win=65535 Len=2920 [TCP segment of a reassembled PDU]
1,1.7817699999995966,62.210.85.178,10.0.2.15,TCP,60,9001  >  35978 [ACK] Seq=10136697 Ack=184826647 Win=65535 Len=0
1,1.7817770000001474,62.210.85.178,10.0.2.15,TCP,60,9001  >  35978 [ACK] Seq=10136697 Ack=184828107 Win=65535 Len=0
1,1.7817809999996825,62.210.85.178,10.0.2.15,TCP,60,9001  >  35978 [ACK] Seq=10136697 Ack=184829567 Win=65535 Len=0
1,1.7818120000001727,10.0.2.15,62.210.85.178,TLSv1.2,1204,Application Data
1,1.7818489999999656,62.210.85.178,10.0.2.15,TCP,60,9001  >  35978 [ACK] Seq=10136697 Ack=184830717 Win=65535 Len=0
1,1.7818930000003093,10.0.2.15,62.210.85.178,TLSv1.2,3030,Application Data
1,1.7819900000004054,62.210.85.178,10.0.2.15,TCP,60,9001  >  35978 [ACK] Seq=10136697 Ack=184832177 Win=65535 Len=0
1,1.7820050000000265,62.210.85.178,10.0.2.15,TCP,60,9001  >  35978 [ACK] Seq=10136697 Ack=184833637 Win=65535 Len=0
1,1.7820099999999002,62.210.85.178,10.0.2.15,TCP,60,9001  >  35978 [ACK] Seq=10136697 Ack=184833693 Win=65535 Len=0
1,1.7911450000001423,10.0.2.15,62.210.85.178,TLSv1.2,4124,Application Data
1,1.791229999999814,10.0.2.15,62.210.85.178,TCP,2974,35978  >  9001 [ACK] Seq=184837763 Ack=10136697 Win=65535 Len=2920 [TCP segment of a reassembled PDU]
1,1.7912770000002638,62.210.85.178,10.0.2.15,TCP,60,9001  >  35978 [ACK] Seq=10136697 Ack=184835153 Win=65535 Len=0
1,1.7912859999996726,62.210.85.178,10.0.2.15,TCP,60,9001  >  35978 [ACK] Seq=10136697 Ack=184836613 Win=65535 Len=0
1,1.7912900000001173,62.210.85.178,10.0.2.15,TCP,60,9001  >  35978 [ACK] Seq=10136697 Ack=184837763 Win=65535 Len=0
1,1.791294999999991,62.210.85.178,10.0.2.15,TCP,60,9001  >  35978 [ACK] Seq=10136697 Ack=184839223 Win=65535 Len=0
1,1.7912989999995261,62.210.85.178,10.0.2.15,TCP,60,9001  >  35978 [ACK] Seq=10136697 Ack=184840683 Win=65535 Len=0
1,1.7913399999997637,10.0.2.15,62.210.85.178,TLSv1.2,1204,Application Data
1,1.7914080000000467,10.0.2.15,62.210.85.178,TCP,2974,35978  >  9001 [ACK] Seq=184841833 Ack=10136697 Win=65535 Len=2920 [TCP segment of a reassembled PDU]
1,1.7914440000004106,62.210.85.178,10.0.2.15,TCP,60,9001  >  35978 [ACK] Seq=10136697 Ack=184841833 Win=65535 Len=0
1,1.7914510000000519,62.210.85.178,10.0.2.15,TCP,60,9001  >  35978 [ACK] Seq=10136697 Ack=184843293 Win=65535 Len=0
1,1.7914559999999256,62.210.85.178,10.0.2.15,TCP,60,9001  >  35978 [ACK] Seq=10136697 Ack=184844753 Win=65535 Len=0
1,1.7914909999999509,10.0.2.15,62.210.85.178,TLSv1.2,1204,Application Data
1,1.7915549999997893,10.0.2.15,62.210.85.178,TCP,2974,35978  >  9001 [ACK] Seq=184845903 Ack=10136697 Win=65535 Len=2920 [TCP segment of a reassembled PDU]
1,1.7915929999999207,62.210.85.178,10.0.2.15,TCP,60,9001  >  35978 [ACK] Seq=10136697 Ack=184845903 Win=65535 Len=0
1,1.791599000000133,62.210.85.178,10.0.2.15,TCP,60,9001  >  35978 [ACK] Seq=10136697 Ack=184847363 Win=65535 Len=0
1,1.7916040000000066,62.210.85.178,10.0.2.15,TCP,60,9001  >  35978 [ACK] Seq=10136697 Ack=184848823 Win=65535 Len=0
1,1.7916349999995873,10.0.2.15,62.210.85.178,TLSv1.2,1204,Application Data
1,1.7917260000003807,62.210.85.178,10.0.2.15,TCP,60,9001  >  35978 [ACK] Seq=10136697 Ack=184849973 Win=65535 Len=0
1,1.7917539999998553,10.0.2.15,62.210.85.178,TLSv1.2,2974,Application Data
1,1.7917930000003253,62.210.85.178,10.0.2.15,TCP,60,9001  >  35978 [ACK] Seq=10136697 Ack=184851433 Win=65535 Len=0
1,1.791798999999628,62.210.85.178,10.0.2.15,TCP,60,9001  >  35978 [ACK] Seq=10136697 Ack=184852893 Win=65535 Len=0
1,1.7918300000001182,10.0.2.15,62.210.85.178,TLSv1.2,1226,Application Data
1,1.7918659999995725,62.210.85.178,10.0.2.15,TCP,60,9001  >  35978 [ACK] Seq=10136697 Ack=184854065 Win=65535 Len=0
1,1.7919099999999162,10.0.2.15,62.210.85.178,TLSv1.2,4124,Application Data
1,1.791957999999795,62.210.85.178,10.0.2.15,TCP,60,9001  >  35978 [ACK] Seq=10136697 Ack=184855525 Win=65535 Len=0
1,1.7919650000003458,62.210.85.178,10.0.2.15,TCP,60,9001  >  35978 [ACK] Seq=10136697 Ack=184856985 Win=65535 Len=0
1,1.791968999999881,62.210.85.178,10.0.2.15,TCP,60,9001  >  35978 [ACK] Seq=10136697 Ack=184858135 Win=65535 Len=0
1,1.7920459999995728,10.0.2.15,62.210.85.178,TLSv1.2,3030,Application Data
1,1.7920969999995577,62.210.85.178,10.0.2.15,TCP,60,9001  >  35978 [ACK] Seq=10136697 Ack=184859595 Win=65535 Len=0
1,1.7921049999995375,62.210.85.178,10.0.2.15,TCP,60,9001  >  35978 [ACK] Seq=10136697 Ack=184861055 Win=65535 Len=0
1,1.7921089999999822,62.210.85.178,10.0.2.15,TCP,60,9001  >  35978 [ACK] Seq=10136697 Ack=184861111 Win=65535 Len=0
1,1.804997999999614,10.0.2.15,62.210.85.178,TLSv1.2,4124,Application Data
1,1.8051539999996749,62.210.85.178,10.0.2.15,TCP,60,9001  >  35978 [ACK] Seq=10136697 Ack=184862571 Win=65535 Len=0
1,1.8051660000000993,62.210.85.178,10.0.2.15,TCP,60,9001  >  35978 [ACK] Seq=10136697 Ack=184864031 Win=65535 Len=0
1,1.805170999999973,62.210.85.178,10.0.2.15,TCP,60,9001  >  35978 [ACK] Seq=10136697 Ack=184865181 Win=65535 Len=0
1,1.8052299999999377,10.0.2.15,62.210.85.178,TLSv1.2,4124,Application Data
1,1.8052969999998822,10.0.2.15,62.210.85.178,TCP,2974,35978  >  9001 [ACK] Seq=184869251 Ack=10136697 Win=65535 Len=2920 [TCP segment of a reassembled PDU]
1,1.8053350000000137,62.210.85.178,10.0.2.15,TCP,60,9001  >  35978 [ACK] Seq=10136697 Ack=184866641 Win=65535 Len=0
1,1.805341999999655,62.210.85.178,10.0.2.15,TCP,60,9001  >  35978 [ACK] Seq=10136697 Ack=184868101 Win=65535 Len=0
1,1.8053469999995286,62.210.85.178,10.0.2.15,TCP,60,9001  >  35978 [ACK] Seq=10136697 Ack=184869251 Win=65535 Len=0
1,1.8053509999999733,62.210.85.178,10.0.2.15,TCP,60,9001  >  35978 [ACK] Seq=10136697 Ack=184870711 Win=65535 Len=0
1,1.805355999999847,62.210.85.178,10.0.2.15,TCP,60,9001  >  35978 [ACK] Seq=10136697 Ack=184872171 Win=65535 Len=0
1,1.805395000000317,10.0.2.15,62.210.85.178,TLSv1.2,1204,Application Data
1,1.8054700000002413,62.210.85.178,10.0.2.15,TCP,60,9001  >  35978 [ACK] Seq=10136697 Ack=184873321 Win=65535 Len=0
1,1.8055050000002666,10.0.2.15,62.210.85.178,TCP,2974,35978  >  9001 [ACK] Seq=184873321 Ack=10136697 Win=65535 Len=2920 [TCP segment of a reassembled PDU]
1,1.805543000000398,62.210.85.178,10.0.2.15,TCP,60,9001  >  35978 [ACK] Seq=10136697 Ack=184874781 Win=65535 Len=0
1,1.8055489999997008,62.210.85.178,10.0.2.15,TCP,60,9001  >  35978 [ACK] Seq=10136697 Ack=184876241 Win=65535 Len=0
1,1.805583000000297,10.0.2.15,62.210.85.178,TLSv1.2,1204,Application Data
1,1.80562000000009,62.210.85.178,10.0.2.15,TCP,60,9001  >  35978 [ACK] Seq=10136697 Ack=184877391 Win=65535 Len=0
1,1.8056610000003275,10.0.2.15,62.210.85.178,TLSv1.2,332,Application Data
1,1.805699999999888,62.210.85.178,10.0.2.15,TCP,60,9001  >  35978 [ACK] Seq=10136697 Ack=184877669 Win=65535 Len=0
1,1.805757000000085,10.0.2.15,62.210.85.178,TLSv1.2,3868,Application Data
1,1.8057980000003226,62.210.85.178,10.0.2.15,TCP,60,9001  >  35978 [ACK] Seq=10136697 Ack=184879129 Win=65535 Len=0
1,1.8058039999996254,62.210.85.178,10.0.2.15,TCP,60,9001  >  35978 [ACK] Seq=10136697 Ack=184880589 Win=65535 Len=0
1,1.8058090000004086,62.210.85.178,10.0.2.15,TCP,60,9001  >  35978 [ACK] Seq=10136697 Ack=184881483 Win=65535 Len=0
1,1.8058540000001813,10.0.2.15,62.210.85.178,TLSv1.2,2966,Application Data
1,1.8058940000000803,62.210.85.178,10.0.2.15,TCP,60,9001  >  35978 [ACK] Seq=10136697 Ack=184882943 Win=65535 Len=0
1,1.8059009999997215,62.210.85.178,10.0.2.15,TCP,60,9001  >  35978 [ACK] Seq=10136697 Ack=184884395 Win=65535 Len=0
1,1.8816289999995206,54.93.77.70,10.0.2.15,TLSv1.2,3674,Application Data
1,1.881757000000107,10.0.2.15,54.93.77.70,TCP,54,34692  >  9001 [ACK] Seq=10180655 Ack=184674591 Win=65535 Len=0
1,1.921158999999534,54.93.77.70,10.0.2.15,TLSv1.2,3674,Application Data
1,1.9212189999998373,10.0.2.15,54.93.77.70,TCP,54,34692  >  9001 [ACK] Seq=10180655 Ack=184678211 Win=65535 Len=0
1,1.9286039999997229,54.93.77.70,10.0.2.15,TLSv1.2,5846,Application Data
1,1.9286769999998796,10.0.2.15,54.93.77.70,TCP,54,34692  >  9001 [ACK] Seq=10180655 Ack=184684003 Win=65535 Len=0
1,1.928777000000082,54.93.77.70,10.0.2.15,TLSv1.2,2950,Application Data [TCP segment of a reassembled PDU]
1,1.9288729999998395,10.0.2.15,54.93.77.70,TCP,54,34692  >  9001 [ACK] Seq=10180655 Ack=184686899 Win=65535 Len=0
1,1.9408540000003995,54.93.77.70,10.0.2.15,TLSv1.2,170,Application Data
1,1.940881999999874,54.93.77.70,10.0.2.15,TCP,1474,9001  >  34692 [ACK] Seq=184687015 Ack=10180655 Win=65535 Len=1420 [TCP segment of a reassembled PDU]
1,1.9409370000003037,10.0.2.15,54.93.77.70,TCP,54,34692  >  9001 [ACK] Seq=10180655 Ack=184688435 Win=65535 Len=0
1,1.940969999999652,54.93.77.70,10.0.2.15,TLSv1.2,2978,Application Data [TCP segment of a reassembled PDU]
1,1.9409800000003088,54.93.77.70,10.0.2.15,TLSv1.2,2950,Application Data
1,1.9410310000002937,10.0.2.15,54.93.77.70,TCP,54,34692  >  9001 [ACK] Seq=10180655 Ack=184694255 Win=65535 Len=0
1,1.941251000000193,10.0.2.15,54.93.77.70,TLSv1.2,590,Application Data
1,1.9413180000001375,54.93.77.70,10.0.2.15,TCP,60,9001  >  34692 [ACK] Seq=184694255 Ack=10181191 Win=65535 Len=0
1,1.9560240000000704,54.93.77.70,10.0.2.15,TCP,2950,"9001  >  34692 [PSH, ACK] Seq=184694255 Ack=10181191 Win=65535 Len=2896 [TCP segment of a reassembled PDU]"
1,1.9560819999996966,10.0.2.15,54.93.77.70,TCP,54,34692  >  9001 [ACK] Seq=10181191 Ack=184697151 Win=65535 Len=0
1,1.9644379999999728,54.93.77.70,10.0.2.15,TLSv1.2,264,Application Data
1,1.9646249999996144,10.0.2.15,54.93.77.70,TLSv1.2,590,Application Data
1,1.9647390000000087,54.93.77.70,10.0.2.15,TCP,60,9001  >  34692 [ACK] Seq=184697361 Ack=10181727 Win=65535 Len=0
1,1.9659449999999197,54.93.77.70,10.0.2.15,TLSv1.2,7294,Application Data
1,1.9660119999998642,10.0.2.15,54.93.77.70,TCP,54,34692  >  9001 [ACK] Seq=10181727 Ack=184704601 Win=65535 Len=0
1,1.9796880000003512,54.93.77.70,10.0.2.15,TLSv1.2,4398,Application Data [TCP segment of a reassembled PDU]
1,1.9797429999998712,10.0.2.15,54.93.77.70,TCP,54,34692  >  9001 [ACK] Seq=10181727 Ack=184708945 Win=65535 Len=0
1,1.9824470000003203,54.93.77.70,10.0.2.15,TLSv1.2,894,"Application Data, Application Data"
1,1.9884480000000622,54.93.77.70,10.0.2.15,TLSv1.2,7294,Application Data
1,1.9885169999997743,10.0.2.15,54.93.77.70,TCP,54,34692  >  9001 [ACK] Seq=10181727 Ack=184717025 Win=65535 Len=0
1,1.9990360000001601,54.93.77.70,10.0.2.15,TLSv1.2,5846,"Application Data, Application Data, Application Data"
1,1.9990550000002258,54.93.77.70,10.0.2.15,TLSv1.2,4398,Application Data [TCP segment of a reassembled PDU]
1,1.9990950000001249,10.0.2.15,54.93.77.70,TCP,54,34692  >  9001 [ACK] Seq=10181727 Ack=184722817 Win=65535 Len=0
1,1.9991710000003877,10.0.2.15,54.93.77.70,TCP,54,34692  >  9001 [ACK] Seq=10181727 Ack=184727161 Win=65535 Len=0
1,1.9994909999995798,10.0.2.15,54.93.77.70,TLSv1.2,590,Application Data
1,1.999561999999969,54.93.77.70,10.0.2.15,TCP,60,9001  >  34692 [ACK] Seq=184727161 Ack=10182263 Win=65535 Len=0
1,2.00066599999991,54.93.77.70,10.0.2.15,TCP,1502,"9001  >  34692 [PSH, ACK] Seq=184727161 Ack=10182263 Win=65535 Len=1448 [TCP segment of a reassembled PDU]"
1,2.0007089999999152,10.0.2.15,54.93.77.70,TCP,54,34692  >  9001 [ACK] Seq=10182263 Ack=184728609 Win=65535 Len=0
1,2.0077140000003055,54.93.77.70,10.0.2.15,TLSv1.2,1408,Application Data
1,2.0132889999995314,54.93.77.70,10.0.2.15,TLSv1.2,4398,Application Data
1,2.0133569999998144,10.0.2.15,54.93.77.70,TCP,54,34692  >  9001 [ACK] Seq=10182263 Ack=184734307 Win=65535 Len=0
1,2.023588000000018,54.93.77.70,10.0.2.15,TLSv1.2,2950,Application Data [TCP segment of a reassembled PDU]
1,2.0236329999997906,10.0.2.15,54.93.77.70,TCP,54,34692  >  9001 [ACK] Seq=10182263 Ack=184737203 Win=65535 Len=0
1,2.024526000000151,54.93.77.70,10.0.2.15,TLSv1.2,7294,"Application Data, Application Data"
1,2.024591999999757,10.0.2.15,54.93.77.70,TCP,54,34692  >  9001 [ACK] Seq=10182263 Ack=184744443 Win=65535 Len=0
1,2.024862000000212,10.0.2.15,54.93.77.70,TLSv1.2,590,Application Data
1,2.0249910000002274,54.93.77.70,10.0.2.15,TCP,60,9001  >  34692 [ACK] Seq=184744443 Ack=10182799 Win=65535 Len=0
1,2.026738999999907,54.93.77.70,10.0.2.15,TLSv1.2,1104,Application Data
1,2.038601999999628,54.93.77.70,10.0.2.15,TCP,2950,"9001  >  34692 [PSH, ACK] Seq=184745493 Ack=10182799 Win=65535 Len=2896 [TCP segment of a reassembled PDU]"
1,2.038647999999739,10.0.2.15,54.93.77.70,TCP,54,34692  >  9001 [ACK] Seq=10182799 Ack=184748389 Win=65535 Len=0
1,2.0570440000001327,54.93.77.70,10.0.2.15,TLSv1.2,778,Application Data
1,2.057230999999774,10.0.2.15,54.93.77.70,TLSv1.2,590,Application Data
1,2.0573480000002746,54.93.77.70,10.0.2.15,TCP,60,9001  >  34692 [ACK] Seq=184749113 Ack=10183335 Win=65535 Len=0
1,2.0652149999996254,10.0.2.15,54.93.77.70,TLSv1.2,1104,Application Data
1,2.065400999999838,54.93.77.70,10.0.2.15,TCP,60,9001  >  34692 [ACK] Seq=184749113 Ack=10184385 Win=65535 Len=0
1,2.078139000000192,54.93.77.70,10.0.2.15,TLSv1.2,590,Application Data
1,2.121132999999645,10.0.2.15,54.93.77.70,TCP,54,34692  >  9001 [ACK] Seq=10184385 Ack=184749649 Win=65535 Len=0
1,2.165265999999974,62.210.85.178,10.0.2.15,TLSv1.2,2132,Application Data
1,2.165407000000414,10.0.2.15,62.210.85.178,TCP,54,35978  >  9001 [ACK] Seq=184884395 Ack=10138775 Win=65535 Len=0
1,2.1966169999996055,62.210.85.178,10.0.2.15,TLSv1.2,590,Application Data
1,2.2399960000002466,10.0.2.15,62.210.85.178,TCP,54,35978  >  9001 [ACK] Seq=184884395 Ack=10139311 Win=65535 Len=0
1,2.2904209999996965,62.210.85.178,10.0.2.15,TLSv1.2,1104,Application Data
1,2.2905339999997523,10.0.2.15,62.210.85.178,TCP,54,35978  >  9001 [ACK] Seq=184884395 Ack=10140361 Win=65535 Len=0
1,2.2916340000001583,10.0.2.15,62.210.85.178,TLSv1.2,590,Application Data
1,2.292218999999932,62.210.85.178,10.0.2.15,TCP,60,9001  >  35978 [ACK] Seq=10140361 Ack=184884931 Win=65535 Len=0
1,2.75358899999992,54.93.77.70,10.0.2.15,TLSv1.2,590,Application Data
1,2.753679000000375,10.0.2.15,54.93.77.70,TCP,54,34692  >  9001 [ACK] Seq=10184385 Ack=184750185 Win=65535 Len=0
1,2.754106999999749,10.0.2.15,54.93.77.70,TLSv1.2,590,Application Data
1,2.754229000000123,54.93.77.70,10.0.2.15,TCP,60,9001  >  34692 [ACK] Seq=184750185 Ack=10184921 Win=65535 Len=0
1,2.959418999999798,62.210.85.178,10.0.2.15,TLSv1.2,590,Application Data
1,2.963152000000264,10.0.2.15,62.210.85.178,TLSv1.2,590,Application Data
1,2.9633539999995264,62.210.85.178,10.0.2.15,TCP,60,9001  >  35978 [ACK] Seq=10140897 Ack=184885467 Win=65535 Len=0
1,2.972976000000017,10.0.2.15,62.210.85.178,TLSv1.2,1618,Application Data
1,2.9740789999996196,62.210.85.178,10.0.2.15,TCP,60,9001  >  35978 [ACK] Seq=10140897 Ack=184886927 Win=65535 Len=0
1,2.974148000000241,62.210.85.178,10.0.2.15,TCP,60,9001  >  35978 [ACK] Seq=10140897 Ack=184887031 Win=65535 Len=0
1,3.07582900000034,54.93.77.70,10.0.2.15,TLSv1.2,2132,Application Data
1,3.0759479999996984,10.0.2.15,54.93.77.70,TCP,54,34692  >  9001 [ACK] Seq=10184921 Ack=184752263 Win=65535 Len=0
1,3.078400999999758,10.0.2.15,54.93.77.70,TLSv1.2,590,Application Data
1,3.078545999999733,54.93.77.70,10.0.2.15,TCP,60,9001  >  34692 [ACK] Seq=184752263 Ack=10185457 Win=65535 Len=0
1,3.2656950000000506,62.210.85.178,10.0.2.15,TLSv1.2,590,Application Data
1,3.265983999999662,10.0.2.15,62.210.85.178,TLSv1.2,590,Application Data
1,3.266088999999738,62.210.85.178,10.0.2.15,TCP,60,9001  >  35978 [ACK] Seq=10141433 Ack=184887567 Win=65535 Len=0
1,3.6764119999998,54.93.77.70,10.0.2.15,TLSv1.2,590,Application Data
1,3.676854999999705,10.0.2.15,54.93.77.70,TLSv1.2,590,Application Data
1,3.6769969999995737,54.93.77.70,10.0.2.15,TCP,60,9001  >  34692 [ACK] Seq=184752799 Ack=10185993 Win=65535 Len=0
1,3.78210399999989,62.210.85.178,10.0.2.15,TLSv1.2,590,Application Data
1,3.784896000000117,10.0.2.15,62.210.85.178,TLSv1.2,590,Application Data
1,3.785058999999819,62.210.85.178,10.0.2.15,TCP,60,9001  >  35978 [ACK] Seq=10141969 Ack=184888103 Win=65535 Len=0
1,3.796857999999702,10.0.2.15,62.210.85.178,TLSv1.2,4124,Application Data
1,3.7969599999996717,10.0.2.15,62.210.85.178,TCP,1514,35978  >  9001 [ACK] Seq=184892173 Ack=10141969 Win=65535 Len=1460 [TCP segment of a reassembled PDU]
1,3.7970130000003337,62.210.85.178,10.0.2.15,TCP,60,9001  >  35978 [ACK] Seq=10141969 Ack=184889563 Win=65535 Len=0
1,3.7970269999996162,62.210.85.178,10.0.2.15,TCP,60,9001  >  35978 [ACK] Seq=10141969 Ack=184891023 Win=65535 Len=0
1,3.7970320000003994,62.210.85.178,10.0.2.15,TCP,60,9001  >  35978 [ACK] Seq=10141969 Ack=184892173 Win=65535 Len=0
1,3.7970359999999346,62.210.85.178,10.0.2.15,TCP,60,9001  >  35978 [ACK] Seq=10141969 Ack=184893633 Win=65535 Len=0
1,3.79707099999996,10.0.2.15,62.210.85.178,TLSv1.2,736,Application Data
1,3.7971049999996467,62.210.85.178,10.0.2.15,TCP,60,9001  >  35978 [ACK] Seq=10141969 Ack=184894315 Win=65535 Len=0
1,3.900039000000106,54.93.77.70,10.0.2.15,TLSv1.2,590,Application Data
1,3.912680000000364,54.93.77.70,10.0.2.15,TCP,2950,"9001  >  34692 [PSH, ACK] Seq=184753335 Ack=10185993 Win=65535 Len=2896 [TCP segment of a reassembled PDU]"
1,3.912822000000233,10.0.2.15,54.93.77.70,TCP,54,34692  >  9001 [ACK] Seq=10185993 Ack=184756231 Win=65535 Len=0
1,3.915758000000096,54.93.77.70,10.0.2.15,TLSv1.2,778,Application Data
1,3.923265000000356,54.93.77.70,10.0.2.15,TCP,1502,"9001  >  34692 [PSH, ACK] Seq=184756955 Ack=10185993 Win=65535 Len=1448 [TCP segment of a reassembled PDU]"
1,3.9233320000003005,10.0.2.15,54.93.77.70,TCP,54,34692  >  9001 [ACK] Seq=10185993 Ack=184758403 Win=65535 Len=0
1,3.933654999999817,54.93.77.70,10.0.2.15,TLSv1.2,1198,Application Data
1,3.936797999999726,10.0.2.15,54.93.77.70,TLSv1.2,590,Application Data
1,3.936953999999787,54.93.77.70,10.0.2.15,TCP,60,9001  >  34692 [ACK] Seq=184759547 Ack=10186529 Win=65535 Len=0
1,4.291357000000062,62.210.85.178,10.0.2.15,TLSv1.2,590,Application Data
1,4.291948000000048,10.0.2.15,62.210.85.178,TLSv1.2,590,Application Data
1,4.292413999999553,62.210.85.178,10.0.2.15,TCP,60,9001  >  35978 [ACK] Seq=10142505 Ack=184894851 Win=65535 Len=0
1,4.495281999999861,54.93.77.70,10.0.2.15,TLSv1.2,590,Application Data
1,4.495743999999831,10.0.2.15,54.93.77.70,TLSv1.2,590,Application Data
1,4.495899999999892,54.93.77.70,10.0.2.15,TCP,60,9001  >  34692 [ACK] Seq=184760083 Ack=10187065 Win=65535 Len=0
1,4.700850000000173,62.210.85.178,10.0.2.15,TLSv1.2,590,Application Data
1,4.704869000000144,10.0.2.15,62.210.85.178,TLSv1.2,590,Application Data
1,4.705063000000337,62.210.85.178,10.0.2.15,TCP,60,9001  >  35978 [ACK] Seq=10143041 Ack=184895387 Win=65535 Len=0
1,4.7160700000004,10.0.2.15,62.210.85.178,TLSv1.2,4124,Application Data
1,4.716194999999971,10.0.2.15,62.210.85.178,TCP,2974,35978  >  9001 [ACK] Seq=184899457 Ack=10143041 Win=65535 Len=2920 [TCP segment of a reassembled PDU]
1,4.71624200000042,62.210.85.178,10.0.2.15,TCP,60,9001  >  35978 [ACK] Seq=10143041 Ack=184896847 Win=65535 Len=0
1,4.716252000000168,62.210.85.178,10.0.2.15,TCP,60,9001  >  35978 [ACK] Seq=10143041 Ack=184898307 Win=65535 Len=0
1,4.716257000000041,62.210.85.178,10.0.2.15,TCP,60,9001  >  35978 [ACK] Seq=10143041 Ack=184899457 Win=65535 Len=0
1,4.716298000000279,10.0.2.15,62.210.85.178,TLSv1.2,1204,Application Data
1,4.716338000000178,62.210.85.178,10.0.2.15,TCP,60,9001  >  35978 [ACK] Seq=10143041 Ack=184900917 Win=65535 Len=0
1,4.71634400000039,62.210.85.178,10.0.2.15,TCP,60,9001  >  35978 [ACK] Seq=10143041 Ack=184902377 Win=65535 Len=0
1,4.716347999999925,62.210.85.178,10.0.2.15,TCP,60,9001  >  35978 [ACK] Seq=10143041 Ack=184903527 Win=65535 Len=0
1,4.716395999999804,10.0.2.15,62.210.85.178,TLSv1.2,1746,Application Data
1,4.716494999999668,62.210.85.178,10.0.2.15,TCP,60,9001  >  35978 [ACK] Seq=10143041 Ack=184904987 Win=65535 Len=0
1,4.716507999999521,62.210.85.178,10.0.2.15,TCP,60,9001  >  35978 [ACK] Seq=10143041 Ack=184905219 Win=65535 Len=0
1,4.820576000000074,54.93.77.70,10.0.2.15,TLSv1.2,590,Application Data
1,4.844033000000309,54.93.77.70,10.0.2.15,TCP,2950,"9001  >  34692 [PSH, ACK] Seq=184760619 Ack=10187065 Win=65535 Len=2896 [TCP segment of a reassembled PDU]"
1,4.844111999999768,10.0.2.15,54.93.77.70,TCP,54,34692  >  9001 [ACK] Seq=10187065 Ack=184763515 Win=65535 Len=0
1,4.85734500000035,54.93.77.70,10.0.2.15,TLSv1.2,4398,"Application Data, Application Data"
1,4.857417999999598,10.0.2.15,54.93.77.70,TCP,54,34692  >  9001 [ACK] Seq=10187065 Ack=184767859 Win=65535 Len=0
1,4.868908999999803,54.93.77.70,10.0.2.15,TLSv1.2,590,Application Data
1,4.879167000000052,54.93.77.70,10.0.2.15,TCP,1502,"9001  >  34692 [PSH, ACK] Seq=184768395 Ack=10187065 Win=65535 Len=1448 [TCP segment of a reassembled PDU]"
1,4.879243999999744,10.0.2.15,54.93.77.70,TCP,54,34692  >  9001 [ACK] Seq=10187065 Ack=184769843 Win=65535 Len=0
1,4.895816999999624,54.93.77.70,10.0.2.15,TLSv1.2,684,Application Data
1,4.898076000000401,10.0.2.15,54.93.77.70,TLSv1.2,590,Application Data
1,4.898247999999512,54.93.77.70,10.0.2.15,TCP,60,9001  >  34692 [ACK] Seq=184770473 Ack=10187601 Win=65535 Len=0
1,4.998851000000286,62.210.85.178,10.0.2.15,TLSv1.2,590,Application Data
1,4.999235000000226,10.0.2.15,62.210.85.178,TLSv1.2,590,Application Data
1,4.999375000000327,62.210.85.178,10.0.2.15,TCP,60,9001  >  35978 [ACK] Seq=10143577 Ack=184905755 Win=65535 Len=0
1,5.108135999999831,54.93.77.70,10.0.2.15,TLSv1.2,590,Application Data
1,5.108511000000362,10.0.2.15,54.93.77.70,TLSv1.2,590,Application Data
1,5.108618000000206,54.93.77.70,10.0.2.15,TCP,60,9001  >  34692 [ACK] Seq=184771009 Ack=10188137 Win=65535 Len=0
1,5.313747999999578,62.210.85.178,10.0.2.15,TLSv1.2,590,Application Data
1,5.320192000000134,10.0.2.15,62.210.85.178,TLSv1.2,590,Application Data
1,5.320389999999861,62.210.85.178,10.0.2.15,TCP,60,9001  >  35978 [ACK] Seq=10144113 Ack=184906291 Win=65535 Len=0
1,5.332806000000346,10.0.2.15,62.210.85.178,TLSv1.2,4124,Application Data
1,5.332913999999619,10.0.2.15,62.210.85.178,TCP,2974,35978  >  9001 [ACK] Seq=184910361 Ack=10144113 Win=65535 Len=2920 [TCP segment of a reassembled PDU]
1,5.332957999999962,62.210.85.178,10.0.2.15,TCP,60,9001  >  35978 [ACK] Seq=10144113 Ack=184907751 Win=65535 Len=0
1,5.33296799999971,62.210.85.178,10.0.2.15,TCP,60,9001  >  35978 [ACK] Seq=10144113 Ack=184909211 Win=65535 Len=0
1,5.332972999999583,62.210.85.178,10.0.2.15,TCP,60,9001  >  35978 [ACK] Seq=10144113 Ack=184910361 Win=65535 Len=0
1,5.332978000000367,62.210.85.178,10.0.2.15,TCP,60,9001  >  35978 [ACK] Seq=10144113 Ack=184911821 Win=65535 Len=0
1,5.332981999999902,62.210.85.178,10.0.2.15,TCP,60,9001  >  35978 [ACK] Seq=10144113 Ack=184913281 Win=65535 Len=0
1,5.3330269999996744,10.0.2.15,62.210.85.178,TLSv1.2,1204,Application Data
1,5.333096000000296,10.0.2.15,62.210.85.178,TCP,2974,35978  >  9001 [ACK] Seq=184914431 Ack=10144113 Win=65535 Len=2920 [TCP segment of a reassembled PDU]
1,5.333136999999624,62.210.85.178,10.0.2.15,TCP,60,9001  >  35978 [ACK] Seq=10144113 Ack=184914431 Win=65535 Len=0
1,5.333144000000175,62.210.85.178,10.0.2.15,TCP,60,9001  >  35978 [ACK] Seq=10144113 Ack=184915891 Win=65535 Len=0
1,5.33314799999971,62.210.85.178,10.0.2.15,TCP,60,9001  >  35978 [ACK] Seq=10144113 Ack=184917351 Win=65535 Len=0
1,5.333182999999735,10.0.2.15,62.210.85.178,TLSv1.2,1204,Application Data
1,5.333247999999912,10.0.2.15,62.210.85.178,TCP,2974,35978  >  9001 [ACK] Seq=184918501 Ack=10144113 Win=65535 Len=2920 [TCP segment of a reassembled PDU]
1,5.333284999999705,62.210.85.178,10.0.2.15,TCP,60,9001  >  35978 [ACK] Seq=10144113 Ack=184918501 Win=65535 Len=0
1,5.333292000000256,62.210.85.178,10.0.2.15,TCP,60,9001  >  35978 [ACK] Seq=10144113 Ack=184919961 Win=65535 Len=0
1,5.33329700000013,62.210.85.178,10.0.2.15,TCP,60,9001  >  35978 [ACK] Seq=10144113 Ack=184921421 Win=65535 Len=0
1,5.333329000000049,10.0.2.15,62.210.85.178,TLSv1.2,1204,Application Data
1,5.333410999999614,10.0.2.15,62.210.85.178,TLSv1.2,2974,Application Data
1,5.333450999999513,62.210.85.178,10.0.2.15,TCP,60,9001  >  35978 [ACK] Seq=10144113 Ack=184922571 Win=65535 Len=0
1,5.333456999999726,62.210.85.178,10.0.2.15,TCP,60,9001  >  35978 [ACK] Seq=10144113 Ack=184924031 Win=65535 Len=0
1,5.333461999999599,62.210.85.178,10.0.2.15,TCP,60,9001  >  35978 [ACK] Seq=10144113 Ack=184925491 Win=65535 Len=0
1,5.333493999999519,10.0.2.15,62.210.85.178,TLSv1.2,1226,Application Data
1,5.33353199999965,62.210.85.178,10.0.2.15,TCP,60,9001  >  35978 [ACK] Seq=10144113 Ack=184926663 Win=65535 Len=0
1,5.333582000000206,10.0.2.15,62.210.85.178,TLSv1.2,4124,Application Data
1,5.333622000000105,62.210.85.178,10.0.2.15,TCP,60,9001  >  35978 [ACK] Seq=10144113 Ack=184928123 Win=65535 Len=0
1,5.333628999999746,62.210.85.178,10.0.2.15,TCP,60,9001  >  35978 [ACK] Seq=10144113 Ack=184929583 Win=65535 Len=0
1,5.33363399999962,62.210.85.178,10.0.2.15,TCP,60,9001  >  35978 [ACK] Seq=10144113 Ack=184930733 Win=65535 Len=0
1,5.333679999999731,10.0.2.15,62.210.85.178,TLSv1.2,3030,Application Data
1,5.333720999999969,62.210.85.178,10.0.2.15,TCP,60,9001  >  35978 [ACK] Seq=10144113 Ack=184932193 Win=65535 Len=0
1,5.33372799999961,62.210.85.178,10.0.2.15,TCP,60,9001  >  35978 [ACK] Seq=10144113 Ack=184933653 Win=65535 Len=0
1,5.3337320000000545,62.210.85.178,10.0.2.15,TCP,60,9001  >  35978 [ACK] Seq=10144113 Ack=184933709 Win=65535 Len=0
1,5.3429150000001755,10.0.2.15,62.210.85.178,TLSv1.2,4124,Application Data
1,5.342993999999635,10.0.2.15,62.210.85.178,TCP,2974,35978  >  9001 [ACK] Seq=184937779 Ack=10144113 Win=65535 Len=2920 [TCP segment of a reassembled PDU]
1,5.343031000000337,62.210.85.178,10.0.2.15,TCP,60,9001  >  35978 [ACK] Seq=10144113 Ack=184935169 Win=65535 Len=0
1,5.343037999999979,62.210.85.178,10.0.2.15,TCP,60,9001  >  35978 [ACK] Seq=10144113 Ack=184936629 Win=65535 Len=0
1,5.343042999999852,62.210.85.178,10.0.2.15,TCP,60,9001  >  35978 [ACK] Seq=10144113 Ack=184937779 Win=65535 Len=0
1,5.343047999999726,62.210.85.178,10.0.2.15,TCP,60,9001  >  35978 [ACK] Seq=10144113 Ack=184939239 Win=65535 Len=0
1,5.343052000000171,62.210.85.178,10.0.2.15,TCP,60,9001  >  35978 [ACK] Seq=10144113 Ack=184940699 Win=65535 Len=0
1,5.34309200000007,10.0.2.15,62.210.85.178,TLSv1.2,1204,Application Data
1,5.343184999999721,62.210.85.178,10.0.2.15,TCP,60,9001  >  35978 [ACK] Seq=10144113 Ack=184941849 Win=65535 Len=0
1,5.343227999999726,10.0.2.15,62.210.85.178,TLSv1.2,204,Application Data
1,5.343329000000267,62.210.85.178,10.0.2.15,TCP,60,9001  >  35978 [ACK] Seq=10144113 Ack=184941999 Win=65535 Len=0
1,5.451022999999623,54.93.77.70,10.0.2.15,TLSv1.2,590,Application Data
1,5.463803999999982,54.93.77.70,10.0.2.15,TLSv1.2,7294,Application Data
1,5.463902000000417,10.0.2.15,54.93.77.70,TCP,54,34692  >  9001 [ACK] Seq=10188137 Ack=184778785 Win=65535 Len=0
1,5.475233000000117,54.93.77.70,10.0.2.15,TLSv1.2,2950,Application Data [TCP segment of a reassembled PDU]
1,5.475319999999556,10.0.2.15,54.93.77.70,TCP,54,34692  >  9001 [ACK] Seq=10188137 Ack=184781681 Win=65535 Len=0
1,5.481275000000096,54.93.77.70,10.0.2.15,TLSv1.2,1292,Application Data
1,5.493438999999853,54.93.77.70,10.0.2.15,TCP,2950,"9001  >  34692 [PSH, ACK] Seq=184782919 Ack=10188137 Win=65535 Len=2896 [TCP segment of a reassembled PDU]"
1,5.493508999999904,10.0.2.15,54.93.77.70,TCP,54,34692  >  9001 [ACK] Seq=10188137 Ack=184785815 Win=65535 Len=0
1,5.510620000000017,54.93.77.70,10.0.2.15,TLSv1.2,778,Application Data
1,5.513471000000209,54.93.77.70,10.0.2.15,TLSv1.2,4398,Application Data
1,5.513538000000153,10.0.2.15,54.93.77.70,TCP,54,34692  >  9001 [ACK] Seq=10188137 Ack=184790883 Win=65535 Len=0
1,5.523376000000098,54.93.77.70,10.0.2.15,TLSv1.2,2950,Application Data [TCP segment of a reassembled PDU]
1,5.523423999999977,10.0.2.15,54.93.77.70,TCP,54,34692  >  9001 [ACK] Seq=10188137 Ack=184793779 Win=65535 Len=0
1,5.524975999999697,54.93.77.70,10.0.2.15,TLSv1.2,2950,Application Data [TCP segment of a reassembled PDU]
1,5.525018999999702,10.0.2.15,54.93.77.70,TCP,54,34692  >  9001 [ACK] Seq=10188137 Ack=184796675 Win=65535 Len=0
1,5.525805000000219,54.93.77.70,10.0.2.15,TLSv1.2,5846,Application Data [TCP segment of a reassembled PDU]
1,5.525872000000163,10.0.2.15,54.93.77.70,TCP,54,34692  >  9001 [ACK] Seq=10188137 Ack=184802467 Win=65535 Len=0
1,5.526063000000249,10.0.2.15,54.93.77.70,TLSv1.2,1104,Application Data
1,5.526170000000093,54.93.77.70,10.0.2.15,TCP,60,9001  >  34692 [ACK] Seq=184802467 Ack=10189187 Win=65535 Len=0
1,5.528819999999541,54.93.77.70,10.0.2.15,TLSv1.2,684,Application Data
1,5.535848999999871,54.93.77.70,10.0.2.15,TCP,2950,"9001  >  34692 [PSH, ACK] Seq=184803097 Ack=10189187 Win=65535 Len=2896 [TCP segment of a reassembled PDU]"
1,5.535893999999644,10.0.2.15,54.93.77.70,TCP,54,34692  >  9001 [ACK] Seq=10189187 Ack=184805993 Win=65535 Len=0
1,5.5535799999997835,54.93.77.70,10.0.2.15,TLSv1.2,1314,"Application Data, Application Data"
1,5.556733000000349,10.0.2.15,54.93.77.70,TLSv1.2,590,Application Data
1,5.556939000000057,54.93.77.70,10.0.2.15,TCP,60,9001  >  34692 [ACK] Seq=184807253 Ack=10189723 Win=65535 Len=0
1,5.649085000000014,62.210.85.178,10.0.2.15,TLSv1.2,1104,Application Data
1,5.692070000000058,10.0.2.15,62.210.85.178,TCP,54,35978  >  9001 [ACK] Seq=184941999 Ack=10145163 Win=65535 Len=0
1,5.763818999999785,62.210.85.178,10.0.2.15,TLSv1.2,590,Application Data
1,5.763906999999563,10.0.2.15,62.210.85.178,TCP,54,35978  >  9001 [ACK] Seq=184941999 Ack=10145699 Win=65535 Len=0
1,5.764514000000418,10.0.2.15,62.210.85.178,TLSv1.2,590,Application Data
1,5.76464599999963,62.210.85.178,10.0.2.15,TCP,60,9001  >  35978 [ACK] Seq=10145699 Ack=184942535 Win=65535 Len=0
1,5.848820999999589,54.93.77.70,10.0.2.15,TLSv1.2,590,Application Data
1,5.8492630000000645,10.0.2.15,54.93.77.70,TLSv1.2,590,Application Data
1,5.849403999999595,54.93.77.70,10.0.2.15,TCP,60,9001  >  34692 [ACK] Seq=184807789 Ack=10190259 Win=65535 Len=0
1,5.968584000000192,62.210.85.178,10.0.2.15,TLSv1.2,590,Application Data
1,5.97429000000011,10.0.2.15,62.210.85.178,TLSv1.2,590,Application Data
1,5.9744629999995595,62.210.85.178,10.0.2.15,TCP,60,9001  >  35978 [ACK] Seq=10146235 Ack=184943071 Win=65535 Len=0
1,5.984715999999935,10.0.2.15,62.210.85.178,TLSv1.2,4124,Application Data
1,5.984929000000193,10.0.2.15,62.210.85.178,TCP,2974,35978  >  9001 [ACK] Seq=184947141 Ack=10146235 Win=65535 Len=2920 [TCP segment of a reassembled PDU]
1,5.9849709999998595,62.210.85.178,10.0.2.15,TCP,60,9001  >  35978 [ACK] Seq=10146235 Ack=184944531 Win=65535 Len=0
1,5.9849850000000515,62.210.85.178,10.0.2.15,TCP,60,9001  >  35978 [ACK] Seq=10146235 Ack=184945991 Win=65535 Len=0
1,5.984989999999925,62.210.85.178,10.0.2.15,TCP,60,9001  >  35978 [ACK] Seq=10146235 Ack=184947141 Win=65535 Len=0
1,5.985061000000314,10.0.2.15,62.210.85.178,TLSv1.2,1204,Application Data
1,5.985083999999915,62.210.85.178,10.0.2.15,TCP,60,9001  >  35978 [ACK] Seq=10146235 Ack=184948601 Win=65535 Len=0
1,5.9850909999995565,62.210.85.178,10.0.2.15,TCP,60,9001  >  35978 [ACK] Seq=10146235 Ack=184950061 Win=65535 Len=0
1,5.985163000000284,62.210.85.178,10.0.2.15,TCP,60,9001  >  35978 [ACK] Seq=10146235 Ack=184951211 Win=65535 Len=0
1,5.985206000000289,10.0.2.15,62.210.85.178,TLSv1.2,4124,Application Data
1,5.985273000000234,10.0.2.15,62.210.85.178,TCP,2974,35978  >  9001 [ACK] Seq=184955281 Ack=10146235 Win=65535 Len=2920 [TCP segment of a reassembled PDU]
1,5.985335999999734,62.210.85.178,10.0.2.15,TCP,60,9001  >  35978 [ACK] Seq=10146235 Ack=184952671 Win=65535 Len=0
1,5.985343999999714,62.210.85.178,10.0.2.15,TCP,60,9001  >  35978 [ACK] Seq=10146235 Ack=184954131 Win=65535 Len=0
1,5.985348999999587,62.210.85.178,10.0.2.15,TCP,60,9001  >  35978 [ACK] Seq=10146235 Ack=184955281 Win=65535 Len=0
1,5.98535400000037,62.210.85.178,10.0.2.15,TCP,60,9001  >  35978 [ACK] Seq=10146235 Ack=184956741 Win=65535 Len=0
1,5.985357999999906,62.210.85.178,10.0.2.15,TCP,60,9001  >  35978 [ACK] Seq=10146235 Ack=184958201 Win=65535 Len=0
1,5.985397999999805,10.0.2.15,62.210.85.178,TLSv1.2,1204,Application Data
1,5.98546400000032,62.210.85.178,10.0.2.15,TCP,60,9001  >  35978 [ACK] Seq=10146235 Ack=184959351 Win=65535 Len=0
1,5.985507000000325,10.0.2.15,62.210.85.178,TLSv1.2,332,Application Data
1,5.985545999999886,62.210.85.178,10.0.2.15,TCP,60,9001  >  35978 [ACK] Seq=10146235 Ack=184959629 Win=65535 Len=0
1,5.985609999999724,10.0.2.15,62.210.85.178,TLSv1.2,3868,Application Data
1,5.9856520000003,62.210.85.178,10.0.2.15,TCP,60,9001  >  35978 [ACK] Seq=10146235 Ack=184961089 Win=65535 Len=0
1,5.985658999999941,62.210.85.178,10.0.2.15,TCP,60,9001  >  35978 [ACK] Seq=10146235 Ack=184962549 Win=65535 Len=0
1,5.985663999999815,62.210.85.178,10.0.2.15,TCP,60,9001  >  35978 [ACK] Seq=10146235 Ack=184963443 Win=65535 Len=0
1,5.985708000000159,10.0.2.15,62.210.85.178,TLSv1.2,396,Application Data
1,5.985808000000361,62.210.85.178,10.0.2.15,TCP,60,9001  >  35978 [ACK] Seq=10146235 Ack=184963785 Win=65535 Len=0
1,6.079652000000351,54.93.77.70,10.0.2.15,TLSv1.2,3674,Application Data
1,6.079818000000159,10.0.2.15,54.93.77.70,TCP,54,34692  >  9001 [ACK] Seq=10190259 Ack=184811409 Win=65535 Len=0
1,6.095510999999533,54.93.77.70,10.0.2.15,TCP,2950,"9001  >  34692 [PSH, ACK] Seq=184811409 Ack=10190259 Win=65535 Len=2896 [TCP segment of a reassembled PDU]"
1,6.095585000000028,10.0.2.15,54.93.77.70,TCP,54,34692  >  9001 [ACK] Seq=10190259 Ack=184814305 Win=65535 Len=0
1,6.096543999999994,54.93.77.70,10.0.2.15,TLSv1.2,778,Application Data
1,6.113601000000017,54.93.77.70,10.0.2.15,TLSv1.2,2950,Application Data
1,6.113648999999896,10.0.2.15,54.93.77.70,TCP,54,34692  >  9001 [ACK] Seq=10190259 Ack=184817925 Win=65535 Len=0
1,6.114580999999816,54.93.77.70,10.0.2.15,TCP,1502,"9001  >  34692 [PSH, ACK] Seq=184817925 Ack=10190259 Win=65535 Len=1448 [TCP segment of a reassembled PDU]"
1,6.11462500000016,10.0.2.15,54.93.77.70,TCP,54,34692  >  9001 [ACK] Seq=10190259 Ack=184819373 Win=65535 Len=0
1,6.115303999999924,54.93.77.70,10.0.2.15,TLSv1.2,4398,Application Data [TCP segment of a reassembled PDU]
1,6.115367000000333,10.0.2.15,54.93.77.70,TCP,54,34692  >  9001 [ACK] Seq=10190259 Ack=184823717 Win=65535 Len=0
1,6.127838000000338,54.93.77.70,10.0.2.15,TLSv1.2,2950,"Application Data, Application Data"
1,6.127883000000111,10.0.2.15,54.93.77.70,TCP,54,34692  >  9001 [ACK] Seq=10190259 Ack=184826613 Win=65535 Len=0
1,6.130780999999843,54.93.77.70,10.0.2.15,TLSv1.2,1944,Application Data
1,6.130823999999848,10.0.2.15,54.93.77.70,TCP,54,34692  >  9001 [ACK] Seq=10190259 Ack=184828503 Win=65535 Len=0
1,6.140260999999555,10.0.2.15,54.93.77.70,TLSv1.2,590,Application Data
1,6.1403870000003735,54.93.77.70,10.0.2.15,TCP,60,9001  >  34692 [ACK] Seq=184828503 Ack=10190795 Win=65535 Len=0
1,6.150102999999945,10.0.2.15,54.93.77.70,TLSv1.2,590,Application Data
1,6.150281999999606,54.93.77.70,10.0.2.15,TCP,60,9001  >  34692 [ACK] Seq=184828503 Ack=10191331 Win=65535 Len=0
1,6.210368000000017,54.93.77.70,10.0.2.15,TLSv1.2,590,Application Data
1,6.236635000000206,62.210.85.178,10.0.2.15,TLSv1.2,590,Application Data
1,6.252002999999604,10.0.2.15,54.93.77.70,TCP,54,34692  >  9001 [ACK] Seq=10191331 Ack=184829039 Win=65535 Len=0
1,6.2801369999997405,10.0.2.15,62.210.85.178,TCP,54,35978  >  9001 [ACK] Seq=184963785 Ack=10146771 Win=65535 Len=0
1,6.289937999999893,62.210.85.178,10.0.2.15,TLSv1.2,590,Application Data
1,6.290200999999797,10.0.2.15,62.210.85.178,TCP,54,35978  >  9001 [ACK] Seq=184963785 Ack=10147307 Win=65535 Len=0
1,6.291302999999971,10.0.2.15,62.210.85.178,TLSv1.2,590,Application Data
1,6.291627999999946,62.210.85.178,10.0.2.15,TCP,60,9001  >  35978 [ACK] Seq=10147307 Ack=184964321 Win=65535 Len=0
1,6.441815000000133,54.93.77.70,10.0.2.15,TLSv1.2,590,Application Data
1,6.441888999999719,10.0.2.15,54.93.77.70,TCP,54,34692  >  9001 [ACK] Seq=10191331 Ack=184829575 Win=65535 Len=0
1,6.4422709999998915,10.0.2.15,54.93.77.70,TLSv1.2,590,Application Data
1,6.442363000000114,54.93.77.70,10.0.2.15,TCP,60,9001  >  34692 [ACK] Seq=184829575 Ack=10191867 Win=65535 Len=0
1,6.646195000000262,62.210.85.178,10.0.2.15,TLSv1.2,590,Application Data
1,6.6518770000002405,10.0.2.15,62.210.85.178,TLSv1.2,590,Application Data
1,6.65205799999967,62.210.85.178,10.0.2.15,TCP,60,9001  >  35978 [ACK] Seq=10147843 Ack=184964857 Win=65535 Len=0
1,6.66448599999967,10.0.2.15,62.210.85.178,TLSv1.2,4124,Application Data
1,6.664590999999746,10.0.2.15,62.210.85.178,TCP,2974,35978  >  9001 [ACK] Seq=184968927 Ack=10147843 Win=65535 Len=2920 [TCP segment of a reassembled PDU]
1,6.664633000000322,62.210.85.178,10.0.2.15,TCP,60,9001  >  35978 [ACK] Seq=10147843 Ack=184966317 Win=65535 Len=0
1,6.664646000000175,62.210.85.178,10.0.2.15,TCP,60,9001  >  35978 [ACK] Seq=10147843 Ack=184967777 Win=65535 Len=0
1,6.66464999999971,62.210.85.178,10.0.2.15,TCP,60,9001  >  35978 [ACK] Seq=10147843 Ack=184968927 Win=65535 Len=0
1,6.6646529999998165,62.210.85.178,10.0.2.15,TCP,60,9001  >  35978 [ACK] Seq=10147843 Ack=184970387 Win=65535 Len=0
1,6.664655999999923,62.210.85.178,10.0.2.15,TCP,60,9001  >  35978 [ACK] Seq=10147843 Ack=184971847 Win=65535 Len=0
1,6.6646920000002865,10.0.2.15,62.210.85.178,TLSv1.2,1204,Application Data
1,6.664725999999973,62.210.85.178,10.0.2.15,TCP,60,9001  >  35978 [ACK] Seq=10147843 Ack=184972997 Win=65535 Len=0
1,6.664770000000317,10.0.2.15,62.210.85.178,TLSv1.2,4124,Application Data
1,6.664805999999771,62.210.85.178,10.0.2.15,TCP,60,9001  >  35978 [ACK] Seq=10147843 Ack=184974457 Win=65535 Len=0
1,6.664813000000322,62.210.85.178,10.0.2.15,TCP,60,9001  >  35978 [ACK] Seq=10147843 Ack=184975917 Win=65535 Len=0
1,6.664816999999857,62.210.85.178,10.0.2.15,TCP,60,9001  >  35978 [ACK] Seq=10147843 Ack=184977067 Win=65535 Len=0
1,6.664854999999989,10.0.2.15,62.210.85.178,TLSv1.2,4124,Application Data
1,6.66489300000012,62.210.85.178,10.0.2.15,TCP,60,9001  >  35978 [ACK] Seq=10147843 Ack=184978527 Win=65535 Len=0
1,6.664899999999761,62.210.85.178,10.0.2.15,TCP,60,9001  >  35978 [ACK] Seq=10147843 Ack=184979987 Win=65535 Len=0
1,6.664958999999726,10.0.2.15,62.210.85.178,TLSv1.2,2974,Application Data
1,6.66499500000009,62.210.85.178,10.0.2.15,TCP,60,9001  >  35978 [ACK] Seq=10147843 Ack=184981137 Win=65535 Len=0
1,6.665001999999731,62.210.85.178,10.0.2.15,TCP,60,9001  >  35978 [ACK] Seq=10147843 Ack=184982597 Win=65535 Len=0
1,6.665006000000176,62.210.85.178,10.0.2.15,TCP,60,9001  >  35978 [ACK] Seq=10147843 Ack=184984057 Win=65535 Len=0
1,6.665031999999883,10.0.2.15,62.210.85.178,TLSv1.2,1226,Application Data
1,6.66506599999957,62.210.85.178,10.0.2.15,TCP,60,9001  >  35978 [ACK] Seq=10147843 Ack=184985229 Win=65535 Len=0
1,6.665106000000378,10.0.2.15,62.210.85.178,TLSv1.2,4124,Application Data
1,6.665141000000403,62.210.85.178,10.0.2.15,TCP,60,9001  >  35978 [ACK] Seq=10147843 Ack=184986689 Win=65535 Len=0
1,6.665148000000045,62.210.85.178,10.0.2.15,TCP,60,9001  >  35978 [ACK] Seq=10147843 Ack=184988149 Win=65535 Len=0
1,6.665151000000151,62.210.85.178,10.0.2.15,TCP,60,9001  >  35978 [ACK] Seq=10147843 Ack=184989299 Win=65535 Len=0
1,6.665186999999605,10.0.2.15,62.210.85.178,TLSv1.2,3030,Application Data
1,6.6652219999996305,62.210.85.178,10.0.2.15,TCP,60,9001  >  35978 [ACK] Seq=10147843 Ack=184990759 Win=65535 Len=0
1,6.665227999999843,62.210.85.178,10.0.2.15,TCP,60,9001  >  35978 [ACK] Seq=10147843 Ack=184992219 Win=65535 Len=0
1,6.665230999999949,62.210.85.178,10.0.2.15,TCP,60,9001  >  35978 [ACK] Seq=10147843 Ack=184992275 Win=65535 Len=0
1,6.6745380000002115,10.0.2.15,62.210.85.178,TLSv1.2,4124,Application Data
1,6.674662999999782,62.210.85.178,10.0.2.15,TCP,60,9001  >  35978 [ACK] Seq=10147843 Ack=184993735 Win=65535 Len=0
1,6.674678000000313,62.210.85.178,10.0.2.15,TCP,60,9001  >  35978 [ACK] Seq=10147843 Ack=184995195 Win=65535 Len=0
1,6.674681000000419,62.210.85.178,10.0.2.15,TCP,60,9001  >  35978 [ACK] Seq=10147843 Ack=184996345 Win=65535 Len=0
1,6.674715000000106,10.0.2.15,62.210.85.178,TCP,2974,35978  >  9001 [ACK] Seq=184996345 Ack=10147843 Win=65535 Len=2920 [TCP segment of a reassembled PDU]
1,6.674778999999944,62.210.85.178,10.0.2.15,TCP,60,9001  >  35978 [ACK] Seq=10147843 Ack=184997805 Win=65535 Len=0
1,6.674786999999924,62.210.85.178,10.0.2.15,TCP,60,9001  >  35978 [ACK] Seq=10147843 Ack=184999265 Win=65535 Len=0
1,6.674813999999969,10.0.2.15,62.210.85.178,TLSv1.2,1204,Application Data
1,6.674845999999889,62.210.85.178,10.0.2.15,TCP,60,9001  >  35978 [ACK] Seq=10147843 Ack=185000415 Win=65535 Len=0
1,6.674890000000232,10.0.2.15,62.210.85.178,TLSv1.2,4124,Application Data
1,6.674925999999687,62.210.85.178,10.0.2.15,TCP,60,9001  >  35978 [ACK] Seq=10147843 Ack=185001875 Win=65535 Len=0
1,6.674933000000237,62.210.85.178,10.0.2.15,TCP,60,9001  >  35978 [ACK] Seq=10147843 Ack=185003335 Win=65535 Len=0
1,6.6749360000003435,62.210.85.178,10.0.2.15,TCP,60,9001  >  35978 [ACK] Seq=10147843 Ack=185004485 Win=65535 Len=0
1,6.674973999999565,10.0.2.15,62.210.85.178,TLSv1.2,4124,Application Data
1,6.675008000000162,62.210.85.178,10.0.2.15,TCP,60,9001  >  35978 [ACK] Seq=10147843 Ack=185005945 Win=65535 Len=0
1,6.6750160000001415,62.210.85.178,10.0.2.15,TCP,60,9001  >  35978 [ACK] Seq=10147843 Ack=185007405 Win=65535 Len=0
1,6.675019999999677,62.210.85.178,10.0.2.15,TCP,60,9001  >  35978 [ACK] Seq=10147843 Ack=185008555 Win=65535 Len=0
1,6.675054000000273,10.0.2.15,62.210.85.178,TLSv1.2,332,Application Data
1,6.67508799999996,62.210.85.178,10.0.2.15,TCP,60,9001  >  35978 [ACK] Seq=10147843 Ack=185008833 Win=65535 Len=0
1,6.675142000000051,10.0.2.15,62.210.85.178,TLSv1.2,3868,Application Data
1,6.675178000000415,62.210.85.178,10.0.2.15,TCP,60,9001  >  35978 [ACK] Seq=10147843 Ack=185010293 Win=65535 Len=0
1,6.675185000000056,62.210.85.178,10.0.2.15,TCP,60,9001  >  35978 [ACK] Seq=10147843 Ack=185011753 Win=65535 Len=0
1,6.675188000000162,62.210.85.178,10.0.2.15,TCP,60,9001  >  35978 [ACK] Seq=10147843 Ack=185012647 Win=65535 Len=0
1,6.675224999999955,10.0.2.15,62.210.85.178,TLSv1.2,4124,Application Data
1,6.675258999999642,62.210.85.178,10.0.2.15,TCP,60,9001  >  35978 [ACK] Seq=10147843 Ack=185014107 Win=65535 Len=0
1,6.675266000000192,62.210.85.178,10.0.2.15,TCP,60,9001  >  35978 [ACK] Seq=10147843 Ack=185015567 Win=65535 Len=0
1,6.6752690000002985,62.210.85.178,10.0.2.15,TCP,60,9001  >  35978 [ACK] Seq=10147843 Ack=185016717 Win=65535 Len=0
1,6.675304000000324,10.0.2.15,62.210.85.178,TLSv1.2,3030,Application Data
1,6.675338000000011,62.210.85.178,10.0.2.15,TCP,60,9001  >  35978 [ACK] Seq=10147843 Ack=185018177 Win=65535 Len=0
1,6.675344000000223,62.210.85.178,10.0.2.15,TCP,60,9001  >  35978 [ACK] Seq=10147843 Ack=185019637 Win=65535 Len=0
1,6.675347000000329,62.210.85.178,10.0.2.15,TCP,60,9001  >  35978 [ACK] Seq=10147843 Ack=185019693 Win=65535 Len=0
1,6.689046000000417,10.0.2.15,62.210.85.178,TLSv1.2,4124,Application Data
1,6.689169999999649,10.0.2.15,62.210.85.178,TCP,2974,35978  >  9001 [ACK] Seq=185023763 Ack=10147843 Win=65535 Len=2920 [TCP segment of a reassembled PDU]
1,6.689217000000099,62.210.85.178,10.0.2.15,TCP,60,9001  >  35978 [ACK] Seq=10147843 Ack=185021153 Win=65535 Len=0
1,6.689228000000185,62.210.85.178,10.0.2.15,TCP,60,9001  >  35978 [ACK] Seq=10147843 Ack=185022613 Win=65535 Len=0
1,6.689233000000058,62.210.85.178,10.0.2.15,TCP,60,9001  >  35978 [ACK] Seq=10147843 Ack=185023763 Win=65535 Len=0
1,6.6892369999995935,62.210.85.178,10.0.2.15,TCP,60,9001  >  35978 [ACK] Seq=10147843 Ack=185025223 Win=65535 Len=0
1,6.689239000000271,62.210.85.178,10.0.2.15,TCP,60,9001  >  35978 [ACK] Seq=10147843 Ack=185026683 Win=65535 Len=0
1,6.689274000000296,10.0.2.15,62.210.85.178,TLSv1.2,1204,Application Data
1,6.689307999999983,62.210.85.178,10.0.2.15,TCP,60,9001  >  35978 [ACK] Seq=10147843 Ack=185027833 Win=65535 Len=0
1,6.689350999999988,10.0.2.15,62.210.85.178,TLSv1.2,4124,Application Data
1,6.689386000000013,62.210.85.178,10.0.2.15,TCP,60,9001  >  35978 [ACK] Seq=10147843 Ack=185029293 Win=65535 Len=0
1,6.689392999999654,62.210.85.178,10.0.2.15,TCP,60,9001  >  35978 [ACK] Seq=10147843 Ack=185030753 Win=65535 Len=0
1,6.689397000000099,62.210.85.178,10.0.2.15,TCP,60,9001  >  35978 [ACK] Seq=10147843 Ack=185031903 Win=65535 Len=0
1,6.6894350000002305,10.0.2.15,62.210.85.178,TLSv1.2,2324,Application Data
1,6.689468999999917,62.210.85.178,10.0.2.15,TCP,60,9001  >  35978 [ACK] Seq=10147843 Ack=185033363 Win=65535 Len=0
1,6.6894759999995586,62.210.85.178,10.0.2.15,TCP,60,9001  >  35978 [ACK] Seq=10147843 Ack=185034173 Win=65535 Len=0
1,6.763369999999668,54.93.77.70,10.0.2.15,TLSv1.2,590,Application Data
1,6.804068999999799,10.0.2.15,54.93.77.70,TCP,54,34692  >  9001 [ACK] Seq=10191867 Ack=184830111 Win=65535 Len=0
1,6.816020999999637,54.93.77.70,10.0.2.15,TLSv1.2,7294,"Application Data, Application Data"
1,6.816103999999541,10.0.2.15,54.93.77.70,TCP,54,34692  >  9001 [ACK] Seq=10191867 Ack=184837351 Win=65535 Len=0
1,6.839033999999629,54.93.77.70,10.0.2.15,TLSv1.2,7808,"Application Data, Application Data"
1,6.839090999999826,10.0.2.15,54.93.77.70,TCP,54,34692  >  9001 [ACK] Seq=10191867 Ack=184845105 Win=65535 Len=0
1,6.84878899999967,54.93.77.70,10.0.2.15,TCP,2950,"9001  >  34692 [PSH, ACK] Seq=184845105 Ack=10191867 Win=65535 Len=2896 [TCP segment of a reassembled PDU]"
1,6.848834000000352,10.0.2.15,54.93.77.70,TCP,54,34692  >  9001 [ACK] Seq=10191867 Ack=184848001 Win=65535 Len=0
1,6.849615999999514,54.93.77.70,10.0.2.15,TLSv1.2,2950,Application Data [TCP segment of a reassembled PDU]
1,6.84965800000009,10.0.2.15,54.93.77.70,TCP,54,34692  >  9001 [ACK] Seq=10191867 Ack=184850897 Win=65535 Len=0
1,6.855950000000121,54.93.77.70,10.0.2.15,TLSv1.2,6686,"Application Data, Application Data, Application Data"
1,6.855996000000232,10.0.2.15,54.93.77.70,TCP,54,34692  >  9001 [ACK] Seq=10191867 Ack=184857529 Win=65535 Len=0
1,6.856163999999808,10.0.2.15,54.93.77.70,TLSv1.2,590,Application Data
1,6.856238000000303,54.93.77.70,10.0.2.15,TCP,60,9001  >  34692 [ACK] Seq=184857529 Ack=10192403 Win=65535 Len=0
1,6.865544999999656,10.0.2.15,54.93.77.70,TLSv1.2,590,Application Data
1,6.865638999999646,54.93.77.70,10.0.2.15,TCP,60,9001  >  34692 [ACK] Seq=184857529 Ack=10192939 Win=65535 Len=0
1,6.867255999999543,54.93.77.70,10.0.2.15,TLSv1.2,10190,"Application Data, Application Data, Application Data"
1,6.8673280000002705,10.0.2.15,54.93.77.70,TCP,54,34692  >  9001 [ACK] Seq=10192939 Ack=184867665 Win=65535 Len=0
1,6.871925000000374,54.93.77.70,10.0.2.15,TLSv1.2,1314,Application Data
1,6.877956999999697,54.93.77.70,10.0.2.15,TCP,2950,"9001  >  34692 [PSH, ACK] Seq=184868925 Ack=10192939 Win=65535 Len=2896 [TCP segment of a reassembled PDU]"
1,6.878002000000379,10.0.2.15,54.93.77.70,TCP,54,34692  >  9001 [ACK] Seq=10192939 Ack=184871821 Win=65535 Len=0
1,6.886341999999786,54.93.77.70,10.0.2.15,TLSv1.2,5846,"Application Data, Application Data"
1,6.8864480000002,10.0.2.15,54.93.77.70,TCP,54,34692  >  9001 [ACK] Seq=10192939 Ack=184877613 Win=65535 Len=0
1,6.888412000000244,54.93.77.70,10.0.2.15,TLSv1.2,684,Application Data
1,6.908900000000358,54.93.77.70,10.0.2.15,TLSv1.2,3160,Application Data
1,6.908943999999792,10.0.2.15,54.93.77.70,TCP,54,34692  >  9001 [ACK] Seq=10192939 Ack=184881349 Win=65535 Len=0
1,6.909088000000338,10.0.2.15,54.93.77.70,TLSv1.2,590,Application Data
1,6.909160000000156,54.93.77.70,10.0.2.15,TCP,60,9001  >  34692 [ACK] Seq=184881349 Ack=10193475 Win=65535 Len=0
1,6.914130000000114,54.93.77.70,10.0.2.15,TLSv1.2,4398,Application Data
1,6.914195000000291,10.0.2.15,54.93.77.70,TCP,54,34692  >  9001 [ACK] Seq=10193475 Ack=184885693 Win=65535 Len=0
1,6.928256999999576,54.93.77.70,10.0.2.15,TLSv1.2,1408,Application Data
1,6.934925999999905,54.93.77.70,10.0.2.15,TCP,2950,"9001  >  34692 [PSH, ACK] Seq=184887047 Ack=10193475 Win=65535 Len=2896 [TCP segment of a reassembled PDU]"
1,6.934970999999678,10.0.2.15,54.93.77.70,TCP,54,34692  >  9001 [ACK] Seq=10193475 Ack=184889943 Win=65535 Len=0
1,6.942957000000206,54.93.77.70,10.0.2.15,TLSv1.2,7294,"Application Data, Application Data"
1,6.943021000000044,10.0.2.15,54.93.77.70,TCP,54,34692  >  9001 [ACK] Seq=10193475 Ack=184897183 Win=65535 Len=0
1,6.9517720000003465,54.93.77.70,10.0.2.15,TLSv1.2,264,Application Data
1,6.967287999999826,54.93.77.70,10.0.2.15,TCP,1502,"9001  >  34692 [PSH, ACK] Seq=184897393 Ack=10193475 Win=65535 Len=1448 [TCP segment of a reassembled PDU]"
1,6.967338000000382,10.0.2.15,54.93.77.70,TCP,54,34692  >  9001 [ACK] Seq=10193475 Ack=184898841 Win=65535 Len=0
1,6.971217000000252,62.210.85.178,10.0.2.15,TLSv1.2,1104,Application Data
1,6.983621999999741,54.93.77.70,10.0.2.15,TLSv1.2,684,Application Data
