No.,Time,Source,Destination,Protocol,Length,Info
1,0.0008179999995263643,10.0.2.15,54.93.77.70,TCP,54,34692  >  9001 [ACK] Seq=10375745 Ack=188492941 Win=65535 Len=0
1,0.02090799999950832,10.0.2.15,62.210.85.178,TCP,54,35978  >  9001 [ACK] Seq=188626719 Ack=10330591 Win=65535 Len=0
1,0.03952000000026601,62.210.85.178,10.0.2.15,TLSv1.2,590,Application Data
1,0.03963399999975081,10.0.2.15,62.210.85.178,TCP,54,35978  >  9001 [ACK] Seq=188626719 Ack=10331127 Win=65535 Len=0
1,0.1428619999996954,10.0.2.15,54.93.77.70,TLSv1.2,590,Application Data
1,0.143036999999822,54.93.77.70,10.0.2.15,TCP,60,9001  >  34692 [ACK] Seq=188492941 Ack=10376281 Win=65535 Len=0
1,0.2623359999997774,62.210.85.178,10.0.2.15,TLSv1.2,590,Application Data
1,0.26245399999970687,10.0.2.15,62.210.85.178,TCP,54,35978  >  9001 [ACK] Seq=188626719 Ack=10331663 Win=65535 Len=0
1,0.26280599999972765,10.0.2.15,62.210.85.178,TLSv1.2,590,Application Data
1,0.2629369999995106,62.210.85.178,10.0.2.15,TCP,60,9001  >  35978 [ACK] Seq=10331663 Ack=188627255 Win=65535 Len=0
1,0.37139599999954953,54.93.77.70,10.0.2.15,TLSv1.2,590,Application Data
1,0.3714749999999185,10.0.2.15,54.93.77.70,TCP,54,34692  >  9001 [ACK] Seq=10376281 Ack=188493477 Win=65535 Len=0
1,0.3718989999997575,10.0.2.15,54.93.77.70,TLSv1.2,1618,Application Data
1,0.37200099999972736,54.93.77.70,10.0.2.15,TCP,60,9001  >  34692 [ACK] Seq=188493477 Ack=10377741 Win=65535 Len=0
1,0.3720130000001518,54.93.77.70,10.0.2.15,TCP,60,9001  >  34692 [ACK] Seq=188493477 Ack=10377845 Win=65535 Len=0
1,0.4818729999997231,62.210.85.178,10.0.2.15,TLSv1.2,1618,Application Data
1,0.4819950000000972,10.0.2.15,62.210.85.178,TCP,54,35978  >  9001 [ACK] Seq=188627255 Ack=10333227 Win=65535 Len=0
1,0.49537099999997736,10.0.2.15,62.210.85.178,TLSv1.2,590,Application Data
1,0.49554799999987154,62.210.85.178,10.0.2.15,TCP,60,9001  >  35978 [ACK] Seq=10333227 Ack=188627791 Win=65535 Len=0
1,0.505008999999518,10.0.2.15,62.210.85.178,TLSv1.2,1618,Application Data
1,0.5051409999996395,62.210.85.178,10.0.2.15,TCP,60,9001  >  35978 [ACK] Seq=10333227 Ack=188629251 Win=65535 Len=0
1,0.50515600000017,62.210.85.178,10.0.2.15,TCP,60,9001  >  35978 [ACK] Seq=10333227 Ack=188629355 Win=65535 Len=0
1,0.6194530000002487,54.93.77.70,10.0.2.15,TLSv1.2,2132,Application Data
1,0.6195829999996931,10.0.2.15,54.93.77.70,TCP,54,34692  >  9001 [ACK] Seq=10377845 Ack=188495555 Win=65535 Len=0
1,0.622258000000329,10.0.2.15,54.93.77.70,TLSv1.2,590,Application Data
1,0.6224350000002232,54.93.77.70,10.0.2.15,TCP,60,9001  >  34692 [ACK] Seq=188495555 Ack=10378381 Win=65535 Len=0
1,0.8344010000000708,62.210.85.178,10.0.2.15,TLSv1.2,590,Application Data
1,0.8348079999996116,10.0.2.15,62.210.85.178,TLSv1.2,590,Application Data
1,0.8349349999998594,62.210.85.178,10.0.2.15,TCP,60,9001  >  35978 [ACK] Seq=10333763 Ack=188629891 Win=65535 Len=0
1,0.9268849999998565,54.93.77.70,10.0.2.15,TLSv1.2,590,Application Data
1,0.9273530000000392,10.0.2.15,54.93.77.70,TLSv1.2,590,Application Data
1,0.9276959999997416,54.93.77.70,10.0.2.15,TCP,60,9001  >  34692 [ACK] Seq=188496091 Ack=10378917 Win=65535 Len=0
1,1.1414139999997133,62.210.85.178,10.0.2.15,TLSv1.2,590,Application Data
1,1.1460329999999885,10.0.2.15,62.210.85.178,TLSv1.2,590,Application Data
1,1.1462089999995442,62.210.85.178,10.0.2.15,TCP,60,9001  >  35978 [ACK] Seq=10334299 Ack=188630427 Win=65535 Len=0
1,1.1582060000000638,10.0.2.15,62.210.85.178,TLSv1.2,4124,Application Data
1,1.1584569999995438,62.210.85.178,10.0.2.15,TCP,60,9001  >  35978 [ACK] Seq=10334299 Ack=188631887 Win=65535 Len=0
1,1.1585189999996146,62.210.85.178,10.0.2.15,TCP,60,9001  >  35978 [ACK] Seq=10334299 Ack=188633347 Win=65535 Len=0
1,1.1585549999999785,62.210.85.178,10.0.2.15,TCP,60,9001  >  35978 [ACK] Seq=10334299 Ack=188634497 Win=65535 Len=0
1,1.1586589999997159,10.0.2.15,62.210.85.178,TLSv1.2,4124,Application Data
1,1.15878100000009,10.0.2.15,62.210.85.178,TCP,2974,35978  >  9001 [ACK] Seq=188638567 Ack=10334299 Win=65535 Len=2920 [TCP segment of a reassembled PDU]
1,1.1588689999998678,62.210.85.178,10.0.2.15,TCP,60,9001  >  35978 [ACK] Seq=10334299 Ack=188635957 Win=65535 Len=0
1,1.1588849999998274,62.210.85.178,10.0.2.15,TCP,60,9001  >  35978 [ACK] Seq=10334299 Ack=188637417 Win=65535 Len=0
1,1.158889000000272,62.210.85.178,10.0.2.15,TCP,60,9001  >  35978 [ACK] Seq=10334299 Ack=188638567 Win=65535 Len=0
1,1.1588929999998072,62.210.85.178,10.0.2.15,TCP,60,9001  >  35978 [ACK] Seq=10334299 Ack=188640027 Win=65535 Len=0
1,1.1588959999999133,62.210.85.178,10.0.2.15,TCP,60,9001  >  35978 [ACK] Seq=10334299 Ack=188641487 Win=65535 Len=0
1,1.1589359999998123,10.0.2.15,62.210.85.178,TLSv1.2,1204,Application Data
1,1.1589770000000499,62.210.85.178,10.0.2.15,TCP,60,9001  >  35978 [ACK] Seq=10334299 Ack=188642637 Win=65535 Len=0
1,1.1590369999994437,10.0.2.15,62.210.85.178,TLSv1.2,4124,Application Data
1,1.1590839999998934,62.210.85.178,10.0.2.15,TCP,60,9001  >  35978 [ACK] Seq=10334299 Ack=188644097 Win=65535 Len=0
1,1.1590919999998732,62.210.85.178,10.0.2.15,TCP,60,9001  >  35978 [ACK] Seq=10334299 Ack=188645557 Win=65535 Len=0
1,1.1590960000003179,62.210.85.178,10.0.2.15,TCP,60,9001  >  35978 [ACK] Seq=10334299 Ack=188646707 Win=65535 Len=0
1,1.1591470000003028,10.0.2.15,62.210.85.178,TLSv1.2,332,Application Data
1,1.1592799999998533,10.0.2.15,62.210.85.178,TCP,2974,35978  >  9001 [ACK] Seq=188646985 Ack=10334299 Win=65535 Len=2920 [TCP segment of a reassembled PDU]
1,1.159349999999904,62.210.85.178,10.0.2.15,TCP,60,9001  >  35978 [ACK] Seq=10334299 Ack=188646985 Win=65535 Len=0
1,1.1593599999996513,62.210.85.178,10.0.2.15,TCP,60,9001  >  35978 [ACK] Seq=10334299 Ack=188648445 Win=65535 Len=0
1,1.159364000000096,62.210.85.178,10.0.2.15,TCP,60,9001  >  35978 [ACK] Seq=10334299 Ack=188649905 Win=65535 Len=0
1,1.1594020000002274,10.0.2.15,62.210.85.178,TLSv1.2,948,Application Data
1,1.1594390000000203,62.210.85.178,10.0.2.15,TCP,60,9001  >  35978 [ACK] Seq=10334299 Ack=188650799 Win=65535 Len=0
1,1.159483999999793,10.0.2.15,62.210.85.178,TLSv1.2,4124,Application Data
1,1.159523999999692,62.210.85.178,10.0.2.15,TCP,60,9001  >  35978 [ACK] Seq=10334299 Ack=188652259 Win=65535 Len=0
1,1.1595319999996718,62.210.85.178,10.0.2.15,TCP,60,9001  >  35978 [ACK] Seq=10334299 Ack=188653719 Win=65535 Len=0
1,1.1595369999995455,62.210.85.178,10.0.2.15,TCP,60,9001  >  35978 [ACK] Seq=10334299 Ack=188654869 Win=65535 Len=0
1,1.1595790000001216,10.0.2.15,62.210.85.178,TLSv1.2,3030,Application Data
1,1.159617999999682,62.210.85.178,10.0.2.15,TCP,60,9001  >  35978 [ACK] Seq=10334299 Ack=188656329 Win=65535 Len=0
1,1.1596250000002328,62.210.85.178,10.0.2.15,TCP,60,9001  >  35978 [ACK] Seq=10334299 Ack=188657789 Win=65535 Len=0
1,1.159628999999768,62.210.85.178,10.0.2.15,TCP,60,9001  >  35978 [ACK] Seq=10334299 Ack=188657845 Win=65535 Len=0
1,1.1688629999998739,10.0.2.15,62.210.85.178,TLSv1.2,4124,Application Data
1,1.1689209999995,62.210.85.178,10.0.2.15,TCP,60,9001  >  35978 [ACK] Seq=10334299 Ack=188659305 Win=65535 Len=0
1,1.168931999999586,62.210.85.178,10.0.2.15,TCP,60,9001  >  35978 [ACK] Seq=10334299 Ack=188660765 Win=65535 Len=0
1,1.1689369999994597,62.210.85.178,10.0.2.15,TCP,60,9001  >  35978 [ACK] Seq=10334299 Ack=188661915 Win=65535 Len=0
1,1.1689809999998033,10.0.2.15,62.210.85.178,TLSv1.2,4124,Application Data
1,1.16902299999947,62.210.85.178,10.0.2.15,TCP,60,9001  >  35978 [ACK] Seq=10334299 Ack=188663375 Win=65535 Len=0
1,1.1690319999997882,62.210.85.178,10.0.2.15,TCP,60,9001  >  35978 [ACK] Seq=10334299 Ack=188664835 Win=65535 Len=0
1,1.1690360000002329,62.210.85.178,10.0.2.15,TCP,60,9001  >  35978 [ACK] Seq=10334299 Ack=188665985 Win=65535 Len=0
1,1.1690749999997934,10.0.2.15,62.210.85.178,TLSv1.2,4124,Application Data
1,1.1691140000002633,62.210.85.178,10.0.2.15,TCP,60,9001  >  35978 [ACK] Seq=10334299 Ack=188667445 Win=65535 Len=0
1,1.1691220000002431,62.210.85.178,10.0.2.15,TCP,60,9001  >  35978 [ACK] Seq=10334299 Ack=188668905 Win=65535 Len=0
1,1.1691259999997783,62.210.85.178,10.0.2.15,TCP,60,9001  >  35978 [ACK] Seq=10334299 Ack=188670055 Win=65535 Len=0
1,1.1691629999995712,10.0.2.15,62.210.85.178,TLSv1.2,4124,Application Data
1,1.1692469999998139,62.210.85.178,10.0.2.15,TCP,60,9001  >  35978 [ACK] Seq=10334299 Ack=188671515 Win=65535 Len=0
1,1.1692579999998998,62.210.85.178,10.0.2.15,TCP,60,9001  >  35978 [ACK] Seq=10334299 Ack=188672975 Win=65535 Len=0
1,1.1692610000000059,62.210.85.178,10.0.2.15,TCP,60,9001  >  35978 [ACK] Seq=10334299 Ack=188674125 Win=65535 Len=0
1,1.1692910000001575,10.0.2.15,62.210.85.178,TLSv1.2,332,Application Data
1,1.1693530000002283,10.0.2.15,62.210.85.178,TCP,1514,35978  >  9001 [ACK] Seq=188674403 Ack=10334299 Win=65535 Len=1460 [TCP segment of a reassembled PDU]
1,1.1693869999999151,62.210.85.178,10.0.2.15,TCP,60,9001  >  35978 [ACK] Seq=10334299 Ack=188674403 Win=65535 Len=0
1,1.169394999999895,62.210.85.178,10.0.2.15,TCP,60,9001  >  35978 [ACK] Seq=10334299 Ack=188675863 Win=65535 Len=0
1,1.1694219999999405,10.0.2.15,62.210.85.178,TLSv1.2,158,Application Data
1,1.1694539999998597,62.210.85.178,10.0.2.15,TCP,60,9001  >  35978 [ACK] Seq=10334299 Ack=188675967 Win=65535 Len=0
1,1.255153000000064,54.93.77.70,10.0.2.15,TLSv1.2,590,Application Data
1,1.2651420000001963,54.93.77.70,10.0.2.15,TLSv1.2,7294,"Application Data, Application Data"
1,1.2652239999997619,10.0.2.15,54.93.77.70,TCP,54,34692  >  9001 [ACK] Seq=10378917 Ack=188503867 Win=65535 Len=0
1,1.29018300000007,54.93.77.70,10.0.2.15,TLSv1.2,3674,Application Data
1,1.2902260000000751,10.0.2.15,54.93.77.70,TCP,54,34692  >  9001 [ACK] Seq=10378917 Ack=188507487 Win=65535 Len=0
1,1.3474779999996827,54.93.77.70,10.0.2.15,TLSv1.2,4724,"Application Data, Application Data"
1,1.3475820000003296,10.0.2.15,54.93.77.70,TCP,54,34692  >  9001 [ACK] Seq=10378917 Ack=188512157 Win=65535 Len=0
1,1.347751999999673,10.0.2.15,54.93.77.70,TLSv1.2,590,Application Data
1,1.3478210000002946,54.93.77.70,10.0.2.15,TCP,60,9001  >  34692 [ACK] Seq=188512157 Ack=10379453 Win=65535 Len=0
1,1.35774500000025,54.93.77.70,10.0.2.15,TCP,2950,"9001  >  34692 [PSH, ACK] Seq=188512157 Ack=10379453 Win=65535 Len=2896 [TCP segment of a reassembled PDU]"
1,1.3578029999998762,10.0.2.15,54.93.77.70,TCP,54,34692  >  9001 [ACK] Seq=10379453 Ack=188515053 Win=65535 Len=0
1,1.3586599999998725,54.93.77.70,10.0.2.15,TLSv1.2,8742,"Application Data, Application Data"
1,1.3587339999994583,10.0.2.15,54.93.77.70,TCP,54,34692  >  9001 [ACK] Seq=10379453 Ack=188523741 Win=65535 Len=0
1,1.3634499999998297,54.93.77.70,10.0.2.15,TLSv1.2,358,Application Data
1,1.3636100000003353,10.0.2.15,54.93.77.70,TLSv1.2,590,Application Data
1,1.3636850000002596,54.93.77.70,10.0.2.15,TCP,60,9001  >  34692 [ACK] Seq=188524045 Ack=10379989 Win=65535 Len=0
1,1.3762109999997847,54.93.77.70,10.0.2.15,TCP,2950,"9001  >  34692 [PSH, ACK] Seq=188524045 Ack=10379989 Win=65535 Len=2896 [TCP segment of a reassembled PDU]"
1,1.3763479999997799,10.0.2.15,54.93.77.70,TCP,54,34692  >  9001 [ACK] Seq=10379989 Ack=188526941 Win=65535 Len=0
1,1.3771200000001045,54.93.77.70,10.0.2.15,TLSv1.2,8742,"Application Data, Application Data"
1,1.3771850000002814,10.0.2.15,54.93.77.70,TCP,54,34692  >  9001 [ACK] Seq=10379989 Ack=188535629 Win=65535 Len=0
1,1.3804250000002867,54.93.77.70,10.0.2.15,TLSv1.2,358,Application Data
1,1.392837000000327,54.93.77.70,10.0.2.15,TLSv1.2,5846,Application Data
1,1.3928820000000997,10.0.2.15,54.93.77.70,TCP,54,34692  >  9001 [ACK] Seq=10379989 Ack=188541725 Win=65535 Len=0
1,1.4102109999994354,54.93.77.70,10.0.2.15,TLSv1.2,474,Application Data
1,1.4126909999995405,10.0.2.15,54.93.77.70,TLSv1.2,590,Application Data
1,1.4128590000000258,54.93.77.70,10.0.2.15,TCP,60,9001  >  34692 [ACK] Seq=188542145 Ack=10380525 Win=65535 Len=0
1,1.4671779999998762,62.210.85.178,10.0.2.15,TLSv1.2,590,Application Data
1,1.5088829999995141,10.0.2.15,62.210.85.178,TCP,54,35978  >  9001 [ACK] Seq=188675967 Ack=10334835 Win=65535 Len=0
1,1.5260769999995318,62.210.85.178,10.0.2.15,TLSv1.2,590,Application Data
1,1.5261410000002797,10.0.2.15,62.210.85.178,TCP,54,35978  >  9001 [ACK] Seq=188675967 Ack=10335371 Win=65535 Len=0
1,1.653534999999465,62.210.85.178,10.0.2.15,TLSv1.2,590,Application Data
1,1.6536159999996016,10.0.2.15,62.210.85.178,TCP,54,35978  >  9001 [ACK] Seq=188675967 Ack=10335907 Win=65535 Len=0
1,1.654088999999658,10.0.2.15,62.210.85.178,TLSv1.2,590,Application Data
1,1.6541870000000927,62.210.85.178,10.0.2.15,TCP,60,9001  >  35978 [ACK] Seq=10335907 Ack=188676503 Win=65535 Len=0
1,1.8591010000000097,54.93.77.70,10.0.2.15,TLSv1.2,590,Application Data
1,1.8594999999995707,10.0.2.15,54.93.77.70,TLSv1.2,590,Application Data
1,1.8596230000002834,54.93.77.70,10.0.2.15,TCP,60,9001  >  34692 [ACK] Seq=188542681 Ack=10381061 Win=65535 Len=0
1,2.06425500000023,62.210.85.178,10.0.2.15,TLSv1.2,590,Application Data
1,2.0679339999996955,10.0.2.15,62.210.85.178,TLSv1.2,590,Application Data
1,2.0681180000001405,62.210.85.178,10.0.2.15,TCP,60,9001  >  35978 [ACK] Seq=10336443 Ack=188677039 Win=65535 Len=0
1,2.0778479999999035,10.0.2.15,62.210.85.178,TLSv1.2,4124,Application Data
1,2.0782719999997425,62.210.85.178,10.0.2.15,TCP,60,9001  >  35978 [ACK] Seq=10336443 Ack=188678499 Win=65535 Len=0
1,2.078292999999576,62.210.85.178,10.0.2.15,TCP,60,9001  >  35978 [ACK] Seq=10336443 Ack=188679959 Win=65535 Len=0
1,2.078295999999682,62.210.85.178,10.0.2.15,TCP,60,9001  >  35978 [ACK] Seq=10336443 Ack=188681109 Win=65535 Len=0
1,2.0783799999999246,10.0.2.15,62.210.85.178,TLSv1.2,4124,Application Data
1,2.078480000000127,62.210.85.178,10.0.2.15,TCP,60,9001  >  35978 [ACK] Seq=10336443 Ack=188682569 Win=65535 Len=0
1,2.0784899999998743,62.210.85.178,10.0.2.15,TCP,60,9001  >  35978 [ACK] Seq=10336443 Ack=188684029 Win=65535 Len=0
1,2.078494000000319,62.210.85.178,10.0.2.15,TCP,60,9001  >  35978 [ACK] Seq=10336443 Ack=188685179 Win=65535 Len=0
1,2.0785470000000714,10.0.2.15,62.210.85.178,TLSv1.2,4124,Application Data
1,2.078585999999632,62.210.85.178,10.0.2.15,TCP,60,9001  >  35978 [ACK] Seq=10336443 Ack=188686639 Win=65535 Len=0
1,2.0785939999996117,62.210.85.178,10.0.2.15,TCP,60,9001  >  35978 [ACK] Seq=10336443 Ack=188688099 Win=65535 Len=0
1,2.0785989999994854,62.210.85.178,10.0.2.15,TCP,60,9001  >  35978 [ACK] Seq=10336443 Ack=188689249 Win=65535 Len=0
1,2.0786440000001676,10.0.2.15,62.210.85.178,TLSv1.2,4124,Application Data
1,2.0786809999999605,62.210.85.178,10.0.2.15,TCP,60,9001  >  35978 [ACK] Seq=10336443 Ack=188690709 Win=65535 Len=0
1,2.0786879999996017,62.210.85.178,10.0.2.15,TCP,60,9001  >  35978 [ACK] Seq=10336443 Ack=188692169 Win=65535 Len=0
1,2.0787469999995665,10.0.2.15,62.210.85.178,TLSv1.2,2974,Application Data
1,2.078781999999592,62.210.85.178,10.0.2.15,TCP,60,9001  >  35978 [ACK] Seq=10336443 Ack=188693319 Win=65535 Len=0
1,2.0787899999995716,62.210.85.178,10.0.2.15,TCP,60,9001  >  35978 [ACK] Seq=10336443 Ack=188694779 Win=65535 Len=0
1,2.0787940000000162,62.210.85.178,10.0.2.15,TCP,60,9001  >  35978 [ACK] Seq=10336443 Ack=188696239 Win=65535 Len=0
1,2.0788210000000618,10.0.2.15,62.210.85.178,TLSv1.2,1226,Application Data
1,2.078852999999981,62.210.85.178,10.0.2.15,TCP,60,9001  >  35978 [ACK] Seq=10336443 Ack=188697411 Win=65535 Len=0
1,2.07889299999988,10.0.2.15,62.210.85.178,TLSv1.2,1424,Application Data
1,2.0789269999995668,62.210.85.178,10.0.2.15,TCP,60,9001  >  35978 [ACK] Seq=10336443 Ack=188698781 Win=65535 Len=0
1,2.5764680000002045,54.93.77.70,10.0.2.15,TCP,2950,"9001  >  34692 [PSH, ACK] Seq=188542681 Ack=10381061 Win=65535 Len=2896 [TCP segment of a reassembled PDU]"
1,2.576622999999927,10.0.2.15,54.93.77.70,TCP,54,34692  >  9001 [ACK] Seq=10381061 Ack=188545577 Win=65535 Len=0
1,2.579682999999932,54.93.77.70,10.0.2.15,TLSv1.2,1502,Application Data [TCP segment of a reassembled PDU]
1,2.579729000000043,10.0.2.15,54.93.77.70,TCP,54,34692  >  9001 [ACK] Seq=10381061 Ack=188547025 Win=65535 Len=0
1,2.580793999999514,54.93.77.70,10.0.2.15,TLSv1.2,6570,"Application Data, Application Data"
1,2.5808139999999185,54.93.77.70,10.0.2.15,TCP,2950,"9001  >  34692 [PSH, ACK] Seq=188553541 Ack=10381061 Win=65535 Len=2896 [TCP segment of a reassembled PDU]"
1,2.580888999999843,10.0.2.15,54.93.77.70,TCP,54,34692  >  9001 [ACK] Seq=10381061 Ack=188556437 Win=65535 Len=0
1,2.5809819999994943,54.93.77.70,10.0.2.15,TLSv1.2,1502,"Application Data, Application Data"
1,2.581094000000121,10.0.2.15,54.93.77.70,TCP,54,34692  >  9001 [ACK] Seq=10381061 Ack=188557885 Win=65535 Len=0
1,2.596636000000217,54.93.77.70,10.0.2.15,TLSv1.2,2950,Application Data [TCP segment of a reassembled PDU]
1,2.5966859999998633,10.0.2.15,54.93.77.70,TCP,54,34692  >  9001 [ACK] Seq=10381061 Ack=188560781 Win=65535 Len=0
1,2.5976659999996627,54.93.77.70,10.0.2.15,TLSv1.2,4232,"Application Data, Application Data"
1,2.597737000000052,10.0.2.15,54.93.77.70,TCP,54,34692  >  9001 [ACK] Seq=10381061 Ack=188564959 Win=65535 Len=0
1,2.5980239999998958,10.0.2.15,54.93.77.70,TLSv1.2,590,Application Data
1,2.59813800000029,54.93.77.70,10.0.2.15,TCP,60,9001  >  34692 [ACK] Seq=188564959 Ack=10381597 Win=65535 Len=0
1,2.6071670000001177,10.0.2.15,54.93.77.70,TLSv1.2,590,Application Data
1,2.607336999999461,54.93.77.70,10.0.2.15,TCP,60,9001  >  34692 [ACK] Seq=188564959 Ack=10382133 Win=65535 Len=0
1,2.695369999999457,62.210.85.178,10.0.2.15,TLSv1.2,590,Application Data
1,2.7368569999998726,10.0.2.15,62.210.85.178,TCP,54,35978  >  9001 [ACK] Seq=188698781 Ack=10336979 Win=65535 Len=0
1,2.888036000000284,62.210.85.178,10.0.2.15,TLSv1.2,590,Application Data
1,2.8881129999999757,10.0.2.15,62.210.85.178,TCP,54,35978  >  9001 [ACK] Seq=188698781 Ack=10337515 Win=65535 Len=0
1,2.888629000000037,10.0.2.15,62.210.85.178,TLSv1.2,590,Application Data
1,2.8887299999996685,62.210.85.178,10.0.2.15,TCP,60,9001  >  35978 [ACK] Seq=10337515 Ack=188699317 Win=65535 Len=0
1,3.0081270000000586,54.93.77.70,10.0.2.15,TLSv1.2,590,Application Data
1,3.008506999999554,10.0.2.15,54.93.77.70,TLSv1.2,590,Application Data
1,3.008611000000201,54.93.77.70,10.0.2.15,TCP,60,9001  >  34692 [ACK] Seq=188565495 Ack=10382669 Win=65535 Len=0
1,3.4969979999996212,62.210.85.178,10.0.2.15,TLSv1.2,590,Application Data
1,3.5031469999994442,10.0.2.15,62.210.85.178,TLSv1.2,590,Application Data
1,3.503729000000021,62.210.85.178,10.0.2.15,TCP,60,9001  >  35978 [ACK] Seq=10338051 Ack=188699853 Win=65535 Len=0
1,3.513503999999557,10.0.2.15,62.210.85.178,TLSv1.2,4124,Application Data
1,3.513605000000098,10.0.2.15,62.210.85.178,TCP,2974,35978  >  9001 [ACK] Seq=188703923 Ack=10338051 Win=65535 Len=2920 [TCP segment of a reassembled PDU]
1,3.513644999999997,62.210.85.178,10.0.2.15,TCP,60,9001  >  35978 [ACK] Seq=10338051 Ack=188701313 Win=65535 Len=0
1,3.5136569999995118,62.210.85.178,10.0.2.15,TCP,60,9001  >  35978 [ACK] Seq=10338051 Ack=188702773 Win=65535 Len=0
1,3.5136609999999564,62.210.85.178,10.0.2.15,TCP,60,9001  >  35978 [ACK] Seq=10338051 Ack=188703923 Win=65535 Len=0
1,3.513662999999724,62.210.85.178,10.0.2.15,TCP,60,9001  >  35978 [ACK] Seq=10338051 Ack=188705383 Win=65535 Len=0
1,3.51366599999983,62.210.85.178,10.0.2.15,TCP,60,9001  >  35978 [ACK] Seq=10338051 Ack=188706843 Win=65535 Len=0
1,3.513699999999517,10.0.2.15,62.210.85.178,TLSv1.2,1204,Application Data
1,3.513734999999542,62.210.85.178,10.0.2.15,TCP,60,9001  >  35978 [ACK] Seq=10338051 Ack=188707993 Win=65535 Len=0
1,3.5137770000001183,10.0.2.15,62.210.85.178,TLSv1.2,4124,Application Data
1,3.5138200000001234,62.210.85.178,10.0.2.15,TCP,60,9001  >  35978 [ACK] Seq=10338051 Ack=188709453 Win=65535 Len=0
1,3.5138269999997647,62.210.85.178,10.0.2.15,TCP,60,9001  >  35978 [ACK] Seq=10338051 Ack=188710913 Win=65535 Len=0
1,3.513829999999871,62.210.85.178,10.0.2.15,TCP,60,9001  >  35978 [ACK] Seq=10338051 Ack=188712063 Win=65535 Len=0
1,3.5138669999996637,10.0.2.15,62.210.85.178,TLSv1.2,4124,Application Data
1,3.5139280000003055,62.210.85.178,10.0.2.15,TCP,60,9001  >  35978 [ACK] Seq=10338051 Ack=188713523 Win=65535 Len=0
1,3.513938999999482,62.210.85.178,10.0.2.15,TCP,60,9001  >  35978 [ACK] Seq=10338051 Ack=188714983 Win=65535 Len=0
1,3.513941999999588,62.210.85.178,10.0.2.15,TCP,60,9001  >  35978 [ACK] Seq=10338051 Ack=188716133 Win=65535 Len=0
1,3.5139879999996992,10.0.2.15,62.210.85.178,TLSv1.2,332,Application Data
1,3.514046999999664,62.210.85.178,10.0.2.15,TCP,60,9001  >  35978 [ACK] Seq=10338051 Ack=188716411 Win=65535 Len=0
1,3.5141130000001795,10.0.2.15,62.210.85.178,TLSv1.2,3868,Application Data
1,3.51415199999974,62.210.85.178,10.0.2.15,TCP,60,9001  >  35978 [ACK] Seq=10338051 Ack=188717871 Win=65535 Len=0
1,3.5141590000002907,62.210.85.178,10.0.2.15,TCP,60,9001  >  35978 [ACK] Seq=10338051 Ack=188719331 Win=65535 Len=0
1,3.5141619999994873,62.210.85.178,10.0.2.15,TCP,60,9001  >  35978 [ACK] Seq=10338051 Ack=188720225 Win=65535 Len=0
1,3.5141999999996187,10.0.2.15,62.210.85.178,TLSv1.2,4124,Application Data
1,3.514234999999644,62.210.85.178,10.0.2.15,TCP,60,9001  >  35978 [ACK] Seq=10338051 Ack=188721685 Win=65535 Len=0
1,3.5142409999998563,62.210.85.178,10.0.2.15,TCP,60,9001  >  35978 [ACK] Seq=10338051 Ack=188723145 Win=65535 Len=0
1,3.5142439999999624,62.210.85.178,10.0.2.15,TCP,60,9001  >  35978 [ACK] Seq=10338051 Ack=188724295 Win=65535 Len=0
1,3.5142789999999877,10.0.2.15,62.210.85.178,TLSv1.2,3030,Application Data
1,3.5143129999996745,62.210.85.178,10.0.2.15,TCP,60,9001  >  35978 [ACK] Seq=10338051 Ack=188725755 Win=65535 Len=0
1,3.5143189999998867,62.210.85.178,10.0.2.15,TCP,60,9001  >  35978 [ACK] Seq=10338051 Ack=188727215 Win=65535 Len=0
1,3.514321999999993,62.210.85.178,10.0.2.15,TCP,60,9001  >  35978 [ACK] Seq=10338051 Ack=188727271 Win=65535 Len=0
1,3.523533999999927,10.0.2.15,62.210.85.178,TLSv1.2,4124,Application Data
1,3.5235830000001442,62.210.85.178,10.0.2.15,TCP,60,9001  >  35978 [ACK] Seq=10338051 Ack=188728731 Win=65535 Len=0
1,3.52359400000023,62.210.85.178,10.0.2.15,TCP,60,9001  >  35978 [ACK] Seq=10338051 Ack=188730191 Win=65535 Len=0
1,3.5235979999997653,62.210.85.178,10.0.2.15,TCP,60,9001  >  35978 [ACK] Seq=10338051 Ack=188731341 Win=65535 Len=0
1,3.523642000000109,10.0.2.15,62.210.85.178,TLSv1.2,4124,Application Data
1,3.5237019999995027,62.210.85.178,10.0.2.15,TCP,60,9001  >  35978 [ACK] Seq=10338051 Ack=188732801 Win=65535 Len=0
1,3.523707999999715,62.210.85.178,10.0.2.15,TCP,60,9001  >  35978 [ACK] Seq=10338051 Ack=188734261 Win=65535 Len=0
1,3.523710999999821,62.210.85.178,10.0.2.15,TCP,60,9001  >  35978 [ACK] Seq=10338051 Ack=188735411 Win=65535 Len=0
1,3.523747000000185,10.0.2.15,62.210.85.178,TLSv1.2,4124,Application Data
1,3.523783999999978,62.210.85.178,10.0.2.15,TCP,60,9001  >  35978 [ACK] Seq=10338051 Ack=188736871 Win=65535 Len=0
1,3.5237919999999576,62.210.85.178,10.0.2.15,TCP,60,9001  >  35978 [ACK] Seq=10338051 Ack=188738331 Win=65535 Len=0
1,3.523795999999493,62.210.85.178,10.0.2.15,TCP,60,9001  >  35978 [ACK] Seq=10338051 Ack=188739481 Win=65535 Len=0
1,3.5238319999998566,10.0.2.15,62.210.85.178,TLSv1.2,4124,Application Data
1,3.5238659999995434,62.210.85.178,10.0.2.15,TCP,60,9001  >  35978 [ACK] Seq=10338051 Ack=188740941 Win=65535 Len=0
1,3.523873000000094,62.210.85.178,10.0.2.15,TCP,60,9001  >  35978 [ACK] Seq=10338051 Ack=188742401 Win=65535 Len=0
1,3.523877999999968,62.210.85.178,10.0.2.15,TCP,60,9001  >  35978 [ACK] Seq=10338051 Ack=188743551 Win=65535 Len=0
1,3.5239110000002256,10.0.2.15,62.210.85.178,TLSv1.2,332,Application Data
1,3.5239449999999124,62.210.85.178,10.0.2.15,TCP,60,9001  >  35978 [ACK] Seq=10338051 Ack=188743829 Win=65535 Len=0
1,3.5239940000001297,10.0.2.15,62.210.85.178,TLSv1.2,3868,Application Data
1,3.5240309999999226,62.210.85.178,10.0.2.15,TCP,60,9001  >  35978 [ACK] Seq=10338051 Ack=188745289 Win=65535 Len=0
1,3.524037999999564,62.210.85.178,10.0.2.15,TCP,60,9001  >  35978 [ACK] Seq=10338051 Ack=188746749 Win=65535 Len=0
1,3.52404099999967,62.210.85.178,10.0.2.15,TCP,60,9001  >  35978 [ACK] Seq=10338051 Ack=188747643 Win=65535 Len=0
1,3.524077999999463,10.0.2.15,62.210.85.178,TLSv1.2,4124,Application Data
1,3.5241109999997207,62.210.85.178,10.0.2.15,TCP,60,9001  >  35978 [ACK] Seq=10338051 Ack=188749103 Win=65535 Len=0
1,3.5241189999997005,62.210.85.178,10.0.2.15,TCP,60,9001  >  35978 [ACK] Seq=10338051 Ack=188750563 Win=65535 Len=0
1,3.524123000000145,62.210.85.178,10.0.2.15,TCP,60,9001  >  35978 [ACK] Seq=10338051 Ack=188751713 Win=65535 Len=0
1,3.5241580000001704,10.0.2.15,62.210.85.178,TLSv1.2,3030,Application Data
1,3.5241930000001958,62.210.85.178,10.0.2.15,TCP,60,9001  >  35978 [ACK] Seq=10338051 Ack=188753173 Win=65535 Len=0
1,3.5241989999994985,62.210.85.178,10.0.2.15,TCP,60,9001  >  35978 [ACK] Seq=10338051 Ack=188754633 Win=65535 Len=0
1,3.5242019999996046,62.210.85.178,10.0.2.15,TCP,60,9001  >  35978 [ACK] Seq=10338051 Ack=188754689 Win=65535 Len=0
1,3.537825999999768,10.0.2.15,62.210.85.178,TLSv1.2,4124,Application Data
1,3.53790299999946,62.210.85.178,10.0.2.15,TCP,60,9001  >  35978 [ACK] Seq=10338051 Ack=188756149 Win=65535 Len=0
1,3.537913000000117,62.210.85.178,10.0.2.15,TCP,60,9001  >  35978 [ACK] Seq=10338051 Ack=188757609 Win=65535 Len=0
1,3.537916000000223,62.210.85.178,10.0.2.15,TCP,60,9001  >  35978 [ACK] Seq=10338051 Ack=188758759 Win=65535 Len=0
1,3.537959999999657,10.0.2.15,62.210.85.178,TLSv1.2,4124,Application Data
1,3.537996000000021,62.210.85.178,10.0.2.15,TCP,60,9001  >  35978 [ACK] Seq=10338051 Ack=188760219 Win=65535 Len=0
1,3.538004000000001,62.210.85.178,10.0.2.15,TCP,60,9001  >  35978 [ACK] Seq=10338051 Ack=188761679 Win=65535 Len=0
1,3.538007999999536,62.210.85.178,10.0.2.15,TCP,60,9001  >  35978 [ACK] Seq=10338051 Ack=188762829 Win=65535 Len=0
1,3.5380450000002384,10.0.2.15,62.210.85.178,TLSv1.2,4124,Application Data
1,3.5380800000002637,62.210.85.178,10.0.2.15,TCP,60,9001  >  35978 [ACK] Seq=10338051 Ack=188764289 Win=65535 Len=0
1,3.5380889999996725,62.210.85.178,10.0.2.15,TCP,60,9001  >  35978 [ACK] Seq=10338051 Ack=188765749 Win=65535 Len=0
1,3.538093999999546,62.210.85.178,10.0.2.15,TCP,60,9001  >  35978 [ACK] Seq=10338051 Ack=188766899 Win=65535 Len=0
1,3.5381310000002486,10.0.2.15,62.210.85.178,TLSv1.2,4124,Application Data
1,3.5381649999999354,62.210.85.178,10.0.2.15,TCP,60,9001  >  35978 [ACK] Seq=10338051 Ack=188768359 Win=65535 Len=0
1,3.5381719999995767,62.210.85.178,10.0.2.15,TCP,60,9001  >  35978 [ACK] Seq=10338051 Ack=188769819 Win=65535 Len=0
1,3.5381760000000213,62.210.85.178,10.0.2.15,TCP,60,9001  >  35978 [ACK] Seq=10338051 Ack=188770969 Win=65535 Len=0
1,3.538209999999708,10.0.2.15,62.210.85.178,TLSv1.2,332,Application Data
1,3.538242999999966,62.210.85.178,10.0.2.15,TCP,60,9001  >  35978 [ACK] Seq=10338051 Ack=188771247 Win=65535 Len=0
1,3.538292999999612,10.0.2.15,62.210.85.178,TLSv1.2,3868,Application Data
1,3.5383279999996375,62.210.85.178,10.0.2.15,TCP,60,9001  >  35978 [ACK] Seq=10338051 Ack=188772707 Win=65535 Len=0
1,3.5383350000001883,62.210.85.178,10.0.2.15,TCP,60,9001  >  35978 [ACK] Seq=10338051 Ack=188774167 Win=65535 Len=0
1,3.5383389999997235,62.210.85.178,10.0.2.15,TCP,60,9001  >  35978 [ACK] Seq=10338051 Ack=188775061 Win=65535 Len=0
1,3.5383750000000873,10.0.2.15,62.210.85.178,TLSv1.2,1424,Application Data
1,3.538408999999774,62.210.85.178,10.0.2.15,TCP,60,9001  >  35978 [ACK] Seq=10338051 Ack=188776431 Win=65535 Len=0
1,3.616089000000102,54.93.77.70,10.0.2.15,TLSv1.2,3674,Application Data
1,3.616211999999905,10.0.2.15,54.93.77.70,TCP,54,34692  >  9001 [ACK] Seq=10382669 Ack=188569115 Win=65535 Len=0
1,3.645661999999902,54.93.77.70,10.0.2.15,TLSv1.2,7294,Application Data
1,3.6458130000000892,10.0.2.15,54.93.77.70,TCP,54,34692  >  9001 [ACK] Seq=10382669 Ack=188576355 Win=65535 Len=0
1,3.646810999999616,54.93.77.70,10.0.2.15,TLSv1.2,568,Application Data
1,3.6815630000000965,54.93.77.70,10.0.2.15,TLSv1.2,4398,Application Data
1,3.681652000000213,10.0.2.15,54.93.77.70,TCP,54,34692  >  9001 [ACK] Seq=10382669 Ack=188581213 Win=65535 Len=0
1,3.7160869999997885,54.93.77.70,10.0.2.15,TLSv1.2,4724,"Application Data, Application Data"
1,3.716150000000198,54.93.77.70,10.0.2.15,TLSv1.2,12834,"Application Data, Application Data, Application Data"
1,3.7162379999999757,10.0.2.15,54.93.77.70,TCP,54,34692  >  9001 [ACK] Seq=10382669 Ack=188598663 Win=65535 Len=0
1,3.716298000000279,54.93.77.70,10.0.2.15,TCP,1754,"9001  >  34692 [PSH, ACK] Seq=188598663 Ack=10382669 Win=65535 Len=1700 [TCP segment of a reassembled PDU]"
1,3.716451999999663,10.0.2.15,54.93.77.70,TCP,54,34692  >  9001 [ACK] Seq=10382669 Ack=188600363 Win=65535 Len=0
1,3.7168149999997695,10.0.2.15,54.93.77.70,TLSv1.2,590,Application Data
1,3.716881000000285,54.93.77.70,10.0.2.15,TCP,60,9001  >  34692 [ACK] Seq=188600363 Ack=10383205 Win=65535 Len=0
1,3.7320749999998952,54.93.77.70,10.0.2.15,TLSv1.2,358,Application Data
1,3.7728539999998247,10.0.2.15,54.93.77.70,TCP,54,34692  >  9001 [ACK] Seq=10383205 Ack=188600667 Win=65535 Len=0
1,3.8122990000001664,54.93.77.70,10.0.2.15,TLSv1.2,3674,Application Data
1,3.812377000000197,10.0.2.15,54.93.77.70,TCP,54,34692  >  9001 [ACK] Seq=10383205 Ack=188604287 Win=65535 Len=0
1,3.829447000000073,54.93.77.70,10.0.2.15,TLSv1.2,7294,Application Data
1,3.8294969999997193,10.0.2.15,54.93.77.70,TCP,54,34692  >  9001 [ACK] Seq=10383205 Ack=188611527 Win=65535 Len=0
1,3.8308219999998983,54.93.77.70,10.0.2.15,TLSv1.2,568,Application Data
1,3.8308689999994385,10.0.2.15,54.93.77.70,TCP,54,34692  >  9001 [ACK] Seq=10383205 Ack=188612041 Win=65535 Len=0
1,3.85081799999989,54.93.77.70,10.0.2.15,TCP,2950,"9001  >  34692 [PSH, ACK] Seq=188612041 Ack=10383205 Win=65535 Len=2896 [TCP segment of a reassembled PDU]"
1,3.8508860000001732,10.0.2.15,54.93.77.70,TCP,54,34692  >  9001 [ACK] Seq=10383205 Ack=188614937 Win=65535 Len=0
1,3.8528470000001107,54.93.77.70,10.0.2.15,TLSv1.2,9046,"Application Data, Application Data, Application Data"
1,3.8528919999998834,10.0.2.15,54.93.77.70,TCP,54,34692  >  9001 [ACK] Seq=10383205 Ack=188623929 Win=65535 Len=0
1,3.8531709999997474,10.0.2.15,54.93.77.70,TLSv1.2,1104,Application Data
1,3.8532539999996516,54.93.77.70,10.0.2.15,TCP,60,9001  >  34692 [ACK] Seq=188623929 Ack=10384255 Win=65535 Len=0
1,3.8684659999998985,54.93.77.70,10.0.2.15,TLSv1.2,590,Application Data
1,3.8713239999997313,54.93.77.70,10.0.2.15,TCP,2950,"9001  >  34692 [PSH, ACK] Seq=188624465 Ack=10384255 Win=65535 Len=2896 [TCP segment of a reassembled PDU]"
1,3.8713870000001407,10.0.2.15,54.93.77.70,TCP,54,34692  >  9001 [ACK] Seq=10384255 Ack=188627361 Win=65535 Len=0
1,3.878657000000203,54.93.77.70,10.0.2.15,TLSv1.2,1502,Application Data [TCP segment of a reassembled PDU]
1,3.878697999999531,10.0.2.15,54.93.77.70,TCP,54,34692  >  9001 [ACK] Seq=10384255 Ack=188628809 Win=65535 Len=0
1,3.883958999999777,54.93.77.70,10.0.2.15,TLSv1.2,380,Application Data
1,3.8892189999996845,54.93.77.70,10.0.2.15,TCP,2950,"9001  >  34692 [PSH, ACK] Seq=188629135 Ack=10384255 Win=65535 Len=2896 [TCP segment of a reassembled PDU]"
1,3.889277999999649,10.0.2.15,54.93.77.70,TCP,54,34692  >  9001 [ACK] Seq=10384255 Ack=188632031 Win=65535 Len=0
1,3.8898220000000947,62.210.85.178,10.0.2.15,TLSv1.2,590,Application Data
1,3.9010019999996075,54.93.77.70,10.0.2.15,TLSv1.2,1828,"Application Data, Application Data"
1,3.9010479999997187,10.0.2.15,54.93.77.70,TCP,54,34692  >  9001 [ACK] Seq=10384255 Ack=188633805 Win=65535 Len=0
1,3.9110380000001896,54.93.77.70,10.0.2.15,TLSv1.2,5846,Application Data
1,3.9111080000002403,54.93.77.70,10.0.2.15,TLSv1.2,2950,Application Data [TCP segment of a reassembled PDU]
1,3.911200999999892,10.0.2.15,54.93.77.70,TCP,54,34692  >  9001 [ACK] Seq=10384255 Ack=188642493 Win=65535 Len=0
1,3.917887999999948,54.93.77.70,10.0.2.15,TLSv1.2,170,Application Data
1,3.9207509999996546,10.0.2.15,54.93.77.70,TLSv1.2,590,Application Data
1,3.921027000000322,54.93.77.70,10.0.2.15,TCP,60,9001  >  34692 [ACK] Seq=188642609 Ack=10384791 Win=65535 Len=0
1,3.9328020000002653,10.0.2.15,62.210.85.178,TCP,54,35978  >  9001 [ACK] Seq=188776431 Ack=10338587 Win=65535 Len=0
1,3.9743909999997413,62.210.85.178,10.0.2.15,TLSv1.2,1104,Application Data
1,3.9745249999996304,10.0.2.15,62.210.85.178,TCP,54,35978  >  9001 [ACK] Seq=188776431 Ack=10339637 Win=65535 Len=0
1,4.031966999999895,62.210.85.178,10.0.2.15,TLSv1.2,590,Application Data
1,4.032043000000158,10.0.2.15,62.210.85.178,TCP,54,35978  >  9001 [ACK] Seq=188776431 Ack=10340173 Win=65535 Len=0
1,4.032530999999835,10.0.2.15,62.210.85.178,TLSv1.2,590,Application Data
1,4.032631999999467,62.210.85.178,10.0.2.15,TCP,60,9001  >  35978 [ACK] Seq=10340173 Ack=188776967 Win=65535 Len=0
1,4.1548179999999775,54.93.77.70,10.0.2.15,TLSv1.2,590,Application Data
1,4.155219999999645,10.0.2.15,54.93.77.70,TLSv1.2,590,Application Data
1,4.155322999999953,54.93.77.70,10.0.2.15,TCP,60,9001  >  34692 [ACK] Seq=188643145 Ack=10385327 Win=65535 Len=0
1,4.293235999999524,62.210.85.178,10.0.2.15,TLSv1.2,590,Application Data
1,4.300279999999475,10.0.2.15,62.210.85.178,TLSv1.2,590,Application Data
1,4.300478999999541,62.210.85.178,10.0.2.15,TCP,60,9001  >  35978 [ACK] Seq=10340709 Ack=188777503 Win=65535 Len=0
1,4.312898000000132,10.0.2.15,62.210.85.178,TLSv1.2,4124,Application Data
1,4.313003000000208,10.0.2.15,62.210.85.178,TCP,2974,35978  >  9001 [ACK] Seq=188781573 Ack=10340709 Win=65535 Len=2920 [TCP segment of a reassembled PDU]
1,4.313047999999981,62.210.85.178,10.0.2.15,TCP,60,9001  >  35978 [ACK] Seq=10340709 Ack=188778963 Win=65535 Len=0
1,4.313057999999728,62.210.85.178,10.0.2.15,TCP,60,9001  >  35978 [ACK] Seq=10340709 Ack=188780423 Win=65535 Len=0
1,4.313062999999602,62.210.85.178,10.0.2.15,TCP,60,9001  >  35978 [ACK] Seq=10340709 Ack=188781573 Win=65535 Len=0
1,4.313067000000046,62.210.85.178,10.0.2.15,TCP,60,9001  >  35978 [ACK] Seq=10340709 Ack=188783033 Win=65535 Len=0
1,4.3130709999995815,62.210.85.178,10.0.2.15,TCP,60,9001  >  35978 [ACK] Seq=10340709 Ack=188784493 Win=65535 Len=0
1,4.313113999999587,10.0.2.15,62.210.85.178,TLSv1.2,1204,Application Data
1,4.313153999999486,62.210.85.178,10.0.2.15,TCP,60,9001  >  35978 [ACK] Seq=10340709 Ack=188785643 Win=65535 Len=0
1,4.313235999999961,10.0.2.15,62.210.85.178,TLSv1.2,4124,Application Data
1,4.313299999999799,10.0.2.15,62.210.85.178,TCP,2974,35978  >  9001 [ACK] Seq=188789713 Ack=10340709 Win=65535 Len=2920 [TCP segment of a reassembled PDU]
1,4.313336000000163,62.210.85.178,10.0.2.15,TCP,60,9001  >  35978 [ACK] Seq=10340709 Ack=188787103 Win=65535 Len=0
1,4.313342999999804,62.210.85.178,10.0.2.15,TCP,60,9001  >  35978 [ACK] Seq=10340709 Ack=188788563 Win=65535 Len=0
1,4.313347999999678,62.210.85.178,10.0.2.15,TCP,60,9001  >  35978 [ACK] Seq=10340709 Ack=188789713 Win=65535 Len=0
1,4.313352000000123,62.210.85.178,10.0.2.15,TCP,60,9001  >  35978 [ACK] Seq=10340709 Ack=188791173 Win=65535 Len=0
1,4.313355999999658,62.210.85.178,10.0.2.15,TCP,60,9001  >  35978 [ACK] Seq=10340709 Ack=188792633 Win=65535 Len=0
1,4.313393999999789,10.0.2.15,62.210.85.178,TLSv1.2,1204,Application Data
1,4.313476000000264,10.0.2.15,62.210.85.178,TLSv1.2,2974,Application Data
1,4.313516000000163,62.210.85.178,10.0.2.15,TCP,60,9001  >  35978 [ACK] Seq=10340709 Ack=188793783 Win=65535 Len=0
1,4.313521999999466,62.210.85.178,10.0.2.15,TCP,60,9001  >  35978 [ACK] Seq=10340709 Ack=188795243 Win=65535 Len=0
1,4.313527000000249,62.210.85.178,10.0.2.15,TCP,60,9001  >  35978 [ACK] Seq=10340709 Ack=188796703 Win=65535 Len=0
1,4.313560999999936,10.0.2.15,62.210.85.178,TLSv1.2,1226,Application Data
1,4.313627999999881,10.0.2.15,62.210.85.178,TCP,2974,35978  >  9001 [ACK] Seq=188797875 Ack=10340709 Win=65535 Len=2920 [TCP segment of a reassembled PDU]
1,4.313661999999567,62.210.85.178,10.0.2.15,TCP,60,9001  >  35978 [ACK] Seq=10340709 Ack=188797875 Win=65535 Len=0
1,4.313669000000118,62.210.85.178,10.0.2.15,TCP,60,9001  >  35978 [ACK] Seq=10340709 Ack=188799335 Win=65535 Len=0
1,4.313673999999992,62.210.85.178,10.0.2.15,TCP,60,9001  >  35978 [ACK] Seq=10340709 Ack=188800795 Win=65535 Len=0
1,4.3137049999995725,10.0.2.15,62.210.85.178,TLSv1.2,1204,Application Data
1,4.313742000000275,62.210.85.178,10.0.2.15,TCP,60,9001  >  35978 [ACK] Seq=10340709 Ack=188801945 Win=65535 Len=0
1,4.31378500000028,10.0.2.15,62.210.85.178,TLSv1.2,3030,Application Data
1,4.313881000000038,62.210.85.178,10.0.2.15,TCP,60,9001  >  35978 [ACK] Seq=10340709 Ack=188803405 Win=65535 Len=0
1,4.313895999999659,62.210.85.178,10.0.2.15,TCP,60,9001  >  35978 [ACK] Seq=10340709 Ack=188804865 Win=65535 Len=0
1,4.313900000000103,62.210.85.178,10.0.2.15,TCP,60,9001  >  35978 [ACK] Seq=10340709 Ack=188804921 Win=65535 Len=0
1,4.322998999999982,10.0.2.15,62.210.85.178,TLSv1.2,4124,Application Data
1,4.323077000000012,10.0.2.15,62.210.85.178,TCP,2974,35978  >  9001 [ACK] Seq=188808991 Ack=10340709 Win=65535 Len=2920 [TCP segment of a reassembled PDU]
1,4.323112000000037,62.210.85.178,10.0.2.15,TCP,60,9001  >  35978 [ACK] Seq=10340709 Ack=188806381 Win=65535 Len=0
1,4.323120000000017,62.210.85.178,10.0.2.15,TCP,60,9001  >  35978 [ACK] Seq=10340709 Ack=188807841 Win=65535 Len=0
1,4.323123999999552,62.210.85.178,10.0.2.15,TCP,60,9001  >  35978 [ACK] Seq=10340709 Ack=188808991 Win=65535 Len=0
1,4.3231290000003355,62.210.85.178,10.0.2.15,TCP,60,9001  >  35978 [ACK] Seq=10340709 Ack=188810451 Win=65535 Len=0
1,4.323132999999871,62.210.85.178,10.0.2.15,TCP,60,9001  >  35978 [ACK] Seq=10340709 Ack=188811911 Win=65535 Len=0
1,4.323171999999431,10.0.2.15,62.210.85.178,TLSv1.2,1204,Application Data
1,4.323237999999947,10.0.2.15,62.210.85.178,TCP,2974,35978  >  9001 [ACK] Seq=188813061 Ack=10340709 Win=65535 Len=2920 [TCP segment of a reassembled PDU]
1,4.323276000000078,62.210.85.178,10.0.2.15,TCP,60,9001  >  35978 [ACK] Seq=10340709 Ack=188813061 Win=65535 Len=0
1,4.323282999999719,62.210.85.178,10.0.2.15,TCP,60,9001  >  35978 [ACK] Seq=10340709 Ack=188814521 Win=65535 Len=0
1,4.323287999999593,62.210.85.178,10.0.2.15,TCP,60,9001  >  35978 [ACK] Seq=10340709 Ack=188815981 Win=65535 Len=0
1,4.323322999999618,10.0.2.15,62.210.85.178,TLSv1.2,1204,Application Data
1,4.323390999999901,10.0.2.15,62.210.85.178,TCP,2974,35978  >  9001 [ACK] Seq=188817131 Ack=10340709 Win=65535 Len=2920 [TCP segment of a reassembled PDU]
1,4.323427000000265,62.210.85.178,10.0.2.15,TCP,60,9001  >  35978 [ACK] Seq=10340709 Ack=188817131 Win=65535 Len=0
1,4.323432999999568,62.210.85.178,10.0.2.15,TCP,60,9001  >  35978 [ACK] Seq=10340709 Ack=188818591 Win=65535 Len=0
1,4.323437999999442,62.210.85.178,10.0.2.15,TCP,60,9001  >  35978 [ACK] Seq=10340709 Ack=188820051 Win=65535 Len=0
1,4.323468999999932,10.0.2.15,62.210.85.178,TLSv1.2,1204,Application Data
1,4.323574000000008,62.210.85.178,10.0.2.15,TCP,60,9001  >  35978 [ACK] Seq=10340709 Ack=188821201 Win=65535 Len=0
1,4.323615000000245,10.0.2.15,62.210.85.178,TLSv1.2,868,"Application Data, Application Data"
1,4.323655000000144,62.210.85.178,10.0.2.15,TCP,60,9001  >  35978 [ACK] Seq=10340709 Ack=188822015 Win=65535 Len=0
1,4.4789810000002035,54.93.77.70,10.0.2.15,TLSv1.2,590,Application Data
1,4.520816000000195,10.0.2.15,54.93.77.70,TCP,54,34692  >  9001 [ACK] Seq=10385327 Ack=188643681 Win=65535 Len=0
1,4.522036000000298,54.93.77.70,10.0.2.15,TLSv1.2,7294,"Application Data, Application Data"
1,4.522097000000031,10.0.2.15,54.93.77.70,TCP,54,34692  >  9001 [ACK] Seq=10385327 Ack=188650921 Win=65535 Len=0
1,4.542411999999786,54.93.77.70,10.0.2.15,TLSv1.2,3674,Application Data
1,4.542486000000281,10.0.2.15,54.93.77.70,TCP,54,34692  >  9001 [ACK] Seq=10385327 Ack=188654541 Win=65535 Len=0
1,4.566745000000083,54.93.77.70,10.0.2.15,TCP,2950,"9001  >  34692 [PSH, ACK] Seq=188654541 Ack=10385327 Win=65535 Len=2896 [TCP segment of a reassembled PDU]"
1,4.566842999999608,10.0.2.15,54.93.77.70,TCP,54,34692  >  9001 [ACK] Seq=10385327 Ack=188657437 Win=65535 Len=0
1,4.569822999999815,54.93.77.70,10.0.2.15,TLSv1.2,2894,Application Data [TCP segment of a reassembled PDU]
1,4.56988900000033,10.0.2.15,54.93.77.70,TCP,54,34692  >  9001 [ACK] Seq=10385327 Ack=188660277 Win=65535 Len=0
1,4.569942000000083,54.93.77.70,10.0.2.15,TLSv1.2,4664,"Application Data, Application Data"
1,4.569953999999598,54.93.77.70,10.0.2.15,TLSv1.2,8742,"Application Data, Application Data"
1,4.5700019999994765,10.0.2.15,54.93.77.70,TCP,54,34692  >  9001 [ACK] Seq=10385327 Ack=188664887 Win=65535 Len=0
1,4.570044999999482,10.0.2.15,54.93.77.70,TCP,54,34692  >  9001 [ACK] Seq=10385327 Ack=188673575 Win=65535 Len=0
1,4.570572999999968,10.0.2.15,54.93.77.70,TLSv1.2,1104,Application Data
1,4.570654000000104,54.93.77.70,10.0.2.15,TCP,60,9001  >  34692 [ACK] Seq=188673575 Ack=10386377 Win=65535 Len=0
1,4.574416999999812,54.93.77.70,10.0.2.15,TLSv1.2,2950,Application Data [TCP segment of a reassembled PDU]
1,4.574595999999474,10.0.2.15,54.93.77.70,TCP,54,34692  >  9001 [ACK] Seq=10386377 Ack=188676471 Win=65535 Len=0
1,4.585078000000067,54.93.77.70,10.0.2.15,TLSv1.2,5846,Application Data [TCP segment of a reassembled PDU]
1,4.585224999999809,10.0.2.15,54.93.77.70,TCP,54,34692  >  9001 [ACK] Seq=10386377 Ack=188682263 Win=65535 Len=0
1,4.585525999999845,54.93.77.70,10.0.2.15,TLSv1.2,800,"Application Data, Application Data"
1,4.599431999999979,54.93.77.70,10.0.2.15,TCP,2950,"9001  >  34692 [PSH, ACK] Seq=188683009 Ack=10386377 Win=65535 Len=2896 [TCP segment of a reassembled PDU]"
1,4.59948600000007,10.0.2.15,54.93.77.70,TCP,54,34692  >  9001 [ACK] Seq=10386377 Ack=188685905 Win=65535 Len=0
1,4.601270000000113,54.93.77.70,10.0.2.15,TLSv1.2,778,Application Data
1,4.6063139999996565,54.93.77.70,10.0.2.15,TCP,1502,"9001  >  34692 [PSH, ACK] Seq=188686629 Ack=10386377 Win=65535 Len=1448 [TCP segment of a reassembled PDU]"
1,4.606358,10.0.2.15,54.93.77.70,TCP,54,34692  >  9001 [ACK] Seq=10386377 Ack=188688077 Win=65535 Len=0
1,4.616871000000174,54.93.77.70,10.0.2.15,TLSv1.2,170,Application Data
1,4.620060999999623,10.0.2.15,54.93.77.70,TLSv1.2,590,Application Data
1,4.620321000000331,54.93.77.70,10.0.2.15,TCP,60,9001  >  34692 [ACK] Seq=188688193 Ack=10386913 Win=65535 Len=0
1,4.704654999999548,62.210.85.178,10.0.2.15,TLSv1.2,1104,Application Data
1,4.744818000000123,10.0.2.15,62.210.85.178,TCP,54,35978  >  9001 [ACK] Seq=188822015 Ack=10341759 Win=65535 Len=0
1,4.804613999999674,62.210.85.178,10.0.2.15,TLSv1.2,590,Application Data
1,4.804712000000109,10.0.2.15,62.210.85.178,TCP,54,35978  >  9001 [ACK] Seq=188822015 Ack=10342295 Win=65535 Len=0
1,4.805247999999665,10.0.2.15,62.210.85.178,TLSv1.2,590,Application Data
1,4.80537699999968,62.210.85.178,10.0.2.15,TCP,60,9001  >  35978 [ACK] Seq=10342295 Ack=188822551 Win=65535 Len=0
1,5.015411999999742,54.93.77.70,10.0.2.15,TLSv1.2,590,Application Data
1,5.0158510000001115,10.0.2.15,54.93.77.70,TLSv1.2,590,Application Data
1,5.015980999999556,54.93.77.70,10.0.2.15,TCP,60,9001  >  34692 [ACK] Seq=188688729 Ack=10387449 Win=65535 Len=0
1,5.158282000000327,62.210.85.178,10.0.2.15,TLSv1.2,590,Application Data
1,5.164847999999438,10.0.2.15,62.210.85.178,TLSv1.2,590,Application Data
1,5.1650110000000495,62.210.85.178,10.0.2.15,TCP,60,9001  >  35978 [ACK] Seq=10342831 Ack=188823087 Win=65535 Len=0
1,5.177566000000297,10.0.2.15,62.210.85.178,TLSv1.2,4124,Application Data
1,5.177684000000227,10.0.2.15,62.210.85.178,TCP,2974,35978  >  9001 [ACK] Seq=188827157 Ack=10342831 Win=65535 Len=2920 [TCP segment of a reassembled PDU]
1,5.177730999999767,62.210.85.178,10.0.2.15,TCP,60,9001  >  35978 [ACK] Seq=10342831 Ack=188824547 Win=65535 Len=0
1,5.177744999999959,62.210.85.178,10.0.2.15,TCP,60,9001  >  35978 [ACK] Seq=10342831 Ack=188826007 Win=65535 Len=0
1,5.177749999999833,62.210.85.178,10.0.2.15,TCP,60,9001  >  35978 [ACK] Seq=10342831 Ack=188827157 Win=65535 Len=0
1,5.177754999999706,62.210.85.178,10.0.2.15,TCP,60,9001  >  35978 [ACK] Seq=10342831 Ack=188828617 Win=65535 Len=0
1,5.1777579999998125,62.210.85.178,10.0.2.15,TCP,60,9001  >  35978 [ACK] Seq=10342831 Ack=188830077 Win=65535 Len=0
1,5.177794000000176,10.0.2.15,62.210.85.178,TLSv1.2,1204,Application Data
1,5.177834000000075,62.210.85.178,10.0.2.15,TCP,60,9001  >  35978 [ACK] Seq=10342831 Ack=188831227 Win=65535 Len=0
1,5.1778800000001866,10.0.2.15,62.210.85.178,TLSv1.2,4124,Application Data
1,5.177918999999747,62.210.85.178,10.0.2.15,TCP,60,9001  >  35978 [ACK] Seq=10342831 Ack=188832687 Win=65535 Len=0
1,5.177926999999727,62.210.85.178,10.0.2.15,TCP,60,9001  >  35978 [ACK] Seq=10342831 Ack=188834147 Win=65535 Len=0
1,5.1779310000001715,62.210.85.178,10.0.2.15,TCP,60,9001  >  35978 [ACK] Seq=10342831 Ack=188835297 Win=65535 Len=0
1,5.177969999999732,10.0.2.15,62.210.85.178,TLSv1.2,4124,Application Data
1,5.178007999999863,62.210.85.178,10.0.2.15,TCP,60,9001  >  35978 [ACK] Seq=10342831 Ack=188836757 Win=65535 Len=0
1,5.178014999999505,62.210.85.178,10.0.2.15,TCP,60,9001  >  35978 [ACK] Seq=10342831 Ack=188838217 Win=65535 Len=0
1,5.178077999999914,10.0.2.15,62.210.85.178,TLSv1.2,2974,Application Data
1,5.178117999999813,62.210.85.178,10.0.2.15,TCP,60,9001  >  35978 [ACK] Seq=10342831 Ack=188839367 Win=65535 Len=0
1,5.178125999999793,62.210.85.178,10.0.2.15,TCP,60,9001  >  35978 [ACK] Seq=10342831 Ack=188840827 Win=65535 Len=0
1,5.1781300000002375,62.210.85.178,10.0.2.15,TCP,60,9001  >  35978 [ACK] Seq=10342831 Ack=188842287 Win=65535 Len=0
1,5.178157000000283,10.0.2.15,62.210.85.178,TLSv1.2,1226,Application Data
1,5.178192999999737,62.210.85.178,10.0.2.15,TCP,60,9001  >  35978 [ACK] Seq=10342831 Ack=188843459 Win=65535 Len=0
1,5.178245000000061,10.0.2.15,62.210.85.178,TLSv1.2,4124,Application Data
1,5.178286000000298,62.210.85.178,10.0.2.15,TCP,60,9001  >  35978 [ACK] Seq=10342831 Ack=188844919 Win=65535 Len=0
1,5.17829299999994,62.210.85.178,10.0.2.15,TCP,60,9001  >  35978 [ACK] Seq=10342831 Ack=188846379 Win=65535 Len=0
1,5.178296999999475,62.210.85.178,10.0.2.15,TCP,60,9001  >  35978 [ACK] Seq=10342831 Ack=188847529 Win=65535 Len=0
1,5.17833999999948,10.0.2.15,62.210.85.178,TLSv1.2,3030,Application Data
1,5.178380000000288,62.210.85.178,10.0.2.15,TCP,60,9001  >  35978 [ACK] Seq=10342831 Ack=188848989 Win=65535 Len=0
1,5.178388000000268,62.210.85.178,10.0.2.15,TCP,60,9001  >  35978 [ACK] Seq=10342831 Ack=188850449 Win=65535 Len=0
1,5.178393000000142,62.210.85.178,10.0.2.15,TCP,60,9001  >  35978 [ACK] Seq=10342831 Ack=188850505 Win=65535 Len=0
1,5.1876320000001215,10.0.2.15,62.210.85.178,TLSv1.2,4124,Application Data
1,5.187694000000192,62.210.85.178,10.0.2.15,TCP,60,9001  >  35978 [ACK] Seq=10342831 Ack=188851965 Win=65535 Len=0
1,5.187707999999475,62.210.85.178,10.0.2.15,TCP,60,9001  >  35978 [ACK] Seq=10342831 Ack=188853425 Win=65535 Len=0
1,5.1877119999999195,62.210.85.178,10.0.2.15,TCP,60,9001  >  35978 [ACK] Seq=10342831 Ack=188854575 Win=65535 Len=0
1,5.187758000000031,10.0.2.15,62.210.85.178,TLSv1.2,4124,Application Data
1,5.187799000000268,62.210.85.178,10.0.2.15,TCP,60,9001  >  35978 [ACK] Seq=10342831 Ack=188856035 Win=65535 Len=0
1,5.187807999999677,62.210.85.178,10.0.2.15,TCP,60,9001  >  35978 [ACK] Seq=10342831 Ack=188857495 Win=65535 Len=0
1,5.187812999999551,62.210.85.178,10.0.2.15,TCP,60,9001  >  35978 [ACK] Seq=10342831 Ack=188858645 Win=65535 Len=0
1,5.187852000000021,10.0.2.15,62.210.85.178,TLSv1.2,4124,Application Data
1,5.187922000000071,62.210.85.178,10.0.2.15,TCP,60,9001  >  35978 [ACK] Seq=10342831 Ack=188860105 Win=65535 Len=0
1,5.18793099999948,62.210.85.178,10.0.2.15,TCP,60,9001  >  35978 [ACK] Seq=10342831 Ack=188861565 Win=65535 Len=0
1,5.1879360000002634,62.210.85.178,10.0.2.15,TCP,60,9001  >  35978 [ACK] Seq=10342831 Ack=188862715 Win=65535 Len=0
1,5.187973000000056,10.0.2.15,62.210.85.178,TLSv1.2,4124,Application Data
1,5.188046000000213,62.210.85.178,10.0.2.15,TCP,60,9001  >  35978 [ACK] Seq=10342831 Ack=188864175 Win=65535 Len=0
1,5.188054999999622,62.210.85.178,10.0.2.15,TCP,60,9001  >  35978 [ACK] Seq=10342831 Ack=188865635 Win=65535 Len=0
1,5.188059000000067,62.210.85.178,10.0.2.15,TCP,60,9001  >  35978 [ACK] Seq=10342831 Ack=188866785 Win=65535 Len=0
1,5.188094000000092,10.0.2.15,62.210.85.178,TLSv1.2,332,Application Data
1,5.188133999999991,62.210.85.178,10.0.2.15,TCP,60,9001  >  35978 [ACK] Seq=10342831 Ack=188867063 Win=65535 Len=0
1,5.188191999999617,10.0.2.15,62.210.85.178,TLSv1.2,3868,Application Data
1,5.188231000000087,62.210.85.178,10.0.2.15,TCP,60,9001  >  35978 [ACK] Seq=10342831 Ack=188868523 Win=65535 Len=0
1,5.188239999999496,62.210.85.178,10.0.2.15,TCP,60,9001  >  35978 [ACK] Seq=10342831 Ack=188869983 Win=65535 Len=0
1,5.188253000000259,62.210.85.178,10.0.2.15,TCP,60,9001  >  35978 [ACK] Seq=10342831 Ack=188870877 Win=65535 Len=0
1,5.188293999999587,10.0.2.15,62.210.85.178,TLSv1.2,4124,Application Data
1,5.188333000000057,62.210.85.178,10.0.2.15,TCP,60,9001  >  35978 [ACK] Seq=10342831 Ack=188872337 Win=65535 Len=0
1,5.188341000000037,62.210.85.178,10.0.2.15,TCP,60,9001  >  35978 [ACK] Seq=10342831 Ack=188873797 Win=65535 Len=0
1,5.188344999999572,62.210.85.178,10.0.2.15,TCP,60,9001  >  35978 [ACK] Seq=10342831 Ack=188874947 Win=65535 Len=0
1,5.188380999999936,10.0.2.15,62.210.85.178,TLSv1.2,3030,Application Data
1,5.188419000000067,62.210.85.178,10.0.2.15,TCP,60,9001  >  35978 [ACK] Seq=10342831 Ack=188876407 Win=65535 Len=0
1,5.188427000000047,62.210.85.178,10.0.2.15,TCP,60,9001  >  35978 [ACK] Seq=10342831 Ack=188877867 Win=65535 Len=0
1,5.188430999999582,62.210.85.178,10.0.2.15,TCP,60,9001  >  35978 [ACK] Seq=10342831 Ack=188877923 Win=65535 Len=0
1,5.2008319999995365,10.0.2.15,62.210.85.178,TLSv1.2,4124,Application Data
1,5.200920000000224,10.0.2.15,62.210.85.178,TCP,1514,35978  >  9001 [ACK] Seq=188881993 Ack=10342831 Win=65535 Len=1460 [TCP segment of a reassembled PDU]
1,5.200963000000229,62.210.85.178,10.0.2.15,TCP,60,9001  >  35978 [ACK] Seq=10342831 Ack=188879383 Win=65535 Len=0
1,5.200971999999638,62.210.85.178,10.0.2.15,TCP,60,9001  >  35978 [ACK] Seq=10342831 Ack=188880843 Win=65535 Len=0
1,5.2009769999995115,62.210.85.178,10.0.2.15,TCP,60,9001  >  35978 [ACK] Seq=10342831 Ack=188881993 Win=65535 Len=0
1,5.201043000000027,10.0.2.15,62.210.85.178,TLSv1.2,736,Application Data
1,5.20106399999986,62.210.85.178,10.0.2.15,TCP,60,9001  >  35978 [ACK] Seq=10342831 Ack=188883453 Win=65535 Len=0
1,5.201143000000229,62.210.85.178,10.0.2.15,TCP,60,9001  >  35978 [ACK] Seq=10342831 Ack=188884135 Win=65535 Len=0
1,5.318463999999949,54.93.77.70,10.0.2.15,TLSv1.2,590,Application Data
1,5.360834000000068,10.0.2.15,54.93.77.70,TCP,54,34692  >  9001 [ACK] Seq=10387449 Ack=188689265 Win=65535 Len=0
1,5.486939999999777,54.93.77.70,10.0.2.15,TLSv1.2,3674,Application Data
1,5.487019000000146,10.0.2.15,54.93.77.70,TCP,54,34692  >  9001 [ACK] Seq=10387449 Ack=188692885 Win=65535 Len=0
1,5.60942199999954,54.93.77.70,10.0.2.15,TCP,2950,"9001  >  34692 [PSH, ACK] Seq=188692885 Ack=10387449 Win=65535 Len=2896 [TCP segment of a reassembled PDU]"
1,5.609499000000142,10.0.2.15,54.93.77.70,TCP,54,34692  >  9001 [ACK] Seq=10387449 Ack=188695781 Win=65535 Len=0
1,5.611533999999665,54.93.77.70,10.0.2.15,TLSv1.2,778,Application Data
1,5.611584000000221,10.0.2.15,54.93.77.70,TCP,54,34692  >  9001 [ACK] Seq=10387449 Ack=188696505 Win=65535 Len=0
1,5.612919999999576,54.93.77.70,10.0.2.15,TCP,2950,"9001  >  34692 [PSH, ACK] Seq=188696505 Ack=10387449 Win=65535 Len=2896 [TCP segment of a reassembled PDU]"
1,5.612935999999536,54.93.77.70,10.0.2.15,TLSv1.2,5846,"Application Data, Application Data"
1,5.6129719999999,10.0.2.15,54.93.77.70,TCP,54,34692  >  9001 [ACK] Seq=10387449 Ack=188699401 Win=65535 Len=0
1,5.613013000000137,10.0.2.15,54.93.77.70,TCP,54,34692  >  9001 [ACK] Seq=10387449 Ack=188705193 Win=65535 Len=0
1,5.613223000000289,54.93.77.70,10.0.2.15,TCP,1474,9001  >  34692 [ACK] Seq=188705193 Ack=10387449 Win=65535 Len=1420 [TCP segment of a reassembled PDU]
1,5.613247999999658,10.0.2.15,54.93.77.70,TCP,54,34692  >  9001 [ACK] Seq=10387449 Ack=188706613 Win=65535 Len=0
1,5.613279000000148,54.93.77.70,10.0.2.15,TCP,82,"9001  >  34692 [PSH, ACK] Seq=188706613 Ack=10387449 Win=65535 Len=28 [TCP segment of a reassembled PDU]"
1,5.613303000000087,10.0.2.15,54.93.77.70,TCP,54,34692  >  9001 [ACK] Seq=10387449 Ack=188706641 Win=65535 Len=0
1,5.627480999999534,54.93.77.70,10.0.2.15,TLSv1.2,5846,"Application Data, Application Data, Application Data"
1,5.627526999999645,10.0.2.15,54.93.77.70,TCP,54,34692  >  9001 [ACK] Seq=10387449 Ack=188712433 Win=65535 Len=0
1,5.628015000000232,54.93.77.70,10.0.2.15,TLSv1.2,2950,Application Data [TCP segment of a reassembled PDU]
1,5.628056999999899,10.0.2.15,54.93.77.70,TCP,54,34692  >  9001 [ACK] Seq=10387449 Ack=188715329 Win=65535 Len=0
1,5.629324999999881,54.93.77.70,10.0.2.15,TLSv1.2,5586,"Application Data, Application Data, Application Data"
1,5.629366000000118,10.0.2.15,54.93.77.70,TCP,54,34692  >  9001 [ACK] Seq=10387449 Ack=188720861 Win=65535 Len=0
1,5.629519999999502,10.0.2.15,54.93.77.70,TLSv1.2,590,Application Data
1,5.629605000000083,54.93.77.70,10.0.2.15,TCP,60,9001  >  34692 [ACK] Seq=188720861 Ack=10387985 Win=65535 Len=0
1,5.635917999999947,54.93.77.70,10.0.2.15,TLSv1.2,5846,Application Data
1,5.6359599999996135,54.93.77.70,10.0.2.15,TLSv1.2,8742,"Application Data, Application Data"
1,5.636023999999452,10.0.2.15,54.93.77.70,TCP,54,34692  >  9001 [ACK] Seq=10387985 Ack=188726653 Win=65535 Len=0
1,5.636139000000185,10.0.2.15,54.93.77.70,TCP,54,34692  >  9001 [ACK] Seq=10387985 Ack=188735341 Win=65535 Len=0
1,5.639685999999529,10.0.2.15,54.93.77.70,TLSv1.2,590,Application Data
1,5.639814999999544,54.93.77.70,10.0.2.15,TCP,60,9001  >  34692 [ACK] Seq=188735341 Ack=10388521 Win=65535 Len=0
1,5.643865999999434,54.93.77.70,10.0.2.15,TLSv1.2,5846,"Application Data, Application Data"
1,5.6439369999998235,10.0.2.15,54.93.77.70,TCP,54,34692  >  9001 [ACK] Seq=10388521 Ack=188741133 Win=65535 Len=0
1,5.645112000000154,54.93.77.70,10.0.2.15,TLSv1.2,5846,"Application Data, Application Data"
1,5.645158999999694,10.0.2.15,54.93.77.70,TCP,54,34692  >  9001 [ACK] Seq=10388521 Ack=188746925 Win=65535 Len=0
1,5.646514999999454,54.93.77.70,10.0.2.15,TLSv1.2,2972,"Application Data, Application Data"
1,5.646560000000136,10.0.2.15,54.93.77.70,TCP,54,34692  >  9001 [ACK] Seq=10388521 Ack=188749843 Win=65535 Len=0
1,5.6508969999995315,10.0.2.15,54.93.77.70,TLSv1.2,590,Application Data
1,5.651028999999653,54.93.77.70,10.0.2.15,TCP,60,9001  >  34692 [ACK] Seq=188749843 Ack=10389057 Win=65535 Len=0
1,5.690389000000323,10.0.2.15,54.93.77.70,TLSv1.2,590,Application Data
1,5.690593000000263,54.93.77.70,10.0.2.15,TCP,60,9001  >  34692 [ACK] Seq=188749843 Ack=10389593 Win=65535 Len=0
1,5.69979499999954,10.0.2.15,54.93.77.70,TLSv1.2,590,Application Data
1,5.699942999999621,54.93.77.70,10.0.2.15,TCP,60,9001  >  34692 [ACK] Seq=188749843 Ack=10390129 Win=65535 Len=0
1,5.776061999999911,54.93.77.70,10.0.2.15,TLSv1.2,590,Application Data
1,5.776103000000148,62.210.85.178,10.0.2.15,TLSv1.2,1104,Application Data
1,5.816815999999562,10.0.2.15,62.210.85.178,TCP,54,35978  >  9001 [ACK] Seq=188884135 Ack=10343881 Win=65535 Len=0
1,5.816877999999633,10.0.2.15,54.93.77.70,TCP,54,34692  >  9001 [ACK] Seq=10390129 Ack=188750379 Win=65535 Len=0
1,5.917171000000053,62.210.85.178,10.0.2.15,TLSv1.2,590,Application Data
1,5.917261999999937,10.0.2.15,62.210.85.178,TCP,54,35978  >  9001 [ACK] Seq=188884135 Ack=10344417 Win=65535 Len=0
1,5.934615000000122,62.210.85.178,10.0.2.15,TLSv1.2,1104,Application Data
1,5.93467099999998,10.0.2.15,62.210.85.178,TCP,54,35978  >  9001 [ACK] Seq=188884135 Ack=10345467 Win=65535 Len=0
1,5.934951000000183,10.0.2.15,62.210.85.178,TLSv1.2,590,Application Data
1,5.935067999999774,62.210.85.178,10.0.2.15,TCP,60,9001  >  35978 [ACK] Seq=10345467 Ack=188884671 Win=65535 Len=0
1,6.224167000000307,54.93.77.70,10.0.2.15,TLSv1.2,590,Application Data
1,6.224275999999918,10.0.2.15,54.93.77.70,TCP,54,34692  >  9001 [ACK] Seq=10390129 Ack=188750915 Win=65535 Len=0
1,6.224696999999651,10.0.2.15,54.93.77.70,TLSv1.2,590,Application Data
1,6.2248579999995854,54.93.77.70,10.0.2.15,TCP,60,9001  >  34692 [ACK] Seq=188750915 Ack=10390665 Win=65535 Len=0
1,6.410407000000305,62.210.85.178,10.0.2.15,TLSv1.2,590,Application Data
1,6.4166669999995065,10.0.2.15,62.210.85.178,TLSv1.2,590,Application Data
1,6.41683600000033,62.210.85.178,10.0.2.15,TCP,60,9001  >  35978 [ACK] Seq=10346003 Ack=188885207 Win=65535 Len=0
1,6.4292489999998,10.0.2.15,62.210.85.178,TLSv1.2,4124,Application Data
1,6.429341000000022,10.0.2.15,62.210.85.178,TCP,2974,35978  >  9001 [ACK] Seq=188889277 Ack=10346003 Win=65535 Len=2920 [TCP segment of a reassembled PDU]
1,6.429388999999901,62.210.85.178,10.0.2.15,TCP,60,9001  >  35978 [ACK] Seq=10346003 Ack=188886667 Win=65535 Len=0
1,6.429398999999648,62.210.85.178,10.0.2.15,TCP,60,9001  >  35978 [ACK] Seq=10346003 Ack=188888127 Win=65535 Len=0
1,6.429404999999861,62.210.85.178,10.0.2.15,TCP,60,9001  >  35978 [ACK] Seq=10346003 Ack=188889277 Win=65535 Len=0
1,6.429409000000305,62.210.85.178,10.0.2.15,TCP,60,9001  >  35978 [ACK] Seq=10346003 Ack=188890737 Win=65535 Len=0
1,6.429411000000073,62.210.85.178,10.0.2.15,TCP,60,9001  >  35978 [ACK] Seq=10346003 Ack=188892197 Win=65535 Len=0
1,6.429454000000078,10.0.2.15,62.210.85.178,TLSv1.2,1204,Application Data
1,6.429487999999765,62.210.85.178,10.0.2.15,TCP,60,9001  >  35978 [ACK] Seq=10346003 Ack=188893347 Win=65535 Len=0
1,6.429532999999537,10.0.2.15,62.210.85.178,TLSv1.2,4124,Application Data
1,6.429567999999563,62.210.85.178,10.0.2.15,TCP,60,9001  >  35978 [ACK] Seq=10346003 Ack=188894807 Win=65535 Len=0
1,6.4295750000001135,62.210.85.178,10.0.2.15,TCP,60,9001  >  35978 [ACK] Seq=10346003 Ack=188896267 Win=65535 Len=0
1,6.429578999999649,62.210.85.178,10.0.2.15,TCP,60,9001  >  35978 [ACK] Seq=10346003 Ack=188897417 Win=65535 Len=0
1,6.42961699999978,10.0.2.15,62.210.85.178,TLSv1.2,4124,Application Data
1,6.429650000000038,62.210.85.178,10.0.2.15,TCP,60,9001  >  35978 [ACK] Seq=10346003 Ack=188898877 Win=65535 Len=0
1,6.429658000000018,62.210.85.178,10.0.2.15,TCP,60,9001  >  35978 [ACK] Seq=10346003 Ack=188900337 Win=65535 Len=0
1,6.429661999999553,62.210.85.178,10.0.2.15,TCP,60,9001  >  35978 [ACK] Seq=10346003 Ack=188901487 Win=65535 Len=0
1,6.429696000000149,10.0.2.15,62.210.85.178,TLSv1.2,332,Application Data
1,6.429728999999497,62.210.85.178,10.0.2.15,TCP,60,9001  >  35978 [ACK] Seq=10346003 Ack=188901765 Win=65535 Len=0
1,6.429782000000159,10.0.2.15,62.210.85.178,TLSv1.2,3868,Application Data
1,6.429817999999614,62.210.85.178,10.0.2.15,TCP,60,9001  >  35978 [ACK] Seq=10346003 Ack=188903225 Win=65535 Len=0
1,6.429825000000164,62.210.85.178,10.0.2.15,TCP,60,9001  >  35978 [ACK] Seq=10346003 Ack=188904685 Win=65535 Len=0
1,6.4298289999997,62.210.85.178,10.0.2.15,TCP,60,9001  >  35978 [ACK] Seq=10346003 Ack=188905579 Win=65535 Len=0
1,6.429866999999831,10.0.2.15,62.210.85.178,TLSv1.2,4124,Application Data
1,6.429908999999498,62.210.85.178,10.0.2.15,TCP,60,9001  >  35978 [ACK] Seq=10346003 Ack=188907039 Win=65535 Len=0
1,6.42991499999971,62.210.85.178,10.0.2.15,TCP,60,9001  >  35978 [ACK] Seq=10346003 Ack=188908499 Win=65535 Len=0
1,6.429917999999816,62.210.85.178,10.0.2.15,TCP,60,9001  >  35978 [ACK] Seq=10346003 Ack=188909649 Win=65535 Len=0
1,6.429952999999841,10.0.2.15,62.210.85.178,TLSv1.2,3030,Application Data
1,6.430186999999933,62.210.85.178,10.0.2.15,TCP,60,9001  >  35978 [ACK] Seq=10346003 Ack=188911109 Win=65535 Len=0
1,6.4301989999994476,62.210.85.178,10.0.2.15,TCP,60,9001  >  35978 [ACK] Seq=10346003 Ack=188912569 Win=65535 Len=0
1,6.430201999999554,62.210.85.178,10.0.2.15,TCP,60,9001  >  35978 [ACK] Seq=10346003 Ack=188912625 Win=65535 Len=0
1,6.441569999999956,10.0.2.15,62.210.85.178,TLSv1.2,4124,Application Data
1,6.441697000000204,62.210.85.178,10.0.2.15,TCP,60,9001  >  35978 [ACK] Seq=10346003 Ack=188914085 Win=65535 Len=0
1,6.441714999999931,62.210.85.178,10.0.2.15,TCP,60,9001  >  35978 [ACK] Seq=10346003 Ack=188915545 Win=65535 Len=0
1,6.441718000000037,62.210.85.178,10.0.2.15,TCP,60,9001  >  35978 [ACK] Seq=10346003 Ack=188916695 Win=65535 Len=0
1,6.4417539999994915,10.0.2.15,62.210.85.178,TLSv1.2,4124,Application Data
1,6.441799999999603,62.210.85.178,10.0.2.15,TCP,60,9001  >  35978 [ACK] Seq=10346003 Ack=188918155 Win=65535 Len=0
1,6.4418079999995825,62.210.85.178,10.0.2.15,TCP,60,9001  >  35978 [ACK] Seq=10346003 Ack=188919615 Win=65535 Len=0
1,6.441810999999689,62.210.85.178,10.0.2.15,TCP,60,9001  >  35978 [ACK] Seq=10346003 Ack=188920765 Win=65535 Len=0
1,6.44184899999982,10.0.2.15,62.210.85.178,TLSv1.2,4124,Application Data
1,6.441918999999871,62.210.85.178,10.0.2.15,TCP,60,9001  >  35978 [ACK] Seq=10346003 Ack=188922225 Win=65535 Len=0
1,6.441931000000295,62.210.85.178,10.0.2.15,TCP,60,9001  >  35978 [ACK] Seq=10346003 Ack=188923685 Win=65535 Len=0
1,6.441933999999492,62.210.85.178,10.0.2.15,TCP,60,9001  >  35978 [ACK] Seq=10346003 Ack=188924835 Win=65535 Len=0
1,6.441982999999709,10.0.2.15,62.210.85.178,TLSv1.2,4124,Application Data
1,6.442022000000179,62.210.85.178,10.0.2.15,TCP,60,9001  >  35978 [ACK] Seq=10346003 Ack=188926295 Win=65535 Len=0
1,6.44202899999982,62.210.85.178,10.0.2.15,TCP,60,9001  >  35978 [ACK] Seq=10346003 Ack=188927755 Win=65535 Len=0
1,6.442033000000265,62.210.85.178,10.0.2.15,TCP,60,9001  >  35978 [ACK] Seq=10346003 Ack=188928905 Win=65535 Len=0
1,6.442066999999952,10.0.2.15,62.210.85.178,TLSv1.2,332,Application Data
1,6.442100999999639,62.210.85.178,10.0.2.15,TCP,60,9001  >  35978 [ACK] Seq=10346003 Ack=188929183 Win=65535 Len=0
1,6.442156999999497,10.0.2.15,62.210.85.178,TLSv1.2,3868,Application Data
1,6.442285999999513,62.210.85.178,10.0.2.15,TCP,60,9001  >  35978 [ACK] Seq=10346003 Ack=188930643 Win=65535 Len=0
1,6.442296000000169,62.210.85.178,10.0.2.15,TCP,60,9001  >  35978 [ACK] Seq=10346003 Ack=188932103 Win=65535 Len=0
1,6.4422990000002756,62.210.85.178,10.0.2.15,TCP,60,9001  >  35978 [ACK] Seq=10346003 Ack=188932997 Win=65535 Len=0
1,6.442347999999583,10.0.2.15,62.210.85.178,TLSv1.2,4124,Application Data
1,6.442387000000053,62.210.85.178,10.0.2.15,TCP,60,9001  >  35978 [ACK] Seq=10346003 Ack=188934457 Win=65535 Len=0
1,6.442393999999695,62.210.85.178,10.0.2.15,TCP,60,9001  >  35978 [ACK] Seq=10346003 Ack=188935917 Win=65535 Len=0
1,6.442396999999801,62.210.85.178,10.0.2.15,TCP,60,9001  >  35978 [ACK] Seq=10346003 Ack=188937067 Win=65535 Len=0
1,6.442431999999826,10.0.2.15,62.210.85.178,TLSv1.2,3030,Application Data
1,6.442466999999851,62.210.85.178,10.0.2.15,TCP,60,9001  >  35978 [ACK] Seq=10346003 Ack=188938527 Win=65535 Len=0
1,6.442473000000064,62.210.85.178,10.0.2.15,TCP,60,9001  >  35978 [ACK] Seq=10346003 Ack=188939987 Win=65535 Len=0
1,6.44247600000017,62.210.85.178,10.0.2.15,TCP,60,9001  >  35978 [ACK] Seq=10346003 Ack=188940043 Win=65535 Len=0
1,6.4517079999995985,10.0.2.15,62.210.85.178,TLSv1.2,4124,Application Data
1,6.451782999999523,62.210.85.178,10.0.2.15,TCP,60,9001  >  35978 [ACK] Seq=10346003 Ack=188941503 Win=65535 Len=0
1,6.45179300000018,62.210.85.178,10.0.2.15,TCP,60,9001  >  35978 [ACK] Seq=10346003 Ack=188942963 Win=65535 Len=0
1,6.451796999999715,62.210.85.178,10.0.2.15,TCP,60,9001  >  35978 [ACK] Seq=10346003 Ack=188944113 Win=65535 Len=0
1,6.45183999999972,10.0.2.15,62.210.85.178,TLSv1.2,4124,Application Data
1,6.451936999999816,62.210.85.178,10.0.2.15,TCP,60,9001  >  35978 [ACK] Seq=10346003 Ack=188945573 Win=65535 Len=0
1,6.4519439999994574,62.210.85.178,10.0.2.15,TCP,60,9001  >  35978 [ACK] Seq=10346003 Ack=188947033 Win=65535 Len=0
1,6.451947999999902,62.210.85.178,10.0.2.15,TCP,60,9001  >  35978 [ACK] Seq=10346003 Ack=188948183 Win=65535 Len=0
1,6.451984999999695,10.0.2.15,62.210.85.178,TLSv1.2,4124,Application Data
1,6.4520510000002105,62.210.85.178,10.0.2.15,TCP,60,9001  >  35978 [ACK] Seq=10346003 Ack=188949643 Win=65535 Len=0
1,6.45205900000019,62.210.85.178,10.0.2.15,TCP,60,9001  >  35978 [ACK] Seq=10346003 Ack=188951103 Win=65535 Len=0
1,6.452062000000296,62.210.85.178,10.0.2.15,TCP,60,9001  >  35978 [ACK] Seq=10346003 Ack=188952253 Win=65535 Len=0
1,6.452095999999983,10.0.2.15,62.210.85.178,TLSv1.2,4124,Application Data
1,6.4521310000000085,62.210.85.178,10.0.2.15,TCP,60,9001  >  35978 [ACK] Seq=10346003 Ack=188953713 Win=65535 Len=0
1,6.45213799999965,62.210.85.178,10.0.2.15,TCP,60,9001  >  35978 [ACK] Seq=10346003 Ack=188955173 Win=65535 Len=0
1,6.452140999999756,62.210.85.178,10.0.2.15,TCP,60,9001  >  35978 [ACK] Seq=10346003 Ack=188956323 Win=65535 Len=0
1,6.452174999999443,10.0.2.15,62.210.85.178,TLSv1.2,332,Application Data
1,6.452209999999468,62.210.85.178,10.0.2.15,TCP,60,9001  >  35978 [ACK] Seq=10346003 Ack=188956601 Win=65535 Len=0
1,6.45227100000011,10.0.2.15,62.210.85.178,TLSv1.2,3868,Application Data
1,6.45230999999967,62.210.85.178,10.0.2.15,TCP,60,9001  >  35978 [ACK] Seq=10346003 Ack=188958061 Win=65535 Len=0
1,6.452317000000221,62.210.85.178,10.0.2.15,TCP,60,9001  >  35978 [ACK] Seq=10346003 Ack=188959521 Win=65535 Len=0
1,6.452320000000327,62.210.85.178,10.0.2.15,TCP,60,9001  >  35978 [ACK] Seq=10346003 Ack=188960415 Win=65535 Len=0
1,6.4523559999997815,10.0.2.15,62.210.85.178,TLSv1.2,2452,Application Data
1,6.452389000000039,62.210.85.178,10.0.2.15,TCP,60,9001  >  35978 [ACK] Seq=10346003 Ack=188961875 Win=65535 Len=0
1,6.452397000000019,62.210.85.178,10.0.2.15,TCP,60,9001  >  35978 [ACK] Seq=10346003 Ack=188962813 Win=65535 Len=0
1,6.698174999999537,54.93.77.70,10.0.2.15,TLSv1.2,3674,Application Data
1,6.698217000000113,54.93.77.70,10.0.2.15,TLSv1.2,10190,"Application Data, Application Data, Application Data"
1,6.698317000000316,10.0.2.15,54.93.77.70,TCP,54,34692  >  9001 [ACK] Seq=10390665 Ack=188764671 Win=65535 Len=0
1,6.716204999999718,54.93.77.70,10.0.2.15,TLSv1.2,12834,"Application Data, Application Data, Application Data"
1,6.716257000000041,10.0.2.15,54.93.77.70,TCP,54,34692  >  9001 [ACK] Seq=10390665 Ack=188777451 Win=65535 Len=0
1,6.716301999999814,54.93.77.70,10.0.2.15,TLSv1.2,1472,"Application Data, Application Data"
1,6.716623999999683,10.0.2.15,54.93.77.70,TLSv1.2,1104,Application Data
1,6.716703000000052,54.93.77.70,10.0.2.15,TCP,60,9001  >  34692 [ACK] Seq=188778869 Ack=10391715 Win=65535 Len=0
1,6.839876000000004,54.93.77.70,10.0.2.15,TCP,2950,"9001  >  34692 [PSH, ACK] Seq=188778869 Ack=10391715 Win=65535 Len=2896 [TCP segment of a reassembled PDU]"
1,6.839954999999463,10.0.2.15,54.93.77.70,TCP,54,34692  >  9001 [ACK] Seq=10391715 Ack=188781765 Win=65535 Len=0
1,6.845945999999458,54.93.77.70,10.0.2.15,TLSv1.2,5846,"Application Data, Application Data"
1,6.846011999999973,10.0.2.15,54.93.77.70,TCP,54,34692  >  9001 [ACK] Seq=10391715 Ack=188787557 Win=65535 Len=0
1,6.847547000000304,54.93.77.70,10.0.2.15,TLSv1.2,11030,"Application Data, Application Data, Application Data, Application Data"
1,6.847587000000203,54.93.77.70,10.0.2.15,TLSv1.2,11638,"Application Data, Application Data"
1,6.847598000000289,54.93.77.70,10.0.2.15,TLSv1.2,10190,"Application Data, Application Data, Application Data, Application Data"
1,6.847657999999683,10.0.2.15,54.93.77.70,TCP,54,34692  >  9001 [ACK] Seq=10391715 Ack=188820253 Win=65535 Len=0
1,6.848044999999729,10.0.2.15,54.93.77.70,TLSv1.2,590,Application Data
1,6.848120999999992,54.93.77.70,10.0.2.15,TCP,60,9001  >  34692 [ACK] Seq=188820253 Ack=10392251 Win=65535 Len=0
1,6.8578120000001945,54.93.77.70,10.0.2.15,TLSv1.2,2950,Application Data [TCP segment of a reassembled PDU]
1,6.858134999999493,10.0.2.15,54.93.77.70,TCP,54,34692  >  9001 [ACK] Seq=10392251 Ack=188823149 Win=65535 Len=0
1,6.865176999999676,54.93.77.70,10.0.2.15,TLSv1.2,3370,Application Data
1,6.865334999999504,10.0.2.15,54.93.77.70,TCP,54,34692  >  9001 [ACK] Seq=10392251 Ack=188826465 Win=65535 Len=0
1,6.870020000000295,54.93.77.70,10.0.2.15,TCP,1502,"9001  >  34692 [PSH, ACK] Seq=188826465 Ack=10392251 Win=65535 Len=1448 [TCP segment of a reassembled PDU]"
1,6.870100000000093,10.0.2.15,54.93.77.70,TCP,54,34692  >  9001 [ACK] Seq=10392251 Ack=188827913 Win=65535 Len=0
1,6.881204999999682,54.93.77.70,10.0.2.15,TLSv1.2,1198,Application Data
1,6.881397999999535,10.0.2.15,54.93.77.70,TLSv1.2,1104,Application Data
1,6.881492999999864,54.93.77.70,10.0.2.15,TCP,60,9001  >  34692 [ACK] Seq=188829057 Ack=10393301 Win=65535 Len=0
1,6.891236999999819,10.0.2.15,54.93.77.70,TLSv1.2,590,Application Data
1,6.891388000000006,54.93.77.70,10.0.2.15,TCP,60,9001  >  34692 [ACK] Seq=188829057 Ack=10393837 Win=65535 Len=0
1,7.0023309999996854,62.210.85.178,10.0.2.15,TLSv1.2,1104,Application Data
1,7.044788999999582,10.0.2.15,62.210.85.178,TCP,54,35978  >  9001 [ACK] Seq=188962813 Ack=10347053 Win=65535 Len=0
1,7.144643999999971,62.210.85.178,10.0.2.15,TLSv1.2,1502,Application Data
1,7.144729999999981,10.0.2.15,62.210.85.178,TCP,54,35978  >  9001 [ACK] Seq=188962813 Ack=10348501 Win=65535 Len=0
1,7.163320999999996,62.210.85.178,10.0.2.15,TLSv1.2,192,Application Data
1,7.163413999999648,10.0.2.15,62.210.85.178,TCP,54,35978  >  9001 [ACK] Seq=188962813 Ack=10348639 Win=65535 Len=0
1,7.180188000000271,62.210.85.178,10.0.2.15,TLSv1.2,590,Application Data
1,7.180264999999963,10.0.2.15,62.210.85.178,TCP,54,35978  >  9001 [ACK] Seq=188962813 Ack=10349175 Win=65535 Len=0
1,7.180777999999918,10.0.2.15,62.210.85.178,TLSv1.2,590,Application Data
1,7.181012999999439,62.210.85.178,10.0.2.15,TCP,60,9001  >  35978 [ACK] Seq=10349175 Ack=188963349 Win=65535 Len=0
1,7.3114269999996395,54.93.77.70,10.0.2.15,TLSv1.2,590,Application Data
1,7.311858999999458,10.0.2.15,54.93.77.70,TLSv1.2,590,Application Data
1,7.311996999999792,54.93.77.70,10.0.2.15,TCP,60,9001  >  34692 [ACK] Seq=188829593 Ack=10394373 Win=65535 Len=0
1,7.463877999999568,62.210.85.178,10.0.2.15,TLSv1.2,590,Application Data
1,7.469248999999763,10.0.2.15,62.210.85.178,TLSv1.2,590,Application Data
1,7.469444000000294,62.210.85.178,10.0.2.15,TCP,60,9001  >  35978 [ACK] Seq=10349711 Ack=188963885 Win=65535 Len=0
1,7.481912000000193,10.0.2.15,62.210.85.178,TLSv1.2,4124,Application Data
1,7.482034999999996,10.0.2.15,62.210.85.178,TCP,2974,35978  >  9001 [ACK] Seq=188967955 Ack=10349711 Win=65535 Len=2920 [TCP segment of a reassembled PDU]
1,7.482078000000001,62.210.85.178,10.0.2.15,TCP,60,9001  >  35978 [ACK] Seq=10349711 Ack=188965345 Win=65535 Len=0
1,7.482087999999749,62.210.85.178,10.0.2.15,TCP,60,9001  >  35978 [ACK] Seq=10349711 Ack=188966805 Win=65535 Len=0
1,7.482092999999622,62.210.85.178,10.0.2.15,TCP,60,9001  >  35978 [ACK] Seq=10349711 Ack=188967955 Win=65535 Len=0
1,7.482097999999496,62.210.85.178,10.0.2.15,TCP,60,9001  >  35978 [ACK] Seq=10349711 Ack=188969415 Win=65535 Len=0
1,7.482101999999941,62.210.85.178,10.0.2.15,TCP,60,9001  >  35978 [ACK] Seq=10349711 Ack=188970875 Win=65535 Len=0
1,7.482144999999946,10.0.2.15,62.210.85.178,TLSv1.2,1204,Application Data
1,7.482213000000229,10.0.2.15,62.210.85.178,TCP,2974,35978  >  9001 [ACK] Seq=188972025 Ack=10349711 Win=65535 Len=2920 [TCP segment of a reassembled PDU]
1,7.482250999999451,62.210.85.178,10.0.2.15,TCP,60,9001  >  35978 [ACK] Seq=10349711 Ack=188972025 Win=65535 Len=0
1,7.482258000000002,62.210.85.178,10.0.2.15,TCP,60,9001  >  35978 [ACK] Seq=10349711 Ack=188973485 Win=65535 Len=0
1,7.482262999999875,62.210.85.178,10.0.2.15,TCP,60,9001  >  35978 [ACK] Seq=10349711 Ack=188974945 Win=65535 Len=0
1,7.482296999999562,10.0.2.15,62.210.85.178,TLSv1.2,1204,Application Data
1,7.4823859999996785,10.0.2.15,62.210.85.178,TCP,2974,35978  >  9001 [ACK] Seq=188976095 Ack=10349711 Win=65535 Len=2920 [TCP segment of a reassembled PDU]
1,7.48240799999985,62.210.85.178,10.0.2.15,TCP,60,9001  >  35978 [ACK] Seq=10349711 Ack=188976095 Win=65535 Len=0
1,7.4824399999997695,10.0.2.15,62.210.85.178,TLSv1.2,1204,Application Data
1,7.482474999999795,62.210.85.178,10.0.2.15,TCP,60,9001  >  35978 [ACK] Seq=10349711 Ack=188977555 Win=65535 Len=0
1,7.482481999999436,62.210.85.178,10.0.2.15,TCP,60,9001  >  35978 [ACK] Seq=10349711 Ack=188979015 Win=65535 Len=0
1,7.482485999999881,62.210.85.178,10.0.2.15,TCP,60,9001  >  35978 [ACK] Seq=10349711 Ack=188980165 Win=65535 Len=0
1,7.482527999999547,10.0.2.15,62.210.85.178,TLSv1.2,332,Application Data
1,7.482616999999664,10.0.2.15,62.210.85.178,TCP,2974,35978  >  9001 [ACK] Seq=188980443 Ack=10349711 Win=65535 Len=2920 [TCP segment of a reassembled PDU]
1,7.482640000000174,62.210.85.178,10.0.2.15,TCP,60,9001  >  35978 [ACK] Seq=10349711 Ack=188980443 Win=65535 Len=0
1,7.482648000000154,62.210.85.178,10.0.2.15,TCP,60,9001  >  35978 [ACK] Seq=10349711 Ack=188981903 Win=65535 Len=0
1,7.482651999999689,62.210.85.178,10.0.2.15,TCP,60,9001  >  35978 [ACK] Seq=10349711 Ack=188983363 Win=65535 Len=0
1,7.482683999999608,10.0.2.15,62.210.85.178,TLSv1.2,948,Application Data
1,7.482721000000311,62.210.85.178,10.0.2.15,TCP,60,9001  >  35978 [ACK] Seq=10349711 Ack=188984257 Win=65535 Len=0
1,7.482767999999851,10.0.2.15,62.210.85.178,TLSv1.2,1938,Application Data
1,7.48280799999975,62.210.85.178,10.0.2.15,TCP,60,9001  >  35978 [ACK] Seq=10349711 Ack=188985717 Win=65535 Len=0
1,7.482813999999962,62.210.85.178,10.0.2.15,TCP,60,9001  >  35978 [ACK] Seq=10349711 Ack=188986141 Win=65535 Len=0
1,7.604809999999816,54.93.77.70,10.0.2.15,TLSv1.2,3674,Application Data
1,7.604951000000256,10.0.2.15,54.93.77.70,TCP,54,34692  >  9001 [ACK] Seq=10394373 Ack=188833213 Win=65535 Len=0
1,7.623453000000154,54.93.77.70,10.0.2.15,TLSv1.2,4398,Application Data
1,7.623515000000225,10.0.2.15,54.93.77.70,TCP,54,34692  >  9001 [ACK] Seq=10394373 Ack=188837557 Win=65535 Len=0
1,7.623974999999518,54.93.77.70,10.0.2.15,TLSv1.2,2950,Application Data
1,7.624021999999968,10.0.2.15,54.93.77.70,TCP,54,34692  >  9001 [ACK] Seq=10394373 Ack=188840453 Win=65535 Len=0
1,7.747820999999931,54.93.77.70,10.0.2.15,TLSv1.2,5122,Application Data
1,7.747943000000305,10.0.2.15,54.93.77.70,TCP,54,34692  >  9001 [ACK] Seq=10394373 Ack=188845521 Win=65535 Len=0
1,7.749036999999589,54.93.77.70,10.0.2.15,TLSv1.2,1220,"Application Data, Application Data"
1,7.792813999999453,10.0.2.15,54.93.77.70,TCP,54,34692  >  9001 [ACK] Seq=10394373 Ack=188846687 Win=65535 Len=0
1,7.923681000000215,54.93.77.70,10.0.2.15,TCP,2950,"9001  >  34692 [PSH, ACK] Seq=188846687 Ack=10394373 Win=65535 Len=2896 [TCP segment of a reassembled PDU]"
1,7.923757999999907,10.0.2.15,54.93.77.70,TCP,54,34692  >  9001 [ACK] Seq=10394373 Ack=188849583 Win=65535 Len=0
1,7.92575399999987,54.93.77.70,10.0.2.15,TLSv1.2,778,Application Data
1,7.925801999999749,10.0.2.15,54.93.77.70,TCP,54,34692  >  9001 [ACK] Seq=10394373 Ack=188850307 Win=65535 Len=0
1,7.926507000000129,54.93.77.70,10.0.2.15,TCP,1502,"9001  >  34692 [PSH, ACK] Seq=188850307 Ack=10394373 Win=65535 Len=1448 [TCP segment of a reassembled PDU]"
1,7.926550999999563,10.0.2.15,54.93.77.70,TCP,54,34692  >  9001 [ACK] Seq=10394373 Ack=188851755 Win=65535 Len=0
1,7.940977000000203,54.93.77.70,10.0.2.15,TLSv1.2,684,Application Data
1,7.9410259999995105,10.0.2.15,54.93.77.70,TCP,54,34692  >  9001 [ACK] Seq=10394373 Ack=188852385 Win=65535 Len=0
1,7.943344000000252,10.0.2.15,54.93.77.70,TLSv1.2,590,Application Data
1,7.943486000000121,54.93.77.70,10.0.2.15,TCP,60,9001  >  34692 [ACK] Seq=188852385 Ack=10394909 Win=65535 Len=0
1,8.069392000000335,62.210.85.178,10.0.2.15,TLSv1.2,590,Application Data
1,8.06992799999989,10.0.2.15,62.210.85.178,TLSv1.2,590,Application Data
1,8.070071999999527,62.210.85.178,10.0.2.15,TCP,60,9001  >  35978 [ACK] Seq=10350247 Ack=188986677 Win=65535 Len=0
1,8.2299009999997,54.93.77.70,10.0.2.15,TLSv1.2,590,Application Data
1,8.230340999999498,10.0.2.15,54.93.77.70,TLSv1.2,590,Application Data
1,8.230475999999726,54.93.77.70,10.0.2.15,TCP,60,9001  >  34692 [ACK] Seq=188852921 Ack=10395445 Win=65535 Len=0
1,8.416720999999598,62.210.85.178,10.0.2.15,TLSv1.2,590,Application Data
1,8.423275000000103,10.0.2.15,62.210.85.178,TLSv1.2,590,Application Data
1,8.423483999999917,62.210.85.178,10.0.2.15,TCP,60,9001  >  35978 [ACK] Seq=10350783 Ack=188987213 Win=65535 Len=0
1,8.436883999999736,10.0.2.15,62.210.85.178,TLSv1.2,4124,Application Data
1,8.436993000000257,10.0.2.15,62.210.85.178,TCP,2974,35978  >  9001 [ACK] Seq=188991283 Ack=10350783 Win=65535 Len=2920 [TCP segment of a reassembled PDU]
1,8.437036000000262,62.210.85.178,10.0.2.15,TCP,60,9001  >  35978 [ACK] Seq=10350783 Ack=188988673 Win=65535 Len=0
1,8.437046999999438,62.210.85.178,10.0.2.15,TCP,60,9001  >  35978 [ACK] Seq=10350783 Ack=188990133 Win=65535 Len=0
1,8.437050999999883,62.210.85.178,10.0.2.15,TCP,60,9001  >  35978 [ACK] Seq=10350783 Ack=188991283 Win=65535 Len=0
1,8.437055999999757,62.210.85.178,10.0.2.15,TCP,60,9001  >  35978 [ACK] Seq=10350783 Ack=188992743 Win=65535 Len=0
1,8.437060000000201,62.210.85.178,10.0.2.15,TCP,60,9001  >  35978 [ACK] Seq=10350783 Ack=188994203 Win=65535 Len=0
1,8.437101999999868,10.0.2.15,62.210.85.178,TLSv1.2,1204,Application Data
1,8.43717099999958,10.0.2.15,62.210.85.178,TCP,2974,35978  >  9001 [ACK] Seq=188995353 Ack=10350783 Win=65535 Len=2920 [TCP segment of a reassembled PDU]
1,8.437210999999479,62.210.85.178,10.0.2.15,TCP,60,9001  >  35978 [ACK] Seq=10350783 Ack=188995353 Win=65535 Len=0
1,8.43721800000003,62.210.85.178,10.0.2.15,TCP,60,9001  >  35978 [ACK] Seq=10350783 Ack=188996813 Win=65535 Len=0
1,8.437222999999904,62.210.85.178,10.0.2.15,TCP,60,9001  >  35978 [ACK] Seq=10350783 Ack=188998273 Win=65535 Len=0
1,8.43725699999959,10.0.2.15,62.210.85.178,TLSv1.2,1204,Application Data
1,8.437321999999767,10.0.2.15,62.210.85.178,TCP,2974,35978  >  9001 [ACK] Seq=188999423 Ack=10350783 Win=65535 Len=2920 [TCP segment of a reassembled PDU]
1,8.437361000000237,62.210.85.178,10.0.2.15,TCP,60,9001  >  35978 [ACK] Seq=10350783 Ack=188999423 Win=65535 Len=0
1,8.43736699999954,62.210.85.178,10.0.2.15,TCP,60,9001  >  35978 [ACK] Seq=10350783 Ack=189000883 Win=65535 Len=0
1,8.437372000000323,62.210.85.178,10.0.2.15,TCP,60,9001  >  35978 [ACK] Seq=10350783 Ack=189002343 Win=65535 Len=0
1,8.437402999999904,10.0.2.15,62.210.85.178,TLSv1.2,1204,Application Data
1,8.43749200000002,62.210.85.178,10.0.2.15,TCP,60,9001  >  35978 [ACK] Seq=10350783 Ack=189003493 Win=65535 Len=0
1,8.437527000000046,10.0.2.15,62.210.85.178,TLSv1.2,332,Application Data
1,8.437563999999838,62.210.85.178,10.0.2.15,TCP,60,9001  >  35978 [ACK] Seq=10350783 Ack=189003771 Win=65535 Len=0
1,8.437598999999864,10.0.2.15,62.210.85.178,TLSv1.2,3868,Application Data
1,8.437636999999995,62.210.85.178,10.0.2.15,TCP,60,9001  >  35978 [ACK] Seq=10350783 Ack=189005231 Win=65535 Len=0
1,8.437643999999636,62.210.85.178,10.0.2.15,TCP,60,9001  >  35978 [ACK] Seq=10350783 Ack=189006691 Win=65535 Len=0
1,8.437648000000081,62.210.85.178,10.0.2.15,TCP,60,9001  >  35978 [ACK] Seq=10350783 Ack=189007585 Win=65535 Len=0
1,8.437694999999621,10.0.2.15,62.210.85.178,TLSv1.2,4124,Application Data
1,8.437735999999859,62.210.85.178,10.0.2.15,TCP,60,9001  >  35978 [ACK] Seq=10350783 Ack=189009045 Win=65535 Len=0
1,8.437742000000071,62.210.85.178,10.0.2.15,TCP,60,9001  >  35978 [ACK] Seq=10350783 Ack=189010505 Win=65535 Len=0
1,8.437746999999945,62.210.85.178,10.0.2.15,TCP,60,9001  >  35978 [ACK] Seq=10350783 Ack=189011655 Win=65535 Len=0
1,8.437791000000288,10.0.2.15,62.210.85.178,TLSv1.2,3030,Application Data
1,8.437885999999708,62.210.85.178,10.0.2.15,TCP,60,9001  >  35978 [ACK] Seq=10350783 Ack=189013115 Win=65535 Len=0
1,8.4378999999999,62.210.85.178,10.0.2.15,TCP,60,9001  >  35978 [ACK] Seq=10350783 Ack=189014575 Win=65535 Len=0
1,8.437903999999435,62.210.85.178,10.0.2.15,TCP,60,9001  >  35978 [ACK] Seq=10350783 Ack=189014631 Win=65535 Len=0
1,8.446985999999924,10.0.2.15,62.210.85.178,TLSv1.2,4124,Application Data
1,8.447062999999616,10.0.2.15,62.210.85.178,TCP,2974,35978  >  9001 [ACK] Seq=189018701 Ack=10350783 Win=65535 Len=2920 [TCP segment of a reassembled PDU]
1,8.44709899999998,62.210.85.178,10.0.2.15,TCP,60,9001  >  35978 [ACK] Seq=10350783 Ack=189016091 Win=65535 Len=0
1,8.447105999999621,62.210.85.178,10.0.2.15,TCP,60,9001  >  35978 [ACK] Seq=10350783 Ack=189017551 Win=65535 Len=0
1,8.447110999999495,62.210.85.178,10.0.2.15,TCP,60,9001  >  35978 [ACK] Seq=10350783 Ack=189018701 Win=65535 Len=0
1,8.44711499999994,62.210.85.178,10.0.2.15,TCP,60,9001  >  35978 [ACK] Seq=10350783 Ack=189020161 Win=65535 Len=0
1,8.447118999999475,62.210.85.178,10.0.2.15,TCP,60,9001  >  35978 [ACK] Seq=10350783 Ack=189021621 Win=65535 Len=0
1,8.447157999999945,10.0.2.15,62.210.85.178,TLSv1.2,1204,Application Data
1,8.447223000000122,10.0.2.15,62.210.85.178,TCP,1514,35978  >  9001 [ACK] Seq=189022771 Ack=10350783 Win=65535 Len=1460 [TCP segment of a reassembled PDU]
1,8.447258000000147,62.210.85.178,10.0.2.15,TCP,60,9001  >  35978 [ACK] Seq=10350783 Ack=189022771 Win=65535 Len=0
1,8.447264999999788,62.210.85.178,10.0.2.15,TCP,60,9001  >  35978 [ACK] Seq=10350783 Ack=189024231 Win=65535 Len=0
1,8.447298000000046,10.0.2.15,62.210.85.178,TLSv1.2,1314,Application Data
1,8.447387000000163,62.210.85.178,10.0.2.15,TCP,60,9001  >  35978 [ACK] Seq=10350783 Ack=189025491 Win=65535 Len=0
1,8.684244999999464,54.93.77.70,10.0.2.15,TLSv1.2,3674,Application Data
1,8.684408000000076,10.0.2.15,54.93.77.70,TCP,54,34692  >  9001 [ACK] Seq=10395445 Ack=188856541 Win=65535 Len=0
1,8.685537000000295,54.93.77.70,10.0.2.15,TCP,2950,"9001  >  34692 [PSH, ACK] Seq=188856541 Ack=10395445 Win=65535 Len=2896 [TCP segment of a reassembled PDU]"
1,8.68561099999988,10.0.2.15,54.93.77.70,TCP,54,34692  >  9001 [ACK] Seq=10395445 Ack=188859437 Win=65535 Len=0
1,8.69546100000025,54.93.77.70,10.0.2.15,TLSv1.2,2950,Application Data [TCP segment of a reassembled PDU]
1,8.695534999999836,10.0.2.15,54.93.77.70,TCP,54,34692  >  9001 [ACK] Seq=10395445 Ack=188862333 Win=65535 Len=0
1,8.695708000000195,54.93.77.70,10.0.2.15,TCP,1502,"9001  >  34692 [PSH, ACK] Seq=188862333 Ack=10395445 Win=65535 Len=1448 [TCP segment of a reassembled PDU]"
1,8.695799000000079,10.0.2.15,54.93.77.70,TCP,54,34692  >  9001 [ACK] Seq=10395445 Ack=188863781 Win=65535 Len=0
1,8.699969999999666,54.93.77.70,10.0.2.15,TLSv1.2,590,"Application Data, Application Data"
1,8.701438000000053,54.93.77.70,10.0.2.15,TCP,2950,"9001  >  34692 [PSH, ACK] Seq=188864317 Ack=10395445 Win=65535 Len=2896 [TCP segment of a reassembled PDU]"
1,8.70147999999972,10.0.2.15,54.93.77.70,TCP,54,34692  >  9001 [ACK] Seq=10395445 Ack=188867213 Win=65535 Len=0
1,8.702202999999827,54.93.77.70,10.0.2.15,TLSv1.2,2950,Application Data [TCP segment of a reassembled PDU]
1,8.702242999999726,10.0.2.15,54.93.77.70,TCP,54,34692  >  9001 [ACK] Seq=10395445 Ack=188870109 Win=65535 Len=0
1,8.717923000000155,54.93.77.70,10.0.2.15,TLSv1.2,988,Application Data
1,8.726284999999734,54.93.77.70,10.0.2.15,TCP,1502,"9001  >  34692 [PSH, ACK] Seq=188871043 Ack=10395445 Win=65535 Len=1448 [TCP segment of a reassembled PDU]"
1,8.726333999999952,10.0.2.15,54.93.77.70,TCP,54,34692  >  9001 [ACK] Seq=10395445 Ack=188872491 Win=65535 Len=0
1,8.73369300000013,54.93.77.70,10.0.2.15,TLSv1.2,684,Application Data
1,8.776842999999644,10.0.2.15,54.93.77.70,TCP,54,34692  >  9001 [ACK] Seq=10395445 Ack=188873121 Win=65535 Len=0
1,8.77998000000025,54.93.77.70,10.0.2.15,TLSv1.2,7294,"Application Data, Application Data"
1,8.780036999999538,10.0.2.15,54.93.77.70,TCP,54,34692  >  9001 [ACK] Seq=10395445 Ack=188880361 Win=65535 Len=0
1,8.78035699999964,10.0.2.15,54.93.77.70,TLSv1.2,590,Application Data
1,8.780436999999438,54.93.77.70,10.0.2.15,TCP,60,9001  >  34692 [ACK] Seq=188880361 Ack=10395981 Win=65535 Len=0
1,8.808501999999862,54.93.77.70,10.0.2.15,TLSv1.2,3674,Application Data
1,8.80857399999968,10.0.2.15,54.93.77.70,TCP,54,34692  >  9001 [ACK] Seq=10395981 Ack=188883981 Win=65535 Len=0
1,8.80871500000012,10.0.2.15,54.93.77.70,TLSv1.2,590,Application Data
1,8.808782000000065,54.93.77.70,10.0.2.15,TCP,60,9001  >  34692 [ACK] Seq=188883981 Ack=10396517 Win=65535 Len=0
1,8.818637000000308,54.93.77.70,10.0.2.15,TCP,2950,"9001  >  34692 [PSH, ACK] Seq=188883981 Ack=10396517 Win=65535 Len=2896 [TCP segment of a reassembled PDU]"
1,8.818701999999575,10.0.2.15,54.93.77.70,TCP,54,34692  >  9001 [ACK] Seq=10396517 Ack=188886877 Win=65535 Len=0
1,8.824751999999535,54.93.77.70,10.0.2.15,TLSv1.2,1314,"Application Data, Application Data"
1,8.840194999999767,54.93.77.70,10.0.2.15,TCP,2950,"9001  >  34692 [PSH, ACK] Seq=188888137 Ack=10396517 Win=65535 Len=2896 [TCP segment of a reassembled PDU]"
1,8.840304000000287,10.0.2.15,54.93.77.70,TCP,54,34692  >  9001 [ACK] Seq=10396517 Ack=188891033 Win=65535 Len=0
1,8.85656999999992,54.93.77.70,10.0.2.15,TLSv1.2,778,Application Data
