No.,Time,Source,Destination,Protocol,Length,Info
1,0.07380099999954837,62.210.85.178,10.0.2.15,TLSv1.2,590,Application Data
1,0.1188879999999699,10.0.2.15,62.210.85.178,TCP,54,35978  >  9001 [ACK] Seq=188227947 Ack=10310913 Win=65535 Len=0
1,0.17257100000006176,10.0.2.15,54.93.77.70,TLSv1.2,590,Application Data
1,0.1727499999997235,54.93.77.70,10.0.2.15,TCP,60,9001  >  34692 [ACK] Seq=188094015 Ack=10356537 Win=65535 Len=0
1,0.18538399999943067,62.210.85.178,10.0.2.15,TLSv1.2,590,Application Data
1,0.18543299999964802,10.0.2.15,62.210.85.178,TCP,54,35978  >  9001 [ACK] Seq=188227947 Ack=10311449 Win=65535 Len=0
1,0.6024469999993016,62.210.85.178,10.0.2.15,TLSv1.2,590,Application Data
1,0.6025229999995645,10.0.2.15,62.210.85.178,TCP,54,35978  >  9001 [ACK] Seq=188227947 Ack=10311985 Win=65535 Len=0
1,0.6028319999995801,10.0.2.15,62.210.85.178,TLSv1.2,590,Application Data
1,0.6029249999992317,62.210.85.178,10.0.2.15,TCP,60,9001  >  35978 [ACK] Seq=10311985 Ack=188228483 Win=65535 Len=0
1,0.8067399999999907,54.93.77.70,10.0.2.15,TLSv1.2,590,Application Data
1,0.807145999999193,10.0.2.15,54.93.77.70,TLSv1.2,1618,Application Data
1,0.8072799999999916,54.93.77.70,10.0.2.15,TCP,60,9001  >  34692 [ACK] Seq=188094551 Ack=10358101 Win=65535 Len=0
1,0.9258859999999913,62.210.85.178,10.0.2.15,TLSv1.2,1618,Application Data
1,0.9260299999996278,10.0.2.15,62.210.85.178,TCP,54,35978  >  9001 [ACK] Seq=188228483 Ack=10313549 Win=65535 Len=0
1,0.9479509999991933,10.0.2.15,62.210.85.178,TLSv1.2,590,Application Data
1,0.9481339999992997,62.210.85.178,10.0.2.15,TCP,60,9001  >  35978 [ACK] Seq=10313549 Ack=188229019 Win=65535 Len=0
1,0.9628139999995255,10.0.2.15,62.210.85.178,TLSv1.2,1618,Application Data
1,0.9630079999997179,62.210.85.178,10.0.2.15,TCP,60,9001  >  35978 [ACK] Seq=10313549 Ack=188230479 Win=65535 Len=0
1,0.9630299999998897,62.210.85.178,10.0.2.15,TCP,60,9001  >  35978 [ACK] Seq=10313549 Ack=188230583 Win=65535 Len=0
1,1.0739819999998872,54.93.77.70,10.0.2.15,TLSv1.2,590,Application Data
1,1.1049370000000636,54.93.77.70,10.0.2.15,TCP,1502,"9001  >  34692 [PSH, ACK] Seq=188095087 Ack=10358101 Win=65535 Len=1448 [TCP segment of a reassembled PDU]"
1,1.1049949999996898,10.0.2.15,54.93.77.70,TCP,54,34692  >  9001 [ACK] Seq=10358101 Ack=188096535 Win=65535 Len=0
1,1.120521999999255,54.93.77.70,10.0.2.15,TLSv1.2,170,Application Data
1,1.1224990000000616,10.0.2.15,54.93.77.70,TLSv1.2,590,Application Data
1,1.1226499999993393,54.93.77.70,10.0.2.15,TCP,60,9001  >  34692 [ACK] Seq=188096651 Ack=10358637 Win=65535 Len=0
1,1.229548999999679,62.210.85.178,10.0.2.15,TLSv1.2,590,Application Data
1,1.2298510000000533,10.0.2.15,62.210.85.178,TLSv1.2,590,Application Data
1,1.2299579999998969,62.210.85.178,10.0.2.15,TCP,60,9001  >  35978 [ACK] Seq=10314085 Ack=188231119 Win=65535 Len=0
1,1.8312999999998283,54.93.77.70,10.0.2.15,TLSv1.2,590,Application Data
1,1.8316729999996824,10.0.2.15,54.93.77.70,TLSv1.2,590,Application Data
1,1.8317779999997583,54.93.77.70,10.0.2.15,TCP,60,9001  >  34692 [ACK] Seq=188097187 Ack=10359173 Win=65535 Len=0
1,2.447773999999299,62.210.85.178,10.0.2.15,TLSv1.2,590,Application Data
1,2.4556889999994382,10.0.2.15,62.210.85.178,TLSv1.2,590,Application Data
1,2.455972999999176,62.210.85.178,10.0.2.15,TCP,60,9001  >  35978 [ACK] Seq=10314621 Ack=188231655 Win=65535 Len=0
1,2.4711149999993722,10.0.2.15,62.210.85.178,TLSv1.2,4124,Application Data
1,2.4712859999999637,10.0.2.15,62.210.85.178,TCP,2974,35978  >  9001 [ACK] Seq=188235725 Ack=10314621 Win=65535 Len=2920 [TCP segment of a reassembled PDU]
1,2.4714109999995344,62.210.85.178,10.0.2.15,TCP,60,9001  >  35978 [ACK] Seq=10314621 Ack=188233115 Win=65535 Len=0
1,2.4714249999997264,62.210.85.178,10.0.2.15,TCP,60,9001  >  35978 [ACK] Seq=10314621 Ack=188234575 Win=65535 Len=0
1,2.4714299999996,62.210.85.178,10.0.2.15,TCP,60,9001  >  35978 [ACK] Seq=10314621 Ack=188235725 Win=65535 Len=0
1,2.4714340000000448,62.210.85.178,10.0.2.15,TCP,60,9001  >  35978 [ACK] Seq=10314621 Ack=188237185 Win=65535 Len=0
1,2.47143799999958,62.210.85.178,10.0.2.15,TCP,60,9001  >  35978 [ACK] Seq=10314621 Ack=188238645 Win=65535 Len=0
1,2.4714859999994587,10.0.2.15,62.210.85.178,TLSv1.2,1204,Application Data
1,2.4715659999992567,10.0.2.15,62.210.85.178,TCP,2974,35978  >  9001 [ACK] Seq=188239795 Ack=10314621 Win=65535 Len=2920 [TCP segment of a reassembled PDU]
1,2.471607999999833,62.210.85.178,10.0.2.15,TCP,60,9001  >  35978 [ACK] Seq=10314621 Ack=188239795 Win=65535 Len=0
1,2.4716169999992417,62.210.85.178,10.0.2.15,TCP,60,9001  >  35978 [ACK] Seq=10314621 Ack=188241255 Win=65535 Len=0
1,2.471622000000025,62.210.85.178,10.0.2.15,TCP,60,9001  >  35978 [ACK] Seq=10314621 Ack=188242715 Win=65535 Len=0
1,2.4716589999998178,10.0.2.15,62.210.85.178,TLSv1.2,1204,Application Data
1,2.4717299999992974,10.0.2.15,62.210.85.178,TCP,2974,35978  >  9001 [ACK] Seq=188243865 Ack=10314621 Win=65535 Len=2920 [TCP segment of a reassembled PDU]
1,2.4717689999997674,62.210.85.178,10.0.2.15,TCP,60,9001  >  35978 [ACK] Seq=10314621 Ack=188243865 Win=65535 Len=0
1,2.4717759999994087,62.210.85.178,10.0.2.15,TCP,60,9001  >  35978 [ACK] Seq=10314621 Ack=188245325 Win=65535 Len=0
1,2.4717799999998533,62.210.85.178,10.0.2.15,TCP,60,9001  >  35978 [ACK] Seq=10314621 Ack=188246785 Win=65535 Len=0
1,2.4718129999992016,10.0.2.15,62.210.85.178,TLSv1.2,1204,Application Data
1,2.471898999999212,62.210.85.178,10.0.2.15,TCP,60,9001  >  35978 [ACK] Seq=10314621 Ack=188247935 Win=65535 Len=0
1,2.4719349999995757,10.0.2.15,62.210.85.178,TLSv1.2,332,Application Data
1,2.4719709999999395,62.210.85.178,10.0.2.15,TCP,60,9001  >  35978 [ACK] Seq=10314621 Ack=188248213 Win=65535 Len=0
1,2.47204099999999,10.0.2.15,62.210.85.178,TLSv1.2,3868,Application Data
1,2.4721129999998084,62.210.85.178,10.0.2.15,TCP,60,9001  >  35978 [ACK] Seq=10314621 Ack=188249673 Win=65535 Len=0
1,2.472120999999788,62.210.85.178,10.0.2.15,TCP,60,9001  >  35978 [ACK] Seq=10314621 Ack=188251133 Win=65535 Len=0
1,2.4721249999993233,62.210.85.178,10.0.2.15,TCP,60,9001  >  35978 [ACK] Seq=10314621 Ack=188252027 Win=65535 Len=0
1,2.472165999999561,10.0.2.15,62.210.85.178,TLSv1.2,4124,Application Data
1,2.472231999999167,62.210.85.178,10.0.2.15,TCP,60,9001  >  35978 [ACK] Seq=10314621 Ack=188253487 Win=65535 Len=0
1,2.4722389999997176,62.210.85.178,10.0.2.15,TCP,60,9001  >  35978 [ACK] Seq=10314621 Ack=188254947 Win=65535 Len=0
1,2.4722439999995913,62.210.85.178,10.0.2.15,TCP,60,9001  >  35978 [ACK] Seq=10314621 Ack=188256097 Win=65535 Len=0
1,2.4722830000000613,10.0.2.15,62.210.85.178,TLSv1.2,3030,Application Data
1,2.472345999999561,62.210.85.178,10.0.2.15,TCP,60,9001  >  35978 [ACK] Seq=10314621 Ack=188257557 Win=65535 Len=0
1,2.4723529999992024,62.210.85.178,10.0.2.15,TCP,60,9001  >  35978 [ACK] Seq=10314621 Ack=188259017 Win=65535 Len=0
1,2.472356999999647,62.210.85.178,10.0.2.15,TCP,60,9001  >  35978 [ACK] Seq=10314621 Ack=188259073 Win=65535 Len=0
1,2.4818349999995917,10.0.2.15,62.210.85.178,TLSv1.2,4124,Application Data
1,2.4820559999998295,10.0.2.15,62.210.85.178,TCP,2974,35978  >  9001 [ACK] Seq=188263143 Ack=10314621 Win=65535 Len=2920 [TCP segment of a reassembled PDU]
1,2.482159999999567,10.0.2.15,62.210.85.178,TLSv1.2,4434,Application Data [TCP segment of a reassembled PDU]
1,2.4822989999993297,10.0.2.15,62.210.85.178,TLSv1.2,2974,Application Data [TCP segment of a reassembled PDU]
1,2.482481999999436,62.210.85.178,10.0.2.15,TCP,60,9001  >  35978 [ACK] Seq=10314621 Ack=188260533 Win=65535 Len=0
1,2.4825059999993755,62.210.85.178,10.0.2.15,TCP,60,9001  >  35978 [ACK] Seq=10314621 Ack=188261993 Win=65535 Len=0
1,2.4825119999995877,62.210.85.178,10.0.2.15,TCP,60,9001  >  35978 [ACK] Seq=10314621 Ack=188263143 Win=65535 Len=0
1,2.4825160000000324,62.210.85.178,10.0.2.15,TCP,60,9001  >  35978 [ACK] Seq=10314621 Ack=188264603 Win=65535 Len=0
1,2.482520999999906,62.210.85.178,10.0.2.15,TCP,60,9001  >  35978 [ACK] Seq=10314621 Ack=188266063 Win=65535 Len=0
1,2.482524999999441,62.210.85.178,10.0.2.15,TCP,60,9001  >  35978 [ACK] Seq=10314621 Ack=188267523 Win=65535 Len=0
1,2.482528999999886,62.210.85.178,10.0.2.15,TCP,60,9001  >  35978 [ACK] Seq=10314621 Ack=188268983 Win=65535 Len=0
1,2.4825339999997595,62.210.85.178,10.0.2.15,TCP,60,9001  >  35978 [ACK] Seq=10314621 Ack=188270443 Win=65535 Len=0
1,2.4825379999992947,62.210.85.178,10.0.2.15,TCP,60,9001  >  35978 [ACK] Seq=10314621 Ack=188271903 Win=65535 Len=0
1,2.4825419999997393,62.210.85.178,10.0.2.15,TCP,60,9001  >  35978 [ACK] Seq=10314621 Ack=188273363 Win=65535 Len=0
1,2.4826109999994515,10.0.2.15,62.210.85.178,TLSv1.2,2974,"Application Data, Application Data"
1,2.4826929999999265,10.0.2.15,62.210.85.178,TLSv1.2,966,Application Data
1,2.4835349999993923,62.210.85.178,10.0.2.15,TCP,60,9001  >  35978 [ACK] Seq=10314621 Ack=188274823 Win=65535 Len=0
1,2.4835749999992913,62.210.85.178,10.0.2.15,TCP,60,9001  >  35978 [ACK] Seq=10314621 Ack=188276283 Win=65535 Len=0
1,2.4835809999995035,62.210.85.178,10.0.2.15,TCP,60,9001  >  35978 [ACK] Seq=10314621 Ack=188277195 Win=65535 Len=0
1,2.583346999999776,54.93.77.70,10.0.2.15,TCP,2950,"9001  >  34692 [PSH, ACK] Seq=188097187 Ack=10359173 Win=65535 Len=2896 [TCP segment of a reassembled PDU]"
1,2.58352399999967,10.0.2.15,54.93.77.70,TCP,54,34692  >  9001 [ACK] Seq=10359173 Ack=188100083 Win=65535 Len=0
1,2.585186999999678,54.93.77.70,10.0.2.15,TLSv1.2,778,Application Data
1,2.5923479999992196,54.93.77.70,10.0.2.15,TCP,2950,"9001  >  34692 [PSH, ACK] Seq=188100807 Ack=10359173 Win=65535 Len=2896 [TCP segment of a reassembled PDU]"
1,2.5924379999996745,10.0.2.15,54.93.77.70,TCP,54,34692  >  9001 [ACK] Seq=10359173 Ack=188103703 Win=65535 Len=0
1,2.6008209999999963,54.93.77.70,10.0.2.15,TLSv1.2,778,Application Data
1,2.604165999999168,54.93.77.70,10.0.2.15,TCP,2950,"9001  >  34692 [PSH, ACK] Seq=188104427 Ack=10359173 Win=65535 Len=2896 [TCP segment of a reassembled PDU]"
1,2.6042379999998957,10.0.2.15,54.93.77.70,TCP,54,34692  >  9001 [ACK] Seq=10359173 Ack=188107323 Win=65535 Len=0
1,2.614130999999361,54.93.77.70,10.0.2.15,TLSv1.2,4398,Application Data [TCP segment of a reassembled PDU]
1,2.6142049999998562,10.0.2.15,54.93.77.70,TCP,54,34692  >  9001 [ACK] Seq=10359173 Ack=188111667 Win=65535 Len=0
1,2.616440999999213,54.93.77.70,10.0.2.15,TLSv1.2,590,"Application Data, Application Data"
1,2.6320969999997033,54.93.77.70,10.0.2.15,TLSv1.2,2132,Application Data
1,2.6322000000000116,10.0.2.15,54.93.77.70,TCP,54,34692  >  9001 [ACK] Seq=10359173 Ack=188114281 Win=65535 Len=0
1,2.642405999999937,54.93.77.70,10.0.2.15,TCP,2950,"9001  >  34692 [PSH, ACK] Seq=188114281 Ack=10359173 Win=65535 Len=2896 [TCP segment of a reassembled PDU]"
1,2.6424669999996695,10.0.2.15,54.93.77.70,TCP,54,34692  >  9001 [ACK] Seq=10359173 Ack=188117177 Win=65535 Len=0
1,2.650376999999935,54.93.77.70,10.0.2.15,TLSv1.2,778,Application Data
1,2.6621369999993476,54.93.77.70,10.0.2.15,TCP,2950,"9001  >  34692 [PSH, ACK] Seq=188117901 Ack=10359173 Win=65535 Len=2896 [TCP segment of a reassembled PDU]"
1,2.662191999999777,10.0.2.15,54.93.77.70,TCP,54,34692  >  9001 [ACK] Seq=10359173 Ack=188120797 Win=65535 Len=0
1,2.668300999999701,54.93.77.70,10.0.2.15,TLSv1.2,778,Application Data
1,2.707778999999391,54.93.77.70,10.0.2.15,TLSv1.2,5846,Application Data
1,2.7078559999999925,10.0.2.15,54.93.77.70,TCP,54,34692  >  9001 [ACK] Seq=10359173 Ack=188127313 Win=65535 Len=0
1,2.708071999999447,10.0.2.15,54.93.77.70,TLSv1.2,590,Application Data
1,2.708151999999245,54.93.77.70,10.0.2.15,TCP,60,9001  >  34692 [ACK] Seq=188127313 Ack=10359709 Win=65535 Len=0
1,2.7119370000000345,54.93.77.70,10.0.2.15,TLSv1.2,3066,"Application Data, Application Data"
1,2.711978999999701,10.0.2.15,54.93.77.70,TCP,54,34692  >  9001 [ACK] Seq=10359709 Ack=188130325 Win=65535 Len=0
1,2.7159849999998187,54.93.77.70,10.0.2.15,TLSv1.2,4398,Application Data
1,2.7160529999991923,10.0.2.15,54.93.77.70,TCP,54,34692  >  9001 [ACK] Seq=10359709 Ack=188134669 Win=65535 Len=0
1,2.7260669999996026,54.93.77.70,10.0.2.15,TLSv1.2,2950,Application Data [TCP segment of a reassembled PDU]
1,2.726116999999249,10.0.2.15,54.93.77.70,TCP,54,34692  >  9001 [ACK] Seq=10359709 Ack=188137565 Win=65535 Len=0
1,2.728892999999516,54.93.77.70,10.0.2.15,TCP,1502,"9001  >  34692 [PSH, ACK] Seq=188137565 Ack=10359709 Win=65535 Len=1448 [TCP segment of a reassembled PDU]"
1,2.7289419999997335,10.0.2.15,54.93.77.70,TCP,54,34692  >  9001 [ACK] Seq=10359709 Ack=188139013 Win=65535 Len=0
1,2.7292469999993045,54.93.77.70,10.0.2.15,TLSv1.2,684,Application Data
1,2.7293979999994917,10.0.2.15,54.93.77.70,TLSv1.2,590,Application Data
1,2.729465999999775,54.93.77.70,10.0.2.15,TCP,60,9001  >  34692 [ACK] Seq=188139643 Ack=10360245 Win=65535 Len=0
1,2.746590999999171,54.93.77.70,10.0.2.15,TLSv1.2,590,Application Data
1,2.748293999999987,54.93.77.70,10.0.2.15,TCP,2950,"9001  >  34692 [PSH, ACK] Seq=188140179 Ack=10360245 Win=65535 Len=2896 [TCP segment of a reassembled PDU]"
1,2.748443999999836,10.0.2.15,54.93.77.70,TCP,54,34692  >  9001 [ACK] Seq=10360245 Ack=188143075 Win=65535 Len=0
1,2.7630729999991672,54.93.77.70,10.0.2.15,TLSv1.2,264,Application Data
1,2.7656459999998333,10.0.2.15,54.93.77.70,TLSv1.2,590,Application Data
1,2.7658349999992424,54.93.77.70,10.0.2.15,TCP,60,9001  >  34692 [ACK] Seq=188143285 Ack=10360781 Win=65535 Len=0
1,3.0601989999995567,62.210.85.178,10.0.2.15,TLSv1.2,1618,Application Data
1,3.060316000000057,10.0.2.15,62.210.85.178,TCP,54,35978  >  9001 [ACK] Seq=188277195 Ack=10316185 Win=65535 Len=0
1,3.0607780000000275,10.0.2.15,62.210.85.178,TLSv1.2,590,Application Data
1,3.060895999999957,62.210.85.178,10.0.2.15,TCP,60,9001  >  35978 [ACK] Seq=10316185 Ack=188277731 Win=65535 Len=0
1,3.2648059999992256,54.93.77.70,10.0.2.15,TLSv1.2,590,Application Data
1,3.2652209999996558,10.0.2.15,54.93.77.70,TLSv1.2,590,Application Data
1,3.265338999999585,54.93.77.70,10.0.2.15,TCP,60,9001  >  34692 [ACK] Seq=188143821 Ack=10361317 Win=65535 Len=0
1,3.465208999999959,62.210.85.178,10.0.2.15,TLSv1.2,590,Application Data
1,3.4690569999993386,10.0.2.15,62.210.85.178,TLSv1.2,590,Application Data
1,3.469224999999824,62.210.85.178,10.0.2.15,TCP,60,9001  >  35978 [ACK] Seq=10316721 Ack=188278267 Win=65535 Len=0
1,3.482640999999603,10.0.2.15,62.210.85.178,TLSv1.2,4124,Application Data
1,3.4827849999992395,10.0.2.15,62.210.85.178,TCP,2974,35978  >  9001 [ACK] Seq=188282337 Ack=10316721 Win=65535 Len=2920 [TCP segment of a reassembled PDU]
1,3.4828349999997954,62.210.85.178,10.0.2.15,TCP,60,9001  >  35978 [ACK] Seq=10316721 Ack=188279727 Win=65535 Len=0
1,3.482847999999649,62.210.85.178,10.0.2.15,TCP,60,9001  >  35978 [ACK] Seq=10316721 Ack=188281187 Win=65535 Len=0
1,3.4828529999995226,62.210.85.178,10.0.2.15,TCP,60,9001  >  35978 [ACK] Seq=10316721 Ack=188282337 Win=65535 Len=0
1,3.4828579999993963,62.210.85.178,10.0.2.15,TCP,60,9001  >  35978 [ACK] Seq=10316721 Ack=188283797 Win=65535 Len=0
1,3.48286299999927,62.210.85.178,10.0.2.15,TCP,60,9001  >  35978 [ACK] Seq=10316721 Ack=188285257 Win=65535 Len=0
1,3.482905999999275,10.0.2.15,62.210.85.178,TLSv1.2,1204,Application Data
1,3.483024999999543,10.0.2.15,62.210.85.178,TCP,2974,35978  >  9001 [ACK] Seq=188286407 Ack=10316721 Win=65535 Len=2920 [TCP segment of a reassembled PDU]
1,3.4830709999996543,62.210.85.178,10.0.2.15,TCP,60,9001  >  35978 [ACK] Seq=10316721 Ack=188286407 Win=65535 Len=0
1,3.4830799999999726,62.210.85.178,10.0.2.15,TCP,60,9001  >  35978 [ACK] Seq=10316721 Ack=188287867 Win=65535 Len=0
1,3.4830849999998463,62.210.85.178,10.0.2.15,TCP,60,9001  >  35978 [ACK] Seq=10316721 Ack=188289327 Win=65535 Len=0
1,3.483115999999427,10.0.2.15,62.210.85.178,TLSv1.2,1204,Application Data
1,3.4831539999995584,62.210.85.178,10.0.2.15,TCP,60,9001  >  35978 [ACK] Seq=10316721 Ack=188290477 Win=65535 Len=0
1,3.4832049999995434,10.0.2.15,62.210.85.178,TLSv1.2,4124,Application Data
1,3.4833209999997052,62.210.85.178,10.0.2.15,TCP,60,9001  >  35978 [ACK] Seq=10316721 Ack=188291937 Win=65535 Len=0
1,3.483331999999791,62.210.85.178,10.0.2.15,TCP,60,9001  >  35978 [ACK] Seq=10316721 Ack=188293397 Win=65535 Len=0
1,3.4833349999998973,62.210.85.178,10.0.2.15,TCP,60,9001  >  35978 [ACK] Seq=10316721 Ack=188294547 Win=65535 Len=0
1,3.483365999999478,10.0.2.15,62.210.85.178,TLSv1.2,332,Application Data
1,3.483401999999842,62.210.85.178,10.0.2.15,TCP,60,9001  >  35978 [ACK] Seq=10316721 Ack=188294825 Win=65535 Len=0
1,3.483462999999574,10.0.2.15,62.210.85.178,TLSv1.2,3868,Application Data
1,3.4835229999998774,62.210.85.178,10.0.2.15,TCP,60,9001  >  35978 [ACK] Seq=10316721 Ack=188296285 Win=65535 Len=0
1,3.48352899999918,62.210.85.178,10.0.2.15,TCP,60,9001  >  35978 [ACK] Seq=10316721 Ack=188297745 Win=65535 Len=0
1,3.483531999999286,62.210.85.178,10.0.2.15,TCP,60,9001  >  35978 [ACK] Seq=10316721 Ack=188298639 Win=65535 Len=0
1,3.4835659999998825,10.0.2.15,62.210.85.178,TLSv1.2,910,Application Data
1,3.4835989999992307,62.210.85.178,10.0.2.15,TCP,60,9001  >  35978 [ACK] Seq=10316721 Ack=188299495 Win=65535 Len=0
1,3.5931089999994583,54.93.77.70,10.0.2.15,TLSv1.2,3674,Application Data
1,3.5932319999992615,10.0.2.15,54.93.77.70,TCP,54,34692  >  9001 [ACK] Seq=10361317 Ack=188147441 Win=65535 Len=0
1,3.6017629999996643,54.93.77.70,10.0.2.15,TCP,2950,"9001  >  34692 [PSH, ACK] Seq=188147441 Ack=10361317 Win=65535 Len=2896 [TCP segment of a reassembled PDU]"
1,3.6018169999997554,10.0.2.15,54.93.77.70,TCP,54,34692  >  9001 [ACK] Seq=10361317 Ack=188150337 Win=65535 Len=0
1,3.6100879999994504,54.93.77.70,10.0.2.15,TLSv1.2,2950,Application Data [TCP segment of a reassembled PDU]
1,3.6101059999991776,54.93.77.70,10.0.2.15,TLSv1.2,4398,Application Data [TCP segment of a reassembled PDU]
1,3.61014299999988,10.0.2.15,54.93.77.70,TCP,54,34692  >  9001 [ACK] Seq=10361317 Ack=188153233 Win=65535 Len=0
1,3.6102139999993597,10.0.2.15,54.93.77.70,TCP,54,34692  >  9001 [ACK] Seq=10361317 Ack=188157577 Win=65535 Len=0
1,3.6162339999991673,54.93.77.70,10.0.2.15,TLSv1.2,264,Application Data
1,3.6200959999996485,54.93.77.70,10.0.2.15,TLSv1.2,4398,Application Data
1,3.620147999999972,10.0.2.15,54.93.77.70,TCP,54,34692  >  9001 [ACK] Seq=10361317 Ack=188162131 Win=65535 Len=0
1,3.6366589999997814,54.93.77.70,10.0.2.15,TLSv1.2,1408,Application Data
1,3.6566399999992427,54.93.77.70,10.0.2.15,TCP,1502,"9001  >  34692 [PSH, ACK] Seq=188163485 Ack=10361317 Win=65535 Len=1448 [TCP segment of a reassembled PDU]"
1,3.656707999999526,10.0.2.15,54.93.77.70,TCP,54,34692  >  9001 [ACK] Seq=10361317 Ack=188164933 Win=65535 Len=0
1,3.672708999999486,54.93.77.70,10.0.2.15,TLSv1.2,684,Application Data
1,3.6749689999996917,10.0.2.15,54.93.77.70,TLSv1.2,590,Application Data
1,3.6751359999998385,54.93.77.70,10.0.2.15,TCP,60,9001  >  34692 [ACK] Seq=188165563 Ack=10361853 Win=65535 Len=0
1,3.7879269999993994,62.210.85.178,10.0.2.15,TLSv1.2,590,Application Data
1,3.788423999999395,10.0.2.15,62.210.85.178,TLSv1.2,590,Application Data
1,3.7885529999994105,62.210.85.178,10.0.2.15,TCP,60,9001  >  35978 [ACK] Seq=10317257 Ack=188300031 Win=65535 Len=0
1,3.8942989999995916,54.93.77.70,10.0.2.15,TLSv1.2,590,Application Data
1,3.8946569999998246,10.0.2.15,54.93.77.70,TLSv1.2,590,Application Data
1,3.894757999999456,54.93.77.70,10.0.2.15,TCP,60,9001  >  34692 [ACK] Seq=188166099 Ack=10362389 Win=65535 Len=0
1,4.0881979999994655,62.210.85.178,10.0.2.15,TLSv1.2,590,Application Data
1,4.094181999999819,10.0.2.15,62.210.85.178,TLSv1.2,590,Application Data
1,4.094333000000006,62.210.85.178,10.0.2.15,TCP,60,9001  >  35978 [ACK] Seq=10317793 Ack=188300567 Win=65535 Len=0
1,4.106917999999496,10.0.2.15,62.210.85.178,TLSv1.2,4124,Application Data
1,4.107028999999784,10.0.2.15,62.210.85.178,TCP,2974,35978  >  9001 [ACK] Seq=188304637 Ack=10317793 Win=65535 Len=2920 [TCP segment of a reassembled PDU]
1,4.107080999999198,62.210.85.178,10.0.2.15,TCP,60,9001  >  35978 [ACK] Seq=10317793 Ack=188302027 Win=65535 Len=0
1,4.107092999999622,62.210.85.178,10.0.2.15,TCP,60,9001  >  35978 [ACK] Seq=10317793 Ack=188303487 Win=65535 Len=0
1,4.107098999999835,62.210.85.178,10.0.2.15,TCP,60,9001  >  35978 [ACK] Seq=10317793 Ack=188304637 Win=65535 Len=0
1,4.10714199999984,10.0.2.15,62.210.85.178,TLSv1.2,1204,Application Data
1,4.107181999999739,62.210.85.178,10.0.2.15,TCP,60,9001  >  35978 [ACK] Seq=10317793 Ack=188306097 Win=65535 Len=0
1,4.107192999999825,62.210.85.178,10.0.2.15,TCP,60,9001  >  35978 [ACK] Seq=10317793 Ack=188307557 Win=65535 Len=0
1,4.10719699999936,62.210.85.178,10.0.2.15,TCP,60,9001  >  35978 [ACK] Seq=10317793 Ack=188308707 Win=65535 Len=0
1,4.107237999999597,10.0.2.15,62.210.85.178,TLSv1.2,4124,Application Data
1,4.107276999999158,62.210.85.178,10.0.2.15,TCP,60,9001  >  35978 [ACK] Seq=10317793 Ack=188310167 Win=65535 Len=0
1,4.107285999999476,62.210.85.178,10.0.2.15,TCP,60,9001  >  35978 [ACK] Seq=10317793 Ack=188311627 Win=65535 Len=0
1,4.107289999999921,62.210.85.178,10.0.2.15,TCP,60,9001  >  35978 [ACK] Seq=10317793 Ack=188312777 Win=65535 Len=0
1,4.107328000000052,10.0.2.15,62.210.85.178,TLSv1.2,4124,Application Data
1,4.107365999999274,62.210.85.178,10.0.2.15,TCP,60,9001  >  35978 [ACK] Seq=10317793 Ack=188314237 Win=65535 Len=0
1,4.107373999999254,62.210.85.178,10.0.2.15,TCP,60,9001  >  35978 [ACK] Seq=10317793 Ack=188315697 Win=65535 Len=0
1,4.107435999999325,10.0.2.15,62.210.85.178,TLSv1.2,2974,Application Data
1,4.107477999999901,62.210.85.178,10.0.2.15,TCP,60,9001  >  35978 [ACK] Seq=10317793 Ack=188316847 Win=65535 Len=0
1,4.107484999999542,62.210.85.178,10.0.2.15,TCP,60,9001  >  35978 [ACK] Seq=10317793 Ack=188318307 Win=65535 Len=0
1,4.107487999999648,62.210.85.178,10.0.2.15,TCP,60,9001  >  35978 [ACK] Seq=10317793 Ack=188319767 Win=65535 Len=0
1,4.107516000000032,10.0.2.15,62.210.85.178,TLSv1.2,1226,Application Data
1,4.107551000000058,62.210.85.178,10.0.2.15,TCP,60,9001  >  35978 [ACK] Seq=10317793 Ack=188320939 Win=65535 Len=0
1,4.107591999999386,10.0.2.15,62.210.85.178,TLSv1.2,4124,Application Data
1,4.107633999999962,62.210.85.178,10.0.2.15,TCP,60,9001  >  35978 [ACK] Seq=10317793 Ack=188322399 Win=65535 Len=0
1,4.107641999999942,62.210.85.178,10.0.2.15,TCP,60,9001  >  35978 [ACK] Seq=10317793 Ack=188323859 Win=65535 Len=0
1,4.107645999999477,62.210.85.178,10.0.2.15,TCP,60,9001  >  35978 [ACK] Seq=10317793 Ack=188325009 Win=65535 Len=0
1,4.10768299999927,10.0.2.15,62.210.85.178,TLSv1.2,3030,Application Data
1,4.107720999999401,62.210.85.178,10.0.2.15,TCP,60,9001  >  35978 [ACK] Seq=10317793 Ack=188326469 Win=65535 Len=0
1,4.107728999999381,62.210.85.178,10.0.2.15,TCP,60,9001  >  35978 [ACK] Seq=10317793 Ack=188327929 Win=65535 Len=0
1,4.107733999999255,62.210.85.178,10.0.2.15,TCP,60,9001  >  35978 [ACK] Seq=10317793 Ack=188327985 Win=65535 Len=0
1,4.116923999999926,10.0.2.15,62.210.85.178,TLSv1.2,4124,Application Data
1,4.116968999999699,62.210.85.178,10.0.2.15,TCP,60,9001  >  35978 [ACK] Seq=10317793 Ack=188329445 Win=65535 Len=0
1,4.116978000000017,62.210.85.178,10.0.2.15,TCP,60,9001  >  35978 [ACK] Seq=10317793 Ack=188330905 Win=65535 Len=0
1,4.116982999999891,62.210.85.178,10.0.2.15,TCP,60,9001  >  35978 [ACK] Seq=10317793 Ack=188332055 Win=65535 Len=0
1,4.11702299999979,10.0.2.15,62.210.85.178,TLSv1.2,4124,Application Data
1,4.117059999999583,62.210.85.178,10.0.2.15,TCP,60,9001  >  35978 [ACK] Seq=10317793 Ack=188333515 Win=65535 Len=0
1,4.117067999999563,62.210.85.178,10.0.2.15,TCP,60,9001  >  35978 [ACK] Seq=10317793 Ack=188334975 Win=65535 Len=0
1,4.117072999999436,62.210.85.178,10.0.2.15,TCP,60,9001  >  35978 [ACK] Seq=10317793 Ack=188336125 Win=65535 Len=0
1,4.117138999999952,10.0.2.15,62.210.85.178,TLSv1.2,4124,Application Data
1,4.117175999999745,62.210.85.178,10.0.2.15,TCP,60,9001  >  35978 [ACK] Seq=10317793 Ack=188337585 Win=65535 Len=0
1,4.117185000000063,62.210.85.178,10.0.2.15,TCP,60,9001  >  35978 [ACK] Seq=10317793 Ack=188339045 Win=65535 Len=0
1,4.117189999999937,62.210.85.178,10.0.2.15,TCP,60,9001  >  35978 [ACK] Seq=10317793 Ack=188340195 Win=65535 Len=0
1,4.117225999999391,10.0.2.15,62.210.85.178,TLSv1.2,4124,Application Data
1,4.117263999999523,62.210.85.178,10.0.2.15,TCP,60,9001  >  35978 [ACK] Seq=10317793 Ack=188341655 Win=65535 Len=0
1,4.117271999999502,62.210.85.178,10.0.2.15,TCP,60,9001  >  35978 [ACK] Seq=10317793 Ack=188343115 Win=65535 Len=0
1,4.117276999999376,62.210.85.178,10.0.2.15,TCP,60,9001  >  35978 [ACK] Seq=10317793 Ack=188344265 Win=65535 Len=0
1,4.117310999999972,10.0.2.15,62.210.85.178,TLSv1.2,332,Application Data
1,4.117347999999765,62.210.85.178,10.0.2.15,TCP,60,9001  >  35978 [ACK] Seq=10317793 Ack=188344543 Win=65535 Len=0
1,4.11739899999975,10.0.2.15,62.210.85.178,TLSv1.2,3868,Application Data
1,4.117436999999882,62.210.85.178,10.0.2.15,TCP,60,9001  >  35978 [ACK] Seq=10317793 Ack=188346003 Win=65535 Len=0
1,4.1174449999998615,62.210.85.178,10.0.2.15,TCP,60,9001  >  35978 [ACK] Seq=10317793 Ack=188347463 Win=65535 Len=0
1,4.117448999999397,62.210.85.178,10.0.2.15,TCP,60,9001  >  35978 [ACK] Seq=10317793 Ack=188348357 Win=65535 Len=0
1,4.117486999999528,10.0.2.15,62.210.85.178,TLSv1.2,4124,Application Data
1,4.117525999999998,62.210.85.178,10.0.2.15,TCP,60,9001  >  35978 [ACK] Seq=10317793 Ack=188349817 Win=65535 Len=0
1,4.117533999999978,62.210.85.178,10.0.2.15,TCP,60,9001  >  35978 [ACK] Seq=10317793 Ack=188351277 Win=65535 Len=0
1,4.117537999999513,62.210.85.178,10.0.2.15,TCP,60,9001  >  35978 [ACK] Seq=10317793 Ack=188352427 Win=65535 Len=0
1,4.117572999999538,10.0.2.15,62.210.85.178,TLSv1.2,3030,Application Data
1,4.11761099999967,62.210.85.178,10.0.2.15,TCP,60,9001  >  35978 [ACK] Seq=10317793 Ack=188353887 Win=65535 Len=0
1,4.1176189999996495,62.210.85.178,10.0.2.15,TCP,60,9001  >  35978 [ACK] Seq=10317793 Ack=188355347 Win=65535 Len=0
1,4.117623999999523,62.210.85.178,10.0.2.15,TCP,60,9001  >  35978 [ACK] Seq=10317793 Ack=188355403 Win=65535 Len=0
1,4.131238999999368,10.0.2.15,62.210.85.178,TLSv1.2,4124,Application Data
1,4.1313350000000355,10.0.2.15,62.210.85.178,TCP,2974,35978  >  9001 [ACK] Seq=188359473 Ack=10317793 Win=65535 Len=2920 [TCP segment of a reassembled PDU]
1,4.13137899999947,62.210.85.178,10.0.2.15,TCP,60,9001  >  35978 [ACK] Seq=10317793 Ack=188356863 Win=65535 Len=0
1,4.131388999999217,62.210.85.178,10.0.2.15,TCP,60,9001  >  35978 [ACK] Seq=10317793 Ack=188358323 Win=65535 Len=0
1,4.131394,62.210.85.178,10.0.2.15,TCP,60,9001  >  35978 [ACK] Seq=10317793 Ack=188359473 Win=65535 Len=0
1,4.131433999999899,10.0.2.15,62.210.85.178,TLSv1.2,1204,Application Data
1,4.13147299999946,62.210.85.178,10.0.2.15,TCP,60,9001  >  35978 [ACK] Seq=10317793 Ack=188360933 Win=65535 Len=0
1,4.1314800000000105,62.210.85.178,10.0.2.15,TCP,60,9001  >  35978 [ACK] Seq=10317793 Ack=188362393 Win=65535 Len=0
1,4.131483999999546,62.210.85.178,10.0.2.15,TCP,60,9001  >  35978 [ACK] Seq=10317793 Ack=188363543 Win=65535 Len=0
1,4.131532999999763,10.0.2.15,62.210.85.178,TLSv1.2,4124,Application Data
1,4.131598999999369,10.0.2.15,62.210.85.178,TCP,2974,35978  >  9001 [ACK] Seq=188367613 Ack=10317793 Win=65535 Len=2920 [TCP segment of a reassembled PDU]
1,4.131635999999162,62.210.85.178,10.0.2.15,TCP,60,9001  >  35978 [ACK] Seq=10317793 Ack=188365003 Win=65535 Len=0
1,4.131642999999713,62.210.85.178,10.0.2.15,TCP,60,9001  >  35978 [ACK] Seq=10317793 Ack=188366463 Win=65535 Len=0
1,4.131647999999586,62.210.85.178,10.0.2.15,TCP,60,9001  >  35978 [ACK] Seq=10317793 Ack=188367613 Win=65535 Len=0
1,4.131652000000031,62.210.85.178,10.0.2.15,TCP,60,9001  >  35978 [ACK] Seq=10317793 Ack=188369073 Win=65535 Len=0
1,4.131656999999905,62.210.85.178,10.0.2.15,TCP,60,9001  >  35978 [ACK] Seq=10317793 Ack=188370533 Win=65535 Len=0
1,4.1316939999996976,10.0.2.15,62.210.85.178,TLSv1.2,1204,Application Data
1,4.131774999999834,10.0.2.15,62.210.85.178,TLSv1.2,2974,Application Data
1,4.1318389999996725,10.0.2.15,62.210.85.178,TLSv1.2,1514,Application Data [TCP segment of a reassembled PDU]
1,4.131875000000036,62.210.85.178,10.0.2.15,TCP,60,9001  >  35978 [ACK] Seq=10317793 Ack=188371683 Win=65535 Len=0
1,4.131881999999678,62.210.85.178,10.0.2.15,TCP,60,9001  >  35978 [ACK] Seq=10317793 Ack=188373143 Win=65535 Len=0
1,4.131885999999213,62.210.85.178,10.0.2.15,TCP,60,9001  >  35978 [ACK] Seq=10317793 Ack=188374603 Win=65535 Len=0
1,4.1318899999996574,62.210.85.178,10.0.2.15,TCP,60,9001  >  35978 [ACK] Seq=10317793 Ack=188376063 Win=65535 Len=0
1,4.131926000000021,10.0.2.15,62.210.85.178,TLSv1.2,1136,Application Data
1,4.131962999999814,62.210.85.178,10.0.2.15,TCP,60,9001  >  35978 [ACK] Seq=10317793 Ack=188377145 Win=65535 Len=0
1,4.222041999999419,54.93.77.70,10.0.2.15,TLSv1.2,590,Application Data
1,4.234603999999308,54.93.77.70,10.0.2.15,TCP,2950,"9001  >  34692 [PSH, ACK] Seq=188166635 Ack=10362389 Win=65535 Len=2896 [TCP segment of a reassembled PDU]"
1,4.234741999999642,10.0.2.15,54.93.77.70,TCP,54,34692  >  9001 [ACK] Seq=10362389 Ack=188169531 Win=65535 Len=0
1,4.248231999999916,54.93.77.70,10.0.2.15,TLSv1.2,2950,Application Data [TCP segment of a reassembled PDU]
1,4.248335999999654,10.0.2.15,54.93.77.70,TCP,54,34692  >  9001 [ACK] Seq=10362389 Ack=188172427 Win=65535 Len=0
1,4.24839399999928,54.93.77.70,10.0.2.15,TLSv1.2,1502,Application Data
1,4.248468999999204,10.0.2.15,54.93.77.70,TCP,54,34692  >  9001 [ACK] Seq=10362389 Ack=188173875 Win=65535 Len=0
1,4.25684099999944,54.93.77.70,10.0.2.15,TLSv1.2,4210,"Application Data, Application Data"
1,4.2569039999998495,10.0.2.15,54.93.77.70,TCP,54,34692  >  9001 [ACK] Seq=10362389 Ack=188178031 Win=65535 Len=0
1,4.267584999999599,54.93.77.70,10.0.2.15,TCP,2950,"9001  >  34692 [PSH, ACK] Seq=188178031 Ack=10362389 Win=65535 Len=2896 [TCP segment of a reassembled PDU]"
1,4.267658999999185,10.0.2.15,54.93.77.70,TCP,54,34692  >  9001 [ACK] Seq=10362389 Ack=188180927 Win=65535 Len=0
1,4.268301000000065,54.93.77.70,10.0.2.15,TLSv1.2,4398,Application Data [TCP segment of a reassembled PDU]
1,4.2683680000000095,10.0.2.15,54.93.77.70,TCP,54,34692  >  9001 [ACK] Seq=10362389 Ack=188185271 Win=65535 Len=0
1,4.273172999999588,54.93.77.70,10.0.2.15,TLSv1.2,568,Application Data
1,4.282107999999425,54.93.77.70,10.0.2.15,TLSv1.2,4398,Application Data
1,4.282156999999643,10.0.2.15,54.93.77.70,TCP,54,34692  >  9001 [ACK] Seq=10362389 Ack=188190129 Win=65535 Len=0
1,4.291542999999365,54.93.77.70,10.0.2.15,TLSv1.2,2950,Application Data [TCP segment of a reassembled PDU]
1,4.291589999999815,10.0.2.15,54.93.77.70,TCP,54,34692  >  9001 [ACK] Seq=10362389 Ack=188193025 Win=65535 Len=0
1,4.292469999999412,54.93.77.70,10.0.2.15,TLSv1.2,5846,"Application Data, Application Data"
1,4.29253399999925,10.0.2.15,54.93.77.70,TCP,54,34692  >  9001 [ACK] Seq=10362389 Ack=188198817 Win=65535 Len=0
1,4.292734999999993,10.0.2.15,54.93.77.70,TLSv1.2,1104,Application Data
1,4.292843999999604,54.93.77.70,10.0.2.15,TCP,60,9001  >  34692 [ACK] Seq=188198817 Ack=10363439 Win=65535 Len=0
1,4.297602999999981,54.93.77.70,10.0.2.15,TLSv1.2,496,Application Data
1,4.308701999999357,54.93.77.70,10.0.2.15,TCP,2950,"9001  >  34692 [PSH, ACK] Seq=188199259 Ack=10363439 Win=65535 Len=2896 [TCP segment of a reassembled PDU]"
1,4.308760999999322,10.0.2.15,54.93.77.70,TCP,54,34692  >  9001 [ACK] Seq=10363439 Ack=188202155 Win=65535 Len=0
1,4.318416999999499,54.93.77.70,10.0.2.15,TLSv1.2,4398,Application Data [TCP segment of a reassembled PDU]
1,4.318480999999338,10.0.2.15,54.93.77.70,TCP,54,34692  >  9001 [ACK] Seq=10363439 Ack=188206499 Win=65535 Len=0
1,4.319133999999394,54.93.77.70,10.0.2.15,TLSv1.2,4398,Application Data [TCP segment of a reassembled PDU]
1,4.319176999999399,10.0.2.15,54.93.77.70,TCP,54,34692  >  9001 [ACK] Seq=10363439 Ack=188210843 Win=65535 Len=0
1,4.324709999999868,54.93.77.70,10.0.2.15,TLSv1.2,1408,"Application Data, Application Data"
1,4.329815999999482,54.93.77.70,10.0.2.15,TLSv1.2,4398,Application Data
1,4.329869999999573,10.0.2.15,54.93.77.70,TCP,54,34692  >  9001 [ACK] Seq=10363439 Ack=188216541 Win=65535 Len=0
1,4.330414000000019,54.93.77.70,10.0.2.15,TLSv1.2,2950,Application Data
1,4.330458999999792,10.0.2.15,54.93.77.70,TCP,54,34692  >  9001 [ACK] Seq=10363439 Ack=188219437 Win=65535 Len=0
1,4.330642999999327,10.0.2.15,54.93.77.70,TLSv1.2,590,Application Data
1,4.330753999999615,54.93.77.70,10.0.2.15,TCP,60,9001  >  34692 [ACK] Seq=188219437 Ack=10363975 Win=65535 Len=0
1,4.365871999999399,54.93.77.70,10.0.2.15,TLSv1.2,7620,"Application Data, Application Data"
1,4.366012999999839,10.0.2.15,54.93.77.70,TCP,54,34692  >  9001 [ACK] Seq=10363975 Ack=188227003 Win=65535 Len=0
1,4.381787999999688,54.93.77.70,10.0.2.15,TLSv1.2,264,Application Data
1,4.416006999999809,54.93.77.70,10.0.2.15,TLSv1.2,7294,Application Data
1,4.4160609999999,10.0.2.15,54.93.77.70,TCP,54,34692  >  9001 [ACK] Seq=10363975 Ack=188234453 Win=65535 Len=0
1,4.431344999999965,54.93.77.70,10.0.2.15,TLSv1.2,568,Application Data
1,4.432099999999991,54.93.77.70,10.0.2.15,TCP,2950,"9001  >  34692 [PSH, ACK] Seq=188234967 Ack=10363975 Win=65535 Len=2896 [TCP segment of a reassembled PDU]"
1,4.43215599999985,10.0.2.15,54.93.77.70,TCP,54,34692  >  9001 [ACK] Seq=10363975 Ack=188237863 Win=65535 Len=0
1,4.444375999999465,54.93.77.70,10.0.2.15,TLSv1.2,1502,Application Data [TCP segment of a reassembled PDU]
1,4.444459999999708,10.0.2.15,54.93.77.70,TCP,54,34692  >  9001 [ACK] Seq=10363975 Ack=188239311 Win=65535 Len=0
1,4.447953999999299,54.93.77.70,10.0.2.15,TLSv1.2,894,Application Data
1,4.450175999999374,62.210.85.178,10.0.2.15,TLSv1.2,1104,Application Data
1,4.46475399999963,54.93.77.70,10.0.2.15,TCP,2950,"9001  >  34692 [PSH, ACK] Seq=188240151 Ack=10363975 Win=65535 Len=2896 [TCP segment of a reassembled PDU]"
1,4.464843999999175,10.0.2.15,54.93.77.70,TCP,54,34692  >  9001 [ACK] Seq=10363975 Ack=188243047 Win=65535 Len=0
1,4.464912999999797,54.93.77.70,10.0.2.15,TLSv1.2,264,Application Data
1,4.469008000000031,10.0.2.15,54.93.77.70,TLSv1.2,590,Application Data
1,4.469178999999713,54.93.77.70,10.0.2.15,TCP,60,9001  >  34692 [ACK] Seq=188243257 Ack=10364511 Win=65535 Len=0
1,4.4902869999996256,10.0.2.15,62.210.85.178,TCP,54,35978  >  9001 [ACK] Seq=188377145 Ack=10318843 Win=65535 Len=0
1,4.511923999999453,62.210.85.178,10.0.2.15,TLSv1.2,590,Application Data
1,4.512007999999696,10.0.2.15,62.210.85.178,TCP,54,35978  >  9001 [ACK] Seq=188377145 Ack=10319379 Win=65535 Len=0
1,4.903206999999384,62.210.85.178,10.0.2.15,TLSv1.2,590,Application Data
1,4.903285999999753,10.0.2.15,62.210.85.178,TCP,54,35978  >  9001 [ACK] Seq=188377145 Ack=10319915 Win=65535 Len=0
1,4.9037719999996625,10.0.2.15,62.210.85.178,TLSv1.2,590,Application Data
1,4.903881999999612,62.210.85.178,10.0.2.15,TCP,60,9001  >  35978 [ACK] Seq=10319915 Ack=188377681 Win=65535 Len=0
1,5.0091959999999744,54.93.77.70,10.0.2.15,TLSv1.2,590,Application Data
1,5.009557999999743,10.0.2.15,54.93.77.70,TLSv1.2,590,Application Data
1,5.009672999999566,54.93.77.70,10.0.2.15,TCP,60,9001  >  34692 [ACK] Seq=188243793 Ack=10365047 Win=65535 Len=0
1,5.21009099999992,62.210.85.178,10.0.2.15,TLSv1.2,590,Application Data
1,5.217216000000008,10.0.2.15,62.210.85.178,TLSv1.2,590,Application Data
1,5.217447999999422,62.210.85.178,10.0.2.15,TCP,60,9001  >  35978 [ACK] Seq=10320451 Ack=188378217 Win=65535 Len=0
1,5.226948999999877,10.0.2.15,62.210.85.178,TLSv1.2,4124,Application Data
1,5.227041999999528,10.0.2.15,62.210.85.178,TCP,2974,35978  >  9001 [ACK] Seq=188382287 Ack=10320451 Win=65535 Len=2920 [TCP segment of a reassembled PDU]
1,5.227593999999954,62.210.85.178,10.0.2.15,TCP,60,9001  >  35978 [ACK] Seq=10320451 Ack=188379677 Win=65535 Len=0
1,5.227610999999342,62.210.85.178,10.0.2.15,TCP,60,9001  >  35978 [ACK] Seq=10320451 Ack=188381137 Win=65535 Len=0
1,5.227615999999216,62.210.85.178,10.0.2.15,TCP,60,9001  >  35978 [ACK] Seq=10320451 Ack=188382287 Win=65535 Len=0
1,5.227619999999661,62.210.85.178,10.0.2.15,TCP,60,9001  >  35978 [ACK] Seq=10320451 Ack=188383747 Win=65535 Len=0
1,5.227623999999196,62.210.85.178,10.0.2.15,TCP,60,9001  >  35978 [ACK] Seq=10320451 Ack=188385207 Win=65535 Len=0
1,5.227676999999858,10.0.2.15,62.210.85.178,TLSv1.2,1204,Application Data
1,5.227779999999257,10.0.2.15,62.210.85.178,TCP,2974,35978  >  9001 [ACK] Seq=188386357 Ack=10320451 Win=65535 Len=2920 [TCP segment of a reassembled PDU]
1,5.227805999999873,62.210.85.178,10.0.2.15,TCP,60,9001  >  35978 [ACK] Seq=10320451 Ack=188386357 Win=65535 Len=0
1,5.227842999999666,10.0.2.15,62.210.85.178,TLSv1.2,1204,Application Data
1,5.2278929999993125,62.210.85.178,10.0.2.15,TCP,60,9001  >  35978 [ACK] Seq=10320451 Ack=188387817 Win=65535 Len=0
1,5.227899999999863,62.210.85.178,10.0.2.15,TCP,60,9001  >  35978 [ACK] Seq=10320451 Ack=188389277 Win=65535 Len=0
1,5.227903999999398,62.210.85.178,10.0.2.15,TCP,60,9001  >  35978 [ACK] Seq=10320451 Ack=188390427 Win=65535 Len=0
1,5.227961999999934,10.0.2.15,62.210.85.178,TLSv1.2,4124,Application Data
1,5.228072999999313,62.210.85.178,10.0.2.15,TCP,60,9001  >  35978 [ACK] Seq=10320451 Ack=188391887 Win=65535 Len=0
1,5.228081999999631,62.210.85.178,10.0.2.15,TCP,60,9001  >  35978 [ACK] Seq=10320451 Ack=188393347 Win=65535 Len=0
1,5.228085999999166,62.210.85.178,10.0.2.15,TCP,60,9001  >  35978 [ACK] Seq=10320451 Ack=188394497 Win=65535 Len=0
1,5.228140999999596,10.0.2.15,62.210.85.178,TLSv1.2,332,Application Data
1,5.228220999999394,62.210.85.178,10.0.2.15,TCP,60,9001  >  35978 [ACK] Seq=10320451 Ack=188394775 Win=65535 Len=0
1,5.228272999999717,10.0.2.15,62.210.85.178,TLSv1.2,3868,Application Data
1,5.228313999999955,62.210.85.178,10.0.2.15,TCP,60,9001  >  35978 [ACK] Seq=10320451 Ack=188396235 Win=65535 Len=0
1,5.228321999999935,62.210.85.178,10.0.2.15,TCP,60,9001  >  35978 [ACK] Seq=10320451 Ack=188397695 Win=65535 Len=0
1,5.22832599999947,62.210.85.178,10.0.2.15,TCP,60,9001  >  35978 [ACK] Seq=10320451 Ack=188398589 Win=65535 Len=0
1,5.228385999999773,10.0.2.15,62.210.85.178,TLSv1.2,4124,Application Data
1,5.228430999999546,62.210.85.178,10.0.2.15,TCP,60,9001  >  35978 [ACK] Seq=10320451 Ack=188400049 Win=65535 Len=0
1,5.228437999999187,62.210.85.178,10.0.2.15,TCP,60,9001  >  35978 [ACK] Seq=10320451 Ack=188401509 Win=65535 Len=0
1,5.228441999999632,62.210.85.178,10.0.2.15,TCP,60,9001  >  35978 [ACK] Seq=10320451 Ack=188402659 Win=65535 Len=0
1,5.228485999999975,10.0.2.15,62.210.85.178,TLSv1.2,3030,Application Data
1,5.228524999999536,62.210.85.178,10.0.2.15,TCP,60,9001  >  35978 [ACK] Seq=10320451 Ack=188404119 Win=65535 Len=0
1,5.228531999999177,62.210.85.178,10.0.2.15,TCP,60,9001  >  35978 [ACK] Seq=10320451 Ack=188405579 Win=65535 Len=0
1,5.228535999999622,62.210.85.178,10.0.2.15,TCP,60,9001  >  35978 [ACK] Seq=10320451 Ack=188405635 Win=65535 Len=0
1,5.237848999999187,10.0.2.15,62.210.85.178,TLSv1.2,4124,Application Data
1,5.237998999999945,62.210.85.178,10.0.2.15,TCP,60,9001  >  35978 [ACK] Seq=10320451 Ack=188407095 Win=65535 Len=0
1,5.238016999999672,62.210.85.178,10.0.2.15,TCP,60,9001  >  35978 [ACK] Seq=10320451 Ack=188408555 Win=65535 Len=0
1,5.238020999999208,62.210.85.178,10.0.2.15,TCP,60,9001  >  35978 [ACK] Seq=10320451 Ack=188409705 Win=65535 Len=0
1,5.23805799999991,10.0.2.15,62.210.85.178,TCP,2974,35978  >  9001 [ACK] Seq=188409705 Ack=10320451 Win=65535 Len=2920 [TCP segment of a reassembled PDU]
1,5.238127999999961,62.210.85.178,10.0.2.15,TCP,60,9001  >  35978 [ACK] Seq=10320451 Ack=188411165 Win=65535 Len=0
1,5.238136999999369,62.210.85.178,10.0.2.15,TCP,60,9001  >  35978 [ACK] Seq=10320451 Ack=188412625 Win=65535 Len=0
1,5.2381659999991825,10.0.2.15,62.210.85.178,TLSv1.2,1204,Application Data
1,5.238227999999253,62.210.85.178,10.0.2.15,TCP,60,9001  >  35978 [ACK] Seq=10320451 Ack=188413775 Win=65535 Len=0
1,5.2382840000000215,10.0.2.15,62.210.85.178,TLSv1.2,4124,Application Data
1,5.23834799999986,62.210.85.178,10.0.2.15,TCP,60,9001  >  35978 [ACK] Seq=10320451 Ack=188415235 Win=65535 Len=0
1,5.23835599999984,62.210.85.178,10.0.2.15,TCP,60,9001  >  35978 [ACK] Seq=10320451 Ack=188416695 Win=65535 Len=0
1,5.238358999999946,62.210.85.178,10.0.2.15,TCP,60,9001  >  35978 [ACK] Seq=10320451 Ack=188417845 Win=65535 Len=0
1,5.238396999999168,10.0.2.15,62.210.85.178,TLSv1.2,4124,Application Data
1,5.238464000000022,62.210.85.178,10.0.2.15,TCP,60,9001  >  35978 [ACK] Seq=10320451 Ack=188419305 Win=65535 Len=0
1,5.238472000000002,62.210.85.178,10.0.2.15,TCP,60,9001  >  35978 [ACK] Seq=10320451 Ack=188420765 Win=65535 Len=0
1,5.238475999999537,62.210.85.178,10.0.2.15,TCP,60,9001  >  35978 [ACK] Seq=10320451 Ack=188421915 Win=65535 Len=0
1,5.238507999999456,10.0.2.15,62.210.85.178,TLSv1.2,332,Application Data
1,5.238544999999249,62.210.85.178,10.0.2.15,TCP,60,9001  >  35978 [ACK] Seq=10320451 Ack=188422193 Win=65535 Len=0
1,5.2386029999997845,10.0.2.15,62.210.85.178,TLSv1.2,590,Application Data
1,5.238644000000022,62.210.85.178,10.0.2.15,TCP,60,9001  >  35978 [ACK] Seq=10320451 Ack=188422729 Win=65535 Len=0
1,5.317002999999204,54.93.77.70,10.0.2.15,TLSv1.2,590,Application Data
1,5.332435999999689,54.93.77.70,10.0.2.15,TCP,2950,"9001  >  34692 [PSH, ACK] Seq=188244329 Ack=10365047 Win=65535 Len=2896 [TCP segment of a reassembled PDU]"
1,5.332526999999573,10.0.2.15,54.93.77.70,TCP,54,34692  >  9001 [ACK] Seq=10365047 Ack=188247225 Win=65535 Len=0
1,5.3447309999992285,54.93.77.70,10.0.2.15,TLSv1.2,4398,Application Data [TCP segment of a reassembled PDU]
1,5.344796999999744,10.0.2.15,54.93.77.70,TCP,54,34692  >  9001 [ACK] Seq=10365047 Ack=188251569 Win=65535 Len=0
1,5.344951000000037,10.0.2.15,54.93.77.70,TLSv1.2,590,Application Data
1,5.3450209999991785,54.93.77.70,10.0.2.15,TCP,60,9001  >  34692 [ACK] Seq=188251569 Ack=10365583 Win=65535 Len=0
1,5.350506999999197,54.93.77.70,10.0.2.15,TLSv1.2,590,"Application Data, Application Data"
1,5.354137999999693,54.93.77.70,10.0.2.15,TCP,2950,"9001  >  34692 [PSH, ACK] Seq=188252105 Ack=10365583 Win=65535 Len=2896 [TCP segment of a reassembled PDU]"
1,5.35417999999936,10.0.2.15,54.93.77.70,TCP,54,34692  >  9001 [ACK] Seq=10365583 Ack=188255001 Win=65535 Len=0
1,5.365491999999904,54.93.77.70,10.0.2.15,TLSv1.2,4398,"Application Data, Application Data"
1,5.36556599999949,10.0.2.15,54.93.77.70,TCP,54,34692  >  9001 [ACK] Seq=10365583 Ack=188259345 Win=65535 Len=0
1,5.378995000000032,54.93.77.70,10.0.2.15,TLSv1.2,4210,"Application Data, Application Data"
1,5.379039999999804,10.0.2.15,54.93.77.70,TCP,54,34692  >  9001 [ACK] Seq=10365583 Ack=188263501 Win=65535 Len=0
1,5.423413999999866,54.93.77.70,10.0.2.15,TLSv1.2,3674,Application Data
1,5.42347399999926,10.0.2.15,54.93.77.70,TCP,54,34692  >  9001 [ACK] Seq=10365583 Ack=188267121 Win=65535 Len=0
1,5.452632999999878,54.93.77.70,10.0.2.15,TLSv1.2,7294,"Application Data, Application Data"
1,5.456352999999581,10.0.2.15,54.93.77.70,TCP,54,34692  >  9001 [ACK] Seq=10365583 Ack=188274361 Win=65535 Len=0
1,5.456655999999384,10.0.2.15,54.93.77.70,TLSv1.2,590,Application Data
1,5.456764999999905,54.93.77.70,10.0.2.15,TCP,60,9001  >  34692 [ACK] Seq=188274361 Ack=10366119 Win=65535 Len=0
1,5.459578999999394,54.93.77.70,10.0.2.15,TLSv1.2,2950,Application Data [TCP segment of a reassembled PDU]
1,5.459650999999212,10.0.2.15,54.93.77.70,TCP,54,34692  >  9001 [ACK] Seq=10366119 Ack=188277257 Win=65535 Len=0
1,5.461042999999336,54.93.77.70,10.0.2.15,TCP,1502,"9001  >  34692 [PSH, ACK] Seq=188277257 Ack=10366119 Win=65535 Len=1448 [TCP segment of a reassembled PDU]"
1,5.461095999999998,10.0.2.15,54.93.77.70,TCP,54,34692  >  9001 [ACK] Seq=10366119 Ack=188278705 Win=65535 Len=0
1,5.4675429999997505,54.93.77.70,10.0.2.15,TLSv1.2,4398,Application Data [TCP segment of a reassembled PDU]
1,5.467603999999483,10.0.2.15,54.93.77.70,TCP,54,34692  >  9001 [ACK] Seq=10366119 Ack=188283049 Win=65535 Len=0
1,5.468996999999945,54.93.77.70,10.0.2.15,TLSv1.2,5868,"Application Data, Application Data, Application Data"
1,5.469060999999783,10.0.2.15,54.93.77.70,TCP,54,34692  >  9001 [ACK] Seq=10366119 Ack=188288863 Win=65535 Len=0
1,5.471554999999171,10.0.2.15,54.93.77.70,TLSv1.2,590,Application Data
1,5.471704999999929,54.93.77.70,10.0.2.15,TCP,60,9001  >  34692 [ACK] Seq=188288863 Ack=10366655 Win=65535 Len=0
1,5.527701999999408,62.210.85.178,10.0.2.15,TLSv1.2,590,Application Data
1,5.570292999999765,10.0.2.15,62.210.85.178,TCP,54,35978  >  9001 [ACK] Seq=188422729 Ack=10320987 Win=65535 Len=0
1,5.5934839999999895,62.210.85.178,10.0.2.15,TLSv1.2,590,Application Data
1,5.593546999999489,10.0.2.15,62.210.85.178,TCP,54,35978  >  9001 [ACK] Seq=188422729 Ack=10321523 Win=65535 Len=0
1,5.620355000000018,62.210.85.178,10.0.2.15,TLSv1.2,590,Application Data
1,5.620406999999432,10.0.2.15,62.210.85.178,TCP,54,35978  >  9001 [ACK] Seq=188422729 Ack=10322059 Win=65535 Len=0
1,5.620925999999599,10.0.2.15,62.210.85.178,TLSv1.2,590,Application Data
1,5.621054999999615,62.210.85.178,10.0.2.15,TCP,60,9001  >  35978 [ACK] Seq=10322059 Ack=188423265 Win=65535 Len=0
1,5.729440999999497,54.93.77.70,10.0.2.15,TLSv1.2,590,Application Data
1,5.729897999999594,10.0.2.15,54.93.77.70,TLSv1.2,590,Application Data
1,5.730048999999781,54.93.77.70,10.0.2.15,TCP,60,9001  >  34692 [ACK] Seq=188289399 Ack=10367191 Win=65535 Len=0
1,5.881488999999419,62.210.85.178,10.0.2.15,TLSv1.2,590,Application Data
1,5.895695999999589,10.0.2.15,62.210.85.178,TLSv1.2,590,Application Data
1,5.895891999999549,62.210.85.178,10.0.2.15,TCP,60,9001  >  35978 [ACK] Seq=10322595 Ack=188423801 Win=65535 Len=0
1,5.910787999999229,10.0.2.15,62.210.85.178,TLSv1.2,4124,Application Data
1,5.9109159999998155,10.0.2.15,62.210.85.178,TCP,2974,35978  >  9001 [ACK] Seq=188427871 Ack=10322595 Win=65535 Len=2920 [TCP segment of a reassembled PDU]
1,5.910968999999568,62.210.85.178,10.0.2.15,TCP,60,9001  >  35978 [ACK] Seq=10322595 Ack=188425261 Win=65535 Len=0
1,5.9109819999994215,62.210.85.178,10.0.2.15,TCP,60,9001  >  35978 [ACK] Seq=10322595 Ack=188426721 Win=65535 Len=0
1,5.910987999999634,62.210.85.178,10.0.2.15,TCP,60,9001  >  35978 [ACK] Seq=10322595 Ack=188427871 Win=65535 Len=0
1,5.911030999999639,10.0.2.15,62.210.85.178,TLSv1.2,1204,Application Data
1,5.911070999999538,62.210.85.178,10.0.2.15,TCP,60,9001  >  35978 [ACK] Seq=10322595 Ack=188429331 Win=65535 Len=0
1,5.911078999999518,62.210.85.178,10.0.2.15,TCP,60,9001  >  35978 [ACK] Seq=10322595 Ack=188430791 Win=65535 Len=0
1,5.911082999999962,62.210.85.178,10.0.2.15,TCP,60,9001  >  35978 [ACK] Seq=10322595 Ack=188431941 Win=65535 Len=0
1,5.911124999999629,10.0.2.15,62.210.85.178,TLSv1.2,4124,Application Data
1,5.911163999999189,62.210.85.178,10.0.2.15,TCP,60,9001  >  35978 [ACK] Seq=10322595 Ack=188433401 Win=65535 Len=0
1,5.911171999999169,62.210.85.178,10.0.2.15,TCP,60,9001  >  35978 [ACK] Seq=10322595 Ack=188434861 Win=65535 Len=0
1,5.911175999999614,62.210.85.178,10.0.2.15,TCP,60,9001  >  35978 [ACK] Seq=10322595 Ack=188436011 Win=65535 Len=0
1,5.911212999999407,10.0.2.15,62.210.85.178,TLSv1.2,4124,Application Data
1,5.911253999999644,62.210.85.178,10.0.2.15,TCP,60,9001  >  35978 [ACK] Seq=10322595 Ack=188437471 Win=65535 Len=0
1,5.911261999999624,62.210.85.178,10.0.2.15,TCP,60,9001  >  35978 [ACK] Seq=10322595 Ack=188438931 Win=65535 Len=0
1,5.911322999999356,10.0.2.15,62.210.85.178,TLSv1.2,2974,Application Data
1,5.911363999999594,62.210.85.178,10.0.2.15,TCP,60,9001  >  35978 [ACK] Seq=10322595 Ack=188440081 Win=65535 Len=0
1,5.911370999999235,62.210.85.178,10.0.2.15,TCP,60,9001  >  35978 [ACK] Seq=10322595 Ack=188441541 Win=65535 Len=0
1,5.911373999999341,62.210.85.178,10.0.2.15,TCP,60,9001  >  35978 [ACK] Seq=10322595 Ack=188443001 Win=65535 Len=0
1,5.911401999999725,10.0.2.15,62.210.85.178,TLSv1.2,1226,Application Data
1,5.91143799999918,62.210.85.178,10.0.2.15,TCP,60,9001  >  35978 [ACK] Seq=10322595 Ack=188444173 Win=65535 Len=0
1,5.911478999999417,10.0.2.15,62.210.85.178,TLSv1.2,4124,Application Data
1,5.911518999999316,62.210.85.178,10.0.2.15,TCP,60,9001  >  35978 [ACK] Seq=10322595 Ack=188445633 Win=65535 Len=0
1,5.911527999999635,62.210.85.178,10.0.2.15,TCP,60,9001  >  35978 [ACK] Seq=10322595 Ack=188447093 Win=65535 Len=0
1,5.91153199999917,62.210.85.178,10.0.2.15,TCP,60,9001  >  35978 [ACK] Seq=10322595 Ack=188448243 Win=65535 Len=0
1,5.911569999999301,10.0.2.15,62.210.85.178,TLSv1.2,3030,Application Data
1,5.9116099999992,62.210.85.178,10.0.2.15,TCP,60,9001  >  35978 [ACK] Seq=10322595 Ack=188449703 Win=65535 Len=0
1,5.911616999999751,62.210.85.178,10.0.2.15,TCP,60,9001  >  35978 [ACK] Seq=10322595 Ack=188451163 Win=65535 Len=0
1,5.911620999999286,62.210.85.178,10.0.2.15,TCP,60,9001  >  35978 [ACK] Seq=10322595 Ack=188451219 Win=65535 Len=0
1,5.920835999999326,10.0.2.15,62.210.85.178,TLSv1.2,4124,Application Data
1,5.920889999999417,62.210.85.178,10.0.2.15,TCP,60,9001  >  35978 [ACK] Seq=10322595 Ack=188452679 Win=65535 Len=0
1,5.920900999999503,62.210.85.178,10.0.2.15,TCP,60,9001  >  35978 [ACK] Seq=10322595 Ack=188454139 Win=65535 Len=0
1,5.920904999999948,62.210.85.178,10.0.2.15,TCP,60,9001  >  35978 [ACK] Seq=10322595 Ack=188455289 Win=65535 Len=0
1,5.920951999999488,10.0.2.15,62.210.85.178,TLSv1.2,4124,Application Data
1,5.9210809999995035,62.210.85.178,10.0.2.15,TCP,60,9001  >  35978 [ACK] Seq=10322595 Ack=188456749 Win=65535 Len=0
1,5.921090999999251,62.210.85.178,10.0.2.15,TCP,60,9001  >  35978 [ACK] Seq=10322595 Ack=188458209 Win=65535 Len=0
1,5.921093999999357,62.210.85.178,10.0.2.15,TCP,60,9001  >  35978 [ACK] Seq=10322595 Ack=188459359 Win=65535 Len=0
1,5.921144999999342,10.0.2.15,62.210.85.178,TLSv1.2,4124,Application Data
1,5.921188999999686,62.210.85.178,10.0.2.15,TCP,60,9001  >  35978 [ACK] Seq=10322595 Ack=188460819 Win=65535 Len=0
1,5.921196999999665,62.210.85.178,10.0.2.15,TCP,60,9001  >  35978 [ACK] Seq=10322595 Ack=188462279 Win=65535 Len=0
1,5.921200999999201,62.210.85.178,10.0.2.15,TCP,60,9001  >  35978 [ACK] Seq=10322595 Ack=188463429 Win=65535 Len=0
1,5.921237999999903,10.0.2.15,62.210.85.178,TLSv1.2,4124,Application Data
1,5.921276000000034,62.210.85.178,10.0.2.15,TCP,60,9001  >  35978 [ACK] Seq=10322595 Ack=188464889 Win=65535 Len=0
1,5.921284999999443,62.210.85.178,10.0.2.15,TCP,60,9001  >  35978 [ACK] Seq=10322595 Ack=188466349 Win=65535 Len=0
1,5.921288999999888,62.210.85.178,10.0.2.15,TCP,60,9001  >  35978 [ACK] Seq=10322595 Ack=188467499 Win=65535 Len=0
1,5.921323999999913,10.0.2.15,62.210.85.178,TLSv1.2,332,Application Data
1,5.921359999999368,62.210.85.178,10.0.2.15,TCP,60,9001  >  35978 [ACK] Seq=10322595 Ack=188467777 Win=65535 Len=0
1,5.921413999999459,10.0.2.15,62.210.85.178,TLSv1.2,3868,Application Data
1,5.921452999999929,62.210.85.178,10.0.2.15,TCP,60,9001  >  35978 [ACK] Seq=10322595 Ack=188469237 Win=65535 Len=0
1,5.921460999999908,62.210.85.178,10.0.2.15,TCP,60,9001  >  35978 [ACK] Seq=10322595 Ack=188470697 Win=65535 Len=0
1,5.921466999999211,62.210.85.178,10.0.2.15,TCP,60,9001  >  35978 [ACK] Seq=10322595 Ack=188471591 Win=65535 Len=0
1,5.921507999999449,10.0.2.15,62.210.85.178,TLSv1.2,4124,Application Data
1,5.92154599999958,62.210.85.178,10.0.2.15,TCP,60,9001  >  35978 [ACK] Seq=10322595 Ack=188473051 Win=65535 Len=0
1,5.92155399999956,62.210.85.178,10.0.2.15,TCP,60,9001  >  35978 [ACK] Seq=10322595 Ack=188474511 Win=65535 Len=0
1,5.9215580000000045,62.210.85.178,10.0.2.15,TCP,60,9001  >  35978 [ACK] Seq=10322595 Ack=188475661 Win=65535 Len=0
1,5.92159300000003,10.0.2.15,62.210.85.178,TLSv1.2,3030,Application Data
1,5.921632999999929,62.210.85.178,10.0.2.15,TCP,60,9001  >  35978 [ACK] Seq=10322595 Ack=188477121 Win=65535 Len=0
1,5.92163999999957,62.210.85.178,10.0.2.15,TCP,60,9001  >  35978 [ACK] Seq=10322595 Ack=188478581 Win=65535 Len=0
1,5.921644000000015,62.210.85.178,10.0.2.15,TCP,60,9001  >  35978 [ACK] Seq=10322595 Ack=188478637 Win=65535 Len=0
1,5.935273999999481,10.0.2.15,62.210.85.178,TLSv1.2,4124,Application Data
1,5.935376999999789,62.210.85.178,10.0.2.15,TCP,60,9001  >  35978 [ACK] Seq=10322595 Ack=188480097 Win=65535 Len=0
1,5.935389999999643,62.210.85.178,10.0.2.15,TCP,60,9001  >  35978 [ACK] Seq=10322595 Ack=188481557 Win=65535 Len=0
1,5.935392999999749,62.210.85.178,10.0.2.15,TCP,60,9001  >  35978 [ACK] Seq=10322595 Ack=188482707 Win=65535 Len=0
1,5.935434999999416,10.0.2.15,62.210.85.178,TLSv1.2,2710,Application Data
1,5.9354709999997795,62.210.85.178,10.0.2.15,TCP,60,9001  >  35978 [ACK] Seq=10322595 Ack=188484167 Win=65535 Len=0
1,5.935478999999759,62.210.85.178,10.0.2.15,TCP,60,9001  >  35978 [ACK] Seq=10322595 Ack=188485363 Win=65535 Len=0
1,6.001913000000059,54.93.77.70,10.0.2.15,TLSv1.2,590,Application Data
1,6.014862999999423,54.93.77.70,10.0.2.15,TCP,2950,"9001  >  34692 [PSH, ACK] Seq=188289935 Ack=10367191 Win=65535 Len=2896 [TCP segment of a reassembled PDU]"
1,6.0149759999994785,10.0.2.15,54.93.77.70,TCP,54,34692  >  9001 [ACK] Seq=10367191 Ack=188292831 Win=65535 Len=0
1,6.024529999999686,54.93.77.70,10.0.2.15,TLSv1.2,2950,Application Data [TCP segment of a reassembled PDU]
1,6.024574999999459,10.0.2.15,54.93.77.70,TCP,54,34692  >  9001 [ACK] Seq=10367191 Ack=188295727 Win=65535 Len=0
1,6.02636799999982,54.93.77.70,10.0.2.15,TLSv1.2,1502,Application Data
1,6.0264119999992545,10.0.2.15,54.93.77.70,TCP,54,34692  >  9001 [ACK] Seq=10367191 Ack=188297175 Win=65535 Len=0
1,6.032880999999179,54.93.77.70,10.0.2.15,TLSv1.2,3674,Application Data
1,6.032964999999422,10.0.2.15,54.93.77.70,TCP,54,34692  >  9001 [ACK] Seq=10367191 Ack=188300795 Win=65535 Len=0
1,6.033175999999912,10.0.2.15,54.93.77.70,TLSv1.2,590,Application Data
1,6.033289999999397,54.93.77.70,10.0.2.15,TCP,60,9001  >  34692 [ACK] Seq=188300795 Ack=10367727 Win=65535 Len=0
1,6.050137999999606,54.93.77.70,10.0.2.15,TLSv1.2,1104,Application Data
1,6.052037999999811,54.93.77.70,10.0.2.15,TCP,2950,"9001  >  34692 [PSH, ACK] Seq=188301845 Ack=10367727 Win=65535 Len=2896 [TCP segment of a reassembled PDU]"
1,6.052103999999417,10.0.2.15,54.93.77.70,TCP,54,34692  >  9001 [ACK] Seq=10367727 Ack=188304741 Win=65535 Len=0
1,6.0674419999995735,54.93.77.70,10.0.2.15,TLSv1.2,2950,Application Data [TCP segment of a reassembled PDU]
1,6.067489999999452,10.0.2.15,54.93.77.70,TCP,54,34692  >  9001 [ACK] Seq=10367727 Ack=188307637 Win=65535 Len=0
1,6.068082999999206,54.93.77.70,10.0.2.15,TLSv1.2,2950,Application Data [TCP segment of a reassembled PDU]
1,6.068126999999549,10.0.2.15,54.93.77.70,TCP,54,34692  >  9001 [ACK] Seq=10367727 Ack=188310533 Win=65535 Len=0
1,6.068455999999969,54.93.77.70,10.0.2.15,TLSv1.2,2740,Application Data
1,6.068496999999297,10.0.2.15,54.93.77.70,TCP,54,34692  >  9001 [ACK] Seq=10367727 Ack=188313219 Win=65535 Len=0
1,6.090382999999747,54.93.77.70,10.0.2.15,TLSv1.2,3160,Application Data
1,6.090467999999419,10.0.2.15,54.93.77.70,TCP,54,34692  >  9001 [ACK] Seq=10367727 Ack=188316325 Win=65535 Len=0
1,6.090619999999944,10.0.2.15,54.93.77.70,TLSv1.2,590,Application Data
1,6.090686999999889,54.93.77.70,10.0.2.15,TCP,60,9001  >  34692 [ACK] Seq=188316325 Ack=10368263 Win=65535 Len=0
1,6.108578999999736,54.93.77.70,10.0.2.15,TLSv1.2,7808,"Application Data, Application Data"
1,6.108690999999453,10.0.2.15,54.93.77.70,TCP,54,34692  >  9001 [ACK] Seq=10368263 Ack=188324079 Win=65535 Len=0
1,6.120654999999715,54.93.77.70,10.0.2.15,TCP,2950,"9001  >  34692 [PSH, ACK] Seq=188324079 Ack=10368263 Win=65535 Len=2896 [TCP segment of a reassembled PDU]"
1,6.120712999999341,10.0.2.15,54.93.77.70,TCP,54,34692  >  9001 [ACK] Seq=10368263 Ack=188326975 Win=65535 Len=0
1,6.125080999999227,54.93.77.70,10.0.2.15,TLSv1.2,1314,"Application Data, Application Data"
1,6.130033999999796,54.93.77.70,10.0.2.15,TLSv1.2,4398,Application Data
1,6.13010899999972,10.0.2.15,54.93.77.70,TCP,54,34692  >  9001 [ACK] Seq=10368263 Ack=188332579 Win=65535 Len=0
1,6.14133799999945,54.93.77.70,10.0.2.15,TLSv1.2,7294,"Application Data, Application Data"
1,6.141452999999274,10.0.2.15,54.93.77.70,TCP,54,34692  >  9001 [ACK] Seq=10368263 Ack=188339819 Win=65535 Len=0
1,6.146293999999216,54.93.77.70,10.0.2.15,TLSv1.2,1408,Application Data
1,6.146504999999706,10.0.2.15,54.93.77.70,TLSv1.2,590,Application Data
1,6.14661199999955,54.93.77.70,10.0.2.15,TCP,60,9001  >  34692 [ACK] Seq=188341173 Ack=10368799 Win=65535 Len=0
1,6.152239000000009,54.93.77.70,10.0.2.15,TLSv1.2,7294,Application Data
1,6.15225399999963,62.210.85.178,10.0.2.15,TLSv1.2,590,Application Data
1,6.1523929999993925,10.0.2.15,54.93.77.70,TCP,54,34692  >  9001 [ACK] Seq=10368799 Ack=188348413 Win=65535 Len=0
1,6.162476999999853,54.93.77.70,10.0.2.15,TLSv1.2,1104,"Application Data, Application Data"
1,6.194257999999536,10.0.2.15,62.210.85.178,TCP,54,35978  >  9001 [ACK] Seq=188485363 Ack=10323131 Win=65535 Len=0
1,6.2062529999993785,10.0.2.15,54.93.77.70,TCP,54,34692  >  9001 [ACK] Seq=10368799 Ack=188349463 Win=65535 Len=0
1,6.221048999999766,62.210.85.178,10.0.2.15,TLSv1.2,590,Application Data
1,6.221096999999645,10.0.2.15,62.210.85.178,TCP,54,35978  >  9001 [ACK] Seq=188485363 Ack=10323667 Win=65535 Len=0
1,6.221880999999485,54.93.77.70,10.0.2.15,TLSv1.2,1104,Application Data
1,6.222028999999566,10.0.2.15,54.93.77.70,TLSv1.2,590,Application Data
1,6.222105999999258,54.93.77.70,10.0.2.15,TCP,60,9001  >  34692 [ACK] Seq=188350513 Ack=10369335 Win=65535 Len=0
1,6.238106999999218,54.93.77.70,10.0.2.15,TLSv1.2,1104,Application Data
1,6.241805999999997,10.0.2.15,54.93.77.70,TLSv1.2,590,Application Data
1,6.242023999999219,54.93.77.70,10.0.2.15,TCP,60,9001  >  34692 [ACK] Seq=188351563 Ack=10369871 Win=65535 Len=0
1,6.267229000000043,62.210.85.178,10.0.2.15,TLSv1.2,590,Application Data
1,6.267304999999396,10.0.2.15,62.210.85.178,TCP,54,35978  >  9001 [ACK] Seq=188485363 Ack=10324203 Win=65535 Len=0
1,6.7456279999996696,62.210.85.178,10.0.2.15,TLSv1.2,1104,Application Data
1,6.745708999999806,10.0.2.15,62.210.85.178,TCP,54,35978  >  9001 [ACK] Seq=188485363 Ack=10325253 Win=65535 Len=0
1,6.746223999999529,10.0.2.15,62.210.85.178,TLSv1.2,590,Application Data
1,6.746444999999767,62.210.85.178,10.0.2.15,TCP,60,9001  >  35978 [ACK] Seq=10325253 Ack=188485899 Win=65535 Len=0
1,6.951127999999699,54.93.77.70,10.0.2.15,TLSv1.2,590,Application Data
1,6.951558999999179,10.0.2.15,54.93.77.70,TLSv1.2,590,Application Data
1,6.951657999999952,54.93.77.70,10.0.2.15,TCP,60,9001  >  34692 [ACK] Seq=188352099 Ack=10370407 Win=65535 Len=0
1,7.154890999999225,62.210.85.178,10.0.2.15,TLSv1.2,590,Application Data
1,7.1610609999997905,10.0.2.15,62.210.85.178,TLSv1.2,590,Application Data
1,7.1616099999992,62.210.85.178,10.0.2.15,TCP,60,9001  >  35978 [ACK] Seq=10325789 Ack=188486435 Win=65535 Len=0
1,7.170919999999569,10.0.2.15,62.210.85.178,TLSv1.2,4124,Application Data
1,7.171334999999999,62.210.85.178,10.0.2.15,TCP,60,9001  >  35978 [ACK] Seq=10325789 Ack=188487895 Win=65535 Len=0
1,7.171351999999388,62.210.85.178,10.0.2.15,TCP,60,9001  >  35978 [ACK] Seq=10325789 Ack=188489355 Win=65535 Len=0
1,7.171354999999494,62.210.85.178,10.0.2.15,TCP,60,9001  >  35978 [ACK] Seq=10325789 Ack=188490505 Win=65535 Len=0
1,7.171428999999989,10.0.2.15,62.210.85.178,TLSv1.2,4124,Application Data
1,7.1715299999996205,62.210.85.178,10.0.2.15,TCP,60,9001  >  35978 [ACK] Seq=10325789 Ack=188491965 Win=65535 Len=0
1,7.1715379999996,62.210.85.178,10.0.2.15,TCP,60,9001  >  35978 [ACK] Seq=10325789 Ack=188493425 Win=65535 Len=0
1,7.171540999999706,62.210.85.178,10.0.2.15,TCP,60,9001  >  35978 [ACK] Seq=10325789 Ack=188494575 Win=65535 Len=0
1,7.171566999999413,10.0.2.15,62.210.85.178,TCP,2974,35978  >  9001 [ACK] Seq=188494575 Ack=10325789 Win=65535 Len=2920 [TCP segment of a reassembled PDU]
1,7.171636000000035,62.210.85.178,10.0.2.15,TCP,60,9001  >  35978 [ACK] Seq=10325789 Ack=188496035 Win=65535 Len=0
1,7.171644999999444,62.210.85.178,10.0.2.15,TCP,60,9001  >  35978 [ACK] Seq=10325789 Ack=188497495 Win=65535 Len=0
1,7.17167900000004,10.0.2.15,62.210.85.178,TLSv1.2,1204,Application Data
1,7.171748999999181,62.210.85.178,10.0.2.15,TCP,60,9001  >  35978 [ACK] Seq=10325789 Ack=188498645 Win=65535 Len=0
1,7.171804999999949,10.0.2.15,62.210.85.178,TLSv1.2,4124,Application Data
1,7.171871999999894,62.210.85.178,10.0.2.15,TCP,60,9001  >  35978 [ACK] Seq=10325789 Ack=188500105 Win=65535 Len=0
1,7.171880999999303,62.210.85.178,10.0.2.15,TCP,60,9001  >  35978 [ACK] Seq=10325789 Ack=188501565 Win=65535 Len=0
1,7.171883999999409,62.210.85.178,10.0.2.15,TCP,60,9001  >  35978 [ACK] Seq=10325789 Ack=188502715 Win=65535 Len=0
1,7.171930999999859,10.0.2.15,62.210.85.178,TLSv1.2,332,Application Data
1,7.171970999999758,62.210.85.178,10.0.2.15,TCP,60,9001  >  35978 [ACK] Seq=10325789 Ack=188502993 Win=65535 Len=0
1,7.172040999999808,10.0.2.15,62.210.85.178,TLSv1.2,3868,Application Data
1,7.17207899999994,62.210.85.178,10.0.2.15,TCP,60,9001  >  35978 [ACK] Seq=10325789 Ack=188504453 Win=65535 Len=0
1,7.1720879999993485,62.210.85.178,10.0.2.15,TCP,60,9001  >  35978 [ACK] Seq=10325789 Ack=188505913 Win=65535 Len=0
1,7.172091999999793,62.210.85.178,10.0.2.15,TCP,60,9001  >  35978 [ACK] Seq=10325789 Ack=188506807 Win=65535 Len=0
1,7.172130999999354,10.0.2.15,62.210.85.178,TLSv1.2,4124,Application Data
1,7.172168000000056,62.210.85.178,10.0.2.15,TCP,60,9001  >  35978 [ACK] Seq=10325789 Ack=188508267 Win=65535 Len=0
1,7.172176000000036,62.210.85.178,10.0.2.15,TCP,60,9001  >  35978 [ACK] Seq=10325789 Ack=188509727 Win=65535 Len=0
1,7.172179999999571,62.210.85.178,10.0.2.15,TCP,60,9001  >  35978 [ACK] Seq=10325789 Ack=188510877 Win=65535 Len=0
1,7.172215999999935,10.0.2.15,62.210.85.178,TLSv1.2,3030,Application Data
1,7.172254999999495,62.210.85.178,10.0.2.15,TCP,60,9001  >  35978 [ACK] Seq=10325789 Ack=188512337 Win=65535 Len=0
1,7.172262999999475,62.210.85.178,10.0.2.15,TCP,60,9001  >  35978 [ACK] Seq=10325789 Ack=188513797 Win=65535 Len=0
1,7.172265999999581,62.210.85.178,10.0.2.15,TCP,60,9001  >  35978 [ACK] Seq=10325789 Ack=188513853 Win=65535 Len=0
1,7.181482999999389,10.0.2.15,62.210.85.178,TLSv1.2,4124,Application Data
1,7.18153699999948,62.210.85.178,10.0.2.15,TCP,60,9001  >  35978 [ACK] Seq=10325789 Ack=188515313 Win=65535 Len=0
1,7.1815489999999045,62.210.85.178,10.0.2.15,TCP,60,9001  >  35978 [ACK] Seq=10325789 Ack=188516773 Win=65535 Len=0
1,7.181553999999778,62.210.85.178,10.0.2.15,TCP,60,9001  >  35978 [ACK] Seq=10325789 Ack=188517923 Win=65535 Len=0
1,7.181597999999212,10.0.2.15,62.210.85.178,TLSv1.2,4124,Application Data
1,7.18163899999945,62.210.85.178,10.0.2.15,TCP,60,9001  >  35978 [ACK] Seq=10325789 Ack=188519383 Win=65535 Len=0
1,7.181647999999768,62.210.85.178,10.0.2.15,TCP,60,9001  >  35978 [ACK] Seq=10325789 Ack=188520843 Win=65535 Len=0
1,7.181652999999642,62.210.85.178,10.0.2.15,TCP,60,9001  >  35978 [ACK] Seq=10325789 Ack=188521993 Win=65535 Len=0
1,7.1816939999998795,10.0.2.15,62.210.85.178,TLSv1.2,4124,Application Data
1,7.181739999999991,62.210.85.178,10.0.2.15,TCP,60,9001  >  35978 [ACK] Seq=10325789 Ack=188523453 Win=65535 Len=0
1,7.1817479999999705,62.210.85.178,10.0.2.15,TCP,60,9001  >  35978 [ACK] Seq=10325789 Ack=188524913 Win=65535 Len=0
1,7.181751999999506,62.210.85.178,10.0.2.15,TCP,60,9001  >  35978 [ACK] Seq=10325789 Ack=188526063 Win=65535 Len=0
1,7.1817879999998695,10.0.2.15,62.210.85.178,TLSv1.2,4124,Application Data
1,7.18182699999943,62.210.85.178,10.0.2.15,TCP,60,9001  >  35978 [ACK] Seq=10325789 Ack=188527523 Win=65535 Len=0
1,7.181835999999748,62.210.85.178,10.0.2.15,TCP,60,9001  >  35978 [ACK] Seq=10325789 Ack=188528983 Win=65535 Len=0
1,7.181840999999622,62.210.85.178,10.0.2.15,TCP,60,9001  >  35978 [ACK] Seq=10325789 Ack=188530133 Win=65535 Len=0
1,7.181876999999986,10.0.2.15,62.210.85.178,TLSv1.2,332,Application Data
1,7.181913999999779,62.210.85.178,10.0.2.15,TCP,60,9001  >  35978 [ACK] Seq=10325789 Ack=188530411 Win=65535 Len=0
1,7.181970999999976,10.0.2.15,62.210.85.178,TLSv1.2,3868,Application Data
1,7.182010999999875,62.210.85.178,10.0.2.15,TCP,60,9001  >  35978 [ACK] Seq=10325789 Ack=188531871 Win=65535 Len=0
1,7.182018999999855,62.210.85.178,10.0.2.15,TCP,60,9001  >  35978 [ACK] Seq=10325789 Ack=188533331 Win=65535 Len=0
1,7.18202299999939,62.210.85.178,10.0.2.15,TCP,60,9001  >  35978 [ACK] Seq=10325789 Ack=188534225 Win=65535 Len=0
1,7.182065999999395,10.0.2.15,62.210.85.178,TLSv1.2,4124,Application Data
1,7.182112999999845,62.210.85.178,10.0.2.15,TCP,60,9001  >  35978 [ACK] Seq=10325789 Ack=188535685 Win=65535 Len=0
1,7.182119000000057,62.210.85.178,10.0.2.15,TCP,60,9001  >  35978 [ACK] Seq=10325789 Ack=188537145 Win=65535 Len=0
1,7.182121999999254,62.210.85.178,10.0.2.15,TCP,60,9001  >  35978 [ACK] Seq=10325789 Ack=188538295 Win=65535 Len=0
1,7.182156999999279,10.0.2.15,62.210.85.178,TLSv1.2,3030,Application Data
1,7.182214999999815,62.210.85.178,10.0.2.15,TCP,60,9001  >  35978 [ACK] Seq=10325789 Ack=188539755 Win=65535 Len=0
1,7.182224999999562,62.210.85.178,10.0.2.15,TCP,60,9001  >  35978 [ACK] Seq=10325789 Ack=188541215 Win=65535 Len=0
1,7.182227999999668,62.210.85.178,10.0.2.15,TCP,60,9001  >  35978 [ACK] Seq=10325789 Ack=188541271 Win=65535 Len=0
1,7.19477199999983,10.0.2.15,62.210.85.178,TLSv1.2,4124,Application Data
1,7.19482699999935,62.210.85.178,10.0.2.15,TCP,60,9001  >  35978 [ACK] Seq=10325789 Ack=188542731 Win=65535 Len=0
1,7.194837999999436,62.210.85.178,10.0.2.15,TCP,60,9001  >  35978 [ACK] Seq=10325789 Ack=188544191 Win=65535 Len=0
1,7.1948429999993095,62.210.85.178,10.0.2.15,TCP,60,9001  >  35978 [ACK] Seq=10325789 Ack=188545341 Win=65535 Len=0
1,7.194888999999421,10.0.2.15,62.210.85.178,TLSv1.2,4124,Application Data
1,7.194929999999658,62.210.85.178,10.0.2.15,TCP,60,9001  >  35978 [ACK] Seq=10325789 Ack=188546801 Win=65535 Len=0
1,7.194937999999638,62.210.85.178,10.0.2.15,TCP,60,9001  >  35978 [ACK] Seq=10325789 Ack=188548261 Win=65535 Len=0
1,7.194941999999173,62.210.85.178,10.0.2.15,TCP,60,9001  >  35978 [ACK] Seq=10325789 Ack=188549411 Win=65535 Len=0
1,7.194982999999411,10.0.2.15,62.210.85.178,TLSv1.2,4124,Application Data
1,7.195021999999881,62.210.85.178,10.0.2.15,TCP,60,9001  >  35978 [ACK] Seq=10325789 Ack=188550871 Win=65535 Len=0
1,7.195029999999861,62.210.85.178,10.0.2.15,TCP,60,9001  >  35978 [ACK] Seq=10325789 Ack=188552331 Win=65535 Len=0
1,7.195034999999734,62.210.85.178,10.0.2.15,TCP,60,9001  >  35978 [ACK] Seq=10325789 Ack=188553481 Win=65535 Len=0
1,7.195073999999295,10.0.2.15,62.210.85.178,TLSv1.2,4124,Application Data
1,7.195112999999765,62.210.85.178,10.0.2.15,TCP,60,9001  >  35978 [ACK] Seq=10325789 Ack=188554941 Win=65535 Len=0
1,7.1951209999997445,62.210.85.178,10.0.2.15,TCP,60,9001  >  35978 [ACK] Seq=10325789 Ack=188556401 Win=65535 Len=0
1,7.195125999999618,62.210.85.178,10.0.2.15,TCP,60,9001  >  35978 [ACK] Seq=10325789 Ack=188557551 Win=65535 Len=0
1,7.1951609999996435,10.0.2.15,62.210.85.178,TLSv1.2,332,Application Data
1,7.195197000000007,62.210.85.178,10.0.2.15,TCP,60,9001  >  35978 [ACK] Seq=10325789 Ack=188557829 Win=65535 Len=0
1,7.195248999999421,10.0.2.15,62.210.85.178,TLSv1.2,3868,Application Data
1,7.195287999999891,62.210.85.178,10.0.2.15,TCP,60,9001  >  35978 [ACK] Seq=10325789 Ack=188559289 Win=65535 Len=0
1,7.195295999999871,62.210.85.178,10.0.2.15,TCP,60,9001  >  35978 [ACK] Seq=10325789 Ack=188560749 Win=65535 Len=0
1,7.195299999999406,62.210.85.178,10.0.2.15,TCP,60,9001  >  35978 [ACK] Seq=10325789 Ack=188561643 Win=65535 Len=0
1,7.195336999999199,10.0.2.15,62.210.85.178,TLSv1.2,2452,Application Data
1,7.195375999999669,62.210.85.178,10.0.2.15,TCP,60,9001  >  35978 [ACK] Seq=10325789 Ack=188563103 Win=65535 Len=0
1,7.19538299999931,62.210.85.178,10.0.2.15,TCP,60,9001  >  35978 [ACK] Seq=10325789 Ack=188564041 Win=65535 Len=0
1,7.2656499999993684,54.93.77.70,10.0.2.15,TLSv1.2,590,Application Data
1,7.283403999999791,54.93.77.70,10.0.2.15,TCP,2950,"9001  >  34692 [PSH, ACK] Seq=188352635 Ack=10370407 Win=65535 Len=2896 [TCP segment of a reassembled PDU]"
1,7.283510999999635,10.0.2.15,54.93.77.70,TCP,54,34692  >  9001 [ACK] Seq=10370407 Ack=188355531 Win=65535 Len=0
1,7.295767999999953,54.93.77.70,10.0.2.15,TLSv1.2,2950,Application Data [TCP segment of a reassembled PDU]
1,7.295844999999645,54.93.77.70,10.0.2.15,TCP,1474,9001  >  34692 [ACK] Seq=188358427 Ack=10370407 Win=65535 Len=1420 [TCP segment of a reassembled PDU]
1,7.295876999999564,10.0.2.15,54.93.77.70,TCP,54,34692  >  9001 [ACK] Seq=10370407 Ack=188358427 Win=65535 Len=0
1,7.29592699999921,54.93.77.70,10.0.2.15,TLSv1.2,82,Application Data
1,7.295980999999301,10.0.2.15,54.93.77.70,TCP,54,34692  >  9001 [ACK] Seq=10370407 Ack=188359875 Win=65535 Len=0
1,7.30700699999943,54.93.77.70,10.0.2.15,TLSv1.2,4210,"Application Data, Application Data"
1,7.307067999999163,10.0.2.15,54.93.77.70,TCP,54,34692  >  9001 [ACK] Seq=10370407 Ack=188364031 Win=65535 Len=0
1,7.318628999999419,54.93.77.70,10.0.2.15,TCP,2950,"9001  >  34692 [PSH, ACK] Seq=188364031 Ack=10370407 Win=65535 Len=2896 [TCP segment of a reassembled PDU]"
1,7.318688999999722,10.0.2.15,54.93.77.70,TCP,54,34692  >  9001 [ACK] Seq=10370407 Ack=188366927 Win=65535 Len=0
1,7.324767999999494,54.93.77.70,10.0.2.15,TLSv1.2,778,Application Data
1,7.32643299999927,54.93.77.70,10.0.2.15,TCP,2950,"9001  >  34692 [PSH, ACK] Seq=188367651 Ack=10370407 Win=65535 Len=2896 [TCP segment of a reassembled PDU]"
1,7.326474999999846,10.0.2.15,54.93.77.70,TCP,54,34692  >  9001 [ACK] Seq=10370407 Ack=188370547 Win=65535 Len=0
1,7.3375599999999395,54.93.77.70,10.0.2.15,TLSv1.2,5846,"Application Data, Application Data"
1,7.337589999999182,54.93.77.70,10.0.2.15,TLSv1.2,4398,Application Data [TCP segment of a reassembled PDU]
1,7.337686999999278,10.0.2.15,54.93.77.70,TCP,54,34692  >  9001 [ACK] Seq=10370407 Ack=188380683 Win=65535 Len=0
1,7.337988999999652,10.0.2.15,54.93.77.70,TLSv1.2,590,Application Data
1,7.338072999999895,54.93.77.70,10.0.2.15,TCP,60,9001  >  34692 [ACK] Seq=188380683 Ack=10370943 Win=65535 Len=0
1,7.34285699999964,54.93.77.70,10.0.2.15,TLSv1.2,474,Application Data
1,7.374024999999165,54.93.77.70,10.0.2.15,TCP,2950,"9001  >  34692 [PSH, ACK] Seq=188381103 Ack=10370943 Win=65535 Len=2896 [TCP segment of a reassembled PDU]"
1,7.374092000000019,10.0.2.15,54.93.77.70,TCP,54,34692  >  9001 [ACK] Seq=10370943 Ack=188383999 Win=65535 Len=0
1,7.393506999999772,54.93.77.70,10.0.2.15,TLSv1.2,778,Application Data
1,7.420617999999195,54.93.77.70,10.0.2.15,TCP,2950,"9001  >  34692 [PSH, ACK] Seq=188384723 Ack=10370943 Win=65535 Len=2896 [TCP segment of a reassembled PDU]"
1,7.4206679999997505,10.0.2.15,54.93.77.70,TCP,54,34692  >  9001 [ACK] Seq=10370943 Ack=188387619 Win=65535 Len=0
1,7.433639999999286,54.93.77.70,10.0.2.15,TLSv1.2,2950,Application Data [TCP segment of a reassembled PDU]
1,7.433685999999398,10.0.2.15,54.93.77.70,TCP,54,34692  >  9001 [ACK] Seq=10370943 Ack=188390515 Win=65535 Len=0
1,7.434009999999944,54.93.77.70,10.0.2.15,TLSv1.2,1502,Application Data
1,7.434064999999464,10.0.2.15,54.93.77.70,TCP,54,34692  >  9001 [ACK] Seq=10370943 Ack=188391963 Win=65535 Len=0
1,7.445561999999882,54.93.77.70,10.0.2.15,TLSv1.2,8858,"Application Data, Application Data, Application Data"
1,7.445682999999917,10.0.2.15,54.93.77.70,TCP,54,34692  >  9001 [ACK] Seq=10370943 Ack=188400767 Win=65535 Len=0
1,7.456695999999283,54.93.77.70,10.0.2.15,TCP,2950,"9001  >  34692 [PSH, ACK] Seq=188400767 Ack=10370943 Win=65535 Len=2896 [TCP segment of a reassembled PDU]"
1,7.45677699999942,10.0.2.15,54.93.77.70,TCP,54,34692  >  9001 [ACK] Seq=10370943 Ack=188403663 Win=65535 Len=0
1,7.46260699999948,54.93.77.70,10.0.2.15,TLSv1.2,264,Application Data
1,7.462777999999162,10.0.2.15,54.93.77.70,TLSv1.2,1104,Application Data
1,7.462865999999849,54.93.77.70,10.0.2.15,TCP,60,9001  >  34692 [ACK] Seq=188403873 Ack=10371993 Win=65535 Len=0
1,7.464310999999725,54.93.77.70,10.0.2.15,TLSv1.2,5846,Application Data
1,7.464373999999225,10.0.2.15,54.93.77.70,TCP,54,34692  >  9001 [ACK] Seq=10371993 Ack=188409665 Win=65535 Len=0
1,7.475886999999602,54.93.77.70,10.0.2.15,TLSv1.2,7294,"Application Data, Application Data"
1,7.475942999999461,10.0.2.15,54.93.77.70,TCP,54,34692  >  9001 [ACK] Seq=10371993 Ack=188416905 Win=65535 Len=0
1,7.479402999999365,54.93.77.70,10.0.2.15,TLSv1.2,988,Application Data
1,7.496894999999313,54.93.77.70,10.0.2.15,TLSv1.2,5846,Application Data
1,7.496936999999889,54.93.77.70,10.0.2.15,TLSv1.2,5846,Application Data [TCP segment of a reassembled PDU]
1,7.497011999999813,10.0.2.15,54.93.77.70,TCP,54,34692  >  9001 [ACK] Seq=10371993 Ack=188423631 Win=65535 Len=0
1,7.497125999999298,10.0.2.15,54.93.77.70,TCP,54,34692  >  9001 [ACK] Seq=10371993 Ack=188429423 Win=65535 Len=0
1,7.514832999999271,54.93.77.70,10.0.2.15,TLSv1.2,894,"Application Data, Application Data"
1,7.5150299999995696,10.0.2.15,54.93.77.70,TLSv1.2,590,Application Data
1,7.515147999999499,54.93.77.70,10.0.2.15,TCP,60,9001  >  34692 [ACK] Seq=188430263 Ack=10372529 Win=65535 Len=0
1,7.523121999999603,10.0.2.15,54.93.77.70,TLSv1.2,590,Application Data
1,7.523314999999457,54.93.77.70,10.0.2.15,TCP,60,9001  >  34692 [ACK] Seq=188430263 Ack=10373065 Win=65535 Len=0
1,7.530551999999261,62.210.85.178,10.0.2.15,TLSv1.2,590,Application Data
1,7.562690999999177,62.210.85.178,10.0.2.15,TLSv1.2,1104,Application Data
1,7.562780999999632,10.0.2.15,62.210.85.178,TCP,54,35978  >  9001 [ACK] Seq=188564041 Ack=10327375 Win=65535 Len=0
1,7.639516999999614,62.210.85.178,10.0.2.15,TLSv1.2,590,Application Data
1,7.682315000000017,10.0.2.15,62.210.85.178,TCP,54,35978  >  9001 [ACK] Seq=188564041 Ack=10327911 Win=65535 Len=0
1,7.6977429999997184,62.210.85.178,10.0.2.15,TLSv1.2,590,Application Data
1,7.697838000000047,10.0.2.15,62.210.85.178,TCP,54,35978  >  9001 [ACK] Seq=188564041 Ack=10328447 Win=65535 Len=0
1,7.698410999999396,10.0.2.15,62.210.85.178,TLSv1.2,590,Application Data
1,7.698667999999998,62.210.85.178,10.0.2.15,TCP,60,9001  >  35978 [ACK] Seq=10328447 Ack=188564577 Win=65535 Len=0
1,7.8716739999999845,54.93.77.70,10.0.2.15,TLSv1.2,590,Application Data
1,7.87213199999951,10.0.2.15,54.93.77.70,TLSv1.2,590,Application Data
1,7.872267999999167,54.93.77.70,10.0.2.15,TCP,60,9001  >  34692 [ACK] Seq=188430799 Ack=10373601 Win=65535 Len=0
1,7.972759999999653,62.210.85.178,10.0.2.15,TLSv1.2,590,Application Data
1,7.9782789999999295,10.0.2.15,62.210.85.178,TLSv1.2,590,Application Data
1,7.978472999999212,62.210.85.178,10.0.2.15,TCP,60,9001  >  35978 [ACK] Seq=10328983 Ack=188565113 Win=65535 Len=0
1,7.990893999999571,10.0.2.15,62.210.85.178,TLSv1.2,4124,Application Data
1,7.9910119999995,10.0.2.15,62.210.85.178,TCP,2974,35978  >  9001 [ACK] Seq=188569183 Ack=10328983 Win=65535 Len=2920 [TCP segment of a reassembled PDU]
1,7.9910549999995055,62.210.85.178,10.0.2.15,TCP,60,9001  >  35978 [ACK] Seq=10328983 Ack=188566573 Win=65535 Len=0
1,7.991064999999253,62.210.85.178,10.0.2.15,TCP,60,9001  >  35978 [ACK] Seq=10328983 Ack=188568033 Win=65535 Len=0
1,7.991070000000036,62.210.85.178,10.0.2.15,TCP,60,9001  >  35978 [ACK] Seq=10328983 Ack=188569183 Win=65535 Len=0
1,7.991073999999571,62.210.85.178,10.0.2.15,TCP,60,9001  >  35978 [ACK] Seq=10328983 Ack=188570643 Win=65535 Len=0
1,7.991115999999238,10.0.2.15,62.210.85.178,TLSv1.2,1204,Application Data
1,7.991154999999708,62.210.85.178,10.0.2.15,TCP,60,9001  >  35978 [ACK] Seq=10328983 Ack=188572103 Win=65535 Len=0
1,7.991209999999228,62.210.85.178,10.0.2.15,TCP,60,9001  >  35978 [ACK] Seq=10328983 Ack=188573253 Win=65535 Len=0
1,7.991247999999359,10.0.2.15,62.210.85.178,TLSv1.2,4124,Application Data
1,7.991312999999536,10.0.2.15,62.210.85.178,TCP,2974,35978  >  9001 [ACK] Seq=188577323 Ack=10328983 Win=65535 Len=2920 [TCP segment of a reassembled PDU]
1,7.991352999999435,62.210.85.178,10.0.2.15,TCP,60,9001  >  35978 [ACK] Seq=10328983 Ack=188574713 Win=65535 Len=0
1,7.9913589999996475,62.210.85.178,10.0.2.15,TCP,60,9001  >  35978 [ACK] Seq=10328983 Ack=188576173 Win=65535 Len=0
1,7.991363999999521,62.210.85.178,10.0.2.15,TCP,60,9001  >  35978 [ACK] Seq=10328983 Ack=188577323 Win=65535 Len=0
1,7.991367999999966,62.210.85.178,10.0.2.15,TCP,60,9001  >  35978 [ACK] Seq=10328983 Ack=188578783 Win=65535 Len=0
1,7.991371999999501,62.210.85.178,10.0.2.15,TCP,60,9001  >  35978 [ACK] Seq=10328983 Ack=188580243 Win=65535 Len=0
1,7.991409999999632,10.0.2.15,62.210.85.178,TLSv1.2,1204,Application Data
1,7.991491999999198,10.0.2.15,62.210.85.178,TLSv1.2,2974,Application Data
1,7.9915320000000065,62.210.85.178,10.0.2.15,TCP,60,9001  >  35978 [ACK] Seq=10328983 Ack=188581393 Win=65535 Len=0
1,7.991538999999648,62.210.85.178,10.0.2.15,TCP,60,9001  >  35978 [ACK] Seq=10328983 Ack=188582853 Win=65535 Len=0
1,7.991542999999183,62.210.85.178,10.0.2.15,TCP,60,9001  >  35978 [ACK] Seq=10328983 Ack=188584313 Win=65535 Len=0
1,7.991577999999208,10.0.2.15,62.210.85.178,TLSv1.2,1226,Application Data
1,7.991640999999618,10.0.2.15,62.210.85.178,TCP,1514,35978  >  9001 [ACK] Seq=188585485 Ack=10328983 Win=65535 Len=1460 [TCP segment of a reassembled PDU]
1,7.991675999999643,62.210.85.178,10.0.2.15,TCP,60,9001  >  35978 [ACK] Seq=10328983 Ack=188585485 Win=65535 Len=0
1,7.991682999999284,62.210.85.178,10.0.2.15,TCP,60,9001  >  35978 [ACK] Seq=10328983 Ack=188586945 Win=65535 Len=0
1,7.991712999999436,10.0.2.15,62.210.85.178,TLSv1.2,478,Application Data
1,7.9917489999998,62.210.85.178,10.0.2.15,TCP,60,9001  >  35978 [ACK] Seq=10328983 Ack=188587369 Win=65535 Len=0
1,8.074275999999372,54.93.77.70,10.0.2.15,TLSv1.2,590,Application Data
1,8.104235999999219,54.93.77.70,10.0.2.15,TCP,2950,"9001  >  34692 [PSH, ACK] Seq=188431335 Ack=10373601 Win=65535 Len=2896 [TCP segment of a reassembled PDU]"
1,8.104321999999229,10.0.2.15,54.93.77.70,TCP,54,34692  >  9001 [ACK] Seq=10373601 Ack=188434231 Win=65535 Len=0
1,8.114343999999619,54.93.77.70,10.0.2.15,TLSv1.2,5846,"Application Data, Application Data"
1,8.114418999999543,10.0.2.15,54.93.77.70,TCP,54,34692  >  9001 [ACK] Seq=10373601 Ack=188440023 Win=65535 Len=0
1,8.114759999999478,54.93.77.70,10.0.2.15,TCP,1502,"9001  >  34692 [PSH, ACK] Seq=188440023 Ack=10373601 Win=65535 Len=1448 [TCP segment of a reassembled PDU]"
1,8.114802999999483,10.0.2.15,54.93.77.70,TCP,54,34692  >  9001 [ACK] Seq=10373601 Ack=188441471 Win=65535 Len=0
1,8.120413999999982,54.93.77.70,10.0.2.15,TLSv1.2,1292,Application Data
1,8.127122999999301,54.93.77.70,10.0.2.15,TCP,2950,"9001  >  34692 [PSH, ACK] Seq=188442709 Ack=10373601 Win=65535 Len=2896 [TCP segment of a reassembled PDU]"
1,8.127172999999857,10.0.2.15,54.93.77.70,TCP,54,34692  >  9001 [ACK] Seq=10373601 Ack=188445605 Win=65535 Len=0
1,8.13788999999997,54.93.77.70,10.0.2.15,TLSv1.2,8018,"Application Data, Application Data, Application Data"
1,8.13802299999952,10.0.2.15,54.93.77.70,TCP,54,34692  >  9001 [ACK] Seq=10373601 Ack=188453569 Win=65535 Len=0
1,8.141152999999576,10.0.2.15,54.93.77.70,TLSv1.2,590,Application Data
1,8.141406999999163,54.93.77.70,10.0.2.15,TCP,60,9001  >  34692 [ACK] Seq=188453569 Ack=10374137 Win=65535 Len=0
1,8.484428999999182,62.210.85.178,10.0.2.15,TLSv1.2,590,Application Data
1,8.484916999999768,10.0.2.15,62.210.85.178,TLSv1.2,590,Application Data
1,8.485031999999592,62.210.85.178,10.0.2.15,TCP,60,9001  >  35978 [ACK] Seq=10329519 Ack=188587905 Win=65535 Len=0
1,8.594168999999965,54.93.77.70,10.0.2.15,TLSv1.2,590,Application Data
1,8.594528999999966,10.0.2.15,54.93.77.70,TLSv1.2,590,Application Data
1,8.594642000000022,54.93.77.70,10.0.2.15,TCP,60,9001  >  34692 [ACK] Seq=188454105 Ack=10374673 Win=65535 Len=0
1,8.793554999999287,62.210.85.178,10.0.2.15,TLSv1.2,590,Application Data
1,8.799365999999281,10.0.2.15,62.210.85.178,TLSv1.2,590,Application Data
1,8.79954699999962,62.210.85.178,10.0.2.15,TCP,60,9001  >  35978 [ACK] Seq=10330055 Ack=188588441 Win=65535 Len=0
1,8.810886999999639,10.0.2.15,62.210.85.178,TLSv1.2,4124,Application Data
1,8.811076999999386,10.0.2.15,62.210.85.178,TCP,2974,35978  >  9001 [ACK] Seq=188592511 Ack=10330055 Win=65535 Len=2920 [TCP segment of a reassembled PDU]
1,8.811169999999947,62.210.85.178,10.0.2.15,TCP,60,9001  >  35978 [ACK] Seq=10330055 Ack=188589901 Win=65535 Len=0
1,8.811187999999675,62.210.85.178,10.0.2.15,TCP,60,9001  >  35978 [ACK] Seq=10330055 Ack=188591361 Win=65535 Len=0
1,8.811193999999887,62.210.85.178,10.0.2.15,TCP,60,9001  >  35978 [ACK] Seq=10330055 Ack=188592511 Win=65535 Len=0
1,8.81119899999976,62.210.85.178,10.0.2.15,TCP,60,9001  >  35978 [ACK] Seq=10330055 Ack=188593971 Win=65535 Len=0
1,8.811203999999634,62.210.85.178,10.0.2.15,TCP,60,9001  >  35978 [ACK] Seq=10330055 Ack=188595431 Win=65535 Len=0
1,8.811252999999851,10.0.2.15,62.210.85.178,TLSv1.2,1204,Application Data
1,8.81129399999918,62.210.85.178,10.0.2.15,TCP,60,9001  >  35978 [ACK] Seq=10330055 Ack=188596581 Win=65535 Len=0
1,8.811343999999735,10.0.2.15,62.210.85.178,TLSv1.2,4124,Application Data
1,8.811383999999634,62.210.85.178,10.0.2.15,TCP,60,9001  >  35978 [ACK] Seq=10330055 Ack=188598041 Win=65535 Len=0
1,8.811391999999614,62.210.85.178,10.0.2.15,TCP,60,9001  >  35978 [ACK] Seq=10330055 Ack=188599501 Win=65535 Len=0
1,8.811396000000059,62.210.85.178,10.0.2.15,TCP,60,9001  >  35978 [ACK] Seq=10330055 Ack=188600651 Win=65535 Len=0
1,8.811435999999958,10.0.2.15,62.210.85.178,TLSv1.2,4124,Application Data
1,8.811474999999518,62.210.85.178,10.0.2.15,TCP,60,9001  >  35978 [ACK] Seq=10330055 Ack=188602111 Win=65535 Len=0
1,8.811482999999498,62.210.85.178,10.0.2.15,TCP,60,9001  >  35978 [ACK] Seq=10330055 Ack=188603571 Win=65535 Len=0
1,8.811546999999337,10.0.2.15,62.210.85.178,TLSv1.2,2974,Application Data
1,8.811592000000019,62.210.85.178,10.0.2.15,TCP,60,9001  >  35978 [ACK] Seq=10330055 Ack=188604721 Win=65535 Len=0
1,8.811597999999321,62.210.85.178,10.0.2.15,TCP,60,9001  >  35978 [ACK] Seq=10330055 Ack=188606181 Win=65535 Len=0
1,8.811600999999428,62.210.85.178,10.0.2.15,TCP,60,9001  >  35978 [ACK] Seq=10330055 Ack=188607641 Win=65535 Len=0
1,8.811633999999685,10.0.2.15,62.210.85.178,TLSv1.2,1226,Application Data
1,8.811671999999817,62.210.85.178,10.0.2.15,TCP,60,9001  >  35978 [ACK] Seq=10330055 Ack=188608813 Win=65535 Len=0
1,8.811713000000054,10.0.2.15,62.210.85.178,TLSv1.2,4124,Application Data
1,8.811752999999953,62.210.85.178,10.0.2.15,TCP,60,9001  >  35978 [ACK] Seq=10330055 Ack=188610273 Win=65535 Len=0
1,8.811759999999595,62.210.85.178,10.0.2.15,TCP,60,9001  >  35978 [ACK] Seq=10330055 Ack=188611733 Win=65535 Len=0
1,8.81176400000004,62.210.85.178,10.0.2.15,TCP,60,9001  >  35978 [ACK] Seq=10330055 Ack=188612883 Win=65535 Len=0
1,8.811800999999832,10.0.2.15,62.210.85.178,TLSv1.2,3030,Application Data
1,8.811839999999393,62.210.85.178,10.0.2.15,TCP,60,9001  >  35978 [ACK] Seq=10330055 Ack=188614343 Win=65535 Len=0
1,8.811846999999943,62.210.85.178,10.0.2.15,TCP,60,9001  >  35978 [ACK] Seq=10330055 Ack=188615803 Win=65535 Len=0
1,8.811850999999479,62.210.85.178,10.0.2.15,TCP,60,9001  >  35978 [ACK] Seq=10330055 Ack=188615859 Win=65535 Len=0
1,8.821077999999943,10.0.2.15,62.210.85.178,TLSv1.2,4124,Application Data
1,8.821130999999696,62.210.85.178,10.0.2.15,TCP,60,9001  >  35978 [ACK] Seq=10330055 Ack=188617319 Win=65535 Len=0
1,8.821141999999782,62.210.85.178,10.0.2.15,TCP,60,9001  >  35978 [ACK] Seq=10330055 Ack=188618779 Win=65535 Len=0
1,8.821145999999317,62.210.85.178,10.0.2.15,TCP,60,9001  >  35978 [ACK] Seq=10330055 Ack=188619929 Win=65535 Len=0
1,8.821195999999873,10.0.2.15,62.210.85.178,TLSv1.2,4124,Application Data
1,8.8212369999992,62.210.85.178,10.0.2.15,TCP,60,9001  >  35978 [ACK] Seq=10330055 Ack=188621389 Win=65535 Len=0
1,8.821245999999519,62.210.85.178,10.0.2.15,TCP,60,9001  >  35978 [ACK] Seq=10330055 Ack=188622849 Win=65535 Len=0
1,8.821250999999393,62.210.85.178,10.0.2.15,TCP,60,9001  >  35978 [ACK] Seq=10330055 Ack=188623999 Win=65535 Len=0
1,8.821288999999524,10.0.2.15,62.210.85.178,TLSv1.2,2774,Application Data
1,8.821328999999423,62.210.85.178,10.0.2.15,TCP,60,9001  >  35978 [ACK] Seq=10330055 Ack=188625459 Win=65535 Len=0
1,8.821336999999403,62.210.85.178,10.0.2.15,TCP,60,9001  >  35978 [ACK] Seq=10330055 Ack=188626719 Win=65535 Len=0
1,8.92084899999918,54.93.77.70,10.0.2.15,TLSv1.2,590,Application Data
1,8.9432199999992,54.93.77.70,10.0.2.15,TLSv1.2,7294,"Application Data, Application Data"
1,8.943555999999262,10.0.2.15,54.93.77.70,TCP,54,34692  >  9001 [ACK] Seq=10374673 Ack=188461881 Win=65535 Len=0
1,8.943915999999263,10.0.2.15,54.93.77.70,TLSv1.2,590,Application Data
1,8.944157999999334,54.93.77.70,10.0.2.15,TCP,60,9001  >  34692 [ACK] Seq=188461881 Ack=10375209 Win=65535 Len=0
1,8.960053999999218,54.93.77.70,10.0.2.15,TLSv1.2,3674,Application Data
1,8.960129000000052,10.0.2.15,54.93.77.70,TCP,54,34692  >  9001 [ACK] Seq=10375209 Ack=188465501 Win=65535 Len=0
1,8.978094999999485,54.93.77.70,10.0.2.15,TLSv1.2,590,Application Data
1,8.981957999999395,54.93.77.70,10.0.2.15,TCP,2950,"9001  >  34692 [PSH, ACK] Seq=188466037 Ack=10375209 Win=65535 Len=2896 [TCP segment of a reassembled PDU]"
1,8.982006999999612,10.0.2.15,54.93.77.70,TCP,54,34692  >  9001 [ACK] Seq=10375209 Ack=188468933 Win=65535 Len=0
1,8.993940999999722,54.93.77.70,10.0.2.15,TLSv1.2,7294,"Application Data, Application Data"
1,8.994007999999667,10.0.2.15,54.93.77.70,TCP,54,34692  >  9001 [ACK] Seq=10375209 Ack=188476173 Win=65535 Len=0
1,8.998104999999669,54.93.77.70,10.0.2.15,TLSv1.2,1292,Application Data
1,9.00784399999975,54.93.77.70,10.0.2.15,TLSv1.2,8742,"Application Data, Application Data"
1,9.0079139999998,10.0.2.15,54.93.77.70,TCP,54,34692  >  9001 [ACK] Seq=10375209 Ack=188486099 Win=65535 Len=0
1,9.00806399999965,10.0.2.15,54.93.77.70,TLSv1.2,590,Application Data
1,9.0081339999997,54.93.77.70,10.0.2.15,TCP,60,9001  >  34692 [ACK] Seq=188486099 Ack=10375745 Win=65535 Len=0
1,9.023755999999594,54.93.77.70,10.0.2.15,TLSv1.2,170,Application Data
1,9.024751999999353,54.93.77.70,10.0.2.15,TCP,2950,"9001  >  34692 [PSH, ACK] Seq=188486215 Ack=10375745 Win=65535 Len=2896 [TCP segment of a reassembled PDU]"
1,9.024802999999338,10.0.2.15,54.93.77.70,TCP,54,34692  >  9001 [ACK] Seq=10375745 Ack=188489111 Win=65535 Len=0
1,9.04066899999998,54.93.77.70,10.0.2.15,TLSv1.2,2950,Application Data [TCP segment of a reassembled PDU]
1,9.040757999999187,10.0.2.15,54.93.77.70,TCP,54,34692  >  9001 [ACK] Seq=10375745 Ack=188492007 Win=65535 Len=0
1,9.042230000000018,54.93.77.70,10.0.2.15,TLSv1.2,988,Application Data
1,9.064676999999392,62.210.85.178,10.0.2.15,TLSv1.2,590,Application Data
