No.,Time,Source,Destination,Protocol,Length,Info
1,0.029293999999936204,10.0.2.15,54.93.77.70,TCP,54,34692  >  9001 [ACK] Seq=10571863 Ack=191860921 Win=65535 Len=0
1,0.13904100000036124,10.0.2.15,54.93.77.70,TLSv1.2,590,Application Data
1,0.13920300000063435,54.93.77.70,10.0.2.15,TCP,60,9001  >  34692 [ACK] Seq=191860921 Ack=10572399 Win=65535 Len=0
1,0.2528650000003836,62.210.85.178,10.0.2.15,TLSv1.2,590,Application Data
1,0.2533739999998943,10.0.2.15,62.210.85.178,TLSv1.2,590,Application Data
1,0.2534940000005008,62.210.85.178,10.0.2.15,TCP,60,9001  >  35978 [ACK] Seq=10527033 Ack=191994355 Win=65535 Len=0
1,0.3715389999997569,54.93.77.70,10.0.2.15,TLSv1.2,590,Application Data
1,0.3716100000001461,10.0.2.15,54.93.77.70,TCP,54,34692  >  9001 [ACK] Seq=10572399 Ack=191861457 Win=65535 Len=0
1,0.37199800000053074,10.0.2.15,54.93.77.70,TLSv1.2,1618,Application Data
1,0.3721030000006067,54.93.77.70,10.0.2.15,TCP,60,9001  >  34692 [ACK] Seq=191861457 Ack=10573859 Win=65535 Len=0
1,0.3721210000003339,54.93.77.70,10.0.2.15,TCP,60,9001  >  34692 [ACK] Seq=191861457 Ack=10573963 Win=65535 Len=0
1,0.5704569999998057,62.210.85.178,10.0.2.15,TLSv1.2,1618,Application Data
1,0.5705889999999272,10.0.2.15,62.210.85.178,TCP,54,35978  >  9001 [ACK] Seq=191994355 Ack=10528597 Win=65535 Len=0
1,0.584037000000535,10.0.2.15,62.210.85.178,TLSv1.2,590,Application Data
1,0.5842060000004494,62.210.85.178,10.0.2.15,TCP,60,9001  >  35978 [ACK] Seq=10528597 Ack=191994891 Win=65535 Len=0
1,0.5970459999998639,10.0.2.15,62.210.85.178,TLSv1.2,1618,Application Data
1,0.5971799999997529,62.210.85.178,10.0.2.15,TCP,60,9001  >  35978 [ACK] Seq=10528597 Ack=191996351 Win=65535 Len=0
1,0.5971980000003896,62.210.85.178,10.0.2.15,TCP,60,9001  >  35978 [ACK] Seq=10528597 Ack=191996455 Win=65535 Len=0
1,0.6899430000003122,54.93.77.70,10.0.2.15,TLSv1.2,590,Application Data
1,0.7329120000003968,10.0.2.15,54.93.77.70,TCP,54,34692  >  9001 [ACK] Seq=10573963 Ack=191861993 Win=65535 Len=0
1,0.7515789999997651,54.93.77.70,10.0.2.15,TLSv1.2,1618,Application Data
1,0.7516300000006595,10.0.2.15,54.93.77.70,TCP,54,34692  >  9001 [ACK] Seq=10573963 Ack=191863557 Win=65535 Len=0
1,0.7537060000004203,10.0.2.15,54.93.77.70,TLSv1.2,590,Application Data
1,0.7538739999999962,54.93.77.70,10.0.2.15,TCP,60,9001  >  34692 [ACK] Seq=191863557 Ack=10574499 Win=65535 Len=0
1,1.1861810000000332,62.210.85.178,10.0.2.15,TLSv1.2,590,Application Data
1,1.1864850000001752,10.0.2.15,62.210.85.178,TLSv1.2,590,Application Data
1,1.1865880000004836,62.210.85.178,10.0.2.15,TCP,60,9001  >  35978 [ACK] Seq=10529133 Ack=191996991 Win=65535 Len=0
1,1.3907820000003994,54.93.77.70,10.0.2.15,TLSv1.2,590,Application Data
1,1.3912890000001426,10.0.2.15,54.93.77.70,TLSv1.2,590,Application Data
1,1.3914230000000316,54.93.77.70,10.0.2.15,TCP,60,9001  >  34692 [ACK] Seq=191864093 Ack=10575035 Win=65535 Len=0
1,1.5955750000002809,62.210.85.178,10.0.2.15,TLSv1.2,590,Application Data
1,1.599981000000298,10.0.2.15,62.210.85.178,TLSv1.2,590,Application Data
1,1.6008760000004258,62.210.85.178,10.0.2.15,TCP,60,9001  >  35978 [ACK] Seq=10529669 Ack=191997527 Win=65535 Len=0
1,1.6102840000003198,10.0.2.15,62.210.85.178,TLSv1.2,4124,Application Data
1,1.610461000000214,62.210.85.178,10.0.2.15,TCP,60,9001  >  35978 [ACK] Seq=10529669 Ack=191998987 Win=65535 Len=0
1,1.6104820000000473,62.210.85.178,10.0.2.15,TCP,60,9001  >  35978 [ACK] Seq=10529669 Ack=192000447 Win=65535 Len=0
1,1.6104850000001534,62.210.85.178,10.0.2.15,TCP,60,9001  >  35978 [ACK] Seq=10529669 Ack=192001597 Win=65535 Len=0
1,1.6105429999997796,10.0.2.15,62.210.85.178,TCP,2974,35978  >  9001 [ACK] Seq=192001597 Ack=10529669 Win=65535 Len=2920 [TCP segment of a reassembled PDU]
1,1.6106140000001687,10.0.2.15,62.210.85.178,TLSv1.2,1204,Application Data
1,1.610634000000573,62.210.85.178,10.0.2.15,TCP,60,9001  >  35978 [ACK] Seq=10529669 Ack=192003057 Win=65535 Len=0
1,1.6106399999998757,62.210.85.178,10.0.2.15,TCP,60,9001  >  35978 [ACK] Seq=10529669 Ack=192004517 Win=65535 Len=0
1,1.610645000000659,62.210.85.178,10.0.2.15,TCP,60,9001  >  35978 [ACK] Seq=10529669 Ack=192005667 Win=65535 Len=0
1,1.610689000000093,10.0.2.15,62.210.85.178,TLSv1.2,4124,Application Data
1,1.610725000000457,62.210.85.178,10.0.2.15,TCP,60,9001  >  35978 [ACK] Seq=10529669 Ack=192007127 Win=65535 Len=0
1,1.6107330000004367,62.210.85.178,10.0.2.15,TCP,60,9001  >  35978 [ACK] Seq=10529669 Ack=192008587 Win=65535 Len=0
1,1.6107360000005428,62.210.85.178,10.0.2.15,TCP,60,9001  >  35978 [ACK] Seq=10529669 Ack=192009737 Win=65535 Len=0
1,1.6107730000003357,10.0.2.15,62.210.85.178,TLSv1.2,4124,Application Data
1,1.6108100000001286,62.210.85.178,10.0.2.15,TCP,60,9001  >  35978 [ACK] Seq=10529669 Ack=192011197 Win=65535 Len=0
1,1.6108160000003409,62.210.85.178,10.0.2.15,TCP,60,9001  >  35978 [ACK] Seq=10529669 Ack=192012657 Win=65535 Len=0
1,1.6108750000003056,10.0.2.15,62.210.85.178,TLSv1.2,2974,Application Data
1,1.6109120000000985,62.210.85.178,10.0.2.15,TCP,60,9001  >  35978 [ACK] Seq=10529669 Ack=192013807 Win=65535 Len=0
1,1.6109190000006492,62.210.85.178,10.0.2.15,TCP,60,9001  >  35978 [ACK] Seq=10529669 Ack=192015267 Win=65535 Len=0
1,1.6109219999998459,62.210.85.178,10.0.2.15,TCP,60,9001  >  35978 [ACK] Seq=10529669 Ack=192016727 Win=65535 Len=0
1,1.6109489999998914,10.0.2.15,62.210.85.178,TLSv1.2,1226,Application Data
1,1.6109820000001491,62.210.85.178,10.0.2.15,TCP,60,9001  >  35978 [ACK] Seq=10529669 Ack=192017899 Win=65535 Len=0
1,1.611021000000619,10.0.2.15,62.210.85.178,TLSv1.2,4124,Application Data
1,1.6110550000003059,62.210.85.178,10.0.2.15,TCP,60,9001  >  35978 [ACK] Seq=10529669 Ack=192019359 Win=65535 Len=0
1,1.6110619999999471,62.210.85.178,10.0.2.15,TCP,60,9001  >  35978 [ACK] Seq=10529669 Ack=192020819 Win=65535 Len=0
1,1.6110650000000533,62.210.85.178,10.0.2.15,TCP,60,9001  >  35978 [ACK] Seq=10529669 Ack=192021969 Win=65535 Len=0
1,1.6111010000004171,10.0.2.15,62.210.85.178,TLSv1.2,3030,Application Data
1,1.6111360000004424,62.210.85.178,10.0.2.15,TCP,60,9001  >  35978 [ACK] Seq=10529669 Ack=192023429 Win=65535 Len=0
1,1.6111430000000837,62.210.85.178,10.0.2.15,TCP,60,9001  >  35978 [ACK] Seq=10529669 Ack=192024889 Win=65535 Len=0
1,1.6111470000005284,62.210.85.178,10.0.2.15,TCP,60,9001  >  35978 [ACK] Seq=10529669 Ack=192024945 Win=65535 Len=0
1,1.6203390000000581,10.0.2.15,62.210.85.178,TLSv1.2,4124,Application Data
1,1.6204170000000886,62.210.85.178,10.0.2.15,TCP,60,9001  >  35978 [ACK] Seq=10529669 Ack=192026405 Win=65535 Len=0
1,1.620426000000407,62.210.85.178,10.0.2.15,TCP,60,9001  >  35978 [ACK] Seq=10529669 Ack=192027865 Win=65535 Len=0
1,1.620429999999942,62.210.85.178,10.0.2.15,TCP,60,9001  >  35978 [ACK] Seq=10529669 Ack=192029015 Win=65535 Len=0
1,1.6204710000001796,10.0.2.15,62.210.85.178,TLSv1.2,4124,Application Data
1,1.6205330000002505,62.210.85.178,10.0.2.15,TCP,60,9001  >  35978 [ACK] Seq=10529669 Ack=192030475 Win=65535 Len=0
1,1.6205420000005688,62.210.85.178,10.0.2.15,TCP,60,9001  >  35978 [ACK] Seq=10529669 Ack=192031935 Win=65535 Len=0
1,1.6205449999997654,62.210.85.178,10.0.2.15,TCP,60,9001  >  35978 [ACK] Seq=10529669 Ack=192033085 Win=65535 Len=0
1,1.620574000000488,10.0.2.15,62.210.85.178,TLSv1.2,204,Application Data
1,1.6206080000001748,62.210.85.178,10.0.2.15,TCP,60,9001  >  35978 [ACK] Seq=10529669 Ack=192033235 Win=65535 Len=0
1,1.746769000000313,54.93.77.70,10.0.2.15,TCP,2950,"9001  >  34692 [PSH, ACK] Seq=191864093 Ack=10575035 Win=65535 Len=2896 [TCP segment of a reassembled PDU]"
1,1.7468820000003689,10.0.2.15,54.93.77.70,TCP,54,34692  >  9001 [ACK] Seq=10575035 Ack=191866989 Win=65535 Len=0
1,1.7472740000002887,54.93.77.70,10.0.2.15,TLSv1.2,778,Application Data
1,1.7811310000006415,54.93.77.70,10.0.2.15,TCP,2950,"9001  >  34692 [PSH, ACK] Seq=191867713 Ack=10575035 Win=65535 Len=2896 [TCP segment of a reassembled PDU]"
1,1.7811890000002677,10.0.2.15,54.93.77.70,TCP,54,34692  >  9001 [ACK] Seq=10575035 Ack=191870609 Win=65535 Len=0
1,1.7815700000001016,54.93.77.70,10.0.2.15,TLSv1.2,778,Application Data
1,1.7984980000001087,54.93.77.70,10.0.2.15,TLSv1.2,590,Application Data
1,1.7985760000001392,10.0.2.15,54.93.77.70,TCP,54,34692  >  9001 [ACK] Seq=10575035 Ack=191871869 Win=65535 Len=0
1,1.8950869999998758,54.93.77.70,10.0.2.15,TLSv1.2,3674,Application Data
1,1.8951960000003965,10.0.2.15,54.93.77.70,TCP,54,34692  >  9001 [ACK] Seq=10575035 Ack=191875489 Win=65535 Len=0
1,1.9064790000002176,54.93.77.70,10.0.2.15,TLSv1.2,5846,Application Data
1,1.9065300000002026,54.93.77.70,10.0.2.15,TLSv1.2,4398,Application Data [TCP segment of a reassembled PDU]
1,1.9066750000001775,10.0.2.15,54.93.77.70,TCP,54,34692  >  9001 [ACK] Seq=10575035 Ack=191885625 Win=65535 Len=0
1,1.9069319999998697,10.0.2.15,54.93.77.70,TLSv1.2,590,Application Data
1,1.90701799999988,54.93.77.70,10.0.2.15,TCP,60,9001  >  34692 [ACK] Seq=191885625 Ack=10575571 Win=65535 Len=0
1,1.9143620000004375,54.93.77.70,10.0.2.15,TLSv1.2,2950,Application Data [TCP segment of a reassembled PDU]
1,1.9144029999997656,54.93.77.70,10.0.2.15,TLSv1.2,3044,Application Data
1,1.9144700000006196,10.0.2.15,54.93.77.70,TCP,54,34692  >  9001 [ACK] Seq=10575571 Ack=191888521 Win=65535 Len=0
1,1.9145790000002307,10.0.2.15,54.93.77.70,TCP,54,34692  >  9001 [ACK] Seq=10575571 Ack=191891511 Win=65535 Len=0
1,1.9203830000005837,10.0.2.15,54.93.77.70,TLSv1.2,590,Application Data
1,1.920521000000008,54.93.77.70,10.0.2.15,TCP,60,9001  >  34692 [ACK] Seq=191891511 Ack=10576107 Win=65535 Len=0
1,1.9269050000002608,54.93.77.70,10.0.2.15,TCP,2950,"9001  >  34692 [PSH, ACK] Seq=191891511 Ack=10576107 Win=65535 Len=2896 [TCP segment of a reassembled PDU]"
1,1.9269899999999325,10.0.2.15,54.93.77.70,TCP,54,34692  >  9001 [ACK] Seq=10576107 Ack=191894407 Win=65535 Len=0
1,1.9307630000002973,54.93.77.70,10.0.2.15,TLSv1.2,778,Application Data
1,1.9350420000000668,54.93.77.70,10.0.2.15,TLSv1.2,4398,Application Data
1,1.9351180000003296,10.0.2.15,54.93.77.70,TCP,54,34692  >  9001 [ACK] Seq=10576107 Ack=191899475 Win=65535 Len=0
1,1.9506069999997635,54.93.77.70,10.0.2.15,TLSv1.2,894,Application Data
1,1.9530510000004142,10.0.2.15,54.93.77.70,TLSv1.2,590,Application Data
1,1.9531999999999243,54.93.77.70,10.0.2.15,TCP,60,9001  >  34692 [ACK] Seq=191900315 Ack=10576643 Win=65535 Len=0
1,2.0446570000003703,62.210.85.178,10.0.2.15,TLSv1.2,1104,Application Data
1,2.0828780000001643,62.210.85.178,10.0.2.15,TLSv1.2,590,Application Data
1,2.082934000000023,10.0.2.15,62.210.85.178,TCP,54,35978  >  9001 [ACK] Seq=192033235 Ack=10531255 Win=65535 Len=0
1,2.083360999999968,10.0.2.15,62.210.85.178,TLSv1.2,590,Application Data
1,2.0834590000004027,62.210.85.178,10.0.2.15,TCP,60,9001  >  35978 [ACK] Seq=10531255 Ack=192033771 Win=65535 Len=0
1,2.414306000000579,54.93.77.70,10.0.2.15,TLSv1.2,590,Application Data
1,2.4146890000001804,10.0.2.15,54.93.77.70,TLSv1.2,590,Application Data
1,2.4147979999997915,54.93.77.70,10.0.2.15,TCP,60,9001  >  34692 [ACK] Seq=191900851 Ack=10577179 Win=65535 Len=0
1,2.7222350000001825,62.210.85.178,10.0.2.15,TLSv1.2,590,Application Data
1,2.728189000000384,10.0.2.15,62.210.85.178,TLSv1.2,590,Application Data
1,2.7283619999998336,62.210.85.178,10.0.2.15,TCP,60,9001  >  35978 [ACK] Seq=10531791 Ack=192034307 Win=65535 Len=0
1,2.741891000000578,10.0.2.15,62.210.85.178,TLSv1.2,4124,Application Data
1,2.741997000000083,10.0.2.15,62.210.85.178,TCP,2974,35978  >  9001 [ACK] Seq=192038377 Ack=10531791 Win=65535 Len=2920 [TCP segment of a reassembled PDU]
1,2.7420499999998356,62.210.85.178,10.0.2.15,TCP,60,9001  >  35978 [ACK] Seq=10531791 Ack=192035767 Win=65535 Len=0
1,2.7420609999999215,62.210.85.178,10.0.2.15,TCP,60,9001  >  35978 [ACK] Seq=10531791 Ack=192037227 Win=65535 Len=0
1,2.7420670000001337,62.210.85.178,10.0.2.15,TCP,60,9001  >  35978 [ACK] Seq=10531791 Ack=192038377 Win=65535 Len=0
1,2.7421080000003712,10.0.2.15,62.210.85.178,TLSv1.2,1204,Application Data
1,2.742149000000609,62.210.85.178,10.0.2.15,TCP,60,9001  >  35978 [ACK] Seq=10531791 Ack=192039837 Win=65535 Len=0
1,2.7421580000000176,62.210.85.178,10.0.2.15,TCP,60,9001  >  35978 [ACK] Seq=10531791 Ack=192041297 Win=65535 Len=0
1,2.7421610000001237,62.210.85.178,10.0.2.15,TCP,60,9001  >  35978 [ACK] Seq=10531791 Ack=192042447 Win=65535 Len=0
1,2.7422020000003613,10.0.2.15,62.210.85.178,TLSv1.2,4124,Application Data
1,2.7422409999999218,62.210.85.178,10.0.2.15,TCP,60,9001  >  35978 [ACK] Seq=10531791 Ack=192043907 Win=65535 Len=0
1,2.7422489999999016,62.210.85.178,10.0.2.15,TCP,60,9001  >  35978 [ACK] Seq=10531791 Ack=192045367 Win=65535 Len=0
1,2.742253000000346,62.210.85.178,10.0.2.15,TCP,60,9001  >  35978 [ACK] Seq=10531791 Ack=192046517 Win=65535 Len=0
1,2.7422919999999067,10.0.2.15,62.210.85.178,TLSv1.2,4124,Application Data
1,2.742329000000609,62.210.85.178,10.0.2.15,TCP,60,9001  >  35978 [ACK] Seq=10531791 Ack=192047977 Win=65535 Len=0
1,2.742338000000018,62.210.85.178,10.0.2.15,TCP,60,9001  >  35978 [ACK] Seq=10531791 Ack=192049437 Win=65535 Len=0
1,2.7423990000006597,10.0.2.15,62.210.85.178,TLSv1.2,2974,Application Data
1,2.74243800000022,62.210.85.178,10.0.2.15,TCP,60,9001  >  35978 [ACK] Seq=10531791 Ack=192050587 Win=65535 Len=0
1,2.7424460000002,62.210.85.178,10.0.2.15,TCP,60,9001  >  35978 [ACK] Seq=10531791 Ack=192052047 Win=65535 Len=0
1,2.742449000000306,62.210.85.178,10.0.2.15,TCP,60,9001  >  35978 [ACK] Seq=10531791 Ack=192053507 Win=65535 Len=0
1,2.7424769999997807,10.0.2.15,62.210.85.178,TLSv1.2,1226,Application Data
1,2.742511999999806,62.210.85.178,10.0.2.15,TCP,60,9001  >  35978 [ACK] Seq=10531791 Ack=192054679 Win=65535 Len=0
1,2.7425530000000435,10.0.2.15,62.210.85.178,TLSv1.2,4124,Application Data
1,2.742591000000175,62.210.85.178,10.0.2.15,TCP,60,9001  >  35978 [ACK] Seq=10531791 Ack=192056139 Win=65535 Len=0
1,2.7425990000001548,62.210.85.178,10.0.2.15,TCP,60,9001  >  35978 [ACK] Seq=10531791 Ack=192057599 Win=65535 Len=0
1,2.7426030000005994,62.210.85.178,10.0.2.15,TCP,60,9001  >  35978 [ACK] Seq=10531791 Ack=192058749 Win=65535 Len=0
1,2.7426409999998214,10.0.2.15,62.210.85.178,TLSv1.2,3030,Application Data
1,2.742678999999953,62.210.85.178,10.0.2.15,TCP,60,9001  >  35978 [ACK] Seq=10531791 Ack=192060209 Win=65535 Len=0
1,2.7426869999999326,62.210.85.178,10.0.2.15,TCP,60,9001  >  35978 [ACK] Seq=10531791 Ack=192061669 Win=65535 Len=0
1,2.7426910000003772,62.210.85.178,10.0.2.15,TCP,60,9001  >  35978 [ACK] Seq=10531791 Ack=192061725 Win=65535 Len=0
1,2.751874000000498,10.0.2.15,62.210.85.178,TLSv1.2,4124,Application Data
1,2.751933000000463,62.210.85.178,10.0.2.15,TCP,60,9001  >  35978 [ACK] Seq=10531791 Ack=192063185 Win=65535 Len=0
1,2.751944000000549,62.210.85.178,10.0.2.15,TCP,60,9001  >  35978 [ACK] Seq=10531791 Ack=192064645 Win=65535 Len=0
1,2.7519490000004225,62.210.85.178,10.0.2.15,TCP,60,9001  >  35978 [ACK] Seq=10531791 Ack=192065795 Win=65535 Len=0
1,2.751995999999963,10.0.2.15,62.210.85.178,TLSv1.2,4124,Application Data
1,2.7520370000002004,62.210.85.178,10.0.2.15,TCP,60,9001  >  35978 [ACK] Seq=10531791 Ack=192067255 Win=65535 Len=0
1,2.7520460000005187,62.210.85.178,10.0.2.15,TCP,60,9001  >  35978 [ACK] Seq=10531791 Ack=192068715 Win=65535 Len=0
1,2.7520510000003924,62.210.85.178,10.0.2.15,TCP,60,9001  >  35978 [ACK] Seq=10531791 Ack=192069865 Win=65535 Len=0
1,2.752089999999953,10.0.2.15,62.210.85.178,TLSv1.2,4124,Application Data
1,2.7521280000000843,62.210.85.178,10.0.2.15,TCP,60,9001  >  35978 [ACK] Seq=10531791 Ack=192071325 Win=65535 Len=0
1,2.752136000000064,62.210.85.178,10.0.2.15,TCP,60,9001  >  35978 [ACK] Seq=10531791 Ack=192072785 Win=65535 Len=0
1,2.7521409999999378,62.210.85.178,10.0.2.15,TCP,60,9001  >  35978 [ACK] Seq=10531791 Ack=192073935 Win=65535 Len=0
1,2.7521770000003016,10.0.2.15,62.210.85.178,TLSv1.2,4124,Application Data
1,2.752215999999862,62.210.85.178,10.0.2.15,TCP,60,9001  >  35978 [ACK] Seq=10531791 Ack=192075395 Win=65535 Len=0
1,2.752223999999842,62.210.85.178,10.0.2.15,TCP,60,9001  >  35978 [ACK] Seq=10531791 Ack=192076855 Win=65535 Len=0
1,2.752229000000625,62.210.85.178,10.0.2.15,TCP,60,9001  >  35978 [ACK] Seq=10531791 Ack=192078005 Win=65535 Len=0
1,2.7522640000006504,10.0.2.15,62.210.85.178,TLSv1.2,332,Application Data
1,2.7523010000004433,62.210.85.178,10.0.2.15,TCP,60,9001  >  35978 [ACK] Seq=10531791 Ack=192078283 Win=65535 Len=0
1,2.7523529999998573,10.0.2.15,62.210.85.178,TLSv1.2,3868,Application Data
1,2.7523909999999887,62.210.85.178,10.0.2.15,TCP,60,9001  >  35978 [ACK] Seq=10531791 Ack=192079743 Win=65535 Len=0
1,2.752400000000307,62.210.85.178,10.0.2.15,TCP,60,9001  >  35978 [ACK] Seq=10531791 Ack=192081203 Win=65535 Len=0
1,2.752403999999842,62.210.85.178,10.0.2.15,TCP,60,9001  >  35978 [ACK] Seq=10531791 Ack=192082097 Win=65535 Len=0
1,2.752443000000312,10.0.2.15,62.210.85.178,TLSv1.2,4124,Application Data
1,2.7524810000004436,62.210.85.178,10.0.2.15,TCP,60,9001  >  35978 [ACK] Seq=10531791 Ack=192083557 Win=65535 Len=0
1,2.7524890000004234,62.210.85.178,10.0.2.15,TCP,60,9001  >  35978 [ACK] Seq=10531791 Ack=192085017 Win=65535 Len=0
1,2.7524929999999586,62.210.85.178,10.0.2.15,TCP,60,9001  >  35978 [ACK] Seq=10531791 Ack=192086167 Win=65535 Len=0
1,2.752527999999984,10.0.2.15,62.210.85.178,TLSv1.2,3030,Application Data
1,2.752567000000454,62.210.85.178,10.0.2.15,TCP,60,9001  >  35978 [ACK] Seq=10531791 Ack=192087627 Win=65535 Len=0
1,2.7525750000004336,62.210.85.178,10.0.2.15,TCP,60,9001  >  35978 [ACK] Seq=10531791 Ack=192089087 Win=65535 Len=0
1,2.7525780000005398,62.210.85.178,10.0.2.15,TCP,60,9001  >  35978 [ACK] Seq=10531791 Ack=192089143 Win=65535 Len=0
1,2.764947000000575,10.0.2.15,62.210.85.178,TLSv1.2,4124,Application Data
1,2.765033000000585,62.210.85.178,10.0.2.15,TCP,60,9001  >  35978 [ACK] Seq=10531791 Ack=192090603 Win=65535 Len=0
1,2.765041999999994,62.210.85.178,10.0.2.15,TCP,60,9001  >  35978 [ACK] Seq=10531791 Ack=192092063 Win=65535 Len=0
1,2.7650450000001,62.210.85.178,10.0.2.15,TCP,60,9001  >  35978 [ACK] Seq=10531791 Ack=192093213 Win=65535 Len=0
1,2.7650860000003377,10.0.2.15,62.210.85.178,TLSv1.2,4124,Application Data
1,2.7651260000002367,62.210.85.178,10.0.2.15,TCP,60,9001  >  35978 [ACK] Seq=10531791 Ack=192094673 Win=65535 Len=0
1,2.765135000000555,62.210.85.178,10.0.2.15,TCP,60,9001  >  35978 [ACK] Seq=10531791 Ack=192096133 Win=65535 Len=0
1,2.76513900000009,62.210.85.178,10.0.2.15,TCP,60,9001  >  35978 [ACK] Seq=10531791 Ack=192097283 Win=65535 Len=0
1,2.7651770000002216,10.0.2.15,62.210.85.178,TLSv1.2,4124,Application Data
1,2.765215999999782,62.210.85.178,10.0.2.15,TCP,60,9001  >  35978 [ACK] Seq=10531791 Ack=192098743 Win=65535 Len=0
1,2.765223999999762,62.210.85.178,10.0.2.15,TCP,60,9001  >  35978 [ACK] Seq=10531791 Ack=192100203 Win=65535 Len=0
1,2.765229000000545,62.210.85.178,10.0.2.15,TCP,60,9001  >  35978 [ACK] Seq=10531791 Ack=192101353 Win=65535 Len=0
1,2.7652680000001055,10.0.2.15,62.210.85.178,TLSv1.2,3352,Application Data
1,2.7653049999998984,62.210.85.178,10.0.2.15,TCP,60,9001  >  35978 [ACK] Seq=10531791 Ack=192102813 Win=65535 Len=0
1,2.7653140000002168,62.210.85.178,10.0.2.15,TCP,60,9001  >  35978 [ACK] Seq=10531791 Ack=192104273 Win=65535 Len=0
1,2.765317999999752,62.210.85.178,10.0.2.15,TCP,60,9001  >  35978 [ACK] Seq=10531791 Ack=192104651 Win=65535 Len=0
1,2.8409209999999803,54.93.77.70,10.0.2.15,TLSv1.2,590,Application Data
1,2.853672000000188,54.93.77.70,10.0.2.15,TCP,2950,"9001  >  34692 [PSH, ACK] Seq=191901387 Ack=10577179 Win=65535 Len=2896 [TCP segment of a reassembled PDU]"
1,2.8537649999998393,54.93.77.70,10.0.2.15,TLSv1.2,4398,Application Data [TCP segment of a reassembled PDU]
1,2.853801000000203,10.0.2.15,54.93.77.70,TCP,54,34692  >  9001 [ACK] Seq=10577179 Ack=191904283 Win=65535 Len=0
1,2.8538589999998294,10.0.2.15,54.93.77.70,TCP,54,34692  >  9001 [ACK] Seq=10577179 Ack=191908627 Win=65535 Len=0
1,2.869934000000285,54.93.77.70,10.0.2.15,TLSv1.2,568,Application Data
1,2.9041830000005575,54.93.77.70,10.0.2.15,TLSv1.2,14534,"Application Data, Application Data, Application Data"
1,2.904429000000164,10.0.2.15,54.93.77.70,TCP,54,34692  >  9001 [ACK] Seq=10577179 Ack=191923621 Win=65535 Len=0
1,2.919966999999815,54.93.77.70,10.0.2.15,TLSv1.2,1082,Application Data
1,2.935312999999951,54.93.77.70,10.0.2.15,TCP,2950,"9001  >  34692 [PSH, ACK] Seq=191924649 Ack=10577179 Win=65535 Len=2896 [TCP segment of a reassembled PDU]"
1,2.935395000000426,10.0.2.15,54.93.77.70,TCP,54,34692  >  9001 [ACK] Seq=10577179 Ack=191927545 Win=65535 Len=0
1,2.9358680000004824,54.93.77.70,10.0.2.15,TLSv1.2,1502,Application Data [TCP segment of a reassembled PDU]
1,2.9359110000004875,10.0.2.15,54.93.77.70,TCP,54,34692  >  9001 [ACK] Seq=10577179 Ack=191928993 Win=65535 Len=0
1,2.936077000000296,10.0.2.15,54.93.77.70,TLSv1.2,590,Application Data
1,2.9361550000003263,54.93.77.70,10.0.2.15,TCP,60,9001  >  34692 [ACK] Seq=191928993 Ack=10577715 Win=65535 Len=0
1,2.9515510000001086,54.93.77.70,10.0.2.15,TLSv1.2,380,Application Data
1,2.9901440000003277,54.93.77.70,10.0.2.15,TCP,2950,"9001  >  34692 [PSH, ACK] Seq=191929319 Ack=10577715 Win=65535 Len=2896 [TCP segment of a reassembled PDU]"
1,2.9901870000003328,10.0.2.15,54.93.77.70,TCP,54,34692  >  9001 [ACK] Seq=10577715 Ack=191932215 Win=65535 Len=0
1,3.005995000000439,54.93.77.70,10.0.2.15,TLSv1.2,778,Application Data
1,3.0062260000004244,10.0.2.15,54.93.77.70,TLSv1.2,590,Application Data
1,3.0063380000001416,54.93.77.70,10.0.2.15,TCP,60,9001  >  34692 [ACK] Seq=191932939 Ack=10578251 Win=65535 Len=0
1,3.0196850000002087,54.93.77.70,10.0.2.15,TCP,2950,"9001  >  34692 [PSH, ACK] Seq=191932939 Ack=10578251 Win=65535 Len=2896 [TCP segment of a reassembled PDU]"
1,3.0197720000005575,10.0.2.15,54.93.77.70,TCP,54,34692  >  9001 [ACK] Seq=10578251 Ack=191935835 Win=65535 Len=0
1,3.0204869999997754,54.93.77.70,10.0.2.15,TLSv1.2,8742,"Application Data, Application Data"
1,3.020553000000291,10.0.2.15,54.93.77.70,TCP,54,34692  >  9001 [ACK] Seq=10578251 Ack=191944523 Win=65535 Len=0
1,3.0228539999998247,54.93.77.70,10.0.2.15,TLSv1.2,358,Application Data
1,3.030036000000109,54.93.77.70,10.0.2.15,TCP,2950,"9001  >  34692 [PSH, ACK] Seq=191944827 Ack=10578251 Win=65535 Len=2896 [TCP segment of a reassembled PDU]"
1,3.030087000000094,10.0.2.15,54.93.77.70,TCP,54,34692  >  9001 [ACK] Seq=10578251 Ack=191947723 Win=65535 Len=0
1,3.0318029999998544,54.93.77.70,10.0.2.15,TLSv1.2,5846,"Application Data, Application Data"
1,3.0318770000003497,10.0.2.15,54.93.77.70,TCP,54,34692  >  9001 [ACK] Seq=10578251 Ack=191953515 Win=65535 Len=0
1,3.032122000000527,10.0.2.15,54.93.77.70,TLSv1.2,590,Application Data
1,3.0321899999999005,54.93.77.70,10.0.2.15,TCP,60,9001  >  34692 [ACK] Seq=191953515 Ack=10578787 Win=65535 Len=0
1,3.0400390000004336,54.93.77.70,10.0.2.15,TLSv1.2,2950,Application Data [TCP segment of a reassembled PDU]
1,3.0400610000006054,54.93.77.70,10.0.2.15,TCP,1502,"9001  >  34692 [PSH, ACK] Seq=191956411 Ack=10578787 Win=65535 Len=1448 [TCP segment of a reassembled PDU]"
1,3.0400980000003983,10.0.2.15,54.93.77.70,TCP,54,34692  >  9001 [ACK] Seq=10578787 Ack=191956411 Win=65535 Len=0
1,3.040179999999964,10.0.2.15,54.93.77.70,TCP,54,34692  >  9001 [ACK] Seq=10578787 Ack=191957859 Win=65535 Len=0
1,3.041033000000425,54.93.77.70,10.0.2.15,TLSv1.2,8742,"Application Data, Application Data, Application Data"
1,3.041095999999925,10.0.2.15,54.93.77.70,TCP,54,34692  >  9001 [ACK] Seq=10578787 Ack=191966547 Win=65535 Len=0
1,3.0509510000001683,54.93.77.70,10.0.2.15,TLSv1.2,3674,Application Data
1,3.050999000000047,10.0.2.15,54.93.77.70,TCP,54,34692  >  9001 [ACK] Seq=10578787 Ack=191970167 Win=65535 Len=0
1,3.0588079999997717,54.93.77.70,10.0.2.15,TCP,1502,"9001  >  34692 [PSH, ACK] Seq=191970167 Ack=10578787 Win=65535 Len=1448 [TCP segment of a reassembled PDU]"
1,3.058850000000348,10.0.2.15,54.93.77.70,TCP,54,34692  >  9001 [ACK] Seq=10578787 Ack=191971615 Win=65535 Len=0
1,3.0665450000005876,54.93.77.70,10.0.2.15,TLSv1.2,170,Application Data
1,3.0691750000005413,10.0.2.15,54.93.77.70,TLSv1.2,590,Application Data
1,3.069333999999799,54.93.77.70,10.0.2.15,TCP,60,9001  >  34692 [ACK] Seq=191971731 Ack=10579323 Win=65535 Len=0
1,3.079743000000235,62.210.85.178,10.0.2.15,TLSv1.2,590,Application Data
1,3.1209650000000693,10.0.2.15,62.210.85.178,TCP,54,35978  >  9001 [ACK] Seq=192104651 Ack=10532327 Win=65535 Len=0
1,3.1368389999997817,62.210.85.178,10.0.2.15,TLSv1.2,590,Application Data
1,3.1369039999999586,10.0.2.15,62.210.85.178,TCP,54,35978  >  9001 [ACK] Seq=192104651 Ack=10532863 Win=65535 Len=0
1,3.4376830000001064,62.210.85.178,10.0.2.15,TLSv1.2,1104,Application Data
1,3.4377599999997983,10.0.2.15,62.210.85.178,TCP,54,35978  >  9001 [ACK] Seq=192104651 Ack=10533913 Win=65535 Len=0
1,3.4382489999998143,10.0.2.15,62.210.85.178,TLSv1.2,590,Application Data
1,3.438350000000355,62.210.85.178,10.0.2.15,TCP,60,9001  >  35978 [ACK] Seq=10533913 Ack=192105187 Win=65535 Len=0
1,3.643594000000121,54.93.77.70,10.0.2.15,TLSv1.2,590,Application Data
1,3.6440240000001722,10.0.2.15,54.93.77.70,TLSv1.2,590,Application Data
1,3.6441560000002937,54.93.77.70,10.0.2.15,TCP,60,9001  >  34692 [ACK] Seq=191972267 Ack=10579859 Win=65535 Len=0
1,3.8482599999997547,62.210.85.178,10.0.2.15,TLSv1.2,590,Application Data
1,3.8543850000005477,10.0.2.15,62.210.85.178,TLSv1.2,590,Application Data
1,3.854569000000083,62.210.85.178,10.0.2.15,TCP,60,9001  >  35978 [ACK] Seq=10534449 Ack=192105723 Win=65535 Len=0
1,3.8699710000000778,10.0.2.15,62.210.85.178,TLSv1.2,4124,Application Data
1,3.870085999999901,10.0.2.15,62.210.85.178,TCP,2974,35978  >  9001 [ACK] Seq=192109793 Ack=10534449 Win=65535 Len=2920 [TCP segment of a reassembled PDU]
1,3.870136999999886,62.210.85.178,10.0.2.15,TCP,60,9001  >  35978 [ACK] Seq=10534449 Ack=192107183 Win=65535 Len=0
1,3.8701490000003105,62.210.85.178,10.0.2.15,TCP,60,9001  >  35978 [ACK] Seq=10534449 Ack=192108643 Win=65535 Len=0
1,3.870154000000184,62.210.85.178,10.0.2.15,TCP,60,9001  >  35978 [ACK] Seq=10534449 Ack=192109793 Win=65535 Len=0
1,3.8701959999998508,10.0.2.15,62.210.85.178,TLSv1.2,1204,Application Data
1,3.8702350000003207,62.210.85.178,10.0.2.15,TCP,60,9001  >  35978 [ACK] Seq=10534449 Ack=192111253 Win=65535 Len=0
1,3.8702430000003005,62.210.85.178,10.0.2.15,TCP,60,9001  >  35978 [ACK] Seq=10534449 Ack=192112713 Win=65535 Len=0
1,3.8702469999998357,62.210.85.178,10.0.2.15,TCP,60,9001  >  35978 [ACK] Seq=10534449 Ack=192113863 Win=65535 Len=0
1,3.8702880000000732,10.0.2.15,62.210.85.178,TLSv1.2,4124,Application Data
1,3.870327000000543,62.210.85.178,10.0.2.15,TCP,60,9001  >  35978 [ACK] Seq=10534449 Ack=192115323 Win=65535 Len=0
1,3.870335000000523,62.210.85.178,10.0.2.15,TCP,60,9001  >  35978 [ACK] Seq=10534449 Ack=192116783 Win=65535 Len=0
1,3.8703400000003967,62.210.85.178,10.0.2.15,TCP,60,9001  >  35978 [ACK] Seq=10534449 Ack=192117933 Win=65535 Len=0
1,3.870378999999957,10.0.2.15,62.210.85.178,TLSv1.2,4124,Application Data
1,3.8704170000000886,62.210.85.178,10.0.2.15,TCP,60,9001  >  35978 [ACK] Seq=10534449 Ack=192119393 Win=65535 Len=0
1,3.8704250000000684,62.210.85.178,10.0.2.15,TCP,60,9001  >  35978 [ACK] Seq=10534449 Ack=192120853 Win=65535 Len=0
1,3.8704960000004576,10.0.2.15,62.210.85.178,TLSv1.2,2974,Application Data
1,3.870538000000124,62.210.85.178,10.0.2.15,TCP,60,9001  >  35978 [ACK] Seq=10534449 Ack=192122003 Win=65535 Len=0
1,3.8705449999997654,62.210.85.178,10.0.2.15,TCP,60,9001  >  35978 [ACK] Seq=10534449 Ack=192123463 Win=65535 Len=0
1,3.87054900000021,62.210.85.178,10.0.2.15,TCP,60,9001  >  35978 [ACK] Seq=10534449 Ack=192124923 Win=65535 Len=0
1,3.8705760000002556,10.0.2.15,62.210.85.178,TLSv1.2,1226,Application Data
1,3.8706120000006194,62.210.85.178,10.0.2.15,TCP,60,9001  >  35978 [ACK] Seq=10534449 Ack=192126095 Win=65535 Len=0
1,3.8706520000005185,10.0.2.15,62.210.85.178,TLSv1.2,4124,Application Data
1,3.8706890000003114,62.210.85.178,10.0.2.15,TCP,60,9001  >  35978 [ACK] Seq=10534449 Ack=192127555 Win=65535 Len=0
1,3.870697000000291,62.210.85.178,10.0.2.15,TCP,60,9001  >  35978 [ACK] Seq=10534449 Ack=192129015 Win=65535 Len=0
1,3.870702000000165,62.210.85.178,10.0.2.15,TCP,60,9001  >  35978 [ACK] Seq=10534449 Ack=192130165 Win=65535 Len=0
1,3.870741000000635,10.0.2.15,62.210.85.178,TLSv1.2,3030,Application Data
1,3.8707800000001953,62.210.85.178,10.0.2.15,TCP,60,9001  >  35978 [ACK] Seq=10534449 Ack=192131625 Win=65535 Len=0
1,3.8707869999998366,62.210.85.178,10.0.2.15,TCP,60,9001  >  35978 [ACK] Seq=10534449 Ack=192133085 Win=65535 Len=0
1,3.870791000000281,62.210.85.178,10.0.2.15,TCP,60,9001  >  35978 [ACK] Seq=10534449 Ack=192133141 Win=65535 Len=0
1,3.8799630000003162,10.0.2.15,62.210.85.178,TLSv1.2,4124,Application Data
1,3.8800160000000687,62.210.85.178,10.0.2.15,TCP,60,9001  >  35978 [ACK] Seq=10534449 Ack=192134601 Win=65535 Len=0
1,3.8800270000001547,62.210.85.178,10.0.2.15,TCP,60,9001  >  35978 [ACK] Seq=10534449 Ack=192136061 Win=65535 Len=0
1,3.8800320000000283,62.210.85.178,10.0.2.15,TCP,60,9001  >  35978 [ACK] Seq=10534449 Ack=192137211 Win=65535 Len=0
1,3.880076999999801,10.0.2.15,62.210.85.178,TLSv1.2,4124,Application Data
1,3.8801170000006096,62.210.85.178,10.0.2.15,TCP,60,9001  >  35978 [ACK] Seq=10534449 Ack=192138671 Win=65535 Len=0
1,3.8801260000000184,62.210.85.178,10.0.2.15,TCP,60,9001  >  35978 [ACK] Seq=10534449 Ack=192140131 Win=65535 Len=0
1,3.880130999999892,62.210.85.178,10.0.2.15,TCP,60,9001  >  35978 [ACK] Seq=10534449 Ack=192141281 Win=65535 Len=0
1,3.880170000000362,10.0.2.15,62.210.85.178,TLSv1.2,4124,Application Data
1,3.8802089999999225,62.210.85.178,10.0.2.15,TCP,60,9001  >  35978 [ACK] Seq=10534449 Ack=192142741 Win=65535 Len=0
1,3.8802169999999023,62.210.85.178,10.0.2.15,TCP,60,9001  >  35978 [ACK] Seq=10534449 Ack=192144201 Win=65535 Len=0
1,3.880221999999776,62.210.85.178,10.0.2.15,TCP,60,9001  >  35978 [ACK] Seq=10534449 Ack=192145351 Win=65535 Len=0
1,3.8802590000004784,10.0.2.15,62.210.85.178,TLSv1.2,4124,Application Data
1,3.88029700000061,62.210.85.178,10.0.2.15,TCP,60,9001  >  35978 [ACK] Seq=10534449 Ack=192146811 Win=65535 Len=0
1,3.8803060000000187,62.210.85.178,10.0.2.15,TCP,60,9001  >  35978 [ACK] Seq=10534449 Ack=192148271 Win=65535 Len=0
1,3.8803100000004633,62.210.85.178,10.0.2.15,TCP,60,9001  >  35978 [ACK] Seq=10534449 Ack=192149421 Win=65535 Len=0
1,3.8803450000004887,10.0.2.15,62.210.85.178,TLSv1.2,332,Application Data
1,3.880380999999943,62.210.85.178,10.0.2.15,TCP,60,9001  >  35978 [ACK] Seq=10534449 Ack=192149699 Win=65535 Len=0
1,3.880431999999928,10.0.2.15,62.210.85.178,TLSv1.2,3868,Application Data
1,3.8804700000000594,62.210.85.178,10.0.2.15,TCP,60,9001  >  35978 [ACK] Seq=10534449 Ack=192151159 Win=65535 Len=0
1,3.8804790000003777,62.210.85.178,10.0.2.15,TCP,60,9001  >  35978 [ACK] Seq=10534449 Ack=192152619 Win=65535 Len=0
1,3.8804840000002514,62.210.85.178,10.0.2.15,TCP,60,9001  >  35978 [ACK] Seq=10534449 Ack=192153513 Win=65535 Len=0
1,3.880522000000383,10.0.2.15,62.210.85.178,TLSv1.2,4124,Application Data
1,3.8805600000005143,62.210.85.178,10.0.2.15,TCP,60,9001  >  35978 [ACK] Seq=10534449 Ack=192154973 Win=65535 Len=0
1,3.880568000000494,62.210.85.178,10.0.2.15,TCP,60,9001  >  35978 [ACK] Seq=10534449 Ack=192156433 Win=65535 Len=0
1,3.880572000000029,62.210.85.178,10.0.2.15,TCP,60,9001  >  35978 [ACK] Seq=10534449 Ack=192157583 Win=65535 Len=0
1,3.8806070000000545,10.0.2.15,62.210.85.178,TLSv1.2,3030,Application Data
1,3.8806460000005245,62.210.85.178,10.0.2.15,TCP,60,9001  >  35978 [ACK] Seq=10534449 Ack=192159043 Win=65535 Len=0
1,3.8806540000005043,62.210.85.178,10.0.2.15,TCP,60,9001  >  35978 [ACK] Seq=10534449 Ack=192160503 Win=65535 Len=0
1,3.8806570000006104,62.210.85.178,10.0.2.15,TCP,60,9001  >  35978 [ACK] Seq=10534449 Ack=192160559 Win=65535 Len=0
1,3.893206000000646,10.0.2.15,62.210.85.178,TLSv1.2,4124,Application Data
1,3.8932590000003984,62.210.85.178,10.0.2.15,TCP,60,9001  >  35978 [ACK] Seq=10534449 Ack=192162019 Win=65535 Len=0
1,3.8932700000004843,62.210.85.178,10.0.2.15,TCP,60,9001  >  35978 [ACK] Seq=10534449 Ack=192163479 Win=65535 Len=0
1,3.893275000000358,62.210.85.178,10.0.2.15,TCP,60,9001  >  35978 [ACK] Seq=10534449 Ack=192164629 Win=65535 Len=0
1,3.8933200000001307,10.0.2.15,62.210.85.178,TLSv1.2,4124,Application Data
1,3.893361000000368,62.210.85.178,10.0.2.15,TCP,60,9001  >  35978 [ACK] Seq=10534449 Ack=192166089 Win=65535 Len=0
1,3.893369999999777,62.210.85.178,10.0.2.15,TCP,60,9001  >  35978 [ACK] Seq=10534449 Ack=192167549 Win=65535 Len=0
1,3.8933740000002217,62.210.85.178,10.0.2.15,TCP,60,9001  >  35978 [ACK] Seq=10534449 Ack=192168699 Win=65535 Len=0
1,3.893412000000353,10.0.2.15,62.210.85.178,TLSv1.2,4124,Application Data
1,3.8934500000004846,62.210.85.178,10.0.2.15,TCP,60,9001  >  35978 [ACK] Seq=10534449 Ack=192170159 Win=65535 Len=0
1,3.8934580000004644,62.210.85.178,10.0.2.15,TCP,60,9001  >  35978 [ACK] Seq=10534449 Ack=192171619 Win=65535 Len=0
1,3.893463000000338,62.210.85.178,10.0.2.15,TCP,60,9001  >  35978 [ACK] Seq=10534449 Ack=192172769 Win=65535 Len=0
1,3.8935019999998985,10.0.2.15,62.210.85.178,TLSv1.2,4124,Application Data
1,3.893539000000601,62.210.85.178,10.0.2.15,TCP,60,9001  >  35978 [ACK] Seq=10534449 Ack=192174229 Win=65535 Len=0
1,3.89354800000001,62.210.85.178,10.0.2.15,TCP,60,9001  >  35978 [ACK] Seq=10534449 Ack=192175689 Win=65535 Len=0
1,3.8935520000004544,62.210.85.178,10.0.2.15,TCP,60,9001  >  35978 [ACK] Seq=10534449 Ack=192176839 Win=65535 Len=0
1,3.8935870000004797,10.0.2.15,62.210.85.178,TLSv1.2,332,Application Data
1,3.893622999999934,62.210.85.178,10.0.2.15,TCP,60,9001  >  35978 [ACK] Seq=10534449 Ack=192177117 Win=65535 Len=0
1,3.89367300000049,10.0.2.15,62.210.85.178,TLSv1.2,3868,Application Data
1,3.8937120000000505,62.210.85.178,10.0.2.15,TCP,60,9001  >  35978 [ACK] Seq=10534449 Ack=192178577 Win=65535 Len=0
1,3.893721000000369,62.210.85.178,10.0.2.15,TCP,60,9001  >  35978 [ACK] Seq=10534449 Ack=192180037 Win=65535 Len=0
1,3.893724999999904,62.210.85.178,10.0.2.15,TCP,60,9001  >  35978 [ACK] Seq=10534449 Ack=192180931 Win=65535 Len=0
1,3.8937630000000354,10.0.2.15,62.210.85.178,TLSv1.2,2966,Application Data
1,3.893801000000167,62.210.85.178,10.0.2.15,TCP,60,9001  >  35978 [ACK] Seq=10534449 Ack=192182391 Win=65535 Len=0
1,3.893807999999808,62.210.85.178,10.0.2.15,TCP,60,9001  >  35978 [ACK] Seq=10534449 Ack=192183843 Win=65535 Len=0
1,3.999917000000096,54.93.77.70,10.0.2.15,TLSv1.2,7808,"Application Data, Application Data"
1,4.000035000000025,10.0.2.15,54.93.77.70,TCP,54,34692  >  9001 [ACK] Seq=10579859 Ack=191980021 Win=65535 Len=0
1,4.018702000000303,54.93.77.70,10.0.2.15,TCP,2950,"9001  >  34692 [PSH, ACK] Seq=191980021 Ack=10579859 Win=65535 Len=2896 [TCP segment of a reassembled PDU]"
1,4.018786999999975,10.0.2.15,54.93.77.70,TCP,54,34692  >  9001 [ACK] Seq=10579859 Ack=191982917 Win=65535 Len=0
1,4.030045999999857,54.93.77.70,10.0.2.15,TLSv1.2,1314,"Application Data, Application Data"
1,4.0302560000000085,10.0.2.15,54.93.77.70,TLSv1.2,590,Application Data
1,4.0303610000000845,54.93.77.70,10.0.2.15,TCP,60,9001  >  34692 [ACK] Seq=191984177 Ack=10580395 Win=65535 Len=0
1,4.046460000000479,54.93.77.70,10.0.2.15,TLSv1.2,11638,"Application Data, Application Data"
1,4.0464920000003985,54.93.77.70,10.0.2.15,TLSv1.2,2950,Application Data [TCP segment of a reassembled PDU]
1,4.046578000000409,10.0.2.15,54.93.77.70,TCP,54,34692  >  9001 [ACK] Seq=10580395 Ack=191998657 Win=65535 Len=0
1,4.0610160000005635,54.93.77.70,10.0.2.15,TLSv1.2,1082,Application Data
1,4.0611619999999675,10.0.2.15,54.93.77.70,TLSv1.2,590,Application Data
1,4.061244000000443,54.93.77.70,10.0.2.15,TCP,60,9001  >  34692 [ACK] Seq=191999685 Ack=10580931 Win=65535 Len=0
1,4.063219000000572,54.93.77.70,10.0.2.15,TCP,2950,"9001  >  34692 [PSH, ACK] Seq=191999685 Ack=10580931 Win=65535 Len=2896 [TCP segment of a reassembled PDU]"
1,4.0632830000004105,10.0.2.15,54.93.77.70,TCP,54,34692  >  9001 [ACK] Seq=10580931 Ack=192002581 Win=65535 Len=0
1,4.080428000000211,54.93.77.70,10.0.2.15,TLSv1.2,1314,"Application Data, Application Data"
1,4.1208770000002914,10.0.2.15,54.93.77.70,TCP,54,34692  >  9001 [ACK] Seq=10580931 Ack=192003841 Win=65535 Len=0
1,4.1318240000000515,54.93.77.70,10.0.2.15,TLSv1.2,11638,"Application Data, Application Data, Application Data"
1,4.131905000000188,10.0.2.15,54.93.77.70,TCP,54,34692  >  9001 [ACK] Seq=10580931 Ack=192015425 Win=65535 Len=0
1,4.141149000000041,54.93.77.70,10.0.2.15,TLSv1.2,1408,Application Data
1,4.141228999999839,10.0.2.15,54.93.77.70,TCP,54,34692  >  9001 [ACK] Seq=10580931 Ack=192016779 Win=65535 Len=0
1,4.146822000000611,54.93.77.70,10.0.2.15,TLSv1.2,4398,Application Data
1,4.146872000000258,10.0.2.15,54.93.77.70,TCP,54,34692  >  9001 [ACK] Seq=10580931 Ack=192021123 Win=65535 Len=0
1,4.148192000000563,54.93.77.70,10.0.2.15,TCP,2950,"9001  >  34692 [PSH, ACK] Seq=192021123 Ack=10580931 Win=65535 Len=2896 [TCP segment of a reassembled PDU]"
1,4.148232999999891,10.0.2.15,54.93.77.70,TCP,54,34692  >  9001 [ACK] Seq=10580931 Ack=192024019 Win=65535 Len=0
1,4.156208000000333,62.210.85.178,10.0.2.15,TLSv1.2,590,Application Data
1,4.157514999999876,54.93.77.70,10.0.2.15,TLSv1.2,568,Application Data
1,4.157553000000007,10.0.2.15,54.93.77.70,TCP,54,34692  >  9001 [ACK] Seq=10580931 Ack=192024533 Win=65535 Len=0
1,4.157710999999836,10.0.2.15,54.93.77.70,TLSv1.2,590,Application Data
1,4.157788000000437,54.93.77.70,10.0.2.15,TCP,60,9001  >  34692 [ACK] Seq=192024533 Ack=10581467 Win=65535 Len=0
1,4.161356999999953,54.93.77.70,10.0.2.15,TLSv1.2,4398,Application Data
1,4.16142200000013,10.0.2.15,54.93.77.70,TCP,54,34692  >  9001 [ACK] Seq=10581467 Ack=192028877 Win=65535 Len=0
1,4.162616999999955,54.93.77.70,10.0.2.15,TCP,2950,"9001  >  34692 [PSH, ACK] Seq=192028877 Ack=10581467 Win=65535 Len=2896 [TCP segment of a reassembled PDU]"
1,4.162656999999854,10.0.2.15,54.93.77.70,TCP,54,34692  >  9001 [ACK] Seq=10581467 Ack=192031773 Win=65535 Len=0
1,4.189385000000584,54.93.77.70,10.0.2.15,TLSv1.2,568,Application Data
1,4.190580999999838,62.210.85.178,10.0.2.15,TLSv1.2,590,Application Data
1,4.1906269999999495,10.0.2.15,62.210.85.178,TCP,54,35978  >  9001 [ACK] Seq=192183843 Ack=10535521 Win=65535 Len=0
1,4.198237999999947,54.93.77.70,10.0.2.15,TLSv1.2,2950,Application Data
1,4.198279000000184,10.0.2.15,54.93.77.70,TCP,54,34692  >  9001 [ACK] Seq=10581467 Ack=192035183 Win=65535 Len=0
1,4.199571000000105,54.93.77.70,10.0.2.15,TLSv1.2,8574,"Application Data, Application Data"
1,4.199687000000267,10.0.2.15,54.93.77.70,TCP,54,34692  >  9001 [ACK] Seq=10581467 Ack=192043703 Win=65535 Len=0
1,4.199751000000106,54.93.77.70,10.0.2.15,TLSv1.2,3118,Application Data [TCP segment of a reassembled PDU]
1,4.1998789999997825,10.0.2.15,54.93.77.70,TLSv1.2,590,Application Data
1,4.199948999999833,54.93.77.70,10.0.2.15,TCP,60,9001  >  34692 [ACK] Seq=192046767 Ack=10582003 Win=65535 Len=0
1,4.205202000000099,54.93.77.70,10.0.2.15,TLSv1.2,590,Application Data
1,4.248916000000463,10.0.2.15,54.93.77.70,TCP,54,34692  >  9001 [ACK] Seq=10582003 Ack=192047303 Win=65535 Len=0
1,4.269938000000366,54.93.77.70,10.0.2.15,TCP,2950,"9001  >  34692 [PSH, ACK] Seq=192047303 Ack=10582003 Win=65535 Len=2896 [TCP segment of a reassembled PDU]"
1,4.270006000000649,54.93.77.70,10.0.2.15,TLSv1.2,778,Application Data
1,4.270062999999936,10.0.2.15,54.93.77.70,TCP,54,34692  >  9001 [ACK] Seq=10582003 Ack=192050923 Win=65535 Len=0
1,4.2702500000004875,10.0.2.15,54.93.77.70,TLSv1.2,590,Application Data
1,4.2703190000002,54.93.77.70,10.0.2.15,TCP,60,9001  >  34692 [ACK] Seq=192050923 Ack=10582539 Win=65535 Len=0
