No.,Time,Source,Destination,Protocol,Length,Info
1,0.0269109999999273,10.0.2.15,54.93.77.70,TCP,54,34692  >  9001 [ACK] Seq=11046041 Ack=201599605 Win=65535 Len=0
1,0.03366600000026665,62.210.85.178,10.0.2.15,TLSv1.2,1104,Application Data
1,0.07113500000014028,62.210.85.178,10.0.2.15,TLSv1.2,590,Application Data
1,0.07122200000048906,10.0.2.15,62.210.85.178,TCP,54,35978  >  9001 [ACK] Seq=201729049 Ack=10997829 Win=65535 Len=0
1,0.10386400000061258,62.210.85.178,10.0.2.15,TLSv1.2,590,Application Data
1,0.13696799999979703,10.0.2.15,54.93.77.70,TLSv1.2,590,Application Data
1,0.13712399999985792,54.93.77.70,10.0.2.15,TCP,60,9001  >  34692 [ACK] Seq=201599605 Ack=11046577 Win=65535 Len=0
1,0.14438700000027893,10.0.2.15,62.210.85.178,TCP,54,35978  >  9001 [ACK] Seq=201729049 Ack=10998365 Win=65535 Len=0
1,0.24701600000025792,62.210.85.178,10.0.2.15,TLSv1.2,590,Application Data
1,0.24708400000054098,10.0.2.15,62.210.85.178,TCP,54,35978  >  9001 [ACK] Seq=201729049 Ack=10998901 Win=65535 Len=0
1,0.2475460000005114,10.0.2.15,62.210.85.178,TLSv1.2,590,Application Data
1,0.2476489999999103,62.210.85.178,10.0.2.15,TCP,60,9001  >  35978 [ACK] Seq=10998901 Ack=201729585 Win=65535 Len=0
1,0.3991940000005343,54.93.77.70,10.0.2.15,TLSv1.2,590,Application Data
1,0.3992710000002262,10.0.2.15,54.93.77.70,TCP,54,34692  >  9001 [ACK] Seq=11046577 Ack=201600141 Win=65535 Len=0
1,0.39964599999984785,10.0.2.15,54.93.77.70,TLSv1.2,1618,Application Data
1,0.3997540000000299,54.93.77.70,10.0.2.15,TCP,60,9001  >  34692 [ACK] Seq=201600141 Ack=11048037 Win=65535 Len=0
1,0.39976600000045437,54.93.77.70,10.0.2.15,TCP,60,9001  >  34692 [ACK] Seq=201600141 Ack=11048141 Win=65535 Len=0
1,0.5047750000003361,62.210.85.178,10.0.2.15,TLSv1.2,1618,Application Data
1,0.5048870000000534,10.0.2.15,62.210.85.178,TCP,54,35978  >  9001 [ACK] Seq=201729585 Ack=11000465 Win=65535 Len=0
1,0.5273489999999583,10.0.2.15,62.210.85.178,TLSv1.2,590,Application Data
1,0.5274770000005446,62.210.85.178,10.0.2.15,TCP,60,9001  >  35978 [ACK] Seq=11000465 Ack=201730121 Win=65535 Len=0
1,0.5369470000005094,10.0.2.15,62.210.85.178,TLSv1.2,1618,Application Data
1,0.5370609999999942,62.210.85.178,10.0.2.15,TCP,60,9001  >  35978 [ACK] Seq=11000465 Ack=201731581 Win=65535 Len=0
1,0.5370769999999538,62.210.85.178,10.0.2.15,TCP,60,9001  >  35978 [ACK] Seq=11000465 Ack=201731685 Win=65535 Len=0
1,1.628537000000506,54.93.77.70,10.0.2.15,TLSv1.2,2132,Application Data
1,1.6286610000006476,10.0.2.15,54.93.77.70,TCP,54,34692  >  9001 [ACK] Seq=11048141 Ack=201602219 Win=65535 Len=0
1,1.6306580000000395,10.0.2.15,54.93.77.70,TLSv1.2,590,Application Data
1,1.6308360000002722,54.93.77.70,10.0.2.15,TCP,60,9001  >  34692 [ACK] Seq=201602219 Ack=11048677 Win=65535 Len=0
1,1.9339780000000246,62.210.85.178,10.0.2.15,TLSv1.2,590,Application Data
1,1.9342839999999342,10.0.2.15,62.210.85.178,TLSv1.2,590,Application Data
1,1.9343910000006872,62.210.85.178,10.0.2.15,TCP,60,9001  >  35978 [ACK] Seq=11001001 Ack=201732221 Win=65535 Len=0
1,2.138628000000608,54.93.77.70,10.0.2.15,TLSv1.2,590,Application Data
1,2.1390080000001035,10.0.2.15,54.93.77.70,TLSv1.2,590,Application Data
1,2.1391100000000733,54.93.77.70,10.0.2.15,TCP,60,9001  >  34692 [ACK] Seq=201602755 Ack=11049213 Win=65535 Len=0
1,2.2418130000005476,62.210.85.178,10.0.2.15,TLSv1.2,590,Application Data
1,2.2460540000001856,10.0.2.15,62.210.85.178,TLSv1.2,590,Application Data
1,2.2461990000001606,62.210.85.178,10.0.2.15,TCP,60,9001  >  35978 [ACK] Seq=11001537 Ack=201732757 Win=65535 Len=0
1,2.25768700000026,10.0.2.15,62.210.85.178,TLSv1.2,4124,Application Data
1,2.257849999999962,10.0.2.15,62.210.85.178,TCP,2974,35978  >  9001 [ACK] Seq=201736827 Ack=11001537 Win=65535 Len=2920 [TCP segment of a reassembled PDU]
1,2.2578790000006848,62.210.85.178,10.0.2.15,TCP,60,9001  >  35978 [ACK] Seq=11001537 Ack=201734217 Win=65535 Len=0
1,2.257889999999861,62.210.85.178,10.0.2.15,TCP,60,9001  >  35978 [ACK] Seq=11001537 Ack=201735677 Win=65535 Len=0
1,2.257894000000306,62.210.85.178,10.0.2.15,TCP,60,9001  >  35978 [ACK] Seq=11001537 Ack=201736827 Win=65535 Len=0
1,2.2578990000001795,62.210.85.178,10.0.2.15,TCP,60,9001  >  35978 [ACK] Seq=11001537 Ack=201738287 Win=65535 Len=0
1,2.257903000000624,62.210.85.178,10.0.2.15,TCP,60,9001  >  35978 [ACK] Seq=11001537 Ack=201739747 Win=65535 Len=0
1,2.257948000000397,10.0.2.15,62.210.85.178,TLSv1.2,1204,Application Data
1,2.2579900000000634,62.210.85.178,10.0.2.15,TCP,60,9001  >  35978 [ACK] Seq=11001537 Ack=201740897 Win=65535 Len=0
1,2.2580400000006193,10.0.2.15,62.210.85.178,TLSv1.2,4124,Application Data
1,2.2580800000005183,62.210.85.178,10.0.2.15,TCP,60,9001  >  35978 [ACK] Seq=11001537 Ack=201742357 Win=65535 Len=0
1,2.2580870000001596,62.210.85.178,10.0.2.15,TCP,60,9001  >  35978 [ACK] Seq=11001537 Ack=201743817 Win=65535 Len=0
1,2.2580910000006043,62.210.85.178,10.0.2.15,TCP,60,9001  >  35978 [ACK] Seq=11001537 Ack=201744967 Win=65535 Len=0
1,2.2581410000002506,10.0.2.15,62.210.85.178,TLSv1.2,4124,Application Data
1,2.258241000000453,10.0.2.15,62.210.85.178,TLSv1.2,2974,Application Data
1,2.258264000000054,62.210.85.178,10.0.2.15,TCP,60,9001  >  35978 [ACK] Seq=11001537 Ack=201746427 Win=65535 Len=0
1,2.2582710000006045,62.210.85.178,10.0.2.15,TCP,60,9001  >  35978 [ACK] Seq=11001537 Ack=201747887 Win=65535 Len=0
1,2.2582750000001397,62.210.85.178,10.0.2.15,TCP,60,9001  >  35978 [ACK] Seq=11001537 Ack=201749037 Win=65535 Len=0
1,2.2582790000005843,62.210.85.178,10.0.2.15,TCP,60,9001  >  35978 [ACK] Seq=11001537 Ack=201750497 Win=65535 Len=0
1,2.2582830000001195,62.210.85.178,10.0.2.15,TCP,60,9001  >  35978 [ACK] Seq=11001537 Ack=201751957 Win=65535 Len=0
1,2.2583220000005895,10.0.2.15,62.210.85.178,TLSv1.2,1226,Application Data
1,2.2583590000003824,62.210.85.178,10.0.2.15,TCP,60,9001  >  35978 [ACK] Seq=11001537 Ack=201753129 Win=65535 Len=0
1,2.2584090000000288,10.0.2.15,62.210.85.178,TLSv1.2,4124,Application Data
1,2.2584500000002663,62.210.85.178,10.0.2.15,TCP,60,9001  >  35978 [ACK] Seq=11001537 Ack=201754589 Win=65535 Len=0
1,2.2584560000004785,62.210.85.178,10.0.2.15,TCP,60,9001  >  35978 [ACK] Seq=11001537 Ack=201756049 Win=65535 Len=0
1,2.258461000000352,62.210.85.178,10.0.2.15,TCP,60,9001  >  35978 [ACK] Seq=11001537 Ack=201757199 Win=65535 Len=0
1,2.258506000000125,10.0.2.15,62.210.85.178,TLSv1.2,3030,Application Data
1,2.2585470000003625,62.210.85.178,10.0.2.15,TCP,60,9001  >  35978 [ACK] Seq=11001537 Ack=201758659 Win=65535 Len=0
1,2.2585530000005747,62.210.85.178,10.0.2.15,TCP,60,9001  >  35978 [ACK] Seq=11001537 Ack=201760119 Win=65535 Len=0
1,2.2585580000004484,62.210.85.178,10.0.2.15,TCP,60,9001  >  35978 [ACK] Seq=11001537 Ack=201760175 Win=65535 Len=0
1,2.2677440000006754,10.0.2.15,62.210.85.178,TLSv1.2,4124,Application Data
1,2.2678670000004786,62.210.85.178,10.0.2.15,TCP,60,9001  >  35978 [ACK] Seq=11001537 Ack=201761635 Win=65535 Len=0
1,2.267880000000332,62.210.85.178,10.0.2.15,TCP,60,9001  >  35978 [ACK] Seq=11001537 Ack=201763095 Win=65535 Len=0
1,2.2678850000002058,62.210.85.178,10.0.2.15,TCP,60,9001  >  35978 [ACK] Seq=11001537 Ack=201764245 Win=65535 Len=0
1,2.2679250000001048,10.0.2.15,62.210.85.178,TLSv1.2,1168,Application Data
1,2.2680319999999483,62.210.85.178,10.0.2.15,TCP,60,9001  >  35978 [ACK] Seq=11001537 Ack=201765359 Win=65535 Len=0
1,2.3459890000003725,54.93.77.70,10.0.2.15,TLSv1.2,590,Application Data
1,2.3883660000001328,10.0.2.15,54.93.77.70,TCP,54,34692  >  9001 [ACK] Seq=11049213 Ack=201603291 Win=65535 Len=0
1,2.3982270000005883,54.93.77.70,10.0.2.15,TCP,2950,"9001  >  34692 [PSH, ACK] Seq=201603291 Ack=11049213 Win=65535 Len=2896 [TCP segment of a reassembled PDU]"
1,2.3982999999998356,10.0.2.15,54.93.77.70,TCP,54,34692  >  9001 [ACK] Seq=11049213 Ack=201606187 Win=65535 Len=0
1,2.4000560000004043,54.93.77.70,10.0.2.15,TLSv1.2,778,Application Data
1,2.4000990000004094,10.0.2.15,54.93.77.70,TCP,54,34692  >  9001 [ACK] Seq=11049213 Ack=201606911 Win=65535 Len=0
1,2.4002790000004097,10.0.2.15,54.93.77.70,TLSv1.2,590,Application Data
1,2.4003560000001016,54.93.77.70,10.0.2.15,TCP,60,9001  >  34692 [ACK] Seq=201606911 Ack=11049749 Win=65535 Len=0
1,2.4093840000005002,54.93.77.70,10.0.2.15,TCP,2950,"9001  >  34692 [PSH, ACK] Seq=201606911 Ack=11049749 Win=65535 Len=2896 [TCP segment of a reassembled PDU]"
1,2.409472000000278,10.0.2.15,54.93.77.70,TCP,54,34692  >  9001 [ACK] Seq=11049749 Ack=201609807 Win=65535 Len=0
1,2.4159700000000157,54.93.77.70,10.0.2.15,TLSv1.2,1314,"Application Data, Application Data"
1,2.43601100000069,54.93.77.70,10.0.2.15,TLSv1.2,3674,Application Data
1,2.4360620000006747,10.0.2.15,54.93.77.70,TCP,54,34692  >  9001 [ACK] Seq=11049749 Ack=201614687 Win=65535 Len=0
1,2.4707109999999375,54.93.77.70,10.0.2.15,TCP,2950,"9001  >  34692 [PSH, ACK] Seq=201614687 Ack=11049749 Win=65535 Len=2896 [TCP segment of a reassembled PDU]"
1,2.470769000000473,10.0.2.15,54.93.77.70,TCP,54,34692  >  9001 [ACK] Seq=11049749 Ack=201617583 Win=65535 Len=0
1,2.470817000000352,54.93.77.70,10.0.2.15,TLSv1.2,778,Application Data
1,2.4819040000002133,54.93.77.70,10.0.2.15,TCP,2950,"9001  >  34692 [PSH, ACK] Seq=201618307 Ack=11049749 Win=65535 Len=2896 [TCP segment of a reassembled PDU]"
1,2.4819470000002184,10.0.2.15,54.93.77.70,TCP,54,34692  >  9001 [ACK] Seq=11049749 Ack=201621203 Win=65535 Len=0
1,2.487720000000081,54.93.77.70,10.0.2.15,TLSv1.2,1314,"Application Data, Application Data"
1,2.496165999999903,54.93.77.70,10.0.2.15,TCP,1502,"9001  >  34692 [PSH, ACK] Seq=201622463 Ack=11049749 Win=65535 Len=1448 [TCP segment of a reassembled PDU]"
1,2.496211000000585,10.0.2.15,54.93.77.70,TCP,54,34692  >  9001 [ACK] Seq=11049749 Ack=201623911 Win=65535 Len=0
1,2.503819999999905,54.93.77.70,10.0.2.15,TLSv1.2,170,Application Data
1,2.5076060000001235,54.93.77.70,10.0.2.15,TCP,2950,"9001  >  34692 [PSH, ACK] Seq=201624027 Ack=11049749 Win=65535 Len=2896 [TCP segment of a reassembled PDU]"
1,2.5076319999998304,54.93.77.70,10.0.2.15,TLSv1.2,8742,"Application Data, Application Data"
1,2.5076990000006845,10.0.2.15,54.93.77.70,TCP,54,34692  >  9001 [ACK] Seq=11049749 Ack=201635611 Win=65535 Len=0
1,2.507908999999927,10.0.2.15,54.93.77.70,TLSv1.2,590,Application Data
1,2.507988000000296,54.93.77.70,10.0.2.15,TCP,60,9001  >  34692 [ACK] Seq=201635611 Ack=11050285 Win=65535 Len=0
1,2.5227530000001934,54.93.77.70,10.0.2.15,TLSv1.2,358,Application Data
1,2.525032000000465,10.0.2.15,54.93.77.70,TLSv1.2,590,Application Data
1,2.5251990000006117,54.93.77.70,10.0.2.15,TCP,60,9001  >  34692 [ACK] Seq=201635915 Ack=11050821 Win=65535 Len=0
1,2.6103940000002694,62.210.85.178,10.0.2.15,TLSv1.2,590,Application Data
1,2.652411000000029,10.0.2.15,62.210.85.178,TCP,54,35978  >  9001 [ACK] Seq=201765359 Ack=11002073 Win=65535 Len=0
1,2.720151000000442,62.210.85.178,10.0.2.15,TLSv1.2,590,Application Data
1,2.7202330000000075,10.0.2.15,62.210.85.178,TCP,54,35978  >  9001 [ACK] Seq=201765359 Ack=11002609 Win=65535 Len=0
1,2.856573000000026,62.210.85.178,10.0.2.15,TLSv1.2,590,Application Data
1,2.8566490000002887,10.0.2.15,62.210.85.178,TCP,54,35978  >  9001 [ACK] Seq=201765359 Ack=11003145 Win=65535 Len=0
1,2.8571230000006835,10.0.2.15,62.210.85.178,TLSv1.2,590,Application Data
1,2.857241000000613,62.210.85.178,10.0.2.15,TCP,60,9001  >  35978 [ACK] Seq=11003145 Ack=201765895 Win=65535 Len=0
1,2.9579020000001037,54.93.77.70,10.0.2.15,TLSv1.2,590,Application Data
1,2.958284000000276,10.0.2.15,54.93.77.70,TLSv1.2,590,Application Data
1,2.958400999999867,54.93.77.70,10.0.2.15,TCP,60,9001  >  34692 [ACK] Seq=201636451 Ack=11051357 Win=65535 Len=0
1,3.09742499999993,62.210.85.178,10.0.2.15,TLSv1.2,590,Application Data
1,3.1016129999998157,10.0.2.15,62.210.85.178,TLSv1.2,590,Application Data
1,3.101799000000028,62.210.85.178,10.0.2.15,TCP,60,9001  >  35978 [ACK] Seq=11003681 Ack=201766431 Win=65535 Len=0
1,3.113060000000587,10.0.2.15,62.210.85.178,TLSv1.2,4124,Application Data
1,3.113162000000557,10.0.2.15,62.210.85.178,TCP,2974,35978  >  9001 [ACK] Seq=201770501 Ack=11003681 Win=65535 Len=2920 [TCP segment of a reassembled PDU]
1,3.1132070000003296,62.210.85.178,10.0.2.15,TCP,60,9001  >  35978 [ACK] Seq=11003681 Ack=201767891 Win=65535 Len=0
1,3.113220000000183,62.210.85.178,10.0.2.15,TCP,60,9001  >  35978 [ACK] Seq=11003681 Ack=201769351 Win=65535 Len=0
1,3.1132250000000568,62.210.85.178,10.0.2.15,TCP,60,9001  >  35978 [ACK] Seq=11003681 Ack=201770501 Win=65535 Len=0
1,3.113228000000163,62.210.85.178,10.0.2.15,TCP,60,9001  >  35978 [ACK] Seq=11003681 Ack=201771961 Win=65535 Len=0
1,3.113231000000269,62.210.85.178,10.0.2.15,TCP,60,9001  >  35978 [ACK] Seq=11003681 Ack=201773421 Win=65535 Len=0
1,3.1132699999998295,10.0.2.15,62.210.85.178,TLSv1.2,1204,Application Data
1,3.113307999999961,62.210.85.178,10.0.2.15,TCP,60,9001  >  35978 [ACK] Seq=11003681 Ack=201774571 Win=65535 Len=0
1,3.113354000000072,10.0.2.15,62.210.85.178,TLSv1.2,4124,Application Data
1,3.113393000000542,62.210.85.178,10.0.2.15,TCP,60,9001  >  35978 [ACK] Seq=11003681 Ack=201776031 Win=65535 Len=0
1,3.113401999999951,62.210.85.178,10.0.2.15,TCP,60,9001  >  35978 [ACK] Seq=11003681 Ack=201777491 Win=65535 Len=0
1,3.1134060000003956,62.210.85.178,10.0.2.15,TCP,60,9001  >  35978 [ACK] Seq=11003681 Ack=201778641 Win=65535 Len=0
1,3.113444999999956,10.0.2.15,62.210.85.178,TLSv1.2,4124,Application Data
1,3.1134830000000875,62.210.85.178,10.0.2.15,TCP,60,9001  >  35978 [ACK] Seq=11003681 Ack=201780101 Win=65535 Len=0
1,3.1134910000000673,62.210.85.178,10.0.2.15,TCP,60,9001  >  35978 [ACK] Seq=11003681 Ack=201781561 Win=65535 Len=0
1,3.1135510000003705,10.0.2.15,62.210.85.178,TLSv1.2,2974,Application Data
1,3.1135910000002696,62.210.85.178,10.0.2.15,TCP,60,9001  >  35978 [ACK] Seq=11003681 Ack=201782711 Win=65535 Len=0
1,3.1135990000002494,62.210.85.178,10.0.2.15,TCP,60,9001  >  35978 [ACK] Seq=11003681 Ack=201784171 Win=65535 Len=0
1,3.1136020000003555,62.210.85.178,10.0.2.15,TCP,60,9001  >  35978 [ACK] Seq=11003681 Ack=201785631 Win=65535 Len=0
1,3.11362999999983,10.0.2.15,62.210.85.178,TLSv1.2,1226,Application Data
1,3.1136679999999615,62.210.85.178,10.0.2.15,TCP,60,9001  >  35978 [ACK] Seq=11003681 Ack=201786803 Win=65535 Len=0
1,3.113709000000199,10.0.2.15,62.210.85.178,TLSv1.2,4124,Application Data
1,3.1137550000003102,62.210.85.178,10.0.2.15,TCP,60,9001  >  35978 [ACK] Seq=11003681 Ack=201788263 Win=65535 Len=0
1,3.11376300000029,62.210.85.178,10.0.2.15,TCP,60,9001  >  35978 [ACK] Seq=11003681 Ack=201789723 Win=65535 Len=0
1,3.113766000000396,62.210.85.178,10.0.2.15,TCP,60,9001  >  35978 [ACK] Seq=11003681 Ack=201790873 Win=65535 Len=0
1,3.1138049999999566,10.0.2.15,62.210.85.178,TLSv1.2,3030,Application Data
1,3.1138440000004266,62.210.85.178,10.0.2.15,TCP,60,9001  >  35978 [ACK] Seq=11003681 Ack=201792333 Win=65535 Len=0
1,3.1138520000004064,62.210.85.178,10.0.2.15,TCP,60,9001  >  35978 [ACK] Seq=11003681 Ack=201793793 Win=65535 Len=0
1,3.1138550000005125,62.210.85.178,10.0.2.15,TCP,60,9001  >  35978 [ACK] Seq=11003681 Ack=201793849 Win=65535 Len=0
1,3.123051999999916,10.0.2.15,62.210.85.178,TLSv1.2,590,Application Data
1,3.123102999999901,62.210.85.178,10.0.2.15,TCP,60,9001  >  35978 [ACK] Seq=11003681 Ack=201794385 Win=65535 Len=0
1,3.21282599999995,54.93.77.70,10.0.2.15,TCP,2950,"9001  >  34692 [PSH, ACK] Seq=201636451 Ack=11051357 Win=65535 Len=2896 [TCP segment of a reassembled PDU]"
1,3.2129580000000715,10.0.2.15,54.93.77.70,TCP,54,34692  >  9001 [ACK] Seq=11051357 Ack=201639347 Win=65535 Len=0
1,3.2132510000001275,54.93.77.70,10.0.2.15,TLSv1.2,778,Application Data
1,3.2470030000004044,54.93.77.70,10.0.2.15,TCP,2950,"9001  >  34692 [PSH, ACK] Seq=201640071 Ack=11051357 Win=65535 Len=2896 [TCP segment of a reassembled PDU]"
1,3.247073000000455,10.0.2.15,54.93.77.70,TCP,54,34692  >  9001 [ACK] Seq=11051357 Ack=201642967 Win=65535 Len=0
1,3.258722000000489,54.93.77.70,10.0.2.15,TLSv1.2,2950,Application Data [TCP segment of a reassembled PDU]
1,3.258762000000388,54.93.77.70,10.0.2.15,TCP,1502,"9001  >  34692 [PSH, ACK] Seq=201645863 Ack=11051357 Win=65535 Len=1448 [TCP segment of a reassembled PDU]"
1,3.2588290000003326,10.0.2.15,54.93.77.70,TCP,54,34692  >  9001 [ACK] Seq=11051357 Ack=201645863 Win=65535 Len=0
1,3.258921000000555,10.0.2.15,54.93.77.70,TCP,54,34692  >  9001 [ACK] Seq=11051357 Ack=201647311 Win=65535 Len=0
1,3.262471000000005,54.93.77.70,10.0.2.15,TLSv1.2,590,"Application Data, Application Data"
1,3.2689319999999498,54.93.77.70,10.0.2.15,TLSv1.2,7294,Application Data
1,3.269014999999854,10.0.2.15,54.93.77.70,TCP,54,34692  >  9001 [ACK] Seq=11051357 Ack=201655087 Win=65535 Len=0
1,3.2785530000001017,54.93.77.70,10.0.2.15,TLSv1.2,2950,"Application Data, Application Data"
1,3.2785700000004,54.93.77.70,10.0.2.15,TLSv1.2,800,Application Data
1,3.2786150000001726,10.0.2.15,54.93.77.70,TCP,54,34692  >  9001 [ACK] Seq=11051357 Ack=201657983 Win=65535 Len=0
1,3.3140790000006746,54.93.77.70,10.0.2.15,TLSv1.2,2950,Application Data
1,3.3141160000004675,54.93.77.70,10.0.2.15,TCP,1502,"9001  >  34692 [PSH, ACK] Seq=201661625 Ack=11051357 Win=65535 Len=1448 [TCP segment of a reassembled PDU]"
1,3.3141599999999016,10.0.2.15,54.93.77.70,TCP,54,34692  >  9001 [ACK] Seq=11051357 Ack=201661625 Win=65535 Len=0
1,3.314259000000675,10.0.2.15,54.93.77.70,TCP,54,34692  >  9001 [ACK] Seq=11051357 Ack=201663073 Win=65535 Len=0
1,3.3143980000004376,10.0.2.15,54.93.77.70,TLSv1.2,590,Application Data
1,3.314476999999897,54.93.77.70,10.0.2.15,TCP,60,9001  >  34692 [ACK] Seq=201663073 Ack=11051893 Win=65535 Len=0
1,3.329577000000427,54.93.77.70,10.0.2.15,TLSv1.2,380,Application Data
1,3.3297130000000834,10.0.2.15,54.93.77.70,TLSv1.2,590,Application Data
1,3.32979400000022,54.93.77.70,10.0.2.15,TCP,60,9001  >  34692 [ACK] Seq=201663399 Ack=11052429 Win=65535 Len=0
1,3.336757000000034,54.93.77.70,10.0.2.15,TCP,1502,"9001  >  34692 [PSH, ACK] Seq=201663399 Ack=11052429 Win=65535 Len=1448 [TCP segment of a reassembled PDU]"
1,3.3368209999998726,10.0.2.15,54.93.77.70,TCP,54,34692  >  9001 [ACK] Seq=11052429 Ack=201664847 Win=65535 Len=0
1,3.3492080000005444,54.93.77.70,10.0.2.15,TLSv1.2,170,Application Data
1,3.3521440000004077,10.0.2.15,54.93.77.70,TLSv1.2,590,Application Data
1,3.35229900000013,54.93.77.70,10.0.2.15,TCP,60,9001  >  34692 [ACK] Seq=201664963 Ack=11052965 Win=65535 Len=0
1,3.5726439999998547,62.210.85.178,10.0.2.15,TLSv1.2,590,Application Data
1,3.616410999999971,10.0.2.15,62.210.85.178,TCP,54,35978  >  9001 [ACK] Seq=201794385 Ack=11004217 Win=65535 Len=0
1,3.778772000000572,62.210.85.178,10.0.2.15,TLSv1.2,1104,Application Data
1,3.778849000000264,10.0.2.15,62.210.85.178,TCP,54,35978  >  9001 [ACK] Seq=201794385 Ack=11005267 Win=65535 Len=0
1,3.7793280000005325,10.0.2.15,62.210.85.178,TLSv1.2,590,Application Data
1,3.779438000000482,62.210.85.178,10.0.2.15,TCP,60,9001  >  35978 [ACK] Seq=11005267 Ack=201794921 Win=65535 Len=0
1,4.086312000000362,54.93.77.70,10.0.2.15,TLSv1.2,590,Application Data
1,4.086715000000368,10.0.2.15,54.93.77.70,TLSv1.2,590,Application Data
1,4.086817000000337,54.93.77.70,10.0.2.15,TCP,60,9001  >  34692 [ACK] Seq=201665499 Ack=11053501 Win=65535 Len=0
1,4.28899200000069,62.210.85.178,10.0.2.15,TLSv1.2,590,Application Data
1,4.294563999999809,10.0.2.15,62.210.85.178,TLSv1.2,590,Application Data
1,4.294730000000527,62.210.85.178,10.0.2.15,TCP,60,9001  >  35978 [ACK] Seq=11005803 Ack=201795457 Win=65535 Len=0
1,4.304917999999816,10.0.2.15,62.210.85.178,TLSv1.2,4124,Application Data
1,4.305018000000018,10.0.2.15,62.210.85.178,TCP,2974,35978  >  9001 [ACK] Seq=201799527 Ack=11005803 Win=65535 Len=2920 [TCP segment of a reassembled PDU]
1,4.305091000000175,62.210.85.178,10.0.2.15,TCP,60,9001  >  35978 [ACK] Seq=11005803 Ack=201796917 Win=65535 Len=0
1,4.305107000000135,62.210.85.178,10.0.2.15,TCP,60,9001  >  35978 [ACK] Seq=11005803 Ack=201798377 Win=65535 Len=0
1,4.305110000000241,62.210.85.178,10.0.2.15,TCP,60,9001  >  35978 [ACK] Seq=11005803 Ack=201799527 Win=65535 Len=0
1,4.305113000000347,62.210.85.178,10.0.2.15,TCP,60,9001  >  35978 [ACK] Seq=11005803 Ack=201800987 Win=65535 Len=0
1,4.305115000000114,62.210.85.178,10.0.2.15,TCP,60,9001  >  35978 [ACK] Seq=11005803 Ack=201802447 Win=65535 Len=0
1,4.30516500000067,10.0.2.15,62.210.85.178,TLSv1.2,1204,Application Data
1,4.305210000000443,62.210.85.178,10.0.2.15,TCP,60,9001  >  35978 [ACK] Seq=11005803 Ack=201803597 Win=65535 Len=0
1,4.30526700000064,10.0.2.15,62.210.85.178,TLSv1.2,4124,Application Data
1,4.305306000000201,62.210.85.178,10.0.2.15,TCP,60,9001  >  35978 [ACK] Seq=11005803 Ack=201805057 Win=65535 Len=0
1,4.305315000000519,62.210.85.178,10.0.2.15,TCP,60,9001  >  35978 [ACK] Seq=11005803 Ack=201806517 Win=65535 Len=0
1,4.305319000000054,62.210.85.178,10.0.2.15,TCP,60,9001  >  35978 [ACK] Seq=11005803 Ack=201807667 Win=65535 Len=0
1,4.305358999999953,10.0.2.15,62.210.85.178,TLSv1.2,4124,Application Data
1,4.305393000000549,62.210.85.178,10.0.2.15,TCP,60,9001  >  35978 [ACK] Seq=11005803 Ack=201809127 Win=65535 Len=0
1,4.305400000000191,62.210.85.178,10.0.2.15,TCP,60,9001  >  35978 [ACK] Seq=11005803 Ack=201810587 Win=65535 Len=0
1,4.305460000000494,10.0.2.15,62.210.85.178,TLSv1.2,2974,Application Data
1,4.305497000000287,62.210.85.178,10.0.2.15,TCP,60,9001  >  35978 [ACK] Seq=11005803 Ack=201811737 Win=65535 Len=0
1,4.305503000000499,62.210.85.178,10.0.2.15,TCP,60,9001  >  35978 [ACK] Seq=11005803 Ack=201813197 Win=65535 Len=0
1,4.305506000000605,62.210.85.178,10.0.2.15,TCP,60,9001  >  35978 [ACK] Seq=11005803 Ack=201814657 Win=65535 Len=0
1,4.305538000000524,10.0.2.15,62.210.85.178,TLSv1.2,1226,Application Data
1,4.305570999999873,62.210.85.178,10.0.2.15,TCP,60,9001  >  35978 [ACK] Seq=11005803 Ack=201815829 Win=65535 Len=0
1,4.3056100000003426,10.0.2.15,62.210.85.178,TLSv1.2,4124,Application Data
1,4.305645000000368,62.210.85.178,10.0.2.15,TCP,60,9001  >  35978 [ACK] Seq=11005803 Ack=201817289 Win=65535 Len=0
1,4.30565100000058,62.210.85.178,10.0.2.15,TCP,60,9001  >  35978 [ACK] Seq=11005803 Ack=201818749 Win=65535 Len=0
1,4.305654000000686,62.210.85.178,10.0.2.15,TCP,60,9001  >  35978 [ACK] Seq=11005803 Ack=201819899 Win=65535 Len=0
1,4.305690000000141,10.0.2.15,62.210.85.178,TLSv1.2,3030,Application Data
1,4.305725000000166,62.210.85.178,10.0.2.15,TCP,60,9001  >  35978 [ACK] Seq=11005803 Ack=201821359 Win=65535 Len=0
1,4.305731000000378,62.210.85.178,10.0.2.15,TCP,60,9001  >  35978 [ACK] Seq=11005803 Ack=201822819 Win=65535 Len=0
1,4.305734000000484,62.210.85.178,10.0.2.15,TCP,60,9001  >  35978 [ACK] Seq=11005803 Ack=201822875 Win=65535 Len=0
1,4.317189000000326,10.0.2.15,62.210.85.178,TLSv1.2,4124,Application Data
1,4.317235999999866,62.210.85.178,10.0.2.15,TCP,60,9001  >  35978 [ACK] Seq=11005803 Ack=201824335 Win=65535 Len=0
1,4.317246000000523,62.210.85.178,10.0.2.15,TCP,60,9001  >  35978 [ACK] Seq=11005803 Ack=201825795 Win=65535 Len=0
1,4.317251000000397,62.210.85.178,10.0.2.15,TCP,60,9001  >  35978 [ACK] Seq=11005803 Ack=201826945 Win=65535 Len=0
1,4.317294999999831,10.0.2.15,62.210.85.178,TLSv1.2,4124,Application Data
1,4.317355000000134,62.210.85.178,10.0.2.15,TCP,60,9001  >  35978 [ACK] Seq=11005803 Ack=201828405 Win=65535 Len=0
1,4.317361000000346,62.210.85.178,10.0.2.15,TCP,60,9001  >  35978 [ACK] Seq=11005803 Ack=201829865 Win=65535 Len=0
1,4.3173640000004525,62.210.85.178,10.0.2.15,TCP,60,9001  >  35978 [ACK] Seq=11005803 Ack=201831015 Win=65535 Len=0
1,4.317399999999907,10.0.2.15,62.210.85.178,TLSv1.2,4124,Application Data
1,4.317434000000503,62.210.85.178,10.0.2.15,TCP,60,9001  >  35978 [ACK] Seq=11005803 Ack=201832475 Win=65535 Len=0
1,4.317441000000144,62.210.85.178,10.0.2.15,TCP,60,9001  >  35978 [ACK] Seq=11005803 Ack=201833935 Win=65535 Len=0
1,4.317445000000589,62.210.85.178,10.0.2.15,TCP,60,9001  >  35978 [ACK] Seq=11005803 Ack=201835085 Win=65535 Len=0
1,4.317480000000614,10.0.2.15,62.210.85.178,TLSv1.2,4124,Application Data
1,4.317514000000301,62.210.85.178,10.0.2.15,TCP,60,9001  >  35978 [ACK] Seq=11005803 Ack=201836545 Win=65535 Len=0
1,4.317520999999942,62.210.85.178,10.0.2.15,TCP,60,9001  >  35978 [ACK] Seq=11005803 Ack=201838005 Win=65535 Len=0
1,4.3175240000000485,62.210.85.178,10.0.2.15,TCP,60,9001  >  35978 [ACK] Seq=11005803 Ack=201839155 Win=65535 Len=0
1,4.317558000000645,10.0.2.15,62.210.85.178,TLSv1.2,332,Application Data
1,4.317594000000099,62.210.85.178,10.0.2.15,TCP,60,9001  >  35978 [ACK] Seq=11005803 Ack=201839433 Win=65535 Len=0
1,4.317641999999978,10.0.2.15,62.210.85.178,TLSv1.2,3868,Application Data
1,4.31767900000068,62.210.85.178,10.0.2.15,TCP,60,9001  >  35978 [ACK] Seq=11005803 Ack=201840893 Win=65535 Len=0
1,4.317686000000322,62.210.85.178,10.0.2.15,TCP,60,9001  >  35978 [ACK] Seq=11005803 Ack=201842353 Win=65535 Len=0
1,4.317689000000428,62.210.85.178,10.0.2.15,TCP,60,9001  >  35978 [ACK] Seq=11005803 Ack=201843247 Win=65535 Len=0
1,4.317726000000221,10.0.2.15,62.210.85.178,TLSv1.2,4124,Application Data
1,4.317770999999993,62.210.85.178,10.0.2.15,TCP,60,9001  >  35978 [ACK] Seq=11005803 Ack=201844707 Win=65535 Len=0
1,4.317777000000206,62.210.85.178,10.0.2.15,TCP,60,9001  >  35978 [ACK] Seq=11005803 Ack=201846167 Win=65535 Len=0
1,4.31778100000065,62.210.85.178,10.0.2.15,TCP,60,9001  >  35978 [ACK] Seq=11005803 Ack=201847317 Win=65535 Len=0
1,4.317816000000676,10.0.2.15,62.210.85.178,TLSv1.2,3030,Application Data
1,4.317850999999791,62.210.85.178,10.0.2.15,TCP,60,9001  >  35978 [ACK] Seq=11005803 Ack=201848777 Win=65535 Len=0
1,4.317858000000342,62.210.85.178,10.0.2.15,TCP,60,9001  >  35978 [ACK] Seq=11005803 Ack=201850237 Win=65535 Len=0
1,4.317861000000448,62.210.85.178,10.0.2.15,TCP,60,9001  >  35978 [ACK] Seq=11005803 Ack=201850293 Win=65535 Len=0
1,4.3270510000002105,10.0.2.15,62.210.85.178,TLSv1.2,4124,Application Data
1,4.327124999999796,10.0.2.15,62.210.85.178,TCP,1514,35978  >  9001 [ACK] Seq=201854363 Ack=11005803 Win=65535 Len=1460 [TCP segment of a reassembled PDU]
1,4.327162999999928,62.210.85.178,10.0.2.15,TCP,60,9001  >  35978 [ACK] Seq=11005803 Ack=201851753 Win=65535 Len=0
1,4.327172000000246,62.210.85.178,10.0.2.15,TCP,60,9001  >  35978 [ACK] Seq=11005803 Ack=201853213 Win=65535 Len=0
1,4.327175000000352,62.210.85.178,10.0.2.15,TCP,60,9001  >  35978 [ACK] Seq=11005803 Ack=201854363 Win=65535 Len=0
1,4.32717700000012,62.210.85.178,10.0.2.15,TCP,60,9001  >  35978 [ACK] Seq=11005803 Ack=201855823 Win=65535 Len=0
1,4.32720800000061,10.0.2.15,62.210.85.178,TLSv1.2,1250,Application Data
1,4.327240999999958,62.210.85.178,10.0.2.15,TCP,60,9001  >  35978 [ACK] Seq=11005803 Ack=201857019 Win=65535 Len=0
1,4.408548000000337,54.93.77.70,10.0.2.15,TCP,2950,"9001  >  34692 [PSH, ACK] Seq=201665499 Ack=11053501 Win=65535 Len=2896 [TCP segment of a reassembled PDU]"
1,4.40867100000014,10.0.2.15,54.93.77.70,TCP,54,34692  >  9001 [ACK] Seq=11053501 Ack=201668395 Win=65535 Len=0
1,4.409003000000666,54.93.77.70,10.0.2.15,TLSv1.2,778,Application Data
1,4.424496999999974,54.93.77.70,10.0.2.15,TCP,2950,"9001  >  34692 [PSH, ACK] Seq=201669119 Ack=11053501 Win=65535 Len=2896 [TCP segment of a reassembled PDU]"
1,4.424547999999959,10.0.2.15,54.93.77.70,TCP,54,34692  >  9001 [ACK] Seq=11053501 Ack=201672015 Win=65535 Len=0
1,4.441260000000511,54.93.77.70,10.0.2.15,TLSv1.2,1314,"Application Data, Application Data"
1,4.450431000000208,54.93.77.70,10.0.2.15,TCP,2950,"9001  >  34692 [PSH, ACK] Seq=201673275 Ack=11053501 Win=65535 Len=2896 [TCP segment of a reassembled PDU]"
1,4.450511000000006,10.0.2.15,54.93.77.70,TCP,54,34692  >  9001 [ACK] Seq=11053501 Ack=201676171 Win=65535 Len=0
1,4.459772000000157,54.93.77.70,10.0.2.15,TLSv1.2,5846,"Application Data, Application Data"
1,4.459845000000314,10.0.2.15,54.93.77.70,TCP,54,34692  >  9001 [ACK] Seq=11053501 Ack=201681963 Win=65535 Len=0
1,4.460159000000203,54.93.77.70,10.0.2.15,TCP,1502,"9001  >  34692 [PSH, ACK] Seq=201681963 Ack=11053501 Win=65535 Len=1448 [TCP segment of a reassembled PDU]"
1,4.460198000000673,10.0.2.15,54.93.77.70,TCP,54,34692  >  9001 [ACK] Seq=11053501 Ack=201683411 Win=65535 Len=0
1,4.469188000000031,54.93.77.70,10.0.2.15,TLSv1.2,1292,Application Data
1,4.4758920000003855,54.93.77.70,10.0.2.15,TCP,2950,"9001  >  34692 [PSH, ACK] Seq=201684649 Ack=11053501 Win=65535 Len=2896 [TCP segment of a reassembled PDU]"
1,4.475910000000113,54.93.77.70,10.0.2.15,TLSv1.2,5846,"Application Data, Application Data"
1,4.475970999999845,10.0.2.15,54.93.77.70,TCP,54,34692  >  9001 [ACK] Seq=11053501 Ack=201693337 Win=65535 Len=0
1,4.476161000000502,10.0.2.15,54.93.77.70,TLSv1.2,590,Application Data
1,4.476231000000553,54.93.77.70,10.0.2.15,TCP,60,9001  >  34692 [ACK] Seq=201693337 Ack=11054037 Win=65535 Len=0
1,4.485520000000179,54.93.77.70,10.0.2.15,TLSv1.2,2950,Application Data [TCP segment of a reassembled PDU]
1,4.485630000000128,10.0.2.15,54.93.77.70,TCP,54,34692  >  9001 [ACK] Seq=11054037 Ack=201696233 Win=65535 Len=0
1,4.485701999999947,54.93.77.70,10.0.2.15,TLSv1.2,4398,Application Data [TCP segment of a reassembled PDU]
1,4.485849000000599,10.0.2.15,54.93.77.70,TCP,54,34692  >  9001 [ACK] Seq=11054037 Ack=201700577 Win=65535 Len=0
1,4.486026999999922,54.93.77.70,10.0.2.15,TLSv1.2,684,Application Data
1,4.497241000000031,54.93.77.70,10.0.2.15,TCP,2950,"9001  >  34692 [PSH, ACK] Seq=201701207 Ack=11054037 Win=65535 Len=2896 [TCP segment of a reassembled PDU]"
1,4.497301000000334,54.93.77.70,10.0.2.15,TLSv1.2,1474,Application Data [TCP segment of a reassembled PDU]
1,4.497347000000445,10.0.2.15,54.93.77.70,TCP,54,34692  >  9001 [ACK] Seq=11054037 Ack=201704103 Win=65535 Len=0
1,4.497421000000031,54.93.77.70,10.0.2.15,TCP,2978,"9001  >  34692 [PSH, ACK] Seq=201705523 Ack=11054037 Win=65535 Len=2924 [TCP segment of a reassembled PDU]"
1,4.497527999999875,10.0.2.15,54.93.77.70,TCP,54,34692  >  9001 [ACK] Seq=11054037 Ack=201708447 Win=65535 Len=0
1,4.507790999999997,54.93.77.70,10.0.2.15,TLSv1.2,2950,"Application Data, Application Data"
1,4.5078709999997955,10.0.2.15,54.93.77.70,TCP,54,34692  >  9001 [ACK] Seq=11054037 Ack=201711343 Win=65535 Len=0
1,4.507923000000119,54.93.77.70,10.0.2.15,TCP,1502,"9001  >  34692 [PSH, ACK] Seq=201711343 Ack=11054037 Win=65535 Len=1448 [TCP segment of a reassembled PDU]"
1,4.507986999999957,10.0.2.15,54.93.77.70,TCP,54,34692  >  9001 [ACK] Seq=11054037 Ack=201712791 Win=65535 Len=0
1,4.508759000000282,54.93.77.70,10.0.2.15,TLSv1.2,4398,Application Data [TCP segment of a reassembled PDU]
1,4.508808999999928,10.0.2.15,54.93.77.70,TCP,54,34692  >  9001 [ACK] Seq=11054037 Ack=201717135 Win=65535 Len=0
1,4.508967000000666,10.0.2.15,54.93.77.70,TLSv1.2,590,Application Data
1,4.5090390000004845,54.93.77.70,10.0.2.15,TCP,60,9001  >  34692 [ACK] Seq=201717135 Ack=11054573 Win=65535 Len=0
1,4.512779000000592,54.93.77.70,10.0.2.15,TLSv1.2,706,"Application Data, Application Data"
1,4.519275000000562,54.93.77.70,10.0.2.15,TCP,2950,"9001  >  34692 [PSH, ACK] Seq=201717787 Ack=11054573 Win=65535 Len=2896 [TCP segment of a reassembled PDU]"
1,4.519318000000567,10.0.2.15,54.93.77.70,TCP,54,34692  >  9001 [ACK] Seq=11054573 Ack=201720683 Win=65535 Len=0
1,4.52155700000003,10.0.2.15,54.93.77.70,TLSv1.2,590,Application Data
1,4.521634000000631,54.93.77.70,10.0.2.15,TCP,60,9001  >  34692 [ACK] Seq=201720683 Ack=11055109 Win=65535 Len=0
1,4.522888000000421,54.93.77.70,10.0.2.15,TLSv1.2,5846,"Application Data, Application Data"
1,4.522950000000492,10.0.2.15,54.93.77.70,TCP,54,34692  >  9001 [ACK] Seq=11055109 Ack=201726475 Win=65535 Len=0
1,4.5357240000003,54.93.77.70,10.0.2.15,TLSv1.2,1198,Application Data
1,4.538288000000648,10.0.2.15,54.93.77.70,TLSv1.2,590,Application Data
1,4.538441000000603,54.93.77.70,10.0.2.15,TCP,60,9001  >  34692 [ACK] Seq=201727619 Ack=11055645 Win=65535 Len=0
1,4.610533000000032,62.210.85.178,10.0.2.15,TLSv1.2,1104,Application Data
1,4.652390000000196,10.0.2.15,62.210.85.178,TCP,54,35978  >  9001 [ACK] Seq=201857019 Ack=11006853 Win=65535 Len=0
1,4.726404000000002,62.210.85.178,10.0.2.15,TLSv1.2,1104,Application Data
1,4.726478999999927,10.0.2.15,62.210.85.178,TCP,54,35978  >  9001 [ACK] Seq=201857019 Ack=11007903 Win=65535 Len=0
1,4.726945000000342,10.0.2.15,62.210.85.178,TLSv1.2,590,Application Data
1,4.72704800000065,62.210.85.178,10.0.2.15,TCP,60,9001  >  35978 [ACK] Seq=11007903 Ack=201857555 Win=65535 Len=0
1,4.904145000000426,54.93.77.70,10.0.2.15,TLSv1.2,590,Application Data
1,4.904523000000154,10.0.2.15,54.93.77.70,TLSv1.2,590,Application Data
1,4.904624000000695,54.93.77.70,10.0.2.15,TCP,60,9001  >  34692 [ACK] Seq=201728155 Ack=11056181 Win=65535 Len=0
1,5.023054000000229,62.210.85.178,10.0.2.15,TLSv1.2,590,Application Data
1,5.027874000000338,10.0.2.15,62.210.85.178,TLSv1.2,590,Application Data
1,5.028028000000631,62.210.85.178,10.0.2.15,TCP,60,9001  >  35978 [ACK] Seq=11008439 Ack=201858091 Win=65535 Len=0
1,5.0373450000006414,10.0.2.15,62.210.85.178,TLSv1.2,4124,Application Data
1,5.037466000000677,10.0.2.15,62.210.85.178,TCP,2974,35978  >  9001 [ACK] Seq=201862161 Ack=11008439 Win=65535 Len=2920 [TCP segment of a reassembled PDU]
1,5.037492999999813,62.210.85.178,10.0.2.15,TCP,60,9001  >  35978 [ACK] Seq=11008439 Ack=201859551 Win=65535 Len=0
1,5.037503999999899,62.210.85.178,10.0.2.15,TCP,60,9001  >  35978 [ACK] Seq=11008439 Ack=201861011 Win=65535 Len=0
1,5.037510000000111,62.210.85.178,10.0.2.15,TCP,60,9001  >  35978 [ACK] Seq=11008439 Ack=201862161 Win=65535 Len=0
1,5.037549000000581,10.0.2.15,62.210.85.178,TLSv1.2,1204,Application Data
1,5.03758900000048,62.210.85.178,10.0.2.15,TCP,60,9001  >  35978 [ACK] Seq=11008439 Ack=201863621 Win=65535 Len=0
1,5.03759700000046,62.210.85.178,10.0.2.15,TCP,60,9001  >  35978 [ACK] Seq=11008439 Ack=201865081 Win=65535 Len=0
1,5.037600000000566,62.210.85.178,10.0.2.15,TCP,60,9001  >  35978 [ACK] Seq=11008439 Ack=201866231 Win=65535 Len=0
1,5.037640999999894,10.0.2.15,62.210.85.178,TLSv1.2,4124,Application Data
1,5.03769100000045,62.210.85.178,10.0.2.15,TCP,60,9001  >  35978 [ACK] Seq=11008439 Ack=201867691 Win=65535 Len=0
1,5.037698000000091,62.210.85.178,10.0.2.15,TCP,60,9001  >  35978 [ACK] Seq=11008439 Ack=201869151 Win=65535 Len=0
1,5.037701000000197,62.210.85.178,10.0.2.15,TCP,60,9001  >  35978 [ACK] Seq=11008439 Ack=201870301 Win=65535 Len=0
1,5.037747000000309,10.0.2.15,62.210.85.178,TLSv1.2,4124,Application Data
1,5.038118000000395,62.210.85.178,10.0.2.15,TCP,60,9001  >  35978 [ACK] Seq=11008439 Ack=201871761 Win=65535 Len=0
1,5.03812999999991,62.210.85.178,10.0.2.15,TCP,60,9001  >  35978 [ACK] Seq=11008439 Ack=201873221 Win=65535 Len=0
1,5.038133000000016,62.210.85.178,10.0.2.15,TCP,60,9001  >  35978 [ACK] Seq=11008439 Ack=201874371 Win=65535 Len=0
1,5.03818500000034,10.0.2.15,62.210.85.178,TLSv1.2,332,Application Data
1,5.038229000000683,62.210.85.178,10.0.2.15,TCP,60,9001  >  35978 [ACK] Seq=11008439 Ack=201874649 Win=65535 Len=0
1,5.0382870000003095,10.0.2.15,62.210.85.178,TLSv1.2,3868,Application Data
1,5.038354000000254,62.210.85.178,10.0.2.15,TCP,60,9001  >  35978 [ACK] Seq=11008439 Ack=201876109 Win=65535 Len=0
1,5.038363000000572,62.210.85.178,10.0.2.15,TCP,60,9001  >  35978 [ACK] Seq=11008439 Ack=201877569 Win=65535 Len=0
1,5.0383660000006785,62.210.85.178,10.0.2.15,TCP,60,9001  >  35978 [ACK] Seq=11008439 Ack=201878463 Win=65535 Len=0
1,5.038414000000557,10.0.2.15,62.210.85.178,TLSv1.2,4124,Application Data
1,5.038489999999911,62.210.85.178,10.0.2.15,TCP,60,9001  >  35978 [ACK] Seq=11008439 Ack=201879923 Win=65535 Len=0
1,5.0385000000005675,62.210.85.178,10.0.2.15,TCP,60,9001  >  35978 [ACK] Seq=11008439 Ack=201881383 Win=65535 Len=0
1,5.038503000000674,62.210.85.178,10.0.2.15,TCP,60,9001  >  35978 [ACK] Seq=11008439 Ack=201882533 Win=65535 Len=0
1,5.038548999999875,10.0.2.15,62.210.85.178,TLSv1.2,3030,Application Data
1,5.038590000000113,62.210.85.178,10.0.2.15,TCP,60,9001  >  35978 [ACK] Seq=11008439 Ack=201883993 Win=65535 Len=0
1,5.038599000000431,62.210.85.178,10.0.2.15,TCP,60,9001  >  35978 [ACK] Seq=11008439 Ack=201885453 Win=65535 Len=0
1,5.038602999999966,62.210.85.178,10.0.2.15,TCP,60,9001  >  35978 [ACK] Seq=11008439 Ack=201885509 Win=65535 Len=0
1,5.048961000000418,10.0.2.15,62.210.85.178,TLSv1.2,4124,Application Data
1,5.049097000000074,62.210.85.178,10.0.2.15,TCP,60,9001  >  35978 [ACK] Seq=11008439 Ack=201886969 Win=65535 Len=0
1,5.049112000000605,62.210.85.178,10.0.2.15,TCP,60,9001  >  35978 [ACK] Seq=11008439 Ack=201888429 Win=65535 Len=0
1,5.04911600000014,62.210.85.178,10.0.2.15,TCP,60,9001  >  35978 [ACK] Seq=11008439 Ack=201889579 Win=65535 Len=0
1,5.049160000000484,10.0.2.15,62.210.85.178,TLSv1.2,4124,Application Data
1,5.049227999999857,62.210.85.178,10.0.2.15,TCP,60,9001  >  35978 [ACK] Seq=11008439 Ack=201891039 Win=65535 Len=0
1,5.049235999999837,62.210.85.178,10.0.2.15,TCP,60,9001  >  35978 [ACK] Seq=11008439 Ack=201892499 Win=65535 Len=0
1,5.049240000000282,62.210.85.178,10.0.2.15,TCP,60,9001  >  35978 [ACK] Seq=11008439 Ack=201893649 Win=65535 Len=0
1,5.049278000000413,10.0.2.15,62.210.85.178,TLSv1.2,4124,Application Data
1,5.049340000000484,62.210.85.178,10.0.2.15,TCP,60,9001  >  35978 [ACK] Seq=11008439 Ack=201895109 Win=65535 Len=0
1,5.049347000000125,62.210.85.178,10.0.2.15,TCP,60,9001  >  35978 [ACK] Seq=11008439 Ack=201896569 Win=65535 Len=0
1,5.04935100000057,62.210.85.178,10.0.2.15,TCP,60,9001  >  35978 [ACK] Seq=11008439 Ack=201897719 Win=65535 Len=0
1,5.049391999999898,10.0.2.15,62.210.85.178,TLSv1.2,4124,Application Data
1,5.049448000000666,62.210.85.178,10.0.2.15,TCP,60,9001  >  35978 [ACK] Seq=11008439 Ack=201899179 Win=65535 Len=0
1,5.049453999999969,62.210.85.178,10.0.2.15,TCP,60,9001  >  35978 [ACK] Seq=11008439 Ack=201900639 Win=65535 Len=0
1,5.0494580000004134,62.210.85.178,10.0.2.15,TCP,60,9001  >  35978 [ACK] Seq=11008439 Ack=201901789 Win=65535 Len=0
1,5.049496999999974,10.0.2.15,62.210.85.178,TLSv1.2,332,Application Data
1,5.049535000000105,62.210.85.178,10.0.2.15,TCP,60,9001  >  35978 [ACK] Seq=11008439 Ack=201902067 Win=65535 Len=0
1,5.04959400000007,10.0.2.15,62.210.85.178,TLSv1.2,3868,Application Data
1,5.0496320000002015,62.210.85.178,10.0.2.15,TCP,60,9001  >  35978 [ACK] Seq=11008439 Ack=201903527 Win=65535 Len=0
1,5.049638999999843,62.210.85.178,10.0.2.15,TCP,60,9001  >  35978 [ACK] Seq=11008439 Ack=201904987 Win=65535 Len=0
1,5.049643000000287,62.210.85.178,10.0.2.15,TCP,60,9001  >  35978 [ACK] Seq=11008439 Ack=201905881 Win=65535 Len=0
1,5.049684999999954,10.0.2.15,62.210.85.178,TLSv1.2,1424,Application Data
1,5.049721000000318,62.210.85.178,10.0.2.15,TCP,60,9001  >  35978 [ACK] Seq=11008439 Ack=201907251 Win=65535 Len=0
1,5.1167050000003655,54.93.77.70,10.0.2.15,TLSv1.2,590,Application Data
1,5.147968000000219,54.93.77.70,10.0.2.15,TCP,2950,"9001  >  34692 [PSH, ACK] Seq=201728691 Ack=11056181 Win=65535 Len=2896 [TCP segment of a reassembled PDU]"
1,5.147996000000603,54.93.77.70,10.0.2.15,TLSv1.2,7294,"Application Data, Application Data"
1,5.148087000000487,10.0.2.15,54.93.77.70,TCP,54,34692  >  9001 [ACK] Seq=11056181 Ack=201738827 Win=65535 Len=0
1,5.163961000000199,54.93.77.70,10.0.2.15,TLSv1.2,1292,Application Data
1,5.168751000000157,54.93.77.70,10.0.2.15,TCP,2950,"9001  >  34692 [PSH, ACK] Seq=201740065 Ack=11056181 Win=65535 Len=2896 [TCP segment of a reassembled PDU]"
1,5.168807000000015,10.0.2.15,54.93.77.70,TCP,54,34692  >  9001 [ACK] Seq=11056181 Ack=201742961 Win=65535 Len=0
1,5.176872000000003,54.93.77.70,10.0.2.15,TLSv1.2,2950,"Application Data, Application Data"
1,5.176913000000241,54.93.77.70,10.0.2.15,TLSv1.2,4314,Application Data [TCP segment of a reassembled PDU]
1,5.176941000000625,10.0.2.15,54.93.77.70,TCP,54,34692  >  9001 [ACK] Seq=11056181 Ack=201745857 Win=65535 Len=0
1,5.176985000000059,54.93.77.70,10.0.2.15,TLSv1.2,5930,Application Data [TCP segment of a reassembled PDU]
1,5.177032999999938,10.0.2.15,54.93.77.70,TCP,54,34692  >  9001 [ACK] Seq=11056181 Ack=201755993 Win=65535 Len=0
1,5.184278000000631,54.93.77.70,10.0.2.15,TLSv1.2,170,Application Data
1,5.184422000000268,10.0.2.15,54.93.77.70,TLSv1.2,590,Application Data
1,5.184501000000637,54.93.77.70,10.0.2.15,TCP,60,9001  >  34692 [ACK] Seq=201756109 Ack=11056717 Win=65535 Len=0
1,5.195534000000407,54.93.77.70,10.0.2.15,TCP,1502,"9001  >  34692 [PSH, ACK] Seq=201756109 Ack=11056717 Win=65535 Len=1448 [TCP segment of a reassembled PDU]"
1,5.195606000000225,10.0.2.15,54.93.77.70,TCP,54,34692  >  9001 [ACK] Seq=11056717 Ack=201757557 Win=65535 Len=0
1,5.200307000000066,54.93.77.70,10.0.2.15,TLSv1.2,684,Application Data
1,5.203879000000597,54.93.77.70,10.0.2.15,TLSv1.2,8742,"Application Data, Application Data"
1,5.203967999999804,10.0.2.15,54.93.77.70,TCP,54,34692  >  9001 [ACK] Seq=11056717 Ack=201766875 Win=65535 Len=0
1,5.204185999999936,10.0.2.15,54.93.77.70,TLSv1.2,590,Application Data
1,5.20426099999986,54.93.77.70,10.0.2.15,TCP,60,9001  >  34692 [ACK] Seq=201766875 Ack=11057253 Win=65535 Len=0
1,5.21621099999993,54.93.77.70,10.0.2.15,TLSv1.2,1198,Application Data
1,5.224371000000247,54.93.77.70,10.0.2.15,TCP,2950,"9001  >  34692 [PSH, ACK] Seq=201768019 Ack=11057253 Win=65535 Len=2896 [TCP segment of a reassembled PDU]"
1,5.22441500000059,10.0.2.15,54.93.77.70,TCP,54,34692  >  9001 [ACK] Seq=11057253 Ack=201770915 Win=65535 Len=0
1,5.241471000000274,54.93.77.70,10.0.2.15,TLSv1.2,778,Application Data
1,5.256617000000006,54.93.77.70,10.0.2.15,TCP,2950,"9001  >  34692 [PSH, ACK] Seq=201771639 Ack=11057253 Win=65535 Len=2896 [TCP segment of a reassembled PDU]"
1,5.2566649999998845,10.0.2.15,54.93.77.70,TCP,54,34692  >  9001 [ACK] Seq=11057253 Ack=201774535 Win=65535 Len=0
1,5.273428999999851,54.93.77.70,10.0.2.15,TLSv1.2,778,Application Data
1,5.282484000000295,54.93.77.70,10.0.2.15,TCP,1502,"9001  >  34692 [PSH, ACK] Seq=201775259 Ack=11057253 Win=65535 Len=1448 [TCP segment of a reassembled PDU]"
1,5.282541000000492,10.0.2.15,54.93.77.70,TCP,54,34692  >  9001 [ACK] Seq=11057253 Ack=201776707 Win=65535 Len=0
1,5.296467000000121,62.210.85.178,10.0.2.15,TLSv1.2,590,Application Data
1,5.299178000000211,54.93.77.70,10.0.2.15,TLSv1.2,1198,Application Data
1,5.302040000000488,10.0.2.15,54.93.77.70,TLSv1.2,590,Application Data
1,5.3021749999998065,54.93.77.70,10.0.2.15,TCP,60,9001  >  34692 [ACK] Seq=201777851 Ack=11057789 Win=65535 Len=0
1,5.33557699999983,62.210.85.178,10.0.2.15,TLSv1.2,590,Application Data
1,5.335677000000032,10.0.2.15,62.210.85.178,TCP,54,35978  >  9001 [ACK] Seq=201907251 Ack=11009511 Win=65535 Len=0
1,5.4007369999999355,62.210.85.178,10.0.2.15,TLSv1.2,590,Application Data
1,5.401236000000608,10.0.2.15,62.210.85.178,TLSv1.2,590,Application Data
1,5.401346000000558,62.210.85.178,10.0.2.15,TCP,60,9001  >  35978 [ACK] Seq=11010047 Ack=201907787 Win=65535 Len=0
1,5.598775999999816,54.93.77.70,10.0.2.15,TLSv1.2,590,Application Data
1,5.5991410000006,10.0.2.15,54.93.77.70,TLSv1.2,590,Application Data
1,5.599256999999852,54.93.77.70,10.0.2.15,TCP,60,9001  >  34692 [ACK] Seq=201778387 Ack=11058325 Win=65535 Len=0
1,5.890105000000403,62.210.85.178,10.0.2.15,TLSv1.2,590,Application Data
1,5.893949000000248,10.0.2.15,62.210.85.178,TLSv1.2,590,Application Data
1,5.894106000000647,62.210.85.178,10.0.2.15,TCP,60,9001  >  35978 [ACK] Seq=11010583 Ack=201908323 Win=65535 Len=0
1,5.90937600000052,10.0.2.15,62.210.85.178,TLSv1.2,4124,Application Data
1,5.909488000000238,10.0.2.15,62.210.85.178,TCP,2974,35978  >  9001 [ACK] Seq=201912393 Ack=11010583 Win=65535 Len=2920 [TCP segment of a reassembled PDU]
1,5.909537000000455,62.210.85.178,10.0.2.15,TCP,60,9001  >  35978 [ACK] Seq=11010583 Ack=201909783 Win=65535 Len=0
1,5.9095500000003085,62.210.85.178,10.0.2.15,TCP,60,9001  >  35978 [ACK] Seq=11010583 Ack=201911243 Win=65535 Len=0
1,5.909555000000182,62.210.85.178,10.0.2.15,TCP,60,9001  >  35978 [ACK] Seq=11010583 Ack=201912393 Win=65535 Len=0
1,5.909559000000627,62.210.85.178,10.0.2.15,TCP,60,9001  >  35978 [ACK] Seq=11010583 Ack=201913853 Win=65535 Len=0
1,5.9095619999998235,62.210.85.178,10.0.2.15,TCP,60,9001  >  35978 [ACK] Seq=11010583 Ack=201915313 Win=65535 Len=0
1,5.909609000000273,10.0.2.15,62.210.85.178,TLSv1.2,1204,Application Data
1,5.909647000000405,62.210.85.178,10.0.2.15,TCP,60,9001  >  35978 [ACK] Seq=11010583 Ack=201916463 Win=65535 Len=0
1,5.909690999999839,10.0.2.15,62.210.85.178,TLSv1.2,4124,Application Data
1,5.90973699999995,62.210.85.178,10.0.2.15,TCP,60,9001  >  35978 [ACK] Seq=11010583 Ack=201917923 Win=65535 Len=0
1,5.909746000000268,62.210.85.178,10.0.2.15,TCP,60,9001  >  35978 [ACK] Seq=11010583 Ack=201919383 Win=65535 Len=0
1,5.909752000000481,62.210.85.178,10.0.2.15,TCP,60,9001  >  35978 [ACK] Seq=11010583 Ack=201920533 Win=65535 Len=0
1,5.909792999999809,10.0.2.15,62.210.85.178,TLSv1.2,4124,Application Data
1,5.909832000000279,62.210.85.178,10.0.2.15,TCP,60,9001  >  35978 [ACK] Seq=11010583 Ack=201921993 Win=65535 Len=0
1,5.909840000000258,62.210.85.178,10.0.2.15,TCP,60,9001  >  35978 [ACK] Seq=11010583 Ack=201923453 Win=65535 Len=0
1,5.909902000000329,10.0.2.15,62.210.85.178,TLSv1.2,2974,Application Data
1,5.909942000000228,62.210.85.178,10.0.2.15,TCP,60,9001  >  35978 [ACK] Seq=11010583 Ack=201924603 Win=65535 Len=0
1,5.909950000000208,62.210.85.178,10.0.2.15,TCP,60,9001  >  35978 [ACK] Seq=11010583 Ack=201926063 Win=65535 Len=0
1,5.909953000000314,62.210.85.178,10.0.2.15,TCP,60,9001  >  35978 [ACK] Seq=11010583 Ack=201927523 Win=65535 Len=0
1,5.909980999999789,10.0.2.15,62.210.85.178,TLSv1.2,1226,Application Data
1,5.910017000000153,62.210.85.178,10.0.2.15,TCP,60,9001  >  35978 [ACK] Seq=11010583 Ack=201928695 Win=65535 Len=0
1,5.91005800000039,10.0.2.15,62.210.85.178,TLSv1.2,4124,Application Data
1,5.910096000000522,62.210.85.178,10.0.2.15,TCP,60,9001  >  35978 [ACK] Seq=11010583 Ack=201930155 Win=65535 Len=0
1,5.910104000000501,62.210.85.178,10.0.2.15,TCP,60,9001  >  35978 [ACK] Seq=11010583 Ack=201931615 Win=65535 Len=0
1,5.9101080000000366,62.210.85.178,10.0.2.15,TCP,60,9001  >  35978 [ACK] Seq=11010583 Ack=201932765 Win=65535 Len=0
1,5.910146000000168,10.0.2.15,62.210.85.178,TLSv1.2,3030,Application Data
1,5.910182999999961,62.210.85.178,10.0.2.15,TCP,60,9001  >  35978 [ACK] Seq=11010583 Ack=201934225 Win=65535 Len=0
1,5.910190999999941,62.210.85.178,10.0.2.15,TCP,60,9001  >  35978 [ACK] Seq=11010583 Ack=201935685 Win=65535 Len=0
1,5.910195999999814,62.210.85.178,10.0.2.15,TCP,60,9001  >  35978 [ACK] Seq=11010583 Ack=201935741 Win=65535 Len=0
1,6.039977999999792,54.93.77.70,10.0.2.15,TLSv1.2,590,Application Data
1,6.0804180000004635,10.0.2.15,54.93.77.70,TCP,54,34692  >  9001 [ACK] Seq=11058325 Ack=201778923 Win=65535 Len=0
1,6.196257000000514,54.93.77.70,10.0.2.15,TLSv1.2,13086,"Application Data, Application Data, Application Data, Application Data"
1,6.196338000000651,10.0.2.15,54.93.77.70,TCP,54,34692  >  9001 [ACK] Seq=11058325 Ack=201791955 Win=65535 Len=0
1,6.210852000000159,54.93.77.70,10.0.2.15,TCP,2950,"9001  >  34692 [PSH, ACK] Seq=201791955 Ack=11058325 Win=65535 Len=2896 [TCP segment of a reassembled PDU]"
1,6.2109180000006745,10.0.2.15,54.93.77.70,TCP,54,34692  >  9001 [ACK] Seq=11058325 Ack=201794851 Win=65535 Len=0
1,6.212462999999843,54.93.77.70,10.0.2.15,TLSv1.2,7410,"Application Data, Application Data, Application Data"
1,6.212510000000293,10.0.2.15,54.93.77.70,TCP,54,34692  >  9001 [ACK] Seq=11058325 Ack=201802207 Win=65535 Len=0
1,6.361265000000458,54.93.77.70,10.0.2.15,TLSv1.2,590,Application Data
1,6.36134200000015,10.0.2.15,54.93.77.70,TCP,54,34692  >  9001 [ACK] Seq=11058325 Ack=201802743 Win=65535 Len=0
1,6.36505600000055,54.93.77.70,10.0.2.15,TCP,2950,"9001  >  34692 [PSH, ACK] Seq=201802743 Ack=11058325 Win=65535 Len=2896 [TCP segment of a reassembled PDU]"
1,6.36510300000009,10.0.2.15,54.93.77.70,TCP,54,34692  >  9001 [ACK] Seq=11058325 Ack=201805639 Win=65535 Len=0
1,6.380162000000382,54.93.77.70,10.0.2.15,TLSv1.2,778,Application Data
1,6.380207000000155,10.0.2.15,54.93.77.70,TCP,54,34692  >  9001 [ACK] Seq=11058325 Ack=201806363 Win=65535 Len=0
1,6.380436999999802,10.0.2.15,54.93.77.70,TLSv1.2,590,Application Data
1,6.380522999999812,54.93.77.70,10.0.2.15,TCP,60,9001  >  34692 [ACK] Seq=201806363 Ack=11058861 Win=65535 Len=0
1,6.389850000000479,10.0.2.15,54.93.77.70,TLSv1.2,590,Application Data
1,6.389984999999797,54.93.77.70,10.0.2.15,TCP,60,9001  >  34692 [ACK] Seq=201806363 Ack=11059397 Win=65535 Len=0
1,6.667710000000625,62.210.85.178,10.0.2.15,TLSv1.2,590,Application Data
1,6.708411000000524,10.0.2.15,62.210.85.178,TCP,54,35978  >  9001 [ACK] Seq=201935741 Ack=11011119 Win=65535 Len=0
1,6.812117999999828,62.210.85.178,10.0.2.15,TLSv1.2,590,Application Data
1,6.812206999999944,10.0.2.15,62.210.85.178,TCP,54,35978  >  9001 [ACK] Seq=201935741 Ack=11011655 Win=65535 Len=0
1,6.812550000000556,10.0.2.15,62.210.85.178,TLSv1.2,590,Application Data
1,6.812673000000359,62.210.85.178,10.0.2.15,TCP,60,9001  >  35978 [ACK] Seq=11011655 Ack=201936277 Win=65535 Len=0
1,7.467658999999912,54.93.77.70,10.0.2.15,TLSv1.2,590,Application Data
1,7.468109000000368,10.0.2.15,54.93.77.70,TLSv1.2,590,Application Data
1,7.468252000000575,54.93.77.70,10.0.2.15,TCP,60,9001  >  34692 [ACK] Seq=201806899 Ack=11059933 Win=65535 Len=0
1,7.774682000000212,62.210.85.178,10.0.2.15,TLSv1.2,590,Application Data
1,7.780974000000242,10.0.2.15,62.210.85.178,TLSv1.2,590,Application Data
1,7.781176999999843,62.210.85.178,10.0.2.15,TCP,60,9001  >  35978 [ACK] Seq=11012191 Ack=201936813 Win=65535 Len=0
1,7.792481999999836,10.0.2.15,62.210.85.178,TLSv1.2,4124,Application Data
1,7.79260400000021,10.0.2.15,62.210.85.178,TCP,2974,35978  >  9001 [ACK] Seq=201940883 Ack=11012191 Win=65535 Len=2920 [TCP segment of a reassembled PDU]
1,7.792648999999983,62.210.85.178,10.0.2.15,TCP,60,9001  >  35978 [ACK] Seq=11012191 Ack=201938273 Win=65535 Len=0
1,7.79265900000064,62.210.85.178,10.0.2.15,TCP,60,9001  >  35978 [ACK] Seq=11012191 Ack=201939733 Win=65535 Len=0
1,7.792664000000514,62.210.85.178,10.0.2.15,TCP,60,9001  >  35978 [ACK] Seq=11012191 Ack=201940883 Win=65535 Len=0
1,7.792668000000049,62.210.85.178,10.0.2.15,TCP,60,9001  >  35978 [ACK] Seq=11012191 Ack=201942343 Win=65535 Len=0
1,7.792672000000493,62.210.85.178,10.0.2.15,TCP,60,9001  >  35978 [ACK] Seq=11012191 Ack=201943803 Win=65535 Len=0
1,7.7927150000004985,10.0.2.15,62.210.85.178,TLSv1.2,1204,Application Data
1,7.792782999999872,10.0.2.15,62.210.85.178,TCP,2974,35978  >  9001 [ACK] Seq=201944953 Ack=11012191 Win=65535 Len=2920 [TCP segment of a reassembled PDU]
1,7.792823000000681,62.210.85.178,10.0.2.15,TCP,60,9001  >  35978 [ACK] Seq=11012191 Ack=201944953 Win=65535 Len=0
1,7.792830000000322,62.210.85.178,10.0.2.15,TCP,60,9001  >  35978 [ACK] Seq=11012191 Ack=201946413 Win=65535 Len=0
1,7.792833999999857,62.210.85.178,10.0.2.15,TCP,60,9001  >  35978 [ACK] Seq=11012191 Ack=201947873 Win=65535 Len=0
1,7.792868999999882,10.0.2.15,62.210.85.178,TLSv1.2,1204,Application Data
1,7.792938000000504,10.0.2.15,62.210.85.178,TCP,2974,35978  >  9001 [ACK] Seq=201949023 Ack=11012191 Win=65535 Len=2920 [TCP segment of a reassembled PDU]
1,7.792973000000529,62.210.85.178,10.0.2.15,TCP,60,9001  >  35978 [ACK] Seq=11012191 Ack=201949023 Win=65535 Len=0
1,7.7929800000001705,62.210.85.178,10.0.2.15,TCP,60,9001  >  35978 [ACK] Seq=11012191 Ack=201950483 Win=65535 Len=0
1,7.792984000000615,62.210.85.178,10.0.2.15,TCP,60,9001  >  35978 [ACK] Seq=11012191 Ack=201951943 Win=65535 Len=0
1,7.793015000000196,10.0.2.15,62.210.85.178,TLSv1.2,1204,Application Data
1,7.793096000000332,10.0.2.15,62.210.85.178,TLSv1.2,2974,Application Data
1,7.793136000000231,62.210.85.178,10.0.2.15,TCP,60,9001  >  35978 [ACK] Seq=11012191 Ack=201953093 Win=65535 Len=0
1,7.793142999999873,62.210.85.178,10.0.2.15,TCP,60,9001  >  35978 [ACK] Seq=11012191 Ack=201954553 Win=65535 Len=0
1,7.793147000000317,62.210.85.178,10.0.2.15,TCP,60,9001  >  35978 [ACK] Seq=11012191 Ack=201956013 Win=65535 Len=0
1,7.793179000000237,10.0.2.15,62.210.85.178,TLSv1.2,1226,Application Data
1,7.793239999999969,10.0.2.15,62.210.85.178,TCP,2974,35978  >  9001 [ACK] Seq=201957185 Ack=11012191 Win=65535 Len=2920 [TCP segment of a reassembled PDU]
1,7.793279000000439,62.210.85.178,10.0.2.15,TCP,60,9001  >  35978 [ACK] Seq=11012191 Ack=201957185 Win=65535 Len=0
1,7.79328600000008,62.210.85.178,10.0.2.15,TCP,60,9001  >  35978 [ACK] Seq=11012191 Ack=201958645 Win=65535 Len=0
1,7.793290000000525,62.210.85.178,10.0.2.15,TCP,60,9001  >  35978 [ACK] Seq=11012191 Ack=201960105 Win=65535 Len=0
1,7.793321000000105,10.0.2.15,62.210.85.178,TLSv1.2,1204,Application Data
1,7.793361000000004,62.210.85.178,10.0.2.15,TCP,60,9001  >  35978 [ACK] Seq=11012191 Ack=201961255 Win=65535 Len=0
1,7.7934040000000095,10.0.2.15,62.210.85.178,TLSv1.2,3030,Application Data
1,7.7934439999999086,62.210.85.178,10.0.2.15,TCP,60,9001  >  35978 [ACK] Seq=11012191 Ack=201962715 Win=65535 Len=0
1,7.793450000000121,62.210.85.178,10.0.2.15,TCP,60,9001  >  35978 [ACK] Seq=11012191 Ack=201964175 Win=65535 Len=0
1,7.7934549999999945,62.210.85.178,10.0.2.15,TCP,60,9001  >  35978 [ACK] Seq=11012191 Ack=201964231 Win=65535 Len=0
1,7.802647000000434,10.0.2.15,62.210.85.178,TLSv1.2,4124,Application Data
1,7.802730000000338,10.0.2.15,62.210.85.178,TCP,2974,35978  >  9001 [ACK] Seq=201968301 Ack=11012191 Win=65535 Len=2920 [TCP segment of a reassembled PDU]
1,7.802767000000131,62.210.85.178,10.0.2.15,TCP,60,9001  >  35978 [ACK] Seq=11012191 Ack=201965691 Win=65535 Len=0
1,7.802775000000111,62.210.85.178,10.0.2.15,TCP,60,9001  >  35978 [ACK] Seq=11012191 Ack=201967151 Win=65535 Len=0
1,7.802779000000555,62.210.85.178,10.0.2.15,TCP,60,9001  >  35978 [ACK] Seq=11012191 Ack=201968301 Win=65535 Len=0
1,7.80278300000009,62.210.85.178,10.0.2.15,TCP,60,9001  >  35978 [ACK] Seq=11012191 Ack=201969761 Win=65535 Len=0
1,7.802787999999964,62.210.85.178,10.0.2.15,TCP,60,9001  >  35978 [ACK] Seq=11012191 Ack=201971221 Win=65535 Len=0
1,7.802827000000434,10.0.2.15,62.210.85.178,TLSv1.2,818,Application Data
1,7.8028659999999945,62.210.85.178,10.0.2.15,TCP,60,9001  >  35978 [ACK] Seq=11012191 Ack=201971985 Win=65535 Len=0
1,7.911079000000427,54.93.77.70,10.0.2.15,TLSv1.2,3674,Application Data
1,7.911237000000256,10.0.2.15,54.93.77.70,TCP,54,34692  >  9001 [ACK] Seq=11059933 Ack=201810519 Win=65535 Len=0
1,7.924310000000332,54.93.77.70,10.0.2.15,TCP,2950,"9001  >  34692 [PSH, ACK] Seq=201810519 Ack=11059933 Win=65535 Len=2896 [TCP segment of a reassembled PDU]"
1,7.924371000000065,10.0.2.15,54.93.77.70,TCP,54,34692  >  9001 [ACK] Seq=11059933 Ack=201813415 Win=65535 Len=0
1,7.926872000000003,54.93.77.70,10.0.2.15,TLSv1.2,778,Application Data
1,7.9342130000004545,54.93.77.70,10.0.2.15,TLSv1.2,4398,Application Data
1,7.934259000000566,10.0.2.15,54.93.77.70,TCP,54,34692  >  9001 [ACK] Seq=11059933 Ack=201818483 Win=65535 Len=0
1,7.942530000000261,54.93.77.70,10.0.2.15,TLSv1.2,380,Application Data
1,7.9436500000001615,10.0.2.15,54.93.77.70,TLSv1.2,590,Application Data
1,7.943771000000197,54.93.77.70,10.0.2.15,TCP,60,9001  >  34692 [ACK] Seq=201818809 Ack=11060469 Win=65535 Len=0
1,7.949067000000468,54.93.77.70,10.0.2.15,TCP,2950,"9001  >  34692 [PSH, ACK] Seq=201818809 Ack=11060469 Win=65535 Len=2896 [TCP segment of a reassembled PDU]"
1,7.949200000000019,10.0.2.15,54.93.77.70,TCP,54,34692  >  9001 [ACK] Seq=11060469 Ack=201821705 Win=65535 Len=0
1,7.958894000000328,54.93.77.70,10.0.2.15,TLSv1.2,1314,"Application Data, Application Data"
1,7.970416000000114,54.93.77.70,10.0.2.15,TLSv1.2,5846,Application Data
1,7.970441000000392,54.93.77.70,10.0.2.15,TLSv1.2,10190,"Application Data, Application Data"
1,7.970514999999978,10.0.2.15,54.93.77.70,TCP,54,34692  >  9001 [ACK] Seq=11060469 Ack=201838893 Win=65535 Len=0
1,7.970793000000413,10.0.2.15,54.93.77.70,TLSv1.2,590,Application Data
1,7.970871000000443,54.93.77.70,10.0.2.15,TCP,60,9001  >  34692 [ACK] Seq=201838893 Ack=11061005 Win=65535 Len=0
1,7.988610000000335,54.93.77.70,10.0.2.15,TLSv1.2,2740,"Application Data, Application Data"
1,7.9886569999998756,10.0.2.15,54.93.77.70,TCP,54,34692  >  9001 [ACK] Seq=11061005 Ack=201841579 Win=65535 Len=0
1,8.005169000000024,54.93.77.70,10.0.2.15,TLSv1.2,1104,Application Data
1,8.007534000000305,10.0.2.15,54.93.77.70,TLSv1.2,590,Application Data
1,8.007698000000346,54.93.77.70,10.0.2.15,TCP,60,9001  >  34692 [ACK] Seq=201842629 Ack=11061541 Win=65535 Len=0
1,8.036191000000144,62.210.85.178,10.0.2.15,TLSv1.2,590,Application Data
1,8.07640900000024,10.0.2.15,62.210.85.178,TCP,54,35978  >  9001 [ACK] Seq=201971985 Ack=11012727 Win=65535 Len=0
1,8.095146999999997,62.210.85.178,10.0.2.15,TLSv1.2,590,Application Data
1,8.095209000000068,10.0.2.15,62.210.85.178,TCP,54,35978  >  9001 [ACK] Seq=201971985 Ack=11013263 Win=65535 Len=0
1,8.155969000000368,62.210.85.178,10.0.2.15,TLSv1.2,590,Application Data
1,8.156050000000505,10.0.2.15,62.210.85.178,TCP,54,35978  >  9001 [ACK] Seq=201971985 Ack=11013799 Win=65535 Len=0
1,8.156539000000521,10.0.2.15,62.210.85.178,TLSv1.2,590,Application Data
1,8.156758000000082,62.210.85.178,10.0.2.15,TCP,60,9001  >  35978 [ACK] Seq=11013799 Ack=201972521 Win=65535 Len=0
1,8.266196000000491,54.93.77.70,10.0.2.15,TLSv1.2,590,Application Data
1,8.266556000000492,10.0.2.15,54.93.77.70,TLSv1.2,590,Application Data
1,8.266687000000275,54.93.77.70,10.0.2.15,TCP,60,9001  >  34692 [ACK] Seq=201843165 Ack=11062077 Win=65535 Len=0
1,8.369678000000022,62.210.85.178,10.0.2.15,TLSv1.2,590,Application Data
1,8.373196999999891,10.0.2.15,62.210.85.178,TLSv1.2,590,Application Data
1,8.373978999999963,62.210.85.178,10.0.2.15,TCP,60,9001  >  35978 [ACK] Seq=11014335 Ack=201973057 Win=65535 Len=0
1,8.385264000000461,10.0.2.15,62.210.85.178,TLSv1.2,4124,Application Data
1,8.385361000000557,10.0.2.15,62.210.85.178,TCP,2974,35978  >  9001 [ACK] Seq=201977127 Ack=11014335 Win=65535 Len=2920 [TCP segment of a reassembled PDU]
1,8.385404999999992,62.210.85.178,10.0.2.15,TCP,60,9001  >  35978 [ACK] Seq=11014335 Ack=201974517 Win=65535 Len=0
1,8.385417000000416,62.210.85.178,10.0.2.15,TCP,60,9001  >  35978 [ACK] Seq=11014335 Ack=201975977 Win=65535 Len=0
1,8.385420999999951,62.210.85.178,10.0.2.15,TCP,60,9001  >  35978 [ACK] Seq=11014335 Ack=201977127 Win=65535 Len=0
1,8.385425000000396,62.210.85.178,10.0.2.15,TCP,60,9001  >  35978 [ACK] Seq=11014335 Ack=201978587 Win=65535 Len=0
1,8.385427000000163,62.210.85.178,10.0.2.15,TCP,60,9001  >  35978 [ACK] Seq=11014335 Ack=201980047 Win=65535 Len=0
1,8.385462000000189,10.0.2.15,62.210.85.178,TLSv1.2,1204,Application Data
1,8.385498999999982,62.210.85.178,10.0.2.15,TCP,60,9001  >  35978 [ACK] Seq=11014335 Ack=201981197 Win=65535 Len=0
1,8.385545000000093,10.0.2.15,62.210.85.178,TLSv1.2,4124,Application Data
1,8.385583000000224,62.210.85.178,10.0.2.15,TCP,60,9001  >  35978 [ACK] Seq=11014335 Ack=201982657 Win=65535 Len=0
1,8.385592000000543,62.210.85.178,10.0.2.15,TCP,60,9001  >  35978 [ACK] Seq=11014335 Ack=201984117 Win=65535 Len=0
1,8.385596000000078,62.210.85.178,10.0.2.15,TCP,60,9001  >  35978 [ACK] Seq=11014335 Ack=201985267 Win=65535 Len=0
1,8.385635000000548,10.0.2.15,62.210.85.178,TLSv1.2,4124,Application Data
1,8.385674000000108,62.210.85.178,10.0.2.15,TCP,60,9001  >  35978 [ACK] Seq=11014335 Ack=201986727 Win=65535 Len=0
1,8.385681000000659,62.210.85.178,10.0.2.15,TCP,60,9001  >  35978 [ACK] Seq=11014335 Ack=201988187 Win=65535 Len=0
1,8.385732000000644,62.210.85.178,10.0.2.15,TCP,60,9001  >  35978 [ACK] Seq=11014335 Ack=201989337 Win=65535 Len=0
1,8.38576600000033,10.0.2.15,62.210.85.178,TLSv1.2,332,Application Data
1,8.385802000000695,62.210.85.178,10.0.2.15,TCP,60,9001  >  35978 [ACK] Seq=11014335 Ack=201989615 Win=65535 Len=0
1,8.385857000000215,10.0.2.15,62.210.85.178,TLSv1.2,3160,Application Data
1,8.385898000000452,62.210.85.178,10.0.2.15,TCP,60,9001  >  35978 [ACK] Seq=11014335 Ack=201991075 Win=65535 Len=0
1,8.385906000000432,62.210.85.178,10.0.2.15,TCP,60,9001  >  35978 [ACK] Seq=11014335 Ack=201992535 Win=65535 Len=0
1,8.385909999999967,62.210.85.178,10.0.2.15,TCP,60,9001  >  35978 [ACK] Seq=11014335 Ack=201992721 Win=65535 Len=0
1,8.469296000000213,54.93.77.70,10.0.2.15,TLSv1.2,590,Application Data
1,8.481158999999934,54.93.77.70,10.0.2.15,TCP,2950,"9001  >  34692 [PSH, ACK] Seq=201843701 Ack=11062077 Win=65535 Len=2896 [TCP segment of a reassembled PDU]"
1,8.481233999999858,10.0.2.15,54.93.77.70,TCP,54,34692  >  9001 [ACK] Seq=11062077 Ack=201846597 Win=65535 Len=0
1,8.49181899999985,54.93.77.70,10.0.2.15,TLSv1.2,2950,Application Data [TCP segment of a reassembled PDU]
1,8.491872000000512,10.0.2.15,54.93.77.70,TCP,54,34692  >  9001 [ACK] Seq=11062077 Ack=201849493 Win=65535 Len=0
1,8.492612000000008,54.93.77.70,10.0.2.15,TLSv1.2,7294,"Application Data, Application Data"
1,8.492685000000165,10.0.2.15,54.93.77.70,TCP,54,34692  >  9001 [ACK] Seq=11062077 Ack=201856733 Win=65535 Len=0
1,8.493186000000605,54.93.77.70,10.0.2.15,TCP,1502,"9001  >  34692 [PSH, ACK] Seq=201856733 Ack=11062077 Win=65535 Len=1448 [TCP segment of a reassembled PDU]"
1,8.493225000000166,10.0.2.15,54.93.77.70,TCP,54,34692  >  9001 [ACK] Seq=11062077 Ack=201858181 Win=65535 Len=0
1,8.499265000000378,54.93.77.70,10.0.2.15,TLSv1.2,1082,Application Data
1,8.504883999999947,54.93.77.70,10.0.2.15,TCP,2950,"9001  >  34692 [PSH, ACK] Seq=201859209 Ack=11062077 Win=65535 Len=2896 [TCP segment of a reassembled PDU]"
1,8.504955000000336,10.0.2.15,54.93.77.70,TCP,54,34692  >  9001 [ACK] Seq=11062077 Ack=201862105 Win=65535 Len=0
1,8.515349000000242,54.93.77.70,10.0.2.15,TLSv1.2,778,Application Data
1,8.515660000000025,10.0.2.15,54.93.77.70,TLSv1.2,590,Application Data
1,8.515758999999889,54.93.77.70,10.0.2.15,TCP,60,9001  >  34692 [ACK] Seq=201862829 Ack=11062613 Win=65535 Len=0
1,8.524970999999823,10.0.2.15,54.93.77.70,TLSv1.2,590,Application Data
1,8.525120000000243,54.93.77.70,10.0.2.15,TCP,60,9001  >  34692 [ACK] Seq=201862829 Ack=11063149 Win=65535 Len=0
1,8.53211900000042,54.93.77.70,10.0.2.15,TLSv1.2,590,Application Data
1,8.572439000000486,10.0.2.15,54.93.77.70,TCP,54,34692  >  9001 [ACK] Seq=11063149 Ack=201863365 Win=65535 Len=0
1,8.622631000000183,62.210.85.178,10.0.2.15,TLSv1.2,590,Application Data
1,8.664416000000529,10.0.2.15,62.210.85.178,TCP,54,35978  >  9001 [ACK] Seq=201992721 Ack=11014871 Win=65535 Len=0
1,9.307149000000209,62.210.85.178,10.0.2.15,TLSv1.2,590,Application Data
1,9.307240000000093,10.0.2.15,62.210.85.178,TCP,54,35978  >  9001 [ACK] Seq=201992721 Ack=11015407 Win=65535 Len=0
1,9.307515000000421,10.0.2.15,62.210.85.178,TLSv1.2,590,Application Data
1,9.30761799999982,62.210.85.178,10.0.2.15,TCP,60,9001  >  35978 [ACK] Seq=11015407 Ack=201993257 Win=65535 Len=0
1,9.512840000000324,54.93.77.70,10.0.2.15,TLSv1.2,590,Application Data
1,9.512916000000587,10.0.2.15,54.93.77.70,TCP,54,34692  >  9001 [ACK] Seq=11063149 Ack=201863901 Win=65535 Len=0
1,9.513264000000163,10.0.2.15,54.93.77.70,TLSv1.2,590,Application Data
1,9.513359000000492,54.93.77.70,10.0.2.15,TCP,60,9001  >  34692 [ACK] Seq=201863901 Ack=11063685 Win=65535 Len=0
1,9.62505500000043,62.210.85.178,10.0.2.15,TLSv1.2,590,Application Data
1,9.629629000000023,10.0.2.15,62.210.85.178,TLSv1.2,590,Application Data
1,9.629802000000382,62.210.85.178,10.0.2.15,TCP,60,9001  >  35978 [ACK] Seq=11015943 Ack=201993793 Win=65535 Len=0
1,9.645109000000048,10.0.2.15,62.210.85.178,TLSv1.2,4124,Application Data
1,9.645215999999891,10.0.2.15,62.210.85.178,TCP,2974,35978  >  9001 [ACK] Seq=201997863 Ack=11015943 Win=65535 Len=2920 [TCP segment of a reassembled PDU]
1,9.645304000000579,62.210.85.178,10.0.2.15,TCP,60,9001  >  35978 [ACK] Seq=11015943 Ack=201995253 Win=65535 Len=0
1,9.645322000000306,62.210.85.178,10.0.2.15,TCP,60,9001  >  35978 [ACK] Seq=11015943 Ack=201996713 Win=65535 Len=0
1,9.64532599999984,62.210.85.178,10.0.2.15,TCP,60,9001  >  35978 [ACK] Seq=11015943 Ack=201997863 Win=65535 Len=0
1,9.645328000000518,62.210.85.178,10.0.2.15,TCP,60,9001  >  35978 [ACK] Seq=11015943 Ack=201999323 Win=65535 Len=0
1,9.645331000000624,62.210.85.178,10.0.2.15,TCP,60,9001  >  35978 [ACK] Seq=11015943 Ack=202000783 Win=65535 Len=0
1,9.645371999999952,10.0.2.15,62.210.85.178,TLSv1.2,1204,Application Data
1,9.64541300000019,62.210.85.178,10.0.2.15,TCP,60,9001  >  35978 [ACK] Seq=11015943 Ack=202001933 Win=65535 Len=0
1,9.645465000000513,10.0.2.15,62.210.85.178,TLSv1.2,4124,Application Data
1,9.64550700000018,62.210.85.178,10.0.2.15,TCP,60,9001  >  35978 [ACK] Seq=11015943 Ack=202003393 Win=65535 Len=0
1,9.645516000000498,62.210.85.178,10.0.2.15,TCP,60,9001  >  35978 [ACK] Seq=11015943 Ack=202004853 Win=65535 Len=0
1,9.645520000000033,62.210.85.178,10.0.2.15,TCP,60,9001  >  35978 [ACK] Seq=11015943 Ack=202006003 Win=65535 Len=0
1,9.645559999999932,10.0.2.15,62.210.85.178,TLSv1.2,4124,Application Data
1,9.645598000000064,62.210.85.178,10.0.2.15,TCP,60,9001  >  35978 [ACK] Seq=11015943 Ack=202007463 Win=65535 Len=0
1,9.645606000000043,62.210.85.178,10.0.2.15,TCP,60,9001  >  35978 [ACK] Seq=11015943 Ack=202008923 Win=65535 Len=0
1,9.645668000000114,10.0.2.15,62.210.85.178,TLSv1.2,2974,Application Data
1,9.645712999999887,62.210.85.178,10.0.2.15,TCP,60,9001  >  35978 [ACK] Seq=11015943 Ack=202010073 Win=65535 Len=0
1,9.645720999999867,62.210.85.178,10.0.2.15,TCP,60,9001  >  35978 [ACK] Seq=11015943 Ack=202011533 Win=65535 Len=0
1,9.64572600000065,62.210.85.178,10.0.2.15,TCP,60,9001  >  35978 [ACK] Seq=11015943 Ack=202012993 Win=65535 Len=0
1,9.645755000000463,10.0.2.15,62.210.85.178,TLSv1.2,1226,Application Data
1,9.64579700000013,62.210.85.178,10.0.2.15,TCP,60,9001  >  35978 [ACK] Seq=11015943 Ack=202014165 Win=65535 Len=0
1,9.645837000000029,10.0.2.15,62.210.85.178,TLSv1.2,4124,Application Data
1,9.64587500000016,62.210.85.178,10.0.2.15,TCP,60,9001  >  35978 [ACK] Seq=11015943 Ack=202015625 Win=65535 Len=0
1,9.64588300000014,62.210.85.178,10.0.2.15,TCP,60,9001  >  35978 [ACK] Seq=11015943 Ack=202017085 Win=65535 Len=0
1,9.645888000000014,62.210.85.178,10.0.2.15,TCP,60,9001  >  35978 [ACK] Seq=11015943 Ack=202018235 Win=65535 Len=0
1,9.645929000000251,10.0.2.15,62.210.85.178,TLSv1.2,3030,Application Data
1,9.645967000000383,62.210.85.178,10.0.2.15,TCP,60,9001  >  35978 [ACK] Seq=11015943 Ack=202019695 Win=65535 Len=0
1,9.645975000000362,62.210.85.178,10.0.2.15,TCP,60,9001  >  35978 [ACK] Seq=11015943 Ack=202021155 Win=65535 Len=0
1,9.645978999999897,62.210.85.178,10.0.2.15,TCP,60,9001  >  35978 [ACK] Seq=11015943 Ack=202021211 Win=65535 Len=0
1,9.657391000000644,10.0.2.15,62.210.85.178,TLSv1.2,4124,Application Data
1,9.657495000000381,62.210.85.178,10.0.2.15,TCP,60,9001  >  35978 [ACK] Seq=11015943 Ack=202022671 Win=65535 Len=0
1,9.657506999999896,62.210.85.178,10.0.2.15,TCP,60,9001  >  35978 [ACK] Seq=11015943 Ack=202024131 Win=65535 Len=0
1,9.657510000000002,62.210.85.178,10.0.2.15,TCP,60,9001  >  35978 [ACK] Seq=11015943 Ack=202025281 Win=65535 Len=0
1,9.657554000000346,10.0.2.15,62.210.85.178,TLSv1.2,4124,Application Data
1,9.657624999999825,62.210.85.178,10.0.2.15,TCP,60,9001  >  35978 [ACK] Seq=11015943 Ack=202026741 Win=65535 Len=0
1,9.657632000000376,62.210.85.178,10.0.2.15,TCP,60,9001  >  35978 [ACK] Seq=11015943 Ack=202028201 Win=65535 Len=0
1,9.657635000000482,62.210.85.178,10.0.2.15,TCP,60,9001  >  35978 [ACK] Seq=11015943 Ack=202029351 Win=65535 Len=0
1,9.657670000000508,10.0.2.15,62.210.85.178,TLSv1.2,4124,Application Data
1,9.657713000000513,62.210.85.178,10.0.2.15,TCP,60,9001  >  35978 [ACK] Seq=11015943 Ack=202030811 Win=65535 Len=0
1,9.657721999999922,62.210.85.178,10.0.2.15,TCP,60,9001  >  35978 [ACK] Seq=11015943 Ack=202032271 Win=65535 Len=0
1,9.657726999999795,62.210.85.178,10.0.2.15,TCP,60,9001  >  35978 [ACK] Seq=11015943 Ack=202033421 Win=65535 Len=0
1,9.657764999999927,10.0.2.15,62.210.85.178,TLSv1.2,4124,Application Data
1,9.657804000000397,62.210.85.178,10.0.2.15,TCP,60,9001  >  35978 [ACK] Seq=11015943 Ack=202034881 Win=65535 Len=0
1,9.657812000000376,62.210.85.178,10.0.2.15,TCP,60,9001  >  35978 [ACK] Seq=11015943 Ack=202036341 Win=65535 Len=0
1,9.65781700000025,62.210.85.178,10.0.2.15,TCP,60,9001  >  35978 [ACK] Seq=11015943 Ack=202037491 Win=65535 Len=0
1,9.657852000000275,10.0.2.15,62.210.85.178,TLSv1.2,332,Application Data
1,9.657889000000068,62.210.85.178,10.0.2.15,TCP,60,9001  >  35978 [ACK] Seq=11015943 Ack=202037769 Win=65535 Len=0
1,9.65794300000016,10.0.2.15,62.210.85.178,TLSv1.2,1618,Application Data
1,9.65798100000029,62.210.85.178,10.0.2.15,TCP,60,9001  >  35978 [ACK] Seq=11015943 Ack=202039229 Win=65535 Len=0
1,9.657991000000038,62.210.85.178,10.0.2.15,TCP,60,9001  >  35978 [ACK] Seq=11015943 Ack=202039333 Win=65535 Len=0
1,9.733964000000014,54.93.77.70,10.0.2.15,TLSv1.2,590,Application Data
1,9.776421000000482,10.0.2.15,54.93.77.70,TCP,54,34692  >  9001 [ACK] Seq=11063685 Ack=201864437 Win=65535 Len=0
1,9.92220400000042,54.93.77.70,10.0.2.15,TCP,2950,"9001  >  34692 [PSH, ACK] Seq=201864437 Ack=11063685 Win=65535 Len=2896 [TCP segment of a reassembled PDU]"
1,9.922293000000536,10.0.2.15,54.93.77.70,TCP,54,34692  >  9001 [ACK] Seq=11063685 Ack=201867333 Win=65535 Len=0
1,9.924353000000337,54.93.77.70,10.0.2.15,TLSv1.2,778,Application Data
1,9.924395000000004,10.0.2.15,54.93.77.70,TCP,54,34692  >  9001 [ACK] Seq=11063685 Ack=201868057 Win=65535 Len=0
1,9.927200000000084,54.93.77.70,10.0.2.15,TLSv1.2,10190,"Application Data, Application Data"
1,9.927257000000282,10.0.2.15,54.93.77.70,TCP,54,34692  >  9001 [ACK] Seq=11063685 Ack=201878193 Win=65535 Len=0
1,9.927507000000332,10.0.2.15,54.93.77.70,TLSv1.2,590,Application Data
1,9.927588999999898,54.93.77.70,10.0.2.15,TCP,60,9001  >  34692 [ACK] Seq=201878193 Ack=11064221 Win=65535 Len=0
1,9.939918000000034,54.93.77.70,10.0.2.15,TLSv1.2,2950,"Application Data, Application Data"
1,9.939962000000378,10.0.2.15,54.93.77.70,TCP,54,34692  >  9001 [ACK] Seq=11064221 Ack=201881089 Win=65535 Len=0
1,9.940663000000313,54.93.77.70,10.0.2.15,TLSv1.2,5846,Application Data [TCP segment of a reassembled PDU]
1,9.94072899999992,10.0.2.15,54.93.77.70,TCP,54,34692  >  9001 [ACK] Seq=11064221 Ack=201886881 Win=65535 Len=0
1,9.94337700000051,54.93.77.70,10.0.2.15,TLSv1.2,5608,"Application Data, Application Data, Application Data, Application Data, Application Data"
1,9.943433000000368,10.0.2.15,54.93.77.70,TCP,54,34692  >  9001 [ACK] Seq=11064221 Ack=201892435 Win=65535 Len=0
1,9.943693000000167,10.0.2.15,54.93.77.70,TLSv1.2,590,Application Data
1,9.943788999999924,54.93.77.70,10.0.2.15,TCP,60,9001  >  34692 [ACK] Seq=201892435 Ack=11064757 Win=65535 Len=0
1,9.947304000000258,54.93.77.70,10.0.2.15,TCP,2950,"9001  >  34692 [PSH, ACK] Seq=201892435 Ack=11064757 Win=65535 Len=2896 [TCP segment of a reassembled PDU]"
1,9.947431999999935,54.93.77.70,10.0.2.15,TLSv1.2,1502,Application Data [TCP segment of a reassembled PDU]
1,9.947535000000244,10.0.2.15,54.93.77.70,TCP,54,34692  >  9001 [ACK] Seq=11064757 Ack=201895331 Win=65535 Len=0
1,9.94775000000027,10.0.2.15,54.93.77.70,TCP,54,34692  >  9001 [ACK] Seq=11064757 Ack=201896779 Win=65535 Len=0
1,9.948147000000063,54.93.77.70,10.0.2.15,TLSv1.2,8742,"Application Data, Application Data"
1,9.94822000000022,10.0.2.15,54.93.77.70,TCP,54,34692  >  9001 [ACK] Seq=11064757 Ack=201905467 Win=65535 Len=0
1,9.949720999999954,54.93.77.70,10.0.2.15,TCP,1502,"9001  >  34692 [PSH, ACK] Seq=201905467 Ack=11064757 Win=65535 Len=1448 [TCP segment of a reassembled PDU]"
1,9.949760999999853,10.0.2.15,54.93.77.70,TCP,54,34692  >  9001 [ACK] Seq=11064757 Ack=201906915 Win=65535 Len=0
1,9.959295999999995,54.93.77.70,10.0.2.15,TLSv1.2,1082,Application Data
1,9.96882800000003,54.93.77.70,10.0.2.15,TCP,1502,"9001  >  34692 [PSH, ACK] Seq=201907943 Ack=11064757 Win=65535 Len=1448 [TCP segment of a reassembled PDU]"
1,9.96887599999991,10.0.2.15,54.93.77.70,TCP,54,34692  >  9001 [ACK] Seq=11064757 Ack=201909391 Win=65535 Len=0
1,9.974951000000146,54.93.77.70,10.0.2.15,TLSv1.2,684,Application Data
1,9.977445999999873,10.0.2.15,54.93.77.70,TLSv1.2,590,Application Data
1,9.97760500000004,54.93.77.70,10.0.2.15,TCP,60,9001  >  34692 [ACK] Seq=201910021 Ack=11065293 Win=65535 Len=0
1,10.044477999999799,62.210.85.178,10.0.2.15,TLSv1.2,590,Application Data
1,10.084813000000395,62.210.85.178,10.0.2.15,TLSv1.2,590,Application Data
1,10.08490299999994,10.0.2.15,62.210.85.178,TCP,54,35978  >  9001 [ACK] Seq=202039333 Ack=11017015 Win=65535 Len=0
1,10.136489999999867,62.210.85.178,10.0.2.15,TLSv1.2,590,Application Data
1,10.136951999999837,10.0.2.15,62.210.85.178,TLSv1.2,590,Application Data
1,10.13706000000002,62.210.85.178,10.0.2.15,TCP,60,9001  >  35978 [ACK] Seq=11017551 Ack=202039869 Win=65535 Len=0
1,10.236182999999983,54.93.77.70,10.0.2.15,TLSv1.2,590,Application Data
1,10.236519000000044,10.0.2.15,54.93.77.70,TLSv1.2,590,Application Data
1,10.23661600000014,54.93.77.70,10.0.2.15,TCP,60,9001  >  34692 [ACK] Seq=201910557 Ack=11065829 Win=65535 Len=0
1,10.333423000000039,62.210.85.178,10.0.2.15,TLSv1.2,590,Application Data
1,10.338411000000633,10.0.2.15,62.210.85.178,TLSv1.2,590,Application Data
1,10.338588999999956,62.210.85.178,10.0.2.15,TCP,60,9001  >  35978 [ACK] Seq=11018087 Ack=202040405 Win=65535 Len=0
1,10.34866300000067,10.0.2.15,62.210.85.178,TLSv1.2,4124,Application Data
1,10.349132000000282,62.210.85.178,10.0.2.15,TCP,60,9001  >  35978 [ACK] Seq=11018087 Ack=202041865 Win=65535 Len=0
1,10.349156000000221,62.210.85.178,10.0.2.15,TCP,60,9001  >  35978 [ACK] Seq=11018087 Ack=202043325 Win=65535 Len=0
1,10.349160000000666,62.210.85.178,10.0.2.15,TCP,60,9001  >  35978 [ACK] Seq=11018087 Ack=202044475 Win=65535 Len=0
1,10.349237000000358,10.0.2.15,62.210.85.178,TLSv1.2,4124,Application Data
1,10.349330000000009,62.210.85.178,10.0.2.15,TCP,60,9001  >  35978 [ACK] Seq=11018087 Ack=202045935 Win=65535 Len=0
1,10.34933700000056,62.210.85.178,10.0.2.15,TCP,60,9001  >  35978 [ACK] Seq=11018087 Ack=202047395 Win=65535 Len=0
1,10.349340000000666,62.210.85.178,10.0.2.15,TCP,60,9001  >  35978 [ACK] Seq=11018087 Ack=202048545 Win=65535 Len=0
1,10.349366000000373,10.0.2.15,62.210.85.178,TCP,2974,35978  >  9001 [ACK] Seq=202048545 Ack=11018087 Win=65535 Len=2920 [TCP segment of a reassembled PDU]
1,10.349404000000504,62.210.85.178,10.0.2.15,TCP,60,9001  >  35978 [ACK] Seq=11018087 Ack=202050005 Win=65535 Len=0
1,10.349412000000484,62.210.85.178,10.0.2.15,TCP,60,9001  >  35978 [ACK] Seq=11018087 Ack=202051465 Win=65535 Len=0
1,10.349442000000636,10.0.2.15,62.210.85.178,TLSv1.2,1204,Application Data
1,10.34950900000058,10.0.2.15,62.210.85.178,TCP,2974,35978  >  9001 [ACK] Seq=202052615 Ack=11018087 Win=65535 Len=2920 [TCP segment of a reassembled PDU]
1,10.349546999999802,62.210.85.178,10.0.2.15,TCP,60,9001  >  35978 [ACK] Seq=11018087 Ack=202052615 Win=65535 Len=0
1,10.34955600000012,62.210.85.178,10.0.2.15,TCP,60,9001  >  35978 [ACK] Seq=11018087 Ack=202054075 Win=65535 Len=0
1,10.349559000000227,62.210.85.178,10.0.2.15,TCP,60,9001  >  35978 [ACK] Seq=11018087 Ack=202055535 Win=65535 Len=0
1,10.34958700000061,10.0.2.15,62.210.85.178,TLSv1.2,1204,Application Data
1,10.349622000000636,62.210.85.178,10.0.2.15,TCP,60,9001  >  35978 [ACK] Seq=11018087 Ack=202056685 Win=65535 Len=0
1,10.349661000000197,10.0.2.15,62.210.85.178,TLSv1.2,332,Application Data
1,10.349707000000308,62.210.85.178,10.0.2.15,TCP,60,9001  >  35978 [ACK] Seq=11018087 Ack=202056963 Win=65535 Len=0
1,10.34976800000004,10.0.2.15,62.210.85.178,TLSv1.2,3868,Application Data
1,10.349809000000278,62.210.85.178,10.0.2.15,TCP,60,9001  >  35978 [ACK] Seq=11018087 Ack=202058423 Win=65535 Len=0
1,10.349817000000257,62.210.85.178,10.0.2.15,TCP,60,9001  >  35978 [ACK] Seq=11018087 Ack=202059883 Win=65535 Len=0
1,10.349820000000364,62.210.85.178,10.0.2.15,TCP,60,9001  >  35978 [ACK] Seq=11018087 Ack=202060777 Win=65535 Len=0
1,10.349858000000495,10.0.2.15,62.210.85.178,TLSv1.2,4124,Application Data
1,10.349904000000606,62.210.85.178,10.0.2.15,TCP,60,9001  >  35978 [ACK] Seq=11018087 Ack=202062237 Win=65535 Len=0
1,10.349912000000586,62.210.85.178,10.0.2.15,TCP,60,9001  >  35978 [ACK] Seq=11018087 Ack=202063697 Win=65535 Len=0
1,10.349917999999889,62.210.85.178,10.0.2.15,TCP,60,9001  >  35978 [ACK] Seq=11018087 Ack=202064847 Win=65535 Len=0
1,10.349955000000591,10.0.2.15,62.210.85.178,TLSv1.2,3030,Application Data
1,10.349994000000152,62.210.85.178,10.0.2.15,TCP,60,9001  >  35978 [ACK] Seq=11018087 Ack=202066307 Win=65535 Len=0
1,10.350000999999793,62.210.85.178,10.0.2.15,TCP,60,9001  >  35978 [ACK] Seq=11018087 Ack=202067767 Win=65535 Len=0
1,10.350005000000237,62.210.85.178,10.0.2.15,TCP,60,9001  >  35978 [ACK] Seq=11018087 Ack=202067823 Win=65535 Len=0
1,10.361434999999801,10.0.2.15,62.210.85.178,TLSv1.2,4124,Application Data
1,10.361531000000468,62.210.85.178,10.0.2.15,TCP,60,9001  >  35978 [ACK] Seq=11018087 Ack=202069283 Win=65535 Len=0
1,10.361541000000216,62.210.85.178,10.0.2.15,TCP,60,9001  >  35978 [ACK] Seq=11018087 Ack=202070743 Win=65535 Len=0
1,10.361544000000322,62.210.85.178,10.0.2.15,TCP,60,9001  >  35978 [ACK] Seq=11018087 Ack=202071893 Win=65535 Len=0
1,10.361585999999988,10.0.2.15,62.210.85.178,TLSv1.2,4124,Application Data
1,10.361625000000458,62.210.85.178,10.0.2.15,TCP,60,9001  >  35978 [ACK] Seq=11018087 Ack=202073353 Win=65535 Len=0
1,10.361633999999867,62.210.85.178,10.0.2.15,TCP,60,9001  >  35978 [ACK] Seq=11018087 Ack=202074813 Win=65535 Len=0
1,10.36163900000065,62.210.85.178,10.0.2.15,TCP,60,9001  >  35978 [ACK] Seq=11018087 Ack=202075963 Win=65535 Len=0
1,10.361676999999872,10.0.2.15,62.210.85.178,TLSv1.2,4124,Application Data
1,10.361722000000555,62.210.85.178,10.0.2.15,TCP,60,9001  >  35978 [ACK] Seq=11018087 Ack=202077423 Win=65535 Len=0
1,10.361730000000534,62.210.85.178,10.0.2.15,TCP,60,9001  >  35978 [ACK] Seq=11018087 Ack=202078883 Win=65535 Len=0
1,10.36173400000007,62.210.85.178,10.0.2.15,TCP,60,9001  >  35978 [ACK] Seq=11018087 Ack=202080033 Win=65535 Len=0
1,10.361770999999862,10.0.2.15,62.210.85.178,TLSv1.2,4124,Application Data
1,10.361808999999994,62.210.85.178,10.0.2.15,TCP,60,9001  >  35978 [ACK] Seq=11018087 Ack=202081493 Win=65535 Len=0
1,10.361818000000312,62.210.85.178,10.0.2.15,TCP,60,9001  >  35978 [ACK] Seq=11018087 Ack=202082953 Win=65535 Len=0
1,10.361821999999847,62.210.85.178,10.0.2.15,TCP,60,9001  >  35978 [ACK] Seq=11018087 Ack=202084103 Win=65535 Len=0
1,10.361856999999873,10.0.2.15,62.210.85.178,TLSv1.2,332,Application Data
1,10.361894000000575,62.210.85.178,10.0.2.15,TCP,60,9001  >  35978 [ACK] Seq=11018087 Ack=202084381 Win=65535 Len=0
1,10.361945999999989,10.0.2.15,62.210.85.178,TLSv1.2,3868,Application Data
1,10.361985000000459,62.210.85.178,10.0.2.15,TCP,60,9001  >  35978 [ACK] Seq=11018087 Ack=202085841 Win=65535 Len=0
1,10.361993000000439,62.210.85.178,10.0.2.15,TCP,60,9001  >  35978 [ACK] Seq=11018087 Ack=202087301 Win=65535 Len=0
1,10.361996999999974,62.210.85.178,10.0.2.15,TCP,60,9001  >  35978 [ACK] Seq=11018087 Ack=202088195 Win=65535 Len=0
1,10.362034000000676,10.0.2.15,62.210.85.178,TLSv1.2,4124,Application Data
1,10.362073000000237,62.210.85.178,10.0.2.15,TCP,60,9001  >  35978 [ACK] Seq=11018087 Ack=202089655 Win=65535 Len=0
1,10.362081000000217,62.210.85.178,10.0.2.15,TCP,60,9001  >  35978 [ACK] Seq=11018087 Ack=202091115 Win=65535 Len=0
1,10.362085000000661,62.210.85.178,10.0.2.15,TCP,60,9001  >  35978 [ACK] Seq=11018087 Ack=202092265 Win=65535 Len=0
1,10.362119000000348,10.0.2.15,62.210.85.178,TLSv1.2,974,Application Data
1,10.362156000000141,62.210.85.178,10.0.2.15,TCP,60,9001  >  35978 [ACK] Seq=11018087 Ack=202093185 Win=65535 Len=0
1,10.441220000000612,54.93.77.70,10.0.2.15,TLSv1.2,590,Application Data
1,10.45274900000004,54.93.77.70,10.0.2.15,TCP,2950,"9001  >  34692 [PSH, ACK] Seq=201911093 Ack=11065829 Win=65535 Len=2896 [TCP segment of a reassembled PDU]"
1,10.45283500000005,54.93.77.70,10.0.2.15,TLSv1.2,2950,Application Data [TCP segment of a reassembled PDU]
1,10.452890999999909,10.0.2.15,54.93.77.70,TCP,54,34692  >  9001 [ACK] Seq=11065829 Ack=201916885 Win=65535 Len=0
1,10.471082000000024,54.93.77.70,10.0.2.15,TLSv1.2,474,Application Data
1,10.48526000000038,54.93.77.70,10.0.2.15,TCP,2950,"9001  >  34692 [PSH, ACK] Seq=201917305 Ack=11065829 Win=65535 Len=2896 [TCP segment of a reassembled PDU]"
1,10.48530699999992,10.0.2.15,54.93.77.70,TCP,54,34692  >  9001 [ACK] Seq=11065829 Ack=201920201 Win=65535 Len=0
1,10.498368000000482,54.93.77.70,10.0.2.15,TLSv1.2,1502,Application Data [TCP segment of a reassembled PDU]
1,10.498414000000594,10.0.2.15,54.93.77.70,TCP,54,34692  >  9001 [ACK] Seq=11065829 Ack=201921649 Win=65535 Len=0
1,10.5011199999999,54.93.77.70,10.0.2.15,TLSv1.2,894,Application Data
1,10.508324999999786,54.93.77.70,10.0.2.15,TCP,2950,"9001  >  34692 [PSH, ACK] Seq=201922489 Ack=11065829 Win=65535 Len=2896 [TCP segment of a reassembled PDU]"
1,10.508417000000009,10.0.2.15,54.93.77.70,TCP,54,34692  >  9001 [ACK] Seq=11065829 Ack=201925385 Win=65535 Len=0
1,10.509203000000525,54.93.77.70,10.0.2.15,TLSv1.2,7294,"Application Data, Application Data"
1,10.509265000000596,10.0.2.15,54.93.77.70,TCP,54,34692  >  9001 [ACK] Seq=11065829 Ack=201932625 Win=65535 Len=0
1,10.509413000000677,10.0.2.15,54.93.77.70,TLSv1.2,590,Application Data
1,10.509485000000495,54.93.77.70,10.0.2.15,TCP,60,9001  >  34692 [ACK] Seq=201932625 Ack=11066365 Win=65535 Len=0
1,10.517840999999862,54.93.77.70,10.0.2.15,TLSv1.2,1292,Application Data
1,10.521255000000565,54.93.77.70,10.0.2.15,TLSv1.2,7294,Application Data
1,10.521298999999999,10.0.2.15,54.93.77.70,TCP,54,34692  >  9001 [ACK] Seq=11066365 Ack=201941103 Win=65535 Len=0
1,10.521453000000292,10.0.2.15,54.93.77.70,TLSv1.2,590,Application Data
1,10.521522000000004,54.93.77.70,10.0.2.15,TCP,60,9001  >  34692 [ACK] Seq=201941103 Ack=11066901 Win=65535 Len=0
1,10.533268000000135,54.93.77.70,10.0.2.15,TLSv1.2,1502,Application Data [TCP segment of a reassembled PDU]
1,10.533314000000246,10.0.2.15,54.93.77.70,TCP,54,34692  >  9001 [ACK] Seq=11066901 Ack=201942551 Win=65535 Len=0
1,10.536653000000115,54.93.77.70,10.0.2.15,TLSv1.2,170,Application Data
1,10.545000000000073,54.93.77.70,10.0.2.15,TCP,2950,"9001  >  34692 [PSH, ACK] Seq=201942667 Ack=11066901 Win=65535 Len=2896 [TCP segment of a reassembled PDU]"
1,10.54507300000023,10.0.2.15,54.93.77.70,TCP,54,34692  >  9001 [ACK] Seq=11066901 Ack=201945563 Win=65535 Len=0
1,10.554059000000052,54.93.77.70,10.0.2.15,TLSv1.2,778,Application Data
1,10.557426000000305,54.93.77.70,10.0.2.15,TCP,2950,"9001  >  34692 [PSH, ACK] Seq=201946287 Ack=11066901 Win=65535 Len=2896 [TCP segment of a reassembled PDU]"
1,10.557483000000502,10.0.2.15,54.93.77.70,TCP,54,34692  >  9001 [ACK] Seq=11066901 Ack=201949183 Win=65535 Len=0
1,10.573060000000623,54.93.77.70,10.0.2.15,TLSv1.2,778,Application Data
1,10.604476000000432,54.93.77.70,10.0.2.15,TLSv1.2,2950,Application Data
1,10.604527999999846,10.0.2.15,54.93.77.70,TCP,54,34692  >  9001 [ACK] Seq=11066901 Ack=201952803 Win=65535 Len=0
1,10.60579300000063,54.93.77.70,10.0.2.15,TLSv1.2,5846,Application Data [TCP segment of a reassembled PDU]
1,10.605865000000449,10.0.2.15,54.93.77.70,TCP,54,34692  >  9001 [ACK] Seq=11066901 Ack=201958595 Win=65535 Len=0
1,10.611888999999792,54.93.77.70,10.0.2.15,TLSv1.2,1502,Application Data [TCP segment of a reassembled PDU]
1,10.611907000000429,62.210.85.178,10.0.2.15,TLSv1.2,590,Application Data
1,10.611955000000307,10.0.2.15,54.93.77.70,TCP,54,34692  >  9001 [ACK] Seq=11066901 Ack=201960043 Win=65535 Len=0
1,10.612224999999853,54.93.77.70,10.0.2.15,TCP,1502,"9001  >  34692 [PSH, ACK] Seq=201960043 Ack=11066901 Win=65535 Len=1448 [TCP segment of a reassembled PDU]"
1,10.612267999999858,10.0.2.15,54.93.77.70,TCP,54,34692  >  9001 [ACK] Seq=11066901 Ack=201961491 Win=65535 Len=0
1,10.62224200000037,54.93.77.70,10.0.2.15,TLSv1.2,1430,"Application Data, Application Data"
1,10.622421000000031,10.0.2.15,54.93.77.70,TLSv1.2,590,Application Data
1,10.622533000000658,54.93.77.70,10.0.2.15,TCP,60,9001  >  34692 [ACK] Seq=201962867 Ack=11067437 Win=65535 Len=0
1,10.652351000000635,10.0.2.15,62.210.85.178,TCP,54,35978  >  9001 [ACK] Seq=202093185 Ack=11018623 Win=65535 Len=0
1,10.708395000000564,54.93.77.70,10.0.2.15,TLSv1.2,1104,Application Data
1,10.71741800000018,10.0.2.15,54.93.77.70,TLSv1.2,590,Application Data
1,10.71759800000018,54.93.77.70,10.0.2.15,TCP,60,9001  >  34692 [ACK] Seq=201963917 Ack=11067973 Win=65535 Len=0
1,10.758655999999974,62.210.85.178,10.0.2.15,TLSv1.2,1104,Application Data
1,10.75874500000009,10.0.2.15,62.210.85.178,TCP,54,35978  >  9001 [ACK] Seq=202093185 Ack=11019673 Win=65535 Len=0
1,10.833338999999796,62.210.85.178,10.0.2.15,TLSv1.2,590,Application Data
1,10.833424000000377,10.0.2.15,62.210.85.178,TCP,54,35978  >  9001 [ACK] Seq=202093185 Ack=11020209 Win=65535 Len=0
1,10.833983999999873,10.0.2.15,62.210.85.178,TLSv1.2,590,Application Data
1,10.834122000000207,62.210.85.178,10.0.2.15,TCP,60,9001  >  35978 [ACK] Seq=11020209 Ack=202093721 Win=65535 Len=0
1,11.459144999999808,54.93.77.70,10.0.2.15,TLSv1.2,590,Application Data
1,11.459509000000253,10.0.2.15,54.93.77.70,TLSv1.2,590,Application Data
1,11.459631000000627,54.93.77.70,10.0.2.15,TCP,60,9001  >  34692 [ACK] Seq=201964453 Ack=11068509 Win=65535 Len=0
1,11.661947999999938,62.210.85.178,10.0.2.15,TLSv1.2,590,Application Data
1,11.66610700000001,10.0.2.15,62.210.85.178,TLSv1.2,590,Application Data
1,11.66627200000039,62.210.85.178,10.0.2.15,TCP,60,9001  >  35978 [ACK] Seq=11020745 Ack=202094257 Win=65535 Len=0
1,11.680890999999974,10.0.2.15,62.210.85.178,TLSv1.2,4124,Application Data
1,11.681005000000368,10.0.2.15,62.210.85.178,TCP,2974,35978  >  9001 [ACK] Seq=202098327 Ack=11020745 Win=65535 Len=2920 [TCP segment of a reassembled PDU]
1,11.68105100000048,62.210.85.178,10.0.2.15,TCP,60,9001  >  35978 [ACK] Seq=11020745 Ack=202095717 Win=65535 Len=0
1,11.681064000000333,62.210.85.178,10.0.2.15,TCP,60,9001  >  35978 [ACK] Seq=11020745 Ack=202097177 Win=65535 Len=0
1,11.681070000000545,62.210.85.178,10.0.2.15,TCP,60,9001  >  35978 [ACK] Seq=11020745 Ack=202098327 Win=65535 Len=0
1,11.68107400000008,62.210.85.178,10.0.2.15,TCP,60,9001  >  35978 [ACK] Seq=11020745 Ack=202099787 Win=65535 Len=0
1,11.681078000000525,62.210.85.178,10.0.2.15,TCP,60,9001  >  35978 [ACK] Seq=11020745 Ack=202101247 Win=65535 Len=0
1,11.68111399999998,10.0.2.15,62.210.85.178,TLSv1.2,1204,Application Data
1,11.681156000000556,62.210.85.178,10.0.2.15,TCP,60,9001  >  35978 [ACK] Seq=11020745 Ack=202102397 Win=65535 Len=0
1,11.681209000000308,10.0.2.15,62.210.85.178,TLSv1.2,4124,Application Data
1,11.681247999999869,62.210.85.178,10.0.2.15,TCP,60,9001  >  35978 [ACK] Seq=11020745 Ack=202103857 Win=65535 Len=0
1,11.681257000000187,62.210.85.178,10.0.2.15,TCP,60,9001  >  35978 [ACK] Seq=11020745 Ack=202105317 Win=65535 Len=0
1,11.681261000000632,62.210.85.178,10.0.2.15,TCP,60,9001  >  35978 [ACK] Seq=11020745 Ack=202106467 Win=65535 Len=0
1,11.681300000000192,10.0.2.15,62.210.85.178,TLSv1.2,4124,Application Data
1,11.681338000000324,62.210.85.178,10.0.2.15,TCP,60,9001  >  35978 [ACK] Seq=11020745 Ack=202107927 Win=65535 Len=0
1,11.681346000000303,62.210.85.178,10.0.2.15,TCP,60,9001  >  35978 [ACK] Seq=11020745 Ack=202109387 Win=65535 Len=0
1,11.681406000000607,10.0.2.15,62.210.85.178,TLSv1.2,2974,Application Data
1,11.681446000000506,62.210.85.178,10.0.2.15,TCP,60,9001  >  35978 [ACK] Seq=11020745 Ack=202110537 Win=65535 Len=0
1,11.681454000000485,62.210.85.178,10.0.2.15,TCP,60,9001  >  35978 [ACK] Seq=11020745 Ack=202111997 Win=65535 Len=0
1,11.681457000000592,62.210.85.178,10.0.2.15,TCP,60,9001  >  35978 [ACK] Seq=11020745 Ack=202113457 Win=65535 Len=0
1,11.681484000000637,10.0.2.15,62.210.85.178,TLSv1.2,1226,Application Data
1,11.681520000000091,62.210.85.178,10.0.2.15,TCP,60,9001  >  35978 [ACK] Seq=11020745 Ack=202114629 Win=65535 Len=0
1,11.681561000000329,10.0.2.15,62.210.85.178,TLSv1.2,4124,Application Data
1,11.68159900000046,62.210.85.178,10.0.2.15,TCP,60,9001  >  35978 [ACK] Seq=11020745 Ack=202116089 Win=65535 Len=0
1,11.68160799999987,62.210.85.178,10.0.2.15,TCP,60,9001  >  35978 [ACK] Seq=11020745 Ack=202117549 Win=65535 Len=0
1,11.681612000000314,62.210.85.178,10.0.2.15,TCP,60,9001  >  35978 [ACK] Seq=11020745 Ack=202118699 Win=65535 Len=0
1,11.681650000000445,10.0.2.15,62.210.85.178,TLSv1.2,3030,Application Data
1,11.68169399999988,62.210.85.178,10.0.2.15,TCP,60,9001  >  35978 [ACK] Seq=11020745 Ack=202120159 Win=65535 Len=0
1,11.68170199999986,62.210.85.178,10.0.2.15,TCP,60,9001  >  35978 [ACK] Seq=11020745 Ack=202121619 Win=65535 Len=0
1,11.681704999999965,62.210.85.178,10.0.2.15,TCP,60,9001  >  35978 [ACK] Seq=11020745 Ack=202121675 Win=65535 Len=0
1,11.69090099999994,10.0.2.15,62.210.85.178,TLSv1.2,4124,Application Data
1,11.690962000000582,62.210.85.178,10.0.2.15,TCP,60,9001  >  35978 [ACK] Seq=11020745 Ack=202123135 Win=65535 Len=0
1,11.690973000000668,62.210.85.178,10.0.2.15,TCP,60,9001  >  35978 [ACK] Seq=11020745 Ack=202124595 Win=65535 Len=0
1,11.690978000000541,62.210.85.178,10.0.2.15,TCP,60,9001  >  35978 [ACK] Seq=11020745 Ack=202125745 Win=65535 Len=0
1,11.691023000000314,10.0.2.15,62.210.85.178,TLSv1.2,3738,Application Data
1,11.691063000000213,62.210.85.178,10.0.2.15,TCP,60,9001  >  35978 [ACK] Seq=11020745 Ack=202127205 Win=65535 Len=0
1,11.691072000000531,62.210.85.178,10.0.2.15,TCP,60,9001  >  35978 [ACK] Seq=11020745 Ack=202128665 Win=65535 Len=0
1,11.691077000000405,62.210.85.178,10.0.2.15,TCP,60,9001  >  35978 [ACK] Seq=11020745 Ack=202129429 Win=65535 Len=0
1,12.073163000000022,54.93.77.70,10.0.2.15,TCP,2950,"9001  >  34692 [PSH, ACK] Seq=201964453 Ack=11068509 Win=65535 Len=2896 [TCP segment of a reassembled PDU]"
1,12.07329000000027,10.0.2.15,54.93.77.70,TCP,54,34692  >  9001 [ACK] Seq=11068509 Ack=201967349 Win=65535 Len=0
1,12.077052999999978,54.93.77.70,10.0.2.15,TLSv1.2,778,Application Data
1,12.078790000000481,54.93.77.70,10.0.2.15,TLSv1.2,10190,"Application Data, Application Data"
1,12.07887699999992,10.0.2.15,54.93.77.70,TCP,54,34692  >  9001 [ACK] Seq=11068509 Ack=201978209 Win=65535 Len=0
1,12.079053999999815,54.93.77.70,10.0.2.15,TCP,1502,"9001  >  34692 [PSH, ACK] Seq=201978209 Ack=11068509 Win=65535 Len=1448 [TCP segment of a reassembled PDU]"
1,12.079133000000184,10.0.2.15,54.93.77.70,TCP,54,34692  >  9001 [ACK] Seq=11068509 Ack=201979657 Win=65535 Len=0
1,12.093956000000617,54.93.77.70,10.0.2.15,TLSv1.2,2950,"Application Data, Application Data"
1,12.09400100000039,10.0.2.15,54.93.77.70,TCP,54,34692  >  9001 [ACK] Seq=11068509 Ack=201982553 Win=65535 Len=0
1,12.094176000000516,10.0.2.15,54.93.77.70,TLSv1.2,590,Application Data
1,12.094246999999996,54.93.77.70,10.0.2.15,TCP,60,9001  >  34692 [ACK] Seq=201982553 Ack=11069045 Win=65535 Len=0
1,12.096631000000343,54.93.77.70,10.0.2.15,TCP,2950,"9001  >  34692 [PSH, ACK] Seq=201982553 Ack=11069045 Win=65535 Len=2896 [TCP segment of a reassembled PDU]"
1,12.096653999999944,54.93.77.70,10.0.2.15,TLSv1.2,8554,"Application Data, Application Data, Application Data, Application Data"
1,12.09669600000052,10.0.2.15,54.93.77.70,TCP,54,34692  >  9001 [ACK] Seq=11069045 Ack=201985449 Win=65535 Len=0
1,12.09677400000055,10.0.2.15,54.93.77.70,TCP,54,34692  >  9001 [ACK] Seq=11069045 Ack=201993949 Win=65535 Len=0
1,12.101026000000275,54.93.77.70,10.0.2.15,TLSv1.2,5846,Application Data
1,12.101070000000618,10.0.2.15,54.93.77.70,TCP,54,34692  >  9001 [ACK] Seq=11069045 Ack=201999741 Win=65535 Len=0
1,12.107520000000477,10.0.2.15,54.93.77.70,TLSv1.2,590,Application Data
1,12.107888999999886,54.93.77.70,10.0.2.15,TCP,60,9001  >  34692 [ACK] Seq=201999741 Ack=11069581 Win=65535 Len=0
1,12.112375000000611,54.93.77.70,10.0.2.15,TLSv1.2,474,Application Data
