No.,Time,Source,Destination,Protocol,Length,Info
1,0.09968800000024203,62.210.85.178,10.0.2.15,TLSv1.2,590,Application Data
1,0.13538599999992584,10.0.2.15,54.93.77.70,TLSv1.2,590,Application Data
1,0.13553200000023935,54.93.77.70,10.0.2.15,TCP,60,9001  >  34692 [ACK] Seq=213621141 Ack=11726213 Win=65535 Len=0
1,0.14100200000029872,10.0.2.15,62.210.85.178,TCP,54,35978  >  9001 [ACK] Seq=213740693 Ack=11667939 Win=65535 Len=0
1,0.34804799999983516,62.210.85.178,10.0.2.15,TLSv1.2,590,Application Data
1,0.3481449999999313,10.0.2.15,62.210.85.178,TCP,54,35978  >  9001 [ACK] Seq=213740693 Ack=11668475 Win=65535 Len=0
1,0.3487140000006548,10.0.2.15,62.210.85.178,TLSv1.2,590,Application Data
1,0.3488470000002053,62.210.85.178,10.0.2.15,TCP,60,9001  >  35978 [ACK] Seq=11668475 Ack=213741229 Win=65535 Len=0
1,0.5530100000005405,54.93.77.70,10.0.2.15,TLSv1.2,590,Application Data
1,0.5535070000005362,10.0.2.15,54.93.77.70,TLSv1.2,1618,Application Data
1,0.5536480000000665,54.93.77.70,10.0.2.15,TCP,60,9001  >  34692 [ACK] Seq=213621677 Ack=11727777 Win=65535 Len=0
1,0.7574540000005072,62.210.85.178,10.0.2.15,TLSv1.2,1618,Application Data
1,0.7576010000002498,10.0.2.15,62.210.85.178,TCP,54,35978  >  9001 [ACK] Seq=213741229 Ack=11670039 Win=65535 Len=0
1,0.791693000000123,10.0.2.15,62.210.85.178,TLSv1.2,590,Application Data
1,0.7918420000005426,62.210.85.178,10.0.2.15,TCP,60,9001  >  35978 [ACK] Seq=11670039 Ack=213741765 Win=65535 Len=0
1,0.801328999999896,10.0.2.15,62.210.85.178,TLSv1.2,1618,Application Data
1,0.801473000000442,62.210.85.178,10.0.2.15,TCP,60,9001  >  35978 [ACK] Seq=11670039 Ack=213743225 Win=65535 Len=0
1,0.8014940000002753,62.210.85.178,10.0.2.15,TCP,60,9001  >  35978 [ACK] Seq=11670039 Ack=213743329 Win=65535 Len=0
1,0.9103610000001936,54.93.77.70,10.0.2.15,TLSv1.2,590,Application Data
1,0.9530740000000151,10.0.2.15,54.93.77.70,TCP,54,34692  >  9001 [ACK] Seq=11727777 Ack=213622213 Win=65535 Len=0
1,1.3784270000005563,54.93.77.70,10.0.2.15,TLSv1.2,1618,Application Data
1,1.3785139999999956,10.0.2.15,54.93.77.70,TCP,54,34692  >  9001 [ACK] Seq=11727777 Ack=213623777 Win=65535 Len=0
1,1.380525999999918,10.0.2.15,54.93.77.70,TLSv1.2,590,Application Data
1,1.3806970000005094,54.93.77.70,10.0.2.15,TCP,60,9001  >  34692 [ACK] Seq=213623777 Ack=11728313 Win=65535 Len=0
1,1.9877720000004047,62.210.85.178,10.0.2.15,TLSv1.2,590,Application Data
1,1.9881670000004306,10.0.2.15,62.210.85.178,TLSv1.2,590,Application Data
1,1.9883070000005318,62.210.85.178,10.0.2.15,TCP,60,9001  >  35978 [ACK] Seq=11670575 Ack=213743865 Win=65535 Len=0
1,2.1910729999999603,54.93.77.70,10.0.2.15,TLSv1.2,590,Application Data
1,2.191444000000047,10.0.2.15,54.93.77.70,TLSv1.2,590,Application Data
1,2.1915450000005876,54.93.77.70,10.0.2.15,TCP,60,9001  >  34692 [ACK] Seq=213624313 Ack=11728849 Win=65535 Len=0
1,2.3961630000003424,62.210.85.178,10.0.2.15,TLSv1.2,590,Application Data
1,2.410631000000649,10.0.2.15,62.210.85.178,TLSv1.2,590,Application Data
1,2.411360000000059,62.210.85.178,10.0.2.15,TCP,60,9001  >  35978 [ACK] Seq=11671111 Ack=213744401 Win=65535 Len=0
1,2.4258639999998195,10.0.2.15,62.210.85.178,TLSv1.2,4124,Application Data
1,2.425976000000446,10.0.2.15,62.210.85.178,TCP,2974,35978  >  9001 [ACK] Seq=213748471 Ack=11671111 Win=65535 Len=2920 [TCP segment of a reassembled PDU]
1,2.4260260000000926,62.210.85.178,10.0.2.15,TCP,60,9001  >  35978 [ACK] Seq=11671111 Ack=213745861 Win=65535 Len=0
1,2.426038000000517,62.210.85.178,10.0.2.15,TCP,60,9001  >  35978 [ACK] Seq=11671111 Ack=213747321 Win=65535 Len=0
1,2.42604399999982,62.210.85.178,10.0.2.15,TCP,60,9001  >  35978 [ACK] Seq=11671111 Ack=213748471 Win=65535 Len=0
1,2.426086999999825,10.0.2.15,62.210.85.178,TLSv1.2,1204,Application Data
1,2.4261249999999563,62.210.85.178,10.0.2.15,TCP,60,9001  >  35978 [ACK] Seq=11671111 Ack=213749931 Win=65535 Len=0
1,2.4261340000002747,62.210.85.178,10.0.2.15,TCP,60,9001  >  35978 [ACK] Seq=11671111 Ack=213751391 Win=65535 Len=0
1,2.42613799999981,62.210.85.178,10.0.2.15,TCP,60,9001  >  35978 [ACK] Seq=11671111 Ack=213752541 Win=65535 Len=0
1,2.4261790000000474,10.0.2.15,62.210.85.178,TLSv1.2,4124,Application Data
1,2.426217000000179,62.210.85.178,10.0.2.15,TCP,60,9001  >  35978 [ACK] Seq=11671111 Ack=213754001 Win=65535 Len=0
1,2.426226000000497,62.210.85.178,10.0.2.15,TCP,60,9001  >  35978 [ACK] Seq=11671111 Ack=213755461 Win=65535 Len=0
1,2.426231000000371,62.210.85.178,10.0.2.15,TCP,60,9001  >  35978 [ACK] Seq=11671111 Ack=213756611 Win=65535 Len=0
1,2.4262699999999313,10.0.2.15,62.210.85.178,TLSv1.2,4124,Application Data
1,2.4263080000000627,62.210.85.178,10.0.2.15,TCP,60,9001  >  35978 [ACK] Seq=11671111 Ack=213758071 Win=65535 Len=0
1,2.4263160000000425,62.210.85.178,10.0.2.15,TCP,60,9001  >  35978 [ACK] Seq=11671111 Ack=213759531 Win=65535 Len=0
1,2.4263780000001134,10.0.2.15,62.210.85.178,TLSv1.2,2974,Application Data
1,2.4264180000000124,62.210.85.178,10.0.2.15,TCP,60,9001  >  35978 [ACK] Seq=11671111 Ack=213760681 Win=65535 Len=0
1,2.426425999999992,62.210.85.178,10.0.2.15,TCP,60,9001  >  35978 [ACK] Seq=11671111 Ack=213762141 Win=65535 Len=0
1,2.4264290000000983,62.210.85.178,10.0.2.15,TCP,60,9001  >  35978 [ACK] Seq=11671111 Ack=213763601 Win=65535 Len=0
1,2.4264570000004824,10.0.2.15,62.210.85.178,TLSv1.2,1226,Application Data
1,2.4264929999999367,62.210.85.178,10.0.2.15,TCP,60,9001  >  35978 [ACK] Seq=11671111 Ack=213764773 Win=65535 Len=0
1,2.426538000000619,10.0.2.15,62.210.85.178,TLSv1.2,4124,Application Data
1,2.426578999999947,62.210.85.178,10.0.2.15,TCP,60,9001  >  35978 [ACK] Seq=11671111 Ack=213766233 Win=65535 Len=0
1,2.4265869999999268,62.210.85.178,10.0.2.15,TCP,60,9001  >  35978 [ACK] Seq=11671111 Ack=213767693 Win=65535 Len=0
1,2.426590000000033,62.210.85.178,10.0.2.15,TCP,60,9001  >  35978 [ACK] Seq=11671111 Ack=213768843 Win=65535 Len=0
1,2.426626999999826,10.0.2.15,62.210.85.178,TLSv1.2,3030,Application Data
1,2.4266670000006343,62.210.85.178,10.0.2.15,TCP,60,9001  >  35978 [ACK] Seq=11671111 Ack=213770303 Win=65535 Len=0
1,2.4266740000002756,62.210.85.178,10.0.2.15,TCP,60,9001  >  35978 [ACK] Seq=11671111 Ack=213771763 Win=65535 Len=0
1,2.4266779999998107,62.210.85.178,10.0.2.15,TCP,60,9001  >  35978 [ACK] Seq=11671111 Ack=213771819 Win=65535 Len=0
1,2.435903999999937,10.0.2.15,62.210.85.178,TLSv1.2,4124,Application Data
1,2.436061000000336,62.210.85.178,10.0.2.15,TCP,60,9001  >  35978 [ACK] Seq=11671111 Ack=213773279 Win=65535 Len=0
1,2.4360740000001897,62.210.85.178,10.0.2.15,TCP,60,9001  >  35978 [ACK] Seq=11671111 Ack=213774739 Win=65535 Len=0
1,2.4360780000006343,62.210.85.178,10.0.2.15,TCP,60,9001  >  35978 [ACK] Seq=11671111 Ack=213775889 Win=65535 Len=0
1,2.436134000000493,10.0.2.15,62.210.85.178,TLSv1.2,4124,Application Data
1,2.4361790000002657,62.210.85.178,10.0.2.15,TCP,60,9001  >  35978 [ACK] Seq=11671111 Ack=213777349 Win=65535 Len=0
1,2.436188000000584,62.210.85.178,10.0.2.15,TCP,60,9001  >  35978 [ACK] Seq=11671111 Ack=213778809 Win=65535 Len=0
1,2.4361930000004577,62.210.85.178,10.0.2.15,TCP,60,9001  >  35978 [ACK] Seq=11671111 Ack=213779959 Win=65535 Len=0
1,2.4362330000003567,10.0.2.15,62.210.85.178,TLSv1.2,4124,Application Data
1,2.436271999999917,62.210.85.178,10.0.2.15,TCP,60,9001  >  35978 [ACK] Seq=11671111 Ack=213781419 Win=65535 Len=0
1,2.4362810000002355,62.210.85.178,10.0.2.15,TCP,60,9001  >  35978 [ACK] Seq=11671111 Ack=213782879 Win=65535 Len=0
1,2.436286000000109,62.210.85.178,10.0.2.15,TCP,60,9001  >  35978 [ACK] Seq=11671111 Ack=213784029 Win=65535 Len=0
1,2.436322000000473,10.0.2.15,62.210.85.178,TLSv1.2,4124,Application Data
1,2.4363610000000335,62.210.85.178,10.0.2.15,TCP,60,9001  >  35978 [ACK] Seq=11671111 Ack=213785489 Win=65535 Len=0
1,2.4363690000000133,62.210.85.178,10.0.2.15,TCP,60,9001  >  35978 [ACK] Seq=11671111 Ack=213786949 Win=65535 Len=0
1,2.436373999999887,62.210.85.178,10.0.2.15,TCP,60,9001  >  35978 [ACK] Seq=11671111 Ack=213788099 Win=65535 Len=0
1,2.4364089999999123,10.0.2.15,62.210.85.178,TLSv1.2,332,Application Data
1,2.436445000000276,62.210.85.178,10.0.2.15,TCP,60,9001  >  35978 [ACK] Seq=11671111 Ack=213788377 Win=65535 Len=0
1,2.4364990000003672,10.0.2.15,62.210.85.178,TLSv1.2,3868,Application Data
1,2.4365370000004987,62.210.85.178,10.0.2.15,TCP,60,9001  >  35978 [ACK] Seq=11671111 Ack=213789837 Win=65535 Len=0
1,2.4365459999999075,62.210.85.178,10.0.2.15,TCP,60,9001  >  35978 [ACK] Seq=11671111 Ack=213791297 Win=65535 Len=0
1,2.4365510000006907,62.210.85.178,10.0.2.15,TCP,60,9001  >  35978 [ACK] Seq=11671111 Ack=213792191 Win=65535 Len=0
1,2.4365889999999126,10.0.2.15,62.210.85.178,TLSv1.2,4124,Application Data
1,2.436627000000044,62.210.85.178,10.0.2.15,TCP,60,9001  >  35978 [ACK] Seq=11671111 Ack=213793651 Win=65535 Len=0
1,2.4366360000003624,62.210.85.178,10.0.2.15,TCP,60,9001  >  35978 [ACK] Seq=11671111 Ack=213795111 Win=65535 Len=0
1,2.4366399999998976,62.210.85.178,10.0.2.15,TCP,60,9001  >  35978 [ACK] Seq=11671111 Ack=213796261 Win=65535 Len=0
1,2.436674999999923,10.0.2.15,62.210.85.178,TLSv1.2,3030,Application Data
1,2.436714000000393,62.210.85.178,10.0.2.15,TCP,60,9001  >  35978 [ACK] Seq=11671111 Ack=213797721 Win=65535 Len=0
1,2.4367220000003726,62.210.85.178,10.0.2.15,TCP,60,9001  >  35978 [ACK] Seq=11671111 Ack=213799181 Win=65535 Len=0
1,2.436725999999908,62.210.85.178,10.0.2.15,TCP,60,9001  >  35978 [ACK] Seq=11671111 Ack=213799237 Win=65535 Len=0
1,2.449300000000221,10.0.2.15,62.210.85.178,TLSv1.2,4124,Application Data
1,2.4494180000001506,62.210.85.178,10.0.2.15,TCP,60,9001  >  35978 [ACK] Seq=11671111 Ack=213800697 Win=65535 Len=0
1,2.449431000000004,62.210.85.178,10.0.2.15,TCP,60,9001  >  35978 [ACK] Seq=11671111 Ack=213802157 Win=65535 Len=0
1,2.449435000000449,62.210.85.178,10.0.2.15,TCP,60,9001  >  35978 [ACK] Seq=11671111 Ack=213803307 Win=65535 Len=0
1,2.44948100000056,10.0.2.15,62.210.85.178,TLSv1.2,4124,Application Data
1,2.449586000000636,62.210.85.178,10.0.2.15,TCP,60,9001  >  35978 [ACK] Seq=11671111 Ack=213804767 Win=65535 Len=0
1,2.4495999999999185,62.210.85.178,10.0.2.15,TCP,60,9001  >  35978 [ACK] Seq=11671111 Ack=213806227 Win=65535 Len=0
1,2.4496030000000246,62.210.85.178,10.0.2.15,TCP,60,9001  >  35978 [ACK] Seq=11671111 Ack=213807377 Win=65535 Len=0
1,2.4496330000001763,10.0.2.15,62.210.85.178,TLSv1.2,718,Application Data
1,2.4496710000003077,62.210.85.178,10.0.2.15,TCP,60,9001  >  35978 [ACK] Seq=11671111 Ack=213808041 Win=65535 Len=0
1,2.5355639999997948,54.93.77.70,10.0.2.15,TLSv1.2,590,Application Data
1,2.577009000000544,10.0.2.15,54.93.77.70,TCP,54,34692  >  9001 [ACK] Seq=11728849 Ack=213624849 Win=65535 Len=0
1,2.5842499999998836,54.93.77.70,10.0.2.15,TLSv1.2,3160,Application Data
1,2.584299000000101,10.0.2.15,54.93.77.70,TCP,54,34692  >  9001 [ACK] Seq=11728849 Ack=213627955 Win=65535 Len=0
1,2.5904950000003737,54.93.77.70,10.0.2.15,TCP,1502,"9001  >  34692 [PSH, ACK] Seq=213627955 Ack=11728849 Win=65535 Len=1448 [TCP segment of a reassembled PDU]"
1,2.5905460000003586,10.0.2.15,54.93.77.70,TCP,54,34692  >  9001 [ACK] Seq=11728849 Ack=213629403 Win=65535 Len=0
1,2.5993490000000747,54.93.77.70,10.0.2.15,TLSv1.2,2950,Application Data [TCP segment of a reassembled PDU]
1,2.59939200000008,10.0.2.15,54.93.77.70,TCP,54,34692  >  9001 [ACK] Seq=11728849 Ack=213632299 Win=65535 Len=0
1,2.5997409999999945,54.93.77.70,10.0.2.15,TLSv1.2,894,Application Data
1,2.5997809999998935,10.0.2.15,54.93.77.70,TCP,54,34692  >  9001 [ACK] Seq=11728849 Ack=213633139 Win=65535 Len=0
1,2.599941999999828,10.0.2.15,54.93.77.70,TLSv1.2,590,Application Data
1,2.600018000000091,54.93.77.70,10.0.2.15,TCP,60,9001  >  34692 [ACK] Seq=213633139 Ack=11729385 Win=65535 Len=0
1,2.6177999999999884,54.93.77.70,10.0.2.15,TLSv1.2,1104,Application Data
1,2.631822000000284,54.93.77.70,10.0.2.15,TCP,2950,"9001  >  34692 [PSH, ACK] Seq=213634189 Ack=11729385 Win=65535 Len=2896 [TCP segment of a reassembled PDU]"
1,2.631890000000567,10.0.2.15,54.93.77.70,TCP,54,34692  >  9001 [ACK] Seq=11729385 Ack=213637085 Win=65535 Len=0
1,2.6346730000004754,54.93.77.70,10.0.2.15,TLSv1.2,778,Application Data
1,2.6479150000004665,54.93.77.70,10.0.2.15,TLSv1.2,2950,Application Data
1,2.6479610000005778,10.0.2.15,54.93.77.70,TCP,54,34692  >  9001 [ACK] Seq=11729385 Ack=213640705 Win=65535 Len=0
1,2.649409999999989,54.93.77.70,10.0.2.15,TLSv1.2,4398,Application Data [TCP segment of a reassembled PDU]
1,2.649452000000565,10.0.2.15,54.93.77.70,TCP,54,34692  >  9001 [ACK] Seq=11729385 Ack=213645049 Win=65535 Len=0
1,2.6528120000002673,54.93.77.70,10.0.2.15,TLSv1.2,76,Application Data
1,2.6687410000004093,54.93.77.70,10.0.2.15,TCP,2950,"9001  >  34692 [PSH, ACK] Seq=213645071 Ack=11729385 Win=65535 Len=2896 [TCP segment of a reassembled PDU]"
1,2.668783000000076,10.0.2.15,54.93.77.70,TCP,54,34692  >  9001 [ACK] Seq=11729385 Ack=213647967 Win=65535 Len=0
1,2.669593000000532,54.93.77.70,10.0.2.15,TLSv1.2,778,Application Data
1,2.6878390000001673,54.93.77.70,10.0.2.15,TCP,1502,"9001  >  34692 [PSH, ACK] Seq=213648691 Ack=11729385 Win=65535 Len=1448 [TCP segment of a reassembled PDU]"
1,2.68788399999994,10.0.2.15,54.93.77.70,TCP,54,34692  >  9001 [ACK] Seq=11729385 Ack=213650139 Win=65535 Len=0
1,2.6884399999999005,54.93.77.70,10.0.2.15,TLSv1.2,684,Application Data
1,2.688574000000699,10.0.2.15,54.93.77.70,TLSv1.2,590,Application Data
1,2.6886500000000524,54.93.77.70,10.0.2.15,TCP,60,9001  >  34692 [ACK] Seq=213650769 Ack=11729921 Win=65535 Len=0
1,2.7062599999999293,62.210.85.178,10.0.2.15,TLSv1.2,590,Application Data
1,2.7098439999999755,54.93.77.70,10.0.2.15,TCP,2950,"9001  >  34692 [PSH, ACK] Seq=213650769 Ack=11729921 Win=65535 Len=2896 [TCP segment of a reassembled PDU]"
1,2.7099230000003445,10.0.2.15,54.93.77.70,TCP,54,34692  >  9001 [ACK] Seq=11729921 Ack=213653665 Win=65535 Len=0
1,2.7101870000005874,54.93.77.70,10.0.2.15,TLSv1.2,778,Application Data
1,2.7184240000005957,54.93.77.70,10.0.2.15,TCP,2950,"9001  >  34692 [PSH, ACK] Seq=213654389 Ack=11729921 Win=65535 Len=2896 [TCP segment of a reassembled PDU]"
1,2.71846800000003,10.0.2.15,54.93.77.70,TCP,54,34692  >  9001 [ACK] Seq=11729921 Ack=213657285 Win=65535 Len=0
1,2.7194710000003397,54.93.77.70,10.0.2.15,TLSv1.2,4398,Application Data [TCP segment of a reassembled PDU]
1,2.7195120000005772,10.0.2.15,54.93.77.70,TCP,54,34692  >  9001 [ACK] Seq=11729921 Ack=213661629 Win=65535 Len=0
1,2.7344100000000253,54.93.77.70,10.0.2.15,TLSv1.2,568,Application Data
1,2.738466000000699,54.93.77.70,10.0.2.15,TCP,1502,"9001  >  34692 [PSH, ACK] Seq=213662143 Ack=11729921 Win=65535 Len=1448 [TCP segment of a reassembled PDU]"
1,2.738510000000133,10.0.2.15,54.93.77.70,TCP,54,34692  >  9001 [ACK] Seq=11729921 Ack=213663591 Win=65535 Len=0
1,2.7490050000005795,10.0.2.15,62.210.85.178,TCP,54,35978  >  9001 [ACK] Seq=213808041 Ack=11671647 Win=65535 Len=0
1,2.75573600000007,54.93.77.70,10.0.2.15,TLSv1.2,1198,Application Data
1,2.7593470000001616,54.93.77.70,10.0.2.15,TCP,2950,"9001  >  34692 [PSH, ACK] Seq=213664735 Ack=11729921 Win=65535 Len=2896 [TCP segment of a reassembled PDU]"
1,2.7594090000002325,10.0.2.15,54.93.77.70,TCP,54,34692  >  9001 [ACK] Seq=11729921 Ack=213667631 Win=65535 Len=0
1,2.77183100000002,54.93.77.70,10.0.2.15,TLSv1.2,2950,Application Data [TCP segment of a reassembled PDU]
1,2.771870999999919,10.0.2.15,54.93.77.70,TCP,54,34692  >  9001 [ACK] Seq=11729921 Ack=213670527 Win=65535 Len=0
1,2.775789000000259,54.93.77.70,10.0.2.15,TLSv1.2,988,Application Data
1,2.792747999999847,54.93.77.70,10.0.2.15,TCP,1502,"9001  >  34692 [PSH, ACK] Seq=213671461 Ack=11729921 Win=65535 Len=1448 [TCP segment of a reassembled PDU]"
1,2.7927989999998317,10.0.2.15,54.93.77.70,TCP,54,34692  >  9001 [ACK] Seq=11729921 Ack=213672909 Win=65535 Len=0
1,2.810159000000567,54.93.77.70,10.0.2.15,TLSv1.2,1198,Application Data
1,2.814530999999988,54.93.77.70,10.0.2.15,TCP,2950,"9001  >  34692 [PSH, ACK] Seq=213674053 Ack=11729921 Win=65535 Len=2896 [TCP segment of a reassembled PDU]"
1,2.8145979999999327,10.0.2.15,54.93.77.70,TCP,54,34692  >  9001 [ACK] Seq=11729921 Ack=213676949 Win=65535 Len=0
1,2.818964000000051,62.210.85.178,10.0.2.15,TLSv1.2,590,Application Data
1,2.8190080000003945,10.0.2.15,62.210.85.178,TCP,54,35978  >  9001 [ACK] Seq=213808041 Ack=11672183 Win=65535 Len=0
1,2.825480000000425,54.93.77.70,10.0.2.15,TLSv1.2,1502,Application Data [TCP segment of a reassembled PDU]
1,2.825520000000324,10.0.2.15,54.93.77.70,TCP,54,34692  >  9001 [ACK] Seq=11729921 Ack=213678397 Win=65535 Len=0
1,2.8256719999999405,10.0.2.15,54.93.77.70,TLSv1.2,590,Application Data
1,2.825752000000648,54.93.77.70,10.0.2.15,TCP,60,9001  >  34692 [ACK] Seq=213678397 Ack=11730457 Win=65535 Len=0
1,2.831427000000076,54.93.77.70,10.0.2.15,TLSv1.2,1408,Application Data
1,2.8487000000004628,54.93.77.70,10.0.2.15,TCP,2950,"9001  >  34692 [PSH, ACK] Seq=213679751 Ack=11730457 Win=65535 Len=2896 [TCP segment of a reassembled PDU]"
1,2.8487700000005134,10.0.2.15,54.93.77.70,TCP,54,34692  >  9001 [ACK] Seq=11730457 Ack=213682647 Win=65535 Len=0
1,2.8586420000001453,54.93.77.70,10.0.2.15,TLSv1.2,2950,Application Data [TCP segment of a reassembled PDU]
1,2.858664000000317,54.93.77.70,10.0.2.15,TLSv1.2,1502,Application Data
1,2.8587059999999838,10.0.2.15,54.93.77.70,TCP,54,34692  >  9001 [ACK] Seq=11730457 Ack=213685543 Win=65535 Len=0
1,2.858791000000565,10.0.2.15,54.93.77.70,TCP,54,34692  >  9001 [ACK] Seq=11730457 Ack=213686991 Win=65535 Len=0
1,2.8590890000004947,10.0.2.15,54.93.77.70,TLSv1.2,590,Application Data
1,2.8592050000006566,54.93.77.70,10.0.2.15,TCP,60,9001  >  34692 [ACK] Seq=213686991 Ack=11730993 Win=65535 Len=0
1,2.9052190000002156,54.93.77.70,10.0.2.15,TLSv1.2,1618,Application Data
1,2.9053020000001197,10.0.2.15,54.93.77.70,TCP,54,34692  >  9001 [ACK] Seq=11730993 Ack=213688555 Win=65535 Len=0
1,2.908957999999984,10.0.2.15,54.93.77.70,TLSv1.2,590,Application Data
1,2.909150999999838,54.93.77.70,10.0.2.15,TCP,60,9001  >  34692 [ACK] Seq=213688555 Ack=11731529 Win=65535 Len=0
1,2.99961600000006,62.210.85.178,10.0.2.15,TLSv1.2,590,Application Data
1,2.999703000000409,10.0.2.15,62.210.85.178,TCP,54,35978  >  9001 [ACK] Seq=213808041 Ack=11672719 Win=65535 Len=0
1,3.037245999999868,62.210.85.178,10.0.2.15,TLSv1.2,590,Application Data
1,3.037310000000616,10.0.2.15,62.210.85.178,TCP,54,35978  >  9001 [ACK] Seq=213808041 Ack=11673255 Win=65535 Len=0
1,3.5220850000005157,62.210.85.178,10.0.2.15,TLSv1.2,590,Application Data
1,3.5221700000001874,10.0.2.15,62.210.85.178,TCP,54,35978  >  9001 [ACK] Seq=213808041 Ack=11673791 Win=65535 Len=0
1,3.522501999999804,10.0.2.15,62.210.85.178,TLSv1.2,590,Application Data
1,3.5226220000004105,62.210.85.178,10.0.2.15,TCP,60,9001  >  35978 [ACK] Seq=11673791 Ack=213808577 Win=65535 Len=0
1,3.7277500000000146,54.93.77.70,10.0.2.15,TLSv1.2,590,Application Data
1,3.7282329999998183,10.0.2.15,54.93.77.70,TLSv1.2,590,Application Data
1,3.728368000000046,54.93.77.70,10.0.2.15,TCP,60,9001  >  34692 [ACK] Seq=213689091 Ack=11732065 Win=65535 Len=0
1,4.137620000000425,62.210.85.178,10.0.2.15,TLSv1.2,590,Application Data
1,4.1430230000005395,10.0.2.15,62.210.85.178,TLSv1.2,590,Application Data
1,4.143176000000494,62.210.85.178,10.0.2.15,TCP,60,9001  >  35978 [ACK] Seq=11674327 Ack=213809113 Win=65535 Len=0
1,4.157144000000699,10.0.2.15,62.210.85.178,TLSv1.2,4124,Application Data
1,4.157240999999885,10.0.2.15,62.210.85.178,TCP,2974,35978  >  9001 [ACK] Seq=213813183 Ack=11674327 Win=65535 Len=2920 [TCP segment of a reassembled PDU]
1,4.157288000000335,62.210.85.178,10.0.2.15,TCP,60,9001  >  35978 [ACK] Seq=11674327 Ack=213810573 Win=65535 Len=0
1,4.157301000000189,62.210.85.178,10.0.2.15,TCP,60,9001  >  35978 [ACK] Seq=11674327 Ack=213812033 Win=65535 Len=0
1,4.157305000000633,62.210.85.178,10.0.2.15,TCP,60,9001  >  35978 [ACK] Seq=11674327 Ack=213813183 Win=65535 Len=0
1,4.15730799999983,62.210.85.178,10.0.2.15,TCP,60,9001  >  35978 [ACK] Seq=11674327 Ack=213814643 Win=65535 Len=0
1,4.157310999999936,62.210.85.178,10.0.2.15,TCP,60,9001  >  35978 [ACK] Seq=11674327 Ack=213816103 Win=65535 Len=0
1,4.157345000000532,10.0.2.15,62.210.85.178,TLSv1.2,1204,Application Data
1,4.157379000000219,62.210.85.178,10.0.2.15,TCP,60,9001  >  35978 [ACK] Seq=11674327 Ack=213817253 Win=65535 Len=0
1,4.157422000000224,10.0.2.15,62.210.85.178,TLSv1.2,4124,Application Data
1,4.157459000000017,62.210.85.178,10.0.2.15,TCP,60,9001  >  35978 [ACK] Seq=11674327 Ack=213818713 Win=65535 Len=0
1,4.157466999999997,62.210.85.178,10.0.2.15,TCP,60,9001  >  35978 [ACK] Seq=11674327 Ack=213820173 Win=65535 Len=0
1,4.157471000000442,62.210.85.178,10.0.2.15,TCP,60,9001  >  35978 [ACK] Seq=11674327 Ack=213821323 Win=65535 Len=0
1,4.157510000000002,10.0.2.15,62.210.85.178,TLSv1.2,4124,Application Data
1,4.15754300000026,62.210.85.178,10.0.2.15,TCP,60,9001  >  35978 [ACK] Seq=11674327 Ack=213822783 Win=65535 Len=0
1,4.15755100000024,62.210.85.178,10.0.2.15,TCP,60,9001  >  35978 [ACK] Seq=11674327 Ack=213824243 Win=65535 Len=0
1,4.1575899999998,62.210.85.178,10.0.2.15,TCP,60,9001  >  35978 [ACK] Seq=11674327 Ack=213825393 Win=65535 Len=0
1,4.157623000000058,10.0.2.15,62.210.85.178,TLSv1.2,332,Application Data
1,4.1576560000003155,62.210.85.178,10.0.2.15,TCP,60,9001  >  35978 [ACK] Seq=11674327 Ack=213825671 Win=65535 Len=0
1,4.157709000000068,10.0.2.15,62.210.85.178,TLSv1.2,3868,Application Data
1,4.157745000000432,62.210.85.178,10.0.2.15,TCP,60,9001  >  35978 [ACK] Seq=11674327 Ack=213827131 Win=65535 Len=0
1,4.157752000000073,62.210.85.178,10.0.2.15,TCP,60,9001  >  35978 [ACK] Seq=11674327 Ack=213828591 Win=65535 Len=0
1,4.157755000000179,62.210.85.178,10.0.2.15,TCP,60,9001  >  35978 [ACK] Seq=11674327 Ack=213829485 Win=65535 Len=0
1,4.157791999999972,10.0.2.15,62.210.85.178,TLSv1.2,4124,Application Data
1,4.1578269999999975,62.210.85.178,10.0.2.15,TCP,60,9001  >  35978 [ACK] Seq=11674327 Ack=213830945 Win=65535 Len=0
1,4.15783300000021,62.210.85.178,10.0.2.15,TCP,60,9001  >  35978 [ACK] Seq=11674327 Ack=213832405 Win=65535 Len=0
1,4.157836000000316,62.210.85.178,10.0.2.15,TCP,60,9001  >  35978 [ACK] Seq=11674327 Ack=213833555 Win=65535 Len=0
1,4.157870000000003,10.0.2.15,62.210.85.178,TLSv1.2,3030,Application Data
1,4.157905000000028,62.210.85.178,10.0.2.15,TCP,60,9001  >  35978 [ACK] Seq=11674327 Ack=213835015 Win=65535 Len=0
1,4.15791100000024,62.210.85.178,10.0.2.15,TCP,60,9001  >  35978 [ACK] Seq=11674327 Ack=213836475 Win=65535 Len=0
1,4.157914000000346,62.210.85.178,10.0.2.15,TCP,60,9001  >  35978 [ACK] Seq=11674327 Ack=213836531 Win=65535 Len=0
1,4.167120000000068,10.0.2.15,62.210.85.178,TLSv1.2,4124,Application Data
1,4.167170000000624,62.210.85.178,10.0.2.15,TCP,60,9001  >  35978 [ACK] Seq=11674327 Ack=213837991 Win=65535 Len=0
1,4.167180000000371,62.210.85.178,10.0.2.15,TCP,60,9001  >  35978 [ACK] Seq=11674327 Ack=213839451 Win=65535 Len=0
1,4.167185000000245,62.210.85.178,10.0.2.15,TCP,60,9001  >  35978 [ACK] Seq=11674327 Ack=213840601 Win=65535 Len=0
1,4.167230000000018,10.0.2.15,62.210.85.178,TLSv1.2,4124,Application Data
1,4.167266000000382,62.210.85.178,10.0.2.15,TCP,60,9001  >  35978 [ACK] Seq=11674327 Ack=213842061 Win=65535 Len=0
1,4.167274000000361,62.210.85.178,10.0.2.15,TCP,60,9001  >  35978 [ACK] Seq=11674327 Ack=213843521 Win=65535 Len=0
1,4.167279000000235,62.210.85.178,10.0.2.15,TCP,60,9001  >  35978 [ACK] Seq=11674327 Ack=213844671 Win=65535 Len=0
1,4.167319000000134,10.0.2.15,62.210.85.178,TLSv1.2,4124,Application Data
1,4.167354000000159,62.210.85.178,10.0.2.15,TCP,60,9001  >  35978 [ACK] Seq=11674327 Ack=213846131 Win=65535 Len=0
1,4.167360999999801,62.210.85.178,10.0.2.15,TCP,60,9001  >  35978 [ACK] Seq=11674327 Ack=213847591 Win=65535 Len=0
1,4.167365000000245,62.210.85.178,10.0.2.15,TCP,60,9001  >  35978 [ACK] Seq=11674327 Ack=213848741 Win=65535 Len=0
1,4.167401000000609,10.0.2.15,62.210.85.178,TLSv1.2,4124,Application Data
1,4.1674339999999575,62.210.85.178,10.0.2.15,TCP,60,9001  >  35978 [ACK] Seq=11674327 Ack=213850201 Win=65535 Len=0
1,4.167441999999937,62.210.85.178,10.0.2.15,TCP,60,9001  >  35978 [ACK] Seq=11674327 Ack=213851661 Win=65535 Len=0
1,4.167446000000382,62.210.85.178,10.0.2.15,TCP,60,9001  >  35978 [ACK] Seq=11674327 Ack=213852811 Win=65535 Len=0
1,4.167480000000069,10.0.2.15,62.210.85.178,TLSv1.2,332,Application Data
1,4.167514000000665,62.210.85.178,10.0.2.15,TCP,60,9001  >  35978 [ACK] Seq=11674327 Ack=213853089 Win=65535 Len=0
1,4.167562999999973,10.0.2.15,62.210.85.178,TLSv1.2,3868,Application Data
1,4.167599000000337,62.210.85.178,10.0.2.15,TCP,60,9001  >  35978 [ACK] Seq=11674327 Ack=213854549 Win=65535 Len=0
1,4.167605999999978,62.210.85.178,10.0.2.15,TCP,60,9001  >  35978 [ACK] Seq=11674327 Ack=213856009 Win=65535 Len=0
1,4.167609000000084,62.210.85.178,10.0.2.15,TCP,60,9001  >  35978 [ACK] Seq=11674327 Ack=213856903 Win=65535 Len=0
1,4.167648000000554,10.0.2.15,62.210.85.178,TLSv1.2,4124,Application Data
1,4.167683000000579,62.210.85.178,10.0.2.15,TCP,60,9001  >  35978 [ACK] Seq=11674327 Ack=213858363 Win=65535 Len=0
1,4.167690000000221,62.210.85.178,10.0.2.15,TCP,60,9001  >  35978 [ACK] Seq=11674327 Ack=213859823 Win=65535 Len=0
1,4.167693000000327,62.210.85.178,10.0.2.15,TCP,60,9001  >  35978 [ACK] Seq=11674327 Ack=213860973 Win=65535 Len=0
1,4.1677270000000135,10.0.2.15,62.210.85.178,TLSv1.2,460,Application Data
1,4.167762000000039,62.210.85.178,10.0.2.15,TCP,60,9001  >  35978 [ACK] Seq=11674327 Ack=213861379 Win=65535 Len=0
1,4.444890000000669,54.93.77.70,10.0.2.15,TCP,2950,"9001  >  34692 [PSH, ACK] Seq=213689091 Ack=11732065 Win=65535 Len=2896 [TCP segment of a reassembled PDU]"
1,4.4450290000004316,10.0.2.15,54.93.77.70,TCP,54,34692  >  9001 [ACK] Seq=11732065 Ack=213691987 Win=65535 Len=0
1,4.447763000000123,54.93.77.70,10.0.2.15,TLSv1.2,778,Application Data
1,4.448621000000458,54.93.77.70,10.0.2.15,TCP,2950,"9001  >  34692 [PSH, ACK] Seq=213692711 Ack=11732065 Win=65535 Len=2896 [TCP segment of a reassembled PDU]"
1,4.448667000000569,10.0.2.15,54.93.77.70,TCP,54,34692  >  9001 [ACK] Seq=11732065 Ack=213695607 Win=65535 Len=0
1,4.4645360000004075,54.93.77.70,10.0.2.15,TLSv1.2,1314,"Application Data, Application Data"
1,4.48566800000026,54.93.77.70,10.0.2.15,TLSv1.2,590,Application Data
1,4.485725999999886,10.0.2.15,54.93.77.70,TCP,54,34692  >  9001 [ACK] Seq=11732065 Ack=213697403 Win=65535 Len=0
1,4.539840000000368,54.93.77.70,10.0.2.15,TCP,2950,"9001  >  34692 [PSH, ACK] Seq=213697403 Ack=11732065 Win=65535 Len=2896 [TCP segment of a reassembled PDU]"
1,4.5399450000004435,10.0.2.15,54.93.77.70,TCP,54,34692  >  9001 [ACK] Seq=11732065 Ack=213700299 Win=65535 Len=0
1,4.540262999999868,54.93.77.70,10.0.2.15,TLSv1.2,778,Application Data
1,4.558423999999832,54.93.77.70,10.0.2.15,TCP,2950,"9001  >  34692 [PSH, ACK] Seq=213701023 Ack=11732065 Win=65535 Len=2896 [TCP segment of a reassembled PDU]"
1,4.558500000000095,10.0.2.15,54.93.77.70,TCP,54,34692  >  9001 [ACK] Seq=11732065 Ack=213703919 Win=65535 Len=0
1,4.558899000000565,54.93.77.70,10.0.2.15,TLSv1.2,778,Application Data
1,4.567482000000382,54.93.77.70,10.0.2.15,TCP,2950,"9001  >  34692 [PSH, ACK] Seq=213704643 Ack=11732065 Win=65535 Len=2896 [TCP segment of a reassembled PDU]"
1,4.567525000000387,10.0.2.15,54.93.77.70,TCP,54,34692  >  9001 [ACK] Seq=11732065 Ack=213707539 Win=65535 Len=0
1,4.574674000000414,54.93.77.70,10.0.2.15,TLSv1.2,778,Application Data
1,4.577627000000575,54.93.77.70,10.0.2.15,TCP,2950,"9001  >  34692 [PSH, ACK] Seq=213708263 Ack=11732065 Win=65535 Len=2896 [TCP segment of a reassembled PDU]"
1,4.577667999999903,10.0.2.15,54.93.77.70,TCP,54,34692  >  9001 [ACK] Seq=11732065 Ack=213711159 Win=65535 Len=0
1,4.5862480000005235,54.93.77.70,10.0.2.15,TLSv1.2,5846,"Application Data, Application Data, Application Data"
1,4.5863130000007,10.0.2.15,54.93.77.70,TCP,54,34692  >  9001 [ACK] Seq=11732065 Ack=213716951 Win=65535 Len=0
1,4.5865270000003875,10.0.2.15,54.93.77.70,TLSv1.2,590,Application Data
1,4.586597000000438,54.93.77.70,10.0.2.15,TCP,60,9001  >  34692 [ACK] Seq=213716951 Ack=11732601 Win=65535 Len=0
1,4.586645000000317,54.93.77.70,10.0.2.15,TCP,1502,"9001  >  34692 [PSH, ACK] Seq=213716951 Ack=11732601 Win=65535 Len=1448 [TCP segment of a reassembled PDU]"
1,4.586679000000004,10.0.2.15,54.93.77.70,TCP,54,34692  >  9001 [ACK] Seq=11732601 Ack=213718399 Win=65535 Len=0
1,4.590689999999995,54.93.77.70,10.0.2.15,TLSv1.2,1314,Application Data
1,4.608573999999862,54.93.77.70,10.0.2.15,TLSv1.2,2132,Application Data
1,4.608627999999953,10.0.2.15,54.93.77.70,TCP,54,34692  >  9001 [ACK] Seq=11732601 Ack=213721737 Win=65535 Len=0
1,4.617713000000549,54.93.77.70,10.0.2.15,TLSv1.2,7294,"Application Data, Application Data"
1,4.617785000000367,10.0.2.15,54.93.77.70,TCP,54,34692  >  9001 [ACK] Seq=11732601 Ack=213728977 Win=65535 Len=0
1,4.6394020000007,54.93.77.70,10.0.2.15,TCP,2950,"9001  >  34692 [PSH, ACK] Seq=213728977 Ack=11732601 Win=65535 Len=2896 [TCP segment of a reassembled PDU]"
1,4.639470000000074,10.0.2.15,54.93.77.70,TCP,54,34692  >  9001 [ACK] Seq=11732601 Ack=213731873 Win=65535 Len=0
1,4.6395000000002256,54.93.77.70,10.0.2.15,TLSv1.2,778,Application Data
1,4.662546000000475,54.93.77.70,10.0.2.15,TLSv1.2,3674,Application Data
1,4.662620000000061,10.0.2.15,54.93.77.70,TCP,54,34692  >  9001 [ACK] Seq=11732601 Ack=213736217 Win=65535 Len=0
1,4.674713000000338,54.93.77.70,10.0.2.15,TCP,2950,"9001  >  34692 [PSH, ACK] Seq=213736217 Ack=11732601 Win=65535 Len=2896 [TCP segment of a reassembled PDU]"
1,4.674762000000555,10.0.2.15,54.93.77.70,TCP,54,34692  >  9001 [ACK] Seq=11732601 Ack=213739113 Win=65535 Len=0
1,4.675760000000082,54.93.77.70,10.0.2.15,TLSv1.2,1502,Application Data [TCP segment of a reassembled PDU]
1,4.675799999999981,10.0.2.15,54.93.77.70,TCP,54,34692  >  9001 [ACK] Seq=11732601 Ack=213740561 Win=65535 Len=0
1,4.675978000000214,10.0.2.15,54.93.77.70,TLSv1.2,590,Application Data
1,4.676054999999906,54.93.77.70,10.0.2.15,TCP,60,9001  >  34692 [ACK] Seq=213740561 Ack=11733137 Win=65535 Len=0
1,4.679334000000381,54.93.77.70,10.0.2.15,TLSv1.2,1408,Application Data
1,4.6900970000006055,10.0.2.15,54.93.77.70,TLSv1.2,1104,Application Data
1,4.690246000000116,54.93.77.70,10.0.2.15,TCP,60,9001  >  34692 [ACK] Seq=213741915 Ack=11734187 Win=65535 Len=0
1,4.723807000000306,62.210.85.178,10.0.2.15,TLSv1.2,590,Application Data
1,4.764995999999883,10.0.2.15,62.210.85.178,TCP,54,35978  >  9001 [ACK] Seq=213861379 Ack=11674863 Win=65535 Len=0
1,4.819806999999855,62.210.85.178,10.0.2.15,TLSv1.2,590,Application Data
1,4.819868999999926,10.0.2.15,62.210.85.178,TCP,54,35978  >  9001 [ACK] Seq=213861379 Ack=11675399 Win=65535 Len=0
1,5.365711000000374,62.210.85.178,10.0.2.15,TLSv1.2,1104,Application Data
1,5.365788000000066,10.0.2.15,62.210.85.178,TCP,54,35978  >  9001 [ACK] Seq=213861379 Ack=11676449 Win=65535 Len=0
1,5.366280000000188,10.0.2.15,62.210.85.178,TLSv1.2,590,Application Data
1,5.366380999999819,62.210.85.178,10.0.2.15,TCP,60,9001  >  35978 [ACK] Seq=11676449 Ack=213861915 Win=65535 Len=0
1,5.478778000000602,54.93.77.70,10.0.2.15,TLSv1.2,590,Application Data
1,5.479162999999971,10.0.2.15,54.93.77.70,TLSv1.2,590,Application Data
1,5.479261999999835,54.93.77.70,10.0.2.15,TCP,60,9001  >  34692 [ACK] Seq=213742451 Ack=11734723 Win=65535 Len=0
1,5.616445000000567,62.210.85.178,10.0.2.15,TLSv1.2,590,Application Data
1,5.6214890000001105,10.0.2.15,62.210.85.178,TLSv1.2,590,Application Data
1,5.62165400000049,62.210.85.178,10.0.2.15,TCP,60,9001  >  35978 [ACK] Seq=11676985 Ack=213862451 Win=65535 Len=0
1,5.633992000000035,10.0.2.15,62.210.85.178,TLSv1.2,4124,Application Data
1,5.634094000000005,10.0.2.15,62.210.85.178,TCP,2974,35978  >  9001 [ACK] Seq=213866521 Ack=11676985 Win=65535 Len=2920 [TCP segment of a reassembled PDU]
1,5.634140000000116,62.210.85.178,10.0.2.15,TCP,60,9001  >  35978 [ACK] Seq=11676985 Ack=213863911 Win=65535 Len=0
1,5.634152999999969,62.210.85.178,10.0.2.15,TCP,60,9001  >  35978 [ACK] Seq=11676985 Ack=213865371 Win=65535 Len=0
1,5.6341590000001815,62.210.85.178,10.0.2.15,TCP,60,9001  >  35978 [ACK] Seq=11676985 Ack=213866521 Win=65535 Len=0
1,5.634162000000288,62.210.85.178,10.0.2.15,TCP,60,9001  >  35978 [ACK] Seq=11676985 Ack=213867981 Win=65535 Len=0
1,5.634165000000394,62.210.85.178,10.0.2.15,TCP,60,9001  >  35978 [ACK] Seq=11676985 Ack=213869441 Win=65535 Len=0
1,5.634200000000419,10.0.2.15,62.210.85.178,TLSv1.2,1204,Application Data
1,5.63423899999998,62.210.85.178,10.0.2.15,TCP,60,9001  >  35978 [ACK] Seq=11676985 Ack=213870591 Win=65535 Len=0
1,5.634284000000662,10.0.2.15,62.210.85.178,TLSv1.2,4124,Application Data
1,5.634323000000222,62.210.85.178,10.0.2.15,TCP,60,9001  >  35978 [ACK] Seq=11676985 Ack=213872051 Win=65535 Len=0
1,5.634332000000541,62.210.85.178,10.0.2.15,TCP,60,9001  >  35978 [ACK] Seq=11676985 Ack=213873511 Win=65535 Len=0
1,5.634337000000414,62.210.85.178,10.0.2.15,TCP,60,9001  >  35978 [ACK] Seq=11676985 Ack=213874661 Win=65535 Len=0
1,5.634375999999975,10.0.2.15,62.210.85.178,TLSv1.2,4124,Application Data
1,5.634413000000677,62.210.85.178,10.0.2.15,TCP,60,9001  >  35978 [ACK] Seq=11676985 Ack=213876121 Win=65535 Len=0
1,5.634421000000657,62.210.85.178,10.0.2.15,TCP,60,9001  >  35978 [ACK] Seq=11676985 Ack=213877581 Win=65535 Len=0
1,5.6344630000003235,62.210.85.178,10.0.2.15,TCP,60,9001  >  35978 [ACK] Seq=11676985 Ack=213878731 Win=65535 Len=0
1,5.634498000000349,10.0.2.15,62.210.85.178,TLSv1.2,332,Application Data
1,5.634535000000142,62.210.85.178,10.0.2.15,TCP,60,9001  >  35978 [ACK] Seq=11676985 Ack=213879009 Win=65535 Len=0
1,5.634587999999894,10.0.2.15,62.210.85.178,TLSv1.2,3868,Application Data
1,5.634629000000132,62.210.85.178,10.0.2.15,TCP,60,9001  >  35978 [ACK] Seq=11676985 Ack=213880469 Win=65535 Len=0
1,5.634637000000112,62.210.85.178,10.0.2.15,TCP,60,9001  >  35978 [ACK] Seq=11676985 Ack=213881929 Win=65535 Len=0
1,5.634640000000218,62.210.85.178,10.0.2.15,TCP,60,9001  >  35978 [ACK] Seq=11676985 Ack=213882823 Win=65535 Len=0
1,5.634678000000349,10.0.2.15,62.210.85.178,TLSv1.2,4124,Application Data
1,5.63471699999991,62.210.85.178,10.0.2.15,TCP,60,9001  >  35978 [ACK] Seq=11676985 Ack=213884283 Win=65535 Len=0
1,5.634724999999889,62.210.85.178,10.0.2.15,TCP,60,9001  >  35978 [ACK] Seq=11676985 Ack=213885743 Win=65535 Len=0
1,5.634729000000334,62.210.85.178,10.0.2.15,TCP,60,9001  >  35978 [ACK] Seq=11676985 Ack=213886893 Win=65535 Len=0
1,5.634765000000698,10.0.2.15,62.210.85.178,TLSv1.2,3030,Application Data
1,5.63480299999992,62.210.85.178,10.0.2.15,TCP,60,9001  >  35978 [ACK] Seq=11676985 Ack=213888353 Win=65535 Len=0
1,5.634810000000471,62.210.85.178,10.0.2.15,TCP,60,9001  >  35978 [ACK] Seq=11676985 Ack=213889813 Win=65535 Len=0
1,5.634815000000344,62.210.85.178,10.0.2.15,TCP,60,9001  >  35978 [ACK] Seq=11676985 Ack=213889869 Win=65535 Len=0
1,5.645100000000639,10.0.2.15,62.210.85.178,TLSv1.2,4124,Application Data
1,5.645155000000159,62.210.85.178,10.0.2.15,TCP,60,9001  >  35978 [ACK] Seq=11676985 Ack=213891329 Win=65535 Len=0
1,5.645167000000583,62.210.85.178,10.0.2.15,TCP,60,9001  >  35978 [ACK] Seq=11676985 Ack=213892789 Win=65535 Len=0
1,5.645172000000457,62.210.85.178,10.0.2.15,TCP,60,9001  >  35978 [ACK] Seq=11676985 Ack=213893939 Win=65535 Len=0
1,5.64521700000023,10.0.2.15,62.210.85.178,TLSv1.2,4124,Application Data
1,5.645282999999836,62.210.85.178,10.0.2.15,TCP,60,9001  >  35978 [ACK] Seq=11676985 Ack=213895399 Win=65535 Len=0
1,5.645289000000048,62.210.85.178,10.0.2.15,TCP,60,9001  >  35978 [ACK] Seq=11676985 Ack=213896859 Win=65535 Len=0
1,5.645292000000154,62.210.85.178,10.0.2.15,TCP,60,9001  >  35978 [ACK] Seq=11676985 Ack=213898009 Win=65535 Len=0
1,5.645328000000518,10.0.2.15,62.210.85.178,TLSv1.2,4124,Application Data
1,5.645365000000311,62.210.85.178,10.0.2.15,TCP,60,9001  >  35978 [ACK] Seq=11676985 Ack=213899469 Win=65535 Len=0
1,5.645374000000629,62.210.85.178,10.0.2.15,TCP,60,9001  >  35978 [ACK] Seq=11676985 Ack=213900929 Win=65535 Len=0
1,5.645378000000164,62.210.85.178,10.0.2.15,TCP,60,9001  >  35978 [ACK] Seq=11676985 Ack=213902079 Win=65535 Len=0
1,5.645414999999957,10.0.2.15,62.210.85.178,TLSv1.2,4124,Application Data
1,5.645453000000089,62.210.85.178,10.0.2.15,TCP,60,9001  >  35978 [ACK] Seq=11676985 Ack=213903539 Win=65535 Len=0
1,5.645462000000407,62.210.85.178,10.0.2.15,TCP,60,9001  >  35978 [ACK] Seq=11676985 Ack=213904999 Win=65535 Len=0
1,5.645465999999942,62.210.85.178,10.0.2.15,TCP,60,9001  >  35978 [ACK] Seq=11676985 Ack=213906149 Win=65535 Len=0
1,5.6455009999999675,10.0.2.15,62.210.85.178,TLSv1.2,332,Application Data
1,5.64553800000067,62.210.85.178,10.0.2.15,TCP,60,9001  >  35978 [ACK] Seq=11676985 Ack=213906427 Win=65535 Len=0
1,5.645589000000655,10.0.2.15,62.210.85.178,TLSv1.2,3868,Application Data
1,5.645628000000215,62.210.85.178,10.0.2.15,TCP,60,9001  >  35978 [ACK] Seq=11676985 Ack=213907887 Win=65535 Len=0
1,5.645636000000195,62.210.85.178,10.0.2.15,TCP,60,9001  >  35978 [ACK] Seq=11676985 Ack=213909347 Win=65535 Len=0
1,5.645641000000069,62.210.85.178,10.0.2.15,TCP,60,9001  >  35978 [ACK] Seq=11676985 Ack=213910241 Win=65535 Len=0
1,5.645680000000539,10.0.2.15,62.210.85.178,TLSv1.2,4124,Application Data
1,5.645719000000099,62.210.85.178,10.0.2.15,TCP,60,9001  >  35978 [ACK] Seq=11676985 Ack=213911701 Win=65535 Len=0
1,5.64572600000065,62.210.85.178,10.0.2.15,TCP,60,9001  >  35978 [ACK] Seq=11676985 Ack=213913161 Win=65535 Len=0
1,5.645731000000524,62.210.85.178,10.0.2.15,TCP,60,9001  >  35978 [ACK] Seq=11676985 Ack=213914311 Win=65535 Len=0
1,5.645766000000549,10.0.2.15,62.210.85.178,TLSv1.2,3030,Application Data
1,5.64580400000068,62.210.85.178,10.0.2.15,TCP,60,9001  >  35978 [ACK] Seq=11676985 Ack=213915771 Win=65535 Len=0
1,5.64581200000066,62.210.85.178,10.0.2.15,TCP,60,9001  >  35978 [ACK] Seq=11676985 Ack=213917231 Win=65535 Len=0
1,5.645817000000534,62.210.85.178,10.0.2.15,TCP,60,9001  >  35978 [ACK] Seq=11676985 Ack=213917287 Win=65535 Len=0
1,5.655018999999811,10.0.2.15,62.210.85.178,TLSv1.2,2132,Application Data
1,5.655072999999902,62.210.85.178,10.0.2.15,TCP,60,9001  >  35978 [ACK] Seq=11676985 Ack=213918747 Win=65535 Len=0
1,5.655083999999988,62.210.85.178,10.0.2.15,TCP,60,9001  >  35978 [ACK] Seq=11676985 Ack=213919365 Win=65535 Len=0
1,5.740830000000642,54.93.77.70,10.0.2.15,TLSv1.2,590,Application Data
1,5.774899000000005,54.93.77.70,10.0.2.15,TLSv1.2,7294,Application Data
1,5.774961000000076,10.0.2.15,54.93.77.70,TCP,54,34692  >  9001 [ACK] Seq=11734723 Ack=213750227 Win=65535 Len=0
1,5.787852000000385,54.93.77.70,10.0.2.15,TLSv1.2,2950,Application Data [TCP segment of a reassembled PDU]
1,5.787920000000668,10.0.2.15,54.93.77.70,TCP,54,34692  >  9001 [ACK] Seq=11734723 Ack=213753123 Win=65535 Len=0
1,5.787976000000526,54.93.77.70,10.0.2.15,TCP,1502,"9001  >  34692 [PSH, ACK] Seq=213753123 Ack=11734723 Win=65535 Len=1448 [TCP segment of a reassembled PDU]"
1,5.788031000000046,10.0.2.15,54.93.77.70,TCP,54,34692  >  9001 [ACK] Seq=11734723 Ack=213754571 Win=65535 Len=0
1,5.794630000000325,54.93.77.70,10.0.2.15,TLSv1.2,380,"Application Data, Application Data"
1,5.803012000000308,54.93.77.70,10.0.2.15,TCP,1502,"9001  >  34692 [PSH, ACK] Seq=213754897 Ack=11734723 Win=65535 Len=1448 [TCP segment of a reassembled PDU]"
1,5.803053999999975,10.0.2.15,54.93.77.70,TCP,54,34692  >  9001 [ACK] Seq=11734723 Ack=213756345 Win=65535 Len=0
1,5.812134000000697,54.93.77.70,10.0.2.15,TLSv1.2,684,Application Data
1,5.818812000000435,54.93.77.70,10.0.2.15,TCP,2950,"9001  >  34692 [PSH, ACK] Seq=213756975 Ack=11734723 Win=65535 Len=2896 [TCP segment of a reassembled PDU]"
1,5.818887000000359,10.0.2.15,54.93.77.70,TCP,54,34692  >  9001 [ACK] Seq=11734723 Ack=213759871 Win=65535 Len=0
1,5.829185000000507,54.93.77.70,10.0.2.15,TLSv1.2,2950,Application Data [TCP segment of a reassembled PDU]
1,5.829225000000406,10.0.2.15,54.93.77.70,TCP,54,34692  >  9001 [ACK] Seq=11734723 Ack=213762767 Win=65535 Len=0
1,5.831562000000304,54.93.77.70,10.0.2.15,TLSv1.2,1502,Application Data
1,5.831603000000541,10.0.2.15,54.93.77.70,TCP,54,34692  >  9001 [ACK] Seq=11734723 Ack=213764215 Win=65535 Len=0
1,5.8367910000006304,54.93.77.70,10.0.2.15,TLSv1.2,5238,"Application Data, Application Data"
1,5.836855000000469,10.0.2.15,54.93.77.70,TCP,54,34692  >  9001 [ACK] Seq=11734723 Ack=213769399 Win=65535 Len=0
1,5.83704200000011,10.0.2.15,54.93.77.70,TLSv1.2,590,Application Data
1,5.837104000000181,54.93.77.70,10.0.2.15,TCP,60,9001  >  34692 [ACK] Seq=213769399 Ack=11735259 Win=65535 Len=0
1,5.870249000000513,54.93.77.70,10.0.2.15,TCP,2950,"9001  >  34692 [PSH, ACK] Seq=213769399 Ack=11735259 Win=65535 Len=2896 [TCP segment of a reassembled PDU]"
1,5.8703080000004775,54.93.77.70,10.0.2.15,TLSv1.2,778,Application Data
1,5.870366000000104,10.0.2.15,54.93.77.70,TCP,54,34692  >  9001 [ACK] Seq=11735259 Ack=213773019 Win=65535 Len=0
1,5.878983999999946,54.93.77.70,10.0.2.15,TCP,2950,"9001  >  34692 [PSH, ACK] Seq=213773019 Ack=11735259 Win=65535 Len=2896 [TCP segment of a reassembled PDU]"
1,5.879026000000522,10.0.2.15,54.93.77.70,TCP,54,34692  >  9001 [ACK] Seq=11735259 Ack=213775915 Win=65535 Len=0
1,5.889436000000387,54.93.77.70,10.0.2.15,TLSv1.2,7294,"Application Data, Application Data"
1,5.8895000000002256,10.0.2.15,54.93.77.70,TCP,54,34692  >  9001 [ACK] Seq=11735259 Ack=213783155 Win=65535 Len=0
1,5.896525000000111,54.93.77.70,10.0.2.15,TLSv1.2,1292,Application Data
1,5.899156000000403,54.93.77.70,10.0.2.15,TCP,1502,"9001  >  34692 [PSH, ACK] Seq=213784393 Ack=11735259 Win=65535 Len=1448 [TCP segment of a reassembled PDU]"
1,5.89919700000064,10.0.2.15,54.93.77.70,TCP,54,34692  >  9001 [ACK] Seq=11735259 Ack=213785841 Win=65535 Len=0
1,5.91762000000017,54.93.77.70,10.0.2.15,TLSv1.2,2950,Application Data [TCP segment of a reassembled PDU]
1,5.91765900000064,54.93.77.70,10.0.2.15,TLSv1.2,1408,Application Data
1,5.9177270000000135,10.0.2.15,54.93.77.70,TCP,54,34692  >  9001 [ACK] Seq=11735259 Ack=213790091 Win=65535 Len=0
1,5.9272689999997965,54.93.77.70,10.0.2.15,TCP,2950,"9001  >  34692 [PSH, ACK] Seq=213790091 Ack=11735259 Win=65535 Len=2896 [TCP segment of a reassembled PDU]"
1,5.927320000000691,10.0.2.15,54.93.77.70,TCP,54,34692  >  9001 [ACK] Seq=11735259 Ack=213792987 Win=65535 Len=0
1,5.945577999999841,54.93.77.70,10.0.2.15,TLSv1.2,778,Application Data
1,5.945926000000327,10.0.2.15,54.93.77.70,TLSv1.2,590,Application Data
1,5.946030000000064,54.93.77.70,10.0.2.15,TCP,60,9001  >  34692 [ACK] Seq=213793711 Ack=11735795 Win=65535 Len=0
1,5.977652000000489,54.93.77.70,10.0.2.15,TLSv1.2,3674,Application Data
1,5.9777750000002925,10.0.2.15,54.93.77.70,TCP,54,34692  >  9001 [ACK] Seq=11735795 Ack=213797331 Win=65535 Len=0
1,5.977953999999954,10.0.2.15,54.93.77.70,TLSv1.2,590,Application Data
1,5.978025000000343,54.93.77.70,10.0.2.15,TCP,60,9001  >  34692 [ACK] Seq=213797331 Ack=11736331 Win=65535 Len=0
1,5.986971000000267,54.93.77.70,10.0.2.15,TCP,1502,"9001  >  34692 [PSH, ACK] Seq=213797331 Ack=11736331 Win=65535 Len=1448 [TCP segment of a reassembled PDU]"
1,5.98703900000055,10.0.2.15,54.93.77.70,TCP,54,34692  >  9001 [ACK] Seq=11736331 Ack=213798779 Win=65535 Len=0
1,5.999214999999822,54.93.77.70,10.0.2.15,TLSv1.2,1198,Application Data
1,6.00170800000069,10.0.2.15,54.93.77.70,TLSv1.2,590,Application Data
1,6.001876000000266,54.93.77.70,10.0.2.15,TCP,60,9001  >  34692 [ACK] Seq=213799923 Ack=11736867 Win=65535 Len=0
1,6.014719000000696,62.210.85.178,10.0.2.15,TLSv1.2,590,Application Data
1,6.056998000000021,10.0.2.15,62.210.85.178,TCP,54,35978  >  9001 [ACK] Seq=213919365 Ack=11677521 Win=65535 Len=0
1,6.184553000000051,62.210.85.178,10.0.2.15,TLSv1.2,590,Application Data
1,6.184634000000187,10.0.2.15,62.210.85.178,TCP,54,35978  >  9001 [ACK] Seq=213919365 Ack=11678057 Win=65535 Len=0
1,6.212626999999884,62.210.85.178,10.0.2.15,TLSv1.2,590,Application Data
1,6.212700000000041,10.0.2.15,62.210.85.178,TCP,54,35978  >  9001 [ACK] Seq=213919365 Ack=11678593 Win=65535 Len=0
1,6.597259000000122,62.210.85.178,10.0.2.15,TLSv1.2,590,Application Data
1,6.597335000000385,10.0.2.15,62.210.85.178,TCP,54,35978  >  9001 [ACK] Seq=213919365 Ack=11679129 Win=65535 Len=0
1,6.597773999999845,10.0.2.15,62.210.85.178,TLSv1.2,590,Application Data
1,6.597874000000047,62.210.85.178,10.0.2.15,TCP,60,9001  >  35978 [ACK] Seq=11679129 Ack=213919901 Win=65535 Len=0
1,6.800106000000596,54.93.77.70,10.0.2.15,TLSv1.2,590,Application Data
1,6.8005339999999705,10.0.2.15,54.93.77.70,TLSv1.2,590,Application Data
1,6.8006530000002385,54.93.77.70,10.0.2.15,TCP,60,9001  >  34692 [ACK] Seq=213800459 Ack=11737403 Win=65535 Len=0
1,7.209523999999874,62.210.85.178,10.0.2.15,TLSv1.2,590,Application Data
1,7.214174000000639,10.0.2.15,62.210.85.178,TLSv1.2,590,Application Data
1,7.214340999999877,62.210.85.178,10.0.2.15,TCP,60,9001  >  35978 [ACK] Seq=11679665 Ack=213920437 Win=65535 Len=0
1,7.225624000000607,10.0.2.15,62.210.85.178,TLSv1.2,4124,Application Data
1,7.225742999999966,10.0.2.15,62.210.85.178,TCP,2974,35978  >  9001 [ACK] Seq=213924507 Ack=11679665 Win=65535 Len=2920 [TCP segment of a reassembled PDU]
1,7.225790999999845,62.210.85.178,10.0.2.15,TCP,60,9001  >  35978 [ACK] Seq=11679665 Ack=213921897 Win=65535 Len=0
1,7.225803000000269,62.210.85.178,10.0.2.15,TCP,60,9001  >  35978 [ACK] Seq=11679665 Ack=213923357 Win=65535 Len=0
1,7.225808000000143,62.210.85.178,10.0.2.15,TCP,60,9001  >  35978 [ACK] Seq=11679665 Ack=213924507 Win=65535 Len=0
1,7.225811000000249,62.210.85.178,10.0.2.15,TCP,60,9001  >  35978 [ACK] Seq=11679665 Ack=213925967 Win=65535 Len=0
1,7.225814000000355,62.210.85.178,10.0.2.15,TCP,60,9001  >  35978 [ACK] Seq=11679665 Ack=213927427 Win=65535 Len=0
1,7.22584900000038,10.0.2.15,62.210.85.178,TLSv1.2,1204,Application Data
1,7.225887000000512,62.210.85.178,10.0.2.15,TCP,60,9001  >  35978 [ACK] Seq=11679665 Ack=213928577 Win=65535 Len=0
1,7.2259320000002845,10.0.2.15,62.210.85.178,TLSv1.2,4124,Application Data
1,7.225970999999845,62.210.85.178,10.0.2.15,TCP,60,9001  >  35978 [ACK] Seq=11679665 Ack=213930037 Win=65535 Len=0
1,7.225980000000163,62.210.85.178,10.0.2.15,TCP,60,9001  >  35978 [ACK] Seq=11679665 Ack=213931497 Win=65535 Len=0
1,7.225984000000608,62.210.85.178,10.0.2.15,TCP,60,9001  >  35978 [ACK] Seq=11679665 Ack=213932647 Win=65535 Len=0
1,7.226023000000168,10.0.2.15,62.210.85.178,TLSv1.2,4124,Application Data
1,7.2260610000003,62.210.85.178,10.0.2.15,TCP,60,9001  >  35978 [ACK] Seq=11679665 Ack=213934107 Win=65535 Len=0
1,7.226067999999941,62.210.85.178,10.0.2.15,TCP,60,9001  >  35978 [ACK] Seq=11679665 Ack=213935567 Win=65535 Len=0
1,7.22613900000033,10.0.2.15,62.210.85.178,TLSv1.2,2974,Application Data
1,7.226180000000568,62.210.85.178,10.0.2.15,TCP,60,9001  >  35978 [ACK] Seq=11679665 Ack=213936717 Win=65535 Len=0
1,7.226188000000548,62.210.85.178,10.0.2.15,TCP,60,9001  >  35978 [ACK] Seq=11679665 Ack=213938177 Win=65535 Len=0
1,7.226192000000083,62.210.85.178,10.0.2.15,TCP,60,9001  >  35978 [ACK] Seq=11679665 Ack=213939637 Win=65535 Len=0
1,7.226219000000128,10.0.2.15,62.210.85.178,TLSv1.2,1226,Application Data
1,7.226255000000492,62.210.85.178,10.0.2.15,TCP,60,9001  >  35978 [ACK] Seq=11679665 Ack=213940809 Win=65535 Len=0
1,7.22629599999982,10.0.2.15,62.210.85.178,TLSv1.2,4124,Application Data
1,7.22633500000029,62.210.85.178,10.0.2.15,TCP,60,9001  >  35978 [ACK] Seq=11679665 Ack=213942269 Win=65535 Len=0
1,7.22634300000027,62.210.85.178,10.0.2.15,TCP,60,9001  >  35978 [ACK] Seq=11679665 Ack=213943729 Win=65535 Len=0
1,7.226346999999805,62.210.85.178,10.0.2.15,TCP,60,9001  >  35978 [ACK] Seq=11679665 Ack=213944879 Win=65535 Len=0
1,7.2263840000005075,10.0.2.15,62.210.85.178,TLSv1.2,3030,Application Data
1,7.226423000000068,62.210.85.178,10.0.2.15,TCP,60,9001  >  35978 [ACK] Seq=11679665 Ack=213946339 Win=65535 Len=0
1,7.226431000000048,62.210.85.178,10.0.2.15,TCP,60,9001  >  35978 [ACK] Seq=11679665 Ack=213947799 Win=65535 Len=0
1,7.226434000000154,62.210.85.178,10.0.2.15,TCP,60,9001  >  35978 [ACK] Seq=11679665 Ack=213947855 Win=65535 Len=0
1,7.235641000000214,10.0.2.15,62.210.85.178,TLSv1.2,4124,Application Data
1,7.235693999999967,62.210.85.178,10.0.2.15,TCP,60,9001  >  35978 [ACK] Seq=11679665 Ack=213949315 Win=65535 Len=0
1,7.235706000000391,62.210.85.178,10.0.2.15,TCP,60,9001  >  35978 [ACK] Seq=11679665 Ack=213950775 Win=65535 Len=0
1,7.235711000000265,62.210.85.178,10.0.2.15,TCP,60,9001  >  35978 [ACK] Seq=11679665 Ack=213951925 Win=65535 Len=0
1,7.235756000000038,10.0.2.15,62.210.85.178,TLSv1.2,4124,Application Data
1,7.235795999999937,62.210.85.178,10.0.2.15,TCP,60,9001  >  35978 [ACK] Seq=11679665 Ack=213953385 Win=65535 Len=0
1,7.235805000000255,62.210.85.178,10.0.2.15,TCP,60,9001  >  35978 [ACK] Seq=11679665 Ack=213954845 Win=65535 Len=0
1,7.235810000000129,62.210.85.178,10.0.2.15,TCP,60,9001  >  35978 [ACK] Seq=11679665 Ack=213955995 Win=65535 Len=0
1,7.235849000000599,10.0.2.15,62.210.85.178,TLSv1.2,4124,Application Data
1,7.235893000000033,62.210.85.178,10.0.2.15,TCP,60,9001  >  35978 [ACK] Seq=11679665 Ack=213957455 Win=65535 Len=0
1,7.235901000000013,62.210.85.178,10.0.2.15,TCP,60,9001  >  35978 [ACK] Seq=11679665 Ack=213958915 Win=65535 Len=0
1,7.235905000000457,62.210.85.178,10.0.2.15,TCP,60,9001  >  35978 [ACK] Seq=11679665 Ack=213960065 Win=65535 Len=0
1,7.23594200000025,10.0.2.15,62.210.85.178,TLSv1.2,4124,Application Data
1,7.2359800000003816,62.210.85.178,10.0.2.15,TCP,60,9001  >  35978 [ACK] Seq=11679665 Ack=213961525 Win=65535 Len=0
1,7.2359890000007,62.210.85.178,10.0.2.15,TCP,60,9001  >  35978 [ACK] Seq=11679665 Ack=213962985 Win=65535 Len=0
1,7.235993000000235,62.210.85.178,10.0.2.15,TCP,60,9001  >  35978 [ACK] Seq=11679665 Ack=213964135 Win=65535 Len=0
1,7.23602800000026,10.0.2.15,62.210.85.178,TLSv1.2,332,Application Data
1,7.236066000000392,62.210.85.178,10.0.2.15,TCP,60,9001  >  35978 [ACK] Seq=11679665 Ack=213964413 Win=65535 Len=0
1,7.236115000000609,10.0.2.15,62.210.85.178,TLSv1.2,590,Application Data
1,7.23615400000017,62.210.85.178,10.0.2.15,TCP,60,9001  >  35978 [ACK] Seq=11679665 Ack=213964949 Win=65535 Len=0
1,7.414913999999953,54.93.77.70,10.0.2.15,TCP,2950,"9001  >  34692 [PSH, ACK] Seq=213800459 Ack=11737403 Win=65535 Len=2896 [TCP segment of a reassembled PDU]"
1,7.415038000000095,10.0.2.15,54.93.77.70,TCP,54,34692  >  9001 [ACK] Seq=11737403 Ack=213803355 Win=65535 Len=0
1,7.420207000000119,54.93.77.70,10.0.2.15,TLSv1.2,778,Application Data
1,7.421374000000469,54.93.77.70,10.0.2.15,TLSv1.2,7294,Application Data
1,7.4214520000004995,10.0.2.15,54.93.77.70,TCP,54,34692  >  9001 [ACK] Seq=11737403 Ack=213811319 Win=65535 Len=0
1,7.434009000000515,54.93.77.70,10.0.2.15,TLSv1.2,2950,"Application Data, Application Data"
1,7.434073000000353,10.0.2.15,54.93.77.70,TCP,54,34692  >  9001 [ACK] Seq=11737403 Ack=213814215 Win=65535 Len=0
1,7.43639500000063,54.93.77.70,10.0.2.15,TCP,1502,"9001  >  34692 [PSH, ACK] Seq=213814215 Ack=11737403 Win=65535 Len=1448 [TCP segment of a reassembled PDU]"
1,7.436437000000296,10.0.2.15,54.93.77.70,TCP,54,34692  >  9001 [ACK] Seq=11737403 Ack=213815663 Win=65535 Len=0
1,7.443551000000298,54.93.77.70,10.0.2.15,TLSv1.2,380,Application Data
1,7.444647000000259,54.93.77.70,10.0.2.15,TCP,2950,"9001  >  34692 [PSH, ACK] Seq=213815989 Ack=11737403 Win=65535 Len=2896 [TCP segment of a reassembled PDU]"
1,7.444774999999936,10.0.2.15,54.93.77.70,TCP,54,34692  >  9001 [ACK] Seq=11737403 Ack=213818885 Win=65535 Len=0
1,7.456661000000167,54.93.77.70,10.0.2.15,TLSv1.2,2950,Application Data [TCP segment of a reassembled PDU]
1,7.4567440000000715,10.0.2.15,54.93.77.70,TCP,54,34692  >  9001 [ACK] Seq=11737403 Ack=213821781 Win=65535 Len=0
1,7.456780000000435,54.93.77.70,10.0.2.15,TCP,1502,"9001  >  34692 [PSH, ACK] Seq=213821781 Ack=11737403 Win=65535 Len=1448 [TCP segment of a reassembled PDU]"
1,7.4568370000006325,10.0.2.15,54.93.77.70,TCP,54,34692  >  9001 [ACK] Seq=11737403 Ack=213823229 Win=65535 Len=0
1,7.464039000000412,54.93.77.70,10.0.2.15,TLSv1.2,590,"Application Data, Application Data"
1,7.470788000000539,54.93.77.70,10.0.2.15,TCP,1502,"9001  >  34692 [PSH, ACK] Seq=213823765 Ack=11737403 Win=65535 Len=1448 [TCP segment of a reassembled PDU]"
1,7.470831999999973,10.0.2.15,54.93.77.70,TCP,54,34692  >  9001 [ACK] Seq=11737403 Ack=213825213 Win=65535 Len=0
1,7.476107000000411,54.93.77.70,10.0.2.15,TLSv1.2,2950,Application Data [TCP segment of a reassembled PDU]
1,7.476133000000118,54.93.77.70,10.0.2.15,TLSv1.2,5846,Application Data [TCP segment of a reassembled PDU]
1,7.476191000000654,10.0.2.15,54.93.77.70,TCP,54,34692  >  9001 [ACK] Seq=11737403 Ack=213833901 Win=65535 Len=0
1,7.476325999999972,10.0.2.15,54.93.77.70,TLSv1.2,590,Application Data
1,7.476392999999916,54.93.77.70,10.0.2.15,TCP,60,9001  >  34692 [ACK] Seq=213833901 Ack=11737939 Win=65535 Len=0
1,7.48130300000048,54.93.77.70,10.0.2.15,TLSv1.2,264,Application Data
1,7.493876999999884,54.93.77.70,10.0.2.15,TCP,2950,"9001  >  34692 [PSH, ACK] Seq=213834111 Ack=11737939 Win=65535 Len=2896 [TCP segment of a reassembled PDU]"
1,7.493919999999889,10.0.2.15,54.93.77.70,TCP,54,34692  >  9001 [ACK] Seq=11737939 Ack=213837007 Win=65535 Len=0
1,7.513891999999942,54.93.77.70,10.0.2.15,TLSv1.2,1314,"Application Data, Application Data"
1,7.557048000000577,10.0.2.15,54.93.77.70,TCP,54,34692  >  9001 [ACK] Seq=11737939 Ack=213838267 Win=65535 Len=0
1,7.576361000000361,54.93.77.70,10.0.2.15,TLSv1.2,1104,Application Data
1,7.576418000000558,10.0.2.15,54.93.77.70,TCP,54,34692  >  9001 [ACK] Seq=11737939 Ack=213839317 Win=65535 Len=0
1,7.601972000000387,54.93.77.70,10.0.2.15,TCP,2950,"9001  >  34692 [PSH, ACK] Seq=213839317 Ack=11737939 Win=65535 Len=2896 [TCP segment of a reassembled PDU]"
1,7.601998000000094,54.93.77.70,10.0.2.15,TLSv1.2,3370,"Application Data, Application Data"
1,7.602050000000418,10.0.2.15,54.93.77.70,TCP,54,34692  >  9001 [ACK] Seq=11737939 Ack=213842213 Win=65535 Len=0
1,7.60209500000019,10.0.2.15,54.93.77.70,TCP,54,34692  >  9001 [ACK] Seq=11737939 Ack=213845529 Win=65535 Len=0
1,7.602476000000024,10.0.2.15,54.93.77.70,TLSv1.2,590,Application Data
1,7.602614000000358,54.93.77.70,10.0.2.15,TCP,60,9001  >  34692 [ACK] Seq=213845529 Ack=11738475 Win=65535 Len=0
1,7.611593999999968,62.210.85.178,10.0.2.15,TLSv1.2,590,Application Data
1,7.611928000000262,10.0.2.15,54.93.77.70,TLSv1.2,590,Application Data
1,7.612071000000469,54.93.77.70,10.0.2.15,TCP,60,9001  >  34692 [ACK] Seq=213845529 Ack=11739011 Win=65535 Len=0
1,7.653033000000505,10.0.2.15,62.210.85.178,TCP,54,35978  >  9001 [ACK] Seq=213964949 Ack=11680201 Win=65535 Len=0
1,7.824405000000297,62.210.85.178,10.0.2.15,TLSv1.2,1104,Application Data
1,7.82448900000054,10.0.2.15,62.210.85.178,TCP,54,35978  >  9001 [ACK] Seq=213964949 Ack=11681251 Win=65535 Len=0
1,7.825093000000379,10.0.2.15,62.210.85.178,TLSv1.2,590,Application Data
1,7.825318000000152,62.210.85.178,10.0.2.15,TCP,60,9001  >  35978 [ACK] Seq=11681251 Ack=213965485 Win=65535 Len=0
1,8.028713000000607,54.93.77.70,10.0.2.15,TLSv1.2,590,Application Data
1,8.029207000000497,10.0.2.15,54.93.77.70,TLSv1.2,590,Application Data
1,8.029336999999941,54.93.77.70,10.0.2.15,TCP,60,9001  >  34692 [ACK] Seq=213846065 Ack=11739547 Win=65535 Len=0
1,8.161353999999847,62.210.85.178,10.0.2.15,TLSv1.2,590,Application Data
1,8.168437000000267,10.0.2.15,62.210.85.178,TLSv1.2,590,Application Data
1,8.168650000000525,62.210.85.178,10.0.2.15,TCP,60,9001  >  35978 [ACK] Seq=11681787 Ack=213966021 Win=65535 Len=0
1,8.181080000000293,10.0.2.15,62.210.85.178,TLSv1.2,4124,Application Data
1,8.181185000000369,10.0.2.15,62.210.85.178,TCP,2974,35978  >  9001 [ACK] Seq=213970091 Ack=11681787 Win=65535 Len=2920 [TCP segment of a reassembled PDU]
1,8.181228000000374,62.210.85.178,10.0.2.15,TCP,60,9001  >  35978 [ACK] Seq=11681787 Ack=213967481 Win=65535 Len=0
1,8.181238000000121,62.210.85.178,10.0.2.15,TCP,60,9001  >  35978 [ACK] Seq=11681787 Ack=213968941 Win=65535 Len=0
1,8.181242999999995,62.210.85.178,10.0.2.15,TCP,60,9001  >  35978 [ACK] Seq=11681787 Ack=213970091 Win=65535 Len=0
1,8.18124700000044,62.210.85.178,10.0.2.15,TCP,60,9001  >  35978 [ACK] Seq=11681787 Ack=213971551 Win=65535 Len=0
1,8.181250999999975,62.210.85.178,10.0.2.15,TCP,60,9001  >  35978 [ACK] Seq=11681787 Ack=213973011 Win=65535 Len=0
1,8.18129300000055,10.0.2.15,62.210.85.178,TLSv1.2,1204,Application Data
1,8.181360999999924,10.0.2.15,62.210.85.178,TCP,2974,35978  >  9001 [ACK] Seq=213974161 Ack=11681787 Win=65535 Len=2920 [TCP segment of a reassembled PDU]
1,8.181398000000627,62.210.85.178,10.0.2.15,TCP,60,9001  >  35978 [ACK] Seq=11681787 Ack=213974161 Win=65535 Len=0
1,8.181405000000268,62.210.85.178,10.0.2.15,TCP,60,9001  >  35978 [ACK] Seq=11681787 Ack=213975621 Win=65535 Len=0
1,8.181408999999803,62.210.85.178,10.0.2.15,TCP,60,9001  >  35978 [ACK] Seq=11681787 Ack=213977081 Win=65535 Len=0
1,8.181443999999829,10.0.2.15,62.210.85.178,TLSv1.2,1204,Application Data
1,8.181483000000298,62.210.85.178,10.0.2.15,TCP,60,9001  >  35978 [ACK] Seq=11681787 Ack=213978231 Win=65535 Len=0
1,8.181529999999839,10.0.2.15,62.210.85.178,TLSv1.2,4124,Application Data
1,8.181571000000076,62.210.85.178,10.0.2.15,TCP,60,9001  >  35978 [ACK] Seq=11681787 Ack=213979691 Win=65535 Len=0
1,8.181578000000627,62.210.85.178,10.0.2.15,TCP,60,9001  >  35978 [ACK] Seq=11681787 Ack=213981151 Win=65535 Len=0
1,8.181640000000698,10.0.2.15,62.210.85.178,TLSv1.2,2974,Application Data
1,8.181681000000026,62.210.85.178,10.0.2.15,TCP,60,9001  >  35978 [ACK] Seq=11681787 Ack=213982301 Win=65535 Len=0
1,8.181688000000577,62.210.85.178,10.0.2.15,TCP,60,9001  >  35978 [ACK] Seq=11681787 Ack=213983761 Win=65535 Len=0
1,8.181692000000112,62.210.85.178,10.0.2.15,TCP,60,9001  >  35978 [ACK] Seq=11681787 Ack=213985221 Win=65535 Len=0
1,8.181725999999799,10.0.2.15,62.210.85.178,TLSv1.2,1226,Application Data
1,8.181790000000547,10.0.2.15,62.210.85.178,TCP,2974,35978  >  9001 [ACK] Seq=213986393 Ack=11681787 Win=65535 Len=2920 [TCP segment of a reassembled PDU]
1,8.181829000000107,62.210.85.178,10.0.2.15,TCP,60,9001  >  35978 [ACK] Seq=11681787 Ack=213986393 Win=65535 Len=0
1,8.18183500000032,62.210.85.178,10.0.2.15,TCP,60,9001  >  35978 [ACK] Seq=11681787 Ack=213987853 Win=65535 Len=0
1,8.181840000000193,62.210.85.178,10.0.2.15,TCP,60,9001  >  35978 [ACK] Seq=11681787 Ack=213989313 Win=65535 Len=0
1,8.18187399999988,10.0.2.15,62.210.85.178,TLSv1.2,1204,Application Data
1,8.181910000000244,62.210.85.178,10.0.2.15,TCP,60,9001  >  35978 [ACK] Seq=11681787 Ack=213990463 Win=65535 Len=0
1,8.181955000000016,10.0.2.15,62.210.85.178,TLSv1.2,3030,Application Data
1,8.181996000000254,62.210.85.178,10.0.2.15,TCP,60,9001  >  35978 [ACK] Seq=11681787 Ack=213991923 Win=65535 Len=0
1,8.182002999999895,62.210.85.178,10.0.2.15,TCP,60,9001  >  35978 [ACK] Seq=11681787 Ack=213993383 Win=65535 Len=0
1,8.18200700000034,62.210.85.178,10.0.2.15,TCP,60,9001  >  35978 [ACK] Seq=11681787 Ack=213993439 Win=65535 Len=0
1,8.19126099999994,10.0.2.15,62.210.85.178,TLSv1.2,4124,Application Data
1,8.191377000000102,62.210.85.178,10.0.2.15,TCP,60,9001  >  35978 [ACK] Seq=11681787 Ack=213994899 Win=65535 Len=0
1,8.191389999999956,62.210.85.178,10.0.2.15,TCP,60,9001  >  35978 [ACK] Seq=11681787 Ack=213996359 Win=65535 Len=0
1,8.1913940000004,62.210.85.178,10.0.2.15,TCP,60,9001  >  35978 [ACK] Seq=11681787 Ack=213997509 Win=65535 Len=0
1,8.1914340000003,10.0.2.15,62.210.85.178,TLSv1.2,4124,Application Data
1,8.191474000000198,62.210.85.178,10.0.2.15,TCP,60,9001  >  35978 [ACK] Seq=11681787 Ack=213998969 Win=65535 Len=0
1,8.191483000000517,62.210.85.178,10.0.2.15,TCP,60,9001  >  35978 [ACK] Seq=11681787 Ack=214000429 Win=65535 Len=0
1,8.19148800000039,62.210.85.178,10.0.2.15,TCP,60,9001  >  35978 [ACK] Seq=11681787 Ack=214001579 Win=65535 Len=0
1,8.191526999999951,10.0.2.15,62.210.85.178,TLSv1.2,4124,Application Data
1,8.191566000000421,62.210.85.178,10.0.2.15,TCP,60,9001  >  35978 [ACK] Seq=11681787 Ack=214003039 Win=65535 Len=0
1,8.19157499999983,62.210.85.178,10.0.2.15,TCP,60,9001  >  35978 [ACK] Seq=11681787 Ack=214004499 Win=65535 Len=0
1,8.191579000000274,62.210.85.178,10.0.2.15,TCP,60,9001  >  35978 [ACK] Seq=11681787 Ack=214005649 Win=65535 Len=0
1,8.191620000000512,10.0.2.15,62.210.85.178,TLSv1.2,3866,Application Data
1,8.191658000000643,62.210.85.178,10.0.2.15,TCP,60,9001  >  35978 [ACK] Seq=11681787 Ack=214007109 Win=65535 Len=0
1,8.191666000000623,62.210.85.178,10.0.2.15,TCP,60,9001  >  35978 [ACK] Seq=11681787 Ack=214008569 Win=65535 Len=0
1,8.191670000000158,62.210.85.178,10.0.2.15,TCP,60,9001  >  35978 [ACK] Seq=11681787 Ack=214009461 Win=65535 Len=0
1,8.294850000000224,54.93.77.70,10.0.2.15,TLSv1.2,590,Application Data
1,8.30301000000054,54.93.77.70,10.0.2.15,TCP,2950,"9001  >  34692 [PSH, ACK] Seq=213846601 Ack=11739547 Win=65535 Len=2896 [TCP segment of a reassembled PDU]"
1,8.303085000000465,10.0.2.15,54.93.77.70,TCP,54,34692  >  9001 [ACK] Seq=11739547 Ack=213849497 Win=65535 Len=0
1,8.313302000000476,54.93.77.70,10.0.2.15,TLSv1.2,778,Application Data
1,8.321324000000459,54.93.77.70,10.0.2.15,TCP,2950,"9001  >  34692 [PSH, ACK] Seq=213850221 Ack=11739547 Win=65535 Len=2896 [TCP segment of a reassembled PDU]"
1,8.321371,10.0.2.15,54.93.77.70,TCP,54,34692  >  9001 [ACK] Seq=11739547 Ack=213853117 Win=65535 Len=0
1,8.331998999999996,54.93.77.70,10.0.2.15,TLSv1.2,778,Application Data
1,8.335732000000462,54.93.77.70,10.0.2.15,TCP,2950,"9001  >  34692 [PSH, ACK] Seq=213853841 Ack=11739547 Win=65535 Len=2896 [TCP segment of a reassembled PDU]"
1,8.335778000000573,10.0.2.15,54.93.77.70,TCP,54,34692  >  9001 [ACK] Seq=11739547 Ack=213856737 Win=65535 Len=0
1,8.349691000000348,54.93.77.70,10.0.2.15,TLSv1.2,264,Application Data
1,8.353650000000016,54.93.77.70,10.0.2.15,TCP,2950,"9001  >  34692 [PSH, ACK] Seq=213856947 Ack=11739547 Win=65535 Len=2896 [TCP segment of a reassembled PDU]"
1,8.35367000000042,54.93.77.70,10.0.2.15,TLSv1.2,1502,Application Data [TCP segment of a reassembled PDU]
1,8.353711000000658,10.0.2.15,54.93.77.70,TCP,54,34692  >  9001 [ACK] Seq=11739547 Ack=213859843 Win=65535 Len=0
1,8.353791000000456,10.0.2.15,54.93.77.70,TCP,54,34692  >  9001 [ACK] Seq=11739547 Ack=213861291 Win=65535 Len=0
1,8.368905000000268,54.93.77.70,10.0.2.15,TLSv1.2,380,Application Data
1,8.376584000000548,54.93.77.70,10.0.2.15,TCP,1502,"9001  >  34692 [PSH, ACK] Seq=213861617 Ack=11739547 Win=65535 Len=1448 [TCP segment of a reassembled PDU]"
1,8.376643999999942,10.0.2.15,54.93.77.70,TCP,54,34692  >  9001 [ACK] Seq=11739547 Ack=213863065 Win=65535 Len=0
1,8.3868480000001,54.93.77.70,10.0.2.15,TLSv1.2,2646,Application Data [TCP segment of a reassembled PDU]
1,8.386892000000444,10.0.2.15,54.93.77.70,TCP,54,34692  >  9001 [ACK] Seq=11739547 Ack=213865657 Win=65535 Len=0
1,8.387301000000662,54.93.77.70,10.0.2.15,TCP,1502,"9001  >  34692 [PSH, ACK] Seq=213865657 Ack=11739547 Win=65535 Len=1448 [TCP segment of a reassembled PDU]"
1,8.387345000000096,10.0.2.15,54.93.77.70,TCP,54,34692  >  9001 [ACK] Seq=11739547 Ack=213867105 Win=65535 Len=0
1,8.390250999999807,54.93.77.70,10.0.2.15,TLSv1.2,2950,Application Data [TCP segment of a reassembled PDU]
1,8.390314000000217,10.0.2.15,54.93.77.70,TCP,54,34692  >  9001 [ACK] Seq=11739547 Ack=213870001 Win=65535 Len=0
1,8.408156999999846,54.93.77.70,10.0.2.15,TLSv1.2,988,Application Data
1,8.422440000000279,54.93.77.70,10.0.2.15,TCP,2950,"9001  >  34692 [PSH, ACK] Seq=213870935 Ack=11739547 Win=65535 Len=2896 [TCP segment of a reassembled PDU]"
1,8.422464000000218,54.93.77.70,10.0.2.15,TLSv1.2,2950,Application Data [TCP segment of a reassembled PDU]
1,8.422516000000542,10.0.2.15,54.93.77.70,TCP,54,34692  >  9001 [ACK] Seq=11739547 Ack=213873831 Win=65535 Len=0
1,8.422607999999855,10.0.2.15,54.93.77.70,TCP,54,34692  >  9001 [ACK] Seq=11739547 Ack=213876727 Win=65535 Len=0
1,8.42280699999992,10.0.2.15,54.93.77.70,TLSv1.2,590,Application Data
1,8.422939000000042,54.93.77.70,10.0.2.15,TCP,60,9001  >  34692 [ACK] Seq=213876727 Ack=11740083 Win=65535 Len=0
1,8.423444000000018,54.93.77.70,10.0.2.15,TCP,1502,"9001  >  34692 [PSH, ACK] Seq=213876727 Ack=11740083 Win=65535 Len=1448 [TCP segment of a reassembled PDU]"
1,8.423501000000215,10.0.2.15,54.93.77.70,TCP,54,34692  >  9001 [ACK] Seq=11740083 Ack=213878175 Win=65535 Len=0
1,8.426540999999816,54.93.77.70,10.0.2.15,TLSv1.2,568,Application Data
1,8.439025000000584,54.93.77.70,10.0.2.15,TLSv1.2,4398,Application Data
1,8.439127000000553,10.0.2.15,54.93.77.70,TCP,54,34692  >  9001 [ACK] Seq=11740083 Ack=213883033 Win=65535 Len=0
1,8.44326700000056,54.93.77.70,10.0.2.15,TLSv1.2,894,Application Data
1,8.467744999999923,54.93.77.70,10.0.2.15,TCP,2950,"9001  >  34692 [PSH, ACK] Seq=213883873 Ack=11740083 Win=65535 Len=2896 [TCP segment of a reassembled PDU]"
1,8.467806000000564,10.0.2.15,54.93.77.70,TCP,54,34692  >  9001 [ACK] Seq=11740083 Ack=213886769 Win=65535 Len=0
1,8.477716000000328,54.93.77.70,10.0.2.15,TLSv1.2,2950,Application Data [TCP segment of a reassembled PDU]
1,8.47776900000008,10.0.2.15,54.93.77.70,TCP,54,34692  >  9001 [ACK] Seq=11740083 Ack=213889665 Win=65535 Len=0
1,8.4852520000004,54.93.77.70,10.0.2.15,TLSv1.2,474,Application Data
1,8.48842599999989,10.0.2.15,54.93.77.70,TLSv1.2,590,Application Data
1,8.488670000000639,54.93.77.70,10.0.2.15,TCP,60,9001  >  34692 [ACK] Seq=213890085 Ack=11740619 Win=65535 Len=0
1,8.558191000000079,62.210.85.178,10.0.2.15,TLSv1.2,590,Application Data
1,8.601015000000189,10.0.2.15,62.210.85.178,TCP,54,35978  >  9001 [ACK] Seq=214009461 Ack=11682323 Win=65535 Len=0
1,8.626976000000468,62.210.85.178,10.0.2.15,TLSv1.2,590,Application Data
1,8.627032000000327,10.0.2.15,62.210.85.178,TCP,54,35978  >  9001 [ACK] Seq=214009461 Ack=11682859 Win=65535 Len=0
1,8.627279000000271,10.0.2.15,62.210.85.178,TLSv1.2,590,Application Data
1,8.627371999999923,62.210.85.178,10.0.2.15,TCP,60,9001  >  35978 [ACK] Seq=11682859 Ack=214009997 Win=65535 Len=0
1,8.74402900000041,54.93.77.70,10.0.2.15,TLSv1.2,590,Application Data
1,8.744490000000042,10.0.2.15,54.93.77.70,TLSv1.2,590,Application Data
1,8.744630000000143,54.93.77.70,10.0.2.15,TCP,60,9001  >  34692 [ACK] Seq=213890621 Ack=11741155 Win=65535 Len=0
1,8.857958999999937,62.210.85.178,10.0.2.15,TLSv1.2,590,Application Data
1,8.86437500000011,10.0.2.15,62.210.85.178,TLSv1.2,590,Application Data
1,8.864532000000509,62.210.85.178,10.0.2.15,TCP,60,9001  >  35978 [ACK] Seq=11683395 Ack=214010533 Win=65535 Len=0
1,8.877097000000504,10.0.2.15,62.210.85.178,TLSv1.2,4124,Application Data
1,8.877188999999817,10.0.2.15,62.210.85.178,TCP,2974,35978  >  9001 [ACK] Seq=214014603 Ack=11683395 Win=65535 Len=2920 [TCP segment of a reassembled PDU]
1,8.877244000000246,62.210.85.178,10.0.2.15,TCP,60,9001  >  35978 [ACK] Seq=11683395 Ack=214011993 Win=65535 Len=0
1,8.877253999999994,62.210.85.178,10.0.2.15,TCP,60,9001  >  35978 [ACK] Seq=11683395 Ack=214013453 Win=65535 Len=0
1,8.8772570000001,62.210.85.178,10.0.2.15,TCP,60,9001  >  35978 [ACK] Seq=11683395 Ack=214014603 Win=65535 Len=0
1,8.877260000000206,62.210.85.178,10.0.2.15,TCP,60,9001  >  35978 [ACK] Seq=11683395 Ack=214016063 Win=65535 Len=0
1,8.877263000000312,62.210.85.178,10.0.2.15,TCP,60,9001  >  35978 [ACK] Seq=11683395 Ack=214017523 Win=65535 Len=0
1,8.87729600000057,10.0.2.15,62.210.85.178,TLSv1.2,1204,Application Data
1,8.877333000000363,62.210.85.178,10.0.2.15,TCP,60,9001  >  35978 [ACK] Seq=11683395 Ack=214018673 Win=65535 Len=0
1,8.87738200000058,10.0.2.15,62.210.85.178,TLSv1.2,4124,Application Data
1,8.877416000000267,62.210.85.178,10.0.2.15,TCP,60,9001  >  35978 [ACK] Seq=11683395 Ack=214020133 Win=65535 Len=0
1,8.877424000000246,62.210.85.178,10.0.2.15,TCP,60,9001  >  35978 [ACK] Seq=11683395 Ack=214021593 Win=65535 Len=0
1,8.87742900000012,62.210.85.178,10.0.2.15,TCP,60,9001  >  35978 [ACK] Seq=11683395 Ack=214022743 Win=65535 Len=0
1,8.87746800000059,10.0.2.15,62.210.85.178,TLSv1.2,4124,Application Data
1,8.877500999999938,62.210.85.178,10.0.2.15,TCP,60,9001  >  35978 [ACK] Seq=11683395 Ack=214024203 Win=65535 Len=0
1,8.877508999999918,62.210.85.178,10.0.2.15,TCP,60,9001  >  35978 [ACK] Seq=11683395 Ack=214025663 Win=65535 Len=0
1,8.877564000000348,10.0.2.15,62.210.85.178,TLSv1.2,2974,Application Data
1,8.877599000000373,62.210.85.178,10.0.2.15,TCP,60,9001  >  35978 [ACK] Seq=11683395 Ack=214026813 Win=65535 Len=0
1,8.877607000000353,62.210.85.178,10.0.2.15,TCP,60,9001  >  35978 [ACK] Seq=11683395 Ack=214028273 Win=65535 Len=0
1,8.877610999999888,62.210.85.178,10.0.2.15,TCP,60,9001  >  35978 [ACK] Seq=11683395 Ack=214029733 Win=65535 Len=0
1,8.877637999999934,10.0.2.15,62.210.85.178,TLSv1.2,1226,Application Data
1,8.877671000000191,62.210.85.178,10.0.2.15,TCP,60,9001  >  35978 [ACK] Seq=11683395 Ack=214030905 Win=65535 Len=0
1,8.87771100000009,10.0.2.15,62.210.85.178,TLSv1.2,4124,Application Data
1,8.877746000000116,62.210.85.178,10.0.2.15,TCP,60,9001  >  35978 [ACK] Seq=11683395 Ack=214032365 Win=65535 Len=0
1,8.877753000000666,62.210.85.178,10.0.2.15,TCP,60,9001  >  35978 [ACK] Seq=11683395 Ack=214033825 Win=65535 Len=0
1,8.877755999999863,62.210.85.178,10.0.2.15,TCP,60,9001  >  35978 [ACK] Seq=11683395 Ack=214034975 Win=65535 Len=0
1,8.877793000000565,10.0.2.15,62.210.85.178,TLSv1.2,3030,Application Data
1,8.877827000000252,62.210.85.178,10.0.2.15,TCP,60,9001  >  35978 [ACK] Seq=11683395 Ack=214036435 Win=65535 Len=0
1,8.877833000000464,62.210.85.178,10.0.2.15,TCP,60,9001  >  35978 [ACK] Seq=11683395 Ack=214037895 Win=65535 Len=0
1,8.87783600000057,62.210.85.178,10.0.2.15,TCP,60,9001  >  35978 [ACK] Seq=11683395 Ack=214037951 Win=65535 Len=0
1,8.886961000000156,10.0.2.15,62.210.85.178,TLSv1.2,4124,Application Data
1,8.887029000000439,62.210.85.178,10.0.2.15,TCP,60,9001  >  35978 [ACK] Seq=11683395 Ack=214039411 Win=65535 Len=0
1,8.88703600000008,62.210.85.178,10.0.2.15,TCP,60,9001  >  35978 [ACK] Seq=11683395 Ack=214040871 Win=65535 Len=0
1,8.887039000000186,62.210.85.178,10.0.2.15,TCP,60,9001  >  35978 [ACK] Seq=11683395 Ack=214042021 Win=65535 Len=0
1,8.88707500000055,10.0.2.15,62.210.85.178,TLSv1.2,4124,Application Data
1,8.88713000000007,62.210.85.178,10.0.2.15,TCP,60,9001  >  35978 [ACK] Seq=11683395 Ack=214043481 Win=65535 Len=0
1,8.887137000000621,62.210.85.178,10.0.2.15,TCP,60,9001  >  35978 [ACK] Seq=11683395 Ack=214044941 Win=65535 Len=0
1,8.887139999999818,62.210.85.178,10.0.2.15,TCP,60,9001  >  35978 [ACK] Seq=11683395 Ack=214046091 Win=65535 Len=0
1,8.887174999999843,10.0.2.15,62.210.85.178,TLSv1.2,4124,Application Data
1,8.8872080000001,62.210.85.178,10.0.2.15,TCP,60,9001  >  35978 [ACK] Seq=11683395 Ack=214047551 Win=65535 Len=0
1,8.88721600000008,62.210.85.178,10.0.2.15,TCP,60,9001  >  35978 [ACK] Seq=11683395 Ack=214049011 Win=65535 Len=0
1,8.887220000000525,62.210.85.178,10.0.2.15,TCP,60,9001  >  35978 [ACK] Seq=11683395 Ack=214050161 Win=65535 Len=0
1,8.88725599999998,10.0.2.15,62.210.85.178,TLSv1.2,4124,Application Data
1,8.887289000000237,62.210.85.178,10.0.2.15,TCP,60,9001  >  35978 [ACK] Seq=11683395 Ack=214051621 Win=65535 Len=0
1,8.887297000000217,62.210.85.178,10.0.2.15,TCP,60,9001  >  35978 [ACK] Seq=11683395 Ack=214053081 Win=65535 Len=0
1,8.887301000000662,62.210.85.178,10.0.2.15,TCP,60,9001  >  35978 [ACK] Seq=11683395 Ack=214054231 Win=65535 Len=0
1,8.887335000000348,10.0.2.15,62.210.85.178,TLSv1.2,332,Application Data
1,8.887367000000268,62.210.85.178,10.0.2.15,TCP,60,9001  >  35978 [ACK] Seq=11683395 Ack=214054509 Win=65535 Len=0
1,8.887416000000485,10.0.2.15,62.210.85.178,TLSv1.2,3868,Application Data
1,8.88745199999994,62.210.85.178,10.0.2.15,TCP,60,9001  >  35978 [ACK] Seq=11683395 Ack=214055969 Win=65535 Len=0
1,8.88745900000049,62.210.85.178,10.0.2.15,TCP,60,9001  >  35978 [ACK] Seq=11683395 Ack=214057429 Win=65535 Len=0
1,8.887462000000596,62.210.85.178,10.0.2.15,TCP,60,9001  >  35978 [ACK] Seq=11683395 Ack=214058323 Win=65535 Len=0
1,8.887499000000389,10.0.2.15,62.210.85.178,TLSv1.2,4124,Application Data
1,8.887533000000076,62.210.85.178,10.0.2.15,TCP,60,9001  >  35978 [ACK] Seq=11683395 Ack=214059783 Win=65535 Len=0
1,8.887540000000627,62.210.85.178,10.0.2.15,TCP,60,9001  >  35978 [ACK] Seq=11683395 Ack=214061243 Win=65535 Len=0
1,8.887542999999823,62.210.85.178,10.0.2.15,TCP,60,9001  >  35978 [ACK] Seq=11683395 Ack=214062393 Win=65535 Len=0
1,8.88757700000042,10.0.2.15,62.210.85.178,TLSv1.2,3030,Application Data
1,8.887612000000445,62.210.85.178,10.0.2.15,TCP,60,9001  >  35978 [ACK] Seq=11683395 Ack=214063853 Win=65535 Len=0
1,8.887618000000657,62.210.85.178,10.0.2.15,TCP,60,9001  >  35978 [ACK] Seq=11683395 Ack=214065313 Win=65535 Len=0
1,8.887620999999854,62.210.85.178,10.0.2.15,TCP,60,9001  >  35978 [ACK] Seq=11683395 Ack=214065369 Win=65535 Len=0
1,8.901220000000649,10.0.2.15,62.210.85.178,TLSv1.2,4124,Application Data
1,8.90130500000032,62.210.85.178,10.0.2.15,TCP,60,9001  >  35978 [ACK] Seq=11683395 Ack=214066829 Win=65535 Len=0
1,8.901315000000068,62.210.85.178,10.0.2.15,TCP,60,9001  >  35978 [ACK] Seq=11683395 Ack=214068289 Win=65535 Len=0
1,8.901318000000174,62.210.85.178,10.0.2.15,TCP,60,9001  >  35978 [ACK] Seq=11683395 Ack=214069439 Win=65535 Len=0
1,8.901357000000644,10.0.2.15,62.210.85.178,TLSv1.2,4124,Application Data
1,8.90139100000033,62.210.85.178,10.0.2.15,TCP,60,9001  >  35978 [ACK] Seq=11683395 Ack=214070899 Win=65535 Len=0
1,8.901400000000649,62.210.85.178,10.0.2.15,TCP,60,9001  >  35978 [ACK] Seq=11683395 Ack=214072359 Win=65535 Len=0
1,8.901404000000184,62.210.85.178,10.0.2.15,TCP,60,9001  >  35978 [ACK] Seq=11683395 Ack=214073509 Win=65535 Len=0
1,8.901443000000654,10.0.2.15,62.210.85.178,TLSv1.2,4124,Application Data
1,8.90147800000068,62.210.85.178,10.0.2.15,TCP,60,9001  >  35978 [ACK] Seq=11683395 Ack=214074969 Win=65535 Len=0
1,8.90148500000032,62.210.85.178,10.0.2.15,TCP,60,9001  >  35978 [ACK] Seq=11683395 Ack=214076429 Win=65535 Len=0
1,8.901488999999856,62.210.85.178,10.0.2.15,TCP,60,9001  >  35978 [ACK] Seq=11683395 Ack=214077579 Win=65535 Len=0
1,8.90152500000022,10.0.2.15,62.210.85.178,TLSv1.2,4124,Application Data
1,8.901558000000477,62.210.85.178,10.0.2.15,TCP,60,9001  >  35978 [ACK] Seq=11683395 Ack=214079039 Win=65535 Len=0
1,8.901566000000457,62.210.85.178,10.0.2.15,TCP,60,9001  >  35978 [ACK] Seq=11683395 Ack=214080499 Win=65535 Len=0
1,8.901569999999992,62.210.85.178,10.0.2.15,TCP,60,9001  >  35978 [ACK] Seq=11683395 Ack=214081649 Win=65535 Len=0
1,8.901605000000018,10.0.2.15,62.210.85.178,TLSv1.2,332,Application Data
1,8.901640000000043,62.210.85.178,10.0.2.15,TCP,60,9001  >  35978 [ACK] Seq=11683395 Ack=214081927 Win=65535 Len=0
1,8.90168900000026,10.0.2.15,62.210.85.178,TLSv1.2,3868,Application Data
1,8.901725000000624,62.210.85.178,10.0.2.15,TCP,60,9001  >  35978 [ACK] Seq=11683395 Ack=214083387 Win=65535 Len=0
1,8.901732000000266,62.210.85.178,10.0.2.15,TCP,60,9001  >  35978 [ACK] Seq=11683395 Ack=214084847 Win=65535 Len=0
1,8.9017359999998,62.210.85.178,10.0.2.15,TCP,60,9001  >  35978 [ACK] Seq=11683395 Ack=214085741 Win=65535 Len=0
1,8.901773999999932,10.0.2.15,62.210.85.178,TLSv1.2,4124,Application Data
1,8.901810000000296,62.210.85.178,10.0.2.15,TCP,60,9001  >  35978 [ACK] Seq=11683395 Ack=214087201 Win=65535 Len=0
1,8.901816000000508,62.210.85.178,10.0.2.15,TCP,60,9001  >  35978 [ACK] Seq=11683395 Ack=214088661 Win=65535 Len=0
1,8.901819000000614,62.210.85.178,10.0.2.15,TCP,60,9001  >  35978 [ACK] Seq=11683395 Ack=214089811 Win=65535 Len=0
1,8.901853000000301,10.0.2.15,62.210.85.178,TLSv1.2,3030,Application Data
1,8.901886999999988,62.210.85.178,10.0.2.15,TCP,60,9001  >  35978 [ACK] Seq=11683395 Ack=214091271 Win=65535 Len=0
1,8.901894000000539,62.210.85.178,10.0.2.15,TCP,60,9001  >  35978 [ACK] Seq=11683395 Ack=214092731 Win=65535 Len=0
1,8.901896000000306,62.210.85.178,10.0.2.15,TCP,60,9001  >  35978 [ACK] Seq=11683395 Ack=214092787 Win=65535 Len=0
1,8.911017000000356,10.0.2.15,62.210.85.178,TLSv1.2,1618,Application Data
1,8.911105000000134,62.210.85.178,10.0.2.15,TCP,60,9001  >  35978 [ACK] Seq=11683395 Ack=214094247 Win=65535 Len=0
1,8.911114000000453,62.210.85.178,10.0.2.15,TCP,60,9001  >  35978 [ACK] Seq=11683395 Ack=214094351 Win=65535 Len=0
1,8.99955399999999,54.93.77.70,10.0.2.15,TLSv1.2,590,Application Data
1,9.04121000000032,10.0.2.15,54.93.77.70,TCP,54,34692  >  9001 [ACK] Seq=11741155 Ack=213891157 Win=65535 Len=0
1,9.086217000000033,54.93.77.70,10.0.2.15,TLSv1.2,2132,Application Data
1,9.086283000000549,10.0.2.15,54.93.77.70,TCP,54,34692  >  9001 [ACK] Seq=11741155 Ack=213893235 Win=65535 Len=0
1,9.09955600000012,54.93.77.70,10.0.2.15,TCP,2950,"9001  >  34692 [PSH, ACK] Seq=213893235 Ack=11741155 Win=65535 Len=2896 [TCP segment of a reassembled PDU]"
1,9.099614000000656,10.0.2.15,54.93.77.70,TCP,54,34692  >  9001 [ACK] Seq=11741155 Ack=213896131 Win=65535 Len=0
1,9.116534000000684,54.93.77.70,10.0.2.15,TLSv1.2,2342,"Application Data, Application Data"
1,9.116587999999865,10.0.2.15,54.93.77.70,TCP,54,34692  >  9001 [ACK] Seq=11741155 Ack=213898419 Win=65535 Len=0
1,9.116829999999936,10.0.2.15,54.93.77.70,TLSv1.2,590,Application Data
1,9.116917000000285,54.93.77.70,10.0.2.15,TCP,60,9001  >  34692 [ACK] Seq=213898419 Ack=11741691 Win=65535 Len=0
1,9.17234499999995,54.93.77.70,10.0.2.15,TLSv1.2,3674,Application Data
1,9.17246299999988,10.0.2.15,54.93.77.70,TCP,54,34692  >  9001 [ACK] Seq=11741691 Ack=213902039 Win=65535 Len=0
1,9.190034000000196,54.93.77.70,10.0.2.15,TLSv1.2,590,Application Data
1,9.211748000000625,54.93.77.70,10.0.2.15,TCP,2950,"9001  >  34692 [PSH, ACK] Seq=213902575 Ack=11741691 Win=65535 Len=2896 [TCP segment of a reassembled PDU]"
1,9.211812999999893,10.0.2.15,54.93.77.70,TCP,54,34692  >  9001 [ACK] Seq=11741691 Ack=213905471 Win=65535 Len=0
1,9.217814999999973,54.93.77.70,10.0.2.15,TLSv1.2,778,Application Data
1,9.246939999999995,54.93.77.70,10.0.2.15,TCP,2950,"9001  >  34692 [PSH, ACK] Seq=213906195 Ack=11741691 Win=65535 Len=2896 [TCP segment of a reassembled PDU]"
1,9.246979999999894,54.93.77.70,10.0.2.15,TLSv1.2,10190,"Application Data, Application Data, Application Data, Application Data"
1,9.247037000000091,10.0.2.15,54.93.77.70,TCP,54,34692  >  9001 [ACK] Seq=11741691 Ack=213909091 Win=65535 Len=0
1,9.247143000000506,10.0.2.15,54.93.77.70,TCP,54,34692  >  9001 [ACK] Seq=11741691 Ack=213919227 Win=65535 Len=0
1,9.24746099999993,10.0.2.15,54.93.77.70,TLSv1.2,590,Application Data
1,9.247537000000193,54.93.77.70,10.0.2.15,TCP,60,9001  >  34692 [ACK] Seq=213919227 Ack=11742227 Win=65535 Len=0
1,9.261030000000574,54.93.77.70,10.0.2.15,TLSv1.2,2552,Application Data
1,9.261086000000432,10.0.2.15,54.93.77.70,TCP,54,34692  >  9001 [ACK] Seq=11742227 Ack=213921725 Win=65535 Len=0
1,9.275724000000082,54.93.77.70,10.0.2.15,TCP,2950,"9001  >  34692 [PSH, ACK] Seq=213921725 Ack=11742227 Win=65535 Len=2896 [TCP segment of a reassembled PDU]"
1,9.2757730000003,54.93.77.70,10.0.2.15,TLSv1.2,11638,"Application Data, Application Data, Application Data"
1,9.275841000000582,10.0.2.15,54.93.77.70,TCP,54,34692  >  9001 [ACK] Seq=11742227 Ack=213936205 Win=65535 Len=0
1,9.276190000000497,62.210.85.178,10.0.2.15,TLSv1.2,590,Application Data
1,9.277320000000145,54.93.77.70,10.0.2.15,TLSv1.2,568,Application Data
1,9.2856069999998,54.93.77.70,10.0.2.15,TCP,2950,"9001  >  34692 [PSH, ACK] Seq=213936719 Ack=11742227 Win=65535 Len=2896 [TCP segment of a reassembled PDU]"
1,9.285625000000437,54.93.77.70,10.0.2.15,TLSv1.2,1502,Application Data [TCP segment of a reassembled PDU]
1,9.285671999999977,10.0.2.15,54.93.77.70,TCP,54,34692  >  9001 [ACK] Seq=11742227 Ack=213939615 Win=65535 Len=0
1,9.28576299999986,10.0.2.15,54.93.77.70,TCP,54,34692  >  9001 [ACK] Seq=11742227 Ack=213941063 Win=65535 Len=0
1,9.291819000000032,54.93.77.70,10.0.2.15,TCP,1502,"9001  >  34692 [PSH, ACK] Seq=213941063 Ack=11742227 Win=65535 Len=1448 [TCP segment of a reassembled PDU]"
1,9.291872000000694,10.0.2.15,54.93.77.70,TCP,54,34692  >  9001 [ACK] Seq=11742227 Ack=213942511 Win=65535 Len=0
1,9.294045000000551,54.93.77.70,10.0.2.15,TLSv1.2,7294,"Application Data, Application Data"
1,9.294111000000157,10.0.2.15,54.93.77.70,TCP,54,34692  >  9001 [ACK] Seq=11742227 Ack=213949751 Win=65535 Len=0
1,9.294276999999965,10.0.2.15,54.93.77.70,TLSv1.2,590,Application Data
1,9.294389000000592,54.93.77.70,10.0.2.15,TCP,60,9001  >  34692 [ACK] Seq=213949751 Ack=11742763 Win=65535 Len=0
1,9.294565000000148,54.93.77.70,10.0.2.15,TLSv1.2,2950,Application Data [TCP segment of a reassembled PDU]
1,9.294608000000153,10.0.2.15,54.93.77.70,TCP,54,34692  >  9001 [ACK] Seq=11742763 Ack=213952647 Win=65535 Len=0
1,9.295325000000048,54.93.77.70,10.0.2.15,TLSv1.2,684,Application Data
1,9.304565999999795,10.0.2.15,54.93.77.70,TLSv1.2,590,Application Data
1,9.304691000000275,54.93.77.70,10.0.2.15,TCP,60,9001  >  34692 [ACK] Seq=213953277 Ack=11743299 Win=65535 Len=0
1,9.316979000000174,10.0.2.15,62.210.85.178,TCP,54,35978  >  9001 [ACK] Seq=214094351 Ack=11683931 Win=65535 Len=0
1,9.319951000000401,54.93.77.70,10.0.2.15,TLSv1.2,7294,Application Data
1,9.320035000000644,10.0.2.15,54.93.77.70,TCP,54,34692  >  9001 [ACK] Seq=11743299 Ack=213960517 Win=65535 Len=0
1,9.321201000000656,54.93.77.70,10.0.2.15,TLSv1.2,1104,"Application Data, Application Data"
1,9.32650300000023,54.93.77.70,10.0.2.15,TLSv1.2,5846,Application Data
1,9.326555000000553,10.0.2.15,54.93.77.70,TCP,54,34692  >  9001 [ACK] Seq=11743299 Ack=213967359 Win=65535 Len=0
1,9.346521000000394,54.93.77.70,10.0.2.15,TLSv1.2,988,Application Data
1,9.346773000000212,10.0.2.15,54.93.77.70,TLSv1.2,590,Application Data
1,9.346916999999848,54.93.77.70,10.0.2.15,TCP,60,9001  >  34692 [ACK] Seq=213968293 Ack=11743835 Win=65535 Len=0
1,9.347153000000617,54.93.77.70,10.0.2.15,TCP,2950,"9001  >  34692 [PSH, ACK] Seq=213968293 Ack=11743835 Win=65535 Len=2896 [TCP segment of a reassembled PDU]"
1,9.347215000000688,10.0.2.15,54.93.77.70,TCP,54,34692  >  9001 [ACK] Seq=11743835 Ack=213971189 Win=65535 Len=0
1,9.365703000000394,54.93.77.70,10.0.2.15,TLSv1.2,778,Application Data
1,9.367296000000351,54.93.77.70,10.0.2.15,TCP,2950,"9001  >  34692 [PSH, ACK] Seq=213971913 Ack=11743835 Win=65535 Len=2896 [TCP segment of a reassembled PDU]"
1,9.367350000000442,10.0.2.15,54.93.77.70,TCP,54,34692  >  9001 [ACK] Seq=11743835 Ack=213974809 Win=65535 Len=0
1,9.384465000000091,54.93.77.70,10.0.2.15,TLSv1.2,264,Application Data
1,9.388320000000022,10.0.2.15,54.93.77.70,TLSv1.2,590,Application Data
1,9.388495000000148,54.93.77.70,10.0.2.15,TCP,60,9001  >  34692 [ACK] Seq=213975019 Ack=11744371 Win=65535 Len=0
1,9.441571000000295,62.210.85.178,10.0.2.15,TLSv1.2,590,Application Data
1,9.441698999999971,10.0.2.15,62.210.85.178,TCP,54,35978  >  9001 [ACK] Seq=214094351 Ack=11684467 Win=65535 Len=0
1,9.523619999999937,62.210.85.178,10.0.2.15,TLSv1.2,1104,Application Data
1,9.5237189999998,10.0.2.15,62.210.85.178,TCP,54,35978  >  9001 [ACK] Seq=214094351 Ack=11685517 Win=65535 Len=0
1,9.551865000000362,62.210.85.178,10.0.2.15,TLSv1.2,1104,Application Data
1,9.551951999999801,10.0.2.15,62.210.85.178,TCP,54,35978  >  9001 [ACK] Seq=214094351 Ack=11686567 Win=65535 Len=0
1,9.552309000000605,10.0.2.15,62.210.85.178,TLSv1.2,590,Application Data
1,9.55243100000007,62.210.85.178,10.0.2.15,TCP,60,9001  >  35978 [ACK] Seq=11686567 Ack=214094887 Win=65535 Len=0
1,9.769021000000066,54.93.77.70,10.0.2.15,TLSv1.2,590,Application Data
1,9.76946500000031,10.0.2.15,54.93.77.70,TLSv1.2,590,Application Data
1,9.769568000000618,54.93.77.70,10.0.2.15,TCP,60,9001  >  34692 [ACK] Seq=213975555 Ack=11744907 Win=65535 Len=0
1,9.973778000000493,62.210.85.178,10.0.2.15,TLSv1.2,590,Application Data
1,9.979463000000578,10.0.2.15,62.210.85.178,TLSv1.2,590,Application Data
1,9.979616999999962,62.210.85.178,10.0.2.15,TCP,60,9001  >  35978 [ACK] Seq=11687103 Ack=214095423 Win=65535 Len=0
1,9.989814000000479,10.0.2.15,62.210.85.178,TLSv1.2,4124,Application Data
1,9.989912000000004,10.0.2.15,62.210.85.178,TCP,2974,35978  >  9001 [ACK] Seq=214099493 Ack=11687103 Win=65535 Len=2920 [TCP segment of a reassembled PDU]
1,9.989958000000115,62.210.85.178,10.0.2.15,TCP,60,9001  >  35978 [ACK] Seq=11687103 Ack=214096883 Win=65535 Len=0
1,9.989970999999969,62.210.85.178,10.0.2.15,TCP,60,9001  >  35978 [ACK] Seq=11687103 Ack=214098343 Win=65535 Len=0
1,9.989975000000413,62.210.85.178,10.0.2.15,TCP,60,9001  >  35978 [ACK] Seq=11687103 Ack=214099493 Win=65535 Len=0
1,9.98997800000052,62.210.85.178,10.0.2.15,TCP,60,9001  >  35978 [ACK] Seq=11687103 Ack=214100953 Win=65535 Len=0
1,9.989980000000287,62.210.85.178,10.0.2.15,TCP,60,9001  >  35978 [ACK] Seq=11687103 Ack=214102413 Win=65535 Len=0
1,9.990013999999974,10.0.2.15,62.210.85.178,TLSv1.2,1204,Application Data
1,9.99004800000057,62.210.85.178,10.0.2.15,TCP,60,9001  >  35978 [ACK] Seq=11687103 Ack=214103563 Win=65535 Len=0
1,9.990092000000004,10.0.2.15,62.210.85.178,TLSv1.2,4124,Application Data
1,9.990154000000075,62.210.85.178,10.0.2.15,TCP,60,9001  >  35978 [ACK] Seq=11687103 Ack=214105023 Win=65535 Len=0
1,9.9901660000005,62.210.85.178,10.0.2.15,TCP,60,9001  >  35978 [ACK] Seq=11687103 Ack=214106483 Win=65535 Len=0
1,9.990169000000606,62.210.85.178,10.0.2.15,TCP,60,9001  >  35978 [ACK] Seq=11687103 Ack=214107633 Win=65535 Len=0
1,9.990217999999913,10.0.2.15,62.210.85.178,TLSv1.2,4124,Application Data
1,9.990287000000535,62.210.85.178,10.0.2.15,TCP,60,9001  >  35978 [ACK] Seq=11687103 Ack=214109093 Win=65535 Len=0
1,9.990298000000621,62.210.85.178,10.0.2.15,TCP,60,9001  >  35978 [ACK] Seq=11687103 Ack=214110553 Win=65535 Len=0
1,9.990300999999818,62.210.85.178,10.0.2.15,TCP,60,9001  >  35978 [ACK] Seq=11687103 Ack=214111703 Win=65535 Len=0
1,9.990345000000161,10.0.2.15,62.210.85.178,TLSv1.2,332,Application Data
1,9.990381999999954,62.210.85.178,10.0.2.15,TCP,60,9001  >  35978 [ACK] Seq=11687103 Ack=214111981 Win=65535 Len=0
1,9.990436000000045,10.0.2.15,62.210.85.178,TLSv1.2,3868,Application Data
1,9.990472999999838,62.210.85.178,10.0.2.15,TCP,60,9001  >  35978 [ACK] Seq=11687103 Ack=214113441 Win=65535 Len=0
1,9.990480000000389,62.210.85.178,10.0.2.15,TCP,60,9001  >  35978 [ACK] Seq=11687103 Ack=214114901 Win=65535 Len=0
1,9.990483000000495,62.210.85.178,10.0.2.15,TCP,60,9001  >  35978 [ACK] Seq=11687103 Ack=214115795 Win=65535 Len=0
1,9.990520000000288,10.0.2.15,62.210.85.178,TLSv1.2,4124,Application Data
1,9.990555000000313,62.210.85.178,10.0.2.15,TCP,60,9001  >  35978 [ACK] Seq=11687103 Ack=214117255 Win=65535 Len=0
1,9.990561000000525,62.210.85.178,10.0.2.15,TCP,60,9001  >  35978 [ACK] Seq=11687103 Ack=214118715 Win=65535 Len=0
1,9.990564000000631,62.210.85.178,10.0.2.15,TCP,60,9001  >  35978 [ACK] Seq=11687103 Ack=214119865 Win=65535 Len=0
1,9.990598000000318,10.0.2.15,62.210.85.178,TLSv1.2,3030,Application Data
1,9.990632000000005,62.210.85.178,10.0.2.15,TCP,60,9001  >  35978 [ACK] Seq=11687103 Ack=214121325 Win=65535 Len=0
1,9.990639000000556,62.210.85.178,10.0.2.15,TCP,60,9001  >  35978 [ACK] Seq=11687103 Ack=214122785 Win=65535 Len=0
1,9.990642000000662,62.210.85.178,10.0.2.15,TCP,60,9001  >  35978 [ACK] Seq=11687103 Ack=214122841 Win=65535 Len=0
1,10.001444999999876,10.0.2.15,62.210.85.178,TLSv1.2,4124,Application Data
1,10.001546999999846,62.210.85.178,10.0.2.15,TCP,60,9001  >  35978 [ACK] Seq=11687103 Ack=214124301 Win=65535 Len=0
1,10.001561000000038,62.210.85.178,10.0.2.15,TCP,60,9001  >  35978 [ACK] Seq=11687103 Ack=214125761 Win=65535 Len=0
1,10.001565000000483,62.210.85.178,10.0.2.15,TCP,60,9001  >  35978 [ACK] Seq=11687103 Ack=214126911 Win=65535 Len=0
1,10.001608999999917,10.0.2.15,62.210.85.178,TLSv1.2,4124,Application Data
1,10.001667999999881,62.210.85.178,10.0.2.15,TCP,60,9001  >  35978 [ACK] Seq=11687103 Ack=214128371 Win=65535 Len=0
1,10.001675000000432,62.210.85.178,10.0.2.15,TCP,60,9001  >  35978 [ACK] Seq=11687103 Ack=214129831 Win=65535 Len=0
1,10.001678000000538,62.210.85.178,10.0.2.15,TCP,60,9001  >  35978 [ACK] Seq=11687103 Ack=214130981 Win=65535 Len=0
1,10.001713000000564,10.0.2.15,62.210.85.178,TLSv1.2,4124,Application Data
1,10.00174700000025,62.210.85.178,10.0.2.15,TCP,60,9001  >  35978 [ACK] Seq=11687103 Ack=214132441 Win=65535 Len=0
1,10.00175500000023,62.210.85.178,10.0.2.15,TCP,60,9001  >  35978 [ACK] Seq=11687103 Ack=214133901 Win=65535 Len=0
1,10.001759000000675,62.210.85.178,10.0.2.15,TCP,60,9001  >  35978 [ACK] Seq=11687103 Ack=214135051 Win=65535 Len=0
1,10.001796999999897,10.0.2.15,62.210.85.178,TLSv1.2,4124,Application Data
1,10.001831000000493,62.210.85.178,10.0.2.15,TCP,60,9001  >  35978 [ACK] Seq=11687103 Ack=214136511 Win=65535 Len=0
1,10.001838000000134,62.210.85.178,10.0.2.15,TCP,60,9001  >  35978 [ACK] Seq=11687103 Ack=214137971 Win=65535 Len=0
1,10.001842000000579,62.210.85.178,10.0.2.15,TCP,60,9001  >  35978 [ACK] Seq=11687103 Ack=214139121 Win=65535 Len=0
1,10.001876000000266,10.0.2.15,62.210.85.178,TLSv1.2,332,Application Data
1,10.001909000000524,62.210.85.178,10.0.2.15,TCP,60,9001  >  35978 [ACK] Seq=11687103 Ack=214139399 Win=65535 Len=0
1,10.001963000000615,10.0.2.15,62.210.85.178,TLSv1.2,3868,Application Data
1,10.002000000000407,62.210.85.178,10.0.2.15,TCP,60,9001  >  35978 [ACK] Seq=11687103 Ack=214140859 Win=65535 Len=0
1,10.002007000000049,62.210.85.178,10.0.2.15,TCP,60,9001  >  35978 [ACK] Seq=11687103 Ack=214142319 Win=65535 Len=0
1,10.002011000000493,62.210.85.178,10.0.2.15,TCP,60,9001  >  35978 [ACK] Seq=11687103 Ack=214143213 Win=65535 Len=0
1,10.002048000000286,10.0.2.15,62.210.85.178,TLSv1.2,4124,Application Data
1,10.002083000000312,62.210.85.178,10.0.2.15,TCP,60,9001  >  35978 [ACK] Seq=11687103 Ack=214144673 Win=65535 Len=0
1,10.002089999999953,62.210.85.178,10.0.2.15,TCP,60,9001  >  35978 [ACK] Seq=11687103 Ack=214146133 Win=65535 Len=0
1,10.002093000000059,62.210.85.178,10.0.2.15,TCP,60,9001  >  35978 [ACK] Seq=11687103 Ack=214147283 Win=65535 Len=0
1,10.002127000000655,10.0.2.15,62.210.85.178,TLSv1.2,3030,Application Data
1,10.002161000000342,62.210.85.178,10.0.2.15,TCP,60,9001  >  35978 [ACK] Seq=11687103 Ack=214148743 Win=65535 Len=0
1,10.002167999999983,62.210.85.178,10.0.2.15,TCP,60,9001  >  35978 [ACK] Seq=11687103 Ack=214150203 Win=65535 Len=0
1,10.00217100000009,62.210.85.178,10.0.2.15,TCP,60,9001  >  35978 [ACK] Seq=11687103 Ack=214150259 Win=65535 Len=0
1,10.01371300000028,10.0.2.15,62.210.85.178,TLSv1.2,4124,Application Data
1,10.013819000000694,62.210.85.178,10.0.2.15,TCP,60,9001  >  35978 [ACK] Seq=11687103 Ack=214151719 Win=65535 Len=0
1,10.013834000000315,62.210.85.178,10.0.2.15,TCP,60,9001  >  35978 [ACK] Seq=11687103 Ack=214153179 Win=65535 Len=0
1,10.01383799999985,62.210.85.178,10.0.2.15,TCP,60,9001  >  35978 [ACK] Seq=11687103 Ack=214154329 Win=65535 Len=0
1,10.013882000000194,10.0.2.15,62.210.85.178,TLSv1.2,4124,Application Data
1,10.013918000000558,62.210.85.178,10.0.2.15,TCP,60,9001  >  35978 [ACK] Seq=11687103 Ack=214155789 Win=65535 Len=0
1,10.013926999999967,62.210.85.178,10.0.2.15,TCP,60,9001  >  35978 [ACK] Seq=11687103 Ack=214157249 Win=65535 Len=0
1,10.013930000000073,62.210.85.178,10.0.2.15,TCP,60,9001  >  35978 [ACK] Seq=11687103 Ack=214158399 Win=65535 Len=0
1,10.013974999999846,10.0.2.15,62.210.85.178,TLSv1.2,3802,Application Data
1,10.014012000000548,62.210.85.178,10.0.2.15,TCP,60,9001  >  35978 [ACK] Seq=11687103 Ack=214159859 Win=65535 Len=0
1,10.01401900000019,62.210.85.178,10.0.2.15,TCP,60,9001  >  35978 [ACK] Seq=11687103 Ack=214161319 Win=65535 Len=0
1,10.014022000000296,62.210.85.178,10.0.2.15,TCP,60,9001  >  35978 [ACK] Seq=11687103 Ack=214162147 Win=65535 Len=0
1,10.281149999999798,54.93.77.70,10.0.2.15,TLSv1.2,590,Application Data
1,10.284107000000404,54.93.77.70,10.0.2.15,TCP,2950,"9001  >  34692 [PSH, ACK] Seq=213976091 Ack=11744907 Win=65535 Len=2896 [TCP segment of a reassembled PDU]"
1,10.284179000000222,10.0.2.15,54.93.77.70,TCP,54,34692  >  9001 [ACK] Seq=11744907 Ack=213978987 Win=65535 Len=0
1,10.286436000000322,54.93.77.70,10.0.2.15,TLSv1.2,1502,Application Data [TCP segment of a reassembled PDU]
1,10.286477999999988,10.0.2.15,54.93.77.70,TCP,54,34692  >  9001 [ACK] Seq=11744907 Ack=213980435 Win=65535 Len=0
1,10.287156000000323,54.93.77.70,10.0.2.15,TCP,2950,"9001  >  34692 [PSH, ACK] Seq=213980435 Ack=11744907 Win=65535 Len=2896 [TCP segment of a reassembled PDU]"
1,10.287172000000282,54.93.77.70,10.0.2.15,TLSv1.2,5846,"Application Data, Application Data, Application Data"
1,10.287229999999909,10.0.2.15,54.93.77.70,TCP,54,34692  >  9001 [ACK] Seq=11744907 Ack=213989123 Win=65535 Len=0
1,10.30235300000004,54.93.77.70,10.0.2.15,TCP,2950,"9001  >  34692 [PSH, ACK] Seq=213989123 Ack=11744907 Win=65535 Len=2896 [TCP segment of a reassembled PDU]"
1,10.30236800000057,54.93.77.70,10.0.2.15,TLSv1.2,4398,"Application Data, Application Data"
1,10.302402000000257,10.0.2.15,54.93.77.70,TCP,54,34692  >  9001 [ACK] Seq=11744907 Ack=213992019 Win=65535 Len=0
1,10.302469000000201,10.0.2.15,54.93.77.70,TCP,54,34692  >  9001 [ACK] Seq=11744907 Ack=213996363 Win=65535 Len=0
1,10.304127000000335,54.93.77.70,10.0.2.15,TLSv1.2,7244,"Application Data, Application Data, Application Data, Application Data"
1,10.30417000000034,10.0.2.15,54.93.77.70,TCP,54,34692  >  9001 [ACK] Seq=11744907 Ack=214003553 Win=65535 Len=0
1,10.304401000000325,10.0.2.15,54.93.77.70,TLSv1.2,1104,Application Data
1,10.304471000000376,54.93.77.70,10.0.2.15,TCP,60,9001  >  34692 [ACK] Seq=214003553 Ack=11745957 Win=65535 Len=0
1,10.306397000000288,54.93.77.70,10.0.2.15,TLSv1.2,5846,Application Data
1,10.306449000000612,10.0.2.15,54.93.77.70,TCP,54,34692  >  9001 [ACK] Seq=11745957 Ack=214009345 Win=65535 Len=0
1,10.320051000000603,54.93.77.70,10.0.2.15,TLSv1.2,2950,Application Data [TCP segment of a reassembled PDU]
1,10.32008500000029,54.93.77.70,10.0.2.15,TLSv1.2,4398,Application Data [TCP segment of a reassembled PDU]
1,10.32012399999985,10.0.2.15,54.93.77.70,TCP,54,34692  >  9001 [ACK] Seq=11745957 Ack=214012241 Win=65535 Len=0
1,10.320201000000452,10.0.2.15,54.93.77.70,TCP,54,34692  >  9001 [ACK] Seq=11745957 Ack=214016585 Win=65535 Len=0
1,10.321547999999893,54.93.77.70,10.0.2.15,TLSv1.2,7294,"Application Data, Application Data"
1,10.321590999999898,10.0.2.15,54.93.77.70,TCP,54,34692  >  9001 [ACK] Seq=11745957 Ack=214023825 Win=65535 Len=0
1,10.32231899999988,54.93.77.70,10.0.2.15,TLSv1.2,2950,Application Data [TCP segment of a reassembled PDU]
1,10.322359000000688,10.0.2.15,54.93.77.70,TCP,54,34692  >  9001 [ACK] Seq=11745957 Ack=214026721 Win=65535 Len=0
1,10.323186999999962,54.93.77.70,10.0.2.15,TLSv1.2,2784,"Application Data, Application Data, Application Data"
1,10.3232280000002,10.0.2.15,54.93.77.70,TCP,54,34692  >  9001 [ACK] Seq=11745957 Ack=214029451 Win=65535 Len=0
1,10.323379000000386,10.0.2.15,54.93.77.70,TLSv1.2,590,Application Data
1,10.323444999999992,54.93.77.70,10.0.2.15,TCP,60,9001  >  34692 [ACK] Seq=214029451 Ack=11746493 Win=65535 Len=0
1,10.339156000000003,54.93.77.70,10.0.2.15,TLSv1.2,7294,Application Data
1,10.339227000000392,10.0.2.15,54.93.77.70,TCP,54,34692  >  9001 [ACK] Seq=11746493 Ack=214036691 Win=65535 Len=0
1,10.33967500000017,54.93.77.70,10.0.2.15,TLSv1.2,1104,"Application Data, Application Data"
1,10.381009000000631,10.0.2.15,54.93.77.70,TCP,54,34692  >  9001 [ACK] Seq=11746493 Ack=214037741 Win=65535 Len=0
1,10.382903000000624,54.93.77.70,10.0.2.15,TCP,1502,"9001  >  34692 [PSH, ACK] Seq=214037741 Ack=11746493 Win=65535 Len=1448 [TCP segment of a reassembled PDU]"
1,10.382996000000276,10.0.2.15,54.93.77.70,TCP,54,34692  >  9001 [ACK] Seq=11746493 Ack=214039189 Win=65535 Len=0
1,10.39776400000028,54.93.77.70,10.0.2.15,TLSv1.2,684,Application Data
1,10.397824000000583,10.0.2.15,54.93.77.70,TCP,54,34692  >  9001 [ACK] Seq=11746493 Ack=214039819 Win=65535 Len=0
1,10.494892000000618,54.93.77.70,10.0.2.15,TLSv1.2,1618,Application Data
1,10.49502399999983,10.0.2.15,54.93.77.70,TCP,54,34692  >  9001 [ACK] Seq=11746493 Ack=214041383 Win=65535 Len=0
1,10.549070000000029,54.93.77.70,10.0.2.15,TLSv1.2,1104,Application Data
1,10.549168999999893,10.0.2.15,54.93.77.70,TCP,54,34692  >  9001 [ACK] Seq=11746493 Ack=214042433 Win=65535 Len=0
1,10.553272000000106,10.0.2.15,54.93.77.70,TLSv1.2,590,Application Data
1,10.553437999999915,54.93.77.70,10.0.2.15,TCP,60,9001  >  34692 [ACK] Seq=214042433 Ack=11747029 Win=65535 Len=0
