No.,Time,Source,Destination,Protocol,Length,Info
1,0.15598899999986315,10.0.2.15,54.93.77.70,TLSv1.2,590,Application Data
1,0.15614800000003015,54.93.77.70,10.0.2.15,TCP,60,9001  >  34692 [ACK] Seq=228428461 Ack=12543697 Win=65535 Len=0
1,0.1732640000000174,62.210.85.178,10.0.2.15,TLSv1.2,590,Application Data
1,0.21628400000008696,10.0.2.15,62.210.85.178,TCP,54,35978  >  9001 [ACK] Seq=228540467 Ack=12480649 Win=65535 Len=0
1,0.7070399999993242,62.210.85.178,10.0.2.15,TLSv1.2,590,Application Data
1,0.7071289999994406,10.0.2.15,62.210.85.178,TCP,54,35978  >  9001 [ACK] Seq=228540467 Ack=12481185 Win=65535 Len=0
1,0.7075949999998556,10.0.2.15,62.210.85.178,TLSv1.2,590,Application Data
1,0.7076979999992545,62.210.85.178,10.0.2.15,TCP,60,9001  >  35978 [ACK] Seq=12481185 Ack=228541003 Win=65535 Len=0
1,0.9116649999996298,54.93.77.70,10.0.2.15,TLSv1.2,590,Application Data
1,0.9117429999996602,10.0.2.15,54.93.77.70,TCP,54,34692  >  9001 [ACK] Seq=12543697 Ack=228428997 Win=65535 Len=0
1,0.9121369999993476,10.0.2.15,54.93.77.70,TLSv1.2,1618,Application Data
1,0.9122600000000602,54.93.77.70,10.0.2.15,TCP,60,9001  >  34692 [ACK] Seq=228428997 Ack=12545157 Win=65535 Len=0
1,0.9122729999999137,54.93.77.70,10.0.2.15,TCP,60,9001  >  34692 [ACK] Seq=228428997 Ack=12545261 Win=65535 Len=0
1,1.321907999999894,62.210.85.178,10.0.2.15,TLSv1.2,1618,Application Data
1,1.3220289999999295,10.0.2.15,62.210.85.178,TCP,54,35978  >  9001 [ACK] Seq=228541003 Ack=12482749 Win=65535 Len=0
1,1.3355249999995067,10.0.2.15,62.210.85.178,TLSv1.2,590,Application Data
1,1.3357310000001235,62.210.85.178,10.0.2.15,TCP,60,9001  >  35978 [ACK] Seq=12482749 Ack=228541539 Win=65535 Len=0
1,1.3486889999994673,10.0.2.15,62.210.85.178,TLSv1.2,1618,Application Data
1,1.3488469999992958,62.210.85.178,10.0.2.15,TCP,60,9001  >  35978 [ACK] Seq=12482749 Ack=228542999 Win=65535 Len=0
1,1.3488680000000386,62.210.85.178,10.0.2.15,TCP,60,9001  >  35978 [ACK] Seq=12482749 Ack=228543103 Win=65535 Len=0
1,1.6281859999999142,54.93.77.70,10.0.2.15,TLSv1.2,2132,Application Data
1,1.6283219999995708,10.0.2.15,54.93.77.70,TCP,54,34692  >  9001 [ACK] Seq=12545261 Ack=228431075 Win=65535 Len=0
1,1.6303889999999228,10.0.2.15,54.93.77.70,TLSv1.2,590,Application Data
1,1.6305429999993066,54.93.77.70,10.0.2.15,TCP,60,9001  >  34692 [ACK] Seq=228431075 Ack=12545797 Win=65535 Len=0
1,1.7307529999998224,62.210.85.178,10.0.2.15,TLSv1.2,590,Application Data
1,1.731050999999752,10.0.2.15,62.210.85.178,TLSv1.2,590,Application Data
1,1.731156999999257,62.210.85.178,10.0.2.15,TCP,60,9001  >  35978 [ACK] Seq=12483285 Ack=228543639 Win=65535 Len=0
1,1.8404160000000047,54.93.77.70,10.0.2.15,TLSv1.2,590,Application Data
1,1.8409029999993436,10.0.2.15,54.93.77.70,TLSv1.2,590,Application Data
1,1.8410069999999905,54.93.77.70,10.0.2.15,TCP,60,9001  >  34692 [ACK] Seq=228431611 Ack=12546333 Win=65535 Len=0
1,2.0369739999996455,62.210.85.178,10.0.2.15,TLSv1.2,590,Application Data
1,2.0371909999994386,10.0.2.15,62.210.85.178,TLSv1.2,590,Application Data
1,2.0372859999997672,62.210.85.178,10.0.2.15,TCP,60,9001  >  35978 [ACK] Seq=12483821 Ack=228544175 Win=65535 Len=0
1,2.0484299999998257,10.0.2.15,62.210.85.178,TLSv1.2,4124,Application Data
1,2.0485949999992954,62.210.85.178,10.0.2.15,TCP,60,9001  >  35978 [ACK] Seq=12483821 Ack=228545635 Win=65535 Len=0
1,2.048620999999912,62.210.85.178,10.0.2.15,TCP,60,9001  >  35978 [ACK] Seq=12483821 Ack=228547095 Win=65535 Len=0
1,2.048624000000018,62.210.85.178,10.0.2.15,TCP,60,9001  >  35978 [ACK] Seq=12483821 Ack=228548245 Win=65535 Len=0
1,2.0486940000000686,10.0.2.15,62.210.85.178,TLSv1.2,4124,Application Data
1,2.048791999999594,62.210.85.178,10.0.2.15,TCP,60,9001  >  35978 [ACK] Seq=12483821 Ack=228549705 Win=65535 Len=0
1,2.0488029999996797,62.210.85.178,10.0.2.15,TCP,60,9001  >  35978 [ACK] Seq=12483821 Ack=228551165 Win=65535 Len=0
1,2.0488079999995534,62.210.85.178,10.0.2.15,TCP,60,9001  >  35978 [ACK] Seq=12483821 Ack=228552315 Win=65535 Len=0
1,2.048863999999412,10.0.2.15,62.210.85.178,TLSv1.2,4124,Application Data
1,2.0489299999999275,62.210.85.178,10.0.2.15,TCP,60,9001  >  35978 [ACK] Seq=12483821 Ack=228553775 Win=65535 Len=0
1,2.0489410000000134,62.210.85.178,10.0.2.15,TCP,60,9001  >  35978 [ACK] Seq=12483821 Ack=228555235 Win=65535 Len=0
1,2.0489440000001196,62.210.85.178,10.0.2.15,TCP,60,9001  >  35978 [ACK] Seq=12483821 Ack=228556385 Win=65535 Len=0
1,2.0489899999993213,10.0.2.15,62.210.85.178,TLSv1.2,4124,Application Data
1,2.049091999999291,62.210.85.178,10.0.2.15,TCP,60,9001  >  35978 [ACK] Seq=12483821 Ack=228557845 Win=65535 Len=0
1,2.049101999999948,62.210.85.178,10.0.2.15,TCP,60,9001  >  35978 [ACK] Seq=12483821 Ack=228559305 Win=65535 Len=0
1,2.049105000000054,62.210.85.178,10.0.2.15,TCP,60,9001  >  35978 [ACK] Seq=12483821 Ack=228560455 Win=65535 Len=0
1,2.0491519999995944,10.0.2.15,62.210.85.178,TLSv1.2,332,Application Data
1,2.049192999999832,62.210.85.178,10.0.2.15,TCP,60,9001  >  35978 [ACK] Seq=12483821 Ack=228560733 Win=65535 Len=0
1,2.0492779999995037,10.0.2.15,62.210.85.178,TLSv1.2,3868,Application Data
1,2.049344000000019,62.210.85.178,10.0.2.15,TCP,60,9001  >  35978 [ACK] Seq=12483821 Ack=228562193 Win=65535 Len=0
1,2.0493539999997665,62.210.85.178,10.0.2.15,TCP,60,9001  >  35978 [ACK] Seq=12483821 Ack=228563653 Win=65535 Len=0
1,2.0493569999998726,62.210.85.178,10.0.2.15,TCP,60,9001  >  35978 [ACK] Seq=12483821 Ack=228564547 Win=65535 Len=0
1,2.049403999999413,10.0.2.15,62.210.85.178,TLSv1.2,4124,Application Data
1,2.04946899999959,62.210.85.178,10.0.2.15,TCP,60,9001  >  35978 [ACK] Seq=12483821 Ack=228566007 Win=65535 Len=0
1,2.0494789999993372,62.210.85.178,10.0.2.15,TCP,60,9001  >  35978 [ACK] Seq=12483821 Ack=228567467 Win=65535 Len=0
1,2.0494819999994434,62.210.85.178,10.0.2.15,TCP,60,9001  >  35978 [ACK] Seq=12483821 Ack=228568617 Win=65535 Len=0
1,2.0495270000001256,10.0.2.15,62.210.85.178,TLSv1.2,3030,Application Data
1,2.049591999999393,62.210.85.178,10.0.2.15,TCP,60,9001  >  35978 [ACK] Seq=12483821 Ack=228570077 Win=65535 Len=0
1,2.04960200000005,62.210.85.178,10.0.2.15,TCP,60,9001  >  35978 [ACK] Seq=12483821 Ack=228571537 Win=65535 Len=0
1,2.049605000000156,62.210.85.178,10.0.2.15,TCP,60,9001  >  35978 [ACK] Seq=12483821 Ack=228571593 Win=65535 Len=0
1,2.0625629999995,10.0.2.15,62.210.85.178,TLSv1.2,4124,Application Data
1,2.062676999999894,62.210.85.178,10.0.2.15,TCP,60,9001  >  35978 [ACK] Seq=12483821 Ack=228573053 Win=65535 Len=0
1,2.062693999999283,62.210.85.178,10.0.2.15,TCP,60,9001  >  35978 [ACK] Seq=12483821 Ack=228574513 Win=65535 Len=0
1,2.0626979999997275,62.210.85.178,10.0.2.15,TCP,60,9001  >  35978 [ACK] Seq=12483821 Ack=228575663 Win=65535 Len=0
1,2.0627439999998387,10.0.2.15,62.210.85.178,TLSv1.2,4124,Application Data
1,2.062821999999869,62.210.85.178,10.0.2.15,TCP,60,9001  >  35978 [ACK] Seq=12483821 Ack=228577123 Win=65535 Len=0
1,2.062829999999849,62.210.85.178,10.0.2.15,TCP,60,9001  >  35978 [ACK] Seq=12483821 Ack=228578583 Win=65535 Len=0
1,2.062832999999955,62.210.85.178,10.0.2.15,TCP,60,9001  >  35978 [ACK] Seq=12483821 Ack=228579733 Win=65535 Len=0
1,2.0628710000000865,10.0.2.15,62.210.85.178,TLSv1.2,4124,Application Data
1,2.0629079999998794,62.210.85.178,10.0.2.15,TCP,60,9001  >  35978 [ACK] Seq=12483821 Ack=228581193 Win=65535 Len=0
1,2.0629169999992882,62.210.85.178,10.0.2.15,TCP,60,9001  >  35978 [ACK] Seq=12483821 Ack=228582653 Win=65535 Len=0
1,2.0629220000000714,62.210.85.178,10.0.2.15,TCP,60,9001  >  35978 [ACK] Seq=12483821 Ack=228583803 Win=65535 Len=0
1,2.0629589999998643,10.0.2.15,62.210.85.178,TLSv1.2,4124,Application Data
1,2.062997999999425,62.210.85.178,10.0.2.15,TCP,60,9001  >  35978 [ACK] Seq=12483821 Ack=228585263 Win=65535 Len=0
1,2.0630059999994046,62.210.85.178,10.0.2.15,TCP,60,9001  >  35978 [ACK] Seq=12483821 Ack=228586723 Win=65535 Len=0
1,2.0630109999992783,62.210.85.178,10.0.2.15,TCP,60,9001  >  35978 [ACK] Seq=12483821 Ack=228587873 Win=65535 Len=0
1,2.063046999999642,10.0.2.15,62.210.85.178,TLSv1.2,332,Application Data
1,2.063090999999986,62.210.85.178,10.0.2.15,TCP,60,9001  >  35978 [ACK] Seq=12483821 Ack=228588151 Win=65535 Len=0
1,2.063145999999506,10.0.2.15,62.210.85.178,TLSv1.2,3868,Application Data
1,2.0631869999997434,62.210.85.178,10.0.2.15,TCP,60,9001  >  35978 [ACK] Seq=12483821 Ack=228589611 Win=65535 Len=0
1,2.0631960000000618,62.210.85.178,10.0.2.15,TCP,60,9001  >  35978 [ACK] Seq=12483821 Ack=228591071 Win=65535 Len=0
1,2.063199999999597,62.210.85.178,10.0.2.15,TCP,60,9001  >  35978 [ACK] Seq=12483821 Ack=228591965 Win=65535 Len=0
1,2.063239000000067,10.0.2.15,62.210.85.178,TLSv1.2,4124,Application Data
1,2.063276999999289,62.210.85.178,10.0.2.15,TCP,60,9001  >  35978 [ACK] Seq=12483821 Ack=228593425 Win=65535 Len=0
1,2.0632839999998396,62.210.85.178,10.0.2.15,TCP,60,9001  >  35978 [ACK] Seq=12483821 Ack=228594885 Win=65535 Len=0
1,2.0632879999993747,62.210.85.178,10.0.2.15,TCP,60,9001  >  35978 [ACK] Seq=12483821 Ack=228596035 Win=65535 Len=0
1,2.0633239999997386,10.0.2.15,62.210.85.178,TLSv1.2,3030,Application Data
1,2.063362999999299,62.210.85.178,10.0.2.15,TCP,60,9001  >  35978 [ACK] Seq=12483821 Ack=228597495 Win=65535 Len=0
1,2.06336999999985,62.210.85.178,10.0.2.15,TCP,60,9001  >  35978 [ACK] Seq=12483821 Ack=228598955 Win=65535 Len=0
1,2.063372999999956,62.210.85.178,10.0.2.15,TCP,60,9001  >  35978 [ACK] Seq=12483821 Ack=228599011 Win=65535 Len=0
1,2.072635999999875,10.0.2.15,62.210.85.178,TLSv1.2,4124,Application Data
1,2.07274199999938,62.210.85.178,10.0.2.15,TCP,60,9001  >  35978 [ACK] Seq=12483821 Ack=228600471 Win=65535 Len=0
1,2.072755000000143,62.210.85.178,10.0.2.15,TCP,60,9001  >  35978 [ACK] Seq=12483821 Ack=228601931 Win=65535 Len=0
1,2.0727579999993395,62.210.85.178,10.0.2.15,TCP,60,9001  >  35978 [ACK] Seq=12483821 Ack=228603081 Win=65535 Len=0
1,2.0728049999997893,10.0.2.15,62.210.85.178,TLSv1.2,4124,Application Data
1,2.0728540000000066,62.210.85.178,10.0.2.15,TCP,60,9001  >  35978 [ACK] Seq=12483821 Ack=228604541 Win=65535 Len=0
1,2.0728629999994155,62.210.85.178,10.0.2.15,TCP,60,9001  >  35978 [ACK] Seq=12483821 Ack=228606001 Win=65535 Len=0
1,2.072867999999289,62.210.85.178,10.0.2.15,TCP,60,9001  >  35978 [ACK] Seq=12483821 Ack=228607151 Win=65535 Len=0
1,2.0729049999999916,10.0.2.15,62.210.85.178,TLSv1.2,4124,Application Data
1,2.072943999999552,62.210.85.178,10.0.2.15,TCP,60,9001  >  35978 [ACK] Seq=12483821 Ack=228608611 Win=65535 Len=0
1,2.072951999999532,62.210.85.178,10.0.2.15,TCP,60,9001  >  35978 [ACK] Seq=12483821 Ack=228610071 Win=65535 Len=0
1,2.072957999999744,62.210.85.178,10.0.2.15,TCP,60,9001  >  35978 [ACK] Seq=12483821 Ack=228611221 Win=65535 Len=0
1,2.0729969999993045,10.0.2.15,62.210.85.178,TLSv1.2,2324,Application Data
1,2.0730649999995876,62.210.85.178,10.0.2.15,TCP,60,9001  >  35978 [ACK] Seq=12483821 Ack=228612681 Win=65535 Len=0
1,2.0730729999995674,62.210.85.178,10.0.2.15,TCP,60,9001  >  35978 [ACK] Seq=12483821 Ack=228613491 Win=65535 Len=0
1,2.3448209999996834,54.93.77.70,10.0.2.15,TCP,2950,"9001  >  34692 [PSH, ACK] Seq=228431611 Ack=12546333 Win=65535 Len=2896 [TCP segment of a reassembled PDU]"
1,2.34496499999932,10.0.2.15,54.93.77.70,TCP,54,34692  >  9001 [ACK] Seq=12546333 Ack=228434507 Win=65535 Len=0
1,2.3472729999994044,54.93.77.70,10.0.2.15,TLSv1.2,778,Application Data
1,2.3483339999993404,54.93.77.70,10.0.2.15,TLSv1.2,7294,"Application Data, Application Data"
1,2.3484129999997094,10.0.2.15,54.93.77.70,TCP,54,34692  >  9001 [ACK] Seq=12546333 Ack=228442471 Win=65535 Len=0
1,2.3522519999996803,54.93.77.70,10.0.2.15,TLSv1.2,2950,Application Data
1,2.352296999999453,10.0.2.15,54.93.77.70,TCP,54,34692  >  9001 [ACK] Seq=12546333 Ack=228445367 Win=65535 Len=0
1,2.363510000000133,54.93.77.70,10.0.2.15,TLSv1.2,2950,Application Data [TCP segment of a reassembled PDU]
1,2.363550999999461,10.0.2.15,54.93.77.70,TCP,54,34692  >  9001 [ACK] Seq=12546333 Ack=228448263 Win=65535 Len=0
1,2.3644699999995282,54.93.77.70,10.0.2.15,TCP,2950,"9001  >  34692 [PSH, ACK] Seq=228448263 Ack=12546333 Win=65535 Len=2896 [TCP segment of a reassembled PDU]"
1,2.364508999999998,10.0.2.15,54.93.77.70,TCP,54,34692  >  9001 [ACK] Seq=12546333 Ack=228451159 Win=65535 Len=0
1,2.366487999999663,54.93.77.70,10.0.2.15,TLSv1.2,7410,"Application Data, Application Data, Application Data"
1,2.3665499999997337,10.0.2.15,54.93.77.70,TCP,54,34692  >  9001 [ACK] Seq=12546333 Ack=228458515 Win=65535 Len=0
1,2.3667719999994006,10.0.2.15,54.93.77.70,TLSv1.2,590,Application Data
1,2.366860999999517,54.93.77.70,10.0.2.15,TCP,60,9001  >  34692 [ACK] Seq=228458515 Ack=12546869 Win=65535 Len=0
1,2.377578999999969,54.93.77.70,10.0.2.15,TCP,2950,"9001  >  34692 [PSH, ACK] Seq=228458515 Ack=12546869 Win=65535 Len=2896 [TCP segment of a reassembled PDU]"
1,2.377639999999701,10.0.2.15,54.93.77.70,TCP,54,34692  >  9001 [ACK] Seq=12546869 Ack=228461411 Win=65535 Len=0
1,2.383234999999331,54.93.77.70,10.0.2.15,TLSv1.2,1314,"Application Data, Application Data"
1,2.3875749999997424,54.93.77.70,10.0.2.15,TCP,2950,"9001  >  34692 [PSH, ACK] Seq=228462671 Ack=12546869 Win=65535 Len=2896 [TCP segment of a reassembled PDU]"
1,2.3876179999997476,10.0.2.15,54.93.77.70,TCP,54,34692  >  9001 [ACK] Seq=12546869 Ack=228465567 Win=65535 Len=0
1,2.3893809999999576,54.93.77.70,10.0.2.15,TLSv1.2,5846,"Application Data, Application Data"
1,2.3894380000001547,10.0.2.15,54.93.77.70,TCP,54,34692  >  9001 [ACK] Seq=12546869 Ack=228471359 Win=65535 Len=0
1,2.3895709999997052,10.0.2.15,54.93.77.70,TLSv1.2,590,Application Data
1,2.3896389999999883,54.93.77.70,10.0.2.15,TCP,60,9001  >  34692 [ACK] Seq=228471359 Ack=12547405 Win=65535 Len=0
1,2.398779999999533,54.93.77.70,10.0.2.15,TLSv1.2,2950,Application Data [TCP segment of a reassembled PDU]
1,2.3988039999994726,54.93.77.70,10.0.2.15,TLSv1.2,4398,Application Data [TCP segment of a reassembled PDU]
1,2.39884499999971,10.0.2.15,54.93.77.70,TCP,54,34692  >  9001 [ACK] Seq=12547405 Ack=228474255 Win=65535 Len=0
1,2.398928999999953,10.0.2.15,54.93.77.70,TCP,54,34692  >  9001 [ACK] Seq=12547405 Ack=228478599 Win=65535 Len=0
1,2.399521999999706,54.93.77.70,10.0.2.15,TLSv1.2,1220,"Application Data, Application Data"
1,2.4113330000000133,54.93.77.70,10.0.2.15,TCP,2950,"9001  >  34692 [PSH, ACK] Seq=228479765 Ack=12547405 Win=65535 Len=2896 [TCP segment of a reassembled PDU]"
1,2.41137499999968,10.0.2.15,54.93.77.70,TCP,54,34692  >  9001 [ACK] Seq=12547405 Ack=228482661 Win=65535 Len=0
1,2.4203600000000733,54.93.77.70,10.0.2.15,TLSv1.2,7294,"Application Data, Application Data"
1,2.420422999999573,10.0.2.15,54.93.77.70,TCP,54,34692  >  9001 [ACK] Seq=12547405 Ack=228489901 Win=65535 Len=0
1,2.420629999999619,10.0.2.15,54.93.77.70,TLSv1.2,590,Application Data
1,2.4207040000001143,54.93.77.70,10.0.2.15,TCP,60,9001  >  34692 [ACK] Seq=228489901 Ack=12547941 Win=65535 Len=0
1,2.427600999999413,54.93.77.70,10.0.2.15,TLSv1.2,1292,Application Data
1,2.430827999999565,54.93.77.70,10.0.2.15,TCP,2950,"9001  >  34692 [PSH, ACK] Seq=228491139 Ack=12547941 Win=65535 Len=2896 [TCP segment of a reassembled PDU]"
1,2.430844999999863,54.93.77.70,10.0.2.15,TLSv1.2,1502,Application Data [TCP segment of a reassembled PDU]
1,2.430890999999974,10.0.2.15,54.93.77.70,TCP,54,34692  >  9001 [ACK] Seq=12547941 Ack=228494035 Win=65535 Len=0
1,2.4309779999994134,10.0.2.15,54.93.77.70,TCP,54,34692  >  9001 [ACK] Seq=12547941 Ack=228495483 Win=65535 Len=0
1,2.432590999999775,54.93.77.70,10.0.2.15,TLSv1.2,4398,Application Data [TCP segment of a reassembled PDU]
1,2.4326359999995475,10.0.2.15,54.93.77.70,TCP,54,34692  >  9001 [ACK] Seq=12547941 Ack=228499827 Win=65535 Len=0
1,2.444439999999304,54.93.77.70,10.0.2.15,TLSv1.2,1502,Application Data [TCP segment of a reassembled PDU]
1,2.444510999999693,10.0.2.15,54.93.77.70,TCP,54,34692  >  9001 [ACK] Seq=12547941 Ack=228501275 Win=65535 Len=0
1,2.4479999999994106,54.93.77.70,10.0.2.15,TLSv1.2,286,Application Data
1,2.4508689999993294,10.0.2.15,54.93.77.70,TLSv1.2,590,Application Data
1,2.451043000000027,54.93.77.70,10.0.2.15,TCP,60,9001  >  34692 [ACK] Seq=228501507 Ack=12548477 Win=65535 Len=0
1,2.5077659999997195,62.210.85.178,10.0.2.15,TLSv1.2,1104,Application Data
1,2.5483180000001084,10.0.2.15,62.210.85.178,TCP,54,35978  >  9001 [ACK] Seq=228613491 Ack=12484871 Win=65535 Len=0
1,2.753979000000072,62.210.85.178,10.0.2.15,TLSv1.2,1104,Application Data
1,2.7540689999996175,10.0.2.15,62.210.85.178,TCP,54,35978  >  9001 [ACK] Seq=228613491 Ack=12485921 Win=65535 Len=0
1,2.7545329999993555,10.0.2.15,62.210.85.178,TLSv1.2,590,Application Data
1,2.754632999999558,62.210.85.178,10.0.2.15,TCP,60,9001  >  35978 [ACK] Seq=12485921 Ack=228614027 Win=65535 Len=0
1,3.4709699999993973,54.93.77.70,10.0.2.15,TLSv1.2,590,Application Data
1,3.471329999999398,10.0.2.15,54.93.77.70,TLSv1.2,590,Application Data
1,3.471437000000151,54.93.77.70,10.0.2.15,TCP,60,9001  >  34692 [ACK] Seq=228502043 Ack=12549013 Win=65535 Len=0
1,3.5773490000001402,62.210.85.178,10.0.2.15,TLSv1.2,590,Application Data
1,3.5812129999994795,10.0.2.15,62.210.85.178,TLSv1.2,590,Application Data
1,3.5813849999995,62.210.85.178,10.0.2.15,TCP,60,9001  >  35978 [ACK] Seq=12486457 Ack=228614563 Win=65535 Len=0
1,3.592646999999488,10.0.2.15,62.210.85.178,TLSv1.2,4124,Application Data
1,3.592751000000135,10.0.2.15,62.210.85.178,TCP,2974,35978  >  9001 [ACK] Seq=228618633 Ack=12486457 Win=65535 Len=2920 [TCP segment of a reassembled PDU]
1,3.592797999999675,62.210.85.178,10.0.2.15,TCP,60,9001  >  35978 [ACK] Seq=12486457 Ack=228616023 Win=65535 Len=0
1,3.592808999999761,62.210.85.178,10.0.2.15,TCP,60,9001  >  35978 [ACK] Seq=12486457 Ack=228617483 Win=65535 Len=0
1,3.5928139999996347,62.210.85.178,10.0.2.15,TCP,60,9001  >  35978 [ACK] Seq=12486457 Ack=228618633 Win=65535 Len=0
1,3.592819999999847,62.210.85.178,10.0.2.15,TCP,60,9001  >  35978 [ACK] Seq=12486457 Ack=228620093 Win=65535 Len=0
1,3.592830999999933,62.210.85.178,10.0.2.15,TCP,60,9001  >  35978 [ACK] Seq=12486457 Ack=228621553 Win=65535 Len=0
1,3.5928699999994933,10.0.2.15,62.210.85.178,TLSv1.2,1204,Application Data
1,3.592910999999731,62.210.85.178,10.0.2.15,TCP,60,9001  >  35978 [ACK] Seq=12486457 Ack=228622703 Win=65535 Len=0
1,3.592956999999842,10.0.2.15,62.210.85.178,TLSv1.2,4124,Application Data
1,3.5929959999994026,62.210.85.178,10.0.2.15,TCP,60,9001  >  35978 [ACK] Seq=12486457 Ack=228624163 Win=65535 Len=0
1,3.593004999999721,62.210.85.178,10.0.2.15,TCP,60,9001  >  35978 [ACK] Seq=12486457 Ack=228625623 Win=65535 Len=0
1,3.593008999999256,62.210.85.178,10.0.2.15,TCP,60,9001  >  35978 [ACK] Seq=12486457 Ack=228626773 Win=65535 Len=0
1,3.593047999999726,10.0.2.15,62.210.85.178,TLSv1.2,4124,Application Data
1,3.593084999999519,62.210.85.178,10.0.2.15,TCP,60,9001  >  35978 [ACK] Seq=12486457 Ack=228628233 Win=65535 Len=0
1,3.5930939999998373,62.210.85.178,10.0.2.15,TCP,60,9001  >  35978 [ACK] Seq=12486457 Ack=228629693 Win=65535 Len=0
1,3.593152999999802,10.0.2.15,62.210.85.178,TLSv1.2,2974,Application Data
1,3.5931949999994686,62.210.85.178,10.0.2.15,TCP,60,9001  >  35978 [ACK] Seq=12486457 Ack=228630843 Win=65535 Len=0
1,3.5932029999994484,62.210.85.178,10.0.2.15,TCP,60,9001  >  35978 [ACK] Seq=12486457 Ack=228632303 Win=65535 Len=0
1,3.5932059999995545,62.210.85.178,10.0.2.15,TCP,60,9001  >  35978 [ACK] Seq=12486457 Ack=228633763 Win=65535 Len=0
1,3.5932339999999385,10.0.2.15,62.210.85.178,TLSv1.2,1226,Application Data
1,3.593269999999393,62.210.85.178,10.0.2.15,TCP,60,9001  >  35978 [ACK] Seq=12486457 Ack=228634935 Win=65535 Len=0
1,3.593308999999863,10.0.2.15,62.210.85.178,TLSv1.2,4124,Application Data
1,3.5933500000001004,62.210.85.178,10.0.2.15,TCP,60,9001  >  35978 [ACK] Seq=12486457 Ack=228636395 Win=65535 Len=0
1,3.5933569999997417,62.210.85.178,10.0.2.15,TCP,60,9001  >  35978 [ACK] Seq=12486457 Ack=228637855 Win=65535 Len=0
1,3.593360999999277,62.210.85.178,10.0.2.15,TCP,60,9001  >  35978 [ACK] Seq=12486457 Ack=228639005 Win=65535 Len=0
1,3.593397999999979,10.0.2.15,62.210.85.178,TLSv1.2,2516,Application Data
1,3.5934360000001107,62.210.85.178,10.0.2.15,TCP,60,9001  >  35978 [ACK] Seq=12486457 Ack=228640465 Win=65535 Len=0
1,3.593442999999752,62.210.85.178,10.0.2.15,TCP,60,9001  >  35978 [ACK] Seq=12486457 Ack=228641467 Win=65535 Len=0
1,3.7015480000000025,54.93.77.70,10.0.2.15,TLSv1.2,590,Application Data
1,3.7442989999999554,10.0.2.15,54.93.77.70,TCP,54,34692  >  9001 [ACK] Seq=12549013 Ack=228502579 Win=65535 Len=0
1,3.7631000000001222,54.93.77.70,10.0.2.15,TCP,2950,"9001  >  34692 [PSH, ACK] Seq=228502579 Ack=12549013 Win=65535 Len=2896 [TCP segment of a reassembled PDU]"
1,3.7631860000001325,10.0.2.15,54.93.77.70,TCP,54,34692  >  9001 [ACK] Seq=12549013 Ack=228505475 Win=65535 Len=0
1,3.764925999999832,54.93.77.70,10.0.2.15,TLSv1.2,778,Application Data
1,3.764970999999605,10.0.2.15,54.93.77.70,TCP,54,34692  >  9001 [ACK] Seq=12549013 Ack=228506199 Win=65535 Len=0
1,3.773537000000033,54.93.77.70,10.0.2.15,TCP,2950,"9001  >  34692 [PSH, ACK] Seq=228506199 Ack=12549013 Win=65535 Len=2896 [TCP segment of a reassembled PDU]"
1,3.7735869999996794,10.0.2.15,54.93.77.70,TCP,54,34692  >  9001 [ACK] Seq=12549013 Ack=228509095 Win=65535 Len=0
1,3.783195999999407,54.93.77.70,10.0.2.15,TLSv1.2,4210,"Application Data, Application Data"
1,3.7832439999992857,10.0.2.15,54.93.77.70,TCP,54,34692  >  9001 [ACK] Seq=12549013 Ack=228513251 Win=65535 Len=0
1,3.7957959999994273,54.93.77.70,10.0.2.15,TLSv1.2,2950,Application Data [TCP segment of a reassembled PDU]
1,3.795839999999771,10.0.2.15,54.93.77.70,TCP,54,34692  >  9001 [ACK] Seq=12549013 Ack=228516147 Win=65535 Len=0
1,3.7964709999996558,54.93.77.70,10.0.2.15,TLSv1.2,1502,Application Data
1,3.7965119999998933,10.0.2.15,54.93.77.70,TCP,54,34692  >  9001 [ACK] Seq=12549013 Ack=228517595 Win=65535 Len=0
1,3.7966719999994893,10.0.2.15,54.93.77.70,TLSv1.2,590,Application Data
1,3.7967459999999846,54.93.77.70,10.0.2.15,TCP,60,9001  >  34692 [ACK] Seq=228517595 Ack=12549549 Win=65535 Len=0
1,3.8055619999995542,54.93.77.70,10.0.2.15,TCP,2950,"9001  >  34692 [PSH, ACK] Seq=228517595 Ack=12549549 Win=65535 Len=2896 [TCP segment of a reassembled PDU]"
1,3.805642999999691,10.0.2.15,54.93.77.70,TCP,54,34692  >  9001 [ACK] Seq=12549549 Ack=228520491 Win=65535 Len=0
1,3.8062999999992826,54.93.77.70,10.0.2.15,TLSv1.2,1314,"Application Data, Application Data"
1,3.8154139999996914,54.93.77.70,10.0.2.15,TCP,2950,"9001  >  34692 [PSH, ACK] Seq=228521751 Ack=12549549 Win=65535 Len=2896 [TCP segment of a reassembled PDU]"
1,3.815455999999358,10.0.2.15,54.93.77.70,TCP,54,34692  >  9001 [ACK] Seq=12549549 Ack=228524647 Win=65535 Len=0
1,3.8225389999997788,54.93.77.70,10.0.2.15,TLSv1.2,778,Application Data
1,3.8307009999998627,54.93.77.70,10.0.2.15,TCP,2950,"9001  >  34692 [PSH, ACK] Seq=228525371 Ack=12549549 Win=65535 Len=2896 [TCP segment of a reassembled PDU]"
1,3.8307639999993626,10.0.2.15,54.93.77.70,TCP,54,34692  >  9001 [ACK] Seq=12549549 Ack=228528267 Win=65535 Len=0
1,3.8394289999996545,54.93.77.70,10.0.2.15,TLSv1.2,1314,"Application Data, Application Data"
1,3.839586000000054,10.0.2.15,54.93.77.70,TLSv1.2,590,Application Data
1,3.8396739999998317,54.93.77.70,10.0.2.15,TCP,60,9001  >  34692 [ACK] Seq=228529527 Ack=12550085 Win=65535 Len=0
1,3.849122999999963,10.0.2.15,54.93.77.70,TLSv1.2,590,Application Data
1,3.8492719999994733,54.93.77.70,10.0.2.15,TCP,60,9001  >  34692 [ACK] Seq=228529527 Ack=12550621 Win=65535 Len=0
1,3.918855999999323,62.210.85.178,10.0.2.15,TLSv1.2,590,Application Data
1,3.9602649999997084,10.0.2.15,62.210.85.178,TCP,54,35978  >  9001 [ACK] Seq=228641467 Ack=12486993 Win=65535 Len=0
1,4.700823000000128,62.210.85.178,10.0.2.15,TLSv1.2,1104,Application Data
1,4.700901000000158,10.0.2.15,62.210.85.178,TCP,54,35978  >  9001 [ACK] Seq=228641467 Ack=12488043 Win=65535 Len=0
1,4.701195999999982,10.0.2.15,62.210.85.178,TLSv1.2,590,Application Data
1,4.701287999999295,62.210.85.178,10.0.2.15,TCP,60,9001  >  35978 [ACK] Seq=12488043 Ack=228642003 Win=65535 Len=0
1,5.11057399999936,54.93.77.70,10.0.2.15,TLSv1.2,590,Application Data
1,5.110990999999558,10.0.2.15,54.93.77.70,TLSv1.2,590,Application Data
1,5.11109099999976,54.93.77.70,10.0.2.15,TCP,60,9001  >  34692 [ACK] Seq=228530063 Ack=12551157 Win=65535 Len=0
1,5.233038999999735,62.210.85.178,10.0.2.15,TLSv1.2,590,Application Data
1,5.238190000000031,10.0.2.15,62.210.85.178,TLSv1.2,590,Application Data
1,5.238327999999456,62.210.85.178,10.0.2.15,TCP,60,9001  >  35978 [ACK] Seq=12488579 Ack=228642539 Win=65535 Len=0
1,5.24857399999928,10.0.2.15,62.210.85.178,TLSv1.2,4124,Application Data
1,5.248709999999846,62.210.85.178,10.0.2.15,TCP,60,9001  >  35978 [ACK] Seq=12488579 Ack=228643999 Win=65535 Len=0
1,5.2487279999995735,62.210.85.178,10.0.2.15,TCP,60,9001  >  35978 [ACK] Seq=12488579 Ack=228645459 Win=65535 Len=0
1,5.248732000000018,62.210.85.178,10.0.2.15,TCP,60,9001  >  35978 [ACK] Seq=12488579 Ack=228646609 Win=65535 Len=0
1,5.248798999999963,10.0.2.15,62.210.85.178,TLSv1.2,4124,Application Data
1,5.248884999999973,62.210.85.178,10.0.2.15,TCP,60,9001  >  35978 [ACK] Seq=12488579 Ack=228648069 Win=65535 Len=0
1,5.248892999999953,62.210.85.178,10.0.2.15,TCP,60,9001  >  35978 [ACK] Seq=12488579 Ack=228649529 Win=65535 Len=0
1,5.248896000000059,62.210.85.178,10.0.2.15,TCP,60,9001  >  35978 [ACK] Seq=12488579 Ack=228650679 Win=65535 Len=0
1,5.248927999999978,10.0.2.15,62.210.85.178,TLSv1.2,4124,Application Data
1,5.248967999999877,62.210.85.178,10.0.2.15,TCP,60,9001  >  35978 [ACK] Seq=12488579 Ack=228652139 Win=65535 Len=0
1,5.248976999999286,62.210.85.178,10.0.2.15,TCP,60,9001  >  35978 [ACK] Seq=12488579 Ack=228653599 Win=65535 Len=0
1,5.248980999999731,62.210.85.178,10.0.2.15,TCP,60,9001  >  35978 [ACK] Seq=12488579 Ack=228654749 Win=65535 Len=0
1,5.249018999999862,10.0.2.15,62.210.85.178,TLSv1.2,4124,Application Data
1,5.249056999999993,62.210.85.178,10.0.2.15,TCP,60,9001  >  35978 [ACK] Seq=12488579 Ack=228656209 Win=65535 Len=0
1,5.249064999999973,62.210.85.178,10.0.2.15,TCP,60,9001  >  35978 [ACK] Seq=12488579 Ack=228657669 Win=65535 Len=0
1,5.249127000000044,10.0.2.15,62.210.85.178,TLSv1.2,2974,Application Data
1,5.249168999999711,62.210.85.178,10.0.2.15,TCP,60,9001  >  35978 [ACK] Seq=12488579 Ack=228658819 Win=65535 Len=0
1,5.2491769999996905,62.210.85.178,10.0.2.15,TCP,60,9001  >  35978 [ACK] Seq=12488579 Ack=228660279 Win=65535 Len=0
1,5.249179999999797,62.210.85.178,10.0.2.15,TCP,60,9001  >  35978 [ACK] Seq=12488579 Ack=228661739 Win=65535 Len=0
1,5.24920899999961,10.0.2.15,62.210.85.178,TLSv1.2,1226,Application Data
1,5.2492449999999735,62.210.85.178,10.0.2.15,TCP,60,9001  >  35978 [ACK] Seq=12488579 Ack=228662911 Win=65535 Len=0
1,5.2492849999998725,10.0.2.15,62.210.85.178,TLSv1.2,4124,Application Data
1,5.249323999999433,62.210.85.178,10.0.2.15,TCP,60,9001  >  35978 [ACK] Seq=12488579 Ack=228664371 Win=65535 Len=0
1,5.249331999999413,62.210.85.178,10.0.2.15,TCP,60,9001  >  35978 [ACK] Seq=12488579 Ack=228665831 Win=65535 Len=0
1,5.2493759999997565,10.0.2.15,62.210.85.178,TCP,2974,35978  >  9001 [ACK] Seq=228666981 Ack=12488579 Win=65535 Len=2920 [TCP segment of a reassembled PDU]
1,5.249413999999888,62.210.85.178,10.0.2.15,TCP,60,9001  >  35978 [ACK] Seq=12488579 Ack=228666981 Win=65535 Len=0
1,5.249420999999529,62.210.85.178,10.0.2.15,TCP,60,9001  >  35978 [ACK] Seq=12488579 Ack=228668441 Win=65535 Len=0
1,5.249423999999635,62.210.85.178,10.0.2.15,TCP,60,9001  >  35978 [ACK] Seq=12488579 Ack=228669901 Win=65535 Len=0
1,5.249450999999681,10.0.2.15,62.210.85.178,TLSv1.2,110,Application Data
1,5.249487000000045,62.210.85.178,10.0.2.15,TCP,60,9001  >  35978 [ACK] Seq=12488579 Ack=228669957 Win=65535 Len=0
1,5.260831999999937,10.0.2.15,62.210.85.178,TLSv1.2,4124,Application Data
1,5.260875999999371,62.210.85.178,10.0.2.15,TCP,60,9001  >  35978 [ACK] Seq=12488579 Ack=228671417 Win=65535 Len=0
1,5.260884999999689,62.210.85.178,10.0.2.15,TCP,60,9001  >  35978 [ACK] Seq=12488579 Ack=228672877 Win=65535 Len=0
1,5.260889999999563,62.210.85.178,10.0.2.15,TCP,60,9001  >  35978 [ACK] Seq=12488579 Ack=228674027 Win=65535 Len=0
1,5.2609309999998,10.0.2.15,62.210.85.178,TLSv1.2,4124,Application Data
1,5.260968999999932,62.210.85.178,10.0.2.15,TCP,60,9001  >  35978 [ACK] Seq=12488579 Ack=228675487 Win=65535 Len=0
1,5.260976999999912,62.210.85.178,10.0.2.15,TCP,60,9001  >  35978 [ACK] Seq=12488579 Ack=228676947 Win=65535 Len=0
1,5.260981999999785,62.210.85.178,10.0.2.15,TCP,60,9001  >  35978 [ACK] Seq=12488579 Ack=228678097 Win=65535 Len=0
1,5.261019999999917,10.0.2.15,62.210.85.178,TLSv1.2,4124,Application Data
1,5.26105699999971,62.210.85.178,10.0.2.15,TCP,60,9001  >  35978 [ACK] Seq=12488579 Ack=228679557 Win=65535 Len=0
1,5.261066000000028,62.210.85.178,10.0.2.15,TCP,60,9001  >  35978 [ACK] Seq=12488579 Ack=228681017 Win=65535 Len=0
1,5.261069999999563,62.210.85.178,10.0.2.15,TCP,60,9001  >  35978 [ACK] Seq=12488579 Ack=228682167 Win=65535 Len=0
1,5.261106999999356,10.0.2.15,62.210.85.178,TLSv1.2,4124,Application Data
1,5.2611449999994875,62.210.85.178,10.0.2.15,TCP,60,9001  >  35978 [ACK] Seq=12488579 Ack=228683627 Win=65535 Len=0
1,5.261152999999467,62.210.85.178,10.0.2.15,TCP,60,9001  >  35978 [ACK] Seq=12488579 Ack=228685087 Win=65535 Len=0
1,5.261156999999912,62.210.85.178,10.0.2.15,TCP,60,9001  >  35978 [ACK] Seq=12488579 Ack=228686237 Win=65535 Len=0
1,5.261191999999937,10.0.2.15,62.210.85.178,TLSv1.2,332,Application Data
1,5.26122899999973,62.210.85.178,10.0.2.15,TCP,60,9001  >  35978 [ACK] Seq=12488579 Ack=228686515 Win=65535 Len=0
1,5.2612789999993765,10.0.2.15,62.210.85.178,TLSv1.2,3868,Application Data
1,5.261319999999614,62.210.85.178,10.0.2.15,TCP,60,9001  >  35978 [ACK] Seq=12488579 Ack=228687975 Win=65535 Len=0
1,5.261328999999932,62.210.85.178,10.0.2.15,TCP,60,9001  >  35978 [ACK] Seq=12488579 Ack=228689435 Win=65535 Len=0
1,5.261332999999468,62.210.85.178,10.0.2.15,TCP,60,9001  >  35978 [ACK] Seq=12488579 Ack=228690329 Win=65535 Len=0
1,5.261370999999599,10.0.2.15,62.210.85.178,TLSv1.2,4124,Application Data
1,5.26140899999973,62.210.85.178,10.0.2.15,TCP,60,9001  >  35978 [ACK] Seq=12488579 Ack=228691789 Win=65535 Len=0
1,5.26141699999971,62.210.85.178,10.0.2.15,TCP,60,9001  >  35978 [ACK] Seq=12488579 Ack=228693249 Win=65535 Len=0
1,5.261421000000155,62.210.85.178,10.0.2.15,TCP,60,9001  >  35978 [ACK] Seq=12488579 Ack=228694399 Win=65535 Len=0
1,5.261455999999271,10.0.2.15,62.210.85.178,TLSv1.2,3030,Application Data
1,5.261493999999402,62.210.85.178,10.0.2.15,TCP,60,9001  >  35978 [ACK] Seq=12488579 Ack=228695859 Win=65535 Len=0
1,5.261501999999382,62.210.85.178,10.0.2.15,TCP,60,9001  >  35978 [ACK] Seq=12488579 Ack=228697319 Win=65535 Len=0
1,5.261504999999488,62.210.85.178,10.0.2.15,TCP,60,9001  >  35978 [ACK] Seq=12488579 Ack=228697375 Win=65535 Len=0
1,5.272920999999769,10.0.2.15,62.210.85.178,TLSv1.2,1618,Application Data
1,5.273025999999845,62.210.85.178,10.0.2.15,TCP,60,9001  >  35978 [ACK] Seq=12488579 Ack=228698835 Win=65535 Len=0
1,5.27303799999936,62.210.85.178,10.0.2.15,TCP,60,9001  >  35978 [ACK] Seq=12488579 Ack=228698939 Win=65535 Len=0
1,5.3569629999992685,54.93.77.70,10.0.2.15,TLSv1.2,590,Application Data
1,5.377642999999807,54.93.77.70,10.0.2.15,TCP,2950,"9001  >  34692 [PSH, ACK] Seq=228530599 Ack=12551157 Win=65535 Len=2896 [TCP segment of a reassembled PDU]"
1,5.377719999999499,10.0.2.15,54.93.77.70,TCP,54,34692  >  9001 [ACK] Seq=12551157 Ack=228533495 Win=65535 Len=0
1,5.390663000000131,54.93.77.70,10.0.2.15,TLSv1.2,2950,Application Data [TCP segment of a reassembled PDU]
1,5.390701999999692,10.0.2.15,54.93.77.70,TCP,54,34692  >  9001 [ACK] Seq=12551157 Ack=228536391 Win=65535 Len=0
1,5.391650999999911,54.93.77.70,10.0.2.15,TLSv1.2,1502,Application Data
1,5.391697000000022,10.0.2.15,54.93.77.70,TCP,54,34692  >  9001 [ACK] Seq=12551157 Ack=228537839 Win=65535 Len=0
1,5.401143999999476,54.93.77.70,10.0.2.15,TCP,2950,"9001  >  34692 [PSH, ACK] Seq=228537839 Ack=12551157 Win=65535 Len=2896 [TCP segment of a reassembled PDU]"
1,5.401238999999805,10.0.2.15,54.93.77.70,TCP,54,34692  >  9001 [ACK] Seq=12551157 Ack=228540735 Win=65535 Len=0
1,5.401713999999629,54.93.77.70,10.0.2.15,TLSv1.2,5448,"Application Data, Application Data, Application Data"
1,5.401773999999932,10.0.2.15,54.93.77.70,TCP,54,34692  >  9001 [ACK] Seq=12551157 Ack=228546129 Win=65535 Len=0
1,5.415791999999783,54.93.77.70,10.0.2.15,TCP,2950,"9001  >  34692 [PSH, ACK] Seq=228546129 Ack=12551157 Win=65535 Len=2896 [TCP segment of a reassembled PDU]"
1,5.41583399999945,10.0.2.15,54.93.77.70,TCP,54,34692  >  9001 [ACK] Seq=12551157 Ack=228549025 Win=65535 Len=0
1,5.416213999999854,54.93.77.70,10.0.2.15,TLSv1.2,4398,Application Data [TCP segment of a reassembled PDU]
1,5.416253999999753,10.0.2.15,54.93.77.70,TCP,54,34692  >  9001 [ACK] Seq=12551157 Ack=228553369 Win=65535 Len=0
1,5.418506999999408,54.93.77.70,10.0.2.15,TLSv1.2,568,Application Data
1,5.423799000000145,54.93.77.70,10.0.2.15,TCP,2950,"9001  >  34692 [PSH, ACK] Seq=228553883 Ack=12551157 Win=65535 Len=2896 [TCP segment of a reassembled PDU]"
1,5.423840999999811,10.0.2.15,54.93.77.70,TCP,54,34692  >  9001 [ACK] Seq=12551157 Ack=228556779 Win=65535 Len=0
1,5.434865999999602,54.93.77.70,10.0.2.15,TLSv1.2,2950,Application Data [TCP segment of a reassembled PDU]
1,5.43492999999944,10.0.2.15,54.93.77.70,TCP,54,34692  >  9001 [ACK] Seq=12551157 Ack=228559675 Win=65535 Len=0
1,5.434962999999698,54.93.77.70,10.0.2.15,TCP,1502,"9001  >  34692 [PSH, ACK] Seq=228559675 Ack=12551157 Win=65535 Len=1448 [TCP segment of a reassembled PDU]"
1,5.435008999999809,10.0.2.15,54.93.77.70,TCP,54,34692  >  9001 [ACK] Seq=12551157 Ack=228561123 Win=65535 Len=0
1,5.435150999999678,10.0.2.15,54.93.77.70,TLSv1.2,590,Application Data
1,5.435218999999961,54.93.77.70,10.0.2.15,TCP,60,9001  >  34692 [ACK] Seq=228561123 Ack=12551693 Win=65535 Len=0
1,5.440266999999949,54.93.77.70,10.0.2.15,TLSv1.2,1104,"Application Data, Application Data"
1,5.447317999999541,54.93.77.70,10.0.2.15,TCP,2950,"9001  >  34692 [PSH, ACK] Seq=228562173 Ack=12551693 Win=65535 Len=2896 [TCP segment of a reassembled PDU]"
1,5.447368000000097,10.0.2.15,54.93.77.70,TCP,54,34692  >  9001 [ACK] Seq=12551693 Ack=228565069 Win=65535 Len=0
1,5.447967000000062,54.93.77.70,10.0.2.15,TLSv1.2,2950,Application Data [TCP segment of a reassembled PDU]
1,5.448006999999961,10.0.2.15,54.93.77.70,TCP,54,34692  >  9001 [ACK] Seq=12551693 Ack=228567965 Win=65535 Len=0
1,5.449153999999908,54.93.77.70,10.0.2.15,TLSv1.2,4398,Application Data [TCP segment of a reassembled PDU]
1,5.449195000000145,10.0.2.15,54.93.77.70,TCP,54,34692  >  9001 [ACK] Seq=12551693 Ack=228572309 Win=65535 Len=0
1,5.46431499999926,54.93.77.70,10.0.2.15,TLSv1.2,778,Application Data
1,5.464462999999341,10.0.2.15,54.93.77.70,TLSv1.2,590,Application Data
1,5.464539999999943,54.93.77.70,10.0.2.15,TCP,60,9001  >  34692 [ACK] Seq=228573033 Ack=12552229 Win=65535 Len=0
1,5.467599999999948,54.93.77.70,10.0.2.15,TCP,2950,"9001  >  34692 [PSH, ACK] Seq=228573033 Ack=12552229 Win=65535 Len=2896 [TCP segment of a reassembled PDU]"
1,5.4676629999994475,10.0.2.15,54.93.77.70,TCP,54,34692  >  9001 [ACK] Seq=12552229 Ack=228575929 Win=65535 Len=0
1,5.482625999999982,54.93.77.70,10.0.2.15,TLSv1.2,778,Application Data
1,5.490327999999863,54.93.77.70,10.0.2.15,TCP,1502,"9001  >  34692 [PSH, ACK] Seq=228576653 Ack=12552229 Win=65535 Len=1448 [TCP segment of a reassembled PDU]"
1,5.490374999999403,10.0.2.15,54.93.77.70,TCP,54,34692  >  9001 [ACK] Seq=12552229 Ack=228578101 Win=65535 Len=0
1,5.503264999999374,54.93.77.70,10.0.2.15,TLSv1.2,2950,Application Data [TCP segment of a reassembled PDU]
1,5.50334599999951,10.0.2.15,54.93.77.70,TCP,54,34692  >  9001 [ACK] Seq=12552229 Ack=228580997 Win=65535 Len=0
1,5.506853999999294,54.93.77.70,10.0.2.15,TLSv1.2,1408,Application Data
1,5.506993999999395,10.0.2.15,54.93.77.70,TLSv1.2,590,Application Data
1,5.507072999999764,54.93.77.70,10.0.2.15,TCP,60,9001  >  34692 [ACK] Seq=228582351 Ack=12552765 Win=65535 Len=0
1,5.5139689999996335,54.93.77.70,10.0.2.15,TCP,2950,"9001  >  34692 [PSH, ACK] Seq=228582351 Ack=12552765 Win=65535 Len=2896 [TCP segment of a reassembled PDU]"
1,5.514035999999578,10.0.2.15,54.93.77.70,TCP,54,34692  >  9001 [ACK] Seq=12552765 Ack=228585247 Win=65535 Len=0
1,5.524630999999317,54.93.77.70,10.0.2.15,TLSv1.2,1314,"Application Data, Application Data"
1,5.525901999999405,10.0.2.15,54.93.77.70,TLSv1.2,590,Application Data
1,5.526020999999673,54.93.77.70,10.0.2.15,TCP,60,9001  >  34692 [ACK] Seq=228586507 Ack=12553301 Win=65535 Len=0
1,5.535748999999669,10.0.2.15,54.93.77.70,TLSv1.2,590,Application Data
1,5.535879000000023,54.93.77.70,10.0.2.15,TCP,60,9001  >  34692 [ACK] Seq=228586507 Ack=12553837 Win=65535 Len=0
1,5.5426879999995435,54.93.77.70,10.0.2.15,TLSv1.2,590,Application Data
1,5.575943999999254,62.210.85.178,10.0.2.15,TLSv1.2,590,Application Data
1,5.584265999999843,10.0.2.15,54.93.77.70,TCP,54,34692  >  9001 [ACK] Seq=12553837 Ack=228587043 Win=65535 Len=0
1,5.6163339999993696,10.0.2.15,62.210.85.178,TCP,54,35978  >  9001 [ACK] Seq=228698939 Ack=12489115 Win=65535 Len=0
1,5.704624999999396,62.210.85.178,10.0.2.15,TLSv1.2,2132,Application Data
1,5.704700999999659,10.0.2.15,62.210.85.178,TCP,54,35978  >  9001 [ACK] Seq=228698939 Ack=12491193 Win=65535 Len=0
1,5.705180999999357,10.0.2.15,62.210.85.178,TLSv1.2,590,Application Data
1,5.705283999999665,62.210.85.178,10.0.2.15,TCP,60,9001  >  35978 [ACK] Seq=12491193 Ack=228699475 Win=65535 Len=0
1,6.235998999999538,54.93.77.70,10.0.2.15,TLSv1.2,590,Application Data
1,6.236077999999907,10.0.2.15,54.93.77.70,TCP,54,34692  >  9001 [ACK] Seq=12553837 Ack=228587579 Win=65535 Len=0
1,6.236433000000034,10.0.2.15,54.93.77.70,TLSv1.2,590,Application Data
1,6.236506999999619,54.93.77.70,10.0.2.15,TCP,60,9001  >  34692 [ACK] Seq=228587579 Ack=12554373 Win=65535 Len=0
1,6.440897999999834,62.210.85.178,10.0.2.15,TLSv1.2,590,Application Data
1,6.446371999999428,10.0.2.15,62.210.85.178,TLSv1.2,590,Application Data
1,6.446505999999317,62.210.85.178,10.0.2.15,TCP,60,9001  >  35978 [ACK] Seq=12491729 Ack=228700011 Win=65535 Len=0
1,6.456717000000026,10.0.2.15,62.210.85.178,TLSv1.2,4124,Application Data
1,6.456828999999743,10.0.2.15,62.210.85.178,TCP,2974,35978  >  9001 [ACK] Seq=228704081 Ack=12491729 Win=65535 Len=2920 [TCP segment of a reassembled PDU]
1,6.456908000000112,62.210.85.178,10.0.2.15,TCP,60,9001  >  35978 [ACK] Seq=12491729 Ack=228701471 Win=65535 Len=0
1,6.456924999999501,62.210.85.178,10.0.2.15,TCP,60,9001  >  35978 [ACK] Seq=12491729 Ack=228702931 Win=65535 Len=0
1,6.4569289999999455,62.210.85.178,10.0.2.15,TCP,60,9001  >  35978 [ACK] Seq=12491729 Ack=228704081 Win=65535 Len=0
1,6.456932000000052,62.210.85.178,10.0.2.15,TCP,60,9001  >  35978 [ACK] Seq=12491729 Ack=228705541 Win=65535 Len=0
1,6.456935000000158,62.210.85.178,10.0.2.15,TCP,60,9001  >  35978 [ACK] Seq=12491729 Ack=228707001 Win=65535 Len=0
1,6.45697299999938,10.0.2.15,62.210.85.178,TLSv1.2,1204,Application Data
1,6.457021999999597,62.210.85.178,10.0.2.15,TCP,60,9001  >  35978 [ACK] Seq=12491729 Ack=228708151 Win=65535 Len=0
1,6.457080000000133,10.0.2.15,62.210.85.178,TLSv1.2,4124,Application Data
1,6.457124999999905,62.210.85.178,10.0.2.15,TCP,60,9001  >  35978 [ACK] Seq=12491729 Ack=228709611 Win=65535 Len=0
1,6.457132999999885,62.210.85.178,10.0.2.15,TCP,60,9001  >  35978 [ACK] Seq=12491729 Ack=228711071 Win=65535 Len=0
1,6.45713699999942,62.210.85.178,10.0.2.15,TCP,60,9001  >  35978 [ACK] Seq=12491729 Ack=228712221 Win=65535 Len=0
1,6.457176999999319,10.0.2.15,62.210.85.178,TLSv1.2,4124,Application Data
1,6.457214999999451,62.210.85.178,10.0.2.15,TCP,60,9001  >  35978 [ACK] Seq=12491729 Ack=228713681 Win=65535 Len=0
1,6.457222999999431,62.210.85.178,10.0.2.15,TCP,60,9001  >  35978 [ACK] Seq=12491729 Ack=228715141 Win=65535 Len=0
1,6.4572849999995015,10.0.2.15,62.210.85.178,TLSv1.2,2974,Application Data
1,6.4573270000000775,62.210.85.178,10.0.2.15,TCP,60,9001  >  35978 [ACK] Seq=12491729 Ack=228716291 Win=65535 Len=0
1,6.457333999999719,62.210.85.178,10.0.2.15,TCP,60,9001  >  35978 [ACK] Seq=12491729 Ack=228717751 Win=65535 Len=0
1,6.457337999999254,62.210.85.178,10.0.2.15,TCP,60,9001  >  35978 [ACK] Seq=12491729 Ack=228719211 Win=65535 Len=0
1,6.4573649999992995,10.0.2.15,62.210.85.178,TLSv1.2,1226,Application Data
1,6.457402999999431,62.210.85.178,10.0.2.15,TCP,60,9001  >  35978 [ACK] Seq=12491729 Ack=228720383 Win=65535 Len=0
1,6.45744299999933,10.0.2.15,62.210.85.178,TLSv1.2,4124,Application Data
1,6.457480999999461,62.210.85.178,10.0.2.15,TCP,60,9001  >  35978 [ACK] Seq=12491729 Ack=228721843 Win=65535 Len=0
1,6.457488999999441,62.210.85.178,10.0.2.15,TCP,60,9001  >  35978 [ACK] Seq=12491729 Ack=228723303 Win=65535 Len=0
1,6.457492999999886,62.210.85.178,10.0.2.15,TCP,60,9001  >  35978 [ACK] Seq=12491729 Ack=228724453 Win=65535 Len=0
1,6.457534000000123,10.0.2.15,62.210.85.178,TLSv1.2,3030,Application Data
1,6.457571999999345,62.210.85.178,10.0.2.15,TCP,60,9001  >  35978 [ACK] Seq=12491729 Ack=228725913 Win=65535 Len=0
1,6.457578999999896,62.210.85.178,10.0.2.15,TCP,60,9001  >  35978 [ACK] Seq=12491729 Ack=228727373 Win=65535 Len=0
1,6.457582999999431,62.210.85.178,10.0.2.15,TCP,60,9001  >  35978 [ACK] Seq=12491729 Ack=228727429 Win=65535 Len=0
1,6.468892999999298,10.0.2.15,62.210.85.178,TLSv1.2,4124,Application Data
1,6.468936999999642,62.210.85.178,10.0.2.15,TCP,60,9001  >  35978 [ACK] Seq=12491729 Ack=228728889 Win=65535 Len=0
1,6.46894599999996,62.210.85.178,10.0.2.15,TCP,60,9001  >  35978 [ACK] Seq=12491729 Ack=228730349 Win=65535 Len=0
1,6.468950999999834,62.210.85.178,10.0.2.15,TCP,60,9001  >  35978 [ACK] Seq=12491729 Ack=228731499 Win=65535 Len=0
1,6.468990999999733,10.0.2.15,62.210.85.178,TLSv1.2,4124,Application Data
1,6.469028999999864,62.210.85.178,10.0.2.15,TCP,60,9001  >  35978 [ACK] Seq=12491729 Ack=228732959 Win=65535 Len=0
1,6.469037999999273,62.210.85.178,10.0.2.15,TCP,60,9001  >  35978 [ACK] Seq=12491729 Ack=228734419 Win=65535 Len=0
1,6.4690419999997175,62.210.85.178,10.0.2.15,TCP,60,9001  >  35978 [ACK] Seq=12491729 Ack=228735569 Win=65535 Len=0
1,6.469079999999849,10.0.2.15,62.210.85.178,TLSv1.2,4124,Application Data
1,6.469116999999642,62.210.85.178,10.0.2.15,TCP,60,9001  >  35978 [ACK] Seq=12491729 Ack=228737029 Win=65535 Len=0
1,6.46912599999996,62.210.85.178,10.0.2.15,TCP,60,9001  >  35978 [ACK] Seq=12491729 Ack=228738489 Win=65535 Len=0
1,6.469129999999495,62.210.85.178,10.0.2.15,TCP,60,9001  >  35978 [ACK] Seq=12491729 Ack=228739639 Win=65535 Len=0
1,6.469165999999859,10.0.2.15,62.210.85.178,TLSv1.2,4124,Application Data
1,6.469203999999991,62.210.85.178,10.0.2.15,TCP,60,9001  >  35978 [ACK] Seq=12491729 Ack=228741099 Win=65535 Len=0
1,6.46921199999997,62.210.85.178,10.0.2.15,TCP,60,9001  >  35978 [ACK] Seq=12491729 Ack=228742559 Win=65535 Len=0
1,6.469215999999506,62.210.85.178,10.0.2.15,TCP,60,9001  >  35978 [ACK] Seq=12491729 Ack=228743709 Win=65535 Len=0
1,6.469250000000102,10.0.2.15,62.210.85.178,TLSv1.2,332,Application Data
1,6.469286999999895,62.210.85.178,10.0.2.15,TCP,60,9001  >  35978 [ACK] Seq=12491729 Ack=228743987 Win=65535 Len=0
1,6.469336000000112,10.0.2.15,62.210.85.178,TLSv1.2,3868,Application Data
1,6.469379999999546,62.210.85.178,10.0.2.15,TCP,60,9001  >  35978 [ACK] Seq=12491729 Ack=228745447 Win=65535 Len=0
1,6.469387000000097,62.210.85.178,10.0.2.15,TCP,60,9001  >  35978 [ACK] Seq=12491729 Ack=228746907 Win=65535 Len=0
1,6.469390999999632,62.210.85.178,10.0.2.15,TCP,60,9001  >  35978 [ACK] Seq=12491729 Ack=228747801 Win=65535 Len=0
1,6.469430000000102,10.0.2.15,62.210.85.178,TLSv1.2,4124,Application Data
1,6.469468999999663,62.210.85.178,10.0.2.15,TCP,60,9001  >  35978 [ACK] Seq=12491729 Ack=228749261 Win=65535 Len=0
1,6.469476999999642,62.210.85.178,10.0.2.15,TCP,60,9001  >  35978 [ACK] Seq=12491729 Ack=228750721 Win=65535 Len=0
1,6.4694799999997485,62.210.85.178,10.0.2.15,TCP,60,9001  >  35978 [ACK] Seq=12491729 Ack=228751871 Win=65535 Len=0
1,6.469514999999774,10.0.2.15,62.210.85.178,TLSv1.2,3030,Application Data
1,6.469553999999334,62.210.85.178,10.0.2.15,TCP,60,9001  >  35978 [ACK] Seq=12491729 Ack=228753331 Win=65535 Len=0
1,6.469560999999885,62.210.85.178,10.0.2.15,TCP,60,9001  >  35978 [ACK] Seq=12491729 Ack=228754791 Win=65535 Len=0
1,6.46956499999942,62.210.85.178,10.0.2.15,TCP,60,9001  >  35978 [ACK] Seq=12491729 Ack=228754847 Win=65535 Len=0
1,6.480854999999792,10.0.2.15,62.210.85.178,TLSv1.2,4124,Application Data
1,6.480899999999565,62.210.85.178,10.0.2.15,TCP,60,9001  >  35978 [ACK] Seq=12491729 Ack=228756307 Win=65535 Len=0
1,6.480908999999883,62.210.85.178,10.0.2.15,TCP,60,9001  >  35978 [ACK] Seq=12491729 Ack=228757767 Win=65535 Len=0
1,6.480913999999757,62.210.85.178,10.0.2.15,TCP,60,9001  >  35978 [ACK] Seq=12491729 Ack=228758917 Win=65535 Len=0
1,6.4809549999999945,10.0.2.15,62.210.85.178,TLSv1.2,4124,Application Data
1,6.480993000000126,62.210.85.178,10.0.2.15,TCP,60,9001  >  35978 [ACK] Seq=12491729 Ack=228760377 Win=65535 Len=0
1,6.481001000000106,62.210.85.178,10.0.2.15,TCP,60,9001  >  35978 [ACK] Seq=12491729 Ack=228761837 Win=65535 Len=0
1,6.481005999999979,62.210.85.178,10.0.2.15,TCP,60,9001  >  35978 [ACK] Seq=12491729 Ack=228762987 Win=65535 Len=0
1,6.481041000000005,10.0.2.15,62.210.85.178,TLSv1.2,718,Application Data
1,6.481080999999904,62.210.85.178,10.0.2.15,TCP,60,9001  >  35978 [ACK] Seq=12491729 Ack=228763651 Win=65535 Len=0
1,6.551233000000138,54.93.77.70,10.0.2.15,TCP,2950,"9001  >  34692 [PSH, ACK] Seq=228587579 Ack=12554373 Win=65535 Len=2896 [TCP segment of a reassembled PDU]"
1,6.551368999999795,10.0.2.15,54.93.77.70,TCP,54,34692  >  9001 [ACK] Seq=12554373 Ack=228590475 Win=65535 Len=0
1,6.551789999999528,54.93.77.70,10.0.2.15,TLSv1.2,778,Application Data
1,6.576407999999901,54.93.77.70,10.0.2.15,TCP,2950,"9001  >  34692 [PSH, ACK] Seq=228591199 Ack=12554373 Win=65535 Len=2896 [TCP segment of a reassembled PDU]"
1,6.576466999999866,10.0.2.15,54.93.77.70,TCP,54,34692  >  9001 [ACK] Seq=12554373 Ack=228594095 Win=65535 Len=0
1,6.576815999999781,54.93.77.70,10.0.2.15,TLSv1.2,778,Application Data
1,6.592834999999468,54.93.77.70,10.0.2.15,TLSv1.2,1104,Application Data
1,6.592882999999347,10.0.2.15,54.93.77.70,TCP,54,34692  >  9001 [ACK] Seq=12554373 Ack=228595869 Win=65535 Len=0
1,6.617249999999331,54.93.77.70,10.0.2.15,TLSv1.2,7294,Application Data
1,6.617334999999912,10.0.2.15,54.93.77.70,TCP,54,34692  >  9001 [ACK] Seq=12554373 Ack=228603109 Win=65535 Len=0
1,6.621920999999929,54.93.77.70,10.0.2.15,TLSv1.2,568,Application Data
1,6.64871200000016,54.93.77.70,10.0.2.15,TCP,2950,"9001  >  34692 [PSH, ACK] Seq=228603623 Ack=12554373 Win=65535 Len=2896 [TCP segment of a reassembled PDU]"
1,6.648785999999745,10.0.2.15,54.93.77.70,TCP,54,34692  >  9001 [ACK] Seq=12554373 Ack=228606519 Win=65535 Len=0
1,6.649828999999954,54.93.77.70,10.0.2.15,TLSv1.2,778,Application Data
1,6.663555999999517,54.93.77.70,10.0.2.15,TCP,2950,"9001  >  34692 [PSH, ACK] Seq=228607243 Ack=12554373 Win=65535 Len=2896 [TCP segment of a reassembled PDU]"
1,6.663617000000158,10.0.2.15,54.93.77.70,TCP,54,34692  >  9001 [ACK] Seq=12554373 Ack=228610139 Win=65535 Len=0
1,6.666338999999425,54.93.77.70,10.0.2.15,TLSv1.2,778,Application Data
1,6.679854999999407,54.93.77.70,10.0.2.15,TLSv1.2,2950,Application Data
1,6.6799049999999625,10.0.2.15,54.93.77.70,TCP,54,34692  >  9001 [ACK] Seq=12554373 Ack=228613759 Win=65535 Len=0
1,6.682358000000022,54.93.77.70,10.0.2.15,TLSv1.2,1314,Application Data
1,6.682509999999638,10.0.2.15,54.93.77.70,TLSv1.2,590,Application Data
1,6.682589999999436,54.93.77.70,10.0.2.15,TCP,60,9001  >  34692 [ACK] Seq=228615019 Ack=12554909 Win=65535 Len=0
1,6.686523999999736,54.93.77.70,10.0.2.15,TLSv1.2,5846,Application Data
1,6.686589999999342,10.0.2.15,54.93.77.70,TCP,54,34692  >  9001 [ACK] Seq=12554909 Ack=228620811 Win=65535 Len=0
1,6.687276999999995,54.93.77.70,10.0.2.15,TLSv1.2,1502,Application Data
1,6.687315999999555,10.0.2.15,54.93.77.70,TCP,54,34692  >  9001 [ACK] Seq=12554909 Ack=228622259 Win=65535 Len=0
1,6.6987899999994625,54.93.77.70,10.0.2.15,TLSv1.2,1104,Application Data
1,6.698956999999609,10.0.2.15,54.93.77.70,TLSv1.2,590,Application Data
1,6.699047000000064,54.93.77.70,10.0.2.15,TCP,60,9001  >  34692 [ACK] Seq=228623309 Ack=12555445 Win=65535 Len=0
1,6.702026999999362,54.93.77.70,10.0.2.15,TLSv1.2,5846,Application Data
1,6.702107000000069,10.0.2.15,54.93.77.70,TCP,54,34692  >  9001 [ACK] Seq=12555445 Ack=228629101 Win=65535 Len=0
1,6.702903999999762,54.93.77.70,10.0.2.15,TCP,1502,"9001  >  34692 [PSH, ACK] Seq=228629101 Ack=12555445 Win=65535 Len=1448 [TCP segment of a reassembled PDU]"
1,6.702945999999429,10.0.2.15,54.93.77.70,TCP,54,34692  >  9001 [ACK] Seq=12555445 Ack=228630549 Win=65535 Len=0
1,6.716005999999652,54.93.77.70,10.0.2.15,TLSv1.2,568,Application Data
1,6.719393999999738,54.93.77.70,10.0.2.15,TCP,2950,"9001  >  34692 [PSH, ACK] Seq=228631063 Ack=12555445 Win=65535 Len=2896 [TCP segment of a reassembled PDU]"
1,6.719457000000148,10.0.2.15,54.93.77.70,TCP,54,34692  >  9001 [ACK] Seq=12555445 Ack=228633959 Win=65535 Len=0
1,6.73410100000001,54.93.77.70,10.0.2.15,TLSv1.2,1314,"Application Data, Application Data"
1,6.772625999999946,54.93.77.70,10.0.2.15,TCP,2950,"9001  >  34692 [PSH, ACK] Seq=228635219 Ack=12555445 Win=65535 Len=2896 [TCP segment of a reassembled PDU]"
1,6.77270099999987,10.0.2.15,54.93.77.70,TCP,54,34692  >  9001 [ACK] Seq=12555445 Ack=228638115 Win=65535 Len=0
1,6.773057999999764,54.93.77.70,10.0.2.15,TLSv1.2,778,Application Data
1,6.803057000000081,54.93.77.70,10.0.2.15,TCP,2950,"9001  >  34692 [PSH, ACK] Seq=228638839 Ack=12555445 Win=65535 Len=2896 [TCP segment of a reassembled PDU]"
1,6.803140999999414,10.0.2.15,54.93.77.70,TCP,54,34692  >  9001 [ACK] Seq=12555445 Ack=228641735 Win=65535 Len=0
1,6.803175999999439,54.93.77.70,10.0.2.15,TLSv1.2,1314,"Application Data, Application Data"
1,6.803326999999626,10.0.2.15,54.93.77.70,TLSv1.2,590,Application Data
1,6.803398000000016,54.93.77.70,10.0.2.15,TCP,60,9001  >  34692 [ACK] Seq=228642995 Ack=12555981 Win=65535 Len=0
1,6.811542999999801,54.93.77.70,10.0.2.15,TCP,2950,"9001  >  34692 [PSH, ACK] Seq=228642995 Ack=12555981 Win=65535 Len=2896 [TCP segment of a reassembled PDU]"
1,6.8115999999999985,10.0.2.15,54.93.77.70,TCP,54,34692  >  9001 [ACK] Seq=12555981 Ack=228645891 Win=65535 Len=0
1,6.812898000000132,54.93.77.70,10.0.2.15,TLSv1.2,4398,"Application Data, Application Data"
1,6.812939999999799,10.0.2.15,54.93.77.70,TCP,54,34692  >  9001 [ACK] Seq=12555981 Ack=228650235 Win=65535 Len=0
1,6.8227829999996175,54.93.77.70,10.0.2.15,TLSv1.2,1618,Application Data
1,6.822823999999855,10.0.2.15,54.93.77.70,TCP,54,34692  >  9001 [ACK] Seq=12555981 Ack=228651799 Win=65535 Len=0
1,6.8253679999997985,10.0.2.15,54.93.77.70,TLSv1.2,590,Application Data
1,6.8255410000001575,54.93.77.70,10.0.2.15,TCP,60,9001  >  34692 [ACK] Seq=228651799 Ack=12556517 Win=65535 Len=0
1,6.833675999999286,62.210.85.178,10.0.2.15,TLSv1.2,1104,Application Data
1,6.876357999999527,10.0.2.15,62.210.85.178,TCP,54,35978  >  9001 [ACK] Seq=228763651 Ack=12492779 Win=65535 Len=0
1,6.964531999999963,62.210.85.178,10.0.2.15,TLSv1.2,590,Application Data
1,6.964634999999362,10.0.2.15,62.210.85.178,TCP,54,35978  >  9001 [ACK] Seq=228763651 Ack=12493315 Win=65535 Len=0
1,7.015140999999858,62.210.85.178,10.0.2.15,TLSv1.2,590,Application Data
1,7.01521799999955,10.0.2.15,62.210.85.178,TCP,54,35978  >  9001 [ACK] Seq=228763651 Ack=12493851 Win=65535 Len=0
1,7.0157039999994595,10.0.2.15,62.210.85.178,TLSv1.2,590,Application Data
1,7.015813999999409,62.210.85.178,10.0.2.15,TCP,60,9001  >  35978 [ACK] Seq=12493851 Ack=228764187 Win=65535 Len=0
1,7.466255999999703,54.93.77.70,10.0.2.15,TLSv1.2,590,Application Data
1,7.466693999999734,10.0.2.15,54.93.77.70,TLSv1.2,590,Application Data
1,7.466818999999305,54.93.77.70,10.0.2.15,TCP,60,9001  >  34692 [ACK] Seq=228652335 Ack=12557053 Win=65535 Len=0
1,7.5812919999998485,62.210.85.178,10.0.2.15,TLSv1.2,590,Application Data
1,7.584348999999747,10.0.2.15,62.210.85.178,TLSv1.2,590,Application Data
1,7.584504999999808,62.210.85.178,10.0.2.15,TCP,60,9001  >  35978 [ACK] Seq=12494387 Ack=228764723 Win=65535 Len=0
1,7.597378999999819,10.0.2.15,62.210.85.178,TLSv1.2,4124,Application Data
1,7.597477999999683,10.0.2.15,62.210.85.178,TCP,1514,35978  >  9001 [ACK] Seq=228768793 Ack=12494387 Win=65535 Len=1460 [TCP segment of a reassembled PDU]
1,7.5975259999995615,62.210.85.178,10.0.2.15,TCP,60,9001  >  35978 [ACK] Seq=12494387 Ack=228766183 Win=65535 Len=0
1,7.597536999999647,62.210.85.178,10.0.2.15,TCP,60,9001  >  35978 [ACK] Seq=12494387 Ack=228767643 Win=65535 Len=0
1,7.597541000000092,62.210.85.178,10.0.2.15,TCP,60,9001  >  35978 [ACK] Seq=12494387 Ack=228768793 Win=65535 Len=0
1,7.597543999999289,62.210.85.178,10.0.2.15,TCP,60,9001  >  35978 [ACK] Seq=12494387 Ack=228770253 Win=65535 Len=0
1,7.597576999999546,10.0.2.15,62.210.85.178,TLSv1.2,1250,Application Data
1,7.597614999999678,62.210.85.178,10.0.2.15,TCP,60,9001  >  35978 [ACK] Seq=12494387 Ack=228771449 Win=65535 Len=0
1,8.079181000000062,54.93.77.70,10.0.2.15,TCP,2950,"9001  >  34692 [PSH, ACK] Seq=228652335 Ack=12557053 Win=65535 Len=2896 [TCP segment of a reassembled PDU]"
1,8.079310999999507,10.0.2.15,54.93.77.70,TCP,54,34692  >  9001 [ACK] Seq=12557053 Ack=228655231 Win=65535 Len=0
1,8.082950999999412,54.93.77.70,10.0.2.15,TLSv1.2,4398,"Application Data, Application Data"
1,8.082993999999417,10.0.2.15,54.93.77.70,TCP,54,34692  >  9001 [ACK] Seq=12557053 Ack=228659575 Win=65535 Len=0
1,8.08567099999982,10.0.2.15,54.93.77.70,TLSv1.2,590,Application Data
1,8.08580399999937,54.93.77.70,10.0.2.15,TCP,60,9001  >  34692 [ACK] Seq=228659575 Ack=12557589 Win=65535 Len=0
1,8.488988999999492,62.210.85.178,10.0.2.15,TLSv1.2,590,Application Data
1,8.489294999999402,10.0.2.15,62.210.85.178,TLSv1.2,590,Application Data
1,8.489399999999478,62.210.85.178,10.0.2.15,TCP,60,9001  >  35978 [ACK] Seq=12494923 Ack=228771985 Win=65535 Len=0
1,8.694337999999334,54.93.77.70,10.0.2.15,TLSv1.2,590,Application Data
1,8.694707999999991,10.0.2.15,54.93.77.70,TLSv1.2,590,Application Data
1,8.694815999999264,54.93.77.70,10.0.2.15,TCP,60,9001  >  34692 [ACK] Seq=228660111 Ack=12558125 Win=65535 Len=0
1,9.001343999999335,62.210.85.178,10.0.2.15,TLSv1.2,590,Application Data
1,9.006117999999333,10.0.2.15,62.210.85.178,TLSv1.2,590,Application Data
1,9.006252000000131,62.210.85.178,10.0.2.15,TCP,60,9001  >  35978 [ACK] Seq=12495459 Ack=228772521 Win=65535 Len=0
1,9.017554999999447,10.0.2.15,62.210.85.178,TLSv1.2,4124,Application Data
1,9.01766999999927,10.0.2.15,62.210.85.178,TCP,2974,35978  >  9001 [ACK] Seq=228776591 Ack=12495459 Win=65535 Len=2920 [TCP segment of a reassembled PDU]
1,9.01771699999972,62.210.85.178,10.0.2.15,TCP,60,9001  >  35978 [ACK] Seq=12495459 Ack=228773981 Win=65535 Len=0
1,9.017729000000145,62.210.85.178,10.0.2.15,TCP,60,9001  >  35978 [ACK] Seq=12495459 Ack=228775441 Win=65535 Len=0
1,9.017734000000019,62.210.85.178,10.0.2.15,TCP,60,9001  >  35978 [ACK] Seq=12495459 Ack=228776591 Win=65535 Len=0
1,9.017738999999892,62.210.85.178,10.0.2.15,TCP,60,9001  >  35978 [ACK] Seq=12495459 Ack=228778051 Win=65535 Len=0
1,9.01774099999966,62.210.85.178,10.0.2.15,TCP,60,9001  >  35978 [ACK] Seq=12495459 Ack=228779511 Win=65535 Len=0
1,9.017777000000024,10.0.2.15,62.210.85.178,TLSv1.2,1204,Application Data
1,9.017815000000155,62.210.85.178,10.0.2.15,TCP,60,9001  >  35978 [ACK] Seq=12495459 Ack=228780661 Win=65535 Len=0
1,9.017861999999695,10.0.2.15,62.210.85.178,TLSv1.2,4124,Application Data
1,9.017900999999256,62.210.85.178,10.0.2.15,TCP,60,9001  >  35978 [ACK] Seq=12495459 Ack=228782121 Win=65535 Len=0
1,9.017909000000145,62.210.85.178,10.0.2.15,TCP,60,9001  >  35978 [ACK] Seq=12495459 Ack=228783581 Win=65535 Len=0
1,9.01791299999968,62.210.85.178,10.0.2.15,TCP,60,9001  >  35978 [ACK] Seq=12495459 Ack=228784731 Win=65535 Len=0
1,9.01795200000015,10.0.2.15,62.210.85.178,TLSv1.2,4124,Application Data
1,9.017989999999372,62.210.85.178,10.0.2.15,TCP,60,9001  >  35978 [ACK] Seq=12495459 Ack=228786191 Win=65535 Len=0
1,9.017997999999352,62.210.85.178,10.0.2.15,TCP,60,9001  >  35978 [ACK] Seq=12495459 Ack=228787651 Win=65535 Len=0
1,9.018058999999994,10.0.2.15,62.210.85.178,TLSv1.2,2974,Application Data
1,9.01810099999966,62.210.85.178,10.0.2.15,TCP,60,9001  >  35978 [ACK] Seq=12495459 Ack=228788801 Win=65535 Len=0
1,9.018107999999302,62.210.85.178,10.0.2.15,TCP,60,9001  >  35978 [ACK] Seq=12495459 Ack=228790261 Win=65535 Len=0
1,9.018111999999746,62.210.85.178,10.0.2.15,TCP,60,9001  >  35978 [ACK] Seq=12495459 Ack=228791721 Win=65535 Len=0
1,9.018138999999792,10.0.2.15,62.210.85.178,TLSv1.2,1226,Application Data
1,9.018175999999585,62.210.85.178,10.0.2.15,TCP,60,9001  >  35978 [ACK] Seq=12495459 Ack=228792893 Win=65535 Len=0
1,9.018216999999822,10.0.2.15,62.210.85.178,TLSv1.2,4124,Application Data
1,9.018256999999721,62.210.85.178,10.0.2.15,TCP,60,9001  >  35978 [ACK] Seq=12495459 Ack=228794353 Win=65535 Len=0
1,9.018263999999363,62.210.85.178,10.0.2.15,TCP,60,9001  >  35978 [ACK] Seq=12495459 Ack=228795813 Win=65535 Len=0
1,9.018267999999807,62.210.85.178,10.0.2.15,TCP,60,9001  >  35978 [ACK] Seq=12495459 Ack=228796963 Win=65535 Len=0
1,9.0183049999996,10.0.2.15,62.210.85.178,TLSv1.2,3030,Application Data
1,9.0183449999995,62.210.85.178,10.0.2.15,TCP,60,9001  >  35978 [ACK] Seq=12495459 Ack=228798423 Win=65535 Len=0
1,9.018352999999479,62.210.85.178,10.0.2.15,TCP,60,9001  >  35978 [ACK] Seq=12495459 Ack=228799883 Win=65535 Len=0
1,9.018355999999585,62.210.85.178,10.0.2.15,TCP,60,9001  >  35978 [ACK] Seq=12495459 Ack=228799939 Win=65535 Len=0
1,9.027556999999433,10.0.2.15,62.210.85.178,TLSv1.2,4124,Application Data
1,9.027610999999524,62.210.85.178,10.0.2.15,TCP,60,9001  >  35978 [ACK] Seq=12495459 Ack=228801399 Win=65535 Len=0
1,9.027620999999272,62.210.85.178,10.0.2.15,TCP,60,9001  >  35978 [ACK] Seq=12495459 Ack=228802859 Win=65535 Len=0
1,9.027626000000055,62.210.85.178,10.0.2.15,TCP,60,9001  >  35978 [ACK] Seq=12495459 Ack=228804009 Win=65535 Len=0
1,9.027670999999827,10.0.2.15,62.210.85.178,TLSv1.2,4124,Application Data
1,9.027710999999726,62.210.85.178,10.0.2.15,TCP,60,9001  >  35978 [ACK] Seq=12495459 Ack=228805469 Win=65535 Len=0
1,9.027720000000045,62.210.85.178,10.0.2.15,TCP,60,9001  >  35978 [ACK] Seq=12495459 Ack=228806929 Win=65535 Len=0
1,9.027724999999919,62.210.85.178,10.0.2.15,TCP,60,9001  >  35978 [ACK] Seq=12495459 Ack=228808079 Win=65535 Len=0
1,9.027763999999479,10.0.2.15,62.210.85.178,TLSv1.2,4124,Application Data
1,9.027802999999949,62.210.85.178,10.0.2.15,TCP,60,9001  >  35978 [ACK] Seq=12495459 Ack=228809539 Win=65535 Len=0
1,9.027810999999929,62.210.85.178,10.0.2.15,TCP,60,9001  >  35978 [ACK] Seq=12495459 Ack=228810999 Win=65535 Len=0
1,9.027815999999802,62.210.85.178,10.0.2.15,TCP,60,9001  >  35978 [ACK] Seq=12495459 Ack=228812149 Win=65535 Len=0
1,9.027851999999257,10.0.2.15,62.210.85.178,TLSv1.2,782,Application Data
1,9.02788899999996,62.210.85.178,10.0.2.15,TCP,60,9001  >  35978 [ACK] Seq=12495459 Ack=228812877 Win=65535 Len=0
1,9.154396999999335,54.93.77.70,10.0.2.15,TLSv1.2,3674,Application Data
1,9.15452599999935,10.0.2.15,54.93.77.70,TCP,54,34692  >  9001 [ACK] Seq=12558125 Ack=228663731 Win=65535 Len=0
1,9.162734999999884,54.93.77.70,10.0.2.15,TLSv1.2,5846,Application Data
1,9.162841999999728,10.0.2.15,54.93.77.70,TCP,54,34692  >  9001 [ACK] Seq=12558125 Ack=228669523 Win=65535 Len=0
1,9.163720999999896,54.93.77.70,10.0.2.15,TCP,1502,"9001  >  34692 [PSH, ACK] Seq=228669523 Ack=12558125 Win=65535 Len=1448 [TCP segment of a reassembled PDU]"
1,9.163760999999795,10.0.2.15,54.93.77.70,TCP,54,34692  >  9001 [ACK] Seq=12558125 Ack=228670971 Win=65535 Len=0
1,9.171972000000096,54.93.77.70,10.0.2.15,TLSv1.2,568,Application Data
1,9.17430400000012,54.93.77.70,10.0.2.15,TCP,1502,"9001  >  34692 [PSH, ACK] Seq=228671485 Ack=12558125 Win=65535 Len=1448 [TCP segment of a reassembled PDU]"
1,9.174347000000125,10.0.2.15,54.93.77.70,TCP,54,34692  >  9001 [ACK] Seq=12558125 Ack=228672933 Win=65535 Len=0
1,9.189527999999882,54.93.77.70,10.0.2.15,TLSv1.2,1198,Application Data
1,9.19520999999986,54.93.77.70,10.0.2.15,TCP,2950,"9001  >  34692 [PSH, ACK] Seq=228674077 Ack=12558125 Win=65535 Len=2896 [TCP segment of a reassembled PDU]"
1,9.195275000000038,10.0.2.15,54.93.77.70,TCP,54,34692  >  9001 [ACK] Seq=12558125 Ack=228676973 Win=65535 Len=0
1,9.207892999999785,54.93.77.70,10.0.2.15,TLSv1.2,2950,Application Data [TCP segment of a reassembled PDU]
1,9.207932999999684,54.93.77.70,10.0.2.15,TLSv1.2,2950,Application Data [TCP segment of a reassembled PDU]
1,9.207974999999351,10.0.2.15,54.93.77.70,TCP,54,34692  >  9001 [ACK] Seq=12558125 Ack=228679869 Win=65535 Len=0
1,9.208057999999255,10.0.2.15,54.93.77.70,TCP,54,34692  >  9001 [ACK] Seq=12558125 Ack=228682765 Win=65535 Len=0
1,9.20820999999978,10.0.2.15,54.93.77.70,TLSv1.2,590,Application Data
1,9.20827299999928,54.93.77.70,10.0.2.15,TCP,60,9001  >  34692 [ACK] Seq=228682765 Ack=12558661 Win=65535 Len=0
1,9.208665999999539,54.93.77.70,10.0.2.15,TLSv1.2,5332,"Application Data, Application Data"
1,9.208701999999903,10.0.2.15,54.93.77.70,TCP,54,34692  >  9001 [ACK] Seq=12558661 Ack=228688043 Win=65535 Len=0
1,9.22029399999974,10.0.2.15,54.93.77.70,TLSv1.2,590,Application Data
1,9.22037999999975,54.93.77.70,10.0.2.15,TCP,60,9001  >  34692 [ACK] Seq=228688043 Ack=12559197 Win=65535 Len=0
1,9.229378999999426,54.93.77.70,10.0.2.15,TLSv1.2,3674,Application Data
1,9.229444999999942,10.0.2.15,54.93.77.70,TCP,54,34692  >  9001 [ACK] Seq=12559197 Ack=228691663 Win=65535 Len=0
1,9.31189699999959,54.93.77.70,10.0.2.15,TLSv1.2,7294,"Application Data, Application Data"
1,9.312031999999817,10.0.2.15,54.93.77.70,TCP,54,34692  >  9001 [ACK] Seq=12559197 Ack=228698903 Win=65535 Len=0
1,9.331521999999495,54.93.77.70,10.0.2.15,TLSv1.2,2132,Application Data
1,9.331569999999374,10.0.2.15,54.93.77.70,TCP,54,34692  >  9001 [ACK] Seq=12559197 Ack=228700981 Win=65535 Len=0
1,9.333897999999863,10.0.2.15,54.93.77.70,TLSv1.2,590,Application Data
1,9.334057999999459,54.93.77.70,10.0.2.15,TCP,60,9001  >  34692 [ACK] Seq=228700981 Ack=12559733 Win=65535 Len=0
1,9.388433000000077,62.210.85.178,10.0.2.15,TLSv1.2,590,Application Data
1,9.432305999999699,10.0.2.15,62.210.85.178,TCP,54,35978  >  9001 [ACK] Seq=228812877 Ack=12495995 Win=65535 Len=0
1,9.448903999999857,62.210.85.178,10.0.2.15,TLSv1.2,590,Application Data
1,9.448997999999847,10.0.2.15,62.210.85.178,TCP,54,35978  >  9001 [ACK] Seq=228812877 Ack=12496531 Win=65535 Len=0
1,9.47714199999973,62.210.85.178,10.0.2.15,TLSv1.2,590,Application Data
1,9.477194000000054,10.0.2.15,62.210.85.178,TCP,54,35978  >  9001 [ACK] Seq=228812877 Ack=12497067 Win=65535 Len=0
1,9.477618999999322,10.0.2.15,62.210.85.178,TLSv1.2,590,Application Data
1,9.477728999999272,62.210.85.178,10.0.2.15,TCP,60,9001  >  35978 [ACK] Seq=12497067 Ack=228813413 Win=65535 Len=0
1,9.924482999999782,54.93.77.70,10.0.2.15,TLSv1.2,590,Application Data
1,9.924865999999383,10.0.2.15,54.93.77.70,TLSv1.2,590,Application Data
1,9.924973000000136,54.93.77.70,10.0.2.15,TCP,60,9001  >  34692 [ACK] Seq=228701517 Ack=12560269 Win=65535 Len=0
1,10.537688999999773,62.210.85.178,10.0.2.15,TLSv1.2,590,Application Data
1,10.541312999999718,10.0.2.15,62.210.85.178,TLSv1.2,590,Application Data
1,10.54155399999945,62.210.85.178,10.0.2.15,TCP,60,9001  >  35978 [ACK] Seq=12497603 Ack=228813949 Win=65535 Len=0
1,10.552816999999777,10.0.2.15,62.210.85.178,TLSv1.2,4124,Application Data
1,10.552948999999899,10.0.2.15,62.210.85.178,TCP,2974,35978  >  9001 [ACK] Seq=228818019 Ack=12497603 Win=65535 Len=2920 [TCP segment of a reassembled PDU]
1,10.552995999999439,62.210.85.178,10.0.2.15,TCP,60,9001  >  35978 [ACK] Seq=12497603 Ack=228815409 Win=65535 Len=0
1,10.553008999999292,62.210.85.178,10.0.2.15,TCP,60,9001  >  35978 [ACK] Seq=12497603 Ack=228816869 Win=65535 Len=0
1,10.553014999999505,62.210.85.178,10.0.2.15,TCP,60,9001  >  35978 [ACK] Seq=12497603 Ack=228818019 Win=65535 Len=0
1,10.553019999999378,62.210.85.178,10.0.2.15,TCP,60,9001  >  35978 [ACK] Seq=12497603 Ack=228819479 Win=65535 Len=0
1,10.553022999999484,62.210.85.178,10.0.2.15,TCP,60,9001  >  35978 [ACK] Seq=12497603 Ack=228820939 Win=65535 Len=0
1,10.553062999999383,10.0.2.15,62.210.85.178,TLSv1.2,1204,Application Data
1,10.553100999999515,62.210.85.178,10.0.2.15,TCP,60,9001  >  35978 [ACK] Seq=12497603 Ack=228822089 Win=65535 Len=0
1,10.553147999999965,10.0.2.15,62.210.85.178,TLSv1.2,4124,Application Data
1,10.553186000000096,62.210.85.178,10.0.2.15,TCP,60,9001  >  35978 [ACK] Seq=12497603 Ack=228823549 Win=65535 Len=0
1,10.553194000000076,62.210.85.178,10.0.2.15,TCP,60,9001  >  35978 [ACK] Seq=12497603 Ack=228825009 Win=65535 Len=0
1,10.55319899999995,62.210.85.178,10.0.2.15,TCP,60,9001  >  35978 [ACK] Seq=12497603 Ack=228826159 Win=65535 Len=0
1,10.553238999999849,10.0.2.15,62.210.85.178,TLSv1.2,4124,Application Data
1,10.55327699999998,62.210.85.178,10.0.2.15,TCP,60,9001  >  35978 [ACK] Seq=12497603 Ack=228827619 Win=65535 Len=0
1,10.55328499999996,62.210.85.178,10.0.2.15,TCP,60,9001  >  35978 [ACK] Seq=12497603 Ack=228829079 Win=65535 Len=0
1,10.553345999999692,10.0.2.15,62.210.85.178,TLSv1.2,1514,Application Data
1,10.553385999999591,62.210.85.178,10.0.2.15,TCP,60,9001  >  35978 [ACK] Seq=12497603 Ack=228830229 Win=65535 Len=0
1,10.553393000000142,62.210.85.178,10.0.2.15,TCP,60,9001  >  35978 [ACK] Seq=12497603 Ack=228831689 Win=65535 Len=0
1,10.553419999999278,10.0.2.15,62.210.85.178,TLSv1.2,436,Application Data
1,10.553455999999642,62.210.85.178,10.0.2.15,TCP,60,9001  >  35978 [ACK] Seq=12497603 Ack=228832071 Win=65535 Len=0
1,10.86907599999995,54.93.77.70,10.0.2.15,TCP,2950,"9001  >  34692 [PSH, ACK] Seq=228701517 Ack=12560269 Win=65535 Len=2896 [TCP segment of a reassembled PDU]"
1,10.869203999999627,10.0.2.15,54.93.77.70,TCP,54,34692  >  9001 [ACK] Seq=12560269 Ack=228704413 Win=65535 Len=0
1,10.903048000000126,54.93.77.70,10.0.2.15,TLSv1.2,778,Application Data
1,10.905937999999878,54.93.77.70,10.0.2.15,TCP,2950,"9001  >  34692 [PSH, ACK] Seq=228705137 Ack=12560269 Win=65535 Len=2896 [TCP segment of a reassembled PDU]"
1,10.905996999999843,10.0.2.15,54.93.77.70,TCP,54,34692  >  9001 [ACK] Seq=12560269 Ack=228708033 Win=65535 Len=0
1,10.907169999999496,54.93.77.70,10.0.2.15,TLSv1.2,7294,"Application Data, Application Data, Application Data, Application Data"
1,10.907247999999527,10.0.2.15,54.93.77.70,TCP,54,34692  >  9001 [ACK] Seq=12560269 Ack=228715273 Win=65535 Len=0
1,10.922377999999298,54.93.77.70,10.0.2.15,TLSv1.2,2950,Application Data [TCP segment of a reassembled PDU]
1,10.922432999999728,10.0.2.15,54.93.77.70,TCP,54,34692  >  9001 [ACK] Seq=12560269 Ack=228718169 Win=65535 Len=0
1,10.925378999999339,54.93.77.70,10.0.2.15,TCP,1502,"9001  >  34692 [PSH, ACK] Seq=228718169 Ack=12560269 Win=65535 Len=1448 [TCP segment of a reassembled PDU]"
1,10.925436999999874,10.0.2.15,54.93.77.70,TCP,54,34692  >  9001 [ACK] Seq=12560269 Ack=228719617 Win=65535 Len=0
1,10.925859999999375,54.93.77.70,10.0.2.15,TLSv1.2,612,Application Data
1,10.928839000000153,10.0.2.15,54.93.77.70,TLSv1.2,590,Application Data
1,10.92901299999994,54.93.77.70,10.0.2.15,TCP,60,9001  >  34692 [ACK] Seq=228720175 Ack=12560805 Win=65535 Len=0
1,11.058105000000069,62.210.85.178,10.0.2.15,TLSv1.2,590,Application Data
1,11.058602999999493,10.0.2.15,62.210.85.178,TLSv1.2,590,Application Data
1,11.058712000000014,62.210.85.178,10.0.2.15,TCP,60,9001  >  35978 [ACK] Seq=12498139 Ack=228832607 Win=65535 Len=0
1,11.459289999999783,54.93.77.70,10.0.2.15,TLSv1.2,590,Application Data
1,11.459675000000061,10.0.2.15,54.93.77.70,TLSv1.2,590,Application Data
1,11.459774999999354,54.93.77.70,10.0.2.15,TCP,60,9001  >  34692 [ACK] Seq=228720711 Ack=12561341 Win=65535 Len=0
1,11.57653399999981,62.210.85.178,10.0.2.15,TLSv1.2,590,Application Data
1,11.581983999999466,10.0.2.15,62.210.85.178,TLSv1.2,590,Application Data
1,11.58213699999942,62.210.85.178,10.0.2.15,TCP,60,9001  >  35978 [ACK] Seq=12498675 Ack=228833143 Win=65535 Len=0
1,11.592345000000023,10.0.2.15,62.210.85.178,TLSv1.2,4124,Application Data
1,11.5924329999998,10.0.2.15,62.210.85.178,TCP,2974,35978  >  9001 [ACK] Seq=228837213 Ack=12498675 Win=65535 Len=2920 [TCP segment of a reassembled PDU]
1,11.592483999999786,62.210.85.178,10.0.2.15,TCP,60,9001  >  35978 [ACK] Seq=12498675 Ack=228834603 Win=65535 Len=0
1,11.592494999999872,62.210.85.178,10.0.2.15,TCP,60,9001  >  35978 [ACK] Seq=12498675 Ack=228836063 Win=65535 Len=0
1,11.592499999999745,62.210.85.178,10.0.2.15,TCP,60,9001  >  35978 [ACK] Seq=12498675 Ack=228837213 Win=65535 Len=0
1,11.59250399999928,62.210.85.178,10.0.2.15,TCP,60,9001  >  35978 [ACK] Seq=12498675 Ack=228838673 Win=65535 Len=0
1,11.592506999999387,62.210.85.178,10.0.2.15,TCP,60,9001  >  35978 [ACK] Seq=12498675 Ack=228840133 Win=65535 Len=0
1,11.592540999999983,10.0.2.15,62.210.85.178,TLSv1.2,1204,Application Data
1,11.59259799999927,62.210.85.178,10.0.2.15,TCP,60,9001  >  35978 [ACK] Seq=12498675 Ack=228841283 Win=65535 Len=0
1,11.592655999999806,10.0.2.15,62.210.85.178,TLSv1.2,4124,Application Data
1,11.59271600000011,62.210.85.178,10.0.2.15,TCP,60,9001  >  35978 [ACK] Seq=12498675 Ack=228842743 Win=65535 Len=0
1,11.592724999999518,62.210.85.178,10.0.2.15,TCP,60,9001  >  35978 [ACK] Seq=12498675 Ack=228844203 Win=65535 Len=0
1,11.592727999999624,62.210.85.178,10.0.2.15,TCP,60,9001  >  35978 [ACK] Seq=12498675 Ack=228845353 Win=65535 Len=0
1,11.592784999999822,10.0.2.15,62.210.85.178,TLSv1.2,4124,Application Data
1,11.592823999999382,62.210.85.178,10.0.2.15,TCP,60,9001  >  35978 [ACK] Seq=12498675 Ack=228846813 Win=65535 Len=0
1,11.592830999999933,62.210.85.178,10.0.2.15,TCP,60,9001  >  35978 [ACK] Seq=12498675 Ack=228848273 Win=65535 Len=0
1,11.592896999999539,10.0.2.15,62.210.85.178,TLSv1.2,2974,Application Data
1,11.592931999999564,62.210.85.178,10.0.2.15,TCP,60,9001  >  35978 [ACK] Seq=12498675 Ack=228849423 Win=65535 Len=0
1,11.592941999999312,62.210.85.178,10.0.2.15,TCP,60,9001  >  35978 [ACK] Seq=12498675 Ack=228850883 Win=65535 Len=0
1,11.592944999999418,62.210.85.178,10.0.2.15,TCP,60,9001  >  35978 [ACK] Seq=12498675 Ack=228852343 Win=65535 Len=0
1,11.592971999999463,10.0.2.15,62.210.85.178,TLSv1.2,1226,Application Data
1,11.593004999999721,62.210.85.178,10.0.2.15,TCP,60,9001  >  35978 [ACK] Seq=12498675 Ack=228853515 Win=65535 Len=0
1,11.593043999999281,10.0.2.15,62.210.85.178,TLSv1.2,4124,Application Data
1,11.593078999999307,62.210.85.178,10.0.2.15,TCP,60,9001  >  35978 [ACK] Seq=12498675 Ack=228854975 Win=65535 Len=0
1,11.593085999999857,62.210.85.178,10.0.2.15,TCP,60,9001  >  35978 [ACK] Seq=12498675 Ack=228856435 Win=65535 Len=0
1,11.593087999999625,62.210.85.178,10.0.2.15,TCP,60,9001  >  35978 [ACK] Seq=12498675 Ack=228857585 Win=65535 Len=0
1,11.593124999999418,10.0.2.15,62.210.85.178,TLSv1.2,3030,Application Data
1,11.593159000000014,62.210.85.178,10.0.2.15,TCP,60,9001  >  35978 [ACK] Seq=12498675 Ack=228859045 Win=65535 Len=0
1,11.593164999999317,62.210.85.178,10.0.2.15,TCP,60,9001  >  35978 [ACK] Seq=12498675 Ack=228860505 Win=65535 Len=0
1,11.593167999999423,62.210.85.178,10.0.2.15,TCP,60,9001  >  35978 [ACK] Seq=12498675 Ack=228860561 Win=65535 Len=0
1,11.604478999999628,10.0.2.15,62.210.85.178,TLSv1.2,4124,Application Data
1,11.604543999999805,62.210.85.178,10.0.2.15,TCP,60,9001  >  35978 [ACK] Seq=12498675 Ack=228862021 Win=65535 Len=0
1,11.604551999999785,62.210.85.178,10.0.2.15,TCP,60,9001  >  35978 [ACK] Seq=12498675 Ack=228863481 Win=65535 Len=0
1,11.604554999999891,62.210.85.178,10.0.2.15,TCP,60,9001  >  35978 [ACK] Seq=12498675 Ack=228864631 Win=65535 Len=0
1,11.604590999999346,10.0.2.15,62.210.85.178,TLSv1.2,4124,Application Data
1,11.604640999999901,62.210.85.178,10.0.2.15,TCP,60,9001  >  35978 [ACK] Seq=12498675 Ack=228866091 Win=65535 Len=0
1,11.604647999999543,62.210.85.178,10.0.2.15,TCP,60,9001  >  35978 [ACK] Seq=12498675 Ack=228867551 Win=65535 Len=0
1,11.604650999999649,62.210.85.178,10.0.2.15,TCP,60,9001  >  35978 [ACK] Seq=12498675 Ack=228868701 Win=65535 Len=0
1,11.604685999999674,10.0.2.15,62.210.85.178,TLSv1.2,4124,Application Data
1,11.604718999999932,62.210.85.178,10.0.2.15,TCP,60,9001  >  35978 [ACK] Seq=12498675 Ack=228870161 Win=65535 Len=0
1,11.604726999999912,62.210.85.178,10.0.2.15,TCP,60,9001  >  35978 [ACK] Seq=12498675 Ack=228871621 Win=65535 Len=0
1,11.604730999999447,62.210.85.178,10.0.2.15,TCP,60,9001  >  35978 [ACK] Seq=12498675 Ack=228872771 Win=65535 Len=0
1,11.604773000000023,10.0.2.15,62.210.85.178,TLSv1.2,4124,Application Data
1,11.60480699999971,62.210.85.178,10.0.2.15,TCP,60,9001  >  35978 [ACK] Seq=12498675 Ack=228874231 Win=65535 Len=0
1,11.60481499999969,62.210.85.178,10.0.2.15,TCP,60,9001  >  35978 [ACK] Seq=12498675 Ack=228875691 Win=65535 Len=0
1,11.604819000000134,62.210.85.178,10.0.2.15,TCP,60,9001  >  35978 [ACK] Seq=12498675 Ack=228876841 Win=65535 Len=0
1,11.604852999999821,10.0.2.15,62.210.85.178,TLSv1.2,332,Application Data
1,11.604886000000079,62.210.85.178,10.0.2.15,TCP,60,9001  >  35978 [ACK] Seq=12498675 Ack=228877119 Win=65535 Len=0
1,11.604933999999957,10.0.2.15,62.210.85.178,TLSv1.2,3868,Application Data
1,11.604969999999412,62.210.85.178,10.0.2.15,TCP,60,9001  >  35978 [ACK] Seq=12498675 Ack=228878579 Win=65535 Len=0
1,11.604976999999963,62.210.85.178,10.0.2.15,TCP,60,9001  >  35978 [ACK] Seq=12498675 Ack=228880039 Win=65535 Len=0
1,11.604980000000069,62.210.85.178,10.0.2.15,TCP,60,9001  >  35978 [ACK] Seq=12498675 Ack=228880933 Win=65535 Len=0
1,11.605016999999862,10.0.2.15,62.210.85.178,TLSv1.2,4124,Application Data
1,11.605050999999548,62.210.85.178,10.0.2.15,TCP,60,9001  >  35978 [ACK] Seq=12498675 Ack=228882393 Win=65535 Len=0
1,11.6050580000001,62.210.85.178,10.0.2.15,TCP,60,9001  >  35978 [ACK] Seq=12498675 Ack=228883853 Win=65535 Len=0
1,11.605060999999296,62.210.85.178,10.0.2.15,TCP,60,9001  >  35978 [ACK] Seq=12498675 Ack=228885003 Win=65535 Len=0
1,11.605098999999427,10.0.2.15,62.210.85.178,TLSv1.2,3030,Application Data
1,11.605133000000023,62.210.85.178,10.0.2.15,TCP,60,9001  >  35978 [ACK] Seq=12498675 Ack=228886463 Win=65535 Len=0
1,11.605138999999326,62.210.85.178,10.0.2.15,TCP,60,9001  >  35978 [ACK] Seq=12498675 Ack=228887923 Win=65535 Len=0
1,11.60514299999977,62.210.85.178,10.0.2.15,TCP,60,9001  >  35978 [ACK] Seq=12498675 Ack=228887979 Win=65535 Len=0
1,11.616596999999274,10.0.2.15,62.210.85.178,TLSv1.2,4124,Application Data
1,11.61669399999937,62.210.85.178,10.0.2.15,TCP,60,9001  >  35978 [ACK] Seq=12498675 Ack=228889439 Win=65535 Len=0
1,11.616704000000027,62.210.85.178,10.0.2.15,TCP,60,9001  >  35978 [ACK] Seq=12498675 Ack=228890899 Win=65535 Len=0
1,11.616707000000133,62.210.85.178,10.0.2.15,TCP,60,9001  >  35978 [ACK] Seq=12498675 Ack=228892049 Win=65535 Len=0
1,11.616743999999926,10.0.2.15,62.210.85.178,TLSv1.2,140,Application Data
1,11.616783999999825,62.210.85.178,10.0.2.15,TCP,60,9001  >  35978 [ACK] Seq=12498675 Ack=228892135 Win=65535 Len=0
1,11.70082099999945,54.93.77.70,10.0.2.15,TCP,2950,"9001  >  34692 [PSH, ACK] Seq=228720711 Ack=12561341 Win=65535 Len=2896 [TCP segment of a reassembled PDU]"
1,11.7009309999994,10.0.2.15,54.93.77.70,TCP,54,34692  >  9001 [ACK] Seq=12561341 Ack=228723607 Win=65535 Len=0
1,11.701261000000159,54.93.77.70,10.0.2.15,TLSv1.2,778,Application Data
1,11.744311999999809,10.0.2.15,54.93.77.70,TCP,54,34692  >  9001 [ACK] Seq=12561341 Ack=228724331 Win=65535 Len=0
1,11.780772999999499,54.93.77.70,10.0.2.15,TCP,2950,"9001  >  34692 [PSH, ACK] Seq=228724331 Ack=12561341 Win=65535 Len=2896 [TCP segment of a reassembled PDU]"
1,11.780847999999423,10.0.2.15,54.93.77.70,TCP,54,34692  >  9001 [ACK] Seq=12561341 Ack=228727227 Win=65535 Len=0
1,11.780893000000106,54.93.77.70,10.0.2.15,TLSv1.2,778,Application Data
1,11.780920000000151,10.0.2.15,54.93.77.70,TCP,54,34692  >  9001 [ACK] Seq=12561341 Ack=228727951 Win=65535 Len=0
1,11.798909000000094,54.93.77.70,10.0.2.15,TLSv1.2,3674,Application Data
1,11.798963999999614,10.0.2.15,54.93.77.70,TCP,54,34692  >  9001 [ACK] Seq=12561341 Ack=228731571 Win=65535 Len=0
1,11.799121000000014,10.0.2.15,54.93.77.70,TLSv1.2,590,Application Data
1,11.799193999999261,54.93.77.70,10.0.2.15,TCP,60,9001  >  34692 [ACK] Seq=228731571 Ack=12561877 Win=65535 Len=0
1,11.80926399999953,54.93.77.70,10.0.2.15,TCP,2950,"9001  >  34692 [PSH, ACK] Seq=228731571 Ack=12561877 Win=65535 Len=2896 [TCP segment of a reassembled PDU]"
1,11.809346999999434,10.0.2.15,54.93.77.70,TCP,54,34692  >  9001 [ACK] Seq=12561877 Ack=228734467 Win=65535 Len=0
1,11.81616699999995,54.93.77.70,10.0.2.15,TLSv1.2,778,Application Data
1,11.831360000000132,54.93.77.70,10.0.2.15,TLSv1.2,2950,Application Data
1,11.831376000000091,54.93.77.70,10.0.2.15,TCP,1502,"9001  >  34692 [PSH, ACK] Seq=228738087 Ack=12561877 Win=65535 Len=1448 [TCP segment of a reassembled PDU]"
1,11.831409999999778,10.0.2.15,54.93.77.70,TCP,54,34692  >  9001 [ACK] Seq=12561877 Ack=228738087 Win=65535 Len=0
1,11.83148600000004,10.0.2.15,54.93.77.70,TCP,54,34692  >  9001 [ACK] Seq=12561877 Ack=228739535 Win=65535 Len=0
1,11.840306999999484,54.93.77.70,10.0.2.15,TLSv1.2,2950,Application Data [TCP segment of a reassembled PDU]
1,11.840376999999535,10.0.2.15,54.93.77.70,TCP,54,34692  >  9001 [ACK] Seq=12561877 Ack=228742431 Win=65535 Len=0
1,11.84087399999953,54.93.77.70,10.0.2.15,TLSv1.2,4398,"Application Data, Application Data"
1,11.84093699999994,10.0.2.15,54.93.77.70,TCP,54,34692  >  9001 [ACK] Seq=12561877 Ack=228746775 Win=65535 Len=0
1,11.84918800000014,54.93.77.70,10.0.2.15,TLSv1.2,1430,Application Data
1,11.849445999999261,10.0.2.15,54.93.77.70,TLSv1.2,590,Application Data
1,11.849577999999383,54.93.77.70,10.0.2.15,TCP,60,9001  >  34692 [ACK] Seq=228748151 Ack=12562413 Win=65535 Len=0
1,11.856883999999809,54.93.77.70,10.0.2.15,TCP,2950,"9001  >  34692 [PSH, ACK] Seq=228748151 Ack=12562413 Win=65535 Len=2896 [TCP segment of a reassembled PDU]"
1,11.85690599999998,54.93.77.70,10.0.2.15,TLSv1.2,2950,Application Data [TCP segment of a reassembled PDU]
1,11.856984000000011,10.0.2.15,54.93.77.70,TCP,54,34692  >  9001 [ACK] Seq=12562413 Ack=228753943 Win=65535 Len=0
1,11.857242000000042,54.93.77.70,10.0.2.15,TCP,1502,"9001  >  34692 [PSH, ACK] Seq=228753943 Ack=12562413 Win=65535 Len=1448 [TCP segment of a reassembled PDU]"
1,11.857286999999815,10.0.2.15,54.93.77.70,TCP,54,34692  >  9001 [ACK] Seq=12562413 Ack=228755391 Win=65535 Len=0
1,11.859333999999762,54.93.77.70,10.0.2.15,TLSv1.2,4398,Application Data [TCP segment of a reassembled PDU]
1,11.859402999999475,10.0.2.15,54.93.77.70,TCP,54,34692  >  9001 [ACK] Seq=12562413 Ack=228759735 Win=65535 Len=0
1,11.866563999999926,54.93.77.70,10.0.2.15,TLSv1.2,358,Application Data
1,11.867465999999695,54.93.77.70,10.0.2.15,TCP,2950,"9001  >  34692 [PSH, ACK] Seq=228760039 Ack=12562413 Win=65535 Len=2896 [TCP segment of a reassembled PDU]"
1,11.867510000000038,10.0.2.15,54.93.77.70,TCP,54,34692  >  9001 [ACK] Seq=12562413 Ack=228762935 Win=65535 Len=0
1,11.878735999999662,54.93.77.70,10.0.2.15,TLSv1.2,7294,"Application Data, Application Data, Application Data"
1,11.878797999999733,10.0.2.15,54.93.77.70,TCP,54,34692  >  9001 [ACK] Seq=12562413 Ack=228770175 Win=65535 Len=0
1,11.884146999999757,54.93.77.70,10.0.2.15,TLSv1.2,1314,Application Data
1,11.901183999999375,62.210.85.178,10.0.2.15,TLSv1.2,590,Application Data
1,11.912104,54.93.77.70,10.0.2.15,TLSv1.2,5846,Application Data
1,11.91215800000009,10.0.2.15,54.93.77.70,TCP,54,34692  >  9001 [ACK] Seq=12562413 Ack=228777227 Win=65535 Len=0
1,11.91233000000011,10.0.2.15,54.93.77.70,TLSv1.2,590,Application Data
1,11.912408000000141,54.93.77.70,10.0.2.15,TCP,60,9001  >  34692 [ACK] Seq=228777227 Ack=12562949 Win=65535 Len=0
1,11.931102999999894,54.93.77.70,10.0.2.15,TLSv1.2,474,Application Data
1,11.944284999999581,10.0.2.15,62.210.85.178,TCP,54,35978  >  9001 [ACK] Seq=228892135 Ack=12499211 Win=65535 Len=0
1,11.947844999999688,54.93.77.70,10.0.2.15,TCP,1502,"9001  >  34692 [PSH, ACK] Seq=228777647 Ack=12562949 Win=65535 Len=1448 [TCP segment of a reassembled PDU]"
1,11.947889000000032,10.0.2.15,54.93.77.70,TCP,54,34692  >  9001 [ACK] Seq=12562949 Ack=228779095 Win=65535 Len=0
1,11.9644789999993,54.93.77.70,10.0.2.15,TLSv1.2,1198,Application Data
1,11.966949999999997,10.0.2.15,54.93.77.70,TLSv1.2,590,Application Data
1,11.967102999999952,54.93.77.70,10.0.2.15,TCP,60,9001  >  34692 [ACK] Seq=228780239 Ack=12563485 Win=65535 Len=0
1,11.974887999999737,62.210.85.178,10.0.2.15,TLSv1.2,590,Application Data
1,11.97493200000008,10.0.2.15,62.210.85.178,TCP,54,35978  >  9001 [ACK] Seq=228892135 Ack=12499747 Win=65535 Len=0
1,12.038270000000011,62.210.85.178,10.0.2.15,TLSv1.2,590,Application Data
1,12.038345999999365,10.0.2.15,62.210.85.178,TCP,54,35978  >  9001 [ACK] Seq=228892135 Ack=12500283 Win=65535 Len=0
1,12.247475000000122,62.210.85.178,10.0.2.15,TLSv1.2,590,Application Data
1,12.247550000000047,10.0.2.15,62.210.85.178,TCP,54,35978  >  9001 [ACK] Seq=228892135 Ack=12500819 Win=65535 Len=0
1,12.248007999999572,10.0.2.15,62.210.85.178,TLSv1.2,590,Application Data
1,12.24811199999931,62.210.85.178,10.0.2.15,TCP,60,9001  >  35978 [ACK] Seq=12500819 Ack=228892671 Win=65535 Len=0
1,12.688639999999396,54.93.77.70,10.0.2.15,TLSv1.2,590,Application Data
1,12.689021000000139,10.0.2.15,54.93.77.70,TLSv1.2,590,Application Data
1,12.689125999999305,54.93.77.70,10.0.2.15,TCP,60,9001  >  34692 [ACK] Seq=228780775 Ack=12564021 Win=65535 Len=0
1,12.891546999999264,62.210.85.178,10.0.2.15,TLSv1.2,590,Application Data
1,12.897135999999591,10.0.2.15,62.210.85.178,TLSv1.2,590,Application Data
1,12.897272000000157,62.210.85.178,10.0.2.15,TCP,60,9001  >  35978 [ACK] Seq=12501355 Ack=228893207 Win=65535 Len=0
1,12.908579999999347,10.0.2.15,62.210.85.178,TLSv1.2,4124,Application Data
1,12.908688999999868,10.0.2.15,62.210.85.178,TCP,2974,35978  >  9001 [ACK] Seq=228897277 Ack=12501355 Win=65535 Len=2920 [TCP segment of a reassembled PDU]
1,12.9087499999996,62.210.85.178,10.0.2.15,TCP,60,9001  >  35978 [ACK] Seq=12501355 Ack=228894667 Win=65535 Len=0
1,12.908770000000004,62.210.85.178,10.0.2.15,TCP,60,9001  >  35978 [ACK] Seq=12501355 Ack=228896127 Win=65535 Len=0
1,12.908775999999307,62.210.85.178,10.0.2.15,TCP,60,9001  >  35978 [ACK] Seq=12501355 Ack=228897277 Win=65535 Len=0
1,12.90878100000009,62.210.85.178,10.0.2.15,TCP,60,9001  >  35978 [ACK] Seq=12501355 Ack=228898737 Win=65535 Len=0
1,12.908824999999524,10.0.2.15,62.210.85.178,TLSv1.2,1204,Application Data
1,12.908863999999994,62.210.85.178,10.0.2.15,TCP,60,9001  >  35978 [ACK] Seq=12501355 Ack=228900197 Win=65535 Len=0
1,12.908926000000065,10.0.2.15,62.210.85.178,TCP,2974,35978  >  9001 [ACK] Seq=228901347 Ack=12501355 Win=65535 Len=2920 [TCP segment of a reassembled PDU]
1,12.909012000000075,62.210.85.178,10.0.2.15,TCP,60,9001  >  35978 [ACK] Seq=12501355 Ack=228901347 Win=65535 Len=0
1,12.909025999999358,62.210.85.178,10.0.2.15,TCP,60,9001  >  35978 [ACK] Seq=12501355 Ack=228902807 Win=65535 Len=0
1,12.90903199999957,62.210.85.178,10.0.2.15,TCP,60,9001  >  35978 [ACK] Seq=12501355 Ack=228904267 Win=65535 Len=0
1,12.909067999999934,10.0.2.15,62.210.85.178,TLSv1.2,1204,Application Data
1,12.909136999999646,10.0.2.15,62.210.85.178,TCP,2974,35978  >  9001 [ACK] Seq=228905417 Ack=12501355 Win=65535 Len=2920 [TCP segment of a reassembled PDU]
1,12.909174999999777,62.210.85.178,10.0.2.15,TCP,60,9001  >  35978 [ACK] Seq=12501355 Ack=228905417 Win=65535 Len=0
1,12.909181999999419,62.210.85.178,10.0.2.15,TCP,60,9001  >  35978 [ACK] Seq=12501355 Ack=228906877 Win=65535 Len=0
1,12.909184999999525,62.210.85.178,10.0.2.15,TCP,60,9001  >  35978 [ACK] Seq=12501355 Ack=228908337 Win=65535 Len=0
1,12.909209999999803,10.0.2.15,62.210.85.178,TLSv1.2,1204,Application Data
1,12.909275999999409,62.210.85.178,10.0.2.15,TCP,60,9001  >  35978 [ACK] Seq=12501355 Ack=228909487 Win=65535 Len=0
1,12.90932199999952,10.0.2.15,62.210.85.178,TLSv1.2,332,Application Data
1,12.909442000000126,10.0.2.15,62.210.85.178,TCP,2974,35978  >  9001 [ACK] Seq=228909765 Ack=12501355 Win=65535 Len=2920 [TCP segment of a reassembled PDU]
1,12.909483999999793,62.210.85.178,10.0.2.15,TCP,60,9001  >  35978 [ACK] Seq=12501355 Ack=228909765 Win=65535 Len=0
1,12.909493000000111,62.210.85.178,10.0.2.15,TCP,60,9001  >  35978 [ACK] Seq=12501355 Ack=228911225 Win=65535 Len=0
1,12.909496999999647,62.210.85.178,10.0.2.15,TCP,60,9001  >  35978 [ACK] Seq=12501355 Ack=228912685 Win=65535 Len=0
1,12.909522999999353,10.0.2.15,62.210.85.178,TLSv1.2,948,Application Data
1,12.909554999999273,62.210.85.178,10.0.2.15,TCP,60,9001  >  35978 [ACK] Seq=12501355 Ack=228913579 Win=65535 Len=0
1,12.909593999999743,10.0.2.15,62.210.85.178,TLSv1.2,4124,Application Data
1,12.909628999999768,62.210.85.178,10.0.2.15,TCP,60,9001  >  35978 [ACK] Seq=12501355 Ack=228915039 Win=65535 Len=0
1,12.90963599999941,62.210.85.178,10.0.2.15,TCP,60,9001  >  35978 [ACK] Seq=12501355 Ack=228916499 Win=65535 Len=0
1,12.909638999999515,62.210.85.178,10.0.2.15,TCP,60,9001  >  35978 [ACK] Seq=12501355 Ack=228917649 Win=65535 Len=0
1,12.90967499999988,10.0.2.15,62.210.85.178,TLSv1.2,3030,Application Data
1,12.909709999999905,62.210.85.178,10.0.2.15,TCP,60,9001  >  35978 [ACK] Seq=12501355 Ack=228919109 Win=65535 Len=0
1,12.909716000000117,62.210.85.178,10.0.2.15,TCP,60,9001  >  35978 [ACK] Seq=12501355 Ack=228920569 Win=65535 Len=0
1,12.909718999999313,62.210.85.178,10.0.2.15,TCP,60,9001  >  35978 [ACK] Seq=12501355 Ack=228920625 Win=65535 Len=0
1,12.921163999999408,10.0.2.15,62.210.85.178,TLSv1.2,4124,Application Data
1,12.921248999999989,62.210.85.178,10.0.2.15,TCP,60,9001  >  35978 [ACK] Seq=12501355 Ack=228922085 Win=65535 Len=0
1,12.921258999999736,62.210.85.178,10.0.2.15,TCP,60,9001  >  35978 [ACK] Seq=12501355 Ack=228923545 Win=65535 Len=0
1,12.921261999999842,62.210.85.178,10.0.2.15,TCP,60,9001  >  35978 [ACK] Seq=12501355 Ack=228924695 Win=65535 Len=0
1,12.921300999999403,10.0.2.15,62.210.85.178,TLSv1.2,4124,Application Data
1,12.92136500000015,62.210.85.178,10.0.2.15,TCP,60,9001  >  35978 [ACK] Seq=12501355 Ack=228926155 Win=65535 Len=0
1,12.921371999999792,62.210.85.178,10.0.2.15,TCP,60,9001  >  35978 [ACK] Seq=12501355 Ack=228927615 Win=65535 Len=0
1,12.921374999999898,62.210.85.178,10.0.2.15,TCP,60,9001  >  35978 [ACK] Seq=12501355 Ack=228928765 Win=65535 Len=0
1,12.921409999999923,10.0.2.15,62.210.85.178,TLSv1.2,4124,Application Data
1,12.921442999999272,62.210.85.178,10.0.2.15,TCP,60,9001  >  35978 [ACK] Seq=12501355 Ack=228930225 Win=65535 Len=0
1,12.921450999999252,62.210.85.178,10.0.2.15,TCP,60,9001  >  35978 [ACK] Seq=12501355 Ack=228931685 Win=65535 Len=0
1,12.921453999999358,62.210.85.178,10.0.2.15,TCP,60,9001  >  35978 [ACK] Seq=12501355 Ack=228932835 Win=65535 Len=0
1,12.921488999999383,10.0.2.15,62.210.85.178,TLSv1.2,4124,Application Data
1,12.92152299999998,62.210.85.178,10.0.2.15,TCP,60,9001  >  35978 [ACK] Seq=12501355 Ack=228934295 Win=65535 Len=0
1,12.92152999999962,62.210.85.178,10.0.2.15,TCP,60,9001  >  35978 [ACK] Seq=12501355 Ack=228935755 Win=65535 Len=0
1,12.921534000000065,62.210.85.178,10.0.2.15,TCP,60,9001  >  35978 [ACK] Seq=12501355 Ack=228936905 Win=65535 Len=0
1,12.921567999999752,10.0.2.15,62.210.85.178,TLSv1.2,332,Application Data
1,12.92160100000001,62.210.85.178,10.0.2.15,TCP,60,9001  >  35978 [ACK] Seq=12501355 Ack=228937183 Win=65535 Len=0
1,12.921651999999995,10.0.2.15,62.210.85.178,TLSv1.2,3868,Application Data
1,12.921687999999449,62.210.85.178,10.0.2.15,TCP,60,9001  >  35978 [ACK] Seq=12501355 Ack=228938643 Win=65535 Len=0
1,12.921695,62.210.85.178,10.0.2.15,TCP,60,9001  >  35978 [ACK] Seq=12501355 Ack=228940103 Win=65535 Len=0
1,12.921698000000106,62.210.85.178,10.0.2.15,TCP,60,9001  >  35978 [ACK] Seq=12501355 Ack=228940997 Win=65535 Len=0
1,12.921734999999899,10.0.2.15,62.210.85.178,TLSv1.2,4124,Application Data
1,12.921770999999353,62.210.85.178,10.0.2.15,TCP,60,9001  >  35978 [ACK] Seq=12501355 Ack=228942457 Win=65535 Len=0
1,12.921776999999565,62.210.85.178,10.0.2.15,TCP,60,9001  >  35978 [ACK] Seq=12501355 Ack=228943917 Win=65535 Len=0
1,12.921779999999671,62.210.85.178,10.0.2.15,TCP,60,9001  >  35978 [ACK] Seq=12501355 Ack=228945067 Win=65535 Len=0
1,12.921814999999697,10.0.2.15,62.210.85.178,TLSv1.2,3030,Application Data
1,12.921848999999384,62.210.85.178,10.0.2.15,TCP,60,9001  >  35978 [ACK] Seq=12501355 Ack=228946527 Win=65535 Len=0
1,12.921854999999596,62.210.85.178,10.0.2.15,TCP,60,9001  >  35978 [ACK] Seq=12501355 Ack=228947987 Win=65535 Len=0
1,12.921857999999702,62.210.85.178,10.0.2.15,TCP,60,9001  >  35978 [ACK] Seq=12501355 Ack=228948043 Win=65535 Len=0
1,12.933269999999538,10.0.2.15,62.210.85.178,TLSv1.2,4124,Application Data
1,12.933357999999316,62.210.85.178,10.0.2.15,TCP,60,9001  >  35978 [ACK] Seq=12501355 Ack=228949503 Win=65535 Len=0
1,12.93336999999974,62.210.85.178,10.0.2.15,TCP,60,9001  >  35978 [ACK] Seq=12501355 Ack=228950963 Win=65535 Len=0
1,12.933372999999847,62.210.85.178,10.0.2.15,TCP,60,9001  >  35978 [ACK] Seq=12501355 Ack=228952113 Win=65535 Len=0
1,12.933412999999746,10.0.2.15,62.210.85.178,TLSv1.2,4124,Application Data
1,12.93344900000011,62.210.85.178,10.0.2.15,TCP,60,9001  >  35978 [ACK] Seq=12501355 Ack=228953573 Win=65535 Len=0
1,12.93345700000009,62.210.85.178,10.0.2.15,TCP,60,9001  >  35978 [ACK] Seq=12501355 Ack=228955033 Win=65535 Len=0
1,12.933460999999625,62.210.85.178,10.0.2.15,TCP,60,9001  >  35978 [ACK] Seq=12501355 Ack=228956183 Win=65535 Len=0
1,12.933496999999988,10.0.2.15,62.210.85.178,TLSv1.2,204,Application Data
1,12.933529999999337,62.210.85.178,10.0.2.15,TCP,60,9001  >  35978 [ACK] Seq=12501355 Ack=228956333 Win=65535 Len=0
1,13.025281999999606,54.93.77.70,10.0.2.15,TCP,2950,"9001  >  34692 [PSH, ACK] Seq=228780775 Ack=12564021 Win=65535 Len=2896 [TCP segment of a reassembled PDU]"
1,13.02541999999994,10.0.2.15,54.93.77.70,TCP,54,34692  >  9001 [ACK] Seq=12564021 Ack=228783671 Win=65535 Len=0
1,13.025720999999976,54.93.77.70,10.0.2.15,TLSv1.2,778,Application Data
1,13.025899999999638,10.0.2.15,54.93.77.70,TLSv1.2,590,Application Data
1,13.025974000000133,54.93.77.70,10.0.2.15,TCP,60,9001  >  34692 [ACK] Seq=228784395 Ack=12564557 Win=65535 Len=0
1,13.033497999999781,54.93.77.70,10.0.2.15,TCP,2950,"9001  >  34692 [PSH, ACK] Seq=228784395 Ack=12564557 Win=65535 Len=2896 [TCP segment of a reassembled PDU]"
1,13.033517999999276,54.93.77.70,10.0.2.15,TLSv1.2,4398,Application Data [TCP segment of a reassembled PDU]
1,13.033583999999792,10.0.2.15,54.93.77.70,TCP,54,34692  >  9001 [ACK] Seq=12564557 Ack=228791635 Win=65535 Len=0
1,13.041438999999627,54.93.77.70,10.0.2.15,TLSv1.2,568,Application Data
1,13.058492999999544,54.93.77.70,10.0.2.15,TLSv1.2,1104,Application Data
1,13.058575999999448,10.0.2.15,54.93.77.70,TCP,54,34692  >  9001 [ACK] Seq=12564557 Ack=228793199 Win=65535 Len=0
1,13.081577999999354,54.93.77.70,10.0.2.15,TCP,2950,"9001  >  34692 [PSH, ACK] Seq=228793199 Ack=12564557 Win=65535 Len=2896 [TCP segment of a reassembled PDU]"
1,13.081675999999788,10.0.2.15,54.93.77.70,TCP,54,34692  >  9001 [ACK] Seq=12564557 Ack=228796095 Win=65535 Len=0
1,13.081720999999561,54.93.77.70,10.0.2.15,TLSv1.2,778,Application Data
1,13.092189999999391,54.93.77.70,10.0.2.15,TCP,2950,"9001  >  34692 [PSH, ACK] Seq=228796819 Ack=12564557 Win=65535 Len=2896 [TCP segment of a reassembled PDU]"
1,13.092230999999629,10.0.2.15,54.93.77.70,TCP,54,34692  >  9001 [ACK] Seq=12564557 Ack=228799715 Win=65535 Len=0
1,13.093267999999625,54.93.77.70,10.0.2.15,TLSv1.2,7294,"Application Data, Application Data"
1,13.093328999999358,10.0.2.15,54.93.77.70,TCP,54,34692  >  9001 [ACK] Seq=12564557 Ack=228806955 Win=65535 Len=0
1,13.095209000000068,54.93.77.70,10.0.2.15,TLSv1.2,5846,Application Data [TCP segment of a reassembled PDU]
1,13.095250999999735,10.0.2.15,54.93.77.70,TCP,54,34692  >  9001 [ACK] Seq=12564557 Ack=228812747 Win=65535 Len=0
1,13.09541099999933,10.0.2.15,54.93.77.70,TLSv1.2,590,Application Data
1,13.095488999999361,54.93.77.70,10.0.2.15,TCP,60,9001  >  34692 [ACK] Seq=228812747 Ack=12565093 Win=65535 Len=0
1,13.097357999999986,54.93.77.70,10.0.2.15,TLSv1.2,1502,"Application Data, Application Data"
1,13.097397999999885,10.0.2.15,54.93.77.70,TCP,54,34692  >  9001 [ACK] Seq=12565093 Ack=228814195 Win=65535 Len=0
1,13.098181999999724,54.93.77.70,10.0.2.15,TLSv1.2,1314,Application Data
1,13.114454999999907,54.93.77.70,10.0.2.15,TLSv1.2,1104,Application Data
1,13.114528000000064,10.0.2.15,54.93.77.70,TCP,54,34692  >  9001 [ACK] Seq=12565093 Ack=228816505 Win=65535 Len=0
1,13.128192999999555,54.93.77.70,10.0.2.15,TCP,2950,"9001  >  34692 [PSH, ACK] Seq=228816505 Ack=12565093 Win=65535 Len=2896 [TCP segment of a reassembled PDU]"
1,13.128276999999798,10.0.2.15,54.93.77.70,TCP,54,34692  >  9001 [ACK] Seq=12565093 Ack=228819401 Win=65535 Len=0
1,13.130456999999296,54.93.77.70,10.0.2.15,TLSv1.2,778,Application Data
1,13.146443999999974,54.93.77.70,10.0.2.15,TLSv1.2,2950,Application Data
1,13.146535999999287,10.0.2.15,54.93.77.70,TCP,54,34692  >  9001 [ACK] Seq=12565093 Ack=228823021 Win=65535 Len=0
1,13.146754999999757,54.93.77.70,10.0.2.15,TLSv1.2,1314,Application Data
1,13.155165000000125,54.93.77.70,10.0.2.15,TCP,2950,"9001  >  34692 [PSH, ACK] Seq=228824281 Ack=12565093 Win=65535 Len=2896 [TCP segment of a reassembled PDU]"
1,13.155197999999473,54.93.77.70,10.0.2.15,TLSv1.2,1502,Application Data [TCP segment of a reassembled PDU]
1,13.155243000000155,10.0.2.15,54.93.77.70,TCP,54,34692  >  9001 [ACK] Seq=12565093 Ack=228827177 Win=65535 Len=0
1,13.1553329999997,10.0.2.15,54.93.77.70,TCP,54,34692  >  9001 [ACK] Seq=12565093 Ack=228828625 Win=65535 Len=0
1,13.156285999999454,54.93.77.70,10.0.2.15,TLSv1.2,7294,Application Data [TCP segment of a reassembled PDU]
1,13.156361999999717,10.0.2.15,54.93.77.70,TCP,54,34692  >  9001 [ACK] Seq=12565093 Ack=228835865 Win=65535 Len=0
1,13.163017999999283,54.93.77.70,10.0.2.15,TLSv1.2,894,"Application Data, Application Data"
1,13.163195000000087,10.0.2.15,54.93.77.70,TLSv1.2,1104,Application Data
1,13.16327099999944,54.93.77.70,10.0.2.15,TCP,60,9001  >  34692 [ACK] Seq=228836705 Ack=12566143 Win=65535 Len=0
1,13.175637999999708,54.93.77.70,10.0.2.15,TCP,2950,"9001  >  34692 [PSH, ACK] Seq=228836705 Ack=12566143 Win=65535 Len=2896 [TCP segment of a reassembled PDU]"
1,13.17571399999997,10.0.2.15,54.93.77.70,TCP,54,34692  >  9001 [ACK] Seq=12566143 Ack=228839601 Win=65535 Len=0
1,13.17917099999977,54.93.77.70,10.0.2.15,TLSv1.2,778,Application Data
1,13.186769999999342,54.93.77.70,10.0.2.15,TCP,1502,"9001  >  34692 [PSH, ACK] Seq=228840325 Ack=12566143 Win=65535 Len=1448 [TCP segment of a reassembled PDU]"
1,13.186823999999433,10.0.2.15,54.93.77.70,TCP,54,34692  >  9001 [ACK] Seq=12566143 Ack=228841773 Win=65535 Len=0
1,13.203384999999798,54.93.77.70,10.0.2.15,TLSv1.2,2132,Application Data [TCP segment of a reassembled PDU]
1,13.203431999999339,10.0.2.15,54.93.77.70,TCP,54,34692  >  9001 [ACK] Seq=12566143 Ack=228843851 Win=65535 Len=0
1,13.22020799999973,54.93.77.70,10.0.2.15,TLSv1.2,684,Application Data
