No.,Time,Source,Destination,Protocol,Length,Info
1,0.018602000000100816,10.0.2.15,54.93.77.70,TCP,54,34692  >  9001 [ACK] Seq=13008837 Ack=236274089 Win=65535 Len=0
1,0.0721480000001975,62.210.85.178,10.0.2.15,TLSv1.2,590,Application Data
1,0.11859399999957532,10.0.2.15,62.210.85.178,TCP,54,35978  >  9001 [ACK] Seq=236366253 Ack=12921899 Win=65535 Len=0
1,0.13061000000016065,10.0.2.15,54.93.77.70,TLSv1.2,590,Application Data
1,0.13078200000018114,54.93.77.70,10.0.2.15,TCP,60,9001  >  34692 [ACK] Seq=236274089 Ack=13009373 Win=65535 Len=0
1,0.13517700000011246,62.210.85.178,10.0.2.15,TLSv1.2,1126,"Application Data, Application Data"
1,0.13522199999988516,10.0.2.15,62.210.85.178,TCP,54,35978  >  9001 [ACK] Seq=236366253 Ack=12922971 Win=65535 Len=0
1,0.2565580000000409,62.210.85.178,10.0.2.15,TLSv1.2,590,Application Data
1,0.256666000000223,10.0.2.15,62.210.85.178,TCP,54,35978  >  9001 [ACK] Seq=236366253 Ack=12923507 Win=65535 Len=0
1,0.2571459999999206,10.0.2.15,62.210.85.178,TLSv1.2,590,Application Data
1,0.25724300000001676,62.210.85.178,10.0.2.15,TCP,60,9001  >  35978 [ACK] Seq=12923507 Ack=236366789 Win=65535 Len=0
1,0.6336709999995946,54.93.77.70,10.0.2.15,TLSv1.2,590,Application Data
1,0.633748000000196,10.0.2.15,54.93.77.70,TCP,54,34692  >  9001 [ACK] Seq=13009373 Ack=236274625 Win=65535 Len=0
1,0.6341330000004746,10.0.2.15,54.93.77.70,TLSv1.2,1618,Application Data
1,0.6342439999998533,54.93.77.70,10.0.2.15,TCP,60,9001  >  34692 [ACK] Seq=236274625 Ack=13010833 Win=65535 Len=0
1,0.6342549999999392,54.93.77.70,10.0.2.15,TCP,60,9001  >  34692 [ACK] Seq=236274625 Ack=13010937 Win=65535 Len=0
1,0.8379599999998391,62.210.85.178,10.0.2.15,TLSv1.2,1618,Application Data
1,0.8392400000002453,10.0.2.15,62.210.85.178,TCP,54,35978  >  9001 [ACK] Seq=236366789 Ack=12925071 Win=65535 Len=0
1,0.8529600000001665,10.0.2.15,62.210.85.178,TLSv1.2,590,Application Data
1,0.8531409999995958,62.210.85.178,10.0.2.15,TCP,60,9001  >  35978 [ACK] Seq=12925071 Ack=236367325 Win=65535 Len=0
1,0.8647879999998622,10.0.2.15,62.210.85.178,TLSv1.2,1618,Application Data
1,0.8650260000003982,62.210.85.178,10.0.2.15,TCP,60,9001  >  35978 [ACK] Seq=12925071 Ack=236368785 Win=65535 Len=0
1,0.8650479999996605,62.210.85.178,10.0.2.15,TCP,60,9001  >  35978 [ACK] Seq=12925071 Ack=236368889 Win=65535 Len=0
1,1.0447350000004008,54.93.77.70,10.0.2.15,TLSv1.2,2132,Application Data
1,1.0450950000004013,10.0.2.15,54.93.77.70,TCP,54,34692  >  9001 [ACK] Seq=13010937 Ack=236276703 Win=65535 Len=0
1,1.04719600000044,10.0.2.15,54.93.77.70,TLSv1.2,590,Application Data
1,1.0473760000004404,54.93.77.70,10.0.2.15,TCP,60,9001  >  34692 [ACK] Seq=236276703 Ack=13011473 Win=65535 Len=0
1,1.2481809999999314,62.210.85.178,10.0.2.15,TLSv1.2,590,Application Data
1,1.248518000000331,10.0.2.15,62.210.85.178,TLSv1.2,590,Application Data
1,1.2485990000004676,62.210.85.178,10.0.2.15,TCP,60,9001  >  35978 [ACK] Seq=12925607 Ack=236369425 Win=65535 Len=0
1,1.3613560000003417,54.93.77.70,10.0.2.15,TLSv1.2,590,Application Data
1,1.3617420000000493,10.0.2.15,54.93.77.70,TLSv1.2,590,Application Data
1,1.3618429999996806,54.93.77.70,10.0.2.15,TCP,60,9001  >  34692 [ACK] Seq=236277239 Ack=13012009 Win=65535 Len=0
1,1.8616339999998672,62.210.85.178,10.0.2.15,TLSv1.2,590,Application Data
1,1.8671919999997044,10.0.2.15,62.210.85.178,TLSv1.2,590,Application Data
1,1.8673570000000836,62.210.85.178,10.0.2.15,TCP,60,9001  >  35978 [ACK] Seq=12926143 Ack=236369961 Win=65535 Len=0
1,1.880847000000358,10.0.2.15,62.210.85.178,TLSv1.2,4124,Application Data
1,1.8809700000001612,10.0.2.15,62.210.85.178,TCP,2974,35978  >  9001 [ACK] Seq=236374031 Ack=12926143 Win=65535 Len=2920 [TCP segment of a reassembled PDU]
1,1.8810169999997015,62.210.85.178,10.0.2.15,TCP,60,9001  >  35978 [ACK] Seq=12926143 Ack=236371421 Win=65535 Len=0
1,1.8810309999998935,62.210.85.178,10.0.2.15,TCP,60,9001  >  35978 [ACK] Seq=12926143 Ack=236372881 Win=65535 Len=0
1,1.8810370000001058,62.210.85.178,10.0.2.15,TCP,60,9001  >  35978 [ACK] Seq=12926143 Ack=236374031 Win=65535 Len=0
1,1.8810419999999795,62.210.85.178,10.0.2.15,TCP,60,9001  >  35978 [ACK] Seq=12926143 Ack=236375491 Win=65535 Len=0
1,1.881046000000424,62.210.85.178,10.0.2.15,TCP,60,9001  >  35978 [ACK] Seq=12926143 Ack=236376951 Win=65535 Len=0
1,1.881083999999646,10.0.2.15,62.210.85.178,TLSv1.2,1204,Application Data
1,1.881123000000116,62.210.85.178,10.0.2.15,TCP,60,9001  >  35978 [ACK] Seq=12926143 Ack=236378101 Win=65535 Len=0
1,1.8811679999998887,10.0.2.15,62.210.85.178,TLSv1.2,4124,Application Data
1,1.8812070000003587,62.210.85.178,10.0.2.15,TCP,60,9001  >  35978 [ACK] Seq=12926143 Ack=236379561 Win=65535 Len=0
1,1.8812159999997675,62.210.85.178,10.0.2.15,TCP,60,9001  >  35978 [ACK] Seq=12926143 Ack=236381021 Win=65535 Len=0
1,1.8812200000002122,62.210.85.178,10.0.2.15,TCP,60,9001  >  35978 [ACK] Seq=12926143 Ack=236382171 Win=65535 Len=0
1,1.8812600000001112,10.0.2.15,62.210.85.178,TLSv1.2,4124,Application Data
1,1.881296999999904,62.210.85.178,10.0.2.15,TCP,60,9001  >  35978 [ACK] Seq=12926143 Ack=236383631 Win=65535 Len=0
1,1.8813049999998839,62.210.85.178,10.0.2.15,TCP,60,9001  >  35978 [ACK] Seq=12926143 Ack=236385091 Win=65535 Len=0
1,1.8813689999997223,10.0.2.15,62.210.85.178,TLSv1.2,2974,Application Data
1,1.8814110000002984,62.210.85.178,10.0.2.15,TCP,60,9001  >  35978 [ACK] Seq=12926143 Ack=236386241 Win=65535 Len=0
1,1.8814190000002782,62.210.85.178,10.0.2.15,TCP,60,9001  >  35978 [ACK] Seq=12926143 Ack=236387701 Win=65535 Len=0
1,1.8814220000003843,62.210.85.178,10.0.2.15,TCP,60,9001  >  35978 [ACK] Seq=12926143 Ack=236389161 Win=65535 Len=0
1,1.8814499999998588,10.0.2.15,62.210.85.178,TLSv1.2,1226,Application Data
1,1.8814860000002227,62.210.85.178,10.0.2.15,TCP,60,9001  >  35978 [ACK] Seq=12926143 Ack=236390333 Win=65535 Len=0
1,1.8815260000001217,10.0.2.15,62.210.85.178,TLSv1.2,4124,Application Data
1,1.8815640000002531,62.210.85.178,10.0.2.15,TCP,60,9001  >  35978 [ACK] Seq=12926143 Ack=236391793 Win=65535 Len=0
1,1.881572000000233,62.210.85.178,10.0.2.15,TCP,60,9001  >  35978 [ACK] Seq=12926143 Ack=236393253 Win=65535 Len=0
1,1.881575999999768,62.210.85.178,10.0.2.15,TCP,60,9001  >  35978 [ACK] Seq=12926143 Ack=236394403 Win=65535 Len=0
1,1.8816130000004705,10.0.2.15,62.210.85.178,TLSv1.2,3030,Application Data
1,1.8816500000002634,62.210.85.178,10.0.2.15,TCP,60,9001  >  35978 [ACK] Seq=12926143 Ack=236395863 Win=65535 Len=0
1,1.8816589999996722,62.210.85.178,10.0.2.15,TCP,60,9001  >  35978 [ACK] Seq=12926143 Ack=236397323 Win=65535 Len=0
1,1.8816630000001169,62.210.85.178,10.0.2.15,TCP,60,9001  >  35978 [ACK] Seq=12926143 Ack=236397379 Win=65535 Len=0
1,1.8931039999997665,10.0.2.15,62.210.85.178,TLSv1.2,4124,Application Data
1,1.8931579999998576,62.210.85.178,10.0.2.15,TCP,60,9001  >  35978 [ACK] Seq=12926143 Ack=236398839 Win=65535 Len=0
1,1.8931689999999435,62.210.85.178,10.0.2.15,TCP,60,9001  >  35978 [ACK] Seq=12926143 Ack=236400299 Win=65535 Len=0
1,1.8931739999998172,62.210.85.178,10.0.2.15,TCP,60,9001  >  35978 [ACK] Seq=12926143 Ack=236401449 Win=65535 Len=0
1,1.8932199999999284,10.0.2.15,62.210.85.178,TLSv1.2,4124,Application Data
1,1.8932599999998274,62.210.85.178,10.0.2.15,TCP,60,9001  >  35978 [ACK] Seq=12926143 Ack=236402909 Win=65535 Len=0
1,1.8932690000001458,62.210.85.178,10.0.2.15,TCP,60,9001  >  35978 [ACK] Seq=12926143 Ack=236404369 Win=65535 Len=0
1,1.893275999999787,62.210.85.178,10.0.2.15,TCP,60,9001  >  35978 [ACK] Seq=12926143 Ack=236405519 Win=65535 Len=0
1,1.893315000000257,10.0.2.15,62.210.85.178,TLSv1.2,4124,Application Data
1,1.8933539999998175,62.210.85.178,10.0.2.15,TCP,60,9001  >  35978 [ACK] Seq=12926143 Ack=236406979 Win=65535 Len=0
1,1.8933619999997973,62.210.85.178,10.0.2.15,TCP,60,9001  >  35978 [ACK] Seq=12926143 Ack=236408439 Win=65535 Len=0
1,1.893366999999671,62.210.85.178,10.0.2.15,TCP,60,9001  >  35978 [ACK] Seq=12926143 Ack=236409589 Win=65535 Len=0
1,1.8934030000000348,10.0.2.15,62.210.85.178,TLSv1.2,4124,Application Data
1,1.8934410000001662,62.210.85.178,10.0.2.15,TCP,60,9001  >  35978 [ACK] Seq=12926143 Ack=236411049 Win=65535 Len=0
1,1.893449000000146,62.210.85.178,10.0.2.15,TCP,60,9001  >  35978 [ACK] Seq=12926143 Ack=236412509 Win=65535 Len=0
1,1.8934540000000197,62.210.85.178,10.0.2.15,TCP,60,9001  >  35978 [ACK] Seq=12926143 Ack=236413659 Win=65535 Len=0
1,1.893489000000045,10.0.2.15,62.210.85.178,TLSv1.2,332,Application Data
1,1.893525999999838,62.210.85.178,10.0.2.15,TCP,60,9001  >  35978 [ACK] Seq=12926143 Ack=236413937 Win=65535 Len=0
1,1.8935769999998229,10.0.2.15,62.210.85.178,TLSv1.2,3868,Application Data
1,1.8936160000002928,62.210.85.178,10.0.2.15,TCP,60,9001  >  35978 [ACK] Seq=12926143 Ack=236415397 Win=65535 Len=0
1,1.8936249999997017,62.210.85.178,10.0.2.15,TCP,60,9001  >  35978 [ACK] Seq=12926143 Ack=236416857 Win=65535 Len=0
1,1.8936290000001463,62.210.85.178,10.0.2.15,TCP,60,9001  >  35978 [ACK] Seq=12926143 Ack=236417751 Win=65535 Len=0
1,1.8936670000002778,10.0.2.15,62.210.85.178,TLSv1.2,4124,Application Data
1,1.8937050000004092,62.210.85.178,10.0.2.15,TCP,60,9001  >  35978 [ACK] Seq=12926143 Ack=236419211 Win=65535 Len=0
1,1.893713000000389,62.210.85.178,10.0.2.15,TCP,60,9001  >  35978 [ACK] Seq=12926143 Ack=236420671 Win=65535 Len=0
1,1.8937169999999242,62.210.85.178,10.0.2.15,TCP,60,9001  >  35978 [ACK] Seq=12926143 Ack=236421821 Win=65535 Len=0
1,1.8937519999999495,10.0.2.15,62.210.85.178,TLSv1.2,3030,Application Data
1,1.8937910000004194,62.210.85.178,10.0.2.15,TCP,60,9001  >  35978 [ACK] Seq=12926143 Ack=236423281 Win=65535 Len=0
1,1.8937990000003992,62.210.85.178,10.0.2.15,TCP,60,9001  >  35978 [ACK] Seq=12926143 Ack=236424741 Win=65535 Len=0
1,1.8938019999995959,62.210.85.178,10.0.2.15,TCP,60,9001  >  35978 [ACK] Seq=12926143 Ack=236424797 Win=65535 Len=0
1,1.9052709999996296,10.0.2.15,62.210.85.178,TLSv1.2,4124,Application Data
1,1.905362999999852,62.210.85.178,10.0.2.15,TCP,60,9001  >  35978 [ACK] Seq=12926143 Ack=236426257 Win=65535 Len=0
1,1.905373999999938,62.210.85.178,10.0.2.15,TCP,60,9001  >  35978 [ACK] Seq=12926143 Ack=236427717 Win=65535 Len=0
1,1.905377000000044,62.210.85.178,10.0.2.15,TCP,60,9001  >  35978 [ACK] Seq=12926143 Ack=236428867 Win=65535 Len=0
1,1.9054219999998168,10.0.2.15,62.210.85.178,TLSv1.2,4124,Application Data
1,1.9054630000000543,62.210.85.178,10.0.2.15,TCP,60,9001  >  35978 [ACK] Seq=12926143 Ack=236430327 Win=65535 Len=0
1,1.9054720000003726,62.210.85.178,10.0.2.15,TCP,60,9001  >  35978 [ACK] Seq=12926143 Ack=236431787 Win=65535 Len=0
1,1.9054770000002463,62.210.85.178,10.0.2.15,TCP,60,9001  >  35978 [ACK] Seq=12926143 Ack=236432937 Win=65535 Len=0
1,1.9055150000003778,10.0.2.15,62.210.85.178,TLSv1.2,4124,Application Data
1,1.905590000000302,62.210.85.178,10.0.2.15,TCP,60,9001  >  35978 [ACK] Seq=12926143 Ack=236434397 Win=65535 Len=0
1,1.905601000000388,62.210.85.178,10.0.2.15,TCP,60,9001  >  35978 [ACK] Seq=12926143 Ack=236435857 Win=65535 Len=0
1,1.9056039999995846,62.210.85.178,10.0.2.15,TCP,60,9001  >  35978 [ACK] Seq=12926143 Ack=236437007 Win=65535 Len=0
1,1.905652000000373,10.0.2.15,62.210.85.178,TLSv1.2,268,Application Data
1,1.9056940000000395,62.210.85.178,10.0.2.15,TCP,60,9001  >  35978 [ACK] Seq=12926143 Ack=236437221 Win=65535 Len=0
1,1.991030000000137,54.93.77.70,10.0.2.15,TLSv1.2,590,Application Data
1,2.004399000000376,54.93.77.70,10.0.2.15,TLSv1.2,7294,"Application Data, Application Data"
1,2.0044840000000477,10.0.2.15,54.93.77.70,TCP,54,34692  >  9001 [ACK] Seq=13012009 Ack=236285015 Win=65535 Len=0
1,2.0136300000003757,54.93.77.70,10.0.2.15,TCP,2950,"9001  >  34692 [PSH, ACK] Seq=236285015 Ack=13012009 Win=65535 Len=2896 [TCP segment of a reassembled PDU]"
1,2.0136970000003203,10.0.2.15,54.93.77.70,TCP,54,34692  >  9001 [ACK] Seq=13012009 Ack=236287911 Win=65535 Len=0
1,2.0137290000002395,54.93.77.70,10.0.2.15,TLSv1.2,1502,Application Data [TCP segment of a reassembled PDU]
1,2.013778999999886,10.0.2.15,54.93.77.70,TCP,54,34692  >  9001 [ACK] Seq=13012009 Ack=236289359 Win=65535 Len=0
1,2.0141590000002907,54.93.77.70,10.0.2.15,TLSv1.2,3464,Application Data
1,2.014197999999851,10.0.2.15,54.93.77.70,TCP,54,34692  >  9001 [ACK] Seq=13012009 Ack=236292769 Win=65535 Len=0
1,2.0254869999998846,54.93.77.70,10.0.2.15,TCP,2950,"9001  >  34692 [PSH, ACK] Seq=236292769 Ack=13012009 Win=65535 Len=2896 [TCP segment of a reassembled PDU]"
1,2.025507999999718,54.93.77.70,10.0.2.15,TLSv1.2,7294,"Application Data, Application Data"
1,2.0255550000001676,10.0.2.15,54.93.77.70,TCP,54,34692  >  9001 [ACK] Seq=13012009 Ack=236295665 Win=65535 Len=0
1,2.025641999999607,10.0.2.15,54.93.77.70,TCP,54,34692  >  9001 [ACK] Seq=13012009 Ack=236302905 Win=65535 Len=0
1,2.0304320000004736,54.93.77.70,10.0.2.15,TLSv1.2,264,Application Data
1,2.0306149999996705,10.0.2.15,54.93.77.70,TLSv1.2,1104,Application Data
1,2.0307400000001508,54.93.77.70,10.0.2.15,TCP,60,9001  >  34692 [ACK] Seq=236303115 Ack=13013059 Win=65535 Len=0
1,2.036344000000099,54.93.77.70,10.0.2.15,TCP,2950,"9001  >  34692 [PSH, ACK] Seq=236303115 Ack=13013059 Win=65535 Len=2896 [TCP segment of a reassembled PDU]"
1,2.036431000000448,10.0.2.15,54.93.77.70,TCP,54,34692  >  9001 [ACK] Seq=13013059 Ack=236306011 Win=65535 Len=0
1,2.0464789999996356,54.93.77.70,10.0.2.15,TLSv1.2,778,Application Data
1,2.0542930000001434,54.93.77.70,10.0.2.15,TCP,2950,"9001  >  34692 [PSH, ACK] Seq=236306735 Ack=13013059 Win=65535 Len=2896 [TCP segment of a reassembled PDU]"
1,2.0543360000001485,10.0.2.15,54.93.77.70,TCP,54,34692  >  9001 [ACK] Seq=13013059 Ack=236309631 Win=65535 Len=0
1,2.063608000000386,54.93.77.70,10.0.2.15,TLSv1.2,2950,Application Data [TCP segment of a reassembled PDU]
1,2.0636530000001585,10.0.2.15,54.93.77.70,TCP,54,34692  >  9001 [ACK] Seq=13013059 Ack=236312527 Win=65535 Len=0
1,2.066628999999921,54.93.77.70,10.0.2.15,TLSv1.2,9994,"Application Data, Application Data"
1,2.066689999999653,10.0.2.15,54.93.77.70,TCP,54,34692  >  9001 [ACK] Seq=13013059 Ack=236322467 Win=65535 Len=0
1,2.066740999999638,54.93.77.70,10.0.2.15,TLSv1.2,3146,Application Data [TCP segment of a reassembled PDU]
1,2.066859999999906,10.0.2.15,54.93.77.70,TCP,54,34692  >  9001 [ACK] Seq=13013059 Ack=236325559 Win=65535 Len=0
1,2.067323000000215,54.93.77.70,10.0.2.15,TLSv1.2,1502,"Application Data, Application Data"
1,2.067366999999649,10.0.2.15,54.93.77.70,TCP,54,34692  >  9001 [ACK] Seq=13013059 Ack=236327007 Win=65535 Len=0
1,2.0702570000003107,54.93.77.70,10.0.2.15,TLSv1.2,496,Application Data
1,2.0770540000003166,54.93.77.70,10.0.2.15,TCP,2950,"9001  >  34692 [PSH, ACK] Seq=236327449 Ack=13013059 Win=65535 Len=2896 [TCP segment of a reassembled PDU]"
1,2.077143999999862,10.0.2.15,54.93.77.70,TCP,54,34692  >  9001 [ACK] Seq=13013059 Ack=236330345 Win=65535 Len=0
1,2.0867770000004384,54.93.77.70,10.0.2.15,TLSv1.2,264,Application Data
1,2.086935999999696,10.0.2.15,54.93.77.70,TLSv1.2,590,Application Data
1,2.0870189999996,54.93.77.70,10.0.2.15,TCP,60,9001  >  34692 [ACK] Seq=236330555 Ack=13013595 Win=65535 Len=0
1,2.0944390000004205,54.93.77.70,10.0.2.15,TLSv1.2,7294,Application Data
1,2.0945080000001326,10.0.2.15,54.93.77.70,TCP,54,34692  >  9001 [ACK] Seq=13013595 Ack=236337795 Win=65535 Len=0
1,2.1022320000001855,54.93.77.70,10.0.2.15,TLSv1.2,2950,Application Data [TCP segment of a reassembled PDU]
1,2.102276999999958,10.0.2.15,54.93.77.70,TCP,54,34692  >  9001 [ACK] Seq=13013595 Ack=236340691 Win=65535 Len=0
1,2.103309000000081,54.93.77.70,10.0.2.15,TLSv1.2,778,Application Data
1,2.1140940000004775,54.93.77.70,10.0.2.15,TCP,2950,"9001  >  34692 [PSH, ACK] Seq=236341415 Ack=13013595 Win=65535 Len=2896 [TCP segment of a reassembled PDU]"
1,2.114136000000144,10.0.2.15,54.93.77.70,TCP,54,34692  >  9001 [ACK] Seq=13013595 Ack=236344311 Win=65535 Len=0
1,2.1303479999996853,54.93.77.70,10.0.2.15,TLSv1.2,778,Application Data
1,2.133020000000215,10.0.2.15,54.93.77.70,TLSv1.2,590,Application Data
1,2.1331719999998313,54.93.77.70,10.0.2.15,TCP,60,9001  >  34692 [ACK] Seq=236345035 Ack=13014131 Win=65535 Len=0
1,2.149265000000014,62.210.85.178,10.0.2.15,TLSv1.2,1104,Application Data
1,2.192673000000468,10.0.2.15,62.210.85.178,TCP,54,35978  >  9001 [ACK] Seq=236437221 Ack=12927193 Win=65535 Len=0
1,2.2821500000000015,62.210.85.178,10.0.2.15,TLSv1.2,1104,Application Data
1,2.282245999999759,10.0.2.15,62.210.85.178,TCP,54,35978  >  9001 [ACK] Seq=236437221 Ack=12928243 Win=65535 Len=0
1,2.282731999999669,10.0.2.15,62.210.85.178,TLSv1.2,590,Application Data
1,2.282825999999659,62.210.85.178,10.0.2.15,TCP,60,9001  >  35978 [ACK] Seq=12928243 Ack=236437757 Win=65535 Len=0
1,2.476411999999982,54.93.77.70,10.0.2.15,TLSv1.2,590,Application Data
1,2.476857999999993,10.0.2.15,54.93.77.70,TLSv1.2,590,Application Data
1,2.4769930000002205,54.93.77.70,10.0.2.15,TCP,60,9001  >  34692 [ACK] Seq=236345571 Ack=13014667 Win=65535 Len=0
1,2.6831490000004123,62.210.85.178,10.0.2.15,TLSv1.2,590,Application Data
1,2.68764100000044,10.0.2.15,62.210.85.178,TLSv1.2,590,Application Data
1,2.6878020000003744,62.210.85.178,10.0.2.15,TCP,60,9001  >  35978 [ACK] Seq=12928779 Ack=236438293 Win=65535 Len=0
1,2.6979819999996835,10.0.2.15,62.210.85.178,TLSv1.2,4124,Application Data
1,2.698127999999997,62.210.85.178,10.0.2.15,TCP,60,9001  >  35978 [ACK] Seq=12928779 Ack=236439753 Win=65535 Len=0
1,2.698145999999724,62.210.85.178,10.0.2.15,TCP,60,9001  >  35978 [ACK] Seq=12928779 Ack=236441213 Win=65535 Len=0
1,2.6981489999998303,62.210.85.178,10.0.2.15,TCP,60,9001  >  35978 [ACK] Seq=12928779 Ack=236442363 Win=65535 Len=0
1,2.6982230000003256,10.0.2.15,62.210.85.178,TLSv1.2,4124,Application Data
1,2.698298999999679,62.210.85.178,10.0.2.15,TCP,60,9001  >  35978 [ACK] Seq=12928779 Ack=236443823 Win=65535 Len=0
1,2.6983069999996587,62.210.85.178,10.0.2.15,TCP,60,9001  >  35978 [ACK] Seq=12928779 Ack=236445283 Win=65535 Len=0
1,2.698309999999765,62.210.85.178,10.0.2.15,TCP,60,9001  >  35978 [ACK] Seq=12928779 Ack=236446433 Win=65535 Len=0
1,2.6983430000000226,10.0.2.15,62.210.85.178,TLSv1.2,4124,Application Data
1,2.698381000000154,62.210.85.178,10.0.2.15,TCP,60,9001  >  35978 [ACK] Seq=12928779 Ack=236447893 Win=65535 Len=0
1,2.6983900000004724,62.210.85.178,10.0.2.15,TCP,60,9001  >  35978 [ACK] Seq=12928779 Ack=236449353 Win=65535 Len=0
1,2.698395000000346,62.210.85.178,10.0.2.15,TCP,60,9001  >  35978 [ACK] Seq=12928779 Ack=236450503 Win=65535 Len=0
1,2.698472000000038,10.0.2.15,62.210.85.178,TLSv1.2,4124,Application Data
1,2.6985070000000633,62.210.85.178,10.0.2.15,TCP,60,9001  >  35978 [ACK] Seq=12928779 Ack=236451963 Win=65535 Len=0
1,2.698515000000043,62.210.85.178,10.0.2.15,TCP,60,9001  >  35978 [ACK] Seq=12928779 Ack=236453423 Win=65535 Len=0
1,2.6985599999998158,62.210.85.178,10.0.2.15,TCP,60,9001  >  35978 [ACK] Seq=12928779 Ack=236454573 Win=65535 Len=0
1,2.698594999999841,10.0.2.15,62.210.85.178,TLSv1.2,332,Application Data
1,2.698631999999634,62.210.85.178,10.0.2.15,TCP,60,9001  >  35978 [ACK] Seq=12928779 Ack=236454851 Win=65535 Len=0
1,2.698685999999725,10.0.2.15,62.210.85.178,TLSv1.2,3868,Application Data
1,2.698725999999624,62.210.85.178,10.0.2.15,TCP,60,9001  >  35978 [ACK] Seq=12928779 Ack=236456311 Win=65535 Len=0
1,2.698733999999604,62.210.85.178,10.0.2.15,TCP,60,9001  >  35978 [ACK] Seq=12928779 Ack=236457771 Win=65535 Len=0
1,2.6987380000000485,62.210.85.178,10.0.2.15,TCP,60,9001  >  35978 [ACK] Seq=12928779 Ack=236458665 Win=65535 Len=0
1,2.69877600000018,10.0.2.15,62.210.85.178,TLSv1.2,4124,Application Data
1,2.6988170000004175,62.210.85.178,10.0.2.15,TCP,60,9001  >  35978 [ACK] Seq=12928779 Ack=236460125 Win=65535 Len=0
1,2.6988240000000587,62.210.85.178,10.0.2.15,TCP,60,9001  >  35978 [ACK] Seq=12928779 Ack=236461585 Win=65535 Len=0
1,2.698827999999594,62.210.85.178,10.0.2.15,TCP,60,9001  >  35978 [ACK] Seq=12928779 Ack=236462735 Win=65535 Len=0
1,2.698862999999619,10.0.2.15,62.210.85.178,TLSv1.2,3030,Application Data
1,2.698902000000089,62.210.85.178,10.0.2.15,TCP,60,9001  >  35978 [ACK] Seq=12928779 Ack=236464195 Win=65535 Len=0
1,2.6989089999997304,62.210.85.178,10.0.2.15,TCP,60,9001  >  35978 [ACK] Seq=12928779 Ack=236465655 Win=65535 Len=0
1,2.698913000000175,62.210.85.178,10.0.2.15,TCP,60,9001  >  35978 [ACK] Seq=12928779 Ack=236465711 Win=65535 Len=0
1,2.7081209999996645,10.0.2.15,62.210.85.178,TLSv1.2,4124,Application Data
1,2.7081790000002,62.210.85.178,10.0.2.15,TCP,60,9001  >  35978 [ACK] Seq=12928779 Ack=236467171 Win=65535 Len=0
1,2.708190000000286,62.210.85.178,10.0.2.15,TCP,60,9001  >  35978 [ACK] Seq=12928779 Ack=236468631 Win=65535 Len=0
1,2.708195999999589,62.210.85.178,10.0.2.15,TCP,60,9001  >  35978 [ACK] Seq=12928779 Ack=236469781 Win=65535 Len=0
1,2.7082419999997,10.0.2.15,62.210.85.178,TLSv1.2,4124,Application Data
1,2.7082829999999376,62.210.85.178,10.0.2.15,TCP,60,9001  >  35978 [ACK] Seq=12928779 Ack=236471241 Win=65535 Len=0
1,2.708292000000256,62.210.85.178,10.0.2.15,TCP,60,9001  >  35978 [ACK] Seq=12928779 Ack=236472701 Win=65535 Len=0
1,2.7082970000001296,62.210.85.178,10.0.2.15,TCP,60,9001  >  35978 [ACK] Seq=12928779 Ack=236473851 Win=65535 Len=0
1,2.7083370000000286,10.0.2.15,62.210.85.178,TLSv1.2,4124,Application Data
1,2.70837500000016,62.210.85.178,10.0.2.15,TCP,60,9001  >  35978 [ACK] Seq=12928779 Ack=236475311 Win=65535 Len=0
1,2.7083840000004784,62.210.85.178,10.0.2.15,TCP,60,9001  >  35978 [ACK] Seq=12928779 Ack=236476771 Win=65535 Len=0
1,2.708389000000352,62.210.85.178,10.0.2.15,TCP,60,9001  >  35978 [ACK] Seq=12928779 Ack=236477921 Win=65535 Len=0
1,2.7084240000003774,10.0.2.15,62.210.85.178,TLSv1.2,268,Application Data
1,2.708469999999579,62.210.85.178,10.0.2.15,TCP,60,9001  >  35978 [ACK] Seq=12928779 Ack=236478135 Win=65535 Len=0
1,2.8875340000004144,54.93.77.70,10.0.2.15,TCP,2950,"9001  >  34692 [PSH, ACK] Seq=236345571 Ack=13014667 Win=65535 Len=2896 [TCP segment of a reassembled PDU]"
1,2.8876630000004297,10.0.2.15,54.93.77.70,TCP,54,34692  >  9001 [ACK] Seq=13014667 Ack=236348467 Win=65535 Len=0
1,2.891845000000103,54.93.77.70,10.0.2.15,TLSv1.2,4912,"Application Data, Application Data"
1,2.891907999999603,10.0.2.15,54.93.77.70,TCP,54,34692  >  9001 [ACK] Seq=13014667 Ack=236353325 Win=65535 Len=0
1,2.893235000000459,54.93.77.70,10.0.2.15,TLSv1.2,5846,Application Data
1,2.893283000000338,10.0.2.15,54.93.77.70,TCP,54,34692  >  9001 [ACK] Seq=13014667 Ack=236359117 Win=65535 Len=0
1,2.893457000000126,10.0.2.15,54.93.77.70,TLSv1.2,590,Application Data
1,2.8935359999995853,54.93.77.70,10.0.2.15,TCP,60,9001  >  34692 [ACK] Seq=236359117 Ack=13015203 Win=65535 Len=0
1,2.909969999999703,54.93.77.70,10.0.2.15,TLSv1.2,2950,Application Data [TCP segment of a reassembled PDU]
1,2.9100220000000263,10.0.2.15,54.93.77.70,TCP,54,34692  >  9001 [ACK] Seq=13015203 Ack=236362013 Win=65535 Len=0
1,2.9107850000000326,54.93.77.70,10.0.2.15,TLSv1.2,11544,"Application Data, Application Data, Application Data, Application Data"
1,2.9108560000004218,10.0.2.15,54.93.77.70,TCP,54,34692  >  9001 [ACK] Seq=13015203 Ack=236373503 Win=65535 Len=0
1,2.911090999999942,10.0.2.15,54.93.77.70,TLSv1.2,590,Application Data
1,2.9111620000003313,54.93.77.70,10.0.2.15,TCP,60,9001  >  34692 [ACK] Seq=236373503 Ack=13015739 Win=65535 Len=0
1,2.922281000000112,54.93.77.70,10.0.2.15,TCP,2950,"9001  >  34692 [PSH, ACK] Seq=236373503 Ack=13015739 Win=65535 Len=2896 [TCP segment of a reassembled PDU]"
1,2.9223250000004555,10.0.2.15,54.93.77.70,TCP,54,34692  >  9001 [ACK] Seq=13015739 Ack=236376399 Win=65535 Len=0
1,2.922443000000385,54.93.77.70,10.0.2.15,TLSv1.2,8574,"Application Data, Application Data"
1,2.922472000000198,10.0.2.15,54.93.77.70,TCP,54,34692  >  9001 [ACK] Seq=13015739 Ack=236384919 Win=65535 Len=0
1,2.9225079999996524,54.93.77.70,10.0.2.15,TCP,222,"9001  >  34692 [PSH, ACK] Seq=236384919 Ack=13015739 Win=65535 Len=168 [TCP segment of a reassembled PDU]"
1,2.927318000000014,54.93.77.70,10.0.2.15,TLSv1.2,894,"Application Data, Application Data"
1,2.9274390000000494,10.0.2.15,54.93.77.70,TCP,54,34692  >  9001 [ACK] Seq=13015739 Ack=236385927 Win=65535 Len=0
1,2.9298429999998916,10.0.2.15,54.93.77.70,TLSv1.2,590,Application Data
1,2.9299849999997605,54.93.77.70,10.0.2.15,TCP,60,9001  >  34692 [ACK] Seq=236385927 Ack=13016275 Win=65535 Len=0
1,3.40342899999996,62.210.85.178,10.0.2.15,TLSv1.2,590,Application Data
1,3.4061250000004293,62.210.85.178,10.0.2.15,TLSv1.2,1104,Application Data
1,3.406199000000015,10.0.2.15,62.210.85.178,TCP,54,35978  >  9001 [ACK] Seq=236478135 Ack=12930365 Win=65535 Len=0
1,3.406420999999682,10.0.2.15,62.210.85.178,TLSv1.2,590,Application Data
1,3.406496999999945,62.210.85.178,10.0.2.15,TCP,60,9001  >  35978 [ACK] Seq=12930365 Ack=236478671 Win=65535 Len=0
1,3.499974999999722,54.93.77.70,10.0.2.15,TLSv1.2,590,Application Data
1,3.5004730000000563,10.0.2.15,54.93.77.70,TLSv1.2,590,Application Data
1,3.5005950000004304,54.93.77.70,10.0.2.15,TCP,60,9001  >  34692 [ACK] Seq=236386463 Ack=13016811 Win=65535 Len=0
1,3.6167759999998452,62.210.85.178,10.0.2.15,TLSv1.2,590,Application Data
1,3.6246830000000045,10.0.2.15,62.210.85.178,TLSv1.2,590,Application Data
1,3.6248340000001917,62.210.85.178,10.0.2.15,TCP,60,9001  >  35978 [ACK] Seq=12930901 Ack=236479207 Win=65535 Len=0
1,3.637254999999641,10.0.2.15,62.210.85.178,TLSv1.2,4124,Application Data
1,3.6373579999999492,10.0.2.15,62.210.85.178,TCP,2974,35978  >  9001 [ACK] Seq=236483277 Ack=12930901 Win=65535 Len=2920 [TCP segment of a reassembled PDU]
1,3.637405000000399,62.210.85.178,10.0.2.15,TCP,60,9001  >  35978 [ACK] Seq=12930901 Ack=236480667 Win=65535 Len=0
1,3.637416999999914,62.210.85.178,10.0.2.15,TCP,60,9001  >  35978 [ACK] Seq=12930901 Ack=236482127 Win=65535 Len=0
1,3.6374219999997877,62.210.85.178,10.0.2.15,TCP,60,9001  >  35978 [ACK] Seq=12930901 Ack=236483277 Win=65535 Len=0
1,3.6374260000002323,62.210.85.178,10.0.2.15,TCP,60,9001  >  35978 [ACK] Seq=12930901 Ack=236484737 Win=65535 Len=0
1,3.637431000000106,62.210.85.178,10.0.2.15,TCP,60,9001  >  35978 [ACK] Seq=12930901 Ack=236486197 Win=65535 Len=0
1,3.63746700000047,10.0.2.15,62.210.85.178,TLSv1.2,1204,Application Data
1,3.637504999999692,62.210.85.178,10.0.2.15,TCP,60,9001  >  35978 [ACK] Seq=12930901 Ack=236487347 Win=65535 Len=0
1,3.637550999999803,10.0.2.15,62.210.85.178,TLSv1.2,4124,Application Data
1,3.637590000000273,62.210.85.178,10.0.2.15,TCP,60,9001  >  35978 [ACK] Seq=12930901 Ack=236488807 Win=65535 Len=0
1,3.637598999999682,62.210.85.178,10.0.2.15,TCP,60,9001  >  35978 [ACK] Seq=12930901 Ack=236490267 Win=65535 Len=0
1,3.6376030000001265,62.210.85.178,10.0.2.15,TCP,60,9001  >  35978 [ACK] Seq=12930901 Ack=236491417 Win=65535 Len=0
1,3.6376430000000255,10.0.2.15,62.210.85.178,TLSv1.2,4124,Application Data
1,3.6376799999998184,62.210.85.178,10.0.2.15,TCP,60,9001  >  35978 [ACK] Seq=12930901 Ack=236492877 Win=65535 Len=0
1,3.637687999999798,62.210.85.178,10.0.2.15,TCP,60,9001  >  35978 [ACK] Seq=12930901 Ack=236494337 Win=65535 Len=0
1,3.63774900000044,10.0.2.15,62.210.85.178,TLSv1.2,2974,Application Data
1,3.6377880000000005,62.210.85.178,10.0.2.15,TCP,60,9001  >  35978 [ACK] Seq=12930901 Ack=236495487 Win=65535 Len=0
1,3.637797000000319,62.210.85.178,10.0.2.15,TCP,60,9001  >  35978 [ACK] Seq=12930901 Ack=236496947 Win=65535 Len=0
1,3.637800000000425,62.210.85.178,10.0.2.15,TCP,60,9001  >  35978 [ACK] Seq=12930901 Ack=236498407 Win=65535 Len=0
1,3.6378279999998995,10.0.2.15,62.210.85.178,TLSv1.2,1226,Application Data
1,3.6378640000002633,62.210.85.178,10.0.2.15,TCP,60,9001  >  35978 [ACK] Seq=12930901 Ack=236499579 Win=65535 Len=0
1,3.6379049999995914,10.0.2.15,62.210.85.178,TLSv1.2,4124,Application Data
1,3.637948999999935,62.210.85.178,10.0.2.15,TCP,60,9001  >  35978 [ACK] Seq=12930901 Ack=236501039 Win=65535 Len=0
1,3.6379559999995763,62.210.85.178,10.0.2.15,TCP,60,9001  >  35978 [ACK] Seq=12930901 Ack=236502499 Win=65535 Len=0
1,3.6379589999996824,62.210.85.178,10.0.2.15,TCP,60,9001  >  35978 [ACK] Seq=12930901 Ack=236503649 Win=65535 Len=0
1,3.637996999999814,10.0.2.15,62.210.85.178,TLSv1.2,3030,Application Data
1,3.6380349999999453,62.210.85.178,10.0.2.15,TCP,60,9001  >  35978 [ACK] Seq=12930901 Ack=236505109 Win=65535 Len=0
1,3.638042999999925,62.210.85.178,10.0.2.15,TCP,60,9001  >  35978 [ACK] Seq=12930901 Ack=236506569 Win=65535 Len=0
1,3.6380479999997988,62.210.85.178,10.0.2.15,TCP,60,9001  >  35978 [ACK] Seq=12930901 Ack=236506625 Win=65535 Len=0
1,3.6494979999997668,10.0.2.15,62.210.85.178,TLSv1.2,4124,Application Data
1,3.6495530000001963,62.210.85.178,10.0.2.15,TCP,60,9001  >  35978 [ACK] Seq=12930901 Ack=236508085 Win=65535 Len=0
1,3.6495649999997113,62.210.85.178,10.0.2.15,TCP,60,9001  >  35978 [ACK] Seq=12930901 Ack=236509545 Win=65535 Len=0
1,3.6495709999999235,62.210.85.178,10.0.2.15,TCP,60,9001  >  35978 [ACK] Seq=12930901 Ack=236510695 Win=65535 Len=0
1,3.6496170000000347,10.0.2.15,62.210.85.178,TLSv1.2,4124,Application Data
1,3.649688000000424,62.210.85.178,10.0.2.15,TCP,60,9001  >  35978 [ACK] Seq=12930901 Ack=236512155 Win=65535 Len=0
1,3.6496960000004037,62.210.85.178,10.0.2.15,TCP,60,9001  >  35978 [ACK] Seq=12930901 Ack=236513615 Win=65535 Len=0
1,3.6496989999996003,62.210.85.178,10.0.2.15,TCP,60,9001  >  35978 [ACK] Seq=12930901 Ack=236514765 Win=65535 Len=0
1,3.6497300000000905,10.0.2.15,62.210.85.178,TLSv1.2,4124,Application Data
1,3.649768000000222,62.210.85.178,10.0.2.15,TCP,60,9001  >  35978 [ACK] Seq=12930901 Ack=236516225 Win=65535 Len=0
1,3.649776999999631,62.210.85.178,10.0.2.15,TCP,60,9001  >  35978 [ACK] Seq=12930901 Ack=236517685 Win=65535 Len=0
1,3.6497810000000754,62.210.85.178,10.0.2.15,TCP,60,9001  >  35978 [ACK] Seq=12930901 Ack=236518835 Win=65535 Len=0
1,3.6498179999998683,10.0.2.15,62.210.85.178,TLSv1.2,4124,Application Data
1,3.6498570000003383,62.210.85.178,10.0.2.15,TCP,60,9001  >  35978 [ACK] Seq=12930901 Ack=236520295 Win=65535 Len=0
1,3.649865000000318,62.210.85.178,10.0.2.15,TCP,60,9001  >  35978 [ACK] Seq=12930901 Ack=236521755 Win=65535 Len=0
1,3.6498689999998533,62.210.85.178,10.0.2.15,TCP,60,9001  >  35978 [ACK] Seq=12930901 Ack=236522905 Win=65535 Len=0
1,3.6499039999998786,10.0.2.15,62.210.85.178,TLSv1.2,332,Application Data
1,3.650018999999702,62.210.85.178,10.0.2.15,TCP,60,9001  >  35978 [ACK] Seq=12930901 Ack=236523183 Win=65535 Len=0
1,3.6500919999998587,10.0.2.15,62.210.85.178,TLSv1.2,3868,Application Data
1,3.650134999999864,62.210.85.178,10.0.2.15,TCP,60,9001  >  35978 [ACK] Seq=12930901 Ack=236524643 Win=65535 Len=0
1,3.6501429999998436,62.210.85.178,10.0.2.15,TCP,60,9001  >  35978 [ACK] Seq=12930901 Ack=236526103 Win=65535 Len=0
1,3.6501470000002882,62.210.85.178,10.0.2.15,TCP,60,9001  >  35978 [ACK] Seq=12930901 Ack=236526997 Win=65535 Len=0
1,3.6501850000004197,10.0.2.15,62.210.85.178,TLSv1.2,4124,Application Data
1,3.65022399999998,62.210.85.178,10.0.2.15,TCP,60,9001  >  35978 [ACK] Seq=12930901 Ack=236528457 Win=65535 Len=0
1,3.65023199999996,62.210.85.178,10.0.2.15,TCP,60,9001  >  35978 [ACK] Seq=12930901 Ack=236529917 Win=65535 Len=0
1,3.6502360000004046,62.210.85.178,10.0.2.15,TCP,60,9001  >  35978 [ACK] Seq=12930901 Ack=236531067 Win=65535 Len=0
1,3.65027100000043,10.0.2.15,62.210.85.178,TLSv1.2,3030,Application Data
1,3.650308999999652,62.210.85.178,10.0.2.15,TCP,60,9001  >  35978 [ACK] Seq=12930901 Ack=236532527 Win=65535 Len=0
1,3.6503169999996317,62.210.85.178,10.0.2.15,TCP,60,9001  >  35978 [ACK] Seq=12930901 Ack=236533987 Win=65535 Len=0
1,3.6503210000000763,62.210.85.178,10.0.2.15,TCP,60,9001  >  35978 [ACK] Seq=12930901 Ack=236534043 Win=65535 Len=0
1,3.6595100000004095,10.0.2.15,62.210.85.178,TLSv1.2,1104,Application Data
1,3.6596129999998084,62.210.85.178,10.0.2.15,TCP,60,9001  >  35978 [ACK] Seq=12930901 Ack=236535093 Win=65535 Len=0
1,3.727751000000353,54.93.77.70,10.0.2.15,TLSv1.2,590,Application Data
1,3.7552120000000286,54.93.77.70,10.0.2.15,TCP,2950,"9001  >  34692 [PSH, ACK] Seq=236386999 Ack=13016811 Win=65535 Len=2896 [TCP segment of a reassembled PDU]"
1,3.7552939999995942,10.0.2.15,54.93.77.70,TCP,54,34692  >  9001 [ACK] Seq=13016811 Ack=236389895 Win=65535 Len=0
1,3.7636329999995723,54.93.77.70,10.0.2.15,TLSv1.2,2950,Application Data [TCP segment of a reassembled PDU]
1,3.76367399999981,10.0.2.15,54.93.77.70,TCP,54,34692  >  9001 [ACK] Seq=13016811 Ack=236392791 Win=65535 Len=0
1,3.7648660000004384,54.93.77.70,10.0.2.15,TLSv1.2,2950,Application Data [TCP segment of a reassembled PDU]
1,3.7649069999997664,10.0.2.15,54.93.77.70,TCP,54,34692  >  9001 [ACK] Seq=13016811 Ack=236395687 Win=65535 Len=0
1,3.771392999999989,54.93.77.70,10.0.2.15,TLSv1.2,170,Application Data
1,3.7740210000001753,54.93.77.70,10.0.2.15,TCP,1502,"9001  >  34692 [PSH, ACK] Seq=236395803 Ack=13016811 Win=65535 Len=1448 [TCP segment of a reassembled PDU]"
1,3.7740649999996094,10.0.2.15,54.93.77.70,TCP,54,34692  >  9001 [ACK] Seq=13016811 Ack=236397251 Win=65535 Len=0
1,3.798388000000159,54.93.77.70,10.0.2.15,TLSv1.2,1198,Application Data
1,3.840578999999707,10.0.2.15,54.93.77.70,TCP,54,34692  >  9001 [ACK] Seq=13016811 Ack=236398395 Win=65535 Len=0
1,3.855023000000074,54.93.77.70,10.0.2.15,TCP,2950,"9001  >  34692 [PSH, ACK] Seq=236398395 Ack=13016811 Win=65535 Len=2896 [TCP segment of a reassembled PDU]"
1,3.855066000000079,54.93.77.70,10.0.2.15,TLSv1.2,4398,"Application Data, Application Data"
1,3.855117000000064,10.0.2.15,54.93.77.70,TCP,54,34692  >  9001 [ACK] Seq=13016811 Ack=236401291 Win=65535 Len=0
1,3.855168000000049,10.0.2.15,54.93.77.70,TCP,54,34692  >  9001 [ACK] Seq=13016811 Ack=236405635 Win=65535 Len=0
1,3.869778000000224,54.93.77.70,10.0.2.15,TCP,2950,"9001  >  34692 [PSH, ACK] Seq=236405635 Ack=13016811 Win=65535 Len=2896 [TCP segment of a reassembled PDU]"
1,3.869829000000209,10.0.2.15,54.93.77.70,TCP,54,34692  >  9001 [ACK] Seq=13016811 Ack=236408531 Win=65535 Len=0
1,3.870404000000235,54.93.77.70,10.0.2.15,TLSv1.2,4912,"Application Data, Application Data"
1,3.8704459999999017,10.0.2.15,54.93.77.70,TCP,54,34692  >  9001 [ACK] Seq=13016811 Ack=236413389 Win=65535 Len=0
1,3.870608000000175,10.0.2.15,54.93.77.70,TLSv1.2,590,Application Data
1,3.870683000000099,54.93.77.70,10.0.2.15,TCP,60,9001  >  34692 [ACK] Seq=236413389 Ack=13017347 Win=65535 Len=0
1,3.8799639999997453,10.0.2.15,54.93.77.70,TLSv1.2,590,Application Data
1,3.8800810000002457,54.93.77.70,10.0.2.15,TCP,60,9001  >  34692 [ACK] Seq=236413389 Ack=13017883 Win=65535 Len=0
1,3.880489000000125,54.93.77.70,10.0.2.15,TCP,2950,"9001  >  34692 [PSH, ACK] Seq=236413389 Ack=13017883 Win=65535 Len=2896 [TCP segment of a reassembled PDU]"
1,3.880557000000408,10.0.2.15,54.93.77.70,TCP,54,34692  >  9001 [ACK] Seq=13017883 Ack=236416285 Win=65535 Len=0
1,3.8814039999997476,54.93.77.70,10.0.2.15,TLSv1.2,5846,"Application Data, Application Data"
1,3.881464000000051,10.0.2.15,54.93.77.70,TCP,54,34692  >  9001 [ACK] Seq=13017883 Ack=236422077 Win=65535 Len=0
1,3.8888170000000173,54.93.77.70,10.0.2.15,TLSv1.2,170,Application Data
1,3.8913579999998547,54.93.77.70,10.0.2.15,TLSv1.2,4398,Application Data
1,3.8914000000004307,10.0.2.15,54.93.77.70,TCP,54,34692  >  9001 [ACK] Seq=13017883 Ack=236426537 Win=65535 Len=0
1,3.9020000000000437,54.93.77.70,10.0.2.15,TLSv1.2,7294,"Application Data, Application Data"
1,3.902103999999781,10.0.2.15,54.93.77.70,TCP,54,34692  >  9001 [ACK] Seq=13017883 Ack=236433777 Win=65535 Len=0
1,3.907669000000169,54.93.77.70,10.0.2.15,TLSv1.2,894,Application Data
1,3.9115819999997257,54.93.77.70,10.0.2.15,TCP,1502,"9001  >  34692 [PSH, ACK] Seq=236434617 Ack=13017883 Win=65535 Len=1448 [TCP segment of a reassembled PDU]"
1,3.9116260000000693,10.0.2.15,54.93.77.70,TCP,54,34692  >  9001 [ACK] Seq=13017883 Ack=236436065 Win=65535 Len=0
1,3.9181980000003023,54.93.77.70,10.0.2.15,TLSv1.2,1502,Application Data [TCP segment of a reassembled PDU]
1,3.9182389999996303,10.0.2.15,54.93.77.70,TCP,54,34692  >  9001 [ACK] Seq=13017883 Ack=236437513 Win=65535 Len=0
1,3.926727000000028,54.93.77.70,10.0.2.15,TLSv1.2,1314,Application Data
1,3.926857000000382,10.0.2.15,54.93.77.70,TLSv1.2,590,Application Data
1,3.9269389999999476,54.93.77.70,10.0.2.15,TCP,60,9001  >  34692 [ACK] Seq=236438773 Ack=13018419 Win=65535 Len=0
1,3.9299849999997605,54.93.77.70,10.0.2.15,TCP,2950,"9001  >  34692 [PSH, ACK] Seq=236438773 Ack=13018419 Win=65535 Len=2896 [TCP segment of a reassembled PDU]"
1,3.9300460000004023,10.0.2.15,54.93.77.70,TCP,54,34692  >  9001 [ACK] Seq=13018419 Ack=236441669 Win=65535 Len=0
1,3.9433380000000398,54.93.77.70,10.0.2.15,TLSv1.2,778,Application Data
1,3.9448499999998603,10.0.2.15,54.93.77.70,TLSv1.2,590,Application Data
1,3.9464260000004288,54.93.77.70,10.0.2.15,TCP,60,9001  >  34692 [ACK] Seq=236442393 Ack=13018955 Win=65535 Len=0
1,3.960493999999926,54.93.77.70,10.0.2.15,TLSv1.2,590,Application Data
1,3.963042000000314,10.0.2.15,54.93.77.70,TLSv1.2,590,Application Data
1,3.963195999999698,54.93.77.70,10.0.2.15,TCP,60,9001  >  34692 [ACK] Seq=236442929 Ack=13019491 Win=65535 Len=0
1,4.627212999999756,62.210.85.178,10.0.2.15,TLSv1.2,2646,Application Data
1,4.627347999999984,10.0.2.15,62.210.85.178,TCP,54,35978  >  9001 [ACK] Seq=236535093 Ack=12933493 Win=65535 Len=0
1,4.627819000000272,10.0.2.15,62.210.85.178,TLSv1.2,590,Application Data
1,4.627921000000242,62.210.85.178,10.0.2.15,TCP,60,9001  >  35978 [ACK] Seq=12933493 Ack=236535629 Win=65535 Len=0
1,4.83189399999992,54.93.77.70,10.0.2.15,TLSv1.2,590,Application Data
1,4.832320999999865,10.0.2.15,54.93.77.70,TLSv1.2,590,Application Data
1,4.832424000000174,54.93.77.70,10.0.2.15,TCP,60,9001  >  34692 [ACK] Seq=236443465 Ack=13020027 Win=65535 Len=0
1,4.932952000000114,62.210.85.178,10.0.2.15,TLSv1.2,590,Application Data
1,4.9358949999996184,10.0.2.15,62.210.85.178,TLSv1.2,590,Application Data
1,4.936039999999593,62.210.85.178,10.0.2.15,TCP,60,9001  >  35978 [ACK] Seq=12934029 Ack=236536165 Win=65535 Len=0
1,4.946772000000237,10.0.2.15,62.210.85.178,TLSv1.2,4124,Application Data
1,4.947538999999779,62.210.85.178,10.0.2.15,TCP,60,9001  >  35978 [ACK] Seq=12934029 Ack=236537625 Win=65535 Len=0
1,4.947557000000415,62.210.85.178,10.0.2.15,TCP,60,9001  >  35978 [ACK] Seq=12934029 Ack=236539085 Win=65535 Len=0
1,4.947559999999612,62.210.85.178,10.0.2.15,TCP,60,9001  >  35978 [ACK] Seq=12934029 Ack=236540235 Win=65535 Len=0
1,4.947595999999976,10.0.2.15,62.210.85.178,TLSv1.2,140,Application Data
1,4.947672999999668,62.210.85.178,10.0.2.15,TCP,60,9001  >  35978 [ACK] Seq=12934029 Ack=236540321 Win=65535 Len=0
1,5.1408510000001115,54.93.77.70,10.0.2.15,TCP,2950,"9001  >  34692 [PSH, ACK] Seq=236443465 Ack=13020027 Win=65535 Len=2896 [TCP segment of a reassembled PDU]"
1,5.140973999999915,10.0.2.15,54.93.77.70,TCP,54,34692  >  9001 [ACK] Seq=13020027 Ack=236446361 Win=65535 Len=0
1,5.149629999999888,54.93.77.70,10.0.2.15,TLSv1.2,778,Application Data
1,5.189556000000266,54.93.77.70,10.0.2.15,TLSv1.2,1104,Application Data
1,5.189636000000064,10.0.2.15,54.93.77.70,TCP,54,34692  >  9001 [ACK] Seq=13020027 Ack=236448135 Win=65535 Len=0
1,5.192508000000089,10.0.2.15,54.93.77.70,TLSv1.2,590,Application Data
1,5.192675999999665,54.93.77.70,10.0.2.15,TCP,60,9001  >  34692 [ACK] Seq=236448135 Ack=13020563 Win=65535 Len=0
1,5.293365999999878,62.210.85.178,10.0.2.15,TLSv1.2,590,Application Data
1,5.29377199999999,10.0.2.15,62.210.85.178,TLSv1.2,590,Application Data
1,5.29390500000045,62.210.85.178,10.0.2.15,TCP,60,9001  >  35978 [ACK] Seq=12934565 Ack=236540857 Win=65535 Len=0
1,5.548999999999978,54.93.77.70,10.0.2.15,TLSv1.2,590,Application Data
1,5.549551000000065,10.0.2.15,54.93.77.70,TLSv1.2,590,Application Data
1,5.54970400000002,54.93.77.70,10.0.2.15,TCP,60,9001  >  34692 [ACK] Seq=236448671 Ack=13021099 Win=65535 Len=0
1,5.855921000000308,62.210.85.178,10.0.2.15,TLSv1.2,590,Application Data
1,5.864668999999594,10.0.2.15,62.210.85.178,TLSv1.2,590,Application Data
1,5.864870000000337,62.210.85.178,10.0.2.15,TCP,60,9001  >  35978 [ACK] Seq=12935101 Ack=236541393 Win=65535 Len=0
1,5.877628999999615,10.0.2.15,62.210.85.178,TLSv1.2,4124,Application Data
1,5.877755000000434,10.0.2.15,62.210.85.178,TCP,2974,35978  >  9001 [ACK] Seq=236545463 Ack=12935101 Win=65535 Len=2920 [TCP segment of a reassembled PDU]
1,5.877798000000439,62.210.85.178,10.0.2.15,TCP,60,9001  >  35978 [ACK] Seq=12935101 Ack=236542853 Win=65535 Len=0
1,5.8778089999996155,62.210.85.178,10.0.2.15,TCP,60,9001  >  35978 [ACK] Seq=12935101 Ack=236544313 Win=65535 Len=0
1,5.87781300000006,62.210.85.178,10.0.2.15,TCP,60,9001  >  35978 [ACK] Seq=12935101 Ack=236545463 Win=65535 Len=0
1,5.877816999999595,62.210.85.178,10.0.2.15,TCP,60,9001  >  35978 [ACK] Seq=12935101 Ack=236546923 Win=65535 Len=0
1,5.8778220000003785,62.210.85.178,10.0.2.15,TCP,60,9001  >  35978 [ACK] Seq=12935101 Ack=236548383 Win=65535 Len=0
1,5.877865999999813,10.0.2.15,62.210.85.178,TLSv1.2,1204,Application Data
1,5.87790700000005,62.210.85.178,10.0.2.15,TCP,60,9001  >  35978 [ACK] Seq=12935101 Ack=236549533 Win=65535 Len=0
1,5.8779560000002675,10.0.2.15,62.210.85.178,TLSv1.2,4124,Application Data
1,5.877996999999596,62.210.85.178,10.0.2.15,TCP,60,9001  >  35978 [ACK] Seq=12935101 Ack=236550993 Win=65535 Len=0
1,5.878004000000146,62.210.85.178,10.0.2.15,TCP,60,9001  >  35978 [ACK] Seq=12935101 Ack=236552453 Win=65535 Len=0
1,5.87800900000002,62.210.85.178,10.0.2.15,TCP,60,9001  >  35978 [ACK] Seq=12935101 Ack=236553603 Win=65535 Len=0
1,5.87805600000047,10.0.2.15,62.210.85.178,TLSv1.2,4124,Application Data
1,5.8781669999998485,62.210.85.178,10.0.2.15,TCP,60,9001  >  35978 [ACK] Seq=12935101 Ack=236555063 Win=65535 Len=0
1,5.878176000000167,62.210.85.178,10.0.2.15,TCP,60,9001  >  35978 [ACK] Seq=12935101 Ack=236556523 Win=65535 Len=0
1,5.8781810000000405,62.210.85.178,10.0.2.15,TCP,60,9001  >  35978 [ACK] Seq=12935101 Ack=236557673 Win=65535 Len=0
1,5.878225999999813,10.0.2.15,62.210.85.178,TLSv1.2,332,Application Data
1,5.878265999999712,62.210.85.178,10.0.2.15,TCP,60,9001  >  35978 [ACK] Seq=12935101 Ack=236557951 Win=65535 Len=0
1,5.878327000000354,10.0.2.15,62.210.85.178,TLSv1.2,3868,Application Data
1,5.878369000000021,62.210.85.178,10.0.2.15,TCP,60,9001  >  35978 [ACK] Seq=12935101 Ack=236559411 Win=65535 Len=0
1,5.878375999999662,62.210.85.178,10.0.2.15,TCP,60,9001  >  35978 [ACK] Seq=12935101 Ack=236560871 Win=65535 Len=0
1,5.8783800000001065,62.210.85.178,10.0.2.15,TCP,60,9001  >  35978 [ACK] Seq=12935101 Ack=236561765 Win=65535 Len=0
1,5.878456000000369,10.0.2.15,62.210.85.178,TLSv1.2,4124,Application Data
1,5.878493999999591,62.210.85.178,10.0.2.15,TCP,60,9001  >  35978 [ACK] Seq=12935101 Ack=236563225 Win=65535 Len=0
1,5.878501000000142,62.210.85.178,10.0.2.15,TCP,60,9001  >  35978 [ACK] Seq=12935101 Ack=236564685 Win=65535 Len=0
1,5.878504999999677,62.210.85.178,10.0.2.15,TCP,60,9001  >  35978 [ACK] Seq=12935101 Ack=236565835 Win=65535 Len=0
1,5.878552000000127,10.0.2.15,62.210.85.178,TLSv1.2,3030,Application Data
1,5.878649000000223,62.210.85.178,10.0.2.15,TCP,60,9001  >  35978 [ACK] Seq=12935101 Ack=236567295 Win=65535 Len=0
1,5.878663999999844,62.210.85.178,10.0.2.15,TCP,60,9001  >  35978 [ACK] Seq=12935101 Ack=236568755 Win=65535 Len=0
1,5.878668999999718,62.210.85.178,10.0.2.15,TCP,60,9001  >  35978 [ACK] Seq=12935101 Ack=236568811 Win=65535 Len=0
1,5.887773000000379,10.0.2.15,62.210.85.178,TLSv1.2,4124,Application Data
1,5.887862999999925,10.0.2.15,62.210.85.178,TCP,2974,35978  >  9001 [ACK] Seq=236572881 Ack=12935101 Win=65535 Len=2920 [TCP segment of a reassembled PDU]
1,5.887902999999824,62.210.85.178,10.0.2.15,TCP,60,9001  >  35978 [ACK] Seq=12935101 Ack=236570271 Win=65535 Len=0
1,5.887910999999804,62.210.85.178,10.0.2.15,TCP,60,9001  >  35978 [ACK] Seq=12935101 Ack=236571731 Win=65535 Len=0
1,5.887915999999677,62.210.85.178,10.0.2.15,TCP,60,9001  >  35978 [ACK] Seq=12935101 Ack=236572881 Win=65535 Len=0
1,5.887953999999809,10.0.2.15,62.210.85.178,TLSv1.2,1204,Application Data
1,5.887993999999708,62.210.85.178,10.0.2.15,TCP,60,9001  >  35978 [ACK] Seq=12935101 Ack=236574341 Win=65535 Len=0
1,5.88799999999992,62.210.85.178,10.0.2.15,TCP,60,9001  >  35978 [ACK] Seq=12935101 Ack=236575801 Win=65535 Len=0
1,5.888004999999794,62.210.85.178,10.0.2.15,TCP,60,9001  >  35978 [ACK] Seq=12935101 Ack=236576951 Win=65535 Len=0
1,5.888050999999905,10.0.2.15,62.210.85.178,TLSv1.2,4124,Application Data
1,5.888124000000062,62.210.85.178,10.0.2.15,TCP,60,9001  >  35978 [ACK] Seq=12935101 Ack=236578411 Win=65535 Len=0
1,5.888132000000041,62.210.85.178,10.0.2.15,TCP,60,9001  >  35978 [ACK] Seq=12935101 Ack=236579871 Win=65535 Len=0
1,5.888135999999577,62.210.85.178,10.0.2.15,TCP,60,9001  >  35978 [ACK] Seq=12935101 Ack=236581021 Win=65535 Len=0
1,5.888167000000067,10.0.2.15,62.210.85.178,TCP,2974,35978  >  9001 [ACK] Seq=236581021 Ack=12935101 Win=65535 Len=2920 [TCP segment of a reassembled PDU]
1,5.888206999999966,62.210.85.178,10.0.2.15,TCP,60,9001  >  35978 [ACK] Seq=12935101 Ack=236582481 Win=65535 Len=0
1,5.888213999999607,62.210.85.178,10.0.2.15,TCP,60,9001  >  35978 [ACK] Seq=12935101 Ack=236583941 Win=65535 Len=0
1,5.8882519999997385,10.0.2.15,62.210.85.178,TLSv1.2,1204,Application Data
1,5.888291000000208,62.210.85.178,10.0.2.15,TCP,60,9001  >  35978 [ACK] Seq=12935101 Ack=236585091 Win=65535 Len=0
1,5.888334999999643,10.0.2.15,62.210.85.178,TLSv1.2,332,Application Data
1,5.888372999999774,62.210.85.178,10.0.2.15,TCP,60,9001  >  35978 [ACK] Seq=12935101 Ack=236585369 Win=65535 Len=0
1,5.888461000000461,10.0.2.15,62.210.85.178,TLSv1.2,3868,Application Data
1,5.888501999999789,62.210.85.178,10.0.2.15,TCP,60,9001  >  35978 [ACK] Seq=12935101 Ack=236586829 Win=65535 Len=0
1,5.888508000000002,62.210.85.178,10.0.2.15,TCP,60,9001  >  35978 [ACK] Seq=12935101 Ack=236588289 Win=65535 Len=0
1,5.888512999999875,62.210.85.178,10.0.2.15,TCP,60,9001  >  35978 [ACK] Seq=12935101 Ack=236589183 Win=65535 Len=0
1,5.888613000000078,10.0.2.15,62.210.85.178,TLSv1.2,4124,Application Data
1,5.888656000000083,62.210.85.178,10.0.2.15,TCP,60,9001  >  35978 [ACK] Seq=12935101 Ack=236590643 Win=65535 Len=0
1,5.888662000000295,62.210.85.178,10.0.2.15,TCP,60,9001  >  35978 [ACK] Seq=12935101 Ack=236592103 Win=65535 Len=0
1,5.888667000000169,62.210.85.178,10.0.2.15,TCP,60,9001  >  35978 [ACK] Seq=12935101 Ack=236593253 Win=65535 Len=0
1,5.888710999999603,10.0.2.15,62.210.85.178,TLSv1.2,3030,Application Data
1,5.888750000000073,62.210.85.178,10.0.2.15,TCP,60,9001  >  35978 [ACK] Seq=12935101 Ack=236594713 Win=65535 Len=0
1,5.888756999999714,62.210.85.178,10.0.2.15,TCP,60,9001  >  35978 [ACK] Seq=12935101 Ack=236596173 Win=65535 Len=0
1,5.888761999999588,62.210.85.178,10.0.2.15,TCP,60,9001  >  35978 [ACK] Seq=12935101 Ack=236596229 Win=65535 Len=0
1,5.90120399999978,10.0.2.15,62.210.85.178,TLSv1.2,4124,Application Data
1,5.901302000000214,10.0.2.15,62.210.85.178,TCP,2974,35978  >  9001 [ACK] Seq=236600299 Ack=12935101 Win=65535 Len=2920 [TCP segment of a reassembled PDU]
1,5.9013459999996485,62.210.85.178,10.0.2.15,TCP,60,9001  >  35978 [ACK] Seq=12935101 Ack=236597689 Win=65535 Len=0
1,5.901356000000305,62.210.85.178,10.0.2.15,TCP,60,9001  >  35978 [ACK] Seq=12935101 Ack=236599149 Win=65535 Len=0
1,5.9013599999998405,62.210.85.178,10.0.2.15,TCP,60,9001  >  35978 [ACK] Seq=12935101 Ack=236600299 Win=65535 Len=0
1,5.901423999999679,10.0.2.15,62.210.85.178,TLSv1.2,1204,Application Data
1,5.901445999999851,62.210.85.178,10.0.2.15,TCP,60,9001  >  35978 [ACK] Seq=12935101 Ack=236601759 Win=65535 Len=0
1,5.9014530000004015,62.210.85.178,10.0.2.15,TCP,60,9001  >  35978 [ACK] Seq=12935101 Ack=236603219 Win=65535 Len=0
1,5.9015449999997145,62.210.85.178,10.0.2.15,TCP,60,9001  >  35978 [ACK] Seq=12935101 Ack=236604369 Win=65535 Len=0
1,5.901582000000417,10.0.2.15,62.210.85.178,TLSv1.2,204,Application Data
1,5.901679999999942,62.210.85.178,10.0.2.15,TCP,60,9001  >  35978 [ACK] Seq=12935101 Ack=236604519 Win=65535 Len=0
1,5.993284000000131,54.93.77.70,10.0.2.15,TLSv1.2,590,Application Data
1,6.006188999999722,54.93.77.70,10.0.2.15,TCP,2950,"9001  >  34692 [PSH, ACK] Seq=236449207 Ack=13021099 Win=65535 Len=2896 [TCP segment of a reassembled PDU]"
1,6.006266000000323,10.0.2.15,54.93.77.70,TCP,54,34692  >  9001 [ACK] Seq=13021099 Ack=236452103 Win=65535 Len=0
1,6.010436999999911,54.93.77.70,10.0.2.15,TLSv1.2,778,Application Data
1,6.020902999999635,54.93.77.70,10.0.2.15,TCP,2950,"9001  >  34692 [PSH, ACK] Seq=236452827 Ack=13021099 Win=65535 Len=2896 [TCP segment of a reassembled PDU]"
1,6.020945000000211,10.0.2.15,54.93.77.70,TCP,54,34692  >  9001 [ACK] Seq=13021099 Ack=236455723 Win=65535 Len=0
1,6.026695999999902,54.93.77.70,10.0.2.15,TLSv1.2,778,Application Data
1,6.030775999999605,54.93.77.70,10.0.2.15,TCP,2950,"9001  >  34692 [PSH, ACK] Seq=236456447 Ack=13021099 Win=65535 Len=2896 [TCP segment of a reassembled PDU]"
1,6.030816999999843,10.0.2.15,54.93.77.70,TCP,54,34692  >  9001 [ACK] Seq=13021099 Ack=236459343 Win=65535 Len=0
1,6.044229000000087,54.93.77.70,10.0.2.15,TLSv1.2,2950,"Application Data, Application Data"
1,6.044283000000178,54.93.77.70,10.0.2.15,TLSv1.2,7154,"Application Data, Application Data"
1,6.044329000000289,10.0.2.15,54.93.77.70,TCP,54,34692  >  9001 [ACK] Seq=13021099 Ack=236462239 Win=65535 Len=0
1,6.0443960000002335,54.93.77.70,10.0.2.15,TCP,3090,"9001  >  34692 [PSH, ACK] Seq=236469339 Ack=13021099 Win=65535 Len=3036 [TCP segment of a reassembled PDU]"
1,6.044469999999819,10.0.2.15,54.93.77.70,TCP,54,34692  >  9001 [ACK] Seq=13021099 Ack=236472375 Win=65535 Len=0
1,6.044726000000082,10.0.2.15,54.93.77.70,TLSv1.2,590,Application Data
1,6.0448379999998,54.93.77.70,10.0.2.15,TCP,60,9001  >  34692 [ACK] Seq=236472375 Ack=13021635 Win=65535 Len=0
1,6.04729000000043,54.93.77.70,10.0.2.15,TLSv1.2,170,Application Data
1,6.0537930000000415,54.93.77.70,10.0.2.15,TCP,2950,"9001  >  34692 [PSH, ACK] Seq=236472491 Ack=13021635 Win=65535 Len=2896 [TCP segment of a reassembled PDU]"
1,6.0538580000002185,10.0.2.15,54.93.77.70,TCP,54,34692  >  9001 [ACK] Seq=13021635 Ack=236475387 Win=65535 Len=0
1,6.070209999999861,54.93.77.70,10.0.2.15,TLSv1.2,778,Application Data
1,6.070413999999801,10.0.2.15,54.93.77.70,TLSv1.2,590,Application Data
1,6.070534999999836,54.93.77.70,10.0.2.15,TCP,60,9001  >  34692 [ACK] Seq=236476111 Ack=13022171 Win=65535 Len=0
1,6.071842000000288,54.93.77.70,10.0.2.15,TCP,2950,"9001  >  34692 [PSH, ACK] Seq=236476111 Ack=13022171 Win=65535 Len=2896 [TCP segment of a reassembled PDU]"
1,6.071907999999894,10.0.2.15,54.93.77.70,TCP,54,34692  >  9001 [ACK] Seq=13022171 Ack=236479007 Win=65535 Len=0
1,6.076912000000448,54.93.77.70,10.0.2.15,TLSv1.2,7294,"Application Data, Application Data"
1,6.076990999999907,10.0.2.15,54.93.77.70,TCP,54,34692  >  9001 [ACK] Seq=13022171 Ack=236486247 Win=65535 Len=0
1,6.0843940000004295,54.93.77.70,10.0.2.15,TLSv1.2,5846,"Application Data, Application Data"
1,6.084452000000056,10.0.2.15,54.93.77.70,TCP,54,34692  >  9001 [ACK] Seq=13022171 Ack=236492039 Win=65535 Len=0
1,6.085087000000385,54.93.77.70,10.0.2.15,TLSv1.2,2950,Application Data [TCP segment of a reassembled PDU]
1,6.085133999999925,10.0.2.15,54.93.77.70,TCP,54,34692  >  9001 [ACK] Seq=13022171 Ack=236494935 Win=65535 Len=0
1,6.086852000000363,54.93.77.70,10.0.2.15,TLSv1.2,1408,Application Data
1,6.093053999999938,54.93.77.70,10.0.2.15,TCP,2950,"9001  >  34692 [PSH, ACK] Seq=236496289 Ack=13022171 Win=65535 Len=2896 [TCP segment of a reassembled PDU]"
1,6.093101000000388,10.0.2.15,54.93.77.70,TCP,54,34692  >  9001 [ACK] Seq=13022171 Ack=236499185 Win=65535 Len=0
1,6.104290000000219,54.93.77.70,10.0.2.15,TLSv1.2,2950,"Application Data, Application Data"
1,6.104309999999714,54.93.77.70,10.0.2.15,TLSv1.2,2950,Application Data [TCP segment of a reassembled PDU]
1,6.104347000000416,10.0.2.15,54.93.77.70,TCP,54,34692  >  9001 [ACK] Seq=13022171 Ack=236502081 Win=65535 Len=0
1,6.104425999999876,10.0.2.15,54.93.77.70,TCP,54,34692  >  9001 [ACK] Seq=13022171 Ack=236504977 Win=65535 Len=0
1,6.10462600000028,10.0.2.15,54.93.77.70,TLSv1.2,590,Application Data
1,6.104693000000225,54.93.77.70,10.0.2.15,TCP,60,9001  >  34692 [ACK] Seq=236504977 Ack=13022707 Win=65535 Len=0
1,6.105174000000261,54.93.77.70,10.0.2.15,TLSv1.2,7294,Application Data [TCP segment of a reassembled PDU]
1,6.105228000000352,10.0.2.15,54.93.77.70,TCP,54,34692  >  9001 [ACK] Seq=13022707 Ack=236512217 Win=65535 Len=0
1,6.109206000000086,54.93.77.70,10.0.2.15,TLSv1.2,170,Application Data
