No.,Time,Source,Destination,Protocol,Length,Info
1,0.00025400000049558,10.0.2.15,62.210.85.178,TCP,54,35978  >  9001 [ACK] Seq=237081051 Ack=12963267 Win=65535 Len=0
1,0.027172999999493186,10.0.2.15,54.93.77.70,TCP,54,34692  >  9001 [ACK] Seq=13050447 Ack=236988997 Win=65535 Len=0
1,0.033065999999962514,62.210.85.178,10.0.2.15,TLSv1.2,590,Application Data
1,0.03316300000005867,10.0.2.15,62.210.85.178,TCP,54,35978  >  9001 [ACK] Seq=237081051 Ack=12963803 Win=65535 Len=0
1,0.09232599999995728,62.210.85.178,10.0.2.15,TLSv1.2,590,Application Data
1,0.0924219999997149,10.0.2.15,62.210.85.178,TCP,54,35978  >  9001 [ACK] Seq=237081051 Ack=12964339 Win=65535 Len=0
1,0.1608059999998659,10.0.2.15,54.93.77.70,TLSv1.2,590,Application Data
1,0.16099399999984598,54.93.77.70,10.0.2.15,TCP,60,9001  >  34692 [ACK] Seq=236988997 Ack=13050983 Win=65535 Len=0
1,0.6792189999996481,62.210.85.178,10.0.2.15,TLSv1.2,590,Application Data
1,0.679298000000017,10.0.2.15,62.210.85.178,TCP,54,35978  >  9001 [ACK] Seq=237081051 Ack=12964875 Win=65535 Len=0
1,0.6795979999997144,10.0.2.15,62.210.85.178,TLSv1.2,590,Application Data
1,0.6796889999995983,62.210.85.178,10.0.2.15,TCP,60,9001  >  35978 [ACK] Seq=12964875 Ack=237081587 Win=65535 Len=0
1,0.7583210000002509,54.93.77.70,10.0.2.15,TLSv1.2,590,Application Data
1,0.7584079999996902,10.0.2.15,54.93.77.70,TCP,54,34692  >  9001 [ACK] Seq=13050983 Ack=236989533 Win=65535 Len=0
1,0.7587819999998828,10.0.2.15,54.93.77.70,TLSv1.2,1618,Application Data
1,0.7588989999994737,54.93.77.70,10.0.2.15,TCP,60,9001  >  34692 [ACK] Seq=236989533 Ack=13052443 Win=65535 Len=0
1,0.7589120000002367,54.93.77.70,10.0.2.15,TCP,60,9001  >  34692 [ACK] Seq=236989533 Ack=13052547 Win=65535 Len=0
1,0.8551489999999831,62.210.85.178,10.0.2.15,TLSv1.2,1618,Application Data
1,0.8552829999998721,10.0.2.15,62.210.85.178,TCP,54,35978  >  9001 [ACK] Seq=237081587 Ack=12966439 Win=65535 Len=0
1,0.8683579999997164,10.0.2.15,62.210.85.178,TLSv1.2,590,Application Data
1,0.8684969999994792,62.210.85.178,10.0.2.15,TCP,60,9001  >  35978 [ACK] Seq=12966439 Ack=237082123 Win=65535 Len=0
1,0.8780049999995754,10.0.2.15,62.210.85.178,TLSv1.2,1618,Application Data
1,0.8781220000000758,62.210.85.178,10.0.2.15,TCP,60,9001  >  35978 [ACK] Seq=12966439 Ack=237083583 Win=65535 Len=0
1,0.8781380000000354,62.210.85.178,10.0.2.15,TCP,60,9001  >  35978 [ACK] Seq=12966439 Ack=237083687 Win=65535 Len=0
1,0.9635579999994661,54.93.77.70,10.0.2.15,TLSv1.2,590,Application Data
1,1.0052779999996346,10.0.2.15,54.93.77.70,TCP,54,34692  >  9001 [ACK] Seq=13052547 Ack=236990069 Win=65535 Len=0
1,1.01031200000034,54.93.77.70,10.0.2.15,TLSv1.2,1618,Application Data
1,1.0103559999997742,10.0.2.15,54.93.77.70,TCP,54,34692  >  9001 [ACK] Seq=13052547 Ack=236991633 Win=65535 Len=0
1,1.012337999999545,10.0.2.15,54.93.77.70,TLSv1.2,590,Application Data
1,1.0125060000000303,54.93.77.70,10.0.2.15,TCP,60,9001  >  34692 [ACK] Seq=236991633 Ack=13053083 Win=65535 Len=0
1,1.2936319999998886,62.210.85.178,10.0.2.15,TLSv1.2,590,Application Data
1,1.2939409999999043,10.0.2.15,62.210.85.178,TLSv1.2,590,Application Data
1,1.2940339999995558,62.210.85.178,10.0.2.15,TCP,60,9001  >  35978 [ACK] Seq=12966975 Ack=237084223 Win=65535 Len=0
1,1.4986429999999018,54.93.77.70,10.0.2.15,TLSv1.2,590,Application Data
1,1.4990129999996498,10.0.2.15,54.93.77.70,TLSv1.2,590,Application Data
1,1.4991229999995994,54.93.77.70,10.0.2.15,TCP,60,9001  >  34692 [ACK] Seq=236992169 Ack=13053619 Win=65535 Len=0
1,1.7031829999996262,62.210.85.178,10.0.2.15,TLSv1.2,590,Application Data
1,1.7089880000003177,10.0.2.15,62.210.85.178,TLSv1.2,590,Application Data
1,1.7091559999998935,62.210.85.178,10.0.2.15,TCP,60,9001  >  35978 [ACK] Seq=12967511 Ack=237084759 Win=65535 Len=0
1,1.7220470000002024,10.0.2.15,62.210.85.178,TLSv1.2,4124,Application Data
1,1.7221650000001318,10.0.2.15,62.210.85.178,TCP,2974,35978  >  9001 [ACK] Seq=237088829 Ack=12967511 Win=65535 Len=2920 [TCP segment of a reassembled PDU]
1,1.7222119999996721,62.210.85.178,10.0.2.15,TCP,60,9001  >  35978 [ACK] Seq=12967511 Ack=237086219 Win=65535 Len=0
1,1.7222249999995256,62.210.85.178,10.0.2.15,TCP,60,9001  >  35978 [ACK] Seq=12967511 Ack=237087679 Win=65535 Len=0
1,1.7222300000003088,62.210.85.178,10.0.2.15,TCP,60,9001  >  35978 [ACK] Seq=12967511 Ack=237088829 Win=65535 Len=0
1,1.72223699999995,62.210.85.178,10.0.2.15,TCP,60,9001  >  35978 [ACK] Seq=12967511 Ack=237090289 Win=65535 Len=0
1,1.7222400000000562,62.210.85.178,10.0.2.15,TCP,60,9001  >  35978 [ACK] Seq=12967511 Ack=237091749 Win=65535 Len=0
1,1.7222789999996166,10.0.2.15,62.210.85.178,TLSv1.2,1204,Application Data
1,1.7223480000002382,10.0.2.15,62.210.85.178,TCP,2974,35978  >  9001 [ACK] Seq=237092899 Ack=12967511 Win=65535 Len=2920 [TCP segment of a reassembled PDU]
1,1.7226149999996778,62.210.85.178,10.0.2.15,TCP,60,9001  >  35978 [ACK] Seq=12967511 Ack=237092899 Win=65535 Len=0
1,1.722635000000082,62.210.85.178,10.0.2.15,TCP,60,9001  >  35978 [ACK] Seq=12967511 Ack=237094359 Win=65535 Len=0
1,1.7226430000000619,62.210.85.178,10.0.2.15,TCP,60,9001  >  35978 [ACK] Seq=12967511 Ack=237095819 Win=65535 Len=0
1,1.7226899999996022,10.0.2.15,62.210.85.178,TLSv1.2,1204,Application Data
1,1.7227530000000115,62.210.85.178,10.0.2.15,TCP,60,9001  >  35978 [ACK] Seq=12967511 Ack=237096969 Win=65535 Len=0
1,1.7227970000003552,10.0.2.15,62.210.85.178,TLSv1.2,4124,Application Data
1,1.7228500000001077,62.210.85.178,10.0.2.15,TCP,60,9001  >  35978 [ACK] Seq=12967511 Ack=237098429 Win=65535 Len=0
1,1.72285600000032,62.210.85.178,10.0.2.15,TCP,60,9001  >  35978 [ACK] Seq=12967511 Ack=237099889 Win=65535 Len=0
1,1.7229299999999057,10.0.2.15,62.210.85.178,TLSv1.2,2974,Application Data
1,1.7229660000002696,62.210.85.178,10.0.2.15,TCP,60,9001  >  35978 [ACK] Seq=12967511 Ack=237101039 Win=65535 Len=0
1,1.7229740000002494,62.210.85.178,10.0.2.15,TCP,60,9001  >  35978 [ACK] Seq=12967511 Ack=237102499 Win=65535 Len=0
1,1.7229779999997845,62.210.85.178,10.0.2.15,TCP,60,9001  >  35978 [ACK] Seq=12967511 Ack=237103959 Win=65535 Len=0
1,1.72300499999983,10.0.2.15,62.210.85.178,TLSv1.2,1226,Application Data
1,1.7230369999997492,62.210.85.178,10.0.2.15,TCP,60,9001  >  35978 [ACK] Seq=12967511 Ack=237105131 Win=65535 Len=0
1,1.7230779999999868,10.0.2.15,62.210.85.178,TLSv1.2,4124,Application Data
1,1.723113000000012,62.210.85.178,10.0.2.15,TCP,60,9001  >  35978 [ACK] Seq=12967511 Ack=237106591 Win=65535 Len=0
1,1.7231190000002243,62.210.85.178,10.0.2.15,TCP,60,9001  >  35978 [ACK] Seq=12967511 Ack=237108051 Win=65535 Len=0
1,1.7231220000003304,62.210.85.178,10.0.2.15,TCP,60,9001  >  35978 [ACK] Seq=12967511 Ack=237109201 Win=65535 Len=0
1,1.7231579999997848,10.0.2.15,62.210.85.178,TLSv1.2,3030,Application Data
1,1.7231929999998101,62.210.85.178,10.0.2.15,TCP,60,9001  >  35978 [ACK] Seq=12967511 Ack=237110661 Win=65535 Len=0
1,1.7231990000000224,62.210.85.178,10.0.2.15,TCP,60,9001  >  35978 [ACK] Seq=12967511 Ack=237112121 Win=65535 Len=0
1,1.7232020000001285,62.210.85.178,10.0.2.15,TCP,60,9001  >  35978 [ACK] Seq=12967511 Ack=237112177 Win=65535 Len=0
1,1.733524999999645,10.0.2.15,62.210.85.178,TLSv1.2,4124,Application Data
1,1.7335759999996299,62.210.85.178,10.0.2.15,TCP,60,9001  >  35978 [ACK] Seq=12967511 Ack=237113637 Win=65535 Len=0
1,1.7335889999994833,62.210.85.178,10.0.2.15,TCP,60,9001  >  35978 [ACK] Seq=12967511 Ack=237115097 Win=65535 Len=0
1,1.733592999999928,62.210.85.178,10.0.2.15,TCP,60,9001  >  35978 [ACK] Seq=12967511 Ack=237116247 Win=65535 Len=0
1,1.7336370000002717,10.0.2.15,62.210.85.178,TLSv1.2,4124,Application Data
1,1.733672999999726,62.210.85.178,10.0.2.15,TCP,60,9001  >  35978 [ACK] Seq=12967511 Ack=237117707 Win=65535 Len=0
1,1.7336809999997058,62.210.85.178,10.0.2.15,TCP,60,9001  >  35978 [ACK] Seq=12967511 Ack=237119167 Win=65535 Len=0
1,1.7336859999995795,62.210.85.178,10.0.2.15,TCP,60,9001  >  35978 [ACK] Seq=12967511 Ack=237120317 Win=65535 Len=0
1,1.7337219999999434,10.0.2.15,62.210.85.178,TLSv1.2,4124,Application Data
1,1.7337569999999687,62.210.85.178,10.0.2.15,TCP,60,9001  >  35978 [ACK] Seq=12967511 Ack=237121777 Win=65535 Len=0
1,1.7337649999999485,62.210.85.178,10.0.2.15,TCP,60,9001  >  35978 [ACK] Seq=12967511 Ack=237123237 Win=65535 Len=0
1,1.7337680000000546,62.210.85.178,10.0.2.15,TCP,60,9001  >  35978 [ACK] Seq=12967511 Ack=237124387 Win=65535 Len=0
1,1.73380300000008,10.0.2.15,62.210.85.178,TLSv1.2,4124,Application Data
1,1.7338369999997667,62.210.85.178,10.0.2.15,TCP,60,9001  >  35978 [ACK] Seq=12967511 Ack=237125847 Win=65535 Len=0
1,1.7338449999997465,62.210.85.178,10.0.2.15,TCP,60,9001  >  35978 [ACK] Seq=12967511 Ack=237127307 Win=65535 Len=0
1,1.7338499999996202,62.210.85.178,10.0.2.15,TCP,60,9001  >  35978 [ACK] Seq=12967511 Ack=237128457 Win=65535 Len=0
1,1.7338840000002165,10.0.2.15,62.210.85.178,TLSv1.2,332,Application Data
1,1.7339179999999033,62.210.85.178,10.0.2.15,TCP,60,9001  >  35978 [ACK] Seq=12967511 Ack=237128735 Win=65535 Len=0
1,1.733965999999782,10.0.2.15,62.210.85.178,TLSv1.2,3868,Application Data
1,1.734002999999575,62.210.85.178,10.0.2.15,TCP,60,9001  >  35978 [ACK] Seq=12967511 Ack=237130195 Win=65535 Len=0
1,1.7340100000001257,62.210.85.178,10.0.2.15,TCP,60,9001  >  35978 [ACK] Seq=12967511 Ack=237131655 Win=65535 Len=0
1,1.7340130000002318,62.210.85.178,10.0.2.15,TCP,60,9001  >  35978 [ACK] Seq=12967511 Ack=237132549 Win=65535 Len=0
1,1.7340500000000247,10.0.2.15,62.210.85.178,TLSv1.2,4124,Application Data
1,1.73408500000005,62.210.85.178,10.0.2.15,TCP,60,9001  >  35978 [ACK] Seq=12967511 Ack=237134009 Win=65535 Len=0
1,1.7340910000002623,62.210.85.178,10.0.2.15,TCP,60,9001  >  35978 [ACK] Seq=12967511 Ack=237135469 Win=65535 Len=0
1,1.7340949999997974,62.210.85.178,10.0.2.15,TCP,60,9001  >  35978 [ACK] Seq=12967511 Ack=237136619 Win=65535 Len=0
1,1.7341280000000552,10.0.2.15,62.210.85.178,TLSv1.2,3030,Application Data
1,1.7341630000000805,62.210.85.178,10.0.2.15,TCP,60,9001  >  35978 [ACK] Seq=12967511 Ack=237138079 Win=65535 Len=0
1,1.7341690000002927,62.210.85.178,10.0.2.15,TCP,60,9001  >  35978 [ACK] Seq=12967511 Ack=237139539 Win=65535 Len=0
1,1.7341740000001664,62.210.85.178,10.0.2.15,TCP,60,9001  >  35978 [ACK] Seq=12967511 Ack=237139595 Win=65535 Len=0
1,1.7455989999998565,10.0.2.15,62.210.85.178,TLSv1.2,4124,Application Data
1,1.7456739999997808,62.210.85.178,10.0.2.15,TCP,60,9001  >  35978 [ACK] Seq=12967511 Ack=237141055 Win=65535 Len=0
1,1.7456830000000991,62.210.85.178,10.0.2.15,TCP,60,9001  >  35978 [ACK] Seq=12967511 Ack=237142515 Win=65535 Len=0
1,1.7456860000002052,62.210.85.178,10.0.2.15,TCP,60,9001  >  35978 [ACK] Seq=12967511 Ack=237143665 Win=65535 Len=0
1,1.7457260000001042,10.0.2.15,62.210.85.178,TLSv1.2,4124,Application Data
1,1.7457610000001296,62.210.85.178,10.0.2.15,TCP,60,9001  >  35978 [ACK] Seq=12967511 Ack=237145125 Win=65535 Len=0
1,1.7457690000001094,62.210.85.178,10.0.2.15,TCP,60,9001  >  35978 [ACK] Seq=12967511 Ack=237146585 Win=65535 Len=0
1,1.7457729999996445,62.210.85.178,10.0.2.15,TCP,60,9001  >  35978 [ACK] Seq=12967511 Ack=237147735 Win=65535 Len=0
1,1.745810000000347,10.0.2.15,62.210.85.178,TLSv1.2,4124,Application Data
1,1.7458440000000337,62.210.85.178,10.0.2.15,TCP,60,9001  >  35978 [ACK] Seq=12967511 Ack=237149195 Win=65535 Len=0
1,1.745850999999675,62.210.85.178,10.0.2.15,TCP,60,9001  >  35978 [ACK] Seq=12967511 Ack=237150655 Win=65535 Len=0
1,1.7458550000001196,62.210.85.178,10.0.2.15,TCP,60,9001  >  35978 [ACK] Seq=12967511 Ack=237151805 Win=65535 Len=0
1,1.7458889999998064,10.0.2.15,62.210.85.178,TLSv1.2,268,Application Data
1,1.7459220000000641,62.210.85.178,10.0.2.15,TCP,60,9001  >  35978 [ACK] Seq=12967511 Ack=237152019 Win=65535 Len=0
1,1.8146059999999125,54.93.77.70,10.0.2.15,TLSv1.2,590,Application Data
1,1.844941999999719,54.93.77.70,10.0.2.15,TCP,2950,"9001  >  34692 [PSH, ACK] Seq=236992705 Ack=13053619 Win=65535 Len=2896 [TCP segment of a reassembled PDU]"
1,1.8450629999997545,10.0.2.15,54.93.77.70,TCP,54,34692  >  9001 [ACK] Seq=13053619 Ack=236995601 Win=65535 Len=0
1,1.8560189999998329,54.93.77.70,10.0.2.15,TLSv1.2,8742,"Application Data, Application Data"
1,1.8560969999998633,10.0.2.15,54.93.77.70,TCP,54,34692  >  9001 [ACK] Seq=13053619 Ack=237004289 Win=65535 Len=0
1,1.8562990000000354,10.0.2.15,54.93.77.70,TLSv1.2,590,Application Data
1,1.8564100000003236,54.93.77.70,10.0.2.15,TCP,60,9001  >  34692 [ACK] Seq=237004289 Ack=13054155 Win=65535 Len=0
1,1.8611039999996137,54.93.77.70,10.0.2.15,TLSv1.2,380,"Application Data, Application Data"
1,1.901267000000189,10.0.2.15,54.93.77.70,TCP,54,34692  >  9001 [ACK] Seq=13054155 Ack=237004615 Win=65535 Len=0
1,1.931974000000082,54.93.77.70,10.0.2.15,TLSv1.2,7808,"Application Data, Application Data"
1,1.9320609999995213,10.0.2.15,54.93.77.70,TCP,54,34692  >  9001 [ACK] Seq=13054155 Ack=237012369 Win=65535 Len=0
1,1.9406639999997424,54.93.77.70,10.0.2.15,TCP,2950,"9001  >  34692 [PSH, ACK] Seq=237012369 Ack=13054155 Win=65535 Len=2896 [TCP segment of a reassembled PDU]"
1,1.9407149999997273,10.0.2.15,54.93.77.70,TCP,54,34692  >  9001 [ACK] Seq=13054155 Ack=237015265 Win=65535 Len=0
1,1.9415490000001228,54.93.77.70,10.0.2.15,TLSv1.2,4398,Application Data [TCP segment of a reassembled PDU]
1,1.9415939999998955,10.0.2.15,54.93.77.70,TCP,54,34692  >  9001 [ACK] Seq=13054155 Ack=237019609 Win=65535 Len=0
1,1.9487389999994775,54.93.77.70,10.0.2.15,TLSv1.2,1104,"Application Data, Application Data"
1,1.9487840000001597,10.0.2.15,54.93.77.70,TCP,54,34692  >  9001 [ACK] Seq=13054155 Ack=237020659 Win=65535 Len=0
1,1.948978999999781,10.0.2.15,54.93.77.70,TLSv1.2,590,Application Data
1,1.9490919999998368,54.93.77.70,10.0.2.15,TCP,60,9001  >  34692 [ACK] Seq=237020659 Ack=13054691 Win=65535 Len=0
1,1.9636890000001586,54.93.77.70,10.0.2.15,TCP,2950,"9001  >  34692 [PSH, ACK] Seq=237020659 Ack=13054691 Win=65535 Len=2896 [TCP segment of a reassembled PDU]"
1,1.9637620000003153,10.0.2.15,54.93.77.70,TCP,54,34692  >  9001 [ACK] Seq=13054691 Ack=237023555 Win=65535 Len=0
1,1.964719999999943,54.93.77.70,10.0.2.15,TLSv1.2,778,Application Data
1,1.9791059999997742,54.93.77.70,10.0.2.15,TCP,2950,"9001  >  34692 [PSH, ACK] Seq=237024279 Ack=13054691 Win=65535 Len=2896 [TCP segment of a reassembled PDU]"
1,1.9791500000001179,10.0.2.15,54.93.77.70,TCP,54,34692  >  9001 [ACK] Seq=13054691 Ack=237027175 Win=65535 Len=0
1,1.9811849999996411,54.93.77.70,10.0.2.15,TLSv1.2,778,Application Data
1,1.9844729999995252,62.210.85.178,10.0.2.15,TLSv1.2,590,Application Data
1,1.9889839999996184,54.93.77.70,10.0.2.15,TLSv1.2,7294,Application Data
1,1.9890500000001339,10.0.2.15,54.93.77.70,TCP,54,34692  >  9001 [ACK] Seq=13054691 Ack=237035139 Win=65535 Len=0
1,1.9974910000000818,54.93.77.70,10.0.2.15,TLSv1.2,568,Application Data
1,2.009291999999732,54.93.77.70,10.0.2.15,TCP,2950,"9001  >  34692 [PSH, ACK] Seq=237035653 Ack=13054691 Win=65535 Len=2896 [TCP segment of a reassembled PDU]"
1,2.009334000000308,10.0.2.15,54.93.77.70,TCP,54,34692  >  9001 [ACK] Seq=13054691 Ack=237038549 Win=65535 Len=0
1,2.0095979999996416,54.93.77.70,10.0.2.15,TLSv1.2,1502,Application Data [TCP segment of a reassembled PDU]
1,2.009638999999879,10.0.2.15,54.93.77.70,TCP,54,34692  >  9001 [ACK] Seq=13054691 Ack=237039997 Win=65535 Len=0
1,2.0139579999995476,54.93.77.70,10.0.2.15,TLSv1.2,1408,Application Data
1,2.025278000000071,10.0.2.15,62.210.85.178,TCP,54,35978  >  9001 [ACK] Seq=237152019 Ack=12968047 Win=65535 Len=0
1,2.05724999999984,10.0.2.15,54.93.77.70,TCP,54,34692  >  9001 [ACK] Seq=13054691 Ack=237041351 Win=65535 Len=0
1,2.093753000000106,62.210.85.178,10.0.2.15,TLSv1.2,590,Application Data
1,2.09385199999997,10.0.2.15,62.210.85.178,TCP,54,35978  >  9001 [ACK] Seq=237152019 Ack=12968583 Win=65535 Len=0
1,2.099659999999858,54.93.77.70,10.0.2.15,TLSv1.2,5846,Application Data
1,2.099725999999464,10.0.2.15,54.93.77.70,TCP,54,34692  >  9001 [ACK] Seq=13054691 Ack=237047143 Win=65535 Len=0
1,2.0999650000003385,10.0.2.15,54.93.77.70,TLSv1.2,590,Application Data
1,2.1000919999996768,54.93.77.70,10.0.2.15,TCP,60,9001  >  34692 [ACK] Seq=237047143 Ack=13055227 Win=65535 Len=0
1,2.100478999999723,54.93.77.70,10.0.2.15,TLSv1.2,2016,Application Data
1,2.100521999999728,10.0.2.15,54.93.77.70,TCP,54,34692  >  9001 [ACK] Seq=13055227 Ack=237049105 Win=65535 Len=0
1,2.109835999999632,10.0.2.15,54.93.77.70,TLSv1.2,590,Application Data
1,2.1099590000003445,54.93.77.70,10.0.2.15,TCP,60,9001  >  34692 [ACK] Seq=237049105 Ack=13055763 Win=65535 Len=0
1,2.122667999999976,54.93.77.70,10.0.2.15,TCP,2950,"9001  >  34692 [PSH, ACK] Seq=237049105 Ack=13055763 Win=65535 Len=2896 [TCP segment of a reassembled PDU]"
1,2.122776999999587,54.93.77.70,10.0.2.15,TLSv1.2,778,Application Data
1,2.122812999999951,10.0.2.15,54.93.77.70,TCP,54,34692  >  9001 [ACK] Seq=13055763 Ack=237052001 Win=65535 Len=0
1,2.129320000000007,54.93.77.70,10.0.2.15,TCP,2950,"9001  >  34692 [PSH, ACK] Seq=237052725 Ack=13055763 Win=65535 Len=2896 [TCP segment of a reassembled PDU]"
1,2.129393999999593,10.0.2.15,54.93.77.70,TCP,54,34692  >  9001 [ACK] Seq=13055763 Ack=237055621 Win=65535 Len=0
1,2.1294490000000224,54.93.77.70,10.0.2.15,TLSv1.2,1474,Application Data [TCP segment of a reassembled PDU]
1,2.1296590000001743,54.93.77.70,10.0.2.15,TCP,82,"9001  >  34692 [PSH, ACK] Seq=237057041 Ack=13055763 Win=65535 Len=28 [TCP segment of a reassembled PDU]"
1,2.129700999999841,10.0.2.15,54.93.77.70,TCP,54,34692  >  9001 [ACK] Seq=13055763 Ack=237057069 Win=65535 Len=0
1,2.1298049999995783,54.93.77.70,10.0.2.15,TLSv1.2,2950,Application Data
1,2.1298479999995834,10.0.2.15,54.93.77.70,TCP,54,34692  >  9001 [ACK] Seq=13055763 Ack=237059965 Win=65535 Len=0
1,2.13354900000013,10.0.2.15,54.93.77.70,TLSv1.2,590,Application Data
1,2.133737999999539,54.93.77.70,10.0.2.15,TCP,60,9001  >  34692 [ACK] Seq=237059965 Ack=13056299 Win=65535 Len=0
1,2.2267799999999625,62.210.85.178,10.0.2.15,TLSv1.2,590,Application Data
1,2.22687599999972,10.0.2.15,62.210.85.178,TCP,54,35978  >  9001 [ACK] Seq=237152019 Ack=12969119 Win=65535 Len=0
1,2.420227999999952,62.210.85.178,10.0.2.15,TLSv1.2,1104,Application Data
1,2.4203040000002147,10.0.2.15,62.210.85.178,TCP,54,35978  >  9001 [ACK] Seq=237152019 Ack=12970169 Win=65535 Len=0
1,2.420756999999867,10.0.2.15,62.210.85.178,TLSv1.2,590,Application Data
1,2.4208639999997104,62.210.85.178,10.0.2.15,TCP,60,9001  >  35978 [ACK] Seq=12970169 Ack=237152555 Win=65535 Len=0
1,2.5201459999998406,54.93.77.70,10.0.2.15,TLSv1.2,590,Application Data
1,2.5205290000003515,10.0.2.15,54.93.77.70,TLSv1.2,590,Application Data
1,2.5206310000003214,54.93.77.70,10.0.2.15,TCP,60,9001  >  34692 [ACK] Seq=237060501 Ack=13056835 Win=65535 Len=0
1,2.727520999999797,62.210.85.178,10.0.2.15,TLSv1.2,590,Application Data
1,2.7319500000003245,10.0.2.15,62.210.85.178,TLSv1.2,590,Application Data
1,2.7321270000002187,62.210.85.178,10.0.2.15,TCP,60,9001  >  35978 [ACK] Seq=12970705 Ack=237153091 Win=65535 Len=0
1,2.7423859999998967,10.0.2.15,62.210.85.178,TLSv1.2,4124,Application Data
1,2.7425320000002102,10.0.2.15,62.210.85.178,TCP,2974,35978  >  9001 [ACK] Seq=237157161 Ack=12970705 Win=65535 Len=2920 [TCP segment of a reassembled PDU]
1,2.742569000000003,62.210.85.178,10.0.2.15,TCP,60,9001  >  35978 [ACK] Seq=12970705 Ack=237154551 Win=65535 Len=0
1,2.7425789999997505,62.210.85.178,10.0.2.15,TCP,60,9001  >  35978 [ACK] Seq=12970705 Ack=237156011 Win=65535 Len=0
1,2.7425819999998566,62.210.85.178,10.0.2.15,TCP,60,9001  >  35978 [ACK] Seq=12970705 Ack=237157161 Win=65535 Len=0
1,2.742656999999781,10.0.2.15,62.210.85.178,TLSv1.2,1204,Application Data
1,2.7426809999997204,62.210.85.178,10.0.2.15,TCP,60,9001  >  35978 [ACK] Seq=12970705 Ack=237158621 Win=65535 Len=0
1,2.742688000000271,62.210.85.178,10.0.2.15,TCP,60,9001  >  35978 [ACK] Seq=12970705 Ack=237160081 Win=65535 Len=0
1,2.7426919999998063,62.210.85.178,10.0.2.15,TCP,60,9001  >  35978 [ACK] Seq=12970705 Ack=237161231 Win=65535 Len=0
1,2.7427440000001297,10.0.2.15,62.210.85.178,TLSv1.2,4124,Application Data
1,2.742782000000261,62.210.85.178,10.0.2.15,TCP,60,9001  >  35978 [ACK] Seq=12970705 Ack=237162691 Win=65535 Len=0
1,2.742790000000241,62.210.85.178,10.0.2.15,TCP,60,9001  >  35978 [ACK] Seq=12970705 Ack=237164151 Win=65535 Len=0
1,2.742793000000347,62.210.85.178,10.0.2.15,TCP,60,9001  >  35978 [ACK] Seq=12970705 Ack=237165301 Win=65535 Len=0
1,2.742830999999569,10.0.2.15,62.210.85.178,TLSv1.2,4124,Application Data
1,2.7428680000002714,62.210.85.178,10.0.2.15,TCP,60,9001  >  35978 [ACK] Seq=12970705 Ack=237166761 Win=65535 Len=0
1,2.742873999999574,62.210.85.178,10.0.2.15,TCP,60,9001  >  35978 [ACK] Seq=12970705 Ack=237168221 Win=65535 Len=0
1,2.7429309999997713,10.0.2.15,62.210.85.178,TLSv1.2,2974,Application Data
1,2.742967999999564,62.210.85.178,10.0.2.15,TCP,60,9001  >  35978 [ACK] Seq=12970705 Ack=237169371 Win=65535 Len=0
1,2.742975000000115,62.210.85.178,10.0.2.15,TCP,60,9001  >  35978 [ACK] Seq=12970705 Ack=237170831 Win=65535 Len=0
1,2.742978000000221,62.210.85.178,10.0.2.15,TCP,60,9001  >  35978 [ACK] Seq=12970705 Ack=237172291 Win=65535 Len=0
1,2.7430050000002666,10.0.2.15,62.210.85.178,TLSv1.2,1226,Application Data
1,2.743037999999615,62.210.85.178,10.0.2.15,TCP,60,9001  >  35978 [ACK] Seq=12970705 Ack=237173463 Win=65535 Len=0
1,2.7430759999997463,10.0.2.15,62.210.85.178,TLSv1.2,4124,Application Data
1,2.7431109999997716,62.210.85.178,10.0.2.15,TCP,60,9001  >  35978 [ACK] Seq=12970705 Ack=237174923 Win=65535 Len=0
1,2.7431180000003224,62.210.85.178,10.0.2.15,TCP,60,9001  >  35978 [ACK] Seq=12970705 Ack=237176383 Win=65535 Len=0
1,2.7431219999998575,62.210.85.178,10.0.2.15,TCP,60,9001  >  35978 [ACK] Seq=12970705 Ack=237177533 Win=65535 Len=0
1,2.7431610000003275,10.0.2.15,62.210.85.178,TLSv1.2,3030,Application Data
1,2.743196000000353,62.210.85.178,10.0.2.15,TCP,60,9001  >  35978 [ACK] Seq=12970705 Ack=237178993 Win=65535 Len=0
1,2.743202999999994,62.210.85.178,10.0.2.15,TCP,60,9001  >  35978 [ACK] Seq=12970705 Ack=237180453 Win=65535 Len=0
1,2.743206999999529,62.210.85.178,10.0.2.15,TCP,60,9001  >  35978 [ACK] Seq=12970705 Ack=237180509 Win=65535 Len=0
1,2.753529999999955,10.0.2.15,62.210.85.178,TLSv1.2,4124,Application Data
1,2.753606999999647,62.210.85.178,10.0.2.15,TCP,60,9001  >  35978 [ACK] Seq=12970705 Ack=237181969 Win=65535 Len=0
1,2.7536159999999654,62.210.85.178,10.0.2.15,TCP,60,9001  >  35978 [ACK] Seq=12970705 Ack=237183429 Win=65535 Len=0
1,2.7536199999995006,62.210.85.178,10.0.2.15,TCP,60,9001  >  35978 [ACK] Seq=12970705 Ack=237184579 Win=65535 Len=0
1,2.753660999999738,10.0.2.15,62.210.85.178,TLSv1.2,4124,Application Data
1,2.7537139999994906,62.210.85.178,10.0.2.15,TCP,60,9001  >  35978 [ACK] Seq=12970705 Ack=237186039 Win=65535 Len=0
1,2.7537240000001475,62.210.85.178,10.0.2.15,TCP,60,9001  >  35978 [ACK] Seq=12970705 Ack=237187499 Win=65535 Len=0
1,2.7537270000002536,62.210.85.178,10.0.2.15,TCP,60,9001  >  35978 [ACK] Seq=12970705 Ack=237188649 Win=65535 Len=0
1,2.753762999999708,10.0.2.15,62.210.85.178,TLSv1.2,4124,Application Data
1,2.7537979999997333,62.210.85.178,10.0.2.15,TCP,60,9001  >  35978 [ACK] Seq=12970705 Ack=237190109 Win=65535 Len=0
1,2.753805000000284,62.210.85.178,10.0.2.15,TCP,60,9001  >  35978 [ACK] Seq=12970705 Ack=237191569 Win=65535 Len=0
1,2.753808999999819,62.210.85.178,10.0.2.15,TCP,60,9001  >  35978 [ACK] Seq=12970705 Ack=237192719 Win=65535 Len=0
1,2.753842999999506,10.0.2.15,62.210.85.178,TLSv1.2,268,Application Data
1,2.7538759999997637,62.210.85.178,10.0.2.15,TCP,60,9001  >  35978 [ACK] Seq=12970705 Ack=237192933 Win=65535 Len=0
1,2.847120999999788,54.93.77.70,10.0.2.15,TLSv1.2,3674,Application Data
1,2.8472460000002684,10.0.2.15,54.93.77.70,TCP,54,34692  >  9001 [ACK] Seq=13056835 Ack=237064121 Win=65535 Len=0
1,2.8553359999996246,54.93.77.70,10.0.2.15,TCP,2950,"9001  >  34692 [PSH, ACK] Seq=237064121 Ack=13056835 Win=65535 Len=2896 [TCP segment of a reassembled PDU]"
1,2.8554009999998016,10.0.2.15,54.93.77.70,TCP,54,34692  >  9001 [ACK] Seq=13056835 Ack=237067017 Win=65535 Len=0
1,2.8554549999998926,54.93.77.70,10.0.2.15,TLSv1.2,1502,Application Data [TCP segment of a reassembled PDU]
1,2.855518999999731,10.0.2.15,54.93.77.70,TCP,54,34692  >  9001 [ACK] Seq=13056835 Ack=237068465 Win=65535 Len=0
1,2.863118000000213,54.93.77.70,10.0.2.15,TLSv1.2,380,Application Data
1,2.8734119999999166,54.93.77.70,10.0.2.15,TCP,2950,"9001  >  34692 [PSH, ACK] Seq=237068791 Ack=13056835 Win=65535 Len=2896 [TCP segment of a reassembled PDU]"
1,2.8734809999996287,10.0.2.15,54.93.77.70,TCP,54,34692  >  9001 [ACK] Seq=13056835 Ack=237071687 Win=65535 Len=0
1,2.8797599999998056,54.93.77.70,10.0.2.15,TLSv1.2,778,Application Data
1,2.884313999999904,54.93.77.70,10.0.2.15,TCP,2950,"9001  >  34692 [PSH, ACK] Seq=237072411 Ack=13056835 Win=65535 Len=2896 [TCP segment of a reassembled PDU]"
1,2.884407999999894,10.0.2.15,54.93.77.70,TCP,54,34692  >  9001 [ACK] Seq=13056835 Ack=237075307 Win=65535 Len=0
1,2.8930529999997816,54.93.77.70,10.0.2.15,TLSv1.2,5846,"Application Data, Application Data"
1,2.893124000000171,10.0.2.15,54.93.77.70,TCP,54,34692  >  9001 [ACK] Seq=13056835 Ack=237081099 Win=65535 Len=0
1,2.893388999999843,54.93.77.70,10.0.2.15,TCP,1502,"9001  >  34692 [PSH, ACK] Seq=237081099 Ack=13056835 Win=65535 Len=1448 [TCP segment of a reassembled PDU]"
1,2.893423999999868,10.0.2.15,54.93.77.70,TCP,54,34692  >  9001 [ACK] Seq=13056835 Ack=237082547 Win=65535 Len=0
1,2.9006179999996675,54.93.77.70,10.0.2.15,TLSv1.2,1292,Application Data
1,2.906764000000294,54.93.77.70,10.0.2.15,TLSv1.2,4398,Application Data
1,2.906836999999541,10.0.2.15,54.93.77.70,TCP,54,34692  >  9001 [ACK] Seq=13056835 Ack=237088129 Win=65535 Len=0
1,2.906984000000193,10.0.2.15,54.93.77.70,TLSv1.2,590,Application Data
1,2.907054999999673,54.93.77.70,10.0.2.15,TCP,60,9001  >  34692 [ACK] Seq=237088129 Ack=13057371 Win=65535 Len=0
1,2.9166210000003048,54.93.77.70,10.0.2.15,TLSv1.2,1408,Application Data
1,2.9255270000003293,54.93.77.70,10.0.2.15,TCP,2950,"9001  >  34692 [PSH, ACK] Seq=237089483 Ack=13057371 Win=65535 Len=2896 [TCP segment of a reassembled PDU]"
1,2.92555799999991,54.93.77.70,10.0.2.15,TLSv1.2,4398,Application Data [TCP segment of a reassembled PDU]
1,2.9256050000003597,10.0.2.15,54.93.77.70,TCP,54,34692  >  9001 [ACK] Seq=13057371 Ack=237092379 Win=65535 Len=0
1,2.9257219999999506,10.0.2.15,54.93.77.70,TCP,54,34692  >  9001 [ACK] Seq=13057371 Ack=237096723 Win=65535 Len=0
1,2.9410319999997228,54.93.77.70,10.0.2.15,TLSv1.2,2950,Application Data [TCP segment of a reassembled PDU]
1,2.941074000000299,10.0.2.15,54.93.77.70,TCP,54,34692  >  9001 [ACK] Seq=13057371 Ack=237099619 Win=65535 Len=0
1,2.942019999999502,54.93.77.70,10.0.2.15,TLSv1.2,264,Application Data
1,2.942167999999583,10.0.2.15,54.93.77.70,TLSv1.2,590,Application Data
1,2.9422459999996136,54.93.77.70,10.0.2.15,TCP,60,9001  >  34692 [ACK] Seq=237099829 Ack=13057907 Win=65535 Len=0
1,2.966685999999754,54.93.77.70,10.0.2.15,TLSv1.2,1104,Application Data
1,2.9690279999995255,10.0.2.15,54.93.77.70,TLSv1.2,590,Application Data
1,2.9691809999994803,54.93.77.70,10.0.2.15,TCP,60,9001  >  34692 [ACK] Seq=237100879 Ack=13058443 Win=65535 Len=0
1,3.0249579999999696,62.210.85.178,10.0.2.15,TLSv1.2,590,Application Data
1,3.065244999999777,10.0.2.15,62.210.85.178,TCP,54,35978  >  9001 [ACK] Seq=237192933 Ack=12971241 Win=65535 Len=0
1,3.1051070000003165,62.210.85.178,10.0.2.15,TLSv1.2,590,Application Data
1,3.1051959999995233,10.0.2.15,62.210.85.178,TCP,54,35978  >  9001 [ACK] Seq=237192933 Ack=12971777 Win=65535 Len=0
1,3.16313799999989,62.210.85.178,10.0.2.15,TLSv1.2,590,Application Data
1,3.1632140000001527,10.0.2.15,62.210.85.178,TCP,54,35978  >  9001 [ACK] Seq=237192933 Ack=12972313 Win=65535 Len=0
1,3.163692999999512,10.0.2.15,62.210.85.178,TLSv1.2,590,Application Data
1,3.1637940000000526,62.210.85.178,10.0.2.15,TCP,60,9001  >  35978 [ACK] Seq=12972313 Ack=237193469 Win=65535 Len=0
1,3.2614370000001145,54.93.77.70,10.0.2.15,TLSv1.2,590,Application Data
1,3.2618179999999484,10.0.2.15,54.93.77.70,TLSv1.2,590,Application Data
1,3.2619260000001304,54.93.77.70,10.0.2.15,TCP,60,9001  >  34692 [ACK] Seq=237101415 Ack=13058979 Win=65535 Len=0
1,3.4441429999997126,62.210.85.178,10.0.2.15,TLSv1.2,590,Application Data
1,3.449300000000221,10.0.2.15,62.210.85.178,TLSv1.2,590,Application Data
1,3.449456999999711,62.210.85.178,10.0.2.15,TCP,60,9001  >  35978 [ACK] Seq=12972849 Ack=237194005 Win=65535 Len=0
1,3.46197200000006,10.0.2.15,62.210.85.178,TLSv1.2,4124,Application Data
1,3.4620889999996507,10.0.2.15,62.210.85.178,TCP,2974,35978  >  9001 [ACK] Seq=237198075 Ack=12972849 Win=65535 Len=2920 [TCP segment of a reassembled PDU]
1,3.4621329999999944,62.210.85.178,10.0.2.15,TCP,60,9001  >  35978 [ACK] Seq=12972849 Ack=237195465 Win=65535 Len=0
1,3.4621440000000803,62.210.85.178,10.0.2.15,TCP,60,9001  >  35978 [ACK] Seq=12972849 Ack=237196925 Win=65535 Len=0
1,3.4621479999996154,62.210.85.178,10.0.2.15,TCP,60,9001  >  35978 [ACK] Seq=12972849 Ack=237198075 Win=65535 Len=0
1,3.46215200000006,62.210.85.178,10.0.2.15,TCP,60,9001  >  35978 [ACK] Seq=12972849 Ack=237199535 Win=65535 Len=0
1,3.4621559999995952,62.210.85.178,10.0.2.15,TCP,60,9001  >  35978 [ACK] Seq=12972849 Ack=237200995 Win=65535 Len=0
1,3.4622010000002774,10.0.2.15,62.210.85.178,TLSv1.2,1204,Application Data
1,3.4622419999996055,62.210.85.178,10.0.2.15,TCP,60,9001  >  35978 [ACK] Seq=12972849 Ack=237202145 Win=65535 Len=0
1,3.4622920000001614,10.0.2.15,62.210.85.178,TLSv1.2,4124,Application Data
1,3.462359999999535,10.0.2.15,62.210.85.178,TCP,2974,35978  >  9001 [ACK] Seq=237206215 Ack=12972849 Win=65535 Len=2920 [TCP segment of a reassembled PDU]
1,3.462399000000005,62.210.85.178,10.0.2.15,TCP,60,9001  >  35978 [ACK] Seq=12972849 Ack=237203605 Win=65535 Len=0
1,3.462405999999646,62.210.85.178,10.0.2.15,TCP,60,9001  >  35978 [ACK] Seq=12972849 Ack=237205065 Win=65535 Len=0
1,3.462410000000091,62.210.85.178,10.0.2.15,TCP,60,9001  >  35978 [ACK] Seq=12972849 Ack=237206215 Win=65535 Len=0
1,3.462413999999626,62.210.85.178,10.0.2.15,TCP,60,9001  >  35978 [ACK] Seq=12972849 Ack=237207675 Win=65535 Len=0
1,3.4624180000000706,62.210.85.178,10.0.2.15,TCP,60,9001  >  35978 [ACK] Seq=12972849 Ack=237209135 Win=65535 Len=0
1,3.462456999999631,10.0.2.15,62.210.85.178,TLSv1.2,1204,Application Data
1,3.462539999999535,10.0.2.15,62.210.85.178,TLSv1.2,2974,Application Data
1,3.462579000000005,62.210.85.178,10.0.2.15,TCP,60,9001  >  35978 [ACK] Seq=12972849 Ack=237210285 Win=65535 Len=0
1,3.4625859999996464,62.210.85.178,10.0.2.15,TCP,60,9001  >  35978 [ACK] Seq=12972849 Ack=237211745 Win=65535 Len=0
1,3.46259099999952,62.210.85.178,10.0.2.15,TCP,60,9001  >  35978 [ACK] Seq=12972849 Ack=237213205 Win=65535 Len=0
1,3.4626250000001164,10.0.2.15,62.210.85.178,TLSv1.2,1226,Application Data
1,3.462663000000248,62.210.85.178,10.0.2.15,TCP,60,9001  >  35978 [ACK] Seq=12972849 Ack=237214377 Win=65535 Len=0
1,3.462709000000359,10.0.2.15,62.210.85.178,TLSv1.2,4124,Application Data
1,3.4627730000001975,10.0.2.15,62.210.85.178,TCP,2974,35978  >  9001 [ACK] Seq=237218447 Ack=12972849 Win=65535 Len=2920 [TCP segment of a reassembled PDU]
1,3.4628160000002026,62.210.85.178,10.0.2.15,TCP,60,9001  >  35978 [ACK] Seq=12972849 Ack=237215837 Win=65535 Len=0
1,3.462822999999844,62.210.85.178,10.0.2.15,TCP,60,9001  >  35978 [ACK] Seq=12972849 Ack=237217297 Win=65535 Len=0
1,3.4628270000002885,62.210.85.178,10.0.2.15,TCP,60,9001  >  35978 [ACK] Seq=12972849 Ack=237218447 Win=65535 Len=0
1,3.4628309999998237,62.210.85.178,10.0.2.15,TCP,60,9001  >  35978 [ACK] Seq=12972849 Ack=237219907 Win=65535 Len=0
1,3.4628359999996974,62.210.85.178,10.0.2.15,TCP,60,9001  >  35978 [ACK] Seq=12972849 Ack=237221367 Win=65535 Len=0
1,3.4628729999994903,10.0.2.15,62.210.85.178,TLSv1.2,110,Application Data
1,3.4629660000000513,62.210.85.178,10.0.2.15,TCP,60,9001  >  35978 [ACK] Seq=12972849 Ack=237221423 Win=65535 Len=0
1,3.474290999999539,10.0.2.15,62.210.85.178,TLSv1.2,4124,Application Data
1,3.47439200000008,10.0.2.15,62.210.85.178,TCP,2974,35978  >  9001 [ACK] Seq=237225493 Ack=12972849 Win=65535 Len=2920 [TCP segment of a reassembled PDU]
1,3.474435000000085,62.210.85.178,10.0.2.15,TCP,60,9001  >  35978 [ACK] Seq=12972849 Ack=237222883 Win=65535 Len=0
1,3.4744449999998324,62.210.85.178,10.0.2.15,TCP,60,9001  >  35978 [ACK] Seq=12972849 Ack=237224343 Win=65535 Len=0
1,3.474449999999706,62.210.85.178,10.0.2.15,TCP,60,9001  >  35978 [ACK] Seq=12972849 Ack=237225493 Win=65535 Len=0
1,3.474489999999605,10.0.2.15,62.210.85.178,TLSv1.2,1204,Application Data
1,3.4745270000003075,62.210.85.178,10.0.2.15,TCP,60,9001  >  35978 [ACK] Seq=12972849 Ack=237226953 Win=65535 Len=0
1,3.47453299999961,62.210.85.178,10.0.2.15,TCP,60,9001  >  35978 [ACK] Seq=12972849 Ack=237228413 Win=65535 Len=0
1,3.474537999999484,62.210.85.178,10.0.2.15,TCP,60,9001  >  35978 [ACK] Seq=12972849 Ack=237229563 Win=65535 Len=0
1,3.474586000000272,10.0.2.15,62.210.85.178,TLSv1.2,4124,Application Data
1,3.474626000000171,62.210.85.178,10.0.2.15,TCP,60,9001  >  35978 [ACK] Seq=12972849 Ack=237231023 Win=65535 Len=0
1,3.4746329999998125,62.210.85.178,10.0.2.15,TCP,60,9001  >  35978 [ACK] Seq=12972849 Ack=237232483 Win=65535 Len=0
1,3.474637999999686,62.210.85.178,10.0.2.15,TCP,60,9001  >  35978 [ACK] Seq=12972849 Ack=237233633 Win=65535 Len=0
1,3.4746869999999035,10.0.2.15,62.210.85.178,TLSv1.2,4124,Application Data
1,3.47482299999956,62.210.85.178,10.0.2.15,TCP,60,9001  >  35978 [ACK] Seq=12972849 Ack=237235093 Win=65535 Len=0
1,3.4748389999995197,62.210.85.178,10.0.2.15,TCP,60,9001  >  35978 [ACK] Seq=12972849 Ack=237236553 Win=65535 Len=0
1,3.474844000000303,62.210.85.178,10.0.2.15,TCP,60,9001  >  35978 [ACK] Seq=12972849 Ack=237237703 Win=65535 Len=0
1,3.4749059999994643,10.0.2.15,62.210.85.178,TLSv1.2,332,Application Data
1,3.4749510000001465,62.210.85.178,10.0.2.15,TCP,60,9001  >  35978 [ACK] Seq=12972849 Ack=237237981 Win=65535 Len=0
1,3.4750139999996463,10.0.2.15,62.210.85.178,TLSv1.2,3868,Application Data
1,3.4750819999999294,10.0.2.15,62.210.85.178,TCP,2974,35978  >  9001 [ACK] Seq=237241795 Ack=12972849 Win=65535 Len=2920 [TCP segment of a reassembled PDU]
1,3.475120000000061,62.210.85.178,10.0.2.15,TCP,60,9001  >  35978 [ACK] Seq=12972849 Ack=237239441 Win=65535 Len=0
1,3.475126999999702,62.210.85.178,10.0.2.15,TCP,60,9001  >  35978 [ACK] Seq=12972849 Ack=237240901 Win=65535 Len=0
1,3.4751310000001467,62.210.85.178,10.0.2.15,TCP,60,9001  >  35978 [ACK] Seq=12972849 Ack=237241795 Win=65535 Len=0
1,3.4751360000000204,62.210.85.178,10.0.2.15,TCP,60,9001  >  35978 [ACK] Seq=12972849 Ack=237243255 Win=65535 Len=0
1,3.4751399999995556,62.210.85.178,10.0.2.15,TCP,60,9001  >  35978 [ACK] Seq=12972849 Ack=237244715 Win=65535 Len=0
1,3.475177000000258,10.0.2.15,62.210.85.178,TLSv1.2,1204,Application Data
1,3.4752410000000964,10.0.2.15,62.210.85.178,TCP,2974,35978  >  9001 [ACK] Seq=237245865 Ack=12972849 Win=65535 Len=2920 [TCP segment of a reassembled PDU]
1,3.4752760000001217,62.210.85.178,10.0.2.15,TCP,60,9001  >  35978 [ACK] Seq=12972849 Ack=237245865 Win=65535 Len=0
1,3.475282999999763,62.210.85.178,10.0.2.15,TCP,60,9001  >  35978 [ACK] Seq=12972849 Ack=237247325 Win=65535 Len=0
1,3.4752870000002076,62.210.85.178,10.0.2.15,TCP,60,9001  >  35978 [ACK] Seq=12972849 Ack=237248785 Win=65535 Len=0
1,3.475319999999556,10.0.2.15,62.210.85.178,TLSv1.2,110,Application Data
1,3.475408000000243,62.210.85.178,10.0.2.15,TCP,60,9001  >  35978 [ACK] Seq=12972849 Ack=237248841 Win=65535 Len=0
1,3.484537000000273,10.0.2.15,62.210.85.178,TLSv1.2,1618,Application Data
1,3.4846459999998842,62.210.85.178,10.0.2.15,TCP,60,9001  >  35978 [ACK] Seq=12972849 Ack=237250301 Win=65535 Len=0
1,3.4846589999997377,62.210.85.178,10.0.2.15,TCP,60,9001  >  35978 [ACK] Seq=12972849 Ack=237250405 Win=65535 Len=0
1,3.566421999999875,54.93.77.70,10.0.2.15,TLSv1.2,3674,Application Data
1,3.5665479999997842,10.0.2.15,54.93.77.70,TCP,54,34692  >  9001 [ACK] Seq=13058979 Ack=237105035 Win=65535 Len=0
1,3.584563999999773,54.93.77.70,10.0.2.15,TLSv1.2,590,Application Data
1,3.587558999999601,54.93.77.70,10.0.2.15,TCP,2950,"9001  >  34692 [PSH, ACK] Seq=237105571 Ack=13058979 Win=65535 Len=2896 [TCP segment of a reassembled PDU]"
1,3.5876140000000305,10.0.2.15,54.93.77.70,TCP,54,34692  >  9001 [ACK] Seq=13058979 Ack=237108467 Win=65535 Len=0
1,3.605685999999878,54.93.77.70,10.0.2.15,TLSv1.2,1314,"Application Data, Application Data"
1,3.6492600000001403,10.0.2.15,54.93.77.70,TCP,54,34692  >  9001 [ACK] Seq=13058979 Ack=237109727 Win=65535 Len=0
1,3.6568609999994806,54.93.77.70,10.0.2.15,TLSv1.2,10190,"Application Data, Application Data"
1,3.6569200000003548,10.0.2.15,54.93.77.70,TCP,54,34692  >  9001 [ACK] Seq=13058979 Ack=237119863 Win=65535 Len=0
1,3.6639329999998154,54.93.77.70,10.0.2.15,TLSv1.2,2950,Application Data [TCP segment of a reassembled PDU]
1,3.663980999999694,10.0.2.15,54.93.77.70,TCP,54,34692  >  9001 [ACK] Seq=13058979 Ack=237122759 Win=65535 Len=0
1,3.6647659999998723,54.93.77.70,10.0.2.15,TLSv1.2,2950,Application Data [TCP segment of a reassembled PDU]
1,3.664810000000216,10.0.2.15,54.93.77.70,TCP,54,34692  >  9001 [ACK] Seq=13058979 Ack=237125655 Win=65535 Len=0
1,3.673482999999578,54.93.77.70,10.0.2.15,TLSv1.2,3254,Application Data
1,3.6735390000003463,10.0.2.15,54.93.77.70,TCP,54,34692  >  9001 [ACK] Seq=13058979 Ack=237128855 Win=65535 Len=0
1,3.6737249999996493,10.0.2.15,54.93.77.70,TLSv1.2,590,Application Data
1,3.6738070000001244,54.93.77.70,10.0.2.15,TCP,60,9001  >  34692 [ACK] Seq=237128855 Ack=13059515 Win=65535 Len=0
1,3.6872089999997115,54.93.77.70,10.0.2.15,TLSv1.2,2950,Application Data
1,3.6872400000002017,54.93.77.70,10.0.2.15,TLSv1.2,5846,"Application Data, Application Data"
1,3.687332999999853,10.0.2.15,54.93.77.70,TCP,54,34692  >  9001 [ACK] Seq=13059515 Ack=237137543 Win=65535 Len=0
1,3.689155000000028,54.93.77.70,10.0.2.15,TLSv1.2,192,Application Data
1,3.698409999999967,54.93.77.70,10.0.2.15,TCP,2950,"9001  >  34692 [PSH, ACK] Seq=237137681 Ack=13059515 Win=65535 Len=2896 [TCP segment of a reassembled PDU]"
1,3.698435999999674,54.93.77.70,10.0.2.15,TLSv1.2,7294,"Application Data, Application Data"
1,3.698486999999659,10.0.2.15,54.93.77.70,TCP,54,34692  >  9001 [ACK] Seq=13059515 Ack=237140577 Win=65535 Len=0
1,3.6985789999998815,10.0.2.15,54.93.77.70,TCP,54,34692  >  9001 [ACK] Seq=13059515 Ack=237147817 Win=65535 Len=0
1,3.7051320000000487,54.93.77.70,10.0.2.15,TLSv1.2,1292,Application Data
1,3.7107420000002094,54.93.77.70,10.0.2.15,TLSv1.2,7294,Application Data
1,3.7107960000003004,10.0.2.15,54.93.77.70,TCP,54,34692  >  9001 [ACK] Seq=13059515 Ack=237156295 Win=65535 Len=0
1,3.711000999999669,10.0.2.15,54.93.77.70,TLSv1.2,590,Application Data
1,3.711124999999811,54.93.77.70,10.0.2.15,TCP,60,9001  >  34692 [ACK] Seq=237156295 Ack=13060051 Win=65535 Len=0
1,3.7215610000002926,54.93.77.70,10.0.2.15,TLSv1.2,568,Application Data
1,3.7217170000003534,10.0.2.15,54.93.77.70,TLSv1.2,590,Application Data
1,3.7217909999999392,54.93.77.70,10.0.2.15,TCP,60,9001  >  34692 [ACK] Seq=237156809 Ack=13060587 Win=65535 Len=0
1,3.728892999999516,54.93.77.70,10.0.2.15,TCP,1502,"9001  >  34692 [PSH, ACK] Seq=237156809 Ack=13060587 Win=65535 Len=1448 [TCP segment of a reassembled PDU]"
1,3.7289849999997386,10.0.2.15,54.93.77.70,TCP,54,34692  >  9001 [ACK] Seq=13060587 Ack=237158257 Win=65535 Len=0
1,3.7390349999996033,54.93.77.70,10.0.2.15,TLSv1.2,170,Application Data
1,3.7414859999998953,10.0.2.15,54.93.77.70,TLSv1.2,590,Application Data
1,3.7416400000001886,54.93.77.70,10.0.2.15,TCP,60,9001  >  34692 [ACK] Seq=237158373 Ack=13061123 Win=65535 Len=0
1,3.7849850000002334,62.210.85.178,10.0.2.15,TLSv1.2,590,Application Data
1,3.8252480000001015,10.0.2.15,62.210.85.178,TCP,54,35978  >  9001 [ACK] Seq=237250405 Ack=12973385 Win=65535 Len=0
1,3.8453639999997904,62.210.85.178,10.0.2.15,TLSv1.2,590,Application Data
1,3.8454359999996086,10.0.2.15,62.210.85.178,TCP,54,35978  >  9001 [ACK] Seq=237250405 Ack=12973921 Win=65535 Len=0
1,3.9201050000001487,62.210.85.178,10.0.2.15,TLSv1.2,1104,Application Data
1,3.920191999999588,10.0.2.15,62.210.85.178,TCP,54,35978  >  9001 [ACK] Seq=237250405 Ack=12974971 Win=65535 Len=0
1,3.920680000000175,10.0.2.15,62.210.85.178,TLSv1.2,590,Application Data
1,3.920777000000271,62.210.85.178,10.0.2.15,TCP,60,9001  >  35978 [ACK] Seq=12974971 Ack=237250941 Win=65535 Len=0
1,4.365585999999894,54.93.77.70,10.0.2.15,TLSv1.2,590,Application Data
1,4.365955999999642,10.0.2.15,54.93.77.70,TLSv1.2,590,Application Data
1,4.366062999999485,54.93.77.70,10.0.2.15,TCP,60,9001  >  34692 [ACK] Seq=237158909 Ack=13061659 Win=65535 Len=0
1,4.48844199999985,62.210.85.178,10.0.2.15,TLSv1.2,590,Application Data
1,4.491156999999475,10.0.2.15,62.210.85.178,TLSv1.2,590,Application Data
1,4.491323999999622,62.210.85.178,10.0.2.15,TCP,60,9001  >  35978 [ACK] Seq=12975507 Ack=237251477 Win=65535 Len=0
1,4.501502000000073,10.0.2.15,62.210.85.178,TLSv1.2,4124,Application Data
1,4.502488999999514,62.210.85.178,10.0.2.15,TCP,60,9001  >  35978 [ACK] Seq=12975507 Ack=237252937 Win=65535 Len=0
1,4.5025720000003275,62.210.85.178,10.0.2.15,TCP,60,9001  >  35978 [ACK] Seq=12975507 Ack=237254397 Win=65535 Len=0
1,4.502575999999863,62.210.85.178,10.0.2.15,TCP,60,9001  >  35978 [ACK] Seq=12975507 Ack=237255547 Win=65535 Len=0
1,4.502840999999535,10.0.2.15,62.210.85.178,TLSv1.2,140,Application Data
1,4.503176999999596,62.210.85.178,10.0.2.15,TCP,60,9001  >  35978 [ACK] Seq=12975507 Ack=237255633 Win=65535 Len=0
1,4.675387000000228,54.93.77.70,10.0.2.15,TLSv1.2,2646,Application Data
1,4.675521999999546,10.0.2.15,54.93.77.70,TCP,54,34692  >  9001 [ACK] Seq=13061659 Ack=237161501 Win=65535 Len=0
1,4.676572000000306,54.93.77.70,10.0.2.15,TCP,1502,"9001  >  34692 [PSH, ACK] Seq=237161501 Ack=13061659 Win=65535 Len=1448 [TCP segment of a reassembled PDU]"
1,4.676625000000058,10.0.2.15,54.93.77.70,TCP,54,34692  >  9001 [ACK] Seq=13061659 Ack=237162949 Win=65535 Len=0
1,4.692011999999522,54.93.77.70,10.0.2.15,TLSv1.2,684,Application Data
1,4.694198999999571,10.0.2.15,54.93.77.70,TLSv1.2,590,Application Data
1,4.6943780000001425,54.93.77.70,10.0.2.15,TCP,60,9001  >  34692 [ACK] Seq=237163579 Ack=13062195 Win=65535 Len=0
1,4.802440999999817,62.210.85.178,10.0.2.15,TLSv1.2,590,Application Data
1,4.802762999999686,10.0.2.15,62.210.85.178,TLSv1.2,590,Application Data
1,4.802856999999676,62.210.85.178,10.0.2.15,TCP,60,9001  >  35978 [ACK] Seq=12976043 Ack=237256169 Win=65535 Len=0
1,4.885863999999856,54.93.77.70,10.0.2.15,TLSv1.2,590,Application Data
1,4.886218999999983,10.0.2.15,54.93.77.70,TLSv1.2,590,Application Data
1,4.886319000000185,54.93.77.70,10.0.2.15,TCP,60,9001  >  34692 [ACK] Seq=237164115 Ack=13062731 Win=65535 Len=0
1,5.083262000000104,62.210.85.178,10.0.2.15,TLSv1.2,590,Application Data
1,5.089130000000296,10.0.2.15,62.210.85.178,TLSv1.2,590,Application Data
1,5.089273999999932,62.210.85.178,10.0.2.15,TCP,60,9001  >  35978 [ACK] Seq=12976579 Ack=237256705 Win=65535 Len=0
1,5.101722000000336,10.0.2.15,62.210.85.178,TLSv1.2,4124,Application Data
1,5.101835999999821,10.0.2.15,62.210.85.178,TCP,2974,35978  >  9001 [ACK] Seq=237260775 Ack=12976579 Win=65535 Len=2920 [TCP segment of a reassembled PDU]
1,5.1018880000001445,62.210.85.178,10.0.2.15,TCP,60,9001  >  35978 [ACK] Seq=12976579 Ack=237258165 Win=65535 Len=0
1,5.101900999999998,62.210.85.178,10.0.2.15,TCP,60,9001  >  35978 [ACK] Seq=12976579 Ack=237259625 Win=65535 Len=0
1,5.101905999999872,62.210.85.178,10.0.2.15,TCP,60,9001  >  35978 [ACK] Seq=12976579 Ack=237260775 Win=65535 Len=0
1,5.101908999999978,62.210.85.178,10.0.2.15,TCP,60,9001  >  35978 [ACK] Seq=12976579 Ack=237262235 Win=65535 Len=0
1,5.101912000000084,62.210.85.178,10.0.2.15,TCP,60,9001  >  35978 [ACK] Seq=12976579 Ack=237263695 Win=65535 Len=0
1,5.101947999999538,10.0.2.15,62.210.85.178,TLSv1.2,1204,Application Data
1,5.101985000000241,62.210.85.178,10.0.2.15,TCP,60,9001  >  35978 [ACK] Seq=12976579 Ack=237264845 Win=65535 Len=0
1,5.102031000000352,10.0.2.15,62.210.85.178,TLSv1.2,4124,Application Data
1,5.102069999999912,62.210.85.178,10.0.2.15,TCP,60,9001  >  35978 [ACK] Seq=12976579 Ack=237266305 Win=65535 Len=0
1,5.102077999999892,62.210.85.178,10.0.2.15,TCP,60,9001  >  35978 [ACK] Seq=12976579 Ack=237267765 Win=65535 Len=0
1,5.102082000000337,62.210.85.178,10.0.2.15,TCP,60,9001  >  35978 [ACK] Seq=12976579 Ack=237268915 Win=65535 Len=0
1,5.102120999999897,10.0.2.15,62.210.85.178,TLSv1.2,4124,Application Data
1,5.102159000000029,62.210.85.178,10.0.2.15,TCP,60,9001  >  35978 [ACK] Seq=12976579 Ack=237270375 Win=65535 Len=0
1,5.102167000000009,62.210.85.178,10.0.2.15,TCP,60,9001  >  35978 [ACK] Seq=12976579 Ack=237271835 Win=65535 Len=0
1,5.102227000000312,10.0.2.15,62.210.85.178,TLSv1.2,2974,Application Data
1,5.102268999999978,62.210.85.178,10.0.2.15,TCP,60,9001  >  35978 [ACK] Seq=12976579 Ack=237272985 Win=65535 Len=0
1,5.102276999999958,62.210.85.178,10.0.2.15,TCP,60,9001  >  35978 [ACK] Seq=12976579 Ack=237274445 Win=65535 Len=0
1,5.102280000000064,62.210.85.178,10.0.2.15,TCP,60,9001  >  35978 [ACK] Seq=12976579 Ack=237275905 Win=65535 Len=0
1,5.102307999999539,10.0.2.15,62.210.85.178,TLSv1.2,1226,Application Data
1,5.102343999999903,62.210.85.178,10.0.2.15,TCP,60,9001  >  35978 [ACK] Seq=12976579 Ack=237277077 Win=65535 Len=0
1,5.102382999999463,10.0.2.15,62.210.85.178,TLSv1.2,4124,Application Data
1,5.102420999999595,62.210.85.178,10.0.2.15,TCP,60,9001  >  35978 [ACK] Seq=12976579 Ack=237278537 Win=65535 Len=0
1,5.102428999999574,62.210.85.178,10.0.2.15,TCP,60,9001  >  35978 [ACK] Seq=12976579 Ack=237279997 Win=65535 Len=0
1,5.102433000000019,62.210.85.178,10.0.2.15,TCP,60,9001  >  35978 [ACK] Seq=12976579 Ack=237281147 Win=65535 Len=0
1,5.102469999999812,10.0.2.15,62.210.85.178,TLSv1.2,3030,Application Data
1,5.102507999999943,62.210.85.178,10.0.2.15,TCP,60,9001  >  35978 [ACK] Seq=12976579 Ack=237282607 Win=65535 Len=0
1,5.102515999999923,62.210.85.178,10.0.2.15,TCP,60,9001  >  35978 [ACK] Seq=12976579 Ack=237284067 Win=65535 Len=0
1,5.102519000000029,62.210.85.178,10.0.2.15,TCP,60,9001  >  35978 [ACK] Seq=12976579 Ack=237284123 Win=65535 Len=0
1,5.113978000000316,10.0.2.15,62.210.85.178,TLSv1.2,4124,Application Data
1,5.11404500000026,62.210.85.178,10.0.2.15,TCP,60,9001  >  35978 [ACK] Seq=12976579 Ack=237285583 Win=65535 Len=0
1,5.114056000000346,62.210.85.178,10.0.2.15,TCP,60,9001  >  35978 [ACK] Seq=12976579 Ack=237287043 Win=65535 Len=0
1,5.114061999999649,62.210.85.178,10.0.2.15,TCP,60,9001  >  35978 [ACK] Seq=12976579 Ack=237288193 Win=65535 Len=0
1,5.114110999999866,10.0.2.15,62.210.85.178,TLSv1.2,4124,Application Data
1,5.114152000000104,62.210.85.178,10.0.2.15,TCP,60,9001  >  35978 [ACK] Seq=12976579 Ack=237289653 Win=65535 Len=0
1,5.114161999999851,62.210.85.178,10.0.2.15,TCP,60,9001  >  35978 [ACK] Seq=12976579 Ack=237291113 Win=65535 Len=0
1,5.114166000000296,62.210.85.178,10.0.2.15,TCP,60,9001  >  35978 [ACK] Seq=12976579 Ack=237292263 Win=65535 Len=0
1,5.114204999999856,10.0.2.15,62.210.85.178,TLSv1.2,4124,Application Data
1,5.114242999999988,62.210.85.178,10.0.2.15,TCP,60,9001  >  35978 [ACK] Seq=12976579 Ack=237293723 Win=65535 Len=0
1,5.1142509999999675,62.210.85.178,10.0.2.15,TCP,60,9001  >  35978 [ACK] Seq=12976579 Ack=237295183 Win=65535 Len=0
1,5.114255999999841,62.210.85.178,10.0.2.15,TCP,60,9001  >  35978 [ACK] Seq=12976579 Ack=237296333 Win=65535 Len=0
1,5.114292000000205,10.0.2.15,62.210.85.178,TLSv1.2,4124,Application Data
1,5.114330000000336,62.210.85.178,10.0.2.15,TCP,60,9001  >  35978 [ACK] Seq=12976579 Ack=237297793 Win=65535 Len=0
1,5.114338000000316,62.210.85.178,10.0.2.15,TCP,60,9001  >  35978 [ACK] Seq=12976579 Ack=237299253 Win=65535 Len=0
1,5.11434300000019,62.210.85.178,10.0.2.15,TCP,60,9001  >  35978 [ACK] Seq=12976579 Ack=237300403 Win=65535 Len=0
1,5.114378000000215,10.0.2.15,62.210.85.178,TLSv1.2,332,Application Data
1,5.114526999999725,62.210.85.178,10.0.2.15,TCP,60,9001  >  35978 [ACK] Seq=12976579 Ack=237300681 Win=65535 Len=0
1,5.114596999999776,10.0.2.15,62.210.85.178,TLSv1.2,3868,Application Data
1,5.114639999999781,62.210.85.178,10.0.2.15,TCP,60,9001  >  35978 [ACK] Seq=12976579 Ack=237302141 Win=65535 Len=0
1,5.114647999999761,62.210.85.178,10.0.2.15,TCP,60,9001  >  35978 [ACK] Seq=12976579 Ack=237303601 Win=65535 Len=0
1,5.114652000000206,62.210.85.178,10.0.2.15,TCP,60,9001  >  35978 [ACK] Seq=12976579 Ack=237304495 Win=65535 Len=0
1,5.114690999999766,10.0.2.15,62.210.85.178,TLSv1.2,4124,Application Data
1,5.1147289999998975,62.210.85.178,10.0.2.15,TCP,60,9001  >  35978 [ACK] Seq=12976579 Ack=237305955 Win=65535 Len=0
1,5.114736999999877,62.210.85.178,10.0.2.15,TCP,60,9001  >  35978 [ACK] Seq=12976579 Ack=237307415 Win=65535 Len=0
1,5.114741000000322,62.210.85.178,10.0.2.15,TCP,60,9001  >  35978 [ACK] Seq=12976579 Ack=237308565 Win=65535 Len=0
1,5.114776000000347,10.0.2.15,62.210.85.178,TLSv1.2,3030,Application Data
1,5.11481300000014,62.210.85.178,10.0.2.15,TCP,60,9001  >  35978 [ACK] Seq=12976579 Ack=237310025 Win=65535 Len=0
1,5.11482100000012,62.210.85.178,10.0.2.15,TCP,60,9001  >  35978 [ACK] Seq=12976579 Ack=237311485 Win=65535 Len=0
1,5.114824999999655,62.210.85.178,10.0.2.15,TCP,60,9001  >  35978 [ACK] Seq=12976579 Ack=237311541 Win=65535 Len=0
1,5.12403600000016,10.0.2.15,62.210.85.178,TLSv1.2,4124,Application Data
1,5.124088999999913,62.210.85.178,10.0.2.15,TCP,60,9001  >  35978 [ACK] Seq=12976579 Ack=237313001 Win=65535 Len=0
1,5.1240999999999985,62.210.85.178,10.0.2.15,TCP,60,9001  >  35978 [ACK] Seq=12976579 Ack=237314461 Win=65535 Len=0
1,5.124104999999872,62.210.85.178,10.0.2.15,TCP,60,9001  >  35978 [ACK] Seq=12976579 Ack=237315611 Win=65535 Len=0
1,5.124149999999645,10.0.2.15,62.210.85.178,TLSv1.2,4124,Application Data
1,5.1241909999998825,62.210.85.178,10.0.2.15,TCP,60,9001  >  35978 [ACK] Seq=12976579 Ack=237317071 Win=65535 Len=0
1,5.124200000000201,62.210.85.178,10.0.2.15,TCP,60,9001  >  35978 [ACK] Seq=12976579 Ack=237318531 Win=65535 Len=0
1,5.1242050000000745,62.210.85.178,10.0.2.15,TCP,60,9001  >  35978 [ACK] Seq=12976579 Ack=237319681 Win=65535 Len=0
1,5.124240999999529,10.0.2.15,62.210.85.178,TLSv1.2,204,Application Data
1,5.124281999999766,62.210.85.178,10.0.2.15,TCP,60,9001  >  35978 [ACK] Seq=12976579 Ack=237319831 Win=65535 Len=0
1,5.222077999999783,54.93.77.70,10.0.2.15,TLSv1.2,590,Application Data
1,5.232670999999755,54.93.77.70,10.0.2.15,TCP,2950,"9001  >  34692 [PSH, ACK] Seq=237164651 Ack=13062731 Win=65535 Len=2896 [TCP segment of a reassembled PDU]"
1,5.232780999999704,10.0.2.15,54.93.77.70,TCP,54,34692  >  9001 [ACK] Seq=13062731 Ack=237167547 Win=65535 Len=0
1,5.233712000000196,54.93.77.70,10.0.2.15,TLSv1.2,4398,Application Data [TCP segment of a reassembled PDU]
1,5.2337509999997565,10.0.2.15,54.93.77.70,TCP,54,34692  >  9001 [ACK] Seq=13062731 Ack=237171891 Win=65535 Len=0
1,5.239101999999548,54.93.77.70,10.0.2.15,TLSv1.2,568,Application Data
1,5.246215999999549,54.93.77.70,10.0.2.15,TLSv1.2,5846,Application Data
1,5.2462900000000445,10.0.2.15,54.93.77.70,TCP,54,34692  >  9001 [ACK] Seq=13062731 Ack=237178197 Win=65535 Len=0
1,5.247295999999551,54.93.77.70,10.0.2.15,TCP,1502,"9001  >  34692 [PSH, ACK] Seq=237178197 Ack=13062731 Win=65535 Len=1448 [TCP segment of a reassembled PDU]"
1,5.247335000000021,10.0.2.15,54.93.77.70,TCP,54,34692  >  9001 [ACK] Seq=13062731 Ack=237179645 Win=65535 Len=0
1,5.254871000000094,54.93.77.70,10.0.2.15,TLSv1.2,568,Application Data
1,5.257857999999942,54.93.77.70,10.0.2.15,TLSv1.2,7294,Application Data
1,5.2579249999998865,10.0.2.15,54.93.77.70,TCP,54,34692  >  9001 [ACK] Seq=13062731 Ack=237187399 Win=65535 Len=0
1,5.2720399999998335,54.93.77.70,10.0.2.15,TLSv1.2,568,Application Data
1,5.279875999999604,54.93.77.70,10.0.2.15,TCP,2950,"9001  >  34692 [PSH, ACK] Seq=237187913 Ack=13062731 Win=65535 Len=2896 [TCP segment of a reassembled PDU]"
1,5.2799379999996745,10.0.2.15,54.93.77.70,TCP,54,34692  >  9001 [ACK] Seq=13062731 Ack=237190809 Win=65535 Len=0
1,5.280555999999706,54.93.77.70,10.0.2.15,TLSv1.2,4398,"Application Data, Application Data"
1,5.280595999999605,10.0.2.15,54.93.77.70,TCP,54,34692  >  9001 [ACK] Seq=13062731 Ack=237195153 Win=65535 Len=0
1,5.2807599999996455,10.0.2.15,54.93.77.70,TLSv1.2,590,Application Data
1,5.280835999999908,54.93.77.70,10.0.2.15,TCP,60,9001  >  34692 [ACK] Seq=237195153 Ack=13063267 Win=65535 Len=0
1,5.2916519999998854,54.93.77.70,10.0.2.15,TCP,2950,"9001  >  34692 [PSH, ACK] Seq=237195153 Ack=13063267 Win=65535 Len=2896 [TCP segment of a reassembled PDU]"
1,5.291723999999704,10.0.2.15,54.93.77.70,TCP,54,34692  >  9001 [ACK] Seq=13063267 Ack=237198049 Win=65535 Len=0
1,5.292840000000069,54.93.77.70,10.0.2.15,TLSv1.2,4912,"Application Data, Application Data"
1,5.292900999999802,10.0.2.15,54.93.77.70,TCP,54,34692  >  9001 [ACK] Seq=13063267 Ack=237202907 Win=65535 Len=0
1,5.308439999999791,54.93.77.70,10.0.2.15,TLSv1.2,7294,"Application Data, Application Data, Application Data"
1,5.308524999999463,10.0.2.15,54.93.77.70,TCP,54,34692  >  9001 [ACK] Seq=13063267 Ack=237210147 Win=65535 Len=0
1,5.308729000000312,10.0.2.15,54.93.77.70,TLSv1.2,590,Application Data
1,5.3088019999995595,54.93.77.70,10.0.2.15,TCP,60,9001  >  34692 [ACK] Seq=237210147 Ack=13063803 Win=65535 Len=0
1,5.309095999999954,54.93.77.70,10.0.2.15,TLSv1.2,6288,"Application Data, Application Data"
1,5.309138999999959,10.0.2.15,54.93.77.70,TCP,54,34692  >  9001 [ACK] Seq=13063803 Ack=237216381 Win=65535 Len=0
1,5.321847000000162,10.0.2.15,54.93.77.70,TLSv1.2,590,Application Data
1,5.321931999999833,54.93.77.70,10.0.2.15,TCP,60,9001  >  34692 [ACK] Seq=237216381 Ack=13064339 Win=65535 Len=0
1,5.330898000000161,54.93.77.70,10.0.2.15,TLSv1.2,3674,Application Data
1,5.330977999999959,10.0.2.15,54.93.77.70,TCP,54,34692  >  9001 [ACK] Seq=13064339 Ack=237220001 Win=65535 Len=0
1,5.337378999999601,54.93.77.70,10.0.2.15,TCP,2950,"9001  >  34692 [PSH, ACK] Seq=237220001 Ack=13064339 Win=65535 Len=2896 [TCP segment of a reassembled PDU]"
1,5.33739499999956,54.93.77.70,10.0.2.15,TLSv1.2,1502,Application Data [TCP segment of a reassembled PDU]
1,5.337429999999586,10.0.2.15,54.93.77.70,TCP,54,34692  >  9001 [ACK] Seq=13064339 Ack=237222897 Win=65535 Len=0
1,5.337499999999636,10.0.2.15,54.93.77.70,TCP,54,34692  >  9001 [ACK] Seq=13064339 Ack=237224345 Win=65535 Len=0
1,5.3396960000000036,54.93.77.70,10.0.2.15,TCP,2950,"9001  >  34692 [PSH, ACK] Seq=237224345 Ack=13064339 Win=65535 Len=2896 [TCP segment of a reassembled PDU]"
1,5.33973799999967,10.0.2.15,54.93.77.70,TCP,54,34692  >  9001 [ACK] Seq=13064339 Ack=237227241 Win=65535 Len=0
1,5.347600999999486,54.93.77.70,10.0.2.15,TLSv1.2,568,Application Data
