No.,Time,Source,Destination,Protocol,Length,Info
1,0.010798000000249885,10.0.2.15,54.93.77.70,TCP,54,34692  >  9001 [ACK] Seq=12922849 Ack=234842893 Win=65535 Len=0
1,0.042277000000467524,62.210.85.178,10.0.2.15,TLSv1.2,590,Application Data
1,0.04237399999965419,10.0.2.15,62.210.85.178,TCP,54,35978  >  9001 [ACK] Seq=234935651 Ack=12837401 Win=65535 Len=0
1,0.13795800000025338,10.0.2.15,54.93.77.70,TLSv1.2,590,Application Data
1,0.13817000000017288,54.93.77.70,10.0.2.15,TCP,60,9001  >  34692 [ACK] Seq=234842893 Ack=12923385 Win=65535 Len=0
1,0.8499309999997422,62.210.85.178,10.0.2.15,TLSv1.2,590,Application Data
1,0.8500080000003436,10.0.2.15,62.210.85.178,TCP,54,35978  >  9001 [ACK] Seq=234935651 Ack=12837937 Win=65535 Len=0
1,0.8504910000001473,10.0.2.15,62.210.85.178,TLSv1.2,590,Application Data
1,0.8505740000000515,62.210.85.178,10.0.2.15,TCP,60,9001  >  35978 [ACK] Seq=12837937 Ack=234936187 Win=65535 Len=0
1,1.0542859999995926,54.93.77.70,10.0.2.15,TLSv1.2,590,Application Data
1,1.0543829999996888,10.0.2.15,54.93.77.70,TCP,54,34692  >  9001 [ACK] Seq=12923385 Ack=234843429 Win=65535 Len=0
1,1.0547910000004777,10.0.2.15,54.93.77.70,TLSv1.2,1618,Application Data
1,1.0548939999998765,54.93.77.70,10.0.2.15,TCP,60,9001  >  34692 [ACK] Seq=234843429 Ack=12924845 Win=65535 Len=0
1,1.054909000000407,54.93.77.70,10.0.2.15,TCP,60,9001  >  34692 [ACK] Seq=234843429 Ack=12924949 Win=65535 Len=0
1,1.4629510000004302,62.210.85.178,10.0.2.15,TLSv1.2,1618,Application Data
1,1.4630779999997685,10.0.2.15,62.210.85.178,TCP,54,35978  >  9001 [ACK] Seq=234936187 Ack=12839501 Win=65535 Len=0
1,1.4805480000004536,10.0.2.15,62.210.85.178,TLSv1.2,590,Application Data
1,1.4812089999995806,62.210.85.178,10.0.2.15,TCP,60,9001  >  35978 [ACK] Seq=12839501 Ack=234936723 Win=65535 Len=0
1,1.4913550000001123,10.0.2.15,62.210.85.178,TLSv1.2,1618,Application Data
1,1.4914890000000014,62.210.85.178,10.0.2.15,TCP,60,9001  >  35978 [ACK] Seq=12839501 Ack=234938183 Win=65535 Len=0
1,1.4915030000001934,62.210.85.178,10.0.2.15,TCP,60,9001  >  35978 [ACK] Seq=12839501 Ack=234938287 Win=65535 Len=0
1,1.7699190000003,54.93.77.70,10.0.2.15,TLSv1.2,590,Application Data
1,1.7726370000000315,54.93.77.70,10.0.2.15,TCP,1502,"9001  >  34692 [PSH, ACK] Seq=234843965 Ack=12924949 Win=65535 Len=1448 [TCP segment of a reassembled PDU]"
1,1.7727119999999559,10.0.2.15,54.93.77.70,TCP,54,34692  >  9001 [ACK] Seq=12924949 Ack=234845413 Win=65535 Len=0
1,1.7886230000003707,54.93.77.70,10.0.2.15,TLSv1.2,170,Application Data
1,1.7905739999996513,10.0.2.15,54.93.77.70,TLSv1.2,590,Application Data
1,1.790780999999697,54.93.77.70,10.0.2.15,TCP,60,9001  >  34692 [ACK] Seq=234845529 Ack=12925485 Win=65535 Len=0
1,1.8801380000004428,62.210.85.178,10.0.2.15,TLSv1.2,590,Application Data
1,1.8804520000003322,10.0.2.15,62.210.85.178,TLSv1.2,590,Application Data
1,1.880551999999625,62.210.85.178,10.0.2.15,TCP,60,9001  >  35978 [ACK] Seq=12840037 Ack=234938823 Win=65535 Len=0
1,1.972353000000112,54.93.77.70,10.0.2.15,TLSv1.2,590,Application Data
1,1.9727169999996477,10.0.2.15,54.93.77.70,TLSv1.2,590,Application Data
1,1.9728189999996175,54.93.77.70,10.0.2.15,TCP,60,9001  >  34692 [ACK] Seq=234846065 Ack=12926021 Win=65535 Len=0
1,2.3849819999995816,62.210.85.178,10.0.2.15,TLSv1.2,590,Application Data
1,2.39086000000043,10.0.2.15,62.210.85.178,TLSv1.2,590,Application Data
1,2.391026999999667,62.210.85.178,10.0.2.15,TCP,60,9001  >  35978 [ACK] Seq=12840573 Ack=234939359 Win=65535 Len=0
1,2.4033470000003945,10.0.2.15,62.210.85.178,TLSv1.2,4124,Application Data
1,2.403457000000344,10.0.2.15,62.210.85.178,TCP,2974,35978  >  9001 [ACK] Seq=234943429 Ack=12840573 Win=65535 Len=2920 [TCP segment of a reassembled PDU]
1,2.403505999999652,62.210.85.178,10.0.2.15,TCP,60,9001  >  35978 [ACK] Seq=12840573 Ack=234940819 Win=65535 Len=0
1,2.403516999999738,62.210.85.178,10.0.2.15,TCP,60,9001  >  35978 [ACK] Seq=12840573 Ack=234942279 Win=65535 Len=0
1,2.4035219999996116,62.210.85.178,10.0.2.15,TCP,60,9001  >  35978 [ACK] Seq=12840573 Ack=234943429 Win=65535 Len=0
1,2.403570999999829,10.0.2.15,62.210.85.178,TLSv1.2,1204,Application Data
1,2.403610999999728,62.210.85.178,10.0.2.15,TCP,60,9001  >  35978 [ACK] Seq=12840573 Ack=234944889 Win=65535 Len=0
1,2.4036189999997077,62.210.85.178,10.0.2.15,TCP,60,9001  >  35978 [ACK] Seq=12840573 Ack=234946349 Win=65535 Len=0
1,2.403621999999814,62.210.85.178,10.0.2.15,TCP,60,9001  >  35978 [ACK] Seq=12840573 Ack=234947499 Win=65535 Len=0
1,2.40366400000039,10.0.2.15,62.210.85.178,TLSv1.2,4124,Application Data
1,2.4037029999999504,62.210.85.178,10.0.2.15,TCP,60,9001  >  35978 [ACK] Seq=12840573 Ack=234948959 Win=65535 Len=0
1,2.40371099999993,62.210.85.178,10.0.2.15,TCP,60,9001  >  35978 [ACK] Seq=12840573 Ack=234950419 Win=65535 Len=0
1,2.403715000000375,62.210.85.178,10.0.2.15,TCP,60,9001  >  35978 [ACK] Seq=12840573 Ack=234951569 Win=65535 Len=0
1,2.403752999999597,10.0.2.15,62.210.85.178,TLSv1.2,4124,Application Data
1,2.403790000000299,62.210.85.178,10.0.2.15,TCP,60,9001  >  35978 [ACK] Seq=12840573 Ack=234953029 Win=65535 Len=0
1,2.403798999999708,62.210.85.178,10.0.2.15,TCP,60,9001  >  35978 [ACK] Seq=12840573 Ack=234954489 Win=65535 Len=0
1,2.4038590000000113,10.0.2.15,62.210.85.178,TLSv1.2,2974,Application Data
1,2.403900999999678,62.210.85.178,10.0.2.15,TCP,60,9001  >  35978 [ACK] Seq=12840573 Ack=234955639 Win=65535 Len=0
1,2.4039089999996577,62.210.85.178,10.0.2.15,TCP,60,9001  >  35978 [ACK] Seq=12840573 Ack=234957099 Win=65535 Len=0
1,2.403911999999764,62.210.85.178,10.0.2.15,TCP,60,9001  >  35978 [ACK] Seq=12840573 Ack=234958559 Win=65535 Len=0
1,2.403940000000148,10.0.2.15,62.210.85.178,TLSv1.2,1226,Application Data
1,2.4039769999999407,62.210.85.178,10.0.2.15,TCP,60,9001  >  35978 [ACK] Seq=12840573 Ack=234959731 Win=65535 Len=0
1,2.4040180000001783,10.0.2.15,62.210.85.178,TLSv1.2,4124,Application Data
1,2.404054999999971,62.210.85.178,10.0.2.15,TCP,60,9001  >  35978 [ACK] Seq=12840573 Ack=234961191 Win=65535 Len=0
1,2.4040640000002895,62.210.85.178,10.0.2.15,TCP,60,9001  >  35978 [ACK] Seq=12840573 Ack=234962651 Win=65535 Len=0
1,2.4040679999998247,62.210.85.178,10.0.2.15,TCP,60,9001  >  35978 [ACK] Seq=12840573 Ack=234963801 Win=65535 Len=0
1,2.4041070000002946,10.0.2.15,62.210.85.178,TLSv1.2,3030,Application Data
1,2.4041440000000875,62.210.85.178,10.0.2.15,TCP,60,9001  >  35978 [ACK] Seq=12840573 Ack=234965261 Win=65535 Len=0
1,2.4041520000000673,62.210.85.178,10.0.2.15,TCP,60,9001  >  35978 [ACK] Seq=12840573 Ack=234966721 Win=65535 Len=0
1,2.404156999999941,62.210.85.178,10.0.2.15,TCP,60,9001  >  35978 [ACK] Seq=12840573 Ack=234966777 Win=65535 Len=0
1,2.4133789999996225,10.0.2.15,62.210.85.178,TLSv1.2,4124,Application Data
1,2.4134320000002845,62.210.85.178,10.0.2.15,TCP,60,9001  >  35978 [ACK] Seq=12840573 Ack=234968237 Win=65535 Len=0
1,2.4134430000003704,62.210.85.178,10.0.2.15,TCP,60,9001  >  35978 [ACK] Seq=12840573 Ack=234969697 Win=65535 Len=0
1,2.413448000000244,62.210.85.178,10.0.2.15,TCP,60,9001  >  35978 [ACK] Seq=12840573 Ack=234970847 Win=65535 Len=0
1,2.4134930000000168,10.0.2.15,62.210.85.178,TLSv1.2,4124,Application Data
1,2.4135329999999158,62.210.85.178,10.0.2.15,TCP,60,9001  >  35978 [ACK] Seq=12840573 Ack=234972307 Win=65535 Len=0
1,2.413542000000234,62.210.85.178,10.0.2.15,TCP,60,9001  >  35978 [ACK] Seq=12840573 Ack=234973767 Win=65535 Len=0
1,2.413547000000108,62.210.85.178,10.0.2.15,TCP,60,9001  >  35978 [ACK] Seq=12840573 Ack=234974917 Win=65535 Len=0
1,2.413587000000007,10.0.2.15,62.210.85.178,TLSv1.2,4124,Application Data
1,2.4136250000001382,62.210.85.178,10.0.2.15,TCP,60,9001  >  35978 [ACK] Seq=12840573 Ack=234976377 Win=65535 Len=0
1,2.4136340000004566,62.210.85.178,10.0.2.15,TCP,60,9001  >  35978 [ACK] Seq=12840573 Ack=234977837 Win=65535 Len=0
1,2.4136379999999917,62.210.85.178,10.0.2.15,TCP,60,9001  >  35978 [ACK] Seq=12840573 Ack=234978987 Win=65535 Len=0
1,2.4136829999997644,10.0.2.15,62.210.85.178,TLSv1.2,4124,Application Data
1,2.4137220000002344,62.210.85.178,10.0.2.15,TCP,60,9001  >  35978 [ACK] Seq=12840573 Ack=234980447 Win=65535 Len=0
1,2.413730000000214,62.210.85.178,10.0.2.15,TCP,60,9001  >  35978 [ACK] Seq=12840573 Ack=234981907 Win=65535 Len=0
1,2.413735000000088,62.210.85.178,10.0.2.15,TCP,60,9001  >  35978 [ACK] Seq=12840573 Ack=234983057 Win=65535 Len=0
1,2.4137710000004517,10.0.2.15,62.210.85.178,TLSv1.2,332,Application Data
1,2.413806999999906,62.210.85.178,10.0.2.15,TCP,60,9001  >  35978 [ACK] Seq=12840573 Ack=234983335 Win=65535 Len=0
1,2.4138590000002296,10.0.2.15,62.210.85.178,TLSv1.2,3868,Application Data
1,2.41389799999979,62.210.85.178,10.0.2.15,TCP,60,9001  >  35978 [ACK] Seq=12840573 Ack=234984795 Win=65535 Len=0
1,2.4139070000001084,62.210.85.178,10.0.2.15,TCP,60,9001  >  35978 [ACK] Seq=12840573 Ack=234986255 Win=65535 Len=0
1,2.4139109999996435,62.210.85.178,10.0.2.15,TCP,60,9001  >  35978 [ACK] Seq=12840573 Ack=234987149 Win=65535 Len=0
1,2.413948999999775,10.0.2.15,62.210.85.178,TLSv1.2,4124,Application Data
1,2.4139869999999064,62.210.85.178,10.0.2.15,TCP,60,9001  >  35978 [ACK] Seq=12840573 Ack=234988609 Win=65535 Len=0
1,2.413994999999886,62.210.85.178,10.0.2.15,TCP,60,9001  >  35978 [ACK] Seq=12840573 Ack=234990069 Win=65535 Len=0
1,2.413999000000331,62.210.85.178,10.0.2.15,TCP,60,9001  >  35978 [ACK] Seq=12840573 Ack=234991219 Win=65535 Len=0
1,2.414034000000356,10.0.2.15,62.210.85.178,TLSv1.2,3030,Application Data
1,2.414071999999578,62.210.85.178,10.0.2.15,TCP,60,9001  >  35978 [ACK] Seq=12840573 Ack=234992679 Win=65535 Len=0
1,2.4140800000004674,62.210.85.178,10.0.2.15,TCP,60,9001  >  35978 [ACK] Seq=12840573 Ack=234994139 Win=65535 Len=0
1,2.4140840000000026,62.210.85.178,10.0.2.15,TCP,60,9001  >  35978 [ACK] Seq=12840573 Ack=234994195 Win=65535 Len=0
1,2.4268789999996443,10.0.2.15,62.210.85.178,TLSv1.2,4124,Application Data
1,2.4269750000003114,62.210.85.178,10.0.2.15,TCP,60,9001  >  35978 [ACK] Seq=12840573 Ack=234995655 Win=65535 Len=0
1,2.4269860000003973,62.210.85.178,10.0.2.15,TCP,60,9001  >  35978 [ACK] Seq=12840573 Ack=234997115 Win=65535 Len=0
1,2.4269899999999325,62.210.85.178,10.0.2.15,TCP,60,9001  >  35978 [ACK] Seq=12840573 Ack=234998265 Win=65535 Len=0
1,2.4270360000000437,10.0.2.15,62.210.85.178,TLSv1.2,4124,Application Data
1,2.4270770000002813,62.210.85.178,10.0.2.15,TCP,60,9001  >  35978 [ACK] Seq=12840573 Ack=234999725 Win=65535 Len=0
1,2.42708599999969,62.210.85.178,10.0.2.15,TCP,60,9001  >  35978 [ACK] Seq=12840573 Ack=235001185 Win=65535 Len=0
1,2.4270900000001348,62.210.85.178,10.0.2.15,TCP,60,9001  >  35978 [ACK] Seq=12840573 Ack=235002335 Win=65535 Len=0
1,2.427128000000266,10.0.2.15,62.210.85.178,TLSv1.2,4124,Application Data
1,2.4271660000003976,62.210.85.178,10.0.2.15,TCP,60,9001  >  35978 [ACK] Seq=12840573 Ack=235003795 Win=65535 Len=0
1,2.4271740000003774,62.210.85.178,10.0.2.15,TCP,60,9001  >  35978 [ACK] Seq=12840573 Ack=235005255 Win=65535 Len=0
1,2.42717999999968,62.210.85.178,10.0.2.15,TCP,60,9001  >  35978 [ACK] Seq=12840573 Ack=235006405 Win=65535 Len=0
1,2.4272170000003825,10.0.2.15,62.210.85.178,TLSv1.2,268,Application Data
1,2.4272549999996045,62.210.85.178,10.0.2.15,TCP,60,9001  >  35978 [ACK] Seq=12840573 Ack=235006619 Win=65535 Len=0
1,2.6917480000001888,54.93.77.70,10.0.2.15,TCP,2950,"9001  >  34692 [PSH, ACK] Seq=234846065 Ack=12926021 Win=65535 Len=2896 [TCP segment of a reassembled PDU]"
1,2.6918729999997595,10.0.2.15,54.93.77.70,TCP,54,34692  >  9001 [ACK] Seq=12926021 Ack=234848961 Win=65535 Len=0
1,2.695284999999785,54.93.77.70,10.0.2.15,TLSv1.2,2950,Application Data [TCP segment of a reassembled PDU]
1,2.695306999999957,54.93.77.70,10.0.2.15,TLSv1.2,8344,"Application Data, Application Data, Application Data"
1,2.6953560000001744,10.0.2.15,54.93.77.70,TCP,54,34692  >  9001 [ACK] Seq=12926021 Ack=234851857 Win=65535 Len=0
1,2.6954450000002907,10.0.2.15,54.93.77.70,TCP,54,34692  >  9001 [ACK] Seq=12926021 Ack=234860147 Win=65535 Len=0
1,2.703497999999854,54.93.77.70,10.0.2.15,TLSv1.2,1502,Application Data [TCP segment of a reassembled PDU]
1,2.703556999999819,10.0.2.15,54.93.77.70,TCP,54,34692  >  9001 [ACK] Seq=12926021 Ack=234861595 Win=65535 Len=0
1,2.7101419999999052,54.93.77.70,10.0.2.15,TCP,2950,"9001  >  34692 [PSH, ACK] Seq=234861595 Ack=12926021 Win=65535 Len=2896 [TCP segment of a reassembled PDU]"
1,2.7102139999997235,10.0.2.15,54.93.77.70,TCP,54,34692  >  9001 [ACK] Seq=12926021 Ack=234864491 Win=65535 Len=0
1,2.7140129999997953,54.93.77.70,10.0.2.15,TLSv1.2,2950,Application Data [TCP segment of a reassembled PDU]
1,2.7140779999999722,10.0.2.15,54.93.77.70,TCP,54,34692  >  9001 [ACK] Seq=12926021 Ack=234867387 Win=65535 Len=0
1,2.7144939999998314,54.93.77.70,10.0.2.15,TLSv1.2,8272,"Application Data, Application Data, Application Data, Application Data, Application Data"
1,2.7145620000001145,10.0.2.15,54.93.77.70,TCP,54,34692  >  9001 [ACK] Seq=12926021 Ack=234875605 Win=65535 Len=0
1,2.7147350000004735,10.0.2.15,54.93.77.70,TLSv1.2,590,Application Data
1,2.7148440000000846,54.93.77.70,10.0.2.15,TCP,60,9001  >  34692 [ACK] Seq=234875605 Ack=12926557 Win=65535 Len=0
1,2.7148550000001705,54.93.77.70,10.0.2.15,TCP,2950,"9001  >  34692 [PSH, ACK] Seq=234875605 Ack=12926557 Win=65535 Len=2896 [TCP segment of a reassembled PDU]"
1,2.714893999999731,10.0.2.15,54.93.77.70,TCP,54,34692  >  9001 [ACK] Seq=12926557 Ack=234878501 Win=65535 Len=0
1,2.7176870000002964,54.93.77.70,10.0.2.15,TLSv1.2,8742,"Application Data, Application Data"
1,2.7177359999996042,10.0.2.15,54.93.77.70,TCP,54,34692  >  9001 [ACK] Seq=12926557 Ack=234887189 Win=65535 Len=0
1,2.7265129999996134,54.93.77.70,10.0.2.15,TLSv1.2,1502,Application Data [TCP segment of a reassembled PDU]
1,2.726568000000043,10.0.2.15,54.93.77.70,TCP,54,34692  >  9001 [ACK] Seq=12926557 Ack=234888637 Win=65535 Len=0
1,2.7267680000004475,10.0.2.15,54.93.77.70,TLSv1.2,590,Application Data
1,2.7268809999995938,54.93.77.70,10.0.2.15,TCP,60,9001  >  34692 [ACK] Seq=234888637 Ack=12927093 Win=65535 Len=0
1,2.7282059999997728,54.93.77.70,10.0.2.15,TLSv1.2,4398,Application Data [TCP segment of a reassembled PDU]
1,2.7282729999997173,10.0.2.15,54.93.77.70,TCP,54,34692  >  9001 [ACK] Seq=12927093 Ack=234892981 Win=65535 Len=0
1,2.7316710000004605,54.93.77.70,10.0.2.15,TLSv1.2,264,Application Data
1,2.7401920000002065,54.93.77.70,10.0.2.15,TLSv1.2,7294,Application Data
1,2.740265000000363,10.0.2.15,54.93.77.70,TCP,54,34692  >  9001 [ACK] Seq=12927093 Ack=234900431 Win=65535 Len=0
1,2.7438670000001366,54.93.77.70,10.0.2.15,TLSv1.2,1502,Application Data [TCP segment of a reassembled PDU]
1,2.7439119999999093,10.0.2.15,54.93.77.70,TCP,54,34692  >  9001 [ACK] Seq=12927093 Ack=234901879 Win=65535 Len=0
1,2.7440960000003543,10.0.2.15,54.93.77.70,TLSv1.2,590,Application Data
1,2.7442080000000715,54.93.77.70,10.0.2.15,TCP,60,9001  >  34692 [ACK] Seq=234901879 Ack=12927629 Win=65535 Len=0
1,2.752534999999625,54.93.77.70,10.0.2.15,TLSv1.2,2950,Application Data [TCP segment of a reassembled PDU]
1,2.752690000000257,10.0.2.15,54.93.77.70,TCP,54,34692  >  9001 [ACK] Seq=12927629 Ack=234904775 Win=65535 Len=0
1,2.756510000000162,54.93.77.70,10.0.2.15,TLSv1.2,894,Application Data
1,2.7726030000003448,54.93.77.70,10.0.2.15,TCP,2950,"9001  >  34692 [PSH, ACK] Seq=234905615 Ack=12927629 Win=65535 Len=2896 [TCP segment of a reassembled PDU]"
1,2.7726659999998446,10.0.2.15,54.93.77.70,TCP,54,34692  >  9001 [ACK] Seq=12927629 Ack=234908511 Win=65535 Len=0
1,2.791385000000446,54.93.77.70,10.0.2.15,TLSv1.2,264,Application Data
1,2.834461000000374,10.0.2.15,54.93.77.70,TCP,54,34692  >  9001 [ACK] Seq=12927629 Ack=234908721 Win=65535 Len=0
1,2.8356059999996432,62.210.85.178,10.0.2.15,TLSv1.2,590,Application Data
1,2.8433310000000347,54.93.77.70,10.0.2.15,TCP,2950,"9001  >  34692 [PSH, ACK] Seq=234908721 Ack=12927629 Win=65535 Len=2896 [TCP segment of a reassembled PDU]"
1,2.8434049999996205,10.0.2.15,54.93.77.70,TCP,54,34692  >  9001 [ACK] Seq=12927629 Ack=234911617 Win=65535 Len=0
1,2.8499769999998534,54.93.77.70,10.0.2.15,TLSv1.2,778,Application Data
1,2.8501070000002073,10.0.2.15,54.93.77.70,TCP,54,34692  >  9001 [ACK] Seq=12927629 Ack=234912341 Win=65535 Len=0
1,2.878461000000243,10.0.2.15,62.210.85.178,TCP,54,35978  >  9001 [ACK] Seq=235006619 Ack=12841109 Win=65535 Len=0
1,2.888764000000265,54.93.77.70,10.0.2.15,TLSv1.2,1618,Application Data
1,2.888850999999704,10.0.2.15,54.93.77.70,TCP,54,34692  >  9001 [ACK] Seq=12927629 Ack=234913905 Win=65535 Len=0
1,2.8926140000003215,10.0.2.15,54.93.77.70,TLSv1.2,590,Application Data
1,2.8927929999999833,54.93.77.70,10.0.2.15,TCP,60,9001  >  34692 [ACK] Seq=234913905 Ack=12928165 Win=65535 Len=0
1,3.6136939999996684,62.210.85.178,10.0.2.15,TLSv1.2,1618,Application Data
1,3.6137930000004417,10.0.2.15,62.210.85.178,TCP,54,35978  >  9001 [ACK] Seq=235006619 Ack=12842673 Win=65535 Len=0
1,3.6144279999998616,10.0.2.15,62.210.85.178,TLSv1.2,590,Application Data
1,3.6145699999997305,62.210.85.178,10.0.2.15,TCP,60,9001  >  35978 [ACK] Seq=12842673 Ack=235007155 Win=65535 Len=0
1,3.8192840000001524,54.93.77.70,10.0.2.15,TLSv1.2,590,Application Data
1,3.819663999999648,10.0.2.15,54.93.77.70,TLSv1.2,590,Application Data
1,3.8197620000000825,54.93.77.70,10.0.2.15,TCP,60,9001  >  34692 [ACK] Seq=234914441 Ack=12928701 Win=65535 Len=0
1,3.9380629999996017,62.210.85.178,10.0.2.15,TLSv1.2,590,Application Data
1,3.9424870000002556,10.0.2.15,62.210.85.178,TLSv1.2,590,Application Data
1,3.9434140000003026,62.210.85.178,10.0.2.15,TCP,60,9001  >  35978 [ACK] Seq=12843209 Ack=235007691 Win=65535 Len=0
1,3.954990999999609,10.0.2.15,62.210.85.178,TLSv1.2,4124,Application Data
1,3.9550829999998314,10.0.2.15,62.210.85.178,TCP,2974,35978  >  9001 [ACK] Seq=235011761 Ack=12843209 Win=65535 Len=2920 [TCP segment of a reassembled PDU]
1,3.955127000000175,62.210.85.178,10.0.2.15,TCP,60,9001  >  35978 [ACK] Seq=12843209 Ack=235009151 Win=65535 Len=0
1,3.955138000000261,62.210.85.178,10.0.2.15,TCP,60,9001  >  35978 [ACK] Seq=12843209 Ack=235010611 Win=65535 Len=0
1,3.955141999999796,62.210.85.178,10.0.2.15,TCP,60,9001  >  35978 [ACK] Seq=12843209 Ack=235011761 Win=65535 Len=0
1,3.955144000000473,62.210.85.178,10.0.2.15,TCP,60,9001  >  35978 [ACK] Seq=12843209 Ack=235013221 Win=65535 Len=0
1,3.9551480000000083,62.210.85.178,10.0.2.15,TCP,60,9001  >  35978 [ACK] Seq=12843209 Ack=235014681 Win=65535 Len=0
1,3.9551830000000336,10.0.2.15,62.210.85.178,TLSv1.2,1204,Application Data
1,3.955218000000059,62.210.85.178,10.0.2.15,TCP,60,9001  >  35978 [ACK] Seq=12843209 Ack=235015831 Win=65535 Len=0
1,3.9552620000004026,10.0.2.15,62.210.85.178,TLSv1.2,4124,Application Data
1,3.9552960000000894,62.210.85.178,10.0.2.15,TCP,60,9001  >  35978 [ACK] Seq=12843209 Ack=235017291 Win=65535 Len=0
1,3.955304000000069,62.210.85.178,10.0.2.15,TCP,60,9001  >  35978 [ACK] Seq=12843209 Ack=235018751 Win=65535 Len=0
1,3.9553079999996044,62.210.85.178,10.0.2.15,TCP,60,9001  >  35978 [ACK] Seq=12843209 Ack=235019901 Win=65535 Len=0
1,3.955345999999736,10.0.2.15,62.210.85.178,TLSv1.2,4124,Application Data
1,3.9553789999999935,62.210.85.178,10.0.2.15,TCP,60,9001  >  35978 [ACK] Seq=12843209 Ack=235021361 Win=65535 Len=0
1,3.955385999999635,62.210.85.178,10.0.2.15,TCP,60,9001  >  35978 [ACK] Seq=12843209 Ack=235022821 Win=65535 Len=0
1,3.9554250000001048,62.210.85.178,10.0.2.15,TCP,60,9001  >  35978 [ACK] Seq=12843209 Ack=235023971 Win=65535 Len=0
1,3.9554580000003625,10.0.2.15,62.210.85.178,TLSv1.2,332,Application Data
1,3.9554900000002817,62.210.85.178,10.0.2.15,TCP,60,9001  >  35978 [ACK] Seq=12843209 Ack=235024249 Win=65535 Len=0
1,3.9555440000003728,10.0.2.15,62.210.85.178,TLSv1.2,3868,Application Data
1,3.955579999999827,62.210.85.178,10.0.2.15,TCP,60,9001  >  35978 [ACK] Seq=12843209 Ack=235025709 Win=65535 Len=0
1,3.955587000000378,62.210.85.178,10.0.2.15,TCP,60,9001  >  35978 [ACK] Seq=12843209 Ack=235027169 Win=65535 Len=0
1,3.9555899999995745,62.210.85.178,10.0.2.15,TCP,60,9001  >  35978 [ACK] Seq=12843209 Ack=235028063 Win=65535 Len=0
1,3.9556259999999384,10.0.2.15,62.210.85.178,TLSv1.2,4124,Application Data
1,3.9556609999999637,62.210.85.178,10.0.2.15,TCP,60,9001  >  35978 [ACK] Seq=12843209 Ack=235029523 Win=65535 Len=0
1,3.955667000000176,62.210.85.178,10.0.2.15,TCP,60,9001  >  35978 [ACK] Seq=12843209 Ack=235030983 Win=65535 Len=0
1,3.955670000000282,62.210.85.178,10.0.2.15,TCP,60,9001  >  35978 [ACK] Seq=12843209 Ack=235032133 Win=65535 Len=0
1,3.955703999999969,10.0.2.15,62.210.85.178,TLSv1.2,3030,Application Data
1,3.9557379999996556,62.210.85.178,10.0.2.15,TCP,60,9001  >  35978 [ACK] Seq=12843209 Ack=235033593 Win=65535 Len=0
1,3.955743999999868,62.210.85.178,10.0.2.15,TCP,60,9001  >  35978 [ACK] Seq=12843209 Ack=235035053 Win=65535 Len=0
1,3.955746999999974,62.210.85.178,10.0.2.15,TCP,60,9001  >  35978 [ACK] Seq=12843209 Ack=235035109 Win=65535 Len=0
1,3.9671900000003006,10.0.2.15,62.210.85.178,TLSv1.2,4124,Application Data
1,3.967239999999947,62.210.85.178,10.0.2.15,TCP,60,9001  >  35978 [ACK] Seq=12843209 Ack=235036569 Win=65535 Len=0
1,3.9672499999996944,62.210.85.178,10.0.2.15,TCP,60,9001  >  35978 [ACK] Seq=12843209 Ack=235038029 Win=65535 Len=0
1,3.9672550000004776,62.210.85.178,10.0.2.15,TCP,60,9001  >  35978 [ACK] Seq=12843209 Ack=235039179 Win=65535 Len=0
1,3.9673000000002503,10.0.2.15,62.210.85.178,TLSv1.2,4124,Application Data
1,3.967359000000215,62.210.85.178,10.0.2.15,TCP,60,9001  >  35978 [ACK] Seq=12843209 Ack=235040639 Win=65535 Len=0
1,3.967367000000195,62.210.85.178,10.0.2.15,TCP,60,9001  >  35978 [ACK] Seq=12843209 Ack=235042099 Win=65535 Len=0
1,3.96737099999973,62.210.85.178,10.0.2.15,TCP,60,9001  >  35978 [ACK] Seq=12843209 Ack=235043249 Win=65535 Len=0
1,3.967407000000094,10.0.2.15,62.210.85.178,TLSv1.2,4124,Application Data
1,3.9674400000003516,62.210.85.178,10.0.2.15,TCP,60,9001  >  35978 [ACK] Seq=12843209 Ack=235044709 Win=65535 Len=0
1,3.9674480000003314,62.210.85.178,10.0.2.15,TCP,60,9001  >  35978 [ACK] Seq=12843209 Ack=235046169 Win=65535 Len=0
1,3.9674519999998665,62.210.85.178,10.0.2.15,TCP,60,9001  >  35978 [ACK] Seq=12843209 Ack=235047319 Win=65535 Len=0
1,3.967486000000463,10.0.2.15,62.210.85.178,TLSv1.2,268,Application Data
1,3.967518999999811,62.210.85.178,10.0.2.15,TCP,60,9001  >  35978 [ACK] Seq=12843209 Ack=235047533 Win=65535 Len=0
1,4.064317000000301,54.93.77.70,10.0.2.15,TLSv1.2,590,Application Data
1,4.106501000000208,10.0.2.15,54.93.77.70,TCP,54,34692  >  9001 [ACK] Seq=12928701 Ack=234914977 Win=65535 Len=0
1,4.126941999999872,54.93.77.70,10.0.2.15,TLSv1.2,8194,"Application Data, Application Data"
1,4.126997000000301,10.0.2.15,54.93.77.70,TCP,54,34692  >  9001 [ACK] Seq=12928701 Ack=234923117 Win=65535 Len=0
1,4.127183999999943,10.0.2.15,54.93.77.70,TLSv1.2,590,Application Data
1,4.127261999999973,54.93.77.70,10.0.2.15,TCP,60,9001  >  34692 [ACK] Seq=234923117 Ack=12929237 Win=65535 Len=0
1,4.144669999999678,54.93.77.70,10.0.2.15,TLSv1.2,1232,Application Data
1,4.148121999999603,54.93.77.70,10.0.2.15,TCP,2950,"9001  >  34692 [PSH, ACK] Seq=234924295 Ack=12929237 Win=65535 Len=2896 [TCP segment of a reassembled PDU]"
1,4.1481400000002395,54.93.77.70,10.0.2.15,TLSv1.2,1502,Application Data [TCP segment of a reassembled PDU]
1,4.148188000000118,10.0.2.15,54.93.77.70,TCP,54,34692  >  9001 [ACK] Seq=12929237 Ack=234927191 Win=65535 Len=0
1,4.148280000000341,10.0.2.15,54.93.77.70,TCP,54,34692  >  9001 [ACK] Seq=12929237 Ack=234928639 Win=65535 Len=0
1,4.161850000000413,54.93.77.70,10.0.2.15,TLSv1.2,2950,Application Data [TCP segment of a reassembled PDU]
1,4.161901999999827,10.0.2.15,54.93.77.70,TCP,54,34692  >  9001 [ACK] Seq=12929237 Ack=234931535 Win=65535 Len=0
1,4.161952000000383,54.93.77.70,10.0.2.15,TCP,1502,"9001  >  34692 [PSH, ACK] Seq=234931535 Ack=12929237 Win=65535 Len=1448 [TCP segment of a reassembled PDU]"
1,4.162006000000474,10.0.2.15,54.93.77.70,TCP,54,34692  >  9001 [ACK] Seq=12929237 Ack=234932983 Win=65535 Len=0
1,4.164181000000099,54.93.77.70,10.0.2.15,TLSv1.2,684,Application Data
1,4.167335000000094,54.93.77.70,10.0.2.15,TLSv1.2,4398,Application Data
1,4.167381000000205,10.0.2.15,54.93.77.70,TCP,54,34692  >  9001 [ACK] Seq=12929237 Ack=234937957 Win=65535 Len=0
1,4.168142000000444,54.93.77.70,10.0.2.15,TLSv1.2,2950,Application Data
1,4.168187000000216,10.0.2.15,54.93.77.70,TCP,54,34692  >  9001 [ACK] Seq=12929237 Ack=234940853 Win=65535 Len=0
1,4.16833299999962,10.0.2.15,54.93.77.70,TLSv1.2,590,Application Data
1,4.168402999999671,54.93.77.70,10.0.2.15,TCP,60,9001  >  34692 [ACK] Seq=234940853 Ack=12929773 Win=65535 Len=0
1,4.188831000000391,54.93.77.70,10.0.2.15,TCP,2950,"9001  >  34692 [PSH, ACK] Seq=234940853 Ack=12929773 Win=65535 Len=2896 [TCP segment of a reassembled PDU]"
1,4.188938000000235,54.93.77.70,10.0.2.15,TLSv1.2,778,Application Data
1,4.188967000000048,10.0.2.15,54.93.77.70,TCP,54,34692  >  9001 [ACK] Seq=12929773 Ack=234943749 Win=65535 Len=0
1,4.216443999999683,54.93.77.70,10.0.2.15,TCP,1502,"9001  >  34692 [PSH, ACK] Seq=234944473 Ack=12929773 Win=65535 Len=1448 [TCP segment of a reassembled PDU]"
1,4.216486000000259,10.0.2.15,54.93.77.70,TCP,54,34692  >  9001 [ACK] Seq=12929773 Ack=234945921 Win=65535 Len=0
1,4.225129999999808,54.93.77.70,10.0.2.15,TLSv1.2,2950,Application Data [TCP segment of a reassembled PDU]
1,4.225145999999768,54.93.77.70,10.0.2.15,TCP,1502,"9001  >  34692 [PSH, ACK] Seq=234948817 Ack=12929773 Win=65535 Len=1448 [TCP segment of a reassembled PDU]"
1,4.225206000000071,10.0.2.15,54.93.77.70,TCP,54,34692  >  9001 [ACK] Seq=12929773 Ack=234950265 Win=65535 Len=0
1,4.231834000000163,54.93.77.70,10.0.2.15,TLSv1.2,1502,Application Data [TCP segment of a reassembled PDU]
1,4.23189100000036,10.0.2.15,54.93.77.70,TCP,54,34692  >  9001 [ACK] Seq=12929773 Ack=234951713 Win=65535 Len=0
1,4.232649999999921,54.93.77.70,10.0.2.15,TLSv1.2,590,Application Data
1,4.258713000000171,62.210.85.178,10.0.2.15,TLSv1.2,590,Application Data
1,4.274497999999767,10.0.2.15,54.93.77.70,TCP,54,34692  >  9001 [ACK] Seq=12929773 Ack=234952249 Win=65535 Len=0
1,4.277188000000024,62.210.85.178,10.0.2.15,TLSv1.2,590,Application Data
1,4.277282000000014,10.0.2.15,62.210.85.178,TCP,54,35978  >  9001 [ACK] Seq=235047533 Ack=12844281 Win=65535 Len=0
1,4.308686999999736,54.93.77.70,10.0.2.15,TLSv1.2,2646,Application Data
1,4.308732999999847,10.0.2.15,54.93.77.70,TCP,54,34692  >  9001 [ACK] Seq=12929773 Ack=234954841 Win=65535 Len=0
1,4.3112229999997,10.0.2.15,54.93.77.70,TLSv1.2,590,Application Data
1,4.311383999999634,54.93.77.70,10.0.2.15,TCP,60,9001  >  34692 [ACK] Seq=234954841 Ack=12930309 Win=65535 Len=0
1,4.429624000000331,62.210.85.178,10.0.2.15,TLSv1.2,590,Application Data
1,4.43010299999969,10.0.2.15,62.210.85.178,TLSv1.2,590,Application Data
1,4.4302120000002105,62.210.85.178,10.0.2.15,TCP,60,9001  >  35978 [ACK] Seq=12844817 Ack=235048069 Win=65535 Len=0
1,4.536495999999715,54.93.77.70,10.0.2.15,TLSv1.2,590,Application Data
1,4.536858999999822,10.0.2.15,54.93.77.70,TLSv1.2,590,Application Data
1,4.536963999999898,54.93.77.70,10.0.2.15,TCP,60,9001  >  34692 [ACK] Seq=234955377 Ack=12930845 Win=65535 Len=0
1,4.6191570000000866,62.210.85.178,10.0.2.15,TLSv1.2,590,Application Data
1,4.624367000000348,10.0.2.15,62.210.85.178,TLSv1.2,590,Application Data
1,4.6254109999999855,62.210.85.178,10.0.2.15,TCP,60,9001  >  35978 [ACK] Seq=12845353 Ack=235048605 Win=65535 Len=0
1,4.6347420000001875,10.0.2.15,62.210.85.178,TLSv1.2,4124,Application Data
1,4.634836000000178,10.0.2.15,62.210.85.178,TCP,2974,35978  >  9001 [ACK] Seq=235052675 Ack=12845353 Win=65535 Len=2920 [TCP segment of a reassembled PDU]
1,4.634914000000208,62.210.85.178,10.0.2.15,TCP,60,9001  >  35978 [ACK] Seq=12845353 Ack=235050065 Win=65535 Len=0
1,4.6349280000004,62.210.85.178,10.0.2.15,TCP,60,9001  >  35978 [ACK] Seq=12845353 Ack=235051525 Win=65535 Len=0
1,4.634930999999597,62.210.85.178,10.0.2.15,TCP,60,9001  >  35978 [ACK] Seq=12845353 Ack=235052675 Win=65535 Len=0
1,4.634933999999703,62.210.85.178,10.0.2.15,TCP,60,9001  >  35978 [ACK] Seq=12845353 Ack=235054135 Win=65535 Len=0
1,4.634936999999809,62.210.85.178,10.0.2.15,TCP,60,9001  >  35978 [ACK] Seq=12845353 Ack=235055595 Win=65535 Len=0
1,4.63497499999994,10.0.2.15,62.210.85.178,TLSv1.2,1204,Application Data
1,4.635019000000284,62.210.85.178,10.0.2.15,TCP,60,9001  >  35978 [ACK] Seq=12845353 Ack=235056745 Win=65535 Len=0
1,4.635078000000249,10.0.2.15,62.210.85.178,TLSv1.2,4124,Application Data
1,4.635118000000148,62.210.85.178,10.0.2.15,TCP,60,9001  >  35978 [ACK] Seq=12845353 Ack=235058205 Win=65535 Len=0
1,4.635124999999789,62.210.85.178,10.0.2.15,TCP,60,9001  >  35978 [ACK] Seq=12845353 Ack=235059665 Win=65535 Len=0
1,4.635129000000234,62.210.85.178,10.0.2.15,TCP,60,9001  >  35978 [ACK] Seq=12845353 Ack=235060815 Win=65535 Len=0
1,4.635167999999794,10.0.2.15,62.210.85.178,TLSv1.2,4124,Application Data
1,4.63520200000039,62.210.85.178,10.0.2.15,TCP,60,9001  >  35978 [ACK] Seq=12845353 Ack=235062275 Win=65535 Len=0
1,4.635209000000032,62.210.85.178,10.0.2.15,TCP,60,9001  >  35978 [ACK] Seq=12845353 Ack=235063735 Win=65535 Len=0
1,4.635248999999931,62.210.85.178,10.0.2.15,TCP,60,9001  >  35978 [ACK] Seq=12845353 Ack=235064885 Win=65535 Len=0
1,4.635282000000188,10.0.2.15,62.210.85.178,TLSv1.2,332,Application Data
1,4.635315000000446,62.210.85.178,10.0.2.15,TCP,60,9001  >  35978 [ACK] Seq=12845353 Ack=235065163 Win=65535 Len=0
1,4.635371000000305,10.0.2.15,62.210.85.178,TLSv1.2,3868,Application Data
1,4.635406999999759,62.210.85.178,10.0.2.15,TCP,60,9001  >  35978 [ACK] Seq=12845353 Ack=235066623 Win=65535 Len=0
1,4.63541400000031,62.210.85.178,10.0.2.15,TCP,60,9001  >  35978 [ACK] Seq=12845353 Ack=235068083 Win=65535 Len=0
1,4.635417999999845,62.210.85.178,10.0.2.15,TCP,60,9001  >  35978 [ACK] Seq=12845353 Ack=235068977 Win=65535 Len=0
1,4.635454999999638,10.0.2.15,62.210.85.178,TLSv1.2,4124,Application Data
1,4.635489000000234,62.210.85.178,10.0.2.15,TCP,60,9001  >  35978 [ACK] Seq=12845353 Ack=235070437 Win=65535 Len=0
1,4.6354959999998755,62.210.85.178,10.0.2.15,TCP,60,9001  >  35978 [ACK] Seq=12845353 Ack=235071897 Win=65535 Len=0
1,4.635498999999982,62.210.85.178,10.0.2.15,TCP,60,9001  >  35978 [ACK] Seq=12845353 Ack=235073047 Win=65535 Len=0
1,4.635532999999668,10.0.2.15,62.210.85.178,TLSv1.2,3030,Application Data
1,4.635567000000265,62.210.85.178,10.0.2.15,TCP,60,9001  >  35978 [ACK] Seq=12845353 Ack=235074507 Win=65535 Len=0
1,4.635573999999906,62.210.85.178,10.0.2.15,TCP,60,9001  >  35978 [ACK] Seq=12845353 Ack=235075967 Win=65535 Len=0
1,4.635577000000012,62.210.85.178,10.0.2.15,TCP,60,9001  >  35978 [ACK] Seq=12845353 Ack=235076023 Win=65535 Len=0
1,4.64696400000048,10.0.2.15,62.210.85.178,TLSv1.2,4124,Application Data
1,4.647049000000152,10.0.2.15,62.210.85.178,TCP,2974,35978  >  9001 [ACK] Seq=235080093 Ack=12845353 Win=65535 Len=2920 [TCP segment of a reassembled PDU]
1,4.647117000000435,62.210.85.178,10.0.2.15,TCP,60,9001  >  35978 [ACK] Seq=12845353 Ack=235077483 Win=65535 Len=0
1,4.647125999999844,62.210.85.178,10.0.2.15,TCP,60,9001  >  35978 [ACK] Seq=12845353 Ack=235078943 Win=65535 Len=0
1,4.6471309999997175,62.210.85.178,10.0.2.15,TCP,60,9001  >  35978 [ACK] Seq=12845353 Ack=235080093 Win=65535 Len=0
1,4.647135000000162,62.210.85.178,10.0.2.15,TCP,60,9001  >  35978 [ACK] Seq=12845353 Ack=235081553 Win=65535 Len=0
1,4.647140000000036,62.210.85.178,10.0.2.15,TCP,60,9001  >  35978 [ACK] Seq=12845353 Ack=235083013 Win=65535 Len=0
1,4.647181999999702,10.0.2.15,62.210.85.178,TLSv1.2,1204,Application Data
1,4.647251000000324,10.0.2.15,62.210.85.178,TCP,2974,35978  >  9001 [ACK] Seq=235084163 Ack=12845353 Win=65535 Len=2920 [TCP segment of a reassembled PDU]
1,4.647291000000223,62.210.85.178,10.0.2.15,TCP,60,9001  >  35978 [ACK] Seq=12845353 Ack=235084163 Win=65535 Len=0
1,4.647297999999864,62.210.85.178,10.0.2.15,TCP,60,9001  >  35978 [ACK] Seq=12845353 Ack=235085623 Win=65535 Len=0
1,4.647302999999738,62.210.85.178,10.0.2.15,TCP,60,9001  >  35978 [ACK] Seq=12845353 Ack=235087083 Win=65535 Len=0
1,4.647337999999763,10.0.2.15,62.210.85.178,TLSv1.2,1204,Application Data
1,4.64740299999994,10.0.2.15,62.210.85.178,TCP,2974,35978  >  9001 [ACK] Seq=235088233 Ack=12845353 Win=65535 Len=2920 [TCP segment of a reassembled PDU]
1,4.647436999999627,62.210.85.178,10.0.2.15,TCP,60,9001  >  35978 [ACK] Seq=12845353 Ack=235088233 Win=65535 Len=0
1,4.647444000000178,62.210.85.178,10.0.2.15,TCP,60,9001  >  35978 [ACK] Seq=12845353 Ack=235089693 Win=65535 Len=0
1,4.647447999999713,62.210.85.178,10.0.2.15,TCP,60,9001  >  35978 [ACK] Seq=12845353 Ack=235091153 Win=65535 Len=0
1,4.647479999999632,10.0.2.15,62.210.85.178,TLSv1.2,1204,Application Data
1,4.647573000000193,10.0.2.15,62.210.85.178,TLSv1.2,2974,Application Data
1,4.647595999999794,62.210.85.178,10.0.2.15,TCP,60,9001  >  35978 [ACK] Seq=12845353 Ack=235092303 Win=65535 Len=0
1,4.647602000000006,62.210.85.178,10.0.2.15,TCP,60,9001  >  35978 [ACK] Seq=12845353 Ack=235093763 Win=65535 Len=0
1,4.64760699999988,62.210.85.178,10.0.2.15,TCP,60,9001  >  35978 [ACK] Seq=12845353 Ack=235095223 Win=65535 Len=0
1,4.647638999999799,10.0.2.15,62.210.85.178,TLSv1.2,1226,Application Data
1,4.647675999999592,62.210.85.178,10.0.2.15,TCP,60,9001  >  35978 [ACK] Seq=12845353 Ack=235096395 Win=65535 Len=0
1,4.647718999999597,10.0.2.15,62.210.85.178,TLSv1.2,4124,Application Data
1,4.647759999999835,62.210.85.178,10.0.2.15,TCP,60,9001  >  35978 [ACK] Seq=12845353 Ack=235097855 Win=65535 Len=0
1,4.6477670000003855,62.210.85.178,10.0.2.15,TCP,60,9001  >  35978 [ACK] Seq=12845353 Ack=235099315 Win=65535 Len=0
1,4.647770999999921,62.210.85.178,10.0.2.15,TCP,60,9001  >  35978 [ACK] Seq=12845353 Ack=235100465 Win=65535 Len=0
1,4.647817000000032,10.0.2.15,62.210.85.178,TLSv1.2,3030,Application Data
1,4.647856999999931,62.210.85.178,10.0.2.15,TCP,60,9001  >  35978 [ACK] Seq=12845353 Ack=235101925 Win=65535 Len=0
1,4.647863000000143,62.210.85.178,10.0.2.15,TCP,60,9001  >  35978 [ACK] Seq=12845353 Ack=235103385 Win=65535 Len=0
1,4.647868000000017,62.210.85.178,10.0.2.15,TCP,60,9001  >  35978 [ACK] Seq=12845353 Ack=235103441 Win=65535 Len=0
1,4.657046000000264,10.0.2.15,62.210.85.178,TLSv1.2,1618,Application Data
1,4.657156999999643,62.210.85.178,10.0.2.15,TCP,60,9001  >  35978 [ACK] Seq=12845353 Ack=235104901 Win=65535 Len=0
1,4.657172000000173,62.210.85.178,10.0.2.15,TCP,60,9001  >  35978 [ACK] Seq=12845353 Ack=235105005 Win=65535 Len=0
1,4.737089999999625,54.93.77.70,10.0.2.15,TCP,2950,"9001  >  34692 [PSH, ACK] Seq=234955377 Ack=12930845 Win=65535 Len=2896 [TCP segment of a reassembled PDU]"
1,4.737216000000444,10.0.2.15,54.93.77.70,TCP,54,34692  >  9001 [ACK] Seq=12930845 Ack=234958273 Win=65535 Len=0
1,4.737532000000101,54.93.77.70,10.0.2.15,TLSv1.2,778,Application Data
1,4.773237999999765,54.93.77.70,10.0.2.15,TLSv1.2,3674,Application Data
1,4.773320999999669,10.0.2.15,54.93.77.70,TCP,54,34692  >  9001 [ACK] Seq=12930845 Ack=234962617 Win=65535 Len=0
1,4.784040999999888,54.93.77.70,10.0.2.15,TLSv1.2,7294,Application Data
1,4.784118999999919,10.0.2.15,54.93.77.70,TCP,54,34692  >  9001 [ACK] Seq=12930845 Ack=234969857 Win=65535 Len=0
1,4.791014000000359,54.93.77.70,10.0.2.15,TLSv1.2,568,Application Data
1,4.808618000000024,54.93.77.70,10.0.2.15,TLSv1.2,2132,Application Data
1,4.808664000000135,10.0.2.15,54.93.77.70,TCP,54,34692  >  9001 [ACK] Seq=12930845 Ack=234972449 Win=65535 Len=0
1,4.808847000000242,10.0.2.15,54.93.77.70,TLSv1.2,590,Application Data
1,4.808955000000424,54.93.77.70,10.0.2.15,TCP,60,9001  >  34692 [ACK] Seq=234972449 Ack=12931381 Win=65535 Len=0
1,4.81884700000046,54.93.77.70,10.0.2.15,TLSv1.2,7294,Application Data
1,4.818919000000278,10.0.2.15,54.93.77.70,TCP,54,34692  >  9001 [ACK] Seq=12931381 Ack=234979689 Win=65535 Len=0
1,4.824902999999722,54.93.77.70,10.0.2.15,TLSv1.2,568,Application Data
1,4.836236000000099,54.93.77.70,10.0.2.15,TCP,2950,"9001  >  34692 [PSH, ACK] Seq=234980203 Ack=12931381 Win=65535 Len=2896 [TCP segment of a reassembled PDU]"
1,4.836291999999958,10.0.2.15,54.93.77.70,TCP,54,34692  >  9001 [ACK] Seq=12931381 Ack=234983099 Win=65535 Len=0
1,4.838090000000193,54.93.77.70,10.0.2.15,TLSv1.2,7294,"Application Data, Application Data"
1,4.838160000000244,10.0.2.15,54.93.77.70,TCP,54,34692  >  9001 [ACK] Seq=12931381 Ack=234990339 Win=65535 Len=0
1,4.838337000000138,10.0.2.15,54.93.77.70,TLSv1.2,590,Application Data
1,4.838464999999815,54.93.77.70,10.0.2.15,TCP,60,9001  >  34692 [ACK] Seq=234990339 Ack=12931917 Win=65535 Len=0
1,4.852525000000242,54.93.77.70,10.0.2.15,TLSv1.2,264,Application Data
1,4.8674989999999525,54.93.77.70,10.0.2.15,TLSv1.2,7294,Application Data
1,4.867551999999705,10.0.2.15,54.93.77.70,TCP,54,34692  >  9001 [ACK] Seq=12931917 Ack=234997789 Win=65535 Len=0
1,4.883520999999746,54.93.77.70,10.0.2.15,TLSv1.2,568,Application Data
1,4.889159000000291,54.93.77.70,10.0.2.15,TCP,2950,"9001  >  34692 [PSH, ACK] Seq=234998303 Ack=12931917 Win=65535 Len=2896 [TCP segment of a reassembled PDU]"
1,4.889204000000063,10.0.2.15,54.93.77.70,TCP,54,34692  >  9001 [ACK] Seq=12931917 Ack=235001199 Win=65535 Len=0
1,4.896794999999656,54.93.77.70,10.0.2.15,TLSv1.2,1502,Application Data [TCP segment of a reassembled PDU]
1,4.896839,10.0.2.15,54.93.77.70,TCP,54,34692  >  9001 [ACK] Seq=12931917 Ack=235002647 Win=65535 Len=0
1,4.899073999999928,62.210.85.178,10.0.2.15,TLSv1.2,590,Application Data
1,4.905217000000448,54.93.77.70,10.0.2.15,TLSv1.2,380,Application Data
1,4.90720599999986,54.93.77.70,10.0.2.15,TCP,2950,"9001  >  34692 [PSH, ACK] Seq=235002973 Ack=12931917 Win=65535 Len=2896 [TCP segment of a reassembled PDU]"
1,4.907275000000482,10.0.2.15,54.93.77.70,TCP,54,34692  >  9001 [ACK] Seq=12931917 Ack=235005869 Win=65535 Len=0
1,4.9157530000002225,54.93.77.70,10.0.2.15,TLSv1.2,2950,Application Data [TCP segment of a reassembled PDU]
1,4.915796999999657,10.0.2.15,54.93.77.70,TCP,54,34692  >  9001 [ACK] Seq=12931917 Ack=235008765 Win=65535 Len=0
1,4.9166009999999005,54.93.77.70,10.0.2.15,TCP,1502,"9001  >  34692 [PSH, ACK] Seq=235008765 Ack=12931917 Win=65535 Len=1448 [TCP segment of a reassembled PDU]"
1,4.916643999999906,10.0.2.15,54.93.77.70,TCP,54,34692  >  9001 [ACK] Seq=12931917 Ack=235010213 Win=65535 Len=0
1,4.9220869999999195,54.93.77.70,10.0.2.15,TLSv1.2,590,"Application Data, Application Data"
1,4.922263999999814,10.0.2.15,54.93.77.70,TLSv1.2,590,Application Data
1,4.922371999999996,54.93.77.70,10.0.2.15,TCP,60,9001  >  34692 [ACK] Seq=235010749 Ack=12932453 Win=65535 Len=0
1,4.9424840000001495,10.0.2.15,62.210.85.178,TCP,54,35978  >  9001 [ACK] Seq=235105005 Ack=12845889 Win=65535 Len=0
1,4.961651999999958,62.210.85.178,10.0.2.15,TLSv1.2,590,Application Data
1,4.9617269999998825,10.0.2.15,62.210.85.178,TCP,54,35978  >  9001 [ACK] Seq=235105005 Ack=12846425 Win=65535 Len=0
1,4.96506700000009,54.93.77.70,10.0.2.15,TLSv1.2,1618,Application Data
1,4.965114999999969,10.0.2.15,54.93.77.70,TCP,54,34692  >  9001 [ACK] Seq=12932453 Ack=235012313 Win=65535 Len=0
1,4.968579000000318,10.0.2.15,54.93.77.70,TLSv1.2,590,Application Data
1,4.968770999999833,54.93.77.70,10.0.2.15,TCP,60,9001  >  34692 [ACK] Seq=235012313 Ack=12932989 Win=65535 Len=0
1,5.088772000000063,62.210.85.178,10.0.2.15,TLSv1.2,590,Application Data
1,5.088858000000073,10.0.2.15,62.210.85.178,TCP,54,35978  >  9001 [ACK] Seq=235105005 Ack=12846961 Win=65535 Len=0
1,5.456608999999844,62.210.85.178,10.0.2.15,TLSv1.2,590,Application Data
1,5.456694000000425,10.0.2.15,62.210.85.178,TCP,54,35978  >  9001 [ACK] Seq=235105005 Ack=12847497 Win=65535 Len=0
1,5.4572470000002795,10.0.2.15,62.210.85.178,TLSv1.2,590,Application Data
1,5.457379000000401,62.210.85.178,10.0.2.15,TCP,60,9001  >  35978 [ACK] Seq=12847497 Ack=235105541 Win=65535 Len=0
1,5.561459000000468,54.93.77.70,10.0.2.15,TLSv1.2,590,Application Data
1,5.561854999999923,10.0.2.15,54.93.77.70,TLSv1.2,590,Application Data
1,5.5619699999997465,54.93.77.70,10.0.2.15,TCP,60,9001  >  34692 [ACK] Seq=235012849 Ack=12933525 Win=65535 Len=0
1,5.7644069999996645,62.210.85.178,10.0.2.15,TLSv1.2,590,Application Data
1,5.767469000000347,10.0.2.15,62.210.85.178,TLSv1.2,590,Application Data
1,5.767644999999902,62.210.85.178,10.0.2.15,TCP,60,9001  >  35978 [ACK] Seq=12848033 Ack=235106077 Win=65535 Len=0
1,5.779363999999987,10.0.2.15,62.210.85.178,TLSv1.2,4124,Application Data
1,5.779500999999982,62.210.85.178,10.0.2.15,TCP,60,9001  >  35978 [ACK] Seq=12848033 Ack=235107537 Win=65535 Len=0
1,5.77951800000028,62.210.85.178,10.0.2.15,TCP,60,9001  >  35978 [ACK] Seq=12848033 Ack=235108997 Win=65535 Len=0
1,5.779521999999815,62.210.85.178,10.0.2.15,TCP,60,9001  >  35978 [ACK] Seq=12848033 Ack=235110147 Win=65535 Len=0
1,5.7795539999997345,10.0.2.15,62.210.85.178,TLSv1.2,140,Application Data
1,5.779588000000331,62.210.85.178,10.0.2.15,TCP,60,9001  >  35978 [ACK] Seq=12848033 Ack=235110233 Win=65535 Len=0
1,5.9688560000004145,54.93.77.70,10.0.2.15,TLSv1.2,590,Application Data
1,6.010435000000143,10.0.2.15,54.93.77.70,TCP,54,34692  >  9001 [ACK] Seq=12933525 Ack=235013385 Win=65535 Len=0
1,6.383711000000403,54.93.77.70,10.0.2.15,TCP,2950,"9001  >  34692 [PSH, ACK] Seq=235013385 Ack=12933525 Win=65535 Len=2896 [TCP segment of a reassembled PDU]"
1,6.38379999999961,10.0.2.15,54.93.77.70,TCP,54,34692  >  9001 [ACK] Seq=12933525 Ack=235016281 Win=65535 Len=0
1,6.385478999999577,54.93.77.70,10.0.2.15,TLSv1.2,778,Application Data
1,6.385530999999901,10.0.2.15,54.93.77.70,TCP,54,34692  >  9001 [ACK] Seq=12933525 Ack=235017005 Win=65535 Len=0
1,6.38645600000018,10.0.2.15,54.93.77.70,TLSv1.2,590,Application Data
1,6.386588000000302,54.93.77.70,10.0.2.15,TCP,60,9001  >  34692 [ACK] Seq=235017005 Ack=12934061 Win=65535 Len=0
1,6.3961419999996,10.0.2.15,54.93.77.70,TLSv1.2,590,Application Data
1,6.396334000000024,54.93.77.70,10.0.2.15,TCP,60,9001  >  34692 [ACK] Seq=235017005 Ack=12934597 Win=65535 Len=0
1,6.401872999999796,54.93.77.70,10.0.2.15,TLSv1.2,590,Application Data
1,6.442476999999599,10.0.2.15,54.93.77.70,TCP,54,34692  >  9001 [ACK] Seq=12934597 Ack=235017541 Win=65535 Len=0
1,6.494265000000269,62.210.85.178,10.0.2.15,TLSv1.2,590,Application Data
1,6.534467000000404,10.0.2.15,62.210.85.178,TCP,54,35978  >  9001 [ACK] Seq=235110233 Ack=12848569 Win=65535 Len=0
1,6.992355999999745,62.210.85.178,10.0.2.15,TLSv1.2,590,Application Data
1,6.992428999999902,10.0.2.15,62.210.85.178,TCP,54,35978  >  9001 [ACK] Seq=235110233 Ack=12849105 Win=65535 Len=0
1,6.992927999999665,10.0.2.15,62.210.85.178,TLSv1.2,590,Application Data
1,6.9930279999998675,62.210.85.178,10.0.2.15,TCP,60,9001  >  35978 [ACK] Seq=12849105 Ack=235110769 Win=65535 Len=0
1,7.19696600000043,54.93.77.70,10.0.2.15,TLSv1.2,590,Application Data
1,7.19704400000046,10.0.2.15,54.93.77.70,TCP,54,34692  >  9001 [ACK] Seq=12934597 Ack=235018077 Win=65535 Len=0
1,7.197393000000375,10.0.2.15,54.93.77.70,TLSv1.2,590,Application Data
1,7.197490000000471,54.93.77.70,10.0.2.15,TCP,60,9001  >  34692 [ACK] Seq=235018077 Ack=12935133 Win=65535 Len=0
1,7.606883999999809,62.210.85.178,10.0.2.15,TLSv1.2,590,Application Data
1,7.612546999999722,10.0.2.15,62.210.85.178,TLSv1.2,590,Application Data
1,7.613674999999603,62.210.85.178,10.0.2.15,TCP,60,9001  >  35978 [ACK] Seq=12849641 Ack=235111305 Win=65535 Len=0
1,7.62289200000032,10.0.2.15,62.210.85.178,TLSv1.2,4124,Application Data
1,7.622989000000416,10.0.2.15,62.210.85.178,TCP,2974,35978  >  9001 [ACK] Seq=235115375 Ack=12849641 Win=65535 Len=2920 [TCP segment of a reassembled PDU]
1,7.6230640000003405,62.210.85.178,10.0.2.15,TCP,60,9001  >  35978 [ACK] Seq=12849641 Ack=235112765 Win=65535 Len=0
1,7.623075999999855,62.210.85.178,10.0.2.15,TCP,60,9001  >  35978 [ACK] Seq=12849641 Ack=235114225 Win=65535 Len=0
1,7.6230789999999615,62.210.85.178,10.0.2.15,TCP,60,9001  >  35978 [ACK] Seq=12849641 Ack=235115375 Win=65535 Len=0
1,7.623082000000068,62.210.85.178,10.0.2.15,TCP,60,9001  >  35978 [ACK] Seq=12849641 Ack=235116835 Win=65535 Len=0
1,7.623085000000174,62.210.85.178,10.0.2.15,TCP,60,9001  >  35978 [ACK] Seq=12849641 Ack=235118295 Win=65535 Len=0
1,7.623123000000305,10.0.2.15,62.210.85.178,TLSv1.2,1204,Application Data
1,7.623171999999613,62.210.85.178,10.0.2.15,TCP,60,9001  >  35978 [ACK] Seq=12849641 Ack=235119445 Win=65535 Len=0
1,7.623230000000149,10.0.2.15,62.210.85.178,TLSv1.2,4124,Application Data
1,7.623273000000154,62.210.85.178,10.0.2.15,TCP,60,9001  >  35978 [ACK] Seq=12849641 Ack=235120905 Win=65535 Len=0
1,7.623281000000134,62.210.85.178,10.0.2.15,TCP,60,9001  >  35978 [ACK] Seq=12849641 Ack=235122365 Win=65535 Len=0
1,7.623286000000007,62.210.85.178,10.0.2.15,TCP,60,9001  >  35978 [ACK] Seq=12849641 Ack=235123515 Win=65535 Len=0
1,7.623325999999906,10.0.2.15,62.210.85.178,TLSv1.2,4124,Application Data
1,7.623364000000038,62.210.85.178,10.0.2.15,TCP,60,9001  >  35978 [ACK] Seq=12849641 Ack=235124975 Win=65535 Len=0
1,7.623372000000018,62.210.85.178,10.0.2.15,TCP,60,9001  >  35978 [ACK] Seq=12849641 Ack=235126435 Win=65535 Len=0
1,7.623435000000427,10.0.2.15,62.210.85.178,TLSv1.2,2974,Application Data
1,7.623475999999755,62.210.85.178,10.0.2.15,TCP,60,9001  >  35978 [ACK] Seq=12849641 Ack=235127585 Win=65535 Len=0
1,7.623483999999735,62.210.85.178,10.0.2.15,TCP,60,9001  >  35978 [ACK] Seq=12849641 Ack=235129045 Win=65535 Len=0
1,7.623486999999841,62.210.85.178,10.0.2.15,TCP,60,9001  >  35978 [ACK] Seq=12849641 Ack=235130505 Win=65535 Len=0
1,7.623515000000225,10.0.2.15,62.210.85.178,TLSv1.2,1226,Application Data
1,7.623550999999679,62.210.85.178,10.0.2.15,TCP,60,9001  >  35978 [ACK] Seq=12849641 Ack=235131677 Win=65535 Len=0
1,7.6235939999996845,10.0.2.15,62.210.85.178,TLSv1.2,4124,Application Data
1,7.623633000000154,62.210.85.178,10.0.2.15,TCP,60,9001  >  35978 [ACK] Seq=12849641 Ack=235133137 Win=65535 Len=0
1,7.623641000000134,62.210.85.178,10.0.2.15,TCP,60,9001  >  35978 [ACK] Seq=12849641 Ack=235134597 Win=65535 Len=0
1,7.623644999999669,62.210.85.178,10.0.2.15,TCP,60,9001  >  35978 [ACK] Seq=12849641 Ack=235135747 Win=65535 Len=0
1,7.623682000000372,10.0.2.15,62.210.85.178,TLSv1.2,3030,Application Data
1,7.623720999999932,62.210.85.178,10.0.2.15,TCP,60,9001  >  35978 [ACK] Seq=12849641 Ack=235137207 Win=65535 Len=0
1,7.623728999999912,62.210.85.178,10.0.2.15,TCP,60,9001  >  35978 [ACK] Seq=12849641 Ack=235138667 Win=65535 Len=0
1,7.623732000000018,62.210.85.178,10.0.2.15,TCP,60,9001  >  35978 [ACK] Seq=12849641 Ack=235138723 Win=65535 Len=0
1,7.635153999999602,10.0.2.15,62.210.85.178,TLSv1.2,4124,Application Data
1,7.635253999999804,62.210.85.178,10.0.2.15,TCP,60,9001  >  35978 [ACK] Seq=12849641 Ack=235140183 Win=65535 Len=0
1,7.635266999999658,62.210.85.178,10.0.2.15,TCP,60,9001  >  35978 [ACK] Seq=12849641 Ack=235141643 Win=65535 Len=0
1,7.6352710000001025,62.210.85.178,10.0.2.15,TCP,60,9001  >  35978 [ACK] Seq=12849641 Ack=235142793 Win=65535 Len=0
1,7.635314000000108,10.0.2.15,62.210.85.178,TLSv1.2,4124,Application Data
1,7.635379999999714,62.210.85.178,10.0.2.15,TCP,60,9001  >  35978 [ACK] Seq=12849641 Ack=235144253 Win=65535 Len=0
1,7.635387000000264,62.210.85.178,10.0.2.15,TCP,60,9001  >  35978 [ACK] Seq=12849641 Ack=235145713 Win=65535 Len=0
1,7.6353900000003705,62.210.85.178,10.0.2.15,TCP,60,9001  >  35978 [ACK] Seq=12849641 Ack=235146863 Win=65535 Len=0
1,7.635425999999825,10.0.2.15,62.210.85.178,TLSv1.2,4124,Application Data
1,7.635462999999618,62.210.85.178,10.0.2.15,TCP,60,9001  >  35978 [ACK] Seq=12849641 Ack=235148323 Win=65535 Len=0
1,7.6354709999995976,62.210.85.178,10.0.2.15,TCP,60,9001  >  35978 [ACK] Seq=12849641 Ack=235149783 Win=65535 Len=0
1,7.635476000000381,62.210.85.178,10.0.2.15,TCP,60,9001  >  35978 [ACK] Seq=12849641 Ack=235150933 Win=65535 Len=0
1,7.635513000000174,10.0.2.15,62.210.85.178,TLSv1.2,4124,Application Data
1,7.6355499999999665,62.210.85.178,10.0.2.15,TCP,60,9001  >  35978 [ACK] Seq=12849641 Ack=235152393 Win=65535 Len=0
1,7.635559000000285,62.210.85.178,10.0.2.15,TCP,60,9001  >  35978 [ACK] Seq=12849641 Ack=235153853 Win=65535 Len=0
1,7.635564000000159,62.210.85.178,10.0.2.15,TCP,60,9001  >  35978 [ACK] Seq=12849641 Ack=235155003 Win=65535 Len=0
1,7.635599000000184,10.0.2.15,62.210.85.178,TLSv1.2,332,Application Data
1,7.635635999999977,62.210.85.178,10.0.2.15,TCP,60,9001  >  35978 [ACK] Seq=12849641 Ack=235155281 Win=65535 Len=0
1,7.635690000000068,10.0.2.15,62.210.85.178,TLSv1.2,3868,Application Data
1,7.635729999999967,62.210.85.178,10.0.2.15,TCP,60,9001  >  35978 [ACK] Seq=12849641 Ack=235156741 Win=65535 Len=0
1,7.635739000000285,62.210.85.178,10.0.2.15,TCP,60,9001  >  35978 [ACK] Seq=12849641 Ack=235158201 Win=65535 Len=0
1,7.635742000000391,62.210.85.178,10.0.2.15,TCP,60,9001  >  35978 [ACK] Seq=12849641 Ack=235159095 Win=65535 Len=0
1,7.635779999999613,10.0.2.15,62.210.85.178,TLSv1.2,4124,Application Data
1,7.635817999999745,62.210.85.178,10.0.2.15,TCP,60,9001  >  35978 [ACK] Seq=12849641 Ack=235160555 Win=65535 Len=0
1,7.635827000000063,62.210.85.178,10.0.2.15,TCP,60,9001  >  35978 [ACK] Seq=12849641 Ack=235162015 Win=65535 Len=0
1,7.635831999999937,62.210.85.178,10.0.2.15,TCP,60,9001  >  35978 [ACK] Seq=12849641 Ack=235163165 Win=65535 Len=0
1,7.6358680000003005,10.0.2.15,62.210.85.178,TLSv1.2,3030,Application Data
1,7.635905000000093,62.210.85.178,10.0.2.15,TCP,60,9001  >  35978 [ACK] Seq=12849641 Ack=235164625 Win=65535 Len=0
1,7.635914000000412,62.210.85.178,10.0.2.15,TCP,60,9001  >  35978 [ACK] Seq=12849641 Ack=235166085 Win=65535 Len=0
1,7.635917999999947,62.210.85.178,10.0.2.15,TCP,60,9001  >  35978 [ACK] Seq=12849641 Ack=235166141 Win=65535 Len=0
1,7.64736400000038,10.0.2.15,62.210.85.178,TLSv1.2,4124,Application Data
1,7.647482999999738,62.210.85.178,10.0.2.15,TCP,60,9001  >  35978 [ACK] Seq=12849641 Ack=235167601 Win=65535 Len=0
1,7.647498999999698,62.210.85.178,10.0.2.15,TCP,60,9001  >  35978 [ACK] Seq=12849641 Ack=235169061 Win=65535 Len=0
1,7.647501999999804,62.210.85.178,10.0.2.15,TCP,60,9001  >  35978 [ACK] Seq=12849641 Ack=235170211 Win=65535 Len=0
1,7.647549999999683,10.0.2.15,62.210.85.178,TLSv1.2,4124,Application Data
1,7.647592000000259,62.210.85.178,10.0.2.15,TCP,60,9001  >  35978 [ACK] Seq=12849641 Ack=235171671 Win=65535 Len=0
1,7.647600999999668,62.210.85.178,10.0.2.15,TCP,60,9001  >  35978 [ACK] Seq=12849641 Ack=235173131 Win=65535 Len=0
1,7.647605000000112,62.210.85.178,10.0.2.15,TCP,60,9001  >  35978 [ACK] Seq=12849641 Ack=235174281 Win=65535 Len=0
1,7.647641999999905,10.0.2.15,62.210.85.178,TLSv1.2,204,Application Data
1,7.647680000000037,62.210.85.178,10.0.2.15,TCP,60,9001  >  35978 [ACK] Seq=12849641 Ack=235174431 Win=65535 Len=0
1,7.712370000000192,54.93.77.70,10.0.2.15,TCP,2950,"9001  >  34692 [PSH, ACK] Seq=235018077 Ack=12935133 Win=65535 Len=2896 [TCP segment of a reassembled PDU]"
1,7.712408000000323,54.93.77.70,10.0.2.15,TLSv1.2,778,Application Data
1,7.712505000000419,10.0.2.15,54.93.77.70,TCP,54,34692  >  9001 [ACK] Seq=12935133 Ack=235021697 Win=65535 Len=0
1,7.781442999999854,54.93.77.70,10.0.2.15,TLSv1.2,590,Application Data
1,7.789445999999771,54.93.77.70,10.0.2.15,TCP,2950,"9001  >  34692 [PSH, ACK] Seq=235022233 Ack=12935133 Win=65535 Len=2896 [TCP segment of a reassembled PDU]"
1,7.789496000000327,10.0.2.15,54.93.77.70,TCP,54,34692  >  9001 [ACK] Seq=12935133 Ack=235025129 Win=65535 Len=0
1,7.7976449999996476,54.93.77.70,10.0.2.15,TLSv1.2,778,Application Data
1,7.797790999999961,10.0.2.15,54.93.77.70,TLSv1.2,590,Application Data
1,7.797873000000436,54.93.77.70,10.0.2.15,TCP,60,9001  >  34692 [ACK] Seq=235025853 Ack=12935669 Win=65535 Len=0
1,7.799673999999868,54.93.77.70,10.0.2.15,TCP,2950,"9001  >  34692 [PSH, ACK] Seq=235025853 Ack=12935669 Win=65535 Len=2896 [TCP segment of a reassembled PDU]"
1,7.799735999999939,10.0.2.15,54.93.77.70,TCP,54,34692  >  9001 [ACK] Seq=12935669 Ack=235028749 Win=65535 Len=0
1,7.812544999999773,54.93.77.70,10.0.2.15,TLSv1.2,4398,Application Data [TCP segment of a reassembled PDU]
1,7.812584999999672,10.0.2.15,54.93.77.70,TCP,54,34692  >  9001 [ACK] Seq=12935669 Ack=235033093 Win=65535 Len=0
1,7.8136530000001585,54.93.77.70,10.0.2.15,TLSv1.2,590,"Application Data, Application Data"
1,7.820216000000073,54.93.77.70,10.0.2.15,TCP,2950,"9001  >  34692 [PSH, ACK] Seq=235033629 Ack=12935669 Win=65535 Len=2896 [TCP segment of a reassembled PDU]"
1,7.820257000000311,10.0.2.15,54.93.77.70,TCP,54,34692  >  9001 [ACK] Seq=12935669 Ack=235036525 Win=65535 Len=0
1,7.822138999999879,54.93.77.70,10.0.2.15,TLSv1.2,4398,Application Data [TCP segment of a reassembled PDU]
1,7.822181000000455,10.0.2.15,54.93.77.70,TCP,54,34692  >  9001 [ACK] Seq=12935669 Ack=235040869 Win=65535 Len=0
1,7.830872000000454,54.93.77.70,10.0.2.15,TLSv1.2,2950,Application Data [TCP segment of a reassembled PDU]
1,7.830925000000207,10.0.2.15,54.93.77.70,TCP,54,34692  >  9001 [ACK] Seq=12935669 Ack=235043765 Win=65535 Len=0
1,7.832795999999689,54.93.77.70,10.0.2.15,TCP,1502,"9001  >  34692 [PSH, ACK] Seq=235043765 Ack=12935669 Win=65535 Len=1448 [TCP segment of a reassembled PDU]"
1,7.8328440000004775,10.0.2.15,54.93.77.70,TCP,54,34692  >  9001 [ACK] Seq=12935669 Ack=235045213 Win=65535 Len=0
1,7.837604000000283,54.93.77.70,10.0.2.15,TLSv1.2,380,"Application Data, Application Data"
1,7.837763999999879,10.0.2.15,54.93.77.70,TLSv1.2,590,Application Data
1,7.837840000000142,54.93.77.70,10.0.2.15,TCP,60,9001  >  34692 [ACK] Seq=235045539 Ack=12936205 Win=65535 Len=0
1,7.841403999999784,54.93.77.70,10.0.2.15,TLSv1.2,5846,Application Data
1,7.841467000000193,10.0.2.15,54.93.77.70,TCP,54,34692  >  9001 [ACK] Seq=12936205 Ack=235051331 Win=65535 Len=0
1,7.855168000000049,54.93.77.70,10.0.2.15,TLSv1.2,474,Application Data
1,7.867221999999856,54.93.77.70,10.0.2.15,TLSv1.2,7294,Application Data
1,7.867293000000245,10.0.2.15,54.93.77.70,TCP,54,34692  >  9001 [ACK] Seq=12936205 Ack=235058991 Win=65535 Len=0
1,7.87021999999979,54.93.77.70,10.0.2.15,TLSv1.2,4398,Application Data [TCP segment of a reassembled PDU]
1,7.870264000000134,10.0.2.15,54.93.77.70,TCP,54,34692  >  9001 [ACK] Seq=12936205 Ack=235063335 Win=65535 Len=0
1,7.884466999999859,54.93.77.70,10.0.2.15,TLSv1.2,380,"Application Data, Application Data"
1,7.892439000000195,54.93.77.70,10.0.2.15,TCP,2950,"9001  >  34692 [PSH, ACK] Seq=235063661 Ack=12936205 Win=65535 Len=2896 [TCP segment of a reassembled PDU]"
1,7.8924820000002,10.0.2.15,54.93.77.70,TCP,54,34692  >  9001 [ACK] Seq=12936205 Ack=235066557 Win=65535 Len=0
1,7.902554999999666,54.93.77.70,10.0.2.15,TLSv1.2,7294,"Application Data, Application Data"
1,7.902616000000307,10.0.2.15,54.93.77.70,TCP,54,34692  >  9001 [ACK] Seq=12936205 Ack=235073797 Win=65535 Len=0
1,7.902828000000227,10.0.2.15,54.93.77.70,TLSv1.2,590,Application Data
1,7.902900000000045,54.93.77.70,10.0.2.15,TCP,60,9001  >  34692 [ACK] Seq=235073797 Ack=12936741 Win=65535 Len=0
1,7.9097499999998035,54.93.77.70,10.0.2.15,TLSv1.2,1292,Application Data
1,7.912183000000368,54.93.77.70,10.0.2.15,TCP,1502,"9001  >  34692 [PSH, ACK] Seq=235075035 Ack=12936741 Win=65535 Len=1448 [TCP segment of a reassembled PDU]"
1,7.912225000000035,10.0.2.15,54.93.77.70,TCP,54,34692  >  9001 [ACK] Seq=12936741 Ack=235076483 Win=65535 Len=0
1,7.924966999999924,54.93.77.70,10.0.2.15,TLSv1.2,2950,Application Data [TCP segment of a reassembled PDU]
1,7.925028999999995,10.0.2.15,54.93.77.70,TCP,54,34692  >  9001 [ACK] Seq=12936741 Ack=235079379 Win=65535 Len=0
1,7.925145999999586,10.0.2.15,54.93.77.70,TLSv1.2,590,Application Data
1,7.9252150000002075,54.93.77.70,10.0.2.15,TCP,60,9001  >  34692 [ACK] Seq=235079379 Ack=12937277 Win=65535 Len=0
1,7.928200999999717,54.93.77.70,10.0.2.15,TLSv1.2,894,Application Data
1,7.934516999999687,54.93.77.70,10.0.2.15,TCP,1502,"9001  >  34692 [PSH, ACK] Seq=235080219 Ack=12937277 Win=65535 Len=1448 [TCP segment of a reassembled PDU]"
1,7.934565999999904,10.0.2.15,54.93.77.70,TCP,54,34692  >  9001 [ACK] Seq=12937277 Ack=235081667 Win=65535 Len=0
1,7.9510980000004565,54.93.77.70,10.0.2.15,TLSv1.2,170,Application Data
