No.,Time,Source,Destination,Protocol,Length,Info
1,0.022017999999661697,10.0.2.15,54.93.77.70,TCP,54,34692  >  9001 [ACK] Seq=13420839 Ack=243477893 Win=65535 Len=0
1,0.179852999999639,10.0.2.15,54.93.77.70,TLSv1.2,590,Application Data
1,0.18002499999965949,54.93.77.70,10.0.2.15,TCP,60,9001  >  34692 [ACK] Seq=243477893 Ack=13421375 Win=65535 Len=0
1,0.5814159999999902,62.210.85.178,10.0.2.15,TLSv1.2,590,Application Data
1,0.5817530000003899,10.0.2.15,62.210.85.178,TLSv1.2,590,Application Data
1,0.5818490000001475,62.210.85.178,10.0.2.15,TCP,60,9001  >  35978 [ACK] Seq=13333793 Ack=243567447 Win=65535 Len=0
1,0.7861229999998613,54.93.77.70,10.0.2.15,TLSv1.2,590,Application Data
1,0.7861960000000181,10.0.2.15,54.93.77.70,TCP,54,34692  >  9001 [ACK] Seq=13421375 Ack=243478429 Win=65535 Len=0
1,0.7865709999996398,10.0.2.15,54.93.77.70,TLSv1.2,1618,Application Data
1,0.7866780000003928,54.93.77.70,10.0.2.15,TCP,60,9001  >  34692 [ACK] Seq=243478429 Ack=13422835 Win=65535 Len=0
1,0.7866910000002463,54.93.77.70,10.0.2.15,TCP,60,9001  >  34692 [ACK] Seq=243478429 Ack=13422939 Win=65535 Len=0
1,0.9920039999997243,62.210.85.178,10.0.2.15,TLSv1.2,1618,Application Data
1,0.9921439999998256,10.0.2.15,62.210.85.178,TCP,54,35978  >  9001 [ACK] Seq=243567447 Ack=13335357 Win=65535 Len=0
1,1.0066710000000967,10.0.2.15,62.210.85.178,TLSv1.2,590,Application Data
1,1.0068620000001829,62.210.85.178,10.0.2.15,TCP,60,9001  >  35978 [ACK] Seq=13335357 Ack=243567983 Win=65535 Len=0
1,1.0195679999997083,10.0.2.15,62.210.85.178,TLSv1.2,1618,Application Data
1,1.019745999999941,62.210.85.178,10.0.2.15,TCP,60,9001  >  35978 [ACK] Seq=13335357 Ack=243569443 Win=65535 Len=0
1,1.019771000000219,62.210.85.178,10.0.2.15,TCP,60,9001  >  35978 [ACK] Seq=13335357 Ack=243569547 Win=65535 Len=0
1,1.1249909999996817,54.93.77.70,10.0.2.15,TLSv1.2,590,Application Data
1,1.1543609999998807,54.93.77.70,10.0.2.15,TCP,1502,"9001  >  34692 [PSH, ACK] Seq=243478965 Ack=13422939 Win=65535 Len=1448 [TCP segment of a reassembled PDU]"
1,1.1545200000000477,10.0.2.15,54.93.77.70,TCP,54,34692  >  9001 [ACK] Seq=13422939 Ack=243480413 Win=65535 Len=0
1,1.170578999999634,54.93.77.70,10.0.2.15,TLSv1.2,170,Application Data
1,1.1732220000003508,10.0.2.15,54.93.77.70,TLSv1.2,590,Application Data
1,1.1734159999996336,54.93.77.70,10.0.2.15,TCP,60,9001  >  34692 [ACK] Seq=243480529 Ack=13423475 Win=65535 Len=0
1,1.5023479999999836,62.210.85.178,10.0.2.15,TLSv1.2,590,Application Data
1,1.5027030000001105,10.0.2.15,62.210.85.178,TLSv1.2,590,Application Data
1,1.502835999999661,62.210.85.178,10.0.2.15,TCP,60,9001  >  35978 [ACK] Seq=13335893 Ack=243570083 Win=65535 Len=0
1,1.613419000000249,54.93.77.70,10.0.2.15,TLSv1.2,590,Application Data
1,1.613865999999689,10.0.2.15,54.93.77.70,TLSv1.2,590,Application Data
1,1.61401399999977,54.93.77.70,10.0.2.15,TCP,60,9001  >  34692 [ACK] Seq=243481065 Ack=13424011 Win=65535 Len=0
1,1.7166390000002139,62.210.85.178,10.0.2.15,TLSv1.2,590,Application Data
1,1.7266719999997804,10.0.2.15,62.210.85.178,TLSv1.2,590,Application Data
1,1.7268569999996544,62.210.85.178,10.0.2.15,TCP,60,9001  >  35978 [ACK] Seq=13336429 Ack=243570619 Win=65535 Len=0
1,1.7388240000000224,10.0.2.15,62.210.85.178,TLSv1.2,4124,Application Data
1,1.7389610000000175,10.0.2.15,62.210.85.178,TCP,2974,35978  >  9001 [ACK] Seq=243574689 Ack=13336429 Win=65535 Len=2920 [TCP segment of a reassembled PDU]
1,1.7390189999996437,62.210.85.178,10.0.2.15,TCP,60,9001  >  35978 [ACK] Seq=13336429 Ack=243572079 Win=65535 Len=0
1,1.7390299999997296,62.210.85.178,10.0.2.15,TCP,60,9001  >  35978 [ACK] Seq=13336429 Ack=243573539 Win=65535 Len=0
1,1.7390349999996033,62.210.85.178,10.0.2.15,TCP,60,9001  >  35978 [ACK] Seq=13336429 Ack=243574689 Win=65535 Len=0
1,1.739039000000048,62.210.85.178,10.0.2.15,TCP,60,9001  >  35978 [ACK] Seq=13336429 Ack=243576149 Win=65535 Len=0
1,1.7390429999995831,62.210.85.178,10.0.2.15,TCP,60,9001  >  35978 [ACK] Seq=13336429 Ack=243577609 Win=65535 Len=0
1,1.7390880000002653,10.0.2.15,62.210.85.178,TLSv1.2,1204,Application Data
1,1.7391559999996389,10.0.2.15,62.210.85.178,TCP,2974,35978  >  9001 [ACK] Seq=243578759 Ack=13336429 Win=65535 Len=2920 [TCP segment of a reassembled PDU]
1,1.7391930000003413,62.210.85.178,10.0.2.15,TCP,60,9001  >  35978 [ACK] Seq=13336429 Ack=243578759 Win=65535 Len=0
1,1.7391999999999825,62.210.85.178,10.0.2.15,TCP,60,9001  >  35978 [ACK] Seq=13336429 Ack=243580219 Win=65535 Len=0
1,1.7392040000004272,62.210.85.178,10.0.2.15,TCP,60,9001  >  35978 [ACK] Seq=13336429 Ack=243581679 Win=65535 Len=0
1,1.739238000000114,10.0.2.15,62.210.85.178,TLSv1.2,1204,Application Data
1,1.7393050000000585,10.0.2.15,62.210.85.178,TCP,2974,35978  >  9001 [ACK] Seq=243582829 Ack=13336429 Win=65535 Len=2920 [TCP segment of a reassembled PDU]
1,1.73934300000019,62.210.85.178,10.0.2.15,TCP,60,9001  >  35978 [ACK] Seq=13336429 Ack=243582829 Win=65535 Len=0
1,1.7393499999998312,62.210.85.178,10.0.2.15,TCP,60,9001  >  35978 [ACK] Seq=13336429 Ack=243584289 Win=65535 Len=0
1,1.7393540000002758,62.210.85.178,10.0.2.15,TCP,60,9001  >  35978 [ACK] Seq=13336429 Ack=243585749 Win=65535 Len=0
1,1.7393849999998565,10.0.2.15,62.210.85.178,TLSv1.2,1204,Application Data
1,1.739465999999993,10.0.2.15,62.210.85.178,TLSv1.2,2974,Application Data
1,1.739505000000463,62.210.85.178,10.0.2.15,TCP,60,9001  >  35978 [ACK] Seq=13336429 Ack=243586899 Win=65535 Len=0
1,1.7395109999997658,62.210.85.178,10.0.2.15,TCP,60,9001  >  35978 [ACK] Seq=13336429 Ack=243588359 Win=65535 Len=0
1,1.7395159999996395,62.210.85.178,10.0.2.15,TCP,60,9001  >  35978 [ACK] Seq=13336429 Ack=243589819 Win=65535 Len=0
1,1.7395470000001296,10.0.2.15,62.210.85.178,TLSv1.2,1226,Application Data
1,1.739585000000261,62.210.85.178,10.0.2.15,TCP,60,9001  >  35978 [ACK] Seq=13336429 Ack=243590991 Win=65535 Len=0
1,1.7396289999996952,10.0.2.15,62.210.85.178,TLSv1.2,4124,Application Data
1,1.7396689999995942,62.210.85.178,10.0.2.15,TCP,60,9001  >  35978 [ACK] Seq=13336429 Ack=243592451 Win=65535 Len=0
1,1.739676000000145,62.210.85.178,10.0.2.15,TCP,60,9001  >  35978 [ACK] Seq=13336429 Ack=243593911 Win=65535 Len=0
1,1.7396799999996801,62.210.85.178,10.0.2.15,TCP,60,9001  >  35978 [ACK] Seq=13336429 Ack=243595061 Win=65535 Len=0
1,1.7397259999997914,10.0.2.15,62.210.85.178,TLSv1.2,3030,Application Data
1,1.7397659999996904,62.210.85.178,10.0.2.15,TCP,60,9001  >  35978 [ACK] Seq=13336429 Ack=243596521 Win=65535 Len=0
1,1.7397730000002412,62.210.85.178,10.0.2.15,TCP,60,9001  >  35978 [ACK] Seq=13336429 Ack=243597981 Win=65535 Len=0
1,1.7397769999997763,62.210.85.178,10.0.2.15,TCP,60,9001  >  35978 [ACK] Seq=13336429 Ack=243598037 Win=65535 Len=0
1,1.7511739999999918,10.0.2.15,62.210.85.178,TLSv1.2,4124,Application Data
1,1.7512619999997696,10.0.2.15,62.210.85.178,TCP,2974,35978  >  9001 [ACK] Seq=243602107 Ack=13336429 Win=65535 Len=2920 [TCP segment of a reassembled PDU]
1,1.7513040000003457,62.210.85.178,10.0.2.15,TCP,60,9001  >  35978 [ACK] Seq=13336429 Ack=243599497 Win=65535 Len=0
1,1.7513129999997545,62.210.85.178,10.0.2.15,TCP,60,9001  >  35978 [ACK] Seq=13336429 Ack=243600957 Win=65535 Len=0
1,1.7513179999996282,62.210.85.178,10.0.2.15,TCP,60,9001  >  35978 [ACK] Seq=13336429 Ack=243602107 Win=65535 Len=0
1,1.7513220000000729,62.210.85.178,10.0.2.15,TCP,60,9001  >  35978 [ACK] Seq=13336429 Ack=243603567 Win=65535 Len=0
1,1.751325999999608,62.210.85.178,10.0.2.15,TCP,60,9001  >  35978 [ACK] Seq=13336429 Ack=243605027 Win=65535 Len=0
1,1.7513669999998456,10.0.2.15,62.210.85.178,TLSv1.2,1204,Application Data
1,1.751433000000361,10.0.2.15,62.210.85.178,TCP,2974,35978  >  9001 [ACK] Seq=243606177 Ack=13336429 Win=65535 Len=2920 [TCP segment of a reassembled PDU]
1,1.751470999999583,62.210.85.178,10.0.2.15,TCP,60,9001  >  35978 [ACK] Seq=13336429 Ack=243606177 Win=65535 Len=0
1,1.7514780000001338,62.210.85.178,10.0.2.15,TCP,60,9001  >  35978 [ACK] Seq=13336429 Ack=243607637 Win=65535 Len=0
1,1.751481999999669,62.210.85.178,10.0.2.15,TCP,60,9001  >  35978 [ACK] Seq=13336429 Ack=243609097 Win=65535 Len=0
1,1.7515160000002652,10.0.2.15,62.210.85.178,TLSv1.2,1204,Application Data
1,1.751589000000422,62.210.85.178,10.0.2.15,TCP,60,9001  >  35978 [ACK] Seq=13336429 Ack=243610247 Win=65535 Len=0
1,1.7516200000000026,10.0.2.15,62.210.85.178,TCP,2974,35978  >  9001 [ACK] Seq=243610247 Ack=13336429 Win=65535 Len=2920 [TCP segment of a reassembled PDU]
1,1.751669999999649,10.0.2.15,62.210.85.178,TLSv1.2,1204,Application Data
1,1.7517049999996743,62.210.85.178,10.0.2.15,TCP,60,9001  >  35978 [ACK] Seq=13336429 Ack=243611707 Win=65535 Len=0
1,1.7517109999998866,62.210.85.178,10.0.2.15,TCP,60,9001  >  35978 [ACK] Seq=13336429 Ack=243613167 Win=65535 Len=0
1,1.7517159999997602,62.210.85.178,10.0.2.15,TCP,60,9001  >  35978 [ACK] Seq=13336429 Ack=243614317 Win=65535 Len=0
1,1.7517569999999978,10.0.2.15,62.210.85.178,TLSv1.2,332,Application Data
1,1.7517950000001292,62.210.85.178,10.0.2.15,TCP,60,9001  >  35978 [ACK] Seq=13336429 Ack=243614595 Win=65535 Len=0
1,1.7518499999996493,10.0.2.15,62.210.85.178,TLSv1.2,3868,Application Data
1,1.7519240000001446,62.210.85.178,10.0.2.15,TCP,60,9001  >  35978 [ACK] Seq=13336429 Ack=243616055 Win=65535 Len=0
1,1.7519430000002103,62.210.85.178,10.0.2.15,TCP,60,9001  >  35978 [ACK] Seq=13336429 Ack=243617515 Win=65535 Len=0
1,1.751948000000084,62.210.85.178,10.0.2.15,TCP,60,9001  >  35978 [ACK] Seq=13336429 Ack=243618409 Win=65535 Len=0
1,1.7520100000001548,10.0.2.15,62.210.85.178,TLSv1.2,4124,Application Data
1,1.7520610000001398,62.210.85.178,10.0.2.15,TCP,60,9001  >  35978 [ACK] Seq=13336429 Ack=243619869 Win=65535 Len=0
1,1.7520709999998871,62.210.85.178,10.0.2.15,TCP,60,9001  >  35978 [ACK] Seq=13336429 Ack=243621329 Win=65535 Len=0
1,1.7520759999997608,62.210.85.178,10.0.2.15,TCP,60,9001  >  35978 [ACK] Seq=13336429 Ack=243622479 Win=65535 Len=0
1,1.7522170000002006,10.0.2.15,62.210.85.178,TLSv1.2,3030,Application Data
1,1.752266000000418,62.210.85.178,10.0.2.15,TCP,60,9001  >  35978 [ACK] Seq=13336429 Ack=243623939 Win=65535 Len=0
1,1.7522730000000593,62.210.85.178,10.0.2.15,TCP,60,9001  >  35978 [ACK] Seq=13336429 Ack=243625399 Win=65535 Len=0
1,1.752277999999933,62.210.85.178,10.0.2.15,TCP,60,9001  >  35978 [ACK] Seq=13336429 Ack=243625455 Win=65535 Len=0
1,1.7636309999998048,10.0.2.15,62.210.85.178,TLSv1.2,4124,Application Data
1,1.7637249999997948,10.0.2.15,62.210.85.178,TCP,2974,35978  >  9001 [ACK] Seq=243629525 Ack=13336429 Win=65535 Len=2920 [TCP segment of a reassembled PDU]
1,1.7637489999997342,62.210.85.178,10.0.2.15,TCP,60,9001  >  35978 [ACK] Seq=13336429 Ack=243626915 Win=65535 Len=0
1,1.7637610000001587,62.210.85.178,10.0.2.15,TCP,60,9001  >  35978 [ACK] Seq=13336429 Ack=243628375 Win=65535 Len=0
1,1.7637649999996938,62.210.85.178,10.0.2.15,TCP,60,9001  >  35978 [ACK] Seq=13336429 Ack=243629525 Win=65535 Len=0
1,1.7638159999996788,62.210.85.178,10.0.2.15,TCP,60,9001  >  35978 [ACK] Seq=13336429 Ack=243630985 Win=65535 Len=0
1,1.763821999999891,62.210.85.178,10.0.2.15,TCP,60,9001  >  35978 [ACK] Seq=13336429 Ack=243632445 Win=65535 Len=0
1,1.7638580000002548,10.0.2.15,62.210.85.178,TLSv1.2,1204,Application Data
1,1.7638969999998153,62.210.85.178,10.0.2.15,TCP,60,9001  >  35978 [ACK] Seq=13336429 Ack=243633595 Win=65535 Len=0
1,1.7639479999998002,10.0.2.15,62.210.85.178,TLSv1.2,4124,Application Data
1,1.7639879999996992,62.210.85.178,10.0.2.15,TCP,60,9001  >  35978 [ACK] Seq=13336429 Ack=243635055 Win=65535 Len=0
1,1.76399500000025,62.210.85.178,10.0.2.15,TCP,60,9001  >  35978 [ACK] Seq=13336429 Ack=243636515 Win=65535 Len=0
1,1.7640000000001237,62.210.85.178,10.0.2.15,TCP,60,9001  >  35978 [ACK] Seq=13336429 Ack=243637665 Win=65535 Len=0
1,1.764046000000235,10.0.2.15,62.210.85.178,TLSv1.2,4124,Application Data
1,1.7640920000003462,62.210.85.178,10.0.2.15,TCP,60,9001  >  35978 [ACK] Seq=13336429 Ack=243639125 Win=65535 Len=0
1,1.7640989999999874,62.210.85.178,10.0.2.15,TCP,60,9001  >  35978 [ACK] Seq=13336429 Ack=243640585 Win=65535 Len=0
1,1.7641039999998611,62.210.85.178,10.0.2.15,TCP,60,9001  >  35978 [ACK] Seq=13336429 Ack=243641735 Win=65535 Len=0
1,1.7641450000000987,10.0.2.15,62.210.85.178,TLSv1.2,332,Application Data
1,1.7641839999996591,62.210.85.178,10.0.2.15,TCP,60,9001  >  35978 [ACK] Seq=13336429 Ack=243642013 Win=65535 Len=0
1,1.7642390000000887,10.0.2.15,62.210.85.178,TLSv1.2,3868,Application Data
1,1.7642830000004324,62.210.85.178,10.0.2.15,TCP,60,9001  >  35978 [ACK] Seq=13336429 Ack=243643473 Win=65535 Len=0
1,1.7642900000000736,62.210.85.178,10.0.2.15,TCP,60,9001  >  35978 [ACK] Seq=13336429 Ack=243644933 Win=65535 Len=0
1,1.7642939999996088,62.210.85.178,10.0.2.15,TCP,60,9001  >  35978 [ACK] Seq=13336429 Ack=243645827 Win=65535 Len=0
1,1.7643429999998261,10.0.2.15,62.210.85.178,TLSv1.2,1938,Application Data
1,1.7643829999997251,62.210.85.178,10.0.2.15,TCP,60,9001  >  35978 [ACK] Seq=13336429 Ack=243647287 Win=65535 Len=0
1,1.764390000000276,62.210.85.178,10.0.2.15,TCP,60,9001  >  35978 [ACK] Seq=13336429 Ack=243647711 Win=65535 Len=0
1,1.8268299999999726,54.93.77.70,10.0.2.15,TLSv1.2,590,Application Data
1,1.8640299999997296,54.93.77.70,10.0.2.15,TCP,2950,"9001  >  34692 [PSH, ACK] Seq=243481601 Ack=13424011 Win=65535 Len=2896 [TCP segment of a reassembled PDU]"
1,1.8641310000002704,10.0.2.15,54.93.77.70,TCP,54,34692  >  9001 [ACK] Seq=13424011 Ack=243484497 Win=65535 Len=0
1,1.8783620000003793,54.93.77.70,10.0.2.15,TLSv1.2,2950,Application Data [TCP segment of a reassembled PDU]
1,1.878421000000344,10.0.2.15,54.93.77.70,TCP,54,34692  >  9001 [ACK] Seq=13424011 Ack=243487393 Win=65535 Len=0
1,1.879664000000048,54.93.77.70,10.0.2.15,TLSv1.2,1502,Application Data
1,1.8797160000003714,10.0.2.15,54.93.77.70,TCP,54,34692  >  9001 [ACK] Seq=13424011 Ack=243488841 Win=65535 Len=0
1,1.9116629999998622,54.93.77.70,10.0.2.15,TLSv1.2,3674,Application Data
1,1.911764000000403,10.0.2.15,54.93.77.70,TCP,54,34692  >  9001 [ACK] Seq=13424011 Ack=243492461 Win=65535 Len=0
1,1.920564000000013,54.93.77.70,10.0.2.15,TCP,2950,"9001  >  34692 [PSH, ACK] Seq=243492461 Ack=13424011 Win=65535 Len=2896 [TCP segment of a reassembled PDU]"
1,1.9206199999998717,10.0.2.15,54.93.77.70,TCP,54,34692  >  9001 [ACK] Seq=13424011 Ack=243495357 Win=65535 Len=0
1,1.9289730000000418,54.93.77.70,10.0.2.15,TLSv1.2,1314,"Application Data, Application Data"
1,1.9320779999998194,54.93.77.70,10.0.2.15,TCP,2950,"9001  >  34692 [PSH, ACK] Seq=243496617 Ack=13424011 Win=65535 Len=2896 [TCP segment of a reassembled PDU]"
1,1.932369000000108,10.0.2.15,54.93.77.70,TCP,54,34692  >  9001 [ACK] Seq=13424011 Ack=243499513 Win=65535 Len=0
1,1.940585000000283,54.93.77.70,10.0.2.15,TLSv1.2,2950,"Application Data, Application Data"
1,1.9406660000004194,10.0.2.15,54.93.77.70,TCP,54,34692  >  9001 [ACK] Seq=13424011 Ack=243502409 Win=65535 Len=0
1,1.9413430000004155,54.93.77.70,10.0.2.15,TCP,1502,"9001  >  34692 [PSH, ACK] Seq=243502409 Ack=13424011 Win=65535 Len=1448 [TCP segment of a reassembled PDU]"
1,1.9413809999996374,10.0.2.15,54.93.77.70,TCP,54,34692  >  9001 [ACK] Seq=13424011 Ack=243503857 Win=65535 Len=0
1,1.94806299999982,54.93.77.70,10.0.2.15,TLSv1.2,4398,Application Data [TCP segment of a reassembled PDU]
1,1.9481349999996382,10.0.2.15,54.93.77.70,TCP,54,34692  >  9001 [ACK] Seq=13424011 Ack=243508201 Win=65535 Len=0
1,1.9482770000004166,10.0.2.15,54.93.77.70,TLSv1.2,590,Application Data
1,1.9483499999996639,54.93.77.70,10.0.2.15,TCP,60,9001  >  34692 [ACK] Seq=243508201 Ack=13424547 Win=65535 Len=0
1,1.9568550000003597,54.93.77.70,10.0.2.15,TLSv1.2,916,"Application Data, Application Data"
1,1.959248000000116,10.0.2.15,54.93.77.70,TLSv1.2,590,Application Data
1,1.9593590000004042,54.93.77.70,10.0.2.15,TCP,60,9001  >  34692 [ACK] Seq=243509063 Ack=13425083 Win=65535 Len=0
1,1.971781999999621,54.93.77.70,10.0.2.15,TLSv1.2,7294,"Application Data, Application Data"
1,1.971864000000096,10.0.2.15,54.93.77.70,TCP,54,34692  >  9001 [ACK] Seq=13425083 Ack=243516303 Win=65535 Len=0
1,1.9772370000000592,54.93.77.70,10.0.2.15,TLSv1.2,1104,Application Data
1,1.9805939999996554,54.93.77.70,10.0.2.15,TLSv1.2,7294,Application Data
1,1.9806399999997666,10.0.2.15,54.93.77.70,TCP,54,34692  >  9001 [ACK] Seq=13425083 Ack=243524593 Win=65535 Len=0
1,1.9920350000002145,54.93.77.70,10.0.2.15,TLSv1.2,7294,"Application Data, Application Data"
1,1.9920920000004116,10.0.2.15,54.93.77.70,TCP,54,34692  >  9001 [ACK] Seq=13425083 Ack=243531833 Win=65535 Len=0
1,1.9983579999998256,54.93.77.70,10.0.2.15,TLSv1.2,568,Application Data
1,2.0223669999995764,54.93.77.70,10.0.2.15,TCP,2950,"9001  >  34692 [PSH, ACK] Seq=243532347 Ack=13425083 Win=65535 Len=2896 [TCP segment of a reassembled PDU]"
1,2.022436999999627,10.0.2.15,54.93.77.70,TCP,54,34692  >  9001 [ACK] Seq=13425083 Ack=243535243 Win=65535 Len=0
1,2.022490999999718,54.93.77.70,10.0.2.15,TLSv1.2,4398,Application Data [TCP segment of a reassembled PDU]
1,2.0225570000002335,10.0.2.15,54.93.77.70,TCP,54,34692  >  9001 [ACK] Seq=13425083 Ack=243539587 Win=65535 Len=0
1,2.022715000000062,10.0.2.15,54.93.77.70,TLSv1.2,590,Application Data
1,2.0227820000000065,54.93.77.70,10.0.2.15,TCP,60,9001  >  34692 [ACK] Seq=243539587 Ack=13425619 Win=65535 Len=0
1,2.0338650000003327,54.93.77.70,10.0.2.15,TLSv1.2,7294,"Application Data, Application Data"
1,2.03393799999958,10.0.2.15,54.93.77.70,TCP,54,34692  >  9001 [ACK] Seq=13425619 Ack=243546827 Win=65535 Len=0
1,2.038996999999654,54.93.77.70,10.0.2.15,TLSv1.2,1082,Application Data
1,2.045412000000397,54.93.77.70,10.0.2.15,TCP,2950,"9001  >  34692 [PSH, ACK] Seq=243547855 Ack=13425619 Win=65535 Len=2896 [TCP segment of a reassembled PDU]"
1,2.045476000000235,10.0.2.15,54.93.77.70,TCP,54,34692  >  9001 [ACK] Seq=13425619 Ack=243550751 Win=65535 Len=0
1,2.056308999999601,54.93.77.70,10.0.2.15,TLSv1.2,7294,"Application Data, Application Data"
1,2.0563720000000103,10.0.2.15,54.93.77.70,TCP,54,34692  >  9001 [ACK] Seq=13425619 Ack=243557991 Win=65535 Len=0
1,2.056590999999571,10.0.2.15,54.93.77.70,TLSv1.2,590,Application Data
1,2.056692000000112,54.93.77.70,10.0.2.15,TCP,60,9001  >  34692 [ACK] Seq=243557991 Ack=13426155 Win=65535 Len=0
1,2.0632070000001477,54.93.77.70,10.0.2.15,TLSv1.2,778,Application Data
1,2.0660049999996772,10.0.2.15,54.93.77.70,TLSv1.2,590,Application Data
1,2.0661550000004354,54.93.77.70,10.0.2.15,TCP,60,9001  >  34692 [ACK] Seq=243558715 Ack=13426691 Win=65535 Len=0
1,2.0942740000000413,62.210.85.178,10.0.2.15,TLSv1.2,1104,Application Data
1,2.1345479999999952,10.0.2.15,62.210.85.178,TCP,54,35978  >  9001 [ACK] Seq=243647711 Ack=13337479 Win=65535 Len=0
1,2.1541230000002543,62.210.85.178,10.0.2.15,TLSv1.2,590,Application Data
1,2.1541870000000927,10.0.2.15,62.210.85.178,TCP,54,35978  >  9001 [ACK] Seq=243647711 Ack=13338015 Win=65535 Len=0
1,2.193108999999822,62.210.85.178,10.0.2.15,TLSv1.2,590,Application Data
1,2.1931720000002315,10.0.2.15,62.210.85.178,TCP,54,35978  >  9001 [ACK] Seq=243647711 Ack=13338551 Win=65535 Len=0
1,2.2225680000001375,62.210.85.178,10.0.2.15,TLSv1.2,590,Application Data
1,2.22266800000034,10.0.2.15,62.210.85.178,TCP,54,35978  >  9001 [ACK] Seq=243647711 Ack=13339087 Win=65535 Len=0
1,2.2232229999999618,10.0.2.15,62.210.85.178,TLSv1.2,590,Application Data
1,2.2233509999996386,62.210.85.178,10.0.2.15,TCP,60,9001  >  35978 [ACK] Seq=13339087 Ack=243648247 Win=65535 Len=0
1,2.333980999999767,54.93.77.70,10.0.2.15,TLSv1.2,590,Application Data
1,2.3350600000003396,10.0.2.15,54.93.77.70,TLSv1.2,590,Application Data
1,2.3354490000001533,54.93.77.70,10.0.2.15,TCP,60,9001  >  34692 [ACK] Seq=243559251 Ack=13427227 Win=65535 Len=0
1,2.731847000000016,62.210.85.178,10.0.2.15,TLSv1.2,590,Application Data
1,2.738148000000365,10.0.2.15,62.210.85.178,TLSv1.2,590,Application Data
1,2.73829300000034,62.210.85.178,10.0.2.15,TCP,60,9001  >  35978 [ACK] Seq=13339623 Ack=243648783 Win=65535 Len=0
1,2.7468360000002576,10.0.2.15,62.210.85.178,TLSv1.2,4124,Application Data
1,2.7469449999998687,10.0.2.15,62.210.85.178,TCP,2974,35978  >  9001 [ACK] Seq=243652853 Ack=13339623 Win=65535 Len=2920 [TCP segment of a reassembled PDU]
1,2.7469950000004246,62.210.85.178,10.0.2.15,TCP,60,9001  >  35978 [ACK] Seq=13339623 Ack=243650243 Win=65535 Len=0
1,2.7470069999999396,62.210.85.178,10.0.2.15,TCP,60,9001  >  35978 [ACK] Seq=13339623 Ack=243651703 Win=65535 Len=0
1,2.7470119999998133,62.210.85.178,10.0.2.15,TCP,60,9001  >  35978 [ACK] Seq=13339623 Ack=243652853 Win=65535 Len=0
1,2.747016000000258,62.210.85.178,10.0.2.15,TCP,60,9001  >  35978 [ACK] Seq=13339623 Ack=243654313 Win=65535 Len=0
1,2.7470180000000255,62.210.85.178,10.0.2.15,TCP,60,9001  >  35978 [ACK] Seq=13339623 Ack=243655773 Win=65535 Len=0
1,2.7470540000003894,10.0.2.15,62.210.85.178,TLSv1.2,1204,Application Data
1,2.7470940000002884,62.210.85.178,10.0.2.15,TCP,60,9001  >  35978 [ACK] Seq=13339623 Ack=243656923 Win=65535 Len=0
1,2.7471400000003996,10.0.2.15,62.210.85.178,TLSv1.2,4124,Application Data
1,2.74717899999996,62.210.85.178,10.0.2.15,TCP,60,9001  >  35978 [ACK] Seq=13339623 Ack=243658383 Win=65535 Len=0
1,2.7471880000002784,62.210.85.178,10.0.2.15,TCP,60,9001  >  35978 [ACK] Seq=13339623 Ack=243659843 Win=65535 Len=0
1,2.7471919999998136,62.210.85.178,10.0.2.15,TCP,60,9001  >  35978 [ACK] Seq=13339623 Ack=243660993 Win=65535 Len=0
1,2.7472310000002835,10.0.2.15,62.210.85.178,TLSv1.2,4124,Application Data
1,2.747269000000415,62.210.85.178,10.0.2.15,TCP,60,9001  >  35978 [ACK] Seq=13339623 Ack=243662453 Win=65535 Len=0
1,2.7472770000003948,62.210.85.178,10.0.2.15,TCP,60,9001  >  35978 [ACK] Seq=13339623 Ack=243663913 Win=65535 Len=0
1,2.7473390000004656,10.0.2.15,62.210.85.178,TLSv1.2,2974,Application Data
1,2.747378000000026,62.210.85.178,10.0.2.15,TCP,60,9001  >  35978 [ACK] Seq=13339623 Ack=243665063 Win=65535 Len=0
1,2.7473870000003444,62.210.85.178,10.0.2.15,TCP,60,9001  >  35978 [ACK] Seq=13339623 Ack=243666523 Win=65535 Len=0
1,2.7473909999998796,62.210.85.178,10.0.2.15,TCP,60,9001  >  35978 [ACK] Seq=13339623 Ack=243667983 Win=65535 Len=0
1,2.7474190000002636,10.0.2.15,62.210.85.178,TLSv1.2,1226,Application Data
1,2.747454999999718,62.210.85.178,10.0.2.15,TCP,60,9001  >  35978 [ACK] Seq=13339623 Ack=243669155 Win=65535 Len=0
1,2.747497999999723,10.0.2.15,62.210.85.178,TLSv1.2,4124,Application Data
1,2.7475359999998545,62.210.85.178,10.0.2.15,TCP,60,9001  >  35978 [ACK] Seq=13339623 Ack=243670615 Win=65535 Len=0
1,2.7475439999998343,62.210.85.178,10.0.2.15,TCP,60,9001  >  35978 [ACK] Seq=13339623 Ack=243672075 Win=65535 Len=0
1,2.747548000000279,62.210.85.178,10.0.2.15,TCP,60,9001  >  35978 [ACK] Seq=13339623 Ack=243673225 Win=65535 Len=0
1,2.747585000000072,10.0.2.15,62.210.85.178,TLSv1.2,3030,Application Data
1,2.7476230000002033,62.210.85.178,10.0.2.15,TCP,60,9001  >  35978 [ACK] Seq=13339623 Ack=243674685 Win=65535 Len=0
1,2.747631000000183,62.210.85.178,10.0.2.15,TCP,60,9001  >  35978 [ACK] Seq=13339623 Ack=243676145 Win=65535 Len=0
1,2.7476349999997183,62.210.85.178,10.0.2.15,TCP,60,9001  >  35978 [ACK] Seq=13339623 Ack=243676201 Win=65535 Len=0
1,2.759100000000217,10.0.2.15,62.210.85.178,TLSv1.2,4124,Application Data
1,2.7591599999996106,62.210.85.178,10.0.2.15,TCP,60,9001  >  35978 [ACK] Seq=13339623 Ack=243677661 Win=65535 Len=0
1,2.7591730000003736,62.210.85.178,10.0.2.15,TCP,60,9001  >  35978 [ACK] Seq=13339623 Ack=243679121 Win=65535 Len=0
1,2.7591780000002473,62.210.85.178,10.0.2.15,TCP,60,9001  >  35978 [ACK] Seq=13339623 Ack=243680271 Win=65535 Len=0
1,2.7592249999997875,10.0.2.15,62.210.85.178,TLSv1.2,4124,Application Data
1,2.7592899999999645,62.210.85.178,10.0.2.15,TCP,60,9001  >  35978 [ACK] Seq=13339623 Ack=243681731 Win=65535 Len=0
1,2.759299000000283,62.210.85.178,10.0.2.15,TCP,60,9001  >  35978 [ACK] Seq=13339623 Ack=243683191 Win=65535 Len=0
1,2.7593010000000504,62.210.85.178,10.0.2.15,TCP,60,9001  >  35978 [ACK] Seq=13339623 Ack=243684341 Win=65535 Len=0
1,2.7593379999998433,10.0.2.15,62.210.85.178,TLSv1.2,4124,Application Data
1,2.759374999999636,62.210.85.178,10.0.2.15,TCP,60,9001  >  35978 [ACK] Seq=13339623 Ack=243685801 Win=65535 Len=0
1,2.7593839999999545,62.210.85.178,10.0.2.15,TCP,60,9001  >  35978 [ACK] Seq=13339623 Ack=243687261 Win=65535 Len=0
1,2.7593889999998282,62.210.85.178,10.0.2.15,TCP,60,9001  >  35978 [ACK] Seq=13339623 Ack=243688411 Win=65535 Len=0
1,2.759425999999621,10.0.2.15,62.210.85.178,TLSv1.2,4124,Application Data
1,2.7594639999997526,62.210.85.178,10.0.2.15,TCP,60,9001  >  35978 [ACK] Seq=13339623 Ack=243689871 Win=65535 Len=0
1,2.7594719999997324,62.210.85.178,10.0.2.15,TCP,60,9001  >  35978 [ACK] Seq=13339623 Ack=243691331 Win=65535 Len=0
1,2.759476000000177,62.210.85.178,10.0.2.15,TCP,60,9001  >  35978 [ACK] Seq=13339623 Ack=243692481 Win=65535 Len=0
1,2.7595110000002023,10.0.2.15,62.210.85.178,TLSv1.2,332,Application Data
1,2.7595479999999952,62.210.85.178,10.0.2.15,TCP,60,9001  >  35978 [ACK] Seq=13339623 Ack=243692759 Win=65535 Len=0
1,2.7596009999997477,10.0.2.15,62.210.85.178,TLSv1.2,3868,Application Data
1,2.7596400000002177,62.210.85.178,10.0.2.15,TCP,60,9001  >  35978 [ACK] Seq=13339623 Ack=243694219 Win=65535 Len=0
1,2.7596480000001975,62.210.85.178,10.0.2.15,TCP,60,9001  >  35978 [ACK] Seq=13339623 Ack=243695679 Win=65535 Len=0
1,2.7596519999997327,62.210.85.178,10.0.2.15,TCP,60,9001  >  35978 [ACK] Seq=13339623 Ack=243696573 Win=65535 Len=0
1,2.759689999999864,10.0.2.15,62.210.85.178,TLSv1.2,4124,Application Data
1,2.7597279999999955,62.210.85.178,10.0.2.15,TCP,60,9001  >  35978 [ACK] Seq=13339623 Ack=243698033 Win=65535 Len=0
1,2.7597359999999753,62.210.85.178,10.0.2.15,TCP,60,9001  >  35978 [ACK] Seq=13339623 Ack=243699493 Win=65535 Len=0
1,2.75974000000042,62.210.85.178,10.0.2.15,TCP,60,9001  >  35978 [ACK] Seq=13339623 Ack=243700643 Win=65535 Len=0
1,2.7597759999998743,10.0.2.15,62.210.85.178,TLSv1.2,3030,Application Data
1,2.7598140000000058,62.210.85.178,10.0.2.15,TCP,60,9001  >  35978 [ACK] Seq=13339623 Ack=243702103 Win=65535 Len=0
1,2.7598219999999856,62.210.85.178,10.0.2.15,TCP,60,9001  >  35978 [ACK] Seq=13339623 Ack=243703563 Win=65535 Len=0
1,2.75982600000043,62.210.85.178,10.0.2.15,TCP,60,9001  >  35978 [ACK] Seq=13339623 Ack=243703619 Win=65535 Len=0
1,2.771230000000287,10.0.2.15,62.210.85.178,TLSv1.2,4124,Application Data
1,2.7713290000001507,62.210.85.178,10.0.2.15,TCP,60,9001  >  35978 [ACK] Seq=13339623 Ack=243705079 Win=65535 Len=0
1,2.771338999999898,62.210.85.178,10.0.2.15,TCP,60,9001  >  35978 [ACK] Seq=13339623 Ack=243706539 Win=65535 Len=0
1,2.7713430000003427,62.210.85.178,10.0.2.15,TCP,60,9001  >  35978 [ACK] Seq=13339623 Ack=243707689 Win=65535 Len=0
1,2.7713809999995647,10.0.2.15,62.210.85.178,TLSv1.2,4124,Application Data
1,2.771421000000373,62.210.85.178,10.0.2.15,TCP,60,9001  >  35978 [ACK] Seq=13339623 Ack=243709149 Win=65535 Len=0
1,2.7714340000002267,62.210.85.178,10.0.2.15,TCP,60,9001  >  35978 [ACK] Seq=13339623 Ack=243710609 Win=65535 Len=0
1,2.7714390000001004,62.210.85.178,10.0.2.15,TCP,60,9001  >  35978 [ACK] Seq=13339623 Ack=243711759 Win=65535 Len=0
1,2.7714759999998932,10.0.2.15,62.210.85.178,TLSv1.2,4124,Application Data
1,2.771515000000363,62.210.85.178,10.0.2.15,TCP,60,9001  >  35978 [ACK] Seq=13339623 Ack=243713219 Win=65535 Len=0
1,2.771523999999772,62.210.85.178,10.0.2.15,TCP,60,9001  >  35978 [ACK] Seq=13339623 Ack=243714679 Win=65535 Len=0
1,2.7715289999996457,62.210.85.178,10.0.2.15,TCP,60,9001  >  35978 [ACK] Seq=13339623 Ack=243715829 Win=65535 Len=0
1,2.7715680000001157,10.0.2.15,62.210.85.178,TLSv1.2,4124,Application Data
1,2.771606999999676,62.210.85.178,10.0.2.15,TCP,60,9001  >  35978 [ACK] Seq=13339623 Ack=243717289 Win=65535 Len=0
1,2.771614999999656,62.210.85.178,10.0.2.15,TCP,60,9001  >  35978 [ACK] Seq=13339623 Ack=243718749 Win=65535 Len=0
1,2.7716190000001006,62.210.85.178,10.0.2.15,TCP,60,9001  >  35978 [ACK] Seq=13339623 Ack=243719899 Win=65535 Len=0
1,2.771654000000126,10.0.2.15,62.210.85.178,TLSv1.2,332,Application Data
1,2.7716920000002574,62.210.85.178,10.0.2.15,TCP,60,9001  >  35978 [ACK] Seq=13339623 Ack=243720177 Win=65535 Len=0
1,2.771741999999904,10.0.2.15,62.210.85.178,TLSv1.2,3868,Application Data
1,2.771781999999803,62.210.85.178,10.0.2.15,TCP,60,9001  >  35978 [ACK] Seq=13339623 Ack=243721637 Win=65535 Len=0
1,2.7717899999997826,62.210.85.178,10.0.2.15,TCP,60,9001  >  35978 [ACK] Seq=13339623 Ack=243723097 Win=65535 Len=0
1,2.7717929999998887,62.210.85.178,10.0.2.15,TCP,60,9001  >  35978 [ACK] Seq=13339623 Ack=243723991 Win=65535 Len=0
1,2.7718329999997877,10.0.2.15,62.210.85.178,TLSv1.2,2966,Application Data
1,2.7718729999996867,62.210.85.178,10.0.2.15,TCP,60,9001  >  35978 [ACK] Seq=13339623 Ack=243725451 Win=65535 Len=0
1,2.771878999999899,62.210.85.178,10.0.2.15,TCP,60,9001  >  35978 [ACK] Seq=13339623 Ack=243726903 Win=65535 Len=0
1,2.8472929999998087,54.93.77.70,10.0.2.15,TLSv1.2,3674,Application Data
1,2.847429000000375,10.0.2.15,54.93.77.70,TCP,54,34692  >  9001 [ACK] Seq=13427227 Ack=243562871 Win=65535 Len=0
1,2.8683970000001864,54.93.77.70,10.0.2.15,TLSv1.2,590,Application Data
1,2.8810849999999846,54.93.77.70,10.0.2.15,TCP,2950,"9001  >  34692 [PSH, ACK] Seq=243563407 Ack=13427227 Win=65535 Len=2896 [TCP segment of a reassembled PDU]"
1,2.8811619999996765,10.0.2.15,54.93.77.70,TCP,54,34692  >  9001 [ACK] Seq=13427227 Ack=243566303 Win=65535 Len=0
1,2.8895149999998466,54.93.77.70,10.0.2.15,TLSv1.2,5846,"Application Data, Application Data"
1,2.889595999999983,10.0.2.15,54.93.77.70,TCP,54,34692  >  9001 [ACK] Seq=13427227 Ack=243572095 Win=65535 Len=0
1,2.8897049999995943,54.93.77.70,10.0.2.15,TCP,1502,"9001  >  34692 [PSH, ACK] Seq=243572095 Ack=13427227 Win=65535 Len=1448 [TCP segment of a reassembled PDU]"
1,2.8898099999996703,10.0.2.15,54.93.77.70,TCP,54,34692  >  9001 [ACK] Seq=13427227 Ack=243573543 Win=65535 Len=0
1,2.8978100000003906,54.93.77.70,10.0.2.15,TLSv1.2,1292,Application Data
1,2.91409399999975,54.93.77.70,10.0.2.15,TLSv1.2,7294,"Application Data, Application Data"
1,2.9141579999995884,10.0.2.15,54.93.77.70,TCP,54,34692  >  9001 [ACK] Seq=13427227 Ack=243582021 Win=65535 Len=0
1,2.9144859999996697,54.93.77.70,10.0.2.15,TLSv1.2,1104,Application Data
1,2.925532000000203,54.93.77.70,10.0.2.15,TCP,2950,"9001  >  34692 [PSH, ACK] Seq=243583071 Ack=13427227 Win=65535 Len=2896 [TCP segment of a reassembled PDU]"
1,2.925623000000087,10.0.2.15,54.93.77.70,TCP,54,34692  >  9001 [ACK] Seq=13427227 Ack=243585967 Win=65535 Len=0
1,2.937257999999929,54.93.77.70,10.0.2.15,TLSv1.2,2950,"Application Data, Application Data"
1,2.9373020000002725,54.93.77.70,10.0.2.15,TCP,1502,"9001  >  34692 [PSH, ACK] Seq=243588863 Ack=13427227 Win=65535 Len=1448 [TCP segment of a reassembled PDU]"
1,2.937363000000005,10.0.2.15,54.93.77.70,TCP,54,34692  >  9001 [ACK] Seq=13427227 Ack=243588863 Win=65535 Len=0
1,2.937482000000273,10.0.2.15,54.93.77.70,TCP,54,34692  >  9001 [ACK] Seq=13427227 Ack=243590311 Win=65535 Len=0
1,2.93769599999996,10.0.2.15,54.93.77.70,TLSv1.2,590,Application Data
1,2.937775999999758,54.93.77.70,10.0.2.15,TCP,60,9001  >  34692 [ACK] Seq=243590311 Ack=13427763 Win=65535 Len=0
1,2.9435759999996662,54.93.77.70,10.0.2.15,TLSv1.2,590,Application Data
1,2.948210999999901,54.93.77.70,10.0.2.15,TCP,2950,"9001  >  34692 [PSH, ACK] Seq=243590847 Ack=13427763 Win=65535 Len=2896 [TCP segment of a reassembled PDU]"
1,2.948261000000457,10.0.2.15,54.93.77.70,TCP,54,34692  >  9001 [ACK] Seq=13427763 Ack=243593743 Win=65535 Len=0
1,2.9485050000002957,54.93.77.70,10.0.2.15,TLSv1.2,1502,Application Data [TCP segment of a reassembled PDU]
1,2.9485469999999623,10.0.2.15,54.93.77.70,TCP,54,34692  >  9001 [ACK] Seq=13427763 Ack=243595191 Win=65535 Len=0
1,2.960172000000057,54.93.77.70,10.0.2.15,TLSv1.2,1502,Application Data [TCP segment of a reassembled PDU]
1,2.9602169999998296,10.0.2.15,54.93.77.70,TCP,54,34692  >  9001 [ACK] Seq=13427763 Ack=243596639 Win=65535 Len=0
1,2.9738539999998466,54.93.77.70,10.0.2.15,TLSv1.2,1010,Application Data
1,2.9778260000002774,54.93.77.70,10.0.2.15,TLSv1.2,5846,Application Data
1,2.9779029999999693,10.0.2.15,54.93.77.70,TCP,54,34692  >  9001 [ACK] Seq=13427763 Ack=243603387 Win=65535 Len=0
1,2.9788650000000416,54.93.77.70,10.0.2.15,TCP,1502,"9001  >  34692 [PSH, ACK] Seq=243603387 Ack=13427763 Win=65535 Len=1448 [TCP segment of a reassembled PDU]"
1,2.978906999999708,10.0.2.15,54.93.77.70,TCP,54,34692  >  9001 [ACK] Seq=13427763 Ack=243604835 Win=65535 Len=0
1,2.989628000000266,54.93.77.70,10.0.2.15,TLSv1.2,7294,"Application Data, Application Data"
1,2.9896920000001046,10.0.2.15,54.93.77.70,TCP,54,34692  >  9001 [ACK] Seq=13427763 Ack=243612075 Win=65535 Len=0
1,2.989972000000307,10.0.2.15,54.93.77.70,TLSv1.2,590,Application Data
1,2.990082000000257,54.93.77.70,10.0.2.15,TCP,60,9001  >  34692 [ACK] Seq=243612075 Ack=13428299 Win=65535 Len=0
1,2.999163999999837,54.93.77.70,10.0.2.15,TLSv1.2,1082,Application Data
1,2.999348999999711,10.0.2.15,54.93.77.70,TLSv1.2,590,Application Data
1,2.9994610000003377,54.93.77.70,10.0.2.15,TCP,60,9001  >  34692 [ACK] Seq=243613103 Ack=13428835 Win=65535 Len=0
1,3.0058090000002267,54.93.77.70,10.0.2.15,TLSv1.2,7294,Application Data
1,3.0058769999996002,10.0.2.15,54.93.77.70,TCP,54,34692  >  9001 [ACK] Seq=13428835 Ack=243620343 Win=65535 Len=0
1,3.0267540000004374,54.93.77.70,10.0.2.15,TLSv1.2,1104,"Application Data, Application Data"
1,3.0296079999998256,54.93.77.70,10.0.2.15,TLSv1.2,4398,Application Data
1,3.029660999999578,10.0.2.15,54.93.77.70,TCP,54,34692  >  9001 [ACK] Seq=13428835 Ack=243625737 Win=65535 Len=0
1,3.0405730000002222,54.93.77.70,10.0.2.15,TLSv1.2,2950,Application Data [TCP segment of a reassembled PDU]
1,3.0406519999996817,10.0.2.15,54.93.77.70,TCP,54,34692  >  9001 [ACK] Seq=13428835 Ack=243628633 Win=65535 Len=0
1,3.0420249999997395,54.93.77.70,10.0.2.15,TLSv1.2,4398,Application Data [TCP segment of a reassembled PDU]
1,3.042069000000083,10.0.2.15,54.93.77.70,TCP,54,34692  >  9001 [ACK] Seq=13428835 Ack=243632977 Win=65535 Len=0
1,3.0459090000003926,54.93.77.70,10.0.2.15,TLSv1.2,894,Application Data
1,3.0584680000001754,54.93.77.70,10.0.2.15,TCP,2950,"9001  >  34692 [PSH, ACK] Seq=243633817 Ack=13428835 Win=65535 Len=2896 [TCP segment of a reassembled PDU]"
1,3.0585220000002664,10.0.2.15,54.93.77.70,TCP,54,34692  >  9001 [ACK] Seq=13428835 Ack=243636713 Win=65535 Len=0
1,3.0747819999996864,54.93.77.70,10.0.2.15,TLSv1.2,264,Application Data
1,3.074931000000106,10.0.2.15,54.93.77.70,TLSv1.2,590,Application Data
1,3.0750129999996716,54.93.77.70,10.0.2.15,TCP,60,9001  >  34692 [ACK] Seq=243636923 Ack=13429371 Win=65535 Len=0
1,3.091363000000456,62.210.85.178,10.0.2.15,TLSv1.2,590,Application Data
1,3.102324000000408,54.93.77.70,10.0.2.15,TLSv1.2,1104,Application Data
1,3.1049220000004425,10.0.2.15,54.93.77.70,TLSv1.2,590,Application Data
1,3.1050809999997,54.93.77.70,10.0.2.15,TCP,60,9001  >  34692 [ACK] Seq=243637973 Ack=13429907 Win=65535 Len=0
1,3.1202409999996235,62.210.85.178,10.0.2.15,TLSv1.2,590,Application Data
1,3.120375000000422,10.0.2.15,62.210.85.178,TCP,54,35978  >  9001 [ACK] Seq=243726903 Ack=13340695 Win=65535 Len=0
1,3.1591600000001563,62.210.85.178,10.0.2.15,TLSv1.2,590,Application Data
1,3.2025690000000395,10.0.2.15,62.210.85.178,TCP,54,35978  >  9001 [ACK] Seq=243726903 Ack=13341231 Win=65535 Len=0
1,3.345140999999785,62.210.85.178,10.0.2.15,TLSv1.2,590,Application Data
1,3.3452299999999013,10.0.2.15,62.210.85.178,TCP,54,35978  >  9001 [ACK] Seq=243726903 Ack=13341767 Win=65535 Len=0
1,3.409114000000045,62.210.85.178,10.0.2.15,TLSv1.2,590,Application Data
1,3.409179000000222,10.0.2.15,62.210.85.178,TCP,54,35978  >  9001 [ACK] Seq=243726903 Ack=13342303 Win=65535 Len=0
1,3.4094770000001517,10.0.2.15,62.210.85.178,TLSv1.2,590,Application Data
1,3.409599999999955,62.210.85.178,10.0.2.15,TCP,60,9001  >  35978 [ACK] Seq=13342303 Ack=243727439 Win=65535 Len=0
1,3.652407999999923,54.93.77.70,10.0.2.15,TLSv1.2,590,Application Data
1,3.652834999999868,10.0.2.15,54.93.77.70,TLSv1.2,590,Application Data
1,3.652944999999818,54.93.77.70,10.0.2.15,TCP,60,9001  >  34692 [ACK] Seq=243638509 Ack=13430443 Win=65535 Len=0
1,3.756808000000092,62.210.85.178,10.0.2.15,TLSv1.2,590,Application Data
1,3.760736999999608,10.0.2.15,62.210.85.178,TLSv1.2,590,Application Data
1,3.760932000000139,62.210.85.178,10.0.2.15,TCP,60,9001  >  35978 [ACK] Seq=13342839 Ack=243727975 Win=65535 Len=0
1,3.7705889999997453,10.0.2.15,62.210.85.178,TLSv1.2,4124,Application Data
1,3.7710109999998167,62.210.85.178,10.0.2.15,TCP,60,9001  >  35978 [ACK] Seq=13342839 Ack=243729435 Win=65535 Len=0
1,3.771031000000221,62.210.85.178,10.0.2.15,TCP,60,9001  >  35978 [ACK] Seq=13342839 Ack=243730895 Win=65535 Len=0
1,3.7710360000000946,62.210.85.178,10.0.2.15,TCP,60,9001  >  35978 [ACK] Seq=13342839 Ack=243732045 Win=65535 Len=0
1,3.7711120000003575,10.0.2.15,62.210.85.178,TLSv1.2,654,Application Data
1,3.771197000000029,62.210.85.178,10.0.2.15,TCP,60,9001  >  35978 [ACK] Seq=13342839 Ack=243732645 Win=65535 Len=0
1,3.8796110000002955,54.93.77.70,10.0.2.15,TLSv1.2,590,Application Data
1,3.898653000000195,54.93.77.70,10.0.2.15,TCP,2950,"9001  >  34692 [PSH, ACK] Seq=243639045 Ack=13430443 Win=65535 Len=2896 [TCP segment of a reassembled PDU]"
1,3.8987450000004173,10.0.2.15,54.93.77.70,TCP,54,34692  >  9001 [ACK] Seq=13430443 Ack=243641941 Win=65535 Len=0
1,3.907694000000447,54.93.77.70,10.0.2.15,TLSv1.2,1502,Application Data [TCP segment of a reassembled PDU]
1,3.907737999999881,10.0.2.15,54.93.77.70,TCP,54,34692  >  9001 [ACK] Seq=13430443 Ack=243643389 Win=65535 Len=0
1,3.914491999999882,54.93.77.70,10.0.2.15,TLSv1.2,380,Application Data
1,3.917497999999796,10.0.2.15,54.93.77.70,TLSv1.2,590,Application Data
1,3.91767499999969,54.93.77.70,10.0.2.15,TCP,60,9001  >  34692 [ACK] Seq=243643715 Ack=13430979 Win=65535 Len=0
1,4.031318000000283,62.210.85.178,10.0.2.15,TLSv1.2,590,Application Data
1,4.0316869999996925,10.0.2.15,62.210.85.178,TLSv1.2,590,Application Data
1,4.031825000000026,62.210.85.178,10.0.2.15,TCP,60,9001  >  35978 [ACK] Seq=13343375 Ack=243733181 Win=65535 Len=0
1,4.139618000000155,54.93.77.70,10.0.2.15,TLSv1.2,590,Application Data
1,4.140011999999842,10.0.2.15,54.93.77.70,TLSv1.2,590,Application Data
1,4.140128000000004,54.93.77.70,10.0.2.15,TCP,60,9001  >  34692 [ACK] Seq=243644251 Ack=13431515 Win=65535 Len=0
1,4.57393299999967,62.210.85.178,10.0.2.15,TLSv1.2,590,Application Data
1,4.583037000000331,10.0.2.15,62.210.85.178,TLSv1.2,590,Application Data
1,4.583225000000311,62.210.85.178,10.0.2.15,TCP,60,9001  >  35978 [ACK] Seq=13343911 Ack=243733717 Win=65535 Len=0
1,4.594904999999926,10.0.2.15,62.210.85.178,TLSv1.2,4124,Application Data
1,4.595013000000108,10.0.2.15,62.210.85.178,TCP,2974,35978  >  9001 [ACK] Seq=243737787 Ack=13343911 Win=65535 Len=2920 [TCP segment of a reassembled PDU]
1,4.595067999999628,62.210.85.178,10.0.2.15,TCP,60,9001  >  35978 [ACK] Seq=13343911 Ack=243735177 Win=65535 Len=0
1,4.595078000000285,62.210.85.178,10.0.2.15,TCP,60,9001  >  35978 [ACK] Seq=13343911 Ack=243736637 Win=65535 Len=0
1,4.595083000000159,62.210.85.178,10.0.2.15,TCP,60,9001  >  35978 [ACK] Seq=13343911 Ack=243737787 Win=65535 Len=0
1,4.595086999999694,62.210.85.178,10.0.2.15,TCP,60,9001  >  35978 [ACK] Seq=13343911 Ack=243739247 Win=65535 Len=0
1,4.595091000000139,62.210.85.178,10.0.2.15,TCP,60,9001  >  35978 [ACK] Seq=13343911 Ack=243740707 Win=65535 Len=0
1,4.595134999999573,10.0.2.15,62.210.85.178,TLSv1.2,1204,Application Data
1,4.595202999999856,10.0.2.15,62.210.85.178,TCP,2974,35978  >  9001 [ACK] Seq=243741857 Ack=13343911 Win=65535 Len=2920 [TCP segment of a reassembled PDU]
