No.,Time,Source,Destination,Protocol,Length,Info
1,0.026872999999795866,62.210.85.178,10.0.2.15,TLSv1.2,590,Application Data
1,0.026977000000442786,10.0.2.15,62.210.85.178,TCP,54,35978  >  9001 [ACK] Seq=251480475 Ack=13735877 Win=65535 Len=0
1,0.1394719999998415,10.0.2.15,54.93.77.70,TLSv1.2,590,Application Data
1,0.13971399999991263,54.93.77.70,10.0.2.15,TCP,60,9001  >  34692 [ACK] Seq=251395153 Ack=13825623 Win=65535 Len=0
1,0.3563080000003538,62.210.85.178,10.0.2.15,TLSv1.2,590,Application Data
1,0.3563819999999396,10.0.2.15,62.210.85.178,TCP,54,35978  >  9001 [ACK] Seq=251480475 Ack=13736413 Win=65535 Len=0
1,0.35686100000020815,10.0.2.15,62.210.85.178,TLSv1.2,590,Application Data
1,0.3569610000004104,62.210.85.178,10.0.2.15,TCP,60,9001  >  35978 [ACK] Seq=13736413 Ack=251481011 Win=65535 Len=0
1,0.5614089999999123,54.93.77.70,10.0.2.15,TLSv1.2,590,Application Data
1,0.5614850000001752,10.0.2.15,54.93.77.70,TCP,54,34692  >  9001 [ACK] Seq=13825623 Ack=251395689 Win=65535 Len=0
1,0.5618819999999687,10.0.2.15,54.93.77.70,TLSv1.2,1618,Application Data
1,0.5619839999999385,54.93.77.70,10.0.2.15,TCP,60,9001  >  34692 [ACK] Seq=251395689 Ack=13827083 Win=65535 Len=0
1,0.561996000000363,54.93.77.70,10.0.2.15,TCP,60,9001  >  34692 [ACK] Seq=251395689 Ack=13827187 Win=65535 Len=0
1,0.8703290000003108,62.210.85.178,10.0.2.15,TLSv1.2,1618,Application Data
1,0.8704560000005586,10.0.2.15,62.210.85.178,TCP,54,35978  >  9001 [ACK] Seq=251481011 Ack=13737977 Win=65535 Len=0
1,0.8841950000005454,10.0.2.15,62.210.85.178,TLSv1.2,590,Application Data
1,0.884342999999717,62.210.85.178,10.0.2.15,TCP,60,9001  >  35978 [ACK] Seq=13737977 Ack=251481547 Win=65535 Len=0
1,0.8960550000001604,10.0.2.15,62.210.85.178,TLSv1.2,1618,Application Data
1,0.8961740000004284,62.210.85.178,10.0.2.15,TCP,60,9001  >  35978 [ACK] Seq=13737977 Ack=251483007 Win=65535 Len=0
1,0.896190999999817,62.210.85.178,10.0.2.15,TCP,60,9001  >  35978 [ACK] Seq=13737977 Ack=251483111 Win=65535 Len=0
1,1.0729810000002544,54.93.77.70,10.0.2.15,TLSv1.2,590,Application Data
1,1.0767550000000483,54.93.77.70,10.0.2.15,TCP,1502,"9001  >  34692 [PSH, ACK] Seq=251396225 Ack=13827187 Win=65535 Len=1448 [TCP segment of a reassembled PDU]"
1,1.07683999999972,10.0.2.15,54.93.77.70,TCP,54,34692  >  9001 [ACK] Seq=13827187 Ack=251397673 Win=65535 Len=0
1,1.0921699999998964,54.93.77.70,10.0.2.15,TLSv1.2,170,Application Data
1,1.094122999999854,10.0.2.15,54.93.77.70,TLSv1.2,590,Application Data
1,1.0942880000002333,54.93.77.70,10.0.2.15,TCP,60,9001  >  34692 [ACK] Seq=251397789 Ack=13827723 Win=65535 Len=0
1,1.2791589999997086,62.210.85.178,10.0.2.15,TLSv1.2,590,Application Data
1,1.279475999999704,10.0.2.15,62.210.85.178,TLSv1.2,590,Application Data
1,1.2795599999999467,62.210.85.178,10.0.2.15,TCP,60,9001  >  35978 [ACK] Seq=13738513 Ack=251483647 Win=65535 Len=0
1,1.7898660000000746,54.93.77.70,10.0.2.15,TLSv1.2,590,Application Data
1,1.7902290000001813,10.0.2.15,54.93.77.70,TLSv1.2,590,Application Data
1,1.790328000000045,54.93.77.70,10.0.2.15,TCP,60,9001  >  34692 [ACK] Seq=251398325 Ack=13828259 Win=65535 Len=0
1,1.9951270000001387,62.210.85.178,10.0.2.15,TLSv1.2,590,Application Data
1,2.000890000000254,10.0.2.15,62.210.85.178,TLSv1.2,590,Application Data
1,2.001054999999724,62.210.85.178,10.0.2.15,TCP,60,9001  >  35978 [ACK] Seq=13739049 Ack=251484183 Win=65535 Len=0
1,2.012746000000334,10.0.2.15,62.210.85.178,TLSv1.2,4124,Application Data
1,2.013053000000582,62.210.85.178,10.0.2.15,TCP,60,9001  >  35978 [ACK] Seq=13739049 Ack=251485643 Win=65535 Len=0
1,2.013071000000309,62.210.85.178,10.0.2.15,TCP,60,9001  >  35978 [ACK] Seq=13739049 Ack=251487103 Win=65535 Len=0
1,2.0130740000004153,62.210.85.178,10.0.2.15,TCP,60,9001  >  35978 [ACK] Seq=13739049 Ack=251488253 Win=65535 Len=0
1,2.0131090000004406,10.0.2.15,62.210.85.178,TCP,2974,35978  >  9001 [ACK] Seq=251488253 Ack=13739049 Win=65535 Len=2920 [TCP segment of a reassembled PDU]
1,2.0131820000005973,62.210.85.178,10.0.2.15,TCP,60,9001  >  35978 [ACK] Seq=13739049 Ack=251489713 Win=65535 Len=0
1,2.013190000000577,62.210.85.178,10.0.2.15,TCP,60,9001  >  35978 [ACK] Seq=13739049 Ack=251491173 Win=65535 Len=0
1,2.0132180000000517,10.0.2.15,62.210.85.178,TLSv1.2,1204,Application Data
1,2.0132579999999507,62.210.85.178,10.0.2.15,TCP,60,9001  >  35978 [ACK] Seq=13739049 Ack=251492323 Win=65535 Len=0
1,2.0133029999997234,10.0.2.15,62.210.85.178,TLSv1.2,4124,Application Data
1,2.013343000000532,62.210.85.178,10.0.2.15,TCP,60,9001  >  35978 [ACK] Seq=13739049 Ack=251493783 Win=65535 Len=0
1,2.0133510000005117,62.210.85.178,10.0.2.15,TCP,60,9001  >  35978 [ACK] Seq=13739049 Ack=251495243 Win=65535 Len=0
1,2.013355000000047,62.210.85.178,10.0.2.15,TCP,60,9001  >  35978 [ACK] Seq=13739049 Ack=251496393 Win=65535 Len=0
1,2.013401000000158,10.0.2.15,62.210.85.178,TLSv1.2,4124,Application Data
1,2.013441000000057,62.210.85.178,10.0.2.15,TCP,60,9001  >  35978 [ACK] Seq=13739049 Ack=251497853 Win=65535 Len=0
1,2.013449000000037,62.210.85.178,10.0.2.15,TCP,60,9001  >  35978 [ACK] Seq=13739049 Ack=251499313 Win=65535 Len=0
1,2.0135159999999814,10.0.2.15,62.210.85.178,TLSv1.2,2974,Application Data
1,2.013557000000219,62.210.85.178,10.0.2.15,TCP,60,9001  >  35978 [ACK] Seq=13739049 Ack=251500463 Win=65535 Len=0
1,2.0135660000005373,62.210.85.178,10.0.2.15,TCP,60,9001  >  35978 [ACK] Seq=13739049 Ack=251501923 Win=65535 Len=0
1,2.013568999999734,62.210.85.178,10.0.2.15,TCP,60,9001  >  35978 [ACK] Seq=13739049 Ack=251503383 Win=65535 Len=0
1,2.013597000000118,10.0.2.15,62.210.85.178,TLSv1.2,1226,Application Data
1,2.0136320000001433,62.210.85.178,10.0.2.15,TCP,60,9001  >  35978 [ACK] Seq=13739049 Ack=251504555 Win=65535 Len=0
1,2.0136750000001484,10.0.2.15,62.210.85.178,TLSv1.2,4124,Application Data
1,2.01371300000028,62.210.85.178,10.0.2.15,TCP,60,9001  >  35978 [ACK] Seq=13739049 Ack=251506015 Win=65535 Len=0
1,2.0137210000002597,62.210.85.178,10.0.2.15,TCP,60,9001  >  35978 [ACK] Seq=13739049 Ack=251507475 Win=65535 Len=0
1,2.013724999999795,62.210.85.178,10.0.2.15,TCP,60,9001  >  35978 [ACK] Seq=13739049 Ack=251508625 Win=65535 Len=0
1,2.0137629999999263,10.0.2.15,62.210.85.178,TLSv1.2,3030,Application Data
1,2.0138010000000577,62.210.85.178,10.0.2.15,TCP,60,9001  >  35978 [ACK] Seq=13739049 Ack=251510085 Win=65535 Len=0
1,2.0138090000000375,62.210.85.178,10.0.2.15,TCP,60,9001  >  35978 [ACK] Seq=13739049 Ack=251511545 Win=65535 Len=0
1,2.013813000000482,62.210.85.178,10.0.2.15,TCP,60,9001  >  35978 [ACK] Seq=13739049 Ack=251511601 Win=65535 Len=0
1,2.0230069999997795,10.0.2.15,62.210.85.178,TLSv1.2,4124,Application Data
1,2.023062000000209,62.210.85.178,10.0.2.15,TCP,60,9001  >  35978 [ACK] Seq=13739049 Ack=251513061 Win=65535 Len=0
1,2.023073000000295,62.210.85.178,10.0.2.15,TCP,60,9001  >  35978 [ACK] Seq=13739049 Ack=251514521 Win=65535 Len=0
1,2.0230780000001687,62.210.85.178,10.0.2.15,TCP,60,9001  >  35978 [ACK] Seq=13739049 Ack=251515671 Win=65535 Len=0
1,2.0231260000000475,10.0.2.15,62.210.85.178,TLSv1.2,4124,Application Data
1,2.023167000000285,62.210.85.178,10.0.2.15,TCP,60,9001  >  35978 [ACK] Seq=13739049 Ack=251517131 Win=65535 Len=0
1,2.0231760000006034,62.210.85.178,10.0.2.15,TCP,60,9001  >  35978 [ACK] Seq=13739049 Ack=251518591 Win=65535 Len=0
1,2.023181000000477,62.210.85.178,10.0.2.15,TCP,60,9001  >  35978 [ACK] Seq=13739049 Ack=251519741 Win=65535 Len=0
1,2.023218999999699,10.0.2.15,62.210.85.178,TLSv1.2,4124,Application Data
1,2.023258000000169,62.210.85.178,10.0.2.15,TCP,60,9001  >  35978 [ACK] Seq=13739049 Ack=251521201 Win=65535 Len=0
1,2.023266000000149,62.210.85.178,10.0.2.15,TCP,60,9001  >  35978 [ACK] Seq=13739049 Ack=251522661 Win=65535 Len=0
1,2.0232710000000225,62.210.85.178,10.0.2.15,TCP,60,9001  >  35978 [ACK] Seq=13739049 Ack=251523811 Win=65535 Len=0
1,2.0233070000003863,10.0.2.15,62.210.85.178,TLSv1.2,4124,Application Data
1,2.023345999999947,62.210.85.178,10.0.2.15,TCP,60,9001  >  35978 [ACK] Seq=13739049 Ack=251525271 Win=65535 Len=0
1,2.0233539999999266,62.210.85.178,10.0.2.15,TCP,60,9001  >  35978 [ACK] Seq=13739049 Ack=251526731 Win=65535 Len=0
1,2.0233580000003712,62.210.85.178,10.0.2.15,TCP,60,9001  >  35978 [ACK] Seq=13739049 Ack=251527881 Win=65535 Len=0
1,2.023392000000058,10.0.2.15,62.210.85.178,TLSv1.2,332,Application Data
1,2.0234360000004017,62.210.85.178,10.0.2.15,TCP,60,9001  >  35978 [ACK] Seq=13739049 Ack=251528159 Win=65535 Len=0
1,2.023514999999861,10.0.2.15,62.210.85.178,TLSv1.2,3868,Application Data
1,2.0235579999998663,62.210.85.178,10.0.2.15,TCP,60,9001  >  35978 [ACK] Seq=13739049 Ack=251529619 Win=65535 Len=0
1,2.023565999999846,62.210.85.178,10.0.2.15,TCP,60,9001  >  35978 [ACK] Seq=13739049 Ack=251531079 Win=65535 Len=0
1,2.0235700000002907,62.210.85.178,10.0.2.15,TCP,60,9001  >  35978 [ACK] Seq=13739049 Ack=251531973 Win=65535 Len=0
1,2.0236230000000432,10.0.2.15,62.210.85.178,TLSv1.2,4124,Application Data
1,2.0237010000000737,62.210.85.178,10.0.2.15,TCP,60,9001  >  35978 [ACK] Seq=13739049 Ack=251533433 Win=65535 Len=0
1,2.0237090000000535,62.210.85.178,10.0.2.15,TCP,60,9001  >  35978 [ACK] Seq=13739049 Ack=251534893 Win=65535 Len=0
1,2.0237120000001596,62.210.85.178,10.0.2.15,TCP,60,9001  >  35978 [ACK] Seq=13739049 Ack=251536043 Win=65535 Len=0
1,2.0237550000001647,10.0.2.15,62.210.85.178,TLSv1.2,3030,Application Data
1,2.023793000000296,62.210.85.178,10.0.2.15,TCP,60,9001  >  35978 [ACK] Seq=13739049 Ack=251537503 Win=65535 Len=0
1,2.023801999999705,62.210.85.178,10.0.2.15,TCP,60,9001  >  35978 [ACK] Seq=13739049 Ack=251538963 Win=65535 Len=0
1,2.023807000000488,62.210.85.178,10.0.2.15,TCP,60,9001  >  35978 [ACK] Seq=13739049 Ack=251539019 Win=65535 Len=0
1,2.036533999999847,10.0.2.15,62.210.85.178,TLSv1.2,4124,Application Data
1,2.0366519999997763,62.210.85.178,10.0.2.15,TCP,60,9001  >  35978 [ACK] Seq=13739049 Ack=251540479 Win=65535 Len=0
1,2.0366629999998622,62.210.85.178,10.0.2.15,TCP,60,9001  >  35978 [ACK] Seq=13739049 Ack=251541939 Win=65535 Len=0
1,2.0366659999999683,62.210.85.178,10.0.2.15,TCP,60,9001  >  35978 [ACK] Seq=13739049 Ack=251543089 Win=65535 Len=0
1,2.0367059999998673,10.0.2.15,62.210.85.178,TLSv1.2,4124,Application Data
1,2.0367459999997664,62.210.85.178,10.0.2.15,TCP,60,9001  >  35978 [ACK] Seq=13739049 Ack=251544549 Win=65535 Len=0
1,2.0367550000000847,62.210.85.178,10.0.2.15,TCP,60,9001  >  35978 [ACK] Seq=13739049 Ack=251546009 Win=65535 Len=0
1,2.0367590000005293,62.210.85.178,10.0.2.15,TCP,60,9001  >  35978 [ACK] Seq=13739049 Ack=251547159 Win=65535 Len=0
1,2.0367969999997513,10.0.2.15,62.210.85.178,TLSv1.2,4124,Application Data
1,2.0368349999998827,62.210.85.178,10.0.2.15,TCP,60,9001  >  35978 [ACK] Seq=13739049 Ack=251548619 Win=65535 Len=0
1,2.036844000000201,62.210.85.178,10.0.2.15,TCP,60,9001  >  35978 [ACK] Seq=13739049 Ack=251550079 Win=65535 Len=0
1,2.0368490000000747,62.210.85.178,10.0.2.15,TCP,60,9001  >  35978 [ACK] Seq=13739049 Ack=251551229 Win=65535 Len=0
1,2.036887000000206,10.0.2.15,62.210.85.178,TLSv1.2,2324,Application Data
1,2.036923999999999,62.210.85.178,10.0.2.15,TCP,60,9001  >  35978 [ACK] Seq=13739049 Ack=251552689 Win=65535 Len=0
1,2.036931999999979,62.210.85.178,10.0.2.15,TCP,60,9001  >  35978 [ACK] Seq=13739049 Ack=251553499 Win=65535 Len=0
1,2.1185919999998077,54.93.77.70,10.0.2.15,TLSv1.2,590,Application Data
1,2.1336609999998473,54.93.77.70,10.0.2.15,TCP,2950,"9001  >  34692 [PSH, ACK] Seq=251398861 Ack=13828259 Win=65535 Len=2896 [TCP segment of a reassembled PDU]"
1,2.1337579999999434,10.0.2.15,54.93.77.70,TCP,54,34692  >  9001 [ACK] Seq=13828259 Ack=251401757 Win=65535 Len=0
1,2.1497550000003685,54.93.77.70,10.0.2.15,TLSv1.2,778,Application Data
1,2.1499210000001767,10.0.2.15,54.93.77.70,TLSv1.2,590,Application Data
1,2.1499949999997625,54.93.77.70,10.0.2.15,TCP,60,9001  >  34692 [ACK] Seq=251402481 Ack=13828795 Win=65535 Len=0
1,2.1531430000004548,54.93.77.70,10.0.2.15,TCP,2950,"9001  >  34692 [PSH, ACK] Seq=251402481 Ack=13828795 Win=65535 Len=2896 [TCP segment of a reassembled PDU]"
1,2.1532109999998283,10.0.2.15,54.93.77.70,TCP,54,34692  >  9001 [ACK] Seq=13828795 Ack=251405377 Win=65535 Len=0
1,2.1645989999997255,54.93.77.70,10.0.2.15,TLSv1.2,2950,Application Data [TCP segment of a reassembled PDU]
1,2.1646300000002157,54.93.77.70,10.0.2.15,TLSv1.2,1502,Application Data
1,2.164676000000327,10.0.2.15,54.93.77.70,TCP,54,34692  >  9001 [ACK] Seq=13828795 Ack=251408273 Win=65535 Len=0
1,2.164759000000231,10.0.2.15,54.93.77.70,TCP,54,34692  >  9001 [ACK] Seq=13828795 Ack=251409721 Win=65535 Len=0
1,2.1824240000005375,54.93.77.70,10.0.2.15,TCP,2950,"9001  >  34692 [PSH, ACK] Seq=251409721 Ack=13828795 Win=65535 Len=2896 [TCP segment of a reassembled PDU]"
1,2.182485999999699,10.0.2.15,54.93.77.70,TCP,54,34692  >  9001 [ACK] Seq=13828795 Ack=251412617 Win=65535 Len=0
1,2.18253199999981,54.93.77.70,10.0.2.15,TLSv1.2,778,Application Data
1,2.202607000000171,54.93.77.70,10.0.2.15,TLSv1.2,2950,Application Data
1,2.2026519999999437,10.0.2.15,54.93.77.70,TCP,54,34692  >  9001 [ACK] Seq=13828795 Ack=251416237 Win=65535 Len=0
1,2.2140669999998863,54.93.77.70,10.0.2.15,TLSv1.2,2950,Application Data [TCP segment of a reassembled PDU]
1,2.2140950000002704,54.93.77.70,10.0.2.15,TCP,1502,"9001  >  34692 [PSH, ACK] Seq=251419133 Ack=13828795 Win=65535 Len=1448 [TCP segment of a reassembled PDU]"
1,2.2141380000002755,10.0.2.15,54.93.77.70,TCP,54,34692  >  9001 [ACK] Seq=13828795 Ack=251419133 Win=65535 Len=0
1,2.2142350000003717,10.0.2.15,54.93.77.70,TCP,54,34692  >  9001 [ACK] Seq=13828795 Ack=251420581 Win=65535 Len=0
1,2.218923000000359,54.93.77.70,10.0.2.15,TLSv1.2,1126,"Application Data, Application Data"
1,2.2325810000002093,54.93.77.70,10.0.2.15,TLSv1.2,2950,Application Data
1,2.2326300000004267,10.0.2.15,54.93.77.70,TCP,54,34692  >  9001 [ACK] Seq=13828795 Ack=251424549 Win=65535 Len=0
1,2.235114000000067,54.93.77.70,10.0.2.15,TLSv1.2,1314,Application Data
1,2.2352559999999357,10.0.2.15,54.93.77.70,TLSv1.2,590,Application Data
1,2.2353510000002643,54.93.77.70,10.0.2.15,TCP,60,9001  >  34692 [ACK] Seq=251425809 Ack=13829331 Win=65535 Len=0
1,2.2527900000004593,54.93.77.70,10.0.2.15,TLSv1.2,590,Application Data
1,2.253733000000466,54.93.77.70,10.0.2.15,TCP,2950,"9001  >  34692 [PSH, ACK] Seq=251426345 Ack=13829331 Win=65535 Len=2896 [TCP segment of a reassembled PDU]"
1,2.253805000000284,10.0.2.15,54.93.77.70,TCP,54,34692  >  9001 [ACK] Seq=13829331 Ack=251429241 Win=65535 Len=0
1,2.2705619999996998,54.93.77.70,10.0.2.15,TLSv1.2,778,Application Data
1,2.2972350000000006,54.93.77.70,10.0.2.15,TCP,2950,"9001  >  34692 [PSH, ACK] Seq=251429965 Ack=13829331 Win=65535 Len=2896 [TCP segment of a reassembled PDU]"
1,2.2973050000000512,10.0.2.15,54.93.77.70,TCP,54,34692  >  9001 [ACK] Seq=13829331 Ack=251432861 Win=65535 Len=0
1,2.3031840000003285,62.210.85.178,10.0.2.15,TLSv1.2,590,Application Data
1,2.3134829999999056,54.93.77.70,10.0.2.15,TLSv1.2,1314,"Application Data, Application Data"
1,2.3142680000000837,54.93.77.70,10.0.2.15,TCP,2950,"9001  >  34692 [PSH, ACK] Seq=251434121 Ack=13829331 Win=65535 Len=2896 [TCP segment of a reassembled PDU]"
1,2.3143150000005335,10.0.2.15,54.93.77.70,TCP,54,34692  >  9001 [ACK] Seq=13829331 Ack=251437017 Win=65535 Len=0
1,2.326208999999835,54.93.77.70,10.0.2.15,TLSv1.2,2950,"Application Data, Application Data"
1,2.326227000000472,54.93.77.70,10.0.2.15,TLSv1.2,5846,Application Data [TCP segment of a reassembled PDU]
1,2.3262650000006033,10.0.2.15,54.93.77.70,TCP,54,34692  >  9001 [ACK] Seq=13829331 Ack=251439913 Win=65535 Len=0
1,2.326344000000063,10.0.2.15,54.93.77.70,TCP,54,34692  >  9001 [ACK] Seq=13829331 Ack=251445705 Win=65535 Len=0
1,2.333534999999756,54.93.77.70,10.0.2.15,TLSv1.2,380,Application Data
1,2.336164000000281,54.93.77.70,10.0.2.15,TLSv1.2,7294,Application Data
1,2.3362090000000535,10.0.2.15,54.93.77.70,TCP,54,34692  >  9001 [ACK] Seq=13829331 Ack=251453271 Win=65535 Len=0
1,2.343818999999712,10.0.2.15,62.210.85.178,TCP,54,35978  >  9001 [ACK] Seq=251553499 Ack=13739585 Win=65535 Len=0
1,2.3494399999999587,54.93.77.70,10.0.2.15,TLSv1.2,2950,Application Data [TCP segment of a reassembled PDU]
1,2.3494849999997314,10.0.2.15,54.93.77.70,TCP,54,34692  >  9001 [ACK] Seq=13829331 Ack=251456167 Win=65535 Len=0
1,2.3496649999997317,10.0.2.15,54.93.77.70,TLSv1.2,1104,Application Data
1,2.349742000000333,54.93.77.70,10.0.2.15,TCP,60,9001  >  34692 [ACK] Seq=251456167 Ack=13830381 Win=65535 Len=0
1,2.3530470000005153,54.93.77.70,10.0.2.15,TLSv1.2,1292,Application Data
1,2.3578600000000733,54.93.77.70,10.0.2.15,TLSv1.2,4398,Application Data
1,2.3579099999997197,10.0.2.15,54.93.77.70,TCP,54,34692  >  9001 [ACK] Seq=13830381 Ack=251461749 Win=65535 Len=0
1,2.3584230000005846,54.93.77.70,10.0.2.15,TCP,2950,"9001  >  34692 [PSH, ACK] Seq=251461749 Ack=13830381 Win=65535 Len=2896 [TCP segment of a reassembled PDU]"
1,2.358465000000251,10.0.2.15,54.93.77.70,TCP,54,34692  >  9001 [ACK] Seq=13830381 Ack=251464645 Win=65535 Len=0
1,2.3642790000003515,62.210.85.178,10.0.2.15,TLSv1.2,590,Application Data
1,2.3643250000004628,10.0.2.15,62.210.85.178,TCP,54,35978  >  9001 [ACK] Seq=251553499 Ack=13740121 Win=65535 Len=0
1,2.3744240000005448,54.93.77.70,10.0.2.15,TLSv1.2,1104,"Application Data, Application Data"
1,2.38192700000036,54.93.77.70,10.0.2.15,TCP,1502,"9001  >  34692 [PSH, ACK] Seq=251465695 Ack=13830381 Win=65535 Len=1448 [TCP segment of a reassembled PDU]"
1,2.3819739999999,10.0.2.15,54.93.77.70,TCP,54,34692  >  9001 [ACK] Seq=13830381 Ack=251467143 Win=65535 Len=0
1,2.3984410000002754,54.93.77.70,10.0.2.15,TLSv1.2,1198,Application Data
1,2.401050999999825,10.0.2.15,54.93.77.70,TLSv1.2,590,Application Data
1,2.401224000000184,54.93.77.70,10.0.2.15,TCP,60,9001  >  34692 [ACK] Seq=251468287 Ack=13830917 Win=65535 Len=0
1,2.4640840000001845,62.210.85.178,10.0.2.15,TLSv1.2,1104,Application Data
1,2.4642640000001848,10.0.2.15,62.210.85.178,TCP,54,35978  >  9001 [ACK] Seq=251553499 Ack=13741171 Win=65535 Len=0
1,2.6102490000002945,62.210.85.178,10.0.2.15,TLSv1.2,590,Application Data
1,2.610327000000325,10.0.2.15,62.210.85.178,TCP,54,35978  >  9001 [ACK] Seq=251553499 Ack=13741707 Win=65535 Len=0
1,2.6107920000004015,10.0.2.15,62.210.85.178,TLSv1.2,590,Application Data
1,2.6109120000000985,62.210.85.178,10.0.2.15,TCP,60,9001  >  35978 [ACK] Seq=13741707 Ack=251554035 Win=65535 Len=0
1,2.813984000000346,54.93.77.70,10.0.2.15,TLSv1.2,590,Application Data
1,2.8143780000000334,10.0.2.15,54.93.77.70,TLSv1.2,590,Application Data
1,2.8144940000001952,54.93.77.70,10.0.2.15,TCP,60,9001  >  34692 [ACK] Seq=251468823 Ack=13831453 Win=65535 Len=0
1,3.0197479999997086,62.210.85.178,10.0.2.15,TLSv1.2,590,Application Data
1,3.0233870000001843,10.0.2.15,62.210.85.178,TLSv1.2,590,Application Data
1,3.02360200000021,62.210.85.178,10.0.2.15,TCP,60,9001  >  35978 [ACK] Seq=13742243 Ack=251554571 Win=65535 Len=0
1,3.0360570000002554,10.0.2.15,62.210.85.178,TLSv1.2,4124,Application Data
1,3.036199000000124,10.0.2.15,62.210.85.178,TCP,2974,35978  >  9001 [ACK] Seq=251558641 Ack=13742243 Win=65535 Len=2920 [TCP segment of a reassembled PDU]
1,3.036243000000468,62.210.85.178,10.0.2.15,TCP,60,9001  >  35978 [ACK] Seq=13742243 Ack=251556031 Win=65535 Len=0
1,3.036254000000554,62.210.85.178,10.0.2.15,TCP,60,9001  >  35978 [ACK] Seq=13742243 Ack=251557491 Win=65535 Len=0
1,3.0362590000004275,62.210.85.178,10.0.2.15,TCP,60,9001  >  35978 [ACK] Seq=13742243 Ack=251558641 Win=65535 Len=0
1,3.0362629999999626,62.210.85.178,10.0.2.15,TCP,60,9001  >  35978 [ACK] Seq=13742243 Ack=251560101 Win=65535 Len=0
1,3.0362679999998363,62.210.85.178,10.0.2.15,TCP,60,9001  >  35978 [ACK] Seq=13742243 Ack=251561561 Win=65535 Len=0
1,3.0363130000005185,10.0.2.15,62.210.85.178,TLSv1.2,1204,Application Data
1,3.0363820000002306,10.0.2.15,62.210.85.178,TCP,2974,35978  >  9001 [ACK] Seq=251562711 Ack=13742243 Win=65535 Len=2920 [TCP segment of a reassembled PDU]
1,3.036420000000362,62.210.85.178,10.0.2.15,TCP,60,9001  >  35978 [ACK] Seq=13742243 Ack=251562711 Win=65535 Len=0
1,3.0364270000000033,62.210.85.178,10.0.2.15,TCP,60,9001  >  35978 [ACK] Seq=13742243 Ack=251564171 Win=65535 Len=0
1,3.036431000000448,62.210.85.178,10.0.2.15,TCP,60,9001  >  35978 [ACK] Seq=13742243 Ack=251565631 Win=65535 Len=0
1,3.0364660000004733,10.0.2.15,62.210.85.178,TLSv1.2,1204,Application Data
1,3.0365320000000793,10.0.2.15,62.210.85.178,TCP,2974,35978  >  9001 [ACK] Seq=251566781 Ack=13742243 Win=65535 Len=2920 [TCP segment of a reassembled PDU]
1,3.0365710000005492,62.210.85.178,10.0.2.15,TCP,60,9001  >  35978 [ACK] Seq=13742243 Ack=251566781 Win=65535 Len=0
1,3.0365780000001905,62.210.85.178,10.0.2.15,TCP,60,9001  >  35978 [ACK] Seq=13742243 Ack=251568241 Win=65535 Len=0
1,3.036583000000064,62.210.85.178,10.0.2.15,TCP,60,9001  >  35978 [ACK] Seq=13742243 Ack=251569701 Win=65535 Len=0
1,3.0366140000005544,10.0.2.15,62.210.85.178,TLSv1.2,1204,Application Data
1,3.036693000000014,10.0.2.15,62.210.85.178,TLSv1.2,2974,Application Data
1,3.0367299999998068,62.210.85.178,10.0.2.15,TCP,60,9001  >  35978 [ACK] Seq=13742243 Ack=251570851 Win=65535 Len=0
1,3.0367370000003575,62.210.85.178,10.0.2.15,TCP,60,9001  >  35978 [ACK] Seq=13742243 Ack=251572311 Win=65535 Len=0
1,3.0367409999998927,62.210.85.178,10.0.2.15,TCP,60,9001  >  35978 [ACK] Seq=13742243 Ack=251573771 Win=65535 Len=0
1,3.036772999999812,10.0.2.15,62.210.85.178,TLSv1.2,1226,Application Data
1,3.036863999999696,62.210.85.178,10.0.2.15,TCP,60,9001  >  35978 [ACK] Seq=13742243 Ack=251574943 Win=65535 Len=0
1,3.0369080000000395,10.0.2.15,62.210.85.178,TLSv1.2,396,Application Data
1,3.0369470000005094,62.210.85.178,10.0.2.15,TCP,60,9001  >  35978 [ACK] Seq=13742243 Ack=251575285 Win=65535 Len=0
1,3.135041000000456,54.93.77.70,10.0.2.15,TLSv1.2,590,Application Data
1,3.175481000000218,10.0.2.15,54.93.77.70,TCP,54,34692  >  9001 [ACK] Seq=13831453 Ack=251469359 Win=65535 Len=0
1,3.202331000000413,54.93.77.70,10.0.2.15,TCP,2950,"9001  >  34692 [PSH, ACK] Seq=251469359 Ack=13831453 Win=65535 Len=2896 [TCP segment of a reassembled PDU]"
1,3.2023840000001655,10.0.2.15,54.93.77.70,TCP,54,34692  >  9001 [ACK] Seq=13831453 Ack=251472255 Win=65535 Len=0
1,3.202772999999979,54.93.77.70,10.0.2.15,TLSv1.2,778,Application Data
1,3.2028159999999843,10.0.2.15,54.93.77.70,TCP,54,34692  >  9001 [ACK] Seq=13831453 Ack=251472979 Win=65535 Len=0
1,3.2208369999998467,54.93.77.70,10.0.2.15,TCP,2950,"9001  >  34692 [PSH, ACK] Seq=251472979 Ack=13831453 Win=65535 Len=2896 [TCP segment of a reassembled PDU]"
1,3.2209179999999833,10.0.2.15,54.93.77.70,TCP,54,34692  >  9001 [ACK] Seq=13831453 Ack=251475875 Win=65535 Len=0
1,3.221258000000489,54.93.77.70,10.0.2.15,TLSv1.2,778,Application Data
1,3.2213000000001557,10.0.2.15,54.93.77.70,TCP,54,34692  >  9001 [ACK] Seq=13831453 Ack=251476599 Win=65535 Len=0
1,3.2309110000005603,54.93.77.70,10.0.2.15,TLSv1.2,7294,Application Data
1,3.230967000000419,10.0.2.15,54.93.77.70,TCP,54,34692  >  9001 [ACK] Seq=13831453 Ack=251483839 Win=65535 Len=0
1,3.237162000000353,54.93.77.70,10.0.2.15,TLSv1.2,1104,"Application Data, Application Data"
1,3.2372040000000197,10.0.2.15,54.93.77.70,TCP,54,34692  >  9001 [ACK] Seq=13831453 Ack=251484889 Win=65535 Len=0
1,3.249649999999747,54.93.77.70,10.0.2.15,TCP,2950,"9001  >  34692 [PSH, ACK] Seq=251484889 Ack=13831453 Win=65535 Len=2896 [TCP segment of a reassembled PDU]"
1,3.249692999999752,10.0.2.15,54.93.77.70,TCP,54,34692  >  9001 [ACK] Seq=13831453 Ack=251487785 Win=65535 Len=0
1,3.253276999999798,54.93.77.70,10.0.2.15,TLSv1.2,778,Application Data
1,3.253316999999697,10.0.2.15,54.93.77.70,TCP,54,34692  >  9001 [ACK] Seq=13831453 Ack=251488509 Win=65535 Len=0
1,3.270524000000478,54.93.77.70,10.0.2.15,TCP,1502,"9001  >  34692 [PSH, ACK] Seq=251488509 Ack=13831453 Win=65535 Len=1448 [TCP segment of a reassembled PDU]"
1,3.2705720000003566,10.0.2.15,54.93.77.70,TCP,54,34692  >  9001 [ACK] Seq=13831453 Ack=251489957 Win=65535 Len=0
1,3.2706630000002406,54.93.77.70,10.0.2.15,TLSv1.2,170,Application Data
1,3.270698999999695,10.0.2.15,54.93.77.70,TCP,54,34692  >  9001 [ACK] Seq=13831453 Ack=251490073 Win=65535 Len=0
1,3.2730209999999715,10.0.2.15,54.93.77.70,TLSv1.2,590,Application Data
1,3.273175000000265,54.93.77.70,10.0.2.15,TCP,60,9001  >  34692 [ACK] Seq=251490073 Ack=13831989 Win=65535 Len=0
1,3.4284850000003644,62.210.85.178,10.0.2.15,TLSv1.2,590,Application Data
1,3.4289880000005724,10.0.2.15,62.210.85.178,TLSv1.2,590,Application Data
1,3.429102000000057,62.210.85.178,10.0.2.15,TCP,60,9001  >  35978 [ACK] Seq=13742779 Ack=251575821 Win=65535 Len=0
1,3.6344660000004296,54.93.77.70,10.0.2.15,TLSv1.2,590,Application Data
1,3.6348470000002635,10.0.2.15,54.93.77.70,TLSv1.2,590,Application Data
1,3.6349580000005517,54.93.77.70,10.0.2.15,TCP,60,9001  >  34692 [ACK] Seq=251490609 Ack=13832525 Win=65535 Len=0
1,3.838843999999881,62.210.85.178,10.0.2.15,TLSv1.2,590,Application Data
1,3.8416809999998804,10.0.2.15,62.210.85.178,TLSv1.2,590,Application Data
1,3.8418480000000272,62.210.85.178,10.0.2.15,TCP,60,9001  >  35978 [ACK] Seq=13743315 Ack=251576357 Win=65535 Len=0
1,3.8520410000000993,10.0.2.15,62.210.85.178,TLSv1.2,4124,Application Data
1,3.8521810000002006,10.0.2.15,62.210.85.178,TCP,1514,35978  >  9001 [ACK] Seq=251580427 Ack=13743315 Win=65535 Len=1460 [TCP segment of a reassembled PDU]
1,3.852563000000373,62.210.85.178,10.0.2.15,TCP,60,9001  >  35978 [ACK] Seq=13743315 Ack=251577817 Win=65535 Len=0
1,3.8525790000003326,62.210.85.178,10.0.2.15,TCP,60,9001  >  35978 [ACK] Seq=13743315 Ack=251579277 Win=65535 Len=0
1,3.8525820000004387,62.210.85.178,10.0.2.15,TCP,60,9001  >  35978 [ACK] Seq=13743315 Ack=251580427 Win=65535 Len=0
1,3.852585000000545,62.210.85.178,10.0.2.15,TCP,60,9001  >  35978 [ACK] Seq=13743315 Ack=251581887 Win=65535 Len=0
1,3.852636999999959,10.0.2.15,62.210.85.178,TLSv1.2,222,Application Data
1,3.8526849999998376,62.210.85.178,10.0.2.15,TCP,60,9001  >  35978 [ACK] Seq=13743315 Ack=251582055 Win=65535 Len=0
1,3.9592010000005757,54.93.77.70,10.0.2.15,TLSv1.2,590,Application Data
1,3.9699099999997998,54.93.77.70,10.0.2.15,TCP,2950,"9001  >  34692 [PSH, ACK] Seq=251491145 Ack=13832525 Win=65535 Len=2896 [TCP segment of a reassembled PDU]"
1,3.9699499999996988,54.93.77.70,10.0.2.15,TLSv1.2,1502,Application Data [TCP segment of a reassembled PDU]
1,3.97004300000026,10.0.2.15,54.93.77.70,TCP,54,34692  >  9001 [ACK] Seq=13832525 Ack=251495489 Win=65535 Len=0
1,3.9848990000000413,54.93.77.70,10.0.2.15,TLSv1.2,1408,Application Data
1,3.9872450000002573,10.0.2.15,54.93.77.70,TLSv1.2,590,Application Data
1,3.9874140000001717,54.93.77.70,10.0.2.15,TCP,60,9001  >  34692 [ACK] Seq=251496843 Ack=13833061 Win=65535 Len=0
1,4.247550000000047,62.210.85.178,10.0.2.15,TLSv1.2,590,Application Data
1,4.247887000000446,10.0.2.15,62.210.85.178,TLSv1.2,590,Application Data
1,4.248018000000229,62.210.85.178,10.0.2.15,TCP,60,9001  >  35978 [ACK] Seq=13743851 Ack=251582591 Win=65535 Len=0
1,4.361963000000287,54.93.77.70,10.0.2.15,TLSv1.2,590,Application Data
1,4.362334999999803,10.0.2.15,54.93.77.70,TLSv1.2,590,Application Data
1,4.36243900000045,54.93.77.70,10.0.2.15,TCP,60,9001  >  34692 [ACK] Seq=251497379 Ack=13833597 Win=65535 Len=0
1,4.4685120000003735,62.210.85.178,10.0.2.15,TLSv1.2,590,Application Data
1,4.472651000000042,10.0.2.15,62.210.85.178,TLSv1.2,590,Application Data
1,4.472829999999703,62.210.85.178,10.0.2.15,TCP,60,9001  >  35978 [ACK] Seq=13744387 Ack=251583127 Win=65535 Len=0
1,4.484096000000136,10.0.2.15,62.210.85.178,TLSv1.2,4124,Application Data
1,4.484204999999747,10.0.2.15,62.210.85.178,TCP,2974,35978  >  9001 [ACK] Seq=251587197 Ack=13744387 Win=65535 Len=2920 [TCP segment of a reassembled PDU]
1,4.4842570000000705,62.210.85.178,10.0.2.15,TCP,60,9001  >  35978 [ACK] Seq=13744387 Ack=251584587 Win=65535 Len=0
1,4.484269000000495,62.210.85.178,10.0.2.15,TCP,60,9001  >  35978 [ACK] Seq=13744387 Ack=251586047 Win=65535 Len=0
1,4.484274000000369,62.210.85.178,10.0.2.15,TCP,60,9001  >  35978 [ACK] Seq=13744387 Ack=251587197 Win=65535 Len=0
1,4.484317000000374,10.0.2.15,62.210.85.178,TLSv1.2,1204,Application Data
1,4.484355999999934,62.210.85.178,10.0.2.15,TCP,60,9001  >  35978 [ACK] Seq=13744387 Ack=251588657 Win=65535 Len=0
1,4.484363999999914,62.210.85.178,10.0.2.15,TCP,60,9001  >  35978 [ACK] Seq=13744387 Ack=251590117 Win=65535 Len=0
1,4.48436700000002,62.210.85.178,10.0.2.15,TCP,60,9001  >  35978 [ACK] Seq=13744387 Ack=251591267 Win=65535 Len=0
1,4.484409000000596,10.0.2.15,62.210.85.178,TLSv1.2,4124,Application Data
1,4.484448000000157,62.210.85.178,10.0.2.15,TCP,60,9001  >  35978 [ACK] Seq=13744387 Ack=251592727 Win=65535 Len=0
1,4.4844560000001366,62.210.85.178,10.0.2.15,TCP,60,9001  >  35978 [ACK] Seq=13744387 Ack=251594187 Win=65535 Len=0
1,4.48446100000001,62.210.85.178,10.0.2.15,TCP,60,9001  >  35978 [ACK] Seq=13744387 Ack=251595337 Win=65535 Len=0
1,4.484504000000015,10.0.2.15,62.210.85.178,TLSv1.2,4124,Application Data
1,4.4845860000004905,62.210.85.178,10.0.2.15,TCP,60,9001  >  35978 [ACK] Seq=13744387 Ack=251596797 Win=65535 Len=0
1,4.484598000000005,62.210.85.178,10.0.2.15,TCP,60,9001  >  35978 [ACK] Seq=13744387 Ack=251598257 Win=65535 Len=0
1,4.484602999999879,62.210.85.178,10.0.2.15,TCP,60,9001  >  35978 [ACK] Seq=13744387 Ack=251599407 Win=65535 Len=0
1,4.484631000000263,10.0.2.15,62.210.85.178,TLSv1.2,332,Application Data
1,4.484669999999824,62.210.85.178,10.0.2.15,TCP,60,9001  >  35978 [ACK] Seq=13744387 Ack=251599685 Win=65535 Len=0
1,4.484715000000506,10.0.2.15,62.210.85.178,TLSv1.2,3868,Application Data
1,4.484755000000405,62.210.85.178,10.0.2.15,TCP,60,9001  >  35978 [ACK] Seq=13744387 Ack=251601145 Win=65535 Len=0
1,4.484762000000046,62.210.85.178,10.0.2.15,TCP,60,9001  >  35978 [ACK] Seq=13744387 Ack=251602605 Win=65535 Len=0
1,4.484766000000491,62.210.85.178,10.0.2.15,TCP,60,9001  >  35978 [ACK] Seq=13744387 Ack=251603499 Win=65535 Len=0
1,4.484803999999713,10.0.2.15,62.210.85.178,TLSv1.2,4124,Application Data
1,4.484843000000183,62.210.85.178,10.0.2.15,TCP,60,9001  >  35978 [ACK] Seq=13744387 Ack=251604959 Win=65535 Len=0
1,4.4848510000001625,62.210.85.178,10.0.2.15,TCP,60,9001  >  35978 [ACK] Seq=13744387 Ack=251606419 Win=65535 Len=0
1,4.484854999999698,62.210.85.178,10.0.2.15,TCP,60,9001  >  35978 [ACK] Seq=13744387 Ack=251607569 Win=65535 Len=0
1,4.484889999999723,10.0.2.15,62.210.85.178,TLSv1.2,3030,Application Data
1,4.484929000000193,62.210.85.178,10.0.2.15,TCP,60,9001  >  35978 [ACK] Seq=13744387 Ack=251609029 Win=65535 Len=0
1,4.484935999999834,62.210.85.178,10.0.2.15,TCP,60,9001  >  35978 [ACK] Seq=13744387 Ack=251610489 Win=65535 Len=0
1,4.484940000000279,62.210.85.178,10.0.2.15,TCP,60,9001  >  35978 [ACK] Seq=13744387 Ack=251610545 Win=65535 Len=0
1,4.496288000000277,10.0.2.15,62.210.85.178,TLSv1.2,4124,Application Data
1,4.496352000000115,62.210.85.178,10.0.2.15,TCP,60,9001  >  35978 [ACK] Seq=13744387 Ack=251612005 Win=65535 Len=0
1,4.496363000000201,62.210.85.178,10.0.2.15,TCP,60,9001  >  35978 [ACK] Seq=13744387 Ack=251613465 Win=65535 Len=0
1,4.496368000000075,62.210.85.178,10.0.2.15,TCP,60,9001  >  35978 [ACK] Seq=13744387 Ack=251614615 Win=65535 Len=0
1,4.496412000000419,10.0.2.15,62.210.85.178,TLSv1.2,3224,Application Data
1,4.496454000000085,62.210.85.178,10.0.2.15,TCP,60,9001  >  35978 [ACK] Seq=13744387 Ack=251616075 Win=65535 Len=0
1,4.4964630000004036,62.210.85.178,10.0.2.15,TCP,60,9001  >  35978 [ACK] Seq=13744387 Ack=251617535 Win=65535 Len=0
1,4.496468000000277,62.210.85.178,10.0.2.15,TCP,60,9001  >  35978 [ACK] Seq=13744387 Ack=251617785 Win=65535 Len=0
1,4.615632000000005,54.93.77.70,10.0.2.15,TLSv1.2,590,Application Data
1,4.650102999999945,54.93.77.70,10.0.2.15,TLSv1.2,10190,"Application Data, Application Data, Application Data, Application Data"
1,4.650172999999995,10.0.2.15,54.93.77.70,TCP,54,34692  >  9001 [ACK] Seq=13833597 Ack=251508051 Win=65535 Len=0
1,4.652965000000222,54.93.77.70,10.0.2.15,TLSv1.2,2950,Application Data [TCP segment of a reassembled PDU]
1,4.653008000000227,10.0.2.15,54.93.77.70,TCP,54,34692  >  9001 [ACK] Seq=13833597 Ack=251510947 Win=65535 Len=0
1,4.653151000000435,10.0.2.15,54.93.77.70,TLSv1.2,590,Application Data
1,4.653232000000571,54.93.77.70,10.0.2.15,TCP,60,9001  >  34692 [ACK] Seq=251510947 Ack=13834133 Win=65535 Len=0
1,4.67732100000012,54.93.77.70,10.0.2.15,TLSv1.2,2950,Application Data [TCP segment of a reassembled PDU]
1,4.677383000000191,10.0.2.15,54.93.77.70,TCP,54,34692  >  9001 [ACK] Seq=13834133 Ack=251513843 Win=65535 Len=0
1,4.679442000000563,54.93.77.70,10.0.2.15,TLSv1.2,7454,"Application Data, Application Data, Application Data"
1,4.679540000000088,10.0.2.15,54.93.77.70,TCP,54,34692  >  9001 [ACK] Seq=13834133 Ack=251521243 Win=65535 Len=0
1,4.682617000000391,54.93.77.70,10.0.2.15,TCP,2950,"9001  >  34692 [PSH, ACK] Seq=251521243 Ack=13834133 Win=65535 Len=2896 [TCP segment of a reassembled PDU]"
1,4.6826630000005025,10.0.2.15,54.93.77.70,TCP,54,34692  >  9001 [ACK] Seq=13834133 Ack=251524139 Win=65535 Len=0
1,4.683288000000175,54.93.77.70,10.0.2.15,TLSv1.2,7294,"Application Data, Application Data"
1,4.6833510000005845,10.0.2.15,54.93.77.70,TCP,54,34692  >  9001 [ACK] Seq=13834133 Ack=251531379 Win=65535 Len=0
1,4.683495000000221,10.0.2.15,54.93.77.70,TLSv1.2,590,Application Data
1,4.683557000000292,54.93.77.70,10.0.2.15,TCP,60,9001  >  34692 [ACK] Seq=251531379 Ack=13834669 Win=65535 Len=0
1,4.699091999999837,54.93.77.70,10.0.2.15,TLSv1.2,1292,Application Data
1,4.701369000000341,10.0.2.15,54.93.77.70,TLSv1.2,590,Application Data
1,4.701532000000043,54.93.77.70,10.0.2.15,TCP,60,9001  >  34692 [ACK] Seq=251532617 Ack=13835205 Win=65535 Len=0
1,4.8234339999999065,62.210.85.178,10.0.2.15,TLSv1.2,590,Application Data
1,4.8634970000002795,10.0.2.15,62.210.85.178,TCP,54,35978  >  9001 [ACK] Seq=251617785 Ack=13744923 Win=65535 Len=0
1,4.95442600000024,62.210.85.178,10.0.2.15,TLSv1.2,590,Application Data
1,4.954518000000462,10.0.2.15,62.210.85.178,TCP,54,35978  >  9001 [ACK] Seq=251617785 Ack=13745459 Win=65535 Len=0
1,4.9897289999998975,62.210.85.178,10.0.2.15,TLSv1.2,590,Application Data
1,4.989810000000034,10.0.2.15,62.210.85.178,TCP,54,35978  >  9001 [ACK] Seq=251617785 Ack=13745995 Win=65535 Len=0
1,4.990076000000045,10.0.2.15,62.210.85.178,TLSv1.2,590,Application Data
1,4.990176000000247,62.210.85.178,10.0.2.15,TCP,60,9001  >  35978 [ACK] Seq=13745995 Ack=251618321 Win=65535 Len=0
1,5.170667000000321,54.93.77.70,10.0.2.15,TLSv1.2,590,Application Data
1,5.171100000000479,10.0.2.15,54.93.77.70,TLSv1.2,590,Application Data
1,5.171242000000348,54.93.77.70,10.0.2.15,TCP,60,9001  >  34692 [ACK] Seq=251533153 Ack=13835741 Win=65535 Len=0
1,5.298762999999781,62.210.85.178,10.0.2.15,TLSv1.2,590,Application Data
1,5.303617999999915,10.0.2.15,62.210.85.178,TLSv1.2,590,Application Data
1,5.303801000000021,62.210.85.178,10.0.2.15,TCP,60,9001  >  35978 [ACK] Seq=13746531 Ack=251618857 Win=65535 Len=0
1,5.316232000000127,10.0.2.15,62.210.85.178,TLSv1.2,4124,Application Data
1,5.31637899999987,62.210.85.178,10.0.2.15,TCP,60,9001  >  35978 [ACK] Seq=13746531 Ack=251620317 Win=65535 Len=0
1,5.316399000000274,62.210.85.178,10.0.2.15,TCP,60,9001  >  35978 [ACK] Seq=13746531 Ack=251621777 Win=65535 Len=0
1,5.316404000000148,62.210.85.178,10.0.2.15,TCP,60,9001  >  35978 [ACK] Seq=13746531 Ack=251622927 Win=65535 Len=0
1,5.316471000000092,10.0.2.15,62.210.85.178,TLSv1.2,4124,Application Data
1,5.3165420000004815,10.0.2.15,62.210.85.178,TCP,2974,35978  >  9001 [ACK] Seq=251626997 Ack=13746531 Win=65535 Len=2920 [TCP segment of a reassembled PDU]
1,5.3165820000003805,62.210.85.178,10.0.2.15,TCP,60,9001  >  35978 [ACK] Seq=13746531 Ack=251624387 Win=65535 Len=0
1,5.316589000000022,62.210.85.178,10.0.2.15,TCP,60,9001  >  35978 [ACK] Seq=13746531 Ack=251625847 Win=65535 Len=0
1,5.316593000000466,62.210.85.178,10.0.2.15,TCP,60,9001  >  35978 [ACK] Seq=13746531 Ack=251626997 Win=65535 Len=0
1,5.31659800000034,62.210.85.178,10.0.2.15,TCP,60,9001  >  35978 [ACK] Seq=13746531 Ack=251628457 Win=65535 Len=0
1,5.31660600000032,62.210.85.178,10.0.2.15,TCP,60,9001  >  35978 [ACK] Seq=13746531 Ack=251629917 Win=65535 Len=0
1,5.316646000000219,10.0.2.15,62.210.85.178,TLSv1.2,1204,Application Data
1,5.316711999999825,10.0.2.15,62.210.85.178,TCP,2974,35978  >  9001 [ACK] Seq=251631067 Ack=13746531 Win=65535 Len=2920 [TCP segment of a reassembled PDU]
1,5.316749999999956,62.210.85.178,10.0.2.15,TCP,60,9001  >  35978 [ACK] Seq=13746531 Ack=251631067 Win=65535 Len=0
1,5.316756000000169,62.210.85.178,10.0.2.15,TCP,60,9001  >  35978 [ACK] Seq=13746531 Ack=251632527 Win=65535 Len=0
1,5.316761000000042,62.210.85.178,10.0.2.15,TCP,60,9001  >  35978 [ACK] Seq=13746531 Ack=251633987 Win=65535 Len=0
1,5.316794999999729,10.0.2.15,62.210.85.178,TLSv1.2,1204,Application Data
1,5.316906000000017,62.210.85.178,10.0.2.15,TCP,60,9001  >  35978 [ACK] Seq=13746531 Ack=251635137 Win=65535 Len=0
1,5.316947000000255,10.0.2.15,62.210.85.178,TLSv1.2,868,"Application Data, Application Data"
1,5.317052000000331,62.210.85.178,10.0.2.15,TCP,60,9001  >  35978 [ACK] Seq=13746531 Ack=251635951 Win=65535 Len=0
1,5.432558999999856,54.93.77.70,10.0.2.15,TLSv1.2,590,Application Data
1,5.45948800000042,54.93.77.70,10.0.2.15,TCP,2950,"9001  >  34692 [PSH, ACK] Seq=251533689 Ack=13835741 Win=65535 Len=2896 [TCP segment of a reassembled PDU]"
1,5.459635000000162,10.0.2.15,54.93.77.70,TCP,54,34692  >  9001 [ACK] Seq=13835741 Ack=251536585 Win=65535 Len=0
1,5.460113000000092,54.93.77.70,10.0.2.15,TLSv1.2,4398,Application Data [TCP segment of a reassembled PDU]
1,5.460160000000542,10.0.2.15,54.93.77.70,TCP,54,34692  >  9001 [ACK] Seq=13835741 Ack=251540929 Win=65535 Len=0
1,5.480776999999762,54.93.77.70,10.0.2.15,TLSv1.2,568,Application Data
1,5.48700000000008,54.93.77.70,10.0.2.15,TCP,2950,"9001  >  34692 [PSH, ACK] Seq=251541443 Ack=13835741 Win=65535 Len=2896 [TCP segment of a reassembled PDU]"
1,5.487111999999797,10.0.2.15,54.93.77.70,TCP,54,34692  >  9001 [ACK] Seq=13835741 Ack=251544339 Win=65535 Len=0
1,5.50557900000058,54.93.77.70,10.0.2.15,TLSv1.2,2950,Application Data [TCP segment of a reassembled PDU]
1,5.505664000000252,10.0.2.15,54.93.77.70,TCP,54,34692  >  9001 [ACK] Seq=13835741 Ack=251547235 Win=65535 Len=0
1,5.505715000000237,54.93.77.70,10.0.2.15,TLSv1.2,1502,Application Data
1,5.505779000000075,10.0.2.15,54.93.77.70,TCP,54,34692  >  9001 [ACK] Seq=13835741 Ack=251548683 Win=65535 Len=0
1,5.518825000000106,54.93.77.70,10.0.2.15,TLSv1.2,2132,Application Data
1,5.518931000000521,10.0.2.15,54.93.77.70,TCP,54,34692  >  9001 [ACK] Seq=13835741 Ack=251550761 Win=65535 Len=0
1,5.521638000000166,10.0.2.15,54.93.77.70,TLSv1.2,590,Application Data
1,5.5218150000000605,54.93.77.70,10.0.2.15,TCP,60,9001  >  34692 [ACK] Seq=251550761 Ack=13836277 Win=65535 Len=0
1,5.681166999999732,62.210.85.178,10.0.2.15,TLSv1.2,590,Application Data
1,5.681653000000551,10.0.2.15,62.210.85.178,TLSv1.2,590,Application Data
1,5.681778000000122,62.210.85.178,10.0.2.15,TCP,60,9001  >  35978 [ACK] Seq=13747067 Ack=251636487 Win=65535 Len=0
1,6.091957999999977,54.93.77.70,10.0.2.15,TLSv1.2,590,Application Data
1,6.092329000000063,10.0.2.15,54.93.77.70,TLSv1.2,590,Application Data
1,6.092435999999907,54.93.77.70,10.0.2.15,TCP,60,9001  >  34692 [ACK] Seq=251551297 Ack=13836813 Win=65535 Len=0
1,6.705617999999959,62.210.85.178,10.0.2.15,TLSv1.2,590,Application Data
1,6.7104129999997895,10.0.2.15,62.210.85.178,TLSv1.2,590,Application Data
1,6.710594000000128,62.210.85.178,10.0.2.15,TCP,60,9001  >  35978 [ACK] Seq=13747603 Ack=251637023 Win=65535 Len=0
