No.,Time,Source,Destination,Protocol,Length,Info
1,0.06041599999934988,54.93.77.70,10.0.2.15,TLSv1.2,590,Application Data
1,0.10554599999977654,10.0.2.15,54.93.77.70,TCP,54,34692  >  9001 [ACK] Seq=13934637 Ack=253519765 Win=65535 Len=0
1,0.11486100000001898,62.210.85.178,10.0.2.15,TLSv1.2,590,Application Data
1,0.11496099999931175,10.0.2.15,62.210.85.178,TCP,54,35978  >  9001 [ACK] Seq=253604075 Ack=13845031 Win=65535 Len=0
1,0.15030399999977817,10.0.2.15,54.93.77.70,TLSv1.2,590,Application Data
1,0.15049599999929342,54.93.77.70,10.0.2.15,TCP,60,9001  >  34692 [ACK] Seq=253519765 Ack=13935173 Win=65535 Len=0
1,0.4109199999993507,62.210.85.178,10.0.2.15,TLSv1.2,590,Application Data
1,0.4109969999999521,10.0.2.15,62.210.85.178,TCP,54,35978  >  9001 [ACK] Seq=253604075 Ack=13845567 Win=65535 Len=0
1,0.4114689999996699,10.0.2.15,62.210.85.178,TLSv1.2,590,Application Data
1,0.41157399999974587,62.210.85.178,10.0.2.15,TCP,60,9001  >  35978 [ACK] Seq=13845567 Ack=253604611 Win=65535 Len=0
1,0.5576499999997395,54.93.77.70,10.0.2.15,TLSv1.2,590,Application Data
1,0.5577309999998761,10.0.2.15,54.93.77.70,TCP,54,34692  >  9001 [ACK] Seq=13935173 Ack=253520301 Win=65535 Len=0
1,0.5581369999999879,10.0.2.15,54.93.77.70,TLSv1.2,1618,Application Data
1,0.5582509999994727,54.93.77.70,10.0.2.15,TCP,60,9001  >  34692 [ACK] Seq=253520301 Ack=13936633 Win=65535 Len=0
1,0.5582629999998971,54.93.77.70,10.0.2.15,TCP,60,9001  >  34692 [ACK] Seq=253520301 Ack=13936737 Win=65535 Len=0
1,0.7002429999993183,62.210.85.178,10.0.2.15,TLSv1.2,1618,Application Data
1,0.70036699999946,10.0.2.15,62.210.85.178,TCP,54,35978  >  9001 [ACK] Seq=253604611 Ack=13847131 Win=65535 Len=0
1,0.7137999999995372,10.0.2.15,62.210.85.178,TLSv1.2,590,Application Data
1,0.71397799999977,62.210.85.178,10.0.2.15,TCP,60,9001  >  35978 [ACK] Seq=13847131 Ack=253605147 Win=65535 Len=0
1,0.7267299999994066,10.0.2.15,62.210.85.178,TLSv1.2,1618,Application Data
1,0.7268659999999727,62.210.85.178,10.0.2.15,TCP,60,9001  >  35978 [ACK] Seq=13847131 Ack=253606607 Win=65535 Len=0
1,0.7268839999996999,62.210.85.178,10.0.2.15,TCP,60,9001  >  35978 [ACK] Seq=13847131 Ack=253606711 Win=65535 Len=0
1,0.879903000000013,54.93.77.70,10.0.2.15,TLSv1.2,590,Application Data
1,0.8854779999992388,54.93.77.70,10.0.2.15,TCP,1502,"9001  >  34692 [PSH, ACK] Seq=253520837 Ack=13936737 Win=65535 Len=1448 [TCP segment of a reassembled PDU]"
1,0.885574999999335,10.0.2.15,54.93.77.70,TCP,54,34692  >  9001 [ACK] Seq=13936737 Ack=253522285 Win=65535 Len=0
1,0.8978849999994054,54.93.77.70,10.0.2.15,TLSv1.2,170,Application Data
1,0.8980819999997038,10.0.2.15,54.93.77.70,TLSv1.2,590,Application Data
1,0.8981989999992948,54.93.77.70,10.0.2.15,TCP,60,9001  >  34692 [ACK] Seq=253522401 Ack=13937273 Win=65535 Len=0
1,0.9077959999995073,10.0.2.15,54.93.77.70,TLSv1.2,590,Application Data
1,0.90797399999974,54.93.77.70,10.0.2.15,TCP,60,9001  >  34692 [ACK] Seq=253522401 Ack=13937809 Win=65535 Len=0
1,1.0246989999996003,62.210.85.178,10.0.2.15,TLSv1.2,590,Application Data
1,1.0665099999996528,10.0.2.15,62.210.85.178,TCP,54,35978  >  9001 [ACK] Seq=253606711 Ack=13847667 Win=65535 Len=0
1,1.191345999999612,62.210.85.178,10.0.2.15,TLSv1.2,590,Application Data
1,1.1914349999997285,10.0.2.15,62.210.85.178,TCP,54,35978  >  9001 [ACK] Seq=253606711 Ack=13848203 Win=65535 Len=0
1,1.1918109999996886,10.0.2.15,62.210.85.178,TLSv1.2,590,Application Data
1,1.1919319999997242,62.210.85.178,10.0.2.15,TCP,60,9001  >  35978 [ACK] Seq=13848203 Ack=253607247 Win=65535 Len=0
1,1.4760579999992842,54.93.77.70,10.0.2.15,TLSv1.2,590,Application Data
1,1.4765639999995983,10.0.2.15,54.93.77.70,TLSv1.2,590,Application Data
1,1.4767039999996996,54.93.77.70,10.0.2.15,TCP,60,9001  >  34692 [ACK] Seq=253522937 Ack=13938345 Win=65535 Len=0
1,1.615114999999605,62.210.85.178,10.0.2.15,TLSv1.2,590,Application Data
1,1.6246979999996256,10.0.2.15,62.210.85.178,TLSv1.2,590,Application Data
1,1.6248839999998381,62.210.85.178,10.0.2.15,TCP,60,9001  >  35978 [ACK] Seq=13848739 Ack=253607783 Win=65535 Len=0
1,1.635534999999436,10.0.2.15,62.210.85.178,TLSv1.2,4124,Application Data
1,1.6356390000000829,10.0.2.15,62.210.85.178,TCP,2974,35978  >  9001 [ACK] Seq=253611853 Ack=13848739 Win=65535 Len=2920 [TCP segment of a reassembled PDU]
1,1.635682999999517,62.210.85.178,10.0.2.15,TCP,60,9001  >  35978 [ACK] Seq=13848739 Ack=253609243 Win=65535 Len=0
1,1.6356929999992644,62.210.85.178,10.0.2.15,TCP,60,9001  >  35978 [ACK] Seq=13848739 Ack=253610703 Win=65535 Len=0
1,1.6356989999994767,62.210.85.178,10.0.2.15,TCP,60,9001  >  35978 [ACK] Seq=13848739 Ack=253611853 Win=65535 Len=0
1,1.6357029999999213,62.210.85.178,10.0.2.15,TCP,60,9001  >  35978 [ACK] Seq=13848739 Ack=253613313 Win=65535 Len=0
1,1.6357069999994565,62.210.85.178,10.0.2.15,TCP,60,9001  >  35978 [ACK] Seq=13848739 Ack=253614773 Win=65535 Len=0
1,1.6357509999998001,10.0.2.15,62.210.85.178,TLSv1.2,1204,Application Data
1,1.6358449999997902,62.210.85.178,10.0.2.15,TCP,60,9001  >  35978 [ACK] Seq=13848739 Ack=253615923 Win=65535 Len=0
1,1.635906999999861,10.0.2.15,62.210.85.178,TLSv1.2,4124,Application Data
1,1.6360049999993862,62.210.85.178,10.0.2.15,TCP,60,9001  >  35978 [ACK] Seq=13848739 Ack=253617383 Win=65535 Len=0
1,1.6360179999992397,62.210.85.178,10.0.2.15,TCP,60,9001  >  35978 [ACK] Seq=13848739 Ack=253618843 Win=65535 Len=0
1,1.6360219999996843,62.210.85.178,10.0.2.15,TCP,60,9001  >  35978 [ACK] Seq=13848739 Ack=253619993 Win=65535 Len=0
1,1.6360729999996693,10.0.2.15,62.210.85.178,TLSv1.2,4124,Application Data
1,1.6361669999996593,62.210.85.178,10.0.2.15,TCP,60,9001  >  35978 [ACK] Seq=13848739 Ack=253621453 Win=65535 Len=0
1,1.6361749999996391,62.210.85.178,10.0.2.15,TCP,60,9001  >  35978 [ACK] Seq=13848739 Ack=253622913 Win=65535 Len=0
1,1.6361799999995128,62.210.85.178,10.0.2.15,TCP,60,9001  >  35978 [ACK] Seq=13848739 Ack=253624063 Win=65535 Len=0
1,1.636211999999432,10.0.2.15,62.210.85.178,TLSv1.2,2974,Application Data
1,1.6362679999992906,10.0.2.15,62.210.85.178,TLSv1.2,1226,Application Data
1,1.636302999999316,62.210.85.178,10.0.2.15,TCP,60,9001  >  35978 [ACK] Seq=13848739 Ack=253625523 Win=65535 Len=0
1,1.6363089999995282,62.210.85.178,10.0.2.15,TCP,60,9001  >  35978 [ACK] Seq=13848739 Ack=253626983 Win=65535 Len=0
1,1.6363139999994019,62.210.85.178,10.0.2.15,TCP,60,9001  >  35978 [ACK] Seq=13848739 Ack=253628155 Win=65535 Len=0
1,1.636359999999513,10.0.2.15,62.210.85.178,TLSv1.2,4124,Application Data
1,1.6364239999993515,10.0.2.15,62.210.85.178,TCP,2974,35978  >  9001 [ACK] Seq=253632225 Ack=13848739 Win=65535 Len=2920 [TCP segment of a reassembled PDU]
1,1.6364589999993768,62.210.85.178,10.0.2.15,TCP,60,9001  >  35978 [ACK] Seq=13848739 Ack=253629615 Win=65535 Len=0
1,1.6364659999999276,62.210.85.178,10.0.2.15,TCP,60,9001  >  35978 [ACK] Seq=13848739 Ack=253631075 Win=65535 Len=0
1,1.6364699999994627,62.210.85.178,10.0.2.15,TCP,60,9001  >  35978 [ACK] Seq=13848739 Ack=253632225 Win=65535 Len=0
1,1.6364739999999074,62.210.85.178,10.0.2.15,TCP,60,9001  >  35978 [ACK] Seq=13848739 Ack=253633685 Win=65535 Len=0
1,1.6364779999994425,62.210.85.178,10.0.2.15,TCP,60,9001  >  35978 [ACK] Seq=13848739 Ack=253635145 Win=65535 Len=0
1,1.636515999999574,10.0.2.15,62.210.85.178,TLSv1.2,110,Application Data
1,1.6366060000000289,62.210.85.178,10.0.2.15,TCP,60,9001  >  35978 [ACK] Seq=13848739 Ack=253635201 Win=65535 Len=0
1,1.6457239999999729,10.0.2.15,62.210.85.178,TLSv1.2,4124,Application Data
1,1.6458029999994324,10.0.2.15,62.210.85.178,TCP,2974,35978  >  9001 [ACK] Seq=253639271 Ack=13848739 Win=65535 Len=2920 [TCP segment of a reassembled PDU]
1,1.6458419999999023,62.210.85.178,10.0.2.15,TCP,60,9001  >  35978 [ACK] Seq=13848739 Ack=253636661 Win=65535 Len=0
1,1.6458499999998821,62.210.85.178,10.0.2.15,TCP,60,9001  >  35978 [ACK] Seq=13848739 Ack=253638121 Win=65535 Len=0
1,1.6458549999997558,62.210.85.178,10.0.2.15,TCP,60,9001  >  35978 [ACK] Seq=13848739 Ack=253639271 Win=65535 Len=0
1,1.6458929999998873,10.0.2.15,62.210.85.178,TLSv1.2,1204,Application Data
1,1.6459279999999126,62.210.85.178,10.0.2.15,TCP,60,9001  >  35978 [ACK] Seq=13848739 Ack=253640731 Win=65535 Len=0
1,1.6459349999995538,62.210.85.178,10.0.2.15,TCP,60,9001  >  35978 [ACK] Seq=13848739 Ack=253642191 Win=65535 Len=0
1,1.6459389999999985,62.210.85.178,10.0.2.15,TCP,60,9001  >  35978 [ACK] Seq=13848739 Ack=253643341 Win=65535 Len=0
1,1.6459859999995388,10.0.2.15,62.210.85.178,TLSv1.2,4124,Application Data
1,1.6460509999997157,10.0.2.15,62.210.85.178,TCP,2974,35978  >  9001 [ACK] Seq=253647411 Ack=13848739 Win=65535 Len=2920 [TCP segment of a reassembled PDU]
1,1.6460889999998471,62.210.85.178,10.0.2.15,TCP,60,9001  >  35978 [ACK] Seq=13848739 Ack=253644801 Win=65535 Len=0
1,1.6460959999994884,62.210.85.178,10.0.2.15,TCP,60,9001  >  35978 [ACK] Seq=13848739 Ack=253646261 Win=65535 Len=0
1,1.646099999999933,62.210.85.178,10.0.2.15,TCP,60,9001  >  35978 [ACK] Seq=13848739 Ack=253647411 Win=65535 Len=0
1,1.6461039999994682,62.210.85.178,10.0.2.15,TCP,60,9001  >  35978 [ACK] Seq=13848739 Ack=253648871 Win=65535 Len=0
1,1.6461079999999129,62.210.85.178,10.0.2.15,TCP,60,9001  >  35978 [ACK] Seq=13848739 Ack=253650331 Win=65535 Len=0
1,1.6461460000000443,10.0.2.15,62.210.85.178,TLSv1.2,1204,Application Data
1,1.6462400000000343,10.0.2.15,62.210.85.178,TLSv1.2,2974,Application Data
1,1.6462629999996352,62.210.85.178,10.0.2.15,TCP,60,9001  >  35978 [ACK] Seq=13848739 Ack=253651481 Win=65535 Len=0
1,1.6462979999996605,10.0.2.15,62.210.85.178,TLSv1.2,1226,Application Data
1,1.646347999999307,62.210.85.178,10.0.2.15,TCP,60,9001  >  35978 [ACK] Seq=13848739 Ack=253652941 Win=65535 Len=0
1,1.6463539999995191,62.210.85.178,10.0.2.15,TCP,60,9001  >  35978 [ACK] Seq=13848739 Ack=253654401 Win=65535 Len=0
1,1.6463589999993928,62.210.85.178,10.0.2.15,TCP,60,9001  >  35978 [ACK] Seq=13848739 Ack=253655573 Win=65535 Len=0
1,1.646443999999974,10.0.2.15,62.210.85.178,TLSv1.2,4124,Application Data
1,1.6464879999994082,62.210.85.178,10.0.2.15,TCP,60,9001  >  35978 [ACK] Seq=13848739 Ack=253657033 Win=65535 Len=0
1,1.646494999999959,62.210.85.178,10.0.2.15,TCP,60,9001  >  35978 [ACK] Seq=13848739 Ack=253658493 Win=65535 Len=0
1,1.6464999999998327,62.210.85.178,10.0.2.15,TCP,60,9001  >  35978 [ACK] Seq=13848739 Ack=253659643 Win=65535 Len=0
1,1.6465479999997115,10.0.2.15,62.210.85.178,TLSv1.2,3030,Application Data
1,1.6465879999996105,62.210.85.178,10.0.2.15,TCP,60,9001  >  35978 [ACK] Seq=13848739 Ack=253661103 Win=65535 Len=0
1,1.6465949999992517,62.210.85.178,10.0.2.15,TCP,60,9001  >  35978 [ACK] Seq=13848739 Ack=253662563 Win=65535 Len=0
1,1.6465989999996964,62.210.85.178,10.0.2.15,TCP,60,9001  >  35978 [ACK] Seq=13848739 Ack=253662619 Win=65535 Len=0
1,1.6592139999993378,10.0.2.15,62.210.85.178,TLSv1.2,4124,Application Data
1,1.65931399999954,62.210.85.178,10.0.2.15,TCP,60,9001  >  35978 [ACK] Seq=13848739 Ack=253664079 Win=65535 Len=0
1,1.6593259999999646,62.210.85.178,10.0.2.15,TCP,60,9001  >  35978 [ACK] Seq=13848739 Ack=253665539 Win=65535 Len=0
1,1.6593290000000707,62.210.85.178,10.0.2.15,TCP,60,9001  >  35978 [ACK] Seq=13848739 Ack=253666689 Win=65535 Len=0
1,1.6593689999999697,10.0.2.15,62.210.85.178,TLSv1.2,4124,Application Data
1,1.6594079999995301,62.210.85.178,10.0.2.15,TCP,60,9001  >  35978 [ACK] Seq=13848739 Ack=253668149 Win=65535 Len=0
1,1.65941599999951,62.210.85.178,10.0.2.15,TCP,60,9001  >  35978 [ACK] Seq=13848739 Ack=253669609 Win=65535 Len=0
1,1.6594209999993836,62.210.85.178,10.0.2.15,TCP,60,9001  >  35978 [ACK] Seq=13848739 Ack=253670759 Win=65535 Len=0
1,1.659458999999515,10.0.2.15,62.210.85.178,TLSv1.2,3288,Application Data
1,1.659497999999985,62.210.85.178,10.0.2.15,TCP,60,9001  >  35978 [ACK] Seq=13848739 Ack=253672219 Win=65535 Len=0
1,1.6595059999999648,62.210.85.178,10.0.2.15,TCP,60,9001  >  35978 [ACK] Seq=13848739 Ack=253673679 Win=65535 Len=0
1,1.6595109999998385,62.210.85.178,10.0.2.15,TCP,60,9001  >  35978 [ACK] Seq=13848739 Ack=253673993 Win=65535 Len=0
1,1.7391009999992093,54.93.77.70,10.0.2.15,TCP,2950,"9001  >  34692 [PSH, ACK] Seq=253522937 Ack=13938345 Win=65535 Len=2896 [TCP segment of a reassembled PDU]"
1,1.7392089999993914,10.0.2.15,54.93.77.70,TCP,54,34692  >  9001 [ACK] Seq=13938345 Ack=253525833 Win=65535 Len=0
1,1.7403309999999692,54.93.77.70,10.0.2.15,TLSv1.2,778,Application Data
1,1.7698199999995268,54.93.77.70,10.0.2.15,TLSv1.2,7294,"Application Data, Application Data"
1,1.7699669999992693,10.0.2.15,54.93.77.70,TCP,54,34692  >  9001 [ACK] Seq=13938345 Ack=253533797 Win=65535 Len=0
1,1.7788879999998244,54.93.77.70,10.0.2.15,TLSv1.2,2950,Application Data [TCP segment of a reassembled PDU]
1,1.7789339999999356,10.0.2.15,54.93.77.70,TCP,54,34692  >  9001 [ACK] Seq=13938345 Ack=253536693 Win=65535 Len=0
1,1.7875409999996918,54.93.77.70,10.0.2.15,TLSv1.2,1314,Application Data
1,1.8304679999992004,10.0.2.15,54.93.77.70,TCP,54,34692  >  9001 [ACK] Seq=13938345 Ack=253537953 Win=65535 Len=0
1,1.8420369999994364,54.93.77.70,10.0.2.15,TLSv1.2,2950,Application Data
1,1.842094999999972,10.0.2.15,54.93.77.70,TCP,54,34692  >  9001 [ACK] Seq=13938345 Ack=253540849 Win=65535 Len=0
1,1.8511060000000725,54.93.77.70,10.0.2.15,TLSv1.2,2762,Application Data [TCP segment of a reassembled PDU]
1,1.8512069999997038,10.0.2.15,54.93.77.70,TCP,54,34692  >  9001 [ACK] Seq=13938345 Ack=253543557 Win=65535 Len=0
1,1.8512479999999414,54.93.77.70,10.0.2.15,TCP,1502,"9001  >  34692 [PSH, ACK] Seq=253543557 Ack=13938345 Win=65535 Len=1448 [TCP segment of a reassembled PDU]"
1,1.8512769999997545,10.0.2.15,54.93.77.70,TCP,54,34692  >  9001 [ACK] Seq=13938345 Ack=253545005 Win=65535 Len=0
1,1.8579289999997854,54.93.77.70,10.0.2.15,TLSv1.2,1502,Application Data [TCP segment of a reassembled PDU]
1,1.8580409999995027,10.0.2.15,54.93.77.70,TCP,54,34692  >  9001 [ACK] Seq=13938345 Ack=253546453 Win=65535 Len=0
1,1.8708269999997356,54.93.77.70,10.0.2.15,TLSv1.2,8156,"Application Data, Application Data, Application Data, Application Data"
1,1.8708969999997862,10.0.2.15,54.93.77.70,TCP,54,34692  >  9001 [ACK] Seq=13938345 Ack=253554555 Win=65535 Len=0
1,1.871206999999231,10.0.2.15,54.93.77.70,TLSv1.2,590,Application Data
1,1.871317999999519,54.93.77.70,10.0.2.15,TCP,60,9001  >  34692 [ACK] Seq=253554555 Ack=13938881 Win=65535 Len=0
1,1.8901149999992413,54.93.77.70,10.0.2.15,TCP,2950,"9001  >  34692 [PSH, ACK] Seq=253554555 Ack=13938881 Win=65535 Len=2896 [TCP segment of a reassembled PDU]"
1,1.8901679999999033,10.0.2.15,54.93.77.70,TCP,54,34692  >  9001 [ACK] Seq=13938881 Ack=253557451 Win=65535 Len=0
1,1.8912149999996473,54.93.77.70,10.0.2.15,TLSv1.2,778,Application Data
1,1.8979699999999866,54.93.77.70,10.0.2.15,TCP,1502,"9001  >  34692 [PSH, ACK] Seq=253558175 Ack=13938881 Win=65535 Len=1448 [TCP segment of a reassembled PDU]"
1,1.8980189999992945,10.0.2.15,54.93.77.70,TCP,54,34692  >  9001 [ACK] Seq=13938881 Ack=253559623 Win=65535 Len=0
1,1.9084469999997964,54.93.77.70,10.0.2.15,TLSv1.2,7294,"Application Data, Application Data"
1,1.9085199999999531,10.0.2.15,54.93.77.70,TCP,54,34692  >  9001 [ACK] Seq=13938881 Ack=253566863 Win=65535 Len=0
1,1.9107319999993706,54.93.77.70,10.0.2.15,TLSv1.2,170,Application Data
1,1.9209359999995286,54.93.77.70,10.0.2.15,TLSv1.2,5846,Application Data
1,1.9209929999997257,10.0.2.15,54.93.77.70,TCP,54,34692  >  9001 [ACK] Seq=13938881 Ack=253572771 Win=65535 Len=0
1,1.9210450000000492,54.93.77.70,10.0.2.15,TCP,1502,"9001  >  34692 [PSH, ACK] Seq=253572771 Ack=13938881 Win=65535 Len=1448 [TCP segment of a reassembled PDU]"
1,1.9210949999996956,10.0.2.15,54.93.77.70,TCP,54,34692  >  9001 [ACK] Seq=13938881 Ack=253574219 Win=65535 Len=0
1,1.928024999999252,54.93.77.70,10.0.2.15,TLSv1.2,568,Application Data
1,1.92818299999999,10.0.2.15,54.93.77.70,TLSv1.2,1104,Application Data
1,1.928263999999217,54.93.77.70,10.0.2.15,TCP,60,9001  >  34692 [ACK] Seq=253574733 Ack=13939931 Win=65535 Len=0
1,1.9400649999997768,54.93.77.70,10.0.2.15,TCP,2950,"9001  >  34692 [PSH, ACK] Seq=253574733 Ack=13939931 Win=65535 Len=2896 [TCP segment of a reassembled PDU]"
1,1.9401389999993626,10.0.2.15,54.93.77.70,TCP,54,34692  >  9001 [ACK] Seq=13939931 Ack=253577629 Win=65535 Len=0
1,1.9406439999993381,54.93.77.70,10.0.2.15,TLSv1.2,4398,"Application Data, Application Data"
1,1.940682999999808,10.0.2.15,54.93.77.70,TCP,54,34692  >  9001 [ACK] Seq=13939931 Ack=253581973 Win=65535 Len=0
1,1.9559199999994235,54.93.77.70,10.0.2.15,TCP,2950,"9001  >  34692 [PSH, ACK] Seq=253581973 Ack=13939931 Win=65535 Len=2896 [TCP segment of a reassembled PDU]"
1,1.9560209999999643,10.0.2.15,54.93.77.70,TCP,54,34692  >  9001 [ACK] Seq=13939931 Ack=253584869 Win=65535 Len=0
1,1.9566289999993387,54.93.77.70,10.0.2.15,TLSv1.2,4912,"Application Data, Application Data"
1,1.9567329999999856,10.0.2.15,54.93.77.70,TCP,54,34692  >  9001 [ACK] Seq=13939931 Ack=253589727 Win=65535 Len=0
1,1.959524999999303,10.0.2.15,54.93.77.70,TLSv1.2,590,Application Data
1,1.9596959999998944,54.93.77.70,10.0.2.15,TCP,60,9001  >  34692 [ACK] Seq=253589727 Ack=13940467 Win=65535 Len=0
1,2.0009829999999056,62.210.85.178,10.0.2.15,TLSv1.2,590,Application Data
1,2.037117999999282,62.210.85.178,10.0.2.15,TLSv1.2,1104,Application Data
1,2.0372019999995246,10.0.2.15,62.210.85.178,TCP,54,35978  >  9001 [ACK] Seq=253673993 Ack=13850325 Win=65535 Len=0
1,2.0972579999997834,62.210.85.178,10.0.2.15,TLSv1.2,590,Application Data
1,2.0975879999996323,10.0.2.15,62.210.85.178,TLSv1.2,590,Application Data
1,2.097711999999774,62.210.85.178,10.0.2.15,TCP,60,9001  >  35978 [ACK] Seq=13850861 Ack=253674529 Win=65535 Len=0
1,2.2050799999997253,54.93.77.70,10.0.2.15,TLSv1.2,590,Application Data
1,2.2055159999999887,10.0.2.15,54.93.77.70,TLSv1.2,590,Application Data
1,2.2056589999992866,54.93.77.70,10.0.2.15,TCP,60,9001  >  34692 [ACK] Seq=253590263 Ack=13941003 Win=65535 Len=0
1,2.5896020000000135,62.210.85.178,10.0.2.15,TLSv1.2,590,Application Data
1,2.594654999999875,10.0.2.15,62.210.85.178,TLSv1.2,590,Application Data
1,2.594808999999259,62.210.85.178,10.0.2.15,TCP,60,9001  >  35978 [ACK] Seq=13851397 Ack=253675065 Win=65535 Len=0
1,2.6072449999992386,10.0.2.15,62.210.85.178,TLSv1.2,4124,Application Data
1,2.60732999999982,10.0.2.15,62.210.85.178,TCP,2974,35978  >  9001 [ACK] Seq=253679135 Ack=13851397 Win=65535 Len=2920 [TCP segment of a reassembled PDU]
1,2.6073710000000574,62.210.85.178,10.0.2.15,TCP,60,9001  >  35978 [ACK] Seq=13851397 Ack=253676525 Win=65535 Len=0
1,2.607381999999234,62.210.85.178,10.0.2.15,TCP,60,9001  >  35978 [ACK] Seq=13851397 Ack=253677985 Win=65535 Len=0
1,2.6073859999996785,62.210.85.178,10.0.2.15,TCP,60,9001  >  35978 [ACK] Seq=13851397 Ack=253679135 Win=65535 Len=0
1,2.6073889999997846,62.210.85.178,10.0.2.15,TCP,60,9001  >  35978 [ACK] Seq=13851397 Ack=253680595 Win=65535 Len=0
1,2.6073919999998907,62.210.85.178,10.0.2.15,TCP,60,9001  >  35978 [ACK] Seq=13851397 Ack=253682055 Win=65535 Len=0
1,2.6074259999995775,10.0.2.15,62.210.85.178,TLSv1.2,1204,Application Data
1,2.607458999999835,62.210.85.178,10.0.2.15,TCP,60,9001  >  35978 [ACK] Seq=13851397 Ack=253683205 Win=65535 Len=0
1,2.6075029999992694,10.0.2.15,62.210.85.178,TLSv1.2,4124,Application Data
1,2.6075379999992947,62.210.85.178,10.0.2.15,TCP,60,9001  >  35978 [ACK] Seq=13851397 Ack=253684665 Win=65535 Len=0
1,2.6075459999992745,62.210.85.178,10.0.2.15,TCP,60,9001  >  35978 [ACK] Seq=13851397 Ack=253686125 Win=65535 Len=0
1,2.607549999999719,62.210.85.178,10.0.2.15,TCP,60,9001  >  35978 [ACK] Seq=13851397 Ack=253687275 Win=65535 Len=0
1,2.607586999999512,10.0.2.15,62.210.85.178,TLSv1.2,4124,Application Data
1,2.60761999999977,62.210.85.178,10.0.2.15,TCP,60,9001  >  35978 [ACK] Seq=13851397 Ack=253688735 Win=65535 Len=0
1,2.6076279999997496,62.210.85.178,10.0.2.15,TCP,60,9001  >  35978 [ACK] Seq=13851397 Ack=253690195 Win=65535 Len=0
1,2.607680999999502,10.0.2.15,62.210.85.178,TLSv1.2,2974,Application Data
1,2.607716999999866,62.210.85.178,10.0.2.15,TCP,60,9001  >  35978 [ACK] Seq=13851397 Ack=253691345 Win=65535 Len=0
1,2.6077249999998457,62.210.85.178,10.0.2.15,TCP,60,9001  >  35978 [ACK] Seq=13851397 Ack=253692805 Win=65535 Len=0
1,2.607727999999952,62.210.85.178,10.0.2.15,TCP,60,9001  >  35978 [ACK] Seq=13851397 Ack=253694265 Win=65535 Len=0
1,2.6077549999999974,10.0.2.15,62.210.85.178,TLSv1.2,1226,Application Data
1,2.6077879999993456,62.210.85.178,10.0.2.15,TCP,60,9001  >  35978 [ACK] Seq=13851397 Ack=253695437 Win=65535 Len=0
1,2.6078279999992446,10.0.2.15,62.210.85.178,TLSv1.2,4124,Application Data
1,2.60786299999927,62.210.85.178,10.0.2.15,TCP,60,9001  >  35978 [ACK] Seq=13851397 Ack=253696897 Win=65535 Len=0
1,2.607868999999482,62.210.85.178,10.0.2.15,TCP,60,9001  >  35978 [ACK] Seq=13851397 Ack=253698357 Win=65535 Len=0
1,2.6078719999995883,62.210.85.178,10.0.2.15,TCP,60,9001  >  35978 [ACK] Seq=13851397 Ack=253699507 Win=65535 Len=0
1,2.607907999999952,10.0.2.15,62.210.85.178,TLSv1.2,3030,Application Data
1,2.6079429999999775,62.210.85.178,10.0.2.15,TCP,60,9001  >  35978 [ACK] Seq=13851397 Ack=253700967 Win=65535 Len=0
1,2.60794899999928,62.210.85.178,10.0.2.15,TCP,60,9001  >  35978 [ACK] Seq=13851397 Ack=253702427 Win=65535 Len=0
1,2.6079519999993863,62.210.85.178,10.0.2.15,TCP,60,9001  >  35978 [ACK] Seq=13851397 Ack=253702483 Win=65535 Len=0
1,2.6171699999995326,10.0.2.15,62.210.85.178,TLSv1.2,4124,Application Data
1,2.6172669999996288,62.210.85.178,10.0.2.15,TCP,60,9001  >  35978 [ACK] Seq=13851397 Ack=253703943 Win=65535 Len=0
1,2.617276999999376,62.210.85.178,10.0.2.15,TCP,60,9001  >  35978 [ACK] Seq=13851397 Ack=253705403 Win=65535 Len=0
1,2.6172799999994822,62.210.85.178,10.0.2.15,TCP,60,9001  >  35978 [ACK] Seq=13851397 Ack=253706553 Win=65535 Len=0
1,2.6173220000000583,10.0.2.15,62.210.85.178,TLSv1.2,4124,Application Data
1,2.6173730000000432,62.210.85.178,10.0.2.15,TCP,60,9001  >  35978 [ACK] Seq=13851397 Ack=253708013 Win=65535 Len=0
1,2.6173799999996845,62.210.85.178,10.0.2.15,TCP,60,9001  >  35978 [ACK] Seq=13851397 Ack=253709473 Win=65535 Len=0
1,2.6173829999997906,62.210.85.178,10.0.2.15,TCP,60,9001  >  35978 [ACK] Seq=13851397 Ack=253710623 Win=65535 Len=0
1,2.6174199999995835,10.0.2.15,62.210.85.178,TLSv1.2,4124,Application Data
1,2.617454999999609,62.210.85.178,10.0.2.15,TCP,60,9001  >  35978 [ACK] Seq=13851397 Ack=253712083 Win=65535 Len=0
1,2.61746199999925,62.210.85.178,10.0.2.15,TCP,60,9001  >  35978 [ACK] Seq=13851397 Ack=253713543 Win=65535 Len=0
1,2.6174659999996948,62.210.85.178,10.0.2.15,TCP,60,9001  >  35978 [ACK] Seq=13851397 Ack=253714693 Win=65535 Len=0
1,2.61750099999972,10.0.2.15,62.210.85.178,TLSv1.2,4124,Application Data
1,2.617533999999978,62.210.85.178,10.0.2.15,TCP,60,9001  >  35978 [ACK] Seq=13851397 Ack=253716153 Win=65535 Len=0
1,2.6175419999999576,62.210.85.178,10.0.2.15,TCP,60,9001  >  35978 [ACK] Seq=13851397 Ack=253717613 Win=65535 Len=0
1,2.617545999999493,62.210.85.178,10.0.2.15,TCP,60,9001  >  35978 [ACK] Seq=13851397 Ack=253718763 Win=65535 Len=0
1,2.6175799999991796,10.0.2.15,62.210.85.178,TLSv1.2,332,Application Data
1,2.617613999999776,62.210.85.178,10.0.2.15,TCP,60,9001  >  35978 [ACK] Seq=13851397 Ack=253719041 Win=65535 Len=0
1,2.6176699999996345,10.0.2.15,62.210.85.178,TLSv1.2,3868,Application Data
1,2.6177069999994274,62.210.85.178,10.0.2.15,TCP,60,9001  >  35978 [ACK] Seq=13851397 Ack=253720501 Win=65535 Len=0
1,2.617713999999978,62.210.85.178,10.0.2.15,TCP,60,9001  >  35978 [ACK] Seq=13851397 Ack=253721961 Win=65535 Len=0
1,2.6177170000000842,62.210.85.178,10.0.2.15,TCP,60,9001  >  35978 [ACK] Seq=13851397 Ack=253722855 Win=65535 Len=0
1,2.617753999999877,10.0.2.15,62.210.85.178,TLSv1.2,4124,Application Data
1,2.617787999999564,62.210.85.178,10.0.2.15,TCP,60,9001  >  35978 [ACK] Seq=13851397 Ack=253724315 Win=65535 Len=0
1,2.617794999999205,62.210.85.178,10.0.2.15,TCP,60,9001  >  35978 [ACK] Seq=13851397 Ack=253725775 Win=65535 Len=0
1,2.6177979999993113,62.210.85.178,10.0.2.15,TCP,60,9001  >  35978 [ACK] Seq=13851397 Ack=253726925 Win=65535 Len=0
1,2.6178329999993366,10.0.2.15,62.210.85.178,TLSv1.2,3030,Application Data
1,2.617866999999933,62.210.85.178,10.0.2.15,TCP,60,9001  >  35978 [ACK] Seq=13851397 Ack=253728385 Win=65535 Len=0
1,2.617873999999574,62.210.85.178,10.0.2.15,TCP,60,9001  >  35978 [ACK] Seq=13851397 Ack=253729845 Win=65535 Len=0
1,2.6178769999996803,62.210.85.178,10.0.2.15,TCP,60,9001  >  35978 [ACK] Seq=13851397 Ack=253729901 Win=65535 Len=0
1,2.6315119999999297,10.0.2.15,62.210.85.178,TLSv1.2,590,Application Data
1,2.6315669999994498,62.210.85.178,10.0.2.15,TCP,60,9001  >  35978 [ACK] Seq=13851397 Ack=253730437 Win=65535 Len=0
1,2.7202729999999065,54.93.77.70,10.0.2.15,TLSv1.2,590,Application Data
1,2.762499999999818,10.0.2.15,54.93.77.70,TCP,54,34692  >  9001 [ACK] Seq=13941003 Ack=253590799 Win=65535 Len=0
1,2.7700580000000627,54.93.77.70,10.0.2.15,TCP,2950,"9001  >  34692 [PSH, ACK] Seq=253590799 Ack=13941003 Win=65535 Len=2896 [TCP segment of a reassembled PDU]"
1,2.7701209999995626,10.0.2.15,54.93.77.70,TCP,54,34692  >  9001 [ACK] Seq=13941003 Ack=253593695 Win=65535 Len=0
1,2.7788009999994756,54.93.77.70,10.0.2.15,TLSv1.2,778,Application Data
1,2.778849999999693,10.0.2.15,54.93.77.70,TCP,54,34692  >  9001 [ACK] Seq=13941003 Ack=253594419 Win=65535 Len=0
1,2.7797860000000583,54.93.77.70,10.0.2.15,TCP,2950,"9001  >  34692 [PSH, ACK] Seq=253594419 Ack=13941003 Win=65535 Len=2896 [TCP segment of a reassembled PDU]"
1,2.7798379999994722,10.0.2.15,54.93.77.70,TCP,54,34692  >  9001 [ACK] Seq=13941003 Ack=253597315 Win=65535 Len=0
1,2.795541999999841,54.93.77.70,10.0.2.15,TLSv1.2,778,Application Data
1,2.7955849999998463,10.0.2.15,54.93.77.70,TCP,54,34692  >  9001 [ACK] Seq=13941003 Ack=253598039 Win=65535 Len=0
1,2.852947999999742,54.93.77.70,10.0.2.15,TLSv1.2,3674,Application Data
1,2.8530039999996006,10.0.2.15,54.93.77.70,TCP,54,34692  >  9001 [ACK] Seq=13941003 Ack=253601659 Win=65535 Len=0
1,2.8616919999994934,54.93.77.70,10.0.2.15,TCP,2950,"9001  >  34692 [PSH, ACK] Seq=253601659 Ack=13941003 Win=65535 Len=2896 [TCP segment of a reassembled PDU]"
1,2.8617399999993722,10.0.2.15,54.93.77.70,TCP,54,34692  >  9001 [ACK] Seq=13941003 Ack=253604555 Win=65535 Len=0
1,2.86932699999943,54.93.77.70,10.0.2.15,TLSv1.2,1314,"Application Data, Application Data"
1,2.869377999999415,10.0.2.15,54.93.77.70,TCP,54,34692  >  9001 [ACK] Seq=13941003 Ack=253605815 Win=65535 Len=0
1,2.8717199999991863,54.93.77.70,10.0.2.15,TCP,2950,"9001  >  34692 [PSH, ACK] Seq=253605815 Ack=13941003 Win=65535 Len=2896 [TCP segment of a reassembled PDU]"
1,2.871780999999828,10.0.2.15,54.93.77.70,TCP,54,34692  >  9001 [ACK] Seq=13941003 Ack=253608711 Win=65535 Len=0
1,2.8836529999998675,54.93.77.70,10.0.2.15,TLSv1.2,1502,Application Data [TCP segment of a reassembled PDU]
1,2.8836969999993016,10.0.2.15,54.93.77.70,TCP,54,34692  >  9001 [ACK] Seq=13941003 Ack=253610159 Win=65535 Len=0
1,2.8852029999998194,54.93.77.70,10.0.2.15,TLSv1.2,380,Application Data
1,2.885244999999486,10.0.2.15,54.93.77.70,TCP,54,34692  >  9001 [ACK] Seq=13941003 Ack=253610485 Win=65535 Len=0
1,2.893859999999222,54.93.77.70,10.0.2.15,TCP,2950,"9001  >  34692 [PSH, ACK] Seq=253610485 Ack=13941003 Win=65535 Len=2896 [TCP segment of a reassembled PDU]"
1,2.893901999999798,10.0.2.15,54.93.77.70,TCP,54,34692  >  9001 [ACK] Seq=13941003 Ack=253613381 Win=65535 Len=0
1,2.901315000000068,54.93.77.70,10.0.2.15,TLSv1.2,778,Application Data
1,2.901355999999396,10.0.2.15,54.93.77.70,TCP,54,34692  >  9001 [ACK] Seq=13941003 Ack=253614105 Win=65535 Len=0
1,2.905297999999675,54.93.77.70,10.0.2.15,TLSv1.2,7294,Application Data
1,2.905342999999448,10.0.2.15,54.93.77.70,TCP,54,34692  >  9001 [ACK] Seq=13941003 Ack=253621345 Win=65535 Len=0
1,2.905493999999635,10.0.2.15,54.93.77.70,TLSv1.2,590,Application Data
1,2.905569999999898,54.93.77.70,10.0.2.15,TCP,60,9001  >  34692 [ACK] Seq=253621345 Ack=13941539 Win=65535 Len=0
1,2.9237209999992047,54.93.77.70,10.0.2.15,TLSv1.2,4188,"Application Data, Application Data"
1,2.923769999999422,10.0.2.15,54.93.77.70,TCP,54,34692  >  9001 [ACK] Seq=13941539 Ack=253625479 Win=65535 Len=0
1,2.929356999999982,54.93.77.70,10.0.2.15,TCP,2950,"9001  >  34692 [PSH, ACK] Seq=253625479 Ack=13941539 Win=65535 Len=2896 [TCP segment of a reassembled PDU]"
1,2.9294049999998606,10.0.2.15,54.93.77.70,TCP,54,34692  >  9001 [ACK] Seq=13941539 Ack=253628375 Win=65535 Len=0
1,2.9403949999996257,54.93.77.70,10.0.2.15,TLSv1.2,2950,Application Data [TCP segment of a reassembled PDU]
1,2.9404420000000755,10.0.2.15,54.93.77.70,TCP,54,34692  >  9001 [ACK] Seq=13941539 Ack=253631271 Win=65535 Len=0
1,2.9406129999997574,10.0.2.15,54.93.77.70,TLSv1.2,590,Application Data
1,2.940683999999237,54.93.77.70,10.0.2.15,TCP,60,9001  >  34692 [ACK] Seq=253631271 Ack=13942075 Win=65535 Len=0
1,2.9415909999997893,54.93.77.70,10.0.2.15,TLSv1.2,5122,"Application Data, Application Data"
1,2.94165299999986,10.0.2.15,54.93.77.70,TCP,54,34692  >  9001 [ACK] Seq=13942075 Ack=253636339 Win=65535 Len=0
1,2.9494349999995393,54.93.77.70,10.0.2.15,TLSv1.2,5846,Application Data
1,2.949476999999206,10.0.2.15,54.93.77.70,TCP,54,34692  >  9001 [ACK] Seq=13942075 Ack=253642131 Win=65535 Len=0
1,2.9587299999993775,54.93.77.70,10.0.2.15,TLSv1.2,474,Application Data
1,2.9589679999999134,10.0.2.15,54.93.77.70,TLSv1.2,590,Application Data
1,2.95905700000003,54.93.77.70,10.0.2.15,TCP,60,9001  >  34692 [ACK] Seq=253642551 Ack=13942611 Win=65535 Len=0
1,2.9723119999998744,54.93.77.70,10.0.2.15,TCP,2950,"9001  >  34692 [PSH, ACK] Seq=253642551 Ack=13942611 Win=65535 Len=2896 [TCP segment of a reassembled PDU]"
1,2.972617999999784,10.0.2.15,54.93.77.70,TCP,54,34692  >  9001 [ACK] Seq=13942611 Ack=253645447 Win=65535 Len=0
1,2.9754989999992176,54.93.77.70,10.0.2.15,TLSv1.2,264,Application Data
1,2.9772759999996197,10.0.2.15,54.93.77.70,TLSv1.2,590,Application Data
1,2.977407999999741,54.93.77.70,10.0.2.15,TCP,60,9001  >  34692 [ACK] Seq=253645657 Ack=13943147 Win=65535 Len=0
1,2.987301999999545,10.0.2.15,54.93.77.70,TLSv1.2,590,Application Data
1,2.987435000000005,54.93.77.70,10.0.2.15,TCP,60,9001  >  34692 [ACK] Seq=253645657 Ack=13943683 Win=65535 Len=0
1,3.0161749999997483,54.93.77.70,10.0.2.15,TLSv1.2,590,Application Data
1,3.024541999999201,62.210.85.178,10.0.2.15,TLSv1.2,590,Application Data
1,3.058467999999266,10.0.2.15,54.93.77.70,TCP,54,34692  >  9001 [ACK] Seq=13943683 Ack=253646193 Win=65535 Len=0
1,3.06646499999988,10.0.2.15,62.210.85.178,TCP,54,35978  >  9001 [ACK] Seq=253730437 Ack=13851933 Win=65535 Len=0
1,3.084082999999737,62.210.85.178,10.0.2.15,TLSv1.2,590,Application Data
1,3.0841309999996156,10.0.2.15,62.210.85.178,TCP,54,35978  >  9001 [ACK] Seq=253730437 Ack=13852469 Win=65535 Len=0
1,3.20026499999949,62.210.85.178,10.0.2.15,TLSv1.2,1618,Application Data
1,3.200341999999182,10.0.2.15,62.210.85.178,TCP,54,35978  >  9001 [ACK] Seq=253730437 Ack=13854033 Win=65535 Len=0
1,3.2006529999998747,10.0.2.15,62.210.85.178,TLSv1.2,590,Application Data
1,3.2007449999991877,62.210.85.178,10.0.2.15,TCP,60,9001  >  35978 [ACK] Seq=13854033 Ack=253730973 Win=65535 Len=0
1,3.5074849999991784,54.93.77.70,10.0.2.15,TLSv1.2,590,Application Data
1,3.5075779999997394,10.0.2.15,54.93.77.70,TCP,54,34692  >  9001 [ACK] Seq=13943683 Ack=253646729 Win=65535 Len=0
1,3.507949999999255,10.0.2.15,54.93.77.70,TLSv1.2,590,Application Data
1,3.5080389999993713,54.93.77.70,10.0.2.15,TCP,60,9001  >  34692 [ACK] Seq=253646729 Ack=13944219 Win=65535 Len=0
1,3.713488999999754,62.210.85.178,10.0.2.15,TLSv1.2,590,Application Data
1,3.717185999999856,10.0.2.15,62.210.85.178,TLSv1.2,590,Application Data
1,3.7173659999998563,62.210.85.178,10.0.2.15,TCP,60,9001  >  35978 [ACK] Seq=13854569 Ack=253731509 Win=65535 Len=0
1,3.727068999999574,10.0.2.15,62.210.85.178,TLSv1.2,4124,Application Data
1,3.7275159999999232,62.210.85.178,10.0.2.15,TCP,60,9001  >  35978 [ACK] Seq=13854569 Ack=253732969 Win=65535 Len=0
1,3.7275369999997565,62.210.85.178,10.0.2.15,TCP,60,9001  >  35978 [ACK] Seq=13854569 Ack=253734429 Win=65535 Len=0
1,3.7275399999998626,62.210.85.178,10.0.2.15,TCP,60,9001  >  35978 [ACK] Seq=13854569 Ack=253735579 Win=65535 Len=0
1,3.727629999999408,10.0.2.15,62.210.85.178,TLSv1.2,4124,Application Data
1,3.727700999999797,62.210.85.178,10.0.2.15,TCP,60,9001  >  35978 [ACK] Seq=13854569 Ack=253737039 Win=65535 Len=0
1,3.7277139999996507,62.210.85.178,10.0.2.15,TCP,60,9001  >  35978 [ACK] Seq=13854569 Ack=253738499 Win=65535 Len=0
1,3.7277189999995244,62.210.85.178,10.0.2.15,TCP,60,9001  >  35978 [ACK] Seq=13854569 Ack=253739649 Win=65535 Len=0
1,3.7277679999997417,10.0.2.15,62.210.85.178,TLSv1.2,4124,Application Data
1,3.7278120000000854,62.210.85.178,10.0.2.15,TCP,60,9001  >  35978 [ACK] Seq=13854569 Ack=253741109 Win=65535 Len=0
1,3.7278209999994942,62.210.85.178,10.0.2.15,TCP,60,9001  >  35978 [ACK] Seq=13854569 Ack=253742569 Win=65535 Len=0
1,3.727824999999939,62.210.85.178,10.0.2.15,TCP,60,9001  >  35978 [ACK] Seq=13854569 Ack=253743719 Win=65535 Len=0
1,3.7278630000000703,10.0.2.15,62.210.85.178,TLSv1.2,4124,Application Data
1,3.7279009999992923,62.210.85.178,10.0.2.15,TCP,60,9001  >  35978 [ACK] Seq=13854569 Ack=253745179 Win=65535 Len=0
1,3.7279099999996106,62.210.85.178,10.0.2.15,TCP,60,9001  >  35978 [ACK] Seq=13854569 Ack=253746639 Win=65535 Len=0
1,3.7279749999997875,10.0.2.15,62.210.85.178,TLSv1.2,2974,Application Data
1,3.7280149999996866,62.210.85.178,10.0.2.15,TCP,60,9001  >  35978 [ACK] Seq=13854569 Ack=253747789 Win=65535 Len=0
1,3.7280229999996664,62.210.85.178,10.0.2.15,TCP,60,9001  >  35978 [ACK] Seq=13854569 Ack=253749249 Win=65535 Len=0
1,3.7280259999997725,62.210.85.178,10.0.2.15,TCP,60,9001  >  35978 [ACK] Seq=13854569 Ack=253750709 Win=65535 Len=0
1,3.728053999999247,10.0.2.15,62.210.85.178,TLSv1.2,1226,Application Data
1,3.7280889999992723,62.210.85.178,10.0.2.15,TCP,60,9001  >  35978 [ACK] Seq=13854569 Ack=253751881 Win=65535 Len=0
1,3.7281319999992775,10.0.2.15,62.210.85.178,TLSv1.2,2452,Application Data
1,3.72816899999998,62.210.85.178,10.0.2.15,TCP,60,9001  >  35978 [ACK] Seq=13854569 Ack=253753341 Win=65535 Len=0
1,3.7281769999999597,62.210.85.178,10.0.2.15,TCP,60,9001  >  35978 [ACK] Seq=13854569 Ack=253754279 Win=65535 Len=0
1,3.9158699999998134,54.93.77.70,10.0.2.15,TLSv1.2,590,Application Data
1,3.920079999999871,54.93.77.70,10.0.2.15,TCP,2950,"9001  >  34692 [PSH, ACK] Seq=253647265 Ack=13944219 Win=65535 Len=2896 [TCP segment of a reassembled PDU]"
1,3.9201049999992392,54.93.77.70,10.0.2.15,TLSv1.2,4398,Application Data [TCP segment of a reassembled PDU]
1,3.92011199999979,54.93.77.70,10.0.2.15,TLSv1.2,4398,Application Data [TCP segment of a reassembled PDU]
1,3.9201989999992293,10.0.2.15,54.93.77.70,TCP,54,34692  >  9001 [ACK] Seq=13944219 Ack=253658849 Win=65535 Len=0
1,3.9358869999996386,54.93.77.70,10.0.2.15,TLSv1.2,2950,Application Data [TCP segment of a reassembled PDU]
1,3.9359459999996034,10.0.2.15,54.93.77.70,TCP,54,34692  >  9001 [ACK] Seq=13944219 Ack=253661745 Win=65535 Len=0
1,3.9363409999996293,54.93.77.70,10.0.2.15,TLSv1.2,568,Application Data
1,3.9380419999997684,54.93.77.70,10.0.2.15,TCP,2950,"9001  >  34692 [PSH, ACK] Seq=253662259 Ack=13944219 Win=65535 Len=2896 [TCP segment of a reassembled PDU]"
1,3.938086999999541,10.0.2.15,54.93.77.70,TCP,54,34692  >  9001 [ACK] Seq=13944219 Ack=253665155 Win=65535 Len=0
1,3.9563799999996263,54.93.77.70,10.0.2.15,TLSv1.2,1314,"Application Data, Application Data"
1,3.9571909999995114,54.93.77.70,10.0.2.15,TCP,2950,"9001  >  34692 [PSH, ACK] Seq=253666415 Ack=13944219 Win=65535 Len=2896 [TCP segment of a reassembled PDU]"
1,3.9572849999995015,10.0.2.15,54.93.77.70,TCP,54,34692  >  9001 [ACK] Seq=13944219 Ack=253669311 Win=65535 Len=0
1,3.9726049999999304,54.93.77.70,10.0.2.15,TLSv1.2,778,Application Data
1,3.9749369999999544,10.0.2.15,54.93.77.70,TLSv1.2,590,Application Data
1,3.9751109999997425,54.93.77.70,10.0.2.15,TCP,60,9001  >  34692 [ACK] Seq=253670035 Ack=13944755 Win=65535 Len=0
1,4.120472999999947,62.210.85.178,10.0.2.15,TLSv1.2,590,Application Data
1,4.120777999999518,10.0.2.15,62.210.85.178,TLSv1.2,590,Application Data
1,4.120872999999847,62.210.85.178,10.0.2.15,TCP,60,9001  >  35978 [ACK] Seq=13855105 Ack=253754815 Win=65535 Len=0
1,4.3251839999993535,54.93.77.70,10.0.2.15,TLSv1.2,590,Application Data
1,4.32556299999942,10.0.2.15,54.93.77.70,TLSv1.2,590,Application Data
1,4.325665999999728,54.93.77.70,10.0.2.15,TCP,60,9001  >  34692 [ACK] Seq=253670571 Ack=13945291 Win=65535 Len=0
1,4.419783999999709,62.210.85.178,10.0.2.15,TLSv1.2,590,Application Data
1,4.424755999999434,10.0.2.15,62.210.85.178,TLSv1.2,590,Application Data
1,4.4254000000000815,62.210.85.178,10.0.2.15,TCP,60,9001  >  35978 [ACK] Seq=13855641 Ack=253755351 Win=65535 Len=0
1,4.435097999999925,10.0.2.15,62.210.85.178,TLSv1.2,4124,Application Data
1,4.435233999999582,62.210.85.178,10.0.2.15,TCP,60,9001  >  35978 [ACK] Seq=13855641 Ack=253756811 Win=65535 Len=0
1,4.43525099999988,62.210.85.178,10.0.2.15,TCP,60,9001  >  35978 [ACK] Seq=13855641 Ack=253758271 Win=65535 Len=0
1,4.435253999999986,62.210.85.178,10.0.2.15,TCP,60,9001  >  35978 [ACK] Seq=13855641 Ack=253759421 Win=65535 Len=0
1,4.435324000000037,10.0.2.15,62.210.85.178,TLSv1.2,4124,Application Data
1,4.435390999999981,10.0.2.15,62.210.85.178,TCP,2974,35978  >  9001 [ACK] Seq=253763491 Ack=13855641 Win=65535 Len=2920 [TCP segment of a reassembled PDU]
1,4.435429999999542,62.210.85.178,10.0.2.15,TCP,60,9001  >  35978 [ACK] Seq=13855641 Ack=253760881 Win=65535 Len=0
1,4.435437999999522,62.210.85.178,10.0.2.15,TCP,60,9001  >  35978 [ACK] Seq=13855641 Ack=253762341 Win=65535 Len=0
1,4.435442999999395,62.210.85.178,10.0.2.15,TCP,60,9001  >  35978 [ACK] Seq=13855641 Ack=253763491 Win=65535 Len=0
1,4.43544699999984,62.210.85.178,10.0.2.15,TCP,60,9001  >  35978 [ACK] Seq=13855641 Ack=253764951 Win=65535 Len=0
1,4.435450999999375,62.210.85.178,10.0.2.15,TCP,60,9001  >  35978 [ACK] Seq=13855641 Ack=253766411 Win=65535 Len=0
1,4.435480999999527,10.0.2.15,62.210.85.178,TLSv1.2,1204,Application Data
1,4.435545999999704,62.210.85.178,10.0.2.15,TCP,60,9001  >  35978 [ACK] Seq=13855641 Ack=253767561 Win=65535 Len=0
1,4.435582999999497,10.0.2.15,62.210.85.178,TLSv1.2,4124,Application Data
1,4.435615999999754,62.210.85.178,10.0.2.15,TCP,60,9001  >  35978 [ACK] Seq=13855641 Ack=253769021 Win=65535 Len=0
1,4.435622999999396,62.210.85.178,10.0.2.15,TCP,60,9001  >  35978 [ACK] Seq=13855641 Ack=253770481 Win=65535 Len=0
1,4.43568199999936,10.0.2.15,62.210.85.178,TLSv1.2,2974,Application Data
1,4.435719000000063,62.210.85.178,10.0.2.15,TCP,60,9001  >  35978 [ACK] Seq=13855641 Ack=253771631 Win=65535 Len=0
1,4.435725999999704,62.210.85.178,10.0.2.15,TCP,60,9001  >  35978 [ACK] Seq=13855641 Ack=253773091 Win=65535 Len=0
1,4.43572899999981,62.210.85.178,10.0.2.15,TCP,60,9001  >  35978 [ACK] Seq=13855641 Ack=253774551 Win=65535 Len=0
1,4.435755999999856,10.0.2.15,62.210.85.178,TLSv1.2,1226,Application Data
1,4.435788999999204,62.210.85.178,10.0.2.15,TCP,60,9001  >  35978 [ACK] Seq=13855641 Ack=253775723 Win=65535 Len=0
1,4.435826999999335,10.0.2.15,62.210.85.178,TLSv1.2,4124,Application Data
1,4.435861999999361,62.210.85.178,10.0.2.15,TCP,60,9001  >  35978 [ACK] Seq=13855641 Ack=253777183 Win=65535 Len=0
1,4.435867999999573,62.210.85.178,10.0.2.15,TCP,60,9001  >  35978 [ACK] Seq=13855641 Ack=253778643 Win=65535 Len=0
1,4.435870999999679,62.210.85.178,10.0.2.15,TCP,60,9001  >  35978 [ACK] Seq=13855641 Ack=253779793 Win=65535 Len=0
1,4.435907000000043,10.0.2.15,62.210.85.178,TLSv1.2,3030,Application Data
