No.,Time,Source,Destination,Protocol,Length,Info
1,0.020685999999841442,10.0.2.15,54.93.77.70,TCP,54,34692  >  9001 [ACK] Seq=14059731 Ack=255945901 Win=65535 Len=0
1,0.03127299999960087,62.210.85.178,10.0.2.15,TLSv1.2,590,Application Data
1,0.06734099999994214,62.210.85.178,10.0.2.15,TLSv1.2,590,Application Data
1,0.06742599999961385,10.0.2.15,62.210.85.178,TCP,54,35978  >  9001 [ACK] Seq=256029111 Ack=13969127 Win=65535 Len=0
1,0.08963399999993271,62.210.85.178,10.0.2.15,TLSv1.2,590,Application Data
1,0.13163499999973283,10.0.2.15,54.93.77.70,TLSv1.2,590,Application Data
1,0.13180699999975332,54.93.77.70,10.0.2.15,TCP,60,9001  >  34692 [ACK] Seq=255945901 Ack=14060267 Win=65535 Len=0
1,0.1319020000000819,10.0.2.15,62.210.85.178,TCP,54,35978  >  9001 [ACK] Seq=256029111 Ack=13969663 Win=65535 Len=0
1,0.3903179999997519,62.210.85.178,10.0.2.15,TLSv1.2,590,Application Data
1,0.39039299999967625,10.0.2.15,62.210.85.178,TCP,54,35978  >  9001 [ACK] Seq=256029111 Ack=13970199 Win=65535 Len=0
1,0.3908629999996265,10.0.2.15,62.210.85.178,TLSv1.2,590,Application Data
1,0.3909800000001269,62.210.85.178,10.0.2.15,TCP,60,9001  >  35978 [ACK] Seq=13970199 Ack=256029647 Win=65535 Len=0
1,0.9022230000000491,54.93.77.70,10.0.2.15,TLSv1.2,590,Application Data
1,0.9022990000003119,10.0.2.15,54.93.77.70,TCP,54,34692  >  9001 [ACK] Seq=14060267 Ack=255946437 Win=65535 Len=0
1,0.9026519999997618,10.0.2.15,54.93.77.70,TLSv1.2,1618,Application Data
1,0.9027690000002622,54.93.77.70,10.0.2.15,TCP,60,9001  >  34692 [ACK] Seq=255946437 Ack=14061727 Win=65535 Len=0
1,0.9027809999997771,54.93.77.70,10.0.2.15,TCP,60,9001  >  34692 [ACK] Seq=255946437 Ack=14061831 Win=65535 Len=0
1,1.1089750000001004,62.210.85.178,10.0.2.15,TLSv1.2,1618,Application Data
1,1.1090999999996711,10.0.2.15,62.210.85.178,TCP,54,35978  >  9001 [ACK] Seq=256029647 Ack=13971763 Win=65535 Len=0
1,1.1237959999998566,10.0.2.15,62.210.85.178,TLSv1.2,590,Application Data
1,1.1245660000004136,62.210.85.178,10.0.2.15,TCP,60,9001  >  35978 [ACK] Seq=13971763 Ack=256030183 Win=65535 Len=0
1,1.1368320000001404,10.0.2.15,62.210.85.178,TLSv1.2,1618,Application Data
1,1.1370129999995697,62.210.85.178,10.0.2.15,TCP,60,9001  >  35978 [ACK] Seq=13971763 Ack=256031643 Win=65535 Len=0
1,1.13703600000008,62.210.85.178,10.0.2.15,TCP,60,9001  >  35978 [ACK] Seq=13971763 Ack=256031747 Win=65535 Len=0
1,1.312608000000182,54.93.77.70,10.0.2.15,TLSv1.2,590,Application Data
1,1.323153000000275,54.93.77.70,10.0.2.15,TCP,1502,"9001  >  34692 [PSH, ACK] Seq=255946973 Ack=14061831 Win=65535 Len=1448 [TCP segment of a reassembled PDU]"
1,1.3232529999995677,10.0.2.15,54.93.77.70,TCP,54,34692  >  9001 [ACK] Seq=14061831 Ack=255948421 Win=65535 Len=0
1,1.3403729999999996,54.93.77.70,10.0.2.15,TLSv1.2,170,Application Data
1,1.3424800000002506,10.0.2.15,54.93.77.70,TLSv1.2,590,Application Data
1,1.3426550000003772,54.93.77.70,10.0.2.15,TCP,60,9001  >  34692 [ACK] Seq=255948537 Ack=14062367 Win=65535 Len=0
1,1.5177700000003824,62.210.85.178,10.0.2.15,TLSv1.2,590,Application Data
1,1.5180819999995947,10.0.2.15,62.210.85.178,TLSv1.2,590,Application Data
1,1.5181920000004538,62.210.85.178,10.0.2.15,TCP,60,9001  >  35978 [ACK] Seq=13972299 Ack=256032283 Win=65535 Len=0
1,1.721918000000187,54.93.77.70,10.0.2.15,TLSv1.2,590,Application Data
1,1.722407999999632,10.0.2.15,54.93.77.70,TLSv1.2,590,Application Data
1,1.7225429999998596,54.93.77.70,10.0.2.15,TCP,60,9001  >  34692 [ACK] Seq=255949073 Ack=14062903 Win=65535 Len=0
1,2.1321740000003047,62.210.85.178,10.0.2.15,TLSv1.2,590,Application Data
1,2.1378640000002633,10.0.2.15,62.210.85.178,TLSv1.2,590,Application Data
1,2.1380150000004505,62.210.85.178,10.0.2.15,TCP,60,9001  >  35978 [ACK] Seq=13972835 Ack=256032819 Win=65535 Len=0
1,2.1481940000003306,10.0.2.15,62.210.85.178,TLSv1.2,4124,Application Data
1,2.1482969999997295,10.0.2.15,62.210.85.178,TCP,2974,35978  >  9001 [ACK] Seq=256036889 Ack=13972835 Win=65535 Len=2920 [TCP segment of a reassembled PDU]
1,2.148341000000073,62.210.85.178,10.0.2.15,TCP,60,9001  >  35978 [ACK] Seq=13972835 Ack=256034279 Win=65535 Len=0
1,2.148352000000159,62.210.85.178,10.0.2.15,TCP,60,9001  >  35978 [ACK] Seq=13972835 Ack=256035739 Win=65535 Len=0
1,2.1483570000000327,62.210.85.178,10.0.2.15,TCP,60,9001  >  35978 [ACK] Seq=13972835 Ack=256036889 Win=65535 Len=0
1,2.1483619999999064,62.210.85.178,10.0.2.15,TCP,60,9001  >  35978 [ACK] Seq=13972835 Ack=256038349 Win=65535 Len=0
1,2.1483650000000125,62.210.85.178,10.0.2.15,TCP,60,9001  >  35978 [ACK] Seq=13972835 Ack=256039809 Win=65535 Len=0
1,2.1483989999996993,10.0.2.15,62.210.85.178,TLSv1.2,1204,Application Data
1,2.1484330000002956,62.210.85.178,10.0.2.15,TCP,60,9001  >  35978 [ACK] Seq=13972835 Ack=256040959 Win=65535 Len=0
1,2.1484769999997297,10.0.2.15,62.210.85.178,TLSv1.2,4124,Application Data
1,2.1485380000003715,62.210.85.178,10.0.2.15,TCP,60,9001  >  35978 [ACK] Seq=13972835 Ack=256042419 Win=65535 Len=0
1,2.1485499999998865,62.210.85.178,10.0.2.15,TCP,60,9001  >  35978 [ACK] Seq=13972835 Ack=256043879 Win=65535 Len=0
1,2.1485529999999926,62.210.85.178,10.0.2.15,TCP,60,9001  >  35978 [ACK] Seq=13972835 Ack=256045029 Win=65535 Len=0
1,2.14860200000021,10.0.2.15,62.210.85.178,TLSv1.2,4124,Application Data
1,2.1486619999996037,62.210.85.178,10.0.2.15,TCP,60,9001  >  35978 [ACK] Seq=13972835 Ack=256046489 Win=65535 Len=0
1,2.1486720000002606,62.210.85.178,10.0.2.15,TCP,60,9001  >  35978 [ACK] Seq=13972835 Ack=256047949 Win=65535 Len=0
1,2.1486750000003667,62.210.85.178,10.0.2.15,TCP,60,9001  >  35978 [ACK] Seq=13972835 Ack=256049099 Win=65535 Len=0
1,2.148718999999801,10.0.2.15,62.210.85.178,TLSv1.2,332,Application Data
1,2.1487569999999323,62.210.85.178,10.0.2.15,TCP,60,9001  >  35978 [ACK] Seq=13972835 Ack=256049377 Win=65535 Len=0
1,2.1488110000000233,10.0.2.15,62.210.85.178,TLSv1.2,3868,Application Data
1,2.148847000000387,62.210.85.178,10.0.2.15,TCP,60,9001  >  35978 [ACK] Seq=13972835 Ack=256050837 Win=65535 Len=0
1,2.1488540000000285,62.210.85.178,10.0.2.15,TCP,60,9001  >  35978 [ACK] Seq=13972835 Ack=256052297 Win=65535 Len=0
1,2.1488570000001346,62.210.85.178,10.0.2.15,TCP,60,9001  >  35978 [ACK] Seq=13972835 Ack=256053191 Win=65535 Len=0
1,2.148892999999589,10.0.2.15,62.210.85.178,TLSv1.2,4124,Application Data
1,2.148927000000185,62.210.85.178,10.0.2.15,TCP,60,9001  >  35978 [ACK] Seq=13972835 Ack=256054651 Win=65535 Len=0
1,2.1489339999998265,62.210.85.178,10.0.2.15,TCP,60,9001  >  35978 [ACK] Seq=13972835 Ack=256056111 Win=65535 Len=0
1,2.148938000000271,62.210.85.178,10.0.2.15,TCP,60,9001  >  35978 [ACK] Seq=13972835 Ack=256057261 Win=65535 Len=0
1,2.1489730000002965,10.0.2.15,62.210.85.178,TLSv1.2,3030,Application Data
1,2.1490080000003218,62.210.85.178,10.0.2.15,TCP,60,9001  >  35978 [ACK] Seq=13972835 Ack=256058721 Win=65535 Len=0
1,2.149014999999963,62.210.85.178,10.0.2.15,TCP,60,9001  >  35978 [ACK] Seq=13972835 Ack=256060181 Win=65535 Len=0
1,2.149018000000069,62.210.85.178,10.0.2.15,TCP,60,9001  >  35978 [ACK] Seq=13972835 Ack=256060237 Win=65535 Len=0
1,2.1604779999997845,10.0.2.15,62.210.85.178,TLSv1.2,4124,Application Data
1,2.1605570000001535,62.210.85.178,10.0.2.15,TCP,60,9001  >  35978 [ACK] Seq=13972835 Ack=256061697 Win=65535 Len=0
1,2.1605659999995623,62.210.85.178,10.0.2.15,TCP,60,9001  >  35978 [ACK] Seq=13972835 Ack=256063157 Win=65535 Len=0
1,2.160570000000007,62.210.85.178,10.0.2.15,TCP,60,9001  >  35978 [ACK] Seq=13972835 Ack=256064307 Win=65535 Len=0
1,2.1606110000002445,10.0.2.15,62.210.85.178,TLSv1.2,4124,Application Data
1,2.1606769999998505,62.210.85.178,10.0.2.15,TCP,60,9001  >  35978 [ACK] Seq=13972835 Ack=256065767 Win=65535 Len=0
1,2.1606849999998303,62.210.85.178,10.0.2.15,TCP,60,9001  >  35978 [ACK] Seq=13972835 Ack=256067227 Win=65535 Len=0
1,2.1606879999999364,62.210.85.178,10.0.2.15,TCP,60,9001  >  35978 [ACK] Seq=13972835 Ack=256068377 Win=65535 Len=0
1,2.160721000000194,10.0.2.15,62.210.85.178,TLSv1.2,4124,Application Data
1,2.160754000000452,62.210.85.178,10.0.2.15,TCP,60,9001  >  35978 [ACK] Seq=13972835 Ack=256069837 Win=65535 Len=0
1,2.160761000000093,62.210.85.178,10.0.2.15,TCP,60,9001  >  35978 [ACK] Seq=13972835 Ack=256071297 Win=65535 Len=0
1,2.1607649999996283,62.210.85.178,10.0.2.15,TCP,60,9001  >  35978 [ACK] Seq=13972835 Ack=256072447 Win=65535 Len=0
1,2.160800999999992,10.0.2.15,62.210.85.178,TLSv1.2,4124,Application Data
1,2.16083400000025,62.210.85.178,10.0.2.15,TCP,60,9001  >  35978 [ACK] Seq=13972835 Ack=256073907 Win=65535 Len=0
1,2.1608420000002297,62.210.85.178,10.0.2.15,TCP,60,9001  >  35978 [ACK] Seq=13972835 Ack=256075367 Win=65535 Len=0
1,2.160845999999765,62.210.85.178,10.0.2.15,TCP,60,9001  >  35978 [ACK] Seq=13972835 Ack=256076517 Win=65535 Len=0
1,2.160880000000361,10.0.2.15,62.210.85.178,TLSv1.2,332,Application Data
1,2.1609129999997094,62.210.85.178,10.0.2.15,TCP,60,9001  >  35978 [ACK] Seq=13972835 Ack=256076795 Win=65535 Len=0
1,2.1609630000002653,10.0.2.15,62.210.85.178,TLSv1.2,3868,Application Data
1,2.1609989999997197,62.210.85.178,10.0.2.15,TCP,60,9001  >  35978 [ACK] Seq=13972835 Ack=256078255 Win=65535 Len=0
1,2.1610060000002704,62.210.85.178,10.0.2.15,TCP,60,9001  >  35978 [ACK] Seq=13972835 Ack=256079715 Win=65535 Len=0
1,2.1610099999998056,62.210.85.178,10.0.2.15,TCP,60,9001  >  35978 [ACK] Seq=13972835 Ack=256080609 Win=65535 Len=0
1,2.1610469999995985,10.0.2.15,62.210.85.178,TLSv1.2,4124,Application Data
1,2.161081999999624,62.210.85.178,10.0.2.15,TCP,60,9001  >  35978 [ACK] Seq=13972835 Ack=256082069 Win=65535 Len=0
1,2.161087999999836,62.210.85.178,10.0.2.15,TCP,60,9001  >  35978 [ACK] Seq=13972835 Ack=256083529 Win=65535 Len=0
1,2.161090999999942,62.210.85.178,10.0.2.15,TCP,60,9001  >  35978 [ACK] Seq=13972835 Ack=256084679 Win=65535 Len=0
1,2.161124999999629,10.0.2.15,62.210.85.178,TLSv1.2,3030,Application Data
1,2.1611599999996542,62.210.85.178,10.0.2.15,TCP,60,9001  >  35978 [ACK] Seq=13972835 Ack=256086139 Win=65535 Len=0
1,2.1611659999998665,62.210.85.178,10.0.2.15,TCP,60,9001  >  35978 [ACK] Seq=13972835 Ack=256087599 Win=65535 Len=0
1,2.1611689999999726,62.210.85.178,10.0.2.15,TCP,60,9001  >  35978 [ACK] Seq=13972835 Ack=256087655 Win=65535 Len=0
1,2.172548000000461,10.0.2.15,62.210.85.178,TLSv1.2,4124,Application Data
1,2.172620999999708,62.210.85.178,10.0.2.15,TCP,60,9001  >  35978 [ACK] Seq=13972835 Ack=256089115 Win=65535 Len=0
1,2.1726330000001326,62.210.85.178,10.0.2.15,TCP,60,9001  >  35978 [ACK] Seq=13972835 Ack=256090575 Win=65535 Len=0
1,2.1726360000002387,62.210.85.178,10.0.2.15,TCP,60,9001  >  35978 [ACK] Seq=13972835 Ack=256091725 Win=65535 Len=0
1,2.172674999999799,10.0.2.15,62.210.85.178,TLSv1.2,4124,Application Data
1,2.1727090000003955,62.210.85.178,10.0.2.15,TCP,60,9001  >  35978 [ACK] Seq=13972835 Ack=256093185 Win=65535 Len=0
1,2.1727170000003753,62.210.85.178,10.0.2.15,TCP,60,9001  >  35978 [ACK] Seq=13972835 Ack=256094645 Win=65535 Len=0
1,2.1727209999999104,62.210.85.178,10.0.2.15,TCP,60,9001  >  35978 [ACK] Seq=13972835 Ack=256095795 Win=65535 Len=0
1,2.1727570000002743,10.0.2.15,62.210.85.178,TLSv1.2,3288,Application Data
1,2.172790999999961,62.210.85.178,10.0.2.15,TCP,60,9001  >  35978 [ACK] Seq=13972835 Ack=256097255 Win=65535 Len=0
1,2.1727979999996023,62.210.85.178,10.0.2.15,TCP,60,9001  >  35978 [ACK] Seq=13972835 Ack=256098715 Win=65535 Len=0
1,2.1728030000003855,62.210.85.178,10.0.2.15,TCP,60,9001  >  35978 [ACK] Seq=13972835 Ack=256099029 Win=65535 Len=0
1,2.273522000000412,54.93.77.70,10.0.2.15,TLSv1.2,590,Application Data
1,2.2995719999998983,54.93.77.70,10.0.2.15,TLSv1.2,7294,Application Data
1,2.2995979999996052,54.93.77.70,10.0.2.15,TLSv1.2,590,"Application Data, Application Data"
1,2.299681000000419,10.0.2.15,54.93.77.70,TCP,54,34692  >  9001 [ACK] Seq=14062903 Ack=255957385 Win=65535 Len=0
1,2.32253000000037,54.93.77.70,10.0.2.15,TLSv1.2,3674,Application Data
1,2.322602999999617,10.0.2.15,54.93.77.70,TCP,54,34692  >  9001 [ACK] Seq=14062903 Ack=255961005 Win=65535 Len=0
1,2.3401249999997162,54.93.77.70,10.0.2.15,TLSv1.2,590,Application Data
1,2.3428649999996196,54.93.77.70,10.0.2.15,TCP,2950,"9001  >  34692 [PSH, ACK] Seq=255961541 Ack=14062903 Win=65535 Len=2896 [TCP segment of a reassembled PDU]"
1,2.342913999999837,10.0.2.15,54.93.77.70,TCP,54,34692  >  9001 [ACK] Seq=14062903 Ack=255964437 Win=65535 Len=0
1,2.354565999999977,54.93.77.70,10.0.2.15,TLSv1.2,2950,Application Data [TCP segment of a reassembled PDU]
1,2.3546120000000883,10.0.2.15,54.93.77.70,TCP,54,34692  >  9001 [ACK] Seq=14062903 Ack=255967333 Win=65535 Len=0
1,2.3547850000004473,10.0.2.15,54.93.77.70,TLSv1.2,590,Application Data
1,2.3548609999998007,54.93.77.70,10.0.2.15,TCP,60,9001  >  34692 [ACK] Seq=255967333 Ack=14063439 Win=65535 Len=0
1,2.3556429999998727,54.93.77.70,10.0.2.15,TLSv1.2,1502,Application Data
1,2.355685999999878,10.0.2.15,54.93.77.70,TCP,54,34692  >  9001 [ACK] Seq=14063439 Ack=255968781 Win=65535 Len=0
1,2.3613530000002356,54.93.77.70,10.0.2.15,TLSv1.2,590,Application Data
1,2.3724249999995664,54.93.77.70,10.0.2.15,TLSv1.2,5846,Application Data
1,2.3724890000003143,10.0.2.15,54.93.77.70,TCP,54,34692  >  9001 [ACK] Seq=14063439 Ack=255975109 Win=65535 Len=0
1,2.3730930000001536,54.93.77.70,10.0.2.15,TLSv1.2,4398,Application Data [TCP segment of a reassembled PDU]
1,2.373134000000391,10.0.2.15,54.93.77.70,TCP,54,34692  >  9001 [ACK] Seq=14063439 Ack=255979453 Win=65535 Len=0
1,2.373284999999669,10.0.2.15,54.93.77.70,TLSv1.2,590,Application Data
1,2.3733549999997194,54.93.77.70,10.0.2.15,TCP,60,9001  >  34692 [ACK] Seq=255979453 Ack=14063975 Win=65535 Len=0
1,2.3771999999999025,54.93.77.70,10.0.2.15,TLSv1.2,1292,Application Data
1,2.383273000000372,54.93.77.70,10.0.2.15,TCP,2950,"9001  >  34692 [PSH, ACK] Seq=255980691 Ack=14063975 Win=65535 Len=2896 [TCP segment of a reassembled PDU]"
1,2.3833169999998063,10.0.2.15,54.93.77.70,TCP,54,34692  >  9001 [ACK] Seq=14063975 Ack=255983587 Win=65535 Len=0
1,2.383870999999999,54.93.77.70,10.0.2.15,TLSv1.2,4398,Application Data [TCP segment of a reassembled PDU]
1,2.383907999999792,10.0.2.15,54.93.77.70,TCP,54,34692  >  9001 [ACK] Seq=14063975 Ack=255987931 Win=65535 Len=0
1,2.394666000000143,54.93.77.70,10.0.2.15,TLSv1.2,8742,"Application Data, Application Data, Application Data"
1,2.394749000000047,10.0.2.15,54.93.77.70,TCP,54,34692  >  9001 [ACK] Seq=14063975 Ack=255996619 Win=65535 Len=0
1,2.3949290000000474,54.93.77.70,10.0.2.15,TCP,1502,"9001  >  34692 [PSH, ACK] Seq=255996619 Ack=14063975 Win=65535 Len=1448 [TCP segment of a reassembled PDU]"
1,2.394999000000098,10.0.2.15,54.93.77.70,TCP,54,34692  >  9001 [ACK] Seq=14063975 Ack=255998067 Win=65535 Len=0
1,2.4040020000002187,54.93.77.70,10.0.2.15,TLSv1.2,778,Application Data
1,2.4068999999999505,54.93.77.70,10.0.2.15,TCP,2950,"9001  >  34692 [PSH, ACK] Seq=255998791 Ack=14063975 Win=65535 Len=2896 [TCP segment of a reassembled PDU]"
1,2.4069589999999152,10.0.2.15,54.93.77.70,TCP,54,34692  >  9001 [ACK] Seq=14063975 Ack=256001687 Win=65535 Len=0
1,2.4187519999995857,54.93.77.70,10.0.2.15,TLSv1.2,1502,Application Data [TCP segment of a reassembled PDU]
1,2.4188100000001214,10.0.2.15,54.93.77.70,TCP,54,34692  >  9001 [ACK] Seq=14063975 Ack=256003135 Win=65535 Len=0
1,2.41900700000042,10.0.2.15,54.93.77.70,TLSv1.2,590,Application Data
1,2.4190920000000915,54.93.77.70,10.0.2.15,TCP,60,9001  >  34692 [ACK] Seq=256003135 Ack=14064511 Win=65535 Len=0
1,2.4200870000004215,54.93.77.70,10.0.2.15,TLSv1.2,380,Application Data
1,2.4293989999996484,54.93.77.70,10.0.2.15,TCP,2950,"9001  >  34692 [PSH, ACK] Seq=256003461 Ack=14064511 Win=65535 Len=2896 [TCP segment of a reassembled PDU]"
1,2.4294380000001183,54.93.77.70,10.0.2.15,TLSv1.2,4398,Application Data [TCP segment of a reassembled PDU]
1,2.429565000000366,10.0.2.15,54.93.77.70,TCP,54,34692  >  9001 [ACK] Seq=14064511 Ack=256010701 Win=65535 Len=0
1,2.4453169999997044,54.93.77.70,10.0.2.15,TLSv1.2,568,Application Data
1,2.452470999999605,54.93.77.70,10.0.2.15,TCP,2950,"9001  >  34692 [PSH, ACK] Seq=256011215 Ack=14064511 Win=65535 Len=2896 [TCP segment of a reassembled PDU]"
1,2.452524000000267,10.0.2.15,54.93.77.70,TCP,54,34692  >  9001 [ACK] Seq=14064511 Ack=256014111 Win=65535 Len=0
1,2.470032000000174,54.93.77.70,10.0.2.15,TLSv1.2,778,Application Data
1,2.4701969999996436,10.0.2.15,54.93.77.70,TLSv1.2,590,Application Data
1,2.47028599999976,54.93.77.70,10.0.2.15,TCP,60,9001  >  34692 [ACK] Seq=256014835 Ack=14065047 Win=65535 Len=0
1,2.4983640000000378,54.93.77.70,10.0.2.15,TLSv1.2,1104,Application Data
1,2.5010709999996834,10.0.2.15,54.93.77.70,TLSv1.2,590,Application Data
1,2.5012189999997645,54.93.77.70,10.0.2.15,TCP,60,9001  >  34692 [ACK] Seq=256015885 Ack=14065583 Win=65535 Len=0
1,2.5072940000000017,62.210.85.178,10.0.2.15,TLSv1.2,1104,Application Data
1,2.545427000000018,62.210.85.178,10.0.2.15,TLSv1.2,590,Application Data
1,2.545509999999922,10.0.2.15,62.210.85.178,TCP,54,35978  >  9001 [ACK] Seq=256099029 Ack=13974421 Win=65535 Len=0
1,2.581210999999712,62.210.85.178,10.0.2.15,TLSv1.2,590,Application Data
1,2.6239699999996446,10.0.2.15,62.210.85.178,TCP,54,35978  >  9001 [ACK] Seq=256099029 Ack=13974957 Win=65535 Len=0
1,2.7454399999996895,62.210.85.178,10.0.2.15,TLSv1.2,590,Application Data
1,2.7455220000001646,10.0.2.15,62.210.85.178,TCP,54,35978  >  9001 [ACK] Seq=256099029 Ack=13975493 Win=65535 Len=0
1,2.746006999999736,10.0.2.15,62.210.85.178,TLSv1.2,590,Application Data
1,2.7461059999995996,62.210.85.178,10.0.2.15,TCP,60,9001  >  35978 [ACK] Seq=13975493 Ack=256099565 Win=65535 Len=0
1,2.8473430000003646,54.93.77.70,10.0.2.15,TLSv1.2,590,Application Data
1,2.8477309999998397,10.0.2.15,54.93.77.70,TLSv1.2,590,Application Data
1,2.847867000000406,54.93.77.70,10.0.2.15,TCP,60,9001  >  34692 [ACK] Seq=256016421 Ack=14066119 Win=65535 Len=0
1,3.0526449999997567,62.210.85.178,10.0.2.15,TLSv1.2,590,Application Data
1,3.0578709999999774,10.0.2.15,62.210.85.178,TLSv1.2,590,Application Data
1,3.0589600000002974,62.210.85.178,10.0.2.15,TCP,60,9001  >  35978 [ACK] Seq=13976029 Ack=256100101 Win=65535 Len=0
1,3.068210000000363,10.0.2.15,62.210.85.178,TLSv1.2,4124,Application Data
1,3.068307999999888,10.0.2.15,62.210.85.178,TCP,2974,35978  >  9001 [ACK] Seq=256104171 Ack=13976029 Win=65535 Len=2920 [TCP segment of a reassembled PDU]
1,3.0683509999998932,62.210.85.178,10.0.2.15,TCP,60,9001  >  35978 [ACK] Seq=13976029 Ack=256101561 Win=65535 Len=0
1,3.068361999999979,62.210.85.178,10.0.2.15,TCP,60,9001  >  35978 [ACK] Seq=13976029 Ack=256103021 Win=65535 Len=0
1,3.068366999999853,62.210.85.178,10.0.2.15,TCP,60,9001  >  35978 [ACK] Seq=13976029 Ack=256104171 Win=65535 Len=0
1,3.0683719999997265,62.210.85.178,10.0.2.15,TCP,60,9001  >  35978 [ACK] Seq=13976029 Ack=256105631 Win=65535 Len=0
1,3.0683749999998327,62.210.85.178,10.0.2.15,TCP,60,9001  >  35978 [ACK] Seq=13976029 Ack=256107091 Win=65535 Len=0
1,3.068409000000429,10.0.2.15,62.210.85.178,TLSv1.2,1204,Application Data
1,3.068446999999651,62.210.85.178,10.0.2.15,TCP,60,9001  >  35978 [ACK] Seq=13976029 Ack=256108241 Win=65535 Len=0
1,3.0684940000001006,10.0.2.15,62.210.85.178,TLSv1.2,4124,Application Data
1,3.068532999999661,62.210.85.178,10.0.2.15,TCP,60,9001  >  35978 [ACK] Seq=13976029 Ack=256109701 Win=65535 Len=0
1,3.068540999999641,62.210.85.178,10.0.2.15,TCP,60,9001  >  35978 [ACK] Seq=13976029 Ack=256111161 Win=65535 Len=0
1,3.068546000000424,62.210.85.178,10.0.2.15,TCP,60,9001  >  35978 [ACK] Seq=13976029 Ack=256112311 Win=65535 Len=0
1,3.0685849999999846,10.0.2.15,62.210.85.178,TLSv1.2,4124,Application Data
1,3.068623000000116,62.210.85.178,10.0.2.15,TCP,60,9001  >  35978 [ACK] Seq=13976029 Ack=256113771 Win=65535 Len=0
1,3.0686299999997573,62.210.85.178,10.0.2.15,TCP,60,9001  >  35978 [ACK] Seq=13976029 Ack=256115231 Win=65535 Len=0
1,3.0686900000000605,10.0.2.15,62.210.85.178,TLSv1.2,2974,Application Data
1,3.068757000000005,62.210.85.178,10.0.2.15,TCP,60,9001  >  35978 [ACK] Seq=13976029 Ack=256116381 Win=65535 Len=0
1,3.0687669999997524,62.210.85.178,10.0.2.15,TCP,60,9001  >  35978 [ACK] Seq=13976029 Ack=256117841 Win=65535 Len=0
1,3.0687699999998586,62.210.85.178,10.0.2.15,TCP,60,9001  >  35978 [ACK] Seq=13976029 Ack=256119301 Win=65535 Len=0
1,3.06880000000001,10.0.2.15,62.210.85.178,TLSv1.2,1226,Application Data
1,3.0688499999996566,62.210.85.178,10.0.2.15,TCP,60,9001  >  35978 [ACK] Seq=13976029 Ack=256120473 Win=65535 Len=0
1,3.0689030000003186,10.0.2.15,62.210.85.178,TLSv1.2,4124,Application Data
1,3.0689469999997527,62.210.85.178,10.0.2.15,TCP,60,9001  >  35978 [ACK] Seq=13976029 Ack=256121933 Win=65535 Len=0
1,3.068956000000071,62.210.85.178,10.0.2.15,TCP,60,9001  >  35978 [ACK] Seq=13976029 Ack=256123393 Win=65535 Len=0
1,3.0689609999999448,62.210.85.178,10.0.2.15,TCP,60,9001  >  35978 [ACK] Seq=13976029 Ack=256124543 Win=65535 Len=0
1,3.0690000000004147,10.0.2.15,62.210.85.178,TLSv1.2,3030,Application Data
1,3.0690400000003137,62.210.85.178,10.0.2.15,TCP,60,9001  >  35978 [ACK] Seq=13976029 Ack=256126003 Win=65535 Len=0
1,3.0690489999997226,62.210.85.178,10.0.2.15,TCP,60,9001  >  35978 [ACK] Seq=13976029 Ack=256127463 Win=65535 Len=0
1,3.0690530000001672,62.210.85.178,10.0.2.15,TCP,60,9001  >  35978 [ACK] Seq=13976029 Ack=256127519 Win=65535 Len=0
1,3.0805069999996704,10.0.2.15,62.210.85.178,TLSv1.2,4124,Application Data
1,3.080558999999994,62.210.85.178,10.0.2.15,TCP,60,9001  >  35978 [ACK] Seq=13976029 Ack=256128979 Win=65535 Len=0
1,3.0805700000000797,62.210.85.178,10.0.2.15,TCP,60,9001  >  35978 [ACK] Seq=13976029 Ack=256130439 Win=65535 Len=0
1,3.080573999999615,62.210.85.178,10.0.2.15,TCP,60,9001  >  35978 [ACK] Seq=13976029 Ack=256131589 Win=65535 Len=0
1,3.0806179999999586,10.0.2.15,62.210.85.178,TLSv1.2,4124,Application Data
1,3.080659000000196,62.210.85.178,10.0.2.15,TCP,60,9001  >  35978 [ACK] Seq=13976029 Ack=256133049 Win=65535 Len=0
1,3.080667000000176,62.210.85.178,10.0.2.15,TCP,60,9001  >  35978 [ACK] Seq=13976029 Ack=256134509 Win=65535 Len=0
1,3.0806720000000496,62.210.85.178,10.0.2.15,TCP,60,9001  >  35978 [ACK] Seq=13976029 Ack=256135659 Win=65535 Len=0
1,3.08071099999961,10.0.2.15,62.210.85.178,TLSv1.2,4124,Application Data
1,3.08075000000008,62.210.85.178,10.0.2.15,TCP,60,9001  >  35978 [ACK] Seq=13976029 Ack=256137119 Win=65535 Len=0
1,3.08075800000006,62.210.85.178,10.0.2.15,TCP,60,9001  >  35978 [ACK] Seq=13976029 Ack=256138579 Win=65535 Len=0
1,3.0807629999999335,62.210.85.178,10.0.2.15,TCP,60,9001  >  35978 [ACK] Seq=13976029 Ack=256139729 Win=65535 Len=0
1,3.0807999999997264,10.0.2.15,62.210.85.178,TLSv1.2,4124,Application Data
1,3.080837999999858,62.210.85.178,10.0.2.15,TCP,60,9001  >  35978 [ACK] Seq=13976029 Ack=256141189 Win=65535 Len=0
1,3.0808459999998377,62.210.85.178,10.0.2.15,TCP,60,9001  >  35978 [ACK] Seq=13976029 Ack=256142649 Win=65535 Len=0
1,3.0808500000002823,62.210.85.178,10.0.2.15,TCP,60,9001  >  35978 [ACK] Seq=13976029 Ack=256143799 Win=65535 Len=0
1,3.0808850000003076,10.0.2.15,62.210.85.178,TLSv1.2,332,Application Data
1,3.0809220000001005,62.210.85.178,10.0.2.15,TCP,60,9001  >  35978 [ACK] Seq=13976029 Ack=256144077 Win=65535 Len=0
1,3.080974000000424,10.0.2.15,62.210.85.178,TLSv1.2,3868,Application Data
1,3.0810129999999845,62.210.85.178,10.0.2.15,TCP,60,9001  >  35978 [ACK] Seq=13976029 Ack=256145537 Win=65535 Len=0
1,3.0810209999999643,62.210.85.178,10.0.2.15,TCP,60,9001  >  35978 [ACK] Seq=13976029 Ack=256146997 Win=65535 Len=0
1,3.081025000000409,62.210.85.178,10.0.2.15,TCP,60,9001  >  35978 [ACK] Seq=13976029 Ack=256147891 Win=65535 Len=0
1,3.081062999999631,10.0.2.15,62.210.85.178,TLSv1.2,4124,Application Data
1,3.0811009999997623,62.210.85.178,10.0.2.15,TCP,60,9001  >  35978 [ACK] Seq=13976029 Ack=256149351 Win=65535 Len=0
1,3.081108999999742,62.210.85.178,10.0.2.15,TCP,60,9001  >  35978 [ACK] Seq=13976029 Ack=256150811 Win=65535 Len=0
1,3.081111999999848,62.210.85.178,10.0.2.15,TCP,60,9001  >  35978 [ACK] Seq=13976029 Ack=256151961 Win=65535 Len=0
1,3.0811469999998735,10.0.2.15,62.210.85.178,TLSv1.2,3030,Application Data
1,3.0811860000003435,62.210.85.178,10.0.2.15,TCP,60,9001  >  35978 [ACK] Seq=13976029 Ack=256153421 Win=65535 Len=0
1,3.0811940000003233,62.210.85.178,10.0.2.15,TCP,60,9001  >  35978 [ACK] Seq=13976029 Ack=256154881 Win=65535 Len=0
1,3.0811979999998584,62.210.85.178,10.0.2.15,TCP,60,9001  >  35978 [ACK] Seq=13976029 Ack=256154937 Win=65535 Len=0
1,3.0926280000003317,10.0.2.15,62.210.85.178,TLSv1.2,590,Application Data
1,3.0926840000001903,62.210.85.178,10.0.2.15,TCP,60,9001  >  35978 [ACK] Seq=13976029 Ack=256155473 Win=65535 Len=0
1,3.2192860000004657,54.93.77.70,10.0.2.15,TLSv1.2,3674,Application Data
1,3.2194289999997636,10.0.2.15,54.93.77.70,TCP,54,34692  >  9001 [ACK] Seq=14066119 Ack=256020041 Win=65535 Len=0
1,3.2562669999997524,54.93.77.70,10.0.2.15,TLSv1.2,3674,Application Data
1,3.2563499999996566,10.0.2.15,54.93.77.70,TCP,54,34692  >  9001 [ACK] Seq=14066119 Ack=256023661 Win=65535 Len=0
1,3.2666760000001887,54.93.77.70,10.0.2.15,TCP,2950,"9001  >  34692 [PSH, ACK] Seq=256023661 Ack=14066119 Win=65535 Len=2896 [TCP segment of a reassembled PDU]"
1,3.2667220000003,10.0.2.15,54.93.77.70,TCP,54,34692  >  9001 [ACK] Seq=14066119 Ack=256026557 Win=65535 Len=0
1,3.27245000000039,54.93.77.70,10.0.2.15,TLSv1.2,778,Application Data
1,3.2781400000003487,54.93.77.70,10.0.2.15,TCP,2950,"9001  >  34692 [PSH, ACK] Seq=256027281 Ack=14066119 Win=65535 Len=2896 [TCP segment of a reassembled PDU]"
1,3.2781809999996767,10.0.2.15,54.93.77.70,TCP,54,34692  >  9001 [ACK] Seq=14066119 Ack=256030177 Win=65535 Len=0
1,3.291121000000203,54.93.77.70,10.0.2.15,TLSv1.2,1502,Application Data [TCP segment of a reassembled PDU]
1,3.291164000000208,10.0.2.15,54.93.77.70,TCP,54,34692  >  9001 [ACK] Seq=14066119 Ack=256031625 Win=65535 Len=0
1,3.2943020000002434,54.93.77.70,10.0.2.15,TLSv1.2,380,Application Data
1,3.300793999999769,54.93.77.70,10.0.2.15,TCP,2950,"9001  >  34692 [PSH, ACK] Seq=256031951 Ack=14066119 Win=65535 Len=2896 [TCP segment of a reassembled PDU]"
1,3.3008120000004055,54.93.77.70,10.0.2.15,TLSv1.2,1502,Application Data [TCP segment of a reassembled PDU]
1,3.3008810000001176,10.0.2.15,54.93.77.70,TCP,54,34692  >  9001 [ACK] Seq=14066119 Ack=256036295 Win=65535 Len=0
1,3.3021170000001803,54.93.77.70,10.0.2.15,TCP,2950,"9001  >  34692 [PSH, ACK] Seq=256036295 Ack=14066119 Win=65535 Len=2896 [TCP segment of a reassembled PDU]"
1,3.3021609999996144,10.0.2.15,54.93.77.70,TCP,54,34692  >  9001 [ACK] Seq=14066119 Ack=256039191 Win=65535 Len=0
1,3.310295999999653,54.93.77.70,10.0.2.15,TLSv1.2,568,Application Data
1,3.3126149999998233,54.93.77.70,10.0.2.15,TLSv1.2,5846,Application Data
1,3.3126979999997275,10.0.2.15,54.93.77.70,TCP,54,34692  >  9001 [ACK] Seq=14066119 Ack=256045497 Win=65535 Len=0
1,3.312923999999839,10.0.2.15,54.93.77.70,TLSv1.2,590,Application Data
1,3.312995000000228,54.93.77.70,10.0.2.15,TCP,1502,"9001  >  34692 [PSH, ACK] Seq=256045497 Ack=14066119 Win=65535 Len=1448 [TCP segment of a reassembled PDU]"
1,3.313003999999637,54.93.77.70,10.0.2.15,TCP,60,9001  >  34692 [ACK] Seq=256046945 Ack=14066655 Win=65535 Len=0
1,3.3130590000000666,10.0.2.15,54.93.77.70,TCP,54,34692  >  9001 [ACK] Seq=14066655 Ack=256046945 Win=65535 Len=0
1,3.327508000000307,54.93.77.70,10.0.2.15,TLSv1.2,1502,"Application Data, Application Data"
1,3.3276169999999183,10.0.2.15,54.93.77.70,TCP,54,34692  >  9001 [ACK] Seq=14066655 Ack=256048393 Win=65535 Len=0
1,3.3290319999996427,54.93.77.70,10.0.2.15,TLSv1.2,192,Application Data
1,3.339407000000392,54.93.77.70,10.0.2.15,TCP,2950,"9001  >  34692 [PSH, ACK] Seq=256048531 Ack=14066655 Win=65535 Len=2896 [TCP segment of a reassembled PDU]"
1,3.339495999999599,10.0.2.15,54.93.77.70,TCP,54,34692  >  9001 [ACK] Seq=14066655 Ack=256051427 Win=65535 Len=0
1,3.346013000000312,54.93.77.70,10.0.2.15,TLSv1.2,778,Application Data
1,3.353172000000086,54.93.77.70,10.0.2.15,TCP,2950,"9001  >  34692 [PSH, ACK] Seq=256052151 Ack=14066655 Win=65535 Len=2896 [TCP segment of a reassembled PDU]"
1,3.353226999999606,10.0.2.15,54.93.77.70,TCP,54,34692  >  9001 [ACK] Seq=14066655 Ack=256055047 Win=65535 Len=0
1,3.3614749999997002,54.93.77.70,10.0.2.15,TLSv1.2,5846,"Application Data, Application Data"
1,3.361547000000428,10.0.2.15,54.93.77.70,TCP,54,34692  >  9001 [ACK] Seq=14066655 Ack=256060839 Win=65535 Len=0
1,3.3621439999997165,54.93.77.70,10.0.2.15,TLSv1.2,4398,Application Data [TCP segment of a reassembled PDU]
1,3.3621869999997216,10.0.2.15,54.93.77.70,TCP,54,34692  >  9001 [ACK] Seq=14066655 Ack=256065183 Win=65535 Len=0
1,3.3627260000002934,54.93.77.70,10.0.2.15,TCP,1502,"9001  >  34692 [PSH, ACK] Seq=256065183 Ack=14066655 Win=65535 Len=1448 [TCP segment of a reassembled PDU]"
1,3.362771000000066,10.0.2.15,54.93.77.70,TCP,54,34692  >  9001 [ACK] Seq=14066655 Ack=256066631 Win=65535 Len=0
1,3.3691890000000058,54.93.77.70,10.0.2.15,TLSv1.2,568,Application Data
1,3.373703000000205,54.93.77.70,10.0.2.15,TCP,2950,"9001  >  34692 [PSH, ACK] Seq=256067145 Ack=14066655 Win=65535 Len=2896 [TCP segment of a reassembled PDU]"
1,3.373768000000382,10.0.2.15,54.93.77.70,TCP,54,34692  >  9001 [ACK] Seq=14066655 Ack=256070041 Win=65535 Len=0
1,3.384613999999601,54.93.77.70,10.0.2.15,TLSv1.2,1502,Application Data [TCP segment of a reassembled PDU]
1,3.384664000000157,10.0.2.15,54.93.77.70,TCP,54,34692  >  9001 [ACK] Seq=14066655 Ack=256071489 Win=65535 Len=0
1,3.384885000000395,10.0.2.15,54.93.77.70,TLSv1.2,1104,Application Data
1,3.3849980000004507,54.93.77.70,10.0.2.15,TCP,60,9001  >  34692 [ACK] Seq=256071489 Ack=14067705 Win=65535 Len=0
1,3.385116999999809,54.93.77.70,10.0.2.15,TLSv1.2,894,Application Data
1,3.3947129999996832,10.0.2.15,54.93.77.70,TLSv1.2,590,Application Data
1,3.3948890000001484,54.93.77.70,10.0.2.15,TCP,60,9001  >  34692 [ACK] Seq=256072329 Ack=14068241 Win=65535 Len=0
1,3.460642000000007,62.210.85.178,10.0.2.15,TLSv1.2,590,Application Data
1,3.5039710000000923,10.0.2.15,62.210.85.178,TCP,54,35978  >  9001 [ACK] Seq=256155473 Ack=13976565 Win=65535 Len=0
1,3.5216419999997015,62.210.85.178,10.0.2.15,TLSv1.2,1104,Application Data
1,3.5217099999999846,10.0.2.15,62.210.85.178,TCP,54,35978  >  9001 [ACK] Seq=256155473 Ack=13977615 Win=65535 Len=0
1,3.555333000000246,62.210.85.178,10.0.2.15,TLSv1.2,590,Application Data
1,3.555409999999938,10.0.2.15,62.210.85.178,TCP,54,35978  >  9001 [ACK] Seq=256155473 Ack=13978151 Win=65535 Len=0
1,3.5557129999997414,10.0.2.15,62.210.85.178,TLSv1.2,590,Application Data
1,3.555796999999984,62.210.85.178,10.0.2.15,TCP,60,9001  >  35978 [ACK] Seq=13978151 Ack=256156009 Win=65535 Len=0
1,3.665310999999747,54.93.77.70,10.0.2.15,TLSv1.2,590,Application Data
1,3.6657020000002376,10.0.2.15,54.93.77.70,TLSv1.2,590,Application Data
1,3.66580200000044,54.93.77.70,10.0.2.15,TCP,60,9001  >  34692 [ACK] Seq=256072865 Ack=14068777 Win=65535 Len=0
1,3.777560999999878,62.210.85.178,10.0.2.15,TLSv1.2,590,Application Data
1,3.7812919999996666,10.0.2.15,62.210.85.178,TLSv1.2,590,Application Data
1,3.781442999999854,62.210.85.178,10.0.2.15,TCP,60,9001  >  35978 [ACK] Seq=13978687 Ack=256156545 Win=65535 Len=0
1,3.7922269999999116,10.0.2.15,62.210.85.178,TLSv1.2,4124,Application Data
1,3.7923209999999017,10.0.2.15,62.210.85.178,TCP,2974,35978  >  9001 [ACK] Seq=256160615 Ack=13978687 Win=65535 Len=2920 [TCP segment of a reassembled PDU]
1,3.7923609999998007,62.210.85.178,10.0.2.15,TCP,60,9001  >  35978 [ACK] Seq=13978687 Ack=256158005 Win=65535 Len=0
1,3.792373000000225,62.210.85.178,10.0.2.15,TCP,60,9001  >  35978 [ACK] Seq=13978687 Ack=256159465 Win=65535 Len=0
1,3.7923790000004374,62.210.85.178,10.0.2.15,TCP,60,9001  >  35978 [ACK] Seq=13978687 Ack=256160615 Win=65535 Len=0
1,3.792381999999634,62.210.85.178,10.0.2.15,TCP,60,9001  >  35978 [ACK] Seq=13978687 Ack=256162075 Win=65535 Len=0
1,3.79238499999974,62.210.85.178,10.0.2.15,TCP,60,9001  >  35978 [ACK] Seq=13978687 Ack=256163535 Win=65535 Len=0
1,3.7924190000003364,10.0.2.15,62.210.85.178,TLSv1.2,1204,Application Data
1,3.7924540000003617,62.210.85.178,10.0.2.15,TCP,60,9001  >  35978 [ACK] Seq=13978687 Ack=256164685 Win=65535 Len=0
1,3.792497000000367,10.0.2.15,62.210.85.178,TLSv1.2,4124,Application Data
1,3.792532000000392,62.210.85.178,10.0.2.15,TCP,60,9001  >  35978 [ACK] Seq=13978687 Ack=256166145 Win=65535 Len=0
1,3.792540000000372,62.210.85.178,10.0.2.15,TCP,60,9001  >  35978 [ACK] Seq=13978687 Ack=256167605 Win=65535 Len=0
1,3.7925450000002456,62.210.85.178,10.0.2.15,TCP,60,9001  >  35978 [ACK] Seq=13978687 Ack=256168755 Win=65535 Len=0
1,3.792583999999806,10.0.2.15,62.210.85.178,TLSv1.2,4124,Application Data
1,3.7926180000004024,62.210.85.178,10.0.2.15,TCP,60,9001  >  35978 [ACK] Seq=13978687 Ack=256170215 Win=65535 Len=0
1,3.7926250000000437,62.210.85.178,10.0.2.15,TCP,60,9001  >  35978 [ACK] Seq=13978687 Ack=256171675 Win=65535 Len=0
1,3.792668000000049,62.210.85.178,10.0.2.15,TCP,60,9001  >  35978 [ACK] Seq=13978687 Ack=256172825 Win=65535 Len=0
1,3.7927019999997356,10.0.2.15,62.210.85.178,TLSv1.2,332,Application Data
1,3.792736000000332,62.210.85.178,10.0.2.15,TCP,60,9001  >  35978 [ACK] Seq=13978687 Ack=256173103 Win=65535 Len=0
1,3.792787999999746,10.0.2.15,62.210.85.178,TLSv1.2,3868,Application Data
1,3.792825000000448,62.210.85.178,10.0.2.15,TCP,60,9001  >  35978 [ACK] Seq=13978687 Ack=256174563 Win=65535 Len=0
1,3.7928320000000895,62.210.85.178,10.0.2.15,TCP,60,9001  >  35978 [ACK] Seq=13978687 Ack=256176023 Win=65535 Len=0
1,3.7928359999996246,62.210.85.178,10.0.2.15,TCP,60,9001  >  35978 [ACK] Seq=13978687 Ack=256176917 Win=65535 Len=0
1,3.7928719999999885,10.0.2.15,62.210.85.178,TLSv1.2,2452,Application Data
1,3.7929059999996753,62.210.85.178,10.0.2.15,TCP,60,9001  >  35978 [ACK] Seq=13978687 Ack=256178377 Win=65535 Len=0
1,3.792913000000226,62.210.85.178,10.0.2.15,TCP,60,9001  >  35978 [ACK] Seq=13978687 Ack=256179315 Win=65535 Len=0
1,3.8895880000000034,54.93.77.70,10.0.2.15,TLSv1.2,590,Application Data
1,3.918851000000359,54.93.77.70,10.0.2.15,TLSv1.2,5846,Application Data
1,3.9189619999997376,10.0.2.15,54.93.77.70,TCP,54,34692  >  9001 [ACK] Seq=14068777 Ack=256079193 Win=65535 Len=0
1,3.9195760000002338,54.93.77.70,10.0.2.15,TLSv1.2,5846,Application Data [TCP segment of a reassembled PDU]
1,3.9196179999999003,10.0.2.15,54.93.77.70,TCP,54,34692  >  9001 [ACK] Seq=14068777 Ack=256084985 Win=65535 Len=0
1,3.9354569999995874,54.93.77.70,10.0.2.15,TLSv1.2,358,Application Data
1,3.946584000000257,54.93.77.70,10.0.2.15,TCP,2950,"9001  >  34692 [PSH, ACK] Seq=256085289 Ack=14068777 Win=65535 Len=2896 [TCP segment of a reassembled PDU]"
1,3.946654999999737,10.0.2.15,54.93.77.70,TCP,54,34692  >  9001 [ACK] Seq=14068777 Ack=256088185 Win=65535 Len=0
1,3.955210000000079,54.93.77.70,10.0.2.15,TLSv1.2,2950,Application Data [TCP segment of a reassembled PDU]
1,3.9552560000001904,10.0.2.15,54.93.77.70,TCP,54,34692  >  9001 [ACK] Seq=14068777 Ack=256091081 Win=65535 Len=0
1,3.9557590000003984,54.93.77.70,10.0.2.15,TLSv1.2,4398,Application Data [TCP segment of a reassembled PDU]
1,3.9558029999998325,10.0.2.15,54.93.77.70,TCP,54,34692  >  9001 [ACK] Seq=14068777 Ack=256095425 Win=65535 Len=0
1,3.9623689999998533,54.93.77.70,10.0.2.15,TLSv1.2,778,Application Data
1,3.964680000000044,10.0.2.15,54.93.77.70,TLSv1.2,590,Application Data
1,3.9648440000000846,54.93.77.70,10.0.2.15,TCP,60,9001  >  34692 [ACK] Seq=256096149 Ack=14069313 Win=65535 Len=0
1,4.178947999999764,62.210.85.178,10.0.2.15,TLSv1.2,590,Application Data
1,4.1794300000001385,10.0.2.15,62.210.85.178,TLSv1.2,590,Application Data
1,4.179552999999942,62.210.85.178,10.0.2.15,TCP,60,9001  >  35978 [ACK] Seq=13979223 Ack=256179851 Win=65535 Len=0
1,4.385745999999926,54.93.77.70,10.0.2.15,TLSv1.2,590,Application Data
1,4.3861980000001495,10.0.2.15,54.93.77.70,TLSv1.2,590,Application Data
1,4.386340000000018,54.93.77.70,10.0.2.15,TCP,60,9001  >  34692 [ACK] Seq=256096685 Ack=14069849 Win=65535 Len=0
1,4.588619000000108,62.210.85.178,10.0.2.15,TLSv1.2,590,Application Data
1,4.59607700000015,10.0.2.15,62.210.85.178,TLSv1.2,590,Application Data
1,4.5962799999997515,62.210.85.178,10.0.2.15,TCP,60,9001  >  35978 [ACK] Seq=13979759 Ack=256180387 Win=65535 Len=0
1,4.608838000000105,10.0.2.15,62.210.85.178,TLSv1.2,4124,Application Data
1,4.608946000000287,10.0.2.15,62.210.85.178,TCP,2974,35978  >  9001 [ACK] Seq=256184457 Ack=13979759 Win=65535 Len=2920 [TCP segment of a reassembled PDU]
1,4.608994000000166,62.210.85.178,10.0.2.15,TCP,60,9001  >  35978 [ACK] Seq=13979759 Ack=256181847 Win=65535 Len=0
1,4.6090039999999135,62.210.85.178,10.0.2.15,TCP,60,9001  >  35978 [ACK] Seq=13979759 Ack=256183307 Win=65535 Len=0
1,4.609008999999787,62.210.85.178,10.0.2.15,TCP,60,9001  >  35978 [ACK] Seq=13979759 Ack=256184457 Win=65535 Len=0
1,4.609013000000232,62.210.85.178,10.0.2.15,TCP,60,9001  >  35978 [ACK] Seq=13979759 Ack=256185917 Win=65535 Len=0
1,4.609016999999767,62.210.85.178,10.0.2.15,TCP,60,9001  >  35978 [ACK] Seq=13979759 Ack=256187377 Win=65535 Len=0
1,4.609061000000111,10.0.2.15,62.210.85.178,TLSv1.2,1204,Application Data
1,4.609129000000394,10.0.2.15,62.210.85.178,TCP,2974,35978  >  9001 [ACK] Seq=256188527 Ack=13979759 Win=65535 Len=2920 [TCP segment of a reassembled PDU]
1,4.609167999999954,62.210.85.178,10.0.2.15,TCP,60,9001  >  35978 [ACK] Seq=13979759 Ack=256188527 Win=65535 Len=0
1,4.6091749999995955,62.210.85.178,10.0.2.15,TCP,60,9001  >  35978 [ACK] Seq=13979759 Ack=256189987 Win=65535 Len=0
1,4.609180000000379,62.210.85.178,10.0.2.15,TCP,60,9001  >  35978 [ACK] Seq=13979759 Ack=256191447 Win=65535 Len=0
1,4.609215000000404,10.0.2.15,62.210.85.178,TLSv1.2,1204,Application Data
1,4.609290000000328,62.210.85.178,10.0.2.15,TCP,60,9001  >  35978 [ACK] Seq=13979759 Ack=256192597 Win=65535 Len=0
1,4.60931999999957,10.0.2.15,62.210.85.178,TCP,2974,35978  >  9001 [ACK] Seq=256192597 Ack=13979759 Win=65535 Len=2920 [TCP segment of a reassembled PDU]
1,4.609357999999702,62.210.85.178,10.0.2.15,TCP,60,9001  >  35978 [ACK] Seq=13979759 Ack=256194057 Win=65535 Len=0
1,4.609363999999914,62.210.85.178,10.0.2.15,TCP,60,9001  >  35978 [ACK] Seq=13979759 Ack=256195517 Win=65535 Len=0
1,4.609395000000404,10.0.2.15,62.210.85.178,TLSv1.2,1204,Application Data
1,4.609462999999778,62.210.85.178,10.0.2.15,TCP,60,9001  >  35978 [ACK] Seq=13979759 Ack=256196667 Win=65535 Len=0
1,4.609496000000036,10.0.2.15,62.210.85.178,TLSv1.2,332,Application Data
1,4.609531000000061,62.210.85.178,10.0.2.15,TCP,60,9001  >  35978 [ACK] Seq=13979759 Ack=256196945 Win=65535 Len=0
1,4.609585999999581,10.0.2.15,62.210.85.178,TLSv1.2,3868,Application Data
1,4.609631000000263,62.210.85.178,10.0.2.15,TCP,60,9001  >  35978 [ACK] Seq=13979759 Ack=256198405 Win=65535 Len=0
1,4.609637999999904,62.210.85.178,10.0.2.15,TCP,60,9001  >  35978 [ACK] Seq=13979759 Ack=256199865 Win=65535 Len=0
1,4.609642000000349,62.210.85.178,10.0.2.15,TCP,60,9001  >  35978 [ACK] Seq=13979759 Ack=256200759 Win=65535 Len=0
1,4.609688999999889,10.0.2.15,62.210.85.178,TLSv1.2,4124,Application Data
1,4.609731000000465,62.210.85.178,10.0.2.15,TCP,60,9001  >  35978 [ACK] Seq=13979759 Ack=256202219 Win=65535 Len=0
1,4.609738000000107,62.210.85.178,10.0.2.15,TCP,60,9001  >  35978 [ACK] Seq=13979759 Ack=256203679 Win=65535 Len=0
1,4.60974299999998,62.210.85.178,10.0.2.15,TCP,60,9001  >  35978 [ACK] Seq=13979759 Ack=256204829 Win=65535 Len=0
1,4.609784999999647,10.0.2.15,62.210.85.178,TLSv1.2,3030,Application Data
1,4.6098250000004555,62.210.85.178,10.0.2.15,TCP,60,9001  >  35978 [ACK] Seq=13979759 Ack=256206289 Win=65535 Len=0
