No.,Time,Source,Destination,Protocol,Length,Info
1,0.009707000000162225,10.0.2.15,54.93.77.70,TCP,54,34692  >  9001 [ACK] Seq=14109939 Ack=256916815 Win=65535 Len=0
1,0.00981099999989965,10.0.2.15,62.210.85.178,TCP,54,35978  >  9001 [ACK] Seq=256999541 Ack=14019071 Win=65535 Len=0
1,0.10711199999968812,62.210.85.178,10.0.2.15,TLSv1.2,590,Application Data
1,0.10721099999955186,10.0.2.15,62.210.85.178,TCP,54,35978  >  9001 [ACK] Seq=256999541 Ack=14019607 Win=65535 Len=0
1,0.17589899999984482,10.0.2.15,54.93.77.70,TLSv1.2,590,Application Data
1,0.17606599999999162,54.93.77.70,10.0.2.15,TCP,60,9001  >  34692 [ACK] Seq=256916815 Ack=14110475 Win=65535 Len=0
1,0.2990700000000288,62.210.85.178,10.0.2.15,TLSv1.2,590,Application Data
1,0.2991469999997207,10.0.2.15,62.210.85.178,TCP,54,35978  >  9001 [ACK] Seq=256999541 Ack=14020143 Win=65535 Len=0
1,0.2994250000001557,10.0.2.15,62.210.85.178,TLSv1.2,590,Application Data
1,0.29951100000016595,62.210.85.178,10.0.2.15,TCP,60,9001  >  35978 [ACK] Seq=14020143 Ack=257000077 Win=65535 Len=0
1,0.4134759999997186,54.93.77.70,10.0.2.15,TLSv1.2,590,Application Data
1,0.41355300000032,10.0.2.15,54.93.77.70,TCP,54,34692  >  9001 [ACK] Seq=14110475 Ack=256917351 Win=65535 Len=0
1,0.4139450000002398,10.0.2.15,54.93.77.70,TLSv1.2,1618,Application Data
1,0.4140639999995983,54.93.77.70,10.0.2.15,TCP,60,9001  >  34692 [ACK] Seq=256917351 Ack=14111935 Win=65535 Len=0
1,0.4140749999996842,54.93.77.70,10.0.2.15,TCP,60,9001  >  34692 [ACK] Seq=256917351 Ack=14112039 Win=65535 Len=0
1,0.6328270000003613,62.210.85.178,10.0.2.15,TLSv1.2,1618,Application Data
1,0.6329439999999522,10.0.2.15,62.210.85.178,TCP,54,35978  >  9001 [ACK] Seq=257000077 Ack=14021707 Win=65535 Len=0
1,0.6498789999996006,10.0.2.15,62.210.85.178,TLSv1.2,590,Application Data
1,0.650445000000218,62.210.85.178,10.0.2.15,TCP,60,9001  >  35978 [ACK] Seq=14021707 Ack=257000613 Win=65535 Len=0
1,0.6617340000002514,10.0.2.15,62.210.85.178,TLSv1.2,1618,Application Data
1,0.6618889999999737,62.210.85.178,10.0.2.15,TCP,60,9001  >  35978 [ACK] Seq=14021707 Ack=257002073 Win=65535 Len=0
1,0.661909999999807,62.210.85.178,10.0.2.15,TCP,60,9001  >  35978 [ACK] Seq=14021707 Ack=257002177 Win=65535 Len=0
1,0.7927650000001449,54.93.77.70,10.0.2.15,TLSv1.2,2132,Application Data
1,0.7929180000000997,10.0.2.15,54.93.77.70,TCP,54,34692  >  9001 [ACK] Seq=14112039 Ack=256919429 Win=65535 Len=0
1,0.793123999999807,10.0.2.15,54.93.77.70,TLSv1.2,590,Application Data
1,0.7932090000003882,54.93.77.70,10.0.2.15,TCP,60,9001  >  34692 [ACK] Seq=256919429 Ack=14112575 Win=65535 Len=0
1,0.8034660000002987,10.0.2.15,54.93.77.70,TLSv1.2,590,Application Data
1,0.803621000000021,54.93.77.70,10.0.2.15,TCP,60,9001  >  34692 [ACK] Seq=256919429 Ack=14113111 Win=65535 Len=0
1,0.9005760000000009,62.210.85.178,10.0.2.15,TLSv1.2,590,Application Data
1,0.940679999999702,10.0.2.15,62.210.85.178,TCP,54,35978  >  9001 [ACK] Seq=257002177 Ack=14022243 Win=65535 Len=0
1,1.3495590000002267,62.210.85.178,10.0.2.15,TLSv1.2,590,Application Data
1,1.349637000000257,10.0.2.15,62.210.85.178,TCP,54,35978  >  9001 [ACK] Seq=257002177 Ack=14022779 Win=65535 Len=0
1,1.34992499999953,10.0.2.15,62.210.85.178,TLSv1.2,590,Application Data
1,1.350018000000091,62.210.85.178,10.0.2.15,TCP,60,9001  >  35978 [ACK] Seq=14022779 Ack=257002713 Win=65535 Len=0
1,1.555210999999872,54.93.77.70,10.0.2.15,TLSv1.2,590,Application Data
1,1.5560159999995449,10.0.2.15,54.93.77.70,TLSv1.2,590,Application Data
1,1.5564299999996365,54.93.77.70,10.0.2.15,TCP,60,9001  >  34692 [ACK] Seq=256919965 Ack=14113647 Win=65535 Len=0
1,1.7592999999997119,62.210.85.178,10.0.2.15,TLSv1.2,590,Application Data
1,1.7638600000000224,10.0.2.15,62.210.85.178,TLSv1.2,590,Application Data
1,1.7640119999996386,62.210.85.178,10.0.2.15,TCP,60,9001  >  35978 [ACK] Seq=14023315 Ack=257003249 Win=65535 Len=0
1,1.774185999999645,10.0.2.15,62.210.85.178,TLSv1.2,4124,Application Data
1,1.774293999999827,10.0.2.15,62.210.85.178,TCP,2974,35978  >  9001 [ACK] Seq=257007319 Ack=14023315 Win=65535 Len=2920 [TCP segment of a reassembled PDU]
1,1.7743819999996049,62.210.85.178,10.0.2.15,TCP,60,9001  >  35978 [ACK] Seq=14023315 Ack=257004709 Win=65535 Len=0
1,1.7744000000002416,62.210.85.178,10.0.2.15,TCP,60,9001  >  35978 [ACK] Seq=14023315 Ack=257006169 Win=65535 Len=0
1,1.7744059999995443,62.210.85.178,10.0.2.15,TCP,60,9001  >  35978 [ACK] Seq=14023315 Ack=257007319 Win=65535 Len=0
1,1.774409999999989,62.210.85.178,10.0.2.15,TCP,60,9001  >  35978 [ACK] Seq=14023315 Ack=257008779 Win=65535 Len=0
1,1.774413000000095,62.210.85.178,10.0.2.15,TCP,60,9001  >  35978 [ACK] Seq=14023315 Ack=257010239 Win=65535 Len=0
1,1.7744519999996555,10.0.2.15,62.210.85.178,TLSv1.2,1204,Application Data
1,1.7745020000002114,62.210.85.178,10.0.2.15,TCP,60,9001  >  35978 [ACK] Seq=14023315 Ack=257011389 Win=65535 Len=0
1,1.7745590000004086,10.0.2.15,62.210.85.178,TLSv1.2,4124,Application Data
1,1.7746010000000751,62.210.85.178,10.0.2.15,TCP,60,9001  >  35978 [ACK] Seq=14023315 Ack=257012849 Win=65535 Len=0
1,1.7746100000003935,62.210.85.178,10.0.2.15,TCP,60,9001  >  35978 [ACK] Seq=14023315 Ack=257014309 Win=65535 Len=0
1,1.7746150000002672,62.210.85.178,10.0.2.15,TCP,60,9001  >  35978 [ACK] Seq=14023315 Ack=257015459 Win=65535 Len=0
1,1.7746539999998276,10.0.2.15,62.210.85.178,TLSv1.2,4124,Application Data
1,1.774691999999959,62.210.85.178,10.0.2.15,TCP,60,9001  >  35978 [ACK] Seq=14023315 Ack=257016919 Win=65535 Len=0
1,1.7747010000002774,62.210.85.178,10.0.2.15,TCP,60,9001  >  35978 [ACK] Seq=14023315 Ack=257018379 Win=65535 Len=0
1,1.7747639999997773,10.0.2.15,62.210.85.178,TLSv1.2,2974,Application Data
1,1.7748060000003534,62.210.85.178,10.0.2.15,TCP,60,9001  >  35978 [ACK] Seq=14023315 Ack=257019529 Win=65535 Len=0
1,1.7748140000003332,62.210.85.178,10.0.2.15,TCP,60,9001  >  35978 [ACK] Seq=14023315 Ack=257020989 Win=65535 Len=0
1,1.7748169999995298,62.210.85.178,10.0.2.15,TCP,60,9001  >  35978 [ACK] Seq=14023315 Ack=257022449 Win=65535 Len=0
1,1.7748449999999139,10.0.2.15,62.210.85.178,TLSv1.2,1226,Application Data
1,1.7748819999997067,62.210.85.178,10.0.2.15,TCP,60,9001  >  35978 [ACK] Seq=14023315 Ack=257023621 Win=65535 Len=0
1,1.7749219999996058,10.0.2.15,62.210.85.178,TLSv1.2,4124,Application Data
1,1.7749610000000757,62.210.85.178,10.0.2.15,TCP,60,9001  >  35978 [ACK] Seq=14023315 Ack=257025081 Win=65535 Len=0
1,1.7749690000000555,62.210.85.178,10.0.2.15,TCP,60,9001  >  35978 [ACK] Seq=14023315 Ack=257026541 Win=65535 Len=0
1,1.7749729999995907,62.210.85.178,10.0.2.15,TCP,60,9001  >  35978 [ACK] Seq=14023315 Ack=257027691 Win=65535 Len=0
1,1.775010000000293,10.0.2.15,62.210.85.178,TLSv1.2,3030,Application Data
1,1.775047999999515,62.210.85.178,10.0.2.15,TCP,60,9001  >  35978 [ACK] Seq=14023315 Ack=257029151 Win=65535 Len=0
1,1.7750550000000658,62.210.85.178,10.0.2.15,TCP,60,9001  >  35978 [ACK] Seq=14023315 Ack=257030611 Win=65535 Len=0
1,1.775061000000278,62.210.85.178,10.0.2.15,TCP,60,9001  >  35978 [ACK] Seq=14023315 Ack=257030667 Win=65535 Len=0
1,1.7853530000002138,10.0.2.15,62.210.85.178,TLSv1.2,4124,Application Data
1,1.78541099999984,62.210.85.178,10.0.2.15,TCP,60,9001  >  35978 [ACK] Seq=14023315 Ack=257032127 Win=65535 Len=0
1,1.785421999999926,62.210.85.178,10.0.2.15,TCP,60,9001  >  35978 [ACK] Seq=14023315 Ack=257033587 Win=65535 Len=0
1,1.7854269999997996,62.210.85.178,10.0.2.15,TCP,60,9001  >  35978 [ACK] Seq=14023315 Ack=257034737 Win=65535 Len=0
1,1.7854719999995723,10.0.2.15,62.210.85.178,TLSv1.2,4124,Application Data
1,1.7855499999996027,62.210.85.178,10.0.2.15,TCP,60,9001  >  35978 [ACK] Seq=14023315 Ack=257036197 Win=65535 Len=0
1,1.7855579999995825,62.210.85.178,10.0.2.15,TCP,60,9001  >  35978 [ACK] Seq=14023315 Ack=257037657 Win=65535 Len=0
1,1.7855609999996886,62.210.85.178,10.0.2.15,TCP,60,9001  >  35978 [ACK] Seq=14023315 Ack=257038807 Win=65535 Len=0
1,1.785595000000285,10.0.2.15,62.210.85.178,TLSv1.2,3288,Application Data
1,1.7856330000004164,62.210.85.178,10.0.2.15,TCP,60,9001  >  35978 [ACK] Seq=14023315 Ack=257040267 Win=65535 Len=0
1,1.7856410000003962,62.210.85.178,10.0.2.15,TCP,60,9001  >  35978 [ACK] Seq=14023315 Ack=257041727 Win=65535 Len=0
1,1.7856460000002699,62.210.85.178,10.0.2.15,TCP,60,9001  >  35978 [ACK] Seq=14023315 Ack=257042041 Win=65535 Len=0
1,1.8640839999998207,54.93.77.70,10.0.2.15,TLSv1.2,590,Application Data
1,1.8915289999995366,54.93.77.70,10.0.2.15,TCP,2950,"9001  >  34692 [PSH, ACK] Seq=256920501 Ack=14113647 Win=65535 Len=2896 [TCP segment of a reassembled PDU]"
1,1.891646000000037,10.0.2.15,54.93.77.70,TCP,54,34692  >  9001 [ACK] Seq=14113647 Ack=256923397 Win=65535 Len=0
1,1.9079560000000129,54.93.77.70,10.0.2.15,TLSv1.2,778,Application Data
1,1.9236140000002706,54.93.77.70,10.0.2.15,TCP,2950,"9001  >  34692 [PSH, ACK] Seq=256924121 Ack=14113647 Win=65535 Len=2896 [TCP segment of a reassembled PDU]"
1,1.9236730000002353,10.0.2.15,54.93.77.70,TCP,54,34692  >  9001 [ACK] Seq=14113647 Ack=256927017 Win=65535 Len=0
1,1.9340590000001612,54.93.77.70,10.0.2.15,TLSv1.2,2950,Application Data [TCP segment of a reassembled PDU]
1,1.934078999999656,54.93.77.70,10.0.2.15,TLSv1.2,1502,Application Data
1,1.9341160000003583,10.0.2.15,54.93.77.70,TCP,54,34692  >  9001 [ACK] Seq=14113647 Ack=256929913 Win=65535 Len=0
1,1.9341930000000502,10.0.2.15,54.93.77.70,TCP,54,34692  >  9001 [ACK] Seq=14113647 Ack=256931361 Win=65535 Len=0
1,1.9424760000001697,54.93.77.70,10.0.2.15,TCP,2950,"9001  >  34692 [PSH, ACK] Seq=256931361 Ack=14113647 Win=65535 Len=2896 [TCP segment of a reassembled PDU]"
1,1.942493999999897,54.93.77.70,10.0.2.15,TLSv1.2,1314,"Application Data, Application Data"
1,1.9425300000002608,10.0.2.15,54.93.77.70,TCP,54,34692  >  9001 [ACK] Seq=14113647 Ack=256934257 Win=65535 Len=0
1,1.9544980000000578,54.93.77.70,10.0.2.15,TCP,2950,"9001  >  34692 [PSH, ACK] Seq=256935517 Ack=14113647 Win=65535 Len=2896 [TCP segment of a reassembled PDU]"
1,1.9545850000004066,10.0.2.15,54.93.77.70,TCP,54,34692  >  9001 [ACK] Seq=14113647 Ack=256938413 Win=65535 Len=0
1,1.971042000000125,54.93.77.70,10.0.2.15,TLSv1.2,2950,"Application Data, Application Data"
1,1.9711319999996704,10.0.2.15,54.93.77.70,TCP,54,34692  >  9001 [ACK] Seq=14113647 Ack=256941309 Win=65535 Len=0
1,1.9713629999996556,54.93.77.70,10.0.2.15,TLSv1.2,1010,Application Data
1,1.978425999999672,54.93.77.70,10.0.2.15,TCP,2950,"9001  >  34692 [PSH, ACK] Seq=256942265 Ack=14113647 Win=65535 Len=2896 [TCP segment of a reassembled PDU]"
1,1.9784730000001218,10.0.2.15,54.93.77.70,TCP,54,34692  >  9001 [ACK] Seq=14113647 Ack=256945161 Win=65535 Len=0
1,1.9899930000001405,54.93.77.70,10.0.2.15,TLSv1.2,7294,"Application Data, Application Data"
1,1.990136999999777,10.0.2.15,54.93.77.70,TCP,54,34692  >  9001 [ACK] Seq=14113647 Ack=256952401 Win=65535 Len=0
1,1.9903160000003481,10.0.2.15,54.93.77.70,TLSv1.2,590,Application Data
1,1.9903910000002725,54.93.77.70,10.0.2.15,TCP,60,9001  >  34692 [ACK] Seq=256952401 Ack=14114183 Win=65535 Len=0
1,1.9946559999998499,54.93.77.70,10.0.2.15,TLSv1.2,778,Application Data
1,2.0099449999997887,54.93.77.70,10.0.2.15,TCP,1502,"9001  >  34692 [PSH, ACK] Seq=256953125 Ack=14114183 Win=65535 Len=1448 [TCP segment of a reassembled PDU]"
1,2.0100039999997534,10.0.2.15,54.93.77.70,TCP,54,34692  >  9001 [ACK] Seq=14114183 Ack=256954573 Win=65535 Len=0
1,2.026426000000356,54.93.77.70,10.0.2.15,TLSv1.2,170,Application Data
1,2.0687090000001263,10.0.2.15,54.93.77.70,TCP,54,34692  >  9001 [ACK] Seq=14114183 Ack=256954689 Win=65535 Len=0
1,2.07169199999953,54.93.77.70,10.0.2.15,TCP,2950,"9001  >  34692 [PSH, ACK] Seq=256954689 Ack=14114183 Win=65535 Len=2896 [TCP segment of a reassembled PDU]"
1,2.071748000000298,10.0.2.15,54.93.77.70,TCP,54,34692  >  9001 [ACK] Seq=14114183 Ack=256957585 Win=65535 Len=0
1,2.0843740000000253,54.93.77.70,10.0.2.15,TLSv1.2,778,Application Data
1,2.0844139999999243,10.0.2.15,54.93.77.70,TCP,54,34692  >  9001 [ACK] Seq=14114183 Ack=256958309 Win=65535 Len=0
1,2.1169499999996333,62.210.85.178,10.0.2.15,TLSv1.2,590,Application Data
1,2.160729999999603,10.0.2.15,62.210.85.178,TCP,54,35978  >  9001 [ACK] Seq=257042041 Ack=14023851 Win=65535 Len=0
1,2.1726019999996424,54.93.77.70,10.0.2.15,TLSv1.2,1104,Application Data
1,2.172671000000264,10.0.2.15,54.93.77.70,TCP,54,34692  >  9001 [ACK] Seq=14114183 Ack=256959359 Win=65535 Len=0
1,2.175094999999601,10.0.2.15,54.93.77.70,TLSv1.2,590,Application Data
1,2.175253000000339,54.93.77.70,10.0.2.15,TCP,60,9001  >  34692 [ACK] Seq=256959359 Ack=14114719 Win=65535 Len=0
1,2.283198000000084,62.210.85.178,10.0.2.15,TLSv1.2,590,Application Data
1,2.2832730000000083,10.0.2.15,62.210.85.178,TCP,54,35978  >  9001 [ACK] Seq=257042041 Ack=14024387 Win=65535 Len=0
1,2.283749000000171,10.0.2.15,62.210.85.178,TLSv1.2,590,Application Data
1,2.2838510000001406,62.210.85.178,10.0.2.15,TCP,60,9001  >  35978 [ACK] Seq=14024387 Ack=257042577 Win=65535 Len=0
1,2.3830699999998615,54.93.77.70,10.0.2.15,TLSv1.2,590,Application Data
1,2.3834429999997155,10.0.2.15,54.93.77.70,TLSv1.2,590,Application Data
1,2.3835559999997713,54.93.77.70,10.0.2.15,TCP,60,9001  >  34692 [ACK] Seq=256959895 Ack=14115255 Win=65535 Len=0
1,2.885787000000164,62.210.85.178,10.0.2.15,TLSv1.2,590,Application Data
1,2.891574999999648,10.0.2.15,62.210.85.178,TLSv1.2,590,Application Data
1,2.891740000000027,62.210.85.178,10.0.2.15,TCP,60,9001  >  35978 [ACK] Seq=14024923 Ack=257043113 Win=65535 Len=0
1,2.9018969999997353,10.0.2.15,62.210.85.178,TLSv1.2,4124,Application Data
1,2.9020339999997304,62.210.85.178,10.0.2.15,TCP,60,9001  >  35978 [ACK] Seq=14024923 Ack=257044573 Win=65535 Len=0
1,2.902052999999796,62.210.85.178,10.0.2.15,TCP,60,9001  >  35978 [ACK] Seq=14024923 Ack=257046033 Win=65535 Len=0
1,2.902057000000241,62.210.85.178,10.0.2.15,TCP,60,9001  >  35978 [ACK] Seq=14024923 Ack=257047183 Win=65535 Len=0
1,2.9021219999995083,10.0.2.15,62.210.85.178,TLSv1.2,4124,Application Data
1,2.902197999999771,62.210.85.178,10.0.2.15,TCP,60,9001  >  35978 [ACK] Seq=14024923 Ack=257048643 Win=65535 Len=0
1,2.902205000000322,62.210.85.178,10.0.2.15,TCP,60,9001  >  35978 [ACK] Seq=14024923 Ack=257050103 Win=65535 Len=0
1,2.9022079999995185,62.210.85.178,10.0.2.15,TCP,60,9001  >  35978 [ACK] Seq=14024923 Ack=257051253 Win=65535 Len=0
1,2.9022439999998824,10.0.2.15,62.210.85.178,TLSv1.2,4124,Application Data
1,2.9022839999997814,62.210.85.178,10.0.2.15,TCP,60,9001  >  35978 [ACK] Seq=14024923 Ack=257052713 Win=65535 Len=0
1,2.9022930000000997,62.210.85.178,10.0.2.15,TCP,60,9001  >  35978 [ACK] Seq=14024923 Ack=257054173 Win=65535 Len=0
1,2.9022979999999734,62.210.85.178,10.0.2.15,TCP,60,9001  >  35978 [ACK] Seq=14024923 Ack=257055323 Win=65535 Len=0
1,2.902336000000105,10.0.2.15,62.210.85.178,TLSv1.2,4124,Application Data
1,2.9023729999998977,62.210.85.178,10.0.2.15,TCP,60,9001  >  35978 [ACK] Seq=14024923 Ack=257056783 Win=65535 Len=0
1,2.9023809999998775,62.210.85.178,10.0.2.15,TCP,60,9001  >  35978 [ACK] Seq=14024923 Ack=257058243 Win=65535 Len=0
1,2.902444000000287,10.0.2.15,62.210.85.178,TLSv1.2,2974,Application Data
1,2.902484000000186,62.210.85.178,10.0.2.15,TCP,60,9001  >  35978 [ACK] Seq=14024923 Ack=257059393 Win=65535 Len=0
1,2.9024920000001657,62.210.85.178,10.0.2.15,TCP,60,9001  >  35978 [ACK] Seq=14024923 Ack=257060853 Win=65535 Len=0
1,2.902495999999701,62.210.85.178,10.0.2.15,TCP,60,9001  >  35978 [ACK] Seq=14024923 Ack=257062313 Win=65535 Len=0
1,2.902524999999514,10.0.2.15,62.210.85.178,TLSv1.2,1226,Application Data
1,2.9025620000002164,62.210.85.178,10.0.2.15,TCP,60,9001  >  35978 [ACK] Seq=14024923 Ack=257063485 Win=65535 Len=0
1,2.9026029999995444,10.0.2.15,62.210.85.178,TLSv1.2,4124,Application Data
1,2.902640999999676,62.210.85.178,10.0.2.15,TCP,60,9001  >  35978 [ACK] Seq=14024923 Ack=257064945 Win=65535 Len=0
1,2.902649999999994,62.210.85.178,10.0.2.15,TCP,60,9001  >  35978 [ACK] Seq=14024923 Ack=257066405 Win=65535 Len=0
1,2.9026530000001003,62.210.85.178,10.0.2.15,TCP,60,9001  >  35978 [ACK] Seq=14024923 Ack=257067555 Win=65535 Len=0
1,2.9026910000002317,10.0.2.15,62.210.85.178,TLSv1.2,3030,Application Data
1,2.902729999999792,62.210.85.178,10.0.2.15,TCP,60,9001  >  35978 [ACK] Seq=14024923 Ack=257069015 Win=65535 Len=0
1,2.902737000000343,62.210.85.178,10.0.2.15,TCP,60,9001  >  35978 [ACK] Seq=14024923 Ack=257070475 Win=65535 Len=0
1,2.902740999999878,62.210.85.178,10.0.2.15,TCP,60,9001  >  35978 [ACK] Seq=14024923 Ack=257070531 Win=65535 Len=0
1,2.9119479999999385,10.0.2.15,62.210.85.178,TLSv1.2,4124,Application Data
1,2.912029000000075,62.210.85.178,10.0.2.15,TCP,60,9001  >  35978 [ACK] Seq=14024923 Ack=257071991 Win=65535 Len=0
1,2.9120389999998224,62.210.85.178,10.0.2.15,TCP,60,9001  >  35978 [ACK] Seq=14024923 Ack=257073451 Win=65535 Len=0
1,2.912043000000267,62.210.85.178,10.0.2.15,TCP,60,9001  >  35978 [ACK] Seq=14024923 Ack=257074601 Win=65535 Len=0
1,2.912083000000166,10.0.2.15,62.210.85.178,TLSv1.2,4124,Application Data
1,2.912126000000171,62.210.85.178,10.0.2.15,TCP,60,9001  >  35978 [ACK] Seq=14024923 Ack=257076061 Win=65535 Len=0
1,2.912134000000151,62.210.85.178,10.0.2.15,TCP,60,9001  >  35978 [ACK] Seq=14024923 Ack=257077521 Win=65535 Len=0
1,2.912137000000257,62.210.85.178,10.0.2.15,TCP,60,9001  >  35978 [ACK] Seq=14024923 Ack=257078671 Win=65535 Len=0
1,2.91217400000005,10.0.2.15,62.210.85.178,TLSv1.2,4124,Application Data
1,2.912207999999737,62.210.85.178,10.0.2.15,TCP,60,9001  >  35978 [ACK] Seq=14024923 Ack=257080131 Win=65535 Len=0
1,2.9122159999997166,62.210.85.178,10.0.2.15,TCP,60,9001  >  35978 [ACK] Seq=14024923 Ack=257081591 Win=65535 Len=0
1,2.9122200000001612,62.210.85.178,10.0.2.15,TCP,60,9001  >  35978 [ACK] Seq=14024923 Ack=257082741 Win=65535 Len=0
1,2.9122550000001866,10.0.2.15,62.210.85.178,TLSv1.2,4124,Application Data
1,2.9122889999998733,62.210.85.178,10.0.2.15,TCP,60,9001  >  35978 [ACK] Seq=14024923 Ack=257084201 Win=65535 Len=0
1,2.9122959999995146,62.210.85.178,10.0.2.15,TCP,60,9001  >  35978 [ACK] Seq=14024923 Ack=257085661 Win=65535 Len=0
1,2.912301000000298,62.210.85.178,10.0.2.15,TCP,60,9001  >  35978 [ACK] Seq=14024923 Ack=257086811 Win=65535 Len=0
1,2.9123349999999846,10.0.2.15,62.210.85.178,TLSv1.2,332,Application Data
1,2.9123689999996714,62.210.85.178,10.0.2.15,TCP,60,9001  >  35978 [ACK] Seq=14024923 Ack=257087089 Win=65535 Len=0
1,2.9124190000002272,10.0.2.15,62.210.85.178,TLSv1.2,3868,Application Data
1,2.9124549999996816,62.210.85.178,10.0.2.15,TCP,60,9001  >  35978 [ACK] Seq=14024923 Ack=257088549 Win=65535 Len=0
1,2.9124620000002324,62.210.85.178,10.0.2.15,TCP,60,9001  >  35978 [ACK] Seq=14024923 Ack=257090009 Win=65535 Len=0
1,2.9124650000003385,62.210.85.178,10.0.2.15,TCP,60,9001  >  35978 [ACK] Seq=14024923 Ack=257090903 Win=65535 Len=0
1,2.9125020000001314,10.0.2.15,62.210.85.178,TLSv1.2,4124,Application Data
1,2.912543999999798,62.210.85.178,10.0.2.15,TCP,60,9001  >  35978 [ACK] Seq=14024923 Ack=257092363 Win=65535 Len=0
1,2.91255000000001,62.210.85.178,10.0.2.15,TCP,60,9001  >  35978 [ACK] Seq=14024923 Ack=257093823 Win=65535 Len=0
1,2.9125530000001163,62.210.85.178,10.0.2.15,TCP,60,9001  >  35978 [ACK] Seq=14024923 Ack=257094973 Win=65535 Len=0
1,2.9125880000001416,10.0.2.15,62.210.85.178,TLSv1.2,3030,Application Data
1,2.9126399999995556,62.210.85.178,10.0.2.15,TCP,60,9001  >  35978 [ACK] Seq=14024923 Ack=257096433 Win=65535 Len=0
1,2.9126500000002125,62.210.85.178,10.0.2.15,TCP,60,9001  >  35978 [ACK] Seq=14024923 Ack=257097893 Win=65535 Len=0
1,2.9126530000003186,62.210.85.178,10.0.2.15,TCP,60,9001  >  35978 [ACK] Seq=14024923 Ack=257097949 Win=65535 Len=0
1,2.925216999999975,10.0.2.15,62.210.85.178,TLSv1.2,4124,Application Data
1,2.925296000000344,62.210.85.178,10.0.2.15,TCP,60,9001  >  35978 [ACK] Seq=14024923 Ack=257099409 Win=65535 Len=0
1,2.9253099999996266,62.210.85.178,10.0.2.15,TCP,60,9001  >  35978 [ACK] Seq=14024923 Ack=257100869 Win=65535 Len=0
1,2.9253129999997327,62.210.85.178,10.0.2.15,TCP,60,9001  >  35978 [ACK] Seq=14024923 Ack=257102019 Win=65535 Len=0
1,2.9253529999996317,10.0.2.15,62.210.85.178,TLSv1.2,4124,Application Data
1,2.925387999999657,62.210.85.178,10.0.2.15,TCP,60,9001  >  35978 [ACK] Seq=14024923 Ack=257103479 Win=65535 Len=0
1,2.925395999999637,62.210.85.178,10.0.2.15,TCP,60,9001  >  35978 [ACK] Seq=14024923 Ack=257104939 Win=65535 Len=0
1,2.9254000000000815,62.210.85.178,10.0.2.15,TCP,60,9001  >  35978 [ACK] Seq=14024923 Ack=257106089 Win=65535 Len=0
1,2.9254369999998744,10.0.2.15,62.210.85.178,TLSv1.2,4124,Application Data
1,2.925470999999561,62.210.85.178,10.0.2.15,TCP,60,9001  >  35978 [ACK] Seq=14024923 Ack=257107549 Win=65535 Len=0
1,2.925478000000112,62.210.85.178,10.0.2.15,TCP,60,9001  >  35978 [ACK] Seq=14024923 Ack=257109009 Win=65535 Len=0
1,2.925481999999647,62.210.85.178,10.0.2.15,TCP,60,9001  >  35978 [ACK] Seq=14024923 Ack=257110159 Win=65535 Len=0
1,2.925518000000011,10.0.2.15,62.210.85.178,TLSv1.2,2324,Application Data
1,2.92554999999993,62.210.85.178,10.0.2.15,TCP,60,9001  >  35978 [ACK] Seq=14024923 Ack=257111619 Win=65535 Len=0
1,2.92555799999991,62.210.85.178,10.0.2.15,TCP,60,9001  >  35978 [ACK] Seq=14024923 Ack=257112429 Win=65535 Len=0
1,3.017436999999518,54.93.77.70,10.0.2.15,TLSv1.2,590,Application Data
1,3.0548079999998663,54.93.77.70,10.0.2.15,TLSv1.2,3674,Application Data
1,3.054914000000281,10.0.2.15,54.93.77.70,TCP,54,34692  >  9001 [ACK] Seq=14115255 Ack=256964051 Win=65535 Len=0
1,3.0627949999998236,54.93.77.70,10.0.2.15,TLSv1.2,8742,"Application Data, Application Data"
1,3.0629030000000057,10.0.2.15,54.93.77.70,TCP,54,34692  >  9001 [ACK] Seq=14115255 Ack=256972739 Win=65535 Len=0
1,3.0632230000001073,10.0.2.15,54.93.77.70,TLSv1.2,590,Application Data
1,3.063339999999698,54.93.77.70,10.0.2.15,TCP,60,9001  >  34692 [ACK] Seq=256972739 Ack=14115791 Win=65535 Len=0
1,3.0642820000002757,54.93.77.70,10.0.2.15,TCP,1502,"9001  >  34692 [PSH, ACK] Seq=256972739 Ack=14115791 Win=65535 Len=1448 [TCP segment of a reassembled PDU]"
1,3.0643330000002607,10.0.2.15,54.93.77.70,TCP,54,34692  >  9001 [ACK] Seq=14115791 Ack=256974187 Win=65535 Len=0
1,3.071006000000125,54.93.77.70,10.0.2.15,TLSv1.2,1806,Application Data
1,3.071052000000236,10.0.2.15,54.93.77.70,TCP,54,34692  >  9001 [ACK] Seq=14115791 Ack=256975939 Win=65535 Len=0
1,3.074811999999838,54.93.77.70,10.0.2.15,TCP,2950,"9001  >  34692 [PSH, ACK] Seq=256975939 Ack=14115791 Win=65535 Len=2896 [TCP segment of a reassembled PDU]"
1,3.0748780000003535,10.0.2.15,54.93.77.70,TCP,54,34692  >  9001 [ACK] Seq=14115791 Ack=256978835 Win=65535 Len=0
1,3.0836319999998523,54.93.77.70,10.0.2.15,TLSv1.2,2950,Application Data [TCP segment of a reassembled PDU]
1,3.0836749999998574,10.0.2.15,54.93.77.70,TCP,54,34692  >  9001 [ACK] Seq=14115791 Ack=256981731 Win=65535 Len=0
1,3.0872920000001614,54.93.77.70,10.0.2.15,TLSv1.2,988,Application Data
1,3.0932769999999437,54.93.77.70,10.0.2.15,TCP,2950,"9001  >  34692 [PSH, ACK] Seq=256982665 Ack=14115791 Win=65535 Len=2896 [TCP segment of a reassembled PDU]"
1,3.093323000000055,10.0.2.15,54.93.77.70,TCP,54,34692  >  9001 [ACK] Seq=14115791 Ack=256985561 Win=65535 Len=0
1,3.1021129999999175,54.93.77.70,10.0.2.15,TLSv1.2,1502,"Application Data, Application Data"
1,3.1021600000003673,10.0.2.15,54.93.77.70,TCP,54,34692  >  9001 [ACK] Seq=14115791 Ack=256987009 Win=65535 Len=0
1,3.102356000000327,10.0.2.15,54.93.77.70,TLSv1.2,590,Application Data
1,3.1024649999999383,54.93.77.70,10.0.2.15,TCP,60,9001  >  34692 [ACK] Seq=256987009 Ack=14116327 Win=65535 Len=0
1,3.11052699999982,54.93.77.70,10.0.2.15,TLSv1.2,3298,Application Data [TCP segment of a reassembled PDU]
1,3.1106010000003153,10.0.2.15,54.93.77.70,TCP,54,34692  >  9001 [ACK] Seq=14116327 Ack=256990253 Win=65535 Len=0
1,3.120383999999831,54.93.77.70,10.0.2.15,TLSv1.2,2950,Application Data [TCP segment of a reassembled PDU]
1,3.120429999999942,10.0.2.15,54.93.77.70,TCP,54,34692  >  9001 [ACK] Seq=14116327 Ack=256993149 Win=65535 Len=0
1,3.121476000000257,54.93.77.70,10.0.2.15,TLSv1.2,4398,Application Data [TCP segment of a reassembled PDU]
1,3.1215229999997973,10.0.2.15,54.93.77.70,TCP,54,34692  >  9001 [ACK] Seq=14116327 Ack=256997493 Win=65535 Len=0
1,3.1266560000003665,54.93.77.70,10.0.2.15,TLSv1.2,1292,Application Data
1,3.1449759999995877,54.93.77.70,10.0.2.15,TLSv1.2,2950,Application Data
1,3.145046999999977,10.0.2.15,54.93.77.70,TCP,54,34692  >  9001 [ACK] Seq=14116327 Ack=257001627 Win=65535 Len=0
1,3.1450999999997293,54.93.77.70,10.0.2.15,TCP,1502,"9001  >  34692 [PSH, ACK] Seq=257001627 Ack=14116327 Win=65535 Len=1448 [TCP segment of a reassembled PDU]"
1,3.1451719999995476,10.0.2.15,54.93.77.70,TCP,54,34692  >  9001 [ACK] Seq=14116327 Ack=257003075 Win=65535 Len=0
1,3.1533369999997376,54.93.77.70,10.0.2.15,TLSv1.2,2950,Application Data [TCP segment of a reassembled PDU]
1,3.1534209999999803,10.0.2.15,54.93.77.70,TCP,54,34692  >  9001 [ACK] Seq=14116327 Ack=257005971 Win=65535 Len=0
1,3.1543140000003405,54.93.77.70,10.0.2.15,TLSv1.2,4398,Application Data [TCP segment of a reassembled PDU]
1,3.154363999999987,10.0.2.15,54.93.77.70,TCP,54,34692  >  9001 [ACK] Seq=14116327 Ack=257010315 Win=65535 Len=0
1,3.1610460000001694,54.93.77.70,10.0.2.15,TLSv1.2,894,Application Data
1,3.17779900000005,54.93.77.70,10.0.2.15,TLSv1.2,2950,Application Data
1,3.177821000000222,54.93.77.70,10.0.2.15,TCP,1502,"9001  >  34692 [PSH, ACK] Seq=257014051 Ack=14116327 Win=65535 Len=1448 [TCP segment of a reassembled PDU]"
1,3.177864000000227,10.0.2.15,54.93.77.70,TCP,54,34692  >  9001 [ACK] Seq=14116327 Ack=257014051 Win=65535 Len=0
1,3.1779520000000048,10.0.2.15,54.93.77.70,TCP,54,34692  >  9001 [ACK] Seq=14116327 Ack=257015499 Win=65535 Len=0
1,3.1780879999996614,10.0.2.15,54.93.77.70,TLSv1.2,590,Application Data
1,3.1782169999996768,54.93.77.70,10.0.2.15,TCP,60,9001  >  34692 [ACK] Seq=257015499 Ack=14116863 Win=65535 Len=0
1,3.1869759999999587,54.93.77.70,10.0.2.15,TLSv1.2,2950,Application Data [TCP segment of a reassembled PDU]
1,3.187025999999605,10.0.2.15,54.93.77.70,TCP,54,34692  >  9001 [ACK] Seq=14116863 Ack=257018395 Win=65535 Len=0
1,3.1876830000001064,54.93.77.70,10.0.2.15,TLSv1.2,5846,"Application Data, Application Data"
1,3.1877510000003895,10.0.2.15,54.93.77.70,TCP,54,34692  >  9001 [ACK] Seq=14116863 Ack=257024187 Win=65535 Len=0
1,3.188032000000021,10.0.2.15,54.93.77.70,TLSv1.2,590,Application Data
1,3.1881439999997383,54.93.77.70,10.0.2.15,TCP,60,9001  >  34692 [ACK] Seq=257024187 Ack=14117399 Win=65535 Len=0
1,3.1886670000003505,54.93.77.70,10.0.2.15,TCP,1502,"9001  >  34692 [PSH, ACK] Seq=257024187 Ack=14117399 Win=65535 Len=1448 [TCP segment of a reassembled PDU]"
1,3.188683999999739,62.210.85.178,10.0.2.15,TLSv1.2,590,Application Data
1,3.1887249999999767,10.0.2.15,54.93.77.70,TCP,54,34692  >  9001 [ACK] Seq=14117399 Ack=257025635 Win=65535 Len=0
1,3.1946820000002845,54.93.77.70,10.0.2.15,TLSv1.2,76,Application Data
1,3.229377999999997,62.210.85.178,10.0.2.15,TLSv1.2,590,Application Data
1,3.2294650000003458,10.0.2.15,62.210.85.178,TCP,54,35978  >  9001 [ACK] Seq=257112429 Ack=14025995 Win=65535 Len=0
1,3.236675999999534,10.0.2.15,54.93.77.70,TCP,54,34692  >  9001 [ACK] Seq=14117399 Ack=257025657 Win=65535 Len=0
1,3.2391820000002554,54.93.77.70,10.0.2.15,TCP,2950,"9001  >  34692 [PSH, ACK] Seq=257025657 Ack=14117399 Win=65535 Len=2896 [TCP segment of a reassembled PDU]"
1,3.239201000000321,54.93.77.70,10.0.2.15,TLSv1.2,778,Application Data
1,3.239270000000033,10.0.2.15,54.93.77.70,TCP,54,34692  >  9001 [ACK] Seq=14117399 Ack=257029277 Win=65535 Len=0
1,3.2406129999999393,10.0.2.15,54.93.77.70,TLSv1.2,590,Application Data
1,3.2407299999995303,54.93.77.70,10.0.2.15,TCP,60,9001  >  34692 [ACK] Seq=257029277 Ack=14117935 Win=65535 Len=0
1,3.250633999999991,10.0.2.15,54.93.77.70,TLSv1.2,590,Application Data
1,3.250810999999885,54.93.77.70,10.0.2.15,TCP,60,9001  >  34692 [ACK] Seq=257029277 Ack=14118471 Win=65535 Len=0
1,3.2914220000002388,62.210.85.178,10.0.2.15,TLSv1.2,590,Application Data
1,3.302480000000287,54.93.77.70,10.0.2.15,TLSv1.2,590,Application Data
1,3.3310419999997976,62.210.85.178,10.0.2.15,TLSv1.2,590,Application Data
1,3.3311320000002524,10.0.2.15,62.210.85.178,TCP,54,35978  >  9001 [ACK] Seq=257112429 Ack=14027067 Win=65535 Len=0
1,3.344648999999663,10.0.2.15,54.93.77.70,TCP,54,34692  >  9001 [ACK] Seq=14118471 Ack=257029813 Win=65535 Len=0
1,3.3820200000000114,62.210.85.178,10.0.2.15,TLSv1.2,1104,Application Data
1,3.382470999999896,10.0.2.15,62.210.85.178,TLSv1.2,590,Application Data
1,3.3825779999997394,62.210.85.178,10.0.2.15,TCP,60,9001  >  35978 [ACK] Seq=14028117 Ack=257112965 Win=65535 Len=0
1,3.602358999999524,54.93.77.70,10.0.2.15,TLSv1.2,590,Application Data
1,3.6024349999997867,10.0.2.15,54.93.77.70,TCP,54,34692  >  9001 [ACK] Seq=14118471 Ack=257030349 Win=65535 Len=0
1,3.6028409999998985,10.0.2.15,54.93.77.70,TLSv1.2,590,Application Data
1,3.6029379999999946,54.93.77.70,10.0.2.15,TCP,60,9001  >  34692 [ACK] Seq=257030349 Ack=14119007 Win=65535 Len=0
1,3.7354919999997946,62.210.85.178,10.0.2.15,TLSv1.2,590,Application Data
1,3.7406639999999243,10.0.2.15,62.210.85.178,TLSv1.2,590,Application Data
1,3.740813999999773,62.210.85.178,10.0.2.15,TCP,60,9001  >  35978 [ACK] Seq=14028653 Ack=257113501 Win=65535 Len=0
1,3.7533370000001014,10.0.2.15,62.210.85.178,TLSv1.2,4124,Application Data
1,3.753464000000349,10.0.2.15,62.210.85.178,TCP,2974,35978  >  9001 [ACK] Seq=257117571 Ack=14028653 Win=65535 Len=2920 [TCP segment of a reassembled PDU]
1,3.7535079999997834,62.210.85.178,10.0.2.15,TCP,60,9001  >  35978 [ACK] Seq=14028653 Ack=257114961 Win=65535 Len=0
1,3.7535189999998693,62.210.85.178,10.0.2.15,TCP,60,9001  >  35978 [ACK] Seq=14028653 Ack=257116421 Win=65535 Len=0
1,3.753523999999743,62.210.85.178,10.0.2.15,TCP,60,9001  >  35978 [ACK] Seq=14028653 Ack=257117571 Win=65535 Len=0
1,3.7535280000001876,62.210.85.178,10.0.2.15,TCP,60,9001  >  35978 [ACK] Seq=14028653 Ack=257119031 Win=65535 Len=0
1,3.7535330000000613,62.210.85.178,10.0.2.15,TCP,60,9001  >  35978 [ACK] Seq=14028653 Ack=257120491 Win=65535 Len=0
1,3.753577000000405,10.0.2.15,62.210.85.178,TLSv1.2,1204,Application Data
1,3.7536479999998846,10.0.2.15,62.210.85.178,TCP,2974,35978  >  9001 [ACK] Seq=257121641 Ack=14028653 Win=65535 Len=2920 [TCP segment of a reassembled PDU]
1,3.7536849999996775,62.210.85.178,10.0.2.15,TCP,60,9001  >  35978 [ACK] Seq=14028653 Ack=257121641 Win=65535 Len=0
1,3.7536920000002283,62.210.85.178,10.0.2.15,TCP,60,9001  >  35978 [ACK] Seq=14028653 Ack=257123101 Win=65535 Len=0
1,3.7536959999997634,62.210.85.178,10.0.2.15,TCP,60,9001  >  35978 [ACK] Seq=14028653 Ack=257124561 Win=65535 Len=0
1,3.7537309999997888,10.0.2.15,62.210.85.178,TLSv1.2,1204,Application Data
1,3.7538210000002437,10.0.2.15,62.210.85.178,TCP,2974,35978  >  9001 [ACK] Seq=257125711 Ack=14028653 Win=65535 Len=2920 [TCP segment of a reassembled PDU]
1,3.7538430000004155,62.210.85.178,10.0.2.15,TCP,60,9001  >  35978 [ACK] Seq=14028653 Ack=257125711 Win=65535 Len=0
1,3.7538750000003347,10.0.2.15,62.210.85.178,TLSv1.2,1204,Application Data
1,3.753910999999789,62.210.85.178,10.0.2.15,TCP,60,9001  >  35978 [ACK] Seq=14028653 Ack=257127171 Win=65535 Len=0
1,3.75391800000034,62.210.85.178,10.0.2.15,TCP,60,9001  >  35978 [ACK] Seq=14028653 Ack=257128631 Win=65535 Len=0
1,3.753979000000072,10.0.2.15,62.210.85.178,TLSv1.2,2974,Application Data
1,3.7540200000003097,62.210.85.178,10.0.2.15,TCP,60,9001  >  35978 [ACK] Seq=14028653 Ack=257129781 Win=65535 Len=0
1,3.754052000000229,10.0.2.15,62.210.85.178,TLSv1.2,1226,Application Data
1,3.7540879999996832,62.210.85.178,10.0.2.15,TCP,60,9001  >  35978 [ACK] Seq=14028653 Ack=257131241 Win=65535 Len=0
1,3.7540939999998955,62.210.85.178,10.0.2.15,TCP,60,9001  >  35978 [ACK] Seq=14028653 Ack=257132701 Win=65535 Len=0
1,3.754098999999769,62.210.85.178,10.0.2.15,TCP,60,9001  >  35978 [ACK] Seq=14028653 Ack=257133873 Win=65535 Len=0
1,3.7541419999997743,10.0.2.15,62.210.85.178,TLSv1.2,4124,Application Data
1,3.7541819999996733,62.210.85.178,10.0.2.15,TCP,60,9001  >  35978 [ACK] Seq=14028653 Ack=257135333 Win=65535 Len=0
1,3.7541879999998855,62.210.85.178,10.0.2.15,TCP,60,9001  >  35978 [ACK] Seq=14028653 Ack=257136793 Win=65535 Len=0
1,3.7541959999998653,62.210.85.178,10.0.2.15,TCP,60,9001  >  35978 [ACK] Seq=14028653 Ack=257137943 Win=65535 Len=0
1,3.7542419999999765,10.0.2.15,62.210.85.178,TLSv1.2,3030,Application Data
1,3.754280000000108,62.210.85.178,10.0.2.15,TCP,60,9001  >  35978 [ACK] Seq=14028653 Ack=257139403 Win=65535 Len=0
1,3.7542869999997492,62.210.85.178,10.0.2.15,TCP,60,9001  >  35978 [ACK] Seq=14028653 Ack=257140863 Win=65535 Len=0
1,3.754291999999623,62.210.85.178,10.0.2.15,TCP,60,9001  >  35978 [ACK] Seq=14028653 Ack=257140919 Win=65535 Len=0
1,3.763509999999769,10.0.2.15,62.210.85.178,TLSv1.2,4124,Application Data
1,3.7636019999999917,10.0.2.15,62.210.85.178,TCP,2974,35978  >  9001 [ACK] Seq=257144989 Ack=14028653 Win=65535 Len=2920 [TCP segment of a reassembled PDU]
1,3.763643000000229,62.210.85.178,10.0.2.15,TCP,60,9001  >  35978 [ACK] Seq=14028653 Ack=257142379 Win=65535 Len=0
1,3.763651999999638,62.210.85.178,10.0.2.15,TCP,60,9001  >  35978 [ACK] Seq=14028653 Ack=257143839 Win=65535 Len=0
1,3.7636569999995118,62.210.85.178,10.0.2.15,TCP,60,9001  >  35978 [ACK] Seq=14028653 Ack=257144989 Win=65535 Len=0
1,3.763694999999643,10.0.2.15,62.210.85.178,TLSv1.2,1204,Application Data
1,3.7637329999997746,62.210.85.178,10.0.2.15,TCP,60,9001  >  35978 [ACK] Seq=14028653 Ack=257146449 Win=65535 Len=0
1,3.763738999999987,62.210.85.178,10.0.2.15,TCP,60,9001  >  35978 [ACK] Seq=14028653 Ack=257147909 Win=65535 Len=0
1,3.7637439999998605,62.210.85.178,10.0.2.15,TCP,60,9001  >  35978 [ACK] Seq=14028653 Ack=257149059 Win=65535 Len=0
1,3.7637910000003103,10.0.2.15,62.210.85.178,TLSv1.2,4124,Application Data
1,3.7638550000001487,10.0.2.15,62.210.85.178,TCP,2974,35978  >  9001 [ACK] Seq=257153129 Ack=14028653 Win=65535 Len=2920 [TCP segment of a reassembled PDU]
1,3.7638919999999416,62.210.85.178,10.0.2.15,TCP,60,9001  >  35978 [ACK] Seq=14028653 Ack=257150519 Win=65535 Len=0
1,3.763898999999583,62.210.85.178,10.0.2.15,TCP,60,9001  >  35978 [ACK] Seq=14028653 Ack=257151979 Win=65535 Len=0
1,3.7639030000000275,62.210.85.178,10.0.2.15,TCP,60,9001  >  35978 [ACK] Seq=14028653 Ack=257153129 Win=65535 Len=0
1,3.763907999999901,62.210.85.178,10.0.2.15,TCP,60,9001  >  35978 [ACK] Seq=14028653 Ack=257154589 Win=65535 Len=0
1,3.763912000000346,62.210.85.178,10.0.2.15,TCP,60,9001  >  35978 [ACK] Seq=14028653 Ack=257156049 Win=65535 Len=0
1,3.763949999999568,10.0.2.15,62.210.85.178,TLSv1.2,1204,Application Data
1,3.7639890000000378,62.210.85.178,10.0.2.15,TCP,60,9001  >  35978 [ACK] Seq=14028653 Ack=257157199 Win=65535 Len=0
1,3.764035000000149,10.0.2.15,62.210.85.178,TLSv1.2,332,Application Data
1,3.7640739999997095,62.210.85.178,10.0.2.15,TCP,60,9001  >  35978 [ACK] Seq=14028653 Ack=257157477 Win=65535 Len=0
1,3.764137999999548,10.0.2.15,62.210.85.178,TLSv1.2,3868,Application Data
1,3.764205000000402,10.0.2.15,62.210.85.178,TCP,2974,35978  >  9001 [ACK] Seq=257161291 Ack=14028653 Win=65535 Len=2920 [TCP segment of a reassembled PDU]
1,3.764245000000301,62.210.85.178,10.0.2.15,TCP,60,9001  >  35978 [ACK] Seq=14028653 Ack=257158937 Win=65535 Len=0
1,3.764251999999942,62.210.85.178,10.0.2.15,TCP,60,9001  >  35978 [ACK] Seq=14028653 Ack=257160397 Win=65535 Len=0
1,3.764256000000387,62.210.85.178,10.0.2.15,TCP,60,9001  >  35978 [ACK] Seq=14028653 Ack=257161291 Win=65535 Len=0
1,3.7642610000002605,62.210.85.178,10.0.2.15,TCP,60,9001  >  35978 [ACK] Seq=14028653 Ack=257162751 Win=65535 Len=0
1,3.7642649999997957,62.210.85.178,10.0.2.15,TCP,60,9001  >  35978 [ACK] Seq=14028653 Ack=257164211 Win=65535 Len=0
1,3.764302999999927,10.0.2.15,62.210.85.178,TLSv1.2,1204,Application Data
1,3.7643410000000586,62.210.85.178,10.0.2.15,TCP,60,9001  >  35978 [ACK] Seq=14028653 Ack=257165361 Win=65535 Len=0
1,3.76438700000017,10.0.2.15,62.210.85.178,TLSv1.2,3030,Application Data
1,3.7644259999997303,62.210.85.178,10.0.2.15,TCP,60,9001  >  35978 [ACK] Seq=14028653 Ack=257166821 Win=65535 Len=0
1,3.764433000000281,62.210.85.178,10.0.2.15,TCP,60,9001  >  35978 [ACK] Seq=14028653 Ack=257168281 Win=65535 Len=0
1,3.764436999999816,62.210.85.178,10.0.2.15,TCP,60,9001  >  35978 [ACK] Seq=14028653 Ack=257168337 Win=65535 Len=0
1,3.776977999999872,10.0.2.15,62.210.85.178,TLSv1.2,590,Application Data
1,3.777035000000069,62.210.85.178,10.0.2.15,TCP,60,9001  >  35978 [ACK] Seq=14028653 Ack=257168873 Win=65535 Len=0
1,3.8550500000001193,54.93.77.70,10.0.2.15,TLSv1.2,590,Application Data
1,3.8869599999998172,54.93.77.70,10.0.2.15,TCP,2950,"9001  >  34692 [PSH, ACK] Seq=257030885 Ack=14119007 Win=65535 Len=2896 [TCP segment of a reassembled PDU]"
1,3.887029999999868,10.0.2.15,54.93.77.70,TCP,54,34692  >  9001 [ACK] Seq=14119007 Ack=257033781 Win=65535 Len=0
1,3.8870799999995143,54.93.77.70,10.0.2.15,TLSv1.2,778,Application Data
1,3.908121999999821,54.93.77.70,10.0.2.15,TLSv1.2,7294,Application Data
1,3.908215000000382,10.0.2.15,54.93.77.70,TCP,54,34692  >  9001 [ACK] Seq=14119007 Ack=257041745 Win=65535 Len=0
1,3.9083499999997002,54.93.77.70,10.0.2.15,TLSv1.2,568,Application Data
1,3.921389999999519,54.93.77.70,10.0.2.15,TCP,2950,"9001  >  34692 [PSH, ACK] Seq=257042259 Ack=14119007 Win=65535 Len=2896 [TCP segment of a reassembled PDU]"
1,3.92145999999957,10.0.2.15,54.93.77.70,TCP,54,34692  >  9001 [ACK] Seq=14119007 Ack=257045155 Win=65535 Len=0
1,3.926462999999785,54.93.77.70,10.0.2.15,TLSv1.2,778,Application Data
1,3.9340919999995094,54.93.77.70,10.0.2.15,TCP,2950,"9001  >  34692 [PSH, ACK] Seq=257045879 Ack=14119007 Win=65535 Len=2896 [TCP segment of a reassembled PDU]"
1,3.934138999999959,10.0.2.15,54.93.77.70,TCP,54,34692  >  9001 [ACK] Seq=14119007 Ack=257048775 Win=65535 Len=0
1,3.9426039999998466,54.93.77.70,10.0.2.15,TLSv1.2,778,Application Data
1,3.9596419999998034,54.93.77.70,10.0.2.15,TLSv1.2,2950,Application Data
1,3.9597579999999653,10.0.2.15,54.93.77.70,TCP,54,34692  >  9001 [ACK] Seq=14119007 Ack=257052395 Win=65535 Len=0
1,3.9598150000001624,54.93.77.70,10.0.2.15,TLSv1.2,5448,"Application Data, Application Data"
1,3.9598949999999604,10.0.2.15,54.93.77.70,TCP,54,34692  >  9001 [ACK] Seq=14119007 Ack=257057789 Win=65535 Len=0
1,3.960186000000249,10.0.2.15,54.93.77.70,TLSv1.2,590,Application Data
1,3.9602640000002793,54.93.77.70,10.0.2.15,TCP,60,9001  >  34692 [ACK] Seq=257057789 Ack=14119543 Win=65535 Len=0
1,3.9808819999998377,54.93.77.70,10.0.2.15,TLSv1.2,1618,Application Data
1,3.9810099999995145,10.0.2.15,54.93.77.70,TCP,54,34692  >  9001 [ACK] Seq=14119543 Ack=257059353 Win=65535 Len=0
1,4.056926000000203,54.93.77.70,10.0.2.15,TCP,2950,"9001  >  34692 [PSH, ACK] Seq=257059353 Ack=14119543 Win=65535 Len=2896 [TCP segment of a reassembled PDU]"
1,4.057058999999754,10.0.2.15,54.93.77.70,TCP,54,34692  >  9001 [ACK] Seq=14119543 Ack=257062249 Win=65535 Len=0
1,4.058493999999882,54.93.77.70,10.0.2.15,TLSv1.2,778,Application Data
1,4.065991000000395,54.93.77.70,10.0.2.15,TLSv1.2,5846,Application Data
1,4.066095999999561,10.0.2.15,54.93.77.70,TCP,54,34692  >  9001 [ACK] Seq=14119543 Ack=257068765 Win=65535 Len=0
1,4.066950000000361,54.93.77.70,10.0.2.15,TLSv1.2,2950,Application Data [TCP segment of a reassembled PDU]
1,4.0669920000000275,10.0.2.15,54.93.77.70,TCP,54,34692  >  9001 [ACK] Seq=14119543 Ack=257071661 Win=65535 Len=0
1,4.07539799999995,54.93.77.70,10.0.2.15,TLSv1.2,684,Application Data
1,4.115835999999945,54.93.77.70,10.0.2.15,TLSv1.2,1104,Application Data
1,4.115885000000162,10.0.2.15,54.93.77.70,TCP,54,34692  >  9001 [ACK] Seq=14119543 Ack=257073341 Win=65535 Len=0
1,4.1257009999999354,54.93.77.70,10.0.2.15,TLSv1.2,4398,Application Data
1,4.125727999999981,62.210.85.178,10.0.2.15,TLSv1.2,590,Application Data
1,4.1257949999999255,10.0.2.15,54.93.77.70,TCP,54,34692  >  9001 [ACK] Seq=14119543 Ack=257077685 Win=65535 Len=0
1,4.1259399999999005,10.0.2.15,54.93.77.70,TLSv1.2,590,Application Data
1,4.126009999999951,54.93.77.70,10.0.2.15,TCP,60,9001  >  34692 [ACK] Seq=257077685 Ack=14120079 Win=65535 Len=0
1,4.134216000000379,54.93.77.70,10.0.2.15,TLSv1.2,894,Application Data
1,4.136405999999624,54.93.77.70,10.0.2.15,TCP,1502,"9001  >  34692 [PSH, ACK] Seq=257078525 Ack=14120079 Win=65535 Len=1448 [TCP segment of a reassembled PDU]"
1,4.1364480000002,10.0.2.15,54.93.77.70,TCP,54,34692  >  9001 [ACK] Seq=14120079 Ack=257079973 Win=65535 Len=0
1,4.157521999999517,54.93.77.70,10.0.2.15,TLSv1.2,684,Application Data
1,4.162341999999626,54.93.77.70,10.0.2.15,TCP,1502,"9001  >  34692 [PSH, ACK] Seq=257080603 Ack=14120079 Win=65535 Len=1448 [TCP segment of a reassembled PDU]"
1,4.162389000000076,10.0.2.15,54.93.77.70,TCP,54,34692  >  9001 [ACK] Seq=14120079 Ack=257082051 Win=65535 Len=0
1,4.1686939999999595,10.0.2.15,62.210.85.178,TCP,54,35978  >  9001 [ACK] Seq=257168873 Ack=14029189 Win=65535 Len=0
1,4.184489000000212,54.93.77.70,10.0.2.15,TLSv1.2,1198,Application Data
1,4.1846230000001015,10.0.2.15,54.93.77.70,TLSv1.2,590,Application Data
1,4.184690000000046,54.93.77.70,10.0.2.15,TCP,60,9001  >  34692 [ACK] Seq=257083195 Ack=14120615 Win=65535 Len=0
1,4.197613000000274,54.93.77.70,10.0.2.15,TCP,1502,"9001  >  34692 [PSH, ACK] Seq=257083195 Ack=14120615 Win=65535 Len=1448 [TCP segment of a reassembled PDU]"
1,4.1976770000001125,10.0.2.15,54.93.77.70,TCP,54,34692  >  9001 [ACK] Seq=14120615 Ack=257084643 Win=65535 Len=0
1,4.204405000000406,54.93.77.70,10.0.2.15,TLSv1.2,1198,Application Data
1,4.2066109999996115,10.0.2.15,54.93.77.70,TLSv1.2,590,Application Data
1,4.206782000000203,54.93.77.70,10.0.2.15,TCP,60,9001  >  34692 [ACK] Seq=257085787 Ack=14121151 Win=65535 Len=0
1,4.218566999999894,10.0.2.15,54.93.77.70,TLSv1.2,590,Application Data
1,4.218761999999515,54.93.77.70,10.0.2.15,TCP,60,9001  >  34692 [ACK] Seq=257085787 Ack=14121687 Win=65535 Len=0
1,4.257163999999648,54.93.77.70,10.0.2.15,TLSv1.2,590,Application Data
1,4.266649000000143,62.210.85.178,10.0.2.15,TLSv1.2,590,Application Data
1,4.2667220000003,10.0.2.15,62.210.85.178,TCP,54,35978  >  9001 [ACK] Seq=257168873 Ack=14029725 Win=65535 Len=0
1,4.300717000000077,10.0.2.15,54.93.77.70,TCP,54,34692  >  9001 [ACK] Seq=14121687 Ack=257086323 Win=65535 Len=0
1,4.330500000000029,62.210.85.178,10.0.2.15,TLSv1.2,590,Application Data
1,4.330574999999953,10.0.2.15,62.210.85.178,TCP,54,35978  >  9001 [ACK] Seq=257168873 Ack=14030261 Win=65535 Len=0
1,4.360279999999875,62.210.85.178,10.0.2.15,TLSv1.2,1104,Application Data
1,4.360380000000077,10.0.2.15,62.210.85.178,TCP,54,35978  >  9001 [ACK] Seq=257168873 Ack=14031311 Win=65535 Len=0
1,4.360948999999891,10.0.2.15,62.210.85.178,TLSv1.2,590,Application Data
1,4.361257999999907,62.210.85.178,10.0.2.15,TCP,60,9001  >  35978 [ACK] Seq=14031311 Ack=257169409 Win=65535 Len=0
1,4.471191999999974,54.93.77.70,10.0.2.15,TLSv1.2,590,Application Data
1,4.471287000000302,10.0.2.15,54.93.77.70,TCP,54,34692  >  9001 [ACK] Seq=14121687 Ack=257086859 Win=65535 Len=0
1,4.471709000000374,10.0.2.15,54.93.77.70,TLSv1.2,590,Application Data
1,4.471803999999793,54.93.77.70,10.0.2.15,TCP,60,9001  >  34692 [ACK] Seq=257086859 Ack=14122223 Win=65535 Len=0
1,5.139879999999721,62.210.85.178,10.0.2.15,TLSv1.2,590,Application Data
1,5.1455550000000585,10.0.2.15,62.210.85.178,TLSv1.2,590,Application Data
1,5.146620999999868,62.210.85.178,10.0.2.15,TCP,60,9001  >  35978 [ACK] Seq=14031847 Ack=257169945 Win=65535 Len=0
1,5.157170000000406,10.0.2.15,62.210.85.178,TLSv1.2,4124,Application Data
1,5.157296000000315,10.0.2.15,62.210.85.178,TCP,2974,35978  >  9001 [ACK] Seq=257174015 Ack=14031847 Win=65535 Len=2920 [TCP segment of a reassembled PDU]
1,5.157341000000088,62.210.85.178,10.0.2.15,TCP,60,9001  >  35978 [ACK] Seq=14031847 Ack=257171405 Win=65535 Len=0
1,5.157352000000174,62.210.85.178,10.0.2.15,TCP,60,9001  >  35978 [ACK] Seq=14031847 Ack=257172865 Win=65535 Len=0
1,5.157357000000047,62.210.85.178,10.0.2.15,TCP,60,9001  >  35978 [ACK] Seq=14031847 Ack=257174015 Win=65535 Len=0
1,5.157360999999582,62.210.85.178,10.0.2.15,TCP,60,9001  >  35978 [ACK] Seq=14031847 Ack=257175475 Win=65535 Len=0
1,5.157366000000366,62.210.85.178,10.0.2.15,TCP,60,9001  >  35978 [ACK] Seq=14031847 Ack=257176935 Win=65535 Len=0
1,5.157411000000138,10.0.2.15,62.210.85.178,TLSv1.2,1204,Application Data
1,5.157510000000002,10.0.2.15,62.210.85.178,TCP,2974,35978  >  9001 [ACK] Seq=257178085 Ack=14031847 Win=65535 Len=2920 [TCP segment of a reassembled PDU]
1,5.157532000000174,62.210.85.178,10.0.2.15,TCP,60,9001  >  35978 [ACK] Seq=14031847 Ack=257178085 Win=65535 Len=0
1,5.157567999999628,10.0.2.15,62.210.85.178,TLSv1.2,1204,Application Data
1,5.1576029999996535,62.210.85.178,10.0.2.15,TCP,60,9001  >  35978 [ACK] Seq=14031847 Ack=257179545 Win=65535 Len=0
1,5.157610000000204,62.210.85.178,10.0.2.15,TCP,60,9001  >  35978 [ACK] Seq=14031847 Ack=257181005 Win=65535 Len=0
1,5.1576139999997395,62.210.85.178,10.0.2.15,TCP,60,9001  >  35978 [ACK] Seq=14031847 Ack=257182155 Win=65535 Len=0
1,5.157659999999851,10.0.2.15,62.210.85.178,TLSv1.2,4124,Application Data
1,5.157753999999841,62.210.85.178,10.0.2.15,TCP,60,9001  >  35978 [ACK] Seq=14031847 Ack=257183615 Win=65535 Len=0
1,5.157763000000159,62.210.85.178,10.0.2.15,TCP,60,9001  >  35978 [ACK] Seq=14031847 Ack=257185075 Win=65535 Len=0
1,5.157766999999694,62.210.85.178,10.0.2.15,TCP,60,9001  >  35978 [ACK] Seq=14031847 Ack=257186225 Win=65535 Len=0
1,5.157798000000184,10.0.2.15,62.210.85.178,TLSv1.2,2974,Application Data
1,5.1578529999997045,10.0.2.15,62.210.85.178,TLSv1.2,1226,Application Data
1,5.15788799999973,62.210.85.178,10.0.2.15,TCP,60,9001  >  35978 [ACK] Seq=14031847 Ack=257187685 Win=65535 Len=0
1,5.157895000000281,62.210.85.178,10.0.2.15,TCP,60,9001  >  35978 [ACK] Seq=14031847 Ack=257189145 Win=65535 Len=0
1,5.157898999999816,62.210.85.178,10.0.2.15,TCP,60,9001  >  35978 [ACK] Seq=14031847 Ack=257190317 Win=65535 Len=0
1,5.157944999999927,10.0.2.15,62.210.85.178,TLSv1.2,4124,Application Data
1,5.1580400000002555,62.210.85.178,10.0.2.15,TCP,60,9001  >  35978 [ACK] Seq=14031847 Ack=257191777 Win=65535 Len=0
1,5.158056000000215,62.210.85.178,10.0.2.15,TCP,60,9001  >  35978 [ACK] Seq=14031847 Ack=257193237 Win=65535 Len=0
1,5.158061000000089,62.210.85.178,10.0.2.15,TCP,60,9001  >  35978 [ACK] Seq=14031847 Ack=257194387 Win=65535 Len=0
1,5.158097999999882,10.0.2.15,62.210.85.178,TLSv1.2,1488,Application Data
1,5.158137999999781,62.210.85.178,10.0.2.15,TCP,60,9001  >  35978 [ACK] Seq=14031847 Ack=257195821 Win=65535 Len=0
1,5.2603650000000926,54.93.77.70,10.0.2.15,TLSv1.2,3674,Application Data
1,5.260532999999668,10.0.2.15,54.93.77.70,TCP,54,34692  >  9001 [ACK] Seq=14122223 Ack=257090479 Win=65535 Len=0
1,5.28338900000017,54.93.77.70,10.0.2.15,TLSv1.2,3674,Application Data
1,5.283457999999882,10.0.2.15,54.93.77.70,TCP,54,34692  >  9001 [ACK] Seq=14122223 Ack=257094099 Win=65535 Len=0
1,5.294934999999896,54.93.77.70,10.0.2.15,TCP,2950,"9001  >  34692 [PSH, ACK] Seq=257094099 Ack=14122223 Win=65535 Len=2896 [TCP segment of a reassembled PDU]"
1,5.294982000000346,10.0.2.15,54.93.77.70,TCP,54,34692  >  9001 [ACK] Seq=14122223 Ack=257096995 Win=65535 Len=0
1,5.299465000000055,54.93.77.70,10.0.2.15,TLSv1.2,778,Application Data
1,5.314217000000099,54.93.77.70,10.0.2.15,TLSv1.2,4398,Application Data
1,5.314266000000316,10.0.2.15,54.93.77.70,TCP,54,34692  >  9001 [ACK] Seq=14122223 Ack=257102063 Win=65535 Len=0
1,5.315577999999732,54.93.77.70,10.0.2.15,TLSv1.2,380,Application Data
1,5.323594999999841,54.93.77.70,10.0.2.15,TCP,1502,"9001  >  34692 [PSH, ACK] Seq=257102389 Ack=14122223 Win=65535 Len=1448 [TCP segment of a reassembled PDU]"
1,5.323636999999508,10.0.2.15,54.93.77.70,TCP,54,34692  >  9001 [ACK] Seq=14122223 Ack=257103837 Win=65535 Len=0
1,5.331924000000072,54.93.77.70,10.0.2.15,TLSv1.2,1198,Application Data
1,5.345046000000366,54.93.77.70,10.0.2.15,TCP,2950,"9001  >  34692 [PSH, ACK] Seq=257104981 Ack=14122223 Win=65535 Len=2896 [TCP segment of a reassembled PDU]"
1,5.3451420000001235,54.93.77.70,10.0.2.15,TLSv1.2,1502,Application Data [TCP segment of a reassembled PDU]
1,5.345199000000321,10.0.2.15,54.93.77.70,TCP,54,34692  >  9001 [ACK] Seq=14122223 Ack=257109325 Win=65535 Len=0
1,5.349416000000019,54.93.77.70,10.0.2.15,TLSv1.2,1408,Application Data
1,5.364829999999529,54.93.77.70,10.0.2.15,TCP,1502,"9001  >  34692 [PSH, ACK] Seq=257110679 Ack=14122223 Win=65535 Len=1448 [TCP segment of a reassembled PDU]"
1,5.364918999999645,10.0.2.15,54.93.77.70,TCP,54,34692  >  9001 [ACK] Seq=14122223 Ack=257112127 Win=65535 Len=0
1,5.365705000000162,54.93.77.70,10.0.2.15,TLSv1.2,1198,Application Data
1,5.36837099999957,10.0.2.15,54.93.77.70,TLSv1.2,590,Application Data
1,5.368521000000328,54.93.77.70,10.0.2.15,TCP,60,9001  >  34692 [ACK] Seq=257113271 Ack=14122759 Win=65535 Len=0
1,5.380347000000256,10.0.2.15,54.93.77.70,TLSv1.2,590,Application Data
1,5.380653999999595,54.93.77.70,10.0.2.15,TCP,60,9001  >  34692 [ACK] Seq=257113271 Ack=14123295 Win=65535 Len=0
1,5.959114000000227,62.210.85.178,10.0.2.15,TLSv1.2,1104,Application Data
1,5.959439999999631,10.0.2.15,62.210.85.178,TLSv1.2,590,Application Data
1,5.959549000000152,62.210.85.178,10.0.2.15,TCP,60,9001  >  35978 [ACK] Seq=14032897 Ack=257196357 Win=65535 Len=0
1,6.068798000000243,54.93.77.70,10.0.2.15,TLSv1.2,590,Application Data
1,6.069260000000213,10.0.2.15,54.93.77.70,TLSv1.2,590,Application Data
1,6.069370999999592,54.93.77.70,10.0.2.15,TCP,60,9001  >  34692 [ACK] Seq=257113807 Ack=14123831 Win=65535 Len=0
1,6.2647509999997055,62.210.85.178,10.0.2.15,TLSv1.2,590,Application Data
1,6.2703679999995074,10.0.2.15,62.210.85.178,TLSv1.2,590,Application Data
1,6.270593999999619,62.210.85.178,10.0.2.15,TCP,60,9001  >  35978 [ACK] Seq=14033433 Ack=257196893 Win=65535 Len=0
1,6.2808649999997215,10.0.2.15,62.210.85.178,TLSv1.2,4124,Application Data
1,6.281022000000121,10.0.2.15,62.210.85.178,TCP,2974,35978  >  9001 [ACK] Seq=257200963 Ack=14033433 Win=65535 Len=2920 [TCP segment of a reassembled PDU]
1,6.281079000000318,62.210.85.178,10.0.2.15,TCP,60,9001  >  35978 [ACK] Seq=14033433 Ack=257198353 Win=65535 Len=0
1,6.281092999999601,62.210.85.178,10.0.2.15,TCP,60,9001  >  35978 [ACK] Seq=14033433 Ack=257199813 Win=65535 Len=0
1,6.281098000000384,62.210.85.178,10.0.2.15,TCP,60,9001  >  35978 [ACK] Seq=14033433 Ack=257200963 Win=65535 Len=0
1,6.2811430000001565,10.0.2.15,62.210.85.178,TLSv1.2,1204,Application Data
1,6.281184000000394,62.210.85.178,10.0.2.15,TCP,60,9001  >  35978 [ACK] Seq=14033433 Ack=257202423 Win=65535 Len=0
1,6.281191000000035,62.210.85.178,10.0.2.15,TCP,60,9001  >  35978 [ACK] Seq=14033433 Ack=257203883 Win=65535 Len=0
1,6.281235000000379,62.210.85.178,10.0.2.15,TCP,60,9001  >  35978 [ACK] Seq=14033433 Ack=257205033 Win=65535 Len=0
1,6.281288000000131,10.0.2.15,62.210.85.178,TLSv1.2,4124,Application Data
1,6.2813569999998435,10.0.2.15,62.210.85.178,TCP,2974,35978  >  9001 [ACK] Seq=257209103 Ack=14033433 Win=65535 Len=2920 [TCP segment of a reassembled PDU]
1,6.281393999999636,62.210.85.178,10.0.2.15,TCP,60,9001  >  35978 [ACK] Seq=14033433 Ack=257206493 Win=65535 Len=0
1,6.281401000000187,62.210.85.178,10.0.2.15,TCP,60,9001  >  35978 [ACK] Seq=14033433 Ack=257207953 Win=65535 Len=0
1,6.281406000000061,62.210.85.178,10.0.2.15,TCP,60,9001  >  35978 [ACK] Seq=14033433 Ack=257209103 Win=65535 Len=0
1,6.281409999999596,62.210.85.178,10.0.2.15,TCP,60,9001  >  35978 [ACK] Seq=14033433 Ack=257210563 Win=65535 Len=0
1,6.281415000000379,62.210.85.178,10.0.2.15,TCP,60,9001  >  35978 [ACK] Seq=14033433 Ack=257212023 Win=65535 Len=0
1,6.28145399999994,10.0.2.15,62.210.85.178,TLSv1.2,1204,Application Data
1,6.281536000000415,10.0.2.15,62.210.85.178,TLSv1.2,2974,Application Data
1,6.281574999999975,62.210.85.178,10.0.2.15,TCP,60,9001  >  35978 [ACK] Seq=14033433 Ack=257213173 Win=65535 Len=0
1,6.2815819999996165,62.210.85.178,10.0.2.15,TCP,60,9001  >  35978 [ACK] Seq=14033433 Ack=257214633 Win=65535 Len=0
1,6.281586000000061,62.210.85.178,10.0.2.15,TCP,60,9001  >  35978 [ACK] Seq=14033433 Ack=257216093 Win=65535 Len=0
1,6.2816210000000865,10.0.2.15,62.210.85.178,TLSv1.2,1226,Application Data
1,6.281657999999879,62.210.85.178,10.0.2.15,TCP,60,9001  >  35978 [ACK] Seq=14033433 Ack=257217265 Win=65535 Len=0
1,6.281703999999991,10.0.2.15,62.210.85.178,TLSv1.2,4124,Application Data
1,6.28174399999989,62.210.85.178,10.0.2.15,TCP,60,9001  >  35978 [ACK] Seq=14033433 Ack=257218725 Win=65535 Len=0
1,6.281750999999531,62.210.85.178,10.0.2.15,TCP,60,9001  >  35978 [ACK] Seq=14033433 Ack=257220185 Win=65535 Len=0
1,6.2817549999999756,62.210.85.178,10.0.2.15,TCP,60,9001  >  35978 [ACK] Seq=14033433 Ack=257221335 Win=65535 Len=0
1,6.281799999999748,10.0.2.15,62.210.85.178,TLSv1.2,2002,Application Data
1,6.281839000000218,62.210.85.178,10.0.2.15,TCP,60,9001  >  35978 [ACK] Seq=14033433 Ack=257222795 Win=65535 Len=0
1,6.2818459999998595,62.210.85.178,10.0.2.15,TCP,60,9001  >  35978 [ACK] Seq=14033433 Ack=257223283 Win=65535 Len=0
1,6.364263000000392,54.93.77.70,10.0.2.15,TLSv1.2,590,Application Data
1,6.388531999999941,54.93.77.70,10.0.2.15,TCP,2950,"9001  >  34692 [PSH, ACK] Seq=257114343 Ack=14123831 Win=65535 Len=2896 [TCP segment of a reassembled PDU]"
1,6.388632999999572,10.0.2.15,54.93.77.70,TCP,54,34692  >  9001 [ACK] Seq=14123831 Ack=257117239 Win=65535 Len=0
1,6.394188000000213,54.93.77.70,10.0.2.15,TLSv1.2,4398,"Application Data, Application Data"
1,6.394234000000324,10.0.2.15,54.93.77.70,TCP,54,34692  >  9001 [ACK] Seq=14123831 Ack=257121583 Win=65535 Len=0
1,6.417975000000297,54.93.77.70,10.0.2.15,TCP,2950,"9001  >  34692 [PSH, ACK] Seq=257121583 Ack=14123831 Win=65535 Len=2896 [TCP segment of a reassembled PDU]"
1,6.418055000000095,10.0.2.15,54.93.77.70,TCP,54,34692  >  9001 [ACK] Seq=14123831 Ack=257124479 Win=65535 Len=0
1,6.4184040000000095,54.93.77.70,10.0.2.15,TLSv1.2,778,Application Data
1,6.455071000000316,54.93.77.70,10.0.2.15,TCP,2950,"9001  >  34692 [PSH, ACK] Seq=257125203 Ack=14123831 Win=65535 Len=2896 [TCP segment of a reassembled PDU]"
1,6.455184000000372,10.0.2.15,54.93.77.70,TCP,54,34692  >  9001 [ACK] Seq=14123831 Ack=257128099 Win=65535 Len=0
1,6.455229999999574,54.93.77.70,10.0.2.15,TLSv1.2,4398,Application Data [TCP segment of a reassembled PDU]
1,6.45532699999967,10.0.2.15,54.93.77.70,TCP,54,34692  >  9001 [ACK] Seq=14123831 Ack=257132443 Win=65535 Len=0
1,6.461823999999979,54.93.77.70,10.0.2.15,TLSv1.2,1502,"Application Data, Application Data"
1,6.461870999999519,10.0.2.15,54.93.77.70,TCP,54,34692  >  9001 [ACK] Seq=14123831 Ack=257133891 Win=65535 Len=0
1,6.462069999999585,10.0.2.15,54.93.77.70,TLSv1.2,590,Application Data
1,6.462187999999514,54.93.77.70,10.0.2.15,TCP,60,9001  >  34692 [ACK] Seq=257133891 Ack=14124367 Win=65535 Len=0
1,6.4705659999999625,54.93.77.70,10.0.2.15,TLSv1.2,2950,Application Data [TCP segment of a reassembled PDU]
1,6.470655999999508,10.0.2.15,54.93.77.70,TCP,54,34692  >  9001 [ACK] Seq=14124367 Ack=257136787 Win=65535 Len=0
1,6.47105399999964,54.93.77.70,10.0.2.15,TLSv1.2,916,Application Data
1,6.502631000000292,54.93.77.70,10.0.2.15,TCP,2950,"9001  >  34692 [PSH, ACK] Seq=257137649 Ack=14124367 Win=65535 Len=2896 [TCP segment of a reassembled PDU]"
1,6.502685000000383,10.0.2.15,54.93.77.70,TCP,54,34692  >  9001 [ACK] Seq=14124367 Ack=257140545 Win=65535 Len=0
1,6.5197589999997945,54.93.77.70,10.0.2.15,TLSv1.2,264,Application Data
1,6.519991999999547,10.0.2.15,54.93.77.70,TLSv1.2,590,Application Data
1,6.520120000000134,54.93.77.70,10.0.2.15,TCP,60,9001  >  34692 [ACK] Seq=257140755 Ack=14124903 Win=65535 Len=0
1,6.529986999999892,10.0.2.15,54.93.77.70,TLSv1.2,590,Application Data
1,6.530157999999574,54.93.77.70,10.0.2.15,TCP,60,9001  >  34692 [ACK] Seq=257140755 Ack=14125439 Win=65535 Len=0
1,6.580740999999762,62.210.85.178,10.0.2.15,TLSv1.2,590,Application Data
1,6.624711000000389,10.0.2.15,62.210.85.178,TCP,54,35978  >  9001 [ACK] Seq=257223283 Ack=14033969 Win=65535 Len=0
1,6.777353000000403,62.210.85.178,10.0.2.15,TLSv1.2,590,Application Data
1,6.77744999999959,10.0.2.15,62.210.85.178,TCP,54,35978  >  9001 [ACK] Seq=257223283 Ack=14034505 Win=65535 Len=0
1,6.798421999999846,62.210.85.178,10.0.2.15,TLSv1.2,590,Application Data
1,6.798479000000043,10.0.2.15,62.210.85.178,TCP,54,35978  >  9001 [ACK] Seq=257223283 Ack=14035041 Win=65535 Len=0
1,6.7989749999997,10.0.2.15,62.210.85.178,TLSv1.2,590,Application Data
1,6.799109999999928,62.210.85.178,10.0.2.15,TCP,60,9001  >  35978 [ACK] Seq=14035041 Ack=257223819 Win=65535 Len=0
1,6.895352999999886,54.93.77.70,10.0.2.15,TLSv1.2,590,Application Data
1,6.895864000000074,10.0.2.15,54.93.77.70,TLSv1.2,590,Application Data
1,6.896026000000347,54.93.77.70,10.0.2.15,TCP,60,9001  >  34692 [ACK] Seq=257141291 Ack=14125975 Win=65535 Len=0
1,7.006663000000117,62.210.85.178,10.0.2.15,TLSv1.2,590,Application Data
1,7.011354999999639,10.0.2.15,62.210.85.178,TLSv1.2,590,Application Data
1,7.011531999999534,62.210.85.178,10.0.2.15,TCP,60,9001  >  35978 [ACK] Seq=14035577 Ack=257224355 Win=65535 Len=0
1,7.021722000000409,10.0.2.15,62.210.85.178,TLSv1.2,4124,Application Data
1,7.021816999999828,10.0.2.15,62.210.85.178,TCP,2974,35978  >  9001 [ACK] Seq=257228425 Ack=14035577 Win=65535 Len=2920 [TCP segment of a reassembled PDU]
1,7.021883999999773,62.210.85.178,10.0.2.15,TCP,60,9001  >  35978 [ACK] Seq=14035577 Ack=257225815 Win=65535 Len=0
1,7.021897999999965,62.210.85.178,10.0.2.15,TCP,60,9001  >  35978 [ACK] Seq=14035577 Ack=257227275 Win=65535 Len=0
1,7.021902000000409,62.210.85.178,10.0.2.15,TCP,60,9001  >  35978 [ACK] Seq=14035577 Ack=257228425 Win=65535 Len=0
1,7.0219059999999445,62.210.85.178,10.0.2.15,TCP,60,9001  >  35978 [ACK] Seq=14035577 Ack=257229885 Win=65535 Len=0
1,7.021909000000051,62.210.85.178,10.0.2.15,TCP,60,9001  >  35978 [ACK] Seq=14035577 Ack=257231345 Win=65535 Len=0
1,7.021947000000182,10.0.2.15,62.210.85.178,TLSv1.2,1204,Application Data
1,7.021993000000293,62.210.85.178,10.0.2.15,TCP,60,9001  >  35978 [ACK] Seq=14035577 Ack=257232495 Win=65535 Len=0
1,7.022049999999581,10.0.2.15,62.210.85.178,TLSv1.2,4124,Application Data
1,7.022092999999586,62.210.85.178,10.0.2.15,TCP,60,9001  >  35978 [ACK] Seq=14035577 Ack=257233955 Win=65535 Len=0
1,7.022100000000137,62.210.85.178,10.0.2.15,TCP,60,9001  >  35978 [ACK] Seq=14035577 Ack=257235415 Win=65535 Len=0
1,7.022103000000243,62.210.85.178,10.0.2.15,TCP,60,9001  >  35978 [ACK] Seq=14035577 Ack=257236565 Win=65535 Len=0
1,7.022141999999803,10.0.2.15,62.210.85.178,TLSv1.2,4124,Application Data
1,7.0221760000004,62.210.85.178,10.0.2.15,TCP,60,9001  >  35978 [ACK] Seq=14035577 Ack=257238025 Win=65535 Len=0
1,7.022183000000041,62.210.85.178,10.0.2.15,TCP,60,9001  >  35978 [ACK] Seq=14035577 Ack=257239485 Win=65535 Len=0
1,7.0222389999998995,10.0.2.15,62.210.85.178,TLSv1.2,2974,Application Data
1,7.022275000000263,62.210.85.178,10.0.2.15,TCP,60,9001  >  35978 [ACK] Seq=14035577 Ack=257240635 Win=65535 Len=0
1,7.022283000000243,62.210.85.178,10.0.2.15,TCP,60,9001  >  35978 [ACK] Seq=14035577 Ack=257242095 Win=65535 Len=0
1,7.022286000000349,62.210.85.178,10.0.2.15,TCP,60,9001  >  35978 [ACK] Seq=14035577 Ack=257243555 Win=65535 Len=0
1,7.022313999999824,10.0.2.15,62.210.85.178,TLSv1.2,1226,Application Data
1,7.022345999999743,62.210.85.178,10.0.2.15,TCP,60,9001  >  35978 [ACK] Seq=14035577 Ack=257244727 Win=65535 Len=0
1,7.022385999999642,10.0.2.15,62.210.85.178,TLSv1.2,4124,Application Data
1,7.022420999999667,62.210.85.178,10.0.2.15,TCP,60,9001  >  35978 [ACK] Seq=14035577 Ack=257246187 Win=65535 Len=0
1,7.022428000000218,62.210.85.178,10.0.2.15,TCP,60,9001  >  35978 [ACK] Seq=14035577 Ack=257247647 Win=65535 Len=0
1,7.022431000000324,62.210.85.178,10.0.2.15,TCP,60,9001  >  35978 [ACK] Seq=14035577 Ack=257248797 Win=65535 Len=0
1,7.022466999999779,10.0.2.15,62.210.85.178,TLSv1.2,3030,Application Data
1,7.022500000000036,62.210.85.178,10.0.2.15,TCP,60,9001  >  35978 [ACK] Seq=14035577 Ack=257250257 Win=65535 Len=0
1,7.022506999999678,62.210.85.178,10.0.2.15,TCP,60,9001  >  35978 [ACK] Seq=14035577 Ack=257251717 Win=65535 Len=0
1,7.022509999999784,62.210.85.178,10.0.2.15,TCP,60,9001  >  35978 [ACK] Seq=14035577 Ack=257251773 Win=65535 Len=0
1,7.0316469999997935,10.0.2.15,62.210.85.178,TLSv1.2,4124,Application Data
1,7.031713000000309,62.210.85.178,10.0.2.15,TCP,60,9001  >  35978 [ACK] Seq=14035577 Ack=257253233 Win=65535 Len=0
1,7.03171999999995,62.210.85.178,10.0.2.15,TCP,60,9001  >  35978 [ACK] Seq=14035577 Ack=257254693 Win=65535 Len=0
1,7.031723000000056,62.210.85.178,10.0.2.15,TCP,60,9001  >  35978 [ACK] Seq=14035577 Ack=257255843 Win=65535 Len=0
1,7.031758999999511,10.0.2.15,62.210.85.178,TLSv1.2,4124,Application Data
1,7.031807999999728,62.210.85.178,10.0.2.15,TCP,60,9001  >  35978 [ACK] Seq=14035577 Ack=257257303 Win=65535 Len=0
1,7.03181399999994,62.210.85.178,10.0.2.15,TCP,60,9001  >  35978 [ACK] Seq=14035577 Ack=257258763 Win=65535 Len=0
1,7.031817000000046,62.210.85.178,10.0.2.15,TCP,60,9001  >  35978 [ACK] Seq=14035577 Ack=257259913 Win=65535 Len=0
1,7.031852000000072,10.0.2.15,62.210.85.178,TLSv1.2,4124,Application Data
1,7.0318850000003295,62.210.85.178,10.0.2.15,TCP,60,9001  >  35978 [ACK] Seq=14035577 Ack=257261373 Win=65535 Len=0
1,7.031891999999971,62.210.85.178,10.0.2.15,TCP,60,9001  >  35978 [ACK] Seq=14035577 Ack=257262833 Win=65535 Len=0
1,7.031896999999844,62.210.85.178,10.0.2.15,TCP,60,9001  >  35978 [ACK] Seq=14035577 Ack=257263983 Win=65535 Len=0
1,7.031930999999531,10.0.2.15,62.210.85.178,TLSv1.2,4124,Application Data
1,7.03196300000036,62.210.85.178,10.0.2.15,TCP,60,9001  >  35978 [ACK] Seq=14035577 Ack=257265443 Win=65535 Len=0
1,7.03197100000034,62.210.85.178,10.0.2.15,TCP,60,9001  >  35978 [ACK] Seq=14035577 Ack=257266903 Win=65535 Len=0
1,7.031974999999875,62.210.85.178,10.0.2.15,TCP,60,9001  >  35978 [ACK] Seq=14035577 Ack=257268053 Win=65535 Len=0
1,7.032008000000133,10.0.2.15,62.210.85.178,TLSv1.2,332,Application Data
1,7.032043000000158,62.210.85.178,10.0.2.15,TCP,60,9001  >  35978 [ACK] Seq=14035577 Ack=257268331 Win=65535 Len=0
1,7.03209599999991,10.0.2.15,62.210.85.178,TLSv1.2,2646,Application Data
1,7.032132999999703,62.210.85.178,10.0.2.15,TCP,60,9001  >  35978 [ACK] Seq=14035577 Ack=257269791 Win=65535 Len=0
1,7.032140999999683,62.210.85.178,10.0.2.15,TCP,60,9001  >  35978 [ACK] Seq=14035577 Ack=257270923 Win=65535 Len=0
1,7.288854000000356,54.93.77.70,10.0.2.15,TLSv1.2,590,Application Data
1,7.292625000000044,54.93.77.70,10.0.2.15,TCP,2950,"9001  >  34692 [PSH, ACK] Seq=257141827 Ack=14125975 Win=65535 Len=2896 [TCP segment of a reassembled PDU]"
1,7.292645999999877,54.93.77.70,10.0.2.15,TLSv1.2,4398,"Application Data, Application Data"
1,7.292650999999751,54.93.77.70,10.0.2.15,TCP,2950,"9001  >  34692 [PSH, ACK] Seq=257149067 Ack=14125975 Win=65535 Len=2896 [TCP segment of a reassembled PDU]"
1,7.292717000000266,10.0.2.15,54.93.77.70,TCP,54,34692  >  9001 [ACK] Seq=14125975 Ack=257151963 Win=65535 Len=0
1,7.297121999999945,54.93.77.70,10.0.2.15,TLSv1.2,2950,Application Data [TCP segment of a reassembled PDU]
1,7.2971660000002885,10.0.2.15,54.93.77.70,TCP,54,34692  >  9001 [ACK] Seq=14125975 Ack=257154859 Win=65535 Len=0
1,7.309084999999868,54.93.77.70,10.0.2.15,TLSv1.2,2950,Application Data [TCP segment of a reassembled PDU]
1,7.309102999999595,54.93.77.70,10.0.2.15,TLSv1.2,2226,Application Data
1,7.309140999999727,10.0.2.15,54.93.77.70,TCP,54,34692  >  9001 [ACK] Seq=14125975 Ack=257157755 Win=65535 Len=0
1,7.309210000000348,10.0.2.15,54.93.77.70,TCP,54,34692  >  9001 [ACK] Seq=14125975 Ack=257159927 Win=65535 Len=0
1,7.310981999999967,54.93.77.70,10.0.2.15,TCP,2950,"9001  >  34692 [PSH, ACK] Seq=257159927 Ack=14125975 Win=65535 Len=2896 [TCP segment of a reassembled PDU]"
1,7.311023999999634,10.0.2.15,54.93.77.70,TCP,54,34692  >  9001 [ACK] Seq=14125975 Ack=257162823 Win=65535 Len=0
1,7.322091,54.93.77.70,10.0.2.15,TLSv1.2,2950,Application Data [TCP segment of a reassembled PDU]
1,7.322135000000344,10.0.2.15,54.93.77.70,TCP,54,34692  >  9001 [ACK] Seq=14125975 Ack=257165719 Win=65535 Len=0
1,7.322621000000254,54.93.77.70,10.0.2.15,TLSv1.2,2950,Application Data [TCP segment of a reassembled PDU]
1,7.32266299999992,10.0.2.15,54.93.77.70,TCP,54,34692  >  9001 [ACK] Seq=14125975 Ack=257168615 Win=65535 Len=0
1,7.325353000000177,54.93.77.70,10.0.2.15,TLSv1.2,1198,Application Data
1,7.325506000000132,10.0.2.15,54.93.77.70,TLSv1.2,590,Application Data
1,7.325587000000269,54.93.77.70,10.0.2.15,TCP,60,9001  >  34692 [ACK] Seq=257169759 Ack=14126511 Win=65535 Len=0
1,7.334885999999642,54.93.77.70,10.0.2.15,TCP,2950,"9001  >  34692 [PSH, ACK] Seq=257169759 Ack=14126511 Win=65535 Len=2896 [TCP segment of a reassembled PDU]"
1,7.3349630000002435,10.0.2.15,54.93.77.70,TCP,54,34692  >  9001 [ACK] Seq=14126511 Ack=257172655 Win=65535 Len=0
1,7.341935999999805,54.93.77.70,10.0.2.15,TLSv1.2,778,Application Data
1,7.352577999999994,54.93.77.70,10.0.2.15,TCP,2950,"9001  >  34692 [PSH, ACK] Seq=257173379 Ack=14126511 Win=65535 Len=2896 [TCP segment of a reassembled PDU]"
1,7.352847000000111,10.0.2.15,54.93.77.70,TCP,54,34692  >  9001 [ACK] Seq=14126511 Ack=257176275 Win=65535 Len=0
1,7.352947999999742,54.93.77.70,10.0.2.15,TLSv1.2,1502,Application Data [TCP segment of a reassembled PDU]
1,7.353125999999975,10.0.2.15,54.93.77.70,TCP,54,34692  >  9001 [ACK] Seq=14126511 Ack=257177723 Win=65535 Len=0
1,7.365955000000213,54.93.77.70,10.0.2.15,TLSv1.2,2950,Application Data [TCP segment of a reassembled PDU]
1,7.36605099999997,10.0.2.15,54.93.77.70,TCP,54,34692  >  9001 [ACK] Seq=14126511 Ack=257180619 Win=65535 Len=0
1,7.368996000000152,54.93.77.70,10.0.2.15,TLSv1.2,76,Application Data
1,7.37608900000032,54.93.77.70,10.0.2.15,TCP,1502,"9001  >  34692 [PSH, ACK] Seq=257180641 Ack=14126511 Win=65535 Len=1448 [TCP segment of a reassembled PDU]"
1,7.376134999999522,10.0.2.15,54.93.77.70,TCP,54,34692  >  9001 [ACK] Seq=14126511 Ack=257182089 Win=65535 Len=0
1,7.394634000000224,54.93.77.70,10.0.2.15,TLSv1.2,170,Application Data
1,7.398304999999709,54.93.77.70,10.0.2.15,TCP,1502,"9001  >  34692 [PSH, ACK] Seq=257182205 Ack=14126511 Win=65535 Len=1448 [TCP segment of a reassembled PDU]"
1,7.3983509999998205,10.0.2.15,54.93.77.70,TCP,54,34692  >  9001 [ACK] Seq=14126511 Ack=257183653 Win=65535 Len=0
1,7.408465999999862,54.93.77.70,10.0.2.15,TLSv1.2,2950,Application Data [TCP segment of a reassembled PDU]
1,7.40853799999968,10.0.2.15,54.93.77.70,TCP,54,34692  >  9001 [ACK] Seq=14126511 Ack=257186549 Win=65535 Len=0
1,7.408709999999701,10.0.2.15,54.93.77.70,TLSv1.2,590,Application Data
1,7.408817999999883,54.93.77.70,10.0.2.15,TCP,60,9001  >  34692 [ACK] Seq=257186549 Ack=14127047 Win=65535 Len=0
1,7.415578999999525,54.93.77.70,10.0.2.15,TLSv1.2,1408,Application Data
1,7.418526000000384,10.0.2.15,54.93.77.70,TLSv1.2,590,Application Data
1,7.419079000000238,54.93.77.70,10.0.2.15,TCP,60,9001  >  34692 [ACK] Seq=257187903 Ack=14127583 Win=65535 Len=0
1,7.43039299999964,10.0.2.15,54.93.77.70,TLSv1.2,590,Application Data
1,7.430712000000312,54.93.77.70,10.0.2.15,TCP,60,9001  >  34692 [ACK] Seq=257187903 Ack=14128119 Win=65535 Len=0
1,7.445896000000175,62.210.85.178,10.0.2.15,TLSv1.2,590,Application Data
1,7.470443999999588,54.93.77.70,10.0.2.15,TLSv1.2,590,Application Data
1,7.488742999999886,10.0.2.15,62.210.85.178,TCP,54,35978  >  9001 [ACK] Seq=257270923 Ack=14036113 Win=65535 Len=0
1,7.512678000000051,10.0.2.15,54.93.77.70,TCP,54,34692  >  9001 [ACK] Seq=14128119 Ack=257188439 Win=65535 Len=0
1,7.5180380000001605,62.210.85.178,10.0.2.15,TLSv1.2,590,Application Data
1,7.5180899999995745,10.0.2.15,62.210.85.178,TCP,54,35978  >  9001 [ACK] Seq=257270923 Ack=14036649 Win=65535 Len=0
1,7.590285000000222,62.210.85.178,10.0.2.15,TLSv1.2,1104,Application Data
1,7.590382000000318,10.0.2.15,62.210.85.178,TCP,54,35978  >  9001 [ACK] Seq=257270923 Ack=14037699 Win=65535 Len=0
1,7.590940000000046,10.0.2.15,62.210.85.178,TLSv1.2,590,Application Data
1,7.591075999999703,62.210.85.178,10.0.2.15,TCP,60,9001  >  35978 [ACK] Seq=14037699 Ack=257271459 Win=65535 Len=0
1,7.705359999999928,54.93.77.70,10.0.2.15,TLSv1.2,590,Application Data
1,7.705452999999579,10.0.2.15,54.93.77.70,TCP,54,34692  >  9001 [ACK] Seq=14128119 Ack=257188975 Win=65535 Len=0
1,7.705960000000232,10.0.2.15,54.93.77.70,TLSv1.2,590,Application Data
1,7.706089999999676,54.93.77.70,10.0.2.15,TCP,60,9001  >  34692 [ACK] Seq=257188975 Ack=14128655 Win=65535 Len=0
1,7.824963000000025,62.210.85.178,10.0.2.15,TLSv1.2,590,Application Data
1,7.829658999999992,10.0.2.15,62.210.85.178,TLSv1.2,590,Application Data
1,7.8298469999999725,62.210.85.178,10.0.2.15,TCP,60,9001  >  35978 [ACK] Seq=14038235 Ack=257271995 Win=65535 Len=0
1,7.844232000000375,10.0.2.15,62.210.85.178,TLSv1.2,4124,Application Data
1,7.84433799999988,10.0.2.15,62.210.85.178,TCP,2974,35978  >  9001 [ACK] Seq=257276065 Ack=14038235 Win=65535 Len=2920 [TCP segment of a reassembled PDU]
1,7.844387000000097,62.210.85.178,10.0.2.15,TCP,60,9001  >  35978 [ACK] Seq=14038235 Ack=257273455 Win=65535 Len=0
1,7.844398000000183,62.210.85.178,10.0.2.15,TCP,60,9001  >  35978 [ACK] Seq=14038235 Ack=257274915 Win=65535 Len=0
1,7.844401999999718,62.210.85.178,10.0.2.15,TCP,60,9001  >  35978 [ACK] Seq=14038235 Ack=257276065 Win=65535 Len=0
1,7.844406999999592,62.210.85.178,10.0.2.15,TCP,60,9001  >  35978 [ACK] Seq=14038235 Ack=257277525 Win=65535 Len=0
1,7.844412000000375,62.210.85.178,10.0.2.15,TCP,60,9001  >  35978 [ACK] Seq=14038235 Ack=257278985 Win=65535 Len=0
1,7.84446300000036,10.0.2.15,62.210.85.178,TLSv1.2,1204,Application Data
1,7.844508000000133,62.210.85.178,10.0.2.15,TCP,60,9001  >  35978 [ACK] Seq=14038235 Ack=257280135 Win=65535 Len=0
1,7.844562000000224,10.0.2.15,62.210.85.178,TLSv1.2,4124,Application Data
1,7.844634000000042,10.0.2.15,62.210.85.178,TCP,2974,35978  >  9001 [ACK] Seq=257284205 Ack=14038235 Win=65535 Len=2920 [TCP segment of a reassembled PDU]
1,7.844688000000133,62.210.85.178,10.0.2.15,TCP,60,9001  >  35978 [ACK] Seq=14038235 Ack=257281595 Win=65535 Len=0
1,7.844700999999986,62.210.85.178,10.0.2.15,TCP,60,9001  >  35978 [ACK] Seq=14038235 Ack=257283055 Win=65535 Len=0
1,7.84470599999986,62.210.85.178,10.0.2.15,TCP,60,9001  >  35978 [ACK] Seq=14038235 Ack=257284205 Win=65535 Len=0
1,7.844710999999734,62.210.85.178,10.0.2.15,TCP,60,9001  >  35978 [ACK] Seq=14038235 Ack=257285665 Win=65535 Len=0
1,7.844715000000178,62.210.85.178,10.0.2.15,TCP,60,9001  >  35978 [ACK] Seq=14038235 Ack=257287125 Win=65535 Len=0
1,7.8447580000001835,10.0.2.15,62.210.85.178,TLSv1.2,946,Application Data
1,7.844853999999941,62.210.85.178,10.0.2.15,TCP,60,9001  >  35978 [ACK] Seq=14038235 Ack=257288017 Win=65535 Len=0
1,7.983001999999942,54.93.77.70,10.0.2.15,TLSv1.2,3674,Application Data
1,7.983172000000195,10.0.2.15,54.93.77.70,TCP,54,34692  >  9001 [ACK] Seq=14128655 Ack=257192595 Win=65535 Len=0
1,8.010419999999613,54.93.77.70,10.0.2.15,TLSv1.2,3674,Application Data
1,8.01049299999977,10.0.2.15,54.93.77.70,TCP,54,34692  >  9001 [ACK] Seq=14128655 Ack=257196215 Win=65535 Len=0
1,8.026248000000123,54.93.77.70,10.0.2.15,TLSv1.2,590,Application Data
1,8.055953000000045,54.93.77.70,10.0.2.15,TLSv1.2,2646,Application Data
1,8.056043999999929,10.0.2.15,54.93.77.70,TCP,54,34692  >  9001 [ACK] Seq=14128655 Ack=257199343 Win=65535 Len=0
1,8.0681340000001,54.93.77.70,10.0.2.15,TCP,2950,"9001  >  34692 [PSH, ACK] Seq=257199343 Ack=14128655 Win=65535 Len=2896 [TCP segment of a reassembled PDU]"
1,8.068237999999837,10.0.2.15,54.93.77.70,TCP,54,34692  >  9001 [ACK] Seq=14128655 Ack=257202239 Win=65535 Len=0
1,8.071780999999646,54.93.77.70,10.0.2.15,TLSv1.2,778,Application Data
1,8.102235000000292,54.93.77.70,10.0.2.15,TLSv1.2,2646,Application Data
1,8.10229100000015,10.0.2.15,54.93.77.70,TCP,54,34692  >  9001 [ACK] Seq=14128655 Ack=257205555 Win=65535 Len=0
