No.,Time,Source,Destination,Protocol,Length,Info
1,0.03812500000003638,54.93.77.70,10.0.2.15,TLSv1.2,590,Application Data
1,0.08517200000005687,10.0.2.15,54.93.77.70,TCP,54,34692  >  9001 [ACK] Seq=14268001 Ack=259516761 Win=65535 Len=0
1,0.09168399999998655,62.210.85.178,10.0.2.15,TLSv1.2,590,Application Data
1,0.135178000000451,10.0.2.15,62.210.85.178,TCP,54,35978  >  9001 [ACK] Seq=259596339 Ack=14175019 Win=65535 Len=0
1,0.13584300000002258,10.0.2.15,54.93.77.70,TLSv1.2,590,Application Data
1,0.13596899999993184,54.93.77.70,10.0.2.15,TCP,60,9001  >  34692 [ACK] Seq=259516761 Ack=14268537 Win=65535 Len=0
1,0.2566560000004756,62.210.85.178,10.0.2.15,TLSv1.2,590,Application Data
1,0.2567330000001675,10.0.2.15,62.210.85.178,TCP,54,35978  >  9001 [ACK] Seq=259596339 Ack=14175555 Win=65535 Len=0
1,0.25721599999997125,10.0.2.15,62.210.85.178,TLSv1.2,590,Application Data
1,0.2574770000001081,62.210.85.178,10.0.2.15,TCP,60,9001  >  35978 [ACK] Seq=14175555 Ack=259596875 Win=65535 Len=0
1,0.4636259999997492,54.93.77.70,10.0.2.15,TLSv1.2,590,Application Data
1,0.4637030000003506,10.0.2.15,54.93.77.70,TCP,54,34692  >  9001 [ACK] Seq=14268537 Ack=259517297 Win=65535 Len=0
1,0.46409899999980553,10.0.2.15,54.93.77.70,TLSv1.2,1618,Application Data
1,0.4642260000000533,54.93.77.70,10.0.2.15,TCP,60,9001  >  34692 [ACK] Seq=259517297 Ack=14269997 Win=65535 Len=0
1,0.46423800000047777,54.93.77.70,10.0.2.15,TCP,60,9001  >  34692 [ACK] Seq=259517297 Ack=14270101 Win=65535 Len=0
1,0.5775260000000344,62.210.85.178,10.0.2.15,TLSv1.2,1618,Application Data
1,0.5776720000003479,10.0.2.15,62.210.85.178,TCP,54,35978  >  9001 [ACK] Seq=259596875 Ack=14177119 Win=65535 Len=0
1,0.5910560000002079,10.0.2.15,62.210.85.178,TLSv1.2,590,Application Data
1,0.5912299999999959,62.210.85.178,10.0.2.15,TCP,60,9001  >  35978 [ACK] Seq=14177119 Ack=259597411 Win=65535 Len=0
1,0.6018830000002708,10.0.2.15,62.210.85.178,TLSv1.2,1618,Application Data
1,0.6020370000005641,62.210.85.178,10.0.2.15,TCP,60,9001  >  35978 [ACK] Seq=14177119 Ack=259598871 Win=65535 Len=0
1,0.6020539999999528,62.210.85.178,10.0.2.15,TCP,60,9001  >  35978 [ACK] Seq=14177119 Ack=259598975 Win=65535 Len=0
1,0.7153250000001208,54.93.77.70,10.0.2.15,TLSv1.2,590,Application Data
1,0.7255480000003445,54.93.77.70,10.0.2.15,TCP,1502,"9001  >  34692 [PSH, ACK] Seq=259517833 Ack=14270101 Win=65535 Len=1448 [TCP segment of a reassembled PDU]"
1,0.7256230000002688,10.0.2.15,54.93.77.70,TCP,54,34692  >  9001 [ACK] Seq=14270101 Ack=259519281 Win=65535 Len=0
1,0.7315639999997074,54.93.77.70,10.0.2.15,TLSv1.2,170,Application Data
1,0.7348799999999756,10.0.2.15,54.93.77.70,TLSv1.2,590,Application Data
1,0.7350710000000618,54.93.77.70,10.0.2.15,TCP,60,9001  >  34692 [ACK] Seq=259519397 Ack=14270637 Win=65535 Len=0
1,0.8429409999998825,62.210.85.178,10.0.2.15,TLSv1.2,590,Application Data
1,0.8436000000001513,10.0.2.15,62.210.85.178,TLSv1.2,590,Application Data
1,0.843949000000066,62.210.85.178,10.0.2.15,TCP,60,9001  >  35978 [ACK] Seq=14177655 Ack=259599511 Win=65535 Len=0
1,0.9447950000003402,54.93.77.70,10.0.2.15,TLSv1.2,590,Application Data
1,0.9456259999997201,10.0.2.15,54.93.77.70,TLSv1.2,590,Application Data
1,0.9459649999998874,54.93.77.70,10.0.2.15,TCP,60,9001  >  34692 [ACK] Seq=259519933 Ack=14271173 Win=65535 Len=0
1,1.18023600000015,62.210.85.178,10.0.2.15,TLSv1.2,590,Application Data
1,1.184903000000304,10.0.2.15,62.210.85.178,TLSv1.2,590,Application Data
1,1.1850439999998343,62.210.85.178,10.0.2.15,TCP,60,9001  >  35978 [ACK] Seq=14178191 Ack=259600047 Win=65535 Len=0
1,1.193224999999984,10.0.2.15,62.210.85.178,TLSv1.2,4124,Application Data
1,1.193304999999782,10.0.2.15,62.210.85.178,TCP,2974,35978  >  9001 [ACK] Seq=259604117 Ack=14178191 Win=65535 Len=2920 [TCP segment of a reassembled PDU]
1,1.193344000000252,62.210.85.178,10.0.2.15,TCP,60,9001  >  35978 [ACK] Seq=14178191 Ack=259601507 Win=65535 Len=0
1,1.193355999999767,62.210.85.178,10.0.2.15,TCP,60,9001  >  35978 [ACK] Seq=14178191 Ack=259602967 Win=65535 Len=0
1,1.1933619999999792,62.210.85.178,10.0.2.15,TCP,60,9001  >  35978 [ACK] Seq=14178191 Ack=259604117 Win=65535 Len=0
1,1.1933650000000853,62.210.85.178,10.0.2.15,TCP,60,9001  >  35978 [ACK] Seq=14178191 Ack=259605577 Win=65535 Len=0
1,1.1933680000001914,62.210.85.178,10.0.2.15,TCP,60,9001  >  35978 [ACK] Seq=14178191 Ack=259607037 Win=65535 Len=0
1,1.1934019999998782,10.0.2.15,62.210.85.178,TLSv1.2,1204,Application Data
1,1.1934390000005806,62.210.85.178,10.0.2.15,TCP,60,9001  >  35978 [ACK] Seq=14178191 Ack=259608187 Win=65535 Len=0
1,1.1934820000005857,10.0.2.15,62.210.85.178,TLSv1.2,4124,Application Data
1,1.1935160000002725,62.210.85.178,10.0.2.15,TCP,60,9001  >  35978 [ACK] Seq=14178191 Ack=259609647 Win=65535 Len=0
1,1.1935229999999137,62.210.85.178,10.0.2.15,TCP,60,9001  >  35978 [ACK] Seq=14178191 Ack=259611107 Win=65535 Len=0
1,1.1935279999997874,62.210.85.178,10.0.2.15,TCP,60,9001  >  35978 [ACK] Seq=14178191 Ack=259612257 Win=65535 Len=0
1,1.1935650000004898,10.0.2.15,62.210.85.178,TLSv1.2,4124,Application Data
1,1.193597999999838,62.210.85.178,10.0.2.15,TCP,60,9001  >  35978 [ACK] Seq=14178191 Ack=259613717 Win=65535 Len=0
1,1.1936059999998179,62.210.85.178,10.0.2.15,TCP,60,9001  >  35978 [ACK] Seq=14178191 Ack=259615177 Win=65535 Len=0
1,1.1936580000001413,10.0.2.15,62.210.85.178,TLSv1.2,2974,Application Data
1,1.1936949999999342,62.210.85.178,10.0.2.15,TCP,60,9001  >  35978 [ACK] Seq=14178191 Ack=259616327 Win=65535 Len=0
1,1.193702000000485,62.210.85.178,10.0.2.15,TCP,60,9001  >  35978 [ACK] Seq=14178191 Ack=259617787 Win=65535 Len=0
1,1.1937049999996816,62.210.85.178,10.0.2.15,TCP,60,9001  >  35978 [ACK] Seq=14178191 Ack=259619247 Win=65535 Len=0
1,1.1937319999997271,10.0.2.15,62.210.85.178,TLSv1.2,1226,Application Data
1,1.1937640000005558,62.210.85.178,10.0.2.15,TCP,60,9001  >  35978 [ACK] Seq=14178191 Ack=259620419 Win=65535 Len=0
1,1.1938019999997778,10.0.2.15,62.210.85.178,TLSv1.2,4124,Application Data
1,1.193836999999803,62.210.85.178,10.0.2.15,TCP,60,9001  >  35978 [ACK] Seq=14178191 Ack=259621879 Win=65535 Len=0
1,1.1938440000003538,62.210.85.178,10.0.2.15,TCP,60,9001  >  35978 [ACK] Seq=14178191 Ack=259623339 Win=65535 Len=0
1,1.19384700000046,62.210.85.178,10.0.2.15,TCP,60,9001  >  35978 [ACK] Seq=14178191 Ack=259624489 Win=65535 Len=0
1,1.1938829999999143,10.0.2.15,62.210.85.178,TLSv1.2,3030,Application Data
1,1.1939170000005106,62.210.85.178,10.0.2.15,TCP,60,9001  >  35978 [ACK] Seq=14178191 Ack=259625949 Win=65535 Len=0
1,1.1939240000001519,62.210.85.178,10.0.2.15,TCP,60,9001  >  35978 [ACK] Seq=14178191 Ack=259627409 Win=65535 Len=0
1,1.193927000000258,62.210.85.178,10.0.2.15,TCP,60,9001  >  35978 [ACK] Seq=14178191 Ack=259627465 Win=65535 Len=0
1,1.2053240000004735,10.0.2.15,62.210.85.178,TLSv1.2,4124,Application Data
1,1.2054040000002715,62.210.85.178,10.0.2.15,TCP,60,9001  >  35978 [ACK] Seq=14178191 Ack=259628925 Win=65535 Len=0
1,1.2054140000000189,62.210.85.178,10.0.2.15,TCP,60,9001  >  35978 [ACK] Seq=14178191 Ack=259630385 Win=65535 Len=0
1,1.2054180000004635,62.210.85.178,10.0.2.15,TCP,60,9001  >  35978 [ACK] Seq=14178191 Ack=259631535 Win=65535 Len=0
1,1.20546000000013,10.0.2.15,62.210.85.178,TLSv1.2,4124,Application Data
1,1.2055120000004536,62.210.85.178,10.0.2.15,TCP,60,9001  >  35978 [ACK] Seq=14178191 Ack=259632995 Win=65535 Len=0
1,1.2055190000000948,62.210.85.178,10.0.2.15,TCP,60,9001  >  35978 [ACK] Seq=14178191 Ack=259634455 Win=65535 Len=0
1,1.205522000000201,62.210.85.178,10.0.2.15,TCP,60,9001  >  35978 [ACK] Seq=14178191 Ack=259635605 Win=65535 Len=0
1,1.2055580000005648,10.0.2.15,62.210.85.178,TLSv1.2,3288,Application Data
1,1.2055940000000192,62.210.85.178,10.0.2.15,TCP,60,9001  >  35978 [ACK] Seq=14178191 Ack=259637065 Win=65535 Len=0
1,1.205601999999999,62.210.85.178,10.0.2.15,TCP,60,9001  >  35978 [ACK] Seq=14178191 Ack=259638525 Win=65535 Len=0
1,1.2056060000004436,62.210.85.178,10.0.2.15,TCP,60,9001  >  35978 [ACK] Seq=14178191 Ack=259638839 Win=65535 Len=0
1,1.2982819999997446,54.93.77.70,10.0.2.15,TLSv1.2,590,Application Data
1,1.3080010000003313,54.93.77.70,10.0.2.15,TCP,2950,"9001  >  34692 [PSH, ACK] Seq=259520469 Ack=14271173 Win=65535 Len=2896 [TCP segment of a reassembled PDU]"
1,1.3080790000003617,10.0.2.15,54.93.77.70,TCP,54,34692  >  9001 [ACK] Seq=14271173 Ack=259523365 Win=65535 Len=0
1,1.308774000000085,54.93.77.70,10.0.2.15,TLSv1.2,4398,Application Data [TCP segment of a reassembled PDU]
1,1.3088150000003225,10.0.2.15,54.93.77.70,TCP,54,34692  >  9001 [ACK] Seq=14271173 Ack=259527709 Win=65535 Len=0
1,1.3197479999998905,54.93.77.70,10.0.2.15,TLSv1.2,2950,Application Data [TCP segment of a reassembled PDU]
1,1.3197930000005726,10.0.2.15,54.93.77.70,TCP,54,34692  >  9001 [ACK] Seq=14271173 Ack=259530605 Win=65535 Len=0
1,1.3246449999996912,54.93.77.70,10.0.2.15,TLSv1.2,1292,Application Data
1,1.3330690000002505,54.93.77.70,10.0.2.15,TCP,2950,"9001  >  34692 [PSH, ACK] Seq=259531843 Ack=14271173 Win=65535 Len=2896 [TCP segment of a reassembled PDU]"
1,1.3330919999998514,54.93.77.70,10.0.2.15,TLSv1.2,8742,"Application Data, Application Data"
1,1.333150000000387,10.0.2.15,54.93.77.70,TCP,54,34692  >  9001 [ACK] Seq=14271173 Ack=259534739 Win=65535 Len=0
1,1.3332220000002053,10.0.2.15,54.93.77.70,TCP,54,34692  >  9001 [ACK] Seq=14271173 Ack=259543427 Win=65535 Len=0
1,1.3333689999999478,10.0.2.15,54.93.77.70,TLSv1.2,590,Application Data
1,1.333437000000231,54.93.77.70,10.0.2.15,TCP,60,9001  >  34692 [ACK] Seq=259543427 Ack=14271709 Win=65535 Len=0
1,1.3495090000005803,54.93.77.70,10.0.2.15,TLSv1.2,358,Application Data
1,1.3588440000003175,54.93.77.70,10.0.2.15,TCP,2950,"9001  >  34692 [PSH, ACK] Seq=259543731 Ack=14271709 Win=65535 Len=2896 [TCP segment of a reassembled PDU]"
1,1.3589270000002216,10.0.2.15,54.93.77.70,TCP,54,34692  >  9001 [ACK] Seq=14271709 Ack=259546627 Win=65535 Len=0
1,1.3677569999999832,54.93.77.70,10.0.2.15,TLSv1.2,2950,Application Data [TCP segment of a reassembled PDU]
1,1.3678060000002006,10.0.2.15,54.93.77.70,TCP,54,34692  >  9001 [ACK] Seq=14271709 Ack=259549523 Win=65535 Len=0
1,1.3679860000002009,10.0.2.15,54.93.77.70,TLSv1.2,590,Application Data
1,1.3680629999998928,54.93.77.70,10.0.2.15,TCP,60,9001  >  34692 [ACK] Seq=259549523 Ack=14272245 Win=65535 Len=0
1,1.3690050000004703,54.93.77.70,10.0.2.15,TLSv1.2,8742,"Application Data, Application Data, Application Data"
1,1.3690729999998439,10.0.2.15,54.93.77.70,TCP,54,34692  >  9001 [ACK] Seq=14272245 Ack=259558211 Win=65535 Len=0
1,1.3936920000005557,54.93.77.70,10.0.2.15,TLSv1.2,1104,Application Data
1,1.3961610000005749,10.0.2.15,54.93.77.70,TLSv1.2,590,Application Data
1,1.396335999999792,54.93.77.70,10.0.2.15,TCP,60,9001  >  34692 [ACK] Seq=259559261 Ack=14272781 Win=65535 Len=0
1,1.4319160000004558,62.210.85.178,10.0.2.15,TLSv1.2,590,Application Data
1,1.473218000000088,10.0.2.15,62.210.85.178,TCP,54,35978  >  9001 [ACK] Seq=259638839 Ack=14178727 Win=65535 Len=0
1,1.4894540000004781,62.210.85.178,10.0.2.15,TLSv1.2,590,Application Data
1,1.4895130000004428,10.0.2.15,62.210.85.178,TCP,54,35978  >  9001 [ACK] Seq=259638839 Ack=14179263 Win=65535 Len=0
1,1.5676370000001043,62.210.85.178,10.0.2.15,TLSv1.2,590,Application Data
1,1.5677169999999023,10.0.2.15,62.210.85.178,TCP,54,35978  >  9001 [ACK] Seq=259638839 Ack=14179799 Win=65535 Len=0
1,1.568224000000555,10.0.2.15,62.210.85.178,TLSv1.2,590,Application Data
1,1.5683340000005046,62.210.85.178,10.0.2.15,TCP,60,9001  >  35978 [ACK] Seq=14179799 Ack=259639375 Win=65535 Len=0
1,1.6767760000002454,54.93.77.70,10.0.2.15,TLSv1.2,590,Application Data
1,1.6771459999999934,10.0.2.15,54.93.77.70,TLSv1.2,590,Application Data
1,1.6772579999997106,54.93.77.70,10.0.2.15,TCP,60,9001  >  34692 [ACK] Seq=259559797 Ack=14273317 Win=65535 Len=0
1,1.8973699999996825,62.210.85.178,10.0.2.15,TLSv1.2,590,Application Data
1,1.9030090000005657,10.0.2.15,62.210.85.178,TLSv1.2,590,Application Data
1,1.903189999999995,62.210.85.178,10.0.2.15,TCP,60,9001  >  35978 [ACK] Seq=14180335 Ack=259639911 Win=65535 Len=0
1,1.9133780000001934,10.0.2.15,62.210.85.178,TLSv1.2,4124,Application Data
1,1.9134679999997388,10.0.2.15,62.210.85.178,TCP,2974,35978  >  9001 [ACK] Seq=259643981 Ack=14180335 Win=65535 Len=2920 [TCP segment of a reassembled PDU]
1,1.9135089999999764,62.210.85.178,10.0.2.15,TCP,60,9001  >  35978 [ACK] Seq=14180335 Ack=259641371 Win=65535 Len=0
1,1.9135189999997237,62.210.85.178,10.0.2.15,TCP,60,9001  >  35978 [ACK] Seq=14180335 Ack=259642831 Win=65535 Len=0
1,1.9135230000001684,62.210.85.178,10.0.2.15,TCP,60,9001  >  35978 [ACK] Seq=14180335 Ack=259643981 Win=65535 Len=0
1,1.913524999999936,62.210.85.178,10.0.2.15,TCP,60,9001  >  35978 [ACK] Seq=14180335 Ack=259645441 Win=65535 Len=0
1,1.913528000000042,62.210.85.178,10.0.2.15,TCP,60,9001  >  35978 [ACK] Seq=14180335 Ack=259646901 Win=65535 Len=0
1,1.9135619999997289,10.0.2.15,62.210.85.178,TLSv1.2,1204,Application Data
1,1.913604000000305,62.210.85.178,10.0.2.15,TCP,60,9001  >  35978 [ACK] Seq=14180335 Ack=259648051 Win=65535 Len=0
1,1.91364700000031,10.0.2.15,62.210.85.178,TLSv1.2,4124,Application Data
1,1.9137080000000424,62.210.85.178,10.0.2.15,TCP,60,9001  >  35978 [ACK] Seq=14180335 Ack=259649511 Win=65535 Len=0
1,1.9137190000001283,62.210.85.178,10.0.2.15,TCP,60,9001  >  35978 [ACK] Seq=14180335 Ack=259650971 Win=65535 Len=0
1,1.9137220000002344,62.210.85.178,10.0.2.15,TCP,60,9001  >  35978 [ACK] Seq=14180335 Ack=259652121 Win=65535 Len=0
1,1.9137740000005579,10.0.2.15,62.210.85.178,TLSv1.2,4124,Application Data
1,1.9138350000002902,62.210.85.178,10.0.2.15,TCP,60,9001  >  35978 [ACK] Seq=14180335 Ack=259653581 Win=65535 Len=0
1,1.913843999999699,62.210.85.178,10.0.2.15,TCP,60,9001  >  35978 [ACK] Seq=14180335 Ack=259655041 Win=65535 Len=0
1,1.9138469999998051,62.210.85.178,10.0.2.15,TCP,60,9001  >  35978 [ACK] Seq=14180335 Ack=259656191 Win=65535 Len=0
1,1.9138920000004873,10.0.2.15,62.210.85.178,TLSv1.2,332,Application Data
1,1.9139299999997093,62.210.85.178,10.0.2.15,TCP,60,9001  >  35978 [ACK] Seq=14180335 Ack=259656469 Win=65535 Len=0
1,1.9139830000003712,10.0.2.15,62.210.85.178,TLSv1.2,3868,Application Data
1,1.9140189999998256,62.210.85.178,10.0.2.15,TCP,60,9001  >  35978 [ACK] Seq=14180335 Ack=259657929 Win=65535 Len=0
1,1.9140260000003764,62.210.85.178,10.0.2.15,TCP,60,9001  >  35978 [ACK] Seq=14180335 Ack=259659389 Win=65535 Len=0
1,1.9140290000004825,62.210.85.178,10.0.2.15,TCP,60,9001  >  35978 [ACK] Seq=14180335 Ack=259660283 Win=65535 Len=0
1,1.9140649999999368,10.0.2.15,62.210.85.178,TLSv1.2,4124,Application Data
1,1.9140999999999622,62.210.85.178,10.0.2.15,TCP,60,9001  >  35978 [ACK] Seq=14180335 Ack=259661743 Win=65535 Len=0
1,1.9141060000001744,62.210.85.178,10.0.2.15,TCP,60,9001  >  35978 [ACK] Seq=14180335 Ack=259663203 Win=65535 Len=0
1,1.9141090000002805,62.210.85.178,10.0.2.15,TCP,60,9001  >  35978 [ACK] Seq=14180335 Ack=259664353 Win=65535 Len=0
1,1.9141490000001795,10.0.2.15,62.210.85.178,TLSv1.2,3030,Application Data
1,1.914190000000417,62.210.85.178,10.0.2.15,TCP,60,9001  >  35978 [ACK] Seq=14180335 Ack=259665813 Win=65535 Len=0
1,1.9141959999997198,62.210.85.178,10.0.2.15,TCP,60,9001  >  35978 [ACK] Seq=14180335 Ack=259667273 Win=65535 Len=0
1,1.914198999999826,62.210.85.178,10.0.2.15,TCP,60,9001  >  35978 [ACK] Seq=14180335 Ack=259667329 Win=65535 Len=0
1,1.9256560000003446,10.0.2.15,62.210.85.178,TLSv1.2,4124,Application Data
1,1.9257400000005873,62.210.85.178,10.0.2.15,TCP,60,9001  >  35978 [ACK] Seq=14180335 Ack=259668789 Win=65535 Len=0
1,1.9257489999999962,62.210.85.178,10.0.2.15,TCP,60,9001  >  35978 [ACK] Seq=14180335 Ack=259670249 Win=65535 Len=0
1,1.9257520000001023,62.210.85.178,10.0.2.15,TCP,60,9001  >  35978 [ACK] Seq=14180335 Ack=259671399 Win=65535 Len=0
1,1.9257930000003398,10.0.2.15,62.210.85.178,TLSv1.2,4124,Application Data
1,1.9258449999997538,62.210.85.178,10.0.2.15,TCP,60,9001  >  35978 [ACK] Seq=14180335 Ack=259672859 Win=65535 Len=0
1,1.9258520000003045,62.210.85.178,10.0.2.15,TCP,60,9001  >  35978 [ACK] Seq=14180335 Ack=259674319 Win=65535 Len=0
1,1.9258550000004107,62.210.85.178,10.0.2.15,TCP,60,9001  >  35978 [ACK] Seq=14180335 Ack=259675469 Win=65535 Len=0
1,1.9258920000002036,10.0.2.15,62.210.85.178,TLSv1.2,4124,Application Data
1,1.9259259999998903,62.210.85.178,10.0.2.15,TCP,60,9001  >  35978 [ACK] Seq=14180335 Ack=259676929 Win=65535 Len=0
1,1.9259339999998701,62.210.85.178,10.0.2.15,TCP,60,9001  >  35978 [ACK] Seq=14180335 Ack=259678389 Win=65535 Len=0
1,1.9259380000003148,62.210.85.178,10.0.2.15,TCP,60,9001  >  35978 [ACK] Seq=14180335 Ack=259679539 Win=65535 Len=0
1,1.9259739999997691,10.0.2.15,62.210.85.178,TLSv1.2,4124,Application Data
1,1.9260080000003654,62.210.85.178,10.0.2.15,TCP,60,9001  >  35978 [ACK] Seq=14180335 Ack=259680999 Win=65535 Len=0
1,1.9260160000003452,62.210.85.178,10.0.2.15,TCP,60,9001  >  35978 [ACK] Seq=14180335 Ack=259682459 Win=65535 Len=0
1,1.9260199999998804,62.210.85.178,10.0.2.15,TCP,60,9001  >  35978 [ACK] Seq=14180335 Ack=259683609 Win=65535 Len=0
1,1.9260530000001381,10.0.2.15,62.210.85.178,TLSv1.2,332,Application Data
1,1.9260880000001634,62.210.85.178,10.0.2.15,TCP,60,9001  >  35978 [ACK] Seq=14180335 Ack=259683887 Win=65535 Len=0
1,1.9261370000003808,10.0.2.15,62.210.85.178,TLSv1.2,3868,Application Data
1,1.9261729999998352,62.210.85.178,10.0.2.15,TCP,60,9001  >  35978 [ACK] Seq=14180335 Ack=259685347 Win=65535 Len=0
1,1.926180999999815,62.210.85.178,10.0.2.15,TCP,60,9001  >  35978 [ACK] Seq=14180335 Ack=259686807 Win=65535 Len=0
1,1.9261850000002596,62.210.85.178,10.0.2.15,TCP,60,9001  >  35978 [ACK] Seq=14180335 Ack=259687701 Win=65535 Len=0
1,1.9262220000000525,10.0.2.15,62.210.85.178,TLSv1.2,4124,Application Data
1,1.9262570000000778,62.210.85.178,10.0.2.15,TCP,60,9001  >  35978 [ACK] Seq=14180335 Ack=259689161 Win=65535 Len=0
1,1.92626300000029,62.210.85.178,10.0.2.15,TCP,60,9001  >  35978 [ACK] Seq=14180335 Ack=259690621 Win=65535 Len=0
1,1.9262660000003962,62.210.85.178,10.0.2.15,TCP,60,9001  >  35978 [ACK] Seq=14180335 Ack=259691771 Win=65535 Len=0
1,1.926300000000083,10.0.2.15,62.210.85.178,TLSv1.2,3030,Application Data
1,1.9263350000001083,62.210.85.178,10.0.2.15,TCP,60,9001  >  35978 [ACK] Seq=14180335 Ack=259693231 Win=65535 Len=0
1,1.9263410000003205,62.210.85.178,10.0.2.15,TCP,60,9001  >  35978 [ACK] Seq=14180335 Ack=259694691 Win=65535 Len=0
1,1.9263440000004266,62.210.85.178,10.0.2.15,TCP,60,9001  >  35978 [ACK] Seq=14180335 Ack=259694747 Win=65535 Len=0
1,1.937753000000157,10.0.2.15,62.210.85.178,TLSv1.2,4124,Application Data
1,1.937847000000147,10.0.2.15,62.210.85.178,TCP,2974,35978  >  9001 [ACK] Seq=259698817 Ack=14180335 Win=65535 Len=2920 [TCP segment of a reassembled PDU]
1,1.9378900000001522,62.210.85.178,10.0.2.15,TCP,60,9001  >  35978 [ACK] Seq=14180335 Ack=259696207 Win=65535 Len=0
1,1.9378999999998996,62.210.85.178,10.0.2.15,TCP,60,9001  >  35978 [ACK] Seq=14180335 Ack=259697667 Win=65535 Len=0
1,1.9379049999997733,62.210.85.178,10.0.2.15,TCP,60,9001  >  35978 [ACK] Seq=14180335 Ack=259698817 Win=65535 Len=0
1,1.9379450000005818,10.0.2.15,62.210.85.178,TLSv1.2,1204,Application Data
1,1.9379900000003545,62.210.85.178,10.0.2.15,TCP,60,9001  >  35978 [ACK] Seq=14180335 Ack=259700277 Win=65535 Len=0
1,1.9379969999999958,62.210.85.178,10.0.2.15,TCP,60,9001  >  35978 [ACK] Seq=14180335 Ack=259701737 Win=65535 Len=0
1,1.938068000000385,10.0.2.15,62.210.85.178,TCP,2974,35978  >  9001 [ACK] Seq=259702887 Ack=14180335 Win=65535 Len=2920 [TCP segment of a reassembled PDU]
1,1.9380900000005568,62.210.85.178,10.0.2.15,TCP,60,9001  >  35978 [ACK] Seq=14180335 Ack=259702887 Win=65535 Len=0
1,1.938125000000582,10.0.2.15,62.210.85.178,TLSv1.2,1204,Application Data
1,1.9381610000000364,62.210.85.178,10.0.2.15,TCP,60,9001  >  35978 [ACK] Seq=14180335 Ack=259704347 Win=65535 Len=0
1,1.9381680000005872,62.210.85.178,10.0.2.15,TCP,60,9001  >  35978 [ACK] Seq=14180335 Ack=259705807 Win=65535 Len=0
1,1.9381720000001224,62.210.85.178,10.0.2.15,TCP,60,9001  >  35978 [ACK] Seq=14180335 Ack=259706957 Win=65535 Len=0
1,1.9382190000005721,10.0.2.15,62.210.85.178,TLSv1.2,2324,Application Data
1,1.9382599999999002,62.210.85.178,10.0.2.15,TCP,60,9001  >  35978 [ACK] Seq=14180335 Ack=259708417 Win=65535 Len=0
1,1.938267000000451,62.210.85.178,10.0.2.15,TCP,60,9001  >  35978 [ACK] Seq=14180335 Ack=259709227 Win=65535 Len=0
1,2.4093370000000505,54.93.77.70,10.0.2.15,TCP,2950,"9001  >  34692 [PSH, ACK] Seq=259559797 Ack=14273317 Win=65535 Len=2896 [TCP segment of a reassembled PDU]"
1,2.4094629999999597,10.0.2.15,54.93.77.70,TCP,54,34692  >  9001 [ACK] Seq=14273317 Ack=259562693 Win=65535 Len=0
1,2.414176000000225,54.93.77.70,10.0.2.15,TLSv1.2,2950,Application Data [TCP segment of a reassembled PDU]
1,2.4142170000004626,10.0.2.15,54.93.77.70,TCP,54,34692  >  9001 [ACK] Seq=14273317 Ack=259565589 Win=65535 Len=0
1,2.4143300000005183,54.93.77.70,10.0.2.15,TLSv1.2,1502,Application Data
1,2.414346000000478,54.93.77.70,10.0.2.15,TLSv1.2,8742,"Application Data, Application Data"
1,2.414434999999685,10.0.2.15,54.93.77.70,TCP,54,34692  >  9001 [ACK] Seq=14273317 Ack=259575725 Win=65535 Len=0
1,2.4297370000003866,54.93.77.70,10.0.2.15,TLSv1.2,2950,Application Data [TCP segment of a reassembled PDU]
1,2.429795000000013,10.0.2.15,54.93.77.70,TCP,54,34692  >  9001 [ACK] Seq=14273317 Ack=259578621 Win=65535 Len=0
1,2.4307880000005753,54.93.77.70,10.0.2.15,TLSv1.2,5846,Application Data [TCP segment of a reassembled PDU]
1,2.430865000000267,10.0.2.15,54.93.77.70,TCP,54,34692  >  9001 [ACK] Seq=14273317 Ack=259584413 Win=65535 Len=0
1,2.431825000000572,54.93.77.70,10.0.2.15,TLSv1.2,5448,"Application Data, Application Data, Application Data"
1,2.431865000000471,10.0.2.15,54.93.77.70,TCP,54,34692  >  9001 [ACK] Seq=14273317 Ack=259589807 Win=65535 Len=0
1,2.4320180000004257,10.0.2.15,54.93.77.70,TLSv1.2,590,Application Data
1,2.432104999999865,54.93.77.70,10.0.2.15,TCP,60,9001  >  34692 [ACK] Seq=259589807 Ack=14273853 Win=65535 Len=0
1,2.4414370000004055,10.0.2.15,54.93.77.70,TLSv1.2,590,Application Data
1,2.441581000000042,54.93.77.70,10.0.2.15,TCP,60,9001  >  34692 [ACK] Seq=259589807 Ack=14274389 Win=65535 Len=0
1,2.4547780000002604,54.93.77.70,10.0.2.15,TCP,2950,"9001  >  34692 [PSH, ACK] Seq=259589807 Ack=14274389 Win=65535 Len=2896 [TCP segment of a reassembled PDU]"
1,2.454905000000508,10.0.2.15,54.93.77.70,TCP,54,34692  >  9001 [ACK] Seq=14274389 Ack=259592703 Win=65535 Len=0
1,2.4562080000005153,54.93.77.70,10.0.2.15,TLSv1.2,12834,"Application Data, Application Data, Application Data"
1,2.456256999999823,10.0.2.15,54.93.77.70,TCP,54,34692  >  9001 [ACK] Seq=14274389 Ack=259605483 Win=65535 Len=0
1,2.4562999999998283,54.93.77.70,10.0.2.15,TLSv1.2,936,"Application Data, Application Data"
1,2.464407999999821,54.93.77.70,10.0.2.15,TLSv1.2,4398,Application Data
1,2.4644490000000587,54.93.77.70,10.0.2.15,TLSv1.2,17430,"Application Data, Application Data, Application Data, Application Data, Application Data"
1,2.4644889999999577,10.0.2.15,54.93.77.70,TCP,54,34692  >  9001 [ACK] Seq=14274389 Ack=259610709 Win=65535 Len=0
1,2.464582999999948,10.0.2.15,54.93.77.70,TCP,54,34692  >  9001 [ACK] Seq=14274389 Ack=259628085 Win=65535 Len=0
1,2.4648090000000593,10.0.2.15,54.93.77.70,TLSv1.2,590,Application Data
1,2.4648839999999836,54.93.77.70,10.0.2.15,TCP,60,9001  >  34692 [ACK] Seq=259628085 Ack=14274925 Win=65535 Len=0
1,2.473218000000088,54.93.77.70,10.0.2.15,TCP,1502,"9001  >  34692 [PSH, ACK] Seq=259628085 Ack=14274925 Win=65535 Len=1448 [TCP segment of a reassembled PDU]"
1,2.4732700000004115,10.0.2.15,54.93.77.70,TCP,54,34692  >  9001 [ACK] Seq=14274925 Ack=259629533 Win=65535 Len=0
1,2.4803130000000237,54.93.77.70,10.0.2.15,TLSv1.2,170,Application Data
1,2.4830620000002455,10.0.2.15,54.93.77.70,TLSv1.2,590,Application Data
1,2.483226000000286,54.93.77.70,10.0.2.15,TCP,60,9001  >  34692 [ACK] Seq=259629649 Ack=14275461 Win=65535 Len=0
1,2.5395550000002913,62.210.85.178,10.0.2.15,TLSv1.2,590,Application Data
1,2.5811540000004243,10.0.2.15,62.210.85.178,TCP,54,35978  >  9001 [ACK] Seq=259709227 Ack=14180871 Win=65535 Len=0
1,2.593698000000586,62.210.85.178,10.0.2.15,TLSv1.2,1104,Application Data
1,2.593772000000172,10.0.2.15,62.210.85.178,TCP,54,35978  >  9001 [ACK] Seq=259709227 Ack=14181921 Win=65535 Len=0
1,2.6271200000001045,62.210.85.178,10.0.2.15,TLSv1.2,590,Application Data
1,2.627183999999943,10.0.2.15,62.210.85.178,TCP,54,35978  >  9001 [ACK] Seq=259709227 Ack=14182457 Win=65535 Len=0
1,2.627607999999782,10.0.2.15,62.210.85.178,TLSv1.2,590,Application Data
1,2.627704999999878,62.210.85.178,10.0.2.15,TCP,60,9001  >  35978 [ACK] Seq=14182457 Ack=259709763 Win=65535 Len=0
1,2.8193309999996927,54.93.77.70,10.0.2.15,TLSv1.2,590,Application Data
1,2.819684000000052,10.0.2.15,54.93.77.70,TLSv1.2,590,Application Data
1,2.8197909999998956,54.93.77.70,10.0.2.15,TCP,60,9001  >  34692 [ACK] Seq=259630185 Ack=14275997 Win=65535 Len=0
1,2.9428109999998924,62.210.85.178,10.0.2.15,TLSv1.2,590,Application Data
1,2.9502430000002278,10.0.2.15,62.210.85.178,TLSv1.2,590,Application Data
1,2.950437999999849,62.210.85.178,10.0.2.15,TCP,60,9001  >  35978 [ACK] Seq=14182993 Ack=259710299 Win=65535 Len=0
1,2.9617410000000746,10.0.2.15,62.210.85.178,TLSv1.2,4124,Application Data
1,2.961852999999792,10.0.2.15,62.210.85.178,TCP,2974,35978  >  9001 [ACK] Seq=259714369 Ack=14182993 Win=65535 Len=2920 [TCP segment of a reassembled PDU]
1,2.9619080000002214,62.210.85.178,10.0.2.15,TCP,60,9001  >  35978 [ACK] Seq=14182993 Ack=259711759 Win=65535 Len=0
1,2.9619199999997363,62.210.85.178,10.0.2.15,TCP,60,9001  >  35978 [ACK] Seq=14182993 Ack=259713219 Win=65535 Len=0
1,2.9619259999999485,62.210.85.178,10.0.2.15,TCP,60,9001  >  35978 [ACK] Seq=14182993 Ack=259714369 Win=65535 Len=0
1,2.9619680000005246,10.0.2.15,62.210.85.178,TLSv1.2,1204,Application Data
1,2.9620059999997466,62.210.85.178,10.0.2.15,TCP,60,9001  >  35978 [ACK] Seq=14182993 Ack=259715829 Win=65535 Len=0
1,2.9620139999997264,62.210.85.178,10.0.2.15,TCP,60,9001  >  35978 [ACK] Seq=14182993 Ack=259717289 Win=65535 Len=0
1,2.9620169999998325,62.210.85.178,10.0.2.15,TCP,60,9001  >  35978 [ACK] Seq=14182993 Ack=259718439 Win=65535 Len=0
1,2.9620590000004086,10.0.2.15,62.210.85.178,TLSv1.2,4124,Application Data
1,2.962097999999969,62.210.85.178,10.0.2.15,TCP,60,9001  >  35978 [ACK] Seq=14182993 Ack=259719899 Win=65535 Len=0
1,2.962105999999949,62.210.85.178,10.0.2.15,TCP,60,9001  >  35978 [ACK] Seq=14182993 Ack=259721359 Win=65535 Len=0
1,2.9621109999998225,62.210.85.178,10.0.2.15,TCP,60,9001  >  35978 [ACK] Seq=14182993 Ack=259722509 Win=65535 Len=0
1,2.9621500000002925,10.0.2.15,62.210.85.178,TLSv1.2,4124,Application Data
1,2.9621870000000854,62.210.85.178,10.0.2.15,TCP,60,9001  >  35978 [ACK] Seq=14182993 Ack=259723969 Win=65535 Len=0
1,2.9621960000004037,62.210.85.178,10.0.2.15,TCP,60,9001  >  35978 [ACK] Seq=14182993 Ack=259725429 Win=65535 Len=0
1,2.962257000000136,10.0.2.15,62.210.85.178,TLSv1.2,2974,Application Data
1,2.962300000000141,62.210.85.178,10.0.2.15,TCP,60,9001  >  35978 [ACK] Seq=14182993 Ack=259726579 Win=65535 Len=0
1,2.9623060000003534,62.210.85.178,10.0.2.15,TCP,60,9001  >  35978 [ACK] Seq=14182993 Ack=259728039 Win=65535 Len=0
1,2.9623090000004595,62.210.85.178,10.0.2.15,TCP,60,9001  >  35978 [ACK] Seq=14182993 Ack=259729499 Win=65535 Len=0
1,2.962336999999934,10.0.2.15,62.210.85.178,TLSv1.2,1226,Application Data
1,2.962373000000298,62.210.85.178,10.0.2.15,TCP,60,9001  >  35978 [ACK] Seq=14182993 Ack=259730671 Win=65535 Len=0
1,2.962413000000197,10.0.2.15,62.210.85.178,TLSv1.2,4124,Application Data
1,2.9624519999997574,62.210.85.178,10.0.2.15,TCP,60,9001  >  35978 [ACK] Seq=14182993 Ack=259732131 Win=65535 Len=0
1,2.962459999999737,62.210.85.178,10.0.2.15,TCP,60,9001  >  35978 [ACK] Seq=14182993 Ack=259733591 Win=65535 Len=0
1,2.9624629999998433,62.210.85.178,10.0.2.15,TCP,60,9001  >  35978 [ACK] Seq=14182993 Ack=259734741 Win=65535 Len=0
1,2.9625009999999747,10.0.2.15,62.210.85.178,TLSv1.2,3030,Application Data
1,2.9625489999998535,62.210.85.178,10.0.2.15,TCP,60,9001  >  35978 [ACK] Seq=14182993 Ack=259736201 Win=65535 Len=0
1,2.9625560000004043,62.210.85.178,10.0.2.15,TCP,60,9001  >  35978 [ACK] Seq=14182993 Ack=259737661 Win=65535 Len=0
1,2.9625590000005104,62.210.85.178,10.0.2.15,TCP,60,9001  >  35978 [ACK] Seq=14182993 Ack=259737717 Win=65535 Len=0
1,2.971784999999727,10.0.2.15,62.210.85.178,TLSv1.2,4124,Application Data
1,2.971838000000389,62.210.85.178,10.0.2.15,TCP,60,9001  >  35978 [ACK] Seq=14182993 Ack=259739177 Win=65535 Len=0
1,2.971849999999904,62.210.85.178,10.0.2.15,TCP,60,9001  >  35978 [ACK] Seq=14182993 Ack=259740637 Win=65535 Len=0
1,2.9718540000003486,62.210.85.178,10.0.2.15,TCP,60,9001  >  35978 [ACK] Seq=14182993 Ack=259741787 Win=65535 Len=0
1,2.9718990000001213,10.0.2.15,62.210.85.178,TLSv1.2,4124,Application Data
1,2.971940000000359,62.210.85.178,10.0.2.15,TCP,60,9001  >  35978 [ACK] Seq=14182993 Ack=259743247 Win=65535 Len=0
1,2.9719500000001062,62.210.85.178,10.0.2.15,TCP,60,9001  >  35978 [ACK] Seq=14182993 Ack=259744707 Win=65535 Len=0
1,2.971954000000551,62.210.85.178,10.0.2.15,TCP,60,9001  >  35978 [ACK] Seq=14182993 Ack=259745857 Win=65535 Len=0
1,2.971991999999773,10.0.2.15,62.210.85.178,TLSv1.2,4124,Application Data
1,2.972031000000243,62.210.85.178,10.0.2.15,TCP,60,9001  >  35978 [ACK] Seq=14182993 Ack=259747317 Win=65535 Len=0
1,2.9720390000002226,62.210.85.178,10.0.2.15,TCP,60,9001  >  35978 [ACK] Seq=14182993 Ack=259748777 Win=65535 Len=0
1,2.9720440000000963,62.210.85.178,10.0.2.15,TCP,60,9001  >  35978 [ACK] Seq=14182993 Ack=259749927 Win=65535 Len=0
1,2.97208000000046,10.0.2.15,62.210.85.178,TLSv1.2,4124,Application Data
1,2.9721260000005714,62.210.85.178,10.0.2.15,TCP,60,9001  >  35978 [ACK] Seq=14182993 Ack=259751387 Win=65535 Len=0
1,2.972134000000551,62.210.85.178,10.0.2.15,TCP,60,9001  >  35978 [ACK] Seq=14182993 Ack=259752847 Win=65535 Len=0
1,2.9721380000000863,62.210.85.178,10.0.2.15,TCP,60,9001  >  35978 [ACK] Seq=14182993 Ack=259753997 Win=65535 Len=0
1,2.972171999999773,10.0.2.15,62.210.85.178,TLSv1.2,332,Application Data
1,2.9722099999999045,62.210.85.178,10.0.2.15,TCP,60,9001  >  35978 [ACK] Seq=14182993 Ack=259754275 Win=65535 Len=0
1,2.9722609999998895,10.0.2.15,62.210.85.178,TLSv1.2,3868,Application Data
1,2.972302000000127,62.210.85.178,10.0.2.15,TCP,60,9001  >  35978 [ACK] Seq=14182993 Ack=259755735 Win=65535 Len=0
1,2.972310000000107,62.210.85.178,10.0.2.15,TCP,60,9001  >  35978 [ACK] Seq=14182993 Ack=259757195 Win=65535 Len=0
1,2.9723140000005515,62.210.85.178,10.0.2.15,TCP,60,9001  >  35978 [ACK] Seq=14182993 Ack=259758089 Win=65535 Len=0
1,2.9723519999997734,10.0.2.15,62.210.85.178,TLSv1.2,4124,Application Data
1,2.9723910000002434,62.210.85.178,10.0.2.15,TCP,60,9001  >  35978 [ACK] Seq=14182993 Ack=259759549 Win=65535 Len=0
1,2.972399000000223,62.210.85.178,10.0.2.15,TCP,60,9001  >  35978 [ACK] Seq=14182993 Ack=259761009 Win=65535 Len=0
1,2.9724029999997583,62.210.85.178,10.0.2.15,TCP,60,9001  >  35978 [ACK] Seq=14182993 Ack=259762159 Win=65535 Len=0
1,2.9724379999997836,10.0.2.15,62.210.85.178,TLSv1.2,3030,Application Data
1,2.972475999999915,62.210.85.178,10.0.2.15,TCP,60,9001  >  35978 [ACK] Seq=14182993 Ack=259763619 Win=65535 Len=0
1,2.972483999999895,62.210.85.178,10.0.2.15,TCP,60,9001  >  35978 [ACK] Seq=14182993 Ack=259765079 Win=65535 Len=0
1,2.972487000000001,62.210.85.178,10.0.2.15,TCP,60,9001  >  35978 [ACK] Seq=14182993 Ack=259765135 Win=65535 Len=0
1,2.9861620000001494,10.0.2.15,62.210.85.178,TLSv1.2,590,Application Data
1,2.986283000000185,62.210.85.178,10.0.2.15,TCP,60,9001  >  35978 [ACK] Seq=14182993 Ack=259765671 Win=65535 Len=0
1,3.1204450000004726,54.93.77.70,10.0.2.15,TLSv1.2,3674,Application Data
1,3.1205870000003415,10.0.2.15,54.93.77.70,TCP,54,34692  >  9001 [ACK] Seq=14275997 Ack=259633805 Win=65535 Len=0
1,3.1276010000001406,54.93.77.70,10.0.2.15,TLSv1.2,5846,Application Data
1,3.1276859999998123,10.0.2.15,54.93.77.70,TCP,54,34692  >  9001 [ACK] Seq=14275997 Ack=259639597 Win=65535 Len=0
1,3.1309739999996964,54.93.77.70,10.0.2.15,TLSv1.2,5846,Application Data [TCP segment of a reassembled PDU]
1,3.1310160000002725,10.0.2.15,54.93.77.70,TCP,54,34692  >  9001 [ACK] Seq=14275997 Ack=259645389 Win=65535 Len=0
1,3.131177000000207,10.0.2.15,54.93.77.70,TLSv1.2,590,Application Data
1,3.131260000000111,54.93.77.70,10.0.2.15,TCP,60,9001  >  34692 [ACK] Seq=259645389 Ack=14276533 Win=65535 Len=0
1,3.1385010000003604,54.93.77.70,10.0.2.15,TLSv1.2,358,Application Data
1,3.162651000000551,54.93.77.70,10.0.2.15,TCP,2950,"9001  >  34692 [PSH, ACK] Seq=259645693 Ack=14276533 Win=65535 Len=2896 [TCP segment of a reassembled PDU]"
1,3.1627079999998386,10.0.2.15,54.93.77.70,TCP,54,34692  >  9001 [ACK] Seq=14276533 Ack=259648589 Win=65535 Len=0
1,3.1713369999997667,54.93.77.70,10.0.2.15,TLSv1.2,2950,"Application Data, Application Data"
1,3.1713620000000446,54.93.77.70,10.0.2.15,TLSv1.2,8742,"Application Data, Application Data"
1,3.171419000000242,10.0.2.15,54.93.77.70,TCP,54,34692  >  9001 [ACK] Seq=14276533 Ack=259651485 Win=65535 Len=0
1,3.1715039999999135,10.0.2.15,54.93.77.70,TCP,54,34692  >  9001 [ACK] Seq=14276533 Ack=259660173 Win=65535 Len=0
1,3.171925999999985,10.0.2.15,54.93.77.70,TLSv1.2,590,Application Data
1,3.1720359999999346,54.93.77.70,10.0.2.15,TCP,60,9001  >  34692 [ACK] Seq=259660173 Ack=14277069 Win=65535 Len=0
1,3.182491999999911,54.93.77.70,10.0.2.15,TLSv1.2,1104,Application Data
1,3.187533999999687,54.93.77.70,10.0.2.15,TCP,2950,"9001  >  34692 [PSH, ACK] Seq=259661223 Ack=14277069 Win=65535 Len=2896 [TCP segment of a reassembled PDU]"
1,3.187582000000475,10.0.2.15,54.93.77.70,TCP,54,34692  >  9001 [ACK] Seq=14277069 Ack=259664119 Win=65535 Len=0
1,3.1876320000001215,54.93.77.70,10.0.2.15,TLSv1.2,1502,Application Data [TCP segment of a reassembled PDU]
1,3.1876970000002984,10.0.2.15,54.93.77.70,TCP,54,34692  >  9001 [ACK] Seq=14277069 Ack=259665567 Win=65535 Len=0
1,3.1970229999997173,54.93.77.70,10.0.2.15,TLSv1.2,7294,"Application Data, Application Data"
1,3.1971009999997477,10.0.2.15,54.93.77.70,TCP,54,34692  >  9001 [ACK] Seq=14277069 Ack=259672807 Win=65535 Len=0
1,3.20527200000015,54.93.77.70,10.0.2.15,TLSv1.2,380,Application Data
1,3.218702000000121,54.93.77.70,10.0.2.15,TLSv1.2,7294,Application Data
1,3.218749000000571,10.0.2.15,54.93.77.70,TCP,54,34692  >  9001 [ACK] Seq=14277069 Ack=259680373 Win=65535 Len=0
1,3.230004000000008,54.93.77.70,10.0.2.15,TLSv1.2,2950,"Application Data, Application Data"
1,3.2300640000003114,10.0.2.15,54.93.77.70,TCP,54,34692  >  9001 [ACK] Seq=14277069 Ack=259683269 Win=65535 Len=0
1,3.230109000000084,54.93.77.70,10.0.2.15,TCP,1502,"9001  >  34692 [PSH, ACK] Seq=259683269 Ack=14277069 Win=65535 Len=1448 [TCP segment of a reassembled PDU]"
1,3.2301589999997304,10.0.2.15,54.93.77.70,TCP,54,34692  >  9001 [ACK] Seq=14277069 Ack=259684717 Win=65535 Len=0
1,3.2349530000001323,54.93.77.70,10.0.2.15,TLSv1.2,380,Application Data
1,3.235091000000466,10.0.2.15,54.93.77.70,TLSv1.2,590,Application Data
1,3.235168000000158,54.93.77.70,10.0.2.15,TCP,60,9001  >  34692 [ACK] Seq=259685043 Ack=14277605 Win=65535 Len=0
1,3.2530249999999796,54.93.77.70,10.0.2.15,TLSv1.2,1104,Application Data
1,3.255898999999772,10.0.2.15,54.93.77.70,TLSv1.2,590,Application Data
1,3.256057999999939,54.93.77.70,10.0.2.15,TCP,60,9001  >  34692 [ACK] Seq=259686093 Ack=14278141 Win=65535 Len=0
1,3.258990999999696,62.210.85.178,10.0.2.15,TLSv1.2,590,Application Data
1,3.302552000000105,10.0.2.15,62.210.85.178,TCP,54,35978  >  9001 [ACK] Seq=259765671 Ack=14183529 Win=65535 Len=0
1,3.317254000000503,62.210.85.178,10.0.2.15,TLSv1.2,590,Application Data
1,3.3173280000000887,10.0.2.15,62.210.85.178,TCP,54,35978  >  9001 [ACK] Seq=259765671 Ack=14184065 Win=65535 Len=0
1,3.337897999999768,62.210.85.178,10.0.2.15,TLSv1.2,590,Application Data
1,3.33796700000039,10.0.2.15,62.210.85.178,TCP,54,35978  >  9001 [ACK] Seq=259765671 Ack=14184601 Win=65535 Len=0
1,3.4079430000001594,62.210.85.178,10.0.2.15,TLSv1.2,590,Application Data
1,3.408027000000402,10.0.2.15,62.210.85.178,TCP,54,35978  >  9001 [ACK] Seq=259765671 Ack=14185137 Win=65535 Len=0
1,3.408524999999827,10.0.2.15,62.210.85.178,TLSv1.2,590,Application Data
1,3.4086310000002413,62.210.85.178,10.0.2.15,TCP,60,9001  >  35978 [ACK] Seq=14185137 Ack=259766207 Win=65535 Len=0
1,3.5002519999998185,54.93.77.70,10.0.2.15,TLSv1.2,590,Application Data
1,3.50061900000037,10.0.2.15,54.93.77.70,TLSv1.2,590,Application Data
1,3.5007350000005317,54.93.77.70,10.0.2.15,TCP,60,9001  >  34692 [ACK] Seq=259686629 Ack=14278677 Win=65535 Len=0
1,3.623507000000245,62.210.85.178,10.0.2.15,TLSv1.2,590,Application Data
1,3.6272360000002664,10.0.2.15,62.210.85.178,TLSv1.2,590,Application Data
1,3.62738200000058,62.210.85.178,10.0.2.15,TCP,60,9001  >  35978 [ACK] Seq=14185673 Ack=259766743 Win=65535 Len=0
1,3.6382260000000315,10.0.2.15,62.210.85.178,TLSv1.2,4124,Application Data
1,3.638355000000047,10.0.2.15,62.210.85.178,TCP,2974,35978  >  9001 [ACK] Seq=259770813 Ack=14185673 Win=65535 Len=2920 [TCP segment of a reassembled PDU]
1,3.638383000000431,62.210.85.178,10.0.2.15,TCP,60,9001  >  35978 [ACK] Seq=14185673 Ack=259768203 Win=65535 Len=0
1,3.638394000000517,62.210.85.178,10.0.2.15,TCP,60,9001  >  35978 [ACK] Seq=14185673 Ack=259769663 Win=65535 Len=0
1,3.6383990000003905,62.210.85.178,10.0.2.15,TCP,60,9001  >  35978 [ACK] Seq=14185673 Ack=259770813 Win=65535 Len=0
1,3.638455999999678,62.210.85.178,10.0.2.15,TCP,60,9001  >  35978 [ACK] Seq=14185673 Ack=259772273 Win=65535 Len=0
1,3.638463000000229,62.210.85.178,10.0.2.15,TCP,60,9001  >  35978 [ACK] Seq=14185673 Ack=259773733 Win=65535 Len=0
1,3.6384980000002543,10.0.2.15,62.210.85.178,TLSv1.2,1204,Application Data
1,3.6385360000003857,62.210.85.178,10.0.2.15,TCP,60,9001  >  35978 [ACK] Seq=14185673 Ack=259774883 Win=65535 Len=0
1,3.6385849999996935,10.0.2.15,62.210.85.178,TLSv1.2,4124,Application Data
1,3.6386499999998705,10.0.2.15,62.210.85.178,TCP,2974,35978  >  9001 [ACK] Seq=259778953 Ack=14185673 Win=65535 Len=2920 [TCP segment of a reassembled PDU]
1,3.6386890000003405,62.210.85.178,10.0.2.15,TCP,60,9001  >  35978 [ACK] Seq=14185673 Ack=259776343 Win=65535 Len=0
1,3.6386959999999817,62.210.85.178,10.0.2.15,TCP,60,9001  >  35978 [ACK] Seq=14185673 Ack=259777803 Win=65535 Len=0
1,3.6387000000004264,62.210.85.178,10.0.2.15,TCP,60,9001  >  35978 [ACK] Seq=14185673 Ack=259778953 Win=65535 Len=0
1,3.6387039999999615,62.210.85.178,10.0.2.15,TCP,60,9001  >  35978 [ACK] Seq=14185673 Ack=259780413 Win=65535 Len=0
1,3.638708000000406,62.210.85.178,10.0.2.15,TCP,60,9001  >  35978 [ACK] Seq=14185673 Ack=259781873 Win=65535 Len=0
1,3.6387460000005376,10.0.2.15,62.210.85.178,TLSv1.2,1204,Application Data
1,3.6388290000004417,62.210.85.178,10.0.2.15,TCP,60,9001  >  35978 [ACK] Seq=14185673 Ack=259783023 Win=65535 Len=0
1,3.638898000000154,10.0.2.15,62.210.85.178,TLSv1.2,332,Application Data
1,3.638938000000053,62.210.85.178,10.0.2.15,TCP,60,9001  >  35978 [ACK] Seq=14185673 Ack=259783301 Win=65535 Len=0
1,3.638998999999785,10.0.2.15,62.210.85.178,TLSv1.2,3868,Application Data
1,3.6390400000000227,62.210.85.178,10.0.2.15,TCP,60,9001  >  35978 [ACK] Seq=14185673 Ack=259784761 Win=65535 Len=0
1,3.6390470000005735,62.210.85.178,10.0.2.15,TCP,60,9001  >  35978 [ACK] Seq=14185673 Ack=259786221 Win=65535 Len=0
1,3.6390510000001086,62.210.85.178,10.0.2.15,TCP,60,9001  >  35978 [ACK] Seq=14185673 Ack=259787115 Win=65535 Len=0
1,3.6391050000001997,10.0.2.15,62.210.85.178,TLSv1.2,4124,Application Data
1,3.6391810000004625,62.210.85.178,10.0.2.15,TCP,60,9001  >  35978 [ACK] Seq=14185673 Ack=259788575 Win=65535 Len=0
1,3.6391890000004423,62.210.85.178,10.0.2.15,TCP,60,9001  >  35978 [ACK] Seq=14185673 Ack=259790035 Win=65535 Len=0
1,3.6391929999999775,62.210.85.178,10.0.2.15,TCP,60,9001  >  35978 [ACK] Seq=14185673 Ack=259791185 Win=65535 Len=0
1,3.6392390000000887,10.0.2.15,62.210.85.178,TLSv1.2,1488,Application Data
1,3.6392789999999877,62.210.85.178,10.0.2.15,TCP,60,9001  >  35978 [ACK] Seq=14185673 Ack=259792619 Win=65535 Len=0
1,3.7299960000000283,54.93.77.70,10.0.2.15,TCP,2950,"9001  >  34692 [PSH, ACK] Seq=259686629 Ack=14278677 Win=65535 Len=2896 [TCP segment of a reassembled PDU]"
1,3.7301250000000437,54.93.77.70,10.0.2.15,TLSv1.2,778,Application Data
1,3.7301690000003873,10.0.2.15,54.93.77.70,TCP,54,34692  >  9001 [ACK] Seq=14278677 Ack=259690249 Win=65535 Len=0
1,3.7389929999999367,54.93.77.70,10.0.2.15,TLSv1.2,7294,Application Data
1,3.739078000000518,10.0.2.15,54.93.77.70,TCP,54,34692  >  9001 [ACK] Seq=14278677 Ack=259697489 Win=65535 Len=0
1,3.7392689999996946,10.0.2.15,54.93.77.70,TLSv1.2,590,Application Data
1,3.739389000000301,54.93.77.70,10.0.2.15,TCP,60,9001  >  34692 [ACK] Seq=259697489 Ack=14279213 Win=65535 Len=0
1,3.757064000000355,54.93.77.70,10.0.2.15,TLSv1.2,568,Application Data
1,3.7776249999997162,54.93.77.70,10.0.2.15,TLSv1.2,7294,Application Data
1,3.7777820000001157,10.0.2.15,54.93.77.70,TCP,54,34692  >  9001 [ACK] Seq=14279213 Ack=259705243 Win=65535 Len=0
1,3.7967930000004344,54.93.77.70,10.0.2.15,TLSv1.2,1104,"Application Data, Application Data"
1,3.805702999999994,54.93.77.70,10.0.2.15,TCP,2950,"9001  >  34692 [PSH, ACK] Seq=259706293 Ack=14279213 Win=65535 Len=2896 [TCP segment of a reassembled PDU]"
1,3.8057770000004894,10.0.2.15,54.93.77.70,TCP,54,34692  >  9001 [ACK] Seq=14279213 Ack=259709189 Win=65535 Len=0
1,3.8058270000001357,54.93.77.70,10.0.2.15,TLSv1.2,1502,Application Data [TCP segment of a reassembled PDU]
1,3.805876000000353,10.0.2.15,54.93.77.70,TCP,54,34692  >  9001 [ACK] Seq=14279213 Ack=259710637 Win=65535 Len=0
1,3.806673000000046,54.93.77.70,10.0.2.15,TCP,1502,"9001  >  34692 [PSH, ACK] Seq=259710637 Ack=14279213 Win=65535 Len=1448 [TCP segment of a reassembled PDU]"
1,3.8067140000002837,10.0.2.15,54.93.77.70,TCP,54,34692  >  9001 [ACK] Seq=14279213 Ack=259712085 Win=65535 Len=0
1,3.8251110000001063,54.93.77.70,10.0.2.15,TLSv1.2,988,Application Data
1,3.8253899999999703,10.0.2.15,54.93.77.70,TLSv1.2,590,Application Data
1,3.825471000000107,54.93.77.70,10.0.2.15,TCP,60,9001  >  34692 [ACK] Seq=259713019 Ack=14279749 Win=65535 Len=0
1,3.8362120000001596,10.0.2.15,54.93.77.70,TLSv1.2,590,Application Data
1,3.836377999999968,54.93.77.70,10.0.2.15,TCP,60,9001  >  34692 [ACK] Seq=259713019 Ack=14280285 Win=65535 Len=0
1,3.8697650000003705,62.210.85.178,10.0.2.15,TLSv1.2,590,Application Data
1,3.913198000000193,10.0.2.15,62.210.85.178,TCP,54,35978  >  9001 [ACK] Seq=259792619 Ack=14186209 Win=65535 Len=0
1,4.254364000000351,62.210.85.178,10.0.2.15,TLSv1.2,1104,Application Data
1,4.254439999999704,10.0.2.15,62.210.85.178,TCP,54,35978  >  9001 [ACK] Seq=259792619 Ack=14187259 Win=65535 Len=0
1,4.2549159999998665,10.0.2.15,62.210.85.178,TLSv1.2,590,Application Data
1,4.255017999999836,62.210.85.178,10.0.2.15,TCP,60,9001  >  35978 [ACK] Seq=14187259 Ack=259793155 Win=65535 Len=0
1,4.852303000000575,54.93.77.70,10.0.2.15,TLSv1.2,590,Application Data
1,4.852678000000196,10.0.2.15,54.93.77.70,TLSv1.2,590,Application Data
1,4.852788000000146,54.93.77.70,10.0.2.15,TCP,60,9001  >  34692 [ACK] Seq=259713555 Ack=14280821 Win=65535 Len=0
1,5.073988000000099,62.210.85.178,10.0.2.15,TLSv1.2,590,Application Data
1,5.078086999999869,10.0.2.15,62.210.85.178,TLSv1.2,590,Application Data
1,5.078220000000329,62.210.85.178,10.0.2.15,TCP,60,9001  >  35978 [ACK] Seq=14187795 Ack=259793691 Win=65535 Len=0
1,5.089474999999766,10.0.2.15,62.210.85.178,TLSv1.2,4124,Application Data
1,5.089622999999847,62.210.85.178,10.0.2.15,TCP,60,9001  >  35978 [ACK] Seq=14187795 Ack=259795151 Win=65535 Len=0
1,5.089640000000145,62.210.85.178,10.0.2.15,TCP,60,9001  >  35978 [ACK] Seq=14187795 Ack=259796611 Win=65535 Len=0
1,5.089645000000019,62.210.85.178,10.0.2.15,TCP,60,9001  >  35978 [ACK] Seq=14187795 Ack=259797761 Win=65535 Len=0
1,5.089700999999877,10.0.2.15,62.210.85.178,TLSv1.2,4124,Application Data
1,5.08978500000012,62.210.85.178,10.0.2.15,TCP,60,9001  >  35978 [ACK] Seq=14187795 Ack=259799221 Win=65535 Len=0
1,5.089791999999761,62.210.85.178,10.0.2.15,TCP,60,9001  >  35978 [ACK] Seq=14187795 Ack=259800681 Win=65535 Len=0
1,5.089794999999867,62.210.85.178,10.0.2.15,TCP,60,9001  >  35978 [ACK] Seq=14187795 Ack=259801831 Win=65535 Len=0
1,5.0898269999997865,10.0.2.15,62.210.85.178,TLSv1.2,4124,Application Data
1,5.089864999999918,62.210.85.178,10.0.2.15,TCP,60,9001  >  35978 [ACK] Seq=14187795 Ack=259803291 Win=65535 Len=0
1,5.089874000000236,62.210.85.178,10.0.2.15,TCP,60,9001  >  35978 [ACK] Seq=14187795 Ack=259804751 Win=65535 Len=0
1,5.08987900000011,62.210.85.178,10.0.2.15,TCP,60,9001  >  35978 [ACK] Seq=14187795 Ack=259805901 Win=65535 Len=0
1,5.089915999999903,10.0.2.15,62.210.85.178,TLSv1.2,4124,Application Data
1,5.089954000000034,62.210.85.178,10.0.2.15,TCP,60,9001  >  35978 [ACK] Seq=14187795 Ack=259807361 Win=65535 Len=0
1,5.089962000000014,62.210.85.178,10.0.2.15,TCP,60,9001  >  35978 [ACK] Seq=14187795 Ack=259808821 Win=65535 Len=0
1,5.090024000000085,10.0.2.15,62.210.85.178,TLSv1.2,2974,Application Data
1,5.0900650000003225,62.210.85.178,10.0.2.15,TCP,60,9001  >  35978 [ACK] Seq=14187795 Ack=259809971 Win=65535 Len=0
1,5.090071999999964,62.210.85.178,10.0.2.15,TCP,60,9001  >  35978 [ACK] Seq=14187795 Ack=259811431 Win=65535 Len=0
1,5.090076999999837,62.210.85.178,10.0.2.15,TCP,60,9001  >  35978 [ACK] Seq=14187795 Ack=259812891 Win=65535 Len=0
1,5.0901050000002215,10.0.2.15,62.210.85.178,TLSv1.2,1226,Application Data
1,5.090140000000247,62.210.85.178,10.0.2.15,TCP,60,9001  >  35978 [ACK] Seq=14187795 Ack=259814063 Win=65535 Len=0
1,5.090183000000252,10.0.2.15,62.210.85.178,TLSv1.2,4124,Application Data
1,5.090223000000151,62.210.85.178,10.0.2.15,TCP,60,9001  >  35978 [ACK] Seq=14187795 Ack=259815523 Win=65535 Len=0
1,5.090231000000131,62.210.85.178,10.0.2.15,TCP,60,9001  >  35978 [ACK] Seq=14187795 Ack=259816983 Win=65535 Len=0
1,5.090234000000237,62.210.85.178,10.0.2.15,TCP,60,9001  >  35978 [ACK] Seq=14187795 Ack=259818133 Win=65535 Len=0
1,5.09027100000003,10.0.2.15,62.210.85.178,TLSv1.2,2002,Application Data
1,5.090310999999929,62.210.85.178,10.0.2.15,TCP,60,9001  >  35978 [ACK] Seq=14187795 Ack=259819593 Win=65535 Len=0
1,5.090317000000141,62.210.85.178,10.0.2.15,TCP,60,9001  >  35978 [ACK] Seq=14187795 Ack=259820081 Win=65535 Len=0
1,5.252459000000272,54.93.77.70,10.0.2.15,TLSv1.2,3674,Application Data
1,5.252588000000287,10.0.2.15,54.93.77.70,TCP,54,34692  >  9001 [ACK] Seq=14280821 Ack=259717175 Win=65535 Len=0
1,5.2717090000005555,54.93.77.70,10.0.2.15,TCP,2950,"9001  >  34692 [PSH, ACK] Seq=259717175 Ack=14280821 Win=65535 Len=2896 [TCP segment of a reassembled PDU]"
1,5.271762999999737,10.0.2.15,54.93.77.70,TCP,54,34692  >  9001 [ACK] Seq=14280821 Ack=259720071 Win=65535 Len=0
1,5.272098999999798,54.93.77.70,10.0.2.15,TLSv1.2,778,Application Data
1,5.309385000000475,54.93.77.70,10.0.2.15,TLSv1.2,1104,Application Data
1,5.309439999999995,10.0.2.15,54.93.77.70,TCP,54,34692  >  9001 [ACK] Seq=14280821 Ack=259721845 Win=65535 Len=0
1,5.402068000000327,54.93.77.70,10.0.2.15,TLSv1.2,3674,Application Data
1,5.402200000000448,10.0.2.15,54.93.77.70,TCP,54,34692  >  9001 [ACK] Seq=14280821 Ack=259725465 Win=65535 Len=0
1,5.407373000000007,54.93.77.70,10.0.2.15,TCP,2950,"9001  >  34692 [PSH, ACK] Seq=259725465 Ack=14280821 Win=65535 Len=2896 [TCP segment of a reassembled PDU]"
1,5.4074170000003505,10.0.2.15,54.93.77.70,TCP,54,34692  >  9001 [ACK] Seq=14280821 Ack=259728361 Win=65535 Len=0
1,5.4083559999999125,54.93.77.70,10.0.2.15,TLSv1.2,7294,"Application Data, Application Data"
1,5.408422000000428,10.0.2.15,54.93.77.70,TCP,54,34692  >  9001 [ACK] Seq=14280821 Ack=259735601 Win=65535 Len=0
1,5.472356000000218,54.93.77.70,10.0.2.15,TLSv1.2,2950,Application Data [TCP segment of a reassembled PDU]
1,5.47243299999991,10.0.2.15,54.93.77.70,TCP,54,34692  >  9001 [ACK] Seq=14280821 Ack=259738497 Win=65535 Len=0
1,5.472483999999895,54.93.77.70,10.0.2.15,TLSv1.2,1502,Application Data
1,5.472545999999966,10.0.2.15,54.93.77.70,TCP,54,34692  >  9001 [ACK] Seq=14280821 Ack=259739945 Win=65535 Len=0
1,5.472775000000183,10.0.2.15,54.93.77.70,TLSv1.2,590,Application Data
1,5.472851000000446,54.93.77.70,10.0.2.15,TCP,60,9001  >  34692 [ACK] Seq=259739945 Ack=14281357 Win=65535 Len=0
1,5.487788999999793,10.0.2.15,54.93.77.70,TLSv1.2,1104,Application Data
1,5.487920000000486,54.93.77.70,10.0.2.15,TCP,60,9001  >  34692 [ACK] Seq=259739945 Ack=14282407 Win=65535 Len=0
1,5.518643000000338,54.93.77.70,10.0.2.15,TLSv1.2,590,Application Data
1,5.561232000000018,10.0.2.15,54.93.77.70,TCP,54,34692  >  9001 [ACK] Seq=14282407 Ack=259740481 Win=65535 Len=0
1,6.096975999999813,62.210.85.178,10.0.2.15,TLSv1.2,1618,Application Data
1,6.097119000000021,10.0.2.15,62.210.85.178,TCP,54,35978  >  9001 [ACK] Seq=259820081 Ack=14189359 Win=65535 Len=0
1,6.097461999999723,10.0.2.15,62.210.85.178,TLSv1.2,590,Application Data
1,6.097590999999738,62.210.85.178,10.0.2.15,TCP,60,9001  >  35978 [ACK] Seq=14189359 Ack=259820617 Win=65535 Len=0
1,6.7265159999997195,54.93.77.70,10.0.2.15,TLSv1.2,590,Application Data
1,6.72660199999973,10.0.2.15,54.93.77.70,TCP,54,34692  >  9001 [ACK] Seq=14282407 Ack=259741017 Win=65535 Len=0
1,6.727080999999998,10.0.2.15,54.93.77.70,TLSv1.2,590,Application Data
1,6.727237000000059,54.93.77.70,10.0.2.15,TCP,60,9001  >  34692 [ACK] Seq=259741017 Ack=14282943 Win=65535 Len=0
1,6.848113000000012,62.210.85.178,10.0.2.15,TLSv1.2,590,Application Data
1,6.855567000000519,10.0.2.15,62.210.85.178,TLSv1.2,590,Application Data
1,6.855792000000292,62.210.85.178,10.0.2.15,TCP,60,9001  >  35978 [ACK] Seq=14189895 Ack=259821153 Win=65535 Len=0
1,6.866036000000349,10.0.2.15,62.210.85.178,TLSv1.2,4124,Application Data
1,6.8661480000000665,10.0.2.15,62.210.85.178,TCP,2974,35978  >  9001 [ACK] Seq=259825223 Ack=14189895 Win=65535 Len=2920 [TCP segment of a reassembled PDU]
1,6.866215000000011,62.210.85.178,10.0.2.15,TCP,60,9001  >  35978 [ACK] Seq=14189895 Ack=259822613 Win=65535 Len=0
1,6.866226000000097,62.210.85.178,10.0.2.15,TCP,60,9001  >  35978 [ACK] Seq=14189895 Ack=259824073 Win=65535 Len=0
1,6.866230000000542,62.210.85.178,10.0.2.15,TCP,60,9001  >  35978 [ACK] Seq=14189895 Ack=259825223 Win=65535 Len=0
1,6.866235000000415,62.210.85.178,10.0.2.15,TCP,60,9001  >  35978 [ACK] Seq=14189895 Ack=259826683 Win=65535 Len=0
1,6.8662389999999505,62.210.85.178,10.0.2.15,TCP,60,9001  >  35978 [ACK] Seq=14189895 Ack=259828143 Win=65535 Len=0
1,6.866313000000446,10.0.2.15,62.210.85.178,TLSv1.2,1204,Application Data
1,6.866410000000542,62.210.85.178,10.0.2.15,TCP,60,9001  >  35978 [ACK] Seq=14189895 Ack=259829293 Win=65535 Len=0
1,6.866465000000062,10.0.2.15,62.210.85.178,TLSv1.2,4124,Application Data
1,6.8665320000000065,10.0.2.15,62.210.85.178,TCP,2974,35978  >  9001 [ACK] Seq=259833363 Ack=14189895 Win=65535 Len=2920 [TCP segment of a reassembled PDU]
1,6.8665719999999055,62.210.85.178,10.0.2.15,TCP,60,9001  >  35978 [ACK] Seq=14189895 Ack=259830753 Win=65535 Len=0
1,6.866579000000456,62.210.85.178,10.0.2.15,TCP,60,9001  >  35978 [ACK] Seq=14189895 Ack=259832213 Win=65535 Len=0
1,6.86658400000033,62.210.85.178,10.0.2.15,TCP,60,9001  >  35978 [ACK] Seq=14189895 Ack=259833363 Win=65535 Len=0
1,6.866589000000204,62.210.85.178,10.0.2.15,TCP,60,9001  >  35978 [ACK] Seq=14189895 Ack=259834823 Win=65535 Len=0
1,6.866592999999739,62.210.85.178,10.0.2.15,TCP,60,9001  >  35978 [ACK] Seq=14189895 Ack=259836283 Win=65535 Len=0
1,6.866632000000209,10.0.2.15,62.210.85.178,TLSv1.2,1204,Application Data
1,6.866721000000325,62.210.85.178,10.0.2.15,TCP,60,9001  >  35978 [ACK] Seq=14189895 Ack=259837433 Win=65535 Len=0
1,6.8667569999997795,10.0.2.15,62.210.85.178,TLSv1.2,332,Application Data
1,6.866815000000315,10.0.2.15,62.210.85.178,TCP,2974,35978  >  9001 [ACK] Seq=259837711 Ack=14189895 Win=65535 Len=2920 [TCP segment of a reassembled PDU]
1,6.8668500000003405,62.210.85.178,10.0.2.15,TCP,60,9001  >  35978 [ACK] Seq=14189895 Ack=259837711 Win=65535 Len=0
1,6.866856000000553,62.210.85.178,10.0.2.15,TCP,60,9001  >  35978 [ACK] Seq=14189895 Ack=259839171 Win=65535 Len=0
1,6.866861000000426,62.210.85.178,10.0.2.15,TCP,60,9001  >  35978 [ACK] Seq=14189895 Ack=259840631 Win=65535 Len=0
1,6.866892000000007,10.0.2.15,62.210.85.178,TLSv1.2,948,Application Data
1,6.866952999999739,10.0.2.15,62.210.85.178,TCP,2974,35978  >  9001 [ACK] Seq=259841525 Ack=14189895 Win=65535 Len=2920 [TCP segment of a reassembled PDU]
1,6.866990000000442,62.210.85.178,10.0.2.15,TCP,60,9001  >  35978 [ACK] Seq=14189895 Ack=259841525 Win=65535 Len=0
1,6.866997000000083,62.210.85.178,10.0.2.15,TCP,60,9001  >  35978 [ACK] Seq=14189895 Ack=259842985 Win=65535 Len=0
1,6.867001000000528,62.210.85.178,10.0.2.15,TCP,60,9001  >  35978 [ACK] Seq=14189895 Ack=259844445 Win=65535 Len=0
1,6.867032000000108,10.0.2.15,62.210.85.178,TLSv1.2,1204,Application Data
1,6.867068000000472,62.210.85.178,10.0.2.15,TCP,60,9001  >  35978 [ACK] Seq=14189895 Ack=259845595 Win=65535 Len=0
1,6.867111000000477,10.0.2.15,62.210.85.178,TLSv1.2,3030,Application Data
1,6.867150000000038,62.210.85.178,10.0.2.15,TCP,60,9001  >  35978 [ACK] Seq=14189895 Ack=259847055 Win=65535 Len=0
1,6.867156999999679,62.210.85.178,10.0.2.15,TCP,60,9001  >  35978 [ACK] Seq=14189895 Ack=259848515 Win=65535 Len=0
1,6.867161000000124,62.210.85.178,10.0.2.15,TCP,60,9001  >  35978 [ACK] Seq=14189895 Ack=259848571 Win=65535 Len=0
1,6.8774240000002465,10.0.2.15,62.210.85.178,TLSv1.2,4124,Application Data
1,6.8775040000000445,10.0.2.15,62.210.85.178,TCP,2974,35978  >  9001 [ACK] Seq=259852641 Ack=14189895 Win=65535 Len=2920 [TCP segment of a reassembled PDU]
1,6.877543000000514,62.210.85.178,10.0.2.15,TCP,60,9001  >  35978 [ACK] Seq=14189895 Ack=259850031 Win=65535 Len=0
1,6.877551000000494,62.210.85.178,10.0.2.15,TCP,60,9001  >  35978 [ACK] Seq=14189895 Ack=259851491 Win=65535 Len=0
1,6.877556000000368,62.210.85.178,10.0.2.15,TCP,60,9001  >  35978 [ACK] Seq=14189895 Ack=259852641 Win=65535 Len=0
1,6.877559999999903,62.210.85.178,10.0.2.15,TCP,60,9001  >  35978 [ACK] Seq=14189895 Ack=259854101 Win=65535 Len=0
1,6.877564000000348,62.210.85.178,10.0.2.15,TCP,60,9001  >  35978 [ACK] Seq=14189895 Ack=259855561 Win=65535 Len=0
1,6.877605000000585,10.0.2.15,62.210.85.178,TLSv1.2,1204,Application Data
1,6.877645999999913,62.210.85.178,10.0.2.15,TCP,60,9001  >  35978 [ACK] Seq=14189895 Ack=259856711 Win=65535 Len=0
1,6.877700000000004,10.0.2.15,62.210.85.178,TLSv1.2,4124,Application Data
1,6.877774999999929,62.210.85.178,10.0.2.15,TCP,60,9001  >  35978 [ACK] Seq=14189895 Ack=259858171 Win=65535 Len=0
1,6.8777829999999085,62.210.85.178,10.0.2.15,TCP,60,9001  >  35978 [ACK] Seq=14189895 Ack=259859631 Win=65535 Len=0
1,6.877787999999782,62.210.85.178,10.0.2.15,TCP,60,9001  >  35978 [ACK] Seq=14189895 Ack=259860781 Win=65535 Len=0
1,6.8778360000005705,10.0.2.15,62.210.85.178,TLSv1.2,4124,Application Data
1,6.877903000000515,62.210.85.178,10.0.2.15,TCP,60,9001  >  35978 [ACK] Seq=14189895 Ack=259862241 Win=65535 Len=0
1,6.877910000000156,62.210.85.178,10.0.2.15,TCP,60,9001  >  35978 [ACK] Seq=14189895 Ack=259863701 Win=65535 Len=0
1,6.87791500000003,62.210.85.178,10.0.2.15,TCP,60,9001  >  35978 [ACK] Seq=14189895 Ack=259864851 Win=65535 Len=0
1,6.877956999999697,10.0.2.15,62.210.85.178,TLSv1.2,332,Application Data
1,6.878045999999813,62.210.85.178,10.0.2.15,TCP,60,9001  >  35978 [ACK] Seq=14189895 Ack=259865129 Win=65535 Len=0
1,6.878079000000071,10.0.2.15,62.210.85.178,TCP,1514,35978  >  9001 [ACK] Seq=259865129 Ack=14189895 Win=65535 Len=1460 [TCP segment of a reassembled PDU]
1,6.878133000000162,10.0.2.15,62.210.85.178,TLSv1.2,1186,Application Data
1,6.8781669999998485,62.210.85.178,10.0.2.15,TCP,60,9001  >  35978 [ACK] Seq=14189895 Ack=259866589 Win=65535 Len=0
1,6.878174000000399,62.210.85.178,10.0.2.15,TCP,60,9001  >  35978 [ACK] Seq=14189895 Ack=259867721 Win=65535 Len=0
1,6.96245799999997,54.93.77.70,10.0.2.15,TLSv1.2,590,Application Data
1,6.982858999999735,54.93.77.70,10.0.2.15,TCP,2950,"9001  >  34692 [PSH, ACK] Seq=259741553 Ack=14282943 Win=65535 Len=2896 [TCP segment of a reassembled PDU]"
1,6.982960000000276,10.0.2.15,54.93.77.70,TCP,54,34692  >  9001 [ACK] Seq=14282943 Ack=259744449 Win=65535 Len=0
1,6.983200000000579,54.93.77.70,10.0.2.15,TLSv1.2,778,Application Data
1,6.999870999999985,54.93.77.70,10.0.2.15,TCP,2950,"9001  >  34692 [PSH, ACK] Seq=259745173 Ack=14282943 Win=65535 Len=2896 [TCP segment of a reassembled PDU]"
1,6.999926000000414,10.0.2.15,54.93.77.70,TCP,54,34692  >  9001 [ACK] Seq=14282943 Ack=259748069 Win=65535 Len=0
1,7.000237000000197,54.93.77.70,10.0.2.15,TLSv1.2,778,Application Data
1,7.000442000000476,10.0.2.15,54.93.77.70,TLSv1.2,590,Application Data
1,7.000549000000319,54.93.77.70,10.0.2.15,TCP,60,9001  >  34692 [ACK] Seq=259748793 Ack=14283479 Win=65535 Len=0
1,7.004482999999709,54.93.77.70,10.0.2.15,TCP,2950,"9001  >  34692 [PSH, ACK] Seq=259748793 Ack=14283479 Win=65535 Len=2896 [TCP segment of a reassembled PDU]"
1,7.004552000000331,10.0.2.15,54.93.77.70,TCP,54,34692  >  9001 [ACK] Seq=14283479 Ack=259751689 Win=65535 Len=0
1,7.017888999999741,54.93.77.70,10.0.2.15,TLSv1.2,1314,"Application Data, Application Data"
1,7.061155000000326,10.0.2.15,54.93.77.70,TCP,54,34692  >  9001 [ACK] Seq=14283479 Ack=259752949 Win=65535 Len=0
1,7.111955000000307,54.93.77.70,10.0.2.15,TCP,2950,"9001  >  34692 [PSH, ACK] Seq=259752949 Ack=14283479 Win=65535 Len=2896 [TCP segment of a reassembled PDU]"
1,7.112014000000272,10.0.2.15,54.93.77.70,TCP,54,34692  >  9001 [ACK] Seq=14283479 Ack=259755845 Win=65535 Len=0
1,7.11239999999998,54.93.77.70,10.0.2.15,TLSv1.2,778,Application Data
1,7.112442999999985,10.0.2.15,54.93.77.70,TCP,54,34692  >  9001 [ACK] Seq=14283479 Ack=259756569 Win=65535 Len=0
1,7.126672000000326,54.93.77.70,10.0.2.15,TCP,2950,"9001  >  34692 [PSH, ACK] Seq=259756569 Ack=14283479 Win=65535 Len=2896 [TCP segment of a reassembled PDU]"
1,7.126723000000311,10.0.2.15,54.93.77.70,TCP,54,34692  >  9001 [ACK] Seq=14283479 Ack=259759465 Win=65535 Len=0
1,7.127806999999848,62.210.85.178,10.0.2.15,TLSv1.2,590,Application Data
1,7.128509000000122,54.93.77.70,10.0.2.15,TLSv1.2,778,Application Data
1,7.1285509999997885,10.0.2.15,54.93.77.70,TCP,54,34692  >  9001 [ACK] Seq=14283479 Ack=259760189 Win=65535 Len=0
1,7.138772000000245,54.93.77.70,10.0.2.15,TLSv1.2,7294,Application Data
1,7.138821000000462,10.0.2.15,54.93.77.70,TCP,54,34692  >  9001 [ACK] Seq=14283479 Ack=259767429 Win=65535 Len=0
1,7.157423000000563,54.93.77.70,10.0.2.15,TLSv1.2,2016,Application Data [TCP segment of a reassembled PDU]
1,7.15751199999977,10.0.2.15,54.93.77.70,TCP,54,34692  >  9001 [ACK] Seq=14283479 Ack=259769391 Win=65535 Len=0
1,7.157567000000199,54.93.77.70,10.0.2.15,TLSv1.2,2950,Application Data [TCP segment of a reassembled PDU]
1,7.157605000000331,10.0.2.15,54.93.77.70,TCP,54,34692  >  9001 [ACK] Seq=14283479 Ack=259772287 Win=65535 Len=0
1,7.157850000000508,10.0.2.15,54.93.77.70,TLSv1.2,590,Application Data
1,7.157963000000564,54.93.77.70,10.0.2.15,TCP,60,9001  >  34692 [ACK] Seq=259772287 Ack=14284015 Win=65535 Len=0
1,7.160554000000047,54.93.77.70,10.0.2.15,TLSv1.2,4398,Application Data [TCP segment of a reassembled PDU]
1,7.160598000000391,10.0.2.15,54.93.77.70,TCP,54,34692  >  9001 [ACK] Seq=14284015 Ack=259776631 Win=65535 Len=0
1,7.161117999999988,54.93.77.70,10.0.2.15,TLSv1.2,4398,Application Data [TCP segment of a reassembled PDU]
1,7.161160999999993,10.0.2.15,54.93.77.70,TCP,54,34692  >  9001 [ACK] Seq=14284015 Ack=259780975 Win=65535 Len=0
1,7.169170000000122,10.0.2.15,62.210.85.178,TCP,54,35978  >  9001 [ACK] Seq=259867721 Ack=14190431 Win=65535 Len=0
1,7.170716000000539,54.93.77.70,10.0.2.15,TLSv1.2,2950,Application Data [TCP segment of a reassembled PDU]
1,7.170763000000079,10.0.2.15,54.93.77.70,TCP,54,34692  >  9001 [ACK] Seq=14284015 Ack=259783871 Win=65535 Len=0
1,7.172760999999809,54.93.77.70,10.0.2.15,TCP,1502,"9001  >  34692 [PSH, ACK] Seq=259783871 Ack=14284015 Win=65535 Len=1448 [TCP segment of a reassembled PDU]"
1,7.172808999999688,10.0.2.15,54.93.77.70,TCP,54,34692  >  9001 [ACK] Seq=14284015 Ack=259785319 Win=65535 Len=0
1,7.173370999999861,54.93.77.70,10.0.2.15,TLSv1.2,1314,"Application Data, Application Data"
1,7.1782750000002125,54.93.77.70,10.0.2.15,TCP,1502,"9001  >  34692 [PSH, ACK] Seq=259786579 Ack=14284015 Win=65535 Len=1448 [TCP segment of a reassembled PDU]"
1,7.178327000000536,10.0.2.15,54.93.77.70,TCP,54,34692  >  9001 [ACK] Seq=14284015 Ack=259788027 Win=65535 Len=0
1,7.189166000000114,54.93.77.70,10.0.2.15,TLSv1.2,170,Application Data
1,7.192379000000074,10.0.2.15,54.93.77.70,TLSv1.2,590,Application Data
1,7.192547999999988,54.93.77.70,10.0.2.15,TCP,60,9001  >  34692 [ACK] Seq=259788143 Ack=14284551 Win=65535 Len=0
1,7.287234000000353,62.210.85.178,10.0.2.15,TLSv1.2,590,Application Data
1,7.2873209999997925,10.0.2.15,62.210.85.178,TCP,54,35978  >  9001 [ACK] Seq=259867721 Ack=14190967 Win=65535 Len=0
1,7.4274270000005345,62.210.85.178,10.0.2.15,TLSv1.2,590,Application Data
1,7.427513000000545,10.0.2.15,62.210.85.178,TCP,54,35978  >  9001 [ACK] Seq=259867721 Ack=14191503 Win=65535 Len=0
1,7.428079000000253,10.0.2.15,62.210.85.178,TLSv1.2,590,Application Data
1,7.428179000000455,62.210.85.178,10.0.2.15,TCP,60,9001  >  35978 [ACK] Seq=14191503 Ack=259868257 Win=65535 Len=0
1,7.631378000000041,54.93.77.70,10.0.2.15,TLSv1.2,590,Application Data
1,7.631895000000441,10.0.2.15,54.93.77.70,TLSv1.2,590,Application Data
1,7.632040000000416,54.93.77.70,10.0.2.15,TCP,60,9001  >  34692 [ACK] Seq=259788679 Ack=14285087 Win=65535 Len=0
1,7.871227000000545,62.210.85.178,10.0.2.15,TLSv1.2,590,Application Data
1,7.876224000000548,10.0.2.15,62.210.85.178,TLSv1.2,590,Application Data
1,7.876404000000548,62.210.85.178,10.0.2.15,TCP,60,9001  >  35978 [ACK] Seq=14192039 Ack=259868793 Win=65535 Len=0
1,7.886634000000413,10.0.2.15,62.210.85.178,TLSv1.2,4124,Application Data
1,7.88680100000056,10.0.2.15,62.210.85.178,TCP,2974,35978  >  9001 [ACK] Seq=259872863 Ack=14192039 Win=65535 Len=2920 [TCP segment of a reassembled PDU]
1,7.886854000000312,62.210.85.178,10.0.2.15,TCP,60,9001  >  35978 [ACK] Seq=14192039 Ack=259870253 Win=65535 Len=0
1,7.886868000000504,62.210.85.178,10.0.2.15,TCP,60,9001  >  35978 [ACK] Seq=14192039 Ack=259871713 Win=65535 Len=0
1,7.886873000000378,62.210.85.178,10.0.2.15,TCP,60,9001  >  35978 [ACK] Seq=14192039 Ack=259872863 Win=65535 Len=0
1,7.886953000000176,10.0.2.15,62.210.85.178,TLSv1.2,1204,Application Data
1,7.886977000000115,62.210.85.178,10.0.2.15,TCP,60,9001  >  35978 [ACK] Seq=14192039 Ack=259874323 Win=65535 Len=0
1,7.886983000000328,62.210.85.178,10.0.2.15,TCP,60,9001  >  35978 [ACK] Seq=14192039 Ack=259875783 Win=65535 Len=0
1,7.887053000000378,62.210.85.178,10.0.2.15,TCP,60,9001  >  35978 [ACK] Seq=14192039 Ack=259876933 Win=65535 Len=0
1,7.887093999999706,10.0.2.15,62.210.85.178,TCP,2974,35978  >  9001 [ACK] Seq=259876933 Ack=14192039 Win=65535 Len=2920 [TCP segment of a reassembled PDU]
1,7.887134999999944,62.210.85.178,10.0.2.15,TCP,60,9001  >  35978 [ACK] Seq=14192039 Ack=259878393 Win=65535 Len=0
1,7.887141000000156,62.210.85.178,10.0.2.15,TCP,60,9001  >  35978 [ACK] Seq=14192039 Ack=259879853 Win=65535 Len=0
1,7.887174999999843,10.0.2.15,62.210.85.178,TLSv1.2,1204,Application Data
1,7.887212999999974,62.210.85.178,10.0.2.15,TCP,60,9001  >  35978 [ACK] Seq=14192039 Ack=259881003 Win=65535 Len=0
1,7.8872590000000855,10.0.2.15,62.210.85.178,TLSv1.2,3866,Application Data
1,7.887300999999752,62.210.85.178,10.0.2.15,TCP,60,9001  >  35978 [ACK] Seq=14192039 Ack=259882463 Win=65535 Len=0
1,7.887308000000303,62.210.85.178,10.0.2.15,TCP,60,9001  >  35978 [ACK] Seq=14192039 Ack=259883923 Win=65535 Len=0
1,7.887311999999838,62.210.85.178,10.0.2.15,TCP,60,9001  >  35978 [ACK] Seq=14192039 Ack=259884815 Win=65535 Len=0
1,8.04125600000043,54.93.77.70,10.0.2.15,TCP,2950,"9001  >  34692 [PSH, ACK] Seq=259788679 Ack=14285087 Win=65535 Len=2896 [TCP segment of a reassembled PDU]"
1,8.041393000000426,10.0.2.15,54.93.77.70,TCP,54,34692  >  9001 [ACK] Seq=14285087 Ack=259791575 Win=65535 Len=0
1,8.044409000000087,54.93.77.70,10.0.2.15,TLSv1.2,778,Application Data
1,8.085152999999991,10.0.2.15,54.93.77.70,TCP,54,34692  >  9001 [ACK] Seq=14285087 Ack=259792299 Win=65535 Len=0
1,8.110577999999805,54.93.77.70,10.0.2.15,TCP,2950,"9001  >  34692 [PSH, ACK] Seq=259792299 Ack=14285087 Win=65535 Len=2896 [TCP segment of a reassembled PDU]"
1,8.110649000000194,10.0.2.15,54.93.77.70,TCP,54,34692  >  9001 [ACK] Seq=14285087 Ack=259795195 Win=65535 Len=0
1,8.110698000000411,54.93.77.70,10.0.2.15,TLSv1.2,778,Application Data
1,8.110732000000098,10.0.2.15,54.93.77.70,TCP,54,34692  >  9001 [ACK] Seq=14285087 Ack=259795919 Win=65535 Len=0
1,8.130014000000301,54.93.77.70,10.0.2.15,TCP,2950,"9001  >  34692 [PSH, ACK] Seq=259795919 Ack=14285087 Win=65535 Len=2896 [TCP segment of a reassembled PDU]"
1,8.130065999999715,10.0.2.15,54.93.77.70,TCP,54,34692  >  9001 [ACK] Seq=14285087 Ack=259798815 Win=65535 Len=0
1,8.130149999999958,54.93.77.70,10.0.2.15,TLSv1.2,1502,Application Data [TCP segment of a reassembled PDU]
1,8.130192000000534,10.0.2.15,54.93.77.70,TCP,54,34692  >  9001 [ACK] Seq=14285087 Ack=259800263 Win=65535 Len=0
1,8.132352000000537,54.93.77.70,10.0.2.15,TLSv1.2,3464,Application Data
1,8.132395000000542,10.0.2.15,54.93.77.70,TCP,54,34692  >  9001 [ACK] Seq=14285087 Ack=259803673 Win=65535 Len=0
1,8.13259300000027,10.0.2.15,54.93.77.70,TLSv1.2,590,Application Data
1,8.132704999999987,54.93.77.70,10.0.2.15,TCP,60,9001  >  34692 [ACK] Seq=259803673 Ack=14285623 Win=65535 Len=0
1,8.348205000000235,62.210.85.178,10.0.2.15,TLSv1.2,590,Application Data
1,8.351504000000205,54.93.77.70,10.0.2.15,TLSv1.2,1618,Application Data
1,8.351670000000013,10.0.2.15,54.93.77.70,TCP,54,34692  >  9001 [ACK] Seq=14285623 Ack=259805237 Win=65535 Len=0
