No.,Time,Source,Destination,Protocol,Length,Info
1,0.02164199999970151,10.0.2.15,54.93.77.70,TCP,54,34692  >  9001 [ACK] Seq=14382309 Ack=261740479 Win=65535 Len=0
1,0.10383900000033464,62.210.85.178,10.0.2.15,TLSv1.2,590,Application Data
1,0.13053099999979167,10.0.2.15,54.93.77.70,TLSv1.2,590,Application Data
1,0.13072100000044884,54.93.77.70,10.0.2.15,TCP,60,9001  >  34692 [ACK] Seq=261740479 Ack=14382845 Win=65535 Len=0
1,0.14401300000008632,10.0.2.15,62.210.85.178,TCP,54,35978  >  9001 [ACK] Seq=261819353 Ack=14288887 Win=65535 Len=0
1,0.23404699999991863,62.210.85.178,10.0.2.15,TLSv1.2,590,Application Data
1,0.23412100000041391,10.0.2.15,62.210.85.178,TCP,54,35978  >  9001 [ACK] Seq=261819353 Ack=14289423 Win=65535 Len=0
1,0.23463100000026316,10.0.2.15,62.210.85.178,TLSv1.2,590,Application Data
1,0.23473199999989447,62.210.85.178,10.0.2.15,TCP,60,9001  >  35978 [ACK] Seq=14289423 Ack=261819889 Win=65535 Len=0
1,0.5810989999999947,54.93.77.70,10.0.2.15,TLSv1.2,590,Application Data
1,0.5811869999997725,10.0.2.15,54.93.77.70,TCP,54,34692  >  9001 [ACK] Seq=14382845 Ack=261741015 Win=65535 Len=0
1,0.5815890000003492,10.0.2.15,54.93.77.70,TLSv1.2,1618,Application Data
1,0.5816940000004251,54.93.77.70,10.0.2.15,TCP,60,9001  >  34692 [ACK] Seq=261741015 Ack=14384305 Win=65535 Len=0
1,0.5817059999999401,54.93.77.70,10.0.2.15,TCP,60,9001  >  34692 [ACK] Seq=261741015 Ack=14384409 Win=65535 Len=0
1,0.7862390000000232,62.210.85.178,10.0.2.15,TLSv1.2,1618,Application Data
1,0.7863749999996799,10.0.2.15,62.210.85.178,TCP,54,35978  >  9001 [ACK] Seq=261819889 Ack=14290987 Win=65535 Len=0
1,0.8001370000001771,10.0.2.15,62.210.85.178,TLSv1.2,590,Application Data
1,0.8003250000001572,62.210.85.178,10.0.2.15,TCP,60,9001  >  35978 [ACK] Seq=14290987 Ack=261820425 Win=65535 Len=0
1,0.8130339999997886,10.0.2.15,62.210.85.178,TLSv1.2,1618,Application Data
1,0.8132329999998547,62.210.85.178,10.0.2.15,TCP,60,9001  >  35978 [ACK] Seq=14290987 Ack=261821885 Win=65535 Len=0
1,0.8132530000002589,62.210.85.178,10.0.2.15,TCP,60,9001  >  35978 [ACK] Seq=14290987 Ack=261821989 Win=65535 Len=0
1,0.9258019999997487,54.93.77.70,10.0.2.15,TLSv1.2,590,Application Data
1,0.9447900000004665,54.93.77.70,10.0.2.15,TLSv1.2,1618,Application Data
1,0.9448709999996936,10.0.2.15,54.93.77.70,TCP,54,34692  >  9001 [ACK] Seq=14384409 Ack=261743115 Win=65535 Len=0
1,0.9468440000000555,10.0.2.15,54.93.77.70,TLSv1.2,590,Application Data
1,0.9469920000001366,54.93.77.70,10.0.2.15,TCP,60,9001  >  34692 [ACK] Seq=261743115 Ack=14384945 Win=65535 Len=0
1,1.0934109999998327,62.210.85.178,10.0.2.15,TLSv1.2,590,Application Data
1,1.093721999999616,10.0.2.15,62.210.85.178,TLSv1.2,590,Application Data
1,1.0938360000000102,62.210.85.178,10.0.2.15,TCP,60,9001  >  35978 [ACK] Seq=14291523 Ack=261822525 Win=65535 Len=0
1,1.1939330000004702,54.93.77.70,10.0.2.15,TLSv1.2,590,Application Data
1,1.1943479999999909,10.0.2.15,54.93.77.70,TLSv1.2,590,Application Data
1,1.194441999999981,54.93.77.70,10.0.2.15,TCP,60,9001  >  34692 [ACK] Seq=261743651 Ack=14385481 Win=65535 Len=0
1,1.3124939999997878,62.210.85.178,10.0.2.15,TLSv1.2,590,Application Data
1,1.3179360000003726,10.0.2.15,62.210.85.178,TLSv1.2,590,Application Data
1,1.3180780000002414,62.210.85.178,10.0.2.15,TCP,60,9001  >  35978 [ACK] Seq=14292059 Ack=261823061 Win=65535 Len=0
1,1.3283140000003186,10.0.2.15,62.210.85.178,TLSv1.2,4124,Application Data
1,1.3284629999998288,62.210.85.178,10.0.2.15,TCP,60,9001  >  35978 [ACK] Seq=14292059 Ack=261824521 Win=65535 Len=0
1,1.3284819999998945,62.210.85.178,10.0.2.15,TCP,60,9001  >  35978 [ACK] Seq=14292059 Ack=261825981 Win=65535 Len=0
1,1.3284850000000006,62.210.85.178,10.0.2.15,TCP,60,9001  >  35978 [ACK] Seq=14292059 Ack=261827131 Win=65535 Len=0
1,1.3285269999996672,10.0.2.15,62.210.85.178,TLSv1.2,4124,Application Data
1,1.3285949999999502,62.210.85.178,10.0.2.15,TCP,60,9001  >  35978 [ACK] Seq=14292059 Ack=261828591 Win=65535 Len=0
1,1.328602000000501,62.210.85.178,10.0.2.15,TCP,60,9001  >  35978 [ACK] Seq=14292059 Ack=261830051 Win=65535 Len=0
1,1.3286049999996976,62.210.85.178,10.0.2.15,TCP,60,9001  >  35978 [ACK] Seq=14292059 Ack=261831201 Win=65535 Len=0
1,1.328631000000314,10.0.2.15,62.210.85.178,TCP,2974,35978  >  9001 [ACK] Seq=261831201 Ack=14292059 Win=65535 Len=2920 [TCP segment of a reassembled PDU]
1,1.3286650000000009,62.210.85.178,10.0.2.15,TCP,60,9001  >  35978 [ACK] Seq=14292059 Ack=261832661 Win=65535 Len=0
1,1.3286729999999807,62.210.85.178,10.0.2.15,TCP,60,9001  >  35978 [ACK] Seq=14292059 Ack=261834121 Win=65535 Len=0
1,1.3287019999997938,10.0.2.15,62.210.85.178,TLSv1.2,1204,Application Data
1,1.3287350000000515,62.210.85.178,10.0.2.15,TCP,60,9001  >  35978 [ACK] Seq=14292059 Ack=261835271 Win=65535 Len=0
1,1.328776000000289,10.0.2.15,62.210.85.178,TLSv1.2,4124,Application Data
1,1.3288110000003144,62.210.85.178,10.0.2.15,TCP,60,9001  >  35978 [ACK] Seq=14292059 Ack=261836731 Win=65535 Len=0
1,1.3288179999999556,62.210.85.178,10.0.2.15,TCP,60,9001  >  35978 [ACK] Seq=14292059 Ack=261838191 Win=65535 Len=0
1,1.3288769999999204,10.0.2.15,62.210.85.178,TLSv1.2,2974,Application Data
1,1.3289139999997133,62.210.85.178,10.0.2.15,TCP,60,9001  >  35978 [ACK] Seq=14292059 Ack=261839341 Win=65535 Len=0
1,1.328921000000264,62.210.85.178,10.0.2.15,TCP,60,9001  >  35978 [ACK] Seq=14292059 Ack=261840801 Win=65535 Len=0
1,1.3289240000003701,62.210.85.178,10.0.2.15,TCP,60,9001  >  35978 [ACK] Seq=14292059 Ack=261842261 Win=65535 Len=0
1,1.3289500000000771,10.0.2.15,62.210.85.178,TLSv1.2,1226,Application Data
1,1.3289830000003349,62.210.85.178,10.0.2.15,TCP,60,9001  >  35978 [ACK] Seq=14292059 Ack=261843433 Win=65535 Len=0
1,1.3290210000004663,10.0.2.15,62.210.85.178,TLSv1.2,4124,Application Data
1,1.3290560000004916,62.210.85.178,10.0.2.15,TCP,60,9001  >  35978 [ACK] Seq=14292059 Ack=261844893 Win=65535 Len=0
1,1.3290630000001329,62.210.85.178,10.0.2.15,TCP,60,9001  >  35978 [ACK] Seq=14292059 Ack=261846353 Win=65535 Len=0
1,1.3290649999999005,62.210.85.178,10.0.2.15,TCP,60,9001  >  35978 [ACK] Seq=14292059 Ack=261847503 Win=65535 Len=0
1,1.3291010000002643,10.0.2.15,62.210.85.178,TLSv1.2,3030,Application Data
1,1.3291339999996126,62.210.85.178,10.0.2.15,TCP,60,9001  >  35978 [ACK] Seq=14292059 Ack=261848963 Win=65535 Len=0
1,1.3291410000001633,62.210.85.178,10.0.2.15,TCP,60,9001  >  35978 [ACK] Seq=14292059 Ack=261850423 Win=65535 Len=0
1,1.3291449999996985,62.210.85.178,10.0.2.15,TCP,60,9001  >  35978 [ACK] Seq=14292059 Ack=261850479 Win=65535 Len=0
1,1.3405519999996613,10.0.2.15,62.210.85.178,TLSv1.2,4124,Application Data
1,1.3406050000003233,62.210.85.178,10.0.2.15,TCP,60,9001  >  35978 [ACK] Seq=14292059 Ack=261851939 Win=65535 Len=0
1,1.3406150000000707,62.210.85.178,10.0.2.15,TCP,60,9001  >  35978 [ACK] Seq=14292059 Ack=261853399 Win=65535 Len=0
1,1.3406199999999444,62.210.85.178,10.0.2.15,TCP,60,9001  >  35978 [ACK] Seq=14292059 Ack=261854549 Win=65535 Len=0
1,1.3406629999999495,10.0.2.15,62.210.85.178,TLSv1.2,4124,Application Data
1,1.3407230000002528,62.210.85.178,10.0.2.15,TCP,60,9001  >  35978 [ACK] Seq=14292059 Ack=261856009 Win=65535 Len=0
1,1.340729000000465,62.210.85.178,10.0.2.15,TCP,60,9001  >  35978 [ACK] Seq=14292059 Ack=261857469 Win=65535 Len=0
1,1.3407319999996616,62.210.85.178,10.0.2.15,TCP,60,9001  >  35978 [ACK] Seq=14292059 Ack=261858619 Win=65535 Len=0
1,1.3407680000000255,10.0.2.15,62.210.85.178,TLSv1.2,4124,Application Data
1,1.3408010000002832,62.210.85.178,10.0.2.15,TCP,60,9001  >  35978 [ACK] Seq=14292059 Ack=261860079 Win=65535 Len=0
1,1.340809000000263,62.210.85.178,10.0.2.15,TCP,60,9001  >  35978 [ACK] Seq=14292059 Ack=261861539 Win=65535 Len=0
1,1.3408120000003692,62.210.85.178,10.0.2.15,TCP,60,9001  >  35978 [ACK] Seq=14292059 Ack=261862689 Win=65535 Len=0
1,1.3408470000003945,10.0.2.15,62.210.85.178,TLSv1.2,4124,Application Data
1,1.3408810000000813,62.210.85.178,10.0.2.15,TCP,60,9001  >  35978 [ACK] Seq=14292059 Ack=261864149 Win=65535 Len=0
1,1.340889000000061,62.210.85.178,10.0.2.15,TCP,60,9001  >  35978 [ACK] Seq=14292059 Ack=261865609 Win=65535 Len=0
1,1.3408920000001672,62.210.85.178,10.0.2.15,TCP,60,9001  >  35978 [ACK] Seq=14292059 Ack=261866759 Win=65535 Len=0
1,1.340925999999854,10.0.2.15,62.210.85.178,TLSv1.2,332,Application Data
1,1.3409590000001117,62.210.85.178,10.0.2.15,TCP,60,9001  >  35978 [ACK] Seq=14292059 Ack=261867037 Win=65535 Len=0
1,1.341008999999758,10.0.2.15,62.210.85.178,TLSv1.2,3868,Application Data
1,1.341045000000122,62.210.85.178,10.0.2.15,TCP,60,9001  >  35978 [ACK] Seq=14292059 Ack=261868497 Win=65535 Len=0
1,1.3410519999997632,62.210.85.178,10.0.2.15,TCP,60,9001  >  35978 [ACK] Seq=14292059 Ack=261869957 Win=65535 Len=0
1,1.3410549999998693,62.210.85.178,10.0.2.15,TCP,60,9001  >  35978 [ACK] Seq=14292059 Ack=261870851 Win=65535 Len=0
1,1.3410919999996622,10.0.2.15,62.210.85.178,TLSv1.2,4124,Application Data
1,1.3411269999996875,62.210.85.178,10.0.2.15,TCP,60,9001  >  35978 [ACK] Seq=14292059 Ack=261872311 Win=65535 Len=0
1,1.3411329999998998,62.210.85.178,10.0.2.15,TCP,60,9001  >  35978 [ACK] Seq=14292059 Ack=261873771 Win=65535 Len=0
1,1.3411370000003444,62.210.85.178,10.0.2.15,TCP,60,9001  >  35978 [ACK] Seq=14292059 Ack=261874921 Win=65535 Len=0
1,1.3411720000003697,10.0.2.15,62.210.85.178,TLSv1.2,3030,Application Data
1,1.3412060000000565,62.210.85.178,10.0.2.15,TCP,60,9001  >  35978 [ACK] Seq=14292059 Ack=261876381 Win=65535 Len=0
1,1.3412129999996978,62.210.85.178,10.0.2.15,TCP,60,9001  >  35978 [ACK] Seq=14292059 Ack=261877841 Win=65535 Len=0
1,1.341215999999804,62.210.85.178,10.0.2.15,TCP,60,9001  >  35978 [ACK] Seq=14292059 Ack=261877897 Win=65535 Len=0
1,1.3526440000005095,10.0.2.15,62.210.85.178,TLSv1.2,2132,Application Data
1,1.3527329999997164,62.210.85.178,10.0.2.15,TCP,60,9001  >  35978 [ACK] Seq=14292059 Ack=261879357 Win=65535 Len=0
1,1.3527460000004794,62.210.85.178,10.0.2.15,TCP,60,9001  >  35978 [ACK] Seq=14292059 Ack=261879975 Win=65535 Len=0
1,1.4388630000003104,54.93.77.70,10.0.2.15,TLSv1.2,3674,Application Data
1,1.4389979999996285,10.0.2.15,54.93.77.70,TCP,54,34692  >  9001 [ACK] Seq=14385481 Ack=261747271 Win=65535 Len=0
1,1.4487030000000232,54.93.77.70,10.0.2.15,TLSv1.2,5846,Application Data
1,1.4488080000000991,10.0.2.15,54.93.77.70,TCP,54,34692  >  9001 [ACK] Seq=14385481 Ack=261753063 Win=65535 Len=0
1,1.4488600000004226,54.93.77.70,10.0.2.15,TLSv1.2,1502,Application Data
1,1.4489000000003216,10.0.2.15,54.93.77.70,TCP,54,34692  >  9001 [ACK] Seq=14385481 Ack=261754511 Win=65535 Len=0
1,1.4562949999999546,54.93.77.70,10.0.2.15,TCP,2950,"9001  >  34692 [PSH, ACK] Seq=261754511 Ack=14385481 Win=65535 Len=2896 [TCP segment of a reassembled PDU]"
1,1.4563520000001517,10.0.2.15,54.93.77.70,TCP,54,34692  >  9001 [ACK] Seq=14385481 Ack=261757407 Win=65535 Len=0
1,1.4570059999996374,54.93.77.70,10.0.2.15,TLSv1.2,4912,"Application Data, Application Data"
1,1.4570730000004914,10.0.2.15,54.93.77.70,TCP,54,34692  >  9001 [ACK] Seq=14385481 Ack=261762265 Win=65535 Len=0
1,1.4573479999999108,10.0.2.15,54.93.77.70,TLSv1.2,590,Application Data
1,1.4574679999996079,54.93.77.70,10.0.2.15,TCP,60,9001  >  34692 [ACK] Seq=261762265 Ack=14386017 Win=65535 Len=0
1,1.4674420000001192,54.93.77.70,10.0.2.15,TCP,1502,"9001  >  34692 [PSH, ACK] Seq=261762265 Ack=14386017 Win=65535 Len=1448 [TCP segment of a reassembled PDU]"
1,1.4675139999999374,10.0.2.15,54.93.77.70,TCP,54,34692  >  9001 [ACK] Seq=14386017 Ack=261763713 Win=65535 Len=0
1,1.4726449999998295,54.93.77.70,10.0.2.15,TLSv1.2,2950,Application Data [TCP segment of a reassembled PDU]
1,1.4727190000003247,10.0.2.15,54.93.77.70,TCP,54,34692  >  9001 [ACK] Seq=14386017 Ack=261766609 Win=65535 Len=0
1,1.4743260000004739,54.93.77.70,10.0.2.15,TLSv1.2,894,Application Data
1,1.4938609999999244,54.93.77.70,10.0.2.15,TLSv1.2,5846,Application Data
1,1.4938789999996516,54.93.77.70,10.0.2.15,TLSv1.2,4398,Application Data [TCP segment of a reassembled PDU]
1,1.4939430000003995,10.0.2.15,54.93.77.70,TCP,54,34692  >  9001 [ACK] Seq=14386017 Ack=261777585 Win=65535 Len=0
1,1.4941200000002937,10.0.2.15,54.93.77.70,TLSv1.2,590,Application Data
1,1.494235000000117,54.93.77.70,10.0.2.15,TCP,60,9001  >  34692 [ACK] Seq=261777585 Ack=14386553 Win=65535 Len=0
1,1.5101819999999861,54.93.77.70,10.0.2.15,TLSv1.2,4912,"Application Data, Application Data"
1,1.5102340000003096,10.0.2.15,54.93.77.70,TCP,54,34692  >  9001 [ACK] Seq=14386553 Ack=261782443 Win=65535 Len=0
1,1.5265410000001793,54.93.77.70,10.0.2.15,TLSv1.2,590,Application Data
1,1.5605980000000272,54.93.77.70,10.0.2.15,TLSv1.2,11414,"Application Data, Application Data"
1,1.5606539999998859,10.0.2.15,54.93.77.70,TCP,54,34692  >  9001 [ACK] Seq=14386553 Ack=261794339 Win=65535 Len=0
1,1.5607099999997445,54.93.77.70,10.0.2.15,TLSv1.2,3174,Application Data [TCP segment of a reassembled PDU]
1,1.560779999999795,10.0.2.15,54.93.77.70,TCP,54,34692  >  9001 [ACK] Seq=14386553 Ack=261797459 Win=65535 Len=0
1,1.5610139999998864,54.93.77.70,10.0.2.15,TCP,1502,"9001  >  34692 [PSH, ACK] Seq=261797459 Ack=14386553 Win=65535 Len=1448 [TCP segment of a reassembled PDU]"
1,1.5610520000000179,10.0.2.15,54.93.77.70,TCP,54,34692  >  9001 [ACK] Seq=14386553 Ack=261798907 Win=65535 Len=0
1,1.5769179999997505,54.93.77.70,10.0.2.15,TLSv1.2,148,Application Data
1,1.5771210000002611,10.0.2.15,54.93.77.70,TLSv1.2,590,Application Data
1,1.5772420000002967,54.93.77.70,10.0.2.15,TCP,60,9001  >  34692 [ACK] Seq=261799001 Ack=14387089 Win=65535 Len=0
1,1.586153999999624,62.210.85.178,10.0.2.15,TLSv1.2,590,Application Data
1,1.5874599999997372,54.93.77.70,10.0.2.15,TCP,1502,"9001  >  34692 [PSH, ACK] Seq=261799001 Ack=14387089 Win=65535 Len=1448 [TCP segment of a reassembled PDU]"
1,1.5875569999998334,10.0.2.15,54.93.77.70,TCP,54,34692  >  9001 [ACK] Seq=14387089 Ack=261800449 Win=65535 Len=0
1,1.5929519999999684,54.93.77.70,10.0.2.15,TLSv1.2,684,Application Data
1,1.5965530000003127,10.0.2.15,54.93.77.70,TLSv1.2,590,Application Data
1,1.5968720000000758,54.93.77.70,10.0.2.15,TCP,60,9001  >  34692 [ACK] Seq=261801079 Ack=14387625 Win=65535 Len=0
1,1.6280079999996815,10.0.2.15,62.210.85.178,TCP,54,35978  >  9001 [ACK] Seq=261879975 Ack=14292595 Win=65535 Len=0
1,1.6452300000000832,62.210.85.178,10.0.2.15,TLSv1.2,590,Application Data
1,1.6453620000002047,10.0.2.15,62.210.85.178,TCP,54,35978  >  9001 [ACK] Seq=261879975 Ack=14293131 Win=65535 Len=0
1,1.7098299999997835,62.210.85.178,10.0.2.15,TLSv1.2,590,Application Data
1,1.7099140000000261,10.0.2.15,62.210.85.178,TCP,54,35978  >  9001 [ACK] Seq=261879975 Ack=14293667 Win=65535 Len=0
1,1.9116370000001552,62.210.85.178,10.0.2.15,TLSv1.2,590,Application Data
1,1.9117349999996804,10.0.2.15,62.210.85.178,TCP,54,35978  >  9001 [ACK] Seq=261879975 Ack=14294203 Win=65535 Len=0
1,1.9120739999998477,10.0.2.15,62.210.85.178,TLSv1.2,590,Application Data
1,1.9124910000000455,62.210.85.178,10.0.2.15,TCP,60,9001  >  35978 [ACK] Seq=14294203 Ack=261880511 Win=65535 Len=0
1,2.0197619999999006,54.93.77.70,10.0.2.15,TLSv1.2,590,Application Data
1,2.0201909999996133,10.0.2.15,54.93.77.70,TLSv1.2,590,Application Data
1,2.020343000000139,54.93.77.70,10.0.2.15,TCP,60,9001  >  34692 [ACK] Seq=261801615 Ack=14388161 Win=65535 Len=0
1,2.159936000000016,62.210.85.178,10.0.2.15,TLSv1.2,590,Application Data
1,2.1650580000004993,10.0.2.15,62.210.85.178,TLSv1.2,590,Application Data
1,2.1651959999999235,62.210.85.178,10.0.2.15,TCP,60,9001  >  35978 [ACK] Seq=14294739 Ack=261881047 Win=65535 Len=0
1,2.1765550000000076,10.0.2.15,62.210.85.178,TLSv1.2,4124,Application Data
1,2.176669000000402,10.0.2.15,62.210.85.178,TCP,2974,35978  >  9001 [ACK] Seq=261885117 Ack=14294739 Win=65535 Len=2920 [TCP segment of a reassembled PDU]
1,2.1767190000000483,62.210.85.178,10.0.2.15,TCP,60,9001  >  35978 [ACK] Seq=14294739 Ack=261882507 Win=65535 Len=0
1,2.1767429999999877,62.210.85.178,10.0.2.15,TCP,60,9001  >  35978 [ACK] Seq=14294739 Ack=261883967 Win=65535 Len=0
1,2.1767479999998613,62.210.85.178,10.0.2.15,TCP,60,9001  >  35978 [ACK] Seq=14294739 Ack=261885117 Win=65535 Len=0
1,2.1767509999999675,62.210.85.178,10.0.2.15,TCP,60,9001  >  35978 [ACK] Seq=14294739 Ack=261886577 Win=65535 Len=0
1,2.1767540000000736,62.210.85.178,10.0.2.15,TCP,60,9001  >  35978 [ACK] Seq=14294739 Ack=261888037 Win=65535 Len=0
1,2.1767900000004374,10.0.2.15,62.210.85.178,TLSv1.2,1204,Application Data
1,2.1768279999996594,62.210.85.178,10.0.2.15,TCP,60,9001  >  35978 [ACK] Seq=14294739 Ack=261889187 Win=65535 Len=0
1,2.1768739999997706,10.0.2.15,62.210.85.178,TLSv1.2,4124,Application Data
1,2.1769130000002406,62.210.85.178,10.0.2.15,TCP,60,9001  >  35978 [ACK] Seq=14294739 Ack=261890647 Win=65535 Len=0
1,2.1769210000002204,62.210.85.178,10.0.2.15,TCP,60,9001  >  35978 [ACK] Seq=14294739 Ack=261892107 Win=65535 Len=0
1,2.176926000000094,62.210.85.178,10.0.2.15,TCP,60,9001  >  35978 [ACK] Seq=14294739 Ack=261893257 Win=65535 Len=0
1,2.1769649999996545,10.0.2.15,62.210.85.178,TLSv1.2,4124,Application Data
1,2.177002000000357,62.210.85.178,10.0.2.15,TCP,60,9001  >  35978 [ACK] Seq=14294739 Ack=261894717 Win=65535 Len=0
1,2.1770109999997658,62.210.85.178,10.0.2.15,TCP,60,9001  >  35978 [ACK] Seq=14294739 Ack=261896177 Win=65535 Len=0
1,2.177074000000175,10.0.2.15,62.210.85.178,TLSv1.2,2974,Application Data
1,2.1771150000004127,62.210.85.178,10.0.2.15,TCP,60,9001  >  35978 [ACK] Seq=14294739 Ack=261897327 Win=65535 Len=0
1,2.177122000000054,62.210.85.178,10.0.2.15,TCP,60,9001  >  35978 [ACK] Seq=14294739 Ack=261898787 Win=65535 Len=0
1,2.17712500000016,62.210.85.178,10.0.2.15,TCP,60,9001  >  35978 [ACK] Seq=14294739 Ack=261900247 Win=65535 Len=0
1,2.1771529999996346,10.0.2.15,62.210.85.178,TLSv1.2,1226,Application Data
1,2.17718799999966,62.210.85.178,10.0.2.15,TCP,60,9001  >  35978 [ACK] Seq=14294739 Ack=261901419 Win=65535 Len=0
1,2.1772280000004685,10.0.2.15,62.210.85.178,TLSv1.2,4124,Application Data
1,2.1772680000003675,62.210.85.178,10.0.2.15,TCP,60,9001  >  35978 [ACK] Seq=14294739 Ack=261902879 Win=65535 Len=0
1,2.1772750000000087,62.210.85.178,10.0.2.15,TCP,60,9001  >  35978 [ACK] Seq=14294739 Ack=261904339 Win=65535 Len=0
1,2.1772790000004534,62.210.85.178,10.0.2.15,TCP,60,9001  >  35978 [ACK] Seq=14294739 Ack=261905489 Win=65535 Len=0
1,2.1773160000002463,10.0.2.15,62.210.85.178,TLSv1.2,3030,Application Data
1,2.1773549999998068,62.210.85.178,10.0.2.15,TCP,60,9001  >  35978 [ACK] Seq=14294739 Ack=261906949 Win=65535 Len=0
1,2.1773629999997866,62.210.85.178,10.0.2.15,TCP,60,9001  >  35978 [ACK] Seq=14294739 Ack=261908409 Win=65535 Len=0
1,2.177367000000231,62.210.85.178,10.0.2.15,TCP,60,9001  >  35978 [ACK] Seq=14294739 Ack=261908465 Win=65535 Len=0
1,2.188788000000386,10.0.2.15,62.210.85.178,TLSv1.2,4124,Application Data
1,2.188842999999906,62.210.85.178,10.0.2.15,TCP,60,9001  >  35978 [ACK] Seq=14294739 Ack=261909925 Win=65535 Len=0
1,2.188853999999992,62.210.85.178,10.0.2.15,TCP,60,9001  >  35978 [ACK] Seq=14294739 Ack=261911385 Win=65535 Len=0
1,2.1888589999998658,62.210.85.178,10.0.2.15,TCP,60,9001  >  35978 [ACK] Seq=14294739 Ack=261912535 Win=65535 Len=0
1,2.188904999999977,10.0.2.15,62.210.85.178,TLSv1.2,4124,Application Data
1,2.188944999999876,62.210.85.178,10.0.2.15,TCP,60,9001  >  35978 [ACK] Seq=14294739 Ack=261913995 Win=65535 Len=0
1,2.1889540000001944,62.210.85.178,10.0.2.15,TCP,60,9001  >  35978 [ACK] Seq=14294739 Ack=261915455 Win=65535 Len=0
1,2.1889579999997295,62.210.85.178,10.0.2.15,TCP,60,9001  >  35978 [ACK] Seq=14294739 Ack=261916605 Win=65535 Len=0
1,2.1889979999996285,10.0.2.15,62.210.85.178,TLSv1.2,4124,Application Data
1,2.18903599999976,62.210.85.178,10.0.2.15,TCP,60,9001  >  35978 [ACK] Seq=14294739 Ack=261918065 Win=65535 Len=0
1,2.1890450000000783,62.210.85.178,10.0.2.15,TCP,60,9001  >  35978 [ACK] Seq=14294739 Ack=261919525 Win=65535 Len=0
1,2.189049999999952,62.210.85.178,10.0.2.15,TCP,60,9001  >  35978 [ACK] Seq=14294739 Ack=261920675 Win=65535 Len=0
1,2.189086999999745,10.0.2.15,62.210.85.178,TLSv1.2,4124,Application Data
1,2.1891240000004473,62.210.85.178,10.0.2.15,TCP,60,9001  >  35978 [ACK] Seq=14294739 Ack=261922135 Win=65535 Len=0
1,2.189132999999856,62.210.85.178,10.0.2.15,TCP,60,9001  >  35978 [ACK] Seq=14294739 Ack=261923595 Win=65535 Len=0
1,2.1891370000003008,62.210.85.178,10.0.2.15,TCP,60,9001  >  35978 [ACK] Seq=14294739 Ack=261924745 Win=65535 Len=0
1,2.189172999999755,10.0.2.15,62.210.85.178,TLSv1.2,332,Application Data
1,2.1892100000004575,62.210.85.178,10.0.2.15,TCP,60,9001  >  35978 [ACK] Seq=14294739 Ack=261925023 Win=65535 Len=0
1,2.1892619999998715,10.0.2.15,62.210.85.178,TLSv1.2,3868,Application Data
1,2.189300000000003,62.210.85.178,10.0.2.15,TCP,60,9001  >  35978 [ACK] Seq=14294739 Ack=261926483 Win=65535 Len=0
1,2.1893090000003212,62.210.85.178,10.0.2.15,TCP,60,9001  >  35978 [ACK] Seq=14294739 Ack=261927943 Win=65535 Len=0
1,2.189314000000195,62.210.85.178,10.0.2.15,TCP,60,9001  >  35978 [ACK] Seq=14294739 Ack=261928837 Win=65535 Len=0
1,2.1893520000003264,10.0.2.15,62.210.85.178,TLSv1.2,4124,Application Data
1,2.189390999999887,62.210.85.178,10.0.2.15,TCP,60,9001  >  35978 [ACK] Seq=14294739 Ack=261930297 Win=65535 Len=0
1,2.1893989999998666,62.210.85.178,10.0.2.15,TCP,60,9001  >  35978 [ACK] Seq=14294739 Ack=261931757 Win=65535 Len=0
1,2.1894030000003113,62.210.85.178,10.0.2.15,TCP,60,9001  >  35978 [ACK] Seq=14294739 Ack=261932907 Win=65535 Len=0
1,2.1894380000003366,10.0.2.15,62.210.85.178,TLSv1.2,2002,Application Data
1,2.189476999999897,62.210.85.178,10.0.2.15,TCP,60,9001  >  35978 [ACK] Seq=14294739 Ack=261934367 Win=65535 Len=0
1,2.1894830000001093,62.210.85.178,10.0.2.15,TCP,60,9001  >  35978 [ACK] Seq=14294739 Ack=261934855 Win=65535 Len=0
1,2.2780119999997623,54.93.77.70,10.0.2.15,TLSv1.2,590,Application Data
1,2.2889210000003004,54.93.77.70,10.0.2.15,TLSv1.2,7294,"Application Data, Application Data"
1,2.2890070000003107,10.0.2.15,54.93.77.70,TCP,54,34692  >  9001 [ACK] Seq=14388161 Ack=261809391 Win=65535 Len=0
1,2.306470999999874,54.93.77.70,10.0.2.15,TLSv1.2,3674,Application Data
1,2.3065169999999853,10.0.2.15,54.93.77.70,TCP,54,34692  >  9001 [ACK] Seq=14388161 Ack=261813011 Win=65535 Len=0
1,2.3066909999997733,10.0.2.15,54.93.77.70,TLSv1.2,590,Application Data
1,2.3067650000002686,54.93.77.70,10.0.2.15,TCP,60,9001  >  34692 [ACK] Seq=261813011 Ack=14388697 Win=65535 Len=0
1,2.316686000000118,54.93.77.70,10.0.2.15,TLSv1.2,5846,Application Data
1,2.316700999999739,54.93.77.70,10.0.2.15,TLSv1.2,4398,Application Data [TCP segment of a reassembled PDU]
1,2.3167590000002747,10.0.2.15,54.93.77.70,TCP,54,34692  >  9001 [ACK] Seq=14388697 Ack=261823147 Win=65535 Len=0
1,2.3169889999999214,54.93.77.70,10.0.2.15,TCP,1502,"9001  >  34692 [PSH, ACK] Seq=261823147 Ack=14388697 Win=65535 Len=1448 [TCP segment of a reassembled PDU]"
1,2.3170259999997143,10.0.2.15,54.93.77.70,TCP,54,34692  >  9001 [ACK] Seq=14388697 Ack=261824595 Win=65535 Len=0
1,2.3224909999999,54.93.77.70,10.0.2.15,TLSv1.2,358,Application Data
1,2.3378309999998237,54.93.77.70,10.0.2.15,TLSv1.2,5846,"Application Data, Application Data"
1,2.3379150000000664,54.93.77.70,10.0.2.15,TCP,1474,9001  >  34692 [ACK] Seq=261830691 Ack=14388697 Win=65535 Len=1420 [TCP segment of a reassembled PDU]
1,2.337988999999652,10.0.2.15,54.93.77.70,TCP,54,34692  >  9001 [ACK] Seq=14388697 Ack=261832111 Win=65535 Len=0
1,2.3380379999998695,54.93.77.70,10.0.2.15,TCP,1530,"9001  >  34692 [PSH, ACK] Seq=261832111 Ack=14388697 Win=65535 Len=1476 [TCP segment of a reassembled PDU]"
1,2.338064999999915,10.0.2.15,54.93.77.70,TCP,54,34692  >  9001 [ACK] Seq=14388697 Ack=261833587 Win=65535 Len=0
1,2.3382840000003853,10.0.2.15,54.93.77.70,TLSv1.2,590,Application Data
1,2.3383569999996325,54.93.77.70,10.0.2.15,TCP,60,9001  >  34692 [ACK] Seq=261833587 Ack=14389233 Win=65535 Len=0
1,2.33948700000019,54.93.77.70,10.0.2.15,TLSv1.2,170,Application Data
1,2.355526999999711,54.93.77.70,10.0.2.15,TCP,2950,"9001  >  34692 [PSH, ACK] Seq=261833703 Ack=14389233 Win=65535 Len=2896 [TCP segment of a reassembled PDU]"
1,2.3555740000001606,10.0.2.15,54.93.77.70,TCP,54,34692  >  9001 [ACK] Seq=14389233 Ack=261836599 Win=65535 Len=0
1,2.3564440000000104,54.93.77.70,10.0.2.15,TLSv1.2,7294,"Application Data, Application Data"
1,2.3565330000001268,10.0.2.15,54.93.77.70,TCP,54,34692  >  9001 [ACK] Seq=14389233 Ack=261843839 Win=65535 Len=0
1,2.3672139999998763,54.93.77.70,10.0.2.15,TLSv1.2,5846,"Application Data, Application Data"
1,2.3672599999999875,10.0.2.15,54.93.77.70,TCP,54,34692  >  9001 [ACK] Seq=14389233 Ack=261849631 Win=65535 Len=0
1,2.3673539999999775,54.93.77.70,10.0.2.15,TCP,2950,"9001  >  34692 [PSH, ACK] Seq=261849631 Ack=14389233 Win=65535 Len=2896 [TCP segment of a reassembled PDU]"
1,2.367409999999836,10.0.2.15,54.93.77.70,TCP,54,34692  >  9001 [ACK] Seq=14389233 Ack=261852527 Win=65535 Len=0
1,2.3751549999997223,54.93.77.70,10.0.2.15,TLSv1.2,358,Application Data
1,2.399510000000191,54.93.77.70,10.0.2.15,TLSv1.2,2950,Application Data
1,2.399728999999752,10.0.2.15,54.93.77.70,TCP,54,34692  >  9001 [ACK] Seq=14389233 Ack=261855727 Win=65535 Len=0
1,2.4001340000004348,10.0.2.15,54.93.77.70,TLSv1.2,590,Application Data
1,2.4004249999998137,54.93.77.70,10.0.2.15,TCP,60,9001  >  34692 [ACK] Seq=261855727 Ack=14389769 Win=65535 Len=0
1,2.416704999999638,54.93.77.70,10.0.2.15,TLSv1.2,286,Application Data
1,2.4167420000003403,62.210.85.178,10.0.2.15,TLSv1.2,590,Application Data
1,2.4194280000001527,10.0.2.15,54.93.77.70,TLSv1.2,590,Application Data
1,2.4195840000002136,54.93.77.70,10.0.2.15,TCP,60,9001  >  34692 [ACK] Seq=261855959 Ack=14390305 Win=65535 Len=0
1,2.460055999999895,10.0.2.15,62.210.85.178,TCP,54,35978  >  9001 [ACK] Seq=261934855 Ack=14295275 Win=65535 Len=0
1,2.6281989999997677,62.210.85.178,10.0.2.15,TLSv1.2,590,Application Data
1,2.628273000000263,10.0.2.15,62.210.85.178,TCP,54,35978  >  9001 [ACK] Seq=261934855 Ack=14295811 Win=65535 Len=0
1,2.647132000000056,62.210.85.178,10.0.2.15,TLSv1.2,1104,Application Data
1,2.6471780000001672,10.0.2.15,62.210.85.178,TCP,54,35978  >  9001 [ACK] Seq=261934855 Ack=14296861 Win=65535 Len=0
1,2.6476290000000517,10.0.2.15,62.210.85.178,TLSv1.2,590,Application Data
1,2.6477199999999357,62.210.85.178,10.0.2.15,TCP,60,9001  >  35978 [ACK] Seq=14296861 Ack=261935391 Win=65535 Len=0
1,3.0389020000002347,54.93.77.70,10.0.2.15,TLSv1.2,590,Application Data
1,3.039278999999624,10.0.2.15,54.93.77.70,TLSv1.2,590,Application Data
1,3.039394999999786,54.93.77.70,10.0.2.15,TCP,60,9001  >  34692 [ACK] Seq=261856495 Ack=14390841 Win=65535 Len=0
1,3.1597780000001876,62.210.85.178,10.0.2.15,TLSv1.2,590,Application Data
1,3.1643110000004526,10.0.2.15,62.210.85.178,TLSv1.2,590,Application Data
1,3.1644539999997505,62.210.85.178,10.0.2.15,TCP,60,9001  >  35978 [ACK] Seq=14297397 Ack=261935927 Win=65535 Len=0
1,3.17699999999968,10.0.2.15,62.210.85.178,TLSv1.2,4124,Application Data
1,3.1771179999996093,10.0.2.15,62.210.85.178,TCP,2974,35978  >  9001 [ACK] Seq=261939997 Ack=14297397 Win=65535 Len=2920 [TCP segment of a reassembled PDU]
1,3.177176000000145,62.210.85.178,10.0.2.15,TCP,60,9001  >  35978 [ACK] Seq=14297397 Ack=261937387 Win=65535 Len=0
1,3.17718799999966,62.210.85.178,10.0.2.15,TCP,60,9001  >  35978 [ACK] Seq=14297397 Ack=261938847 Win=65535 Len=0
1,3.1771920000001046,62.210.85.178,10.0.2.15,TCP,60,9001  >  35978 [ACK] Seq=14297397 Ack=261939997 Win=65535 Len=0
1,3.1771959999996398,62.210.85.178,10.0.2.15,TCP,60,9001  >  35978 [ACK] Seq=14297397 Ack=261941457 Win=65535 Len=0
1,3.177201000000423,62.210.85.178,10.0.2.15,TCP,60,9001  >  35978 [ACK] Seq=14297397 Ack=261942917 Win=65535 Len=0
1,3.177244999999857,10.0.2.15,62.210.85.178,TLSv1.2,1204,Application Data
1,3.1773140000004787,10.0.2.15,62.210.85.178,TCP,2974,35978  >  9001 [ACK] Seq=261944067 Ack=14297397 Win=65535 Len=2920 [TCP segment of a reassembled PDU]
1,3.1773519999997006,62.210.85.178,10.0.2.15,TCP,60,9001  >  35978 [ACK] Seq=14297397 Ack=261944067 Win=65535 Len=0
1,3.1773590000002514,62.210.85.178,10.0.2.15,TCP,60,9001  >  35978 [ACK] Seq=14297397 Ack=261945527 Win=65535 Len=0
1,3.1773629999997866,62.210.85.178,10.0.2.15,TCP,60,9001  >  35978 [ACK] Seq=14297397 Ack=261946987 Win=65535 Len=0
1,3.177397999999812,10.0.2.15,62.210.85.178,TLSv1.2,1204,Application Data
1,3.177462999999989,10.0.2.15,62.210.85.178,TCP,2974,35978  >  9001 [ACK] Seq=261948137 Ack=14297397 Win=65535 Len=2920 [TCP segment of a reassembled PDU]
1,3.1774990000003527,62.210.85.178,10.0.2.15,TCP,60,9001  >  35978 [ACK] Seq=14297397 Ack=261948137 Win=65535 Len=0
1,3.177505999999994,62.210.85.178,10.0.2.15,TCP,60,9001  >  35978 [ACK] Seq=14297397 Ack=261949597 Win=65535 Len=0
1,3.1775100000004386,62.210.85.178,10.0.2.15,TCP,60,9001  >  35978 [ACK] Seq=14297397 Ack=261951057 Win=65535 Len=0
1,3.1775410000000193,10.0.2.15,62.210.85.178,TLSv1.2,1204,Application Data
1,3.177625999999691,10.0.2.15,62.210.85.178,TLSv1.2,2974,Application Data
1,3.177665000000161,62.210.85.178,10.0.2.15,TCP,60,9001  >  35978 [ACK] Seq=14297397 Ack=261952207 Win=65535 Len=0
1,3.177671999999802,62.210.85.178,10.0.2.15,TCP,60,9001  >  35978 [ACK] Seq=14297397 Ack=261953667 Win=65535 Len=0
1,3.177676000000247,62.210.85.178,10.0.2.15,TCP,60,9001  >  35978 [ACK] Seq=14297397 Ack=261955127 Win=65535 Len=0
1,3.177708000000166,10.0.2.15,62.210.85.178,TLSv1.2,1226,Application Data
1,3.1777689999998984,10.0.2.15,62.210.85.178,TCP,2974,35978  >  9001 [ACK] Seq=261956299 Ack=14297397 Win=65535 Len=2920 [TCP segment of a reassembled PDU]
1,3.1778059999996913,62.210.85.178,10.0.2.15,TCP,60,9001  >  35978 [ACK] Seq=14297397 Ack=261956299 Win=65535 Len=0
1,3.1778119999999035,62.210.85.178,10.0.2.15,TCP,60,9001  >  35978 [ACK] Seq=14297397 Ack=261957759 Win=65535 Len=0
1,3.177816999999777,62.210.85.178,10.0.2.15,TCP,60,9001  >  35978 [ACK] Seq=14297397 Ack=261959219 Win=65535 Len=0
1,3.1778480000002673,10.0.2.15,62.210.85.178,TLSv1.2,1204,Application Data
1,3.1778839999997217,62.210.85.178,10.0.2.15,TCP,60,9001  >  35978 [ACK] Seq=14297397 Ack=261960369 Win=65535 Len=0
1,3.177926999999727,10.0.2.15,62.210.85.178,TLSv1.2,3030,Application Data
1,3.177966000000197,62.210.85.178,10.0.2.15,TCP,60,9001  >  35978 [ACK] Seq=14297397 Ack=261961829 Win=65535 Len=0
1,3.177972999999838,62.210.85.178,10.0.2.15,TCP,60,9001  >  35978 [ACK] Seq=14297397 Ack=261963289 Win=65535 Len=0
1,3.1779770000002827,62.210.85.178,10.0.2.15,TCP,60,9001  >  35978 [ACK] Seq=14297397 Ack=261963345 Win=65535 Len=0
1,3.187198999999964,10.0.2.15,62.210.85.178,TLSv1.2,4124,Application Data
1,3.1872590000002674,62.210.85.178,10.0.2.15,TCP,60,9001  >  35978 [ACK] Seq=14297397 Ack=261964805 Win=65535 Len=0
1,3.1872709999997824,62.210.85.178,10.0.2.15,TCP,60,9001  >  35978 [ACK] Seq=14297397 Ack=261966265 Win=65535 Len=0
1,3.187275999999656,62.210.85.178,10.0.2.15,TCP,60,9001  >  35978 [ACK] Seq=14297397 Ack=261967415 Win=65535 Len=0
1,3.1873219999997673,10.0.2.15,62.210.85.178,TLSv1.2,4124,Application Data
1,3.1873649999997724,62.210.85.178,10.0.2.15,TCP,60,9001  >  35978 [ACK] Seq=14297397 Ack=261968875 Win=65535 Len=0
1,3.1873740000000907,62.210.85.178,10.0.2.15,TCP,60,9001  >  35978 [ACK] Seq=14297397 Ack=261970335 Win=65535 Len=0
1,3.1873789999999644,62.210.85.178,10.0.2.15,TCP,60,9001  >  35978 [ACK] Seq=14297397 Ack=261971485 Win=65535 Len=0
1,3.1874180000004344,10.0.2.15,62.210.85.178,TLSv1.2,4124,Application Data
1,3.1874559999996563,62.210.85.178,10.0.2.15,TCP,60,9001  >  35978 [ACK] Seq=14297397 Ack=261972945 Win=65535 Len=0
1,3.1874649999999747,62.210.85.178,10.0.2.15,TCP,60,9001  >  35978 [ACK] Seq=14297397 Ack=261974405 Win=65535 Len=0
1,3.1874690000004193,62.210.85.178,10.0.2.15,TCP,60,9001  >  35978 [ACK] Seq=14297397 Ack=261975555 Win=65535 Len=0
1,3.1875060000002122,10.0.2.15,62.210.85.178,TLSv1.2,2838,Application Data
1,3.1875440000003437,62.210.85.178,10.0.2.15,TCP,60,9001  >  35978 [ACK] Seq=14297397 Ack=261977015 Win=65535 Len=0
1,3.187550999999985,62.210.85.178,10.0.2.15,TCP,60,9001  >  35978 [ACK] Seq=14297397 Ack=261978339 Win=65535 Len=0
1,3.282742999999755,54.93.77.70,10.0.2.15,TLSv1.2,3674,Application Data
1,3.2828870000003008,10.0.2.15,54.93.77.70,TCP,54,34692  >  9001 [ACK] Seq=14390841 Ack=261860115 Win=65535 Len=0
1,3.3097109999998793,54.93.77.70,10.0.2.15,TLSv1.2,7294,Application Data
1,3.309741000000031,54.93.77.70,10.0.2.15,TLSv1.2,5238,"Application Data, Application Data, Application Data"
1,3.3098250000002736,10.0.2.15,54.93.77.70,TCP,54,34692  >  9001 [ACK] Seq=14390841 Ack=261872539 Win=65535 Len=0
1,3.3100530000001527,10.0.2.15,54.93.77.70,TLSv1.2,590,Application Data
1,3.3101260000003094,54.93.77.70,10.0.2.15,TCP,60,9001  >  34692 [ACK] Seq=261872539 Ack=14391377 Win=65535 Len=0
1,3.3205710000002,54.93.77.70,10.0.2.15,TCP,1502,"9001  >  34692 [PSH, ACK] Seq=261872539 Ack=14391377 Win=65535 Len=1448 [TCP segment of a reassembled PDU]"
1,3.3206200000004173,10.0.2.15,54.93.77.70,TCP,54,34692  >  9001 [ACK] Seq=14391377 Ack=261873987 Win=65535 Len=0
1,3.326387000000068,54.93.77.70,10.0.2.15,TLSv1.2,2226,Application Data
1,3.326433000000179,10.0.2.15,54.93.77.70,TCP,54,34692  >  9001 [ACK] Seq=14391377 Ack=261876159 Win=65535 Len=0
1,3.3284810000004654,54.93.77.70,10.0.2.15,TLSv1.2,7294,Application Data
1,3.32854800000041,10.0.2.15,54.93.77.70,TCP,54,34692  >  9001 [ACK] Seq=14391377 Ack=261883399 Win=65535 Len=0
1,3.328980999999658,54.93.77.70,10.0.2.15,TLSv1.2,2950,Application Data [TCP segment of a reassembled PDU]
1,3.3290200000001278,10.0.2.15,54.93.77.70,TCP,54,34692  >  9001 [ACK] Seq=14391377 Ack=261886295 Win=65535 Len=0
1,3.329171000000315,10.0.2.15,54.93.77.70,TLSv1.2,590,Application Data
1,3.329236000000492,54.93.77.70,10.0.2.15,TCP,60,9001  >  34692 [ACK] Seq=261886295 Ack=14391913 Win=65535 Len=0
1,3.341301000000385,54.93.77.70,10.0.2.15,TLSv1.2,1502,Application Data [TCP segment of a reassembled PDU]
1,3.341341999999713,10.0.2.15,54.93.77.70,TCP,54,34692  >  9001 [ACK] Seq=14391913 Ack=261887743 Win=65535 Len=0
1,3.3424009999998816,54.93.77.70,10.0.2.15,TLSv1.2,894,Application Data
1,3.351599999999962,54.93.77.70,10.0.2.15,TCP,2950,"9001  >  34692 [PSH, ACK] Seq=261888583 Ack=14391913 Win=65535 Len=2896 [TCP segment of a reassembled PDU]"
1,3.351665000000139,10.0.2.15,54.93.77.70,TCP,54,34692  >  9001 [ACK] Seq=14391913 Ack=261891479 Win=65535 Len=0
1,3.3521630000004734,54.93.77.70,10.0.2.15,TLSv1.2,4398,Application Data [TCP segment of a reassembled PDU]
1,3.3522009999996953,10.0.2.15,54.93.77.70,TCP,54,34692  >  9001 [ACK] Seq=14391913 Ack=261895823 Win=65535 Len=0
1,3.358473000000231,54.93.77.70,10.0.2.15,TLSv1.2,568,Application Data
1,3.367030000000341,54.93.77.70,10.0.2.15,TCP,2950,"9001  >  34692 [PSH, ACK] Seq=261896337 Ack=14391913 Win=65535 Len=2896 [TCP segment of a reassembled PDU]"
1,3.367073999999775,10.0.2.15,54.93.77.70,TCP,54,34692  >  9001 [ACK] Seq=14391913 Ack=261899233 Win=65535 Len=0
1,3.3830479999996896,54.93.77.70,10.0.2.15,TLSv1.2,264,Application Data
1,3.389965000000302,10.0.2.15,54.93.77.70,TLSv1.2,590,Application Data
1,3.3901260000002367,54.93.77.70,10.0.2.15,TCP,60,9001  >  34692 [ACK] Seq=261899443 Ack=14392449 Win=65535 Len=0
1,3.396571000000222,62.210.85.178,10.0.2.15,TLSv1.2,590,Application Data
1,3.441627000000153,10.0.2.15,62.210.85.178,TCP,54,35978  >  9001 [ACK] Seq=261978339 Ack=14297933 Win=65535 Len=0
1,3.455866999999671,62.210.85.178,10.0.2.15,TLSv1.2,590,Application Data
1,3.4559440000002724,10.0.2.15,62.210.85.178,TCP,54,35978  >  9001 [ACK] Seq=261978339 Ack=14298469 Win=65535 Len=0
1,3.6525140000003375,62.210.85.178,10.0.2.15,TLSv1.2,590,Application Data
1,3.6526059999996505,10.0.2.15,62.210.85.178,TCP,54,35978  >  9001 [ACK] Seq=261978339 Ack=14299005 Win=65535 Len=0
1,3.653059999999641,10.0.2.15,62.210.85.178,TLSv1.2,590,Application Data
1,3.6531599999998434,62.210.85.178,10.0.2.15,TCP,60,9001  >  35978 [ACK] Seq=14299005 Ack=261978875 Win=65535 Len=0
1,3.858169000000089,54.93.77.70,10.0.2.15,TLSv1.2,590,Application Data
1,3.8585439999997106,10.0.2.15,54.93.77.70,TLSv1.2,590,Application Data
1,3.858661000000211,54.93.77.70,10.0.2.15,TCP,60,9001  >  34692 [ACK] Seq=261899979 Ack=14392985 Win=65535 Len=0
1,4.062230000000454,62.210.85.178,10.0.2.15,TLSv1.2,590,Application Data
1,4.070533000000069,10.0.2.15,62.210.85.178,TLSv1.2,590,Application Data
1,4.070713000000069,62.210.85.178,10.0.2.15,TCP,60,9001  >  35978 [ACK] Seq=14299541 Ack=261979411 Win=65535 Len=0
1,4.084558999999899,10.0.2.15,62.210.85.178,TLSv1.2,4124,Application Data
1,4.0846849999998085,10.0.2.15,62.210.85.178,TCP,2974,35978  >  9001 [ACK] Seq=261983481 Ack=14299541 Win=65535 Len=2920 [TCP segment of a reassembled PDU]
1,4.084730000000491,62.210.85.178,10.0.2.15,TCP,60,9001  >  35978 [ACK] Seq=14299541 Ack=261980871 Win=65535 Len=0
1,4.084740999999667,62.210.85.178,10.0.2.15,TCP,60,9001  >  35978 [ACK] Seq=14299541 Ack=261982331 Win=65535 Len=0
1,4.08474600000045,62.210.85.178,10.0.2.15,TCP,60,9001  >  35978 [ACK] Seq=14299541 Ack=261983481 Win=65535 Len=0
1,4.0847499999999854,62.210.85.178,10.0.2.15,TCP,60,9001  >  35978 [ACK] Seq=14299541 Ack=261984941 Win=65535 Len=0
1,4.08475400000043,62.210.85.178,10.0.2.15,TCP,60,9001  >  35978 [ACK] Seq=14299541 Ack=261986401 Win=65535 Len=0
1,4.084799000000203,10.0.2.15,62.210.85.178,TLSv1.2,1204,Application Data
1,4.084872999999789,10.0.2.15,62.210.85.178,TCP,2974,35978  >  9001 [ACK] Seq=261987551 Ack=14299541 Win=65535 Len=2920 [TCP segment of a reassembled PDU]
1,4.084912999999688,62.210.85.178,10.0.2.15,TCP,60,9001  >  35978 [ACK] Seq=14299541 Ack=261987551 Win=65535 Len=0
1,4.084920000000238,62.210.85.178,10.0.2.15,TCP,60,9001  >  35978 [ACK] Seq=14299541 Ack=261989011 Win=65535 Len=0
1,4.0849239999997735,62.210.85.178,10.0.2.15,TCP,60,9001  >  35978 [ACK] Seq=14299541 Ack=261990471 Win=65535 Len=0
1,4.084958999999799,10.0.2.15,62.210.85.178,TLSv1.2,1204,Application Data
1,4.085023999999976,10.0.2.15,62.210.85.178,TCP,2974,35978  >  9001 [ACK] Seq=261991621 Ack=14299541 Win=65535 Len=2920 [TCP segment of a reassembled PDU]
1,4.085059000000001,62.210.85.178,10.0.2.15,TCP,60,9001  >  35978 [ACK] Seq=14299541 Ack=261991621 Win=65535 Len=0
1,4.085065000000213,62.210.85.178,10.0.2.15,TCP,60,9001  >  35978 [ACK] Seq=14299541 Ack=261993081 Win=65535 Len=0
1,4.085070000000087,62.210.85.178,10.0.2.15,TCP,60,9001  >  35978 [ACK] Seq=14299541 Ack=261994541 Win=65535 Len=0
1,4.085100999999668,10.0.2.15,62.210.85.178,TLSv1.2,1204,Application Data
1,4.085181000000375,10.0.2.15,62.210.85.178,TLSv1.2,2974,Application Data
1,4.085219000000507,62.210.85.178,10.0.2.15,TCP,60,9001  >  35978 [ACK] Seq=14299541 Ack=261995691 Win=65535 Len=0
1,4.085226000000148,62.210.85.178,10.0.2.15,TCP,60,9001  >  35978 [ACK] Seq=14299541 Ack=261997151 Win=65535 Len=0
1,4.085229999999683,62.210.85.178,10.0.2.15,TCP,60,9001  >  35978 [ACK] Seq=14299541 Ack=261998611 Win=65535 Len=0
1,4.085261000000173,10.0.2.15,62.210.85.178,TLSv1.2,1226,Application Data
1,4.085323000000244,10.0.2.15,62.210.85.178,TCP,2974,35978  >  9001 [ACK] Seq=261999783 Ack=14299541 Win=65535 Len=2920 [TCP segment of a reassembled PDU]
1,4.085358000000269,62.210.85.178,10.0.2.15,TCP,60,9001  >  35978 [ACK] Seq=14299541 Ack=261999783 Win=65535 Len=0
1,4.085364999999911,62.210.85.178,10.0.2.15,TCP,60,9001  >  35978 [ACK] Seq=14299541 Ack=262001243 Win=65535 Len=0
1,4.085369000000355,62.210.85.178,10.0.2.15,TCP,60,9001  >  35978 [ACK] Seq=14299541 Ack=262002703 Win=65535 Len=0
1,4.0854010000002745,10.0.2.15,62.210.85.178,TLSv1.2,1204,Application Data
1,4.085436999999729,62.210.85.178,10.0.2.15,TCP,60,9001  >  35978 [ACK] Seq=14299541 Ack=262003853 Win=65535 Len=0
