No.,Time,Source,Destination,Protocol,Length,Info
1,0.016085000000202854,10.0.2.15,62.210.85.178,TCP,54,35978  >  9001 [ACK] Seq=259884815 Ack=14192575 Win=65535 Len=0
1,0.13204600000062783,10.0.2.15,54.93.77.70,TLSv1.2,590,Application Data
1,0.13222399999995105,54.93.77.70,10.0.2.15,TCP,60,9001  >  34692 [ACK] Seq=259805237 Ack=14286159 Win=65535 Len=0
1,0.2502490000006219,62.210.85.178,10.0.2.15,TLSv1.2,590,Application Data
1,0.250437000000602,10.0.2.15,62.210.85.178,TCP,54,35978  >  9001 [ACK] Seq=259884815 Ack=14193111 Win=65535 Len=0
1,0.2516620000005787,10.0.2.15,62.210.85.178,TLSv1.2,590,Application Data
1,0.25201300000026094,62.210.85.178,10.0.2.15,TCP,60,9001  >  35978 [ACK] Seq=14193111 Ack=259885351 Win=65535 Len=0
1,0.48129400000016176,54.93.77.70,10.0.2.15,TLSv1.2,590,Application Data
1,0.48172599999998056,10.0.2.15,54.93.77.70,TLSv1.2,1618,Application Data
1,0.48184800000035466,54.93.77.70,10.0.2.15,TCP,60,9001  >  34692 [ACK] Seq=259805773 Ack=14287723 Win=65535 Len=0
1,0.6859760000006645,62.210.85.178,10.0.2.15,TLSv1.2,1618,Application Data
1,0.6861320000007254,10.0.2.15,62.210.85.178,TCP,54,35978  >  9001 [ACK] Seq=259885351 Ack=14194675 Win=65535 Len=0
1,0.7119450000000143,10.0.2.15,62.210.85.178,TLSv1.2,590,Application Data
1,0.7120880000002217,62.210.85.178,10.0.2.15,TCP,60,9001  >  35978 [ACK] Seq=14194675 Ack=259885887 Win=65535 Len=0
1,0.7226160000000164,10.0.2.15,62.210.85.178,TLSv1.2,1618,Application Data
1,0.7227470000007088,62.210.85.178,10.0.2.15,TCP,60,9001  >  35978 [ACK] Seq=14194675 Ack=259887347 Win=65535 Len=0
1,0.7227689999999711,62.210.85.178,10.0.2.15,TCP,60,9001  >  35978 [ACK] Seq=14194675 Ack=259887451 Win=65535 Len=0
1,1.0958989999999176,54.93.77.70,10.0.2.15,TLSv1.2,590,Application Data
1,1.1001270000006116,54.93.77.70,10.0.2.15,TLSv1.2,1618,Application Data
1,1.1001990000004298,10.0.2.15,54.93.77.70,TCP,54,34692  >  9001 [ACK] Seq=14287723 Ack=259807873 Win=65535 Len=0
1,1.1022659999998723,10.0.2.15,54.93.77.70,TLSv1.2,590,Application Data
1,1.102407000000312,54.93.77.70,10.0.2.15,TCP,60,9001  >  34692 [ACK] Seq=259807873 Ack=14288259 Win=65535 Len=0
1,1.2164360000006127,62.210.85.178,10.0.2.15,TLSv1.2,590,Application Data
1,1.2167340000005424,10.0.2.15,62.210.85.178,TLSv1.2,590,Application Data
1,1.2168430000001536,62.210.85.178,10.0.2.15,TCP,60,9001  >  35978 [ACK] Seq=14195211 Ack=259887987 Win=65535 Len=0
1,1.3187880000004952,54.93.77.70,10.0.2.15,TLSv1.2,590,Application Data
1,1.3191430000006221,10.0.2.15,54.93.77.70,TLSv1.2,590,Application Data
1,1.3192610000005516,54.93.77.70,10.0.2.15,TCP,60,9001  >  34692 [ACK] Seq=259808409 Ack=14288795 Win=65535 Len=0
1,1.5051360000006753,62.210.85.178,10.0.2.15,TLSv1.2,590,Application Data
1,1.510431000000608,10.0.2.15,62.210.85.178,TLSv1.2,590,Application Data
1,1.5105810000004567,62.210.85.178,10.0.2.15,TCP,60,9001  >  35978 [ACK] Seq=14195747 Ack=259888523 Win=65535 Len=0
1,1.5230380000002697,10.0.2.15,62.210.85.178,TLSv1.2,4124,Application Data
1,1.5231330000005983,10.0.2.15,62.210.85.178,TCP,2974,35978  >  9001 [ACK] Seq=259892593 Ack=14195747 Win=65535 Len=2920 [TCP segment of a reassembled PDU]
1,1.5231750000002648,62.210.85.178,10.0.2.15,TCP,60,9001  >  35978 [ACK] Seq=14195747 Ack=259889983 Win=65535 Len=0
1,1.5231870000006893,62.210.85.178,10.0.2.15,TCP,60,9001  >  35978 [ACK] Seq=14195747 Ack=259891443 Win=65535 Len=0
1,1.523189999999886,62.210.85.178,10.0.2.15,TCP,60,9001  >  35978 [ACK] Seq=14195747 Ack=259892593 Win=65535 Len=0
1,1.523192999999992,62.210.85.178,10.0.2.15,TCP,60,9001  >  35978 [ACK] Seq=14195747 Ack=259894053 Win=65535 Len=0
1,1.5231960000000981,62.210.85.178,10.0.2.15,TCP,60,9001  >  35978 [ACK] Seq=14195747 Ack=259895513 Win=65535 Len=0
1,1.5232370000003357,10.0.2.15,62.210.85.178,TLSv1.2,1204,Application Data
1,1.5232710000000225,62.210.85.178,10.0.2.15,TCP,60,9001  >  35978 [ACK] Seq=14195747 Ack=259896663 Win=65535 Len=0
1,1.5233160000007047,10.0.2.15,62.210.85.178,TLSv1.2,4124,Application Data
1,1.5233500000003914,62.210.85.178,10.0.2.15,TCP,60,9001  >  35978 [ACK] Seq=14195747 Ack=259898123 Win=65535 Len=0
1,1.5233580000003712,62.210.85.178,10.0.2.15,TCP,60,9001  >  35978 [ACK] Seq=14195747 Ack=259899583 Win=65535 Len=0
1,1.5233619999999064,62.210.85.178,10.0.2.15,TCP,60,9001  >  35978 [ACK] Seq=14195747 Ack=259900733 Win=65535 Len=0
1,1.5234010000003764,10.0.2.15,62.210.85.178,TLSv1.2,4124,Application Data
1,1.5234340000006341,62.210.85.178,10.0.2.15,TCP,60,9001  >  35978 [ACK] Seq=14195747 Ack=259902193 Win=65535 Len=0
1,1.5234410000002754,62.210.85.178,10.0.2.15,TCP,60,9001  >  35978 [ACK] Seq=14195747 Ack=259903653 Win=65535 Len=0
1,1.5234980000004725,10.0.2.15,62.210.85.178,TLSv1.2,2974,Application Data
1,1.523533999999927,62.210.85.178,10.0.2.15,TCP,60,9001  >  35978 [ACK] Seq=14195747 Ack=259904803 Win=65535 Len=0
1,1.5235410000004777,62.210.85.178,10.0.2.15,TCP,60,9001  >  35978 [ACK] Seq=14195747 Ack=259906263 Win=65535 Len=0
1,1.5235440000005838,62.210.85.178,10.0.2.15,TCP,60,9001  >  35978 [ACK] Seq=14195747 Ack=259907723 Win=65535 Len=0
1,1.5235710000006293,10.0.2.15,62.210.85.178,TLSv1.2,1226,Application Data
1,1.5236039999999775,62.210.85.178,10.0.2.15,TCP,60,9001  >  35978 [ACK] Seq=14195747 Ack=259908895 Win=65535 Len=0
1,1.523645000000215,10.0.2.15,62.210.85.178,TLSv1.2,4124,Application Data
1,1.5236800000002404,62.210.85.178,10.0.2.15,TCP,60,9001  >  35978 [ACK] Seq=14195747 Ack=259910355 Win=65535 Len=0
1,1.5236860000004526,62.210.85.178,10.0.2.15,TCP,60,9001  >  35978 [ACK] Seq=14195747 Ack=259911815 Win=65535 Len=0
1,1.5236890000005587,62.210.85.178,10.0.2.15,TCP,60,9001  >  35978 [ACK] Seq=14195747 Ack=259912965 Win=65535 Len=0
1,1.523725000000013,10.0.2.15,62.210.85.178,TLSv1.2,3030,Application Data
1,1.5237590000006094,62.210.85.178,10.0.2.15,TCP,60,9001  >  35978 [ACK] Seq=14195747 Ack=259914425 Win=65535 Len=0
1,1.5237660000002506,62.210.85.178,10.0.2.15,TCP,60,9001  >  35978 [ACK] Seq=14195747 Ack=259915885 Win=65535 Len=0
1,1.5237690000003568,62.210.85.178,10.0.2.15,TCP,60,9001  >  35978 [ACK] Seq=14195747 Ack=259915941 Win=65535 Len=0
1,1.5351670000000013,10.0.2.15,62.210.85.178,TLSv1.2,4124,Application Data
1,1.5352520000005825,62.210.85.178,10.0.2.15,TCP,60,9001  >  35978 [ACK] Seq=14195747 Ack=259917401 Win=65535 Len=0
1,1.5352609999999913,62.210.85.178,10.0.2.15,TCP,60,9001  >  35978 [ACK] Seq=14195747 Ack=259918861 Win=65535 Len=0
1,1.535265000000436,62.210.85.178,10.0.2.15,TCP,60,9001  >  35978 [ACK] Seq=14195747 Ack=259920011 Win=65535 Len=0
1,1.5353030000005674,10.0.2.15,62.210.85.178,TLSv1.2,4124,Application Data
1,1.535359000000426,62.210.85.178,10.0.2.15,TCP,60,9001  >  35978 [ACK] Seq=14195747 Ack=259921471 Win=65535 Len=0
1,1.5353670000004058,62.210.85.178,10.0.2.15,TCP,60,9001  >  35978 [ACK] Seq=14195747 Ack=259922931 Win=65535 Len=0
1,1.535370000000512,62.210.85.178,10.0.2.15,TCP,60,9001  >  35978 [ACK] Seq=14195747 Ack=259924081 Win=65535 Len=0
1,1.5354059999999663,10.0.2.15,62.210.85.178,TLSv1.2,4124,Application Data
1,1.5354470000002038,62.210.85.178,10.0.2.15,TCP,60,9001  >  35978 [ACK] Seq=14195747 Ack=259925541 Win=65535 Len=0
1,1.535453999999845,62.210.85.178,10.0.2.15,TCP,60,9001  >  35978 [ACK] Seq=14195747 Ack=259927001 Win=65535 Len=0
1,1.5354569999999512,62.210.85.178,10.0.2.15,TCP,60,9001  >  35978 [ACK] Seq=14195747 Ack=259928151 Win=65535 Len=0
1,1.535493000000315,10.0.2.15,62.210.85.178,TLSv1.2,4124,Application Data
1,1.5355260000005728,62.210.85.178,10.0.2.15,TCP,60,9001  >  35978 [ACK] Seq=14195747 Ack=259929611 Win=65535 Len=0
1,1.535533000000214,62.210.85.178,10.0.2.15,TCP,60,9001  >  35978 [ACK] Seq=14195747 Ack=259931071 Win=65535 Len=0
1,1.5355380000000878,62.210.85.178,10.0.2.15,TCP,60,9001  >  35978 [ACK] Seq=14195747 Ack=259932221 Win=65535 Len=0
1,1.535572000000684,10.0.2.15,62.210.85.178,TLSv1.2,332,Application Data
1,1.5356060000003708,62.210.85.178,10.0.2.15,TCP,60,9001  >  35978 [ACK] Seq=14195747 Ack=259932499 Win=65535 Len=0
1,1.5356560000000172,10.0.2.15,62.210.85.178,TLSv1.2,3868,Application Data
1,1.5357739999999467,62.210.85.178,10.0.2.15,TCP,60,9001  >  35978 [ACK] Seq=14195747 Ack=259933959 Win=65535 Len=0
1,1.5357850000000326,62.210.85.178,10.0.2.15,TCP,60,9001  >  35978 [ACK] Seq=14195747 Ack=259935419 Win=65535 Len=0
1,1.5357880000001387,62.210.85.178,10.0.2.15,TCP,60,9001  >  35978 [ACK] Seq=14195747 Ack=259936313 Win=65535 Len=0
1,1.5358420000002297,10.0.2.15,62.210.85.178,TLSv1.2,4124,Application Data
1,1.5359070000004067,62.210.85.178,10.0.2.15,TCP,60,9001  >  35978 [ACK] Seq=14195747 Ack=259937773 Win=65535 Len=0
1,1.535916000000725,62.210.85.178,10.0.2.15,TCP,60,9001  >  35978 [ACK] Seq=14195747 Ack=259939233 Win=65535 Len=0
1,1.5359189999999217,62.210.85.178,10.0.2.15,TCP,60,9001  >  35978 [ACK] Seq=14195747 Ack=259940383 Win=65535 Len=0
1,1.5359480000006442,10.0.2.15,62.210.85.178,TLSv1.2,3030,Application Data
1,1.5359840000000986,62.210.85.178,10.0.2.15,TCP,60,9001  >  35978 [ACK] Seq=14195747 Ack=259941843 Win=65535 Len=0
1,1.5359920000000784,62.210.85.178,10.0.2.15,TCP,60,9001  >  35978 [ACK] Seq=14195747 Ack=259943303 Win=65535 Len=0
1,1.535996999999952,62.210.85.178,10.0.2.15,TCP,60,9001  >  35978 [ACK] Seq=14195747 Ack=259943359 Win=65535 Len=0
1,1.5451610000000073,10.0.2.15,62.210.85.178,TLSv1.2,2132,Application Data
1,1.5452150000000984,62.210.85.178,10.0.2.15,TCP,60,9001  >  35978 [ACK] Seq=14195747 Ack=259944819 Win=65535 Len=0
1,1.5452249999998457,62.210.85.178,10.0.2.15,TCP,60,9001  >  35978 [ACK] Seq=14195747 Ack=259945437 Win=65535 Len=0
1,1.6170830000000933,54.93.77.70,10.0.2.15,TLSv1.2,590,Application Data
1,1.6389850000005026,54.93.77.70,10.0.2.15,TCP,2950,"9001  >  34692 [PSH, ACK] Seq=259808945 Ack=14288795 Win=65535 Len=2896 [TCP segment of a reassembled PDU]"
1,1.6391160000002856,10.0.2.15,54.93.77.70,TCP,54,34692  >  9001 [ACK] Seq=14288795 Ack=259811841 Win=65535 Len=0
1,1.6586600000000544,54.93.77.70,10.0.2.15,TLSv1.2,778,Application Data
1,1.702089000000342,10.0.2.15,54.93.77.70,TCP,54,34692  >  9001 [ACK] Seq=14288795 Ack=259812565 Win=65535 Len=0
1,1.7317600000005768,54.93.77.70,10.0.2.15,TCP,2950,"9001  >  34692 [PSH, ACK] Seq=259812565 Ack=14288795 Win=65535 Len=2896 [TCP segment of a reassembled PDU]"
1,1.731843000000481,10.0.2.15,54.93.77.70,TCP,54,34692  >  9001 [ACK] Seq=14288795 Ack=259815461 Win=65535 Len=0
1,1.7318930000001274,54.93.77.70,10.0.2.15,TLSv1.2,1828,"Application Data, Application Data"
1,1.7319200000001729,10.0.2.15,54.93.77.70,TCP,54,34692  >  9001 [ACK] Seq=14288795 Ack=259817235 Win=65535 Len=0
1,1.74004800000057,54.93.77.70,10.0.2.15,TCP,2950,"9001  >  34692 [PSH, ACK] Seq=259817235 Ack=14288795 Win=65535 Len=2896 [TCP segment of a reassembled PDU]"
1,1.7400940000006813,10.0.2.15,54.93.77.70,TCP,54,34692  >  9001 [ACK] Seq=14288795 Ack=259820131 Win=65535 Len=0
1,1.74062000000049,54.93.77.70,10.0.2.15,TLSv1.2,4398,Application Data [TCP segment of a reassembled PDU]
1,1.7406620000001567,10.0.2.15,54.93.77.70,TCP,54,34692  >  9001 [ACK] Seq=14288795 Ack=259824475 Win=65535 Len=0
1,1.7527209999998377,54.93.77.70,10.0.2.15,TLSv1.2,2016,Application Data [TCP segment of a reassembled PDU]
1,1.7527500000005602,54.93.77.70,10.0.2.15,TLSv1.2,10190,"Application Data, Application Data"
1,1.7527939999999944,10.0.2.15,54.93.77.70,TCP,54,34692  >  9001 [ACK] Seq=14288795 Ack=259826437 Win=65535 Len=0
1,1.7528360000005705,10.0.2.15,54.93.77.70,TCP,54,34692  >  9001 [ACK] Seq=14288795 Ack=259836573 Win=65535 Len=0
1,1.764615000000049,54.93.77.70,10.0.2.15,TLSv1.2,7294,"Application Data, Application Data"
1,1.7646640000002662,10.0.2.15,54.93.77.70,TCP,54,34692  >  9001 [ACK] Seq=14288795 Ack=259843813 Win=65535 Len=0
1,1.7648380000000543,10.0.2.15,54.93.77.70,TLSv1.2,590,Application Data
1,1.7649179999998523,54.93.77.70,10.0.2.15,TCP,60,9001  >  34692 [ACK] Seq=259843813 Ack=14289331 Win=65535 Len=0
1,1.7706410000000687,54.93.77.70,10.0.2.15,TLSv1.2,1408,"Application Data, Application Data"
1,1.7849059999998644,54.93.77.70,10.0.2.15,TCP,1502,"9001  >  34692 [PSH, ACK] Seq=259845167 Ack=14289331 Win=65535 Len=1448 [TCP segment of a reassembled PDU]"
1,1.7849660000001677,10.0.2.15,54.93.77.70,TCP,54,34692  >  9001 [ACK] Seq=14289331 Ack=259846615 Win=65535 Len=0
1,1.7937550000006013,54.93.77.70,10.0.2.15,TLSv1.2,2950,Application Data [TCP segment of a reassembled PDU]
1,1.7937830000000758,54.93.77.70,10.0.2.15,TLSv1.2,8742,"Application Data, Application Data"
1,1.793851000000359,10.0.2.15,54.93.77.70,TCP,54,34692  >  9001 [ACK] Seq=14289331 Ack=259858199 Win=65535 Len=0
1,1.794118000000708,10.0.2.15,54.93.77.70,TLSv1.2,590,Application Data
1,1.7941850000006525,54.93.77.70,10.0.2.15,TCP,60,9001  >  34692 [ACK] Seq=259858199 Ack=14289867 Win=65535 Len=0
1,1.8011690000003,54.93.77.70,10.0.2.15,TLSv1.2,474,Application Data
1,1.8086370000000898,54.93.77.70,10.0.2.15,TLSv1.2,7294,"Application Data, Application Data"
1,1.8086890000004132,10.0.2.15,54.93.77.70,TCP,54,34692  >  9001 [ACK] Seq=14289867 Ack=259865859 Win=65535 Len=0
1,1.8088490000000093,10.0.2.15,54.93.77.70,TLSv1.2,590,Application Data
1,1.8089209999998275,54.93.77.70,10.0.2.15,TCP,60,9001  >  34692 [ACK] Seq=259865859 Ack=14290403 Win=65535 Len=0
1,1.8186500000001615,10.0.2.15,54.93.77.70,TLSv1.2,590,Application Data
1,1.8187900000002628,54.93.77.70,10.0.2.15,TCP,60,9001  >  34692 [ACK] Seq=259865859 Ack=14290939 Win=65535 Len=0
1,1.8885580000005575,62.210.85.178,10.0.2.15,TLSv1.2,590,Application Data
1,1.9301009999999224,10.0.2.15,62.210.85.178,TCP,54,35978  >  9001 [ACK] Seq=259945437 Ack=14196283 Win=65535 Len=0
1,2.32467700000052,62.210.85.178,10.0.2.15,TLSv1.2,1618,Application Data
1,2.3247559999999794,10.0.2.15,62.210.85.178,TCP,54,35978  >  9001 [ACK] Seq=259945437 Ack=14197847 Win=65535 Len=0
1,2.3252790000005916,10.0.2.15,62.210.85.178,TLSv1.2,590,Application Data
1,2.325394000000415,62.210.85.178,10.0.2.15,TCP,60,9001  >  35978 [ACK] Seq=14197847 Ack=259945973 Win=65535 Len=0
1,2.5312840000005963,54.93.77.70,10.0.2.15,TLSv1.2,590,Application Data
1,2.5316570000004504,10.0.2.15,54.93.77.70,TLSv1.2,590,Application Data
1,2.531767999999829,54.93.77.70,10.0.2.15,TCP,60,9001  >  34692 [ACK] Seq=259866395 Ack=14291475 Win=65535 Len=0
1,2.6375889999999345,62.210.85.178,10.0.2.15,TLSv1.2,590,Application Data
1,2.642573000000084,10.0.2.15,62.210.85.178,TLSv1.2,590,Application Data
1,2.642746000000443,62.210.85.178,10.0.2.15,TCP,60,9001  >  35978 [ACK] Seq=14198383 Ack=259946509 Win=65535 Len=0
1,2.655080999999882,10.0.2.15,62.210.85.178,TLSv1.2,4124,Application Data
1,2.655189000000064,10.0.2.15,62.210.85.178,TCP,2974,35978  >  9001 [ACK] Seq=259950579 Ack=14198383 Win=65535 Len=2920 [TCP segment of a reassembled PDU]
1,2.655236999999943,62.210.85.178,10.0.2.15,TCP,60,9001  >  35978 [ACK] Seq=14198383 Ack=259947969 Win=65535 Len=0
1,2.6552500000007058,62.210.85.178,10.0.2.15,TCP,60,9001  >  35978 [ACK] Seq=14198383 Ack=259949429 Win=65535 Len=0
1,2.6552560000000085,62.210.85.178,10.0.2.15,TCP,60,9001  >  35978 [ACK] Seq=14198383 Ack=259950579 Win=65535 Len=0
1,2.655260000000453,62.210.85.178,10.0.2.15,TCP,60,9001  >  35978 [ACK] Seq=14198383 Ack=259952039 Win=65535 Len=0
1,2.6552639999999883,62.210.85.178,10.0.2.15,TCP,60,9001  >  35978 [ACK] Seq=14198383 Ack=259953499 Win=65535 Len=0
1,2.6552990000000136,10.0.2.15,62.210.85.178,TLSv1.2,1204,Application Data
1,2.655337000000145,62.210.85.178,10.0.2.15,TCP,60,9001  >  35978 [ACK] Seq=14198383 Ack=259954649 Win=65535 Len=0
1,2.655384000000595,10.0.2.15,62.210.85.178,TLSv1.2,4124,Application Data
1,2.6554230000001553,62.210.85.178,10.0.2.15,TCP,60,9001  >  35978 [ACK] Seq=14198383 Ack=259956109 Win=65535 Len=0
1,2.6554320000004736,62.210.85.178,10.0.2.15,TCP,60,9001  >  35978 [ACK] Seq=14198383 Ack=259957569 Win=65535 Len=0
1,2.655436000000009,62.210.85.178,10.0.2.15,TCP,60,9001  >  35978 [ACK] Seq=14198383 Ack=259958719 Win=65535 Len=0
1,2.6554740000001402,10.0.2.15,62.210.85.178,TLSv1.2,4124,Application Data
1,2.6555120000002717,62.210.85.178,10.0.2.15,TCP,60,9001  >  35978 [ACK] Seq=14198383 Ack=259960179 Win=65535 Len=0
1,2.6555200000002515,62.210.85.178,10.0.2.15,TCP,60,9001  >  35978 [ACK] Seq=14198383 Ack=259961639 Win=65535 Len=0
1,2.6555800000005547,10.0.2.15,62.210.85.178,TLSv1.2,2974,Application Data
1,2.6556209999998828,62.210.85.178,10.0.2.15,TCP,60,9001  >  35978 [ACK] Seq=14198383 Ack=259962789 Win=65535 Len=0
1,2.6556280000004335,62.210.85.178,10.0.2.15,TCP,60,9001  >  35978 [ACK] Seq=14198383 Ack=259964249 Win=65535 Len=0
1,2.6556310000005396,62.210.85.178,10.0.2.15,TCP,60,9001  >  35978 [ACK] Seq=14198383 Ack=259965709 Win=65535 Len=0
1,2.655659000000014,10.0.2.15,62.210.85.178,TLSv1.2,1226,Application Data
1,2.655695000000378,62.210.85.178,10.0.2.15,TCP,60,9001  >  35978 [ACK] Seq=14198383 Ack=259966881 Win=65535 Len=0
1,2.6557339999999385,10.0.2.15,62.210.85.178,TLSv1.2,4124,Application Data
1,2.6557760000005146,62.210.85.178,10.0.2.15,TCP,60,9001  >  35978 [ACK] Seq=14198383 Ack=259968341 Win=65535 Len=0
1,2.6557840000004944,62.210.85.178,10.0.2.15,TCP,60,9001  >  35978 [ACK] Seq=14198383 Ack=259969801 Win=65535 Len=0
1,2.6557870000006005,62.210.85.178,10.0.2.15,TCP,60,9001  >  35978 [ACK] Seq=14198383 Ack=259970951 Win=65535 Len=0
1,2.6558240000003934,10.0.2.15,62.210.85.178,TLSv1.2,3030,Application Data
1,2.6558850000001257,62.210.85.178,10.0.2.15,TCP,60,9001  >  35978 [ACK] Seq=14198383 Ack=259972411 Win=65535 Len=0
1,2.655891000000338,62.210.85.178,10.0.2.15,TCP,60,9001  >  35978 [ACK] Seq=14198383 Ack=259973871 Win=65535 Len=0
1,2.655894000000444,62.210.85.178,10.0.2.15,TCP,60,9001  >  35978 [ACK] Seq=14198383 Ack=259973927 Win=65535 Len=0
1,2.6663750000006985,10.0.2.15,62.210.85.178,TLSv1.2,4124,Application Data
1,2.6664330000003247,62.210.85.178,10.0.2.15,TCP,60,9001  >  35978 [ACK] Seq=14198383 Ack=259975387 Win=65535 Len=0
1,2.6664440000004106,62.210.85.178,10.0.2.15,TCP,60,9001  >  35978 [ACK] Seq=14198383 Ack=259976847 Win=65535 Len=0
1,2.6664490000002843,62.210.85.178,10.0.2.15,TCP,60,9001  >  35978 [ACK] Seq=14198383 Ack=259977997 Win=65535 Len=0
1,2.6664959999998246,10.0.2.15,62.210.85.178,TLSv1.2,4124,Application Data
1,2.666537000000062,62.210.85.178,10.0.2.15,TCP,60,9001  >  35978 [ACK] Seq=14198383 Ack=259979457 Win=65535 Len=0
1,2.666545000000042,62.210.85.178,10.0.2.15,TCP,60,9001  >  35978 [ACK] Seq=14198383 Ack=259980917 Win=65535 Len=0
1,2.6665499999999156,62.210.85.178,10.0.2.15,TCP,60,9001  >  35978 [ACK] Seq=14198383 Ack=259982067 Win=65535 Len=0
1,2.6665890000003856,10.0.2.15,62.210.85.178,TLSv1.2,4124,Application Data
1,2.666627999999946,62.210.85.178,10.0.2.15,TCP,60,9001  >  35978 [ACK] Seq=14198383 Ack=259983527 Win=65535 Len=0
1,2.6666370000002644,62.210.85.178,10.0.2.15,TCP,60,9001  >  35978 [ACK] Seq=14198383 Ack=259984987 Win=65535 Len=0
1,2.666641000000709,62.210.85.178,10.0.2.15,TCP,60,9001  >  35978 [ACK] Seq=14198383 Ack=259986137 Win=65535 Len=0
1,2.666678000000502,10.0.2.15,62.210.85.178,TLSv1.2,4124,Application Data
1,2.666715000000295,62.210.85.178,10.0.2.15,TCP,60,9001  >  35978 [ACK] Seq=14198383 Ack=259987597 Win=65535 Len=0
1,2.666725000000042,62.210.85.178,10.0.2.15,TCP,60,9001  >  35978 [ACK] Seq=14198383 Ack=259989057 Win=65535 Len=0
1,2.666729999999916,62.210.85.178,10.0.2.15,TCP,60,9001  >  35978 [ACK] Seq=14198383 Ack=259990207 Win=65535 Len=0
1,2.6667680000000473,10.0.2.15,62.210.85.178,TLSv1.2,332,Application Data
1,2.66680499999984,62.210.85.178,10.0.2.15,TCP,60,9001  >  35978 [ACK] Seq=14198383 Ack=259990485 Win=65535 Len=0
1,2.6668570000001637,10.0.2.15,62.210.85.178,TLSv1.2,3868,Application Data
1,2.6668960000006336,62.210.85.178,10.0.2.15,TCP,60,9001  >  35978 [ACK] Seq=14198383 Ack=259991945 Win=65535 Len=0
1,2.6669040000006135,62.210.85.178,10.0.2.15,TCP,60,9001  >  35978 [ACK] Seq=14198383 Ack=259993405 Win=65535 Len=0
1,2.6669080000001486,62.210.85.178,10.0.2.15,TCP,60,9001  >  35978 [ACK] Seq=14198383 Ack=259994299 Win=65535 Len=0
1,2.6669470000006186,10.0.2.15,62.210.85.178,TLSv1.2,4124,Application Data
1,2.6669849999998405,62.210.85.178,10.0.2.15,TCP,60,9001  >  35978 [ACK] Seq=14198383 Ack=259995759 Win=65535 Len=0
1,2.66699300000073,62.210.85.178,10.0.2.15,TCP,60,9001  >  35978 [ACK] Seq=14198383 Ack=259997219 Win=65535 Len=0
1,2.666997000000265,62.210.85.178,10.0.2.15,TCP,60,9001  >  35978 [ACK] Seq=14198383 Ack=259998369 Win=65535 Len=0
1,2.6670320000002903,10.0.2.15,62.210.85.178,TLSv1.2,2002,Application Data
1,2.6670700000004217,62.210.85.178,10.0.2.15,TCP,60,9001  >  35978 [ACK] Seq=14198383 Ack=259999829 Win=65535 Len=0
1,2.667077000000063,62.210.85.178,10.0.2.15,TCP,60,9001  >  35978 [ACK] Seq=14198383 Ack=260000317 Win=65535 Len=0
1,2.7646730000005846,54.93.77.70,10.0.2.15,TLSv1.2,590,Application Data
1,2.7864669999999023,54.93.77.70,10.0.2.15,TCP,2950,"9001  >  34692 [PSH, ACK] Seq=259866931 Ack=14291475 Win=65535 Len=2896 [TCP segment of a reassembled PDU]"
1,2.7865520000004835,10.0.2.15,54.93.77.70,TCP,54,34692  >  9001 [ACK] Seq=14291475 Ack=259869827 Win=65535 Len=0
1,2.8025150000003123,54.93.77.70,10.0.2.15,TLSv1.2,4398,"Application Data, Application Data"
1,2.802566000000297,10.0.2.15,54.93.77.70,TCP,54,34692  >  9001 [ACK] Seq=14291475 Ack=259874171 Win=65535 Len=0
1,2.8115649999999732,54.93.77.70,10.0.2.15,TLSv1.2,3674,Application Data
1,2.811620000000403,10.0.2.15,54.93.77.70,TCP,54,34692  >  9001 [ACK] Seq=14291475 Ack=259877791 Win=65535 Len=0
1,2.822428999999829,54.93.77.70,10.0.2.15,TCP,2950,"9001  >  34692 [PSH, ACK] Seq=259877791 Ack=14291475 Win=65535 Len=2896 [TCP segment of a reassembled PDU]"
1,2.8224780000000464,10.0.2.15,54.93.77.70,TCP,54,34692  >  9001 [ACK] Seq=14291475 Ack=259880687 Win=65535 Len=0
1,2.8306140000004234,54.93.77.70,10.0.2.15,TLSv1.2,1314,"Application Data, Application Data"
1,2.832205000000613,54.93.77.70,10.0.2.15,TCP,2950,"9001  >  34692 [PSH, ACK] Seq=259881947 Ack=14291475 Win=65535 Len=2896 [TCP segment of a reassembled PDU]"
1,2.832256000000598,10.0.2.15,54.93.77.70,TCP,54,34692  >  9001 [ACK] Seq=14291475 Ack=259884843 Win=65535 Len=0
1,2.840204000000085,54.93.77.70,10.0.2.15,TLSv1.2,2950,Application Data [TCP segment of a reassembled PDU]
1,2.840219000000616,54.93.77.70,10.0.2.15,TCP,1502,"9001  >  34692 [PSH, ACK] Seq=259887739 Ack=14291475 Win=65535 Len=1448 [TCP segment of a reassembled PDU]"
1,2.8402530000003026,10.0.2.15,54.93.77.70,TCP,54,34692  >  9001 [ACK] Seq=14291475 Ack=259887739 Win=65535 Len=0
1,2.8403260000004593,10.0.2.15,54.93.77.70,TCP,54,34692  >  9001 [ACK] Seq=14291475 Ack=259889187 Win=65535 Len=0
1,2.8506539999998495,54.93.77.70,10.0.2.15,TLSv1.2,4934,"Application Data, Application Data, Application Data"
1,2.8506960000004256,10.0.2.15,54.93.77.70,TCP,54,34692  >  9001 [ACK] Seq=14291475 Ack=259894067 Win=65535 Len=0
1,2.850930000000517,10.0.2.15,54.93.77.70,TLSv1.2,590,Application Data
1,2.8510040000001027,54.93.77.70,10.0.2.15,TCP,60,9001  >  34692 [ACK] Seq=259894067 Ack=14292011 Win=65535 Len=0
1,2.869826000000103,54.93.77.70,10.0.2.15,TLSv1.2,380,Application Data
1,2.8909560000001875,54.93.77.70,10.0.2.15,TCP,2950,"9001  >  34692 [PSH, ACK] Seq=259894393 Ack=14292011 Win=65535 Len=2896 [TCP segment of a reassembled PDU]"
1,2.8910100000002785,10.0.2.15,54.93.77.70,TCP,54,34692  >  9001 [ACK] Seq=14292011 Ack=259897289 Win=65535 Len=0
1,2.9038310000005367,54.93.77.70,10.0.2.15,TLSv1.2,11638,"Application Data, Application Data, Application Data"
1,2.9040460000005623,10.0.2.15,54.93.77.70,TCP,54,34692  >  9001 [ACK] Seq=14292011 Ack=259908873 Win=65535 Len=0
1,2.90767600000072,54.93.77.70,10.0.2.15,TLSv1.2,568,Application Data
1,2.9078550000003816,10.0.2.15,54.93.77.70,TLSv1.2,590,Application Data
1,2.9079430000001594,54.93.77.70,10.0.2.15,TCP,60,9001  >  34692 [ACK] Seq=259909387 Ack=14292547 Win=65535 Len=0
1,2.912290000000212,54.93.77.70,10.0.2.15,TCP,2950,"9001  >  34692 [PSH, ACK] Seq=259909387 Ack=14292547 Win=65535 Len=2896 [TCP segment of a reassembled PDU]"
1,2.912364000000707,10.0.2.15,54.93.77.70,TCP,54,34692  >  9001 [ACK] Seq=14292547 Ack=259912283 Win=65535 Len=0
1,2.9167340000003605,54.93.77.70,10.0.2.15,TLSv1.2,4398,Application Data [TCP segment of a reassembled PDU]
1,2.9167930000003253,10.0.2.15,54.93.77.70,TCP,54,34692  >  9001 [ACK] Seq=14292547 Ack=259916627 Win=65535 Len=0
1,2.9199820000003456,54.93.77.70,10.0.2.15,TLSv1.2,2950,Application Data [TCP segment of a reassembled PDU]
1,2.920028000000457,10.0.2.15,54.93.77.70,TCP,54,34692  >  9001 [ACK] Seq=14292547 Ack=259919523 Win=65535 Len=0
1,2.924641999999949,54.93.77.70,10.0.2.15,TLSv1.2,778,Application Data
1,2.924775999999838,10.0.2.15,54.93.77.70,TLSv1.2,590,Application Data
1,2.9248640000005253,54.93.77.70,10.0.2.15,TCP,60,9001  >  34692 [ACK] Seq=259920247 Ack=14293083 Win=65535 Len=0
1,2.93907500000023,10.0.2.15,54.93.77.70,TLSv1.2,1104,Application Data
1,2.9393749999999272,54.93.77.70,10.0.2.15,TCP,60,9001  >  34692 [ACK] Seq=259920247 Ack=14294133 Win=65535 Len=0
1,2.941874000000098,54.93.77.70,10.0.2.15,TLSv1.2,590,Application Data
1,2.956380000000536,62.210.85.178,10.0.2.15,TLSv1.2,590,Application Data
1,2.9821419999998398,10.0.2.15,54.93.77.70,TCP,54,34692  >  9001 [ACK] Seq=14294133 Ack=259920783 Win=65535 Len=0
1,2.998282999999901,10.0.2.15,62.210.85.178,TCP,54,35978  >  9001 [ACK] Seq=260000317 Ack=14198919 Win=65535 Len=0
1,3.0249039999998786,62.210.85.178,10.0.2.15,TLSv1.2,590,Application Data
1,3.024992999999995,10.0.2.15,62.210.85.178,TCP,54,35978  >  9001 [ACK] Seq=260000317 Ack=14199455 Win=65535 Len=0
1,3.0521090000002005,62.210.85.178,10.0.2.15,TLSv1.2,590,Application Data
1,3.0521570000000793,10.0.2.15,62.210.85.178,TCP,54,35978  >  9001 [ACK] Seq=260000317 Ack=14199991 Win=65535 Len=0
1,3.0941200000006575,62.210.85.178,10.0.2.15,TLSv1.2,1104,Application Data
1,3.094198000000688,10.0.2.15,62.210.85.178,TCP,54,35978  >  9001 [ACK] Seq=260000317 Ack=14201041 Win=65535 Len=0
1,3.0946920000005775,10.0.2.15,62.210.85.178,TLSv1.2,590,Application Data
1,3.094814000000042,62.210.85.178,10.0.2.15,TCP,60,9001  >  35978 [ACK] Seq=14201041 Ack=260000853 Win=65535 Len=0
1,3.2078300000002855,54.93.77.70,10.0.2.15,TLSv1.2,590,Application Data
1,3.2079060000005484,10.0.2.15,54.93.77.70,TCP,54,34692  >  9001 [ACK] Seq=14294133 Ack=259921319 Win=65535 Len=0
1,3.2082600000003367,10.0.2.15,54.93.77.70,TLSv1.2,590,Application Data
1,3.208349999999882,54.93.77.70,10.0.2.15,TCP,60,9001  >  34692 [ACK] Seq=259921319 Ack=14294669 Win=65535 Len=0
1,3.349557999999888,62.210.85.178,10.0.2.15,TLSv1.2,590,Application Data
1,3.35787800000071,10.0.2.15,62.210.85.178,TLSv1.2,590,Application Data
1,3.3580160000001342,62.210.85.178,10.0.2.15,TCP,60,9001  >  35978 [ACK] Seq=14201577 Ack=260001389 Win=65535 Len=0
1,3.370433000000048,10.0.2.15,62.210.85.178,TLSv1.2,4124,Application Data
1,3.370535000000018,10.0.2.15,62.210.85.178,TCP,2974,35978  >  9001 [ACK] Seq=260005459 Ack=14201577 Win=65535 Len=2920 [TCP segment of a reassembled PDU]
1,3.370582999999897,62.210.85.178,10.0.2.15,TCP,60,9001  >  35978 [ACK] Seq=14201577 Ack=260002849 Win=65535 Len=0
1,3.370597000000089,62.210.85.178,10.0.2.15,TCP,60,9001  >  35978 [ACK] Seq=14201577 Ack=260004309 Win=65535 Len=0
1,3.3706010000005335,62.210.85.178,10.0.2.15,TCP,60,9001  >  35978 [ACK] Seq=14201577 Ack=260005459 Win=65535 Len=0
1,3.3706050000000687,62.210.85.178,10.0.2.15,TCP,60,9001  >  35978 [ACK] Seq=14201577 Ack=260006919 Win=65535 Len=0
1,3.370608000000175,62.210.85.178,10.0.2.15,TCP,60,9001  >  35978 [ACK] Seq=14201577 Ack=260008379 Win=65535 Len=0
1,3.3706430000002,10.0.2.15,62.210.85.178,TLSv1.2,1204,Application Data
1,3.3706810000003316,62.210.85.178,10.0.2.15,TCP,60,9001  >  35978 [ACK] Seq=14201577 Ack=260009529 Win=65535 Len=0
1,3.370727000000443,10.0.2.15,62.210.85.178,TLSv1.2,4124,Application Data
1,3.3707660000000033,62.210.85.178,10.0.2.15,TCP,60,9001  >  35978 [ACK] Seq=14201577 Ack=260010989 Win=65535 Len=0
1,3.3707750000003216,62.210.85.178,10.0.2.15,TCP,60,9001  >  35978 [ACK] Seq=14201577 Ack=260012449 Win=65535 Len=0
1,3.3707789999998568,62.210.85.178,10.0.2.15,TCP,60,9001  >  35978 [ACK] Seq=14201577 Ack=260013599 Win=65535 Len=0
1,3.3708190000006653,10.0.2.15,62.210.85.178,TLSv1.2,4124,Application Data
1,3.370856999999887,62.210.85.178,10.0.2.15,TCP,60,9001  >  35978 [ACK] Seq=14201577 Ack=260015059 Win=65535 Len=0
1,3.370864999999867,62.210.85.178,10.0.2.15,TCP,60,9001  >  35978 [ACK] Seq=14201577 Ack=260016519 Win=65535 Len=0
1,3.370907999999872,62.210.85.178,10.0.2.15,TCP,60,9001  >  35978 [ACK] Seq=14201577 Ack=260017669 Win=65535 Len=0
1,3.3709420000004684,10.0.2.15,62.210.85.178,TLSv1.2,332,Application Data
1,3.3709779999999228,62.210.85.178,10.0.2.15,TCP,60,9001  >  35978 [ACK] Seq=14201577 Ack=260017947 Win=65535 Len=0
1,3.3710310000005848,10.0.2.15,62.210.85.178,TLSv1.2,3868,Application Data
1,3.3710710000004838,62.210.85.178,10.0.2.15,TCP,60,9001  >  35978 [ACK] Seq=14201577 Ack=260019407 Win=65535 Len=0
1,3.3710790000004636,62.210.85.178,10.0.2.15,TCP,60,9001  >  35978 [ACK] Seq=14201577 Ack=260020867 Win=65535 Len=0
1,3.3710829999999987,62.210.85.178,10.0.2.15,TCP,60,9001  >  35978 [ACK] Seq=14201577 Ack=260021761 Win=65535 Len=0
1,3.371120000000701,10.0.2.15,62.210.85.178,TLSv1.2,4124,Application Data
1,3.371157999999923,62.210.85.178,10.0.2.15,TCP,60,9001  >  35978 [ACK] Seq=14201577 Ack=260023221 Win=65535 Len=0
1,3.371165999999903,62.210.85.178,10.0.2.15,TCP,60,9001  >  35978 [ACK] Seq=14201577 Ack=260024681 Win=65535 Len=0
1,3.3711700000003475,62.210.85.178,10.0.2.15,TCP,60,9001  >  35978 [ACK] Seq=14201577 Ack=260025831 Win=65535 Len=0
1,3.3712070000001404,10.0.2.15,62.210.85.178,TLSv1.2,3030,Application Data
1,3.3712460000006104,62.210.85.178,10.0.2.15,TCP,60,9001  >  35978 [ACK] Seq=14201577 Ack=260027291 Win=65535 Len=0
1,3.37125400000059,62.210.85.178,10.0.2.15,TCP,60,9001  >  35978 [ACK] Seq=14201577 Ack=260028751 Win=65535 Len=0
1,3.3712580000001253,62.210.85.178,10.0.2.15,TCP,60,9001  >  35978 [ACK] Seq=14201577 Ack=260028807 Win=65535 Len=0
1,3.382701999999881,10.0.2.15,62.210.85.178,TLSv1.2,4124,Application Data
1,3.38278900000023,62.210.85.178,10.0.2.15,TCP,60,9001  >  35978 [ACK] Seq=14201577 Ack=260030267 Win=65535 Len=0
1,3.3827989999999772,62.210.85.178,10.0.2.15,TCP,60,9001  >  35978 [ACK] Seq=14201577 Ack=260031727 Win=65535 Len=0
1,3.3828020000000834,62.210.85.178,10.0.2.15,TCP,60,9001  >  35978 [ACK] Seq=14201577 Ack=260032877 Win=65535 Len=0
1,3.382843000000321,10.0.2.15,62.210.85.178,TLSv1.2,4124,Application Data
1,3.3829160000004777,62.210.85.178,10.0.2.15,TCP,60,9001  >  35978 [ACK] Seq=14201577 Ack=260034337 Win=65535 Len=0
1,3.382923000000119,62.210.85.178,10.0.2.15,TCP,60,9001  >  35978 [ACK] Seq=14201577 Ack=260035797 Win=65535 Len=0
1,3.382926000000225,62.210.85.178,10.0.2.15,TCP,60,9001  >  35978 [ACK] Seq=14201577 Ack=260036947 Win=65535 Len=0
1,3.3829610000002504,10.0.2.15,62.210.85.178,TLSv1.2,4124,Application Data
1,3.3829980000000432,62.210.85.178,10.0.2.15,TCP,60,9001  >  35978 [ACK] Seq=14201577 Ack=260038407 Win=65535 Len=0
1,3.3830070000003616,62.210.85.178,10.0.2.15,TCP,60,9001  >  35978 [ACK] Seq=14201577 Ack=260039867 Win=65535 Len=0
1,3.383013000000574,62.210.85.178,10.0.2.15,TCP,60,9001  >  35978 [ACK] Seq=14201577 Ack=260041017 Win=65535 Len=0
1,3.3830500000003667,10.0.2.15,62.210.85.178,TLSv1.2,2838,Application Data
1,3.383096000000478,62.210.85.178,10.0.2.15,TCP,60,9001  >  35978 [ACK] Seq=14201577 Ack=260042477 Win=65535 Len=0
1,3.383103000000119,62.210.85.178,10.0.2.15,TCP,60,9001  >  35978 [ACK] Seq=14201577 Ack=260043801 Win=65535 Len=0
1,3.554141999999956,54.93.77.70,10.0.2.15,TLSv1.2,590,Application Data
1,3.556726000000708,54.93.77.70,10.0.2.15,TCP,2950,"9001  >  34692 [PSH, ACK] Seq=259921855 Ack=14294669 Win=65535 Len=2896 [TCP segment of a reassembled PDU]"
1,3.5568030000004,10.0.2.15,54.93.77.70,TCP,54,34692  >  9001 [ACK] Seq=14294669 Ack=259924751 Win=65535 Len=0
1,3.5716650000003938,54.93.77.70,10.0.2.15,TLSv1.2,778,Application Data
1,3.576415999999881,54.93.77.70,10.0.2.15,TCP,2950,"9001  >  34692 [PSH, ACK] Seq=259925475 Ack=14294669 Win=65535 Len=2896 [TCP segment of a reassembled PDU]"
1,3.5764650000000984,10.0.2.15,54.93.77.70,TCP,54,34692  >  9001 [ACK] Seq=14294669 Ack=259928371 Win=65535 Len=0
1,3.588415000000168,54.93.77.70,10.0.2.15,TLSv1.2,8742,"Application Data, Application Data, Application Data"
1,3.588434000000234,54.93.77.70,10.0.2.15,TLSv1.2,380,Application Data
1,3.5884970000006433,10.0.2.15,54.93.77.70,TCP,54,34692  >  9001 [ACK] Seq=14294669 Ack=259937385 Win=65535 Len=0
1,3.6048650000002453,54.93.77.70,10.0.2.15,TCP,2950,"9001  >  34692 [PSH, ACK] Seq=259937385 Ack=14294669 Win=65535 Len=2896 [TCP segment of a reassembled PDU]"
1,3.604957999999897,10.0.2.15,54.93.77.70,TCP,54,34692  >  9001 [ACK] Seq=14294669 Ack=259940281 Win=65535 Len=0
1,3.6058010000006107,54.93.77.70,10.0.2.15,TLSv1.2,8742,"Application Data, Application Data"
1,3.6058929999999236,54.93.77.70,10.0.2.15,TLSv1.2,894,"Application Data, Application Data"
1,3.605956000000333,10.0.2.15,54.93.77.70,TCP,54,34692  >  9001 [ACK] Seq=14294669 Ack=259949809 Win=65535 Len=0
1,3.6063410000006115,10.0.2.15,54.93.77.70,TLSv1.2,590,Application Data
1,3.606411000000662,54.93.77.70,10.0.2.15,TCP,60,9001  >  34692 [ACK] Seq=259949809 Ack=14295205 Win=65535 Len=0
1,3.629271000000699,54.93.77.70,10.0.2.15,TCP,2950,"9001  >  34692 [PSH, ACK] Seq=259949809 Ack=14295205 Win=65535 Len=2896 [TCP segment of a reassembled PDU]"
1,3.6293320000004314,10.0.2.15,54.93.77.70,TCP,54,34692  >  9001 [ACK] Seq=14295205 Ack=259952705 Win=65535 Len=0
1,3.629656000000068,54.93.77.70,10.0.2.15,TLSv1.2,778,Application Data
1,3.6390070000006745,54.93.77.70,10.0.2.15,TLSv1.2,7294,Application Data
1,3.639132000000245,10.0.2.15,54.93.77.70,TCP,54,34692  >  9001 [ACK] Seq=14295205 Ack=259960669 Win=65535 Len=0
1,3.6456960000004983,54.93.77.70,10.0.2.15,TLSv1.2,568,Application Data
1,3.645894000000226,10.0.2.15,54.93.77.70,TLSv1.2,590,Application Data
1,3.6460390000002008,54.93.77.70,10.0.2.15,TCP,60,9001  >  34692 [ACK] Seq=259961183 Ack=14295741 Win=65535 Len=0
1,3.729464000000007,62.210.85.178,10.0.2.15,TLSv1.2,590,Application Data
1,3.741044000000329,54.93.77.70,10.0.2.15,TCP,2950,"9001  >  34692 [PSH, ACK] Seq=259961183 Ack=14295741 Win=65535 Len=2896 [TCP segment of a reassembled PDU]"
1,3.7411810000003243,10.0.2.15,54.93.77.70,TCP,54,34692  >  9001 [ACK] Seq=14295741 Ack=259964079 Win=65535 Len=0
1,3.74301800000012,54.93.77.70,10.0.2.15,TLSv1.2,264,Application Data
1,3.7463290000005145,10.0.2.15,54.93.77.70,TLSv1.2,590,Application Data
1,3.746509000000515,54.93.77.70,10.0.2.15,TCP,60,9001  >  34692 [ACK] Seq=259964289 Ack=14296277 Win=65535 Len=0
1,3.7700540000005276,10.0.2.15,62.210.85.178,TCP,54,35978  >  9001 [ACK] Seq=260043801 Ack=14202113 Win=65535 Len=0
1,3.9635630000002493,62.210.85.178,10.0.2.15,TLSv1.2,590,Application Data
1,3.9636749999999665,10.0.2.15,62.210.85.178,TCP,54,35978  >  9001 [ACK] Seq=260043801 Ack=14202649 Win=65535 Len=0
1,3.983479000000443,62.210.85.178,10.0.2.15,TLSv1.2,590,Application Data
1,3.9835689999999886,10.0.2.15,62.210.85.178,TCP,54,35978  >  9001 [ACK] Seq=260043801 Ack=14203185 Win=65535 Len=0
1,3.9841200000000754,10.0.2.15,62.210.85.178,TLSv1.2,590,Application Data
1,3.9842750000007072,62.210.85.178,10.0.2.15,TCP,60,9001  >  35978 [ACK] Seq=14203185 Ack=260044337 Win=65535 Len=0
1,4.092878000000383,54.93.77.70,10.0.2.15,TLSv1.2,590,Application Data
1,4.093332000000373,10.0.2.15,54.93.77.70,TLSv1.2,590,Application Data
1,4.0934839999999895,54.93.77.70,10.0.2.15,TCP,60,9001  >  34692 [ACK] Seq=259964825 Ack=14296813 Win=65535 Len=0
1,4.269995000000563,62.210.85.178,10.0.2.15,TLSv1.2,590,Application Data
1,4.278406000000359,10.0.2.15,62.210.85.178,TLSv1.2,590,Application Data
1,4.278583000000253,62.210.85.178,10.0.2.15,TCP,60,9001  >  35978 [ACK] Seq=14203721 Ack=260044873 Win=65535 Len=0
1,4.290150000000722,10.0.2.15,62.210.85.178,TLSv1.2,4124,Application Data
1,4.29027700000006,10.0.2.15,62.210.85.178,TCP,2974,35978  >  9001 [ACK] Seq=260048943 Ack=14203721 Win=65535 Len=2920 [TCP segment of a reassembled PDU]
1,4.290334000000257,62.210.85.178,10.0.2.15,TCP,60,9001  >  35978 [ACK] Seq=14203721 Ack=260046333 Win=65535 Len=0
1,4.290346000000682,62.210.85.178,10.0.2.15,TCP,60,9001  >  35978 [ACK] Seq=14203721 Ack=260047793 Win=65535 Len=0
1,4.290350000000217,62.210.85.178,10.0.2.15,TCP,60,9001  >  35978 [ACK] Seq=14203721 Ack=260048943 Win=65535 Len=0
1,4.2903550000000905,62.210.85.178,10.0.2.15,TCP,60,9001  >  35978 [ACK] Seq=14203721 Ack=260050403 Win=65535 Len=0
1,4.290359000000535,62.210.85.178,10.0.2.15,TCP,60,9001  >  35978 [ACK] Seq=14203721 Ack=260051863 Win=65535 Len=0
1,4.290402999999969,10.0.2.15,62.210.85.178,TLSv1.2,1204,Application Data
1,4.290472000000591,10.0.2.15,62.210.85.178,TCP,2974,35978  >  9001 [ACK] Seq=260053013 Ack=14203721 Win=65535 Len=2920 [TCP segment of a reassembled PDU]
1,4.290512999999919,62.210.85.178,10.0.2.15,TCP,60,9001  >  35978 [ACK] Seq=14203721 Ack=260053013 Win=65535 Len=0
1,4.29052000000047,62.210.85.178,10.0.2.15,TCP,60,9001  >  35978 [ACK] Seq=14203721 Ack=260054473 Win=65535 Len=0
1,4.290524000000005,62.210.85.178,10.0.2.15,TCP,60,9001  >  35978 [ACK] Seq=14203721 Ack=260055933 Win=65535 Len=0
1,4.29055900000003,10.0.2.15,62.210.85.178,TLSv1.2,1204,Application Data
1,4.290622999999869,10.0.2.15,62.210.85.178,TCP,2974,35978  >  9001 [ACK] Seq=260057083 Ack=14203721 Win=65535 Len=2920 [TCP segment of a reassembled PDU]
1,4.290661,62.210.85.178,10.0.2.15,TCP,60,9001  >  35978 [ACK] Seq=14203721 Ack=260057083 Win=65535 Len=0
1,4.290667000000212,62.210.85.178,10.0.2.15,TCP,60,9001  >  35978 [ACK] Seq=14203721 Ack=260058543 Win=65535 Len=0
1,4.290672000000086,62.210.85.178,10.0.2.15,TCP,60,9001  >  35978 [ACK] Seq=14203721 Ack=260060003 Win=65535 Len=0
1,4.290703000000576,10.0.2.15,62.210.85.178,TLSv1.2,1204,Application Data
1,4.290765000000647,62.210.85.178,10.0.2.15,TCP,60,9001  >  35978 [ACK] Seq=14203721 Ack=260061153 Win=65535 Len=0
1,4.290805000000546,10.0.2.15,62.210.85.178,TLSv1.2,332,Application Data
1,4.290891000000556,62.210.85.178,10.0.2.15,TCP,60,9001  >  35978 [ACK] Seq=14203721 Ack=260061431 Win=65535 Len=0
1,4.290919000000031,10.0.2.15,62.210.85.178,TCP,2974,35978  >  9001 [ACK] Seq=260061431 Ack=14203721 Win=65535 Len=2920 [TCP segment of a reassembled PDU]
1,4.290958000000501,62.210.85.178,10.0.2.15,TCP,60,9001  >  35978 [ACK] Seq=14203721 Ack=260062891 Win=65535 Len=0
1,4.290964000000713,62.210.85.178,10.0.2.15,TCP,60,9001  >  35978 [ACK] Seq=14203721 Ack=260064351 Win=65535 Len=0
1,4.290993999999955,10.0.2.15,62.210.85.178,TLSv1.2,948,Application Data
1,4.2910310000006575,62.210.85.178,10.0.2.15,TCP,60,9001  >  35978 [ACK] Seq=14203721 Ack=260065245 Win=65535 Len=0
1,4.291075000000092,10.0.2.15,62.210.85.178,TLSv1.2,4124,Application Data
1,4.291116000000329,62.210.85.178,10.0.2.15,TCP,60,9001  >  35978 [ACK] Seq=14203721 Ack=260066705 Win=65535 Len=0
1,4.2911220000005414,62.210.85.178,10.0.2.15,TCP,60,9001  >  35978 [ACK] Seq=14203721 Ack=260068165 Win=65535 Len=0
1,4.291127000000415,62.210.85.178,10.0.2.15,TCP,60,9001  >  35978 [ACK] Seq=14203721 Ack=260069315 Win=65535 Len=0
1,4.291172000000188,10.0.2.15,62.210.85.178,TLSv1.2,3030,Application Data
1,4.291213000000425,62.210.85.178,10.0.2.15,TCP,60,9001  >  35978 [ACK] Seq=14203721 Ack=260070775 Win=65535 Len=0
1,4.291220000000067,62.210.85.178,10.0.2.15,TCP,60,9001  >  35978 [ACK] Seq=14203721 Ack=260072235 Win=65535 Len=0
