No.,Time,Source,Destination,Protocol,Length,Info
1,0.007086999999955879,62.210.85.178,10.0.2.15,TLSv1.2,590,Application Data
1,0.053224999999656575,10.0.2.15,62.210.85.178,TCP,54,35978  >  9001 [ACK] Seq=265044195 Ack=14450379 Win=65535 Len=0
1,0.19447399999990012,10.0.2.15,54.93.77.70,TLSv1.2,590,Application Data
1,0.19462599999951635,54.93.77.70,10.0.2.15,TCP,60,9001  >  34692 [ACK] Seq=264968183 Ack=14547427 Win=65535 Len=0
1,0.3507899999995061,62.210.85.178,10.0.2.15,TLSv1.2,590,Application Data
1,0.3510200000000623,10.0.2.15,62.210.85.178,TCP,54,35978  >  9001 [ACK] Seq=265044195 Ack=14450915 Win=65535 Len=0
1,0.3524069999994026,10.0.2.15,62.210.85.178,TLSv1.2,590,Application Data
1,0.3527539999995497,62.210.85.178,10.0.2.15,TCP,60,9001  >  35978 [ACK] Seq=14450915 Ack=265044731 Win=65535 Len=0
1,0.4680269999998927,54.93.77.70,10.0.2.15,TLSv1.2,590,Application Data
1,0.4681080000000293,10.0.2.15,54.93.77.70,TCP,54,34692  >  9001 [ACK] Seq=14547427 Ack=264968719 Win=65535 Len=0
1,0.46853099999952974,10.0.2.15,54.93.77.70,TLSv1.2,1618,Application Data
1,0.468630999999732,54.93.77.70,10.0.2.15,TCP,60,9001  >  34692 [ACK] Seq=264968719 Ack=14548887 Win=65535 Len=0
1,0.46864300000015646,54.93.77.70,10.0.2.15,TCP,60,9001  >  34692 [ACK] Seq=264968719 Ack=14548991 Win=65535 Len=0
1,0.5857550000000629,62.210.85.178,10.0.2.15,TLSv1.2,1618,Application Data
1,0.5858749999997599,10.0.2.15,62.210.85.178,TCP,54,35978  >  9001 [ACK] Seq=265044731 Ack=14452479 Win=65535 Len=0
1,0.5993499999995038,10.0.2.15,62.210.85.178,TLSv1.2,590,Application Data
1,0.5995419999999285,62.210.85.178,10.0.2.15,TCP,60,9001  >  35978 [ACK] Seq=14452479 Ack=265045267 Win=65535 Len=0
1,0.6101229999994757,10.0.2.15,62.210.85.178,TLSv1.2,1618,Application Data
1,0.6102679999994507,62.210.85.178,10.0.2.15,TCP,60,9001  >  35978 [ACK] Seq=14452479 Ack=265046727 Win=65535 Len=0
1,0.6102860000000874,62.210.85.178,10.0.2.15,TCP,60,9001  >  35978 [ACK] Seq=14452479 Ack=265046831 Win=65535 Len=0
1,0.7068099999996775,54.93.77.70,10.0.2.15,TLSv1.2,590,Application Data
1,0.7500570000001971,10.0.2.15,54.93.77.70,TCP,54,34692  >  9001 [ACK] Seq=14548991 Ack=264969255 Win=65535 Len=0
1,0.7555210000000443,54.93.77.70,10.0.2.15,TLSv1.2,1618,Application Data
1,0.7555729999994583,10.0.2.15,54.93.77.70,TCP,54,34692  >  9001 [ACK] Seq=14548991 Ack=264970819 Win=65535 Len=0
1,0.7576410000001488,10.0.2.15,54.93.77.70,TLSv1.2,590,Application Data
1,0.7578029999995124,54.93.77.70,10.0.2.15,TCP,60,9001  >  34692 [ACK] Seq=264970819 Ack=14549527 Win=65535 Len=0
1,0.8677609999995184,62.210.85.178,10.0.2.15,TLSv1.2,590,Application Data
1,0.868054999999913,10.0.2.15,62.210.85.178,TLSv1.2,590,Application Data
1,0.8681839999999283,62.210.85.178,10.0.2.15,TCP,60,9001  >  35978 [ACK] Seq=14453015 Ack=265047367 Win=65535 Len=0
1,1.0672960000001694,54.93.77.70,10.0.2.15,TLSv1.2,590,Application Data
1,1.0677019999993718,10.0.2.15,54.93.77.70,TLSv1.2,590,Application Data
1,1.067801000000145,54.93.77.70,10.0.2.15,TCP,60,9001  >  34692 [ACK] Seq=264971355 Ack=14550063 Win=65535 Len=0
1,1.2721160000000964,62.210.85.178,10.0.2.15,TLSv1.2,590,Application Data
1,1.2773099999994884,10.0.2.15,62.210.85.178,TLSv1.2,590,Application Data
1,1.2780489999995552,62.210.85.178,10.0.2.15,TCP,60,9001  >  35978 [ACK] Seq=14453551 Ack=265047903 Win=65535 Len=0
1,1.286884999999529,10.0.2.15,62.210.85.178,TLSv1.2,4124,Application Data
1,1.286989000000176,10.0.2.15,62.210.85.178,TCP,2974,35978  >  9001 [ACK] Seq=265051973 Ack=14453551 Win=65535 Len=2920 [TCP segment of a reassembled PDU]
1,1.2870320000001811,62.210.85.178,10.0.2.15,TCP,60,9001  >  35978 [ACK] Seq=14453551 Ack=265049363 Win=65535 Len=0
1,1.2870419999999285,62.210.85.178,10.0.2.15,TCP,60,9001  >  35978 [ACK] Seq=14453551 Ack=265050823 Win=65535 Len=0
1,1.2870459999994637,62.210.85.178,10.0.2.15,TCP,60,9001  >  35978 [ACK] Seq=14453551 Ack=265051973 Win=65535 Len=0
1,1.2870510000002469,62.210.85.178,10.0.2.15,TCP,60,9001  >  35978 [ACK] Seq=14453551 Ack=265053433 Win=65535 Len=0
1,1.287054999999782,62.210.85.178,10.0.2.15,TCP,60,9001  >  35978 [ACK] Seq=14453551 Ack=265054893 Win=65535 Len=0
1,1.2871029999996608,10.0.2.15,62.210.85.178,TLSv1.2,1204,Application Data
1,1.2876310000001467,62.210.85.178,10.0.2.15,TCP,60,9001  >  35978 [ACK] Seq=14453551 Ack=265056043 Win=65535 Len=0
1,1.2877129999997123,10.0.2.15,62.210.85.178,TLSv1.2,4124,Application Data
1,1.2878279999995357,62.210.85.178,10.0.2.15,TCP,60,9001  >  35978 [ACK] Seq=14453551 Ack=265057503 Win=65535 Len=0
1,1.2878389999996216,62.210.85.178,10.0.2.15,TCP,60,9001  >  35978 [ACK] Seq=14453551 Ack=265058963 Win=65535 Len=0
1,1.2878439999994953,62.210.85.178,10.0.2.15,TCP,60,9001  >  35978 [ACK] Seq=14453551 Ack=265060113 Win=65535 Len=0
1,1.2879130000001169,10.0.2.15,62.210.85.178,TLSv1.2,4124,Application Data
1,1.288010999999642,62.210.85.178,10.0.2.15,TCP,60,9001  >  35978 [ACK] Seq=14453551 Ack=265061573 Win=65535 Len=0
1,1.2880189999996219,62.210.85.178,10.0.2.15,TCP,60,9001  >  35978 [ACK] Seq=14453551 Ack=265063033 Win=65535 Len=0
1,1.2880239999994956,62.210.85.178,10.0.2.15,TCP,60,9001  >  35978 [ACK] Seq=14453551 Ack=265064183 Win=65535 Len=0
1,1.288058999999521,10.0.2.15,62.210.85.178,TLSv1.2,332,Application Data
1,1.2881059999999707,62.210.85.178,10.0.2.15,TCP,60,9001  >  35978 [ACK] Seq=14453551 Ack=265064461 Win=65535 Len=0
1,1.2881499999994048,10.0.2.15,62.210.85.178,TLSv1.2,3868,Application Data
1,1.2882159999999203,10.0.2.15,62.210.85.178,TCP,2974,35978  >  9001 [ACK] Seq=265068275 Ack=14453551 Win=65535 Len=2920 [TCP segment of a reassembled PDU]
1,1.2882570000001579,62.210.85.178,10.0.2.15,TCP,60,9001  >  35978 [ACK] Seq=14453551 Ack=265065921 Win=65535 Len=0
1,1.2882639999997991,62.210.85.178,10.0.2.15,TCP,60,9001  >  35978 [ACK] Seq=14453551 Ack=265067381 Win=65535 Len=0
1,1.2882680000002438,62.210.85.178,10.0.2.15,TCP,60,9001  >  35978 [ACK] Seq=14453551 Ack=265068275 Win=65535 Len=0
1,1.2882730000001175,62.210.85.178,10.0.2.15,TCP,60,9001  >  35978 [ACK] Seq=14453551 Ack=265069735 Win=65535 Len=0
1,1.2882769999996526,62.210.85.178,10.0.2.15,TCP,60,9001  >  35978 [ACK] Seq=14453551 Ack=265071195 Win=65535 Len=0
1,1.288314999999784,10.0.2.15,62.210.85.178,TLSv1.2,1204,Application Data
1,1.2883780000001934,10.0.2.15,62.210.85.178,TCP,2974,35978  >  9001 [ACK] Seq=265072345 Ack=14453551 Win=65535 Len=2920 [TCP segment of a reassembled PDU]
1,1.2884149999999863,62.210.85.178,10.0.2.15,TCP,60,9001  >  35978 [ACK] Seq=14453551 Ack=265072345 Win=65535 Len=0
1,1.2884219999996276,62.210.85.178,10.0.2.15,TCP,60,9001  >  35978 [ACK] Seq=14453551 Ack=265073805 Win=65535 Len=0
1,1.2884260000000722,62.210.85.178,10.0.2.15,TCP,60,9001  >  35978 [ACK] Seq=14453551 Ack=265075265 Win=65535 Len=0
1,1.288459999999759,10.0.2.15,62.210.85.178,TLSv1.2,110,Application Data
1,1.2885559999995166,62.210.85.178,10.0.2.15,TCP,60,9001  >  35978 [ACK] Seq=14453551 Ack=265075321 Win=65535 Len=0
1,1.297733999999764,10.0.2.15,62.210.85.178,TLSv1.2,4124,Application Data
1,1.2977940000000672,62.210.85.178,10.0.2.15,TCP,60,9001  >  35978 [ACK] Seq=14453551 Ack=265076781 Win=65535 Len=0
1,1.2978059999995821,62.210.85.178,10.0.2.15,TCP,60,9001  >  35978 [ACK] Seq=14453551 Ack=265078241 Win=65535 Len=0
1,1.2978109999994558,62.210.85.178,10.0.2.15,TCP,60,9001  >  35978 [ACK] Seq=14453551 Ack=265079391 Win=65535 Len=0
1,1.2978579999999056,10.0.2.15,62.210.85.178,TLSv1.2,4124,Application Data
1,1.2978999999995722,62.210.85.178,10.0.2.15,TCP,60,9001  >  35978 [ACK] Seq=14453551 Ack=265080851 Win=65535 Len=0
1,1.297907999999552,62.210.85.178,10.0.2.15,TCP,60,9001  >  35978 [ACK] Seq=14453551 Ack=265082311 Win=65535 Len=0
1,1.2979129999994257,62.210.85.178,10.0.2.15,TCP,60,9001  >  35978 [ACK] Seq=14453551 Ack=265083461 Win=65535 Len=0
1,1.2979530000002342,10.0.2.15,62.210.85.178,TLSv1.2,4124,Application Data
1,1.2980219999999463,62.210.85.178,10.0.2.15,TCP,60,9001  >  35978 [ACK] Seq=14453551 Ack=265084921 Win=65535 Len=0
1,1.2980309999993551,62.210.85.178,10.0.2.15,TCP,60,9001  >  35978 [ACK] Seq=14453551 Ack=265086381 Win=65535 Len=0
1,1.2980339999994612,62.210.85.178,10.0.2.15,TCP,60,9001  >  35978 [ACK] Seq=14453551 Ack=265087531 Win=65535 Len=0
1,1.2980779999998049,10.0.2.15,62.210.85.178,TLSv1.2,4124,Application Data
1,1.2981220000001485,62.210.85.178,10.0.2.15,TCP,60,9001  >  35978 [ACK] Seq=14453551 Ack=265088991 Win=65535 Len=0
1,1.2981300000001283,62.210.85.178,10.0.2.15,TCP,60,9001  >  35978 [ACK] Seq=14453551 Ack=265090451 Win=65535 Len=0
1,1.298135000000002,62.210.85.178,10.0.2.15,TCP,60,9001  >  35978 [ACK] Seq=14453551 Ack=265091601 Win=65535 Len=0
1,1.2981709999994564,10.0.2.15,62.210.85.178,TLSv1.2,332,Application Data
1,1.2982080000001588,62.210.85.178,10.0.2.15,TCP,60,9001  >  35978 [ACK] Seq=14453551 Ack=265091879 Win=65535 Len=0
1,1.2982640000000174,10.0.2.15,62.210.85.178,TLSv1.2,3868,Application Data
1,1.2983029999995779,62.210.85.178,10.0.2.15,TCP,60,9001  >  35978 [ACK] Seq=14453551 Ack=265093339 Win=65535 Len=0
1,1.2983119999998962,62.210.85.178,10.0.2.15,TCP,60,9001  >  35978 [ACK] Seq=14453551 Ack=265094799 Win=65535 Len=0
1,1.2983159999994314,62.210.85.178,10.0.2.15,TCP,60,9001  >  35978 [ACK] Seq=14453551 Ack=265095693 Win=65535 Len=0
1,1.2983539999995628,10.0.2.15,62.210.85.178,TLSv1.2,4124,Application Data
1,1.2983930000000328,62.210.85.178,10.0.2.15,TCP,60,9001  >  35978 [ACK] Seq=14453551 Ack=265097153 Win=65535 Len=0
1,1.2984010000000126,62.210.85.178,10.0.2.15,TCP,60,9001  >  35978 [ACK] Seq=14453551 Ack=265098613 Win=65535 Len=0
1,1.2984040000001187,62.210.85.178,10.0.2.15,TCP,60,9001  >  35978 [ACK] Seq=14453551 Ack=265099763 Win=65535 Len=0
1,1.298439999999573,10.0.2.15,62.210.85.178,TLSv1.2,3030,Application Data
1,1.298479999999472,62.210.85.178,10.0.2.15,TCP,60,9001  >  35978 [ACK] Seq=14453551 Ack=265101223 Win=65535 Len=0
1,1.2984870000000228,62.210.85.178,10.0.2.15,TCP,60,9001  >  35978 [ACK] Seq=14453551 Ack=265102683 Win=65535 Len=0
1,1.298490999999558,62.210.85.178,10.0.2.15,TCP,60,9001  >  35978 [ACK] Seq=14453551 Ack=265102739 Win=65535 Len=0
1,1.3108899999997448,10.0.2.15,62.210.85.178,TLSv1.2,2132,Application Data
1,1.3111250000001746,62.210.85.178,10.0.2.15,TCP,60,9001  >  35978 [ACK] Seq=14453551 Ack=265104199 Win=65535 Len=0
1,1.311146999999437,62.210.85.178,10.0.2.15,TCP,60,9001  >  35978 [ACK] Seq=14453551 Ack=265104817 Win=65535 Len=0
1,1.4266289999995934,54.93.77.70,10.0.2.15,TLSv1.2,7294,"Application Data, Application Data"
1,1.4267519999993965,10.0.2.15,54.93.77.70,TCP,54,34692  >  9001 [ACK] Seq=14550063 Ack=264978595 Win=65535 Len=0
1,1.4419639999996434,54.93.77.70,10.0.2.15,TLSv1.2,4724,"Application Data, Application Data"
1,1.4420239999999467,10.0.2.15,54.93.77.70,TCP,54,34692  >  9001 [ACK] Seq=14550063 Ack=264983265 Win=65535 Len=0
1,1.4713529999999082,54.93.77.70,10.0.2.15,TLSv1.2,3674,Application Data
1,1.4714059999996607,10.0.2.15,54.93.77.70,TCP,54,34692  >  9001 [ACK] Seq=14550063 Ack=264986885 Win=65535 Len=0
1,1.479110999999648,54.93.77.70,10.0.2.15,TCP,2950,"9001  >  34692 [PSH, ACK] Seq=264986885 Ack=14550063 Win=65535 Len=2896 [TCP segment of a reassembled PDU]"
1,1.4791299999997136,54.93.77.70,10.0.2.15,TLSv1.2,4398,Application Data [TCP segment of a reassembled PDU]
1,1.479164999999739,10.0.2.15,54.93.77.70,TCP,54,34692  >  9001 [ACK] Seq=14550063 Ack=264989781 Win=65535 Len=0
1,1.479233000000022,10.0.2.15,54.93.77.70,TCP,54,34692  >  9001 [ACK] Seq=14550063 Ack=264994125 Win=65535 Len=0
1,1.4793650000001435,10.0.2.15,54.93.77.70,TLSv1.2,590,Application Data
1,1.4794560000000274,54.93.77.70,10.0.2.15,TCP,60,9001  >  34692 [ACK] Seq=264994125 Ack=14550599 Win=65535 Len=0
1,1.488524999999754,54.93.77.70,10.0.2.15,TLSv1.2,568,Application Data
1,1.4994449999994686,54.93.77.70,10.0.2.15,TLSv1.2,7294,Application Data
1,1.4995049999997718,10.0.2.15,54.93.77.70,TCP,54,34692  >  9001 [ACK] Seq=14550599 Ack=265001879 Win=65535 Len=0
1,1.4996620000001712,10.0.2.15,54.93.77.70,TLSv1.2,590,Application Data
1,1.4997439999997368,54.93.77.70,10.0.2.15,TCP,60,9001  >  34692 [ACK] Seq=265001879 Ack=14551135 Win=65535 Len=0
1,1.5165699999997742,54.93.77.70,10.0.2.15,TLSv1.2,1104,"Application Data, Application Data"
1,1.5203169999995225,54.93.77.70,10.0.2.15,TLSv1.2,7294,"Application Data, Application Data"
1,1.5203609999998662,10.0.2.15,54.93.77.70,TCP,54,34692  >  9001 [ACK] Seq=14551135 Ack=265010169 Win=65535 Len=0
1,1.534295999999813,54.93.77.70,10.0.2.15,TLSv1.2,7294,Application Data
1,1.5343419999999242,10.0.2.15,54.93.77.70,TCP,54,34692  >  9001 [ACK] Seq=14551135 Ack=265017409 Win=65535 Len=0
1,1.537322000000131,54.93.77.70,10.0.2.15,TLSv1.2,568,Application Data
1,1.5632630000000063,54.93.77.70,10.0.2.15,TLSv1.2,2950,Application Data
1,1.5633499999994456,10.0.2.15,54.93.77.70,TCP,54,34692  >  9001 [ACK] Seq=14551135 Ack=265020819 Win=65535 Len=0
1,1.564209000000119,54.93.77.70,10.0.2.15,TCP,1502,"9001  >  34692 [PSH, ACK] Seq=265020819 Ack=14551135 Win=65535 Len=1448 [TCP segment of a reassembled PDU]"
1,1.564473999999791,10.0.2.15,54.93.77.70,TCP,54,34692  >  9001 [ACK] Seq=14551135 Ack=265022267 Win=65535 Len=0
1,1.5655660000002172,54.93.77.70,10.0.2.15,TLSv1.2,2950,Application Data [TCP segment of a reassembled PDU]
1,1.5658610000000408,10.0.2.15,54.93.77.70,TCP,54,34692  >  9001 [ACK] Seq=14551135 Ack=265025163 Win=65535 Len=0
1,1.5828369999999268,54.93.77.70,10.0.2.15,TLSv1.2,590,Application Data
1,1.5830729999997857,10.0.2.15,54.93.77.70,TLSv1.2,590,Application Data
1,1.5831749999997555,54.93.77.70,10.0.2.15,TCP,60,9001  >  34692 [ACK] Seq=265025699 Ack=14551671 Win=65535 Len=0
1,1.5953760000002148,54.93.77.70,10.0.2.15,TCP,2950,"9001  >  34692 [PSH, ACK] Seq=265025699 Ack=14551671 Win=65535 Len=2896 [TCP segment of a reassembled PDU]"
1,1.5954609999998866,10.0.2.15,54.93.77.70,TCP,54,34692  >  9001 [ACK] Seq=14551671 Ack=265028595 Win=65535 Len=0
1,1.6018309999999474,54.93.77.70,10.0.2.15,TLSv1.2,264,Application Data
1,1.6044929999998203,10.0.2.15,54.93.77.70,TLSv1.2,590,Application Data
1,1.6046360000000277,54.93.77.70,10.0.2.15,TCP,60,9001  >  34692 [ACK] Seq=265028805 Ack=14552207 Win=65535 Len=0
1,1.6104459999996834,62.210.85.178,10.0.2.15,TLSv1.2,1104,Application Data
1,1.6540969999996378,10.0.2.15,62.210.85.178,TCP,54,35978  >  9001 [ACK] Seq=265104817 Ack=14454601 Win=65535 Len=0
1,1.7216220000000249,62.210.85.178,10.0.2.15,TLSv1.2,590,Application Data
1,1.7217259999997623,10.0.2.15,62.210.85.178,TCP,54,35978  >  9001 [ACK] Seq=265104817 Ack=14455137 Win=65535 Len=0
1,1.8166270000001532,62.210.85.178,10.0.2.15,TLSv1.2,590,Application Data
1,1.8167130000001634,10.0.2.15,62.210.85.178,TCP,54,35978  >  9001 [ACK] Seq=265104817 Ack=14455673 Win=65535 Len=0
1,1.8172889999996187,10.0.2.15,62.210.85.178,TLSv1.2,590,Application Data
1,1.8174189999999726,62.210.85.178,10.0.2.15,TCP,60,9001  >  35978 [ACK] Seq=14455673 Ack=265105353 Win=65535 Len=0
1,1.922910000000229,54.93.77.70,10.0.2.15,TLSv1.2,590,Application Data
1,1.923345000000154,10.0.2.15,54.93.77.70,TLSv1.2,590,Application Data
1,1.9234779999997045,54.93.77.70,10.0.2.15,TCP,60,9001  >  34692 [ACK] Seq=265029341 Ack=14552743 Win=65535 Len=0
1,2.0317409999997835,62.210.85.178,10.0.2.15,TLSv1.2,590,Application Data
1,2.0396499999997104,10.0.2.15,62.210.85.178,TLSv1.2,590,Application Data
1,2.0398450000002413,62.210.85.178,10.0.2.15,TCP,60,9001  >  35978 [ACK] Seq=14456209 Ack=265105889 Win=65535 Len=0
1,2.0502299999998286,10.0.2.15,62.210.85.178,TLSv1.2,4124,Application Data
1,2.050387000000228,62.210.85.178,10.0.2.15,TCP,60,9001  >  35978 [ACK] Seq=14456209 Ack=265107349 Win=65535 Len=0
1,2.0504039999996166,62.210.85.178,10.0.2.15,TCP,60,9001  >  35978 [ACK] Seq=14456209 Ack=265108809 Win=65535 Len=0
1,2.0504089999994903,62.210.85.178,10.0.2.15,TCP,60,9001  >  35978 [ACK] Seq=14456209 Ack=265109959 Win=65535 Len=0
1,2.0504469999996218,10.0.2.15,62.210.85.178,TCP,2974,35978  >  9001 [ACK] Seq=265109959 Ack=14456209 Win=65535 Len=2920 [TCP segment of a reassembled PDU]
1,2.050543999999718,10.0.2.15,62.210.85.178,TLSv1.2,1204,Application Data
1,2.0505880000000616,62.210.85.178,10.0.2.15,TCP,60,9001  >  35978 [ACK] Seq=14456209 Ack=265111419 Win=65535 Len=0
1,2.050594999999703,62.210.85.178,10.0.2.15,TCP,60,9001  >  35978 [ACK] Seq=14456209 Ack=265112879 Win=65535 Len=0
1,2.0506619999996474,62.210.85.178,10.0.2.15,TCP,60,9001  >  35978 [ACK] Seq=14456209 Ack=265114029 Win=65535 Len=0
1,2.0506969999996727,10.0.2.15,62.210.85.178,TCP,2974,35978  >  9001 [ACK] Seq=265114029 Ack=14456209 Win=65535 Len=2920 [TCP segment of a reassembled PDU]
1,2.0507509999997637,10.0.2.15,62.210.85.178,TLSv1.2,1204,Application Data
1,2.0507849999994505,62.210.85.178,10.0.2.15,TCP,60,9001  >  35978 [ACK] Seq=14456209 Ack=265115489 Win=65535 Len=0
1,2.0507920000000013,62.210.85.178,10.0.2.15,TCP,60,9001  >  35978 [ACK] Seq=14456209 Ack=265116949 Win=65535 Len=0
1,2.0507959999995364,62.210.85.178,10.0.2.15,TCP,60,9001  >  35978 [ACK] Seq=14456209 Ack=265118099 Win=65535 Len=0
1,2.05083999999988,10.0.2.15,62.210.85.178,TLSv1.2,4124,Application Data
1,2.0509320000001026,62.210.85.178,10.0.2.15,TCP,60,9001  >  35978 [ACK] Seq=14456209 Ack=265119559 Win=65535 Len=0
1,2.0509400000000824,62.210.85.178,10.0.2.15,TCP,60,9001  >  35978 [ACK] Seq=14456209 Ack=265121019 Win=65535 Len=0
1,2.050944999999956,62.210.85.178,10.0.2.15,TCP,60,9001  >  35978 [ACK] Seq=14456209 Ack=265122169 Win=65535 Len=0
1,2.050978999999643,10.0.2.15,62.210.85.178,TLSv1.2,332,Application Data
1,2.0510409999997137,10.0.2.15,62.210.85.178,TCP,2974,35978  >  9001 [ACK] Seq=265122447 Ack=14456209 Win=65535 Len=2920 [TCP segment of a reassembled PDU]
1,2.0510770000000775,62.210.85.178,10.0.2.15,TCP,60,9001  >  35978 [ACK] Seq=14456209 Ack=265122447 Win=65535 Len=0
1,2.051083999999719,62.210.85.178,10.0.2.15,TCP,60,9001  >  35978 [ACK] Seq=14456209 Ack=265123907 Win=65535 Len=0
1,2.0510880000001634,62.210.85.178,10.0.2.15,TCP,60,9001  >  35978 [ACK] Seq=14456209 Ack=265125367 Win=65535 Len=0
1,2.0511219999998502,10.0.2.15,62.210.85.178,TLSv1.2,948,Application Data
1,2.051158999999643,62.210.85.178,10.0.2.15,TCP,60,9001  >  35978 [ACK] Seq=14456209 Ack=265126261 Win=65535 Len=0
1,2.0512049999997544,10.0.2.15,62.210.85.178,TLSv1.2,4124,Application Data
1,2.0512440000002243,62.210.85.178,10.0.2.15,TCP,60,9001  >  35978 [ACK] Seq=14456209 Ack=265127721 Win=65535 Len=0
1,2.0512509999998656,62.210.85.178,10.0.2.15,TCP,60,9001  >  35978 [ACK] Seq=14456209 Ack=265129181 Win=65535 Len=0
1,2.0512549999994008,62.210.85.178,10.0.2.15,TCP,60,9001  >  35978 [ACK] Seq=14456209 Ack=265130331 Win=65535 Len=0
1,2.051300999999512,10.0.2.15,62.210.85.178,TLSv1.2,3030,Application Data
1,2.051339999999982,62.210.85.178,10.0.2.15,TCP,60,9001  >  35978 [ACK] Seq=14456209 Ack=265131791 Win=65535 Len=0
1,2.051346000000194,62.210.85.178,10.0.2.15,TCP,60,9001  >  35978 [ACK] Seq=14456209 Ack=265133251 Win=65535 Len=0
1,2.051351000000068,62.210.85.178,10.0.2.15,TCP,60,9001  >  35978 [ACK] Seq=14456209 Ack=265133307 Win=65535 Len=0
1,2.062707999999475,10.0.2.15,62.210.85.178,TLSv1.2,4124,Application Data
1,2.0627999999996973,10.0.2.15,62.210.85.178,TCP,2974,35978  >  9001 [ACK] Seq=265137377 Ack=14456209 Win=65535 Len=2920 [TCP segment of a reassembled PDU]
1,2.0628399999995963,62.210.85.178,10.0.2.15,TCP,60,9001  >  35978 [ACK] Seq=14456209 Ack=265134767 Win=65535 Len=0
1,2.062847999999576,62.210.85.178,10.0.2.15,TCP,60,9001  >  35978 [ACK] Seq=14456209 Ack=265136227 Win=65535 Len=0
1,2.06285299999945,62.210.85.178,10.0.2.15,TCP,60,9001  >  35978 [ACK] Seq=14456209 Ack=265137377 Win=65535 Len=0
1,2.0628569999998945,62.210.85.178,10.0.2.15,TCP,60,9001  >  35978 [ACK] Seq=14456209 Ack=265138837 Win=65535 Len=0
1,2.062861999999768,62.210.85.178,10.0.2.15,TCP,60,9001  >  35978 [ACK] Seq=14456209 Ack=265140297 Win=65535 Len=0
1,2.062901999999667,10.0.2.15,62.210.85.178,TLSv1.2,1204,Application Data
1,2.062974999999824,62.210.85.178,10.0.2.15,TCP,60,9001  >  35978 [ACK] Seq=14456209 Ack=265141447 Win=65535 Len=0
1,2.0630129999999554,10.0.2.15,62.210.85.178,TLSv1.2,4124,Application Data
1,2.0630499999997483,62.210.85.178,10.0.2.15,TCP,60,9001  >  35978 [ACK] Seq=14456209 Ack=265142907 Win=65535 Len=0
1,2.0630559999999605,62.210.85.178,10.0.2.15,TCP,60,9001  >  35978 [ACK] Seq=14456209 Ack=265144367 Win=65535 Len=0
1,2.063060999999834,62.210.85.178,10.0.2.15,TCP,60,9001  >  35978 [ACK] Seq=14456209 Ack=265145517 Win=65535 Len=0
1,2.0631069999999454,10.0.2.15,62.210.85.178,TLSv1.2,4124,Application Data
1,2.0632009999999354,10.0.2.15,62.210.85.178,TLSv1.2,2974,Application Data
1,2.0632230000001073,62.210.85.178,10.0.2.15,TCP,60,9001  >  35978 [ACK] Seq=14456209 Ack=265146977 Win=65535 Len=0
1,2.0632299999997485,62.210.85.178,10.0.2.15,TCP,60,9001  >  35978 [ACK] Seq=14456209 Ack=265148437 Win=65535 Len=0
1,2.0632349999996222,62.210.85.178,10.0.2.15,TCP,60,9001  >  35978 [ACK] Seq=14456209 Ack=265149587 Win=65535 Len=0
1,2.0632699999996476,10.0.2.15,62.210.85.178,TLSv1.2,1226,Application Data
1,2.063304999999673,62.210.85.178,10.0.2.15,TCP,60,9001  >  35978 [ACK] Seq=14456209 Ack=265151047 Win=65535 Len=0
1,2.0633120000002236,62.210.85.178,10.0.2.15,TCP,60,9001  >  35978 [ACK] Seq=14456209 Ack=265152507 Win=65535 Len=0
1,2.063315999999759,62.210.85.178,10.0.2.15,TCP,60,9001  >  35978 [ACK] Seq=14456209 Ack=265153679 Win=65535 Len=0
1,2.06336199999987,10.0.2.15,62.210.85.178,TLSv1.2,4124,Application Data
1,2.0634009999994305,62.210.85.178,10.0.2.15,TCP,60,9001  >  35978 [ACK] Seq=14456209 Ack=265155139 Win=65535 Len=0
1,2.0634069999996427,62.210.85.178,10.0.2.15,TCP,60,9001  >  35978 [ACK] Seq=14456209 Ack=265156599 Win=65535 Len=0
1,2.0634119999995164,62.210.85.178,10.0.2.15,TCP,60,9001  >  35978 [ACK] Seq=14456209 Ack=265157749 Win=65535 Len=0
1,2.0634570000001986,10.0.2.15,62.210.85.178,TLSv1.2,2002,Application Data
1,2.0634949999994205,62.210.85.178,10.0.2.15,TCP,60,9001  >  35978 [ACK] Seq=14456209 Ack=265159209 Win=65535 Len=0
1,2.0635019999999713,62.210.85.178,10.0.2.15,TCP,60,9001  >  35978 [ACK] Seq=14456209 Ack=265159697 Win=65535 Len=0
1,2.1518319999995583,54.93.77.70,10.0.2.15,TLSv1.2,590,Application Data
1,2.172236999999768,54.93.77.70,10.0.2.15,TCP,2950,"9001  >  34692 [PSH, ACK] Seq=265029877 Ack=14552743 Win=65535 Len=2896 [TCP segment of a reassembled PDU]"
1,2.172341999999844,10.0.2.15,54.93.77.70,TCP,54,34692  >  9001 [ACK] Seq=14552743 Ack=265032773 Win=65535 Len=0
1,2.1734529999994265,54.93.77.70,10.0.2.15,TLSv1.2,8574,"Application Data, Application Data"
1,2.1735069999995176,10.0.2.15,54.93.77.70,TCP,54,34692  >  9001 [ACK] Seq=14552743 Ack=265041293 Win=65535 Len=0
1,2.1735509999998612,54.93.77.70,10.0.2.15,TCP,222,"9001  >  34692 [PSH, ACK] Seq=265041293 Ack=14552743 Win=65535 Len=168 [TCP segment of a reassembled PDU]"
1,2.190676000000167,54.93.77.70,10.0.2.15,TLSv1.2,3464,"Application Data, Application Data"
1,2.1907759999994596,10.0.2.15,54.93.77.70,TCP,54,34692  >  9001 [ACK] Seq=14552743 Ack=265044871 Win=65535 Len=0
1,2.1910980000002382,10.0.2.15,54.93.77.70,TLSv1.2,590,Application Data
1,2.191211999999723,54.93.77.70,10.0.2.15,TCP,60,9001  >  34692 [ACK] Seq=265044871 Ack=14553279 Win=65535 Len=0
1,2.279602999999952,54.93.77.70,10.0.2.15,TLSv1.2,3674,Application Data
1,2.2796870000001945,10.0.2.15,54.93.77.70,TCP,54,34692  >  9001 [ACK] Seq=14553279 Ack=265048491 Win=65535 Len=0
1,2.301249000000098,54.93.77.70,10.0.2.15,TLSv1.2,590,Application Data
1,2.3140880000000834,54.93.77.70,10.0.2.15,TCP,2950,"9001  >  34692 [PSH, ACK] Seq=265049027 Ack=14553279 Win=65535 Len=2896 [TCP segment of a reassembled PDU]"
1,2.314220999999634,54.93.77.70,10.0.2.15,TLSv1.2,4398,"Application Data, Application Data"
1,2.3144099999999526,10.0.2.15,54.93.77.70,TCP,54,34692  >  9001 [ACK] Seq=14553279 Ack=265051923 Win=65535 Len=0
1,2.314781000000039,10.0.2.15,54.93.77.70,TCP,54,34692  >  9001 [ACK] Seq=14553279 Ack=265056267 Win=65535 Len=0
1,2.315472000000227,10.0.2.15,54.93.77.70,TLSv1.2,590,Application Data
1,2.3162969999993948,54.93.77.70,10.0.2.15,TCP,60,9001  >  34692 [ACK] Seq=265056267 Ack=14553815 Win=65535 Len=0
1,2.329956999999922,54.93.77.70,10.0.2.15,TLSv1.2,7294,Application Data
1,2.3302560000001904,10.0.2.15,54.93.77.70,TCP,54,34692  >  9001 [ACK] Seq=14553815 Ack=265063507 Win=65535 Len=0
1,2.3339369999994233,54.93.77.70,10.0.2.15,TLSv1.2,1104,"Application Data, Application Data"
1,2.3413979999995718,54.93.77.70,10.0.2.15,TCP,2950,"9001  >  34692 [PSH, ACK] Seq=265064557 Ack=14553815 Win=65535 Len=2896 [TCP segment of a reassembled PDU]"
1,2.3414679999996224,10.0.2.15,54.93.77.70,TCP,54,34692  >  9001 [ACK] Seq=14553815 Ack=265067453 Win=65535 Len=0
1,2.3446500000000015,62.210.85.178,10.0.2.15,TLSv1.2,590,Application Data
1,2.351227000000108,54.93.77.70,10.0.2.15,TLSv1.2,1502,Application Data [TCP segment of a reassembled PDU]
1,2.3512769999997545,10.0.2.15,54.93.77.70,TCP,54,34692  >  9001 [ACK] Seq=14553815 Ack=265068901 Win=65535 Len=0
1,2.357256000000234,54.93.77.70,10.0.2.15,TLSv1.2,4398,Application Data [TCP segment of a reassembled PDU]
1,2.3573379999997996,10.0.2.15,54.93.77.70,TCP,54,34692  >  9001 [ACK] Seq=14553815 Ack=265073245 Win=65535 Len=0
1,2.3860459999996237,10.0.2.15,62.210.85.178,TCP,54,35978  >  9001 [ACK] Seq=265159697 Ack=14456745 Win=65535 Len=0
1,2.471875999999611,54.93.77.70,10.0.2.15,TLSv1.2,2950,Application Data [TCP segment of a reassembled PDU]
1,2.4719649999997273,10.0.2.15,54.93.77.70,TCP,54,34692  >  9001 [ACK] Seq=14553815 Ack=265076141 Win=65535 Len=0
1,2.473460000000159,54.93.77.70,10.0.2.15,TLSv1.2,2972,"Application Data, Application Data"
1,2.473479999999654,54.93.77.70,10.0.2.15,TLSv1.2,4210,"Application Data, Application Data"
1,2.4735289999998713,10.0.2.15,54.93.77.70,TCP,54,34692  >  9001 [ACK] Seq=14553815 Ack=265079059 Win=65535 Len=0
1,2.473653999999442,10.0.2.15,54.93.77.70,TCP,54,34692  >  9001 [ACK] Seq=14553815 Ack=265083215 Win=65535 Len=0
1,2.473994999999377,10.0.2.15,54.93.77.70,TLSv1.2,590,Application Data
1,2.4741370000001552,54.93.77.70,10.0.2.15,TCP,60,9001  >  34692 [ACK] Seq=265083215 Ack=14554351 Win=65535 Len=0
1,2.475160999999389,62.210.85.178,10.0.2.15,TLSv1.2,590,Application Data
1,2.4752189999999246,10.0.2.15,62.210.85.178,TCP,54,35978  >  9001 [ACK] Seq=265159697 Ack=14457281 Win=65535 Len=0
1,2.477538999999524,10.0.2.15,54.93.77.70,TLSv1.2,590,Application Data
1,2.477708999999777,54.93.77.70,10.0.2.15,TCP,60,9001  >  34692 [ACK] Seq=265083215 Ack=14554887 Win=65535 Len=0
1,2.4904239999996207,54.93.77.70,10.0.2.15,TLSv1.2,590,Application Data
1,2.490534999999909,10.0.2.15,54.93.77.70,TLSv1.2,590,Application Data
1,2.4906590000000506,54.93.77.70,10.0.2.15,TCP,60,9001  >  34692 [ACK] Seq=265083751 Ack=14555423 Win=65535 Len=0
1,2.6281349999999293,62.210.85.178,10.0.2.15,TLSv1.2,590,Application Data
1,2.6282380000002377,10.0.2.15,62.210.85.178,TCP,54,35978  >  9001 [ACK] Seq=265159697 Ack=14457817 Win=65535 Len=0
1,2.7718979999999647,62.210.85.178,10.0.2.15,TLSv1.2,1104,Application Data
1,2.7719829999996364,10.0.2.15,62.210.85.178,TCP,54,35978  >  9001 [ACK] Seq=265159697 Ack=14458867 Win=65535 Len=0
1,2.7723500000001877,10.0.2.15,62.210.85.178,TLSv1.2,590,Application Data
1,2.772428000000218,62.210.85.178,10.0.2.15,TCP,60,9001  >  35978 [ACK] Seq=14458867 Ack=265160233 Win=65535 Len=0
1,2.929200999999921,54.93.77.70,10.0.2.15,TLSv1.2,590,Application Data
1,2.929653999999573,10.0.2.15,54.93.77.70,TLSv1.2,590,Application Data
1,2.9297609999994165,54.93.77.70,10.0.2.15,TCP,60,9001  >  34692 [ACK] Seq=265084287 Ack=14555959 Win=65535 Len=0
1,3.084976000000097,62.210.85.178,10.0.2.15,TLSv1.2,590,Application Data
1,3.089657999999872,10.0.2.15,62.210.85.178,TLSv1.2,590,Application Data
1,3.0898209999995743,62.210.85.178,10.0.2.15,TCP,60,9001  >  35978 [ACK] Seq=14459403 Ack=265160769 Win=65535 Len=0
1,3.098124999999527,10.0.2.15,62.210.85.178,TLSv1.2,4124,Application Data
1,3.0982139999996434,10.0.2.15,62.210.85.178,TCP,2974,35978  >  9001 [ACK] Seq=265164839 Ack=14459403 Win=65535 Len=2920 [TCP segment of a reassembled PDU]
1,3.098257999999987,62.210.85.178,10.0.2.15,TCP,60,9001  >  35978 [ACK] Seq=14459403 Ack=265162229 Win=65535 Len=0
1,3.0982709999998406,62.210.85.178,10.0.2.15,TCP,60,9001  >  35978 [ACK] Seq=14459403 Ack=265163689 Win=65535 Len=0
1,3.0982749999993757,62.210.85.178,10.0.2.15,TCP,60,9001  >  35978 [ACK] Seq=14459403 Ack=265164839 Win=65535 Len=0
1,3.098277000000053,62.210.85.178,10.0.2.15,TCP,60,9001  >  35978 [ACK] Seq=14459403 Ack=265166299 Win=65535 Len=0
1,3.098280000000159,62.210.85.178,10.0.2.15,TCP,60,9001  >  35978 [ACK] Seq=14459403 Ack=265167759 Win=65535 Len=0
1,3.0983139999998457,10.0.2.15,62.210.85.178,TLSv1.2,1204,Application Data
1,3.0983479999995325,62.210.85.178,10.0.2.15,TCP,60,9001  >  35978 [ACK] Seq=14459403 Ack=265168909 Win=65535 Len=0
1,3.098391999999876,10.0.2.15,62.210.85.178,TLSv1.2,4124,Application Data
1,3.0984269999999015,62.210.85.178,10.0.2.15,TCP,60,9001  >  35978 [ACK] Seq=14459403 Ack=265170369 Win=65535 Len=0
1,3.0984349999998813,62.210.85.178,10.0.2.15,TCP,60,9001  >  35978 [ACK] Seq=14459403 Ack=265171829 Win=65535 Len=0
1,3.0984379999999874,62.210.85.178,10.0.2.15,TCP,60,9001  >  35978 [ACK] Seq=14459403 Ack=265172979 Win=65535 Len=0
1,3.098476000000119,10.0.2.15,62.210.85.178,TLSv1.2,4124,Application Data
1,3.098508999999467,62.210.85.178,10.0.2.15,TCP,60,9001  >  35978 [ACK] Seq=14459403 Ack=265174439 Win=65535 Len=0
1,3.098516000000018,62.210.85.178,10.0.2.15,TCP,60,9001  >  35978 [ACK] Seq=14459403 Ack=265175899 Win=65535 Len=0
1,3.0985689999997703,10.0.2.15,62.210.85.178,TLSv1.2,2974,Application Data
1,3.098605999999563,62.210.85.178,10.0.2.15,TCP,60,9001  >  35978 [ACK] Seq=14459403 Ack=265177049 Win=65535 Len=0
1,3.098613000000114,62.210.85.178,10.0.2.15,TCP,60,9001  >  35978 [ACK] Seq=14459403 Ack=265178509 Win=65535 Len=0
1,3.09861600000022,62.210.85.178,10.0.2.15,TCP,60,9001  >  35978 [ACK] Seq=14459403 Ack=265179969 Win=65535 Len=0
1,3.098642999999356,10.0.2.15,62.210.85.178,TLSv1.2,1226,Application Data
1,3.098675999999614,62.210.85.178,10.0.2.15,TCP,60,9001  >  35978 [ACK] Seq=14459403 Ack=265181141 Win=65535 Len=0
1,3.098715000000084,10.0.2.15,62.210.85.178,TLSv1.2,4124,Application Data
1,3.0987489999997706,62.210.85.178,10.0.2.15,TCP,60,9001  >  35978 [ACK] Seq=14459403 Ack=265182601 Win=65535 Len=0
1,3.098754999999983,62.210.85.178,10.0.2.15,TCP,60,9001  >  35978 [ACK] Seq=14459403 Ack=265184061 Win=65535 Len=0
1,3.098758999999518,62.210.85.178,10.0.2.15,TCP,60,9001  >  35978 [ACK] Seq=14459403 Ack=265185211 Win=65535 Len=0
1,3.098794999999882,10.0.2.15,62.210.85.178,TLSv1.2,3030,Application Data
1,3.0988289999995686,62.210.85.178,10.0.2.15,TCP,60,9001  >  35978 [ACK] Seq=14459403 Ack=265186671 Win=65535 Len=0
1,3.098834999999781,62.210.85.178,10.0.2.15,TCP,60,9001  >  35978 [ACK] Seq=14459403 Ack=265188131 Win=65535 Len=0
1,3.098837999999887,62.210.85.178,10.0.2.15,TCP,60,9001  >  35978 [ACK] Seq=14459403 Ack=265188187 Win=65535 Len=0
1,3.1103349999993952,10.0.2.15,62.210.85.178,TLSv1.2,4124,Application Data
1,3.110439999999471,62.210.85.178,10.0.2.15,TCP,60,9001  >  35978 [ACK] Seq=14459403 Ack=265189647 Win=65535 Len=0
1,3.1104550000000017,62.210.85.178,10.0.2.15,TCP,60,9001  >  35978 [ACK] Seq=14459403 Ack=265191107 Win=65535 Len=0
1,3.110458999999537,62.210.85.178,10.0.2.15,TCP,60,9001  >  35978 [ACK] Seq=14459403 Ack=265192257 Win=65535 Len=0
1,3.110498000000007,10.0.2.15,62.210.85.178,TLSv1.2,4124,Application Data
1,3.110552000000098,62.210.85.178,10.0.2.15,TCP,60,9001  >  35978 [ACK] Seq=14459403 Ack=265193717 Win=65535 Len=0
1,3.110558999999739,62.210.85.178,10.0.2.15,TCP,60,9001  >  35978 [ACK] Seq=14459403 Ack=265195177 Win=65535 Len=0
1,3.1105619999998453,62.210.85.178,10.0.2.15,TCP,60,9001  >  35978 [ACK] Seq=14459403 Ack=265196327 Win=65535 Len=0
1,3.1106049999998504,10.0.2.15,62.210.85.178,TLSv1.2,4124,Application Data
1,3.110700000000179,62.210.85.178,10.0.2.15,TCP,60,9001  >  35978 [ACK] Seq=14459403 Ack=265197787 Win=65535 Len=0
1,3.1107069999998203,62.210.85.178,10.0.2.15,TCP,60,9001  >  35978 [ACK] Seq=14459403 Ack=265199247 Win=65535 Len=0
1,3.1107099999999264,62.210.85.178,10.0.2.15,TCP,60,9001  >  35978 [ACK] Seq=14459403 Ack=265200397 Win=65535 Len=0
1,3.110748000000058,10.0.2.15,62.210.85.178,TLSv1.2,2838,Application Data
1,3.1107819999997446,62.210.85.178,10.0.2.15,TCP,60,9001  >  35978 [ACK] Seq=14459403 Ack=265201857 Win=65535 Len=0
1,3.1107899999997244,62.210.85.178,10.0.2.15,TCP,60,9001  >  35978 [ACK] Seq=14459403 Ack=265203181 Win=65535 Len=0
1,3.410707000000002,54.93.77.70,10.0.2.15,TLSv1.2,5846,Application Data
1,3.4107450000001336,54.93.77.70,10.0.2.15,TLSv1.2,3066,"Application Data, Application Data"
1,3.4107509999994363,54.93.77.70,10.0.2.15,TLSv1.2,4398,Application Data
1,3.4108509999996386,10.0.2.15,54.93.77.70,TCP,54,34692  >  9001 [ACK] Seq=14555959 Ack=265097435 Win=65535 Len=0
1,3.411189999999806,10.0.2.15,54.93.77.70,TLSv1.2,590,Application Data
1,3.4112599999998565,54.93.77.70,10.0.2.15,TCP,60,9001  >  34692 [ACK] Seq=265097435 Ack=14556495 Win=65535 Len=0
1,3.4298689999995986,54.93.77.70,10.0.2.15,TLSv1.2,5846,Application Data [TCP segment of a reassembled PDU]
1,3.4299000000000888,54.93.77.70,10.0.2.15,TLSv1.2,8554,"Application Data, Application Data, Application Data, Application Data"
1,3.4299529999998413,10.0.2.15,54.93.77.70,TCP,54,34692  >  9001 [ACK] Seq=14556495 Ack=265103227 Win=65535 Len=0
1,3.4300499999999374,10.0.2.15,54.93.77.70,TCP,54,34692  >  9001 [ACK] Seq=14556495 Ack=265111727 Win=65535 Len=0
1,3.430441999999857,10.0.2.15,54.93.77.70,TLSv1.2,590,Application Data
1,3.430547999999362,54.93.77.70,10.0.2.15,TCP,60,9001  >  34692 [ACK] Seq=265111727 Ack=14557031 Win=65535 Len=0
1,3.5482569999994666,54.93.77.70,10.0.2.15,TCP,2950,"9001  >  34692 [PSH, ACK] Seq=265111727 Ack=14557031 Win=65535 Len=2896 [TCP segment of a reassembled PDU]"
1,3.548345999999583,10.0.2.15,54.93.77.70,TCP,54,34692  >  9001 [ACK] Seq=14557031 Ack=265114623 Win=65535 Len=0
1,3.5526890000001004,54.93.77.70,10.0.2.15,TLSv1.2,5846,"Application Data, Application Data"
1,3.552713999999469,54.93.77.70,10.0.2.15,TCP,2950,"9001  >  34692 [PSH, ACK] Seq=265120415 Ack=14557031 Win=65535 Len=2896 [TCP segment of a reassembled PDU]"
1,3.552810000000136,10.0.2.15,54.93.77.70,TCP,54,34692  >  9001 [ACK] Seq=14557031 Ack=265123311 Win=65535 Len=0
1,3.553675000000112,62.210.85.178,10.0.2.15,TLSv1.2,590,Application Data
1,3.567570999999589,54.93.77.70,10.0.2.15,TLSv1.2,358,Application Data
1,3.5940270000000965,10.0.2.15,62.210.85.178,TCP,54,35978  >  9001 [ACK] Seq=265203181 Ack=14459939 Win=65535 Len=0
1,3.6102719999998953,10.0.2.15,54.93.77.70,TCP,54,34692  >  9001 [ACK] Seq=14557031 Ack=265123615 Win=65535 Len=0
1,3.693717000000106,54.93.77.70,10.0.2.15,TCP,2950,"9001  >  34692 [PSH, ACK] Seq=265123615 Ack=14557031 Win=65535 Len=2896 [TCP segment of a reassembled PDU]"
1,3.6938030000001163,10.0.2.15,54.93.77.70,TCP,54,34692  >  9001 [ACK] Seq=14557031 Ack=265126511 Win=65535 Len=0
1,3.709429999999884,54.93.77.70,10.0.2.15,TLSv1.2,778,Application Data
1,3.709490000000187,10.0.2.15,54.93.77.70,TCP,54,34692  >  9001 [ACK] Seq=14557031 Ack=265127235 Win=65535 Len=0
1,3.709668999999849,62.210.85.178,10.0.2.15,TLSv1.2,590,Application Data
1,3.7097130000001926,10.0.2.15,62.210.85.178,TCP,54,35978  >  9001 [ACK] Seq=265203181 Ack=14460475 Win=65535 Len=0
1,3.712126999999782,10.0.2.15,54.93.77.70,TLSv1.2,590,Application Data
1,3.7122709999994186,54.93.77.70,10.0.2.15,TCP,60,9001  >  34692 [ACK] Seq=265127235 Ack=14557567 Win=65535 Len=0
1,3.8556449999996403,62.210.85.178,10.0.2.15,TLSv1.2,590,Application Data
1,3.855731999999989,10.0.2.15,62.210.85.178,TCP,54,35978  >  9001 [ACK] Seq=265203181 Ack=14461011 Win=65535 Len=0
1,3.8563050000002477,10.0.2.15,62.210.85.178,TLSv1.2,590,Application Data
1,3.8564470000001165,62.210.85.178,10.0.2.15,TCP,60,9001  >  35978 [ACK] Seq=14461011 Ack=265203717 Win=65535 Len=0
1,4.005935999999565,54.93.77.70,10.0.2.15,TLSv1.2,590,Application Data
1,4.006451999999626,10.0.2.15,54.93.77.70,TLSv1.2,590,Application Data
1,4.00658999999996,54.93.77.70,10.0.2.15,TCP,60,9001  >  34692 [ACK] Seq=265127771 Ack=14558103 Win=65535 Len=0
1,4.163442999999461,62.210.85.178,10.0.2.15,TLSv1.2,590,Application Data
1,4.170384999999442,10.0.2.15,62.210.85.178,TLSv1.2,590,Application Data
1,4.170567999999548,62.210.85.178,10.0.2.15,TCP,60,9001  >  35978 [ACK] Seq=14461547 Ack=265204253 Win=65535 Len=0
1,4.182944000000134,10.0.2.15,62.210.85.178,TLSv1.2,4124,Application Data
1,4.183052999999745,10.0.2.15,62.210.85.178,TCP,2974,35978  >  9001 [ACK] Seq=265208323 Ack=14461547 Win=65535 Len=2920 [TCP segment of a reassembled PDU]
1,4.183094999999412,62.210.85.178,10.0.2.15,TCP,60,9001  >  35978 [ACK] Seq=14461547 Ack=265205713 Win=65535 Len=0
1,4.183105000000069,62.210.85.178,10.0.2.15,TCP,60,9001  >  35978 [ACK] Seq=14461547 Ack=265207173 Win=65535 Len=0
1,4.183108999999604,62.210.85.178,10.0.2.15,TCP,60,9001  >  35978 [ACK] Seq=14461547 Ack=265208323 Win=65535 Len=0
1,4.183110999999371,62.210.85.178,10.0.2.15,TCP,60,9001  >  35978 [ACK] Seq=14461547 Ack=265209783 Win=65535 Len=0
1,4.1831139999994775,62.210.85.178,10.0.2.15,TCP,60,9001  >  35978 [ACK] Seq=14461547 Ack=265211243 Win=65535 Len=0
1,4.183148000000074,10.0.2.15,62.210.85.178,TLSv1.2,1204,Application Data
1,4.183183000000099,62.210.85.178,10.0.2.15,TCP,60,9001  >  35978 [ACK] Seq=14461547 Ack=265212393 Win=65535 Len=0
1,4.183226000000104,10.0.2.15,62.210.85.178,TLSv1.2,4124,Application Data
1,4.18326100000013,62.210.85.178,10.0.2.15,TCP,60,9001  >  35978 [ACK] Seq=14461547 Ack=265213853 Win=65535 Len=0
1,4.183269000000109,62.210.85.178,10.0.2.15,TCP,60,9001  >  35978 [ACK] Seq=14461547 Ack=265215313 Win=65535 Len=0
1,4.1832720000002155,62.210.85.178,10.0.2.15,TCP,60,9001  >  35978 [ACK] Seq=14461547 Ack=265216463 Win=65535 Len=0
1,4.183309999999437,10.0.2.15,62.210.85.178,TLSv1.2,4124,Application Data
1,4.183344000000034,62.210.85.178,10.0.2.15,TCP,60,9001  >  35978 [ACK] Seq=14461547 Ack=265217923 Win=65535 Len=0
1,4.183350000000246,62.210.85.178,10.0.2.15,TCP,60,9001  >  35978 [ACK] Seq=14461547 Ack=265219383 Win=65535 Len=0
1,4.183353999999781,62.210.85.178,10.0.2.15,TCP,60,9001  >  35978 [ACK] Seq=14461547 Ack=265220533 Win=65535 Len=0
1,4.183387000000039,10.0.2.15,62.210.85.178,TLSv1.2,332,Application Data
1,4.183419999999387,62.210.85.178,10.0.2.15,TCP,60,9001  >  35978 [ACK] Seq=14461547 Ack=265220811 Win=65535 Len=0
1,4.183474999999817,10.0.2.15,62.210.85.178,TLSv1.2,3868,Application Data
1,4.1835110000001805,62.210.85.178,10.0.2.15,TCP,60,9001  >  35978 [ACK] Seq=14461547 Ack=265222271 Win=65535 Len=0
1,4.183516999999483,62.210.85.178,10.0.2.15,TCP,60,9001  >  35978 [ACK] Seq=14461547 Ack=265223731 Win=65535 Len=0
1,4.183520999999928,62.210.85.178,10.0.2.15,TCP,60,9001  >  35978 [ACK] Seq=14461547 Ack=265224625 Win=65535 Len=0
1,4.183559000000059,10.0.2.15,62.210.85.178,TLSv1.2,4124,Application Data
1,4.183592999999746,62.210.85.178,10.0.2.15,TCP,60,9001  >  35978 [ACK] Seq=14461547 Ack=265226085 Win=65535 Len=0
1,4.183599999999387,62.210.85.178,10.0.2.15,TCP,60,9001  >  35978 [ACK] Seq=14461547 Ack=265227545 Win=65535 Len=0
1,4.1836029999994935,62.210.85.178,10.0.2.15,TCP,60,9001  >  35978 [ACK] Seq=14461547 Ack=265228695 Win=65535 Len=0
1,4.183637999999519,10.0.2.15,62.210.85.178,TLSv1.2,3030,Application Data
1,4.183672000000115,62.210.85.178,10.0.2.15,TCP,60,9001  >  35978 [ACK] Seq=14461547 Ack=265230155 Win=65535 Len=0
