No.,Time,Source,Destination,Protocol,Length,Info
1,0.20377499999995052,10.0.2.15,54.93.77.70,TLSv1.2,590,Application Data
1,0.2039889999996376,54.93.77.70,10.0.2.15,TCP,60,9001  >  34692 [ACK] Seq=276220503 Ack=15147279 Win=65535 Len=0
1,0.31331000000045606,62.210.85.178,10.0.2.15,TLSv1.2,590,Application Data
1,0.3138150000004316,10.0.2.15,62.210.85.178,TLSv1.2,590,Application Data
1,0.3139369999998962,62.210.85.178,10.0.2.15,TCP,60,9001  >  35978 [ACK] Seq=15106213 Ack=276571341 Win=65535 Len=0
1,0.5559570000004896,54.93.77.70,10.0.2.15,TLSv1.2,590,Application Data
1,0.5560370000002877,10.0.2.15,54.93.77.70,TCP,54,34692  >  9001 [ACK] Seq=15147279 Ack=276221039 Win=65535 Len=0
1,0.5564430000003995,10.0.2.15,54.93.77.70,TLSv1.2,1618,Application Data
1,0.5565420000002632,54.93.77.70,10.0.2.15,TCP,60,9001  >  34692 [ACK] Seq=276221039 Ack=15148739 Win=65535 Len=0
1,0.5565530000003491,54.93.77.70,10.0.2.15,TCP,60,9001  >  34692 [ACK] Seq=276221039 Ack=15148843 Win=65535 Len=0
1,0.7556560000002719,62.210.85.178,10.0.2.15,TLSv1.2,1618,Application Data
1,0.755779000000075,10.0.2.15,62.210.85.178,TCP,54,35978  >  9001 [ACK] Seq=276571341 Ack=15107777 Win=65535 Len=0
1,0.7696299999997791,10.0.2.15,62.210.85.178,TLSv1.2,590,Application Data
1,0.7697879999996076,62.210.85.178,10.0.2.15,TCP,60,9001  >  35978 [ACK] Seq=15107777 Ack=276571877 Win=65535 Len=0
1,0.7814989999997124,10.0.2.15,62.210.85.178,TLSv1.2,1618,Application Data
1,0.7816380000003846,62.210.85.178,10.0.2.15,TCP,60,9001  >  35978 [ACK] Seq=15107777 Ack=276573337 Win=65535 Len=0
1,0.7816679999996268,62.210.85.178,10.0.2.15,TCP,60,9001  >  35978 [ACK] Seq=15107777 Ack=276573441 Win=65535 Len=0
1,0.9623289999999542,54.93.77.70,10.0.2.15,TLSv1.2,590,Application Data
1,1.0052839999998469,10.0.2.15,54.93.77.70,TCP,54,34692  >  9001 [ACK] Seq=15148843 Ack=276221575 Win=65535 Len=0
1,1.1652309999999488,54.93.77.70,10.0.2.15,TLSv1.2,1618,Application Data
1,1.1653200000000652,10.0.2.15,54.93.77.70,TCP,54,34692  >  9001 [ACK] Seq=15148843 Ack=276223139 Win=65535 Len=0
1,1.1680280000000494,10.0.2.15,54.93.77.70,TLSv1.2,590,Application Data
1,1.1682019999998374,54.93.77.70,10.0.2.15,TCP,60,9001  >  34692 [ACK] Seq=276223139 Ack=15149379 Win=65535 Len=0
1,1.3099350000002232,62.210.85.178,10.0.2.15,TLSv1.2,590,Application Data
1,1.3103250000003754,10.0.2.15,62.210.85.178,TLSv1.2,590,Application Data
1,1.3105560000003607,62.210.85.178,10.0.2.15,TCP,60,9001  >  35978 [ACK] Seq=15108313 Ack=276573977 Win=65535 Len=0
1,1.4754290000000765,54.93.77.70,10.0.2.15,TLSv1.2,590,Application Data
1,1.475803000000269,10.0.2.15,54.93.77.70,TLSv1.2,590,Application Data
1,1.4759030000004714,54.93.77.70,10.0.2.15,TCP,60,9001  >  34692 [ACK] Seq=276223675 Ack=15149915 Win=65535 Len=0
1,1.6174399999999878,62.210.85.178,10.0.2.15,TLSv1.2,590,Application Data
1,1.6232719999998153,10.0.2.15,62.210.85.178,TLSv1.2,590,Application Data
1,1.6234059999997044,62.210.85.178,10.0.2.15,TCP,60,9001  >  35978 [ACK] Seq=15108849 Ack=276574513 Win=65535 Len=0
1,1.6337030000004233,10.0.2.15,62.210.85.178,TLSv1.2,4124,Application Data
1,1.63383900000008,10.0.2.15,62.210.85.178,TCP,2974,35978  >  9001 [ACK] Seq=276578583 Ack=15108849 Win=65535 Len=2920 [TCP segment of a reassembled PDU]
1,1.6338869999999588,62.210.85.178,10.0.2.15,TCP,60,9001  >  35978 [ACK] Seq=15108849 Ack=276575973 Win=65535 Len=0
1,1.6338990000003832,62.210.85.178,10.0.2.15,TCP,60,9001  >  35978 [ACK] Seq=15108849 Ack=276577433 Win=65535 Len=0
1,1.633904000000257,62.210.85.178,10.0.2.15,TCP,60,9001  >  35978 [ACK] Seq=15108849 Ack=276578583 Win=65535 Len=0
1,1.633907999999792,62.210.85.178,10.0.2.15,TCP,60,9001  >  35978 [ACK] Seq=15108849 Ack=276580043 Win=65535 Len=0
1,1.6339109999998982,62.210.85.178,10.0.2.15,TCP,60,9001  >  35978 [ACK] Seq=15108849 Ack=276581503 Win=65535 Len=0
1,1.6339570000000094,10.0.2.15,62.210.85.178,TLSv1.2,1204,Application Data
1,1.6339950000001409,62.210.85.178,10.0.2.15,TCP,60,9001  >  35978 [ACK] Seq=15108849 Ack=276582653 Win=65535 Len=0
1,1.6340419999996811,10.0.2.15,62.210.85.178,TLSv1.2,4124,Application Data
1,1.634081000000151,62.210.85.178,10.0.2.15,TCP,60,9001  >  35978 [ACK] Seq=15108849 Ack=276584113 Win=65535 Len=0
1,1.634089000000131,62.210.85.178,10.0.2.15,TCP,60,9001  >  35978 [ACK] Seq=15108849 Ack=276585573 Win=65535 Len=0
1,1.6340940000000046,62.210.85.178,10.0.2.15,TCP,60,9001  >  35978 [ACK] Seq=15108849 Ack=276586723 Win=65535 Len=0
1,1.6341389999997773,10.0.2.15,62.210.85.178,TLSv1.2,4124,Application Data
1,1.6342100000001665,62.210.85.178,10.0.2.15,TCP,60,9001  >  35978 [ACK] Seq=15108849 Ack=276588183 Win=65535 Len=0
1,1.63422300000002,62.210.85.178,10.0.2.15,TCP,60,9001  >  35978 [ACK] Seq=15108849 Ack=276589643 Win=65535 Len=0
1,1.634226000000126,62.210.85.178,10.0.2.15,TCP,60,9001  >  35978 [ACK] Seq=15108849 Ack=276590793 Win=65535 Len=0
1,1.6342729999996664,10.0.2.15,62.210.85.178,TLSv1.2,332,Application Data
1,1.6343360000000757,62.210.85.178,10.0.2.15,TCP,60,9001  >  35978 [ACK] Seq=15108849 Ack=276591071 Win=65535 Len=0
1,1.6344040000003588,10.0.2.15,62.210.85.178,TLSv1.2,3868,Application Data
1,1.6344460000000254,62.210.85.178,10.0.2.15,TCP,60,9001  >  35978 [ACK] Seq=15108849 Ack=276592531 Win=65535 Len=0
1,1.6344540000000052,62.210.85.178,10.0.2.15,TCP,60,9001  >  35978 [ACK] Seq=15108849 Ack=276593991 Win=65535 Len=0
1,1.6344580000004498,62.210.85.178,10.0.2.15,TCP,60,9001  >  35978 [ACK] Seq=15108849 Ack=276594885 Win=65535 Len=0
1,1.6344980000003488,10.0.2.15,62.210.85.178,TLSv1.2,4124,Application Data
1,1.6345360000004803,62.210.85.178,10.0.2.15,TCP,60,9001  >  35978 [ACK] Seq=15108849 Ack=276596345 Win=65535 Len=0
1,1.63454400000046,62.210.85.178,10.0.2.15,TCP,60,9001  >  35978 [ACK] Seq=15108849 Ack=276597805 Win=65535 Len=0
1,1.6345479999999952,62.210.85.178,10.0.2.15,TCP,60,9001  >  35978 [ACK] Seq=15108849 Ack=276598955 Win=65535 Len=0
1,1.634584000000359,10.0.2.15,62.210.85.178,TLSv1.2,3030,Application Data
1,1.6346220000004905,62.210.85.178,10.0.2.15,TCP,60,9001  >  35978 [ACK] Seq=15108849 Ack=276600415 Win=65535 Len=0
1,1.6346300000004703,62.210.85.178,10.0.2.15,TCP,60,9001  >  35978 [ACK] Seq=15108849 Ack=276601875 Win=65535 Len=0
1,1.634632999999667,62.210.85.178,10.0.2.15,TCP,60,9001  >  35978 [ACK] Seq=15108849 Ack=276601931 Win=65535 Len=0
1,1.6460720000004585,10.0.2.15,62.210.85.178,TLSv1.2,4124,Application Data
1,1.6461269999999786,62.210.85.178,10.0.2.15,TCP,60,9001  >  35978 [ACK] Seq=15108849 Ack=276603391 Win=65535 Len=0
1,1.646139000000403,62.210.85.178,10.0.2.15,TCP,60,9001  >  35978 [ACK] Seq=15108849 Ack=276604851 Win=65535 Len=0
1,1.6461440000002767,62.210.85.178,10.0.2.15,TCP,60,9001  >  35978 [ACK] Seq=15108849 Ack=276606001 Win=65535 Len=0
1,1.646190999999817,10.0.2.15,62.210.85.178,TLSv1.2,4124,Application Data
1,1.6462320000000545,62.210.85.178,10.0.2.15,TCP,60,9001  >  35978 [ACK] Seq=15108849 Ack=276607461 Win=65535 Len=0
1,1.6462410000003729,62.210.85.178,10.0.2.15,TCP,60,9001  >  35978 [ACK] Seq=15108849 Ack=276608921 Win=65535 Len=0
1,1.646244999999908,62.210.85.178,10.0.2.15,TCP,60,9001  >  35978 [ACK] Seq=15108849 Ack=276610071 Win=65535 Len=0
1,1.646284000000378,10.0.2.15,62.210.85.178,TLSv1.2,4124,Application Data
1,1.6463300000004892,62.210.85.178,10.0.2.15,TCP,60,9001  >  35978 [ACK] Seq=15108849 Ack=276611531 Win=65535 Len=0
1,1.646338999999898,62.210.85.178,10.0.2.15,TCP,60,9001  >  35978 [ACK] Seq=15108849 Ack=276612991 Win=65535 Len=0
1,1.6463439999997718,62.210.85.178,10.0.2.15,TCP,60,9001  >  35978 [ACK] Seq=15108849 Ack=276614141 Win=65535 Len=0
1,1.6463830000002417,10.0.2.15,62.210.85.178,TLSv1.2,4124,Application Data
1,1.6464210000003732,62.210.85.178,10.0.2.15,TCP,60,9001  >  35978 [ACK] Seq=15108849 Ack=276615601 Win=65535 Len=0
1,1.646429999999782,62.210.85.178,10.0.2.15,TCP,60,9001  >  35978 [ACK] Seq=15108849 Ack=276617061 Win=65535 Len=0
1,1.6464349999996557,62.210.85.178,10.0.2.15,TCP,60,9001  >  35978 [ACK] Seq=15108849 Ack=276618211 Win=65535 Len=0
1,1.646469999999681,10.0.2.15,62.210.85.178,TLSv1.2,332,Application Data
1,1.6465390000003026,62.210.85.178,10.0.2.15,TCP,60,9001  >  35978 [ACK] Seq=15108849 Ack=276618489 Win=65535 Len=0
1,1.646603000000141,10.0.2.15,62.210.85.178,TLSv1.2,3868,Application Data
1,1.6466449999998076,62.210.85.178,10.0.2.15,TCP,60,9001  >  35978 [ACK] Seq=15108849 Ack=276619949 Win=65535 Len=0
1,1.646654000000126,62.210.85.178,10.0.2.15,TCP,60,9001  >  35978 [ACK] Seq=15108849 Ack=276621409 Win=65535 Len=0
1,1.6466579999996611,62.210.85.178,10.0.2.15,TCP,60,9001  >  35978 [ACK] Seq=15108849 Ack=276622303 Win=65535 Len=0
1,1.6466980000004696,10.0.2.15,62.210.85.178,TLSv1.2,4124,Application Data
1,1.6467380000003686,62.210.85.178,10.0.2.15,TCP,60,9001  >  35978 [ACK] Seq=15108849 Ack=276623763 Win=65535 Len=0
1,1.6467460000003484,62.210.85.178,10.0.2.15,TCP,60,9001  >  35978 [ACK] Seq=15108849 Ack=276625223 Win=65535 Len=0
1,1.6467490000004545,62.210.85.178,10.0.2.15,TCP,60,9001  >  35978 [ACK] Seq=15108849 Ack=276626373 Win=65535 Len=0
1,1.646784999999909,10.0.2.15,62.210.85.178,TLSv1.2,3030,Application Data
1,1.6468240000003789,62.210.85.178,10.0.2.15,TCP,60,9001  >  35978 [ACK] Seq=15108849 Ack=276627833 Win=65535 Len=0
1,1.6468320000003587,62.210.85.178,10.0.2.15,TCP,60,9001  >  35978 [ACK] Seq=15108849 Ack=276629293 Win=65535 Len=0
1,1.6468359999998938,62.210.85.178,10.0.2.15,TCP,60,9001  >  35978 [ACK] Seq=15108849 Ack=276629349 Win=65535 Len=0
1,1.6560310000004392,10.0.2.15,62.210.85.178,TLSv1.2,4124,Application Data
1,1.6560849999996208,62.210.85.178,10.0.2.15,TCP,60,9001  >  35978 [ACK] Seq=15108849 Ack=276630809 Win=65535 Len=0
1,1.6560959999997067,62.210.85.178,10.0.2.15,TCP,60,9001  >  35978 [ACK] Seq=15108849 Ack=276632269 Win=65535 Len=0
1,1.6561010000004899,62.210.85.178,10.0.2.15,TCP,60,9001  >  35978 [ACK] Seq=15108849 Ack=276633419 Win=65535 Len=0
1,1.656144999999924,10.0.2.15,62.210.85.178,TLSv1.2,4124,Application Data
1,1.6561870000005001,62.210.85.178,10.0.2.15,TCP,60,9001  >  35978 [ACK] Seq=15108849 Ack=276634879 Win=65535 Len=0
1,1.656195999999909,62.210.85.178,10.0.2.15,TCP,60,9001  >  35978 [ACK] Seq=15108849 Ack=276636339 Win=65535 Len=0
1,1.6562000000003536,62.210.85.178,10.0.2.15,TCP,60,9001  >  35978 [ACK] Seq=15108849 Ack=276637489 Win=65535 Len=0
1,1.656235999999808,10.0.2.15,62.210.85.178,TLSv1.2,1746,Application Data
1,1.656275000000278,62.210.85.178,10.0.2.15,TCP,60,9001  >  35978 [ACK] Seq=15108849 Ack=276638949 Win=65535 Len=0
1,1.6562830000002577,62.210.85.178,10.0.2.15,TCP,60,9001  >  35978 [ACK] Seq=15108849 Ack=276639181 Win=65535 Len=0
1,1.7648300000000745,54.93.77.70,10.0.2.15,TLSv1.2,590,Application Data
1,1.805341000000226,10.0.2.15,54.93.77.70,TCP,54,34692  >  9001 [ACK] Seq=15149915 Ack=276224211 Win=65535 Len=0
1,1.9162429999996675,54.93.77.70,10.0.2.15,TCP,2950,"9001  >  34692 [PSH, ACK] Seq=276224211 Ack=15149915 Win=65535 Len=2896 [TCP segment of a reassembled PDU]"
1,1.9162870000000112,54.93.77.70,10.0.2.15,TLSv1.2,10190,"Application Data, Application Data, Application Data, Application Data"
1,1.9163799999996627,10.0.2.15,54.93.77.70,TCP,54,34692  >  9001 [ACK] Seq=15149915 Ack=276227107 Win=65535 Len=0
1,1.9164110000001529,10.0.2.15,54.93.77.70,TCP,54,34692  >  9001 [ACK] Seq=15149915 Ack=276237243 Win=65535 Len=0
1,1.926948000000266,54.93.77.70,10.0.2.15,TLSv1.2,2950,Application Data [TCP segment of a reassembled PDU]
1,1.9270230000001902,10.0.2.15,54.93.77.70,TCP,54,34692  >  9001 [ACK] Seq=15149915 Ack=276240139 Win=65535 Len=0
1,2.052437999999711,54.93.77.70,10.0.2.15,TCP,2950,"9001  >  34692 [PSH, ACK] Seq=276240139 Ack=15149915 Win=65535 Len=2896 [TCP segment of a reassembled PDU]"
1,2.05246999999963,54.93.77.70,10.0.2.15,TLSv1.2,8156,"Application Data, Application Data, Application Data, Application Data"
1,2.0524750000004133,54.93.77.70,10.0.2.15,TLSv1.2,4398,Application Data
1,2.052520999999615,10.0.2.15,54.93.77.70,TCP,54,34692  >  9001 [ACK] Seq=15149915 Ack=276243035 Win=65535 Len=0
1,2.0525619999998526,10.0.2.15,54.93.77.70,TCP,54,34692  >  9001 [ACK] Seq=15149915 Ack=276251137 Win=65535 Len=0
1,2.0525840000000244,10.0.2.15,54.93.77.70,TCP,54,34692  >  9001 [ACK] Seq=15149915 Ack=276255481 Win=65535 Len=0
1,2.0529109999997672,10.0.2.15,54.93.77.70,TLSv1.2,1104,Application Data
1,2.0529930000002423,54.93.77.70,10.0.2.15,TCP,60,9001  >  34692 [ACK] Seq=276255481 Ack=15150965 Win=65535 Len=0
1,2.0542629999999917,54.93.77.70,10.0.2.15,TLSv1.2,12834,"Application Data, Application Data, Application Data, Application Data"
1,2.0542969999996785,10.0.2.15,54.93.77.70,TCP,54,34692  >  9001 [ACK] Seq=15150965 Ack=276268261 Win=65535 Len=0
1,2.0543440000001283,54.93.77.70,10.0.2.15,TLSv1.2,3202,Application Data [TCP segment of a reassembled PDU]
1,2.054395000000113,10.0.2.15,54.93.77.70,TCP,54,34692  >  9001 [ACK] Seq=15150965 Ack=276271409 Win=65535 Len=0
1,2.0686290000003282,54.93.77.70,10.0.2.15,TLSv1.2,2950,Application Data [TCP segment of a reassembled PDU]
1,2.0686750000004395,10.0.2.15,54.93.77.70,TCP,54,34692  >  9001 [ACK] Seq=15150965 Ack=276274305 Win=65535 Len=0
1,2.0688270000000557,54.93.77.70,10.0.2.15,TCP,1502,"9001  >  34692 [PSH, ACK] Seq=276274305 Ack=15150965 Win=65535 Len=1448 [TCP segment of a reassembled PDU]"
1,2.0688609999997425,10.0.2.15,54.93.77.70,TCP,54,34692  >  9001 [ACK] Seq=15150965 Ack=276275753 Win=65535 Len=0
1,2.0703560000001744,54.93.77.70,10.0.2.15,TLSv1.2,286,Application Data
1,2.0704960000002757,10.0.2.15,54.93.77.70,TLSv1.2,590,Application Data
1,2.0705710000002,54.93.77.70,10.0.2.15,TCP,60,9001  >  34692 [ACK] Seq=276275985 Ack=15151501 Win=65535 Len=0
1,2.0872380000000703,54.93.77.70,10.0.2.15,TCP,2950,"9001  >  34692 [PSH, ACK] Seq=276275985 Ack=15151501 Win=65535 Len=2896 [TCP segment of a reassembled PDU]"
1,2.0872580000004746,54.93.77.70,10.0.2.15,TLSv1.2,1828,"Application Data, Application Data"
1,2.0873380000002726,10.0.2.15,54.93.77.70,TCP,54,34692  >  9001 [ACK] Seq=15151501 Ack=276280655 Win=65535 Len=0
1,2.213295000000471,54.93.77.70,10.0.2.15,TCP,2950,"9001  >  34692 [PSH, ACK] Seq=276280655 Ack=15151501 Win=65535 Len=2896 [TCP segment of a reassembled PDU]"
1,2.2133929999999964,10.0.2.15,54.93.77.70,TCP,54,34692  >  9001 [ACK] Seq=15151501 Ack=276283551 Win=65535 Len=0
1,2.2177629999996498,54.93.77.70,10.0.2.15,TLSv1.2,2950,Application Data [TCP segment of a reassembled PDU]
1,2.2178160000003118,10.0.2.15,54.93.77.70,TCP,54,34692  >  9001 [ACK] Seq=15151501 Ack=276286447 Win=65535 Len=0
1,2.2183199999999488,54.93.77.70,10.0.2.15,TLSv1.2,2016,Application Data
1,2.2183329999998023,62.210.85.178,10.0.2.15,TLSv1.2,1104,Application Data
1,2.2183780000004845,10.0.2.15,54.93.77.70,TCP,54,34692  >  9001 [ACK] Seq=15151501 Ack=276288409 Win=65535 Len=0
1,2.2188089999999647,10.0.2.15,54.93.77.70,TLSv1.2,590,Application Data
1,2.2189550000002782,54.93.77.70,10.0.2.15,TCP,60,9001  >  34692 [ACK] Seq=276288409 Ack=15152037 Win=65535 Len=0
1,2.219014000000243,54.93.77.70,10.0.2.15,TLSv1.2,590,Application Data
1,2.2339300000003277,10.0.2.15,54.93.77.70,TLSv1.2,590,Application Data
1,2.2340720000001966,54.93.77.70,10.0.2.15,TCP,60,9001  >  34692 [ACK] Seq=276288945 Ack=15152573 Win=65535 Len=0
1,2.2613250000003973,10.0.2.15,62.210.85.178,TCP,54,35978  >  9001 [ACK] Seq=276639181 Ack=15109899 Win=65535 Len=0
1,2.38904999999977,62.210.85.178,10.0.2.15,TLSv1.2,1126,"Application Data, Application Data"
1,2.3891249999996944,10.0.2.15,62.210.85.178,TCP,54,35978  >  9001 [ACK] Seq=276639181 Ack=15110971 Win=65535 Len=0
1,2.520567000000483,62.210.85.178,10.0.2.15,TLSv1.2,590,Application Data
1,2.5206539999999222,10.0.2.15,62.210.85.178,TCP,54,35978  >  9001 [ACK] Seq=276639181 Ack=15111507 Win=65535 Len=0
1,2.5211179999996602,10.0.2.15,62.210.85.178,TLSv1.2,590,Application Data
1,2.521241999999802,62.210.85.178,10.0.2.15,TCP,60,9001  >  35978 [ACK] Seq=15111507 Ack=276639717 Win=65535 Len=0
1,2.6643940000003568,54.93.77.70,10.0.2.15,TLSv1.2,590,Application Data
1,2.6648040000000037,10.0.2.15,54.93.77.70,TLSv1.2,590,Application Data
1,2.6649399999996604,54.93.77.70,10.0.2.15,TCP,60,9001  >  34692 [ACK] Seq=276289481 Ack=15153109 Win=65535 Len=0
1,2.827266000000236,62.210.85.178,10.0.2.15,TLSv1.2,590,Application Data
1,2.834788000000117,10.0.2.15,62.210.85.178,TLSv1.2,590,Application Data
1,2.835001999999804,62.210.85.178,10.0.2.15,TCP,60,9001  >  35978 [ACK] Seq=15112043 Ack=276640253 Win=65535 Len=0
1,2.846241000000191,10.0.2.15,62.210.85.178,TLSv1.2,4124,Application Data
1,2.846363999999994,10.0.2.15,62.210.85.178,TCP,2974,35978  >  9001 [ACK] Seq=276644323 Ack=15112043 Win=65535 Len=2920 [TCP segment of a reassembled PDU]
1,2.846411999999873,62.210.85.178,10.0.2.15,TCP,60,9001  >  35978 [ACK] Seq=15112043 Ack=276641713 Win=65535 Len=0
1,2.8464249999997264,62.210.85.178,10.0.2.15,TCP,60,9001  >  35978 [ACK] Seq=15112043 Ack=276643173 Win=65535 Len=0
1,2.8464300000005096,62.210.85.178,10.0.2.15,TCP,60,9001  >  35978 [ACK] Seq=15112043 Ack=276644323 Win=65535 Len=0
1,2.8464340000000448,62.210.85.178,10.0.2.15,TCP,60,9001  >  35978 [ACK] Seq=15112043 Ack=276645783 Win=65535 Len=0
1,2.846437000000151,62.210.85.178,10.0.2.15,TCP,60,9001  >  35978 [ACK] Seq=15112043 Ack=276647243 Win=65535 Len=0
1,2.8464729999996052,10.0.2.15,62.210.85.178,TLSv1.2,1204,Application Data
1,2.8465109999997367,62.210.85.178,10.0.2.15,TCP,60,9001  >  35978 [ACK] Seq=15112043 Ack=276648393 Win=65535 Len=0
1,2.84656300000006,10.0.2.15,62.210.85.178,TLSv1.2,4124,Application Data
1,2.8466010000001916,62.210.85.178,10.0.2.15,TCP,60,9001  >  35978 [ACK] Seq=15112043 Ack=276649853 Win=65535 Len=0
1,2.84661000000051,62.210.85.178,10.0.2.15,TCP,60,9001  >  35978 [ACK] Seq=15112043 Ack=276651313 Win=65535 Len=0
1,2.846614000000045,62.210.85.178,10.0.2.15,TCP,60,9001  >  35978 [ACK] Seq=15112043 Ack=276652463 Win=65535 Len=0
1,2.846653999999944,10.0.2.15,62.210.85.178,TLSv1.2,4124,Application Data
1,2.8466920000000755,62.210.85.178,10.0.2.15,TCP,60,9001  >  35978 [ACK] Seq=15112043 Ack=276653923 Win=65535 Len=0
1,2.8467000000000553,62.210.85.178,10.0.2.15,TCP,60,9001  >  35978 [ACK] Seq=15112043 Ack=276655383 Win=65535 Len=0
1,2.846704999999929,62.210.85.178,10.0.2.15,TCP,60,9001  >  35978 [ACK] Seq=15112043 Ack=276656533 Win=65535 Len=0
1,2.8467399999999543,10.0.2.15,62.210.85.178,TLSv1.2,332,Application Data
1,2.8467780000000857,62.210.85.178,10.0.2.15,TCP,60,9001  >  35978 [ACK] Seq=15112043 Ack=276656811 Win=65535 Len=0
1,2.8468309999998382,10.0.2.15,62.210.85.178,TLSv1.2,3868,Application Data
1,2.846872000000076,62.210.85.178,10.0.2.15,TCP,60,9001  >  35978 [ACK] Seq=15112043 Ack=276658271 Win=65535 Len=0
1,2.8468800000000556,62.210.85.178,10.0.2.15,TCP,60,9001  >  35978 [ACK] Seq=15112043 Ack=276659731 Win=65535 Len=0
1,2.8468840000005002,62.210.85.178,10.0.2.15,TCP,60,9001  >  35978 [ACK] Seq=15112043 Ack=276660625 Win=65535 Len=0
1,2.846921999999722,10.0.2.15,62.210.85.178,TLSv1.2,4124,Application Data
1,2.8469629999999597,62.210.85.178,10.0.2.15,TCP,60,9001  >  35978 [ACK] Seq=15112043 Ack=276662085 Win=65535 Len=0
1,2.8469709999999395,62.210.85.178,10.0.2.15,TCP,60,9001  >  35978 [ACK] Seq=15112043 Ack=276663545 Win=65535 Len=0
1,2.846975000000384,62.210.85.178,10.0.2.15,TCP,60,9001  >  35978 [ACK] Seq=15112043 Ack=276664695 Win=65535 Len=0
1,2.8470100000004095,10.0.2.15,62.210.85.178,TLSv1.2,3030,Application Data
1,2.84704899999997,62.210.85.178,10.0.2.15,TCP,60,9001  >  35978 [ACK] Seq=15112043 Ack=276666155 Win=65535 Len=0
1,2.8470559999996112,62.210.85.178,10.0.2.15,TCP,60,9001  >  35978 [ACK] Seq=15112043 Ack=276667615 Win=65535 Len=0
1,2.847060000000056,62.210.85.178,10.0.2.15,TCP,60,9001  >  35978 [ACK] Seq=15112043 Ack=276667671 Win=65535 Len=0
1,2.973402999999962,54.93.77.70,10.0.2.15,TLSv1.2,7830,"Application Data, Application Data, Application Data"
1,2.973547000000508,10.0.2.15,54.93.77.70,TCP,54,34692  >  9001 [ACK] Seq=15153109 Ack=276297257 Win=65535 Len=0
1,2.9864440000001196,54.93.77.70,10.0.2.15,TCP,2950,"9001  >  34692 [PSH, ACK] Seq=276297257 Ack=15153109 Win=65535 Len=2896 [TCP segment of a reassembled PDU]"
1,2.9865129999998317,10.0.2.15,54.93.77.70,TCP,54,34692  >  9001 [ACK] Seq=15153109 Ack=276300153 Win=65535 Len=0
1,2.9892339999996693,54.93.77.70,10.0.2.15,TLSv1.2,1314,"Application Data, Application Data"
1,2.996971000000485,54.93.77.70,10.0.2.15,TCP,2950,"9001  >  34692 [PSH, ACK] Seq=276301413 Ack=15153109 Win=65535 Len=2896 [TCP segment of a reassembled PDU]"
1,2.997016999999687,10.0.2.15,54.93.77.70,TCP,54,34692  >  9001 [ACK] Seq=15153109 Ack=276304309 Win=65535 Len=0
1,3.122400000000198,54.93.77.70,10.0.2.15,TLSv1.2,1314,"Application Data, Application Data"
1,3.1226370000003953,10.0.2.15,54.93.77.70,TLSv1.2,590,Application Data
1,3.122747000000345,54.93.77.70,10.0.2.15,TCP,60,9001  >  34692 [ACK] Seq=276305569 Ack=15153645 Win=65535 Len=0
1,3.1246369999998933,54.93.77.70,10.0.2.15,TLSv1.2,7294,"Application Data, Application Data"
1,3.124721000000136,10.0.2.15,54.93.77.70,TCP,54,34692  >  9001 [ACK] Seq=15153645 Ack=276312809 Win=65535 Len=0
1,3.140002000000095,54.93.77.70,10.0.2.15,TLSv1.2,1104,Application Data
1,3.181311999999707,10.0.2.15,54.93.77.70,TCP,54,34692  >  9001 [ACK] Seq=15153645 Ack=276313859 Win=65535 Len=0
1,3.2645480000001044,54.93.77.70,10.0.2.15,TCP,2950,"9001  >  34692 [PSH, ACK] Seq=276313859 Ack=15153645 Win=65535 Len=2896 [TCP segment of a reassembled PDU]"
1,3.264640999999756,10.0.2.15,54.93.77.70,TCP,54,34692  >  9001 [ACK] Seq=15153645 Ack=276316755 Win=65535 Len=0
1,3.280405999999857,54.93.77.70,10.0.2.15,TLSv1.2,778,Application Data
1,3.280456000000413,10.0.2.15,54.93.77.70,TCP,54,34692  >  9001 [ACK] Seq=15153645 Ack=276317479 Win=65535 Len=0
1,3.2806870000003983,10.0.2.15,54.93.77.70,TLSv1.2,590,Application Data
1,3.280768999999964,54.93.77.70,10.0.2.15,TCP,60,9001  >  34692 [ACK] Seq=276317479 Ack=15154181 Win=65535 Len=0
1,3.2901730000003226,10.0.2.15,54.93.77.70,TLSv1.2,590,Application Data
1,3.290310999999747,54.93.77.70,10.0.2.15,TCP,60,9001  >  34692 [ACK] Seq=276317479 Ack=15154717 Win=65535 Len=0
1,3.293706999999813,62.210.85.178,10.0.2.15,TLSv1.2,590,Application Data
1,3.340737999999874,10.0.2.15,62.210.85.178,TCP,54,35978  >  9001 [ACK] Seq=276667671 Ack=15112579 Win=65535 Len=0
1,3.4474019999997836,62.210.85.178,10.0.2.15,TLSv1.2,590,Application Data
1,3.4474780000000464,10.0.2.15,62.210.85.178,TCP,54,35978  >  9001 [ACK] Seq=276667671 Ack=15113115 Win=65535 Len=0
1,3.748486000000412,62.210.85.178,10.0.2.15,TLSv1.2,590,Application Data
1,3.748563000000104,10.0.2.15,62.210.85.178,TCP,54,35978  >  9001 [ACK] Seq=276667671 Ack=15113651 Win=65535 Len=0
1,3.7490230000003066,10.0.2.15,62.210.85.178,TLSv1.2,590,Application Data
1,3.7491330000002563,62.210.85.178,10.0.2.15,TCP,60,9001  >  35978 [ACK] Seq=15113651 Ack=276668207 Win=65535 Len=0
1,3.892178000000058,54.93.77.70,10.0.2.15,TLSv1.2,590,Application Data
1,3.8925570000001244,10.0.2.15,54.93.77.70,TLSv1.2,590,Application Data
1,3.892655999999988,54.93.77.70,10.0.2.15,TCP,60,9001  >  34692 [ACK] Seq=276318015 Ack=15155253 Win=65535 Len=0
1,4.0611879999996745,62.210.85.178,10.0.2.15,TLSv1.2,590,Application Data
1,4.0665539999999964,10.0.2.15,62.210.85.178,TLSv1.2,590,Application Data
1,4.0667279999997845,62.210.85.178,10.0.2.15,TCP,60,9001  >  35978 [ACK] Seq=15114187 Ack=276668743 Win=65535 Len=0
1,4.077911999999742,10.0.2.15,62.210.85.178,TLSv1.2,4124,Application Data
1,4.078005999999732,10.0.2.15,62.210.85.178,TCP,2974,35978  >  9001 [ACK] Seq=276672813 Ack=15114187 Win=65535 Len=2920 [TCP segment of a reassembled PDU]
1,4.078059999999823,62.210.85.178,10.0.2.15,TCP,60,9001  >  35978 [ACK] Seq=15114187 Ack=276670203 Win=65535 Len=0
1,4.0780720000002475,62.210.85.178,10.0.2.15,TCP,60,9001  >  35978 [ACK] Seq=15114187 Ack=276671663 Win=65535 Len=0
1,4.078077000000121,62.210.85.178,10.0.2.15,TCP,60,9001  >  35978 [ACK] Seq=15114187 Ack=276672813 Win=65535 Len=0
1,4.078081999999995,62.210.85.178,10.0.2.15,TCP,60,9001  >  35978 [ACK] Seq=15114187 Ack=276674273 Win=65535 Len=0
1,4.0780839999997625,62.210.85.178,10.0.2.15,TCP,60,9001  >  35978 [ACK] Seq=15114187 Ack=276675733 Win=65535 Len=0
1,4.078120000000126,10.0.2.15,62.210.85.178,TLSv1.2,1204,Application Data
1,4.078153999999813,62.210.85.178,10.0.2.15,TCP,60,9001  >  35978 [ACK] Seq=15114187 Ack=276676883 Win=65535 Len=0
1,4.078199000000495,10.0.2.15,62.210.85.178,TLSv1.2,4124,Application Data
1,4.078233000000182,62.210.85.178,10.0.2.15,TCP,60,9001  >  35978 [ACK] Seq=15114187 Ack=276678343 Win=65535 Len=0
1,4.078239999999823,62.210.85.178,10.0.2.15,TCP,60,9001  >  35978 [ACK] Seq=15114187 Ack=276679803 Win=65535 Len=0
1,4.078244999999697,62.210.85.178,10.0.2.15,TCP,60,9001  >  35978 [ACK] Seq=15114187 Ack=276680953 Win=65535 Len=0
1,4.0782829999998285,10.0.2.15,62.210.85.178,TLSv1.2,4124,Application Data
1,4.078316000000086,62.210.85.178,10.0.2.15,TCP,60,9001  >  35978 [ACK] Seq=15114187 Ack=276682413 Win=65535 Len=0
1,4.078324000000066,62.210.85.178,10.0.2.15,TCP,60,9001  >  35978 [ACK] Seq=15114187 Ack=276683873 Win=65535 Len=0
1,4.078328000000511,62.210.85.178,10.0.2.15,TCP,60,9001  >  35978 [ACK] Seq=15114187 Ack=276685023 Win=65535 Len=0
1,4.078362000000197,10.0.2.15,62.210.85.178,TLSv1.2,332,Application Data
1,4.078395000000455,62.210.85.178,10.0.2.15,TCP,60,9001  >  35978 [ACK] Seq=15114187 Ack=276685301 Win=65535 Len=0
1,4.078454999999849,10.0.2.15,62.210.85.178,TLSv1.2,3868,Application Data
1,4.078491000000213,62.210.85.178,10.0.2.15,TCP,60,9001  >  35978 [ACK] Seq=15114187 Ack=276686761 Win=65535 Len=0
1,4.078497999999854,62.210.85.178,10.0.2.15,TCP,60,9001  >  35978 [ACK] Seq=15114187 Ack=276688221 Win=65535 Len=0
1,4.07850099999996,62.210.85.178,10.0.2.15,TCP,60,9001  >  35978 [ACK] Seq=15114187 Ack=276689115 Win=65535 Len=0
1,4.078537000000324,10.0.2.15,62.210.85.178,TLSv1.2,4124,Application Data
1,4.078572000000349,62.210.85.178,10.0.2.15,TCP,60,9001  >  35978 [ACK] Seq=15114187 Ack=276690575 Win=65535 Len=0
1,4.078578999999991,62.210.85.178,10.0.2.15,TCP,60,9001  >  35978 [ACK] Seq=15114187 Ack=276692035 Win=65535 Len=0
1,4.078582000000097,62.210.85.178,10.0.2.15,TCP,60,9001  >  35978 [ACK] Seq=15114187 Ack=276693185 Win=65535 Len=0
1,4.0786159999997835,10.0.2.15,62.210.85.178,TLSv1.2,3030,Application Data
1,4.07865000000038,62.210.85.178,10.0.2.15,TCP,60,9001  >  35978 [ACK] Seq=15114187 Ack=276694645 Win=65535 Len=0
1,4.078657000000021,62.210.85.178,10.0.2.15,TCP,60,9001  >  35978 [ACK] Seq=15114187 Ack=276696105 Win=65535 Len=0
1,4.078660000000127,62.210.85.178,10.0.2.15,TCP,60,9001  >  35978 [ACK] Seq=15114187 Ack=276696161 Win=65535 Len=0
1,4.090111999999863,10.0.2.15,62.210.85.178,TLSv1.2,4124,Application Data
1,4.090197999999873,62.210.85.178,10.0.2.15,TCP,60,9001  >  35978 [ACK] Seq=15114187 Ack=276697621 Win=65535 Len=0
1,4.090207000000191,62.210.85.178,10.0.2.15,TCP,60,9001  >  35978 [ACK] Seq=15114187 Ack=276699081 Win=65535 Len=0
1,4.090210000000297,62.210.85.178,10.0.2.15,TCP,60,9001  >  35978 [ACK] Seq=15114187 Ack=276700231 Win=65535 Len=0
1,4.090248000000429,10.0.2.15,62.210.85.178,TLSv1.2,4124,Application Data
1,4.090299999999843,62.210.85.178,10.0.2.15,TCP,60,9001  >  35978 [ACK] Seq=15114187 Ack=276701691 Win=65535 Len=0
1,4.090307000000394,62.210.85.178,10.0.2.15,TCP,60,9001  >  35978 [ACK] Seq=15114187 Ack=276703151 Win=65535 Len=0
1,4.0903100000005,62.210.85.178,10.0.2.15,TCP,60,9001  >  35978 [ACK] Seq=15114187 Ack=276704301 Win=65535 Len=0
1,4.090347000000293,10.0.2.15,62.210.85.178,TLSv1.2,4124,Application Data
1,4.090382000000318,62.210.85.178,10.0.2.15,TCP,60,9001  >  35978 [ACK] Seq=15114187 Ack=276705761 Win=65535 Len=0
1,4.090388999999959,62.210.85.178,10.0.2.15,TCP,60,9001  >  35978 [ACK] Seq=15114187 Ack=276707221 Win=65535 Len=0
1,4.090393000000404,62.210.85.178,10.0.2.15,TCP,60,9001  >  35978 [ACK] Seq=15114187 Ack=276708371 Win=65535 Len=0
1,4.090428999999858,10.0.2.15,62.210.85.178,TLSv1.2,4124,Application Data
1,4.090462000000116,62.210.85.178,10.0.2.15,TCP,60,9001  >  35978 [ACK] Seq=15114187 Ack=276709831 Win=65535 Len=0
1,4.090468999999757,62.210.85.178,10.0.2.15,TCP,60,9001  >  35978 [ACK] Seq=15114187 Ack=276711291 Win=65535 Len=0
1,4.090473999999631,62.210.85.178,10.0.2.15,TCP,60,9001  >  35978 [ACK] Seq=15114187 Ack=276712441 Win=65535 Len=0
1,4.090506999999889,10.0.2.15,62.210.85.178,TLSv1.2,332,Application Data
1,4.090541000000485,62.210.85.178,10.0.2.15,TCP,60,9001  >  35978 [ACK] Seq=15114187 Ack=276712719 Win=65535 Len=0
1,4.090591000000131,10.0.2.15,62.210.85.178,TLSv1.2,3868,Application Data
1,4.090627000000495,62.210.85.178,10.0.2.15,TCP,60,9001  >  35978 [ACK] Seq=15114187 Ack=276714179 Win=65535 Len=0
1,4.090634000000136,62.210.85.178,10.0.2.15,TCP,60,9001  >  35978 [ACK] Seq=15114187 Ack=276715639 Win=65535 Len=0
1,4.0906370000002426,62.210.85.178,10.0.2.15,TCP,60,9001  >  35978 [ACK] Seq=15114187 Ack=276716533 Win=65535 Len=0
1,4.0906740000000354,10.0.2.15,62.210.85.178,TLSv1.2,4124,Application Data
1,4.090707999999722,62.210.85.178,10.0.2.15,TCP,60,9001  >  35978 [ACK] Seq=15114187 Ack=276717993 Win=65535 Len=0
1,4.090715000000273,62.210.85.178,10.0.2.15,TCP,60,9001  >  35978 [ACK] Seq=15114187 Ack=276719453 Win=65535 Len=0
1,4.090718000000379,62.210.85.178,10.0.2.15,TCP,60,9001  >  35978 [ACK] Seq=15114187 Ack=276720603 Win=65535 Len=0
1,4.090752000000066,10.0.2.15,62.210.85.178,TLSv1.2,3030,Application Data
1,4.090787000000091,62.210.85.178,10.0.2.15,TCP,60,9001  >  35978 [ACK] Seq=15114187 Ack=276722063 Win=65535 Len=0
1,4.090793000000303,62.210.85.178,10.0.2.15,TCP,60,9001  >  35978 [ACK] Seq=15114187 Ack=276723523 Win=65535 Len=0
1,4.0907960000004095,62.210.85.178,10.0.2.15,TCP,60,9001  >  35978 [ACK] Seq=15114187 Ack=276723579 Win=65535 Len=0
1,4.1022579999998925,10.0.2.15,62.210.85.178,TLSv1.2,4124,Application Data
1,4.10235399999965,62.210.85.178,10.0.2.15,TCP,60,9001  >  35978 [ACK] Seq=15114187 Ack=276725039 Win=65535 Len=0
1,4.102378999999928,62.210.85.178,10.0.2.15,TCP,60,9001  >  35978 [ACK] Seq=15114187 Ack=276726499 Win=65535 Len=0
1,4.102382000000034,62.210.85.178,10.0.2.15,TCP,60,9001  >  35978 [ACK] Seq=15114187 Ack=276727649 Win=65535 Len=0
1,4.102418000000398,10.0.2.15,62.210.85.178,TLSv1.2,654,Application Data
1,4.102453000000423,62.210.85.178,10.0.2.15,TCP,60,9001  >  35978 [ACK] Seq=15114187 Ack=276728249 Win=65535 Len=0
1,4.20713700000033,54.93.77.70,10.0.2.15,TLSv1.2,590,Application Data
1,4.208800000000338,54.93.77.70,10.0.2.15,TCP,2950,"9001  >  34692 [PSH, ACK] Seq=276318551 Ack=15155253 Win=65535 Len=2896 [TCP segment of a reassembled PDU]"
1,4.208881000000474,10.0.2.15,54.93.77.70,TCP,54,34692  >  9001 [ACK] Seq=15155253 Ack=276321447 Win=65535 Len=0
1,4.220328999999765,54.93.77.70,10.0.2.15,TLSv1.2,2950,Application Data [TCP segment of a reassembled PDU]
1,4.220344000000296,54.93.77.70,10.0.2.15,TLSv1.2,1502,Application Data
1,4.220377999999982,10.0.2.15,54.93.77.70,TCP,54,34692  >  9001 [ACK] Seq=15155253 Ack=276324343 Win=65535 Len=0
1,4.220444999999927,10.0.2.15,54.93.77.70,TCP,54,34692  >  9001 [ACK] Seq=15155253 Ack=276325791 Win=65535 Len=0
1,4.365370000000439,54.93.77.70,10.0.2.15,TLSv1.2,590,Application Data
1,4.3719920000003185,54.93.77.70,10.0.2.15,TCP,2950,"9001  >  34692 [PSH, ACK] Seq=276326327 Ack=15155253 Win=65535 Len=2896 [TCP segment of a reassembled PDU]"
1,4.3720579999999245,10.0.2.15,54.93.77.70,TCP,54,34692  >  9001 [ACK] Seq=15155253 Ack=276329223 Win=65535 Len=0
1,4.381645999999819,54.93.77.70,10.0.2.15,TLSv1.2,778,Application Data
1,4.425328999999692,10.0.2.15,54.93.77.70,TCP,54,34692  >  9001 [ACK] Seq=15155253 Ack=276329947 Win=65535 Len=0
1,4.506677999999738,54.93.77.70,10.0.2.15,TCP,2950,"9001  >  34692 [PSH, ACK] Seq=276329947 Ack=15155253 Win=65535 Len=2896 [TCP segment of a reassembled PDU]"
1,4.506752999999662,10.0.2.15,54.93.77.70,TCP,54,34692  >  9001 [ACK] Seq=15155253 Ack=276332843 Win=65535 Len=0
1,4.541503000000375,54.93.77.70,10.0.2.15,TLSv1.2,3674,Application Data [TCP segment of a reassembled PDU]
1,4.541527999999744,54.93.77.70,10.0.2.15,TLSv1.2,4398,Application Data [TCP segment of a reassembled PDU]
1,4.54157000000032,10.0.2.15,54.93.77.70,TCP,54,34692  >  9001 [ACK] Seq=15155253 Ack=276336463 Win=65535 Len=0
1,4.541610999999648,10.0.2.15,54.93.77.70,TCP,54,34692  >  9001 [ACK] Seq=15155253 Ack=276340807 Win=65535 Len=0
1,4.544354999999996,54.93.77.70,10.0.2.15,TLSv1.2,7294,"Application Data, Application Data, Application Data"
1,4.544401000000107,10.0.2.15,54.93.77.70,TCP,54,34692  >  9001 [ACK] Seq=15155253 Ack=276348047 Win=65535 Len=0
1,4.544624000000113,10.0.2.15,54.93.77.70,TLSv1.2,590,Application Data
1,4.544708000000355,54.93.77.70,10.0.2.15,TCP,60,9001  >  34692 [ACK] Seq=276348047 Ack=15155789 Win=65535 Len=0
1,4.670135999999729,54.93.77.70,10.0.2.15,TLSv1.2,2950,Application Data [TCP segment of a reassembled PDU]
1,4.670211999999992,10.0.2.15,54.93.77.70,TCP,54,34692  >  9001 [ACK] Seq=15155789 Ack=276350943 Win=65535 Len=0
1,4.674380000000383,54.93.77.70,10.0.2.15,TLSv1.2,2950,Application Data [TCP segment of a reassembled PDU]
1,4.674415999999837,54.93.77.70,10.0.2.15,TCP,1474,9001  >  34692 [ACK] Seq=276353839 Ack=15155789 Win=65535 Len=1420 [TCP segment of a reassembled PDU]
1,4.674481000000014,10.0.2.15,54.93.77.70,TCP,54,34692  >  9001 [ACK] Seq=15155789 Ack=276353839 Win=65535 Len=0
1,4.674517999999807,54.93.77.70,10.0.2.15,TLSv1.2,14418,"Application Data, Application Data, Application Data, Application Data, Application Data, Application Data"
1,4.674573000000237,10.0.2.15,54.93.77.70,TCP,54,34692  >  9001 [ACK] Seq=15155789 Ack=276369623 Win=65535 Len=0
1,4.674796999999671,10.0.2.15,54.93.77.70,TLSv1.2,590,Application Data
1,4.674864999999954,54.93.77.70,10.0.2.15,TCP,60,9001  >  34692 [ACK] Seq=276369623 Ack=15156325 Win=65535 Len=0
1,4.6759890000003,54.93.77.70,10.0.2.15,TLSv1.2,4398,Application Data [TCP segment of a reassembled PDU]
1,4.676003000000492,54.93.77.70,10.0.2.15,TLSv1.2,2950,"Application Data, Application Data"
1,4.676007000000027,62.210.85.178,10.0.2.15,TLSv1.2,590,Application Data
1,4.676046999999926,10.0.2.15,54.93.77.70,TCP,54,34692  >  9001 [ACK] Seq=15156325 Ack=276373967 Win=65535 Len=0
1,4.676115999999638,10.0.2.15,54.93.77.70,TCP,54,34692  >  9001 [ACK] Seq=15156325 Ack=276376863 Win=65535 Len=0
1,4.684481999999662,10.0.2.15,54.93.77.70,TLSv1.2,590,Application Data
1,4.684578999999758,54.93.77.70,10.0.2.15,TCP,60,9001  >  34692 [ACK] Seq=276376863 Ack=15156861 Win=65535 Len=0
1,4.690819000000374,54.93.77.70,10.0.2.15,TLSv1.2,1314,Application Data
1,4.694332000000031,10.0.2.15,54.93.77.70,TLSv1.2,590,Application Data
1,4.694467999999688,54.93.77.70,10.0.2.15,TCP,60,9001  >  34692 [ACK] Seq=276378123 Ack=15157397 Win=65535 Len=0
1,4.717302000000018,10.0.2.15,62.210.85.178,TCP,54,35978  >  9001 [ACK] Seq=276728249 Ack=15114723 Win=65535 Len=0
1,4.832250000000386,62.210.85.178,10.0.2.15,TLSv1.2,590,Application Data
1,4.832343000000037,10.0.2.15,62.210.85.178,TCP,54,35978  >  9001 [ACK] Seq=276728249 Ack=15115259 Win=65535 Len=0
1,4.911326999999801,62.210.85.178,10.0.2.15,TLSv1.2,1104,Application Data
1,4.911401000000296,10.0.2.15,62.210.85.178,TCP,54,35978  >  9001 [ACK] Seq=276728249 Ack=15116309 Win=65535 Len=0
1,4.911844000000201,10.0.2.15,62.210.85.178,TLSv1.2,590,Application Data
1,4.911946000000171,62.210.85.178,10.0.2.15,TCP,60,9001  >  35978 [ACK] Seq=15116309 Ack=276728785 Win=65535 Len=0
1,5.05675599999995,54.93.77.70,10.0.2.15,TLSv1.2,590,Application Data
1,5.0571460000001025,10.0.2.15,54.93.77.70,TLSv1.2,590,Application Data
1,5.0573059999996985,54.93.77.70,10.0.2.15,TCP,60,9001  >  34692 [ACK] Seq=276378659 Ack=15157933 Win=65535 Len=0
1,5.1660689999998795,62.210.85.178,10.0.2.15,TLSv1.2,590,Application Data
1,5.16888900000049,10.0.2.15,62.210.85.178,TLSv1.2,590,Application Data
1,5.169084000000112,62.210.85.178,10.0.2.15,TCP,60,9001  >  35978 [ACK] Seq=15116845 Ack=276729321 Win=65535 Len=0
1,5.178192000000308,10.0.2.15,62.210.85.178,TLSv1.2,4124,Application Data
1,5.178326000000197,10.0.2.15,62.210.85.178,TCP,2974,35978  >  9001 [ACK] Seq=276733391 Ack=15116845 Win=65535 Len=2920 [TCP segment of a reassembled PDU]
1,5.178353999999672,62.210.85.178,10.0.2.15,TCP,60,9001  >  35978 [ACK] Seq=15116845 Ack=276730781 Win=65535 Len=0
1,5.178364999999758,62.210.85.178,10.0.2.15,TCP,60,9001  >  35978 [ACK] Seq=15116845 Ack=276732241 Win=65535 Len=0
1,5.17837099999997,62.210.85.178,10.0.2.15,TCP,60,9001  >  35978 [ACK] Seq=15116845 Ack=276733391 Win=65535 Len=0
1,5.178412999999637,10.0.2.15,62.210.85.178,TLSv1.2,304,Application Data
1,5.178455000000213,62.210.85.178,10.0.2.15,TCP,60,9001  >  35978 [ACK] Seq=15116845 Ack=276734851 Win=65535 Len=0
1,5.178461999999854,62.210.85.178,10.0.2.15,TCP,60,9001  >  35978 [ACK] Seq=15116845 Ack=276736311 Win=65535 Len=0
1,5.17846499999996,62.210.85.178,10.0.2.15,TCP,60,9001  >  35978 [ACK] Seq=15116845 Ack=276736561 Win=65535 Len=0
1,5.471185999999761,54.93.77.70,10.0.2.15,TCP,2950,"9001  >  34692 [PSH, ACK] Seq=276378659 Ack=15157933 Win=65535 Len=2896 [TCP segment of a reassembled PDU]"
1,5.471324000000095,10.0.2.15,54.93.77.70,TCP,54,34692  >  9001 [ACK] Seq=15157933 Ack=276381555 Win=65535 Len=0
1,5.474600999999893,54.93.77.70,10.0.2.15,TLSv1.2,778,Application Data
1,5.498128999999608,54.93.77.70,10.0.2.15,TCP,2950,"9001  >  34692 [PSH, ACK] Seq=276382279 Ack=15157933 Win=65535 Len=2896 [TCP segment of a reassembled PDU]"
1,5.498193999999785,10.0.2.15,54.93.77.70,TCP,54,34692  >  9001 [ACK] Seq=15157933 Ack=276385175 Win=65535 Len=0
1,5.514635999999882,54.93.77.70,10.0.2.15,TLSv1.2,1314,"Application Data, Application Data"
1,5.516880000000128,10.0.2.15,54.93.77.70,TLSv1.2,590,Application Data
1,5.517037999999957,54.93.77.70,10.0.2.15,TCP,60,9001  >  34692 [ACK] Seq=276386435 Ack=15158469 Win=65535 Len=0
1,5.671691999999894,62.210.85.178,10.0.2.15,TLSv1.2,590,Application Data
1,5.671994999999697,10.0.2.15,62.210.85.178,TLSv1.2,590,Application Data
1,5.672093000000132,62.210.85.178,10.0.2.15,TCP,60,9001  >  35978 [ACK] Seq=15117381 Ack=276737097 Win=65535 Len=0
1,5.875479000000269,54.93.77.70,10.0.2.15,TLSv1.2,590,Application Data
1,5.875845000000481,10.0.2.15,54.93.77.70,TLSv1.2,590,Application Data
1,5.875965000000178,54.93.77.70,10.0.2.15,TCP,60,9001  >  34692 [ACK] Seq=276386971 Ack=15159005 Win=65535 Len=0
1,6.081559999999627,62.210.85.178,10.0.2.15,TLSv1.2,590,Application Data
1,6.088060000000041,10.0.2.15,62.210.85.178,TLSv1.2,590,Application Data
1,6.089426000000458,62.210.85.178,10.0.2.15,TCP,60,9001  >  35978 [ACK] Seq=15117917 Ack=276737633 Win=65535 Len=0
1,6.098425000000134,10.0.2.15,62.210.85.178,TLSv1.2,4124,Application Data
1,6.098527000000104,10.0.2.15,62.210.85.178,TCP,2974,35978  >  9001 [ACK] Seq=276741703 Ack=15117917 Win=65535 Len=2920 [TCP segment of a reassembled PDU]
1,6.0985749999999825,62.210.85.178,10.0.2.15,TCP,60,9001  >  35978 [ACK] Seq=15117917 Ack=276739093 Win=65535 Len=0
1,6.098587999999836,62.210.85.178,10.0.2.15,TCP,60,9001  >  35978 [ACK] Seq=15117917 Ack=276740553 Win=65535 Len=0
1,6.09859299999971,62.210.85.178,10.0.2.15,TCP,60,9001  >  35978 [ACK] Seq=15117917 Ack=276741703 Win=65535 Len=0
1,6.098598000000493,62.210.85.178,10.0.2.15,TCP,60,9001  >  35978 [ACK] Seq=15117917 Ack=276743163 Win=65535 Len=0
1,6.0986009999996895,62.210.85.178,10.0.2.15,TCP,60,9001  >  35978 [ACK] Seq=15117917 Ack=276744623 Win=65535 Len=0
1,6.098637000000053,10.0.2.15,62.210.85.178,TLSv1.2,1204,Application Data
1,6.098675000000185,62.210.85.178,10.0.2.15,TCP,60,9001  >  35978 [ACK] Seq=15117917 Ack=276745773 Win=65535 Len=0
