No.,Time,Source,Destination,Protocol,Length,Info
1,0.02069500000015978,10.0.2.15,54.93.77.70,TCP,54,34692  >  9001 [ACK] Seq=14997683 Ack=273290233 Win=65535 Len=0
1,0.057410999999774504,62.210.85.178,10.0.2.15,TLSv1.2,590,Application Data
1,0.11114600000018982,10.0.2.15,62.210.85.178,TCP,54,35978  >  9001 [ACK] Seq=273641635 Ack=14957101 Win=65535 Len=0
1,0.13073900000017602,10.0.2.15,54.93.77.70,TLSv1.2,590,Application Data
1,0.13089800000034302,54.93.77.70,10.0.2.15,TCP,60,9001  >  34692 [ACK] Seq=273290233 Ack=14998219 Win=65535 Len=0
1,0.26251700000011624,62.210.85.178,10.0.2.15,TLSv1.2,590,Application Data
1,0.2626200000004246,10.0.2.15,62.210.85.178,TCP,54,35978  >  9001 [ACK] Seq=273641635 Ack=14957637 Win=65535 Len=0
1,0.263187000000471,10.0.2.15,62.210.85.178,TLSv1.2,590,Application Data
1,0.26330500000040047,62.210.85.178,10.0.2.15,TCP,60,9001  >  35978 [ACK] Seq=14957637 Ack=273642171 Win=65535 Len=0
1,0.4586380000000645,54.93.77.70,10.0.2.15,TLSv1.2,590,Application Data
1,0.45874000000003434,10.0.2.15,54.93.77.70,TCP,54,34692  >  9001 [ACK] Seq=14998219 Ack=273290769 Win=65535 Len=0
1,0.4592240000001766,10.0.2.15,54.93.77.70,TLSv1.2,1618,Application Data
1,0.4593640000002779,54.93.77.70,10.0.2.15,TCP,60,9001  >  34692 [ACK] Seq=273290769 Ack=14999679 Win=65535 Len=0
1,0.4593780000004699,54.93.77.70,10.0.2.15,TCP,60,9001  >  34692 [ACK] Seq=273290769 Ack=14999783 Win=65535 Len=0
1,0.6662519999999859,62.210.85.178,10.0.2.15,TLSv1.2,1618,Application Data
1,0.6664099999998143,10.0.2.15,62.210.85.178,TCP,54,35978  >  9001 [ACK] Seq=273642171 Ack=14959201 Win=65535 Len=0
1,0.689183999999841,10.0.2.15,62.210.85.178,TLSv1.2,590,Application Data
1,0.6893980000004376,62.210.85.178,10.0.2.15,TCP,60,9001  >  35978 [ACK] Seq=14959201 Ack=273642707 Win=65535 Len=0
1,0.7011640000000625,10.0.2.15,62.210.85.178,TLSv1.2,1618,Application Data
1,0.7012970000005225,62.210.85.178,10.0.2.15,TCP,60,9001  >  35978 [ACK] Seq=14959201 Ack=273644167 Win=65535 Len=0
1,0.7013139999999112,62.210.85.178,10.0.2.15,TCP,60,9001  >  35978 [ACK] Seq=14959201 Ack=273644271 Win=65535 Len=0
1,0.8257590000002892,54.93.77.70,10.0.2.15,TLSv1.2,590,Application Data
1,0.8672580000002199,54.93.77.70,10.0.2.15,TCP,1502,"9001  >  34692 [PSH, ACK] Seq=273291305 Ack=14999783 Win=65535 Len=1448 [TCP segment of a reassembled PDU]"
1,0.8673369999996794,10.0.2.15,54.93.77.70,TCP,54,34692  >  9001 [ACK] Seq=14999783 Ack=273292753 Win=65535 Len=0
1,0.8744509999996808,54.93.77.70,10.0.2.15,TLSv1.2,170,Application Data
1,0.8766230000001087,10.0.2.15,54.93.77.70,TLSv1.2,590,Application Data
1,0.8767820000002757,54.93.77.70,10.0.2.15,TCP,60,9001  >  34692 [ACK] Seq=273292869 Ack=15000319 Win=65535 Len=0
1,1.0744030000005296,62.210.85.178,10.0.2.15,TLSv1.2,590,Application Data
1,1.0747360000004846,10.0.2.15,62.210.85.178,TLSv1.2,590,Application Data
1,1.0748430000003282,62.210.85.178,10.0.2.15,TCP,60,9001  >  35978 [ACK] Seq=14959737 Ack=273644807 Win=65535 Len=0
1,1.198631000000205,54.93.77.70,10.0.2.15,TLSv1.2,590,Application Data
1,1.1990139999998064,10.0.2.15,54.93.77.70,TLSv1.2,590,Application Data
1,1.1991219999999885,54.93.77.70,10.0.2.15,TCP,60,9001  >  34692 [ACK] Seq=273293405 Ack=15000855 Win=65535 Len=0
1,1.3804049999998824,62.210.85.178,10.0.2.15,TLSv1.2,590,Application Data
1,1.386066000000028,10.0.2.15,62.210.85.178,TLSv1.2,590,Application Data
1,1.3862319999998363,62.210.85.178,10.0.2.15,TCP,60,9001  >  35978 [ACK] Seq=14960273 Ack=273645343 Win=65535 Len=0
1,1.397490999999718,10.0.2.15,62.210.85.178,TLSv1.2,4124,Application Data
1,1.3976089999996475,10.0.2.15,62.210.85.178,TCP,2974,35978  >  9001 [ACK] Seq=273649413 Ack=14960273 Win=65535 Len=2920 [TCP segment of a reassembled PDU]
1,1.3976570000004358,62.210.85.178,10.0.2.15,TCP,60,9001  >  35978 [ACK] Seq=14960273 Ack=273646803 Win=65535 Len=0
1,1.3976700000002893,62.210.85.178,10.0.2.15,TCP,60,9001  >  35978 [ACK] Seq=14960273 Ack=273648263 Win=65535 Len=0
1,1.3976760000005015,62.210.85.178,10.0.2.15,TCP,60,9001  >  35978 [ACK] Seq=14960273 Ack=273649413 Win=65535 Len=0
1,1.3976810000003752,62.210.85.178,10.0.2.15,TCP,60,9001  >  35978 [ACK] Seq=14960273 Ack=273650873 Win=65535 Len=0
1,1.3976840000004813,62.210.85.178,10.0.2.15,TCP,60,9001  >  35978 [ACK] Seq=14960273 Ack=273652333 Win=65535 Len=0
1,1.3977199999999357,10.0.2.15,62.210.85.178,TLSv1.2,1204,Application Data
1,1.3977580000000671,62.210.85.178,10.0.2.15,TCP,60,9001  >  35978 [ACK] Seq=14960273 Ack=273653483 Win=65535 Len=0
1,1.3978040000001783,10.0.2.15,62.210.85.178,TLSv1.2,4124,Application Data
1,1.3978429999997388,62.210.85.178,10.0.2.15,TCP,60,9001  >  35978 [ACK] Seq=14960273 Ack=273654943 Win=65535 Len=0
1,1.3978520000000572,62.210.85.178,10.0.2.15,TCP,60,9001  >  35978 [ACK] Seq=14960273 Ack=273656403 Win=65535 Len=0
1,1.3978560000005018,62.210.85.178,10.0.2.15,TCP,60,9001  >  35978 [ACK] Seq=14960273 Ack=273657553 Win=65535 Len=0
1,1.3978960000004008,10.0.2.15,62.210.85.178,TLSv1.2,4124,Application Data
1,1.3979360000002998,62.210.85.178,10.0.2.15,TCP,60,9001  >  35978 [ACK] Seq=14960273 Ack=273659013 Win=65535 Len=0
1,1.3979449999997087,62.210.85.178,10.0.2.15,TCP,60,9001  >  35978 [ACK] Seq=14960273 Ack=273660473 Win=65535 Len=0
1,1.3979950000002646,62.210.85.178,10.0.2.15,TCP,60,9001  >  35978 [ACK] Seq=14960273 Ack=273661623 Win=65535 Len=0
1,1.3980300000002899,10.0.2.15,62.210.85.178,TLSv1.2,332,Application Data
1,1.3980659999997442,62.210.85.178,10.0.2.15,TCP,60,9001  >  35978 [ACK] Seq=14960273 Ack=273661901 Win=65535 Len=0
1,1.3981210000001738,10.0.2.15,62.210.85.178,TLSv1.2,3868,Application Data
1,1.3981620000004114,62.210.85.178,10.0.2.15,TCP,60,9001  >  35978 [ACK] Seq=14960273 Ack=273663361 Win=65535 Len=0
1,1.3981700000003912,62.210.85.178,10.0.2.15,TCP,60,9001  >  35978 [ACK] Seq=14960273 Ack=273664821 Win=65535 Len=0
1,1.3981730000004973,62.210.85.178,10.0.2.15,TCP,60,9001  >  35978 [ACK] Seq=14960273 Ack=273665715 Win=65535 Len=0
1,1.3982109999997192,10.0.2.15,62.210.85.178,TLSv1.2,4124,Application Data
1,1.3982510000005277,62.210.85.178,10.0.2.15,TCP,60,9001  >  35978 [ACK] Seq=14960273 Ack=273667175 Win=65535 Len=0
1,1.398258000000169,62.210.85.178,10.0.2.15,TCP,60,9001  >  35978 [ACK] Seq=14960273 Ack=273668635 Win=65535 Len=0
1,1.3982619999997041,62.210.85.178,10.0.2.15,TCP,60,9001  >  35978 [ACK] Seq=14960273 Ack=273669785 Win=65535 Len=0
1,1.3982969999997295,10.0.2.15,62.210.85.178,TLSv1.2,3030,Application Data
1,1.3983349999998609,62.210.85.178,10.0.2.15,TCP,60,9001  >  35978 [ACK] Seq=14960273 Ack=273671245 Win=65535 Len=0
1,1.3983429999998407,62.210.85.178,10.0.2.15,TCP,60,9001  >  35978 [ACK] Seq=14960273 Ack=273672705 Win=65535 Len=0
1,1.3983470000002853,62.210.85.178,10.0.2.15,TCP,60,9001  >  35978 [ACK] Seq=14960273 Ack=273672761 Win=65535 Len=0
1,1.4097540000002482,10.0.2.15,62.210.85.178,TLSv1.2,4124,Application Data
1,1.4098080000003392,62.210.85.178,10.0.2.15,TCP,60,9001  >  35978 [ACK] Seq=14960273 Ack=273674221 Win=65535 Len=0
1,1.4098190000004251,62.210.85.178,10.0.2.15,TCP,60,9001  >  35978 [ACK] Seq=14960273 Ack=273675681 Win=65535 Len=0
1,1.4098240000002988,62.210.85.178,10.0.2.15,TCP,60,9001  >  35978 [ACK] Seq=14960273 Ack=273676831 Win=65535 Len=0
1,1.4098730000005162,10.0.2.15,62.210.85.178,TLSv1.2,4124,Application Data
1,1.4099139999998442,62.210.85.178,10.0.2.15,TCP,60,9001  >  35978 [ACK] Seq=14960273 Ack=273678291 Win=65535 Len=0
1,1.4099230000001626,62.210.85.178,10.0.2.15,TCP,60,9001  >  35978 [ACK] Seq=14960273 Ack=273679751 Win=65535 Len=0
1,1.4099269999996977,62.210.85.178,10.0.2.15,TCP,60,9001  >  35978 [ACK] Seq=14960273 Ack=273680901 Win=65535 Len=0
1,1.4099670000005062,10.0.2.15,62.210.85.178,TLSv1.2,4124,Application Data
1,1.4100060000000667,62.210.85.178,10.0.2.15,TCP,60,9001  >  35978 [ACK] Seq=14960273 Ack=273682361 Win=65535 Len=0
1,1.4100140000000465,62.210.85.178,10.0.2.15,TCP,60,9001  >  35978 [ACK] Seq=14960273 Ack=273683821 Win=65535 Len=0
1,1.4100189999999202,62.210.85.178,10.0.2.15,TCP,60,9001  >  35978 [ACK] Seq=14960273 Ack=273684971 Win=65535 Len=0
1,1.410055999999713,10.0.2.15,62.210.85.178,TLSv1.2,4124,Application Data
1,1.4100939999998445,62.210.85.178,10.0.2.15,TCP,60,9001  >  35978 [ACK] Seq=14960273 Ack=273686431 Win=65535 Len=0
1,1.4101019999998243,62.210.85.178,10.0.2.15,TCP,60,9001  >  35978 [ACK] Seq=14960273 Ack=273687891 Win=65535 Len=0
1,1.410106999999698,62.210.85.178,10.0.2.15,TCP,60,9001  >  35978 [ACK] Seq=14960273 Ack=273689041 Win=65535 Len=0
1,1.4101419999997233,10.0.2.15,62.210.85.178,TLSv1.2,332,Application Data
1,1.4101790000004257,62.210.85.178,10.0.2.15,TCP,60,9001  >  35978 [ACK] Seq=14960273 Ack=273689319 Win=65535 Len=0
1,1.4102309999998397,10.0.2.15,62.210.85.178,TLSv1.2,3868,Application Data
1,1.4102700000003097,62.210.85.178,10.0.2.15,TCP,60,9001  >  35978 [ACK] Seq=14960273 Ack=273690779 Win=65535 Len=0
1,1.4102780000002895,62.210.85.178,10.0.2.15,TCP,60,9001  >  35978 [ACK] Seq=14960273 Ack=273692239 Win=65535 Len=0
1,1.4102830000001632,62.210.85.178,10.0.2.15,TCP,60,9001  >  35978 [ACK] Seq=14960273 Ack=273693133 Win=65535 Len=0
1,1.4103210000002946,10.0.2.15,62.210.85.178,TLSv1.2,4124,Application Data
1,1.4103610000001936,62.210.85.178,10.0.2.15,TCP,60,9001  >  35978 [ACK] Seq=14960273 Ack=273694593 Win=65535 Len=0
1,1.4103690000001734,62.210.85.178,10.0.2.15,TCP,60,9001  >  35978 [ACK] Seq=14960273 Ack=273696053 Win=65535 Len=0
1,1.4103729999997086,62.210.85.178,10.0.2.15,TCP,60,9001  >  35978 [ACK] Seq=14960273 Ack=273697203 Win=65535 Len=0
1,1.4104079999997339,10.0.2.15,62.210.85.178,TLSv1.2,3030,Application Data
1,1.4104470000002038,62.210.85.178,10.0.2.15,TCP,60,9001  >  35978 [ACK] Seq=14960273 Ack=273698663 Win=65535 Len=0
1,1.4104550000001836,62.210.85.178,10.0.2.15,TCP,60,9001  >  35978 [ACK] Seq=14960273 Ack=273700123 Win=65535 Len=0
1,1.4104580000002898,62.210.85.178,10.0.2.15,TCP,60,9001  >  35978 [ACK] Seq=14960273 Ack=273700179 Win=65535 Len=0
1,1.4217570000000705,10.0.2.15,62.210.85.178,TLSv1.2,4124,Application Data
1,1.4218579999997019,62.210.85.178,10.0.2.15,TCP,60,9001  >  35978 [ACK] Seq=14960273 Ack=273701639 Win=65535 Len=0
1,1.4218680000003587,62.210.85.178,10.0.2.15,TCP,60,9001  >  35978 [ACK] Seq=14960273 Ack=273703099 Win=65535 Len=0
1,1.4218710000004648,62.210.85.178,10.0.2.15,TCP,60,9001  >  35978 [ACK] Seq=14960273 Ack=273704249 Win=65535 Len=0
1,1.4218980000005104,10.0.2.15,62.210.85.178,TCP,2974,35978  >  9001 [ACK] Seq=273704249 Ack=14960273 Win=65535 Len=2920 [TCP segment of a reassembled PDU]
1,1.4219359999997323,62.210.85.178,10.0.2.15,TCP,60,9001  >  35978 [ACK] Seq=14960273 Ack=273705709 Win=65535 Len=0
1,1.421943999999712,62.210.85.178,10.0.2.15,TCP,60,9001  >  35978 [ACK] Seq=14960273 Ack=273707169 Win=65535 Len=0
1,1.4219750000002023,10.0.2.15,62.210.85.178,TLSv1.2,1204,Application Data
1,1.4220119999999952,62.210.85.178,10.0.2.15,TCP,60,9001  >  35978 [ACK] Seq=14960273 Ack=273708319 Win=65535 Len=0
1,1.4220550000000003,10.0.2.15,62.210.85.178,TLSv1.2,1746,Application Data
1,1.4220980000000054,62.210.85.178,10.0.2.15,TCP,60,9001  >  35978 [ACK] Seq=14960273 Ack=273709779 Win=65535 Len=0
1,1.4221049999996467,62.210.85.178,10.0.2.15,TCP,60,9001  >  35978 [ACK] Seq=14960273 Ack=273710011 Win=65535 Len=0
1,1.488470999999663,54.93.77.70,10.0.2.15,TLSv1.2,590,Application Data
1,1.4994290000004185,54.93.77.70,10.0.2.15,TCP,2950,"9001  >  34692 [PSH, ACK] Seq=273293941 Ack=15000855 Win=65535 Len=2896 [TCP segment of a reassembled PDU]"
1,1.4995030000000042,10.0.2.15,54.93.77.70,TCP,54,34692  >  9001 [ACK] Seq=15000855 Ack=273296837 Win=65535 Len=0
1,1.5120660000002317,54.93.77.70,10.0.2.15,TLSv1.2,4398,"Application Data, Application Data"
1,1.5121079999998983,10.0.2.15,54.93.77.70,TCP,54,34692  >  9001 [ACK] Seq=15000855 Ack=273301181 Win=65535 Len=0
1,1.5745280000001003,54.93.77.70,10.0.2.15,TCP,2950,"9001  >  34692 [PSH, ACK] Seq=273301181 Ack=15000855 Win=65535 Len=2896 [TCP segment of a reassembled PDU]"
1,1.5746049999997922,10.0.2.15,54.93.77.70,TCP,54,34692  >  9001 [ACK] Seq=15000855 Ack=273304077 Win=65535 Len=0
1,1.5751650000001973,54.93.77.70,10.0.2.15,TLSv1.2,778,Application Data
1,1.585030000000188,54.93.77.70,10.0.2.15,TCP,2950,"9001  >  34692 [PSH, ACK] Seq=273304801 Ack=15000855 Win=65535 Len=2896 [TCP segment of a reassembled PDU]"
1,1.5850909999999203,10.0.2.15,54.93.77.70,TCP,54,34692  >  9001 [ACK] Seq=15000855 Ack=273307697 Win=65535 Len=0
1,1.5909460000002582,54.93.77.70,10.0.2.15,TLSv1.2,2950,Application Data [TCP segment of a reassembled PDU]
1,1.590994000000137,10.0.2.15,54.93.77.70,TCP,54,34692  >  9001 [ACK] Seq=15000855 Ack=273310593 Win=65535 Len=0
1,1.5923320000001695,54.93.77.70,10.0.2.15,TLSv1.2,8574,"Application Data, Application Data"
1,1.5923920000004728,10.0.2.15,54.93.77.70,TCP,54,34692  >  9001 [ACK] Seq=15000855 Ack=273319113 Win=65535 Len=0
1,1.592439000000013,54.93.77.70,10.0.2.15,TCP,222,"9001  >  34692 [PSH, ACK] Seq=273319113 Ack=15000855 Win=65535 Len=168 [TCP segment of a reassembled PDU]"
1,1.6008990000000267,54.93.77.70,10.0.2.15,TLSv1.2,1502,Application Data [TCP segment of a reassembled PDU]
1,1.600945000000138,10.0.2.15,54.93.77.70,TCP,54,34692  >  9001 [ACK] Seq=15000855 Ack=273320729 Win=65535 Len=0
1,1.6011420000004364,10.0.2.15,54.93.77.70,TLSv1.2,590,Application Data
1,1.6012550000004921,54.93.77.70,10.0.2.15,TCP,60,9001  >  34692 [ACK] Seq=273320729 Ack=15001391 Win=65535 Len=0
1,1.601383000000169,54.93.77.70,10.0.2.15,TLSv1.2,170,Application Data
1,1.6072070000000167,54.93.77.70,10.0.2.15,TLSv1.2,5846,Application Data
1,1.6072739999999612,10.0.2.15,54.93.77.70,TCP,54,34692  >  9001 [ACK] Seq=15001391 Ack=273326637 Win=65535 Len=0
1,1.6232209999998304,54.93.77.70,10.0.2.15,TLSv1.2,988,Application Data
1,1.6283700000003591,54.93.77.70,10.0.2.15,TLSv1.2,8742,"Application Data, Application Data"
1,1.6284480000003896,10.0.2.15,54.93.77.70,TCP,54,34692  >  9001 [ACK] Seq=15001391 Ack=273336259 Win=65535 Len=0
1,1.6403280000004088,54.93.77.70,10.0.2.15,TLSv1.2,2950,Application Data [TCP segment of a reassembled PDU]
1,1.6403780000000552,10.0.2.15,54.93.77.70,TCP,54,34692  >  9001 [ACK] Seq=15001391 Ack=273339155 Win=65535 Len=0
1,1.6409919999996418,54.93.77.70,10.0.2.15,TLSv1.2,4398,Application Data [TCP segment of a reassembled PDU]
1,1.6410359999999855,10.0.2.15,54.93.77.70,TCP,54,34692  >  9001 [ACK] Seq=15001391 Ack=273343499 Win=65535 Len=0
1,1.6412179999997534,10.0.2.15,54.93.77.70,TLSv1.2,590,Application Data
1,1.641327000000274,54.93.77.70,10.0.2.15,TCP,60,9001  >  34692 [ACK] Seq=273343499 Ack=15001927 Win=65535 Len=0
1,1.64458999999988,54.93.77.70,10.0.2.15,TLSv1.2,684,Application Data
1,1.6470580000004702,54.93.77.70,10.0.2.15,TLSv1.2,4398,Application Data
1,1.6471229999997377,10.0.2.15,54.93.77.70,TCP,54,34692  >  9001 [ACK] Seq=15001927 Ack=273348473 Win=65535 Len=0
1,1.6478919999999562,54.93.77.70,10.0.2.15,TCP,2950,"9001  >  34692 [PSH, ACK] Seq=273348473 Ack=15001927 Win=65535 Len=2896 [TCP segment of a reassembled PDU]"
1,1.647939999999835,10.0.2.15,54.93.77.70,TCP,54,34692  >  9001 [ACK] Seq=15001927 Ack=273351369 Win=65535 Len=0
1,1.6511430000000473,10.0.2.15,54.93.77.70,TLSv1.2,590,Application Data
1,1.6512640000000829,54.93.77.70,10.0.2.15,TCP,60,9001  >  34692 [ACK] Seq=273351369 Ack=15002463 Win=65535 Len=0
1,1.664389000000483,54.93.77.70,10.0.2.15,TLSv1.2,7316,"Application Data, Application Data, Application Data, Application Data"
1,1.6645120000002862,10.0.2.15,54.93.77.70,TCP,54,34692  >  9001 [ACK] Seq=15002463 Ack=273358631 Win=65535 Len=0
1,1.6684390000000349,10.0.2.15,54.93.77.70,TLSv1.2,590,Application Data
1,1.6687130000000252,54.93.77.70,10.0.2.15,TCP,60,9001  >  34692 [ACK] Seq=273358631 Ack=15002999 Win=65535 Len=0
1,1.711750000000393,62.210.85.178,10.0.2.15,TLSv1.2,590,Application Data
1,1.7530939999996917,10.0.2.15,62.210.85.178,TCP,54,35978  >  9001 [ACK] Seq=273710011 Ack=14960809 Win=65535 Len=0
1,1.7717320000001564,62.210.85.178,10.0.2.15,TLSv1.2,590,Application Data
1,1.7717959999999948,10.0.2.15,62.210.85.178,TCP,54,35978  >  9001 [ACK] Seq=273710011 Ack=14961345 Win=65535 Len=0
1,1.8292339999998148,62.210.85.178,10.0.2.15,TLSv1.2,1104,Application Data
1,1.829302000000098,10.0.2.15,62.210.85.178,TCP,54,35978  >  9001 [ACK] Seq=273710011 Ack=14962395 Win=65535 Len=0
1,1.8298809999996593,10.0.2.15,62.210.85.178,TLSv1.2,590,Application Data
1,1.8300179999996544,62.210.85.178,10.0.2.15,TCP,60,9001  >  35978 [ACK] Seq=14962395 Ack=273710547 Win=65535 Len=0
1,1.9244360000002416,54.93.77.70,10.0.2.15,TLSv1.2,590,Application Data
1,1.9248749999997017,10.0.2.15,54.93.77.70,TLSv1.2,590,Application Data
1,1.9250350000002072,54.93.77.70,10.0.2.15,TCP,60,9001  >  34692 [ACK] Seq=273359167 Ack=15003535 Win=65535 Len=0
1,2.041715999999724,62.210.85.178,10.0.2.15,TLSv1.2,590,Application Data
1,2.0474960000001374,10.0.2.15,62.210.85.178,TLSv1.2,590,Application Data
1,2.047693999999865,62.210.85.178,10.0.2.15,TCP,60,9001  >  35978 [ACK] Seq=14962931 Ack=273711083 Win=65535 Len=0
1,2.05882500000007,10.0.2.15,62.210.85.178,TLSv1.2,4124,Application Data
1,2.0591999999996915,62.210.85.178,10.0.2.15,TCP,60,9001  >  35978 [ACK] Seq=14962931 Ack=273712543 Win=65535 Len=0
1,2.0592610000003333,62.210.85.178,10.0.2.15,TCP,60,9001  >  35978 [ACK] Seq=14962931 Ack=273714003 Win=65535 Len=0
1,2.0592679999999746,62.210.85.178,10.0.2.15,TCP,60,9001  >  35978 [ACK] Seq=14962931 Ack=273715153 Win=65535 Len=0
1,2.059443000000101,10.0.2.15,62.210.85.178,TLSv1.2,4124,Application Data
1,2.0596690000002127,10.0.2.15,62.210.85.178,TCP,2974,35978  >  9001 [ACK] Seq=273719223 Ack=14962931 Win=65535 Len=2920 [TCP segment of a reassembled PDU]
1,2.059755999999652,62.210.85.178,10.0.2.15,TCP,60,9001  >  35978 [ACK] Seq=14962931 Ack=273716613 Win=65535 Len=0
1,2.0597680000000764,62.210.85.178,10.0.2.15,TCP,60,9001  >  35978 [ACK] Seq=14962931 Ack=273718073 Win=65535 Len=0
1,2.05977299999995,62.210.85.178,10.0.2.15,TCP,60,9001  >  35978 [ACK] Seq=14962931 Ack=273719223 Win=65535 Len=0
1,2.059777999999824,62.210.85.178,10.0.2.15,TCP,60,9001  >  35978 [ACK] Seq=14962931 Ack=273720683 Win=65535 Len=0
1,2.05978099999993,62.210.85.178,10.0.2.15,TCP,60,9001  >  35978 [ACK] Seq=14962931 Ack=273722143 Win=65535 Len=0
1,2.059841999999662,10.0.2.15,62.210.85.178,TLSv1.2,1204,Application Data
1,2.059921000000031,62.210.85.178,10.0.2.15,TCP,60,9001  >  35978 [ACK] Seq=14962931 Ack=273723293 Win=65535 Len=0
1,2.060019000000466,10.0.2.15,62.210.85.178,TLSv1.2,4124,Application Data
1,2.0601580000002286,62.210.85.178,10.0.2.15,TCP,60,9001  >  35978 [ACK] Seq=14962931 Ack=273724753 Win=65535 Len=0
1,2.060171000000082,62.210.85.178,10.0.2.15,TCP,60,9001  >  35978 [ACK] Seq=14962931 Ack=273726213 Win=65535 Len=0
1,2.060175000000527,62.210.85.178,10.0.2.15,TCP,60,9001  >  35978 [ACK] Seq=14962931 Ack=273727363 Win=65535 Len=0
1,2.060215000000426,10.0.2.15,62.210.85.178,TLSv1.2,332,Application Data
1,2.0603179999998247,62.210.85.178,10.0.2.15,TCP,60,9001  >  35978 [ACK] Seq=14962931 Ack=273727641 Win=65535 Len=0
1,2.0604050000001735,10.0.2.15,62.210.85.178,TLSv1.2,3868,Application Data
1,2.06045499999982,62.210.85.178,10.0.2.15,TCP,60,9001  >  35978 [ACK] Seq=14962931 Ack=273729101 Win=65535 Len=0
1,2.060464000000138,62.210.85.178,10.0.2.15,TCP,60,9001  >  35978 [ACK] Seq=14962931 Ack=273730561 Win=65535 Len=0
1,2.0604679999996733,62.210.85.178,10.0.2.15,TCP,60,9001  >  35978 [ACK] Seq=14962931 Ack=273731455 Win=65535 Len=0
1,2.060529000000315,10.0.2.15,62.210.85.178,TLSv1.2,4124,Application Data
1,2.0605969999996887,62.210.85.178,10.0.2.15,TCP,60,9001  >  35978 [ACK] Seq=14962931 Ack=273732915 Win=65535 Len=0
1,2.060606000000007,62.210.85.178,10.0.2.15,TCP,60,9001  >  35978 [ACK] Seq=14962931 Ack=273734375 Win=65535 Len=0
1,2.0606109999998807,62.210.85.178,10.0.2.15,TCP,60,9001  >  35978 [ACK] Seq=14962931 Ack=273735525 Win=65535 Len=0
1,2.0606720000005225,10.0.2.15,62.210.85.178,TLSv1.2,3030,Application Data
1,2.0608570000003965,62.210.85.178,10.0.2.15,TCP,60,9001  >  35978 [ACK] Seq=14962931 Ack=273736985 Win=65535 Len=0
1,2.0608720000000176,62.210.85.178,10.0.2.15,TCP,60,9001  >  35978 [ACK] Seq=14962931 Ack=273738445 Win=65535 Len=0
1,2.0608769999998913,62.210.85.178,10.0.2.15,TCP,60,9001  >  35978 [ACK] Seq=14962931 Ack=273738501 Win=65535 Len=0
1,2.16720499999974,54.93.77.70,10.0.2.15,TLSv1.2,590,Application Data
1,2.1754680000003646,54.93.77.70,10.0.2.15,TCP,2950,"9001  >  34692 [PSH, ACK] Seq=273359703 Ack=15003535 Win=65535 Len=2896 [TCP segment of a reassembled PDU]"
1,2.175575999999637,10.0.2.15,54.93.77.70,TCP,54,34692  >  9001 [ACK] Seq=15003535 Ack=273362599 Win=65535 Len=0
1,2.1760910000002696,54.93.77.70,10.0.2.15,TLSv1.2,4398,Application Data [TCP segment of a reassembled PDU]
1,2.176132999999936,10.0.2.15,54.93.77.70,TCP,54,34692  >  9001 [ACK] Seq=15003535 Ack=273366943 Win=65535 Len=0
1,2.1927960000002713,54.93.77.70,10.0.2.15,TLSv1.2,568,Application Data
1,2.203295999999682,54.93.77.70,10.0.2.15,TCP,2950,"9001  >  34692 [PSH, ACK] Seq=273367457 Ack=15003535 Win=65535 Len=2896 [TCP segment of a reassembled PDU]"
1,2.2033449999998993,10.0.2.15,54.93.77.70,TCP,54,34692  >  9001 [ACK] Seq=15003535 Ack=273370353 Win=65535 Len=0
1,2.2128529999999955,54.93.77.70,10.0.2.15,TLSv1.2,2950,Application Data [TCP segment of a reassembled PDU]
1,2.2128730000003998,54.93.77.70,10.0.2.15,TCP,1502,"9001  >  34692 [PSH, ACK] Seq=273373249 Ack=15003535 Win=65535 Len=1448 [TCP segment of a reassembled PDU]"
1,2.21291999999994,10.0.2.15,54.93.77.70,TCP,54,34692  >  9001 [ACK] Seq=15003535 Ack=273373249 Win=65535 Len=0
1,2.212999000000309,10.0.2.15,54.93.77.70,TCP,54,34692  >  9001 [ACK] Seq=15003535 Ack=273374697 Win=65535 Len=0
1,2.2201789999999164,54.93.77.70,10.0.2.15,TLSv1.2,590,"Application Data, Application Data"
1,2.248381000000336,54.93.77.70,10.0.2.15,TCP,2950,"9001  >  34692 [PSH, ACK] Seq=273375233 Ack=15003535 Win=65535 Len=2896 [TCP segment of a reassembled PDU]"
1,2.2484770000000935,10.0.2.15,54.93.77.70,TCP,54,34692  >  9001 [ACK] Seq=15003535 Ack=273378129 Win=65535 Len=0
1,2.2537380000003395,54.93.77.70,10.0.2.15,TLSv1.2,9046,"Application Data, Application Data, Application Data"
1,2.2538370000002033,10.0.2.15,54.93.77.70,TCP,54,34692  >  9001 [ACK] Seq=15003535 Ack=273387121 Win=65535 Len=0
1,2.254152000000431,10.0.2.15,54.93.77.70,TLSv1.2,590,Application Data
1,2.2542419999999765,54.93.77.70,10.0.2.15,TCP,60,9001  >  34692 [ACK] Seq=273387121 Ack=15004071 Win=65535 Len=0
1,2.2637610000001587,10.0.2.15,54.93.77.70,TLSv1.2,590,Application Data
1,2.2639289999997345,54.93.77.70,10.0.2.15,TCP,60,9001  >  34692 [ACK] Seq=273387121 Ack=15004607 Win=65535 Len=0
1,2.506680000000415,62.210.85.178,10.0.2.15,TLSv1.2,590,Application Data
1,2.531989000000067,62.210.85.178,10.0.2.15,TLSv1.2,590,Application Data
1,2.5320700000002034,10.0.2.15,62.210.85.178,TCP,54,35978  >  9001 [ACK] Seq=273738501 Ack=14964003 Win=65535 Len=0
1,2.5324749999999767,10.0.2.15,62.210.85.178,TLSv1.2,590,Application Data
1,2.5325730000004114,62.210.85.178,10.0.2.15,TCP,60,9001  >  35978 [ACK] Seq=14964003 Ack=273739037 Win=65535 Len=0
1,2.7114879999999175,54.93.77.70,10.0.2.15,TLSv1.2,590,Application Data
1,2.7118520000003628,10.0.2.15,54.93.77.70,TLSv1.2,590,Application Data
1,2.7119739999998274,54.93.77.70,10.0.2.15,TCP,60,9001  >  34692 [ACK] Seq=273387657 Ack=15005143 Win=65535 Len=0
1,2.8347420000000056,62.210.85.178,10.0.2.15,TLSv1.2,590,Application Data
1,2.839990999999827,10.0.2.15,62.210.85.178,TLSv1.2,590,Application Data
1,2.84016100000008,62.210.85.178,10.0.2.15,TCP,60,9001  >  35978 [ACK] Seq=14964539 Ack=273739573 Win=65535 Len=0
1,2.8537429999996675,10.0.2.15,62.210.85.178,TLSv1.2,4124,Application Data
1,2.8538680000001477,10.0.2.15,62.210.85.178,TCP,2974,35978  >  9001 [ACK] Seq=273743643 Ack=14964539 Win=65535 Len=2920 [TCP segment of a reassembled PDU]
1,2.8539129999999204,62.210.85.178,10.0.2.15,TCP,60,9001  >  35978 [ACK] Seq=14964539 Ack=273741033 Win=65535 Len=0
1,2.8539240000000063,62.210.85.178,10.0.2.15,TCP,60,9001  >  35978 [ACK] Seq=14964539 Ack=273742493 Win=65535 Len=0
1,2.85392899999988,62.210.85.178,10.0.2.15,TCP,60,9001  >  35978 [ACK] Seq=14964539 Ack=273743643 Win=65535 Len=0
1,2.8539330000003247,62.210.85.178,10.0.2.15,TCP,60,9001  >  35978 [ACK] Seq=14964539 Ack=273745103 Win=65535 Len=0
1,2.85393699999986,62.210.85.178,10.0.2.15,TCP,60,9001  >  35978 [ACK] Seq=14964539 Ack=273746563 Win=65535 Len=0
1,2.8539819999996325,10.0.2.15,62.210.85.178,TLSv1.2,1204,Application Data
1,2.8540499999999156,10.0.2.15,62.210.85.178,TCP,2974,35978  >  9001 [ACK] Seq=273747713 Ack=14964539 Win=65535 Len=2920 [TCP segment of a reassembled PDU]
1,2.8540899999998146,62.210.85.178,10.0.2.15,TCP,60,9001  >  35978 [ACK] Seq=14964539 Ack=273747713 Win=65535 Len=0
1,2.8540970000003654,62.210.85.178,10.0.2.15,TCP,60,9001  >  35978 [ACK] Seq=14964539 Ack=273749173 Win=65535 Len=0
1,2.8541009999999005,62.210.85.178,10.0.2.15,TCP,60,9001  >  35978 [ACK] Seq=14964539 Ack=273750633 Win=65535 Len=0
1,2.854135000000497,10.0.2.15,62.210.85.178,TLSv1.2,1204,Application Data
1,2.854201000000103,10.0.2.15,62.210.85.178,TCP,2974,35978  >  9001 [ACK] Seq=273751783 Ack=14964539 Win=65535 Len=2920 [TCP segment of a reassembled PDU]
1,2.8542390000002342,62.210.85.178,10.0.2.15,TCP,60,9001  >  35978 [ACK] Seq=14964539 Ack=273751783 Win=65535 Len=0
1,2.8542450000004465,62.210.85.178,10.0.2.15,TCP,60,9001  >  35978 [ACK] Seq=14964539 Ack=273753243 Win=65535 Len=0
1,2.85425000000032,62.210.85.178,10.0.2.15,TCP,60,9001  >  35978 [ACK] Seq=14964539 Ack=273754703 Win=65535 Len=0
1,2.854280999999901,10.0.2.15,62.210.85.178,TLSv1.2,1204,Application Data
1,2.8543620000000374,10.0.2.15,62.210.85.178,TLSv1.2,2974,Application Data
1,2.8544010000005073,62.210.85.178,10.0.2.15,TCP,60,9001  >  35978 [ACK] Seq=14964539 Ack=273755853 Win=65535 Len=0
1,2.8544080000001486,62.210.85.178,10.0.2.15,TCP,60,9001  >  35978 [ACK] Seq=14964539 Ack=273757313 Win=65535 Len=0
1,2.8544119999996838,62.210.85.178,10.0.2.15,TCP,60,9001  >  35978 [ACK] Seq=14964539 Ack=273758773 Win=65535 Len=0
1,2.8544440000005125,10.0.2.15,62.210.85.178,TLSv1.2,1226,Application Data
1,2.854505999999674,10.0.2.15,62.210.85.178,TCP,2974,35978  >  9001 [ACK] Seq=273759945 Ack=14964539 Win=65535 Len=2920 [TCP segment of a reassembled PDU]
1,2.854540999999699,62.210.85.178,10.0.2.15,TCP,60,9001  >  35978 [ACK] Seq=14964539 Ack=273759945 Win=65535 Len=0
1,2.85454800000025,62.210.85.178,10.0.2.15,TCP,60,9001  >  35978 [ACK] Seq=14964539 Ack=273761405 Win=65535 Len=0
1,2.854551999999785,62.210.85.178,10.0.2.15,TCP,60,9001  >  35978 [ACK] Seq=14964539 Ack=273762865 Win=65535 Len=0
1,2.854583000000275,10.0.2.15,62.210.85.178,TLSv1.2,1204,Application Data
1,2.854620000000068,62.210.85.178,10.0.2.15,TCP,60,9001  >  35978 [ACK] Seq=14964539 Ack=273764015 Win=65535 Len=0
1,2.8546640000004118,10.0.2.15,62.210.85.178,TLSv1.2,3030,Application Data
1,2.85470499999974,62.210.85.178,10.0.2.15,TCP,60,9001  >  35978 [ACK] Seq=14964539 Ack=273765475 Win=65535 Len=0
1,2.854710999999952,62.210.85.178,10.0.2.15,TCP,60,9001  >  35978 [ACK] Seq=14964539 Ack=273766935 Win=65535 Len=0
1,2.8547159999998257,62.210.85.178,10.0.2.15,TCP,60,9001  >  35978 [ACK] Seq=14964539 Ack=273766991 Win=65535 Len=0
1,2.8639499999999316,10.0.2.15,62.210.85.178,TLSv1.2,4124,Application Data
1,2.864031000000068,10.0.2.15,62.210.85.178,TCP,2974,35978  >  9001 [ACK] Seq=273771061 Ack=14964539 Win=65535 Len=2920 [TCP segment of a reassembled PDU]
1,2.8640690000001996,62.210.85.178,10.0.2.15,TCP,60,9001  >  35978 [ACK] Seq=14964539 Ack=273768451 Win=65535 Len=0
1,2.8640770000001794,62.210.85.178,10.0.2.15,TCP,60,9001  >  35978 [ACK] Seq=14964539 Ack=273769911 Win=65535 Len=0
1,2.8640809999997145,62.210.85.178,10.0.2.15,TCP,60,9001  >  35978 [ACK] Seq=14964539 Ack=273771061 Win=65535 Len=0
1,2.8640860000004977,62.210.85.178,10.0.2.15,TCP,60,9001  >  35978 [ACK] Seq=14964539 Ack=273772521 Win=65535 Len=0
1,2.864090000000033,62.210.85.178,10.0.2.15,TCP,60,9001  >  35978 [ACK] Seq=14964539 Ack=273773981 Win=65535 Len=0
1,2.864129999999932,10.0.2.15,62.210.85.178,TLSv1.2,1204,Application Data
1,2.8641960000004474,10.0.2.15,62.210.85.178,TCP,2974,35978  >  9001 [ACK] Seq=273775131 Ack=14964539 Win=65535 Len=2920 [TCP segment of a reassembled PDU]
1,2.8642330000002403,62.210.85.178,10.0.2.15,TCP,60,9001  >  35978 [ACK] Seq=14964539 Ack=273775131 Win=65535 Len=0
1,2.8642390000004525,62.210.85.178,10.0.2.15,TCP,60,9001  >  35978 [ACK] Seq=14964539 Ack=273776591 Win=65535 Len=0
1,2.864244000000326,62.210.85.178,10.0.2.15,TCP,60,9001  >  35978 [ACK] Seq=14964539 Ack=273778051 Win=65535 Len=0
1,2.864278000000013,10.0.2.15,62.210.85.178,TLSv1.2,1204,Application Data
1,2.8643419999998514,10.0.2.15,62.210.85.178,TCP,2974,35978  >  9001 [ACK] Seq=273779201 Ack=14964539 Win=65535 Len=2920 [TCP segment of a reassembled PDU]
1,2.8643789999996443,62.210.85.178,10.0.2.15,TCP,60,9001  >  35978 [ACK] Seq=14964539 Ack=273779201 Win=65535 Len=0
1,2.864386999999624,62.210.85.178,10.0.2.15,TCP,60,9001  >  35978 [ACK] Seq=14964539 Ack=273780661 Win=65535 Len=0
1,2.8643910000000687,62.210.85.178,10.0.2.15,TCP,60,9001  >  35978 [ACK] Seq=14964539 Ack=273782121 Win=65535 Len=0
1,2.864422999999988,10.0.2.15,62.210.85.178,TLSv1.2,1204,Application Data
1,2.864513000000443,62.210.85.178,10.0.2.15,TCP,60,9001  >  35978 [ACK] Seq=14964539 Ack=273783271 Win=65535 Len=0
1,2.8645400000004884,10.0.2.15,62.210.85.178,TLSv1.2,2974,Application Data
1,2.864593000000241,10.0.2.15,62.210.85.178,TLSv1.2,1226,Application Data
1,2.864628000000266,62.210.85.178,10.0.2.15,TCP,60,9001  >  35978 [ACK] Seq=14964539 Ack=273784731 Win=65535 Len=0
1,2.8646349999999074,62.210.85.178,10.0.2.15,TCP,60,9001  >  35978 [ACK] Seq=14964539 Ack=273786191 Win=65535 Len=0
1,2.864639000000352,62.210.85.178,10.0.2.15,TCP,60,9001  >  35978 [ACK] Seq=14964539 Ack=273787363 Win=65535 Len=0
1,2.8646829999997863,10.0.2.15,62.210.85.178,TLSv1.2,4124,Application Data
1,2.8647229999996853,62.210.85.178,10.0.2.15,TCP,60,9001  >  35978 [ACK] Seq=14964539 Ack=273788823 Win=65535 Len=0
1,2.864730000000236,62.210.85.178,10.0.2.15,TCP,60,9001  >  35978 [ACK] Seq=14964539 Ack=273790283 Win=65535 Len=0
1,2.8647350000001097,62.210.85.178,10.0.2.15,TCP,60,9001  >  35978 [ACK] Seq=14964539 Ack=273791433 Win=65535 Len=0
1,2.8647799999998824,10.0.2.15,62.210.85.178,TLSv1.2,3030,Application Data
1,2.8648220000004585,62.210.85.178,10.0.2.15,TCP,60,9001  >  35978 [ACK] Seq=14964539 Ack=273792893 Win=65535 Len=0
1,2.8648290000000998,62.210.85.178,10.0.2.15,TCP,60,9001  >  35978 [ACK] Seq=14964539 Ack=273794353 Win=65535 Len=0
1,2.864832999999635,62.210.85.178,10.0.2.15,TCP,60,9001  >  35978 [ACK] Seq=14964539 Ack=273794409 Win=65535 Len=0
1,2.877309000000423,10.0.2.15,62.210.85.178,TLSv1.2,4124,Application Data
1,2.877368000000388,62.210.85.178,10.0.2.15,TCP,60,9001  >  35978 [ACK] Seq=14964539 Ack=273795869 Win=65535 Len=0
1,2.877379999999903,62.210.85.178,10.0.2.15,TCP,60,9001  >  35978 [ACK] Seq=14964539 Ack=273797329 Win=65535 Len=0
1,2.8773849999997765,62.210.85.178,10.0.2.15,TCP,60,9001  >  35978 [ACK] Seq=14964539 Ack=273798479 Win=65535 Len=0
1,2.87742900000012,10.0.2.15,62.210.85.178,TLSv1.2,140,Application Data
1,2.8774679999996806,62.210.85.178,10.0.2.15,TCP,60,9001  >  35978 [ACK] Seq=14964539 Ack=273798565 Win=65535 Len=0
1,2.9571459999997387,54.93.77.70,10.0.2.15,TLSv1.2,590,Application Data
1,2.99353500000052,54.93.77.70,10.0.2.15,TLSv1.2,7294,"Application Data, Application Data"
1,2.993612000000212,10.0.2.15,54.93.77.70,TCP,54,34692  >  9001 [ACK] Seq=15005143 Ack=273395433 Win=65535 Len=0
1,2.9937980000004245,10.0.2.15,54.93.77.70,TLSv1.2,590,Application Data
1,2.993876000000455,54.93.77.70,10.0.2.15,TCP,60,9001  >  34692 [ACK] Seq=273395433 Ack=15005679 Win=65535 Len=0
1,3.0021530000003622,54.93.77.70,10.0.2.15,TLSv1.2,5846,Application Data
1,3.0022140000000945,10.0.2.15,54.93.77.70,TCP,54,34692  >  9001 [ACK] Seq=15005679 Ack=273401225 Win=65535 Len=0
1,3.0133089999999356,54.93.77.70,10.0.2.15,TLSv1.2,2016,Application Data
1,3.0133789999999863,10.0.2.15,54.93.77.70,TCP,54,34692  >  9001 [ACK] Seq=15005679 Ack=273403187 Win=65535 Len=0
1,3.0395730000000185,54.93.77.70,10.0.2.15,TLSv1.2,7808,"Application Data, Application Data"
1,3.0396590000000288,10.0.2.15,54.93.77.70,TCP,54,34692  >  9001 [ACK] Seq=15005679 Ack=273410941 Win=65535 Len=0
1,3.0694940000003044,54.93.77.70,10.0.2.15,TLSv1.2,1104,Application Data
1,3.071603000000323,54.93.77.70,10.0.2.15,TCP,2950,"9001  >  34692 [PSH, ACK] Seq=273411991 Ack=15005679 Win=65535 Len=2896 [TCP segment of a reassembled PDU]"
1,3.071649000000434,10.0.2.15,54.93.77.70,TCP,54,34692  >  9001 [ACK] Seq=15005679 Ack=273414887 Win=65535 Len=0
1,3.0726039999999557,54.93.77.70,10.0.2.15,TLSv1.2,4398,"Application Data, Application Data"
1,3.0726439999998547,10.0.2.15,54.93.77.70,TCP,54,34692  >  9001 [ACK] Seq=15005679 Ack=273419231 Win=65535 Len=0
1,3.0727930000002743,10.0.2.15,54.93.77.70,TLSv1.2,590,Application Data
1,3.072866000000431,54.93.77.70,10.0.2.15,TCP,60,9001  >  34692 [ACK] Seq=273419231 Ack=15006215 Win=65535 Len=0
1,3.0853470000001835,54.93.77.70,10.0.2.15,TCP,2950,"9001  >  34692 [PSH, ACK] Seq=273419231 Ack=15006215 Win=65535 Len=2896 [TCP segment of a reassembled PDU]"
1,3.085425999999643,10.0.2.15,54.93.77.70,TCP,54,34692  >  9001 [ACK] Seq=15006215 Ack=273422127 Win=65535 Len=0
1,3.0999149999997826,54.93.77.70,10.0.2.15,TLSv1.2,7294,"Application Data, Application Data"
1,3.099989999999707,10.0.2.15,54.93.77.70,TCP,54,34692  >  9001 [ACK] Seq=15006215 Ack=273429367 Win=65535 Len=0
1,3.1007680000002438,54.93.77.70,10.0.2.15,TLSv1.2,264,Application Data
1,3.1176690000002054,54.93.77.70,10.0.2.15,TLSv1.2,7294,Application Data
1,3.117713999999978,10.0.2.15,54.93.77.70,TCP,54,34692  >  9001 [ACK] Seq=15006215 Ack=273436817 Win=65535 Len=0
1,3.127144000000044,54.93.77.70,10.0.2.15,TLSv1.2,7294,"Application Data, Application Data"
1,3.1271889999998166,10.0.2.15,54.93.77.70,TCP,54,34692  >  9001 [ACK] Seq=15006215 Ack=273444057 Win=65535 Len=0
1,3.1274160000002666,10.0.2.15,54.93.77.70,TLSv1.2,590,Application Data
1,3.1274890000004234,54.93.77.70,10.0.2.15,TCP,60,9001  >  34692 [ACK] Seq=273444057 Ack=15006751 Win=65535 Len=0
1,3.1290340000005017,62.210.85.178,10.0.2.15,TLSv1.2,590,Application Data
1,3.136066000000028,54.93.77.70,10.0.2.15,TLSv1.2,1082,Application Data
1,3.1417069999997693,10.0.2.15,54.93.77.70,TLSv1.2,590,Application Data
1,3.1418009999997594,54.93.77.70,10.0.2.15,TCP,60,9001  >  34692 [ACK] Seq=273445085 Ack=15007287 Win=65535 Len=0
1,3.161616000000322,54.93.77.70,10.0.2.15,TLSv1.2,1104,Application Data
1,3.173077000000376,10.0.2.15,62.210.85.178,TCP,54,35978  >  9001 [ACK] Seq=273798565 Ack=14965075 Win=65535 Len=0
1,3.2005159999998796,62.210.85.178,10.0.2.15,TLSv1.2,590,Application Data
1,3.2005699999999706,10.0.2.15,62.210.85.178,TCP,54,35978  >  9001 [ACK] Seq=273798565 Ack=14965611 Win=65535 Len=0
1,3.205073000000084,10.0.2.15,54.93.77.70,TCP,54,34692  >  9001 [ACK] Seq=15007287 Ack=273446135 Win=65535 Len=0
1,3.2220539999998437,54.93.77.70,10.0.2.15,TLSv1.2,1104,Application Data
1,3.2221010000002934,10.0.2.15,54.93.77.70,TCP,54,34692  >  9001 [ACK] Seq=15007287 Ack=273447185 Win=65535 Len=0
1,3.2245620000003328,10.0.2.15,54.93.77.70,TLSv1.2,590,Application Data
1,3.224731000000247,54.93.77.70,10.0.2.15,TCP,60,9001  >  34692 [ACK] Seq=273447185 Ack=15007823 Win=65535 Len=0
1,3.2691100000001825,62.210.85.178,10.0.2.15,TLSv1.2,590,Application Data
1,3.269231999999647,10.0.2.15,62.210.85.178,TCP,54,35978  >  9001 [ACK] Seq=273798565 Ack=14966147 Win=65535 Len=0
1,3.3028340000000753,62.210.85.178,10.0.2.15,TLSv1.2,590,Application Data
1,3.302918000000318,10.0.2.15,62.210.85.178,TCP,54,35978  >  9001 [ACK] Seq=273798565 Ack=14966683 Win=65535 Len=0
1,3.338013000000501,62.210.85.178,10.0.2.15,TLSv1.2,590,Application Data
1,3.3380800000004456,10.0.2.15,62.210.85.178,TCP,54,35978  >  9001 [ACK] Seq=273798565 Ack=14967219 Win=65535 Len=0
1,3.3383899999998903,10.0.2.15,62.210.85.178,TLSv1.2,590,Application Data
1,3.3385129999996934,62.210.85.178,10.0.2.15,TCP,60,9001  >  35978 [ACK] Seq=14967219 Ack=273799101 Win=65535 Len=0
1,3.530695999999807,54.93.77.70,10.0.2.15,TLSv1.2,590,Application Data
1,3.5310600000002523,10.0.2.15,54.93.77.70,TLSv1.2,590,Application Data
1,3.531162000000222,54.93.77.70,10.0.2.15,TCP,60,9001  >  34692 [ACK] Seq=273447721 Ack=15008359 Win=65535 Len=0
1,3.7392060000001948,62.210.85.178,10.0.2.15,TLSv1.2,590,Application Data
1,3.7423360000002504,10.0.2.15,62.210.85.178,TLSv1.2,590,Application Data
1,3.7424810000002253,62.210.85.178,10.0.2.15,TCP,60,9001  >  35978 [ACK] Seq=14967755 Ack=273799637 Win=65535 Len=0
1,3.7542130000001634,10.0.2.15,62.210.85.178,TLSv1.2,4124,Application Data
1,3.7543329999998605,10.0.2.15,62.210.85.178,TCP,2974,35978  >  9001 [ACK] Seq=273803707 Ack=14967755 Win=65535 Len=2920 [TCP segment of a reassembled PDU]
1,3.7543839999998454,62.210.85.178,10.0.2.15,TCP,60,9001  >  35978 [ACK] Seq=14967755 Ack=273801097 Win=65535 Len=0
1,3.754396999999699,62.210.85.178,10.0.2.15,TCP,60,9001  >  35978 [ACK] Seq=14967755 Ack=273802557 Win=65535 Len=0
1,3.754402000000482,62.210.85.178,10.0.2.15,TCP,60,9001  >  35978 [ACK] Seq=14967755 Ack=273803707 Win=65535 Len=0
1,3.754445000000487,10.0.2.15,62.210.85.178,TLSv1.2,304,Application Data
1,3.7544840000000477,62.210.85.178,10.0.2.15,TCP,60,9001  >  35978 [ACK] Seq=14967755 Ack=273805167 Win=65535 Len=0
1,3.7544920000000275,62.210.85.178,10.0.2.15,TCP,60,9001  >  35978 [ACK] Seq=14967755 Ack=273806627 Win=65535 Len=0
1,3.7544950000001336,62.210.85.178,10.0.2.15,TCP,60,9001  >  35978 [ACK] Seq=14967755 Ack=273806877 Win=65535 Len=0
1,3.854159000000436,54.93.77.70,10.0.2.15,TLSv1.2,590,Application Data
1,3.897092000000157,10.0.2.15,54.93.77.70,TCP,54,34692  >  9001 [ACK] Seq=15008359 Ack=273448257 Win=65535 Len=0
1,3.9263049999999566,54.93.77.70,10.0.2.15,TCP,2950,"9001  >  34692 [PSH, ACK] Seq=273448257 Ack=15008359 Win=65535 Len=2896 [TCP segment of a reassembled PDU]"
1,3.9263499999997293,10.0.2.15,54.93.77.70,TCP,54,34692  >  9001 [ACK] Seq=15008359 Ack=273451153 Win=65535 Len=0
1,3.926706999999624,54.93.77.70,10.0.2.15,TLSv1.2,778,Application Data
1,3.9267470000004323,10.0.2.15,54.93.77.70,TCP,54,34692  >  9001 [ACK] Seq=15008359 Ack=273451877 Win=65535 Len=0
1,3.956694999999854,54.93.77.70,10.0.2.15,TLSv1.2,3674,Application Data
1,3.956774999999652,10.0.2.15,54.93.77.70,TCP,54,34692  >  9001 [ACK] Seq=15008359 Ack=273455497 Win=65535 Len=0
1,3.958958000000166,10.0.2.15,54.93.77.70,TLSv1.2,590,Application Data
1,3.959136000000399,54.93.77.70,10.0.2.15,TCP,60,9001  >  34692 [ACK] Seq=273455497 Ack=15008895 Win=65535 Len=0
1,4.145362000000205,62.210.85.178,10.0.2.15,TLSv1.2,590,Application Data
1,4.145717000000332,10.0.2.15,62.210.85.178,TLSv1.2,590,Application Data
1,4.1458339999999225,62.210.85.178,10.0.2.15,TCP,60,9001  >  35978 [ACK] Seq=14968291 Ack=273807413 Win=65535 Len=0
1,4.351383000000169,54.93.77.70,10.0.2.15,TLSv1.2,590,Application Data
1,4.351744000000508,10.0.2.15,54.93.77.70,TLSv1.2,590,Application Data
1,4.351861000000099,54.93.77.70,10.0.2.15,TCP,60,9001  >  34692 [ACK] Seq=273456033 Ack=15009431 Win=65535 Len=0
1,4.554664999999659,62.210.85.178,10.0.2.15,TLSv1.2,590,Application Data
1,4.563615000000027,10.0.2.15,62.210.85.178,TLSv1.2,590,Application Data
1,4.564991000000191,62.210.85.178,10.0.2.15,TCP,60,9001  >  35978 [ACK] Seq=14968827 Ack=273807949 Win=65535 Len=0
