No.,Time,Source,Destination,Protocol,Length,Info
1,0.1511419999997088,10.0.2.15,54.93.77.70,TLSv1.2,590,Application Data
1,0.15137700000013865,54.93.77.70,10.0.2.15,TCP,60,9001  >  34692 [ACK] Seq=271533333 Ack=14907341 Win=65535 Len=0
1,0.3575360000004366,62.210.85.178,10.0.2.15,TLSv1.2,590,Application Data
1,0.35786600000028557,10.0.2.15,62.210.85.178,TLSv1.2,590,Application Data
1,0.35797700000057375,62.210.85.178,10.0.2.15,TCP,60,9001  >  35978 [ACK] Seq=14837359 Ack=271745419 Win=65535 Len=0
1,0.5620539999999892,54.93.77.70,10.0.2.15,TLSv1.2,590,Application Data
1,0.562170000000151,10.0.2.15,54.93.77.70,TCP,54,34692  >  9001 [ACK] Seq=14907341 Ack=271533869 Win=65535 Len=0
1,0.5626629999997022,10.0.2.15,54.93.77.70,TLSv1.2,1618,Application Data
1,0.5628050000004805,54.93.77.70,10.0.2.15,TCP,60,9001  >  34692 [ACK] Seq=271533869 Ack=14908801 Win=65535 Len=0
1,0.562818000000334,54.93.77.70,10.0.2.15,TCP,60,9001  >  34692 [ACK] Seq=271533869 Ack=14908905 Win=65535 Len=0
1,1.0751350000000457,62.210.85.178,10.0.2.15,TLSv1.2,1618,Application Data
1,1.0752510000002076,10.0.2.15,62.210.85.178,TCP,54,35978  >  9001 [ACK] Seq=271745419 Ack=14838923 Win=65535 Len=0
1,1.0893150000001697,10.0.2.15,62.210.85.178,TLSv1.2,590,Application Data
1,1.0904829999999492,62.210.85.178,10.0.2.15,TCP,60,9001  >  35978 [ACK] Seq=14838923 Ack=271745955 Win=65535 Len=0
1,1.1022110000003522,10.0.2.15,62.210.85.178,TLSv1.2,1618,Application Data
1,1.102375000000393,62.210.85.178,10.0.2.15,TCP,60,9001  >  35978 [ACK] Seq=14838923 Ack=271747415 Win=65535 Len=0
1,1.102390000000014,62.210.85.178,10.0.2.15,TCP,60,9001  >  35978 [ACK] Seq=14838923 Ack=271747519 Win=65535 Len=0
1,1.2207399999997506,54.93.77.70,10.0.2.15,TLSv1.2,590,Application Data
1,1.2548930000002656,54.93.77.70,10.0.2.15,TLSv1.2,1618,Application Data
1,1.254971999999725,10.0.2.15,54.93.77.70,TCP,54,34692  >  9001 [ACK] Seq=14908905 Ack=271535969 Win=65535 Len=0
1,1.257064000000355,10.0.2.15,54.93.77.70,TLSv1.2,590,Application Data
1,1.2572589999999764,54.93.77.70,10.0.2.15,TCP,60,9001  >  34692 [ACK] Seq=271535969 Ack=14909441 Win=65535 Len=0
1,1.4843659999996817,62.210.85.178,10.0.2.15,TLSv1.2,590,Application Data
1,1.4847420000005513,10.0.2.15,62.210.85.178,TLSv1.2,590,Application Data
1,1.4848549999996976,62.210.85.178,10.0.2.15,TCP,60,9001  >  35978 [ACK] Seq=14839459 Ack=271748055 Win=65535 Len=0
1,1.6885160000001633,54.93.77.70,10.0.2.15,TLSv1.2,590,Application Data
1,1.688890000000356,10.0.2.15,54.93.77.70,TLSv1.2,590,Application Data
1,1.6889920000003258,54.93.77.70,10.0.2.15,TCP,60,9001  >  34692 [ACK] Seq=271536505 Ack=14909977 Win=65535 Len=0
1,1.8951240000005782,62.210.85.178,10.0.2.15,TLSv1.2,590,Application Data
1,1.9006639999997788,10.0.2.15,62.210.85.178,TLSv1.2,590,Application Data
1,1.90179900000021,62.210.85.178,10.0.2.15,TCP,60,9001  >  35978 [ACK] Seq=14839995 Ack=271748591 Win=65535 Len=0
1,1.9110300000002098,10.0.2.15,62.210.85.178,TLSv1.2,4124,Application Data
1,1.911141000000498,10.0.2.15,62.210.85.178,TCP,2974,35978  >  9001 [ACK] Seq=271752661 Ack=14839995 Win=65535 Len=2920 [TCP segment of a reassembled PDU]
1,1.9111830000001646,62.210.85.178,10.0.2.15,TCP,60,9001  >  35978 [ACK] Seq=14839995 Ack=271750051 Win=65535 Len=0
1,1.9111940000002505,62.210.85.178,10.0.2.15,TCP,60,9001  >  35978 [ACK] Seq=14839995 Ack=271751511 Win=65535 Len=0
1,1.9112000000004628,62.210.85.178,10.0.2.15,TCP,60,9001  >  35978 [ACK] Seq=14839995 Ack=271752661 Win=65535 Len=0
1,1.9112030000005689,62.210.85.178,10.0.2.15,TCP,60,9001  >  35978 [ACK] Seq=14839995 Ack=271754121 Win=65535 Len=0
1,1.911207000000104,62.210.85.178,10.0.2.15,TCP,60,9001  >  35978 [ACK] Seq=14839995 Ack=271755581 Win=65535 Len=0
1,1.9112430000004679,10.0.2.15,62.210.85.178,TLSv1.2,1204,Application Data
1,1.9113029999998616,62.210.85.178,10.0.2.15,TCP,60,9001  >  35978 [ACK] Seq=14839995 Ack=271756731 Win=65535 Len=0
1,1.9113649999999325,10.0.2.15,62.210.85.178,TLSv1.2,4124,Application Data
1,1.9114690000005794,62.210.85.178,10.0.2.15,TCP,60,9001  >  35978 [ACK] Seq=14839995 Ack=271758191 Win=65535 Len=0
1,1.9114779999999882,62.210.85.178,10.0.2.15,TCP,60,9001  >  35978 [ACK] Seq=14839995 Ack=271759651 Win=65535 Len=0
1,1.911482000000433,62.210.85.178,10.0.2.15,TCP,60,9001  >  35978 [ACK] Seq=14839995 Ack=271760801 Win=65535 Len=0
1,1.9115330000004178,10.0.2.15,62.210.85.178,TLSv1.2,4124,Application Data
1,1.9115739999997459,62.210.85.178,10.0.2.15,TCP,60,9001  >  35978 [ACK] Seq=14839995 Ack=271762261 Win=65535 Len=0
1,1.9115830000000642,62.210.85.178,10.0.2.15,TCP,60,9001  >  35978 [ACK] Seq=14839995 Ack=271763721 Win=65535 Len=0
1,1.911627999999837,62.210.85.178,10.0.2.15,TCP,60,9001  >  35978 [ACK] Seq=14839995 Ack=271764871 Win=65535 Len=0
1,1.9116629999998622,10.0.2.15,62.210.85.178,TLSv1.2,332,Application Data
1,1.9117000000005646,62.210.85.178,10.0.2.15,TCP,60,9001  >  35978 [ACK] Seq=14839995 Ack=271765149 Win=65535 Len=0
1,1.9117580000001908,10.0.2.15,62.210.85.178,TLSv1.2,3868,Application Data
1,1.9117990000004284,62.210.85.178,10.0.2.15,TCP,60,9001  >  35978 [ACK] Seq=14839995 Ack=271766609 Win=65535 Len=0
1,1.9118070000004082,62.210.85.178,10.0.2.15,TCP,60,9001  >  35978 [ACK] Seq=14839995 Ack=271768069 Win=65535 Len=0
1,1.9118109999999433,62.210.85.178,10.0.2.15,TCP,60,9001  >  35978 [ACK] Seq=14839995 Ack=271768963 Win=65535 Len=0
1,1.9118490000000747,10.0.2.15,62.210.85.178,TLSv1.2,4124,Application Data
1,1.9118870000002062,62.210.85.178,10.0.2.15,TCP,60,9001  >  35978 [ACK] Seq=14839995 Ack=271770423 Win=65535 Len=0
1,1.911895000000186,62.210.85.178,10.0.2.15,TCP,60,9001  >  35978 [ACK] Seq=14839995 Ack=271771883 Win=65535 Len=0
1,1.9119000000000597,62.210.85.178,10.0.2.15,TCP,60,9001  >  35978 [ACK] Seq=14839995 Ack=271773033 Win=65535 Len=0
1,1.9119419999997262,10.0.2.15,62.210.85.178,TLSv1.2,3030,Application Data
1,1.9119790000004286,62.210.85.178,10.0.2.15,TCP,60,9001  >  35978 [ACK] Seq=14839995 Ack=271774493 Win=65535 Len=0
1,1.9119879999998375,62.210.85.178,10.0.2.15,TCP,60,9001  >  35978 [ACK] Seq=14839995 Ack=271775953 Win=65535 Len=0
1,1.9119920000002821,62.210.85.178,10.0.2.15,TCP,60,9001  >  35978 [ACK] Seq=14839995 Ack=271776009 Win=65535 Len=0
1,1.921215000000302,10.0.2.15,62.210.85.178,TLSv1.2,4124,Application Data
1,1.9212790000001405,62.210.85.178,10.0.2.15,TCP,60,9001  >  35978 [ACK] Seq=14839995 Ack=271777469 Win=65535 Len=0
1,1.921291000000565,62.210.85.178,10.0.2.15,TCP,60,9001  >  35978 [ACK] Seq=14839995 Ack=271778929 Win=65535 Len=0
1,1.9212960000004387,62.210.85.178,10.0.2.15,TCP,60,9001  >  35978 [ACK] Seq=14839995 Ack=271780079 Win=65535 Len=0
1,1.9213449999997465,10.0.2.15,62.210.85.178,TLSv1.2,4124,Application Data
1,1.9213870000003226,62.210.85.178,10.0.2.15,TCP,60,9001  >  35978 [ACK] Seq=14839995 Ack=271781539 Win=65535 Len=0
1,1.9213950000003024,62.210.85.178,10.0.2.15,TCP,60,9001  >  35978 [ACK] Seq=14839995 Ack=271782999 Win=65535 Len=0
1,1.921400000000176,62.210.85.178,10.0.2.15,TCP,60,9001  >  35978 [ACK] Seq=14839995 Ack=271784149 Win=65535 Len=0
1,1.9214389999997366,10.0.2.15,62.210.85.178,TLSv1.2,4124,Application Data
1,1.9214830000000802,62.210.85.178,10.0.2.15,TCP,60,9001  >  35978 [ACK] Seq=14839995 Ack=271785609 Win=65535 Len=0
1,1.92149100000006,62.210.85.178,10.0.2.15,TCP,60,9001  >  35978 [ACK] Seq=14839995 Ack=271787069 Win=65535 Len=0
1,1.9214940000001661,62.210.85.178,10.0.2.15,TCP,60,9001  >  35978 [ACK] Seq=14839995 Ack=271788219 Win=65535 Len=0
1,1.921530999999959,10.0.2.15,62.210.85.178,TLSv1.2,4124,Application Data
1,1.921567999999752,62.210.85.178,10.0.2.15,TCP,60,9001  >  35978 [ACK] Seq=14839995 Ack=271789679 Win=65535 Len=0
1,1.9215770000000703,62.210.85.178,10.0.2.15,TCP,60,9001  >  35978 [ACK] Seq=14839995 Ack=271791139 Win=65535 Len=0
1,1.921581000000515,62.210.85.178,10.0.2.15,TCP,60,9001  >  35978 [ACK] Seq=14839995 Ack=271792289 Win=65535 Len=0
1,1.9216169999999693,10.0.2.15,62.210.85.178,TLSv1.2,332,Application Data
1,1.9216530000003331,62.210.85.178,10.0.2.15,TCP,60,9001  >  35978 [ACK] Seq=14839995 Ack=271792567 Win=65535 Len=0
1,1.9217060000000856,10.0.2.15,62.210.85.178,TLSv1.2,3868,Application Data
1,1.9217459999999846,62.210.85.178,10.0.2.15,TCP,60,9001  >  35978 [ACK] Seq=14839995 Ack=271794027 Win=65535 Len=0
1,1.9217539999999644,62.210.85.178,10.0.2.15,TCP,60,9001  >  35978 [ACK] Seq=14839995 Ack=271795487 Win=65535 Len=0
1,1.921758000000409,62.210.85.178,10.0.2.15,TCP,60,9001  >  35978 [ACK] Seq=14839995 Ack=271796381 Win=65535 Len=0
1,1.9217960000005405,10.0.2.15,62.210.85.178,TLSv1.2,4124,Application Data
1,1.921835000000101,62.210.85.178,10.0.2.15,TCP,60,9001  >  35978 [ACK] Seq=14839995 Ack=271797841 Win=65535 Len=0
1,1.9218419999997423,62.210.85.178,10.0.2.15,TCP,60,9001  >  35978 [ACK] Seq=14839995 Ack=271799301 Win=65535 Len=0
1,1.921846000000187,62.210.85.178,10.0.2.15,TCP,60,9001  >  35978 [ACK] Seq=14839995 Ack=271800451 Win=65535 Len=0
1,1.9218820000005508,10.0.2.15,62.210.85.178,TLSv1.2,3030,Application Data
1,1.9219460000003892,62.210.85.178,10.0.2.15,TCP,60,9001  >  35978 [ACK] Seq=14839995 Ack=271801911 Win=65535 Len=0
1,1.9219530000000304,62.210.85.178,10.0.2.15,TCP,60,9001  >  35978 [ACK] Seq=14839995 Ack=271803371 Win=65535 Len=0
1,1.921954999999798,62.210.85.178,10.0.2.15,TCP,60,9001  >  35978 [ACK] Seq=14839995 Ack=271803427 Win=65535 Len=0
1,1.934479000000465,10.0.2.15,62.210.85.178,TLSv1.2,4124,Application Data
1,1.9345350000003236,62.210.85.178,10.0.2.15,TCP,60,9001  >  35978 [ACK] Seq=14839995 Ack=271804887 Win=65535 Len=0
1,1.9345460000004095,62.210.85.178,10.0.2.15,TCP,60,9001  >  35978 [ACK] Seq=14839995 Ack=271806347 Win=65535 Len=0
1,1.9345510000002832,62.210.85.178,10.0.2.15,TCP,60,9001  >  35978 [ACK] Seq=14839995 Ack=271807497 Win=65535 Len=0
1,1.934596000000056,10.0.2.15,62.210.85.178,TLSv1.2,4124,Application Data
1,1.934690000000046,10.0.2.15,62.210.85.178,TCP,1514,35978  >  9001 [ACK] Seq=271811567 Ack=14839995 Win=65535 Len=1460 [TCP segment of a reassembled PDU]
1,1.9347130000005563,62.210.85.178,10.0.2.15,TCP,60,9001  >  35978 [ACK] Seq=14839995 Ack=271808957 Win=65535 Len=0
1,1.9347210000005362,62.210.85.178,10.0.2.15,TCP,60,9001  >  35978 [ACK] Seq=14839995 Ack=271810417 Win=65535 Len=0
1,1.9347250000000713,62.210.85.178,10.0.2.15,TCP,60,9001  >  35978 [ACK] Seq=14839995 Ack=271811567 Win=65535 Len=0
1,1.934729000000516,62.210.85.178,10.0.2.15,TCP,60,9001  >  35978 [ACK] Seq=14839995 Ack=271813027 Win=65535 Len=0
1,1.9347640000005413,10.0.2.15,62.210.85.178,TLSv1.2,286,Application Data
1,1.9347999999999956,62.210.85.178,10.0.2.15,TCP,60,9001  >  35978 [ACK] Seq=14839995 Ack=271813259 Win=65535 Len=0
1,2.0230380000002697,54.93.77.70,10.0.2.15,TLSv1.2,3674,Application Data
1,2.0231629999998404,10.0.2.15,54.93.77.70,TCP,54,34692  >  9001 [ACK] Seq=14909977 Ack=271540125 Win=65535 Len=0
1,2.0233680000001186,10.0.2.15,54.93.77.70,TLSv1.2,590,Application Data
1,2.0234419999997044,54.93.77.70,10.0.2.15,TCP,60,9001  >  34692 [ACK] Seq=271540125 Ack=14910513 Win=65535 Len=0
1,2.0332029999999577,54.93.77.70,10.0.2.15,TCP,2950,"9001  >  34692 [PSH, ACK] Seq=271540125 Ack=14910513 Win=65535 Len=2896 [TCP segment of a reassembled PDU]"
1,2.033285999999862,10.0.2.15,54.93.77.70,TCP,54,34692  >  9001 [ACK] Seq=14910513 Ack=271543021 Win=65535 Len=0
1,2.043510000000424,54.93.77.70,10.0.2.15,TLSv1.2,778,Application Data
1,2.047142999999778,54.93.77.70,10.0.2.15,TCP,2950,"9001  >  34692 [PSH, ACK] Seq=271543745 Ack=14910513 Win=65535 Len=2896 [TCP segment of a reassembled PDU]"
1,2.0471870000001218,10.0.2.15,54.93.77.70,TCP,54,34692  >  9001 [ACK] Seq=14910513 Ack=271546641 Win=65535 Len=0
1,2.062730000000556,54.93.77.70,10.0.2.15,TLSv1.2,2950,Application Data [TCP segment of a reassembled PDU]
1,2.0627580000000307,54.93.77.70,10.0.2.15,TLSv1.2,1502,Application Data
1,2.0628029999998034,10.0.2.15,54.93.77.70,TCP,54,34692  >  9001 [ACK] Seq=14910513 Ack=271549537 Win=65535 Len=0
1,2.0628930000002583,10.0.2.15,54.93.77.70,TCP,54,34692  >  9001 [ACK] Seq=14910513 Ack=271550985 Win=65535 Len=0
1,2.0755040000003646,54.93.77.70,10.0.2.15,TLSv1.2,1104,Application Data
1,2.0848900000000867,54.93.77.70,10.0.2.15,TCP,2950,"9001  >  34692 [PSH, ACK] Seq=271552035 Ack=14910513 Win=65535 Len=2896 [TCP segment of a reassembled PDU]"
1,2.084907000000385,54.93.77.70,10.0.2.15,TLSv1.2,5846,"Application Data, Application Data"
1,2.0849429999998392,10.0.2.15,54.93.77.70,TCP,54,34692  >  9001 [ACK] Seq=14910513 Ack=271554931 Win=65535 Len=0
1,2.0850140000002284,10.0.2.15,54.93.77.70,TCP,54,34692  >  9001 [ACK] Seq=14910513 Ack=271560723 Win=65535 Len=0
1,2.093906000000061,54.93.77.70,10.0.2.15,TLSv1.2,170,Application Data
1,2.106166999999914,54.93.77.70,10.0.2.15,TCP,2950,"9001  >  34692 [PSH, ACK] Seq=271560839 Ack=14910513 Win=65535 Len=2896 [TCP segment of a reassembled PDU]"
1,2.1062140000003637,10.0.2.15,54.93.77.70,TCP,54,34692  >  9001 [ACK] Seq=14910513 Ack=271563735 Win=65535 Len=0
1,2.1150139999999737,54.93.77.70,10.0.2.15,TLSv1.2,2950,"Application Data, Application Data"
1,2.115060000000085,10.0.2.15,54.93.77.70,TCP,54,34692  >  9001 [ACK] Seq=14910513 Ack=271566631 Win=65535 Len=0
1,2.1152240000001257,10.0.2.15,54.93.77.70,TLSv1.2,590,Application Data
1,2.1153050000002622,54.93.77.70,10.0.2.15,TCP,60,9001  >  34692 [ACK] Seq=271566631 Ack=14911049 Win=65535 Len=0
1,2.124080999999933,54.93.77.70,10.0.2.15,TLSv1.2,496,Application Data
1,2.1293580000001384,54.93.77.70,10.0.2.15,TCP,2950,"9001  >  34692 [PSH, ACK] Seq=271567073 Ack=14911049 Win=65535 Len=2896 [TCP segment of a reassembled PDU]"
1,2.129399000000376,10.0.2.15,54.93.77.70,TCP,54,34692  >  9001 [ACK] Seq=14911049 Ack=271569969 Win=65535 Len=0
1,2.1376030000001265,54.93.77.70,10.0.2.15,TLSv1.2,2950,Application Data [TCP segment of a reassembled PDU]
1,2.1376710000004095,10.0.2.15,54.93.77.70,TCP,54,34692  >  9001 [ACK] Seq=14911049 Ack=271572865 Win=65535 Len=0
1,2.1377050000000963,54.93.77.70,10.0.2.15,TCP,1502,"9001  >  34692 [PSH, ACK] Seq=271572865 Ack=14911049 Win=65535 Len=1448 [TCP segment of a reassembled PDU]"
1,2.137752999999975,10.0.2.15,54.93.77.70,TCP,54,34692  >  9001 [ACK] Seq=14911049 Ack=271574313 Win=65535 Len=0
1,2.1386460000003353,54.93.77.70,10.0.2.15,TLSv1.2,2950,Application Data [TCP segment of a reassembled PDU]
1,2.138687000000573,10.0.2.15,54.93.77.70,TCP,54,34692  >  9001 [ACK] Seq=14911049 Ack=271577209 Win=65535 Len=0
1,2.14817099999982,54.93.77.70,10.0.2.15,TLSv1.2,1292,Application Data
1,2.148184000000583,62.210.85.178,10.0.2.15,TLSv1.2,590,Application Data
1,2.159770000000208,54.93.77.70,10.0.2.15,TCP,2950,"9001  >  34692 [PSH, ACK] Seq=271578447 Ack=14911049 Win=65535 Len=2896 [TCP segment of a reassembled PDU]"
1,2.1598579999999856,54.93.77.70,10.0.2.15,TLSv1.2,4398,Application Data [TCP segment of a reassembled PDU]
1,2.159943000000567,10.0.2.15,54.93.77.70,TCP,54,34692  >  9001 [ACK] Seq=14911049 Ack=271581343 Win=65535 Len=0
1,2.160211000000345,10.0.2.15,54.93.77.70,TCP,54,34692  >  9001 [ACK] Seq=14911049 Ack=271585687 Win=65535 Len=0
1,2.1714419999998427,54.93.77.70,10.0.2.15,TLSv1.2,2950,Application Data [TCP segment of a reassembled PDU]
1,2.171522999999979,10.0.2.15,54.93.77.70,TCP,54,34692  >  9001 [ACK] Seq=14911049 Ack=271588583 Win=65535 Len=0
1,2.178174000000581,54.93.77.70,10.0.2.15,TLSv1.2,2740,Application Data [TCP segment of a reassembled PDU]
1,2.178237000000081,10.0.2.15,54.93.77.70,TCP,54,34692  >  9001 [ACK] Seq=14911049 Ack=271591269 Win=65535 Len=0
1,2.178393000000142,10.0.2.15,54.93.77.70,TLSv1.2,590,Application Data
1,2.178476000000046,54.93.77.70,10.0.2.15,TCP,60,9001  >  34692 [ACK] Seq=271591269 Ack=14911585 Win=65535 Len=0
1,2.17965600000025,54.93.77.70,10.0.2.15,TCP,1502,"9001  >  34692 [PSH, ACK] Seq=271591269 Ack=14911585 Win=65535 Len=1448 [TCP segment of a reassembled PDU]"
1,2.179699000000255,10.0.2.15,54.93.77.70,TCP,54,34692  >  9001 [ACK] Seq=14911585 Ack=271592717 Win=65535 Len=0
1,2.186453999999685,54.93.77.70,10.0.2.15,TLSv1.2,2950,Application Data [TCP segment of a reassembled PDU]
1,2.1865630000002056,10.0.2.15,54.93.77.70,TCP,54,34692  >  9001 [ACK] Seq=14911585 Ack=271595613 Win=65535 Len=0
1,2.1885110000002896,54.93.77.70,10.0.2.15,TLSv1.2,4398,Application Data [TCP segment of a reassembled PDU]
1,2.188560999999936,10.0.2.15,54.93.77.70,TCP,54,34692  >  9001 [ACK] Seq=14911585 Ack=271599957 Win=65535 Len=0
1,2.190113000000565,10.0.2.15,62.210.85.178,TCP,54,35978  >  9001 [ACK] Seq=271813259 Ack=14840531 Win=65535 Len=0
1,2.1909459999997125,10.0.2.15,54.93.77.70,TLSv1.2,590,Application Data
1,2.1911470000004556,54.93.77.70,10.0.2.15,TCP,60,9001  >  34692 [ACK] Seq=271599957 Ack=14912121 Win=65535 Len=0
1,2.2020620000002964,54.93.77.70,10.0.2.15,TLSv1.2,1292,Application Data
1,2.2032850000005055,10.0.2.15,54.93.77.70,TLSv1.2,590,Application Data
1,2.203400000000329,54.93.77.70,10.0.2.15,TCP,60,9001  >  34692 [ACK] Seq=271601195 Ack=14912657 Win=65535 Len=0
1,2.21320199999991,10.0.2.15,54.93.77.70,TLSv1.2,590,Application Data
1,2.2133739999999307,54.93.77.70,10.0.2.15,TCP,60,9001  >  34692 [ACK] Seq=271601195 Ack=14913193 Win=65535 Len=0
1,2.2500129999998535,54.93.77.70,10.0.2.15,TLSv1.2,590,Application Data
1,2.259541000000354,62.210.85.178,10.0.2.15,TLSv1.2,590,Application Data
1,2.2597710000000006,10.0.2.15,62.210.85.178,TCP,54,35978  >  9001 [ACK] Seq=271813259 Ack=14841067 Win=65535 Len=0
1,2.2901560000000245,10.0.2.15,54.93.77.70,TCP,54,34692  >  9001 [ACK] Seq=14913193 Ack=271601731 Win=65535 Len=0
1,2.320227000000159,62.210.85.178,10.0.2.15,TLSv1.2,1104,Application Data
1,2.320281999999679,10.0.2.15,62.210.85.178,TCP,54,35978  >  9001 [ACK] Seq=271813259 Ack=14842117 Win=65535 Len=0
1,2.3505169999998543,62.210.85.178,10.0.2.15,TLSv1.2,1104,Application Data
1,2.3505660000000717,10.0.2.15,62.210.85.178,TCP,54,35978  >  9001 [ACK] Seq=271813259 Ack=14843167 Win=65535 Len=0
1,2.350996000000123,10.0.2.15,62.210.85.178,TLSv1.2,590,Application Data
1,2.3511060000000725,62.210.85.178,10.0.2.15,TCP,60,9001  >  35978 [ACK] Seq=14843167 Ack=271813795 Win=65535 Len=0
1,2.611007999999856,54.93.77.70,10.0.2.15,TLSv1.2,590,Application Data
1,2.6110859999998866,10.0.2.15,54.93.77.70,TCP,54,34692  >  9001 [ACK] Seq=14913193 Ack=271602267 Win=65535 Len=0
1,2.611442999999781,10.0.2.15,54.93.77.70,TLSv1.2,590,Application Data
1,2.6115340000005745,54.93.77.70,10.0.2.15,TCP,60,9001  >  34692 [ACK] Seq=271602267 Ack=14913729 Win=65535 Len=0
1,2.9187119999996867,62.210.85.178,10.0.2.15,TLSv1.2,590,Application Data
1,2.9227010000004157,10.0.2.15,62.210.85.178,TLSv1.2,590,Application Data
1,2.9235639999997147,62.210.85.178,10.0.2.15,TCP,60,9001  >  35978 [ACK] Seq=14843703 Ack=271814331 Win=65535 Len=0
1,2.9351440000000366,10.0.2.15,62.210.85.178,TLSv1.2,4124,Application Data
1,2.935253000000557,10.0.2.15,62.210.85.178,TCP,2974,35978  >  9001 [ACK] Seq=271818401 Ack=14843703 Win=65535 Len=2920 [TCP segment of a reassembled PDU]
1,2.9352969999999914,62.210.85.178,10.0.2.15,TCP,60,9001  >  35978 [ACK] Seq=14843703 Ack=271815791 Win=65535 Len=0
1,2.935309000000416,62.210.85.178,10.0.2.15,TCP,60,9001  >  35978 [ACK] Seq=14843703 Ack=271817251 Win=65535 Len=0
1,2.9353140000002895,62.210.85.178,10.0.2.15,TCP,60,9001  >  35978 [ACK] Seq=14843703 Ack=271818401 Win=65535 Len=0
1,2.9353179999998247,62.210.85.178,10.0.2.15,TCP,60,9001  >  35978 [ACK] Seq=14843703 Ack=271819861 Win=65535 Len=0
1,2.9353200000005018,62.210.85.178,10.0.2.15,TCP,60,9001  >  35978 [ACK] Seq=14843703 Ack=271821321 Win=65535 Len=0
1,2.935355000000527,10.0.2.15,62.210.85.178,TLSv1.2,1204,Application Data
1,2.935392999999749,62.210.85.178,10.0.2.15,TCP,60,9001  >  35978 [ACK] Seq=14843703 Ack=271822471 Win=65535 Len=0
1,2.935446000000411,10.0.2.15,62.210.85.178,TLSv1.2,4124,Application Data
1,2.9354849999999715,62.210.85.178,10.0.2.15,TCP,60,9001  >  35978 [ACK] Seq=14843703 Ack=271823931 Win=65535 Len=0
1,2.93549400000029,62.210.85.178,10.0.2.15,TCP,60,9001  >  35978 [ACK] Seq=14843703 Ack=271825391 Win=65535 Len=0
1,2.935497999999825,62.210.85.178,10.0.2.15,TCP,60,9001  >  35978 [ACK] Seq=14843703 Ack=271826541 Win=65535 Len=0
1,2.935537000000295,10.0.2.15,62.210.85.178,TLSv1.2,4124,Application Data
1,2.9355759999998554,62.210.85.178,10.0.2.15,TCP,60,9001  >  35978 [ACK] Seq=14843703 Ack=271828001 Win=65535 Len=0
1,2.935583000000406,62.210.85.178,10.0.2.15,TCP,60,9001  >  35978 [ACK] Seq=14843703 Ack=271829461 Win=65535 Len=0
1,2.9356440000001385,10.0.2.15,62.210.85.178,TLSv1.2,2974,Application Data
1,2.9356840000000375,62.210.85.178,10.0.2.15,TCP,60,9001  >  35978 [ACK] Seq=14843703 Ack=271830611 Win=65535 Len=0
1,2.9356920000000173,62.210.85.178,10.0.2.15,TCP,60,9001  >  35978 [ACK] Seq=14843703 Ack=271832071 Win=65535 Len=0
1,2.9356950000001234,62.210.85.178,10.0.2.15,TCP,60,9001  >  35978 [ACK] Seq=14843703 Ack=271833531 Win=65535 Len=0
1,2.9357230000005075,10.0.2.15,62.210.85.178,TLSv1.2,1226,Application Data
1,2.9357580000005328,62.210.85.178,10.0.2.15,TCP,60,9001  >  35978 [ACK] Seq=14843703 Ack=271834703 Win=65535 Len=0
1,2.9358000000001994,10.0.2.15,62.210.85.178,TLSv1.2,4124,Application Data
1,2.9358400000000984,62.210.85.178,10.0.2.15,TCP,60,9001  >  35978 [ACK] Seq=14843703 Ack=271836163 Win=65535 Len=0
1,2.9358469999997396,62.210.85.178,10.0.2.15,TCP,60,9001  >  35978 [ACK] Seq=14843703 Ack=271837623 Win=65535 Len=0
1,2.9358510000001843,62.210.85.178,10.0.2.15,TCP,60,9001  >  35978 [ACK] Seq=14843703 Ack=271838773 Win=65535 Len=0
1,2.935887999999977,10.0.2.15,62.210.85.178,TLSv1.2,3030,Application Data
1,2.935927000000447,62.210.85.178,10.0.2.15,TCP,60,9001  >  35978 [ACK] Seq=14843703 Ack=271840233 Win=65535 Len=0
1,2.935935000000427,62.210.85.178,10.0.2.15,TCP,60,9001  >  35978 [ACK] Seq=14843703 Ack=271841693 Win=65535 Len=0
1,2.9359400000003006,62.210.85.178,10.0.2.15,TCP,60,9001  >  35978 [ACK] Seq=14843703 Ack=271841749 Win=65535 Len=0
1,3.0595009999997274,54.93.77.70,10.0.2.15,TCP,2950,"9001  >  34692 [PSH, ACK] Seq=271602267 Ack=14913729 Win=65535 Len=2896 [TCP segment of a reassembled PDU]"
1,3.05963200000042,10.0.2.15,54.93.77.70,TCP,54,34692  >  9001 [ACK] Seq=14913729 Ack=271605163 Win=65535 Len=0
1,3.0599529999999504,54.93.77.70,10.0.2.15,TLSv1.2,1228,Application Data
1,3.0706529999997656,54.93.77.70,10.0.2.15,TLSv1.2,7294,"Application Data, Application Data"
1,3.070730000000367,10.0.2.15,54.93.77.70,TCP,54,34692  >  9001 [ACK] Seq=14913729 Ack=271613577 Win=65535 Len=0
1,3.078946000000542,54.93.77.70,10.0.2.15,TLSv1.2,654,Application Data
1,3.099341000000095,54.93.77.70,10.0.2.15,TLSv1.2,2038,Application Data
1,3.09942300000057,10.0.2.15,54.93.77.70,TCP,54,34692  >  9001 [ACK] Seq=14913729 Ack=271616161 Win=65535 Len=0
1,3.099460999999792,54.93.77.70,10.0.2.15,TCP,1502,"9001  >  34692 [PSH, ACK] Seq=271616161 Ack=14913729 Win=65535 Len=1448 [TCP segment of a reassembled PDU]"
1,3.0995160000002215,10.0.2.15,54.93.77.70,TCP,54,34692  >  9001 [ACK] Seq=14913729 Ack=271617609 Win=65535 Len=0
1,3.1191680000001725,54.93.77.70,10.0.2.15,TLSv1.2,778,Application Data
1,3.1296990000000733,54.93.77.70,10.0.2.15,TCP,2950,"9001  >  34692 [PSH, ACK] Seq=271618333 Ack=14913729 Win=65535 Len=2896 [TCP segment of a reassembled PDU]"
1,3.1297510000003967,10.0.2.15,54.93.77.70,TCP,54,34692  >  9001 [ACK] Seq=14913729 Ack=271621229 Win=65535 Len=0
1,3.137909000000036,54.93.77.70,10.0.2.15,TLSv1.2,1314,"Application Data, Application Data"
1,3.140473999999813,54.93.77.70,10.0.2.15,TCP,2950,"9001  >  34692 [PSH, ACK] Seq=271622489 Ack=14913729 Win=65535 Len=2896 [TCP segment of a reassembled PDU]"
1,3.140519999999924,10.0.2.15,54.93.77.70,TCP,54,34692  >  9001 [ACK] Seq=14913729 Ack=271625385 Win=65535 Len=0
1,3.1514250000000175,54.93.77.70,10.0.2.15,TLSv1.2,2950,Application Data [TCP segment of a reassembled PDU]
1,3.15147799999977,10.0.2.15,54.93.77.70,TCP,54,34692  >  9001 [ACK] Seq=14913729 Ack=271628281 Win=65535 Len=0
1,3.151528000000326,54.93.77.70,10.0.2.15,TLSv1.2,1502,Application Data
1,3.151574999999866,10.0.2.15,54.93.77.70,TCP,54,34692  >  9001 [ACK] Seq=14913729 Ack=271629729 Win=65535 Len=0
1,3.1517800000001444,10.0.2.15,54.93.77.70,TLSv1.2,590,Application Data
1,3.15185399999973,54.93.77.70,10.0.2.15,TCP,60,9001  >  34692 [ACK] Seq=271629729 Ack=14914265 Win=65535 Len=0
1,3.1657420000001366,54.93.77.70,10.0.2.15,TLSv1.2,590,Application Data
1,3.166027000000213,10.0.2.15,54.93.77.70,TLSv1.2,1104,Application Data
1,3.166132000000289,54.93.77.70,10.0.2.15,TCP,60,9001  >  34692 [ACK] Seq=271630265 Ack=14915315 Win=65535 Len=0
1,3.5774419999997917,62.210.85.178,10.0.2.15,TLSv1.2,590,Application Data
1,3.61815100000058,10.0.2.15,62.210.85.178,TCP,54,35978  >  9001 [ACK] Seq=271841749 Ack=14844239 Win=65535 Len=0
1,4.147484000000077,62.210.85.178,10.0.2.15,TLSv1.2,1104,Application Data
1,4.147558000000572,10.0.2.15,62.210.85.178,TCP,54,35978  >  9001 [ACK] Seq=271841749 Ack=14845289 Win=65535 Len=0
1,4.147834999999759,10.0.2.15,62.210.85.178,TLSv1.2,590,Application Data
1,4.1479269999999815,62.210.85.178,10.0.2.15,TCP,60,9001  >  35978 [ACK] Seq=14845289 Ack=271842285 Win=65535 Len=0
1,4.427224000000024,54.93.77.70,10.0.2.15,TLSv1.2,590,Application Data
1,4.427588000000469,10.0.2.15,54.93.77.70,TLSv1.2,590,Application Data
1,4.427695999999742,54.93.77.70,10.0.2.15,TCP,60,9001  >  34692 [ACK] Seq=271630801 Ack=14915851 Win=65535 Len=0
1,4.576600999999755,62.210.85.178,10.0.2.15,TLSv1.2,590,Application Data
1,4.581828000000314,10.0.2.15,62.210.85.178,TLSv1.2,590,Application Data
1,4.582018000000062,62.210.85.178,10.0.2.15,TCP,60,9001  >  35978 [ACK] Seq=14845825 Ack=271842821 Win=65535 Len=0
1,4.595312000000376,10.0.2.15,62.210.85.178,TLSv1.2,4124,Application Data
1,4.595449999999801,10.0.2.15,62.210.85.178,TCP,2974,35978  >  9001 [ACK] Seq=271846891 Ack=14845825 Win=65535 Len=2920 [TCP segment of a reassembled PDU]
1,4.595495999999912,62.210.85.178,10.0.2.15,TCP,60,9001  >  35978 [ACK] Seq=14845825 Ack=271844281 Win=65535 Len=0
1,4.595510000000104,62.210.85.178,10.0.2.15,TCP,60,9001  >  35978 [ACK] Seq=14845825 Ack=271845741 Win=65535 Len=0
1,4.595514999999978,62.210.85.178,10.0.2.15,TCP,60,9001  >  35978 [ACK] Seq=14845825 Ack=271846891 Win=65535 Len=0
1,4.595519999999851,62.210.85.178,10.0.2.15,TCP,60,9001  >  35978 [ACK] Seq=14845825 Ack=271848351 Win=65535 Len=0
1,4.595522999999957,62.210.85.178,10.0.2.15,TCP,60,9001  >  35978 [ACK] Seq=14845825 Ack=271849811 Win=65535 Len=0
1,4.595559000000321,10.0.2.15,62.210.85.178,TLSv1.2,1204,Application Data
1,4.595597999999882,62.210.85.178,10.0.2.15,TCP,60,9001  >  35978 [ACK] Seq=14845825 Ack=271850961 Win=65535 Len=0
1,4.595643000000564,10.0.2.15,62.210.85.178,TLSv1.2,4124,Application Data
1,4.595682000000124,62.210.85.178,10.0.2.15,TCP,60,9001  >  35978 [ACK] Seq=14845825 Ack=271852421 Win=65535 Len=0
1,4.595691000000443,62.210.85.178,10.0.2.15,TCP,60,9001  >  35978 [ACK] Seq=14845825 Ack=271853881 Win=65535 Len=0
1,4.595694999999978,62.210.85.178,10.0.2.15,TCP,60,9001  >  35978 [ACK] Seq=14845825 Ack=271855031 Win=65535 Len=0
1,4.595734000000448,10.0.2.15,62.210.85.178,TLSv1.2,4124,Application Data
1,4.5958049999999275,62.210.85.178,10.0.2.15,TCP,60,9001  >  35978 [ACK] Seq=14845825 Ack=271856491 Win=65535 Len=0
1,4.595814000000246,62.210.85.178,10.0.2.15,TCP,60,9001  >  35978 [ACK] Seq=14845825 Ack=271857951 Win=65535 Len=0
1,4.595817000000352,62.210.85.178,10.0.2.15,TCP,60,9001  >  35978 [ACK] Seq=14845825 Ack=271859101 Win=65535 Len=0
1,4.595855000000483,10.0.2.15,62.210.85.178,TLSv1.2,332,Application Data
1,4.595892999999705,62.210.85.178,10.0.2.15,TCP,60,9001  >  35978 [ACK] Seq=14845825 Ack=271859379 Win=65535 Len=0
1,4.5959499999999025,10.0.2.15,62.210.85.178,TLSv1.2,3868,Application Data
1,4.5959890000003725,62.210.85.178,10.0.2.15,TCP,60,9001  >  35978 [ACK] Seq=14845825 Ack=271860839 Win=65535 Len=0
1,4.595997000000352,62.210.85.178,10.0.2.15,TCP,60,9001  >  35978 [ACK] Seq=14845825 Ack=271862299 Win=65535 Len=0
1,4.596000999999887,62.210.85.178,10.0.2.15,TCP,60,9001  >  35978 [ACK] Seq=14845825 Ack=271863193 Win=65535 Len=0
1,4.596040000000357,10.0.2.15,62.210.85.178,TLSv1.2,4124,Application Data
1,4.596078999999918,62.210.85.178,10.0.2.15,TCP,60,9001  >  35978 [ACK] Seq=14845825 Ack=271864653 Win=65535 Len=0
1,4.596086000000469,62.210.85.178,10.0.2.15,TCP,60,9001  >  35978 [ACK] Seq=14845825 Ack=271866113 Win=65535 Len=0
1,4.596090000000004,62.210.85.178,10.0.2.15,TCP,60,9001  >  35978 [ACK] Seq=14845825 Ack=271867263 Win=65535 Len=0
1,4.596125000000029,10.0.2.15,62.210.85.178,TLSv1.2,3030,Application Data
1,4.596164000000499,62.210.85.178,10.0.2.15,TCP,60,9001  >  35978 [ACK] Seq=14845825 Ack=271868723 Win=65535 Len=0
1,4.59617100000014,62.210.85.178,10.0.2.15,TCP,60,9001  >  35978 [ACK] Seq=14845825 Ack=271870183 Win=65535 Len=0
1,4.59617900000012,62.210.85.178,10.0.2.15,TCP,60,9001  >  35978 [ACK] Seq=14845825 Ack=271870239 Win=65535 Len=0
1,4.605787999999848,10.0.2.15,62.210.85.178,TLSv1.2,4124,Application Data
1,4.605900000000474,62.210.85.178,10.0.2.15,TCP,60,9001  >  35978 [ACK] Seq=14845825 Ack=271871699 Win=65535 Len=0
1,4.60591100000056,62.210.85.178,10.0.2.15,TCP,60,9001  >  35978 [ACK] Seq=14845825 Ack=271873159 Win=65535 Len=0
1,4.6059150000000955,62.210.85.178,10.0.2.15,TCP,60,9001  >  35978 [ACK] Seq=14845825 Ack=271874309 Win=65535 Len=0
1,4.605951999999888,10.0.2.15,62.210.85.178,TLSv1.2,4124,Application Data
1,4.606017000000065,62.210.85.178,10.0.2.15,TCP,60,9001  >  35978 [ACK] Seq=14845825 Ack=271875769 Win=65535 Len=0
1,4.606023999999707,62.210.85.178,10.0.2.15,TCP,60,9001  >  35978 [ACK] Seq=14845825 Ack=271877229 Win=65535 Len=0
1,4.606026999999813,62.210.85.178,10.0.2.15,TCP,60,9001  >  35978 [ACK] Seq=14845825 Ack=271878379 Win=65535 Len=0
1,4.6060630000001765,10.0.2.15,62.210.85.178,TLSv1.2,4124,Application Data
1,4.606120000000374,62.210.85.178,10.0.2.15,TCP,60,9001  >  35978 [ACK] Seq=14845825 Ack=271879839 Win=65535 Len=0
1,4.606131999999889,62.210.85.178,10.0.2.15,TCP,60,9001  >  35978 [ACK] Seq=14845825 Ack=271881299 Win=65535 Len=0
1,4.606134999999995,62.210.85.178,10.0.2.15,TCP,60,9001  >  35978 [ACK] Seq=14845825 Ack=271882449 Win=65535 Len=0
1,4.6061820000004445,10.0.2.15,62.210.85.178,TLSv1.2,4124,Application Data
1,4.606221000000005,62.210.85.178,10.0.2.15,TCP,60,9001  >  35978 [ACK] Seq=14845825 Ack=271883909 Win=65535 Len=0
1,4.606228999999985,62.210.85.178,10.0.2.15,TCP,60,9001  >  35978 [ACK] Seq=14845825 Ack=271885369 Win=65535 Len=0
1,4.606232000000091,62.210.85.178,10.0.2.15,TCP,60,9001  >  35978 [ACK] Seq=14845825 Ack=271886519 Win=65535 Len=0
1,4.606270000000222,10.0.2.15,62.210.85.178,TLSv1.2,332,Application Data
1,4.606303999999909,62.210.85.178,10.0.2.15,TCP,60,9001  >  35978 [ACK] Seq=14845825 Ack=271886797 Win=65535 Len=0
1,4.606357000000571,10.0.2.15,62.210.85.178,TLSv1.2,3868,Application Data
1,4.606391999999687,62.210.85.178,10.0.2.15,TCP,60,9001  >  35978 [ACK] Seq=14845825 Ack=271888257 Win=65535 Len=0
1,4.606399000000238,62.210.85.178,10.0.2.15,TCP,60,9001  >  35978 [ACK] Seq=14845825 Ack=271889717 Win=65535 Len=0
1,4.606402000000344,62.210.85.178,10.0.2.15,TCP,60,9001  >  35978 [ACK] Seq=14845825 Ack=271890611 Win=65535 Len=0
1,4.606440000000475,10.0.2.15,62.210.85.178,TLSv1.2,4124,Application Data
1,4.606474000000162,62.210.85.178,10.0.2.15,TCP,60,9001  >  35978 [ACK] Seq=14845825 Ack=271892071 Win=65535 Len=0
1,4.606480999999803,62.210.85.178,10.0.2.15,TCP,60,9001  >  35978 [ACK] Seq=14845825 Ack=271893531 Win=65535 Len=0
1,4.606483999999909,62.210.85.178,10.0.2.15,TCP,60,9001  >  35978 [ACK] Seq=14845825 Ack=271894681 Win=65535 Len=0
1,4.606518000000506,10.0.2.15,62.210.85.178,TLSv1.2,3030,Application Data
1,4.606553000000531,62.210.85.178,10.0.2.15,TCP,60,9001  >  35978 [ACK] Seq=14845825 Ack=271896141 Win=65535 Len=0
1,4.606558999999834,62.210.85.178,10.0.2.15,TCP,60,9001  >  35978 [ACK] Seq=14845825 Ack=271897601 Win=65535 Len=0
1,4.60656199999994,62.210.85.178,10.0.2.15,TCP,60,9001  >  35978 [ACK] Seq=14845825 Ack=271897657 Win=65535 Len=0
1,4.619085999999697,10.0.2.15,62.210.85.178,TLSv1.2,4124,Application Data
1,4.6191680000001725,62.210.85.178,10.0.2.15,TCP,60,9001  >  35978 [ACK] Seq=14845825 Ack=271899117 Win=65535 Len=0
1,4.61917799999992,62.210.85.178,10.0.2.15,TCP,60,9001  >  35978 [ACK] Seq=14845825 Ack=271900577 Win=65535 Len=0
1,4.619181000000026,62.210.85.178,10.0.2.15,TCP,60,9001  >  35978 [ACK] Seq=14845825 Ack=271901727 Win=65535 Len=0
1,4.619220999999925,10.0.2.15,62.210.85.178,TLSv1.2,140,Application Data
1,4.61925599999995,62.210.85.178,10.0.2.15,TCP,60,9001  >  35978 [ACK] Seq=14845825 Ack=271901813 Win=65535 Len=0
1,4.735869000000093,54.93.77.70,10.0.2.15,TLSv1.2,590,Application Data
1,4.778132000000369,10.0.2.15,54.93.77.70,TCP,54,34692  >  9001 [ACK] Seq=14915851 Ack=271631337 Win=65535 Len=0
1,4.912945000000036,54.93.77.70,10.0.2.15,TCP,2950,"9001  >  34692 [PSH, ACK] Seq=271631337 Ack=14915851 Win=65535 Len=2896 [TCP segment of a reassembled PDU]"
1,4.913099999999758,10.0.2.15,54.93.77.70,TCP,54,34692  >  9001 [ACK] Seq=14915851 Ack=271634233 Win=65535 Len=0
1,5.047348000000056,54.93.77.70,10.0.2.15,TLSv1.2,778,Application Data
1,5.047451000000365,10.0.2.15,54.93.77.70,TCP,54,34692  >  9001 [ACK] Seq=14915851 Ack=271634957 Win=65535 Len=0
1,5.148707000000286,10.0.2.15,62.210.85.178,TLSv1.2,4124,Application Data
1,5.148890000000392,62.210.85.178,10.0.2.15,TCP,60,9001  >  35978 [ACK] Seq=14845825 Ack=271903273 Win=65535 Len=0
1,5.148906000000352,62.210.85.178,10.0.2.15,TCP,60,9001  >  35978 [ACK] Seq=14845825 Ack=271904733 Win=65535 Len=0
1,5.148909999999887,62.210.85.178,10.0.2.15,TCP,60,9001  >  35978 [ACK] Seq=14845825 Ack=271905883 Win=65535 Len=0
1,5.14902499999971,10.0.2.15,62.210.85.178,TLSv1.2,140,Application Data
1,5.149077000000034,62.210.85.178,10.0.2.15,TCP,60,9001  >  35978 [ACK] Seq=14845825 Ack=271905969 Win=65535 Len=0
1,5.342910999999731,54.93.77.70,10.0.2.15,TLSv1.2,13086,"Application Data, Application Data, Application Data"
1,5.343006000000059,10.0.2.15,54.93.77.70,TCP,54,34692  >  9001 [ACK] Seq=14915851 Ack=271647989 Win=65535 Len=0
1,5.343323000000055,54.93.77.70,10.0.2.15,TLSv1.2,2950,Application Data [TCP segment of a reassembled PDU]
1,5.343362999999954,10.0.2.15,54.93.77.70,TCP,54,34692  >  9001 [ACK] Seq=14915851 Ack=271650885 Win=65535 Len=0
1,5.34346800000003,10.0.2.15,54.93.77.70,TLSv1.2,590,Application Data
1,5.343539000000419,54.93.77.70,10.0.2.15,TCP,60,9001  >  34692 [ACK] Seq=271650885 Ack=14916387 Win=65535 Len=0
1,5.357138000000305,54.93.77.70,10.0.2.15,TCP,1502,"9001  >  34692 [PSH, ACK] Seq=271650885 Ack=14916387 Win=65535 Len=1448 [TCP segment of a reassembled PDU]"
1,5.357181999999739,10.0.2.15,54.93.77.70,TCP,54,34692  >  9001 [ACK] Seq=14916387 Ack=271652333 Win=65535 Len=0
1,5.370815000000221,62.210.85.178,10.0.2.15,TLSv1.2,2646,Application Data
1,5.3709060000001045,10.0.2.15,62.210.85.178,TCP,54,35978  >  9001 [ACK] Seq=271905969 Ack=14848417 Win=65535 Len=0
1,5.3717139999998835,10.0.2.15,62.210.85.178,TLSv1.2,2646,Application Data
1,5.371814000000086,62.210.85.178,10.0.2.15,TCP,60,9001  >  35978 [ACK] Seq=14848417 Ack=271907429 Win=65535 Len=0
1,5.37182600000051,62.210.85.178,10.0.2.15,TCP,60,9001  >  35978 [ACK] Seq=14848417 Ack=271908561 Win=65535 Len=0
1,5.372323000000506,54.93.77.70,10.0.2.15,TLSv1.2,2950,"Application Data, Application Data"
1,5.3723900000004505,10.0.2.15,54.93.77.70,TCP,54,34692  >  9001 [ACK] Seq=14916387 Ack=271655229 Win=65535 Len=0
1,5.374794000000293,54.93.77.70,10.0.2.15,TLSv1.2,12942,"Application Data, Application Data, Application Data, Application Data, Application Data, Application Data"
1,5.374864999999772,10.0.2.15,54.93.77.70,TCP,54,34692  >  9001 [ACK] Seq=14916387 Ack=271668117 Win=65535 Len=0
1,5.3750120000004245,10.0.2.15,54.93.77.70,TLSv1.2,590,Application Data
1,5.375084000000243,54.93.77.70,10.0.2.15,TCP,60,9001  >  34692 [ACK] Seq=271668117 Ack=14916923 Win=65535 Len=0
1,5.377317999999832,54.93.77.70,10.0.2.15,TCP,2950,"9001  >  34692 [PSH, ACK] Seq=271668117 Ack=14916923 Win=65535 Len=2896 [TCP segment of a reassembled PDU]"
1,5.377360999999837,10.0.2.15,54.93.77.70,TCP,54,34692  >  9001 [ACK] Seq=14916923 Ack=271671013 Win=65535 Len=0
1,5.378639999999905,54.93.77.70,10.0.2.15,TLSv1.2,5846,"Application Data, Application Data"
1,5.378703000000314,10.0.2.15,54.93.77.70,TCP,54,34692  >  9001 [ACK] Seq=14916923 Ack=271676805 Win=65535 Len=0
1,5.3801290000001245,54.93.77.70,10.0.2.15,TLSv1.2,4398,Application Data [TCP segment of a reassembled PDU]
1,5.3801690000000235,10.0.2.15,54.93.77.70,TCP,54,34692  >  9001 [ACK] Seq=14916923 Ack=271681149 Win=65535 Len=0
1,5.381000000000313,54.93.77.70,10.0.2.15,TCP,2950,"9001  >  34692 [PSH, ACK] Seq=271681149 Ack=14916923 Win=65535 Len=2896 [TCP segment of a reassembled PDU]"
1,5.38104100000055,10.0.2.15,54.93.77.70,TCP,54,34692  >  9001 [ACK] Seq=14916923 Ack=271684045 Win=65535 Len=0
1,5.501713999999993,54.93.77.70,10.0.2.15,TLSv1.2,2950,"Application Data, Application Data"
1,5.501846000000114,10.0.2.15,54.93.77.70,TCP,54,34692  >  9001 [ACK] Seq=14916923 Ack=271686941 Win=65535 Len=0
1,5.502075999999761,10.0.2.15,54.93.77.70,TLSv1.2,590,Application Data
1,5.502140999999938,54.93.77.70,10.0.2.15,TCP,60,9001  >  34692 [ACK] Seq=271686941 Ack=14917459 Win=65535 Len=0
1,5.507510999999795,54.93.77.70,10.0.2.15,TLSv1.2,3486,"Application Data, Application Data"
1,5.507598000000144,10.0.2.15,54.93.77.70,TCP,54,34692  >  9001 [ACK] Seq=14917459 Ack=271690373 Win=65535 Len=0
1,5.5078599999997095,62.210.85.178,10.0.2.15,TLSv1.2,1104,Application Data
1,5.510193000000072,10.0.2.15,62.210.85.178,TLSv1.2,1104,Application Data
1,5.510812000000442,62.210.85.178,10.0.2.15,TCP,60,9001  >  35978 [ACK] Seq=14849467 Ack=271909611 Win=65535 Len=0
1,5.512539999999717,10.0.2.15,54.93.77.70,TLSv1.2,590,Application Data
1,5.512695999999778,54.93.77.70,10.0.2.15,TCP,60,9001  >  34692 [ACK] Seq=271690373 Ack=14917995 Win=65535 Len=0
1,5.5238799999997354,62.210.85.178,10.0.2.15,TLSv1.2,1502,"Application Data, Application Data"
1,5.524194000000534,10.0.2.15,62.210.85.178,TCP,54,35978  >  9001 [ACK] Seq=271909611 Ack=14850915 Win=65535 Len=0
1,5.524709999999686,10.0.2.15,62.210.85.178,TLSv1.2,590,Application Data
1,5.524841000000379,62.210.85.178,10.0.2.15,TCP,60,9001  >  35978 [ACK] Seq=14850915 Ack=271910147 Win=65535 Len=0
1,5.534705000000031,10.0.2.15,62.210.85.178,TLSv1.2,4124,Application Data
1,5.534832000000279,10.0.2.15,62.210.85.178,TCP,2974,35978  >  9001 [ACK] Seq=271914217 Ack=14850915 Win=65535 Len=2920 [TCP segment of a reassembled PDU]
1,5.534873999999945,62.210.85.178,10.0.2.15,TCP,60,9001  >  35978 [ACK] Seq=14850915 Ack=271911607 Win=65535 Len=0
1,5.534883999999693,62.210.85.178,10.0.2.15,TCP,60,9001  >  35978 [ACK] Seq=14850915 Ack=271913067 Win=65535 Len=0
1,5.534889000000476,62.210.85.178,10.0.2.15,TCP,60,9001  >  35978 [ACK] Seq=14850915 Ack=271914217 Win=65535 Len=0
1,5.534893000000011,62.210.85.178,10.0.2.15,TCP,60,9001  >  35978 [ACK] Seq=14850915 Ack=271915677 Win=65535 Len=0
1,5.534897999999885,62.210.85.178,10.0.2.15,TCP,60,9001  >  35978 [ACK] Seq=14850915 Ack=271917137 Win=65535 Len=0
1,5.534942000000228,10.0.2.15,62.210.85.178,TLSv1.2,1204,Application Data
1,5.5349880000003395,62.210.85.178,10.0.2.15,TCP,60,9001  >  35978 [ACK] Seq=14850915 Ack=271918287 Win=65535 Len=0
1,5.535037999999986,10.0.2.15,62.210.85.178,TLSv1.2,4124,Application Data
1,5.53510499999993,10.0.2.15,62.210.85.178,TCP,2974,35978  >  9001 [ACK] Seq=271922357 Ack=14850915 Win=65535 Len=2920 [TCP segment of a reassembled PDU]
