No.,Time,Source,Destination,Protocol,Length,Info
1,0.04349199999978737,62.210.85.178,10.0.2.15,TLSv1.2,590,Application Data
1,0.08627499999965949,10.0.2.15,62.210.85.178,TCP,54,35978  >  9001 [ACK] Seq=289498525 Ack=15724997 Win=65535 Len=0
1,0.1650209999997969,10.0.2.15,54.93.77.70,TLSv1.2,590,Application Data
1,0.16520700000000943,54.93.77.70,10.0.2.15,TCP,60,9001  >  34692 [ACK] Seq=289153415 Ack=15769555 Win=65535 Len=0
1,0.16859199999998964,62.210.85.178,10.0.2.15,TLSv1.2,590,Application Data
1,0.16865000000052532,10.0.2.15,62.210.85.178,TCP,54,35978  >  9001 [ACK] Seq=289498525 Ack=15725533 Win=65535 Len=0
1,0.2779550000004747,62.210.85.178,10.0.2.15,TLSv1.2,590,Application Data
1,0.27804100000048493,10.0.2.15,62.210.85.178,TCP,54,35978  >  9001 [ACK] Seq=289498525 Ack=15726069 Win=65535 Len=0
1,0.2785009999997783,10.0.2.15,62.210.85.178,TLSv1.2,590,Application Data
1,0.27860099999998056,62.210.85.178,10.0.2.15,TCP,60,9001  >  35978 [ACK] Seq=15726069 Ack=289499061 Win=65535 Len=0
1,0.4705610000000888,54.93.77.70,10.0.2.15,TLSv1.2,590,Application Data
1,0.4710450000002311,10.0.2.15,54.93.77.70,TLSv1.2,1618,Application Data
1,0.4712040000003981,54.93.77.70,10.0.2.15,TCP,60,9001  >  34692 [ACK] Seq=289153951 Ack=15771119 Win=65535 Len=0
1,0.6764899999998306,62.210.85.178,10.0.2.15,TLSv1.2,1618,Application Data
1,0.6766079999997601,10.0.2.15,62.210.85.178,TCP,54,35978  >  9001 [ACK] Seq=289499061 Ack=15727633 Win=65535 Len=0
1,0.6904729999996562,10.0.2.15,62.210.85.178,TLSv1.2,590,Application Data
1,0.6906490000001213,62.210.85.178,10.0.2.15,TCP,60,9001  >  35978 [ACK] Seq=15727633 Ack=289499597 Win=65535 Len=0
1,0.7014099999996688,10.0.2.15,62.210.85.178,TLSv1.2,1618,Application Data
1,0.7015659999997297,62.210.85.178,10.0.2.15,TCP,60,9001  >  35978 [ACK] Seq=15727633 Ack=289501057 Win=65535 Len=0
1,0.7015860000001339,62.210.85.178,10.0.2.15,TCP,60,9001  >  35978 [ACK] Seq=15727633 Ack=289501161 Win=65535 Len=0
1,0.8800309999996898,54.93.77.70,10.0.2.15,TLSv1.2,590,Application Data
1,0.8838420000001861,54.93.77.70,10.0.2.15,TCP,1502,"9001  >  34692 [PSH, ACK] Seq=289154487 Ack=15771119 Win=65535 Len=1448 [TCP segment of a reassembled PDU]"
1,0.8839260000004288,10.0.2.15,54.93.77.70,TCP,54,34692  >  9001 [ACK] Seq=15771119 Ack=289155935 Win=65535 Len=0
1,0.8998320000000604,54.93.77.70,10.0.2.15,TLSv1.2,170,Application Data
1,0.9042970000000423,10.0.2.15,54.93.77.70,TLSv1.2,590,Application Data
1,0.9046749999997701,54.93.77.70,10.0.2.15,TCP,60,9001  >  34692 [ACK] Seq=289156051 Ack=15771655 Win=65535 Len=0
1,1.0862830000005488,62.210.85.178,10.0.2.15,TLSv1.2,590,Application Data
1,1.0865929999999935,10.0.2.15,62.210.85.178,TLSv1.2,590,Application Data
1,1.0866980000000694,62.210.85.178,10.0.2.15,TCP,60,9001  >  35978 [ACK] Seq=15728169 Ack=289501697 Win=65535 Len=0
1,1.2896430000000692,54.93.77.70,10.0.2.15,TLSv1.2,590,Application Data
1,1.2900159999999232,10.0.2.15,54.93.77.70,TLSv1.2,590,Application Data
1,1.290140000000065,54.93.77.70,10.0.2.15,TCP,60,9001  >  34692 [ACK] Seq=289156587 Ack=15772191 Win=65535 Len=0
1,1.495085000000472,62.210.85.178,10.0.2.15,TLSv1.2,590,Application Data
1,1.5072689999997237,10.0.2.15,62.210.85.178,TLSv1.2,590,Application Data
1,1.5090740000005098,62.210.85.178,10.0.2.15,TCP,60,9001  >  35978 [ACK] Seq=15728705 Ack=289502233 Win=65535 Len=0
1,1.5180460000001403,10.0.2.15,62.210.85.178,TLSv1.2,4124,Application Data
1,1.5181600000005346,10.0.2.15,62.210.85.178,TCP,2974,35978  >  9001 [ACK] Seq=289506303 Ack=15728705 Win=65535 Len=2920 [TCP segment of a reassembled PDU]
1,1.5182039999999688,62.210.85.178,10.0.2.15,TCP,60,9001  >  35978 [ACK] Seq=15728705 Ack=289503693 Win=65535 Len=0
1,1.5182139999997162,62.210.85.178,10.0.2.15,TCP,60,9001  >  35978 [ACK] Seq=15728705 Ack=289505153 Win=65535 Len=0
1,1.5182190000004994,62.210.85.178,10.0.2.15,TCP,60,9001  >  35978 [ACK] Seq=15728705 Ack=289506303 Win=65535 Len=0
1,1.518224000000373,62.210.85.178,10.0.2.15,TCP,60,9001  >  35978 [ACK] Seq=15728705 Ack=289507763 Win=65535 Len=0
1,1.5182279999999082,62.210.85.178,10.0.2.15,TCP,60,9001  >  35978 [ACK] Seq=15728705 Ack=289509223 Win=65535 Len=0
1,1.5182720000002519,10.0.2.15,62.210.85.178,TLSv1.2,1204,Application Data
1,1.5183450000004086,10.0.2.15,62.210.85.178,TCP,2974,35978  >  9001 [ACK] Seq=289510373 Ack=15728705 Win=65535 Len=2920 [TCP segment of a reassembled PDU]
1,1.518383999999969,62.210.85.178,10.0.2.15,TCP,60,9001  >  35978 [ACK] Seq=15728705 Ack=289510373 Win=65535 Len=0
1,1.5183910000005199,62.210.85.178,10.0.2.15,TCP,60,9001  >  35978 [ACK] Seq=15728705 Ack=289511833 Win=65535 Len=0
1,1.5183960000003935,62.210.85.178,10.0.2.15,TCP,60,9001  >  35978 [ACK] Seq=15728705 Ack=289513293 Win=65535 Len=0
1,1.5184300000000803,10.0.2.15,62.210.85.178,TLSv1.2,1204,Application Data
1,1.5184950000002573,10.0.2.15,62.210.85.178,TCP,2974,35978  >  9001 [ACK] Seq=289514443 Ack=15728705 Win=65535 Len=2920 [TCP segment of a reassembled PDU]
1,1.5185330000003887,62.210.85.178,10.0.2.15,TCP,60,9001  >  35978 [ACK] Seq=15728705 Ack=289514443 Win=65535 Len=0
1,1.51854000000003,62.210.85.178,10.0.2.15,TCP,60,9001  >  35978 [ACK] Seq=15728705 Ack=289515903 Win=65535 Len=0
1,1.5185440000004746,62.210.85.178,10.0.2.15,TCP,60,9001  >  35978 [ACK] Seq=15728705 Ack=289517363 Win=65535 Len=0
1,1.5185750000000553,10.0.2.15,62.210.85.178,TLSv1.2,1204,Application Data
1,1.5186690000000453,62.210.85.178,10.0.2.15,TCP,60,9001  >  35978 [ACK] Seq=15728705 Ack=289518513 Win=65535 Len=0
1,1.5187269999996715,10.0.2.15,62.210.85.178,TLSv1.2,332,Application Data
1,1.5187889999997424,62.210.85.178,10.0.2.15,TCP,60,9001  >  35978 [ACK] Seq=15728705 Ack=289518791 Win=65535 Len=0
1,1.5188650000000052,10.0.2.15,62.210.85.178,TLSv1.2,3868,Application Data
1,1.518909999999778,62.210.85.178,10.0.2.15,TCP,60,9001  >  35978 [ACK] Seq=15728705 Ack=289520251 Win=65535 Len=0
1,1.5189179999997577,62.210.85.178,10.0.2.15,TCP,60,9001  >  35978 [ACK] Seq=15728705 Ack=289521711 Win=65535 Len=0
1,1.518923000000541,62.210.85.178,10.0.2.15,TCP,60,9001  >  35978 [ACK] Seq=15728705 Ack=289522605 Win=65535 Len=0
1,1.5189710000004197,10.0.2.15,62.210.85.178,TLSv1.2,4124,Application Data
1,1.519029000000046,62.210.85.178,10.0.2.15,TCP,60,9001  >  35978 [ACK] Seq=15728705 Ack=289524065 Win=65535 Len=0
1,1.5190359999996872,62.210.85.178,10.0.2.15,TCP,60,9001  >  35978 [ACK] Seq=15728705 Ack=289525525 Win=65535 Len=0
1,1.5190410000004704,62.210.85.178,10.0.2.15,TCP,60,9001  >  35978 [ACK] Seq=15728705 Ack=289526675 Win=65535 Len=0
1,1.5190840000004755,10.0.2.15,62.210.85.178,TLSv1.2,3030,Application Data
1,1.519123000000036,62.210.85.178,10.0.2.15,TCP,60,9001  >  35978 [ACK] Seq=15728705 Ack=289528135 Win=65535 Len=0
1,1.5191299999996772,62.210.85.178,10.0.2.15,TCP,60,9001  >  35978 [ACK] Seq=15728705 Ack=289529595 Win=65535 Len=0
1,1.5191340000001219,62.210.85.178,10.0.2.15,TCP,60,9001  >  35978 [ACK] Seq=15728705 Ack=289529651 Win=65535 Len=0
1,1.5283280000003288,10.0.2.15,62.210.85.178,TLSv1.2,4124,Application Data
1,1.5284050000000207,10.0.2.15,62.210.85.178,TCP,2974,35978  >  9001 [ACK] Seq=289533721 Ack=15728705 Win=65535 Len=2920 [TCP segment of a reassembled PDU]
1,1.5284440000004906,62.210.85.178,10.0.2.15,TCP,60,9001  >  35978 [ACK] Seq=15728705 Ack=289531111 Win=65535 Len=0
1,1.5284520000004704,62.210.85.178,10.0.2.15,TCP,60,9001  >  35978 [ACK] Seq=15728705 Ack=289532571 Win=65535 Len=0
1,1.5284560000000056,62.210.85.178,10.0.2.15,TCP,60,9001  >  35978 [ACK] Seq=15728705 Ack=289533721 Win=65535 Len=0
1,1.5284609999998793,62.210.85.178,10.0.2.15,TCP,60,9001  >  35978 [ACK] Seq=15728705 Ack=289535181 Win=65535 Len=0
1,1.528465000000324,62.210.85.178,10.0.2.15,TCP,60,9001  >  35978 [ACK] Seq=15728705 Ack=289536641 Win=65535 Len=0
1,1.5285039999998844,10.0.2.15,62.210.85.178,TLSv1.2,1204,Application Data
1,1.5285700000003999,10.0.2.15,62.210.85.178,TCP,2974,35978  >  9001 [ACK] Seq=289537791 Ack=15728705 Win=65535 Len=2920 [TCP segment of a reassembled PDU]
1,1.5286059999998542,62.210.85.178,10.0.2.15,TCP,60,9001  >  35978 [ACK] Seq=15728705 Ack=289537791 Win=65535 Len=0
1,1.528613999999834,62.210.85.178,10.0.2.15,TCP,60,9001  >  35978 [ACK] Seq=15728705 Ack=289539251 Win=65535 Len=0
1,1.5286189999997077,62.210.85.178,10.0.2.15,TCP,60,9001  >  35978 [ACK] Seq=15728705 Ack=289540711 Win=65535 Len=0
1,1.528653000000304,10.0.2.15,62.210.85.178,TLSv1.2,1204,Application Data
1,1.528718000000481,10.0.2.15,62.210.85.178,TCP,2974,35978  >  9001 [ACK] Seq=289541861 Ack=15728705 Win=65535 Len=2920 [TCP segment of a reassembled PDU]
1,1.5287550000002739,62.210.85.178,10.0.2.15,TCP,60,9001  >  35978 [ACK] Seq=15728705 Ack=289541861 Win=65535 Len=0
1,1.5287619999999151,62.210.85.178,10.0.2.15,TCP,60,9001  >  35978 [ACK] Seq=15728705 Ack=289543321 Win=65535 Len=0
1,1.5287669999997888,62.210.85.178,10.0.2.15,TCP,60,9001  >  35978 [ACK] Seq=15728705 Ack=289544781 Win=65535 Len=0
1,1.528798000000279,10.0.2.15,62.210.85.178,TLSv1.2,1204,Application Data
1,1.5288860000000568,62.210.85.178,10.0.2.15,TCP,60,9001  >  35978 [ACK] Seq=15728705 Ack=289545931 Win=65535 Len=0
1,1.5289220000004207,10.0.2.15,62.210.85.178,TLSv1.2,332,Application Data
1,1.529011000000537,10.0.2.15,62.210.85.178,TCP,2974,35978  >  9001 [ACK] Seq=289546209 Ack=15728705 Win=65535 Len=2920 [TCP segment of a reassembled PDU]
1,1.529034000000138,62.210.85.178,10.0.2.15,TCP,60,9001  >  35978 [ACK] Seq=15728705 Ack=289546209 Win=65535 Len=0
1,1.5290409999997792,62.210.85.178,10.0.2.15,TCP,60,9001  >  35978 [ACK] Seq=15728705 Ack=289547669 Win=65535 Len=0
1,1.5290709999999308,10.0.2.15,62.210.85.178,TLSv1.2,948,Application Data
1,1.5291079999997237,62.210.85.178,10.0.2.15,TCP,60,9001  >  35978 [ACK] Seq=15728705 Ack=289549129 Win=65535 Len=0
1,1.529113999999936,62.210.85.178,10.0.2.15,TCP,60,9001  >  35978 [ACK] Seq=15728705 Ack=289550023 Win=65535 Len=0
1,1.5291580000002796,10.0.2.15,62.210.85.178,TLSv1.2,4124,Application Data
1,1.5291980000001786,62.210.85.178,10.0.2.15,TCP,60,9001  >  35978 [ACK] Seq=15728705 Ack=289551483 Win=65535 Len=0
1,1.5292049999998198,62.210.85.178,10.0.2.15,TCP,60,9001  >  35978 [ACK] Seq=15728705 Ack=289552943 Win=65535 Len=0
1,1.5292099999996935,62.210.85.178,10.0.2.15,TCP,60,9001  >  35978 [ACK] Seq=15728705 Ack=289554093 Win=65535 Len=0
1,1.5292550000003757,10.0.2.15,62.210.85.178,TLSv1.2,3030,Application Data
1,1.5292950000002747,62.210.85.178,10.0.2.15,TCP,60,9001  >  35978 [ACK] Seq=15728705 Ack=289555553 Win=65535 Len=0
1,1.529301999999916,62.210.85.178,10.0.2.15,TCP,60,9001  >  35978 [ACK] Seq=15728705 Ack=289557013 Win=65535 Len=0
1,1.5293060000003607,62.210.85.178,10.0.2.15,TCP,60,9001  >  35978 [ACK] Seq=15728705 Ack=289557069 Win=65535 Len=0
1,1.5417200000001685,10.0.2.15,62.210.85.178,TLSv1.2,4124,Application Data
1,1.5417999999999665,10.0.2.15,62.210.85.178,TCP,2974,35978  >  9001 [ACK] Seq=289561139 Ack=15728705 Win=65535 Len=2920 [TCP segment of a reassembled PDU]
1,1.5418429999999717,62.210.85.178,10.0.2.15,TCP,60,9001  >  35978 [ACK] Seq=15728705 Ack=289558529 Win=65535 Len=0
1,1.54185200000029,62.210.85.178,10.0.2.15,TCP,60,9001  >  35978 [ACK] Seq=15728705 Ack=289559989 Win=65535 Len=0
1,1.5418570000001637,62.210.85.178,10.0.2.15,TCP,60,9001  >  35978 [ACK] Seq=15728705 Ack=289561139 Win=65535 Len=0
1,1.5418609999996988,62.210.85.178,10.0.2.15,TCP,60,9001  >  35978 [ACK] Seq=15728705 Ack=289562599 Win=65535 Len=0
1,1.5418650000001435,62.210.85.178,10.0.2.15,TCP,60,9001  >  35978 [ACK] Seq=15728705 Ack=289564059 Win=65535 Len=0
1,1.541903999999704,10.0.2.15,62.210.85.178,TLSv1.2,1204,Application Data
1,1.5419730000003256,10.0.2.15,62.210.85.178,TCP,2974,35978  >  9001 [ACK] Seq=289565209 Ack=15728705 Win=65535 Len=2920 [TCP segment of a reassembled PDU]
1,1.542011999999886,62.210.85.178,10.0.2.15,TCP,60,9001  >  35978 [ACK] Seq=15728705 Ack=289565209 Win=65535 Len=0
1,1.5420190000004368,62.210.85.178,10.0.2.15,TCP,60,9001  >  35978 [ACK] Seq=15728705 Ack=289566669 Win=65535 Len=0
1,1.542022999999972,62.210.85.178,10.0.2.15,TCP,60,9001  >  35978 [ACK] Seq=15728705 Ack=289568129 Win=65535 Len=0
1,1.5420569999996587,10.0.2.15,62.210.85.178,TLSv1.2,1204,Application Data
1,1.542120000000068,10.0.2.15,62.210.85.178,TCP,1514,35978  >  9001 [ACK] Seq=289569279 Ack=15728705 Win=65535 Len=1460 [TCP segment of a reassembled PDU]
1,1.542156999999861,62.210.85.178,10.0.2.15,TCP,60,9001  >  35978 [ACK] Seq=15728705 Ack=289569279 Win=65535 Len=0
1,1.5421630000000732,62.210.85.178,10.0.2.15,TCP,60,9001  >  35978 [ACK] Seq=15728705 Ack=289570739 Win=65535 Len=0
1,1.5421930000002249,10.0.2.15,62.210.85.178,TLSv1.2,864,Application Data
1,1.5422939999998562,62.210.85.178,10.0.2.15,TCP,60,9001  >  35978 [ACK] Seq=15728705 Ack=289571549 Win=65535 Len=0
1,1.9040809999996782,54.93.77.70,10.0.2.15,TLSv1.2,590,Application Data
1,1.9072260000002643,54.93.77.70,10.0.2.15,TCP,2950,"9001  >  34692 [PSH, ACK] Seq=289157123 Ack=15772191 Win=65535 Len=2896 [TCP segment of a reassembled PDU]"
1,1.9073239999997895,10.0.2.15,54.93.77.70,TCP,54,34692  >  9001 [ACK] Seq=15772191 Ack=289160019 Win=65535 Len=0
1,1.9078520000002754,54.93.77.70,10.0.2.15,TLSv1.2,7294,"Application Data, Application Data"
1,1.9079160000001139,10.0.2.15,54.93.77.70,TCP,54,34692  >  9001 [ACK] Seq=15772191 Ack=289167259 Win=65535 Len=0
1,1.9249570000001768,54.93.77.70,10.0.2.15,TLSv1.2,1292,Application Data
1,1.9370120000003226,54.93.77.70,10.0.2.15,TCP,2950,"9001  >  34692 [PSH, ACK] Seq=289168497 Ack=15772191 Win=65535 Len=2896 [TCP segment of a reassembled PDU]"
1,1.9370550000003277,10.0.2.15,54.93.77.70,TCP,54,34692  >  9001 [ACK] Seq=15772191 Ack=289171393 Win=65535 Len=0
1,1.9545989999996891,54.93.77.70,10.0.2.15,TLSv1.2,778,Application Data
1,1.9599639999996725,54.93.77.70,10.0.2.15,TCP,2950,"9001  >  34692 [PSH, ACK] Seq=289172117 Ack=15772191 Win=65535 Len=2896 [TCP segment of a reassembled PDU]"
1,1.9600120000004608,10.0.2.15,54.93.77.70,TCP,54,34692  >  9001 [ACK] Seq=15772191 Ack=289175013 Win=65535 Len=0
1,1.9672049999999217,54.93.77.70,10.0.2.15,TLSv1.2,4398,"Application Data, Application Data"
1,1.9672499999996944,10.0.2.15,54.93.77.70,TCP,54,34692  >  9001 [ACK] Seq=15772191 Ack=289179357 Win=65535 Len=0
1,2.0098470000002635,54.93.77.70,10.0.2.15,TLSv1.2,5846,Application Data
1,2.0099069999996573,54.93.77.70,10.0.2.15,TLSv1.2,2402,Application Data
1,2.0100170000005164,10.0.2.15,54.93.77.70,TCP,54,34692  >  9001 [ACK] Seq=15772191 Ack=289187497 Win=65535 Len=0
1,2.010193000000072,10.0.2.15,54.93.77.70,TLSv1.2,590,Application Data
1,2.010266000000229,54.93.77.70,10.0.2.15,TCP,60,9001  >  34692 [ACK] Seq=289187497 Ack=15772727 Win=65535 Len=0
1,2.0262149999998655,54.93.77.70,10.0.2.15,TLSv1.2,204,Application Data
1,2.0591160000003583,54.93.77.70,10.0.2.15,TLSv1.2,7294,Application Data
1,2.0591670000003433,10.0.2.15,54.93.77.70,TCP,54,34692  >  9001 [ACK] Seq=15772727 Ack=289194887 Win=65535 Len=0
1,2.075246999999763,54.93.77.70,10.0.2.15,TLSv1.2,1104,"Application Data, Application Data"
1,2.075463000000127,10.0.2.15,54.93.77.70,TLSv1.2,590,Application Data
1,2.075550000000476,54.93.77.70,10.0.2.15,TCP,60,9001  >  34692 [ACK] Seq=289195937 Ack=15773263 Win=65535 Len=0
1,2.0796159999999873,54.93.77.70,10.0.2.15,TCP,2950,"9001  >  34692 [PSH, ACK] Seq=289195937 Ack=15773263 Win=65535 Len=2896 [TCP segment of a reassembled PDU]"
1,2.0796799999998257,10.0.2.15,54.93.77.70,TCP,54,34692  >  9001 [ACK] Seq=15773263 Ack=289198833 Win=65535 Len=0
1,2.092319999999745,54.93.77.70,10.0.2.15,TLSv1.2,1314,"Application Data, Application Data"
1,2.1220830000002024,54.93.77.70,10.0.2.15,TLSv1.2,7294,Application Data
1,2.122127000000546,54.93.77.70,10.0.2.15,TLSv1.2,2950,Application Data [TCP segment of a reassembled PDU]
1,2.1221850000001723,10.0.2.15,54.93.77.70,TCP,54,34692  >  9001 [ACK] Seq=15773263 Ack=289207333 Win=65535 Len=0
1,2.122287000000142,10.0.2.15,54.93.77.70,TCP,54,34692  >  9001 [ACK] Seq=15773263 Ack=289210229 Win=65535 Len=0
1,2.1382320000002437,54.93.77.70,10.0.2.15,TLSv1.2,264,Application Data
1,2.138383000000431,10.0.2.15,54.93.77.70,TLSv1.2,590,Application Data
1,2.1384619999998904,54.93.77.70,10.0.2.15,TCP,60,9001  >  34692 [ACK] Seq=289210439 Ack=15773799 Win=65535 Len=0
1,2.1550930000003063,54.93.77.70,10.0.2.15,TLSv1.2,590,Application Data
1,2.181647999999768,54.93.77.70,10.0.2.15,TLSv1.2,7294,Application Data
1,2.181743000000097,10.0.2.15,54.93.77.70,TCP,54,34692  >  9001 [ACK] Seq=15773799 Ack=289218215 Win=65535 Len=0
1,2.1832860000004075,54.93.77.70,10.0.2.15,TLSv1.2,4398,Application Data [TCP segment of a reassembled PDU]
1,2.183336000000054,10.0.2.15,54.93.77.70,TCP,54,34692  >  9001 [ACK] Seq=15773799 Ack=289222559 Win=65535 Len=0
1,2.1841340000000855,62.210.85.178,10.0.2.15,TLSv1.2,590,Application Data
1,2.1985709999999017,54.93.77.70,10.0.2.15,TLSv1.2,2950,"Application Data, Application Data"
1,2.1986219999998866,10.0.2.15,54.93.77.70,TCP,54,34692  >  9001 [ACK] Seq=15773799 Ack=289225455 Win=65535 Len=0
1,2.2031239999996615,54.93.77.70,10.0.2.15,TLSv1.2,1104,Application Data
1,2.205641000000469,10.0.2.15,54.93.77.70,TLSv1.2,590,Application Data
1,2.205815999999686,54.93.77.70,10.0.2.15,TCP,60,9001  >  34692 [ACK] Seq=289226505 Ack=15774335 Win=65535 Len=0
1,2.224873000000116,10.0.2.15,62.210.85.178,TCP,54,35978  >  9001 [ACK] Seq=289571549 Ack=15729241 Win=65535 Len=0
1,2.266171000000213,62.210.85.178,10.0.2.15,TLSv1.2,590,Application Data
1,2.2662490000002435,10.0.2.15,62.210.85.178,TCP,54,35978  >  9001 [ACK] Seq=289571549 Ack=15729777 Win=65535 Len=0
1,2.518587999999909,62.210.85.178,10.0.2.15,TLSv1.2,590,Application Data
1,2.518677000000025,10.0.2.15,62.210.85.178,TCP,54,35978  >  9001 [ACK] Seq=289571549 Ack=15730313 Win=65535 Len=0
1,2.537612000000081,62.210.85.178,10.0.2.15,TLSv1.2,590,Application Data
1,2.5376610000002984,10.0.2.15,62.210.85.178,TCP,54,35978  >  9001 [ACK] Seq=289571549 Ack=15730849 Win=65535 Len=0
1,2.538148999999976,10.0.2.15,62.210.85.178,TLSv1.2,590,Application Data
1,2.5382900000004156,62.210.85.178,10.0.2.15,TCP,60,9001  >  35978 [ACK] Seq=15730849 Ack=289572085 Win=65535 Len=0
1,3.1353250000001935,54.93.77.70,10.0.2.15,TLSv1.2,590,Application Data
1,3.135772999999972,10.0.2.15,54.93.77.70,TLSv1.2,590,Application Data
1,3.1359110000003056,54.93.77.70,10.0.2.15,TCP,60,9001  >  34692 [ACK] Seq=289227041 Ack=15774871 Win=65535 Len=0
1,3.148858000000473,10.0.2.15,193.246.105.82,TCP,54,[TCP Keep-Alive] 55396  >  443 [ACK] Seq=1953 Ack=802 Win=32160 Len=0
1,3.1489510000001246,193.246.105.82,10.0.2.15,TCP,60,[TCP Keep-Alive ACK] 443  >  55396 [ACK] Seq=802 Ack=1954 Win=65535 Len=0
1,3.3385589999998047,62.210.85.178,10.0.2.15,TLSv1.2,590,Application Data
1,3.3453520000002754,10.0.2.15,62.210.85.178,TLSv1.2,590,Application Data
1,3.345570000000407,62.210.85.178,10.0.2.15,TCP,60,9001  >  35978 [ACK] Seq=15731385 Ack=289572621 Win=65535 Len=0
1,3.3569330000000264,10.0.2.15,62.210.85.178,TLSv1.2,4124,Application Data
1,3.357042999999976,10.0.2.15,62.210.85.178,TCP,2974,35978  >  9001 [ACK] Seq=289576691 Ack=15731385 Win=65535 Len=2920 [TCP segment of a reassembled PDU]
1,3.3570879999997487,62.210.85.178,10.0.2.15,TCP,60,9001  >  35978 [ACK] Seq=15731385 Ack=289574081 Win=65535 Len=0
1,3.3570989999998346,62.210.85.178,10.0.2.15,TCP,60,9001  >  35978 [ACK] Seq=15731385 Ack=289575541 Win=65535 Len=0
1,3.3571039999997083,62.210.85.178,10.0.2.15,TCP,60,9001  >  35978 [ACK] Seq=15731385 Ack=289576691 Win=65535 Len=0
1,3.357108000000153,62.210.85.178,10.0.2.15,TCP,60,9001  >  35978 [ACK] Seq=15731385 Ack=289578151 Win=65535 Len=0
1,3.357111999999688,62.210.85.178,10.0.2.15,TCP,60,9001  >  35978 [ACK] Seq=15731385 Ack=289579611 Win=65535 Len=0
1,3.3571549999996932,10.0.2.15,62.210.85.178,TLSv1.2,1204,Application Data
1,3.357224000000315,10.0.2.15,62.210.85.178,TCP,2974,35978  >  9001 [ACK] Seq=289580761 Ack=15731385 Win=65535 Len=2920 [TCP segment of a reassembled PDU]
1,3.3572620000004463,62.210.85.178,10.0.2.15,TCP,60,9001  >  35978 [ACK] Seq=15731385 Ack=289580761 Win=65535 Len=0
1,3.3572690000000875,62.210.85.178,10.0.2.15,TCP,60,9001  >  35978 [ACK] Seq=15731385 Ack=289582221 Win=65535 Len=0
1,3.357273000000532,62.210.85.178,10.0.2.15,TCP,60,9001  >  35978 [ACK] Seq=15731385 Ack=289583681 Win=65535 Len=0
1,3.357310000000325,10.0.2.15,62.210.85.178,TLSv1.2,1204,Application Data
1,3.357375000000502,10.0.2.15,62.210.85.178,TCP,2974,35978  >  9001 [ACK] Seq=289584831 Ack=15731385 Win=65535 Len=2920 [TCP segment of a reassembled PDU]
1,3.3574109999999564,62.210.85.178,10.0.2.15,TCP,60,9001  >  35978 [ACK] Seq=15731385 Ack=289584831 Win=65535 Len=0
1,3.357418000000507,62.210.85.178,10.0.2.15,TCP,60,9001  >  35978 [ACK] Seq=15731385 Ack=289586291 Win=65535 Len=0
1,3.3574220000000423,62.210.85.178,10.0.2.15,TCP,60,9001  >  35978 [ACK] Seq=15731385 Ack=289587751 Win=65535 Len=0
1,3.3574530000005325,10.0.2.15,62.210.85.178,TLSv1.2,1204,Application Data
1,3.357531999999992,10.0.2.15,62.210.85.178,TLSv1.2,2974,Application Data
1,3.357568999999785,62.210.85.178,10.0.2.15,TCP,60,9001  >  35978 [ACK] Seq=15731385 Ack=289588901 Win=65535 Len=0
1,3.3575760000003356,62.210.85.178,10.0.2.15,TCP,60,9001  >  35978 [ACK] Seq=15731385 Ack=289590361 Win=65535 Len=0
1,3.357579999999871,62.210.85.178,10.0.2.15,TCP,60,9001  >  35978 [ACK] Seq=15731385 Ack=289591821 Win=65535 Len=0
1,3.35761199999979,10.0.2.15,62.210.85.178,TLSv1.2,1226,Application Data
1,3.3576810000004116,10.0.2.15,62.210.85.178,TCP,2974,35978  >  9001 [ACK] Seq=289592993 Ack=15731385 Win=65535 Len=2920 [TCP segment of a reassembled PDU]
1,3.3577219999997396,62.210.85.178,10.0.2.15,TCP,60,9001  >  35978 [ACK] Seq=15731385 Ack=289592993 Win=65535 Len=0
1,3.3577290000002904,62.210.85.178,10.0.2.15,TCP,60,9001  >  35978 [ACK] Seq=15731385 Ack=289594453 Win=65535 Len=0
1,3.3577329999998256,62.210.85.178,10.0.2.15,TCP,60,9001  >  35978 [ACK] Seq=15731385 Ack=289595913 Win=65535 Len=0
1,3.3578050000005533,10.0.2.15,62.210.85.178,TLSv1.2,1204,Application Data
1,3.3578520000000935,62.210.85.178,10.0.2.15,TCP,60,9001  >  35978 [ACK] Seq=15731385 Ack=289597063 Win=65535 Len=0
1,3.357907999999952,10.0.2.15,62.210.85.178,TLSv1.2,3030,Application Data
1,3.3579540000000634,62.210.85.178,10.0.2.15,TCP,60,9001  >  35978 [ACK] Seq=15731385 Ack=289598523 Win=65535 Len=0
1,3.357962000000043,62.210.85.178,10.0.2.15,TCP,60,9001  >  35978 [ACK] Seq=15731385 Ack=289599983 Win=65535 Len=0
1,3.357966999999917,62.210.85.178,10.0.2.15,TCP,60,9001  >  35978 [ACK] Seq=15731385 Ack=289600039 Win=65535 Len=0
1,3.3693050000001676,10.0.2.15,62.210.85.178,TLSv1.2,4124,Application Data
1,3.3693880000000718,10.0.2.15,62.210.85.178,TCP,2974,35978  >  9001 [ACK] Seq=289604109 Ack=15731385 Win=65535 Len=2920 [TCP segment of a reassembled PDU]
1,3.3694270000005417,62.210.85.178,10.0.2.15,TCP,60,9001  >  35978 [ACK] Seq=15731385 Ack=289601499 Win=65535 Len=0
1,3.3694350000005215,62.210.85.178,10.0.2.15,TCP,60,9001  >  35978 [ACK] Seq=15731385 Ack=289602959 Win=65535 Len=0
1,3.3694400000003952,62.210.85.178,10.0.2.15,TCP,60,9001  >  35978 [ACK] Seq=15731385 Ack=289604109 Win=65535 Len=0
1,3.3694439999999304,62.210.85.178,10.0.2.15,TCP,60,9001  >  35978 [ACK] Seq=15731385 Ack=289605569 Win=65535 Len=0
1,3.369448000000375,62.210.85.178,10.0.2.15,TCP,60,9001  >  35978 [ACK] Seq=15731385 Ack=289607029 Win=65535 Len=0
1,3.369488000000274,10.0.2.15,62.210.85.178,TLSv1.2,1204,Application Data
1,3.369556000000557,10.0.2.15,62.210.85.178,TCP,2974,35978  >  9001 [ACK] Seq=289608179 Ack=15731385 Win=65535 Len=2920 [TCP segment of a reassembled PDU]
1,3.3695920000000115,62.210.85.178,10.0.2.15,TCP,60,9001  >  35978 [ACK] Seq=15731385 Ack=289608179 Win=65535 Len=0
1,3.3695989999996527,62.210.85.178,10.0.2.15,TCP,60,9001  >  35978 [ACK] Seq=15731385 Ack=289609639 Win=65535 Len=0
1,3.3696030000000974,62.210.85.178,10.0.2.15,TCP,60,9001  >  35978 [ACK] Seq=15731385 Ack=289611099 Win=65535 Len=0
1,3.369636999999784,10.0.2.15,62.210.85.178,TLSv1.2,882,Application Data
1,3.3697290000000066,62.210.85.178,10.0.2.15,TCP,60,9001  >  35978 [ACK] Seq=15731385 Ack=289611927 Win=65535 Len=0
1,3.468474999999671,54.93.77.70,10.0.2.15,TLSv1.2,3674,Application Data
1,3.4686149999997724,10.0.2.15,54.93.77.70,TCP,54,34692  >  9001 [ACK] Seq=15774871 Ack=289230661 Win=65535 Len=0
1,3.4984030000005077,54.93.77.70,10.0.2.15,TLSv1.2,590,Application Data
1,3.5254640000002837,54.93.77.70,10.0.2.15,TLSv1.2,4210,"Application Data, Application Data"
1,3.5255699999997887,10.0.2.15,54.93.77.70,TCP,54,34692  >  9001 [ACK] Seq=15774871 Ack=289235353 Win=65535 Len=0
1,3.5732029999999213,54.93.77.70,10.0.2.15,TLSv1.2,7808,"Application Data, Application Data"
1,3.573312999999871,10.0.2.15,54.93.77.70,TCP,54,34692  >  9001 [ACK] Seq=15774871 Ack=289243107 Win=65535 Len=0
1,3.5802599999997256,54.93.77.70,10.0.2.15,TLSv1.2,5846,Application Data
1,3.5803130000003875,10.0.2.15,54.93.77.70,TCP,54,34692  >  9001 [ACK] Seq=15774871 Ack=289248899 Win=65535 Len=0
1,3.59063900000001,54.93.77.70,10.0.2.15,TLSv1.2,5846,Application Data [TCP segment of a reassembled PDU]
1,3.5906599999998434,54.93.77.70,10.0.2.15,TLSv1.2,5028,"Application Data, Application Data, Application Data"
1,3.5906999999997424,10.0.2.15,54.93.77.70,TCP,54,34692  >  9001 [ACK] Seq=15774871 Ack=289254691 Win=65535 Len=0
1,3.5907740000002377,10.0.2.15,54.93.77.70,TCP,54,34692  >  9001 [ACK] Seq=15774871 Ack=289259665 Win=65535 Len=0
1,3.5909959999999046,10.0.2.15,54.93.77.70,TLSv1.2,590,Application Data
1,3.591113999999834,54.93.77.70,10.0.2.15,TCP,60,9001  >  34692 [ACK] Seq=289259665 Ack=15775407 Win=65535 Len=0
1,3.60172700000021,10.0.2.15,54.93.77.70,TLSv1.2,590,Application Data
1,3.6018670000003112,54.93.77.70,10.0.2.15,TCP,60,9001  >  34692 [ACK] Seq=289259665 Ack=15775943 Win=65535 Len=0
1,3.6098860000001878,54.93.77.70,10.0.2.15,TCP,2950,"9001  >  34692 [PSH, ACK] Seq=289259665 Ack=15775943 Win=65535 Len=2896 [TCP segment of a reassembled PDU]"
1,3.6099620000004506,10.0.2.15,54.93.77.70,TCP,54,34692  >  9001 [ACK] Seq=15775943 Ack=289262561 Win=65535 Len=0
1,3.6103089999996882,54.93.77.70,10.0.2.15,TLSv1.2,2342,"Application Data, Application Data"
1,3.6103490000004967,10.0.2.15,54.93.77.70,TCP,54,34692  >  9001 [ACK] Seq=15775943 Ack=289264849 Win=65535 Len=0
1,3.6351839999997537,54.93.77.70,10.0.2.15,TLSv1.2,2132,Application Data
1,3.6352390000001833,10.0.2.15,54.93.77.70,TCP,54,34692  >  9001 [ACK] Seq=15775943 Ack=289266927 Win=65535 Len=0
1,3.637746000000334,10.0.2.15,54.93.77.70,TLSv1.2,590,Application Data
1,3.6379159999996773,54.93.77.70,10.0.2.15,TCP,60,9001  >  34692 [ACK] Seq=289266927 Ack=15776479 Win=65535 Len=0
1,3.7191290000000663,62.210.85.178,10.0.2.15,TLSv1.2,590,Application Data
1,3.760838000000149,10.0.2.15,62.210.85.178,TCP,54,35978  >  9001 [ACK] Seq=289611927 Ack=15731921 Win=65535 Len=0
1,3.851539999999659,62.210.85.178,10.0.2.15,TLSv1.2,1104,Application Data
1,3.8516340000005584,10.0.2.15,62.210.85.178,TCP,54,35978  >  9001 [ACK] Seq=289611927 Ack=15732971 Win=65535 Len=0
1,3.852202000000034,10.0.2.15,62.210.85.178,TLSv1.2,590,Application Data
1,3.852332000000388,62.210.85.178,10.0.2.15,TCP,60,9001  >  35978 [ACK] Seq=15732971 Ack=289612463 Win=65535 Len=0
1,4.05444499999976,54.93.77.70,10.0.2.15,TLSv1.2,590,Application Data
1,4.054896000000554,10.0.2.15,54.93.77.70,TLSv1.2,590,Application Data
1,4.055027000000337,54.93.77.70,10.0.2.15,TCP,60,9001  >  34692 [ACK] Seq=289267463 Ack=15777015 Win=65535 Len=0
1,4.259761000000253,62.210.85.178,10.0.2.15,TLSv1.2,590,Application Data
1,4.267219999999725,10.0.2.15,62.210.85.178,TLSv1.2,590,Application Data
1,4.2674010000000635,62.210.85.178,10.0.2.15,TCP,60,9001  >  35978 [ACK] Seq=15733507 Ack=289612999 Win=65535 Len=0
1,4.277664000000186,10.0.2.15,62.210.85.178,TLSv1.2,4124,Application Data
1,4.277766000000156,10.0.2.15,62.210.85.178,TCP,2974,35978  >  9001 [ACK] Seq=289617069 Ack=15733507 Win=65535 Len=2920 [TCP segment of a reassembled PDU]
1,4.277809000000161,62.210.85.178,10.0.2.15,TCP,60,9001  >  35978 [ACK] Seq=15733507 Ack=289614459 Win=65535 Len=0
1,4.2778180000004795,62.210.85.178,10.0.2.15,TCP,60,9001  >  35978 [ACK] Seq=15733507 Ack=289615919 Win=65535 Len=0
1,4.277823000000353,62.210.85.178,10.0.2.15,TCP,60,9001  >  35978 [ACK] Seq=15733507 Ack=289617069 Win=65535 Len=0
1,4.277826999999888,62.210.85.178,10.0.2.15,TCP,60,9001  >  35978 [ACK] Seq=15733507 Ack=289618529 Win=65535 Len=0
1,4.277831000000333,62.210.85.178,10.0.2.15,TCP,60,9001  >  35978 [ACK] Seq=15733507 Ack=289619989 Win=65535 Len=0
1,4.277873,10.0.2.15,62.210.85.178,TLSv1.2,1204,Application Data
1,4.27795900000001,62.210.85.178,10.0.2.15,TCP,60,9001  >  35978 [ACK] Seq=15733507 Ack=289621139 Win=65535 Len=0
1,4.2780290000000605,10.0.2.15,62.210.85.178,TLSv1.2,4124,Application Data
1,4.278127999999924,62.210.85.178,10.0.2.15,TCP,60,9001  >  35978 [ACK] Seq=15733507 Ack=289622599 Win=65535 Len=0
1,4.27813900000001,62.210.85.178,10.0.2.15,TCP,60,9001  >  35978 [ACK] Seq=15733507 Ack=289624059 Win=65535 Len=0
1,4.278143999999884,62.210.85.178,10.0.2.15,TCP,60,9001  >  35978 [ACK] Seq=15733507 Ack=289625209 Win=65535 Len=0
1,4.278189999999995,10.0.2.15,62.210.85.178,TLSv1.2,4124,Application Data
1,4.27828000000045,62.210.85.178,10.0.2.15,TCP,60,9001  >  35978 [ACK] Seq=15733507 Ack=289626669 Win=65535 Len=0
1,4.27828800000043,62.210.85.178,10.0.2.15,TCP,60,9001  >  35978 [ACK] Seq=15733507 Ack=289628129 Win=65535 Len=0
1,4.278291999999965,62.210.85.178,10.0.2.15,TCP,60,9001  >  35978 [ACK] Seq=15733507 Ack=289629279 Win=65535 Len=0
1,4.27832699999999,10.0.2.15,62.210.85.178,TLSv1.2,332,Application Data
1,4.278384000000187,10.0.2.15,62.210.85.178,TCP,2974,35978  >  9001 [ACK] Seq=289629557 Ack=15733507 Win=65535 Len=2920 [TCP segment of a reassembled PDU]
1,4.278420000000551,62.210.85.178,10.0.2.15,TCP,60,9001  >  35978 [ACK] Seq=15733507 Ack=289629557 Win=65535 Len=0
1,4.278425999999854,62.210.85.178,10.0.2.15,TCP,60,9001  >  35978 [ACK] Seq=15733507 Ack=289631017 Win=65535 Len=0
1,4.278430999999728,62.210.85.178,10.0.2.15,TCP,60,9001  >  35978 [ACK] Seq=15733507 Ack=289632477 Win=65535 Len=0
1,4.278465000000324,10.0.2.15,62.210.85.178,TLSv1.2,948,Application Data
1,4.278527999999824,10.0.2.15,62.210.85.178,TCP,2974,35978  >  9001 [ACK] Seq=289633371 Ack=15733507 Win=65535 Len=2920 [TCP segment of a reassembled PDU]
1,4.278564000000188,62.210.85.178,10.0.2.15,TCP,60,9001  >  35978 [ACK] Seq=15733507 Ack=289633371 Win=65535 Len=0
1,4.278570999999829,62.210.85.178,10.0.2.15,TCP,60,9001  >  35978 [ACK] Seq=15733507 Ack=289634831 Win=65535 Len=0
1,4.278575000000274,62.210.85.178,10.0.2.15,TCP,60,9001  >  35978 [ACK] Seq=15733507 Ack=289636291 Win=65535 Len=0
1,4.27860899999996,10.0.2.15,62.210.85.178,TLSv1.2,1204,Application Data
1,4.278645000000324,62.210.85.178,10.0.2.15,TCP,60,9001  >  35978 [ACK] Seq=15733507 Ack=289637441 Win=65535 Len=0
1,4.278688000000329,10.0.2.15,62.210.85.178,TLSv1.2,3030,Application Data
1,4.278728000000228,62.210.85.178,10.0.2.15,TCP,60,9001  >  35978 [ACK] Seq=15733507 Ack=289638901 Win=65535 Len=0
1,4.27873499999987,62.210.85.178,10.0.2.15,TCP,60,9001  >  35978 [ACK] Seq=15733507 Ack=289640361 Win=65535 Len=0
1,4.278739000000314,62.210.85.178,10.0.2.15,TCP,60,9001  >  35978 [ACK] Seq=15733507 Ack=289640417 Win=65535 Len=0
1,4.287946999999804,10.0.2.15,62.210.85.178,TLSv1.2,4124,Application Data
1,4.2880230000000665,10.0.2.15,62.210.85.178,TCP,2974,35978  >  9001 [ACK] Seq=289644487 Ack=15733507 Win=65535 Len=2920 [TCP segment of a reassembled PDU]
1,4.28805900000043,62.210.85.178,10.0.2.15,TCP,60,9001  >  35978 [ACK] Seq=15733507 Ack=289641877 Win=65535 Len=0
1,4.28806700000041,62.210.85.178,10.0.2.15,TCP,60,9001  >  35978 [ACK] Seq=15733507 Ack=289643337 Win=65535 Len=0
1,4.288070999999945,62.210.85.178,10.0.2.15,TCP,60,9001  >  35978 [ACK] Seq=15733507 Ack=289644487 Win=65535 Len=0
1,4.28807500000039,62.210.85.178,10.0.2.15,TCP,60,9001  >  35978 [ACK] Seq=15733507 Ack=289645947 Win=65535 Len=0
1,4.288078999999925,62.210.85.178,10.0.2.15,TCP,60,9001  >  35978 [ACK] Seq=15733507 Ack=289647407 Win=65535 Len=0
1,4.288118000000395,10.0.2.15,62.210.85.178,TLSv1.2,1204,Application Data
1,4.288185999999769,10.0.2.15,62.210.85.178,TCP,2974,35978  >  9001 [ACK] Seq=289648557 Ack=15733507 Win=65535 Len=2920 [TCP segment of a reassembled PDU]
1,4.288220999999794,62.210.85.178,10.0.2.15,TCP,60,9001  >  35978 [ACK] Seq=15733507 Ack=289648557 Win=65535 Len=0
1,4.288228000000345,62.210.85.178,10.0.2.15,TCP,60,9001  >  35978 [ACK] Seq=15733507 Ack=289650017 Win=65535 Len=0
1,4.28823199999988,62.210.85.178,10.0.2.15,TCP,60,9001  >  35978 [ACK] Seq=15733507 Ack=289651477 Win=65535 Len=0
1,4.288266000000476,10.0.2.15,62.210.85.178,TLSv1.2,1204,Application Data
1,4.288328999999976,10.0.2.15,62.210.85.178,TCP,2974,35978  >  9001 [ACK] Seq=289652627 Ack=15733507 Win=65535 Len=2920 [TCP segment of a reassembled PDU]
1,4.28836500000034,62.210.85.178,10.0.2.15,TCP,60,9001  >  35978 [ACK] Seq=15733507 Ack=289652627 Win=65535 Len=0
1,4.288371000000552,62.210.85.178,10.0.2.15,TCP,60,9001  >  35978 [ACK] Seq=15733507 Ack=289654087 Win=65535 Len=0
1,4.288376000000426,62.210.85.178,10.0.2.15,TCP,60,9001  >  35978 [ACK] Seq=15733507 Ack=289655547 Win=65535 Len=0
1,4.2884070000000065,10.0.2.15,62.210.85.178,TLSv1.2,1204,Application Data
1,4.288497000000461,10.0.2.15,62.210.85.178,TLSv1.2,1514,Application Data
1,4.288518999999724,62.210.85.178,10.0.2.15,TCP,60,9001  >  35978 [ACK] Seq=15733507 Ack=289656697 Win=65535 Len=0
1,4.2885510000005524,10.0.2.15,62.210.85.178,TLSv1.2,950,Application Data
1,4.288585000000239,62.210.85.178,10.0.2.15,TCP,60,9001  >  35978 [ACK] Seq=15733507 Ack=289658157 Win=65535 Len=0
1,4.2885910000004515,62.210.85.178,10.0.2.15,TCP,60,9001  >  35978 [ACK] Seq=15733507 Ack=289659053 Win=65535 Len=0
1,4.466793000000507,54.93.77.70,10.0.2.15,TCP,2950,"9001  >  34692 [PSH, ACK] Seq=289267463 Ack=15777015 Win=65535 Len=2896 [TCP segment of a reassembled PDU]"
1,4.466913000000204,10.0.2.15,54.93.77.70,TCP,54,34692  >  9001 [ACK] Seq=15777015 Ack=289270359 Win=65535 Len=0
1,4.471738000000187,54.93.77.70,10.0.2.15,TLSv1.2,2950,Application Data [TCP segment of a reassembled PDU]
1,4.47177499999998,10.0.2.15,54.93.77.70,TCP,54,34692  >  9001 [ACK] Seq=15777015 Ack=289273255 Win=65535 Len=0
1,4.473077999999987,54.93.77.70,10.0.2.15,TLSv1.2,2016,Application Data
1,4.473095999999714,54.93.77.70,10.0.2.15,TCP,2950,"9001  >  34692 [PSH, ACK] Seq=289275217 Ack=15777015 Win=65535 Len=2896 [TCP segment of a reassembled PDU]"
1,4.473144000000502,10.0.2.15,54.93.77.70,TCP,54,34692  >  9001 [ACK] Seq=15777015 Ack=289275217 Win=65535 Len=0
1,4.473218000000088,10.0.2.15,54.93.77.70,TCP,54,34692  >  9001 [ACK] Seq=15777015 Ack=289278113 Win=65535 Len=0
1,4.494155999999748,54.93.77.70,10.0.2.15,TLSv1.2,778,Application Data
1,4.497698000000128,54.93.77.70,10.0.2.15,TCP,2950,"9001  >  34692 [PSH, ACK] Seq=289278837 Ack=15777015 Win=65535 Len=2896 [TCP segment of a reassembled PDU]"
1,4.4977209999997285,54.93.77.70,10.0.2.15,TLSv1.2,5846,"Application Data, Application Data"
1,4.497763000000305,10.0.2.15,54.93.77.70,TCP,54,34692  >  9001 [ACK] Seq=15777015 Ack=289281733 Win=65535 Len=0
1,4.497847000000547,10.0.2.15,54.93.77.70,TCP,54,34692  >  9001 [ACK] Seq=15777015 Ack=289287525 Win=65535 Len=0
1,4.515059999999721,54.93.77.70,10.0.2.15,TLSv1.2,2950,Application Data [TCP segment of a reassembled PDU]
1,4.515102999999726,54.93.77.70,10.0.2.15,TLSv1.2,4398,Application Data [TCP segment of a reassembled PDU]
1,4.515156000000388,10.0.2.15,54.93.77.70,TCP,54,34692  >  9001 [ACK] Seq=15777015 Ack=289290421 Win=65535 Len=0
1,4.515298000000257,10.0.2.15,54.93.77.70,TCP,54,34692  >  9001 [ACK] Seq=15777015 Ack=289294765 Win=65535 Len=0
1,4.516147999999703,54.93.77.70,10.0.2.15,TLSv1.2,1198,Application Data
1,4.516303999999764,10.0.2.15,54.93.77.70,TLSv1.2,590,Application Data
1,4.51639299999988,54.93.77.70,10.0.2.15,TCP,60,9001  >  34692 [ACK] Seq=289295909 Ack=15777551 Win=65535 Len=0
1,4.5356110000002445,54.93.77.70,10.0.2.15,TCP,2950,"9001  >  34692 [PSH, ACK] Seq=289295909 Ack=15777551 Win=65535 Len=2896 [TCP segment of a reassembled PDU]"
1,4.535740999999689,10.0.2.15,54.93.77.70,TCP,54,34692  >  9001 [ACK] Seq=15777551 Ack=289298805 Win=65535 Len=0
1,4.536137000000053,54.93.77.70,10.0.2.15,TLSv1.2,2950,Application Data [TCP segment of a reassembled PDU]
1,4.536184999999932,10.0.2.15,54.93.77.70,TCP,54,34692  >  9001 [ACK] Seq=15777551 Ack=289301701 Win=65535 Len=0
1,4.536779000000024,54.93.77.70,10.0.2.15,TLSv1.2,2402,Application Data
1,4.536796000000322,54.93.77.70,10.0.2.15,TLSv1.2,4398,Application Data
1,4.536839000000327,10.0.2.15,54.93.77.70,TCP,54,34692  >  9001 [ACK] Seq=15777551 Ack=289304049 Win=65535 Len=0
1,4.536917000000358,10.0.2.15,54.93.77.70,TCP,54,34692  >  9001 [ACK] Seq=15777551 Ack=289308393 Win=65535 Len=0
1,4.537103999999999,10.0.2.15,54.93.77.70,TLSv1.2,590,Application Data
1,4.5371729999997115,54.93.77.70,10.0.2.15,TCP,60,9001  >  34692 [ACK] Seq=289308393 Ack=15778087 Win=65535 Len=0
1,4.556376999999884,54.93.77.70,10.0.2.15,TLSv1.2,2564,Application Data
1,4.556432000000314,10.0.2.15,54.93.77.70,TCP,54,34692  >  9001 [ACK] Seq=15778087 Ack=289310903 Win=65535 Len=0
1,4.586398999999801,54.93.77.70,10.0.2.15,TLSv1.2,3160,Application Data
1,4.586479000000509,10.0.2.15,54.93.77.70,TCP,54,34692  >  9001 [ACK] Seq=15778087 Ack=289314009 Win=65535 Len=0
1,4.590194000000338,10.0.2.15,54.93.77.70,TLSv1.2,590,Application Data
1,4.590377000000444,54.93.77.70,10.0.2.15,TCP,60,9001  >  34692 [ACK] Seq=289314009 Ack=15778623 Win=65535 Len=0
1,4.682998000000225,62.210.85.178,10.0.2.15,TLSv1.2,1104,Application Data
1,4.724887000000308,10.0.2.15,62.210.85.178,TCP,54,35978  >  9001 [ACK] Seq=289659053 Ack=15734557 Win=65535 Len=0
1,4.782554999999775,62.210.85.178,10.0.2.15,TLSv1.2,590,Application Data
1,4.782621999999719,10.0.2.15,62.210.85.178,TCP,54,35978  >  9001 [ACK] Seq=289659053 Ack=15735093 Win=65535 Len=0
1,4.783113000000412,10.0.2.15,62.210.85.178,TLSv1.2,590,Application Data
1,4.783222000000023,62.210.85.178,10.0.2.15,TCP,60,9001  >  35978 [ACK] Seq=15735093 Ack=289659589 Win=65535 Len=0
1,5.283774000000449,54.93.77.70,10.0.2.15,TLSv1.2,590,Application Data
1,5.284128999999666,10.0.2.15,54.93.77.70,TLSv1.2,590,Application Data
1,5.284244999999828,54.93.77.70,10.0.2.15,TCP,60,9001  >  34692 [ACK] Seq=289314545 Ack=15779159 Win=65535 Len=0
1,5.492103999999927,62.210.85.178,10.0.2.15,TLSv1.2,590,Application Data
1,5.501663000000008,10.0.2.15,62.210.85.178,TLSv1.2,590,Application Data
1,5.501819000000069,62.210.85.178,10.0.2.15,TCP,60,9001  >  35978 [ACK] Seq=15735629 Ack=289660125 Win=65535 Len=0
1,5.5135440000003655,10.0.2.15,62.210.85.178,TLSv1.2,4124,Application Data
1,5.513651000000209,10.0.2.15,62.210.85.178,TCP,2974,35978  >  9001 [ACK] Seq=289664195 Ack=15735629 Win=65535 Len=2920 [TCP segment of a reassembled PDU]
1,5.513692000000447,62.210.85.178,10.0.2.15,TCP,60,9001  >  35978 [ACK] Seq=15735629 Ack=289661585 Win=65535 Len=0
1,5.5137050000003,62.210.85.178,10.0.2.15,TCP,60,9001  >  35978 [ACK] Seq=15735629 Ack=289663045 Win=65535 Len=0
1,5.513708999999835,62.210.85.178,10.0.2.15,TCP,60,9001  >  35978 [ACK] Seq=15735629 Ack=289664195 Win=65535 Len=0
1,5.513711999999941,62.210.85.178,10.0.2.15,TCP,60,9001  >  35978 [ACK] Seq=15735629 Ack=289665655 Win=65535 Len=0
1,5.513713999999709,62.210.85.178,10.0.2.15,TCP,60,9001  >  35978 [ACK] Seq=15735629 Ack=289667115 Win=65535 Len=0
1,5.513750000000073,10.0.2.15,62.210.85.178,TLSv1.2,1204,Application Data
