No.,Time,Source,Destination,Protocol,Length,Info
1,0.0027019999997719424,62.210.85.178,10.0.2.15,TLSv1.2,590,Application Data
1,0.05213699999967503,10.0.2.15,62.210.85.178,TCP,54,35978  >  9001 [ACK] Seq=306859495 Ack=16597531 Win=65535 Len=0
1,0.11340500000005704,62.210.85.178,10.0.2.15,TLSv1.2,590,Application Data
1,0.1134939999992639,10.0.2.15,62.210.85.178,TCP,54,35978  >  9001 [ACK] Seq=306859495 Ack=16598067 Win=65535 Len=0
1,0.14011799999934738,10.0.2.15,54.93.77.70,TLSv1.2,590,Application Data
1,0.14030299999922136,54.93.77.70,10.0.2.15,TCP,60,9001  >  34692 [ACK] Seq=306512739 Ack=16645103 Win=65535 Len=0
1,0.2583099999992555,62.210.85.178,10.0.2.15,TLSv1.2,590,Application Data
1,0.2584870000000592,10.0.2.15,62.210.85.178,TCP,54,35978  >  9001 [ACK] Seq=306859495 Ack=16598603 Win=65535 Len=0
1,0.2590919999993275,10.0.2.15,62.210.85.178,TLSv1.2,590,Application Data
1,0.25922999999966123,62.210.85.178,10.0.2.15,TCP,60,9001  >  35978 [ACK] Seq=16598603 Ack=306860031 Win=65535 Len=0
1,0.7198739999994359,54.93.77.70,10.0.2.15,TLSv1.2,590,Application Data
1,0.7202760000000126,10.0.2.15,54.93.77.70,TLSv1.2,1618,Application Data
1,0.7203970000000481,54.93.77.70,10.0.2.15,TCP,60,9001  >  34692 [ACK] Seq=306513275 Ack=16646667 Win=65535 Len=0
1,0.925905000000057,62.210.85.178,10.0.2.15,TLSv1.2,1618,Application Data
1,0.9260279999998602,10.0.2.15,62.210.85.178,TCP,54,35978  >  9001 [ACK] Seq=306860031 Ack=16600167 Win=65535 Len=0
1,0.9393209999998362,10.0.2.15,62.210.85.178,TLSv1.2,590,Application Data
1,0.9395029999996041,62.210.85.178,10.0.2.15,TCP,60,9001  >  35978 [ACK] Seq=16600167 Ack=306860567 Win=65535 Len=0
1,0.9501299999992625,10.0.2.15,62.210.85.178,TLSv1.2,1618,Application Data
1,0.9502539999994042,62.210.85.178,10.0.2.15,TCP,60,9001  >  35978 [ACK] Seq=16600167 Ack=306862027 Win=65535 Len=0
1,0.9502689999999347,62.210.85.178,10.0.2.15,TCP,60,9001  >  35978 [ACK] Seq=16600167 Ack=306862131 Win=65535 Len=0
1,1.0520109999997658,54.93.77.70,10.0.2.15,TLSv1.2,590,Application Data
1,1.0806480000001102,54.93.77.70,10.0.2.15,TLSv1.2,1618,Application Data
1,1.080775999999787,10.0.2.15,54.93.77.70,TCP,54,34692  >  9001 [ACK] Seq=16646667 Ack=306515375 Win=65535 Len=0
1,1.0828919999994469,10.0.2.15,54.93.77.70,TLSv1.2,590,Application Data
1,1.0830419999992955,54.93.77.70,10.0.2.15,TCP,60,9001  >  34692 [ACK] Seq=306515375 Ack=16647203 Win=65535 Len=0
1,1.3388799999993353,62.210.85.178,10.0.2.15,TLSv1.2,590,Application Data
1,1.3392340000000331,10.0.2.15,62.210.85.178,TLSv1.2,590,Application Data
1,1.3393289999994522,62.210.85.178,10.0.2.15,TCP,60,9001  >  35978 [ACK] Seq=16600703 Ack=306862667 Win=65535 Len=0
1,1.4491739999994024,54.93.77.70,10.0.2.15,TLSv1.2,590,Application Data
1,1.4495259999994232,10.0.2.15,54.93.77.70,TLSv1.2,590,Application Data
1,1.4496199999994133,54.93.77.70,10.0.2.15,TCP,60,9001  >  34692 [ACK] Seq=306515911 Ack=16647739 Win=65535 Len=0
1,1.5617239999992307,62.210.85.178,10.0.2.15,TLSv1.2,590,Application Data
1,1.5728489999992235,10.0.2.15,62.210.85.178,TLSv1.2,590,Application Data
1,1.5742079999999987,62.210.85.178,10.0.2.15,TCP,60,9001  >  35978 [ACK] Seq=16601239 Ack=306863203 Win=65535 Len=0
1,1.581554999999753,10.0.2.15,62.210.85.178,TLSv1.2,4124,Application Data
1,1.581666000000041,10.0.2.15,62.210.85.178,TCP,2974,35978  >  9001 [ACK] Seq=306867273 Ack=16601239 Win=65535 Len=2920 [TCP segment of a reassembled PDU]
1,1.58170599999994,62.210.85.178,10.0.2.15,TCP,60,9001  >  35978 [ACK] Seq=16601239 Ack=306864663 Win=65535 Len=0
1,1.581714999999349,62.210.85.178,10.0.2.15,TCP,60,9001  >  35978 [ACK] Seq=16601239 Ack=306866123 Win=65535 Len=0
1,1.5817199999992226,62.210.85.178,10.0.2.15,TCP,60,9001  >  35978 [ACK] Seq=16601239 Ack=306867273 Win=65535 Len=0
1,1.5817609999994602,10.0.2.15,62.210.85.178,TLSv1.2,1204,Application Data
1,1.5818019999996977,62.210.85.178,10.0.2.15,TCP,60,9001  >  35978 [ACK] Seq=16601239 Ack=306868733 Win=65535 Len=0
1,1.581808999999339,62.210.85.178,10.0.2.15,TCP,60,9001  >  35978 [ACK] Seq=16601239 Ack=306870193 Win=65535 Len=0
1,1.5818140000001222,62.210.85.178,10.0.2.15,TCP,60,9001  >  35978 [ACK] Seq=16601239 Ack=306871343 Win=65535 Len=0
1,1.5818989999997939,10.0.2.15,62.210.85.178,TLSv1.2,4124,Application Data
1,1.5819449999999051,62.210.85.178,10.0.2.15,TCP,60,9001  >  35978 [ACK] Seq=16601239 Ack=306872803 Win=65535 Len=0
1,1.5819519999995464,62.210.85.178,10.0.2.15,TCP,60,9001  >  35978 [ACK] Seq=16601239 Ack=306874263 Win=65535 Len=0
1,1.5819579999997586,62.210.85.178,10.0.2.15,TCP,60,9001  >  35978 [ACK] Seq=16601239 Ack=306875413 Win=65535 Len=0
1,1.582006999999976,10.0.2.15,62.210.85.178,TLSv1.2,4124,Application Data
1,1.5820999999996275,62.210.85.178,10.0.2.15,TCP,60,9001  >  35978 [ACK] Seq=16601239 Ack=306876873 Win=65535 Len=0
1,1.5821069999992687,62.210.85.178,10.0.2.15,TCP,60,9001  >  35978 [ACK] Seq=16601239 Ack=306878333 Win=65535 Len=0
1,1.582112000000052,62.210.85.178,10.0.2.15,TCP,60,9001  >  35978 [ACK] Seq=16601239 Ack=306879483 Win=65535 Len=0
1,1.582141999999294,10.0.2.15,62.210.85.178,TLSv1.2,2974,Application Data
1,1.5821980000000622,10.0.2.15,62.210.85.178,TLSv1.2,1226,Application Data
1,1.5822309999994104,62.210.85.178,10.0.2.15,TCP,60,9001  >  35978 [ACK] Seq=16601239 Ack=306880943 Win=65535 Len=0
1,1.5822379999999612,62.210.85.178,10.0.2.15,TCP,60,9001  >  35978 [ACK] Seq=16601239 Ack=306882403 Win=65535 Len=0
1,1.5822419999994963,62.210.85.178,10.0.2.15,TCP,60,9001  >  35978 [ACK] Seq=16601239 Ack=306883575 Win=65535 Len=0
1,1.5822920000000522,10.0.2.15,62.210.85.178,TLSv1.2,4124,Application Data
1,1.582354000000123,10.0.2.15,62.210.85.178,TCP,2974,35978  >  9001 [ACK] Seq=306887645 Ack=16601239 Win=65535 Len=2920 [TCP segment of a reassembled PDU]
1,1.582391999999345,62.210.85.178,10.0.2.15,TCP,60,9001  >  35978 [ACK] Seq=16601239 Ack=306885035 Win=65535 Len=0
1,1.5823979999995572,62.210.85.178,10.0.2.15,TCP,60,9001  >  35978 [ACK] Seq=16601239 Ack=306886495 Win=65535 Len=0
1,1.582402999999431,62.210.85.178,10.0.2.15,TCP,60,9001  >  35978 [ACK] Seq=16601239 Ack=306887645 Win=65535 Len=0
1,1.5824069999998756,62.210.85.178,10.0.2.15,TCP,60,9001  >  35978 [ACK] Seq=16601239 Ack=306889105 Win=65535 Len=0
1,1.5824109999994107,62.210.85.178,10.0.2.15,TCP,60,9001  >  35978 [ACK] Seq=16601239 Ack=306890565 Win=65535 Len=0
1,1.582448000000113,10.0.2.15,62.210.85.178,TLSv1.2,110,Application Data
1,1.582538999999997,62.210.85.178,10.0.2.15,TCP,60,9001  >  35978 [ACK] Seq=16601239 Ack=306890621 Win=65535 Len=0
1,1.5938619999997172,10.0.2.15,62.210.85.178,TLSv1.2,4124,Application Data
1,1.5939579999994749,10.0.2.15,62.210.85.178,TCP,2974,35978  >  9001 [ACK] Seq=306894691 Ack=16601239 Win=65535 Len=2920 [TCP segment of a reassembled PDU]
1,1.5940019999998185,62.210.85.178,10.0.2.15,TCP,60,9001  >  35978 [ACK] Seq=16601239 Ack=306892081 Win=65535 Len=0
1,1.5940119999995659,62.210.85.178,10.0.2.15,TCP,60,9001  >  35978 [ACK] Seq=16601239 Ack=306893541 Win=65535 Len=0
1,1.5940160000000105,62.210.85.178,10.0.2.15,TCP,60,9001  >  35978 [ACK] Seq=16601239 Ack=306894691 Win=65535 Len=0
1,1.5940590000000157,10.0.2.15,62.210.85.178,TLSv1.2,1204,Application Data
1,1.5940959999998086,62.210.85.178,10.0.2.15,TCP,60,9001  >  35978 [ACK] Seq=16601239 Ack=306896151 Win=65535 Len=0
1,1.5941029999994498,62.210.85.178,10.0.2.15,TCP,60,9001  >  35978 [ACK] Seq=16601239 Ack=306897611 Win=65535 Len=0
1,1.5941069999998945,62.210.85.178,10.0.2.15,TCP,60,9001  >  35978 [ACK] Seq=16601239 Ack=306898761 Win=65535 Len=0
1,1.5941549999997733,10.0.2.15,62.210.85.178,TLSv1.2,4124,Application Data
1,1.5941949999996723,62.210.85.178,10.0.2.15,TCP,60,9001  >  35978 [ACK] Seq=16601239 Ack=306900221 Win=65535 Len=0
1,1.5942019999993136,62.210.85.178,10.0.2.15,TCP,60,9001  >  35978 [ACK] Seq=16601239 Ack=306901681 Win=65535 Len=0
1,1.5942079999995258,62.210.85.178,10.0.2.15,TCP,60,9001  >  35978 [ACK] Seq=16601239 Ack=306902831 Win=65535 Len=0
1,1.594253999999637,10.0.2.15,62.210.85.178,TLSv1.2,4124,Application Data
1,1.5943499999993946,10.0.2.15,62.210.85.178,TLSv1.2,2974,Application Data
1,1.594373999999334,62.210.85.178,10.0.2.15,TCP,60,9001  >  35978 [ACK] Seq=16601239 Ack=306904291 Win=65535 Len=0
1,1.5943799999995463,62.210.85.178,10.0.2.15,TCP,60,9001  >  35978 [ACK] Seq=16601239 Ack=306905751 Win=65535 Len=0
1,1.59438499999942,62.210.85.178,10.0.2.15,TCP,60,9001  >  35978 [ACK] Seq=16601239 Ack=306906901 Win=65535 Len=0
1,1.5943889999998646,62.210.85.178,10.0.2.15,TCP,60,9001  >  35978 [ACK] Seq=16601239 Ack=306908361 Win=65535 Len=0
1,1.5943929999993998,62.210.85.178,10.0.2.15,TCP,60,9001  >  35978 [ACK] Seq=16601239 Ack=306909821 Win=65535 Len=0
1,1.5944309999995312,10.0.2.15,62.210.85.178,TLSv1.2,1226,Application Data
1,1.5944689999996626,62.210.85.178,10.0.2.15,TCP,60,9001  >  35978 [ACK] Seq=16601239 Ack=306910993 Win=65535 Len=0
1,1.5945160000001124,10.0.2.15,62.210.85.178,TLSv1.2,4124,Application Data
1,1.5945560000000114,62.210.85.178,10.0.2.15,TCP,60,9001  >  35978 [ACK] Seq=16601239 Ack=306912453 Win=65535 Len=0
1,1.5945619999993141,62.210.85.178,10.0.2.15,TCP,60,9001  >  35978 [ACK] Seq=16601239 Ack=306913913 Win=65535 Len=0
1,1.5945670000000973,62.210.85.178,10.0.2.15,TCP,60,9001  >  35978 [ACK] Seq=16601239 Ack=306915063 Win=65535 Len=0
1,1.5946159999994052,10.0.2.15,62.210.85.178,TLSv1.2,3030,Application Data
1,1.5946559999993042,62.210.85.178,10.0.2.15,TCP,60,9001  >  35978 [ACK] Seq=16601239 Ack=306916523 Win=65535 Len=0
1,1.594662999999855,62.210.85.178,10.0.2.15,TCP,60,9001  >  35978 [ACK] Seq=16601239 Ack=306917983 Win=65535 Len=0
1,1.59466699999939,62.210.85.178,10.0.2.15,TCP,60,9001  >  35978 [ACK] Seq=16601239 Ack=306918039 Win=65535 Len=0
1,1.606047999999646,10.0.2.15,62.210.85.178,TLSv1.2,4124,Application Data
1,1.6061509999999544,10.0.2.15,62.210.85.178,TCP,2974,35978  >  9001 [ACK] Seq=306922109 Ack=16601239 Win=65535 Len=2920 [TCP segment of a reassembled PDU]
1,1.6061949999993885,62.210.85.178,10.0.2.15,TCP,60,9001  >  35978 [ACK] Seq=16601239 Ack=306919499 Win=65535 Len=0
1,1.6062029999993683,62.210.85.178,10.0.2.15,TCP,60,9001  >  35978 [ACK] Seq=16601239 Ack=306920959 Win=65535 Len=0
1,1.606207999999242,62.210.85.178,10.0.2.15,TCP,60,9001  >  35978 [ACK] Seq=16601239 Ack=306922109 Win=65535 Len=0
1,1.6062119999996867,62.210.85.178,10.0.2.15,TCP,60,9001  >  35978 [ACK] Seq=16601239 Ack=306923569 Win=65535 Len=0
1,1.6062159999992218,62.210.85.178,10.0.2.15,TCP,60,9001  >  35978 [ACK] Seq=16601239 Ack=306925029 Win=65535 Len=0
1,1.6062569999994594,10.0.2.15,62.210.85.178,TLSv1.2,1204,Application Data
1,1.6063299999996161,10.0.2.15,62.210.85.178,TCP,2974,35978  >  9001 [ACK] Seq=306926179 Ack=16601239 Win=65535 Len=2920 [TCP segment of a reassembled PDU]
1,1.606366999999409,62.210.85.178,10.0.2.15,TCP,60,9001  >  35978 [ACK] Seq=16601239 Ack=306926179 Win=65535 Len=0
1,1.6063739999999598,62.210.85.178,10.0.2.15,TCP,60,9001  >  35978 [ACK] Seq=16601239 Ack=306927639 Win=65535 Len=0
1,1.606377999999495,62.210.85.178,10.0.2.15,TCP,60,9001  >  35978 [ACK] Seq=16601239 Ack=306929099 Win=65535 Len=0
1,1.6064120000000912,10.0.2.15,62.210.85.178,TLSv1.2,1204,Application Data
1,1.606500999999298,10.0.2.15,62.210.85.178,TCP,2974,35978  >  9001 [ACK] Seq=306930249 Ack=16601239 Win=65535 Len=2920 [TCP segment of a reassembled PDU]
1,1.60652299999947,62.210.85.178,10.0.2.15,TCP,60,9001  >  35978 [ACK] Seq=16601239 Ack=306930249 Win=65535 Len=0
1,1.606554999999389,10.0.2.15,62.210.85.178,TLSv1.2,1204,Application Data
1,1.6065920000000915,62.210.85.178,10.0.2.15,TCP,60,9001  >  35978 [ACK] Seq=16601239 Ack=306931709 Win=65535 Len=0
1,1.6065979999993942,62.210.85.178,10.0.2.15,TCP,60,9001  >  35978 [ACK] Seq=16601239 Ack=306933169 Win=65535 Len=0
1,1.606602999999268,62.210.85.178,10.0.2.15,TCP,60,9001  >  35978 [ACK] Seq=16601239 Ack=306934319 Win=65535 Len=0
1,1.6066430000000764,10.0.2.15,62.210.85.178,TLSv1.2,332,Application Data
1,1.606713999999556,10.0.2.15,62.210.85.178,TCP,2974,35978  >  9001 [ACK] Seq=306934597 Ack=16601239 Win=65535 Len=2920 [TCP segment of a reassembled PDU]
1,1.6067559999992227,62.210.85.178,10.0.2.15,TCP,60,9001  >  35978 [ACK] Seq=16601239 Ack=306934597 Win=65535 Len=0
1,1.6067629999997735,62.210.85.178,10.0.2.15,TCP,60,9001  >  35978 [ACK] Seq=16601239 Ack=306936057 Win=65535 Len=0
1,1.6067669999993086,62.210.85.178,10.0.2.15,TCP,60,9001  >  35978 [ACK] Seq=16601239 Ack=306937517 Win=65535 Len=0
1,1.6067989999992278,10.0.2.15,62.210.85.178,TLSv1.2,948,Application Data
1,1.6068359999999302,62.210.85.178,10.0.2.15,TCP,60,9001  >  35978 [ACK] Seq=16601239 Ack=306938411 Win=65535 Len=0
1,1.606883999999809,10.0.2.15,62.210.85.178,TLSv1.2,4124,Application Data
1,1.6069250000000466,62.210.85.178,10.0.2.15,TCP,60,9001  >  35978 [ACK] Seq=16601239 Ack=306939871 Win=65535 Len=0
1,1.6069309999993493,62.210.85.178,10.0.2.15,TCP,60,9001  >  35978 [ACK] Seq=16601239 Ack=306941331 Win=65535 Len=0
1,1.606935999999223,62.210.85.178,10.0.2.15,TCP,60,9001  >  35978 [ACK] Seq=16601239 Ack=306942481 Win=65535 Len=0
1,1.6069809999999052,10.0.2.15,62.210.85.178,TLSv1.2,3030,Application Data
1,1.6070209999998042,62.210.85.178,10.0.2.15,TCP,60,9001  >  35978 [ACK] Seq=16601239 Ack=306943941 Win=65535 Len=0
1,1.6070279999994455,62.210.85.178,10.0.2.15,TCP,60,9001  >  35978 [ACK] Seq=16601239 Ack=306945401 Win=65535 Len=0
1,1.60703199999989,62.210.85.178,10.0.2.15,TCP,60,9001  >  35978 [ACK] Seq=16601239 Ack=306945457 Win=65535 Len=0
1,1.6842790000000605,54.93.77.70,10.0.2.15,TLSv1.2,590,Application Data
1,1.7042050000000017,54.93.77.70,10.0.2.15,TCP,2950,"9001  >  34692 [PSH, ACK] Seq=306516447 Ack=16647739 Win=65535 Len=2896 [TCP segment of a reassembled PDU]"
1,1.7043229999999312,10.0.2.15,54.93.77.70,TCP,54,34692  >  9001 [ACK] Seq=16647739 Ack=306519343 Win=65535 Len=0
1,1.7047969999994166,54.93.77.70,10.0.2.15,TLSv1.2,4398,"Application Data, Application Data"
1,1.7048379999996541,10.0.2.15,54.93.77.70,TCP,54,34692  >  9001 [ACK] Seq=16647739 Ack=306523687 Win=65535 Len=0
1,1.7254130000001169,54.93.77.70,10.0.2.15,TLSv1.2,3674,Application Data
1,1.725456999999551,10.0.2.15,54.93.77.70,TCP,54,34692  >  9001 [ACK] Seq=16647739 Ack=306527307 Win=65535 Len=0
1,1.7449459999997998,54.93.77.70,10.0.2.15,TLSv1.2,3674,Application Data
1,1.745006000000103,10.0.2.15,54.93.77.70,TCP,54,34692  >  9001 [ACK] Seq=16647739 Ack=306530927 Win=65535 Len=0
1,1.7560139999995954,54.93.77.70,10.0.2.15,TLSv1.2,5846,Application Data
1,1.7560379999995348,54.93.77.70,10.0.2.15,TLSv1.2,7294,"Application Data, Application Data"
1,1.7561059999998179,10.0.2.15,54.93.77.70,TCP,54,34692  >  9001 [ACK] Seq=16647739 Ack=306543959 Win=65535 Len=0
1,1.7563749999999345,10.0.2.15,54.93.77.70,TLSv1.2,590,Application Data
1,1.7564459999994142,54.93.77.70,10.0.2.15,TCP,60,9001  >  34692 [ACK] Seq=306543959 Ack=16648275 Win=65535 Len=0
1,1.7591199999997116,54.93.77.70,10.0.2.15,TCP,1502,"9001  >  34692 [PSH, ACK] Seq=306543959 Ack=16648275 Win=65535 Len=1448 [TCP segment of a reassembled PDU]"
1,1.7591640000000552,10.0.2.15,54.93.77.70,TCP,54,34692  >  9001 [ACK] Seq=16648275 Ack=306545407 Win=65535 Len=0
1,1.769058999999288,54.93.77.70,10.0.2.15,TLSv1.2,568,Application Data
1,1.7889359999999215,54.93.77.70,10.0.2.15,TLSv1.2,3674,Application Data
1,1.789056999999957,10.0.2.15,54.93.77.70,TCP,54,34692  >  9001 [ACK] Seq=16648275 Ack=306549541 Win=65535 Len=0
1,1.796394999999393,54.93.77.70,10.0.2.15,TCP,2950,"9001  >  34692 [PSH, ACK] Seq=306549541 Ack=16648275 Win=65535 Len=2896 [TCP segment of a reassembled PDU]"
1,1.796448999999484,10.0.2.15,54.93.77.70,TCP,54,34692  >  9001 [ACK] Seq=16648275 Ack=306552437 Win=65535 Len=0
1,1.8060889999997016,54.93.77.70,10.0.2.15,TLSv1.2,5846,"Application Data, Application Data"
1,1.8062049999998635,10.0.2.15,54.93.77.70,TCP,54,34692  >  9001 [ACK] Seq=16648275 Ack=306558229 Win=65535 Len=0
1,1.8074109999997745,54.93.77.70,10.0.2.15,TLSv1.2,7924,"Application Data, Application Data, Application Data"
1,1.8074879999994664,10.0.2.15,54.93.77.70,TCP,54,34692  >  9001 [ACK] Seq=16648275 Ack=306566099 Win=65535 Len=0
1,1.8078009999999267,10.0.2.15,54.93.77.70,TLSv1.2,590,Application Data
1,1.807912999999644,54.93.77.70,10.0.2.15,TCP,60,9001  >  34692 [ACK] Seq=306566099 Ack=16648811 Win=65535 Len=0
1,1.81566599999951,54.93.77.70,10.0.2.15,TCP,1502,"9001  >  34692 [PSH, ACK] Seq=306566099 Ack=16648811 Win=65535 Len=1448 [TCP segment of a reassembled PDU]"
1,1.8157400000000052,10.0.2.15,54.93.77.70,TCP,54,34692  >  9001 [ACK] Seq=16648811 Ack=306567547 Win=65535 Len=0
1,1.8234099999999671,54.93.77.70,10.0.2.15,TLSv1.2,5846,"Application Data, Application Data"
1,1.8234299999994619,54.93.77.70,10.0.2.15,TLSv1.2,4398,Application Data [TCP segment of a reassembled PDU]
1,1.8234939999993003,10.0.2.15,54.93.77.70,TCP,54,34692  >  9001 [ACK] Seq=16648811 Ack=306577683 Win=65535 Len=0
1,1.8236119999992297,10.0.2.15,54.93.77.70,TLSv1.2,590,Application Data
1,1.8236790000000838,54.93.77.70,10.0.2.15,TCP,60,9001  >  34692 [ACK] Seq=306577683 Ack=16649347 Win=65535 Len=0
1,1.8260129999998753,54.93.77.70,10.0.2.15,TLSv1.2,1408,Application Data
1,1.8438689999993585,54.93.77.70,10.0.2.15,TCP,2950,"9001  >  34692 [PSH, ACK] Seq=306579037 Ack=16649347 Win=65535 Len=2896 [TCP segment of a reassembled PDU]"
1,1.8439199999993434,10.0.2.15,54.93.77.70,TCP,54,34692  >  9001 [ACK] Seq=16649347 Ack=306581933 Win=65535 Len=0
1,1.8618649999998524,54.93.77.70,10.0.2.15,TLSv1.2,778,Application Data
1,1.8800449999998818,62.210.85.178,10.0.2.15,TLSv1.2,590,Application Data
1,1.8829839999998512,54.93.77.70,10.0.2.15,TCP,2950,"9001  >  34692 [PSH, ACK] Seq=306582657 Ack=16649347 Win=65535 Len=2896 [TCP segment of a reassembled PDU]"
1,1.883054999999331,10.0.2.15,54.93.77.70,TCP,54,34692  >  9001 [ACK] Seq=16649347 Ack=306585553 Win=65535 Len=0
1,1.8914609999992535,54.93.77.70,10.0.2.15,TLSv1.2,5846,"Application Data, Application Data, Application Data"
1,1.8915299999998751,10.0.2.15,54.93.77.70,TCP,54,34692  >  9001 [ACK] Seq=16649347 Ack=306591345 Win=65535 Len=0
1,1.891646999999466,54.93.77.70,10.0.2.15,TCP,2950,"9001  >  34692 [PSH, ACK] Seq=306591345 Ack=16649347 Win=65535 Len=2896 [TCP segment of a reassembled PDU]"
1,1.8917449999999008,10.0.2.15,54.93.77.70,TCP,54,34692  >  9001 [ACK] Seq=16649347 Ack=306594241 Win=65535 Len=0
1,1.9011679999994158,54.93.77.70,10.0.2.15,TLSv1.2,1430,"Application Data, Application Data"
1,1.901358000000073,10.0.2.15,54.93.77.70,TLSv1.2,590,Application Data
1,1.9014799999995375,54.93.77.70,10.0.2.15,TCP,60,9001  >  34692 [ACK] Seq=306595617 Ack=16649883 Win=65535 Len=0
1,1.9040899999999965,54.93.77.70,10.0.2.15,TCP,2950,"9001  >  34692 [PSH, ACK] Seq=306595617 Ack=16649883 Win=65535 Len=2896 [TCP segment of a reassembled PDU]"
1,1.9041559999996025,10.0.2.15,54.93.77.70,TCP,54,34692  >  9001 [ACK] Seq=16649883 Ack=306598513 Win=65535 Len=0
1,1.918388999999479,54.93.77.70,10.0.2.15,TLSv1.2,264,Application Data
1,1.922034999999596,10.0.2.15,62.210.85.178,TCP,54,35978  >  9001 [ACK] Seq=306945457 Ack=16601775 Win=65535 Len=0
1,1.9225799999994706,10.0.2.15,54.93.77.70,TLSv1.2,590,Application Data
1,1.9227139999993597,54.93.77.70,10.0.2.15,TCP,60,9001  >  34692 [ACK] Seq=306598723 Ack=16650419 Win=65535 Len=0
1,1.9377189999995608,62.210.85.178,10.0.2.15,TLSv1.2,590,Application Data
1,1.937801999999465,10.0.2.15,62.210.85.178,TCP,54,35978  >  9001 [ACK] Seq=306945457 Ack=16602311 Win=65535 Len=0
1,1.975550999999541,62.210.85.178,10.0.2.15,TLSv1.2,590,Application Data
1,1.9756399999996574,10.0.2.15,62.210.85.178,TCP,54,35978  >  9001 [ACK] Seq=306945457 Ack=16602847 Win=65535 Len=0
1,2.0439209999995,62.210.85.178,10.0.2.15,TLSv1.2,590,Application Data
1,2.044000999999298,10.0.2.15,62.210.85.178,TCP,54,35978  >  9001 [ACK] Seq=306945457 Ack=16603383 Win=65535 Len=0
1,2.5644679999995788,62.210.85.178,10.0.2.15,TLSv1.2,590,Application Data
1,2.5645669999994425,10.0.2.15,62.210.85.178,TCP,54,35978  >  9001 [ACK] Seq=306945457 Ack=16603919 Win=65535 Len=0
1,2.5649329999996553,10.0.2.15,62.210.85.178,TLSv1.2,590,Application Data
1,2.5650329999998576,62.210.85.178,10.0.2.15,TCP,60,9001  >  35978 [ACK] Seq=16603919 Ack=306945993 Win=65535 Len=0
1,2.672023000000081,54.93.77.70,10.0.2.15,TLSv1.2,590,Application Data
1,2.6724169999997684,10.0.2.15,54.93.77.70,TLSv1.2,590,Application Data
1,2.6725289999994857,54.93.77.70,10.0.2.15,TCP,60,9001  >  34692 [ACK] Seq=306599259 Ack=16650955 Win=65535 Len=0
1,2.8714649999992616,62.210.85.178,10.0.2.15,TLSv1.2,590,Application Data
1,2.8816479999995863,10.0.2.15,62.210.85.178,TLSv1.2,590,Application Data
1,2.881819999999607,62.210.85.178,10.0.2.15,TCP,60,9001  >  35978 [ACK] Seq=16604455 Ack=306946529 Win=65535 Len=0
1,2.89378299999953,10.0.2.15,62.210.85.178,TLSv1.2,4124,Application Data
1,2.893890999999712,10.0.2.15,62.210.85.178,TCP,2974,35978  >  9001 [ACK] Seq=306950599 Ack=16604455 Win=65535 Len=2920 [TCP segment of a reassembled PDU]
1,2.8939339999997173,62.210.85.178,10.0.2.15,TCP,60,9001  >  35978 [ACK] Seq=16604455 Ack=306947989 Win=65535 Len=0
1,2.8939449999998033,62.210.85.178,10.0.2.15,TCP,60,9001  >  35978 [ACK] Seq=16604455 Ack=306949449 Win=65535 Len=0
1,2.893949999999677,62.210.85.178,10.0.2.15,TCP,60,9001  >  35978 [ACK] Seq=16604455 Ack=306950599 Win=65535 Len=0
1,2.8939549999995506,62.210.85.178,10.0.2.15,TCP,60,9001  >  35978 [ACK] Seq=16604455 Ack=306952059 Win=65535 Len=0
1,2.8939589999999953,62.210.85.178,10.0.2.15,TCP,60,9001  >  35978 [ACK] Seq=16604455 Ack=306953519 Win=65535 Len=0
1,2.8940020000000004,10.0.2.15,62.210.85.178,TLSv1.2,1204,Application Data
1,2.8940709999997125,10.0.2.15,62.210.85.178,TCP,2974,35978  >  9001 [ACK] Seq=306954669 Ack=16604455 Win=65535 Len=2920 [TCP segment of a reassembled PDU]
1,2.8941109999996115,62.210.85.178,10.0.2.15,TCP,60,9001  >  35978 [ACK] Seq=16604455 Ack=306954669 Win=65535 Len=0
1,2.894117999999253,62.210.85.178,10.0.2.15,TCP,60,9001  >  35978 [ACK] Seq=16604455 Ack=306956129 Win=65535 Len=0
1,2.894123000000036,62.210.85.178,10.0.2.15,TCP,60,9001  >  35978 [ACK] Seq=16604455 Ack=306957589 Win=65535 Len=0
1,2.8941580000000613,10.0.2.15,62.210.85.178,TLSv1.2,1204,Application Data
1,2.8942229999993287,10.0.2.15,62.210.85.178,TCP,2974,35978  >  9001 [ACK] Seq=306958739 Ack=16604455 Win=65535 Len=2920 [TCP segment of a reassembled PDU]
1,2.894260000000031,62.210.85.178,10.0.2.15,TCP,60,9001  >  35978 [ACK] Seq=16604455 Ack=306958739 Win=65535 Len=0
1,2.894265999999334,62.210.85.178,10.0.2.15,TCP,60,9001  >  35978 [ACK] Seq=16604455 Ack=306960199 Win=65535 Len=0
1,2.894271000000117,62.210.85.178,10.0.2.15,TCP,60,9001  >  35978 [ACK] Seq=16604455 Ack=306961659 Win=65535 Len=0
1,2.8943019999996977,10.0.2.15,62.210.85.178,TLSv1.2,1204,Application Data
1,2.8943810000000667,10.0.2.15,62.210.85.178,TLSv1.2,2974,Application Data
1,2.8944189999992886,62.210.85.178,10.0.2.15,TCP,60,9001  >  35978 [ACK] Seq=16604455 Ack=306962809 Win=65535 Len=0
1,2.8944259999998394,62.210.85.178,10.0.2.15,TCP,60,9001  >  35978 [ACK] Seq=16604455 Ack=306964269 Win=65535 Len=0
1,2.8944299999993746,62.210.85.178,10.0.2.15,TCP,60,9001  >  35978 [ACK] Seq=16604455 Ack=306965729 Win=65535 Len=0
1,2.8944609999998647,10.0.2.15,62.210.85.178,TLSv1.2,1226,Application Data
1,2.8945269999994707,10.0.2.15,62.210.85.178,TCP,2974,35978  >  9001 [ACK] Seq=306966901 Ack=16604455 Win=65535 Len=2920 [TCP segment of a reassembled PDU]
1,2.8945679999997083,62.210.85.178,10.0.2.15,TCP,60,9001  >  35978 [ACK] Seq=16604455 Ack=306966901 Win=65535 Len=0
1,2.8945749999993495,62.210.85.178,10.0.2.15,TCP,60,9001  >  35978 [ACK] Seq=16604455 Ack=306968361 Win=65535 Len=0
1,2.894579999999223,62.210.85.178,10.0.2.15,TCP,60,9001  >  35978 [ACK] Seq=16604455 Ack=306969821 Win=65535 Len=0
1,2.8946109999997134,10.0.2.15,62.210.85.178,TLSv1.2,1204,Application Data
1,2.8946470000000772,62.210.85.178,10.0.2.15,TCP,60,9001  >  35978 [ACK] Seq=16604455 Ack=306970971 Win=65535 Len=0
1,2.8946909999995114,10.0.2.15,62.210.85.178,TLSv1.2,3030,Application Data
1,2.894731999999749,62.210.85.178,10.0.2.15,TCP,60,9001  >  35978 [ACK] Seq=16604455 Ack=306972431 Win=65535 Len=0
1,2.894737999999961,62.210.85.178,10.0.2.15,TCP,60,9001  >  35978 [ACK] Seq=16604455 Ack=306973891 Win=65535 Len=0
1,2.894742999999835,62.210.85.178,10.0.2.15,TCP,60,9001  >  35978 [ACK] Seq=16604455 Ack=306973947 Win=65535 Len=0
1,2.90611699999954,10.0.2.15,62.210.85.178,TLSv1.2,4124,Application Data
1,2.9062059999996563,10.0.2.15,62.210.85.178,TCP,2974,35978  >  9001 [ACK] Seq=306978017 Ack=16604455 Win=65535 Len=2920 [TCP segment of a reassembled PDU]
1,2.9062450000001263,62.210.85.178,10.0.2.15,TCP,60,9001  >  35978 [ACK] Seq=16604455 Ack=306975407 Win=65535 Len=0
1,2.906253999999535,62.210.85.178,10.0.2.15,TCP,60,9001  >  35978 [ACK] Seq=16604455 Ack=306976867 Win=65535 Len=0
1,2.90625799999998,62.210.85.178,10.0.2.15,TCP,60,9001  >  35978 [ACK] Seq=16604455 Ack=306978017 Win=65535 Len=0
1,2.9062629999998535,62.210.85.178,10.0.2.15,TCP,60,9001  >  35978 [ACK] Seq=16604455 Ack=306979477 Win=65535 Len=0
1,2.9062669999993886,62.210.85.178,10.0.2.15,TCP,60,9001  >  35978 [ACK] Seq=16604455 Ack=306980937 Win=65535 Len=0
1,2.906307999999626,10.0.2.15,62.210.85.178,TLSv1.2,1204,Application Data
1,2.9063749999995707,10.0.2.15,62.210.85.178,TCP,2974,35978  >  9001 [ACK] Seq=306982087 Ack=16604455 Win=65535 Len=2920 [TCP segment of a reassembled PDU]
1,2.906409999999596,62.210.85.178,10.0.2.15,TCP,60,9001  >  35978 [ACK] Seq=16604455 Ack=306982087 Win=65535 Len=0
1,2.9064169999992373,62.210.85.178,10.0.2.15,TCP,60,9001  >  35978 [ACK] Seq=16604455 Ack=306983547 Win=65535 Len=0
1,2.906420999999682,62.210.85.178,10.0.2.15,TCP,60,9001  >  35978 [ACK] Seq=16604455 Ack=306985007 Win=65535 Len=0
1,2.9064549999993687,10.0.2.15,62.210.85.178,TLSv1.2,1204,Application Data
1,2.9065190000001166,10.0.2.15,62.210.85.178,TCP,2974,35978  >  9001 [ACK] Seq=306986157 Ack=16604455 Win=65535 Len=2920 [TCP segment of a reassembled PDU]
1,2.9065559999999095,62.210.85.178,10.0.2.15,TCP,60,9001  >  35978 [ACK] Seq=16604455 Ack=306986157 Win=65535 Len=0
1,2.906562999999551,62.210.85.178,10.0.2.15,TCP,60,9001  >  35978 [ACK] Seq=16604455 Ack=306987617 Win=65535 Len=0
1,2.9065669999999955,62.210.85.178,10.0.2.15,TCP,60,9001  >  35978 [ACK] Seq=16604455 Ack=306989077 Win=65535 Len=0
1,2.906597999999576,10.0.2.15,62.210.85.178,TLSv1.2,1204,Application Data
1,2.9066939999993338,10.0.2.15,62.210.85.178,TLSv1.2,2974,Application Data
1,2.906716999999844,62.210.85.178,10.0.2.15,TCP,60,9001  >  35978 [ACK] Seq=16604455 Ack=306990227 Win=65535 Len=0
1,2.9067239999994854,62.210.85.178,10.0.2.15,TCP,60,9001  >  35978 [ACK] Seq=16604455 Ack=306991687 Win=65535 Len=0
1,2.906728999999359,62.210.85.178,10.0.2.15,TCP,60,9001  >  35978 [ACK] Seq=16604455 Ack=306993147 Win=65535 Len=0
1,2.9067599999998492,10.0.2.15,62.210.85.178,TLSv1.2,1226,Application Data
1,2.906796999999642,62.210.85.178,10.0.2.15,TCP,60,9001  >  35978 [ACK] Seq=16604455 Ack=306994319 Win=65535 Len=0
1,2.906840999999986,10.0.2.15,62.210.85.178,TLSv1.2,4124,Application Data
1,2.906912999999804,62.210.85.178,10.0.2.15,TCP,60,9001  >  35978 [ACK] Seq=16604455 Ack=306995779 Win=65535 Len=0
1,2.9069259999996575,62.210.85.178,10.0.2.15,TCP,60,9001  >  35978 [ACK] Seq=16604455 Ack=306997239 Win=65535 Len=0
1,2.906930999999531,62.210.85.178,10.0.2.15,TCP,60,9001  >  35978 [ACK] Seq=16604455 Ack=306998389 Win=65535 Len=0
1,2.906992999999602,10.0.2.15,62.210.85.178,TLSv1.2,3030,Application Data
1,2.9070369999999457,62.210.85.178,10.0.2.15,TCP,60,9001  >  35978 [ACK] Seq=16604455 Ack=306999849 Win=65535 Len=0
1,2.907043999999587,62.210.85.178,10.0.2.15,TCP,60,9001  >  35978 [ACK] Seq=16604455 Ack=307001309 Win=65535 Len=0
1,2.9070489999994606,62.210.85.178,10.0.2.15,TCP,60,9001  >  35978 [ACK] Seq=16604455 Ack=307001365 Win=65535 Len=0
1,2.917457999999897,10.0.2.15,62.210.85.178,TLSv1.2,4124,Application Data
1,2.917562999999973,10.0.2.15,62.210.85.178,TCP,2974,35978  >  9001 [ACK] Seq=307005435 Ack=16604455 Win=65535 Len=2920 [TCP segment of a reassembled PDU]
1,2.9176079999997455,62.210.85.178,10.0.2.15,TCP,60,9001  >  35978 [ACK] Seq=16604455 Ack=307002825 Win=65535 Len=0
1,2.917617999999493,62.210.85.178,10.0.2.15,TCP,60,9001  >  35978 [ACK] Seq=16604455 Ack=307004285 Win=65535 Len=0
1,2.9176229999993666,62.210.85.178,10.0.2.15,TCP,60,9001  >  35978 [ACK] Seq=16604455 Ack=307005435 Win=65535 Len=0
1,2.917689999999311,10.0.2.15,62.210.85.178,TLSv1.2,1204,Application Data
1,2.917711999999483,62.210.85.178,10.0.2.15,TCP,60,9001  >  35978 [ACK] Seq=16604455 Ack=307006895 Win=65535 Len=0
1,2.9177190000000337,62.210.85.178,10.0.2.15,TCP,60,9001  >  35978 [ACK] Seq=16604455 Ack=307008355 Win=65535 Len=0
1,2.9177929999996195,10.0.2.15,62.210.85.178,TCP,2974,35978  >  9001 [ACK] Seq=307009505 Ack=16604455 Win=65535 Len=2920 [TCP segment of a reassembled PDU]
1,2.917813999999453,62.210.85.178,10.0.2.15,TCP,60,9001  >  35978 [ACK] Seq=16604455 Ack=307009505 Win=65535 Len=0
1,2.917848999999478,10.0.2.15,62.210.85.178,TLSv1.2,1204,Application Data
1,2.917884999999842,62.210.85.178,10.0.2.15,TCP,60,9001  >  35978 [ACK] Seq=16604455 Ack=307010965 Win=65535 Len=0
1,2.9178919999994832,62.210.85.178,10.0.2.15,TCP,60,9001  >  35978 [ACK] Seq=16604455 Ack=307012425 Win=65535 Len=0
1,2.917895999999928,62.210.85.178,10.0.2.15,TCP,60,9001  >  35978 [ACK] Seq=16604455 Ack=307013575 Win=65535 Len=0
1,2.917942999999468,10.0.2.15,62.210.85.178,TLSv1.2,4124,Application Data
1,2.917982999999367,62.210.85.178,10.0.2.15,TCP,60,9001  >  35978 [ACK] Seq=16604455 Ack=307015035 Win=65535 Len=0
1,2.9179889999995794,62.210.85.178,10.0.2.15,TCP,60,9001  >  35978 [ACK] Seq=16604455 Ack=307016495 Win=65535 Len=0
1,2.917993999999453,62.210.85.178,10.0.2.15,TCP,60,9001  >  35978 [ACK] Seq=16604455 Ack=307017645 Win=65535 Len=0
1,2.9180379999997967,10.0.2.15,62.210.85.178,TLSv1.2,332,Application Data
1,2.918076999999357,62.210.85.178,10.0.2.15,TCP,60,9001  >  35978 [ACK] Seq=16604455 Ack=307017923 Win=65535 Len=0
1,2.918135999999322,10.0.2.15,62.210.85.178,TLSv1.2,3868,Application Data
1,2.918178999999327,62.210.85.178,10.0.2.15,TCP,60,9001  >  35978 [ACK] Seq=16604455 Ack=307019383 Win=65535 Len=0
1,2.918185999999878,62.210.85.178,10.0.2.15,TCP,60,9001  >  35978 [ACK] Seq=16604455 Ack=307020843 Win=65535 Len=0
1,2.918189999999413,62.210.85.178,10.0.2.15,TCP,60,9001  >  35978 [ACK] Seq=16604455 Ack=307021737 Win=65535 Len=0
1,2.9182369999998627,10.0.2.15,62.210.85.178,TLSv1.2,3480,Application Data
1,2.9182780000001003,62.210.85.178,10.0.2.15,TCP,60,9001  >  35978 [ACK] Seq=16604455 Ack=307023197 Win=65535 Len=0
1,2.9182849999997416,62.210.85.178,10.0.2.15,TCP,60,9001  >  35978 [ACK] Seq=16604455 Ack=307024657 Win=65535 Len=0
1,2.9182899999996152,62.210.85.178,10.0.2.15,TCP,60,9001  >  35978 [ACK] Seq=16604455 Ack=307025163 Win=65535 Len=0
1,3.0476309999994555,54.93.77.70,10.0.2.15,TLSv1.2,590,Application Data
1,3.058791999999812,54.93.77.70,10.0.2.15,TCP,2950,"9001  >  34692 [PSH, ACK] Seq=306599795 Ack=16650955 Win=65535 Len=2896 [TCP segment of a reassembled PDU]"
1,3.0589669999999387,10.0.2.15,54.93.77.70,TCP,54,34692  >  9001 [ACK] Seq=16650955 Ack=306602691 Win=65535 Len=0
1,3.0674239999998463,54.93.77.70,10.0.2.15,TLSv1.2,2950,Application Data [TCP segment of a reassembled PDU]
1,3.0675139999993917,10.0.2.15,54.93.77.70,TCP,54,34692  >  9001 [ACK] Seq=16650955 Ack=306605587 Win=65535 Len=0
1,3.0679129999998622,54.93.77.70,10.0.2.15,TLSv1.2,1502,Application Data
1,3.067964999999276,10.0.2.15,54.93.77.70,TCP,54,34692  >  9001 [ACK] Seq=16650955 Ack=306607035 Win=65535 Len=0
1,3.076970000000074,54.93.77.70,10.0.2.15,TLSv1.2,3674,Application Data
1,3.0773369999997158,10.0.2.15,54.93.77.70,TCP,54,34692  >  9001 [ACK] Seq=16650955 Ack=306610655 Win=65535 Len=0
1,3.0831869999992705,54.93.77.70,10.0.2.15,TLSv1.2,4398,Application Data
1,3.0832729999992807,10.0.2.15,54.93.77.70,TCP,54,34692  >  9001 [ACK] Seq=16650955 Ack=306614999 Win=65535 Len=0
1,3.091494999999668,54.93.77.70,10.0.2.15,TLSv1.2,2950,Application Data [TCP segment of a reassembled PDU]
1,3.0915569999997388,10.0.2.15,54.93.77.70,TCP,54,34692  >  9001 [ACK] Seq=16650955 Ack=306617895 Win=65535 Len=0
1,3.0928539999995337,54.93.77.70,10.0.2.15,TLSv1.2,1104,Application Data
1,3.0930529999995997,10.0.2.15,54.93.77.70,TLSv1.2,590,Application Data
1,3.0931689999997616,54.93.77.70,10.0.2.15,TCP,60,9001  >  34692 [ACK] Seq=306618945 Ack=16651491 Win=65535 Len=0
1,3.0996729999997115,54.93.77.70,10.0.2.15,TCP,2950,"9001  >  34692 [PSH, ACK] Seq=306618945 Ack=16651491 Win=65535 Len=2896 [TCP segment of a reassembled PDU]"
1,3.0997609999994893,10.0.2.15,54.93.77.70,TCP,54,34692  >  9001 [ACK] Seq=16651491 Ack=306621841 Win=65535 Len=0
1,3.1075849999997445,54.93.77.70,10.0.2.15,TLSv1.2,5846,"Application Data, Application Data, Application Data"
1,3.1077049999994415,10.0.2.15,54.93.77.70,TCP,54,34692  >  9001 [ACK] Seq=16651491 Ack=306627633 Win=65535 Len=0
1,3.107734999999593,54.93.77.70,10.0.2.15,TCP,2950,"9001  >  34692 [PSH, ACK] Seq=306627633 Ack=16651491 Win=65535 Len=2896 [TCP segment of a reassembled PDU]"
1,3.1078639999996085,10.0.2.15,54.93.77.70,TCP,54,34692  >  9001 [ACK] Seq=16651491 Ack=306630529 Win=65535 Len=0
1,3.108075000000099,10.0.2.15,54.93.77.70,TLSv1.2,590,Application Data
1,3.1081799999992654,54.93.77.70,10.0.2.15,TCP,60,9001  >  34692 [ACK] Seq=306630529 Ack=16652027 Win=65535 Len=0
1,3.1093489999993835,54.93.77.70,10.0.2.15,TLSv1.2,380,Application Data
1,3.123649000000114,54.93.77.70,10.0.2.15,TCP,2950,"9001  >  34692 [PSH, ACK] Seq=306630855 Ack=16652027 Win=65535 Len=2896 [TCP segment of a reassembled PDU]"
1,3.123696999999993,10.0.2.15,54.93.77.70,TCP,54,34692  >  9001 [ACK] Seq=16652027 Ack=306633751 Win=65535 Len=0
1,3.134877999999844,54.93.77.70,10.0.2.15,TLSv1.2,2950,"Application Data, Application Data"
1,3.134922999999617,10.0.2.15,54.93.77.70,TCP,54,34692  >  9001 [ACK] Seq=16652027 Ack=306636647 Win=65535 Len=0
1,3.1359400000001187,54.93.77.70,10.0.2.15,TLSv1.2,5846,Application Data [TCP segment of a reassembled PDU]
1,3.1360109999995984,10.0.2.15,54.93.77.70,TCP,54,34692  >  9001 [ACK] Seq=16652027 Ack=306642439 Win=65535 Len=0
1,3.1395039999997607,54.93.77.70,10.0.2.15,TLSv1.2,1430,"Application Data, Application Data"
1,3.1685059999999794,54.93.77.70,10.0.2.15,TLSv1.2,4398,Application Data
1,3.1685969999998633,10.0.2.15,54.93.77.70,TCP,54,34692  >  9001 [ACK] Seq=16652027 Ack=306648159 Win=65535 Len=0
1,3.1749769999996715,54.93.77.70,10.0.2.15,TLSv1.2,7294,"Application Data, Application Data"
1,3.1750939999992625,10.0.2.15,54.93.77.70,TCP,54,34692  >  9001 [ACK] Seq=16652027 Ack=306655399 Win=65535 Len=0
1,3.175376999999571,10.0.2.15,54.93.77.70,TLSv1.2,590,Application Data
1,3.1754940000000715,54.93.77.70,10.0.2.15,TCP,60,9001  >  34692 [ACK] Seq=306655399 Ack=16652563 Win=65535 Len=0
1,3.1859629999999015,54.93.77.70,10.0.2.15,TLSv1.2,894,Application Data
1,3.1973079999997935,54.93.77.70,10.0.2.15,TLSv1.2,4398,Application Data
1,3.1973629999993136,10.0.2.15,54.93.77.70,TCP,54,34692  >  9001 [ACK] Seq=16652563 Ack=306660583 Win=65535 Len=0
1,3.2097439999997732,54.93.77.70,10.0.2.15,TLSv1.2,2950,Application Data [TCP segment of a reassembled PDU]
1,3.2097979999998643,10.0.2.15,54.93.77.70,TCP,54,34692  >  9001 [ACK] Seq=16652563 Ack=306663479 Win=65535 Len=0
1,3.2105409999994663,54.93.77.70,10.0.2.15,TCP,1502,"9001  >  34692 [PSH, ACK] Seq=306663479 Ack=16652563 Win=65535 Len=1448 [TCP segment of a reassembled PDU]"
1,3.21058499999981,10.0.2.15,54.93.77.70,TCP,54,34692  >  9001 [ACK] Seq=16652563 Ack=306664927 Win=65535 Len=0
1,3.2138539999996283,54.93.77.70,10.0.2.15,TLSv1.2,684,Application Data
1,3.2215249999999287,54.93.77.70,10.0.2.15,TLSv1.2,7294,Application Data
1,3.221593999999641,10.0.2.15,54.93.77.70,TCP,54,34692  >  9001 [ACK] Seq=16652563 Ack=306672797 Win=65535 Len=0
1,3.230638999999428,54.93.77.70,10.0.2.15,TLSv1.2,568,Application Data
1,3.2308169999996608,10.0.2.15,54.93.77.70,TLSv1.2,590,Application Data
1,3.2309299999997165,54.93.77.70,10.0.2.15,TCP,60,9001  >  34692 [ACK] Seq=306673311 Ack=16653099 Win=65535 Len=0
1,3.2324199999993652,62.210.85.178,10.0.2.15,TLSv1.2,590,Application Data
1,3.2435679999998683,54.93.77.70,10.0.2.15,TCP,2950,"9001  >  34692 [PSH, ACK] Seq=306673311 Ack=16653099 Win=65535 Len=2896 [TCP segment of a reassembled PDU]"
1,3.243634999999813,10.0.2.15,54.93.77.70,TCP,54,34692  >  9001 [ACK] Seq=16653099 Ack=306676207 Win=65535 Len=0
1,3.2470639999992272,54.93.77.70,10.0.2.15,TLSv1.2,778,Application Data
1,3.2472239999997328,10.0.2.15,54.93.77.70,TLSv1.2,590,Application Data
1,3.2473339999996824,54.93.77.70,10.0.2.15,TCP,60,9001  >  34692 [ACK] Seq=306676931 Ack=16653635 Win=65535 Len=0
1,3.2500639999998384,62.210.85.178,10.0.2.15,TLSv1.2,590,Application Data
1,3.250136999999995,10.0.2.15,62.210.85.178,TCP,54,35978  >  9001 [ACK] Seq=307025163 Ack=16605527 Win=65535 Len=0
1,3.2831939999996393,54.93.77.70,10.0.2.15,TLSv1.2,1618,Application Data
1,3.283289999999397,10.0.2.15,54.93.77.70,TCP,54,34692  >  9001 [ACK] Seq=16653635 Ack=306678495 Win=65535 Len=0
1,3.286065999999664,10.0.2.15,54.93.77.70,TLSv1.2,590,Application Data
1,3.2862289999993664,54.93.77.70,10.0.2.15,TCP,60,9001  >  34692 [ACK] Seq=306678495 Ack=16654171 Win=65535 Len=0
1,3.2869080000000395,62.210.85.178,10.0.2.15,TLSv1.2,590,Application Data
1,3.332043999999769,10.0.2.15,62.210.85.178,TCP,54,35978  >  9001 [ACK] Seq=307025163 Ack=16606063 Win=65535 Len=0
1,3.377136999999493,62.210.85.178,10.0.2.15,TLSv1.2,590,Application Data
1,3.377212999999756,10.0.2.15,62.210.85.178,TCP,54,35978  >  9001 [ACK] Seq=307025163 Ack=16606599 Win=65535 Len=0
1,3.468135999999504,62.210.85.178,10.0.2.15,TLSv1.2,1104,Application Data
1,3.468210999999428,10.0.2.15,62.210.85.178,TCP,54,35978  >  9001 [ACK] Seq=307025163 Ack=16607649 Win=65535 Len=0
1,3.468685999999252,10.0.2.15,62.210.85.178,TLSv1.2,590,Application Data
1,3.468779999999242,62.210.85.178,10.0.2.15,TCP,60,9001  >  35978 [ACK] Seq=16607649 Ack=307025699 Win=65535 Len=0
1,4.100532999999814,54.93.77.70,10.0.2.15,TLSv1.2,590,Application Data
1,4.101158999999825,10.0.2.15,54.93.77.70,TLSv1.2,590,Application Data
1,4.101308999999674,54.93.77.70,10.0.2.15,TCP,60,9001  >  34692 [ACK] Seq=306679031 Ack=16654707 Win=65535 Len=0
1,4.406005999999252,62.210.85.178,10.0.2.15,TLSv1.2,590,Application Data
1,4.4131680000000415,10.0.2.15,62.210.85.178,TLSv1.2,590,Application Data
1,4.413350999999238,62.210.85.178,10.0.2.15,TCP,60,9001  >  35978 [ACK] Seq=16608185 Ack=307026235 Win=65535 Len=0
1,4.425779999999577,10.0.2.15,62.210.85.178,TLSv1.2,4124,Application Data
1,4.425885999999991,10.0.2.15,62.210.85.178,TCP,2974,35978  >  9001 [ACK] Seq=307030305 Ack=16608185 Win=65535 Len=2920 [TCP segment of a reassembled PDU]
1,4.4259289999999964,62.210.85.178,10.0.2.15,TCP,60,9001  >  35978 [ACK] Seq=16608185 Ack=307027695 Win=65535 Len=0
1,4.425938999999744,62.210.85.178,10.0.2.15,TCP,60,9001  >  35978 [ACK] Seq=16608185 Ack=307029155 Win=65535 Len=0
1,4.4259439999996175,62.210.85.178,10.0.2.15,TCP,60,9001  >  35978 [ACK] Seq=16608185 Ack=307030305 Win=65535 Len=0
1,4.425948000000062,62.210.85.178,10.0.2.15,TCP,60,9001  >  35978 [ACK] Seq=16608185 Ack=307031765 Win=65535 Len=0
1,4.425951999999597,62.210.85.178,10.0.2.15,TCP,60,9001  >  35978 [ACK] Seq=16608185 Ack=307033225 Win=65535 Len=0
1,4.425994999999602,10.0.2.15,62.210.85.178,TLSv1.2,1204,Application Data
1,4.426061999999547,10.0.2.15,62.210.85.178,TCP,2974,35978  >  9001 [ACK] Seq=307034375 Ack=16608185 Win=65535 Len=2920 [TCP segment of a reassembled PDU]
1,4.426101000000017,62.210.85.178,10.0.2.15,TCP,60,9001  >  35978 [ACK] Seq=16608185 Ack=307034375 Win=65535 Len=0
1,4.42610699999932,62.210.85.178,10.0.2.15,TCP,60,9001  >  35978 [ACK] Seq=16608185 Ack=307035835 Win=65535 Len=0
1,4.426112000000103,62.210.85.178,10.0.2.15,TCP,60,9001  >  35978 [ACK] Seq=16608185 Ack=307037295 Win=65535 Len=0
1,4.42614599999979,10.0.2.15,62.210.85.178,TLSv1.2,1204,Application Data
1,4.426210999999967,10.0.2.15,62.210.85.178,TCP,2974,35978  >  9001 [ACK] Seq=307038445 Ack=16608185 Win=65535 Len=2920 [TCP segment of a reassembled PDU]
1,4.4262479999997595,62.210.85.178,10.0.2.15,TCP,60,9001  >  35978 [ACK] Seq=16608185 Ack=307038445 Win=65535 Len=0
1,4.426254999999401,62.210.85.178,10.0.2.15,TCP,60,9001  >  35978 [ACK] Seq=16608185 Ack=307039905 Win=65535 Len=0
1,4.426258999999845,62.210.85.178,10.0.2.15,TCP,60,9001  >  35978 [ACK] Seq=16608185 Ack=307041365 Win=65535 Len=0
1,4.426289999999426,10.0.2.15,62.210.85.178,TLSv1.2,1204,Application Data
1,4.4263679999994565,10.0.2.15,62.210.85.178,TLSv1.2,2974,Application Data
1,4.426404999999249,62.210.85.178,10.0.2.15,TCP,60,9001  >  35978 [ACK] Seq=16608185 Ack=307042515 Win=65535 Len=0
1,4.4264119999998,62.210.85.178,10.0.2.15,TCP,60,9001  >  35978 [ACK] Seq=16608185 Ack=307043975 Win=65535 Len=0
1,4.426415999999335,62.210.85.178,10.0.2.15,TCP,60,9001  >  35978 [ACK] Seq=16608185 Ack=307045435 Win=65535 Len=0
1,4.4264479999992545,10.0.2.15,62.210.85.178,TLSv1.2,1226,Application Data
1,4.426509999999325,10.0.2.15,62.210.85.178,TCP,2974,35978  >  9001 [ACK] Seq=307046607 Ack=16608185 Win=65535 Len=2920 [TCP segment of a reassembled PDU]
1,4.426548999999795,62.210.85.178,10.0.2.15,TCP,60,9001  >  35978 [ACK] Seq=16608185 Ack=307046607 Win=65535 Len=0
1,4.426555000000008,62.210.85.178,10.0.2.15,TCP,60,9001  >  35978 [ACK] Seq=16608185 Ack=307048067 Win=65535 Len=0
1,4.426559999999881,62.210.85.178,10.0.2.15,TCP,60,9001  >  35978 [ACK] Seq=16608185 Ack=307049527 Win=65535 Len=0
1,4.426590999999462,10.0.2.15,62.210.85.178,TLSv1.2,1204,Application Data
1,4.426627999999255,62.210.85.178,10.0.2.15,TCP,60,9001  >  35978 [ACK] Seq=16608185 Ack=307050677 Win=65535 Len=0
1,4.42667099999926,10.0.2.15,62.210.85.178,TLSv1.2,3030,Application Data
1,4.4267119999994975,62.210.85.178,10.0.2.15,TCP,60,9001  >  35978 [ACK] Seq=16608185 Ack=307052137 Win=65535 Len=0
1,4.426719000000048,62.210.85.178,10.0.2.15,TCP,60,9001  >  35978 [ACK] Seq=16608185 Ack=307053597 Win=65535 Len=0
1,4.426722999999583,62.210.85.178,10.0.2.15,TCP,60,9001  >  35978 [ACK] Seq=16608185 Ack=307053653 Win=65535 Len=0
1,4.438068999999814,10.0.2.15,62.210.85.178,TLSv1.2,4124,Application Data
1,4.438148999999612,10.0.2.15,62.210.85.178,TCP,2974,35978  >  9001 [ACK] Seq=307057723 Ack=16608185 Win=65535 Len=2920 [TCP segment of a reassembled PDU]
1,4.438184999999976,62.210.85.178,10.0.2.15,TCP,60,9001  >  35978 [ACK] Seq=16608185 Ack=307055113 Win=65535 Len=0
1,4.438191999999617,62.210.85.178,10.0.2.15,TCP,60,9001  >  35978 [ACK] Seq=16608185 Ack=307056573 Win=65535 Len=0
1,4.438196999999491,62.210.85.178,10.0.2.15,TCP,60,9001  >  35978 [ACK] Seq=16608185 Ack=307057723 Win=65535 Len=0
1,4.4382009999999354,62.210.85.178,10.0.2.15,TCP,60,9001  >  35978 [ACK] Seq=16608185 Ack=307059183 Win=65535 Len=0
1,4.438204999999471,62.210.85.178,10.0.2.15,TCP,60,9001  >  35978 [ACK] Seq=16608185 Ack=307060643 Win=65535 Len=0
1,4.43824499999937,10.0.2.15,62.210.85.178,TLSv1.2,1204,Application Data
1,4.438310999999885,10.0.2.15,62.210.85.178,TCP,2974,35978  >  9001 [ACK] Seq=307061793 Ack=16608185 Win=65535 Len=2920 [TCP segment of a reassembled PDU]
1,4.4383469999993395,62.210.85.178,10.0.2.15,TCP,60,9001  >  35978 [ACK] Seq=16608185 Ack=307061793 Win=65535 Len=0
1,4.43835399999989,62.210.85.178,10.0.2.15,TCP,60,9001  >  35978 [ACK] Seq=16608185 Ack=307063253 Win=65535 Len=0
1,4.438357999999425,62.210.85.178,10.0.2.15,TCP,60,9001  >  35978 [ACK] Seq=16608185 Ack=307064713 Win=65535 Len=0
1,4.438392000000022,10.0.2.15,62.210.85.178,TLSv1.2,1204,Application Data
1,4.43845599999986,10.0.2.15,62.210.85.178,TCP,2974,35978  >  9001 [ACK] Seq=307065863 Ack=16608185 Win=65535 Len=2920 [TCP segment of a reassembled PDU]
1,4.438491999999314,62.210.85.178,10.0.2.15,TCP,60,9001  >  35978 [ACK] Seq=16608185 Ack=307065863 Win=65535 Len=0
1,4.438497999999527,62.210.85.178,10.0.2.15,TCP,60,9001  >  35978 [ACK] Seq=16608185 Ack=307067323 Win=65535 Len=0
1,4.4385029999994,62.210.85.178,10.0.2.15,TCP,60,9001  >  35978 [ACK] Seq=16608185 Ack=307068783 Win=65535 Len=0
1,4.438532999999552,10.0.2.15,62.210.85.178,TLSv1.2,1204,Application Data
1,4.43864399999984,62.210.85.178,10.0.2.15,TCP,60,9001  >  35978 [ACK] Seq=16608185 Ack=307069933 Win=65535 Len=0
1,4.43870699999934,10.0.2.15,62.210.85.178,TLSv1.2,332,Application Data
1,4.43881699999929,62.210.85.178,10.0.2.15,TCP,60,9001  >  35978 [ACK] Seq=16608185 Ack=307070211 Win=65535 Len=0
1,4.438857000000098,10.0.2.15,62.210.85.178,TLSv1.2,590,Application Data
1,4.438897999999426,62.210.85.178,10.0.2.15,TCP,60,9001  >  35978 [ACK] Seq=16608185 Ack=307070747 Win=65535 Len=0
1,4.523799999999937,54.93.77.70,10.0.2.15,TLSv1.2,590,Application Data
1,4.5519369999992705,54.93.77.70,10.0.2.15,TLSv1.2,7294,"Application Data, Application Data"
1,4.552061999999751,10.0.2.15,54.93.77.70,TCP,54,34692  >  9001 [ACK] Seq=16654707 Ack=306686807 Win=65535 Len=0
1,4.563043000000107,54.93.77.70,10.0.2.15,TCP,2950,"9001  >  34692 [PSH, ACK] Seq=306686807 Ack=16654707 Win=65535 Len=2896 [TCP segment of a reassembled PDU]"
1,4.563143999999738,10.0.2.15,54.93.77.70,TCP,54,34692  >  9001 [ACK] Seq=16654707 Ack=306689703 Win=65535 Len=0
1,4.5632949999999255,54.93.77.70,10.0.2.15,TLSv1.2,778,Application Data
1,4.580926999999974,54.93.77.70,10.0.2.15,TLSv1.2,1104,Application Data
1,4.581037999999353,10.0.2.15,54.93.77.70,TCP,54,34692  >  9001 [ACK] Seq=16654707 Ack=306691477 Win=65535 Len=0
1,4.582121999999799,54.93.77.70,10.0.2.15,TLSv1.2,5846,Application Data
1,4.582202999999936,10.0.2.15,54.93.77.70,TCP,54,34692  >  9001 [ACK] Seq=16654707 Ack=306697269 Win=65535 Len=0
1,4.583201999999801,54.93.77.70,10.0.2.15,TCP,1502,"9001  >  34692 [PSH, ACK] Seq=306697269 Ack=16654707 Win=65535 Len=1448 [TCP segment of a reassembled PDU]"
1,4.583243999999468,10.0.2.15,54.93.77.70,TCP,54,34692  >  9001 [ACK] Seq=16654707 Ack=306698717 Win=65535 Len=0
1,4.590161999999509,54.93.77.70,10.0.2.15,TLSv1.2,5846,"Application Data, Application Data, Application Data"
1,4.590241999999307,10.0.2.15,54.93.77.70,TCP,54,34692  >  9001 [ACK] Seq=16654707 Ack=306704509 Win=65535 Len=0
1,4.590773999999328,54.93.77.70,10.0.2.15,TLSv1.2,5846,Application Data [TCP segment of a reassembled PDU]
1,4.5908199999994395,10.0.2.15,54.93.77.70,TCP,54,34692  >  9001 [ACK] Seq=16654707 Ack=306710301 Win=65535 Len=0
1,4.591027999999824,10.0.2.15,54.93.77.70,TLSv1.2,590,Application Data
1,4.591139000000112,54.93.77.70,10.0.2.15,TCP,60,9001  >  34692 [ACK] Seq=306710301 Ack=16655243 Win=65535 Len=0
1,4.597292999999809,54.93.77.70,10.0.2.15,TLSv1.2,1408,Application Data
1,4.638517999999749,54.93.77.70,10.0.2.15,TLSv1.2,7294,Application Data
1,4.638541999999688,54.93.77.70,10.0.2.15,TLSv1.2,3160,"Application Data, Application Data"
1,4.6385849999996935,10.0.2.15,54.93.77.70,TCP,54,34692  >  9001 [ACK] Seq=16655243 Ack=306718895 Win=65535 Len=0
1,4.638667999999598,10.0.2.15,54.93.77.70,TCP,54,34692  >  9001 [ACK] Seq=16655243 Ack=306722001 Win=65535 Len=0
1,4.652758999999605,54.93.77.70,10.0.2.15,TCP,1502,"9001  >  34692 [PSH, ACK] Seq=306722001 Ack=16655243 Win=65535 Len=1448 [TCP segment of a reassembled PDU]"
1,4.652806000000055,10.0.2.15,54.93.77.70,TCP,54,34692  >  9001 [ACK] Seq=16655243 Ack=306723449 Win=65535 Len=0
1,4.655989999999292,54.93.77.70,10.0.2.15,TLSv1.2,684,Application Data
1,4.65616399999999,10.0.2.15,54.93.77.70,TLSv1.2,590,Application Data
1,4.656239999999343,54.93.77.70,10.0.2.15,TCP,60,9001  >  34692 [ACK] Seq=306724079 Ack=16655779 Win=65535 Len=0
1,4.666376999999557,10.0.2.15,54.93.77.70,TLSv1.2,590,Application Data
1,4.666542999999365,54.93.77.70,10.0.2.15,TCP,60,9001  >  34692 [ACK] Seq=306724079 Ack=16656315 Win=65535 Len=0
1,4.70332099999996,62.210.85.178,10.0.2.15,TLSv1.2,590,Application Data
1,4.745291999999608,10.0.2.15,62.210.85.178,TCP,54,35978  >  9001 [ACK] Seq=307070747 Ack=16608721 Win=65535 Len=0
1,4.763817999999446,62.210.85.178,10.0.2.15,TLSv1.2,590,Application Data
1,4.763881999999285,10.0.2.15,62.210.85.178,TCP,54,35978  >  9001 [ACK] Seq=307070747 Ack=16609257 Win=65535 Len=0
1,5.026990999999725,62.210.85.178,10.0.2.15,TLSv1.2,590,Application Data
1,5.0270739999996295,10.0.2.15,62.210.85.178,TCP,54,35978  >  9001 [ACK] Seq=307070747 Ack=16609793 Win=65535 Len=0
1,5.02758300000005,10.0.2.15,62.210.85.178,TLSv1.2,590,Application Data
1,5.0277159999996,62.210.85.178,10.0.2.15,TCP,60,9001  >  35978 [ACK] Seq=16609793 Ack=307071283 Win=65535 Len=0
1,5.137370999999803,54.93.77.70,10.0.2.15,TLSv1.2,590,Application Data
1,5.137804999999389,10.0.2.15,54.93.77.70,TLSv1.2,590,Application Data
1,5.137936999999511,54.93.77.70,10.0.2.15,TCP,60,9001  >  34692 [ACK] Seq=306724615 Ack=16656851 Win=65535 Len=0
1,5.2498939999995855,62.210.85.178,10.0.2.15,TLSv1.2,590,Application Data
1,5.259662999999819,10.0.2.15,62.210.85.178,TLSv1.2,590,Application Data
1,5.259806999999455,62.210.85.178,10.0.2.15,TCP,60,9001  >  35978 [ACK] Seq=16610329 Ack=307071819 Win=65535 Len=0
1,5.270596999999725,10.0.2.15,62.210.85.178,TLSv1.2,4124,Application Data
1,5.270715999999993,10.0.2.15,62.210.85.178,TCP,2974,35978  >  9001 [ACK] Seq=307075889 Ack=16610329 Win=65535 Len=2920 [TCP segment of a reassembled PDU]
1,5.270758999999998,62.210.85.178,10.0.2.15,TCP,60,9001  >  35978 [ACK] Seq=16610329 Ack=307073279 Win=65535 Len=0
1,5.270770000000084,62.210.85.178,10.0.2.15,TCP,60,9001  >  35978 [ACK] Seq=16610329 Ack=307074739 Win=65535 Len=0
1,5.270774999999958,62.210.85.178,10.0.2.15,TCP,60,9001  >  35978 [ACK] Seq=16610329 Ack=307075889 Win=65535 Len=0
1,5.270778999999493,62.210.85.178,10.0.2.15,TCP,60,9001  >  35978 [ACK] Seq=16610329 Ack=307077349 Win=65535 Len=0
1,5.270782999999938,62.210.85.178,10.0.2.15,TCP,60,9001  >  35978 [ACK] Seq=16610329 Ack=307078809 Win=65535 Len=0
1,5.270826999999372,10.0.2.15,62.210.85.178,TLSv1.2,1204,Application Data
1,5.270923000000039,62.210.85.178,10.0.2.15,TCP,60,9001  >  35978 [ACK] Seq=16610329 Ack=307079959 Win=65535 Len=0
1,5.27098500000011,10.0.2.15,62.210.85.178,TLSv1.2,4124,Application Data
1,5.271076999999423,62.210.85.178,10.0.2.15,TCP,60,9001  >  35978 [ACK] Seq=16610329 Ack=307081419 Win=65535 Len=0
1,5.271088999999847,62.210.85.178,10.0.2.15,TCP,60,9001  >  35978 [ACK] Seq=16610329 Ack=307082879 Win=65535 Len=0
1,5.271093999999721,62.210.85.178,10.0.2.15,TCP,60,9001  >  35978 [ACK] Seq=16610329 Ack=307084029 Win=65535 Len=0
1,5.271148999999241,10.0.2.15,62.210.85.178,TLSv1.2,4124,Application Data
1,5.271244999999908,62.210.85.178,10.0.2.15,TCP,60,9001  >  35978 [ACK] Seq=16610329 Ack=307085489 Win=65535 Len=0
1,5.271252999999888,62.210.85.178,10.0.2.15,TCP,60,9001  >  35978 [ACK] Seq=16610329 Ack=307086949 Win=65535 Len=0
1,5.2712579999997615,62.210.85.178,10.0.2.15,TCP,60,9001  >  35978 [ACK] Seq=16610329 Ack=307088099 Win=65535 Len=0
1,5.271291999999448,10.0.2.15,62.210.85.178,TLSv1.2,332,Application Data
1,5.271347999999307,10.0.2.15,62.210.85.178,TCP,2974,35978  >  9001 [ACK] Seq=307088377 Ack=16610329 Win=65535 Len=2920 [TCP segment of a reassembled PDU]
1,5.271383999999671,62.210.85.178,10.0.2.15,TCP,60,9001  >  35978 [ACK] Seq=16610329 Ack=307088377 Win=65535 Len=0
1,5.271389999999883,62.210.85.178,10.0.2.15,TCP,60,9001  >  35978 [ACK] Seq=16610329 Ack=307089837 Win=65535 Len=0
1,5.271393999999418,62.210.85.178,10.0.2.15,TCP,60,9001  >  35978 [ACK] Seq=16610329 Ack=307091297 Win=65535 Len=0
1,5.2714289999994435,10.0.2.15,62.210.85.178,TLSv1.2,948,Application Data
1,5.2715019999996,62.210.85.178,10.0.2.15,TCP,60,9001  >  35978 [ACK] Seq=16610329 Ack=307092191 Win=65535 Len=0
1,5.271539999999732,10.0.2.15,62.210.85.178,TLSv1.2,4124,Application Data
1,5.271578999999292,62.210.85.178,10.0.2.15,TCP,60,9001  >  35978 [ACK] Seq=16610329 Ack=307093651 Win=65535 Len=0
1,5.271585999999843,62.210.85.178,10.0.2.15,TCP,60,9001  >  35978 [ACK] Seq=16610329 Ack=307095111 Win=65535 Len=0
1,5.271589999999378,62.210.85.178,10.0.2.15,TCP,60,9001  >  35978 [ACK] Seq=16610329 Ack=307096261 Win=65535 Len=0
1,5.271635999999489,10.0.2.15,62.210.85.178,TLSv1.2,3030,Application Data
1,5.271676999999727,62.210.85.178,10.0.2.15,TCP,60,9001  >  35978 [ACK] Seq=16610329 Ack=307097721 Win=65535 Len=0
1,5.271682999999939,62.210.85.178,10.0.2.15,TCP,60,9001  >  35978 [ACK] Seq=16610329 Ack=307099181 Win=65535 Len=0
1,5.271687999999813,62.210.85.178,10.0.2.15,TCP,60,9001  >  35978 [ACK] Seq=16610329 Ack=307099237 Win=65535 Len=0
1,5.280910999999833,10.0.2.15,62.210.85.178,TLSv1.2,4124,Application Data
1,5.281031999999868,10.0.2.15,62.210.85.178,TCP,2974,35978  >  9001 [ACK] Seq=307103307 Ack=16610329 Win=65535 Len=2920 [TCP segment of a reassembled PDU]
1,5.281056999999237,62.210.85.178,10.0.2.15,TCP,60,9001  >  35978 [ACK] Seq=16610329 Ack=307100697 Win=65535 Len=0
1,5.281065000000126,62.210.85.178,10.0.2.15,TCP,60,9001  >  35978 [ACK] Seq=16610329 Ack=307102157 Win=65535 Len=0
1,5.281070999999429,62.210.85.178,10.0.2.15,TCP,60,9001  >  35978 [ACK] Seq=16610329 Ack=307103307 Win=65535 Len=0
1,5.281109999999899,10.0.2.15,62.210.85.178,TLSv1.2,1204,Application Data
1,5.281161999999313,62.210.85.178,10.0.2.15,TCP,60,9001  >  35978 [ACK] Seq=16610329 Ack=307104767 Win=65535 Len=0
1,5.281167999999525,62.210.85.178,10.0.2.15,TCP,60,9001  >  35978 [ACK] Seq=16610329 Ack=307106227 Win=65535 Len=0
1,5.281245999999555,62.210.85.178,10.0.2.15,TCP,60,9001  >  35978 [ACK] Seq=16610329 Ack=307107377 Win=65535 Len=0
1,5.28130499999952,10.0.2.15,62.210.85.178,TLSv1.2,4124,Application Data
1,5.281348999999864,62.210.85.178,10.0.2.15,TCP,60,9001  >  35978 [ACK] Seq=16610329 Ack=307108837 Win=65535 Len=0
1,5.281355999999505,62.210.85.178,10.0.2.15,TCP,60,9001  >  35978 [ACK] Seq=16610329 Ack=307110297 Win=65535 Len=0
1,5.28135999999995,62.210.85.178,10.0.2.15,TCP,60,9001  >  35978 [ACK] Seq=16610329 Ack=307111447 Win=65535 Len=0
1,5.2814079999998285,10.0.2.15,62.210.85.178,TLSv1.2,4124,Application Data
1,5.2814479999997275,62.210.85.178,10.0.2.15,TCP,60,9001  >  35978 [ACK] Seq=16610329 Ack=307112907 Win=65535 Len=0
1,5.28145399999994,62.210.85.178,10.0.2.15,TCP,60,9001  >  35978 [ACK] Seq=16610329 Ack=307114367 Win=65535 Len=0
1,5.281458999999813,62.210.85.178,10.0.2.15,TCP,60,9001  >  35978 [ACK] Seq=16610329 Ack=307115517 Win=65535 Len=0
1,5.281500000000051,10.0.2.15,62.210.85.178,TLSv1.2,332,Application Data
1,5.281537999999273,62.210.85.178,10.0.2.15,TCP,60,9001  >  35978 [ACK] Seq=16610329 Ack=307115795 Win=65535 Len=0
1,5.2815959999998086,10.0.2.15,62.210.85.178,TLSv1.2,3868,Application Data
1,5.281637999999475,62.210.85.178,10.0.2.15,TCP,60,9001  >  35978 [ACK] Seq=16610329 Ack=307117255 Win=65535 Len=0
1,5.281643999999687,62.210.85.178,10.0.2.15,TCP,60,9001  >  35978 [ACK] Seq=16610329 Ack=307118715 Win=65535 Len=0
1,5.281648999999561,62.210.85.178,10.0.2.15,TCP,60,9001  >  35978 [ACK] Seq=16610329 Ack=307119609 Win=65535 Len=0
1,5.281694999999672,10.0.2.15,62.210.85.178,TLSv1.2,4124,Application Data
1,5.281733999999233,62.210.85.178,10.0.2.15,TCP,60,9001  >  35978 [ACK] Seq=16610329 Ack=307121069 Win=65535 Len=0
1,5.281739999999445,62.210.85.178,10.0.2.15,TCP,60,9001  >  35978 [ACK] Seq=16610329 Ack=307122529 Win=65535 Len=0
1,5.281744999999319,62.210.85.178,10.0.2.15,TCP,60,9001  >  35978 [ACK] Seq=16610329 Ack=307123679 Win=65535 Len=0
1,5.281787999999324,10.0.2.15,62.210.85.178,TLSv1.2,3030,Application Data
1,5.2818299999999,62.210.85.178,10.0.2.15,TCP,60,9001  >  35978 [ACK] Seq=16610329 Ack=307125139 Win=65535 Len=0
1,5.281836999999541,62.210.85.178,10.0.2.15,TCP,60,9001  >  35978 [ACK] Seq=16610329 Ack=307126599 Win=65535 Len=0
1,5.281841999999415,62.210.85.178,10.0.2.15,TCP,60,9001  >  35978 [ACK] Seq=16610329 Ack=307126655 Win=65535 Len=0
1,5.294504999999845,10.0.2.15,62.210.85.178,TLSv1.2,4124,Application Data
1,5.2948379999998,10.0.2.15,62.210.85.178,TCP,2974,35978  >  9001 [ACK] Seq=307130725 Ack=16610329 Win=65535 Len=2920 [TCP segment of a reassembled PDU]
1,5.294973000000027,62.210.85.178,10.0.2.15,TCP,60,9001  >  35978 [ACK] Seq=16610329 Ack=307128115 Win=65535 Len=0
1,5.295078999999532,62.210.85.178,10.0.2.15,TCP,60,9001  >  35978 [ACK] Seq=16610329 Ack=307129575 Win=65535 Len=0
1,5.295089999999618,62.210.85.178,10.0.2.15,TCP,60,9001  >  35978 [ACK] Seq=16610329 Ack=307130725 Win=65535 Len=0
1,5.295094999999492,62.210.85.178,10.0.2.15,TCP,60,9001  >  35978 [ACK] Seq=16610329 Ack=307132185 Win=65535 Len=0
1,5.2950989999999365,62.210.85.178,10.0.2.15,TCP,60,9001  >  35978 [ACK] Seq=16610329 Ack=307133645 Win=65535 Len=0
1,5.295151999999689,10.0.2.15,62.210.85.178,TLSv1.2,1204,Application Data
1,5.295301000000109,62.210.85.178,10.0.2.15,TCP,60,9001  >  35978 [ACK] Seq=16610329 Ack=307134795 Win=65535 Len=0
1,5.295376999999462,10.0.2.15,62.210.85.178,TCP,2974,35978  >  9001 [ACK] Seq=307134795 Ack=16610329 Win=65535 Len=2920 [TCP segment of a reassembled PDU]
1,5.295446000000084,10.0.2.15,62.210.85.178,TLSv1.2,1204,Application Data
1,5.295498999999836,62.210.85.178,10.0.2.15,TCP,60,9001  >  35978 [ACK] Seq=16610329 Ack=307136255 Win=65535 Len=0
1,5.295507999999245,62.210.85.178,10.0.2.15,TCP,60,9001  >  35978 [ACK] Seq=16610329 Ack=307137715 Win=65535 Len=0
1,5.295513000000028,62.210.85.178,10.0.2.15,TCP,60,9001  >  35978 [ACK] Seq=16610329 Ack=307138865 Win=65535 Len=0
1,5.295583000000079,10.0.2.15,62.210.85.178,TLSv1.2,4124,Application Data
1,5.295731999999589,62.210.85.178,10.0.2.15,TCP,60,9001  >  35978 [ACK] Seq=16610329 Ack=307140325 Win=65535 Len=0
1,5.2957479999995485,62.210.85.178,10.0.2.15,TCP,60,9001  >  35978 [ACK] Seq=16610329 Ack=307141785 Win=65535 Len=0
1,5.295752999999422,62.210.85.178,10.0.2.15,TCP,60,9001  >  35978 [ACK] Seq=16610329 Ack=307142935 Win=65535 Len=0
1,5.295814999999493,10.0.2.15,62.210.85.178,TLSv1.2,332,Application Data
1,5.295933999999761,62.210.85.178,10.0.2.15,TCP,60,9001  >  35978 [ACK] Seq=16610329 Ack=307143213 Win=65535 Len=0
1,5.2959860000000845,10.0.2.15,62.210.85.178,TCP,1514,35978  >  9001 [ACK] Seq=307143213 Ack=16610329 Win=65535 Len=1460 [TCP segment of a reassembled PDU]
1,5.296050999999352,10.0.2.15,62.210.85.178,TLSv1.2,158,Application Data
1,5.296096000000034,62.210.85.178,10.0.2.15,TCP,60,9001  >  35978 [ACK] Seq=16610329 Ack=307144673 Win=65535 Len=0
1,5.296118999999635,62.210.85.178,10.0.2.15,TCP,60,9001  >  35978 [ACK] Seq=16610329 Ack=307144777 Win=65535 Len=0
1,5.3704939999997805,54.93.77.70,10.0.2.15,TLSv1.2,590,Application Data
1,5.3824879999992845,54.93.77.70,10.0.2.15,TLSv1.2,7294,Application Data
1,5.382587000000058,10.0.2.15,54.93.77.70,TCP,54,34692  >  9001 [ACK] Seq=16656851 Ack=306732391 Win=65535 Len=0
1,5.399919999999838,54.93.77.70,10.0.2.15,TLSv1.2,568,Application Data
1,5.441297999999733,10.0.2.15,54.93.77.70,TCP,54,34692  >  9001 [ACK] Seq=16656851 Ack=306732905 Win=65535 Len=0
1,5.452524999999696,54.93.77.70,10.0.2.15,TLSv1.2,7294,Application Data
1,5.452581999999893,10.0.2.15,54.93.77.70,TCP,54,34692  >  9001 [ACK] Seq=16656851 Ack=306740145 Win=65535 Len=0
1,5.452906999999868,54.93.77.70,10.0.2.15,TLSv1.2,4398,Application Data [TCP segment of a reassembled PDU]
1,5.452946999999767,10.0.2.15,54.93.77.70,TCP,54,34692  >  9001 [ACK] Seq=16656851 Ack=306744489 Win=65535 Len=0
1,5.458546999999271,54.93.77.70,10.0.2.15,TLSv1.2,358,Application Data
1,5.458896999999524,10.0.2.15,54.93.77.70,TCP,54,34692  >  9001 [ACK] Seq=16656851 Ack=306744793 Win=65535 Len=0
1,5.4619519999996555,54.93.77.70,10.0.2.15,TLSv1.2,4398,Application Data
1,5.462145999999848,10.0.2.15,54.93.77.70,TCP,54,34692  >  9001 [ACK] Seq=16656851 Ack=306749137 Win=65535 Len=0
1,5.462281000000075,54.93.77.70,10.0.2.15,TLSv1.2,4398,Application Data [TCP segment of a reassembled PDU]
1,5.462332999999489,10.0.2.15,54.93.77.70,TCP,54,34692  >  9001 [ACK] Seq=16656851 Ack=306753481 Win=65535 Len=0
1,5.463106999999582,10.0.2.15,54.93.77.70,TLSv1.2,590,Application Data
1,5.463380999999572,54.93.77.70,10.0.2.15,TCP,60,9001  >  34692 [ACK] Seq=306753481 Ack=16657387 Win=65535 Len=0
1,5.474860999999692,54.93.77.70,10.0.2.15,TLSv1.2,7294,"Application Data, Application Data"
1,5.474930999999742,10.0.2.15,54.93.77.70,TCP,54,34692  >  9001 [ACK] Seq=16657387 Ack=306760721 Win=65535 Len=0
1,5.474983000000066,54.93.77.70,10.0.2.15,TLSv1.2,684,Application Data
1,5.514900000000125,54.93.77.70,10.0.2.15,TLSv1.2,3674,Application Data
1,5.514971999999943,10.0.2.15,54.93.77.70,TCP,54,34692  >  9001 [ACK] Seq=16657387 Ack=306764971 Win=65535 Len=0
1,5.522556999999324,54.93.77.70,10.0.2.15,TLSv1.2,7294,Application Data
1,5.522627999999713,10.0.2.15,54.93.77.70,TCP,54,34692  >  9001 [ACK] Seq=16657387 Ack=306772211 Win=65535 Len=0
1,5.5230609999998705,54.93.77.70,10.0.2.15,TLSv1.2,2950,Application Data [TCP segment of a reassembled PDU]
1,5.5231009999997696,10.0.2.15,54.93.77.70,TCP,54,34692  >  9001 [ACK] Seq=16657387 Ack=306775107 Win=65535 Len=0
1,5.531026999999995,54.93.77.70,10.0.2.15,TLSv1.2,264,Application Data
1,5.542236999999659,54.93.77.70,10.0.2.15,TCP,2950,"9001  >  34692 [PSH, ACK] Seq=306775317 Ack=16657387 Win=65535 Len=2896 [TCP segment of a reassembled PDU]"
1,5.542287999999644,10.0.2.15,54.93.77.70,TCP,54,34692  >  9001 [ACK] Seq=16657387 Ack=306778213 Win=65535 Len=0
1,5.547442000000046,54.93.77.70,10.0.2.15,TLSv1.2,778,Application Data
1,5.547599999999875,10.0.2.15,54.93.77.70,TLSv1.2,1104,Application Data
1,5.547708000000057,54.93.77.70,10.0.2.15,TCP,60,9001  >  34692 [ACK] Seq=306778937 Ack=16658437 Win=65535 Len=0
1,5.564437999999427,54.93.77.70,10.0.2.15,TLSv1.2,3160,Application Data
1,5.564590999999382,10.0.2.15,54.93.77.70,TCP,54,34692  >  9001 [ACK] Seq=16658437 Ack=306782043 Win=65535 Len=0
1,5.576263999999355,54.93.77.70,10.0.2.15,TCP,2950,"9001  >  34692 [PSH, ACK] Seq=306782043 Ack=16658437 Win=65535 Len=2896 [TCP segment of a reassembled PDU]"
1,5.576305999999931,54.93.77.70,10.0.2.15,TLSv1.2,4398,"Application Data, Application Data"
1,5.576357999999345,10.0.2.15,54.93.77.70,TCP,54,34692  >  9001 [ACK] Seq=16658437 Ack=306784939 Win=65535 Len=0
1,5.57646399999976,10.0.2.15,54.93.77.70,TCP,54,34692  >  9001 [ACK] Seq=16658437 Ack=306789283 Win=65535 Len=0
1,5.582705999999234,62.210.85.178,10.0.2.15,TLSv1.2,590,Application Data
1,5.587411999999858,54.93.77.70,10.0.2.15,TLSv1.2,6780,"Application Data, Application Data"
1,5.587463999999272,10.0.2.15,54.93.77.70,TCP,54,34692  >  9001 [ACK] Seq=16658437 Ack=306796009 Win=65535 Len=0
1,5.601416999999856,54.93.77.70,10.0.2.15,TCP,1502,"9001  >  34692 [PSH, ACK] Seq=306796009 Ack=16658437 Win=65535 Len=1448 [TCP segment of a reassembled PDU]"
1,5.601467999999841,10.0.2.15,54.93.77.70,TCP,54,34692  >  9001 [ACK] Seq=16658437 Ack=306797457 Win=65535 Len=0
1,5.604308999999375,54.93.77.70,10.0.2.15,TLSv1.2,684,Application Data
1,5.606894999999895,10.0.2.15,54.93.77.70,TLSv1.2,590,Application Data
1,5.607054000000062,54.93.77.70,10.0.2.15,TCP,60,9001  >  34692 [ACK] Seq=306798087 Ack=16658973 Win=65535 Len=0
1,5.625337999999829,10.0.2.15,62.210.85.178,TCP,54,35978  >  9001 [ACK] Seq=307144777 Ack=16610865 Win=65535 Len=0
1,5.657556999999542,62.210.85.178,10.0.2.15,TLSv1.2,1104,Application Data
1,5.657766999999694,10.0.2.15,62.210.85.178,TCP,54,35978  >  9001 [ACK] Seq=307144777 Ack=16611915 Win=65535 Len=0
1,5.724811999999474,62.210.85.178,10.0.2.15,TLSv1.2,590,Application Data
1,5.7248859999999695,10.0.2.15,62.210.85.178,TCP,54,35978  >  9001 [ACK] Seq=307144777 Ack=16612451 Win=65535 Len=0
1,5.725356999999349,10.0.2.15,62.210.85.178,TLSv1.2,590,Application Data
1,5.725559999999859,62.210.85.178,10.0.2.15,TCP,60,9001  >  35978 [ACK] Seq=16612451 Ack=307145313 Win=65535 Len=0
1,5.827639999999519,54.93.77.70,10.0.2.15,TLSv1.2,590,Application Data
1,5.8280439999998634,10.0.2.15,54.93.77.70,TLSv1.2,590,Application Data
1,5.828141999999389,54.93.77.70,10.0.2.15,TCP,60,9001  >  34692 [ACK] Seq=306798623 Ack=16659509 Win=65535 Len=0
1,5.984805000000051,62.210.85.178,10.0.2.15,TLSv1.2,590,Application Data
1,5.988158999999541,10.0.2.15,62.210.85.178,TLSv1.2,590,Application Data
1,5.988315999999941,62.210.85.178,10.0.2.15,TCP,60,9001  >  35978 [ACK] Seq=16612987 Ack=307145849 Win=65535 Len=0
1,5.997833999999784,10.0.2.15,62.210.85.178,TLSv1.2,4124,Application Data
1,5.99791599999935,10.0.2.15,62.210.85.178,TCP,2974,35978  >  9001 [ACK] Seq=307149919 Ack=16612987 Win=65535 Len=2920 [TCP segment of a reassembled PDU]
1,5.997957999999926,62.210.85.178,10.0.2.15,TCP,60,9001  >  35978 [ACK] Seq=16612987 Ack=307147309 Win=65535 Len=0
1,5.997965999999906,62.210.85.178,10.0.2.15,TCP,60,9001  >  35978 [ACK] Seq=16612987 Ack=307148769 Win=65535 Len=0
1,5.997969999999441,62.210.85.178,10.0.2.15,TCP,60,9001  >  35978 [ACK] Seq=16612987 Ack=307149919 Win=65535 Len=0
1,5.998006999999234,10.0.2.15,62.210.85.178,TLSv1.2,1204,Application Data
1,5.998042999999598,62.210.85.178,10.0.2.15,TCP,60,9001  >  35978 [ACK] Seq=16612987 Ack=307151379 Win=65535 Len=0
1,5.998049999999239,62.210.85.178,10.0.2.15,TCP,60,9001  >  35978 [ACK] Seq=16612987 Ack=307152839 Win=65535 Len=0
1,5.998052999999345,62.210.85.178,10.0.2.15,TCP,60,9001  >  35978 [ACK] Seq=16612987 Ack=307153989 Win=65535 Len=0
1,5.998092999999244,10.0.2.15,62.210.85.178,TLSv1.2,4124,Application Data
1,5.998460999999224,62.210.85.178,10.0.2.15,TCP,60,9001  >  35978 [ACK] Seq=16612987 Ack=307155449 Win=65535 Len=0
1,5.998472999999649,62.210.85.178,10.0.2.15,TCP,60,9001  >  35978 [ACK] Seq=16612987 Ack=307156909 Win=65535 Len=0
1,5.998475999999755,62.210.85.178,10.0.2.15,TCP,60,9001  >  35978 [ACK] Seq=16612987 Ack=307158059 Win=65535 Len=0
1,5.998555000000124,10.0.2.15,62.210.85.178,TLSv1.2,2324,Application Data
1,5.998610999999983,62.210.85.178,10.0.2.15,TCP,60,9001  >  35978 [ACK] Seq=16612987 Ack=307159519 Win=65535 Len=0
1,5.998619999999391,62.210.85.178,10.0.2.15,TCP,60,9001  >  35978 [ACK] Seq=16612987 Ack=307160329 Win=65535 Len=0
1,6.105782999999974,54.93.77.70,10.0.2.15,TLSv1.2,3674,Application Data
1,6.105919999999969,10.0.2.15,54.93.77.70,TCP,54,34692  >  9001 [ACK] Seq=16659509 Ack=306802243 Win=65535 Len=0
1,6.113910999999462,54.93.77.70,10.0.2.15,TCP,2950,"9001  >  34692 [PSH, ACK] Seq=306802243 Ack=16659509 Win=65535 Len=2896 [TCP segment of a reassembled PDU]"
1,6.113972000000103,10.0.2.15,54.93.77.70,TCP,54,34692  >  9001 [ACK] Seq=16659509 Ack=306805139 Win=65535 Len=0
1,6.1262849999993705,54.93.77.70,10.0.2.15,TLSv1.2,778,Application Data
1,6.169363999999405,10.0.2.15,54.93.77.70,TCP,54,34692  >  9001 [ACK] Seq=16659509 Ack=306805863 Win=65535 Len=0
1,6.559940999999526,54.93.77.70,10.0.2.15,TCP,2950,"9001  >  34692 [PSH, ACK] Seq=306805863 Ack=16659509 Win=65535 Len=2896 [TCP segment of a reassembled PDU]"
1,6.560036999999284,10.0.2.15,54.93.77.70,TCP,54,34692  >  9001 [ACK] Seq=16659509 Ack=306808759 Win=65535 Len=0
1,6.562747999999374,54.93.77.70,10.0.2.15,TLSv1.2,778,Application Data
1,6.562762999999904,54.93.77.70,10.0.2.15,TCP,2950,"9001  >  34692 [PSH, ACK] Seq=306809483 Ack=16659509 Win=65535 Len=2896 [TCP segment of a reassembled PDU]"
1,6.5628059999999095,10.0.2.15,54.93.77.70,TCP,54,34692  >  9001 [ACK] Seq=16659509 Ack=306809483 Win=65535 Len=0
1,6.5628459999998086,10.0.2.15,54.93.77.70,TCP,54,34692  >  9001 [ACK] Seq=16659509 Ack=306812379 Win=65535 Len=0
1,7.176169999999729,54.93.77.70,10.0.2.15,TLSv1.2,1314,"Application Data, Application Data"
1,7.176257999999507,10.0.2.15,54.93.77.70,TCP,54,34692  >  9001 [ACK] Seq=16659509 Ack=306813639 Win=65535 Len=0
1,7.178635999999642,10.0.2.15,54.93.77.70,TLSv1.2,590,Application Data
1,7.178806999999324,54.93.77.70,10.0.2.15,TCP,60,9001  >  34692 [ACK] Seq=306813639 Ack=16660045 Win=65535 Len=0
1,7.377220999999736,62.210.85.178,10.0.2.15,TLSv1.2,590,Application Data
1,7.377549999999246,10.0.2.15,62.210.85.178,TLSv1.2,590,Application Data
1,7.377668000000085,62.210.85.178,10.0.2.15,TCP,60,9001  >  35978 [ACK] Seq=16613523 Ack=307160865 Win=65535 Len=0
1,7.4838190000000395,54.93.77.70,10.0.2.15,TLSv1.2,590,Application Data
1,7.484263999999712,10.0.2.15,54.93.77.70,TLSv1.2,590,Application Data
1,7.484379999999874,54.93.77.70,10.0.2.15,TCP,60,9001  >  34692 [ACK] Seq=306814175 Ack=16660581 Win=65535 Len=0
1,7.587987999999314,62.210.85.178,10.0.2.15,TLSv1.2,590,Application Data
1,7.592545999999857,10.0.2.15,62.210.85.178,TLSv1.2,590,Application Data
1,7.592705999999453,62.210.85.178,10.0.2.15,TCP,60,9001  >  35978 [ACK] Seq=16614059 Ack=307161401 Win=65535 Len=0
1,7.606156999999257,10.0.2.15,62.210.85.178,TLSv1.2,4124,Application Data
1,7.606283000000076,10.0.2.15,62.210.85.178,TCP,2974,35978  >  9001 [ACK] Seq=307165471 Ack=16614059 Win=65535 Len=2920 [TCP segment of a reassembled PDU]
1,7.606332999999722,62.210.85.178,10.0.2.15,TCP,60,9001  >  35978 [ACK] Seq=16614059 Ack=307162861 Win=65535 Len=0
1,7.606344999999237,62.210.85.178,10.0.2.15,TCP,60,9001  >  35978 [ACK] Seq=16614059 Ack=307164321 Win=65535 Len=0
1,7.60635000000002,62.210.85.178,10.0.2.15,TCP,60,9001  >  35978 [ACK] Seq=16614059 Ack=307165471 Win=65535 Len=0
1,7.6063930000000255,10.0.2.15,62.210.85.178,TLSv1.2,1204,Application Data
1,7.6064329999999245,62.210.85.178,10.0.2.15,TCP,60,9001  >  35978 [ACK] Seq=16614059 Ack=307166931 Win=65535 Len=0
1,7.606438999999227,62.210.85.178,10.0.2.15,TCP,60,9001  >  35978 [ACK] Seq=16614059 Ack=307168391 Win=65535 Len=0
1,7.606442999999672,62.210.85.178,10.0.2.15,TCP,60,9001  >  35978 [ACK] Seq=16614059 Ack=307169541 Win=65535 Len=0
1,7.6064849999993385,10.0.2.15,62.210.85.178,TLSv1.2,4124,Application Data
1,7.606541999999536,62.210.85.178,10.0.2.15,TCP,60,9001  >  35978 [ACK] Seq=16614059 Ack=307171001 Win=65535 Len=0
1,7.6066009999995,62.210.85.178,10.0.2.15,TCP,60,9001  >  35978 [ACK] Seq=16614059 Ack=307172461 Win=65535 Len=0
1,7.606609999999819,62.210.85.178,10.0.2.15,TCP,60,9001  >  35978 [ACK] Seq=16614059 Ack=307173611 Win=65535 Len=0
1,7.6066579999996975,10.0.2.15,62.210.85.178,TLSv1.2,4124,Application Data
1,7.606719999999768,62.210.85.178,10.0.2.15,TCP,60,9001  >  35978 [ACK] Seq=16614059 Ack=307175071 Win=65535 Len=0
1,7.606727999999748,62.210.85.178,10.0.2.15,TCP,60,9001  >  35978 [ACK] Seq=16614059 Ack=307176531 Win=65535 Len=0
1,7.60674999999992,62.210.85.178,10.0.2.15,TCP,60,9001  >  35978 [ACK] Seq=16614059 Ack=307177681 Win=65535 Len=0
1,7.606785999999374,10.0.2.15,62.210.85.178,TLSv1.2,332,Application Data
1,7.606841999999233,62.210.85.178,10.0.2.15,TCP,60,9001  >  35978 [ACK] Seq=16614059 Ack=307177959 Win=65535 Len=0
1,7.6068969999996625,10.0.2.15,62.210.85.178,TLSv1.2,3868,Application Data
1,7.606934999999794,62.210.85.178,10.0.2.15,TCP,60,9001  >  35978 [ACK] Seq=16614059 Ack=307179419 Win=65535 Len=0
1,7.606941999999435,62.210.85.178,10.0.2.15,TCP,60,9001  >  35978 [ACK] Seq=16614059 Ack=307180879 Win=65535 Len=0
1,7.606944999999541,62.210.85.178,10.0.2.15,TCP,60,9001  >  35978 [ACK] Seq=16614059 Ack=307181773 Win=65535 Len=0
1,7.606981999999334,10.0.2.15,62.210.85.178,TLSv1.2,4124,Application Data
1,7.6070169999993595,62.210.85.178,10.0.2.15,TCP,60,9001  >  35978 [ACK] Seq=16614059 Ack=307183233 Win=65535 Len=0
1,7.60702399999991,62.210.85.178,10.0.2.15,TCP,60,9001  >  35978 [ACK] Seq=16614059 Ack=307184693 Win=65535 Len=0
1,7.607027000000016,62.210.85.178,10.0.2.15,TCP,60,9001  >  35978 [ACK] Seq=16614059 Ack=307185843 Win=65535 Len=0
1,7.607062000000042,10.0.2.15,62.210.85.178,TLSv1.2,3030,Application Data
1,7.607097999999496,62.210.85.178,10.0.2.15,TCP,60,9001  >  35978 [ACK] Seq=16614059 Ack=307187303 Win=65535 Len=0
1,7.607105000000047,62.210.85.178,10.0.2.15,TCP,60,9001  >  35978 [ACK] Seq=16614059 Ack=307188763 Win=65535 Len=0
1,7.607106999999814,62.210.85.178,10.0.2.15,TCP,60,9001  >  35978 [ACK] Seq=16614059 Ack=307188819 Win=65535 Len=0
1,7.616285000000062,10.0.2.15,62.210.85.178,TLSv1.2,4124,Application Data
1,7.6163339999993696,62.210.85.178,10.0.2.15,TCP,60,9001  >  35978 [ACK] Seq=16614059 Ack=307190279 Win=65535 Len=0
1,7.616344000000026,62.210.85.178,10.0.2.15,TCP,60,9001  >  35978 [ACK] Seq=16614059 Ack=307191739 Win=65535 Len=0
1,7.6163489999999,62.210.85.178,10.0.2.15,TCP,60,9001  >  35978 [ACK] Seq=16614059 Ack=307192889 Win=65535 Len=0
1,7.61639599999944,10.0.2.15,62.210.85.178,TLSv1.2,4124,Application Data
1,7.616454999999405,62.210.85.178,10.0.2.15,TCP,60,9001  >  35978 [ACK] Seq=16614059 Ack=307194349 Win=65535 Len=0
1,7.616461999999956,62.210.85.178,10.0.2.15,TCP,60,9001  >  35978 [ACK] Seq=16614059 Ack=307195809 Win=65535 Len=0
1,7.616465000000062,62.210.85.178,10.0.2.15,TCP,60,9001  >  35978 [ACK] Seq=16614059 Ack=307196959 Win=65535 Len=0
1,7.616500999999516,10.0.2.15,62.210.85.178,TLSv1.2,4124,Application Data
1,7.616533999999774,62.210.85.178,10.0.2.15,TCP,60,9001  >  35978 [ACK] Seq=16614059 Ack=307198419 Win=65535 Len=0
1,7.616541999999754,62.210.85.178,10.0.2.15,TCP,60,9001  >  35978 [ACK] Seq=16614059 Ack=307199879 Win=65535 Len=0
1,7.616545999999289,62.210.85.178,10.0.2.15,TCP,60,9001  >  35978 [ACK] Seq=16614059 Ack=307201029 Win=65535 Len=0
1,7.616580999999314,10.0.2.15,62.210.85.178,TLSv1.2,2324,Application Data
1,7.616613999999572,62.210.85.178,10.0.2.15,TCP,60,9001  >  35978 [ACK] Seq=16614059 Ack=307202489 Win=65535 Len=0
1,7.616621999999552,62.210.85.178,10.0.2.15,TCP,60,9001  >  35978 [ACK] Seq=16614059 Ack=307203299 Win=65535 Len=0
1,7.708372000000054,54.93.77.70,10.0.2.15,TLSv1.2,590,Application Data
1,7.7164960000000065,54.93.77.70,10.0.2.15,TCP,2950,"9001  >  34692 [PSH, ACK] Seq=306814711 Ack=16660581 Win=65535 Len=2896 [TCP segment of a reassembled PDU]"
1,7.716574000000037,10.0.2.15,54.93.77.70,TCP,54,34692  >  9001 [ACK] Seq=16660581 Ack=306817607 Win=65535 Len=0
1,7.724349999999504,54.93.77.70,10.0.2.15,TLSv1.2,1314,"Application Data, Application Data"
1,7.765330999999605,10.0.2.15,54.93.77.70,TCP,54,34692  >  9001 [ACK] Seq=16660581 Ack=306818867 Win=65535 Len=0
1,7.769018999999389,54.93.77.70,10.0.2.15,TLSv1.2,7808,"Application Data, Application Data"
1,7.76908899999944,10.0.2.15,54.93.77.70,TCP,54,34692  >  9001 [ACK] Seq=16660581 Ack=306826621 Win=65535 Len=0
1,7.801815999999235,54.93.77.70,10.0.2.15,TLSv1.2,3674,Application Data
1,7.8018849999998565,10.0.2.15,54.93.77.70,TCP,54,34692  >  9001 [ACK] Seq=16660581 Ack=306830241 Win=65535 Len=0
1,7.802063000000089,10.0.2.15,54.93.77.70,TLSv1.2,590,Application Data
1,7.802161999999953,54.93.77.70,10.0.2.15,TCP,60,9001  >  34692 [ACK] Seq=306830241 Ack=16661117 Win=65535 Len=0
1,7.810950999999477,54.93.77.70,10.0.2.15,TCP,2950,"9001  >  34692 [PSH, ACK] Seq=306830241 Ack=16661117 Win=65535 Len=2896 [TCP segment of a reassembled PDU]"
1,7.8110289999995075,10.0.2.15,54.93.77.70,TCP,54,34692  >  9001 [ACK] Seq=16661117 Ack=306833137 Win=65535 Len=0
1,7.817795999999362,54.93.77.70,10.0.2.15,TLSv1.2,778,Application Data
1,7.820426999999654,54.93.77.70,10.0.2.15,TLSv1.2,4398,Application Data
1,7.820468999999321,10.0.2.15,54.93.77.70,TCP,54,34692  >  9001 [ACK] Seq=16661117 Ack=306838205 Win=65535 Len=0
1,7.821265999999923,54.93.77.70,10.0.2.15,TCP,1502,"9001  >  34692 [PSH, ACK] Seq=306838205 Ack=16661117 Win=65535 Len=1448 [TCP segment of a reassembled PDU]"
1,7.821314999999231,10.0.2.15,54.93.77.70,TCP,54,34692  >  9001 [ACK] Seq=16661117 Ack=306839653 Win=65535 Len=0
1,7.838139999999839,54.93.77.70,10.0.2.15,TLSv1.2,988,Application Data
1,7.83828799999992,10.0.2.15,54.93.77.70,TLSv1.2,590,Application Data
1,7.838361000000077,54.93.77.70,10.0.2.15,TCP,60,9001  >  34692 [ACK] Seq=306840587 Ack=16661653 Win=65535 Len=0
1,7.888380999999754,62.210.85.178,10.0.2.15,TLSv1.2,590,Application Data
1,7.892331000000013,54.93.77.70,10.0.2.15,TCP,2950,"9001  >  34692 [PSH, ACK] Seq=306840587 Ack=16661653 Win=65535 Len=2896 [TCP segment of a reassembled PDU]"
1,7.892417000000023,10.0.2.15,54.93.77.70,TCP,54,34692  >  9001 [ACK] Seq=16661653 Ack=306843483 Win=65535 Len=0
1,7.8930780000000595,54.93.77.70,10.0.2.15,TLSv1.2,8742,"Application Data, Application Data"
1,7.893140999999559,10.0.2.15,54.93.77.70,TCP,54,34692  >  9001 [ACK] Seq=16661653 Ack=306852171 Win=65535 Len=0
1,7.910272000000077,54.93.77.70,10.0.2.15,TLSv1.2,2950,"Application Data, Application Data"
1,7.910326999999597,10.0.2.15,54.93.77.70,TCP,54,34692  >  9001 [ACK] Seq=16661653 Ack=306855067 Win=65535 Len=0
1,7.91104599999926,54.93.77.70,10.0.2.15,TLSv1.2,1618,Application Data
1,7.911088999999265,10.0.2.15,54.93.77.70,TCP,54,34692  >  9001 [ACK] Seq=16661653 Ack=306856631 Win=65535 Len=0
