No.,Time,Source,Destination,Protocol,Length,Info
1,0.021015999999690393,10.0.2.15,54.93.77.70,TCP,54,34692  >  9001 [ACK] Seq=16626431 Ack=306168781 Win=65535 Len=0
1,0.031269000000065716,62.210.85.178,10.0.2.15,TLSv1.2,1104,Application Data
1,0.07394599999952334,10.0.2.15,62.210.85.178,TCP,54,35978  >  9001 [ACK] Seq=306515691 Ack=16579997 Win=65535 Len=0
1,0.142055999999684,10.0.2.15,54.93.77.70,TLSv1.2,590,Application Data
1,0.14231199999994715,54.93.77.70,10.0.2.15,TCP,60,9001  >  34692 [ACK] Seq=306168781 Ack=16626967 Win=65535 Len=0
1,0.2586359999995693,62.210.85.178,10.0.2.15,TLSv1.2,590,Application Data
1,0.25879100000020117,10.0.2.15,62.210.85.178,TCP,54,35978  >  9001 [ACK] Seq=306515691 Ack=16580533 Win=65535 Len=0
1,0.25989800000024843,10.0.2.15,62.210.85.178,TLSv1.2,590,Application Data
1,0.2603140000001076,62.210.85.178,10.0.2.15,TCP,60,9001  >  35978 [ACK] Seq=16580533 Ack=306516227 Win=65535 Len=0
1,0.35509300000012445,54.93.77.70,10.0.2.15,TLSv1.2,590,Application Data
1,0.35516999999981635,10.0.2.15,54.93.77.70,TCP,54,34692  >  9001 [ACK] Seq=16626967 Ack=306169317 Win=65535 Len=0
1,0.3555799999994633,10.0.2.15,54.93.77.70,TLSv1.2,1618,Application Data
1,0.3556799999996656,54.93.77.70,10.0.2.15,TCP,60,9001  >  34692 [ACK] Seq=306169317 Ack=16628427 Win=65535 Len=0
1,0.35569200000009005,54.93.77.70,10.0.2.15,TCP,60,9001  >  34692 [ACK] Seq=306169317 Ack=16628531 Win=65535 Len=0
1,0.5748929999999746,62.210.85.178,10.0.2.15,TLSv1.2,1618,Application Data
1,0.5750090000001364,10.0.2.15,62.210.85.178,TCP,54,35978  >  9001 [ACK] Seq=306516227 Ack=16582097 Win=65535 Len=0
1,0.5886540000001332,10.0.2.15,62.210.85.178,TLSv1.2,590,Application Data
1,0.5888349999995626,62.210.85.178,10.0.2.15,TCP,60,9001  >  35978 [ACK] Seq=16582097 Ack=306516763 Win=65535 Len=0
1,0.601636000000326,10.0.2.15,62.210.85.178,TLSv1.2,1618,Application Data
1,0.6017890000002808,62.210.85.178,10.0.2.15,TCP,60,9001  >  35978 [ACK] Seq=16582097 Ack=306518223 Win=65535 Len=0
1,0.601807000000008,62.210.85.178,10.0.2.15,TCP,60,9001  >  35978 [ACK] Seq=16582097 Ack=306518327 Win=65535 Len=0
1,1.0867959999995946,54.93.77.70,10.0.2.15,TLSv1.2,590,Application Data
1,1.089933000000201,54.93.77.70,10.0.2.15,TLSv1.2,1618,Application Data
1,1.0902569999998377,10.0.2.15,54.93.77.70,TCP,54,34692  >  9001 [ACK] Seq=16628531 Ack=306171417 Win=65535 Len=0
1,1.093764000000192,10.0.2.15,54.93.77.70,TLSv1.2,590,Application Data
1,1.0939509999998336,54.93.77.70,10.0.2.15,TCP,60,9001  >  34692 [ACK] Seq=306171417 Ack=16629067 Win=65535 Len=0
1,1.2068689999996423,62.210.85.178,10.0.2.15,TLSv1.2,590,Application Data
1,1.2072440000001734,10.0.2.15,62.210.85.178,TLSv1.2,590,Application Data
1,1.2073739999996178,62.210.85.178,10.0.2.15,TCP,60,9001  >  35978 [ACK] Seq=16582633 Ack=306518863 Win=65535 Len=0
1,1.3185489999996207,54.93.77.70,10.0.2.15,TLSv1.2,590,Application Data
1,1.3189489999995203,10.0.2.15,54.93.77.70,TLSv1.2,590,Application Data
1,1.319075000000339,54.93.77.70,10.0.2.15,TCP,60,9001  >  34692 [ACK] Seq=306171953 Ack=16629603 Win=65535 Len=0
1,1.4125549999998839,62.210.85.178,10.0.2.15,TLSv1.2,590,Application Data
1,1.4226929999995264,10.0.2.15,62.210.85.178,TLSv1.2,590,Application Data
1,1.422907999999552,62.210.85.178,10.0.2.15,TCP,60,9001  >  35978 [ACK] Seq=16583169 Ack=306519399 Win=65535 Len=0
1,1.4337980000000243,10.0.2.15,62.210.85.178,TLSv1.2,4124,Application Data
1,1.4339149999996152,10.0.2.15,62.210.85.178,TCP,2974,35978  >  9001 [ACK] Seq=306523469 Ack=16583169 Win=65535 Len=2920 [TCP segment of a reassembled PDU]
1,1.433958999999959,62.210.85.178,10.0.2.15,TCP,60,9001  >  35978 [ACK] Seq=16583169 Ack=306520859 Win=65535 Len=0
1,1.4339689999997063,62.210.85.178,10.0.2.15,TCP,60,9001  >  35978 [ACK] Seq=16583169 Ack=306522319 Win=65535 Len=0
1,1.43397399999958,62.210.85.178,10.0.2.15,TCP,60,9001  >  35978 [ACK] Seq=16583169 Ack=306523469 Win=65535 Len=0
1,1.4339780000000246,62.210.85.178,10.0.2.15,TCP,60,9001  >  35978 [ACK] Seq=16583169 Ack=306524929 Win=65535 Len=0
1,1.4339819999995598,62.210.85.178,10.0.2.15,TCP,60,9001  >  35978 [ACK] Seq=16583169 Ack=306526389 Win=65535 Len=0
1,1.4340240000001359,10.0.2.15,62.210.85.178,TLSv1.2,1204,Application Data
1,1.4341159999994488,62.210.85.178,10.0.2.15,TCP,60,9001  >  35978 [ACK] Seq=16583169 Ack=306527539 Win=65535 Len=0
1,1.4341779999995197,10.0.2.15,62.210.85.178,TLSv1.2,4124,Application Data
1,1.4342850000002727,62.210.85.178,10.0.2.15,TCP,60,9001  >  35978 [ACK] Seq=16583169 Ack=306528999 Win=65535 Len=0
1,1.4342969999997877,62.210.85.178,10.0.2.15,TCP,60,9001  >  35978 [ACK] Seq=16583169 Ack=306530459 Win=65535 Len=0
1,1.4343010000002323,62.210.85.178,10.0.2.15,TCP,60,9001  >  35978 [ACK] Seq=16583169 Ack=306531609 Win=65535 Len=0
1,1.4343550000003233,10.0.2.15,62.210.85.178,TLSv1.2,4124,Application Data
1,1.4344590000000608,10.0.2.15,62.210.85.178,TLSv1.2,2974,Application Data
1,1.4344819999996616,62.210.85.178,10.0.2.15,TCP,60,9001  >  35978 [ACK] Seq=16583169 Ack=306533069 Win=65535 Len=0
1,1.4344890000002124,62.210.85.178,10.0.2.15,TCP,60,9001  >  35978 [ACK] Seq=16583169 Ack=306534529 Win=65535 Len=0
1,1.434494000000086,62.210.85.178,10.0.2.15,TCP,60,9001  >  35978 [ACK] Seq=16583169 Ack=306535679 Win=65535 Len=0
1,1.4344979999996212,62.210.85.178,10.0.2.15,TCP,60,9001  >  35978 [ACK] Seq=16583169 Ack=306537139 Win=65535 Len=0
1,1.434502000000066,62.210.85.178,10.0.2.15,TCP,60,9001  >  35978 [ACK] Seq=16583169 Ack=306538599 Win=65535 Len=0
1,1.4345400000001973,10.0.2.15,62.210.85.178,TLSv1.2,1226,Application Data
1,1.4346059999998033,10.0.2.15,62.210.85.178,TCP,2974,35978  >  9001 [ACK] Seq=306539771 Ack=16583169 Win=65535 Len=2920 [TCP segment of a reassembled PDU]
1,1.4346409999998286,62.210.85.178,10.0.2.15,TCP,60,9001  >  35978 [ACK] Seq=16583169 Ack=306539771 Win=65535 Len=0
1,1.4346470000000409,62.210.85.178,10.0.2.15,TCP,60,9001  >  35978 [ACK] Seq=16583169 Ack=306541231 Win=65535 Len=0
1,1.4346519999999146,62.210.85.178,10.0.2.15,TCP,60,9001  >  35978 [ACK] Seq=16583169 Ack=306542691 Win=65535 Len=0
1,1.4346850000001723,10.0.2.15,62.210.85.178,TLSv1.2,1204,Application Data
1,1.4347479999996722,10.0.2.15,62.210.85.178,TCP,2974,35978  >  9001 [ACK] Seq=306543841 Ack=16583169 Win=65535 Len=2920 [TCP segment of a reassembled PDU]
1,1.4347829999996975,62.210.85.178,10.0.2.15,TCP,60,9001  >  35978 [ACK] Seq=16583169 Ack=306543841 Win=65535 Len=0
1,1.4347889999999097,62.210.85.178,10.0.2.15,TCP,60,9001  >  35978 [ACK] Seq=16583169 Ack=306545301 Win=65535 Len=0
1,1.4347939999997834,62.210.85.178,10.0.2.15,TCP,60,9001  >  35978 [ACK] Seq=16583169 Ack=306546761 Win=65535 Len=0
1,1.434823999999935,10.0.2.15,62.210.85.178,TLSv1.2,110,Application Data
1,1.434860999999728,62.210.85.178,10.0.2.15,TCP,60,9001  >  35978 [ACK] Seq=16583169 Ack=306546817 Win=65535 Len=0
1,1.444043999999849,10.0.2.15,62.210.85.178,TLSv1.2,4124,Application Data
1,1.4441189999997732,10.0.2.15,62.210.85.178,TCP,2974,35978  >  9001 [ACK] Seq=306550887 Ack=16583169 Win=65535 Len=2920 [TCP segment of a reassembled PDU]
1,1.444155000000137,62.210.85.178,10.0.2.15,TCP,60,9001  >  35978 [ACK] Seq=16583169 Ack=306548277 Win=65535 Len=0
1,1.4441619999997783,62.210.85.178,10.0.2.15,TCP,60,9001  >  35978 [ACK] Seq=16583169 Ack=306549737 Win=65535 Len=0
1,1.444166999999652,62.210.85.178,10.0.2.15,TCP,60,9001  >  35978 [ACK] Seq=16583169 Ack=306550887 Win=65535 Len=0
1,1.4441710000000967,62.210.85.178,10.0.2.15,TCP,60,9001  >  35978 [ACK] Seq=16583169 Ack=306552347 Win=65535 Len=0
1,1.4441749999996318,62.210.85.178,10.0.2.15,TCP,60,9001  >  35978 [ACK] Seq=16583169 Ack=306553807 Win=65535 Len=0
1,1.4442129999997633,10.0.2.15,62.210.85.178,TLSv1.2,1204,Application Data
1,1.444282999999814,62.210.85.178,10.0.2.15,TCP,60,9001  >  35978 [ACK] Seq=16583169 Ack=306554957 Win=65535 Len=0
1,1.4443240000000515,10.0.2.15,62.210.85.178,TLSv1.2,4124,Application Data
1,1.4443709999995917,62.210.85.178,10.0.2.15,TCP,60,9001  >  35978 [ACK] Seq=16583169 Ack=306556417 Win=65535 Len=0
1,1.4443780000001425,62.210.85.178,10.0.2.15,TCP,60,9001  >  35978 [ACK] Seq=16583169 Ack=306557877 Win=65535 Len=0
1,1.4443819999996776,62.210.85.178,10.0.2.15,TCP,60,9001  >  35978 [ACK] Seq=16583169 Ack=306559027 Win=65535 Len=0
1,1.4444299999995565,10.0.2.15,62.210.85.178,TLSv1.2,4124,Application Data
1,1.4445260000002236,62.210.85.178,10.0.2.15,TCP,60,9001  >  35978 [ACK] Seq=16583169 Ack=306560487 Win=65535 Len=0
1,1.4445340000002034,62.210.85.178,10.0.2.15,TCP,60,9001  >  35978 [ACK] Seq=16583169 Ack=306561947 Win=65535 Len=0
1,1.444539000000077,62.210.85.178,10.0.2.15,TCP,60,9001  >  35978 [ACK] Seq=16583169 Ack=306563097 Win=65535 Len=0
1,1.4445829999995112,10.0.2.15,62.210.85.178,TLSv1.2,2974,Application Data
1,1.4446390000002793,10.0.2.15,62.210.85.178,TLSv1.2,1226,Application Data
1,1.444658999999774,62.210.85.178,10.0.2.15,TCP,60,9001  >  35978 [ACK] Seq=16583169 Ack=306564557 Win=65535 Len=0
1,1.4446660000003249,62.210.85.178,10.0.2.15,TCP,60,9001  >  35978 [ACK] Seq=16583169 Ack=306566017 Win=65535 Len=0
1,1.44466999999986,62.210.85.178,10.0.2.15,TCP,60,9001  >  35978 [ACK] Seq=16583169 Ack=306567189 Win=65535 Len=0
1,1.4447229999996125,10.0.2.15,62.210.85.178,TLSv1.2,4124,Application Data
1,1.444800000000214,62.210.85.178,10.0.2.15,TCP,60,9001  >  35978 [ACK] Seq=16583169 Ack=306568649 Win=65535 Len=0
1,1.4448080000001937,62.210.85.178,10.0.2.15,TCP,60,9001  >  35978 [ACK] Seq=16583169 Ack=306570109 Win=65535 Len=0
1,1.4448130000000674,62.210.85.178,10.0.2.15,TCP,60,9001  >  35978 [ACK] Seq=16583169 Ack=306571259 Win=65535 Len=0
1,1.444843000000219,10.0.2.15,62.210.85.178,TCP,2974,35978  >  9001 [ACK] Seq=306571259 Ack=16583169 Win=65535 Len=2920 [TCP segment of a reassembled PDU]
1,1.4448979999997391,10.0.2.15,62.210.85.178,TLSv1.2,110,Application Data
1,1.444934999999532,62.210.85.178,10.0.2.15,TCP,60,9001  >  35978 [ACK] Seq=16583169 Ack=306572719 Win=65535 Len=0
1,1.4449409999997442,62.210.85.178,10.0.2.15,TCP,60,9001  >  35978 [ACK] Seq=16583169 Ack=306574179 Win=65535 Len=0
1,1.444945999999618,62.210.85.178,10.0.2.15,TCP,60,9001  >  35978 [ACK] Seq=16583169 Ack=306574235 Win=65535 Len=0
1,1.457394999999451,10.0.2.15,62.210.85.178,TLSv1.2,4124,Application Data
1,1.4574839999995675,10.0.2.15,62.210.85.178,TCP,2974,35978  >  9001 [ACK] Seq=306578305 Ack=16583169 Win=65535 Len=2920 [TCP segment of a reassembled PDU]
1,1.4575260000001435,62.210.85.178,10.0.2.15,TCP,60,9001  >  35978 [ACK] Seq=16583169 Ack=306575695 Win=65535 Len=0
1,1.4575349999995524,62.210.85.178,10.0.2.15,TCP,60,9001  >  35978 [ACK] Seq=16583169 Ack=306577155 Win=65535 Len=0
1,1.4575400000003356,62.210.85.178,10.0.2.15,TCP,60,9001  >  35978 [ACK] Seq=16583169 Ack=306578305 Win=65535 Len=0
1,1.4575439999998707,62.210.85.178,10.0.2.15,TCP,60,9001  >  35978 [ACK] Seq=16583169 Ack=306579765 Win=65535 Len=0
1,1.4575480000003154,62.210.85.178,10.0.2.15,TCP,60,9001  >  35978 [ACK] Seq=16583169 Ack=306581225 Win=65535 Len=0
1,1.4575889999996434,10.0.2.15,62.210.85.178,TLSv1.2,1204,Application Data
1,1.4576569999999265,10.0.2.15,62.210.85.178,TCP,2974,35978  >  9001 [ACK] Seq=306582375 Ack=16583169 Win=65535 Len=2920 [TCP segment of a reassembled PDU]
1,1.457695999999487,62.210.85.178,10.0.2.15,TCP,60,9001  >  35978 [ACK] Seq=16583169 Ack=306582375 Win=65535 Len=0
1,1.4577030000000377,62.210.85.178,10.0.2.15,TCP,60,9001  >  35978 [ACK] Seq=16583169 Ack=306583835 Win=65535 Len=0
1,1.4577079999999114,62.210.85.178,10.0.2.15,TCP,60,9001  >  35978 [ACK] Seq=16583169 Ack=306585295 Win=65535 Len=0
1,1.4577419999995982,10.0.2.15,62.210.85.178,TLSv1.2,1204,Application Data
1,1.4578110000002198,10.0.2.15,62.210.85.178,TCP,2974,35978  >  9001 [ACK] Seq=306586445 Ack=16583169 Win=65535 Len=2920 [TCP segment of a reassembled PDU]
1,1.4578469999996742,62.210.85.178,10.0.2.15,TCP,60,9001  >  35978 [ACK] Seq=16583169 Ack=306586445 Win=65535 Len=0
1,1.457854000000225,62.210.85.178,10.0.2.15,TCP,60,9001  >  35978 [ACK] Seq=16583169 Ack=306587905 Win=65535 Len=0
1,1.45785799999976,62.210.85.178,10.0.2.15,TCP,60,9001  >  35978 [ACK] Seq=16583169 Ack=306589365 Win=65535 Len=0
1,1.4578890000002502,10.0.2.15,62.210.85.178,TLSv1.2,1204,Application Data
1,1.4579809999995632,10.0.2.15,62.210.85.178,TLSv1.2,2974,Application Data
1,1.4580040000000736,62.210.85.178,10.0.2.15,TCP,60,9001  >  35978 [ACK] Seq=16583169 Ack=306590515 Win=65535 Len=0
1,1.4580100000002858,62.210.85.178,10.0.2.15,TCP,60,9001  >  35978 [ACK] Seq=16583169 Ack=306591975 Win=65535 Len=0
1,1.4580150000001595,62.210.85.178,10.0.2.15,TCP,60,9001  >  35978 [ACK] Seq=16583169 Ack=306593435 Win=65535 Len=0
1,1.4580459999997402,10.0.2.15,62.210.85.178,TLSv1.2,1226,Application Data
1,1.458082999999533,62.210.85.178,10.0.2.15,TCP,60,9001  >  35978 [ACK] Seq=16583169 Ack=306594607 Win=65535 Len=0
1,1.4581259999995382,10.0.2.15,62.210.85.178,TLSv1.2,4124,Application Data
1,1.4581650000000081,62.210.85.178,10.0.2.15,TCP,60,9001  >  35978 [ACK] Seq=16583169 Ack=306596067 Win=65535 Len=0
1,1.4581710000002204,62.210.85.178,10.0.2.15,TCP,60,9001  >  35978 [ACK] Seq=16583169 Ack=306597527 Win=65535 Len=0
1,1.458176000000094,62.210.85.178,10.0.2.15,TCP,60,9001  >  35978 [ACK] Seq=16583169 Ack=306598677 Win=65535 Len=0
1,1.4582209999998668,10.0.2.15,62.210.85.178,TLSv1.2,3030,Application Data
1,1.4582620000001043,62.210.85.178,10.0.2.15,TCP,60,9001  >  35978 [ACK] Seq=16583169 Ack=306600137 Win=65535 Len=0
1,1.4582680000003165,62.210.85.178,10.0.2.15,TCP,60,9001  >  35978 [ACK] Seq=16583169 Ack=306601597 Win=65535 Len=0
1,1.4582730000001902,62.210.85.178,10.0.2.15,TCP,60,9001  >  35978 [ACK] Seq=16583169 Ack=306601653 Win=65535 Len=0
1,1.5299070000000938,54.93.77.70,10.0.2.15,TLSv1.2,590,Application Data
1,1.5504149999997026,54.93.77.70,10.0.2.15,TCP,2950,"9001  >  34692 [PSH, ACK] Seq=306172489 Ack=16629603 Win=65535 Len=2896 [TCP segment of a reassembled PDU]"
1,1.5505409999996118,10.0.2.15,54.93.77.70,TCP,54,34692  >  9001 [ACK] Seq=16629603 Ack=306175385 Win=65535 Len=0
1,1.5676400000002104,54.93.77.70,10.0.2.15,TLSv1.2,778,Application Data
1,1.571190999999999,54.93.77.70,10.0.2.15,TCP,2950,"9001  >  34692 [PSH, ACK] Seq=306176109 Ack=16629603 Win=65535 Len=2896 [TCP segment of a reassembled PDU]"
1,1.5713980000000447,10.0.2.15,54.93.77.70,TCP,54,34692  >  9001 [ACK] Seq=16629603 Ack=306179005 Win=65535 Len=0
1,1.5816319999994448,54.93.77.70,10.0.2.15,TLSv1.2,4398,"Application Data, Application Data"
1,1.581717000000026,10.0.2.15,54.93.77.70,TCP,54,34692  >  9001 [ACK] Seq=16629603 Ack=306183349 Win=65535 Len=0
1,1.590780999999879,54.93.77.70,10.0.2.15,TLSv1.2,4210,"Application Data, Application Data"
1,1.59083499999997,10.0.2.15,54.93.77.70,TCP,54,34692  >  9001 [ACK] Seq=16629603 Ack=306187505 Win=65535 Len=0
1,1.5986510000002454,54.93.77.70,10.0.2.15,TCP,2950,"9001  >  34692 [PSH, ACK] Seq=306187505 Ack=16629603 Win=65535 Len=2896 [TCP segment of a reassembled PDU]"
1,1.5986809999994875,54.93.77.70,10.0.2.15,TLSv1.2,4398,Application Data [TCP segment of a reassembled PDU]
1,1.5987310000000434,10.0.2.15,54.93.77.70,TCP,54,34692  >  9001 [ACK] Seq=16629603 Ack=306190401 Win=65535 Len=0
1,1.5988310000002457,10.0.2.15,54.93.77.70,TCP,54,34692  >  9001 [ACK] Seq=16629603 Ack=306194745 Win=65535 Len=0
1,1.6067889999994804,54.93.77.70,10.0.2.15,TLSv1.2,568,Application Data
1,1.6209129999997458,54.93.77.70,10.0.2.15,TLSv1.2,4398,Application Data
1,1.6209659999994983,10.0.2.15,54.93.77.70,TCP,54,34692  >  9001 [ACK] Seq=16629603 Ack=306199603 Win=65535 Len=0
1,1.6211350000003222,10.0.2.15,54.93.77.70,TLSv1.2,590,Application Data
1,1.6212539999996807,54.93.77.70,10.0.2.15,TCP,60,9001  >  34692 [ACK] Seq=306199603 Ack=16630139 Win=65535 Len=0
1,1.622483999999531,54.93.77.70,10.0.2.15,TLSv1.2,2950,Application Data [TCP segment of a reassembled PDU]
1,1.6225260000001072,10.0.2.15,54.93.77.70,TCP,54,34692  >  9001 [ACK] Seq=16630139 Ack=306202499 Win=65535 Len=0
1,1.6308179999996355,10.0.2.15,54.93.77.70,TLSv1.2,590,Application Data
1,1.6309439999995448,54.93.77.70,10.0.2.15,TCP,60,9001  >  34692 [ACK] Seq=306202499 Ack=16630675 Win=65535 Len=0
1,1.6309579999997368,54.93.77.70,10.0.2.15,TLSv1.2,2950,Application Data [TCP segment of a reassembled PDU]
1,1.6310210000001462,10.0.2.15,54.93.77.70,TCP,54,34692  >  9001 [ACK] Seq=16630675 Ack=306205395 Win=65535 Len=0
1,1.6310629999998127,54.93.77.70,10.0.2.15,TCP,1502,"9001  >  34692 [PSH, ACK] Seq=306205395 Ack=16630675 Win=65535 Len=1448 [TCP segment of a reassembled PDU]"
1,1.631094999999732,10.0.2.15,54.93.77.70,TCP,54,34692  >  9001 [ACK] Seq=16630675 Ack=306206843 Win=65535 Len=0
1,1.6372879999998986,54.93.77.70,10.0.2.15,TLSv1.2,3276,Application Data [TCP segment of a reassembled PDU]
1,1.6373299999995652,10.0.2.15,54.93.77.70,TCP,54,34692  >  9001 [ACK] Seq=16630675 Ack=306210065 Win=65535 Len=0
1,1.6377579999998488,54.93.77.70,10.0.2.15,TLSv1.2,1502,Application Data [TCP segment of a reassembled PDU]
1,1.637800999999854,10.0.2.15,54.93.77.70,TCP,54,34692  >  9001 [ACK] Seq=16630675 Ack=306211513 Win=65535 Len=0
1,1.6503450000000157,54.93.77.70,10.0.2.15,TLSv1.2,4398,Application Data [TCP segment of a reassembled PDU]
1,1.6504089999998541,10.0.2.15,54.93.77.70,TCP,54,34692  >  9001 [ACK] Seq=16630675 Ack=306215857 Win=65535 Len=0
1,1.6535359999998036,54.93.77.70,10.0.2.15,TLSv1.2,170,Application Data
1,1.6597860000001674,54.93.77.70,10.0.2.15,TCP,2950,"9001  >  34692 [PSH, ACK] Seq=306215973 Ack=16630675 Win=65535 Len=2896 [TCP segment of a reassembled PDU]"
1,1.6598320000002786,10.0.2.15,54.93.77.70,TCP,54,34692  >  9001 [ACK] Seq=16630675 Ack=306218869 Win=65535 Len=0
1,1.6656379999994897,54.93.77.70,10.0.2.15,TLSv1.2,7294,"Application Data, Application Data, Application Data"
1,1.665700999999899,10.0.2.15,54.93.77.70,TCP,54,34692  >  9001 [ACK] Seq=16630675 Ack=306226109 Win=65535 Len=0
1,1.6659730000001218,10.0.2.15,54.93.77.70,TLSv1.2,590,Application Data
1,1.666081999999733,54.93.77.70,10.0.2.15,TCP,60,9001  >  34692 [ACK] Seq=306226109 Ack=16631211 Win=65535 Len=0
1,1.6663769999995566,54.93.77.70,10.0.2.15,TLSv1.2,4398,Application Data [TCP segment of a reassembled PDU]
1,1.6664199999995617,10.0.2.15,54.93.77.70,TCP,54,34692  >  9001 [ACK] Seq=16631211 Ack=306230453 Win=65535 Len=0
1,1.6758600000002843,54.93.77.70,10.0.2.15,TLSv1.2,1104,Application Data
1,1.6770639999995183,54.93.77.70,10.0.2.15,TLSv1.2,4398,Application Data
1,1.6771159999998417,10.0.2.15,54.93.77.70,TCP,54,34692  >  9001 [ACK] Seq=16631211 Ack=306235847 Win=65535 Len=0
1,1.6782809999995152,54.93.77.70,10.0.2.15,TCP,2950,"9001  >  34692 [PSH, ACK] Seq=306235847 Ack=16631211 Win=65535 Len=2896 [TCP segment of a reassembled PDU]"
1,1.6783299999997325,10.0.2.15,54.93.77.70,TCP,54,34692  >  9001 [ACK] Seq=16631211 Ack=306238743 Win=65535 Len=0
1,1.6799080000000686,54.93.77.70,10.0.2.15,TLSv1.2,7294,"Application Data, Application Data"
1,1.6799739999996746,10.0.2.15,54.93.77.70,TCP,54,34692  >  9001 [ACK] Seq=16631211 Ack=306245983 Win=65535 Len=0
1,1.6979190000001836,54.93.77.70,10.0.2.15,TLSv1.2,568,Application Data
1,1.7000820000002932,54.93.77.70,10.0.2.15,TLSv1.2,5846,Application Data
1,1.7001430000000255,10.0.2.15,54.93.77.70,TCP,54,34692  >  9001 [ACK] Seq=16631211 Ack=306252289 Win=65535 Len=0
1,1.7003629999999248,10.0.2.15,54.93.77.70,TLSv1.2,1104,Application Data
1,1.7004280000001017,54.93.77.70,10.0.2.15,TCP,60,9001  >  34692 [ACK] Seq=306252289 Ack=16632261 Win=65535 Len=0
1,1.7163579999996728,54.93.77.70,10.0.2.15,TLSv1.2,988,Application Data
1,1.7223579999999856,54.93.77.70,10.0.2.15,TCP,1502,"9001  >  34692 [PSH, ACK] Seq=306253223 Ack=16632261 Win=65535 Len=1448 [TCP segment of a reassembled PDU]"
1,1.7224059999998644,10.0.2.15,54.93.77.70,TCP,54,34692  >  9001 [ACK] Seq=16632261 Ack=306254671 Win=65535 Len=0
1,1.7384979999997086,54.93.77.70,10.0.2.15,TLSv1.2,170,Application Data
1,1.7422369999994771,10.0.2.15,54.93.77.70,TLSv1.2,590,Application Data
1,1.7424389999996492,54.93.77.70,10.0.2.15,TCP,60,9001  >  34692 [ACK] Seq=306254787 Ack=16632797 Win=65535 Len=0
1,1.7566600000000108,62.210.85.178,10.0.2.15,TLSv1.2,1104,Application Data
1,1.800583999999617,10.0.2.15,62.210.85.178,TCP,54,35978  >  9001 [ACK] Seq=306601653 Ack=16584219 Win=65535 Len=0
1,1.8368529999997918,62.210.85.178,10.0.2.15,TLSv1.2,590,Application Data
1,1.8369400000001406,10.0.2.15,62.210.85.178,TCP,54,35978  >  9001 [ACK] Seq=306601653 Ack=16584755 Win=65535 Len=0
1,1.905837999999676,62.210.85.178,10.0.2.15,TLSv1.2,1104,Application Data
1,1.9059299999998984,10.0.2.15,62.210.85.178,TCP,54,35978  >  9001 [ACK] Seq=306601653 Ack=16585805 Win=65535 Len=0
1,1.939155000000028,62.210.85.178,10.0.2.15,TLSv1.2,590,Application Data
1,1.9392079999997804,10.0.2.15,62.210.85.178,TCP,54,35978  >  9001 [ACK] Seq=306601653 Ack=16586341 Win=65535 Len=0
1,1.9394780000002356,10.0.2.15,62.210.85.178,TLSv1.2,590,Application Data
1,1.9395999999997002,62.210.85.178,10.0.2.15,TCP,60,9001  >  35978 [ACK] Seq=16586341 Ack=306602189 Win=65535 Len=0
1,2.0428259999998772,54.93.77.70,10.0.2.15,TLSv1.2,590,Application Data
1,2.0432620000001407,10.0.2.15,54.93.77.70,TLSv1.2,590,Application Data
1,2.0433689999999842,54.93.77.70,10.0.2.15,TCP,60,9001  >  34692 [ACK] Seq=306255323 Ack=16633333 Win=65535 Len=0
1,2.1508059999996476,62.210.85.178,10.0.2.15,TLSv1.2,590,Application Data
1,2.1571579999999813,10.0.2.15,62.210.85.178,TLSv1.2,590,Application Data
1,2.157328999999663,62.210.85.178,10.0.2.15,TCP,60,9001  >  35978 [ACK] Seq=16586877 Ack=306602725 Win=65535 Len=0
1,2.16972799999985,10.0.2.15,62.210.85.178,TLSv1.2,4124,Application Data
1,2.169836999999461,10.0.2.15,62.210.85.178,TCP,2974,35978  >  9001 [ACK] Seq=306606795 Ack=16586877 Win=65535 Len=2920 [TCP segment of a reassembled PDU]
1,2.169887000000017,62.210.85.178,10.0.2.15,TCP,60,9001  >  35978 [ACK] Seq=16586877 Ack=306604185 Win=65535 Len=0
1,2.1698999999998705,62.210.85.178,10.0.2.15,TCP,60,9001  >  35978 [ACK] Seq=16586877 Ack=306605645 Win=65535 Len=0
1,2.169904999999744,62.210.85.178,10.0.2.15,TCP,60,9001  >  35978 [ACK] Seq=16586877 Ack=306606795 Win=65535 Len=0
1,2.1699470000003203,10.0.2.15,62.210.85.178,TLSv1.2,1204,Application Data
1,2.1699870000002193,62.210.85.178,10.0.2.15,TCP,60,9001  >  35978 [ACK] Seq=16586877 Ack=306608255 Win=65535 Len=0
1,2.169995999999628,62.210.85.178,10.0.2.15,TCP,60,9001  >  35978 [ACK] Seq=16586877 Ack=306609715 Win=65535 Len=0
1,2.1700000000000728,62.210.85.178,10.0.2.15,TCP,60,9001  >  35978 [ACK] Seq=16586877 Ack=306610865 Win=65535 Len=0
1,2.170043000000078,10.0.2.15,62.210.85.178,TLSv1.2,4124,Application Data
1,2.1700819999996384,62.210.85.178,10.0.2.15,TCP,60,9001  >  35978 [ACK] Seq=16586877 Ack=306612325 Win=65535 Len=0
1,2.1700909999999567,62.210.85.178,10.0.2.15,TCP,60,9001  >  35978 [ACK] Seq=16586877 Ack=306613785 Win=65535 Len=0
1,2.1700959999998304,62.210.85.178,10.0.2.15,TCP,60,9001  >  35978 [ACK] Seq=16586877 Ack=306614935 Win=65535 Len=0
1,2.1701359999997294,10.0.2.15,62.210.85.178,TLSv1.2,4124,Application Data
1,2.170173999999861,62.210.85.178,10.0.2.15,TCP,60,9001  >  35978 [ACK] Seq=16586877 Ack=306616395 Win=65535 Len=0
1,2.1701819999998406,62.210.85.178,10.0.2.15,TCP,60,9001  >  35978 [ACK] Seq=16586877 Ack=306617855 Win=65535 Len=0
1,2.1702260000001843,62.210.85.178,10.0.2.15,TCP,60,9001  >  35978 [ACK] Seq=16586877 Ack=306619005 Win=65535 Len=0
1,2.170259999999871,10.0.2.15,62.210.85.178,TLSv1.2,332,Application Data
1,2.170296000000235,62.210.85.178,10.0.2.15,TCP,60,9001  >  35978 [ACK] Seq=16586877 Ack=306619283 Win=65535 Len=0
1,2.170350999999755,10.0.2.15,62.210.85.178,TLSv1.2,3868,Application Data
1,2.1703919999999925,62.210.85.178,10.0.2.15,TCP,60,9001  >  35978 [ACK] Seq=16586877 Ack=306620743 Win=65535 Len=0
1,2.170401000000311,62.210.85.178,10.0.2.15,TCP,60,9001  >  35978 [ACK] Seq=16586877 Ack=306622203 Win=65535 Len=0
1,2.170404999999846,62.210.85.178,10.0.2.15,TCP,60,9001  >  35978 [ACK] Seq=16586877 Ack=306623097 Win=65535 Len=0
1,2.170444999999745,10.0.2.15,62.210.85.178,TLSv1.2,4124,Application Data
1,2.170484999999644,62.210.85.178,10.0.2.15,TCP,60,9001  >  35978 [ACK] Seq=16586877 Ack=306624557 Win=65535 Len=0
1,2.1704939999999624,62.210.85.178,10.0.2.15,TCP,60,9001  >  35978 [ACK] Seq=16586877 Ack=306626017 Win=65535 Len=0
1,2.1704979999994976,62.210.85.178,10.0.2.15,TCP,60,9001  >  35978 [ACK] Seq=16586877 Ack=306627167 Win=65535 Len=0
1,2.1705339999998614,10.0.2.15,62.210.85.178,TLSv1.2,3030,Application Data
1,2.1705730000003314,62.210.85.178,10.0.2.15,TCP,60,9001  >  35978 [ACK] Seq=16586877 Ack=306628627 Win=65535 Len=0
1,2.170581000000311,62.210.85.178,10.0.2.15,TCP,60,9001  >  35978 [ACK] Seq=16586877 Ack=306630087 Win=65535 Len=0
1,2.170583999999508,62.210.85.178,10.0.2.15,TCP,60,9001  >  35978 [ACK] Seq=16586877 Ack=306630143 Win=65535 Len=0
1,2.180887999999868,10.0.2.15,62.210.85.178,TLSv1.2,4124,Application Data
1,2.180984999999964,62.210.85.178,10.0.2.15,TCP,60,9001  >  35978 [ACK] Seq=16586877 Ack=306631603 Win=65535 Len=0
1,2.1809949999997116,62.210.85.178,10.0.2.15,TCP,60,9001  >  35978 [ACK] Seq=16586877 Ack=306633063 Win=65535 Len=0
1,2.1809990000001562,62.210.85.178,10.0.2.15,TCP,60,9001  >  35978 [ACK] Seq=16586877 Ack=306634213 Win=65535 Len=0
1,2.1810399999994843,10.0.2.15,62.210.85.178,TLSv1.2,4124,Application Data
1,2.181080999999722,62.210.85.178,10.0.2.15,TCP,60,9001  >  35978 [ACK] Seq=16586877 Ack=306635673 Win=65535 Len=0
1,2.18109000000004,62.210.85.178,10.0.2.15,TCP,60,9001  >  35978 [ACK] Seq=16586877 Ack=306637133 Win=65535 Len=0
1,2.1810939999995753,62.210.85.178,10.0.2.15,TCP,60,9001  >  35978 [ACK] Seq=16586877 Ack=306638283 Win=65535 Len=0
1,2.1811339999994743,10.0.2.15,62.210.85.178,TLSv1.2,4124,Application Data
1,2.1811729999999443,62.210.85.178,10.0.2.15,TCP,60,9001  >  35978 [ACK] Seq=16586877 Ack=306639743 Win=65535 Len=0
1,2.181180999999924,62.210.85.178,10.0.2.15,TCP,60,9001  >  35978 [ACK] Seq=16586877 Ack=306641203 Win=65535 Len=0
1,2.181185999999798,62.210.85.178,10.0.2.15,TCP,60,9001  >  35978 [ACK] Seq=16586877 Ack=306642353 Win=65535 Len=0
1,2.1812229999995907,10.0.2.15,62.210.85.178,TLSv1.2,4124,Application Data
1,2.1812620000000607,62.210.85.178,10.0.2.15,TCP,60,9001  >  35978 [ACK] Seq=16586877 Ack=306643813 Win=65535 Len=0
1,2.1812700000000405,62.210.85.178,10.0.2.15,TCP,60,9001  >  35978 [ACK] Seq=16586877 Ack=306645273 Win=65535 Len=0
1,2.1812739999995756,62.210.85.178,10.0.2.15,TCP,60,9001  >  35978 [ACK] Seq=16586877 Ack=306646423 Win=65535 Len=0
1,2.181308999999601,10.0.2.15,62.210.85.178,TLSv1.2,332,Application Data
1,2.1813460000003033,62.210.85.178,10.0.2.15,TCP,60,9001  >  35978 [ACK] Seq=16586877 Ack=306646701 Win=65535 Len=0
1,2.181399000000056,10.0.2.15,62.210.85.178,TLSv1.2,3868,Application Data
1,2.1814379999996163,62.210.85.178,10.0.2.15,TCP,60,9001  >  35978 [ACK] Seq=16586877 Ack=306648161 Win=65535 Len=0
1,2.181445999999596,62.210.85.178,10.0.2.15,TCP,60,9001  >  35978 [ACK] Seq=16586877 Ack=306649621 Win=65535 Len=0
1,2.1814500000000407,62.210.85.178,10.0.2.15,TCP,60,9001  >  35978 [ACK] Seq=16586877 Ack=306650515 Win=65535 Len=0
1,2.181488000000172,10.0.2.15,62.210.85.178,TLSv1.2,4124,Application Data
1,2.1815260000003036,62.210.85.178,10.0.2.15,TCP,60,9001  >  35978 [ACK] Seq=16586877 Ack=306651975 Win=65535 Len=0
1,2.1815340000002834,62.210.85.178,10.0.2.15,TCP,60,9001  >  35978 [ACK] Seq=16586877 Ack=306653435 Win=65535 Len=0
1,2.1815379999998186,62.210.85.178,10.0.2.15,TCP,60,9001  >  35978 [ACK] Seq=16586877 Ack=306654585 Win=65535 Len=0
1,2.181572999999844,10.0.2.15,62.210.85.178,TLSv1.2,3030,Application Data
1,2.181612000000314,62.210.85.178,10.0.2.15,TCP,60,9001  >  35978 [ACK] Seq=16586877 Ack=306656045 Win=65535 Len=0
1,2.1816200000002937,62.210.85.178,10.0.2.15,TCP,60,9001  >  35978 [ACK] Seq=16586877 Ack=306657505 Win=65535 Len=0
1,2.1816229999994903,62.210.85.178,10.0.2.15,TCP,60,9001  >  35978 [ACK] Seq=16586877 Ack=306657561 Win=65535 Len=0
1,2.193043999999645,10.0.2.15,62.210.85.178,TLSv1.2,4124,Application Data
1,2.1931009999998423,62.210.85.178,10.0.2.15,TCP,60,9001  >  35978 [ACK] Seq=16586877 Ack=306659021 Win=65535 Len=0
1,2.1931119999999282,62.210.85.178,10.0.2.15,TCP,60,9001  >  35978 [ACK] Seq=16586877 Ack=306660481 Win=65535 Len=0
1,2.193116999999802,62.210.85.178,10.0.2.15,TCP,60,9001  >  35978 [ACK] Seq=16586877 Ack=306661631 Win=65535 Len=0
1,2.1931660000000193,10.0.2.15,62.210.85.178,TLSv1.2,4124,Application Data
1,2.193207000000257,62.210.85.178,10.0.2.15,TCP,60,9001  >  35978 [ACK] Seq=16586877 Ack=306663091 Win=65535 Len=0
1,2.1932159999996657,62.210.85.178,10.0.2.15,TCP,60,9001  >  35978 [ACK] Seq=16586877 Ack=306664551 Win=65535 Len=0
1,2.1932200000001103,62.210.85.178,10.0.2.15,TCP,60,9001  >  35978 [ACK] Seq=16586877 Ack=306665701 Win=65535 Len=0
1,2.1932589999996708,10.0.2.15,62.210.85.178,TLSv1.2,4124,Application Data
1,2.193296999999802,62.210.85.178,10.0.2.15,TCP,60,9001  >  35978 [ACK] Seq=16586877 Ack=306667161 Win=65535 Len=0
1,2.1933060000001205,62.210.85.178,10.0.2.15,TCP,60,9001  >  35978 [ACK] Seq=16586877 Ack=306668621 Win=65535 Len=0
1,2.1933109999999942,62.210.85.178,10.0.2.15,TCP,60,9001  >  35978 [ACK] Seq=16586877 Ack=306669771 Win=65535 Len=0
1,2.1933490000001257,10.0.2.15,62.210.85.178,TLSv1.2,4124,Application Data
1,2.193387000000257,62.210.85.178,10.0.2.15,TCP,60,9001  >  35978 [ACK] Seq=16586877 Ack=306671231 Win=65535 Len=0
1,2.193395000000237,62.210.85.178,10.0.2.15,TCP,60,9001  >  35978 [ACK] Seq=16586877 Ack=306672691 Win=65535 Len=0
1,2.193398999999772,62.210.85.178,10.0.2.15,TCP,60,9001  >  35978 [ACK] Seq=16586877 Ack=306673841 Win=65535 Len=0
1,2.1934339999997974,10.0.2.15,62.210.85.178,TLSv1.2,332,Application Data
1,2.1934709999995903,62.210.85.178,10.0.2.15,TCP,60,9001  >  35978 [ACK] Seq=16586877 Ack=306674119 Win=65535 Len=0
1,2.193521999999575,10.0.2.15,62.210.85.178,TLSv1.2,3868,Application Data
1,2.193561999999474,62.210.85.178,10.0.2.15,TCP,60,9001  >  35978 [ACK] Seq=16586877 Ack=306675579 Win=65535 Len=0
1,2.193569999999454,62.210.85.178,10.0.2.15,TCP,60,9001  >  35978 [ACK] Seq=16586877 Ack=306677039 Win=65535 Len=0
1,2.1935739999998987,62.210.85.178,10.0.2.15,TCP,60,9001  >  35978 [ACK] Seq=16586877 Ack=306677933 Win=65535 Len=0
1,2.193612999999459,10.0.2.15,62.210.85.178,TLSv1.2,3480,Application Data
1,2.1936509999995906,62.210.85.178,10.0.2.15,TCP,60,9001  >  35978 [ACK] Seq=16586877 Ack=306679393 Win=65535 Len=0
1,2.1936589999995704,62.210.85.178,10.0.2.15,TCP,60,9001  >  35978 [ACK] Seq=16586877 Ack=306680853 Win=65535 Len=0
1,2.193663999999444,62.210.85.178,10.0.2.15,TCP,60,9001  >  35978 [ACK] Seq=16586877 Ack=306681359 Win=65535 Len=0
1,2.272746999999981,54.93.77.70,10.0.2.15,TLSv1.2,5846,Application Data
1,2.2728930000002947,10.0.2.15,54.93.77.70,TCP,54,34692  >  9001 [ACK] Seq=16633333 Ack=306261115 Win=65535 Len=0
1,2.273067999999512,54.93.77.70,10.0.2.15,TLSv1.2,2016,Application Data
1,2.2731329999996888,10.0.2.15,54.93.77.70,TCP,54,34692  >  9001 [ACK] Seq=16633333 Ack=306263077 Win=65535 Len=0
1,2.291486000000077,54.93.77.70,10.0.2.15,TLSv1.2,590,Application Data
1,2.2943530000002283,54.93.77.70,10.0.2.15,TCP,2950,"9001  >  34692 [PSH, ACK] Seq=306263613 Ack=16633333 Win=65535 Len=2896 [TCP segment of a reassembled PDU]"
1,2.294448999999986,10.0.2.15,54.93.77.70,TCP,54,34692  >  9001 [ACK] Seq=16633333 Ack=306266509 Win=65535 Len=0
1,2.3027659999997923,54.93.77.70,10.0.2.15,TLSv1.2,7294,"Application Data, Application Data"
1,2.302853000000141,10.0.2.15,54.93.77.70,TCP,54,34692  >  9001 [ACK] Seq=16633333 Ack=306273749 Win=65535 Len=0
1,2.313532999999552,54.93.77.70,10.0.2.15,TLSv1.2,5636,"Application Data, Application Data"
1,2.3135819999997693,10.0.2.15,54.93.77.70,TCP,54,34692  >  9001 [ACK] Seq=16633333 Ack=306279331 Win=65535 Len=0
1,2.3279959999999846,54.93.77.70,10.0.2.15,TLSv1.2,2950,Application Data [TCP segment of a reassembled PDU]
1,2.3280409999997573,10.0.2.15,54.93.77.70,TCP,54,34692  >  9001 [ACK] Seq=16633333 Ack=306282227 Win=65535 Len=0
1,2.3299329999999827,54.93.77.70,10.0.2.15,TLSv1.2,1104,Application Data
1,2.3300710000003164,10.0.2.15,54.93.77.70,TLSv1.2,590,Application Data
1,2.33014699999967,54.93.77.70,10.0.2.15,TCP,60,9001  >  34692 [ACK] Seq=306283277 Ack=16633869 Win=65535 Len=0
1,2.3349520000001576,54.93.77.70,10.0.2.15,TLSv1.2,5846,Application Data
1,2.3349749999997584,54.93.77.70,10.0.2.15,TLSv1.2,5846,Application Data [TCP segment of a reassembled PDU]
1,2.3350519999994503,10.0.2.15,54.93.77.70,TCP,54,34692  >  9001 [ACK] Seq=16633869 Ack=306294861 Win=65535 Len=0
1,2.346429000000171,54.93.77.70,10.0.2.15,TLSv1.2,4398,Application Data [TCP segment of a reassembled PDU]
1,2.346480000000156,10.0.2.15,54.93.77.70,TCP,54,34692  >  9001 [ACK] Seq=16633869 Ack=306299205 Win=65535 Len=0
1,2.347657999999683,54.93.77.70,10.0.2.15,TLSv1.2,7294,"Application Data, Application Data"
1,2.3477350000002843,10.0.2.15,54.93.77.70,TCP,54,34692  >  9001 [ACK] Seq=16633869 Ack=306306445 Win=65535 Len=0
1,2.34801299999981,10.0.2.15,54.93.77.70,TLSv1.2,590,Application Data
1,2.3481309999997393,54.93.77.70,10.0.2.15,TCP,60,9001  >  34692 [ACK] Seq=306306445 Ack=16634405 Win=65535 Len=0
1,2.348931999999877,54.93.77.70,10.0.2.15,TLSv1.2,662,Application Data
1,2.357216000000335,10.0.2.15,54.93.77.70,TLSv1.2,590,Application Data
1,2.357336999999461,54.93.77.70,10.0.2.15,TCP,60,9001  >  34692 [ACK] Seq=306307053 Ack=16634941 Win=65535 Len=0
1,2.3908590000000913,54.93.77.70,10.0.2.15,TCP,2950,"9001  >  34692 [PSH, ACK] Seq=306307053 Ack=16634941 Win=65535 Len=2896 [TCP segment of a reassembled PDU]"
1,2.390946999999869,10.0.2.15,54.93.77.70,TCP,54,34692  >  9001 [ACK] Seq=16634941 Ack=306309949 Win=65535 Len=0
1,2.3913089999996373,54.93.77.70,10.0.2.15,TLSv1.2,778,Application Data
1,2.403548999999657,54.93.77.70,10.0.2.15,TLSv1.2,5846,Application Data
1,2.4035690000000614,54.93.77.70,10.0.2.15,TLSv1.2,4398,Application Data [TCP segment of a reassembled PDU]
1,2.4036340000002383,10.0.2.15,54.93.77.70,TCP,54,34692  >  9001 [ACK] Seq=16634941 Ack=306320809 Win=65535 Len=0
1,2.4042899999994916,54.93.77.70,10.0.2.15,TLSv1.2,5846,Application Data [TCP segment of a reassembled PDU]
1,2.4043430000001536,10.0.2.15,54.93.77.70,TCP,54,34692  >  9001 [ACK] Seq=16634941 Ack=306326601 Win=65535 Len=0
1,2.4057080000002316,54.93.77.70,10.0.2.15,TLSv1.2,7294,"Application Data, Application Data, Application Data"
1,2.405775000000176,10.0.2.15,54.93.77.70,TCP,54,34692  >  9001 [ACK] Seq=16634941 Ack=306333841 Win=65535 Len=0
1,2.4223940000001676,54.93.77.70,10.0.2.15,TLSv1.2,684,Application Data
1,2.422571999999491,10.0.2.15,54.93.77.70,TLSv1.2,590,Application Data
1,2.422649000000092,54.93.77.70,10.0.2.15,TCP,60,9001  >  34692 [ACK] Seq=306334471 Ack=16635477 Win=65535 Len=0
1,2.436939000000166,10.0.2.15,54.93.77.70,TLSv1.2,590,Application Data
1,2.437130000000252,54.93.77.70,10.0.2.15,TCP,60,9001  >  34692 [ACK] Seq=306334471 Ack=16636013 Win=65535 Len=0
1,2.4781679999996413,62.210.85.178,10.0.2.15,TLSv1.2,1104,Application Data
1,2.5205839999998716,10.0.2.15,62.210.85.178,TCP,54,35978  >  9001 [ACK] Seq=306681359 Ack=16587927 Win=65535 Len=0
1,2.622827999999572,62.210.85.178,10.0.2.15,TLSv1.2,1104,Application Data
1,2.6229119999998147,10.0.2.15,62.210.85.178,TCP,54,35978  >  9001 [ACK] Seq=306681359 Ack=16588977 Win=65535 Len=0
1,2.717472000000271,62.210.85.178,10.0.2.15,TLSv1.2,590,Application Data
1,2.7175399999996444,10.0.2.15,62.210.85.178,TCP,54,35978  >  9001 [ACK] Seq=306681359 Ack=16589513 Win=65535 Len=0
1,2.7180280000002313,10.0.2.15,62.210.85.178,TLSv1.2,590,Application Data
1,2.718127999999524,62.210.85.178,10.0.2.15,TCP,60,9001  >  35978 [ACK] Seq=16589513 Ack=306681895 Win=65535 Len=0
1,2.9299220000002606,54.93.77.70,10.0.2.15,TLSv1.2,590,Application Data
1,2.930301999999756,10.0.2.15,54.93.77.70,TLSv1.2,590,Application Data
1,2.9304030000002967,54.93.77.70,10.0.2.15,TCP,60,9001  >  34692 [ACK] Seq=306335007 Ack=16636549 Win=65535 Len=0
1,3.066671999999926,62.210.85.178,10.0.2.15,TLSv1.2,590,Application Data
1,3.0772680000000037,10.0.2.15,62.210.85.178,TLSv1.2,590,Application Data
1,3.077414999999746,62.210.85.178,10.0.2.15,TCP,60,9001  >  35978 [ACK] Seq=16590049 Ack=306682431 Win=65535 Len=0
1,3.0893850000002203,10.0.2.15,62.210.85.178,TLSv1.2,4124,Application Data
1,3.0902980000000753,62.210.85.178,10.0.2.15,TCP,60,9001  >  35978 [ACK] Seq=16590049 Ack=306683891 Win=65535 Len=0
1,3.09036500000002,62.210.85.178,10.0.2.15,TCP,60,9001  >  35978 [ACK] Seq=16590049 Ack=306685351 Win=65535 Len=0
1,3.090368999999555,62.210.85.178,10.0.2.15,TCP,60,9001  >  35978 [ACK] Seq=16590049 Ack=306686501 Win=65535 Len=0
1,3.0907259999994494,10.0.2.15,62.210.85.178,TLSv1.2,4124,Application Data
1,3.091073999999935,62.210.85.178,10.0.2.15,TCP,60,9001  >  35978 [ACK] Seq=16590049 Ack=306687961 Win=65535 Len=0
1,3.091131000000132,62.210.85.178,10.0.2.15,TCP,60,9001  >  35978 [ACK] Seq=16590049 Ack=306689421 Win=65535 Len=0
1,3.0912429999998494,62.210.85.178,10.0.2.15,TCP,60,9001  >  35978 [ACK] Seq=16590049 Ack=306690571 Win=65535 Len=0
1,3.0913250000003245,10.0.2.15,62.210.85.178,TCP,2974,35978  >  9001 [ACK] Seq=306690571 Ack=16590049 Win=65535 Len=2920 [TCP segment of a reassembled PDU]
1,3.0915079999995214,62.210.85.178,10.0.2.15,TCP,60,9001  >  35978 [ACK] Seq=16590049 Ack=306692031 Win=65535 Len=0
1,3.091526000000158,62.210.85.178,10.0.2.15,TCP,60,9001  >  35978 [ACK] Seq=16590049 Ack=306693491 Win=65535 Len=0
1,3.091588000000229,10.0.2.15,62.210.85.178,TLSv1.2,1204,Application Data
1,3.0916889999998602,10.0.2.15,62.210.85.178,TCP,2974,35978  >  9001 [ACK] Seq=306694641 Ack=16590049 Win=65535 Len=2920 [TCP segment of a reassembled PDU]
1,3.0918320000000676,10.0.2.15,62.210.85.178,TLSv1.2,4434,"Application Data, Application Data"
1,3.0918839999994816,62.210.85.178,10.0.2.15,TCP,60,9001  >  35978 [ACK] Seq=16590049 Ack=306694641 Win=65535 Len=0
1,3.0918940000001385,62.210.85.178,10.0.2.15,TCP,60,9001  >  35978 [ACK] Seq=16590049 Ack=306696101 Win=65535 Len=0
1,3.0919000000003507,62.210.85.178,10.0.2.15,TCP,60,9001  >  35978 [ACK] Seq=16590049 Ack=306697561 Win=65535 Len=0
1,3.0919050000002244,62.210.85.178,10.0.2.15,TCP,60,9001  >  35978 [ACK] Seq=16590049 Ack=306699021 Win=65535 Len=0
1,3.0919480000002295,10.0.2.15,62.210.85.178,TLSv1.2,916,Application Data
1,3.09198699999979,62.210.85.178,10.0.2.15,TCP,60,9001  >  35978 [ACK] Seq=16590049 Ack=306700481 Win=65535 Len=0
1,3.0919960000001083,62.210.85.178,10.0.2.15,TCP,60,9001  >  35978 [ACK] Seq=16590049 Ack=306701941 Win=65535 Len=0
1,3.0919990000002144,62.210.85.178,10.0.2.15,TCP,60,9001  >  35978 [ACK] Seq=16590049 Ack=306702803 Win=65535 Len=0
1,3.0920429999996486,10.0.2.15,62.210.85.178,TLSv1.2,4124,Application Data
1,3.092091999999866,62.210.85.178,10.0.2.15,TCP,60,9001  >  35978 [ACK] Seq=16590049 Ack=306704263 Win=65535 Len=0
1,3.092098999999507,62.210.85.178,10.0.2.15,TCP,60,9001  >  35978 [ACK] Seq=16590049 Ack=306705723 Win=65535 Len=0
1,3.0921019999996133,62.210.85.178,10.0.2.15,TCP,60,9001  >  35978 [ACK] Seq=16590049 Ack=306706873 Win=65535 Len=0
1,3.092142999999851,10.0.2.15,62.210.85.178,TLSv1.2,3030,Application Data
1,3.0922350000000733,62.210.85.178,10.0.2.15,TCP,60,9001  >  35978 [ACK] Seq=16590049 Ack=306708333 Win=65535 Len=0
1,3.092247999999927,62.210.85.178,10.0.2.15,TCP,60,9001  >  35978 [ACK] Seq=16590049 Ack=306709793 Win=65535 Len=0
1,3.092251000000033,62.210.85.178,10.0.2.15,TCP,60,9001  >  35978 [ACK] Seq=16590049 Ack=306709849 Win=65535 Len=0
1,3.10143700000026,10.0.2.15,62.210.85.178,TLSv1.2,4124,Application Data
1,3.1015520000000834,62.210.85.178,10.0.2.15,TCP,60,9001  >  35978 [ACK] Seq=16590049 Ack=306711309 Win=65535 Len=0
1,3.1015660000002754,62.210.85.178,10.0.2.15,TCP,60,9001  >  35978 [ACK] Seq=16590049 Ack=306712769 Win=65535 Len=0
1,3.1015699999998105,62.210.85.178,10.0.2.15,TCP,60,9001  >  35978 [ACK] Seq=16590049 Ack=306713919 Win=65535 Len=0
1,3.1016129999998157,10.0.2.15,62.210.85.178,TLSv1.2,4124,Application Data
1,3.101654000000053,62.210.85.178,10.0.2.15,TCP,60,9001  >  35978 [ACK] Seq=16590049 Ack=306715379 Win=65535 Len=0
1,3.1017089999995733,62.210.85.178,10.0.2.15,TCP,60,9001  >  35978 [ACK] Seq=16590049 Ack=306716839 Win=65535 Len=0
1,3.101716000000124,62.210.85.178,10.0.2.15,TCP,60,9001  >  35978 [ACK] Seq=16590049 Ack=306717989 Win=65535 Len=0
1,3.1017689999998765,10.0.2.15,62.210.85.178,TLSv1.2,4124,Application Data
1,3.101807000000008,62.210.85.178,10.0.2.15,TCP,60,9001  >  35978 [ACK] Seq=16590049 Ack=306719449 Win=65535 Len=0
1,3.1018599999997605,62.210.85.178,10.0.2.15,TCP,60,9001  >  35978 [ACK] Seq=16590049 Ack=306720909 Win=65535 Len=0
1,3.1018670000003112,62.210.85.178,10.0.2.15,TCP,60,9001  >  35978 [ACK] Seq=16590049 Ack=306722059 Win=65535 Len=0
1,3.1019079999996393,10.0.2.15,62.210.85.178,TLSv1.2,4124,Application Data
1,3.1019459999997707,62.210.85.178,10.0.2.15,TCP,60,9001  >  35978 [ACK] Seq=16590049 Ack=306723519 Win=65535 Len=0
1,3.101998999999523,62.210.85.178,10.0.2.15,TCP,60,9001  >  35978 [ACK] Seq=16590049 Ack=306724979 Win=65535 Len=0
1,3.102006000000074,62.210.85.178,10.0.2.15,TCP,60,9001  >  35978 [ACK] Seq=16590049 Ack=306726129 Win=65535 Len=0
1,3.102042999999867,10.0.2.15,62.210.85.178,TLSv1.2,332,Application Data
1,3.1021099999998114,62.210.85.178,10.0.2.15,TCP,60,9001  >  35978 [ACK] Seq=16590049 Ack=306726407 Win=65535 Len=0
1,3.1021860000000743,10.0.2.15,62.210.85.178,TLSv1.2,590,Application Data
1,3.1022259999999733,62.210.85.178,10.0.2.15,TCP,60,9001  >  35978 [ACK] Seq=16590049 Ack=306726943 Win=65535 Len=0
1,3.1832119999999122,54.93.77.70,10.0.2.15,TLSv1.2,3674,Application Data
1,3.1833550000001196,10.0.2.15,54.93.77.70,TCP,54,34692  >  9001 [ACK] Seq=16636549 Ack=306338627 Win=65535 Len=0
1,3.2121070000002874,54.93.77.70,10.0.2.15,TLSv1.2,590,Application Data
1,3.22076399999969,54.93.77.70,10.0.2.15,TLSv1.2,4398,Application Data
1,3.2208190000001196,10.0.2.15,54.93.77.70,TCP,54,34692  >  9001 [ACK] Seq=16636549 Ack=306343507 Win=65535 Len=0
1,3.2214359999998123,54.93.77.70,10.0.2.15,TCP,2950,"9001  >  34692 [PSH, ACK] Seq=306343507 Ack=16636549 Win=65535 Len=2896 [TCP segment of a reassembled PDU]"
1,3.22147700000005,10.0.2.15,54.93.77.70,TCP,54,34692  >  9001 [ACK] Seq=16636549 Ack=306346403 Win=65535 Len=0
1,3.2324330000001282,54.93.77.70,10.0.2.15,TLSv1.2,4398,Application Data [TCP segment of a reassembled PDU]
1,3.2324730000000272,10.0.2.15,54.93.77.70,TCP,54,34692  >  9001 [ACK] Seq=16636549 Ack=306350747 Win=65535 Len=0
1,3.238040999999612,54.93.77.70,10.0.2.15,TLSv1.2,3978,"Application Data, Application Data"
1,3.238104000000021,10.0.2.15,54.93.77.70,TCP,54,34692  >  9001 [ACK] Seq=16636549 Ack=306354671 Win=65535 Len=0
1,3.238328999999794,10.0.2.15,54.93.77.70,TLSv1.2,590,Application Data
1,3.2383979999995063,54.93.77.70,10.0.2.15,TCP,60,9001  >  34692 [ACK] Seq=306354671 Ack=16637085 Win=65535 Len=0
1,3.2417599999998856,54.93.77.70,10.0.2.15,TCP,2950,"9001  >  34692 [PSH, ACK] Seq=306354671 Ack=16637085 Win=65535 Len=2896 [TCP segment of a reassembled PDU]"
1,3.241823000000295,10.0.2.15,54.93.77.70,TCP,54,34692  >  9001 [ACK] Seq=16637085 Ack=306357567 Win=65535 Len=0
1,3.243080000000191,54.93.77.70,10.0.2.15,TLSv1.2,8742,"Application Data, Application Data"
1,3.2431479999995645,10.0.2.15,54.93.77.70,TCP,54,34692  >  9001 [ACK] Seq=16637085 Ack=306366255 Win=65535 Len=0
1,3.2484569999996893,10.0.2.15,54.93.77.70,TLSv1.2,590,Application Data
1,3.2485599999999977,54.93.77.70,10.0.2.15,TCP,60,9001  >  34692 [ACK] Seq=306366255 Ack=16637621 Win=65535 Len=0
1,3.2542619999994713,54.93.77.70,10.0.2.15,TLSv1.2,358,Application Data
1,3.2616799999996147,54.93.77.70,10.0.2.15,TLSv1.2,4398,Application Data
1,3.2617490000002363,10.0.2.15,54.93.77.70,TCP,54,34692  >  9001 [ACK] Seq=16637621 Ack=306370903 Win=65535 Len=0
1,3.2789899999997942,54.93.77.70,10.0.2.15,TLSv1.2,380,Application Data
1,3.2829039999996894,54.93.77.70,10.0.2.15,TCP,2950,"9001  >  34692 [PSH, ACK] Seq=306371229 Ack=16637621 Win=65535 Len=2896 [TCP segment of a reassembled PDU]"
1,3.2829499999998006,10.0.2.15,54.93.77.70,TCP,54,34692  >  9001 [ACK] Seq=16637621 Ack=306374125 Win=65535 Len=0
1,3.2990039999995133,54.93.77.70,10.0.2.15,TLSv1.2,778,Application Data
1,3.340562000000318,10.0.2.15,54.93.77.70,TCP,54,34692  >  9001 [ACK] Seq=16637621 Ack=306374849 Win=65535 Len=0
1,3.3608150000000023,62.210.85.178,10.0.2.15,TLSv1.2,590,Application Data
1,3.3939140000002226,54.93.77.70,10.0.2.15,TLSv1.2,4724,"Application Data, Application Data"
1,3.3940050000001065,10.0.2.15,54.93.77.70,TCP,54,34692  >  9001 [ACK] Seq=16637621 Ack=306379519 Win=65535 Len=0
1,3.395121999999901,10.0.2.15,54.93.77.70,TLSv1.2,590,Application Data
1,3.3952360000002955,54.93.77.70,10.0.2.15,TCP,60,9001  >  34692 [ACK] Seq=306379519 Ack=16638157 Win=65535 Len=0
1,3.4045939999996335,10.0.2.15,62.210.85.178,TCP,54,35978  >  9001 [ACK] Seq=306726943 Ack=16590585 Win=65535 Len=0
1,3.4050179999994725,10.0.2.15,54.93.77.70,TLSv1.2,590,Application Data
1,3.4051369999997405,54.93.77.70,10.0.2.15,TCP,60,9001  >  34692 [ACK] Seq=306379519 Ack=16638693 Win=65535 Len=0
1,3.409929999999804,54.93.77.70,10.0.2.15,TLSv1.2,590,Application Data
1,3.4336249999996653,62.210.85.178,10.0.2.15,TLSv1.2,590,Application Data
1,3.4336999999995896,10.0.2.15,62.210.85.178,TCP,54,35978  >  9001 [ACK] Seq=306726943 Ack=16591121 Win=65535 Len=0
1,3.4527539999999135,10.0.2.15,54.93.77.70,TCP,54,34692  >  9001 [ACK] Seq=16638693 Ack=306380055 Win=65535 Len=0
1,3.523255999999492,62.210.85.178,10.0.2.15,TLSv1.2,590,Application Data
1,3.5233399999997346,10.0.2.15,62.210.85.178,TCP,54,35978  >  9001 [ACK] Seq=306726943 Ack=16591657 Win=65535 Len=0
1,3.857156999999461,62.210.85.178,10.0.2.15,TLSv1.2,590,Application Data
1,3.8572489999996833,10.0.2.15,62.210.85.178,TCP,54,35978  >  9001 [ACK] Seq=306726943 Ack=16592193 Win=65535 Len=0
1,3.8575920000002952,10.0.2.15,62.210.85.178,TLSv1.2,590,Application Data
1,3.8577189999996335,62.210.85.178,10.0.2.15,TCP,60,9001  >  35978 [ACK] Seq=16592193 Ack=306727479 Win=65535 Len=0
1,4.056454999999914,54.93.77.70,10.0.2.15,TLSv1.2,590,Application Data
1,4.056540999999925,10.0.2.15,54.93.77.70,TCP,54,34692  >  9001 [ACK] Seq=16638693 Ack=306380591 Win=65535 Len=0
1,4.057021999999961,10.0.2.15,54.93.77.70,TLSv1.2,590,Application Data
1,4.057149000000209,54.93.77.70,10.0.2.15,TCP,60,9001  >  34692 [ACK] Seq=306380591 Ack=16639229 Win=65535 Len=0
1,4.170906000000286,62.210.85.178,10.0.2.15,TLSv1.2,590,Application Data
1,4.179352000000108,10.0.2.15,62.210.85.178,TLSv1.2,590,Application Data
1,4.179529000000002,62.210.85.178,10.0.2.15,TCP,60,9001  >  35978 [ACK] Seq=16592729 Ack=306728015 Win=65535 Len=0
1,4.193121000000247,10.0.2.15,62.210.85.178,TLSv1.2,4124,Application Data
1,4.193255999999565,10.0.2.15,62.210.85.178,TCP,2974,35978  >  9001 [ACK] Seq=306732085 Ack=16592729 Win=65535 Len=2920 [TCP segment of a reassembled PDU]
1,4.193301999999676,62.210.85.178,10.0.2.15,TCP,60,9001  >  35978 [ACK] Seq=16592729 Ack=306729475 Win=65535 Len=0
1,4.193312999999762,62.210.85.178,10.0.2.15,TCP,60,9001  >  35978 [ACK] Seq=16592729 Ack=306730935 Win=65535 Len=0
1,4.1933170000002065,62.210.85.178,10.0.2.15,TCP,60,9001  >  35978 [ACK] Seq=16592729 Ack=306732085 Win=65535 Len=0
1,4.193320999999742,62.210.85.178,10.0.2.15,TCP,60,9001  >  35978 [ACK] Seq=16592729 Ack=306733545 Win=65535 Len=0
1,4.193325000000186,62.210.85.178,10.0.2.15,TCP,60,9001  >  35978 [ACK] Seq=16592729 Ack=306735005 Win=65535 Len=0
1,4.193379000000277,10.0.2.15,62.210.85.178,TLSv1.2,1204,Application Data
1,4.193449000000328,10.0.2.15,62.210.85.178,TCP,2974,35978  >  9001 [ACK] Seq=306736155 Ack=16592729 Win=65535 Len=2920 [TCP segment of a reassembled PDU]
1,4.193489000000227,62.210.85.178,10.0.2.15,TCP,60,9001  >  35978 [ACK] Seq=16592729 Ack=306736155 Win=65535 Len=0
1,4.193495999999868,62.210.85.178,10.0.2.15,TCP,60,9001  >  35978 [ACK] Seq=16592729 Ack=306737615 Win=65535 Len=0
1,4.193500999999742,62.210.85.178,10.0.2.15,TCP,60,9001  >  35978 [ACK] Seq=16592729 Ack=306739075 Win=65535 Len=0
1,4.193535000000338,10.0.2.15,62.210.85.178,TLSv1.2,1204,Application Data
1,4.193599999999606,10.0.2.15,62.210.85.178,TCP,2974,35978  >  9001 [ACK] Seq=306740225 Ack=16592729 Win=65535 Len=2920 [TCP segment of a reassembled PDU]
1,4.1936359999999695,62.210.85.178,10.0.2.15,TCP,60,9001  >  35978 [ACK] Seq=16592729 Ack=306740225 Win=65535 Len=0
1,4.193642999999611,62.210.85.178,10.0.2.15,TCP,60,9001  >  35978 [ACK] Seq=16592729 Ack=306741685 Win=65535 Len=0
1,4.193647000000055,62.210.85.178,10.0.2.15,TCP,60,9001  >  35978 [ACK] Seq=16592729 Ack=306743145 Win=65535 Len=0
1,4.193677999999636,10.0.2.15,62.210.85.178,TLSv1.2,1204,Application Data
1,4.193760000000111,10.0.2.15,62.210.85.178,TLSv1.2,2974,Application Data
1,4.193804999999884,62.210.85.178,10.0.2.15,TCP,60,9001  >  35978 [ACK] Seq=16592729 Ack=306744295 Win=65535 Len=0
1,4.193811999999525,62.210.85.178,10.0.2.15,TCP,60,9001  >  35978 [ACK] Seq=16592729 Ack=306745755 Win=65535 Len=0
1,4.193817000000308,62.210.85.178,10.0.2.15,TCP,60,9001  >  35978 [ACK] Seq=16592729 Ack=306747215 Win=65535 Len=0
1,4.193849999999657,10.0.2.15,62.210.85.178,TLSv1.2,1226,Application Data
1,4.193887999999788,62.210.85.178,10.0.2.15,TCP,60,9001  >  35978 [ACK] Seq=16592729 Ack=306748387 Win=65535 Len=0
1,4.193935000000238,10.0.2.15,62.210.85.178,TLSv1.2,4124,Application Data
1,4.193978000000243,62.210.85.178,10.0.2.15,TCP,60,9001  >  35978 [ACK] Seq=16592729 Ack=306749847 Win=65535 Len=0
1,4.193984999999884,62.210.85.178,10.0.2.15,TCP,60,9001  >  35978 [ACK] Seq=16592729 Ack=306751307 Win=65535 Len=0
1,4.193989000000329,62.210.85.178,10.0.2.15,TCP,60,9001  >  35978 [ACK] Seq=16592729 Ack=306752457 Win=65535 Len=0
1,4.1940349999995306,10.0.2.15,62.210.85.178,TLSv1.2,3030,Application Data
1,4.1940740000000005,62.210.85.178,10.0.2.15,TCP,60,9001  >  35978 [ACK] Seq=16592729 Ack=306753917 Win=65535 Len=0
1,4.194080999999642,62.210.85.178,10.0.2.15,TCP,60,9001  >  35978 [ACK] Seq=16592729 Ack=306755377 Win=65535 Len=0
1,4.194085000000086,62.210.85.178,10.0.2.15,TCP,60,9001  >  35978 [ACK] Seq=16592729 Ack=306755433 Win=65535 Len=0
1,4.2032979999994495,10.0.2.15,62.210.85.178,TLSv1.2,4124,Application Data
1,4.203381000000263,10.0.2.15,62.210.85.178,TCP,2974,35978  >  9001 [ACK] Seq=306759503 Ack=16592729 Win=65535 Len=2920 [TCP segment of a reassembled PDU]
1,4.203421000000162,62.210.85.178,10.0.2.15,TCP,60,9001  >  35978 [ACK] Seq=16592729 Ack=306756893 Win=65535 Len=0
1,4.203429000000142,62.210.85.178,10.0.2.15,TCP,60,9001  >  35978 [ACK] Seq=16592729 Ack=306758353 Win=65535 Len=0
1,4.203432999999677,62.210.85.178,10.0.2.15,TCP,60,9001  >  35978 [ACK] Seq=16592729 Ack=306759503 Win=65535 Len=0
1,4.20346999999947,10.0.2.15,62.210.85.178,TLSv1.2,1204,Application Data
1,4.203505999999834,62.210.85.178,10.0.2.15,TCP,60,9001  >  35978 [ACK] Seq=16592729 Ack=306760963 Win=65535 Len=0
1,4.203512999999475,62.210.85.178,10.0.2.15,TCP,60,9001  >  35978 [ACK] Seq=16592729 Ack=306762423 Win=65535 Len=0
1,4.20351699999992,62.210.85.178,10.0.2.15,TCP,60,9001  >  35978 [ACK] Seq=16592729 Ack=306763573 Win=65535 Len=0
1,4.203564999999799,10.0.2.15,62.210.85.178,TLSv1.2,4124,Application Data
1,4.203604999999698,62.210.85.178,10.0.2.15,TCP,60,9001  >  35978 [ACK] Seq=16592729 Ack=306765033 Win=65535 Len=0
1,4.203612000000248,62.210.85.178,10.0.2.15,TCP,60,9001  >  35978 [ACK] Seq=16592729 Ack=306766493 Win=65535 Len=0
1,4.203617000000122,62.210.85.178,10.0.2.15,TCP,60,9001  >  35978 [ACK] Seq=16592729 Ack=306767643 Win=65535 Len=0
1,4.203661999999895,10.0.2.15,62.210.85.178,TLSv1.2,4124,Application Data
1,4.203757000000223,62.210.85.178,10.0.2.15,TCP,60,9001  >  35978 [ACK] Seq=16592729 Ack=306769103 Win=65535 Len=0
1,4.203765000000203,62.210.85.178,10.0.2.15,TCP,60,9001  >  35978 [ACK] Seq=16592729 Ack=306770563 Win=65535 Len=0
1,4.203768999999738,62.210.85.178,10.0.2.15,TCP,60,9001  >  35978 [ACK] Seq=16592729 Ack=306771713 Win=65535 Len=0
1,4.203803999999764,10.0.2.15,62.210.85.178,TLSv1.2,332,Application Data
1,4.203841999999895,62.210.85.178,10.0.2.15,TCP,60,9001  >  35978 [ACK] Seq=16592729 Ack=306771991 Win=65535 Len=0
1,4.203881999999794,10.0.2.15,62.210.85.178,TLSv1.2,3868,Application Data
1,4.203921999999693,62.210.85.178,10.0.2.15,TCP,60,9001  >  35978 [ACK] Seq=16592729 Ack=306773451 Win=65535 Len=0
1,4.203929000000244,62.210.85.178,10.0.2.15,TCP,60,9001  >  35978 [ACK] Seq=16592729 Ack=306774911 Win=65535 Len=0
1,4.203932999999779,62.210.85.178,10.0.2.15,TCP,60,9001  >  35978 [ACK] Seq=16592729 Ack=306775805 Win=65535 Len=0
1,4.20397899999989,10.0.2.15,62.210.85.178,TLSv1.2,4124,Application Data
1,4.204018999999789,62.210.85.178,10.0.2.15,TCP,60,9001  >  35978 [ACK] Seq=16592729 Ack=306777265 Win=65535 Len=0
1,4.2040250000000015,62.210.85.178,10.0.2.15,TCP,60,9001  >  35978 [ACK] Seq=16592729 Ack=306778725 Win=65535 Len=0
1,4.204029999999875,62.210.85.178,10.0.2.15,TCP,60,9001  >  35978 [ACK] Seq=16592729 Ack=306779875 Win=65535 Len=0
1,4.20407299999988,10.0.2.15,62.210.85.178,TLSv1.2,3030,Application Data
1,4.204112999999779,62.210.85.178,10.0.2.15,TCP,60,9001  >  35978 [ACK] Seq=16592729 Ack=306781335 Win=65535 Len=0
1,4.20412000000033,62.210.85.178,10.0.2.15,TCP,60,9001  >  35978 [ACK] Seq=16592729 Ack=306782795 Win=65535 Len=0
1,4.204123999999865,62.210.85.178,10.0.2.15,TCP,60,9001  >  35978 [ACK] Seq=16592729 Ack=306782851 Win=65535 Len=0
1,4.21766099999968,10.0.2.15,62.210.85.178,TLSv1.2,4124,Application Data
1,4.217751999999564,10.0.2.15,62.210.85.178,TCP,2974,35978  >  9001 [ACK] Seq=306786921 Ack=16592729 Win=65535 Len=2920 [TCP segment of a reassembled PDU]
1,4.217791000000034,62.210.85.178,10.0.2.15,TCP,60,9001  >  35978 [ACK] Seq=16592729 Ack=306784311 Win=65535 Len=0
1,4.217799999999443,62.210.85.178,10.0.2.15,TCP,60,9001  >  35978 [ACK] Seq=16592729 Ack=306785771 Win=65535 Len=0
1,4.217805000000226,62.210.85.178,10.0.2.15,TCP,60,9001  >  35978 [ACK] Seq=16592729 Ack=306786921 Win=65535 Len=0
1,4.217808999999761,62.210.85.178,10.0.2.15,TCP,60,9001  >  35978 [ACK] Seq=16592729 Ack=306788381 Win=65535 Len=0
1,4.217813000000206,62.210.85.178,10.0.2.15,TCP,60,9001  >  35978 [ACK] Seq=16592729 Ack=306789841 Win=65535 Len=0
1,4.217853999999534,10.0.2.15,62.210.85.178,TLSv1.2,1204,Application Data
1,4.217921999999817,10.0.2.15,62.210.85.178,TCP,2974,35978  >  9001 [ACK] Seq=306790991 Ack=16592729 Win=65535 Len=2920 [TCP segment of a reassembled PDU]
1,4.217958000000181,62.210.85.178,10.0.2.15,TCP,60,9001  >  35978 [ACK] Seq=16592729 Ack=306790991 Win=65535 Len=0
1,4.217964999999822,62.210.85.178,10.0.2.15,TCP,60,9001  >  35978 [ACK] Seq=16592729 Ack=306792451 Win=65535 Len=0
1,4.2179690000002665,62.210.85.178,10.0.2.15,TCP,60,9001  >  35978 [ACK] Seq=16592729 Ack=306793911 Win=65535 Len=0
1,4.218002999999953,10.0.2.15,62.210.85.178,TLSv1.2,1204,Application Data
1,4.218066999999792,10.0.2.15,62.210.85.178,TCP,2974,35978  >  9001 [ACK] Seq=306795061 Ack=16592729 Win=65535 Len=2920 [TCP segment of a reassembled PDU]
1,4.218104999999923,62.210.85.178,10.0.2.15,TCP,60,9001  >  35978 [ACK] Seq=16592729 Ack=306795061 Win=65535 Len=0
1,4.218111000000135,62.210.85.178,10.0.2.15,TCP,60,9001  >  35978 [ACK] Seq=16592729 Ack=306796521 Win=65535 Len=0
1,4.218116000000009,62.210.85.178,10.0.2.15,TCP,60,9001  >  35978 [ACK] Seq=16592729 Ack=306797981 Win=65535 Len=0
1,4.218147999999928,10.0.2.15,62.210.85.178,TLSv1.2,1204,Application Data
1,4.218237999999474,10.0.2.15,62.210.85.178,TLSv1.2,1514,Application Data
1,4.218260999999984,62.210.85.178,10.0.2.15,TCP,60,9001  >  35978 [ACK] Seq=16592729 Ack=306799131 Win=65535 Len=0
1,4.218294999999671,10.0.2.15,62.210.85.178,TLSv1.2,436,Application Data
1,4.218331999999464,62.210.85.178,10.0.2.15,TCP,60,9001  >  35978 [ACK] Seq=16592729 Ack=306800591 Win=65535 Len=0
1,4.218337999999676,62.210.85.178,10.0.2.15,TCP,60,9001  >  35978 [ACK] Seq=16592729 Ack=306800973 Win=65535 Len=0
1,4.277309000000059,54.93.77.70,10.0.2.15,TLSv1.2,590,Application Data
1,4.30390400000033,54.93.77.70,10.0.2.15,TLSv1.2,3674,Application Data
1,4.304011999999602,10.0.2.15,54.93.77.70,TCP,54,34692  >  9001 [ACK] Seq=16639229 Ack=306384747 Win=65535 Len=0
1,4.314397000000099,54.93.77.70,10.0.2.15,TCP,2950,"9001  >  34692 [PSH, ACK] Seq=306384747 Ack=16639229 Win=65535 Len=2896 [TCP segment of a reassembled PDU]"
1,4.314449999999852,10.0.2.15,54.93.77.70,TCP,54,34692  >  9001 [ACK] Seq=16639229 Ack=306387643 Win=65535 Len=0
1,4.319894999999633,54.93.77.70,10.0.2.15,TLSv1.2,778,Application Data
1,4.321248999999625,54.93.77.70,10.0.2.15,TLSv1.2,4398,Application Data
1,4.32129999999961,10.0.2.15,54.93.77.70,TCP,54,34692  >  9001 [ACK] Seq=16639229 Ack=306392711 Win=65535 Len=0
1,4.337109999999484,54.93.77.70,10.0.2.15,TLSv1.2,380,Application Data
1,4.380589000000327,10.0.2.15,54.93.77.70,TCP,54,34692  >  9001 [ACK] Seq=16639229 Ack=306393037 Win=65535 Len=0
1,4.393213999999716,54.93.77.70,10.0.2.15,TLSv1.2,3674,Application Data
1,4.393274000000019,10.0.2.15,54.93.77.70,TCP,54,34692  >  9001 [ACK] Seq=16639229 Ack=306396657 Win=65535 Len=0
1,4.403301999999712,54.93.77.70,10.0.2.15,TLSv1.2,7294,Application Data
1,4.403357999999571,10.0.2.15,54.93.77.70,TCP,54,34692  >  9001 [ACK] Seq=16639229 Ack=306403897 Win=65535 Len=0
1,4.4038629999995464,54.93.77.70,10.0.2.15,TLSv1.2,4398,Application Data [TCP segment of a reassembled PDU]
1,4.4039050000001225,10.0.2.15,54.93.77.70,TCP,54,34692  >  9001 [ACK] Seq=16639229 Ack=306408241 Win=65535 Len=0
1,4.4039569999995365,54.93.77.70,10.0.2.15,TLSv1.2,1502,Application Data [TCP segment of a reassembled PDU]
1,4.403986999999688,10.0.2.15,54.93.77.70,TCP,54,34692  >  9001 [ACK] Seq=16639229 Ack=306409689 Win=65535 Len=0
1,4.404222000000118,10.0.2.15,54.93.77.70,TLSv1.2,1104,Application Data
1,4.404293999999936,54.93.77.70,10.0.2.15,TCP,60,9001  >  34692 [ACK] Seq=306409689 Ack=16640279 Win=65535 Len=0
1,4.4094969999996465,54.93.77.70,10.0.2.15,TCP,2950,"9001  >  34692 [PSH, ACK] Seq=306409689 Ack=16640279 Win=65535 Len=2896 [TCP segment of a reassembled PDU]"
1,4.409547000000202,10.0.2.15,54.93.77.70,TCP,54,34692  >  9001 [ACK] Seq=16640279 Ack=306412585 Win=65535 Len=0
1,4.4100799999996525,54.93.77.70,10.0.2.15,TLSv1.2,5846,"Application Data, Application Data, Application Data"
1,4.410143999999491,10.0.2.15,54.93.77.70,TCP,54,34692  >  9001 [ACK] Seq=16640279 Ack=306418377 Win=65535 Len=0
1,4.423501000000215,54.93.77.70,10.0.2.15,TLSv1.2,4724,"Application Data, Application Data"
1,4.4235459999999875,10.0.2.15,54.93.77.70,TCP,54,34692  >  9001 [ACK] Seq=16640279 Ack=306423047 Win=65535 Len=0
1,4.440577999999732,54.93.77.70,10.0.2.15,TLSv1.2,2950,"Application Data, Application Data"
1,4.440620999999737,10.0.2.15,54.93.77.70,TCP,54,34692  >  9001 [ACK] Seq=16640279 Ack=306425943 Win=65535 Len=0
1,4.441757999999936,54.93.77.70,10.0.2.15,TLSv1.2,4956,"Application Data, Application Data"
1,4.441821999999775,10.0.2.15,54.93.77.70,TCP,54,34692  >  9001 [ACK] Seq=16640279 Ack=306430845 Win=65535 Len=0
1,4.464936999999736,54.93.77.70,10.0.2.15,TLSv1.2,3674,Application Data
1,4.4649979999994684,10.0.2.15,54.93.77.70,TCP,54,34692  >  9001 [ACK] Seq=16640279 Ack=306434465 Win=65535 Len=0
1,4.465228999999454,10.0.2.15,54.93.77.70,TLSv1.2,590,Application Data
1,4.46535700000004,54.93.77.70,10.0.2.15,TCP,60,9001  >  34692 [ACK] Seq=306434465 Ack=16640815 Win=65535 Len=0
1,4.470996999999443,54.93.77.70,10.0.2.15,TCP,2950,"9001  >  34692 [PSH, ACK] Seq=306434465 Ack=16640815 Win=65535 Len=2896 [TCP segment of a reassembled PDU]"
1,4.471121999999923,10.0.2.15,54.93.77.70,TCP,54,34692  >  9001 [ACK] Seq=16640815 Ack=306437361 Win=65535 Len=0
1,4.481450999999652,54.93.77.70,10.0.2.15,TLSv1.2,264,Application Data
1,4.524559999999838,10.0.2.15,54.93.77.70,TCP,54,34692  >  9001 [ACK] Seq=16640815 Ack=306437571 Win=65535 Len=0
1,4.529846999999791,62.210.85.178,10.0.2.15,TLSv1.2,1104,Application Data
1,4.5540979999996125,54.93.77.70,10.0.2.15,TLSv1.2,3674,Application Data
1,4.554212000000007,10.0.2.15,54.93.77.70,TCP,54,34692  >  9001 [ACK] Seq=16640815 Ack=306441191 Win=65535 Len=0
1,4.563889000000017,54.93.77.70,10.0.2.15,TCP,2950,"9001  >  34692 [PSH, ACK] Seq=306441191 Ack=16640815 Win=65535 Len=2896 [TCP segment of a reassembled PDU]"
1,4.563954000000194,10.0.2.15,54.93.77.70,TCP,54,34692  >  9001 [ACK] Seq=16640815 Ack=306444087 Win=65535 Len=0
1,4.564349999999649,54.93.77.70,10.0.2.15,TLSv1.2,2950,Application Data [TCP segment of a reassembled PDU]
1,4.564392000000225,10.0.2.15,54.93.77.70,TCP,54,34692  >  9001 [ACK] Seq=16640815 Ack=306446983 Win=65535 Len=0
1,4.57260099999985,10.0.2.15,62.210.85.178,TCP,54,35978  >  9001 [ACK] Seq=306800973 Ack=16593779 Win=65535 Len=0
1,4.573566000000028,54.93.77.70,10.0.2.15,TLSv1.2,474,Application Data
1,4.573677000000316,10.0.2.15,54.93.77.70,TCP,54,34692  >  9001 [ACK] Seq=16640815 Ack=306447403 Win=65535 Len=0
1,4.581481000000167,54.93.77.70,10.0.2.15,TCP,2950,"9001  >  34692 [PSH, ACK] Seq=306447403 Ack=16640815 Win=65535 Len=2896 [TCP segment of a reassembled PDU]"
1,4.58161999999993,54.93.77.70,10.0.2.15,TLSv1.2,2950,Application Data [TCP segment of a reassembled PDU]
1,4.581686999999874,10.0.2.15,54.93.77.70,TCP,54,34692  >  9001 [ACK] Seq=16640815 Ack=306453195 Win=65535 Len=0
1,4.598326999999699,54.93.77.70,10.0.2.15,TLSv1.2,988,Application Data
1,4.598393000000215,10.0.2.15,54.93.77.70,TCP,54,34692  >  9001 [ACK] Seq=16640815 Ack=306454129 Win=65535 Len=0
1,4.601214999999684,10.0.2.15,54.93.77.70,TLSv1.2,590,Application Data
1,4.601380999999492,54.93.77.70,10.0.2.15,TCP,60,9001  >  34692 [ACK] Seq=306454129 Ack=16641351 Win=65535 Len=0
1,4.609116999999969,62.210.85.178,10.0.2.15,TLSv1.2,590,Application Data
1,4.609167999999954,10.0.2.15,62.210.85.178,TCP,54,35978  >  9001 [ACK] Seq=306800973 Ack=16594315 Win=65535 Len=0
1,4.736182999999983,62.210.85.178,10.0.2.15,TLSv1.2,590,Application Data
1,4.736272999999528,10.0.2.15,62.210.85.178,TCP,54,35978  >  9001 [ACK] Seq=306800973 Ack=16594851 Win=65535 Len=0
1,4.736789999999928,10.0.2.15,62.210.85.178,TLSv1.2,590,Application Data
1,4.736987999999656,62.210.85.178,10.0.2.15,TCP,60,9001  >  35978 [ACK] Seq=16594851 Ack=306801509 Win=65535 Len=0
1,4.862513000000035,54.93.77.70,10.0.2.15,TLSv1.2,590,Application Data
1,4.863021999999546,10.0.2.15,54.93.77.70,TLSv1.2,590,Application Data
1,4.863172000000304,54.93.77.70,10.0.2.15,TCP,60,9001  >  34692 [ACK] Seq=306454665 Ack=16641887 Win=65535 Len=0
1,4.965478999999505,62.210.85.178,10.0.2.15,TLSv1.2,590,Application Data
1,4.968988999999965,10.0.2.15,62.210.85.178,TLSv1.2,590,Application Data
1,4.969124000000193,62.210.85.178,10.0.2.15,TCP,60,9001  >  35978 [ACK] Seq=16595387 Ack=306802045 Win=65535 Len=0
1,4.981037999999899,10.0.2.15,62.210.85.178,TLSv1.2,4124,Application Data
1,4.9811680000002525,10.0.2.15,62.210.85.178,TCP,2974,35978  >  9001 [ACK] Seq=306806115 Ack=16595387 Win=65535 Len=2920 [TCP segment of a reassembled PDU]
1,4.981219000000237,62.210.85.178,10.0.2.15,TCP,60,9001  >  35978 [ACK] Seq=16595387 Ack=306803505 Win=65535 Len=0
1,4.9812339999998585,62.210.85.178,10.0.2.15,TCP,60,9001  >  35978 [ACK] Seq=16595387 Ack=306804965 Win=65535 Len=0
1,4.981240000000071,62.210.85.178,10.0.2.15,TCP,60,9001  >  35978 [ACK] Seq=16595387 Ack=306806115 Win=65535 Len=0
1,4.981300999999803,10.0.2.15,62.210.85.178,TLSv1.2,1204,Application Data
1,4.981359000000339,62.210.85.178,10.0.2.15,TCP,60,9001  >  35978 [ACK] Seq=16595387 Ack=306807575 Win=65535 Len=0
1,4.981369000000086,62.210.85.178,10.0.2.15,TCP,60,9001  >  35978 [ACK] Seq=16595387 Ack=306809035 Win=65535 Len=0
1,4.98137399999996,62.210.85.178,10.0.2.15,TCP,60,9001  >  35978 [ACK] Seq=16595387 Ack=306810185 Win=65535 Len=0
1,4.981442000000243,10.0.2.15,62.210.85.178,TLSv1.2,4124,Application Data
1,4.981518999999935,62.210.85.178,10.0.2.15,TCP,60,9001  >  35978 [ACK] Seq=16595387 Ack=306811645 Win=65535 Len=0
1,4.981528000000253,62.210.85.178,10.0.2.15,TCP,60,9001  >  35978 [ACK] Seq=16595387 Ack=306813105 Win=65535 Len=0
1,4.981531999999788,62.210.85.178,10.0.2.15,TCP,60,9001  >  35978 [ACK] Seq=16595387 Ack=306814255 Win=65535 Len=0
1,4.981571999999687,10.0.2.15,62.210.85.178,TLSv1.2,2324,Application Data
1,4.9816060000002835,62.210.85.178,10.0.2.15,TCP,60,9001  >  35978 [ACK] Seq=16595387 Ack=306815715 Win=65535 Len=0
1,4.981614000000263,62.210.85.178,10.0.2.15,TCP,60,9001  >  35978 [ACK] Seq=16595387 Ack=306816525 Win=65535 Len=0
1,5.094992999999704,54.93.77.70,10.0.2.15,TLSv1.2,590,Application Data
1,5.113078999999743,54.93.77.70,10.0.2.15,TLSv1.2,7294,"Application Data, Application Data"
1,5.1132040000002235,10.0.2.15,54.93.77.70,TCP,54,34692  >  9001 [ACK] Seq=16641887 Ack=306462441 Win=65535 Len=0
1,5.1133639999998195,10.0.2.15,54.93.77.70,TLSv1.2,590,Application Data
1,5.113438000000315,54.93.77.70,10.0.2.15,TCP,60,9001  >  34692 [ACK] Seq=306462441 Ack=16642423 Win=65535 Len=0
1,5.135591000000204,54.93.77.70,10.0.2.15,TLSv1.2,3674,Application Data
1,5.135637999999744,10.0.2.15,54.93.77.70,TCP,54,34692  >  9001 [ACK] Seq=16642423 Ack=306466061 Win=65535 Len=0
1,5.205584000000272,54.93.77.70,10.0.2.15,TLSv1.2,1104,Application Data
1,5.21698699999979,62.210.85.178,10.0.2.15,TLSv1.2,590,Application Data
1,5.248552999999447,10.0.2.15,54.93.77.70,TCP,54,34692  >  9001 [ACK] Seq=16642423 Ack=306467111 Win=65535 Len=0
1,5.260559000000285,10.0.2.15,62.210.85.178,TCP,54,35978  >  9001 [ACK] Seq=306816525 Ack=16595923 Win=65535 Len=0
1,5.581162999999833,54.93.77.70,10.0.2.15,TLSv1.2,2646,Application Data
1,5.581258999999591,10.0.2.15,54.93.77.70,TCP,54,34692  >  9001 [ACK] Seq=16642423 Ack=306469703 Win=65535 Len=0
1,5.583642999999938,10.0.2.15,54.93.77.70,TLSv1.2,590,Application Data
1,5.583791000000019,54.93.77.70,10.0.2.15,TCP,60,9001  >  34692 [ACK] Seq=306469703 Ack=16642959 Win=65535 Len=0
1,5.73610699999972,62.210.85.178,10.0.2.15,TLSv1.2,590,Application Data
1,5.736181999999644,10.0.2.15,62.210.85.178,TCP,54,35978  >  9001 [ACK] Seq=306816525 Ack=16596459 Win=65535 Len=0
1,5.736673999999766,10.0.2.15,62.210.85.178,TLSv1.2,590,Application Data
1,5.7368749999996,62.210.85.178,10.0.2.15,TCP,60,9001  >  35978 [ACK] Seq=16596459 Ack=306817061 Win=65535 Len=0
1,5.899535999999898,54.93.77.70,10.0.2.15,TLSv1.2,590,Application Data
1,5.899956000000202,10.0.2.15,54.93.77.70,TLSv1.2,590,Application Data
1,5.900053999999727,54.93.77.70,10.0.2.15,TCP,60,9001  >  34692 [ACK] Seq=306470239 Ack=16643495 Win=65535 Len=0
1,6.106714999999895,62.210.85.178,10.0.2.15,TLSv1.2,590,Application Data
1,6.111388000000261,10.0.2.15,62.210.85.178,TLSv1.2,590,Application Data
1,6.111565999999584,62.210.85.178,10.0.2.15,TCP,60,9001  >  35978 [ACK] Seq=16596995 Ack=306817597 Win=65535 Len=0
1,6.12175599999955,10.0.2.15,62.210.85.178,TLSv1.2,4124,Application Data
1,6.121847999999773,10.0.2.15,62.210.85.178,TCP,2974,35978  >  9001 [ACK] Seq=306821667 Ack=16596995 Win=65535 Len=2920 [TCP segment of a reassembled PDU]
1,6.121920999999929,62.210.85.178,10.0.2.15,TCP,60,9001  >  35978 [ACK] Seq=16596995 Ack=306819057 Win=65535 Len=0
1,6.12193599999955,62.210.85.178,10.0.2.15,TCP,60,9001  >  35978 [ACK] Seq=16596995 Ack=306820517 Win=65535 Len=0
1,6.1219389999996565,62.210.85.178,10.0.2.15,TCP,60,9001  >  35978 [ACK] Seq=16596995 Ack=306821667 Win=65535 Len=0
1,6.121941999999763,62.210.85.178,10.0.2.15,TCP,60,9001  >  35978 [ACK] Seq=16596995 Ack=306823127 Win=65535 Len=0
1,6.12194399999953,62.210.85.178,10.0.2.15,TCP,60,9001  >  35978 [ACK] Seq=16596995 Ack=306824587 Win=65535 Len=0
1,6.121981000000233,10.0.2.15,62.210.85.178,TLSv1.2,1204,Application Data
1,6.1220299999995405,62.210.85.178,10.0.2.15,TCP,60,9001  >  35978 [ACK] Seq=16596995 Ack=306825737 Win=65535 Len=0
1,6.122086999999738,10.0.2.15,62.210.85.178,TLSv1.2,4124,Application Data
1,6.122126000000208,62.210.85.178,10.0.2.15,TCP,60,9001  >  35978 [ACK] Seq=16596995 Ack=306827197 Win=65535 Len=0
1,6.122132999999849,62.210.85.178,10.0.2.15,TCP,60,9001  >  35978 [ACK] Seq=16596995 Ack=306828657 Win=65535 Len=0
1,6.122135999999955,62.210.85.178,10.0.2.15,TCP,60,9001  >  35978 [ACK] Seq=16596995 Ack=306829807 Win=65535 Len=0
1,6.122174999999515,10.0.2.15,62.210.85.178,TLSv1.2,4124,Application Data
1,6.122209000000112,62.210.85.178,10.0.2.15,TCP,60,9001  >  35978 [ACK] Seq=16596995 Ack=306831267 Win=65535 Len=0
1,6.122215999999753,62.210.85.178,10.0.2.15,TCP,60,9001  >  35978 [ACK] Seq=16596995 Ack=306832727 Win=65535 Len=0
1,6.122271999999612,10.0.2.15,62.210.85.178,TLSv1.2,2974,Application Data
1,6.122309000000314,62.210.85.178,10.0.2.15,TCP,60,9001  >  35978 [ACK] Seq=16596995 Ack=306833877 Win=65535 Len=0
1,6.122315999999955,62.210.85.178,10.0.2.15,TCP,60,9001  >  35978 [ACK] Seq=16596995 Ack=306835337 Win=65535 Len=0
1,6.122319000000061,62.210.85.178,10.0.2.15,TCP,60,9001  >  35978 [ACK] Seq=16596995 Ack=306836797 Win=65535 Len=0
1,6.122346000000107,10.0.2.15,62.210.85.178,TLSv1.2,1226,Application Data
1,6.122378999999455,62.210.85.178,10.0.2.15,TCP,60,9001  >  35978 [ACK] Seq=16596995 Ack=306837969 Win=65535 Len=0
1,6.1224169999995866,10.0.2.15,62.210.85.178,TLSv1.2,4124,Application Data
1,6.122454000000289,62.210.85.178,10.0.2.15,TCP,60,9001  >  35978 [ACK] Seq=16596995 Ack=306839429 Win=65535 Len=0
1,6.122459999999592,62.210.85.178,10.0.2.15,TCP,60,9001  >  35978 [ACK] Seq=16596995 Ack=306840889 Win=65535 Len=0
1,6.122462999999698,62.210.85.178,10.0.2.15,TCP,60,9001  >  35978 [ACK] Seq=16596995 Ack=306842039 Win=65535 Len=0
1,6.122499999999491,10.0.2.15,62.210.85.178,TLSv1.2,3030,Application Data
1,6.122534000000087,62.210.85.178,10.0.2.15,TCP,60,9001  >  35978 [ACK] Seq=16596995 Ack=306843499 Win=65535 Len=0
1,6.122540000000299,62.210.85.178,10.0.2.15,TCP,60,9001  >  35978 [ACK] Seq=16596995 Ack=306844959 Win=65535 Len=0
1,6.122542999999496,62.210.85.178,10.0.2.15,TCP,60,9001  >  35978 [ACK] Seq=16596995 Ack=306845015 Win=65535 Len=0
1,6.131746000000021,10.0.2.15,62.210.85.178,TLSv1.2,4124,Application Data
1,6.1317939999999,62.210.85.178,10.0.2.15,TCP,60,9001  >  35978 [ACK] Seq=16596995 Ack=306846475 Win=65535 Len=0
1,6.131806999999753,62.210.85.178,10.0.2.15,TCP,60,9001  >  35978 [ACK] Seq=16596995 Ack=306847935 Win=65535 Len=0
1,6.131811000000198,62.210.85.178,10.0.2.15,TCP,60,9001  >  35978 [ACK] Seq=16596995 Ack=306849085 Win=65535 Len=0
1,6.131854999999632,10.0.2.15,62.210.85.178,TLSv1.2,4124,Application Data
1,6.131914999999935,62.210.85.178,10.0.2.15,TCP,60,9001  >  35978 [ACK] Seq=16596995 Ack=306850545 Win=65535 Len=0
1,6.131921000000148,62.210.85.178,10.0.2.15,TCP,60,9001  >  35978 [ACK] Seq=16596995 Ack=306852005 Win=65535 Len=0
1,6.131937000000107,62.210.85.178,10.0.2.15,TCP,60,9001  >  35978 [ACK] Seq=16596995 Ack=306853155 Win=65535 Len=0
1,6.131975000000239,10.0.2.15,62.210.85.178,TLSv1.2,4124,Application Data
1,6.132010000000264,62.210.85.178,10.0.2.15,TCP,60,9001  >  35978 [ACK] Seq=16596995 Ack=306854615 Win=65535 Len=0
1,6.132016999999905,62.210.85.178,10.0.2.15,TCP,60,9001  >  35978 [ACK] Seq=16596995 Ack=306856075 Win=65535 Len=0
1,6.132021999999779,62.210.85.178,10.0.2.15,TCP,60,9001  >  35978 [ACK] Seq=16596995 Ack=306857225 Win=65535 Len=0
1,6.132058000000143,10.0.2.15,62.210.85.178,TLSv1.2,2324,Application Data
1,6.13209199999983,62.210.85.178,10.0.2.15,TCP,60,9001  >  35978 [ACK] Seq=16596995 Ack=306858685 Win=65535 Len=0
1,6.132098999999471,62.210.85.178,10.0.2.15,TCP,60,9001  >  35978 [ACK] Seq=16596995 Ack=306859495 Win=65535 Len=0
1,6.222342999999455,54.93.77.70,10.0.2.15,TLSv1.2,590,Application Data
1,6.253574000000299,54.93.77.70,10.0.2.15,TCP,2950,"9001  >  34692 [PSH, ACK] Seq=306470775 Ack=16643495 Win=65535 Len=2896 [TCP segment of a reassembled PDU]"
1,6.253635000000031,10.0.2.15,54.93.77.70,TCP,54,34692  >  9001 [ACK] Seq=16643495 Ack=306473671 Win=65535 Len=0
1,6.254025999999612,54.93.77.70,10.0.2.15,TLSv1.2,2342,"Application Data, Application Data"
1,6.254065999999511,10.0.2.15,54.93.77.70,TCP,54,34692  >  9001 [ACK] Seq=16643495 Ack=306475959 Win=65535 Len=0
1,6.277922000000217,54.93.77.70,10.0.2.15,TLSv1.2,4210,"Application Data, Application Data"
1,6.278080999999474,10.0.2.15,54.93.77.70,TCP,54,34692  >  9001 [ACK] Seq=16643495 Ack=306480115 Win=65535 Len=0
1,6.29695300000003,54.93.77.70,10.0.2.15,TLSv1.2,1104,Application Data
1,6.324913999999808,54.93.77.70,10.0.2.15,TLSv1.2,3160,Application Data
1,6.324967999999899,10.0.2.15,54.93.77.70,TCP,54,34692  >  9001 [ACK] Seq=16643495 Ack=306484271 Win=65535 Len=0
1,6.348273999999947,54.93.77.70,10.0.2.15,TLSv1.2,3674,Application Data
1,6.348366000000169,10.0.2.15,54.93.77.70,TCP,54,34692  >  9001 [ACK] Seq=16643495 Ack=306487891 Win=65535 Len=0
1,6.396211000000221,54.93.77.70,10.0.2.15,TLSv1.2,3674,Application Data
1,6.396284999999807,10.0.2.15,54.93.77.70,TCP,54,34692  >  9001 [ACK] Seq=16643495 Ack=306491511 Win=65535 Len=0
1,6.403620000000046,54.93.77.70,10.0.2.15,TLSv1.2,5846,Application Data
1,6.403693999999632,10.0.2.15,54.93.77.70,TCP,54,34692  >  9001 [ACK] Seq=16643495 Ack=306497303 Win=65535 Len=0
1,6.414305999999669,54.93.77.70,10.0.2.15,TLSv1.2,988,Application Data
1,6.414504000000306,10.0.2.15,54.93.77.70,TLSv1.2,590,Application Data
1,6.414619999999559,54.93.77.70,10.0.2.15,TCP,60,9001  >  34692 [ACK] Seq=306498237 Ack=16644031 Win=65535 Len=0
1,6.416559999999663,54.93.77.70,10.0.2.15,TCP,2950,"9001  >  34692 [PSH, ACK] Seq=306498237 Ack=16644031 Win=65535 Len=2896 [TCP segment of a reassembled PDU]"
1,6.4166260000001785,10.0.2.15,54.93.77.70,TCP,54,34692  >  9001 [ACK] Seq=16644031 Ack=306501133 Win=65535 Len=0
1,6.428071000000273,54.93.77.70,10.0.2.15,TLSv1.2,1502,Application Data [TCP segment of a reassembled PDU]
1,6.428111999999601,10.0.2.15,54.93.77.70,TCP,54,34692  >  9001 [ACK] Seq=16644031 Ack=306502581 Win=65535 Len=0
1,6.431397999999717,54.93.77.70,10.0.2.15,TLSv1.2,1408,Application Data
1,6.446458000000348,54.93.77.70,10.0.2.15,TCP,2950,"9001  >  34692 [PSH, ACK] Seq=306503935 Ack=16644031 Win=65535 Len=2896 [TCP segment of a reassembled PDU]"
1,6.446527999999489,10.0.2.15,54.93.77.70,TCP,54,34692  >  9001 [ACK] Seq=16644031 Ack=306506831 Win=65535 Len=0
1,6.447560999999951,54.93.77.70,10.0.2.15,TLSv1.2,778,Application Data
1,6.465825000000223,54.93.77.70,10.0.2.15,TLSv1.2,2132,Application Data
1,6.465868000000228,10.0.2.15,54.93.77.70,TCP,54,34692  >  9001 [ACK] Seq=16644031 Ack=306509633 Win=65535 Len=0
1,6.478900000000067,54.93.77.70,10.0.2.15,TCP,2950,"9001  >  34692 [PSH, ACK] Seq=306509633 Ack=16644031 Win=65535 Len=2896 [TCP segment of a reassembled PDU]"
1,6.479059999999663,10.0.2.15,54.93.77.70,TCP,54,34692  >  9001 [ACK] Seq=16644031 Ack=306512529 Win=65535 Len=0
1,6.482138000000305,54.93.77.70,10.0.2.15,TLSv1.2,264,Application Data
1,6.4824390000003405,10.0.2.15,54.93.77.70,TLSv1.2,590,Application Data
1,6.482557999999699,54.93.77.70,10.0.2.15,TCP,60,9001  >  34692 [ACK] Seq=306512739 Ack=16644567 Win=65535 Len=0
