No.,Time,Source,Destination,Protocol,Length,Info
1,0.09773299999960727,62.210.85.178,10.0.2.15,TLSv1.2,1618,Application Data
1,0.09794799999963288,10.0.2.15,62.210.85.178,TCP,54,35978  >  9001 [ACK] Seq=310967857 Ack=16820149 Win=65535 Len=0
1,0.13501199999973323,10.0.2.15,54.93.77.70,TLSv1.2,590,Application Data
1,0.13518800000019837,54.93.77.70,10.0.2.15,TCP,60,9001  >  34692 [ACK] Seq=310622619 Ack=16867889 Win=65535 Len=0
1,0.26152900000033696,62.210.85.178,10.0.2.15,TLSv1.2,590,Application Data
1,0.2615960000002815,10.0.2.15,62.210.85.178,TCP,54,35978  >  9001 [ACK] Seq=310967857 Ack=16820685 Win=65535 Len=0
1,0.26187599999957456,10.0.2.15,62.210.85.178,TLSv1.2,590,Application Data
1,0.2619640000002619,62.210.85.178,10.0.2.15,TCP,60,9001  >  35978 [ACK] Seq=16820685 Ack=310968393 Win=65535 Len=0
1,0.47334200000022975,54.93.77.70,10.0.2.15,TLSv1.2,590,Application Data
1,0.4734310000003461,10.0.2.15,54.93.77.70,TCP,54,34692  >  9001 [ACK] Seq=16867889 Ack=310623155 Win=65535 Len=0
1,0.4738729999999123,10.0.2.15,54.93.77.70,TLSv1.2,1618,Application Data
1,0.47402099999999336,54.93.77.70,10.0.2.15,TCP,60,9001  >  34692 [ACK] Seq=310623155 Ack=16869349 Win=65535 Len=0
1,0.47403599999961443,54.93.77.70,10.0.2.15,TCP,60,9001  >  34692 [ACK] Seq=310623155 Ack=16869453 Win=65535 Len=0
1,0.6805919999997059,62.210.85.178,10.0.2.15,TLSv1.2,1618,Application Data
1,0.6807179999996151,10.0.2.15,62.210.85.178,TCP,54,35978  >  9001 [ACK] Seq=310968393 Ack=16822249 Win=65535 Len=0
1,0.6941079999996873,10.0.2.15,62.210.85.178,TLSv1.2,590,Application Data
1,0.6942879999996876,62.210.85.178,10.0.2.15,TCP,60,9001  >  35978 [ACK] Seq=16822249 Ack=310968929 Win=65535 Len=0
1,0.704953000000387,10.0.2.15,62.210.85.178,TLSv1.2,1618,Application Data
1,0.7051060000003417,62.210.85.178,10.0.2.15,TCP,60,9001  >  35978 [ACK] Seq=16822249 Ack=310970389 Win=65535 Len=0
1,0.7051289999999426,62.210.85.178,10.0.2.15,TCP,60,9001  >  35978 [ACK] Seq=16822249 Ack=310970493 Win=65535 Len=0
1,0.8039360000002489,54.93.77.70,10.0.2.15,TLSv1.2,590,Application Data
1,0.8309189999999944,54.93.77.70,10.0.2.15,TLSv1.2,1618,Application Data
1,0.8310099999998783,10.0.2.15,54.93.77.70,TCP,54,34692  >  9001 [ACK] Seq=16869453 Ack=310625255 Win=65535 Len=0
1,0.8331420000004073,10.0.2.15,54.93.77.70,TLSv1.2,590,Application Data
1,0.8333089999996446,54.93.77.70,10.0.2.15,TCP,60,9001  >  34692 [ACK] Seq=310625255 Ack=16869989 Win=65535 Len=0
1,1.1274139999995896,62.210.85.178,10.0.2.15,TLSv1.2,590,Application Data
1,1.1277289999998175,10.0.2.15,62.210.85.178,TLSv1.2,590,Application Data
1,1.1278190000002724,62.210.85.178,10.0.2.15,TCP,60,9001  >  35978 [ACK] Seq=16822785 Ack=310971029 Win=65535 Len=0
1,1.2944699999998193,54.93.77.70,10.0.2.15,TLSv1.2,590,Application Data
1,1.2948539999997593,10.0.2.15,54.93.77.70,TLSv1.2,590,Application Data
1,1.2949499999995169,54.93.77.70,10.0.2.15,TCP,60,9001  >  34692 [ACK] Seq=310625791 Ack=16870525 Win=65535 Len=0
1,1.7036650000000009,62.210.85.178,10.0.2.15,TLSv1.2,590,Application Data
1,1.7077289999997447,10.0.2.15,62.210.85.178,TLSv1.2,590,Application Data
1,1.7079180000000633,62.210.85.178,10.0.2.15,TCP,60,9001  >  35978 [ACK] Seq=16823321 Ack=310971565 Win=65535 Len=0
1,1.7175319999996645,10.0.2.15,62.210.85.178,TLSv1.2,4124,Application Data
1,1.7180719999996654,62.210.85.178,10.0.2.15,TCP,60,9001  >  35978 [ACK] Seq=16823321 Ack=310973025 Win=65535 Len=0
1,1.718098999999711,62.210.85.178,10.0.2.15,TCP,60,9001  >  35978 [ACK] Seq=16823321 Ack=310974485 Win=65535 Len=0
1,1.7181039999995846,62.210.85.178,10.0.2.15,TCP,60,9001  >  35978 [ACK] Seq=16823321 Ack=310975635 Win=65535 Len=0
1,1.7181989999999132,10.0.2.15,62.210.85.178,TLSv1.2,4124,Application Data
1,1.718337999999676,62.210.85.178,10.0.2.15,TCP,60,9001  >  35978 [ACK] Seq=16823321 Ack=310977095 Win=65535 Len=0
1,1.7183500000001004,62.210.85.178,10.0.2.15,TCP,60,9001  >  35978 [ACK] Seq=16823321 Ack=310978555 Win=65535 Len=0
1,1.718354999999974,62.210.85.178,10.0.2.15,TCP,60,9001  >  35978 [ACK] Seq=16823321 Ack=310979705 Win=65535 Len=0
1,1.718391999999767,10.0.2.15,62.210.85.178,TLSv1.2,204,Application Data
1,1.7184939999997368,62.210.85.178,10.0.2.15,TCP,60,9001  >  35978 [ACK] Seq=16823321 Ack=310979855 Win=65535 Len=0
1,1.8064080000003742,54.93.77.70,10.0.2.15,TLSv1.2,590,Application Data
1,1.839546000000155,54.93.77.70,10.0.2.15,TCP,2950,"9001  >  34692 [PSH, ACK] Seq=310626327 Ack=16870525 Win=65535 Len=2896 [TCP segment of a reassembled PDU]"
1,1.8396199999997407,10.0.2.15,54.93.77.70,TCP,54,34692  >  9001 [ACK] Seq=16870525 Ack=310629223 Win=65535 Len=0
1,1.8503179999997883,54.93.77.70,10.0.2.15,TLSv1.2,2950,Application Data [TCP segment of a reassembled PDU]
1,1.850365999999667,10.0.2.15,54.93.77.70,TCP,54,34692  >  9001 [ACK] Seq=16870525 Ack=310632119 Win=65535 Len=0
1,1.8557479999999487,54.93.77.70,10.0.2.15,TLSv1.2,988,Application Data
1,1.8962009999995644,10.0.2.15,54.93.77.70,TCP,54,34692  >  9001 [ACK] Seq=16870525 Ack=310633053 Win=65535 Len=0
1,1.9170780000004015,54.93.77.70,10.0.2.15,TLSv1.2,590,Application Data
1,1.9171479999995427,10.0.2.15,54.93.77.70,TCP,54,34692  >  9001 [ACK] Seq=16870525 Ack=310633589 Win=65535 Len=0
1,1.9675319999996645,54.93.77.70,10.0.2.15,TLSv1.2,1104,Application Data
1,1.9676040000003923,10.0.2.15,54.93.77.70,TCP,54,34692  >  9001 [ACK] Seq=16870525 Ack=310634639 Win=65535 Len=0
1,1.9697630000000572,10.0.2.15,54.93.77.70,TLSv1.2,590,Application Data
1,1.9699110000001383,54.93.77.70,10.0.2.15,TCP,60,9001  >  34692 [ACK] Seq=310634639 Ack=16871061 Win=65535 Len=0
1,2.0962060000001657,62.210.85.178,10.0.2.15,TLSv1.2,590,Application Data
1,2.096915000000081,10.0.2.15,62.210.85.178,TLSv1.2,590,Application Data
1,2.0970420000003287,62.210.85.178,10.0.2.15,TCP,60,9001  >  35978 [ACK] Seq=16823857 Ack=310980391 Win=65535 Len=0
1,2.2227460000003703,54.93.77.70,10.0.2.15,TLSv1.2,590,Application Data
1,2.2232249999997293,10.0.2.15,54.93.77.70,TLSv1.2,590,Application Data
1,2.2233610000002955,54.93.77.70,10.0.2.15,TCP,60,9001  >  34692 [ACK] Seq=310635175 Ack=16871597 Win=65535 Len=0
1,2.4194070000003194,62.210.85.178,10.0.2.15,TLSv1.2,590,Application Data
1,2.4245810000002166,10.0.2.15,62.210.85.178,TLSv1.2,590,Application Data
1,2.4247379999997065,62.210.85.178,10.0.2.15,TCP,60,9001  >  35978 [ACK] Seq=16824393 Ack=310980927 Win=65535 Len=0
1,2.437163999999939,10.0.2.15,62.210.85.178,TLSv1.2,4124,Application Data
1,2.43726499999957,10.0.2.15,62.210.85.178,TCP,2974,35978  >  9001 [ACK] Seq=310984997 Ack=16824393 Win=65535 Len=2920 [TCP segment of a reassembled PDU]
1,2.4373109999996814,62.210.85.178,10.0.2.15,TCP,60,9001  >  35978 [ACK] Seq=16824393 Ack=310982387 Win=65535 Len=0
1,2.4373349999996208,62.210.85.178,10.0.2.15,TCP,60,9001  >  35978 [ACK] Seq=16824393 Ack=310983847 Win=65535 Len=0
1,2.437340000000404,62.210.85.178,10.0.2.15,TCP,60,9001  >  35978 [ACK] Seq=16824393 Ack=310984997 Win=65535 Len=0
1,2.437343999999939,62.210.85.178,10.0.2.15,TCP,60,9001  >  35978 [ACK] Seq=16824393 Ack=310986457 Win=65535 Len=0
1,2.4373459999997067,62.210.85.178,10.0.2.15,TCP,60,9001  >  35978 [ACK] Seq=16824393 Ack=310987917 Win=65535 Len=0
1,2.4373820000000705,10.0.2.15,62.210.85.178,TLSv1.2,1204,Application Data
1,2.437417999999525,62.210.85.178,10.0.2.15,TCP,60,9001  >  35978 [ACK] Seq=16824393 Ack=310989067 Win=65535 Len=0
1,2.4374649999999747,10.0.2.15,62.210.85.178,TLSv1.2,4124,Application Data
1,2.4375019999997676,62.210.85.178,10.0.2.15,TCP,60,9001  >  35978 [ACK] Seq=16824393 Ack=310990527 Win=65535 Len=0
1,2.4375090000003183,62.210.85.178,10.0.2.15,TCP,60,9001  >  35978 [ACK] Seq=16824393 Ack=310991987 Win=65535 Len=0
1,2.437511999999515,62.210.85.178,10.0.2.15,TCP,60,9001  >  35978 [ACK] Seq=16824393 Ack=310993137 Win=65535 Len=0
1,2.4375499999996464,10.0.2.15,62.210.85.178,TLSv1.2,4124,Application Data
1,2.4375849999996717,62.210.85.178,10.0.2.15,TCP,60,9001  >  35978 [ACK] Seq=16824393 Ack=310994597 Win=65535 Len=0
1,2.4375920000002225,62.210.85.178,10.0.2.15,TCP,60,9001  >  35978 [ACK] Seq=16824393 Ack=310996057 Win=65535 Len=0
1,2.43764899999951,10.0.2.15,62.210.85.178,TLSv1.2,2974,Application Data
1,2.4376869999996416,62.210.85.178,10.0.2.15,TCP,60,9001  >  35978 [ACK] Seq=16824393 Ack=310997207 Win=65535 Len=0
1,2.4376940000001923,62.210.85.178,10.0.2.15,TCP,60,9001  >  35978 [ACK] Seq=16824393 Ack=310998667 Win=65535 Len=0
1,2.4376970000002984,62.210.85.178,10.0.2.15,TCP,60,9001  >  35978 [ACK] Seq=16824393 Ack=311000127 Win=65535 Len=0
1,2.437724000000344,10.0.2.15,62.210.85.178,TLSv1.2,1226,Application Data
1,2.4377580000000307,62.210.85.178,10.0.2.15,TCP,60,9001  >  35978 [ACK] Seq=16824393 Ack=311001299 Win=65535 Len=0
1,2.4377979999999297,10.0.2.15,62.210.85.178,TLSv1.2,4124,Application Data
1,2.4378379999998288,62.210.85.178,10.0.2.15,TCP,60,9001  >  35978 [ACK] Seq=16824393 Ack=311002759 Win=65535 Len=0
1,2.437844000000041,62.210.85.178,10.0.2.15,TCP,60,9001  >  35978 [ACK] Seq=16824393 Ack=311004219 Win=65535 Len=0
1,2.437847000000147,62.210.85.178,10.0.2.15,TCP,60,9001  >  35978 [ACK] Seq=16824393 Ack=311005369 Win=65535 Len=0
1,2.4378829999996015,10.0.2.15,62.210.85.178,TLSv1.2,3030,Application Data
1,2.437915999999859,62.210.85.178,10.0.2.15,TCP,60,9001  >  35978 [ACK] Seq=16824393 Ack=311006829 Win=65535 Len=0
1,2.43792300000041,62.210.85.178,10.0.2.15,TCP,60,9001  >  35978 [ACK] Seq=16824393 Ack=311008289 Win=65535 Len=0
1,2.437926999999945,62.210.85.178,10.0.2.15,TCP,60,9001  >  35978 [ACK] Seq=16824393 Ack=311008345 Win=65535 Len=0
1,2.4482600000001185,10.0.2.15,62.210.85.178,TLSv1.2,4124,Application Data
1,2.448309999999765,62.210.85.178,10.0.2.15,TCP,60,9001  >  35978 [ACK] Seq=16824393 Ack=311009805 Win=65535 Len=0
1,2.4483209999998508,62.210.85.178,10.0.2.15,TCP,60,9001  >  35978 [ACK] Seq=16824393 Ack=311011265 Win=65535 Len=0
1,2.4483250000002954,62.210.85.178,10.0.2.15,TCP,60,9001  >  35978 [ACK] Seq=16824393 Ack=311012415 Win=65535 Len=0
1,2.448370000000068,10.0.2.15,62.210.85.178,TLSv1.2,4124,Application Data
1,2.448435000000245,62.210.85.178,10.0.2.15,TCP,60,9001  >  35978 [ACK] Seq=16824393 Ack=311013875 Win=65535 Len=0
1,2.448443000000225,62.210.85.178,10.0.2.15,TCP,60,9001  >  35978 [ACK] Seq=16824393 Ack=311015335 Win=65535 Len=0
1,2.4484449999999924,62.210.85.178,10.0.2.15,TCP,60,9001  >  35978 [ACK] Seq=16824393 Ack=311016485 Win=65535 Len=0
1,2.4484810000003563,10.0.2.15,62.210.85.178,TLSv1.2,4124,Application Data
1,2.4485160000003816,62.210.85.178,10.0.2.15,TCP,60,9001  >  35978 [ACK] Seq=16824393 Ack=311017945 Win=65535 Len=0
1,2.4485240000003614,62.210.85.178,10.0.2.15,TCP,60,9001  >  35978 [ACK] Seq=16824393 Ack=311019405 Win=65535 Len=0
1,2.448526999999558,62.210.85.178,10.0.2.15,TCP,60,9001  >  35978 [ACK] Seq=16824393 Ack=311020555 Win=65535 Len=0
1,2.4485640000002604,10.0.2.15,62.210.85.178,TLSv1.2,4124,Application Data
1,2.4485969999996087,62.210.85.178,10.0.2.15,TCP,60,9001  >  35978 [ACK] Seq=16824393 Ack=311022015 Win=65535 Len=0
1,2.4486040000001594,62.210.85.178,10.0.2.15,TCP,60,9001  >  35978 [ACK] Seq=16824393 Ack=311023475 Win=65535 Len=0
1,2.4486079999996946,62.210.85.178,10.0.2.15,TCP,60,9001  >  35978 [ACK] Seq=16824393 Ack=311024625 Win=65535 Len=0
1,2.448642000000291,10.0.2.15,62.210.85.178,TLSv1.2,332,Application Data
1,2.448674999999639,62.210.85.178,10.0.2.15,TCP,60,9001  >  35978 [ACK] Seq=16824393 Ack=311024903 Win=65535 Len=0
1,2.448725000000195,10.0.2.15,62.210.85.178,TLSv1.2,3868,Application Data
1,2.448761999999988,62.210.85.178,10.0.2.15,TCP,60,9001  >  35978 [ACK] Seq=16824393 Ack=311026363 Win=65535 Len=0
1,2.448768999999629,62.210.85.178,10.0.2.15,TCP,60,9001  >  35978 [ACK] Seq=16824393 Ack=311027823 Win=65535 Len=0
1,2.4487719999997353,62.210.85.178,10.0.2.15,TCP,60,9001  >  35978 [ACK] Seq=16824393 Ack=311028717 Win=65535 Len=0
1,2.4488149999997404,10.0.2.15,62.210.85.178,TLSv1.2,4124,Application Data
1,2.4488499999997657,62.210.85.178,10.0.2.15,TCP,60,9001  >  35978 [ACK] Seq=16824393 Ack=311030177 Win=65535 Len=0
1,2.4488570000003165,62.210.85.178,10.0.2.15,TCP,60,9001  >  35978 [ACK] Seq=16824393 Ack=311031637 Win=65535 Len=0
1,2.448859999999513,62.210.85.178,10.0.2.15,TCP,60,9001  >  35978 [ACK] Seq=16824393 Ack=311032787 Win=65535 Len=0
1,2.4488949999995384,10.0.2.15,62.210.85.178,TLSv1.2,3030,Application Data
1,2.4489299999995637,62.210.85.178,10.0.2.15,TCP,60,9001  >  35978 [ACK] Seq=16824393 Ack=311034247 Win=65535 Len=0
1,2.448935999999776,62.210.85.178,10.0.2.15,TCP,60,9001  >  35978 [ACK] Seq=16824393 Ack=311035707 Win=65535 Len=0
1,2.448938999999882,62.210.85.178,10.0.2.15,TCP,60,9001  >  35978 [ACK] Seq=16824393 Ack=311035763 Win=65535 Len=0
1,2.4603040000001783,10.0.2.15,62.210.85.178,TLSv1.2,2646,Application Data
1,2.4604349999999613,62.210.85.178,10.0.2.15,TCP,60,9001  >  35978 [ACK] Seq=16824393 Ack=311037223 Win=65535 Len=0
1,2.4604559999997946,62.210.85.178,10.0.2.15,TCP,60,9001  >  35978 [ACK] Seq=16824393 Ack=311038355 Win=65535 Len=0
1,2.563742000000275,54.93.77.70,10.0.2.15,TLSv1.2,590,Application Data
1,2.6040830000001733,10.0.2.15,54.93.77.70,TCP,54,34692  >  9001 [ACK] Seq=16871597 Ack=310635711 Win=65535 Len=0
1,2.6050560000003316,54.93.77.70,10.0.2.15,TLSv1.2,7294,"Application Data, Application Data"
1,2.6051159999997253,10.0.2.15,54.93.77.70,TCP,54,34692  >  9001 [ACK] Seq=16871597 Ack=310642951 Win=65535 Len=0
1,2.6243930000000546,54.93.77.70,10.0.2.15,TCP,2950,"9001  >  34692 [PSH, ACK] Seq=310642951 Ack=16871597 Win=65535 Len=2896 [TCP segment of a reassembled PDU]"
1,2.6244630000001052,10.0.2.15,54.93.77.70,TCP,54,34692  >  9001 [ACK] Seq=16871597 Ack=310645847 Win=65535 Len=0
1,2.6250669999999445,54.93.77.70,10.0.2.15,TLSv1.2,4912,"Application Data, Application Data"
1,2.6251130000000558,10.0.2.15,54.93.77.70,TCP,54,34692  >  9001 [ACK] Seq=16871597 Ack=310650705 Win=65535 Len=0
1,2.6486770000001343,54.93.77.70,10.0.2.15,TLSv1.2,3674,Application Data
1,2.6487349999997605,10.0.2.15,54.93.77.70,TCP,54,34692  >  9001 [ACK] Seq=16871597 Ack=310654325 Win=65535 Len=0
1,2.668181000000004,54.93.77.70,10.0.2.15,TCP,2950,"9001  >  34692 [PSH, ACK] Seq=310654325 Ack=16871597 Win=65535 Len=2896 [TCP segment of a reassembled PDU]"
1,2.668235000000095,10.0.2.15,54.93.77.70,TCP,54,34692  >  9001 [ACK] Seq=16871597 Ack=310657221 Win=65535 Len=0
1,2.6686140000001615,54.93.77.70,10.0.2.15,TLSv1.2,2342,"Application Data, Application Data"
1,2.668655999999828,10.0.2.15,54.93.77.70,TCP,54,34692  >  9001 [ACK] Seq=16871597 Ack=310659509 Win=65535 Len=0
1,2.668851999999788,10.0.2.15,54.93.77.70,TLSv1.2,590,Application Data
1,2.668963999999505,54.93.77.70,10.0.2.15,TCP,60,9001  >  34692 [ACK] Seq=310659509 Ack=16872133 Win=65535 Len=0
1,2.6924669999998514,54.93.77.70,10.0.2.15,TLSv1.2,3674,Application Data
1,2.6925920000003316,10.0.2.15,54.93.77.70,TCP,54,34692  >  9001 [ACK] Seq=16872133 Ack=310663129 Win=65535 Len=0
1,2.692829999999958,10.0.2.15,54.93.77.70,TLSv1.2,590,Application Data
1,2.692968000000292,54.93.77.70,10.0.2.15,TCP,60,9001  >  34692 [ACK] Seq=310663129 Ack=16872669 Win=65535 Len=0
1,2.703614000000016,54.93.77.70,10.0.2.15,TCP,2950,"9001  >  34692 [PSH, ACK] Seq=310663129 Ack=16872669 Win=65535 Len=2896 [TCP segment of a reassembled PDU]"
1,2.7037570000002233,10.0.2.15,54.93.77.70,TCP,54,34692  >  9001 [ACK] Seq=16872669 Ack=310666025 Win=65535 Len=0
1,2.7082799999998315,54.93.77.70,10.0.2.15,TLSv1.2,1314,"Application Data, Application Data"
1,2.749727000000348,54.93.77.70,10.0.2.15,TLSv1.2,4398,Application Data
1,2.749786000000313,10.0.2.15,54.93.77.70,TCP,54,34692  >  9001 [ACK] Seq=16872669 Ack=310671629 Win=65535 Len=0
1,2.7631099999998696,54.93.77.70,10.0.2.15,TLSv1.2,2950,Application Data [TCP segment of a reassembled PDU]
1,2.7631719999999405,10.0.2.15,54.93.77.70,TCP,54,34692  >  9001 [ACK] Seq=16872669 Ack=310674525 Win=65535 Len=0
1,2.763944999999694,54.93.77.70,10.0.2.15,TLSv1.2,7294,"Application Data, Application Data"
1,2.7640199999996184,10.0.2.15,54.93.77.70,TCP,54,34692  >  9001 [ACK] Seq=16872669 Ack=310681765 Win=65535 Len=0
1,2.7662600000003295,54.93.77.70,10.0.2.15,TLSv1.2,4398,Application Data [TCP segment of a reassembled PDU]
1,2.766305000000102,10.0.2.15,54.93.77.70,TCP,54,34692  >  9001 [ACK] Seq=16872669 Ack=310686109 Win=65535 Len=0
1,2.7669519999999466,54.93.77.70,10.0.2.15,TLSv1.2,5868,"Application Data, Application Data"
1,2.7670310000003155,10.0.2.15,54.93.77.70,TCP,54,34692  >  9001 [ACK] Seq=16872669 Ack=310691923 Win=65535 Len=0
1,2.7671739999996134,10.0.2.15,54.93.77.70,TLSv1.2,590,Application Data
1,2.767243000000235,54.93.77.70,10.0.2.15,TCP,60,9001  >  34692 [ACK] Seq=310691923 Ack=16873205 Win=65535 Len=0
1,2.784929999999804,54.93.77.70,10.0.2.15,TLSv1.2,1314,"Application Data, Application Data"
1,2.787543999999798,10.0.2.15,54.93.77.70,TLSv1.2,590,Application Data
1,2.7876909999995405,54.93.77.70,10.0.2.15,TCP,60,9001  >  34692 [ACK] Seq=310693183 Ack=16873741 Win=65535 Len=0
1,2.7898660000000746,62.210.85.178,10.0.2.15,TLSv1.2,590,Application Data
1,2.8345989999997983,10.0.2.15,62.210.85.178,TCP,54,35978  >  9001 [ACK] Seq=311038355 Ack=16824929 Win=65535 Len=0
1,2.853653000000122,62.210.85.178,10.0.2.15,TLSv1.2,590,Application Data
1,2.853755000000092,10.0.2.15,62.210.85.178,TCP,54,35978  >  9001 [ACK] Seq=311038355 Ack=16825465 Win=65535 Len=0
1,3.2415320000000065,62.210.85.178,10.0.2.15,TLSv1.2,1104,Application Data
1,3.2416039999998247,10.0.2.15,62.210.85.178,TCP,54,35978  >  9001 [ACK] Seq=311038355 Ack=16826515 Win=65535 Len=0
1,3.2420890000003055,10.0.2.15,62.210.85.178,TLSv1.2,590,Application Data
1,3.2421910000002754,62.210.85.178,10.0.2.15,TCP,60,9001  >  35978 [ACK] Seq=16826515 Ack=311038891 Win=65535 Len=0
1,3.443202000000383,54.93.77.70,10.0.2.15,TLSv1.2,590,Application Data
1,3.443594000000303,10.0.2.15,54.93.77.70,TLSv1.2,590,Application Data
1,3.4437010000001465,54.93.77.70,10.0.2.15,TCP,60,9001  >  34692 [ACK] Seq=310693719 Ack=16874277 Win=65535 Len=0
1,3.576583000000028,62.210.85.178,10.0.2.15,TLSv1.2,590,Application Data
1,3.5797739999998157,10.0.2.15,62.210.85.178,TLSv1.2,590,Application Data
1,3.579939999999624,62.210.85.178,10.0.2.15,TCP,60,9001  >  35978 [ACK] Seq=16827051 Ack=311039427 Win=65535 Len=0
1,3.589541000000281,10.0.2.15,62.210.85.178,TLSv1.2,4124,Application Data
1,3.589621000000079,10.0.2.15,62.210.85.178,TCP,2974,35978  >  9001 [ACK] Seq=311043497 Ack=16827051 Win=65535 Len=2920 [TCP segment of a reassembled PDU]
1,3.5896599999996397,62.210.85.178,10.0.2.15,TCP,60,9001  >  35978 [ACK] Seq=16827051 Ack=311040887 Win=65535 Len=0
1,3.5896709999997256,62.210.85.178,10.0.2.15,TCP,60,9001  >  35978 [ACK] Seq=16827051 Ack=311042347 Win=65535 Len=0
1,3.589676999999938,62.210.85.178,10.0.2.15,TCP,60,9001  >  35978 [ACK] Seq=16827051 Ack=311043497 Win=65535 Len=0
1,3.589680000000044,62.210.85.178,10.0.2.15,TCP,60,9001  >  35978 [ACK] Seq=16827051 Ack=311044957 Win=65535 Len=0
1,3.58968300000015,62.210.85.178,10.0.2.15,TCP,60,9001  >  35978 [ACK] Seq=16827051 Ack=311046417 Win=65535 Len=0
1,3.59007500000007,10.0.2.15,62.210.85.178,TLSv1.2,1204,Application Data
1,3.590143999999782,62.210.85.178,10.0.2.15,TCP,60,9001  >  35978 [ACK] Seq=16827051 Ack=311047567 Win=65535 Len=0
1,3.5901919999996608,10.0.2.15,62.210.85.178,TLSv1.2,4124,Application Data
1,3.5902280000000246,62.210.85.178,10.0.2.15,TCP,60,9001  >  35978 [ACK] Seq=16827051 Ack=311049027 Win=65535 Len=0
1,3.5902360000000044,62.210.85.178,10.0.2.15,TCP,60,9001  >  35978 [ACK] Seq=16827051 Ack=311050487 Win=65535 Len=0
1,3.5902390000001105,62.210.85.178,10.0.2.15,TCP,60,9001  >  35978 [ACK] Seq=16827051 Ack=311051637 Win=65535 Len=0
1,3.5903070000003936,10.0.2.15,62.210.85.178,TLSv1.2,782,Application Data
1,3.5903589999998076,62.210.85.178,10.0.2.15,TCP,60,9001  >  35978 [ACK] Seq=16827051 Ack=311052365 Win=65535 Len=0
1,3.6739230000002863,54.93.77.70,10.0.2.15,TLSv1.2,590,Application Data
1,3.6929879999997866,54.93.77.70,10.0.2.15,TLSv1.2,7294,"Application Data, Application Data"
1,3.6931210000002466,10.0.2.15,54.93.77.70,TCP,54,34692  >  9001 [ACK] Seq=16874277 Ack=310701495 Win=65535 Len=0
1,3.75597899999957,54.93.77.70,10.0.2.15,TLSv1.2,3674,Application Data
1,3.7560739999998987,10.0.2.15,54.93.77.70,TCP,54,34692  >  9001 [ACK] Seq=16874277 Ack=310705115 Win=65535 Len=0
1,3.777524999999514,54.93.77.70,10.0.2.15,TLSv1.2,2132,Application Data
1,3.7775830000000497,10.0.2.15,54.93.77.70,TCP,54,34692  >  9001 [ACK] Seq=16874277 Ack=310707193 Win=65535 Len=0
1,3.7804159999996045,10.0.2.15,54.93.77.70,TLSv1.2,590,Application Data
1,3.780587000000196,54.93.77.70,10.0.2.15,TCP,60,9001  >  34692 [ACK] Seq=310707193 Ack=16874813 Win=65535 Len=0
1,3.9563060000000405,62.210.85.178,10.0.2.15,TLSv1.2,590,Application Data
1,3.956645999999637,10.0.2.15,62.210.85.178,TLSv1.2,590,Application Data
1,3.956753999999819,62.210.85.178,10.0.2.15,TCP,60,9001  >  35978 [ACK] Seq=16827587 Ack=311052901 Win=65535 Len=0
1,4.073581999999988,54.93.77.70,10.0.2.15,TLSv1.2,590,Application Data
1,4.0739489999996295,10.0.2.15,54.93.77.70,TLSv1.2,590,Application Data
1,4.074063000000024,54.93.77.70,10.0.2.15,TCP,60,9001  >  34692 [ACK] Seq=310707729 Ack=16875349 Win=65535 Len=0
1,4.262383999999656,62.210.85.178,10.0.2.15,TLSv1.2,590,Application Data
1,4.266548999999941,10.0.2.15,62.210.85.178,TLSv1.2,590,Application Data
1,4.266719000000194,62.210.85.178,10.0.2.15,TCP,60,9001  >  35978 [ACK] Seq=16828123 Ack=311053437 Win=65535 Len=0
1,4.276933999999528,10.0.2.15,62.210.85.178,TLSv1.2,4124,Application Data
1,4.277079999999842,62.210.85.178,10.0.2.15,TCP,60,9001  >  35978 [ACK] Seq=16828123 Ack=311054897 Win=65535 Len=0
1,4.2771020000000135,62.210.85.178,10.0.2.15,TCP,60,9001  >  35978 [ACK] Seq=16828123 Ack=311056357 Win=65535 Len=0
1,4.27710500000012,62.210.85.178,10.0.2.15,TCP,60,9001  >  35978 [ACK] Seq=16828123 Ack=311057507 Win=65535 Len=0
1,4.2771679999996195,10.0.2.15,62.210.85.178,TLSv1.2,4124,Application Data
1,4.277243999999882,62.210.85.178,10.0.2.15,TCP,60,9001  >  35978 [ACK] Seq=16828123 Ack=311058967 Win=65535 Len=0
1,4.277250999999524,62.210.85.178,10.0.2.15,TCP,60,9001  >  35978 [ACK] Seq=16828123 Ack=311060427 Win=65535 Len=0
1,4.27725399999963,62.210.85.178,10.0.2.15,TCP,60,9001  >  35978 [ACK] Seq=16828123 Ack=311061577 Win=65535 Len=0
1,4.277289999999994,10.0.2.15,62.210.85.178,TLSv1.2,4124,Application Data
1,4.277325000000019,62.210.85.178,10.0.2.15,TCP,60,9001  >  35978 [ACK] Seq=16828123 Ack=311063037 Win=65535 Len=0
1,4.277332999999999,62.210.85.178,10.0.2.15,TCP,60,9001  >  35978 [ACK] Seq=16828123 Ack=311064497 Win=65535 Len=0
1,4.277336999999534,62.210.85.178,10.0.2.15,TCP,60,9001  >  35978 [ACK] Seq=16828123 Ack=311065647 Win=65535 Len=0
1,4.277374999999665,10.0.2.15,62.210.85.178,TLSv1.2,4124,Application Data
1,4.277407999999923,62.210.85.178,10.0.2.15,TCP,60,9001  >  35978 [ACK] Seq=16828123 Ack=311067107 Win=65535 Len=0
1,4.277415999999903,62.210.85.178,10.0.2.15,TCP,60,9001  >  35978 [ACK] Seq=16828123 Ack=311068567 Win=65535 Len=0
1,4.277476000000206,10.0.2.15,62.210.85.178,TLSv1.2,2974,Application Data
1,4.277512999999999,62.210.85.178,10.0.2.15,TCP,60,9001  >  35978 [ACK] Seq=16828123 Ack=311069717 Win=65535 Len=0
1,4.27751999999964,62.210.85.178,10.0.2.15,TCP,60,9001  >  35978 [ACK] Seq=16828123 Ack=311071177 Win=65535 Len=0
1,4.277522999999746,62.210.85.178,10.0.2.15,TCP,60,9001  >  35978 [ACK] Seq=16828123 Ack=311072637 Win=65535 Len=0
1,4.27755100000013,10.0.2.15,62.210.85.178,TLSv1.2,1226,Application Data
1,4.277584000000388,62.210.85.178,10.0.2.15,TCP,60,9001  >  35978 [ACK] Seq=16828123 Ack=311073809 Win=65535 Len=0
1,4.277624000000287,10.0.2.15,62.210.85.178,TLSv1.2,4124,Application Data
1,4.277659999999742,62.210.85.178,10.0.2.15,TCP,60,9001  >  35978 [ACK] Seq=16828123 Ack=311075269 Win=65535 Len=0
1,4.277667000000292,62.210.85.178,10.0.2.15,TCP,60,9001  >  35978 [ACK] Seq=16828123 Ack=311076729 Win=65535 Len=0
1,4.277670000000398,62.210.85.178,10.0.2.15,TCP,60,9001  >  35978 [ACK] Seq=16828123 Ack=311077879 Win=65535 Len=0
1,4.277705999999853,10.0.2.15,62.210.85.178,TLSv1.2,3030,Application Data
1,4.277740999999878,62.210.85.178,10.0.2.15,TCP,60,9001  >  35978 [ACK] Seq=16828123 Ack=311079339 Win=65535 Len=0
1,4.27774700000009,62.210.85.178,10.0.2.15,TCP,60,9001  >  35978 [ACK] Seq=16828123 Ack=311080799 Win=65535 Len=0
1,4.2777500000001965,62.210.85.178,10.0.2.15,TCP,60,9001  >  35978 [ACK] Seq=16828123 Ack=311080855 Win=65535 Len=0
1,4.288066999999501,10.0.2.15,62.210.85.178,TLSv1.2,4124,Application Data
1,4.288117000000057,62.210.85.178,10.0.2.15,TCP,60,9001  >  35978 [ACK] Seq=16828123 Ack=311082315 Win=65535 Len=0
1,4.288126999999804,62.210.85.178,10.0.2.15,TCP,60,9001  >  35978 [ACK] Seq=16828123 Ack=311083775 Win=65535 Len=0
1,4.288131999999678,62.210.85.178,10.0.2.15,TCP,60,9001  >  35978 [ACK] Seq=16828123 Ack=311084925 Win=65535 Len=0
1,4.28817700000036,10.0.2.15,62.210.85.178,TLSv1.2,2196,Application Data
1,4.288236999999754,62.210.85.178,10.0.2.15,TCP,60,9001  >  35978 [ACK] Seq=16828123 Ack=311086385 Win=65535 Len=0
1,4.288244000000304,62.210.85.178,10.0.2.15,TCP,60,9001  >  35978 [ACK] Seq=16828123 Ack=311087067 Win=65535 Len=0
1,4.414361999999528,54.93.77.70,10.0.2.15,TLSv1.2,3674,Application Data
1,4.414490000000114,10.0.2.15,54.93.77.70,TCP,54,34692  >  9001 [ACK] Seq=16875349 Ack=310711349 Win=65535 Len=0
1,4.473801000000094,54.93.77.70,10.0.2.15,TLSv1.2,4398,Application Data
1,4.473888999999872,10.0.2.15,54.93.77.70,TCP,54,34692  >  9001 [ACK] Seq=16875349 Ack=310715693 Win=65535 Len=0
1,4.474145000000135,10.0.2.15,54.93.77.70,TLSv1.2,590,Application Data
1,4.474261999999726,54.93.77.70,10.0.2.15,TCP,60,9001  >  34692 [ACK] Seq=310715693 Ack=16875885 Win=65535 Len=0
1,4.475228999999672,54.93.77.70,10.0.2.15,TLSv1.2,3464,Application Data
1,4.475273000000016,10.0.2.15,54.93.77.70,TCP,54,34692  >  9001 [ACK] Seq=16875885 Ack=310719103 Win=65535 Len=0
1,4.49165499999981,54.93.77.70,10.0.2.15,TLSv1.2,590,Application Data
1,4.532032999999501,10.0.2.15,54.93.77.70,TCP,54,34692  >  9001 [ACK] Seq=16875885 Ack=310719639 Win=65535 Len=0
1,4.537788999999975,54.93.77.70,10.0.2.15,TLSv1.2,7294,"Application Data, Application Data"
1,4.537865999999667,10.0.2.15,54.93.77.70,TCP,54,34692  >  9001 [ACK] Seq=16875885 Ack=310726879 Win=65535 Len=0
1,4.549606999999924,54.93.77.70,10.0.2.15,TCP,2950,"9001  >  34692 [PSH, ACK] Seq=310726879 Ack=16875885 Win=65535 Len=2896 [TCP segment of a reassembled PDU]"
1,4.54965699999957,10.0.2.15,54.93.77.70,TCP,54,34692  >  9001 [ACK] Seq=16875885 Ack=310729775 Win=65535 Len=0
1,4.550089999999727,54.93.77.70,10.0.2.15,TLSv1.2,5846,"Application Data, Application Data"
1,4.550132000000303,10.0.2.15,54.93.77.70,TCP,54,34692  >  9001 [ACK] Seq=16875885 Ack=310735567 Win=65535 Len=0
1,4.550376999999571,10.0.2.15,54.93.77.70,TLSv1.2,590,Application Data
1,4.550449999999728,54.93.77.70,10.0.2.15,TCP,60,9001  >  34692 [ACK] Seq=310735567 Ack=16876421 Win=65535 Len=0
1,4.551518999999644,54.93.77.70,10.0.2.15,TLSv1.2,170,Application Data
1,4.568941999999879,54.93.77.70,10.0.2.15,TLSv1.2,1104,Application Data
1,4.569021000000248,10.0.2.15,54.93.77.70,TCP,54,34692  >  9001 [ACK] Seq=16876421 Ack=310736733 Win=65535 Len=0
1,4.574660000000222,54.93.77.70,10.0.2.15,TCP,2950,"9001  >  34692 [PSH, ACK] Seq=310736733 Ack=16876421 Win=65535 Len=2896 [TCP segment of a reassembled PDU]"
1,4.574725999999828,10.0.2.15,54.93.77.70,TCP,54,34692  >  9001 [ACK] Seq=16876421 Ack=310739629 Win=65535 Len=0
1,4.585697999999866,54.93.77.70,10.0.2.15,TLSv1.2,264,Application Data
1,4.600094999999783,54.93.77.70,10.0.2.15,TLSv1.2,1502,Application Data
1,4.600137999999788,10.0.2.15,54.93.77.70,TCP,54,34692  >  9001 [ACK] Seq=16876421 Ack=310741287 Win=65535 Len=0
1,4.602649999999812,54.93.77.70,10.0.2.15,TLSv1.2,706,Application Data
1,4.604628000000048,62.210.85.178,10.0.2.15,TLSv1.2,590,Application Data
1,4.605193000000327,10.0.2.15,54.93.77.70,TLSv1.2,590,Application Data
1,4.6053060000003825,54.93.77.70,10.0.2.15,TCP,60,9001  >  34692 [ACK] Seq=310741939 Ack=16876957 Win=65535 Len=0
1,4.651773999999932,10.0.2.15,62.210.85.178,TCP,54,35978  >  9001 [ACK] Seq=311087067 Ack=16828659 Win=65535 Len=0
1,4.726219000000128,62.210.85.178,10.0.2.15,TLSv1.2,590,Application Data
1,4.726295000000391,10.0.2.15,62.210.85.178,TCP,54,35978  >  9001 [ACK] Seq=311087067 Ack=16829195 Win=65535 Len=0
1,4.791842999999972,62.210.85.178,10.0.2.15,TLSv1.2,590,Application Data
1,4.791935999999623,10.0.2.15,62.210.85.178,TCP,54,35978  >  9001 [ACK] Seq=311087067 Ack=16829731 Win=65535 Len=0
1,4.7923970000001646,10.0.2.15,62.210.85.178,TLSv1.2,590,Application Data
1,4.79249499999969,62.210.85.178,10.0.2.15,TCP,60,9001  >  35978 [ACK] Seq=16829731 Ack=311087603 Win=65535 Len=0
1,4.979029999999511,54.93.77.70,10.0.2.15,TLSv1.2,590,Application Data
1,4.9794050000000425,10.0.2.15,54.93.77.70,TLSv1.2,590,Application Data
1,4.9795009999998,54.93.77.70,10.0.2.15,TCP,60,9001  >  34692 [ACK] Seq=310742475 Ack=16877493 Win=65535 Len=0
1,5.1851269999997385,62.210.85.178,10.0.2.15,TLSv1.2,590,Application Data
1,5.188420000000406,10.0.2.15,62.210.85.178,TLSv1.2,590,Application Data
1,5.188578000000234,62.210.85.178,10.0.2.15,TCP,60,9001  >  35978 [ACK] Seq=16830267 Ack=311088139 Win=65535 Len=0
1,5.200420999999551,10.0.2.15,62.210.85.178,TLSv1.2,4124,Application Data
1,5.200549000000137,10.0.2.15,62.210.85.178,TCP,2974,35978  >  9001 [ACK] Seq=311092209 Ack=16830267 Win=65535 Len=2920 [TCP segment of a reassembled PDU]
1,5.200600999999551,62.210.85.178,10.0.2.15,TCP,60,9001  >  35978 [ACK] Seq=16830267 Ack=311089599 Win=65535 Len=0
1,5.200612999999976,62.210.85.178,10.0.2.15,TCP,60,9001  >  35978 [ACK] Seq=16830267 Ack=311091059 Win=65535 Len=0
1,5.200617999999849,62.210.85.178,10.0.2.15,TCP,60,9001  >  35978 [ACK] Seq=16830267 Ack=311092209 Win=65535 Len=0
1,5.200622999999723,62.210.85.178,10.0.2.15,TCP,60,9001  >  35978 [ACK] Seq=16830267 Ack=311093669 Win=65535 Len=0
1,5.200627999999597,62.210.85.178,10.0.2.15,TCP,60,9001  >  35978 [ACK] Seq=16830267 Ack=311095129 Win=65535 Len=0
1,5.200673000000279,10.0.2.15,62.210.85.178,TLSv1.2,1204,Application Data
1,5.200743999999759,10.0.2.15,62.210.85.178,TCP,2974,35978  >  9001 [ACK] Seq=311096279 Ack=16830267 Win=65535 Len=2920 [TCP segment of a reassembled PDU]
1,5.20078199999989,62.210.85.178,10.0.2.15,TCP,60,9001  >  35978 [ACK] Seq=16830267 Ack=311096279 Win=65535 Len=0
1,5.200788999999531,62.210.85.178,10.0.2.15,TCP,60,9001  >  35978 [ACK] Seq=16830267 Ack=311097739 Win=65535 Len=0
1,5.2007940000003146,62.210.85.178,10.0.2.15,TCP,60,9001  >  35978 [ACK] Seq=16830267 Ack=311099199 Win=65535 Len=0
1,5.20082900000034,10.0.2.15,62.210.85.178,TLSv1.2,1204,Application Data
1,5.200920000000224,62.210.85.178,10.0.2.15,TCP,60,9001  >  35978 [ACK] Seq=16830267 Ack=311100349 Win=65535 Len=0
1,5.2009649999999965,10.0.2.15,62.210.85.178,TLSv1.2,782,Application Data
1,5.2010049999998955,62.210.85.178,10.0.2.15,TCP,60,9001  >  35978 [ACK] Seq=16830267 Ack=311101077 Win=65535 Len=0
1,5.697826999999961,54.93.77.70,10.0.2.15,TCP,2950,"9001  >  34692 [PSH, ACK] Seq=310742475 Ack=16877493 Win=65535 Len=2896 [TCP segment of a reassembled PDU]"
1,5.697957000000315,10.0.2.15,54.93.77.70,TCP,54,34692  >  9001 [ACK] Seq=16877493 Ack=310745371 Win=65535 Len=0
1,5.7055239999999685,54.93.77.70,10.0.2.15,TLSv1.2,778,Application Data
1,5.705560000000332,54.93.77.70,10.0.2.15,TCP,1474,9001  >  34692 [ACK] Seq=310746095 Ack=16877493 Win=65535 Len=1420 [TCP segment of a reassembled PDU]
1,5.705595000000358,10.0.2.15,54.93.77.70,TCP,54,34692  >  9001 [ACK] Seq=16877493 Ack=310747515 Win=65535 Len=0
1,5.70564800000011,54.93.77.70,10.0.2.15,TLSv1.2,5874,"Application Data, Application Data"
1,5.705659000000196,54.93.77.70,10.0.2.15,TLSv1.2,2668,"Application Data, Application Data"
1,5.705719999999928,10.0.2.15,54.93.77.70,TCP,54,34692  >  9001 [ACK] Seq=16877493 Ack=310755949 Win=65535 Len=0
1,5.708432999999786,10.0.2.15,54.93.77.70,TLSv1.2,590,Application Data
1,5.7085989999995945,54.93.77.70,10.0.2.15,TCP,60,9001  >  34692 [ACK] Seq=310755949 Ack=16878029 Win=65535 Len=0
1,6.3108689999999115,62.210.85.178,10.0.2.15,TLSv1.2,590,Application Data
1,6.311208000000079,10.0.2.15,62.210.85.178,TLSv1.2,590,Application Data
1,6.3113069999999425,62.210.85.178,10.0.2.15,TCP,60,9001  >  35978 [ACK] Seq=16830803 Ack=311101613 Win=65535 Len=0
1,6.411087999999836,54.93.77.70,10.0.2.15,TLSv1.2,590,Application Data
1,6.411536999999953,10.0.2.15,54.93.77.70,TLSv1.2,590,Application Data
1,6.41167299999961,54.93.77.70,10.0.2.15,TCP,60,9001  >  34692 [ACK] Seq=310756485 Ack=16878565 Win=65535 Len=0
1,6.618169000000307,62.210.85.178,10.0.2.15,TLSv1.2,590,Application Data
1,6.628695000000334,10.0.2.15,62.210.85.178,TLSv1.2,590,Application Data
1,6.628917000000001,62.210.85.178,10.0.2.15,TCP,60,9001  >  35978 [ACK] Seq=16831339 Ack=311102149 Win=65535 Len=0
1,6.640833999999813,10.0.2.15,62.210.85.178,TLSv1.2,4124,Application Data
1,6.640945999999531,10.0.2.15,62.210.85.178,TCP,2974,35978  >  9001 [ACK] Seq=311106219 Ack=16831339 Win=65535 Len=2920 [TCP segment of a reassembled PDU]
1,6.64099299999998,62.210.85.178,10.0.2.15,TCP,60,9001  >  35978 [ACK] Seq=16831339 Ack=311103609 Win=65535 Len=0
1,6.641004000000066,62.210.85.178,10.0.2.15,TCP,60,9001  >  35978 [ACK] Seq=16831339 Ack=311105069 Win=65535 Len=0
1,6.64100899999994,62.210.85.178,10.0.2.15,TCP,60,9001  >  35978 [ACK] Seq=16831339 Ack=311106219 Win=65535 Len=0
1,6.641013000000385,62.210.85.178,10.0.2.15,TCP,60,9001  >  35978 [ACK] Seq=16831339 Ack=311107679 Win=65535 Len=0
1,6.64101699999992,62.210.85.178,10.0.2.15,TCP,60,9001  >  35978 [ACK] Seq=16831339 Ack=311109139 Win=65535 Len=0
1,6.641069999999672,10.0.2.15,62.210.85.178,TLSv1.2,1204,Application Data
1,6.641139000000294,10.0.2.15,62.210.85.178,TCP,2974,35978  >  9001 [ACK] Seq=311110289 Ack=16831339 Win=65535 Len=2920 [TCP segment of a reassembled PDU]
1,6.641176999999516,62.210.85.178,10.0.2.15,TCP,60,9001  >  35978 [ACK] Seq=16831339 Ack=311110289 Win=65535 Len=0
1,6.641184000000067,62.210.85.178,10.0.2.15,TCP,60,9001  >  35978 [ACK] Seq=16831339 Ack=311111749 Win=65535 Len=0
1,6.641187999999602,62.210.85.178,10.0.2.15,TCP,60,9001  >  35978 [ACK] Seq=16831339 Ack=311113209 Win=65535 Len=0
1,6.641222999999627,10.0.2.15,62.210.85.178,TLSv1.2,1204,Application Data
1,6.641287999999804,10.0.2.15,62.210.85.178,TCP,2974,35978  >  9001 [ACK] Seq=311114359 Ack=16831339 Win=65535 Len=2920 [TCP segment of a reassembled PDU]
1,6.641327000000274,62.210.85.178,10.0.2.15,TCP,60,9001  >  35978 [ACK] Seq=16831339 Ack=311114359 Win=65535 Len=0
1,6.641333999999915,62.210.85.178,10.0.2.15,TCP,60,9001  >  35978 [ACK] Seq=16831339 Ack=311115819 Win=65535 Len=0
1,6.64133800000036,62.210.85.178,10.0.2.15,TCP,60,9001  >  35978 [ACK] Seq=16831339 Ack=311117279 Win=65535 Len=0
1,6.641375999999582,10.0.2.15,62.210.85.178,TLSv1.2,1204,Application Data
1,6.641477000000123,62.210.85.178,10.0.2.15,TCP,60,9001  >  35978 [ACK] Seq=16831339 Ack=311118429 Win=65535 Len=0
1,6.641512999999577,10.0.2.15,62.210.85.178,TLSv1.2,332,Application Data
1,6.641550999999708,62.210.85.178,10.0.2.15,TCP,60,9001  >  35978 [ACK] Seq=16831339 Ack=311118707 Win=65535 Len=0
1,6.6415909999996074,10.0.2.15,62.210.85.178,TLSv1.2,3868,Application Data
1,6.641655000000355,10.0.2.15,62.210.85.178,TCP,2974,35978  >  9001 [ACK] Seq=311122521 Ack=16831339 Win=65535 Len=2920 [TCP segment of a reassembled PDU]
1,6.6416980000003605,62.210.85.178,10.0.2.15,TCP,60,9001  >  35978 [ACK] Seq=16831339 Ack=311120167 Win=65535 Len=0
1,6.641703999999663,62.210.85.178,10.0.2.15,TCP,60,9001  >  35978 [ACK] Seq=16831339 Ack=311121627 Win=65535 Len=0
1,6.641708999999537,62.210.85.178,10.0.2.15,TCP,60,9001  >  35978 [ACK] Seq=16831339 Ack=311122521 Win=65535 Len=0
1,6.6417129999999815,62.210.85.178,10.0.2.15,TCP,60,9001  >  35978 [ACK] Seq=16831339 Ack=311123981 Win=65535 Len=0
1,6.641716999999517,62.210.85.178,10.0.2.15,TCP,60,9001  >  35978 [ACK] Seq=16831339 Ack=311125441 Win=65535 Len=0
1,6.641754999999648,10.0.2.15,62.210.85.178,TLSv1.2,1204,Application Data
1,6.64179299999978,62.210.85.178,10.0.2.15,TCP,60,9001  >  35978 [ACK] Seq=16831339 Ack=311126591 Win=65535 Len=0
1,6.641838999999891,10.0.2.15,62.210.85.178,TLSv1.2,3030,Application Data
1,6.64187899999979,62.210.85.178,10.0.2.15,TCP,60,9001  >  35978 [ACK] Seq=16831339 Ack=311128051 Win=65535 Len=0
1,6.641886000000341,62.210.85.178,10.0.2.15,TCP,60,9001  >  35978 [ACK] Seq=16831339 Ack=311129511 Win=65535 Len=0
1,6.641889999999876,62.210.85.178,10.0.2.15,TCP,60,9001  >  35978 [ACK] Seq=16831339 Ack=311129567 Win=65535 Len=0
1,6.651114000000234,10.0.2.15,62.210.85.178,TLSv1.2,4124,Application Data
1,6.6511959999998,10.0.2.15,62.210.85.178,TCP,2974,35978  >  9001 [ACK] Seq=311133637 Ack=16831339 Win=65535 Len=2920 [TCP segment of a reassembled PDU]
1,6.651235999999699,62.210.85.178,10.0.2.15,TCP,60,9001  >  35978 [ACK] Seq=16831339 Ack=311131027 Win=65535 Len=0
1,6.651243999999679,62.210.85.178,10.0.2.15,TCP,60,9001  >  35978 [ACK] Seq=16831339 Ack=311132487 Win=65535 Len=0
1,6.651248000000123,62.210.85.178,10.0.2.15,TCP,60,9001  >  35978 [ACK] Seq=16831339 Ack=311133637 Win=65535 Len=0
1,6.651286000000255,10.0.2.15,62.210.85.178,TLSv1.2,1204,Application Data
1,6.65132100000028,62.210.85.178,10.0.2.15,TCP,60,9001  >  35978 [ACK] Seq=16831339 Ack=311135097 Win=65535 Len=0
1,6.651326999999583,62.210.85.178,10.0.2.15,TCP,60,9001  >  35978 [ACK] Seq=16831339 Ack=311136557 Win=65535 Len=0
1,6.651332000000366,62.210.85.178,10.0.2.15,TCP,60,9001  >  35978 [ACK] Seq=16831339 Ack=311137707 Win=65535 Len=0
1,6.651377999999568,10.0.2.15,62.210.85.178,TLSv1.2,4124,Application Data
1,6.651444000000083,10.0.2.15,62.210.85.178,TCP,2974,35978  >  9001 [ACK] Seq=311141777 Ack=16831339 Win=65535 Len=2920 [TCP segment of a reassembled PDU]
1,6.651480999999876,62.210.85.178,10.0.2.15,TCP,60,9001  >  35978 [ACK] Seq=16831339 Ack=311139167 Win=65535 Len=0
1,6.651487999999517,62.210.85.178,10.0.2.15,TCP,60,9001  >  35978 [ACK] Seq=16831339 Ack=311140627 Win=65535 Len=0
1,6.651491999999962,62.210.85.178,10.0.2.15,TCP,60,9001  >  35978 [ACK] Seq=16831339 Ack=311141777 Win=65535 Len=0
1,6.651496000000407,62.210.85.178,10.0.2.15,TCP,60,9001  >  35978 [ACK] Seq=16831339 Ack=311143237 Win=65535 Len=0
1,6.65150100000028,62.210.85.178,10.0.2.15,TCP,60,9001  >  35978 [ACK] Seq=16831339 Ack=311144697 Win=65535 Len=0
1,6.651538000000073,10.0.2.15,62.210.85.178,TLSv1.2,1204,Application Data
1,6.651625999999851,62.210.85.178,10.0.2.15,TCP,60,9001  >  35978 [ACK] Seq=16831339 Ack=311145847 Win=65535 Len=0
1,6.651660999999876,10.0.2.15,62.210.85.178,TLSv1.2,2974,Application Data
1,6.651713999999629,10.0.2.15,62.210.85.178,TLSv1.2,1226,Application Data
1,6.651748000000225,62.210.85.178,10.0.2.15,TCP,60,9001  >  35978 [ACK] Seq=16831339 Ack=311147307 Win=65535 Len=0
1,6.651754999999866,62.210.85.178,10.0.2.15,TCP,60,9001  >  35978 [ACK] Seq=16831339 Ack=311148767 Win=65535 Len=0
1,6.651759000000311,62.210.85.178,10.0.2.15,TCP,60,9001  >  35978 [ACK] Seq=16831339 Ack=311149939 Win=65535 Len=0
1,6.651802999999745,10.0.2.15,62.210.85.178,TLSv1.2,4124,Application Data
1,6.651842999999644,62.210.85.178,10.0.2.15,TCP,60,9001  >  35978 [ACK] Seq=16831339 Ack=311151399 Win=65535 Len=0
1,6.651850000000195,62.210.85.178,10.0.2.15,TCP,60,9001  >  35978 [ACK] Seq=16831339 Ack=311152859 Win=65535 Len=0
1,6.65185399999973,62.210.85.178,10.0.2.15,TCP,60,9001  >  35978 [ACK] Seq=16831339 Ack=311154009 Win=65535 Len=0
1,6.651899999999841,10.0.2.15,62.210.85.178,TLSv1.2,3030,Application Data
