No.,Time,Source,Destination,Protocol,Length,Info
1,0.0014970000001994777,62.210.85.178,10.0.2.15,TLSv1.2,590,Application Data
1,0.027154000000336964,10.0.2.15,54.93.77.70,TCP,54,34692  >  9001 [ACK] Seq=17159327 Ack=315881717 Win=65535 Len=0
1,0.04713900000024296,10.0.2.15,62.210.85.178,TCP,54,35978  >  9001 [ACK] Seq=316224887 Ack=17109055 Win=65535 Len=0
1,0.08192900000085501,62.210.85.178,10.0.2.15,TLSv1.2,590,Application Data
1,0.08202200000050652,10.0.2.15,62.210.85.178,TCP,54,35978  >  9001 [ACK] Seq=316224887 Ack=17109591 Win=65535 Len=0
1,0.12446600000021135,62.210.85.178,10.0.2.15,TLSv1.2,1618,Application Data
1,0.12455400000089867,10.0.2.15,62.210.85.178,TCP,54,35978  >  9001 [ACK] Seq=316224887 Ack=17111155 Win=65535 Len=0
1,0.1410840000007738,10.0.2.15,54.93.77.70,TLSv1.2,590,Application Data
1,0.1412640000007741,54.93.77.70,10.0.2.15,TCP,60,9001  >  34692 [ACK] Seq=315881717 Ack=17159863 Win=65535 Len=0
1,0.24726400000054127,62.210.85.178,10.0.2.15,TLSv1.2,590,Application Data
1,0.24734300000000076,10.0.2.15,62.210.85.178,TCP,54,35978  >  9001 [ACK] Seq=316224887 Ack=17111691 Win=65535 Len=0
1,0.2478290000008201,10.0.2.15,62.210.85.178,TLSv1.2,590,Application Data
1,0.24792600000000675,62.210.85.178,10.0.2.15,TCP,60,9001  >  35978 [ACK] Seq=17111691 Ack=316225423 Win=65535 Len=0
1,0.3488680000000386,54.93.77.70,10.0.2.15,TLSv1.2,590,Application Data
1,0.3489370000006602,10.0.2.15,54.93.77.70,TCP,54,34692  >  9001 [ACK] Seq=17159863 Ack=315882253 Win=65535 Len=0
1,0.3493060000000696,10.0.2.15,54.93.77.70,TLSv1.2,1618,Application Data
1,0.349409000000378,54.93.77.70,10.0.2.15,TCP,60,9001  >  34692 [ACK] Seq=315882253 Ack=17161323 Win=65535 Len=0
1,0.34943100000054983,54.93.77.70,10.0.2.15,TCP,60,9001  >  34692 [ACK] Seq=315882253 Ack=17161427 Win=65535 Len=0
1,0.5280410000004849,62.210.85.178,10.0.2.15,TLSv1.2,1618,Application Data
1,0.5281680000007327,10.0.2.15,62.210.85.178,TCP,54,35978  >  9001 [ACK] Seq=316225423 Ack=17113255 Win=65535 Len=0
1,0.5438190000004397,10.0.2.15,62.210.85.178,TLSv1.2,590,Application Data
1,0.5439949999999953,62.210.85.178,10.0.2.15,TCP,60,9001  >  35978 [ACK] Seq=17113255 Ack=316225959 Win=65535 Len=0
1,0.55571400000008,10.0.2.15,62.210.85.178,TLSv1.2,1618,Application Data
1,0.5562230000005002,62.210.85.178,10.0.2.15,TCP,60,9001  >  35978 [ACK] Seq=17113255 Ack=316227419 Win=65535 Len=0
1,0.5562800000006973,62.210.85.178,10.0.2.15,TCP,60,9001  >  35978 [ACK] Seq=17113255 Ack=316227523 Win=65535 Len=0
1,0.6419020000003002,54.93.77.70,10.0.2.15,TLSv1.2,590,Application Data
1,0.681988000000274,10.0.2.15,54.93.77.70,TCP,54,34692  >  9001 [ACK] Seq=17161427 Ack=315882789 Win=65535 Len=0
1,0.8332380000001649,54.93.77.70,10.0.2.15,TLSv1.2,1618,Application Data
1,0.8333260000008522,10.0.2.15,54.93.77.70,TCP,54,34692  >  9001 [ACK] Seq=17161427 Ack=315884353 Win=65535 Len=0
1,0.8360720000000583,10.0.2.15,54.93.77.70,TLSv1.2,590,Application Data
1,0.8362680000000182,54.93.77.70,10.0.2.15,TCP,60,9001  >  34692 [ACK] Seq=315884353 Ack=17161963 Win=65535 Len=0
1,0.9431630000008226,62.210.85.178,10.0.2.15,TLSv1.2,590,Application Data
1,0.9435630000007222,10.0.2.15,62.210.85.178,TLSv1.2,590,Application Data
1,0.9436940000005052,62.210.85.178,10.0.2.15,TCP,60,9001  >  35978 [ACK] Seq=17113791 Ack=316228059 Win=65535 Len=0
1,1.1404300000003786,54.93.77.70,10.0.2.15,TLSv1.2,590,Application Data
1,1.1408290000008492,10.0.2.15,54.93.77.70,TLSv1.2,590,Application Data
1,1.1409390000007988,54.93.77.70,10.0.2.15,TCP,60,9001  >  34692 [ACK] Seq=315884889 Ack=17162499 Win=65535 Len=0
1,1.345976000000519,62.210.85.178,10.0.2.15,TLSv1.2,590,Application Data
1,1.3500390000008338,10.0.2.15,62.210.85.178,TLSv1.2,590,Application Data
1,1.3502390000003288,62.210.85.178,10.0.2.15,TCP,60,9001  >  35978 [ACK] Seq=17114327 Ack=316228595 Win=65535 Len=0
1,1.3626960000001418,10.0.2.15,62.210.85.178,TLSv1.2,4124,Application Data
1,1.3628380000000107,10.0.2.15,62.210.85.178,TCP,2974,35978  >  9001 [ACK] Seq=316232665 Ack=17114327 Win=65535 Len=2920 [TCP segment of a reassembled PDU]
1,1.3628670000007332,62.210.85.178,10.0.2.15,TCP,60,9001  >  35978 [ACK] Seq=17114327 Ack=316230055 Win=65535 Len=0
1,1.3628770000004806,62.210.85.178,10.0.2.15,TCP,60,9001  >  35978 [ACK] Seq=17114327 Ack=316231515 Win=65535 Len=0
1,1.3628820000003543,62.210.85.178,10.0.2.15,TCP,60,9001  >  35978 [ACK] Seq=17114327 Ack=316232665 Win=65535 Len=0
1,1.3629300000002331,10.0.2.15,62.210.85.178,TLSv1.2,1204,Application Data
1,1.3629700000001321,62.210.85.178,10.0.2.15,TCP,60,9001  >  35978 [ACK] Seq=17114327 Ack=316234125 Win=65535 Len=0
1,1.362977000000683,62.210.85.178,10.0.2.15,TCP,60,9001  >  35978 [ACK] Seq=17114327 Ack=316235585 Win=65535 Len=0
1,1.362981000000218,62.210.85.178,10.0.2.15,TCP,60,9001  >  35978 [ACK] Seq=17114327 Ack=316236735 Win=65535 Len=0
1,1.3630290000000969,10.0.2.15,62.210.85.178,TLSv1.2,4124,Application Data
1,1.3631200000008903,10.0.2.15,62.210.85.178,TCP,2974,35978  >  9001 [ACK] Seq=316240805 Ack=17114327 Win=65535 Len=2920 [TCP segment of a reassembled PDU]
1,1.3631420000001526,62.210.85.178,10.0.2.15,TCP,60,9001  >  35978 [ACK] Seq=17114327 Ack=316238195 Win=65535 Len=0
1,1.3631490000007034,62.210.85.178,10.0.2.15,TCP,60,9001  >  35978 [ACK] Seq=17114327 Ack=316239655 Win=65535 Len=0
1,1.363154000000577,62.210.85.178,10.0.2.15,TCP,60,9001  >  35978 [ACK] Seq=17114327 Ack=316240805 Win=65535 Len=0
1,1.3631890000006024,10.0.2.15,62.210.85.178,TLSv1.2,1204,Application Data
1,1.3632240000006277,62.210.85.178,10.0.2.15,TCP,60,9001  >  35978 [ACK] Seq=17114327 Ack=316242265 Win=65535 Len=0
1,1.36323000000084,62.210.85.178,10.0.2.15,TCP,60,9001  >  35978 [ACK] Seq=17114327 Ack=316243725 Win=65535 Len=0
1,1.363296000000446,10.0.2.15,62.210.85.178,TLSv1.2,2974,Application Data
1,1.3633410000002186,62.210.85.178,10.0.2.15,TCP,60,9001  >  35978 [ACK] Seq=17114327 Ack=316244875 Win=65535 Len=0
1,1.3633480000007694,62.210.85.178,10.0.2.15,TCP,60,9001  >  35978 [ACK] Seq=17114327 Ack=316246335 Win=65535 Len=0
1,1.3633520000003045,62.210.85.178,10.0.2.15,TCP,60,9001  >  35978 [ACK] Seq=17114327 Ack=316247795 Win=65535 Len=0
1,1.3633870000003299,10.0.2.15,62.210.85.178,TLSv1.2,1226,Application Data
1,1.3634230000006937,62.210.85.178,10.0.2.15,TCP,60,9001  >  35978 [ACK] Seq=17114327 Ack=316248967 Win=65535 Len=0
1,1.363470000000234,10.0.2.15,62.210.85.178,TLSv1.2,4124,Application Data
1,1.36351200000081,62.210.85.178,10.0.2.15,TCP,60,9001  >  35978 [ACK] Seq=17114327 Ack=316250427 Win=65535 Len=0
1,1.3635180000001128,62.210.85.178,10.0.2.15,TCP,60,9001  >  35978 [ACK] Seq=17114327 Ack=316251887 Win=65535 Len=0
1,1.3635220000005575,62.210.85.178,10.0.2.15,TCP,60,9001  >  35978 [ACK] Seq=17114327 Ack=316253037 Win=65535 Len=0
1,1.3635680000006687,10.0.2.15,62.210.85.178,TLSv1.2,3030,Application Data
1,1.3636089999999967,62.210.85.178,10.0.2.15,TCP,60,9001  >  35978 [ACK] Seq=17114327 Ack=316254497 Win=65535 Len=0
1,1.363615000000209,62.210.85.178,10.0.2.15,TCP,60,9001  >  35978 [ACK] Seq=17114327 Ack=316255957 Win=65535 Len=0
1,1.3636200000000827,62.210.85.178,10.0.2.15,TCP,60,9001  >  35978 [ACK] Seq=17114327 Ack=316256013 Win=65535 Len=0
1,1.3728460000002087,10.0.2.15,62.210.85.178,TLSv1.2,590,Application Data
1,1.3729030000004059,62.210.85.178,10.0.2.15,TCP,60,9001  >  35978 [ACK] Seq=17114327 Ack=316256549 Win=65535 Len=0
1,1.4544300000006842,54.93.77.70,10.0.2.15,TLSv1.2,3674,Application Data
1,1.4545750000006592,10.0.2.15,54.93.77.70,TCP,54,34692  >  9001 [ACK] Seq=17162499 Ack=315888509 Win=65535 Len=0
1,1.4703350000008868,54.93.77.70,10.0.2.15,TLSv1.2,590,Application Data
1,1.4874650000001566,54.93.77.70,10.0.2.15,TLSv1.2,4210,"Application Data, Application Data"
1,1.48751700000048,10.0.2.15,54.93.77.70,TCP,54,34692  >  9001 [ACK] Seq=17162499 Ack=315893201 Win=65535 Len=0
1,1.4982610000006389,54.93.77.70,10.0.2.15,TCP,2950,"9001  >  34692 [PSH, ACK] Seq=315893201 Ack=17162499 Win=65535 Len=2896 [TCP segment of a reassembled PDU]"
1,1.4983060000004116,10.0.2.15,54.93.77.70,TCP,54,34692  >  9001 [ACK] Seq=17162499 Ack=315896097 Win=65535 Len=0
1,1.5043710000009014,54.93.77.70,10.0.2.15,TLSv1.2,778,Application Data
1,1.5082230000007257,54.93.77.70,10.0.2.15,TCP,2950,"9001  >  34692 [PSH, ACK] Seq=315896821 Ack=17162499 Win=65535 Len=2896 [TCP segment of a reassembled PDU]"
1,1.508269000000837,10.0.2.15,54.93.77.70,TCP,54,34692  >  9001 [ACK] Seq=17162499 Ack=315899717 Win=65535 Len=0
1,1.5196310000001176,54.93.77.70,10.0.2.15,TLSv1.2,4398,Application Data [TCP segment of a reassembled PDU]
1,1.5196780000005674,10.0.2.15,54.93.77.70,TCP,54,34692  >  9001 [ACK] Seq=17162499 Ack=315904061 Win=65535 Len=0
1,1.5214760000008027,54.93.77.70,10.0.2.15,TLSv1.2,568,Application Data
1,1.561159000000771,54.93.77.70,10.0.2.15,TLSv1.2,3674,Application Data
1,1.5612350000001243,10.0.2.15,54.93.77.70,TCP,54,34692  >  9001 [ACK] Seq=17162499 Ack=315908195 Win=65535 Len=0
1,1.5718890000007377,54.93.77.70,10.0.2.15,TCP,2950,"9001  >  34692 [PSH, ACK] Seq=315908195 Ack=17162499 Win=65535 Len=2896 [TCP segment of a reassembled PDU]"
1,1.5719420000004902,10.0.2.15,54.93.77.70,TCP,54,34692  >  9001 [ACK] Seq=17162499 Ack=315911091 Win=65535 Len=0
1,1.578244000000268,54.93.77.70,10.0.2.15,TLSv1.2,1314,"Application Data, Application Data"
1,1.5783950000004552,10.0.2.15,54.93.77.70,TLSv1.2,590,Application Data
1,1.5784670000002734,54.93.77.70,10.0.2.15,TCP,60,9001  >  34692 [ACK] Seq=315912351 Ack=17163035 Win=65535 Len=0
1,1.6425080000008165,54.93.77.70,10.0.2.15,TLSv1.2,1104,Application Data
1,1.6449030000003404,10.0.2.15,54.93.77.70,TLSv1.2,590,Application Data
1,1.6450550000008661,54.93.77.70,10.0.2.15,TCP,60,9001  >  34692 [ACK] Seq=315913401 Ack=17163571 Win=65535 Len=0
1,1.7146670000001905,62.210.85.178,10.0.2.15,TLSv1.2,590,Application Data
1,1.757991000000402,10.0.2.15,62.210.85.178,TCP,54,35978  >  9001 [ACK] Seq=316256549 Ack=17114863 Win=65535 Len=0
1,1.7746790000001056,62.210.85.178,10.0.2.15,TLSv1.2,590,Application Data
1,1.7747370000006413,10.0.2.15,62.210.85.178,TCP,54,35978  >  9001 [ACK] Seq=316256549 Ack=17115399 Win=65535 Len=0
1,1.7751860000007582,10.0.2.15,62.210.85.178,TLSv1.2,590,Application Data
1,1.7752910000008342,62.210.85.178,10.0.2.15,TCP,60,9001  >  35978 [ACK] Seq=17115399 Ack=316257085 Win=65535 Len=0
1,1.8749560000005658,54.93.77.70,10.0.2.15,TLSv1.2,590,Application Data
1,1.8753120000001218,10.0.2.15,54.93.77.70,TLSv1.2,590,Application Data
1,1.8754140000000916,54.93.77.70,10.0.2.15,TCP,60,9001  >  34692 [ACK] Seq=315913937 Ack=17164107 Win=65535 Len=0
1,1.9951800000008006,62.210.85.178,10.0.2.15,TLSv1.2,590,Application Data
1,2.0007070000001477,10.0.2.15,62.210.85.178,TLSv1.2,590,Application Data
1,2.000853000000461,62.210.85.178,10.0.2.15,TCP,60,9001  >  35978 [ACK] Seq=17115935 Ack=316257621 Win=65535 Len=0
1,2.0143860000007408,10.0.2.15,62.210.85.178,TLSv1.2,4124,Application Data
1,2.0144780000000537,10.0.2.15,62.210.85.178,TCP,2974,35978  >  9001 [ACK] Seq=316261691 Ack=17115935 Win=65535 Len=2920 [TCP segment of a reassembled PDU]
1,2.01452000000063,62.210.85.178,10.0.2.15,TCP,60,9001  >  35978 [ACK] Seq=17115935 Ack=316259081 Win=65535 Len=0
1,2.014530000000377,62.210.85.178,10.0.2.15,TCP,60,9001  >  35978 [ACK] Seq=17115935 Ack=316260541 Win=65535 Len=0
1,2.0145360000005894,62.210.85.178,10.0.2.15,TCP,60,9001  >  35978 [ACK] Seq=17115935 Ack=316261691 Win=65535 Len=0
1,2.0145400000001246,62.210.85.178,10.0.2.15,TCP,60,9001  >  35978 [ACK] Seq=17115935 Ack=316263151 Win=65535 Len=0
1,2.014544000000569,62.210.85.178,10.0.2.15,TCP,60,9001  >  35978 [ACK] Seq=17115935 Ack=316264611 Win=65535 Len=0
1,2.014578000000256,10.0.2.15,62.210.85.178,TLSv1.2,1204,Application Data
1,2.0146120000008523,62.210.85.178,10.0.2.15,TCP,60,9001  >  35978 [ACK] Seq=17115935 Ack=316265761 Win=65535 Len=0
1,2.0146560000002864,10.0.2.15,62.210.85.178,TLSv1.2,4124,Application Data
1,2.0146920000006503,62.210.85.178,10.0.2.15,TCP,60,9001  >  35978 [ACK] Seq=17115935 Ack=316267221 Win=65535 Len=0
1,2.01470000000063,62.210.85.178,10.0.2.15,TCP,60,9001  >  35978 [ACK] Seq=17115935 Ack=316268681 Win=65535 Len=0
1,2.0147040000001653,62.210.85.178,10.0.2.15,TCP,60,9001  >  35978 [ACK] Seq=17115935 Ack=316269831 Win=65535 Len=0
1,2.0147410000008676,10.0.2.15,62.210.85.178,TLSv1.2,4124,Application Data
1,2.0147750000005544,62.210.85.178,10.0.2.15,TCP,60,9001  >  35978 [ACK] Seq=17115935 Ack=316271291 Win=65535 Len=0
1,2.0147820000001957,62.210.85.178,10.0.2.15,TCP,60,9001  >  35978 [ACK] Seq=17115935 Ack=316272751 Win=65535 Len=0
1,2.0148370000006253,10.0.2.15,62.210.85.178,TLSv1.2,2974,Application Data
1,2.014874000000418,62.210.85.178,10.0.2.15,TCP,60,9001  >  35978 [ACK] Seq=17115935 Ack=316273901 Win=65535 Len=0
1,2.0148810000000594,62.210.85.178,10.0.2.15,TCP,60,9001  >  35978 [ACK] Seq=17115935 Ack=316275361 Win=65535 Len=0
1,2.0148840000001655,62.210.85.178,10.0.2.15,TCP,60,9001  >  35978 [ACK] Seq=17115935 Ack=316276821 Win=65535 Len=0
1,2.014911000000211,10.0.2.15,62.210.85.178,TLSv1.2,1226,Application Data
1,2.0149430000001303,62.210.85.178,10.0.2.15,TCP,60,9001  >  35978 [ACK] Seq=17115935 Ack=316277993 Win=65535 Len=0
1,2.0149830000000293,10.0.2.15,62.210.85.178,TLSv1.2,4124,Application Data
1,2.0150180000000546,62.210.85.178,10.0.2.15,TCP,60,9001  >  35978 [ACK] Seq=17115935 Ack=316279453 Win=65535 Len=0
1,2.015024000000267,62.210.85.178,10.0.2.15,TCP,60,9001  >  35978 [ACK] Seq=17115935 Ack=316280913 Win=65535 Len=0
1,2.015027000000373,62.210.85.178,10.0.2.15,TCP,60,9001  >  35978 [ACK] Seq=17115935 Ack=316282063 Win=65535 Len=0
1,2.015063000000737,10.0.2.15,62.210.85.178,TLSv1.2,3030,Application Data
1,2.015098000000762,62.210.85.178,10.0.2.15,TCP,60,9001  >  35978 [ACK] Seq=17115935 Ack=316283523 Win=65535 Len=0
1,2.0151080000005095,62.210.85.178,10.0.2.15,TCP,60,9001  >  35978 [ACK] Seq=17115935 Ack=316284983 Win=65535 Len=0
1,2.0151110000006156,62.210.85.178,10.0.2.15,TCP,60,9001  >  35978 [ACK] Seq=17115935 Ack=316285039 Win=65535 Len=0
1,2.0265470000003916,10.0.2.15,62.210.85.178,TLSv1.2,4124,Application Data
1,2.0266240000000835,62.210.85.178,10.0.2.15,TCP,60,9001  >  35978 [ACK] Seq=17115935 Ack=316286499 Win=65535 Len=0
1,2.026633000000402,62.210.85.178,10.0.2.15,TCP,60,9001  >  35978 [ACK] Seq=17115935 Ack=316287959 Win=65535 Len=0
1,2.026636000000508,62.210.85.178,10.0.2.15,TCP,60,9001  >  35978 [ACK] Seq=17115935 Ack=316289109 Win=65535 Len=0
1,2.0266780000001745,10.0.2.15,62.210.85.178,TLSv1.2,4124,Application Data
1,2.026748000000225,62.210.85.178,10.0.2.15,TCP,60,9001  >  35978 [ACK] Seq=17115935 Ack=316290569 Win=65535 Len=0
1,2.026756000000205,62.210.85.178,10.0.2.15,TCP,60,9001  >  35978 [ACK] Seq=17115935 Ack=316292029 Win=65535 Len=0
1,2.026759000000311,62.210.85.178,10.0.2.15,TCP,60,9001  >  35978 [ACK] Seq=17115935 Ack=316293179 Win=65535 Len=0
1,2.0267910000002303,10.0.2.15,62.210.85.178,TLSv1.2,4124,Application Data
1,2.026824000000488,62.210.85.178,10.0.2.15,TCP,60,9001  >  35978 [ACK] Seq=17115935 Ack=316294639 Win=65535 Len=0
1,2.0268310000001293,62.210.85.178,10.0.2.15,TCP,60,9001  >  35978 [ACK] Seq=17115935 Ack=316296099 Win=65535 Len=0
1,2.026835000000574,62.210.85.178,10.0.2.15,TCP,60,9001  >  35978 [ACK] Seq=17115935 Ack=316297249 Win=65535 Len=0
1,2.0268710000000283,10.0.2.15,62.210.85.178,TLSv1.2,4124,Application Data
1,2.0269060000000536,62.210.85.178,10.0.2.15,TCP,60,9001  >  35978 [ACK] Seq=17115935 Ack=316298709 Win=65535 Len=0
1,2.0269140000000334,62.210.85.178,10.0.2.15,TCP,60,9001  >  35978 [ACK] Seq=17115935 Ack=316300169 Win=65535 Len=0
1,2.0269190000008166,62.210.85.178,10.0.2.15,TCP,60,9001  >  35978 [ACK] Seq=17115935 Ack=316301319 Win=65535 Len=0
1,2.026955000000271,10.0.2.15,62.210.85.178,TLSv1.2,332,Application Data
1,2.0269890000008672,62.210.85.178,10.0.2.15,TCP,60,9001  >  35978 [ACK] Seq=17115935 Ack=316301597 Win=65535 Len=0
1,2.0270390000005136,10.0.2.15,62.210.85.178,TLSv1.2,3868,Application Data
1,2.0270830000008573,62.210.85.178,10.0.2.15,TCP,60,9001  >  35978 [ACK] Seq=17115935 Ack=316303057 Win=65535 Len=0
1,2.02708900000016,62.210.85.178,10.0.2.15,TCP,60,9001  >  35978 [ACK] Seq=17115935 Ack=316304517 Win=65535 Len=0
1,2.027092000000266,62.210.85.178,10.0.2.15,TCP,60,9001  >  35978 [ACK] Seq=17115935 Ack=316305411 Win=65535 Len=0
1,2.027129000000059,10.0.2.15,62.210.85.178,TLSv1.2,4124,Application Data
1,2.0272320000003674,62.210.85.178,10.0.2.15,TCP,60,9001  >  35978 [ACK] Seq=17115935 Ack=316306871 Win=65535 Len=0
1,2.0272430000004533,62.210.85.178,10.0.2.15,TCP,60,9001  >  35978 [ACK] Seq=17115935 Ack=316308331 Win=65535 Len=0
1,2.0272460000005594,62.210.85.178,10.0.2.15,TCP,60,9001  >  35978 [ACK] Seq=17115935 Ack=316309481 Win=65535 Len=0
1,2.0272920000006707,10.0.2.15,62.210.85.178,TLSv1.2,3030,Application Data
1,2.027349000000868,62.210.85.178,10.0.2.15,TCP,60,9001  >  35978 [ACK] Seq=17115935 Ack=316310941 Win=65535 Len=0
1,2.0273570000008476,62.210.85.178,10.0.2.15,TCP,60,9001  >  35978 [ACK] Seq=17115935 Ack=316312401 Win=65535 Len=0
1,2.0273600000000442,62.210.85.178,10.0.2.15,TCP,60,9001  >  35978 [ACK] Seq=17115935 Ack=316312457 Win=65535 Len=0
1,2.0366970000004585,10.0.2.15,62.210.85.178,TLSv1.2,4124,Application Data
1,2.036832000000686,62.210.85.178,10.0.2.15,TCP,60,9001  >  35978 [ACK] Seq=17115935 Ack=316313917 Win=65535 Len=0
1,2.0368480000006457,62.210.85.178,10.0.2.15,TCP,60,9001  >  35978 [ACK] Seq=17115935 Ack=316315377 Win=65535 Len=0
1,2.036852000000181,62.210.85.178,10.0.2.15,TCP,60,9001  >  35978 [ACK] Seq=17115935 Ack=316316527 Win=65535 Len=0
1,2.0369500000006155,10.0.2.15,62.210.85.178,TLSv1.2,4124,Application Data
1,2.037020000000666,62.210.85.178,10.0.2.15,TCP,60,9001  >  35978 [ACK] Seq=17115935 Ack=316317987 Win=65535 Len=0
1,2.0370270000003075,62.210.85.178,10.0.2.15,TCP,60,9001  >  35978 [ACK] Seq=17115935 Ack=316319447 Win=65535 Len=0
1,2.037032000000181,62.210.85.178,10.0.2.15,TCP,60,9001  >  35978 [ACK] Seq=17115935 Ack=316320597 Win=65535 Len=0
1,2.0370740000007572,10.0.2.15,62.210.85.178,TLSv1.2,1232,Application Data
1,2.037130000000616,62.210.85.178,10.0.2.15,TCP,60,9001  >  35978 [ACK] Seq=17115935 Ack=316321775 Win=65535 Len=0
1,2.1149520000008124,54.93.77.70,10.0.2.15,TLSv1.2,590,Application Data
1,2.1372580000006565,54.93.77.70,10.0.2.15,TLSv1.2,7294,Application Data
1,2.1373650000005,10.0.2.15,54.93.77.70,TCP,54,34692  >  9001 [ACK] Seq=17164107 Ack=315921713 Win=65535 Len=0
1,2.137775000000147,54.93.77.70,10.0.2.15,TLSv1.2,2950,Application Data [TCP segment of a reassembled PDU]
1,2.137820000000829,10.0.2.15,54.93.77.70,TCP,54,34692  >  9001 [ACK] Seq=17164107 Ack=315924609 Win=65535 Len=0
1,2.154844000000594,54.93.77.70,10.0.2.15,TLSv1.2,778,Application Data
1,2.197985000000699,10.0.2.15,54.93.77.70,TCP,54,34692  >  9001 [ACK] Seq=17164107 Ack=315925333 Win=65535 Len=0
1,2.203135000000657,54.93.77.70,10.0.2.15,TCP,2950,"9001  >  34692 [PSH, ACK] Seq=315925333 Ack=17164107 Win=65535 Len=2896 [TCP segment of a reassembled PDU]"
1,2.2031850000003033,10.0.2.15,54.93.77.70,TCP,54,34692  >  9001 [ACK] Seq=17164107 Ack=315928229 Win=65535 Len=0
1,2.2129540000005363,54.93.77.70,10.0.2.15,TLSv1.2,778,Application Data
1,2.212993000000097,10.0.2.15,54.93.77.70,TCP,54,34692  >  9001 [ACK] Seq=17164107 Ack=315928953 Win=65535 Len=0
1,2.213770000000295,54.93.77.70,10.0.2.15,TCP,2950,"9001  >  34692 [PSH, ACK] Seq=315928953 Ack=17164107 Win=65535 Len=2896 [TCP segment of a reassembled PDU]"
1,2.213812000000871,10.0.2.15,54.93.77.70,TCP,54,34692  >  9001 [ACK] Seq=17164107 Ack=315931849 Win=65535 Len=0
1,2.22131200000058,54.93.77.70,10.0.2.15,TLSv1.2,5846,"Application Data, Application Data, Application Data"
1,2.2213540000002467,10.0.2.15,54.93.77.70,TCP,54,34692  >  9001 [ACK] Seq=17164107 Ack=315937641 Win=65535 Len=0
1,2.2215130000004137,10.0.2.15,54.93.77.70,TLSv1.2,590,Application Data
1,2.221588000000338,54.93.77.70,10.0.2.15,TCP,60,9001  >  34692 [ACK] Seq=315937641 Ack=17164643 Win=65535 Len=0
1,2.229827000000114,54.93.77.70,10.0.2.15,TLSv1.2,192,Application Data
1,2.2347820000004504,54.93.77.70,10.0.2.15,TLSv1.2,7294,"Application Data, Application Data"
1,2.2348620000002484,10.0.2.15,54.93.77.70,TCP,54,34692  >  9001 [ACK] Seq=17164643 Ack=315945019 Win=65535 Len=0
1,2.235003000000688,10.0.2.15,54.93.77.70,TLSv1.2,590,Application Data
1,2.23508000000038,54.93.77.70,10.0.2.15,TCP,60,9001  >  34692 [ACK] Seq=315945019 Ack=17165179 Win=65535 Len=0
1,2.246024000000034,54.93.77.70,10.0.2.15,TCP,2950,"9001  >  34692 [PSH, ACK] Seq=315945019 Ack=17165179 Win=65535 Len=2896 [TCP segment of a reassembled PDU]"
1,2.246091000000888,10.0.2.15,54.93.77.70,TCP,54,34692  >  9001 [ACK] Seq=17165179 Ack=315947915 Win=65535 Len=0
1,2.246117000000595,54.93.77.70,10.0.2.15,TLSv1.2,1502,Application Data [TCP segment of a reassembled PDU]
1,2.2461660000008123,10.0.2.15,54.93.77.70,TCP,54,34692  >  9001 [ACK] Seq=17165179 Ack=315949363 Win=65535 Len=0
1,2.2476680000008855,54.93.77.70,10.0.2.15,TLSv1.2,7598,"Application Data, Application Data"
1,2.247729000000618,10.0.2.15,54.93.77.70,TCP,54,34692  >  9001 [ACK] Seq=17165179 Ack=315956907 Win=65535 Len=0
1,2.2581800000007206,54.93.77.70,10.0.2.15,TLSv1.2,7294,Application Data
1,2.2582310000007055,10.0.2.15,54.93.77.70,TCP,54,34692  >  9001 [ACK] Seq=17165179 Ack=315964147 Win=65535 Len=0
1,2.2638090000000375,54.93.77.70,10.0.2.15,TLSv1.2,568,Application Data
1,2.280649000000267,54.93.77.70,10.0.2.15,TLSv1.2,5846,Application Data
1,2.280695000000378,10.0.2.15,54.93.77.70,TCP,54,34692  >  9001 [ACK] Seq=17165179 Ack=315970453 Win=65535 Len=0
1,2.2808530000002065,10.0.2.15,54.93.77.70,TLSv1.2,590,Application Data
1,2.280927000000702,54.93.77.70,10.0.2.15,TCP,60,9001  >  34692 [ACK] Seq=315970453 Ack=17165715 Win=65535 Len=0
1,2.2811450000008335,54.93.77.70,10.0.2.15,TLSv1.2,2402,Application Data
1,2.2811850000007325,10.0.2.15,54.93.77.70,TCP,54,34692  >  9001 [ACK] Seq=17165715 Ack=315972801 Win=65535 Len=0
1,2.2925930000001244,54.93.77.70,10.0.2.15,TLSv1.2,5846,"Application Data, Application Data"
1,2.29265900000064,10.0.2.15,54.93.77.70,TCP,54,34692  >  9001 [ACK] Seq=17165715 Ack=315978593 Win=65535 Len=0
1,2.2973500000007334,54.93.77.70,10.0.2.15,TLSv1.2,110,Application Data
1,2.2999330000002374,10.0.2.15,54.93.77.70,TLSv1.2,590,Application Data
1,2.30011100000047,54.93.77.70,10.0.2.15,TCP,60,9001  >  34692 [ACK] Seq=315978649 Ack=17166251 Win=65535 Len=0
1,2.3392430000003515,62.210.85.178,10.0.2.15,TLSv1.2,1104,Application Data
1,2.382009000000835,10.0.2.15,62.210.85.178,TCP,54,35978  >  9001 [ACK] Seq=316321775 Ack=17116985 Win=65535 Len=0
1,2.390363000000434,62.210.85.178,10.0.2.15,TLSv1.2,590,Application Data
1,2.3904150000007576,10.0.2.15,62.210.85.178,TCP,54,35978  >  9001 [ACK] Seq=316321775 Ack=17117521 Win=65535 Len=0
1,2.443810000000667,62.210.85.178,10.0.2.15,TLSv1.2,590,Application Data
1,2.443890000000465,10.0.2.15,62.210.85.178,TCP,54,35978  >  9001 [ACK] Seq=316321775 Ack=17118057 Win=65535 Len=0
1,2.4443950000004406,10.0.2.15,62.210.85.178,TLSv1.2,590,Application Data
1,2.4445000000005166,62.210.85.178,10.0.2.15,TCP,60,9001  >  35978 [ACK] Seq=17118057 Ack=316322311 Win=65535 Len=0
1,2.5496310000007725,54.93.77.70,10.0.2.15,TLSv1.2,590,Application Data
1,2.5500230000006923,10.0.2.15,54.93.77.70,TLSv1.2,590,Application Data
1,2.5501970000004803,54.93.77.70,10.0.2.15,TCP,60,9001  >  34692 [ACK] Seq=315979185 Ack=17166787 Win=65535 Len=0
1,2.984087000000727,62.210.85.178,10.0.2.15,TLSv1.2,590,Application Data
1,2.9887670000007347,10.0.2.15,62.210.85.178,TLSv1.2,590,Application Data
1,2.9889060000004974,62.210.85.178,10.0.2.15,TCP,60,9001  >  35978 [ACK] Seq=17118593 Ack=316322847 Win=65535 Len=0
1,2.9991190000000643,10.0.2.15,62.210.85.178,TLSv1.2,4124,Application Data
1,2.9992260000008173,10.0.2.15,62.210.85.178,TCP,2974,35978  >  9001 [ACK] Seq=316326917 Ack=17118593 Win=65535 Len=2920 [TCP segment of a reassembled PDU]
1,2.9993160000003627,62.210.85.178,10.0.2.15,TCP,60,9001  >  35978 [ACK] Seq=17118593 Ack=316324307 Win=65535 Len=0
1,2.9993300000005547,62.210.85.178,10.0.2.15,TCP,60,9001  >  35978 [ACK] Seq=17118593 Ack=316325767 Win=65535 Len=0
1,2.99933400000009,62.210.85.178,10.0.2.15,TCP,60,9001  >  35978 [ACK] Seq=17118593 Ack=316326917 Win=65535 Len=0
1,2.999337000000196,62.210.85.178,10.0.2.15,TCP,60,9001  >  35978 [ACK] Seq=17118593 Ack=316328377 Win=65535 Len=0
1,2.999339000000873,62.210.85.178,10.0.2.15,TCP,60,9001  >  35978 [ACK] Seq=17118593 Ack=316329837 Win=65535 Len=0
1,2.999377000000095,10.0.2.15,62.210.85.178,TLSv1.2,1204,Application Data
1,2.9994260000003123,62.210.85.178,10.0.2.15,TCP,60,9001  >  35978 [ACK] Seq=17118593 Ack=316330987 Win=65535 Len=0
1,2.999485000000277,10.0.2.15,62.210.85.178,TLSv1.2,4124,Application Data
1,2.999528000000282,62.210.85.178,10.0.2.15,TCP,60,9001  >  35978 [ACK] Seq=17118593 Ack=316332447 Win=65535 Len=0
1,2.9995370000006005,62.210.85.178,10.0.2.15,TCP,60,9001  >  35978 [ACK] Seq=17118593 Ack=316333907 Win=65535 Len=0
1,2.9995410000001357,62.210.85.178,10.0.2.15,TCP,60,9001  >  35978 [ACK] Seq=17118593 Ack=316335057 Win=65535 Len=0
1,2.9995810000000347,10.0.2.15,62.210.85.178,TLSv1.2,4124,Application Data
1,2.999619000000166,62.210.85.178,10.0.2.15,TCP,60,9001  >  35978 [ACK] Seq=17118593 Ack=316336517 Win=65535 Len=0
1,2.999627000000146,62.210.85.178,10.0.2.15,TCP,60,9001  >  35978 [ACK] Seq=17118593 Ack=316337977 Win=65535 Len=0
1,2.999672000000828,62.210.85.178,10.0.2.15,TCP,60,9001  >  35978 [ACK] Seq=17118593 Ack=316339127 Win=65535 Len=0
1,2.999706000000515,10.0.2.15,62.210.85.178,TLSv1.2,332,Application Data
1,2.999743000000308,62.210.85.178,10.0.2.15,TCP,60,9001  >  35978 [ACK] Seq=17118593 Ack=316339405 Win=65535 Len=0
1,2.9997990000001664,10.0.2.15,62.210.85.178,TLSv1.2,3868,Application Data
1,2.999840000000404,62.210.85.178,10.0.2.15,TCP,60,9001  >  35978 [ACK] Seq=17118593 Ack=316340865 Win=65535 Len=0
1,2.9998480000003838,62.210.85.178,10.0.2.15,TCP,60,9001  >  35978 [ACK] Seq=17118593 Ack=316342325 Win=65535 Len=0
1,2.99985100000049,62.210.85.178,10.0.2.15,TCP,60,9001  >  35978 [ACK] Seq=17118593 Ack=316343219 Win=65535 Len=0
1,2.9998900000000503,10.0.2.15,62.210.85.178,TLSv1.2,4124,Application Data
1,2.999928000000182,62.210.85.178,10.0.2.15,TCP,60,9001  >  35978 [ACK] Seq=17118593 Ack=316344679 Win=65535 Len=0
1,2.9999360000001616,62.210.85.178,10.0.2.15,TCP,60,9001  >  35978 [ACK] Seq=17118593 Ack=316346139 Win=65535 Len=0
1,2.9999410000000353,62.210.85.178,10.0.2.15,TCP,60,9001  >  35978 [ACK] Seq=17118593 Ack=316347289 Win=65535 Len=0
1,2.9999870000001465,10.0.2.15,62.210.85.178,TLSv1.2,3030,Application Data
1,3.0000270000000455,62.210.85.178,10.0.2.15,TCP,60,9001  >  35978 [ACK] Seq=17118593 Ack=316348749 Win=65535 Len=0
1,3.0000350000000253,62.210.85.178,10.0.2.15,TCP,60,9001  >  35978 [ACK] Seq=17118593 Ack=316350209 Win=65535 Len=0
1,3.0000380000001314,62.210.85.178,10.0.2.15,TCP,60,9001  >  35978 [ACK] Seq=17118593 Ack=316350265 Win=65535 Len=0
1,3.00926200000049,10.0.2.15,62.210.85.178,TLSv1.2,4124,Application Data
1,3.0093140000008134,62.210.85.178,10.0.2.15,TCP,60,9001  >  35978 [ACK] Seq=17118593 Ack=316351725 Win=65535 Len=0
1,3.0093250000008993,62.210.85.178,10.0.2.15,TCP,60,9001  >  35978 [ACK] Seq=17118593 Ack=316353185 Win=65535 Len=0
1,3.009330000000773,62.210.85.178,10.0.2.15,TCP,60,9001  >  35978 [ACK] Seq=17118593 Ack=316354335 Win=65535 Len=0
1,3.0093760000008842,10.0.2.15,62.210.85.178,TLSv1.2,4124,Application Data
1,3.0094170000002123,62.210.85.178,10.0.2.15,TCP,60,9001  >  35978 [ACK] Seq=17118593 Ack=316355795 Win=65535 Len=0
1,3.009425000000192,62.210.85.178,10.0.2.15,TCP,60,9001  >  35978 [ACK] Seq=17118593 Ack=316357255 Win=65535 Len=0
1,3.0094300000000658,62.210.85.178,10.0.2.15,TCP,60,9001  >  35978 [ACK] Seq=17118593 Ack=316358405 Win=65535 Len=0
1,3.0094700000008743,10.0.2.15,62.210.85.178,TLSv1.2,4124,Application Data
1,3.009508000000096,62.210.85.178,10.0.2.15,TCP,60,9001  >  35978 [ACK] Seq=17118593 Ack=316359865 Win=65535 Len=0
1,3.0095170000004146,62.210.85.178,10.0.2.15,TCP,60,9001  >  35978 [ACK] Seq=17118593 Ack=316361325 Win=65535 Len=0
1,3.0095220000002882,62.210.85.178,10.0.2.15,TCP,60,9001  >  35978 [ACK] Seq=17118593 Ack=316362475 Win=65535 Len=0
1,3.009559000000081,10.0.2.15,62.210.85.178,TLSv1.2,4124,Application Data
1,3.0095960000007835,62.210.85.178,10.0.2.15,TCP,60,9001  >  35978 [ACK] Seq=17118593 Ack=316363935 Win=65535 Len=0
1,3.0096050000001924,62.210.85.178,10.0.2.15,TCP,60,9001  >  35978 [ACK] Seq=17118593 Ack=316365395 Win=65535 Len=0
1,3.009609000000637,62.210.85.178,10.0.2.15,TCP,60,9001  >  35978 [ACK] Seq=17118593 Ack=316366545 Win=65535 Len=0
1,3.0096450000000914,10.0.2.15,62.210.85.178,TLSv1.2,332,Application Data
1,3.0096810000004552,62.210.85.178,10.0.2.15,TCP,60,9001  >  35978 [ACK] Seq=17118593 Ack=316366823 Win=65535 Len=0
1,3.00973200000044,10.0.2.15,62.210.85.178,TLSv1.2,3160,Application Data
1,3.0097710000000006,62.210.85.178,10.0.2.15,TCP,60,9001  >  35978 [ACK] Seq=17118593 Ack=316368283 Win=65535 Len=0
1,3.00977900000089,62.210.85.178,10.0.2.15,TCP,60,9001  >  35978 [ACK] Seq=17118593 Ack=316369743 Win=65535 Len=0
1,3.009783000000425,62.210.85.178,10.0.2.15,TCP,60,9001  >  35978 [ACK] Seq=17118593 Ack=316369929 Win=65535 Len=0
1,3.0985600000003615,54.93.77.70,10.0.2.15,TCP,2950,"9001  >  34692 [PSH, ACK] Seq=315979185 Ack=17166787 Win=65535 Len=2896 [TCP segment of a reassembled PDU]"
1,3.0986830000001646,10.0.2.15,54.93.77.70,TCP,54,34692  >  9001 [ACK] Seq=17166787 Ack=315982081 Win=65535 Len=0
1,3.0989400000007663,54.93.77.70,10.0.2.15,TLSv1.2,778,Application Data
1,3.09910200000013,10.0.2.15,54.93.77.70,TLSv1.2,590,Application Data
1,3.0991790000007313,54.93.77.70,10.0.2.15,TCP,60,9001  >  34692 [ACK] Seq=315982805 Ack=17167323 Win=65535 Len=0
1,3.1121280000006664,54.93.77.70,10.0.2.15,TCP,2950,"9001  >  34692 [PSH, ACK] Seq=315982805 Ack=17167323 Win=65535 Len=2896 [TCP segment of a reassembled PDU]"
1,3.112216000000444,10.0.2.15,54.93.77.70,TCP,54,34692  >  9001 [ACK] Seq=17167323 Ack=315985701 Win=65535 Len=0
1,3.116834000000381,54.93.77.70,10.0.2.15,TLSv1.2,778,Application Data
1,3.12093300000015,54.93.77.70,10.0.2.15,TCP,2950,"9001  >  34692 [PSH, ACK] Seq=315986425 Ack=17167323 Win=65535 Len=2896 [TCP segment of a reassembled PDU]"
1,3.120975000000726,10.0.2.15,54.93.77.70,TCP,54,34692  >  9001 [ACK] Seq=17167323 Ack=315989321 Win=65535 Len=0
1,3.1296830000001137,54.93.77.70,10.0.2.15,TLSv1.2,2950,Application Data [TCP segment of a reassembled PDU]
1,3.1296980000006442,54.93.77.70,10.0.2.15,TCP,1502,"9001  >  34692 [PSH, ACK] Seq=315992217 Ack=17167323 Win=65535 Len=1448 [TCP segment of a reassembled PDU]"
1,3.1297440000007555,10.0.2.15,54.93.77.70,TCP,54,34692  >  9001 [ACK] Seq=17167323 Ack=315992217 Win=65535 Len=0
1,3.129826000000321,10.0.2.15,54.93.77.70,TCP,54,34692  >  9001 [ACK] Seq=17167323 Ack=315993665 Win=65535 Len=0
1,3.1408190000001923,54.93.77.70,10.0.2.15,TLSv1.2,1104,"Application Data, Application Data"
1,3.162373000000116,54.93.77.70,10.0.2.15,TLSv1.2,590,Application Data
1,3.1624460000002728,10.0.2.15,54.93.77.70,TCP,54,34692  >  9001 [ACK] Seq=17167323 Ack=315995251 Win=65535 Len=0
1,3.2192110000005414,54.93.77.70,10.0.2.15,TCP,2950,"9001  >  34692 [PSH, ACK] Seq=315995251 Ack=17167323 Win=65535 Len=2896 [TCP segment of a reassembled PDU]"
1,3.2193110000007437,54.93.77.70,10.0.2.15,TLSv1.2,1502,Application Data [TCP segment of a reassembled PDU]
1,3.2193480000005366,10.0.2.15,54.93.77.70,TCP,54,34692  >  9001 [ACK] Seq=17167323 Ack=315998147 Win=65535 Len=0
1,3.2193960000004154,10.0.2.15,54.93.77.70,TCP,54,34692  >  9001 [ACK] Seq=17167323 Ack=315999595 Win=65535 Len=0
1,3.2233180000002903,54.93.77.70,10.0.2.15,TLSv1.2,380,Application Data
1,3.2285860000001776,54.93.77.70,10.0.2.15,TCP,2950,"9001  >  34692 [PSH, ACK] Seq=315999921 Ack=17167323 Win=65535 Len=2896 [TCP segment of a reassembled PDU]"
1,3.228627000000415,10.0.2.15,54.93.77.70,TCP,54,34692  >  9001 [ACK] Seq=17167323 Ack=316002817 Win=65535 Len=0
1,3.2388700000001336,54.93.77.70,10.0.2.15,TLSv1.2,2950,Application Data [TCP segment of a reassembled PDU]
1,3.2389670000002297,10.0.2.15,54.93.77.70,TCP,54,34692  >  9001 [ACK] Seq=17167323 Ack=316005713 Win=65535 Len=0
1,3.2390260000001945,54.93.77.70,10.0.2.15,TLSv1.2,4398,Application Data [TCP segment of a reassembled PDU]
1,3.2391110000007757,10.0.2.15,54.93.77.70,TCP,54,34692  >  9001 [ACK] Seq=17167323 Ack=316010057 Win=65535 Len=0
1,3.2393580000007205,10.0.2.15,54.93.77.70,TLSv1.2,590,Application Data
1,3.2394350000004124,54.93.77.70,10.0.2.15,TCP,60,9001  >  34692 [ACK] Seq=316010057 Ack=17167859 Win=65535 Len=0
1,3.242659000000458,54.93.77.70,10.0.2.15,TLSv1.2,264,Application Data
1,3.2510180000008404,54.93.77.70,10.0.2.15,TLSv1.2,7294,Application Data
1,3.251068000000487,10.0.2.15,54.93.77.70,TCP,54,34692  >  9001 [ACK] Seq=17167859 Ack=316017507 Win=65535 Len=0
1,3.2591100000008737,62.210.85.178,10.0.2.15,TLSv1.2,590,Application Data
1,3.262533000000076,54.93.77.70,10.0.2.15,TLSv1.2,2950,"Application Data, Application Data"
1,3.262582000000293,10.0.2.15,54.93.77.70,TCP,54,34692  >  9001 [ACK] Seq=17167859 Ack=316020403 Win=65535 Len=0
1,3.2633160000004864,54.93.77.70,10.0.2.15,TLSv1.2,6498,"Application Data, Application Data, Application Data"
1,3.263380000000325,10.0.2.15,54.93.77.70,TCP,54,34692  >  9001 [ACK] Seq=17167859 Ack=316026847 Win=65535 Len=0
1,3.265874000000622,10.0.2.15,54.93.77.70,TLSv1.2,590,Application Data
1,3.2660530000002836,54.93.77.70,10.0.2.15,TCP,60,9001  >  34692 [ACK] Seq=316026847 Ack=17168395 Win=65535 Len=0
1,3.302008999999998,10.0.2.15,62.210.85.178,TCP,54,35978  >  9001 [ACK] Seq=316369929 Ack=17119129 Win=65535 Len=0
1,3.3617250000006607,62.210.85.178,10.0.2.15,TLSv1.2,590,Application Data
1,3.3618020000003526,10.0.2.15,62.210.85.178,TCP,54,35978  >  9001 [ACK] Seq=316369929 Ack=17119665 Win=65535 Len=0
1,3.4987590000000637,62.210.85.178,10.0.2.15,TLSv1.2,590,Application Data
1,3.498845000000074,10.0.2.15,62.210.85.178,TCP,54,35978  >  9001 [ACK] Seq=316369929 Ack=17120201 Win=65535 Len=0
1,3.4993050000002768,10.0.2.15,62.210.85.178,TLSv1.2,590,Application Data
1,3.499405000000479,62.210.85.178,10.0.2.15,TCP,60,9001  >  35978 [ACK] Seq=17120201 Ack=316370465 Win=65535 Len=0
1,3.623087000000851,54.93.77.70,10.0.2.15,TLSv1.2,590,Application Data
1,3.62346400000024,10.0.2.15,54.93.77.70,TLSv1.2,590,Application Data
1,3.623561000000336,54.93.77.70,10.0.2.15,TCP,60,9001  >  34692 [ACK] Seq=316027383 Ack=17168931 Win=65535 Len=0
1,3.722530000000006,62.210.85.178,10.0.2.15,TLSv1.2,590,Application Data
1,3.726269000000684,10.0.2.15,62.210.85.178,TLSv1.2,590,Application Data
1,3.7264180000001943,62.210.85.178,10.0.2.15,TCP,60,9001  >  35978 [ACK] Seq=17120737 Ack=316371001 Win=65535 Len=0
1,3.7388210000008257,10.0.2.15,62.210.85.178,TLSv1.2,4124,Application Data
1,3.7389340000008815,10.0.2.15,62.210.85.178,TCP,2974,35978  >  9001 [ACK] Seq=316375071 Ack=17120737 Win=65535 Len=2920 [TCP segment of a reassembled PDU]
1,3.7389850000008664,62.210.85.178,10.0.2.15,TCP,60,9001  >  35978 [ACK] Seq=17120737 Ack=316372461 Win=65535 Len=0
1,3.73899800000072,62.210.85.178,10.0.2.15,TCP,60,9001  >  35978 [ACK] Seq=17120737 Ack=316373921 Win=65535 Len=0
1,3.7390030000005936,62.210.85.178,10.0.2.15,TCP,60,9001  >  35978 [ACK] Seq=17120737 Ack=316375071 Win=65535 Len=0
1,3.7390460000005987,10.0.2.15,62.210.85.178,TLSv1.2,1204,Application Data
1,3.7390870000008363,62.210.85.178,10.0.2.15,TCP,60,9001  >  35978 [ACK] Seq=17120737 Ack=316376531 Win=65535 Len=0
1,3.739095000000816,62.210.85.178,10.0.2.15,TCP,60,9001  >  35978 [ACK] Seq=17120737 Ack=316377991 Win=65535 Len=0
1,3.7390990000003512,62.210.85.178,10.0.2.15,TCP,60,9001  >  35978 [ACK] Seq=17120737 Ack=316379141 Win=65535 Len=0
1,3.7391400000005888,10.0.2.15,62.210.85.178,TLSv1.2,4124,Application Data
1,3.7391790000001492,62.210.85.178,10.0.2.15,TCP,60,9001  >  35978 [ACK] Seq=17120737 Ack=316380601 Win=65535 Len=0
1,3.7391880000004676,62.210.85.178,10.0.2.15,TCP,60,9001  >  35978 [ACK] Seq=17120737 Ack=316382061 Win=65535 Len=0
1,3.7391920000000027,62.210.85.178,10.0.2.15,TCP,60,9001  >  35978 [ACK] Seq=17120737 Ack=316383211 Win=65535 Len=0
1,3.7392310000004727,10.0.2.15,62.210.85.178,TLSv1.2,4124,Application Data
1,3.739269000000604,62.210.85.178,10.0.2.15,TCP,60,9001  >  35978 [ACK] Seq=17120737 Ack=316384671 Win=65535 Len=0
1,3.739278000000013,62.210.85.178,10.0.2.15,TCP,60,9001  >  35978 [ACK] Seq=17120737 Ack=316386131 Win=65535 Len=0
1,3.7393380000003162,10.0.2.15,62.210.85.178,TLSv1.2,2974,Application Data
1,3.739379000000554,62.210.85.178,10.0.2.15,TCP,60,9001  >  35978 [ACK] Seq=17120737 Ack=316387281 Win=65535 Len=0
1,3.739386000000195,62.210.85.178,10.0.2.15,TCP,60,9001  >  35978 [ACK] Seq=17120737 Ack=316388741 Win=65535 Len=0
1,3.739389000000301,62.210.85.178,10.0.2.15,TCP,60,9001  >  35978 [ACK] Seq=17120737 Ack=316390201 Win=65535 Len=0
1,3.739417000000685,10.0.2.15,62.210.85.178,TLSv1.2,1226,Application Data
1,3.7394530000001396,62.210.85.178,10.0.2.15,TCP,60,9001  >  35978 [ACK] Seq=17120737 Ack=316391373 Win=65535 Len=0
1,3.7394960000001447,10.0.2.15,62.210.85.178,TLSv1.2,4124,Application Data
1,3.7395350000006147,62.210.85.178,10.0.2.15,TCP,60,9001  >  35978 [ACK] Seq=17120737 Ack=316392833 Win=65535 Len=0
1,3.7395430000005945,62.210.85.178,10.0.2.15,TCP,60,9001  >  35978 [ACK] Seq=17120737 Ack=316394293 Win=65535 Len=0
1,3.7395460000007006,62.210.85.178,10.0.2.15,TCP,60,9001  >  35978 [ACK] Seq=17120737 Ack=316395443 Win=65535 Len=0
1,3.7395830000004935,10.0.2.15,62.210.85.178,TLSv1.2,2002,Application Data
1,3.739621000000625,62.210.85.178,10.0.2.15,TCP,60,9001  >  35978 [ACK] Seq=17120737 Ack=316396903 Win=65535 Len=0
1,3.739628000000266,62.210.85.178,10.0.2.15,TCP,60,9001  >  35978 [ACK] Seq=17120737 Ack=316397391 Win=65535 Len=0
1,3.857816000000639,54.93.77.70,10.0.2.15,TCP,2950,"9001  >  34692 [PSH, ACK] Seq=316027383 Ack=17168931 Win=65535 Len=2896 [TCP segment of a reassembled PDU]"
1,3.85793300000023,10.0.2.15,54.93.77.70,TCP,54,34692  >  9001 [ACK] Seq=17168931 Ack=316030279 Win=65535 Len=0
1,3.8582490000007965,54.93.77.70,10.0.2.15,TLSv1.2,778,Application Data
1,3.866714000000684,54.93.77.70,10.0.2.15,TCP,2950,"9001  >  34692 [PSH, ACK] Seq=316031003 Ack=17168931 Win=65535 Len=2896 [TCP segment of a reassembled PDU]"
1,3.86678000000029,10.0.2.15,54.93.77.70,TCP,54,34692  >  9001 [ACK] Seq=17168931 Ack=316033899 Win=65535 Len=0
1,3.8668300000008458,54.93.77.70,10.0.2.15,TLSv1.2,1502,Application Data [TCP segment of a reassembled PDU]
1,3.866885000000366,10.0.2.15,54.93.77.70,TCP,54,34692  >  9001 [ACK] Seq=17168931 Ack=316035347 Win=65535 Len=0
1,3.8670680000004722,54.93.77.70,10.0.2.15,TCP,2950,"9001  >  34692 [PSH, ACK] Seq=316035347 Ack=17168931 Win=65535 Len=2896 [TCP segment of a reassembled PDU]"
1,3.867105000000265,10.0.2.15,54.93.77.70,TCP,54,34692  >  9001 [ACK] Seq=17168931 Ack=316038243 Win=65535 Len=0
1,3.8836550000005445,54.93.77.70,10.0.2.15,TLSv1.2,568,Application Data
1,3.8838250000007974,10.0.2.15,54.93.77.70,TLSv1.2,590,Application Data
1,3.8839050000005955,54.93.77.70,10.0.2.15,TCP,60,9001  >  34692 [ACK] Seq=316038757 Ack=17169467 Win=65535 Len=0
1,3.8878300000005765,54.93.77.70,10.0.2.15,TCP,2950,"9001  >  34692 [PSH, ACK] Seq=316038757 Ack=17169467 Win=65535 Len=2896 [TCP segment of a reassembled PDU]"
1,3.8878960000001825,10.0.2.15,54.93.77.70,TCP,54,34692  >  9001 [ACK] Seq=17169467 Ack=316041653 Win=65535 Len=0
1,3.8981080000003203,54.93.77.70,10.0.2.15,TLSv1.2,5846,"Application Data, Application Data"
