No.,Time,Source,Destination,Protocol,Length,Info
1,0.007781999999679101,10.0.2.15,54.93.77.70,TCP,54,34692  >  9001 [ACK] Seq=17811671 Ack=326914585 Win=65535 Len=0
1,0.14042400000016642,10.0.2.15,54.93.77.70,TLSv1.2,590,Application Data
1,0.14061399999991409,54.93.77.70,10.0.2.15,TCP,60,9001  >  34692 [ACK] Seq=326914585 Ack=17812207 Win=65535 Len=0
1,0.3226539999996021,62.210.85.178,10.0.2.15,TLSv1.2,590,Application Data
1,0.32296899999983,10.0.2.15,62.210.85.178,TLSv1.2,590,Application Data
1,0.3230869999997594,62.210.85.178,10.0.2.15,TCP,60,9001  >  35978 [ACK] Seq=17757723 Ack=327251643 Win=65535 Len=0
1,0.43397599999934755,54.93.77.70,10.0.2.15,TLSv1.2,590,Application Data
1,0.43406599999980244,10.0.2.15,54.93.77.70,TCP,54,34692  >  9001 [ACK] Seq=17812207 Ack=326915121 Win=65535 Len=0
1,0.4345020000000659,10.0.2.15,54.93.77.70,TLSv1.2,1618,Application Data
1,0.43460999999933847,54.93.77.70,10.0.2.15,TCP,60,9001  >  34692 [ACK] Seq=326915121 Ack=17813667 Win=65535 Len=0
1,0.43462300000010146,54.93.77.70,10.0.2.15,TCP,60,9001  >  34692 [ACK] Seq=326915121 Ack=17813771 Win=65535 Len=0
1,0.5230149999997593,62.210.85.178,10.0.2.15,TLSv1.2,1618,Application Data
1,0.5231329999996888,10.0.2.15,62.210.85.178,TCP,54,35978  >  9001 [ACK] Seq=327251643 Ack=17759287 Win=65535 Len=0
1,0.5367409999998927,10.0.2.15,62.210.85.178,TLSv1.2,590,Application Data
1,0.5369339999997464,62.210.85.178,10.0.2.15,TCP,60,9001  >  35978 [ACK] Seq=17759287 Ack=327252179 Win=65535 Len=0
1,0.5486829999999827,10.0.2.15,62.210.85.178,TLSv1.2,1618,Application Data
1,0.5488319999994928,62.210.85.178,10.0.2.15,TCP,60,9001  >  35978 [ACK] Seq=17759287 Ack=327253639 Win=65535 Len=0
1,0.548848999999791,62.210.85.178,10.0.2.15,TCP,60,9001  >  35978 [ACK] Seq=17759287 Ack=327253743 Win=65535 Len=0
1,0.6305279999996856,54.93.77.70,10.0.2.15,TLSv1.2,590,Application Data
1,0.661920999999893,54.93.77.70,10.0.2.15,TLSv1.2,1618,Application Data
1,0.661975999999413,10.0.2.15,54.93.77.70,TCP,54,34692  >  9001 [ACK] Seq=17813771 Ack=326917221 Win=65535 Len=0
1,0.6640099999995073,10.0.2.15,54.93.77.70,TLSv1.2,590,Application Data
1,0.6641559999998208,54.93.77.70,10.0.2.15,TCP,60,9001  >  34692 [ACK] Seq=326917221 Ack=17814307 Win=65535 Len=0
1,0.8210060000001249,62.210.85.178,10.0.2.15,TLSv1.2,590,Application Data
1,0.8213179999993372,10.0.2.15,62.210.85.178,TLSv1.2,590,Application Data
1,0.8214760000000751,62.210.85.178,10.0.2.15,TCP,60,9001  >  35978 [ACK] Seq=17759823 Ack=327254279 Win=65535 Len=0
1,0.9287500000000364,54.93.77.70,10.0.2.15,TLSv1.2,590,Application Data
1,0.929204000000027,10.0.2.15,54.93.77.70,TLSv1.2,590,Application Data
1,0.9293419999994512,54.93.77.70,10.0.2.15,TCP,60,9001  >  34692 [ACK] Seq=326917757 Ack=17814843 Win=65535 Len=0
1,1.129439999999704,62.210.85.178,10.0.2.15,TLSv1.2,590,Application Data
1,1.1331460000001243,10.0.2.15,62.210.85.178,TLSv1.2,590,Application Data
1,1.13332199999968,62.210.85.178,10.0.2.15,TCP,60,9001  >  35978 [ACK] Seq=17760359 Ack=327254815 Win=65535 Len=0
1,1.144123000000036,10.0.2.15,62.210.85.178,TLSv1.2,4124,Application Data
1,1.1442200000001321,10.0.2.15,62.210.85.178,TCP,2974,35978  >  9001 [ACK] Seq=327258885 Ack=17760359 Win=65535 Len=2920 [TCP segment of a reassembled PDU]
1,1.1442609999994602,62.210.85.178,10.0.2.15,TCP,60,9001  >  35978 [ACK] Seq=17760359 Ack=327256275 Win=65535 Len=0
1,1.1442729999998846,62.210.85.178,10.0.2.15,TCP,60,9001  >  35978 [ACK] Seq=17760359 Ack=327257735 Win=65535 Len=0
1,1.1442769999994198,62.210.85.178,10.0.2.15,TCP,60,9001  >  35978 [ACK] Seq=17760359 Ack=327258885 Win=65535 Len=0
1,1.144279999999526,62.210.85.178,10.0.2.15,TCP,60,9001  >  35978 [ACK] Seq=17760359 Ack=327260345 Win=65535 Len=0
1,1.1442819999992935,62.210.85.178,10.0.2.15,TCP,60,9001  >  35978 [ACK] Seq=17760359 Ack=327261805 Win=65535 Len=0
1,1.1443159999998898,10.0.2.15,62.210.85.178,TLSv1.2,1204,Application Data
1,1.1443549999994502,62.210.85.178,10.0.2.15,TCP,60,9001  >  35978 [ACK] Seq=17760359 Ack=327262955 Win=65535 Len=0
1,1.1443979999994554,10.0.2.15,62.210.85.178,TLSv1.2,4124,Application Data
1,1.1444329999994807,62.210.85.178,10.0.2.15,TCP,60,9001  >  35978 [ACK] Seq=17760359 Ack=327264415 Win=65535 Len=0
1,1.1444409999994605,62.210.85.178,10.0.2.15,TCP,60,9001  >  35978 [ACK] Seq=17760359 Ack=327265875 Win=65535 Len=0
1,1.1444439999995666,62.210.85.178,10.0.2.15,TCP,60,9001  >  35978 [ACK] Seq=17760359 Ack=327267025 Win=65535 Len=0
1,1.144481999999698,10.0.2.15,62.210.85.178,TLSv1.2,4124,Application Data
1,1.1445149999999558,62.210.85.178,10.0.2.15,TCP,60,9001  >  35978 [ACK] Seq=17760359 Ack=327268485 Win=65535 Len=0
1,1.1445229999999356,62.210.85.178,10.0.2.15,TCP,60,9001  >  35978 [ACK] Seq=17760359 Ack=327269945 Win=65535 Len=0
1,1.1445770000000266,10.0.2.15,62.210.85.178,TLSv1.2,2974,Application Data
1,1.1446139999998195,62.210.85.178,10.0.2.15,TCP,60,9001  >  35978 [ACK] Seq=17760359 Ack=327271095 Win=65535 Len=0
1,1.1446219999997993,62.210.85.178,10.0.2.15,TCP,60,9001  >  35978 [ACK] Seq=17760359 Ack=327272555 Win=65535 Len=0
1,1.1446249999999054,62.210.85.178,10.0.2.15,TCP,60,9001  >  35978 [ACK] Seq=17760359 Ack=327274015 Win=65535 Len=0
1,1.144651999999951,10.0.2.15,62.210.85.178,TLSv1.2,1226,Application Data
1,1.1446849999992992,62.210.85.178,10.0.2.15,TCP,60,9001  >  35978 [ACK] Seq=17760359 Ack=327275187 Win=65535 Len=0
1,1.1447229999994306,10.0.2.15,62.210.85.178,TLSv1.2,1938,Application Data
1,1.144760000000133,62.210.85.178,10.0.2.15,TCP,60,9001  >  35978 [ACK] Seq=17760359 Ack=327276647 Win=65535 Len=0
1,1.1447659999994357,62.210.85.178,10.0.2.15,TCP,60,9001  >  35978 [ACK] Seq=17760359 Ack=327277071 Win=65535 Len=0
1,1.2399689999992916,54.93.77.70,10.0.2.15,TLSv1.2,3674,Application Data
1,1.2401049999998577,10.0.2.15,54.93.77.70,TCP,54,34692  >  9001 [ACK] Seq=17814843 Ack=326921377 Win=65535 Len=0
1,1.2691059999997378,54.93.77.70,10.0.2.15,TLSv1.2,4934,"Application Data, Application Data"
1,1.2691989999993893,10.0.2.15,54.93.77.70,TCP,54,34692  >  9001 [ACK] Seq=17814843 Ack=326926257 Win=65535 Len=0
1,1.2692849999993996,54.93.77.70,10.0.2.15,TCP,2950,"9001  >  34692 [PSH, ACK] Seq=326926257 Ack=17814843 Win=65535 Len=2896 [TCP segment of a reassembled PDU]"
1,1.2693589999998949,10.0.2.15,54.93.77.70,TCP,54,34692  >  9001 [ACK] Seq=17814843 Ack=326929153 Win=65535 Len=0
1,1.269547999999304,10.0.2.15,54.93.77.70,TLSv1.2,590,Application Data
1,1.2696589999995922,54.93.77.70,10.0.2.15,TCP,60,9001  >  34692 [ACK] Seq=326929153 Ack=17815379 Win=65535 Len=0
1,1.2978509999993548,54.93.77.70,10.0.2.15,TLSv1.2,1104,"Application Data, Application Data"
1,1.339708999999857,10.0.2.15,54.93.77.70,TCP,54,34692  >  9001 [ACK] Seq=17815379 Ack=326930203 Win=65535 Len=0
1,1.3744790000000648,54.93.77.70,10.0.2.15,TLSv1.2,7294,"Application Data, Application Data"
1,1.3745389999994586,10.0.2.15,54.93.77.70,TCP,54,34692  >  9001 [ACK] Seq=17815379 Ack=326937443 Win=65535 Len=0
1,1.3844060000001264,62.210.85.178,10.0.2.15,TLSv1.2,590,Application Data
1,1.3983220000000074,54.93.77.70,10.0.2.15,TLSv1.2,590,Application Data
1,1.3983829999997397,10.0.2.15,54.93.77.70,TCP,54,34692  >  9001 [ACK] Seq=17815379 Ack=326937979 Win=65535 Len=0
1,1.4087730000001102,54.93.77.70,10.0.2.15,TCP,1502,"9001  >  34692 [PSH, ACK] Seq=326937979 Ack=17815379 Win=65535 Len=1448 [TCP segment of a reassembled PDU]"
1,1.408861999999317,10.0.2.15,54.93.77.70,TCP,54,34692  >  9001 [ACK] Seq=17815379 Ack=326939427 Win=65535 Len=0
1,1.417330999999649,54.93.77.70,10.0.2.15,TLSv1.2,1198,Application Data
1,1.4173940000000584,10.0.2.15,54.93.77.70,TCP,54,34692  >  9001 [ACK] Seq=17815379 Ack=326940571 Win=65535 Len=0
1,1.4197189999995317,10.0.2.15,54.93.77.70,TLSv1.2,590,Application Data
1,1.4199099999996179,54.93.77.70,10.0.2.15,TCP,60,9001  >  34692 [ACK] Seq=326940571 Ack=17815915 Win=65535 Len=0
1,1.4277160000001459,10.0.2.15,62.210.85.178,TCP,54,35978  >  9001 [ACK] Seq=327277071 Ack=17760895 Win=65535 Len=0
1,1.5249329999996917,62.210.85.178,10.0.2.15,TLSv1.2,590,Application Data
1,1.5250120000000607,10.0.2.15,62.210.85.178,TCP,54,35978  >  9001 [ACK] Seq=327277071 Ack=17761431 Win=65535 Len=0
1,1.5255389999992985,10.0.2.15,62.210.85.178,TLSv1.2,590,Application Data
1,1.5256639999997788,62.210.85.178,10.0.2.15,TCP,60,9001  >  35978 [ACK] Seq=17761431 Ack=327277607 Win=65535 Len=0
1,1.643366999999671,54.93.77.70,10.0.2.15,TLSv1.2,590,Application Data
1,1.6438019999995959,10.0.2.15,54.93.77.70,TLSv1.2,590,Application Data
1,1.6439339999997173,54.93.77.70,10.0.2.15,TCP,60,9001  >  34692 [ACK] Seq=326941107 Ack=17816451 Win=65535 Len=0
1,1.8453309999995327,62.210.85.178,10.0.2.15,TLSv1.2,590,Application Data
1,1.854512999999315,10.0.2.15,62.210.85.178,TLSv1.2,590,Application Data
1,1.8548110000001543,62.210.85.178,10.0.2.15,TCP,60,9001  >  35978 [ACK] Seq=17761967 Ack=327278143 Win=65535 Len=0
1,1.8686199999992823,10.0.2.15,62.210.85.178,TLSv1.2,4124,Application Data
1,1.8687270000000353,10.0.2.15,62.210.85.178,TCP,2974,35978  >  9001 [ACK] Seq=327282213 Ack=17761967 Win=65535 Len=2920 [TCP segment of a reassembled PDU]
1,1.8687739999995756,62.210.85.178,10.0.2.15,TCP,60,9001  >  35978 [ACK] Seq=17761967 Ack=327279603 Win=65535 Len=0
1,1.868783999999323,62.210.85.178,10.0.2.15,TCP,60,9001  >  35978 [ACK] Seq=17761967 Ack=327281063 Win=65535 Len=0
1,1.8687890000001062,62.210.85.178,10.0.2.15,TCP,60,9001  >  35978 [ACK] Seq=17761967 Ack=327282213 Win=65535 Len=0
1,1.8687929999996413,62.210.85.178,10.0.2.15,TCP,60,9001  >  35978 [ACK] Seq=17761967 Ack=327283673 Win=65535 Len=0
1,1.868797999999515,62.210.85.178,10.0.2.15,TCP,60,9001  >  35978 [ACK] Seq=17761967 Ack=327285133 Win=65535 Len=0
1,1.868840000000091,10.0.2.15,62.210.85.178,TLSv1.2,1204,Application Data
1,1.8689079999994647,10.0.2.15,62.210.85.178,TCP,2974,35978  >  9001 [ACK] Seq=327286283 Ack=17761967 Win=65535 Len=2920 [TCP segment of a reassembled PDU]
1,1.8689479999993637,62.210.85.178,10.0.2.15,TCP,60,9001  >  35978 [ACK] Seq=17761967 Ack=327286283 Win=65535 Len=0
1,1.8689549999999144,62.210.85.178,10.0.2.15,TCP,60,9001  >  35978 [ACK] Seq=17761967 Ack=327287743 Win=65535 Len=0
1,1.8689589999994496,62.210.85.178,10.0.2.15,TCP,60,9001  >  35978 [ACK] Seq=17761967 Ack=327289203 Win=65535 Len=0
1,1.8689930000000459,10.0.2.15,62.210.85.178,TLSv1.2,1204,Application Data
1,1.8690579999993133,10.0.2.15,62.210.85.178,TCP,2974,35978  >  9001 [ACK] Seq=327290353 Ack=17761967 Win=65535 Len=2920 [TCP segment of a reassembled PDU]
1,1.8690939999996772,62.210.85.178,10.0.2.15,TCP,60,9001  >  35978 [ACK] Seq=17761967 Ack=327290353 Win=65535 Len=0
1,1.8691009999993184,62.210.85.178,10.0.2.15,TCP,60,9001  >  35978 [ACK] Seq=17761967 Ack=327291813 Win=65535 Len=0
1,1.8691060000001016,62.210.85.178,10.0.2.15,TCP,60,9001  >  35978 [ACK] Seq=17761967 Ack=327293273 Win=65535 Len=0
1,1.8691369999996823,10.0.2.15,62.210.85.178,TLSv1.2,1204,Application Data
1,1.8692149999997127,10.0.2.15,62.210.85.178,TLSv1.2,2974,Application Data
1,1.8692529999998442,62.210.85.178,10.0.2.15,TCP,60,9001  >  35978 [ACK] Seq=17761967 Ack=327294423 Win=65535 Len=0
1,1.8692599999994854,62.210.85.178,10.0.2.15,TCP,60,9001  >  35978 [ACK] Seq=17761967 Ack=327295883 Win=65535 Len=0
1,1.8692649999993591,62.210.85.178,10.0.2.15,TCP,60,9001  >  35978 [ACK] Seq=17761967 Ack=327297343 Win=65535 Len=0
1,1.8692959999998493,10.0.2.15,62.210.85.178,TLSv1.2,1226,Application Data
1,1.8693579999999201,10.0.2.15,62.210.85.178,TCP,2974,35978  >  9001 [ACK] Seq=327298515 Ack=17761967 Win=65535 Len=2920 [TCP segment of a reassembled PDU]
1,1.8693939999993745,62.210.85.178,10.0.2.15,TCP,60,9001  >  35978 [ACK] Seq=17761967 Ack=327298515 Win=65535 Len=0
1,1.8693999999995867,62.210.85.178,10.0.2.15,TCP,60,9001  >  35978 [ACK] Seq=17761967 Ack=327299975 Win=65535 Len=0
1,1.8694049999994604,62.210.85.178,10.0.2.15,TCP,60,9001  >  35978 [ACK] Seq=17761967 Ack=327301435 Win=65535 Len=0
1,1.8694359999999506,10.0.2.15,62.210.85.178,TLSv1.2,1204,Application Data
1,1.8694729999997435,62.210.85.178,10.0.2.15,TCP,60,9001  >  35978 [ACK] Seq=17761967 Ack=327302585 Win=65535 Len=0
1,1.8695159999997486,10.0.2.15,62.210.85.178,TLSv1.2,3030,Application Data
1,1.8695569999999861,62.210.85.178,10.0.2.15,TCP,60,9001  >  35978 [ACK] Seq=17761967 Ack=327304045 Win=65535 Len=0
1,1.8695639999996274,62.210.85.178,10.0.2.15,TCP,60,9001  >  35978 [ACK] Seq=17761967 Ack=327305505 Win=65535 Len=0
1,1.869568999999501,62.210.85.178,10.0.2.15,TCP,60,9001  >  35978 [ACK] Seq=17761967 Ack=327305561 Win=65535 Len=0
1,1.8787969999993948,10.0.2.15,62.210.85.178,TLSv1.2,4124,Application Data
1,1.8788749999994252,10.0.2.15,62.210.85.178,TCP,2974,35978  >  9001 [ACK] Seq=327309631 Ack=17761967 Win=65535 Len=2920 [TCP segment of a reassembled PDU]
1,1.8789120000001276,62.210.85.178,10.0.2.15,TCP,60,9001  >  35978 [ACK] Seq=17761967 Ack=327307021 Win=65535 Len=0
1,1.8789200000001074,62.210.85.178,10.0.2.15,TCP,60,9001  >  35978 [ACK] Seq=17761967 Ack=327308481 Win=65535 Len=0
1,1.878924999999981,62.210.85.178,10.0.2.15,TCP,60,9001  >  35978 [ACK] Seq=17761967 Ack=327309631 Win=65535 Len=0
1,1.8789289999995162,62.210.85.178,10.0.2.15,TCP,60,9001  >  35978 [ACK] Seq=17761967 Ack=327311091 Win=65535 Len=0
1,1.87893399999939,62.210.85.178,10.0.2.15,TCP,60,9001  >  35978 [ACK] Seq=17761967 Ack=327312551 Win=65535 Len=0
1,1.87897299999986,10.0.2.15,62.210.85.178,TLSv1.2,1204,Application Data
1,1.8790389999994659,10.0.2.15,62.210.85.178,TCP,2974,35978  >  9001 [ACK] Seq=327313701 Ack=17761967 Win=65535 Len=2920 [TCP segment of a reassembled PDU]
1,1.8790749999998297,62.210.85.178,10.0.2.15,TCP,60,9001  >  35978 [ACK] Seq=17761967 Ack=327313701 Win=65535 Len=0
1,1.879081000000042,62.210.85.178,10.0.2.15,TCP,60,9001  >  35978 [ACK] Seq=17761967 Ack=327315161 Win=65535 Len=0
1,1.8790859999999157,62.210.85.178,10.0.2.15,TCP,60,9001  >  35978 [ACK] Seq=17761967 Ack=327316621 Win=65535 Len=0
1,1.8791199999996024,10.0.2.15,62.210.85.178,TLSv1.2,1204,Application Data
1,1.879186999999547,10.0.2.15,62.210.85.178,TCP,2974,35978  >  9001 [ACK] Seq=327317771 Ack=17761967 Win=65535 Len=2920 [TCP segment of a reassembled PDU]
1,1.8792239999993399,62.210.85.178,10.0.2.15,TCP,60,9001  >  35978 [ACK] Seq=17761967 Ack=327317771 Win=65535 Len=0
1,1.879229999999552,62.210.85.178,10.0.2.15,TCP,60,9001  >  35978 [ACK] Seq=17761967 Ack=327319231 Win=65535 Len=0
1,1.8792349999994258,62.210.85.178,10.0.2.15,TCP,60,9001  >  35978 [ACK] Seq=17761967 Ack=327320691 Win=65535 Len=0
1,1.879265999999916,10.0.2.15,62.210.85.178,TLSv1.2,1204,Application Data
1,1.8793409999998403,10.0.2.15,62.210.85.178,TLSv1.2,2974,Application Data
1,1.8793809999997393,62.210.85.178,10.0.2.15,TCP,60,9001  >  35978 [ACK] Seq=17761967 Ack=327321841 Win=65535 Len=0
1,1.8793879999993806,62.210.85.178,10.0.2.15,TCP,60,9001  >  35978 [ACK] Seq=17761967 Ack=327323301 Win=65535 Len=0
1,1.8793919999998252,62.210.85.178,10.0.2.15,TCP,60,9001  >  35978 [ACK] Seq=17761967 Ack=327324761 Win=65535 Len=0
1,1.8794239999997444,10.0.2.15,62.210.85.178,TLSv1.2,1226,Application Data
1,1.8794609999995373,62.210.85.178,10.0.2.15,TCP,60,9001  >  35978 [ACK] Seq=17761967 Ack=327325933 Win=65535 Len=0
1,1.879504999999881,10.0.2.15,62.210.85.178,TLSv1.2,4124,Application Data
1,1.8795469999995476,62.210.85.178,10.0.2.15,TCP,60,9001  >  35978 [ACK] Seq=17761967 Ack=327327393 Win=65535 Len=0
1,1.8795529999997598,62.210.85.178,10.0.2.15,TCP,60,9001  >  35978 [ACK] Seq=17761967 Ack=327328853 Win=65535 Len=0
1,1.8795579999996335,62.210.85.178,10.0.2.15,TCP,60,9001  >  35978 [ACK] Seq=17761967 Ack=327330003 Win=65535 Len=0
1,1.8796029999994062,10.0.2.15,62.210.85.178,TLSv1.2,3030,Application Data
1,1.8796629999997094,62.210.85.178,10.0.2.15,TCP,60,9001  >  35978 [ACK] Seq=17761967 Ack=327331463 Win=65535 Len=0
1,1.8796750000001339,62.210.85.178,10.0.2.15,TCP,60,9001  >  35978 [ACK] Seq=17761967 Ack=327332923 Win=65535 Len=0
1,1.879678999999669,62.210.85.178,10.0.2.15,TCP,60,9001  >  35978 [ACK] Seq=17761967 Ack=327332979 Win=65535 Len=0
1,1.8921000000000276,10.0.2.15,62.210.85.178,TLSv1.2,4124,Application Data
1,1.892186999999467,10.0.2.15,62.210.85.178,TCP,2974,35978  >  9001 [ACK] Seq=327337049 Ack=17761967 Win=65535 Len=2920 [TCP segment of a reassembled PDU]
1,1.8922429999993255,62.210.85.178,10.0.2.15,TCP,60,9001  >  35978 [ACK] Seq=17761967 Ack=327334439 Win=65535 Len=0
1,1.89225499999975,62.210.85.178,10.0.2.15,TCP,60,9001  >  35978 [ACK] Seq=17761967 Ack=327335899 Win=65535 Len=0
1,1.8922599999996237,62.210.85.178,10.0.2.15,TCP,60,9001  >  35978 [ACK] Seq=17761967 Ack=327337049 Win=65535 Len=0
1,1.8922640000000683,62.210.85.178,10.0.2.15,TCP,60,9001  >  35978 [ACK] Seq=17761967 Ack=327338509 Win=65535 Len=0
1,1.8922679999996035,62.210.85.178,10.0.2.15,TCP,60,9001  >  35978 [ACK] Seq=17761967 Ack=327339969 Win=65535 Len=0
1,1.89230999999927,10.0.2.15,62.210.85.178,TLSv1.2,1204,Application Data
1,1.8923789999998917,10.0.2.15,62.210.85.178,TCP,1514,35978  >  9001 [ACK] Seq=327341119 Ack=17761967 Win=65535 Len=1460 [TCP segment of a reassembled PDU]
1,1.892414999999346,62.210.85.178,10.0.2.15,TCP,60,9001  >  35978 [ACK] Seq=17761967 Ack=327341119 Win=65535 Len=0
1,1.8924219999998968,62.210.85.178,10.0.2.15,TCP,60,9001  >  35978 [ACK] Seq=17761967 Ack=327342579 Win=65535 Len=0
1,1.8924559999995836,10.0.2.15,62.210.85.178,TLSv1.2,800,Application Data
1,1.8925629999994271,62.210.85.178,10.0.2.15,TCP,60,9001  >  35978 [ACK] Seq=17761967 Ack=327343325 Win=65535 Len=0
1,2.007709999999861,54.93.77.70,10.0.2.15,TLSv1.2,3674,Application Data
1,2.0078489999996236,10.0.2.15,54.93.77.70,TCP,54,34692  >  9001 [ACK] Seq=17816451 Ack=326944727 Win=65535 Len=0
1,2.0180810000001657,54.93.77.70,10.0.2.15,TLSv1.2,4398,Application Data
1,2.0181689999999435,10.0.2.15,54.93.77.70,TCP,54,34692  >  9001 [ACK] Seq=17816451 Ack=326949071 Win=65535 Len=0
1,2.018537999999353,54.93.77.70,10.0.2.15,TLSv1.2,5846,Application Data [TCP segment of a reassembled PDU]
1,2.0186109999995097,10.0.2.15,54.93.77.70,TCP,54,34692  >  9001 [ACK] Seq=17816451 Ack=326954863 Win=65535 Len=0
1,2.023736000000099,54.93.77.70,10.0.2.15,TLSv1.2,2950,Application Data [TCP segment of a reassembled PDU]
1,2.023784999999407,10.0.2.15,54.93.77.70,TCP,54,34692  >  9001 [ACK] Seq=17816451 Ack=326957759 Win=65535 Len=0
1,2.0241479999995136,54.93.77.70,10.0.2.15,TLSv1.2,3044,Application Data
1,2.0241980000000694,10.0.2.15,54.93.77.70,TCP,54,34692  >  9001 [ACK] Seq=17816451 Ack=326960749 Win=65535 Len=0
1,2.0287399999997433,54.93.77.70,10.0.2.15,TCP,1502,"9001  >  34692 [PSH, ACK] Seq=326960749 Ack=17816451 Win=65535 Len=1448 [TCP segment of a reassembled PDU]"
1,2.0287920000000668,10.0.2.15,54.93.77.70,TCP,54,34692  >  9001 [ACK] Seq=17816451 Ack=326962197 Win=65535 Len=0
1,2.0370100000000093,54.93.77.70,10.0.2.15,TLSv1.2,5846,Application Data [TCP segment of a reassembled PDU]
1,2.03708000000006,10.0.2.15,54.93.77.70,TCP,54,34692  >  9001 [ACK] Seq=17816451 Ack=326967989 Win=65535 Len=0
1,2.039918999999827,54.93.77.70,10.0.2.15,TLSv1.2,5846,"Application Data, Application Data"
1,2.0399369999995542,54.93.77.70,10.0.2.15,TLSv1.2,2950,Application Data [TCP segment of a reassembled PDU]
1,2.039976000000024,10.0.2.15,54.93.77.70,TCP,54,34692  >  9001 [ACK] Seq=17816451 Ack=326973781 Win=65535 Len=0
1,2.0400769999996555,10.0.2.15,54.93.77.70,TCP,54,34692  >  9001 [ACK] Seq=17816451 Ack=326976677 Win=65535 Len=0
1,2.040118999999322,54.93.77.70,10.0.2.15,TLSv1.2,170,Application Data
1,2.040248999999676,10.0.2.15,54.93.77.70,TLSv1.2,590,Application Data
1,2.0403189999997267,54.93.77.70,10.0.2.15,TCP,60,9001  >  34692 [ACK] Seq=326976793 Ack=17816987 Win=65535 Len=0
1,2.0501020000001517,54.93.77.70,10.0.2.15,TLSv1.2,5846,Application Data
1,2.050119999999879,54.93.77.70,10.0.2.15,TLSv1.2,5846,Application Data [TCP segment of a reassembled PDU]
1,2.0501649999996516,10.0.2.15,54.93.77.70,TCP,54,34692  >  9001 [ACK] Seq=17816987 Ack=326982585 Win=65535 Len=0
1,2.0502559999995356,10.0.2.15,54.93.77.70,TCP,54,34692  >  9001 [ACK] Seq=17816987 Ack=326988377 Win=65535 Len=0
1,2.0504320000000007,10.0.2.15,54.93.77.70,TLSv1.2,590,Application Data
1,2.0505370000000767,54.93.77.70,10.0.2.15,TCP,60,9001  >  34692 [ACK] Seq=326988377 Ack=17817523 Win=65535 Len=0
1,2.0563329999995403,54.93.77.70,10.0.2.15,TLSv1.2,358,Application Data
1,2.068891999999323,54.93.77.70,10.0.2.15,TLSv1.2,5846,Application Data
1,2.068944999999985,10.0.2.15,54.93.77.70,TCP,54,34692  >  9001 [ACK] Seq=17817523 Ack=326994473 Win=65535 Len=0
1,2.0694269999994503,54.93.77.70,10.0.2.15,TLSv1.2,4398,Application Data [TCP segment of a reassembled PDU]
1,2.0694739999999,10.0.2.15,54.93.77.70,TCP,54,34692  >  9001 [ACK] Seq=17817523 Ack=326998817 Win=65535 Len=0
1,2.069652000000133,10.0.2.15,54.93.77.70,TLSv1.2,590,Application Data
1,2.069727999999486,54.93.77.70,10.0.2.15,TCP,60,9001  >  34692 [ACK] Seq=326998817 Ack=17818059 Win=65535 Len=0
1,2.0711529999998675,54.93.77.70,10.0.2.15,TLSv1.2,5846,Application Data [TCP segment of a reassembled PDU]
1,2.0712210000001505,10.0.2.15,54.93.77.70,TCP,54,34692  >  9001 [ACK] Seq=17818059 Ack=327004609 Win=65535 Len=0
1,2.0836490000001504,54.93.77.70,10.0.2.15,TLSv1.2,1502,"Application Data, Application Data"
1,2.083697000000029,10.0.2.15,54.93.77.70,TCP,54,34692  >  9001 [ACK] Seq=17818059 Ack=327006057 Win=65535 Len=0
1,2.085320999999567,54.93.77.70,10.0.2.15,TLSv1.2,800,Application Data
1,2.0878679999996166,10.0.2.15,54.93.77.70,TLSv1.2,590,Application Data
1,2.088036000000102,54.93.77.70,10.0.2.15,TCP,60,9001  >  34692 [ACK] Seq=327006803 Ack=17818595 Win=65535 Len=0
1,2.1498949999995602,62.210.85.178,10.0.2.15,TLSv1.2,590,Application Data
1,2.1917219999995723,10.0.2.15,62.210.85.178,TCP,54,35978  >  9001 [ACK] Seq=327343325 Ack=17762503 Win=65535 Len=0
1,2.4606089999997494,62.210.85.178,10.0.2.15,TLSv1.2,590,Application Data
1,2.4606859999994413,10.0.2.15,62.210.85.178,TCP,54,35978  >  9001 [ACK] Seq=327343325 Ack=17763039 Win=65535 Len=0
1,2.479067999999643,62.210.85.178,10.0.2.15,TLSv1.2,1104,Application Data
1,2.4791150000000926,10.0.2.15,62.210.85.178,TCP,54,35978  >  9001 [ACK] Seq=327343325 Ack=17764089 Win=65535 Len=0
1,2.4793449999997392,10.0.2.15,62.210.85.178,TLSv1.2,590,Application Data
1,2.4794279999996434,62.210.85.178,10.0.2.15,TCP,60,9001  >  35978 [ACK] Seq=17764089 Ack=327343861 Win=65535 Len=0
1,2.664233999999851,54.93.77.70,10.0.2.15,TLSv1.2,590,Application Data
1,2.664683999999397,10.0.2.15,54.93.77.70,TLSv1.2,590,Application Data
1,2.664828999999372,54.93.77.70,10.0.2.15,TCP,60,9001  >  34692 [ACK] Seq=327007339 Ack=17819131 Win=65535 Len=0
1,3.3829939999995986,62.210.85.178,10.0.2.15,TLSv1.2,590,Application Data
1,3.388782999999421,10.0.2.15,62.210.85.178,TLSv1.2,590,Application Data
1,3.3889879999996992,62.210.85.178,10.0.2.15,TCP,60,9001  >  35978 [ACK] Seq=17764625 Ack=327344397 Win=65535 Len=0
1,3.4004109999996217,10.0.2.15,62.210.85.178,TLSv1.2,4124,Application Data
1,3.4005319999996573,10.0.2.15,62.210.85.178,TCP,2974,35978  >  9001 [ACK] Seq=327348467 Ack=17764625 Win=65535 Len=2920 [TCP segment of a reassembled PDU]
1,3.400579000000107,62.210.85.178,10.0.2.15,TCP,60,9001  >  35978 [ACK] Seq=17764625 Ack=327345857 Win=65535 Len=0
1,3.4005899999992835,62.210.85.178,10.0.2.15,TCP,60,9001  >  35978 [ACK] Seq=17764625 Ack=327347317 Win=65535 Len=0
1,3.4005950000000666,62.210.85.178,10.0.2.15,TCP,60,9001  >  35978 [ACK] Seq=17764625 Ack=327348467 Win=65535 Len=0
1,3.4005999999999403,62.210.85.178,10.0.2.15,TCP,60,9001  >  35978 [ACK] Seq=17764625 Ack=327349927 Win=65535 Len=0
1,3.4006039999994755,62.210.85.178,10.0.2.15,TCP,60,9001  >  35978 [ACK] Seq=17764625 Ack=327351387 Win=65535 Len=0
1,3.400647999999819,10.0.2.15,62.210.85.178,TLSv1.2,1204,Application Data
1,3.4006890000000567,62.210.85.178,10.0.2.15,TCP,60,9001  >  35978 [ACK] Seq=17764625 Ack=327352537 Win=65535 Len=0
1,3.4007489999994505,10.0.2.15,62.210.85.178,TLSv1.2,4124,Application Data
1,3.400789999999688,62.210.85.178,10.0.2.15,TCP,60,9001  >  35978 [ACK] Seq=17764625 Ack=327353997 Win=65535 Len=0
1,3.4007969999993293,62.210.85.178,10.0.2.15,TCP,60,9001  >  35978 [ACK] Seq=17764625 Ack=327355457 Win=65535 Len=0
1,3.400800999999774,62.210.85.178,10.0.2.15,TCP,60,9001  >  35978 [ACK] Seq=17764625 Ack=327356607 Win=65535 Len=0
1,3.400847999999314,10.0.2.15,62.210.85.178,TLSv1.2,4124,Application Data
1,3.4008889999995517,62.210.85.178,10.0.2.15,TCP,60,9001  >  35978 [ACK] Seq=17764625 Ack=327358067 Win=65535 Len=0
1,3.400894999999764,62.210.85.178,10.0.2.15,TCP,60,9001  >  35978 [ACK] Seq=17764625 Ack=327359527 Win=65535 Len=0
1,3.400956999999835,10.0.2.15,62.210.85.178,TLSv1.2,2974,Application Data
1,3.400996999999734,62.210.85.178,10.0.2.15,TCP,60,9001  >  35978 [ACK] Seq=17764625 Ack=327360677 Win=65535 Len=0
1,3.4010309999994206,10.0.2.15,62.210.85.178,TLSv1.2,1226,Application Data
1,3.401068999999552,62.210.85.178,10.0.2.15,TCP,60,9001  >  35978 [ACK] Seq=17764625 Ack=327362137 Win=65535 Len=0
1,3.4010749999997643,62.210.85.178,10.0.2.15,TCP,60,9001  >  35978 [ACK] Seq=17764625 Ack=327363597 Win=65535 Len=0
1,3.4011209999998755,10.0.2.15,62.210.85.178,TCP,2974,35978  >  9001 [ACK] Seq=327364769 Ack=17764625 Win=65535 Len=2920 [TCP segment of a reassembled PDU]
1,3.401165999999648,62.210.85.178,10.0.2.15,TCP,60,9001  >  35978 [ACK] Seq=17764625 Ack=327364769 Win=65535 Len=0
1,3.4011729999992895,62.210.85.178,10.0.2.15,TCP,60,9001  >  35978 [ACK] Seq=17764625 Ack=327366229 Win=65535 Len=0
1,3.401205999999547,10.0.2.15,62.210.85.178,TLSv1.2,1204,Application Data
1,3.40124299999934,62.210.85.178,10.0.2.15,TCP,60,9001  >  35978 [ACK] Seq=17764625 Ack=327367689 Win=65535 Len=0
1,3.4012489999995523,62.210.85.178,10.0.2.15,TCP,60,9001  >  35978 [ACK] Seq=17764625 Ack=327368839 Win=65535 Len=0
1,3.401293999999325,10.0.2.15,62.210.85.178,TLSv1.2,3030,Application Data
1,3.401335999999901,62.210.85.178,10.0.2.15,TCP,60,9001  >  35978 [ACK] Seq=17764625 Ack=327370299 Win=65535 Len=0
1,3.4013420000001133,62.210.85.178,10.0.2.15,TCP,60,9001  >  35978 [ACK] Seq=17764625 Ack=327371759 Win=65535 Len=0
1,3.401346999999987,62.210.85.178,10.0.2.15,TCP,60,9001  >  35978 [ACK] Seq=17764625 Ack=327371815 Win=65535 Len=0
1,3.4117969999997513,10.0.2.15,62.210.85.178,TLSv1.2,2132,Application Data
1,3.4119149999996807,62.210.85.178,10.0.2.15,TCP,60,9001  >  35978 [ACK] Seq=17764625 Ack=327373275 Win=65535 Len=0
1,3.411927000000105,62.210.85.178,10.0.2.15,TCP,60,9001  >  35978 [ACK] Seq=17764625 Ack=327373893 Win=65535 Len=0
1,3.511364999999387,54.93.77.70,10.0.2.15,TLSv1.2,590,Application Data
1,3.5373389999995197,54.93.77.70,10.0.2.15,TCP,2950,"9001  >  34692 [PSH, ACK] Seq=327007875 Ack=17819131 Win=65535 Len=2896 [TCP segment of a reassembled PDU]"
1,3.5374400000000605,10.0.2.15,54.93.77.70,TCP,54,34692  >  9001 [ACK] Seq=17819131 Ack=327010771 Win=65535 Len=0
1,3.5455809999994017,54.93.77.70,10.0.2.15,TLSv1.2,4398,Application Data [TCP segment of a reassembled PDU]
1,3.545626000000084,10.0.2.15,54.93.77.70,TCP,54,34692  >  9001 [ACK] Seq=17819131 Ack=327015115 Win=65535 Len=0
1,3.5580569999992804,54.93.77.70,10.0.2.15,TLSv1.2,590,"Application Data, Application Data"
1,3.5790470000001733,54.93.77.70,10.0.2.15,TCP,2950,"9001  >  34692 [PSH, ACK] Seq=327015651 Ack=17819131 Win=65535 Len=2896 [TCP segment of a reassembled PDU]"
1,3.5791019999996934,10.0.2.15,54.93.77.70,TCP,54,34692  >  9001 [ACK] Seq=17819131 Ack=327018547 Win=65535 Len=0
1,3.595436999999947,54.93.77.70,10.0.2.15,TLSv1.2,1314,"Application Data, Application Data"
1,3.6357179999995424,10.0.2.15,54.93.77.70,TCP,54,34692  >  9001 [ACK] Seq=17819131 Ack=327019807 Win=65535 Len=0
1,3.997469999999339,54.93.77.70,10.0.2.15,TCP,2950,"9001  >  34692 [PSH, ACK] Seq=327019807 Ack=17819131 Win=65535 Len=2896 [TCP segment of a reassembled PDU]"
1,3.9975610000001325,10.0.2.15,54.93.77.70,TCP,54,34692  >  9001 [ACK] Seq=17819131 Ack=327022703 Win=65535 Len=0
1,4.0009009999994305,54.93.77.70,10.0.2.15,TLSv1.2,778,Application Data
1,4.000959999999395,10.0.2.15,54.93.77.70,TCP,54,34692  >  9001 [ACK] Seq=17819131 Ack=327023427 Win=65535 Len=0
1,4.001808999999412,54.93.77.70,10.0.2.15,TCP,2950,"9001  >  34692 [PSH, ACK] Seq=327023427 Ack=17819131 Win=65535 Len=2896 [TCP segment of a reassembled PDU]"
1,4.0018279999994775,54.93.77.70,10.0.2.15,TLSv1.2,7294,"Application Data, Application Data, Application Data"
1,4.0018679999993765,10.0.2.15,54.93.77.70,TCP,54,34692  >  9001 [ACK] Seq=17819131 Ack=327026323 Win=65535 Len=0
1,4.001905999999508,10.0.2.15,54.93.77.70,TCP,54,34692  >  9001 [ACK] Seq=17819131 Ack=327033563 Win=65535 Len=0
1,4.00213900000017,10.0.2.15,54.93.77.70,TLSv1.2,590,Application Data
1,4.0022259999996095,54.93.77.70,10.0.2.15,TCP,60,9001  >  34692 [ACK] Seq=327033563 Ack=17819667 Win=65535 Len=0
1,4.005812999999762,54.93.77.70,10.0.2.15,TCP,1502,"9001  >  34692 [PSH, ACK] Seq=327033563 Ack=17819667 Win=65535 Len=1448 [TCP segment of a reassembled PDU]"
1,4.0058570000001055,10.0.2.15,54.93.77.70,TCP,54,34692  >  9001 [ACK] Seq=17819667 Ack=327035011 Win=65535 Len=0
1,4.0171479999999065,54.93.77.70,10.0.2.15,TLSv1.2,1502,Application Data [TCP segment of a reassembled PDU]
1,4.017224000000169,10.0.2.15,54.93.77.70,TCP,54,34692  >  9001 [ACK] Seq=17819667 Ack=327036459 Win=65535 Len=0
1,4.0174409999999625,10.0.2.15,54.93.77.70,TLSv1.2,590,Application Data
1,4.017530999999508,54.93.77.70,10.0.2.15,TCP,60,9001  >  34692 [ACK] Seq=327036459 Ack=17820203 Win=65535 Len=0
1,4.01849299999958,54.93.77.70,10.0.2.15,TLSv1.2,1010,Application Data
1,4.029160999999476,10.0.2.15,54.93.77.70,TLSv1.2,590,Application Data
1,4.029321999999411,54.93.77.70,10.0.2.15,TCP,60,9001  >  34692 [ACK] Seq=327037415 Ack=17820739 Win=65535 Len=0
1,4.611214999999902,62.210.85.178,10.0.2.15,TLSv1.2,590,Application Data
1,4.651713999999629,10.0.2.15,62.210.85.178,TCP,54,35978  >  9001 [ACK] Seq=327373893 Ack=17765161 Win=65535 Len=0
1,4.669930000000022,62.210.85.178,10.0.2.15,TLSv1.2,1104,Application Data
1,4.669984999999542,10.0.2.15,62.210.85.178,TCP,54,35978  >  9001 [ACK] Seq=327373893 Ack=17766211 Win=65535 Len=0
1,4.670474999999897,10.0.2.15,62.210.85.178,TLSv1.2,590,Application Data
1,4.670570999999654,62.210.85.178,10.0.2.15,TCP,60,9001  >  35978 [ACK] Seq=17766211 Ack=327374429 Win=65535 Len=0
1,4.917770000000019,54.93.77.70,10.0.2.15,TLSv1.2,590,Application Data
1,4.918179999999666,10.0.2.15,54.93.77.70,TLSv1.2,590,Application Data
1,4.918286999999509,54.93.77.70,10.0.2.15,TCP,60,9001  >  34692 [ACK] Seq=327037951 Ack=17821275 Win=65535 Len=0
1,5.122777999999926,62.210.85.178,10.0.2.15,TLSv1.2,590,Application Data
1,5.12630099999933,10.0.2.15,62.210.85.178,TLSv1.2,590,Application Data
1,5.126462000000174,62.210.85.178,10.0.2.15,TCP,60,9001  >  35978 [ACK] Seq=17766747 Ack=327374965 Win=65535 Len=0
1,5.136163000000124,10.0.2.15,62.210.85.178,TLSv1.2,4124,Application Data
1,5.136585999999625,62.210.85.178,10.0.2.15,TCP,60,9001  >  35978 [ACK] Seq=17766747 Ack=327376425 Win=65535 Len=0
1,5.1366079999997964,62.210.85.178,10.0.2.15,TCP,60,9001  >  35978 [ACK] Seq=17766747 Ack=327377885 Win=65535 Len=0
1,5.136611999999332,62.210.85.178,10.0.2.15,TCP,60,9001  >  35978 [ACK] Seq=17766747 Ack=327379035 Win=65535 Len=0
1,5.13669899999968,10.0.2.15,62.210.85.178,TLSv1.2,4124,Application Data
1,5.136762999999519,62.210.85.178,10.0.2.15,TCP,60,9001  >  35978 [ACK] Seq=17766747 Ack=327380495 Win=65535 Len=0
1,5.136827999999696,10.0.2.15,62.210.85.178,TCP,2974,35978  >  9001 [ACK] Seq=327383105 Ack=17766747 Win=65535 Len=2920 [TCP segment of a reassembled PDU]
1,5.136868999999933,62.210.85.178,10.0.2.15,TCP,60,9001  >  35978 [ACK] Seq=17766747 Ack=327381955 Win=65535 Len=0
1,5.136885999999322,62.210.85.178,10.0.2.15,TCP,60,9001  >  35978 [ACK] Seq=17766747 Ack=327383105 Win=65535 Len=0
1,5.136889999999767,62.210.85.178,10.0.2.15,TCP,60,9001  >  35978 [ACK] Seq=17766747 Ack=327384565 Win=65535 Len=0
1,5.136891999999534,62.210.85.178,10.0.2.15,TCP,60,9001  >  35978 [ACK] Seq=17766747 Ack=327386025 Win=65535 Len=0
1,5.1369269999995595,10.0.2.15,62.210.85.178,TLSv1.2,1204,Application Data
1,5.136967999999797,62.210.85.178,10.0.2.15,TCP,60,9001  >  35978 [ACK] Seq=17766747 Ack=327387175 Win=65535 Len=0
1,5.137010999999802,10.0.2.15,62.210.85.178,TLSv1.2,2838,Application Data
1,5.1370459999998275,62.210.85.178,10.0.2.15,TCP,60,9001  >  35978 [ACK] Seq=17766747 Ack=327388635 Win=65535 Len=0
1,5.137053999999807,62.210.85.178,10.0.2.15,TCP,60,9001  >  35978 [ACK] Seq=17766747 Ack=327389959 Win=65535 Len=0
1,5.839242999999442,54.93.77.70,10.0.2.15,TLSv1.2,590,Application Data
1,5.843732999999702,54.93.77.70,10.0.2.15,TLSv1.2,6570,Application Data
1,5.843767999999727,54.93.77.70,10.0.2.15,TLSv1.2,5846,"Application Data, Application Data, Application Data"
1,5.8438429999996515,10.0.2.15,54.93.77.70,TCP,54,34692  >  9001 [ACK] Seq=17821275 Ack=327050795 Win=65535 Len=0
1,5.86114599999928,54.93.77.70,10.0.2.15,TLSv1.2,2784,"Application Data, Application Data"
1,5.8611919999993916,10.0.2.15,54.93.77.70,TCP,54,34692  >  9001 [ACK] Seq=17821275 Ack=327053525 Win=65535 Len=0
1,5.863640999999916,10.0.2.15,54.93.77.70,TLSv1.2,590,Application Data
1,5.86380999999983,54.93.77.70,10.0.2.15,TCP,60,9001  >  34692 [ACK] Seq=327053525 Ack=17821811 Win=65535 Len=0
1,6.043691999999282,62.210.85.178,10.0.2.15,TLSv1.2,590,Application Data
1,6.044018999999935,10.0.2.15,62.210.85.178,TLSv1.2,590,Application Data
1,6.044113999999354,62.210.85.178,10.0.2.15,TCP,60,9001  >  35978 [ACK] Seq=17767283 Ack=327390495 Win=65535 Len=0
1,6.250422000000071,54.93.77.70,10.0.2.15,TLSv1.2,590,Application Data
1,6.250812999999653,10.0.2.15,54.93.77.70,TLSv1.2,590,Application Data
1,6.250922000000173,54.93.77.70,10.0.2.15,TCP,60,9001  >  34692 [ACK] Seq=327054061 Ack=17822347 Win=65535 Len=0
1,6.762807000000066,62.210.85.178,10.0.2.15,TLSv1.2,590,Application Data
1,6.767323000000033,10.0.2.15,62.210.85.178,TLSv1.2,590,Application Data
1,6.767503999999462,62.210.85.178,10.0.2.15,TCP,60,9001  >  35978 [ACK] Seq=17767819 Ack=327391031 Win=65535 Len=0
1,6.777704000000085,10.0.2.15,62.210.85.178,TLSv1.2,4124,Application Data
1,6.77783399999953,62.210.85.178,10.0.2.15,TCP,60,9001  >  35978 [ACK] Seq=17767819 Ack=327392491 Win=65535 Len=0
1,6.777852000000166,62.210.85.178,10.0.2.15,TCP,60,9001  >  35978 [ACK] Seq=17767819 Ack=327393951 Win=65535 Len=0
1,6.777854999999363,62.210.85.178,10.0.2.15,TCP,60,9001  >  35978 [ACK] Seq=17767819 Ack=327395101 Win=65535 Len=0
1,6.777886999999282,10.0.2.15,62.210.85.178,TCP,2974,35978  >  9001 [ACK] Seq=327395101 Ack=17767819 Win=65535 Len=2920 [TCP segment of a reassembled PDU]
1,6.777962999999545,10.0.2.15,62.210.85.178,TLSv1.2,1204,Application Data
1,6.777982999999949,62.210.85.178,10.0.2.15,TCP,60,9001  >  35978 [ACK] Seq=17767819 Ack=327396561 Win=65535 Len=0
1,6.7779890000001615,62.210.85.178,10.0.2.15,TCP,60,9001  >  35978 [ACK] Seq=17767819 Ack=327398021 Win=65535 Len=0
1,6.777994000000035,62.210.85.178,10.0.2.15,TCP,60,9001  >  35978 [ACK] Seq=17767819 Ack=327399171 Win=65535 Len=0
1,6.778037999999469,10.0.2.15,62.210.85.178,TLSv1.2,4124,Application Data
1,6.778072999999495,62.210.85.178,10.0.2.15,TCP,60,9001  >  35978 [ACK] Seq=17767819 Ack=327400631 Win=65535 Len=0
1,6.778080000000045,62.210.85.178,10.0.2.15,TCP,60,9001  >  35978 [ACK] Seq=17767819 Ack=327402091 Win=65535 Len=0
1,6.7780830000001515,62.210.85.178,10.0.2.15,TCP,60,9001  >  35978 [ACK] Seq=17767819 Ack=327403241 Win=65535 Len=0
1,6.7781209999993735,10.0.2.15,62.210.85.178,TLSv1.2,4124,Application Data
1,6.77815499999997,62.210.85.178,10.0.2.15,TCP,60,9001  >  35978 [ACK] Seq=17767819 Ack=327404701 Win=65535 Len=0
1,6.7781609999992725,62.210.85.178,10.0.2.15,TCP,60,9001  >  35978 [ACK] Seq=17767819 Ack=327406161 Win=65535 Len=0
1,6.778217000000041,10.0.2.15,62.210.85.178,TLSv1.2,2974,Application Data
1,6.778252999999495,62.210.85.178,10.0.2.15,TCP,60,9001  >  35978 [ACK] Seq=17767819 Ack=327407311 Win=65535 Len=0
1,6.778260000000046,62.210.85.178,10.0.2.15,TCP,60,9001  >  35978 [ACK] Seq=17767819 Ack=327408771 Win=65535 Len=0
1,6.778263000000152,62.210.85.178,10.0.2.15,TCP,60,9001  >  35978 [ACK] Seq=17767819 Ack=327410231 Win=65535 Len=0
1,6.778289999999288,10.0.2.15,62.210.85.178,TLSv1.2,1226,Application Data
1,6.778322999999546,62.210.85.178,10.0.2.15,TCP,60,9001  >  35978 [ACK] Seq=17767819 Ack=327411403 Win=65535 Len=0
1,6.7783620000000155,10.0.2.15,62.210.85.178,TLSv1.2,4124,Application Data
1,6.778397000000041,62.210.85.178,10.0.2.15,TCP,60,9001  >  35978 [ACK] Seq=17767819 Ack=327412863 Win=65535 Len=0
1,6.778402999999344,62.210.85.178,10.0.2.15,TCP,60,9001  >  35978 [ACK] Seq=17767819 Ack=327414323 Win=65535 Len=0
1,6.77840599999945,62.210.85.178,10.0.2.15,TCP,60,9001  >  35978 [ACK] Seq=17767819 Ack=327415473 Win=65535 Len=0
1,6.778441999999814,10.0.2.15,62.210.85.178,TLSv1.2,3030,Application Data
1,6.7784759999995,62.210.85.178,10.0.2.15,TCP,60,9001  >  35978 [ACK] Seq=17767819 Ack=327416933 Win=65535 Len=0
1,6.778483000000051,62.210.85.178,10.0.2.15,TCP,60,9001  >  35978 [ACK] Seq=17767819 Ack=327418393 Win=65535 Len=0
1,6.778486000000157,62.210.85.178,10.0.2.15,TCP,60,9001  >  35978 [ACK] Seq=17767819 Ack=327418449 Win=65535 Len=0
1,6.787680999999793,10.0.2.15,62.210.85.178,TLSv1.2,4124,Application Data
1,6.787750999999844,62.210.85.178,10.0.2.15,TCP,60,9001  >  35978 [ACK] Seq=17767819 Ack=327419909 Win=65535 Len=0
1,6.787762999999359,62.210.85.178,10.0.2.15,TCP,60,9001  >  35978 [ACK] Seq=17767819 Ack=327421369 Win=65535 Len=0
1,6.787765999999465,62.210.85.178,10.0.2.15,TCP,60,9001  >  35978 [ACK] Seq=17767819 Ack=327422519 Win=65535 Len=0
1,6.787822999999662,10.0.2.15,62.210.85.178,TLSv1.2,4124,Application Data
1,6.7878869999995,62.210.85.178,10.0.2.15,TCP,60,9001  >  35978 [ACK] Seq=17767819 Ack=327423979 Win=65535 Len=0
1,6.787894000000051,62.210.85.178,10.0.2.15,TCP,60,9001  >  35978 [ACK] Seq=17767819 Ack=327425439 Win=65535 Len=0
1,6.787897000000157,62.210.85.178,10.0.2.15,TCP,60,9001  >  35978 [ACK] Seq=17767819 Ack=327426589 Win=65535 Len=0
1,6.787932999999612,10.0.2.15,62.210.85.178,TLSv1.2,4124,Application Data
1,6.787966999999298,62.210.85.178,10.0.2.15,TCP,60,9001  >  35978 [ACK] Seq=17767819 Ack=327428049 Win=65535 Len=0
1,6.787973999999849,62.210.85.178,10.0.2.15,TCP,60,9001  >  35978 [ACK] Seq=17767819 Ack=327429509 Win=65535 Len=0
1,6.787978999999723,62.210.85.178,10.0.2.15,TCP,60,9001  >  35978 [ACK] Seq=17767819 Ack=327430659 Win=65535 Len=0
1,6.788013999999748,10.0.2.15,62.210.85.178,TLSv1.2,3352,Application Data
1,6.788047999999435,62.210.85.178,10.0.2.15,TCP,60,9001  >  35978 [ACK] Seq=17767819 Ack=327432119 Win=65535 Len=0
1,6.788054999999986,62.210.85.178,10.0.2.15,TCP,60,9001  >  35978 [ACK] Seq=17767819 Ack=327433579 Win=65535 Len=0
1,6.788058999999521,62.210.85.178,10.0.2.15,TCP,60,9001  >  35978 [ACK] Seq=17767819 Ack=327433957 Win=65535 Len=0
1,6.922767999999451,54.93.77.70,10.0.2.15,TLSv1.2,590,Application Data
1,6.9532579999995505,54.93.77.70,10.0.2.15,TCP,2950,"9001  >  34692 [PSH, ACK] Seq=327054597 Ack=17822347 Win=65535 Len=2896 [TCP segment of a reassembled PDU]"
1,6.953317999999854,10.0.2.15,54.93.77.70,TCP,54,34692  >  9001 [ACK] Seq=17822347 Ack=327057493 Win=65535 Len=0
1,6.972584999999526,54.93.77.70,10.0.2.15,TLSv1.2,778,Application Data
1,7.015250999999807,54.93.77.70,10.0.2.15,TLSv1.2,7294,"Application Data, Application Data"
1,7.015343999999459,10.0.2.15,54.93.77.70,TCP,54,34692  >  9001 [ACK] Seq=17822347 Ack=327065457 Win=65535 Len=0
