No.,Time,Source,Destination,Protocol,Length,Info
1,0.021837000000232365,10.0.2.15,54.93.77.70,TCP,54,34692  >  9001 [ACK] Seq=18085487 Ack=331842583 Win=65535 Len=0
1,0.1121819999998479,62.210.85.178,10.0.2.15,TLSv1.2,1618,Application Data
1,0.11231000000043423,10.0.2.15,62.210.85.178,TCP,54,35978  >  9001 [ACK] Seq=332177433 Ack=18029323 Win=65535 Len=0
1,0.14695900000060647,10.0.2.15,54.93.77.70,TLSv1.2,590,Application Data
1,0.147171999999955,54.93.77.70,10.0.2.15,TCP,60,9001  >  34692 [ACK] Seq=331842583 Ack=18086023 Win=65535 Len=0
1,0.14740200000051118,62.210.85.178,10.0.2.15,TLSv1.2,590,Application Data
1,0.18940699999984645,10.0.2.15,62.210.85.178,TCP,54,35978  >  9001 [ACK] Seq=332177433 Ack=18029859 Win=65535 Len=0
1,0.2574690000001283,62.210.85.178,10.0.2.15,TLSv1.2,590,Application Data
1,0.25755000000026484,10.0.2.15,62.210.85.178,TCP,54,35978  >  9001 [ACK] Seq=332177433 Ack=18030395 Win=65535 Len=0
1,0.25802500000008877,10.0.2.15,62.210.85.178,TLSv1.2,590,Application Data
1,0.2581209999998464,62.210.85.178,10.0.2.15,TCP,60,9001  >  35978 [ACK] Seq=18030395 Ack=332177969 Win=65535 Len=0
1,0.3589460000002873,54.93.77.70,10.0.2.15,TLSv1.2,590,Application Data
1,0.35901600000033795,10.0.2.15,54.93.77.70,TCP,54,34692  >  9001 [ACK] Seq=18086023 Ack=331843119 Win=65535 Len=0
1,0.3593989999999394,10.0.2.15,54.93.77.70,TLSv1.2,1618,Application Data
1,0.3595050000003539,54.93.77.70,10.0.2.15,TCP,60,9001  >  34692 [ACK] Seq=331843119 Ack=18087483 Win=65535 Len=0
1,0.35951699999986886,54.93.77.70,10.0.2.15,TCP,60,9001  >  34692 [ACK] Seq=331843119 Ack=18087587 Win=65535 Len=0
1,0.7274800000004689,62.210.85.178,10.0.2.15,TLSv1.2,1618,Application Data
1,0.7276019999999335,10.0.2.15,62.210.85.178,TCP,54,35978  >  9001 [ACK] Seq=332177969 Ack=18031959 Win=65535 Len=0
1,0.7409530000004452,10.0.2.15,62.210.85.178,TLSv1.2,590,Application Data
1,0.7411290000000008,62.210.85.178,10.0.2.15,TCP,60,9001  >  35978 [ACK] Seq=18031959 Ack=332178505 Win=65535 Len=0
1,0.7539999999999054,10.0.2.15,62.210.85.178,TLSv1.2,1618,Application Data
1,0.7541300000002593,62.210.85.178,10.0.2.15,TCP,60,9001  >  35978 [ACK] Seq=18031959 Ack=332179965 Win=65535 Len=0
1,0.7541470000005575,62.210.85.178,10.0.2.15,TCP,60,9001  >  35978 [ACK] Seq=18031959 Ack=332180069 Win=65535 Len=0
1,0.8277109999999084,54.93.77.70,10.0.2.15,TLSv1.2,590,Application Data
1,0.8624369999997725,54.93.77.70,10.0.2.15,TLSv1.2,1618,Application Data
1,0.8624959999997373,10.0.2.15,54.93.77.70,TCP,54,34692  >  9001 [ACK] Seq=18087587 Ack=331845219 Win=65535 Len=0
1,0.8644709999998668,10.0.2.15,54.93.77.70,TLSv1.2,590,Application Data
1,0.8646290000006047,54.93.77.70,10.0.2.15,TCP,60,9001  >  34692 [ACK] Seq=331845219 Ack=18088123 Win=65535 Len=0
1,0.9551870000004783,62.210.85.178,10.0.2.15,TLSv1.2,590,Application Data
1,0.9554800000005343,10.0.2.15,62.210.85.178,TLSv1.2,590,Application Data
1,0.9555669999999736,62.210.85.178,10.0.2.15,TCP,60,9001  >  35978 [ACK] Seq=18032495 Ack=332180605 Win=65535 Len=0
1,1.3431060000002617,54.93.77.70,10.0.2.15,TLSv1.2,590,Application Data
1,1.3435520000002725,10.0.2.15,54.93.77.70,TLSv1.2,590,Application Data
1,1.343699000000015,54.93.77.70,10.0.2.15,TCP,60,9001  >  34692 [ACK] Seq=331845755 Ack=18088659 Win=65535 Len=0
1,1.6489980000005744,62.210.85.178,10.0.2.15,TLSv1.2,590,Application Data
1,1.6576910000003409,10.0.2.15,62.210.85.178,TLSv1.2,590,Application Data
1,1.6578639999997904,62.210.85.178,10.0.2.15,TCP,60,9001  >  35978 [ACK] Seq=18033031 Ack=332181141 Win=65535 Len=0
1,1.6695239999999103,10.0.2.15,62.210.85.178,TLSv1.2,4124,Application Data
1,1.66963399999986,10.0.2.15,62.210.85.178,TCP,2974,35978  >  9001 [ACK] Seq=332185211 Ack=18033031 Win=65535 Len=2920 [TCP segment of a reassembled PDU]
1,1.6696920000003956,62.210.85.178,10.0.2.15,TCP,60,9001  >  35978 [ACK] Seq=18033031 Ack=332182601 Win=65535 Len=0
1,1.6697039999999106,62.210.85.178,10.0.2.15,TCP,60,9001  >  35978 [ACK] Seq=18033031 Ack=332184061 Win=65535 Len=0
1,1.6697089999997843,62.210.85.178,10.0.2.15,TCP,60,9001  >  35978 [ACK] Seq=18033031 Ack=332185211 Win=65535 Len=0
1,1.669713000000229,62.210.85.178,10.0.2.15,TCP,60,9001  >  35978 [ACK] Seq=18033031 Ack=332186671 Win=65535 Len=0
1,1.6697180000001026,62.210.85.178,10.0.2.15,TCP,60,9001  >  35978 [ACK] Seq=18033031 Ack=332188131 Win=65535 Len=0
1,1.6697610000001077,10.0.2.15,62.210.85.178,TLSv1.2,1204,Application Data
1,1.6698290000003908,10.0.2.15,62.210.85.178,TCP,2974,35978  >  9001 [ACK] Seq=332189281 Ack=18033031 Win=65535 Len=2920 [TCP segment of a reassembled PDU]
1,1.6698679999999513,62.210.85.178,10.0.2.15,TCP,60,9001  >  35978 [ACK] Seq=18033031 Ack=332189281 Win=65535 Len=0
1,1.669875000000502,62.210.85.178,10.0.2.15,TCP,60,9001  >  35978 [ACK] Seq=18033031 Ack=332190741 Win=65535 Len=0
1,1.6698800000003757,62.210.85.178,10.0.2.15,TCP,60,9001  >  35978 [ACK] Seq=18033031 Ack=332192201 Win=65535 Len=0
1,1.6699140000000625,10.0.2.15,62.210.85.178,TLSv1.2,1204,Application Data
1,1.6699790000002395,10.0.2.15,62.210.85.178,TCP,2974,35978  >  9001 [ACK] Seq=332193351 Ack=18033031 Win=65535 Len=2920 [TCP segment of a reassembled PDU]
1,1.6700140000002648,62.210.85.178,10.0.2.15,TCP,60,9001  >  35978 [ACK] Seq=18033031 Ack=332193351 Win=65535 Len=0
1,1.670020999999906,62.210.85.178,10.0.2.15,TCP,60,9001  >  35978 [ACK] Seq=18033031 Ack=332194811 Win=65535 Len=0
1,1.6700250000003507,62.210.85.178,10.0.2.15,TCP,60,9001  >  35978 [ACK] Seq=18033031 Ack=332196271 Win=65535 Len=0
1,1.6700559999999314,10.0.2.15,62.210.85.178,TLSv1.2,1204,Application Data
1,1.6701389999998355,10.0.2.15,62.210.85.178,TLSv1.2,2974,Application Data
1,1.670180000000073,62.210.85.178,10.0.2.15,TCP,60,9001  >  35978 [ACK] Seq=18033031 Ack=332197421 Win=65535 Len=0
1,1.6701870000006238,62.210.85.178,10.0.2.15,TCP,60,9001  >  35978 [ACK] Seq=18033031 Ack=332198881 Win=65535 Len=0
1,1.670191000000159,62.210.85.178,10.0.2.15,TCP,60,9001  >  35978 [ACK] Seq=18033031 Ack=332200341 Win=65535 Len=0
1,1.6702230000000782,10.0.2.15,62.210.85.178,TLSv1.2,1226,Application Data
1,1.670259999999871,62.210.85.178,10.0.2.15,TCP,60,9001  >  35978 [ACK] Seq=18033031 Ack=332201513 Win=65535 Len=0
1,1.6703050000005533,10.0.2.15,62.210.85.178,TLSv1.2,4124,Application Data
1,1.6703429999997752,62.210.85.178,10.0.2.15,TCP,60,9001  >  35978 [ACK] Seq=18033031 Ack=332202973 Win=65535 Len=0
1,1.670350000000326,62.210.85.178,10.0.2.15,TCP,60,9001  >  35978 [ACK] Seq=18033031 Ack=332204433 Win=65535 Len=0
1,1.6703539999998611,62.210.85.178,10.0.2.15,TCP,60,9001  >  35978 [ACK] Seq=18033031 Ack=332205583 Win=65535 Len=0
1,1.6703999999999724,10.0.2.15,62.210.85.178,TLSv1.2,3030,Application Data
1,1.6704420000005484,62.210.85.178,10.0.2.15,TCP,60,9001  >  35978 [ACK] Seq=18033031 Ack=332207043 Win=65535 Len=0
1,1.6704479999998512,62.210.85.178,10.0.2.15,TCP,60,9001  >  35978 [ACK] Seq=18033031 Ack=332208503 Win=65535 Len=0
1,1.6704520000002958,62.210.85.178,10.0.2.15,TCP,60,9001  >  35978 [ACK] Seq=18033031 Ack=332208559 Win=65535 Len=0
1,1.6818300000004456,10.0.2.15,62.210.85.178,TLSv1.2,4124,Application Data
1,1.681948000000375,10.0.2.15,62.210.85.178,TCP,2974,35978  >  9001 [ACK] Seq=332212629 Ack=18033031 Win=65535 Len=2920 [TCP segment of a reassembled PDU]
1,1.6819720000003144,62.210.85.178,10.0.2.15,TCP,60,9001  >  35978 [ACK] Seq=18033031 Ack=332210019 Win=65535 Len=0
1,1.6819820000000618,62.210.85.178,10.0.2.15,TCP,60,9001  >  35978 [ACK] Seq=18033031 Ack=332211479 Win=65535 Len=0
1,1.6819860000005065,62.210.85.178,10.0.2.15,TCP,60,9001  >  35978 [ACK] Seq=18033031 Ack=332212629 Win=65535 Len=0
1,1.682025000000067,10.0.2.15,62.210.85.178,TLSv1.2,1204,Application Data
1,1.6820619999998598,62.210.85.178,10.0.2.15,TCP,60,9001  >  35978 [ACK] Seq=18033031 Ack=332214089 Win=65535 Len=0
1,1.6820690000004106,62.210.85.178,10.0.2.15,TCP,60,9001  >  35978 [ACK] Seq=18033031 Ack=332215549 Win=65535 Len=0
1,1.6820729999999458,62.210.85.178,10.0.2.15,TCP,60,9001  >  35978 [ACK] Seq=18033031 Ack=332216699 Win=65535 Len=0
1,1.6821200000003955,10.0.2.15,62.210.85.178,TLSv1.2,4124,Application Data
1,1.6821860000000015,10.0.2.15,62.210.85.178,TCP,2974,35978  >  9001 [ACK] Seq=332220769 Ack=18033031 Win=65535 Len=2920 [TCP segment of a reassembled PDU]
1,1.6822220000003654,62.210.85.178,10.0.2.15,TCP,60,9001  >  35978 [ACK] Seq=18033031 Ack=332218159 Win=65535 Len=0
1,1.6822290000000066,62.210.85.178,10.0.2.15,TCP,60,9001  >  35978 [ACK] Seq=18033031 Ack=332219619 Win=65535 Len=0
1,1.6822330000004513,62.210.85.178,10.0.2.15,TCP,60,9001  >  35978 [ACK] Seq=18033031 Ack=332220769 Win=65535 Len=0
1,1.682238000000325,62.210.85.178,10.0.2.15,TCP,60,9001  >  35978 [ACK] Seq=18033031 Ack=332222229 Win=65535 Len=0
1,1.6822419999998601,62.210.85.178,10.0.2.15,TCP,60,9001  >  35978 [ACK] Seq=18033031 Ack=332223689 Win=65535 Len=0
1,1.6822790000005625,10.0.2.15,62.210.85.178,TLSv1.2,1204,Application Data
1,1.682369000000108,62.210.85.178,10.0.2.15,TCP,60,9001  >  35978 [ACK] Seq=18033031 Ack=332224839 Win=65535 Len=0
1,1.6824040000001332,10.0.2.15,62.210.85.178,TLSv1.2,2974,Application Data
1,1.6824569999998857,10.0.2.15,62.210.85.178,TLSv1.2,1226,Application Data
1,1.682491999999911,62.210.85.178,10.0.2.15,TCP,60,9001  >  35978 [ACK] Seq=18033031 Ack=332226299 Win=65535 Len=0
1,1.6824980000001233,62.210.85.178,10.0.2.15,TCP,60,9001  >  35978 [ACK] Seq=18033031 Ack=332227759 Win=65535 Len=0
1,1.682502999999997,62.210.85.178,10.0.2.15,TCP,60,9001  >  35978 [ACK] Seq=18033031 Ack=332228931 Win=65535 Len=0
1,1.6825470000003406,10.0.2.15,62.210.85.178,TLSv1.2,4124,Application Data
1,1.6825870000002396,62.210.85.178,10.0.2.15,TCP,60,9001  >  35978 [ACK] Seq=18033031 Ack=332230391 Win=65535 Len=0
1,1.682593999999881,62.210.85.178,10.0.2.15,TCP,60,9001  >  35978 [ACK] Seq=18033031 Ack=332231851 Win=65535 Len=0
1,1.6825980000003256,62.210.85.178,10.0.2.15,TCP,60,9001  >  35978 [ACK] Seq=18033031 Ack=332233001 Win=65535 Len=0
1,1.6826440000004368,10.0.2.15,62.210.85.178,TLSv1.2,3030,Application Data
1,1.6826820000005682,62.210.85.178,10.0.2.15,TCP,60,9001  >  35978 [ACK] Seq=18033031 Ack=332234461 Win=65535 Len=0
1,1.6826890000002095,62.210.85.178,10.0.2.15,TCP,60,9001  >  35978 [ACK] Seq=18033031 Ack=332235921 Win=65535 Len=0
1,1.6826929999997446,62.210.85.178,10.0.2.15,TCP,60,9001  >  35978 [ACK] Seq=18033031 Ack=332235977 Win=65535 Len=0
1,1.6939739999997983,10.0.2.15,62.210.85.178,TLSv1.2,4124,Application Data
1,1.6940629999999146,10.0.2.15,62.210.85.178,TCP,2974,35978  >  9001 [ACK] Seq=332240047 Ack=18033031 Win=65535 Len=2920 [TCP segment of a reassembled PDU]
1,1.6941029999998136,62.210.85.178,10.0.2.15,TCP,60,9001  >  35978 [ACK] Seq=18033031 Ack=332237437 Win=65535 Len=0
1,1.694112000000132,62.210.85.178,10.0.2.15,TCP,60,9001  >  35978 [ACK] Seq=18033031 Ack=332238897 Win=65535 Len=0
1,1.6941160000005766,62.210.85.178,10.0.2.15,TCP,60,9001  >  35978 [ACK] Seq=18033031 Ack=332240047 Win=65535 Len=0
1,1.6941539999997985,10.0.2.15,62.210.85.178,TLSv1.2,304,Application Data
1,1.694191000000501,62.210.85.178,10.0.2.15,TCP,60,9001  >  35978 [ACK] Seq=18033031 Ack=332241507 Win=65535 Len=0
1,1.6941969999998037,62.210.85.178,10.0.2.15,TCP,60,9001  >  35978 [ACK] Seq=18033031 Ack=332242967 Win=65535 Len=0
1,1.6942020000005868,62.210.85.178,10.0.2.15,TCP,60,9001  >  35978 [ACK] Seq=18033031 Ack=332243217 Win=65535 Len=0
1,1.8081640000000334,54.93.77.70,10.0.2.15,TLSv1.2,3674,Application Data
1,1.8083269999997356,10.0.2.15,54.93.77.70,TCP,54,34692  >  9001 [ACK] Seq=18088659 Ack=331849375 Win=65535 Len=0
1,1.823645999999826,54.93.77.70,10.0.2.15,TCP,2950,"9001  >  34692 [PSH, ACK] Seq=331849375 Ack=18088659 Win=65535 Len=2896 [TCP segment of a reassembled PDU]"
1,1.823736000000281,10.0.2.15,54.93.77.70,TCP,54,34692  >  9001 [ACK] Seq=18088659 Ack=331852271 Win=65535 Len=0
1,1.8251129999998739,54.93.77.70,10.0.2.15,TLSv1.2,778,Application Data
1,1.8303690000002462,54.93.77.70,10.0.2.15,TCP,2950,"9001  >  34692 [PSH, ACK] Seq=331852995 Ack=18088659 Win=65535 Len=2896 [TCP segment of a reassembled PDU]"
1,1.8304189999998925,10.0.2.15,54.93.77.70,TCP,54,34692  >  9001 [ACK] Seq=18088659 Ack=331855891 Win=65535 Len=0
1,1.8322390000002997,54.93.77.70,10.0.2.15,TLSv1.2,1502,Application Data [TCP segment of a reassembled PDU]
1,1.83228599999984,10.0.2.15,54.93.77.70,TCP,54,34692  >  9001 [ACK] Seq=18088659 Ack=331857339 Win=65535 Len=0
1,1.8388940000004368,54.93.77.70,10.0.2.15,TLSv1.2,4398,Application Data [TCP segment of a reassembled PDU]
1,1.8389590000006137,10.0.2.15,54.93.77.70,TCP,54,34692  >  9001 [ACK] Seq=18088659 Ack=331861683 Win=65535 Len=0
1,1.846226999999999,54.93.77.70,10.0.2.15,TLSv1.2,2950,Application Data [TCP segment of a reassembled PDU]
1,1.8462710000003426,10.0.2.15,54.93.77.70,TCP,54,34692  >  9001 [ACK] Seq=18088659 Ack=331864579 Win=65535 Len=0
1,1.8470070000003034,54.93.77.70,10.0.2.15,TLSv1.2,1430,"Application Data, Application Data"
1,1.85717300000033,54.93.77.70,10.0.2.15,TLSv1.2,7294,Application Data
1,1.8571890000002895,54.93.77.70,10.0.2.15,TLSv1.2,2950,Application Data [TCP segment of a reassembled PDU]
1,1.857256000000234,10.0.2.15,54.93.77.70,TCP,54,34692  >  9001 [ACK] Seq=18088659 Ack=331876091 Win=65535 Len=0
1,1.857531999999992,10.0.2.15,54.93.77.70,TLSv1.2,590,Application Data
1,1.8576360000006389,54.93.77.70,10.0.2.15,TCP,60,9001  >  34692 [ACK] Seq=331876091 Ack=18089195 Win=65535 Len=0
1,1.8667100000002392,54.93.77.70,10.0.2.15,TLSv1.2,2950,Application Data [TCP segment of a reassembled PDU]
1,1.8667599999998856,10.0.2.15,54.93.77.70,TCP,54,34692  >  9001 [ACK] Seq=18089195 Ack=331878987 Win=65535 Len=0
1,1.8732630000004065,54.93.77.70,10.0.2.15,TLSv1.2,474,Application Data
1,1.8732840000002398,54.93.77.70,10.0.2.15,TCP,2950,"9001  >  34692 [PSH, ACK] Seq=331879407 Ack=18089195 Win=65535 Len=2896 [TCP segment of a reassembled PDU]"
1,1.8733369999999923,10.0.2.15,54.93.77.70,TCP,54,34692  >  9001 [ACK] Seq=18089195 Ack=331882303 Win=65535 Len=0
1,1.8737890000002153,54.93.77.70,10.0.2.15,TLSv1.2,4398,Application Data [TCP segment of a reassembled PDU]
1,1.8738370000000941,10.0.2.15,54.93.77.70,TCP,54,34692  >  9001 [ACK] Seq=18089195 Ack=331886647 Win=65535 Len=0
1,1.8740340000003926,10.0.2.15,54.93.77.70,TLSv1.2,590,Application Data
1,1.8741250000002765,54.93.77.70,10.0.2.15,TCP,60,9001  >  34692 [ACK] Seq=331886647 Ack=18089731 Win=65535 Len=0
1,1.8827769999998054,54.93.77.70,10.0.2.15,TLSv1.2,2950,Application Data [TCP segment of a reassembled PDU]
1,1.8828250000005937,10.0.2.15,54.93.77.70,TCP,54,34692  >  9001 [ACK] Seq=18089731 Ack=331889543 Win=65535 Len=0
1,1.8834160000005795,54.93.77.70,10.0.2.15,TLSv1.2,5846,"Application Data, Application Data"
1,1.8834790000000794,10.0.2.15,54.93.77.70,TCP,54,34692  >  9001 [ACK] Seq=18089731 Ack=331895335 Win=65535 Len=0
1,1.8895419999998921,54.93.77.70,10.0.2.15,TLSv1.2,684,Application Data
1,1.892609999999877,54.93.77.70,10.0.2.15,TLSv1.2,5846,Application Data
1,1.892655000000559,10.0.2.15,54.93.77.70,TCP,54,34692  >  9001 [ACK] Seq=18089731 Ack=331901757 Win=65535 Len=0
1,1.892848999999842,10.0.2.15,54.93.77.70,TLSv1.2,590,Application Data
1,1.892957000000024,54.93.77.70,10.0.2.15,TCP,60,9001  >  34692 [ACK] Seq=331901757 Ack=18090267 Win=65535 Len=0
1,1.893232999999782,54.93.77.70,10.0.2.15,TLSv1.2,5846,Application Data [TCP segment of a reassembled PDU]
1,1.893275999999787,10.0.2.15,54.93.77.70,TCP,54,34692  >  9001 [ACK] Seq=18090267 Ack=331907549 Win=65535 Len=0
1,1.909679999999753,54.93.77.70,10.0.2.15,TLSv1.2,894,"Application Data, Application Data"
1,1.9132799999997587,10.0.2.15,54.93.77.70,TLSv1.2,590,Application Data
1,1.9134949999997843,54.93.77.70,10.0.2.15,TCP,60,9001  >  34692 [ACK] Seq=331908389 Ack=18090803 Win=65535 Len=0
1,2.02679900000021,62.210.85.178,10.0.2.15,TLSv1.2,2132,Application Data
1,2.0271929999998974,10.0.2.15,62.210.85.178,TCP,54,35978  >  9001 [ACK] Seq=332243217 Ack=18035109 Win=65535 Len=0
1,2.0277350000005754,10.0.2.15,62.210.85.178,TLSv1.2,590,Application Data
1,2.027868000000126,62.210.85.178,10.0.2.15,TCP,60,9001  >  35978 [ACK] Seq=18035109 Ack=332243753 Win=65535 Len=0
1,2.1265760000005685,54.93.77.70,10.0.2.15,TLSv1.2,590,Application Data
1,2.126984999999877,10.0.2.15,54.93.77.70,TLSv1.2,590,Application Data
1,2.1271080000005895,54.93.77.70,10.0.2.15,TCP,60,9001  >  34692 [ACK] Seq=331908925 Ack=18091339 Win=65535 Len=0
1,2.5771249999997963,62.210.85.178,10.0.2.15,TLSv1.2,590,Application Data
1,2.5813779999998587,10.0.2.15,62.210.85.178,TLSv1.2,590,Application Data
1,2.5815670000001774,62.210.85.178,10.0.2.15,TCP,60,9001  >  35978 [ACK] Seq=18035645 Ack=332244289 Win=65535 Len=0
1,2.593906000000061,10.0.2.15,62.210.85.178,TLSv1.2,4124,Application Data
1,2.5940080000000307,10.0.2.15,62.210.85.178,TCP,2974,35978  >  9001 [ACK] Seq=332248359 Ack=18035645 Win=65535 Len=2920 [TCP segment of a reassembled PDU]
1,2.5940520000003744,62.210.85.178,10.0.2.15,TCP,60,9001  >  35978 [ACK] Seq=18035645 Ack=332245749 Win=65535 Len=0
1,2.5940630000004603,62.210.85.178,10.0.2.15,TCP,60,9001  >  35978 [ACK] Seq=18035645 Ack=332247209 Win=65535 Len=0
1,2.594068000000334,62.210.85.178,10.0.2.15,TCP,60,9001  >  35978 [ACK] Seq=18035645 Ack=332248359 Win=65535 Len=0
1,2.594071999999869,62.210.85.178,10.0.2.15,TCP,60,9001  >  35978 [ACK] Seq=18035645 Ack=332249819 Win=65535 Len=0
1,2.594076000000314,62.210.85.178,10.0.2.15,TCP,60,9001  >  35978 [ACK] Seq=18035645 Ack=332251279 Win=65535 Len=0
1,2.594119000000319,10.0.2.15,62.210.85.178,TLSv1.2,1204,Application Data
1,2.5941860000002634,10.0.2.15,62.210.85.178,TCP,1514,35978  >  9001 [ACK] Seq=332252429 Ack=18035645 Win=65535 Len=1460 [TCP segment of a reassembled PDU]
1,2.5942220000006273,62.210.85.178,10.0.2.15,TCP,60,9001  >  35978 [ACK] Seq=18035645 Ack=332252429 Win=65535 Len=0
1,2.59422799999993,62.210.85.178,10.0.2.15,TCP,60,9001  >  35978 [ACK] Seq=18035645 Ack=332253889 Win=65535 Len=0
1,2.5942610000001878,10.0.2.15,62.210.85.178,TLSv1.2,1314,Application Data
1,2.5943480000005366,62.210.85.178,10.0.2.15,TCP,60,9001  >  35978 [ACK] Seq=18035645 Ack=332255149 Win=65535 Len=0
1,2.7217909999999392,54.93.77.70,10.0.2.15,TLSv1.2,3674,Application Data
1,2.721932999999808,10.0.2.15,54.93.77.70,TCP,54,34692  >  9001 [ACK] Seq=18091339 Ack=331912545 Win=65535 Len=0
1,2.8563750000002983,54.93.77.70,10.0.2.15,TCP,2950,"9001  >  34692 [PSH, ACK] Seq=331912545 Ack=18091339 Win=65535 Len=2896 [TCP segment of a reassembled PDU]"
1,2.8564640000004147,10.0.2.15,54.93.77.70,TCP,54,34692  >  9001 [ACK] Seq=18091339 Ack=331915441 Win=65535 Len=0
1,2.858509000000595,54.93.77.70,10.0.2.15,TLSv1.2,778,Application Data
1,2.864897000000383,54.93.77.70,10.0.2.15,TLSv1.2,590,Application Data
1,2.8649640000003274,10.0.2.15,54.93.77.70,TCP,54,34692  >  9001 [ACK] Seq=18091339 Ack=331916701 Win=65535 Len=0
1,2.999687000000449,54.93.77.70,10.0.2.15,TCP,2950,"9001  >  34692 [PSH, ACK] Seq=331916701 Ack=18091339 Win=65535 Len=2896 [TCP segment of a reassembled PDU]"
1,2.999832999999853,10.0.2.15,54.93.77.70,TCP,54,34692  >  9001 [ACK] Seq=18091339 Ack=331919597 Win=65535 Len=0
1,3.0014639999999417,54.93.77.70,10.0.2.15,TLSv1.2,264,Application Data
1,3.001836999999796,10.0.2.15,54.93.77.70,TLSv1.2,590,Application Data
1,3.00195900000017,54.93.77.70,10.0.2.15,TCP,60,9001  >  34692 [ACK] Seq=331919807 Ack=18091875 Win=65535 Len=0
1,3.011609000000135,10.0.2.15,54.93.77.70,TLSv1.2,590,Application Data
1,3.0117810000001555,54.93.77.70,10.0.2.15,TCP,60,9001  >  34692 [ACK] Seq=331919807 Ack=18092411 Win=65535 Len=0
1,3.153585000000021,54.93.77.70,10.0.2.15,TLSv1.2,590,Application Data
1,3.1541320000005726,62.210.85.178,10.0.2.15,TLSv1.2,590,Application Data
1,3.197454000000107,10.0.2.15,62.210.85.178,TCP,54,35978  >  9001 [ACK] Seq=332255149 Ack=18036181 Win=65535 Len=0
1,3.1975290000000314,10.0.2.15,54.93.77.70,TCP,54,34692  >  9001 [ACK] Seq=18092411 Ack=331920343 Win=65535 Len=0
1,3.34279400000014,62.210.85.178,10.0.2.15,TLSv1.2,590,Application Data
1,3.342899000000216,10.0.2.15,62.210.85.178,TCP,54,35978  >  9001 [ACK] Seq=332255149 Ack=18036717 Win=65535 Len=0
1,3.343238000000383,10.0.2.15,62.210.85.178,TLSv1.2,590,Application Data
1,3.3433610000001863,62.210.85.178,10.0.2.15,TCP,60,9001  >  35978 [ACK] Seq=18036717 Ack=332255685 Win=65535 Len=0
1,3.6176690000002054,54.93.77.70,10.0.2.15,TLSv1.2,590,Application Data
1,3.6177480000005744,10.0.2.15,54.93.77.70,TCP,54,34692  >  9001 [ACK] Seq=18092411 Ack=331920879 Win=65535 Len=0
1,3.6181020000003628,10.0.2.15,54.93.77.70,TLSv1.2,590,Application Data
1,3.6181930000002467,54.93.77.70,10.0.2.15,TCP,60,9001  >  34692 [ACK] Seq=331920879 Ack=18092947 Win=65535 Len=0
1,3.7637610000001587,62.210.85.178,10.0.2.15,TLSv1.2,590,Application Data
1,3.7676430000001346,10.0.2.15,62.210.85.178,TLSv1.2,590,Application Data
1,3.767808000000514,62.210.85.178,10.0.2.15,TCP,60,9001  >  35978 [ACK] Seq=18037253 Ack=332256221 Win=65535 Len=0
1,3.7779060000002573,10.0.2.15,62.210.85.178,TLSv1.2,4124,Application Data
1,3.7780069999998886,10.0.2.15,62.210.85.178,TCP,2974,35978  >  9001 [ACK] Seq=332260291 Ack=18037253 Win=65535 Len=2920 [TCP segment of a reassembled PDU]
1,3.778081999999813,62.210.85.178,10.0.2.15,TCP,60,9001  >  35978 [ACK] Seq=18037253 Ack=332257681 Win=65535 Len=0
1,3.778099000000111,62.210.85.178,10.0.2.15,TCP,60,9001  >  35978 [ACK] Seq=18037253 Ack=332259141 Win=65535 Len=0
1,3.7781020000002172,62.210.85.178,10.0.2.15,TCP,60,9001  >  35978 [ACK] Seq=18037253 Ack=332260291 Win=65535 Len=0
1,3.7781050000003233,62.210.85.178,10.0.2.15,TCP,60,9001  >  35978 [ACK] Seq=18037253 Ack=332261751 Win=65535 Len=0
1,3.7781080000004295,62.210.85.178,10.0.2.15,TCP,60,9001  >  35978 [ACK] Seq=18037253 Ack=332263211 Win=65535 Len=0
1,3.778146000000561,10.0.2.15,62.210.85.178,TLSv1.2,1204,Application Data
1,3.7781910000003336,62.210.85.178,10.0.2.15,TCP,60,9001  >  35978 [ACK] Seq=18037253 Ack=332264361 Win=65535 Len=0
1,3.7782500000002983,10.0.2.15,62.210.85.178,TLSv1.2,4124,Application Data
1,3.7782880000004297,62.210.85.178,10.0.2.15,TCP,60,9001  >  35978 [ACK] Seq=18037253 Ack=332265821 Win=65535 Len=0
1,3.778295000000071,62.210.85.178,10.0.2.15,TCP,60,9001  >  35978 [ACK] Seq=18037253 Ack=332267281 Win=65535 Len=0
1,3.7782990000005157,62.210.85.178,10.0.2.15,TCP,60,9001  >  35978 [ACK] Seq=18037253 Ack=332268431 Win=65535 Len=0
1,3.778338000000076,10.0.2.15,62.210.85.178,TLSv1.2,4124,Application Data
1,3.778371000000334,62.210.85.178,10.0.2.15,TCP,60,9001  >  35978 [ACK] Seq=18037253 Ack=332269891 Win=65535 Len=0
1,3.7783790000003137,62.210.85.178,10.0.2.15,TCP,60,9001  >  35978 [ACK] Seq=18037253 Ack=332271351 Win=65535 Len=0
1,3.778382999999849,62.210.85.178,10.0.2.15,TCP,60,9001  >  35978 [ACK] Seq=18037253 Ack=332272501 Win=65535 Len=0
1,3.778417000000445,10.0.2.15,62.210.85.178,TLSv1.2,332,Application Data
1,3.7784520000004704,62.210.85.178,10.0.2.15,TCP,60,9001  >  35978 [ACK] Seq=18037253 Ack=332272779 Win=65535 Len=0
1,3.7785069999999905,10.0.2.15,62.210.85.178,TLSv1.2,3868,Application Data
1,3.7785430000003544,62.210.85.178,10.0.2.15,TCP,60,9001  >  35978 [ACK] Seq=18037253 Ack=332274239 Win=65535 Len=0
1,3.7785499999999956,62.210.85.178,10.0.2.15,TCP,60,9001  >  35978 [ACK] Seq=18037253 Ack=332275699 Win=65535 Len=0
1,3.7785540000004403,62.210.85.178,10.0.2.15,TCP,60,9001  >  35978 [ACK] Seq=18037253 Ack=332276593 Win=65535 Len=0
1,3.778591000000233,10.0.2.15,62.210.85.178,TLSv1.2,4124,Application Data
1,3.778628000000026,62.210.85.178,10.0.2.15,TCP,60,9001  >  35978 [ACK] Seq=18037253 Ack=332278053 Win=65535 Len=0
1,3.7786340000002383,62.210.85.178,10.0.2.15,TCP,60,9001  >  35978 [ACK] Seq=18037253 Ack=332279513 Win=65535 Len=0
1,3.7786370000003444,62.210.85.178,10.0.2.15,TCP,60,9001  >  35978 [ACK] Seq=18037253 Ack=332280663 Win=65535 Len=0
1,3.7786720000003697,10.0.2.15,62.210.85.178,TLSv1.2,3030,Application Data
1,3.778707000000395,62.210.85.178,10.0.2.15,TCP,60,9001  >  35978 [ACK] Seq=18037253 Ack=332282123 Win=65535 Len=0
1,3.7787130000006073,62.210.85.178,10.0.2.15,TCP,60,9001  >  35978 [ACK] Seq=18037253 Ack=332283583 Win=65535 Len=0
1,3.778715999999804,62.210.85.178,10.0.2.15,TCP,60,9001  >  35978 [ACK] Seq=18037253 Ack=332283639 Win=65535 Len=0
1,3.790111000000252,10.0.2.15,62.210.85.178,TLSv1.2,2646,Application Data
1,3.7901590000001306,62.210.85.178,10.0.2.15,TCP,60,9001  >  35978 [ACK] Seq=18037253 Ack=332285099 Win=65535 Len=0
1,3.790168999999878,62.210.85.178,10.0.2.15,TCP,60,9001  >  35978 [ACK] Seq=18037253 Ack=332286231 Win=65535 Len=0
1,3.9300460000004023,54.93.77.70,10.0.2.15,TLSv1.2,13622,"Application Data, Application Data, Application Data, Application Data, Application Data"
1,3.9303110000000743,10.0.2.15,54.93.77.70,TCP,54,34692  >  9001 [ACK] Seq=18092947 Ack=331934447 Win=65535 Len=0
1,3.953371999999945,54.93.77.70,10.0.2.15,TLSv1.2,5846,"Application Data, Application Data"
1,3.953465999999935,10.0.2.15,54.93.77.70,TCP,54,34692  >  9001 [ACK] Seq=18092947 Ack=331940239 Win=65535 Len=0
1,3.953520000000026,54.93.77.70,10.0.2.15,TLSv1.2,4398,Application Data [TCP segment of a reassembled PDU]
1,3.9535970000006273,10.0.2.15,54.93.77.70,TCP,54,34692  >  9001 [ACK] Seq=18092947 Ack=331944583 Win=65535 Len=0
1,3.9536580000003596,54.93.77.70,10.0.2.15,TLSv1.2,1474,Application Data [TCP segment of a reassembled PDU]
1,3.9538400000001275,10.0.2.15,54.93.77.70,TLSv1.2,590,Application Data
1,3.9538860000002387,54.93.77.70,10.0.2.15,TLSv1.2,2392,Application Data
1,3.9538940000002185,54.93.77.70,10.0.2.15,TCP,60,9001  >  34692 [ACK] Seq=331948341 Ack=18093483 Win=65535 Len=0
1,3.953957000000628,10.0.2.15,54.93.77.70,TCP,54,34692  >  9001 [ACK] Seq=18093483 Ack=331948341 Win=65535 Len=0
1,3.958534000000327,54.93.77.70,10.0.2.15,TCP,2950,"9001  >  34692 [PSH, ACK] Seq=331948341 Ack=18093483 Win=65535 Len=2896 [TCP segment of a reassembled PDU]"
1,3.9585790000000998,10.0.2.15,54.93.77.70,TCP,54,34692  >  9001 [ACK] Seq=18093483 Ack=331951237 Win=65535 Len=0
1,3.9659380000002784,10.0.2.15,54.93.77.70,TLSv1.2,590,Application Data
1,3.9660680000006323,54.93.77.70,10.0.2.15,TCP,60,9001  >  34692 [ACK] Seq=331951237 Ack=18094019 Win=65535 Len=0
1,3.9739049999998315,54.93.77.70,10.0.2.15,TLSv1.2,264,Application Data
1,3.9769270000006145,10.0.2.15,54.93.77.70,TLSv1.2,590,Application Data
1,3.977096000000529,54.93.77.70,10.0.2.15,TCP,60,9001  >  34692 [ACK] Seq=331951447 Ack=18094555 Win=65535 Len=0
1,4.055194000000483,62.210.85.178,10.0.2.15,TLSv1.2,590,Application Data
1,4.097413999999844,10.0.2.15,62.210.85.178,TCP,54,35978  >  9001 [ACK] Seq=332286231 Ack=18037789 Win=65535 Len=0
1,4.413862999999765,62.210.85.178,10.0.2.15,TLSv1.2,1104,Application Data
1,4.413954999999987,10.0.2.15,62.210.85.178,TCP,54,35978  >  9001 [ACK] Seq=332286231 Ack=18038839 Win=65535 Len=0
1,4.414303999999902,10.0.2.15,62.210.85.178,TLSv1.2,590,Application Data
1,4.414429000000382,62.210.85.178,10.0.2.15,TCP,60,9001  >  35978 [ACK] Seq=18038839 Ack=332286767 Win=65535 Len=0
1,4.6195669999997335,54.93.77.70,10.0.2.15,TLSv1.2,590,Application Data
1,4.619940999999926,10.0.2.15,54.93.77.70,TLSv1.2,590,Application Data
1,4.62004799999977,54.93.77.70,10.0.2.15,TCP,60,9001  >  34692 [ACK] Seq=331951983 Ack=18095091 Win=65535 Len=0
1,4.734550000000127,62.210.85.178,10.0.2.15,TLSv1.2,590,Application Data
1,4.7385229999999865,10.0.2.15,62.210.85.178,TLSv1.2,590,Application Data
1,4.73867700000028,62.210.85.178,10.0.2.15,TCP,60,9001  >  35978 [ACK] Seq=18039375 Ack=332287303 Win=65535 Len=0
1,4.750039999999899,10.0.2.15,62.210.85.178,TLSv1.2,4124,Application Data
1,4.7501579999998285,10.0.2.15,62.210.85.178,TCP,2974,35978  >  9001 [ACK] Seq=332291373 Ack=18039375 Win=65535 Len=2920 [TCP segment of a reassembled PDU]
1,4.750208000000384,62.210.85.178,10.0.2.15,TCP,60,9001  >  35978 [ACK] Seq=18039375 Ack=332288763 Win=65535 Len=0
1,4.75021900000047,62.210.85.178,10.0.2.15,TCP,60,9001  >  35978 [ACK] Seq=18039375 Ack=332290223 Win=65535 Len=0
1,4.750224000000344,62.210.85.178,10.0.2.15,TCP,60,9001  >  35978 [ACK] Seq=18039375 Ack=332291373 Win=65535 Len=0
1,4.750227999999879,62.210.85.178,10.0.2.15,TCP,60,9001  >  35978 [ACK] Seq=18039375 Ack=332292833 Win=65535 Len=0
1,4.750232000000324,62.210.85.178,10.0.2.15,TCP,60,9001  >  35978 [ACK] Seq=18039375 Ack=332294293 Win=65535 Len=0
1,4.7502770000000965,10.0.2.15,62.210.85.178,TLSv1.2,1204,Application Data
1,4.750347000000147,10.0.2.15,62.210.85.178,TCP,2974,35978  >  9001 [ACK] Seq=332295443 Ack=18039375 Win=65535 Len=2920 [TCP segment of a reassembled PDU]
1,4.750387000000046,62.210.85.178,10.0.2.15,TCP,60,9001  >  35978 [ACK] Seq=18039375 Ack=332295443 Win=65535 Len=0
1,4.750394000000597,62.210.85.178,10.0.2.15,TCP,60,9001  >  35978 [ACK] Seq=18039375 Ack=332296903 Win=65535 Len=0
1,4.750398000000132,62.210.85.178,10.0.2.15,TCP,60,9001  >  35978 [ACK] Seq=18039375 Ack=332298363 Win=65535 Len=0
1,4.750433000000157,10.0.2.15,62.210.85.178,TLSv1.2,1204,Application Data
1,4.750498000000334,10.0.2.15,62.210.85.178,TCP,2974,35978  >  9001 [ACK] Seq=332299513 Ack=18039375 Win=65535 Len=2920 [TCP segment of a reassembled PDU]
1,4.750533999999789,62.210.85.178,10.0.2.15,TCP,60,9001  >  35978 [ACK] Seq=18039375 Ack=332299513 Win=65535 Len=0
1,4.750541000000339,62.210.85.178,10.0.2.15,TCP,60,9001  >  35978 [ACK] Seq=18039375 Ack=332300973 Win=65535 Len=0
1,4.750546000000213,62.210.85.178,10.0.2.15,TCP,60,9001  >  35978 [ACK] Seq=18039375 Ack=332302433 Win=65535 Len=0
1,4.750576999999794,10.0.2.15,62.210.85.178,TLSv1.2,1204,Application Data
1,4.750651000000289,62.210.85.178,10.0.2.15,TCP,60,9001  >  35978 [ACK] Seq=18039375 Ack=332303583 Win=65535 Len=0
1,4.750684000000547,10.0.2.15,62.210.85.178,TLSv1.2,332,Application Data
1,4.75072100000034,62.210.85.178,10.0.2.15,TCP,60,9001  >  35978 [ACK] Seq=18039375 Ack=332303861 Win=65535 Len=0
1,4.750772000000325,10.0.2.15,62.210.85.178,TLSv1.2,3868,Application Data
1,4.750813000000562,62.210.85.178,10.0.2.15,TCP,60,9001  >  35978 [ACK] Seq=18039375 Ack=332305321 Win=65535 Len=0
1,4.750820000000203,62.210.85.178,10.0.2.15,TCP,60,9001  >  35978 [ACK] Seq=18039375 Ack=332306781 Win=65535 Len=0
1,4.750823999999739,62.210.85.178,10.0.2.15,TCP,60,9001  >  35978 [ACK] Seq=18039375 Ack=332307675 Win=65535 Len=0
1,4.750871000000188,10.0.2.15,62.210.85.178,TLSv1.2,3480,Application Data
1,4.750912000000426,62.210.85.178,10.0.2.15,TCP,60,9001  >  35978 [ACK] Seq=18039375 Ack=332309135 Win=65535 Len=0
1,4.750919000000067,62.210.85.178,10.0.2.15,TCP,60,9001  >  35978 [ACK] Seq=18039375 Ack=332310595 Win=65535 Len=0
1,4.750923999999941,62.210.85.178,10.0.2.15,TCP,60,9001  >  35978 [ACK] Seq=18039375 Ack=332311101 Win=65535 Len=0
1,4.880221999999776,54.93.77.70,10.0.2.15,TLSv1.2,3674,Application Data
1,4.8803539999998975,10.0.2.15,54.93.77.70,TCP,54,34692  >  9001 [ACK] Seq=18095091 Ack=331955603 Win=65535 Len=0
1,4.897683000000143,54.93.77.70,10.0.2.15,TCP,2950,"9001  >  34692 [PSH, ACK] Seq=331955603 Ack=18095091 Win=65535 Len=2896 [TCP segment of a reassembled PDU]"
1,4.897743000000446,10.0.2.15,54.93.77.70,TCP,54,34692  >  9001 [ACK] Seq=18095091 Ack=331958499 Win=65535 Len=0
1,4.898885000000519,54.93.77.70,10.0.2.15,TLSv1.2,778,Application Data
1,4.908849999999802,54.93.77.70,10.0.2.15,TCP,2950,"9001  >  34692 [PSH, ACK] Seq=331959223 Ack=18095091 Win=65535 Len=2896 [TCP segment of a reassembled PDU]"
1,4.908895999999913,10.0.2.15,54.93.77.70,TCP,54,34692  >  9001 [ACK] Seq=18095091 Ack=331962119 Win=65535 Len=0
1,4.920737000000372,54.93.77.70,10.0.2.15,TLSv1.2,2950,Application Data [TCP segment of a reassembled PDU]
1,4.920799000000443,10.0.2.15,54.93.77.70,TCP,54,34692  >  9001 [ACK] Seq=18095091 Ack=331965015 Win=65535 Len=0
1,4.925648000000365,54.93.77.70,10.0.2.15,TLSv1.2,5846,"Application Data, Application Data"
1,4.925720000000183,10.0.2.15,54.93.77.70,TCP,54,34692  >  9001 [ACK] Seq=18095091 Ack=331970807 Win=65535 Len=0
1,4.928216000000248,54.93.77.70,10.0.2.15,TLSv1.2,1408,Application Data
1,4.953435000000354,54.93.77.70,10.0.2.15,TCP,2950,"9001  >  34692 [PSH, ACK] Seq=331972161 Ack=18095091 Win=65535 Len=2896 [TCP segment of a reassembled PDU]"
1,4.953508000000511,10.0.2.15,54.93.77.70,TCP,54,34692  >  9001 [ACK] Seq=18095091 Ack=331975057 Win=65535 Len=0
1,4.972214000000349,54.93.77.70,10.0.2.15,TLSv1.2,1314,"Application Data, Application Data"
1,4.97525399999995,10.0.2.15,54.93.77.70,TLSv1.2,590,Application Data
1,4.975527000000511,54.93.77.70,10.0.2.15,TCP,60,9001  >  34692 [ACK] Seq=331976317 Ack=18095627 Win=65535 Len=0
1,5.063815999999861,62.210.85.178,10.0.2.15,TLSv1.2,590,Application Data
1,5.064307999999983,10.0.2.15,62.210.85.178,TLSv1.2,590,Application Data
1,5.064420000000609,62.210.85.178,10.0.2.15,TCP,60,9001  >  35978 [ACK] Seq=18039911 Ack=332311637 Win=65535 Len=0
1,5.174495000000206,54.93.77.70,10.0.2.15,TLSv1.2,590,Application Data
1,5.174858000000313,10.0.2.15,54.93.77.70,TLSv1.2,590,Application Data
1,5.174963999999818,54.93.77.70,10.0.2.15,TCP,60,9001  >  34692 [ACK] Seq=331976853 Ack=18096163 Win=65535 Len=0
1,5.264140000000225,62.210.85.178,10.0.2.15,TLSv1.2,590,Application Data
1,5.268068000000312,10.0.2.15,62.210.85.178,TLSv1.2,590,Application Data
1,5.26825000000008,62.210.85.178,10.0.2.15,TCP,60,9001  >  35978 [ACK] Seq=18040447 Ack=332312173 Win=65535 Len=0
1,5.278465999999753,10.0.2.15,62.210.85.178,TLSv1.2,4124,Application Data
1,5.2786120000000665,62.210.85.178,10.0.2.15,TCP,60,9001  >  35978 [ACK] Seq=18040447 Ack=332313633 Win=65535 Len=0
1,5.278629999999794,62.210.85.178,10.0.2.15,TCP,60,9001  >  35978 [ACK] Seq=18040447 Ack=332315093 Win=65535 Len=0
1,5.2786329999999,62.210.85.178,10.0.2.15,TCP,60,9001  >  35978 [ACK] Seq=18040447 Ack=332316243 Win=65535 Len=0
1,5.278698000000077,10.0.2.15,62.210.85.178,TLSv1.2,4124,Application Data
1,5.278769000000466,62.210.85.178,10.0.2.15,TCP,60,9001  >  35978 [ACK] Seq=18040447 Ack=332317703 Win=65535 Len=0
1,5.278776000000107,62.210.85.178,10.0.2.15,TCP,60,9001  >  35978 [ACK] Seq=18040447 Ack=332319163 Win=65535 Len=0
1,5.278779000000213,62.210.85.178,10.0.2.15,TCP,60,9001  >  35978 [ACK] Seq=18040447 Ack=332320313 Win=65535 Len=0
1,5.278806000000259,10.0.2.15,62.210.85.178,TCP,2974,35978  >  9001 [ACK] Seq=332320313 Ack=18040447 Win=65535 Len=2920 [TCP segment of a reassembled PDU]
1,5.278839999999946,62.210.85.178,10.0.2.15,TCP,60,9001  >  35978 [ACK] Seq=18040447 Ack=332321773 Win=65535 Len=0
1,5.278847999999925,62.210.85.178,10.0.2.15,TCP,60,9001  >  35978 [ACK] Seq=18040447 Ack=332323233 Win=65535 Len=0
1,5.2788769999997385,10.0.2.15,62.210.85.178,TLSv1.2,1204,Application Data
1,5.278911000000335,62.210.85.178,10.0.2.15,TCP,60,9001  >  35978 [ACK] Seq=18040447 Ack=332324383 Win=65535 Len=0
1,5.278952000000572,10.0.2.15,62.210.85.178,TLSv1.2,4124,Application Data
1,5.278986000000259,62.210.85.178,10.0.2.15,TCP,60,9001  >  35978 [ACK] Seq=18040447 Ack=332325843 Win=65535 Len=0
1,5.2789929999999,62.210.85.178,10.0.2.15,TCP,60,9001  >  35978 [ACK] Seq=18040447 Ack=332327303 Win=65535 Len=0
1,5.279054999999971,10.0.2.15,62.210.85.178,TLSv1.2,2974,Application Data
1,5.279091999999764,62.210.85.178,10.0.2.15,TCP,60,9001  >  35978 [ACK] Seq=18040447 Ack=332328453 Win=65535 Len=0
1,5.279099000000315,62.210.85.178,10.0.2.15,TCP,60,9001  >  35978 [ACK] Seq=18040447 Ack=332329913 Win=65535 Len=0
1,5.279102000000421,62.210.85.178,10.0.2.15,TCP,60,9001  >  35978 [ACK] Seq=18040447 Ack=332331373 Win=65535 Len=0
1,5.2791290000004665,10.0.2.15,62.210.85.178,TLSv1.2,1226,Application Data
1,5.279161000000386,62.210.85.178,10.0.2.15,TCP,60,9001  >  35978 [ACK] Seq=18040447 Ack=332332545 Win=65535 Len=0
1,5.279199999999946,10.0.2.15,62.210.85.178,TLSv1.2,4124,Application Data
1,5.2792349999999715,62.210.85.178,10.0.2.15,TCP,60,9001  >  35978 [ACK] Seq=18040447 Ack=332334005 Win=65535 Len=0
1,5.279241000000184,62.210.85.178,10.0.2.15,TCP,60,9001  >  35978 [ACK] Seq=18040447 Ack=332335465 Win=65535 Len=0
1,5.27924400000029,62.210.85.178,10.0.2.15,TCP,60,9001  >  35978 [ACK] Seq=18040447 Ack=332336615 Win=65535 Len=0
1,5.279279999999744,10.0.2.15,62.210.85.178,TLSv1.2,3030,Application Data
1,5.2793140000003405,62.210.85.178,10.0.2.15,TCP,60,9001  >  35978 [ACK] Seq=18040447 Ack=332338075 Win=65535 Len=0
1,5.279320000000553,62.210.85.178,10.0.2.15,TCP,60,9001  >  35978 [ACK] Seq=18040447 Ack=332339535 Win=65535 Len=0
1,5.279324000000088,62.210.85.178,10.0.2.15,TCP,60,9001  >  35978 [ACK] Seq=18040447 Ack=332339591 Win=65535 Len=0
1,5.288518000000295,10.0.2.15,62.210.85.178,TLSv1.2,1618,Application Data
1,5.2885660000001735,62.210.85.178,10.0.2.15,TCP,60,9001  >  35978 [ACK] Seq=18040447 Ack=332341051 Win=65535 Len=0
1,5.288575999999921,62.210.85.178,10.0.2.15,TCP,60,9001  >  35978 [ACK] Seq=18040447 Ack=332341155 Win=65535 Len=0
1,5.358535000000302,54.93.77.70,10.0.2.15,TLSv1.2,590,Application Data
1,5.369744000000537,54.93.77.70,10.0.2.15,TCP,2950,"9001  >  34692 [PSH, ACK] Seq=331977389 Ack=18096163 Win=65535 Len=2896 [TCP segment of a reassembled PDU]"
1,5.369816000000355,10.0.2.15,54.93.77.70,TCP,54,34692  >  9001 [ACK] Seq=18096163 Ack=331980285 Win=65535 Len=0
1,5.380836000000272,54.93.77.70,10.0.2.15,TLSv1.2,2950,Application Data [TCP segment of a reassembled PDU]
1,5.380901000000449,10.0.2.15,54.93.77.70,TCP,54,34692  >  9001 [ACK] Seq=18096163 Ack=331983181 Win=65535 Len=0
1,5.380946000000222,54.93.77.70,10.0.2.15,TLSv1.2,1502,Application Data
1,5.381000000000313,10.0.2.15,54.93.77.70,TCP,54,34692  >  9001 [ACK] Seq=18096163 Ack=331984629 Win=65535 Len=0
1,5.4116979999998875,54.93.77.70,10.0.2.15,TLSv1.2,4210,"Application Data, Application Data"
1,5.4117489999998725,10.0.2.15,54.93.77.70,TCP,54,34692  >  9001 [ACK] Seq=18096163 Ack=331988785 Win=65535 Len=0
1,5.411928999999873,10.0.2.15,54.93.77.70,TLSv1.2,590,Application Data
1,5.412017999999989,54.93.77.70,10.0.2.15,TCP,60,9001  >  34692 [ACK] Seq=331988785 Ack=18096699 Win=65535 Len=0
1,5.417742999999973,54.93.77.70,10.0.2.15,TLSv1.2,4398,Application Data
1,5.417787000000317,10.0.2.15,54.93.77.70,TCP,54,34692  >  9001 [ACK] Seq=18096699 Ack=331993129 Win=65535 Len=0
1,5.418134999999893,54.93.77.70,10.0.2.15,TCP,2950,"9001  >  34692 [PSH, ACK] Seq=331993129 Ack=18096699 Win=65535 Len=2896 [TCP segment of a reassembled PDU]"
1,5.41817600000013,10.0.2.15,54.93.77.70,TCP,54,34692  >  9001 [ACK] Seq=18096699 Ack=331996025 Win=65535 Len=0
1,5.427655000000414,54.93.77.70,10.0.2.15,TLSv1.2,568,Application Data
1,5.438119999999799,54.93.77.70,10.0.2.15,TLSv1.2,4398,Application Data
1,5.438162999999804,10.0.2.15,54.93.77.70,TCP,54,34692  >  9001 [ACK] Seq=18096699 Ack=332000883 Win=65535 Len=0
1,5.454523999999765,54.93.77.70,10.0.2.15,TLSv1.2,380,Application Data
1,5.497417000000496,10.0.2.15,54.93.77.70,TCP,54,34692  >  9001 [ACK] Seq=18096699 Ack=332001209 Win=65535 Len=0
1,5.514341000000059,54.93.77.70,10.0.2.15,TLSv1.2,3674,Application Data
1,5.514439000000493,10.0.2.15,54.93.77.70,TCP,54,34692  >  9001 [ACK] Seq=18096699 Ack=332004829 Win=65535 Len=0
1,5.514592999999877,10.0.2.15,54.93.77.70,TLSv1.2,590,Application Data
1,5.5146590000003926,54.93.77.70,10.0.2.15,TCP,60,9001  >  34692 [ACK] Seq=332004829 Ack=18097235 Win=65535 Len=0
1,5.526111000000128,54.93.77.70,10.0.2.15,TCP,1502,"9001  >  34692 [PSH, ACK] Seq=332004829 Ack=18097235 Win=65535 Len=1448 [TCP segment of a reassembled PDU]"
1,5.526185000000623,10.0.2.15,54.93.77.70,TCP,54,34692  >  9001 [ACK] Seq=18097235 Ack=332006277 Win=65535 Len=0
1,5.530566000000363,54.93.77.70,10.0.2.15,TLSv1.2,170,Application Data
1,5.532914000000346,10.0.2.15,54.93.77.70,TLSv1.2,590,Application Data
