No.,Time,Source,Destination,Protocol,Length,Info
1,0.014359000000695232,10.0.2.15,54.93.77.70,TCP,54,34692  >  9001 [ACK] Seq=19268715 Ack=354169573 Win=65535 Len=0
1,0.02778500000022177,62.210.85.178,10.0.2.15,TLSv1.2,1104,Application Data
1,0.07431499999984226,10.0.2.15,62.210.85.178,TCP,54,35978  >  9001 [ACK] Seq=354485443 Ack=19191549 Win=65535 Len=0
1,0.1395200000006298,10.0.2.15,54.93.77.70,TLSv1.2,590,Application Data
1,0.13968500000009954,54.93.77.70,10.0.2.15,TCP,60,9001  >  34692 [ACK] Seq=354169573 Ack=19269251 Win=65535 Len=0
1,0.15015300000050047,62.210.85.178,10.0.2.15,TLSv1.2,590,Application Data
1,0.15020000000004075,10.0.2.15,62.210.85.178,TCP,54,35978  >  9001 [ACK] Seq=354485443 Ack=19192085 Win=65535 Len=0
1,0.25414099999943573,62.210.85.178,10.0.2.15,TLSv1.2,590,Application Data
1,0.25421800000003714,10.0.2.15,62.210.85.178,TCP,54,35978  >  9001 [ACK] Seq=354485443 Ack=19192621 Win=65535 Len=0
1,0.25449400000070455,10.0.2.15,62.210.85.178,TLSv1.2,590,Application Data
1,0.2545939999999973,62.210.85.178,10.0.2.15,TCP,60,9001  >  35978 [ACK] Seq=19192621 Ack=354485979 Win=65535 Len=0
1,0.3392810000004829,54.93.77.70,10.0.2.15,TLSv1.2,590,Application Data
1,0.3393519999990531,10.0.2.15,54.93.77.70,TCP,54,34692  >  9001 [ACK] Seq=19269251 Ack=354170109 Win=65535 Len=0
1,0.33973300000070594,10.0.2.15,54.93.77.70,TLSv1.2,1618,Application Data
1,0.33983400000033726,54.93.77.70,10.0.2.15,TCP,60,9001  >  34692 [ACK] Seq=354170109 Ack=19270711 Win=65535 Len=0
1,0.33984699999928125,54.93.77.70,10.0.2.15,TCP,60,9001  >  34692 [ACK] Seq=354170109 Ack=19270815 Win=65535 Len=0
1,0.699624999999287,62.210.85.178,10.0.2.15,TLSv1.2,1618,Application Data
1,0.6999539999997069,10.0.2.15,62.210.85.178,TCP,54,35978  >  9001 [ACK] Seq=354485979 Ack=19194185 Win=65535 Len=0
1,0.7142039999998815,10.0.2.15,62.210.85.178,TLSv1.2,590,Application Data
1,0.7143849999993108,62.210.85.178,10.0.2.15,TCP,60,9001  >  35978 [ACK] Seq=19194185 Ack=354486515 Win=65535 Len=0
1,0.726133000000118,10.0.2.15,62.210.85.178,TLSv1.2,1618,Application Data
1,0.7262969999992492,62.210.85.178,10.0.2.15,TCP,60,9001  >  35978 [ACK] Seq=19194185 Ack=354487975 Win=65535 Len=0
1,0.7263139999995474,62.210.85.178,10.0.2.15,TCP,60,9001  >  35978 [ACK] Seq=19194185 Ack=354488079 Win=65535 Len=0
1,0.9027630000000499,54.93.77.70,10.0.2.15,TLSv1.2,2132,Application Data
1,0.9029140000002371,10.0.2.15,54.93.77.70,TCP,54,34692  >  9001 [ACK] Seq=19270815 Ack=354172187 Win=65535 Len=0
1,0.9049670000003971,10.0.2.15,54.93.77.70,TLSv1.2,590,Application Data
1,0.9051299999991897,54.93.77.70,10.0.2.15,TCP,60,9001  >  34692 [ACK] Seq=354172187 Ack=19271351 Win=65535 Len=0
1,1.003129999999146,62.210.85.178,10.0.2.15,TLSv1.2,590,Application Data
1,1.0034620000005816,10.0.2.15,62.210.85.178,TLSv1.2,590,Application Data
1,1.003563000000213,62.210.85.178,10.0.2.15,TCP,60,9001  >  35978 [ACK] Seq=19194721 Ack=354488615 Win=65535 Len=0
1,1.1059629999999743,54.93.77.70,10.0.2.15,TLSv1.2,590,Application Data
1,1.1063259999991715,10.0.2.15,54.93.77.70,TLSv1.2,590,Application Data
1,1.1064320000004955,54.93.77.70,10.0.2.15,TCP,60,9001  >  34692 [ACK] Seq=354172723 Ack=19271887 Win=65535 Len=0
1,1.3120330000001559,62.210.85.178,10.0.2.15,TLSv1.2,590,Application Data
1,1.315269000000626,10.0.2.15,62.210.85.178,TLSv1.2,590,Application Data
1,1.3154080000003887,62.210.85.178,10.0.2.15,TCP,60,9001  >  35978 [ACK] Seq=19195257 Ack=354489151 Win=65535 Len=0
1,1.326123999999254,10.0.2.15,62.210.85.178,TLSv1.2,4124,Application Data
1,1.3262359999989712,10.0.2.15,62.210.85.178,TCP,2974,35978  >  9001 [ACK] Seq=354493221 Ack=19195257 Win=65535 Len=2920 [TCP segment of a reassembled PDU]
1,1.3262869999998657,62.210.85.178,10.0.2.15,TCP,60,9001  >  35978 [ACK] Seq=19195257 Ack=354490611 Win=65535 Len=0
1,1.326321000000462,62.210.85.178,10.0.2.15,TCP,60,9001  >  35978 [ACK] Seq=19195257 Ack=354492071 Win=65535 Len=0
1,1.3263270000006742,62.210.85.178,10.0.2.15,TCP,60,9001  >  35978 [ACK] Seq=19195257 Ack=354493221 Win=65535 Len=0
1,1.3263310000002093,62.210.85.178,10.0.2.15,TCP,60,9001  >  35978 [ACK] Seq=19195257 Ack=354494681 Win=65535 Len=0
1,1.326333999999406,62.210.85.178,10.0.2.15,TCP,60,9001  >  35978 [ACK] Seq=19195257 Ack=354496141 Win=65535 Len=0
1,1.3263700000006793,10.0.2.15,62.210.85.178,TLSv1.2,818,Application Data
1,1.3264079999989917,62.210.85.178,10.0.2.15,TCP,60,9001  >  35978 [ACK] Seq=19195257 Ack=354496905 Win=65535 Len=0
1,1.5187839999998687,54.93.77.70,10.0.2.15,TLSv1.2,590,Application Data
1,1.5369399999999587,54.93.77.70,10.0.2.15,TLSv1.2,7294,"Application Data, Application Data"
1,1.5370179999990796,10.0.2.15,54.93.77.70,TCP,54,34692  >  9001 [ACK] Seq=19271887 Ack=354180499 Win=65535 Len=0
1,1.5372430000006716,10.0.2.15,54.93.77.70,TLSv1.2,590,Application Data
1,1.5373139999992418,54.93.77.70,10.0.2.15,TLSv1.2,590,Application Data
1,1.5373259999996662,54.93.77.70,10.0.2.15,TCP,60,9001  >  34692 [ACK] Seq=354181035 Ack=19272423 Win=65535 Len=0
1,1.5467750000007072,10.0.2.15,54.93.77.70,TLSv1.2,590,Application Data
1,1.5469200000006822,54.93.77.70,10.0.2.15,TCP,60,9001  >  34692 [ACK] Seq=354181035 Ack=19272959 Win=65535 Len=0
1,1.7217820000005304,62.210.85.178,10.0.2.15,TLSv1.2,590,Application Data
1,1.765347999998994,10.0.2.15,62.210.85.178,TCP,54,35978  >  9001 [ACK] Seq=354496905 Ack=19195793 Win=65535 Len=0
1,1.782788000000437,62.210.85.178,10.0.2.15,TLSv1.2,590,Application Data
1,1.782828999999765,10.0.2.15,62.210.85.178,TCP,54,35978  >  9001 [ACK] Seq=354496905 Ack=19196329 Win=65535 Len=0
1,1.7830689999991591,10.0.2.15,62.210.85.178,TLSv1.2,590,Application Data
1,1.7831480000004376,62.210.85.178,10.0.2.15,TCP,60,9001  >  35978 [ACK] Seq=19196329 Ack=354497441 Win=65535 Len=0
1,1.8846699999994598,54.93.77.70,10.0.2.15,TLSv1.2,590,Application Data
1,1.8850370000000112,10.0.2.15,54.93.77.70,TLSv1.2,590,Application Data
1,1.8851450000001932,54.93.77.70,10.0.2.15,TCP,60,9001  >  34692 [ACK] Seq=354181571 Ack=19273495 Win=65535 Len=0
1,2.0301369999997405,62.210.85.178,10.0.2.15,TLSv1.2,590,Application Data
1,2.035950999999841,10.0.2.15,62.210.85.178,TLSv1.2,590,Application Data
1,2.037125000000742,62.210.85.178,10.0.2.15,TCP,60,9001  >  35978 [ACK] Seq=19196865 Ack=354497977 Win=65535 Len=0
1,2.046280000000479,10.0.2.15,62.210.85.178,TLSv1.2,4124,Application Data
1,2.046377000000575,10.0.2.15,62.210.85.178,TCP,2974,35978  >  9001 [ACK] Seq=354502047 Ack=19196865 Win=65535 Len=2920 [TCP segment of a reassembled PDU]
1,2.046428999999989,62.210.85.178,10.0.2.15,TCP,60,9001  >  35978 [ACK] Seq=19196865 Ack=354499437 Win=65535 Len=0
1,2.0464439999996102,62.210.85.178,10.0.2.15,TCP,60,9001  >  35978 [ACK] Seq=19196865 Ack=354500897 Win=65535 Len=0
1,2.046448999999484,62.210.85.178,10.0.2.15,TCP,60,9001  >  35978 [ACK] Seq=19196865 Ack=354502047 Win=65535 Len=0
1,2.0464520000004995,62.210.85.178,10.0.2.15,TCP,60,9001  >  35978 [ACK] Seq=19196865 Ack=354503507 Win=65535 Len=0
1,2.046454999999696,62.210.85.178,10.0.2.15,TCP,60,9001  >  35978 [ACK] Seq=19196865 Ack=354504967 Win=65535 Len=0
1,2.0464890000002924,10.0.2.15,62.210.85.178,TLSv1.2,1204,Application Data
1,2.046534999999494,62.210.85.178,10.0.2.15,TCP,60,9001  >  35978 [ACK] Seq=19196865 Ack=354506117 Win=65535 Len=0
1,2.0465779999994993,10.0.2.15,62.210.85.178,TLSv1.2,4124,Application Data
1,2.0466450000003533,62.210.85.178,10.0.2.15,TCP,60,9001  >  35978 [ACK] Seq=19196865 Ack=354507577 Win=65535 Len=0
1,2.0466550000001007,62.210.85.178,10.0.2.15,TCP,60,9001  >  35978 [ACK] Seq=19196865 Ack=354509037 Win=65535 Len=0
1,2.0466579999992973,62.210.85.178,10.0.2.15,TCP,60,9001  >  35978 [ACK] Seq=19196865 Ack=354510187 Win=65535 Len=0
1,2.0467069999995147,10.0.2.15,62.210.85.178,TLSv1.2,4124,Application Data
1,2.0467750000007072,62.210.85.178,10.0.2.15,TCP,60,9001  >  35978 [ACK] Seq=19196865 Ack=354511647 Win=65535 Len=0
1,2.0467850000004546,62.210.85.178,10.0.2.15,TCP,60,9001  >  35978 [ACK] Seq=19196865 Ack=354513107 Win=65535 Len=0
1,2.0467889999999898,62.210.85.178,10.0.2.15,TCP,60,9001  >  35978 [ACK] Seq=19196865 Ack=354514257 Win=65535 Len=0
1,2.046834000000672,10.0.2.15,62.210.85.178,TLSv1.2,332,Application Data
1,2.046875,62.210.85.178,10.0.2.15,TCP,60,9001  >  35978 [ACK] Seq=19196865 Ack=354514535 Win=65535 Len=0
1,2.0469300000004296,10.0.2.15,62.210.85.178,TLSv1.2,3868,Application Data
1,2.046972000000096,62.210.85.178,10.0.2.15,TCP,60,9001  >  35978 [ACK] Seq=19196865 Ack=354515995 Win=65535 Len=0
1,2.046979000000647,62.210.85.178,10.0.2.15,TCP,60,9001  >  35978 [ACK] Seq=19196865 Ack=354517455 Win=65535 Len=0
1,2.046983000000182,62.210.85.178,10.0.2.15,TCP,60,9001  >  35978 [ACK] Seq=19196865 Ack=354518349 Win=65535 Len=0
1,2.0470210000003135,10.0.2.15,62.210.85.178,TLSv1.2,4124,Application Data
1,2.0470599999989645,62.210.85.178,10.0.2.15,TCP,60,9001  >  35978 [ACK] Seq=19196865 Ack=354519809 Win=65535 Len=0
1,2.0470669999995152,62.210.85.178,10.0.2.15,TCP,60,9001  >  35978 [ACK] Seq=19196865 Ack=354521269 Win=65535 Len=0
1,2.0470709999990504,62.210.85.178,10.0.2.15,TCP,60,9001  >  35978 [ACK] Seq=19196865 Ack=354522419 Win=65535 Len=0
1,2.047105999999985,10.0.2.15,62.210.85.178,TLSv1.2,3030,Application Data
1,2.047145000000455,62.210.85.178,10.0.2.15,TCP,60,9001  >  35978 [ACK] Seq=19196865 Ack=354523879 Win=65535 Len=0
1,2.0471529999995255,62.210.85.178,10.0.2.15,TCP,60,9001  >  35978 [ACK] Seq=19196865 Ack=354525339 Win=65535 Len=0
1,2.047156000000541,62.210.85.178,10.0.2.15,TCP,60,9001  >  35978 [ACK] Seq=19196865 Ack=354525395 Win=65535 Len=0
1,2.056322000000364,10.0.2.15,62.210.85.178,TLSv1.2,4124,Application Data
1,2.0563679999995657,62.210.85.178,10.0.2.15,TCP,60,9001  >  35978 [ACK] Seq=19196865 Ack=354526855 Win=65535 Len=0
1,2.056376000000455,62.210.85.178,10.0.2.15,TCP,60,9001  >  35978 [ACK] Seq=19196865 Ack=354528315 Win=65535 Len=0
1,2.0563810000003286,62.210.85.178,10.0.2.15,TCP,60,9001  >  35978 [ACK] Seq=19196865 Ack=354529465 Win=65535 Len=0
1,2.056420999999318,10.0.2.15,62.210.85.178,TLSv1.2,4124,Application Data
1,2.0564589999994496,62.210.85.178,10.0.2.15,TCP,60,9001  >  35978 [ACK] Seq=19196865 Ack=354530925 Win=65535 Len=0
1,2.0564680000006774,62.210.85.178,10.0.2.15,TCP,60,9001  >  35978 [ACK] Seq=19196865 Ack=354532385 Win=65535 Len=0
1,2.056473000000551,62.210.85.178,10.0.2.15,TCP,60,9001  >  35978 [ACK] Seq=19196865 Ack=354533535 Win=65535 Len=0
1,2.0565110000006825,10.0.2.15,62.210.85.178,TLSv1.2,4124,Application Data
1,2.0565499999993335,62.210.85.178,10.0.2.15,TCP,60,9001  >  35978 [ACK] Seq=19196865 Ack=354534995 Win=65535 Len=0
1,2.056558000000223,62.210.85.178,10.0.2.15,TCP,60,9001  >  35978 [ACK] Seq=19196865 Ack=354536455 Win=65535 Len=0
1,2.0565630000000965,62.210.85.178,10.0.2.15,TCP,60,9001  >  35978 [ACK] Seq=19196865 Ack=354537605 Win=65535 Len=0
1,2.0565999999998894,10.0.2.15,62.210.85.178,TLSv1.2,4124,Application Data
1,2.0566369999996823,62.210.85.178,10.0.2.15,TCP,60,9001  >  35978 [ACK] Seq=19196865 Ack=354539065 Win=65535 Len=0
1,2.056645999999091,62.210.85.178,10.0.2.15,TCP,60,9001  >  35978 [ACK] Seq=19196865 Ack=354540525 Win=65535 Len=0
1,2.0566500000004453,62.210.85.178,10.0.2.15,TCP,60,9001  >  35978 [ACK] Seq=19196865 Ack=354541675 Win=65535 Len=0
1,2.0566859999998996,10.0.2.15,62.210.85.178,TLSv1.2,332,Application Data
1,2.056721999999354,62.210.85.178,10.0.2.15,TCP,60,9001  >  35978 [ACK] Seq=19196865 Ack=354541953 Win=65535 Len=0
1,2.05677199999991,10.0.2.15,62.210.85.178,TLSv1.2,3868,Application Data
1,2.0568100000000413,62.210.85.178,10.0.2.15,TCP,60,9001  >  35978 [ACK] Seq=19196865 Ack=354543413 Win=65535 Len=0
1,2.0568199999997887,62.210.85.178,10.0.2.15,TCP,60,9001  >  35978 [ACK] Seq=19196865 Ack=354544873 Win=65535 Len=0
1,2.0568249999996624,62.210.85.178,10.0.2.15,TCP,60,9001  >  35978 [ACK] Seq=19196865 Ack=354545767 Win=65535 Len=0
1,2.056862999999794,10.0.2.15,62.210.85.178,TLSv1.2,4124,Application Data
1,2.0569009999999253,62.210.85.178,10.0.2.15,TCP,60,9001  >  35978 [ACK] Seq=19196865 Ack=354547227 Win=65535 Len=0
1,2.0569089999989956,62.210.85.178,10.0.2.15,TCP,60,9001  >  35978 [ACK] Seq=19196865 Ack=354548687 Win=65535 Len=0
1,2.0569130000003497,62.210.85.178,10.0.2.15,TCP,60,9001  >  35978 [ACK] Seq=19196865 Ack=354549837 Win=65535 Len=0
1,2.056946999999127,10.0.2.15,62.210.85.178,TLSv1.2,3030,Application Data
1,2.0569849999992584,62.210.85.178,10.0.2.15,TCP,60,9001  >  35978 [ACK] Seq=19196865 Ack=354551297 Win=65535 Len=0
1,2.0569930000001477,62.210.85.178,10.0.2.15,TCP,60,9001  >  35978 [ACK] Seq=19196865 Ack=354552757 Win=65535 Len=0
1,2.056996999999683,62.210.85.178,10.0.2.15,TCP,60,9001  >  35978 [ACK] Seq=19196865 Ack=354552813 Win=65535 Len=0
1,2.0695269999996526,10.0.2.15,62.210.85.178,TLSv1.2,4124,Application Data
1,2.069610999998986,62.210.85.178,10.0.2.15,TCP,60,9001  >  35978 [ACK] Seq=19196865 Ack=354554273 Win=65535 Len=0
1,2.0696200000002136,62.210.85.178,10.0.2.15,TCP,60,9001  >  35978 [ACK] Seq=19196865 Ack=354555733 Win=65535 Len=0
1,2.0696239999997488,62.210.85.178,10.0.2.15,TCP,60,9001  >  35978 [ACK] Seq=19196865 Ack=354556883 Win=65535 Len=0
1,2.0696640000005573,10.0.2.15,62.210.85.178,TLSv1.2,4124,Application Data
1,2.0697029999992083,62.210.85.178,10.0.2.15,TCP,60,9001  >  35978 [ACK] Seq=19196865 Ack=354558343 Win=65535 Len=0
1,2.069712000000436,62.210.85.178,10.0.2.15,TCP,60,9001  >  35978 [ACK] Seq=19196865 Ack=354559803 Win=65535 Len=0
1,2.0697159999999712,62.210.85.178,10.0.2.15,TCP,60,9001  >  35978 [ACK] Seq=19196865 Ack=354560953 Win=65535 Len=0
1,2.069755000000441,10.0.2.15,62.210.85.178,TLSv1.2,3802,Application Data
1,2.0697930000005726,62.210.85.178,10.0.2.15,TCP,60,9001  >  35978 [ACK] Seq=19196865 Ack=354562413 Win=65535 Len=0
1,2.069800999999643,62.210.85.178,10.0.2.15,TCP,60,9001  >  35978 [ACK] Seq=19196865 Ack=354563873 Win=65535 Len=0
1,2.069806999999855,62.210.85.178,10.0.2.15,TCP,60,9001  >  35978 [ACK] Seq=19196865 Ack=354564701 Win=65535 Len=0
1,2.1508969999995315,54.93.77.70,10.0.2.15,TLSv1.2,3674,Application Data
1,2.1510209999996732,10.0.2.15,54.93.77.70,TCP,54,34692  >  9001 [ACK] Seq=19273495 Ack=354185191 Win=65535 Len=0
1,2.2338239999990037,54.93.77.70,10.0.2.15,TLSv1.2,7294,"Application Data, Application Data"
1,2.2339630000005855,10.0.2.15,54.93.77.70,TCP,54,34692  >  9001 [ACK] Seq=19273495 Ack=354192431 Win=65535 Len=0
1,2.2438879999990604,54.93.77.70,10.0.2.15,TLSv1.2,3674,Application Data
1,2.2439329999997426,10.0.2.15,54.93.77.70,TCP,54,34692  >  9001 [ACK] Seq=19273495 Ack=354196051 Win=65535 Len=0
1,2.255059999999503,54.93.77.70,10.0.2.15,TLSv1.2,7294,Application Data
1,2.255130999999892,10.0.2.15,54.93.77.70,TCP,54,34692  >  9001 [ACK] Seq=19273495 Ack=354203291 Win=65535 Len=0
1,2.260796999999002,54.93.77.70,10.0.2.15,TLSv1.2,568,Application Data
1,2.26771700000063,54.93.77.70,10.0.2.15,TLSv1.2,4398,Application Data
1,2.2677609999991546,10.0.2.15,54.93.77.70,TCP,54,34692  >  9001 [ACK] Seq=19273495 Ack=354208149 Win=65535 Len=0
1,2.267917999999554,10.0.2.15,54.93.77.70,TLSv1.2,590,Application Data
1,2.267993999999817,54.93.77.70,10.0.2.15,TCP,60,9001  >  34692 [ACK] Seq=354208149 Ack=19274031 Win=65535 Len=0
1,2.268098000000464,54.93.77.70,10.0.2.15,TCP,2950,"9001  >  34692 [PSH, ACK] Seq=354208149 Ack=19274031 Win=65535 Len=2896 [TCP segment of a reassembled PDU]"
1,2.268131999999241,10.0.2.15,54.93.77.70,TCP,54,34692  >  9001 [ACK] Seq=19274031 Ack=354211045 Win=65535 Len=0
1,2.2781940000004397,54.93.77.70,10.0.2.15,TLSv1.2,2950,"Application Data, Application Data"
1,2.2782360000001063,10.0.2.15,54.93.77.70,TCP,54,34692  >  9001 [ACK] Seq=19274031 Ack=354213941 Win=65535 Len=0
1,2.279031000000032,54.93.77.70,10.0.2.15,TLSv1.2,8742,"Application Data, Application Data"
1,2.2790970000005473,10.0.2.15,54.93.77.70,TCP,54,34692  >  9001 [ACK] Seq=19274031 Ack=354222629 Win=65535 Len=0
1,2.2858329999999114,54.93.77.70,10.0.2.15,TLSv1.2,894,Application Data
1,2.287902000000031,54.93.77.70,10.0.2.15,TCP,2950,"9001  >  34692 [PSH, ACK] Seq=354223469 Ack=19274031 Win=65535 Len=2896 [TCP segment of a reassembled PDU]"
1,2.287942999999359,10.0.2.15,54.93.77.70,TCP,54,34692  >  9001 [ACK] Seq=19274031 Ack=354226365 Win=65535 Len=0
1,2.3038699999997334,54.93.77.70,10.0.2.15,TLSv1.2,2950,Application Data [TCP segment of a reassembled PDU]
1,2.3039580000004207,10.0.2.15,54.93.77.70,TCP,54,34692  >  9001 [ACK] Seq=19274031 Ack=354229261 Win=65535 Len=0
1,2.3040120000005118,54.93.77.70,10.0.2.15,TLSv1.2,1502,Application Data
1,2.3040820000005624,10.0.2.15,54.93.77.70,TCP,54,34692  >  9001 [ACK] Seq=19274031 Ack=354230709 Win=65535 Len=0
1,2.304324999999153,10.0.2.15,54.93.77.70,TLSv1.2,590,Application Data
1,2.3044090000003052,54.93.77.70,10.0.2.15,TCP,60,9001  >  34692 [ACK] Seq=354230709 Ack=19274567 Win=65535 Len=0
1,2.3103140000002895,54.93.77.70,10.0.2.15,TLSv1.2,5846,Application Data
1,2.3103989999999612,10.0.2.15,54.93.77.70,TCP,54,34692  >  9001 [ACK] Seq=19274567 Ack=354236501 Win=65535 Len=0
1,2.3110599999999977,54.93.77.70,10.0.2.15,TLSv1.2,2552,"Application Data, Application Data"
1,2.3111040000003413,10.0.2.15,54.93.77.70,TCP,54,34692  >  9001 [ACK] Seq=19274567 Ack=354238999 Win=65535 Len=0
1,2.3144179999999324,10.0.2.15,54.93.77.70,TLSv1.2,590,Application Data
1,2.314501000000746,54.93.77.70,10.0.2.15,TCP,60,9001  >  34692 [ACK] Seq=354238999 Ack=19275103 Win=65535 Len=0
1,2.3224410000002536,54.93.77.70,10.0.2.15,TLSv1.2,7294,Application Data
1,2.3225079999992886,10.0.2.15,54.93.77.70,TCP,54,34692  >  9001 [ACK] Seq=19275103 Ack=354246239 Win=65535 Len=0
1,2.3233930000005785,54.93.77.70,10.0.2.15,TLSv1.2,1502,Application Data [TCP segment of a reassembled PDU]
1,2.323432999999568,10.0.2.15,54.93.77.70,TCP,54,34692  >  9001 [ACK] Seq=19275103 Ack=354247687 Win=65535 Len=0
1,2.3270830000001297,54.93.77.70,10.0.2.15,TLSv1.2,1198,Application Data
1,2.3297029999994265,10.0.2.15,54.93.77.70,TLSv1.2,590,Application Data
1,2.329889999999068,54.93.77.70,10.0.2.15,TCP,60,9001  >  34692 [ACK] Seq=354248831 Ack=19275639 Win=65535 Len=0
1,2.3850769999990007,62.210.85.178,10.0.2.15,TLSv1.2,590,Application Data
1,2.4169419999998354,62.210.85.178,10.0.2.15,TLSv1.2,1104,Application Data
1,2.4170130000002246,10.0.2.15,62.210.85.178,TCP,54,35978  >  9001 [ACK] Seq=354564701 Ack=19198451 Win=65535 Len=0
1,2.508128999999826,62.210.85.178,10.0.2.15,TLSv1.2,590,Application Data
1,2.508643999999549,10.0.2.15,62.210.85.178,TLSv1.2,590,Application Data
1,2.508756999999605,62.210.85.178,10.0.2.15,TCP,60,9001  >  35978 [ACK] Seq=19198987 Ack=354565237 Win=65535 Len=0
1,2.8487009999989823,54.93.77.70,10.0.2.15,TLSv1.2,590,Application Data
1,2.8490710000005492,10.0.2.15,54.93.77.70,TLSv1.2,590,Application Data
1,2.8491790000007313,54.93.77.70,10.0.2.15,TCP,60,9001  >  34692 [ACK] Seq=354249367 Ack=19276175 Win=65535 Len=0
1,2.975851999999577,62.210.85.178,10.0.2.15,TLSv1.2,590,Application Data
1,2.9807010000004084,10.0.2.15,62.210.85.178,TLSv1.2,590,Application Data
1,2.980862000000343,62.210.85.178,10.0.2.15,TCP,60,9001  >  35978 [ACK] Seq=19199523 Ack=354565773 Win=65535 Len=0
1,2.9902320000001055,10.0.2.15,62.210.85.178,TLSv1.2,4124,Application Data
1,2.9903309999990597,10.0.2.15,62.210.85.178,TCP,2974,35978  >  9001 [ACK] Seq=354569843 Ack=19199523 Win=65535 Len=2920 [TCP segment of a reassembled PDU]
1,2.9903790000007575,62.210.85.178,10.0.2.15,TCP,60,9001  >  35978 [ACK] Seq=19199523 Ack=354567233 Win=65535 Len=0
1,2.990389000000505,62.210.85.178,10.0.2.15,TCP,60,9001  >  35978 [ACK] Seq=19199523 Ack=354568693 Win=65535 Len=0
1,2.9903940000003786,62.210.85.178,10.0.2.15,TCP,60,9001  >  35978 [ACK] Seq=19199523 Ack=354569843 Win=65535 Len=0
1,2.9904349999997066,10.0.2.15,62.210.85.178,TLSv1.2,1204,Application Data
1,2.9904740000001766,62.210.85.178,10.0.2.15,TCP,60,9001  >  35978 [ACK] Seq=19199523 Ack=354571303 Win=65535 Len=0
1,2.990481999999247,62.210.85.178,10.0.2.15,TCP,60,9001  >  35978 [ACK] Seq=19199523 Ack=354572763 Win=65535 Len=0
1,2.9904850000002625,62.210.85.178,10.0.2.15,TCP,60,9001  >  35978 [ACK] Seq=19199523 Ack=354573913 Win=65535 Len=0
1,2.990526999999929,10.0.2.15,62.210.85.178,TLSv1.2,4124,Application Data
1,2.990900999999212,62.210.85.178,10.0.2.15,TCP,60,9001  >  35978 [ACK] Seq=19199523 Ack=354575373 Win=65535 Len=0
1,2.9909150000003137,62.210.85.178,10.0.2.15,TCP,60,9001  >  35978 [ACK] Seq=19199523 Ack=354576833 Win=65535 Len=0
1,2.9909179999995104,62.210.85.178,10.0.2.15,TCP,60,9001  >  35978 [ACK] Seq=19199523 Ack=354577983 Win=65535 Len=0
1,2.990975000000617,10.0.2.15,62.210.85.178,TLSv1.2,4124,Application Data
1,2.9910189999991417,62.210.85.178,10.0.2.15,TCP,60,9001  >  35978 [ACK] Seq=19199523 Ack=354579443 Win=65535 Len=0
1,2.991027000000031,62.210.85.178,10.0.2.15,TCP,60,9001  >  35978 [ACK] Seq=19199523 Ack=354580903 Win=65535 Len=0
1,2.9910949999994045,10.0.2.15,62.210.85.178,TLSv1.2,2974,Application Data
1,2.9911620000002586,62.210.85.178,10.0.2.15,TCP,60,9001  >  35978 [ACK] Seq=19199523 Ack=354582053 Win=65535 Len=0
1,2.991174000000683,62.210.85.178,10.0.2.15,TCP,60,9001  >  35978 [ACK] Seq=19199523 Ack=354583513 Win=65535 Len=0
1,2.9911769999998796,62.210.85.178,10.0.2.15,TCP,60,9001  >  35978 [ACK] Seq=19199523 Ack=354584973 Win=65535 Len=0
1,2.9912079999994603,10.0.2.15,62.210.85.178,TLSv1.2,1226,Application Data
1,2.9912530000001425,62.210.85.178,10.0.2.15,TCP,60,9001  >  35978 [ACK] Seq=19199523 Ack=354586145 Win=65535 Len=0
1,2.9913070000002335,10.0.2.15,62.210.85.178,TLSv1.2,4124,Application Data
1,2.9913500000002387,62.210.85.178,10.0.2.15,TCP,60,9001  >  35978 [ACK] Seq=19199523 Ack=354587605 Win=65535 Len=0
1,2.991357999999309,62.210.85.178,10.0.2.15,TCP,60,9001  >  35978 [ACK] Seq=19199523 Ack=354589065 Win=65535 Len=0
1,2.991362000000663,62.210.85.178,10.0.2.15,TCP,60,9001  >  35978 [ACK] Seq=19199523 Ack=354590215 Win=65535 Len=0
1,2.9913999999989755,10.0.2.15,62.210.85.178,TLSv1.2,3030,Application Data
1,2.9914370000005874,62.210.85.178,10.0.2.15,TCP,60,9001  >  35978 [ACK] Seq=19199523 Ack=354591675 Win=65535 Len=0
1,2.9914459999999963,62.210.85.178,10.0.2.15,TCP,60,9001  >  35978 [ACK] Seq=19199523 Ack=354593135 Win=65535 Len=0
1,2.9914499999995314,62.210.85.178,10.0.2.15,TCP,60,9001  >  35978 [ACK] Seq=19199523 Ack=354593191 Win=65535 Len=0
1,3.0006819999998697,10.0.2.15,62.210.85.178,TLSv1.2,4124,Application Data
1,3.0007449999993696,62.210.85.178,10.0.2.15,TCP,60,9001  >  35978 [ACK] Seq=19199523 Ack=354594651 Win=65535 Len=0
1,3.0007580000001326,62.210.85.178,10.0.2.15,TCP,60,9001  >  35978 [ACK] Seq=19199523 Ack=354596111 Win=65535 Len=0
1,3.0007630000000063,62.210.85.178,10.0.2.15,TCP,60,9001  >  35978 [ACK] Seq=19199523 Ack=354597261 Win=65535 Len=0
1,3.000810999999885,10.0.2.15,62.210.85.178,TLSv1.2,4124,Application Data
1,3.0008529999995517,62.210.85.178,10.0.2.15,TCP,60,9001  >  35978 [ACK] Seq=19199523 Ack=354598721 Win=65535 Len=0
1,3.0008620000007795,62.210.85.178,10.0.2.15,TCP,60,9001  >  35978 [ACK] Seq=19199523 Ack=354600181 Win=65535 Len=0
1,3.0008660000003147,62.210.85.178,10.0.2.15,TCP,60,9001  >  35978 [ACK] Seq=19199523 Ack=354601331 Win=65535 Len=0
1,3.000905999999304,10.0.2.15,62.210.85.178,TLSv1.2,4124,Application Data
1,3.000944999999774,62.210.85.178,10.0.2.15,TCP,60,9001  >  35978 [ACK] Seq=19199523 Ack=354602791 Win=65535 Len=0
1,3.0009530000006635,62.210.85.178,10.0.2.15,TCP,60,9001  >  35978 [ACK] Seq=19199523 Ack=354604251 Win=65535 Len=0
1,3.000958000000537,62.210.85.178,10.0.2.15,TCP,60,9001  >  35978 [ACK] Seq=19199523 Ack=354605401 Win=65535 Len=0
1,3.00099500000033,10.0.2.15,62.210.85.178,TLSv1.2,4124,Application Data
1,3.0010330000004615,62.210.85.178,10.0.2.15,TCP,60,9001  >  35978 [ACK] Seq=19199523 Ack=354606861 Win=65535 Len=0
1,3.0010409999995318,62.210.85.178,10.0.2.15,TCP,60,9001  >  35978 [ACK] Seq=19199523 Ack=354608321 Win=65535 Len=0
1,3.0010459999994055,62.210.85.178,10.0.2.15,TCP,60,9001  >  35978 [ACK] Seq=19199523 Ack=354609471 Win=65535 Len=0
1,3.0010810000003403,10.0.2.15,62.210.85.178,TLSv1.2,332,Application Data
1,3.001118000000133,62.210.85.178,10.0.2.15,TCP,60,9001  >  35978 [ACK] Seq=19199523 Ack=354609749 Win=65535 Len=0
1,3.001169999999547,10.0.2.15,62.210.85.178,TLSv1.2,3868,Application Data
1,3.0012169999990874,62.210.85.178,10.0.2.15,TCP,60,9001  >  35978 [ACK] Seq=19199523 Ack=354611209 Win=65535 Len=0
1,3.0012249999999767,62.210.85.178,10.0.2.15,TCP,60,9001  >  35978 [ACK] Seq=19199523 Ack=354612669 Win=65535 Len=0
1,3.001228999999512,62.210.85.178,10.0.2.15,TCP,60,9001  >  35978 [ACK] Seq=19199523 Ack=354613563 Win=65535 Len=0
1,3.001297999999224,10.0.2.15,62.210.85.178,TLSv1.2,910,Application Data
1,3.0013380000000325,62.210.85.178,10.0.2.15,TCP,60,9001  >  35978 [ACK] Seq=19199523 Ack=354614419 Win=65535 Len=0
1,3.086757999999463,54.93.77.70,10.0.2.15,TLSv1.2,590,Application Data
1,3.1141349999998056,54.93.77.70,10.0.2.15,TCP,2950,"9001  >  34692 [PSH, ACK] Seq=354249903 Ack=19276175 Win=65535 Len=2896 [TCP segment of a reassembled PDU]"
1,3.114223000000493,54.93.77.70,10.0.2.15,TLSv1.2,1502,Application Data [TCP segment of a reassembled PDU]
1,3.1143109999993612,10.0.2.15,54.93.77.70,TCP,54,34692  >  9001 [ACK] Seq=19276175 Ack=354254247 Win=65535 Len=0
1,3.114642000000458,54.93.77.70,10.0.2.15,TLSv1.2,2950,Application Data [TCP segment of a reassembled PDU]
1,3.1146829999997863,10.0.2.15,54.93.77.70,TCP,54,34692  >  9001 [ACK] Seq=19276175 Ack=354257143 Win=65535 Len=0
1,3.130261000000246,54.93.77.70,10.0.2.15,TLSv1.2,76,Application Data
1,3.1374140000007174,54.93.77.70,10.0.2.15,TLSv1.2,4398,Application Data
1,3.1374890000006417,10.0.2.15,54.93.77.70,TCP,54,34692  >  9001 [ACK] Seq=19276175 Ack=354261509 Win=65535 Len=0
1,3.1377030000003288,54.93.77.70,10.0.2.15,TCP,2950,"9001  >  34692 [PSH, ACK] Seq=354261509 Ack=19276175 Win=65535 Len=2896 [TCP segment of a reassembled PDU]"
1,3.1377400000001217,10.0.2.15,54.93.77.70,TCP,54,34692  >  9001 [ACK] Seq=19276175 Ack=354264405 Win=65535 Len=0
1,3.154907000000094,54.93.77.70,10.0.2.15,TLSv1.2,568,Application Data
1,3.156659000000218,54.93.77.70,10.0.2.15,TCP,2950,"9001  >  34692 [PSH, ACK] Seq=354264919 Ack=19276175 Win=65535 Len=2896 [TCP segment of a reassembled PDU]"
1,3.1567049999994197,10.0.2.15,54.93.77.70,TCP,54,34692  >  9001 [ACK] Seq=19276175 Ack=354267815 Win=65535 Len=0
1,3.15851499999917,54.93.77.70,10.0.2.15,TLSv1.2,8742,"Application Data, Application Data"
1,3.1585789999990084,10.0.2.15,54.93.77.70,TCP,54,34692  >  9001 [ACK] Seq=19276175 Ack=354276503 Win=65535 Len=0
1,3.1665720000000874,54.93.77.70,10.0.2.15,TLSv1.2,5846,"Application Data, Application Data"
1,3.1666150000000926,10.0.2.15,54.93.77.70,TCP,54,34692  >  9001 [ACK] Seq=19276175 Ack=354282295 Win=65535 Len=0
1,3.1667839999990974,10.0.2.15,54.93.77.70,TLSv1.2,590,Application Data
1,3.166855999999825,54.93.77.70,10.0.2.15,TCP,60,9001  >  34692 [ACK] Seq=354282295 Ack=19276711 Win=65535 Len=0
1,3.1762180000005173,54.93.77.70,10.0.2.15,TLSv1.2,2950,Application Data [TCP segment of a reassembled PDU]
1,3.1762589999998454,10.0.2.15,54.93.77.70,TCP,54,34692  >  9001 [ACK] Seq=19276711 Ack=354285191 Win=65535 Len=0
1,3.176411000000371,10.0.2.15,54.93.77.70,TLSv1.2,590,Application Data
1,3.1764800000000832,54.93.77.70,10.0.2.15,TCP,60,9001  >  34692 [ACK] Seq=354285191 Ack=19277247 Win=65535 Len=0
1,3.1767390000004525,54.93.77.70,10.0.2.15,TLSv1.2,4094,"Application Data, Application Data"
1,3.176781000000119,10.0.2.15,54.93.77.70,TCP,54,34692  >  9001 [ACK] Seq=19277247 Ack=354289231 Win=65535 Len=0
1,3.178835999999137,54.93.77.70,10.0.2.15,TLSv1.2,4398,Application Data
1,3.1788780000006227,10.0.2.15,54.93.77.70,TCP,54,34692  >  9001 [ACK] Seq=19277247 Ack=354293575 Win=65535 Len=0
1,3.1945039999991423,54.93.77.70,10.0.2.15,TLSv1.2,380,Application Data
1,3.2220429999997577,54.93.77.70,10.0.2.15,TCP,2950,"9001  >  34692 [PSH, ACK] Seq=354293901 Ack=19277247 Win=65535 Len=2896 [TCP segment of a reassembled PDU]"
1,3.222153000000617,10.0.2.15,54.93.77.70,TCP,54,34692  >  9001 [ACK] Seq=19277247 Ack=354296797 Win=65535 Len=0
1,3.231180000000677,54.93.77.70,10.0.2.15,TLSv1.2,1502,Application Data [TCP segment of a reassembled PDU]
1,3.2312349999992875,10.0.2.15,54.93.77.70,TCP,54,34692  >  9001 [ACK] Seq=19277247 Ack=354298245 Win=65535 Len=0
1,3.2381330000007438,54.93.77.70,10.0.2.15,TLSv1.2,380,Application Data
1,3.2405629999993835,10.0.2.15,54.93.77.70,TLSv1.2,590,Application Data
1,3.2407229999989795,54.93.77.70,10.0.2.15,TCP,60,9001  >  34692 [ACK] Seq=354298571 Ack=19277783 Win=65535 Len=0
1,3.295771999999488,62.210.85.178,10.0.2.15,TLSv1.2,590,Application Data
1,3.337320999999065,10.0.2.15,62.210.85.178,TCP,54,35978  >  9001 [ACK] Seq=354614419 Ack=19200059 Win=65535 Len=0
1,3.3599360000007437,62.210.85.178,10.0.2.15,TLSv1.2,1104,Application Data
1,3.359991999999693,10.0.2.15,62.210.85.178,TCP,54,35978  >  9001 [ACK] Seq=354614419 Ack=19201109 Win=65535 Len=0
1,3.360464999999749,10.0.2.15,62.210.85.178,TLSv1.2,590,Application Data
1,3.3605640000005224,62.210.85.178,10.0.2.15,TCP,60,9001  >  35978 [ACK] Seq=19201109 Ack=354614955 Win=65535 Len=0
1,3.5649819999998726,54.93.77.70,10.0.2.15,TLSv1.2,590,Application Data
1,3.565372999999454,10.0.2.15,54.93.77.70,TLSv1.2,590,Application Data
1,3.7733189999999013,10.0.2.15,54.93.77.70,TCP,590,"[TCP Retransmission] 34692  >  9001 [PSH, ACK] Seq=19277783 Ack=354299107 Win=65535 Len=536"
1,3.7733919999991485,54.93.77.70,10.0.2.15,TCP,60,9001  >  34692 [ACK] Seq=354299107 Ack=19278319 Win=65535 Len=0
1,3.7734049999999115,54.93.77.70,10.0.2.15,TCP,60,[TCP Dup ACK 760943#1] 9001  >  34692 [ACK] Seq=354299107 Ack=19278319 Win=65535 Len=0
1,4.082166000000143,62.210.85.178,10.0.2.15,TLSv1.2,590,Application Data
1,4.088866000000053,10.0.2.15,62.210.85.178,TLSv1.2,590,Application Data
1,4.089012000000366,62.210.85.178,10.0.2.15,TCP,60,9001  >  35978 [ACK] Seq=19201645 Ack=354615491 Win=65535 Len=0
1,4.097711000000345,10.0.2.15,62.210.85.178,TLSv1.2,4124,Application Data
1,4.097830000000613,10.0.2.15,62.210.85.178,TCP,2974,35978  >  9001 [ACK] Seq=354619561 Ack=19201645 Win=65535 Len=2920 [TCP segment of a reassembled PDU]
1,4.097878999999011,62.210.85.178,10.0.2.15,TCP,60,9001  >  35978 [ACK] Seq=19201645 Ack=354616951 Win=65535 Len=0
1,4.097893000000113,62.210.85.178,10.0.2.15,TCP,60,9001  >  35978 [ACK] Seq=19201645 Ack=354618411 Win=65535 Len=0
1,4.097899000000325,62.210.85.178,10.0.2.15,TCP,60,9001  >  35978 [ACK] Seq=19201645 Ack=354619561 Win=65535 Len=0
1,4.097904000000199,62.210.85.178,10.0.2.15,TCP,60,9001  >  35978 [ACK] Seq=19201645 Ack=354621021 Win=65535 Len=0
1,4.097906999999395,62.210.85.178,10.0.2.15,TCP,60,9001  >  35978 [ACK] Seq=19201645 Ack=354622481 Win=65535 Len=0
1,4.097943999999188,10.0.2.15,62.210.85.178,TLSv1.2,1204,Application Data
1,4.097983999999997,62.210.85.178,10.0.2.15,TCP,60,9001  >  35978 [ACK] Seq=19201645 Ack=354623631 Win=65535 Len=0
1,4.098029000000679,10.0.2.15,62.210.85.178,TLSv1.2,4124,Application Data
1,4.0980689999996684,62.210.85.178,10.0.2.15,TCP,60,9001  >  35978 [ACK] Seq=19201645 Ack=354625091 Win=65535 Len=0
1,4.098077999999077,62.210.85.178,10.0.2.15,TCP,60,9001  >  35978 [ACK] Seq=19201645 Ack=354626551 Win=65535 Len=0
1,4.098082000000431,62.210.85.178,10.0.2.15,TCP,60,9001  >  35978 [ACK] Seq=19201645 Ack=354627701 Win=65535 Len=0
1,4.098128999999972,10.0.2.15,62.210.85.178,TLSv1.2,4124,Application Data
1,4.098165999999765,62.210.85.178,10.0.2.15,TCP,60,9001  >  35978 [ACK] Seq=19201645 Ack=354629161 Win=65535 Len=0
1,4.098174000000654,62.210.85.178,10.0.2.15,TCP,60,9001  >  35978 [ACK] Seq=19201645 Ack=354630621 Win=65535 Len=0
1,4.098238000000492,10.0.2.15,62.210.85.178,TLSv1.2,2974,Application Data
1,4.09827899999982,62.210.85.178,10.0.2.15,TCP,60,9001  >  35978 [ACK] Seq=19201645 Ack=354631771 Win=65535 Len=0
1,4.098286000000371,62.210.85.178,10.0.2.15,TCP,60,9001  >  35978 [ACK] Seq=19201645 Ack=354633231 Win=65535 Len=0
1,4.098289999999906,62.210.85.178,10.0.2.15,TCP,60,9001  >  35978 [ACK] Seq=19201645 Ack=354634691 Win=65535 Len=0
1,4.098316999999952,10.0.2.15,62.210.85.178,TLSv1.2,1226,Application Data
1,4.098352999999406,62.210.85.178,10.0.2.15,TCP,60,9001  >  35978 [ACK] Seq=19201645 Ack=354635863 Win=65535 Len=0
1,4.098394000000553,10.0.2.15,62.210.85.178,TLSv1.2,4124,Application Data
1,4.098432999999204,62.210.85.178,10.0.2.15,TCP,60,9001  >  35978 [ACK] Seq=19201645 Ack=354637323 Win=65535 Len=0
1,4.0984410000000935,62.210.85.178,10.0.2.15,TCP,60,9001  >  35978 [ACK] Seq=19201645 Ack=354638783 Win=65535 Len=0
1,4.09844399999929,62.210.85.178,10.0.2.15,TCP,60,9001  >  35978 [ACK] Seq=19201645 Ack=354639933 Win=65535 Len=0
1,4.0984819999994215,10.0.2.15,62.210.85.178,TLSv1.2,3030,Application Data
1,4.098519999999553,62.210.85.178,10.0.2.15,TCP,60,9001  >  35978 [ACK] Seq=19201645 Ack=354641393 Win=65535 Len=0
1,4.098528000000442,62.210.85.178,10.0.2.15,TCP,60,9001  >  35978 [ACK] Seq=19201645 Ack=354642853 Win=65535 Len=0
1,4.098531999999977,62.210.85.178,10.0.2.15,TCP,60,9001  >  35978 [ACK] Seq=19201645 Ack=354642909 Win=65535 Len=0
1,4.11004099999991,10.0.2.15,62.210.85.178,TLSv1.2,4124,Application Data
1,4.110155000000304,62.210.85.178,10.0.2.15,TCP,60,9001  >  35978 [ACK] Seq=19201645 Ack=354644369 Win=65535 Len=0
1,4.110167999999248,62.210.85.178,10.0.2.15,TCP,60,9001  >  35978 [ACK] Seq=19201645 Ack=354645829 Win=65535 Len=0
1,4.110172000000603,62.210.85.178,10.0.2.15,TCP,60,9001  >  35978 [ACK] Seq=19201645 Ack=354646979 Win=65535 Len=0
1,4.110216999999466,10.0.2.15,62.210.85.178,TLSv1.2,4124,Application Data
1,4.1102890000001935,62.210.85.178,10.0.2.15,TCP,60,9001  >  35978 [ACK] Seq=19201645 Ack=354648439 Win=65535 Len=0
1,4.110296999999264,62.210.85.178,10.0.2.15,TCP,60,9001  >  35978 [ACK] Seq=19201645 Ack=354649899 Win=65535 Len=0
1,4.110300000000279,62.210.85.178,10.0.2.15,TCP,60,9001  >  35978 [ACK] Seq=19201645 Ack=354651049 Win=65535 Len=0
1,4.110335999999734,10.0.2.15,62.210.85.178,TLSv1.2,4124,Application Data
1,4.110372999999527,62.210.85.178,10.0.2.15,TCP,60,9001  >  35978 [ACK] Seq=19201645 Ack=354652509 Win=65535 Len=0
1,4.1103820000007545,62.210.85.178,10.0.2.15,TCP,60,9001  >  35978 [ACK] Seq=19201645 Ack=354653969 Win=65535 Len=0
1,4.110387000000628,62.210.85.178,10.0.2.15,TCP,60,9001  >  35978 [ACK] Seq=19201645 Ack=354655119 Win=65535 Len=0
1,4.11042500000076,10.0.2.15,62.210.85.178,TLSv1.2,4124,Application Data
1,4.110473999999158,62.210.85.178,10.0.2.15,TCP,60,9001  >  35978 [ACK] Seq=19201645 Ack=354656579 Win=65535 Len=0
1,4.110480999999709,62.210.85.178,10.0.2.15,TCP,60,9001  >  35978 [ACK] Seq=19201645 Ack=354658039 Win=65535 Len=0
1,4.110484000000724,62.210.85.178,10.0.2.15,TCP,60,9001  >  35978 [ACK] Seq=19201645 Ack=354659189 Win=65535 Len=0
1,4.110517999999502,10.0.2.15,62.210.85.178,TLSv1.2,332,Application Data
1,4.110588999999891,62.210.85.178,10.0.2.15,TCP,60,9001  >  35978 [ACK] Seq=19201645 Ack=354659467 Win=65535 Len=0
1,4.110662999999477,10.0.2.15,62.210.85.178,TLSv1.2,3868,Application Data
1,4.110709999999017,62.210.85.178,10.0.2.15,TCP,60,9001  >  35978 [ACK] Seq=19201645 Ack=354660927 Win=65535 Len=0
1,4.110717999999906,62.210.85.178,10.0.2.15,TCP,60,9001  >  35978 [ACK] Seq=19201645 Ack=354662387 Win=65535 Len=0
1,4.110721999999441,62.210.85.178,10.0.2.15,TCP,60,9001  >  35978 [ACK] Seq=19201645 Ack=354663281 Win=65535 Len=0
1,4.110760999999911,10.0.2.15,62.210.85.178,TLSv1.2,4124,Application Data
1,4.110800000000381,62.210.85.178,10.0.2.15,TCP,60,9001  >  35978 [ACK] Seq=19201645 Ack=354664741 Win=65535 Len=0
1,4.110807999999452,62.210.85.178,10.0.2.15,TCP,60,9001  >  35978 [ACK] Seq=19201645 Ack=354666201 Win=65535 Len=0
1,4.110811999998987,62.210.85.178,10.0.2.15,TCP,60,9001  >  35978 [ACK] Seq=19201645 Ack=354667351 Win=65535 Len=0
1,4.1108469999999215,10.0.2.15,62.210.85.178,TLSv1.2,3030,Application Data
1,4.110885000000053,62.210.85.178,10.0.2.15,TCP,60,9001  >  35978 [ACK] Seq=19201645 Ack=354668811 Win=65535 Len=0
1,4.110892999999123,62.210.85.178,10.0.2.15,TCP,60,9001  >  35978 [ACK] Seq=19201645 Ack=354670271 Win=65535 Len=0
1,4.110897000000477,62.210.85.178,10.0.2.15,TCP,60,9001  >  35978 [ACK] Seq=19201645 Ack=354670327 Win=65535 Len=0
1,4.12011800000073,10.0.2.15,62.210.85.178,TLSv1.2,4124,Application Data
1,4.120171000000482,62.210.85.178,10.0.2.15,TCP,60,9001  >  35978 [ACK] Seq=19201645 Ack=354671787 Win=65535 Len=0
1,4.120182999999088,62.210.85.178,10.0.2.15,TCP,60,9001  >  35978 [ACK] Seq=19201645 Ack=354673247 Win=65535 Len=0
1,4.1201880000007804,62.210.85.178,10.0.2.15,TCP,60,9001  >  35978 [ACK] Seq=19201645 Ack=354674397 Win=65535 Len=0
1,4.120233999999982,10.0.2.15,62.210.85.178,TLSv1.2,4124,Application Data
1,4.120273999998972,62.210.85.178,10.0.2.15,TCP,60,9001  >  35978 [ACK] Seq=19201645 Ack=354675857 Win=65535 Len=0
1,4.1202830000001995,62.210.85.178,10.0.2.15,TCP,60,9001  >  35978 [ACK] Seq=19201645 Ack=354677317 Win=65535 Len=0
1,4.120288000000073,62.210.85.178,10.0.2.15,TCP,60,9001  >  35978 [ACK] Seq=19201645 Ack=354678467 Win=65535 Len=0
1,4.120326000000205,10.0.2.15,62.210.85.178,TLSv1.2,4124,Application Data
1,4.120365000000675,62.210.85.178,10.0.2.15,TCP,60,9001  >  35978 [ACK] Seq=19201645 Ack=354679927 Win=65535 Len=0
1,4.120372999999745,62.210.85.178,10.0.2.15,TCP,60,9001  >  35978 [ACK] Seq=19201645 Ack=354681387 Win=65535 Len=0
1,4.120378999999957,62.210.85.178,10.0.2.15,TCP,60,9001  >  35978 [ACK] Seq=19201645 Ack=354682537 Win=65535 Len=0
1,4.120418000000427,10.0.2.15,62.210.85.178,TLSv1.2,4124,Application Data
1,4.120456000000559,62.210.85.178,10.0.2.15,TCP,60,9001  >  35978 [ACK] Seq=19201645 Ack=354683997 Win=65535 Len=0
1,4.120463999999629,62.210.85.178,10.0.2.15,TCP,60,9001  >  35978 [ACK] Seq=19201645 Ack=354685457 Win=65535 Len=0
1,4.120468999999503,62.210.85.178,10.0.2.15,TCP,60,9001  >  35978 [ACK] Seq=19201645 Ack=354686607 Win=65535 Len=0
1,4.120503000000099,10.0.2.15,62.210.85.178,TLSv1.2,332,Application Data
1,4.12054100000023,62.210.85.178,10.0.2.15,TCP,60,9001  >  35978 [ACK] Seq=19201645 Ack=354686885 Win=65535 Len=0
1,4.120593999999983,10.0.2.15,62.210.85.178,TLSv1.2,3868,Application Data
1,4.120633000000453,62.210.85.178,10.0.2.15,TCP,60,9001  >  35978 [ACK] Seq=19201645 Ack=354688345 Win=65535 Len=0
1,4.120640999999523,62.210.85.178,10.0.2.15,TCP,60,9001  >  35978 [ACK] Seq=19201645 Ack=354689805 Win=65535 Len=0
1,4.120645999999397,62.210.85.178,10.0.2.15,TCP,60,9001  >  35978 [ACK] Seq=19201645 Ack=354690699 Win=65535 Len=0
1,4.120684999999867,10.0.2.15,62.210.85.178,TLSv1.2,4124,Application Data
1,4.120757999999114,62.210.85.178,10.0.2.15,TCP,60,9001  >  35978 [ACK] Seq=19201645 Ack=354692159 Win=65535 Len=0
1,4.120764999999665,62.210.85.178,10.0.2.15,TCP,60,9001  >  35978 [ACK] Seq=19201645 Ack=354693619 Win=65535 Len=0
1,4.12076800000068,62.210.85.178,10.0.2.15,TCP,60,9001  >  35978 [ACK] Seq=19201645 Ack=354694769 Win=65535 Len=0
1,4.120795000000726,10.0.2.15,62.210.85.178,TCP,2974,35978  >  9001 [ACK] Seq=354694769 Ack=19201645 Win=65535 Len=2920 [TCP segment of a reassembled PDU]
1,4.120833999999377,62.210.85.178,10.0.2.15,TCP,60,9001  >  35978 [ACK] Seq=19201645 Ack=354696229 Win=65535 Len=0
1,4.120840999999928,62.210.85.178,10.0.2.15,TCP,60,9001  >  35978 [ACK] Seq=19201645 Ack=354697689 Win=65535 Len=0
1,4.12087000000065,10.0.2.15,62.210.85.178,TLSv1.2,110,Application Data
1,4.1209060000001045,62.210.85.178,10.0.2.15,TCP,60,9001  >  35978 [ACK] Seq=19201645 Ack=354697745 Win=65535 Len=0
1,4.133418999999776,10.0.2.15,62.210.85.178,TLSv1.2,1618,Application Data
