No.,Time,Source,Destination,Protocol,Length,Info
1,0.022379000000000815,10.0.2.15,54.93.77.70,TCP,54,34692  >  9001 [ACK] Seq=19071055 Ack=350479075 Win=65535 Len=0
1,0.14867000000049302,10.0.2.15,54.93.77.70,TLSv1.2,590,Application Data
1,0.14888500000051863,54.93.77.70,10.0.2.15,TCP,60,9001  >  34692 [ACK] Seq=350479075 Ack=19071591 Win=65535 Len=0
1,0.30687200000102166,62.210.85.178,10.0.2.15,TLSv1.2,590,Application Data
1,0.3069489999998041,10.0.2.15,62.210.85.178,TCP,54,35978  >  9001 [ACK] Seq=350802257 Ack=19004065 Win=65535 Len=0
1,0.30741200000011304,10.0.2.15,62.210.85.178,TLSv1.2,590,Application Data
1,0.3075140000000829,62.210.85.178,10.0.2.15,TCP,60,9001  >  35978 [ACK] Seq=19004065 Ack=350802793 Win=65535 Len=0
1,0.5281560000003083,54.93.77.70,10.0.2.15,TLSv1.2,590,Application Data
1,0.5282330000009097,10.0.2.15,54.93.77.70,TCP,54,34692  >  9001 [ACK] Seq=19071591 Ack=350479611 Win=65535 Len=0
1,0.5286159999996016,10.0.2.15,54.93.77.70,TLSv1.2,1618,Application Data
1,0.5287179999995715,54.93.77.70,10.0.2.15,TCP,60,9001  >  34692 [ACK] Seq=350479611 Ack=19073051 Win=65535 Len=0
1,0.5287299999999959,54.93.77.70,10.0.2.15,TCP,60,9001  >  34692 [ACK] Seq=350479611 Ack=19073155 Win=65535 Len=0
1,0.7278630000000703,62.210.85.178,10.0.2.15,TLSv1.2,1618,Application Data
1,0.7280009999994945,10.0.2.15,62.210.85.178,TCP,54,35978  >  9001 [ACK] Seq=350802793 Ack=19005629 Win=65535 Len=0
1,0.7497889999995095,10.0.2.15,62.210.85.178,TLSv1.2,590,Application Data
1,0.7500140000011015,62.210.85.178,10.0.2.15,TCP,60,9001  >  35978 [ACK] Seq=19005629 Ack=350803329 Win=65535 Len=0
1,0.7606869999999617,10.0.2.15,62.210.85.178,TLSv1.2,1618,Application Data
1,0.7608880000007048,62.210.85.178,10.0.2.15,TCP,60,9001  >  35978 [ACK] Seq=19005629 Ack=350804789 Win=65535 Len=0
1,0.7609130000000732,62.210.85.178,10.0.2.15,TCP,60,9001  >  35978 [ACK] Seq=19005629 Ack=350804893 Win=65535 Len=0
1,0.8461090000000695,54.93.77.70,10.0.2.15,TLSv1.2,590,Application Data
1,0.8882680000006076,10.0.2.15,54.93.77.70,TCP,54,34692  >  9001 [ACK] Seq=19073155 Ack=350480147 Win=65535 Len=0
1,0.8949489999995421,54.93.77.70,10.0.2.15,TLSv1.2,1618,Application Data
1,0.8950060000006488,10.0.2.15,54.93.77.70,TCP,54,34692  >  9001 [ACK] Seq=19073155 Ack=350481711 Win=65535 Len=0
1,0.8976299999994808,10.0.2.15,54.93.77.70,TLSv1.2,590,Application Data
1,0.897806999999375,54.93.77.70,10.0.2.15,TCP,60,9001  >  34692 [ACK] Seq=350481711 Ack=19073691 Win=65535 Len=0
1,0.9995689999996102,62.210.85.178,10.0.2.15,TLSv1.2,590,Application Data
1,0.9998959999993531,10.0.2.15,62.210.85.178,TLSv1.2,590,Application Data
1,1.0000319999999192,62.210.85.178,10.0.2.15,TCP,60,9001  >  35978 [ACK] Seq=19006165 Ack=350805429 Win=65535 Len=0
1,1.0977830000010727,54.93.77.70,10.0.2.15,TLSv1.2,590,Application Data
1,1.09823200000028,10.0.2.15,54.93.77.70,TLSv1.2,590,Application Data
1,1.098323000000164,54.93.77.70,10.0.2.15,TCP,60,9001  >  34692 [ACK] Seq=350482247 Ack=19074227 Win=65535 Len=0
1,1.4511430000002292,62.210.85.178,10.0.2.15,TLSv1.2,590,Application Data
1,1.4552230000008421,10.0.2.15,62.210.85.178,TLSv1.2,590,Application Data
1,1.4554100000004837,62.210.85.178,10.0.2.15,TCP,60,9001  >  35978 [ACK] Seq=19006701 Ack=350805965 Win=65535 Len=0
1,1.4650469999996858,10.0.2.15,62.210.85.178,TLSv1.2,4124,Application Data
1,1.4654940000000352,62.210.85.178,10.0.2.15,TCP,60,9001  >  35978 [ACK] Seq=19006701 Ack=350807425 Win=65535 Len=0
1,1.4655170000005455,62.210.85.178,10.0.2.15,TCP,60,9001  >  35978 [ACK] Seq=19006701 Ack=350808885 Win=65535 Len=0
1,1.4655210000000807,62.210.85.178,10.0.2.15,TCP,60,9001  >  35978 [ACK] Seq=19006701 Ack=350810035 Win=65535 Len=0
1,1.4656009999998787,10.0.2.15,62.210.85.178,TLSv1.2,3738,Application Data
1,1.4657029999998485,62.210.85.178,10.0.2.15,TCP,60,9001  >  35978 [ACK] Seq=19006701 Ack=350811495 Win=65535 Len=0
1,1.4657399999996414,62.210.85.178,10.0.2.15,TCP,60,9001  >  35978 [ACK] Seq=19006701 Ack=350812955 Win=65535 Len=0
1,1.465743000000657,62.210.85.178,10.0.2.15,TCP,60,9001  >  35978 [ACK] Seq=19006701 Ack=350813719 Win=65535 Len=0
1,1.5622270000003482,54.93.77.70,10.0.2.15,TLSv1.2,590,Application Data
1,1.584898000000976,54.93.77.70,10.0.2.15,TCP,2950,"9001  >  34692 [PSH, ACK] Seq=350482783 Ack=19074227 Win=65535 Len=2896 [TCP segment of a reassembled PDU]"
1,1.585016999999425,10.0.2.15,54.93.77.70,TCP,54,34692  >  9001 [ACK] Seq=19074227 Ack=350485679 Win=65535 Len=0
1,1.595607999999629,54.93.77.70,10.0.2.15,TLSv1.2,2950,Application Data [TCP segment of a reassembled PDU]
1,1.5956519999999728,10.0.2.15,54.93.77.70,TCP,54,34692  >  9001 [ACK] Seq=19074227 Ack=350488575 Win=65535 Len=0
1,1.5957309999994322,54.93.77.70,10.0.2.15,TLSv1.2,1502,Application Data
1,1.5957720000005793,10.0.2.15,54.93.77.70,TCP,54,34692  >  9001 [ACK] Seq=19074227 Ack=350490023 Win=65535 Len=0
1,1.6048750000009022,10.0.2.15,54.93.77.70,TLSv1.2,590,Application Data
1,1.6049920000004931,54.93.77.70,10.0.2.15,TCP,60,9001  >  34692 [ACK] Seq=350490023 Ack=19074763 Win=65535 Len=0
1,1.6150770000003831,10.0.2.15,54.93.77.70,TLSv1.2,590,Application Data
1,1.6152120000006107,54.93.77.70,10.0.2.15,TCP,60,9001  >  34692 [ACK] Seq=350490023 Ack=19075299 Win=65535 Len=0
1,1.6640690000003815,54.93.77.70,10.0.2.15,TLSv1.2,590,Application Data
1,1.7042870000004768,10.0.2.15,54.93.77.70,TCP,54,34692  >  9001 [ACK] Seq=19075299 Ack=350490559 Win=65535 Len=0
1,1.739951999999903,62.210.85.178,10.0.2.15,TLSv1.2,590,Application Data
1,1.780307000000903,10.0.2.15,62.210.85.178,TCP,54,35978  >  9001 [ACK] Seq=350813719 Ack=19007237 Win=65535 Len=0
1,1.800413999999364,62.210.85.178,10.0.2.15,TLSv1.2,590,Application Data
1,1.8004780000010214,10.0.2.15,62.210.85.178,TCP,54,35978  >  9001 [ACK] Seq=350813719 Ack=19007773 Win=65535 Len=0
1,1.8008260000005976,10.0.2.15,62.210.85.178,TLSv1.2,590,Application Data
1,1.8009450000008655,62.210.85.178,10.0.2.15,TCP,60,9001  >  35978 [ACK] Seq=19007773 Ack=350814255 Win=65535 Len=0
1,1.9093179999999847,54.93.77.70,10.0.2.15,TLSv1.2,590,Application Data
1,1.9094160000004194,10.0.2.15,54.93.77.70,TCP,54,34692  >  9001 [ACK] Seq=19075299 Ack=350491095 Win=65535 Len=0
1,1.9098240000002988,10.0.2.15,54.93.77.70,TLSv1.2,590,Application Data
1,1.9099459999997634,54.93.77.70,10.0.2.15,TCP,60,9001  >  34692 [ACK] Seq=350491095 Ack=19075835 Win=65535 Len=0
1,2.0179210000005696,62.210.85.178,10.0.2.15,TLSv1.2,590,Application Data
1,2.0270000000000437,10.0.2.15,62.210.85.178,TLSv1.2,590,Application Data
1,2.027169999999387,62.210.85.178,10.0.2.15,TCP,60,9001  >  35978 [ACK] Seq=19008309 Ack=350814791 Win=65535 Len=0
1,2.0410219999994297,10.0.2.15,62.210.85.178,TLSv1.2,4124,Application Data
1,2.0411239999993995,10.0.2.15,62.210.85.178,TCP,2974,35978  >  9001 [ACK] Seq=350818861 Ack=19008309 Win=65535 Len=2920 [TCP segment of a reassembled PDU]
1,2.0411690000000817,62.210.85.178,10.0.2.15,TCP,60,9001  >  35978 [ACK] Seq=19008309 Ack=350816251 Win=65535 Len=0
1,2.041178999999829,62.210.85.178,10.0.2.15,TCP,60,9001  >  35978 [ACK] Seq=19008309 Ack=350817711 Win=65535 Len=0
1,2.041183999999703,62.210.85.178,10.0.2.15,TCP,60,9001  >  35978 [ACK] Seq=19008309 Ack=350818861 Win=65535 Len=0
1,2.041188000001057,62.210.85.178,10.0.2.15,TCP,60,9001  >  35978 [ACK] Seq=19008309 Ack=350820321 Win=65535 Len=0
1,2.041192000000592,62.210.85.178,10.0.2.15,TCP,60,9001  >  35978 [ACK] Seq=19008309 Ack=350821781 Win=65535 Len=0
1,2.041235000000597,10.0.2.15,62.210.85.178,TLSv1.2,1204,Application Data
1,2.041302999999971,10.0.2.15,62.210.85.178,TCP,2974,35978  >  9001 [ACK] Seq=350822931 Ack=19008309 Win=65535 Len=2920 [TCP segment of a reassembled PDU]
1,2.0413399999997637,62.210.85.178,10.0.2.15,TCP,60,9001  >  35978 [ACK] Seq=19008309 Ack=350822931 Win=65535 Len=0
1,2.041345999999976,62.210.85.178,10.0.2.15,TCP,60,9001  >  35978 [ACK] Seq=19008309 Ack=350824391 Win=65535 Len=0
1,2.0413509999998496,62.210.85.178,10.0.2.15,TCP,60,9001  >  35978 [ACK] Seq=19008309 Ack=350825851 Win=65535 Len=0
1,2.041385000000446,10.0.2.15,62.210.85.178,TLSv1.2,1204,Application Data
1,2.041450000000623,10.0.2.15,62.210.85.178,TCP,2974,35978  >  9001 [ACK] Seq=350827001 Ack=19008309 Win=65535 Len=2920 [TCP segment of a reassembled PDU]
1,2.041489000001093,62.210.85.178,10.0.2.15,TCP,60,9001  >  35978 [ACK] Seq=19008309 Ack=350827001 Win=65535 Len=0
1,2.041494999999486,62.210.85.178,10.0.2.15,TCP,60,9001  >  35978 [ACK] Seq=19008309 Ack=350828461 Win=65535 Len=0
1,2.0415009999996983,62.210.85.178,10.0.2.15,TCP,60,9001  >  35978 [ACK] Seq=19008309 Ack=350829921 Win=65535 Len=0
1,2.0415329999996175,10.0.2.15,62.210.85.178,TLSv1.2,1204,Application Data
1,2.041596999999456,62.210.85.178,10.0.2.15,TCP,60,9001  >  35978 [ACK] Seq=19008309 Ack=350831071 Win=65535 Len=0
1,2.0416349999995873,10.0.2.15,62.210.85.178,TLSv1.2,332,Application Data
1,2.04167199999938,62.210.85.178,10.0.2.15,TCP,60,9001  >  35978 [ACK] Seq=19008309 Ack=350831349 Win=65535 Len=0
1,2.0417539999998553,10.0.2.15,62.210.85.178,TLSv1.2,3868,Application Data
1,2.0417969999998604,62.210.85.178,10.0.2.15,TCP,60,9001  >  35978 [ACK] Seq=19008309 Ack=350832809 Win=65535 Len=0
1,2.041804000000411,62.210.85.178,10.0.2.15,TCP,60,9001  >  35978 [ACK] Seq=19008309 Ack=350834269 Win=65535 Len=0
1,2.0418079999999463,62.210.85.178,10.0.2.15,TCP,60,9001  >  35978 [ACK] Seq=19008309 Ack=350835163 Win=65535 Len=0
1,2.041854000000967,10.0.2.15,62.210.85.178,TLSv1.2,4124,Application Data
1,2.0418939999999566,62.210.85.178,10.0.2.15,TCP,60,9001  >  35978 [ACK] Seq=19008309 Ack=350836623 Win=65535 Len=0
1,2.0419010000005073,62.210.85.178,10.0.2.15,TCP,60,9001  >  35978 [ACK] Seq=19008309 Ack=350838083 Win=65535 Len=0
1,2.041906000000381,62.210.85.178,10.0.2.15,TCP,60,9001  >  35978 [ACK] Seq=19008309 Ack=350839233 Win=65535 Len=0
1,2.0419500000007247,10.0.2.15,62.210.85.178,TLSv1.2,3030,Application Data
1,2.0420460000004823,62.210.85.178,10.0.2.15,TCP,60,9001  >  35978 [ACK] Seq=19008309 Ack=350840693 Win=65535 Len=0
1,2.042059999999765,62.210.85.178,10.0.2.15,TCP,60,9001  >  35978 [ACK] Seq=19008309 Ack=350842153 Win=65535 Len=0
1,2.0420649999996385,62.210.85.178,10.0.2.15,TCP,60,9001  >  35978 [ACK] Seq=19008309 Ack=350842209 Win=65535 Len=0
1,2.051171000000977,10.0.2.15,62.210.85.178,TLSv1.2,4124,Application Data
1,2.0512550000003102,10.0.2.15,62.210.85.178,TCP,2974,35978  >  9001 [ACK] Seq=350846279 Ack=19008309 Win=65535 Len=2920 [TCP segment of a reassembled PDU]
1,2.0512930000004417,62.210.85.178,10.0.2.15,TCP,60,9001  >  35978 [ACK] Seq=19008309 Ack=350843669 Win=65535 Len=0
1,2.051300999999512,62.210.85.178,10.0.2.15,TCP,60,9001  >  35978 [ACK] Seq=19008309 Ack=350845129 Win=65535 Len=0
1,2.051305000000866,62.210.85.178,10.0.2.15,TCP,60,9001  >  35978 [ACK] Seq=19008309 Ack=350846279 Win=65535 Len=0
1,2.05131000000074,62.210.85.178,10.0.2.15,TCP,60,9001  >  35978 [ACK] Seq=19008309 Ack=350847739 Win=65535 Len=0
1,2.051314000000275,62.210.85.178,10.0.2.15,TCP,60,9001  >  35978 [ACK] Seq=19008309 Ack=350849199 Win=65535 Len=0
1,2.0513540000010835,10.0.2.15,62.210.85.178,TLSv1.2,1204,Application Data
1,2.051425999999992,62.210.85.178,10.0.2.15,TCP,60,9001  >  35978 [ACK] Seq=19008309 Ack=350850349 Win=65535 Len=0
1,2.051467999999659,10.0.2.15,62.210.85.178,TLSv1.2,4124,Application Data
1,2.051542999999583,62.210.85.178,10.0.2.15,TCP,60,9001  >  35978 [ACK] Seq=19008309 Ack=350851809 Win=65535 Len=0
1,2.0515510000004724,62.210.85.178,10.0.2.15,TCP,60,9001  >  35978 [ACK] Seq=19008309 Ack=350853269 Win=65535 Len=0
1,2.0515550000000076,62.210.85.178,10.0.2.15,TCP,60,9001  >  35978 [ACK] Seq=19008309 Ack=350854419 Win=65535 Len=0
1,2.0515850000010687,10.0.2.15,62.210.85.178,TCP,2974,35978  >  9001 [ACK] Seq=350854419 Ack=19008309 Win=65535 Len=2920 [TCP segment of a reassembled PDU]
1,2.0516239999997197,62.210.85.178,10.0.2.15,TCP,60,9001  >  35978 [ACK] Seq=19008309 Ack=350855879 Win=65535 Len=0
1,2.051629999999932,62.210.85.178,10.0.2.15,TCP,60,9001  >  35978 [ACK] Seq=19008309 Ack=350857339 Win=65535 Len=0
1,2.0516650000008667,10.0.2.15,62.210.85.178,TLSv1.2,1204,Application Data
1,2.051701000000321,62.210.85.178,10.0.2.15,TCP,60,9001  >  35978 [ACK] Seq=19008309 Ack=350858489 Win=65535 Len=0
1,2.0517460000010033,10.0.2.15,62.210.85.178,TLSv1.2,332,Application Data
1,2.0517840000011347,62.210.85.178,10.0.2.15,TCP,60,9001  >  35978 [ACK] Seq=19008309 Ack=350858767 Win=65535 Len=0
1,2.051840000000084,10.0.2.15,62.210.85.178,TLSv1.2,3868,Application Data
1,2.051880999999412,62.210.85.178,10.0.2.15,TCP,60,9001  >  35978 [ACK] Seq=19008309 Ack=350860227 Win=65535 Len=0
1,2.0518879999999626,62.210.85.178,10.0.2.15,TCP,60,9001  >  35978 [ACK] Seq=19008309 Ack=350861687 Win=65535 Len=0
1,2.051891999999498,62.210.85.178,10.0.2.15,TCP,60,9001  >  35978 [ACK] Seq=19008309 Ack=350862581 Win=65535 Len=0
1,2.0519380000005185,10.0.2.15,62.210.85.178,TLSv1.2,4124,Application Data
1,2.051977999999508,62.210.85.178,10.0.2.15,TCP,60,9001  >  35978 [ACK] Seq=19008309 Ack=350864041 Win=65535 Len=0
1,2.051985000000059,62.210.85.178,10.0.2.15,TCP,60,9001  >  35978 [ACK] Seq=19008309 Ack=350865501 Win=65535 Len=0
1,2.051988999999594,62.210.85.178,10.0.2.15,TCP,60,9001  >  35978 [ACK] Seq=19008309 Ack=350866651 Win=65535 Len=0
1,2.052031999999599,10.0.2.15,62.210.85.178,TLSv1.2,3030,Application Data
1,2.052071000000069,62.210.85.178,10.0.2.15,TCP,60,9001  >  35978 [ACK] Seq=19008309 Ack=350868111 Win=65535 Len=0
1,2.05207800000062,62.210.85.178,10.0.2.15,TCP,60,9001  >  35978 [ACK] Seq=19008309 Ack=350869571 Win=65535 Len=0
1,2.052082000000155,62.210.85.178,10.0.2.15,TCP,60,9001  >  35978 [ACK] Seq=19008309 Ack=350869627 Win=65535 Len=0
1,2.0645839999997406,10.0.2.15,62.210.85.178,TLSv1.2,4124,Application Data
1,2.064734999999928,62.210.85.178,10.0.2.15,TCP,60,9001  >  35978 [ACK] Seq=19008309 Ack=350871087 Win=65535 Len=0
1,2.064752000000226,62.210.85.178,10.0.2.15,TCP,60,9001  >  35978 [ACK] Seq=19008309 Ack=350872547 Win=65535 Len=0
1,2.0647570000000997,62.210.85.178,10.0.2.15,TCP,60,9001  >  35978 [ACK] Seq=19008309 Ack=350873697 Win=65535 Len=0
1,2.0648030000011204,10.0.2.15,62.210.85.178,TCP,2974,35978  >  9001 [ACK] Seq=350873697 Ack=19008309 Win=65535 Len=2920 [TCP segment of a reassembled PDU]
1,2.064872999999352,62.210.85.178,10.0.2.15,TCP,60,9001  >  35978 [ACK] Seq=19008309 Ack=350875157 Win=65535 Len=0
1,2.0648810000002413,62.210.85.178,10.0.2.15,TCP,60,9001  >  35978 [ACK] Seq=19008309 Ack=350876617 Win=65535 Len=0
1,2.0649180000000342,10.0.2.15,62.210.85.178,TLSv1.2,1204,Application Data
1,2.064954999999827,62.210.85.178,10.0.2.15,TCP,60,9001  >  35978 [ACK] Seq=19008309 Ack=350877767 Win=65535 Len=0
1,2.065005000000383,10.0.2.15,62.210.85.178,TLSv1.2,3802,Application Data
1,2.0650669999995444,62.210.85.178,10.0.2.15,TCP,60,9001  >  35978 [ACK] Seq=19008309 Ack=350879227 Win=65535 Len=0
1,2.065074000000095,62.210.85.178,10.0.2.15,TCP,60,9001  >  35978 [ACK] Seq=19008309 Ack=350880687 Win=65535 Len=0
1,2.065078999999969,62.210.85.178,10.0.2.15,TCP,60,9001  >  35978 [ACK] Seq=19008309 Ack=350881515 Win=65535 Len=0
1,2.131296999999904,54.93.77.70,10.0.2.15,TLSv1.2,590,Application Data
1,2.172316000000137,10.0.2.15,54.93.77.70,TCP,54,34692  >  9001 [ACK] Seq=19075835 Ack=350491631 Win=65535 Len=0
1,2.21787200000108,54.93.77.70,10.0.2.15,TCP,2950,"9001  >  34692 [PSH, ACK] Seq=350491631 Ack=19075835 Win=65535 Len=2896 [TCP segment of a reassembled PDU]"
1,2.2179420000011305,10.0.2.15,54.93.77.70,TCP,54,34692  >  9001 [ACK] Seq=19075835 Ack=350494527 Win=65535 Len=0
1,2.218377999999575,54.93.77.70,10.0.2.15,TLSv1.2,4398,"Application Data, Application Data"
1,2.218423000000257,10.0.2.15,54.93.77.70,TCP,54,34692  >  9001 [ACK] Seq=19075835 Ack=350498871 Win=65535 Len=0
1,2.2259180000000924,54.93.77.70,10.0.2.15,TLSv1.2,5846,Application Data
1,2.2259869999998045,10.0.2.15,54.93.77.70,TCP,54,34692  >  9001 [ACK] Seq=19075835 Ack=350504663 Win=65535 Len=0
1,2.2264960000011342,54.93.77.70,10.0.2.15,TLSv1.2,1502,Application Data
1,2.2265389999993204,10.0.2.15,54.93.77.70,TCP,54,34692  >  9001 [ACK] Seq=19075835 Ack=350506111 Win=65535 Len=0
1,2.2436219999999594,54.93.77.70,10.0.2.15,TCP,2950,"9001  >  34692 [PSH, ACK] Seq=350506111 Ack=19075835 Win=65535 Len=2896 [TCP segment of a reassembled PDU]"
1,2.243666000000303,10.0.2.15,54.93.77.70,TCP,54,34692  >  9001 [ACK] Seq=19075835 Ack=350509007 Win=65535 Len=0
1,2.245146000001114,54.93.77.70,10.0.2.15,TLSv1.2,4124,Application Data [TCP segment of a reassembled PDU]
1,2.2451880000007804,10.0.2.15,54.93.77.70,TCP,54,34692  >  9001 [ACK] Seq=19075835 Ack=350513077 Win=65535 Len=0
1,2.250446000000011,54.93.77.70,10.0.2.15,TLSv1.2,2950,Application Data [TCP segment of a reassembled PDU]
1,2.250486999999339,10.0.2.15,54.93.77.70,TCP,54,34692  >  9001 [ACK] Seq=19075835 Ack=350515973 Win=65535 Len=0
1,2.2569409999996424,54.93.77.70,10.0.2.15,TLSv1.2,2950,Application Data [TCP segment of a reassembled PDU]
1,2.257004999999481,10.0.2.15,54.93.77.70,TCP,54,34692  >  9001 [ACK] Seq=19075835 Ack=350518869 Win=65535 Len=0
1,2.2572629999995115,10.0.2.15,54.93.77.70,TLSv1.2,1104,Application Data
1,2.2578410000005533,54.93.77.70,10.0.2.15,TCP,60,9001  >  34692 [ACK] Seq=350518869 Ack=19076885 Win=65535 Len=0
1,2.2593870000000607,54.93.77.70,10.0.2.15,TLSv1.2,5846,Application Data [TCP segment of a reassembled PDU]
1,2.2595020000007935,10.0.2.15,54.93.77.70,TCP,54,34692  >  9001 [ACK] Seq=19076885 Ack=350524661 Win=65535 Len=0
1,2.2621479999997973,54.93.77.70,10.0.2.15,TLSv1.2,118,Application Data
1,2.2665820000001986,54.93.77.70,10.0.2.15,TLSv1.2,7294,"Application Data, Application Data"
1,2.266660999999658,10.0.2.15,54.93.77.70,TCP,54,34692  >  9001 [ACK] Seq=19076885 Ack=350531965 Win=65535 Len=0
1,2.289790000000721,54.93.77.70,10.0.2.15,TLSv1.2,3674,Application Data
1,2.2898540000005596,10.0.2.15,54.93.77.70,TCP,54,34692  >  9001 [ACK] Seq=19076885 Ack=350535585 Win=65535 Len=0
1,2.298595000000205,54.93.77.70,10.0.2.15,TLSv1.2,8742,"Application Data, Application Data"
1,2.2986739999996644,10.0.2.15,54.93.77.70,TCP,54,34692  >  9001 [ACK] Seq=19076885 Ack=350544273 Win=65535 Len=0
1,2.2989099999995233,54.93.77.70,10.0.2.15,TCP,2950,"9001  >  34692 [PSH, ACK] Seq=350544273 Ack=19076885 Win=65535 Len=2896 [TCP segment of a reassembled PDU]"
1,2.298960000000079,10.0.2.15,54.93.77.70,TLSv1.2,590,Application Data
1,2.299039999999877,54.93.77.70,10.0.2.15,TCP,60,9001  >  34692 [ACK] Seq=350547169 Ack=19077421 Win=65535 Len=0
1,2.3063120000006165,54.93.77.70,10.0.2.15,TLSv1.2,358,Application Data
1,2.309417000000394,54.93.77.70,10.0.2.15,TCP,2950,"9001  >  34692 [PSH, ACK] Seq=350547473 Ack=19077421 Win=65535 Len=2896 [TCP segment of a reassembled PDU]"
1,2.3094600000003993,10.0.2.15,54.93.77.70,TCP,54,34692  >  9001 [ACK] Seq=19077421 Ack=350550369 Win=65535 Len=0
1,2.322442000000592,54.93.77.70,10.0.2.15,TLSv1.2,7294,"Application Data, Application Data"
1,2.3225099999999657,10.0.2.15,54.93.77.70,TCP,54,34692  >  9001 [ACK] Seq=19077421 Ack=350557609 Win=65535 Len=0
1,2.3258920000007492,54.93.77.70,10.0.2.15,TLSv1.2,778,Application Data
1,2.3284370000001218,10.0.2.15,54.93.77.70,TLSv1.2,590,Application Data
1,2.3286220000009052,54.93.77.70,10.0.2.15,TCP,60,9001  >  34692 [ACK] Seq=350558333 Ack=19077957 Win=65535 Len=0
1,2.361297999999806,62.210.85.178,10.0.2.15,TLSv1.2,1104,Application Data
1,2.404250999999931,10.0.2.15,62.210.85.178,TCP,54,35978  >  9001 [ACK] Seq=350881515 Ack=19009359 Win=65535 Len=0
1,2.4419529999995575,62.210.85.178,10.0.2.15,TLSv1.2,590,Application Data
1,2.442010000000664,10.0.2.15,62.210.85.178,TCP,54,35978  >  9001 [ACK] Seq=350881515 Ack=19009895 Win=65535 Len=0
1,2.486189999999624,62.210.85.178,10.0.2.15,TLSv1.2,590,Application Data
1,2.486280999999508,10.0.2.15,62.210.85.178,TCP,54,35978  >  9001 [ACK] Seq=350881515 Ack=19010431 Win=65535 Len=0
1,2.486840999999913,10.0.2.15,62.210.85.178,TLSv1.2,590,Application Data
1,2.486995000001116,62.210.85.178,10.0.2.15,TCP,60,9001  >  35978 [ACK] Seq=19010431 Ack=350882051 Win=65535 Len=0
1,2.584262000000308,54.93.77.70,10.0.2.15,TLSv1.2,590,Application Data
1,2.5846529999998893,10.0.2.15,54.93.77.70,TLSv1.2,590,Application Data
1,2.584773000000496,54.93.77.70,10.0.2.15,TCP,60,9001  >  34692 [ACK] Seq=350558869 Ack=19078493 Win=65535 Len=0
1,2.7768809999997757,62.210.85.178,10.0.2.15,TLSv1.2,590,Application Data
1,2.782140999999683,10.0.2.15,62.210.85.178,TLSv1.2,590,Application Data
1,2.782262000000628,62.210.85.178,10.0.2.15,TCP,60,9001  >  35978 [ACK] Seq=19010967 Ack=350882587 Win=65535 Len=0
1,2.7925450000002456,10.0.2.15,62.210.85.178,TLSv1.2,4124,Application Data
1,2.7926900000002206,62.210.85.178,10.0.2.15,TCP,60,9001  >  35978 [ACK] Seq=19010967 Ack=350884047 Win=65535 Len=0
1,2.7927099999997154,62.210.85.178,10.0.2.15,TCP,60,9001  >  35978 [ACK] Seq=19010967 Ack=350885507 Win=65535 Len=0
1,2.792713000000731,62.210.85.178,10.0.2.15,TCP,60,9001  >  35978 [ACK] Seq=19010967 Ack=350886657 Win=65535 Len=0
1,2.792794999999387,10.0.2.15,62.210.85.178,TLSv1.2,4124,Application Data
1,2.792876999999862,62.210.85.178,10.0.2.15,TCP,60,9001  >  35978 [ACK] Seq=19010967 Ack=350888117 Win=65535 Len=0
1,2.7928850000007515,62.210.85.178,10.0.2.15,TCP,60,9001  >  35978 [ACK] Seq=19010967 Ack=350889577 Win=65535 Len=0
1,2.792887999999948,62.210.85.178,10.0.2.15,TCP,60,9001  >  35978 [ACK] Seq=19010967 Ack=350890727 Win=65535 Len=0
1,2.792921000000206,10.0.2.15,62.210.85.178,TLSv1.2,4124,Application Data
1,2.7929610000010143,62.210.85.178,10.0.2.15,TCP,60,9001  >  35978 [ACK] Seq=19010967 Ack=350892187 Win=65535 Len=0
1,2.792970000000423,62.210.85.178,10.0.2.15,TCP,60,9001  >  35978 [ACK] Seq=19010967 Ack=350893647 Win=65535 Len=0
1,2.792975000000297,62.210.85.178,10.0.2.15,TCP,60,9001  >  35978 [ACK] Seq=19010967 Ack=350894797 Win=65535 Len=0
1,2.7930130000004283,10.0.2.15,62.210.85.178,TLSv1.2,4124,Application Data
1,2.7930510000005597,62.210.85.178,10.0.2.15,TCP,60,9001  >  35978 [ACK] Seq=19010967 Ack=350896257 Win=65535 Len=0
1,2.79305899999963,62.210.85.178,10.0.2.15,TCP,60,9001  >  35978 [ACK] Seq=19010967 Ack=350897717 Win=65535 Len=0
1,2.793122000000949,62.210.85.178,10.0.2.15,TCP,60,9001  >  35978 [ACK] Seq=19010967 Ack=350898867 Win=65535 Len=0
1,2.7931570000000647,10.0.2.15,62.210.85.178,TLSv1.2,332,Application Data
1,2.793192999999519,62.210.85.178,10.0.2.15,TCP,60,9001  >  35978 [ACK] Seq=19010967 Ack=350899145 Win=65535 Len=0
1,2.7932940000009694,10.0.2.15,62.210.85.178,TLSv1.2,3868,Application Data
1,2.793332000001101,62.210.85.178,10.0.2.15,TCP,60,9001  >  35978 [ACK] Seq=19010967 Ack=350900605 Win=65535 Len=0
1,2.7933410000005097,62.210.85.178,10.0.2.15,TCP,60,9001  >  35978 [ACK] Seq=19010967 Ack=350902065 Win=65535 Len=0
1,2.793345000000045,62.210.85.178,10.0.2.15,TCP,60,9001  >  35978 [ACK] Seq=19010967 Ack=350902959 Win=65535 Len=0
1,2.7933850000008533,10.0.2.15,62.210.85.178,TLSv1.2,4124,Application Data
1,2.7934239999995043,62.210.85.178,10.0.2.15,TCP,60,9001  >  35978 [ACK] Seq=19010967 Ack=350904419 Win=65535 Len=0
1,2.7934320000003936,62.210.85.178,10.0.2.15,TCP,60,9001  >  35978 [ACK] Seq=19010967 Ack=350905879 Win=65535 Len=0
1,2.7934359999999288,62.210.85.178,10.0.2.15,TCP,60,9001  >  35978 [ACK] Seq=19010967 Ack=350907029 Win=65535 Len=0
1,2.7934729999997217,10.0.2.15,62.210.85.178,TLSv1.2,3030,Application Data
1,2.7935140000008687,62.210.85.178,10.0.2.15,TCP,60,9001  >  35978 [ACK] Seq=19010967 Ack=350908489 Win=65535 Len=0
1,2.7935209999996005,62.210.85.178,10.0.2.15,TCP,60,9001  >  35978 [ACK] Seq=19010967 Ack=350909949 Win=65535 Len=0
1,2.7935250000009546,62.210.85.178,10.0.2.15,TCP,60,9001  >  35978 [ACK] Seq=19010967 Ack=350910005 Win=65535 Len=0
1,2.80490699999973,10.0.2.15,62.210.85.178,TLSv1.2,4124,Application Data
1,2.804959000000963,62.210.85.178,10.0.2.15,TCP,60,9001  >  35978 [ACK] Seq=19010967 Ack=350911465 Win=65535 Len=0
1,2.804970000001049,62.210.85.178,10.0.2.15,TCP,60,9001  >  35978 [ACK] Seq=19010967 Ack=350912925 Win=65535 Len=0
1,2.8049750000009226,62.210.85.178,10.0.2.15,TCP,60,9001  >  35978 [ACK] Seq=19010967 Ack=350914075 Win=65535 Len=0
1,2.805019999999786,10.0.2.15,62.210.85.178,TLSv1.2,4124,Application Data
1,2.8050600000005943,62.210.85.178,10.0.2.15,TCP,60,9001  >  35978 [ACK] Seq=19010967 Ack=350915535 Win=65535 Len=0
1,2.805069000000003,62.210.85.178,10.0.2.15,TCP,60,9001  >  35978 [ACK] Seq=19010967 Ack=350916995 Win=65535 Len=0
1,2.805073999999877,62.210.85.178,10.0.2.15,TCP,60,9001  >  35978 [ACK] Seq=19010967 Ack=350918145 Win=65535 Len=0
1,2.805113000000347,10.0.2.15,62.210.85.178,TLSv1.2,4124,Application Data
1,2.8051510000004782,62.210.85.178,10.0.2.15,TCP,60,9001  >  35978 [ACK] Seq=19010967 Ack=350919605 Win=65535 Len=0
1,2.805159999999887,62.210.85.178,10.0.2.15,TCP,60,9001  >  35978 [ACK] Seq=19010967 Ack=350921065 Win=65535 Len=0
1,2.8051639999994222,62.210.85.178,10.0.2.15,TCP,60,9001  >  35978 [ACK] Seq=19010967 Ack=350922215 Win=65535 Len=0
1,2.805201000001034,10.0.2.15,62.210.85.178,TLSv1.2,4124,Application Data
1,2.805239999999685,62.210.85.178,10.0.2.15,TCP,60,9001  >  35978 [ACK] Seq=19010967 Ack=350923675 Win=65535 Len=0
1,2.805249000000913,62.210.85.178,10.0.2.15,TCP,60,9001  >  35978 [ACK] Seq=19010967 Ack=350925135 Win=65535 Len=0
1,2.805253000000448,62.210.85.178,10.0.2.15,TCP,60,9001  >  35978 [ACK] Seq=19010967 Ack=350926285 Win=65535 Len=0
1,2.805287999999564,10.0.2.15,62.210.85.178,TLSv1.2,332,Application Data
1,2.8053259999996953,62.210.85.178,10.0.2.15,TCP,60,9001  >  35978 [ACK] Seq=19010967 Ack=350926563 Win=65535 Len=0
1,2.8053770000005898,10.0.2.15,62.210.85.178,TLSv1.2,3868,Application Data
1,2.805415000000721,62.210.85.178,10.0.2.15,TCP,60,9001  >  35978 [ACK] Seq=19010967 Ack=350928023 Win=65535 Len=0
1,2.80542400000013,62.210.85.178,10.0.2.15,TCP,60,9001  >  35978 [ACK] Seq=19010967 Ack=350929483 Win=65535 Len=0
1,2.805427999999665,62.210.85.178,10.0.2.15,TCP,60,9001  >  35978 [ACK] Seq=19010967 Ack=350930377 Win=65535 Len=0
1,2.805464999999458,10.0.2.15,62.210.85.178,TLSv1.2,396,Application Data
1,2.80550200000107,62.210.85.178,10.0.2.15,TCP,60,9001  >  35978 [ACK] Seq=19010967 Ack=350930719 Win=65535 Len=0
1,2.891830000000482,54.93.77.70,10.0.2.15,TLSv1.2,3674,Application Data
1,2.8919669999995676,10.0.2.15,54.93.77.70,TCP,54,34692  >  9001 [ACK] Seq=19078493 Ack=350562489 Win=65535 Len=0
1,2.9186399999998685,54.93.77.70,10.0.2.15,TLSv1.2,3674,Application Data
1,2.918712000000596,10.0.2.15,54.93.77.70,TCP,54,34692  >  9001 [ACK] Seq=19078493 Ack=350566109 Win=65535 Len=0
1,2.927577000000383,54.93.77.70,10.0.2.15,TLSv1.2,7294,Application Data
1,2.9276559999998426,10.0.2.15,54.93.77.70,TCP,54,34692  >  9001 [ACK] Seq=19078493 Ack=350573349 Win=65535 Len=0
1,2.9278269999995246,10.0.2.15,54.93.77.70,TLSv1.2,590,Application Data
1,2.927917000000889,54.93.77.70,10.0.2.15,TCP,60,9001  >  34692 [ACK] Seq=350573349 Ack=19079029 Win=65535 Len=0
1,2.9357490000002144,54.93.77.70,10.0.2.15,TLSv1.2,568,Application Data
1,2.94835299999977,54.93.77.70,10.0.2.15,TCP,2950,"9001  >  34692 [PSH, ACK] Seq=350573863 Ack=19079029 Win=65535 Len=2896 [TCP segment of a reassembled PDU]"
1,2.9484009999996488,10.0.2.15,54.93.77.70,TCP,54,34692  >  9001 [ACK] Seq=19079029 Ack=350576759 Win=65535 Len=0
1,2.9590079999998125,54.93.77.70,10.0.2.15,TLSv1.2,7294,"Application Data, Application Data"
1,2.959071999999651,10.0.2.15,54.93.77.70,TCP,54,34692  >  9001 [ACK] Seq=19079029 Ack=350583999 Win=65535 Len=0
1,2.9661080000005313,54.93.77.70,10.0.2.15,TLSv1.2,1292,Application Data
1,2.9662680000001274,10.0.2.15,54.93.77.70,TLSv1.2,590,Application Data
1,2.9663440000003902,54.93.77.70,10.0.2.15,TCP,60,9001  >  34692 [ACK] Seq=350585237 Ack=19079565 Win=65535 Len=0
1,2.9740290000008827,54.93.77.70,10.0.2.15,TLSv1.2,4398,Application Data
1,2.974094999999579,10.0.2.15,54.93.77.70,TCP,54,34692  >  9001 [ACK] Seq=19079565 Ack=350589581 Win=65535 Len=0
1,2.9755779999995866,54.93.77.70,10.0.2.15,TCP,1502,"9001  >  34692 [PSH, ACK] Seq=350589581 Ack=19079565 Win=65535 Len=1448 [TCP segment of a reassembled PDU]"
1,2.9756209999995917,10.0.2.15,54.93.77.70,TCP,54,34692  >  9001 [ACK] Seq=19079565 Ack=350591029 Win=65535 Len=0
1,2.9837939999997616,54.93.77.70,10.0.2.15,TLSv1.2,988,Application Data
1,2.9850010000009206,54.93.77.70,10.0.2.15,TCP,2950,"9001  >  34692 [PSH, ACK] Seq=350591963 Ack=19079565 Win=65535 Len=2896 [TCP segment of a reassembled PDU]"
1,2.9850700000006327,10.0.2.15,54.93.77.70,TCP,54,34692  >  9001 [ACK] Seq=19079565 Ack=350594859 Win=65535 Len=0
1,2.9950989999997546,54.93.77.70,10.0.2.15,TLSv1.2,1502,Application Data [TCP segment of a reassembled PDU]
1,2.9951529999998456,10.0.2.15,54.93.77.70,TCP,54,34692  >  9001 [ACK] Seq=19079565 Ack=350596307 Win=65535 Len=0
1,3.0024389999998675,54.93.77.70,10.0.2.15,TLSv1.2,894,Application Data
1,3.0442670000011276,10.0.2.15,54.93.77.70,TCP,54,34692  >  9001 [ACK] Seq=19079565 Ack=350597147 Win=65535 Len=0
1,3.050784000000931,54.93.77.70,10.0.2.15,TLSv1.2,3674,Application Data
1,3.0508279999994556,10.0.2.15,54.93.77.70,TCP,54,34692  >  9001 [ACK] Seq=19079565 Ack=350600767 Win=65535 Len=0
1,3.0610240000005433,54.93.77.70,10.0.2.15,TCP,2950,"9001  >  34692 [PSH, ACK] Seq=350600767 Ack=19079565 Win=65535 Len=2896 [TCP segment of a reassembled PDU]"
1,3.0611210000006395,10.0.2.15,54.93.77.70,TCP,54,34692  >  9001 [ACK] Seq=19079565 Ack=350603663 Win=65535 Len=0
1,3.070826000001034,54.93.77.70,10.0.2.15,TLSv1.2,2226,Application Data [TCP segment of a reassembled PDU]
1,3.070928000001004,54.93.77.70,10.0.2.15,TCP,1502,"9001  >  34692 [PSH, ACK] Seq=350605835 Ack=19079565 Win=65535 Len=1448 [TCP segment of a reassembled PDU]"
1,3.071008000000802,10.0.2.15,54.93.77.70,TCP,54,34692  >  9001 [ACK] Seq=19079565 Ack=350605835 Win=65535 Len=0
1,3.071062000000893,10.0.2.15,54.93.77.70,TCP,54,34692  >  9001 [ACK] Seq=19079565 Ack=350607283 Win=65535 Len=0
1,3.0854810000000725,62.210.85.178,10.0.2.15,TLSv1.2,590,Application Data
1,3.088997000000745,54.93.77.70,10.0.2.15,TLSv1.2,264,Application Data
1,3.0890890000009676,10.0.2.15,54.93.77.70,TCP,54,34692  >  9001 [ACK] Seq=19079565 Ack=350607493 Win=65535 Len=0
1,3.0917609999996785,10.0.2.15,54.93.77.70,TLSv1.2,590,Application Data
1,3.0919119999998657,54.93.77.70,10.0.2.15,TCP,60,9001  >  34692 [ACK] Seq=350607493 Ack=19080101 Win=65535 Len=0
1,3.1283199999998033,10.0.2.15,62.210.85.178,TCP,54,35978  >  9001 [ACK] Seq=350930719 Ack=19011503 Win=65535 Len=0
1,3.1463220000005094,62.210.85.178,10.0.2.15,TLSv1.2,590,Application Data
1,3.1464130000003934,10.0.2.15,62.210.85.178,TCP,54,35978  >  9001 [ACK] Seq=350930719 Ack=19012039 Win=65535 Len=0
1,3.287947000000713,62.210.85.178,10.0.2.15,TLSv1.2,590,Application Data
1,3.2880370000002586,10.0.2.15,62.210.85.178,TCP,54,35978  >  9001 [ACK] Seq=350930719 Ack=19012575 Win=65535 Len=0
1,3.2886149999994814,10.0.2.15,62.210.85.178,TLSv1.2,590,Application Data
1,3.288746000000174,62.210.85.178,10.0.2.15,TCP,60,9001  >  35978 [ACK] Seq=19012575 Ack=350931255 Win=65535 Len=0
1,3.407219000000623,54.93.77.70,10.0.2.15,TLSv1.2,590,Application Data
1,3.407654000000548,10.0.2.15,54.93.77.70,TLSv1.2,590,Application Data
1,3.407796999999846,54.93.77.70,10.0.2.15,TCP,60,9001  >  34692 [ACK] Seq=350608029 Ack=19080637 Win=65535 Len=0
1,3.512683000000834,62.210.85.178,10.0.2.15,TLSv1.2,590,Application Data
1,3.5191240000003745,10.0.2.15,62.210.85.178,TLSv1.2,590,Application Data
1,3.5197690000004513,62.210.85.178,10.0.2.15,TCP,60,9001  >  35978 [ACK] Seq=19013111 Ack=350931791 Win=65535 Len=0
1,3.52896999999939,10.0.2.15,62.210.85.178,TLSv1.2,4124,Application Data
1,3.5293780000010884,62.210.85.178,10.0.2.15,TCP,60,9001  >  35978 [ACK] Seq=19013111 Ack=350933251 Win=65535 Len=0
1,3.5293949999995675,62.210.85.178,10.0.2.15,TCP,60,9001  >  35978 [ACK] Seq=19013111 Ack=350934711 Win=65535 Len=0
1,3.529398000000583,62.210.85.178,10.0.2.15,TCP,60,9001  >  35978 [ACK] Seq=19013111 Ack=350935861 Win=65535 Len=0
1,3.52946300000076,10.0.2.15,62.210.85.178,TLSv1.2,4124,Application Data
1,3.5295660000010685,62.210.85.178,10.0.2.15,TCP,60,9001  >  35978 [ACK] Seq=19013111 Ack=350937321 Win=65535 Len=0
1,3.5295740000001388,62.210.85.178,10.0.2.15,TCP,60,9001  >  35978 [ACK] Seq=19013111 Ack=350938781 Win=65535 Len=0
1,3.5295769999993354,62.210.85.178,10.0.2.15,TCP,60,9001  >  35978 [ACK] Seq=19013111 Ack=350939931 Win=65535 Len=0
1,3.529602000000523,10.0.2.15,62.210.85.178,TCP,2974,35978  >  9001 [ACK] Seq=350939931 Ack=19013111 Win=65535 Len=2920 [TCP segment of a reassembled PDU]
1,3.529688000000533,62.210.85.178,10.0.2.15,TCP,60,9001  >  35978 [ACK] Seq=19013111 Ack=350941391 Win=65535 Len=0
1,3.5296940000007453,62.210.85.178,10.0.2.15,TCP,60,9001  >  35978 [ACK] Seq=19013111 Ack=350942851 Win=65535 Len=0
1,3.5297239999999874,10.0.2.15,62.210.85.178,TLSv1.2,1204,Application Data
1,3.529770000001008,62.210.85.178,10.0.2.15,TCP,60,9001  >  35978 [ACK] Seq=19013111 Ack=350944001 Win=65535 Len=0
1,3.5298130000010133,10.0.2.15,62.210.85.178,TLSv1.2,4124,Application Data
1,3.5298789999997098,62.210.85.178,10.0.2.15,TCP,60,9001  >  35978 [ACK] Seq=19013111 Ack=350945461 Win=65535 Len=0
1,3.529888999999457,62.210.85.178,10.0.2.15,TCP,60,9001  >  35978 [ACK] Seq=19013111 Ack=350946921 Win=65535 Len=0
1,3.5298920000004728,62.210.85.178,10.0.2.15,TCP,60,9001  >  35978 [ACK] Seq=19013111 Ack=350948071 Win=65535 Len=0
1,3.5299379999996745,10.0.2.15,62.210.85.178,TLSv1.2,332,Application Data
1,3.530000000000655,62.210.85.178,10.0.2.15,TCP,60,9001  >  35978 [ACK] Seq=19013111 Ack=350948349 Win=65535 Len=0
1,3.5300760000009177,10.0.2.15,62.210.85.178,TLSv1.2,3868,Application Data
1,3.5301180000005843,62.210.85.178,10.0.2.15,TCP,60,9001  >  35978 [ACK] Seq=19013111 Ack=350949809 Win=65535 Len=0
1,3.5301259999996546,62.210.85.178,10.0.2.15,TCP,60,9001  >  35978 [ACK] Seq=19013111 Ack=350951269 Win=65535 Len=0
1,3.5301300000010087,62.210.85.178,10.0.2.15,TCP,60,9001  >  35978 [ACK] Seq=19013111 Ack=350952163 Win=65535 Len=0
1,3.5301689999996597,10.0.2.15,62.210.85.178,TLSv1.2,4124,Application Data
1,3.5302080000001297,62.210.85.178,10.0.2.15,TCP,60,9001  >  35978 [ACK] Seq=19013111 Ack=350953623 Win=65535 Len=0
1,3.530216000001019,62.210.85.178,10.0.2.15,TCP,60,9001  >  35978 [ACK] Seq=19013111 Ack=350955083 Win=65535 Len=0
1,3.530220000000554,62.210.85.178,10.0.2.15,TCP,60,9001  >  35978 [ACK] Seq=19013111 Ack=350956233 Win=65535 Len=0
1,3.53025499999967,10.0.2.15,62.210.85.178,TLSv1.2,3030,Application Data
1,3.53029400000014,62.210.85.178,10.0.2.15,TCP,60,9001  >  35978 [ACK] Seq=19013111 Ack=350957693 Win=65535 Len=0
1,3.5303020000010292,62.210.85.178,10.0.2.15,TCP,60,9001  >  35978 [ACK] Seq=19013111 Ack=350959153 Win=65535 Len=0
1,3.530305000000226,62.210.85.178,10.0.2.15,TCP,60,9001  >  35978 [ACK] Seq=19013111 Ack=350959209 Win=65535 Len=0
1,3.5395170000010694,10.0.2.15,62.210.85.178,TLSv1.2,4124,Application Data
1,3.539570000000822,62.210.85.178,10.0.2.15,TCP,60,9001  >  35978 [ACK] Seq=19013111 Ack=350960669 Win=65535 Len=0
1,3.539581000000908,62.210.85.178,10.0.2.15,TCP,60,9001  >  35978 [ACK] Seq=19013111 Ack=350962129 Win=65535 Len=0
1,3.5395860000007815,62.210.85.178,10.0.2.15,TCP,60,9001  >  35978 [ACK] Seq=19013111 Ack=350963279 Win=65535 Len=0
1,3.5396319999999832,10.0.2.15,62.210.85.178,TLSv1.2,4124,Application Data
1,3.5396730000011303,62.210.85.178,10.0.2.15,TCP,60,9001  >  35978 [ACK] Seq=19013111 Ack=350964739 Win=65535 Len=0
1,3.5396810000002006,62.210.85.178,10.0.2.15,TCP,60,9001  >  35978 [ACK] Seq=19013111 Ack=350966199 Win=65535 Len=0
1,3.539687000000413,62.210.85.178,10.0.2.15,TCP,60,9001  >  35978 [ACK] Seq=19013111 Ack=350967349 Win=65535 Len=0
1,3.539727999999741,10.0.2.15,62.210.85.178,TLSv1.2,4124,Application Data
1,3.5397659999998723,62.210.85.178,10.0.2.15,TCP,60,9001  >  35978 [ACK] Seq=19013111 Ack=350968809 Win=65535 Len=0
1,3.5397750000011,62.210.85.178,10.0.2.15,TCP,60,9001  >  35978 [ACK] Seq=19013111 Ack=350970269 Win=65535 Len=0
1,3.539780000000974,62.210.85.178,10.0.2.15,TCP,60,9001  >  35978 [ACK] Seq=19013111 Ack=350971419 Win=65535 Len=0
1,3.5398170000007667,10.0.2.15,62.210.85.178,TLSv1.2,4124,Application Data
1,3.539855000000898,62.210.85.178,10.0.2.15,TCP,60,9001  >  35978 [ACK] Seq=19013111 Ack=350972879 Win=65535 Len=0
1,3.5398629999999685,62.210.85.178,10.0.2.15,TCP,60,9001  >  35978 [ACK] Seq=19013111 Ack=350974339 Win=65535 Len=0
1,3.539867999999842,62.210.85.178,10.0.2.15,TCP,60,9001  >  35978 [ACK] Seq=19013111 Ack=350975489 Win=65535 Len=0
1,3.539903000000777,10.0.2.15,62.210.85.178,TLSv1.2,332,Application Data
1,3.53994000000057,62.210.85.178,10.0.2.15,TCP,60,9001  >  35978 [ACK] Seq=19013111 Ack=350975767 Win=65535 Len=0
1,3.539991999999984,10.0.2.15,62.210.85.178,TLSv1.2,3868,Application Data
1,3.540031000000454,62.210.85.178,10.0.2.15,TCP,60,9001  >  35978 [ACK] Seq=19013111 Ack=350977227 Win=65535 Len=0
1,3.5400399999998626,62.210.85.178,10.0.2.15,TCP,60,9001  >  35978 [ACK] Seq=19013111 Ack=350978687 Win=65535 Len=0
1,3.540043999999398,62.210.85.178,10.0.2.15,TCP,60,9001  >  35978 [ACK] Seq=19013111 Ack=350979581 Win=65535 Len=0
1,3.540081999999529,10.0.2.15,62.210.85.178,TLSv1.2,4124,Application Data
1,3.540120999999999,62.210.85.178,10.0.2.15,TCP,60,9001  >  35978 [ACK] Seq=19013111 Ack=350981041 Win=65535 Len=0
1,3.5401290000008885,62.210.85.178,10.0.2.15,TCP,60,9001  >  35978 [ACK] Seq=19013111 Ack=350982501 Win=65535 Len=0
1,3.5401330000004236,62.210.85.178,10.0.2.15,TCP,60,9001  >  35978 [ACK] Seq=19013111 Ack=350983651 Win=65535 Len=0
1,3.5401679999995395,10.0.2.15,62.210.85.178,TLSv1.2,3030,Application Data
1,3.54021400000056,62.210.85.178,10.0.2.15,TCP,60,9001  >  35978 [ACK] Seq=19013111 Ack=350985111 Win=65535 Len=0
1,3.5402200000007724,62.210.85.178,10.0.2.15,TCP,60,9001  >  35978 [ACK] Seq=19013111 Ack=350986571 Win=65535 Len=0
1,3.540222999999969,62.210.85.178,10.0.2.15,TCP,60,9001  >  35978 [ACK] Seq=19013111 Ack=350986627 Win=65535 Len=0
1,3.55280700000003,10.0.2.15,62.210.85.178,TLSv1.2,4124,Application Data
1,3.552896999999575,62.210.85.178,10.0.2.15,TCP,60,9001  >  35978 [ACK] Seq=19013111 Ack=350988087 Win=65535 Len=0
1,3.552906000000803,62.210.85.178,10.0.2.15,TCP,60,9001  >  35978 [ACK] Seq=19013111 Ack=350989547 Win=65535 Len=0
1,3.5529089999999997,62.210.85.178,10.0.2.15,TCP,60,9001  >  35978 [ACK] Seq=19013111 Ack=350990697 Win=65535 Len=0
1,3.5529520000000048,10.0.2.15,62.210.85.178,TLSv1.2,4124,Application Data
1,3.5529920000008133,62.210.85.178,10.0.2.15,TCP,60,9001  >  35978 [ACK] Seq=19013111 Ack=350992157 Win=65535 Len=0
1,3.553001000000222,62.210.85.178,10.0.2.15,TCP,60,9001  >  35978 [ACK] Seq=19013111 Ack=350993617 Win=65535 Len=0
1,3.5530049999997573,62.210.85.178,10.0.2.15,TCP,60,9001  >  35978 [ACK] Seq=19013111 Ack=350994767 Win=65535 Len=0
1,3.5530440000002272,10.0.2.15,62.210.85.178,TLSv1.2,4124,Application Data
1,3.5530820000003587,62.210.85.178,10.0.2.15,TCP,60,9001  >  35978 [ACK] Seq=19013111 Ack=350996227 Win=65535 Len=0
1,3.553089999999429,62.210.85.178,10.0.2.15,TCP,60,9001  >  35978 [ACK] Seq=19013111 Ack=350997687 Win=65535 Len=0
1,3.553095999999641,62.210.85.178,10.0.2.15,TCP,60,9001  >  35978 [ACK] Seq=19013111 Ack=350998837 Win=65535 Len=0
1,3.553135000000111,10.0.2.15,62.210.85.178,TLSv1.2,4124,Application Data
1,3.5531750000009197,62.210.85.178,10.0.2.15,TCP,60,9001  >  35978 [ACK] Seq=19013111 Ack=351000297 Win=65535 Len=0
1,3.5531840000003285,62.210.85.178,10.0.2.15,TCP,60,9001  >  35978 [ACK] Seq=19013111 Ack=351001757 Win=65535 Len=0
