No.,Time,Source,Destination,Protocol,Length,Info
1,0.14555799999993724,10.0.2.15,54.93.77.70,TLSv1.2,590,Application Data
1,0.1457469999999148,54.93.77.70,10.0.2.15,TCP,60,9001  >  34692 [ACK] Seq=27367985 Ack=1586611 Win=65535 Len=0
1,0.5828769999999395,62.210.85.178,10.0.2.15,TLSv1.2,590,Application Data
1,0.5829539999999724,10.0.2.15,62.210.85.178,TCP,54,35978  >  9001 [ACK] Seq=27486841 Ack=1590975 Win=65535 Len=0
1,0.5832520000000159,10.0.2.15,62.210.85.178,TLSv1.2,590,Application Data
1,0.583336999999915,62.210.85.178,10.0.2.15,TCP,60,9001  >  35978 [ACK] Seq=1590975 Ack=27487377 Win=65535 Len=0
1,0.6877259999999978,54.93.77.70,10.0.2.15,TLSv1.2,590,Application Data
1,0.6878070000000207,10.0.2.15,54.93.77.70,TCP,54,34692  >  9001 [ACK] Seq=1586611 Ack=27368521 Win=65535 Len=0
1,0.6883460000000241,10.0.2.15,54.93.77.70,TLSv1.2,1618,Application Data
1,0.6885009999999738,54.93.77.70,10.0.2.15,TCP,60,9001  >  34692 [ACK] Seq=27368521 Ack=1588071 Win=65535 Len=0
1,0.6885179999999309,54.93.77.70,10.0.2.15,TCP,60,9001  >  34692 [ACK] Seq=27368521 Ack=1588175 Win=65535 Len=0
1,0.8897049999999354,62.210.85.178,10.0.2.15,TLSv1.2,1618,Application Data
1,0.8898399999999356,10.0.2.15,62.210.85.178,TCP,54,35978  >  9001 [ACK] Seq=27487377 Ack=1592539 Win=65535 Len=0
1,0.9042109999999184,10.0.2.15,62.210.85.178,TLSv1.2,590,Application Data
1,0.9043960000000197,62.210.85.178,10.0.2.15,TCP,60,9001  >  35978 [ACK] Seq=1592539 Ack=27487913 Win=65535 Len=0
1,0.9149169999999458,10.0.2.15,62.210.85.178,TLSv1.2,1618,Application Data
1,0.9150740000000042,62.210.85.178,10.0.2.15,TCP,60,9001  >  35978 [ACK] Seq=1592539 Ack=27489373 Win=65535 Len=0
1,0.9150939999999537,62.210.85.178,10.0.2.15,TCP,60,9001  >  35978 [ACK] Seq=1592539 Ack=27489477 Win=65535 Len=0
1,1.19681700000001,54.93.77.70,10.0.2.15,TLSv1.2,2132,Application Data
1,1.1969560000000001,10.0.2.15,54.93.77.70,TCP,54,34692  >  9001 [ACK] Seq=1588175 Ack=27370599 Win=65535 Len=0
1,1.1992089999999962,10.0.2.15,54.93.77.70,TLSv1.2,590,Application Data
1,1.1993810000000167,54.93.77.70,10.0.2.15,TCP,60,9001  >  34692 [ACK] Seq=27370599 Ack=1588711 Win=65535 Len=0
1,1.3032899999999472,62.210.85.178,10.0.2.15,TLSv1.2,590,Application Data
1,1.3035959999999704,10.0.2.15,62.210.85.178,TLSv1.2,590,Application Data
1,1.3036989999999378,62.210.85.178,10.0.2.15,TCP,60,9001  >  35978 [ACK] Seq=1593075 Ack=27490013 Win=65535 Len=0
1,1.812667999999917,54.93.77.70,10.0.2.15,TLSv1.2,590,Application Data
1,1.8131129999999303,10.0.2.15,54.93.77.70,TLSv1.2,590,Application Data
1,1.813258000000019,54.93.77.70,10.0.2.15,TCP,60,9001  >  34692 [ACK] Seq=27371135 Ack=1589247 Win=65535 Len=0
1,3.042752999999948,62.210.85.178,10.0.2.15,TLSv1.2,590,Application Data
1,3.046210999999971,10.0.2.15,62.210.85.178,TLSv1.2,590,Application Data
1,3.0463809999999967,62.210.85.178,10.0.2.15,TCP,60,9001  >  35978 [ACK] Seq=1593611 Ack=27490549 Win=65535 Len=0
1,3.0581609999999273,10.0.2.15,62.210.85.178,TLSv1.2,4124,Application Data
1,3.0582959999999275,10.0.2.15,62.210.85.178,TCP,2974,35978  >  9001 [ACK] Seq=27494619 Ack=1593611 Win=65535 Len=2920 [TCP segment of a reassembled PDU]
1,3.0583239999999705,62.210.85.178,10.0.2.15,TCP,60,9001  >  35978 [ACK] Seq=1593611 Ack=27492009 Win=65535 Len=0
1,3.0583349999999427,62.210.85.178,10.0.2.15,TCP,60,9001  >  35978 [ACK] Seq=1593611 Ack=27493469 Win=65535 Len=0
1,3.05833999999993,62.210.85.178,10.0.2.15,TCP,60,9001  >  35978 [ACK] Seq=1593611 Ack=27494619 Win=65535 Len=0
1,3.05838499999993,10.0.2.15,62.210.85.178,TLSv1.2,1204,Application Data
1,3.0584259999999404,62.210.85.178,10.0.2.15,TCP,60,9001  >  35978 [ACK] Seq=1593611 Ack=27496079 Win=65535 Len=0
1,3.0584329999999227,62.210.85.178,10.0.2.15,TCP,60,9001  >  35978 [ACK] Seq=1593611 Ack=27497539 Win=65535 Len=0
1,3.0584380000000237,62.210.85.178,10.0.2.15,TCP,60,9001  >  35978 [ACK] Seq=1593611 Ack=27498689 Win=65535 Len=0
1,3.0584870000000137,10.0.2.15,62.210.85.178,TLSv1.2,4124,Application Data
1,3.0585889999999836,62.210.85.178,10.0.2.15,TCP,60,9001  >  35978 [ACK] Seq=1593611 Ack=27500149 Win=65535 Len=0
1,3.0586039999999457,62.210.85.178,10.0.2.15,TCP,60,9001  >  35978 [ACK] Seq=1593611 Ack=27501609 Win=65535 Len=0
1,3.0586079999999356,62.210.85.178,10.0.2.15,TCP,60,9001  >  35978 [ACK] Seq=1593611 Ack=27502759 Win=65535 Len=0
1,3.0586459999999533,10.0.2.15,62.210.85.178,TLSv1.2,1296,Application Data
1,3.0587509999999156,62.210.85.178,10.0.2.15,TCP,60,9001  >  35978 [ACK] Seq=1593611 Ack=27504001 Win=65535 Len=0
1,3.24530900000002,54.93.77.70,10.0.2.15,TLSv1.2,2132,Application Data
1,3.245437999999922,10.0.2.15,54.93.77.70,TCP,54,34692  >  9001 [ACK] Seq=1589247 Ack=27373213 Win=65535 Len=0
1,3.65524199999993,54.93.77.70,10.0.2.15,TLSv1.2,1618,Application Data
1,3.655320999999958,10.0.2.15,54.93.77.70,TCP,54,34692  >  9001 [ACK] Seq=1589247 Ack=27374777 Win=65535 Len=0
1,3.675399999999968,54.93.77.70,10.0.2.15,TLSv1.2,3674,Application Data
1,3.675479999999993,10.0.2.15,54.93.77.70,TCP,54,34692  >  9001 [ACK] Seq=1589247 Ack=27378397 Win=65535 Len=0
1,3.686230000000023,54.93.77.70,10.0.2.15,TCP,1502,"9001  >  34692 [PSH, ACK] Seq=27378397 Ack=1589247 Win=65535 Len=1448 [TCP segment of a reassembled PDU]"
1,3.6862800000000107,10.0.2.15,54.93.77.70,TCP,54,34692  >  9001 [ACK] Seq=1589247 Ack=27379845 Win=65535 Len=0
1,3.692637999999988,54.93.77.70,10.0.2.15,TLSv1.2,684,Application Data
1,3.7340050000000247,10.0.2.15,54.93.77.70,TCP,54,34692  >  9001 [ACK] Seq=1589247 Ack=27380475 Win=65535 Len=0
1,3.7507249999999885,54.93.77.70,10.0.2.15,TLSv1.2,2646,Application Data
1,3.750782999999956,10.0.2.15,54.93.77.70,TCP,54,34692  >  9001 [ACK] Seq=1589247 Ack=27383067 Win=65535 Len=0
1,3.7712139999999863,54.93.77.70,10.0.2.15,TLSv1.2,2132,Application Data
1,3.7712639999999737,10.0.2.15,54.93.77.70,TCP,54,34692  >  9001 [ACK] Seq=1589247 Ack=27385145 Win=65535 Len=0
1,3.7735569999999825,10.0.2.15,54.93.77.70,TLSv1.2,590,Application Data
1,3.7737019999999575,54.93.77.70,10.0.2.15,TCP,60,9001  >  34692 [ACK] Seq=27385145 Ack=1589783 Win=65535 Len=0
1,4.88441499999999,62.210.85.178,10.0.2.15,TLSv1.2,590,Application Data
1,4.884719000000018,10.0.2.15,62.210.85.178,TLSv1.2,590,Application Data
1,4.884824999999978,62.210.85.178,10.0.2.15,TCP,60,9001  >  35978 [ACK] Seq=1594147 Ack=27504537 Win=65535 Len=0
1,5.088929000000007,54.93.77.70,10.0.2.15,TLSv1.2,590,Application Data
1,5.089297999999985,10.0.2.15,54.93.77.70,TLSv1.2,590,Application Data
1,5.0894049999999424,54.93.77.70,10.0.2.15,TCP,60,9001  >  34692 [ACK] Seq=27385681 Ack=1590319 Win=65535 Len=0
1,5.293292999999949,62.210.85.178,10.0.2.15,TLSv1.2,590,Application Data
1,5.300970000000007,10.0.2.15,62.210.85.178,TLSv1.2,590,Application Data
1,5.301127999999949,62.210.85.178,10.0.2.15,TCP,60,9001  >  35978 [ACK] Seq=1594683 Ack=27505073 Win=65535 Len=0
1,5.314817999999946,10.0.2.15,62.210.85.178,TLSv1.2,4124,Application Data
1,5.314920999999913,10.0.2.15,62.210.85.178,TCP,2974,35978  >  9001 [ACK] Seq=27509143 Ack=1594683 Win=65535 Len=2920 [TCP segment of a reassembled PDU]
1,5.314961999999923,62.210.85.178,10.0.2.15,TCP,60,9001  >  35978 [ACK] Seq=1594683 Ack=27506533 Win=65535 Len=0
1,5.3149740000000065,62.210.85.178,10.0.2.15,TCP,60,9001  >  35978 [ACK] Seq=1594683 Ack=27507993 Win=65535 Len=0
1,5.314977999999996,62.210.85.178,10.0.2.15,TCP,60,9001  >  35978 [ACK] Seq=1594683 Ack=27509143 Win=65535 Len=0
1,5.314980999999989,62.210.85.178,10.0.2.15,TCP,60,9001  >  35978 [ACK] Seq=1594683 Ack=27510603 Win=65535 Len=0
1,5.314982999999984,62.210.85.178,10.0.2.15,TCP,60,9001  >  35978 [ACK] Seq=1594683 Ack=27512063 Win=65535 Len=0
1,5.315019000000007,10.0.2.15,62.210.85.178,TLSv1.2,1204,Application Data
1,5.315052999999921,62.210.85.178,10.0.2.15,TCP,60,9001  >  35978 [ACK] Seq=1594683 Ack=27513213 Win=65535 Len=0
1,5.315097999999921,10.0.2.15,62.210.85.178,TLSv1.2,4124,Application Data
1,5.315133999999944,62.210.85.178,10.0.2.15,TCP,60,9001  >  35978 [ACK] Seq=1594683 Ack=27514673 Win=65535 Len=0
1,5.315141999999923,62.210.85.178,10.0.2.15,TCP,60,9001  >  35978 [ACK] Seq=1594683 Ack=27516133 Win=65535 Len=0
1,5.315145999999913,62.210.85.178,10.0.2.15,TCP,60,9001  >  35978 [ACK] Seq=1594683 Ack=27517283 Win=65535 Len=0
1,5.3151869999999235,10.0.2.15,62.210.85.178,TLSv1.2,4124,Application Data
1,5.315220999999951,62.210.85.178,10.0.2.15,TCP,60,9001  >  35978 [ACK] Seq=1594683 Ack=27518743 Win=65535 Len=0
1,5.315227999999934,62.210.85.178,10.0.2.15,TCP,60,9001  >  35978 [ACK] Seq=1594683 Ack=27520203 Win=65535 Len=0
1,5.315286000000015,10.0.2.15,62.210.85.178,TLSv1.2,2974,Application Data
1,5.315321999999924,62.210.85.178,10.0.2.15,TCP,60,9001  >  35978 [ACK] Seq=1594683 Ack=27521353 Win=65535 Len=0
1,5.31532900000002,62.210.85.178,10.0.2.15,TCP,60,9001  >  35978 [ACK] Seq=1594683 Ack=27522813 Win=65535 Len=0
1,5.31533300000001,62.210.85.178,10.0.2.15,TCP,60,9001  >  35978 [ACK] Seq=1594683 Ack=27524273 Win=65535 Len=0
1,5.3153599999999415,10.0.2.15,62.210.85.178,TLSv1.2,1226,Application Data
1,5.315392999999972,62.210.85.178,10.0.2.15,TCP,60,9001  >  35978 [ACK] Seq=1594683 Ack=27525445 Win=65535 Len=0
1,5.315431999999987,10.0.2.15,62.210.85.178,TLSv1.2,4124,Application Data
1,5.315467000000012,62.210.85.178,10.0.2.15,TCP,60,9001  >  35978 [ACK] Seq=1594683 Ack=27526905 Win=65535 Len=0
1,5.315472999999997,62.210.85.178,10.0.2.15,TCP,60,9001  >  35978 [ACK] Seq=1594683 Ack=27528365 Win=65535 Len=0
1,5.31547599999999,62.210.85.178,10.0.2.15,TCP,60,9001  >  35978 [ACK] Seq=1594683 Ack=27529515 Win=65535 Len=0
1,5.31551300000001,10.0.2.15,62.210.85.178,TLSv1.2,3030,Application Data
1,5.315547999999922,62.210.85.178,10.0.2.15,TCP,60,9001  >  35978 [ACK] Seq=1594683 Ack=27530975 Win=65535 Len=0
1,5.31555400000002,62.210.85.178,10.0.2.15,TCP,60,9001  >  35978 [ACK] Seq=1594683 Ack=27532435 Win=65535 Len=0
1,5.3155570000000125,62.210.85.178,10.0.2.15,TCP,60,9001  >  35978 [ACK] Seq=1594683 Ack=27532491 Win=65535 Len=0
1,5.324780999999916,10.0.2.15,62.210.85.178,TLSv1.2,4124,Application Data
1,5.324865999999929,62.210.85.178,10.0.2.15,TCP,60,9001  >  35978 [ACK] Seq=1594683 Ack=27533951 Win=65535 Len=0
1,5.32487500000002,62.210.85.178,10.0.2.15,TCP,60,9001  >  35978 [ACK] Seq=1594683 Ack=27535411 Win=65535 Len=0
1,5.324878000000012,62.210.85.178,10.0.2.15,TCP,60,9001  >  35978 [ACK] Seq=1594683 Ack=27536561 Win=65535 Len=0
1,5.3249159999999165,10.0.2.15,62.210.85.178,TLSv1.2,4124,Application Data
1,5.324977999999987,62.210.85.178,10.0.2.15,TCP,60,9001  >  35978 [ACK] Seq=1594683 Ack=27538021 Win=65535 Len=0
1,5.32498499999997,62.210.85.178,10.0.2.15,TCP,60,9001  >  35978 [ACK] Seq=1594683 Ack=27539481 Win=65535 Len=0
1,5.324987999999962,62.210.85.178,10.0.2.15,TCP,60,9001  >  35978 [ACK] Seq=1594683 Ack=27540631 Win=65535 Len=0
1,5.325023999999985,10.0.2.15,62.210.85.178,TLSv1.2,4124,Application Data
1,5.325057000000015,62.210.85.178,10.0.2.15,TCP,60,9001  >  35978 [ACK] Seq=1594683 Ack=27542091 Win=65535 Len=0
1,5.325063999999998,62.210.85.178,10.0.2.15,TCP,60,9001  >  35978 [ACK] Seq=1594683 Ack=27543551 Win=65535 Len=0
1,5.325068999999985,62.210.85.178,10.0.2.15,TCP,60,9001  >  35978 [ACK] Seq=1594683 Ack=27544701 Win=65535 Len=0
1,5.325105000000008,10.0.2.15,62.210.85.178,TLSv1.2,4124,Application Data
1,5.325137999999924,62.210.85.178,10.0.2.15,TCP,60,9001  >  35978 [ACK] Seq=1594683 Ack=27546161 Win=65535 Len=0
1,5.3251450000000204,62.210.85.178,10.0.2.15,TCP,60,9001  >  35978 [ACK] Seq=1594683 Ack=27547621 Win=65535 Len=0
1,5.325150000000008,62.210.85.178,10.0.2.15,TCP,60,9001  >  35978 [ACK] Seq=1594683 Ack=27548771 Win=65535 Len=0
1,5.325183999999922,10.0.2.15,62.210.85.178,TLSv1.2,332,Application Data
1,5.325218999999947,62.210.85.178,10.0.2.15,TCP,60,9001  >  35978 [ACK] Seq=1594683 Ack=27549049 Win=65535 Len=0
1,5.325268999999935,10.0.2.15,62.210.85.178,TLSv1.2,3868,Application Data
1,5.3253049999999575,62.210.85.178,10.0.2.15,TCP,60,9001  >  35978 [ACK] Seq=1594683 Ack=27550509 Win=65535 Len=0
1,5.32531199999994,62.210.85.178,10.0.2.15,TCP,60,9001  >  35978 [ACK] Seq=1594683 Ack=27551969 Win=65535 Len=0
1,5.325314999999932,62.210.85.178,10.0.2.15,TCP,60,9001  >  35978 [ACK] Seq=1594683 Ack=27552863 Win=65535 Len=0
1,5.32535299999995,10.0.2.15,62.210.85.178,TLSv1.2,4124,Application Data
1,5.32539399999996,62.210.85.178,10.0.2.15,TCP,60,9001  >  35978 [ACK] Seq=1594683 Ack=27554323 Win=65535 Len=0
1,5.325399999999945,62.210.85.178,10.0.2.15,TCP,60,9001  >  35978 [ACK] Seq=1594683 Ack=27555783 Win=65535 Len=0
1,5.3254029999999375,62.210.85.178,10.0.2.15,TCP,60,9001  >  35978 [ACK] Seq=1594683 Ack=27556933 Win=65535 Len=0
1,5.325437999999963,10.0.2.15,62.210.85.178,TLSv1.2,3030,Application Data
1,5.325473999999986,62.210.85.178,10.0.2.15,TCP,60,9001  >  35978 [ACK] Seq=1594683 Ack=27558393 Win=65535 Len=0
1,5.3254799999999705,62.210.85.178,10.0.2.15,TCP,60,9001  >  35978 [ACK] Seq=1594683 Ack=27559853 Win=65535 Len=0
1,5.325482999999963,62.210.85.178,10.0.2.15,TCP,60,9001  >  35978 [ACK] Seq=1594683 Ack=27559909 Win=65535 Len=0
1,5.339062000000013,10.0.2.15,62.210.85.178,TLSv1.2,4124,Application Data
1,5.339162999999985,10.0.2.15,62.210.85.178,TCP,2974,35978  >  9001 [ACK] Seq=27563979 Ack=1594683 Win=65535 Len=2920 [TCP segment of a reassembled PDU]
1,5.339214999999967,62.210.85.178,10.0.2.15,TCP,60,9001  >  35978 [ACK] Seq=1594683 Ack=27561369 Win=65535 Len=0
1,5.339223999999945,62.210.85.178,10.0.2.15,TCP,60,9001  >  35978 [ACK] Seq=1594683 Ack=27562829 Win=65535 Len=0
1,5.339228999999932,62.210.85.178,10.0.2.15,TCP,60,9001  >  35978 [ACK] Seq=1594683 Ack=27563979 Win=65535 Len=0
1,5.339273999999932,10.0.2.15,62.210.85.178,TLSv1.2,1204,Application Data
1,5.33931199999995,62.210.85.178,10.0.2.15,TCP,60,9001  >  35978 [ACK] Seq=1594683 Ack=27565439 Win=65535 Len=0
1,5.339318999999932,62.210.85.178,10.0.2.15,TCP,60,9001  >  35978 [ACK] Seq=1594683 Ack=27566899 Win=65535 Len=0
1,5.339322999999922,62.210.85.178,10.0.2.15,TCP,60,9001  >  35978 [ACK] Seq=1594683 Ack=27568049 Win=65535 Len=0
1,5.339373000000023,10.0.2.15,62.210.85.178,TLSv1.2,4124,Application Data
1,5.33944299999996,10.0.2.15,62.210.85.178,TCP,2974,35978  >  9001 [ACK] Seq=27572119 Ack=1594683 Win=65535 Len=2920 [TCP segment of a reassembled PDU]
1,5.339481999999975,62.210.85.178,10.0.2.15,TCP,60,9001  >  35978 [ACK] Seq=1594683 Ack=27569509 Win=65535 Len=0
1,5.33948799999996,62.210.85.178,10.0.2.15,TCP,60,9001  >  35978 [ACK] Seq=1594683 Ack=27570969 Win=65535 Len=0
1,5.339492999999948,62.210.85.178,10.0.2.15,TCP,60,9001  >  35978 [ACK] Seq=1594683 Ack=27572119 Win=65535 Len=0
1,5.3394969999999375,62.210.85.178,10.0.2.15,TCP,60,9001  >  35978 [ACK] Seq=1594683 Ack=27573579 Win=65535 Len=0
1,5.3395009999999274,62.210.85.178,10.0.2.15,TCP,60,9001  >  35978 [ACK] Seq=1594683 Ack=27575039 Win=65535 Len=0
1,5.339538999999945,10.0.2.15,62.210.85.178,TLSv1.2,1204,Application Data
1,5.339576999999963,62.210.85.178,10.0.2.15,TCP,60,9001  >  35978 [ACK] Seq=1594683 Ack=27576189 Win=65535 Len=0
1,5.3396209999999655,10.0.2.15,62.210.85.178,TLSv1.2,332,Application Data
1,5.339713999999958,10.0.2.15,62.210.85.178,TCP,2974,35978  >  9001 [ACK] Seq=27576467 Ack=1594683 Win=65535 Len=2920 [TCP segment of a reassembled PDU]
1,5.339737000000014,62.210.85.178,10.0.2.15,TCP,60,9001  >  35978 [ACK] Seq=1594683 Ack=27576467 Win=65535 Len=0
1,5.339743999999996,62.210.85.178,10.0.2.15,TCP,60,9001  >  35978 [ACK] Seq=1594683 Ack=27577927 Win=65535 Len=0
1,5.339747999999986,62.210.85.178,10.0.2.15,TCP,60,9001  >  35978 [ACK] Seq=1594683 Ack=27579387 Win=65535 Len=0
1,5.339783000000011,10.0.2.15,62.210.85.178,TLSv1.2,948,Application Data
1,5.339823000000024,62.210.85.178,10.0.2.15,TCP,60,9001  >  35978 [ACK] Seq=1594683 Ack=27580281 Win=65535 Len=0
1,5.3398639999999205,10.0.2.15,62.210.85.178,TLSv1.2,910,Application Data
1,5.339902999999936,62.210.85.178,10.0.2.15,TCP,60,9001  >  35978 [ACK] Seq=1594683 Ack=27581137 Win=65535 Len=0
1,5.399622000000022,54.93.77.70,10.0.2.15,TLSv1.2,590,Application Data
1,5.44199500000002,10.0.2.15,54.93.77.70,TCP,54,34692  >  9001 [ACK] Seq=1590319 Ack=27386217 Win=65535 Len=0
1,5.464051999999924,54.93.77.70,10.0.2.15,TLSv1.2,3674,Application Data
1,5.46410800000001,10.0.2.15,54.93.77.70,TCP,54,34692  >  9001 [ACK] Seq=1590319 Ack=27389837 Win=65535 Len=0
1,5.473060999999916,54.93.77.70,10.0.2.15,TLSv1.2,5846,Application Data
1,5.4731389999999465,10.0.2.15,54.93.77.70,TCP,54,34692  >  9001 [ACK] Seq=1590319 Ack=27395629 Win=65535 Len=0
1,5.474307999999951,54.93.77.70,10.0.2.15,TCP,1502,"9001  >  34692 [PSH, ACK] Seq=27395629 Ack=1590319 Win=65535 Len=1448 [TCP segment of a reassembled PDU]"
1,5.474352999999951,10.0.2.15,54.93.77.70,TCP,54,34692  >  9001 [ACK] Seq=1590319 Ack=27397077 Win=65535 Len=0
1,5.480425999999966,54.93.77.70,10.0.2.15,TLSv1.2,568,Application Data
1,5.480466999999976,10.0.2.15,54.93.77.70,TCP,54,34692  >  9001 [ACK] Seq=1590319 Ack=27397591 Win=65535 Len=0
1,5.482295000000022,54.93.77.70,10.0.2.15,TCP,2950,"9001  >  34692 [PSH, ACK] Seq=27397591 Ack=1590319 Win=65535 Len=2896 [TCP segment of a reassembled PDU]"
1,5.482337999999913,10.0.2.15,54.93.77.70,TCP,54,34692  >  9001 [ACK] Seq=1590319 Ack=27400487 Win=65535 Len=0
1,5.494137000000023,54.93.77.70,10.0.2.15,TLSv1.2,4398,"Application Data, Application Data"
1,5.4942179999999325,10.0.2.15,54.93.77.70,TCP,54,34692  >  9001 [ACK] Seq=1590319 Ack=27404831 Win=65535 Len=0
1,5.502663999999982,54.93.77.70,10.0.2.15,TCP,2950,"9001  >  34692 [PSH, ACK] Seq=27404831 Ack=1590319 Win=65535 Len=2896 [TCP segment of a reassembled PDU]"
1,5.5027619999999615,10.0.2.15,54.93.77.70,TCP,54,34692  >  9001 [ACK] Seq=1590319 Ack=27407727 Win=65535 Len=0
1,5.503240000000005,54.93.77.70,10.0.2.15,TLSv1.2,5448,"Application Data, Application Data, Application Data"
1,5.503300999999965,10.0.2.15,54.93.77.70,TCP,54,34692  >  9001 [ACK] Seq=1590319 Ack=27413121 Win=65535 Len=0
1,5.503653999999983,10.0.2.15,54.93.77.70,TLSv1.2,1104,Application Data
1,5.503741999999988,54.93.77.70,10.0.2.15,TCP,60,9001  >  34692 [ACK] Seq=27413121 Ack=1591369 Win=65535 Len=0
1,5.514609999999948,54.93.77.70,10.0.2.15,TCP,2950,"9001  >  34692 [PSH, ACK] Seq=27413121 Ack=1591369 Win=65535 Len=2896 [TCP segment of a reassembled PDU]"
1,5.514674000000014,10.0.2.15,54.93.77.70,TCP,54,34692  >  9001 [ACK] Seq=1591369 Ack=27416017 Win=65535 Len=0
1,5.52017699999999,54.93.77.70,10.0.2.15,TLSv1.2,778,Application Data
1,5.524779999999964,54.93.77.70,10.0.2.15,TCP,1502,"9001  >  34692 [PSH, ACK] Seq=27416741 Ack=1591369 Win=65535 Len=1448 [TCP segment of a reassembled PDU]"
1,5.524823999999967,10.0.2.15,54.93.77.70,TCP,54,34692  >  9001 [ACK] Seq=1591369 Ack=27418189 Win=65535 Len=0
1,5.525796000000014,54.93.77.70,10.0.2.15,TLSv1.2,2950,Application Data [TCP segment of a reassembled PDU]
1,5.525856999999974,10.0.2.15,54.93.77.70,TCP,54,34692  >  9001 [ACK] Seq=1591369 Ack=27421085 Win=65535 Len=0
1,5.537943999999925,54.93.77.70,10.0.2.15,TLSv1.2,1408,Application Data
1,5.546280000000024,54.93.77.70,10.0.2.15,TLSv1.2,4398,Application Data
1,5.546350999999959,10.0.2.15,54.93.77.70,TCP,54,34692  >  9001 [ACK] Seq=1591369 Ack=27426783 Win=65535 Len=0
1,5.555158000000006,54.93.77.70,10.0.2.15,TLSv1.2,5846,"Application Data, Application Data"
1,5.555202000000008,10.0.2.15,54.93.77.70,TCP,54,34692  >  9001 [ACK] Seq=1591369 Ack=27432575 Win=65535 Len=0
1,5.555303999999978,54.93.77.70,10.0.2.15,TLSv1.2,2856,Application Data
1,5.555348999999978,10.0.2.15,54.93.77.70,TCP,54,34692  >  9001 [ACK] Seq=1591369 Ack=27435377 Win=65535 Len=0
1,5.5770539999999755,54.93.77.70,10.0.2.15,TLSv1.2,5238,"Application Data, Application Data"
1,5.577101999999968,10.0.2.15,54.93.77.70,TCP,54,34692  >  9001 [ACK] Seq=1591369 Ack=27440561 Win=65535 Len=0
1,5.577256999999918,10.0.2.15,54.93.77.70,TLSv1.2,590,Application Data
1,5.577325999999971,54.93.77.70,10.0.2.15,TCP,60,9001  >  34692 [ACK] Seq=27440561 Ack=1591905 Win=65535 Len=0
1,5.586966999999959,54.93.77.70,10.0.2.15,TCP,2950,"9001  >  34692 [PSH, ACK] Seq=27440561 Ack=1591905 Win=65535 Len=2896 [TCP segment of a reassembled PDU]"
1,5.587034000000017,10.0.2.15,54.93.77.70,TCP,54,34692  >  9001 [ACK] Seq=1591905 Ack=27443457 Win=65535 Len=0
1,5.593135999999959,54.93.77.70,10.0.2.15,TLSv1.2,778,Application Data
1,5.598067000000015,54.93.77.70,10.0.2.15,TCP,1502,"9001  >  34692 [PSH, ACK] Seq=27444181 Ack=1591905 Win=65535 Len=1448 [TCP segment of a reassembled PDU]"
1,5.598240999999916,10.0.2.15,54.93.77.70,TCP,54,34692  >  9001 [ACK] Seq=1591905 Ack=27445629 Win=65535 Len=0
1,5.6099779999999555,54.93.77.70,10.0.2.15,TLSv1.2,4326,"Application Data, Application Data, Application Data"
1,5.610097999999994,10.0.2.15,54.93.77.70,TCP,54,34692  >  9001 [ACK] Seq=1591905 Ack=27449901 Win=65535 Len=0
1,5.618995999999925,62.210.85.178,10.0.2.15,TLSv1.2,1104,Application Data
1,5.62858899999992,54.93.77.70,10.0.2.15,TLSv1.2,4398,Application Data
1,5.628657999999973,10.0.2.15,54.93.77.70,TCP,54,34692  >  9001 [ACK] Seq=1591905 Ack=27454245 Win=65535 Len=0
1,5.629568999999947,54.93.77.70,10.0.2.15,TLSv1.2,3464,Application Data
1,5.629614999999944,10.0.2.15,54.93.77.70,TCP,54,34692  >  9001 [ACK] Seq=1591905 Ack=27457655 Win=65535 Len=0
1,5.651593999999932,54.93.77.70,10.0.2.15,TCP,2950,"9001  >  34692 [PSH, ACK] Seq=27457655 Ack=1591905 Win=65535 Len=2896 [TCP segment of a reassembled PDU]"
1,5.651657999999998,10.0.2.15,54.93.77.70,TCP,54,34692  >  9001 [ACK] Seq=1591905 Ack=27460551 Win=65535 Len=0
1,5.651722999999947,54.93.77.70,10.0.2.15,TLSv1.2,1474,Application Data [TCP segment of a reassembled PDU]
1,5.651896999999963,54.93.77.70,10.0.2.15,TLSv1.2,408,Application Data
1,5.65193499999998,10.0.2.15,54.93.77.70,TCP,54,34692  >  9001 [ACK] Seq=1591905 Ack=27462325 Win=65535 Len=0
1,5.652166999999963,10.0.2.15,54.93.77.70,TLSv1.2,590,Application Data
1,5.652243999999996,54.93.77.70,10.0.2.15,TCP,60,9001  >  34692 [ACK] Seq=27462325 Ack=1592441 Win=65535 Len=0
1,5.662008000000014,10.0.2.15,62.210.85.178,TCP,54,35978  >  9001 [ACK] Seq=27581137 Ack=1595733 Win=65535 Len=0
1,5.662222999999926,10.0.2.15,54.93.77.70,TLSv1.2,590,Application Data
1,5.662317999999914,54.93.77.70,10.0.2.15,TCP,60,9001  >  34692 [ACK] Seq=27462325 Ack=1592977 Win=65535 Len=0
1,6.112181999999962,62.210.85.178,10.0.2.15,TLSv1.2,1104,Application Data
1,6.112288999999919,10.0.2.15,62.210.85.178,TCP,54,35978  >  9001 [ACK] Seq=27581137 Ack=1596783 Win=65535 Len=0
1,6.130965999999944,62.210.85.178,10.0.2.15,TLSv1.2,590,Application Data
1,6.131020999999919,10.0.2.15,62.210.85.178,TCP,54,35978  >  9001 [ACK] Seq=27581137 Ack=1597319 Win=65535 Len=0
1,6.131519000000026,10.0.2.15,62.210.85.178,TLSv1.2,590,Application Data
1,6.1316209999999955,62.210.85.178,10.0.2.15,TCP,60,9001  >  35978 [ACK] Seq=1597319 Ack=27581673 Win=65535 Len=0
1,6.72679299999993,54.93.77.70,10.0.2.15,TLSv1.2,590,Application Data
1,6.727254000000016,10.0.2.15,54.93.77.70,TLSv1.2,590,Application Data
1,6.7273910000000114,54.93.77.70,10.0.2.15,TCP,60,9001  >  34692 [ACK] Seq=27462861 Ack=1593513 Win=65535 Len=0
1,7.65042399999993,62.210.85.178,10.0.2.15,TLSv1.2,590,Application Data
1,7.655628999999976,10.0.2.15,62.210.85.178,TLSv1.2,590,Application Data
1,7.655796000000009,62.210.85.178,10.0.2.15,TCP,60,9001  >  35978 [ACK] Seq=1597855 Ack=27582209 Win=65535 Len=0
1,7.665947999999958,10.0.2.15,62.210.85.178,TLSv1.2,4124,Application Data
1,7.666098999999917,62.210.85.178,10.0.2.15,TCP,60,9001  >  35978 [ACK] Seq=1597855 Ack=27583669 Win=65535 Len=0
1,7.666117999999983,62.210.85.178,10.0.2.15,TCP,60,9001  >  35978 [ACK] Seq=1597855 Ack=27585129 Win=65535 Len=0
1,7.6661209999999755,62.210.85.178,10.0.2.15,TCP,60,9001  >  35978 [ACK] Seq=1597855 Ack=27586279 Win=65535 Len=0
1,7.666173999999955,10.0.2.15,62.210.85.178,TLSv1.2,4124,Application Data
1,7.666244000000006,62.210.85.178,10.0.2.15,TCP,60,9001  >  35978 [ACK] Seq=1597855 Ack=27587739 Win=65535 Len=0
1,7.666250999999988,62.210.85.178,10.0.2.15,TCP,60,9001  >  35978 [ACK] Seq=1597855 Ack=27589199 Win=65535 Len=0
1,7.666253999999981,62.210.85.178,10.0.2.15,TCP,60,9001  >  35978 [ACK] Seq=1597855 Ack=27590349 Win=65535 Len=0
1,7.666278999999918,10.0.2.15,62.210.85.178,TCP,2974,35978  >  9001 [ACK] Seq=27590349 Ack=1597855 Win=65535 Len=2920 [TCP segment of a reassembled PDU]
1,7.6663129999999455,62.210.85.178,10.0.2.15,TCP,60,9001  >  35978 [ACK] Seq=1597855 Ack=27591809 Win=65535 Len=0
1,7.666319999999928,62.210.85.178,10.0.2.15,TCP,60,9001  >  35978 [ACK] Seq=1597855 Ack=27593269 Win=65535 Len=0
1,7.666348999999968,10.0.2.15,62.210.85.178,TLSv1.2,1204,Application Data
1,7.666381999999999,62.210.85.178,10.0.2.15,TCP,60,9001  >  35978 [ACK] Seq=1597855 Ack=27594419 Win=65535 Len=0
1,7.666423000000009,10.0.2.15,62.210.85.178,TLSv1.2,4124,Application Data
1,7.666458999999918,62.210.85.178,10.0.2.15,TCP,60,9001  >  35978 [ACK] Seq=1597855 Ack=27595879 Win=65535 Len=0
1,7.6664650000000165,62.210.85.178,10.0.2.15,TCP,60,9001  >  35978 [ACK] Seq=1597855 Ack=27597339 Win=65535 Len=0
1,7.666523999999981,10.0.2.15,62.210.85.178,TLSv1.2,2974,Application Data
1,7.6665610000000015,62.210.85.178,10.0.2.15,TCP,60,9001  >  35978 [ACK] Seq=1597855 Ack=27598489 Win=65535 Len=0
1,7.666567999999984,62.210.85.178,10.0.2.15,TCP,60,9001  >  35978 [ACK] Seq=1597855 Ack=27599949 Win=65535 Len=0
1,7.666570999999976,62.210.85.178,10.0.2.15,TCP,60,9001  >  35978 [ACK] Seq=1597855 Ack=27601409 Win=65535 Len=0
1,7.666598000000022,10.0.2.15,62.210.85.178,TLSv1.2,1226,Application Data
1,7.6666309999999385,62.210.85.178,10.0.2.15,TCP,60,9001  >  35978 [ACK] Seq=1597855 Ack=27602581 Win=65535 Len=0
1,7.666669999999954,10.0.2.15,62.210.85.178,TLSv1.2,4124,Application Data
1,7.666704999999979,62.210.85.178,10.0.2.15,TCP,60,9001  >  35978 [ACK] Seq=1597855 Ack=27604041 Win=65535 Len=0
1,7.666711999999961,62.210.85.178,10.0.2.15,TCP,60,9001  >  35978 [ACK] Seq=1597855 Ack=27605501 Win=65535 Len=0
1,7.666713999999956,62.210.85.178,10.0.2.15,TCP,60,9001  >  35978 [ACK] Seq=1597855 Ack=27606651 Win=65535 Len=0
1,7.666750999999977,10.0.2.15,62.210.85.178,TLSv1.2,3030,Application Data
1,7.666786000000002,62.210.85.178,10.0.2.15,TCP,60,9001  >  35978 [ACK] Seq=1597855 Ack=27608111 Win=65535 Len=0
1,7.666792999999984,62.210.85.178,10.0.2.15,TCP,60,9001  >  35978 [ACK] Seq=1597855 Ack=27609571 Win=65535 Len=0
1,7.666795999999977,62.210.85.178,10.0.2.15,TCP,60,9001  >  35978 [ACK] Seq=1597855 Ack=27609627 Win=65535 Len=0
1,7.675959999999918,10.0.2.15,62.210.85.178,TLSv1.2,4124,Application Data
1,7.676051999999913,10.0.2.15,62.210.85.178,TCP,2974,35978  >  9001 [ACK] Seq=27613697 Ack=1597855 Win=65535 Len=2920 [TCP segment of a reassembled PDU]
1,7.676095999999916,62.210.85.178,10.0.2.15,TCP,60,9001  >  35978 [ACK] Seq=1597855 Ack=27611087 Win=65535 Len=0
1,7.676106000000004,62.210.85.178,10.0.2.15,TCP,60,9001  >  35978 [ACK] Seq=1597855 Ack=27612547 Win=65535 Len=0
1,7.6761169999999765,62.210.85.178,10.0.2.15,TCP,60,9001  >  35978 [ACK] Seq=1597855 Ack=27613697 Win=65535 Len=0
1,7.676121999999964,62.210.85.178,10.0.2.15,TCP,60,9001  >  35978 [ACK] Seq=1597855 Ack=27615157 Win=65535 Len=0
1,7.676125999999954,62.210.85.178,10.0.2.15,TCP,60,9001  >  35978 [ACK] Seq=1597855 Ack=27616617 Win=65535 Len=0
1,7.676172999999949,10.0.2.15,62.210.85.178,TLSv1.2,1204,Application Data
1,7.676242000000002,10.0.2.15,62.210.85.178,TCP,2974,35978  >  9001 [ACK] Seq=27617767 Ack=1597855 Win=65535 Len=2920 [TCP segment of a reassembled PDU]
1,7.67628000000002,62.210.85.178,10.0.2.15,TCP,60,9001  >  35978 [ACK] Seq=1597855 Ack=27617767 Win=65535 Len=0
1,7.676315999999929,10.0.2.15,62.210.85.178,TLSv1.2,1204,Application Data
1,7.676355999999942,62.210.85.178,10.0.2.15,TCP,60,9001  >  35978 [ACK] Seq=1597855 Ack=27619227 Win=65535 Len=0
1,7.676363999999921,62.210.85.178,10.0.2.15,TCP,60,9001  >  35978 [ACK] Seq=1597855 Ack=27620687 Win=65535 Len=0
1,7.676369000000022,62.210.85.178,10.0.2.15,TCP,60,9001  >  35978 [ACK] Seq=1597855 Ack=27621837 Win=65535 Len=0
1,7.676418000000012,10.0.2.15,62.210.85.178,TLSv1.2,4124,Application Data
1,7.676521999999977,62.210.85.178,10.0.2.15,TCP,60,9001  >  35978 [ACK] Seq=1597855 Ack=27623297 Win=65535 Len=0
1,7.676534999999944,62.210.85.178,10.0.2.15,TCP,60,9001  >  35978 [ACK] Seq=1597855 Ack=27624757 Win=65535 Len=0
1,7.676539999999932,62.210.85.178,10.0.2.15,TCP,60,9001  >  35978 [ACK] Seq=1597855 Ack=27625907 Win=65535 Len=0
1,7.676576999999952,10.0.2.15,62.210.85.178,TLSv1.2,868,"Application Data, Application Data"
1,7.676617999999962,62.210.85.178,10.0.2.15,TCP,60,9001  >  35978 [ACK] Seq=1597855 Ack=27626721 Win=65535 Len=0
1,8.263339999999971,54.93.77.70,10.0.2.15,TCP,2950,"9001  >  34692 [PSH, ACK] Seq=27462861 Ack=1593513 Win=65535 Len=2896 [TCP segment of a reassembled PDU]"
1,8.263483999999949,10.0.2.15,54.93.77.70,TCP,54,34692  >  9001 [ACK] Seq=1593513 Ack=27465757 Win=65535 Len=0
1,8.265976000000023,54.93.77.70,10.0.2.15,TLSv1.2,778,Application Data
1,8.313184999999976,10.0.2.15,54.93.77.70,TCP,54,34692  >  9001 [ACK] Seq=1593513 Ack=27466481 Win=65535 Len=0
1,8.468238999999926,54.93.77.70,10.0.2.15,TCP,2950,"9001  >  34692 [PSH, ACK] Seq=27466481 Ack=1593513 Win=65535 Len=2896 [TCP segment of a reassembled PDU]"
1,8.468324999999936,10.0.2.15,54.93.77.70,TCP,54,34692  >  9001 [ACK] Seq=1593513 Ack=27469377 Win=65535 Len=0
1,8.470674999999915,54.93.77.70,10.0.2.15,TLSv1.2,778,Application Data
1,8.47072700000001,10.0.2.15,54.93.77.70,TCP,54,34692  >  9001 [ACK] Seq=1593513 Ack=27470101 Win=65535 Len=0
1,8.558101999999963,54.93.77.70,10.0.2.15,TLSv1.2,590,Application Data
1,8.558182999999985,10.0.2.15,54.93.77.70,TCP,54,34692  >  9001 [ACK] Seq=1593513 Ack=27470637 Win=65535 Len=0
1,8.629021999999964,54.93.77.70,10.0.2.15,TLSv1.2,3674,Application Data
1,8.629099999999994,10.0.2.15,54.93.77.70,TCP,54,34692  >  9001 [ACK] Seq=1593513 Ack=27474257 Win=65535 Len=0
1,8.661437999999976,54.93.77.70,10.0.2.15,TLSv1.2,590,Application Data
1,8.661519999999996,10.0.2.15,54.93.77.70,TCP,54,34692  >  9001 [ACK] Seq=1593513 Ack=27474793 Win=65535 Len=0
1,8.733964000000014,54.93.77.70,10.0.2.15,TLSv1.2,3674,Application Data
1,8.734042999999929,10.0.2.15,54.93.77.70,TCP,54,34692  >  9001 [ACK] Seq=1593513 Ack=27478413 Win=65535 Len=0
1,8.754568999999947,54.93.77.70,10.0.2.15,TLSv1.2,590,Application Data
1,8.75462099999993,10.0.2.15,54.93.77.70,TCP,54,34692  >  9001 [ACK] Seq=1593513 Ack=27478949 Win=65535 Len=0
1,8.76583699999992,54.93.77.70,10.0.2.15,TCP,2950,"9001  >  34692 [PSH, ACK] Seq=27478949 Ack=1593513 Win=65535 Len=2896 [TCP segment of a reassembled PDU]"
1,8.765882999999917,10.0.2.15,54.93.77.70,TCP,54,34692  >  9001 [ACK] Seq=1593513 Ack=27481845 Win=65535 Len=0
1,8.77203499999996,54.93.77.70,10.0.2.15,TLSv1.2,778,Application Data
1,8.77207599999997,10.0.2.15,54.93.77.70,TCP,54,34692  >  9001 [ACK] Seq=1593513 Ack=27482569 Win=65535 Len=0
1,8.78247399999998,54.93.77.70,10.0.2.15,TCP,2950,"9001  >  34692 [PSH, ACK] Seq=27482569 Ack=1593513 Win=65535 Len=2896 [TCP segment of a reassembled PDU]"
1,8.78251899999998,10.0.2.15,54.93.77.70,TCP,54,34692  >  9001 [ACK] Seq=1593513 Ack=27485465 Win=65535 Len=0
1,8.78819999999996,54.93.77.70,10.0.2.15,TLSv1.2,778,Application Data
1,8.788250999999946,10.0.2.15,54.93.77.70,TCP,54,34692  >  9001 [ACK] Seq=1593513 Ack=27486189 Win=65535 Len=0
1,8.802886999999942,54.93.77.70,10.0.2.15,TCP,2950,"9001  >  34692 [PSH, ACK] Seq=27486189 Ack=1593513 Win=65535 Len=2896 [TCP segment of a reassembled PDU]"
1,8.802959999999985,10.0.2.15,54.93.77.70,TCP,54,34692  >  9001 [ACK] Seq=1593513 Ack=27489085 Win=65535 Len=0
1,8.804608999999914,54.93.77.70,10.0.2.15,TLSv1.2,778,Application Data
1,8.804662000000008,10.0.2.15,54.93.77.70,TCP,54,34692  >  9001 [ACK] Seq=1593513 Ack=27489809 Win=65535 Len=0
1,8.804826999999932,10.0.2.15,54.93.77.70,TLSv1.2,590,Application Data
1,8.80490199999997,54.93.77.70,10.0.2.15,TCP,60,9001  >  34692 [ACK] Seq=27489809 Ack=1594049 Win=65535 Len=0
1,8.82078899999999,54.93.77.70,10.0.2.15,TLSv1.2,590,Application Data
1,8.821629999999914,54.93.77.70,10.0.2.15,TCP,1502,"9001  >  34692 [PSH, ACK] Seq=27490345 Ack=1594049 Win=65535 Len=1448 [TCP segment of a reassembled PDU]"
1,8.821696999999972,10.0.2.15,54.93.77.70,TCP,54,34692  >  9001 [ACK] Seq=1594049 Ack=27491793 Win=65535 Len=0
1,8.822074999999927,54.93.77.70,10.0.2.15,TCP,1502,"9001  >  34692 [PSH, ACK] Seq=27491793 Ack=1594049 Win=65535 Len=1448 [TCP segment of a reassembled PDU]"
1,8.822115999999937,10.0.2.15,54.93.77.70,TCP,54,34692  >  9001 [ACK] Seq=1594049 Ack=27493241 Win=65535 Len=0
1,8.832421999999951,54.93.77.70,10.0.2.15,TLSv1.2,2950,Application Data [TCP segment of a reassembled PDU]
1,8.83248500000002,10.0.2.15,54.93.77.70,TCP,54,34692  >  9001 [ACK] Seq=1594049 Ack=27496137 Win=65535 Len=0
1,8.832791999999927,54.93.77.70,10.0.2.15,TLSv1.2,2950,Application Data [TCP segment of a reassembled PDU]
1,8.83283199999994,10.0.2.15,54.93.77.70,TCP,54,34692  >  9001 [ACK] Seq=1594049 Ack=27499033 Win=65535 Len=0
1,8.836852000000022,54.93.77.70,10.0.2.15,TLSv1.2,1198,Application Data
1,8.855074999999943,54.93.77.70,10.0.2.15,TLSv1.2,3674,Application Data
1,8.855152999999973,10.0.2.15,54.93.77.70,TCP,54,34692  >  9001 [ACK] Seq=1594049 Ack=27503797 Win=65535 Len=0
1,8.898781999999983,54.93.77.70,10.0.2.15,TLSv1.2,2132,Application Data
1,8.899082000000021,10.0.2.15,54.93.77.70,TCP,54,34692  >  9001 [ACK] Seq=1594049 Ack=27505875 Win=65535 Len=0
1,8.909722999999985,54.93.77.70,10.0.2.15,TCP,1502,"9001  >  34692 [PSH, ACK] Seq=27505875 Ack=1594049 Win=65535 Len=1448 [TCP segment of a reassembled PDU]"
1,8.909800000000018,10.0.2.15,54.93.77.70,TCP,54,34692  >  9001 [ACK] Seq=1594049 Ack=27507323 Win=65535 Len=0
1,8.914433999999915,54.93.77.70,10.0.2.15,TLSv1.2,684,Application Data
1,8.916916000000015,10.0.2.15,54.93.77.70,TLSv1.2,590,Application Data
1,8.917075999999952,54.93.77.70,10.0.2.15,TCP,60,9001  >  34692 [ACK] Seq=27507953 Ack=1594585 Win=65535 Len=0
1,8.980461999999989,62.210.85.178,10.0.2.15,TLSv1.2,590,Application Data
1,9.02198999999996,10.0.2.15,62.210.85.178,TCP,54,35978  >  9001 [ACK] Seq=27626721 Ack=1598391 Win=65535 Len=0
1,9.044722999999976,62.210.85.178,10.0.2.15,TLSv1.2,590,Application Data
1,9.04478999999992,10.0.2.15,62.210.85.178,TCP,54,35978  >  9001 [ACK] Seq=27626721 Ack=1598927 Win=65535 Len=0
1,9.045118000000002,10.0.2.15,62.210.85.178,TLSv1.2,590,Application Data
1,9.045203000000015,62.210.85.178,10.0.2.15,TCP,60,9001  >  35978 [ACK] Seq=1598927 Ack=27627257 Win=65535 Len=0
1,9.494172999999932,54.93.77.70,10.0.2.15,TLSv1.2,590,Application Data
1,9.494545000000016,10.0.2.15,54.93.77.70,TLSv1.2,590,Application Data
1,9.494643999999994,54.93.77.70,10.0.2.15,TCP,60,9001  >  34692 [ACK] Seq=27508489 Ack=1595121 Win=65535 Len=0
1,9.697502999999983,62.210.85.178,10.0.2.15,TLSv1.2,590,Application Data
1,9.707713000000012,10.0.2.15,62.210.85.178,TLSv1.2,590,Application Data
1,9.70791399999996,62.210.85.178,10.0.2.15,TCP,60,9001  >  35978 [ACK] Seq=1599463 Ack=27627793 Win=65535 Len=0
1,9.72258899999997,10.0.2.15,62.210.85.178,TLSv1.2,4124,Application Data
1,9.722708000000011,10.0.2.15,62.210.85.178,TCP,2974,35978  >  9001 [ACK] Seq=27631863 Ack=1599463 Win=65535 Len=2920 [TCP segment of a reassembled PDU]
1,9.722754000000009,62.210.85.178,10.0.2.15,TCP,60,9001  >  35978 [ACK] Seq=1599463 Ack=27629253 Win=65535 Len=0
1,9.722764999999981,62.210.85.178,10.0.2.15,TCP,60,9001  >  35978 [ACK] Seq=1599463 Ack=27630713 Win=65535 Len=0
1,9.722769999999969,62.210.85.178,10.0.2.15,TCP,60,9001  >  35978 [ACK] Seq=1599463 Ack=27631863 Win=65535 Len=0
1,9.722773999999959,62.210.85.178,10.0.2.15,TCP,60,9001  >  35978 [ACK] Seq=1599463 Ack=27633323 Win=65535 Len=0
1,9.722777999999948,62.210.85.178,10.0.2.15,TCP,60,9001  >  35978 [ACK] Seq=1599463 Ack=27634783 Win=65535 Len=0
1,9.722821999999951,10.0.2.15,62.210.85.178,TLSv1.2,1204,Application Data
1,9.722897999999986,62.210.85.178,10.0.2.15,TCP,60,9001  >  35978 [ACK] Seq=1599463 Ack=27635933 Win=65535 Len=0
1,9.722936000000004,10.0.2.15,62.210.85.178,TCP,2974,35978  >  9001 [ACK] Seq=27635933 Ack=1599463 Win=65535 Len=2920 [TCP segment of a reassembled PDU]
1,9.722982000000002,62.210.85.178,10.0.2.15,TCP,60,9001  >  35978 [ACK] Seq=1599463 Ack=27637393 Win=65535 Len=0
1,9.722988999999984,62.210.85.178,10.0.2.15,TCP,60,9001  >  35978 [ACK] Seq=1599463 Ack=27638853 Win=65535 Len=0
1,9.723046999999951,10.0.2.15,62.210.85.178,TLSv1.2,1204,Application Data
1,9.723094999999944,10.0.2.15,62.210.85.178,TCP,2974,35978  >  9001 [ACK] Seq=27640003 Ack=1599463 Win=65535 Len=2920 [TCP segment of a reassembled PDU]
1,9.723133999999959,62.210.85.178,10.0.2.15,TCP,60,9001  >  35978 [ACK] Seq=1599463 Ack=27640003 Win=65535 Len=0
1,9.723139999999944,62.210.85.178,10.0.2.15,TCP,60,9001  >  35978 [ACK] Seq=1599463 Ack=27641463 Win=65535 Len=0
1,9.723144999999931,62.210.85.178,10.0.2.15,TCP,60,9001  >  35978 [ACK] Seq=1599463 Ack=27642923 Win=65535 Len=0
1,9.723175999999967,10.0.2.15,62.210.85.178,TLSv1.2,1204,Application Data
1,9.723239999999919,62.210.85.178,10.0.2.15,TCP,60,9001  >  35978 [ACK] Seq=1599463 Ack=27644073 Win=65535 Len=0
1,9.723277999999937,10.0.2.15,62.210.85.178,TLSv1.2,332,Application Data
1,9.723315999999954,62.210.85.178,10.0.2.15,TCP,60,9001  >  35978 [ACK] Seq=1599463 Ack=27644351 Win=65535 Len=0
1,9.723375999999917,10.0.2.15,62.210.85.178,TLSv1.2,3868,Application Data
1,9.723417999999924,62.210.85.178,10.0.2.15,TCP,60,9001  >  35978 [ACK] Seq=1599463 Ack=27645811 Win=65535 Len=0
1,9.72342500000002,62.210.85.178,10.0.2.15,TCP,60,9001  >  35978 [ACK] Seq=1599463 Ack=27647271 Win=65535 Len=0
1,9.723430000000008,62.210.85.178,10.0.2.15,TCP,60,9001  >  35978 [ACK] Seq=1599463 Ack=27648165 Win=65535 Len=0
1,9.723476000000005,10.0.2.15,62.210.85.178,TLSv1.2,4124,Application Data
1,9.723517000000015,62.210.85.178,10.0.2.15,TCP,60,9001  >  35978 [ACK] Seq=1599463 Ack=27649625 Win=65535 Len=0
1,9.723523999999998,62.210.85.178,10.0.2.15,TCP,60,9001  >  35978 [ACK] Seq=1599463 Ack=27651085 Win=65535 Len=0
1,9.723527999999988,62.210.85.178,10.0.2.15,TCP,60,9001  >  35978 [ACK] Seq=1599463 Ack=27652235 Win=65535 Len=0
1,9.723570999999993,10.0.2.15,62.210.85.178,TLSv1.2,3030,Application Data
1,9.723611000000005,62.210.85.178,10.0.2.15,TCP,60,9001  >  35978 [ACK] Seq=1599463 Ack=27653695 Win=65535 Len=0
1,9.723617999999988,62.210.85.178,10.0.2.15,TCP,60,9001  >  35978 [ACK] Seq=1599463 Ack=27655155 Win=65535 Len=0
1,9.723622999999975,62.210.85.178,10.0.2.15,TCP,60,9001  >  35978 [ACK] Seq=1599463 Ack=27655211 Win=65535 Len=0
1,9.732799999999997,10.0.2.15,62.210.85.178,TLSv1.2,4124,Application Data
1,9.73288500000001,10.0.2.15,62.210.85.178,TCP,1514,35978  >  9001 [ACK] Seq=27659281 Ack=1599463 Win=65535 Len=1460 [TCP segment of a reassembled PDU]
1,9.732925000000023,62.210.85.178,10.0.2.15,TCP,60,9001  >  35978 [ACK] Seq=1599463 Ack=27656671 Win=65535 Len=0
1,9.732932000000005,62.210.85.178,10.0.2.15,TCP,60,9001  >  35978 [ACK] Seq=1599463 Ack=27658131 Win=65535 Len=0
1,9.732936999999993,62.210.85.178,10.0.2.15,TCP,60,9001  >  35978 [ACK] Seq=1599463 Ack=27659281 Win=65535 Len=0
1,9.732940999999983,62.210.85.178,10.0.2.15,TCP,60,9001  >  35978 [ACK] Seq=1599463 Ack=27660741 Win=65535 Len=0
1,9.73304399999995,10.0.2.15,62.210.85.178,TLSv1.2,1250,Application Data
1,9.733138999999937,62.210.85.178,10.0.2.15,TCP,60,9001  >  35978 [ACK] Seq=1599463 Ack=27661937 Win=65535 Len=0
1,10.106763,54.93.77.70,10.0.2.15,TLSv1.2,590,Application Data
1,10.111630999999988,54.93.77.70,10.0.2.15,TLSv1.2,5846,Application Data
1,10.111662000000024,54.93.77.70,10.0.2.15,TLSv1.2,8742,"Application Data, Application Data, Application Data"
1,10.11173999999994,10.0.2.15,54.93.77.70,TCP,54,34692  >  9001 [ACK] Seq=1595121 Ack=27523505 Win=65535 Len=0
1,10.111978000000022,10.0.2.15,54.93.77.70,TLSv1.2,590,Application Data
1,10.112051999999949,54.93.77.70,10.0.2.15,TCP,60,9001  >  34692 [ACK] Seq=27523505 Ack=1595657 Win=65535 Len=0
1,10.124187000000006,54.93.77.70,10.0.2.15,TLSv1.2,1502,Application Data [TCP segment of a reassembled PDU]
1,10.124232000000006,10.0.2.15,54.93.77.70,TCP,54,34692  >  9001 [ACK] Seq=1595657 Ack=27524953 Win=65535 Len=0
1,10.127862999999934,54.93.77.70,10.0.2.15,TLSv1.2,5846,"Application Data, Application Data"
1,10.127931999999987,10.0.2.15,54.93.77.70,TCP,54,34692  >  9001 [ACK] Seq=1595657 Ack=27530745 Win=65535 Len=0
1,10.128856999999925,54.93.77.70,10.0.2.15,TLSv1.2,7294,"Application Data, Application Data, Application Data, Application Data"
1,10.128919999999994,10.0.2.15,54.93.77.70,TCP,54,34692  >  9001 [ACK] Seq=1595657 Ack=27537985 Win=65535 Len=0
1,10.129119999999944,10.0.2.15,54.93.77.70,TLSv1.2,590,Application Data
1,10.129175999999916,54.93.77.70,10.0.2.15,TCP,60,9001  >  34692 [ACK] Seq=27537985 Ack=1596193 Win=65535 Len=0
1,10.129587000000015,54.93.77.70,10.0.2.15,TLSv1.2,2712,Application Data
1,10.129628000000025,10.0.2.15,54.93.77.70,TCP,54,34692  >  9001 [ACK] Seq=1596193 Ack=27540643 Win=65535 Len=0
1,10.139791999999943,54.93.77.70,10.0.2.15,TCP,1502,"9001  >  34692 [PSH, ACK] Seq=27540643 Ack=1596193 Win=65535 Len=1448 [TCP segment of a reassembled PDU]"
1,10.139846999999918,10.0.2.15,54.93.77.70,TCP,54,34692  >  9001 [ACK] Seq=1596193 Ack=27542091 Win=65535 Len=0
1,10.145983999999999,54.93.77.70,10.0.2.15,TLSv1.2,1198,Application Data
1,10.14836200000002,10.0.2.15,54.93.77.70,TLSv1.2,590,Application Data
1,10.148530999999934,54.93.77.70,10.0.2.15,TCP,60,9001  >  34692 [ACK] Seq=27543235 Ack=1596729 Win=65535 Len=0
1,10.413006999999993,62.210.85.178,10.0.2.15,TLSv1.2,1618,Application Data
1,10.41314699999998,10.0.2.15,62.210.85.178,TCP,54,35978  >  9001 [ACK] Seq=27661937 Ack=1601027 Win=65535 Len=0
1,10.413619999999923,10.0.2.15,62.210.85.178,TLSv1.2,590,Application Data
1,10.413730999999984,62.210.85.178,10.0.2.15,TCP,60,9001  >  35978 [ACK] Seq=1601027 Ack=27662473 Win=65535 Len=0
1,10.507229999999936,54.93.77.70,10.0.2.15,TLSv1.2,590,Application Data
1,10.507632999999942,10.0.2.15,54.93.77.70,TLSv1.2,590,Application Data
1,10.507742000000007,54.93.77.70,10.0.2.15,TCP,60,9001  >  34692 [ACK] Seq=27543771 Ack=1597265 Win=65535 Len=0
1,11.027679999999918,62.210.85.178,10.0.2.15,TLSv1.2,590,Application Data
1,11.032109999999989,10.0.2.15,62.210.85.178,TLSv1.2,590,Application Data
1,11.032295999999974,62.210.85.178,10.0.2.15,TCP,60,9001  >  35978 [ACK] Seq=1601563 Ack=27663009 Win=65535 Len=0
1,11.046933999999965,10.0.2.15,62.210.85.178,TLSv1.2,4124,Application Data
1,11.047048000000018,10.0.2.15,62.210.85.178,TCP,2974,35978  >  9001 [ACK] Seq=27667079 Ack=1601563 Win=65535 Len=2920 [TCP segment of a reassembled PDU]
1,11.047097000000008,62.210.85.178,10.0.2.15,TCP,60,9001  >  35978 [ACK] Seq=1601563 Ack=27664469 Win=65535 Len=0
1,11.047109999999975,62.210.85.178,10.0.2.15,TCP,60,9001  >  35978 [ACK] Seq=1601563 Ack=27665929 Win=65535 Len=0
1,11.04711599999996,62.210.85.178,10.0.2.15,TCP,60,9001  >  35978 [ACK] Seq=1601563 Ack=27667079 Win=65535 Len=0
1,11.04711999999995,62.210.85.178,10.0.2.15,TCP,60,9001  >  35978 [ACK] Seq=1601563 Ack=27668539 Win=65535 Len=0
1,11.04712399999994,62.210.85.178,10.0.2.15,TCP,60,9001  >  35978 [ACK] Seq=1601563 Ack=27669999 Win=65535 Len=0
1,11.047159999999963,10.0.2.15,62.210.85.178,TLSv1.2,1204,Application Data
1,11.04719799999998,62.210.85.178,10.0.2.15,TCP,60,9001  >  35978 [ACK] Seq=1601563 Ack=27671149 Win=65535 Len=0
1,11.047244999999975,10.0.2.15,62.210.85.178,TLSv1.2,4124,Application Data
1,11.047286999999983,62.210.85.178,10.0.2.15,TCP,60,9001  >  35978 [ACK] Seq=1601563 Ack=27672609 Win=65535 Len=0
1,11.047294999999963,62.210.85.178,10.0.2.15,TCP,60,9001  >  35978 [ACK] Seq=1601563 Ack=27674069 Win=65535 Len=0
1,11.04729999999995,62.210.85.178,10.0.2.15,TCP,60,9001  >  35978 [ACK] Seq=1601563 Ack=27675219 Win=65535 Len=0
1,11.047342999999955,10.0.2.15,62.210.85.178,TLSv1.2,4124,Application Data
1,11.047379999999976,62.210.85.178,10.0.2.15,TCP,60,9001  >  35978 [ACK] Seq=1601563 Ack=27676679 Win=65535 Len=0
1,11.047387999999955,62.210.85.178,10.0.2.15,TCP,60,9001  >  35978 [ACK] Seq=1601563 Ack=27678139 Win=65535 Len=0
1,11.047449999999913,10.0.2.15,62.210.85.178,TLSv1.2,2974,Application Data
1,11.04749199999992,62.210.85.178,10.0.2.15,TCP,60,9001  >  35978 [ACK] Seq=1601563 Ack=27679289 Win=65535 Len=0
1,11.047500000000014,62.210.85.178,10.0.2.15,TCP,60,9001  >  35978 [ACK] Seq=1601563 Ack=27680749 Win=65535 Len=0
1,11.047503000000006,62.210.85.178,10.0.2.15,TCP,60,9001  >  35978 [ACK] Seq=1601563 Ack=27682209 Win=65535 Len=0
1,11.047530999999935,10.0.2.15,62.210.85.178,TLSv1.2,1226,Application Data
1,11.04756599999996,62.210.85.178,10.0.2.15,TCP,60,9001  >  35978 [ACK] Seq=1601563 Ack=27683381 Win=65535 Len=0
1,11.04760699999997,10.0.2.15,62.210.85.178,TLSv1.2,4124,Application Data
1,11.047646999999984,62.210.85.178,10.0.2.15,TCP,60,9001  >  35978 [ACK] Seq=1601563 Ack=27684841 Win=65535 Len=0
1,11.047654999999963,62.210.85.178,10.0.2.15,TCP,60,9001  >  35978 [ACK] Seq=1601563 Ack=27686301 Win=65535 Len=0
1,11.047657999999956,62.210.85.178,10.0.2.15,TCP,60,9001  >  35978 [ACK] Seq=1601563 Ack=27687451 Win=65535 Len=0
1,11.047698999999966,10.0.2.15,62.210.85.178,TLSv1.2,3030,Application Data
1,11.047736999999984,62.210.85.178,10.0.2.15,TCP,60,9001  >  35978 [ACK] Seq=1601563 Ack=27688911 Win=65535 Len=0
1,11.047744999999964,62.210.85.178,10.0.2.15,TCP,60,9001  >  35978 [ACK] Seq=1601563 Ack=27690371 Win=65535 Len=0
1,11.047748999999953,62.210.85.178,10.0.2.15,TCP,60,9001  >  35978 [ACK] Seq=1601563 Ack=27690427 Win=65535 Len=0
1,11.056968999999981,10.0.2.15,62.210.85.178,TLSv1.2,4124,Application Data
1,11.057032999999933,62.210.85.178,10.0.2.15,TCP,60,9001  >  35978 [ACK] Seq=1601563 Ack=27691887 Win=65535 Len=0
1,11.057044000000019,62.210.85.178,10.0.2.15,TCP,60,9001  >  35978 [ACK] Seq=1601563 Ack=27693347 Win=65535 Len=0
1,11.057049000000006,62.210.85.178,10.0.2.15,TCP,60,9001  >  35978 [ACK] Seq=1601563 Ack=27694497 Win=65535 Len=0
1,11.057095000000004,10.0.2.15,62.210.85.178,TLSv1.2,4124,Application Data
1,11.057135000000017,62.210.85.178,10.0.2.15,TCP,60,9001  >  35978 [ACK] Seq=1601563 Ack=27695957 Win=65535 Len=0
1,11.057143999999994,62.210.85.178,10.0.2.15,TCP,60,9001  >  35978 [ACK] Seq=1601563 Ack=27697417 Win=65535 Len=0
1,11.057148999999981,62.210.85.178,10.0.2.15,TCP,60,9001  >  35978 [ACK] Seq=1601563 Ack=27698567 Win=65535 Len=0
1,11.057186999999999,10.0.2.15,62.210.85.178,TLSv1.2,1232,Application Data
1,11.057225000000017,62.210.85.178,10.0.2.15,TCP,60,9001  >  35978 [ACK] Seq=1601563 Ack=27699745 Win=65535 Len=0
1,11.137851999999953,54.93.77.70,10.0.2.15,TLSv1.2,590,Application Data
1,11.177962999999977,10.0.2.15,54.93.77.70,TCP,54,34692  >  9001 [ACK] Seq=1597265 Ack=27544307 Win=65535 Len=0
1,11.187525999999934,54.93.77.70,10.0.2.15,TCP,2950,"9001  >  34692 [PSH, ACK] Seq=27544307 Ack=1597265 Win=65535 Len=2896 [TCP segment of a reassembled PDU]"
1,11.187592999999993,10.0.2.15,54.93.77.70,TCP,54,34692  >  9001 [ACK] Seq=1597265 Ack=27547203 Win=65535 Len=0
1,11.196776999999997,54.93.77.70,10.0.2.15,TLSv1.2,3674,Application Data [TCP segment of a reassembled PDU]
1,11.196843999999942,10.0.2.15,54.93.77.70,TCP,54,34692  >  9001 [ACK] Seq=1597265 Ack=27550823 Win=65535 Len=0
1,11.214338999999995,54.93.77.70,10.0.2.15,TLSv1.2,1314,"Application Data, Application Data"
1,11.214440999999965,10.0.2.15,54.93.77.70,TCP,54,34692  >  9001 [ACK] Seq=1597265 Ack=27552083 Win=65535 Len=0
1,11.229922999999985,54.93.77.70,10.0.2.15,TLSv1.2,7294,Application Data
1,11.229975999999965,10.0.2.15,54.93.77.70,TCP,54,34692  >  9001 [ACK] Seq=1597265 Ack=27559323 Win=65535 Len=0
1,11.230212999999935,54.93.77.70,10.0.2.15,TLSv1.2,568,Application Data
1,11.230256999999938,10.0.2.15,54.93.77.70,TCP,54,34692  >  9001 [ACK] Seq=1597265 Ack=27559837 Win=65535 Len=0
1,11.238644000000022,54.93.77.70,10.0.2.15,TCP,2950,"9001  >  34692 [PSH, ACK] Seq=27559837 Ack=1597265 Win=65535 Len=2896 [TCP segment of a reassembled PDU]"
1,11.238719999999944,10.0.2.15,54.93.77.70,TCP,54,34692  >  9001 [ACK] Seq=1597265 Ack=27562733 Win=65535 Len=0
1,11.247610000000009,54.93.77.70,10.0.2.15,TLSv1.2,778,Application Data
1,11.247658999999999,10.0.2.15,54.93.77.70,TCP,54,34692  >  9001 [ACK] Seq=1597265 Ack=27563457 Win=65535 Len=0
1,11.250074999999924,54.93.77.70,10.0.2.15,TCP,2950,"9001  >  34692 [PSH, ACK] Seq=27563457 Ack=1597265 Win=65535 Len=2896 [TCP segment of a reassembled PDU]"
1,11.250123999999914,10.0.2.15,54.93.77.70,TCP,54,34692  >  9001 [ACK] Seq=1597265 Ack=27566353 Win=65535 Len=0
1,11.26507099999992,54.93.77.70,10.0.2.15,TLSv1.2,1314,"Application Data, Application Data"
1,11.265113999999926,10.0.2.15,54.93.77.70,TCP,54,34692  >  9001 [ACK] Seq=1597265 Ack=27567613 Win=65535 Len=0
1,11.269645999999966,54.93.77.70,10.0.2.15,TLSv1.2,5846,Application Data
1,11.269693999999959,10.0.2.15,54.93.77.70,TCP,54,34692  >  9001 [ACK] Seq=1597265 Ack=27573405 Win=65535 Len=0
1,11.269863999999984,10.0.2.15,54.93.77.70,TLSv1.2,1104,Application Data
1,11.269938000000025,54.93.77.70,10.0.2.15,TCP,60,9001  >  34692 [ACK] Seq=27573405 Ack=1598315 Win=65535 Len=0
1,11.28140099999996,54.93.77.70,10.0.2.15,TLSv1.2,474,Application Data
1,11.322003999999993,10.0.2.15,54.93.77.70,TCP,54,34692  >  9001 [ACK] Seq=1598315 Ack=27573825 Win=65535 Len=0
1,11.437958999999978,54.93.77.70,10.0.2.15,TCP,2950,"9001  >  34692 [PSH, ACK] Seq=27573825 Ack=1598315 Win=65535 Len=2896 [TCP segment of a reassembled PDU]"
1,11.438049999999976,10.0.2.15,54.93.77.70,TCP,54,34692  >  9001 [ACK] Seq=1598315 Ack=27576721 Win=65535 Len=0
1,11.442399000000023,54.93.77.70,10.0.2.15,TLSv1.2,778,Application Data
1,11.44244900000001,10.0.2.15,54.93.77.70,TCP,54,34692  >  9001 [ACK] Seq=1598315 Ack=27577445 Win=65535 Len=0
1,11.49017600000002,54.93.77.70,10.0.2.15,TLSv1.2,3160,Application Data
1,11.490262999999914,10.0.2.15,54.93.77.70,TCP,54,34692  >  9001 [ACK] Seq=1598315 Ack=27580551 Win=65535 Len=0
1,11.490624000000025,10.0.2.15,54.93.77.70,TLSv1.2,590,Application Data
1,11.490707999999927,54.93.77.70,10.0.2.15,TCP,60,9001  >  34692 [ACK] Seq=27580551 Ack=1598851 Win=65535 Len=0
1,11.500089000000003,10.0.2.15,54.93.77.70,TLSv1.2,590,Application Data
1,11.50026200000002,54.93.77.70,10.0.2.15,TCP,60,9001  >  34692 [ACK] Seq=27580551 Ack=1599387 Win=65535 Len=0
1,11.577238999999963,62.210.85.178,10.0.2.15,TLSv1.2,1104,Application Data
1,11.615085000000022,54.93.77.70,10.0.2.15,TLSv1.2,590,Application Data
1,11.617943999999966,10.0.2.15,62.210.85.178,TCP,54,35978  >  9001 [ACK] Seq=27699745 Ack=1602613 Win=65535 Len=0
1,11.637718999999947,62.210.85.178,10.0.2.15,TLSv1.2,590,Application Data
1,11.637779000000023,10.0.2.15,62.210.85.178,TCP,54,35978  >  9001 [ACK] Seq=27699745 Ack=1603149 Win=65535 Len=0
1,11.65798099999995,10.0.2.15,54.93.77.70,TCP,54,34692  >  9001 [ACK] Seq=1599387 Ack=27581087 Win=65535 Len=0
1,11.951771000000008,62.210.85.178,10.0.2.15,TLSv1.2,590,Application Data
1,11.95184699999993,10.0.2.15,62.210.85.178,TCP,54,35978  >  9001 [ACK] Seq=27699745 Ack=1603685 Win=65535 Len=0
1,11.952316999999994,10.0.2.15,62.210.85.178,TLSv1.2,590,Application Data
1,11.952422999999953,62.210.85.178,10.0.2.15,TCP,60,9001  >  35978 [ACK] Seq=1603685 Ack=27700281 Win=65535 Len=0
1,12.153919999999971,54.93.77.70,10.0.2.15,TLSv1.2,590,Application Data
1,12.153996000000006,10.0.2.15,54.93.77.70,TCP,54,34692  >  9001 [ACK] Seq=1599387 Ack=27581623 Win=65535 Len=0
1,12.154352000000017,10.0.2.15,54.93.77.70,TLSv1.2,590,Application Data
1,12.154444000000012,54.93.77.70,10.0.2.15,TCP,60,9001  >  34692 [ACK] Seq=27581623 Ack=1599923 Win=65535 Len=0
1,12.263264999999933,62.210.85.178,10.0.2.15,TLSv1.2,590,Application Data
1,12.267749999999978,10.0.2.15,62.210.85.178,TLSv1.2,590,Application Data
1,12.267904999999928,62.210.85.178,10.0.2.15,TCP,60,9001  >  35978 [ACK] Seq=1604221 Ack=27700817 Win=65535 Len=0
1,12.282523999999967,10.0.2.15,62.210.85.178,TLSv1.2,4124,Application Data
1,12.282617999999957,10.0.2.15,62.210.85.178,TCP,2974,35978  >  9001 [ACK] Seq=27704887 Ack=1604221 Win=65535 Len=2920 [TCP segment of a reassembled PDU]
1,12.282667999999944,62.210.85.178,10.0.2.15,TCP,60,9001  >  35978 [ACK] Seq=1604221 Ack=27702277 Win=65535 Len=0
1,12.282678999999916,62.210.85.178,10.0.2.15,TCP,60,9001  >  35978 [ACK] Seq=1604221 Ack=27703737 Win=65535 Len=0
1,12.28268300000002,62.210.85.178,10.0.2.15,TCP,60,9001  >  35978 [ACK] Seq=1604221 Ack=27704887 Win=65535 Len=0
1,12.282686000000012,62.210.85.178,10.0.2.15,TCP,60,9001  >  35978 [ACK] Seq=1604221 Ack=27706347 Win=65535 Len=0
1,12.282689000000005,62.210.85.178,10.0.2.15,TCP,60,9001  >  35978 [ACK] Seq=1604221 Ack=27707807 Win=65535 Len=0
1,12.282723999999916,10.0.2.15,62.210.85.178,TLSv1.2,1204,Application Data
1,12.282756999999947,62.210.85.178,10.0.2.15,TCP,60,9001  >  35978 [ACK] Seq=1604221 Ack=27708957 Win=65535 Len=0
1,12.282801999999947,10.0.2.15,62.210.85.178,TLSv1.2,4124,Application Data
1,12.282835999999975,62.210.85.178,10.0.2.15,TCP,60,9001  >  35978 [ACK] Seq=1604221 Ack=27710417 Win=65535 Len=0
1,12.282843999999955,62.210.85.178,10.0.2.15,TCP,60,9001  >  35978 [ACK] Seq=1604221 Ack=27711877 Win=65535 Len=0
1,12.282847999999944,62.210.85.178,10.0.2.15,TCP,60,9001  >  35978 [ACK] Seq=1604221 Ack=27713027 Win=65535 Len=0
1,12.282884999999965,10.0.2.15,62.210.85.178,TLSv1.2,4124,Application Data
1,12.28291999999999,62.210.85.178,10.0.2.15,TCP,60,9001  >  35978 [ACK] Seq=1604221 Ack=27714487 Win=65535 Len=0
1,12.282926999999972,62.210.85.178,10.0.2.15,TCP,60,9001  >  35978 [ACK] Seq=1604221 Ack=27715947 Win=65535 Len=0
1,12.28298099999995,10.0.2.15,62.210.85.178,TLSv1.2,2974,Application Data
1,12.28302199999996,62.210.85.178,10.0.2.15,TCP,60,9001  >  35978 [ACK] Seq=1604221 Ack=27717097 Win=65535 Len=0
1,12.28302999999994,62.210.85.178,10.0.2.15,TCP,60,9001  >  35978 [ACK] Seq=1604221 Ack=27718557 Win=65535 Len=0
1,12.283035999999925,62.210.85.178,10.0.2.15,TCP,60,9001  >  35978 [ACK] Seq=1604221 Ack=27720017 Win=65535 Len=0
1,12.28306699999996,10.0.2.15,62.210.85.178,TLSv1.2,1226,Application Data
1,12.28310399999998,62.210.85.178,10.0.2.15,TCP,60,9001  >  35978 [ACK] Seq=1604221 Ack=27721189 Win=65535 Len=0
1,12.28314499999999,10.0.2.15,62.210.85.178,TLSv1.2,4124,Application Data
1,12.283184000000006,62.210.85.178,10.0.2.15,TCP,60,9001  >  35978 [ACK] Seq=1604221 Ack=27722649 Win=65535 Len=0
1,12.283192999999983,62.210.85.178,10.0.2.15,TCP,60,9001  >  35978 [ACK] Seq=1604221 Ack=27724109 Win=65535 Len=0
1,12.283196999999973,62.210.85.178,10.0.2.15,TCP,60,9001  >  35978 [ACK] Seq=1604221 Ack=27725259 Win=65535 Len=0
1,12.283235999999988,10.0.2.15,62.210.85.178,TLSv1.2,3030,Application Data
1,12.283274000000006,62.210.85.178,10.0.2.15,TCP,60,9001  >  35978 [ACK] Seq=1604221 Ack=27726719 Win=65535 Len=0
1,12.283281999999986,62.210.85.178,10.0.2.15,TCP,60,9001  >  35978 [ACK] Seq=1604221 Ack=27728179 Win=65535 Len=0
1,12.283285999999976,62.210.85.178,10.0.2.15,TCP,60,9001  >  35978 [ACK] Seq=1604221 Ack=27728235 Win=65535 Len=0
1,12.292507999999998,10.0.2.15,62.210.85.178,TLSv1.2,4124,Application Data
1,12.29261299999996,62.210.85.178,10.0.2.15,TCP,60,9001  >  35978 [ACK] Seq=1604221 Ack=27729695 Win=65535 Len=0
1,12.292623999999932,62.210.85.178,10.0.2.15,TCP,60,9001  >  35978 [ACK] Seq=1604221 Ack=27731155 Win=65535 Len=0
1,12.292626999999925,62.210.85.178,10.0.2.15,TCP,60,9001  >  35978 [ACK] Seq=1604221 Ack=27732305 Win=65535 Len=0
1,12.292666999999938,10.0.2.15,62.210.85.178,TLSv1.2,4124,Application Data
1,12.29273599999999,62.210.85.178,10.0.2.15,TCP,60,9001  >  35978 [ACK] Seq=1604221 Ack=27733765 Win=65535 Len=0
1,12.29274399999997,62.210.85.178,10.0.2.15,TCP,60,9001  >  35978 [ACK] Seq=1604221 Ack=27735225 Win=65535 Len=0
1,12.292746999999963,62.210.85.178,10.0.2.15,TCP,60,9001  >  35978 [ACK] Seq=1604221 Ack=27736375 Win=65535 Len=0
1,12.292781999999988,10.0.2.15,62.210.85.178,TLSv1.2,4124,Application Data
1,12.292819000000009,62.210.85.178,10.0.2.15,TCP,60,9001  >  35978 [ACK] Seq=1604221 Ack=27737835 Win=65535 Len=0
1,12.292827999999986,62.210.85.178,10.0.2.15,TCP,60,9001  >  35978 [ACK] Seq=1604221 Ack=27739295 Win=65535 Len=0
1,12.292832999999973,62.210.85.178,10.0.2.15,TCP,60,9001  >  35978 [ACK] Seq=1604221 Ack=27740445 Win=65535 Len=0
1,12.292869999999994,10.0.2.15,62.210.85.178,TLSv1.2,1810,Application Data
1,12.292908000000011,62.210.85.178,10.0.2.15,TCP,60,9001  >  35978 [ACK] Seq=1604221 Ack=27741905 Win=65535 Len=0
1,12.292915999999991,62.210.85.178,10.0.2.15,TCP,60,9001  >  35978 [ACK] Seq=1604221 Ack=27742201 Win=65535 Len=0
1,12.37536399999999,54.93.77.70,10.0.2.15,TLSv1.2,590,Application Data
1,12.406782000000021,54.93.77.70,10.0.2.15,TLSv1.2,7294,Application Data
1,12.40685499999995,10.0.2.15,54.93.77.70,TCP,54,34692  >  9001 [ACK] Seq=1599923 Ack=27589399 Win=65535 Len=0
1,12.413980999999922,54.93.77.70,10.0.2.15,TLSv1.2,4398,Application Data [TCP segment of a reassembled PDU]
1,12.414058999999952,10.0.2.15,54.93.77.70,TCP,54,34692  >  9001 [ACK] Seq=1599923 Ack=27593743 Win=65535 Len=0
1,12.423072999999931,54.93.77.70,10.0.2.15,TLSv1.2,3464,"Application Data, Application Data"
1,12.423129000000017,10.0.2.15,54.93.77.70,TCP,54,34692  >  9001 [ACK] Seq=1599923 Ack=27597153 Win=65535 Len=0
1,12.476340999999934,54.93.77.70,10.0.2.15,TCP,2950,"9001  >  34692 [PSH, ACK] Seq=27597153 Ack=1599923 Win=65535 Len=2896 [TCP segment of a reassembled PDU]"
1,12.476407999999992,10.0.2.15,54.93.77.70,TCP,54,34692  >  9001 [ACK] Seq=1599923 Ack=27600049 Win=65535 Len=0
1,12.476805000000013,54.93.77.70,10.0.2.15,TLSv1.2,778,Application Data
1,12.487017999999921,54.93.77.70,10.0.2.15,TCP,2950,"9001  >  34692 [PSH, ACK] Seq=27600773 Ack=1599923 Win=65535 Len=2896 [TCP segment of a reassembled PDU]"
1,12.487061999999924,10.0.2.15,54.93.77.70,TCP,54,34692  >  9001 [ACK] Seq=1599923 Ack=27603669 Win=65535 Len=0
1,12.49834599999997,54.93.77.70,10.0.2.15,TLSv1.2,4398,Application Data [TCP segment of a reassembled PDU]
1,12.49861199999998,10.0.2.15,54.93.77.70,TCP,54,34692  >  9001 [ACK] Seq=1599923 Ack=27608013 Win=65535 Len=0
1,12.503500999999915,54.93.77.70,10.0.2.15,TLSv1.2,1104,"Application Data, Application Data"
1,12.503721999999925,10.0.2.15,54.93.77.70,TLSv1.2,590,Application Data
1,12.503814999999918,54.93.77.70,10.0.2.15,TCP,60,9001  >  34692 [ACK] Seq=27609063 Ack=1600459 Win=65535 Len=0
1,12.506359999999972,54.93.77.70,10.0.2.15,TCP,2950,"9001  >  34692 [PSH, ACK] Seq=27609063 Ack=1600459 Win=65535 Len=2896 [TCP segment of a reassembled PDU]"
1,12.506438000000003,10.0.2.15,54.93.77.70,TCP,54,34692  >  9001 [ACK] Seq=1600459 Ack=27611959 Win=65535 Len=0
1,12.520289999999932,54.93.77.70,10.0.2.15,TLSv1.2,778,Application Data
1,12.526452999999947,54.93.77.70,10.0.2.15,TLSv1.2,5846,Application Data
1,12.526534999999967,10.0.2.15,54.93.77.70,TCP,54,34692  >  9001 [ACK] Seq=1600459 Ack=27618475 Win=65535 Len=0
1,12.543818999999985,54.93.77.70,10.0.2.15,TLSv1.2,988,Application Data
1,12.546244999999999,54.93.77.70,10.0.2.15,TCP,2950,"9001  >  34692 [PSH, ACK] Seq=27619409 Ack=1600459 Win=65535 Len=2896 [TCP segment of a reassembled PDU]"
1,12.546289999999999,10.0.2.15,54.93.77.70,TCP,54,34692  >  9001 [ACK] Seq=1600459 Ack=27622305 Win=65535 Len=0
1,12.562680999999998,54.93.77.70,10.0.2.15,TLSv1.2,1314,"Application Data, Application Data"
1,12.56297399999994,10.0.2.15,54.93.77.70,TLSv1.2,590,Application Data
1,12.56309299999998,54.93.77.70,10.0.2.15,TCP,60,9001  >  34692 [ACK] Seq=27623565 Ack=1600995 Win=65535 Len=0
1,12.572571999999923,10.0.2.15,54.93.77.70,TLSv1.2,590,Application Data
1,12.572720000000004,54.93.77.70,10.0.2.15,TCP,60,9001  >  34692 [ACK] Seq=27623565 Ack=1601531 Win=65535 Len=0
1,12.63381199999992,62.210.85.178,10.0.2.15,TLSv1.2,590,Application Data
1,12.673991999999998,10.0.2.15,62.210.85.178,TCP,54,35978  >  9001 [ACK] Seq=27742201 Ack=1604757 Win=65535 Len=0
1,12.871326999999951,62.210.85.178,10.0.2.15,TLSv1.2,1104,Application Data
1,12.871402999999987,10.0.2.15,62.210.85.178,TCP,54,35978  >  9001 [ACK] Seq=27742201 Ack=1605807 Win=65535 Len=0
1,12.871894999999995,10.0.2.15,62.210.85.178,TLSv1.2,590,Application Data
1,12.871997999999962,62.210.85.178,10.0.2.15,TCP,60,9001  >  35978 [ACK] Seq=1605807 Ack=27742737 Win=65535 Len=0
1,13.07511999999997,54.93.77.70,10.0.2.15,TLSv1.2,590,Application Data
1,13.075515999999993,10.0.2.15,54.93.77.70,TLSv1.2,590,Application Data
1,13.075603999999998,54.93.77.70,10.0.2.15,TCP,60,9001  >  34692 [ACK] Seq=27624101 Ack=1602067 Win=65535 Len=0
1,13.202620000000024,62.210.85.178,10.0.2.15,TLSv1.2,590,Application Data
1,13.20673499999998,10.0.2.15,62.210.85.178,TLSv1.2,590,Application Data
1,13.20692699999995,62.210.85.178,10.0.2.15,TCP,60,9001  >  35978 [ACK] Seq=1606343 Ack=27743273 Win=65535 Len=0
1,13.218830000000025,10.0.2.15,62.210.85.178,TLSv1.2,4124,Application Data
1,13.218951999999945,10.0.2.15,62.210.85.178,TCP,1514,35978  >  9001 [ACK] Seq=27747343 Ack=1606343 Win=65535 Len=1460 [TCP segment of a reassembled PDU]
1,13.219000999999935,62.210.85.178,10.0.2.15,TCP,60,9001  >  35978 [ACK] Seq=1606343 Ack=27744733 Win=65535 Len=0
1,13.219013000000018,62.210.85.178,10.0.2.15,TCP,60,9001  >  35978 [ACK] Seq=1606343 Ack=27746193 Win=65535 Len=0
1,13.219017000000008,62.210.85.178,10.0.2.15,TCP,60,9001  >  35978 [ACK] Seq=1606343 Ack=27747343 Win=65535 Len=0
1,13.21902,62.210.85.178,10.0.2.15,TCP,60,9001  >  35978 [ACK] Seq=1606343 Ack=27748803 Win=65535 Len=0
1,13.219053999999915,10.0.2.15,62.210.85.178,TLSv1.2,736,Application Data
1,13.219091999999932,62.210.85.178,10.0.2.15,TCP,60,9001  >  35978 [ACK] Seq=1606343 Ack=27749485 Win=65535 Len=0
1,13.38303499999995,54.93.77.70,10.0.2.15,TCP,2950,"9001  >  34692 [PSH, ACK] Seq=27624101 Ack=1602067 Win=65535 Len=2896 [TCP segment of a reassembled PDU]"
1,13.383156999999983,10.0.2.15,54.93.77.70,TCP,54,34692  >  9001 [ACK] Seq=1602067 Ack=27626997 Win=65535 Len=0
1,13.385260000000017,54.93.77.70,10.0.2.15,TLSv1.2,778,Application Data
1,13.426026999999976,10.0.2.15,54.93.77.70,TCP,54,34692  >  9001 [ACK] Seq=1602067 Ack=27627721 Win=65535 Len=0
1,13.431528999999955,54.93.77.70,10.0.2.15,TLSv1.2,590,Application Data
1,13.431603999999993,10.0.2.15,54.93.77.70,TCP,54,34692  >  9001 [ACK] Seq=1602067 Ack=27628257 Win=65535 Len=0
1,13.479040999999938,54.93.77.70,10.0.2.15,TLSv1.2,2646,Application Data
1,13.479114999999979,10.0.2.15,54.93.77.70,TCP,54,34692  >  9001 [ACK] Seq=1602067 Ack=27630849 Win=65535 Len=0
1,13.481893000000014,10.0.2.15,54.93.77.70,TLSv1.2,590,Application Data
1,13.482050999999956,54.93.77.70,10.0.2.15,TCP,60,9001  >  34692 [ACK] Seq=27630849 Ack=1602603 Win=65535 Len=0
1,13.792945999999915,62.210.85.178,10.0.2.15,TLSv1.2,590,Application Data
1,13.793439999999919,10.0.2.15,62.210.85.178,TLSv1.2,590,Application Data
1,13.793560999999954,62.210.85.178,10.0.2.15,TCP,60,9001  >  35978 [ACK] Seq=1606879 Ack=27750021 Win=65535 Len=0
1,14.101605999999947,54.93.77.70,10.0.2.15,TLSv1.2,590,Application Data
1,14.102045999999973,10.0.2.15,54.93.77.70,TLSv1.2,590,Application Data
1,14.102229999999963,54.93.77.70,10.0.2.15,TCP,60,9001  >  34692 [ACK] Seq=27631385 Ack=1603139 Win=65535 Len=0
1,14.217890000000011,62.210.85.178,10.0.2.15,TLSv1.2,590,Application Data
1,14.224720999999931,10.0.2.15,62.210.85.178,TLSv1.2,590,Application Data
1,14.224941999999942,62.210.85.178,10.0.2.15,TCP,60,9001  >  35978 [ACK] Seq=1607415 Ack=27750557 Win=65535 Len=0
1,14.235210999999936,10.0.2.15,62.210.85.178,TLSv1.2,4124,Application Data
1,14.235317000000009,10.0.2.15,62.210.85.178,TCP,2974,35978  >  9001 [ACK] Seq=27754627 Ack=1607415 Win=65535 Len=2920 [TCP segment of a reassembled PDU]
1,14.235385999999949,62.210.85.178,10.0.2.15,TCP,60,9001  >  35978 [ACK] Seq=1607415 Ack=27752017 Win=65535 Len=0
1,14.235402000000022,62.210.85.178,10.0.2.15,TCP,60,9001  >  35978 [ACK] Seq=1607415 Ack=27753477 Win=65535 Len=0
1,14.23540700000001,62.210.85.178,10.0.2.15,TCP,60,9001  >  35978 [ACK] Seq=1607415 Ack=27754627 Win=65535 Len=0
1,14.235411999999997,62.210.85.178,10.0.2.15,TCP,60,9001  >  35978 [ACK] Seq=1607415 Ack=27756087 Win=65535 Len=0
1,14.235415999999987,62.210.85.178,10.0.2.15,TCP,60,9001  >  35978 [ACK] Seq=1607415 Ack=27757547 Win=65535 Len=0
1,14.235463999999979,10.0.2.15,62.210.85.178,TLSv1.2,1204,Application Data
1,14.235565999999949,62.210.85.178,10.0.2.15,TCP,60,9001  >  35978 [ACK] Seq=1607415 Ack=27758697 Win=65535 Len=0
1,14.235620999999924,10.0.2.15,62.210.85.178,TLSv1.2,4124,Application Data
1,14.235689999999977,10.0.2.15,62.210.85.178,TCP,2974,35978  >  9001 [ACK] Seq=27762767 Ack=1607415 Win=65535 Len=2920 [TCP segment of a reassembled PDU]
1,14.23572999999999,62.210.85.178,10.0.2.15,TCP,60,9001  >  35978 [ACK] Seq=1607415 Ack=27760157 Win=65535 Len=0
1,14.235736999999972,62.210.85.178,10.0.2.15,TCP,60,9001  >  35978 [ACK] Seq=1607415 Ack=27761617 Win=65535 Len=0
1,14.23574199999996,62.210.85.178,10.0.2.15,TCP,60,9001  >  35978 [ACK] Seq=1607415 Ack=27762767 Win=65535 Len=0
1,14.23574599999995,62.210.85.178,10.0.2.15,TCP,60,9001  >  35978 [ACK] Seq=1607415 Ack=27764227 Win=65535 Len=0
1,14.235750999999937,62.210.85.178,10.0.2.15,TCP,60,9001  >  35978 [ACK] Seq=1607415 Ack=27765687 Win=65535 Len=0
1,14.235788999999954,10.0.2.15,62.210.85.178,TLSv1.2,1204,Application Data
1,14.235883999999942,62.210.85.178,10.0.2.15,TCP,60,9001  >  35978 [ACK] Seq=1607415 Ack=27766837 Win=65535 Len=0
1,14.235920999999962,10.0.2.15,62.210.85.178,TLSv1.2,332,Application Data
1,14.235960999999975,62.210.85.178,10.0.2.15,TCP,60,9001  >  35978 [ACK] Seq=1607415 Ack=27767115 Win=65535 Len=0
1,14.235998999999993,10.0.2.15,62.210.85.178,TLSv1.2,3868,Application Data
1,14.236046999999985,62.210.85.178,10.0.2.15,TCP,60,9001  >  35978 [ACK] Seq=1607415 Ack=27768575 Win=65535 Len=0
1,14.236053999999967,62.210.85.178,10.0.2.15,TCP,60,9001  >  35978 [ACK] Seq=1607415 Ack=27770035 Win=65535 Len=0
1,14.236058999999955,62.210.85.178,10.0.2.15,TCP,60,9001  >  35978 [ACK] Seq=1607415 Ack=27770929 Win=65535 Len=0
1,14.236106999999947,10.0.2.15,62.210.85.178,TLSv1.2,4124,Application Data
1,14.23614699999996,62.210.85.178,10.0.2.15,TCP,60,9001  >  35978 [ACK] Seq=1607415 Ack=27772389 Win=65535 Len=0
1,14.236153999999942,62.210.85.178,10.0.2.15,TCP,60,9001  >  35978 [ACK] Seq=1607415 Ack=27773849 Win=65535 Len=0
1,14.236157999999932,62.210.85.178,10.0.2.15,TCP,60,9001  >  35978 [ACK] Seq=1607415 Ack=27774999 Win=65535 Len=0
1,14.236200999999937,10.0.2.15,62.210.85.178,TLSv1.2,3030,Application Data
1,14.236242999999945,62.210.85.178,10.0.2.15,TCP,60,9001  >  35978 [ACK] Seq=1607415 Ack=27776459 Win=65535 Len=0
1,14.236249999999927,62.210.85.178,10.0.2.15,TCP,60,9001  >  35978 [ACK] Seq=1607415 Ack=27777919 Win=65535 Len=0
1,14.236254999999915,62.210.85.178,10.0.2.15,TCP,60,9001  >  35978 [ACK] Seq=1607415 Ack=27777975 Win=65535 Len=0
1,14.246563999999921,10.0.2.15,62.210.85.178,TLSv1.2,4124,Application Data
1,14.246668,10.0.2.15,62.210.85.178,TCP,2974,35978  >  9001 [ACK] Seq=27782045 Ack=1607415 Win=65535 Len=2920 [TCP segment of a reassembled PDU]
1,14.246711000000005,62.210.85.178,10.0.2.15,TCP,60,9001  >  35978 [ACK] Seq=1607415 Ack=27779435 Win=65535 Len=0
1,14.246719999999982,62.210.85.178,10.0.2.15,TCP,60,9001  >  35978 [ACK] Seq=1607415 Ack=27780895 Win=65535 Len=0
1,14.24672499999997,62.210.85.178,10.0.2.15,TCP,60,9001  >  35978 [ACK] Seq=1607415 Ack=27782045 Win=65535 Len=0
1,14.246729999999957,62.210.85.178,10.0.2.15,TCP,60,9001  >  35978 [ACK] Seq=1607415 Ack=27783505 Win=65535 Len=0
1,14.246733999999947,62.210.85.178,10.0.2.15,TCP,60,9001  >  35978 [ACK] Seq=1607415 Ack=27784965 Win=65535 Len=0
1,14.246775999999954,10.0.2.15,62.210.85.178,TLSv1.2,1204,Application Data
1,14.246843000000013,10.0.2.15,62.210.85.178,TCP,1514,35978  >  9001 [ACK] Seq=27786115 Ack=1607415 Win=65535 Len=1460 [TCP segment of a reassembled PDU]
1,14.246880999999917,62.210.85.178,10.0.2.15,TCP,60,9001  >  35978 [ACK] Seq=1607415 Ack=27786115 Win=65535 Len=0
1,14.246888000000013,62.210.85.178,10.0.2.15,TCP,60,9001  >  35978 [ACK] Seq=1607415 Ack=27787575 Win=65535 Len=0
1,14.246921999999927,10.0.2.15,62.210.85.178,TLSv1.2,800,Application Data
1,14.247012999999924,62.210.85.178,10.0.2.15,TCP,60,9001  >  35978 [ACK] Seq=1607415 Ack=27788321 Win=65535 Len=0
1,14.349954000000025,54.93.77.70,10.0.2.15,TLSv1.2,3674,Application Data
1,14.35009100000002,10.0.2.15,54.93.77.70,TCP,54,34692  >  9001 [ACK] Seq=1603139 Ack=27635005 Win=65535 Len=0
1,14.382034999999973,54.93.77.70,10.0.2.15,TLSv1.2,7294,Application Data
1,14.382139999999936,10.0.2.15,54.93.77.70,TCP,54,34692  >  9001 [ACK] Seq=1603139 Ack=27642245 Win=65535 Len=0
1,14.382188999999926,54.93.77.70,10.0.2.15,TLSv1.2,2132,"Application Data, Application Data"
1,14.382232999999928,10.0.2.15,54.93.77.70,TCP,54,34692  >  9001 [ACK] Seq=1603139 Ack=27644323 Win=65535 Len=0
1,14.390026999999918,54.93.77.70,10.0.2.15,TLSv1.2,4398,Application Data
1,14.390094999999974,10.0.2.15,54.93.77.70,TCP,54,34692  >  9001 [ACK] Seq=1603139 Ack=27648667 Win=65535 Len=0
1,14.400523000000021,54.93.77.70,10.0.2.15,TLSv1.2,1944,"Application Data, Application Data"
1,14.400622999999996,10.0.2.15,54.93.77.70,TCP,54,34692  >  9001 [ACK] Seq=1603139 Ack=27650557 Win=65535 Len=0
1,14.419308999999998,54.93.77.70,10.0.2.15,TLSv1.2,4724,"Application Data, Application Data"
1,14.419447999999988,10.0.2.15,54.93.77.70,TCP,54,34692  >  9001 [ACK] Seq=1603139 Ack=27655227 Win=65535 Len=0
1,14.421406999999931,54.93.77.70,10.0.2.15,TCP,1502,"9001  >  34692 [PSH, ACK] Seq=27655227 Ack=1603139 Win=65535 Len=1448 [TCP segment of a reassembled PDU]"
1,14.421454999999924,10.0.2.15,54.93.77.70,TCP,54,34692  >  9001 [ACK] Seq=1603139 Ack=27656675 Win=65535 Len=0
1,14.43313599999999,54.93.77.70,10.0.2.15,TLSv1.2,2950,Application Data [TCP segment of a reassembled PDU]
1,14.433221000000003,10.0.2.15,54.93.77.70,TCP,54,34692  >  9001 [ACK] Seq=1603139 Ack=27659571 Win=65535 Len=0
1,14.435407999999939,54.93.77.70,10.0.2.15,TLSv1.2,1430,"Application Data, Application Data"
1,14.43560100000002,10.0.2.15,54.93.77.70,TLSv1.2,590,Application Data
1,14.435720999999944,54.93.77.70,10.0.2.15,TCP,60,9001  >  34692 [ACK] Seq=27660947 Ack=1603675 Win=65535 Len=0
1,14.473604000000023,54.93.77.70,10.0.2.15,TLSv1.2,4724,"Application Data, Application Data"
1,14.473691999999915,10.0.2.15,54.93.77.70,TCP,54,34692  >  9001 [ACK] Seq=1603675 Ack=27665617 Win=65535 Len=0
1,14.522895999999946,54.93.77.70,10.0.2.15,TLSv1.2,1104,Application Data
1,14.565379000000007,54.93.77.70,10.0.2.15,TCP,2950,"9001  >  34692 [PSH, ACK] Seq=27666667 Ack=1603675 Win=65535 Len=2896 [TCP segment of a reassembled PDU]"
1,14.565451999999937,10.0.2.15,54.93.77.70,TCP,54,34692  >  9001 [ACK] Seq=1603675 Ack=27669563 Win=65535 Len=0
1,14.580318999999918,54.93.77.70,10.0.2.15,TLSv1.2,264,Application Data
1,14.583586999999966,10.0.2.15,54.93.77.70,TLSv1.2,590,Application Data
1,14.583767999999964,54.93.77.70,10.0.2.15,TCP,60,9001  >  34692 [ACK] Seq=27669773 Ack=1604211 Win=65535 Len=0
1,14.687843999999927,62.210.85.178,10.0.2.15,TLSv1.2,1104,Application Data
1,14.688457999999969,10.0.2.15,62.210.85.178,TLSv1.2,590,Application Data
1,14.688600999999949,62.210.85.178,10.0.2.15,TCP,60,9001  >  35978 [ACK] Seq=1608465 Ack=27788857 Win=65535 Len=0
1,15.02187099999992,54.93.77.70,10.0.2.15,TLSv1.2,590,Application Data
1,15.022252999999978,10.0.2.15,54.93.77.70,TLSv1.2,590,Application Data
1,15.022351999999955,54.93.77.70,10.0.2.15,TCP,60,9001  >  34692 [ACK] Seq=27670309 Ack=1604747 Win=65535 Len=0
1,15.225833999999963,62.210.85.178,10.0.2.15,TLSv1.2,590,Application Data
1,15.23135000000002,10.0.2.15,62.210.85.178,TLSv1.2,590,Application Data
1,15.231521999999927,62.210.85.178,10.0.2.15,TCP,60,9001  >  35978 [ACK] Seq=1609001 Ack=27789393 Win=65535 Len=0
1,15.242792000000009,10.0.2.15,62.210.85.178,TLSv1.2,4124,Application Data
1,15.242924000000016,10.0.2.15,62.210.85.178,TCP,2974,35978  >  9001 [ACK] Seq=27793463 Ack=1609001 Win=65535 Len=2920 [TCP segment of a reassembled PDU]
1,15.242985999999974,62.210.85.178,10.0.2.15,TCP,60,9001  >  35978 [ACK] Seq=1609001 Ack=27790853 Win=65535 Len=0
1,15.242999999999938,62.210.85.178,10.0.2.15,TCP,60,9001  >  35978 [ACK] Seq=1609001 Ack=27792313 Win=65535 Len=0
1,15.24300299999993,62.210.85.178,10.0.2.15,TCP,60,9001  >  35978 [ACK] Seq=1609001 Ack=27793463 Win=65535 Len=0
1,15.243005999999923,62.210.85.178,10.0.2.15,TCP,60,9001  >  35978 [ACK] Seq=1609001 Ack=27794923 Win=65535 Len=0
1,15.243008999999915,62.210.85.178,10.0.2.15,TCP,60,9001  >  35978 [ACK] Seq=1609001 Ack=27796383 Win=65535 Len=0
1,15.24304399999994,10.0.2.15,62.210.85.178,TLSv1.2,1204,Application Data
1,15.243078999999966,62.210.85.178,10.0.2.15,TCP,60,9001  >  35978 [ACK] Seq=1609001 Ack=27797533 Win=65535 Len=0
1,15.243126999999959,10.0.2.15,62.210.85.178,TLSv1.2,4124,Application Data
1,15.243162999999981,62.210.85.178,10.0.2.15,TCP,60,9001  >  35978 [ACK] Seq=1609001 Ack=27798993 Win=65535 Len=0
1,15.243170999999961,62.210.85.178,10.0.2.15,TCP,60,9001  >  35978 [ACK] Seq=1609001 Ack=27800453 Win=65535 Len=0
1,15.243173999999954,62.210.85.178,10.0.2.15,TCP,60,9001  >  35978 [ACK] Seq=1609001 Ack=27801603 Win=65535 Len=0
1,15.243211999999971,10.0.2.15,62.210.85.178,TLSv1.2,4124,Application Data
1,15.243249999999989,62.210.85.178,10.0.2.15,TCP,60,9001  >  35978 [ACK] Seq=1609001 Ack=27803063 Win=65535 Len=0
1,15.243255999999974,62.210.85.178,10.0.2.15,TCP,60,9001  >  35978 [ACK] Seq=1609001 Ack=27804523 Win=65535 Len=0
1,15.243311999999946,10.0.2.15,62.210.85.178,TLSv1.2,2974,Application Data
1,15.243348999999967,62.210.85.178,10.0.2.15,TCP,60,9001  >  35978 [ACK] Seq=1609001 Ack=27805673 Win=65535 Len=0
1,15.243355999999949,62.210.85.178,10.0.2.15,TCP,60,9001  >  35978 [ACK] Seq=1609001 Ack=27807133 Win=65535 Len=0
1,15.243359999999939,62.210.85.178,10.0.2.15,TCP,60,9001  >  35978 [ACK] Seq=1609001 Ack=27808593 Win=65535 Len=0
1,15.243386999999984,10.0.2.15,62.210.85.178,TLSv1.2,1226,Application Data
1,15.24341800000002,62.210.85.178,10.0.2.15,TCP,60,9001  >  35978 [ACK] Seq=1609001 Ack=27809765 Win=65535 Len=0
1,15.243458999999916,10.0.2.15,62.210.85.178,TLSv1.2,4124,Application Data
1,15.243492999999944,62.210.85.178,10.0.2.15,TCP,60,9001  >  35978 [ACK] Seq=1609001 Ack=27811225 Win=65535 Len=0
1,15.243499999999926,62.210.85.178,10.0.2.15,TCP,60,9001  >  35978 [ACK] Seq=1609001 Ack=27812685 Win=65535 Len=0
1,15.243502999999919,62.210.85.178,10.0.2.15,TCP,60,9001  >  35978 [ACK] Seq=1609001 Ack=27813835 Win=65535 Len=0
1,15.243539999999939,10.0.2.15,62.210.85.178,TLSv1.2,3030,Application Data
1,15.243574999999964,62.210.85.178,10.0.2.15,TCP,60,9001  >  35978 [ACK] Seq=1609001 Ack=27815295 Win=65535 Len=0
1,15.24358099999995,62.210.85.178,10.0.2.15,TCP,60,9001  >  35978 [ACK] Seq=1609001 Ack=27816755 Win=65535 Len=0
1,15.243583999999942,62.210.85.178,10.0.2.15,TCP,60,9001  >  35978 [ACK] Seq=1609001 Ack=27816811 Win=65535 Len=0
1,15.252831000000015,10.0.2.15,62.210.85.178,TLSv1.2,4124,Application Data
1,15.252931999999987,10.0.2.15,62.210.85.178,TCP,2974,35978  >  9001 [ACK] Seq=27820881 Ack=1609001 Win=65535 Len=2920 [TCP segment of a reassembled PDU]
1,15.252972,62.210.85.178,10.0.2.15,TCP,60,9001  >  35978 [ACK] Seq=1609001 Ack=27818271 Win=65535 Len=0
1,15.252981999999975,62.210.85.178,10.0.2.15,TCP,60,9001  >  35978 [ACK] Seq=1609001 Ack=27819731 Win=65535 Len=0
1,15.252986999999962,62.210.85.178,10.0.2.15,TCP,60,9001  >  35978 [ACK] Seq=1609001 Ack=27820881 Win=65535 Len=0
1,15.25299199999995,62.210.85.178,10.0.2.15,TCP,60,9001  >  35978 [ACK] Seq=1609001 Ack=27822341 Win=65535 Len=0
1,15.25299599999994,62.210.85.178,10.0.2.15,TCP,60,9001  >  35978 [ACK] Seq=1609001 Ack=27823801 Win=65535 Len=0
1,15.253038999999944,10.0.2.15,62.210.85.178,TLSv1.2,1204,Application Data
1,15.253107999999997,10.0.2.15,62.210.85.178,TCP,2974,35978  >  9001 [ACK] Seq=27824951 Ack=1609001 Win=65535 Len=2920 [TCP segment of a reassembled PDU]
1,15.253145000000018,62.210.85.178,10.0.2.15,TCP,60,9001  >  35978 [ACK] Seq=1609001 Ack=27824951 Win=65535 Len=0
1,15.253152,62.210.85.178,10.0.2.15,TCP,60,9001  >  35978 [ACK] Seq=1609001 Ack=27826411 Win=65535 Len=0
1,15.25315599999999,62.210.85.178,10.0.2.15,TCP,60,9001  >  35978 [ACK] Seq=1609001 Ack=27827871 Win=65535 Len=0
1,15.253191000000015,10.0.2.15,62.210.85.178,TLSv1.2,1204,Application Data
1,15.253256999999962,10.0.2.15,62.210.85.178,TCP,2974,35978  >  9001 [ACK] Seq=27829021 Ack=1609001 Win=65535 Len=2920 [TCP segment of a reassembled PDU]
1,15.25329499999998,62.210.85.178,10.0.2.15,TCP,60,9001  >  35978 [ACK] Seq=1609001 Ack=27829021 Win=65535 Len=0
1,15.253301999999962,62.210.85.178,10.0.2.15,TCP,60,9001  >  35978 [ACK] Seq=1609001 Ack=27830481 Win=65535 Len=0
1,15.253305999999952,62.210.85.178,10.0.2.15,TCP,60,9001  >  35978 [ACK] Seq=1609001 Ack=27831941 Win=65535 Len=0
1,15.253337999999985,10.0.2.15,62.210.85.178,TLSv1.2,1204,Application Data
1,15.253434999999968,10.0.2.15,62.210.85.178,TLSv1.2,2974,Application Data
1,15.253458000000023,62.210.85.178,10.0.2.15,TCP,60,9001  >  35978 [ACK] Seq=1609001 Ack=27833091 Win=65535 Len=0
1,15.25349099999994,10.0.2.15,62.210.85.178,TLSv1.2,1226,Application Data
1,15.253526999999963,62.210.85.178,10.0.2.15,TCP,60,9001  >  35978 [ACK] Seq=1609001 Ack=27834551 Win=65535 Len=0
1,15.253532999999948,62.210.85.178,10.0.2.15,TCP,60,9001  >  35978 [ACK] Seq=1609001 Ack=27836011 Win=65535 Len=0
1,15.253537999999935,62.210.85.178,10.0.2.15,TCP,60,9001  >  35978 [ACK] Seq=1609001 Ack=27837183 Win=65535 Len=0
1,15.253581999999938,10.0.2.15,62.210.85.178,TLSv1.2,4124,Application Data
1,15.253622999999948,62.210.85.178,10.0.2.15,TCP,60,9001  >  35978 [ACK] Seq=1609001 Ack=27838643 Win=65535 Len=0
1,15.25362999999993,62.210.85.178,10.0.2.15,TCP,60,9001  >  35978 [ACK] Seq=1609001 Ack=27840103 Win=65535 Len=0
1,15.25363399999992,62.210.85.178,10.0.2.15,TCP,60,9001  >  35978 [ACK] Seq=1609001 Ack=27841253 Win=65535 Len=0
1,15.253679999999918,10.0.2.15,62.210.85.178,TLSv1.2,3030,Application Data
1,15.25371999999993,62.210.85.178,10.0.2.15,TCP,60,9001  >  35978 [ACK] Seq=1609001 Ack=27842713 Win=65535 Len=0
1,15.253726999999913,62.210.85.178,10.0.2.15,TCP,60,9001  >  35978 [ACK] Seq=1609001 Ack=27844173 Win=65535 Len=0
1,15.253731000000016,62.210.85.178,10.0.2.15,TCP,60,9001  >  35978 [ACK] Seq=1609001 Ack=27844229 Win=65535 Len=0
1,15.266138999999953,10.0.2.15,62.210.85.178,TLSv1.2,2132,Application Data
1,15.266252000000009,62.210.85.178,10.0.2.15,TCP,60,9001  >  35978 [ACK] Seq=1609001 Ack=27845689 Win=65535 Len=0
1,15.26626699999997,62.210.85.178,10.0.2.15,TCP,60,9001  >  35978 [ACK] Seq=1609001 Ack=27846307 Win=65535 Len=0
1,15.338758999999982,54.93.77.70,10.0.2.15,TLSv1.2,590,Application Data
1,15.38018999999997,54.93.77.70,10.0.2.15,TLSv1.2,3674,Application Data
1,15.380270999999993,10.0.2.15,54.93.77.70,TCP,54,34692  >  9001 [ACK] Seq=1604747 Ack=27674465 Win=65535 Len=0
1,15.391338000000019,54.93.77.70,10.0.2.15,TLSv1.2,7294,Application Data
1,15.391464999999926,10.0.2.15,54.93.77.70,TCP,54,34692  >  9001 [ACK] Seq=1604747 Ack=27681705 Win=65535 Len=0
1,15.391689999999926,10.0.2.15,54.93.77.70,TLSv1.2,590,Application Data
1,15.39180399999998,54.93.77.70,10.0.2.15,TCP,60,9001  >  34692 [ACK] Seq=27681705 Ack=1605283 Win=65535 Len=0
1,15.399416999999971,54.93.77.70,10.0.2.15,TLSv1.2,568,Application Data
1,15.409852999999998,54.93.77.70,10.0.2.15,TCP,2950,"9001  >  34692 [PSH, ACK] Seq=27682219 Ack=1605283 Win=65535 Len=2896 [TCP segment of a reassembled PDU]"
1,15.409942999999998,10.0.2.15,54.93.77.70,TCP,54,34692  >  9001 [ACK] Seq=1605283 Ack=27685115 Win=65535 Len=0
1,15.411040999999955,54.93.77.70,10.0.2.15,TLSv1.2,4398,"Application Data, Application Data"
1,15.41112099999998,10.0.2.15,54.93.77.70,TCP,54,34692  >  9001 [ACK] Seq=1605283 Ack=27689459 Win=65535 Len=0
1,15.474474999999984,54.93.77.70,10.0.2.15,TLSv1.2,6686,"Application Data, Application Data"
1,15.474587999999926,10.0.2.15,54.93.77.70,TCP,54,34692  >  9001 [ACK] Seq=1605283 Ack=27696091 Win=65535 Len=0
1,15.485021999999958,54.93.77.70,10.0.2.15,TLSv1.2,7294,"Application Data, Application Data"
1,15.485090000000014,10.0.2.15,54.93.77.70,TCP,54,34692  >  9001 [ACK] Seq=1605283 Ack=27703331 Win=65535 Len=0
1,15.485272000000009,10.0.2.15,54.93.77.70,TLSv1.2,590,Application Data
1,15.485394999999926,54.93.77.70,10.0.2.15,TCP,60,9001  >  34692 [ACK] Seq=27703331 Ack=1605819 Win=65535 Len=0
1,15.491256000000021,54.93.77.70,10.0.2.15,TLSv1.2,1198,Application Data
1,15.507226999999943,54.93.77.70,10.0.2.15,TLSv1.2,5846,Application Data
1,15.507269999999949,54.93.77.70,10.0.2.15,TCP,1502,"9001  >  34692 [PSH, ACK] Seq=27710267 Ack=1605819 Win=65535 Len=1448 [TCP segment of a reassembled PDU]"
1,15.50733200000002,10.0.2.15,54.93.77.70,TCP,54,34692  >  9001 [ACK] Seq=1605819 Ack=27710267 Win=65535 Len=0
1,15.507457999999929,10.0.2.15,54.93.77.70,TCP,54,34692  >  9001 [ACK] Seq=1605819 Ack=27711715 Win=65535 Len=0
1,15.515338999999926,62.210.85.178,10.0.2.15,TLSv1.2,590,Application Data
1,15.518354999999929,54.93.77.70,10.0.2.15,TLSv1.2,1502,Application Data [TCP segment of a reassembled PDU]
1,15.518429999999967,10.0.2.15,54.93.77.70,TCP,54,34692  >  9001 [ACK] Seq=1605819 Ack=27713163 Win=65535 Len=0
1,15.523183000000017,54.93.77.70,10.0.2.15,TLSv1.2,170,Application Data
1,15.539446999999996,54.93.77.70,10.0.2.15,TLSv1.2,10190,"Application Data, Application Data"
1,15.539541999999983,10.0.2.15,54.93.77.70,TCP,54,34692  >  9001 [ACK] Seq=1605819 Ack=27723415 Win=65535 Len=0
1,15.55615499999999,54.93.77.70,10.0.2.15,TLSv1.2,1292,Application Data
1,15.556357999999932,10.0.2.15,54.93.77.70,TLSv1.2,590,Application Data
1,15.556476999999973,54.93.77.70,10.0.2.15,TCP,60,9001  >  34692 [ACK] Seq=27724653 Ack=1606355 Win=65535 Len=0
1,15.556670999999938,54.93.77.70,10.0.2.15,TCP,2950,"9001  >  34692 [PSH, ACK] Seq=27724653 Ack=1606355 Win=65535 Len=2896 [TCP segment of a reassembled PDU]"
1,15.556733000000008,10.0.2.15,54.93.77.70,TCP,54,34692  >  9001 [ACK] Seq=1606355 Ack=27727549 Win=65535 Len=0
1,15.55791899999997,10.0.2.15,62.210.85.178,TCP,54,35978  >  9001 [ACK] Seq=27846307 Ack=1609537 Win=65535 Len=0
1,15.57345799999996,54.93.77.70,10.0.2.15,TLSv1.2,264,Application Data
1,15.576904000000013,10.0.2.15,54.93.77.70,TLSv1.2,590,Application Data
1,15.577078999999912,54.93.77.70,10.0.2.15,TCP,60,9001  >  34692 [ACK] Seq=27727759 Ack=1606891 Win=65535 Len=0
1,15.59601299999997,62.210.85.178,10.0.2.15,TLSv1.2,590,Application Data
1,15.596130000000016,10.0.2.15,62.210.85.178,TCP,54,35978  >  9001 [ACK] Seq=27846307 Ack=1610073 Win=65535 Len=0
1,15.658086000000026,62.210.85.178,10.0.2.15,TLSv1.2,590,Application Data
1,15.658176000000026,10.0.2.15,62.210.85.178,TCP,54,35978  >  9001 [ACK] Seq=27846307 Ack=1610609 Win=65535 Len=0
1,16.253286000000003,62.210.85.178,10.0.2.15,TLSv1.2,590,Application Data
1,16.253379999999993,10.0.2.15,62.210.85.178,TCP,54,35978  >  9001 [ACK] Seq=27846307 Ack=1611145 Win=65535 Len=0
1,16.253922999999986,10.0.2.15,62.210.85.178,TLSv1.2,590,Application Data
1,16.254053999999996,62.210.85.178,10.0.2.15,TCP,60,9001  >  35978 [ACK] Seq=1611145 Ack=27846843 Win=65535 Len=0
1,17.47913799999992,54.93.77.70,10.0.2.15,TLSv1.2,590,Application Data
1,17.479500999999914,10.0.2.15,54.93.77.70,TLSv1.2,590,Application Data
1,17.479607999999985,54.93.77.70,10.0.2.15,TCP,60,9001  >  34692 [ACK] Seq=27728295 Ack=1607427 Win=65535 Len=0
1,18.09415200000001,62.210.85.178,10.0.2.15,TLSv1.2,590,Application Data
1,18.098903999999948,10.0.2.15,62.210.85.178,TLSv1.2,590,Application Data
1,18.099062000000004,62.210.85.178,10.0.2.15,TCP,60,9001  >  35978 [ACK] Seq=1611681 Ack=27847379 Win=65535 Len=0
1,18.110404000000017,10.0.2.15,62.210.85.178,TLSv1.2,4124,Application Data
1,18.110501999999997,10.0.2.15,62.210.85.178,TCP,2974,35978  >  9001 [ACK] Seq=27851449 Ack=1611681 Win=65535 Len=2920 [TCP segment of a reassembled PDU]
1,18.11054999999999,62.210.85.178,10.0.2.15,TCP,60,9001  >  35978 [ACK] Seq=1611681 Ack=27848839 Win=65535 Len=0
1,18.11056199999996,62.210.85.178,10.0.2.15,TCP,60,9001  >  35978 [ACK] Seq=1611681 Ack=27850299 Win=65535 Len=0
1,18.11056599999995,62.210.85.178,10.0.2.15,TCP,60,9001  >  35978 [ACK] Seq=1611681 Ack=27851449 Win=65535 Len=0
1,18.11056899999994,62.210.85.178,10.0.2.15,TCP,60,9001  >  35978 [ACK] Seq=1611681 Ack=27852909 Win=65535 Len=0
1,18.110570999999936,62.210.85.178,10.0.2.15,TCP,60,9001  >  35978 [ACK] Seq=1611681 Ack=27854369 Win=65535 Len=0
1,18.11060599999996,10.0.2.15,62.210.85.178,TLSv1.2,1204,Application Data
1,18.11063999999999,62.210.85.178,10.0.2.15,TCP,60,9001  >  35978 [ACK] Seq=1611681 Ack=27855519 Win=65535 Len=0
1,18.110685999999987,10.0.2.15,62.210.85.178,TLSv1.2,4124,Application Data
1,18.110723000000007,62.210.85.178,10.0.2.15,TCP,60,9001  >  35978 [ACK] Seq=1611681 Ack=27856979 Win=65535 Len=0
1,18.110730999999987,62.210.85.178,10.0.2.15,TCP,60,9001  >  35978 [ACK] Seq=1611681 Ack=27858439 Win=65535 Len=0
1,18.11073399999998,62.210.85.178,10.0.2.15,TCP,60,9001  >  35978 [ACK] Seq=1611681 Ack=27859589 Win=65535 Len=0
1,18.110771999999997,10.0.2.15,62.210.85.178,TLSv1.2,4124,Application Data
1,18.110804999999914,62.210.85.178,10.0.2.15,TCP,60,9001  >  35978 [ACK] Seq=1611681 Ack=27861049 Win=65535 Len=0
1,18.110813000000007,62.210.85.178,10.0.2.15,TCP,60,9001  >  35978 [ACK] Seq=1611681 Ack=27862509 Win=65535 Len=0
1,18.110869999999977,10.0.2.15,62.210.85.178,TLSv1.2,2974,Application Data
1,18.110905000000002,62.210.85.178,10.0.2.15,TCP,60,9001  >  35978 [ACK] Seq=1611681 Ack=27863659 Win=65535 Len=0
1,18.110911999999985,62.210.85.178,10.0.2.15,TCP,60,9001  >  35978 [ACK] Seq=1611681 Ack=27865119 Win=65535 Len=0
1,18.110916999999972,62.210.85.178,10.0.2.15,TCP,60,9001  >  35978 [ACK] Seq=1611681 Ack=27866579 Win=65535 Len=0
1,18.110945000000015,10.0.2.15,62.210.85.178,TLSv1.2,1226,Application Data
1,18.110976999999934,62.210.85.178,10.0.2.15,TCP,60,9001  >  35978 [ACK] Seq=1611681 Ack=27867751 Win=65535 Len=0
1,18.111016999999947,10.0.2.15,62.210.85.178,TLSv1.2,4124,Application Data
1,18.111051999999972,62.210.85.178,10.0.2.15,TCP,60,9001  >  35978 [ACK] Seq=1611681 Ack=27869211 Win=65535 Len=0
1,18.111057999999957,62.210.85.178,10.0.2.15,TCP,60,9001  >  35978 [ACK] Seq=1611681 Ack=27870671 Win=65535 Len=0
1,18.11106099999995,62.210.85.178,10.0.2.15,TCP,60,9001  >  35978 [ACK] Seq=1611681 Ack=27871821 Win=65535 Len=0
1,18.11109799999997,10.0.2.15,62.210.85.178,TLSv1.2,3030,Application Data
1,18.111130000000003,62.210.85.178,10.0.2.15,TCP,60,9001  >  35978 [ACK] Seq=1611681 Ack=27873281 Win=65535 Len=0
1,18.111136999999985,62.210.85.178,10.0.2.15,TCP,60,9001  >  35978 [ACK] Seq=1611681 Ack=27874741 Win=65535 Len=0
1,18.111140999999975,62.210.85.178,10.0.2.15,TCP,60,9001  >  35978 [ACK] Seq=1611681 Ack=27874797 Win=65535 Len=0
1,18.122597999999925,10.0.2.15,62.210.85.178,TLSv1.2,4124,Application Data
1,18.122682999999938,62.210.85.178,10.0.2.15,TCP,60,9001  >  35978 [ACK] Seq=1611681 Ack=27876257 Win=65535 Len=0
1,18.12269600000002,62.210.85.178,10.0.2.15,TCP,60,9001  >  35978 [ACK] Seq=1611681 Ack=27877717 Win=65535 Len=0
1,18.12270000000001,62.210.85.178,10.0.2.15,TCP,60,9001  >  35978 [ACK] Seq=1611681 Ack=27878867 Win=65535 Len=0
1,18.122747000000004,10.0.2.15,62.210.85.178,TLSv1.2,4124,Application Data
1,18.12280899999996,62.210.85.178,10.0.2.15,TCP,60,9001  >  35978 [ACK] Seq=1611681 Ack=27880327 Win=65535 Len=0
1,18.122815999999943,62.210.85.178,10.0.2.15,TCP,60,9001  >  35978 [ACK] Seq=1611681 Ack=27881787 Win=65535 Len=0
1,18.122818999999936,62.210.85.178,10.0.2.15,TCP,60,9001  >  35978 [ACK] Seq=1611681 Ack=27882937 Win=65535 Len=0
1,18.12285499999996,10.0.2.15,62.210.85.178,TLSv1.2,4124,Application Data
1,18.122889999999984,62.210.85.178,10.0.2.15,TCP,60,9001  >  35978 [ACK] Seq=1611681 Ack=27884397 Win=65535 Len=0
1,18.122897999999964,62.210.85.178,10.0.2.15,TCP,60,9001  >  35978 [ACK] Seq=1611681 Ack=27885857 Win=65535 Len=0
1,18.12290299999995,62.210.85.178,10.0.2.15,TCP,60,9001  >  35978 [ACK] Seq=1611681 Ack=27887007 Win=65535 Len=0
1,18.12294499999996,10.0.2.15,62.210.85.178,TLSv1.2,3352,Application Data
1,18.12302999999997,62.210.85.178,10.0.2.15,TCP,60,9001  >  35978 [ACK] Seq=1611681 Ack=27888467 Win=65535 Len=0
1,18.12304199999994,62.210.85.178,10.0.2.15,TCP,60,9001  >  35978 [ACK] Seq=1611681 Ack=27889927 Win=65535 Len=0
1,18.123044999999934,62.210.85.178,10.0.2.15,TCP,60,9001  >  35978 [ACK] Seq=1611681 Ack=27890305 Win=65535 Len=0
1,18.19396699999993,54.93.77.70,10.0.2.15,TLSv1.2,590,Application Data
1,18.238013000000024,10.0.2.15,54.93.77.70,TCP,54,34692  >  9001 [ACK] Seq=1607427 Ack=27728831 Win=65535 Len=0
1,18.238756999999964,54.93.77.70,10.0.2.15,TLSv1.2,4314,Application Data
1,18.238809999999944,10.0.2.15,54.93.77.70,TCP,54,34692  >  9001 [ACK] Seq=1607427 Ack=27733091 Win=65535 Len=0
1,18.238853999999947,54.93.77.70,10.0.2.15,TLSv1.2,3034,Application Data
1,18.238884999999982,10.0.2.15,54.93.77.70,TCP,54,34692  >  9001 [ACK] Seq=1607427 Ack=27736071 Win=65535 Len=0
1,18.239109999999982,10.0.2.15,54.93.77.70,TLSv1.2,590,Application Data
1,18.239188000000013,54.93.77.70,10.0.2.15,TCP,60,9001  >  34692 [ACK] Seq=27736071 Ack=1607963 Win=65535 Len=0
1,18.27076999999997,54.93.77.70,10.0.2.15,TLSv1.2,5846,Application Data
1,18.27085599999998,10.0.2.15,54.93.77.70,TCP,54,34692  >  9001 [ACK] Seq=1607963 Ack=27741863 Win=65535 Len=0
1,18.27097500000002,54.93.77.70,10.0.2.15,TLSv1.2,5734,Application Data [TCP segment of a reassembled PDU]
1,18.27104099999997,10.0.2.15,54.93.77.70,TCP,54,34692  >  9001 [ACK] Seq=1607963 Ack=27747543 Win=65535 Len=0
1,18.27108199999998,54.93.77.70,10.0.2.15,TLSv1.2,470,Application Data
1,18.281450999999947,54.93.77.70,10.0.2.15,TLSv1.2,7294,Application Data
1,18.281503999999927,10.0.2.15,54.93.77.70,TCP,54,34692  >  9001 [ACK] Seq=1607963 Ack=27755199 Win=65535 Len=0
1,18.291713999999956,54.93.77.70,10.0.2.15,TLSv1.2,2950,Application Data [TCP segment of a reassembled PDU]
1,18.291771999999924,10.0.2.15,54.93.77.70,TCP,54,34692  >  9001 [ACK] Seq=1607963 Ack=27758095 Win=65535 Len=0
1,18.291983999999957,10.0.2.15,54.93.77.70,TLSv1.2,590,Application Data
1,18.292108999999982,54.93.77.70,10.0.2.15,TCP,60,9001  >  34692 [ACK] Seq=27758095 Ack=1608499 Win=65535 Len=0
1,18.29329699999994,54.93.77.70,10.0.2.15,TLSv1.2,1828,"Application Data, Application Data"
1,18.29334099999994,10.0.2.15,54.93.77.70,TCP,54,34692  >  9001 [ACK] Seq=1608499 Ack=27759869 Win=65535 Len=0
1,18.29886399999998,54.93.77.70,10.0.2.15,TCP,1502,"9001  >  34692 [PSH, ACK] Seq=27759869 Ack=1608499 Win=65535 Len=1448 [TCP segment of a reassembled PDU]"
1,18.29902900000002,10.0.2.15,54.93.77.70,TCP,54,34692  >  9001 [ACK] Seq=1608499 Ack=27761317 Win=65535 Len=0
1,18.312455999999997,54.93.77.70,10.0.2.15,TLSv1.2,684,Application Data
1,18.353322999999932,62.210.85.178,10.0.2.15,TLSv1.2,590,Application Data
1,18.35393499999998,10.0.2.15,54.93.77.70,TCP,54,34692  >  9001 [ACK] Seq=1608499 Ack=27761947 Win=65535 Len=0
1,18.394014999999968,10.0.2.15,62.210.85.178,TCP,54,35978  >  9001 [ACK] Seq=27890305 Ack=1612217 Win=65535 Len=0
1,19.015692999999942,54.93.77.70,10.0.2.15,TCP,2950,"9001  >  34692 [PSH, ACK] Seq=27761947 Ack=1608499 Win=65535 Len=2896 [TCP segment of a reassembled PDU]"
1,19.01578399999994,10.0.2.15,54.93.77.70,TCP,54,34692  >  9001 [ACK] Seq=1608499 Ack=27764843 Win=65535 Len=0
1,19.018430999999964,54.93.77.70,10.0.2.15,TLSv1.2,778,Application Data
1,19.018482999999947,10.0.2.15,54.93.77.70,TCP,54,34692  >  9001 [ACK] Seq=1608499 Ack=27765567 Win=65535 Len=0
1,19.01961199999994,54.93.77.70,10.0.2.15,TCP,2950,"9001  >  34692 [PSH, ACK] Seq=27765567 Ack=1608499 Win=65535 Len=2896 [TCP segment of a reassembled PDU]"
1,19.01962900000001,54.93.77.70,10.0.2.15,TLSv1.2,2878,"Application Data, Application Data, Application Data"
1,19.019633,62.210.85.178,10.0.2.15,TLSv1.2,590,Application Data
1,19.01968199999999,10.0.2.15,54.93.77.70,TCP,54,34692  >  9001 [ACK] Seq=1608499 Ack=27768463 Win=65535 Len=0
1,19.019724999999994,10.0.2.15,54.93.77.70,TCP,54,34692  >  9001 [ACK] Seq=1608499 Ack=27771287 Win=65535 Len=0
1,19.01975099999993,10.0.2.15,62.210.85.178,TCP,54,35978  >  9001 [ACK] Seq=27890305 Ack=1612753 Win=65535 Len=0
1,19.02095799999995,10.0.2.15,54.93.77.70,TLSv1.2,590,Application Data
1,19.021075999999994,54.93.77.70,10.0.2.15,TCP,60,9001  >  34692 [ACK] Seq=27771287 Ack=1609035 Win=65535 Len=0
