No.,Time,Source,Destination,Protocol,Length,Info
1,0.02168800000004012,10.0.2.15,54.93.77.70,TCP,54,34692  >  9001 [ACK] Seq=1539531 Ack=26559927 Win=65535 Len=0
1,0.14836700000000747,10.0.2.15,54.93.77.70,TLSv1.2,590,Application Data
1,0.1485699999999497,54.93.77.70,10.0.2.15,TCP,60,9001  >  34692 [ACK] Seq=26559927 Ack=1540067 Win=65535 Len=0
1,0.6238419999999678,62.210.85.178,10.0.2.15,TLSv1.2,1618,Application Data
1,0.6239649999999983,10.0.2.15,62.210.85.178,TCP,54,35978  >  9001 [ACK] Seq=26679377 Ack=1544717 Win=65535 Len=0
1,0.6244020000000319,10.0.2.15,62.210.85.178,TLSv1.2,590,Application Data
1,0.6244990000000143,62.210.85.178,10.0.2.15,TCP,60,9001  >  35978 [ACK] Seq=1544717 Ack=26679913 Win=65535 Len=0
1,1.2382770000000392,54.93.77.70,10.0.2.15,TLSv1.2,590,Application Data
1,1.2383559999999534,10.0.2.15,54.93.77.70,TCP,54,34692  >  9001 [ACK] Seq=1540067 Ack=26560463 Win=65535 Len=0
1,1.2387479999999869,10.0.2.15,54.93.77.70,TLSv1.2,1618,Application Data
1,1.238864000000035,54.93.77.70,10.0.2.15,TCP,60,9001  >  34692 [ACK] Seq=26560463 Ack=1541527 Win=65535 Len=0
1,1.2388760000000048,54.93.77.70,10.0.2.15,TCP,60,9001  >  34692 [ACK] Seq=26560463 Ack=1541631 Win=65535 Len=0
1,1.3492149999999583,62.210.85.178,10.0.2.15,TLSv1.2,1618,Application Data
1,1.3493479999999636,10.0.2.15,62.210.85.178,TCP,54,35978  >  9001 [ACK] Seq=26679913 Ack=1546281 Win=65535 Len=0
1,1.3495339999999487,10.0.2.15,62.210.85.178,TLSv1.2,590,Application Data
1,1.3496049999999968,62.210.85.178,10.0.2.15,TCP,60,9001  >  35978 [ACK] Seq=1546281 Ack=26680449 Win=65535 Len=0
1,1.362989999999968,10.0.2.15,62.210.85.178,TLSv1.2,590,Application Data
1,1.3631679999999733,62.210.85.178,10.0.2.15,TCP,60,9001  >  35978 [ACK] Seq=1546281 Ack=26680985 Win=65535 Len=0
1,1.3748050000000376,10.0.2.15,62.210.85.178,TLSv1.2,1618,Application Data
1,1.3749559999999974,62.210.85.178,10.0.2.15,TCP,60,9001  >  35978 [ACK] Seq=1546281 Ack=26682445 Win=65535 Len=0
1,1.3749749999999494,62.210.85.178,10.0.2.15,TCP,60,9001  >  35978 [ACK] Seq=1546281 Ack=26682549 Win=65535 Len=0
1,1.5452850000000353,54.93.77.70,10.0.2.15,TLSv1.2,590,Application Data
1,1.5860340000000406,10.0.2.15,54.93.77.70,TCP,54,34692  >  9001 [ACK] Seq=1541631 Ack=26560999 Win=65535 Len=0
1,1.8527930000000197,54.93.77.70,10.0.2.15,TLSv1.2,2132,Application Data
1,1.8528720000000476,10.0.2.15,54.93.77.70,TCP,54,34692  >  9001 [ACK] Seq=1541631 Ack=26563077 Win=65535 Len=0
1,1.8550179999999727,10.0.2.15,54.93.77.70,TLSv1.2,590,Application Data
1,1.855179000000021,54.93.77.70,10.0.2.15,TCP,60,9001  >  34692 [ACK] Seq=26563077 Ack=1542167 Win=65535 Len=0
1,2.0577879999999595,62.210.85.178,10.0.2.15,TLSv1.2,590,Application Data
1,2.0581019999999626,10.0.2.15,62.210.85.178,TLSv1.2,590,Application Data
1,2.058216000000016,62.210.85.178,10.0.2.15,TCP,60,9001  >  35978 [ACK] Seq=1546817 Ack=26683085 Win=65535 Len=0
1,2.169661000000019,54.93.77.70,10.0.2.15,TLSv1.2,590,Application Data
1,2.1700839999999744,10.0.2.15,54.93.77.70,TLSv1.2,590,Application Data
1,2.170195000000035,54.93.77.70,10.0.2.15,TCP,60,9001  >  34692 [ACK] Seq=26563613 Ack=1542703 Win=65535 Len=0
1,2.774915999999962,62.210.85.178,10.0.2.15,TLSv1.2,590,Application Data
1,2.7788590000000113,10.0.2.15,62.210.85.178,TLSv1.2,590,Application Data
1,2.779013999999961,62.210.85.178,10.0.2.15,TCP,60,9001  >  35978 [ACK] Seq=1547353 Ack=26683621 Win=65535 Len=0
1,2.7909499999999525,10.0.2.15,62.210.85.178,TLSv1.2,4124,Application Data
1,2.79104499999994,10.0.2.15,62.210.85.178,TCP,2974,35978  >  9001 [ACK] Seq=26687691 Ack=1547353 Win=65535 Len=2920 [TCP segment of a reassembled PDU]
1,2.79108999999994,62.210.85.178,10.0.2.15,TCP,60,9001  >  35978 [ACK] Seq=1547353 Ack=26685081 Win=65535 Len=0
1,2.791103000000021,62.210.85.178,10.0.2.15,TCP,60,9001  >  35978 [ACK] Seq=1547353 Ack=26686541 Win=65535 Len=0
1,2.7911080000000084,62.210.85.178,10.0.2.15,TCP,60,9001  >  35978 [ACK] Seq=1547353 Ack=26687691 Win=65535 Len=0
1,2.791111000000001,62.210.85.178,10.0.2.15,TCP,60,9001  >  35978 [ACK] Seq=1547353 Ack=26689151 Win=65535 Len=0
1,2.791113999999993,62.210.85.178,10.0.2.15,TCP,60,9001  >  35978 [ACK] Seq=1547353 Ack=26690611 Win=65535 Len=0
1,2.7911490000000185,10.0.2.15,62.210.85.178,TLSv1.2,1204,Application Data
1,2.7911890000000312,62.210.85.178,10.0.2.15,TCP,60,9001  >  35978 [ACK] Seq=1547353 Ack=26691761 Win=65535 Len=0
1,2.7912320000000364,10.0.2.15,62.210.85.178,TLSv1.2,4124,Application Data
1,2.7912699999999404,62.210.85.178,10.0.2.15,TCP,60,9001  >  35978 [ACK] Seq=1547353 Ack=26693221 Win=65535 Len=0
1,2.7912770000000364,62.210.85.178,10.0.2.15,TCP,60,9001  >  35978 [ACK] Seq=1547353 Ack=26694681 Win=65535 Len=0
1,2.791280000000029,62.210.85.178,10.0.2.15,TCP,60,9001  >  35978 [ACK] Seq=1547353 Ack=26695831 Win=65535 Len=0
1,2.791317000000049,10.0.2.15,62.210.85.178,TLSv1.2,1296,Application Data
1,2.7913519999999608,62.210.85.178,10.0.2.15,TCP,60,9001  >  35978 [ACK] Seq=1547353 Ack=26697073 Win=65535 Len=0
1,2.9073079999999436,54.93.77.70,10.0.2.15,TLSv1.2,3674,Application Data
1,2.9074279999999817,10.0.2.15,54.93.77.70,TCP,54,34692  >  9001 [ACK] Seq=1542703 Ack=26567233 Win=65535 Len=0
1,2.9173869999999624,54.93.77.70,10.0.2.15,TCP,2950,"9001  >  34692 [PSH, ACK] Seq=26567233 Ack=1542703 Win=65535 Len=2896 [TCP segment of a reassembled PDU]"
1,2.9174580000000105,10.0.2.15,54.93.77.70,TCP,54,34692  >  9001 [ACK] Seq=1542703 Ack=26570129 Win=65535 Len=0
1,2.925630999999953,54.93.77.70,10.0.2.15,TLSv1.2,1314,"Application Data, Application Data"
1,2.9268990000000485,54.93.77.70,10.0.2.15,TCP,2950,"9001  >  34692 [PSH, ACK] Seq=26571389 Ack=1542703 Win=65535 Len=2896 [TCP segment of a reassembled PDU]"
1,2.9269460000000436,10.0.2.15,54.93.77.70,TCP,54,34692  >  9001 [ACK] Seq=1542703 Ack=26574285 Win=65535 Len=0
1,2.946107999999981,54.93.77.70,10.0.2.15,TLSv1.2,778,Application Data
1,2.946348999999941,54.93.77.70,10.0.2.15,TCP,1502,"9001  >  34692 [PSH, ACK] Seq=26575009 Ack=1542703 Win=65535 Len=1448 [TCP segment of a reassembled PDU]"
1,2.9464060000000245,10.0.2.15,54.93.77.70,TCP,54,34692  >  9001 [ACK] Seq=1542703 Ack=26576457 Win=65535 Len=0
1,2.9683639999999514,54.93.77.70,10.0.2.15,TLSv1.2,1198,Application Data
1,2.970598999999993,10.0.2.15,54.93.77.70,TLSv1.2,590,Application Data
1,2.9707710000000134,54.93.77.70,10.0.2.15,TCP,60,9001  >  34692 [ACK] Seq=26577601 Ack=1543239 Win=65535 Len=0
1,3.3908830000000307,62.210.85.178,10.0.2.15,TLSv1.2,590,Application Data
1,3.3912370000000465,10.0.2.15,62.210.85.178,TLSv1.2,590,Application Data
1,3.391387000000009,62.210.85.178,10.0.2.15,TCP,60,9001  >  35978 [ACK] Seq=1547889 Ack=26697609 Win=65535 Len=0
1,3.6976789999999937,54.93.77.70,10.0.2.15,TLSv1.2,590,Application Data
1,3.6981309999999894,10.0.2.15,54.93.77.70,TLSv1.2,590,Application Data
1,3.698270999999977,54.93.77.70,10.0.2.15,TCP,60,9001  >  34692 [ACK] Seq=26578137 Ack=1543775 Win=65535 Len=0
1,3.8150150000000167,62.210.85.178,10.0.2.15,TLSv1.2,590,Application Data
1,3.82505900000001,10.0.2.15,62.210.85.178,TLSv1.2,590,Application Data
1,3.8252469999999903,62.210.85.178,10.0.2.15,TCP,60,9001  >  35978 [ACK] Seq=1548425 Ack=26698145 Win=65535 Len=0
1,3.8382500000000164,10.0.2.15,62.210.85.178,TLSv1.2,4124,Application Data
1,3.838365999999951,10.0.2.15,62.210.85.178,TCP,2974,35978  >  9001 [ACK] Seq=26702215 Ack=1548425 Win=65535 Len=2920 [TCP segment of a reassembled PDU]
1,3.838412999999946,62.210.85.178,10.0.2.15,TCP,60,9001  >  35978 [ACK] Seq=1548425 Ack=26699605 Win=65535 Len=0
1,3.8384360000000015,62.210.85.178,10.0.2.15,TCP,60,9001  >  35978 [ACK] Seq=1548425 Ack=26701065 Win=65535 Len=0
1,3.838440999999989,62.210.85.178,10.0.2.15,TCP,60,9001  >  35978 [ACK] Seq=1548425 Ack=26702215 Win=65535 Len=0
1,3.8384439999999813,62.210.85.178,10.0.2.15,TCP,60,9001  >  35978 [ACK] Seq=1548425 Ack=26703675 Win=65535 Len=0
1,3.8384459999999763,62.210.85.178,10.0.2.15,TCP,60,9001  >  35978 [ACK] Seq=1548425 Ack=26705135 Win=65535 Len=0
1,3.838481999999999,10.0.2.15,62.210.85.178,TLSv1.2,1204,Application Data
1,3.838520000000017,62.210.85.178,10.0.2.15,TCP,60,9001  >  35978 [ACK] Seq=1548425 Ack=26706285 Win=65535 Len=0
1,3.8385660000000144,10.0.2.15,62.210.85.178,TLSv1.2,4124,Application Data
1,3.8386050000000296,62.210.85.178,10.0.2.15,TCP,60,9001  >  35978 [ACK] Seq=1548425 Ack=26707745 Win=65535 Len=0
1,3.8386130000000094,62.210.85.178,10.0.2.15,TCP,60,9001  >  35978 [ACK] Seq=1548425 Ack=26709205 Win=65535 Len=0
1,3.8386179999999968,62.210.85.178,10.0.2.15,TCP,60,9001  >  35978 [ACK] Seq=1548425 Ack=26710355 Win=65535 Len=0
1,3.8386580000000095,10.0.2.15,62.210.85.178,TLSv1.2,4124,Application Data
1,3.8386950000000297,62.210.85.178,10.0.2.15,TCP,60,9001  >  35978 [ACK] Seq=1548425 Ack=26711815 Win=65535 Len=0
1,3.838704000000007,62.210.85.178,10.0.2.15,TCP,60,9001  >  35978 [ACK] Seq=1548425 Ack=26713275 Win=65535 Len=0
1,3.8387669999999616,10.0.2.15,62.210.85.178,TLSv1.2,2974,Application Data
1,3.8388069999999743,62.210.85.178,10.0.2.15,TCP,60,9001  >  35978 [ACK] Seq=1548425 Ack=26714425 Win=65535 Len=0
1,3.8388159999999516,62.210.85.178,10.0.2.15,TCP,60,9001  >  35978 [ACK] Seq=1548425 Ack=26715885 Win=65535 Len=0
1,3.8388199999999415,62.210.85.178,10.0.2.15,TCP,60,9001  >  35978 [ACK] Seq=1548425 Ack=26717345 Win=65535 Len=0
1,3.838848999999982,10.0.2.15,62.210.85.178,TLSv1.2,1226,Application Data
1,3.8388850000000048,62.210.85.178,10.0.2.15,TCP,60,9001  >  35978 [ACK] Seq=1548425 Ack=26718517 Win=65535 Len=0
1,3.838926000000015,10.0.2.15,62.210.85.178,TLSv1.2,4124,Application Data
1,3.838967000000025,62.210.85.178,10.0.2.15,TCP,60,9001  >  35978 [ACK] Seq=1548425 Ack=26719977 Win=65535 Len=0
1,3.838975000000005,62.210.85.178,10.0.2.15,TCP,60,9001  >  35978 [ACK] Seq=1548425 Ack=26721437 Win=65535 Len=0
1,3.8389779999999973,62.210.85.178,10.0.2.15,TCP,60,9001  >  35978 [ACK] Seq=1548425 Ack=26722587 Win=65535 Len=0
1,3.839016000000015,10.0.2.15,62.210.85.178,TLSv1.2,3030,Application Data
1,3.83906300000001,62.210.85.178,10.0.2.15,TCP,60,9001  >  35978 [ACK] Seq=1548425 Ack=26724047 Win=65535 Len=0
1,3.839068999999995,62.210.85.178,10.0.2.15,TCP,60,9001  >  35978 [ACK] Seq=1548425 Ack=26725507 Win=65535 Len=0
1,3.8390719999999874,62.210.85.178,10.0.2.15,TCP,60,9001  >  35978 [ACK] Seq=1548425 Ack=26725563 Win=65535 Len=0
1,3.8482609999999795,10.0.2.15,62.210.85.178,TLSv1.2,4124,Application Data
1,3.8483189999999468,62.210.85.178,10.0.2.15,TCP,60,9001  >  35978 [ACK] Seq=1548425 Ack=26727023 Win=65535 Len=0
1,3.848329000000035,62.210.85.178,10.0.2.15,TCP,60,9001  >  35978 [ACK] Seq=1548425 Ack=26728483 Win=65535 Len=0
1,3.8483340000000226,62.210.85.178,10.0.2.15,TCP,60,9001  >  35978 [ACK] Seq=1548425 Ack=26729633 Win=65535 Len=0
1,3.84838000000002,10.0.2.15,62.210.85.178,TLSv1.2,4124,Application Data
1,3.8484210000000303,62.210.85.178,10.0.2.15,TCP,60,9001  >  35978 [ACK] Seq=1548425 Ack=26731093 Win=65535 Len=0
1,3.8484300000000076,62.210.85.178,10.0.2.15,TCP,60,9001  >  35978 [ACK] Seq=1548425 Ack=26732553 Win=65535 Len=0
1,3.8484339999999975,62.210.85.178,10.0.2.15,TCP,60,9001  >  35978 [ACK] Seq=1548425 Ack=26733703 Win=65535 Len=0
1,3.84847400000001,10.0.2.15,62.210.85.178,TLSv1.2,4124,Application Data
1,3.8485130000000254,62.210.85.178,10.0.2.15,TCP,60,9001  >  35978 [ACK] Seq=1548425 Ack=26735163 Win=65535 Len=0
1,3.848523,62.210.85.178,10.0.2.15,TCP,60,9001  >  35978 [ACK] Seq=1548425 Ack=26736623 Win=65535 Len=0
1,3.848528999999985,62.210.85.178,10.0.2.15,TCP,60,9001  >  35978 [ACK] Seq=1548425 Ack=26737773 Win=65535 Len=0
1,3.8485769999999775,10.0.2.15,62.210.85.178,TLSv1.2,4124,Application Data
1,3.84861699999999,62.210.85.178,10.0.2.15,TCP,60,9001  >  35978 [ACK] Seq=1548425 Ack=26739233 Win=65535 Len=0
1,3.84862499999997,62.210.85.178,10.0.2.15,TCP,60,9001  >  35978 [ACK] Seq=1548425 Ack=26740693 Win=65535 Len=0
1,3.8486299999999574,62.210.85.178,10.0.2.15,TCP,60,9001  >  35978 [ACK] Seq=1548425 Ack=26741843 Win=65535 Len=0
1,3.8486649999999827,10.0.2.15,62.210.85.178,TLSv1.2,332,Application Data
1,3.848702000000003,62.210.85.178,10.0.2.15,TCP,60,9001  >  35978 [ACK] Seq=1548425 Ack=26742121 Win=65535 Len=0
1,3.8487539999999854,10.0.2.15,62.210.85.178,TLSv1.2,3868,Application Data
1,3.8487930000000006,62.210.85.178,10.0.2.15,TCP,60,9001  >  35978 [ACK] Seq=1548425 Ack=26743581 Win=65535 Len=0
1,3.8488009999999804,62.210.85.178,10.0.2.15,TCP,60,9001  >  35978 [ACK] Seq=1548425 Ack=26745041 Win=65535 Len=0
1,3.8488049999999703,62.210.85.178,10.0.2.15,TCP,60,9001  >  35978 [ACK] Seq=1548425 Ack=26745935 Win=65535 Len=0
1,3.848842999999988,10.0.2.15,62.210.85.178,TLSv1.2,4124,Application Data
1,3.8488820000000032,62.210.85.178,10.0.2.15,TCP,60,9001  >  35978 [ACK] Seq=1548425 Ack=26747395 Win=65535 Len=0
1,3.848889999999983,62.210.85.178,10.0.2.15,TCP,60,9001  >  35978 [ACK] Seq=1548425 Ack=26748855 Win=65535 Len=0
1,3.8488929999999755,62.210.85.178,10.0.2.15,TCP,60,9001  >  35978 [ACK] Seq=1548425 Ack=26750005 Win=65535 Len=0
1,3.8489359999999806,10.0.2.15,62.210.85.178,TLSv1.2,3030,Application Data
1,3.8489739999999983,62.210.85.178,10.0.2.15,TCP,60,9001  >  35978 [ACK] Seq=1548425 Ack=26751465 Win=65535 Len=0
1,3.848981999999978,62.210.85.178,10.0.2.15,TCP,60,9001  >  35978 [ACK] Seq=1548425 Ack=26752925 Win=65535 Len=0
1,3.848985999999968,62.210.85.178,10.0.2.15,TCP,60,9001  >  35978 [ACK] Seq=1548425 Ack=26752981 Win=65535 Len=0
1,3.86257999999998,10.0.2.15,62.210.85.178,TLSv1.2,4124,Application Data
1,3.862635999999952,62.210.85.178,10.0.2.15,TCP,60,9001  >  35978 [ACK] Seq=1548425 Ack=26754441 Win=65535 Len=0
1,3.8626480000000356,62.210.85.178,10.0.2.15,TCP,60,9001  >  35978 [ACK] Seq=1548425 Ack=26755901 Win=65535 Len=0
1,3.862653000000023,62.210.85.178,10.0.2.15,TCP,60,9001  >  35978 [ACK] Seq=1548425 Ack=26757051 Win=65535 Len=0
1,3.862700000000018,10.0.2.15,62.210.85.178,TLSv1.2,4124,Application Data
1,3.862741000000028,62.210.85.178,10.0.2.15,TCP,60,9001  >  35978 [ACK] Seq=1548425 Ack=26758511 Win=65535 Len=0
1,3.862749000000008,62.210.85.178,10.0.2.15,TCP,60,9001  >  35978 [ACK] Seq=1548425 Ack=26759971 Win=65535 Len=0
1,3.8627539999999954,62.210.85.178,10.0.2.15,TCP,60,9001  >  35978 [ACK] Seq=1548425 Ack=26761121 Win=65535 Len=0
1,3.8627930000000106,10.0.2.15,62.210.85.178,TLSv1.2,4124,Application Data
1,3.862832000000026,62.210.85.178,10.0.2.15,TCP,60,9001  >  35978 [ACK] Seq=1548425 Ack=26762581 Win=65535 Len=0
1,3.8628400000000056,62.210.85.178,10.0.2.15,TCP,60,9001  >  35978 [ACK] Seq=1548425 Ack=26764041 Win=65535 Len=0
1,3.8628459999999905,62.210.85.178,10.0.2.15,TCP,60,9001  >  35978 [ACK] Seq=1548425 Ack=26765191 Win=65535 Len=0
1,3.862886000000003,10.0.2.15,62.210.85.178,TLSv1.2,4124,Application Data
1,3.8629230000000234,62.210.85.178,10.0.2.15,TCP,60,9001  >  35978 [ACK] Seq=1548425 Ack=26766651 Win=65535 Len=0
1,3.8629320000000007,62.210.85.178,10.0.2.15,TCP,60,9001  >  35978 [ACK] Seq=1548425 Ack=26768111 Win=65535 Len=0
1,3.8629359999999906,62.210.85.178,10.0.2.15,TCP,60,9001  >  35978 [ACK] Seq=1548425 Ack=26769261 Win=65535 Len=0
1,3.862971000000016,10.0.2.15,62.210.85.178,TLSv1.2,332,Application Data
1,3.863008000000036,62.210.85.178,10.0.2.15,TCP,60,9001  >  35978 [ACK] Seq=1548425 Ack=26769539 Win=65535 Len=0
1,3.863104000000021,10.0.2.15,62.210.85.178,TLSv1.2,3868,Application Data
1,3.8631450000000314,62.210.85.178,10.0.2.15,TCP,60,9001  >  35978 [ACK] Seq=1548425 Ack=26770999 Win=65535 Len=0
1,3.863153000000011,62.210.85.178,10.0.2.15,TCP,60,9001  >  35978 [ACK] Seq=1548425 Ack=26772459 Win=65535 Len=0
1,3.863157000000001,62.210.85.178,10.0.2.15,TCP,60,9001  >  35978 [ACK] Seq=1548425 Ack=26773353 Win=65535 Len=0
1,3.863195000000019,10.0.2.15,62.210.85.178,TLSv1.2,910,Application Data
1,3.8632330000000366,62.210.85.178,10.0.2.15,TCP,60,9001  >  35978 [ACK] Seq=1548425 Ack=26774209 Win=65535 Len=0
1,3.9244410000000016,54.93.77.70,10.0.2.15,TLSv1.2,590,Application Data
1,3.9660390000000234,10.0.2.15,54.93.77.70,TCP,54,34692  >  9001 [ACK] Seq=1543775 Ack=26578673 Win=65535 Len=0
1,3.9809830000000375,54.93.77.70,10.0.2.15,TCP,2950,"9001  >  34692 [PSH, ACK] Seq=26578673 Ack=1543775 Win=65535 Len=2896 [TCP segment of a reassembled PDU]"
1,3.9810380000000123,10.0.2.15,54.93.77.70,TCP,54,34692  >  9001 [ACK] Seq=1543775 Ack=26581569 Win=65535 Len=0
1,3.9914119999999684,54.93.77.70,10.0.2.15,TLSv1.2,4398,"Application Data, Application Data"
1,3.991457999999966,10.0.2.15,54.93.77.70,TCP,54,34692  >  9001 [ACK] Seq=1543775 Ack=26585913 Win=65535 Len=0
1,3.9987559999999576,54.93.77.70,10.0.2.15,TLSv1.2,4210,"Application Data, Application Data"
1,3.9988180000000284,10.0.2.15,54.93.77.70,TCP,54,34692  >  9001 [ACK] Seq=1543775 Ack=26590069 Win=65535 Len=0
1,4.010347000000024,54.93.77.70,10.0.2.15,TLSv1.2,7294,"Application Data, Application Data"
1,4.010403999999994,10.0.2.15,54.93.77.70,TCP,54,34692  >  9001 [ACK] Seq=1543775 Ack=26597309 Win=65535 Len=0
1,4.014731999999981,54.93.77.70,10.0.2.15,TLSv1.2,590,Application Data
1,4.014782999999966,10.0.2.15,54.93.77.70,TCP,54,34692  >  9001 [ACK] Seq=1543775 Ack=26597845 Win=65535 Len=0
1,4.020689999999945,54.93.77.70,10.0.2.15,TLSv1.2,5846,Application Data
1,4.020709000000011,54.93.77.70,10.0.2.15,TCP,1502,"9001  >  34692 [PSH, ACK] Seq=26603637 Ack=1543775 Win=65535 Len=1448 [TCP segment of a reassembled PDU]"
1,4.0207470000000285,10.0.2.15,54.93.77.70,TCP,54,34692  >  9001 [ACK] Seq=1543775 Ack=26603637 Win=65535 Len=0
1,4.020789000000036,10.0.2.15,54.93.77.70,TCP,54,34692  >  9001 [ACK] Seq=1543775 Ack=26605085 Win=65535 Len=0
1,4.031782000000021,54.93.77.70,10.0.2.15,TLSv1.2,2950,"Application Data, Application Data"
1,4.031829000000016,10.0.2.15,54.93.77.70,TCP,54,34692  >  9001 [ACK] Seq=1543775 Ack=26607981 Win=65535 Len=0
1,4.031986999999958,10.0.2.15,54.93.77.70,TLSv1.2,590,Application Data
1,4.032091000000037,54.93.77.70,10.0.2.15,TCP,60,9001  >  34692 [ACK] Seq=26607981 Ack=1544311 Win=65535 Len=0
1,4.032103000000006,54.93.77.70,10.0.2.15,TCP,1502,"9001  >  34692 [PSH, ACK] Seq=26607981 Ack=1544311 Win=65535 Len=1448 [TCP segment of a reassembled PDU]"
1,4.032142000000022,10.0.2.15,54.93.77.70,TCP,54,34692  >  9001 [ACK] Seq=1544311 Ack=26609429 Win=65535 Len=0
1,4.032285000000002,54.93.77.70,10.0.2.15,TLSv1.2,916,"Application Data, Application Data"
1,4.03904799999998,54.93.77.70,10.0.2.15,TCP,2950,"9001  >  34692 [PSH, ACK] Seq=26610291 Ack=1544311 Win=65535 Len=2896 [TCP segment of a reassembled PDU]"
1,4.039139999999975,10.0.2.15,54.93.77.70,TCP,54,34692  >  9001 [ACK] Seq=1544311 Ack=26613187 Win=65535 Len=0
1,4.044430000000034,10.0.2.15,54.93.77.70,TLSv1.2,590,Application Data
1,4.044547999999963,54.93.77.70,10.0.2.15,TCP,60,9001  >  34692 [ACK] Seq=26613187 Ack=1544847 Win=65535 Len=0
1,4.049445999999989,54.93.77.70,10.0.2.15,TLSv1.2,7294,"Application Data, Application Data"
1,4.049575000000004,10.0.2.15,54.93.77.70,TCP,54,34692  >  9001 [ACK] Seq=1544847 Ack=26620427 Win=65535 Len=0
1,4.050233000000048,54.93.77.70,10.0.2.15,TLSv1.2,1292,Application Data
1,4.0590049999999565,54.93.77.70,10.0.2.15,TCP,2950,"9001  >  34692 [PSH, ACK] Seq=26621665 Ack=1544847 Win=65535 Len=2896 [TCP segment of a reassembled PDU]"
1,4.059088999999972,10.0.2.15,54.93.77.70,TCP,54,34692  >  9001 [ACK] Seq=1544847 Ack=26624561 Win=65535 Len=0
1,4.068015999999943,54.93.77.70,10.0.2.15,TLSv1.2,5846,"Application Data, Application Data, Application Data"
1,4.068165000000022,54.93.77.70,10.0.2.15,TLSv1.2,3276,Application Data
1,4.068222999999989,10.0.2.15,54.93.77.70,TCP,54,34692  >  9001 [ACK] Seq=1544847 Ack=26633575 Win=65535 Len=0
1,4.068546999999967,10.0.2.15,54.93.77.70,TLSv1.2,590,Application Data
1,4.068646999999942,54.93.77.70,10.0.2.15,TCP,60,9001  >  34692 [ACK] Seq=26633575 Ack=1545383 Win=65535 Len=0
1,4.0774189999999635,54.93.77.70,10.0.2.15,TCP,2950,"9001  >  34692 [PSH, ACK] Seq=26633575 Ack=1545383 Win=65535 Len=2896 [TCP segment of a reassembled PDU]"
1,4.077580000000012,10.0.2.15,54.93.77.70,TCP,54,34692  >  9001 [ACK] Seq=1545383 Ack=26636471 Win=65535 Len=0
1,4.086347000000046,54.93.77.70,10.0.2.15,TLSv1.2,1314,"Application Data, Application Data"
1,4.088797999999997,54.93.77.70,10.0.2.15,TLSv1.2,5846,Application Data
1,4.088889999999992,10.0.2.15,54.93.77.70,TCP,54,34692  >  9001 [ACK] Seq=1545383 Ack=26643523 Win=65535 Len=0
1,4.088963000000035,54.93.77.70,10.0.2.15,TCP,1502,"9001  >  34692 [PSH, ACK] Seq=26643523 Ack=1545383 Win=65535 Len=1448 [TCP segment of a reassembled PDU]"
1,4.089004000000045,10.0.2.15,54.93.77.70,TCP,54,34692  >  9001 [ACK] Seq=1545383 Ack=26644971 Win=65535 Len=0
1,4.099340999999981,54.93.77.70,10.0.2.15,TLSv1.2,7294,"Application Data, Application Data"
1,4.099399999999946,10.0.2.15,54.93.77.70,TCP,54,34692  >  9001 [ACK] Seq=1545383 Ack=26652211 Win=65535 Len=0
1,4.099634000000037,54.93.77.70,10.0.2.15,TLSv1.2,1502,Application Data [TCP segment of a reassembled PDU]
1,4.099734000000012,10.0.2.15,54.93.77.70,TCP,54,34692  >  9001 [ACK] Seq=1545383 Ack=26653659 Win=65535 Len=0
1,4.105688999999984,54.93.77.70,10.0.2.15,TLSv1.2,684,Application Data
1,4.107541999999967,10.0.2.15,54.93.77.70,TLSv1.2,590,Application Data
1,4.10766000000001,54.93.77.70,10.0.2.15,TCP,60,9001  >  34692 [ACK] Seq=26654289 Ack=1545919 Win=65535 Len=0
1,4.121249000000034,10.0.2.15,54.93.77.70,TLSv1.2,590,Application Data
1,4.121577000000002,54.93.77.70,10.0.2.15,TCP,60,9001  >  34692 [ACK] Seq=26654289 Ack=1546455 Win=65535 Len=0
1,4.124386999999956,54.93.77.70,10.0.2.15,TLSv1.2,590,Application Data
1,4.157860000000028,62.210.85.178,10.0.2.15,TLSv1.2,590,Application Data
1,4.165976999999998,10.0.2.15,54.93.77.70,TCP,54,34692  >  9001 [ACK] Seq=1546455 Ack=26654825 Win=65535 Len=0
1,4.201968999999963,10.0.2.15,62.210.85.178,TCP,54,35978  >  9001 [ACK] Seq=26774209 Ack=1548961 Win=65535 Len=0
1,4.227958999999942,62.210.85.178,10.0.2.15,TLSv1.2,590,Application Data
1,4.228020000000015,10.0.2.15,62.210.85.178,TCP,54,35978  >  9001 [ACK] Seq=26774209 Ack=1549497 Win=65535 Len=0
1,4.248291999999992,62.210.85.178,10.0.2.15,TLSv1.2,590,Application Data
1,4.248368000000028,10.0.2.15,62.210.85.178,TCP,54,35978  >  9001 [ACK] Seq=26774209 Ack=1550033 Win=65535 Len=0
1,4.275825999999938,62.210.85.178,10.0.2.15,TLSv1.2,590,Application Data
1,4.275888000000009,10.0.2.15,62.210.85.178,TCP,54,35978  >  9001 [ACK] Seq=26774209 Ack=1550569 Win=65535 Len=0
1,4.292835999999966,62.210.85.178,10.0.2.15,TLSv1.2,590,Application Data
1,4.292899000000034,10.0.2.15,62.210.85.178,TCP,54,35978  >  9001 [ACK] Seq=26774209 Ack=1551105 Win=65535 Len=0
1,4.293412999999987,10.0.2.15,62.210.85.178,TLSv1.2,590,Application Data
1,4.293519999999944,62.210.85.178,10.0.2.15,TCP,60,9001  >  35978 [ACK] Seq=1551105 Ack=26774745 Win=65535 Len=0
1,4.925713999999971,54.93.77.70,10.0.2.15,TLSv1.2,590,Application Data
1,4.925803999999971,10.0.2.15,54.93.77.70,TCP,54,34692  >  9001 [ACK] Seq=1546455 Ack=26655361 Win=65535 Len=0
1,4.926146000000017,10.0.2.15,54.93.77.70,TLSv1.2,590,Application Data
1,4.926309999999944,54.93.77.70,10.0.2.15,TCP,60,9001  >  34692 [ACK] Seq=26655361 Ack=1546991 Win=65535 Len=0
1,5.074084999999968,62.210.85.178,10.0.2.15,TLSv1.2,590,Application Data
1,5.078883000000019,10.0.2.15,62.210.85.178,TLSv1.2,590,Application Data
1,5.079042999999956,62.210.85.178,10.0.2.15,TCP,60,9001  >  35978 [ACK] Seq=1551641 Ack=26775281 Win=65535 Len=0
1,5.09035300000005,10.0.2.15,62.210.85.178,TLSv1.2,4124,Application Data
1,5.090462000000002,10.0.2.15,62.210.85.178,TCP,2974,35978  >  9001 [ACK] Seq=26779351 Ack=1551641 Win=65535 Len=2920 [TCP segment of a reassembled PDU]
1,5.09050400000001,62.210.85.178,10.0.2.15,TCP,60,9001  >  35978 [ACK] Seq=1551641 Ack=26776741 Win=65535 Len=0
1,5.09051599999998,62.210.85.178,10.0.2.15,TCP,60,9001  >  35978 [ACK] Seq=1551641 Ack=26778201 Win=65535 Len=0
1,5.0905199999999695,62.210.85.178,10.0.2.15,TCP,60,9001  >  35978 [ACK] Seq=1551641 Ack=26779351 Win=65535 Len=0
1,5.0905219999999645,62.210.85.178,10.0.2.15,TCP,60,9001  >  35978 [ACK] Seq=1551641 Ack=26780811 Win=65535 Len=0
1,5.090524999999957,62.210.85.178,10.0.2.15,TCP,60,9001  >  35978 [ACK] Seq=1551641 Ack=26782271 Win=65535 Len=0
1,5.090559999999982,10.0.2.15,62.210.85.178,TLSv1.2,1204,Application Data
1,5.090593000000013,62.210.85.178,10.0.2.15,TCP,60,9001  >  35978 [ACK] Seq=1551641 Ack=26783421 Win=65535 Len=0
1,5.090638000000013,10.0.2.15,62.210.85.178,TLSv1.2,4124,Application Data
1,5.090675000000033,62.210.85.178,10.0.2.15,TCP,60,9001  >  35978 [ACK] Seq=1551641 Ack=26784881 Win=65535 Len=0
1,5.090682000000015,62.210.85.178,10.0.2.15,TCP,60,9001  >  35978 [ACK] Seq=1551641 Ack=26786341 Win=65535 Len=0
1,5.090686000000005,62.210.85.178,10.0.2.15,TCP,60,9001  >  35978 [ACK] Seq=1551641 Ack=26787491 Win=65535 Len=0
1,5.090724000000023,10.0.2.15,62.210.85.178,TLSv1.2,4124,Application Data
1,5.09075699999994,62.210.85.178,10.0.2.15,TCP,60,9001  >  35978 [ACK] Seq=1551641 Ack=26788951 Win=65535 Len=0
1,5.090765000000033,62.210.85.178,10.0.2.15,TCP,60,9001  >  35978 [ACK] Seq=1551641 Ack=26790411 Win=65535 Len=0
1,5.090820000000008,10.0.2.15,62.210.85.178,TLSv1.2,2974,Application Data
1,5.090863000000013,62.210.85.178,10.0.2.15,TCP,60,9001  >  35978 [ACK] Seq=1551641 Ack=26791561 Win=65535 Len=0
1,5.090870999999993,62.210.85.178,10.0.2.15,TCP,60,9001  >  35978 [ACK] Seq=1551641 Ack=26793021 Win=65535 Len=0
1,5.090874999999983,62.210.85.178,10.0.2.15,TCP,60,9001  >  35978 [ACK] Seq=1551641 Ack=26794481 Win=65535 Len=0
1,5.090902000000028,10.0.2.15,62.210.85.178,TLSv1.2,1226,Application Data
1,5.0909339999999474,62.210.85.178,10.0.2.15,TCP,60,9001  >  35978 [ACK] Seq=1551641 Ack=26795653 Win=65535 Len=0
1,5.090972999999963,10.0.2.15,62.210.85.178,TLSv1.2,4124,Application Data
1,5.091007999999988,62.210.85.178,10.0.2.15,TCP,60,9001  >  35978 [ACK] Seq=1551641 Ack=26797113 Win=65535 Len=0
1,5.09101499999997,62.210.85.178,10.0.2.15,TCP,60,9001  >  35978 [ACK] Seq=1551641 Ack=26798573 Win=65535 Len=0
1,5.091017999999963,62.210.85.178,10.0.2.15,TCP,60,9001  >  35978 [ACK] Seq=1551641 Ack=26799723 Win=65535 Len=0
1,5.0910539999999855,10.0.2.15,62.210.85.178,TLSv1.2,3030,Application Data
1,5.091090000000008,62.210.85.178,10.0.2.15,TCP,60,9001  >  35978 [ACK] Seq=1551641 Ack=26801183 Win=65535 Len=0
1,5.091095999999993,62.210.85.178,10.0.2.15,TCP,60,9001  >  35978 [ACK] Seq=1551641 Ack=26802643 Win=65535 Len=0
1,5.091098999999986,62.210.85.178,10.0.2.15,TCP,60,9001  >  35978 [ACK] Seq=1551641 Ack=26802699 Win=65535 Len=0
1,5.100321000000008,10.0.2.15,62.210.85.178,TLSv1.2,4124,Application Data
1,5.100398000000041,62.210.85.178,10.0.2.15,TCP,60,9001  >  35978 [ACK] Seq=1551641 Ack=26804159 Win=65535 Len=0
1,5.100408000000016,62.210.85.178,10.0.2.15,TCP,60,9001  >  35978 [ACK] Seq=1551641 Ack=26805619 Win=65535 Len=0
1,5.100412000000006,62.210.85.178,10.0.2.15,TCP,60,9001  >  35978 [ACK] Seq=1551641 Ack=26806769 Win=65535 Len=0
1,5.100456000000008,10.0.2.15,62.210.85.178,TLSv1.2,4124,Application Data
1,5.100507999999991,62.210.85.178,10.0.2.15,TCP,60,9001  >  35978 [ACK] Seq=1551641 Ack=26808229 Win=65535 Len=0
1,5.100514999999973,62.210.85.178,10.0.2.15,TCP,60,9001  >  35978 [ACK] Seq=1551641 Ack=26809689 Win=65535 Len=0
1,5.1005179999999655,62.210.85.178,10.0.2.15,TCP,60,9001  >  35978 [ACK] Seq=1551641 Ack=26810839 Win=65535 Len=0
1,5.100575000000049,10.0.2.15,62.210.85.178,TLSv1.2,4124,Application Data
1,5.100609999999961,62.210.85.178,10.0.2.15,TCP,60,9001  >  35978 [ACK] Seq=1551641 Ack=26812299 Win=65535 Len=0
1,5.100618999999938,62.210.85.178,10.0.2.15,TCP,60,9001  >  35978 [ACK] Seq=1551641 Ack=26813759 Win=65535 Len=0
1,5.100623000000041,62.210.85.178,10.0.2.15,TCP,60,9001  >  35978 [ACK] Seq=1551641 Ack=26814909 Win=65535 Len=0
1,5.1006589999999505,10.0.2.15,62.210.85.178,TLSv1.2,4124,Application Data
1,5.100691999999981,62.210.85.178,10.0.2.15,TCP,60,9001  >  35978 [ACK] Seq=1551641 Ack=26816369 Win=65535 Len=0
1,5.100700999999958,62.210.85.178,10.0.2.15,TCP,60,9001  >  35978 [ACK] Seq=1551641 Ack=26817829 Win=65535 Len=0
1,5.100704999999948,62.210.85.178,10.0.2.15,TCP,60,9001  >  35978 [ACK] Seq=1551641 Ack=26818979 Win=65535 Len=0
1,5.100738999999976,10.0.2.15,62.210.85.178,TLSv1.2,332,Application Data
1,5.100774000000001,62.210.85.178,10.0.2.15,TCP,60,9001  >  35978 [ACK] Seq=1551641 Ack=26819257 Win=65535 Len=0
1,5.100822999999991,10.0.2.15,62.210.85.178,TLSv1.2,590,Application Data
1,5.1008580000000165,62.210.85.178,10.0.2.15,TCP,60,9001  >  35978 [ACK] Seq=1551641 Ack=26819793 Win=65535 Len=0
1,5.199064000000021,54.93.77.70,10.0.2.15,TLSv1.2,3674,Application Data
1,5.199188000000049,10.0.2.15,54.93.77.70,TCP,54,34692  >  9001 [ACK] Seq=1546991 Ack=26658981 Win=65535 Len=0
1,5.261466000000041,54.93.77.70,10.0.2.15,TLSv1.2,3674,Application Data
1,5.2615710000000036,10.0.2.15,54.93.77.70,TCP,54,34692  >  9001 [ACK] Seq=1546991 Ack=26662601 Win=65535 Len=0
1,5.261849999999981,10.0.2.15,54.93.77.70,TLSv1.2,590,Application Data
1,5.261998999999946,54.93.77.70,10.0.2.15,TCP,60,9001  >  34692 [ACK] Seq=26662601 Ack=1547527 Win=65535 Len=0
1,5.270800000000008,54.93.77.70,10.0.2.15,TCP,2950,"9001  >  34692 [PSH, ACK] Seq=26662601 Ack=1547527 Win=65535 Len=2896 [TCP segment of a reassembled PDU]"
1,5.270870999999943,10.0.2.15,54.93.77.70,TCP,54,34692  >  9001 [ACK] Seq=1547527 Ack=26665497 Win=65535 Len=0
1,5.277693999999997,54.93.77.70,10.0.2.15,TLSv1.2,778,Application Data
1,5.290017000000034,54.93.77.70,10.0.2.15,TCP,2950,"9001  >  34692 [PSH, ACK] Seq=26666221 Ack=1547527 Win=65535 Len=2896 [TCP segment of a reassembled PDU]"
1,5.290085999999974,10.0.2.15,54.93.77.70,TCP,54,34692  >  9001 [ACK] Seq=1547527 Ack=26669117 Win=65535 Len=0
1,5.294489999999996,54.93.77.70,10.0.2.15,TLSv1.2,778,Application Data
1,5.299108000000047,54.93.77.70,10.0.2.15,TCP,1502,"9001  >  34692 [PSH, ACK] Seq=26669841 Ack=1547527 Win=65535 Len=1448 [TCP segment of a reassembled PDU]"
1,5.299164000000019,10.0.2.15,54.93.77.70,TCP,54,34692  >  9001 [ACK] Seq=1547527 Ack=26671289 Win=65535 Len=0
1,5.31103399999995,54.93.77.70,10.0.2.15,TLSv1.2,170,Application Data
1,5.322945000000004,54.93.77.70,10.0.2.15,TCP,2950,"9001  >  34692 [PSH, ACK] Seq=26671405 Ack=1547527 Win=65535 Len=2896 [TCP segment of a reassembled PDU]"
1,5.323036000000002,10.0.2.15,54.93.77.70,TCP,54,34692  >  9001 [ACK] Seq=1547527 Ack=26674301 Win=65535 Len=0
1,5.327163000000041,54.93.77.70,10.0.2.15,TLSv1.2,778,Application Data
1,5.331576000000041,54.93.77.70,10.0.2.15,TCP,2950,"9001  >  34692 [PSH, ACK] Seq=26675025 Ack=1547527 Win=65535 Len=2896 [TCP segment of a reassembled PDU]"
1,5.331637000000001,10.0.2.15,54.93.77.70,TCP,54,34692  >  9001 [ACK] Seq=1547527 Ack=26677921 Win=65535 Len=0
1,5.338330000000042,54.93.77.70,10.0.2.15,TLSv1.2,4398,Application Data [TCP segment of a reassembled PDU]
1,5.338639999999941,10.0.2.15,54.93.77.70,TCP,54,34692  >  9001 [ACK] Seq=1547527 Ack=26682265 Win=65535 Len=0
1,5.34691399999997,54.93.77.70,10.0.2.15,TLSv1.2,1104,"Application Data, Application Data"
1,5.347163000000023,10.0.2.15,54.93.77.70,TLSv1.2,590,Application Data
1,5.347292000000039,54.93.77.70,10.0.2.15,TCP,60,9001  >  34692 [ACK] Seq=26683315 Ack=1548063 Win=65535 Len=0
1,5.349729000000025,54.93.77.70,10.0.2.15,TCP,2950,"9001  >  34692 [PSH, ACK] Seq=26683315 Ack=1548063 Win=65535 Len=2896 [TCP segment of a reassembled PDU]"
1,5.349804999999947,10.0.2.15,54.93.77.70,TCP,54,34692  >  9001 [ACK] Seq=1548063 Ack=26686211 Win=65535 Len=0
1,5.358375000000024,54.93.77.70,10.0.2.15,TLSv1.2,4398,Application Data [TCP segment of a reassembled PDU]
1,5.358451999999943,10.0.2.15,54.93.77.70,TCP,54,34692  >  9001 [ACK] Seq=1548063 Ack=26690555 Win=65535 Len=0
1,5.363036999999963,54.93.77.70,10.0.2.15,TLSv1.2,1104,"Application Data, Application Data"
1,5.365948000000003,54.93.77.70,10.0.2.15,TLSv1.2,7294,Application Data
1,5.366029000000026,10.0.2.15,54.93.77.70,TCP,54,34692  >  9001 [ACK] Seq=1548063 Ack=26698845 Win=65535 Len=0
1,5.375890000000027,54.93.77.70,10.0.2.15,TLSv1.2,1502,Application Data [TCP segment of a reassembled PDU]
1,5.375935000000027,10.0.2.15,54.93.77.70,TCP,54,34692  >  9001 [ACK] Seq=1548063 Ack=26700293 Win=65535 Len=0
1,5.379007999999999,54.93.77.70,10.0.2.15,TLSv1.2,170,Application Data
1,5.382333000000017,10.0.2.15,54.93.77.70,TLSv1.2,590,Application Data
1,5.382517000000007,54.93.77.70,10.0.2.15,TCP,60,9001  >  34692 [ACK] Seq=26700409 Ack=1548599 Win=65535 Len=0
1,5.502058000000034,62.210.85.178,10.0.2.15,TLSv1.2,1618,Application Data
1,5.502181999999948,10.0.2.15,62.210.85.178,TCP,54,35978  >  9001 [ACK] Seq=26819793 Ack=1553205 Win=65535 Len=0
1,5.502614999999992,10.0.2.15,62.210.85.178,TLSv1.2,590,Application Data
1,5.502724999999941,62.210.85.178,10.0.2.15,TCP,60,9001  >  35978 [ACK] Seq=1553205 Ack=26820329 Win=65535 Len=0
1,5.642260999999962,54.93.77.70,10.0.2.15,TLSv1.2,590,Application Data
1,5.642650000000003,10.0.2.15,54.93.77.70,TLSv1.2,590,Application Data
1,5.642751999999973,54.93.77.70,10.0.2.15,TCP,60,9001  >  34692 [ACK] Seq=26700945 Ack=1549135 Win=65535 Len=0
1,6.153401000000031,62.210.85.178,10.0.2.15,TLSv1.2,590,Application Data
1,6.157645000000002,10.0.2.15,62.210.85.178,TLSv1.2,590,Application Data
1,6.157794999999965,62.210.85.178,10.0.2.15,TCP,60,9001  >  35978 [ACK] Seq=1553741 Ack=26820865 Win=65535 Len=0
1,6.170119,10.0.2.15,62.210.85.178,TLSv1.2,4124,Application Data
1,6.170218999999975,10.0.2.15,62.210.85.178,TCP,2974,35978  >  9001 [ACK] Seq=26824935 Ack=1553741 Win=65535 Len=2920 [TCP segment of a reassembled PDU]
1,6.170259999999985,62.210.85.178,10.0.2.15,TCP,60,9001  >  35978 [ACK] Seq=1553741 Ack=26822325 Win=65535 Len=0
1,6.170270999999957,62.210.85.178,10.0.2.15,TCP,60,9001  >  35978 [ACK] Seq=1553741 Ack=26823785 Win=65535 Len=0
1,6.170273999999949,62.210.85.178,10.0.2.15,TCP,60,9001  >  35978 [ACK] Seq=1553741 Ack=26824935 Win=65535 Len=0
1,6.170276999999942,62.210.85.178,10.0.2.15,TCP,60,9001  >  35978 [ACK] Seq=1553741 Ack=26826395 Win=65535 Len=0
1,6.170280000000048,62.210.85.178,10.0.2.15,TCP,60,9001  >  35978 [ACK] Seq=1553741 Ack=26827855 Win=65535 Len=0
1,6.170313999999962,10.0.2.15,62.210.85.178,TLSv1.2,1204,Application Data
1,6.170345999999995,62.210.85.178,10.0.2.15,TCP,60,9001  >  35978 [ACK] Seq=1553741 Ack=26829005 Win=65535 Len=0
1,6.170390999999995,10.0.2.15,62.210.85.178,TLSv1.2,4124,Application Data
1,6.170425000000023,62.210.85.178,10.0.2.15,TCP,60,9001  >  35978 [ACK] Seq=1553741 Ack=26830465 Win=65535 Len=0
1,6.170433000000003,62.210.85.178,10.0.2.15,TCP,60,9001  >  35978 [ACK] Seq=1553741 Ack=26831925 Win=65535 Len=0
1,6.170435999999995,62.210.85.178,10.0.2.15,TCP,60,9001  >  35978 [ACK] Seq=1553741 Ack=26833075 Win=65535 Len=0
1,6.170474000000013,10.0.2.15,62.210.85.178,TLSv1.2,4124,Application Data
1,6.170507000000043,62.210.85.178,10.0.2.15,TCP,60,9001  >  35978 [ACK] Seq=1553741 Ack=26834535 Win=65535 Len=0
1,6.170514000000026,62.210.85.178,10.0.2.15,TCP,60,9001  >  35978 [ACK] Seq=1553741 Ack=26835995 Win=65535 Len=0
1,6.170575999999983,10.0.2.15,62.210.85.178,TLSv1.2,2974,Application Data
1,6.1706120000000055,62.210.85.178,10.0.2.15,TCP,60,9001  >  35978 [ACK] Seq=1553741 Ack=26837145 Win=65535 Len=0
1,6.170619999999985,62.210.85.178,10.0.2.15,TCP,60,9001  >  35978 [ACK] Seq=1553741 Ack=26838605 Win=65535 Len=0
1,6.170622999999978,62.210.85.178,10.0.2.15,TCP,60,9001  >  35978 [ACK] Seq=1553741 Ack=26840065 Win=65535 Len=0
1,6.170650000000023,10.0.2.15,62.210.85.178,TLSv1.2,1226,Application Data
1,6.17068299999994,62.210.85.178,10.0.2.15,TCP,60,9001  >  35978 [ACK] Seq=1553741 Ack=26841237 Win=65535 Len=0
1,6.170721999999955,10.0.2.15,62.210.85.178,TLSv1.2,4124,Application Data
1,6.170755999999983,62.210.85.178,10.0.2.15,TCP,60,9001  >  35978 [ACK] Seq=1553741 Ack=26842697 Win=65535 Len=0
1,6.170762999999965,62.210.85.178,10.0.2.15,TCP,60,9001  >  35978 [ACK] Seq=1553741 Ack=26844157 Win=65535 Len=0
1,6.170765999999958,62.210.85.178,10.0.2.15,TCP,60,9001  >  35978 [ACK] Seq=1553741 Ack=26845307 Win=65535 Len=0
1,6.170802999999978,10.0.2.15,62.210.85.178,TLSv1.2,3030,Application Data
1,6.170837000000006,62.210.85.178,10.0.2.15,TCP,60,9001  >  35978 [ACK] Seq=1553741 Ack=26846767 Win=65535 Len=0
1,6.170843999999988,62.210.85.178,10.0.2.15,TCP,60,9001  >  35978 [ACK] Seq=1553741 Ack=26848227 Win=65535 Len=0
1,6.170846999999981,62.210.85.178,10.0.2.15,TCP,60,9001  >  35978 [ACK] Seq=1553741 Ack=26848283 Win=65535 Len=0
1,6.180142000000046,10.0.2.15,62.210.85.178,TLSv1.2,4124,Application Data
1,6.1802659999999605,62.210.85.178,10.0.2.15,TCP,60,9001  >  35978 [ACK] Seq=1553741 Ack=26849743 Win=65535 Len=0
1,6.180281000000036,62.210.85.178,10.0.2.15,TCP,60,9001  >  35978 [ACK] Seq=1553741 Ack=26851203 Win=65535 Len=0
1,6.180284000000029,62.210.85.178,10.0.2.15,TCP,60,9001  >  35978 [ACK] Seq=1553741 Ack=26852353 Win=65535 Len=0
1,6.180315999999948,10.0.2.15,62.210.85.178,TCP,1514,35978  >  9001 [ACK] Seq=26852353 Ack=1553741 Win=65535 Len=1460 [TCP segment of a reassembled PDU]
1,6.1803710000000365,10.0.2.15,62.210.85.178,TLSv1.2,1250,Application Data
1,6.180406999999946,62.210.85.178,10.0.2.15,TCP,60,9001  >  35978 [ACK] Seq=1553741 Ack=26853813 Win=65535 Len=0
1,6.180413000000044,62.210.85.178,10.0.2.15,TCP,60,9001  >  35978 [ACK] Seq=1553741 Ack=26855009 Win=65535 Len=0
1,6.358789999999999,54.93.77.70,10.0.2.15,TCP,2950,"9001  >  34692 [PSH, ACK] Seq=26700945 Ack=1549135 Win=65535 Len=2896 [TCP segment of a reassembled PDU]"
1,6.358921000000009,10.0.2.15,54.93.77.70,TCP,54,34692  >  9001 [ACK] Seq=1549135 Ack=26703841 Win=65535 Len=0
1,6.360941000000025,54.93.77.70,10.0.2.15,TLSv1.2,778,Application Data
1,6.361883000000034,54.93.77.70,10.0.2.15,TLSv1.2,7294,Application Data
1,6.361903999999981,54.93.77.70,10.0.2.15,TLSv1.2,2950,"Application Data, Application Data"
1,6.361996999999974,10.0.2.15,54.93.77.70,TCP,54,34692  >  9001 [ACK] Seq=1549135 Ack=26714701 Win=65535 Len=0
1,6.37829099999999,54.93.77.70,10.0.2.15,TLSv1.2,2950,"Application Data, Application Data"
1,6.378341999999975,10.0.2.15,54.93.77.70,TCP,54,34692  >  9001 [ACK] Seq=1549135 Ack=26717597 Win=65535 Len=0
1,6.378512999999998,10.0.2.15,54.93.77.70,TLSv1.2,590,Application Data
1,6.378584000000046,54.93.77.70,10.0.2.15,TCP,60,9001  >  34692 [ACK] Seq=26717597 Ack=1549671 Win=65535 Len=0
1,6.378990000000044,54.93.77.70,10.0.2.15,TCP,2950,"9001  >  34692 [PSH, ACK] Seq=26717597 Ack=1549671 Win=65535 Len=2896 [TCP segment of a reassembled PDU]"
1,6.379013999999984,54.93.77.70,10.0.2.15,TLSv1.2,8482,"Application Data, Application Data, Application Data, Application Data"
1,6.3790780000000495,10.0.2.15,54.93.77.70,TCP,54,34692  >  9001 [ACK] Seq=1549671 Ack=26720493 Win=65535 Len=0
1,6.379184000000009,10.0.2.15,54.93.77.70,TCP,54,34692  >  9001 [ACK] Seq=1549671 Ack=26728921 Win=65535 Len=0
1,6.387001999999939,54.93.77.70,10.0.2.15,TCP,2950,"9001  >  34692 [PSH, ACK] Seq=26728921 Ack=1549671 Win=65535 Len=2896 [TCP segment of a reassembled PDU]"
1,6.3870620000000145,10.0.2.15,54.93.77.70,TCP,54,34692  >  9001 [ACK] Seq=1549671 Ack=26731817 Win=65535 Len=0
1,6.39043700000002,10.0.2.15,54.93.77.70,TLSv1.2,590,Application Data
1,6.390565000000038,54.93.77.70,10.0.2.15,TCP,60,9001  >  34692 [ACK] Seq=26731817 Ack=1550207 Win=65535 Len=0
1,6.3953749999999445,54.93.77.70,10.0.2.15,TLSv1.2,264,Application Data
1,6.438043999999991,10.0.2.15,54.93.77.70,TCP,54,34692  >  9001 [ACK] Seq=1550207 Ack=26732027 Win=65535 Len=0
1,6.4562290000000075,54.93.77.70,10.0.2.15,TLSv1.2,3674,Application Data
1,6.456321000000003,10.0.2.15,54.93.77.70,TCP,54,34692  >  9001 [ACK] Seq=1550207 Ack=26735647 Win=65535 Len=0
1,6.458744000000024,10.0.2.15,54.93.77.70,TLSv1.2,590,Application Data
1,6.458911999999941,54.93.77.70,10.0.2.15,TCP,60,9001  >  34692 [ACK] Seq=26735647 Ack=1550743 Win=65535 Len=0
1,6.4918689999999515,62.210.85.178,10.0.2.15,TLSv1.2,590,Application Data
1,6.533986000000027,10.0.2.15,62.210.85.178,TCP,54,35978  >  9001 [ACK] Seq=26855009 Ack=1554277 Win=65535 Len=0
1,6.549901999999975,62.210.85.178,10.0.2.15,TLSv1.2,590,Application Data
1,6.549987999999985,10.0.2.15,62.210.85.178,TCP,54,35978  >  9001 [ACK] Seq=26855009 Ack=1554813 Win=65535 Len=0
1,7.075041999999939,62.210.85.178,10.0.2.15,TLSv1.2,590,Application Data
1,7.0751169999999775,10.0.2.15,62.210.85.178,TCP,54,35978  >  9001 [ACK] Seq=26855009 Ack=1555349 Win=65535 Len=0
1,7.075415000000021,10.0.2.15,62.210.85.178,TLSv1.2,590,Application Data
1,7.075511000000006,62.210.85.178,10.0.2.15,TCP,60,9001  >  35978 [ACK] Seq=1555349 Ack=26855545 Win=65535 Len=0
1,7.185456000000045,54.93.77.70,10.0.2.15,TLSv1.2,590,Application Data
1,7.188203000000044,10.0.2.15,54.93.77.70,TLSv1.2,590,Application Data
1,7.188361999999984,54.93.77.70,10.0.2.15,TCP,60,9001  >  34692 [ACK] Seq=26736183 Ack=1551279 Win=65535 Len=0
1,7.382938999999965,62.210.85.178,10.0.2.15,TLSv1.2,590,Application Data
1,7.389625000000024,10.0.2.15,62.210.85.178,TLSv1.2,590,Application Data
1,7.389827999999966,62.210.85.178,10.0.2.15,TCP,60,9001  >  35978 [ACK] Seq=1555885 Ack=26856081 Win=65535 Len=0
1,7.402261999999951,10.0.2.15,62.210.85.178,TLSv1.2,4124,Application Data
1,7.402381999999989,10.0.2.15,62.210.85.178,TCP,2974,35978  >  9001 [ACK] Seq=26860151 Ack=1555885 Win=65535 Len=2920 [TCP segment of a reassembled PDU]
1,7.402424999999994,62.210.85.178,10.0.2.15,TCP,60,9001  >  35978 [ACK] Seq=1555885 Ack=26857541 Win=65535 Len=0
1,7.402434999999969,62.210.85.178,10.0.2.15,TCP,60,9001  >  35978 [ACK] Seq=1555885 Ack=26859001 Win=65535 Len=0
1,7.402439999999956,62.210.85.178,10.0.2.15,TCP,60,9001  >  35978 [ACK] Seq=1555885 Ack=26860151 Win=65535 Len=0
1,7.402443999999946,62.210.85.178,10.0.2.15,TCP,60,9001  >  35978 [ACK] Seq=1555885 Ack=26861611 Win=65535 Len=0
1,7.402449000000047,62.210.85.178,10.0.2.15,TCP,60,9001  >  35978 [ACK] Seq=1555885 Ack=26863071 Win=65535 Len=0
1,7.4024930000000495,10.0.2.15,62.210.85.178,TLSv1.2,1204,Application Data
1,7.4025609999999915,10.0.2.15,62.210.85.178,TCP,2974,35978  >  9001 [ACK] Seq=26864221 Ack=1555885 Win=65535 Len=2920 [TCP segment of a reassembled PDU]
1,7.402601000000004,62.210.85.178,10.0.2.15,TCP,60,9001  >  35978 [ACK] Seq=1555885 Ack=26864221 Win=65535 Len=0
1,7.4026079999999865,62.210.85.178,10.0.2.15,TCP,60,9001  >  35978 [ACK] Seq=1555885 Ack=26865681 Win=65535 Len=0
1,7.402611999999976,62.210.85.178,10.0.2.15,TCP,60,9001  >  35978 [ACK] Seq=1555885 Ack=26867141 Win=65535 Len=0
1,7.402647000000002,10.0.2.15,62.210.85.178,TLSv1.2,1204,Application Data
1,7.402711999999951,10.0.2.15,62.210.85.178,TCP,2974,35978  >  9001 [ACK] Seq=26868291 Ack=1555885 Win=65535 Len=2920 [TCP segment of a reassembled PDU]
1,7.402748999999972,62.210.85.178,10.0.2.15,TCP,60,9001  >  35978 [ACK] Seq=1555885 Ack=26868291 Win=65535 Len=0
1,7.402755999999954,62.210.85.178,10.0.2.15,TCP,60,9001  >  35978 [ACK] Seq=1555885 Ack=26869751 Win=65535 Len=0
1,7.402760999999941,62.210.85.178,10.0.2.15,TCP,60,9001  >  35978 [ACK] Seq=1555885 Ack=26871211 Win=65535 Len=0
1,7.402791999999977,10.0.2.15,62.210.85.178,TLSv1.2,1204,Application Data
1,7.402854000000048,62.210.85.178,10.0.2.15,TCP,60,9001  >  35978 [ACK] Seq=1555885 Ack=26872361 Win=65535 Len=0
1,7.402892999999949,10.0.2.15,62.210.85.178,TLSv1.2,332,Application Data
1,7.402964999999995,62.210.85.178,10.0.2.15,TCP,60,9001  >  35978 [ACK] Seq=1555885 Ack=26872639 Win=65535 Len=0
1,7.403010999999992,10.0.2.15,62.210.85.178,TLSv1.2,3868,Application Data
1,7.403051000000005,62.210.85.178,10.0.2.15,TCP,60,9001  >  35978 [ACK] Seq=1555885 Ack=26874099 Win=65535 Len=0
1,7.403057999999987,62.210.85.178,10.0.2.15,TCP,60,9001  >  35978 [ACK] Seq=1555885 Ack=26875559 Win=65535 Len=0
1,7.403062999999975,62.210.85.178,10.0.2.15,TCP,60,9001  >  35978 [ACK] Seq=1555885 Ack=26876453 Win=65535 Len=0
1,7.40310999999997,10.0.2.15,62.210.85.178,TLSv1.2,4124,Application Data
1,7.403149999999982,62.210.85.178,10.0.2.15,TCP,60,9001  >  35978 [ACK] Seq=1555885 Ack=26877913 Win=65535 Len=0
1,7.403155999999967,62.210.85.178,10.0.2.15,TCP,60,9001  >  35978 [ACK] Seq=1555885 Ack=26879373 Win=65535 Len=0
1,7.403160999999955,62.210.85.178,10.0.2.15,TCP,60,9001  >  35978 [ACK] Seq=1555885 Ack=26880523 Win=65535 Len=0
1,7.40320399999996,10.0.2.15,62.210.85.178,TLSv1.2,3030,Application Data
1,7.403242999999975,62.210.85.178,10.0.2.15,TCP,60,9001  >  35978 [ACK] Seq=1555885 Ack=26881983 Win=65535 Len=0
1,7.403249999999957,62.210.85.178,10.0.2.15,TCP,60,9001  >  35978 [ACK] Seq=1555885 Ack=26883443 Win=65535 Len=0
1,7.403253999999947,62.210.85.178,10.0.2.15,TCP,60,9001  >  35978 [ACK] Seq=1555885 Ack=26883499 Win=65535 Len=0
1,7.414621000000011,10.0.2.15,62.210.85.178,TLSv1.2,4124,Application Data
1,7.414710000000014,10.0.2.15,62.210.85.178,TCP,2974,35978  >  9001 [ACK] Seq=26887569 Ack=1555885 Win=65535 Len=2920 [TCP segment of a reassembled PDU]
1,7.414748000000031,62.210.85.178,10.0.2.15,TCP,60,9001  >  35978 [ACK] Seq=1555885 Ack=26884959 Win=65535 Len=0
1,7.414756000000011,62.210.85.178,10.0.2.15,TCP,60,9001  >  35978 [ACK] Seq=1555885 Ack=26886419 Win=65535 Len=0
1,7.414760999999999,62.210.85.178,10.0.2.15,TCP,60,9001  >  35978 [ACK] Seq=1555885 Ack=26887569 Win=65535 Len=0
1,7.4147649999999885,62.210.85.178,10.0.2.15,TCP,60,9001  >  35978 [ACK] Seq=1555885 Ack=26889029 Win=65535 Len=0
1,7.414768999999978,62.210.85.178,10.0.2.15,TCP,60,9001  >  35978 [ACK] Seq=1555885 Ack=26890489 Win=65535 Len=0
1,7.4148119999999835,10.0.2.15,62.210.85.178,TLSv1.2,1204,Application Data
1,7.414908999999966,62.210.85.178,10.0.2.15,TCP,60,9001  >  35978 [ACK] Seq=1555885 Ack=26891639 Win=65535 Len=0
1,7.414952999999969,10.0.2.15,62.210.85.178,TLSv1.2,1232,Application Data
1,7.415044999999964,62.210.85.178,10.0.2.15,TCP,60,9001  >  35978 [ACK] Seq=1555885 Ack=26892817 Win=65535 Len=0
1,7.514866999999981,54.93.77.70,10.0.2.15,TLSv1.2,3674,Application Data
1,7.515004999999974,10.0.2.15,54.93.77.70,TCP,54,34692  >  9001 [ACK] Seq=1551279 Ack=26739803 Win=65535 Len=0
1,7.522626999999943,54.93.77.70,10.0.2.15,TCP,2950,"9001  >  34692 [PSH, ACK] Seq=26739803 Ack=1551279 Win=65535 Len=2896 [TCP segment of a reassembled PDU]"
1,7.522695999999996,10.0.2.15,54.93.77.70,TCP,54,34692  >  9001 [ACK] Seq=1551279 Ack=26742699 Win=65535 Len=0
1,7.531047999999942,54.93.77.70,10.0.2.15,TLSv1.2,778,Application Data
1,7.5332389999999805,54.93.77.70,10.0.2.15,TLSv1.2,4398,Application Data
1,7.533307000000036,10.0.2.15,54.93.77.70,TCP,54,34692  >  9001 [ACK] Seq=1551279 Ack=26747767 Win=65535 Len=0
1,7.533988000000022,54.93.77.70,10.0.2.15,TCP,2950,"9001  >  34692 [PSH, ACK] Seq=26747767 Ack=1551279 Win=65535 Len=2896 [TCP segment of a reassembled PDU]"
1,7.534029000000032,10.0.2.15,54.93.77.70,TCP,54,34692  >  9001 [ACK] Seq=1551279 Ack=26750663 Win=65535 Len=0
1,7.545887999999991,54.93.77.70,10.0.2.15,TLSv1.2,1502,Application Data [TCP segment of a reassembled PDU]
1,7.545974000000001,10.0.2.15,54.93.77.70,TCP,54,34692  >  9001 [ACK] Seq=1551279 Ack=26752111 Win=65535 Len=0
1,7.547310000000039,54.93.77.70,10.0.2.15,TLSv1.2,170,Application Data
1,7.562652999999955,54.93.77.70,10.0.2.15,TCP,2950,"9001  >  34692 [PSH, ACK] Seq=26752227 Ack=1551279 Win=65535 Len=2896 [TCP segment of a reassembled PDU]"
1,7.562730999999985,10.0.2.15,54.93.77.70,TCP,54,34692  >  9001 [ACK] Seq=1551279 Ack=26755123 Win=65535 Len=0
1,7.563407999999981,54.93.77.70,10.0.2.15,TLSv1.2,778,Application Data
1,7.570255999999972,54.93.77.70,10.0.2.15,TLSv1.2,7294,Application Data
1,7.570326000000023,10.0.2.15,54.93.77.70,TCP,54,34692  >  9001 [ACK] Seq=1551279 Ack=26763087 Win=65535 Len=0
1,7.579772000000048,54.93.77.70,10.0.2.15,TLSv1.2,1104,"Application Data, Application Data"
1,7.5799710000000005,10.0.2.15,54.93.77.70,TLSv1.2,590,Application Data
1,7.5800859999999375,54.93.77.70,10.0.2.15,TCP,60,9001  >  34692 [ACK] Seq=26764137 Ack=1551815 Win=65535 Len=0
1,7.581388999999945,54.93.77.70,10.0.2.15,TCP,2950,"9001  >  34692 [PSH, ACK] Seq=26764137 Ack=1551815 Win=65535 Len=2896 [TCP segment of a reassembled PDU]"
1,7.58146099999999,10.0.2.15,54.93.77.70,TCP,54,34692  >  9001 [ACK] Seq=1551815 Ack=26767033 Win=65535 Len=0
1,7.582928000000038,54.93.77.70,10.0.2.15,TLSv1.2,4398,"Application Data, Application Data"
1,7.582985000000008,10.0.2.15,54.93.77.70,TCP,54,34692  >  9001 [ACK] Seq=1551815 Ack=26771377 Win=65535 Len=0
1,7.589399999999955,10.0.2.15,54.93.77.70,TLSv1.2,590,Application Data
1,7.589582999999948,54.93.77.70,10.0.2.15,TCP,60,9001  >  34692 [ACK] Seq=26771377 Ack=1552351 Win=65535 Len=0
1,7.645186999999964,54.93.77.70,10.0.2.15,TLSv1.2,2132,Application Data
1,7.645347000000015,10.0.2.15,54.93.77.70,TCP,54,34692  >  9001 [ACK] Seq=1552351 Ack=26773455 Win=65535 Len=0
1,7.648624000000041,10.0.2.15,54.93.77.70,TLSv1.2,590,Application Data
1,7.648804000000041,54.93.77.70,10.0.2.15,TCP,60,9001  >  34692 [ACK] Seq=26773455 Ack=1552887 Win=65535 Len=0
1,7.684729999999945,62.210.85.178,10.0.2.15,TLSv1.2,590,Application Data
1,7.721064999999953,62.210.85.178,10.0.2.15,TLSv1.2,590,Application Data
1,7.721141999999986,10.0.2.15,62.210.85.178,TCP,54,35978  >  9001 [ACK] Seq=26892817 Ack=1556957 Win=65535 Len=0
1,7.800531999999976,62.210.85.178,10.0.2.15,TLSv1.2,590,Application Data
1,7.801080999999954,10.0.2.15,62.210.85.178,TLSv1.2,590,Application Data
1,7.801187000000027,62.210.85.178,10.0.2.15,TCP,60,9001  >  35978 [ACK] Seq=1557493 Ack=26893353 Win=65535 Len=0
1,8.508481999999958,54.93.77.70,10.0.2.15,TLSv1.2,590,Application Data
1,8.50885900000003,10.0.2.15,54.93.77.70,TLSv1.2,590,Application Data
1,8.508969999999977,54.93.77.70,10.0.2.15,TCP,60,9001  >  34692 [ACK] Seq=26773991 Ack=1553423 Win=65535 Len=0
1,8.918844000000036,62.210.85.178,10.0.2.15,TLSv1.2,590,Application Data
1,8.92344700000001,10.0.2.15,62.210.85.178,TLSv1.2,590,Application Data
1,8.923600999999962,62.210.85.178,10.0.2.15,TCP,60,9001  >  35978 [ACK] Seq=1558029 Ack=26893889 Win=65535 Len=0
1,8.939332000000036,10.0.2.15,62.210.85.178,TLSv1.2,4124,Application Data
1,8.939646000000039,10.0.2.15,62.210.85.178,TCP,2974,35978  >  9001 [ACK] Seq=26897959 Ack=1558029 Win=65535 Len=2920 [TCP segment of a reassembled PDU]
1,8.939793000000009,62.210.85.178,10.0.2.15,TCP,60,9001  >  35978 [ACK] Seq=1558029 Ack=26895349 Win=65535 Len=0
1,8.939806999999973,62.210.85.178,10.0.2.15,TCP,60,9001  >  35978 [ACK] Seq=1558029 Ack=26896809 Win=65535 Len=0
1,8.93981199999996,62.210.85.178,10.0.2.15,TCP,60,9001  >  35978 [ACK] Seq=1558029 Ack=26897959 Win=65535 Len=0
1,8.93981599999995,62.210.85.178,10.0.2.15,TCP,60,9001  >  35978 [ACK] Seq=1558029 Ack=26899419 Win=65535 Len=0
1,8.939820999999938,62.210.85.178,10.0.2.15,TCP,60,9001  >  35978 [ACK] Seq=1558029 Ack=26900879 Win=65535 Len=0
1,8.939869000000044,10.0.2.15,62.210.85.178,TLSv1.2,1204,Application Data
1,8.939945999999964,10.0.2.15,62.210.85.178,TCP,2974,35978  >  9001 [ACK] Seq=26902029 Ack=1558029 Win=65535 Len=2920 [TCP segment of a reassembled PDU]
1,8.939986999999974,62.210.85.178,10.0.2.15,TCP,60,9001  >  35978 [ACK] Seq=1558029 Ack=26902029 Win=65535 Len=0
1,8.940024999999991,10.0.2.15,62.210.85.178,TLSv1.2,1204,Application Data
1,8.940060000000017,62.210.85.178,10.0.2.15,TCP,60,9001  >  35978 [ACK] Seq=1558029 Ack=26903489 Win=65535 Len=0
1,8.940066999999999,62.210.85.178,10.0.2.15,TCP,60,9001  >  35978 [ACK] Seq=1558029 Ack=26904949 Win=65535 Len=0
1,8.940071999999986,62.210.85.178,10.0.2.15,TCP,60,9001  >  35978 [ACK] Seq=1558029 Ack=26906099 Win=65535 Len=0
1,8.940119999999979,10.0.2.15,62.210.85.178,TLSv1.2,4124,Application Data
1,8.940196000000014,62.210.85.178,10.0.2.15,TCP,60,9001  >  35978 [ACK] Seq=1558029 Ack=26907559 Win=65535 Len=0
1,8.940203999999994,62.210.85.178,10.0.2.15,TCP,60,9001  >  35978 [ACK] Seq=1558029 Ack=26909019 Win=65535 Len=0
1,8.940207999999984,62.210.85.178,10.0.2.15,TCP,60,9001  >  35978 [ACK] Seq=1558029 Ack=26910169 Win=65535 Len=0
1,8.94024300000001,10.0.2.15,62.210.85.178,TLSv1.2,332,Application Data
1,8.940281000000027,62.210.85.178,10.0.2.15,TCP,60,9001  >  35978 [ACK] Seq=1558029 Ack=26910447 Win=65535 Len=0
1,8.94034899999997,10.0.2.15,62.210.85.178,TLSv1.2,3868,Application Data
1,8.940394999999967,62.210.85.178,10.0.2.15,TCP,60,9001  >  35978 [ACK] Seq=1558029 Ack=26911907 Win=65535 Len=0
1,8.94040199999995,62.210.85.178,10.0.2.15,TCP,60,9001  >  35978 [ACK] Seq=1558029 Ack=26913367 Win=65535 Len=0
1,8.940405999999939,62.210.85.178,10.0.2.15,TCP,60,9001  >  35978 [ACK] Seq=1558029 Ack=26914261 Win=65535 Len=0
1,8.940461000000028,10.0.2.15,62.210.85.178,TLSv1.2,4124,Application Data
1,8.94054600000004,10.0.2.15,62.210.85.178,TCP,2974,35978  >  9001 [ACK] Seq=26918331 Ack=1558029 Win=65535 Len=2920 [TCP segment of a reassembled PDU]
1,8.940582999999947,62.210.85.178,10.0.2.15,TCP,60,9001  >  35978 [ACK] Seq=1558029 Ack=26915721 Win=65535 Len=0
1,8.940590000000043,62.210.85.178,10.0.2.15,TCP,60,9001  >  35978 [ACK] Seq=1558029 Ack=26917181 Win=65535 Len=0
1,8.94059500000003,62.210.85.178,10.0.2.15,TCP,60,9001  >  35978 [ACK] Seq=1558029 Ack=26918331 Win=65535 Len=0
1,8.94059900000002,62.210.85.178,10.0.2.15,TCP,60,9001  >  35978 [ACK] Seq=1558029 Ack=26919791 Win=65535 Len=0
1,8.94060300000001,62.210.85.178,10.0.2.15,TCP,60,9001  >  35978 [ACK] Seq=1558029 Ack=26921251 Win=65535 Len=0
1,8.940642000000025,10.0.2.15,62.210.85.178,TLSv1.2,110,Application Data
1,8.940766999999937,62.210.85.178,10.0.2.15,TCP,60,9001  >  35978 [ACK] Seq=1558029 Ack=26921307 Win=65535 Len=0
1,8.950986999999941,10.0.2.15,62.210.85.178,TLSv1.2,4124,Application Data
1,8.951076999999941,10.0.2.15,62.210.85.178,TCP,2974,35978  >  9001 [ACK] Seq=26925377 Ack=1558029 Win=65535 Len=2920 [TCP segment of a reassembled PDU]
1,8.951117999999951,62.210.85.178,10.0.2.15,TCP,60,9001  >  35978 [ACK] Seq=1558029 Ack=26922767 Win=65535 Len=0
1,8.951127000000042,62.210.85.178,10.0.2.15,TCP,60,9001  >  35978 [ACK] Seq=1558029 Ack=26924227 Win=65535 Len=0
1,8.951131000000032,62.210.85.178,10.0.2.15,TCP,60,9001  >  35978 [ACK] Seq=1558029 Ack=26925377 Win=65535 Len=0
1,8.95113600000002,62.210.85.178,10.0.2.15,TCP,60,9001  >  35978 [ACK] Seq=1558029 Ack=26926837 Win=65535 Len=0
1,8.95114000000001,62.210.85.178,10.0.2.15,TCP,60,9001  >  35978 [ACK] Seq=1558029 Ack=26928297 Win=65535 Len=0
1,8.95118100000002,10.0.2.15,62.210.85.178,TLSv1.2,1204,Application Data
1,8.951262000000042,62.210.85.178,10.0.2.15,TCP,60,9001  >  35978 [ACK] Seq=1558029 Ack=26929447 Win=65535 Len=0
1,8.951317000000017,10.0.2.15,62.210.85.178,TLSv1.2,4124,Application Data
1,8.95138899999995,62.210.85.178,10.0.2.15,TCP,60,9001  >  35978 [ACK] Seq=1558029 Ack=26930907 Win=65535 Len=0
1,8.951397000000043,62.210.85.178,10.0.2.15,TCP,60,9001  >  35978 [ACK] Seq=1558029 Ack=26932367 Win=65535 Len=0
1,8.951401000000033,62.210.85.178,10.0.2.15,TCP,60,9001  >  35978 [ACK] Seq=1558029 Ack=26933517 Win=65535 Len=0
1,8.951448000000028,10.0.2.15,62.210.85.178,TLSv1.2,1810,Application Data
1,8.951517999999965,62.210.85.178,10.0.2.15,TCP,60,9001  >  35978 [ACK] Seq=1558029 Ack=26934977 Win=65535 Len=0
1,8.951524999999947,62.210.85.178,10.0.2.15,TCP,60,9001  >  35978 [ACK] Seq=1558029 Ack=26935273 Win=65535 Len=0
1,9.044269999999983,54.93.77.70,10.0.2.15,TLSv1.2,590,Application Data
1,9.05448100000001,54.93.77.70,10.0.2.15,TCP,2950,"9001  >  34692 [PSH, ACK] Seq=26774527 Ack=1553423 Win=65535 Len=2896 [TCP segment of a reassembled PDU]"
1,9.05479200000002,10.0.2.15,54.93.77.70,TCP,54,34692  >  9001 [ACK] Seq=1553423 Ack=26777423 Win=65535 Len=0
1,9.061644000000001,54.93.77.70,10.0.2.15,TLSv1.2,2950,Application Data [TCP segment of a reassembled PDU]
1,9.061732000000006,10.0.2.15,54.93.77.70,TCP,54,34692  >  9001 [ACK] Seq=1553423 Ack=26780319 Win=65535 Len=0
1,9.062224000000015,54.93.77.70,10.0.2.15,TLSv1.2,4398,Application Data [TCP segment of a reassembled PDU]
1,9.062291999999957,10.0.2.15,54.93.77.70,TCP,54,34692  >  9001 [ACK] Seq=1553423 Ack=26784663 Win=65535 Len=0
1,9.071059999999989,54.93.77.70,10.0.2.15,TLSv1.2,1292,Application Data
1,9.073104999999941,54.93.77.70,10.0.2.15,TCP,2950,"9001  >  34692 [PSH, ACK] Seq=26785901 Ack=1553423 Win=65535 Len=2896 [TCP segment of a reassembled PDU]"
1,9.07315600000004,10.0.2.15,54.93.77.70,TCP,54,34692  >  9001 [ACK] Seq=1553423 Ack=26788797 Win=65535 Len=0
1,9.089351999999963,54.93.77.70,10.0.2.15,TLSv1.2,778,Application Data
1,9.094254999999976,54.93.77.70,10.0.2.15,TCP,2950,"9001  >  34692 [PSH, ACK] Seq=26789521 Ack=1553423 Win=65535 Len=2896 [TCP segment of a reassembled PDU]"
1,9.09430999999995,10.0.2.15,54.93.77.70,TCP,54,34692  >  9001 [ACK] Seq=1553423 Ack=26792417 Win=65535 Len=0
1,9.094422000000009,54.93.77.70,10.0.2.15,TLSv1.2,1502,Application Data [TCP segment of a reassembled PDU]
1,9.094459000000029,10.0.2.15,54.93.77.70,TCP,54,34692  >  9001 [ACK] Seq=1553423 Ack=26793865 Win=65535 Len=0
1,9.107022000000029,54.93.77.70,10.0.2.15,TLSv1.2,2950,Application Data [TCP segment of a reassembled PDU]
1,9.107098999999948,10.0.2.15,54.93.77.70,TCP,54,34692  >  9001 [ACK] Seq=1553423 Ack=26796761 Win=65535 Len=0
1,9.110437000000047,54.93.77.70,10.0.2.15,TLSv1.2,1104,Application Data
1,9.11710000000005,54.93.77.70,10.0.2.15,TLSv1.2,4398,Application Data
1,9.117183999999952,10.0.2.15,54.93.77.70,TCP,54,34692  >  9001 [ACK] Seq=1553423 Ack=26802155 Win=65535 Len=0
1,9.117373000000043,10.0.2.15,54.93.77.70,TLSv1.2,590,Application Data
1,9.117493999999965,54.93.77.70,10.0.2.15,TCP,60,9001  >  34692 [ACK] Seq=26802155 Ack=1553959 Win=65535 Len=0
1,9.133832999999981,54.93.77.70,10.0.2.15,TLSv1.2,894,Application Data
1,9.13863600000002,54.93.77.70,10.0.2.15,TCP,2950,"9001  >  34692 [PSH, ACK] Seq=26802995 Ack=1553959 Win=65535 Len=2896 [TCP segment of a reassembled PDU]"
1,9.138688000000002,10.0.2.15,54.93.77.70,TCP,54,34692  >  9001 [ACK] Seq=1553959 Ack=26805891 Win=65535 Len=0
1,9.154952999999978,54.93.77.70,10.0.2.15,TLSv1.2,778,Application Data
1,9.197978000000035,10.0.2.15,54.93.77.70,TCP,54,34692  >  9001 [ACK] Seq=1553959 Ack=26806615 Win=65535 Len=0
1,9.21452499999998,54.93.77.70,10.0.2.15,TLSv1.2,1104,Application Data
1,9.214594000000034,10.0.2.15,54.93.77.70,TCP,54,34692  >  9001 [ACK] Seq=1553959 Ack=26807665 Win=65535 Len=0
1,9.240770999999995,62.210.85.178,10.0.2.15,TLSv1.2,590,Application Data
1,9.281990999999948,10.0.2.15,62.210.85.178,TCP,54,35978  >  9001 [ACK] Seq=26935273 Ack=1558565 Win=65535 Len=0
1,9.297464999999988,54.93.77.70,10.0.2.15,TLSv1.2,2132,Application Data
1,9.297527999999943,10.0.2.15,54.93.77.70,TCP,54,34692  >  9001 [ACK] Seq=1553959 Ack=26809743 Win=65535 Len=0
1,9.533692999999971,54.93.77.70,10.0.2.15,TLSv1.2,1618,Application Data
1,9.533781999999974,10.0.2.15,54.93.77.70,TCP,54,34692  >  9001 [ACK] Seq=1553959 Ack=26811307 Win=65535 Len=0
1,9.537168999999949,54.93.77.70,10.0.2.15,TCP,2950,"9001  >  34692 [PSH, ACK] Seq=26811307 Ack=1553959 Win=65535 Len=2896 [TCP segment of a reassembled PDU]"
1,9.537261999999942,10.0.2.15,54.93.77.70,TCP,54,34692  >  9001 [ACK] Seq=1553959 Ack=26814203 Win=65535 Len=0
1,9.55311800000004,54.93.77.70,10.0.2.15,TLSv1.2,778,Application Data
1,9.553219000000013,10.0.2.15,54.93.77.70,TCP,54,34692  >  9001 [ACK] Seq=1553959 Ack=26814927 Win=65535 Len=0
1,9.611276999999973,54.93.77.70,10.0.2.15,TLSv1.2,1104,Application Data
1,9.611368999999968,10.0.2.15,54.93.77.70,TCP,54,34692  >  9001 [ACK] Seq=1553959 Ack=26815977 Win=65535 Len=0
1,9.61475900000005,10.0.2.15,54.93.77.70,TLSv1.2,590,Application Data
1,9.61494300000004,54.93.77.70,10.0.2.15,TCP,60,9001  >  34692 [ACK] Seq=26815977 Ack=1554495 Win=65535 Len=0
1,9.742191000000048,62.210.85.178,10.0.2.15,TLSv1.2,590,Application Data
1,9.742269999999962,10.0.2.15,62.210.85.178,TCP,54,35978  >  9001 [ACK] Seq=26935273 Ack=1559101 Win=65535 Len=0
1,9.742760999999973,10.0.2.15,62.210.85.178,TLSv1.2,590,Application Data
1,9.74285999999995,62.210.85.178,10.0.2.15,TCP,60,9001  >  35978 [ACK] Seq=1559101 Ack=26935809 Win=65535 Len=0
1,10.149117000000047,54.93.77.70,10.0.2.15,TLSv1.2,590,Application Data
1,10.149548999999979,10.0.2.15,54.93.77.70,TLSv1.2,590,Application Data
1,10.149651999999946,54.93.77.70,10.0.2.15,TCP,60,9001  >  34692 [ACK] Seq=26816513 Ack=1555031 Win=65535 Len=0
1,10.26874799999996,62.210.85.178,10.0.2.15,TLSv1.2,590,Application Data
1,10.272825000000012,10.0.2.15,62.210.85.178,TLSv1.2,590,Application Data
1,10.27303500000005,62.210.85.178,10.0.2.15,TCP,60,9001  >  35978 [ACK] Seq=1559637 Ack=26936345 Win=65535 Len=0
1,10.28868799999998,10.0.2.15,62.210.85.178,TLSv1.2,4124,Application Data
1,10.28881100000001,10.0.2.15,62.210.85.178,TCP,1514,35978  >  9001 [ACK] Seq=26940415 Ack=1559637 Win=65535 Len=1460 [TCP segment of a reassembled PDU]
1,10.28892099999996,62.210.85.178,10.0.2.15,TCP,60,9001  >  35978 [ACK] Seq=1559637 Ack=26937805 Win=65535 Len=0
1,10.288939000000028,62.210.85.178,10.0.2.15,TCP,60,9001  >  35978 [ACK] Seq=1559637 Ack=26939265 Win=65535 Len=0
1,10.288944000000015,62.210.85.178,10.0.2.15,TCP,60,9001  >  35978 [ACK] Seq=1559637 Ack=26940415 Win=65535 Len=0
1,10.288948000000005,62.210.85.178,10.0.2.15,TCP,60,9001  >  35978 [ACK] Seq=1559637 Ack=26941875 Win=65535 Len=0
1,10.288994000000002,10.0.2.15,62.210.85.178,TLSv1.2,736,Application Data
1,10.289034000000015,62.210.85.178,10.0.2.15,TCP,60,9001  >  35978 [ACK] Seq=1559637 Ack=26942557 Win=65535 Len=0
1,10.38027599999998,54.93.77.70,10.0.2.15,TLSv1.2,590,Application Data
1,10.42213300000003,10.0.2.15,54.93.77.70,TCP,54,34692  >  9001 [ACK] Seq=1555031 Ack=26817049 Win=65535 Len=0
1,10.557051000000001,54.93.77.70,10.0.2.15,TCP,2950,"9001  >  34692 [PSH, ACK] Seq=26817049 Ack=1555031 Win=65535 Len=2896 [TCP segment of a reassembled PDU]"
1,10.557146999999986,10.0.2.15,54.93.77.70,TCP,54,34692  >  9001 [ACK] Seq=1555031 Ack=26819945 Win=65535 Len=0
1,10.560874000000013,54.93.77.70,10.0.2.15,TLSv1.2,778,Application Data
1,10.56092000000001,10.0.2.15,54.93.77.70,TCP,54,34692  >  9001 [ACK] Seq=1555031 Ack=26820669 Win=65535 Len=0
1,10.561305999999945,54.93.77.70,10.0.2.15,TCP,1502,"9001  >  34692 [PSH, ACK] Seq=26820669 Ack=1555031 Win=65535 Len=1448 [TCP segment of a reassembled PDU]"
1,10.561353999999938,10.0.2.15,54.93.77.70,TCP,54,34692  >  9001 [ACK] Seq=1555031 Ack=26822117 Win=65535 Len=0
1,10.583662000000004,54.93.77.70,10.0.2.15,TLSv1.2,1198,Application Data
1,10.583728999999948,10.0.2.15,54.93.77.70,TCP,54,34692  >  9001 [ACK] Seq=1555031 Ack=26823261 Win=65535 Len=0
1,10.584018000000015,10.0.2.15,54.93.77.70,TLSv1.2,590,Application Data
1,10.58410200000003,54.93.77.70,10.0.2.15,TCP,60,9001  >  34692 [ACK] Seq=26823261 Ack=1555567 Win=65535 Len=0
1,10.597984999999994,10.0.2.15,54.93.77.70,TLSv1.2,590,Application Data
1,10.598213999999984,54.93.77.70,10.0.2.15,TCP,60,9001  >  34692 [ACK] Seq=26823261 Ack=1556103 Win=65535 Len=0
1,10.978372000000036,62.210.85.178,10.0.2.15,TLSv1.2,590,Application Data
1,10.996946999999977,62.210.85.178,10.0.2.15,TLSv1.2,590,Application Data
1,10.99704799999995,10.0.2.15,62.210.85.178,TCP,54,35978  >  9001 [ACK] Seq=26942557 Ack=1560709 Win=65535 Len=0
1,10.99727699999994,10.0.2.15,62.210.85.178,TLSv1.2,590,Application Data
1,10.997371000000044,62.210.85.178,10.0.2.15,TCP,60,9001  >  35978 [ACK] Seq=1560709 Ack=26943093 Win=65535 Len=0
1,11.684325999999942,54.93.77.70,10.0.2.15,TLSv1.2,590,Application Data
1,11.68480999999997,10.0.2.15,54.93.77.70,TLSv1.2,590,Application Data
1,11.68495299999995,54.93.77.70,10.0.2.15,TCP,60,9001  >  34692 [ACK] Seq=26823797 Ack=1556639 Win=65535 Len=0
1,12.605199999999968,62.210.85.178,10.0.2.15,TLSv1.2,590,Application Data
1,12.612023000000022,10.0.2.15,62.210.85.178,TLSv1.2,590,Application Data
1,12.612206000000015,62.210.85.178,10.0.2.15,TCP,60,9001  >  35978 [ACK] Seq=1561245 Ack=26943629 Win=65535 Len=0
1,12.626694000000043,10.0.2.15,62.210.85.178,TLSv1.2,4124,Application Data
1,12.626796000000013,10.0.2.15,62.210.85.178,TCP,2974,35978  >  9001 [ACK] Seq=26947699 Ack=1561245 Win=65535 Len=2920 [TCP segment of a reassembled PDU]
1,12.62683800000002,62.210.85.178,10.0.2.15,TCP,60,9001  >  35978 [ACK] Seq=1561245 Ack=26945089 Win=65535 Len=0
1,12.62684999999999,62.210.85.178,10.0.2.15,TCP,60,9001  >  35978 [ACK] Seq=1561245 Ack=26946549 Win=65535 Len=0
1,12.62685399999998,62.210.85.178,10.0.2.15,TCP,60,9001  >  35978 [ACK] Seq=1561245 Ack=26947699 Win=65535 Len=0
1,12.626856999999973,62.210.85.178,10.0.2.15,TCP,60,9001  >  35978 [ACK] Seq=1561245 Ack=26949159 Win=65535 Len=0
1,12.626858999999968,62.210.85.178,10.0.2.15,TCP,60,9001  >  35978 [ACK] Seq=1561245 Ack=26950619 Win=65535 Len=0
1,12.626893999999993,10.0.2.15,62.210.85.178,TLSv1.2,1204,Application Data
1,12.626927000000023,62.210.85.178,10.0.2.15,TCP,60,9001  >  35978 [ACK] Seq=1561245 Ack=26951769 Win=65535 Len=0
1,12.626972000000023,10.0.2.15,62.210.85.178,TLSv1.2,4124,Application Data
1,12.627007000000049,62.210.85.178,10.0.2.15,TCP,60,9001  >  35978 [ACK] Seq=1561245 Ack=26953229 Win=65535 Len=0
1,12.627014000000031,62.210.85.178,10.0.2.15,TCP,60,9001  >  35978 [ACK] Seq=1561245 Ack=26954689 Win=65535 Len=0
1,12.627018000000021,62.210.85.178,10.0.2.15,TCP,60,9001  >  35978 [ACK] Seq=1561245 Ack=26955839 Win=65535 Len=0
1,12.627056000000039,10.0.2.15,62.210.85.178,TLSv1.2,4124,Application Data
1,12.627089999999953,62.210.85.178,10.0.2.15,TCP,60,9001  >  35978 [ACK] Seq=1561245 Ack=26957299 Win=65535 Len=0
1,12.627097000000049,62.210.85.178,10.0.2.15,TCP,60,9001  >  35978 [ACK] Seq=1561245 Ack=26958759 Win=65535 Len=0
1,12.627154000000019,10.0.2.15,62.210.85.178,TLSv1.2,2974,Application Data
1,12.627189000000044,62.210.85.178,10.0.2.15,TCP,60,9001  >  35978 [ACK] Seq=1561245 Ack=26959909 Win=65535 Len=0
1,12.627197000000024,62.210.85.178,10.0.2.15,TCP,60,9001  >  35978 [ACK] Seq=1561245 Ack=26961369 Win=65535 Len=0
1,12.627201000000014,62.210.85.178,10.0.2.15,TCP,60,9001  >  35978 [ACK] Seq=1561245 Ack=26962829 Win=65535 Len=0
1,12.627227999999945,10.0.2.15,62.210.85.178,TLSv1.2,1226,Application Data
1,12.627259999999978,62.210.85.178,10.0.2.15,TCP,60,9001  >  35978 [ACK] Seq=1561245 Ack=26964001 Win=65535 Len=0
1,12.627299999999991,10.0.2.15,62.210.85.178,TLSv1.2,4124,Application Data
1,12.627335000000016,62.210.85.178,10.0.2.15,TCP,60,9001  >  35978 [ACK] Seq=1561245 Ack=26965461 Win=65535 Len=0
1,12.627341000000001,62.210.85.178,10.0.2.15,TCP,60,9001  >  35978 [ACK] Seq=1561245 Ack=26966921 Win=65535 Len=0
1,12.627343999999994,62.210.85.178,10.0.2.15,TCP,60,9001  >  35978 [ACK] Seq=1561245 Ack=26968071 Win=65535 Len=0
1,12.627381000000014,10.0.2.15,62.210.85.178,TLSv1.2,3030,Application Data
1,12.627417000000037,62.210.85.178,10.0.2.15,TCP,60,9001  >  35978 [ACK] Seq=1561245 Ack=26969531 Win=65535 Len=0
1,12.627423000000022,62.210.85.178,10.0.2.15,TCP,60,9001  >  35978 [ACK] Seq=1561245 Ack=26970991 Win=65535 Len=0
1,12.627426000000014,62.210.85.178,10.0.2.15,TCP,60,9001  >  35978 [ACK] Seq=1561245 Ack=26971047 Win=65535 Len=0
1,12.636647000000039,10.0.2.15,62.210.85.178,TLSv1.2,4124,Application Data
1,12.636762999999974,62.210.85.178,10.0.2.15,TCP,60,9001  >  35978 [ACK] Seq=1561245 Ack=26972507 Win=65535 Len=0
1,12.636776999999938,62.210.85.178,10.0.2.15,TCP,60,9001  >  35978 [ACK] Seq=1561245 Ack=26973967 Win=65535 Len=0
1,12.636781000000042,62.210.85.178,10.0.2.15,TCP,60,9001  >  35978 [ACK] Seq=1561245 Ack=26975117 Win=65535 Len=0
1,12.636829000000034,10.0.2.15,62.210.85.178,TCP,2974,35978  >  9001 [ACK] Seq=26975117 Ack=1561245 Win=65535 Len=2920 [TCP segment of a reassembled PDU]
1,12.636905999999954,62.210.85.178,10.0.2.15,TCP,60,9001  >  35978 [ACK] Seq=1561245 Ack=26976577 Win=65535 Len=0
1,12.636914000000047,62.210.85.178,10.0.2.15,TCP,60,9001  >  35978 [ACK] Seq=1561245 Ack=26978037 Win=65535 Len=0
1,12.636951999999951,10.0.2.15,62.210.85.178,TLSv1.2,1204,Application Data
1,12.636988999999971,62.210.85.178,10.0.2.15,TCP,60,9001  >  35978 [ACK] Seq=1561245 Ack=26979187 Win=65535 Len=0
1,12.637038999999959,10.0.2.15,62.210.85.178,TLSv1.2,2260,Application Data
1,12.63715400000001,62.210.85.178,10.0.2.15,TCP,60,9001  >  35978 [ACK] Seq=1561245 Ack=26980647 Win=65535 Len=0
1,12.637170999999967,62.210.85.178,10.0.2.15,TCP,60,9001  >  35978 [ACK] Seq=1561245 Ack=26981393 Win=65535 Len=0
1,12.743306999999959,54.93.77.70,10.0.2.15,TLSv1.2,3674,Application Data
1,12.743439999999964,10.0.2.15,54.93.77.70,TCP,54,34692  >  9001 [ACK] Seq=1556639 Ack=26827417 Win=65535 Len=0
1,12.764223000000015,54.93.77.70,10.0.2.15,TLSv1.2,3674,Application Data
1,12.76429399999995,10.0.2.15,54.93.77.70,TCP,54,34692  >  9001 [ACK] Seq=1556639 Ack=26831037 Win=65535 Len=0
1,12.77545299999997,54.93.77.70,10.0.2.15,TCP,2950,"9001  >  34692 [PSH, ACK] Seq=26831037 Ack=1556639 Win=65535 Len=2896 [TCP segment of a reassembled PDU]"
1,12.775504999999953,10.0.2.15,54.93.77.70,TCP,54,34692  >  9001 [ACK] Seq=1556639 Ack=26833933 Win=65535 Len=0
1,12.780108000000041,54.93.77.70,10.0.2.15,TLSv1.2,1314,"Application Data, Application Data"
1,12.785750000000007,54.93.77.70,10.0.2.15,TLSv1.2,4398,Application Data
1,12.78582300000005,10.0.2.15,54.93.77.70,TCP,54,34692  >  9001 [ACK] Seq=1556639 Ack=26839537 Win=65535 Len=0
1,12.794703000000027,54.93.77.70,10.0.2.15,TLSv1.2,2950,Application Data [TCP segment of a reassembled PDU]
1,12.79475100000002,10.0.2.15,54.93.77.70,TCP,54,34692  >  9001 [ACK] Seq=1556639 Ack=26842433 Win=65535 Len=0
1,12.802869999999984,54.93.77.70,10.0.2.15,TLSv1.2,1104,Application Data
1,12.804170999999997,54.93.77.70,10.0.2.15,TCP,2950,"9001  >  34692 [PSH, ACK] Seq=26843483 Ack=1556639 Win=65535 Len=2896 [TCP segment of a reassembled PDU]"
1,12.80421899999999,10.0.2.15,54.93.77.70,TCP,54,34692  >  9001 [ACK] Seq=1556639 Ack=26846379 Win=65535 Len=0
1,12.805193000000031,54.93.77.70,10.0.2.15,TLSv1.2,5846,"Application Data, Application Data"
1,12.805254999999988,10.0.2.15,54.93.77.70,TCP,54,34692  >  9001 [ACK] Seq=1556639 Ack=26852171 Win=65535 Len=0
1,12.805528999999979,10.0.2.15,54.93.77.70,TLSv1.2,590,Application Data
1,12.80564800000002,54.93.77.70,10.0.2.15,TCP,60,9001  >  34692 [ACK] Seq=26852171 Ack=1557175 Win=65535 Len=0
1,12.815593000000035,54.93.77.70,10.0.2.15,TLSv1.2,2950,Application Data [TCP segment of a reassembled PDU]
1,12.81564400000002,10.0.2.15,54.93.77.70,TCP,54,34692  >  9001 [ACK] Seq=1557175 Ack=26855067 Win=65535 Len=0
1,12.81603599999994,54.93.77.70,10.0.2.15,TCP,1502,"9001  >  34692 [PSH, ACK] Seq=26855067 Ack=1557175 Win=65535 Len=1448 [TCP segment of a reassembled PDU]"
1,12.816079999999943,10.0.2.15,54.93.77.70,TCP,54,34692  >  9001 [ACK] Seq=1557175 Ack=26856515 Win=65535 Len=0
1,12.820066999999995,54.93.77.70,10.0.2.15,TLSv1.2,474,Application Data
1,12.861987999999997,10.0.2.15,54.93.77.70,TCP,54,34692  >  9001 [ACK] Seq=1557175 Ack=26856935 Win=65535 Len=0
1,12.864636000000019,54.93.77.70,10.0.2.15,TLSv1.2,590,Application Data
1,12.864685000000009,10.0.2.15,54.93.77.70,TCP,54,34692  >  9001 [ACK] Seq=1557175 Ack=26857471 Win=65535 Len=0
1,13.526738000000023,62.210.85.178,10.0.2.15,TLSv1.2,590,Application Data
1,13.52941999999996,54.93.77.70,10.0.2.15,TLSv1.2,3674,Application Data
1,13.529484000000025,10.0.2.15,54.93.77.70,TCP,54,34692  >  9001 [ACK] Seq=1557175 Ack=26861091 Win=65535 Len=0
1,13.57021599999996,10.0.2.15,62.210.85.178,TCP,54,35978  >  9001 [ACK] Seq=26981393 Ack=1561781 Win=65535 Len=0
1,14.141905999999949,54.93.77.70,10.0.2.15,TLSv1.2,1104,Application Data
1,14.141986999999972,10.0.2.15,54.93.77.70,TCP,54,34692  >  9001 [ACK] Seq=1557175 Ack=26862141 Win=65535 Len=0
1,14.144493000000011,10.0.2.15,54.93.77.70,TLSv1.2,590,Application Data
1,14.14467000000002,54.93.77.70,10.0.2.15,TCP,60,9001  >  34692 [ACK] Seq=26862141 Ack=1557711 Win=65535 Len=0
1,14.346130000000016,62.210.85.178,10.0.2.15,TLSv1.2,590,Application Data
1,14.346236999999974,10.0.2.15,62.210.85.178,TCP,54,35978  >  9001 [ACK] Seq=26981393 Ack=1562317 Win=65535 Len=0
1,14.346820999999977,10.0.2.15,62.210.85.178,TLSv1.2,590,Application Data
1,14.34696299999996,62.210.85.178,10.0.2.15,TCP,60,9001  >  35978 [ACK] Seq=1562317 Ack=26981929 Win=65535 Len=0
1,14.760527000000025,54.93.77.70,10.0.2.15,TLSv1.2,590,Application Data
1,14.76098300000001,10.0.2.15,54.93.77.70,TLSv1.2,590,Application Data
1,14.761116000000015,54.93.77.70,10.0.2.15,TCP,60,9001  >  34692 [ACK] Seq=26862677 Ack=1558247 Win=65535 Len=0
1,15.370241999999962,62.210.85.178,10.0.2.15,TLSv1.2,590,Application Data
1,15.379493000000025,10.0.2.15,62.210.85.178,TLSv1.2,590,Application Data
1,15.379683,62.210.85.178,10.0.2.15,TCP,60,9001  >  35978 [ACK] Seq=1562853 Ack=26982465 Win=65535 Len=0
1,15.394509999999968,10.0.2.15,62.210.85.178,TLSv1.2,4124,Application Data
1,15.394634999999994,10.0.2.15,62.210.85.178,TCP,2974,35978  >  9001 [ACK] Seq=26986535 Ack=1562853 Win=65535 Len=2920 [TCP segment of a reassembled PDU]
1,15.394677999999999,62.210.85.178,10.0.2.15,TCP,60,9001  >  35978 [ACK] Seq=1562853 Ack=26983925 Win=65535 Len=0
1,15.394689999999969,62.210.85.178,10.0.2.15,TCP,60,9001  >  35978 [ACK] Seq=1562853 Ack=26985385 Win=65535 Len=0
1,15.394694999999956,62.210.85.178,10.0.2.15,TCP,60,9001  >  35978 [ACK] Seq=1562853 Ack=26986535 Win=65535 Len=0
1,15.394698999999946,62.210.85.178,10.0.2.15,TCP,60,9001  >  35978 [ACK] Seq=1562853 Ack=26987995 Win=65535 Len=0
1,15.394704000000047,62.210.85.178,10.0.2.15,TCP,60,9001  >  35978 [ACK] Seq=1562853 Ack=26989455 Win=65535 Len=0
1,15.39474800000005,10.0.2.15,62.210.85.178,TLSv1.2,1204,Application Data
1,15.394816999999989,10.0.2.15,62.210.85.178,TCP,2974,35978  >  9001 [ACK] Seq=26990605 Ack=1562853 Win=65535 Len=2920 [TCP segment of a reassembled PDU]
1,15.394856000000004,62.210.85.178,10.0.2.15,TCP,60,9001  >  35978 [ACK] Seq=1562853 Ack=26990605 Win=65535 Len=0
1,15.394862999999987,62.210.85.178,10.0.2.15,TCP,60,9001  >  35978 [ACK] Seq=1562853 Ack=26992065 Win=65535 Len=0
1,15.394867999999974,62.210.85.178,10.0.2.15,TCP,60,9001  >  35978 [ACK] Seq=1562853 Ack=26993525 Win=65535 Len=0
1,15.394903,10.0.2.15,62.210.85.178,TLSv1.2,1204,Application Data
1,15.394967999999949,10.0.2.15,62.210.85.178,TCP,2974,35978  >  9001 [ACK] Seq=26994675 Ack=1562853 Win=65535 Len=2920 [TCP segment of a reassembled PDU]
1,15.39500499999997,62.210.85.178,10.0.2.15,TCP,60,9001  >  35978 [ACK] Seq=1562853 Ack=26994675 Win=65535 Len=0
1,15.395010999999954,62.210.85.178,10.0.2.15,TCP,60,9001  >  35978 [ACK] Seq=1562853 Ack=26996135 Win=65535 Len=0
1,15.395015999999941,62.210.85.178,10.0.2.15,TCP,60,9001  >  35978 [ACK] Seq=1562853 Ack=26997595 Win=65535 Len=0
1,15.395046999999977,10.0.2.15,62.210.85.178,TLSv1.2,1204,Application Data
1,15.395128,10.0.2.15,62.210.85.178,TLSv1.2,2974,Application Data
1,15.395167000000015,62.210.85.178,10.0.2.15,TCP,60,9001  >  35978 [ACK] Seq=1562853 Ack=26998745 Win=65535 Len=0
1,15.395173999999997,62.210.85.178,10.0.2.15,TCP,60,9001  >  35978 [ACK] Seq=1562853 Ack=27000205 Win=65535 Len=0
1,15.395178999999985,62.210.85.178,10.0.2.15,TCP,60,9001  >  35978 [ACK] Seq=1562853 Ack=27001665 Win=65535 Len=0
1,15.39521000000002,10.0.2.15,62.210.85.178,TLSv1.2,1226,Application Data
1,15.39530400000001,10.0.2.15,62.210.85.178,TCP,2974,35978  >  9001 [ACK] Seq=27002837 Ack=1562853 Win=65535 Len=2920 [TCP segment of a reassembled PDU]
1,15.395325999999955,62.210.85.178,10.0.2.15,TCP,60,9001  >  35978 [ACK] Seq=1562853 Ack=27002837 Win=65535 Len=0
1,15.39533300000005,62.210.85.178,10.0.2.15,TCP,60,9001  >  35978 [ACK] Seq=1562853 Ack=27004297 Win=65535 Len=0
1,15.39533700000004,62.210.85.178,10.0.2.15,TCP,60,9001  >  35978 [ACK] Seq=1562853 Ack=27005757 Win=65535 Len=0
1,15.39536899999996,10.0.2.15,62.210.85.178,TLSv1.2,1204,Application Data
1,15.39540599999998,62.210.85.178,10.0.2.15,TCP,60,9001  >  35978 [ACK] Seq=1562853 Ack=27006907 Win=65535 Len=0
1,15.395449999999983,10.0.2.15,62.210.85.178,TLSv1.2,3030,Application Data
1,15.39549199999999,62.210.85.178,10.0.2.15,TCP,60,9001  >  35978 [ACK] Seq=1562853 Ack=27008367 Win=65535 Len=0
1,15.395498999999973,62.210.85.178,10.0.2.15,TCP,60,9001  >  35978 [ACK] Seq=1562853 Ack=27009827 Win=65535 Len=0
1,15.395502999999962,62.210.85.178,10.0.2.15,TCP,60,9001  >  35978 [ACK] Seq=1562853 Ack=27009883 Win=65535 Len=0
1,15.404728999999975,10.0.2.15,62.210.85.178,TLSv1.2,4124,Application Data
1,15.404827999999952,10.0.2.15,62.210.85.178,TCP,2974,35978  >  9001 [ACK] Seq=27013953 Ack=1562853 Win=65535 Len=2920 [TCP segment of a reassembled PDU]
1,15.404866999999967,62.210.85.178,10.0.2.15,TCP,60,9001  >  35978 [ACK] Seq=1562853 Ack=27011343 Win=65535 Len=0
1,15.404875999999945,62.210.85.178,10.0.2.15,TCP,60,9001  >  35978 [ACK] Seq=1562853 Ack=27012803 Win=65535 Len=0
1,15.404880000000048,62.210.85.178,10.0.2.15,TCP,60,9001  >  35978 [ACK] Seq=1562853 Ack=27013953 Win=65535 Len=0
1,15.404884000000038,62.210.85.178,10.0.2.15,TCP,60,9001  >  35978 [ACK] Seq=1562853 Ack=27015413 Win=65535 Len=0
1,15.404889000000026,62.210.85.178,10.0.2.15,TCP,60,9001  >  35978 [ACK] Seq=1562853 Ack=27016873 Win=65535 Len=0
1,15.405028000000016,10.0.2.15,62.210.85.178,TLSv1.2,1204,Application Data
1,15.405132999999978,62.210.85.178,10.0.2.15,TCP,60,9001  >  35978 [ACK] Seq=1562853 Ack=27018023 Win=65535 Len=0
1,15.405171999999993,10.0.2.15,62.210.85.178,TCP,2974,35978  >  9001 [ACK] Seq=27018023 Ack=1562853 Win=65535 Len=2920 [TCP segment of a reassembled PDU]
1,15.40522999999996,10.0.2.15,62.210.85.178,TLSv1.2,1204,Application Data
1,15.405269999999973,62.210.85.178,10.0.2.15,TCP,60,9001  >  35978 [ACK] Seq=1562853 Ack=27019483 Win=65535 Len=0
1,15.405276999999955,62.210.85.178,10.0.2.15,TCP,60,9001  >  35978 [ACK] Seq=1562853 Ack=27020943 Win=65535 Len=0
1,15.405280999999945,62.210.85.178,10.0.2.15,TCP,60,9001  >  35978 [ACK] Seq=1562853 Ack=27022093 Win=65535 Len=0
1,15.405325999999945,10.0.2.15,62.210.85.178,TLSv1.2,4124,Application Data
1,15.405423000000042,62.210.85.178,10.0.2.15,TCP,60,9001  >  35978 [ACK] Seq=1562853 Ack=27023553 Win=65535 Len=0
1,15.405431000000021,62.210.85.178,10.0.2.15,TCP,60,9001  >  35978 [ACK] Seq=1562853 Ack=27025013 Win=65535 Len=0
1,15.405436000000009,62.210.85.178,10.0.2.15,TCP,60,9001  >  35978 [ACK] Seq=1562853 Ack=27026163 Win=65535 Len=0
1,15.405467000000044,10.0.2.15,62.210.85.178,TLSv1.2,2974,Application Data
1,15.405524000000014,10.0.2.15,62.210.85.178,TLSv1.2,1226,Application Data
1,15.405562000000032,62.210.85.178,10.0.2.15,TCP,60,9001  >  35978 [ACK] Seq=1562853 Ack=27027623 Win=65535 Len=0
1,15.405568000000017,62.210.85.178,10.0.2.15,TCP,60,9001  >  35978 [ACK] Seq=1562853 Ack=27029083 Win=65535 Len=0
1,15.405573000000004,62.210.85.178,10.0.2.15,TCP,60,9001  >  35978 [ACK] Seq=1562853 Ack=27030255 Win=65535 Len=0
1,15.405626999999981,10.0.2.15,62.210.85.178,TLSv1.2,4124,Application Data
1,15.405667999999991,62.210.85.178,10.0.2.15,TCP,60,9001  >  35978 [ACK] Seq=1562853 Ack=27031715 Win=65535 Len=0
1,15.405674999999974,62.210.85.178,10.0.2.15,TCP,60,9001  >  35978 [ACK] Seq=1562853 Ack=27033175 Win=65535 Len=0
1,15.405678999999964,62.210.85.178,10.0.2.15,TCP,60,9001  >  35978 [ACK] Seq=1562853 Ack=27034325 Win=65535 Len=0
1,15.405724999999961,10.0.2.15,62.210.85.178,TLSv1.2,3030,Application Data
1,15.405764999999974,62.210.85.178,10.0.2.15,TCP,60,9001  >  35978 [ACK] Seq=1562853 Ack=27035785 Win=65535 Len=0
1,15.405770999999959,62.210.85.178,10.0.2.15,TCP,60,9001  >  35978 [ACK] Seq=1562853 Ack=27037245 Win=65535 Len=0
1,15.405775999999946,62.210.85.178,10.0.2.15,TCP,60,9001  >  35978 [ACK] Seq=1562853 Ack=27037301 Win=65535 Len=0
1,15.41845699999999,10.0.2.15,62.210.85.178,TLSv1.2,2132,Application Data
1,15.418561999999952,62.210.85.178,10.0.2.15,TCP,60,9001  >  35978 [ACK] Seq=1562853 Ack=27038761 Win=65535 Len=0
1,15.418575000000033,62.210.85.178,10.0.2.15,TCP,60,9001  >  35978 [ACK] Seq=1562853 Ack=27039379 Win=65535 Len=0
1,15.53111899999999,54.93.77.70,10.0.2.15,TLSv1.2,3674,Application Data
1,15.531263999999965,10.0.2.15,54.93.77.70,TCP,54,34692  >  9001 [ACK] Seq=1558247 Ack=26866297 Win=65535 Len=0
1,15.541836999999987,54.93.77.70,10.0.2.15,TCP,2950,"9001  >  34692 [PSH, ACK] Seq=26866297 Ack=1558247 Win=65535 Len=2896 [TCP segment of a reassembled PDU]"
1,15.541919000000007,10.0.2.15,54.93.77.70,TCP,54,34692  >  9001 [ACK] Seq=1558247 Ack=26869193 Win=65535 Len=0
1,15.547382999999968,54.93.77.70,10.0.2.15,TLSv1.2,1314,"Application Data, Application Data"
1,15.552008,54.93.77.70,10.0.2.15,TCP,2950,"9001  >  34692 [PSH, ACK] Seq=26870453 Ack=1558247 Win=65535 Len=2896 [TCP segment of a reassembled PDU]"
1,15.552091000000019,10.0.2.15,54.93.77.70,TCP,54,34692  >  9001 [ACK] Seq=1558247 Ack=26873349 Win=65535 Len=0
1,15.552923999999962,54.93.77.70,10.0.2.15,TLSv1.2,7294,"Application Data, Application Data"
1,15.553007999999977,10.0.2.15,54.93.77.70,TCP,54,34692  >  9001 [ACK] Seq=1558247 Ack=26880589 Win=65535 Len=0
1,15.553228999999988,10.0.2.15,54.93.77.70,TLSv1.2,590,Application Data
1,15.553307000000018,54.93.77.70,10.0.2.15,TCP,60,9001  >  34692 [ACK] Seq=26880589 Ack=1558783 Win=65535 Len=0
1,15.559691000000043,54.93.77.70,10.0.2.15,TCP,1502,"9001  >  34692 [PSH, ACK] Seq=26880589 Ack=1558783 Win=65535 Len=1448 [TCP segment of a reassembled PDU]"
1,15.559740000000033,10.0.2.15,54.93.77.70,TCP,54,34692  >  9001 [ACK] Seq=1558783 Ack=26882037 Win=65535 Len=0
1,15.563476000000037,54.93.77.70,10.0.2.15,TLSv1.2,5846,"Application Data, Application Data"
1,15.563566000000037,54.93.77.70,10.0.2.15,TCP,1502,"9001  >  34692 [PSH, ACK] Seq=26887829 Ack=1558783 Win=65535 Len=1448 [TCP segment of a reassembled PDU]"
1,15.563602999999944,10.0.2.15,54.93.77.70,TCP,54,34692  >  9001 [ACK] Seq=1558783 Ack=26887829 Win=65535 Len=0
1,15.563720999999987,10.0.2.15,54.93.77.70,TCP,54,34692  >  9001 [ACK] Seq=1558783 Ack=26889277 Win=65535 Len=0
1,15.567950999999994,54.93.77.70,10.0.2.15,TLSv1.2,872,Application Data
1,15.568175999999994,10.0.2.15,54.93.77.70,TLSv1.2,590,Application Data
1,15.568315999999982,54.93.77.70,10.0.2.15,TCP,60,9001  >  34692 [ACK] Seq=26890095 Ack=1559319 Win=65535 Len=0
1,15.574045999999953,54.93.77.70,10.0.2.15,TLSv1.2,4398,Application Data
1,15.574130999999966,10.0.2.15,54.93.77.70,TCP,54,34692  >  9001 [ACK] Seq=1559319 Ack=26894439 Win=65535 Len=0
1,15.574761999999964,54.93.77.70,10.0.2.15,TLSv1.2,7294,Application Data [TCP segment of a reassembled PDU]
1,15.574827000000028,10.0.2.15,54.93.77.70,TCP,54,34692  >  9001 [ACK] Seq=1559319 Ack=26901679 Win=65535 Len=0
1,15.584545000000048,54.93.77.70,10.0.2.15,TLSv1.2,894,"Application Data, Application Data"
1,15.58597199999997,54.93.77.70,10.0.2.15,TLSv1.2,4398,Application Data
1,15.586017999999967,10.0.2.15,54.93.77.70,TCP,54,34692  >  9001 [ACK] Seq=1559319 Ack=26906863 Win=65535 Len=0
1,15.597357999999986,54.93.77.70,10.0.2.15,TLSv1.2,7294,"Application Data, Application Data"
1,15.597431000000029,10.0.2.15,54.93.77.70,TCP,54,34692  >  9001 [ACK] Seq=1559319 Ack=26914103 Win=65535 Len=0
1,15.602014999999938,54.93.77.70,10.0.2.15,TLSv1.2,894,Application Data
1,15.60217799999998,10.0.2.15,54.93.77.70,TLSv1.2,590,Application Data
1,15.602261999999996,54.93.77.70,10.0.2.15,TCP,60,9001  >  34692 [ACK] Seq=26914943 Ack=1559855 Win=65535 Len=0
1,15.618716999999947,54.93.77.70,10.0.2.15,TLSv1.2,590,Application Data
1,15.62942499999997,54.93.77.70,10.0.2.15,TCP,2950,"9001  >  34692 [PSH, ACK] Seq=26915479 Ack=1559855 Win=65535 Len=2896 [TCP segment of a reassembled PDU]"
1,15.629515999999967,10.0.2.15,54.93.77.70,TCP,54,34692  >  9001 [ACK] Seq=1559855 Ack=26918375 Win=65535 Len=0
1,15.64032199999997,54.93.77.70,10.0.2.15,TLSv1.2,1502,Application Data [TCP segment of a reassembled PDU]
1,15.640418999999952,10.0.2.15,54.93.77.70,TCP,54,34692  >  9001 [ACK] Seq=1559855 Ack=26919823 Win=65535 Len=0
1,15.646196000000032,54.93.77.70,10.0.2.15,TLSv1.2,380,Application Data
1,15.648931999999945,10.0.2.15,54.93.77.70,TLSv1.2,590,Application Data
1,15.649112999999943,54.93.77.70,10.0.2.15,TCP,60,9001  >  34692 [ACK] Seq=26920149 Ack=1560391 Win=65535 Len=0
1,15.722749000000022,62.210.85.178,10.0.2.15,TLSv1.2,1618,Application Data
1,15.722910999999954,10.0.2.15,62.210.85.178,TCP,54,35978  >  9001 [ACK] Seq=27039379 Ack=1564417 Win=65535 Len=0
1,15.983857999999941,62.210.85.178,10.0.2.15,TLSv1.2,590,Application Data
1,15.984360000000038,10.0.2.15,62.210.85.178,TLSv1.2,590,Application Data
1,15.984485999999947,62.210.85.178,10.0.2.15,TCP,60,9001  >  35978 [ACK] Seq=1564953 Ack=27039915 Win=65535 Len=0
1,16.094821000000024,54.93.77.70,10.0.2.15,TLSv1.2,590,Application Data
1,16.095281999999997,10.0.2.15,54.93.77.70,TLSv1.2,590,Application Data
1,16.095428999999967,54.93.77.70,10.0.2.15,TCP,60,9001  >  34692 [ACK] Seq=26920685 Ack=1560927 Win=65535 Len=0
1,16.29156499999999,62.210.85.178,10.0.2.15,TLSv1.2,590,Application Data
1,16.298669000000018,10.0.2.15,62.210.85.178,TLSv1.2,590,Application Data
1,16.300021000000015,62.210.85.178,10.0.2.15,TCP,60,9001  >  35978 [ACK] Seq=1565489 Ack=27040451 Win=65535 Len=0
1,16.31021899999996,10.0.2.15,62.210.85.178,TLSv1.2,4124,Application Data
1,16.310326000000032,10.0.2.15,62.210.85.178,TCP,2974,35978  >  9001 [ACK] Seq=27044521 Ack=1565489 Win=65535 Len=2920 [TCP segment of a reassembled PDU]
1,16.310378000000014,62.210.85.178,10.0.2.15,TCP,60,9001  >  35978 [ACK] Seq=1565489 Ack=27041911 Win=65535 Len=0
1,16.31038799999999,62.210.85.178,10.0.2.15,TCP,60,9001  >  35978 [ACK] Seq=1565489 Ack=27043371 Win=65535 Len=0
1,16.310392999999976,62.210.85.178,10.0.2.15,TCP,60,9001  >  35978 [ACK] Seq=1565489 Ack=27044521 Win=65535 Len=0
1,16.310397999999964,62.210.85.178,10.0.2.15,TCP,60,9001  >  35978 [ACK] Seq=1565489 Ack=27045981 Win=65535 Len=0
1,16.310401999999954,62.210.85.178,10.0.2.15,TCP,60,9001  >  35978 [ACK] Seq=1565489 Ack=27047441 Win=65535 Len=0
1,16.31044399999996,10.0.2.15,62.210.85.178,TLSv1.2,1204,Application Data
1,16.310513000000014,10.0.2.15,62.210.85.178,TCP,2974,35978  >  9001 [ACK] Seq=27048591 Ack=1565489 Win=65535 Len=2920 [TCP segment of a reassembled PDU]
1,16.31055200000003,62.210.85.178,10.0.2.15,TCP,60,9001  >  35978 [ACK] Seq=1565489 Ack=27048591 Win=65535 Len=0
1,16.31056000000001,62.210.85.178,10.0.2.15,TCP,60,9001  >  35978 [ACK] Seq=1565489 Ack=27050051 Win=65535 Len=0
1,16.310564999999997,62.210.85.178,10.0.2.15,TCP,60,9001  >  35978 [ACK] Seq=1565489 Ack=27051511 Win=65535 Len=0
1,16.31060100000002,10.0.2.15,62.210.85.178,TLSv1.2,1204,Application Data
1,16.31066599999997,10.0.2.15,62.210.85.178,TCP,2974,35978  >  9001 [ACK] Seq=27052661 Ack=1565489 Win=65535 Len=2920 [TCP segment of a reassembled PDU]
1,16.310701999999992,62.210.85.178,10.0.2.15,TCP,60,9001  >  35978 [ACK] Seq=1565489 Ack=27052661 Win=65535 Len=0
1,16.310708999999974,62.210.85.178,10.0.2.15,TCP,60,9001  >  35978 [ACK] Seq=1565489 Ack=27054121 Win=65535 Len=0
1,16.310712999999964,62.210.85.178,10.0.2.15,TCP,60,9001  >  35978 [ACK] Seq=1565489 Ack=27055581 Win=65535 Len=0
1,16.310744999999997,10.0.2.15,62.210.85.178,TLSv1.2,1204,Application Data
1,16.31082600000002,10.0.2.15,62.210.85.178,TLSv1.2,2974,Application Data
1,16.31086300000004,62.210.85.178,10.0.2.15,TCP,60,9001  >  35978 [ACK] Seq=1565489 Ack=27056731 Win=65535 Len=0
1,16.310870000000023,62.210.85.178,10.0.2.15,TCP,60,9001  >  35978 [ACK] Seq=1565489 Ack=27058191 Win=65535 Len=0
1,16.31087500000001,62.210.85.178,10.0.2.15,TCP,60,9001  >  35978 [ACK] Seq=1565489 Ack=27059651 Win=65535 Len=0
1,16.310907000000043,10.0.2.15,62.210.85.178,TLSv1.2,1226,Application Data
1,16.31094399999995,62.210.85.178,10.0.2.15,TCP,60,9001  >  35978 [ACK] Seq=1565489 Ack=27060823 Win=65535 Len=0
1,16.31098899999995,10.0.2.15,62.210.85.178,TLSv1.2,4124,Application Data
1,16.311028999999962,62.210.85.178,10.0.2.15,TCP,60,9001  >  35978 [ACK] Seq=1565489 Ack=27062283 Win=65535 Len=0
1,16.311035999999945,62.210.85.178,10.0.2.15,TCP,60,9001  >  35978 [ACK] Seq=1565489 Ack=27063743 Win=65535 Len=0
1,16.311040000000048,62.210.85.178,10.0.2.15,TCP,60,9001  >  35978 [ACK] Seq=1565489 Ack=27064893 Win=65535 Len=0
1,16.311087000000043,10.0.2.15,62.210.85.178,TLSv1.2,3030,Application Data
1,16.31112799999994,62.210.85.178,10.0.2.15,TCP,60,9001  >  35978 [ACK] Seq=1565489 Ack=27066353 Win=65535 Len=0
1,16.311134000000038,62.210.85.178,10.0.2.15,TCP,60,9001  >  35978 [ACK] Seq=1565489 Ack=27067813 Win=65535 Len=0
1,16.311139000000026,62.210.85.178,10.0.2.15,TCP,60,9001  >  35978 [ACK] Seq=1565489 Ack=27067869 Win=65535 Len=0
1,16.320325000000025,10.0.2.15,62.210.85.178,TLSv1.2,4124,Application Data
1,16.320402999999942,10.0.2.15,62.210.85.178,TCP,2974,35978  >  9001 [ACK] Seq=27071939 Ack=1565489 Win=65535 Len=2920 [TCP segment of a reassembled PDU]
1,16.320446999999945,62.210.85.178,10.0.2.15,TCP,60,9001  >  35978 [ACK] Seq=1565489 Ack=27069329 Win=65535 Len=0
1,16.320455000000038,62.210.85.178,10.0.2.15,TCP,60,9001  >  35978 [ACK] Seq=1565489 Ack=27070789 Win=65535 Len=0
1,16.320460000000026,62.210.85.178,10.0.2.15,TCP,60,9001  >  35978 [ACK] Seq=1565489 Ack=27071939 Win=65535 Len=0
1,16.320464000000015,62.210.85.178,10.0.2.15,TCP,60,9001  >  35978 [ACK] Seq=1565489 Ack=27073399 Win=65535 Len=0
1,16.320468000000005,62.210.85.178,10.0.2.15,TCP,60,9001  >  35978 [ACK] Seq=1565489 Ack=27074859 Win=65535 Len=0
1,16.320508000000018,10.0.2.15,62.210.85.178,TLSv1.2,1204,Application Data
1,16.320574999999963,10.0.2.15,62.210.85.178,TCP,2974,35978  >  9001 [ACK] Seq=27076009 Ack=1565489 Win=65535 Len=2920 [TCP segment of a reassembled PDU]
1,16.320610999999985,62.210.85.178,10.0.2.15,TCP,60,9001  >  35978 [ACK] Seq=1565489 Ack=27076009 Win=65535 Len=0
1,16.320617999999968,62.210.85.178,10.0.2.15,TCP,60,9001  >  35978 [ACK] Seq=1565489 Ack=27077469 Win=65535 Len=0
1,16.320622999999955,62.210.85.178,10.0.2.15,TCP,60,9001  >  35978 [ACK] Seq=1565489 Ack=27078929 Win=65535 Len=0
1,16.320656999999983,10.0.2.15,62.210.85.178,TLSv1.2,1204,Application Data
1,16.32072800000003,62.210.85.178,10.0.2.15,TCP,60,9001  >  35978 [ACK] Seq=1565489 Ack=27080079 Win=65535 Len=0
1,16.320760999999948,10.0.2.15,62.210.85.178,TCP,2974,35978  >  9001 [ACK] Seq=27080079 Ack=1565489 Win=65535 Len=2920 [TCP segment of a reassembled PDU]
1,16.32081100000005,10.0.2.15,62.210.85.178,TLSv1.2,432,Application Data
1,16.320843999999965,62.210.85.178,10.0.2.15,TCP,60,9001  >  35978 [ACK] Seq=1565489 Ack=27081539 Win=65535 Len=0
1,16.320850999999948,62.210.85.178,10.0.2.15,TCP,60,9001  >  35978 [ACK] Seq=1565489 Ack=27082999 Win=65535 Len=0
1,16.320854999999938,62.210.85.178,10.0.2.15,TCP,60,9001  >  35978 [ACK] Seq=1565489 Ack=27083377 Win=65535 Len=0
1,16.454799999999977,54.93.77.70,10.0.2.15,TLSv1.2,3674,Application Data
1,16.454938999999968,10.0.2.15,54.93.77.70,TCP,54,34692  >  9001 [ACK] Seq=1560927 Ack=26924305 Win=65535 Len=0
1,16.46624399999996,54.93.77.70,10.0.2.15,TCP,2950,"9001  >  34692 [PSH, ACK] Seq=26924305 Ack=1560927 Win=65535 Len=2896 [TCP segment of a reassembled PDU]"
1,16.46630700000003,10.0.2.15,54.93.77.70,TCP,54,34692  >  9001 [ACK] Seq=1560927 Ack=26927201 Win=65535 Len=0
1,16.466886000000045,54.93.77.70,10.0.2.15,TLSv1.2,2950,Application Data [TCP segment of a reassembled PDU]
1,16.466903000000002,54.93.77.70,10.0.2.15,TLSv1.2,4398,Application Data [TCP segment of a reassembled PDU]
1,16.466948000000002,10.0.2.15,54.93.77.70,TCP,54,34692  >  9001 [ACK] Seq=1560927 Ack=26930097 Win=65535 Len=0
1,16.467025000000035,10.0.2.15,54.93.77.70,TCP,54,34692  >  9001 [ACK] Seq=1560927 Ack=26934441 Win=65535 Len=0
1,16.467315999999983,10.0.2.15,54.93.77.70,TLSv1.2,590,Application Data
1,16.467423999999937,54.93.77.70,10.0.2.15,TCP,60,9001  >  34692 [ACK] Seq=26934441 Ack=1561463 Win=65535 Len=0
1,16.472789000000034,54.93.77.70,10.0.2.15,TLSv1.2,1806,Application Data
1,16.472833000000037,10.0.2.15,54.93.77.70,TCP,54,34692  >  9001 [ACK] Seq=1561463 Ack=26936193 Win=65535 Len=0
1,16.478921000000014,54.93.77.70,10.0.2.15,TCP,2950,"9001  >  34692 [PSH, ACK] Seq=26936193 Ack=1561463 Win=65535 Len=2896 [TCP segment of a reassembled PDU]"
1,16.478965000000017,10.0.2.15,54.93.77.70,TCP,54,34692  >  9001 [ACK] Seq=1561463 Ack=26939089 Win=65535 Len=0
1,16.48990500000002,54.93.77.70,10.0.2.15,TLSv1.2,1314,"Application Data, Application Data"
1,16.529971000000046,10.0.2.15,54.93.77.70,TCP,54,34692  >  9001 [ACK] Seq=1561463 Ack=26940349 Win=65535 Len=0
1,16.553601999999955,54.93.77.70,10.0.2.15,TLSv1.2,5846,Application Data
1,16.55364099999997,54.93.77.70,10.0.2.15,TLSv1.2,1502,Application Data
1,16.553647999999953,54.93.77.70,10.0.2.15,TLSv1.2,11638,"Application Data, Application Data, Application Data, Application Data"
1,16.55370400000004,10.0.2.15,54.93.77.70,TCP,54,34692  >  9001 [ACK] Seq=1561463 Ack=26946141 Win=65535 Len=0
1,16.55374900000004,10.0.2.15,54.93.77.70,TCP,54,34692  >  9001 [ACK] Seq=1561463 Ack=26947589 Win=65535 Len=0
1,16.553770999999983,10.0.2.15,54.93.77.70,TCP,54,34692  >  9001 [ACK] Seq=1561463 Ack=26959173 Win=65535 Len=0
1,16.554116000000022,10.0.2.15,54.93.77.70,TLSv1.2,590,Application Data
1,16.554190999999946,54.93.77.70,10.0.2.15,TCP,60,9001  >  34692 [ACK] Seq=26959173 Ack=1561999 Win=65535 Len=0
1,16.566861000000017,54.93.77.70,10.0.2.15,TLSv1.2,1430,Application Data
1,16.571507999999994,54.93.77.70,10.0.2.15,TCP,2950,"9001  >  34692 [PSH, ACK] Seq=26960549 Ack=1561999 Win=65535 Len=2896 [TCP segment of a reassembled PDU]"
1,16.571563999999967,10.0.2.15,54.93.77.70,TCP,54,34692  >  9001 [ACK] Seq=1561999 Ack=26963445 Win=65535 Len=0
1,16.584750999999983,54.93.77.70,10.0.2.15,TLSv1.2,778,Application Data
