No.,Time,Source,Destination,Protocol,Length,Info
1,0.011220999998840853,10.0.2.15,54.93.77.70,TCP,54,34692  >  9001 [ACK] Seq=19659747 Ack=361381295 Win=65535 Len=0
1,0.14157499999964784,10.0.2.15,54.93.77.70,TLSv1.2,590,Application Data
1,0.14174499999899126,54.93.77.70,10.0.2.15,TCP,60,9001  >  34692 [ACK] Seq=361381295 Ack=19660283 Win=65535 Len=0
1,0.5170039999993605,62.210.85.178,10.0.2.15,TLSv1.2,590,Application Data
1,0.5173119999999471,10.0.2.15,62.210.85.178,TLSv1.2,590,Application Data
1,0.5174209999986488,62.210.85.178,10.0.2.15,TCP,60,9001  >  35978 [ACK] Seq=19581951 Ack=361695457 Win=65535 Len=0
1,0.7216829999997572,54.93.77.70,10.0.2.15,TLSv1.2,590,Application Data
1,0.7217729999993026,10.0.2.15,54.93.77.70,TCP,54,34692  >  9001 [ACK] Seq=19660283 Ack=361381831 Win=65535 Len=0
1,0.7222000000001572,10.0.2.15,54.93.77.70,TLSv1.2,1618,Application Data
1,0.7223119999998744,54.93.77.70,10.0.2.15,TCP,60,9001  >  34692 [ACK] Seq=361381831 Ack=19661743 Win=65535 Len=0
1,0.7223240000002988,54.93.77.70,10.0.2.15,TCP,60,9001  >  34692 [ACK] Seq=361381831 Ack=19661847 Win=65535 Len=0
1,0.8418559999990975,62.210.85.178,10.0.2.15,TLSv1.2,1618,Application Data
1,0.8419830000002548,10.0.2.15,62.210.85.178,TCP,54,35978  >  9001 [ACK] Seq=361695457 Ack=19583515 Win=65535 Len=0
1,0.8557989999990241,10.0.2.15,62.210.85.178,TLSv1.2,590,Application Data
1,0.8559669999995094,62.210.85.178,10.0.2.15,TCP,60,9001  >  35978 [ACK] Seq=19583515 Ack=361695993 Win=65535 Len=0
1,0.867737999999008,10.0.2.15,62.210.85.178,TLSv1.2,1618,Application Data
1,0.8678859999999986,62.210.85.178,10.0.2.15,TCP,60,9001  >  35978 [ACK] Seq=19583515 Ack=361697453 Win=65535 Len=0
1,0.8679039999988163,62.210.85.178,10.0.2.15,TCP,60,9001  >  35978 [ACK] Seq=19583515 Ack=361697557 Win=65535 Len=0
1,0.9810129999987112,54.93.77.70,10.0.2.15,TLSv1.2,590,Application Data
1,1.0129120000001421,54.93.77.70,10.0.2.15,TCP,1502,"9001  >  34692 [PSH, ACK] Seq=361382367 Ack=19661847 Win=65535 Len=1448 [TCP segment of a reassembled PDU]"
1,1.0129930000002787,10.0.2.15,54.93.77.70,TCP,54,34692  >  9001 [ACK] Seq=19661847 Ack=361383815 Win=65535 Len=0
1,1.0292799999988347,54.93.77.70,10.0.2.15,TLSv1.2,170,Application Data
1,1.031304000000091,10.0.2.15,54.93.77.70,TLSv1.2,590,Application Data
1,1.0314829999988433,54.93.77.70,10.0.2.15,TCP,60,9001  >  34692 [ACK] Seq=361383931 Ack=19662383 Win=65535 Len=0
1,1.4390339999990829,62.210.85.178,10.0.2.15,TLSv1.2,590,Application Data
1,1.4393650000001799,10.0.2.15,62.210.85.178,TLSv1.2,590,Application Data
1,1.4394699999993463,62.210.85.178,10.0.2.15,TCP,60,9001  >  35978 [ACK] Seq=19584051 Ack=361698093 Win=65535 Len=0
1,1.647168999999849,54.93.77.70,10.0.2.15,TLSv1.2,590,Application Data
1,1.6476220000004105,10.0.2.15,54.93.77.70,TLSv1.2,590,Application Data
1,1.6477619999986928,54.93.77.70,10.0.2.15,TCP,60,9001  >  34692 [ACK] Seq=361384467 Ack=19662919 Win=65535 Len=0
1,1.8493490000000747,62.210.85.178,10.0.2.15,TLSv1.2,590,Application Data
1,1.8595900000000256,10.0.2.15,62.210.85.178,TLSv1.2,590,Application Data
1,1.8597680000002583,62.210.85.178,10.0.2.15,TCP,60,9001  >  35978 [ACK] Seq=19584587 Ack=361698629 Win=65535 Len=0
1,1.8717450000003737,10.0.2.15,62.210.85.178,TLSv1.2,4124,Application Data
1,1.8718539999990753,10.0.2.15,62.210.85.178,TCP,2974,35978  >  9001 [ACK] Seq=361702699 Ack=19584587 Win=65535 Len=2920 [TCP segment of a reassembled PDU]
1,1.8718989999997575,62.210.85.178,10.0.2.15,TCP,60,9001  >  35978 [ACK] Seq=19584587 Ack=361700089 Win=65535 Len=0
1,1.8719099999998434,62.210.85.178,10.0.2.15,TCP,60,9001  >  35978 [ACK] Seq=19584587 Ack=361701549 Win=65535 Len=0
1,1.8719139999993786,62.210.85.178,10.0.2.15,TCP,60,9001  >  35978 [ACK] Seq=19584587 Ack=361702699 Win=65535 Len=0
1,1.8719189999992523,62.210.85.178,10.0.2.15,TCP,60,9001  >  35978 [ACK] Seq=19584587 Ack=361704159 Win=65535 Len=0
1,1.8719229999987874,62.210.85.178,10.0.2.15,TCP,60,9001  >  35978 [ACK] Seq=19584587 Ack=361705619 Win=65535 Len=0
1,1.871965000000273,10.0.2.15,62.210.85.178,TLSv1.2,1204,Application Data
1,1.872033999999985,10.0.2.15,62.210.85.178,TCP,2974,35978  >  9001 [ACK] Seq=361706769 Ack=19584587 Win=65535 Len=2920 [TCP segment of a reassembled PDU]
1,1.872073000000455,62.210.85.178,10.0.2.15,TCP,60,9001  >  35978 [ACK] Seq=19584587 Ack=361706769 Win=65535 Len=0
1,1.8720799999991868,62.210.85.178,10.0.2.15,TCP,60,9001  >  35978 [ACK] Seq=19584587 Ack=361708229 Win=65535 Len=0
1,1.872083999998722,62.210.85.178,10.0.2.15,TCP,60,9001  >  35978 [ACK] Seq=19584587 Ack=361709689 Win=65535 Len=0
1,1.8721189999996568,10.0.2.15,62.210.85.178,TLSv1.2,1204,Application Data
1,1.8721839999998338,10.0.2.15,62.210.85.178,TCP,2974,35978  >  9001 [ACK] Seq=361710839 Ack=19584587 Win=65535 Len=2920 [TCP segment of a reassembled PDU]
1,1.8722219999999652,62.210.85.178,10.0.2.15,TCP,60,9001  >  35978 [ACK] Seq=19584587 Ack=361710839 Win=65535 Len=0
1,1.872228999998697,62.210.85.178,10.0.2.15,TCP,60,9001  >  35978 [ACK] Seq=19584587 Ack=361712299 Win=65535 Len=0
1,1.872233000000051,62.210.85.178,10.0.2.15,TCP,60,9001  >  35978 [ACK] Seq=19584587 Ack=361713759 Win=65535 Len=0
1,1.8722649999999703,10.0.2.15,62.210.85.178,TLSv1.2,1204,Application Data
1,1.8723429999990913,10.0.2.15,62.210.85.178,TLSv1.2,2974,Application Data
1,1.8723809999992227,62.210.85.178,10.0.2.15,TCP,60,9001  >  35978 [ACK] Seq=19584587 Ack=361714909 Win=65535 Len=0
1,1.8723879999997735,62.210.85.178,10.0.2.15,TCP,60,9001  >  35978 [ACK] Seq=19584587 Ack=361716369 Win=65535 Len=0
1,1.8723919999993086,62.210.85.178,10.0.2.15,TCP,60,9001  >  35978 [ACK] Seq=19584587 Ack=361717829 Win=65535 Len=0
1,1.8724239999992278,10.0.2.15,62.210.85.178,TLSv1.2,1226,Application Data
1,1.8724849999998696,10.0.2.15,62.210.85.178,TCP,2974,35978  >  9001 [ACK] Seq=361719001 Ack=19584587 Win=65535 Len=2920 [TCP segment of a reassembled PDU]
1,1.872520999999324,62.210.85.178,10.0.2.15,TCP,60,9001  >  35978 [ACK] Seq=19584587 Ack=361719001 Win=65535 Len=0
1,1.8725279999998747,62.210.85.178,10.0.2.15,TCP,60,9001  >  35978 [ACK] Seq=19584587 Ack=361720461 Win=65535 Len=0
1,1.87253199999941,62.210.85.178,10.0.2.15,TCP,60,9001  >  35978 [ACK] Seq=19584587 Ack=361721921 Win=65535 Len=0
1,1.872563999999329,10.0.2.15,62.210.85.178,TLSv1.2,1204,Application Data
1,1.872600999999122,62.210.85.178,10.0.2.15,TCP,60,9001  >  35978 [ACK] Seq=19584587 Ack=361723071 Win=65535 Len=0
1,1.8726439999991271,10.0.2.15,62.210.85.178,TLSv1.2,3030,Application Data
1,1.8726850000002742,62.210.85.178,10.0.2.15,TCP,60,9001  >  35978 [ACK] Seq=19584587 Ack=361724531 Win=65535 Len=0
1,1.872691999999006,62.210.85.178,10.0.2.15,TCP,60,9001  >  35978 [ACK] Seq=19584587 Ack=361725991 Win=65535 Len=0
1,1.87269600000036,62.210.85.178,10.0.2.15,TCP,60,9001  >  35978 [ACK] Seq=19584587 Ack=361726047 Win=65535 Len=0
1,1.8819299999995565,10.0.2.15,62.210.85.178,TLSv1.2,4124,Application Data
1,1.8820079999986774,10.0.2.15,62.210.85.178,TCP,2974,35978  >  9001 [ACK] Seq=361730117 Ack=19584587 Win=65535 Len=2920 [TCP segment of a reassembled PDU]
1,1.882051999999021,62.210.85.178,10.0.2.15,TCP,60,9001  >  35978 [ACK] Seq=19584587 Ack=361727507 Win=65535 Len=0
1,1.8820599999999104,62.210.85.178,10.0.2.15,TCP,60,9001  >  35978 [ACK] Seq=19584587 Ack=361728967 Win=65535 Len=0
1,1.882064999999784,62.210.85.178,10.0.2.15,TCP,60,9001  >  35978 [ACK] Seq=19584587 Ack=361730117 Win=65535 Len=0
1,1.8820689999993192,62.210.85.178,10.0.2.15,TCP,60,9001  >  35978 [ACK] Seq=19584587 Ack=361731577 Win=65535 Len=0
1,1.8820729999988544,62.210.85.178,10.0.2.15,TCP,60,9001  >  35978 [ACK] Seq=19584587 Ack=361733037 Win=65535 Len=0
1,1.8821129999996629,10.0.2.15,62.210.85.178,TLSv1.2,1204,Application Data
1,1.882179999998698,10.0.2.15,62.210.85.178,TCP,2974,35978  >  9001 [ACK] Seq=361734187 Ack=19584587 Win=65535 Len=2920 [TCP segment of a reassembled PDU]
1,1.8822159999999712,62.210.85.178,10.0.2.15,TCP,60,9001  >  35978 [ACK] Seq=19584587 Ack=361734187 Win=65535 Len=0
1,1.882222999998703,62.210.85.178,10.0.2.15,TCP,60,9001  >  35978 [ACK] Seq=19584587 Ack=361735647 Win=65535 Len=0
1,1.8822280000003957,62.210.85.178,10.0.2.15,TCP,60,9001  >  35978 [ACK] Seq=19584587 Ack=361737107 Win=65535 Len=0
1,1.8822609999988344,10.0.2.15,62.210.85.178,TLSv1.2,1204,Application Data
1,1.8823259999990114,10.0.2.15,62.210.85.178,TCP,2974,35978  >  9001 [ACK] Seq=361738257 Ack=19584587 Win=65535 Len=2920 [TCP segment of a reassembled PDU]
1,1.8823620000002848,62.210.85.178,10.0.2.15,TCP,60,9001  >  35978 [ACK] Seq=19584587 Ack=361738257 Win=65535 Len=0
1,1.882367999998678,62.210.85.178,10.0.2.15,TCP,60,9001  >  35978 [ACK] Seq=19584587 Ack=361739717 Win=65535 Len=0
1,1.8823730000003707,62.210.85.178,10.0.2.15,TCP,60,9001  >  35978 [ACK] Seq=19584587 Ack=361741177 Win=65535 Len=0
1,1.8824039999999513,10.0.2.15,62.210.85.178,TLSv1.2,1204,Application Data
1,1.8824969999986934,10.0.2.15,62.210.85.178,TLSv1.2,2974,Application Data
1,1.8825189999988652,62.210.85.178,10.0.2.15,TCP,60,9001  >  35978 [ACK] Seq=19584587 Ack=361742327 Win=65535 Len=0
1,1.882525999999416,62.210.85.178,10.0.2.15,TCP,60,9001  >  35978 [ACK] Seq=19584587 Ack=361743787 Win=65535 Len=0
1,1.8825569999989966,10.0.2.15,62.210.85.178,TLSv1.2,1226,Application Data
1,1.8825939999987895,62.210.85.178,10.0.2.15,TCP,60,9001  >  35978 [ACK] Seq=19584587 Ack=361745247 Win=65535 Len=0
1,1.8826009999993403,62.210.85.178,10.0.2.15,TCP,60,9001  >  35978 [ACK] Seq=19584587 Ack=361746419 Win=65535 Len=0
1,1.8826439999993454,10.0.2.15,62.210.85.178,TLSv1.2,4124,Application Data
1,1.882684000000154,62.210.85.178,10.0.2.15,TCP,60,9001  >  35978 [ACK] Seq=19584587 Ack=361747879 Win=65535 Len=0
1,1.8826900000003661,62.210.85.178,10.0.2.15,TCP,60,9001  >  35978 [ACK] Seq=19584587 Ack=361749339 Win=65535 Len=0
1,1.8826950000002398,62.210.85.178,10.0.2.15,TCP,60,9001  >  35978 [ACK] Seq=19584587 Ack=361750489 Win=65535 Len=0
1,1.882739999999103,10.0.2.15,62.210.85.178,TLSv1.2,3030,Application Data
1,1.8827799999999115,62.210.85.178,10.0.2.15,TCP,60,9001  >  35978 [ACK] Seq=19584587 Ack=361751949 Win=65535 Len=0
1,1.8827870000004623,62.210.85.178,10.0.2.15,TCP,60,9001  >  35978 [ACK] Seq=19584587 Ack=361753409 Win=65535 Len=0
1,1.882792000000336,62.210.85.178,10.0.2.15,TCP,60,9001  >  35978 [ACK] Seq=19584587 Ack=361753465 Win=65535 Len=0
1,1.8952489999992395,10.0.2.15,62.210.85.178,TLSv1.2,4124,Application Data
1,1.8953399999991234,10.0.2.15,62.210.85.178,TCP,2974,35978  >  9001 [ACK] Seq=361757535 Ack=19584587 Win=65535 Len=2920 [TCP segment of a reassembled PDU]
1,1.895379999999932,62.210.85.178,10.0.2.15,TCP,60,9001  >  35978 [ACK] Seq=19584587 Ack=361754925 Win=65535 Len=0
1,1.8953889999993407,62.210.85.178,10.0.2.15,TCP,60,9001  >  35978 [ACK] Seq=19584587 Ack=361756385 Win=65535 Len=0
1,1.895392999998876,62.210.85.178,10.0.2.15,TCP,60,9001  >  35978 [ACK] Seq=19584587 Ack=361757535 Win=65535 Len=0
1,1.8953979999987496,62.210.85.178,10.0.2.15,TCP,60,9001  >  35978 [ACK] Seq=19584587 Ack=361758995 Win=65535 Len=0
1,1.8954020000001037,62.210.85.178,10.0.2.15,TCP,60,9001  >  35978 [ACK] Seq=19584587 Ack=361760455 Win=65535 Len=0
1,1.8954439999997703,10.0.2.15,62.210.85.178,TLSv1.2,1204,Application Data
1,1.8955119999991439,10.0.2.15,62.210.85.178,TCP,2974,35978  >  9001 [ACK] Seq=361761605 Ack=19584587 Win=65535 Len=2920 [TCP segment of a reassembled PDU]
1,1.8955499999992753,62.210.85.178,10.0.2.15,TCP,60,9001  >  35978 [ACK] Seq=19584587 Ack=361761605 Win=65535 Len=0
1,1.8955559999994875,62.210.85.178,10.0.2.15,TCP,60,9001  >  35978 [ACK] Seq=19584587 Ack=361763065 Win=65535 Len=0
1,1.8955609999993612,62.210.85.178,10.0.2.15,TCP,60,9001  >  35978 [ACK] Seq=19584587 Ack=361764525 Win=65535 Len=0
1,1.8955949999999575,10.0.2.15,62.210.85.178,TLSv1.2,1204,Application Data
1,1.895660999998654,10.0.2.15,62.210.85.178,TCP,2974,35978  >  9001 [ACK] Seq=361765675 Ack=19584587 Win=65535 Len=2920 [TCP segment of a reassembled PDU]
1,1.8956989999987854,62.210.85.178,10.0.2.15,TCP,60,9001  >  35978 [ACK] Seq=19584587 Ack=361765675 Win=65535 Len=0
1,1.8957059999993362,62.210.85.178,10.0.2.15,TCP,60,9001  >  35978 [ACK] Seq=19584587 Ack=361767135 Win=65535 Len=0
1,1.8957099999988714,62.210.85.178,10.0.2.15,TCP,60,9001  >  35978 [ACK] Seq=19584587 Ack=361768595 Win=65535 Len=0
1,1.8957419999987906,10.0.2.15,62.210.85.178,TLSv1.2,1204,Application Data
1,1.8958309999998164,62.210.85.178,10.0.2.15,TCP,60,9001  >  35978 [ACK] Seq=19584587 Ack=361769745 Win=65535 Len=0
1,1.895857999999862,10.0.2.15,62.210.85.178,TLSv1.2,2974,Application Data
1,1.895897000000332,62.210.85.178,10.0.2.15,TCP,60,9001  >  35978 [ACK] Seq=19584587 Ack=361771205 Win=65535 Len=0
1,1.8959029999987251,62.210.85.178,10.0.2.15,TCP,60,9001  >  35978 [ACK] Seq=19584587 Ack=361772665 Win=65535 Len=0
1,1.8959340000001248,10.0.2.15,62.210.85.178,TLSv1.2,1226,Application Data
1,1.8959709999999177,62.210.85.178,10.0.2.15,TCP,60,9001  >  35978 [ACK] Seq=19584587 Ack=361773837 Win=65535 Len=0
1,1.8960150000002614,10.0.2.15,62.210.85.178,TLSv1.2,3994,Application Data
1,1.896058999998786,62.210.85.178,10.0.2.15,TCP,60,9001  >  35978 [ACK] Seq=19584587 Ack=361775297 Win=65535 Len=0
1,1.8960659999993368,62.210.85.178,10.0.2.15,TCP,60,9001  >  35978 [ACK] Seq=19584587 Ack=361776757 Win=65535 Len=0
1,1.896069999998872,62.210.85.178,10.0.2.15,TCP,60,9001  >  35978 [ACK] Seq=19584587 Ack=361777777 Win=65535 Len=0
1,2.0248719999999594,54.93.77.70,10.0.2.15,TLSv1.2,3674,Application Data
1,2.0250059999998484,10.0.2.15,54.93.77.70,TCP,54,34692  >  9001 [ACK] Seq=19662919 Ack=361388087 Win=65535 Len=0
1,2.0635829999991984,54.93.77.70,10.0.2.15,TLSv1.2,4210,"Application Data, Application Data"
1,2.0636539999995875,10.0.2.15,54.93.77.70,TCP,54,34692  >  9001 [ACK] Seq=19662919 Ack=361392243 Win=65535 Len=0
1,2.072349000000031,54.93.77.70,10.0.2.15,TCP,2950,"9001  >  34692 [PSH, ACK] Seq=361392243 Ack=19662919 Win=65535 Len=2896 [TCP segment of a reassembled PDU]"
1,2.072394999999233,10.0.2.15,54.93.77.70,TCP,54,34692  >  9001 [ACK] Seq=19662919 Ack=361395139 Win=65535 Len=0
1,2.0795230000003357,54.93.77.70,10.0.2.15,TLSv1.2,778,Application Data
1,2.0826689999994414,54.93.77.70,10.0.2.15,TLSv1.2,7294,Application Data
1,2.0826899999992747,54.93.77.70,10.0.2.15,TLSv1.2,2950,Application Data [TCP segment of a reassembled PDU]
1,2.0827659999995376,10.0.2.15,54.93.77.70,TCP,54,34692  >  9001 [ACK] Seq=19662919 Ack=361405999 Win=65535 Len=0
1,2.0910659999990457,54.93.77.70,10.0.2.15,TLSv1.2,2950,Application Data [TCP segment of a reassembled PDU]
1,2.0911189999987982,10.0.2.15,54.93.77.70,TCP,54,34692  >  9001 [ACK] Seq=19662919 Ack=361408895 Win=65535 Len=0
1,2.0913220000002184,10.0.2.15,54.93.77.70,TLSv1.2,590,Application Data
1,2.0914359999987937,54.93.77.70,10.0.2.15,TCP,60,9001  >  34692 [ACK] Seq=361408895 Ack=19663455 Win=65535 Len=0
1,2.0926669999989826,54.93.77.70,10.0.2.15,TLSv1.2,2950,Application Data [TCP segment of a reassembled PDU]
1,2.0927089999986492,10.0.2.15,54.93.77.70,TCP,54,34692  >  9001 [ACK] Seq=19663455 Ack=361411791 Win=65535 Len=0
1,2.098804999999629,54.93.77.70,10.0.2.15,TLSv1.2,684,Application Data
1,2.1013029999994615,54.93.77.70,10.0.2.15,TCP,2950,"9001  >  34692 [PSH, ACK] Seq=361412421 Ack=19663455 Win=65535 Len=2896 [TCP segment of a reassembled PDU]"
1,2.1013480000001437,10.0.2.15,54.93.77.70,TCP,54,34692  >  9001 [ACK] Seq=19663455 Ack=361415317 Win=65535 Len=0
1,2.103553999999349,10.0.2.15,54.93.77.70,TLSv1.2,590,Application Data
1,2.1036829999993643,54.93.77.70,10.0.2.15,TCP,60,9001  >  34692 [ACK] Seq=361415317 Ack=19663991 Win=65535 Len=0
1,2.117979999999079,54.93.77.70,10.0.2.15,TLSv1.2,778,Application Data
1,2.1186020000004646,54.93.77.70,10.0.2.15,TCP,2950,"9001  >  34692 [PSH, ACK] Seq=361416041 Ack=19663991 Win=65535 Len=2896 [TCP segment of a reassembled PDU]"
1,2.118674999999712,10.0.2.15,54.93.77.70,TCP,54,34692  >  9001 [ACK] Seq=19663991 Ack=361418937 Win=65535 Len=0
1,2.119701999999961,54.93.77.70,10.0.2.15,TLSv1.2,2950,Application Data [TCP segment of a reassembled PDU]
1,2.1197439999996277,10.0.2.15,54.93.77.70,TCP,54,34692  >  9001 [ACK] Seq=19663991 Ack=361421833 Win=65535 Len=0
1,2.1350929999989603,54.93.77.70,10.0.2.15,TLSv1.2,474,Application Data
1,2.175145999999586,10.0.2.15,54.93.77.70,TCP,54,34692  >  9001 [ACK] Seq=19663991 Ack=361422253 Win=65535 Len=0
1,2.2041779999999562,54.93.77.70,10.0.2.15,TCP,2950,"9001  >  34692 [PSH, ACK] Seq=361422253 Ack=19663991 Win=65535 Len=2896 [TCP segment of a reassembled PDU]"
1,2.20424599999933,10.0.2.15,54.93.77.70,TCP,54,34692  >  9001 [ACK] Seq=19663991 Ack=361425149 Win=65535 Len=0
1,2.2046659999996336,54.93.77.70,10.0.2.15,TLSv1.2,778,Application Data
1,2.2047119999988354,10.0.2.15,54.93.77.70,TCP,54,34692  >  9001 [ACK] Seq=19663991 Ack=361425873 Win=65535 Len=0
1,2.2139289999995526,54.93.77.70,10.0.2.15,TLSv1.2,7294,Application Data
1,2.2140259999996488,10.0.2.15,54.93.77.70,TCP,54,34692  >  9001 [ACK] Seq=19663991 Ack=361433113 Win=65535 Len=0
1,2.2206329999989975,54.93.77.70,10.0.2.15,TLSv1.2,568,Application Data
1,2.2206790000000183,10.0.2.15,54.93.77.70,TCP,54,34692  >  9001 [ACK] Seq=19663991 Ack=361433627 Win=65535 Len=0
1,2.2225999999991473,62.210.85.178,10.0.2.15,TLSv1.2,590,Application Data
1,2.236226999999417,54.93.77.70,10.0.2.15,TLSv1.2,5846,Application Data
1,2.236343999999008,10.0.2.15,54.93.77.70,TCP,54,34692  >  9001 [ACK] Seq=19663991 Ack=361439419 Win=65535 Len=0
1,2.236496999999872,10.0.2.15,54.93.77.70,TLSv1.2,590,Application Data
1,2.2365680000002612,54.93.77.70,10.0.2.15,TCP,60,9001  >  34692 [ACK] Seq=361439419 Ack=19664527 Win=65535 Len=0
1,2.236851999999999,54.93.77.70,10.0.2.15,TLSv1.2,5846,Application Data [TCP segment of a reassembled PDU]
1,2.2368919999989885,10.0.2.15,54.93.77.70,TCP,54,34692  >  9001 [ACK] Seq=19664527 Ack=361445211 Win=65535 Len=0
1,2.2369569999991654,54.93.77.70,10.0.2.15,TLSv1.2,894,"Application Data, Application Data"
1,2.2468969999990804,54.93.77.70,10.0.2.15,TLSv1.2,4398,Application Data
1,2.2469419999997626,10.0.2.15,54.93.77.70,TCP,54,34692  >  9001 [ACK] Seq=19664527 Ack=361450395 Win=65535 Len=0
1,2.2471649999988585,54.93.77.70,10.0.2.15,TCP,1502,"9001  >  34692 [PSH, ACK] Seq=361450395 Ack=19664527 Win=65535 Len=1448 [TCP segment of a reassembled PDU]"
1,2.2471999999997934,10.0.2.15,54.93.77.70,TCP,54,34692  >  9001 [ACK] Seq=19664527 Ack=361451843 Win=65535 Len=0
1,2.253415999999561,54.93.77.70,10.0.2.15,TLSv1.2,474,Application Data
1,2.2592399999994086,54.93.77.70,10.0.2.15,TCP,2950,"9001  >  34692 [PSH, ACK] Seq=361452263 Ack=19664527 Win=65535 Len=2896 [TCP segment of a reassembled PDU]"
1,2.2593029999989085,10.0.2.15,54.93.77.70,TCP,54,34692  >  9001 [ACK] Seq=19664527 Ack=361455159 Win=65535 Len=0
1,2.263181000000259,10.0.2.15,62.210.85.178,TCP,54,35978  >  9001 [ACK] Seq=361777777 Ack=19585123 Win=65535 Len=0
1,2.2707339999997203,54.93.77.70,10.0.2.15,TLSv1.2,3674,Application Data [TCP segment of a reassembled PDU]
1,2.2707749999990483,10.0.2.15,54.93.77.70,TCP,54,34692  >  9001 [ACK] Seq=19664527 Ack=361458779 Win=65535 Len=0
1,2.271677999999156,54.93.77.70,10.0.2.15,TLSv1.2,4398,Application Data [TCP segment of a reassembled PDU]
1,2.2717199999988225,10.0.2.15,54.93.77.70,TCP,54,34692  >  9001 [ACK] Seq=19664527 Ack=361463123 Win=65535 Len=0
1,2.2718729999996867,10.0.2.15,54.93.77.70,TLSv1.2,590,Application Data
1,2.271941999999399,54.93.77.70,10.0.2.15,TCP,60,9001  >  34692 [ACK] Seq=361463123 Ack=19665063 Win=65535 Len=0
1,2.2827569999990374,62.210.85.178,10.0.2.15,TLSv1.2,590,Application Data
1,2.2827999999990425,10.0.2.15,62.210.85.178,TCP,54,35978  >  9001 [ACK] Seq=361777777 Ack=19585659 Win=65535 Len=0
1,2.2864360000003217,54.93.77.70,10.0.2.15,TLSv1.2,1104,"Application Data, Application Data"
1,2.2865709999987303,10.0.2.15,54.93.77.70,TLSv1.2,590,Application Data
1,2.2866629999989527,54.93.77.70,10.0.2.15,TCP,60,9001  >  34692 [ACK] Seq=361464173 Ack=19665599 Win=65535 Len=0
1,2.29639700000007,10.0.2.15,54.93.77.70,TLSv1.2,590,Application Data
1,2.296542000000045,54.93.77.70,10.0.2.15,TCP,60,9001  >  34692 [ACK] Seq=361464173 Ack=19666135 Win=65535 Len=0
1,2.417632999999114,62.210.85.178,10.0.2.15,TLSv1.2,1618,Application Data
1,2.4177199999994627,10.0.2.15,62.210.85.178,TCP,54,35978  >  9001 [ACK] Seq=361777777 Ack=19587223 Win=65535 Len=0
1,2.6887559999995574,62.210.85.178,10.0.2.15,TLSv1.2,590,Application Data
1,2.6888309999994817,10.0.2.15,62.210.85.178,TCP,54,35978  >  9001 [ACK] Seq=361777777 Ack=19587759 Win=65535 Len=0
1,2.6892989999996644,10.0.2.15,62.210.85.178,TLSv1.2,590,Application Data
1,2.6893959999997605,62.210.85.178,10.0.2.15,TCP,60,9001  >  35978 [ACK] Seq=19587759 Ack=361778313 Win=65535 Len=0
1,2.7089930000001914,152.89.104.206,10.0.2.15,TLSv1.3,590,Application Data
1,2.7090809999990597,10.0.2.15,152.89.104.206,TCP,54,47334  >  9001 [ACK] Seq=8991 Ack=12464 Win=57352 Len=0
1,2.816617000000406,54.93.77.70,10.0.2.15,TLSv1.2,590,Application Data
1,2.817014999998719,10.0.2.15,54.93.77.70,TLSv1.2,590,Application Data
1,2.81713099999979,54.93.77.70,10.0.2.15,TCP,60,9001  >  34692 [ACK] Seq=361464709 Ack=19666671 Win=65535 Len=0
1,3.077815999999075,62.210.85.178,10.0.2.15,TLSv1.2,590,Application Data
1,3.083755999999994,10.0.2.15,62.210.85.178,TLSv1.2,590,Application Data
1,3.083930999999211,62.210.85.178,10.0.2.15,TCP,60,9001  >  35978 [ACK] Seq=19588295 Ack=361778849 Win=65535 Len=0
1,3.095257999999376,10.0.2.15,62.210.85.178,TLSv1.2,4124,Application Data
1,3.0953630000003614,10.0.2.15,62.210.85.178,TCP,2974,35978  >  9001 [ACK] Seq=361782919 Ack=19588295 Win=65535 Len=2920 [TCP segment of a reassembled PDU]
1,3.09541100000024,62.210.85.178,10.0.2.15,TCP,60,9001  >  35978 [ACK] Seq=19588295 Ack=361780309 Win=65535 Len=0
1,3.0954229999988456,62.210.85.178,10.0.2.15,TCP,60,9001  >  35978 [ACK] Seq=19588295 Ack=361781769 Win=65535 Len=0
1,3.0954279999987193,62.210.85.178,10.0.2.15,TCP,60,9001  >  35978 [ACK] Seq=19588295 Ack=361782919 Win=65535 Len=0
1,3.0954320000000735,62.210.85.178,10.0.2.15,TCP,60,9001  >  35978 [ACK] Seq=19588295 Ack=361784379 Win=65535 Len=0
1,3.09543499999927,62.210.85.178,10.0.2.15,TCP,60,9001  >  35978 [ACK] Seq=19588295 Ack=361785839 Win=65535 Len=0
1,3.095470000000205,10.0.2.15,62.210.85.178,TLSv1.2,1204,Application Data
1,3.095508999998856,62.210.85.178,10.0.2.15,TCP,60,9001  >  35978 [ACK] Seq=19588295 Ack=361786989 Win=65535 Len=0
1,3.0955549999998766,10.0.2.15,62.210.85.178,TLSv1.2,4124,Application Data
1,3.0955959999992047,62.210.85.178,10.0.2.15,TCP,60,9001  >  35978 [ACK] Seq=19588295 Ack=361788449 Win=65535 Len=0
1,3.095604000000094,62.210.85.178,10.0.2.15,TCP,60,9001  >  35978 [ACK] Seq=19588295 Ack=361789909 Win=65535 Len=0
1,3.0956089999999676,62.210.85.178,10.0.2.15,TCP,60,9001  >  35978 [ACK] Seq=19588295 Ack=361791059 Win=65535 Len=0
1,3.095653999998831,10.0.2.15,62.210.85.178,TLSv1.2,4124,Application Data
1,3.0956910000004427,62.210.85.178,10.0.2.15,TCP,60,9001  >  35978 [ACK] Seq=19588295 Ack=361792519 Win=65535 Len=0
1,3.0956999999998516,62.210.85.178,10.0.2.15,TCP,60,9001  >  35978 [ACK] Seq=19588295 Ack=361793979 Win=65535 Len=0
1,3.095760000000155,10.0.2.15,62.210.85.178,TLSv1.2,2974,Application Data
1,3.095800999999483,62.210.85.178,10.0.2.15,TCP,60,9001  >  35978 [ACK] Seq=19588295 Ack=361795129 Win=65535 Len=0
1,3.0958080000000336,62.210.85.178,10.0.2.15,TCP,60,9001  >  35978 [ACK] Seq=19588295 Ack=361796589 Win=65535 Len=0
1,3.0958109999992303,62.210.85.178,10.0.2.15,TCP,60,9001  >  35978 [ACK] Seq=19588295 Ack=361798049 Win=65535 Len=0
1,3.0958389999996143,10.0.2.15,62.210.85.178,TLSv1.2,1226,Application Data
1,3.0958749999990687,62.210.85.178,10.0.2.15,TCP,60,9001  >  35978 [ACK] Seq=19588295 Ack=361799221 Win=65535 Len=0
1,3.095914999999877,10.0.2.15,62.210.85.178,TLSv1.2,4124,Application Data
1,3.095954000000347,62.210.85.178,10.0.2.15,TCP,60,9001  >  35978 [ACK] Seq=19588295 Ack=361800681 Win=65535 Len=0
1,3.095960999999079,62.210.85.178,10.0.2.15,TCP,60,9001  >  35978 [ACK] Seq=19588295 Ack=361802141 Win=65535 Len=0
1,3.095965000000433,62.210.85.178,10.0.2.15,TCP,60,9001  >  35978 [ACK] Seq=19588295 Ack=361803291 Win=65535 Len=0
1,3.096002000000226,10.0.2.15,62.210.85.178,TLSv1.2,3030,Application Data
1,3.0960400000003574,62.210.85.178,10.0.2.15,TCP,60,9001  >  35978 [ACK] Seq=19588295 Ack=361804751 Win=65535 Len=0
1,3.0960489999997662,62.210.85.178,10.0.2.15,TCP,60,9001  >  35978 [ACK] Seq=19588295 Ack=361806211 Win=65535 Len=0
1,3.0960529999993014,62.210.85.178,10.0.2.15,TCP,60,9001  >  35978 [ACK] Seq=19588295 Ack=361806267 Win=65535 Len=0
1,3.1075259999997797,10.0.2.15,62.210.85.178,TLSv1.2,4124,Application Data
1,3.1076429999993707,62.210.85.178,10.0.2.15,TCP,60,9001  >  35978 [ACK] Seq=19588295 Ack=361807727 Win=65535 Len=0
1,3.107656999998653,62.210.85.178,10.0.2.15,TCP,60,9001  >  35978 [ACK] Seq=19588295 Ack=361809187 Win=65535 Len=0
1,3.1076610000000073,62.210.85.178,10.0.2.15,TCP,60,9001  >  35978 [ACK] Seq=19588295 Ack=361810337 Win=65535 Len=0
1,3.1077040000000125,10.0.2.15,62.210.85.178,TLSv1.2,4124,Application Data
1,3.107774000000063,62.210.85.178,10.0.2.15,TCP,60,9001  >  35978 [ACK] Seq=19588295 Ack=361811797 Win=65535 Len=0
1,3.107780999998795,62.210.85.178,10.0.2.15,TCP,60,9001  >  35978 [ACK] Seq=19588295 Ack=361813257 Win=65535 Len=0
1,3.1077839999998105,62.210.85.178,10.0.2.15,TCP,60,9001  >  35978 [ACK] Seq=19588295 Ack=361814407 Win=65535 Len=0
1,3.1078209999996034,10.0.2.15,62.210.85.178,TLSv1.2,4124,Application Data
1,3.1078579999993963,62.210.85.178,10.0.2.15,TCP,60,9001  >  35978 [ACK] Seq=19588295 Ack=361815867 Win=65535 Len=0
1,3.1078660000002856,62.210.85.178,10.0.2.15,TCP,60,9001  >  35978 [ACK] Seq=19588295 Ack=361817327 Win=65535 Len=0
1,3.1078710000001593,62.210.85.178,10.0.2.15,TCP,60,9001  >  35978 [ACK] Seq=19588295 Ack=361818477 Win=65535 Len=0
1,3.1079099999988102,10.0.2.15,62.210.85.178,TLSv1.2,4124,Application Data
1,3.107947000000422,62.210.85.178,10.0.2.15,TCP,60,9001  >  35978 [ACK] Seq=19588295 Ack=361819937 Win=65535 Len=0
1,3.107955999999831,62.210.85.178,10.0.2.15,TCP,60,9001  >  35978 [ACK] Seq=19588295 Ack=361821397 Win=65535 Len=0
1,3.1079609999997047,62.210.85.178,10.0.2.15,TCP,60,9001  >  35978 [ACK] Seq=19588295 Ack=361822547 Win=65535 Len=0
1,3.107995000000301,10.0.2.15,62.210.85.178,TLSv1.2,332,Application Data
1,3.1080330000004324,62.210.85.178,10.0.2.15,TCP,60,9001  >  35978 [ACK] Seq=19588295 Ack=361822825 Win=65535 Len=0
1,3.108083999999508,10.0.2.15,62.210.85.178,TLSv1.2,3868,Application Data
1,3.1081240000003163,62.210.85.178,10.0.2.15,TCP,60,9001  >  35978 [ACK] Seq=19588295 Ack=361824285 Win=65535 Len=0
1,3.1081319999993866,62.210.85.178,10.0.2.15,TCP,60,9001  >  35978 [ACK] Seq=19588295 Ack=361825745 Win=65535 Len=0
1,3.1081359999989218,62.210.85.178,10.0.2.15,TCP,60,9001  >  35978 [ACK] Seq=19588295 Ack=361826639 Win=65535 Len=0
1,3.108173999999053,10.0.2.15,62.210.85.178,TLSv1.2,4124,Application Data
1,3.108212999999523,62.210.85.178,10.0.2.15,TCP,60,9001  >  35978 [ACK] Seq=19588295 Ack=361828099 Win=65535 Len=0
1,3.1082210000004125,62.210.85.178,10.0.2.15,TCP,60,9001  >  35978 [ACK] Seq=19588295 Ack=361829559 Win=65535 Len=0
1,3.1082249999999476,62.210.85.178,10.0.2.15,TCP,60,9001  >  35978 [ACK] Seq=19588295 Ack=361830709 Win=65535 Len=0
1,3.1082599999990634,10.0.2.15,62.210.85.178,TLSv1.2,3030,Application Data
1,3.1082989999995334,62.210.85.178,10.0.2.15,TCP,60,9001  >  35978 [ACK] Seq=19588295 Ack=361832169 Win=65535 Len=0
1,3.1083070000004227,62.210.85.178,10.0.2.15,TCP,60,9001  >  35978 [ACK] Seq=19588295 Ack=361833629 Win=65535 Len=0
1,3.1083120000002964,62.210.85.178,10.0.2.15,TCP,60,9001  >  35978 [ACK] Seq=19588295 Ack=361833685 Win=65535 Len=0
1,3.1197899999988294,10.0.2.15,62.210.85.178,TLSv1.2,4124,Application Data
1,3.119901000000027,62.210.85.178,10.0.2.15,TCP,60,9001  >  35978 [ACK] Seq=19588295 Ack=361835145 Win=65535 Len=0
1,3.119913999998971,62.210.85.178,10.0.2.15,TCP,60,9001  >  35978 [ACK] Seq=19588295 Ack=361836605 Win=65535 Len=0
1,3.1199169999999867,62.210.85.178,10.0.2.15,TCP,60,9001  >  35978 [ACK] Seq=19588295 Ack=361837755 Win=65535 Len=0
1,3.1199669999987236,10.0.2.15,62.210.85.178,TLSv1.2,4124,Application Data
1,3.1200109999990673,62.210.85.178,10.0.2.15,TCP,60,9001  >  35978 [ACK] Seq=19588295 Ack=361839215 Win=65535 Len=0
1,3.1200209999988147,62.210.85.178,10.0.2.15,TCP,60,9001  >  35978 [ACK] Seq=19588295 Ack=361840675 Win=65535 Len=0
1,3.120025000000169,62.210.85.178,10.0.2.15,TCP,60,9001  >  35978 [ACK] Seq=19588295 Ack=361841825 Win=65535 Len=0
1,3.1200649999991583,10.0.2.15,62.210.85.178,TLSv1.2,4124,Application Data
1,3.1201029999992898,62.210.85.178,10.0.2.15,TCP,60,9001  >  35978 [ACK] Seq=19588295 Ack=361843285 Win=65535 Len=0
1,3.120111000000179,62.210.85.178,10.0.2.15,TCP,60,9001  >  35978 [ACK] Seq=19588295 Ack=361844745 Win=65535 Len=0
1,3.1201170000003913,62.210.85.178,10.0.2.15,TCP,60,9001  >  35978 [ACK] Seq=19588295 Ack=361845895 Win=65535 Len=0
1,3.1201549999987037,10.0.2.15,62.210.85.178,TLSv1.2,4124,Application Data
1,3.120192999998835,62.210.85.178,10.0.2.15,TCP,60,9001  >  35978 [ACK] Seq=19588295 Ack=361847355 Win=65535 Len=0
1,3.1202009999997244,62.210.85.178,10.0.2.15,TCP,60,9001  >  35978 [ACK] Seq=19588295 Ack=361848815 Win=65535 Len=0
1,3.120205999999598,62.210.85.178,10.0.2.15,TCP,60,9001  >  35978 [ACK] Seq=19588295 Ack=361849965 Win=65535 Len=0
1,3.120240999998714,10.0.2.15,62.210.85.178,TLSv1.2,332,Application Data
1,3.120278000000326,62.210.85.178,10.0.2.15,TCP,60,9001  >  35978 [ACK] Seq=19588295 Ack=361850243 Win=65535 Len=0
1,3.1203310000000783,10.0.2.15,62.210.85.178,TLSv1.2,590,Application Data
1,3.12036900000021,62.210.85.178,10.0.2.15,TCP,60,9001  >  35978 [ACK] Seq=19588295 Ack=361850779 Win=65535 Len=0
1,3.213265999998839,54.93.77.70,10.0.2.15,TLSv1.2,590,Application Data
1,3.255189999999857,10.0.2.15,54.93.77.70,TCP,54,34692  >  9001 [ACK] Seq=19666671 Ack=361465245 Win=65535 Len=0
1,3.2666730000000825,54.93.77.70,10.0.2.15,TCP,2950,"9001  >  34692 [PSH, ACK] Seq=361465245 Ack=19666671 Win=65535 Len=2896 [TCP segment of a reassembled PDU]"
1,3.266714999999749,10.0.2.15,54.93.77.70,TCP,54,34692  >  9001 [ACK] Seq=19666671 Ack=361468141 Win=65535 Len=0
1,3.2726199999997334,54.93.77.70,10.0.2.15,TLSv1.2,4398,"Application Data, Application Data"
1,3.272659999998723,10.0.2.15,54.93.77.70,TCP,54,34692  >  9001 [ACK] Seq=19666671 Ack=361472485 Win=65535 Len=0
1,3.2823369999987335,54.93.77.70,10.0.2.15,TLSv1.2,590,Application Data
1,3.2823959999986982,10.0.2.15,54.93.77.70,TCP,54,34692  >  9001 [ACK] Seq=19666671 Ack=361473021 Win=65535 Len=0
1,3.2996519999996963,54.93.77.70,10.0.2.15,TLSv1.2,5846,Application Data
1,3.2997039999991102,10.0.2.15,54.93.77.70,TCP,54,34692  >  9001 [ACK] Seq=19666671 Ack=361478813 Win=65535 Len=0
1,3.315984999999273,54.93.77.70,10.0.2.15,TLSv1.2,2016,Application Data
1,3.3160749999988184,10.0.2.15,54.93.77.70,TCP,54,34692  >  9001 [ACK] Seq=19666671 Ack=361480775 Win=65535 Len=0
1,3.319090999999389,54.93.77.70,10.0.2.15,TCP,2950,"9001  >  34692 [PSH, ACK] Seq=361480775 Ack=19666671 Win=65535 Len=2896 [TCP segment of a reassembled PDU]"
1,3.3191379999989294,10.0.2.15,54.93.77.70,TCP,54,34692  >  9001 [ACK] Seq=19666671 Ack=361483671 Win=65535 Len=0
1,3.329932999999073,54.93.77.70,10.0.2.15,TLSv1.2,7294,"Application Data, Application Data"
1,3.3299889999998413,10.0.2.15,54.93.77.70,TCP,54,34692  >  9001 [ACK] Seq=19666671 Ack=361490911 Win=65535 Len=0
1,3.334120999999868,54.93.77.70,10.0.2.15,TLSv1.2,1292,Application Data
1,3.3341700000000856,10.0.2.15,54.93.77.70,TCP,54,34692  >  9001 [ACK] Seq=19666671 Ack=361492149 Win=65535 Len=0
1,3.3343779999995604,10.0.2.15,54.93.77.70,TLSv1.2,590,Application Data
1,3.3344949999991513,54.93.77.70,10.0.2.15,TCP,60,9001  >  34692 [ACK] Seq=361492149 Ack=19667207 Win=65535 Len=0
1,3.342453999999634,54.93.77.70,10.0.2.15,TCP,2950,"9001  >  34692 [PSH, ACK] Seq=361492149 Ack=19667207 Win=65535 Len=2896 [TCP segment of a reassembled PDU]"
1,3.3425200000001496,10.0.2.15,54.93.77.70,TCP,54,34692  >  9001 [ACK] Seq=19667207 Ack=361495045 Win=65535 Len=0
1,3.342914999999266,54.93.77.70,10.0.2.15,TLSv1.2,4398,Application Data [TCP segment of a reassembled PDU]
1,3.342957999999271,10.0.2.15,54.93.77.70,TCP,54,34692  >  9001 [ACK] Seq=19667207 Ack=361499389 Win=65535 Len=0
1,3.350293999999849,54.93.77.70,10.0.2.15,TLSv1.2,568,Application Data
1,3.3646349999999074,54.93.77.70,10.0.2.15,TLSv1.2,7294,"Application Data, Application Data"
1,3.364704999999958,10.0.2.15,54.93.77.70,TCP,54,34692  >  9001 [ACK] Seq=19667207 Ack=361507143 Win=65535 Len=0
1,3.3670359999996435,54.93.77.70,10.0.2.15,TLSv1.2,1104,Application Data
1,3.3759209999989253,54.93.77.70,10.0.2.15,TLSv1.2,9994,"Application Data, Application Data"
1,3.3759790000003704,10.0.2.15,54.93.77.70,TCP,54,34692  >  9001 [ACK] Seq=19667207 Ack=361518133 Win=65535 Len=0
1,3.376024999999572,54.93.77.70,10.0.2.15,TCP,250,"9001  >  34692 [PSH, ACK] Seq=361518133 Ack=19667207 Win=65535 Len=196 [TCP segment of a reassembled PDU]"
1,3.3761780000004364,10.0.2.15,54.93.77.70,TLSv1.2,590,Application Data
1,3.376274000000194,54.93.77.70,10.0.2.15,TCP,60,9001  >  34692 [ACK] Seq=361518329 Ack=19667743 Win=65535 Len=0
1,3.3833949999989272,54.93.77.70,10.0.2.15,TLSv1.2,778,Application Data
1,3.3871239999989484,54.93.77.70,10.0.2.15,TCP,1502,"9001  >  34692 [PSH, ACK] Seq=361519053 Ack=19667743 Win=65535 Len=1448 [TCP segment of a reassembled PDU]"
1,3.387167999999292,10.0.2.15,54.93.77.70,TCP,54,34692  >  9001 [ACK] Seq=19667743 Ack=361520501 Win=65535 Len=0
1,3.387273999998797,10.0.2.15,54.93.77.70,TLSv1.2,590,Application Data
1,3.3873919999987265,54.93.77.70,10.0.2.15,TCP,60,9001  >  34692 [ACK] Seq=361520501 Ack=19668279 Win=65535 Len=0
1,3.395477000000028,54.93.77.70,10.0.2.15,TLSv1.2,1502,Application Data [TCP segment of a reassembled PDU]
1,3.3955409999998665,10.0.2.15,54.93.77.70,TCP,54,34692  >  9001 [ACK] Seq=19668279 Ack=361521949 Win=65535 Len=0
1,3.3993269999991753,54.93.77.70,10.0.2.15,TLSv1.2,800,Application Data
1,3.417606999999407,54.93.77.70,10.0.2.15,TLSv1.2,1618,Application Data
1,3.4177029999991646,10.0.2.15,54.93.77.70,TCP,54,34692  >  9001 [ACK] Seq=19668279 Ack=361524259 Win=65535 Len=0
1,3.4276969999991707,54.93.77.70,10.0.2.15,TLSv1.2,7294,Application Data
1,3.427808999998888,10.0.2.15,54.93.77.70,TCP,54,34692  >  9001 [ACK] Seq=19668279 Ack=361531499 Win=65535 Len=0
1,3.4339209999998275,54.93.77.70,10.0.2.15,TLSv1.2,568,Application Data
1,3.435029999998733,54.93.77.70,10.0.2.15,TCP,2950,"9001  >  34692 [PSH, ACK] Seq=361532013 Ack=19668279 Win=65535 Len=2896 [TCP segment of a reassembled PDU]"
1,3.4350979999999254,10.0.2.15,54.93.77.70,TCP,54,34692  >  9001 [ACK] Seq=19668279 Ack=361534909 Win=65535 Len=0
1,3.436722999998892,62.210.85.178,10.0.2.15,TLSv1.2,590,Application Data
1,3.452166999999463,54.93.77.70,10.0.2.15,TLSv1.2,1314,"Application Data, Application Data"
1,3.479182999999466,10.0.2.15,62.210.85.178,TCP,54,35978  >  9001 [ACK] Seq=361850779 Ack=19588831 Win=65535 Len=0
1,3.4951810000002297,10.0.2.15,54.93.77.70,TCP,54,34692  >  9001 [ACK] Seq=19668279 Ack=361536169 Win=65535 Len=0
1,3.514382999999725,62.210.85.178,10.0.2.15,TLSv1.2,590,Application Data
1,3.5144639999998617,10.0.2.15,62.210.85.178,TCP,54,35978  >  9001 [ACK] Seq=361850779 Ack=19589367 Win=65535 Len=0
1,3.5188639999996667,54.93.77.70,10.0.2.15,TLSv1.2,590,Application Data
1,3.518946000000142,10.0.2.15,54.93.77.70,TCP,54,34692  >  9001 [ACK] Seq=19668279 Ack=361536705 Win=65535 Len=0
1,3.521151999999347,10.0.2.15,54.93.77.70,TLSv1.2,590,Application Data
1,3.521292999999787,54.93.77.70,10.0.2.15,TCP,60,9001  >  34692 [ACK] Seq=361536705 Ack=19668815 Win=65535 Len=0
1,3.5350129999987985,10.0.2.15,54.93.77.70,TLSv1.2,590,Application Data
1,3.535195999998905,54.93.77.70,10.0.2.15,TCP,60,9001  >  34692 [ACK] Seq=361536705 Ack=19669351 Win=65535 Len=0
1,3.565164999999979,54.93.77.70,10.0.2.15,TLSv1.2,590,Application Data
1,3.607210000000123,10.0.2.15,54.93.77.70,TCP,54,34692  >  9001 [ACK] Seq=19669351 Ack=361537241 Win=65535 Len=0
1,3.643022000000201,62.210.85.178,10.0.2.15,TLSv1.2,590,Application Data
1,3.6431089999987307,10.0.2.15,62.210.85.178,TCP,54,35978  >  9001 [ACK] Seq=361850779 Ack=19589903 Win=65535 Len=0
1,3.7947059999987687,62.210.85.178,10.0.2.15,TLSv1.2,590,Application Data
1,3.7947910000002594,10.0.2.15,62.210.85.178,TCP,54,35978  >  9001 [ACK] Seq=361850779 Ack=19590439 Win=65535 Len=0
1,4.002177000000302,62.210.85.178,10.0.2.15,TLSv1.2,590,Application Data
1,4.002259999999296,10.0.2.15,62.210.85.178,TCP,54,35978  >  9001 [ACK] Seq=361850779 Ack=19590975 Win=65535 Len=0
1,4.002591000000393,10.0.2.15,62.210.85.178,TLSv1.2,590,Application Data
1,4.002711999999519,62.210.85.178,10.0.2.15,TCP,60,9001  >  35978 [ACK] Seq=19590975 Ack=361851315 Win=65535 Len=0
1,4.511327000000165,54.93.77.70,10.0.2.15,TLSv1.2,590,Application Data
1,4.511405999999624,10.0.2.15,54.93.77.70,TCP,54,34692  >  9001 [ACK] Seq=19669351 Ack=361537777 Win=65535 Len=0
1,4.511822999998913,10.0.2.15,54.93.77.70,TLSv1.2,590,Application Data
1,4.511929000000237,54.93.77.70,10.0.2.15,TCP,60,9001  >  34692 [ACK] Seq=361537777 Ack=19669887 Win=65535 Len=0
1,4.64734800000042,62.210.85.178,10.0.2.15,TLSv1.2,590,Application Data
1,4.652437999999165,10.0.2.15,62.210.85.178,TLSv1.2,590,Application Data
1,4.652594999999565,62.210.85.178,10.0.2.15,TCP,60,9001  >  35978 [ACK] Seq=19591511 Ack=361851851 Win=65535 Len=0
1,4.663881000000401,10.0.2.15,62.210.85.178,TLSv1.2,4124,Application Data
1,4.663999000000331,10.0.2.15,62.210.85.178,TCP,2974,35978  >  9001 [ACK] Seq=361855921 Ack=19591511 Win=65535 Len=2920 [TCP segment of a reassembled PDU]
1,4.66404700000021,62.210.85.178,10.0.2.15,TCP,60,9001  >  35978 [ACK] Seq=19591511 Ack=361853311 Win=65535 Len=0
1,4.664059999999154,62.210.85.178,10.0.2.15,TCP,60,9001  >  35978 [ACK] Seq=19591511 Ack=361854771 Win=65535 Len=0
1,4.664064999999027,62.210.85.178,10.0.2.15,TCP,60,9001  >  35978 [ACK] Seq=19591511 Ack=361855921 Win=65535 Len=0
1,4.66407099999924,62.210.85.178,10.0.2.15,TCP,60,9001  >  35978 [ACK] Seq=19591511 Ack=361857381 Win=65535 Len=0
1,4.664112000000387,10.0.2.15,62.210.85.178,TLSv1.2,1204,Application Data
1,4.664150999999038,62.210.85.178,10.0.2.15,TCP,60,9001  >  35978 [ACK] Seq=19591511 Ack=361858841 Win=65535 Len=0
1,4.664158999999927,62.210.85.178,10.0.2.15,TCP,60,9001  >  35978 [ACK] Seq=19591511 Ack=361859991 Win=65535 Len=0
1,4.664199999999255,10.0.2.15,62.210.85.178,TLSv1.2,4124,Application Data
1,4.664238999999725,62.210.85.178,10.0.2.15,TCP,60,9001  >  35978 [ACK] Seq=19591511 Ack=361861451 Win=65535 Len=0
1,4.664246999998795,62.210.85.178,10.0.2.15,TCP,60,9001  >  35978 [ACK] Seq=19591511 Ack=361862911 Win=65535 Len=0
1,4.664251999998669,62.210.85.178,10.0.2.15,TCP,60,9001  >  35978 [ACK] Seq=19591511 Ack=361864061 Win=65535 Len=0
1,4.664291999999477,10.0.2.15,62.210.85.178,TLSv1.2,4124,Application Data
1,4.664330999999947,62.210.85.178,10.0.2.15,TCP,60,9001  >  35978 [ACK] Seq=19591511 Ack=361865521 Win=65535 Len=0
1,4.664338999999018,62.210.85.178,10.0.2.15,TCP,60,9001  >  35978 [ACK] Seq=19591511 Ack=361866981 Win=65535 Len=0
1,4.664343999998891,62.210.85.178,10.0.2.15,TCP,60,9001  >  35978 [ACK] Seq=19591511 Ack=361868131 Win=65535 Len=0
1,4.664380999998684,10.0.2.15,62.210.85.178,TLSv1.2,332,Application Data
1,4.664418000000296,62.210.85.178,10.0.2.15,TCP,60,9001  >  35978 [ACK] Seq=19591511 Ack=361868409 Win=65535 Len=0
1,4.664472000000387,10.0.2.15,62.210.85.178,TLSv1.2,3868,Application Data
