No.,Time,Source,Destination,Protocol,Length,Info
1,0.02099600000110513,10.0.2.15,54.93.77.70,TCP,54,34692  >  9001 [ACK] Seq=19963293 Ack=366835727 Win=65535 Len=0
1,0.13444300000082876,10.0.2.15,54.93.77.70,TLSv1.2,590,Application Data
1,0.13464600000042992,54.93.77.70,10.0.2.15,TCP,60,9001  >  34692 [ACK] Seq=366835727 Ack=19963829 Win=65535 Len=0
1,0.3191950000000361,62.210.85.178,10.0.2.15,TLSv1.2,590,Application Data
1,0.31956499999978405,10.0.2.15,62.210.85.178,TLSv1.2,590,Application Data
1,0.31967100000110804,62.210.85.178,10.0.2.15,TCP,60,9001  >  35978 [ACK] Seq=19884023 Ack=367148129 Win=65535 Len=0
1,0.5228889999998501,54.93.77.70,10.0.2.15,TLSv1.2,590,Application Data
1,0.5231880000010278,10.0.2.15,54.93.77.70,TCP,54,34692  >  9001 [ACK] Seq=19963829 Ack=366836263 Win=65535 Len=0
1,0.5247190000009141,10.0.2.15,54.93.77.70,TLSv1.2,1618,Application Data
1,0.5252970000001369,54.93.77.70,10.0.2.15,TCP,60,9001  >  34692 [ACK] Seq=366836263 Ack=19965289 Win=65535 Len=0
1,0.5254000000004453,54.93.77.70,10.0.2.15,TCP,60,9001  >  34692 [ACK] Seq=366836263 Ack=19965393 Win=65535 Len=0
1,0.7286280000007537,62.210.85.178,10.0.2.15,TLSv1.2,1618,Application Data
1,0.7287850000011531,10.0.2.15,62.210.85.178,TCP,54,35978  >  9001 [ACK] Seq=367148129 Ack=19885587 Win=65535 Len=0
1,0.750876000000062,10.0.2.15,62.210.85.178,TLSv1.2,590,Application Data
1,0.7510380000003352,62.210.85.178,10.0.2.15,TCP,60,9001  >  35978 [ACK] Seq=19885587 Ack=367148665 Win=65535 Len=0
1,0.7616429999998218,10.0.2.15,62.210.85.178,TLSv1.2,1618,Application Data
1,0.7617790000003879,62.210.85.178,10.0.2.15,TCP,60,9001  >  35978 [ACK] Seq=19885587 Ack=367150125 Win=65535 Len=0
1,0.7617970000010246,62.210.85.178,10.0.2.15,TCP,60,9001  >  35978 [ACK] Seq=19885587 Ack=367150229 Win=65535 Len=0
1,0.8652240000010352,54.93.77.70,10.0.2.15,TLSv1.2,2132,Application Data
1,0.8653500000000349,10.0.2.15,54.93.77.70,TCP,54,34692  >  9001 [ACK] Seq=19965393 Ack=366838341 Win=65535 Len=0
1,0.867379000001165,10.0.2.15,54.93.77.70,TLSv1.2,590,Application Data
1,0.8675309999998717,54.93.77.70,10.0.2.15,TCP,60,9001  >  34692 [ACK] Seq=366838341 Ack=19965929 Win=65535 Len=0
1,0.9714330000006157,62.210.85.178,10.0.2.15,TLSv1.2,590,Application Data
1,0.9718940000002476,10.0.2.15,62.210.85.178,TLSv1.2,590,Application Data
1,0.9720030000007682,62.210.85.178,10.0.2.15,TCP,60,9001  >  35978 [ACK] Seq=19886123 Ack=367150765 Win=65535 Len=0
1,1.0804879999996047,54.93.77.70,10.0.2.15,TLSv1.2,590,Application Data
1,1.0808850000012171,10.0.2.15,54.93.77.70,TLSv1.2,590,Application Data
1,1.0810050000000047,54.93.77.70,10.0.2.15,TCP,60,9001  >  34692 [ACK] Seq=366838877 Ack=19966465 Win=65535 Len=0
1,1.1927919999998267,62.210.85.178,10.0.2.15,TLSv1.2,590,Application Data
1,1.1967189999995753,10.0.2.15,62.210.85.178,TLSv1.2,590,Application Data
1,1.1968780000006518,62.210.85.178,10.0.2.15,TCP,60,9001  >  35978 [ACK] Seq=19886659 Ack=367151301 Win=65535 Len=0
1,1.210283000000345,10.0.2.15,62.210.85.178,TLSv1.2,4124,Application Data
1,1.2103879999995115,10.0.2.15,62.210.85.178,TCP,2974,35978  >  9001 [ACK] Seq=367155371 Ack=19886659 Win=65535 Len=2920 [TCP segment of a reassembled PDU]
1,1.21042800000032,62.210.85.178,10.0.2.15,TCP,60,9001  >  35978 [ACK] Seq=19886659 Ack=367152761 Win=65535 Len=0
1,1.2104400000007445,62.210.85.178,10.0.2.15,TCP,60,9001  >  35978 [ACK] Seq=19886659 Ack=367154221 Win=65535 Len=0
1,1.2104440000002796,62.210.85.178,10.0.2.15,TCP,60,9001  >  35978 [ACK] Seq=19886659 Ack=367155371 Win=65535 Len=0
1,1.2104470000012952,62.210.85.178,10.0.2.15,TCP,60,9001  >  35978 [ACK] Seq=19886659 Ack=367156831 Win=65535 Len=0
1,1.2104490000001533,62.210.85.178,10.0.2.15,TCP,60,9001  >  35978 [ACK] Seq=19886659 Ack=367158291 Win=65535 Len=0
1,1.2104849999996077,10.0.2.15,62.210.85.178,TLSv1.2,1204,Application Data
1,1.2105179999998654,62.210.85.178,10.0.2.15,TCP,60,9001  >  35978 [ACK] Seq=19886659 Ack=367159441 Win=65535 Len=0
1,1.2105670000000828,10.0.2.15,62.210.85.178,TLSv1.2,4124,Application Data
1,1.2106020000010176,62.210.85.178,10.0.2.15,TCP,60,9001  >  35978 [ACK] Seq=19886659 Ack=367160901 Win=65535 Len=0
1,1.210610000000088,62.210.85.178,10.0.2.15,TCP,60,9001  >  35978 [ACK] Seq=19886659 Ack=367162361 Win=65535 Len=0
1,1.210613999999623,62.210.85.178,10.0.2.15,TCP,60,9001  >  35978 [ACK] Seq=19886659 Ack=367163511 Win=65535 Len=0
1,1.2106519999997545,10.0.2.15,62.210.85.178,TLSv1.2,4124,Application Data
1,1.210689999999886,62.210.85.178,10.0.2.15,TCP,60,9001  >  35978 [ACK] Seq=19886659 Ack=367164971 Win=65535 Len=0
1,1.2106970000004367,62.210.85.178,10.0.2.15,TCP,60,9001  >  35978 [ACK] Seq=19886659 Ack=367166431 Win=65535 Len=0
1,1.2107520000008662,10.0.2.15,62.210.85.178,TLSv1.2,2974,Application Data
1,1.2107880000003206,62.210.85.178,10.0.2.15,TCP,60,9001  >  35978 [ACK] Seq=19886659 Ack=367167581 Win=65535 Len=0
1,1.21079600000121,62.210.85.178,10.0.2.15,TCP,60,9001  >  35978 [ACK] Seq=19886659 Ack=367169041 Win=65535 Len=0
1,1.2107990000004065,62.210.85.178,10.0.2.15,TCP,60,9001  >  35978 [ACK] Seq=19886659 Ack=367170501 Win=65535 Len=0
1,1.210826000000452,10.0.2.15,62.210.85.178,TLSv1.2,1226,Application Data
1,1.2108590000007098,62.210.85.178,10.0.2.15,TCP,60,9001  >  35978 [ACK] Seq=19886659 Ack=367171673 Win=65535 Len=0
1,1.2108980000011798,10.0.2.15,62.210.85.178,TLSv1.2,4124,Application Data
1,1.2109340000006341,62.210.85.178,10.0.2.15,TCP,60,9001  >  35978 [ACK] Seq=19886659 Ack=367173133 Win=65535 Len=0
1,1.2109410000011849,62.210.85.178,10.0.2.15,TCP,60,9001  >  35978 [ACK] Seq=19886659 Ack=367174593 Win=65535 Len=0
1,1.2109440000003815,62.210.85.178,10.0.2.15,TCP,60,9001  >  35978 [ACK] Seq=19886659 Ack=367175743 Win=65535 Len=0
1,1.2109799999998359,10.0.2.15,62.210.85.178,TLSv1.2,2002,Application Data
1,1.2110140000004321,62.210.85.178,10.0.2.15,TCP,60,9001  >  35978 [ACK] Seq=19886659 Ack=367177203 Win=65535 Len=0
1,1.2110200000006444,62.210.85.178,10.0.2.15,TCP,60,9001  >  35978 [ACK] Seq=19886659 Ack=367177691 Win=65535 Len=0
1,1.3123620000005758,54.93.77.70,10.0.2.15,TLSv1.2,590,Application Data
1,1.3535069999998086,10.0.2.15,54.93.77.70,TCP,54,34692  >  9001 [ACK] Seq=19966465 Ack=366839413 Win=65535 Len=0
1,1.3667660000010073,54.93.77.70,10.0.2.15,TCP,2950,"9001  >  34692 [PSH, ACK] Seq=366839413 Ack=19966465 Win=65535 Len=2896 [TCP segment of a reassembled PDU]"
1,1.366825000000972,10.0.2.15,54.93.77.70,TCP,54,34692  >  9001 [ACK] Seq=19966465 Ack=366842309 Win=65535 Len=0
1,1.3716440000007424,54.93.77.70,10.0.2.15,TLSv1.2,778,Application Data
1,1.3716910000002827,10.0.2.15,54.93.77.70,TCP,54,34692  >  9001 [ACK] Seq=19966465 Ack=366843033 Win=65535 Len=0
1,1.3800680000003922,54.93.77.70,10.0.2.15,TCP,2950,"9001  >  34692 [PSH, ACK] Seq=366843033 Ack=19966465 Win=65535 Len=2896 [TCP segment of a reassembled PDU]"
1,1.3801190000012866,10.0.2.15,54.93.77.70,TCP,54,34692  >  9001 [ACK] Seq=19966465 Ack=366845929 Win=65535 Len=0
1,1.3818050000008952,54.93.77.70,10.0.2.15,TLSv1.2,7294,"Application Data, Application Data"
1,1.381849000001239,10.0.2.15,54.93.77.70,TCP,54,34692  >  9001 [ACK] Seq=19966465 Ack=366853169 Win=65535 Len=0
1,1.3884030000008352,54.93.77.70,10.0.2.15,TLSv1.2,1292,Application Data
1,1.3884450000005018,10.0.2.15,54.93.77.70,TCP,54,34692  >  9001 [ACK] Seq=19966465 Ack=366854407 Win=65535 Len=0
1,1.405179000001226,54.93.77.70,10.0.2.15,TLSv1.2,590,Application Data
1,1.4052560000000085,10.0.2.15,54.93.77.70,TCP,54,34692  >  9001 [ACK] Seq=19966465 Ack=366854943 Win=65535 Len=0
1,1.4076619999996183,54.93.77.70,10.0.2.15,TCP,2950,"9001  >  34692 [PSH, ACK] Seq=366854943 Ack=19966465 Win=65535 Len=2896 [TCP segment of a reassembled PDU]"
1,1.4077109999998356,10.0.2.15,54.93.77.70,TCP,54,34692  >  9001 [ACK] Seq=19966465 Ack=366857839 Win=65535 Len=0
1,1.4167670000006183,54.93.77.70,10.0.2.15,TLSv1.2,7294,"Application Data, Application Data, Application Data"
1,1.4168250000002445,10.0.2.15,54.93.77.70,TCP,54,34692  >  9001 [ACK] Seq=19966465 Ack=366865079 Win=65535 Len=0
1,1.4209929999997257,54.93.77.70,10.0.2.15,TLSv1.2,800,Application Data
1,1.4210359999997308,10.0.2.15,54.93.77.70,TCP,54,34692  >  9001 [ACK] Seq=19966465 Ack=366865825 Win=65535 Len=0
1,1.4212210000005143,10.0.2.15,54.93.77.70,TLSv1.2,590,Application Data
1,1.4213390000004438,54.93.77.70,10.0.2.15,TCP,60,9001  >  34692 [ACK] Seq=366865825 Ack=19967001 Win=65535 Len=0
1,1.4306140000007872,10.0.2.15,54.93.77.70,TLSv1.2,590,Application Data
1,1.430765999999494,54.93.77.70,10.0.2.15,TCP,60,9001  >  34692 [ACK] Seq=366865825 Ack=19967537 Win=65535 Len=0
1,1.6497070000004896,62.210.85.178,10.0.2.15,TLSv1.2,590,Application Data
1,1.6934560000008787,10.0.2.15,62.210.85.178,TCP,54,35978  >  9001 [ACK] Seq=367177691 Ack=19887195 Win=65535 Len=0
1,1.7083199999997305,62.210.85.178,10.0.2.15,TLSv1.2,590,Application Data
1,1.708399000001009,10.0.2.15,62.210.85.178,TCP,54,35978  >  9001 [ACK] Seq=367177691 Ack=19887731 Win=65535 Len=0
1,1.7088860000003478,10.0.2.15,62.210.85.178,TLSv1.2,590,Application Data
1,1.708980999999767,62.210.85.178,10.0.2.15,TCP,60,9001  >  35978 [ACK] Seq=19887731 Ack=367178227 Win=65535 Len=0
1,1.8542710000001534,54.93.77.70,10.0.2.15,TLSv1.2,590,Application Data
1,1.8547319999997853,10.0.2.15,54.93.77.70,TLSv1.2,590,Application Data
1,1.8548360000004323,54.93.77.70,10.0.2.15,TCP,60,9001  >  34692 [ACK] Seq=366866361 Ack=19968073 Win=65535 Len=0
1,2.058559000000969,62.210.85.178,10.0.2.15,TLSv1.2,590,Application Data
1,2.062643000001117,10.0.2.15,62.210.85.178,TLSv1.2,590,Application Data
1,2.062801000000036,62.210.85.178,10.0.2.15,TCP,60,9001  >  35978 [ACK] Seq=19888267 Ack=367178763 Win=65535 Len=0
1,2.0741070000003674,10.0.2.15,62.210.85.178,TLSv1.2,4124,Application Data
1,2.074203000000125,10.0.2.15,62.210.85.178,TCP,2974,35978  >  9001 [ACK] Seq=367182833 Ack=19888267 Win=65535 Len=2920 [TCP segment of a reassembled PDU]
1,2.0742430000009335,62.210.85.178,10.0.2.15,TCP,60,9001  >  35978 [ACK] Seq=19888267 Ack=367180223 Win=65535 Len=0
1,2.0742559999998775,62.210.85.178,10.0.2.15,TCP,60,9001  >  35978 [ACK] Seq=19888267 Ack=367181683 Win=65535 Len=0
1,2.0742600000012317,62.210.85.178,10.0.2.15,TCP,60,9001  >  35978 [ACK] Seq=19888267 Ack=367182833 Win=65535 Len=0
1,2.0742620000000898,62.210.85.178,10.0.2.15,TCP,60,9001  >  35978 [ACK] Seq=19888267 Ack=367184293 Win=65535 Len=0
1,2.0742650000011054,62.210.85.178,10.0.2.15,TCP,60,9001  >  35978 [ACK] Seq=19888267 Ack=367185753 Win=65535 Len=0
1,2.0742989999998827,10.0.2.15,62.210.85.178,TLSv1.2,1204,Application Data
1,2.0743320000001404,62.210.85.178,10.0.2.15,TCP,60,9001  >  35978 [ACK] Seq=19888267 Ack=367186903 Win=65535 Len=0
1,2.0743770000008226,10.0.2.15,62.210.85.178,TLSv1.2,4124,Application Data
1,2.0744109999996,62.210.85.178,10.0.2.15,TCP,60,9001  >  35978 [ACK] Seq=19888267 Ack=367188363 Win=65535 Len=0
1,2.074419000000489,62.210.85.178,10.0.2.15,TCP,60,9001  >  35978 [ACK] Seq=19888267 Ack=367189823 Win=65535 Len=0
1,2.0744230000000243,62.210.85.178,10.0.2.15,TCP,60,9001  >  35978 [ACK] Seq=19888267 Ack=367190973 Win=65535 Len=0
1,2.0744610000001558,10.0.2.15,62.210.85.178,TLSv1.2,4124,Application Data
1,2.0744960000010906,62.210.85.178,10.0.2.15,TCP,60,9001  >  35978 [ACK] Seq=19888267 Ack=367192433 Win=65535 Len=0
1,2.0745029999998224,62.210.85.178,10.0.2.15,TCP,60,9001  >  35978 [ACK] Seq=19888267 Ack=367193893 Win=65535 Len=0
1,2.074543000000631,62.210.85.178,10.0.2.15,TCP,60,9001  >  35978 [ACK] Seq=19888267 Ack=367195043 Win=65535 Len=0
1,2.0745779999997467,10.0.2.15,62.210.85.178,TLSv1.2,332,Application Data
1,2.074609999999666,62.210.85.178,10.0.2.15,TCP,60,9001  >  35978 [ACK] Seq=19888267 Ack=367195321 Win=65535 Len=0
1,2.074663999999757,10.0.2.15,62.210.85.178,TLSv1.2,3868,Application Data
1,2.07470099999955,62.210.85.178,10.0.2.15,TCP,60,9001  >  35978 [ACK] Seq=19888267 Ack=367196781 Win=65535 Len=0
1,2.074706999999762,62.210.85.178,10.0.2.15,TCP,60,9001  >  35978 [ACK] Seq=19888267 Ack=367198241 Win=65535 Len=0
1,2.0747100000007777,62.210.85.178,10.0.2.15,TCP,60,9001  >  35978 [ACK] Seq=19888267 Ack=367199135 Win=65535 Len=0
1,2.0747470000005706,10.0.2.15,62.210.85.178,TLSv1.2,4124,Application Data
1,2.0747819999996864,62.210.85.178,10.0.2.15,TCP,60,9001  >  35978 [ACK] Seq=19888267 Ack=367200595 Win=65535 Len=0
1,2.0747879999998986,62.210.85.178,10.0.2.15,TCP,60,9001  >  35978 [ACK] Seq=19888267 Ack=367202055 Win=65535 Len=0
1,2.074791000000914,62.210.85.178,10.0.2.15,TCP,60,9001  >  35978 [ACK] Seq=19888267 Ack=367203205 Win=65535 Len=0
1,2.07482600000003,10.0.2.15,62.210.85.178,TLSv1.2,3030,Application Data
1,2.0748600000006263,62.210.85.178,10.0.2.15,TCP,60,9001  >  35978 [ACK] Seq=19888267 Ack=367204665 Win=65535 Len=0
1,2.0748660000008385,62.210.85.178,10.0.2.15,TCP,60,9001  >  35978 [ACK] Seq=19888267 Ack=367206125 Win=65535 Len=0
1,2.074869000000035,62.210.85.178,10.0.2.15,TCP,60,9001  >  35978 [ACK] Seq=19888267 Ack=367206181 Win=65535 Len=0
1,2.0840619999999035,10.0.2.15,62.210.85.178,TLSv1.2,1104,Application Data
1,2.084111000000121,62.210.85.178,10.0.2.15,TCP,60,9001  >  35978 [ACK] Seq=19888267 Ack=367207231 Win=65535 Len=0
1,2.158093000000008,54.93.77.70,10.0.2.15,TLSv1.2,590,Application Data
1,2.1880500000006577,54.93.77.70,10.0.2.15,TCP,2950,"9001  >  34692 [PSH, ACK] Seq=366866897 Ack=19968073 Win=65535 Len=2896 [TCP segment of a reassembled PDU]"
1,2.188127000001259,10.0.2.15,54.93.77.70,TCP,54,34692  >  9001 [ACK] Seq=19968073 Ack=366869793 Win=65535 Len=0
1,2.1888419999995676,54.93.77.70,10.0.2.15,TLSv1.2,4912,"Application Data, Application Data"
1,2.188901999999871,10.0.2.15,54.93.77.70,TCP,54,34692  >  9001 [ACK] Seq=19968073 Ack=366874651 Win=65535 Len=0
1,2.225999000000229,54.93.77.70,10.0.2.15,TLSv1.2,5846,Application Data
1,2.2261170000001584,10.0.2.15,54.93.77.70,TCP,54,34692  >  9001 [ACK] Seq=19968073 Ack=366880443 Win=65535 Len=0
1,2.2261450000005425,54.93.77.70,10.0.2.15,TLSv1.2,6150,"Application Data, Application Data"
1,2.22623300000123,10.0.2.15,54.93.77.70,TCP,54,34692  >  9001 [ACK] Seq=19968073 Ack=366886539 Win=65535 Len=0
1,2.2264800000011746,10.0.2.15,54.93.77.70,TLSv1.2,590,Application Data
1,2.226556999999957,54.93.77.70,10.0.2.15,TCP,60,9001  >  34692 [ACK] Seq=366886539 Ack=19968609 Win=65535 Len=0
1,2.2316829999999754,54.93.77.70,10.0.2.15,TCP,2950,"9001  >  34692 [PSH, ACK] Seq=366886539 Ack=19968609 Win=65535 Len=2896 [TCP segment of a reassembled PDU]"
1,2.2317330000005313,10.0.2.15,54.93.77.70,TCP,54,34692  >  9001 [ACK] Seq=19968609 Ack=366889435 Win=65535 Len=0
1,2.2427950000001147,54.93.77.70,10.0.2.15,TLSv1.2,4398,"Application Data, Application Data"
1,2.2428429999999935,10.0.2.15,54.93.77.70,TCP,54,34692  >  9001 [ACK] Seq=19968609 Ack=366893779 Win=65535 Len=0
1,2.24306500000057,10.0.2.15,54.93.77.70,TLSv1.2,590,Application Data
1,2.243158000001131,54.93.77.70,10.0.2.15,TCP,60,9001  >  34692 [ACK] Seq=366893779 Ack=19969145 Win=65535 Len=0
1,2.3251689999997325,54.93.77.70,10.0.2.15,TLSv1.2,1618,Application Data
1,2.325306000000637,10.0.2.15,54.93.77.70,TCP,54,34692  >  9001 [ACK] Seq=19969145 Ack=366895343 Win=65535 Len=0
1,2.3276870000008785,10.0.2.15,54.93.77.70,TLSv1.2,590,Application Data
1,2.327842000000601,54.93.77.70,10.0.2.15,TCP,60,9001  >  34692 [ACK] Seq=366895343 Ack=19969681 Win=65535 Len=0
1,2.3473350000003848,62.210.85.178,10.0.2.15,TLSv1.2,590,Application Data
1,2.389447999999902,10.0.2.15,62.210.85.178,TCP,54,35978  >  9001 [ACK] Seq=367207231 Ack=19888803 Win=65535 Len=0
1,2.392511000000013,62.210.85.178,10.0.2.15,TLSv1.2,590,Application Data
1,2.3925749999998516,10.0.2.15,62.210.85.178,TCP,54,35978  >  9001 [ACK] Seq=367207231 Ack=19889339 Win=65535 Len=0
1,2.467746000000261,62.210.85.178,10.0.2.15,TLSv1.2,590,Application Data
1,2.467822000000524,10.0.2.15,62.210.85.178,TCP,54,35978  >  9001 [ACK] Seq=367207231 Ack=19889875 Win=65535 Len=0
1,2.4683590000004187,10.0.2.15,62.210.85.178,TLSv1.2,590,Application Data
1,2.468496999999843,62.210.85.178,10.0.2.15,TCP,60,9001  >  35978 [ACK] Seq=19889875 Ack=367207767 Win=65535 Len=0
1,2.6733340000009775,152.89.104.206,10.0.2.15,TLSv1.3,590,Application Data
1,2.6734310000010737,10.0.2.15,152.89.104.206,TCP,54,47334  >  9001 [ACK] Seq=12743 Ack=18896 Win=65392 Len=0
1,2.6850740000008955,54.93.77.70,10.0.2.15,TLSv1.2,590,Application Data
1,2.6853830000000016,10.0.2.15,54.93.77.70,TLSv1.2,590,Application Data
1,2.6855480000012903,54.93.77.70,10.0.2.15,TCP,60,9001  >  34692 [ACK] Seq=366895879 Ack=19970217 Win=65535 Len=0
1,2.878381000000445,62.210.85.178,10.0.2.15,TLSv1.2,590,Application Data
1,2.8888690000003407,10.0.2.15,62.210.85.178,TLSv1.2,590,Application Data
1,2.8890709999996034,62.210.85.178,10.0.2.15,TCP,60,9001  >  35978 [ACK] Seq=19890411 Ack=367208303 Win=65535 Len=0
1,2.9024090000002616,10.0.2.15,62.210.85.178,TLSv1.2,4124,Application Data
1,2.9026080000003276,62.210.85.178,10.0.2.15,TCP,60,9001  >  35978 [ACK] Seq=19890411 Ack=367209763 Win=65535 Len=0
1,2.9026260000009643,62.210.85.178,10.0.2.15,TCP,60,9001  >  35978 [ACK] Seq=19890411 Ack=367211223 Win=65535 Len=0
1,2.902631000000838,62.210.85.178,10.0.2.15,TCP,60,9001  >  35978 [ACK] Seq=19890411 Ack=367212373 Win=65535 Len=0
1,2.902674000000843,10.0.2.15,62.210.85.178,TCP,2974,35978  >  9001 [ACK] Seq=367212373 Ack=19890411 Win=65535 Len=2920 [TCP segment of a reassembled PDU]
1,2.9027380000006815,10.0.2.15,62.210.85.178,TLSv1.2,1204,Application Data
1,2.902787000000899,62.210.85.178,10.0.2.15,TCP,60,9001  >  35978 [ACK] Seq=19890411 Ack=367213833 Win=65535 Len=0
1,2.9027939999996306,62.210.85.178,10.0.2.15,TCP,60,9001  >  35978 [ACK] Seq=19890411 Ack=367215293 Win=65535 Len=0
1,2.9027989999995043,62.210.85.178,10.0.2.15,TCP,60,9001  >  35978 [ACK] Seq=19890411 Ack=367216443 Win=65535 Len=0
1,2.90284900000006,10.0.2.15,62.210.85.178,TLSv1.2,4124,Application Data
1,2.902928999999858,62.210.85.178,10.0.2.15,TCP,60,9001  >  35978 [ACK] Seq=19890411 Ack=367217903 Win=65535 Len=0
1,2.902936000000409,62.210.85.178,10.0.2.15,TCP,60,9001  >  35978 [ACK] Seq=19890411 Ack=367219363 Win=65535 Len=0
1,2.902939999999944,62.210.85.178,10.0.2.15,TCP,60,9001  >  35978 [ACK] Seq=19890411 Ack=367220513 Win=65535 Len=0
1,2.902964000000793,10.0.2.15,62.210.85.178,TCP,2974,35978  >  9001 [ACK] Seq=367220513 Ack=19890411 Win=65535 Len=2920 [TCP segment of a reassembled PDU]
1,2.9030089999996562,62.210.85.178,10.0.2.15,TCP,60,9001  >  35978 [ACK] Seq=19890411 Ack=367221973 Win=65535 Len=0
1,2.9030149999998685,62.210.85.178,10.0.2.15,TCP,60,9001  >  35978 [ACK] Seq=19890411 Ack=367223433 Win=65535 Len=0
1,2.9030500000008033,10.0.2.15,62.210.85.178,TLSv1.2,1204,Application Data
1,2.903109000000768,62.210.85.178,10.0.2.15,TCP,60,9001  >  35978 [ACK] Seq=19890411 Ack=367224583 Win=65535 Len=0
1,2.903153999999631,10.0.2.15,62.210.85.178,TLSv1.2,332,Application Data
1,2.9031919999997626,62.210.85.178,10.0.2.15,TCP,60,9001  >  35978 [ACK] Seq=19890411 Ack=367224861 Win=65535 Len=0
1,2.9032569999999396,10.0.2.15,62.210.85.178,TLSv1.2,3868,Application Data
1,2.903297000000748,62.210.85.178,10.0.2.15,TCP,60,9001  >  35978 [ACK] Seq=19890411 Ack=367226321 Win=65535 Len=0
1,2.903312000000369,62.210.85.178,10.0.2.15,TCP,60,9001  >  35978 [ACK] Seq=19890411 Ack=367227781 Win=65535 Len=0
1,2.903317000000243,62.210.85.178,10.0.2.15,TCP,60,9001  >  35978 [ACK] Seq=19890411 Ack=367228675 Win=65535 Len=0
1,2.90336600000046,10.0.2.15,62.210.85.178,TLSv1.2,4124,Application Data
1,2.9034069999997882,62.210.85.178,10.0.2.15,TCP,60,9001  >  35978 [ACK] Seq=19890411 Ack=367230135 Win=65535 Len=0
1,2.9034130000000005,62.210.85.178,10.0.2.15,TCP,60,9001  >  35978 [ACK] Seq=19890411 Ack=367231595 Win=65535 Len=0
1,2.903417999999874,62.210.85.178,10.0.2.15,TCP,60,9001  >  35978 [ACK] Seq=19890411 Ack=367232745 Win=65535 Len=0
1,2.9034609999998793,10.0.2.15,62.210.85.178,TLSv1.2,3030,Application Data
1,2.9035000000003492,62.210.85.178,10.0.2.15,TCP,60,9001  >  35978 [ACK] Seq=19890411 Ack=367234205 Win=65535 Len=0
1,2.9035070000009,62.210.85.178,10.0.2.15,TCP,60,9001  >  35978 [ACK] Seq=19890411 Ack=367235665 Win=65535 Len=0
1,2.903511000000435,62.210.85.178,10.0.2.15,TCP,60,9001  >  35978 [ACK] Seq=19890411 Ack=367235721 Win=65535 Len=0
1,2.9127230000012787,10.0.2.15,62.210.85.178,TLSv1.2,4124,Application Data
1,2.9128030000010767,10.0.2.15,62.210.85.178,TCP,2974,35978  >  9001 [ACK] Seq=367239791 Ack=19890411 Win=65535 Len=2920 [TCP segment of a reassembled PDU]
1,2.9128400000008696,62.210.85.178,10.0.2.15,TCP,60,9001  >  35978 [ACK] Seq=19890411 Ack=367237181 Win=65535 Len=0
1,2.91284799999994,62.210.85.178,10.0.2.15,TCP,60,9001  >  35978 [ACK] Seq=19890411 Ack=367238641 Win=65535 Len=0
1,2.912852000001294,62.210.85.178,10.0.2.15,TCP,60,9001  >  35978 [ACK] Seq=19890411 Ack=367239791 Win=65535 Len=0
1,2.9128570000011678,62.210.85.178,10.0.2.15,TCP,60,9001  >  35978 [ACK] Seq=19890411 Ack=367241251 Win=65535 Len=0
1,2.912861000000703,62.210.85.178,10.0.2.15,TCP,60,9001  >  35978 [ACK] Seq=19890411 Ack=367242711 Win=65535 Len=0
1,2.9128990000008343,10.0.2.15,62.210.85.178,TLSv1.2,1204,Application Data
1,2.912964999999531,10.0.2.15,62.210.85.178,TCP,2974,35978  >  9001 [ACK] Seq=367243861 Ack=19890411 Win=65535 Len=2920 [TCP segment of a reassembled PDU]
1,2.9130029999996623,62.210.85.178,10.0.2.15,TCP,60,9001  >  35978 [ACK] Seq=19890411 Ack=367243861 Win=65535 Len=0
1,2.9130089999998745,62.210.85.178,10.0.2.15,TCP,60,9001  >  35978 [ACK] Seq=19890411 Ack=367245321 Win=65535 Len=0
1,2.913013999999748,62.210.85.178,10.0.2.15,TCP,60,9001  >  35978 [ACK] Seq=19890411 Ack=367246781 Win=65535 Len=0
1,2.913047000000006,10.0.2.15,62.210.85.178,TLSv1.2,1204,Application Data
1,2.913115999999718,10.0.2.15,62.210.85.178,TCP,2974,35978  >  9001 [ACK] Seq=367247931 Ack=19890411 Win=65535 Len=2920 [TCP segment of a reassembled PDU]
1,2.913152999999511,62.210.85.178,10.0.2.15,TCP,60,9001  >  35978 [ACK] Seq=19890411 Ack=367247931 Win=65535 Len=0
1,2.9131600000000617,62.210.85.178,10.0.2.15,TCP,60,9001  >  35978 [ACK] Seq=19890411 Ack=367249391 Win=65535 Len=0
1,2.913163999999597,62.210.85.178,10.0.2.15,TCP,60,9001  >  35978 [ACK] Seq=19890411 Ack=367250851 Win=65535 Len=0
1,2.9131950000009965,10.0.2.15,62.210.85.178,TLSv1.2,1204,Application Data
1,2.913287000001219,10.0.2.15,62.210.85.178,TLSv1.2,2974,Application Data
1,2.9133099999999104,62.210.85.178,10.0.2.15,TCP,60,9001  >  35978 [ACK] Seq=19890411 Ack=367252001 Win=65535 Len=0
1,2.91334100000131,10.0.2.15,62.210.85.178,TLSv1.2,1226,Application Data
1,2.913394999999582,62.210.85.178,10.0.2.15,TCP,60,9001  >  35978 [ACK] Seq=19890411 Ack=367253461 Win=65535 Len=0
1,2.913408000000345,62.210.85.178,10.0.2.15,TCP,60,9001  >  35978 [ACK] Seq=19890411 Ack=367254921 Win=65535 Len=0
1,2.9134140000005573,62.210.85.178,10.0.2.15,TCP,60,9001  >  35978 [ACK] Seq=19890411 Ack=367256093 Win=65535 Len=0
1,2.9134699999995064,10.0.2.15,62.210.85.178,TLSv1.2,4124,Application Data
1,2.9135170000008657,62.210.85.178,10.0.2.15,TCP,60,9001  >  35978 [ACK] Seq=19890411 Ack=367257553 Win=65535 Len=0
1,2.9135239999995974,62.210.85.178,10.0.2.15,TCP,60,9001  >  35978 [ACK] Seq=19890411 Ack=367259013 Win=65535 Len=0
1,2.91352900000129,62.210.85.178,10.0.2.15,TCP,60,9001  >  35978 [ACK] Seq=19890411 Ack=367260163 Win=65535 Len=0
1,2.913575000000492,10.0.2.15,62.210.85.178,TLSv1.2,3030,Application Data
1,2.9136150000013004,62.210.85.178,10.0.2.15,TCP,60,9001  >  35978 [ACK] Seq=19890411 Ack=367261623 Win=65535 Len=0
1,2.913622000000032,62.210.85.178,10.0.2.15,TCP,60,9001  >  35978 [ACK] Seq=19890411 Ack=367263083 Win=65535 Len=0
1,2.9136259999995673,62.210.85.178,10.0.2.15,TCP,60,9001  >  35978 [ACK] Seq=19890411 Ack=367263139 Win=65535 Len=0
1,2.9260880000001634,10.0.2.15,62.210.85.178,TLSv1.2,4124,Application Data
1,2.9261870000009367,10.0.2.15,62.210.85.178,TCP,2974,35978  >  9001 [ACK] Seq=367267209 Ack=19890411 Win=65535 Len=2920 [TCP segment of a reassembled PDU]
1,2.926226999999926,62.210.85.178,10.0.2.15,TCP,60,9001  >  35978 [ACK] Seq=19890411 Ack=367264599 Win=65535 Len=0
1,2.926236000001154,62.210.85.178,10.0.2.15,TCP,60,9001  >  35978 [ACK] Seq=19890411 Ack=367266059 Win=65535 Len=0
1,2.9262410000010277,62.210.85.178,10.0.2.15,TCP,60,9001  >  35978 [ACK] Seq=19890411 Ack=367267209 Win=65535 Len=0
1,2.926245000000563,62.210.85.178,10.0.2.15,TCP,60,9001  >  35978 [ACK] Seq=19890411 Ack=367268669 Win=65535 Len=0
1,2.926249000000098,62.210.85.178,10.0.2.15,TCP,60,9001  >  35978 [ACK] Seq=19890411 Ack=367270129 Win=65535 Len=0
1,2.926290000001245,10.0.2.15,62.210.85.178,TLSv1.2,1204,Application Data
1,2.9263609999998152,10.0.2.15,62.210.85.178,TCP,2974,35978  >  9001 [ACK] Seq=367271279 Ack=19890411 Win=65535 Len=2920 [TCP segment of a reassembled PDU]
1,2.926400000000285,62.210.85.178,10.0.2.15,TCP,60,9001  >  35978 [ACK] Seq=19890411 Ack=367271279 Win=65535 Len=0
1,2.926407000000836,62.210.85.178,10.0.2.15,TCP,60,9001  >  35978 [ACK] Seq=19890411 Ack=367272739 Win=65535 Len=0
1,2.926411000000371,62.210.85.178,10.0.2.15,TCP,60,9001  >  35978 [ACK] Seq=19890411 Ack=367274199 Win=65535 Len=0
1,2.9264450000009674,10.0.2.15,62.210.85.178,TLSv1.2,1204,Application Data
1,2.926509000000806,10.0.2.15,62.210.85.178,TCP,2974,35978  >  9001 [ACK] Seq=367275349 Ack=19890411 Win=65535 Len=2920 [TCP segment of a reassembled PDU]
1,2.926548000001276,62.210.85.178,10.0.2.15,TCP,60,9001  >  35978 [ACK] Seq=19890411 Ack=367275349 Win=65535 Len=0
1,2.9265550000000076,62.210.85.178,10.0.2.15,TCP,60,9001  >  35978 [ACK] Seq=19890411 Ack=367276809 Win=65535 Len=0
1,2.9265589999995427,62.210.85.178,10.0.2.15,TCP,60,9001  >  35978 [ACK] Seq=19890411 Ack=367278269 Win=65535 Len=0
1,2.926591000001281,10.0.2.15,62.210.85.178,TLSv1.2,1204,Application Data
1,2.9266870000010385,10.0.2.15,62.210.85.178,TLSv1.2,2974,Application Data
1,2.92670999999973,62.210.85.178,10.0.2.15,TCP,60,9001  >  35978 [ACK] Seq=19890411 Ack=367279419 Win=65535 Len=0
1,2.926741999999649,10.0.2.15,62.210.85.178,TLSv1.2,1226,Application Data
1,2.926777000000584,62.210.85.178,10.0.2.15,TCP,60,9001  >  35978 [ACK] Seq=19890411 Ack=367280879 Win=65535 Len=0
1,2.926783000000796,62.210.85.178,10.0.2.15,TCP,60,9001  >  35978 [ACK] Seq=19890411 Ack=367282339 Win=65535 Len=0
1,2.92678800000067,62.210.85.178,10.0.2.15,TCP,60,9001  >  35978 [ACK] Seq=19890411 Ack=367283511 Win=65535 Len=0
1,2.9268320000010135,10.0.2.15,62.210.85.178,TLSv1.2,4124,Application Data
1,2.92687400000068,62.210.85.178,10.0.2.15,TCP,60,9001  >  35978 [ACK] Seq=19890411 Ack=367284971 Win=65535 Len=0
1,2.926881000001231,62.210.85.178,10.0.2.15,TCP,60,9001  >  35978 [ACK] Seq=19890411 Ack=367286431 Win=65535 Len=0
1,2.926885000000766,62.210.85.178,10.0.2.15,TCP,60,9001  >  35978 [ACK] Seq=19890411 Ack=367287581 Win=65535 Len=0
1,2.9269320000003063,10.0.2.15,62.210.85.178,TLSv1.2,3030,Application Data
1,2.926972000001115,62.210.85.178,10.0.2.15,TCP,60,9001  >  35978 [ACK] Seq=19890411 Ack=367289041 Win=65535 Len=0
1,2.9269789999998466,62.210.85.178,10.0.2.15,TCP,60,9001  >  35978 [ACK] Seq=19890411 Ack=367290501 Win=65535 Len=0
1,2.9269830000012007,62.210.85.178,10.0.2.15,TCP,60,9001  >  35978 [ACK] Seq=19890411 Ack=367290557 Win=65535 Len=0
1,2.9361600000011094,10.0.2.15,62.210.85.178,TLSv1.2,1618,Application Data
1,2.936278000001039,62.210.85.178,10.0.2.15,TCP,60,9001  >  35978 [ACK] Seq=19890411 Ack=367292017 Win=65535 Len=0
1,2.9362899999996444,62.210.85.178,10.0.2.15,TCP,60,9001  >  35978 [ACK] Seq=19890411 Ack=367292121 Win=65535 Len=0
1,3.0576030000011087,54.93.77.70,10.0.2.15,TLSv1.2,3674,Application Data
1,3.05772799999977,10.0.2.15,54.93.77.70,TCP,54,34692  >  9001 [ACK] Seq=19970217 Ack=366899499 Win=65535 Len=0
1,3.0764240000007703,54.93.77.70,10.0.2.15,TLSv1.2,3674,Application Data
1,3.076506999999765,10.0.2.15,54.93.77.70,TCP,54,34692  >  9001 [ACK] Seq=19970217 Ack=366903119 Win=65535 Len=0
1,3.0966129999997065,54.93.77.70,10.0.2.15,TLSv1.2,1104,Application Data
1,3.096644000001106,54.93.77.70,10.0.2.15,TLSv1.2,4398,Application Data
1,3.096729000000778,10.0.2.15,54.93.77.70,TCP,54,34692  >  9001 [ACK] Seq=19970217 Ack=366908513 Win=65535 Len=0
1,3.0975350000007893,54.93.77.70,10.0.2.15,TLSv1.2,7294,Application Data [TCP segment of a reassembled PDU]
1,3.097603000000163,10.0.2.15,54.93.77.70,TCP,54,34692  >  9001 [ACK] Seq=19970217 Ack=366915753 Win=65535 Len=0
1,3.106735999999728,54.93.77.70,10.0.2.15,TLSv1.2,1502,Application Data [TCP segment of a reassembled PDU]
1,3.1068130000003293,10.0.2.15,54.93.77.70,TCP,54,34692  >  9001 [ACK] Seq=19970217 Ack=366917201 Win=65535 Len=0
1,3.117747000000236,54.93.77.70,10.0.2.15,TLSv1.2,6150,"Application Data, Application Data"
1,3.1178280000003724,10.0.2.15,54.93.77.70,TCP,54,34692  >  9001 [ACK] Seq=19970217 Ack=366923297 Win=65535 Len=0
1,3.118125000000873,10.0.2.15,54.93.77.70,TLSv1.2,590,Application Data
1,3.118238000000929,54.93.77.70,10.0.2.15,TCP,60,9001  >  34692 [ACK] Seq=366923297 Ack=19970753 Win=65535 Len=0
1,3.1280580000002374,54.93.77.70,10.0.2.15,TLSv1.2,5846,Application Data
1,3.1281310000013036,10.0.2.15,54.93.77.70,TCP,54,34692  >  9001 [ACK] Seq=19970753 Ack=366929089 Win=65535 Len=0
1,3.128179999999702,54.93.77.70,10.0.2.15,TLSv1.2,2950,Application Data [TCP segment of a reassembled PDU]
1,3.1282200000005105,10.0.2.15,54.93.77.70,TCP,54,34692  >  9001 [ACK] Seq=19970753 Ack=366931985 Win=65535 Len=0
1,3.13116699999955,54.93.77.70,10.0.2.15,TCP,2950,"9001  >  34692 [PSH, ACK] Seq=366931985 Ack=19970753 Win=65535 Len=2896 [TCP segment of a reassembled PDU]"
1,3.131210999999894,10.0.2.15,54.93.77.70,TCP,54,34692  >  9001 [ACK] Seq=19970753 Ack=366934881 Win=65535 Len=0
1,3.1366070000003674,54.93.77.70,10.0.2.15,TLSv1.2,358,Application Data
1,3.136792000001151,10.0.2.15,54.93.77.70,TLSv1.2,590,Application Data
1,3.1369070000000647,54.93.77.70,10.0.2.15,TCP,60,9001  >  34692 [ACK] Seq=366935185 Ack=19971289 Win=65535 Len=0
1,3.1372380000011617,54.93.77.70,10.0.2.15,TLSv1.2,4398,Application Data
1,3.137302000001,10.0.2.15,54.93.77.70,TCP,54,34692  >  9001 [ACK] Seq=19971289 Ack=366939529 Win=65535 Len=0
1,3.1461419999995996,54.93.77.70,10.0.2.15,TLSv1.2,1502,Application Data [TCP segment of a reassembled PDU]
1,3.1461849999996048,10.0.2.15,54.93.77.70,TCP,54,34692  >  9001 [ACK] Seq=19971289 Ack=366940977 Win=65535 Len=0
1,3.153067999999621,54.93.77.70,10.0.2.15,TLSv1.2,2950,Application Data [TCP segment of a reassembled PDU]
1,3.1530970000003435,54.93.77.70,10.0.2.15,TLSv1.2,2950,Application Data [TCP segment of a reassembled PDU]
1,3.153174000000945,10.0.2.15,54.93.77.70,TCP,54,34692  >  9001 [ACK] Seq=19971289 Ack=366946769 Win=65535 Len=0
1,3.153689000000668,54.93.77.70,10.0.2.15,TCP,1502,"9001  >  34692 [PSH, ACK] Seq=366946769 Ack=19971289 Win=65535 Len=1448 [TCP segment of a reassembled PDU]"
1,3.1537330000010115,10.0.2.15,54.93.77.70,TCP,54,34692  >  9001 [ACK] Seq=19971289 Ack=366948217 Win=65535 Len=0
1,3.156696000000011,54.93.77.70,10.0.2.15,TLSv1.2,1010,Application Data
1,3.156875000000582,10.0.2.15,54.93.77.70,TLSv1.2,590,Application Data
1,3.156998000000385,54.93.77.70,10.0.2.15,TCP,60,9001  >  34692 [ACK] Seq=366949173 Ack=19971825 Win=65535 Len=0
1,3.1762539999999717,54.93.77.70,10.0.2.15,TLSv1.2,6780,"Application Data, Application Data"
1,3.176325000000361,10.0.2.15,54.93.77.70,TCP,54,34692  >  9001 [ACK] Seq=19971825 Ack=366955899 Win=65535 Len=0
1,3.187616999999591,54.93.77.70,10.0.2.15,TLSv1.2,7294,Application Data
1,3.18766400000095,10.0.2.15,54.93.77.70,TCP,54,34692  >  9001 [ACK] Seq=19971825 Ack=366963139 Win=65535 Len=0
1,3.1954960000002757,54.93.77.70,10.0.2.15,TLSv1.2,568,Application Data
1,3.1987970000009227,54.93.77.70,10.0.2.15,TCP,1502,"9001  >  34692 [PSH, ACK] Seq=366963653 Ack=19971825 Win=65535 Len=1448 [TCP segment of a reassembled PDU]"
1,3.1988560000008874,10.0.2.15,54.93.77.70,TCP,54,34692  >  9001 [ACK] Seq=19971825 Ack=366965101 Win=65535 Len=0
1,3.204899000000296,54.93.77.70,10.0.2.15,TLSv1.2,5846,"Application Data, Application Data"
1,3.20503699999972,10.0.2.15,54.93.77.70,TCP,54,34692  >  9001 [ACK] Seq=19971825 Ack=366970893 Win=65535 Len=0
1,3.217136000001119,54.93.77.70,10.0.2.15,TLSv1.2,1104,Application Data
1,3.2280810000011115,54.93.77.70,10.0.2.15,TLSv1.2,5846,Application Data
1,3.228140999999596,10.0.2.15,54.93.77.70,TCP,54,34692  >  9001 [ACK] Seq=19971825 Ack=366977735 Win=65535 Len=0
1,3.228342000000339,10.0.2.15,54.93.77.70,TLSv1.2,590,Application Data
1,3.2284730000010313,54.93.77.70,10.0.2.15,TCP,60,9001  >  34692 [ACK] Seq=366977735 Ack=19972361 Win=65535 Len=0
1,3.2437860000009096,62.210.85.178,10.0.2.15,TLSv1.2,590,Application Data
1,3.244254000001092,54.93.77.70,10.0.2.15,TLSv1.2,1502,Application Data [TCP segment of a reassembled PDU]
1,3.2443010000006325,10.0.2.15,54.93.77.70,TCP,54,34692  >  9001 [ACK] Seq=19972361 Ack=366979183 Win=65535 Len=0
1,3.2467870000000403,54.93.77.70,10.0.2.15,TLSv1.2,1104,Application Data
1,3.2506690000009257,10.0.2.15,54.93.77.70,TLSv1.2,590,Application Data
1,3.2508379999999306,54.93.77.70,10.0.2.15,TCP,60,9001  >  34692 [ACK] Seq=366980233 Ack=19972897 Win=65535 Len=0
1,3.2854170000009617,10.0.2.15,62.210.85.178,TCP,54,35978  >  9001 [ACK] Seq=367292121 Ack=19890947 Win=65535 Len=0
1,3.3054009999996197,62.210.85.178,10.0.2.15,TLSv1.2,1104,Application Data
1,3.3055029999995895,10.0.2.15,62.210.85.178,TCP,54,35978  >  9001 [ACK] Seq=367292121 Ack=19891997 Win=65535 Len=0
1,3.342281000001094,62.210.85.178,10.0.2.15,TLSv1.2,590,Application Data
1,3.3423450000009325,10.0.2.15,62.210.85.178,TCP,54,35978  >  9001 [ACK] Seq=367292121 Ack=19892533 Win=65535 Len=0
1,3.493238000000929,62.210.85.178,10.0.2.15,TLSv1.2,590,Application Data
1,3.4933099999998376,10.0.2.15,62.210.85.178,TCP,54,35978  >  9001 [ACK] Seq=367292121 Ack=19893069 Win=65535 Len=0
1,3.4937559999998484,10.0.2.15,62.210.85.178,TLSv1.2,590,Application Data
1,3.4939420000009704,62.210.85.178,10.0.2.15,TCP,60,9001  >  35978 [ACK] Seq=19893069 Ack=367292657 Win=65535 Len=0
1,3.6991300000008778,54.93.77.70,10.0.2.15,TLSv1.2,590,Application Data
1,3.6995110000007116,10.0.2.15,54.93.77.70,TLSv1.2,590,Application Data
1,3.6996170000002166,54.93.77.70,10.0.2.15,TCP,60,9001  >  34692 [ACK] Seq=366980769 Ack=19973433 Win=65535 Len=0
1,3.8224580000005517,62.210.85.178,10.0.2.15,TLSv1.2,590,Application Data
1,3.827465000000302,10.0.2.15,62.210.85.178,TLSv1.2,590,Application Data
1,3.827656000001298,62.210.85.178,10.0.2.15,TCP,60,9001  >  35978 [ACK] Seq=19893605 Ack=367293193 Win=65535 Len=0
1,3.8388919999997597,10.0.2.15,62.210.85.178,TLSv1.2,4124,Application Data
1,3.8390090000011696,10.0.2.15,62.210.85.178,TCP,2974,35978  >  9001 [ACK] Seq=367297263 Ack=19893605 Win=65535 Len=2920 [TCP segment of a reassembled PDU]
1,3.839060000000245,62.210.85.178,10.0.2.15,TCP,60,9001  >  35978 [ACK] Seq=19893605 Ack=367294653 Win=65535 Len=0
1,3.8390720000006695,62.210.85.178,10.0.2.15,TCP,60,9001  >  35978 [ACK] Seq=19893605 Ack=367296113 Win=65535 Len=0
1,3.839077000000543,62.210.85.178,10.0.2.15,TCP,60,9001  >  35978 [ACK] Seq=19893605 Ack=367297263 Win=65535 Len=0
1,3.8390830000007554,62.210.85.178,10.0.2.15,TCP,60,9001  >  35978 [ACK] Seq=19893605 Ack=367298723 Win=65535 Len=0
1,3.839125000000422,10.0.2.15,62.210.85.178,TLSv1.2,1204,Application Data
1,3.8391670000000886,62.210.85.178,10.0.2.15,TCP,60,9001  >  35978 [ACK] Seq=19893605 Ack=367300183 Win=65535 Len=0
1,3.8391740000006394,62.210.85.178,10.0.2.15,TCP,60,9001  >  35978 [ACK] Seq=19893605 Ack=367301333 Win=65535 Len=0
1,3.839216000000306,10.0.2.15,62.210.85.178,TLSv1.2,4124,Application Data
1,3.8392560000011144,62.210.85.178,10.0.2.15,TCP,60,9001  >  35978 [ACK] Seq=19893605 Ack=367302793 Win=65535 Len=0
1,3.8392640000001848,62.210.85.178,10.0.2.15,TCP,60,9001  >  35978 [ACK] Seq=19893605 Ack=367304253 Win=65535 Len=0
1,3.83926799999972,62.210.85.178,10.0.2.15,TCP,60,9001  >  35978 [ACK] Seq=19893605 Ack=367305403 Win=65535 Len=0
1,3.8393190000006143,10.0.2.15,62.210.85.178,TLSv1.2,3352,Application Data
1,3.839358999999604,62.210.85.178,10.0.2.15,TCP,60,9001  >  35978 [ACK] Seq=19893605 Ack=367306863 Win=65535 Len=0
1,3.839367000000493,62.210.85.178,10.0.2.15,TCP,60,9001  >  35978 [ACK] Seq=19893605 Ack=367308323 Win=65535 Len=0
1,3.8393710000000283,62.210.85.178,10.0.2.15,TCP,60,9001  >  35978 [ACK] Seq=19893605 Ack=367308701 Win=65535 Len=0
1,3.963633999999729,54.93.77.70,10.0.2.15,TLSv1.2,590,Application Data
1,3.999615000000631,54.93.77.70,10.0.2.15,TCP,2950,"9001  >  34692 [PSH, ACK] Seq=366981305 Ack=19973433 Win=65535 Len=2896 [TCP segment of a reassembled PDU]"
1,3.999684000000343,10.0.2.15,54.93.77.70,TCP,54,34692  >  9001 [ACK] Seq=19973433 Ack=366984201 Win=65535 Len=0
1,4.017359000001306,54.93.77.70,10.0.2.15,TLSv1.2,778,Application Data
1,4.057441000000836,10.0.2.15,54.93.77.70,TCP,54,34692  >  9001 [ACK] Seq=19973433 Ack=366984925 Win=65535 Len=0
1,4.06756200000018,54.93.77.70,10.0.2.15,TLSv1.2,5846,Application Data
1,4.067597000001115,54.93.77.70,10.0.2.15,TCP,1502,"9001  >  34692 [PSH, ACK] Seq=366990717 Ack=19973433 Win=65535 Len=1448 [TCP segment of a reassembled PDU]"
1,4.067661000000953,10.0.2.15,54.93.77.70,TCP,54,34692  >  9001 [ACK] Seq=19973433 Ack=366990717 Win=65535 Len=0
1,4.0677080000004935,10.0.2.15,54.93.77.70,TCP,54,34692  >  9001 [ACK] Seq=19973433 Ack=366992165 Win=65535 Len=0
1,4.0679479999998875,10.0.2.15,54.93.77.70,TLSv1.2,590,Application Data
1,4.0680800000009185,54.93.77.70,10.0.2.15,TCP,60,9001  >  34692 [ACK] Seq=366992165 Ack=19973969 Win=65535 Len=0
1,4.07384600000114,54.93.77.70,10.0.2.15,TLSv1.2,2950,Application Data [TCP segment of a reassembled PDU]
1,4.073894999999538,10.0.2.15,54.93.77.70,TCP,54,34692  >  9001 [ACK] Seq=19973969 Ack=366995061 Win=65535 Len=0
1,4.144904000000679,54.93.77.70,10.0.2.15,TLSv1.2,1292,Application Data
1,4.145359000000099,10.0.2.15,54.93.77.70,TLSv1.2,590,Application Data
1,4.145486000001256,54.93.77.70,10.0.2.15,TCP,60,9001  >  34692 [ACK] Seq=366996299 Ack=19974505 Win=65535 Len=0
1,4.155366000000868,10.0.2.15,54.93.77.70,TLSv1.2,590,Application Data
1,4.155490999999529,54.93.77.70,10.0.2.15,TCP,60,9001  >  34692 [ACK] Seq=366996299 Ack=19975041 Win=65535 Len=0
1,4.1909580000010465,54.93.77.70,10.0.2.15,TLSv1.2,590,Application Data
1,4.208092000000761,62.210.85.178,10.0.2.15,TLSv1.2,590,Application Data
1,4.233399000000645,10.0.2.15,54.93.77.70,TCP,54,34692  >  9001 [ACK] Seq=19975041 Ack=366996835 Win=65535 Len=0
1,4.249431000000186,10.0.2.15,62.210.85.178,TCP,54,35978  >  9001 [ACK] Seq=367308701 Ack=19894141 Win=65535 Len=0
1,4.283306999999695,62.210.85.178,10.0.2.15,TLSv1.2,1104,Application Data
1,4.2833709999995335,10.0.2.15,62.210.85.178,TCP,54,35978  >  9001 [ACK] Seq=367308701 Ack=19895191 Win=65535 Len=0
1,4.283835000000181,10.0.2.15,62.210.85.178,TLSv1.2,590,Application Data
1,4.28394599999956,62.210.85.178,10.0.2.15,TCP,60,9001  >  35978 [ACK] Seq=19895191 Ack=367309237 Win=65535 Len=0
1,4.412261999999828,54.93.77.70,10.0.2.15,TLSv1.2,590,Application Data
1,4.412349000000177,10.0.2.15,54.93.77.70,TCP,54,34692  >  9001 [ACK] Seq=19975041 Ack=366997371 Win=65535 Len=0
1,4.412695000000895,10.0.2.15,54.93.77.70,TLSv1.2,590,Application Data
1,4.412788999999975,54.93.77.70,10.0.2.15,TCP,60,9001  >  34692 [ACK] Seq=366997371 Ack=19975577 Win=65535 Len=0
1,4.619184000001042,62.210.85.178,10.0.2.15,TLSv1.2,590,Application Data
1,4.623037999999724,10.0.2.15,62.210.85.178,TLSv1.2,590,Application Data
1,4.6231970000008005,62.210.85.178,10.0.2.15,TCP,60,9001  >  35978 [ACK] Seq=19895727 Ack=367309773 Win=65535 Len=0
1,4.634449000001041,10.0.2.15,62.210.85.178,TLSv1.2,4124,Application Data
1,4.6345410000012635,10.0.2.15,62.210.85.178,TCP,2974,35978  >  9001 [ACK] Seq=367313843 Ack=19895727 Win=65535 Len=2920 [TCP segment of a reassembled PDU]
1,4.634584000001269,62.210.85.178,10.0.2.15,TCP,60,9001  >  35978 [ACK] Seq=19895727 Ack=367311233 Win=65535 Len=0
1,4.634595999999874,62.210.85.178,10.0.2.15,TCP,60,9001  >  35978 [ACK] Seq=19895727 Ack=367312693 Win=65535 Len=0
1,4.634600999999748,62.210.85.178,10.0.2.15,TCP,60,9001  >  35978 [ACK] Seq=19895727 Ack=367313843 Win=65535 Len=0
1,4.634604000000763,62.210.85.178,10.0.2.15,TCP,60,9001  >  35978 [ACK] Seq=19895727 Ack=367315303 Win=65535 Len=0
1,4.634605999999621,62.210.85.178,10.0.2.15,TCP,60,9001  >  35978 [ACK] Seq=19895727 Ack=367316763 Win=65535 Len=0
1,4.634640000000218,10.0.2.15,62.210.85.178,TLSv1.2,1204,Application Data
1,4.634674000000814,62.210.85.178,10.0.2.15,TCP,60,9001  >  35978 [ACK] Seq=19895727 Ack=367317913 Win=65535 Len=0
1,4.634718999999677,10.0.2.15,62.210.85.178,TLSv1.2,4124,Application Data
1,4.6347530000002735,62.210.85.178,10.0.2.15,TCP,60,9001  >  35978 [ACK] Seq=19895727 Ack=367319373 Win=65535 Len=0
1,4.634760000000824,62.210.85.178,10.0.2.15,TCP,60,9001  >  35978 [ACK] Seq=19895727 Ack=367320833 Win=65535 Len=0
1,4.634764000000359,62.210.85.178,10.0.2.15,TCP,60,9001  >  35978 [ACK] Seq=19895727 Ack=367321983 Win=65535 Len=0
1,4.634804000001168,10.0.2.15,62.210.85.178,TLSv1.2,4124,Application Data
1,4.634836999999607,62.210.85.178,10.0.2.15,TCP,60,9001  >  35978 [ACK] Seq=19895727 Ack=367323443 Win=65535 Len=0
1,4.634844000000157,62.210.85.178,10.0.2.15,TCP,60,9001  >  35978 [ACK] Seq=19895727 Ack=367324903 Win=65535 Len=0
1,4.6349000000009255,10.0.2.15,62.210.85.178,TLSv1.2,2974,Application Data
1,4.634935000000041,62.210.85.178,10.0.2.15,TCP,60,9001  >  35978 [ACK] Seq=19895727 Ack=367326053 Win=65535 Len=0
1,4.634942000000592,62.210.85.178,10.0.2.15,TCP,60,9001  >  35978 [ACK] Seq=19895727 Ack=367327513 Win=65535 Len=0
1,4.634946000000127,62.210.85.178,10.0.2.15,TCP,60,9001  >  35978 [ACK] Seq=19895727 Ack=367328973 Win=65535 Len=0
1,4.634973000000173,10.0.2.15,62.210.85.178,TLSv1.2,1226,Application Data
1,4.6350060000004305,62.210.85.178,10.0.2.15,TCP,60,9001  >  35978 [ACK] Seq=19895727 Ack=367330145 Win=65535 Len=0
1,4.6350450000009005,10.0.2.15,62.210.85.178,TLSv1.2,2966,Application Data
1,4.635078999999678,62.210.85.178,10.0.2.15,TCP,60,9001  >  35978 [ACK] Seq=19895727 Ack=367331605 Win=65535 Len=0
1,4.63508499999989,62.210.85.178,10.0.2.15,TCP,60,9001  >  35978 [ACK] Seq=19895727 Ack=367333057 Win=65535 Len=0
1,4.7291409999997995,54.93.77.70,10.0.2.15,TLSv1.2,590,Application Data
1,4.73961700000109,54.93.77.70,10.0.2.15,TCP,2950,"9001  >  34692 [PSH, ACK] Seq=366997907 Ack=19975577 Win=65535 Len=2896 [TCP segment of a reassembled PDU]"
1,4.739692999999534,10.0.2.15,54.93.77.70,TCP,54,34692  >  9001 [ACK] Seq=19975577 Ack=367000803 Win=65535 Len=0
1,4.750443000000814,54.93.77.70,10.0.2.15,TLSv1.2,2950,Application Data [TCP segment of a reassembled PDU]
1,4.750489000000016,10.0.2.15,54.93.77.70,TCP,54,34692  >  9001 [ACK] Seq=19975577 Ack=367003699 Win=65535 Len=0
1,4.750535999999556,54.93.77.70,10.0.2.15,TLSv1.2,1502,Application Data
1,4.750587000000451,10.0.2.15,54.93.77.70,TCP,54,34692  >  9001 [ACK] Seq=19975577 Ack=367005147 Win=65535 Len=0
1,4.762714000000415,54.93.77.70,10.0.2.15,TLSv1.2,3674,Application Data
1,4.762767000000167,10.0.2.15,54.93.77.70,TCP,54,34692  >  9001 [ACK] Seq=19975577 Ack=367008767 Win=65535 Len=0
1,4.779029000001174,54.93.77.70,10.0.2.15,TLSv1.2,1104,Application Data
1,4.780603999999585,54.93.77.70,10.0.2.15,TCP,2950,"9001  >  34692 [PSH, ACK] Seq=367009817 Ack=19975577 Win=65535 Len=2896 [TCP segment of a reassembled PDU]"
1,4.78064699999959,10.0.2.15,54.93.77.70,TCP,54,34692  >  9001 [ACK] Seq=19975577 Ack=367012713 Win=65535 Len=0
1,4.7920109999995475,54.93.77.70,10.0.2.15,TLSv1.2,2950,Application Data [TCP segment of a reassembled PDU]
1,4.792053999999553,10.0.2.15,54.93.77.70,TCP,54,34692  >  9001 [ACK] Seq=19975577 Ack=367015609 Win=65535 Len=0
1,4.79210200000125,54.93.77.70,10.0.2.15,TLSv1.2,1502,Application Data
1,4.792149000000791,10.0.2.15,54.93.77.70,TCP,54,34692  >  9001 [ACK] Seq=19975577 Ack=367017057 Win=65535 Len=0
1,4.800693000001047,54.93.77.70,10.0.2.15,TLSv1.2,590,Application Data
1,4.833190000001196,54.93.77.70,10.0.2.15,TLSv1.2,3674,Application Data
1,4.8332680000003165,10.0.2.15,54.93.77.70,TCP,54,34692  >  9001 [ACK] Seq=19975577 Ack=367021213 Win=65535 Len=0
1,4.835612000000765,10.0.2.15,54.93.77.70,TLSv1.2,590,Application Data
1,4.835764000001291,54.93.77.70,10.0.2.15,TCP,60,9001  >  34692 [ACK] Seq=367021213 Ack=19976113 Win=65535 Len=0
1,4.9467640000002575,62.210.85.178,10.0.2.15,TLSv1.2,590,Application Data
1,4.9470820000005915,10.0.2.15,62.210.85.178,TLSv1.2,590,Application Data
1,4.947184000000561,62.210.85.178,10.0.2.15,TCP,60,9001  >  35978 [ACK] Seq=19896263 Ack=367333593 Win=65535 Len=0
1,5.0514600000005885,54.93.77.70,10.0.2.15,TLSv1.2,590,Application Data
1,5.051817999999912,10.0.2.15,54.93.77.70,TLSv1.2,590,Application Data
1,5.051918000001024,54.93.77.70,10.0.2.15,TCP,60,9001  >  34692 [ACK] Seq=367021749 Ack=19976649 Win=65535 Len=0
1,5.233654999999999,62.210.85.178,10.0.2.15,TLSv1.2,590,Application Data
1,5.23987599999964,10.0.2.15,62.210.85.178,TLSv1.2,590,Application Data
1,5.240052999999534,62.210.85.178,10.0.2.15,TCP,60,9001  >  35978 [ACK] Seq=19896799 Ack=367334129 Win=65535 Len=0
1,5.253834000001007,10.0.2.15,62.210.85.178,TLSv1.2,4124,Application Data
1,5.25405900000078,62.210.85.178,10.0.2.15,TCP,60,9001  >  35978 [ACK] Seq=19896799 Ack=367335589 Win=65535 Len=0
1,5.254076999999597,62.210.85.178,10.0.2.15,TCP,60,9001  >  35978 [ACK] Seq=19896799 Ack=367337049 Win=65535 Len=0
1,5.2540810000009515,62.210.85.178,10.0.2.15,TCP,60,9001  >  35978 [ACK] Seq=19896799 Ack=367338199 Win=65535 Len=0
1,5.254139000000578,10.0.2.15,62.210.85.178,TLSv1.2,4124,Application Data
1,5.254227000001265,62.210.85.178,10.0.2.15,TCP,60,9001  >  35978 [ACK] Seq=19896799 Ack=367339659 Win=65535 Len=0
1,5.254235000000335,62.210.85.178,10.0.2.15,TCP,60,9001  >  35978 [ACK] Seq=19896799 Ack=367341119 Win=65535 Len=0
1,5.254237999999532,62.210.85.178,10.0.2.15,TCP,60,9001  >  35978 [ACK] Seq=19896799 Ack=367342269 Win=65535 Len=0
1,5.254258000000846,10.0.2.15,62.210.85.178,TCP,2974,35978  >  9001 [ACK] Seq=367342269 Ack=19896799 Win=65535 Len=2920 [TCP segment of a reassembled PDU]
1,5.254302000001189,62.210.85.178,10.0.2.15,TCP,60,9001  >  35978 [ACK] Seq=19896799 Ack=367343729 Win=65535 Len=0
1,5.254308999999921,62.210.85.178,10.0.2.15,TCP,60,9001  >  35978 [ACK] Seq=19896799 Ack=367345189 Win=65535 Len=0
1,5.254337000000305,10.0.2.15,62.210.85.178,TLSv1.2,1204,Application Data
1,5.2543729999997595,62.210.85.178,10.0.2.15,TCP,60,9001  >  35978 [ACK] Seq=19896799 Ack=367346339 Win=65535 Len=0
1,5.254417000000103,10.0.2.15,62.210.85.178,TLSv1.2,4124,Application Data
1,5.254453999999896,62.210.85.178,10.0.2.15,TCP,60,9001  >  35978 [ACK] Seq=19896799 Ack=367347799 Win=65535 Len=0
1,5.254463000001124,62.210.85.178,10.0.2.15,TCP,60,9001  >  35978 [ACK] Seq=19896799 Ack=367349259 Win=65535 Len=0
1,5.254532000000836,10.0.2.15,62.210.85.178,TLSv1.2,2974,Application Data
1,5.2545719999998255,62.210.85.178,10.0.2.15,TCP,60,9001  >  35978 [ACK] Seq=19896799 Ack=367350409 Win=65535 Len=0
1,5.254581000001053,62.210.85.178,10.0.2.15,TCP,60,9001  >  35978 [ACK] Seq=19896799 Ack=367351869 Win=65535 Len=0
1,5.2545850000005885,62.210.85.178,10.0.2.15,TCP,60,9001  >  35978 [ACK] Seq=19896799 Ack=367353329 Win=65535 Len=0
1,5.254618000000846,10.0.2.15,62.210.85.178,TLSv1.2,1226,Application Data
1,5.254655000000639,62.210.85.178,10.0.2.15,TCP,60,9001  >  35978 [ACK] Seq=19896799 Ack=367354501 Win=65535 Len=0
1,5.254694999999629,10.0.2.15,62.210.85.178,TLSv1.2,4124,Application Data
1,5.254736000000776,62.210.85.178,10.0.2.15,TCP,60,9001  >  35978 [ACK] Seq=19896799 Ack=367355961 Win=65535 Len=0
1,5.254743999999846,62.210.85.178,10.0.2.15,TCP,60,9001  >  35978 [ACK] Seq=19896799 Ack=367357421 Win=65535 Len=0
1,5.2547480000012,62.210.85.178,10.0.2.15,TCP,60,9001  >  35978 [ACK] Seq=19896799 Ack=367358571 Win=65535 Len=0
1,5.254785000000993,10.0.2.15,62.210.85.178,TLSv1.2,3030,Application Data
1,5.254823999999644,62.210.85.178,10.0.2.15,TCP,60,9001  >  35978 [ACK] Seq=19896799 Ack=367360031 Win=65535 Len=0
1,5.254832000000533,62.210.85.178,10.0.2.15,TCP,60,9001  >  35978 [ACK] Seq=19896799 Ack=367361491 Win=65535 Len=0
1,5.2548360000000685,62.210.85.178,10.0.2.15,TCP,60,9001  >  35978 [ACK] Seq=19896799 Ack=367361547 Win=65535 Len=0
1,5.266362000000299,10.0.2.15,62.210.85.178,TLSv1.2,4124,Application Data
1,5.266453000000183,62.210.85.178,10.0.2.15,TCP,60,9001  >  35978 [ACK] Seq=19896799 Ack=367363007 Win=65535 Len=0
1,5.266461999999592,62.210.85.178,10.0.2.15,TCP,60,9001  >  35978 [ACK] Seq=19896799 Ack=367364467 Win=65535 Len=0
1,5.266466000000946,62.210.85.178,10.0.2.15,TCP,60,9001  >  35978 [ACK] Seq=19896799 Ack=367365617 Win=65535 Len=0
1,5.266508000000613,10.0.2.15,62.210.85.178,TLSv1.2,4124,Application Data
1,5.266547999999602,62.210.85.178,10.0.2.15,TCP,60,9001  >  35978 [ACK] Seq=19896799 Ack=367367077 Win=65535 Len=0
1,5.266556000000492,62.210.85.178,10.0.2.15,TCP,60,9001  >  35978 [ACK] Seq=19896799 Ack=367368537 Win=65535 Len=0
1,5.266561000000365,62.210.85.178,10.0.2.15,TCP,60,9001  >  35978 [ACK] Seq=19896799 Ack=367369687 Win=65535 Len=0
1,5.266601000001174,10.0.2.15,62.210.85.178,TLSv1.2,4124,Application Data
1,5.266639999999825,62.210.85.178,10.0.2.15,TCP,60,9001  >  35978 [ACK] Seq=19896799 Ack=367371147 Win=65535 Len=0
1,5.266649000001053,62.210.85.178,10.0.2.15,TCP,60,9001  >  35978 [ACK] Seq=19896799 Ack=367372607 Win=65535 Len=0
1,5.266654000000926,62.210.85.178,10.0.2.15,TCP,60,9001  >  35978 [ACK] Seq=19896799 Ack=367373757 Win=65535 Len=0
1,5.266690000000381,10.0.2.15,62.210.85.178,TLSv1.2,4124,Application Data
1,5.266728000000512,62.210.85.178,10.0.2.15,TCP,60,9001  >  35978 [ACK] Seq=19896799 Ack=367375217 Win=65535 Len=0
1,5.266736999999921,62.210.85.178,10.0.2.15,TCP,60,9001  >  35978 [ACK] Seq=19896799 Ack=367376677 Win=65535 Len=0
1,5.266741000001275,62.210.85.178,10.0.2.15,TCP,60,9001  >  35978 [ACK] Seq=19896799 Ack=367377827 Win=65535 Len=0
1,5.2667770000007295,10.0.2.15,62.210.85.178,TLSv1.2,332,Application Data
1,5.266814000000522,62.210.85.178,10.0.2.15,TCP,60,9001  >  35978 [ACK] Seq=19896799 Ack=367378105 Win=65535 Len=0
1,5.266869000000952,10.0.2.15,62.210.85.178,TLSv1.2,3868,Application Data
1,5.266907000001083,62.210.85.178,10.0.2.15,TCP,60,9001  >  35978 [ACK] Seq=19896799 Ack=367379565 Win=65535 Len=0
1,5.266916000000492,62.210.85.178,10.0.2.15,TCP,60,9001  >  35978 [ACK] Seq=19896799 Ack=367381025 Win=65535 Len=0
1,5.266921000000366,62.210.85.178,10.0.2.15,TCP,60,9001  >  35978 [ACK] Seq=19896799 Ack=367381919 Win=65535 Len=0
1,5.266960000000836,10.0.2.15,62.210.85.178,TLSv1.2,4124,Application Data
1,5.266998000000967,62.210.85.178,10.0.2.15,TCP,60,9001  >  35978 [ACK] Seq=19896799 Ack=367383379 Win=65535 Len=0
1,5.267007000000376,62.210.85.178,10.0.2.15,TCP,60,9001  >  35978 [ACK] Seq=19896799 Ack=367384839 Win=65535 Len=0
1,5.267010999999911,62.210.85.178,10.0.2.15,TCP,60,9001  >  35978 [ACK] Seq=19896799 Ack=367385989 Win=65535 Len=0
1,5.267047000001185,10.0.2.15,62.210.85.178,TLSv1.2,3030,Application Data
1,5.267084999999497,62.210.85.178,10.0.2.15,TCP,60,9001  >  35978 [ACK] Seq=19896799 Ack=367387449 Win=65535 Len=0
1,5.267093000000386,62.210.85.178,10.0.2.15,TCP,60,9001  >  35978 [ACK] Seq=19896799 Ack=367388909 Win=65535 Len=0
1,5.26709800000026,62.210.85.178,10.0.2.15,TCP,60,9001  >  35978 [ACK] Seq=19896799 Ack=367388965 Win=65535 Len=0
1,5.27742600000056,10.0.2.15,62.210.85.178,TLSv1.2,4124,Application Data
1,5.277480000000651,62.210.85.178,10.0.2.15,TCP,60,9001  >  35978 [ACK] Seq=19896799 Ack=367390425 Win=65535 Len=0
1,5.277491000000737,62.210.85.178,10.0.2.15,TCP,60,9001  >  35978 [ACK] Seq=19896799 Ack=367391885 Win=65535 Len=0
1,5.27749600000061,62.210.85.178,10.0.2.15,TCP,60,9001  >  35978 [ACK] Seq=19896799 Ack=367393035 Win=65535 Len=0
1,5.277541000001293,10.0.2.15,62.210.85.178,TLSv1.2,4124,Application Data
1,5.277581000000282,62.210.85.178,10.0.2.15,TCP,60,9001  >  35978 [ACK] Seq=19896799 Ack=367394495 Win=65535 Len=0
1,5.277589999999691,62.210.85.178,10.0.2.15,TCP,60,9001  >  35978 [ACK] Seq=19896799 Ack=367395955 Win=65535 Len=0
1,5.277594999999565,62.210.85.178,10.0.2.15,TCP,60,9001  >  35978 [ACK] Seq=19896799 Ack=367397105 Win=65535 Len=0
1,5.277632999999696,10.0.2.15,62.210.85.178,TLSv1.2,4124,Application Data
1,5.277672000000166,62.210.85.178,10.0.2.15,TCP,60,9001  >  35978 [ACK] Seq=19896799 Ack=367398565 Win=65535 Len=0
1,5.277680000001055,62.210.85.178,10.0.2.15,TCP,60,9001  >  35978 [ACK] Seq=19896799 Ack=367400025 Win=65535 Len=0
1,5.2776860000012675,62.210.85.178,10.0.2.15,TCP,60,9001  >  35978 [ACK] Seq=19896799 Ack=367401175 Win=65535 Len=0
1,5.277731000000131,10.0.2.15,62.210.85.178,TLSv1.2,4124,Application Data
1,5.277767999999924,62.210.85.178,10.0.2.15,TCP,60,9001  >  35978 [ACK] Seq=19896799 Ack=367402635 Win=65535 Len=0
1,5.2777770000011515,62.210.85.178,10.0.2.15,TCP,60,9001  >  35978 [ACK] Seq=19896799 Ack=367404095 Win=65535 Len=0
1,5.277782000001025,62.210.85.178,10.0.2.15,TCP,60,9001  >  35978 [ACK] Seq=19896799 Ack=367405245 Win=65535 Len=0
1,5.277817000000141,10.0.2.15,62.210.85.178,TLSv1.2,332,Application Data
1,5.277853999999934,62.210.85.178,10.0.2.15,TCP,60,9001  >  35978 [ACK] Seq=19896799 Ack=367405523 Win=65535 Len=0
1,5.277905000000828,10.0.2.15,62.210.85.178,TLSv1.2,3868,Application Data
1,5.277944000001298,62.210.85.178,10.0.2.15,TCP,60,9001  >  35978 [ACK] Seq=19896799 Ack=367406983 Win=65535 Len=0
1,5.277952000000369,62.210.85.178,10.0.2.15,TCP,60,9001  >  35978 [ACK] Seq=19896799 Ack=367408443 Win=65535 Len=0
1,5.277957000000242,62.210.85.178,10.0.2.15,TCP,60,9001  >  35978 [ACK] Seq=19896799 Ack=367409337 Win=65535 Len=0
1,5.277995000000374,10.0.2.15,62.210.85.178,TLSv1.2,2966,Application Data
1,5.278034000000844,62.210.85.178,10.0.2.15,TCP,60,9001  >  35978 [ACK] Seq=19896799 Ack=367410797 Win=65535 Len=0
1,5.278040999999575,62.210.85.178,10.0.2.15,TCP,60,9001  >  35978 [ACK] Seq=19896799 Ack=367412249 Win=65535 Len=0
1,5.350631999999678,54.93.77.70,10.0.2.15,TLSv1.2,590,Application Data
1,5.37912900000083,54.93.77.70,10.0.2.15,TLSv1.2,7294,Application Data
1,5.3792310000008,10.0.2.15,54.93.77.70,TCP,54,34692  >  9001 [ACK] Seq=19976649 Ack=367029525 Win=65535 Len=0
1,5.395769000000655,54.93.77.70,10.0.2.15,TLSv1.2,568,Application Data
1,5.401018000000477,54.93.77.70,10.0.2.15,TCP,2950,"9001  >  34692 [PSH, ACK] Seq=367030039 Ack=19976649 Win=65535 Len=2896 [TCP segment of a reassembled PDU]"
1,5.401067000000694,10.0.2.15,54.93.77.70,TCP,54,34692  >  9001 [ACK] Seq=19976649 Ack=367032935 Win=65535 Len=0
1,5.401545000000624,54.93.77.70,10.0.2.15,TLSv1.2,5846,"Application Data, Application Data"
1,5.401606999999785,10.0.2.15,54.93.77.70,TCP,54,34692  >  9001 [ACK] Seq=19976649 Ack=367038727 Win=65535 Len=0
1,5.401898000000074,54.93.77.70,10.0.2.15,TCP,2894,9001  >  34692 [ACK] Seq=367038727 Ack=19976649 Win=65535 Len=2840 [TCP segment of a reassembled PDU]
1,5.401953000000503,10.0.2.15,54.93.77.70,TCP,54,34692  >  9001 [ACK] Seq=19976649 Ack=367041567 Win=65535 Len=0
1,5.401998000001186,54.93.77.70,10.0.2.15,TCP,110,"9001  >  34692 [PSH, ACK] Seq=367041567 Ack=19976649 Win=65535 Len=56 [TCP segment of a reassembled PDU]"
1,5.418397000001278,54.93.77.70,10.0.2.15,TLSv1.2,358,Application Data
1,5.418514000000869,10.0.2.15,54.93.77.70,TCP,54,34692  >  9001 [ACK] Seq=19976649 Ack=367041927 Win=65535 Len=0
1,5.418676000001142,10.0.2.15,54.93.77.70,TLSv1.2,590,Application Data
1,5.418762000001152,54.93.77.70,10.0.2.15,TCP,60,9001  >  34692 [ACK] Seq=367041927 Ack=19977185 Win=65535 Len=0
1,5.419984000000113,54.93.77.70,10.0.2.15,TLSv1.2,5846,Application Data
1,5.420061000000715,10.0.2.15,54.93.77.70,TCP,54,34692  >  9001 [ACK] Seq=19977185 Ack=367047719 Win=65535 Len=0
1,5.420186000001195,54.93.77.70,10.0.2.15,TCP,1502,"9001  >  34692 [PSH, ACK] Seq=367047719 Ack=19977185 Win=65535 Len=1448 [TCP segment of a reassembled PDU]"
1,5.420250000001033,10.0.2.15,54.93.77.70,TCP,54,34692  >  9001 [ACK] Seq=19977185 Ack=367049167 Win=65535 Len=0
1,5.435569999999643,54.93.77.70,10.0.2.15,TLSv1.2,568,Application Data
1,5.435711000000083,10.0.2.15,54.93.77.70,TLSv1.2,590,Application Data
1,5.435779000001276,54.93.77.70,10.0.2.15,TCP,60,9001  >  34692 [ACK] Seq=367049681 Ack=19977721 Win=65535 Len=0
1,5.444349000001239,54.93.77.70,10.0.2.15,TLSv1.2,4398,Application Data
1,5.444413000001077,10.0.2.15,54.93.77.70,TCP,54,34692  >  9001 [ACK] Seq=19977721 Ack=367054025 Win=65535 Len=0
1,5.444933000000674,54.93.77.70,10.0.2.15,TLSv1.2,2950,Application Data
1,5.444972999999663,10.0.2.15,54.93.77.70,TCP,54,34692  >  9001 [ACK] Seq=19977721 Ack=367056921 Win=65535 Len=0
1,5.468387000000803,54.93.77.70,10.0.2.15,TLSv1.2,5846,Application Data
1,5.468491999999969,54.93.77.70,10.0.2.15,TLSv1.2,2016,Application Data
1,5.468559000000823,10.0.2.15,54.93.77.70,TCP,54,34692  >  9001 [ACK] Seq=19977721 Ack=367064675 Win=65535 Len=0
1,5.4889620000012656,54.93.77.70,10.0.2.15,TLSv1.2,4398,Application Data
1,5.48900599999979,10.0.2.15,54.93.77.70,TCP,54,34692  >  9001 [ACK] Seq=19977721 Ack=367069019 Win=65535 Len=0
1,5.48949999999968,54.93.77.70,10.0.2.15,TLSv1.2,4514,"Application Data, Application Data"
1,5.489585000001171,10.0.2.15,54.93.77.70,TCP,54,34692  >  9001 [ACK] Seq=19977721 Ack=367073479 Win=65535 Len=0
1,5.489765000000261,10.0.2.15,54.93.77.70,TLSv1.2,590,Application Data
1,5.489837000000989,54.93.77.70,10.0.2.15,TCP,60,9001  >  34692 [ACK] Seq=367073479 Ack=19978257 Win=65535 Len=0
1,5.496914000001198,54.93.77.70,10.0.2.15,TCP,2950,"9001  >  34692 [PSH, ACK] Seq=367073479 Ack=19978257 Win=65535 Len=2896 [TCP segment of a reassembled PDU]"
1,5.497003000000404,10.0.2.15,54.93.77.70,TCP,54,34692  >  9001 [ACK] Seq=19978257 Ack=367076375 Win=65535 Len=0
1,5.507402999999613,54.93.77.70,10.0.2.15,TLSv1.2,1828,"Application Data, Application Data"
1,5.507480000000214,10.0.2.15,54.93.77.70,TCP,54,34692  >  9001 [ACK] Seq=19978257 Ack=367078149 Win=65535 Len=0
1,5.517305000001215,54.93.77.70,10.0.2.15,TCP,2950,"9001  >  34692 [PSH, ACK] Seq=367078149 Ack=19978257 Win=65535 Len=2896 [TCP segment of a reassembled PDU]"
1,5.517395000000761,10.0.2.15,54.93.77.70,TCP,54,34692  >  9001 [ACK] Seq=19978257 Ack=367081045 Win=65535 Len=0
1,5.524295999999595,54.93.77.70,10.0.2.15,TLSv1.2,1502,Application Data [TCP segment of a reassembled PDU]
1,5.524339999999938,10.0.2.15,54.93.77.70,TCP,54,34692  >  9001 [ACK] Seq=19978257 Ack=367082493 Win=65535 Len=0
1,5.525738000000274,54.93.77.70,10.0.2.15,TLSv1.2,894,Application Data
1,5.533202000000529,54.93.77.70,10.0.2.15,TCP,2950,"9001  >  34692 [PSH, ACK] Seq=367083333 Ack=19978257 Win=65535 Len=2896 [TCP segment of a reassembled PDU]"
1,5.533266000000367,10.0.2.15,54.93.77.70,TCP,54,34692  >  9001 [ACK] Seq=19978257 Ack=367086229 Win=65535 Len=0
1,5.5452040000000125,54.93.77.70,10.0.2.15,TLSv1.2,5122,"Application Data, Application Data"
1,5.545227000000523,54.93.77.70,10.0.2.15,TLSv1.2,5846,Application Data [TCP segment of a reassembled PDU]
1,5.545302000000447,10.0.2.15,54.93.77.70,TCP,54,34692  >  9001 [ACK] Seq=19978257 Ack=367097089 Win=65535 Len=0
1,5.54568400000062,10.0.2.15,54.93.77.70,TLSv1.2,590,Application Data
1,5.545802000000549,54.93.77.70,10.0.2.15,TCP,60,9001  >  34692 [ACK] Seq=367097089 Ack=19978793 Win=65535 Len=0
1,5.565894000001208,54.93.77.70,10.0.2.15,TLSv1.2,264,Application Data
1,5.600427999999738,62.210.85.178,10.0.2.15,TLSv1.2,1104,Application Data
1,5.609397000000172,10.0.2.15,54.93.77.70,TCP,54,34692  >  9001 [ACK] Seq=19978793 Ack=367097299 Win=65535 Len=0
1,5.634294999999838,54.93.77.70,10.0.2.15,TLSv1.2,3160,Application Data
1,5.634375999999975,10.0.2.15,54.93.77.70,TCP,54,34692  >  9001 [ACK] Seq=19978793 Ack=367100405 Win=65535 Len=0
1,5.6345949999995355,10.0.2.15,54.93.77.70,TLSv1.2,590,Application Data
1,5.634691999999632,54.93.77.70,10.0.2.15,TCP,60,9001  >  34692 [ACK] Seq=367100405 Ack=19979329 Win=65535 Len=0
1,5.641397999999754,10.0.2.15,62.210.85.178,TCP,54,35978  >  9001 [ACK] Seq=367412249 Ack=19897849 Win=65535 Len=0
1,5.649455000000671,10.0.2.15,54.93.77.70,TLSv1.2,590,Application Data
1,5.649717000000237,54.93.77.70,10.0.2.15,TCP,60,9001  >  34692 [ACK] Seq=367100405 Ack=19979865 Win=65535 Len=0
1,5.661508999999569,62.210.85.178,10.0.2.15,TLSv1.2,590,Application Data
1,5.661595999999918,10.0.2.15,62.210.85.178,TCP,54,35978  >  9001 [ACK] Seq=367412249 Ack=19898385 Win=65535 Len=0
1,5.7079610000000685,62.210.85.178,10.0.2.15,TLSv1.2,590,Application Data
1,5.708035999999993,10.0.2.15,62.210.85.178,TCP,54,35978  >  9001 [ACK] Seq=367412249 Ack=19898921 Win=65535 Len=0
1,5.772232000001168,62.210.85.178,10.0.2.15,TLSv1.2,590,Application Data
1,5.772292999999991,10.0.2.15,62.210.85.178,TCP,54,35978  >  9001 [ACK] Seq=367412249 Ack=19899457 Win=65535 Len=0
1,5.802982000001066,62.210.85.178,10.0.2.15,TLSv1.2,590,Application Data
1,5.803195000000414,10.0.2.15,62.210.85.178,TCP,54,35978  >  9001 [ACK] Seq=367412249 Ack=19899993 Win=65535 Len=0
1,5.805285000000367,10.0.2.15,62.210.85.178,TLSv1.2,590,Application Data
1,5.805474000000686,62.210.85.178,10.0.2.15,TCP,60,9001  >  35978 [ACK] Seq=19899993 Ack=367412785 Win=65535 Len=0
1,5.920621999999639,54.93.77.70,10.0.2.15,TLSv1.2,590,Application Data
1,5.921070000000327,10.0.2.15,54.93.77.70,TLSv1.2,590,Application Data
1,5.921213999999964,54.93.77.70,10.0.2.15,TCP,60,9001  >  34692 [ACK] Seq=367100941 Ack=19980401 Win=65535 Len=0
1,6.154613000000609,62.210.85.178,10.0.2.15,TLSv1.2,590,Application Data
1,6.165178999999625,10.0.2.15,62.210.85.178,TLSv1.2,590,Application Data
1,6.165398999999525,62.210.85.178,10.0.2.15,TCP,60,9001  >  35978 [ACK] Seq=19900529 Ack=367413321 Win=65535 Len=0
1,6.178453000000445,10.0.2.15,62.210.85.178,TLSv1.2,4124,Application Data
1,6.178566000000501,10.0.2.15,62.210.85.178,TCP,2974,35978  >  9001 [ACK] Seq=367417391 Ack=19900529 Win=65535 Len=2920 [TCP segment of a reassembled PDU]
1,6.178611000001183,62.210.85.178,10.0.2.15,TCP,60,9001  >  35978 [ACK] Seq=19900529 Ack=367414781 Win=65535 Len=0
1,6.178624000000127,62.210.85.178,10.0.2.15,TCP,60,9001  >  35978 [ACK] Seq=19900529 Ack=367416241 Win=65535 Len=0
1,6.178629000000001,62.210.85.178,10.0.2.15,TCP,60,9001  >  35978 [ACK] Seq=19900529 Ack=367417391 Win=65535 Len=0
1,6.1786339999998745,62.210.85.178,10.0.2.15,TCP,60,9001  >  35978 [ACK] Seq=19900529 Ack=367418851 Win=65535 Len=0
1,6.178638000001229,62.210.85.178,10.0.2.15,TCP,60,9001  >  35978 [ACK] Seq=19900529 Ack=367420311 Win=65535 Len=0
1,6.1786730000003445,10.0.2.15,62.210.85.178,TLSv1.2,1204,Application Data
1,6.178712000000814,62.210.85.178,10.0.2.15,TCP,60,9001  >  35978 [ACK] Seq=19900529 Ack=367421461 Win=65535 Len=0
1,6.178759000000355,10.0.2.15,62.210.85.178,TLSv1.2,4124,Application Data
1,6.178797000000486,62.210.85.178,10.0.2.15,TCP,60,9001  >  35978 [ACK] Seq=19900529 Ack=367422921 Win=65535 Len=0
1,6.178805999999895,62.210.85.178,10.0.2.15,TCP,60,9001  >  35978 [ACK] Seq=19900529 Ack=367424381 Win=65535 Len=0
1,6.178810999999769,62.210.85.178,10.0.2.15,TCP,60,9001  >  35978 [ACK] Seq=19900529 Ack=367425531 Win=65535 Len=0
1,6.178851000000577,10.0.2.15,62.210.85.178,TLSv1.2,4124,Application Data
1,6.17888800000037,62.210.85.178,10.0.2.15,TCP,60,9001  >  35978 [ACK] Seq=19900529 Ack=367426991 Win=65535 Len=0
1,6.178896000001259,62.210.85.178,10.0.2.15,TCP,60,9001  >  35978 [ACK] Seq=19900529 Ack=367428451 Win=65535 Len=0
1,6.17896600000131,10.0.2.15,62.210.85.178,TLSv1.2,2974,Application Data
1,6.179007000000638,62.210.85.178,10.0.2.15,TCP,60,9001  >  35978 [ACK] Seq=19900529 Ack=367429601 Win=65535 Len=0
1,6.179014000001189,62.210.85.178,10.0.2.15,TCP,60,9001  >  35978 [ACK] Seq=19900529 Ack=367431061 Win=65535 Len=0
1,6.1790170000003855,62.210.85.178,10.0.2.15,TCP,60,9001  >  35978 [ACK] Seq=19900529 Ack=367432521 Win=65535 Len=0
1,6.179044000000431,10.0.2.15,62.210.85.178,TLSv1.2,1226,Application Data
1,6.179079999999885,62.210.85.178,10.0.2.15,TCP,60,9001  >  35978 [ACK] Seq=19900529 Ack=367433693 Win=65535 Len=0
1,6.179121999999552,10.0.2.15,62.210.85.178,TLSv1.2,4124,Application Data
1,6.17916200000036,62.210.85.178,10.0.2.15,TCP,60,9001  >  35978 [ACK] Seq=19900529 Ack=367435153 Win=65535 Len=0
1,6.179169000000911,62.210.85.178,10.0.2.15,TCP,60,9001  >  35978 [ACK] Seq=19900529 Ack=367436613 Win=65535 Len=0
1,6.179173000000446,62.210.85.178,10.0.2.15,TCP,60,9001  >  35978 [ACK] Seq=19900529 Ack=367437763 Win=65535 Len=0
1,6.179211000000578,10.0.2.15,62.210.85.178,TLSv1.2,3030,Application Data
1,6.179249000000709,62.210.85.178,10.0.2.15,TCP,60,9001  >  35978 [ACK] Seq=19900529 Ack=367439223 Win=65535 Len=0
1,6.1792569999997795,62.210.85.178,10.0.2.15,TCP,60,9001  >  35978 [ACK] Seq=19900529 Ack=367440683 Win=65535 Len=0
1,6.179261000001134,62.210.85.178,10.0.2.15,TCP,60,9001  >  35978 [ACK] Seq=19900529 Ack=367440739 Win=65535 Len=0
1,6.188482999999906,10.0.2.15,62.210.85.178,TLSv1.2,4124,Application Data
1,6.188536999999997,62.210.85.178,10.0.2.15,TCP,60,9001  >  35978 [ACK] Seq=19900529 Ack=367442199 Win=65535 Len=0
1,6.188549000000421,62.210.85.178,10.0.2.15,TCP,60,9001  >  35978 [ACK] Seq=19900529 Ack=367443659 Win=65535 Len=0
1,6.188554000000295,62.210.85.178,10.0.2.15,TCP,60,9001  >  35978 [ACK] Seq=19900529 Ack=367444809 Win=65535 Len=0
1,6.1885999999994965,10.0.2.15,62.210.85.178,TLSv1.2,4124,Application Data
1,6.188640000000305,62.210.85.178,10.0.2.15,TCP,60,9001  >  35978 [ACK] Seq=19900529 Ack=367446269 Win=65535 Len=0
1,6.188648999999714,62.210.85.178,10.0.2.15,TCP,60,9001  >  35978 [ACK] Seq=19900529 Ack=367447729 Win=65535 Len=0
1,6.1886539999995875,62.210.85.178,10.0.2.15,TCP,60,9001  >  35978 [ACK] Seq=19900529 Ack=367448879 Win=65535 Len=0
1,6.188694000000396,10.0.2.15,62.210.85.178,TLSv1.2,4124,Application Data
1,6.1887320000005275,62.210.85.178,10.0.2.15,TCP,60,9001  >  35978 [ACK] Seq=19900529 Ack=367450339 Win=65535 Len=0
1,6.188740999999936,62.210.85.178,10.0.2.15,TCP,60,9001  >  35978 [ACK] Seq=19900529 Ack=367451799 Win=65535 Len=0
1,6.1887450000012905,62.210.85.178,10.0.2.15,TCP,60,9001  >  35978 [ACK] Seq=19900529 Ack=367452949 Win=65535 Len=0
1,6.188782999999603,10.0.2.15,62.210.85.178,TLSv1.2,4124,Application Data
1,6.188822000000073,62.210.85.178,10.0.2.15,TCP,60,9001  >  35978 [ACK] Seq=19900529 Ack=367454409 Win=65535 Len=0
1,6.188830000000962,62.210.85.178,10.0.2.15,TCP,60,9001  >  35978 [ACK] Seq=19900529 Ack=367455869 Win=65535 Len=0
1,6.188835000000836,62.210.85.178,10.0.2.15,TCP,60,9001  >  35978 [ACK] Seq=19900529 Ack=367457019 Win=65535 Len=0
1,6.188869999999952,10.0.2.15,62.210.85.178,TLSv1.2,332,Application Data
1,6.188906999999745,62.210.85.178,10.0.2.15,TCP,60,9001  >  35978 [ACK] Seq=19900529 Ack=367457297 Win=65535 Len=0
1,6.188959999999497,10.0.2.15,62.210.85.178,TLSv1.2,3868,Application Data
1,6.188998999999967,62.210.85.178,10.0.2.15,TCP,60,9001  >  35978 [ACK] Seq=19900529 Ack=367458757 Win=65535 Len=0
1,6.189007000000856,62.210.85.178,10.0.2.15,TCP,60,9001  >  35978 [ACK] Seq=19900529 Ack=367460217 Win=65535 Len=0
1,6.18901200000073,62.210.85.178,10.0.2.15,TCP,60,9001  >  35978 [ACK] Seq=19900529 Ack=367461111 Win=65535 Len=0
1,6.189054000000397,10.0.2.15,62.210.85.178,TLSv1.2,4124,Application Data
1,6.1890910000001895,62.210.85.178,10.0.2.15,TCP,60,9001  >  35978 [ACK] Seq=19900529 Ack=367462571 Win=65535 Len=0
1,6.189099000001079,62.210.85.178,10.0.2.15,TCP,60,9001  >  35978 [ACK] Seq=19900529 Ack=367464031 Win=65535 Len=0
1,6.189103000000614,62.210.85.178,10.0.2.15,TCP,60,9001  >  35978 [ACK] Seq=19900529 Ack=367465181 Win=65535 Len=0
1,6.189146000000619,10.0.2.15,62.210.85.178,TLSv1.2,3030,Application Data
1,6.189185000001089,62.210.85.178,10.0.2.15,TCP,60,9001  >  35978 [ACK] Seq=19900529 Ack=367466641 Win=65535 Len=0
1,6.189193000000159,62.210.85.178,10.0.2.15,TCP,60,9001  >  35978 [ACK] Seq=19900529 Ack=367468101 Win=65535 Len=0
1,6.189196000001175,62.210.85.178,10.0.2.15,TCP,60,9001  >  35978 [ACK] Seq=19900529 Ack=367468157 Win=65535 Len=0
1,6.201673999999912,10.0.2.15,62.210.85.178,TLSv1.2,4124,Application Data
1,6.201997000000119,62.210.85.178,10.0.2.15,TCP,60,9001  >  35978 [ACK] Seq=19900529 Ack=367469617 Win=65535 Len=0
1,6.202038999999786,62.210.85.178,10.0.2.15,TCP,60,9001  >  35978 [ACK] Seq=19900529 Ack=367471077 Win=65535 Len=0
1,6.20204300000114,62.210.85.178,10.0.2.15,TCP,60,9001  >  35978 [ACK] Seq=19900529 Ack=367472227 Win=65535 Len=0
1,6.202113000001191,10.0.2.15,62.210.85.178,TLSv1.2,4124,Application Data
1,6.202158000000054,62.210.85.178,10.0.2.15,TCP,60,9001  >  35978 [ACK] Seq=19900529 Ack=367473687 Win=65535 Len=0
1,6.20216900000014,62.210.85.178,10.0.2.15,TCP,60,9001  >  35978 [ACK] Seq=19900529 Ack=367475147 Win=65535 Len=0
1,6.202172999999675,62.210.85.178,10.0.2.15,TCP,60,9001  >  35978 [ACK] Seq=19900529 Ack=367476297 Win=65535 Len=0
1,6.202214000000822,10.0.2.15,62.210.85.178,TLSv1.2,4124,Application Data
1,6.202248999999938,62.210.85.178,10.0.2.15,TCP,60,9001  >  35978 [ACK] Seq=19900529 Ack=367477757 Win=65535 Len=0
1,6.202257000000827,62.210.85.178,10.0.2.15,TCP,60,9001  >  35978 [ACK] Seq=19900529 Ack=367479217 Win=65535 Len=0
1,6.202261000000362,62.210.85.178,10.0.2.15,TCP,60,9001  >  35978 [ACK] Seq=19900529 Ack=367480367 Win=65535 Len=0
1,6.202296000001297,10.0.2.15,62.210.85.178,TLSv1.2,4124,Application Data
1,6.202331000000413,62.210.85.178,10.0.2.15,TCP,60,9001  >  35978 [ACK] Seq=19900529 Ack=367481827 Win=65535 Len=0
1,6.202338000000964,62.210.85.178,10.0.2.15,TCP,60,9001  >  35978 [ACK] Seq=19900529 Ack=367483287 Win=65535 Len=0
1,6.20234100000016,62.210.85.178,10.0.2.15,TCP,60,9001  >  35978 [ACK] Seq=19900529 Ack=367484437 Win=65535 Len=0
1,6.202375000000757,10.0.2.15,62.210.85.178,TLSv1.2,332,Application Data
1,6.202408999999534,62.210.85.178,10.0.2.15,TCP,60,9001  >  35978 [ACK] Seq=19900529 Ack=367484715 Win=65535 Len=0
1,6.202466000000641,10.0.2.15,62.210.85.178,TLSv1.2,3868,Application Data
1,6.2025009999997565,62.210.85.178,10.0.2.15,TCP,60,9001  >  35978 [ACK] Seq=19900529 Ack=367486175 Win=65535 Len=0
1,6.202509000000646,62.210.85.178,10.0.2.15,TCP,60,9001  >  35978 [ACK] Seq=19900529 Ack=367487635 Win=65535 Len=0
1,6.202511999999842,62.210.85.178,10.0.2.15,TCP,60,9001  >  35978 [ACK] Seq=19900529 Ack=367488529 Win=65535 Len=0
1,6.202548999999635,10.0.2.15,62.210.85.178,TLSv1.2,4124,Application Data
1,6.2025830000002316,62.210.85.178,10.0.2.15,TCP,60,9001  >  35978 [ACK] Seq=19900529 Ack=367489989 Win=65535 Len=0
1,6.202590000000782,62.210.85.178,10.0.2.15,TCP,60,9001  >  35978 [ACK] Seq=19900529 Ack=367491449 Win=65535 Len=0
1,6.2025940000003175,62.210.85.178,10.0.2.15,TCP,60,9001  >  35978 [ACK] Seq=19900529 Ack=367492599 Win=65535 Len=0
1,6.202629000001252,10.0.2.15,62.210.85.178,TLSv1.2,2516,Application Data
1,6.20266300000003,62.210.85.178,10.0.2.15,TCP,60,9001  >  35978 [ACK] Seq=19900529 Ack=367494059 Win=65535 Len=0
1,6.20267000000058,62.210.85.178,10.0.2.15,TCP,60,9001  >  35978 [ACK] Seq=19900529 Ack=367495061 Win=65535 Len=0
1,6.260318000000552,54.93.77.70,10.0.2.15,TLSv1.2,590,Application Data
1,6.301413999999568,10.0.2.15,54.93.77.70,TCP,54,34692  >  9001 [ACK] Seq=19980401 Ack=367101477 Win=65535 Len=0
1,6.311222000000271,54.93.77.70,10.0.2.15,TLSv1.2,3674,Application Data
1,6.311295999999857,10.0.2.15,54.93.77.70,TCP,54,34692  >  9001 [ACK] Seq=19980401 Ack=367105097 Win=65535 Len=0
1,6.320929999999862,54.93.77.70,10.0.2.15,TCP,2950,"9001  >  34692 [PSH, ACK] Seq=367105097 Ack=19980401 Win=65535 Len=2896 [TCP segment of a reassembled PDU]"
1,6.320987000000969,10.0.2.15,54.93.77.70,TCP,54,34692  >  9001 [ACK] Seq=19980401 Ack=367107993 Win=65535 Len=0
1,6.327430000001186,54.93.77.70,10.0.2.15,TLSv1.2,778,Application Data
1,6.327476000000388,10.0.2.15,54.93.77.70,TCP,54,34692  >  9001 [ACK] Seq=19980401 Ack=367108717 Win=65535 Len=0
1,6.338078000000678,54.93.77.70,10.0.2.15,TLSv1.2,2950,Application Data
1,6.338122000001022,10.0.2.15,54.93.77.70,TCP,54,34692  >  9001 [ACK] Seq=19980401 Ack=367111613 Win=65535 Len=0
1,6.343318000001091,54.93.77.70,10.0.2.15,TLSv1.2,1314,Application Data
1,6.343361999999615,10.0.2.15,54.93.77.70,TCP,54,34692  >  9001 [ACK] Seq=19980401 Ack=367112873 Win=65535 Len=0
1,6.36830000000009,54.93.77.70,10.0.2.15,TLSv1.2,6266,"Application Data, Application Data"
1,6.368359000000055,10.0.2.15,54.93.77.70,TCP,54,34692  >  9001 [ACK] Seq=19980401 Ack=367119085 Win=65535 Len=0
1,6.391469000000143,54.93.77.70,10.0.2.15,TLSv1.2,3674,Application Data
1,6.391519000000699,10.0.2.15,54.93.77.70,TCP,54,34692  >  9001 [ACK] Seq=19980401 Ack=367122705 Win=65535 Len=0
1,6.400589000000764,54.93.77.70,10.0.2.15,TLSv1.2,4398,Application Data
1,6.400655000001279,10.0.2.15,54.93.77.70,TCP,54,34692  >  9001 [ACK] Seq=19980401 Ack=367127049 Win=65535 Len=0
1,6.407622000000629,54.93.77.70,10.0.2.15,TLSv1.2,1408,Application Data
1,6.4076939999995375,10.0.2.15,54.93.77.70,TCP,54,34692  >  9001 [ACK] Seq=19980401 Ack=367128403 Win=65535 Len=0
1,6.407912000000579,10.0.2.15,54.93.77.70,TLSv1.2,590,Application Data
1,6.408004000000801,54.93.77.70,10.0.2.15,TCP,60,9001  >  34692 [ACK] Seq=367128403 Ack=19980937 Win=65535 Len=0
1,6.423475999999937,54.93.77.70,10.0.2.15,TLSv1.2,590,Application Data
1,6.434643000000506,54.93.77.70,10.0.2.15,TCP,2950,"9001  >  34692 [PSH, ACK] Seq=367128939 Ack=19980937 Win=65535 Len=2896 [TCP segment of a reassembled PDU]"
1,6.434719000000769,10.0.2.15,54.93.77.70,TCP,54,34692  >  9001 [ACK] Seq=19980937 Ack=367131835 Win=65535 Len=0
1,6.450638000000254,54.93.77.70,10.0.2.15,TLSv1.2,1314,"Application Data, Application Data"
1,6.456969000000754,54.93.77.70,10.0.2.15,TCP,2950,"9001  >  34692 [PSH, ACK] Seq=367133095 Ack=19980937 Win=65535 Len=2896 [TCP segment of a reassembled PDU]"
1,6.457033000000592,10.0.2.15,54.93.77.70,TCP,54,34692  >  9001 [ACK] Seq=19980937 Ack=367135991 Win=65535 Len=0
1,6.464818000000378,54.93.77.70,10.0.2.15,TLSv1.2,7294,"Application Data, Application Data"
1,6.464885999999751,10.0.2.15,54.93.77.70,TCP,54,34692  >  9001 [ACK] Seq=19980937 Ack=367143231 Win=65535 Len=0
1,6.473147000000608,54.93.77.70,10.0.2.15,TLSv1.2,1292,Application Data
1,6.473342000001139,10.0.2.15,54.93.77.70,TLSv1.2,590,Application Data
1,6.4734540000008565,54.93.77.70,10.0.2.15,TCP,60,9001  >  34692 [ACK] Seq=367144469 Ack=19981473 Win=65535 Len=0
1,6.507074999999531,54.93.77.70,10.0.2.15,TLSv1.2,5752,"Application Data, Application Data"
1,6.507218000000648,10.0.2.15,54.93.77.70,TCP,54,34692  >  9001 [ACK] Seq=19981473 Ack=367150167 Win=65535 Len=0
1,6.524825000000419,54.93.77.70,10.0.2.15,TLSv1.2,5734,Application Data
1,6.524875000000975,10.0.2.15,54.93.77.70,TCP,54,34692  >  9001 [ACK] Seq=19981473 Ack=367155847 Win=65535 Len=0
1,6.524930999999924,54.93.77.70,10.0.2.15,TCP,166,"9001  >  34692 [PSH, ACK] Seq=367155847 Ack=19981473 Win=65535 Len=112 [TCP segment of a reassembled PDU]"
1,6.5249409999996715,54.93.77.70,10.0.2.15,TLSv1.2,4398,Application Data [TCP segment of a reassembled PDU]
1,6.525003000000652,10.0.2.15,54.93.77.70,TCP,54,34692  >  9001 [ACK] Seq=19981473 Ack=367160303 Win=65535 Len=0
1,6.5251939999998285,10.0.2.15,54.93.77.70,TLSv1.2,590,Application Data
1,6.525304000000688,54.93.77.70,10.0.2.15,TCP,60,9001  >  34692 [ACK] Seq=367160303 Ack=19982009 Win=65535 Len=0
1,6.54131100000086,54.93.77.70,10.0.2.15,TLSv1.2,1292,Application Data
1,6.5813990000006015,10.0.2.15,54.93.77.70,TCP,54,34692  >  9001 [ACK] Seq=19982009 Ack=367161541 Win=65535 Len=0
1,6.603918000000704,54.93.77.70,10.0.2.15,TCP,2950,"9001  >  34692 [PSH, ACK] Seq=367161541 Ack=19982009 Win=65535 Len=2896 [TCP segment of a reassembled PDU]"
1,6.6040090000005875,10.0.2.15,54.93.77.70,TCP,54,34692  >  9001 [ACK] Seq=19982009 Ack=367164437 Win=65535 Len=0
1,6.604655000001003,54.93.77.70,10.0.2.15,TLSv1.2,9046,"Application Data, Application Data, Application Data"
1,6.604719000000841,10.0.2.15,54.93.77.70,TCP,54,34692  >  9001 [ACK] Seq=19982009 Ack=367173429 Win=65535 Len=0
1,6.609225000000151,62.210.85.178,10.0.2.15,TLSv1.2,1104,Application Data
1,6.622580000001108,54.93.77.70,10.0.2.15,TLSv1.2,5752,"Application Data, Application Data"
1,6.622626000000309,10.0.2.15,54.93.77.70,TCP,54,34692  >  9001 [ACK] Seq=19982009 Ack=367179127 Win=65535 Len=0
1,6.622865000001184,10.0.2.15,54.93.77.70,TLSv1.2,590,Application Data
1,6.622988999999507,54.93.77.70,10.0.2.15,TCP,60,9001  >  34692 [ACK] Seq=367179127 Ack=19982545 Win=65535 Len=0
1,6.649403999999777,10.0.2.15,62.210.85.178,TCP,54,35978  >  9001 [ACK] Seq=367495061 Ack=19901579 Win=65535 Len=0
1,6.6627380000009,54.93.77.70,10.0.2.15,TLSv1.2,3674,Application Data
1,6.66284799999994,10.0.2.15,54.93.77.70,TCP,54,34692  >  9001 [ACK] Seq=19982545 Ack=367182747 Win=65535 Len=0
1,6.679688000000169,54.93.77.70,10.0.2.15,TLSv1.2,590,Application Data
1,6.683453999999983,10.0.2.15,54.93.77.70,TLSv1.2,590,Application Data
1,6.6836440000006405,54.93.77.70,10.0.2.15,TCP,60,9001  >  34692 [ACK] Seq=367183283 Ack=19983081 Win=65535 Len=0
1,6.7052199999998265,62.210.85.178,10.0.2.15,TLSv1.2,590,Application Data
1,6.705309000000852,10.0.2.15,62.210.85.178,TCP,54,35978  >  9001 [ACK] Seq=367495061 Ack=19902115 Win=65535 Len=0
1,6.766701000000467,62.210.85.178,10.0.2.15,TLSv1.2,590,Application Data
1,6.766779999999926,10.0.2.15,62.210.85.178,TCP,54,35978  >  9001 [ACK] Seq=367495061 Ack=19902651 Win=65535 Len=0
1,6.798952000001009,62.210.85.178,10.0.2.15,TLSv1.2,590,Application Data
1,6.799055999999837,10.0.2.15,62.210.85.178,TCP,54,35978  >  9001 [ACK] Seq=367495061 Ack=19903187 Win=65535 Len=0
1,6.799681000000419,10.0.2.15,62.210.85.178,TLSv1.2,590,Application Data
1,6.7997919999997976,62.210.85.178,10.0.2.15,TCP,60,9001  >  35978 [ACK] Seq=19903187 Ack=367495597 Win=65535 Len=0
1,6.906640000001062,54.93.77.70,10.0.2.15,TLSv1.2,590,Application Data
1,6.907105000000229,10.0.2.15,54.93.77.70,TLSv1.2,590,Application Data
1,6.907207000000199,54.93.77.70,10.0.2.15,TCP,60,9001  >  34692 [ACK] Seq=367183819 Ack=19983617 Win=65535 Len=0
1,7.024541000000681,62.210.85.178,10.0.2.15,TLSv1.2,590,Application Data
1,7.034182999999757,10.0.2.15,62.210.85.178,TLSv1.2,590,Application Data
1,7.034386999999697,62.210.85.178,10.0.2.15,TCP,60,9001  >  35978 [ACK] Seq=19903723 Ack=367496133 Win=65535 Len=0
1,7.046150000000125,10.0.2.15,62.210.85.178,TLSv1.2,4124,Application Data
1,7.04625599999963,10.0.2.15,62.210.85.178,TCP,2974,35978  >  9001 [ACK] Seq=367500203 Ack=19903723 Win=65535 Len=2920 [TCP segment of a reassembled PDU]
1,7.046301000000312,62.210.85.178,10.0.2.15,TCP,60,9001  >  35978 [ACK] Seq=19903723 Ack=367497593 Win=65535 Len=0
1,7.04631100000006,62.210.85.178,10.0.2.15,TCP,60,9001  >  35978 [ACK] Seq=19903723 Ack=367499053 Win=65535 Len=0
1,7.046315999999933,62.210.85.178,10.0.2.15,TCP,60,9001  >  35978 [ACK] Seq=19903723 Ack=367500203 Win=65535 Len=0
1,7.0463200000012876,62.210.85.178,10.0.2.15,TCP,60,9001  >  35978 [ACK] Seq=19903723 Ack=367501663 Win=65535 Len=0
1,7.046324000000823,62.210.85.178,10.0.2.15,TCP,60,9001  >  35978 [ACK] Seq=19903723 Ack=367503123 Win=65535 Len=0
1,7.046367000000828,10.0.2.15,62.210.85.178,TLSv1.2,1204,Application Data
1,7.046433999999863,10.0.2.15,62.210.85.178,TCP,2974,35978  >  9001 [ACK] Seq=367504273 Ack=19903723 Win=65535 Len=2920 [TCP segment of a reassembled PDU]
1,7.0464759999995294,62.210.85.178,10.0.2.15,TCP,60,9001  >  35978 [ACK] Seq=19903723 Ack=367504273 Win=65535 Len=0
1,7.04648300000008,62.210.85.178,10.0.2.15,TCP,60,9001  >  35978 [ACK] Seq=19903723 Ack=367505733 Win=65535 Len=0
1,7.046487999999954,62.210.85.178,10.0.2.15,TCP,60,9001  >  35978 [ACK] Seq=19903723 Ack=367507193 Win=65535 Len=0
1,7.04652200000055,10.0.2.15,62.210.85.178,TLSv1.2,1204,Application Data
1,7.046586000000389,10.0.2.15,62.210.85.178,TCP,2974,35978  >  9001 [ACK] Seq=367508343 Ack=19903723 Win=65535 Len=2920 [TCP segment of a reassembled PDU]
1,7.0466230000001815,62.210.85.178,10.0.2.15,TCP,60,9001  >  35978 [ACK] Seq=19903723 Ack=367508343 Win=65535 Len=0
1,7.046631000001071,62.210.85.178,10.0.2.15,TCP,60,9001  >  35978 [ACK] Seq=19903723 Ack=367509803 Win=65535 Len=0
1,7.0466360000009445,62.210.85.178,10.0.2.15,TCP,60,9001  >  35978 [ACK] Seq=19903723 Ack=367511263 Win=65535 Len=0
1,7.046667000000525,10.0.2.15,62.210.85.178,TLSv1.2,1204,Application Data
1,7.046745999999985,10.0.2.15,62.210.85.178,TLSv1.2,2974,Application Data
1,7.0467829999997775,62.210.85.178,10.0.2.15,TCP,60,9001  >  35978 [ACK] Seq=19903723 Ack=367512413 Win=65535 Len=0
1,7.046790000000328,62.210.85.178,10.0.2.15,TCP,60,9001  >  35978 [ACK] Seq=19903723 Ack=367513873 Win=65535 Len=0
1,7.0467939999998634,62.210.85.178,10.0.2.15,TCP,60,9001  >  35978 [ACK] Seq=19903723 Ack=367515333 Win=65535 Len=0
1,7.046825000001263,10.0.2.15,62.210.85.178,TLSv1.2,1226,Application Data
1,7.046862000001056,62.210.85.178,10.0.2.15,TCP,60,9001  >  35978 [ACK] Seq=19903723 Ack=367516505 Win=65535 Len=0
1,7.046905999999581,10.0.2.15,62.210.85.178,TLSv1.2,4124,Application Data
1,7.046946000000389,62.210.85.178,10.0.2.15,TCP,60,9001  >  35978 [ACK] Seq=19903723 Ack=367517965 Win=65535 Len=0
1,7.04695300000094,62.210.85.178,10.0.2.15,TCP,60,9001  >  35978 [ACK] Seq=19903723 Ack=367519425 Win=65535 Len=0
1,7.046957000000475,62.210.85.178,10.0.2.15,TCP,60,9001  >  35978 [ACK] Seq=19903723 Ack=367520575 Win=65535 Len=0
1,7.047002999999677,10.0.2.15,62.210.85.178,TLSv1.2,3030,Application Data
1,7.047043000000485,62.210.85.178,10.0.2.15,TCP,60,9001  >  35978 [ACK] Seq=19903723 Ack=367522035 Win=65535 Len=0
1,7.047050000001036,62.210.85.178,10.0.2.15,TCP,60,9001  >  35978 [ACK] Seq=19903723 Ack=367523495 Win=65535 Len=0
1,7.047054000000571,62.210.85.178,10.0.2.15,TCP,60,9001  >  35978 [ACK] Seq=19903723 Ack=367523551 Win=65535 Len=0
1,7.05629399999998,10.0.2.15,62.210.85.178,TLSv1.2,4124,Application Data
1,7.056384999999864,10.0.2.15,62.210.85.178,TCP,2974,35978  >  9001 [ACK] Seq=367527621 Ack=19903723 Win=65535 Len=2920 [TCP segment of a reassembled PDU]
1,7.056425000000672,62.210.85.178,10.0.2.15,TCP,60,9001  >  35978 [ACK] Seq=19903723 Ack=367525011 Win=65535 Len=0
1,7.056434000000081,62.210.85.178,10.0.2.15,TCP,60,9001  >  35978 [ACK] Seq=19903723 Ack=367526471 Win=65535 Len=0
1,7.056437999999616,62.210.85.178,10.0.2.15,TCP,60,9001  >  35978 [ACK] Seq=19903723 Ack=367527621 Win=65535 Len=0
1,7.056443000001309,62.210.85.178,10.0.2.15,TCP,60,9001  >  35978 [ACK] Seq=19903723 Ack=367529081 Win=65535 Len=0
1,7.056447000000844,62.210.85.178,10.0.2.15,TCP,60,9001  >  35978 [ACK] Seq=19903723 Ack=367530541 Win=65535 Len=0
1,7.056488000000172,10.0.2.15,62.210.85.178,TLSv1.2,1204,Application Data
1,7.056555000001026,10.0.2.15,62.210.85.178,TCP,2974,35978  >  9001 [ACK] Seq=367531691 Ack=19903723 Win=65535 Len=2920 [TCP segment of a reassembled PDU]
1,7.056590000000142,62.210.85.178,10.0.2.15,TCP,60,9001  >  35978 [ACK] Seq=19903723 Ack=367531691 Win=65535 Len=0
1,7.056597000000693,62.210.85.178,10.0.2.15,TCP,60,9001  >  35978 [ACK] Seq=19903723 Ack=367533151 Win=65535 Len=0
1,7.056601000000228,62.210.85.178,10.0.2.15,TCP,60,9001  >  35978 [ACK] Seq=19903723 Ack=367534611 Win=65535 Len=0
1,7.056636000001163,10.0.2.15,62.210.85.178,TLSv1.2,1204,Application Data
1,7.056700000001001,10.0.2.15,62.210.85.178,TCP,2974,35978  >  9001 [ACK] Seq=367535761 Ack=19903723 Win=65535 Len=2920 [TCP segment of a reassembled PDU]
1,7.0567339999997785,62.210.85.178,10.0.2.15,TCP,60,9001  >  35978 [ACK] Seq=19903723 Ack=367535761 Win=65535 Len=0
1,7.056741000000329,62.210.85.178,10.0.2.15,TCP,60,9001  >  35978 [ACK] Seq=19903723 Ack=367537221 Win=65535 Len=0
1,7.056744999999864,62.210.85.178,10.0.2.15,TCP,60,9001  >  35978 [ACK] Seq=19903723 Ack=367538681 Win=65535 Len=0
1,7.056776000001264,10.0.2.15,62.210.85.178,TLSv1.2,1204,Application Data
1,7.056813000001057,62.210.85.178,10.0.2.15,TCP,60,9001  >  35978 [ACK] Seq=19903723 Ack=367539831 Win=65535 Len=0
1,7.056854000000385,10.0.2.15,62.210.85.178,TLSv1.2,332,Application Data
1,7.056892000000516,62.210.85.178,10.0.2.15,TCP,60,9001  >  35978 [ACK] Seq=19903723 Ack=367540109 Win=65535 Len=0
1,7.0569460000006075,10.0.2.15,62.210.85.178,TLSv1.2,3868,Application Data
1,7.056989000000613,62.210.85.178,10.0.2.15,TCP,60,9001  >  35978 [ACK] Seq=19903723 Ack=367541569 Win=65535 Len=0
1,7.056996000001163,62.210.85.178,10.0.2.15,TCP,60,9001  >  35978 [ACK] Seq=19903723 Ack=367543029 Win=65535 Len=0
1,7.0570000000006985,62.210.85.178,10.0.2.15,TCP,60,9001  >  35978 [ACK] Seq=19903723 Ack=367543923 Win=65535 Len=0
1,7.057047000000239,10.0.2.15,62.210.85.178,TLSv1.2,4124,Application Data
1,7.057107000000542,10.0.2.15,62.210.85.178,TCP,2974,35978  >  9001 [ACK] Seq=367547993 Ack=19903723 Win=65535 Len=2920 [TCP segment of a reassembled PDU]
1,7.057146000001012,62.210.85.178,10.0.2.15,TCP,60,9001  >  35978 [ACK] Seq=19903723 Ack=367545383 Win=65535 Len=0
1,7.057152999999744,62.210.85.178,10.0.2.15,TCP,60,9001  >  35978 [ACK] Seq=19903723 Ack=367546843 Win=65535 Len=0
1,7.057157000001098,62.210.85.178,10.0.2.15,TCP,60,9001  >  35978 [ACK] Seq=19903723 Ack=367547993 Win=65535 Len=0
1,7.057161000000633,62.210.85.178,10.0.2.15,TCP,60,9001  >  35978 [ACK] Seq=19903723 Ack=367549453 Win=65535 Len=0
1,7.057165000000168,62.210.85.178,10.0.2.15,TCP,60,9001  >  35978 [ACK] Seq=19903723 Ack=367550913 Win=65535 Len=0
1,7.057201999999961,10.0.2.15,62.210.85.178,TLSv1.2,110,Application Data
1,7.057290000000648,62.210.85.178,10.0.2.15,TCP,60,9001  >  35978 [ACK] Seq=19903723 Ack=367550969 Win=65535 Len=0
1,7.0697240000008605,10.0.2.15,62.210.85.178,TLSv1.2,4124,Application Data
1,7.069870999999694,10.0.2.15,62.210.85.178,TCP,2974,35978  >  9001 [ACK] Seq=367555039 Ack=19903723 Win=65535 Len=2920 [TCP segment of a reassembled PDU]
1,7.069900000000416,62.210.85.178,10.0.2.15,TCP,60,9001  >  35978 [ACK] Seq=19903723 Ack=367552429 Win=65535 Len=0
1,7.069911000000502,62.210.85.178,10.0.2.15,TCP,60,9001  >  35978 [ACK] Seq=19903723 Ack=367553889 Win=65535 Len=0
1,7.069916000000376,62.210.85.178,10.0.2.15,TCP,60,9001  >  35978 [ACK] Seq=19903723 Ack=367555039 Win=65535 Len=0
1,7.069919999999911,62.210.85.178,10.0.2.15,TCP,60,9001  >  35978 [ACK] Seq=19903723 Ack=367556499 Win=65535 Len=0
1,7.069924000001265,62.210.85.178,10.0.2.15,TCP,60,9001  >  35978 [ACK] Seq=19903723 Ack=367557959 Win=65535 Len=0
1,7.069969000000128,10.0.2.15,62.210.85.178,TLSv1.2,1204,Application Data
1,7.070044000000053,62.210.85.178,10.0.2.15,TCP,60,9001  >  35978 [ACK] Seq=19903723 Ack=367559109 Win=65535 Len=0
1,7.070082000000184,10.0.2.15,62.210.85.178,TCP,2974,35978  >  9001 [ACK] Seq=367559109 Ack=19903723 Win=65535 Len=2920 [TCP segment of a reassembled PDU]
1,7.0701200000003155,62.210.85.178,10.0.2.15,TCP,60,9001  >  35978 [ACK] Seq=19903723 Ack=367560569 Win=65535 Len=0
1,7.070127000000866,62.210.85.178,10.0.2.15,TCP,60,9001  >  35978 [ACK] Seq=19903723 Ack=367562029 Win=65535 Len=0
1,7.0701609999996435,10.0.2.15,62.210.85.178,TLSv1.2,1204,Application Data
1,7.070198000001255,62.210.85.178,10.0.2.15,TCP,60,9001  >  35978 [ACK] Seq=19903723 Ack=367563179 Win=65535 Len=0
1,7.07024199999978,10.0.2.15,62.210.85.178,TLSv1.2,4124,Application Data
1,7.0702799999999115,62.210.85.178,10.0.2.15,TCP,60,9001  >  35978 [ACK] Seq=19903723 Ack=367564639 Win=65535 Len=0
1,7.070287000000462,62.210.85.178,10.0.2.15,TCP,60,9001  >  35978 [ACK] Seq=19903723 Ack=367566099 Win=65535 Len=0
1,7.070290999999997,62.210.85.178,10.0.2.15,TCP,60,9001  >  35978 [ACK] Seq=19903723 Ack=367567249 Win=65535 Len=0
1,7.070335000000341,10.0.2.15,62.210.85.178,TLSv1.2,332,Application Data
1,7.070374000000811,62.210.85.178,10.0.2.15,TCP,60,9001  >  35978 [ACK] Seq=19903723 Ack=367567527 Win=65535 Len=0
1,7.070433000000776,10.0.2.15,62.210.85.178,TLSv1.2,1618,Application Data
1,7.070517000000109,62.210.85.178,10.0.2.15,TCP,60,9001  >  35978 [ACK] Seq=19903723 Ack=367568987 Win=65535 Len=0
1,7.07053199999973,62.210.85.178,10.0.2.15,TCP,60,9001  >  35978 [ACK] Seq=19903723 Ack=367569091 Win=65535 Len=0
1,7.15407100000084,54.93.77.70,10.0.2.15,TLSv1.2,590,Application Data
1,7.17254099999991,54.93.77.70,10.0.2.15,TCP,2950,"9001  >  34692 [PSH, ACK] Seq=367184355 Ack=19983617 Win=65535 Len=2896 [TCP segment of a reassembled PDU]"
1,7.172638000000006,10.0.2.15,54.93.77.70,TCP,54,34692  >  9001 [ACK] Seq=19983617 Ack=367187251 Win=65535 Len=0
1,7.182542000000467,54.93.77.70,10.0.2.15,TLSv1.2,7294,"Application Data, Application Data"
1,7.182613000000856,10.0.2.15,54.93.77.70,TCP,54,34692  >  9001 [ACK] Seq=19983617 Ack=367194491 Win=65535 Len=0
1,7.182929000000513,54.93.77.70,10.0.2.15,TLSv1.2,4398,Application Data [TCP segment of a reassembled PDU]
1,7.182972000000518,10.0.2.15,54.93.77.70,TCP,54,34692  >  9001 [ACK] Seq=19983617 Ack=367198835 Win=65535 Len=0
1,7.188513000000967,54.93.77.70,10.0.2.15,TLSv1.2,568,Application Data
1,7.188689000000522,10.0.2.15,54.93.77.70,TLSv1.2,590,Application Data
1,7.188803000000917,54.93.77.70,10.0.2.15,TCP,60,9001  >  34692 [ACK] Seq=367199349 Ack=19984153 Win=65535 Len=0
1,7.203263000001243,54.93.77.70,10.0.2.15,TLSv1.2,5846,Application Data
1,7.203357000000324,10.0.2.15,54.93.77.70,TCP,54,34692  >  9001 [ACK] Seq=19984153 Ack=367205141 Win=65535 Len=0
1,7.204880999999659,54.93.77.70,10.0.2.15,TLSv1.2,474,Application Data
1,7.216347999999925,54.93.77.70,10.0.2.15,TLSv1.2,7294,Application Data
1,7.21642299999985,10.0.2.15,54.93.77.70,TCP,54,34692  >  9001 [ACK] Seq=19984153 Ack=367212801 Win=65535 Len=0
1,7.235587999999552,54.93.77.70,10.0.2.15,TLSv1.2,3464,Application Data [TCP segment of a reassembled PDU]
1,7.2356460000009974,10.0.2.15,54.93.77.70,TCP,54,34692  >  9001 [ACK] Seq=19984153 Ack=367216211 Win=65535 Len=0
1,7.235851000001276,10.0.2.15,54.93.77.70,TLSv1.2,590,Application Data
1,7.235971000000063,54.93.77.70,10.0.2.15,TCP,60,9001  >  34692 [ACK] Seq=367216211 Ack=19984689 Win=65535 Len=0
1,7.236727999999857,54.93.77.70,10.0.2.15,TLSv1.2,5846,"Application Data, Application Data"
1,7.236795000000711,10.0.2.15,54.93.77.70,TCP,54,34692  >  9001 [ACK] Seq=19984689 Ack=367222003 Win=65535 Len=0
1,7.245136999999886,54.93.77.70,10.0.2.15,TLSv1.2,4398,Application Data [TCP segment of a reassembled PDU]
1,7.245184999999765,10.0.2.15,54.93.77.70,TCP,54,34692  >  9001 [ACK] Seq=19984689 Ack=367226347 Win=65535 Len=0
1,7.258378000000448,54.93.77.70,10.0.2.15,TLSv1.2,474,Application Data
1,7.296554000000469,54.93.77.70,10.0.2.15,TLSv1.2,5846,Application Data
1,7.296614000000773,10.0.2.15,54.93.77.70,TCP,54,34692  >  9001 [ACK] Seq=19984689 Ack=367232559 Win=65535 Len=0
1,7.296707999999853,54.93.77.70,10.0.2.15,TLSv1.2,2950,Application Data [TCP segment of a reassembled PDU]
1,7.296766999999818,10.0.2.15,54.93.77.70,TCP,54,34692  >  9001 [ACK] Seq=19984689 Ack=367235455 Win=65535 Len=0
1,7.304847000001246,54.93.77.70,10.0.2.15,TLSv1.2,7294,"Application Data, Application Data"
1,7.304895999999644,10.0.2.15,54.93.77.70,TCP,54,34692  >  9001 [ACK] Seq=19984689 Ack=367242695 Win=65535 Len=0
1,7.305075000000215,10.0.2.15,54.93.77.70,TLSv1.2,590,Application Data
1,7.305182000000059,54.93.77.70,10.0.2.15,TCP,60,9001  >  34692 [ACK] Seq=367242695 Ack=19985225 Win=65535 Len=0
1,7.306146000000808,54.93.77.70,10.0.2.15,TLSv1.2,8574,"Application Data, Application Data"
1,7.306179999999586,10.0.2.15,54.93.77.70,TCP,54,34692  >  9001 [ACK] Seq=19985225 Ack=367251215 Win=65535 Len=0
1,7.306233000001157,54.93.77.70,10.0.2.15,TCP,1670,"9001  >  34692 [PSH, ACK] Seq=367251215 Ack=19985225 Win=65535 Len=1616 [TCP segment of a reassembled PDU]"
1,7.306282999999894,10.0.2.15,54.93.77.70,TCP,54,34692  >  9001 [ACK] Seq=19985225 Ack=367252831 Win=65535 Len=0
1,7.307976000000053,54.93.77.70,10.0.2.15,TLSv1.2,4398,"Application Data, Application Data, Application Data"
1,7.308020000000397,10.0.2.15,54.93.77.70,TCP,54,34692  >  9001 [ACK] Seq=19985225 Ack=367257175 Win=65535 Len=0
1,7.311337000001004,62.210.85.178,10.0.2.15,TLSv1.2,590,Application Data
1,7.315438999999969,10.0.2.15,54.93.77.70,TLSv1.2,1618,Application Data
1,7.315588999999818,54.93.77.70,10.0.2.15,TCP,60,9001  >  34692 [ACK] Seq=367257175 Ack=19986685 Win=65535 Len=0
1,7.31560300000092,54.93.77.70,10.0.2.15,TCP,60,9001  >  34692 [ACK] Seq=367257175 Ack=19986789 Win=65535 Len=0
1,7.321939999999813,54.93.77.70,10.0.2.15,TLSv1.2,192,Application Data
1,7.356756000001042,10.0.2.15,62.210.85.178,TCP,54,35978  >  9001 [ACK] Seq=367569091 Ack=19904259 Win=65535 Len=0
1,7.3654590000005555,10.0.2.15,54.93.77.70,TCP,54,34692  >  9001 [ACK] Seq=19986789 Ack=367257313 Win=65535 Len=0
1,7.38591500000075,62.210.85.178,10.0.2.15,TLSv1.2,590,Application Data
1,7.385991999999533,10.0.2.15,62.210.85.178,TCP,54,35978  >  9001 [ACK] Seq=367569091 Ack=19904795 Win=65535 Len=0
1,7.435822000001281,62.210.85.178,10.0.2.15,TLSv1.2,590,Application Data
1,7.4358700000011595,10.0.2.15,62.210.85.178,TCP,54,35978  >  9001 [ACK] Seq=367569091 Ack=19905331 Win=65535 Len=0
1,7.458554000000731,62.210.85.178,10.0.2.15,TLSv1.2,1618,Application Data
1,7.458608000000822,10.0.2.15,62.210.85.178,TCP,54,35978  >  9001 [ACK] Seq=367569091 Ack=19906895 Win=65535 Len=0
1,7.459055000001172,10.0.2.15,62.210.85.178,TLSv1.2,590,Application Data
1,7.459154000000126,62.210.85.178,10.0.2.15,TCP,60,9001  >  35978 [ACK] Seq=19906895 Ack=367569627 Win=65535 Len=0
1,7.690823000000819,54.93.77.70,10.0.2.15,TLSv1.2,590,Application Data
1,7.690898000000743,10.0.2.15,54.93.77.70,TCP,54,34692  >  9001 [ACK] Seq=19986789 Ack=367257849 Win=65535 Len=0
1,7.6913299999996525,10.0.2.15,54.93.77.70,TLSv1.2,590,Application Data
1,7.691420999999536,54.93.77.70,10.0.2.15,TCP,60,9001  >  34692 [ACK] Seq=367257849 Ack=19987325 Win=65535 Len=0
1,7.7983580000000075,62.210.85.178,10.0.2.15,TLSv1.2,590,Application Data
1,7.801293000000442,10.0.2.15,62.210.85.178,TLSv1.2,590,Application Data
1,7.803514000001087,62.210.85.178,10.0.2.15,TCP,60,9001  >  35978 [ACK] Seq=19907431 Ack=367570163 Win=65535 Len=0
1,7.817274000000907,10.0.2.15,62.210.85.178,TLSv1.2,4124,Application Data
1,7.817445000000589,10.0.2.15,62.210.85.178,TCP,1514,35978  >  9001 [ACK] Seq=367574233 Ack=19907431 Win=65535 Len=1460 [TCP segment of a reassembled PDU]
1,7.817497000000003,62.210.85.178,10.0.2.15,TCP,60,9001  >  35978 [ACK] Seq=19907431 Ack=367571623 Win=65535 Len=0
1,7.817510000000766,62.210.85.178,10.0.2.15,TCP,60,9001  >  35978 [ACK] Seq=19907431 Ack=367573083 Win=65535 Len=0
1,7.817514000000301,62.210.85.178,10.0.2.15,TCP,60,9001  >  35978 [ACK] Seq=19907431 Ack=367574233 Win=65535 Len=0
1,7.817557000000306,10.0.2.15,62.210.85.178,TLSv1.2,1250,Application Data
1,7.817602999999508,62.210.85.178,10.0.2.15,TCP,60,9001  >  35978 [ACK] Seq=19907431 Ack=367575693 Win=65535 Len=0
1,7.817612000000736,62.210.85.178,10.0.2.15,TCP,60,9001  >  35978 [ACK] Seq=19907431 Ack=367576889 Win=65535 Len=0
1,7.911973000000216,54.93.77.70,10.0.2.15,TLSv1.2,590,Application Data
1,7.944359000000986,54.93.77.70,10.0.2.15,TLSv1.2,3674,Application Data
1,7.944430999999895,10.0.2.15,54.93.77.70,TCP,54,34692  >  9001 [ACK] Seq=19987325 Ack=367262005 Win=65535 Len=0
1,7.953096000001096,54.93.77.70,10.0.2.15,TCP,2950,"9001  >  34692 [PSH, ACK] Seq=367262005 Ack=19987325 Win=65535 Len=2896 [TCP segment of a reassembled PDU]"
1,7.953138000000763,10.0.2.15,54.93.77.70,TCP,54,34692  >  9001 [ACK] Seq=19987325 Ack=367264901 Win=65535 Len=0
1,7.96038899999985,54.93.77.70,10.0.2.15,TLSv1.2,264,Application Data
1,7.962571000000025,10.0.2.15,54.93.77.70,TLSv1.2,590,Application Data
1,7.962741999999707,54.93.77.70,10.0.2.15,TCP,60,9001  >  34692 [ACK] Seq=367265111 Ack=19987861 Win=65535 Len=0
1,8.101112000000285,62.210.85.178,10.0.2.15,TLSv1.2,590,Application Data
1,8.10164100000111,10.0.2.15,62.210.85.178,TLSv1.2,590,Application Data
1,8.1024010000001,62.210.85.178,10.0.2.15,TCP,60,9001  >  35978 [ACK] Seq=19907967 Ack=367577425 Win=65535 Len=0
1,8.238610000000335,54.93.77.70,10.0.2.15,TLSv1.2,590,Application Data
1,8.239020000000892,10.0.2.15,54.93.77.70,TLSv1.2,590,Application Data
1,8.239129999999932,54.93.77.70,10.0.2.15,TCP,60,9001  >  34692 [ACK] Seq=367265647 Ack=19988397 Win=65535 Len=0
1,8.612863000000289,62.210.85.178,10.0.2.15,TLSv1.2,590,Application Data
1,8.615760000000591,10.0.2.15,62.210.85.178,TLSv1.2,590,Application Data
1,8.615928000001077,62.210.85.178,10.0.2.15,TCP,60,9001  >  35978 [ACK] Seq=19908503 Ack=367577961 Win=65535 Len=0
1,8.625471999999718,10.0.2.15,62.210.85.178,TLSv1.2,4124,Application Data
1,8.625584000001254,62.210.85.178,10.0.2.15,TCP,60,9001  >  35978 [ACK] Seq=19908503 Ack=367579421 Win=65535 Len=0
1,8.625597000000198,62.210.85.178,10.0.2.15,TCP,60,9001  >  35978 [ACK] Seq=19908503 Ack=367580881 Win=65535 Len=0
1,8.625600999999733,62.210.85.178,10.0.2.15,TCP,60,9001  >  35978 [ACK] Seq=19908503 Ack=367582031 Win=65535 Len=0
1,8.625632999999652,10.0.2.15,62.210.85.178,TLSv1.2,1168,Application Data
1,8.626001000000542,62.210.85.178,10.0.2.15,TCP,60,9001  >  35978 [ACK] Seq=19908503 Ack=367583145 Win=65535 Len=0
1,8.661799999999857,10.0.2.15,152.89.104.206,TLSv1.3,590,Application Data
1,8.661939999999959,152.89.104.206,10.0.2.15,TCP,60,9001  >  47334 [ACK] Seq=18896 Ack=13279 Win=65535 Len=0
1,8.74183500000072,54.93.77.70,10.0.2.15,TLSv1.2,590,Application Data
1,8.758867000000464,54.93.77.70,10.0.2.15,TCP,2950,"9001  >  34692 [PSH, ACK] Seq=367266183 Ack=19988397 Win=65535 Len=2896 [TCP segment of a reassembled PDU]"
1,8.758960000001025,10.0.2.15,54.93.77.70,TCP,54,34692  >  9001 [ACK] Seq=19988397 Ack=367269079 Win=65535 Len=0
1,8.773536000000604,54.93.77.70,10.0.2.15,TLSv1.2,1502,Application Data [TCP segment of a reassembled PDU]
1,8.77357800000027,10.0.2.15,54.93.77.70,TCP,54,34692  >  9001 [ACK] Seq=19988397 Ack=367270527 Win=65535 Len=0
1,8.774873000000298,54.93.77.70,10.0.2.15,TLSv1.2,894,Application Data
