No.,Time,Source,Destination,Protocol,Length,Info
1,0.012732000001051347,62.210.85.178,10.0.2.15,TLSv1.2,590,Application Data
1,0.012822000000596745,10.0.2.15,62.210.85.178,TCP,54,35978  >  9001 [ACK] Seq=391048049 Ack=21115761 Win=65535 Len=0
1,0.031160000000454602,62.210.85.178,10.0.2.15,TLSv1.2,590,Application Data
1,0.03126999999949476,10.0.2.15,62.210.85.178,TCP,54,35978  >  9001 [ACK] Seq=391048049 Ack=21116297 Win=65535 Len=0
1,0.13159000000086962,10.0.2.15,54.93.77.70,TLSv1.2,590,Application Data
1,0.13175799999953597,54.93.77.70,10.0.2.15,TCP,60,9001  >  34692 [ACK] Seq=390745537 Ack=21205767 Win=65535 Len=0
1,0.246871999999712,62.210.85.178,10.0.2.15,TLSv1.2,590,Application Data
1,0.24694000000090455,10.0.2.15,62.210.85.178,TCP,54,35978  >  9001 [ACK] Seq=391048049 Ack=21116833 Win=65535 Len=0
1,0.24737800000002608,10.0.2.15,62.210.85.178,TLSv1.2,590,Application Data
1,0.2476360000000568,62.210.85.178,10.0.2.15,TCP,60,9001  >  35978 [ACK] Seq=21116833 Ack=391048585 Win=65535 Len=0
1,0.3275709999998071,54.93.77.70,10.0.2.15,TLSv1.2,590,Application Data
1,0.3279550000006566,10.0.2.15,54.93.77.70,TLSv1.2,1618,Application Data
1,0.3280690000010509,54.93.77.70,10.0.2.15,TCP,60,9001  >  34692 [ACK] Seq=390746073 Ack=21207331 Win=65535 Len=0
1,0.530029999999897,62.210.85.178,10.0.2.15,TLSv1.2,1618,Application Data
1,0.5301579999995738,10.0.2.15,62.210.85.178,TCP,54,35978  >  9001 [ACK] Seq=391048585 Ack=21118397 Win=65535 Len=0
1,0.5437369999999646,10.0.2.15,62.210.85.178,TLSv1.2,590,Application Data
1,0.5439079999996466,62.210.85.178,10.0.2.15,TCP,60,9001  >  35978 [ACK] Seq=21118397 Ack=391049121 Win=65535 Len=0
1,0.5555580000000191,10.0.2.15,62.210.85.178,TLSv1.2,1618,Application Data
1,0.5557050000006711,62.210.85.178,10.0.2.15,TCP,60,9001  >  35978 [ACK] Seq=21118397 Ack=391050581 Win=65535 Len=0
1,0.5557220000009693,62.210.85.178,10.0.2.15,TCP,60,9001  >  35978 [ACK] Seq=21118397 Ack=391050685 Win=65535 Len=0
1,0.6451070000002801,54.93.77.70,10.0.2.15,TLSv1.2,590,Application Data
1,0.6795839999995223,54.93.77.70,10.0.2.15,TLSv1.2,1618,Application Data
1,0.6796500000000378,10.0.2.15,54.93.77.70,TCP,54,34692  >  9001 [ACK] Seq=21207331 Ack=390748173 Win=65535 Len=0
1,0.68251600000076,10.0.2.15,54.93.77.70,TLSv1.2,590,Application Data
1,0.682689000001119,54.93.77.70,10.0.2.15,TCP,60,9001  >  34692 [ACK] Seq=390748173 Ack=21207867 Win=65535 Len=0
1,0.7954790000003413,62.210.85.178,10.0.2.15,TLSv1.2,590,Application Data
1,0.7958600000001752,10.0.2.15,62.210.85.178,TLSv1.2,590,Application Data
1,0.7959970000010799,62.210.85.178,10.0.2.15,TCP,60,9001  >  35978 [ACK] Seq=21118933 Ack=391051221 Win=65535 Len=0
1,0.8879190000006929,54.93.77.70,10.0.2.15,TLSv1.2,590,Application Data
1,0.8883330000007845,10.0.2.15,54.93.77.70,TLSv1.2,590,Application Data
1,0.8884780000007595,54.93.77.70,10.0.2.15,TCP,60,9001  >  34692 [ACK] Seq=390748709 Ack=21208403 Win=65535 Len=0
1,1.0414990000008402,62.210.85.178,10.0.2.15,TLSv1.2,590,Application Data
1,1.0504049999999552,10.0.2.15,62.210.85.178,TLSv1.2,590,Application Data
1,1.0505919999995967,62.210.85.178,10.0.2.15,TCP,60,9001  >  35978 [ACK] Seq=21119469 Ack=391051757 Win=65535 Len=0
1,1.0643980000004376,10.0.2.15,62.210.85.178,TLSv1.2,4124,Application Data
1,1.0645189999995637,10.0.2.15,62.210.85.178,TCP,2974,35978  >  9001 [ACK] Seq=391055827 Ack=21119469 Win=65535 Len=2920 [TCP segment of a reassembled PDU]
1,1.0645619999995688,62.210.85.178,10.0.2.15,TCP,60,9001  >  35978 [ACK] Seq=21119469 Ack=391053217 Win=65535 Len=0
1,1.0645729999996547,62.210.85.178,10.0.2.15,TCP,60,9001  >  35978 [ACK] Seq=21119469 Ack=391054677 Win=65535 Len=0
1,1.0645779999995284,62.210.85.178,10.0.2.15,TCP,60,9001  >  35978 [ACK] Seq=21119469 Ack=391055827 Win=65535 Len=0
1,1.0645820000008825,62.210.85.178,10.0.2.15,TCP,60,9001  >  35978 [ACK] Seq=21119469 Ack=391057287 Win=65535 Len=0
1,1.0645860000004177,62.210.85.178,10.0.2.15,TCP,60,9001  >  35978 [ACK] Seq=21119469 Ack=391058747 Win=65535 Len=0
1,1.0646290000004228,10.0.2.15,62.210.85.178,TLSv1.2,1204,Application Data
1,1.06470199999967,10.0.2.15,62.210.85.178,TCP,2974,35978  >  9001 [ACK] Seq=391059897 Ack=21119469 Win=65535 Len=2920 [TCP segment of a reassembled PDU]
1,1.0647420000004786,62.210.85.178,10.0.2.15,TCP,60,9001  >  35978 [ACK] Seq=21119469 Ack=391059897 Win=65535 Len=0
1,1.064777999999933,10.0.2.15,62.210.85.178,TLSv1.2,1204,Application Data
1,1.0648130000008678,62.210.85.178,10.0.2.15,TCP,60,9001  >  35978 [ACK] Seq=21119469 Ack=391061357 Win=65535 Len=0
1,1.0648199999995995,62.210.85.178,10.0.2.15,TCP,60,9001  >  35978 [ACK] Seq=21119469 Ack=391062817 Win=65535 Len=0
1,1.0648240000009537,62.210.85.178,10.0.2.15,TCP,60,9001  >  35978 [ACK] Seq=21119469 Ack=391063967 Win=65535 Len=0
1,1.0648789999995643,10.0.2.15,62.210.85.178,TLSv1.2,4124,Application Data
1,1.0649200000007113,62.210.85.178,10.0.2.15,TCP,60,9001  >  35978 [ACK] Seq=21119469 Ack=391065427 Win=65535 Len=0
1,1.064927000001262,62.210.85.178,10.0.2.15,TCP,60,9001  >  35978 [ACK] Seq=21119469 Ack=391066887 Win=65535 Len=0
1,1.0649910000011005,10.0.2.15,62.210.85.178,TLSv1.2,2974,Application Data
1,1.065033000000767,62.210.85.178,10.0.2.15,TCP,60,9001  >  35978 [ACK] Seq=21119469 Ack=391068037 Win=65535 Len=0
1,1.0650399999994988,62.210.85.178,10.0.2.15,TCP,60,9001  >  35978 [ACK] Seq=21119469 Ack=391069497 Win=65535 Len=0
1,1.065044000000853,62.210.85.178,10.0.2.15,TCP,60,9001  >  35978 [ACK] Seq=21119469 Ack=391070957 Win=65535 Len=0
1,1.0650789999999688,10.0.2.15,62.210.85.178,TLSv1.2,1226,Application Data
1,1.0651159999997617,62.210.85.178,10.0.2.15,TCP,60,9001  >  35978 [ACK] Seq=21119469 Ack=391072129 Win=65535 Len=0
1,1.065163000001121,10.0.2.15,62.210.85.178,TLSv1.2,4124,Application Data
1,1.0652030000001105,62.210.85.178,10.0.2.15,TCP,60,9001  >  35978 [ACK] Seq=21119469 Ack=391073589 Win=65535 Len=0
1,1.0652090000003227,62.210.85.178,10.0.2.15,TCP,60,9001  >  35978 [ACK] Seq=21119469 Ack=391075049 Win=65535 Len=0
1,1.0652140000001964,62.210.85.178,10.0.2.15,TCP,60,9001  >  35978 [ACK] Seq=21119469 Ack=391076199 Win=65535 Len=0
1,1.0652590000008786,10.0.2.15,62.210.85.178,TLSv1.2,3030,Application Data
1,1.065298999999868,62.210.85.178,10.0.2.15,TCP,60,9001  >  35978 [ACK] Seq=21119469 Ack=391077659 Win=65535 Len=0
1,1.0653050000000803,62.210.85.178,10.0.2.15,TCP,60,9001  >  35978 [ACK] Seq=21119469 Ack=391079119 Win=65535 Len=0
1,1.065309999999954,62.210.85.178,10.0.2.15,TCP,60,9001  >  35978 [ACK] Seq=21119469 Ack=391079175 Win=65535 Len=0
1,1.074518999999782,10.0.2.15,62.210.85.178,TLSv1.2,4124,Application Data
1,1.0746030000009341,10.0.2.15,62.210.85.178,TCP,2974,35978  >  9001 [ACK] Seq=391083245 Ack=21119469 Win=65535 Len=2920 [TCP segment of a reassembled PDU]
1,1.0746440000002622,62.210.85.178,10.0.2.15,TCP,60,9001  >  35978 [ACK] Seq=21119469 Ack=391080635 Win=65535 Len=0
1,1.0746520000011515,62.210.85.178,10.0.2.15,TCP,60,9001  >  35978 [ACK] Seq=21119469 Ack=391082095 Win=65535 Len=0
1,1.0746570000010252,62.210.85.178,10.0.2.15,TCP,60,9001  >  35978 [ACK] Seq=21119469 Ack=391083245 Win=65535 Len=0
1,1.0747080000001006,62.210.85.178,10.0.2.15,TCP,60,9001  >  35978 [ACK] Seq=21119469 Ack=391084705 Win=65535 Len=0
1,1.0747140000003128,62.210.85.178,10.0.2.15,TCP,60,9001  >  35978 [ACK] Seq=21119469 Ack=391086165 Win=65535 Len=0
1,1.0747490000012476,10.0.2.15,62.210.85.178,TLSv1.2,1204,Application Data
1,1.0748220000004949,62.210.85.178,10.0.2.15,TCP,60,9001  >  35978 [ACK] Seq=21119469 Ack=391087315 Win=65535 Len=0
1,1.0748569999996107,10.0.2.15,62.210.85.178,TCP,2974,35978  >  9001 [ACK] Seq=391087315 Ack=21119469 Win=65535 Len=2920 [TCP segment of a reassembled PDU]
1,1.0748949999997421,62.210.85.178,10.0.2.15,TCP,60,9001  >  35978 [ACK] Seq=21119469 Ack=391088775 Win=65535 Len=0
1,1.0749009999999544,62.210.85.178,10.0.2.15,TCP,60,9001  >  35978 [ACK] Seq=21119469 Ack=391090235 Win=65535 Len=0
1,1.074931999999535,10.0.2.15,62.210.85.178,TLSv1.2,1204,Application Data
1,1.074969000001147,62.210.85.178,10.0.2.15,TCP,60,9001  >  35978 [ACK] Seq=21119469 Ack=391091385 Win=65535 Len=0
1,1.0750140000000101,10.0.2.15,62.210.85.178,TLSv1.2,4124,Application Data
1,1.0750540000008186,62.210.85.178,10.0.2.15,TCP,60,9001  >  35978 [ACK] Seq=21119469 Ack=391092845 Win=65535 Len=0
1,1.0750609999995504,62.210.85.178,10.0.2.15,TCP,60,9001  >  35978 [ACK] Seq=21119469 Ack=391094305 Win=65535 Len=0
1,1.075066000001243,62.210.85.178,10.0.2.15,TCP,60,9001  >  35978 [ACK] Seq=21119469 Ack=391095455 Win=65535 Len=0
1,1.0751090000012482,10.0.2.15,62.210.85.178,TLSv1.2,332,Application Data
1,1.0751469999995606,62.210.85.178,10.0.2.15,TCP,60,9001  >  35978 [ACK] Seq=21119469 Ack=391095733 Win=65535 Len=0
1,1.0752040000006673,10.0.2.15,62.210.85.178,TLSv1.2,3868,Application Data
1,1.0752449999999953,62.210.85.178,10.0.2.15,TCP,60,9001  >  35978 [ACK] Seq=21119469 Ack=391097193 Win=65535 Len=0
1,1.075252000000546,62.210.85.178,10.0.2.15,TCP,60,9001  >  35978 [ACK] Seq=21119469 Ack=391098653 Win=65535 Len=0
1,1.0752560000000813,62.210.85.178,10.0.2.15,TCP,60,9001  >  35978 [ACK] Seq=21119469 Ack=391099547 Win=65535 Len=0
1,1.0753029999996215,10.0.2.15,62.210.85.178,TLSv1.2,4124,Application Data
1,1.0753469999999652,62.210.85.178,10.0.2.15,TCP,60,9001  >  35978 [ACK] Seq=21119469 Ack=391101007 Win=65535 Len=0
1,1.075354000000516,62.210.85.178,10.0.2.15,TCP,60,9001  >  35978 [ACK] Seq=21119469 Ack=391102467 Win=65535 Len=0
1,1.075358000000051,62.210.85.178,10.0.2.15,TCP,60,9001  >  35978 [ACK] Seq=21119469 Ack=391103617 Win=65535 Len=0
1,1.0754280000001017,10.0.2.15,62.210.85.178,TLSv1.2,3030,Application Data
1,1.0754699999997683,62.210.85.178,10.0.2.15,TCP,60,9001  >  35978 [ACK] Seq=21119469 Ack=391105077 Win=65535 Len=0
1,1.075477000000319,62.210.85.178,10.0.2.15,TCP,60,9001  >  35978 [ACK] Seq=21119469 Ack=391106537 Win=65535 Len=0
1,1.0754820000001928,62.210.85.178,10.0.2.15,TCP,60,9001  >  35978 [ACK] Seq=21119469 Ack=391106593 Win=65535 Len=0
1,1.0879359999998996,10.0.2.15,62.210.85.178,TLSv1.2,4124,Application Data
1,1.0880400000005466,10.0.2.15,62.210.85.178,TCP,2974,35978  >  9001 [ACK] Seq=391110663 Ack=21119469 Win=65535 Len=2920 [TCP segment of a reassembled PDU]
1,1.0880809999998746,62.210.85.178,10.0.2.15,TCP,60,9001  >  35978 [ACK] Seq=21119469 Ack=391108053 Win=65535 Len=0
1,1.088090999999622,62.210.85.178,10.0.2.15,TCP,60,9001  >  35978 [ACK] Seq=21119469 Ack=391109513 Win=65535 Len=0
1,1.0880950000009761,62.210.85.178,10.0.2.15,TCP,60,9001  >  35978 [ACK] Seq=21119469 Ack=391110663 Win=65535 Len=0
1,1.0880990000005113,62.210.85.178,10.0.2.15,TCP,60,9001  >  35978 [ACK] Seq=21119469 Ack=391112123 Win=65535 Len=0
1,1.0881030000000464,62.210.85.178,10.0.2.15,TCP,60,9001  >  35978 [ACK] Seq=21119469 Ack=391113583 Win=65535 Len=0
1,1.0881460000000516,10.0.2.15,62.210.85.178,TLSv1.2,1204,Application Data
1,1.0882390000006126,62.210.85.178,10.0.2.15,TCP,60,9001  >  35978 [ACK] Seq=21119469 Ack=391114733 Win=65535 Len=0
1,1.0882830000009562,10.0.2.15,62.210.85.178,TLSv1.2,1232,Application Data
1,1.0883229999999458,62.210.85.178,10.0.2.15,TCP,60,9001  >  35978 [ACK] Seq=21119469 Ack=391115911 Win=65535 Len=0
1,1.1931660000009288,54.93.77.70,10.0.2.15,TLSv1.2,3674,Application Data
1,1.1933220000009896,10.0.2.15,54.93.77.70,TCP,54,34692  >  9001 [ACK] Seq=21208403 Ack=390752329 Win=65535 Len=0
1,1.2161550000000716,54.93.77.70,10.0.2.15,TLSv1.2,3674,Application Data
1,1.2162390000012238,10.0.2.15,54.93.77.70,TCP,54,34692  >  9001 [ACK] Seq=21208403 Ack=390755949 Win=65535 Len=0
1,1.2280289999998786,54.93.77.70,10.0.2.15,TLSv1.2,7294,Application Data
1,1.228108000001157,10.0.2.15,54.93.77.70,TCP,54,34692  >  9001 [ACK] Seq=21208403 Ack=390763189 Win=65535 Len=0
1,1.2321350000001985,54.93.77.70,10.0.2.15,TLSv1.2,568,Application Data
1,1.2387450000005629,54.93.77.70,10.0.2.15,TLSv1.2,7294,Application Data
1,1.238800999999512,10.0.2.15,54.93.77.70,TCP,54,34692  >  9001 [ACK] Seq=21208403 Ack=390770943 Win=65535 Len=0
1,1.2553829999997106,54.93.77.70,10.0.2.15,TLSv1.2,568,Application Data
1,1.2664939999995113,54.93.77.70,10.0.2.15,TLSv1.2,4398,Application Data
1,1.2665410000008706,10.0.2.15,54.93.77.70,TCP,54,34692  >  9001 [ACK] Seq=21208403 Ack=390775801 Win=65535 Len=0
1,1.2667300000011892,10.0.2.15,54.93.77.70,TLSv1.2,590,Application Data
1,1.266843000001245,54.93.77.70,10.0.2.15,TCP,60,9001  >  34692 [ACK] Seq=390775801 Ack=21208939 Win=65535 Len=0
1,1.2831810000006953,54.93.77.70,10.0.2.15,TLSv1.2,380,Application Data
1,1.29871600000115,54.93.77.70,10.0.2.15,TCP,2950,"9001  >  34692 [PSH, ACK] Seq=390776127 Ack=21208939 Win=65535 Len=2896 [TCP segment of a reassembled PDU]"
1,1.298757000000478,54.93.77.70,10.0.2.15,TLSv1.2,8742,"Application Data, Application Data"
1,1.2988290000012057,10.0.2.15,54.93.77.70,TCP,54,34692  >  9001 [ACK] Seq=21208939 Ack=390779023 Win=65535 Len=0
1,1.2989420000012615,10.0.2.15,54.93.77.70,TCP,54,34692  >  9001 [ACK] Seq=21208939 Ack=390787711 Win=65535 Len=0
1,1.3075410000001284,54.93.77.70,10.0.2.15,TLSv1.2,5846,"Application Data, Application Data"
1,1.3075950000002194,10.0.2.15,54.93.77.70,TCP,54,34692  >  9001 [ACK] Seq=21208939 Ack=390793503 Win=65535 Len=0
1,1.307770999999775,10.0.2.15,54.93.77.70,TLSv1.2,590,Application Data
1,1.3078480000003765,54.93.77.70,10.0.2.15,TCP,60,9001  >  34692 [ACK] Seq=390793503 Ack=21209475 Win=65535 Len=0
1,1.3087180000002263,54.93.77.70,10.0.2.15,TLSv1.2,10190,"Application Data, Application Data"
1,1.3087890000006155,10.0.2.15,54.93.77.70,TCP,54,34692  >  9001 [ACK] Seq=21209475 Ack=390803639 Win=65535 Len=0
1,1.3116030000001047,54.93.77.70,10.0.2.15,TLSv1.2,2950,"Application Data, Application Data"
1,1.3116509999999835,10.0.2.15,54.93.77.70,TCP,54,34692  >  9001 [ACK] Seq=21209475 Ack=390806535 Win=65535 Len=0
1,1.3122540000003937,54.93.77.70,10.0.2.15,TCP,1502,"9001  >  34692 [PSH, ACK] Seq=390806535 Ack=21209475 Win=65535 Len=1448 [TCP segment of a reassembled PDU]"
1,1.3122970000003988,10.0.2.15,54.93.77.70,TCP,54,34692  >  9001 [ACK] Seq=21209475 Ack=390807983 Win=65535 Len=0
1,1.3147210000006453,54.93.77.70,10.0.2.15,TLSv1.2,2950,Application Data [TCP segment of a reassembled PDU]
1,1.3147810000009486,10.0.2.15,54.93.77.70,TCP,54,34692  >  9001 [ACK] Seq=21209475 Ack=390810879 Win=65535 Len=0
1,1.3166259999998147,54.93.77.70,10.0.2.15,TLSv1.2,2552,"Application Data, Application Data"
1,1.3166670000009617,10.0.2.15,54.93.77.70,TCP,54,34692  >  9001 [ACK] Seq=21209475 Ack=390813377 Win=65535 Len=0
1,1.3213300000006711,10.0.2.15,54.93.77.70,TLSv1.2,1104,Application Data
1,1.3214800000005198,54.93.77.70,10.0.2.15,TCP,60,9001  >  34692 [ACK] Seq=390813377 Ack=21210525 Win=65535 Len=0
1,1.3723900000004505,62.210.85.178,10.0.2.15,TLSv1.2,590,Application Data
1,1.4154799999996612,10.0.2.15,62.210.85.178,TCP,54,35978  >  9001 [ACK] Seq=391115911 Ack=21120005 Win=65535 Len=0
1,1.4325250000001688,62.210.85.178,10.0.2.15,TLSv1.2,590,Application Data
1,1.4325769999995828,10.0.2.15,62.210.85.178,TCP,54,35978  >  9001 [ACK] Seq=391115911 Ack=21120541 Win=65535 Len=0
1,1.4510750000008557,62.210.85.178,10.0.2.15,TLSv1.2,1104,Application Data
1,1.4511180000008608,10.0.2.15,62.210.85.178,TCP,54,35978  >  9001 [ACK] Seq=391115911 Ack=21121591 Win=65535 Len=0
1,1.4515389999996842,10.0.2.15,62.210.85.178,TLSv1.2,590,Application Data
1,1.4517300000006799,62.210.85.178,10.0.2.15,TCP,60,9001  >  35978 [ACK] Seq=21121591 Ack=391116447 Win=65535 Len=0
1,1.6560470000003988,54.93.77.70,10.0.2.15,TLSv1.2,590,Application Data
1,1.6564849999995204,10.0.2.15,54.93.77.70,TLSv1.2,590,Application Data
1,1.6566259999999602,54.93.77.70,10.0.2.15,TCP,60,9001  >  34692 [ACK] Seq=390813913 Ack=21211061 Win=65535 Len=0
1,1.7673709999999119,62.210.85.178,10.0.2.15,TLSv1.2,590,Application Data
1,1.7710470000001806,10.0.2.15,62.210.85.178,TLSv1.2,590,Application Data
1,1.7718220000006113,62.210.85.178,10.0.2.15,TCP,60,9001  >  35978 [ACK] Seq=21122127 Ack=391116983 Win=65535 Len=0
1,1.780839000000924,10.0.2.15,62.210.85.178,TLSv1.2,4124,Application Data
1,1.7809140000008483,10.0.2.15,62.210.85.178,TCP,2974,35978  >  9001 [ACK] Seq=391121053 Ack=21122127 Win=65535 Len=2920 [TCP segment of a reassembled PDU]
1,1.7812840000005963,62.210.85.178,10.0.2.15,TCP,60,9001  >  35978 [ACK] Seq=21122127 Ack=391118443 Win=65535 Len=0
1,1.7812979999998788,62.210.85.178,10.0.2.15,TCP,60,9001  >  35978 [ACK] Seq=21122127 Ack=391119903 Win=65535 Len=0
1,1.7813010000008944,62.210.85.178,10.0.2.15,TCP,60,9001  >  35978 [ACK] Seq=21122127 Ack=391121053 Win=65535 Len=0
1,1.7813029999997525,62.210.85.178,10.0.2.15,TCP,60,9001  >  35978 [ACK] Seq=21122127 Ack=391122513 Win=65535 Len=0
1,1.781306000000768,62.210.85.178,10.0.2.15,TCP,60,9001  >  35978 [ACK] Seq=21122127 Ack=391123973 Win=65535 Len=0
1,1.7813480000004347,10.0.2.15,62.210.85.178,TLSv1.2,1204,Application Data
1,1.7813850000002276,62.210.85.178,10.0.2.15,TCP,60,9001  >  35978 [ACK] Seq=21122127 Ack=391125123 Win=65535 Len=0
1,1.7814390000003186,10.0.2.15,62.210.85.178,TLSv1.2,4124,Application Data
1,1.7815019999998185,62.210.85.178,10.0.2.15,TCP,60,9001  >  35978 [ACK] Seq=21122127 Ack=391126583 Win=65535 Len=0
1,1.7815110000010463,62.210.85.178,10.0.2.15,TCP,60,9001  >  35978 [ACK] Seq=21122127 Ack=391128043 Win=65535 Len=0
1,1.7815150000005815,62.210.85.178,10.0.2.15,TCP,60,9001  >  35978 [ACK] Seq=21122127 Ack=391129193 Win=65535 Len=0
1,1.7815650000011374,10.0.2.15,62.210.85.178,TLSv1.2,4124,Application Data
1,1.7816259999999602,62.210.85.178,10.0.2.15,TCP,60,9001  >  35978 [ACK] Seq=21122127 Ack=391130653 Win=65535 Len=0
1,1.7816380000003846,62.210.85.178,10.0.2.15,TCP,60,9001  >  35978 [ACK] Seq=21122127 Ack=391132113 Win=65535 Len=0
1,1.7816409999995813,62.210.85.178,10.0.2.15,TCP,60,9001  >  35978 [ACK] Seq=21122127 Ack=391133263 Win=65535 Len=0
1,1.781684999999925,10.0.2.15,62.210.85.178,TLSv1.2,332,Application Data
1,1.7817230000000563,62.210.85.178,10.0.2.15,TCP,60,9001  >  35978 [ACK] Seq=21122127 Ack=391133541 Win=65535 Len=0
1,1.781780000001163,10.0.2.15,62.210.85.178,TLSv1.2,3868,Application Data
1,1.7818160000006174,62.210.85.178,10.0.2.15,TCP,60,9001  >  35978 [ACK] Seq=21122127 Ack=391135001 Win=65535 Len=0
1,1.7818230000011681,62.210.85.178,10.0.2.15,TCP,60,9001  >  35978 [ACK] Seq=21122127 Ack=391136461 Win=65535 Len=0
1,1.7818260000003647,62.210.85.178,10.0.2.15,TCP,60,9001  >  35978 [ACK] Seq=21122127 Ack=391137355 Win=65535 Len=0
1,1.7818630000001576,10.0.2.15,62.210.85.178,TLSv1.2,2452,Application Data
1,1.781897000000754,62.210.85.178,10.0.2.15,TCP,60,9001  >  35978 [ACK] Seq=21122127 Ack=391138815 Win=65535 Len=0
1,1.7819040000013047,62.210.85.178,10.0.2.15,TCP,60,9001  >  35978 [ACK] Seq=21122127 Ack=391139753 Win=65535 Len=0
1,1.9052520000004733,54.93.77.70,10.0.2.15,TLSv1.2,590,Application Data
1,1.9076380000005884,54.93.77.70,10.0.2.15,TCP,2950,"9001  >  34692 [PSH, ACK] Seq=390814449 Ack=21211061 Win=65535 Len=2896 [TCP segment of a reassembled PDU]"
1,1.9076629999999568,54.93.77.70,10.0.2.15,TLSv1.2,7294,"Application Data, Application Data"
1,1.907734000000346,10.0.2.15,54.93.77.70,TCP,54,34692  >  9001 [ACK] Seq=21211061 Ack=390824585 Win=65535 Len=0
1,1.9241180000008171,54.93.77.70,10.0.2.15,TLSv1.2,2950,Application Data [TCP segment of a reassembled PDU]
1,1.9241340000007767,54.93.77.70,10.0.2.15,TLSv1.2,2016,Application Data
1,1.9241739999997662,10.0.2.15,54.93.77.70,TCP,54,34692  >  9001 [ACK] Seq=21211061 Ack=390827481 Win=65535 Len=0
1,1.9242450000001554,10.0.2.15,54.93.77.70,TCP,54,34692  >  9001 [ACK] Seq=21211061 Ack=390829443 Win=65535 Len=0
1,1.9390720000010333,54.93.77.70,10.0.2.15,TCP,2950,"9001  >  34692 [PSH, ACK] Seq=390829443 Ack=21211061 Win=65535 Len=2896 [TCP segment of a reassembled PDU]"
1,1.9390870000006544,54.93.77.70,10.0.2.15,TLSv1.2,2950,Application Data [TCP segment of a reassembled PDU]
1,1.9391240000004473,10.0.2.15,54.93.77.70,TCP,54,34692  >  9001 [ACK] Seq=21211061 Ack=390832339 Win=65535 Len=0
1,1.9391930000001594,10.0.2.15,54.93.77.70,TCP,54,34692  >  9001 [ACK] Seq=21211061 Ack=390835235 Win=65535 Len=0
1,1.9393680000011955,54.93.77.70,10.0.2.15,TCP,1502,"9001  >  34692 [PSH, ACK] Seq=390835235 Ack=21211061 Win=65535 Len=1448 [TCP segment of a reassembled PDU]"
1,1.9394019999999728,10.0.2.15,54.93.77.70,TCP,54,34692  >  9001 [ACK] Seq=21211061 Ack=390836683 Win=65535 Len=0
1,1.9403300000012678,54.93.77.70,10.0.2.15,TLSv1.2,568,Application Data
1,1.9429149999996298,10.0.2.15,54.93.77.70,TLSv1.2,590,Application Data
1,1.943042000000787,54.93.77.70,10.0.2.15,TCP,60,9001  >  34692 [ACK] Seq=390837197 Ack=21211597 Win=65535 Len=0
1,2.045876000000135,62.210.85.178,10.0.2.15,TLSv1.2,590,Application Data
1,2.046385999999984,10.0.2.15,62.210.85.178,TLSv1.2,590,Application Data
1,2.0465020000010554,62.210.85.178,10.0.2.15,TCP,60,9001  >  35978 [ACK] Seq=21122663 Ack=391140289 Win=65535 Len=0
1,2.372960000000603,54.93.77.70,10.0.2.15,TLSv1.2,590,Application Data
1,2.373381999999765,10.0.2.15,54.93.77.70,TLSv1.2,590,Application Data
1,2.3735190000006696,54.93.77.70,10.0.2.15,TCP,60,9001  >  34692 [ACK] Seq=390837733 Ack=21212133 Win=65535 Len=0
1,2.4888800000007905,62.210.85.178,10.0.2.15,TLSv1.2,590,Application Data
1,2.495582999999897,10.0.2.15,62.210.85.178,TLSv1.2,590,Application Data
1,2.495742999999493,62.210.85.178,10.0.2.15,TCP,60,9001  >  35978 [ACK] Seq=21123199 Ack=391140825 Win=65535 Len=0
1,2.5081979999995383,10.0.2.15,62.210.85.178,TLSv1.2,4124,Application Data
1,2.5083080000003974,10.0.2.15,62.210.85.178,TCP,2974,35978  >  9001 [ACK] Seq=391144895 Ack=21123199 Win=65535 Len=2920 [TCP segment of a reassembled PDU]
1,2.508350000000064,62.210.85.178,10.0.2.15,TCP,60,9001  >  35978 [ACK] Seq=21123199 Ack=391142285 Win=65535 Len=0
1,2.5083680000007007,62.210.85.178,10.0.2.15,TCP,60,9001  >  35978 [ACK] Seq=21123199 Ack=391143745 Win=65535 Len=0
1,2.5083730000005744,62.210.85.178,10.0.2.15,TCP,60,9001  >  35978 [ACK] Seq=21123199 Ack=391144895 Win=65535 Len=0
1,2.508375999999771,62.210.85.178,10.0.2.15,TCP,60,9001  >  35978 [ACK] Seq=21123199 Ack=391146355 Win=65535 Len=0
1,2.5083790000007866,62.210.85.178,10.0.2.15,TCP,60,9001  >  35978 [ACK] Seq=21123199 Ack=391147815 Win=65535 Len=0
1,2.508412999999564,10.0.2.15,62.210.85.178,TLSv1.2,1204,Application Data
1,2.5084459999998217,62.210.85.178,10.0.2.15,TCP,60,9001  >  35978 [ACK] Seq=21123199 Ack=391148965 Win=65535 Len=0
1,2.508491000000504,10.0.2.15,62.210.85.178,TLSv1.2,4124,Application Data
1,2.5085259999996197,62.210.85.178,10.0.2.15,TCP,60,9001  >  35978 [ACK] Seq=21123199 Ack=391150425 Win=65535 Len=0
1,2.508534000000509,62.210.85.178,10.0.2.15,TCP,60,9001  >  35978 [ACK] Seq=21123199 Ack=391151885 Win=65535 Len=0
1,2.5085369999997056,62.210.85.178,10.0.2.15,TCP,60,9001  >  35978 [ACK] Seq=21123199 Ack=391153035 Win=65535 Len=0
1,2.508574999999837,10.0.2.15,62.210.85.178,TLSv1.2,4124,Application Data
1,2.5086090000004333,62.210.85.178,10.0.2.15,TCP,60,9001  >  35978 [ACK] Seq=21123199 Ack=391154495 Win=65535 Len=0
1,2.508616000000984,62.210.85.178,10.0.2.15,TCP,60,9001  >  35978 [ACK] Seq=21123199 Ack=391155955 Win=65535 Len=0
1,2.5086730000002717,10.0.2.15,62.210.85.178,TLSv1.2,2974,Application Data
1,2.508711000000403,62.210.85.178,10.0.2.15,TCP,60,9001  >  35978 [ACK] Seq=21123199 Ack=391157105 Win=65535 Len=0
1,2.508718000000954,62.210.85.178,10.0.2.15,TCP,60,9001  >  35978 [ACK] Seq=21123199 Ack=391158565 Win=65535 Len=0
1,2.508722000000489,62.210.85.178,10.0.2.15,TCP,60,9001  >  35978 [ACK] Seq=21123199 Ack=391160025 Win=65535 Len=0
1,2.5087490000005346,10.0.2.15,62.210.85.178,TLSv1.2,1226,Application Data
1,2.5087820000007923,62.210.85.178,10.0.2.15,TCP,60,9001  >  35978 [ACK] Seq=21123199 Ack=391161197 Win=65535 Len=0
1,2.5088210000012623,10.0.2.15,62.210.85.178,TLSv1.2,4124,Application Data
1,2.5088550000000396,62.210.85.178,10.0.2.15,TCP,60,9001  >  35978 [ACK] Seq=21123199 Ack=391162657 Win=65535 Len=0
1,2.5088620000005903,62.210.85.178,10.0.2.15,TCP,60,9001  >  35978 [ACK] Seq=21123199 Ack=391164117 Win=65535 Len=0
1,2.508864999999787,62.210.85.178,10.0.2.15,TCP,60,9001  >  35978 [ACK] Seq=21123199 Ack=391165267 Win=65535 Len=0
1,2.5089010000010603,10.0.2.15,62.210.85.178,TLSv1.2,3030,Application Data
1,2.508936000000176,62.210.85.178,10.0.2.15,TCP,60,9001  >  35978 [ACK] Seq=21123199 Ack=391166727 Win=65535 Len=0
1,2.5089420000003884,62.210.85.178,10.0.2.15,TCP,60,9001  >  35978 [ACK] Seq=21123199 Ack=391168187 Win=65535 Len=0
1,2.508944999999585,62.210.85.178,10.0.2.15,TCP,60,9001  >  35978 [ACK] Seq=21123199 Ack=391168243 Win=65535 Len=0
1,2.5181380000012723,10.0.2.15,62.210.85.178,TLSv1.2,4124,Application Data
1,2.518206000000646,62.210.85.178,10.0.2.15,TCP,60,9001  >  35978 [ACK] Seq=21123199 Ack=391169703 Win=65535 Len=0
1,2.5182130000011966,62.210.85.178,10.0.2.15,TCP,60,9001  >  35978 [ACK] Seq=21123199 Ack=391171163 Win=65535 Len=0
1,2.5182160000003933,62.210.85.178,10.0.2.15,TCP,60,9001  >  35978 [ACK] Seq=21123199 Ack=391172313 Win=65535 Len=0
1,2.5182519999998476,10.0.2.15,62.210.85.178,TLSv1.2,4124,Application Data
1,2.5183049999996,62.210.85.178,10.0.2.15,TCP,60,9001  >  35978 [ACK] Seq=21123199 Ack=391173773 Win=65535 Len=0
1,2.5183109999998123,62.210.85.178,10.0.2.15,TCP,60,9001  >  35978 [ACK] Seq=21123199 Ack=391175233 Win=65535 Len=0
1,2.5183150000011665,62.210.85.178,10.0.2.15,TCP,60,9001  >  35978 [ACK] Seq=21123199 Ack=391176383 Win=65535 Len=0
1,2.518351000000621,10.0.2.15,62.210.85.178,TLSv1.2,4124,Application Data
1,2.5183840000008786,62.210.85.178,10.0.2.15,TCP,60,9001  >  35978 [ACK] Seq=21123199 Ack=391177843 Win=65535 Len=0
1,2.518391999999949,62.210.85.178,10.0.2.15,TCP,60,9001  >  35978 [ACK] Seq=21123199 Ack=391179303 Win=65535 Len=0
1,2.518396000001303,62.210.85.178,10.0.2.15,TCP,60,9001  >  35978 [ACK] Seq=21123199 Ack=391180453 Win=65535 Len=0
1,2.518431000000419,10.0.2.15,62.210.85.178,TLSv1.2,4124,Application Data
1,2.5184640000006766,62.210.85.178,10.0.2.15,TCP,60,9001  >  35978 [ACK] Seq=21123199 Ack=391181913 Win=65535 Len=0
1,2.5184710000012274,62.210.85.178,10.0.2.15,TCP,60,9001  >  35978 [ACK] Seq=21123199 Ack=391183373 Win=65535 Len=0
1,2.5184750000007625,62.210.85.178,10.0.2.15,TCP,60,9001  >  35978 [ACK] Seq=21123199 Ack=391184523 Win=65535 Len=0
1,2.51850899999954,10.0.2.15,62.210.85.178,TLSv1.2,332,Application Data
1,2.5185419999997976,62.210.85.178,10.0.2.15,TCP,60,9001  >  35978 [ACK] Seq=21123199 Ack=391184801 Win=65535 Len=0
1,2.5185899999996764,10.0.2.15,62.210.85.178,TLSv1.2,3868,Application Data
1,2.518625000000611,62.210.85.178,10.0.2.15,TCP,60,9001  >  35978 [ACK] Seq=21123199 Ack=391186261 Win=65535 Len=0
1,2.518632000001162,62.210.85.178,10.0.2.15,TCP,60,9001  >  35978 [ACK] Seq=21123199 Ack=391187721 Win=65535 Len=0
1,2.5186350000003586,62.210.85.178,10.0.2.15,TCP,60,9001  >  35978 [ACK] Seq=21123199 Ack=391188615 Win=65535 Len=0
1,2.51867300000049,10.0.2.15,62.210.85.178,TLSv1.2,4124,Application Data
1,2.5187070000010863,62.210.85.178,10.0.2.15,TCP,60,9001  >  35978 [ACK] Seq=21123199 Ack=391190075 Win=65535 Len=0
1,2.518713999999818,62.210.85.178,10.0.2.15,TCP,60,9001  >  35978 [ACK] Seq=21123199 Ack=391191535 Win=65535 Len=0
1,2.5187170000008337,62.210.85.178,10.0.2.15,TCP,60,9001  >  35978 [ACK] Seq=21123199 Ack=391192685 Win=65535 Len=0
1,2.518750999999611,10.0.2.15,62.210.85.178,TLSv1.2,3030,Application Data
1,2.518785000000207,62.210.85.178,10.0.2.15,TCP,60,9001  >  35978 [ACK] Seq=21123199 Ack=391194145 Win=65535 Len=0
1,2.518792000000758,62.210.85.178,10.0.2.15,TCP,60,9001  >  35978 [ACK] Seq=21123199 Ack=391195605 Win=65535 Len=0
1,2.518793999999616,62.210.85.178,10.0.2.15,TCP,60,9001  >  35978 [ACK] Seq=21123199 Ack=391195661 Win=65535 Len=0
1,2.532350999999835,10.0.2.15,62.210.85.178,TLSv1.2,4124,Application Data
1,2.532427000000098,10.0.2.15,62.210.85.178,TCP,2974,35978  >  9001 [ACK] Seq=391199731 Ack=21123199 Win=65535 Len=2920 [TCP segment of a reassembled PDU]
1,2.532468000001245,62.210.85.178,10.0.2.15,TCP,60,9001  >  35978 [ACK] Seq=21123199 Ack=391197121 Win=65535 Len=0
1,2.532477000000654,62.210.85.178,10.0.2.15,TCP,60,9001  >  35978 [ACK] Seq=21123199 Ack=391198581 Win=65535 Len=0
1,2.5324820000005275,62.210.85.178,10.0.2.15,TCP,60,9001  >  35978 [ACK] Seq=21123199 Ack=391199731 Win=65535 Len=0
1,2.5324860000000626,62.210.85.178,10.0.2.15,TCP,60,9001  >  35978 [ACK] Seq=21123199 Ack=391201191 Win=65535 Len=0
1,2.5324909999999363,62.210.85.178,10.0.2.15,TCP,60,9001  >  35978 [ACK] Seq=21123199 Ack=391202651 Win=65535 Len=0
1,2.532524000000194,10.0.2.15,62.210.85.178,TLSv1.2,1204,Application Data
1,2.5325599999996484,62.210.85.178,10.0.2.15,TCP,60,9001  >  35978 [ACK] Seq=21123199 Ack=391203801 Win=65535 Len=0
1,2.5326029999996535,10.0.2.15,62.210.85.178,TLSv1.2,4124,Application Data
1,2.5326359999999113,62.210.85.178,10.0.2.15,TCP,60,9001  >  35978 [ACK] Seq=21123199 Ack=391205261 Win=65535 Len=0
1,2.5326440000008006,62.210.85.178,10.0.2.15,TCP,60,9001  >  35978 [ACK] Seq=21123199 Ack=391206721 Win=65535 Len=0
1,2.5326480000003357,62.210.85.178,10.0.2.15,TCP,60,9001  >  35978 [ACK] Seq=21123199 Ack=391207871 Win=65535 Len=0
1,2.532686000000467,10.0.2.15,62.210.85.178,TLSv1.2,4124,Application Data
1,2.532720999999583,62.210.85.178,10.0.2.15,TCP,60,9001  >  35978 [ACK] Seq=21123199 Ack=391209331 Win=65535 Len=0
1,2.5327290000004723,62.210.85.178,10.0.2.15,TCP,60,9001  >  35978 [ACK] Seq=21123199 Ack=391210791 Win=65535 Len=0
1,2.532731999999669,62.210.85.178,10.0.2.15,TCP,60,9001  >  35978 [ACK] Seq=21123199 Ack=391211941 Win=65535 Len=0
1,2.5327649999999267,10.0.2.15,62.210.85.178,TLSv1.2,332,Application Data
1,2.532799000000523,62.210.85.178,10.0.2.15,TCP,60,9001  >  35978 [ACK] Seq=21123199 Ack=391212219 Win=65535 Len=0
1,2.623830000000453,54.93.77.70,10.0.2.15,TCP,2950,"9001  >  34692 [PSH, ACK] Seq=390837733 Ack=21212133 Win=65535 Len=2896 [TCP segment of a reassembled PDU]"
1,2.6238700000012614,54.93.77.70,10.0.2.15,TLSv1.2,9046,"Application Data, Application Data, Application Data"
1,2.623970000000554,10.0.2.15,54.93.77.70,TCP,54,34692  >  9001 [ACK] Seq=21212133 Ack=390849621 Win=65535 Len=0
1,2.6241360000003624,10.0.2.15,54.93.77.70,TLSv1.2,590,Application Data
1,2.6242199999996956,54.93.77.70,10.0.2.15,TCP,60,9001  >  34692 [ACK] Seq=390849621 Ack=21212669 Win=65535 Len=0
1,2.6426119999996445,54.93.77.70,10.0.2.15,TCP,2950,"9001  >  34692 [PSH, ACK] Seq=390849621 Ack=21212669 Win=65535 Len=2896 [TCP segment of a reassembled PDU]"
1,2.642665000001216,10.0.2.15,54.93.77.70,TCP,54,34692  >  9001 [ACK] Seq=21212669 Ack=390852517 Win=65535 Len=0
1,2.6435770000007324,54.93.77.70,10.0.2.15,TLSv1.2,5298,"Application Data, Application Data"
1,2.6435940000010305,54.93.77.70,10.0.2.15,TCP,2950,"9001  >  34692 [PSH, ACK] Seq=390857761 Ack=21212669 Win=65535 Len=2896 [TCP segment of a reassembled PDU]"
1,2.643651000000318,10.0.2.15,54.93.77.70,TCP,54,34692  >  9001 [ACK] Seq=21212669 Ack=390860657 Win=65535 Len=0
1,2.660327999999936,54.93.77.70,10.0.2.15,TLSv1.2,906,Application Data
1,2.667869000000792,54.93.77.70,10.0.2.15,TCP,2950,"9001  >  34692 [PSH, ACK] Seq=390861509 Ack=21212669 Win=65535 Len=2896 [TCP segment of a reassembled PDU]"
1,2.667912000000797,10.0.2.15,54.93.77.70,TCP,54,34692  >  9001 [ACK] Seq=21212669 Ack=390864405 Win=65535 Len=0
1,2.677696000000651,54.93.77.70,10.0.2.15,TLSv1.2,2950,Application Data [TCP segment of a reassembled PDU]
1,2.677736999999979,10.0.2.15,54.93.77.70,TCP,54,34692  >  9001 [ACK] Seq=21212669 Ack=390867301 Win=65535 Len=0
1,2.677895000000717,10.0.2.15,54.93.77.70,TLSv1.2,590,Application Data
1,2.677961999999752,54.93.77.70,10.0.2.15,TCP,60,9001  >  34692 [ACK] Seq=390867301 Ack=21213205 Win=65535 Len=0
1,2.6782380000004196,54.93.77.70,10.0.2.15,TLSv1.2,5846,Application Data [TCP segment of a reassembled PDU]
1,2.6782990000010614,10.0.2.15,54.93.77.70,TCP,54,34692  >  9001 [ACK] Seq=21213205 Ack=390873093 Win=65535 Len=0
1,2.6838360000001558,54.93.77.70,10.0.2.15,TLSv1.2,1408,"Application Data, Application Data"
1,2.686767000001055,54.93.77.70,10.0.2.15,TCP,2950,"9001  >  34692 [PSH, ACK] Seq=390874447 Ack=21213205 Win=65535 Len=2896 [TCP segment of a reassembled PDU]"
1,2.686825000000681,10.0.2.15,54.93.77.70,TCP,54,34692  >  9001 [ACK] Seq=21213205 Ack=390877343 Win=65535 Len=0
1,2.687792000000627,54.93.77.70,10.0.2.15,TLSv1.2,8742,"Application Data, Application Data"
1,2.6878560000004654,10.0.2.15,54.93.77.70,TCP,54,34692  >  9001 [ACK] Seq=21213205 Ack=390886031 Win=65535 Len=0
1,2.6975640000000567,54.93.77.70,10.0.2.15,TLSv1.2,2950,Application Data [TCP segment of a reassembled PDU]
1,2.697609000000739,10.0.2.15,54.93.77.70,TCP,54,34692  >  9001 [ACK] Seq=21213205 Ack=390888927 Win=65535 Len=0
1,2.697656000000279,54.93.77.70,10.0.2.15,TCP,1502,"9001  >  34692 [PSH, ACK] Seq=390888927 Ack=21213205 Win=65535 Len=1448 [TCP segment of a reassembled PDU]"
1,2.6977070000011736,10.0.2.15,54.93.77.70,TCP,54,34692  >  9001 [ACK] Seq=21213205 Ack=390890375 Win=65535 Len=0
1,2.6982349999998405,54.93.77.70,10.0.2.15,TLSv1.2,5846,"Application Data, Application Data"
1,2.698275000000649,10.0.2.15,54.93.77.70,TCP,54,34692  >  9001 [ACK] Seq=21213205 Ack=390896167 Win=65535 Len=0
1,2.6984190000002855,10.0.2.15,54.93.77.70,TLSv1.2,590,Application Data
1,2.6984879999999976,54.93.77.70,10.0.2.15,TCP,60,9001  >  34692 [ACK] Seq=390896167 Ack=21213741 Win=65535 Len=0
1,2.704413999999815,54.93.77.70,10.0.2.15,TLSv1.2,1082,Application Data
1,2.707922999999937,10.0.2.15,54.93.77.70,TLSv1.2,590,Application Data
1,2.7080060000007506,54.93.77.70,10.0.2.15,TCP,60,9001  >  34692 [ACK] Seq=390897195 Ack=21214277 Win=65535 Len=0
1,2.722623999999996,54.93.77.70,10.0.2.15,TCP,2950,"9001  >  34692 [PSH, ACK] Seq=390897195 Ack=21214277 Win=65535 Len=2896 [TCP segment of a reassembled PDU]"
1,2.7226430000009714,54.93.77.70,10.0.2.15,TLSv1.2,8742,"Application Data, Application Data"
1,2.7227030000012746,10.0.2.15,54.93.77.70,TCP,54,34692  >  9001 [ACK] Seq=21214277 Ack=390908779 Win=65535 Len=0
1,2.724213999999847,54.93.77.70,10.0.2.15,TLSv1.2,358,Application Data
1,2.7254069999999047,10.0.2.15,54.93.77.70,TLSv1.2,590,Application Data
1,2.725513999999748,54.93.77.70,10.0.2.15,TCP,60,9001  >  34692 [ACK] Seq=390909083 Ack=21214813 Win=65535 Len=0
1,2.731282000000647,62.210.85.178,10.0.2.15,TLSv1.2,590,Application Data
1,2.7422829999995884,54.93.77.70,10.0.2.15,TLSv1.2,590,Application Data
