No.,Time,Source,Destination,Protocol,Length,Info
1,0.02706899999975576,10.0.2.15,54.93.77.70,TCP,54,34692  >  9001 [ACK] Seq=21223859 Ack=391073767 Win=65535 Len=0
1,0.027135000000271248,62.210.85.178,10.0.2.15,TLSv1.2,590,Application Data
1,0.07540200000039476,10.0.2.15,62.210.85.178,TCP,54,35978  >  9001 [ACK] Seq=391376389 Ack=21133853 Win=65535 Len=0
1,0.10848599999917496,62.210.85.178,10.0.2.15,TLSv1.2,1104,Application Data
1,0.10859999999956926,10.0.2.15,62.210.85.178,TCP,54,35978  >  9001 [ACK] Seq=391376389 Ack=21134903 Win=65535 Len=0
1,0.155016999999134,10.0.2.15,54.93.77.70,TLSv1.2,590,Application Data
1,0.15522099999907368,54.93.77.70,10.0.2.15,TCP,60,9001  >  34692 [ACK] Seq=391073767 Ack=21224395 Win=65535 Len=0
1,0.541957999999795,10.0.2.15,54.93.77.70,TLSv1.2,1104,Application Data
1,0.5421270000006189,54.93.77.70,10.0.2.15,TCP,60,9001  >  34692 [ACK] Seq=391073767 Ack=21225445 Win=65535 Len=0
1,0.5454910000007658,62.210.85.178,10.0.2.15,TLSv1.2,590,Application Data
1,0.5455369999999675,10.0.2.15,62.210.85.178,TCP,54,35978  >  9001 [ACK] Seq=391376389 Ack=21135439 Win=65535 Len=0
1,0.5457860000005894,10.0.2.15,62.210.85.178,TLSv1.2,590,Application Data
1,0.5458650000000489,62.210.85.178,10.0.2.15,TCP,60,9001  >  35978 [ACK] Seq=21135439 Ack=391376925 Win=65535 Len=0
1,0.5711859999992157,54.93.77.70,10.0.2.15,TLSv1.2,590,Application Data
1,0.5712430000003224,10.0.2.15,54.93.77.70,TCP,54,34692  >  9001 [ACK] Seq=21225445 Ack=391074303 Win=65535 Len=0
1,0.5715440000003582,10.0.2.15,54.93.77.70,TLSv1.2,590,Application Data
1,0.5716229999998177,54.93.77.70,10.0.2.15,TCP,60,9001  >  34692 [ACK] Seq=391074303 Ack=21225981 Win=65535 Len=0
1,0.6406590000005963,54.93.77.70,10.0.2.15,TLSv1.2,590,Application Data
1,0.6411310000003141,10.0.2.15,54.93.77.70,TLSv1.2,1618,Application Data
1,0.6412720000007539,54.93.77.70,10.0.2.15,TCP,60,9001  >  34692 [ACK] Seq=391074839 Ack=21227545 Win=65535 Len=0
1,0.6993320000001404,54.93.77.70,10.0.2.15,TLSv1.2,590,Application Data
1,0.6997369999990042,10.0.2.15,54.93.77.70,TLSv1.2,590,Application Data
1,0.6998490000005404,54.93.77.70,10.0.2.15,TCP,60,9001  >  34692 [ACK] Seq=391075375 Ack=21228081 Win=65535 Len=0
1,0.7368839999999182,62.210.85.178,10.0.2.15,TLSv1.2,1618,Application Data
1,0.7370090000003984,10.0.2.15,62.210.85.178,TCP,54,35978  >  9001 [ACK] Seq=391376925 Ack=21137003 Win=65535 Len=0
1,0.7504590000007738,10.0.2.15,62.210.85.178,TLSv1.2,590,Application Data
1,0.7506470000007539,62.210.85.178,10.0.2.15,TCP,60,9001  >  35978 [ACK] Seq=21137003 Ack=391377461 Win=65535 Len=0
1,0.7612740000004123,10.0.2.15,62.210.85.178,TLSv1.2,1618,Application Data
1,0.7614030000004277,62.210.85.178,10.0.2.15,TCP,60,9001  >  35978 [ACK] Seq=21137003 Ack=391378921 Win=65535 Len=0
1,0.7614219999995839,62.210.85.178,10.0.2.15,TCP,60,9001  >  35978 [ACK] Seq=21137003 Ack=391379025 Win=65535 Len=0
1,0.9740970000002562,54.93.77.70,10.0.2.15,TLSv1.2,590,Application Data
1,0.9770860000007815,54.93.77.70,10.0.2.15,TCP,1502,"9001  >  34692 [PSH, ACK] Seq=391075911 Ack=21228081 Win=65535 Len=1448 [TCP segment of a reassembled PDU]"
1,0.9771509999991395,10.0.2.15,54.93.77.70,TCP,54,34692  >  9001 [ACK] Seq=21228081 Ack=391077359 Win=65535 Len=0
1,0.9785099999990052,54.93.77.70,10.0.2.15,TLSv1.2,706,"Application Data, Application Data"
1,0.980675999999221,10.0.2.15,54.93.77.70,TLSv1.2,590,Application Data
1,0.9808369999991555,54.93.77.70,10.0.2.15,TCP,60,9001  >  34692 [ACK] Seq=391078011 Ack=21228617 Win=65535 Len=0
1,1.0899790000003122,62.210.85.178,10.0.2.15,TLSv1.2,590,Application Data
1,1.0902709999991202,10.0.2.15,62.210.85.178,TLSv1.2,590,Application Data
1,1.0903760000001057,62.210.85.178,10.0.2.15,TCP,60,9001  >  35978 [ACK] Seq=21137539 Ack=391379561 Win=65535 Len=0
1,1.2003979999990406,54.93.77.70,10.0.2.15,TLSv1.2,590,Application Data
1,1.2008349999996426,10.0.2.15,54.93.77.70,TLSv1.2,590,Application Data
1,1.2009519999992335,54.93.77.70,10.0.2.15,TCP,60,9001  >  34692 [ACK] Seq=391078547 Ack=21229153 Win=65535 Len=0
1,1.347950999999739,62.210.85.178,10.0.2.15,TLSv1.2,590,Application Data
1,1.3534880000006524,10.0.2.15,62.210.85.178,TLSv1.2,590,Application Data
1,1.3536480000002484,62.210.85.178,10.0.2.15,TCP,60,9001  >  35978 [ACK] Seq=21138075 Ack=391380097 Win=65535 Len=0
1,1.3648709999997664,10.0.2.15,62.210.85.178,TLSv1.2,4124,Application Data
1,1.3649740000000747,10.0.2.15,62.210.85.178,TCP,2974,35978  >  9001 [ACK] Seq=391384167 Ack=21138075 Win=65535 Len=2920 [TCP segment of a reassembled PDU]
1,1.3650219999999536,62.210.85.178,10.0.2.15,TCP,60,9001  >  35978 [ACK] Seq=21138075 Ack=391381557 Win=65535 Len=0
1,1.365034000000378,62.210.85.178,10.0.2.15,TCP,60,9001  >  35978 [ACK] Seq=21138075 Ack=391383017 Win=65535 Len=0
1,1.3650390000002517,62.210.85.178,10.0.2.15,TCP,60,9001  >  35978 [ACK] Seq=21138075 Ack=391384167 Win=65535 Len=0
1,1.3650440000001254,62.210.85.178,10.0.2.15,TCP,60,9001  >  35978 [ACK] Seq=21138075 Ack=391385627 Win=65535 Len=0
1,1.365046999999322,62.210.85.178,10.0.2.15,TCP,60,9001  >  35978 [ACK] Seq=21138075 Ack=391387087 Win=65535 Len=0
1,1.3650820000002568,10.0.2.15,62.210.85.178,TLSv1.2,1204,Application Data
1,1.3651200000003882,62.210.85.178,10.0.2.15,TCP,60,9001  >  35978 [ACK] Seq=21138075 Ack=391388237 Win=65535 Len=0
1,1.3651669999999285,10.0.2.15,62.210.85.178,TLSv1.2,4124,Application Data
1,1.36520500000006,62.210.85.178,10.0.2.15,TCP,60,9001  >  35978 [ACK] Seq=21138075 Ack=391389697 Win=65535 Len=0
1,1.3652139999994688,62.210.85.178,10.0.2.15,TCP,60,9001  >  35978 [ACK] Seq=21138075 Ack=391391157 Win=65535 Len=0
1,1.365217999999004,62.210.85.178,10.0.2.15,TCP,60,9001  >  35978 [ACK] Seq=21138075 Ack=391392307 Win=65535 Len=0
1,1.3652579999998125,10.0.2.15,62.210.85.178,TLSv1.2,4124,Application Data
1,1.3652949999996054,62.210.85.178,10.0.2.15,TCP,60,9001  >  35978 [ACK] Seq=21138075 Ack=391393767 Win=65535 Len=0
1,1.3653039999990142,62.210.85.178,10.0.2.15,TCP,60,9001  >  35978 [ACK] Seq=21138075 Ack=391395227 Win=65535 Len=0
1,1.3653639999993175,10.0.2.15,62.210.85.178,TLSv1.2,2974,Application Data
1,1.3654050000004645,62.210.85.178,10.0.2.15,TCP,60,9001  >  35978 [ACK] Seq=21138075 Ack=391396377 Win=65535 Len=0
1,1.3654119999991963,62.210.85.178,10.0.2.15,TCP,60,9001  >  35978 [ACK] Seq=21138075 Ack=391397837 Win=65535 Len=0
1,1.3654150000002119,62.210.85.178,10.0.2.15,TCP,60,9001  >  35978 [ACK] Seq=21138075 Ack=391399297 Win=65535 Len=0
1,1.365443000000596,10.0.2.15,62.210.85.178,TLSv1.2,1226,Application Data
1,1.3654790000000503,62.210.85.178,10.0.2.15,TCP,60,9001  >  35978 [ACK] Seq=21138075 Ack=391400469 Win=65535 Len=0
1,1.3655189999990398,10.0.2.15,62.210.85.178,TLSv1.2,4124,Application Data
1,1.3655579999995098,62.210.85.178,10.0.2.15,TCP,60,9001  >  35978 [ACK] Seq=21138075 Ack=391401929 Win=65535 Len=0
1,1.365566000000399,62.210.85.178,10.0.2.15,TCP,60,9001  >  35978 [ACK] Seq=21138075 Ack=391403389 Win=65535 Len=0
1,1.3655699999999342,62.210.85.178,10.0.2.15,TCP,60,9001  >  35978 [ACK] Seq=21138075 Ack=391404539 Win=65535 Len=0
1,1.3656069999997271,10.0.2.15,62.210.85.178,TLSv1.2,3030,Application Data
1,1.365658999999141,62.210.85.178,10.0.2.15,TCP,60,9001  >  35978 [ACK] Seq=21138075 Ack=391405999 Win=65535 Len=0
1,1.3656649999993533,62.210.85.178,10.0.2.15,TCP,60,9001  >  35978 [ACK] Seq=21138075 Ack=391407459 Win=65535 Len=0
1,1.365668000000369,62.210.85.178,10.0.2.15,TCP,60,9001  >  35978 [ACK] Seq=21138075 Ack=391407515 Win=65535 Len=0
1,1.3770750000003318,10.0.2.15,62.210.85.178,TLSv1.2,4124,Application Data
1,1.3771280000000843,62.210.85.178,10.0.2.15,TCP,60,9001  >  35978 [ACK] Seq=21138075 Ack=391408975 Win=65535 Len=0
1,1.3771390000001702,62.210.85.178,10.0.2.15,TCP,60,9001  >  35978 [ACK] Seq=21138075 Ack=391410435 Win=65535 Len=0
1,1.3771440000000439,62.210.85.178,10.0.2.15,TCP,60,9001  >  35978 [ACK] Seq=21138075 Ack=391411585 Win=65535 Len=0
1,1.3771880000003875,10.0.2.15,62.210.85.178,TLSv1.2,4124,Application Data
1,1.3772289999997156,62.210.85.178,10.0.2.15,TCP,60,9001  >  35978 [ACK] Seq=21138075 Ack=391413045 Win=65535 Len=0
1,1.3772379999991244,62.210.85.178,10.0.2.15,TCP,60,9001  >  35978 [ACK] Seq=21138075 Ack=391414505 Win=65535 Len=0
1,1.3772429999989981,62.210.85.178,10.0.2.15,TCP,60,9001  >  35978 [ACK] Seq=21138075 Ack=391415655 Win=65535 Len=0
1,1.377281999999468,10.0.2.15,62.210.85.178,TLSv1.2,4124,Application Data
1,1.377320999999938,62.210.85.178,10.0.2.15,TCP,60,9001  >  35978 [ACK] Seq=21138075 Ack=391417115 Win=65535 Len=0
1,1.3773289999990084,62.210.85.178,10.0.2.15,TCP,60,9001  >  35978 [ACK] Seq=21138075 Ack=391418575 Win=65535 Len=0
1,1.377334000000701,62.210.85.178,10.0.2.15,TCP,60,9001  >  35978 [ACK] Seq=21138075 Ack=391419725 Win=65535 Len=0
1,1.3773739999996906,10.0.2.15,62.210.85.178,TLSv1.2,4124,Application Data
1,1.377411999999822,62.210.85.178,10.0.2.15,TCP,60,9001  >  35978 [ACK] Seq=21138075 Ack=391421185 Win=65535 Len=0
1,1.3774200000007113,62.210.85.178,10.0.2.15,TCP,60,9001  >  35978 [ACK] Seq=21138075 Ack=391422645 Win=65535 Len=0
1,1.377425000000585,62.210.85.178,10.0.2.15,TCP,60,9001  >  35978 [ACK] Seq=21138075 Ack=391423795 Win=65535 Len=0
1,1.3774610000000393,10.0.2.15,62.210.85.178,TLSv1.2,332,Application Data
1,1.3774979999998322,62.210.85.178,10.0.2.15,TCP,60,9001  >  35978 [ACK] Seq=21138075 Ack=391424073 Win=65535 Len=0
1,1.3775499999992462,10.0.2.15,62.210.85.178,TLSv1.2,3868,Application Data
1,1.3775879999993776,62.210.85.178,10.0.2.15,TCP,60,9001  >  35978 [ACK] Seq=21138075 Ack=391425533 Win=65535 Len=0
1,1.3775970000006055,62.210.85.178,10.0.2.15,TCP,60,9001  >  35978 [ACK] Seq=21138075 Ack=391426993 Win=65535 Len=0
1,1.3776020000004792,62.210.85.178,10.0.2.15,TCP,60,9001  >  35978 [ACK] Seq=21138075 Ack=391427887 Win=65535 Len=0
1,1.3776409999991301,10.0.2.15,62.210.85.178,TLSv1.2,4124,Application Data
1,1.3776789999992616,62.210.85.178,10.0.2.15,TCP,60,9001  >  35978 [ACK] Seq=21138075 Ack=391429347 Win=65535 Len=0
1,1.3776870000001509,62.210.85.178,10.0.2.15,TCP,60,9001  >  35978 [ACK] Seq=21138075 Ack=391430807 Win=65535 Len=0
1,1.377690999999686,62.210.85.178,10.0.2.15,TCP,60,9001  >  35978 [ACK] Seq=21138075 Ack=391431957 Win=65535 Len=0
1,1.3777260000006208,10.0.2.15,62.210.85.178,TLSv1.2,3030,Application Data
1,1.3777649999992718,62.210.85.178,10.0.2.15,TCP,60,9001  >  35978 [ACK] Seq=21138075 Ack=391433417 Win=65535 Len=0
1,1.3777730000001611,62.210.85.178,10.0.2.15,TCP,60,9001  >  35978 [ACK] Seq=21138075 Ack=391434877 Win=65535 Len=0
1,1.3777780000000348,62.210.85.178,10.0.2.15,TCP,60,9001  >  35978 [ACK] Seq=21138075 Ack=391434933 Win=65535 Len=0
1,1.3892099999993661,10.0.2.15,62.210.85.178,TLSv1.2,4124,Application Data
1,1.3892649999997957,62.210.85.178,10.0.2.15,TCP,60,9001  >  35978 [ACK] Seq=21138075 Ack=391436393 Win=65535 Len=0
1,1.3892759999998816,62.210.85.178,10.0.2.15,TCP,60,9001  >  35978 [ACK] Seq=21138075 Ack=391437853 Win=65535 Len=0
1,1.3892809999997553,62.210.85.178,10.0.2.15,TCP,60,9001  >  35978 [ACK] Seq=21138075 Ack=391439003 Win=65535 Len=0
1,1.3893279999992956,10.0.2.15,62.210.85.178,TLSv1.2,4124,Application Data
1,1.389368000000104,62.210.85.178,10.0.2.15,TCP,60,9001  >  35978 [ACK] Seq=21138075 Ack=391440463 Win=65535 Len=0
1,1.389376999999513,62.210.85.178,10.0.2.15,TCP,60,9001  >  35978 [ACK] Seq=21138075 Ack=391441923 Win=65535 Len=0
1,1.3893819999993866,62.210.85.178,10.0.2.15,TCP,60,9001  >  35978 [ACK] Seq=21138075 Ack=391443073 Win=65535 Len=0
1,1.3894189999991795,10.0.2.15,62.210.85.178,TLSv1.2,1232,Application Data
1,1.389456999999311,62.210.85.178,10.0.2.15,TCP,60,9001  >  35978 [ACK] Seq=21138075 Ack=391444251 Win=65535 Len=0
1,1.5047880000001896,54.93.77.70,10.0.2.15,TCP,2950,"9001  >  34692 [PSH, ACK] Seq=391078547 Ack=21229153 Win=65535 Len=2896 [TCP segment of a reassembled PDU]"
1,1.5048289999995177,54.93.77.70,10.0.2.15,TLSv1.2,1502,Application Data [TCP segment of a reassembled PDU]
1,1.5049369999996998,10.0.2.15,54.93.77.70,TCP,54,34692  >  9001 [ACK] Seq=21229153 Ack=391082891 Win=65535 Len=0
1,1.506191000000399,54.93.77.70,10.0.2.15,TLSv1.2,3464,Application Data
1,1.5062500000003638,10.0.2.15,54.93.77.70,TCP,54,34692  >  9001 [ACK] Seq=21229153 Ack=391086301 Win=65535 Len=0
1,1.5241160000005038,54.93.77.70,10.0.2.15,TLSv1.2,3486,Application Data
1,1.5241359999999986,54.93.77.70,10.0.2.15,TLSv1.2,1502,Application Data [TCP segment of a reassembled PDU]
1,1.5241829999995389,10.0.2.15,54.93.77.70,TCP,54,34692  >  9001 [ACK] Seq=21229153 Ack=391089733 Win=65535 Len=0
1,1.524267000000691,10.0.2.15,54.93.77.70,TCP,54,34692  >  9001 [ACK] Seq=21229153 Ack=391091181 Win=65535 Len=0
1,1.5248649999994086,54.93.77.70,10.0.2.15,TLSv1.2,5846,"Application Data, Application Data"
1,1.5249060000005557,10.0.2.15,54.93.77.70,TCP,54,34692  >  9001 [ACK] Seq=21229153 Ack=391096973 Win=65535 Len=0
1,1.5451699999994162,54.93.77.70,10.0.2.15,TLSv1.2,2950,Application Data [TCP segment of a reassembled PDU]
1,1.545191999999588,54.93.77.70,10.0.2.15,TCP,1502,"9001  >  34692 [PSH, ACK] Seq=391099869 Ack=21229153 Win=65535 Len=1448 [TCP segment of a reassembled PDU]"
1,1.5452000000004773,54.93.77.70,10.0.2.15,TLSv1.2,7830,"Application Data, Application Data, Application Data"
1,1.5452409999998054,10.0.2.15,54.93.77.70,TCP,54,34692  >  9001 [ACK] Seq=21229153 Ack=391099869 Win=65535 Len=0
1,1.5453190000007453,10.0.2.15,54.93.77.70,TCP,54,34692  >  9001 [ACK] Seq=21229153 Ack=391109093 Win=65535 Len=0
1,1.545535999999629,10.0.2.15,54.93.77.70,TLSv1.2,590,Application Data
1,1.545604999999341,54.93.77.70,10.0.2.15,TCP,60,9001  >  34692 [ACK] Seq=391109093 Ack=21229689 Win=65535 Len=0
1,1.5518879999999626,54.93.77.70,10.0.2.15,TLSv1.2,5846,Application Data
1,1.5519320000003063,10.0.2.15,54.93.77.70,TCP,54,34692  >  9001 [ACK] Seq=21229689 Ack=391114885 Win=65535 Len=0
1,1.5521580000004178,54.93.77.70,10.0.2.15,TCP,1502,"9001  >  34692 [PSH, ACK] Seq=391114885 Ack=21229689 Win=65535 Len=1448 [TCP segment of a reassembled PDU]"
1,1.552201000000423,10.0.2.15,54.93.77.70,TCP,54,34692  >  9001 [ACK] Seq=21229689 Ack=391116333 Win=65535 Len=0
1,1.557412000000113,10.0.2.15,54.93.77.70,TLSv1.2,590,Application Data
1,1.5575079999998707,54.93.77.70,10.0.2.15,TCP,60,9001  >  34692 [ACK] Seq=391116333 Ack=21230225 Win=65535 Len=0
1,1.5604330000005575,54.93.77.70,10.0.2.15,TLSv1.2,1502,Application Data [TCP segment of a reassembled PDU]
1,1.5604889999995066,10.0.2.15,54.93.77.70,TCP,54,34692  >  9001 [ACK] Seq=21230225 Ack=391117781 Win=65535 Len=0
1,1.561569999999847,54.93.77.70,10.0.2.15,TLSv1.2,684,Application Data
1,1.5722869999990507,54.93.77.70,10.0.2.15,TCP,2950,"9001  >  34692 [PSH, ACK] Seq=391118411 Ack=21230225 Win=65535 Len=2896 [TCP segment of a reassembled PDU]"
1,1.5723500000003696,10.0.2.15,54.93.77.70,TCP,54,34692  >  9001 [ACK] Seq=21230225 Ack=391121307 Win=65535 Len=0
1,1.5818130000006931,54.93.77.70,10.0.2.15,TLSv1.2,778,Application Data
1,1.6045680000006541,54.93.77.70,10.0.2.15,TCP,2950,"9001  >  34692 [PSH, ACK] Seq=391122031 Ack=21230225 Win=65535 Len=2896 [TCP segment of a reassembled PDU]"
1,1.6046630000000732,10.0.2.15,54.93.77.70,TCP,54,34692  >  9001 [ACK] Seq=21230225 Ack=391124927 Win=65535 Len=0
1,1.6048989999999321,54.93.77.70,10.0.2.15,TLSv1.2,2950,Application Data [TCP segment of a reassembled PDU]
1,1.6049430000002758,10.0.2.15,54.93.77.70,TCP,54,34692  >  9001 [ACK] Seq=21230225 Ack=391127823 Win=65535 Len=0
1,1.6062249999995402,54.93.77.70,10.0.2.15,TLSv1.2,4398,Application Data [TCP segment of a reassembled PDU]
1,1.6062870000005205,10.0.2.15,54.93.77.70,TCP,54,34692  >  9001 [ACK] Seq=21230225 Ack=391132167 Win=65535 Len=0
1,1.6170750000001135,54.93.77.70,10.0.2.15,TLSv1.2,2950,Application Data [TCP segment of a reassembled PDU]
1,1.6170980000006239,54.93.77.70,10.0.2.15,TLSv1.2,7294,"Application Data, Application Data"
1,1.6171460000005027,10.0.2.15,54.93.77.70,TCP,54,34692  >  9001 [ACK] Seq=21230225 Ack=391135063 Win=65535 Len=0
1,1.617232000000513,10.0.2.15,54.93.77.70,TCP,54,34692  >  9001 [ACK] Seq=21230225 Ack=391142303 Win=65535 Len=0
1,1.6174169999994774,10.0.2.15,54.93.77.70,TLSv1.2,590,Application Data
1,1.617525999999998,54.93.77.70,10.0.2.15,TCP,60,9001  >  34692 [ACK] Seq=391142303 Ack=21230761 Win=65535 Len=0
1,1.6210119999996095,54.93.77.70,10.0.2.15,TLSv1.2,988,Application Data
1,1.6266689999993105,10.0.2.15,54.93.77.70,TLSv1.2,590,Application Data
1,1.6268519999994169,54.93.77.70,10.0.2.15,TCP,60,9001  >  34692 [ACK] Seq=391143237 Ack=21231297 Win=65535 Len=0
1,1.6594499999991967,62.210.85.178,10.0.2.15,TLSv1.2,590,Application Data
1,1.7006959999998799,10.0.2.15,62.210.85.178,TCP,54,35978  >  9001 [ACK] Seq=391444251 Ack=21138611 Win=65535 Len=0
1,1.7205009999997856,62.210.85.178,10.0.2.15,TLSv1.2,590,Application Data
1,1.720604000000094,10.0.2.15,62.210.85.178,TCP,54,35978  >  9001 [ACK] Seq=391444251 Ack=21139147 Win=65535 Len=0
1,1.7441839999992226,62.210.85.178,10.0.2.15,TLSv1.2,1104,Application Data
1,1.7442339999997785,10.0.2.15,62.210.85.178,TCP,54,35978  >  9001 [ACK] Seq=391444251 Ack=21140197 Win=65535 Len=0
1,1.7446789999994508,10.0.2.15,62.210.85.178,TLSv1.2,590,Application Data
1,1.7448920000006183,62.210.85.178,10.0.2.15,TCP,60,9001  >  35978 [ACK] Seq=21140197 Ack=391444787 Win=65535 Len=0
1,2.2029879999990953,54.93.77.70,10.0.2.15,TLSv1.2,590,Application Data
1,2.203457999999955,10.0.2.15,54.93.77.70,TLSv1.2,590,Application Data
1,2.203567999998995,54.93.77.70,10.0.2.15,TCP,60,9001  >  34692 [ACK] Seq=391143773 Ack=21231833 Win=65535 Len=0
1,2.3490340000007564,62.210.85.178,10.0.2.15,TLSv1.2,590,Application Data
1,2.352708000000348,10.0.2.15,62.210.85.178,TLSv1.2,590,Application Data
1,2.352861999999732,62.210.85.178,10.0.2.15,TCP,60,9001  >  35978 [ACK] Seq=21140733 Ack=391445323 Win=65535 Len=0
1,2.36468799999966,10.0.2.15,62.210.85.178,TLSv1.2,4124,Application Data
1,2.364792000000307,10.0.2.15,62.210.85.178,TCP,2974,35978  >  9001 [ACK] Seq=391449393 Ack=21140733 Win=65535 Len=2920 [TCP segment of a reassembled PDU]
1,2.3648419999990438,62.210.85.178,10.0.2.15,TCP,60,9001  >  35978 [ACK] Seq=21140733 Ack=391446783 Win=65535 Len=0
1,2.3648549999998068,62.210.85.178,10.0.2.15,TCP,60,9001  >  35978 [ACK] Seq=21140733 Ack=391448243 Win=65535 Len=0
1,2.3648599999996804,62.210.85.178,10.0.2.15,TCP,60,9001  >  35978 [ACK] Seq=21140733 Ack=391449393 Win=65535 Len=0
1,2.364901999999347,10.0.2.15,62.210.85.178,TLSv1.2,1204,Application Data
1,2.364940999999817,62.210.85.178,10.0.2.15,TCP,60,9001  >  35978 [ACK] Seq=21140733 Ack=391450853 Win=65535 Len=0
1,2.3649490000007063,62.210.85.178,10.0.2.15,TCP,60,9001  >  35978 [ACK] Seq=21140733 Ack=391452313 Win=65535 Len=0
1,2.3649530000002414,62.210.85.178,10.0.2.15,TCP,60,9001  >  35978 [ACK] Seq=21140733 Ack=391453463 Win=65535 Len=0
1,2.3649939999995695,10.0.2.15,62.210.85.178,TLSv1.2,4124,Application Data
1,2.365031999999701,62.210.85.178,10.0.2.15,TCP,60,9001  >  35978 [ACK] Seq=21140733 Ack=391454923 Win=65535 Len=0
1,2.3650409999991098,62.210.85.178,10.0.2.15,TCP,60,9001  >  35978 [ACK] Seq=21140733 Ack=391456383 Win=65535 Len=0
1,2.3650460000008025,62.210.85.178,10.0.2.15,TCP,60,9001  >  35978 [ACK] Seq=21140733 Ack=391457533 Win=65535 Len=0
1,2.3650849999994534,10.0.2.15,62.210.85.178,TLSv1.2,4124,Application Data
1,2.3651219999992463,62.210.85.178,10.0.2.15,TCP,60,9001  >  35978 [ACK] Seq=21140733 Ack=391458993 Win=65535 Len=0
1,2.365131000000474,62.210.85.178,10.0.2.15,TCP,60,9001  >  35978 [ACK] Seq=21140733 Ack=391460453 Win=65535 Len=0
1,2.3651910000007774,10.0.2.15,62.210.85.178,TLSv1.2,2974,Application Data
1,2.3652299999994284,62.210.85.178,10.0.2.15,TCP,60,9001  >  35978 [ACK] Seq=21140733 Ack=391461603 Win=65535 Len=0
1,2.3652380000003177,62.210.85.178,10.0.2.15,TCP,60,9001  >  35978 [ACK] Seq=21140733 Ack=391463063 Win=65535 Len=0
1,2.365241999999853,62.210.85.178,10.0.2.15,TCP,60,9001  >  35978 [ACK] Seq=21140733 Ack=391464523 Win=65535 Len=0
1,2.365270000000237,10.0.2.15,62.210.85.178,TLSv1.2,1226,Application Data
1,2.36530700000003,62.210.85.178,10.0.2.15,TCP,60,9001  >  35978 [ACK] Seq=21140733 Ack=391465695 Win=65535 Len=0
1,2.3653469999990193,10.0.2.15,62.210.85.178,TLSv1.2,2452,Application Data
1,2.3653859999994893,62.210.85.178,10.0.2.15,TCP,60,9001  >  35978 [ACK] Seq=21140733 Ack=391467155 Win=65535 Len=0
1,2.36539300000004,62.210.85.178,10.0.2.15,TCP,60,9001  >  35978 [ACK] Seq=21140733 Ack=391468093 Win=65535 Len=0
1,2.6126939999994647,54.93.77.70,10.0.2.15,TCP,2950,"9001  >  34692 [PSH, ACK] Seq=391143773 Ack=21231833 Win=65535 Len=2896 [TCP segment of a reassembled PDU]"
1,2.612827999999354,10.0.2.15,54.93.77.70,TCP,54,34692  >  9001 [ACK] Seq=21231833 Ack=391146669 Win=65535 Len=0
1,2.6161489999994956,54.93.77.70,10.0.2.15,TLSv1.2,778,Application Data
1,2.6162339999991673,54.93.77.70,10.0.2.15,TLSv1.2,10190,"Application Data, Application Data, Application Data"
1,2.6162850000000617,10.0.2.15,54.93.77.70,TCP,54,34692  >  9001 [ACK] Seq=21231833 Ack=391157529 Win=65535 Len=0
1,2.631428999999116,54.93.77.70,10.0.2.15,TLSv1.2,2950,Application Data [TCP segment of a reassembled PDU]
1,2.6314800000000105,10.0.2.15,54.93.77.70,TCP,54,34692  >  9001 [ACK] Seq=21231833 Ack=391160425 Win=65535 Len=0
1,2.63296900000023,54.93.77.70,10.0.2.15,TLSv1.2,6686,"Application Data, Application Data"
1,2.6330290000005334,10.0.2.15,54.93.77.70,TCP,54,34692  >  9001 [ACK] Seq=21231833 Ack=391167057 Win=65535 Len=0
1,2.63317300000017,10.0.2.15,54.93.77.70,TLSv1.2,590,Application Data
1,2.6332449999990786,54.93.77.70,10.0.2.15,TCP,60,9001  >  34692 [ACK] Seq=391167057 Ack=21232369 Win=65535 Len=0
1,2.6425970000000234,10.0.2.15,54.93.77.70,TLSv1.2,590,Application Data
1,2.6427309999999125,54.93.77.70,10.0.2.15,TCP,60,9001  >  34692 [ACK] Seq=391167057 Ack=21232905 Win=65535 Len=0
1,2.8179519999994227,62.210.85.178,10.0.2.15,TLSv1.2,1104,Application Data
1,2.8184719999990193,10.0.2.15,62.210.85.178,TLSv1.2,590,Application Data
1,2.8185780000003433,62.210.85.178,10.0.2.15,TCP,60,9001  >  35978 [ACK] Seq=21141783 Ack=391468629 Win=65535 Len=0
1,2.9033699999999953,54.93.77.70,10.0.2.15,TLSv1.2,590,Application Data
1,2.9038280000004306,10.0.2.15,54.93.77.70,TLSv1.2,590,Application Data
1,2.9039369999991322,54.93.77.70,10.0.2.15,TCP,60,9001  >  34692 [ACK] Seq=391167593 Ack=21233441 Win=65535 Len=0
1,3.0160649999997986,62.210.85.178,10.0.2.15,TLSv1.2,590,Application Data
1,3.0218370000002324,10.0.2.15,62.210.85.178,TLSv1.2,590,Application Data
1,3.0219949999991513,62.210.85.178,10.0.2.15,TCP,60,9001  >  35978 [ACK] Seq=21142319 Ack=391469165 Win=65535 Len=0
1,3.0333239999999932,10.0.2.15,62.210.85.178,TLSv1.2,4124,Application Data
1,3.0334189999994123,10.0.2.15,62.210.85.178,TCP,2974,35978  >  9001 [ACK] Seq=391473235 Ack=21142319 Win=65535 Len=2920 [TCP segment of a reassembled PDU]
1,3.033459000000221,62.210.85.178,10.0.2.15,TCP,60,9001  >  35978 [ACK] Seq=21142319 Ack=391470625 Win=65535 Len=0
1,3.033471999999165,62.210.85.178,10.0.2.15,TCP,60,9001  >  35978 [ACK] Seq=21142319 Ack=391472085 Win=65535 Len=0
1,3.0334769999990385,62.210.85.178,10.0.2.15,TCP,60,9001  >  35978 [ACK] Seq=21142319 Ack=391473235 Win=65535 Len=0
1,3.033480000000054,62.210.85.178,10.0.2.15,TCP,60,9001  >  35978 [ACK] Seq=21142319 Ack=391474695 Win=65535 Len=0
1,3.033482000000731,62.210.85.178,10.0.2.15,TCP,60,9001  >  35978 [ACK] Seq=21142319 Ack=391476155 Win=65535 Len=0
1,3.033525999999256,10.0.2.15,62.210.85.178,TLSv1.2,1204,Application Data
1,3.0335589999995136,62.210.85.178,10.0.2.15,TCP,60,9001  >  35978 [ACK] Seq=21142319 Ack=391477305 Win=65535 Len=0
1,3.033604000000196,10.0.2.15,62.210.85.178,TLSv1.2,4124,Application Data
1,3.033638000000792,62.210.85.178,10.0.2.15,TCP,60,9001  >  35978 [ACK] Seq=21142319 Ack=391478765 Win=65535 Len=0
1,3.0336459999998624,62.210.85.178,10.0.2.15,TCP,60,9001  >  35978 [ACK] Seq=21142319 Ack=391480225 Win=65535 Len=0
1,3.0336499999993976,62.210.85.178,10.0.2.15,TCP,60,9001  >  35978 [ACK] Seq=21142319 Ack=391481375 Win=65535 Len=0
1,3.033687999999529,10.0.2.15,62.210.85.178,TLSv1.2,4124,Application Data
1,3.0337220000001253,62.210.85.178,10.0.2.15,TCP,60,9001  >  35978 [ACK] Seq=21142319 Ack=391482835 Win=65535 Len=0
1,3.0337299999991956,62.210.85.178,10.0.2.15,TCP,60,9001  >  35978 [ACK] Seq=21142319 Ack=391484295 Win=65535 Len=0
1,3.033767999999327,62.210.85.178,10.0.2.15,TCP,60,9001  >  35978 [ACK] Seq=21142319 Ack=391485445 Win=65535 Len=0
1,3.0338009999995847,10.0.2.15,62.210.85.178,TLSv1.2,332,Application Data
1,3.0338319999991654,62.210.85.178,10.0.2.15,TCP,60,9001  >  35978 [ACK] Seq=21142319 Ack=391485723 Win=65535 Len=0
1,3.0338859999992565,10.0.2.15,62.210.85.178,TLSv1.2,3868,Application Data
1,3.0339229999990494,62.210.85.178,10.0.2.15,TCP,60,9001  >  35978 [ACK] Seq=21142319 Ack=391487183 Win=65535 Len=0
1,3.0339299999996,62.210.85.178,10.0.2.15,TCP,60,9001  >  35978 [ACK] Seq=21142319 Ack=391488643 Win=65535 Len=0
1,3.0339330000006157,62.210.85.178,10.0.2.15,TCP,60,9001  >  35978 [ACK] Seq=21142319 Ack=391489537 Win=65535 Len=0
1,3.0339700000004086,10.0.2.15,62.210.85.178,TLSv1.2,4124,Application Data
1,3.0340049999995244,62.210.85.178,10.0.2.15,TCP,60,9001  >  35978 [ACK] Seq=21142319 Ack=391490997 Win=65535 Len=0
1,3.034012000000075,62.210.85.178,10.0.2.15,TCP,60,9001  >  35978 [ACK] Seq=21142319 Ack=391492457 Win=65535 Len=0
1,3.034014999999272,62.210.85.178,10.0.2.15,TCP,60,9001  >  35978 [ACK] Seq=21142319 Ack=391493607 Win=65535 Len=0
1,3.034048999999868,10.0.2.15,62.210.85.178,TLSv1.2,3030,Application Data
1,3.0340830000004644,62.210.85.178,10.0.2.15,TCP,60,9001  >  35978 [ACK] Seq=21142319 Ack=391495067 Win=65535 Len=0
1,3.034089999999196,62.210.85.178,10.0.2.15,TCP,60,9001  >  35978 [ACK] Seq=21142319 Ack=391496527 Win=65535 Len=0
1,3.0340930000002118,62.210.85.178,10.0.2.15,TCP,60,9001  >  35978 [ACK] Seq=21142319 Ack=391496583 Win=65535 Len=0
1,3.043314000000464,10.0.2.15,62.210.85.178,TLSv1.2,4124,Application Data
1,3.0433890000003885,62.210.85.178,10.0.2.15,TCP,60,9001  >  35978 [ACK] Seq=21142319 Ack=391498043 Win=65535 Len=0
1,3.0433979999997973,62.210.85.178,10.0.2.15,TCP,60,9001  >  35978 [ACK] Seq=21142319 Ack=391499503 Win=65535 Len=0
1,3.043400999998994,62.210.85.178,10.0.2.15,TCP,60,9001  >  35978 [ACK] Seq=21142319 Ack=391500653 Win=65535 Len=0
1,3.0434409999998024,10.0.2.15,62.210.85.178,TLSv1.2,4124,Application Data
1,3.0434929999992164,62.210.85.178,10.0.2.15,TCP,60,9001  >  35978 [ACK] Seq=21142319 Ack=391502113 Win=65535 Len=0
1,3.043499999999767,62.210.85.178,10.0.2.15,TCP,60,9001  >  35978 [ACK] Seq=21142319 Ack=391503573 Win=65535 Len=0
1,3.0435030000007828,62.210.85.178,10.0.2.15,TCP,60,9001  >  35978 [ACK] Seq=21142319 Ack=391504723 Win=65535 Len=0
1,3.043539000000237,10.0.2.15,62.210.85.178,TLSv1.2,4124,Application Data
1,3.0435729999990144,62.210.85.178,10.0.2.15,TCP,60,9001  >  35978 [ACK] Seq=21142319 Ack=391506183 Win=65535 Len=0
1,3.0435809999999037,62.210.85.178,10.0.2.15,TCP,60,9001  >  35978 [ACK] Seq=21142319 Ack=391507643 Win=65535 Len=0
1,3.043584999999439,62.210.85.178,10.0.2.15,TCP,60,9001  >  35978 [ACK] Seq=21142319 Ack=391508793 Win=65535 Len=0
1,3.0436210000007122,10.0.2.15,62.210.85.178,TLSv1.2,4124,Application Data
1,3.0436549999994895,62.210.85.178,10.0.2.15,TCP,60,9001  >  35978 [ACK] Seq=21142319 Ack=391510253 Win=65535 Len=0
1,3.0436620000000403,62.210.85.178,10.0.2.15,TCP,60,9001  >  35978 [ACK] Seq=21142319 Ack=391511713 Win=65535 Len=0
1,3.043666999999914,62.210.85.178,10.0.2.15,TCP,60,9001  >  35978 [ACK] Seq=21142319 Ack=391512863 Win=65535 Len=0
1,3.0437010000005102,10.0.2.15,62.210.85.178,TLSv1.2,332,Application Data
1,3.043734000000768,62.210.85.178,10.0.2.15,TCP,60,9001  >  35978 [ACK] Seq=21142319 Ack=391513141 Win=65535 Len=0
1,3.0437849999998434,10.0.2.15,62.210.85.178,TLSv1.2,3868,Application Data
1,3.043820999999298,62.210.85.178,10.0.2.15,TCP,60,9001  >  35978 [ACK] Seq=21142319 Ack=391514601 Win=65535 Len=0
1,3.0438279999998485,62.210.85.178,10.0.2.15,TCP,60,9001  >  35978 [ACK] Seq=21142319 Ack=391516061 Win=65535 Len=0
1,3.0438319999993837,62.210.85.178,10.0.2.15,TCP,60,9001  >  35978 [ACK] Seq=21142319 Ack=391516955 Win=65535 Len=0
1,3.0438689999991766,10.0.2.15,62.210.85.178,TLSv1.2,4124,Application Data
1,3.0439040000001114,62.210.85.178,10.0.2.15,TCP,60,9001  >  35978 [ACK] Seq=21142319 Ack=391518415 Win=65535 Len=0
1,3.043911000000662,62.210.85.178,10.0.2.15,TCP,60,9001  >  35978 [ACK] Seq=21142319 Ack=391519875 Win=65535 Len=0
1,3.043913999999859,62.210.85.178,10.0.2.15,TCP,60,9001  >  35978 [ACK] Seq=21142319 Ack=391521025 Win=65535 Len=0
1,3.043948000000455,10.0.2.15,62.210.85.178,TLSv1.2,3030,Application Data
1,3.0439819999992324,62.210.85.178,10.0.2.15,TCP,60,9001  >  35978 [ACK] Seq=21142319 Ack=391522485 Win=65535 Len=0
1,3.043988999999783,62.210.85.178,10.0.2.15,TCP,60,9001  >  35978 [ACK] Seq=21142319 Ack=391523945 Win=65535 Len=0
1,3.04399100000046,62.210.85.178,10.0.2.15,TCP,60,9001  >  35978 [ACK] Seq=21142319 Ack=391524001 Win=65535 Len=0
1,3.0576289999989967,10.0.2.15,62.210.85.178,TLSv1.2,4124,Application Data
1,3.0577250000005733,10.0.2.15,62.210.85.178,TCP,2974,35978  >  9001 [ACK] Seq=391528071 Ack=21142319 Win=65535 Len=2920 [TCP segment of a reassembled PDU]
1,3.0577479999992647,62.210.85.178,10.0.2.15,TCP,60,9001  >  35978 [ACK] Seq=21142319 Ack=391525461 Win=65535 Len=0
1,3.057756000000154,62.210.85.178,10.0.2.15,TCP,60,9001  >  35978 [ACK] Seq=21142319 Ack=391526921 Win=65535 Len=0
1,3.0577610000000277,62.210.85.178,10.0.2.15,TCP,60,9001  >  35978 [ACK] Seq=21142319 Ack=391528071 Win=65535 Len=0
1,3.0577659999999014,62.210.85.178,10.0.2.15,TCP,60,9001  >  35978 [ACK] Seq=21142319 Ack=391529531 Win=65535 Len=0
1,3.0577699999994365,62.210.85.178,10.0.2.15,TCP,60,9001  >  35978 [ACK] Seq=21142319 Ack=391530991 Win=65535 Len=0
1,3.057804000000033,10.0.2.15,62.210.85.178,TLSv1.2,1204,Application Data
1,3.0578370000002906,62.210.85.178,10.0.2.15,TCP,60,9001  >  35978 [ACK] Seq=21142319 Ack=391532141 Win=65535 Len=0
1,3.0578800000002957,10.0.2.15,62.210.85.178,TLSv1.2,4124,Application Data
1,3.057913999999073,62.210.85.178,10.0.2.15,TCP,60,9001  >  35978 [ACK] Seq=21142319 Ack=391533601 Win=65535 Len=0
1,3.0579219999999623,62.210.85.178,10.0.2.15,TCP,60,9001  >  35978 [ACK] Seq=21142319 Ack=391535061 Win=65535 Len=0
1,3.0579259999994974,62.210.85.178,10.0.2.15,TCP,60,9001  >  35978 [ACK] Seq=21142319 Ack=391536211 Win=65535 Len=0
1,3.0579629999992903,10.0.2.15,62.210.85.178,TLSv1.2,4124,Application Data
1,3.057998000000225,62.210.85.178,10.0.2.15,TCP,60,9001  >  35978 [ACK] Seq=21142319 Ack=391537671 Win=65535 Len=0
1,3.058005000000776,62.210.85.178,10.0.2.15,TCP,60,9001  >  35978 [ACK] Seq=21142319 Ack=391539131 Win=65535 Len=0
1,3.058009000000311,62.210.85.178,10.0.2.15,TCP,60,9001  >  35978 [ACK] Seq=21142319 Ack=391540281 Win=65535 Len=0
1,3.058042000000569,10.0.2.15,62.210.85.178,TLSv1.2,332,Application Data
1,3.058075999999346,62.210.85.178,10.0.2.15,TCP,60,9001  >  35978 [ACK] Seq=21142319 Ack=391540559 Win=65535 Len=0
1,3.136091000000306,54.93.77.70,10.0.2.15,TCP,2950,"9001  >  34692 [PSH, ACK] Seq=391167593 Ack=21233441 Win=65535 Len=2896 [TCP segment of a reassembled PDU]"
1,3.136188000000402,54.93.77.70,10.0.2.15,TLSv1.2,778,Application Data
1,3.136248999999225,10.0.2.15,54.93.77.70,TCP,54,34692  >  9001 [ACK] Seq=21233441 Ack=391171213 Win=65535 Len=0
1,3.1965390000004845,54.93.77.70,10.0.2.15,TLSv1.2,3674,Application Data
1,3.1966229999998177,10.0.2.15,54.93.77.70,TCP,54,34692  >  9001 [ACK] Seq=21233441 Ack=391174833 Win=65535 Len=0
1,3.2123049999991053,54.93.77.70,10.0.2.15,TLSv1.2,590,Application Data
1,3.215487999999823,54.93.77.70,10.0.2.15,TCP,2950,"9001  >  34692 [PSH, ACK] Seq=391175369 Ack=21233441 Win=65535 Len=2896 [TCP segment of a reassembled PDU]"
1,3.2155339999990247,10.0.2.15,54.93.77.70,TCP,54,34692  >  9001 [ACK] Seq=21233441 Ack=391178265 Win=65535 Len=0
1,3.2159730000003037,54.93.77.70,10.0.2.15,TLSv1.2,4398,"Application Data, Application Data"
1,3.216013999999632,10.0.2.15,54.93.77.70,TCP,54,34692  >  9001 [ACK] Seq=21233441 Ack=391182609 Win=65535 Len=0
1,3.2267090000004828,54.93.77.70,10.0.2.15,TCP,2950,"9001  >  34692 [PSH, ACK] Seq=391182609 Ack=21233441 Win=65535 Len=2896 [TCP segment of a reassembled PDU]"
1,3.2267489999994723,10.0.2.15,54.93.77.70,TCP,54,34692  >  9001 [ACK] Seq=21233441 Ack=391185505 Win=65535 Len=0
1,3.2275119999994786,54.93.77.70,10.0.2.15,TLSv1.2,8742,"Application Data, Application Data"
1,3.227575999999317,10.0.2.15,54.93.77.70,TCP,54,34692  >  9001 [ACK] Seq=21233441 Ack=391194193 Win=65535 Len=0
1,3.2284039999995002,54.93.77.70,10.0.2.15,TLSv1.2,358,Application Data
1,3.2286129999993136,10.0.2.15,54.93.77.70,TLSv1.2,590,Application Data
1,3.2287300000007235,54.93.77.70,10.0.2.15,TCP,60,9001  >  34692 [ACK] Seq=391194497 Ack=21233977 Win=65535 Len=0
1,3.2361949999994977,54.93.77.70,10.0.2.15,TCP,1502,"9001  >  34692 [PSH, ACK] Seq=391194497 Ack=21233977 Win=65535 Len=1448 [TCP segment of a reassembled PDU]"
1,3.2362599999996746,10.0.2.15,54.93.77.70,TCP,54,34692  >  9001 [ACK] Seq=21233977 Ack=391195945 Win=65535 Len=0
1,3.2454060000000027,54.93.77.70,10.0.2.15,TLSv1.2,170,Application Data
1,3.245994000000792,54.93.77.70,10.0.2.15,TLSv1.2,4398,Application Data
1,3.2460639999990235,10.0.2.15,54.93.77.70,TCP,54,34692  >  9001 [ACK] Seq=21233977 Ack=391200405 Win=65535 Len=0
1,3.246877999999924,54.93.77.70,10.0.2.15,TCP,2950,"9001  >  34692 [PSH, ACK] Seq=391200405 Ack=21233977 Win=65535 Len=2896 [TCP segment of a reassembled PDU]"
1,3.2469209999999293,10.0.2.15,54.93.77.70,TCP,54,34692  >  9001 [ACK] Seq=21233977 Ack=391203301 Win=65535 Len=0
1,3.2629280000001017,54.93.77.70,10.0.2.15,TLSv1.2,568,Application Data
1,3.263734000000113,54.93.77.70,10.0.2.15,TLSv1.2,5846,Application Data
1,3.2638000000006286,10.0.2.15,54.93.77.70,TCP,54,34692  >  9001 [ACK] Seq=21233977 Ack=391209607 Win=65535 Len=0
1,3.264467999999397,54.93.77.70,10.0.2.15,TCP,1502,"9001  >  34692 [PSH, ACK] Seq=391209607 Ack=21233977 Win=65535 Len=1448 [TCP segment of a reassembled PDU]"
1,3.2645119999997405,10.0.2.15,54.93.77.70,TCP,54,34692  >  9001 [ACK] Seq=21233977 Ack=391211055 Win=65535 Len=0
1,3.280360999999175,54.93.77.70,10.0.2.15,TLSv1.2,568,Application Data
1,3.312594999999419,54.93.77.70,10.0.2.15,TCP,2950,"9001  >  34692 [PSH, ACK] Seq=391211569 Ack=21233977 Win=65535 Len=2896 [TCP segment of a reassembled PDU]"
1,3.3127000000004045,10.0.2.15,54.93.77.70,TCP,54,34692  >  9001 [ACK] Seq=21233977 Ack=391214465 Win=65535 Len=0
1,3.3127480000002834,54.93.77.70,10.0.2.15,TLSv1.2,1502,Application Data [TCP segment of a reassembled PDU]
1,3.3128519999991113,10.0.2.15,54.93.77.70,TCP,54,34692  >  9001 [ACK] Seq=21233977 Ack=391215913 Win=65535 Len=0
1,3.313068999999814,10.0.2.15,54.93.77.70,TLSv1.2,590,Application Data
1,3.3131819999998697,54.93.77.70,10.0.2.15,TCP,60,9001  >  34692 [ACK] Seq=391215913 Ack=21234513 Win=65535 Len=0
1,3.3135220000003756,54.93.77.70,10.0.2.15,TLSv1.2,9994,"Application Data, Application Data"
1,3.3135810000003403,10.0.2.15,54.93.77.70,TCP,54,34692  >  9001 [ACK] Seq=21234513 Ack=391225853 Win=65535 Len=0
1,3.3136329999997542,54.93.77.70,10.0.2.15,TCP,1698,"9001  >  34692 [PSH, ACK] Seq=391225853 Ack=21234513 Win=65535 Len=1644 [TCP segment of a reassembled PDU]"
1,3.3137709999991785,10.0.2.15,54.93.77.70,TCP,54,34692  >  9001 [ACK] Seq=21234513 Ack=391227497 Win=65535 Len=0
1,3.313861000000543,54.93.77.70,10.0.2.15,TLSv1.2,684,"Application Data, Application Data"
1,3.3157530000007682,54.93.77.70,10.0.2.15,TCP,1502,"9001  >  34692 [PSH, ACK] Seq=391228127 Ack=21234513 Win=65535 Len=1448 [TCP segment of a reassembled PDU]"
1,3.315801000000647,10.0.2.15,54.93.77.70,TCP,54,34692  >  9001 [ACK] Seq=21234513 Ack=391229575 Win=65535 Len=0
1,3.3250000000007276,10.0.2.15,54.93.77.70,TLSv1.2,590,Application Data
1,3.325127000000066,54.93.77.70,10.0.2.15,TCP,60,9001  >  34692 [ACK] Seq=391229575 Ack=21235049 Win=65535 Len=0
1,3.325709000000643,54.93.77.70,10.0.2.15,TLSv1.2,4398,Application Data [TCP segment of a reassembled PDU]
1,3.32578199999989,10.0.2.15,54.93.77.70,TCP,54,34692  >  9001 [ACK] Seq=21235049 Ack=391233919 Win=65535 Len=0
1,3.327404999999999,54.93.77.70,10.0.2.15,TLSv1.2,4398,Application Data [TCP segment of a reassembled PDU]
1,3.3274490000003425,10.0.2.15,54.93.77.70,TCP,54,34692  >  9001 [ACK] Seq=21235049 Ack=391238263 Win=65535 Len=0
1,3.332155000000057,54.93.77.70,10.0.2.15,TLSv1.2,1314,"Application Data, Application Data"
1,3.346233000000211,62.210.85.178,10.0.2.15,TLSv1.2,590,Application Data
