No.,Time,Source,Destination,Protocol,Length,Info
1,0.03997199999867007,62.210.85.178,10.0.2.15,TLSv1.2,590,Application Data
1,0.08843999999953667,10.0.2.15,62.210.85.178,TCP,54,35978  >  9001 [ACK] Seq=396042069 Ack=21382985 Win=65535 Len=0
1,0.13351999999940745,10.0.2.15,54.93.77.70,TLSv1.2,590,Application Data
1,0.13371100000040315,54.93.77.70,10.0.2.15,TCP,60,9001  >  34692 [ACK] Seq=395741737 Ack=21475567 Win=65535 Len=0
1,0.5357860000003711,62.210.85.178,10.0.2.15,TLSv1.2,590,Application Data
1,0.5358610000002955,10.0.2.15,62.210.85.178,TCP,54,35978  >  9001 [ACK] Seq=396042069 Ack=21383521 Win=65535 Len=0
1,0.5363359999992099,10.0.2.15,62.210.85.178,TLSv1.2,590,Application Data
1,0.5364520000002813,62.210.85.178,10.0.2.15,TCP,60,9001  >  35978 [ACK] Seq=21383521 Ack=396042605 Win=65535 Len=0
1,0.6524549999994633,54.93.77.70,10.0.2.15,TLSv1.2,590,Application Data
1,0.6525299999993877,10.0.2.15,54.93.77.70,TCP,54,34692  >  9001 [ACK] Seq=21475567 Ack=395742273 Win=65535 Len=0
1,0.6529429999991407,10.0.2.15,54.93.77.70,TLSv1.2,1618,Application Data
1,0.6530499999989843,54.93.77.70,10.0.2.15,TCP,60,9001  >  34692 [ACK] Seq=395742273 Ack=21477027 Win=65535 Len=0
1,0.6530619999994087,54.93.77.70,10.0.2.15,TCP,60,9001  >  34692 [ACK] Seq=395742273 Ack=21477131 Win=65535 Len=0
1,0.8425250000000233,62.210.85.178,10.0.2.15,TLSv1.2,1618,Application Data
1,0.842650999999023,10.0.2.15,62.210.85.178,TCP,54,35978  >  9001 [ACK] Seq=396042605 Ack=21385085 Win=65535 Len=0
1,0.8560969999998633,10.0.2.15,62.210.85.178,TLSv1.2,590,Application Data
1,0.8562609999989945,62.210.85.178,10.0.2.15,TCP,60,9001  >  35978 [ACK] Seq=21385085 Ack=396043141 Win=65535 Len=0
1,0.8680659999990894,10.0.2.15,62.210.85.178,TLSv1.2,1618,Application Data
1,0.8681980000001204,62.210.85.178,10.0.2.15,TCP,60,9001  >  35978 [ACK] Seq=21385085 Ack=396044601 Win=65535 Len=0
1,0.8682169999992766,62.210.85.178,10.0.2.15,TCP,60,9001  >  35978 [ACK] Seq=21385085 Ack=396044705 Win=65535 Len=0
1,1.048479999999472,54.93.77.70,10.0.2.15,TLSv1.2,2132,Application Data
1,1.0486149999996996,10.0.2.15,54.93.77.70,TCP,54,34692  >  9001 [ACK] Seq=21477131 Ack=395744351 Win=65535 Len=0
1,1.0506470000000263,10.0.2.15,54.93.77.70,TLSv1.2,590,Application Data
1,1.0507959999995364,54.93.77.70,10.0.2.15,TCP,60,9001  >  34692 [ACK] Seq=395744351 Ack=21477667 Win=65535 Len=0
1,1.2523279999986698,62.210.85.178,10.0.2.15,TLSv1.2,590,Application Data
1,1.2526449999986653,10.0.2.15,62.210.85.178,TLSv1.2,590,Application Data
1,1.2527630000004137,62.210.85.178,10.0.2.15,TCP,60,9001  >  35978 [ACK] Seq=21385621 Ack=396045241 Win=65535 Len=0
1,1.4577529999987746,54.93.77.70,10.0.2.15,TLSv1.2,590,Application Data
1,1.458214999998745,10.0.2.15,54.93.77.70,TLSv1.2,590,Application Data
1,1.4583769999990182,54.93.77.70,10.0.2.15,TCP,60,9001  >  34692 [ACK] Seq=395744887 Ack=21478203 Win=65535 Len=0
1,1.6616009999997914,62.210.85.178,10.0.2.15,TLSv1.2,590,Application Data
1,1.6650279999994382,10.0.2.15,62.210.85.178,TLSv1.2,590,Application Data
1,1.6651939999992464,62.210.85.178,10.0.2.15,TCP,60,9001  >  35978 [ACK] Seq=21386157 Ack=396045777 Win=65535 Len=0
1,1.6759759999986272,10.0.2.15,62.210.85.178,TLSv1.2,4124,Application Data
1,1.6760679999988497,10.0.2.15,62.210.85.178,TCP,2974,35978  >  9001 [ACK] Seq=396049847 Ack=21386157 Win=65535 Len=2920 [TCP segment of a reassembled PDU]
1,1.6761069999993197,62.210.85.178,10.0.2.15,TCP,60,9001  >  35978 [ACK] Seq=21386157 Ack=396047237 Win=65535 Len=0
1,1.6761189999997441,62.210.85.178,10.0.2.15,TCP,60,9001  >  35978 [ACK] Seq=21386157 Ack=396048697 Win=65535 Len=0
1,1.6761239999996178,62.210.85.178,10.0.2.15,TCP,60,9001  >  35978 [ACK] Seq=21386157 Ack=396049847 Win=65535 Len=0
1,1.6761269999988144,62.210.85.178,10.0.2.15,TCP,60,9001  >  35978 [ACK] Seq=21386157 Ack=396051307 Win=65535 Len=0
1,1.6761289999994915,62.210.85.178,10.0.2.15,TCP,60,9001  >  35978 [ACK] Seq=21386157 Ack=396052767 Win=65535 Len=0
1,1.6761630000000878,10.0.2.15,62.210.85.178,TLSv1.2,1204,Application Data
1,1.676196999998865,62.210.85.178,10.0.2.15,TCP,60,9001  >  35978 [ACK] Seq=21386157 Ack=396053917 Win=65535 Len=0
1,1.676246999999421,10.0.2.15,62.210.85.178,TLSv1.2,4124,Application Data
1,1.6762820000003558,62.210.85.178,10.0.2.15,TCP,60,9001  >  35978 [ACK] Seq=21386157 Ack=396055377 Win=65535 Len=0
1,1.6762889999990875,62.210.85.178,10.0.2.15,TCP,60,9001  >  35978 [ACK] Seq=21386157 Ack=396056837 Win=65535 Len=0
1,1.6762929999986227,62.210.85.178,10.0.2.15,TCP,60,9001  >  35978 [ACK] Seq=21386157 Ack=396057987 Win=65535 Len=0
1,1.676328999999896,10.0.2.15,62.210.85.178,TLSv1.2,2324,Application Data
1,1.6763620000001538,62.210.85.178,10.0.2.15,TCP,60,9001  >  35978 [ACK] Seq=21386157 Ack=396059447 Win=65535 Len=0
1,1.6763689999988856,62.210.85.178,10.0.2.15,TCP,60,9001  >  35978 [ACK] Seq=21386157 Ack=396060257 Win=65535 Len=0
1,1.781710999999632,54.93.77.70,10.0.2.15,TCP,2950,"9001  >  34692 [PSH, ACK] Seq=395744887 Ack=21478203 Win=65535 Len=2896 [TCP segment of a reassembled PDU]"
1,1.7818439999991824,10.0.2.15,54.93.77.70,TCP,54,34692  >  9001 [ACK] Seq=21478203 Ack=395747783 Win=65535 Len=0
1,1.7821100000001024,54.93.77.70,10.0.2.15,TLSv1.2,778,Application Data
1,1.8098059999992984,54.93.77.70,10.0.2.15,TCP,2950,"9001  >  34692 [PSH, ACK] Seq=395748507 Ack=21478203 Win=65535 Len=2896 [TCP segment of a reassembled PDU]"
1,1.8098669999999402,10.0.2.15,54.93.77.70,TCP,54,34692  >  9001 [ACK] Seq=21478203 Ack=395751403 Win=65535 Len=0
1,1.810193999999683,54.93.77.70,10.0.2.15,TLSv1.2,778,Application Data
1,1.8514539999996487,10.0.2.15,54.93.77.70,TCP,54,34692  >  9001 [ACK] Seq=21478203 Ack=395752127 Win=65535 Len=0
1,1.8528179999993881,10.0.2.15,152.89.104.206,TLSv1.3,590,Application Data
1,1.8529230000003736,152.89.104.206,10.0.2.15,TCP,60,9001  >  47334 [ACK] Seq=39264 Ack=41151 Win=65535 Len=0
1,1.8681789999991452,54.93.77.70,10.0.2.15,TCP,2950,"9001  >  34692 [PSH, ACK] Seq=395752127 Ack=21478203 Win=65535 Len=2896 [TCP segment of a reassembled PDU]"
1,1.868228999999701,10.0.2.15,54.93.77.70,TCP,54,34692  >  9001 [ACK] Seq=21478203 Ack=395755023 Win=65535 Len=0
1,1.8682749999989028,54.93.77.70,10.0.2.15,TLSv1.2,778,Application Data
1,1.8683289999989938,10.0.2.15,54.93.77.70,TCP,54,34692  >  9001 [ACK] Seq=21478203 Ack=395755747 Win=65535 Len=0
1,1.943065999999817,54.93.77.70,10.0.2.15,TCP,2950,"9001  >  34692 [PSH, ACK] Seq=395755747 Ack=21478203 Win=65535 Len=2896 [TCP segment of a reassembled PDU]"
1,1.943156999999701,10.0.2.15,54.93.77.70,TCP,54,34692  >  9001 [ACK] Seq=21478203 Ack=395758643 Win=65535 Len=0
1,1.9434709999986808,54.93.77.70,10.0.2.15,TLSv1.2,778,Application Data
1,1.943515999999363,10.0.2.15,54.93.77.70,TCP,54,34692  >  9001 [ACK] Seq=21478203 Ack=395759367 Win=65535 Len=0
1,1.9439239999992424,10.0.2.15,54.93.77.70,TLSv1.2,590,Application Data
1,1.9440099999992526,54.93.77.70,10.0.2.15,TCP,60,9001  >  34692 [ACK] Seq=395759367 Ack=21478739 Win=65535 Len=0
1,1.9531589999987773,10.0.2.15,54.93.77.70,TLSv1.2,590,Application Data
1,1.9532909999998083,54.93.77.70,10.0.2.15,TCP,60,9001  >  34692 [ACK] Seq=395759367 Ack=21479275 Win=65535 Len=0
1,1.9648969999998371,54.93.77.70,10.0.2.15,TLSv1.2,590,Application Data
1,2.0075829999987036,10.0.2.15,54.93.77.70,TCP,54,34692  >  9001 [ACK] Seq=21479275 Ack=395759903 Win=65535 Len=0
1,2.1758780000000115,62.210.85.178,10.0.2.15,TLSv1.2,1104,Application Data
1,2.176166999999623,10.0.2.15,62.210.85.178,TLSv1.2,590,Application Data
1,2.1762829999988753,62.210.85.178,10.0.2.15,TCP,60,9001  >  35978 [ACK] Seq=21387207 Ack=396060793 Win=65535 Len=0
1,2.3793900000000576,54.93.77.70,10.0.2.15,TLSv1.2,590,Application Data
1,2.3794879999986733,10.0.2.15,54.93.77.70,TCP,54,34692  >  9001 [ACK] Seq=21479275 Ack=395760439 Win=65535 Len=0
1,2.3799199999994016,10.0.2.15,54.93.77.70,TLSv1.2,590,Application Data
1,2.3800439999995433,54.93.77.70,10.0.2.15,TCP,60,9001  >  34692 [ACK] Seq=395760439 Ack=21479811 Win=65535 Len=0
1,2.583264999999301,62.210.85.178,10.0.2.15,TLSv1.2,590,Application Data
1,2.587575999999899,10.0.2.15,62.210.85.178,TLSv1.2,590,Application Data
1,2.5877369999998336,62.210.85.178,10.0.2.15,TCP,60,9001  >  35978 [ACK] Seq=21387743 Ack=396061329 Win=65535 Len=0
1,2.600061999999525,10.0.2.15,62.210.85.178,TLSv1.2,4124,Application Data
1,2.6001559999986057,10.0.2.15,62.210.85.178,TCP,2974,35978  >  9001 [ACK] Seq=396065399 Ack=21387743 Win=65535 Len=2920 [TCP segment of a reassembled PDU]
1,2.6002019999996264,62.210.85.178,10.0.2.15,TCP,60,9001  >  35978 [ACK] Seq=21387743 Ack=396062789 Win=65535 Len=0
1,2.600214000000051,62.210.85.178,10.0.2.15,TCP,60,9001  >  35978 [ACK] Seq=21387743 Ack=396064249 Win=65535 Len=0
1,2.6002189999999246,62.210.85.178,10.0.2.15,TCP,60,9001  >  35978 [ACK] Seq=21387743 Ack=396065399 Win=65535 Len=0
1,2.600221999999121,62.210.85.178,10.0.2.15,TCP,60,9001  >  35978 [ACK] Seq=21387743 Ack=396066859 Win=65535 Len=0
1,2.600225000000137,62.210.85.178,10.0.2.15,TCP,60,9001  >  35978 [ACK] Seq=21387743 Ack=396068319 Win=65535 Len=0
1,2.6002580000003945,10.0.2.15,62.210.85.178,TLSv1.2,1204,Application Data
1,2.6002909999988333,62.210.85.178,10.0.2.15,TCP,60,9001  >  35978 [ACK] Seq=21387743 Ack=396069469 Win=65535 Len=0
1,2.6003359999995155,10.0.2.15,62.210.85.178,TLSv1.2,4124,Application Data
1,2.6003700000001118,62.210.85.178,10.0.2.15,TCP,60,9001  >  35978 [ACK] Seq=21387743 Ack=396070929 Win=65535 Len=0
1,2.600377999999182,62.210.85.178,10.0.2.15,TCP,60,9001  >  35978 [ACK] Seq=21387743 Ack=396072389 Win=65535 Len=0
1,2.600381999998717,62.210.85.178,10.0.2.15,TCP,60,9001  >  35978 [ACK] Seq=21387743 Ack=396073539 Win=65535 Len=0
1,2.6004199999988487,10.0.2.15,62.210.85.178,TLSv1.2,4124,Application Data
1,2.600453999999445,62.210.85.178,10.0.2.15,TCP,60,9001  >  35978 [ACK] Seq=21387743 Ack=396074999 Win=65535 Len=0
1,2.6004609999999957,62.210.85.178,10.0.2.15,TCP,60,9001  >  35978 [ACK] Seq=21387743 Ack=396076459 Win=65535 Len=0
1,2.600513999999748,10.0.2.15,62.210.85.178,TLSv1.2,2974,Application Data
1,2.600550999999541,62.210.85.178,10.0.2.15,TCP,60,9001  >  35978 [ACK] Seq=21387743 Ack=396077609 Win=65535 Len=0
1,2.6005569999997533,62.210.85.178,10.0.2.15,TCP,60,9001  >  35978 [ACK] Seq=21387743 Ack=396079069 Win=65535 Len=0
1,2.6005609999992885,62.210.85.178,10.0.2.15,TCP,60,9001  >  35978 [ACK] Seq=21387743 Ack=396080529 Win=65535 Len=0
1,2.6005929999992077,10.0.2.15,62.210.85.178,TLSv1.2,1226,Application Data
1,2.600628999998662,62.210.85.178,10.0.2.15,TCP,60,9001  >  35978 [ACK] Seq=21387743 Ack=396081701 Win=65535 Len=0
1,2.6006710000001476,10.0.2.15,62.210.85.178,TLSv1.2,4124,Application Data
1,2.600710999999137,62.210.85.178,10.0.2.15,TCP,60,9001  >  35978 [ACK] Seq=21387743 Ack=396083161 Win=65535 Len=0
1,2.6007190000000264,62.210.85.178,10.0.2.15,TCP,60,9001  >  35978 [ACK] Seq=21387743 Ack=396084621 Win=65535 Len=0
1,2.6007229999995616,62.210.85.178,10.0.2.15,TCP,60,9001  >  35978 [ACK] Seq=21387743 Ack=396085771 Win=65535 Len=0
1,2.600760999999693,10.0.2.15,62.210.85.178,TLSv1.2,3030,Application Data
1,2.600800000000163,62.210.85.178,10.0.2.15,TCP,60,9001  >  35978 [ACK] Seq=21387743 Ack=396087231 Win=65535 Len=0
1,2.6008079999992333,62.210.85.178,10.0.2.15,TCP,60,9001  >  35978 [ACK] Seq=21387743 Ack=396088691 Win=65535 Len=0
1,2.600811000000249,62.210.85.178,10.0.2.15,TCP,60,9001  >  35978 [ACK] Seq=21387743 Ack=396088747 Win=65535 Len=0
1,2.6100040000001172,10.0.2.15,62.210.85.178,TLSv1.2,4124,Application Data
1,2.6100569999998697,62.210.85.178,10.0.2.15,TCP,60,9001  >  35978 [ACK] Seq=21387743 Ack=396090207 Win=65535 Len=0
1,2.6100679999999556,62.210.85.178,10.0.2.15,TCP,60,9001  >  35978 [ACK] Seq=21387743 Ack=396091667 Win=65535 Len=0
1,2.610071999999491,62.210.85.178,10.0.2.15,TCP,60,9001  >  35978 [ACK] Seq=21387743 Ack=396092817 Win=65535 Len=0
1,2.610117000000173,10.0.2.15,62.210.85.178,TLSv1.2,4124,Application Data
1,2.6101569999991625,62.210.85.178,10.0.2.15,TCP,60,9001  >  35978 [ACK] Seq=21387743 Ack=396094277 Win=65535 Len=0
1,2.6101660000003903,62.210.85.178,10.0.2.15,TCP,60,9001  >  35978 [ACK] Seq=21387743 Ack=396095737 Win=65535 Len=0
1,2.610171000000264,62.210.85.178,10.0.2.15,TCP,60,9001  >  35978 [ACK] Seq=21387743 Ack=396096887 Win=65535 Len=0
1,2.6102090000003955,10.0.2.15,62.210.85.178,TLSv1.2,204,Application Data
1,2.610246999998708,62.210.85.178,10.0.2.15,TCP,60,9001  >  35978 [ACK] Seq=21387743 Ack=396097037 Win=65535 Len=0
1,2.790689999999813,54.93.77.70,10.0.2.15,TCP,2950,"9001  >  34692 [PSH, ACK] Seq=395760439 Ack=21479811 Win=65535 Len=2896 [TCP segment of a reassembled PDU]"
1,2.790813999999955,10.0.2.15,54.93.77.70,TCP,54,34692  >  9001 [ACK] Seq=21479811 Ack=395763335 Win=65535 Len=0
1,2.7966939999987517,54.93.77.70,10.0.2.15,TLSv1.2,778,Application Data
1,2.7973110000002634,54.93.77.70,10.0.2.15,TLSv1.2,7294,"Application Data, Application Data"
1,2.7974299999987124,10.0.2.15,54.93.77.70,TCP,54,34692  >  9001 [ACK] Seq=21479811 Ack=395771299 Win=65535 Len=0
1,2.8003520000002027,54.93.77.70,10.0.2.15,TLSv1.2,2950,Application Data [TCP segment of a reassembled PDU]
1,2.800420999999915,10.0.2.15,54.93.77.70,TCP,54,34692  >  9001 [ACK] Seq=21479811 Ack=395774195 Win=65535 Len=0
1,2.817429999999149,54.93.77.70,10.0.2.15,TLSv1.2,8040,"Application Data, Application Data, Application Data"
1,2.8175199999986944,10.0.2.15,54.93.77.70,TCP,54,34692  >  9001 [ACK] Seq=21479811 Ack=395782181 Win=65535 Len=0
1,2.8176929999990534,10.0.2.15,54.93.77.70,TLSv1.2,590,Application Data
1,2.817766999998639,54.93.77.70,10.0.2.15,TCP,60,9001  >  34692 [ACK] Seq=395782181 Ack=21480347 Win=65535 Len=0
1,2.8285290000003442,54.93.77.70,10.0.2.15,TCP,1502,"9001  >  34692 [PSH, ACK] Seq=395782181 Ack=21480347 Win=65535 Len=1448 [TCP segment of a reassembled PDU]"
1,2.8286150000003545,10.0.2.15,54.93.77.70,TCP,54,34692  >  9001 [ACK] Seq=21480347 Ack=395783629 Win=65535 Len=0
1,2.8352990000003047,54.93.77.70,10.0.2.15,TLSv1.2,1198,Application Data
1,2.847381999999925,54.93.77.70,10.0.2.15,TCP,1502,"9001  >  34692 [PSH, ACK] Seq=395784773 Ack=21480347 Win=65535 Len=1448 [TCP segment of a reassembled PDU]"
1,2.8474439999990864,10.0.2.15,54.93.77.70,TCP,54,34692  >  9001 [ACK] Seq=21480347 Ack=395786221 Win=65535 Len=0
1,2.852307999999539,54.93.77.70,10.0.2.15,TLSv1.2,170,Application Data
1,2.852444000000105,10.0.2.15,54.93.77.70,TLSv1.2,590,Application Data
1,2.852614999999787,54.93.77.70,10.0.2.15,TCP,60,9001  >  34692 [ACK] Seq=395786337 Ack=21480883 Win=65535 Len=0
1,2.8557380000002013,54.93.77.70,10.0.2.15,TLSv1.2,5846,Application Data
1,2.8557999999993626,10.0.2.15,54.93.77.70,TCP,54,34692  >  9001 [ACK] Seq=21480883 Ack=395792129 Win=65535 Len=0
1,2.856791999998677,54.93.77.70,10.0.2.15,TCP,1502,"9001  >  34692 [PSH, ACK] Seq=395792129 Ack=21480883 Win=65535 Len=1448 [TCP segment of a reassembled PDU]"
1,2.856830999999147,10.0.2.15,54.93.77.70,TCP,54,34692  >  9001 [ACK] Seq=21480883 Ack=395793577 Win=65535 Len=0
1,2.8685589999986405,54.93.77.70,10.0.2.15,TLSv1.2,568,Application Data
1,2.883922999999413,54.93.77.70,10.0.2.15,TCP,1502,"9001  >  34692 [PSH, ACK] Seq=395794091 Ack=21480883 Win=65535 Len=1448 [TCP segment of a reassembled PDU]"
1,2.8839699999989534,10.0.2.15,54.93.77.70,TCP,54,34692  >  9001 [ACK] Seq=21480883 Ack=395795539 Win=65535 Len=0
1,2.884909999998854,54.93.77.70,10.0.2.15,TLSv1.2,1198,Application Data
1,2.88720899999862,10.0.2.15,54.93.77.70,TLSv1.2,590,Application Data
1,2.8873640000001615,54.93.77.70,10.0.2.15,TCP,60,9001  >  34692 [ACK] Seq=395796683 Ack=21481419 Win=65535 Len=0
1,2.929121999999552,62.210.85.178,10.0.2.15,TLSv1.2,590,Application Data
1,2.9714160000003176,10.0.2.15,62.210.85.178,TCP,54,35978  >  9001 [ACK] Seq=396097037 Ack=21388279 Win=65535 Len=0
1,2.988006999999925,62.210.85.178,10.0.2.15,TLSv1.2,590,Application Data
1,2.9880670000002283,10.0.2.15,62.210.85.178,TCP,54,35978  >  9001 [ACK] Seq=396097037 Ack=21388815 Win=65535 Len=0
1,3.055146999999124,62.210.85.178,10.0.2.15,TLSv1.2,590,Application Data
1,3.055237999999008,10.0.2.15,62.210.85.178,TCP,54,35978  >  9001 [ACK] Seq=396097037 Ack=21389351 Win=65535 Len=0
1,3.0557300000000396,10.0.2.15,62.210.85.178,TLSv1.2,590,Application Data
1,3.0559439999997267,62.210.85.178,10.0.2.15,TCP,60,9001  >  35978 [ACK] Seq=21389351 Ack=396097573 Win=65535 Len=0
1,3.155794000000242,54.93.77.70,10.0.2.15,TLSv1.2,590,Application Data
1,3.1561709999987215,10.0.2.15,54.93.77.70,TLSv1.2,590,Application Data
1,3.156278000000384,54.93.77.70,10.0.2.15,TCP,60,9001  >  34692 [ACK] Seq=395797219 Ack=21481955 Win=65535 Len=0
1,3.6080050000000483,62.210.85.178,10.0.2.15,TLSv1.2,590,Application Data
1,3.612976999998864,10.0.2.15,62.210.85.178,TLSv1.2,590,Application Data
1,3.6131489999988844,62.210.85.178,10.0.2.15,TCP,60,9001  >  35978 [ACK] Seq=21389887 Ack=396098109 Win=65535 Len=0
1,3.6235729999989417,10.0.2.15,62.210.85.178,TLSv1.2,4124,Application Data
1,3.6237569999993866,62.210.85.178,10.0.2.15,TCP,60,9001  >  35978 [ACK] Seq=21389887 Ack=396099569 Win=65535 Len=0
1,3.6237789999995584,62.210.85.178,10.0.2.15,TCP,60,9001  >  35978 [ACK] Seq=21389887 Ack=396101029 Win=65535 Len=0
1,3.6237849999997707,62.210.85.178,10.0.2.15,TCP,60,9001  >  35978 [ACK] Seq=21389887 Ack=396102179 Win=65535 Len=0
1,3.6238679999987653,10.0.2.15,62.210.85.178,TCP,2974,35978  >  9001 [ACK] Seq=396102179 Ack=21389887 Win=65535 Len=2920 [TCP segment of a reassembled PDU]
1,3.623969999998735,10.0.2.15,62.210.85.178,TLSv1.2,1204,Application Data
1,3.624033000000054,62.210.85.178,10.0.2.15,TCP,60,9001  >  35978 [ACK] Seq=21389887 Ack=396103639 Win=65535 Len=0
1,3.6240490000000136,62.210.85.178,10.0.2.15,TCP,60,9001  >  35978 [ACK] Seq=21389887 Ack=396105099 Win=65535 Len=0
1,3.6240519999992102,62.210.85.178,10.0.2.15,TCP,60,9001  >  35978 [ACK] Seq=21389887 Ack=396106249 Win=65535 Len=0
1,3.6241529999988416,10.0.2.15,62.210.85.178,TLSv1.2,4124,Application Data
1,3.6243329999997513,62.210.85.178,10.0.2.15,TCP,60,9001  >  35978 [ACK] Seq=21389887 Ack=396107709 Win=65535 Len=0
1,3.624363999999332,62.210.85.178,10.0.2.15,TCP,60,9001  >  35978 [ACK] Seq=21389887 Ack=396109169 Win=65535 Len=0
1,3.6243689999992057,62.210.85.178,10.0.2.15,TCP,60,9001  >  35978 [ACK] Seq=21389887 Ack=396110319 Win=65535 Len=0
1,3.624454999999216,10.0.2.15,62.210.85.178,TLSv1.2,4124,Application Data
1,3.624587000000247,62.210.85.178,10.0.2.15,TCP,60,9001  >  35978 [ACK] Seq=21389887 Ack=396111779 Win=65535 Len=0
1,3.624603999998726,62.210.85.178,10.0.2.15,TCP,60,9001  >  35978 [ACK] Seq=21389887 Ack=396113239 Win=65535 Len=0
1,3.6246069999997417,62.210.85.178,10.0.2.15,TCP,60,9001  >  35978 [ACK] Seq=21389887 Ack=396114389 Win=65535 Len=0
1,3.6246589999991556,10.0.2.15,62.210.85.178,TLSv1.2,332,Application Data
1,3.6247000000003027,62.210.85.178,10.0.2.15,TCP,60,9001  >  35978 [ACK] Seq=21389887 Ack=396114667 Win=65535 Len=0
1,3.6248079999986658,10.0.2.15,62.210.85.178,TLSv1.2,3868,Application Data
1,3.624889999999141,62.210.85.178,10.0.2.15,TCP,60,9001  >  35978 [ACK] Seq=21389887 Ack=396116127 Win=65535 Len=0
1,3.6249019999995653,62.210.85.178,10.0.2.15,TCP,60,9001  >  35978 [ACK] Seq=21389887 Ack=396117587 Win=65535 Len=0
1,3.624904999998762,62.210.85.178,10.0.2.15,TCP,60,9001  >  35978 [ACK] Seq=21389887 Ack=396118481 Win=65535 Len=0
1,3.624952000000121,10.0.2.15,62.210.85.178,TLSv1.2,4124,Application Data
1,3.6250600000003033,62.210.85.178,10.0.2.15,TCP,60,9001  >  35978 [ACK] Seq=21389887 Ack=396119941 Win=65535 Len=0
1,3.6250700000000506,62.210.85.178,10.0.2.15,TCP,60,9001  >  35978 [ACK] Seq=21389887 Ack=396121401 Win=65535 Len=0
1,3.625073999999586,62.210.85.178,10.0.2.15,TCP,60,9001  >  35978 [ACK] Seq=21389887 Ack=396122551 Win=65535 Len=0
1,3.62510999999904,10.0.2.15,62.210.85.178,TLSv1.2,3030,Application Data
1,3.6251890000003186,62.210.85.178,10.0.2.15,TCP,60,9001  >  35978 [ACK] Seq=21389887 Ack=396124011 Win=65535 Len=0
1,3.625202999999601,62.210.85.178,10.0.2.15,TCP,60,9001  >  35978 [ACK] Seq=21389887 Ack=396125471 Win=65535 Len=0
1,3.625207999999475,62.210.85.178,10.0.2.15,TCP,60,9001  >  35978 [ACK] Seq=21389887 Ack=396125527 Win=65535 Len=0
1,3.634571999999025,10.0.2.15,62.210.85.178,TLSv1.2,4124,Application Data
1,3.6346899999989546,62.210.85.178,10.0.2.15,TCP,60,9001  >  35978 [ACK] Seq=21389887 Ack=396126987 Win=65535 Len=0
1,3.6347050000003946,62.210.85.178,10.0.2.15,TCP,60,9001  >  35978 [ACK] Seq=21389887 Ack=396128447 Win=65535 Len=0
1,3.63470899999993,62.210.85.178,10.0.2.15,TCP,60,9001  >  35978 [ACK] Seq=21389887 Ack=396129597 Win=65535 Len=0
1,3.6347530000002735,10.0.2.15,62.210.85.178,TLSv1.2,4124,Application Data
1,3.63481899999897,62.210.85.178,10.0.2.15,TCP,60,9001  >  35978 [ACK] Seq=21389887 Ack=396131057 Win=65535 Len=0
1,3.6348259999995207,62.210.85.178,10.0.2.15,TCP,60,9001  >  35978 [ACK] Seq=21389887 Ack=396132517 Win=65535 Len=0
1,3.6348309999993944,62.210.85.178,10.0.2.15,TCP,60,9001  >  35978 [ACK] Seq=21389887 Ack=396133667 Win=65535 Len=0
1,3.6348679999991873,10.0.2.15,62.210.85.178,TLSv1.2,4124,Application Data
1,3.634907999999996,62.210.85.178,10.0.2.15,TCP,60,9001  >  35978 [ACK] Seq=21389887 Ack=396135127 Win=65535 Len=0
1,3.6349149999987276,62.210.85.178,10.0.2.15,TCP,60,9001  >  35978 [ACK] Seq=21389887 Ack=396136587 Win=65535 Len=0
1,3.6349190000000817,62.210.85.178,10.0.2.15,TCP,60,9001  >  35978 [ACK] Seq=21389887 Ack=396137737 Win=65535 Len=0
1,3.634954999999536,10.0.2.15,62.210.85.178,TLSv1.2,4124,Application Data
1,3.634987999999794,62.210.85.178,10.0.2.15,TCP,60,9001  >  35978 [ACK] Seq=21389887 Ack=396139197 Win=65535 Len=0
1,3.634995999998864,62.210.85.178,10.0.2.15,TCP,60,9001  >  35978 [ACK] Seq=21389887 Ack=396140657 Win=65535 Len=0
1,3.6350000000002183,62.210.85.178,10.0.2.15,TCP,60,9001  >  35978 [ACK] Seq=21389887 Ack=396141807 Win=65535 Len=0
1,3.6350339999989956,10.0.2.15,62.210.85.178,TLSv1.2,332,Application Data
1,3.635067999999592,62.210.85.178,10.0.2.15,TCP,60,9001  >  35978 [ACK] Seq=21389887 Ack=396142085 Win=65535 Len=0
1,3.635121999999683,10.0.2.15,62.210.85.178,TLSv1.2,3868,Application Data
1,3.6351579999991372,62.210.85.178,10.0.2.15,TCP,60,9001  >  35978 [ACK] Seq=21389887 Ack=396143545 Win=65535 Len=0
1,3.635164999999688,62.210.85.178,10.0.2.15,TCP,60,9001  >  35978 [ACK] Seq=21389887 Ack=396145005 Win=65535 Len=0
1,3.6351699999995617,62.210.85.178,10.0.2.15,TCP,60,9001  >  35978 [ACK] Seq=21389887 Ack=396145899 Win=65535 Len=0
1,3.6352069999993546,10.0.2.15,62.210.85.178,TLSv1.2,4124,Application Data
1,3.6352420000002894,62.210.85.178,10.0.2.15,TCP,60,9001  >  35978 [ACK] Seq=21389887 Ack=396147359 Win=65535 Len=0
1,3.6352479999986826,62.210.85.178,10.0.2.15,TCP,60,9001  >  35978 [ACK] Seq=21389887 Ack=396148819 Win=65535 Len=0
1,3.6352509999996983,62.210.85.178,10.0.2.15,TCP,60,9001  >  35978 [ACK] Seq=21389887 Ack=396149969 Win=65535 Len=0
1,3.6352850000002945,10.0.2.15,62.210.85.178,TLSv1.2,2002,Application Data
1,3.635326999999961,62.210.85.178,10.0.2.15,TCP,60,9001  >  35978 [ACK] Seq=21389887 Ack=396151429 Win=65535 Len=0
1,3.6353330000001733,62.210.85.178,10.0.2.15,TCP,60,9001  >  35978 [ACK] Seq=21389887 Ack=396151917 Win=65535 Len=0
1,3.710229000000254,54.93.77.70,10.0.2.15,TCP,2950,"9001  >  34692 [PSH, ACK] Seq=395797219 Ack=21481955 Win=65535 Len=2896 [TCP segment of a reassembled PDU]"
1,3.7103139999999257,54.93.77.70,10.0.2.15,TLSv1.2,778,Application Data
1,3.710397999999259,10.0.2.15,54.93.77.70,TCP,54,34692  >  9001 [ACK] Seq=21481955 Ack=395800839 Win=65535 Len=0
1,3.7503539999997884,54.93.77.70,10.0.2.15,TCP,2950,"9001  >  34692 [PSH, ACK] Seq=395800839 Ack=21481955 Win=65535 Len=2896 [TCP segment of a reassembled PDU]"
1,3.7504209999988234,10.0.2.15,54.93.77.70,TCP,54,34692  >  9001 [ACK] Seq=21481955 Ack=395803735 Win=65535 Len=0
1,3.76095499999974,54.93.77.70,10.0.2.15,TLSv1.2,2950,"Application Data, Application Data"
1,3.760975999999573,54.93.77.70,10.0.2.15,TLSv1.2,5846,Application Data [TCP segment of a reassembled PDU]
1,3.7610119999990275,10.0.2.15,54.93.77.70,TCP,54,34692  >  9001 [ACK] Seq=21481955 Ack=395806631 Win=65535 Len=0
1,3.76108000000022,10.0.2.15,54.93.77.70,TCP,54,34692  >  9001 [ACK] Seq=21481955 Ack=395812423 Win=65535 Len=0
1,3.7662729999992735,54.93.77.70,10.0.2.15,TLSv1.2,380,Application Data
1,3.7907930000001215,54.93.77.70,10.0.2.15,TLSv1.2,5846,"Application Data, Application Data"
1,3.790849999999409,10.0.2.15,54.93.77.70,TCP,54,34692  >  9001 [ACK] Seq=21481955 Ack=395818541 Win=65535 Len=0
1,3.7916969999987487,54.93.77.70,10.0.2.15,TLSv1.2,4398,Application Data [TCP segment of a reassembled PDU]
1,3.791745999998966,10.0.2.15,54.93.77.70,TCP,54,34692  >  9001 [ACK] Seq=21481955 Ack=395822885 Win=65535 Len=0
1,3.810310999999274,54.93.77.70,10.0.2.15,TLSv1.2,2950,Application Data [TCP segment of a reassembled PDU]
1,3.810335000000123,54.93.77.70,10.0.2.15,TLSv1.2,9300,"Application Data, Application Data, Application Data, Application Data"
1,3.810389000000214,10.0.2.15,54.93.77.70,TCP,54,34692  >  9001 [ACK] Seq=21481955 Ack=395825781 Win=65535 Len=0
1,3.810475000000224,10.0.2.15,54.93.77.70,TCP,54,34692  >  9001 [ACK] Seq=21481955 Ack=395835027 Win=65535 Len=0
1,3.8106410000000324,10.0.2.15,54.93.77.70,TLSv1.2,590,Application Data
1,3.810747999999876,54.93.77.70,10.0.2.15,TCP,60,9001  >  34692 [ACK] Seq=395835027 Ack=21482491 Win=65535 Len=0
1,3.8202369999999064,10.0.2.15,54.93.77.70,TLSv1.2,590,Application Data
1,3.820410999998785,54.93.77.70,10.0.2.15,TCP,60,9001  >  34692 [ACK] Seq=395835027 Ack=21483027 Win=65535 Len=0
1,3.822016000000076,54.93.77.70,10.0.2.15,TLSv1.2,5846,Application Data
1,3.822095999999874,10.0.2.15,54.93.77.70,TCP,54,34692  >  9001 [ACK] Seq=21483027 Ack=395840819 Win=65535 Len=0
1,3.8274060000003374,54.93.77.70,10.0.2.15,TLSv1.2,988,Application Data
1,3.844785999999658,54.93.77.70,10.0.2.15,TCP,2950,"9001  >  34692 [PSH, ACK] Seq=395841753 Ack=21483027 Win=65535 Len=2896 [TCP segment of a reassembled PDU]"
1,3.8448369999987335,10.0.2.15,54.93.77.70,TCP,54,34692  >  9001 [ACK] Seq=21483027 Ack=395844649 Win=65535 Len=0
1,3.8616189999993367,54.93.77.70,10.0.2.15,TLSv1.2,778,Application Data
1,3.90166599999975,62.210.85.178,10.0.2.15,TLSv1.2,590,Application Data
1,3.9033909999998286,10.0.2.15,54.93.77.70,TCP,54,34692  >  9001 [ACK] Seq=21483027 Ack=395845373 Win=65535 Len=0
1,3.935136000000057,54.93.77.70,10.0.2.15,TLSv1.2,2646,Application Data
1,3.935191999999006,10.0.2.15,54.93.77.70,TCP,54,34692  >  9001 [ACK] Seq=21483027 Ack=395847965 Win=65535 Len=0
1,3.941079999998692,62.210.85.178,10.0.2.15,TLSv1.2,590,Application Data
1,3.941125999999713,10.0.2.15,62.210.85.178,TCP,54,35978  >  9001 [ACK] Seq=396151917 Ack=21390959 Win=65535 Len=0
1,3.9524099999998725,54.93.77.70,10.0.2.15,TLSv1.2,590,Application Data
1,3.9524509999992006,10.0.2.15,54.93.77.70,TCP,54,34692  >  9001 [ACK] Seq=21483027 Ack=395848501 Win=65535 Len=0
1,4.2230839999992895,54.93.77.70,10.0.2.15,TCP,2950,"9001  >  34692 [PSH, ACK] Seq=395848501 Ack=21483027 Win=65535 Len=2896 [TCP segment of a reassembled PDU]"
1,4.223173999998835,10.0.2.15,54.93.77.70,TCP,54,34692  >  9001 [ACK] Seq=21483027 Ack=395851397 Win=65535 Len=0
1,4.2296449999994365,54.93.77.70,10.0.2.15,TLSv1.2,264,Application Data
1,4.229701000000205,10.0.2.15,54.93.77.70,TCP,54,34692  >  9001 [ACK] Seq=21483027 Ack=395851607 Win=65535 Len=0
1,4.229977999999392,10.0.2.15,54.93.77.70,TLSv1.2,590,Application Data
1,4.23009699999966,54.93.77.70,10.0.2.15,TCP,60,9001  >  34692 [ACK] Seq=395851607 Ack=21483563 Win=65535 Len=0
1,4.239440999999715,10.0.2.15,54.93.77.70,TLSv1.2,590,Application Data
1,4.239617999999609,54.93.77.70,10.0.2.15,TCP,60,9001  >  34692 [ACK] Seq=395851607 Ack=21484099 Win=65535 Len=0
1,4.5300850000003265,62.210.85.178,10.0.2.15,TLSv1.2,1104,Application Data
1,4.530592999999499,10.0.2.15,62.210.85.178,TLSv1.2,590,Application Data
1,4.53071699999964,62.210.85.178,10.0.2.15,TCP,60,9001  >  35978 [ACK] Seq=21392009 Ack=396152453 Win=65535 Len=0
1,4.660787999999229,54.93.77.70,10.0.2.15,TLSv1.2,590,Application Data
1,4.661190999999235,10.0.2.15,54.93.77.70,TLSv1.2,590,Application Data
1,4.661290000000008,54.93.77.70,10.0.2.15,TCP,60,9001  >  34692 [ACK] Seq=395852143 Ack=21484635 Win=65535 Len=0
1,4.7812749999993684,62.210.85.178,10.0.2.15,TLSv1.2,590,Application Data
1,4.789447999999538,10.0.2.15,62.210.85.178,TLSv1.2,590,Application Data
1,4.789638999998715,62.210.85.178,10.0.2.15,TCP,60,9001  >  35978 [ACK] Seq=21392545 Ack=396152989 Win=65535 Len=0
1,4.799968999999692,10.0.2.15,62.210.85.178,TLSv1.2,4124,Application Data
1,4.8000819999997475,10.0.2.15,62.210.85.178,TCP,2974,35978  >  9001 [ACK] Seq=396157059 Ack=21392545 Win=65535 Len=2920 [TCP segment of a reassembled PDU]
1,4.800124999999753,62.210.85.178,10.0.2.15,TCP,60,9001  >  35978 [ACK] Seq=21392545 Ack=396154449 Win=65535 Len=0
1,4.8001359999998385,62.210.85.178,10.0.2.15,TCP,60,9001  >  35978 [ACK] Seq=21392545 Ack=396155909 Win=65535 Len=0
1,4.800139999999374,62.210.85.178,10.0.2.15,TCP,60,9001  >  35978 [ACK] Seq=21392545 Ack=396157059 Win=65535 Len=0
1,4.800144999999247,62.210.85.178,10.0.2.15,TCP,60,9001  >  35978 [ACK] Seq=21392545 Ack=396158519 Win=65535 Len=0
1,4.8001489999987825,62.210.85.178,10.0.2.15,TCP,60,9001  >  35978 [ACK] Seq=21392545 Ack=396159979 Win=65535 Len=0
1,4.800199999999677,10.0.2.15,62.210.85.178,TLSv1.2,1204,Application Data
1,4.800268999999389,10.0.2.15,62.210.85.178,TCP,2974,35978  >  9001 [ACK] Seq=396161129 Ack=21392545 Win=65535 Len=2920 [TCP segment of a reassembled PDU]
1,4.800307999999859,62.210.85.178,10.0.2.15,TCP,60,9001  >  35978 [ACK] Seq=21392545 Ack=396161129 Win=65535 Len=0
1,4.80031500000041,62.210.85.178,10.0.2.15,TCP,60,9001  >  35978 [ACK] Seq=21392545 Ack=396162589 Win=65535 Len=0
1,4.800318999999945,62.210.85.178,10.0.2.15,TCP,60,9001  >  35978 [ACK] Seq=21392545 Ack=396164049 Win=65535 Len=0
1,4.800407999999152,10.0.2.15,62.210.85.178,TLSv1.2,1204,Application Data
1,4.800473999999667,10.0.2.15,62.210.85.178,TCP,2974,35978  >  9001 [ACK] Seq=396165199 Ack=21392545 Win=65535 Len=2920 [TCP segment of a reassembled PDU]
1,4.800535999998829,62.210.85.178,10.0.2.15,TCP,60,9001  >  35978 [ACK] Seq=21392545 Ack=396165199 Win=65535 Len=0
1,4.8005469999989145,62.210.85.178,10.0.2.15,TCP,60,9001  >  35978 [ACK] Seq=21392545 Ack=396166659 Win=65535 Len=0
1,4.800551999998788,62.210.85.178,10.0.2.15,TCP,60,9001  >  35978 [ACK] Seq=21392545 Ack=396168119 Win=65535 Len=0
1,4.8005890000004,10.0.2.15,62.210.85.178,TLSv1.2,1204,Application Data
1,4.800697999999102,10.0.2.15,62.210.85.178,TLSv1.2,2974,Application Data
1,4.800723999998809,62.210.85.178,10.0.2.15,TCP,60,9001  >  35978 [ACK] Seq=21392545 Ack=396169269 Win=65535 Len=0
1,4.8007569999990665,10.0.2.15,62.210.85.178,TLSv1.2,1226,Application Data
1,4.80079300000034,62.210.85.178,10.0.2.15,TCP,60,9001  >  35978 [ACK] Seq=21392545 Ack=396170729 Win=65535 Len=0
1,4.800798999998733,62.210.85.178,10.0.2.15,TCP,60,9001  >  35978 [ACK] Seq=21392545 Ack=396172189 Win=65535 Len=0
1,4.800803999998607,62.210.85.178,10.0.2.15,TCP,60,9001  >  35978 [ACK] Seq=21392545 Ack=396173361 Win=65535 Len=0
1,4.800848999999289,10.0.2.15,62.210.85.178,TLSv1.2,4124,Application Data
1,4.800912999999127,10.0.2.15,62.210.85.178,TCP,2974,35978  >  9001 [ACK] Seq=396177431 Ack=21392545 Win=65535 Len=2920 [TCP segment of a reassembled PDU]
1,4.800949000000401,62.210.85.178,10.0.2.15,TCP,60,9001  >  35978 [ACK] Seq=21392545 Ack=396174821 Win=65535 Len=0
1,4.8009559999991325,62.210.85.178,10.0.2.15,TCP,60,9001  >  35978 [ACK] Seq=21392545 Ack=396176281 Win=65535 Len=0
1,4.800959999998668,62.210.85.178,10.0.2.15,TCP,60,9001  >  35978 [ACK] Seq=21392545 Ack=396177431 Win=65535 Len=0
1,4.800964000000022,62.210.85.178,10.0.2.15,TCP,60,9001  >  35978 [ACK] Seq=21392545 Ack=396178891 Win=65535 Len=0
1,4.8009689999998955,62.210.85.178,10.0.2.15,TCP,60,9001  >  35978 [ACK] Seq=21392545 Ack=396180351 Win=65535 Len=0
1,4.801005999999688,10.0.2.15,62.210.85.178,TLSv1.2,110,Application Data
1,4.80109099999936,62.210.85.178,10.0.2.15,TCP,60,9001  >  35978 [ACK] Seq=21392545 Ack=396180407 Win=65535 Len=0
1,4.810206999998627,10.0.2.15,62.210.85.178,TLSv1.2,4124,Application Data
1,4.8102859999999055,10.0.2.15,62.210.85.178,TCP,2974,35978  >  9001 [ACK] Seq=396184477 Ack=21392545 Win=65535 Len=2920 [TCP segment of a reassembled PDU]
1,4.810325000000375,62.210.85.178,10.0.2.15,TCP,60,9001  >  35978 [ACK] Seq=21392545 Ack=396181867 Win=65535 Len=0
1,4.810332999999446,62.210.85.178,10.0.2.15,TCP,60,9001  >  35978 [ACK] Seq=21392545 Ack=396183327 Win=65535 Len=0
1,4.810336999998981,62.210.85.178,10.0.2.15,TCP,60,9001  >  35978 [ACK] Seq=21392545 Ack=396184477 Win=65535 Len=0
1,4.810341999998855,62.210.85.178,10.0.2.15,TCP,60,9001  >  35978 [ACK] Seq=21392545 Ack=396185937 Win=65535 Len=0
1,4.810346000000209,62.210.85.178,10.0.2.15,TCP,60,9001  >  35978 [ACK] Seq=21392545 Ack=396187397 Win=65535 Len=0
1,4.810389000000214,10.0.2.15,62.210.85.178,TLSv1.2,1204,Application Data
1,4.810455999999249,10.0.2.15,62.210.85.178,TCP,2974,35978  >  9001 [ACK] Seq=396188547 Ack=21392545 Win=65535 Len=2920 [TCP segment of a reassembled PDU]
1,4.810491000000184,62.210.85.178,10.0.2.15,TCP,60,9001  >  35978 [ACK] Seq=21392545 Ack=396188547 Win=65535 Len=0
1,4.8104979999989155,62.210.85.178,10.0.2.15,TCP,60,9001  >  35978 [ACK] Seq=21392545 Ack=396190007 Win=65535 Len=0
1,4.81050200000027,62.210.85.178,10.0.2.15,TCP,60,9001  >  35978 [ACK] Seq=21392545 Ack=396191467 Win=65535 Len=0
1,4.810536999999385,10.0.2.15,62.210.85.178,TLSv1.2,1204,Application Data
1,4.810600999999224,10.0.2.15,62.210.85.178,TCP,2974,35978  >  9001 [ACK] Seq=396192617 Ack=21392545 Win=65535 Len=2920 [TCP segment of a reassembled PDU]
1,4.810636999998678,62.210.85.178,10.0.2.15,TCP,60,9001  >  35978 [ACK] Seq=21392545 Ack=396192617 Win=65535 Len=0
1,4.810643999999229,62.210.85.178,10.0.2.15,TCP,60,9001  >  35978 [ACK] Seq=21392545 Ack=396194077 Win=65535 Len=0
1,4.810647999998764,62.210.85.178,10.0.2.15,TCP,60,9001  >  35978 [ACK] Seq=21392545 Ack=396195537 Win=65535 Len=0
1,4.810679999998683,10.0.2.15,62.210.85.178,TLSv1.2,1204,Application Data
1,4.810771999998906,10.0.2.15,62.210.85.178,TLSv1.2,2974,Application Data
1,4.810794999999416,62.210.85.178,10.0.2.15,TCP,60,9001  >  35978 [ACK] Seq=21392545 Ack=396196687 Win=65535 Len=0
1,4.810826999999335,10.0.2.15,62.210.85.178,TLSv1.2,1226,Application Data
1,4.81086200000027,62.210.85.178,10.0.2.15,TCP,60,9001  >  35978 [ACK] Seq=21392545 Ack=396198147 Win=65535 Len=0
1,4.810868999999002,62.210.85.178,10.0.2.15,TCP,60,9001  >  35978 [ACK] Seq=21392545 Ack=396199607 Win=65535 Len=0
1,4.810873000000356,62.210.85.178,10.0.2.15,TCP,60,9001  >  35978 [ACK] Seq=21392545 Ack=396200779 Win=65535 Len=0
1,4.810916999998881,10.0.2.15,62.210.85.178,TLSv1.2,4124,Application Data
1,4.810956999999689,62.210.85.178,10.0.2.15,TCP,60,9001  >  35978 [ACK] Seq=21392545 Ack=396202239 Win=65535 Len=0
1,4.81096400000024,62.210.85.178,10.0.2.15,TCP,60,9001  >  35978 [ACK] Seq=21392545 Ack=396203699 Win=65535 Len=0
1,4.810969999998633,62.210.85.178,10.0.2.15,TCP,60,9001  >  35978 [ACK] Seq=21392545 Ack=396204849 Win=65535 Len=0
1,4.8110169999999925,10.0.2.15,62.210.85.178,TLSv1.2,3030,Application Data
1,4.8110559999986435,62.210.85.178,10.0.2.15,TCP,60,9001  >  35978 [ACK] Seq=21392545 Ack=396206309 Win=65535 Len=0
1,4.811062999999194,62.210.85.178,10.0.2.15,TCP,60,9001  >  35978 [ACK] Seq=21392545 Ack=396207769 Win=65535 Len=0
1,4.811066999998729,62.210.85.178,10.0.2.15,TCP,60,9001  >  35978 [ACK] Seq=21392545 Ack=396207825 Win=65535 Len=0
1,4.8235379999987344,10.0.2.15,62.210.85.178,TLSv1.2,590,Application Data
1,4.82391699999971,62.210.85.178,10.0.2.15,TCP,60,9001  >  35978 [ACK] Seq=21392545 Ack=396208361 Win=65535 Len=0
1,4.899233000000095,54.93.77.70,10.0.2.15,TLSv1.2,590,Application Data
1,4.939413000000059,10.0.2.15,54.93.77.70,TCP,54,34692  >  9001 [ACK] Seq=21484635 Ack=395852679 Win=65535 Len=0
1,4.941129999999248,54.93.77.70,10.0.2.15,TCP,2950,"9001  >  34692 [PSH, ACK] Seq=395852679 Ack=21484635 Win=65535 Len=2896 [TCP segment of a reassembled PDU]"
1,4.941178999999465,10.0.2.15,54.93.77.70,TCP,54,34692  >  9001 [ACK] Seq=21484635 Ack=395855575 Win=65535 Len=0
1,4.941549999999552,54.93.77.70,10.0.2.15,TLSv1.2,778,Application Data
1,4.94159000000036,10.0.2.15,54.93.77.70,TCP,54,34692  >  9001 [ACK] Seq=21484635 Ack=395856299 Win=65535 Len=0
1,4.97983799999929,54.93.77.70,10.0.2.15,TLSv1.2,2646,Application Data
1,4.979905000000144,10.0.2.15,54.93.77.70,TCP,54,34692  >  9001 [ACK] Seq=21484635 Ack=395858891 Win=65535 Len=0
1,4.996049999999741,54.93.77.70,10.0.2.15,TLSv1.2,1104,Application Data
1,4.99609799999962,10.0.2.15,54.93.77.70,TCP,54,34692  >  9001 [ACK] Seq=21484635 Ack=395859941 Win=65535 Len=0
1,5.0050089999986085,54.93.77.70,10.0.2.15,TCP,2950,"9001  >  34692 [PSH, ACK] Seq=395859941 Ack=21484635 Win=65535 Len=2896 [TCP segment of a reassembled PDU]"
1,5.005051000000094,10.0.2.15,54.93.77.70,TCP,54,34692  >  9001 [ACK] Seq=21484635 Ack=395862837 Win=65535 Len=0
1,5.01267899999948,54.93.77.70,10.0.2.15,TLSv1.2,778,Application Data
1,5.01271799999995,10.0.2.15,54.93.77.70,TCP,54,34692  >  9001 [ACK] Seq=21484635 Ack=395863561 Win=65535 Len=0
1,5.0141530000000785,54.93.77.70,10.0.2.15,TLSv1.2,5846,Application Data
1,5.014209999999366,10.0.2.15,54.93.77.70,TCP,54,34692  >  9001 [ACK] Seq=21484635 Ack=395869353 Win=65535 Len=0
1,5.014342999998917,54.93.77.70,10.0.2.15,TLSv1.2,1502,Application Data
1,5.01437900000019,10.0.2.15,54.93.77.70,TCP,54,34692  >  9001 [ACK] Seq=21484635 Ack=395870801 Win=65535 Len=0
1,5.038617000000158,54.93.77.70,10.0.2.15,TCP,2950,"9001  >  34692 [PSH, ACK] Seq=395870801 Ack=21484635 Win=65535 Len=2896 [TCP segment of a reassembled PDU]"
1,5.038703999998688,10.0.2.15,54.93.77.70,TCP,54,34692  >  9001 [ACK] Seq=21484635 Ack=395873697 Win=65535 Len=0
1,5.039856999999756,54.93.77.70,10.0.2.15,TLSv1.2,5298,"Application Data, Application Data"
1,5.039905999999974,10.0.2.15,54.93.77.70,TCP,54,34692  >  9001 [ACK] Seq=21484635 Ack=395878941 Win=65535 Len=0
1,5.0401569999994535,10.0.2.15,54.93.77.70,TLSv1.2,590,Application Data
1,5.040235999998913,54.93.77.70,10.0.2.15,TCP,60,9001  >  34692 [ACK] Seq=395878941 Ack=21485171 Win=65535 Len=0
1,5.0454309999986435,54.93.77.70,10.0.2.15,TLSv1.2,2950,Application Data
1,5.045492999999624,10.0.2.15,54.93.77.70,TCP,54,34692  >  9001 [ACK] Seq=21485171 Ack=395881837 Win=65535 Len=0
1,5.046479999999065,54.93.77.70,10.0.2.15,TLSv1.2,7294,"Application Data, Application Data"
1,5.046548000000257,10.0.2.15,54.93.77.70,TCP,54,34692  >  9001 [ACK] Seq=21485171 Ack=395889077 Win=65535 Len=0
1,5.049901999998838,10.0.2.15,54.93.77.70,TLSv1.2,590,Application Data
1,5.049989999999525,54.93.77.70,10.0.2.15,TCP,60,9001  >  34692 [ACK] Seq=395889077 Ack=21485707 Win=65535 Len=0
1,5.055932999999641,54.93.77.70,10.0.2.15,TLSv1.2,414,Application Data
1,5.063038999998753,54.93.77.70,10.0.2.15,TCP,2950,"9001  >  34692 [PSH, ACK] Seq=395889437 Ack=21485707 Win=65535 Len=2896 [TCP segment of a reassembled PDU]"
1,5.063061999999263,54.93.77.70,10.0.2.15,TLSv1.2,4398,Application Data [TCP segment of a reassembled PDU]
1,5.063129999998637,10.0.2.15,54.93.77.70,TCP,54,34692  >  9001 [ACK] Seq=21485707 Ack=395896677 Win=65535 Len=0
1,5.0712139999996,54.93.77.70,10.0.2.15,TLSv1.2,1502,Application Data [TCP segment of a reassembled PDU]
1,5.071256999999605,10.0.2.15,54.93.77.70,TCP,54,34692  >  9001 [ACK] Seq=21485707 Ack=395898125 Win=65535 Len=0
