No.,Time,Source,Destination,Protocol,Length,Info
1,0.000586000000112108,10.0.2.15,62.210.85.178,TCP,54,35978  >  9001 [ACK] Seq=398649221 Ack=21518073 Win=65535 Len=0
1,0.012945000000399887,62.210.85.178,10.0.2.15,TLSv1.2,590,Application Data
1,0.01305800000045565,10.0.2.15,62.210.85.178,TCP,54,35978  >  9001 [ACK] Seq=398649221 Ack=21518609 Win=65535 Len=0
1,0.02018599999973958,10.0.2.15,54.93.77.70,TCP,54,34692  >  9001 [ACK] Seq=21611851 Ack=398349813 Win=65535 Len=0
1,0.09508000000096217,62.210.85.178,10.0.2.15,TLSv1.2,590,Application Data
1,0.09519999999974971,10.0.2.15,62.210.85.178,TCP,54,35978  >  9001 [ACK] Seq=398649221 Ack=21519145 Win=65535 Len=0
1,0.13038500000038766,10.0.2.15,54.93.77.70,TLSv1.2,590,Application Data
1,0.13055999999960477,54.93.77.70,10.0.2.15,TCP,60,9001  >  34692 [ACK] Seq=398349813 Ack=21612387 Win=65535 Len=0
1,0.25443599999925937,62.210.85.178,10.0.2.15,TLSv1.2,590,Application Data
1,0.25452299999960815,10.0.2.15,62.210.85.178,TCP,54,35978  >  9001 [ACK] Seq=398649221 Ack=21519681 Win=65535 Len=0
1,0.2550859999992099,10.0.2.15,62.210.85.178,TLSv1.2,590,Application Data
1,0.2552209999994375,62.210.85.178,10.0.2.15,TCP,60,9001  >  35978 [ACK] Seq=21519681 Ack=398649757 Win=65535 Len=0
1,0.3656300000002375,54.93.77.70,10.0.2.15,TLSv1.2,590,Application Data
1,0.3657230000007985,10.0.2.15,54.93.77.70,TCP,54,34692  >  9001 [ACK] Seq=21612387 Ack=398350349 Win=65535 Len=0
1,0.3662029999995866,10.0.2.15,54.93.77.70,TLSv1.2,1618,Application Data
1,0.3663589999996475,54.93.77.70,10.0.2.15,TCP,60,9001  >  34692 [ACK] Seq=398350349 Ack=21613847 Win=65535 Len=0
1,0.366373000000749,54.93.77.70,10.0.2.15,TCP,60,9001  >  34692 [ACK] Seq=398350349 Ack=21613951 Win=65535 Len=0
1,0.6218650000009802,62.210.85.178,10.0.2.15,TLSv1.2,1618,Application Data
1,0.6219999999993888,10.0.2.15,62.210.85.178,TCP,54,35978  >  9001 [ACK] Seq=398649757 Ack=21521245 Win=65535 Len=0
1,0.6352769999994052,10.0.2.15,62.210.85.178,TLSv1.2,590,Application Data
1,0.6359670000001643,62.210.85.178,10.0.2.15,TCP,60,9001  >  35978 [ACK] Seq=21521245 Ack=398650293 Win=65535 Len=0
1,0.6460150000002614,10.0.2.15,62.210.85.178,TLSv1.2,1618,Application Data
1,0.64616500000011,62.210.85.178,10.0.2.15,TCP,60,9001  >  35978 [ACK] Seq=21521245 Ack=398651753 Win=65535 Len=0
1,0.6461899999994785,62.210.85.178,10.0.2.15,TCP,60,9001  >  35978 [ACK] Seq=21521245 Ack=398651857 Win=65535 Len=0
1,0.7601049999993847,54.93.77.70,10.0.2.15,TLSv1.2,590,Application Data
1,0.7807940000002418,54.93.77.70,10.0.2.15,TCP,1502,"9001  >  34692 [PSH, ACK] Seq=398350885 Ack=21613951 Win=65535 Len=1448 [TCP segment of a reassembled PDU]"
1,0.7808690000001661,10.0.2.15,54.93.77.70,TCP,54,34692  >  9001 [ACK] Seq=21613951 Ack=398352333 Win=65535 Len=0
1,0.7977129999999306,54.93.77.70,10.0.2.15,TLSv1.2,170,Application Data
1,0.7997180000002118,10.0.2.15,54.93.77.70,TLSv1.2,590,Application Data
1,0.7998630000001867,54.93.77.70,10.0.2.15,TCP,60,9001  >  34692 [ACK] Seq=398352449 Ack=21614487 Win=65535 Len=0
1,0.9063310000001366,62.210.85.178,10.0.2.15,TLSv1.2,590,Application Data
1,0.9066309999998339,10.0.2.15,62.210.85.178,TLSv1.2,590,Application Data
1,0.9067240000003949,62.210.85.178,10.0.2.15,TCP,60,9001  >  35978 [ACK] Seq=21521781 Ack=398652393 Win=65535 Len=0
1,1.131708000000799,54.93.77.70,10.0.2.15,TLSv1.2,590,Application Data
1,1.1320950000008452,10.0.2.15,54.93.77.70,TLSv1.2,590,Application Data
1,1.132212000000436,54.93.77.70,10.0.2.15,TCP,60,9001  >  34692 [ACK] Seq=398352985 Ack=21615023 Win=65535 Len=0
1,1.3355719999999565,62.210.85.178,10.0.2.15,TLSv1.2,590,Application Data
1,1.3433189999996102,10.0.2.15,62.210.85.178,TLSv1.2,590,Application Data
1,1.3434809999998834,62.210.85.178,10.0.2.15,TCP,60,9001  >  35978 [ACK] Seq=21522317 Ack=398652929 Win=65535 Len=0
1,1.3536700000004203,10.0.2.15,62.210.85.178,TLSv1.2,4124,Application Data
1,1.3538019999996322,10.0.2.15,62.210.85.178,TCP,2974,35978  >  9001 [ACK] Seq=398656999 Ack=21522317 Win=65535 Len=2920 [TCP segment of a reassembled PDU]
1,1.3538840000001073,62.210.85.178,10.0.2.15,TCP,60,9001  >  35978 [ACK] Seq=21522317 Ack=398654389 Win=65535 Len=0
1,1.3538979999993899,62.210.85.178,10.0.2.15,TCP,60,9001  >  35978 [ACK] Seq=21522317 Ack=398655849 Win=65535 Len=0
1,1.353902000000744,62.210.85.178,10.0.2.15,TCP,60,9001  >  35978 [ACK] Seq=21522317 Ack=398656999 Win=65535 Len=0
1,1.353903999999602,62.210.85.178,10.0.2.15,TCP,60,9001  >  35978 [ACK] Seq=21522317 Ack=398658459 Win=65535 Len=0
1,1.3539070000006177,62.210.85.178,10.0.2.15,TCP,60,9001  >  35978 [ACK] Seq=21522317 Ack=398659919 Win=65535 Len=0
1,1.353967000000921,10.0.2.15,62.210.85.178,TLSv1.2,1204,Application Data
1,1.354021000001012,62.210.85.178,10.0.2.15,TCP,60,9001  >  35978 [ACK] Seq=21522317 Ack=398661069 Win=65535 Len=0
1,1.354099000000133,10.0.2.15,62.210.85.178,TLSv1.2,4124,Application Data
1,1.354153000000224,62.210.85.178,10.0.2.15,TCP,60,9001  >  35978 [ACK] Seq=21522317 Ack=398662529 Win=65535 Len=0
1,1.3542059999999765,62.210.85.178,10.0.2.15,TCP,60,9001  >  35978 [ACK] Seq=21522317 Ack=398663989 Win=65535 Len=0
1,1.3542109999998502,62.210.85.178,10.0.2.15,TCP,60,9001  >  35978 [ACK] Seq=21522317 Ack=398665139 Win=65535 Len=0
1,1.3542579999993904,10.0.2.15,62.210.85.178,TLSv1.2,4124,Application Data
1,1.3542969999998604,62.210.85.178,10.0.2.15,TCP,60,9001  >  35978 [ACK] Seq=21522317 Ack=398666599 Win=65535 Len=0
1,1.3543850000005477,62.210.85.178,10.0.2.15,TCP,60,9001  >  35978 [ACK] Seq=21522317 Ack=398668059 Win=65535 Len=0
1,1.3543939999999566,62.210.85.178,10.0.2.15,TCP,60,9001  >  35978 [ACK] Seq=21522317 Ack=398669209 Win=65535 Len=0
1,1.3544270000002143,10.0.2.15,62.210.85.178,TLSv1.2,332,Application Data
1,1.3544910000000527,62.210.85.178,10.0.2.15,TCP,60,9001  >  35978 [ACK] Seq=21522317 Ack=398669487 Win=65535 Len=0
1,1.3545560000002297,10.0.2.15,62.210.85.178,TLSv1.2,3868,Application Data
1,1.3545979999998963,62.210.85.178,10.0.2.15,TCP,60,9001  >  35978 [ACK] Seq=21522317 Ack=398670947 Win=65535 Len=0
1,1.354659000000538,62.210.85.178,10.0.2.15,TCP,60,9001  >  35978 [ACK] Seq=21522317 Ack=398672407 Win=65535 Len=0
1,1.3546669999996084,62.210.85.178,10.0.2.15,TCP,60,9001  >  35978 [ACK] Seq=21522317 Ack=398673301 Win=65535 Len=0
1,1.3547170000001643,10.0.2.15,62.210.85.178,TLSv1.2,4124,Application Data
1,1.3548119999995833,62.210.85.178,10.0.2.15,TCP,60,9001  >  35978 [ACK] Seq=21522317 Ack=398674761 Win=65535 Len=0
1,1.3548229999996693,62.210.85.178,10.0.2.15,TCP,60,9001  >  35978 [ACK] Seq=21522317 Ack=398676221 Win=65535 Len=0
1,1.3548270000010234,62.210.85.178,10.0.2.15,TCP,60,9001  >  35978 [ACK] Seq=21522317 Ack=398677371 Win=65535 Len=0
1,1.3548960000007355,10.0.2.15,62.210.85.178,TLSv1.2,3030,Application Data
1,1.3550250000007509,62.210.85.178,10.0.2.15,TCP,60,9001  >  35978 [ACK] Seq=21522317 Ack=398678831 Win=65535 Len=0
1,1.3550390000000334,62.210.85.178,10.0.2.15,TCP,60,9001  >  35978 [ACK] Seq=21522317 Ack=398680291 Win=65535 Len=0
1,1.355043999999907,62.210.85.178,10.0.2.15,TCP,60,9001  >  35978 [ACK] Seq=21522317 Ack=398680347 Win=65535 Len=0
1,1.3643429999992804,10.0.2.15,62.210.85.178,TLSv1.2,4124,Application Data
1,1.3644469999999274,62.210.85.178,10.0.2.15,TCP,60,9001  >  35978 [ACK] Seq=21522317 Ack=398681807 Win=65535 Len=0
1,1.3644600000006903,62.210.85.178,10.0.2.15,TCP,60,9001  >  35978 [ACK] Seq=21522317 Ack=398683267 Win=65535 Len=0
1,1.364462999999887,62.210.85.178,10.0.2.15,TCP,60,9001  >  35978 [ACK] Seq=21522317 Ack=398684417 Win=65535 Len=0
1,1.3645049999995535,10.0.2.15,62.210.85.178,TLSv1.2,4124,Application Data
1,1.3645639999995183,62.210.85.178,10.0.2.15,TCP,60,9001  >  35978 [ACK] Seq=21522317 Ack=398685877 Win=65535 Len=0
1,1.3645720000004076,62.210.85.178,10.0.2.15,TCP,60,9001  >  35978 [ACK] Seq=21522317 Ack=398687337 Win=65535 Len=0
1,1.3645749999996042,62.210.85.178,10.0.2.15,TCP,60,9001  >  35978 [ACK] Seq=21522317 Ack=398688487 Win=65535 Len=0
1,1.364610000000539,10.0.2.15,62.210.85.178,TLSv1.2,4124,Application Data
1,1.3646430000007967,62.210.85.178,10.0.2.15,TCP,60,9001  >  35978 [ACK] Seq=21522317 Ack=398689947 Win=65535 Len=0
1,1.364650999999867,62.210.85.178,10.0.2.15,TCP,60,9001  >  35978 [ACK] Seq=21522317 Ack=398691407 Win=65535 Len=0
1,1.3646570000000793,62.210.85.178,10.0.2.15,TCP,60,9001  >  35978 [ACK] Seq=21522317 Ack=398692557 Win=65535 Len=0
1,1.364701000000423,10.0.2.15,62.210.85.178,TLSv1.2,4124,Application Data
1,1.3647340000006807,62.210.85.178,10.0.2.15,TCP,60,9001  >  35978 [ACK] Seq=21522317 Ack=398694017 Win=65535 Len=0
1,1.364741999999751,62.210.85.178,10.0.2.15,TCP,60,9001  >  35978 [ACK] Seq=21522317 Ack=398695477 Win=65535 Len=0
1,1.3647459999992861,62.210.85.178,10.0.2.15,TCP,60,9001  >  35978 [ACK] Seq=21522317 Ack=398696627 Win=65535 Len=0
1,1.364781000000221,10.0.2.15,62.210.85.178,TLSv1.2,332,Application Data
1,1.3648159999993368,62.210.85.178,10.0.2.15,TCP,60,9001  >  35978 [ACK] Seq=21522317 Ack=398696905 Win=65535 Len=0
1,1.3648680000005697,10.0.2.15,62.210.85.178,TLSv1.2,3868,Application Data
1,1.3649050000003626,62.210.85.178,10.0.2.15,TCP,60,9001  >  35978 [ACK] Seq=21522317 Ack=398698365 Win=65535 Len=0
1,1.3649120000009134,62.210.85.178,10.0.2.15,TCP,60,9001  >  35978 [ACK] Seq=21522317 Ack=398699825 Win=65535 Len=0
1,1.36491500000011,62.210.85.178,10.0.2.15,TCP,60,9001  >  35978 [ACK] Seq=21522317 Ack=398700719 Win=65535 Len=0
1,1.364951999999903,10.0.2.15,62.210.85.178,TLSv1.2,4124,Application Data
1,1.3649850000001607,62.210.85.178,10.0.2.15,TCP,60,9001  >  35978 [ACK] Seq=21522317 Ack=398702179 Win=65535 Len=0
1,1.364992999999231,62.210.85.178,10.0.2.15,TCP,60,9001  >  35978 [ACK] Seq=21522317 Ack=398703639 Win=65535 Len=0
1,1.3649960000002466,62.210.85.178,10.0.2.15,TCP,60,9001  >  35978 [ACK] Seq=21522317 Ack=398704789 Win=65535 Len=0
1,1.3650309999993624,10.0.2.15,62.210.85.178,TLSv1.2,3030,Application Data
1,1.3650649999999587,62.210.85.178,10.0.2.15,TCP,60,9001  >  35978 [ACK] Seq=21522317 Ack=398706249 Win=65535 Len=0
1,1.3650720000005094,62.210.85.178,10.0.2.15,TCP,60,9001  >  35978 [ACK] Seq=21522317 Ack=398707709 Win=65535 Len=0
1,1.365074999999706,62.210.85.178,10.0.2.15,TCP,60,9001  >  35978 [ACK] Seq=21522317 Ack=398707765 Win=65535 Len=0
1,1.3786510000009002,10.0.2.15,62.210.85.178,TLSv1.2,4124,Application Data
1,1.3787339999998949,62.210.85.178,10.0.2.15,TCP,60,9001  >  35978 [ACK] Seq=21522317 Ack=398709225 Win=65535 Len=0
1,1.3787439999996423,62.210.85.178,10.0.2.15,TCP,60,9001  >  35978 [ACK] Seq=21522317 Ack=398710685 Win=65535 Len=0
1,1.3787470000006579,62.210.85.178,10.0.2.15,TCP,60,9001  >  35978 [ACK] Seq=21522317 Ack=398711835 Win=65535 Len=0
1,1.378787999999986,10.0.2.15,62.210.85.178,TLSv1.2,2196,Application Data
1,1.3788230000009207,62.210.85.178,10.0.2.15,TCP,60,9001  >  35978 [ACK] Seq=21522317 Ack=398713295 Win=65535 Len=0
1,1.378830999999991,62.210.85.178,10.0.2.15,TCP,60,9001  >  35978 [ACK] Seq=21522317 Ack=398713977 Win=65535 Len=0
1,1.4458259999992151,54.93.77.70,10.0.2.15,TLSv1.2,590,Application Data
1,1.4641350000001694,54.93.77.70,10.0.2.15,TCP,2950,"9001  >  34692 [PSH, ACK] Seq=398353521 Ack=21615023 Win=65535 Len=2896 [TCP segment of a reassembled PDU]"
1,1.4642220000005182,10.0.2.15,54.93.77.70,TCP,54,34692  >  9001 [ACK] Seq=21615023 Ack=398356417 Win=65535 Len=0
1,1.482148999999481,54.93.77.70,10.0.2.15,TLSv1.2,778,Application Data
1,1.487209000000803,54.93.77.70,10.0.2.15,TCP,2950,"9001  >  34692 [PSH, ACK] Seq=398357141 Ack=21615023 Win=65535 Len=2896 [TCP segment of a reassembled PDU]"
1,1.4872250000007625,54.93.77.70,10.0.2.15,TLSv1.2,4398,Application Data [TCP segment of a reassembled PDU]
1,1.4872610000002169,10.0.2.15,54.93.77.70,TCP,54,34692  >  9001 [ACK] Seq=21615023 Ack=398360037 Win=65535 Len=0
1,1.487332000000606,10.0.2.15,54.93.77.70,TCP,54,34692  >  9001 [ACK] Seq=21615023 Ack=398364381 Win=65535 Len=0
1,1.4971160000004602,54.93.77.70,10.0.2.15,TLSv1.2,2950,Application Data [TCP segment of a reassembled PDU]
1,1.4971719999994093,10.0.2.15,54.93.77.70,TCP,54,34692  >  9001 [ACK] Seq=21615023 Ack=398367277 Win=65535 Len=0
1,1.4972350000007282,54.93.77.70,10.0.2.15,TCP,1474,9001  >  34692 [ACK] Seq=398367277 Ack=21615023 Win=65535 Len=1420 [TCP segment of a reassembled PDU]
1,1.4977679999992688,54.93.77.70,10.0.2.15,TCP,82,"9001  >  34692 [PSH, ACK] Seq=398368697 Ack=21615023 Win=65535 Len=28 [TCP segment of a reassembled PDU]"
1,1.497801999999865,10.0.2.15,54.93.77.70,TCP,54,34692  >  9001 [ACK] Seq=21615023 Ack=398368725 Win=65535 Len=0
1,1.5039770000003045,54.93.77.70,10.0.2.15,TLSv1.2,380,"Application Data, Application Data"
1,1.5404840000010154,54.93.77.70,10.0.2.15,TCP,2950,"9001  >  34692 [PSH, ACK] Seq=398369051 Ack=21615023 Win=65535 Len=2896 [TCP segment of a reassembled PDU]"
1,1.5405890000001818,10.0.2.15,54.93.77.70,TCP,54,34692  >  9001 [ACK] Seq=21615023 Ack=398371947 Win=65535 Len=0
1,1.5406139999995503,54.93.77.70,10.0.2.15,TLSv1.2,1502,Application Data [TCP segment of a reassembled PDU]
1,1.5407190000005357,10.0.2.15,54.93.77.70,TCP,54,34692  >  9001 [ACK] Seq=21615023 Ack=398373395 Win=65535 Len=0
1,1.5408769999994547,10.0.2.15,54.93.77.70,TLSv1.2,590,Application Data
1,1.5409450000006473,54.93.77.70,10.0.2.15,TCP,60,9001  >  34692 [ACK] Seq=398373395 Ack=21615559 Win=65535 Len=0
1,1.5411719999992783,54.93.77.70,10.0.2.15,TLSv1.2,4000,"Application Data, Application Data"
1,1.541214000000764,10.0.2.15,54.93.77.70,TCP,54,34692  >  9001 [ACK] Seq=21615559 Ack=398377341 Win=65535 Len=0
1,1.5559350000003178,54.93.77.70,10.0.2.15,TCP,2950,"9001  >  34692 [PSH, ACK] Seq=398377341 Ack=21615559 Win=65535 Len=2896 [TCP segment of a reassembled PDU]"
1,1.5559919999996055,10.0.2.15,54.93.77.70,TCP,54,34692  >  9001 [ACK] Seq=21615559 Ack=398380237 Win=65535 Len=0
1,1.5599480000000767,54.93.77.70,10.0.2.15,TLSv1.2,778,Application Data
1,1.5601100000003498,10.0.2.15,54.93.77.70,TLSv1.2,590,Application Data
1,1.5601860000006127,54.93.77.70,10.0.2.15,TCP,60,9001  >  34692 [ACK] Seq=398380961 Ack=21616095 Win=65535 Len=0
1,1.5672169999998005,54.93.77.70,10.0.2.15,TCP,2950,"9001  >  34692 [PSH, ACK] Seq=398380961 Ack=21616095 Win=65535 Len=2896 [TCP segment of a reassembled PDU]"
1,1.5672529999992548,54.93.77.70,10.0.2.15,TLSv1.2,5734,"Application Data, Application Data"
1,1.567312999999558,10.0.2.15,54.93.77.70,TCP,54,34692  >  9001 [ACK] Seq=21616095 Ack=398389537 Win=65535 Len=0
1,1.567363000000114,54.93.77.70,10.0.2.15,TCP,3062,"9001  >  34692 [PSH, ACK] Seq=398389537 Ack=21616095 Win=65535 Len=3008 [TCP segment of a reassembled PDU]"
1,1.5674030000009225,10.0.2.15,54.93.77.70,TCP,54,34692  >  9001 [ACK] Seq=21616095 Ack=398392545 Win=65535 Len=0
1,1.5782899999994697,54.93.77.70,10.0.2.15,TLSv1.2,2436,"Application Data, Application Data"
1,1.5783379999993485,10.0.2.15,54.93.77.70,TCP,54,34692  >  9001 [ACK] Seq=21616095 Ack=398394927 Win=65535 Len=0
1,1.6295140000001993,54.93.77.70,10.0.2.15,TCP,2950,"9001  >  34692 [PSH, ACK] Seq=398394927 Ack=21616095 Win=65535 Len=2896 [TCP segment of a reassembled PDU]"
1,1.6296170000005077,10.0.2.15,54.93.77.70,TCP,54,34692  >  9001 [ACK] Seq=21616095 Ack=398397823 Win=65535 Len=0
1,1.6302579999992304,54.93.77.70,10.0.2.15,TLSv1.2,778,Application Data
1,1.6389710000003106,54.93.77.70,10.0.2.15,TCP,2950,"9001  >  34692 [PSH, ACK] Seq=398398547 Ack=21616095 Win=65535 Len=2896 [TCP segment of a reassembled PDU]"
1,1.6390620000001945,10.0.2.15,54.93.77.70,TCP,54,34692  >  9001 [ACK] Seq=21616095 Ack=398401443 Win=65535 Len=0
1,1.6391210000001593,54.93.77.70,10.0.2.15,TLSv1.2,5846,"Application Data, Application Data"
1,1.6392120000000432,10.0.2.15,54.93.77.70,TCP,54,34692  >  9001 [ACK] Seq=21616095 Ack=398407235 Win=65535 Len=0
1,1.639458999999988,10.0.2.15,54.93.77.70,TLSv1.2,590,Application Data
1,1.6395329999995738,54.93.77.70,10.0.2.15,TCP,60,9001  >  34692 [ACK] Seq=398407235 Ack=21616631 Win=65535 Len=0
1,1.641380000000936,54.93.77.70,10.0.2.15,TCP,2950,"9001  >  34692 [PSH, ACK] Seq=398407235 Ack=21616631 Win=65535 Len=2896 [TCP segment of a reassembled PDU]"
1,1.6414220000006026,10.0.2.15,54.93.77.70,TCP,54,34692  >  9001 [ACK] Seq=21616631 Ack=398410131 Win=65535 Len=0
1,1.6512110000003304,62.210.85.178,10.0.2.15,TLSv1.2,590,Application Data
1,1.6593420000008337,54.93.77.70,10.0.2.15,TLSv1.2,2950,Application Data [TCP segment of a reassembled PDU]
1,1.6593869999996969,10.0.2.15,54.93.77.70,TCP,54,34692  >  9001 [ACK] Seq=21616631 Ack=398413027 Win=65535 Len=0
1,1.6654130000006262,54.93.77.70,10.0.2.15,TLSv1.2,1502,Application Data [TCP segment of a reassembled PDU]
1,1.6654560000006313,10.0.2.15,54.93.77.70,TCP,54,34692  >  9001 [ACK] Seq=21616631 Ack=398414475 Win=65535 Len=0
1,1.6666170000007696,10.0.2.15,54.93.77.70,TLSv1.2,590,Application Data
1,1.666744000000108,54.93.77.70,10.0.2.15,TCP,60,9001  >  34692 [ACK] Seq=398414475 Ack=21617167 Win=65535 Len=0
1,1.6671740000001591,54.93.77.70,10.0.2.15,TLSv1.2,170,Application Data
1,1.6766480000005686,10.0.2.15,54.93.77.70,TLSv1.2,590,Application Data
1,1.6767780000009225,54.93.77.70,10.0.2.15,TCP,60,9001  >  34692 [ACK] Seq=398414591 Ack=21617703 Win=65535 Len=0
1,1.6936079999995854,10.0.2.15,62.210.85.178,TCP,54,35978  >  9001 [ACK] Seq=398713977 Ack=21522853 Win=65535 Len=0
1,1.7093600000007427,62.210.85.178,10.0.2.15,TLSv1.2,590,Application Data
1,1.7094130000004952,10.0.2.15,62.210.85.178,TCP,54,35978  >  9001 [ACK] Seq=398713977 Ack=21523389 Win=65535 Len=0
1,1.777501000000484,62.210.85.178,10.0.2.15,TLSv1.2,590,Application Data
1,1.7775760000004084,10.0.2.15,62.210.85.178,TCP,54,35978  >  9001 [ACK] Seq=398713977 Ack=21523925 Win=65535 Len=0
1,1.8380030000007537,62.210.85.178,10.0.2.15,TLSv1.2,590,Application Data
1,1.8380980000001728,10.0.2.15,62.210.85.178,TCP,54,35978  >  9001 [ACK] Seq=398713977 Ack=21524461 Win=65535 Len=0
1,1.8961510000008275,62.210.85.178,10.0.2.15,TLSv1.2,590,Application Data
1,1.8962260000007518,10.0.2.15,62.210.85.178,TCP,54,35978  >  9001 [ACK] Seq=398713977 Ack=21524997 Win=65535 Len=0
1,1.8966870000003837,10.0.2.15,62.210.85.178,TLSv1.2,590,Application Data
1,1.8967830000001413,62.210.85.178,10.0.2.15,TCP,60,9001  >  35978 [ACK] Seq=21524997 Ack=398714513 Win=65535 Len=0
1,2.1529979999995703,54.93.77.70,10.0.2.15,TLSv1.2,590,Application Data
1,2.1534339999998338,10.0.2.15,54.93.77.70,TLSv1.2,590,Application Data
1,2.153598000000784,54.93.77.70,10.0.2.15,TCP,60,9001  >  34692 [ACK] Seq=398415127 Ack=21618239 Win=65535 Len=0
1,2.2669330000007903,62.210.85.178,10.0.2.15,TLSv1.2,590,Application Data
1,2.272757000000638,10.0.2.15,62.210.85.178,TLSv1.2,590,Application Data
1,2.2729550000003655,62.210.85.178,10.0.2.15,TCP,60,9001  >  35978 [ACK] Seq=21525533 Ack=398715049 Win=65535 Len=0
1,2.2832280000002356,10.0.2.15,62.210.85.178,TLSv1.2,4124,Application Data
1,2.2833929999997054,10.0.2.15,62.210.85.178,TCP,2974,35978  >  9001 [ACK] Seq=398719119 Ack=21525533 Win=65535 Len=2920 [TCP segment of a reassembled PDU]
1,2.283445999999458,62.210.85.178,10.0.2.15,TCP,60,9001  >  35978 [ACK] Seq=21525533 Ack=398716509 Win=65535 Len=0
1,2.283459000000221,62.210.85.178,10.0.2.15,TCP,60,9001  >  35978 [ACK] Seq=21525533 Ack=398717969 Win=65535 Len=0
1,2.2834640000000945,62.210.85.178,10.0.2.15,TCP,60,9001  >  35978 [ACK] Seq=21525533 Ack=398719119 Win=65535 Len=0
1,2.28353000000061,10.0.2.15,62.210.85.178,TLSv1.2,1204,Application Data
1,2.28355399999964,62.210.85.178,10.0.2.15,TCP,60,9001  >  35978 [ACK] Seq=21525533 Ack=398720579 Win=65535 Len=0
1,2.283559999999852,62.210.85.178,10.0.2.15,TCP,60,9001  >  35978 [ACK] Seq=21525533 Ack=398722039 Win=65535 Len=0
1,2.28363200000058,62.210.85.178,10.0.2.15,TCP,60,9001  >  35978 [ACK] Seq=21525533 Ack=398723189 Win=65535 Len=0
1,2.283670999999231,10.0.2.15,62.210.85.178,TCP,2974,35978  >  9001 [ACK] Seq=398723189 Ack=21525533 Win=65535 Len=2920 [TCP segment of a reassembled PDU]
1,2.2837259999996604,10.0.2.15,62.210.85.178,TLSv1.2,1204,Application Data
1,2.2837600000002567,62.210.85.178,10.0.2.15,TCP,60,9001  >  35978 [ACK] Seq=21525533 Ack=398724649 Win=65535 Len=0
1,2.2837670000008075,62.210.85.178,10.0.2.15,TCP,60,9001  >  35978 [ACK] Seq=21525533 Ack=398726109 Win=65535 Len=0
1,2.2837710000003426,62.210.85.178,10.0.2.15,TCP,60,9001  >  35978 [ACK] Seq=21525533 Ack=398727259 Win=65535 Len=0
1,2.2838169999995444,10.0.2.15,62.210.85.178,TLSv1.2,4124,Application Data
1,2.2839100000001054,62.210.85.178,10.0.2.15,TCP,60,9001  >  35978 [ACK] Seq=21525533 Ack=398728719 Win=65535 Len=0
1,2.283917000000656,62.210.85.178,10.0.2.15,TCP,60,9001  >  35978 [ACK] Seq=21525533 Ack=398730179 Win=65535 Len=0
1,2.28392200000053,62.210.85.178,10.0.2.15,TCP,60,9001  >  35978 [ACK] Seq=21525533 Ack=398731329 Win=65535 Len=0
1,2.2839530000001105,10.0.2.15,62.210.85.178,TLSv1.2,2974,Application Data
1,2.2840670000005048,62.210.85.178,10.0.2.15,TCP,60,9001  >  35978 [ACK] Seq=21525533 Ack=398732789 Win=65535 Len=0
1,2.2840790000009292,62.210.85.178,10.0.2.15,TCP,60,9001  >  35978 [ACK] Seq=21525533 Ack=398734249 Win=65535 Len=0
1,2.2841239999997924,10.0.2.15,62.210.85.178,TLSv1.2,1226,Application Data
1,2.2841850000004342,62.210.85.178,10.0.2.15,TCP,60,9001  >  35978 [ACK] Seq=21525533 Ack=398735421 Win=65535 Len=0
1,2.2842490000002726,10.0.2.15,62.210.85.178,TLSv1.2,4124,Application Data
1,2.284295999999813,62.210.85.178,10.0.2.15,TCP,60,9001  >  35978 [ACK] Seq=21525533 Ack=398736881 Win=65535 Len=0
1,2.284304000000702,62.210.85.178,10.0.2.15,TCP,60,9001  >  35978 [ACK] Seq=21525533 Ack=398738341 Win=65535 Len=0
1,2.2843080000002374,62.210.85.178,10.0.2.15,TCP,60,9001  >  35978 [ACK] Seq=21525533 Ack=398739491 Win=65535 Len=0
1,2.2843570000004547,10.0.2.15,62.210.85.178,TLSv1.2,2516,Application Data
1,2.2843979999997828,62.210.85.178,10.0.2.15,TCP,60,9001  >  35978 [ACK] Seq=21525533 Ack=398740951 Win=65535 Len=0
1,2.2844050000003335,62.210.85.178,10.0.2.15,TCP,60,9001  >  35978 [ACK] Seq=21525533 Ack=398741953 Win=65535 Len=0
1,2.389118999999482,54.93.77.70,10.0.2.15,TLSv1.2,7808,"Application Data, Application Data"
1,2.3892759999998816,10.0.2.15,54.93.77.70,TCP,54,34692  >  9001 [ACK] Seq=21618239 Ack=398422881 Win=65535 Len=0
1,2.4251970000004803,54.93.77.70,10.0.2.15,TCP,2950,"9001  >  34692 [PSH, ACK] Seq=398422881 Ack=21618239 Win=65535 Len=2896 [TCP segment of a reassembled PDU]"
1,2.4252830000004906,10.0.2.15,54.93.77.70,TCP,54,34692  >  9001 [ACK] Seq=21618239 Ack=398425777 Win=65535 Len=0
1,2.4255900000007387,54.93.77.70,10.0.2.15,TLSv1.2,778,Application Data
1,2.425796999999875,10.0.2.15,54.93.77.70,TLSv1.2,590,Application Data
1,2.4259299999994255,54.93.77.70,10.0.2.15,TCP,60,9001  >  34692 [ACK] Seq=398426501 Ack=21618775 Win=65535 Len=0
1,2.435707000000548,152.89.104.206,10.0.2.15,TLSv1.3,590,Application Data
1,2.435754000000088,10.0.2.15,152.89.104.206,TCP,54,47334  >  9001 [ACK] Seq=44903 Ack=41408 Win=65392 Len=0
1,2.4450570000008156,54.93.77.70,10.0.2.15,TLSv1.2,3674,Application Data
1,2.445125000000189,10.0.2.15,54.93.77.70,TCP,54,34692  >  9001 [ACK] Seq=21618775 Ack=398430121 Win=65535 Len=0
1,2.4638820000000123,54.93.77.70,10.0.2.15,TLSv1.2,2950,Application Data
1,2.4639310000002297,10.0.2.15,54.93.77.70,TCP,54,34692  >  9001 [ACK] Seq=21618775 Ack=398433017 Win=65535 Len=0
1,2.4643040000009933,54.93.77.70,10.0.2.15,TLSv1.2,1828,Application Data
1,2.464347999999518,10.0.2.15,54.93.77.70,TCP,54,34692  >  9001 [ACK] Seq=21618775 Ack=398434791 Win=65535 Len=0
1,2.4708339999997406,54.93.77.70,10.0.2.15,TLSv1.2,4398,Application Data
1,2.4708989999999176,10.0.2.15,54.93.77.70,TCP,54,34692  >  9001 [ACK] Seq=21618775 Ack=398439135 Win=65535 Len=0
1,2.4842029999999795,54.93.77.70,10.0.2.15,TLSv1.2,380,Application Data
1,2.498808000000281,54.93.77.70,10.0.2.15,TCP,2950,"9001  >  34692 [PSH, ACK] Seq=398439461 Ack=21618775 Win=65535 Len=2896 [TCP segment of a reassembled PDU]"
1,2.4988630000007106,10.0.2.15,54.93.77.70,TCP,54,34692  >  9001 [ACK] Seq=21618775 Ack=398442357 Win=65535 Len=0
1,2.525123999999778,54.93.77.70,10.0.2.15,TLSv1.2,264,Application Data
1,2.525413999999728,10.0.2.15,54.93.77.70,TLSv1.2,590,Application Data
1,2.5255770000003395,54.93.77.70,10.0.2.15,TCP,60,9001  >  34692 [ACK] Seq=398442567 Ack=21619311 Win=65535 Len=0
1,2.5354709999992338,10.0.2.15,54.93.77.70,TLSv1.2,590,Application Data
1,2.5356470000006084,54.93.77.70,10.0.2.15,TCP,60,9001  >  34692 [ACK] Seq=398442567 Ack=21619847 Win=65535 Len=0
1,2.5944689999996626,62.210.85.178,10.0.2.15,TLSv1.2,590,Application Data
1,2.637572999999975,10.0.2.15,62.210.85.178,TCP,54,35978  >  9001 [ACK] Seq=398741953 Ack=21526069 Win=65535 Len=0
1,2.6512170000005426,62.210.85.178,10.0.2.15,TLSv1.2,590,Application Data
1,2.6512839999995776,10.0.2.15,62.210.85.178,TCP,54,35978  >  9001 [ACK] Seq=398741953 Ack=21526605 Win=65535 Len=0
1,2.686061000000336,62.210.85.178,10.0.2.15,TLSv1.2,590,Application Data
1,2.686106999999538,10.0.2.15,62.210.85.178,TCP,54,35978  >  9001 [ACK] Seq=398741953 Ack=21527141 Win=65535 Len=0
1,2.686604000000443,10.0.2.15,62.210.85.178,TLSv1.2,590,Application Data
1,2.6867380000003322,62.210.85.178,10.0.2.15,TCP,60,9001  >  35978 [ACK] Seq=21527141 Ack=398742489 Win=65535 Len=0
1,2.8717130000004545,54.93.77.70,10.0.2.15,TLSv1.2,590,Application Data
1,2.872150999999576,10.0.2.15,54.93.77.70,TLSv1.2,590,Application Data
1,2.8722859999998036,54.93.77.70,10.0.2.15,TCP,60,9001  >  34692 [ACK] Seq=398443103 Ack=21620383 Win=65535 Len=0
1,2.987016000000949,62.210.85.178,10.0.2.15,TLSv1.2,590,Application Data
1,2.996623000000909,10.0.2.15,62.210.85.178,TLSv1.2,590,Application Data
1,2.9968320000007225,62.210.85.178,10.0.2.15,TCP,60,9001  >  35978 [ACK] Seq=21527677 Ack=398743025 Win=65535 Len=0
1,3.0096709999997984,10.0.2.15,62.210.85.178,TLSv1.2,4124,Application Data
1,3.0097769999993034,10.0.2.15,62.210.85.178,TCP,2974,35978  >  9001 [ACK] Seq=398747095 Ack=21527677 Win=65535 Len=2920 [TCP segment of a reassembled PDU]
1,3.009823000000324,62.210.85.178,10.0.2.15,TCP,60,9001  >  35978 [ACK] Seq=21527677 Ack=398744485 Win=65535 Len=0
1,3.00983400000041,62.210.85.178,10.0.2.15,TCP,60,9001  >  35978 [ACK] Seq=21527677 Ack=398745945 Win=65535 Len=0
1,3.0098390000002837,62.210.85.178,10.0.2.15,TCP,60,9001  >  35978 [ACK] Seq=21527677 Ack=398747095 Win=65535 Len=0
1,3.0098440000001574,62.210.85.178,10.0.2.15,TCP,60,9001  >  35978 [ACK] Seq=21527677 Ack=398748555 Win=65535 Len=0
1,3.009849000000031,62.210.85.178,10.0.2.15,TCP,60,9001  >  35978 [ACK] Seq=21527677 Ack=398750015 Win=65535 Len=0
1,3.009892000000036,10.0.2.15,62.210.85.178,TLSv1.2,1204,Application Data
1,3.0099709999994957,62.210.85.178,10.0.2.15,TCP,60,9001  >  35978 [ACK] Seq=21527677 Ack=398751165 Win=65535 Len=0
1,3.0100060000004305,10.0.2.15,62.210.85.178,TCP,2974,35978  >  9001 [ACK] Seq=398751165 Ack=21527677 Win=65535 Len=2920 [TCP segment of a reassembled PDU]
1,3.010082999999213,62.210.85.178,10.0.2.15,TCP,60,9001  >  35978 [ACK] Seq=21527677 Ack=398752625 Win=65535 Len=0
1,3.0100949999996374,62.210.85.178,10.0.2.15,TCP,60,9001  >  35978 [ACK] Seq=21527677 Ack=398754085 Win=65535 Len=0
1,3.0101269999995566,10.0.2.15,62.210.85.178,TLSv1.2,1204,Application Data
1,3.010218999999779,62.210.85.178,10.0.2.15,TCP,60,9001  >  35978 [ACK] Seq=21527677 Ack=398755235 Win=65535 Len=0
1,3.0102530000003753,10.0.2.15,62.210.85.178,TCP,2974,35978  >  9001 [ACK] Seq=398755235 Ack=21527677 Win=65535 Len=2920 [TCP segment of a reassembled PDU]
1,3.0103049999997893,10.0.2.15,62.210.85.178,TLSv1.2,1204,Application Data
1,3.010340000000724,62.210.85.178,10.0.2.15,TCP,60,9001  >  35978 [ACK] Seq=21527677 Ack=398756695 Win=65535 Len=0
1,3.0103460000009363,62.210.85.178,10.0.2.15,TCP,60,9001  >  35978 [ACK] Seq=21527677 Ack=398758155 Win=65535 Len=0
1,3.01035100000081,62.210.85.178,10.0.2.15,TCP,60,9001  >  35978 [ACK] Seq=21527677 Ack=398759305 Win=65535 Len=0
1,3.0103930000004766,10.0.2.15,62.210.85.178,TLSv1.2,332,Application Data
1,3.010431000000608,62.210.85.178,10.0.2.15,TCP,60,9001  >  35978 [ACK] Seq=21527677 Ack=398759583 Win=65535 Len=0
1,3.0104900000005728,10.0.2.15,62.210.85.178,TLSv1.2,3868,Application Data
1,3.010533000000578,62.210.85.178,10.0.2.15,TCP,60,9001  >  35978 [ACK] Seq=21527677 Ack=398761043 Win=65535 Len=0
1,3.0105399999993097,62.210.85.178,10.0.2.15,TCP,60,9001  >  35978 [ACK] Seq=21527677 Ack=398762503 Win=65535 Len=0
1,3.010544000000664,62.210.85.178,10.0.2.15,TCP,60,9001  >  35978 [ACK] Seq=21527677 Ack=398763397 Win=65535 Len=0
1,3.010591000000204,10.0.2.15,62.210.85.178,TLSv1.2,4124,Application Data
1,3.0106310000010126,62.210.85.178,10.0.2.15,TCP,60,9001  >  35978 [ACK] Seq=21527677 Ack=398764857 Win=65535 Len=0
1,3.0106379999997444,62.210.85.178,10.0.2.15,TCP,60,9001  >  35978 [ACK] Seq=21527677 Ack=398766317 Win=65535 Len=0
1,3.010642999999618,62.210.85.178,10.0.2.15,TCP,60,9001  >  35978 [ACK] Seq=21527677 Ack=398767467 Win=65535 Len=0
1,3.010685999999623,10.0.2.15,62.210.85.178,TLSv1.2,3030,Application Data
1,3.010725000000093,62.210.85.178,10.0.2.15,TCP,60,9001  >  35978 [ACK] Seq=21527677 Ack=398768927 Win=65535 Len=0
1,3.0107330000009824,62.210.85.178,10.0.2.15,TCP,60,9001  >  35978 [ACK] Seq=21527677 Ack=398770387 Win=65535 Len=0
1,3.010738000000856,62.210.85.178,10.0.2.15,TCP,60,9001  >  35978 [ACK] Seq=21527677 Ack=398770443 Win=65535 Len=0
1,3.0222069999999803,10.0.2.15,62.210.85.178,TLSv1.2,4124,Application Data
1,3.0223000000005413,10.0.2.15,62.210.85.178,TCP,2974,35978  >  9001 [ACK] Seq=398774513 Ack=21527677 Win=65535 Len=2920 [TCP segment of a reassembled PDU]
1,3.022342000000208,62.210.85.178,10.0.2.15,TCP,60,9001  >  35978 [ACK] Seq=21527677 Ack=398771903 Win=65535 Len=0
1,3.0223600000008446,62.210.85.178,10.0.2.15,TCP,60,9001  >  35978 [ACK] Seq=21527677 Ack=398773363 Win=65535 Len=0
1,3.0223650000007183,62.210.85.178,10.0.2.15,TCP,60,9001  >  35978 [ACK] Seq=21527677 Ack=398774513 Win=65535 Len=0
1,3.0223690000002534,62.210.85.178,10.0.2.15,TCP,60,9001  >  35978 [ACK] Seq=21527677 Ack=398775973 Win=65535 Len=0
1,3.0223729999997886,62.210.85.178,10.0.2.15,TCP,60,9001  >  35978 [ACK] Seq=21527677 Ack=398777433 Win=65535 Len=0
1,3.022414999999455,10.0.2.15,62.210.85.178,TLSv1.2,1204,Application Data
1,3.0224830000006477,10.0.2.15,62.210.85.178,TCP,2974,35978  >  9001 [ACK] Seq=398778583 Ack=21527677 Win=65535 Len=2920 [TCP segment of a reassembled PDU]
1,3.022519000000102,62.210.85.178,10.0.2.15,TCP,60,9001  >  35978 [ACK] Seq=21527677 Ack=398778583 Win=65535 Len=0
1,3.022526000000653,62.210.85.178,10.0.2.15,TCP,60,9001  >  35978 [ACK] Seq=21527677 Ack=398780043 Win=65535 Len=0
1,3.0225310000005265,62.210.85.178,10.0.2.15,TCP,60,9001  >  35978 [ACK] Seq=21527677 Ack=398781503 Win=65535 Len=0
1,3.022564999999304,10.0.2.15,62.210.85.178,TLSv1.2,1204,Application Data
1,3.022629999999481,10.0.2.15,62.210.85.178,TCP,2974,35978  >  9001 [ACK] Seq=398782653 Ack=21527677 Win=65535 Len=2920 [TCP segment of a reassembled PDU]
1,3.0226669999992737,62.210.85.178,10.0.2.15,TCP,60,9001  >  35978 [ACK] Seq=21527677 Ack=398782653 Win=65535 Len=0
1,3.022672999999486,62.210.85.178,10.0.2.15,TCP,60,9001  >  35978 [ACK] Seq=21527677 Ack=398784113 Win=65535 Len=0
1,3.0226779999993596,62.210.85.178,10.0.2.15,TCP,60,9001  >  35978 [ACK] Seq=21527677 Ack=398785573 Win=65535 Len=0
1,3.0227080000004207,10.0.2.15,62.210.85.178,TLSv1.2,1204,Application Data
1,3.022795999999289,62.210.85.178,10.0.2.15,TCP,60,9001  >  35978 [ACK] Seq=21527677 Ack=398786723 Win=65535 Len=0
1,3.0228299999998853,10.0.2.15,62.210.85.178,TLSv1.2,332,Application Data
1,3.0228819999992993,10.0.2.15,62.210.85.178,TCP,2974,35978  >  9001 [ACK] Seq=398787001 Ack=21527677 Win=65535 Len=2920 [TCP segment of a reassembled PDU]
1,3.0229180000005726,62.210.85.178,10.0.2.15,TCP,60,9001  >  35978 [ACK] Seq=21527677 Ack=398787001 Win=65535 Len=0
1,3.0229249999993044,62.210.85.178,10.0.2.15,TCP,60,9001  >  35978 [ACK] Seq=21527677 Ack=398788461 Win=65535 Len=0
1,3.0229290000006586,62.210.85.178,10.0.2.15,TCP,60,9001  >  35978 [ACK] Seq=21527677 Ack=398789921 Win=65535 Len=0
1,3.0229600000002392,10.0.2.15,62.210.85.178,TLSv1.2,948,Application Data
1,3.0229980000003707,62.210.85.178,10.0.2.15,TCP,60,9001  >  35978 [ACK] Seq=21527677 Ack=398790815 Win=65535 Len=0
1,3.0230420000007143,10.0.2.15,62.210.85.178,TLSv1.2,4124,Application Data
1,3.0230809999993653,62.210.85.178,10.0.2.15,TCP,60,9001  >  35978 [ACK] Seq=21527677 Ack=398792275 Win=65535 Len=0
1,3.0230869999995775,62.210.85.178,10.0.2.15,TCP,60,9001  >  35978 [ACK] Seq=21527677 Ack=398793735 Win=65535 Len=0
1,3.023091999999451,62.210.85.178,10.0.2.15,TCP,60,9001  >  35978 [ACK] Seq=21527677 Ack=398794885 Win=65535 Len=0
1,3.0231450000010227,10.0.2.15,62.210.85.178,TLSv1.2,3030,Application Data
1,3.0231870000006893,62.210.85.178,10.0.2.15,TCP,60,9001  >  35978 [ACK] Seq=21527677 Ack=398796345 Win=65535 Len=0
1,3.023193999999421,62.210.85.178,10.0.2.15,TCP,60,9001  >  35978 [ACK] Seq=21527677 Ack=398797805 Win=65535 Len=0
1,3.0231989999992948,62.210.85.178,10.0.2.15,TCP,60,9001  >  35978 [ACK] Seq=21527677 Ack=398797861 Win=65535 Len=0
1,3.034557999999379,10.0.2.15,62.210.85.178,TLSv1.2,4124,Application Data
1,3.034642000000531,10.0.2.15,62.210.85.178,TCP,2974,35978  >  9001 [ACK] Seq=398801931 Ack=21527677 Win=65535 Len=2920 [TCP segment of a reassembled PDU]
1,3.034685000000536,62.210.85.178,10.0.2.15,TCP,60,9001  >  35978 [ACK] Seq=21527677 Ack=398799321 Win=65535 Len=0
1,3.0346929999996064,62.210.85.178,10.0.2.15,TCP,60,9001  >  35978 [ACK] Seq=21527677 Ack=398800781 Win=65535 Len=0
1,3.0346970000009605,62.210.85.178,10.0.2.15,TCP,60,9001  >  35978 [ACK] Seq=21527677 Ack=398801931 Win=65535 Len=0
1,3.0347020000008342,62.210.85.178,10.0.2.15,TCP,60,9001  >  35978 [ACK] Seq=21527677 Ack=398803391 Win=65535 Len=0
1,3.0347060000003694,62.210.85.178,10.0.2.15,TCP,60,9001  >  35978 [ACK] Seq=21527677 Ack=398804851 Win=65535 Len=0
1,3.034745999999359,10.0.2.15,62.210.85.178,TLSv1.2,1204,Application Data
1,3.034813000000213,10.0.2.15,62.210.85.178,TCP,2974,35978  >  9001 [ACK] Seq=398806001 Ack=21527677 Win=65535 Len=2920 [TCP segment of a reassembled PDU]
1,3.0348489999996673,62.210.85.178,10.0.2.15,TCP,60,9001  >  35978 [ACK] Seq=21527677 Ack=398806001 Win=65535 Len=0
1,3.0348549999998795,62.210.85.178,10.0.2.15,TCP,60,9001  >  35978 [ACK] Seq=21527677 Ack=398807461 Win=65535 Len=0
1,3.034859999999753,62.210.85.178,10.0.2.15,TCP,60,9001  >  35978 [ACK] Seq=21527677 Ack=398808921 Win=65535 Len=0
1,3.0348940000003495,10.0.2.15,62.210.85.178,TLSv1.2,1204,Application Data
1,3.0349669999995967,62.210.85.178,10.0.2.15,TCP,60,9001  >  35978 [ACK] Seq=21527677 Ack=398810071 Win=65535 Len=0
1,3.0350020000005316,10.0.2.15,62.210.85.178,TLSv1.2,4124,Application Data
1,3.035040000000663,62.210.85.178,10.0.2.15,TCP,60,9001  >  35978 [ACK] Seq=21527677 Ack=398811531 Win=65535 Len=0
1,3.035046000000875,62.210.85.178,10.0.2.15,TCP,60,9001  >  35978 [ACK] Seq=21527677 Ack=398812991 Win=65535 Len=0
1,3.035051000000749,62.210.85.178,10.0.2.15,TCP,60,9001  >  35978 [ACK] Seq=21527677 Ack=398814141 Win=65535 Len=0
1,3.0350949999992736,10.0.2.15,62.210.85.178,TLSv1.2,332,Application Data
1,3.035170000001017,62.210.85.178,10.0.2.15,TCP,60,9001  >  35978 [ACK] Seq=21527677 Ack=398814419 Win=65535 Len=0
1,3.0352440000006027,10.0.2.15,62.210.85.178,TLSv1.2,2646,Application Data
1,3.0352899999998044,62.210.85.178,10.0.2.15,TCP,60,9001  >  35978 [ACK] Seq=21527677 Ack=398815879 Win=65535 Len=0
1,3.0352980000006937,62.210.85.178,10.0.2.15,TCP,60,9001  >  35978 [ACK] Seq=21527677 Ack=398817011 Win=65535 Len=0
1,3.0924489999997604,54.93.77.70,10.0.2.15,TLSv1.2,590,Application Data
1,3.1153959999992367,54.93.77.70,10.0.2.15,TCP,2894,9001  >  34692 [ACK] Seq=398443639 Ack=21620383 Win=65535 Len=2840 [TCP segment of a reassembled PDU]
1,3.1154920000008133,54.93.77.70,10.0.2.15,TCP,110,"9001  >  34692 [PSH, ACK] Seq=398446479 Ack=21620383 Win=65535 Len=56 [TCP segment of a reassembled PDU]"
1,3.115545000000566,10.0.2.15,54.93.77.70,TCP,54,34692  >  9001 [ACK] Seq=21620383 Ack=398446535 Win=65535 Len=0
1,3.1351749999994354,54.93.77.70,10.0.2.15,TLSv1.2,778,Application Data
1,3.1381490000003396,54.93.77.70,10.0.2.15,TCP,2950,"9001  >  34692 [PSH, ACK] Seq=398447259 Ack=21620383 Win=65535 Len=2896 [TCP segment of a reassembled PDU]"
1,3.1382549999998446,10.0.2.15,54.93.77.70,TCP,54,34692  >  9001 [ACK] Seq=21620383 Ack=398450155 Win=65535 Len=0
1,3.1575510000002396,54.93.77.70,10.0.2.15,TLSv1.2,778,Application Data
1,3.195372000000134,54.93.77.70,10.0.2.15,TCP,2950,"9001  >  34692 [PSH, ACK] Seq=398450879 Ack=21620383 Win=65535 Len=2896 [TCP segment of a reassembled PDU]"
1,3.1954230000010284,10.0.2.15,54.93.77.70,TCP,54,34692  >  9001 [ACK] Seq=21620383 Ack=398453775 Win=65535 Len=0
1,3.195846000000529,54.93.77.70,10.0.2.15,TLSv1.2,4398,Application Data [TCP segment of a reassembled PDU]
1,3.1958859999995184,10.0.2.15,54.93.77.70,TCP,54,34692  >  9001 [ACK] Seq=21620383 Ack=398458119 Win=65535 Len=0
1,3.207140000000436,54.93.77.70,10.0.2.15,TLSv1.2,2950,"Application Data, Application Data"
1,3.2071820000001026,10.0.2.15,54.93.77.70,TCP,54,34692  >  9001 [ACK] Seq=21620383 Ack=398461015 Win=65535 Len=0
1,3.2134879999994155,54.93.77.70,10.0.2.15,TLSv1.2,1314,Application Data
1,3.2181280000004335,54.93.77.70,10.0.2.15,TCP,2950,"9001  >  34692 [PSH, ACK] Seq=398462275 Ack=21620383 Win=65535 Len=2896 [TCP segment of a reassembled PDU]"
1,3.2181820000005246,10.0.2.15,54.93.77.70,TCP,54,34692  >  9001 [ACK] Seq=21620383 Ack=398465171 Win=65535 Len=0
1,3.2280640000008134,54.93.77.70,10.0.2.15,TLSv1.2,2950,Application Data [TCP segment of a reassembled PDU]
1,3.2281070000008185,10.0.2.15,54.93.77.70,TCP,54,34692  >  9001 [ACK] Seq=21620383 Ack=398468067 Win=65535 Len=0
1,3.228411000000051,54.93.77.70,10.0.2.15,TLSv1.2,4398,Application Data [TCP segment of a reassembled PDU]
1,3.2284510000008595,10.0.2.15,54.93.77.70,TCP,54,34692  >  9001 [ACK] Seq=21620383 Ack=398472411 Win=65535 Len=0
1,3.2286039999999048,10.0.2.15,54.93.77.70,TLSv1.2,590,Application Data
1,3.2286760000006325,54.93.77.70,10.0.2.15,TCP,60,9001  >  34692 [ACK] Seq=398472411 Ack=21620919 Win=65535 Len=0
1,3.236525000000256,54.93.77.70,10.0.2.15,TLSv1.2,1292,Application Data
1,3.2385969999995723,54.93.77.70,10.0.2.15,TCP,2950,"9001  >  34692 [PSH, ACK] Seq=398473649 Ack=21620919 Win=65535 Len=2896 [TCP segment of a reassembled PDU]"
1,3.2386740000001737,10.0.2.15,54.93.77.70,TCP,54,34692  >  9001 [ACK] Seq=21620919 Ack=398476545 Win=65535 Len=0
1,3.239158000000316,54.93.77.70,10.0.2.15,TLSv1.2,8742,"Application Data, Application Data"
1,3.239215999999942,10.0.2.15,54.93.77.70,TCP,54,34692  >  9001 [ACK] Seq=21620919 Ack=398485233 Win=65535 Len=0
1,3.23937400000068,10.0.2.15,54.93.77.70,TLSv1.2,590,Application Data
1,3.2394509999994625,54.93.77.70,10.0.2.15,TCP,60,9001  >  34692 [ACK] Seq=398485233 Ack=21621455 Win=65535 Len=0
1,3.248901000000842,54.93.77.70,10.0.2.15,TLSv1.2,2950,"Application Data, Application Data"
1,3.2489470000000438,10.0.2.15,54.93.77.70,TCP,54,34692  >  9001 [ACK] Seq=21621455 Ack=398488129 Win=65535 Len=0
1,3.2494879999994737,54.93.77.70,10.0.2.15,TLSv1.2,7294,"Application Data, Application Data"
1,3.2495620000008785,10.0.2.15,54.93.77.70,TCP,54,34692  >  9001 [ACK] Seq=21621455 Ack=398495369 Win=65535 Len=0
1,3.250465000000986,54.93.77.70,10.0.2.15,TCP,1502,"9001  >  34692 [PSH, ACK] Seq=398495369 Ack=21621455 Win=65535 Len=1448 [TCP segment of a reassembled PDU]"
1,3.2505049999999756,10.0.2.15,54.93.77.70,TCP,54,34692  >  9001 [ACK] Seq=21621455 Ack=398496817 Win=65535 Len=0
1,3.255569999999352,54.93.77.70,10.0.2.15,TLSv1.2,684,Application Data
