No.,Time,Source,Destination,Protocol,Length,Info
1,0.021682999999029562,10.0.2.15,54.93.77.70,TCP,54,34692  >  9001 [ACK] Seq=22368833 Ack=412087427 Win=65535 Len=0
1,0.13890799999899173,10.0.2.15,54.93.77.70,TLSv1.2,590,Application Data
1,0.139153999998598,54.93.77.70,10.0.2.15,TCP,60,9001  >  34692 [ACK] Seq=412087427 Ack=22369369 Win=65535 Len=0
1,0.2545669999999518,62.210.85.178,10.0.2.15,TLSv1.2,590,Application Data
1,0.25489999999990687,10.0.2.15,62.210.85.178,TLSv1.2,590,Application Data
1,0.25500599999941187,62.210.85.178,10.0.2.15,TCP,60,9001  >  35978 [ACK] Seq=22274023 Ack=412384181 Win=65535 Len=0
1,0.3480119999985618,54.93.77.70,10.0.2.15,TLSv1.2,590,Application Data
1,0.34808999999950174,10.0.2.15,54.93.77.70,TCP,54,34692  >  9001 [ACK] Seq=22369369 Ack=412087963 Win=65535 Len=0
1,0.3485369999998511,10.0.2.15,54.93.77.70,TLSv1.2,1618,Application Data
1,0.34868399999868416,54.93.77.70,10.0.2.15,TCP,60,9001  >  34692 [ACK] Seq=412087963 Ack=22370829 Win=65535 Len=0
1,0.3486979999997857,54.93.77.70,10.0.2.15,TCP,60,9001  >  34692 [ACK] Seq=412087963 Ack=22370933 Win=65535 Len=0
1,0.4573339999988093,62.210.85.178,10.0.2.15,TLSv1.2,1618,Application Data
1,0.45745499999975436,10.0.2.15,62.210.85.178,TCP,54,35978  >  9001 [ACK] Seq=412384181 Ack=22275587 Win=65535 Len=0
1,0.4785830000000715,10.0.2.15,62.210.85.178,TLSv1.2,590,Application Data
1,0.47876499999983935,62.210.85.178,10.0.2.15,TCP,60,9001  >  35978 [ACK] Seq=22275587 Ack=412384717 Win=65535 Len=0
1,0.49049599999852944,10.0.2.15,62.210.85.178,TLSv1.2,1618,Application Data
1,0.49063999999998487,62.210.85.178,10.0.2.15,TCP,60,9001  >  35978 [ACK] Seq=22275587 Ack=412386177 Win=65535 Len=0
1,0.490656999998464,62.210.85.178,10.0.2.15,TCP,60,9001  >  35978 [ACK] Seq=22275587 Ack=412386281 Win=65535 Len=0
1,0.5663979999990261,54.93.77.70,10.0.2.15,TLSv1.2,590,Application Data
1,0.6094069999999192,10.0.2.15,54.93.77.70,TCP,54,34692  >  9001 [ACK] Seq=22370933 Ack=412088499 Win=65535 Len=0
1,0.6246109999992768,54.93.77.70,10.0.2.15,TCP,1502,"9001  >  34692 [PSH, ACK] Seq=412088499 Ack=22370933 Win=65535 Len=1448 [TCP segment of a reassembled PDU]"
1,0.6246549999996205,10.0.2.15,54.93.77.70,TCP,54,34692  >  9001 [ACK] Seq=22370933 Ack=412089947 Win=65535 Len=0
1,0.6257200000000012,54.93.77.70,10.0.2.15,TLSv1.2,170,Application Data
1,0.6257639999985258,10.0.2.15,54.93.77.70,TCP,54,34692  >  9001 [ACK] Seq=22370933 Ack=412090063 Win=65535 Len=0
1,0.6277179999997315,10.0.2.15,54.93.77.70,TLSv1.2,590,Application Data
1,0.6278819999988627,54.93.77.70,10.0.2.15,TCP,60,9001  >  34692 [ACK] Seq=412090063 Ack=22371469 Win=65535 Len=0
1,0.8536279999989347,62.210.85.178,10.0.2.15,TLSv1.2,590,Application Data
1,0.8539430000000721,10.0.2.15,62.210.85.178,TLSv1.2,590,Application Data
1,0.8540549999997893,62.210.85.178,10.0.2.15,TCP,60,9001  >  35978 [ACK] Seq=22276123 Ack=412386817 Win=65535 Len=0
1,0.9394219999994675,54.93.77.70,10.0.2.15,TLSv1.2,590,Application Data
1,0.9398179999989225,10.0.2.15,54.93.77.70,TLSv1.2,590,Application Data
1,0.9399279999997816,54.93.77.70,10.0.2.15,TCP,60,9001  >  34692 [ACK] Seq=412090599 Ack=22372005 Win=65535 Len=0
1,1.0281309999991208,10.0.2.15,152.89.104.206,TLSv1.3,590,Application Data
1,1.0283129999988887,152.89.104.206,10.0.2.15,TCP,60,9001  >  47334 [ACK] Seq=54272 Ack=55087 Win=65535 Len=0
1,1.1088509999990492,62.210.85.178,10.0.2.15,TLSv1.2,590,Application Data
1,1.1191879999987577,10.0.2.15,62.210.85.178,TLSv1.2,590,Application Data
1,1.1194029999987833,62.210.85.178,10.0.2.15,TCP,60,9001  >  35978 [ACK] Seq=22276659 Ack=412387353 Win=65535 Len=0
1,1.130236999999397,10.0.2.15,62.210.85.178,TLSv1.2,4124,Application Data
1,1.1303469999984372,10.0.2.15,62.210.85.178,TCP,2974,35978  >  9001 [ACK] Seq=412391423 Ack=22276659 Win=65535 Len=2920 [TCP segment of a reassembled PDU]
1,1.1303969999989931,62.210.85.178,10.0.2.15,TCP,60,9001  >  35978 [ACK] Seq=22276659 Ack=412388813 Win=65535 Len=0
1,1.130409999999756,62.210.85.178,10.0.2.15,TCP,60,9001  >  35978 [ACK] Seq=22276659 Ack=412390273 Win=65535 Len=0
1,1.1304159999999683,62.210.85.178,10.0.2.15,TCP,60,9001  >  35978 [ACK] Seq=22276659 Ack=412391423 Win=65535 Len=0
1,1.130483999999342,10.0.2.15,62.210.85.178,TLSv1.2,1204,Application Data
1,1.1305359999987559,62.210.85.178,10.0.2.15,TCP,60,9001  >  35978 [ACK] Seq=22276659 Ack=412392883 Win=65535 Len=0
1,1.1305429999993066,62.210.85.178,10.0.2.15,TCP,60,9001  >  35978 [ACK] Seq=22276659 Ack=412394343 Win=65535 Len=0
1,1.1305459999985032,62.210.85.178,10.0.2.15,TCP,60,9001  >  35978 [ACK] Seq=22276659 Ack=412395493 Win=65535 Len=0
1,1.1306019999992714,10.0.2.15,62.210.85.178,TLSv1.2,4124,Application Data
1,1.1306449999992765,62.210.85.178,10.0.2.15,TCP,60,9001  >  35978 [ACK] Seq=22276659 Ack=412396953 Win=65535 Len=0
1,1.1306539999986853,62.210.85.178,10.0.2.15,TCP,60,9001  >  35978 [ACK] Seq=22276659 Ack=412398413 Win=65535 Len=0
1,1.130658999998559,62.210.85.178,10.0.2.15,TCP,60,9001  >  35978 [ACK] Seq=22276659 Ack=412399563 Win=65535 Len=0
1,1.130697999999029,10.0.2.15,62.210.85.178,TLSv1.2,4124,Application Data
1,1.1307359999991604,62.210.85.178,10.0.2.15,TCP,60,9001  >  35978 [ACK] Seq=22276659 Ack=412401023 Win=65535 Len=0
1,1.1307449999985693,62.210.85.178,10.0.2.15,TCP,60,9001  >  35978 [ACK] Seq=22276659 Ack=412402483 Win=65535 Len=0
1,1.1308069999995496,10.0.2.15,62.210.85.178,TLSv1.2,2974,Application Data
1,1.1308479999988776,62.210.85.178,10.0.2.15,TCP,60,9001  >  35978 [ACK] Seq=22276659 Ack=412403633 Win=65535 Len=0
1,1.1308549999994284,62.210.85.178,10.0.2.15,TCP,60,9001  >  35978 [ACK] Seq=22276659 Ack=412405093 Win=65535 Len=0
1,1.130857999998625,62.210.85.178,10.0.2.15,TCP,60,9001  >  35978 [ACK] Seq=22276659 Ack=412406553 Win=65535 Len=0
1,1.130885999999009,10.0.2.15,62.210.85.178,TLSv1.2,1226,Application Data
1,1.1309219999984634,62.210.85.178,10.0.2.15,TCP,60,9001  >  35978 [ACK] Seq=22276659 Ack=412407725 Win=65535 Len=0
1,1.1309629999996105,10.0.2.15,62.210.85.178,TLSv1.2,4124,Application Data
1,1.131000999999742,62.210.85.178,10.0.2.15,TCP,60,9001  >  35978 [ACK] Seq=22276659 Ack=412409185 Win=65535 Len=0
1,1.1310089999988122,62.210.85.178,10.0.2.15,TCP,60,9001  >  35978 [ACK] Seq=22276659 Ack=412410645 Win=65535 Len=0
1,1.1310130000001664,62.210.85.178,10.0.2.15,TCP,60,9001  >  35978 [ACK] Seq=22276659 Ack=412411795 Win=65535 Len=0
1,1.131054999999833,10.0.2.15,62.210.85.178,TLSv1.2,3030,Application Data
1,1.1310949999988225,62.210.85.178,10.0.2.15,TCP,60,9001  >  35978 [ACK] Seq=22276659 Ack=412413255 Win=65535 Len=0
1,1.1311029999997118,62.210.85.178,10.0.2.15,TCP,60,9001  >  35978 [ACK] Seq=22276659 Ack=412414715 Win=65535 Len=0
1,1.1311059999989084,62.210.85.178,10.0.2.15,TCP,60,9001  >  35978 [ACK] Seq=22276659 Ack=412414771 Win=65535 Len=0
1,1.1402909999997064,10.0.2.15,62.210.85.178,TLSv1.2,4124,Application Data
1,1.1403449999997974,62.210.85.178,10.0.2.15,TCP,60,9001  >  35978 [ACK] Seq=22276659 Ack=412416231 Win=65535 Len=0
1,1.1403559999998834,62.210.85.178,10.0.2.15,TCP,60,9001  >  35978 [ACK] Seq=22276659 Ack=412417691 Win=65535 Len=0
1,1.140360999999757,62.210.85.178,10.0.2.15,TCP,60,9001  >  35978 [ACK] Seq=22276659 Ack=412418841 Win=65535 Len=0
1,1.1404069999989588,10.0.2.15,62.210.85.178,TLSv1.2,4124,Application Data
1,1.1404469999997673,62.210.85.178,10.0.2.15,TCP,60,9001  >  35978 [ACK] Seq=22276659 Ack=412420301 Win=65535 Len=0
1,1.1404559999991761,62.210.85.178,10.0.2.15,TCP,60,9001  >  35978 [ACK] Seq=22276659 Ack=412421761 Win=65535 Len=0
1,1.1404609999990498,62.210.85.178,10.0.2.15,TCP,60,9001  >  35978 [ACK] Seq=22276659 Ack=412422911 Win=65535 Len=0
1,1.1405009999998583,10.0.2.15,62.210.85.178,TLSv1.2,4124,Application Data
1,1.1405399999985093,62.210.85.178,10.0.2.15,TCP,60,9001  >  35978 [ACK] Seq=22276659 Ack=412424371 Win=65535 Len=0
1,1.1405479999993986,62.210.85.178,10.0.2.15,TCP,60,9001  >  35978 [ACK] Seq=22276659 Ack=412425831 Win=65535 Len=0
1,1.1405529999992723,62.210.85.178,10.0.2.15,TCP,60,9001  >  35978 [ACK] Seq=22276659 Ack=412426981 Win=65535 Len=0
1,1.1405899999990652,10.0.2.15,62.210.85.178,TLSv1.2,4124,Application Data
1,1.1406329999990703,62.210.85.178,10.0.2.15,TCP,60,9001  >  35978 [ACK] Seq=22276659 Ack=412428441 Win=65535 Len=0
1,1.1406409999999596,62.210.85.178,10.0.2.15,TCP,60,9001  >  35978 [ACK] Seq=22276659 Ack=412429901 Win=65535 Len=0
1,1.1406439999991562,62.210.85.178,10.0.2.15,TCP,60,9001  >  35978 [ACK] Seq=22276659 Ack=412431051 Win=65535 Len=0
1,1.140679000000091,10.0.2.15,62.210.85.178,TLSv1.2,332,Application Data
1,1.140715999999884,62.210.85.178,10.0.2.15,TCP,60,9001  >  35978 [ACK] Seq=22276659 Ack=412431329 Win=65535 Len=0
1,1.1407689999996364,10.0.2.15,62.210.85.178,TLSv1.2,3868,Application Data
1,1.1408080000001064,62.210.85.178,10.0.2.15,TCP,60,9001  >  35978 [ACK] Seq=22276659 Ack=412432789 Win=65535 Len=0
1,1.1408169999995152,62.210.85.178,10.0.2.15,TCP,60,9001  >  35978 [ACK] Seq=22276659 Ack=412434249 Win=65535 Len=0
1,1.1408209999990504,62.210.85.178,10.0.2.15,TCP,60,9001  >  35978 [ACK] Seq=22276659 Ack=412435143 Win=65535 Len=0
1,1.1408599999995204,10.0.2.15,62.210.85.178,TLSv1.2,4124,Application Data
1,1.1408979999996518,62.210.85.178,10.0.2.15,TCP,60,9001  >  35978 [ACK] Seq=22276659 Ack=412436603 Win=65535 Len=0
1,1.140905999998722,62.210.85.178,10.0.2.15,TCP,60,9001  >  35978 [ACK] Seq=22276659 Ack=412438063 Win=65535 Len=0
1,1.1409100000000763,62.210.85.178,10.0.2.15,TCP,60,9001  >  35978 [ACK] Seq=22276659 Ack=412439213 Win=65535 Len=0
1,1.140944999999192,10.0.2.15,62.210.85.178,TLSv1.2,3030,Application Data
1,1.1409850000000006,62.210.85.178,10.0.2.15,TCP,60,9001  >  35978 [ACK] Seq=22276659 Ack=412440673 Win=65535 Len=0
1,1.140992999999071,62.210.85.178,10.0.2.15,TCP,60,9001  >  35978 [ACK] Seq=22276659 Ack=412442133 Win=65535 Len=0
1,1.140996999998606,62.210.85.178,10.0.2.15,TCP,60,9001  >  35978 [ACK] Seq=22276659 Ack=412442189 Win=65535 Len=0
1,1.1535759999987931,10.0.2.15,62.210.85.178,TLSv1.2,4124,Application Data
1,1.1536719999985507,62.210.85.178,10.0.2.15,TCP,60,9001  >  35978 [ACK] Seq=22276659 Ack=412443649 Win=65535 Len=0
1,1.1536859999996523,62.210.85.178,10.0.2.15,TCP,60,9001  >  35978 [ACK] Seq=22276659 Ack=412445109 Win=65535 Len=0
1,1.1536889999988489,62.210.85.178,10.0.2.15,TCP,60,9001  >  35978 [ACK] Seq=22276659 Ack=412446259 Win=65535 Len=0
1,1.1537389999994048,10.0.2.15,62.210.85.178,TLSv1.2,4124,Application Data
1,1.1537809999990714,62.210.85.178,10.0.2.15,TCP,60,9001  >  35978 [ACK] Seq=22276659 Ack=412447719 Win=65535 Len=0
1,1.1537899999984802,62.210.85.178,10.0.2.15,TCP,60,9001  >  35978 [ACK] Seq=22276659 Ack=412449179 Win=65535 Len=0
1,1.1537950000001729,62.210.85.178,10.0.2.15,TCP,60,9001  >  35978 [ACK] Seq=22276659 Ack=412450329 Win=65535 Len=0
1,1.1538339999988239,10.0.2.15,62.210.85.178,TLSv1.2,4124,Application Data
1,1.1538719999989553,62.210.85.178,10.0.2.15,TCP,60,9001  >  35978 [ACK] Seq=22276659 Ack=412451789 Win=65535 Len=0
1,1.1538799999998446,62.210.85.178,10.0.2.15,TCP,60,9001  >  35978 [ACK] Seq=22276659 Ack=412453249 Win=65535 Len=0
1,1.1538860000000568,62.210.85.178,10.0.2.15,TCP,60,9001  >  35978 [ACK] Seq=22276659 Ack=412454399 Win=65535 Len=0
1,1.1539279999997234,10.0.2.15,62.210.85.178,TLSv1.2,4124,Application Data
1,1.153967999998713,62.210.85.178,10.0.2.15,TCP,60,9001  >  35978 [ACK] Seq=22276659 Ack=412455859 Win=65535 Len=0
1,1.1539759999996022,62.210.85.178,10.0.2.15,TCP,60,9001  >  35978 [ACK] Seq=22276659 Ack=412457319 Win=65535 Len=0
1,1.1539799999991374,62.210.85.178,10.0.2.15,TCP,60,9001  >  35978 [ACK] Seq=22276659 Ack=412458469 Win=65535 Len=0
1,1.1540150000000722,10.0.2.15,62.210.85.178,TLSv1.2,332,Application Data
1,1.1540569999997388,62.210.85.178,10.0.2.15,TCP,60,9001  >  35978 [ACK] Seq=22276659 Ack=412458747 Win=65535 Len=0
1,1.1541089999991527,10.0.2.15,62.210.85.178,TLSv1.2,3868,Application Data
1,1.1541899999992893,62.210.85.178,10.0.2.15,TCP,60,9001  >  35978 [ACK] Seq=22276659 Ack=412460207 Win=65535 Len=0
1,1.1541989999986981,62.210.85.178,10.0.2.15,TCP,60,9001  >  35978 [ACK] Seq=22276659 Ack=412461667 Win=65535 Len=0
1,1.1542019999997137,62.210.85.178,10.0.2.15,TCP,60,9001  >  35978 [ACK] Seq=22276659 Ack=412462561 Win=65535 Len=0
1,1.1542269999990822,10.0.2.15,62.210.85.178,TCP,2974,35978  >  9001 [ACK] Seq=412462561 Ack=22276659 Win=65535 Len=2920 [TCP segment of a reassembled PDU]
1,1.15425999999934,62.210.85.178,10.0.2.15,TCP,60,9001  >  35978 [ACK] Seq=22276659 Ack=412464021 Win=65535 Len=0
1,1.1542669999998907,62.210.85.178,10.0.2.15,TCP,60,9001  >  35978 [ACK] Seq=22276659 Ack=412465481 Win=65535 Len=0
1,1.1542969999991328,10.0.2.15,62.210.85.178,TLSv1.2,1204,Application Data
1,1.1543299999993906,62.210.85.178,10.0.2.15,TCP,60,9001  >  35978 [ACK] Seq=22276659 Ack=412466631 Win=65535 Len=0
1,1.1543689999998605,10.0.2.15,62.210.85.178,TLSv1.2,2516,Application Data
1,1.1544029999986378,62.210.85.178,10.0.2.15,TCP,60,9001  >  35978 [ACK] Seq=22276659 Ack=412468091 Win=65535 Len=0
1,1.1544099999991886,62.210.85.178,10.0.2.15,TCP,60,9001  >  35978 [ACK] Seq=22276659 Ack=412469093 Win=65535 Len=0
1,1.233859999998458,54.93.77.70,10.0.2.15,TLSv1.2,590,Application Data
1,1.2774460000000545,10.0.2.15,54.93.77.70,TCP,54,34692  >  9001 [ACK] Seq=22372005 Ack=412091135 Win=65535 Len=0
1,1.3268859999989218,54.93.77.70,10.0.2.15,TLSv1.2,3674,Application Data
1,1.3269380000001547,10.0.2.15,54.93.77.70,TCP,54,34692  >  9001 [ACK] Seq=22372005 Ack=412094755 Win=65535 Len=0
1,1.3591969999997673,54.93.77.70,10.0.2.15,TLSv1.2,3674,Application Data
1,1.3592749999988882,10.0.2.15,54.93.77.70,TCP,54,34692  >  9001 [ACK] Seq=22372005 Ack=412098375 Win=65535 Len=0
1,1.3595019999993383,10.0.2.15,54.93.77.70,TLSv1.2,590,Application Data
1,1.3595859999986715,54.93.77.70,10.0.2.15,TCP,60,9001  >  34692 [ACK] Seq=412098375 Ack=22372541 Win=65535 Len=0
1,1.3762429999987944,54.93.77.70,10.0.2.15,TLSv1.2,590,Application Data
1,1.3903659999996307,54.93.77.70,10.0.2.15,TCP,2950,"9001  >  34692 [PSH, ACK] Seq=412098911 Ack=22372541 Win=65535 Len=2896 [TCP segment of a reassembled PDU]"
1,1.3904320000001462,10.0.2.15,54.93.77.70,TCP,54,34692  >  9001 [ACK] Seq=22372541 Ack=412101807 Win=65535 Len=0
1,1.4077199999992445,54.93.77.70,10.0.2.15,TLSv1.2,778,Application Data
1,1.4431100000001607,54.93.77.70,10.0.2.15,TCP,2950,"9001  >  34692 [PSH, ACK] Seq=412102531 Ack=22372541 Win=65535 Len=2896 [TCP segment of a reassembled PDU]"
1,1.4431879999992816,10.0.2.15,54.93.77.70,TCP,54,34692  >  9001 [ACK] Seq=22372541 Ack=412105427 Win=65535 Len=0
1,1.4593580000000657,54.93.77.70,10.0.2.15,TLSv1.2,1314,"Application Data, Application Data"
1,1.5013819999985571,10.0.2.15,54.93.77.70,TCP,54,34692  >  9001 [ACK] Seq=22372541 Ack=412106687 Win=65535 Len=0
1,1.5059289999990142,54.93.77.70,10.0.2.15,TCP,2950,"9001  >  34692 [PSH, ACK] Seq=412106687 Ack=22372541 Win=65535 Len=2896 [TCP segment of a reassembled PDU]"
1,1.5059799999999086,10.0.2.15,54.93.77.70,TCP,54,34692  >  9001 [ACK] Seq=22372541 Ack=412109583 Win=65535 Len=0
1,1.516646000000037,54.93.77.70,10.0.2.15,TLSv1.2,778,Application Data
1,1.5166919999992388,10.0.2.15,54.93.77.70,TCP,54,34692  >  9001 [ACK] Seq=22372541 Ack=412110307 Win=65535 Len=0
1,1.5277319999986503,54.93.77.70,10.0.2.15,TLSv1.2,7294,"Application Data, Application Data"
1,1.5277819999992062,10.0.2.15,54.93.77.70,TCP,54,34692  >  9001 [ACK] Seq=22372541 Ack=412117547 Win=65535 Len=0
1,1.53297399999974,54.93.77.70,10.0.2.15,TLSv1.2,1104,Application Data
1,1.5330209999992803,10.0.2.15,54.93.77.70,TCP,54,34692  >  9001 [ACK] Seq=22372541 Ack=412118597 Win=65535 Len=0
1,1.53322499999922,10.0.2.15,54.93.77.70,TLSv1.2,590,Application Data
1,1.53330300000016,54.93.77.70,10.0.2.15,TCP,60,9001  >  34692 [ACK] Seq=412118597 Ack=22373077 Win=65535 Len=0
1,1.5400699999991048,54.93.77.70,10.0.2.15,TCP,2950,"9001  >  34692 [PSH, ACK] Seq=412118597 Ack=22373077 Win=65535 Len=2896 [TCP segment of a reassembled PDU]"
1,1.5401619999993272,54.93.77.70,10.0.2.15,TLSv1.2,4398,Application Data [TCP segment of a reassembled PDU]
1,1.540289999999004,10.0.2.15,54.93.77.70,TCP,54,34692  >  9001 [ACK] Seq=22373077 Ack=412125837 Win=65535 Len=0
1,1.5438089999988733,54.93.77.70,10.0.2.15,TLSv1.2,2950,Application Data [TCP segment of a reassembled PDU]
1,1.5438649999996414,10.0.2.15,54.93.77.70,TCP,54,34692  >  9001 [ACK] Seq=22373077 Ack=412128733 Win=65535 Len=0
1,1.5464049999991403,54.93.77.70,10.0.2.15,TLSv1.2,5846,Application Data [TCP segment of a reassembled PDU]
1,1.5465580000000045,10.0.2.15,54.93.77.70,TCP,54,34692  >  9001 [ACK] Seq=22373077 Ack=412134525 Win=65535 Len=0
1,1.550785999999789,54.93.77.70,10.0.2.15,TLSv1.2,8288,"Application Data, Application Data, Application Data"
1,1.5508629999985715,10.0.2.15,54.93.77.70,TCP,54,34692  >  9001 [ACK] Seq=22373077 Ack=412142759 Win=65535 Len=0
1,1.5512719999987894,10.0.2.15,54.93.77.70,TLSv1.2,590,Application Data
1,1.5513859999991837,54.93.77.70,10.0.2.15,TCP,60,9001  >  34692 [ACK] Seq=412142759 Ack=22373613 Win=65535 Len=0
1,1.5589169999984733,54.93.77.70,10.0.2.15,TLSv1.2,5846,"Application Data, Application Data"
1,1.5589689999997063,54.93.77.70,10.0.2.15,TLSv1.2,7294,Application Data [TCP segment of a reassembled PDU]
1,1.5590809999994235,10.0.2.15,54.93.77.70,TCP,54,34692  >  9001 [ACK] Seq=22373613 Ack=412155791 Win=65535 Len=0
1,1.5591349999995145,62.210.85.178,10.0.2.15,TLSv1.2,590,Application Data
1,1.5604419999999664,54.93.77.70,10.0.2.15,TLSv1.2,2950,Application Data [TCP segment of a reassembled PDU]
1,1.5604929999990418,10.0.2.15,54.93.77.70,TCP,54,34692  >  9001 [ACK] Seq=22373613 Ack=412158687 Win=65535 Len=0
1,1.561811999999918,10.0.2.15,54.93.77.70,TLSv1.2,590,Application Data
1,1.5619349999997212,54.93.77.70,10.0.2.15,TCP,60,9001  >  34692 [ACK] Seq=412158687 Ack=22374149 Win=65535 Len=0
1,1.5666629999996076,54.93.77.70,10.0.2.15,TLSv1.2,298,Application Data
1,1.5730769999991026,54.93.77.70,10.0.2.15,TLSv1.2,4398,Application Data
1,1.5731599999999162,10.0.2.15,54.93.77.70,TCP,54,34692  >  9001 [ACK] Seq=22374149 Ack=412163275 Win=65535 Len=0
1,1.5745520000000397,54.93.77.70,10.0.2.15,TCP,2950,"9001  >  34692 [PSH, ACK] Seq=412163275 Ack=22374149 Win=65535 Len=2896 [TCP segment of a reassembled PDU]"
1,1.5745959999985644,10.0.2.15,54.93.77.70,TCP,54,34692  >  9001 [ACK] Seq=22374149 Ack=412166171 Win=65535 Len=0
1,1.5759519999992335,54.93.77.70,10.0.2.15,TLSv1.2,5846,"Application Data, Application Data"
1,1.5760129999998753,10.0.2.15,54.93.77.70,TCP,54,34692  >  9001 [ACK] Seq=22374149 Ack=412171963 Win=65535 Len=0
1,1.5763349999997445,10.0.2.15,54.93.77.70,TLSv1.2,590,Application Data
1,1.5764819999985775,54.93.77.70,10.0.2.15,TCP,60,9001  >  34692 [ACK] Seq=412171963 Ack=22374685 Win=65535 Len=0
1,1.5915899999999965,54.93.77.70,10.0.2.15,TLSv1.2,988,Application Data
1,1.6029039999993984,10.0.2.15,54.93.77.70,TLSv1.2,590,Application Data
1,1.6030839999984892,10.0.2.15,62.210.85.178,TCP,54,35978  >  9001 [ACK] Seq=412469093 Ack=22277195 Win=65535 Len=0
1,1.6031259999999747,54.93.77.70,10.0.2.15,TCP,60,9001  >  34692 [ACK] Seq=412172897 Ack=22375221 Win=65535 Len=0
1,1.6428179999984422,62.210.85.178,10.0.2.15,TLSv1.2,590,Application Data
1,1.6428849999992963,10.0.2.15,62.210.85.178,TCP,54,35978  >  9001 [ACK] Seq=412469093 Ack=22277731 Win=65535 Len=0
1,1.686069999999745,62.210.85.178,10.0.2.15,TLSv1.2,590,Application Data
1,1.6861469999985275,10.0.2.15,62.210.85.178,TCP,54,35978  >  9001 [ACK] Seq=412469093 Ack=22278267 Win=65535 Len=0
1,1.725547000000006,62.210.85.178,10.0.2.15,TLSv1.2,1104,Application Data
1,1.7255979999990814,10.0.2.15,62.210.85.178,TCP,54,35978  >  9001 [ACK] Seq=412469093 Ack=22279317 Win=65535 Len=0
1,2.083071999999447,62.210.85.178,10.0.2.15,TLSv1.2,590,Application Data
1,2.0831490000000485,10.0.2.15,62.210.85.178,TCP,54,35978  >  9001 [ACK] Seq=412469093 Ack=22279853 Win=65535 Len=0
1,2.083638999998584,10.0.2.15,62.210.85.178,TLSv1.2,590,Application Data
1,2.0837400000000343,62.210.85.178,10.0.2.15,TCP,60,9001  >  35978 [ACK] Seq=22279853 Ack=412469629 Win=65535 Len=0
1,2.1910439999992377,54.93.77.70,10.0.2.15,TLSv1.2,590,Application Data
1,2.191397999999026,10.0.2.15,54.93.77.70,TLSv1.2,590,Application Data
1,2.1915009999993345,54.93.77.70,10.0.2.15,TCP,60,9001  >  34692 [ACK] Seq=412173433 Ack=22375757 Win=65535 Len=0
1,2.3031389999996463,62.210.85.178,10.0.2.15,TLSv1.2,590,Application Data
1,2.308744999998453,10.0.2.15,62.210.85.178,TLSv1.2,590,Application Data
1,2.3089249999993626,62.210.85.178,10.0.2.15,TCP,60,9001  >  35978 [ACK] Seq=22280389 Ack=412470165 Win=65535 Len=0
1,2.322451000000001,10.0.2.15,62.210.85.178,TLSv1.2,4124,Application Data
1,2.322556999999506,10.0.2.15,62.210.85.178,TCP,2974,35978  >  9001 [ACK] Seq=412474235 Ack=22280389 Win=65535 Len=2920 [TCP segment of a reassembled PDU]
1,2.3226049999993847,62.210.85.178,10.0.2.15,TCP,60,9001  >  35978 [ACK] Seq=22280389 Ack=412471625 Win=65535 Len=0
1,2.3226189999986673,62.210.85.178,10.0.2.15,TCP,60,9001  >  35978 [ACK] Seq=22280389 Ack=412473085 Win=65535 Len=0
1,2.322623999998541,62.210.85.178,10.0.2.15,TCP,60,9001  >  35978 [ACK] Seq=22280389 Ack=412474235 Win=65535 Len=0
1,2.3226269999995566,62.210.85.178,10.0.2.15,TCP,60,9001  >  35978 [ACK] Seq=22280389 Ack=412475695 Win=65535 Len=0
1,2.3226309999990917,62.210.85.178,10.0.2.15,TCP,60,9001  >  35978 [ACK] Seq=22280389 Ack=412477155 Win=65535 Len=0
1,2.3226660000000265,10.0.2.15,62.210.85.178,TLSv1.2,1204,Application Data
1,2.322699999998804,62.210.85.178,10.0.2.15,TCP,60,9001  >  35978 [ACK] Seq=22280389 Ack=412478305 Win=65535 Len=0
1,2.322744999999486,10.0.2.15,62.210.85.178,TLSv1.2,4124,Application Data
1,2.3227790000000823,62.210.85.178,10.0.2.15,TCP,60,9001  >  35978 [ACK] Seq=22280389 Ack=412479765 Win=65535 Len=0
1,2.322787999999491,62.210.85.178,10.0.2.15,TCP,60,9001  >  35978 [ACK] Seq=22280389 Ack=412481225 Win=65535 Len=0
1,2.3227909999986878,62.210.85.178,10.0.2.15,TCP,60,9001  >  35978 [ACK] Seq=22280389 Ack=412482375 Win=65535 Len=0
1,2.3228299999991577,10.0.2.15,62.210.85.178,TLSv1.2,4124,Application Data
1,2.3228629999994155,62.210.85.178,10.0.2.15,TCP,60,9001  >  35978 [ACK] Seq=22280389 Ack=412483835 Win=65535 Len=0
1,2.322870999998486,62.210.85.178,10.0.2.15,TCP,60,9001  >  35978 [ACK] Seq=22280389 Ack=412485295 Win=65535 Len=0
1,2.322930999998789,10.0.2.15,62.210.85.178,TLSv1.2,2974,Application Data
1,2.3229670000000624,62.210.85.178,10.0.2.15,TCP,60,9001  >  35978 [ACK] Seq=22280389 Ack=412486445 Win=65535 Len=0
1,2.322973999998794,62.210.85.178,10.0.2.15,TCP,60,9001  >  35978 [ACK] Seq=22280389 Ack=412487905 Win=65535 Len=0
1,2.3229780000001483,62.210.85.178,10.0.2.15,TCP,60,9001  >  35978 [ACK] Seq=22280389 Ack=412489365 Win=65535 Len=0
1,2.3230059999987134,10.0.2.15,62.210.85.178,TLSv1.2,1226,Application Data
1,2.3230399999993097,62.210.85.178,10.0.2.15,TCP,60,9001  >  35978 [ACK] Seq=22280389 Ack=412490537 Win=65535 Len=0
1,2.3230789999997796,10.0.2.15,62.210.85.178,TLSv1.2,4124,Application Data
1,2.3231139999988955,62.210.85.178,10.0.2.15,TCP,60,9001  >  35978 [ACK] Seq=22280389 Ack=412491997 Win=65535 Len=0
1,2.323120999999446,62.210.85.178,10.0.2.15,TCP,60,9001  >  35978 [ACK] Seq=22280389 Ack=412493457 Win=65535 Len=0
1,2.323123999998643,62.210.85.178,10.0.2.15,TCP,60,9001  >  35978 [ACK] Seq=22280389 Ack=412494607 Win=65535 Len=0
1,2.3231609999984357,10.0.2.15,62.210.85.178,TLSv1.2,3030,Application Data
1,2.3231959999993705,62.210.85.178,10.0.2.15,TCP,60,9001  >  35978 [ACK] Seq=22280389 Ack=412496067 Win=65535 Len=0
1,2.3232019999995828,62.210.85.178,10.0.2.15,TCP,60,9001  >  35978 [ACK] Seq=22280389 Ack=412497527 Win=65535 Len=0
1,2.3232049999987794,62.210.85.178,10.0.2.15,TCP,60,9001  >  35978 [ACK] Seq=22280389 Ack=412497583 Win=65535 Len=0
1,2.332459999999628,10.0.2.15,62.210.85.178,TLSv1.2,4124,Application Data
1,2.332539999999426,62.210.85.178,10.0.2.15,TCP,60,9001  >  35978 [ACK] Seq=22280389 Ack=412499043 Win=65535 Len=0
1,2.332550999999512,62.210.85.178,10.0.2.15,TCP,60,9001  >  35978 [ACK] Seq=22280389 Ack=412500503 Win=65535 Len=0
1,2.3325559999993857,62.210.85.178,10.0.2.15,TCP,60,9001  >  35978 [ACK] Seq=22280389 Ack=412501653 Win=65535 Len=0
1,2.3326039999992645,10.0.2.15,62.210.85.178,TLSv1.2,4124,Application Data
1,2.332656999999017,62.210.85.178,10.0.2.15,TCP,60,9001  >  35978 [ACK] Seq=22280389 Ack=412503113 Win=65535 Len=0
1,2.3326639999995677,62.210.85.178,10.0.2.15,TCP,60,9001  >  35978 [ACK] Seq=22280389 Ack=412504573 Win=65535 Len=0
1,2.3326669999987644,62.210.85.178,10.0.2.15,TCP,60,9001  >  35978 [ACK] Seq=22280389 Ack=412505723 Win=65535 Len=0
1,2.332704999998896,10.0.2.15,62.210.85.178,TLSv1.2,4124,Application Data
1,2.332738999999492,62.210.85.178,10.0.2.15,TCP,60,9001  >  35978 [ACK] Seq=22280389 Ack=412507183 Win=65535 Len=0
1,2.3327469999985624,62.210.85.178,10.0.2.15,TCP,60,9001  >  35978 [ACK] Seq=22280389 Ack=412508643 Win=65535 Len=0
1,2.332751999998436,62.210.85.178,10.0.2.15,TCP,60,9001  >  35978 [ACK] Seq=22280389 Ack=412509793 Win=65535 Len=0
1,2.332800000000134,10.0.2.15,62.210.85.178,TLSv1.2,4124,Application Data
1,2.3328329999985726,62.210.85.178,10.0.2.15,TCP,60,9001  >  35978 [ACK] Seq=22280389 Ack=412511253 Win=65535 Len=0
1,2.3328399999991234,62.210.85.178,10.0.2.15,TCP,60,9001  >  35978 [ACK] Seq=22280389 Ack=412512713 Win=65535 Len=0
1,2.332844999998997,62.210.85.178,10.0.2.15,TCP,60,9001  >  35978 [ACK] Seq=22280389 Ack=412513863 Win=65535 Len=0
1,2.332879999999932,10.0.2.15,62.210.85.178,TLSv1.2,332,Application Data
1,2.332911999999851,62.210.85.178,10.0.2.15,TCP,60,9001  >  35978 [ACK] Seq=22280389 Ack=412514141 Win=65535 Len=0
1,2.332965999999942,10.0.2.15,62.210.85.178,TLSv1.2,3868,Application Data
1,2.3330019999993965,62.210.85.178,10.0.2.15,TCP,60,9001  >  35978 [ACK] Seq=22280389 Ack=412515601 Win=65535 Len=0
1,2.3330089999999473,62.210.85.178,10.0.2.15,TCP,60,9001  >  35978 [ACK] Seq=22280389 Ack=412517061 Win=65535 Len=0
1,2.333011999999144,62.210.85.178,10.0.2.15,TCP,60,9001  >  35978 [ACK] Seq=22280389 Ack=412517955 Win=65535 Len=0
1,2.3330499999992753,10.0.2.15,62.210.85.178,TLSv1.2,4124,Application Data
1,2.3330839999998716,62.210.85.178,10.0.2.15,TCP,60,9001  >  35978 [ACK] Seq=22280389 Ack=412519415 Win=65535 Len=0
1,2.3330909999986034,62.210.85.178,10.0.2.15,TCP,60,9001  >  35978 [ACK] Seq=22280389 Ack=412520875 Win=65535 Len=0
1,2.333093999999619,62.210.85.178,10.0.2.15,TCP,60,9001  >  35978 [ACK] Seq=22280389 Ack=412522025 Win=65535 Len=0
1,2.333128999998735,10.0.2.15,62.210.85.178,TLSv1.2,3030,Application Data
1,2.333162999999331,62.210.85.178,10.0.2.15,TCP,60,9001  >  35978 [ACK] Seq=22280389 Ack=412523485 Win=65535 Len=0
1,2.333169999999882,62.210.85.178,10.0.2.15,TCP,60,9001  >  35978 [ACK] Seq=22280389 Ack=412524945 Win=65535 Len=0
1,2.3331729999990785,62.210.85.178,10.0.2.15,TCP,60,9001  >  35978 [ACK] Seq=22280389 Ack=412525001 Win=65535 Len=0
1,2.3455880000001343,10.0.2.15,62.210.85.178,TLSv1.2,4124,Application Data
1,2.3456939999996393,62.210.85.178,10.0.2.15,TCP,60,9001  >  35978 [ACK] Seq=22280389 Ack=412526461 Win=65535 Len=0
1,2.345709999999599,62.210.85.178,10.0.2.15,TCP,60,9001  >  35978 [ACK] Seq=22280389 Ack=412527921 Win=65535 Len=0
1,2.3457129999987956,62.210.85.178,10.0.2.15,TCP,60,9001  >  35978 [ACK] Seq=22280389 Ack=412529071 Win=65535 Len=0
1,2.345761999999013,10.0.2.15,62.210.85.178,TLSv1.2,4124,Application Data
1,2.3457979999984673,62.210.85.178,10.0.2.15,TCP,60,9001  >  35978 [ACK] Seq=22280389 Ack=412530531 Win=65535 Len=0
1,2.345806999999695,62.210.85.178,10.0.2.15,TCP,60,9001  >  35978 [ACK] Seq=22280389 Ack=412531991 Win=65535 Len=0
1,2.3458109999992303,62.210.85.178,10.0.2.15,TCP,60,9001  >  35978 [ACK] Seq=22280389 Ack=412533141 Win=65535 Len=0
1,2.3458469999986846,10.0.2.15,62.210.85.178,TLSv1.2,204,Application Data
1,2.3458819999996194,62.210.85.178,10.0.2.15,TCP,60,9001  >  35978 [ACK] Seq=22280389 Ack=412533291 Win=65535 Len=0
1,2.4148649999988265,54.93.77.70,10.0.2.15,TLSv1.2,590,Application Data
1,2.4574309999989055,10.0.2.15,54.93.77.70,TCP,54,34692  >  9001 [ACK] Seq=22375757 Ack=412173969 Win=65535 Len=0
1,2.499657999998817,54.93.77.70,10.0.2.15,TLSv1.2,4398,Application Data
1,2.499713999999585,10.0.2.15,54.93.77.70,TCP,54,34692  >  9001 [ACK] Seq=22375757 Ack=412178313 Win=65535 Len=0
1,2.501829999999245,54.93.77.70,10.0.2.15,TLSv1.2,7084,"Application Data, Application Data"
1,2.5018939999990835,10.0.2.15,54.93.77.70,TCP,54,34692  >  9001 [ACK] Seq=22375757 Ack=412185343 Win=65535 Len=0
1,2.511128000000099,54.93.77.70,10.0.2.15,TCP,2950,"9001  >  34692 [PSH, ACK] Seq=412185343 Ack=22375757 Win=65535 Len=2896 [TCP segment of a reassembled PDU]"
1,2.511172999998962,10.0.2.15,54.93.77.70,TCP,54,34692  >  9001 [ACK] Seq=22375757 Ack=412188239 Win=65535 Len=0
1,2.51745099999971,54.93.77.70,10.0.2.15,TLSv1.2,2950,Application Data [TCP segment of a reassembled PDU]
1,2.517491999999038,10.0.2.15,54.93.77.70,TCP,54,34692  >  9001 [ACK] Seq=22375757 Ack=412191135 Win=65535 Len=0
1,2.518203999999969,54.93.77.70,10.0.2.15,TLSv1.2,8742,"Application Data, Application Data"
1,2.518250999999509,10.0.2.15,54.93.77.70,TCP,54,34692  >  9001 [ACK] Seq=22375757 Ack=412199823 Win=65535 Len=0
1,2.5183059999999386,54.93.77.70,10.0.2.15,TLSv1.2,1596,Application Data
1,2.518337999999858,10.0.2.15,54.93.77.70,TCP,54,34692  >  9001 [ACK] Seq=22375757 Ack=412201365 Win=65535 Len=0
1,2.5186109999995097,10.0.2.15,54.93.77.70,TLSv1.2,1104,Application Data
1,2.5186809999995603,54.93.77.70,10.0.2.15,TCP,60,9001  >  34692 [ACK] Seq=412201365 Ack=22376807 Win=65535 Len=0
1,2.521921999999904,54.93.77.70,10.0.2.15,TCP,2950,"9001  >  34692 [PSH, ACK] Seq=412201365 Ack=22376807 Win=65535 Len=2896 [TCP segment of a reassembled PDU]"
1,2.5219879999986006,10.0.2.15,54.93.77.70,TCP,54,34692  >  9001 [ACK] Seq=22376807 Ack=412204261 Win=65535 Len=0
1,2.529765999999654,54.93.77.70,10.0.2.15,TLSv1.2,5846,"Application Data, Application Data"
1,2.529826999998477,10.0.2.15,54.93.77.70,TCP,54,34692  >  9001 [ACK] Seq=22376807 Ack=412210053 Win=65535 Len=0
1,2.5309479999996256,54.93.77.70,10.0.2.15,TCP,2950,"9001  >  34692 [PSH, ACK] Seq=412210053 Ack=22376807 Win=65535 Len=2896 [TCP segment of a reassembled PDU]"
1,2.5309889999989537,10.0.2.15,54.93.77.70,TCP,54,34692  >  9001 [ACK] Seq=22376807 Ack=412212949 Win=65535 Len=0
1,2.5316299999994953,54.93.77.70,10.0.2.15,TLSv1.2,1502,Application Data [TCP segment of a reassembled PDU]
1,2.5316709999988234,10.0.2.15,54.93.77.70,TCP,54,34692  >  9001 [ACK] Seq=22376807 Ack=412214397 Win=65535 Len=0
1,2.5348549999998795,54.93.77.70,10.0.2.15,TLSv1.2,2950,Application Data [TCP segment of a reassembled PDU]
1,2.534914999998364,10.0.2.15,54.93.77.70,TCP,54,34692  >  9001 [ACK] Seq=22376807 Ack=412217293 Win=65535 Len=0
1,2.5361290000000736,54.93.77.70,10.0.2.15,TLSv1.2,7924,"Application Data, Application Data, Application Data"
1,2.5362199999999575,10.0.2.15,54.93.77.70,TCP,54,34692  >  9001 [ACK] Seq=22376807 Ack=412225163 Win=65535 Len=0
1,2.536543000000165,10.0.2.15,54.93.77.70,TLSv1.2,590,Application Data
1,2.5366399999984424,54.93.77.70,10.0.2.15,TCP,60,9001  >  34692 [ACK] Seq=412225163 Ack=22377343 Win=65535 Len=0
1,2.53975999999966,54.93.77.70,10.0.2.15,TCP,2950,"9001  >  34692 [PSH, ACK] Seq=412225163 Ack=22377343 Win=65535 Len=2896 [TCP segment of a reassembled PDU]"
1,2.539906999998493,10.0.2.15,54.93.77.70,TCP,54,34692  >  9001 [ACK] Seq=22377343 Ack=412228059 Win=65535 Len=0
1,2.54067699999905,54.93.77.70,10.0.2.15,TLSv1.2,7294,"Application Data, Application Data"
1,2.5407579999991867,10.0.2.15,54.93.77.70,TCP,54,34692  >  9001 [ACK] Seq=22377343 Ack=412235299 Win=65535 Len=0
1,2.541704999999638,54.93.77.70,10.0.2.15,TCP,1502,"9001  >  34692 [PSH, ACK] Seq=412235299 Ack=22377343 Win=65535 Len=1448 [TCP segment of a reassembled PDU]"
1,2.5417559999987134,10.0.2.15,54.93.77.70,TCP,54,34692  >  9001 [ACK] Seq=22377343 Ack=412236747 Win=65535 Len=0
1,2.5520999999989726,54.93.77.70,10.0.2.15,TLSv1.2,358,Application Data
1,2.5548889999990934,10.0.2.15,54.93.77.70,TLSv1.2,590,Application Data
1,2.55503299999873,54.93.77.70,10.0.2.15,TCP,60,9001  >  34692 [ACK] Seq=412237051 Ack=22377879 Win=65535 Len=0
1,2.620512999999846,62.210.85.178,10.0.2.15,TLSv1.2,1104,Application Data
1,2.6613849999994272,10.0.2.15,62.210.85.178,TCP,54,35978  >  9001 [ACK] Seq=412533291 Ack=22281439 Win=65535 Len=0
1,2.801942999998573,62.210.85.178,10.0.2.15,TLSv1.2,1104,Application Data
1,2.8020199999991746,10.0.2.15,62.210.85.178,TCP,54,35978  >  9001 [ACK] Seq=412533291 Ack=22282489 Win=65535 Len=0
1,2.8024919999988924,10.0.2.15,62.210.85.178,TLSv1.2,590,Application Data
1,2.802592000000004,62.210.85.178,10.0.2.15,TCP,60,9001  >  35978 [ACK] Seq=22282489 Ack=412533827 Win=65535 Len=0
1,3.1065439999983937,54.93.77.70,10.0.2.15,TLSv1.2,590,Application Data
1,3.1069919999990816,10.0.2.15,54.93.77.70,TLSv1.2,590,Application Data
1,3.107140000000072,54.93.77.70,10.0.2.15,TCP,60,9001  >  34692 [ACK] Seq=412237587 Ack=22378415 Win=65535 Len=0
1,3.2193529999985913,62.210.85.178,10.0.2.15,TLSv1.2,590,Application Data
1,3.223331999999573,10.0.2.15,62.210.85.178,TLSv1.2,590,Application Data
1,3.223519999999553,62.210.85.178,10.0.2.15,TCP,60,9001  >  35978 [ACK] Seq=22283025 Ack=412534363 Win=65535 Len=0
1,3.23419499999909,10.0.2.15,62.210.85.178,TLSv1.2,4124,Application Data
1,3.234294999998383,10.0.2.15,62.210.85.178,TCP,1514,35978  >  9001 [ACK] Seq=412538433 Ack=22283025 Win=65535 Len=1460 [TCP segment of a reassembled PDU]
1,3.234337999998388,62.210.85.178,10.0.2.15,TCP,60,9001  >  35978 [ACK] Seq=22283025 Ack=412535823 Win=65535 Len=0
1,3.2343479999999545,62.210.85.178,10.0.2.15,TCP,60,9001  >  35978 [ACK] Seq=22283025 Ack=412537283 Win=65535 Len=0
1,3.234352999999828,62.210.85.178,10.0.2.15,TCP,60,9001  >  35978 [ACK] Seq=22283025 Ack=412538433 Win=65535 Len=0
1,3.234357999999702,62.210.85.178,10.0.2.15,TCP,60,9001  >  35978 [ACK] Seq=22283025 Ack=412539893 Win=65535 Len=0
1,3.2344059999995807,10.0.2.15,62.210.85.178,TLSv1.2,1250,Application Data
1,3.234497999999803,62.210.85.178,10.0.2.15,TCP,60,9001  >  35978 [ACK] Seq=22283025 Ack=412541089 Win=65535 Len=0
1,3.310165999999299,54.93.77.70,10.0.2.15,TLSv1.2,590,Application Data
1,3.353401999998823,10.0.2.15,54.93.77.70,TCP,54,34692  >  9001 [ACK] Seq=22378415 Ack=412238123 Win=65535 Len=0
1,3.386423999998442,54.93.77.70,10.0.2.15,TLSv1.2,3674,Application Data
1,3.3864829999984067,10.0.2.15,54.93.77.70,TCP,54,34692  >  9001 [ACK] Seq=22378415 Ack=412241743 Win=65535 Len=0
1,3.3980759999994916,54.93.77.70,10.0.2.15,TCP,2950,"9001  >  34692 [PSH, ACK] Seq=412241743 Ack=22378415 Win=65535 Len=2896 [TCP segment of a reassembled PDU]"
1,3.398130999999921,10.0.2.15,54.93.77.70,TCP,54,34692  >  9001 [ACK] Seq=22378415 Ack=412244639 Win=65535 Len=0
1,3.4021609999999782,54.93.77.70,10.0.2.15,TLSv1.2,264,Application Data
1,3.4022019999993063,10.0.2.15,54.93.77.70,TCP,54,34692  >  9001 [ACK] Seq=22378415 Ack=412244849 Win=65535 Len=0
1,3.4043129999990924,10.0.2.15,54.93.77.70,TLSv1.2,590,Application Data
1,3.4044579999990674,54.93.77.70,10.0.2.15,TCP,60,9001  >  34692 [ACK] Seq=412244849 Ack=22378951 Win=65535 Len=0
1,3.618416999999681,62.210.85.178,10.0.2.15,TLSv1.2,590,Application Data
1,3.6187749999990046,10.0.2.15,62.210.85.178,TLSv1.2,590,Application Data
1,3.618912999998429,62.210.85.178,10.0.2.15,TCP,60,9001  >  35978 [ACK] Seq=22283561 Ack=412541625 Win=65535 Len=0
1,3.69813399999839,54.93.77.70,10.0.2.15,TLSv1.2,590,Application Data
1,3.698512999999366,10.0.2.15,54.93.77.70,TLSv1.2,590,Application Data
1,3.698612999998659,54.93.77.70,10.0.2.15,TCP,60,9001  >  34692 [ACK] Seq=412245385 Ack=22379487 Win=65535 Len=0
1,3.8052109999989625,62.210.85.178,10.0.2.15,TLSv1.2,590,Application Data
1,3.8081399999991845,10.0.2.15,62.210.85.178,TLSv1.2,590,Application Data
1,3.8082999999987805,62.210.85.178,10.0.2.15,TCP,60,9001  >  35978 [ACK] Seq=22284097 Ack=412542161 Win=65535 Len=0
1,3.818182999999408,10.0.2.15,62.210.85.178,TLSv1.2,4124,Application Data
1,3.818268999999418,10.0.2.15,62.210.85.178,TCP,2974,35978  >  9001 [ACK] Seq=412546231 Ack=22284097 Win=65535 Len=2920 [TCP segment of a reassembled PDU]
1,3.8183119999994233,62.210.85.178,10.0.2.15,TCP,60,9001  >  35978 [ACK] Seq=22284097 Ack=412543621 Win=65535 Len=0
1,3.8183239999998477,62.210.85.178,10.0.2.15,TCP,60,9001  >  35978 [ACK] Seq=22284097 Ack=412545081 Win=65535 Len=0
1,3.81833000000006,62.210.85.178,10.0.2.15,TCP,60,9001  >  35978 [ACK] Seq=22284097 Ack=412546231 Win=65535 Len=0
1,3.8183329999992566,62.210.85.178,10.0.2.15,TCP,60,9001  >  35978 [ACK] Seq=22284097 Ack=412547691 Win=65535 Len=0
1,3.818335999998453,62.210.85.178,10.0.2.15,TCP,60,9001  >  35978 [ACK] Seq=22284097 Ack=412549151 Win=65535 Len=0
1,3.818368999998711,10.0.2.15,62.210.85.178,TLSv1.2,1204,Application Data
1,3.818433999998888,62.210.85.178,10.0.2.15,TCP,60,9001  >  35978 [ACK] Seq=22284097 Ack=412550301 Win=65535 Len=0
1,3.818489999999656,10.0.2.15,62.210.85.178,TLSv1.2,1232,Application Data
1,3.818896999999197,62.210.85.178,10.0.2.15,TCP,60,9001  >  35978 [ACK] Seq=22284097 Ack=412551479 Win=65535 Len=0
1,3.9007309999997233,54.93.77.70,10.0.2.15,TLSv1.2,590,Application Data
1,3.9357249999993655,54.93.77.70,10.0.2.15,TLSv1.2,3674,Application Data
1,3.9357899999995425,10.0.2.15,54.93.77.70,TCP,54,34692  >  9001 [ACK] Seq=22379487 Ack=412249541 Win=65535 Len=0
1,3.94669199999953,54.93.77.70,10.0.2.15,TCP,2950,"9001  >  34692 [PSH, ACK] Seq=412249541 Ack=22379487 Win=65535 Len=2896 [TCP segment of a reassembled PDU]"
1,3.946771999999328,10.0.2.15,54.93.77.70,TCP,54,34692  >  9001 [ACK] Seq=22379487 Ack=412252437 Win=65535 Len=0
1,3.953217999998742,54.93.77.70,10.0.2.15,TLSv1.2,778,Application Data
1,3.993371999998999,10.0.2.15,54.93.77.70,TCP,54,34692  >  9001 [ACK] Seq=22379487 Ack=412253161 Win=65535 Len=0
1,4.1309499999988475,54.93.77.70,10.0.2.15,TLSv1.2,590,Application Data
1,4.131022999999914,10.0.2.15,54.93.77.70,TCP,54,34692  >  9001 [ACK] Seq=22379487 Ack=412253697 Win=65535 Len=0
1,4.131225999999515,10.0.2.15,54.93.77.70,TLSv1.2,590,Application Data
1,4.131339999999909,54.93.77.70,10.0.2.15,TCP,60,9001  >  34692 [ACK] Seq=412253697 Ack=22380023 Win=65535 Len=0
1,4.18728099999862,54.93.77.70,10.0.2.15,TLSv1.2,1618,Application Data
1,4.18741399999999,10.0.2.15,54.93.77.70,TCP,54,34692  >  9001 [ACK] Seq=22380023 Ack=412255261 Win=65535 Len=0
1,4.190279999998893,10.0.2.15,54.93.77.70,TLSv1.2,590,Application Data
1,4.190464999999676,54.93.77.70,10.0.2.15,TCP,60,9001  >  34692 [ACK] Seq=412255261 Ack=22380559 Win=65535 Len=0
1,4.241500000000087,62.210.85.178,10.0.2.15,TLSv1.2,590,Application Data
1,4.285417999999481,10.0.2.15,62.210.85.178,TCP,54,35978  >  9001 [ACK] Seq=412551479 Ack=22284633 Win=65535 Len=0
1,4.372878000000128,62.210.85.178,10.0.2.15,TLSv1.2,590,Application Data
1,4.372953999998572,10.0.2.15,62.210.85.178,TCP,54,35978  >  9001 [ACK] Seq=412551479 Ack=22285169 Win=65535 Len=0
1,4.373474999998507,10.0.2.15,62.210.85.178,TLSv1.2,590,Application Data
1,4.373689000000013,62.210.85.178,10.0.2.15,TCP,60,9001  >  35978 [ACK] Seq=22285169 Ack=412552015 Win=65535 Len=0
1,4.54106899999897,54.93.77.70,10.0.2.15,TLSv1.2,590,Application Data
1,4.541908999999578,10.0.2.15,54.93.77.70,TLSv1.2,590,Application Data
1,4.54207999999926,54.93.77.70,10.0.2.15,TCP,60,9001  >  34692 [ACK] Seq=412255797 Ack=22381095 Win=65535 Len=0
1,4.636096999998699,62.210.85.178,10.0.2.15,TLSv1.2,590,Application Data
1,4.641777999999249,10.0.2.15,62.210.85.178,TLSv1.2,590,Application Data
1,4.641939999999522,62.210.85.178,10.0.2.15,TCP,60,9001  >  35978 [ACK] Seq=22285705 Ack=412552551 Win=65535 Len=0
1,4.6544489999996586,10.0.2.15,62.210.85.178,TLSv1.2,4124,Application Data
1,4.6545790000000125,10.0.2.15,62.210.85.178,TCP,2974,35978  >  9001 [ACK] Seq=412556621 Ack=22285705 Win=65535 Len=2920 [TCP segment of a reassembled PDU]
1,4.654626999999891,62.210.85.178,10.0.2.15,TCP,60,9001  >  35978 [ACK] Seq=22285705 Ack=412554011 Win=65535 Len=0
1,4.654637999999977,62.210.85.178,10.0.2.15,TCP,60,9001  >  35978 [ACK] Seq=22285705 Ack=412555471 Win=65535 Len=0
1,4.654642999999851,62.210.85.178,10.0.2.15,TCP,60,9001  >  35978 [ACK] Seq=22285705 Ack=412556621 Win=65535 Len=0
1,4.654647999999725,62.210.85.178,10.0.2.15,TCP,60,9001  >  35978 [ACK] Seq=22285705 Ack=412558081 Win=65535 Len=0
1,4.654652999999598,62.210.85.178,10.0.2.15,TCP,60,9001  >  35978 [ACK] Seq=22285705 Ack=412559541 Win=65535 Len=0
1,4.6546979999984615,10.0.2.15,62.210.85.178,TLSv1.2,1204,Application Data
1,4.654769999999189,10.0.2.15,62.210.85.178,TCP,2974,35978  >  9001 [ACK] Seq=412560691 Ack=22285705 Win=65535 Len=2920 [TCP segment of a reassembled PDU]
1,4.654807999999321,62.210.85.178,10.0.2.15,TCP,60,9001  >  35978 [ACK] Seq=22285705 Ack=412560691 Win=65535 Len=0
1,4.654814999999871,62.210.85.178,10.0.2.15,TCP,60,9001  >  35978 [ACK] Seq=22285705 Ack=412562151 Win=65535 Len=0
1,4.6548189999994065,62.210.85.178,10.0.2.15,TCP,60,9001  >  35978 [ACK] Seq=22285705 Ack=412563611 Win=65535 Len=0
1,4.654859999998735,10.0.2.15,62.210.85.178,TLSv1.2,1204,Application Data
1,4.654926999999589,62.210.85.178,10.0.2.15,TCP,60,9001  >  35978 [ACK] Seq=22285705 Ack=412564761 Win=65535 Len=0
1,4.6549789999990026,10.0.2.15,62.210.85.178,TLSv1.2,4124,Application Data
1,4.655072999999902,62.210.85.178,10.0.2.15,TCP,60,9001  >  35978 [ACK] Seq=22285705 Ack=412566221 Win=65535 Len=0
1,4.655081999999311,62.210.85.178,10.0.2.15,TCP,60,9001  >  35978 [ACK] Seq=22285705 Ack=412567681 Win=65535 Len=0
1,4.655085999998846,62.210.85.178,10.0.2.15,TCP,60,9001  >  35978 [ACK] Seq=22285705 Ack=412568831 Win=65535 Len=0
1,4.655118999999104,10.0.2.15,62.210.85.178,TLSv1.2,332,Application Data
1,4.655155999998897,62.210.85.178,10.0.2.15,TCP,60,9001  >  35978 [ACK] Seq=22285705 Ack=412569109 Win=65535 Len=0
1,4.655202999998437,10.0.2.15,62.210.85.178,TLSv1.2,3868,Application Data
1,4.655243999999584,62.210.85.178,10.0.2.15,TCP,60,9001  >  35978 [ACK] Seq=22285705 Ack=412570569 Win=65535 Len=0
1,4.655249999999796,62.210.85.178,10.0.2.15,TCP,60,9001  >  35978 [ACK] Seq=22285705 Ack=412572029 Win=65535 Len=0
1,4.65525499999967,62.210.85.178,10.0.2.15,TCP,60,9001  >  35978 [ACK] Seq=22285705 Ack=412572923 Win=65535 Len=0
1,4.655300999998872,10.0.2.15,62.210.85.178,TLSv1.2,2966,Application Data
1,4.655342000000019,62.210.85.178,10.0.2.15,TCP,60,9001  >  35978 [ACK] Seq=22285705 Ack=412574383 Win=65535 Len=0
1,4.6553489999987505,62.210.85.178,10.0.2.15,TCP,60,9001  >  35978 [ACK] Seq=22285705 Ack=412575835 Win=65535 Len=0
1,4.7427649999990535,54.93.77.70,10.0.2.15,TLSv1.2,3674,Application Data
1,4.742882999998983,10.0.2.15,54.93.77.70,TCP,54,34692  >  9001 [ACK] Seq=22381095 Ack=412259417 Win=65535 Len=0
1,4.770764999999301,54.93.77.70,10.0.2.15,TLSv1.2,3674,Application Data
1,4.770837999998548,10.0.2.15,54.93.77.70,TCP,54,34692  >  9001 [ACK] Seq=22381095 Ack=412263037 Win=65535 Len=0
1,4.786326999999801,54.93.77.70,10.0.2.15,TLSv1.2,2950,Application Data
1,4.78642199999922,10.0.2.15,54.93.77.70,TCP,54,34692  >  9001 [ACK] Seq=22381095 Ack=412265933 Win=65535 Len=0
1,4.787319999999454,54.93.77.70,10.0.2.15,TLSv1.2,1314,Application Data
1,4.793605999999272,54.93.77.70,10.0.2.15,TLSv1.2,5846,Application Data
1,4.793678,10.0.2.15,54.93.77.70,TCP,54,34692  >  9001 [ACK] Seq=22381095 Ack=412272985 Win=65535 Len=0
1,4.7945959999997285,54.93.77.70,10.0.2.15,TCP,1502,"9001  >  34692 [PSH, ACK] Seq=412272985 Ack=22381095 Win=65535 Len=1448 [TCP segment of a reassembled PDU]"
1,4.794637999999395,10.0.2.15,54.93.77.70,TCP,54,34692  >  9001 [ACK] Seq=22381095 Ack=412274433 Win=65535 Len=0
1,4.812060999998721,54.93.77.70,10.0.2.15,TLSv1.2,568,Application Data
1,4.8148179999989225,54.93.77.70,10.0.2.15,TCP,2950,"9001  >  34692 [PSH, ACK] Seq=412274947 Ack=22381095 Win=65535 Len=2896 [TCP segment of a reassembled PDU]"
1,4.814883999999438,10.0.2.15,54.93.77.70,TCP,54,34692  >  9001 [ACK] Seq=22381095 Ack=412277843 Win=65535 Len=0
1,4.826522999999725,54.93.77.70,10.0.2.15,TLSv1.2,1502,Application Data [TCP segment of a reassembled PDU]
1,4.82656599999973,10.0.2.15,54.93.77.70,TCP,54,34692  >  9001 [ACK] Seq=22381095 Ack=412279291 Win=65535 Len=0
1,4.829191999999239,54.93.77.70,10.0.2.15,TLSv1.2,380,Application Data
