No.,Time,Source,Destination,Protocol,Length,Info
1,0.027820999999676133,10.0.2.15,54.93.77.70,TCP,54,34692  >  9001 [ACK] Seq=22478787 Ack=413743635 Win=65535 Len=0
1,0.13098300000092422,10.0.2.15,54.93.77.70,TLSv1.2,590,Application Data
1,0.13116400000035355,54.93.77.70,10.0.2.15,TCP,60,9001  >  34692 [ACK] Seq=413743635 Ack=22479323 Win=65535 Len=0
1,0.2478609999998298,62.210.85.178,10.0.2.15,TLSv1.2,590,Application Data
1,0.24846500000057858,10.0.2.15,62.210.85.178,TLSv1.2,590,Application Data
1,0.2486060000010184,62.210.85.178,10.0.2.15,TCP,60,9001  >  35978 [ACK] Seq=22383625 Ack=414040125 Win=65535 Len=0
1,0.3473370000010618,54.93.77.70,10.0.2.15,TLSv1.2,590,Application Data
1,0.347407999999632,10.0.2.15,54.93.77.70,TCP,54,34692  >  9001 [ACK] Seq=22479323 Ack=413744171 Win=65535 Len=0
1,0.34784600000057253,10.0.2.15,54.93.77.70,TLSv1.2,1618,Application Data
1,0.3479930000012246,54.93.77.70,10.0.2.15,TCP,60,9001  >  34692 [ACK] Seq=413744171 Ack=22480783 Win=65535 Len=0
1,0.34800600000016857,54.93.77.70,10.0.2.15,TCP,60,9001  >  34692 [ACK] Seq=413744171 Ack=22480887 Win=65535 Len=0
1,0.45513500000015483,62.210.85.178,10.0.2.15,TLSv1.2,1618,Application Data
1,0.45527100000072096,10.0.2.15,62.210.85.178,TCP,54,35978  >  9001 [ACK] Seq=414040125 Ack=22385189 Win=65535 Len=0
1,0.4745650000004389,10.0.2.15,62.210.85.178,TLSv1.2,590,Application Data
1,0.47476500000084343,62.210.85.178,10.0.2.15,TCP,60,9001  >  35978 [ACK] Seq=22385189 Ack=414040661 Win=65535 Len=0
1,0.48644700000113517,10.0.2.15,62.210.85.178,TLSv1.2,1618,Application Data
1,0.4866089999995893,62.210.85.178,10.0.2.15,TCP,60,9001  >  35978 [ACK] Seq=22385189 Ack=414042121 Win=65535 Len=0
1,0.4866280000005645,62.210.85.178,10.0.2.15,TCP,60,9001  >  35978 [ACK] Seq=22385189 Ack=414042225 Win=65535 Len=0
1,0.6722700000009354,54.93.77.70,10.0.2.15,TLSv1.2,2132,Application Data
1,0.6724229999999807,10.0.2.15,54.93.77.70,TCP,54,34692  >  9001 [ACK] Seq=22480887 Ack=413746249 Win=65535 Len=0
1,0.6751199999998789,10.0.2.15,54.93.77.70,TLSv1.2,590,Application Data
1,0.6753160000007483,54.93.77.70,10.0.2.15,TCP,60,9001  >  34692 [ACK] Seq=413746249 Ack=22481423 Win=65535 Len=0
1,0.7764569999999367,62.210.85.178,10.0.2.15,TLSv1.2,590,Application Data
1,0.7768250000008265,10.0.2.15,62.210.85.178,TLSv1.2,590,Application Data
1,0.7769680000001244,62.210.85.178,10.0.2.15,TCP,60,9001  >  35978 [ACK] Seq=22385725 Ack=414042761 Win=65535 Len=0
1,0.9793210000007093,54.93.77.70,10.0.2.15,TLSv1.2,590,Application Data
1,0.9796999999998661,10.0.2.15,54.93.77.70,TLSv1.2,590,Application Data
1,0.9797959999996237,54.93.77.70,10.0.2.15,TCP,60,9001  >  34692 [ACK] Seq=413746785 Ack=22481959 Win=65535 Len=0
1,1.0969550000008894,62.210.85.178,10.0.2.15,TLSv1.2,590,Application Data
1,1.1034159999999247,10.0.2.15,62.210.85.178,TLSv1.2,590,Application Data
1,1.1036160000003292,62.210.85.178,10.0.2.15,TCP,60,9001  >  35978 [ACK] Seq=22386261 Ack=414043297 Win=65535 Len=0
1,1.1149679999998625,10.0.2.15,62.210.85.178,TLSv1.2,4124,Application Data
1,1.1150799999995797,10.0.2.15,62.210.85.178,TCP,2974,35978  >  9001 [ACK] Seq=414047367 Ack=22386261 Win=65535 Len=2920 [TCP segment of a reassembled PDU]
1,1.1151239999999234,62.210.85.178,10.0.2.15,TCP,60,9001  >  35978 [ACK] Seq=22386261 Ack=414044757 Win=65535 Len=0
1,1.1151339999996708,62.210.85.178,10.0.2.15,TCP,60,9001  >  35978 [ACK] Seq=22386261 Ack=414046217 Win=65535 Len=0
1,1.1151389999995445,62.210.85.178,10.0.2.15,TCP,60,9001  >  35978 [ACK] Seq=22386261 Ack=414047367 Win=65535 Len=0
1,1.1151440000012371,62.210.85.178,10.0.2.15,TCP,60,9001  >  35978 [ACK] Seq=22386261 Ack=414048827 Win=65535 Len=0
1,1.1151480000007723,62.210.85.178,10.0.2.15,TCP,60,9001  >  35978 [ACK] Seq=22386261 Ack=414050287 Win=65535 Len=0
1,1.115192000001116,10.0.2.15,62.210.85.178,TLSv1.2,1204,Application Data
1,1.1152620000011666,10.0.2.15,62.210.85.178,TCP,2974,35978  >  9001 [ACK] Seq=414051437 Ack=22386261 Win=65535 Len=2920 [TCP segment of a reassembled PDU]
1,1.1153020000001561,62.210.85.178,10.0.2.15,TCP,60,9001  >  35978 [ACK] Seq=22386261 Ack=414051437 Win=65535 Len=0
1,1.1153090000007069,62.210.85.178,10.0.2.15,TCP,60,9001  >  35978 [ACK] Seq=22386261 Ack=414052897 Win=65535 Len=0
1,1.1153140000005806,62.210.85.178,10.0.2.15,TCP,60,9001  >  35978 [ACK] Seq=22386261 Ack=414054357 Win=65535 Len=0
1,1.1153480000011768,10.0.2.15,62.210.85.178,TLSv1.2,1204,Application Data
1,1.1154129999995348,10.0.2.15,62.210.85.178,TCP,2974,35978  >  9001 [ACK] Seq=414055507 Ack=22386261 Win=65535 Len=2920 [TCP segment of a reassembled PDU]
1,1.1154500000011467,62.210.85.178,10.0.2.15,TCP,60,9001  >  35978 [ACK] Seq=22386261 Ack=414055507 Win=65535 Len=0
1,1.11545599999954,62.210.85.178,10.0.2.15,TCP,60,9001  >  35978 [ACK] Seq=22386261 Ack=414056967 Win=65535 Len=0
1,1.1154610000012326,62.210.85.178,10.0.2.15,TCP,60,9001  >  35978 [ACK] Seq=22386261 Ack=414058427 Win=65535 Len=0
1,1.1154920000008133,10.0.2.15,62.210.85.178,TLSv1.2,1204,Application Data
1,1.1155710000002728,10.0.2.15,62.210.85.178,TLSv1.2,2974,Application Data
1,1.1156110000010813,62.210.85.178,10.0.2.15,TCP,60,9001  >  35978 [ACK] Seq=22386261 Ack=414059577 Win=65535 Len=0
1,1.115617999999813,62.210.85.178,10.0.2.15,TCP,60,9001  >  35978 [ACK] Seq=22386261 Ack=414061037 Win=65535 Len=0
1,1.1156220000011672,62.210.85.178,10.0.2.15,TCP,60,9001  >  35978 [ACK] Seq=22386261 Ack=414062497 Win=65535 Len=0
1,1.1156540000010864,10.0.2.15,62.210.85.178,TLSv1.2,1226,Application Data
1,1.1157160000002477,10.0.2.15,62.210.85.178,TCP,2974,35978  >  9001 [ACK] Seq=414063669 Ack=22386261 Win=65535 Len=2920 [TCP segment of a reassembled PDU]
1,1.115751999999702,62.210.85.178,10.0.2.15,TCP,60,9001  >  35978 [ACK] Seq=22386261 Ack=414063669 Win=65535 Len=0
1,1.1157590000002529,62.210.85.178,10.0.2.15,TCP,60,9001  >  35978 [ACK] Seq=22386261 Ack=414065129 Win=65535 Len=0
1,1.1157640000001265,62.210.85.178,10.0.2.15,TCP,60,9001  >  35978 [ACK] Seq=22386261 Ack=414066589 Win=65535 Len=0
1,1.1157949999997072,10.0.2.15,62.210.85.178,TLSv1.2,1204,Application Data
1,1.1158310000009806,62.210.85.178,10.0.2.15,TCP,60,9001  >  35978 [ACK] Seq=22386261 Ack=414067739 Win=65535 Len=0
1,1.1158749999995052,10.0.2.15,62.210.85.178,TLSv1.2,3030,Application Data
1,1.1159150000003137,62.210.85.178,10.0.2.15,TCP,60,9001  >  35978 [ACK] Seq=22386261 Ack=414069199 Win=65535 Len=0
1,1.1159220000008645,62.210.85.178,10.0.2.15,TCP,60,9001  >  35978 [ACK] Seq=22386261 Ack=414070659 Win=65535 Len=0
1,1.1159270000007382,62.210.85.178,10.0.2.15,TCP,60,9001  >  35978 [ACK] Seq=22386261 Ack=414070715 Win=65535 Len=0
1,1.1251000000011118,10.0.2.15,62.210.85.178,TLSv1.2,4124,Application Data
1,1.1251800000009098,10.0.2.15,62.210.85.178,TCP,2974,35978  >  9001 [ACK] Seq=414074785 Ack=22386261 Win=65535 Len=2920 [TCP segment of a reassembled PDU]
1,1.1252170000007027,62.210.85.178,10.0.2.15,TCP,60,9001  >  35978 [ACK] Seq=22386261 Ack=414072175 Win=65535 Len=0
1,1.1252260000001115,62.210.85.178,10.0.2.15,TCP,60,9001  >  35978 [ACK] Seq=22386261 Ack=414073635 Win=65535 Len=0
1,1.1252309999999852,62.210.85.178,10.0.2.15,TCP,60,9001  >  35978 [ACK] Seq=22386261 Ack=414074785 Win=65535 Len=0
1,1.1252349999995204,62.210.85.178,10.0.2.15,TCP,60,9001  >  35978 [ACK] Seq=22386261 Ack=414076245 Win=65535 Len=0
1,1.1252390000008745,62.210.85.178,10.0.2.15,TCP,60,9001  >  35978 [ACK] Seq=22386261 Ack=414077705 Win=65535 Len=0
1,1.1252779999995255,10.0.2.15,62.210.85.178,TLSv1.2,1204,Application Data
1,1.1253429999997024,10.0.2.15,62.210.85.178,TCP,1514,35978  >  9001 [ACK] Seq=414078855 Ack=22386261 Win=65535 Len=1460 [TCP segment of a reassembled PDU]
1,1.1253790000009758,62.210.85.178,10.0.2.15,TCP,60,9001  >  35978 [ACK] Seq=22386261 Ack=414078855 Win=65535 Len=0
1,1.125385000001188,62.210.85.178,10.0.2.15,TCP,60,9001  >  35978 [ACK] Seq=22386261 Ack=414080315 Win=65535 Len=0
1,1.1254179999996268,10.0.2.15,62.210.85.178,TLSv1.2,286,Application Data
1,1.1255089999995107,62.210.85.178,10.0.2.15,TCP,60,9001  >  35978 [ACK] Seq=22386261 Ack=414080547 Win=65535 Len=0
1,1.2532640000008541,54.93.77.70,10.0.2.15,TLSv1.2,590,Application Data
1,1.262817000000723,54.93.77.70,10.0.2.15,TCP,2950,"9001  >  34692 [PSH, ACK] Seq=413747321 Ack=22481959 Win=65535 Len=2896 [TCP segment of a reassembled PDU]"
1,1.2629090000009455,10.0.2.15,54.93.77.70,TCP,54,34692  >  9001 [ACK] Seq=22481959 Ack=413750217 Win=65535 Len=0
1,1.269824000000881,54.93.77.70,10.0.2.15,TLSv1.2,778,Application Data
1,1.270330000001195,54.93.77.70,10.0.2.15,TCP,2950,"9001  >  34692 [PSH, ACK] Seq=413750941 Ack=22481959 Win=65535 Len=2896 [TCP segment of a reassembled PDU]"
1,1.2703730000012001,10.0.2.15,54.93.77.70,TCP,54,34692  >  9001 [ACK] Seq=22481959 Ack=413753837 Win=65535 Len=0
1,1.2807020000000193,54.93.77.70,10.0.2.15,TLSv1.2,5846,"Application Data, Application Data, Application Data"
1,1.2807860000011715,10.0.2.15,54.93.77.70,TCP,54,34692  >  9001 [ACK] Seq=22481959 Ack=413759629 Win=65535 Len=0
1,1.2808760000007169,54.93.77.70,10.0.2.15,TCP,2950,"9001  >  34692 [PSH, ACK] Seq=413759629 Ack=22481959 Win=65535 Len=2896 [TCP segment of a reassembled PDU]"
1,1.2809900000011112,10.0.2.15,54.93.77.70,TCP,54,34692  >  9001 [ACK] Seq=22481959 Ack=413762525 Win=65535 Len=0
1,1.285890000001018,54.93.77.70,10.0.2.15,TLSv1.2,380,Application Data
1,1.2912200000009761,54.93.77.70,10.0.2.15,TLSv1.2,5846,Application Data
1,1.2912670000005164,10.0.2.15,54.93.77.70,TCP,54,34692  >  9001 [ACK] Seq=22481959 Ack=413768643 Win=65535 Len=0
1,1.2914620000010473,10.0.2.15,54.93.77.70,TLSv1.2,590,Application Data
1,1.2915769999999611,54.93.77.70,10.0.2.15,TCP,60,9001  >  34692 [ACK] Seq=413768643 Ack=22482495 Win=65535 Len=0
1,1.2916850000001432,54.93.77.70,10.0.2.15,TLSv1.2,2950,Application Data [TCP segment of a reassembled PDU]
1,1.2917260000012902,10.0.2.15,54.93.77.70,TCP,54,34692  >  9001 [ACK] Seq=22482495 Ack=413771539 Win=65535 Len=0
1,1.2969630000006873,54.93.77.70,10.0.2.15,TCP,2950,"9001  >  34692 [PSH, ACK] Seq=413771539 Ack=22482495 Win=65535 Len=2896 [TCP segment of a reassembled PDU]"
1,1.2970150000001013,10.0.2.15,54.93.77.70,TCP,54,34692  >  9001 [ACK] Seq=22482495 Ack=413774435 Win=65535 Len=0
1,1.2979050000012649,54.93.77.70,10.0.2.15,TLSv1.2,5846,"Application Data, Application Data, Application Data"
1,1.2979730000006384,10.0.2.15,54.93.77.70,TCP,54,34692  >  9001 [ACK] Seq=22482495 Ack=413780227 Win=65535 Len=0
1,1.302002000000357,54.93.77.70,10.0.2.15,TLSv1.2,286,Application Data
1,1.3021140000000742,10.0.2.15,54.93.77.70,TLSv1.2,590,Application Data
1,1.302230999999665,54.93.77.70,10.0.2.15,TCP,60,9001  >  34692 [ACK] Seq=413780459 Ack=22483031 Win=65535 Len=0
1,1.315152000001035,54.93.77.70,10.0.2.15,TCP,2950,"9001  >  34692 [PSH, ACK] Seq=413780459 Ack=22483031 Win=65535 Len=2896 [TCP segment of a reassembled PDU]"
1,1.315217000001212,10.0.2.15,54.93.77.70,TCP,54,34692  >  9001 [ACK] Seq=22483031 Ack=413783355 Win=65535 Len=0
1,1.3178870000010647,54.93.77.70,10.0.2.15,TLSv1.2,778,Application Data
1,1.3341849999997066,10.0.2.15,54.93.77.70,TLSv1.2,590,Application Data
1,1.3343089999998483,54.93.77.70,10.0.2.15,TCP,60,9001  >  34692 [ACK] Seq=413784079 Ack=22483567 Win=65535 Len=0
1,1.3442470000009052,10.0.2.15,54.93.77.70,TLSv1.2,590,Application Data
1,1.3444230000004609,54.93.77.70,10.0.2.15,TCP,60,9001  >  34692 [ACK] Seq=413784079 Ack=22484103 Win=65535 Len=0
1,1.3829079999995884,54.93.77.70,10.0.2.15,TLSv1.2,590,Application Data
1,1.4260000000012951,10.0.2.15,54.93.77.70,TCP,54,34692  >  9001 [ACK] Seq=22484103 Ack=413784615 Win=65535 Len=0
1,1.4363389999998617,62.210.85.178,10.0.2.15,TLSv1.2,590,Application Data
1,1.4627290000007633,62.210.85.178,10.0.2.15,TCP,1502,"9001  >  35978 [PSH, ACK] Seq=22386797 Ack=414080547 Win=65535 Len=1448 [TCP segment of a reassembled PDU]"
1,1.4627959999997984,10.0.2.15,62.210.85.178,TCP,54,35978  >  9001 [ACK] Seq=414080547 Ack=22388245 Win=65535 Len=0
1,1.4797770000004675,62.210.85.178,10.0.2.15,TLSv1.2,170,Application Data
1,1.4803130000000237,10.0.2.15,62.210.85.178,TLSv1.2,590,Application Data
1,1.4804060000005848,62.210.85.178,10.0.2.15,TCP,60,9001  >  35978 [ACK] Seq=22388361 Ack=414081083 Win=65535 Len=0
1,1.6962020000009943,54.93.77.70,10.0.2.15,TLSv1.2,590,Application Data
1,1.6962780000012572,10.0.2.15,54.93.77.70,TCP,54,34692  >  9001 [ACK] Seq=22484103 Ack=413785151 Win=65535 Len=0
1,1.696670000001177,10.0.2.15,54.93.77.70,TLSv1.2,590,Application Data
1,1.6967700000004697,54.93.77.70,10.0.2.15,TCP,60,9001  >  34692 [ACK] Seq=413785151 Ack=22484639 Win=65535 Len=0
1,1.8102060000001075,62.210.85.178,10.0.2.15,TLSv1.2,590,Application Data
1,1.8167000000012195,10.0.2.15,62.210.85.178,TLSv1.2,590,Application Data
1,1.8168560000012803,62.210.85.178,10.0.2.15,TCP,60,9001  >  35978 [ACK] Seq=22388897 Ack=414081619 Win=65535 Len=0
1,1.83046800000011,10.0.2.15,62.210.85.178,TLSv1.2,4124,Application Data
1,1.8305920000002516,10.0.2.15,62.210.85.178,TCP,2974,35978  >  9001 [ACK] Seq=414085689 Ack=22388897 Win=65535 Len=2920 [TCP segment of a reassembled PDU]
1,1.8306489999995392,62.210.85.178,10.0.2.15,TCP,60,9001  >  35978 [ACK] Seq=22388897 Ack=414083079 Win=65535 Len=0
1,1.8306620000003022,62.210.85.178,10.0.2.15,TCP,60,9001  >  35978 [ACK] Seq=22388897 Ack=414084539 Win=65535 Len=0
1,1.830667000000176,62.210.85.178,10.0.2.15,TCP,60,9001  >  35978 [ACK] Seq=22388897 Ack=414085689 Win=65535 Len=0
1,1.8306720000000496,62.210.85.178,10.0.2.15,TCP,60,9001  >  35978 [ACK] Seq=22388897 Ack=414087149 Win=65535 Len=0
1,1.8306759999995847,62.210.85.178,10.0.2.15,TCP,60,9001  >  35978 [ACK] Seq=22388897 Ack=414088609 Win=65535 Len=0
1,1.830712000000858,10.0.2.15,62.210.85.178,TLSv1.2,1204,Application Data
1,1.8307519999998476,62.210.85.178,10.0.2.15,TCP,60,9001  >  35978 [ACK] Seq=22388897 Ack=414089759 Win=65535 Len=0
1,1.8307990000012069,10.0.2.15,62.210.85.178,TLSv1.2,4124,Application Data
1,1.8308379999998579,62.210.85.178,10.0.2.15,TCP,60,9001  >  35978 [ACK] Seq=22388897 Ack=414091219 Win=65535 Len=0
1,1.8308470000010857,62.210.85.178,10.0.2.15,TCP,60,9001  >  35978 [ACK] Seq=22388897 Ack=414092679 Win=65535 Len=0
1,1.8308510000006208,62.210.85.178,10.0.2.15,TCP,60,9001  >  35978 [ACK] Seq=22388897 Ack=414093829 Win=65535 Len=0
1,1.8308900000010908,10.0.2.15,62.210.85.178,TLSv1.2,4124,Application Data
1,1.8309300000000803,62.210.85.178,10.0.2.15,TCP,60,9001  >  35978 [ACK] Seq=22388897 Ack=414095289 Win=65535 Len=0
1,1.830937000000631,62.210.85.178,10.0.2.15,TCP,60,9001  >  35978 [ACK] Seq=22388897 Ack=414096749 Win=65535 Len=0
1,1.8309819999994943,62.210.85.178,10.0.2.15,TCP,60,9001  >  35978 [ACK] Seq=22388897 Ack=414097899 Win=65535 Len=0
1,1.8310180000007676,10.0.2.15,62.210.85.178,TLSv1.2,332,Application Data
1,1.831054000000222,62.210.85.178,10.0.2.15,TCP,60,9001  >  35978 [ACK] Seq=22388897 Ack=414098177 Win=65535 Len=0
1,1.8311090000006516,10.0.2.15,62.210.85.178,TLSv1.2,3868,Application Data
1,1.8311499999999796,62.210.85.178,10.0.2.15,TCP,60,9001  >  35978 [ACK] Seq=22388897 Ack=414099637 Win=65535 Len=0
1,1.8311570000005304,62.210.85.178,10.0.2.15,TCP,60,9001  >  35978 [ACK] Seq=22388897 Ack=414101097 Win=65535 Len=0
1,1.8311610000000655,62.210.85.178,10.0.2.15,TCP,60,9001  >  35978 [ACK] Seq=22388897 Ack=414101991 Win=65535 Len=0
1,1.831199000000197,10.0.2.15,62.210.85.178,TLSv1.2,4124,Application Data
1,1.8312370000003284,62.210.85.178,10.0.2.15,TCP,60,9001  >  35978 [ACK] Seq=22388897 Ack=414103451 Win=65535 Len=0
1,1.8312450000012177,62.210.85.178,10.0.2.15,TCP,60,9001  >  35978 [ACK] Seq=22388897 Ack=414104911 Win=65535 Len=0
1,1.8312490000007529,62.210.85.178,10.0.2.15,TCP,60,9001  >  35978 [ACK] Seq=22388897 Ack=414106061 Win=65535 Len=0
1,1.8312839999998687,10.0.2.15,62.210.85.178,TLSv1.2,3030,Application Data
1,1.8313230000003387,62.210.85.178,10.0.2.15,TCP,60,9001  >  35978 [ACK] Seq=22388897 Ack=414107521 Win=65535 Len=0
1,1.831331000001228,62.210.85.178,10.0.2.15,TCP,60,9001  >  35978 [ACK] Seq=22388897 Ack=414108981 Win=65535 Len=0
1,1.8313340000004246,62.210.85.178,10.0.2.15,TCP,60,9001  >  35978 [ACK] Seq=22388897 Ack=414109037 Win=65535 Len=0
1,1.8427609999998822,10.0.2.15,62.210.85.178,TLSv1.2,4124,Application Data
1,1.8428170000006503,62.210.85.178,10.0.2.15,TCP,60,9001  >  35978 [ACK] Seq=22388897 Ack=414110497 Win=65535 Len=0
1,1.8428290000010747,62.210.85.178,10.0.2.15,TCP,60,9001  >  35978 [ACK] Seq=22388897 Ack=414111957 Win=65535 Len=0
1,1.8428340000009484,62.210.85.178,10.0.2.15,TCP,60,9001  >  35978 [ACK] Seq=22388897 Ack=414113107 Win=65535 Len=0
1,1.8428860000003624,10.0.2.15,62.210.85.178,TLSv1.2,4124,Application Data
1,1.8429520000008779,62.210.85.178,10.0.2.15,TCP,60,9001  >  35978 [ACK] Seq=22388897 Ack=414114567 Win=65535 Len=0
1,1.8429599999999482,62.210.85.178,10.0.2.15,TCP,60,9001  >  35978 [ACK] Seq=22388897 Ack=414116027 Win=65535 Len=0
1,1.8429630000009638,62.210.85.178,10.0.2.15,TCP,60,9001  >  35978 [ACK] Seq=22388897 Ack=414117177 Win=65535 Len=0
1,1.8429990000004182,10.0.2.15,62.210.85.178,TLSv1.2,4124,Application Data
1,1.843036000000211,62.210.85.178,10.0.2.15,TCP,60,9001  >  35978 [ACK] Seq=22388897 Ack=414118637 Win=65535 Len=0
1,1.84304499999962,62.210.85.178,10.0.2.15,TCP,60,9001  >  35978 [ACK] Seq=22388897 Ack=414120097 Win=65535 Len=0
1,1.8430499999994936,62.210.85.178,10.0.2.15,TCP,60,9001  >  35978 [ACK] Seq=22388897 Ack=414121247 Win=65535 Len=0
1,1.843087999999625,10.0.2.15,62.210.85.178,TLSv1.2,4124,Application Data
1,1.843127000000095,62.210.85.178,10.0.2.15,TCP,60,9001  >  35978 [ACK] Seq=22388897 Ack=414122707 Win=65535 Len=0
1,1.8431359999995038,62.210.85.178,10.0.2.15,TCP,60,9001  >  35978 [ACK] Seq=22388897 Ack=414124167 Win=65535 Len=0
1,1.843140000000858,62.210.85.178,10.0.2.15,TCP,60,9001  >  35978 [ACK] Seq=22388897 Ack=414125317 Win=65535 Len=0
1,1.8431760000003123,10.0.2.15,62.210.85.178,TLSv1.2,332,Application Data
1,1.8432119999997667,62.210.85.178,10.0.2.15,TCP,60,9001  >  35978 [ACK] Seq=22388897 Ack=414125595 Win=65535 Len=0
1,1.8432659999998577,10.0.2.15,62.210.85.178,TLSv1.2,3868,Application Data
1,1.8433079999995243,62.210.85.178,10.0.2.15,TCP,60,9001  >  35978 [ACK] Seq=22388897 Ack=414127055 Win=65535 Len=0
1,1.8433160000004136,62.210.85.178,10.0.2.15,TCP,60,9001  >  35978 [ACK] Seq=22388897 Ack=414128515 Win=65535 Len=0
1,1.8433210000002873,62.210.85.178,10.0.2.15,TCP,60,9001  >  35978 [ACK] Seq=22388897 Ack=414129409 Win=65535 Len=0
1,1.8433590000004187,10.0.2.15,62.210.85.178,TLSv1.2,4124,Application Data
1,1.8433970000005502,62.210.85.178,10.0.2.15,TCP,60,9001  >  35978 [ACK] Seq=22388897 Ack=414130869 Win=65535 Len=0
1,1.8434049999996205,62.210.85.178,10.0.2.15,TCP,60,9001  >  35978 [ACK] Seq=22388897 Ack=414132329 Win=65535 Len=0
1,1.8434090000009746,62.210.85.178,10.0.2.15,TCP,60,9001  >  35978 [ACK] Seq=22388897 Ack=414133479 Win=65535 Len=0
1,1.843445000000429,10.0.2.15,62.210.85.178,TLSv1.2,3030,Application Data
1,1.843484000000899,62.210.85.178,10.0.2.15,TCP,60,9001  >  35978 [ACK] Seq=22388897 Ack=414134939 Win=65535 Len=0
1,1.8434919999999693,62.210.85.178,10.0.2.15,TCP,60,9001  >  35978 [ACK] Seq=22388897 Ack=414136399 Win=65535 Len=0
1,1.8434950000009849,62.210.85.178,10.0.2.15,TCP,60,9001  >  35978 [ACK] Seq=22388897 Ack=414136455 Win=65535 Len=0
1,1.8549530000000232,10.0.2.15,62.210.85.178,TLSv1.2,4124,Application Data
1,1.8550080000004527,62.210.85.178,10.0.2.15,TCP,60,9001  >  35978 [ACK] Seq=22388897 Ack=414137915 Win=65535 Len=0
1,1.8550190000005387,62.210.85.178,10.0.2.15,TCP,60,9001  >  35978 [ACK] Seq=22388897 Ack=414139375 Win=65535 Len=0
1,1.8550240000004123,62.210.85.178,10.0.2.15,TCP,60,9001  >  35978 [ACK] Seq=22388897 Ack=414140525 Win=65535 Len=0
1,1.855069999999614,10.0.2.15,62.210.85.178,TLSv1.2,4124,Application Data
1,1.8551100000004226,62.210.85.178,10.0.2.15,TCP,60,9001  >  35978 [ACK] Seq=22388897 Ack=414141985 Win=65535 Len=0
1,1.85512000000017,62.210.85.178,10.0.2.15,TCP,60,9001  >  35978 [ACK] Seq=22388897 Ack=414143445 Win=65535 Len=0
1,1.8551239999997051,62.210.85.178,10.0.2.15,TCP,60,9001  >  35978 [ACK] Seq=22388897 Ack=414144595 Win=65535 Len=0
1,1.8551619999998366,10.0.2.15,62.210.85.178,TLSv1.2,4124,Application Data
1,1.8552010000003065,62.210.85.178,10.0.2.15,TCP,60,9001  >  35978 [ACK] Seq=22388897 Ack=414146055 Win=65535 Len=0
1,1.8552090000011958,62.210.85.178,10.0.2.15,TCP,60,9001  >  35978 [ACK] Seq=22388897 Ack=414147515 Win=65535 Len=0
1,1.8552140000010695,62.210.85.178,10.0.2.15,TCP,60,9001  >  35978 [ACK] Seq=22388897 Ack=414148665 Win=65535 Len=0
1,1.8552610000006098,10.0.2.15,62.210.85.178,TLSv1.2,4124,Application Data
1,1.8552980000004027,62.210.85.178,10.0.2.15,TCP,60,9001  >  35978 [ACK] Seq=22388897 Ack=414150125 Win=65535 Len=0
1,1.85530800000015,62.210.85.178,10.0.2.15,TCP,60,9001  >  35978 [ACK] Seq=22388897 Ack=414151585 Win=65535 Len=0
1,1.8553130000000237,62.210.85.178,10.0.2.15,TCP,60,9001  >  35978 [ACK] Seq=22388897 Ack=414152735 Win=65535 Len=0
1,1.855349000001297,10.0.2.15,62.210.85.178,TLSv1.2,332,Application Data
1,1.85538600000109,62.210.85.178,10.0.2.15,TCP,60,9001  >  35978 [ACK] Seq=22388897 Ack=414153013 Win=65535 Len=0
1,1.8554370000001654,10.0.2.15,62.210.85.178,TLSv1.2,2646,Application Data
1,1.8554760000006354,62.210.85.178,10.0.2.15,TCP,60,9001  >  35978 [ACK] Seq=22388897 Ack=414154473 Win=65535 Len=0
1,1.8554839999997057,62.210.85.178,10.0.2.15,TCP,60,9001  >  35978 [ACK] Seq=22388897 Ack=414155605 Win=65535 Len=0
1,1.9211690000011004,54.93.77.70,10.0.2.15,TLSv1.2,590,Application Data
1,1.9418839999998454,54.93.77.70,10.0.2.15,TLSv1.2,5846,Application Data
1,1.9420250000002852,10.0.2.15,54.93.77.70,TCP,54,34692  >  9001 [ACK] Seq=22484639 Ack=413791479 Win=65535 Len=0
1,1.9422880000001896,54.93.77.70,10.0.2.15,TLSv1.2,2016,Application Data
1,1.9423310000001948,10.0.2.15,54.93.77.70,TCP,54,34692  >  9001 [ACK] Seq=22484639 Ack=413793441 Win=65535 Len=0
1,1.9547529999999824,54.93.77.70,10.0.2.15,TCP,2950,"9001  >  34692 [PSH, ACK] Seq=413793441 Ack=22484639 Win=65535 Len=2896 [TCP segment of a reassembled PDU]"
1,1.9548219999996945,10.0.2.15,54.93.77.70,TCP,54,34692  >  9001 [ACK] Seq=22484639 Ack=413796337 Win=65535 Len=0
1,1.958135000000766,54.93.77.70,10.0.2.15,TLSv1.2,778,Application Data
1,1.9643379999997705,54.93.77.70,10.0.2.15,TLSv1.2,5846,Application Data
1,1.9644140000000334,10.0.2.15,54.93.77.70,TCP,54,34692  >  9001 [ACK] Seq=22484639 Ack=413802853 Win=65535 Len=0
1,1.964958000000479,54.93.77.70,10.0.2.15,TCP,1502,"9001  >  34692 [PSH, ACK] Seq=413802853 Ack=22484639 Win=65535 Len=1448 [TCP segment of a reassembled PDU]"
1,1.964998999999807,10.0.2.15,54.93.77.70,TCP,54,34692  >  9001 [ACK] Seq=22484639 Ack=413804301 Win=65535 Len=0
1,1.97406299999966,54.93.77.70,10.0.2.15,TLSv1.2,1104,"Application Data, Application Data"
1,1.9749879999999393,54.93.77.70,10.0.2.15,TCP,2950,"9001  >  34692 [PSH, ACK] Seq=413805351 Ack=22484639 Win=65535 Len=2896 [TCP segment of a reassembled PDU]"
1,1.9750490000005811,10.0.2.15,54.93.77.70,TCP,54,34692  >  9001 [ACK] Seq=22484639 Ack=413808247 Win=65535 Len=0
1,1.985039000001052,54.93.77.70,10.0.2.15,TLSv1.2,2950,"Application Data, Application Data"
1,1.985088999999789,10.0.2.15,54.93.77.70,TCP,54,34692  >  9001 [ACK] Seq=22484639 Ack=413811143 Win=65535 Len=0
1,1.9856780000009167,54.93.77.70,10.0.2.15,TLSv1.2,5734,Application Data [TCP segment of a reassembled PDU]
1,1.9857410000004165,10.0.2.15,54.93.77.70,TCP,54,34692  >  9001 [ACK] Seq=22484639 Ack=413816823 Win=65535 Len=0
1,1.9857830000000831,54.93.77.70,10.0.2.15,TLSv1.2,1614,Application Data [TCP segment of a reassembled PDU]
1,1.9858949999998003,10.0.2.15,54.93.77.70,TLSv1.2,590,Application Data
1,1.9861300000011397,54.93.77.70,10.0.2.15,TCP,60,9001  >  34692 [ACK] Seq=413818383 Ack=22485175 Win=65535 Len=0
1,1.9868610000012268,54.93.77.70,10.0.2.15,TCP,2950,"9001  >  34692 [PSH, ACK] Seq=413818383 Ack=22485175 Win=65535 Len=2896 [TCP segment of a reassembled PDU]"
1,1.9869020000005548,10.0.2.15,54.93.77.70,TCP,54,34692  >  9001 [ACK] Seq=22485175 Ack=413821279 Win=65535 Len=0
1,1.9899349999996048,54.93.77.70,10.0.2.15,TLSv1.2,706,"Application Data, Application Data"
1,1.9930940000012924,54.93.77.70,10.0.2.15,TCP,2950,"9001  >  34692 [PSH, ACK] Seq=413821931 Ack=22485175 Win=65535 Len=2896 [TCP segment of a reassembled PDU]"
1,1.993147000001045,10.0.2.15,54.93.77.70,TCP,54,34692  >  9001 [ACK] Seq=22485175 Ack=413824827 Win=65535 Len=0
1,1.9944180000002234,54.93.77.70,10.0.2.15,TLSv1.2,8742,"Application Data, Application Data"
1,1.9944840000007389,10.0.2.15,54.93.77.70,TCP,54,34692  >  9001 [ACK] Seq=22485175 Ack=413833515 Win=65535 Len=0
1,1.9980560000003607,10.0.2.15,54.93.77.70,TLSv1.2,590,Application Data
1,1.9981390000011743,54.93.77.70,10.0.2.15,TCP,60,9001  >  34692 [ACK] Seq=413833515 Ack=22485711 Win=65535 Len=0
1,2.004071000001204,54.93.77.70,10.0.2.15,TLSv1.2,2950,Application Data [TCP segment of a reassembled PDU]
1,2.004132000000027,10.0.2.15,54.93.77.70,TCP,54,34692  >  9001 [ACK] Seq=22485711 Ack=413836411 Win=65535 Len=0
1,2.005036000000473,54.93.77.70,10.0.2.15,TLSv1.2,4398,Application Data [TCP segment of a reassembled PDU]
1,2.005076999999801,10.0.2.15,54.93.77.70,TCP,54,34692  >  9001 [ACK] Seq=22485711 Ack=413840755 Win=65535 Len=0
1,2.00593200000003,54.93.77.70,10.0.2.15,TLSv1.2,872,Application Data
1,2.006059000001187,10.0.2.15,54.93.77.70,TLSv1.2,590,Application Data
1,2.0061270000005607,54.93.77.70,10.0.2.15,TCP,60,9001  >  34692 [ACK] Seq=413841573 Ack=22486247 Win=65535 Len=0
1,2.022942999999941,54.93.77.70,10.0.2.15,TLSv1.2,5846,Application Data
1,2.023019000000204,10.0.2.15,54.93.77.70,TCP,54,34692  >  9001 [ACK] Seq=22486247 Ack=413847365 Win=65535 Len=0
1,2.023400000000038,54.93.77.70,10.0.2.15,TLSv1.2,2016,Application Data
1,2.023441000001185,10.0.2.15,54.93.77.70,TCP,54,34692  >  9001 [ACK] Seq=22486247 Ack=413849327 Win=65535 Len=0
1,2.0301259999996546,54.93.77.70,10.0.2.15,TCP,2950,"9001  >  34692 [PSH, ACK] Seq=413849327 Ack=22486247 Win=65535 Len=2896 [TCP segment of a reassembled PDU]"
1,2.03019200000017,10.0.2.15,54.93.77.70,TCP,54,34692  >  9001 [ACK] Seq=22486247 Ack=413852223 Win=65535 Len=0
1,2.039286000001084,54.93.77.70,10.0.2.15,TLSv1.2,778,Application Data
1,2.052233000000342,54.93.77.70,10.0.2.15,TCP,2950,"9001  >  34692 [PSH, ACK] Seq=413852947 Ack=22486247 Win=65535 Len=2896 [TCP segment of a reassembled PDU]"
1,2.0522519999994984,54.93.77.70,10.0.2.15,TLSv1.2,2950,Application Data [TCP segment of a reassembled PDU]
1,2.05228999999963,10.0.2.15,54.93.77.70,TCP,54,34692  >  9001 [ACK] Seq=22486247 Ack=413855843 Win=65535 Len=0
1,2.0523599999996804,10.0.2.15,54.93.77.70,TCP,54,34692  >  9001 [ACK] Seq=22486247 Ack=413858739 Win=65535 Len=0
1,2.0685279999997874,54.93.77.70,10.0.2.15,TLSv1.2,988,Application Data
1,2.0685410000005504,62.210.85.178,10.0.2.15,TLSv1.2,590,Application Data
1,2.0711869999995542,10.0.2.15,54.93.77.70,TLSv1.2,590,Application Data
1,2.07133900000008,54.93.77.70,10.0.2.15,TCP,60,9001  >  34692 [ACK] Seq=413859673 Ack=22486783 Win=65535 Len=0
1,2.110023999999612,10.0.2.15,62.210.85.178,TCP,54,35978  >  9001 [ACK] Seq=414155605 Ack=22389433 Win=65535 Len=0
1,2.6179700000011508,62.210.85.178,10.0.2.15,TLSv1.2,1618,Application Data
1,2.6180590000003576,10.0.2.15,62.210.85.178,TCP,54,35978  >  9001 [ACK] Seq=414155605 Ack=22390997 Win=65535 Len=0
1,2.6186240000006364,10.0.2.15,62.210.85.178,TLSv1.2,590,Application Data
1,2.618765999999596,62.210.85.178,10.0.2.15,TCP,60,9001  >  35978 [ACK] Seq=22390997 Ack=414156141 Win=65535 Len=0
1,2.730276000000231,54.93.77.70,10.0.2.15,TLSv1.2,590,Application Data
1,2.7307199999995646,10.0.2.15,54.93.77.70,TLSv1.2,590,Application Data
1,2.7308610000000044,54.93.77.70,10.0.2.15,TCP,60,9001  >  34692 [ACK] Seq=413860209 Ack=22487319 Win=65535 Len=0
1,2.9249570000010863,62.210.85.178,10.0.2.15,TLSv1.2,590,Application Data
1,2.9295359999996435,10.0.2.15,62.210.85.178,TLSv1.2,590,Application Data
1,2.929680000001099,62.210.85.178,10.0.2.15,TCP,60,9001  >  35978 [ACK] Seq=22391533 Ack=414156677 Win=65535 Len=0
1,2.939234999999826,10.0.2.15,62.210.85.178,TLSv1.2,4124,Application Data
1,2.93932599999971,10.0.2.15,62.210.85.178,TCP,1514,35978  >  9001 [ACK] Seq=414160747 Ack=22391533 Win=65535 Len=1460 [TCP segment of a reassembled PDU]
1,2.9393739999995887,62.210.85.178,10.0.2.15,TCP,60,9001  >  35978 [ACK] Seq=22391533 Ack=414158137 Win=65535 Len=0
1,2.939384000001155,62.210.85.178,10.0.2.15,TCP,60,9001  >  35978 [ACK] Seq=22391533 Ack=414159597 Win=65535 Len=0
1,2.9393899999995483,62.210.85.178,10.0.2.15,TCP,60,9001  >  35978 [ACK] Seq=22391533 Ack=414160747 Win=65535 Len=0
1,2.93980399999964,10.0.2.15,62.210.85.178,TLSv1.2,222,Application Data
1,2.939871000000494,62.210.85.178,10.0.2.15,TCP,60,9001  >  35978 [ACK] Seq=22391533 Ack=414162207 Win=65535 Len=0
1,2.9398789999995643,62.210.85.178,10.0.2.15,TCP,60,9001  >  35978 [ACK] Seq=22391533 Ack=414162375 Win=65535 Len=0
1,3.0262579999998707,54.93.77.70,10.0.2.15,TLSv1.2,590,Application Data
1,3.0426509999997506,54.93.77.70,10.0.2.15,TCP,2950,"9001  >  34692 [PSH, ACK] Seq=413860745 Ack=22487319 Win=65535 Len=2896 [TCP segment of a reassembled PDU]"
1,3.0427490000001853,10.0.2.15,54.93.77.70,TCP,54,34692  >  9001 [ACK] Seq=22487319 Ack=413863641 Win=65535 Len=0
1,3.06048600000031,54.93.77.70,10.0.2.15,TLSv1.2,778,Application Data
1,3.062718000001041,54.93.77.70,10.0.2.15,TCP,1502,"9001  >  34692 [PSH, ACK] Seq=413864365 Ack=22487319 Win=65535 Len=1448 [TCP segment of a reassembled PDU]"
1,3.0627610000010463,10.0.2.15,54.93.77.70,TCP,54,34692  >  9001 [ACK] Seq=22487319 Ack=413865813 Win=65535 Len=0
1,3.0792899999996735,54.93.77.70,10.0.2.15,TLSv1.2,684,Application Data
1,3.0817409999999654,10.0.2.15,54.93.77.70,TLSv1.2,590,Application Data
1,3.08187800000087,54.93.77.70,10.0.2.15,TCP,60,9001  >  34692 [ACK] Seq=413866443 Ack=22487855 Win=65535 Len=0
1,3.196917000001122,62.210.85.178,10.0.2.15,TLSv1.2,590,Application Data
1,3.1972290000012435,10.0.2.15,62.210.85.178,TLSv1.2,590,Application Data
1,3.197319000000789,62.210.85.178,10.0.2.15,TCP,60,9001  >  35978 [ACK] Seq=22392069 Ack=414162911 Win=65535 Len=0
1,3.295242000000144,54.93.77.70,10.0.2.15,TLSv1.2,590,Application Data
1,3.2956059999996796,10.0.2.15,54.93.77.70,TLSv1.2,590,Application Data
1,3.2957120000010036,54.93.77.70,10.0.2.15,TCP,60,9001  >  34692 [ACK] Seq=413866979 Ack=22488391 Win=65535 Len=0
1,3.540305000000444,62.210.85.178,10.0.2.15,TLSv1.2,590,Application Data
1,3.5431420000004437,10.0.2.15,62.210.85.178,TLSv1.2,590,Application Data
1,3.5433110000012675,62.210.85.178,10.0.2.15,TCP,60,9001  >  35978 [ACK] Seq=22392605 Ack=414163447 Win=65535 Len=0
1,3.5542920000007143,10.0.2.15,62.210.85.178,TLSv1.2,4124,Application Data
1,3.5544019999997545,10.0.2.15,62.210.85.178,TCP,2974,35978  >  9001 [ACK] Seq=414167517 Ack=22392605 Win=65535 Len=2920 [TCP segment of a reassembled PDU]
1,3.554460999999719,62.210.85.178,10.0.2.15,TCP,60,9001  >  35978 [ACK] Seq=22392605 Ack=414164907 Win=65535 Len=0
1,3.554471999999805,62.210.85.178,10.0.2.15,TCP,60,9001  >  35978 [ACK] Seq=22392605 Ack=414166367 Win=65535 Len=0
1,3.5544780000000173,62.210.85.178,10.0.2.15,TCP,60,9001  >  35978 [ACK] Seq=22392605 Ack=414167517 Win=65535 Len=0
1,3.554519999999684,10.0.2.15,62.210.85.178,TLSv1.2,1204,Application Data
1,3.554559000000154,62.210.85.178,10.0.2.15,TCP,60,9001  >  35978 [ACK] Seq=22392605 Ack=414168977 Win=65535 Len=0
1,3.554567000001043,62.210.85.178,10.0.2.15,TCP,60,9001  >  35978 [ACK] Seq=22392605 Ack=414170437 Win=65535 Len=0
1,3.5545710000005784,62.210.85.178,10.0.2.15,TCP,60,9001  >  35978 [ACK] Seq=22392605 Ack=414171587 Win=65535 Len=0
1,3.554610999999568,10.0.2.15,62.210.85.178,TLSv1.2,718,Application Data
1,3.5546489999996993,62.210.85.178,10.0.2.15,TCP,60,9001  >  35978 [ACK] Seq=22392605 Ack=414172251 Win=65535 Len=0
1,3.650109000000157,54.93.77.70,10.0.2.15,TLSv1.2,590,Application Data
1,3.6857920000002196,54.93.77.70,10.0.2.15,TCP,2950,"9001  >  34692 [PSH, ACK] Seq=413867515 Ack=22488391 Win=65535 Len=2896 [TCP segment of a reassembled PDU]"
1,3.685852000000523,10.0.2.15,54.93.77.70,TCP,54,34692  >  9001 [ACK] Seq=22488391 Ack=413870411 Win=65535 Len=0
1,3.6920069999996485,54.93.77.70,10.0.2.15,TLSv1.2,4398,"Application Data, Application Data"
1,3.692049000001134,10.0.2.15,54.93.77.70,TCP,54,34692  >  9001 [ACK] Seq=22488391 Ack=413874755 Win=65535 Len=0
1,3.6922279999998864,10.0.2.15,54.93.77.70,TLSv1.2,590,Application Data
1,3.692300000000614,54.93.77.70,10.0.2.15,TCP,60,9001  >  34692 [ACK] Seq=413874755 Ack=22488927 Win=65535 Len=0
1,3.7033190000001923,54.93.77.70,10.0.2.15,TLSv1.2,590,Application Data
1,3.745981000000029,10.0.2.15,54.93.77.70,TCP,54,34692  >  9001 [ACK] Seq=22488927 Ack=413875291 Win=65535 Len=0
1,3.775123999999778,54.93.77.70,10.0.2.15,TLSv1.2,1104,Application Data
1,3.775166999999783,10.0.2.15,54.93.77.70,TCP,54,34692  >  9001 [ACK] Seq=22488927 Ack=413876341 Win=65535 Len=0
1,3.7773310000011406,10.0.2.15,54.93.77.70,TLSv1.2,590,Application Data
1,3.7774680000002263,54.93.77.70,10.0.2.15,TCP,60,9001  >  34692 [ACK] Seq=413876341 Ack=22489463 Win=65535 Len=0
1,3.813100999999733,62.210.85.178,10.0.2.15,TLSv1.2,590,Application Data
1,3.8540000000011787,10.0.2.15,62.210.85.178,TCP,54,35978  >  9001 [ACK] Seq=414172251 Ack=22393141 Win=65535 Len=0
1,3.918241000001217,62.210.85.178,10.0.2.15,TLSv1.2,590,Application Data
1,3.918347000000722,10.0.2.15,62.210.85.178,TCP,54,35978  >  9001 [ACK] Seq=414172251 Ack=22393677 Win=65535 Len=0
1,3.9187140000012732,10.0.2.15,62.210.85.178,TLSv1.2,590,Application Data
1,3.9188130000002275,62.210.85.178,10.0.2.15,TCP,60,9001  >  35978 [ACK] Seq=22393677 Ack=414172787 Win=65535 Len=0
1,4.155883999999787,54.93.77.70,10.0.2.15,TLSv1.2,590,Application Data
1,4.156274000000849,10.0.2.15,54.93.77.70,TLSv1.2,590,Application Data
1,4.156383999999889,54.93.77.70,10.0.2.15,TCP,60,9001  >  34692 [ACK] Seq=413876877 Ack=22489999 Win=65535 Len=0
1,4.274215999999797,62.210.85.178,10.0.2.15,TLSv1.2,590,Application Data
1,4.277487999999721,10.0.2.15,62.210.85.178,TLSv1.2,590,Application Data
1,4.277634000000035,62.210.85.178,10.0.2.15,TCP,60,9001  >  35978 [ACK] Seq=22394213 Ack=414173323 Win=65535 Len=0
1,4.287143999999898,10.0.2.15,62.210.85.178,TLSv1.2,4124,Application Data
1,4.287255999999616,10.0.2.15,62.210.85.178,TCP,1514,35978  >  9001 [ACK] Seq=414177393 Ack=22394213 Win=65535 Len=1460 [TCP segment of a reassembled PDU]
1,4.287303999999494,62.210.85.178,10.0.2.15,TCP,60,9001  >  35978 [ACK] Seq=22394213 Ack=414174783 Win=65535 Len=0
1,4.28731499999958,62.210.85.178,10.0.2.15,TCP,60,9001  >  35978 [ACK] Seq=22394213 Ack=414176243 Win=65535 Len=0
1,4.2873190000009345,62.210.85.178,10.0.2.15,TCP,60,9001  >  35978 [ACK] Seq=22394213 Ack=414177393 Win=65535 Len=0
1,4.287324000000808,62.210.85.178,10.0.2.15,TCP,60,9001  >  35978 [ACK] Seq=22394213 Ack=414178853 Win=65535 Len=0
1,4.287368000001152,10.0.2.15,62.210.85.178,TLSv1.2,1250,Application Data
1,4.287916999999652,62.210.85.178,10.0.2.15,TCP,60,9001  >  35978 [ACK] Seq=22394213 Ack=414180049 Win=65535 Len=0
1,4.394860000000335,54.93.77.70,10.0.2.15,TLSv1.2,590,Application Data
1,4.4379900000003545,10.0.2.15,54.93.77.70,TCP,54,34692  >  9001 [ACK] Seq=22489999 Ack=413877413 Win=65535 Len=0
1,4.440957000000708,54.93.77.70,10.0.2.15,TLSv1.2,6780,"Application Data, Application Data"
1,4.441016000000673,10.0.2.15,54.93.77.70,TCP,54,34692  >  9001 [ACK] Seq=22489999 Ack=413884139 Win=65535 Len=0
1,4.444283000000723,10.0.2.15,54.93.77.70,TLSv1.2,590,Application Data
1,4.444453000000067,54.93.77.70,10.0.2.15,TCP,60,9001  >  34692 [ACK] Seq=413884139 Ack=22490535 Win=65535 Len=0
1,4.6658580000002985,62.210.85.178,10.0.2.15,TLSv1.2,590,Application Data
1,4.666215999999622,10.0.2.15,62.210.85.178,TLSv1.2,590,Application Data
1,4.666353000000527,62.210.85.178,10.0.2.15,TCP,60,9001  >  35978 [ACK] Seq=22394749 Ack=414180585 Win=65535 Len=0
1,4.75516400000015,54.93.77.70,10.0.2.15,TLSv1.2,590,Application Data
1,4.75560299999961,10.0.2.15,54.93.77.70,TLSv1.2,590,Application Data
1,4.75574400000005,54.93.77.70,10.0.2.15,TCP,60,9001  >  34692 [ACK] Seq=413884675 Ack=22491071 Win=65535 Len=0
1,4.853336000000127,62.210.85.178,10.0.2.15,TLSv1.2,590,Application Data
1,4.85844200000065,10.0.2.15,62.210.85.178,TLSv1.2,590,Application Data
1,4.858639000000039,62.210.85.178,10.0.2.15,TCP,60,9001  >  35978 [ACK] Seq=22395285 Ack=414181121 Win=65535 Len=0
1,4.870103999999628,10.0.2.15,62.210.85.178,TLSv1.2,4124,Application Data
1,4.870216999999684,10.0.2.15,62.210.85.178,TCP,2974,35978  >  9001 [ACK] Seq=414185191 Ack=22395285 Win=65535 Len=2920 [TCP segment of a reassembled PDU]
1,4.870263000000705,62.210.85.178,10.0.2.15,TCP,60,9001  >  35978 [ACK] Seq=22395285 Ack=414182581 Win=65535 Len=0
1,4.870273000000452,62.210.85.178,10.0.2.15,TCP,60,9001  >  35978 [ACK] Seq=22395285 Ack=414184041 Win=65535 Len=0
1,4.870278000000326,62.210.85.178,10.0.2.15,TCP,60,9001  >  35978 [ACK] Seq=22395285 Ack=414185191 Win=65535 Len=0
1,4.870281999999861,62.210.85.178,10.0.2.15,TCP,60,9001  >  35978 [ACK] Seq=22395285 Ack=414186651 Win=65535 Len=0
1,4.870286000001215,62.210.85.178,10.0.2.15,TCP,60,9001  >  35978 [ACK] Seq=22395285 Ack=414188111 Win=65535 Len=0
1,4.870337000000291,10.0.2.15,62.210.85.178,TLSv1.2,1204,Application Data
1,4.870406000000003,10.0.2.15,62.210.85.178,TCP,2974,35978  >  9001 [ACK] Seq=414189261 Ack=22395285 Win=65535 Len=2920 [TCP segment of a reassembled PDU]
1,4.870446000000811,62.210.85.178,10.0.2.15,TCP,60,9001  >  35978 [ACK] Seq=22395285 Ack=414189261 Win=65535 Len=0
1,4.870452999999543,62.210.85.178,10.0.2.15,TCP,60,9001  >  35978 [ACK] Seq=22395285 Ack=414190721 Win=65535 Len=0
1,4.870457000000897,62.210.85.178,10.0.2.15,TCP,60,9001  >  35978 [ACK] Seq=22395285 Ack=414192181 Win=65535 Len=0
1,4.870492000000013,10.0.2.15,62.210.85.178,TLSv1.2,1204,Application Data
1,4.87055700000019,10.0.2.15,62.210.85.178,TCP,2974,35978  >  9001 [ACK] Seq=414193331 Ack=22395285 Win=65535 Len=2920 [TCP segment of a reassembled PDU]
1,4.870592999999644,62.210.85.178,10.0.2.15,TCP,60,9001  >  35978 [ACK] Seq=22395285 Ack=414193331 Win=65535 Len=0
1,4.870600000000195,62.210.85.178,10.0.2.15,TCP,60,9001  >  35978 [ACK] Seq=22395285 Ack=414194791 Win=65535 Len=0
1,4.87060399999973,62.210.85.178,10.0.2.15,TCP,60,9001  >  35978 [ACK] Seq=22395285 Ack=414196251 Win=65535 Len=0
1,4.87063500000113,10.0.2.15,62.210.85.178,TLSv1.2,1204,Application Data
1,4.870714000000589,10.0.2.15,62.210.85.178,TLSv1.2,2974,Application Data
1,4.870753999999579,62.210.85.178,10.0.2.15,TCP,60,9001  >  35978 [ACK] Seq=22395285 Ack=414197401 Win=65535 Len=0
1,4.87076100000013,62.210.85.178,10.0.2.15,TCP,60,9001  >  35978 [ACK] Seq=22395285 Ack=414198861 Win=65535 Len=0
1,4.870764999999665,62.210.85.178,10.0.2.15,TCP,60,9001  >  35978 [ACK] Seq=22395285 Ack=414200321 Win=65535 Len=0
1,4.870796999999584,10.0.2.15,62.210.85.178,TLSv1.2,1226,Application Data
1,4.870834000001196,62.210.85.178,10.0.2.15,TCP,60,9001  >  35978 [ACK] Seq=22395285 Ack=414201493 Win=65535 Len=0
1,4.870877000001201,10.0.2.15,62.210.85.178,TLSv1.2,1424,Application Data
1,4.870915999999852,62.210.85.178,10.0.2.15,TCP,60,9001  >  35978 [ACK] Seq=22395285 Ack=414202863 Win=65535 Len=0
1,4.966910000001008,54.93.77.70,10.0.2.15,TLSv1.2,590,Application Data
1,4.9778669999996055,54.93.77.70,10.0.2.15,TLSv1.2,7294,Application Data
1,4.977957999999489,10.0.2.15,54.93.77.70,TCP,54,34692  >  9001 [ACK] Seq=22491071 Ack=413892451 Win=65535 Len=0
1,4.994615999999951,54.93.77.70,10.0.2.15,TLSv1.2,568,Application Data
1,4.998274999999921,54.93.77.70,10.0.2.15,TCP,2950,"9001  >  34692 [PSH, ACK] Seq=413892965 Ack=22491071 Win=65535 Len=2896 [TCP segment of a reassembled PDU]"
1,4.998326000000816,10.0.2.15,54.93.77.70,TCP,54,34692  >  9001 [ACK] Seq=22491071 Ack=413895861 Win=65535 Len=0
1,5.00927799999954,54.93.77.70,10.0.2.15,TLSv1.2,5846,"Application Data, Application Data"
1,5.009345000000394,10.0.2.15,54.93.77.70,TCP,54,34692  >  9001 [ACK] Seq=22491071 Ack=413901653 Win=65535 Len=0
1,5.009453000000576,54.93.77.70,10.0.2.15,TCP,2950,"9001  >  34692 [PSH, ACK] Seq=413901653 Ack=22491071 Win=65535 Len=2896 [TCP segment of a reassembled PDU]"
1,5.009535999999571,10.0.2.15,54.93.77.70,TCP,54,34692  >  9001 [ACK] Seq=22491071 Ack=413904549 Win=65535 Len=0
1,5.014570000001186,54.93.77.70,10.0.2.15,TLSv1.2,380,"Application Data, Application Data"
1,5.022152999999889,54.93.77.70,10.0.2.15,TCP,1502,"9001  >  34692 [PSH, ACK] Seq=413904875 Ack=22491071 Win=65535 Len=1448 [TCP segment of a reassembled PDU]"
1,5.02220699999998,10.0.2.15,54.93.77.70,TCP,54,34692  >  9001 [ACK] Seq=22491071 Ack=413906323 Win=65535 Len=0
1,5.038040000001274,54.93.77.70,10.0.2.15,TLSv1.2,684,Application Data
1,5.041027000001122,10.0.2.15,54.93.77.70,TLSv1.2,590,Application Data
1,5.041193000000931,54.93.77.70,10.0.2.15,TCP,60,9001  >  34692 [ACK] Seq=413906953 Ack=22491607 Win=65535 Len=0
1,5.1388370000004215,62.210.85.178,10.0.2.15,TLSv1.2,590,Application Data
1,5.139433000000281,10.0.2.15,62.210.85.178,TLSv1.2,590,Application Data
1,5.139581000001272,62.210.85.178,10.0.2.15,TCP,60,9001  >  35978 [ACK] Seq=22395821 Ack=414203399 Win=65535 Len=0
1,5.226228999999876,54.93.77.70,10.0.2.15,TLSv1.2,590,Application Data
1,5.226652999999715,10.0.2.15,54.93.77.70,TLSv1.2,590,Application Data
1,5.226792000001296,54.93.77.70,10.0.2.15,TCP,60,9001  >  34692 [ACK] Seq=413907489 Ack=22492143 Win=65535 Len=0
1,5.323311000000103,62.210.85.178,10.0.2.15,TLSv1.2,590,Application Data
1,5.330312000000049,10.0.2.15,62.210.85.178,TLSv1.2,590,Application Data
1,5.330509000001257,62.210.85.178,10.0.2.15,TCP,60,9001  >  35978 [ACK] Seq=22396357 Ack=414203935 Win=65535 Len=0
1,5.342936000000918,10.0.2.15,62.210.85.178,TLSv1.2,4124,Application Data
1,5.343042000000423,10.0.2.15,62.210.85.178,TCP,2974,35978  >  9001 [ACK] Seq=414208005 Ack=22396357 Win=65535 Len=2920 [TCP segment of a reassembled PDU]
1,5.343086000000767,62.210.85.178,10.0.2.15,TCP,60,9001  >  35978 [ACK] Seq=22396357 Ack=414205395 Win=65535 Len=0
1,5.343096000000514,62.210.85.178,10.0.2.15,TCP,60,9001  >  35978 [ACK] Seq=22396357 Ack=414206855 Win=65535 Len=0
1,5.343101000000388,62.210.85.178,10.0.2.15,TCP,60,9001  >  35978 [ACK] Seq=22396357 Ack=414208005 Win=65535 Len=0
1,5.343104999999923,62.210.85.178,10.0.2.15,TCP,60,9001  >  35978 [ACK] Seq=22396357 Ack=414209465 Win=65535 Len=0
1,5.343111000000135,62.210.85.178,10.0.2.15,TCP,60,9001  >  35978 [ACK] Seq=22396357 Ack=414210925 Win=65535 Len=0
1,5.343156000000818,10.0.2.15,62.210.85.178,TLSv1.2,1204,Application Data
1,5.34322500000053,10.0.2.15,62.210.85.178,TCP,2974,35978  >  9001 [ACK] Seq=414212075 Ack=22396357 Win=65535 Len=2920 [TCP segment of a reassembled PDU]
1,5.343262000000323,62.210.85.178,10.0.2.15,TCP,60,9001  >  35978 [ACK] Seq=22396357 Ack=414212075 Win=65535 Len=0
1,5.343269000000873,62.210.85.178,10.0.2.15,TCP,60,9001  >  35978 [ACK] Seq=22396357 Ack=414213535 Win=65535 Len=0
1,5.343274000000747,62.210.85.178,10.0.2.15,TCP,60,9001  >  35978 [ACK] Seq=22396357 Ack=414214995 Win=65535 Len=0
1,5.343307999999524,10.0.2.15,62.210.85.178,TLSv1.2,1204,Application Data
1,5.343372999999701,10.0.2.15,62.210.85.178,TCP,2974,35978  >  9001 [ACK] Seq=414216145 Ack=22396357 Win=65535 Len=2920 [TCP segment of a reassembled PDU]
1,5.343409999999494,62.210.85.178,10.0.2.15,TCP,60,9001  >  35978 [ACK] Seq=22396357 Ack=414216145 Win=65535 Len=0
1,5.343415999999706,62.210.85.178,10.0.2.15,TCP,60,9001  >  35978 [ACK] Seq=22396357 Ack=414217605 Win=65535 Len=0
1,5.34342099999958,62.210.85.178,10.0.2.15,TCP,60,9001  >  35978 [ACK] Seq=22396357 Ack=414219065 Win=65535 Len=0
1,5.34345200000098,10.0.2.15,62.210.85.178,TLSv1.2,1204,Application Data
1,5.343543000000864,10.0.2.15,62.210.85.178,TLSv1.2,2974,Application Data
1,5.343581999999515,62.210.85.178,10.0.2.15,TCP,60,9001  >  35978 [ACK] Seq=22396357 Ack=414220215 Win=65535 Len=0
1,5.343589000000065,62.210.85.178,10.0.2.15,TCP,60,9001  >  35978 [ACK] Seq=22396357 Ack=414221675 Win=65535 Len=0
1,5.343593999999939,62.210.85.178,10.0.2.15,TCP,60,9001  >  35978 [ACK] Seq=22396357 Ack=414223135 Win=65535 Len=0
1,5.34362499999952,10.0.2.15,62.210.85.178,TLSv1.2,1226,Application Data
1,5.3436870000005,10.0.2.15,62.210.85.178,TCP,2974,35978  >  9001 [ACK] Seq=414224307 Ack=22396357 Win=65535 Len=2920 [TCP segment of a reassembled PDU]
1,5.343724000000293,62.210.85.178,10.0.2.15,TCP,60,9001  >  35978 [ACK] Seq=22396357 Ack=414224307 Win=65535 Len=0
1,5.343731000000844,62.210.85.178,10.0.2.15,TCP,60,9001  >  35978 [ACK] Seq=22396357 Ack=414225767 Win=65535 Len=0
1,5.343735000000379,62.210.85.178,10.0.2.15,TCP,60,9001  >  35978 [ACK] Seq=22396357 Ack=414227227 Win=65535 Len=0
1,5.34376599999996,10.0.2.15,62.210.85.178,TLSv1.2,1204,Application Data
1,5.343802000001233,62.210.85.178,10.0.2.15,TCP,60,9001  >  35978 [ACK] Seq=22396357 Ack=414228377 Win=65535 Len=0
1,5.343845999999758,10.0.2.15,62.210.85.178,TLSv1.2,3030,Application Data
1,5.343887000000905,62.210.85.178,10.0.2.15,TCP,60,9001  >  35978 [ACK] Seq=22396357 Ack=414229837 Win=65535 Len=0
1,5.343893999999636,62.210.85.178,10.0.2.15,TCP,60,9001  >  35978 [ACK] Seq=22396357 Ack=414231297 Win=65535 Len=0
1,5.343898000000991,62.210.85.178,10.0.2.15,TCP,60,9001  >  35978 [ACK] Seq=22396357 Ack=414231353 Win=65535 Len=0
1,5.353096000000733,10.0.2.15,62.210.85.178,TLSv1.2,4124,Application Data
1,5.3531739999998535,10.0.2.15,62.210.85.178,TCP,2974,35978  >  9001 [ACK] Seq=414235423 Ack=22396357 Win=65535 Len=2920 [TCP segment of a reassembled PDU]
1,5.3532130000003235,62.210.85.178,10.0.2.15,TCP,60,9001  >  35978 [ACK] Seq=22396357 Ack=414232813 Win=65535 Len=0
1,5.353223000000071,62.210.85.178,10.0.2.15,TCP,60,9001  >  35978 [ACK] Seq=22396357 Ack=414234273 Win=65535 Len=0
1,5.353226999999606,62.210.85.178,10.0.2.15,TCP,60,9001  >  35978 [ACK] Seq=22396357 Ack=414235423 Win=65535 Len=0
1,5.353232000001299,62.210.85.178,10.0.2.15,TCP,60,9001  >  35978 [ACK] Seq=22396357 Ack=414236883 Win=65535 Len=0
1,5.353236000000834,62.210.85.178,10.0.2.15,TCP,60,9001  >  35978 [ACK] Seq=22396357 Ack=414238343 Win=65535 Len=0
1,5.353274999999485,10.0.2.15,62.210.85.178,TLSv1.2,1204,Application Data
1,5.353342000000339,10.0.2.15,62.210.85.178,TCP,2974,35978  >  9001 [ACK] Seq=414239493 Ack=22396357 Win=65535 Len=2920 [TCP segment of a reassembled PDU]
1,5.353377999999793,62.210.85.178,10.0.2.15,TCP,60,9001  >  35978 [ACK] Seq=22396357 Ack=414239493 Win=65535 Len=0
1,5.353385000000344,62.210.85.178,10.0.2.15,TCP,60,9001  >  35978 [ACK] Seq=22396357 Ack=414240953 Win=65535 Len=0
1,5.353390000000218,62.210.85.178,10.0.2.15,TCP,60,9001  >  35978 [ACK] Seq=22396357 Ack=414242413 Win=65535 Len=0
1,5.353424000000814,10.0.2.15,62.210.85.178,TLSv1.2,1204,Application Data
1,5.353487000000314,10.0.2.15,62.210.85.178,TCP,1514,35978  >  9001 [ACK] Seq=414243563 Ack=22396357 Win=65535 Len=1460 [TCP segment of a reassembled PDU]
1,5.353522000001249,62.210.85.178,10.0.2.15,TCP,60,9001  >  35978 [ACK] Seq=22396357 Ack=414243563 Win=65535 Len=0
1,5.35352899999998,62.210.85.178,10.0.2.15,TCP,60,9001  >  35978 [ACK] Seq=22396357 Ack=414245023 Win=65535 Len=0
1,5.353559000001042,10.0.2.15,62.210.85.178,TLSv1.2,864,Application Data
1,5.353651000001264,62.210.85.178,10.0.2.15,TCP,60,9001  >  35978 [ACK] Seq=22396357 Ack=414245833 Win=65535 Len=0
1,5.447645000000193,54.93.77.70,10.0.2.15,TLSv1.2,3674,Application Data
1,5.44777299999987,10.0.2.15,54.93.77.70,TCP,54,34692  >  9001 [ACK] Seq=22492143 Ack=413911109 Win=65535 Len=0
1,5.458297000001039,54.93.77.70,10.0.2.15,TLSv1.2,5846,Application Data
1,5.458321000000069,54.93.77.70,10.0.2.15,TLSv1.2,5846,Application Data [TCP segment of a reassembled PDU]
1,5.458402000000206,10.0.2.15,54.93.77.70,TCP,54,34692  >  9001 [ACK] Seq=22492143 Ack=413922693 Win=65535 Len=0
1,5.463739000000714,54.93.77.70,10.0.2.15,TLSv1.2,894,"Application Data, Application Data"
1,5.46949400000085,54.93.77.70,10.0.2.15,TLSv1.2,5846,Application Data
1,5.46951799999988,54.93.77.70,10.0.2.15,TLSv1.2,4398,Application Data [TCP segment of a reassembled PDU]
1,5.469562000000224,10.0.2.15,54.93.77.70,TCP,54,34692  >  9001 [ACK] Seq=22492143 Ack=413929325 Win=65535 Len=0
1,5.469639000000825,10.0.2.15,54.93.77.70,TCP,54,34692  >  9001 [ACK] Seq=22492143 Ack=413933669 Win=65535 Len=0
1,5.46976800000084,54.93.77.70,10.0.2.15,TCP,1502,"9001  >  34692 [PSH, ACK] Seq=413933669 Ack=22492143 Win=65535 Len=1448 [TCP segment of a reassembled PDU]"
1,5.46992500000124,10.0.2.15,54.93.77.70,TLSv1.2,590,Application Data
1,5.47003500000028,54.93.77.70,10.0.2.15,TCP,60,9001  >  34692 [ACK] Seq=413935117 Ack=22492679 Win=65535 Len=0
1,5.479320000000371,54.93.77.70,10.0.2.15,TLSv1.2,2950,Application Data [TCP segment of a reassembled PDU]
1,5.47936800000025,10.0.2.15,54.93.77.70,TCP,54,34692  >  9001 [ACK] Seq=22492679 Ack=413938013 Win=65535 Len=0
1,5.479543999999805,10.0.2.15,54.93.77.70,TLSv1.2,590,Application Data
1,5.479650999999649,54.93.77.70,10.0.2.15,TCP,60,9001  >  34692 [ACK] Seq=413938013 Ack=22493215 Win=65535 Len=0
1,5.479953000000023,54.93.77.70,10.0.2.15,TLSv1.2,7154,"Application Data, Application Data"
1,5.480004000000918,10.0.2.15,54.93.77.70,TCP,54,34692  >  9001 [ACK] Seq=22493215 Ack=413945113 Win=65535 Len=0
1,5.480048000001261,54.93.77.70,10.0.2.15,TCP,1642,"9001  >  34692 [PSH, ACK] Seq=413945113 Ack=22493215 Win=65535 Len=1588 [TCP segment of a reassembled PDU]"
1,5.480079000000842,10.0.2.15,54.93.77.70,TCP,54,34692  >  9001 [ACK] Seq=22493215 Ack=413946701 Win=65535 Len=0
1,5.487710000001243,54.93.77.70,10.0.2.15,TLSv1.2,662,Application Data
1,5.499692000001232,54.93.77.70,10.0.2.15,TCP,1502,"9001  >  34692 [PSH, ACK] Seq=413947309 Ack=22493215 Win=65535 Len=1448 [TCP segment of a reassembled PDU]"
1,5.499740000001111,10.0.2.15,54.93.77.70,TCP,54,34692  >  9001 [ACK] Seq=22493215 Ack=413948757 Win=65535 Len=0
1,5.518163000000641,54.93.77.70,10.0.2.15,TLSv1.2,1198,Application Data
1,5.521413000000393,10.0.2.15,54.93.77.70,TLSv1.2,590,Application Data
1,5.5216010000003735,54.93.77.70,10.0.2.15,TCP,60,9001  >  34692 [ACK] Seq=413949901 Ack=22493751 Win=65535 Len=0
1,5.604527999999846,62.210.85.178,10.0.2.15,TLSv1.2,1104,Application Data
1,5.645994000000428,10.0.2.15,62.210.85.178,TCP,54,35978  >  9001 [ACK] Seq=414245833 Ack=22397407 Win=65535 Len=0
1,5.70554600000105,62.210.85.178,10.0.2.15,TLSv1.2,590,Application Data
1,5.705633999999918,10.0.2.15,62.210.85.178,TCP,54,35978  >  9001 [ACK] Seq=414245833 Ack=22397943 Win=65535 Len=0
1,5.7061590000012075,10.0.2.15,62.210.85.178,TLSv1.2,590,Application Data
1,5.706395000001066,62.210.85.178,10.0.2.15,TCP,60,9001  >  35978 [ACK] Seq=22397943 Ack=414246369 Win=65535 Len=0
1,5.819202000000587,54.93.77.70,10.0.2.15,TLSv1.2,590,Application Data
1,5.821586000000025,10.0.2.15,54.93.77.70,TLSv1.2,590,Application Data
1,5.821724000001268,54.93.77.70,10.0.2.15,TCP,60,9001  >  34692 [ACK] Seq=413950437 Ack=22494287 Win=65535 Len=0
1,6.070230000001175,10.0.2.15,152.89.104.206,TLSv1.3,590,Application Data
1,6.070394000000306,152.89.104.206,10.0.2.15,TCP,60,9001  >  47334 [ACK] Seq=56416 Ack=57767 Win=65535 Len=0
1,6.0731880000003,62.210.85.178,10.0.2.15,TLSv1.2,590,Application Data
1,6.076522999999725,10.0.2.15,62.210.85.178,TLSv1.2,590,Application Data
1,6.076661000000968,62.210.85.178,10.0.2.15,TCP,60,9001  >  35978 [ACK] Seq=22398479 Ack=414246905 Win=65535 Len=0
1,6.086365999999543,10.0.2.15,62.210.85.178,TLSv1.2,4124,Application Data
1,6.086796999999933,62.210.85.178,10.0.2.15,TCP,60,9001  >  35978 [ACK] Seq=22398479 Ack=414248365 Win=65535 Len=0
1,6.086819000000105,62.210.85.178,10.0.2.15,TCP,60,9001  >  35978 [ACK] Seq=22398479 Ack=414249825 Win=65535 Len=0
1,6.08682299999964,62.210.85.178,10.0.2.15,TCP,60,9001  >  35978 [ACK] Seq=22398479 Ack=414250975 Win=65535 Len=0
1,6.086892999999691,10.0.2.15,62.210.85.178,TLSv1.2,4124,Application Data
1,6.086960000000545,10.0.2.15,62.210.85.178,TCP,2974,35978  >  9001 [ACK] Seq=414255045 Ack=22398479 Win=65535 Len=2920 [TCP segment of a reassembled PDU]
1,6.087005000001227,62.210.85.178,10.0.2.15,TCP,60,9001  >  35978 [ACK] Seq=22398479 Ack=414252435 Win=65535 Len=0
1,6.087011999999959,62.210.85.178,10.0.2.15,TCP,60,9001  >  35978 [ACK] Seq=22398479 Ack=414253895 Win=65535 Len=0
1,6.087015000000974,62.210.85.178,10.0.2.15,TCP,60,9001  >  35978 [ACK] Seq=22398479 Ack=414255045 Win=65535 Len=0
1,6.0870169999998325,62.210.85.178,10.0.2.15,TCP,60,9001  >  35978 [ACK] Seq=22398479 Ack=414256505 Win=65535 Len=0
1,6.087020000000848,62.210.85.178,10.0.2.15,TCP,60,9001  >  35978 [ACK] Seq=22398479 Ack=414257965 Win=65535 Len=0
1,6.0870580000009795,10.0.2.15,62.210.85.178,TLSv1.2,1204,Application Data
1,6.087129999999888,10.0.2.15,62.210.85.178,TCP,1514,35978  >  9001 [ACK] Seq=414259115 Ack=22398479 Win=65535 Len=1460 [TCP segment of a reassembled PDU]
1,6.087169000000358,62.210.85.178,10.0.2.15,TCP,60,9001  >  35978 [ACK] Seq=22398479 Ack=414259115 Win=65535 Len=0
1,6.0871770000012475,62.210.85.178,10.0.2.15,TCP,60,9001  >  35978 [ACK] Seq=22398479 Ack=414260575 Win=65535 Len=0
1,6.087204999999813,10.0.2.15,62.210.85.178,TLSv1.2,864,Application Data
1,6.087240000000747,62.210.85.178,10.0.2.15,TCP,60,9001  >  35978 [ACK] Seq=22398479 Ack=414261385 Win=65535 Len=0
1,6.200995999999577,54.93.77.70,10.0.2.15,TCP,2950,"9001  >  34692 [PSH, ACK] Seq=413950437 Ack=22494287 Win=65535 Len=2896 [TCP segment of a reassembled PDU]"
1,6.201117000000522,10.0.2.15,54.93.77.70,TCP,54,34692  >  9001 [ACK] Seq=22494287 Ack=413953333 Win=65535 Len=0
1,6.201256000000285,54.93.77.70,10.0.2.15,TLSv1.2,778,Application Data
1,6.211651999999958,54.93.77.70,10.0.2.15,TLSv1.2,7294,Application Data
1,6.211765000000014,10.0.2.15,54.93.77.70,TCP,54,34692  >  9001 [ACK] Seq=22494287 Ack=413961297 Win=65535 Len=0
1,6.231347000000824,54.93.77.70,10.0.2.15,TLSv1.2,568,Application Data
1,6.247440999999526,54.93.77.70,10.0.2.15,TCP,2950,"9001  >  34692 [PSH, ACK] Seq=413961811 Ack=22494287 Win=65535 Len=2896 [TCP segment of a reassembled PDU]"
1,6.247488000000885,10.0.2.15,54.93.77.70,TCP,54,34692  >  9001 [ACK] Seq=22494287 Ack=413964707 Win=65535 Len=0
1,6.26564800000051,54.93.77.70,10.0.2.15,TLSv1.2,778,Application Data
