No.,Time,Source,Destination,Protocol,Length,Info
1,0.010424000000057276,10.0.2.15,54.93.77.70,TCP,54,34692  >  9001 [ACK] Seq=23324437 Ack=429186977 Win=65535 Len=0
1,0.018292999999175663,62.210.85.178,10.0.2.15,TLSv1.2,590,Application Data
1,0.018388999998933286,10.0.2.15,62.210.85.178,TCP,54,35978  >  9001 [ACK] Seq=429479037 Ack=23225703 Win=65535 Len=0
1,0.14564400000017486,10.0.2.15,54.93.77.70,TLSv1.2,590,Application Data
1,0.14582999999947788,54.93.77.70,10.0.2.15,TCP,60,9001  >  34692 [ACK] Seq=429186977 Ack=23324973 Win=65535 Len=0
1,0.27826400000049034,62.210.85.178,10.0.2.15,TLSv1.2,590,Application Data
1,0.2783319999998639,10.0.2.15,62.210.85.178,TCP,54,35978  >  9001 [ACK] Seq=429479037 Ack=23226239 Win=65535 Len=0
1,0.27878400000008696,10.0.2.15,62.210.85.178,TLSv1.2,590,Application Data
1,0.2788860000000568,62.210.85.178,10.0.2.15,TCP,60,9001  >  35978 [ACK] Seq=23226239 Ack=429479573 Win=65535 Len=0
1,0.3694899999991321,54.93.77.70,10.0.2.15,TLSv1.2,590,Application Data
1,0.36956999999893014,10.0.2.15,54.93.77.70,TCP,54,34692  >  9001 [ACK] Seq=23324973 Ack=429187513 Win=65535 Len=0
1,0.36996999999973923,10.0.2.15,54.93.77.70,TLSv1.2,1618,Application Data
1,0.3701149999997142,54.93.77.70,10.0.2.15,TCP,60,9001  >  34692 [ACK] Seq=429187513 Ack=23326433 Win=65535 Len=0
1,0.37012700000013865,54.93.77.70,10.0.2.15,TCP,60,9001  >  34692 [ACK] Seq=429187513 Ack=23326537 Win=65535 Len=0
1,0.3954389999998966,109.238.11.185,10.0.2.15,TLSv1.3,590,Application Data
1,0.43815600000016275,10.0.2.15,109.238.11.185,TCP,54,47728  >  51101 [ACK] Seq=5647 Ack=22556 Win=65320 Len=0
1,0.4972670000006474,62.210.85.178,10.0.2.15,TLSv1.2,1618,Application Data
1,0.49742999999944004,10.0.2.15,62.210.85.178,TCP,54,35978  >  9001 [ACK] Seq=429479573 Ack=23227803 Win=65535 Len=0
1,0.4975849999991624,10.0.2.15,62.210.85.178,TLSv1.2,590,Application Data
1,0.4976590000005672,62.210.85.178,10.0.2.15,TCP,60,9001  >  35978 [ACK] Seq=23227803 Ack=429480109 Win=65535 Len=0
1,0.5111459999989165,10.0.2.15,62.210.85.178,TLSv1.2,590,Application Data
1,0.5113160000000789,62.210.85.178,10.0.2.15,TCP,60,9001  >  35978 [ACK] Seq=23227803 Ack=429480645 Win=65535 Len=0
1,0.5273949999991601,10.0.2.15,62.210.85.178,TLSv1.2,1618,Application Data
1,0.5275980000005802,62.210.85.178,10.0.2.15,TCP,60,9001  >  35978 [ACK] Seq=23227803 Ack=429482105 Win=65535 Len=0
1,0.527619999998933,62.210.85.178,10.0.2.15,TCP,60,9001  >  35978 [ACK] Seq=23227803 Ack=429482209 Win=65535 Len=0
1,0.6077949999998964,54.93.77.70,10.0.2.15,TLSv1.2,590,Application Data
1,0.6501250000001164,10.0.2.15,54.93.77.70,TCP,54,34692  >  9001 [ACK] Seq=23326537 Ack=429188049 Win=65535 Len=0
1,0.7790150000000722,54.93.77.70,10.0.2.15,TLSv1.2,2132,Application Data
1,0.779102000000421,10.0.2.15,54.93.77.70,TCP,54,34692  >  9001 [ACK] Seq=23326537 Ack=429190127 Win=65535 Len=0
1,0.7818499999993946,10.0.2.15,54.93.77.70,TLSv1.2,590,Application Data
1,0.7820169999995414,54.93.77.70,10.0.2.15,TCP,60,9001  >  34692 [ACK] Seq=429190127 Ack=23327073 Win=65535 Len=0
1,0.9842200000002777,62.210.85.178,10.0.2.15,TLSv1.2,590,Application Data
1,0.9845900000000256,10.0.2.15,62.210.85.178,TLSv1.2,590,Application Data
1,0.984719000000041,62.210.85.178,10.0.2.15,TCP,60,9001  >  35978 [ACK] Seq=23228339 Ack=429482745 Win=65535 Len=0
1,1.1883390000002692,54.93.77.70,10.0.2.15,TLSv1.2,590,Application Data
1,1.1887690000003204,10.0.2.15,54.93.77.70,TLSv1.2,590,Application Data
1,1.1889119999996183,54.93.77.70,10.0.2.15,TCP,60,9001  >  34692 [ACK] Seq=429190663 Ack=23327609 Win=65535 Len=0
1,1.30145900000025,62.210.85.178,10.0.2.15,TLSv1.2,590,Application Data
1,1.3080150000005233,10.0.2.15,62.210.85.178,TLSv1.2,590,Application Data
1,1.3092720000004192,62.210.85.178,10.0.2.15,TCP,60,9001  >  35978 [ACK] Seq=23228875 Ack=429483281 Win=65535 Len=0
1,1.31854199999907,10.0.2.15,62.210.85.178,TLSv1.2,4124,Application Data
1,1.318649999999252,10.0.2.15,62.210.85.178,TCP,2974,35978  >  9001 [ACK] Seq=429487351 Ack=23228875 Win=65535 Len=2920 [TCP segment of a reassembled PDU]
1,1.3186939999995957,62.210.85.178,10.0.2.15,TCP,60,9001  >  35978 [ACK] Seq=23228875 Ack=429484741 Win=65535 Len=0
1,1.318703999999343,62.210.85.178,10.0.2.15,TCP,60,9001  >  35978 [ACK] Seq=23228875 Ack=429486201 Win=65535 Len=0
1,1.3187089999992168,62.210.85.178,10.0.2.15,TCP,60,9001  >  35978 [ACK] Seq=23228875 Ack=429487351 Win=65535 Len=0
1,1.318713000000571,62.210.85.178,10.0.2.15,TCP,60,9001  >  35978 [ACK] Seq=23228875 Ack=429488811 Win=65535 Len=0
1,1.3187180000004446,62.210.85.178,10.0.2.15,TCP,60,9001  >  35978 [ACK] Seq=23228875 Ack=429490271 Win=65535 Len=0
1,1.3187639999996463,10.0.2.15,62.210.85.178,TLSv1.2,1204,Application Data
1,1.318873000000167,10.0.2.15,62.210.85.178,TCP,2974,35978  >  9001 [ACK] Seq=429491421 Ack=23228875 Win=65535 Len=2920 [TCP segment of a reassembled PDU]
1,1.3189409999995405,62.210.85.178,10.0.2.15,TCP,60,9001  >  35978 [ACK] Seq=23228875 Ack=429491421 Win=65535 Len=0
1,1.318952999999965,62.210.85.178,10.0.2.15,TCP,60,9001  >  35978 [ACK] Seq=23228875 Ack=429492881 Win=65535 Len=0
1,1.3189569999995001,62.210.85.178,10.0.2.15,TCP,60,9001  >  35978 [ACK] Seq=23228875 Ack=429494341 Win=65535 Len=0
1,1.3189989999991667,10.0.2.15,62.210.85.178,TLSv1.2,1204,Application Data
1,1.3190749999994296,10.0.2.15,62.210.85.178,TCP,2974,35978  >  9001 [ACK] Seq=429495491 Ack=23228875 Win=65535 Len=2920 [TCP segment of a reassembled PDU]
1,1.3191169999990962,62.210.85.178,10.0.2.15,TCP,60,9001  >  35978 [ACK] Seq=23228875 Ack=429495491 Win=65535 Len=0
1,1.3191249999999854,62.210.85.178,10.0.2.15,TCP,60,9001  >  35978 [ACK] Seq=23228875 Ack=429496951 Win=65535 Len=0
1,1.3191289999995206,62.210.85.178,10.0.2.15,TCP,60,9001  >  35978 [ACK] Seq=23228875 Ack=429498411 Win=65535 Len=0
1,1.3191630000001169,10.0.2.15,62.210.85.178,TLSv1.2,1204,Application Data
1,1.3192249999992782,62.210.85.178,10.0.2.15,TCP,60,9001  >  35978 [ACK] Seq=23228875 Ack=429499561 Win=65535 Len=0
1,1.3192650000000867,10.0.2.15,62.210.85.178,TLSv1.2,332,Application Data
1,1.3193030000002182,62.210.85.178,10.0.2.15,TCP,60,9001  >  35978 [ACK] Seq=23228875 Ack=429499839 Win=65535 Len=0
1,1.319363999999041,10.0.2.15,62.210.85.178,TLSv1.2,3868,Application Data
1,1.319406999999046,62.210.85.178,10.0.2.15,TCP,60,9001  >  35978 [ACK] Seq=23228875 Ack=429501299 Win=65535 Len=0
1,1.3194139999995969,62.210.85.178,10.0.2.15,TCP,60,9001  >  35978 [ACK] Seq=23228875 Ack=429502759 Win=65535 Len=0
1,1.319417999999132,62.210.85.178,10.0.2.15,TCP,60,9001  >  35978 [ACK] Seq=23228875 Ack=429503653 Win=65535 Len=0
1,1.3194650000004913,10.0.2.15,62.210.85.178,TLSv1.2,4124,Application Data
1,1.3195049999994808,62.210.85.178,10.0.2.15,TCP,60,9001  >  35978 [ACK] Seq=23228875 Ack=429505113 Win=65535 Len=0
1,1.3195120000000315,62.210.85.178,10.0.2.15,TCP,60,9001  >  35978 [ACK] Seq=23228875 Ack=429506573 Win=65535 Len=0
1,1.3195159999995667,62.210.85.178,10.0.2.15,TCP,60,9001  >  35978 [ACK] Seq=23228875 Ack=429507723 Win=65535 Len=0
1,1.319561000000249,10.0.2.15,62.210.85.178,TLSv1.2,3030,Application Data
1,1.319601999999577,62.210.85.178,10.0.2.15,TCP,60,9001  >  35978 [ACK] Seq=23228875 Ack=429509183 Win=65535 Len=0
1,1.3196079999997892,62.210.85.178,10.0.2.15,TCP,60,9001  >  35978 [ACK] Seq=23228875 Ack=429510643 Win=65535 Len=0
1,1.3196119999993243,62.210.85.178,10.0.2.15,TCP,60,9001  >  35978 [ACK] Seq=23228875 Ack=429510699 Win=65535 Len=0
1,1.3287939999991067,10.0.2.15,62.210.85.178,TLSv1.2,4124,Application Data
1,1.3288720000000467,10.0.2.15,62.210.85.178,TCP,2974,35978  >  9001 [ACK] Seq=429514769 Ack=23228875 Win=65535 Len=2920 [TCP segment of a reassembled PDU]
1,1.3289119999990362,62.210.85.178,10.0.2.15,TCP,60,9001  >  35978 [ACK] Seq=23228875 Ack=429512159 Win=65535 Len=0
1,1.3289199999999255,62.210.85.178,10.0.2.15,TCP,60,9001  >  35978 [ACK] Seq=23228875 Ack=429513619 Win=65535 Len=0
1,1.3289239999994606,62.210.85.178,10.0.2.15,TCP,60,9001  >  35978 [ACK] Seq=23228875 Ack=429514769 Win=65535 Len=0
1,1.3289279999989958,62.210.85.178,10.0.2.15,TCP,60,9001  >  35978 [ACK] Seq=23228875 Ack=429516229 Win=65535 Len=0
1,1.3289330000006885,62.210.85.178,10.0.2.15,TCP,60,9001  >  35978 [ACK] Seq=23228875 Ack=429517689 Win=65535 Len=0
1,1.328972999999678,10.0.2.15,62.210.85.178,TLSv1.2,1204,Application Data
1,1.329037999999855,10.0.2.15,62.210.85.178,TCP,1514,35978  >  9001 [ACK] Seq=429518839 Ack=23228875 Win=65535 Len=1460 [TCP segment of a reassembled PDU]
1,1.3290739999993093,62.210.85.178,10.0.2.15,TCP,60,9001  >  35978 [ACK] Seq=23228875 Ack=429518839 Win=65535 Len=0
1,1.32908099999986,62.210.85.178,10.0.2.15,TCP,60,9001  >  35978 [ACK] Seq=23228875 Ack=429520299 Win=65535 Len=0
1,1.3291129999997793,10.0.2.15,62.210.85.178,TLSv1.2,286,Application Data
1,1.3291499999995722,62.210.85.178,10.0.2.15,TCP,60,9001  >  35978 [ACK] Seq=23228875 Ack=429520531 Win=65535 Len=0
1,1.416559999999663,54.93.77.70,10.0.2.15,TLSv1.2,590,Application Data
1,1.4281150000006164,54.93.77.70,10.0.2.15,TLSv1.2,7294,"Application Data, Application Data"
1,1.4282669999993232,10.0.2.15,54.93.77.70,TCP,54,34692  >  9001 [ACK] Seq=23327609 Ack=429198439 Win=65535 Len=0
1,1.4285559999989346,10.0.2.15,54.93.77.70,TLSv1.2,590,Application Data
1,1.4286830000000919,54.93.77.70,10.0.2.15,TCP,60,9001  >  34692 [ACK] Seq=429198439 Ack=23328145 Win=65535 Len=0
1,1.4392289999996137,54.93.77.70,10.0.2.15,TLSv1.2,590,Application Data
1,1.4521210000002611,54.93.77.70,10.0.2.15,TCP,2950,"9001  >  34692 [PSH, ACK] Seq=429198975 Ack=23328145 Win=65535 Len=2896 [TCP segment of a reassembled PDU]"
1,1.452235999999175,10.0.2.15,54.93.77.70,TCP,54,34692  >  9001 [ACK] Seq=23328145 Ack=429201871 Win=65535 Len=0
1,1.4609739999996236,54.93.77.70,10.0.2.15,TLSv1.2,5846,"Application Data, Application Data"
1,1.4610630000006495,10.0.2.15,54.93.77.70,TCP,54,34692  >  9001 [ACK] Seq=23328145 Ack=429207663 Win=65535 Len=0
1,1.4612720000004629,54.93.77.70,10.0.2.15,TCP,1502,"9001  >  34692 [PSH, ACK] Seq=429207663 Ack=23328145 Win=65535 Len=1448 [TCP segment of a reassembled PDU]"
1,1.4614070000006905,10.0.2.15,54.93.77.70,TCP,54,34692  >  9001 [ACK] Seq=23328145 Ack=429209111 Win=65535 Len=0
1,1.4690179999997781,54.93.77.70,10.0.2.15,TLSv1.2,1292,Application Data
1,1.4854429999995773,54.93.77.70,10.0.2.15,TCP,2950,"9001  >  34692 [PSH, ACK] Seq=429210349 Ack=23328145 Win=65535 Len=2896 [TCP segment of a reassembled PDU]"
1,1.4854980000000069,10.0.2.15,54.93.77.70,TCP,54,34692  >  9001 [ACK] Seq=23328145 Ack=429213245 Win=65535 Len=0
1,1.4856129999989207,54.93.77.70,10.0.2.15,TLSv1.2,1314,"Application Data, Application Data"
1,1.5224920000000566,54.93.77.70,10.0.2.15,TCP,2950,"9001  >  34692 [PSH, ACK] Seq=429214505 Ack=23328145 Win=65535 Len=2896 [TCP segment of a reassembled PDU]"
1,1.5225790000004054,10.0.2.15,54.93.77.70,TCP,54,34692  >  9001 [ACK] Seq=23328145 Ack=429217401 Win=65535 Len=0
1,1.5329559999991034,54.93.77.70,10.0.2.15,TLSv1.2,5846,"Application Data, Application Data"
1,1.5330450000001292,10.0.2.15,54.93.77.70,TCP,54,34692  >  9001 [ACK] Seq=23328145 Ack=429223193 Win=65535 Len=0
1,1.5333360000004177,10.0.2.15,54.93.77.70,TLSv1.2,590,Application Data
1,1.5334989999992104,54.93.77.70,10.0.2.15,TCP,60,9001  >  34692 [ACK] Seq=429223193 Ack=23328681 Win=65535 Len=0
1,1.533579999999347,54.93.77.70,10.0.2.15,TLSv1.2,4398,Application Data [TCP segment of a reassembled PDU]
1,1.5337349999990693,10.0.2.15,54.93.77.70,TCP,54,34692  >  9001 [ACK] Seq=23328681 Ack=429227537 Win=65535 Len=0
1,1.534626999999091,62.210.85.178,10.0.2.15,TLSv1.2,590,Application Data
1,1.5393640000002051,54.93.77.70,10.0.2.15,TLSv1.2,988,Application Data
1,1.5425979999999981,10.0.2.15,54.93.77.70,TLSv1.2,590,Application Data
1,1.5427770000005694,54.93.77.70,10.0.2.15,TCP,60,9001  >  34692 [ACK] Seq=429228471 Ack=23329217 Win=65535 Len=0
1,1.5781239999996615,10.0.2.15,62.210.85.178,TCP,54,35978  >  9001 [ACK] Seq=429520531 Ack=23229411 Win=65535 Len=0
1,1.622628999999506,62.210.85.178,10.0.2.15,TLSv1.2,590,Application Data
1,1.6227280000002793,10.0.2.15,62.210.85.178,TCP,54,35978  >  9001 [ACK] Seq=429520531 Ack=23229947 Win=65535 Len=0
1,1.7127259999997477,62.210.85.178,10.0.2.15,TLSv1.2,590,Application Data
1,1.7128279999997176,10.0.2.15,62.210.85.178,TCP,54,35978  >  9001 [ACK] Seq=429520531 Ack=23230483 Win=65535 Len=0
1,1.7131680000002234,10.0.2.15,62.210.85.178,TLSv1.2,590,Application Data
1,1.7132980000005773,62.210.85.178,10.0.2.15,TCP,60,9001  >  35978 [ACK] Seq=23230483 Ack=429521067 Win=65535 Len=0
1,1.8076459999992949,54.93.77.70,10.0.2.15,TLSv1.2,590,Application Data
1,1.8081210000000283,10.0.2.15,54.93.77.70,TLSv1.2,590,Application Data
1,1.8082199999989825,54.93.77.70,10.0.2.15,TCP,60,9001  >  34692 [ACK] Seq=429229007 Ack=23329753 Win=65535 Len=0
1,1.9202949999998964,62.210.85.178,10.0.2.15,TLSv1.2,590,Application Data
1,1.9255940000002738,10.0.2.15,62.210.85.178,TLSv1.2,590,Application Data
1,1.9257619999989402,62.210.85.178,10.0.2.15,TCP,60,9001  >  35978 [ACK] Seq=23231019 Ack=429521603 Win=65535 Len=0
1,1.9382590000004711,10.0.2.15,62.210.85.178,TLSv1.2,4124,Application Data
1,1.9383770000004006,10.0.2.15,62.210.85.178,TCP,2974,35978  >  9001 [ACK] Seq=429525673 Ack=23231019 Win=65535 Len=2920 [TCP segment of a reassembled PDU]
1,1.938441000000239,62.210.85.178,10.0.2.15,TCP,60,9001  >  35978 [ACK] Seq=23231019 Ack=429523063 Win=65535 Len=0
1,1.938452000000325,62.210.85.178,10.0.2.15,TCP,60,9001  >  35978 [ACK] Seq=23231019 Ack=429524523 Win=65535 Len=0
1,1.9384570000001986,62.210.85.178,10.0.2.15,TCP,60,9001  >  35978 [ACK] Seq=23231019 Ack=429525673 Win=65535 Len=0
1,1.9384609999997338,62.210.85.178,10.0.2.15,TCP,60,9001  >  35978 [ACK] Seq=23231019 Ack=429527133 Win=65535 Len=0
1,1.9384659999996074,62.210.85.178,10.0.2.15,TCP,60,9001  >  35978 [ACK] Seq=23231019 Ack=429528593 Win=65535 Len=0
1,1.9385110000002896,10.0.2.15,62.210.85.178,TLSv1.2,1204,Application Data
1,1.9385820000006788,10.0.2.15,62.210.85.178,TCP,2974,35978  >  9001 [ACK] Seq=429529743 Ack=23231019 Win=65535 Len=2920 [TCP segment of a reassembled PDU]
1,1.9386209999993298,62.210.85.178,10.0.2.15,TCP,60,9001  >  35978 [ACK] Seq=23231019 Ack=429529743 Win=65535 Len=0
1,1.9386279999998806,62.210.85.178,10.0.2.15,TCP,60,9001  >  35978 [ACK] Seq=23231019 Ack=429531203 Win=65535 Len=0
1,1.9386319999994157,62.210.85.178,10.0.2.15,TCP,60,9001  >  35978 [ACK] Seq=23231019 Ack=429532663 Win=65535 Len=0
1,1.9386670000003505,10.0.2.15,62.210.85.178,TLSv1.2,1204,Application Data
1,1.9387320000005275,10.0.2.15,62.210.85.178,TCP,2974,35978  >  9001 [ACK] Seq=429533813 Ack=23231019 Win=65535 Len=2920 [TCP segment of a reassembled PDU]
1,1.9387690000003204,62.210.85.178,10.0.2.15,TCP,60,9001  >  35978 [ACK] Seq=23231019 Ack=429533813 Win=65535 Len=0
1,1.9387759999990521,62.210.85.178,10.0.2.15,TCP,60,9001  >  35978 [ACK] Seq=23231019 Ack=429535273 Win=65535 Len=0
1,1.9387800000004063,62.210.85.178,10.0.2.15,TCP,60,9001  >  35978 [ACK] Seq=23231019 Ack=429536733 Win=65535 Len=0
1,1.9388120000003255,10.0.2.15,62.210.85.178,TLSv1.2,1204,Application Data
1,1.938893000000462,10.0.2.15,62.210.85.178,TLSv1.2,2974,Application Data
1,1.938930000000255,62.210.85.178,10.0.2.15,TCP,60,9001  >  35978 [ACK] Seq=23231019 Ack=429537883 Win=65535 Len=0
1,1.9389360000004672,62.210.85.178,10.0.2.15,TCP,60,9001  >  35978 [ACK] Seq=23231019 Ack=429539343 Win=65535 Len=0
1,1.9389410000003409,62.210.85.178,10.0.2.15,TCP,60,9001  >  35978 [ACK] Seq=23231019 Ack=429540803 Win=65535 Len=0
1,1.9389719999999215,10.0.2.15,62.210.85.178,TLSv1.2,1226,Application Data
1,1.9390089999997144,62.210.85.178,10.0.2.15,TCP,60,9001  >  35978 [ACK] Seq=23231019 Ack=429541975 Win=65535 Len=0
1,1.939053000000058,10.0.2.15,62.210.85.178,TLSv1.2,2452,Application Data
1,1.9390929999990476,62.210.85.178,10.0.2.15,TCP,60,9001  >  35978 [ACK] Seq=23231019 Ack=429543435 Win=65535 Len=0
1,1.9390999999995984,62.210.85.178,10.0.2.15,TCP,60,9001  >  35978 [ACK] Seq=23231019 Ack=429544373 Win=65535 Len=0
1,2.0284840000003896,54.93.77.70,10.0.2.15,TLSv1.2,590,Application Data
1,2.051760000000286,54.93.77.70,10.0.2.15,TLSv1.2,7294,Application Data
1,2.051886999999624,10.0.2.15,54.93.77.70,TCP,54,34692  >  9001 [ACK] Seq=23329753 Ack=429236783 Win=65535 Len=0
1,2.0627279999989696,54.93.77.70,10.0.2.15,TLSv1.2,2950,Application Data [TCP segment of a reassembled PDU]
1,2.0627760000006674,54.93.77.70,10.0.2.15,TLSv1.2,2950,Application Data [TCP segment of a reassembled PDU]
1,2.0628469999992376,10.0.2.15,54.93.77.70,TCP,54,34692  >  9001 [ACK] Seq=23329753 Ack=429239679 Win=65535 Len=0
1,2.062966999999844,10.0.2.15,54.93.77.70,TCP,54,34692  >  9001 [ACK] Seq=23329753 Ack=429242575 Win=65535 Len=0
1,2.0641599999999016,54.93.77.70,10.0.2.15,TCP,1502,"9001  >  34692 [PSH, ACK] Seq=429242575 Ack=23329753 Win=65535 Len=1448 [TCP segment of a reassembled PDU]"
1,2.0642040000002453,10.0.2.15,54.93.77.70,TCP,54,34692  >  9001 [ACK] Seq=23329753 Ack=429244023 Win=65535 Len=0
1,2.0722509999995964,54.93.77.70,10.0.2.15,TLSv1.2,8322,"Application Data, Application Data, Application Data"
1,2.072378999999273,10.0.2.15,54.93.77.70,TCP,54,34692  >  9001 [ACK] Seq=23329753 Ack=429252291 Win=65535 Len=0
1,2.0728259999996226,10.0.2.15,54.93.77.70,TLSv1.2,590,Application Data
1,2.072940000000017,54.93.77.70,10.0.2.15,TCP,60,9001  >  34692 [ACK] Seq=429252291 Ack=23330289 Win=65535 Len=0
1,2.082940000000235,10.0.2.15,54.93.77.70,TLSv1.2,590,Application Data
1,2.083113000000594,54.93.77.70,10.0.2.15,TCP,60,9001  >  34692 [ACK] Seq=429252291 Ack=23330825 Win=65535 Len=0
1,2.170524999999543,62.210.85.178,10.0.2.15,TLSv1.2,590,Application Data
1,2.2141389999997045,10.0.2.15,62.210.85.178,TCP,54,35978  >  9001 [ACK] Seq=429544373 Ack=23231555 Win=65535 Len=0
1,2.3149020000000746,62.210.85.178,10.0.2.15,TLSv1.2,590,Application Data
1,2.314979000000676,10.0.2.15,62.210.85.178,TCP,54,35978  >  9001 [ACK] Seq=429544373 Ack=23232091 Win=65535 Len=0
1,2.315473999999085,10.0.2.15,62.210.85.178,TLSv1.2,590,Application Data
1,2.315582999999606,62.210.85.178,10.0.2.15,TCP,60,9001  >  35978 [ACK] Seq=23232091 Ack=429544909 Win=65535 Len=0
1,2.4287769999991724,54.93.77.70,10.0.2.15,TLSv1.2,590,Application Data
1,2.4291419999990467,10.0.2.15,54.93.77.70,TLSv1.2,590,Application Data
1,2.4292700000005425,54.93.77.70,10.0.2.15,TCP,60,9001  >  34692 [ACK] Seq=429252827 Ack=23331361 Win=65535 Len=0
1,2.6220180000000255,62.210.85.178,10.0.2.15,TLSv1.2,590,Application Data
1,2.6278069999989384,10.0.2.15,62.210.85.178,TLSv1.2,590,Application Data
1,2.627984999999171,62.210.85.178,10.0.2.15,TCP,60,9001  >  35978 [ACK] Seq=23232627 Ack=429545445 Win=65535 Len=0
1,2.6382080000003043,10.0.2.15,62.210.85.178,TLSv1.2,4124,Application Data
1,2.6383139999998093,10.0.2.15,62.210.85.178,TCP,2974,35978  >  9001 [ACK] Seq=429549515 Ack=23232627 Win=65535 Len=2920 [TCP segment of a reassembled PDU]
1,2.6383569999998144,62.210.85.178,10.0.2.15,TCP,60,9001  >  35978 [ACK] Seq=23232627 Ack=429546905 Win=65535 Len=0
1,2.6383679999999003,62.210.85.178,10.0.2.15,TCP,60,9001  >  35978 [ACK] Seq=23232627 Ack=429548365 Win=65535 Len=0
1,2.6383719999994355,62.210.85.178,10.0.2.15,TCP,60,9001  >  35978 [ACK] Seq=23232627 Ack=429549515 Win=65535 Len=0
1,2.638375000000451,62.210.85.178,10.0.2.15,TCP,60,9001  >  35978 [ACK] Seq=23232627 Ack=429550975 Win=65535 Len=0
1,2.6383779999996477,62.210.85.178,10.0.2.15,TCP,60,9001  >  35978 [ACK] Seq=23232627 Ack=429552435 Win=65535 Len=0
1,2.6384199999993143,10.0.2.15,62.210.85.178,TLSv1.2,1204,Application Data
1,2.638478999999279,62.210.85.178,10.0.2.15,TCP,60,9001  >  35978 [ACK] Seq=23232627 Ack=429553585 Win=65535 Len=0
1,2.638539999999921,10.0.2.15,62.210.85.178,TLSv1.2,4124,Application Data
1,2.6386010000005626,62.210.85.178,10.0.2.15,TCP,60,9001  >  35978 [ACK] Seq=23232627 Ack=429555045 Win=65535 Len=0
1,2.6386099999999715,62.210.85.178,10.0.2.15,TCP,60,9001  >  35978 [ACK] Seq=23232627 Ack=429556505 Win=65535 Len=0
1,2.6386139999995066,62.210.85.178,10.0.2.15,TCP,60,9001  >  35978 [ACK] Seq=23232627 Ack=429557655 Win=65535 Len=0
1,2.6386619999993854,10.0.2.15,62.210.85.178,TLSv1.2,4124,Application Data
1,2.638699999999517,62.210.85.178,10.0.2.15,TCP,60,9001  >  35978 [ACK] Seq=23232627 Ack=429559115 Win=65535 Len=0
1,2.638708000000406,62.210.85.178,10.0.2.15,TCP,60,9001  >  35978 [ACK] Seq=23232627 Ack=429560575 Win=65535 Len=0
1,2.638767000000371,10.0.2.15,62.210.85.178,TLSv1.2,2974,Application Data
1,2.6388029999998253,62.210.85.178,10.0.2.15,TCP,60,9001  >  35978 [ACK] Seq=23232627 Ack=429561725 Win=65535 Len=0
1,2.6388109999988956,62.210.85.178,10.0.2.15,TCP,60,9001  >  35978 [ACK] Seq=23232627 Ack=429563185 Win=65535 Len=0
1,2.6388150000002497,62.210.85.178,10.0.2.15,TCP,60,9001  >  35978 [ACK] Seq=23232627 Ack=429564645 Win=65535 Len=0
1,2.6388420000002952,10.0.2.15,62.210.85.178,TLSv1.2,1226,Application Data
1,2.638872999999876,62.210.85.178,10.0.2.15,TCP,60,9001  >  35978 [ACK] Seq=23232627 Ack=429565817 Win=65535 Len=0
1,2.638913999999204,10.0.2.15,62.210.85.178,TLSv1.2,4124,Application Data
1,2.6389479999998002,62.210.85.178,10.0.2.15,TCP,60,9001  >  35978 [ACK] Seq=23232627 Ack=429567277 Win=65535 Len=0
1,2.638955000000351,62.210.85.178,10.0.2.15,TCP,60,9001  >  35978 [ACK] Seq=23232627 Ack=429568737 Win=65535 Len=0
1,2.6389579999995476,62.210.85.178,10.0.2.15,TCP,60,9001  >  35978 [ACK] Seq=23232627 Ack=429569887 Win=65535 Len=0
1,2.6389949999993405,10.0.2.15,62.210.85.178,TLSv1.2,3030,Application Data
1,2.639028999999937,62.210.85.178,10.0.2.15,TCP,60,9001  >  35978 [ACK] Seq=23232627 Ack=429571347 Win=65535 Len=0
1,2.6390360000004875,62.210.85.178,10.0.2.15,TCP,60,9001  >  35978 [ACK] Seq=23232627 Ack=429572807 Win=65535 Len=0
1,2.639038999999684,62.210.85.178,10.0.2.15,TCP,60,9001  >  35978 [ACK] Seq=23232627 Ack=429572863 Win=65535 Len=0
1,2.6503950000005716,10.0.2.15,62.210.85.178,TLSv1.2,4124,Application Data
1,2.6504640000002837,62.210.85.178,10.0.2.15,TCP,60,9001  >  35978 [ACK] Seq=23232627 Ack=429574323 Win=65535 Len=0
1,2.650471999999354,62.210.85.178,10.0.2.15,TCP,60,9001  >  35978 [ACK] Seq=23232627 Ack=429575783 Win=65535 Len=0
1,2.6504750000003696,62.210.85.178,10.0.2.15,TCP,60,9001  >  35978 [ACK] Seq=23232627 Ack=429576933 Win=65535 Len=0
1,2.650513000000501,10.0.2.15,62.210.85.178,TLSv1.2,4124,Application Data
1,2.6505639999995765,62.210.85.178,10.0.2.15,TCP,60,9001  >  35978 [ACK] Seq=23232627 Ack=429578393 Win=65535 Len=0
1,2.6505710000001272,62.210.85.178,10.0.2.15,TCP,60,9001  >  35978 [ACK] Seq=23232627 Ack=429579853 Win=65535 Len=0
1,2.650573999999324,62.210.85.178,10.0.2.15,TCP,60,9001  >  35978 [ACK] Seq=23232627 Ack=429581003 Win=65535 Len=0
1,2.650610000000597,10.0.2.15,62.210.85.178,TLSv1.2,4124,Application Data
1,2.6506439999993745,62.210.85.178,10.0.2.15,TCP,60,9001  >  35978 [ACK] Seq=23232627 Ack=429582463 Win=65535 Len=0
1,2.6506509999999253,62.210.85.178,10.0.2.15,TCP,60,9001  >  35978 [ACK] Seq=23232627 Ack=429583923 Win=65535 Len=0
1,2.6506549999994604,62.210.85.178,10.0.2.15,TCP,60,9001  >  35978 [ACK] Seq=23232627 Ack=429585073 Win=65535 Len=0
1,2.6506900000003952,10.0.2.15,62.210.85.178,TLSv1.2,4124,Application Data
1,2.6507239999991725,62.210.85.178,10.0.2.15,TCP,60,9001  >  35978 [ACK] Seq=23232627 Ack=429586533 Win=65535 Len=0
1,2.6507309999997233,62.210.85.178,10.0.2.15,TCP,60,9001  >  35978 [ACK] Seq=23232627 Ack=429587993 Win=65535 Len=0
1,2.65073399999892,62.210.85.178,10.0.2.15,TCP,60,9001  >  35978 [ACK] Seq=23232627 Ack=429589143 Win=65535 Len=0
1,2.6507669999991776,10.0.2.15,62.210.85.178,TLSv1.2,332,Application Data
1,2.6507999999994354,62.210.85.178,10.0.2.15,TCP,60,9001  >  35978 [ACK] Seq=23232627 Ack=429589421 Win=65535 Len=0
1,2.650847999999314,10.0.2.15,62.210.85.178,TLSv1.2,3868,Application Data
1,2.6508840000005875,62.210.85.178,10.0.2.15,TCP,60,9001  >  35978 [ACK] Seq=23232627 Ack=429590881 Win=65535 Len=0
1,2.6508909999993193,62.210.85.178,10.0.2.15,TCP,60,9001  >  35978 [ACK] Seq=23232627 Ack=429592341 Win=65535 Len=0
1,2.650894000000335,62.210.85.178,10.0.2.15,TCP,60,9001  >  35978 [ACK] Seq=23232627 Ack=429593235 Win=65535 Len=0
1,2.6509299999997893,10.0.2.15,62.210.85.178,TLSv1.2,4124,Application Data
1,2.650964999998905,62.210.85.178,10.0.2.15,TCP,60,9001  >  35978 [ACK] Seq=23232627 Ack=429594695 Win=65535 Len=0
1,2.6509709999991173,62.210.85.178,10.0.2.15,TCP,60,9001  >  35978 [ACK] Seq=23232627 Ack=429596155 Win=65535 Len=0
1,2.650974000000133,62.210.85.178,10.0.2.15,TCP,60,9001  >  35978 [ACK] Seq=23232627 Ack=429597305 Win=65535 Len=0
1,2.6510079999989102,10.0.2.15,62.210.85.178,TLSv1.2,3030,Application Data
1,2.6510440000001836,62.210.85.178,10.0.2.15,TCP,60,9001  >  35978 [ACK] Seq=23232627 Ack=429598765 Win=65535 Len=0
1,2.6510509999989154,62.210.85.178,10.0.2.15,TCP,60,9001  >  35978 [ACK] Seq=23232627 Ack=429600225 Win=65535 Len=0
1,2.651053999999931,62.210.85.178,10.0.2.15,TCP,60,9001  >  35978 [ACK] Seq=23232627 Ack=429600281 Win=65535 Len=0
1,2.662376000000222,10.0.2.15,62.210.85.178,TLSv1.2,4124,Application Data
1,2.6625089999997726,10.0.2.15,62.210.85.178,TCP,2974,35978  >  9001 [ACK] Seq=429604351 Ack=23232627 Win=65535 Len=2920 [TCP segment of a reassembled PDU]
1,2.6625629999998637,62.210.85.178,10.0.2.15,TCP,60,9001  >  35978 [ACK] Seq=23232627 Ack=429601741 Win=65535 Len=0
1,2.662575000000288,62.210.85.178,10.0.2.15,TCP,60,9001  >  35978 [ACK] Seq=23232627 Ack=429603201 Win=65535 Len=0
1,2.662580000000162,62.210.85.178,10.0.2.15,TCP,60,9001  >  35978 [ACK] Seq=23232627 Ack=429604351 Win=65535 Len=0
1,2.6625850000000355,62.210.85.178,10.0.2.15,TCP,60,9001  >  35978 [ACK] Seq=23232627 Ack=429605811 Win=65535 Len=0
1,2.662589999999909,62.210.85.178,10.0.2.15,TCP,60,9001  >  35978 [ACK] Seq=23232627 Ack=429607271 Win=65535 Len=0
1,2.6626280000000406,10.0.2.15,62.210.85.178,TLSv1.2,1204,Application Data
1,2.6626670000005106,62.210.85.178,10.0.2.15,TCP,60,9001  >  35978 [ACK] Seq=23232627 Ack=429608421 Win=65535 Len=0
1,2.6627129999997123,10.0.2.15,62.210.85.178,TLSv1.2,4124,Application Data
1,2.6627520000001823,62.210.85.178,10.0.2.15,TCP,60,9001  >  35978 [ACK] Seq=23232627 Ack=429609881 Win=65535 Len=0
1,2.662800000000061,10.0.2.15,62.210.85.178,TCP,2974,35978  >  9001 [ACK] Seq=429612491 Ack=23232627 Win=65535 Len=2920 [TCP segment of a reassembled PDU]
1,2.662839000000531,62.210.85.178,10.0.2.15,TCP,60,9001  >  35978 [ACK] Seq=23232627 Ack=429611341 Win=65535 Len=0
1,2.6628469999996014,62.210.85.178,10.0.2.15,TCP,60,9001  >  35978 [ACK] Seq=23232627 Ack=429612491 Win=65535 Len=0
1,2.6628509999991365,62.210.85.178,10.0.2.15,TCP,60,9001  >  35978 [ACK] Seq=23232627 Ack=429613951 Win=65535 Len=0
1,2.662854000000152,62.210.85.178,10.0.2.15,TCP,60,9001  >  35978 [ACK] Seq=23232627 Ack=429615411 Win=65535 Len=0
1,2.662882000000536,10.0.2.15,62.210.85.178,TLSv1.2,946,Application Data
1,2.662919000000329,62.210.85.178,10.0.2.15,TCP,60,9001  >  35978 [ACK] Seq=23232627 Ack=429616303 Win=65535 Len=0
1,2.73356799999965,54.93.77.70,10.0.2.15,TLSv1.2,590,Application Data
1,2.752801000000545,54.93.77.70,10.0.2.15,TCP,2950,"9001  >  34692 [PSH, ACK] Seq=429253363 Ack=23331361 Win=65535 Len=2896 [TCP segment of a reassembled PDU]"
1,2.7528999999994994,10.0.2.15,54.93.77.70,TCP,54,34692  >  9001 [ACK] Seq=23331361 Ack=429256259 Win=65535 Len=0
1,2.7704929999999877,54.93.77.70,10.0.2.15,TLSv1.2,778,Application Data
1,2.772751000000426,54.93.77.70,10.0.2.15,TCP,2950,"9001  >  34692 [PSH, ACK] Seq=429256983 Ack=23331361 Win=65535 Len=2896 [TCP segment of a reassembled PDU]"
1,2.7727990000003047,10.0.2.15,54.93.77.70,TCP,54,34692  >  9001 [ACK] Seq=23331361 Ack=429259879 Win=65535 Len=0
1,2.777647999999317,54.93.77.70,10.0.2.15,TLSv1.2,7294,"Application Data, Application Data"
1,2.7777210000003834,10.0.2.15,54.93.77.70,TCP,54,34692  >  9001 [ACK] Seq=23331361 Ack=429267119 Win=65535 Len=0
1,2.7870399999992514,54.93.77.70,10.0.2.15,TLSv1.2,2950,Application Data [TCP segment of a reassembled PDU]
1,2.7871199999990495,10.0.2.15,54.93.77.70,TCP,54,34692  >  9001 [ACK] Seq=23331361 Ack=429270015 Win=65535 Len=0
1,2.8048349999990023,54.93.77.70,10.0.2.15,TLSv1.2,5846,Application Data [TCP segment of a reassembled PDU]
1,2.8048610000005283,54.93.77.70,10.0.2.15,TLSv1.2,2950,Application Data [TCP segment of a reassembled PDU]
1,2.8049300000002404,10.0.2.15,54.93.77.70,TCP,54,34692  >  9001 [ACK] Seq=23331361 Ack=429278703 Win=65535 Len=0
1,2.805871999998999,54.93.77.70,10.0.2.15,TLSv1.2,3044,Application Data [TCP segment of a reassembled PDU]
1,2.805924000000232,10.0.2.15,54.93.77.70,TCP,54,34692  >  9001 [ACK] Seq=23331361 Ack=429281693 Win=65535 Len=0
1,2.806075000000419,10.0.2.15,54.93.77.70,TLSv1.2,590,Application Data
1,2.806135999999242,54.93.77.70,10.0.2.15,TCP,60,9001  >  34692 [ACK] Seq=429281693 Ack=23331897 Win=65535 Len=0
1,2.8108790000005683,54.93.77.70,10.0.2.15,TLSv1.2,5846,"Application Data, Application Data"
1,2.8108979999997246,54.93.77.70,10.0.2.15,TLSv1.2,5846,Application Data [TCP segment of a reassembled PDU]
1,2.810958000000028,10.0.2.15,54.93.77.70,TCP,54,34692  >  9001 [ACK] Seq=23331897 Ack=429293277 Win=65535 Len=0
1,2.820130000000063,54.93.77.70,10.0.2.15,TLSv1.2,2950,Application Data [TCP segment of a reassembled PDU]
1,2.820191999999224,10.0.2.15,54.93.77.70,TCP,54,34692  >  9001 [ACK] Seq=23331897 Ack=429296173 Win=65535 Len=0
1,2.8231550000000425,54.93.77.70,10.0.2.15,TLSv1.2,2950,Application Data [TCP segment of a reassembled PDU]
1,2.8232009999992442,10.0.2.15,54.93.77.70,TCP,54,34692  >  9001 [ACK] Seq=23331897 Ack=429299069 Win=65535 Len=0
1,2.82592300000033,54.93.77.70,10.0.2.15,TLSv1.2,3486,"Application Data, Application Data"
1,2.825966000000335,10.0.2.15,54.93.77.70,TCP,54,34692  >  9001 [ACK] Seq=23331897 Ack=429302501 Win=65535 Len=0
1,2.8417030000000523,54.93.77.70,10.0.2.15,TLSv1.2,5846,Application Data
1,2.8417310000004363,54.93.77.70,10.0.2.15,TLSv1.2,10190,"Application Data, Application Data"
1,2.8418079999992187,10.0.2.15,54.93.77.70,TCP,54,34692  >  9001 [ACK] Seq=23331897 Ack=429318429 Win=65535 Len=0
1,2.8419639999992796,10.0.2.15,54.93.77.70,TLSv1.2,1104,Application Data
1,2.8420310000001336,54.93.77.70,10.0.2.15,TCP,60,9001  >  34692 [ACK] Seq=429318429 Ack=23332947 Win=65535 Len=0
1,2.842220999998972,54.93.77.70,10.0.2.15,TLSv1.2,148,Application Data
1,2.860011000000668,54.93.77.70,10.0.2.15,TCP,2950,"9001  >  34692 [PSH, ACK] Seq=429318523 Ack=23332947 Win=65535 Len=2896 [TCP segment of a reassembled PDU]"
1,2.860106000000087,10.0.2.15,54.93.77.70,TCP,54,34692  >  9001 [ACK] Seq=23332947 Ack=429321419 Win=65535 Len=0
1,2.876539999999295,54.93.77.70,10.0.2.15,TLSv1.2,264,Application Data
1,2.8767969999989873,54.93.77.70,10.0.2.15,TCP,1502,"9001  >  34692 [PSH, ACK] Seq=429321629 Ack=23332947 Win=65535 Len=1448 [TCP segment of a reassembled PDU]"
1,2.8768399999989924,10.0.2.15,54.93.77.70,TCP,54,34692  >  9001 [ACK] Seq=23332947 Ack=429323077 Win=65535 Len=0
1,2.893047999999908,54.93.77.70,10.0.2.15,TLSv1.2,1198,Application Data
1,2.896045999999842,10.0.2.15,54.93.77.70,TLSv1.2,590,Application Data
1,2.8962250000004133,54.93.77.70,10.0.2.15,TCP,60,9001  >  34692 [ACK] Seq=429324221 Ack=23333483 Win=65535 Len=0
1,2.9211259999992762,62.210.85.178,10.0.2.15,TLSv1.2,590,Application Data
1,2.962145999999848,10.0.2.15,62.210.85.178,TCP,54,35978  >  9001 [ACK] Seq=429616303 Ack=23233163 Win=65535 Len=0
1,2.979099000000133,62.210.85.178,10.0.2.15,TLSv1.2,1104,Application Data
1,2.979193999999552,10.0.2.15,62.210.85.178,TCP,54,35978  >  9001 [ACK] Seq=429616303 Ack=23234213 Win=65535 Len=0
1,3.0413040000003093,62.210.85.178,10.0.2.15,TLSv1.2,590,Application Data
1,3.0413809999990917,10.0.2.15,62.210.85.178,TCP,54,35978  >  9001 [ACK] Seq=429616303 Ack=23234749 Win=65535 Len=0
1,3.0419179999989865,10.0.2.15,62.210.85.178,TLSv1.2,590,Application Data
1,3.0420979999998963,62.210.85.178,10.0.2.15,TCP,60,9001  >  35978 [ACK] Seq=23234749 Ack=429616839 Win=65535 Len=0
1,3.2364919999999984,54.93.77.70,10.0.2.15,TLSv1.2,590,Application Data
1,3.2368569999998726,10.0.2.15,54.93.77.70,TLSv1.2,590,Application Data
1,3.23696899999959,54.93.77.70,10.0.2.15,TCP,60,9001  >  34692 [ACK] Seq=429324757 Ack=23334019 Win=65535 Len=0
1,3.344608999999764,62.210.85.178,10.0.2.15,TLSv1.2,590,Application Data
1,3.3484989999997197,10.0.2.15,62.210.85.178,TLSv1.2,590,Application Data
1,3.348660999999993,62.210.85.178,10.0.2.15,TCP,60,9001  >  35978 [ACK] Seq=23235285 Ack=429617375 Win=65535 Len=0
1,3.3583880000005593,10.0.2.15,62.210.85.178,TLSv1.2,4124,Application Data
1,3.3588010000003123,62.210.85.178,10.0.2.15,TCP,60,9001  >  35978 [ACK] Seq=23235285 Ack=429618835 Win=65535 Len=0
1,3.358820999999807,62.210.85.178,10.0.2.15,TCP,60,9001  >  35978 [ACK] Seq=23235285 Ack=429620295 Win=65535 Len=0
1,3.3588249999993423,62.210.85.178,10.0.2.15,TCP,60,9001  >  35978 [ACK] Seq=23235285 Ack=429621445 Win=65535 Len=0
1,3.3589149999988877,10.0.2.15,62.210.85.178,TLSv1.2,4124,Application Data
1,3.358985999999277,62.210.85.178,10.0.2.15,TCP,60,9001  >  35978 [ACK] Seq=23235285 Ack=429622905 Win=65535 Len=0
1,3.35899900000004,62.210.85.178,10.0.2.15,TCP,60,9001  >  35978 [ACK] Seq=23235285 Ack=429624365 Win=65535 Len=0
1,3.3590039999999135,62.210.85.178,10.0.2.15,TCP,60,9001  >  35978 [ACK] Seq=23235285 Ack=429625515 Win=65535 Len=0
1,3.359056999999666,10.0.2.15,62.210.85.178,TLSv1.2,4124,Application Data
1,3.3591030000006867,62.210.85.178,10.0.2.15,TCP,60,9001  >  35978 [ACK] Seq=23235285 Ack=429626975 Win=65535 Len=0
1,3.359110999999757,62.210.85.178,10.0.2.15,TCP,60,9001  >  35978 [ACK] Seq=23235285 Ack=429628435 Win=65535 Len=0
1,3.3591159999996307,62.210.85.178,10.0.2.15,TCP,60,9001  >  35978 [ACK] Seq=23235285 Ack=429629585 Win=65535 Len=0
1,3.359162999999171,10.0.2.15,62.210.85.178,TLSv1.2,4124,Application Data
1,3.3592029999999795,62.210.85.178,10.0.2.15,TCP,60,9001  >  35978 [ACK] Seq=23235285 Ack=429631045 Win=65535 Len=0
1,3.359212999999727,62.210.85.178,10.0.2.15,TCP,60,9001  >  35978 [ACK] Seq=23235285 Ack=429632505 Win=65535 Len=0
1,3.359216999999262,62.210.85.178,10.0.2.15,TCP,60,9001  >  35978 [ACK] Seq=23235285 Ack=429633655 Win=65535 Len=0
1,3.359255999999732,10.0.2.15,62.210.85.178,TLSv1.2,332,Application Data
1,3.3592939999998634,62.210.85.178,10.0.2.15,TCP,60,9001  >  35978 [ACK] Seq=23235285 Ack=429633933 Win=65535 Len=0
1,3.359350999999151,10.0.2.15,62.210.85.178,TLSv1.2,3868,Application Data
1,3.3593909999999596,62.210.85.178,10.0.2.15,TCP,60,9001  >  35978 [ACK] Seq=23235285 Ack=429635393 Win=65535 Len=0
1,3.35939899999903,62.210.85.178,10.0.2.15,TCP,60,9001  >  35978 [ACK] Seq=23235285 Ack=429636853 Win=65535 Len=0
1,3.359403000000384,62.210.85.178,10.0.2.15,TCP,60,9001  >  35978 [ACK] Seq=23235285 Ack=429637747 Win=65535 Len=0
1,3.359441999999035,10.0.2.15,62.210.85.178,TLSv1.2,4124,Application Data
1,3.359480999999505,62.210.85.178,10.0.2.15,TCP,60,9001  >  35978 [ACK] Seq=23235285 Ack=429639207 Win=65535 Len=0
1,3.3594890000003943,62.210.85.178,10.0.2.15,TCP,60,9001  >  35978 [ACK] Seq=23235285 Ack=429640667 Win=65535 Len=0
1,3.3594929999999295,62.210.85.178,10.0.2.15,TCP,60,9001  >  35978 [ACK] Seq=23235285 Ack=429641817 Win=65535 Len=0
1,3.359528999999384,10.0.2.15,62.210.85.178,TLSv1.2,974,Application Data
1,3.3595669999995152,62.210.85.178,10.0.2.15,TCP,60,9001  >  35978 [ACK] Seq=23235285 Ack=429642737 Win=65535 Len=0
1,3.4591479999999137,54.93.77.70,10.0.2.15,TLSv1.2,590,Application Data
1,3.4808279999997467,54.93.77.70,10.0.2.15,TLSv1.2,5846,Application Data
1,3.480870999999752,54.93.77.70,10.0.2.15,TLSv1.2,4398,Application Data [TCP segment of a reassembled PDU]
1,3.480976999999257,10.0.2.15,54.93.77.70,TCP,54,34692  >  9001 [ACK] Seq=23334019 Ack=429335429 Win=65535 Len=0
1,3.482421999999133,54.93.77.70,10.0.2.15,TCP,1502,"9001  >  34692 [PSH, ACK] Seq=429335429 Ack=23334019 Win=65535 Len=1448 [TCP segment of a reassembled PDU]"
1,3.482464999999138,10.0.2.15,54.93.77.70,TCP,54,34692  >  9001 [ACK] Seq=23334019 Ack=429336877 Win=65535 Len=0
1,3.5013049999997747,54.93.77.70,10.0.2.15,TLSv1.2,358,Application Data
1,3.521575999999186,54.93.77.70,10.0.2.15,TCP,2950,"9001  >  34692 [PSH, ACK] Seq=429337181 Ack=23334019 Win=65535 Len=2896 [TCP segment of a reassembled PDU]"
1,3.521756000000096,10.0.2.15,54.93.77.70,TCP,54,34692  >  9001 [ACK] Seq=23334019 Ack=429340077 Win=65535 Len=0
1,3.522646999999779,54.93.77.70,10.0.2.15,TLSv1.2,778,Application Data
1,3.5321399999993446,54.93.77.70,10.0.2.15,TLSv1.2,8742,"Application Data, Application Data"
1,3.532231999999567,10.0.2.15,54.93.77.70,TCP,54,34692  >  9001 [ACK] Seq=23334019 Ack=429349489 Win=65535 Len=0
1,3.548737999999503,54.93.77.70,10.0.2.15,TLSv1.2,1198,Application Data
1,3.5520199999991746,10.0.2.15,54.93.77.70,TLSv1.2,590,Application Data
1,3.5522129999990284,54.93.77.70,10.0.2.15,TCP,60,9001  >  34692 [ACK] Seq=429350633 Ack=23334555 Win=65535 Len=0
1,3.749178000000029,62.210.85.178,10.0.2.15,TLSv1.2,590,Application Data
1,3.7495359999993525,10.0.2.15,62.210.85.178,TLSv1.2,590,Application Data
1,3.7496589999991556,62.210.85.178,10.0.2.15,TCP,60,9001  >  35978 [ACK] Seq=23235821 Ack=429643273 Win=65535 Len=0
1,3.9539869999989605,54.93.77.70,10.0.2.15,TLSv1.2,590,Application Data
1,3.9544439999990573,10.0.2.15,54.93.77.70,TLSv1.2,590,Application Data
1,3.954580999999962,54.93.77.70,10.0.2.15,TCP,60,9001  >  34692 [ACK] Seq=429351169 Ack=23335091 Win=65535 Len=0
1,4.158672999999908,62.210.85.178,10.0.2.15,TLSv1.2,590,Application Data
1,4.166283000000476,10.0.2.15,62.210.85.178,TLSv1.2,590,Application Data
1,4.166434000000663,62.210.85.178,10.0.2.15,TCP,60,9001  >  35978 [ACK] Seq=23236357 Ack=429643809 Win=65535 Len=0
1,4.179008999999496,10.0.2.15,62.210.85.178,TLSv1.2,4124,Application Data
1,4.179113000000143,10.0.2.15,62.210.85.178,TCP,2974,35978  >  9001 [ACK] Seq=429647879 Ack=23236357 Win=65535 Len=2920 [TCP segment of a reassembled PDU]
1,4.179153999999471,62.210.85.178,10.0.2.15,TCP,60,9001  >  35978 [ACK] Seq=23236357 Ack=429645269 Win=65535 Len=0
1,4.1791639999992185,62.210.85.178,10.0.2.15,TCP,60,9001  >  35978 [ACK] Seq=23236357 Ack=429646729 Win=65535 Len=0
1,4.179168999999092,62.210.85.178,10.0.2.15,TCP,60,9001  >  35978 [ACK] Seq=23236357 Ack=429647879 Win=65535 Len=0
1,4.179173000000446,62.210.85.178,10.0.2.15,TCP,60,9001  >  35978 [ACK] Seq=23236357 Ack=429649339 Win=65535 Len=0
1,4.1791769999999815,62.210.85.178,10.0.2.15,TCP,60,9001  >  35978 [ACK] Seq=23236357 Ack=429650799 Win=65535 Len=0
1,4.179219999999987,10.0.2.15,62.210.85.178,TLSv1.2,1204,Application Data
1,4.17928799999936,10.0.2.15,62.210.85.178,TCP,2974,35978  >  9001 [ACK] Seq=429651949 Ack=23236357 Win=65535 Len=2920 [TCP segment of a reassembled PDU]
1,4.179328000000169,62.210.85.178,10.0.2.15,TCP,60,9001  >  35978 [ACK] Seq=23236357 Ack=429651949 Win=65535 Len=0
1,4.1793349999989005,62.210.85.178,10.0.2.15,TCP,60,9001  >  35978 [ACK] Seq=23236357 Ack=429653409 Win=65535 Len=0
1,4.179339000000255,62.210.85.178,10.0.2.15,TCP,60,9001  >  35978 [ACK] Seq=23236357 Ack=429654869 Win=65535 Len=0
1,4.17937399999937,10.0.2.15,62.210.85.178,TLSv1.2,1204,Application Data
1,4.179439999999886,10.0.2.15,62.210.85.178,TCP,2974,35978  >  9001 [ACK] Seq=429656019 Ack=23236357 Win=65535 Len=2920 [TCP segment of a reassembled PDU]
1,4.179476999999679,62.210.85.178,10.0.2.15,TCP,60,9001  >  35978 [ACK] Seq=23236357 Ack=429656019 Win=65535 Len=0
1,4.17948400000023,62.210.85.178,10.0.2.15,TCP,60,9001  >  35978 [ACK] Seq=23236357 Ack=429657479 Win=65535 Len=0
1,4.179487999999765,62.210.85.178,10.0.2.15,TCP,60,9001  >  35978 [ACK] Seq=23236357 Ack=429658939 Win=65535 Len=0
1,4.179518999999345,10.0.2.15,62.210.85.178,TLSv1.2,1204,Application Data
1,4.179598999999143,10.0.2.15,62.210.85.178,TLSv1.2,2974,Application Data
1,4.179635999998936,62.210.85.178,10.0.2.15,TCP,60,9001  >  35978 [ACK] Seq=23236357 Ack=429660089 Win=65535 Len=0
1,4.179642999999487,62.210.85.178,10.0.2.15,TCP,60,9001  >  35978 [ACK] Seq=23236357 Ack=429661549 Win=65535 Len=0
1,4.179647999999361,62.210.85.178,10.0.2.15,TCP,60,9001  >  35978 [ACK] Seq=23236357 Ack=429663009 Win=65535 Len=0
1,4.179678999998941,10.0.2.15,62.210.85.178,TLSv1.2,1226,Application Data
1,4.179740999999922,10.0.2.15,62.210.85.178,TCP,2974,35978  >  9001 [ACK] Seq=429664181 Ack=23236357 Win=65535 Len=2920 [TCP segment of a reassembled PDU]
1,4.179775999999038,62.210.85.178,10.0.2.15,TCP,60,9001  >  35978 [ACK] Seq=23236357 Ack=429664181 Win=65535 Len=0
1,4.179782999999588,62.210.85.178,10.0.2.15,TCP,60,9001  >  35978 [ACK] Seq=23236357 Ack=429665641 Win=65535 Len=0
1,4.1797869999991235,62.210.85.178,10.0.2.15,TCP,60,9001  >  35978 [ACK] Seq=23236357 Ack=429667101 Win=65535 Len=0
1,4.179818000000523,10.0.2.15,62.210.85.178,TLSv1.2,1204,Application Data
1,4.179857999999513,62.210.85.178,10.0.2.15,TCP,60,9001  >  35978 [ACK] Seq=23236357 Ack=429668251 Win=65535 Len=0
1,4.179901999999856,10.0.2.15,62.210.85.178,TLSv1.2,3030,Application Data
1,4.179943999999523,62.210.85.178,10.0.2.15,TCP,60,9001  >  35978 [ACK] Seq=23236357 Ack=429669711 Win=65535 Len=0
1,4.179951000000074,62.210.85.178,10.0.2.15,TCP,60,9001  >  35978 [ACK] Seq=23236357 Ack=429671171 Win=65535 Len=0
1,4.179954999999609,62.210.85.178,10.0.2.15,TCP,60,9001  >  35978 [ACK] Seq=23236357 Ack=429671227 Win=65535 Len=0
1,4.189256999999998,10.0.2.15,62.210.85.178,TLSv1.2,4124,Application Data
1,4.189399999999296,62.210.85.178,10.0.2.15,TCP,60,9001  >  35978 [ACK] Seq=23236357 Ack=429672687 Win=65535 Len=0
1,4.189415999999255,62.210.85.178,10.0.2.15,TCP,60,9001  >  35978 [ACK] Seq=23236357 Ack=429674147 Win=65535 Len=0
1,4.189422999999806,62.210.85.178,10.0.2.15,TCP,60,9001  >  35978 [ACK] Seq=23236357 Ack=429675297 Win=65535 Len=0
1,4.189480999999432,10.0.2.15,62.210.85.178,TLSv1.2,4124,Application Data
1,4.189521000000241,62.210.85.178,10.0.2.15,TCP,60,9001  >  35978 [ACK] Seq=23236357 Ack=429676757 Win=65535 Len=0
1,4.1895279999989725,62.210.85.178,10.0.2.15,TCP,60,9001  >  35978 [ACK] Seq=23236357 Ack=429678217 Win=65535 Len=0
1,4.189532000000327,62.210.85.178,10.0.2.15,TCP,60,9001  >  35978 [ACK] Seq=23236357 Ack=429679367 Win=65535 Len=0
1,4.189577999999528,10.0.2.15,62.210.85.178,TLSv1.2,4124,Application Data
1,4.189624000000549,62.210.85.178,10.0.2.15,TCP,60,9001  >  35978 [ACK] Seq=23236357 Ack=429680827 Win=65535 Len=0
1,4.189630999999281,62.210.85.178,10.0.2.15,TCP,60,9001  >  35978 [ACK] Seq=23236357 Ack=429682287 Win=65535 Len=0
1,4.189635000000635,62.210.85.178,10.0.2.15,TCP,60,9001  >  35978 [ACK] Seq=23236357 Ack=429683437 Win=65535 Len=0
1,4.18967899999916,10.0.2.15,62.210.85.178,TLSv1.2,4124,Application Data
1,4.189758999998958,62.210.85.178,10.0.2.15,TCP,60,9001  >  35978 [ACK] Seq=23236357 Ack=429684897 Win=65535 Len=0
1,4.189766999999847,62.210.85.178,10.0.2.15,TCP,60,9001  >  35978 [ACK] Seq=23236357 Ack=429686357 Win=65535 Len=0
1,4.189770999999382,62.210.85.178,10.0.2.15,TCP,60,9001  >  35978 [ACK] Seq=23236357 Ack=429687507 Win=65535 Len=0
1,4.1898049999999785,10.0.2.15,62.210.85.178,TLSv1.2,332,Application Data
1,4.189877999999226,62.210.85.178,10.0.2.15,TCP,60,9001  >  35978 [ACK] Seq=23236357 Ack=429687785 Win=65535 Len=0
1,4.189925000000585,10.0.2.15,62.210.85.178,TLSv1.2,3868,Application Data
1,4.1899649999995745,62.210.85.178,10.0.2.15,TCP,60,9001  >  35978 [ACK] Seq=23236357 Ack=429689245 Win=65535 Len=0
1,4.189972000000125,62.210.85.178,10.0.2.15,TCP,60,9001  >  35978 [ACK] Seq=23236357 Ack=429690705 Win=65535 Len=0
1,4.18997599999966,62.210.85.178,10.0.2.15,TCP,60,9001  >  35978 [ACK] Seq=23236357 Ack=429691599 Win=65535 Len=0
1,4.190026000000216,10.0.2.15,62.210.85.178,TLSv1.2,3480,Application Data
1,4.190087999999378,62.210.85.178,10.0.2.15,TCP,60,9001  >  35978 [ACK] Seq=23236357 Ack=429693059 Win=65535 Len=0
1,4.190102000000479,62.210.85.178,10.0.2.15,TCP,60,9001  >  35978 [ACK] Seq=23236357 Ack=429694519 Win=65535 Len=0
1,4.190107000000353,62.210.85.178,10.0.2.15,TCP,60,9001  >  35978 [ACK] Seq=23236357 Ack=429695025 Win=65535 Len=0
1,4.287431999999171,54.93.77.70,10.0.2.15,TLSv1.2,3674,Application Data
1,4.287586999998894,10.0.2.15,54.93.77.70,TCP,54,34692  >  9001 [ACK] Seq=23335091 Ack=429354789 Win=65535 Len=0
1,4.311942000000272,54.93.77.70,10.0.2.15,TLSv1.2,7830,"Application Data, Application Data"
1,4.312072999999145,10.0.2.15,54.93.77.70,TCP,54,34692  >  9001 [ACK] Seq=23335091 Ack=429362565 Win=65535 Len=0
1,4.312326999999641,10.0.2.15,54.93.77.70,TLSv1.2,590,Application Data
1,4.3124470000002475,54.93.77.70,10.0.2.15,TCP,60,9001  >  34692 [ACK] Seq=429362565 Ack=23335627 Win=65535 Len=0
1,4.330109999998967,54.93.77.70,10.0.2.15,TLSv1.2,568,Application Data
1,4.331083999999464,54.93.77.70,10.0.2.15,TCP,1502,"9001  >  34692 [PSH, ACK] Seq=429363079 Ack=23335627 Win=65535 Len=1448 [TCP segment of a reassembled PDU]"
1,4.331135000000359,10.0.2.15,54.93.77.70,TCP,54,34692  >  9001 [ACK] Seq=23335627 Ack=429364527 Win=65535 Len=0
1,4.332625999999436,54.93.77.70,10.0.2.15,TLSv1.2,2950,Application Data [TCP segment of a reassembled PDU]
1,4.332689999999275,10.0.2.15,54.93.77.70,TCP,54,34692  >  9001 [ACK] Seq=23335627 Ack=429367423 Win=65535 Len=0
1,4.334265999999843,54.93.77.70,10.0.2.15,TLSv1.2,4398,Application Data [TCP segment of a reassembled PDU]
1,4.334313999999722,10.0.2.15,54.93.77.70,TCP,54,34692  >  9001 [ACK] Seq=23335627 Ack=429371767 Win=65535 Len=0
1,4.334783000000243,54.93.77.70,10.0.2.15,TLSv1.2,2950,"Application Data, Application Data"
1,4.334826000000248,10.0.2.15,54.93.77.70,TCP,54,34692  >  9001 [ACK] Seq=23335627 Ack=429374663 Win=65535 Len=0
1,4.343630999999732,54.93.77.70,10.0.2.15,TLSv1.2,8574,"Application Data, Application Data, Application Data"
1,4.34370300000046,10.0.2.15,54.93.77.70,TCP,54,34692  >  9001 [ACK] Seq=23335627 Ack=429383183 Win=65535 Len=0
1,4.34375,54.93.77.70,10.0.2.15,TCP,1670,"9001  >  34692 [PSH, ACK] Seq=429383183 Ack=23335627 Win=65535 Len=1616 [TCP segment of a reassembled PDU]"
1,4.34385199999997,10.0.2.15,54.93.77.70,TCP,54,34692  >  9001 [ACK] Seq=23335627 Ack=429384799 Win=65535 Len=0
1,4.344015999999101,10.0.2.15,54.93.77.70,TLSv1.2,590,Application Data
1,4.344090000000506,54.93.77.70,10.0.2.15,TCP,60,9001  >  34692 [ACK] Seq=429384799 Ack=23336163 Win=65535 Len=0
1,4.3527759999997215,54.93.77.70,10.0.2.15,TLSv1.2,2950,Application Data [TCP segment of a reassembled PDU]
1,4.35283200000049,10.0.2.15,54.93.77.70,TCP,54,34692  >  9001 [ACK] Seq=23336163 Ack=429387695 Win=65535 Len=0
1,4.354342999999062,54.93.77.70,10.0.2.15,TLSv1.2,2364,Application Data
1,4.354389000000083,10.0.2.15,54.93.77.70,TCP,54,34692  >  9001 [ACK] Seq=23336163 Ack=429390005 Win=65535 Len=0
1,4.362386000000697,54.93.77.70,10.0.2.15,TLSv1.2,7294,Application Data
1,4.362455999998929,10.0.2.15,54.93.77.70,TCP,54,34692  >  9001 [ACK] Seq=23336163 Ack=429397245 Win=65535 Len=0
1,4.374015999999756,54.93.77.70,10.0.2.15,TLSv1.2,1104,"Application Data, Application Data"
1,4.37468699999954,54.93.77.70,10.0.2.15,TCP,2950,"9001  >  34692 [PSH, ACK] Seq=429398295 Ack=23336163 Win=65535 Len=2896 [TCP segment of a reassembled PDU]"
1,4.3747349999994185,10.0.2.15,54.93.77.70,TCP,54,34692  >  9001 [ACK] Seq=23336163 Ack=429401191 Win=65535 Len=0
1,4.386911999999938,54.93.77.70,10.0.2.15,TLSv1.2,1502,Application Data [TCP segment of a reassembled PDU]
1,4.38697300000058,10.0.2.15,54.93.77.70,TCP,54,34692  >  9001 [ACK] Seq=23336163 Ack=429402639 Win=65535 Len=0
1,4.392561999999089,54.93.77.70,10.0.2.15,TLSv1.2,380,Application Data
1,4.395849999998973,10.0.2.15,54.93.77.70,TLSv1.2,590,Application Data
1,4.396107000000484,54.93.77.70,10.0.2.15,TCP,60,9001  >  34692 [ACK] Seq=429402965 Ack=23336699 Win=65535 Len=0
1,4.441800999999032,62.210.85.178,10.0.2.15,TLSv1.2,590,Application Data
1,4.482136000000537,10.0.2.15,62.210.85.178,TCP,54,35978  >  9001 [ACK] Seq=429695025 Ack=23236893 Win=65535 Len=0
1,4.502920999999333,62.210.85.178,10.0.2.15,TLSv1.2,1126,"Application Data, Application Data"
1,4.502984000000652,10.0.2.15,62.210.85.178,TCP,54,35978  >  9001 [ACK] Seq=429695025 Ack=23237965 Win=65535 Len=0
1,4.503495999999359,10.0.2.15,62.210.85.178,TLSv1.2,590,Application Data
1,4.503597999999329,62.210.85.178,10.0.2.15,TCP,60,9001  >  35978 [ACK] Seq=23237965 Ack=429695561 Win=65535 Len=0
1,4.595494999999573,54.93.77.70,10.0.2.15,TLSv1.2,590,Application Data
1,4.595921000000089,10.0.2.15,54.93.77.70,TLSv1.2,590,Application Data
1,4.5960570000006555,54.93.77.70,10.0.2.15,TCP,60,9001  >  34692 [ACK] Seq=429403501 Ack=23337235 Win=65535 Len=0
1,4.720799000000625,62.210.85.178,10.0.2.15,TLSv1.2,590,Application Data
1,4.726975999999922,10.0.2.15,62.210.85.178,TLSv1.2,590,Application Data
1,4.727155000000494,62.210.85.178,10.0.2.15,TCP,60,9001  >  35978 [ACK] Seq=23238501 Ack=429696097 Win=65535 Len=0
1,4.7386569999998756,10.0.2.15,62.210.85.178,TLSv1.2,4124,Application Data
1,4.738758999999845,10.0.2.15,62.210.85.178,TCP,2974,35978  >  9001 [ACK] Seq=429700167 Ack=23238501 Win=65535 Len=2920 [TCP segment of a reassembled PDU]
1,4.738806999999724,62.210.85.178,10.0.2.15,TCP,60,9001  >  35978 [ACK] Seq=23238501 Ack=429697557 Win=65535 Len=0
1,4.738822999999684,62.210.85.178,10.0.2.15,TCP,60,9001  >  35978 [ACK] Seq=23238501 Ack=429699017 Win=65535 Len=0
1,4.738826999999219,62.210.85.178,10.0.2.15,TCP,60,9001  >  35978 [ACK] Seq=23238501 Ack=429700167 Win=65535 Len=0
1,4.738828999999896,62.210.85.178,10.0.2.15,TCP,60,9001  >  35978 [ACK] Seq=23238501 Ack=429701627 Win=65535 Len=0
1,4.738831999999093,62.210.85.178,10.0.2.15,TCP,60,9001  >  35978 [ACK] Seq=23238501 Ack=429703087 Win=65535 Len=0
1,4.7388670000000275,10.0.2.15,62.210.85.178,TLSv1.2,1204,Application Data
1,4.738901999999143,62.210.85.178,10.0.2.15,TCP,60,9001  >  35978 [ACK] Seq=23238501 Ack=429704237 Win=65535 Len=0
1,4.738945999999487,10.0.2.15,62.210.85.178,TLSv1.2,4124,Application Data
1,4.738981000000422,62.210.85.178,10.0.2.15,TCP,60,9001  >  35978 [ACK] Seq=23238501 Ack=429705697 Win=65535 Len=0
1,4.7389879999991535,62.210.85.178,10.0.2.15,TCP,60,9001  >  35978 [ACK] Seq=23238501 Ack=429707157 Win=65535 Len=0
1,4.738992000000508,62.210.85.178,10.0.2.15,TCP,60,9001  >  35978 [ACK] Seq=23238501 Ack=429708307 Win=65535 Len=0
1,4.739030000000639,10.0.2.15,62.210.85.178,TLSv1.2,4124,Application Data
1,4.739062999999078,62.210.85.178,10.0.2.15,TCP,60,9001  >  35978 [ACK] Seq=23238501 Ack=429709767 Win=65535 Len=0
1,4.739069999999629,62.210.85.178,10.0.2.15,TCP,60,9001  >  35978 [ACK] Seq=23238501 Ack=429711227 Win=65535 Len=0
1,4.739110000000437,62.210.85.178,10.0.2.15,TCP,60,9001  >  35978 [ACK] Seq=23238501 Ack=429712377 Win=65535 Len=0
1,4.739143999999214,10.0.2.15,62.210.85.178,TLSv1.2,332,Application Data
1,4.739177999999811,62.210.85.178,10.0.2.15,TCP,60,9001  >  35978 [ACK] Seq=23238501 Ack=429712655 Win=65535 Len=0
1,4.739240999999311,10.0.2.15,62.210.85.178,TLSv1.2,3868,Application Data
1,4.7392779999991035,62.210.85.178,10.0.2.15,TCP,60,9001  >  35978 [ACK] Seq=23238501 Ack=429714115 Win=65535 Len=0
1,4.739284999999654,62.210.85.178,10.0.2.15,TCP,60,9001  >  35978 [ACK] Seq=23238501 Ack=429715575 Win=65535 Len=0
1,4.73928800000067,62.210.85.178,10.0.2.15,TCP,60,9001  >  35978 [ACK] Seq=23238501 Ack=429716469 Win=65535 Len=0
1,4.739325000000463,10.0.2.15,62.210.85.178,TLSv1.2,4124,Application Data
1,4.739359999999579,62.210.85.178,10.0.2.15,TCP,60,9001  >  35978 [ACK] Seq=23238501 Ack=429717929 Win=65535 Len=0
1,4.739365999999791,62.210.85.178,10.0.2.15,TCP,60,9001  >  35978 [ACK] Seq=23238501 Ack=429719389 Win=65535 Len=0
1,4.739368999998987,62.210.85.178,10.0.2.15,TCP,60,9001  >  35978 [ACK] Seq=23238501 Ack=429720539 Win=65535 Len=0
1,4.739403999999922,10.0.2.15,62.210.85.178,TLSv1.2,3030,Application Data
1,4.7394380000005185,62.210.85.178,10.0.2.15,TCP,60,9001  >  35978 [ACK] Seq=23238501 Ack=429721999 Win=65535 Len=0
1,4.73944499999925,62.210.85.178,10.0.2.15,TCP,60,9001  >  35978 [ACK] Seq=23238501 Ack=429723459 Win=65535 Len=0
1,4.739448000000266,62.210.85.178,10.0.2.15,TCP,60,9001  >  35978 [ACK] Seq=23238501 Ack=429723515 Win=65535 Len=0
1,4.750899000000572,10.0.2.15,62.210.85.178,TLSv1.2,4124,Application Data
1,4.750948999999309,62.210.85.178,10.0.2.15,TCP,60,9001  >  35978 [ACK] Seq=23238501 Ack=429724975 Win=65535 Len=0
1,4.750958999999057,62.210.85.178,10.0.2.15,TCP,60,9001  >  35978 [ACK] Seq=23238501 Ack=429726435 Win=65535 Len=0
1,4.750963000000411,62.210.85.178,10.0.2.15,TCP,60,9001  >  35978 [ACK] Seq=23238501 Ack=429727585 Win=65535 Len=0
1,4.751007999999274,10.0.2.15,62.210.85.178,TLSv1.2,4124,Application Data
1,4.7510609999990265,62.210.85.178,10.0.2.15,TCP,60,9001  >  35978 [ACK] Seq=23238501 Ack=429729045 Win=65535 Len=0
1,4.751067999999577,62.210.85.178,10.0.2.15,TCP,60,9001  >  35978 [ACK] Seq=23238501 Ack=429730505 Win=65535 Len=0
1,4.751071000000593,62.210.85.178,10.0.2.15,TCP,60,9001  >  35978 [ACK] Seq=23238501 Ack=429731655 Win=65535 Len=0
1,4.751108000000386,10.0.2.15,62.210.85.178,TLSv1.2,4124,Application Data
1,4.751141999999163,62.210.85.178,10.0.2.15,TCP,60,9001  >  35978 [ACK] Seq=23238501 Ack=429733115 Win=65535 Len=0
1,4.751150000000052,62.210.85.178,10.0.2.15,TCP,60,9001  >  35978 [ACK] Seq=23238501 Ack=429734575 Win=65535 Len=0
1,4.7511539999995875,62.210.85.178,10.0.2.15,TCP,60,9001  >  35978 [ACK] Seq=23238501 Ack=429735725 Win=65535 Len=0
1,4.751189000000522,10.0.2.15,62.210.85.178,TLSv1.2,4124,Application Data
1,4.751221999998961,62.210.85.178,10.0.2.15,TCP,60,9001  >  35978 [ACK] Seq=23238501 Ack=429737185 Win=65535 Len=0
1,4.75122999999985,62.210.85.178,10.0.2.15,TCP,60,9001  >  35978 [ACK] Seq=23238501 Ack=429738645 Win=65535 Len=0
1,4.751233999999386,62.210.85.178,10.0.2.15,TCP,60,9001  >  35978 [ACK] Seq=23238501 Ack=429739795 Win=65535 Len=0
1,4.751266999999643,10.0.2.15,62.210.85.178,TLSv1.2,332,Application Data
1,4.751299999999901,62.210.85.178,10.0.2.15,TCP,60,9001  >  35978 [ACK] Seq=23238501 Ack=429740073 Win=65535 Len=0
1,4.751350000000457,10.0.2.15,62.210.85.178,TLSv1.2,3868,Application Data
1,4.751385999999911,62.210.85.178,10.0.2.15,TCP,60,9001  >  35978 [ACK] Seq=23238501 Ack=429741533 Win=65535 Len=0
1,4.751393000000462,62.210.85.178,10.0.2.15,TCP,60,9001  >  35978 [ACK] Seq=23238501 Ack=429742993 Win=65535 Len=0
1,4.751395999999659,62.210.85.178,10.0.2.15,TCP,60,9001  >  35978 [ACK] Seq=23238501 Ack=429743887 Win=65535 Len=0
1,4.7514439999995375,10.0.2.15,62.210.85.178,TLSv1.2,4124,Application Data
1,4.751478000000134,62.210.85.178,10.0.2.15,TCP,60,9001  >  35978 [ACK] Seq=23238501 Ack=429745347 Win=65535 Len=0
1,4.751485999999204,62.210.85.178,10.0.2.15,TCP,60,9001  >  35978 [ACK] Seq=23238501 Ack=429746807 Win=65535 Len=0
1,4.751490000000558,62.210.85.178,10.0.2.15,TCP,60,9001  >  35978 [ACK] Seq=23238501 Ack=429747957 Win=65535 Len=0
1,4.751524999999674,10.0.2.15,62.210.85.178,TLSv1.2,3030,Application Data
1,4.751560000000609,62.210.85.178,10.0.2.15,TCP,60,9001  >  35978 [ACK] Seq=23238501 Ack=429749417 Win=65535 Len=0
1,4.751566999999341,62.210.85.178,10.0.2.15,TCP,60,9001  >  35978 [ACK] Seq=23238501 Ack=429750877 Win=65535 Len=0
1,4.751570000000356,62.210.85.178,10.0.2.15,TCP,60,9001  >  35978 [ACK] Seq=23238501 Ack=429750933 Win=65535 Len=0
1,4.760780000000523,10.0.2.15,62.210.85.178,TLSv1.2,4124,Application Data
1,4.760861000000659,62.210.85.178,10.0.2.15,TCP,60,9001  >  35978 [ACK] Seq=23238501 Ack=429752393 Win=65535 Len=0
1,4.760871000000407,62.210.85.178,10.0.2.15,TCP,60,9001  >  35978 [ACK] Seq=23238501 Ack=429753853 Win=65535 Len=0
1,4.760874999999942,62.210.85.178,10.0.2.15,TCP,60,9001  >  35978 [ACK] Seq=23238501 Ack=429755003 Win=65535 Len=0
1,4.76091599999927,10.0.2.15,62.210.85.178,TLSv1.2,4124,Application Data
1,4.760952000000543,62.210.85.178,10.0.2.15,TCP,60,9001  >  35978 [ACK] Seq=23238501 Ack=429756463 Win=65535 Len=0
1,4.760960999999952,62.210.85.178,10.0.2.15,TCP,60,9001  >  35978 [ACK] Seq=23238501 Ack=429757923 Win=65535 Len=0
1,4.760963999999149,62.210.85.178,10.0.2.15,TCP,60,9001  >  35978 [ACK] Seq=23238501 Ack=429759073 Win=65535 Len=0
1,4.761006999999154,10.0.2.15,62.210.85.178,TLSv1.2,4124,Application Data
1,4.761046999999962,62.210.85.178,10.0.2.15,TCP,60,9001  >  35978 [ACK] Seq=23238501 Ack=429760533 Win=65535 Len=0
1,4.761054999999033,62.210.85.178,10.0.2.15,TCP,60,9001  >  35978 [ACK] Seq=23238501 Ack=429761993 Win=65535 Len=0
1,4.761058000000048,62.210.85.178,10.0.2.15,TCP,60,9001  >  35978 [ACK] Seq=23238501 Ack=429763143 Win=65535 Len=0
1,4.761094999999841,10.0.2.15,62.210.85.178,TLSv1.2,4124,Application Data
1,4.761129000000437,62.210.85.178,10.0.2.15,TCP,60,9001  >  35978 [ACK] Seq=23238501 Ack=429764603 Win=65535 Len=0
1,4.761136999999508,62.210.85.178,10.0.2.15,TCP,60,9001  >  35978 [ACK] Seq=23238501 Ack=429766063 Win=65535 Len=0
1,4.761140000000523,62.210.85.178,10.0.2.15,TCP,60,9001  >  35978 [ACK] Seq=23238501 Ack=429767213 Win=65535 Len=0
1,4.761183999999048,10.0.2.15,62.210.85.178,TLSv1.2,332,Application Data
1,4.761266999999862,10.0.2.15,62.210.85.178,TCP,2974,35978  >  9001 [ACK] Seq=429767491 Ack=23238501 Win=65535 Len=2920 [TCP segment of a reassembled PDU]
1,4.7613170000004175,62.210.85.178,10.0.2.15,TCP,60,9001  >  35978 [ACK] Seq=23238501 Ack=429767491 Win=65535 Len=0
1,4.761324999999488,62.210.85.178,10.0.2.15,TCP,60,9001  >  35978 [ACK] Seq=23238501 Ack=429768951 Win=65535 Len=0
1,4.7613309999997,62.210.85.178,10.0.2.15,TCP,60,9001  >  35978 [ACK] Seq=23238501 Ack=429770411 Win=65535 Len=0
1,4.761362999999619,10.0.2.15,62.210.85.178,TLSv1.2,948,Application Data
1,4.761398999999074,62.210.85.178,10.0.2.15,TCP,60,9001  >  35978 [ACK] Seq=23238501 Ack=429771305 Win=65535 Len=0
1,4.761442999999417,10.0.2.15,62.210.85.178,TLSv1.2,2452,Application Data
1,4.761548000000403,62.210.85.178,10.0.2.15,TCP,60,9001  >  35978 [ACK] Seq=23238501 Ack=429772765 Win=65535 Len=0
1,4.761571999999433,62.210.85.178,10.0.2.15,TCP,60,9001  >  35978 [ACK] Seq=23238501 Ack=429773703 Win=65535 Len=0
1,4.847937999998976,54.93.77.70,10.0.2.15,TLSv1.2,590,Application Data
1,4.891717999998946,10.0.2.15,54.93.77.70,TCP,54,34692  >  9001 [ACK] Seq=23337235 Ack=429404037 Win=65535 Len=0
1,4.917331000000559,54.93.77.70,10.0.2.15,TLSv1.2,3674,Application Data
1,4.917421000000104,10.0.2.15,54.93.77.70,TCP,54,34692  >  9001 [ACK] Seq=23337235 Ack=429407657 Win=65535 Len=0
1,4.92432000000008,54.93.77.70,10.0.2.15,TLSv1.2,7294,Application Data
1,4.924386000000595,10.0.2.15,54.93.77.70,TCP,54,34692  >  9001 [ACK] Seq=23337235 Ack=429414897 Win=65535 Len=0
1,4.924589000000196,10.0.2.15,54.93.77.70,TLSv1.2,590,Application Data
1,4.9246579999999085,54.93.77.70,10.0.2.15,TCP,60,9001  >  34692 [ACK] Seq=429414897 Ack=23337771 Win=65535 Len=0
1,4.934385000000475,54.93.77.70,10.0.2.15,TLSv1.2,568,Application Data
1,4.952423999999155,54.93.77.70,10.0.2.15,TLSv1.2,590,Application Data
1,4.952524000000267,10.0.2.15,54.93.77.70,TCP,54,34692  >  9001 [ACK] Seq=23337771 Ack=429415947 Win=65535 Len=0
1,4.995512999999846,54.93.77.70,10.0.2.15,TLSv1.2,3674,Application Data
1,4.995660999999018,10.0.2.15,54.93.77.70,TCP,54,34692  >  9001 [ACK] Seq=23337771 Ack=429419567 Win=65535 Len=0
1,5.0033409999996366,54.93.77.70,10.0.2.15,TLSv1.2,7294,Application Data
1,5.003489000000627,10.0.2.15,54.93.77.70,TCP,54,34692  >  9001 [ACK] Seq=23337771 Ack=429426807 Win=65535 Len=0
1,5.011381000000256,54.93.77.70,10.0.2.15,TLSv1.2,4398,Application Data [TCP segment of a reassembled PDU]
1,5.0114379999995435,10.0.2.15,54.93.77.70,TCP,54,34692  >  9001 [ACK] Seq=23337771 Ack=429431151 Win=65535 Len=0
1,5.012468999999328,54.93.77.70,10.0.2.15,TLSv1.2,2950,Application Data [TCP segment of a reassembled PDU]
1,5.012511999999333,10.0.2.15,54.93.77.70,TCP,54,34692  >  9001 [ACK] Seq=23337771 Ack=429434047 Win=65535 Len=0
1,5.012698000000455,10.0.2.15,54.93.77.70,TLSv1.2,590,Application Data
1,5.012778000000253,54.93.77.70,10.0.2.15,TCP,60,9001  >  34692 [ACK] Seq=429434047 Ack=23338307 Win=65535 Len=0
1,5.014011999999639,54.93.77.70,10.0.2.15,TLSv1.2,1082,Application Data
1,5.032353000000512,54.93.77.70,10.0.2.15,TLSv1.2,4934,"Application Data, Application Data"
1,5.032481000000189,10.0.2.15,54.93.77.70,TCP,54,34692  >  9001 [ACK] Seq=23338307 Ack=429439955 Win=65535 Len=0
1,5.035635000000184,54.93.77.70,10.0.2.15,TLSv1.2,7294,Application Data [TCP segment of a reassembled PDU]
1,5.035722000000533,10.0.2.15,54.93.77.70,TCP,54,34692  >  9001 [ACK] Seq=23338307 Ack=429447195 Win=65535 Len=0
1,5.037091000000146,62.210.85.178,10.0.2.15,TLSv1.2,590,Application Data
1,5.052084999999352,54.93.77.70,10.0.2.15,TLSv1.2,5846,"Application Data, Application Data"
1,5.052168000000165,10.0.2.15,54.93.77.70,TCP,54,34692  >  9001 [ACK] Seq=23338307 Ack=429452987 Win=65535 Len=0
1,5.0523360000006505,54.93.77.70,10.0.2.15,TLSv1.2,1292,Application Data
1,5.062165999999706,54.93.77.70,10.0.2.15,TLSv1.2,5846,Application Data
1,5.062192999999752,54.93.77.70,10.0.2.15,TLSv1.2,5846,Application Data [TCP segment of a reassembled PDU]
1,5.062245999999504,10.0.2.15,54.93.77.70,TCP,54,34692  >  9001 [ACK] Seq=23338307 Ack=429460017 Win=65535 Len=0
1,5.062337999999727,10.0.2.15,54.93.77.70,TCP,54,34692  >  9001 [ACK] Seq=23338307 Ack=429465809 Win=65535 Len=0
1,5.062504999999874,10.0.2.15,54.93.77.70,TLSv1.2,590,Application Data
1,5.062577000000601,54.93.77.70,10.0.2.15,TCP,60,9001  >  34692 [ACK] Seq=429465809 Ack=23338843 Win=65535 Len=0
1,5.069407999999385,54.93.77.70,10.0.2.15,TLSv1.2,358,Application Data
1,5.072769000000335,10.0.2.15,54.93.77.70,TLSv1.2,590,Application Data
1,5.072866999998951,54.93.77.70,10.0.2.15,TCP,60,9001  >  34692 [ACK] Seq=429466113 Ack=23339379 Win=65535 Len=0
1,5.078094000000419,10.0.2.15,62.210.85.178,TCP,54,35978  >  9001 [ACK] Seq=429773703 Ack=23239037 Win=65535 Len=0
1,5.081082000000606,54.93.77.70,10.0.2.15,TCP,2950,"9001  >  34692 [PSH, ACK] Seq=429466113 Ack=23339379 Win=65535 Len=2896 [TCP segment of a reassembled PDU]"
1,5.081114999999045,54.93.77.70,10.0.2.15,TLSv1.2,7294,"Application Data, Application Data"
1,5.081216000000495,10.0.2.15,54.93.77.70,TCP,54,34692  >  9001 [ACK] Seq=23339379 Ack=429476249 Win=65535 Len=0
1,5.081958999999188,54.93.77.70,10.0.2.15,TLSv1.2,4398,Application Data [TCP segment of a reassembled PDU]
1,5.082005000000208,10.0.2.15,54.93.77.70,TCP,54,34692  >  9001 [ACK] Seq=23339379 Ack=429480593 Win=65535 Len=0
1,5.0969179999992775,54.93.77.70,10.0.2.15,TLSv1.2,1082,Application Data
1,5.097143999999389,10.0.2.15,54.93.77.70,TLSv1.2,590,Application Data
1,5.097239000000627,54.93.77.70,10.0.2.15,TCP,60,9001  >  34692 [ACK] Seq=429481621 Ack=23339915 Win=65535 Len=0
1,5.106905999999071,10.0.2.15,54.93.77.70,TLSv1.2,590,Application Data
1,5.1070419999996375,54.93.77.70,10.0.2.15,TCP,60,9001  >  34692 [ACK] Seq=429481621 Ack=23340451 Win=65535 Len=0
1,5.133429999999862,62.210.85.178,10.0.2.15,TLSv1.2,590,Application Data
1,5.133507999998983,10.0.2.15,62.210.85.178,TCP,54,35978  >  9001 [ACK] Seq=429773703 Ack=23239573 Win=65535 Len=0
1,5.182714999999007,62.210.85.178,10.0.2.15,TLSv1.2,590,Application Data
1,5.18279099999927,10.0.2.15,62.210.85.178,TCP,54,35978  >  9001 [ACK] Seq=429773703 Ack=23240109 Win=65535 Len=0
1,5.253623000000516,62.210.85.178,10.0.2.15,TLSv1.2,590,Application Data
1,5.253686000000016,10.0.2.15,62.210.85.178,TCP,54,35978  >  9001 [ACK] Seq=429773703 Ack=23240645 Win=65535 Len=0
1,5.31719399999929,62.210.85.178,10.0.2.15,TLSv1.2,1104,Application Data
1,5.317456000000675,10.0.2.15,62.210.85.178,TCP,54,35978  >  9001 [ACK] Seq=429773703 Ack=23241695 Win=65535 Len=0
1,5.318209999999453,10.0.2.15,62.210.85.178,TLSv1.2,590,Application Data
1,5.318366999999853,62.210.85.178,10.0.2.15,TCP,60,9001  >  35978 [ACK] Seq=23241695 Ack=429774239 Win=65535 Len=0
1,5.428115999999136,54.93.77.70,10.0.2.15,TLSv1.2,590,Application Data
1,5.428531999999905,10.0.2.15,54.93.77.70,TLSv1.2,590,Application Data
1,5.42866099999992,54.93.77.70,10.0.2.15,TCP,60,9001  >  34692 [ACK] Seq=429482157 Ack=23340987 Win=65535 Len=0
1,5.546759999999267,62.210.85.178,10.0.2.15,TLSv1.2,590,Application Data
1,5.550494999999501,10.0.2.15,62.210.85.178,TLSv1.2,590,Application Data
1,5.5506530000002385,62.210.85.178,10.0.2.15,TCP,60,9001  >  35978 [ACK] Seq=23242231 Ack=429774775 Win=65535 Len=0
1,5.56300100000044,10.0.2.15,62.210.85.178,TLSv1.2,4124,Application Data
1,5.563104999999268,10.0.2.15,62.210.85.178,TCP,2974,35978  >  9001 [ACK] Seq=429778845 Ack=23242231 Win=65535 Len=2920 [TCP segment of a reassembled PDU]
1,5.563146000000415,62.210.85.178,10.0.2.15,TCP,60,9001  >  35978 [ACK] Seq=23242231 Ack=429776235 Win=65535 Len=0
1,5.563157999999021,62.210.85.178,10.0.2.15,TCP,60,9001  >  35978 [ACK] Seq=23242231 Ack=429777695 Win=65535 Len=0
1,5.563162000000375,62.210.85.178,10.0.2.15,TCP,60,9001  >  35978 [ACK] Seq=23242231 Ack=429778845 Win=65535 Len=0
1,5.563168999999107,62.210.85.178,10.0.2.15,TCP,60,9001  >  35978 [ACK] Seq=23242231 Ack=429780305 Win=65535 Len=0
1,5.563173000000461,62.210.85.178,10.0.2.15,TCP,60,9001  >  35978 [ACK] Seq=23242231 Ack=429781765 Win=65535 Len=0
1,5.563208999999915,10.0.2.15,62.210.85.178,TLSv1.2,1204,Application Data
1,5.563242000000173,62.210.85.178,10.0.2.15,TCP,60,9001  >  35978 [ACK] Seq=23242231 Ack=429782915 Win=65535 Len=0
1,5.563286999999036,10.0.2.15,62.210.85.178,TLSv1.2,4124,Application Data
1,5.5633209999996325,62.210.85.178,10.0.2.15,TCP,60,9001  >  35978 [ACK] Seq=23242231 Ack=429784375 Win=65535 Len=0
1,5.563329999999041,62.210.85.178,10.0.2.15,TCP,60,9001  >  35978 [ACK] Seq=23242231 Ack=429785835 Win=65535 Len=0
1,5.563333000000057,62.210.85.178,10.0.2.15,TCP,60,9001  >  35978 [ACK] Seq=23242231 Ack=429786985 Win=65535 Len=0
1,5.563371000000188,10.0.2.15,62.210.85.178,TLSv1.2,4124,Application Data
1,5.563404999998966,62.210.85.178,10.0.2.15,TCP,60,9001  >  35978 [ACK] Seq=23242231 Ack=429788445 Win=65535 Len=0
1,5.563411999999516,62.210.85.178,10.0.2.15,TCP,60,9001  >  35978 [ACK] Seq=23242231 Ack=429789905 Win=65535 Len=0
1,5.563450999999986,62.210.85.178,10.0.2.15,TCP,60,9001  >  35978 [ACK] Seq=23242231 Ack=429791055 Win=65535 Len=0
1,5.563485000000583,10.0.2.15,62.210.85.178,TLSv1.2,332,Application Data
1,5.563517999999021,62.210.85.178,10.0.2.15,TCP,60,9001  >  35978 [ACK] Seq=23242231 Ack=429791333 Win=65535 Len=0
1,5.563570000000254,10.0.2.15,62.210.85.178,TLSv1.2,3868,Application Data
1,5.563608999998905,62.210.85.178,10.0.2.15,TCP,60,9001  >  35978 [ACK] Seq=23242231 Ack=429792793 Win=65535 Len=0
1,5.563614999999118,62.210.85.178,10.0.2.15,TCP,60,9001  >  35978 [ACK] Seq=23242231 Ack=429794253 Win=65535 Len=0
1,5.563618000000133,62.210.85.178,10.0.2.15,TCP,60,9001  >  35978 [ACK] Seq=23242231 Ack=429795147 Win=65535 Len=0
1,5.5636539999995875,10.0.2.15,62.210.85.178,TLSv1.2,1424,Application Data
1,5.563689000000522,62.210.85.178,10.0.2.15,TCP,60,9001  >  35978 [ACK] Seq=23242231 Ack=429796517 Win=65535 Len=0
1,5.79689800000051,54.93.77.70,10.0.2.15,TCP,2950,"9001  >  34692 [PSH, ACK] Seq=429482157 Ack=23340987 Win=65535 Len=2896 [TCP segment of a reassembled PDU]"
1,5.797029999999722,10.0.2.15,54.93.77.70,TCP,54,34692  >  9001 [ACK] Seq=23340987 Ack=429485053 Win=65535 Len=0
1,5.80184299999928,54.93.77.70,10.0.2.15,TLSv1.2,7808,"Application Data, Application Data, Application Data"
1,5.8018579999989015,54.93.77.70,10.0.2.15,TCP,1502,"9001  >  34692 [PSH, ACK] Seq=429492807 Ack=23340987 Win=65535 Len=1448 [TCP segment of a reassembled PDU]"
1,5.801916000000347,10.0.2.15,54.93.77.70,TCP,54,34692  >  9001 [ACK] Seq=23340987 Ack=429494255 Win=65535 Len=0
1,5.804140000000189,54.93.77.70,10.0.2.15,TLSv1.2,2950,Application Data [TCP segment of a reassembled PDU]
1,5.804189000000406,10.0.2.15,54.93.77.70,TCP,54,34692  >  9001 [ACK] Seq=23340987 Ack=429497151 Win=65535 Len=0
1,5.817164000000048,54.93.77.70,10.0.2.15,TLSv1.2,2950,"Application Data, Application Data"
1,5.817208000000392,10.0.2.15,54.93.77.70,TCP,54,34692  >  9001 [ACK] Seq=23340987 Ack=429500047 Win=65535 Len=0
1,5.819939999999406,54.93.77.70,10.0.2.15,TLSv1.2,4442,"Application Data, Application Data"
1,5.819982999999411,10.0.2.15,54.93.77.70,TCP,54,34692  >  9001 [ACK] Seq=23340987 Ack=429504435 Win=65535 Len=0
1,5.822324000000663,10.0.2.15,54.93.77.70,TLSv1.2,590,Application Data
1,5.822562999999718,54.93.77.70,10.0.2.15,TCP,60,9001  >  34692 [ACK] Seq=429504435 Ack=23341523 Win=65535 Len=0
1,6.003145999999106,62.210.85.178,10.0.2.15,TLSv1.2,590,Application Data
1,6.004472000000533,10.0.2.15,62.210.85.178,TLSv1.2,590,Application Data
1,6.004926999999952,62.210.85.178,10.0.2.15,TCP,60,9001  >  35978 [ACK] Seq=23242767 Ack=429797053 Win=65535 Len=0
1,6.20673700000043,54.93.77.70,10.0.2.15,TLSv1.2,590,Application Data
1,6.207123000000138,10.0.2.15,54.93.77.70,TLSv1.2,590,Application Data
1,6.20725499999935,54.93.77.70,10.0.2.15,TCP,60,9001  >  34692 [ACK] Seq=429504971 Ack=23342059 Win=65535 Len=0
1,6.294352999999319,10.0.2.15,152.89.104.206,TLSv1.3,590,Application Data
1,6.294502000000648,152.89.104.206,10.0.2.15,TCP,60,9001  >  47334 [ACK] Seq=122728 Ack=76483 Win=65535 Len=0
1,6.330939999999828,62.210.85.178,10.0.2.15,TLSv1.2,590,Application Data
1,6.33644699999968,10.0.2.15,62.210.85.178,TLSv1.2,590,Application Data
1,6.336600000000544,62.210.85.178,10.0.2.15,TCP,60,9001  >  35978 [ACK] Seq=23243303 Ack=429797589 Win=65535 Len=0
1,6.3467839999993885,10.0.2.15,62.210.85.178,TLSv1.2,4124,Application Data
1,6.346880999999485,10.0.2.15,62.210.85.178,TCP,2974,35978  >  9001 [ACK] Seq=429801659 Ack=23243303 Win=65535 Len=2920 [TCP segment of a reassembled PDU]
1,6.346959999998944,62.210.85.178,10.0.2.15,TCP,60,9001  >  35978 [ACK] Seq=23243303 Ack=429799049 Win=65535 Len=0
1,6.346975999998904,62.210.85.178,10.0.2.15,TCP,60,9001  >  35978 [ACK] Seq=23243303 Ack=429800509 Win=65535 Len=0
1,6.346978999999919,62.210.85.178,10.0.2.15,TCP,60,9001  >  35978 [ACK] Seq=23243303 Ack=429801659 Win=65535 Len=0
1,6.346981999999116,62.210.85.178,10.0.2.15,TCP,60,9001  >  35978 [ACK] Seq=23243303 Ack=429803119 Win=65535 Len=0
1,6.3469850000001315,62.210.85.178,10.0.2.15,TCP,60,9001  >  35978 [ACK] Seq=23243303 Ack=429804579 Win=65535 Len=0
1,6.347034000000349,10.0.2.15,62.210.85.178,TLSv1.2,1204,Application Data
1,6.347078999999212,62.210.85.178,10.0.2.15,TCP,60,9001  >  35978 [ACK] Seq=23243303 Ack=429805729 Win=65535 Len=0
1,6.347136000000319,10.0.2.15,62.210.85.178,TLSv1.2,4124,Application Data
1,6.34717499999897,62.210.85.178,10.0.2.15,TCP,60,9001  >  35978 [ACK] Seq=23243303 Ack=429807189 Win=65535 Len=0
1,6.347182999999859,62.210.85.178,10.0.2.15,TCP,60,9001  >  35978 [ACK] Seq=23243303 Ack=429808649 Win=65535 Len=0
1,6.347185999999056,62.210.85.178,10.0.2.15,TCP,60,9001  >  35978 [ACK] Seq=23243303 Ack=429809799 Win=65535 Len=0
1,6.347224999999526,10.0.2.15,62.210.85.178,TLSv1.2,4124,Application Data
1,6.347259000000122,62.210.85.178,10.0.2.15,TCP,60,9001  >  35978 [ACK] Seq=23243303 Ack=429811259 Win=65535 Len=0
1,6.347265000000334,62.210.85.178,10.0.2.15,TCP,60,9001  >  35978 [ACK] Seq=23243303 Ack=429812719 Win=65535 Len=0
1,6.34732299999996,10.0.2.15,62.210.85.178,TLSv1.2,2974,Application Data
1,6.347358999999415,62.210.85.178,10.0.2.15,TCP,60,9001  >  35978 [ACK] Seq=23243303 Ack=429813869 Win=65535 Len=0
1,6.347367000000304,62.210.85.178,10.0.2.15,TCP,60,9001  >  35978 [ACK] Seq=23243303 Ack=429815329 Win=65535 Len=0
1,6.347370999999839,62.210.85.178,10.0.2.15,TCP,60,9001  >  35978 [ACK] Seq=23243303 Ack=429816789 Win=65535 Len=0
1,6.347399000000223,10.0.2.15,62.210.85.178,TLSv1.2,1226,Application Data
1,6.347431000000142,62.210.85.178,10.0.2.15,TCP,60,9001  >  35978 [ACK] Seq=23243303 Ack=429817961 Win=65535 Len=0
1,6.347470999999132,10.0.2.15,62.210.85.178,TLSv1.2,4124,Application Data
1,6.347506000000067,62.210.85.178,10.0.2.15,TCP,60,9001  >  35978 [ACK] Seq=23243303 Ack=429819421 Win=65535 Len=0
1,6.347512000000279,62.210.85.178,10.0.2.15,TCP,60,9001  >  35978 [ACK] Seq=23243303 Ack=429820881 Win=65535 Len=0
1,6.3475149999994755,62.210.85.178,10.0.2.15,TCP,60,9001  >  35978 [ACK] Seq=23243303 Ack=429822031 Win=65535 Len=0
1,6.34755099999893,10.0.2.15,62.210.85.178,TLSv1.2,3030,Application Data
1,6.347584999999526,62.210.85.178,10.0.2.15,TCP,60,9001  >  35978 [ACK] Seq=23243303 Ack=429823491 Win=65535 Len=0
1,6.347592000000077,62.210.85.178,10.0.2.15,TCP,60,9001  >  35978 [ACK] Seq=23243303 Ack=429824951 Win=65535 Len=0
1,6.347595999999612,62.210.85.178,10.0.2.15,TCP,60,9001  >  35978 [ACK] Seq=23243303 Ack=429825007 Win=65535 Len=0
1,6.356744999999137,10.0.2.15,62.210.85.178,TLSv1.2,4124,Application Data
1,6.356792000000496,62.210.85.178,10.0.2.15,TCP,60,9001  >  35978 [ACK] Seq=23243303 Ack=429826467 Win=65535 Len=0
1,6.356803000000582,62.210.85.178,10.0.2.15,TCP,60,9001  >  35978 [ACK] Seq=23243303 Ack=429827927 Win=65535 Len=0
1,6.356808000000456,62.210.85.178,10.0.2.15,TCP,60,9001  >  35978 [ACK] Seq=23243303 Ack=429829077 Win=65535 Len=0
1,6.35685199999898,10.0.2.15,62.210.85.178,TLSv1.2,4124,Application Data
1,6.356910999998945,62.210.85.178,10.0.2.15,TCP,60,9001  >  35978 [ACK] Seq=23243303 Ack=429830537 Win=65535 Len=0
1,6.356917999999496,62.210.85.178,10.0.2.15,TCP,60,9001  >  35978 [ACK] Seq=23243303 Ack=429831997 Win=65535 Len=0
1,6.356921000000511,62.210.85.178,10.0.2.15,TCP,60,9001  >  35978 [ACK] Seq=23243303 Ack=429833147 Win=65535 Len=0
1,6.356959000000643,10.0.2.15,62.210.85.178,TLSv1.2,4124,Application Data
1,6.35699299999942,62.210.85.178,10.0.2.15,TCP,60,9001  >  35978 [ACK] Seq=23243303 Ack=429834607 Win=65535 Len=0
1,6.357001000000309,62.210.85.178,10.0.2.15,TCP,60,9001  >  35978 [ACK] Seq=23243303 Ack=429836067 Win=65535 Len=0
1,6.357004999999845,62.210.85.178,10.0.2.15,TCP,60,9001  >  35978 [ACK] Seq=23243303 Ack=429837217 Win=65535 Len=0
1,6.35703999999896,10.0.2.15,62.210.85.178,TLSv1.2,4124,Application Data
1,6.357076000000234,62.210.85.178,10.0.2.15,TCP,60,9001  >  35978 [ACK] Seq=23243303 Ack=429838677 Win=65535 Len=0
1,6.3570829999989655,62.210.85.178,10.0.2.15,TCP,60,9001  >  35978 [ACK] Seq=23243303 Ack=429840137 Win=65535 Len=0
1,6.35708700000032,62.210.85.178,10.0.2.15,TCP,60,9001  >  35978 [ACK] Seq=23243303 Ack=429841287 Win=65535 Len=0
1,6.357120999999097,10.0.2.15,62.210.85.178,TLSv1.2,332,Application Data
1,6.357197999999698,62.210.85.178,10.0.2.15,TCP,60,9001  >  35978 [ACK] Seq=23243303 Ack=429841565 Win=65535 Len=0
1,6.357233999999153,10.0.2.15,62.210.85.178,TLSv1.2,3868,Application Data
1,6.357272999999623,62.210.85.178,10.0.2.15,TCP,60,9001  >  35978 [ACK] Seq=23243303 Ack=429843025 Win=65535 Len=0
1,6.3572800000001735,62.210.85.178,10.0.2.15,TCP,60,9001  >  35978 [ACK] Seq=23243303 Ack=429844485 Win=65535 Len=0
1,6.35728299999937,62.210.85.178,10.0.2.15,TCP,60,9001  >  35978 [ACK] Seq=23243303 Ack=429845379 Win=65535 Len=0
1,6.35732199999984,10.0.2.15,62.210.85.178,TLSv1.2,4124,Application Data
1,6.357391999999891,62.210.85.178,10.0.2.15,TCP,60,9001  >  35978 [ACK] Seq=23243303 Ack=429846839 Win=65535 Len=0
1,6.3573990000004414,62.210.85.178,10.0.2.15,TCP,60,9001  >  35978 [ACK] Seq=23243303 Ack=429848299 Win=65535 Len=0
1,6.357401999999638,62.210.85.178,10.0.2.15,TCP,60,9001  >  35978 [ACK] Seq=23243303 Ack=429849449 Win=65535 Len=0
1,6.357434999999896,10.0.2.15,62.210.85.178,TLSv1.2,3030,Application Data
1,6.357474000000366,62.210.85.178,10.0.2.15,TCP,60,9001  >  35978 [ACK] Seq=23243303 Ack=429850909 Win=65535 Len=0
1,6.3574809999990975,62.210.85.178,10.0.2.15,TCP,60,9001  >  35978 [ACK] Seq=23243303 Ack=429852369 Win=65535 Len=0
1,6.357484000000113,62.210.85.178,10.0.2.15,TCP,60,9001  >  35978 [ACK] Seq=23243303 Ack=429852425 Win=65535 Len=0
1,6.37104299999919,10.0.2.15,62.210.85.178,TLSv1.2,4124,Application Data
1,6.371124999999665,62.210.85.178,10.0.2.15,TCP,60,9001  >  35978 [ACK] Seq=23243303 Ack=429853885 Win=65535 Len=0
1,6.37113700000009,62.210.85.178,10.0.2.15,TCP,60,9001  >  35978 [ACK] Seq=23243303 Ack=429855345 Win=65535 Len=0
1,6.371139999999286,62.210.85.178,10.0.2.15,TCP,60,9001  >  35978 [ACK] Seq=23243303 Ack=429856495 Win=65535 Len=0
1,6.371184999999969,10.0.2.15,62.210.85.178,TLSv1.2,4124,Application Data
1,6.3712219999997615,62.210.85.178,10.0.2.15,TCP,60,9001  >  35978 [ACK] Seq=23243303 Ack=429857955 Win=65535 Len=0
1,6.371229000000312,62.210.85.178,10.0.2.15,TCP,60,9001  >  35978 [ACK] Seq=23243303 Ack=429859415 Win=65535 Len=0
1,6.371232999999847,62.210.85.178,10.0.2.15,TCP,60,9001  >  35978 [ACK] Seq=23243303 Ack=429860565 Win=65535 Len=0
1,6.371268999999302,10.0.2.15,62.210.85.178,TLSv1.2,204,Application Data
1,6.371304000000237,62.210.85.178,10.0.2.15,TCP,60,9001  >  35978 [ACK] Seq=23243303 Ack=429860715 Win=65535 Len=0
1,6.457250999999815,54.93.77.70,10.0.2.15,TLSv1.2,590,Application Data
1,6.475291999999172,54.93.77.70,10.0.2.15,TCP,2950,"9001  >  34692 [PSH, ACK] Seq=429505507 Ack=23342059 Win=65535 Len=2896 [TCP segment of a reassembled PDU]"
1,6.4753879999989294,10.0.2.15,54.93.77.70,TCP,54,34692  >  9001 [ACK] Seq=23342059 Ack=429508403 Win=65535 Len=0
1,6.4851569999991625,54.93.77.70,10.0.2.15,TLSv1.2,4398,"Application Data, Application Data"
1,6.485209999998915,10.0.2.15,54.93.77.70,TCP,54,34692  >  9001 [ACK] Seq=23342059 Ack=429512747 Win=65535 Len=0
1,6.523273999999219,54.93.77.70,10.0.2.15,TCP,2950,"9001  >  34692 [PSH, ACK] Seq=429512747 Ack=23342059 Win=65535 Len=2896 [TCP segment of a reassembled PDU]"
1,6.523400000000038,10.0.2.15,54.93.77.70,TCP,54,34692  >  9001 [ACK] Seq=23342059 Ack=429515643 Win=65535 Len=0
1,6.523564999999508,54.93.77.70,10.0.2.15,TLSv1.2,5448,"Application Data, Application Data, Application Data"
1,6.523621000000276,10.0.2.15,54.93.77.70,TCP,54,34692  >  9001 [ACK] Seq=23342059 Ack=429521037 Win=65535 Len=0
1,6.523848999999245,10.0.2.15,54.93.77.70,TLSv1.2,590,Application Data
1,6.523968999999852,54.93.77.70,10.0.2.15,TCP,60,9001  >  34692 [ACK] Seq=429521037 Ack=23342595 Win=65535 Len=0
1,6.529624000000695,54.93.77.70,10.0.2.15,TCP,2950,"9001  >  34692 [PSH, ACK] Seq=429521037 Ack=23342595 Win=65535 Len=2896 [TCP segment of a reassembled PDU]"
1,6.529696999999942,10.0.2.15,54.93.77.70,TCP,54,34692  >  9001 [ACK] Seq=23342595 Ack=429523933 Win=65535 Len=0
1,6.541114999999991,54.93.77.70,10.0.2.15,TLSv1.2,2950,Application Data [TCP segment of a reassembled PDU]
1,6.541178999999829,10.0.2.15,54.93.77.70,TCP,54,34692  >  9001 [ACK] Seq=23342595 Ack=429526829 Win=65535 Len=0
1,6.541647000000012,54.93.77.70,10.0.2.15,TLSv1.2,4398,Application Data [TCP segment of a reassembled PDU]
1,6.541699999999764,10.0.2.15,54.93.77.70,TCP,54,34692  >  9001 [ACK] Seq=23342595 Ack=429531173 Win=65535 Len=0
1,6.550986000000194,54.93.77.70,10.0.2.15,TLSv1.2,2950,Application Data [TCP segment of a reassembled PDU]
1,6.551040000000285,10.0.2.15,54.93.77.70,TCP,54,34692  >  9001 [ACK] Seq=23342595 Ack=429534069 Win=65535 Len=0
1,6.551235999999335,10.0.2.15,54.93.77.70,TLSv1.2,590,Application Data
1,6.551347999999052,54.93.77.70,10.0.2.15,TCP,60,9001  >  34692 [ACK] Seq=429534069 Ack=23343131 Win=65535 Len=0
1,6.5529829999995854,54.93.77.70,10.0.2.15,TLSv1.2,2530,Application Data
1,6.553004999999757,54.93.77.70,10.0.2.15,TLSv1.2,10190,"Application Data, Application Data"
1,6.5530629999993835,10.0.2.15,54.93.77.70,TCP,54,34692  >  9001 [ACK] Seq=23343131 Ack=429536545 Win=65535 Len=0
1,6.553147000000536,10.0.2.15,54.93.77.70,TCP,54,34692  >  9001 [ACK] Seq=23343131 Ack=429546681 Win=65535 Len=0
1,6.555710000000545,54.93.77.70,10.0.2.15,TCP,1502,"9001  >  34692 [PSH, ACK] Seq=429546681 Ack=23343131 Win=65535 Len=1448 [TCP segment of a reassembled PDU]"
1,6.555771999999706,10.0.2.15,54.93.77.70,TCP,54,34692  >  9001 [ACK] Seq=23343131 Ack=429548129 Win=65535 Len=0
1,6.581175999999687,54.93.77.70,10.0.2.15,TLSv1.2,5752,"Application Data, Application Data, Application Data"
1,6.581207999999606,54.93.77.70,10.0.2.15,TLSv1.2,10190,"Application Data, Application Data"
1,6.581302999999025,10.0.2.15,54.93.77.70,TCP,54,34692  >  9001 [ACK] Seq=23343131 Ack=429563963 Win=65535 Len=0
1,6.581732999999076,10.0.2.15,54.93.77.70,TLSv1.2,590,Application Data
1,6.581842999999935,54.93.77.70,10.0.2.15,TCP,60,9001  >  34692 [ACK] Seq=429563963 Ack=23343667 Win=65535 Len=0
1,6.597999999999956,54.93.77.70,10.0.2.15,TLSv1.2,2950,Application Data [TCP segment of a reassembled PDU]
1,6.598094999999375,10.0.2.15,54.93.77.70,TCP,54,34692  >  9001 [ACK] Seq=23343667 Ack=429566859 Win=65535 Len=0
1,6.600155000000086,54.93.77.70,10.0.2.15,TLSv1.2,1292,Application Data
1,6.600465999999869,10.0.2.15,54.93.77.70,TLSv1.2,590,Application Data
1,6.6005629999999655,54.93.77.70,10.0.2.15,TCP,60,9001  >  34692 [ACK] Seq=429568097 Ack=23344203 Win=65535 Len=0
1,6.6105160000006435,10.0.2.15,54.93.77.70,TLSv1.2,590,Application Data
1,6.61070699999982,54.93.77.70,10.0.2.15,TCP,60,9001  >  34692 [ACK] Seq=429568097 Ack=23344739 Win=65535 Len=0
1,6.619741999998951,54.93.77.70,10.0.2.15,TLSv1.2,590,Application Data
