No.,Time,Source,Destination,Protocol,Length,Info
1,0.030936999999539694,10.0.2.15,54.93.77.70,TCP,54,34692  >  9001 [ACK] Seq=23189247 Ack=426525717 Win=65535 Len=0
1,0.06067599999914819,62.210.85.178,10.0.2.15,TLSv1.2,1104,Application Data
1,0.10645999999906053,10.0.2.15,62.210.85.178,TCP,54,35978  >  9001 [ACK] Seq=426818305 Ack=23090057 Win=65535 Len=0
1,0.12467800000013085,62.210.85.178,10.0.2.15,TLSv1.2,1104,Application Data
1,0.12478199999895878,10.0.2.15,62.210.85.178,TCP,54,35978  >  9001 [ACK] Seq=426818305 Ack=23091107 Win=65535 Len=0
1,0.16862399999990885,10.0.2.15,54.93.77.70,TLSv1.2,590,Application Data
1,0.1687919999985752,54.93.77.70,10.0.2.15,TCP,60,9001  >  34692 [ACK] Seq=426525717 Ack=23189783 Win=65535 Len=0
1,0.26908199999888893,62.210.85.178,10.0.2.15,TLSv1.2,590,Application Data
1,0.26916499999970256,10.0.2.15,62.210.85.178,TCP,54,35978  >  9001 [ACK] Seq=426818305 Ack=23091643 Win=65535 Len=0
1,0.26965799999925366,10.0.2.15,62.210.85.178,TLSv1.2,590,Application Data
1,0.2697599999992235,62.210.85.178,10.0.2.15,TCP,60,9001  >  35978 [ACK] Seq=23091643 Ack=426818841 Win=65535 Len=0
1,0.37665199999901233,54.93.77.70,10.0.2.15,TLSv1.2,590,Application Data
1,0.37687000000005355,10.0.2.15,54.93.77.70,TCP,54,34692  >  9001 [ACK] Seq=23189783 Ack=426526253 Win=65535 Len=0
1,0.37755399999878136,10.0.2.15,54.93.77.70,TLSv1.2,1618,Application Data
1,0.37772899999981746,54.93.77.70,10.0.2.15,TCP,60,9001  >  34692 [ACK] Seq=426526253 Ack=23191243 Win=65535 Len=0
1,0.3777479999989737,54.93.77.70,10.0.2.15,TCP,60,9001  >  34692 [ACK] Seq=426526253 Ack=23191347 Win=65535 Len=0
1,0.4888670000000275,62.210.85.178,10.0.2.15,TLSv1.2,1618,Application Data
1,0.489025999999285,10.0.2.15,62.210.85.178,TCP,54,35978  >  9001 [ACK] Seq=426818841 Ack=23093207 Win=65535 Len=0
1,0.5026929999985441,10.0.2.15,62.210.85.178,TLSv1.2,590,Application Data
1,0.5028979999988223,62.210.85.178,10.0.2.15,TCP,60,9001  >  35978 [ACK] Seq=23093207 Ack=426819377 Win=65535 Len=0
1,0.5124779999987368,10.0.2.15,62.210.85.178,TLSv1.2,1618,Application Data
1,0.5126259999997274,62.210.85.178,10.0.2.15,TCP,60,9001  >  35978 [ACK] Seq=23093207 Ack=426820837 Win=65535 Len=0
1,0.5126449999988836,62.210.85.178,10.0.2.15,TCP,60,9001  >  35978 [ACK] Seq=23093207 Ack=426820941 Win=65535 Len=0
1,0.631679999998596,54.93.77.70,10.0.2.15,TLSv1.2,590,Application Data
1,0.6427539999986038,54.93.77.70,10.0.2.15,TCP,1502,"9001  >  34692 [PSH, ACK] Seq=426526789 Ack=23191347 Win=65535 Len=1448 [TCP segment of a reassembled PDU]"
1,0.6428449999984878,10.0.2.15,54.93.77.70,TCP,54,34692  >  9001 [ACK] Seq=23191347 Ack=426528237 Win=65535 Len=0
1,0.6482879999985016,54.93.77.70,10.0.2.15,TLSv1.2,170,Application Data
1,0.6502619999992021,10.0.2.15,54.93.77.70,TLSv1.2,590,Application Data
1,0.6504369999984192,54.93.77.70,10.0.2.15,TCP,60,9001  >  34692 [ACK] Seq=426528353 Ack=23191883 Win=65535 Len=0
1,0.7655279999999038,62.210.85.178,10.0.2.15,TLSv1.2,590,Application Data
1,0.7658839999985503,10.0.2.15,62.210.85.178,TLSv1.2,590,Application Data
1,0.7659739999999147,62.210.85.178,10.0.2.15,TCP,60,9001  >  35978 [ACK] Seq=23093743 Ack=426821477 Win=65535 Len=0
1,0.8731349999998201,54.93.77.70,10.0.2.15,TLSv1.2,590,Application Data
1,0.8735539999997854,10.0.2.15,54.93.77.70,TLSv1.2,590,Application Data
1,0.8736539999990782,54.93.77.70,10.0.2.15,TCP,60,9001  >  34692 [ACK] Seq=426528889 Ack=23192419 Win=65535 Len=0
1,0.9791839999998047,62.210.85.178,10.0.2.15,TLSv1.2,590,Application Data
1,0.9867389999999432,10.0.2.15,62.210.85.178,TLSv1.2,590,Application Data
1,0.9869259999995847,62.210.85.178,10.0.2.15,TCP,60,9001  >  35978 [ACK] Seq=23094279 Ack=426822013 Win=65535 Len=0
1,0.9920109999984561,10.0.2.15,62.210.85.178,TLSv1.2,4124,Application Data
1,0.9921519999988959,10.0.2.15,62.210.85.178,TCP,2974,35978  >  9001 [ACK] Seq=426826083 Ack=23094279 Win=65535 Len=2920 [TCP segment of a reassembled PDU]
1,0.9921789999989414,62.210.85.178,10.0.2.15,TCP,60,9001  >  35978 [ACK] Seq=23094279 Ack=426823473 Win=65535 Len=0
1,0.9921869999998307,62.210.85.178,10.0.2.15,TCP,60,9001  >  35978 [ACK] Seq=23094279 Ack=426824933 Win=65535 Len=0
1,0.9921899999990273,62.210.85.178,10.0.2.15,TCP,60,9001  >  35978 [ACK] Seq=23094279 Ack=426826083 Win=65535 Len=0
1,0.9922360000000481,62.210.85.178,10.0.2.15,TCP,60,9001  >  35978 [ACK] Seq=23094279 Ack=426827543 Win=65535 Len=0
1,0.9922409999999218,62.210.85.178,10.0.2.15,TCP,60,9001  >  35978 [ACK] Seq=23094279 Ack=426829003 Win=65535 Len=0
1,0.9922689999984868,10.0.2.15,62.210.85.178,TLSv1.2,1204,Application Data
1,0.992300999998406,62.210.85.178,10.0.2.15,TCP,60,9001  >  35978 [ACK] Seq=23094279 Ack=426830153 Win=65535 Len=0
1,0.9923439999984112,10.0.2.15,62.210.85.178,TLSv1.2,4124,Application Data
1,0.9923779999990074,62.210.85.178,10.0.2.15,TCP,60,9001  >  35978 [ACK] Seq=23094279 Ack=426831613 Win=65535 Len=0
1,0.9923859999998967,62.210.85.178,10.0.2.15,TCP,60,9001  >  35978 [ACK] Seq=23094279 Ack=426833073 Win=65535 Len=0
1,0.9923899999994319,62.210.85.178,10.0.2.15,TCP,60,9001  >  35978 [ACK] Seq=23094279 Ack=426834223 Win=65535 Len=0
1,0.9924279999995633,10.0.2.15,62.210.85.178,TLSv1.2,4124,Application Data
1,0.9924839999985124,62.210.85.178,10.0.2.15,TCP,60,9001  >  35978 [ACK] Seq=23094279 Ack=426835683 Win=65535 Len=0
1,0.9924959999989369,62.210.85.178,10.0.2.15,TCP,60,9001  >  35978 [ACK] Seq=23094279 Ack=426837143 Win=65535 Len=0
1,0.992499999998472,62.210.85.178,10.0.2.15,TCP,60,9001  >  35978 [ACK] Seq=23094279 Ack=426838293 Win=65535 Len=0
1,0.9925459999994928,10.0.2.15,62.210.85.178,TLSv1.2,332,Application Data
1,0.9925849999999627,62.210.85.178,10.0.2.15,TCP,60,9001  >  35978 [ACK] Seq=23094279 Ack=426838571 Win=65535 Len=0
1,0.9926459999987856,10.0.2.15,62.210.85.178,TLSv1.2,3868,Application Data
1,0.9926849999992555,62.210.85.178,10.0.2.15,TCP,60,9001  >  35978 [ACK] Seq=23094279 Ack=426840031 Win=65535 Len=0
1,0.9926919999998063,62.210.85.178,10.0.2.15,TCP,60,9001  >  35978 [ACK] Seq=23094279 Ack=426841491 Win=65535 Len=0
1,0.9926949999990029,62.210.85.178,10.0.2.15,TCP,60,9001  >  35978 [ACK] Seq=23094279 Ack=426842385 Win=65535 Len=0
1,0.9927319999987958,10.0.2.15,62.210.85.178,TLSv1.2,4124,Application Data
1,0.9927669999997306,62.210.85.178,10.0.2.15,TCP,60,9001  >  35978 [ACK] Seq=23094279 Ack=426843845 Win=65535 Len=0
1,0.9927729999999428,62.210.85.178,10.0.2.15,TCP,60,9001  >  35978 [ACK] Seq=23094279 Ack=426845305 Win=65535 Len=0
1,0.9927759999991395,62.210.85.178,10.0.2.15,TCP,60,9001  >  35978 [ACK] Seq=23094279 Ack=426846455 Win=65535 Len=0
1,0.9928110000000743,10.0.2.15,62.210.85.178,TLSv1.2,3030,Application Data
1,0.9928449999988516,62.210.85.178,10.0.2.15,TCP,60,9001  >  35978 [ACK] Seq=23094279 Ack=426847915 Win=65535 Len=0
1,0.9928529999997409,62.210.85.178,10.0.2.15,TCP,60,9001  >  35978 [ACK] Seq=23094279 Ack=426849375 Win=65535 Len=0
1,0.992856999999276,62.210.85.178,10.0.2.15,TCP,60,9001  >  35978 [ACK] Seq=23094279 Ack=426849431 Win=65535 Len=0
1,1.0043040000000474,10.0.2.15,62.210.85.178,TLSv1.2,4124,Application Data
1,1.0043989999994665,62.210.85.178,10.0.2.15,TCP,60,9001  >  35978 [ACK] Seq=23094279 Ack=426850891 Win=65535 Len=0
1,1.0044119999984105,62.210.85.178,10.0.2.15,TCP,60,9001  >  35978 [ACK] Seq=23094279 Ack=426852351 Win=65535 Len=0
1,1.0044159999997646,62.210.85.178,10.0.2.15,TCP,60,9001  >  35978 [ACK] Seq=23094279 Ack=426853501 Win=65535 Len=0
1,1.004464999999982,10.0.2.15,62.210.85.178,TLSv1.2,4124,Application Data
1,1.0045309999986785,62.210.85.178,10.0.2.15,TCP,60,9001  >  35978 [ACK] Seq=23094279 Ack=426854961 Win=65535 Len=0
1,1.0045379999992292,62.210.85.178,10.0.2.15,TCP,60,9001  >  35978 [ACK] Seq=23094279 Ack=426856421 Win=65535 Len=0
1,1.0045409999984258,62.210.85.178,10.0.2.15,TCP,60,9001  >  35978 [ACK] Seq=23094279 Ack=426857571 Win=65535 Len=0
1,1.0045749999990221,10.0.2.15,62.210.85.178,TLSv1.2,1746,Application Data
1,1.004664000000048,62.210.85.178,10.0.2.15,TCP,60,9001  >  35978 [ACK] Seq=23094279 Ack=426859031 Win=65535 Len=0
1,1.0046759999986534,62.210.85.178,10.0.2.15,TCP,60,9001  >  35978 [ACK] Seq=23094279 Ack=426859263 Win=65535 Len=0
1,1.1007109999991371,54.93.77.70,10.0.2.15,TLSv1.2,3674,Application Data
1,1.1008999999994558,10.0.2.15,54.93.77.70,TCP,54,34692  >  9001 [ACK] Seq=23192419 Ack=426532509 Win=65535 Len=0
1,1.1215969999993831,54.93.77.70,10.0.2.15,TCP,2950,"9001  >  34692 [PSH, ACK] Seq=426532509 Ack=23192419 Win=65535 Len=2896 [TCP segment of a reassembled PDU]"
1,1.1217209999995248,10.0.2.15,54.93.77.70,TCP,54,34692  >  9001 [ACK] Seq=23192419 Ack=426535405 Win=65535 Len=0
1,1.121752999999444,54.93.77.70,10.0.2.15,TLSv1.2,2950,Application Data [TCP segment of a reassembled PDU]
1,1.1218509999998787,10.0.2.15,54.93.77.70,TCP,54,34692  >  9001 [ACK] Seq=23192419 Ack=426538301 Win=65535 Len=0
1,1.1236289999997098,54.93.77.70,10.0.2.15,TLSv1.2,5636,"Application Data, Application Data"
1,1.1236749999989115,10.0.2.15,54.93.77.70,TCP,54,34692  >  9001 [ACK] Seq=23192419 Ack=426543883 Win=65535 Len=0
1,1.1239609999993263,10.0.2.15,54.93.77.70,TLSv1.2,590,Application Data
1,1.1240879999986646,54.93.77.70,10.0.2.15,TCP,60,9001  >  34692 [ACK] Seq=426543883 Ack=23192955 Win=65535 Len=0
1,1.1308629999984987,54.93.77.70,10.0.2.15,TCP,2950,"9001  >  34692 [PSH, ACK] Seq=426543883 Ack=23192955 Win=65535 Len=2896 [TCP segment of a reassembled PDU]"
1,1.1310279999997874,10.0.2.15,54.93.77.70,TCP,54,34692  >  9001 [ACK] Seq=23192955 Ack=426546779 Win=65535 Len=0
1,1.1389839999992546,54.93.77.70,10.0.2.15,TLSv1.2,4398,Application Data [TCP segment of a reassembled PDU]
1,1.13904999999977,10.0.2.15,54.93.77.70,TCP,54,34692  >  9001 [ACK] Seq=23192955 Ack=426551123 Win=65535 Len=0
1,1.139830999998594,54.93.77.70,10.0.2.15,TLSv1.2,4398,Application Data [TCP segment of a reassembled PDU]
1,1.1398779999999533,10.0.2.15,54.93.77.70,TCP,54,34692  >  9001 [ACK] Seq=23192955 Ack=426555467 Win=65535 Len=0
1,1.1405029999987164,54.93.77.70,10.0.2.15,TLSv1.2,894,"Application Data, Application Data"
1,1.1406630000001314,10.0.2.15,54.93.77.70,TLSv1.2,590,Application Data
1,1.1407389999985753,54.93.77.70,10.0.2.15,TCP,60,9001  >  34692 [ACK] Seq=426556307 Ack=23193491 Win=65535 Len=0
1,1.1493919999993523,54.93.77.70,10.0.2.15,TCP,2950,"9001  >  34692 [PSH, ACK] Seq=426556307 Ack=23193491 Win=65535 Len=2896 [TCP segment of a reassembled PDU]"
1,1.149409999999989,54.93.77.70,10.0.2.15,TLSv1.2,4398,Application Data [TCP segment of a reassembled PDU]
1,1.1494739999998274,10.0.2.15,54.93.77.70,TCP,54,34692  >  9001 [ACK] Seq=23193491 Ack=426563547 Win=65535 Len=0
1,1.1572629999991477,54.93.77.70,10.0.2.15,TLSv1.2,568,Application Data
1,1.1996979999985342,10.0.2.15,54.93.77.70,TCP,54,34692  >  9001 [ACK] Seq=23193491 Ack=426564061 Win=65535 Len=0
1,1.2087269999992714,54.93.77.70,10.0.2.15,TLSv1.2,1502,Application Data
1,1.2087799999990239,10.0.2.15,54.93.77.70,TCP,54,34692  >  9001 [ACK] Seq=23193491 Ack=426565509 Win=65535 Len=0
1,1.2157449999995151,54.93.77.70,10.0.2.15,TLSv1.2,1220,Application Data
1,1.2158019999988028,10.0.2.15,54.93.77.70,TCP,54,34692  >  9001 [ACK] Seq=23193491 Ack=426566675 Win=65535 Len=0
1,1.218219999998837,10.0.2.15,54.93.77.70,TLSv1.2,590,Application Data
1,1.2183789999999135,54.93.77.70,10.0.2.15,TCP,60,9001  >  34692 [ACK] Seq=426566675 Ack=23194027 Win=65535 Len=0
1,1.2808989999994083,62.210.85.178,10.0.2.15,TLSv1.2,590,Application Data
1,1.3237129999997705,10.0.2.15,62.210.85.178,TCP,54,35978  >  9001 [ACK] Seq=426859263 Ack=23094815 Win=65535 Len=0
1,1.342118999999002,62.210.85.178,10.0.2.15,TLSv1.2,1104,Application Data
1,1.3421829999988404,10.0.2.15,62.210.85.178,TCP,54,35978  >  9001 [ACK] Seq=426859263 Ack=23095865 Win=65535 Len=0
1,1.342638000000079,10.0.2.15,62.210.85.178,TLSv1.2,590,Application Data
1,1.3427489999994577,62.210.85.178,10.0.2.15,TCP,60,9001  >  35978 [ACK] Seq=23095865 Ack=426859799 Win=65535 Len=0
1,1.4226369999996678,54.93.77.70,10.0.2.15,TLSv1.2,590,Application Data
1,1.423012999999628,10.0.2.15,54.93.77.70,TLSv1.2,590,Application Data
1,1.42310599999837,54.93.77.70,10.0.2.15,TCP,60,9001  >  34692 [ACK] Seq=426567211 Ack=23194563 Win=65535 Len=0
1,1.5286209999994753,62.210.85.178,10.0.2.15,TLSv1.2,590,Application Data
1,1.5350999999991473,10.0.2.15,62.210.85.178,TLSv1.2,590,Application Data
1,1.5352609999990818,62.210.85.178,10.0.2.15,TCP,60,9001  >  35978 [ACK] Seq=23096401 Ack=426860335 Win=65535 Len=0
1,1.54499499999838,10.0.2.15,62.210.85.178,TLSv1.2,4124,Application Data
1,1.5451369999991584,62.210.85.178,10.0.2.15,TCP,60,9001  >  35978 [ACK] Seq=23096401 Ack=426861795 Win=65535 Len=0
1,1.5451539999994566,62.210.85.178,10.0.2.15,TCP,60,9001  >  35978 [ACK] Seq=23096401 Ack=426863255 Win=65535 Len=0
1,1.5451579999989917,62.210.85.178,10.0.2.15,TCP,60,9001  >  35978 [ACK] Seq=23096401 Ack=426864405 Win=65535 Len=0
1,1.5455419999998412,10.0.2.15,62.210.85.178,TLSv1.2,4124,Application Data
1,1.5456359999989218,10.0.2.15,62.210.85.178,TCP,2974,35978  >  9001 [ACK] Seq=426868475 Ack=23096401 Win=65535 Len=2920 [TCP segment of a reassembled PDU]
1,1.5456589999994321,62.210.85.178,10.0.2.15,TCP,60,9001  >  35978 [ACK] Seq=23096401 Ack=426865865 Win=65535 Len=0
1,1.545667999998841,62.210.85.178,10.0.2.15,TCP,60,9001  >  35978 [ACK] Seq=23096401 Ack=426867325 Win=65535 Len=0
1,1.5456729999987147,62.210.85.178,10.0.2.15,TCP,60,9001  >  35978 [ACK] Seq=23096401 Ack=426868475 Win=65535 Len=0
1,1.5456770000000688,62.210.85.178,10.0.2.15,TCP,60,9001  >  35978 [ACK] Seq=23096401 Ack=426869935 Win=65535 Len=0
1,1.545680999999604,62.210.85.178,10.0.2.15,TCP,60,9001  >  35978 [ACK] Seq=23096401 Ack=426871395 Win=65535 Len=0
1,1.5457139999998617,10.0.2.15,62.210.85.178,TLSv1.2,1204,Application Data
1,1.5458330000001297,10.0.2.15,62.210.85.178,TCP,2974,35978  >  9001 [ACK] Seq=426872545 Ack=23096401 Win=65535 Len=2920 [TCP segment of a reassembled PDU]
1,1.5458729999991192,62.210.85.178,10.0.2.15,TCP,60,9001  >  35978 [ACK] Seq=23096401 Ack=426872545 Win=65535 Len=0
1,1.5458810000000085,62.210.85.178,10.0.2.15,TCP,60,9001  >  35978 [ACK] Seq=23096401 Ack=426874005 Win=65535 Len=0
1,1.5458839999992051,62.210.85.178,10.0.2.15,TCP,60,9001  >  35978 [ACK] Seq=23096401 Ack=426875465 Win=65535 Len=0
1,1.5459119999995892,10.0.2.15,62.210.85.178,TLSv1.2,1204,Application Data
1,1.545944999999847,62.210.85.178,10.0.2.15,TCP,60,9001  >  35978 [ACK] Seq=23096401 Ack=426876615 Win=65535 Len=0
1,1.5459819999996398,10.0.2.15,62.210.85.178,TLSv1.2,332,Application Data
1,1.546015999998417,62.210.85.178,10.0.2.15,TCP,60,9001  >  35978 [ACK] Seq=23096401 Ack=426876893 Win=65535 Len=0
1,1.5460749999983818,10.0.2.15,62.210.85.178,TLSv1.2,3868,Application Data
1,1.546160999998392,62.210.85.178,10.0.2.15,TCP,60,9001  >  35978 [ACK] Seq=23096401 Ack=426878353 Win=65535 Len=0
1,1.5461679999989428,62.210.85.178,10.0.2.15,TCP,60,9001  >  35978 [ACK] Seq=23096401 Ack=426879813 Win=65535 Len=0
1,1.5461709999999584,62.210.85.178,10.0.2.15,TCP,60,9001  >  35978 [ACK] Seq=23096401 Ack=426880707 Win=65535 Len=0
1,1.5462119999992865,10.0.2.15,62.210.85.178,TLSv1.2,2452,Application Data
1,1.5462729999999283,62.210.85.178,10.0.2.15,TCP,60,9001  >  35978 [ACK] Seq=23096401 Ack=426882167 Win=65535 Len=0
1,1.5462809999989986,62.210.85.178,10.0.2.15,TCP,60,9001  >  35978 [ACK] Seq=23096401 Ack=426883105 Win=65535 Len=0
1,1.6301709999988816,54.93.77.70,10.0.2.15,TLSv1.2,590,Application Data
1,1.6507969999984198,54.93.77.70,10.0.2.15,TCP,2950,"9001  >  34692 [PSH, ACK] Seq=426567747 Ack=23194563 Win=65535 Len=2896 [TCP segment of a reassembled PDU]"
1,1.6508779999985563,10.0.2.15,54.93.77.70,TCP,54,34692  >  9001 [ACK] Seq=23194563 Ack=426570643 Win=65535 Len=0
1,1.6584359999997105,54.93.77.70,10.0.2.15,TLSv1.2,4398,Application Data [TCP segment of a reassembled PDU]
1,1.6584939999993367,10.0.2.15,54.93.77.70,TCP,54,34692  >  9001 [ACK] Seq=23194563 Ack=426574987 Win=65535 Len=0
1,1.6597689999998693,54.93.77.70,10.0.2.15,TLSv1.2,2950,Application Data [TCP segment of a reassembled PDU]
1,1.6598119999998744,10.0.2.15,54.93.77.70,TCP,54,34692  >  9001 [ACK] Seq=23194563 Ack=426577883 Win=65535 Len=0
1,1.6669019999990269,54.93.77.70,10.0.2.15,TLSv1.2,1292,Application Data
1,1.6838079999997717,54.93.77.70,10.0.2.15,TLSv1.2,590,Application Data
1,1.6838899999984278,10.0.2.15,54.93.77.70,TCP,54,34692  >  9001 [ACK] Seq=23194563 Ack=426579657 Win=65535 Len=0
1,1.7118919999993523,54.93.77.70,10.0.2.15,TCP,2950,"9001  >  34692 [PSH, ACK] Seq=426579657 Ack=23194563 Win=65535 Len=2896 [TCP segment of a reassembled PDU]"
1,1.7119859999984328,10.0.2.15,54.93.77.70,TCP,54,34692  >  9001 [ACK] Seq=23194563 Ack=426582553 Win=65535 Len=0
1,1.712733999998818,54.93.77.70,10.0.2.15,TLSv1.2,4912,"Application Data, Application Data"
1,1.7127929999987828,10.0.2.15,54.93.77.70,TCP,54,34692  >  9001 [ACK] Seq=23194563 Ack=426587411 Win=65535 Len=0
1,1.7360229999994772,54.93.77.70,10.0.2.15,TLSv1.2,3160,Application Data
1,1.7360659999994823,10.0.2.15,54.93.77.70,TCP,54,34692  >  9001 [ACK] Seq=23194563 Ack=426590517 Win=65535 Len=0
1,1.7382739999993646,10.0.2.15,54.93.77.70,TLSv1.2,590,Application Data
1,1.7384229999988747,54.93.77.70,10.0.2.15,TCP,60,9001  >  34692 [ACK] Seq=426590517 Ack=23195099 Win=65535 Len=0
1,1.8343079999995098,62.210.85.178,10.0.2.15,TLSv1.2,590,Application Data
1,1.834802999999738,10.0.2.15,62.210.85.178,TLSv1.2,590,Application Data
1,1.8349170000001322,62.210.85.178,10.0.2.15,TCP,60,9001  >  35978 [ACK] Seq=23096937 Ack=426883641 Win=65535 Len=0
1,1.9513399999996182,54.93.77.70,10.0.2.15,TLSv1.2,590,Application Data
1,1.9517390000000887,10.0.2.15,54.93.77.70,TLSv1.2,590,Application Data
1,1.951850999999806,54.93.77.70,10.0.2.15,TCP,60,9001  >  34692 [ACK] Seq=426591053 Ack=23195635 Win=65535 Len=0
1,2.061240999999427,62.210.85.178,10.0.2.15,TLSv1.2,590,Application Data
1,2.0706829999999172,10.0.2.15,62.210.85.178,TLSv1.2,590,Application Data
1,2.070893000000069,62.210.85.178,10.0.2.15,TCP,60,9001  >  35978 [ACK] Seq=23097473 Ack=426884177 Win=65535 Len=0
1,2.0838179999991553,10.0.2.15,62.210.85.178,TLSv1.2,4124,Application Data
1,2.083934999998746,10.0.2.15,62.210.85.178,TCP,2974,35978  >  9001 [ACK] Seq=426888247 Ack=23097473 Win=65535 Len=2920 [TCP segment of a reassembled PDU]
1,2.0839859999996406,62.210.85.178,10.0.2.15,TCP,60,9001  >  35978 [ACK] Seq=23097473 Ack=426885637 Win=65535 Len=0
1,2.083998000000065,62.210.85.178,10.0.2.15,TCP,60,9001  >  35978 [ACK] Seq=23097473 Ack=426887097 Win=65535 Len=0
1,2.0840039999984583,62.210.85.178,10.0.2.15,TCP,60,9001  >  35978 [ACK] Seq=23097473 Ack=426888247 Win=65535 Len=0
1,2.084045999999944,10.0.2.15,62.210.85.178,TLSv1.2,1204,Application Data
1,2.0840859999989334,62.210.85.178,10.0.2.15,TCP,60,9001  >  35978 [ACK] Seq=23097473 Ack=426889707 Win=65535 Len=0
1,2.0840949999983422,62.210.85.178,10.0.2.15,TCP,60,9001  >  35978 [ACK] Seq=23097473 Ack=426891167 Win=65535 Len=0
1,2.084097999999358,62.210.85.178,10.0.2.15,TCP,60,9001  >  35978 [ACK] Seq=23097473 Ack=426892317 Win=65535 Len=0
1,2.0841399999990244,10.0.2.15,62.210.85.178,TLSv1.2,4124,Application Data
1,2.0841789999994944,62.210.85.178,10.0.2.15,TCP,60,9001  >  35978 [ACK] Seq=23097473 Ack=426893777 Win=65535 Len=0
1,2.0841879999989033,62.210.85.178,10.0.2.15,TCP,60,9001  >  35978 [ACK] Seq=23097473 Ack=426895237 Win=65535 Len=0
1,2.084192999998777,62.210.85.178,10.0.2.15,TCP,60,9001  >  35978 [ACK] Seq=23097473 Ack=426896387 Win=65535 Len=0
1,2.0842329999995854,10.0.2.15,62.210.85.178,TLSv1.2,4124,Application Data
1,2.0842699999993783,62.210.85.178,10.0.2.15,TCP,60,9001  >  35978 [ACK] Seq=23097473 Ack=426897847 Win=65535 Len=0
1,2.0842779999984486,62.210.85.178,10.0.2.15,TCP,60,9001  >  35978 [ACK] Seq=23097473 Ack=426899307 Win=65535 Len=0
1,2.0843409999997675,10.0.2.15,62.210.85.178,TLSv1.2,2974,Application Data
1,2.084382999999434,62.210.85.178,10.0.2.15,TCP,60,9001  >  35978 [ACK] Seq=23097473 Ack=426900457 Win=65535 Len=0
1,2.084389999999985,62.210.85.178,10.0.2.15,TCP,60,9001  >  35978 [ACK] Seq=23097473 Ack=426901917 Win=65535 Len=0
1,2.0843929999991815,62.210.85.178,10.0.2.15,TCP,60,9001  >  35978 [ACK] Seq=23097473 Ack=426903377 Win=65535 Len=0
1,2.0844209999995655,10.0.2.15,62.210.85.178,TLSv1.2,1226,Application Data
1,2.0844559999986814,62.210.85.178,10.0.2.15,TCP,60,9001  >  35978 [ACK] Seq=23097473 Ack=426904549 Win=65535 Len=0
1,2.08449599999949,10.0.2.15,62.210.85.178,TLSv1.2,4124,Application Data
1,2.08453499999996,62.210.85.178,10.0.2.15,TCP,60,9001  >  35978 [ACK] Seq=23097473 Ack=426906009 Win=65535 Len=0
1,2.0845439999993687,62.210.85.178,10.0.2.15,TCP,60,9001  >  35978 [ACK] Seq=23097473 Ack=426907469 Win=65535 Len=0
1,2.084547999998904,62.210.85.178,10.0.2.15,TCP,60,9001  >  35978 [ACK] Seq=23097473 Ack=426908619 Win=65535 Len=0
1,2.0845859999990353,10.0.2.15,62.210.85.178,TLSv1.2,3030,Application Data
1,2.0846259999998438,62.210.85.178,10.0.2.15,TCP,60,9001  >  35978 [ACK] Seq=23097473 Ack=426910079 Win=65535 Len=0
1,2.084633999998914,62.210.85.178,10.0.2.15,TCP,60,9001  >  35978 [ACK] Seq=23097473 Ack=426911539 Win=65535 Len=0
1,2.0846369999999297,62.210.85.178,10.0.2.15,TCP,60,9001  >  35978 [ACK] Seq=23097473 Ack=426911595 Win=65535 Len=0
1,2.096150999999736,10.0.2.15,62.210.85.178,TLSv1.2,4124,Application Data
1,2.0962059999983467,62.210.85.178,10.0.2.15,TCP,60,9001  >  35978 [ACK] Seq=23097473 Ack=426913055 Win=65535 Len=0
1,2.096217999998771,62.210.85.178,10.0.2.15,TCP,60,9001  >  35978 [ACK] Seq=23097473 Ack=426914515 Win=65535 Len=0
1,2.096222999998645,62.210.85.178,10.0.2.15,TCP,60,9001  >  35978 [ACK] Seq=23097473 Ack=426915665 Win=65535 Len=0
1,2.096295999999711,10.0.2.15,62.210.85.178,TLSv1.2,4124,Application Data
1,2.096362999998746,62.210.85.178,10.0.2.15,TCP,60,9001  >  35978 [ACK] Seq=23097473 Ack=426917125 Win=65535 Len=0
1,2.096369999999297,62.210.85.178,10.0.2.15,TCP,60,9001  >  35978 [ACK] Seq=23097473 Ack=426918585 Win=65535 Len=0
1,2.0963729999984935,62.210.85.178,10.0.2.15,TCP,60,9001  >  35978 [ACK] Seq=23097473 Ack=426919735 Win=65535 Len=0
1,2.0963969999993424,10.0.2.15,62.210.85.178,TCP,2974,35978  >  9001 [ACK] Seq=426919735 Ack=23097473 Win=65535 Len=2920 [TCP segment of a reassembled PDU]
1,2.096431999998458,62.210.85.178,10.0.2.15,TCP,60,9001  >  35978 [ACK] Seq=23097473 Ack=426921195 Win=65535 Len=0
1,2.0964399999993475,62.210.85.178,10.0.2.15,TCP,60,9001  >  35978 [ACK] Seq=23097473 Ack=426922655 Win=65535 Len=0
1,2.0964699999985896,10.0.2.15,62.210.85.178,TLSv1.2,1204,Application Data
1,2.096505999999863,62.210.85.178,10.0.2.15,TCP,60,9001  >  35978 [ACK] Seq=23097473 Ack=426923805 Win=65535 Len=0
1,2.0965499999983876,10.0.2.15,62.210.85.178,TLSv1.2,4124,Application Data
1,2.096587999998519,62.210.85.178,10.0.2.15,TCP,60,9001  >  35978 [ACK] Seq=23097473 Ack=426925265 Win=65535 Len=0
1,2.096596999999747,62.210.85.178,10.0.2.15,TCP,60,9001  >  35978 [ACK] Seq=23097473 Ack=426926725 Win=65535 Len=0
1,2.096600999999282,62.210.85.178,10.0.2.15,TCP,60,9001  >  35978 [ACK] Seq=23097473 Ack=426927875 Win=65535 Len=0
1,2.096637999999075,10.0.2.15,62.210.85.178,TLSv1.2,332,Application Data
1,2.0966759999992064,62.210.85.178,10.0.2.15,TCP,60,9001  >  35978 [ACK] Seq=23097473 Ack=426928153 Win=65535 Len=0
1,2.096727000000101,10.0.2.15,62.210.85.178,TLSv1.2,3868,Application Data
1,2.096765999998752,62.210.85.178,10.0.2.15,TCP,60,9001  >  35978 [ACK] Seq=23097473 Ack=426929613 Win=65535 Len=0
1,2.0967749999999796,62.210.85.178,10.0.2.15,TCP,60,9001  >  35978 [ACK] Seq=23097473 Ack=426931073 Win=65535 Len=0
1,2.0967799999998533,62.210.85.178,10.0.2.15,TCP,60,9001  >  35978 [ACK] Seq=23097473 Ack=426931967 Win=65535 Len=0
1,2.0968179999999847,10.0.2.15,62.210.85.178,TLSv1.2,4124,Application Data
1,2.0968569999986357,62.210.85.178,10.0.2.15,TCP,60,9001  >  35978 [ACK] Seq=23097473 Ack=426933427 Win=65535 Len=0
1,2.096864999999525,62.210.85.178,10.0.2.15,TCP,60,9001  >  35978 [ACK] Seq=23097473 Ack=426934887 Win=65535 Len=0
1,2.09686899999906,62.210.85.178,10.0.2.15,TCP,60,9001  >  35978 [ACK] Seq=23097473 Ack=426936037 Win=65535 Len=0
1,2.096903999999995,10.0.2.15,62.210.85.178,TLSv1.2,3030,Application Data
1,2.096942999998646,62.210.85.178,10.0.2.15,TCP,60,9001  >  35978 [ACK] Seq=23097473 Ack=426937497 Win=65535 Len=0
1,2.0969499999991967,62.210.85.178,10.0.2.15,TCP,60,9001  >  35978 [ACK] Seq=23097473 Ack=426938957 Win=65535 Len=0
1,2.096953999998732,62.210.85.178,10.0.2.15,TCP,60,9001  >  35978 [ACK] Seq=23097473 Ack=426939013 Win=65535 Len=0
1,2.1084139999984473,10.0.2.15,62.210.85.178,TLSv1.2,4124,Application Data
1,2.108524999999645,62.210.85.178,10.0.2.15,TCP,60,9001  >  35978 [ACK] Seq=23097473 Ack=426940473 Win=65535 Len=0
1,2.108535999999731,62.210.85.178,10.0.2.15,TCP,60,9001  >  35978 [ACK] Seq=23097473 Ack=426941933 Win=65535 Len=0
1,2.1085389999989275,62.210.85.178,10.0.2.15,TCP,60,9001  >  35978 [ACK] Seq=23097473 Ack=426943083 Win=65535 Len=0
1,2.1085800000000745,10.0.2.15,62.210.85.178,TLSv1.2,4124,Application Data
1,2.108619999999064,62.210.85.178,10.0.2.15,TCP,60,9001  >  35978 [ACK] Seq=23097473 Ack=426944543 Win=65535 Len=0
1,2.108628999998473,62.210.85.178,10.0.2.15,TCP,60,9001  >  35978 [ACK] Seq=23097473 Ack=426946003 Win=65535 Len=0
1,2.1086339999983466,62.210.85.178,10.0.2.15,TCP,60,9001  >  35978 [ACK] Seq=23097473 Ack=426947153 Win=65535 Len=0
1,2.1086729999988165,10.0.2.15,62.210.85.178,TLSv1.2,4124,Application Data
1,2.108710999998948,62.210.85.178,10.0.2.15,TCP,60,9001  >  35978 [ACK] Seq=23097473 Ack=426948613 Win=65535 Len=0
1,2.108719999998357,62.210.85.178,10.0.2.15,TCP,60,9001  >  35978 [ACK] Seq=23097473 Ack=426950073 Win=65535 Len=0
1,2.1087250000000495,62.210.85.178,10.0.2.15,TCP,60,9001  >  35978 [ACK] Seq=23097473 Ack=426951223 Win=65535 Len=0
1,2.108764999999039,10.0.2.15,62.210.85.178,TLSv1.2,3866,Application Data
1,2.1088029999991704,62.210.85.178,10.0.2.15,TCP,60,9001  >  35978 [ACK] Seq=23097473 Ack=426952683 Win=65535 Len=0
1,2.1088110000000597,62.210.85.178,10.0.2.15,TCP,60,9001  >  35978 [ACK] Seq=23097473 Ack=426954143 Win=65535 Len=0
1,2.1088159999999334,62.210.85.178,10.0.2.15,TCP,60,9001  >  35978 [ACK] Seq=23097473 Ack=426955035 Win=65535 Len=0
1,2.2160229999990406,54.93.77.70,10.0.2.15,TLSv1.2,3674,Application Data
1,2.2161529999993945,10.0.2.15,54.93.77.70,TCP,54,34692  >  9001 [ACK] Seq=23195635 Ack=426594673 Win=65535 Len=0
1,2.228096999999252,54.93.77.70,10.0.2.15,TCP,2950,"9001  >  34692 [PSH, ACK] Seq=426594673 Ack=23195635 Win=65535 Len=2896 [TCP segment of a reassembled PDU]"
1,2.228181999998924,10.0.2.15,54.93.77.70,TCP,54,34692  >  9001 [ACK] Seq=23195635 Ack=426597569 Win=65535 Len=0
1,2.232583999999406,54.93.77.70,10.0.2.15,TLSv1.2,1314,"Application Data, Application Data"
1,2.232756999999765,10.0.2.15,54.93.77.70,TLSv1.2,590,Application Data
1,2.2328319999996893,54.93.77.70,10.0.2.15,TCP,60,9001  >  34692 [ACK] Seq=426598829 Ack=23196171 Win=65535 Len=0
1,2.238207999998849,54.93.77.70,10.0.2.15,TLSv1.2,7294,Application Data
1,2.238274999999703,10.0.2.15,54.93.77.70,TCP,54,34692  >  9001 [ACK] Seq=23196171 Ack=426606069 Win=65535 Len=0
1,2.2520580000000336,54.93.77.70,10.0.2.15,TLSv1.2,1104,"Application Data, Application Data"
1,2.2863280000001396,54.93.77.70,10.0.2.15,TCP,2950,"9001  >  34692 [PSH, ACK] Seq=426607119 Ack=23196171 Win=65535 Len=2896 [TCP segment of a reassembled PDU]"
1,2.286387999998624,10.0.2.15,54.93.77.70,TCP,54,34692  >  9001 [ACK] Seq=23196171 Ack=426610015 Win=65535 Len=0
1,2.2875939999994443,54.93.77.70,10.0.2.15,TLSv1.2,13086,"Application Data, Application Data, Application Data"
1,2.2876609999984794,10.0.2.15,54.93.77.70,TCP,54,34692  >  9001 [ACK] Seq=23196171 Ack=426623047 Win=65535 Len=0
1,2.287956000000122,10.0.2.15,54.93.77.70,TLSv1.2,590,Application Data
1,2.2880239999994956,54.93.77.70,10.0.2.15,TCP,60,9001  >  34692 [ACK] Seq=426623047 Ack=23196707 Win=65535 Len=0
1,2.294259999998758,54.93.77.70,10.0.2.15,TLSv1.2,5846,"Application Data, Application Data"
1,2.29430499999944,10.0.2.15,54.93.77.70,TCP,54,34692  >  9001 [ACK] Seq=23196707 Ack=426628839 Win=65535 Len=0
1,2.3064070000000356,54.93.77.70,10.0.2.15,TLSv1.2,5846,Application Data [TCP segment of a reassembled PDU]
1,2.306434000000081,54.93.77.70,10.0.2.15,TLSv1.2,8742,"Application Data, Application Data, Application Data"
1,2.306487999998353,10.0.2.15,54.93.77.70,TCP,54,34692  >  9001 [ACK] Seq=23196707 Ack=426634631 Win=65535 Len=0
1,2.306576999999379,10.0.2.15,54.93.77.70,TCP,54,34692  >  9001 [ACK] Seq=23196707 Ack=426643319 Win=65535 Len=0
1,2.3088019999995595,54.93.77.70,10.0.2.15,TLSv1.2,2950,Application Data [TCP segment of a reassembled PDU]
1,2.308852999998635,10.0.2.15,54.93.77.70,TCP,54,34692  >  9001 [ACK] Seq=23196707 Ack=426646215 Win=65535 Len=0
1,2.3090479999991658,10.0.2.15,54.93.77.70,TLSv1.2,590,Application Data
1,2.3091589999985445,54.93.77.70,10.0.2.15,TCP,60,9001  >  34692 [ACK] Seq=426646215 Ack=23197243 Win=65535 Len=0
1,2.309289999999237,54.93.77.70,10.0.2.15,TLSv1.2,5448,"Application Data, Application Data, Application Data"
1,2.309354999999414,10.0.2.15,54.93.77.70,TCP,54,34692  >  9001 [ACK] Seq=23197243 Ack=426651609 Win=65535 Len=0
1,2.318361999999979,54.93.77.70,10.0.2.15,TLSv1.2,5846,Application Data
1,2.318411999998716,10.0.2.15,54.93.77.70,TCP,54,34692  >  9001 [ACK] Seq=23197243 Ack=426657401 Win=65535 Len=0
1,2.3197089999994205,10.0.2.15,54.93.77.70,TLSv1.2,590,Application Data
1,2.3197909999998956,54.93.77.70,10.0.2.15,TCP,60,9001  >  34692 [ACK] Seq=426657401 Ack=23197779 Win=65535 Len=0
1,2.3486249999987194,54.93.77.70,10.0.2.15,TLSv1.2,474,Application Data
1,2.3486589999993157,54.93.77.70,10.0.2.15,TLSv1.2,4398,Application Data
1,2.3486639999991894,62.210.85.178,10.0.2.15,TLSv1.2,590,Application Data
1,2.348763999998482,10.0.2.15,54.93.77.70,TCP,54,34692  >  9001 [ACK] Seq=23197779 Ack=426662165 Win=65535 Len=0
1,2.372421000000031,54.93.77.70,10.0.2.15,TLSv1.2,380,Application Data
1,2.3750419999996666,10.0.2.15,54.93.77.70,TLSv1.2,590,Application Data
1,2.375200999998924,54.93.77.70,10.0.2.15,TCP,60,9001  >  34692 [ACK] Seq=426662491 Ack=23198315 Win=65535 Len=0
1,2.392104999998992,10.0.2.15,62.210.85.178,TCP,54,35978  >  9001 [ACK] Seq=426955035 Ack=23098009 Win=65535 Len=0
1,2.411824999999226,62.210.85.178,10.0.2.15,TLSv1.2,590,Application Data
1,2.411904999999024,10.0.2.15,62.210.85.178,TCP,54,35978  >  9001 [ACK] Seq=426955035 Ack=23098545 Win=65535 Len=0
1,2.4622659999986354,62.210.85.178,10.0.2.15,TLSv1.2,590,Application Data
1,2.4623539999993227,10.0.2.15,62.210.85.178,TCP,54,35978  >  9001 [ACK] Seq=426955035 Ack=23099081 Win=65535 Len=0
1,2.4924649999993562,10.0.2.15,152.89.104.206,TLSv1.3,590,Application Data
1,2.4926109999996697,152.89.104.206,10.0.2.15,TCP,60,9001  >  47334 [ACK] Seq=120584 Ack=73267 Win=65535 Len=0
1,2.4935219999988476,62.210.85.178,10.0.2.15,TLSv1.2,590,Application Data
1,2.4935679999998683,10.0.2.15,62.210.85.178,TCP,54,35978  >  9001 [ACK] Seq=426955035 Ack=23099617 Win=65535 Len=0
1,2.5758269999987533,62.210.85.178,10.0.2.15,TLSv1.2,590,Application Data
1,2.575911999998425,10.0.2.15,62.210.85.178,TCP,54,35978  >  9001 [ACK] Seq=426955035 Ack=23100153 Win=65535 Len=0
1,2.576454999998532,10.0.2.15,62.210.85.178,TLSv1.2,590,Application Data
1,2.576590999999098,62.210.85.178,10.0.2.15,TCP,60,9001  >  35978 [ACK] Seq=23100153 Ack=426955571 Win=65535 Len=0
1,2.66971999999987,54.93.77.70,10.0.2.15,TLSv1.2,590,Application Data
1,2.670167999998739,10.0.2.15,54.93.77.70,TLSv1.2,590,Application Data
1,2.670319999999265,54.93.77.70,10.0.2.15,TCP,60,9001  >  34692 [ACK] Seq=426663027 Ack=23198851 Win=65535 Len=0
1,2.8389569999999367,62.210.85.178,10.0.2.15,TLSv1.2,590,Application Data
1,2.84284099999968,10.0.2.15,62.210.85.178,TLSv1.2,590,Application Data
1,2.842992999998387,62.210.85.178,10.0.2.15,TCP,60,9001  >  35978 [ACK] Seq=23100689 Ack=426956107 Win=65535 Len=0
1,2.8564229999992676,10.0.2.15,62.210.85.178,TLSv1.2,4124,Application Data
1,2.8565330000001268,10.0.2.15,62.210.85.178,TCP,2974,35978  >  9001 [ACK] Seq=426960177 Ack=23100689 Win=65535 Len=2920 [TCP segment of a reassembled PDU]
1,2.8565729999991163,62.210.85.178,10.0.2.15,TCP,60,9001  >  35978 [ACK] Seq=23100689 Ack=426957567 Win=65535 Len=0
1,2.8565849999995407,62.210.85.178,10.0.2.15,TCP,60,9001  >  35978 [ACK] Seq=23100689 Ack=426959027 Win=65535 Len=0
1,2.8565879999987374,62.210.85.178,10.0.2.15,TCP,60,9001  >  35978 [ACK] Seq=23100689 Ack=426960177 Win=65535 Len=0
1,2.856590999999753,62.210.85.178,10.0.2.15,TCP,60,9001  >  35978 [ACK] Seq=23100689 Ack=426961637 Win=65535 Len=0
1,2.856592999998611,62.210.85.178,10.0.2.15,TCP,60,9001  >  35978 [ACK] Seq=23100689 Ack=426963097 Win=65535 Len=0
1,2.856627999999546,10.0.2.15,62.210.85.178,TLSv1.2,1204,Application Data
1,2.8566609999998036,62.210.85.178,10.0.2.15,TCP,60,9001  >  35978 [ACK] Seq=23100689 Ack=426964247 Win=65535 Len=0
1,2.856705999998667,10.0.2.15,62.210.85.178,TLSv1.2,4124,Application Data
1,2.8567409999996016,62.210.85.178,10.0.2.15,TCP,60,9001  >  35978 [ACK] Seq=23100689 Ack=426965707 Win=65535 Len=0
1,2.856748999998672,62.210.85.178,10.0.2.15,TCP,60,9001  >  35978 [ACK] Seq=23100689 Ack=426967167 Win=65535 Len=0
1,2.8567519999996875,62.210.85.178,10.0.2.15,TCP,60,9001  >  35978 [ACK] Seq=23100689 Ack=426968317 Win=65535 Len=0
1,2.856789999999819,10.0.2.15,62.210.85.178,TLSv1.2,4124,Application Data
1,2.856824999998935,62.210.85.178,10.0.2.15,TCP,60,9001  >  35978 [ACK] Seq=23100689 Ack=426969777 Win=65535 Len=0
1,2.8568319999994856,62.210.85.178,10.0.2.15,TCP,60,9001  >  35978 [ACK] Seq=23100689 Ack=426971237 Win=65535 Len=0
1,2.8568949999989854,10.0.2.15,62.210.85.178,TLSv1.2,2974,Application Data
1,2.8569299999999203,62.210.85.178,10.0.2.15,TCP,60,9001  >  35978 [ACK] Seq=23100689 Ack=426972387 Win=65535 Len=0
1,2.8569379999989906,62.210.85.178,10.0.2.15,TCP,60,9001  >  35978 [ACK] Seq=23100689 Ack=426973847 Win=65535 Len=0
1,2.8569419999985257,62.210.85.178,10.0.2.15,TCP,60,9001  >  35978 [ACK] Seq=23100689 Ack=426975307 Win=65535 Len=0
1,2.8569689999985712,10.0.2.15,62.210.85.178,TLSv1.2,1226,Application Data
1,2.857001999998829,62.210.85.178,10.0.2.15,TCP,60,9001  >  35978 [ACK] Seq=23100689 Ack=426976479 Win=65535 Len=0
1,2.857040999999299,10.0.2.15,62.210.85.178,TLSv1.2,4124,Application Data
1,2.8570759999984148,62.210.85.178,10.0.2.15,TCP,60,9001  >  35978 [ACK] Seq=23100689 Ack=426977939 Win=65535 Len=0
1,2.857081999998627,62.210.85.178,10.0.2.15,TCP,60,9001  >  35978 [ACK] Seq=23100689 Ack=426979399 Win=65535 Len=0
1,2.8570849999996426,62.210.85.178,10.0.2.15,TCP,60,9001  >  35978 [ACK] Seq=23100689 Ack=426980549 Win=65535 Len=0
1,2.85711899999842,10.0.2.15,62.210.85.178,TLSv1.2,460,Application Data
1,2.857152999999016,62.210.85.178,10.0.2.15,TCP,60,9001  >  35978 [ACK] Seq=23100689 Ack=426980955 Win=65535 Len=0
1,2.934150999999474,54.93.77.70,10.0.2.15,TLSv1.2,590,Application Data
1,2.9541730000000825,54.93.77.70,10.0.2.15,TLSv1.2,5846,Application Data
1,2.9542829999991227,10.0.2.15,54.93.77.70,TCP,54,34692  >  9001 [ACK] Seq=23198851 Ack=426669355 Win=65535 Len=0
1,2.955112999999983,54.93.77.70,10.0.2.15,TLSv1.2,4398,Application Data [TCP segment of a reassembled PDU]
1,2.955170999999609,10.0.2.15,54.93.77.70,TCP,54,34692  >  9001 [ACK] Seq=23198851 Ack=426673699 Win=65535 Len=0
1,2.9712889999991603,54.93.77.70,10.0.2.15,TLSv1.2,1292,Application Data
1,2.9863119999990886,54.93.77.70,10.0.2.15,TCP,2950,"9001  >  34692 [PSH, ACK] Seq=426674937 Ack=23198851 Win=65535 Len=2896 [TCP segment of a reassembled PDU]"
1,2.986407999998846,10.0.2.15,54.93.77.70,TCP,54,34692  >  9001 [ACK] Seq=23198851 Ack=426677833 Win=65535 Len=0
1,3.0045549999995274,54.93.77.70,10.0.2.15,TLSv1.2,778,Application Data
1,3.0095239999991463,54.93.77.70,10.0.2.15,TCP,2950,"9001  >  34692 [PSH, ACK] Seq=426678557 Ack=23198851 Win=65535 Len=2896 [TCP segment of a reassembled PDU]"
1,3.009580999998434,10.0.2.15,54.93.77.70,TCP,54,34692  >  9001 [ACK] Seq=23198851 Ack=426681453 Win=65535 Len=0
1,3.0301979999985633,54.93.77.70,10.0.2.15,TLSv1.2,1314,"Application Data, Application Data"
1,3.0430799999994633,54.93.77.70,10.0.2.15,TLSv1.2,4398,Application Data
1,3.043141000000105,10.0.2.15,54.93.77.70,TCP,54,34692  >  9001 [ACK] Seq=23198851 Ack=426687057 Win=65535 Len=0
1,3.061930999998367,54.93.77.70,10.0.2.15,TLSv1.2,1408,Application Data
1,3.0649969999994937,10.0.2.15,54.93.77.70,TLSv1.2,590,Application Data
1,3.0651170000001002,54.93.77.70,10.0.2.15,TCP,60,9001  >  34692 [ACK] Seq=426688411 Ack=23199387 Win=65535 Len=0
1,3.1753459999999905,62.210.85.178,10.0.2.15,TLSv1.2,590,Application Data
1,3.175937999998496,10.0.2.15,62.210.85.178,TLSv1.2,590,Application Data
1,3.1761749999986932,62.210.85.178,10.0.2.15,TCP,60,9001  >  35978 [ACK] Seq=23101225 Ack=426981491 Win=65535 Len=0
1,3.274894000000131,54.93.77.70,10.0.2.15,TLSv1.2,590,Application Data
1,3.275761999999304,10.0.2.15,54.93.77.70,TLSv1.2,590,Application Data
1,3.2759729999997944,54.93.77.70,10.0.2.15,TCP,60,9001  >  34692 [ACK] Seq=426688947 Ack=23199923 Win=65535 Len=0
1,3.453580999999758,62.210.85.178,10.0.2.15,TLSv1.2,590,Application Data
1,3.4616769999993267,10.0.2.15,62.210.85.178,TLSv1.2,590,Application Data
1,3.461874999999054,62.210.85.178,10.0.2.15,TCP,60,9001  >  35978 [ACK] Seq=23101761 Ack=426982027 Win=65535 Len=0
1,3.4723479999993287,10.0.2.15,62.210.85.178,TLSv1.2,4124,Application Data
1,3.472481999999218,10.0.2.15,62.210.85.178,TCP,2974,35978  >  9001 [ACK] Seq=426986097 Ack=23101761 Win=65535 Len=2920 [TCP segment of a reassembled PDU]
1,3.4725339999986318,62.210.85.178,10.0.2.15,TCP,60,9001  >  35978 [ACK] Seq=23101761 Ack=426983487 Win=65535 Len=0
1,3.4725469999993948,62.210.85.178,10.0.2.15,TCP,60,9001  >  35978 [ACK] Seq=23101761 Ack=426984947 Win=65535 Len=0
1,3.472552999999607,62.210.85.178,10.0.2.15,TCP,60,9001  >  35978 [ACK] Seq=23101761 Ack=426986097 Win=65535 Len=0
1,3.4726409999984753,10.0.2.15,62.210.85.178,TLSv1.2,1204,Application Data
1,3.472701999999117,62.210.85.178,10.0.2.15,TCP,60,9001  >  35978 [ACK] Seq=23101761 Ack=426987557 Win=65535 Len=0
1,3.4727119999988645,62.210.85.178,10.0.2.15,TCP,60,9001  >  35978 [ACK] Seq=23101761 Ack=426989017 Win=65535 Len=0
1,3.472716999998738,62.210.85.178,10.0.2.15,TCP,60,9001  >  35978 [ACK] Seq=23101761 Ack=426990167 Win=65535 Len=0
1,3.472796999998536,10.0.2.15,62.210.85.178,TLSv1.2,4124,Application Data
1,3.4728869999999006,62.210.85.178,10.0.2.15,TCP,60,9001  >  35978 [ACK] Seq=23101761 Ack=426991627 Win=65535 Len=0
1,3.472896999999648,62.210.85.178,10.0.2.15,TCP,60,9001  >  35978 [ACK] Seq=23101761 Ack=426993087 Win=65535 Len=0
1,3.472900999999183,62.210.85.178,10.0.2.15,TCP,60,9001  >  35978 [ACK] Seq=23101761 Ack=426994237 Win=65535 Len=0
1,3.4729539999989356,10.0.2.15,62.210.85.178,TLSv1.2,4124,Application Data
1,3.473039999998946,62.210.85.178,10.0.2.15,TCP,60,9001  >  35978 [ACK] Seq=23101761 Ack=426995697 Win=65535 Len=0
1,3.473047999999835,62.210.85.178,10.0.2.15,TCP,60,9001  >  35978 [ACK] Seq=23101761 Ack=426997157 Win=65535 Len=0
1,3.4730509999990318,62.210.85.178,10.0.2.15,TCP,60,9001  >  35978 [ACK] Seq=23101761 Ack=426998307 Win=65535 Len=0
1,3.473086999998486,10.0.2.15,62.210.85.178,TLSv1.2,332,Application Data
1,3.473158999999214,62.210.85.178,10.0.2.15,TCP,60,9001  >  35978 [ACK] Seq=23101761 Ack=426998585 Win=65535 Len=0
1,3.4732349999994767,10.0.2.15,62.210.85.178,TLSv1.2,3868,Application Data
1,3.4733149999992747,62.210.85.178,10.0.2.15,TCP,60,9001  >  35978 [ACK] Seq=23101761 Ack=427000045 Win=65535 Len=0
1,3.473324999999022,62.210.85.178,10.0.2.15,TCP,60,9001  >  35978 [ACK] Seq=23101761 Ack=427001505 Win=65535 Len=0
1,3.473329999998896,62.210.85.178,10.0.2.15,TCP,60,9001  >  35978 [ACK] Seq=23101761 Ack=427002399 Win=65535 Len=0
1,3.473387999998522,10.0.2.15,62.210.85.178,TLSv1.2,4124,Application Data
1,3.4734619999999268,10.0.2.15,62.210.85.178,TCP,2974,35978  >  9001 [ACK] Seq=427006469 Ack=23101761 Win=65535 Len=2920 [TCP segment of a reassembled PDU]
1,3.4735079999991285,62.210.85.178,10.0.2.15,TCP,60,9001  >  35978 [ACK] Seq=23101761 Ack=427003859 Win=65535 Len=0
1,3.473516000000018,62.210.85.178,10.0.2.15,TCP,60,9001  >  35978 [ACK] Seq=23101761 Ack=427005319 Win=65535 Len=0
1,3.4735209999998915,62.210.85.178,10.0.2.15,TCP,60,9001  >  35978 [ACK] Seq=23101761 Ack=427006469 Win=65535 Len=0
1,3.473523999999088,62.210.85.178,10.0.2.15,TCP,60,9001  >  35978 [ACK] Seq=23101761 Ack=427007929 Win=65535 Len=0
1,3.4735270000001037,62.210.85.178,10.0.2.15,TCP,60,9001  >  35978 [ACK] Seq=23101761 Ack=427009389 Win=65535 Len=0
1,3.473571999998967,10.0.2.15,62.210.85.178,TLSv1.2,110,Application Data
1,3.473636999999144,62.210.85.178,10.0.2.15,TCP,60,9001  >  35978 [ACK] Seq=23101761 Ack=427009445 Win=65535 Len=0
1,3.4840599999988626,10.0.2.15,62.210.85.178,TLSv1.2,4124,Application Data
1,3.4841829999986658,62.210.85.178,10.0.2.15,TCP,60,9001  >  35978 [ACK] Seq=23101761 Ack=427010905 Win=65535 Len=0
1,3.4842119999993884,62.210.85.178,10.0.2.15,TCP,60,9001  >  35978 [ACK] Seq=23101761 Ack=427012365 Win=65535 Len=0
1,3.484214999998585,62.210.85.178,10.0.2.15,TCP,60,9001  >  35978 [ACK] Seq=23101761 Ack=427013515 Win=65535 Len=0
1,3.484255999999732,10.0.2.15,62.210.85.178,TLSv1.2,4124,Application Data
1,3.484313999999358,62.210.85.178,10.0.2.15,TCP,60,9001  >  35978 [ACK] Seq=23101761 Ack=427014975 Win=65535 Len=0
1,3.4843199999995704,62.210.85.178,10.0.2.15,TCP,60,9001  >  35978 [ACK] Seq=23101761 Ack=427016435 Win=65535 Len=0
1,3.484322999998767,62.210.85.178,10.0.2.15,TCP,60,9001  >  35978 [ACK] Seq=23101761 Ack=427017585 Win=65535 Len=0
1,3.4843609999988985,10.0.2.15,62.210.85.178,TLSv1.2,4124,Application Data
1,3.484393999999156,62.210.85.178,10.0.2.15,TCP,60,9001  >  35978 [ACK] Seq=23101761 Ack=427019045 Win=65535 Len=0
1,3.4844020000000455,62.210.85.178,10.0.2.15,TCP,60,9001  >  35978 [ACK] Seq=23101761 Ack=427020505 Win=65535 Len=0
1,3.4844059999995807,62.210.85.178,10.0.2.15,TCP,60,9001  >  35978 [ACK] Seq=23101761 Ack=427021655 Win=65535 Len=0
1,3.484441999999035,10.0.2.15,62.210.85.178,TLSv1.2,4124,Application Data
1,3.4844749999992928,62.210.85.178,10.0.2.15,TCP,60,9001  >  35978 [ACK] Seq=23101761 Ack=427023115 Win=65535 Len=0
1,3.48448499999904,62.210.85.178,10.0.2.15,TCP,60,9001  >  35978 [ACK] Seq=23101761 Ack=427024575 Win=65535 Len=0
1,3.4844889999985753,62.210.85.178,10.0.2.15,TCP,60,9001  >  35978 [ACK] Seq=23101761 Ack=427025725 Win=65535 Len=0
1,3.4845229999991716,10.0.2.15,62.210.85.178,TLSv1.2,332,Application Data
1,3.4845559999994293,62.210.85.178,10.0.2.15,TCP,60,9001  >  35978 [ACK] Seq=23101761 Ack=427026003 Win=65535 Len=0
1,3.484618999998929,10.0.2.15,62.210.85.178,TLSv1.2,3868,Application Data
1,3.484653999999864,62.210.85.178,10.0.2.15,TCP,60,9001  >  35978 [ACK] Seq=23101761 Ack=427027463 Win=65535 Len=0
1,3.4846619999989343,62.210.85.178,10.0.2.15,TCP,60,9001  >  35978 [ACK] Seq=23101761 Ack=427028923 Win=65535 Len=0
1,3.48466499999995,62.210.85.178,10.0.2.15,TCP,60,9001  >  35978 [ACK] Seq=23101761 Ack=427029817 Win=65535 Len=0
1,3.4847030000000814,10.0.2.15,62.210.85.178,TLSv1.2,3480,Application Data
1,3.484787999999753,62.210.85.178,10.0.2.15,TCP,60,9001  >  35978 [ACK] Seq=23101761 Ack=427031277 Win=65535 Len=0
1,3.484794999998485,62.210.85.178,10.0.2.15,TCP,60,9001  >  35978 [ACK] Seq=23101761 Ack=427032737 Win=65535 Len=0
1,3.4847979999995005,62.210.85.178,10.0.2.15,TCP,60,9001  >  35978 [ACK] Seq=23101761 Ack=427033243 Win=65535 Len=0
1,3.6089499999998225,54.93.77.70,10.0.2.15,TLSv1.2,4210,"Application Data, Application Data"
1,3.6090899999999237,10.0.2.15,54.93.77.70,TCP,54,34692  >  9001 [ACK] Seq=23199923 Ack=426693103 Win=65535 Len=0
1,3.620262999998886,54.93.77.70,10.0.2.15,TLSv1.2,5846,Application Data
1,3.620365999999194,10.0.2.15,54.93.77.70,TCP,54,34692  >  9001 [ACK] Seq=23199923 Ack=426698895 Win=65535 Len=0
1,3.63072800000009,54.93.77.70,10.0.2.15,TLSv1.2,8742,"Application Data, Application Data"
1,3.630807999999888,10.0.2.15,54.93.77.70,TCP,54,34692  >  9001 [ACK] Seq=23199923 Ack=426707583 Win=65535 Len=0
1,3.6310749999993277,10.0.2.15,54.93.77.70,TLSv1.2,590,Application Data
1,3.6312029999990045,54.93.77.70,10.0.2.15,TLSv1.2,1596,Application Data
1,3.6312199999993027,54.93.77.70,10.0.2.15,TCP,60,9001  >  34692 [ACK] Seq=426709125 Ack=23200459 Win=65535 Len=0
1,3.6312639999996463,10.0.2.15,54.93.77.70,TCP,54,34692  >  9001 [ACK] Seq=23200459 Ack=426709125 Win=65535 Len=0
1,3.6342139999997016,54.93.77.70,10.0.2.15,TCP,1502,"9001  >  34692 [PSH, ACK] Seq=426709125 Ack=23200459 Win=65535 Len=1448 [TCP segment of a reassembled PDU]"
1,3.634258999998565,10.0.2.15,54.93.77.70,TCP,54,34692  >  9001 [ACK] Seq=23200459 Ack=426710573 Win=65535 Len=0
1,3.639757999999347,54.93.77.70,10.0.2.15,TLSv1.2,5846,Application Data [TCP segment of a reassembled PDU]
1,3.639830999998594,10.0.2.15,54.93.77.70,TCP,54,34692  >  9001 [ACK] Seq=23200459 Ack=426716365 Win=65535 Len=0
1,3.640310999999201,54.93.77.70,10.0.2.15,TLSv1.2,5846,"Application Data, Application Data"
1,3.640354999999545,10.0.2.15,54.93.77.70,TCP,54,34692  >  9001 [ACK] Seq=23200459 Ack=426722157 Win=65535 Len=0
1,3.640529999998762,10.0.2.15,54.93.77.70,TLSv1.2,590,Application Data
1,3.640646999998353,54.93.77.70,10.0.2.15,TCP,60,9001  >  34692 [ACK] Seq=426722157 Ack=23200995 Win=65535 Len=0
1,3.648831999998947,54.93.77.70,10.0.2.15,TLSv1.2,3044,Application Data
1,3.6488789999984874,10.0.2.15,54.93.77.70,TCP,54,34692  >  9001 [ACK] Seq=23200995 Ack=426725147 Win=65535 Len=0
1,3.654622999998537,54.93.77.70,10.0.2.15,TLSv1.2,5846,Application Data
1,3.6546419999995123,54.93.77.70,10.0.2.15,TLSv1.2,4398,Application Data [TCP segment of a reassembled PDU]
1,3.654709999998886,10.0.2.15,54.93.77.70,TCP,54,34692  >  9001 [ACK] Seq=23200995 Ack=426735283 Win=65535 Len=0
1,3.6671099999985017,54.93.77.70,10.0.2.15,TLSv1.2,1292,Application Data
1,3.676746999999523,54.93.77.70,10.0.2.15,TCP,2950,"9001  >  34692 [PSH, ACK] Seq=426736521 Ack=23200995 Win=65535 Len=2896 [TCP segment of a reassembled PDU]"
1,3.676808999998684,10.0.2.15,54.93.77.70,TCP,54,34692  >  9001 [ACK] Seq=23200995 Ack=426739417 Win=65535 Len=0
1,3.693056999998589,54.93.77.70,10.0.2.15,TLSv1.2,1314,"Application Data, Application Data"
1,3.695503999999346,10.0.2.15,54.93.77.70,TLSv1.2,590,Application Data
1,3.695644999999786,54.93.77.70,10.0.2.15,TCP,60,9001  >  34692 [ACK] Seq=426740677 Ack=23201531 Win=65535 Len=0
1,3.7727189999986877,62.210.85.178,10.0.2.15,TLSv1.2,1104,Application Data
1,3.815709999998944,10.0.2.15,62.210.85.178,TCP,54,35978  >  9001 [ACK] Seq=427033243 Ack=23102811 Win=65535 Len=0
1,3.833611000000019,62.210.85.178,10.0.2.15,TLSv1.2,590,Application Data
1,3.833681999998589,10.0.2.15,62.210.85.178,TCP,54,35978  >  9001 [ACK] Seq=427033243 Ack=23103347 Win=65535 Len=0
1,3.834144999998898,10.0.2.15,62.210.85.178,TLSv1.2,590,Application Data
1,3.834240000000136,62.210.85.178,10.0.2.15,TCP,60,9001  >  35978 [ACK] Seq=23103347 Ack=427033779 Win=65535 Len=0
1,3.939900999999736,54.93.77.70,10.0.2.15,TLSv1.2,590,Application Data
1,3.940266999999949,10.0.2.15,54.93.77.70,TLSv1.2,590,Application Data
1,3.9403719999991154,54.93.77.70,10.0.2.15,TCP,60,9001  >  34692 [ACK] Seq=426741213 Ack=23202067 Win=65535 Len=0
1,4.27306199999839,62.210.85.178,10.0.2.15,TLSv1.2,590,Application Data
1,4.279144999998607,10.0.2.15,62.210.85.178,TLSv1.2,590,Application Data
1,4.279332000000068,62.210.85.178,10.0.2.15,TCP,60,9001  >  35978 [ACK] Seq=23103883 Ack=427034315 Win=65535 Len=0
1,4.289620999999897,10.0.2.15,62.210.85.178,TLSv1.2,4124,Application Data
1,4.289719999998852,10.0.2.15,62.210.85.178,TCP,2974,35978  >  9001 [ACK] Seq=427038385 Ack=23103883 Win=65535 Len=2920 [TCP segment of a reassembled PDU]
1,4.289761999998518,62.210.85.178,10.0.2.15,TCP,60,9001  >  35978 [ACK] Seq=23103883 Ack=427035775 Win=65535 Len=0
1,4.289774999999281,62.210.85.178,10.0.2.15,TCP,60,9001  >  35978 [ACK] Seq=23103883 Ack=427037235 Win=65535 Len=0
1,4.289777999998478,62.210.85.178,10.0.2.15,TCP,60,9001  >  35978 [ACK] Seq=23103883 Ack=427038385 Win=65535 Len=0
1,4.289780999999493,62.210.85.178,10.0.2.15,TCP,60,9001  >  35978 [ACK] Seq=23103883 Ack=427039845 Win=65535 Len=0
1,4.28978399999869,62.210.85.178,10.0.2.15,TCP,60,9001  >  35978 [ACK] Seq=23103883 Ack=427041305 Win=65535 Len=0
1,4.289824999999837,10.0.2.15,62.210.85.178,TLSv1.2,1204,Application Data
1,4.289858999998614,62.210.85.178,10.0.2.15,TCP,60,9001  >  35978 [ACK] Seq=23103883 Ack=427042455 Win=65535 Len=0
1,4.289904999999635,10.0.2.15,62.210.85.178,TLSv1.2,4124,Application Data
1,4.289967999999135,62.210.85.178,10.0.2.15,TCP,60,9001  >  35978 [ACK] Seq=23103883 Ack=427043915 Win=65535 Len=0
1,4.289979999999559,62.210.85.178,10.0.2.15,TCP,60,9001  >  35978 [ACK] Seq=23103883 Ack=427045375 Win=65535 Len=0
1,4.289982999998756,62.210.85.178,10.0.2.15,TCP,60,9001  >  35978 [ACK] Seq=23103883 Ack=427046525 Win=65535 Len=0
1,4.290032999999312,10.0.2.15,62.210.85.178,TLSv1.2,4124,Application Data
1,4.290094999998473,62.210.85.178,10.0.2.15,TCP,60,9001  >  35978 [ACK] Seq=23103883 Ack=427047985 Win=65535 Len=0
1,4.290103999999701,62.210.85.178,10.0.2.15,TCP,60,9001  >  35978 [ACK] Seq=23103883 Ack=427049445 Win=65535 Len=0
1,4.290106999998898,62.210.85.178,10.0.2.15,TCP,60,9001  >  35978 [ACK] Seq=23103883 Ack=427050595 Win=65535 Len=0
1,4.29015199999958,10.0.2.15,62.210.85.178,TLSv1.2,332,Application Data
1,4.290188999999373,62.210.85.178,10.0.2.15,TCP,60,9001  >  35978 [ACK] Seq=23103883 Ack=427050873 Win=65535 Len=0
1,4.29028499999913,10.0.2.15,62.210.85.178,TLSv1.2,3868,Application Data
1,4.290321999998923,62.210.85.178,10.0.2.15,TCP,60,9001  >  35978 [ACK] Seq=23103883 Ack=427052333 Win=65535 Len=0
1,4.290328999999474,62.210.85.178,10.0.2.15,TCP,60,9001  >  35978 [ACK] Seq=23103883 Ack=427053793 Win=65535 Len=0
1,4.290331999998671,62.210.85.178,10.0.2.15,TCP,60,9001  >  35978 [ACK] Seq=23103883 Ack=427054687 Win=65535 Len=0
1,4.290369999998802,10.0.2.15,62.210.85.178,TLSv1.2,4124,Application Data
1,4.290403999999398,62.210.85.178,10.0.2.15,TCP,60,9001  >  35978 [ACK] Seq=23103883 Ack=427056147 Win=65535 Len=0
1,4.290410999999949,62.210.85.178,10.0.2.15,TCP,60,9001  >  35978 [ACK] Seq=23103883 Ack=427057607 Win=65535 Len=0
1,4.290413999999146,62.210.85.178,10.0.2.15,TCP,60,9001  >  35978 [ACK] Seq=23103883 Ack=427058757 Win=65535 Len=0
1,4.2904499999986,10.0.2.15,62.210.85.178,TLSv1.2,3030,Application Data
1,4.2904859999998735,62.210.85.178,10.0.2.15,TCP,60,9001  >  35978 [ACK] Seq=23103883 Ack=427060217 Win=65535 Len=0
1,4.290492000000086,62.210.85.178,10.0.2.15,TCP,60,9001  >  35978 [ACK] Seq=23103883 Ack=427061677 Win=65535 Len=0
1,4.290494999999282,62.210.85.178,10.0.2.15,TCP,60,9001  >  35978 [ACK] Seq=23103883 Ack=427061733 Win=65535 Len=0
1,4.299674999998388,10.0.2.15,62.210.85.178,TLSv1.2,4124,Application Data
1,4.29978200000005,62.210.85.178,10.0.2.15,TCP,60,9001  >  35978 [ACK] Seq=23103883 Ack=427063193 Win=65535 Len=0
1,4.2997919999997976,62.210.85.178,10.0.2.15,TCP,60,9001  >  35978 [ACK] Seq=23103883 Ack=427064653 Win=65535 Len=0
1,4.299796999999671,62.210.85.178,10.0.2.15,TCP,60,9001  >  35978 [ACK] Seq=23103883 Ack=427065803 Win=65535 Len=0
1,4.299850999999762,10.0.2.15,62.210.85.178,TLSv1.2,4124,Application Data
1,4.2999219999983325,62.210.85.178,10.0.2.15,TCP,60,9001  >  35978 [ACK] Seq=23103883 Ack=427067263 Win=65535 Len=0
1,4.299929999999222,62.210.85.178,10.0.2.15,TCP,60,9001  >  35978 [ACK] Seq=23103883 Ack=427068723 Win=65535 Len=0
1,4.299933999998757,62.210.85.178,10.0.2.15,TCP,60,9001  >  35978 [ACK] Seq=23103883 Ack=427069873 Win=65535 Len=0
1,4.299977999999101,10.0.2.15,62.210.85.178,TLSv1.2,4124,Application Data
1,4.3000409999986005,10.0.2.15,62.210.85.178,TCP,2974,35978  >  9001 [ACK] Seq=427073943 Ack=23103883 Win=65535 Len=2920 [TCP segment of a reassembled PDU]
1,4.300080999999409,62.210.85.178,10.0.2.15,TCP,60,9001  >  35978 [ACK] Seq=23103883 Ack=427071333 Win=65535 Len=0
1,4.30008799999996,62.210.85.178,10.0.2.15,TCP,60,9001  >  35978 [ACK] Seq=23103883 Ack=427072793 Win=65535 Len=0
1,4.300092999999833,62.210.85.178,10.0.2.15,TCP,60,9001  >  35978 [ACK] Seq=23103883 Ack=427073943 Win=65535 Len=0
1,4.300096999999369,62.210.85.178,10.0.2.15,TCP,60,9001  >  35978 [ACK] Seq=23103883 Ack=427075403 Win=65535 Len=0
1,4.300100999998904,62.210.85.178,10.0.2.15,TCP,60,9001  >  35978 [ACK] Seq=23103883 Ack=427076863 Win=65535 Len=0
1,4.300139999999374,10.0.2.15,62.210.85.178,TLSv1.2,1204,Application Data
1,4.300232999999935,62.210.85.178,10.0.2.15,TCP,60,9001  >  35978 [ACK] Seq=23103883 Ack=427078013 Win=65535 Len=0
1,4.3002679999990505,10.0.2.15,62.210.85.178,TLSv1.2,2974,Application Data
1,4.3003069999995205,62.210.85.178,10.0.2.15,TCP,60,9001  >  35978 [ACK] Seq=23103883 Ack=427079473 Win=65535 Len=0
1,4.300312999999733,62.210.85.178,10.0.2.15,TCP,60,9001  >  35978 [ACK] Seq=23103883 Ack=427080933 Win=65535 Len=0
1,4.30034699999851,10.0.2.15,62.210.85.178,TLSv1.2,1226,Application Data
1,4.300384999998641,62.210.85.178,10.0.2.15,TCP,60,9001  >  35978 [ACK] Seq=23103883 Ack=427082105 Win=65535 Len=0
1,4.300430999999662,10.0.2.15,62.210.85.178,TLSv1.2,4124,Application Data
1,4.300472999999329,62.210.85.178,10.0.2.15,TCP,60,9001  >  35978 [ACK] Seq=23103883 Ack=427083565 Win=65535 Len=0
1,4.3004799999998795,62.210.85.178,10.0.2.15,TCP,60,9001  >  35978 [ACK] Seq=23103883 Ack=427085025 Win=65535 Len=0
1,4.300484999999753,62.210.85.178,10.0.2.15,TCP,60,9001  >  35978 [ACK] Seq=23103883 Ack=427086175 Win=65535 Len=0
1,4.300530999998955,10.0.2.15,62.210.85.178,TLSv1.2,3030,Application Data
1,4.300572000000102,62.210.85.178,10.0.2.15,TCP,60,9001  >  35978 [ACK] Seq=23103883 Ack=427087635 Win=65535 Len=0
1,4.300578999998834,62.210.85.178,10.0.2.15,TCP,60,9001  >  35978 [ACK] Seq=23103883 Ack=427089095 Win=65535 Len=0
1,4.300582999998369,62.210.85.178,10.0.2.15,TCP,60,9001  >  35978 [ACK] Seq=23103883 Ack=427089151 Win=65535 Len=0
1,4.311949999999342,10.0.2.15,62.210.85.178,TLSv1.2,4124,Application Data
1,4.312043999998423,10.0.2.15,62.210.85.178,TCP,2974,35978  >  9001 [ACK] Seq=427093221 Ack=23103883 Win=65535 Len=2920 [TCP segment of a reassembled PDU]
1,4.31208499999957,62.210.85.178,10.0.2.15,TCP,60,9001  >  35978 [ACK] Seq=23103883 Ack=427090611 Win=65535 Len=0
1,4.312094999999317,62.210.85.178,10.0.2.15,TCP,60,9001  >  35978 [ACK] Seq=23103883 Ack=427092071 Win=65535 Len=0
1,4.312099999999191,62.210.85.178,10.0.2.15,TCP,60,9001  >  35978 [ACK] Seq=23103883 Ack=427093221 Win=65535 Len=0
1,4.312144999999873,10.0.2.15,62.210.85.178,TLSv1.2,1204,Application Data
1,4.312189999998736,62.210.85.178,10.0.2.15,TCP,60,9001  >  35978 [ACK] Seq=23103883 Ack=427094681 Win=65535 Len=0
1,4.312196999999287,62.210.85.178,10.0.2.15,TCP,60,9001  >  35978 [ACK] Seq=23103883 Ack=427096141 Win=65535 Len=0
1,4.312269000000015,10.0.2.15,62.210.85.178,TCP,2974,35978  >  9001 [ACK] Seq=427097291 Ack=23103883 Win=65535 Len=2920 [TCP segment of a reassembled PDU]
1,4.312290999998368,62.210.85.178,10.0.2.15,TCP,60,9001  >  35978 [ACK] Seq=23103883 Ack=427097291 Win=65535 Len=0
1,4.312324999998964,10.0.2.15,62.210.85.178,TLSv1.2,1204,Application Data
1,4.312361999998757,62.210.85.178,10.0.2.15,TCP,60,9001  >  35978 [ACK] Seq=23103883 Ack=427098751 Win=65535 Len=0
1,4.312368999999308,62.210.85.178,10.0.2.15,TCP,60,9001  >  35978 [ACK] Seq=23103883 Ack=427100211 Win=65535 Len=0
1,4.312372999998843,62.210.85.178,10.0.2.15,TCP,60,9001  >  35978 [ACK] Seq=23103883 Ack=427101361 Win=65535 Len=0
1,4.312419999998383,10.0.2.15,62.210.85.178,TLSv1.2,4124,Application Data
1,4.312497999999323,10.0.2.15,62.210.85.178,TLSv1.2,2974,Application Data
1,4.312538000000131,62.210.85.178,10.0.2.15,TCP,60,9001  >  35978 [ACK] Seq=23103883 Ack=427102821 Win=65535 Len=0
1,4.312544999998863,62.210.85.178,10.0.2.15,TCP,60,9001  >  35978 [ACK] Seq=23103883 Ack=427104281 Win=65535 Len=0
1,4.312550999999075,62.210.85.178,10.0.2.15,TCP,60,9001  >  35978 [ACK] Seq=23103883 Ack=427105431 Win=65535 Len=0
1,4.312554999998611,62.210.85.178,10.0.2.15,TCP,60,9001  >  35978 [ACK] Seq=23103883 Ack=427106891 Win=65535 Len=0
1,4.312558999999965,62.210.85.178,10.0.2.15,TCP,60,9001  >  35978 [ACK] Seq=23103883 Ack=427108351 Win=65535 Len=0
1,4.312597999998616,10.0.2.15,62.210.85.178,TLSv1.2,1226,Application Data
1,4.312635999998747,62.210.85.178,10.0.2.15,TCP,60,9001  >  35978 [ACK] Seq=23103883 Ack=427109523 Win=65535 Len=0
1,4.312683000000106,10.0.2.15,62.210.85.178,TLSv1.2,2452,Application Data
1,4.312720999998419,62.210.85.178,10.0.2.15,TCP,60,9001  >  35978 [ACK] Seq=23103883 Ack=427110983 Win=65535 Len=0
1,4.31272799999897,62.210.85.178,10.0.2.15,TCP,60,9001  >  35978 [ACK] Seq=23103883 Ack=427111921 Win=65535 Len=0
1,4.38620599999922,54.93.77.70,10.0.2.15,TLSv1.2,590,Application Data
1,4.409496999998737,54.93.77.70,10.0.2.15,TLSv1.2,7294,"Application Data, Application Data"
1,4.409621999999217,10.0.2.15,54.93.77.70,TCP,54,34692  >  9001 [ACK] Seq=23202067 Ack=426748989 Win=65535 Len=0
1,4.432405999999901,54.93.77.70,10.0.2.15,TLSv1.2,4398,Application Data
1,4.4324779999988095,10.0.2.15,54.93.77.70,TCP,54,34692  >  9001 [ACK] Seq=23202067 Ack=426753333 Win=65535 Len=0
1,4.433557999998811,54.93.77.70,10.0.2.15,TLSv1.2,8742,"Application Data, Application Data"
1,4.4336309999998775,10.0.2.15,54.93.77.70,TCP,54,34692  >  9001 [ACK] Seq=23202067 Ack=426762021 Win=65535 Len=0
1,4.4338169999991806,10.0.2.15,54.93.77.70,TLSv1.2,590,Application Data
1,4.4339229999986856,54.93.77.70,10.0.2.15,TCP,60,9001  >  34692 [ACK] Seq=426762021 Ack=23202603 Win=65535 Len=0
1,4.4348359999985405,54.93.77.70,10.0.2.15,TLSv1.2,3044,Application Data
1,4.434879999998884,10.0.2.15,54.93.77.70,TCP,54,34692  >  9001 [ACK] Seq=23202603 Ack=426765011 Win=65535 Len=0
1,4.441066999999748,54.93.77.70,10.0.2.15,TCP,2950,"9001  >  34692 [PSH, ACK] Seq=426765011 Ack=23202603 Win=65535 Len=2896 [TCP segment of a reassembled PDU]"
1,4.441111999998611,10.0.2.15,54.93.77.70,TCP,54,34692  >  9001 [ACK] Seq=23202603 Ack=426767907 Win=65535 Len=0
1,4.441684999999779,54.93.77.70,10.0.2.15,TLSv1.2,2950,Application Data [TCP segment of a reassembled PDU]
1,4.4417279999997845,10.0.2.15,54.93.77.70,TCP,54,34692  >  9001 [ACK] Seq=23202603 Ack=426770803 Win=65535 Len=0
1,4.44404299999951,10.0.2.15,54.93.77.70,TLSv1.2,590,Application Data
1,4.44416899999851,54.93.77.70,10.0.2.15,TCP,60,9001  >  34692 [ACK] Seq=426770803 Ack=23203139 Win=65535 Len=0
1,4.451028999999835,54.93.77.70,10.0.2.15,TLSv1.2,7294,"Application Data, Application Data"
1,4.4510969999992085,10.0.2.15,54.93.77.70,TCP,54,34692  >  9001 [ACK] Seq=23203139 Ack=426778043 Win=65535 Len=0
1,4.451748999999836,54.93.77.70,10.0.2.15,TCP,2950,"9001  >  34692 [PSH, ACK] Seq=426778043 Ack=23203139 Win=65535 Len=2896 [TCP segment of a reassembled PDU]"
1,4.451762999999119,54.93.77.70,10.0.2.15,TLSv1.2,148,Application Data
1,4.45180099999925,10.0.2.15,54.93.77.70,TCP,54,34692  >  9001 [ACK] Seq=23203139 Ack=426780939 Win=65535 Len=0
1,4.453405999998722,54.93.77.70,10.0.2.15,TCP,1502,"9001  >  34692 [PSH, ACK] Seq=426781033 Ack=23203139 Win=65535 Len=1448 [TCP segment of a reassembled PDU]"
1,4.453449999999066,10.0.2.15,54.93.77.70,TCP,54,34692  >  9001 [ACK] Seq=23203139 Ack=426782481 Win=65535 Len=0
1,4.47038799999973,54.93.77.70,10.0.2.15,TLSv1.2,170,Application Data
1,4.476229999998395,54.93.77.70,10.0.2.15,TLSv1.2,7294,Application Data
1,4.476321999998618,10.0.2.15,54.93.77.70,TCP,54,34692  >  9001 [ACK] Seq=23203139 Ack=426789837 Win=65535 Len=0
1,4.476996999999756,54.93.77.70,10.0.2.15,TLSv1.2,4398,Application Data [TCP segment of a reassembled PDU]
1,4.477041999998619,10.0.2.15,54.93.77.70,TCP,54,34692  >  9001 [ACK] Seq=23203139 Ack=426794181 Win=65535 Len=0
1,4.4780919999993785,54.93.77.70,10.0.2.15,TLSv1.2,5846,"Application Data, Application Data, Application Data"
1,4.478154999998878,10.0.2.15,54.93.77.70,TCP,54,34692  >  9001 [ACK] Seq=23203139 Ack=426799973 Win=65535 Len=0
1,4.478329999999914,10.0.2.15,54.93.77.70,TLSv1.2,590,Application Data
1,4.478414999999586,54.93.77.70,10.0.2.15,TCP,60,9001  >  34692 [ACK] Seq=426799973 Ack=23203675 Win=65535 Len=0
1,4.487266000000091,54.93.77.70,10.0.2.15,TLSv1.2,7294,"Application Data, Application Data"
1,4.487349999999424,10.0.2.15,54.93.77.70,TCP,54,34692  >  9001 [ACK] Seq=23203675 Ack=426807213 Win=65535 Len=0
1,4.487956999999369,54.93.77.70,10.0.2.15,TLSv1.2,4398,Application Data [TCP segment of a reassembled PDU]
1,4.488020999999208,10.0.2.15,54.93.77.70,TCP,54,34692  >  9001 [ACK] Seq=23203675 Ack=426811557 Win=65535 Len=0
1,4.488205999999991,10.0.2.15,54.93.77.70,TLSv1.2,590,Application Data
1,4.488281999998435,54.93.77.70,10.0.2.15,TCP,60,9001  >  34692 [ACK] Seq=426811557 Ack=23204211 Win=65535 Len=0
1,4.492856999999276,54.93.77.70,10.0.2.15,TLSv1.2,590,Application Data
1,4.498225999999704,54.93.77.70,10.0.2.15,TCP,2950,"9001  >  34692 [PSH, ACK] Seq=426812093 Ack=23204211 Win=65535 Len=2896 [TCP segment of a reassembled PDU]"
1,4.498267999999371,10.0.2.15,54.93.77.70,TCP,54,34692  >  9001 [ACK] Seq=23204211 Ack=426814989 Win=65535 Len=0
1,4.499040999999124,54.93.77.70,10.0.2.15,TLSv1.2,4398,"Application Data, Application Data"
1,4.499081999998452,10.0.2.15,54.93.77.70,TCP,54,34692  >  9001 [ACK] Seq=23204211 Ack=426819333 Win=65535 Len=0
1,4.5018419999996695,10.0.2.15,54.93.77.70,TLSv1.2,590,Application Data
1,4.50199099999918,54.93.77.70,10.0.2.15,TCP,60,9001  >  34692 [ACK] Seq=426819333 Ack=23204747 Win=65535 Len=0
1,4.541104999998424,62.210.85.178,10.0.2.15,TLSv1.2,1104,Application Data
1,4.583741999998892,10.0.2.15,62.210.85.178,TCP,54,35978  >  9001 [ACK] Seq=427111921 Ack=23104933 Win=65535 Len=0
1,4.6008789999996225,62.210.85.178,10.0.2.15,TLSv1.2,590,Application Data
1,4.600955999998405,10.0.2.15,62.210.85.178,TCP,54,35978  >  9001 [ACK] Seq=427111921 Ack=23105469 Win=65535 Len=0
1,4.784163999998782,62.210.85.178,10.0.2.15,TLSv1.2,1104,Application Data
1,4.7842579999996815,10.0.2.15,62.210.85.178,TCP,54,35978  >  9001 [ACK] Seq=427111921 Ack=23106519 Win=65535 Len=0
1,4.784625999998752,10.0.2.15,62.210.85.178,TLSv1.2,590,Application Data
1,4.784768999999869,62.210.85.178,10.0.2.15,TCP,60,9001  >  35978 [ACK] Seq=23106519 Ack=427112457 Win=65535 Len=0
1,4.888920999999755,54.93.77.70,10.0.2.15,TLSv1.2,590,Application Data
1,4.889400000000023,10.0.2.15,54.93.77.70,TLSv1.2,590,Application Data
1,4.889546999998856,54.93.77.70,10.0.2.15,TCP,60,9001  >  34692 [ACK] Seq=426819869 Ack=23205283 Win=65535 Len=0
1,4.997219999999288,62.210.85.178,10.0.2.15,TLSv1.2,590,Application Data
1,5.00093299999935,10.0.2.15,62.210.85.178,TLSv1.2,590,Application Data
1,5.0010999999994965,62.210.85.178,10.0.2.15,TCP,60,9001  >  35978 [ACK] Seq=23107055 Ack=427112993 Win=65535 Len=0
1,5.011923000000024,10.0.2.15,62.210.85.178,TLSv1.2,4124,Application Data
1,5.0120200000001205,10.0.2.15,62.210.85.178,TCP,2974,35978  >  9001 [ACK] Seq=427117063 Ack=23107055 Win=65535 Len=2920 [TCP segment of a reassembled PDU]
1,5.012065999999322,62.210.85.178,10.0.2.15,TCP,60,9001  >  35978 [ACK] Seq=23107055 Ack=427114453 Win=65535 Len=0
1,5.012079000000085,62.210.85.178,10.0.2.15,TCP,60,9001  >  35978 [ACK] Seq=23107055 Ack=427115913 Win=65535 Len=0
1,5.01208299999962,62.210.85.178,10.0.2.15,TCP,60,9001  >  35978 [ACK] Seq=23107055 Ack=427117063 Win=65535 Len=0
1,5.012085999998817,62.210.85.178,10.0.2.15,TCP,60,9001  >  35978 [ACK] Seq=23107055 Ack=427118523 Win=65535 Len=0
1,5.012088999999833,62.210.85.178,10.0.2.15,TCP,60,9001  >  35978 [ACK] Seq=23107055 Ack=427119983 Win=65535 Len=0
1,5.012123999998948,10.0.2.15,62.210.85.178,TLSv1.2,1204,Application Data
1,5.012159999998403,62.210.85.178,10.0.2.15,TCP,60,9001  >  35978 [ACK] Seq=23107055 Ack=427121133 Win=65535 Len=0
1,5.012204999999085,10.0.2.15,62.210.85.178,TLSv1.2,4124,Application Data
1,5.01224000000002,62.210.85.178,10.0.2.15,TCP,60,9001  >  35978 [ACK] Seq=23107055 Ack=427122593 Win=65535 Len=0
1,5.01224799999909,62.210.85.178,10.0.2.15,TCP,60,9001  >  35978 [ACK] Seq=23107055 Ack=427124053 Win=65535 Len=0
1,5.012251999998625,62.210.85.178,10.0.2.15,TCP,60,9001  >  35978 [ACK] Seq=23107055 Ack=427125203 Win=65535 Len=0
1,5.012289999998757,10.0.2.15,62.210.85.178,TLSv1.2,4124,Application Data
1,5.0123249999996915,62.210.85.178,10.0.2.15,TCP,60,9001  >  35978 [ACK] Seq=23107055 Ack=427126663 Win=65535 Len=0
1,5.012331999998423,62.210.85.178,10.0.2.15,TCP,60,9001  >  35978 [ACK] Seq=23107055 Ack=427128123 Win=65535 Len=0
1,5.012369999998555,62.210.85.178,10.0.2.15,TCP,60,9001  >  35978 [ACK] Seq=23107055 Ack=427129273 Win=65535 Len=0
1,5.0124029999988124,10.0.2.15,62.210.85.178,TLSv1.2,332,Application Data
1,5.01243599999907,62.210.85.178,10.0.2.15,TCP,60,9001  >  35978 [ACK] Seq=23107055 Ack=427129551 Win=65535 Len=0
1,5.012488999998823,10.0.2.15,62.210.85.178,TLSv1.2,3868,Application Data
1,5.012525999998616,62.210.85.178,10.0.2.15,TCP,60,9001  >  35978 [ACK] Seq=23107055 Ack=427131011 Win=65535 Len=0
1,5.012531999998828,62.210.85.178,10.0.2.15,TCP,60,9001  >  35978 [ACK] Seq=23107055 Ack=427132471 Win=65535 Len=0
1,5.012534999999843,62.210.85.178,10.0.2.15,TCP,60,9001  >  35978 [ACK] Seq=23107055 Ack=427133365 Win=65535 Len=0
1,5.012570999999298,10.0.2.15,62.210.85.178,TLSv1.2,1424,Application Data
1,5.012604999999894,62.210.85.178,10.0.2.15,TCP,60,9001  >  35978 [ACK] Seq=23107055 Ack=427134735 Win=65535 Len=0
1,5.1035049999991315,54.93.77.70,10.0.2.15,TLSv1.2,2646,Application Data
1,5.103659999998854,10.0.2.15,54.93.77.70,TCP,54,34692  >  9001 [ACK] Seq=23205283 Ack=426822461 Win=65535 Len=0
1,5.110211999999592,54.93.77.70,10.0.2.15,TCP,1502,"9001  >  34692 [PSH, ACK] Seq=426822461 Ack=23205283 Win=65535 Len=1448 [TCP segment of a reassembled PDU]"
1,5.110278999998627,10.0.2.15,54.93.77.70,TCP,54,34692  >  9001 [ACK] Seq=23205283 Ack=426823909 Win=65535 Len=0
1,5.117590999998356,54.93.77.70,10.0.2.15,TLSv1.2,2950,Application Data [TCP segment of a reassembled PDU]
1,5.117675999999847,10.0.2.15,54.93.77.70,TCP,54,34692  >  9001 [ACK] Seq=23205283 Ack=426826805 Win=65535 Len=0
1,5.118806999998924,54.93.77.70,10.0.2.15,TLSv1.2,8742,"Application Data, Application Data"
1,5.118873999999778,10.0.2.15,54.93.77.70,TCP,54,34692  >  9001 [ACK] Seq=23205283 Ack=426835493 Win=65535 Len=0
1,5.120111999998699,54.93.77.70,10.0.2.15,TLSv1.2,474,Application Data
1,5.13905799999884,54.93.77.70,10.0.2.15,TLSv1.2,5846,Application Data
1,5.139104999998381,10.0.2.15,54.93.77.70,TCP,54,34692  >  9001 [ACK] Seq=23205283 Ack=426841705 Win=65535 Len=0
1,5.155674999999974,54.93.77.70,10.0.2.15,TLSv1.2,474,Application Data
1,5.158652999998594,10.0.2.15,54.93.77.70,TLSv1.2,590,Application Data
1,5.158899000000019,54.93.77.70,10.0.2.15,TCP,60,9001  >  34692 [ACK] Seq=426842125 Ack=23205819 Win=65535 Len=0
1,5.296389999999519,62.210.85.178,10.0.2.15,TLSv1.2,590,Application Data
1,5.296897999998691,10.0.2.15,62.210.85.178,TLSv1.2,590,Application Data
1,5.2970079999995505,62.210.85.178,10.0.2.15,TCP,60,9001  >  35978 [ACK] Seq=23107591 Ack=427135271 Win=65535 Len=0
1,5.40954899999997,54.93.77.70,10.0.2.15,TLSv1.2,590,Application Data
1,5.4099329999990005,10.0.2.15,54.93.77.70,TLSv1.2,590,Application Data
1,5.410037999999986,54.93.77.70,10.0.2.15,TCP,60,9001  >  34692 [ACK] Seq=426842661 Ack=23206355 Win=65535 Len=0
1,5.522019,62.210.85.178,10.0.2.15,TLSv1.2,590,Application Data
1,5.527437999999165,10.0.2.15,62.210.85.178,TLSv1.2,590,Application Data
1,5.527602000000115,62.210.85.178,10.0.2.15,TCP,60,9001  >  35978 [ACK] Seq=23108127 Ack=427135807 Win=65535 Len=0
1,5.540015999999014,10.0.2.15,62.210.85.178,TLSv1.2,4124,Application Data
1,5.540111999998771,10.0.2.15,62.210.85.178,TCP,2974,35978  >  9001 [ACK] Seq=427139877 Ack=23108127 Win=65535 Len=2920 [TCP segment of a reassembled PDU]
1,5.540152999999918,62.210.85.178,10.0.2.15,TCP,60,9001  >  35978 [ACK] Seq=23108127 Ack=427137267 Win=65535 Len=0
1,5.540164999998524,62.210.85.178,10.0.2.15,TCP,60,9001  >  35978 [ACK] Seq=23108127 Ack=427138727 Win=65535 Len=0
1,5.5401699999983975,62.210.85.178,10.0.2.15,TCP,60,9001  >  35978 [ACK] Seq=23108127 Ack=427139877 Win=65535 Len=0
1,5.540171999999075,62.210.85.178,10.0.2.15,TCP,60,9001  >  35978 [ACK] Seq=23108127 Ack=427141337 Win=65535 Len=0
1,5.54017500000009,62.210.85.178,10.0.2.15,TCP,60,9001  >  35978 [ACK] Seq=23108127 Ack=427142797 Win=65535 Len=0
1,5.540218000000095,10.0.2.15,62.210.85.178,TLSv1.2,1204,Application Data
1,5.540250999998534,62.210.85.178,10.0.2.15,TCP,60,9001  >  35978 [ACK] Seq=23108127 Ack=427143947 Win=65535 Len=0
1,5.540294999998878,10.0.2.15,62.210.85.178,TLSv1.2,4124,Application Data
1,5.540329999999813,62.210.85.178,10.0.2.15,TCP,60,9001  >  35978 [ACK] Seq=23108127 Ack=427145407 Win=65535 Len=0
1,5.540336999998544,62.210.85.178,10.0.2.15,TCP,60,9001  >  35978 [ACK] Seq=23108127 Ack=427146867 Win=65535 Len=0
1,5.5403409999998985,62.210.85.178,10.0.2.15,TCP,60,9001  >  35978 [ACK] Seq=23108127 Ack=427148017 Win=65535 Len=0
1,5.54037900000003,10.0.2.15,62.210.85.178,TLSv1.2,4124,Application Data
1,5.540411999998469,62.210.85.178,10.0.2.15,TCP,60,9001  >  35978 [ACK] Seq=23108127 Ack=427149477 Win=65535 Len=0
1,5.540419999999358,62.210.85.178,10.0.2.15,TCP,60,9001  >  35978 [ACK] Seq=23108127 Ack=427150937 Win=65535 Len=0
1,5.540458999999828,62.210.85.178,10.0.2.15,TCP,60,9001  >  35978 [ACK] Seq=23108127 Ack=427152087 Win=65535 Len=0
1,5.540492999998605,10.0.2.15,62.210.85.178,TLSv1.2,332,Application Data
1,5.540524999998524,62.210.85.178,10.0.2.15,TCP,60,9001  >  35978 [ACK] Seq=23108127 Ack=427152365 Win=65535 Len=0
1,5.540576999999757,10.0.2.15,62.210.85.178,TLSv1.2,3868,Application Data
1,5.540612999999212,62.210.85.178,10.0.2.15,TCP,60,9001  >  35978 [ACK] Seq=23108127 Ack=427153825 Win=65535 Len=0
1,5.5406199999997625,62.210.85.178,10.0.2.15,TCP,60,9001  >  35978 [ACK] Seq=23108127 Ack=427155285 Win=65535 Len=0
1,5.540622999998959,62.210.85.178,10.0.2.15,TCP,60,9001  >  35978 [ACK] Seq=23108127 Ack=427156179 Win=65535 Len=0
1,5.5406589999984135,10.0.2.15,62.210.85.178,TLSv1.2,4124,Application Data
1,5.540693999999348,62.210.85.178,10.0.2.15,TCP,60,9001  >  35978 [ACK] Seq=23108127 Ack=427157639 Win=65535 Len=0
1,5.540700999999899,62.210.85.178,10.0.2.15,TCP,60,9001  >  35978 [ACK] Seq=23108127 Ack=427159099 Win=65535 Len=0
1,5.540703999999096,62.210.85.178,10.0.2.15,TCP,60,9001  >  35978 [ACK] Seq=23108127 Ack=427160249 Win=65535 Len=0
1,5.540736999999353,10.0.2.15,62.210.85.178,TLSv1.2,3030,Application Data
1,5.540771999998469,62.210.85.178,10.0.2.15,TCP,60,9001  >  35978 [ACK] Seq=23108127 Ack=427161709 Win=65535 Len=0
1,5.5407779999986815,62.210.85.178,10.0.2.15,TCP,60,9001  >  35978 [ACK] Seq=23108127 Ack=427163169 Win=65535 Len=0
1,5.540780999999697,62.210.85.178,10.0.2.15,TCP,60,9001  >  35978 [ACK] Seq=23108127 Ack=427163225 Win=65535 Len=0
1,5.552222999998776,10.0.2.15,62.210.85.178,TLSv1.2,4124,Application Data
1,5.552332999999635,62.210.85.178,10.0.2.15,TCP,60,9001  >  35978 [ACK] Seq=23108127 Ack=427164685 Win=65535 Len=0
1,5.5523489999995945,62.210.85.178,10.0.2.15,TCP,60,9001  >  35978 [ACK] Seq=23108127 Ack=427166145 Win=65535 Len=0
1,5.552351999998791,62.210.85.178,10.0.2.15,TCP,60,9001  >  35978 [ACK] Seq=23108127 Ack=427167295 Win=65535 Len=0
1,5.552393999998458,10.0.2.15,62.210.85.178,TLSv1.2,4124,Application Data
1,5.552462999999989,62.210.85.178,10.0.2.15,TCP,60,9001  >  35978 [ACK] Seq=23108127 Ack=427168755 Win=65535 Len=0
1,5.552470999999059,62.210.85.178,10.0.2.15,TCP,60,9001  >  35978 [ACK] Seq=23108127 Ack=427170215 Win=65535 Len=0
1,5.552474000000075,62.210.85.178,10.0.2.15,TCP,60,9001  >  35978 [ACK] Seq=23108127 Ack=427171365 Win=65535 Len=0
1,5.552507999998852,10.0.2.15,62.210.85.178,TLSv1.2,4124,Application Data
1,5.552542999999787,62.210.85.178,10.0.2.15,TCP,60,9001  >  35978 [ACK] Seq=23108127 Ack=427172825 Win=65535 Len=0
1,5.552549999998519,62.210.85.178,10.0.2.15,TCP,60,9001  >  35978 [ACK] Seq=23108127 Ack=427174285 Win=65535 Len=0
1,5.552553999999873,62.210.85.178,10.0.2.15,TCP,60,9001  >  35978 [ACK] Seq=23108127 Ack=427175435 Win=65535 Len=0
1,5.552589999999327,10.0.2.15,62.210.85.178,TLSv1.2,4124,Application Data
1,5.552624999998443,62.210.85.178,10.0.2.15,TCP,60,9001  >  35978 [ACK] Seq=23108127 Ack=427176895 Win=65535 Len=0
1,5.552631999998994,62.210.85.178,10.0.2.15,TCP,60,9001  >  35978 [ACK] Seq=23108127 Ack=427178355 Win=65535 Len=0
1,5.552635000000009,62.210.85.178,10.0.2.15,TCP,60,9001  >  35978 [ACK] Seq=23108127 Ack=427179505 Win=65535 Len=0
1,5.552668999998787,10.0.2.15,62.210.85.178,TLSv1.2,332,Application Data
1,5.552802999998676,62.210.85.178,10.0.2.15,TCP,60,9001  >  35978 [ACK] Seq=23108127 Ack=427179783 Win=65535 Len=0
1,5.552886999999828,10.0.2.15,62.210.85.178,TLSv1.2,3868,Application Data
1,5.552926999998817,62.210.85.178,10.0.2.15,TCP,60,9001  >  35978 [ACK] Seq=23108127 Ack=427181243 Win=65535 Len=0
1,5.552933999999368,62.210.85.178,10.0.2.15,TCP,60,9001  >  35978 [ACK] Seq=23108127 Ack=427182703 Win=65535 Len=0
1,5.552936999998565,62.210.85.178,10.0.2.15,TCP,60,9001  >  35978 [ACK] Seq=23108127 Ack=427183597 Win=65535 Len=0
1,5.552974999998696,10.0.2.15,62.210.85.178,TLSv1.2,4124,Application Data
1,5.553008999999292,62.210.85.178,10.0.2.15,TCP,60,9001  >  35978 [ACK] Seq=23108127 Ack=427185057 Win=65535 Len=0
1,5.553016999998363,62.210.85.178,10.0.2.15,TCP,60,9001  >  35978 [ACK] Seq=23108127 Ack=427186517 Win=65535 Len=0
1,5.553022000000055,62.210.85.178,10.0.2.15,TCP,60,9001  >  35978 [ACK] Seq=23108127 Ack=427187667 Win=65535 Len=0
1,5.553056999999171,10.0.2.15,62.210.85.178,TLSv1.2,3030,Application Data
1,5.5530909999997675,62.210.85.178,10.0.2.15,TCP,60,9001  >  35978 [ACK] Seq=23108127 Ack=427189127 Win=65535 Len=0
1,5.553098999998838,62.210.85.178,10.0.2.15,TCP,60,9001  >  35978 [ACK] Seq=23108127 Ack=427190587 Win=65535 Len=0
1,5.553101999999853,62.210.85.178,10.0.2.15,TCP,60,9001  >  35978 [ACK] Seq=23108127 Ack=427190643 Win=65535 Len=0
1,5.564429000000018,10.0.2.15,62.210.85.178,TLSv1.2,4124,Application Data
1,5.564583999999741,10.0.2.15,62.210.85.178,TCP,2974,35978  >  9001 [ACK] Seq=427194713 Ack=23108127 Win=65535 Len=2920 [TCP segment of a reassembled PDU]
1,5.564661999998862,62.210.85.178,10.0.2.15,TCP,60,9001  >  35978 [ACK] Seq=23108127 Ack=427192103 Win=65535 Len=0
1,5.564671999998609,62.210.85.178,10.0.2.15,TCP,60,9001  >  35978 [ACK] Seq=23108127 Ack=427193563 Win=65535 Len=0
1,5.564676999998483,62.210.85.178,10.0.2.15,TCP,60,9001  >  35978 [ACK] Seq=23108127 Ack=427194713 Win=65535 Len=0
1,5.564681999998356,62.210.85.178,10.0.2.15,TCP,60,9001  >  35978 [ACK] Seq=23108127 Ack=427196173 Win=65535 Len=0
1,5.5646859999997105,62.210.85.178,10.0.2.15,TCP,60,9001  >  35978 [ACK] Seq=23108127 Ack=427197633 Win=65535 Len=0
1,5.564727999999377,10.0.2.15,62.210.85.178,TLSv1.2,1204,Application Data
1,5.564826999998331,62.210.85.178,10.0.2.15,TCP,60,9001  >  35978 [ACK] Seq=23108127 Ack=427198783 Win=65535 Len=0
1,5.56486699999914,10.0.2.15,62.210.85.178,TLSv1.2,204,Application Data
1,5.564953999999489,62.210.85.178,10.0.2.15,TCP,60,9001  >  35978 [ACK] Seq=23108127 Ack=427198933 Win=65535 Len=0
1,5.629745999998704,54.93.77.70,10.0.2.15,TLSv1.2,4210,"Application Data, Application Data"
1,5.629866999999649,10.0.2.15,54.93.77.70,TCP,54,34692  >  9001 [ACK] Seq=23206355 Ack=426846817 Win=65535 Len=0
1,5.650848999999653,54.93.77.70,10.0.2.15,TCP,2950,"9001  >  34692 [PSH, ACK] Seq=426846817 Ack=23206355 Win=65535 Len=2896 [TCP segment of a reassembled PDU]"
1,5.650950999999623,10.0.2.15,54.93.77.70,TCP,54,34692  >  9001 [ACK] Seq=23206355 Ack=426849713 Win=65535 Len=0
1,5.651389999999083,54.93.77.70,10.0.2.15,TLSv1.2,778,Application Data
1,5.661408999998457,54.93.77.70,10.0.2.15,TLSv1.2,5846,Application Data
1,5.661534999999276,10.0.2.15,54.93.77.70,TCP,54,34692  >  9001 [ACK] Seq=23206355 Ack=426856229 Win=65535 Len=0
1,5.661926999999196,54.93.77.70,10.0.2.15,TLSv1.2,5846,Application Data [TCP segment of a reassembled PDU]
1,5.661967999998524,10.0.2.15,54.93.77.70,TCP,54,34692  >  9001 [ACK] Seq=23206355 Ack=426862021 Win=65535 Len=0
1,5.6736499999988155,54.93.77.70,10.0.2.15,TLSv1.2,2950,"Application Data, Application Data"
1,5.6737450000000536,10.0.2.15,54.93.77.70,TCP,54,34692  >  9001 [ACK] Seq=23206355 Ack=426864917 Win=65535 Len=0
1,5.674105999998574,54.93.77.70,10.0.2.15,TCP,1502,"9001  >  34692 [PSH, ACK] Seq=426864917 Ack=23206355 Win=65535 Len=1448 [TCP segment of a reassembled PDU]"
1,5.674490999999762,10.0.2.15,54.93.77.70,TLSv1.2,590,Application Data
1,5.674741999999242,54.93.77.70,10.0.2.15,TCP,60,9001  >  34692 [ACK] Seq=426866365 Ack=23206891 Win=65535 Len=0
1,5.678171999999904,54.93.77.70,10.0.2.15,TLSv1.2,5846,"Application Data, Application Data"
1,5.678251999999702,10.0.2.15,54.93.77.70,TCP,54,34692  >  9001 [ACK] Seq=23206891 Ack=426872157 Win=65535 Len=0
1,5.67966399999932,54.93.77.70,10.0.2.15,TLSv1.2,6780,"Application Data, Application Data"
1,5.679752000000008,10.0.2.15,54.93.77.70,TCP,54,34692  >  9001 [ACK] Seq=23206891 Ack=426878883 Win=65535 Len=0
1,5.684164999998757,10.0.2.15,54.93.77.70,TLSv1.2,590,Application Data
1,5.684265999998388,54.93.77.70,10.0.2.15,TCP,60,9001  >  34692 [ACK] Seq=426878883 Ack=23207427 Win=65535 Len=0
1,5.695415000000139,54.93.77.70,10.0.2.15,TLSv1.2,590,Application Data
1,5.73010499999873,54.93.77.70,10.0.2.15,TLSv1.2,7294,Application Data
1,5.730160999999498,10.0.2.15,54.93.77.70,TCP,54,34692  >  9001 [ACK] Seq=23207427 Ack=426886659 Win=65535 Len=0
1,5.730447999998432,54.93.77.70,10.0.2.15,TLSv1.2,4398,Application Data [TCP segment of a reassembled PDU]
1,5.730486999998902,10.0.2.15,54.93.77.70,TCP,54,34692  >  9001 [ACK] Seq=23207427 Ack=426891003 Win=65535 Len=0
1,5.746527999999671,54.93.77.70,10.0.2.15,TLSv1.2,11638,"Application Data, Application Data, Application Data"
1,5.746579999999085,54.93.77.70,10.0.2.15,TLSv1.2,662,Application Data
1,5.746664999998757,10.0.2.15,54.93.77.70,TCP,54,34692  >  9001 [ACK] Seq=23207427 Ack=426903195 Win=65535 Len=0
1,5.746880999999121,10.0.2.15,54.93.77.70,TLSv1.2,590,Application Data
1,5.746938999998747,54.93.77.70,10.0.2.15,TCP,60,9001  >  34692 [ACK] Seq=426903195 Ack=23207963 Win=65535 Len=0
1,5.763613999999507,54.93.77.70,10.0.2.15,TLSv1.2,590,Application Data
1,5.766164999999091,54.93.77.70,10.0.2.15,TCP,1502,"9001  >  34692 [PSH, ACK] Seq=426903731 Ack=23207963 Win=65535 Len=1448 [TCP segment of a reassembled PDU]"
1,5.766227999998591,10.0.2.15,54.93.77.70,TCP,54,34692  >  9001 [ACK] Seq=23207963 Ack=426905179 Win=65535 Len=0
1,5.782377999999881,54.93.77.70,10.0.2.15,TLSv1.2,1198,Application Data
1,5.791727999998329,62.210.85.178,10.0.2.15,TLSv1.2,1104,Application Data
